hostb0@pci0:0:0:0:	class=0x060000 card=0x14221022 chip=0x14221022 rev=0x00 hdr=0x00
    vendor     = 'Advanced Micro Devices, Inc. [AMD]'
    device     = 'Family 15h (Models 30h-3fh) Processor Root Complex'
    class      = bridge
    subclass   = HOST-PCI

vgapci0@pci0:0:1:0:	class=0x030000 card=0x01231002 chip=0x131c1002 rev=0x00 hdr=0x00
    vendor     = 'Advanced Micro Devices, Inc. [AMD/ATI]'
    device     = 'Kaveri [Radeon R7 Graphics]'
    class      = display
    subclass   = VGA
    bar   [10] = type Prefetchable Memory, range 64, base 0xc0000000, size 268435456, enabled
    bar   [18] = type Prefetchable Memory, range 64, base 0xd0000000, size 8388608, enabled
    bar   [20] = type I/O Port, range 32, base 0xf000, size 256, enabled
    bar   [24] = type Memory, range 32, base 0xfeb00000, size 262144, enabled
    cap 09[48] = vendor (length 8)
    cap 01[50] = powerspec 3  supports D0 D1 D2 D3  current D0
    cap 10[58] = PCI-Express 2 root endpoint max data 128(256) RO NS
    cap 05[a0] = MSI supports 1 message, 64 bit 
    ecap 000b[100] = Vendor 1 ID 1
    ecap 0019[270] = PCIe Sec 1 lane errors 0
    ecap 000f[2b0] = ATS 1
    ecap 0013[2c0] = unknown 1
    ecap 001b[2d0] = unknown 1

hdac0@pci0:0:1:1:	class=0x040300 card=0x01231002 chip=0x13081002 rev=0x00 hdr=0x00
    vendor     = 'Advanced Micro Devices, Inc. [AMD/ATI]'
    device     = 'Kaveri HDMI/DP Audio Controller'
    class      = multimedia
    subclass   = HDA
    bar   [10] = type Memory, range 64, base 0xfeb64000, size 16384, enabled
    cap 09[48] = vendor (length 8)
    cap 01[50] = powerspec 3  supports D0 D1 D2 D3  current D0
    cap 10[58] = PCI-Express 2 root endpoint max data 128(256) RO NS
    cap 05[a0] = MSI supports 1 message, 64 bit enabled with 1 message
    ecap 000b[100] = Vendor 1 ID 1

hostb1@pci0:0:2:0:	class=0x060000 card=0x00000000 chip=0x14241022 rev=0x00 hdr=0x00
    vendor     = 'Advanced Micro Devices, Inc. [AMD]'
    device     = 'Family 15h (Models 30h-3fh) Processor Root Port'
    class      = bridge
    subclass   = HOST-PCI

pcib1@pci0:0:2:1:	class=0x060400 card=0x12341022 chip=0x14251022 rev=0x00 hdr=0x01
    vendor     = 'Advanced Micro Devices, Inc. [AMD]'
    class      = bridge
    subclass   = PCI-PCI
    cap 01[50] = powerspec 3  supports D0 D3  current D0
    cap 10[58] = PCI-Express 2 root port max data 256(512) RO NS
                 link x1(x16) speed 2.5(8.0) ASPM disabled(L0s/L1)
                 slot 0 power limit 0 mW
    cap 05[a0] = MSI supports 1 message, 64 bit 
    cap 0d[b0] = PCI Bridge card=0x12341022
    cap 08[b8] = HT MSI fixed address window enabled at 0xfee00000
    ecap 000b[100] = Vendor 1 ID 1
    ecap 0019[270] = PCIe Sec 1 lane errors 0x1

hostb2@pci0:0:3:0:	class=0x060000 card=0x00000000 chip=0x14241022 rev=0x00 hdr=0x00
    vendor     = 'Advanced Micro Devices, Inc. [AMD]'
    device     = 'Family 15h (Models 30h-3fh) Processor Root Port'
    class      = bridge
    subclass   = HOST-PCI

pcib2@pci0:0:3:1:	class=0x060400 card=0x12341022 chip=0x14261022 rev=0x00 hdr=0x01
    vendor     = 'Advanced Micro Devices, Inc. [AMD]'
    device     = 'Family 15h (Models 30h-3fh) Processor Root Port'
    class      = bridge
    subclass   = PCI-PCI
    cap 01[50] = powerspec 3  supports D0 D3  current D0
    cap 10[58] = PCI-Express 2 root port max data 512(512) RO NS
                 link x1(x1) speed 2.5(5.0) ASPM disabled(L0s/L1)
                 slot 0 power limit 0 mW
    cap 05[a0] = MSI supports 1 message, 64 bit 
    cap 0d[b0] = PCI Bridge card=0x12341022
    cap 08[b8] = HT MSI fixed address window enabled at 0xfee00000
    ecap 000b[100] = Vendor 1 ID 1
    ecap 0019[270] = PCIe Sec 1 lane errors 0x1

pcib3@pci0:0:3:2:	class=0x060400 card=0x12341022 chip=0x14261022 rev=0x00 hdr=0x01
    vendor     = 'Advanced Micro Devices, Inc. [AMD]'
    device     = 'Family 15h (Models 30h-3fh) Processor Root Port'
    class      = bridge
    subclass   = PCI-PCI
    cap 01[50] = powerspec 3  supports D0 D3  current D0
    cap 10[58] = PCI-Express 2 root port max data 128(512) RO NS
                 link x1(x1) speed 2.5(5.0) ASPM disabled(L0s/L1)
                 slot 0 power limit 0 mW
    cap 05[a0] = MSI supports 1 message, 64 bit 
    cap 0d[b0] = PCI Bridge card=0x12341022
    cap 08[b8] = HT MSI fixed address window enabled at 0xfee00000
    ecap 000b[100] = Vendor 1 ID 1
    ecap 0019[270] = PCIe Sec 1 lane errors 0x1

hostb3@pci0:0:4:0:	class=0x060000 card=0x00000000 chip=0x14241022 rev=0x00 hdr=0x00
    vendor     = 'Advanced Micro Devices, Inc. [AMD]'
    device     = 'Family 15h (Models 30h-3fh) Processor Root Port'
    class      = bridge
    subclass   = HOST-PCI

xhci0@pci0:0:16:0:	class=0x0c0330 card=0x78141022 chip=0x78141022 rev=0x09 hdr=0x00
    vendor     = 'Advanced Micro Devices, Inc. [AMD]'
    device     = 'FCH USB XHCI Controller'
    class      = serial bus
    subclass   = USB
    bar   [10] = type Memory, range 64, base 0xfeb6a000, size 8192, enabled
    cap 01[50] = powerspec 3  supports D0 D3  current D0
    cap 05[70] = MSI supports 8 messages, 64 bit enabled with 1 message
    cap 11[90] = MSI-X supports 8 messages
                 Table in map 0x10[0x1000], PBA in map 0x10[0x1080]
    cap 10[a0] = PCI-Express 2 root endpoint max data 128(128) NS
    ecap 0018[100] = LTR 1

xhci1@pci0:0:16:1:	class=0x0c0330 card=0x78141022 chip=0x78141022 rev=0x09 hdr=0x00
    vendor     = 'Advanced Micro Devices, Inc. [AMD]'
    device     = 'FCH USB XHCI Controller'
    class      = serial bus
    subclass   = USB
    bar   [10] = type Memory, range 64, base 0xfeb68000, size 8192, enabled
    cap 01[50] = powerspec 3  supports D0 D3  current D0
    cap 05[70] = MSI supports 8 messages, 64 bit enabled with 1 message
    cap 11[90] = MSI-X supports 8 messages
                 Table in map 0x10[0x1000], PBA in map 0x10[0x1080]
    cap 10[a0] = PCI-Express 2 root endpoint max data 128(128) NS

ahci0@pci0:0:17:0:	class=0x010601 card=0x78001022 chip=0x78011022 rev=0x40 hdr=0x00
    vendor     = 'Advanced Micro Devices, Inc. [AMD]'
    device     = 'FCH SATA Controller [AHCI mode]'
    class      = mass storage
    subclass   = SATA
    bar   [10] = type I/O Port, range 32, base 0xf190, size 8, enabled
    bar   [14] = type I/O Port, range 32, base 0xf180, size 4, enabled
    bar   [18] = type I/O Port, range 32, base 0xf170, size 8, enabled
    bar   [1c] = type I/O Port, range 32, base 0xf160, size 4, enabled
    bar   [20] = type I/O Port, range 32, base 0xf150, size 16, enabled
    bar   [24] = type Memory, range 32, base 0xfeb71000, size 2048, enabled
    cap 05[50] = MSI supports 8 messages, 64 bit enabled with 8 messages
    cap 12[70] = SATA Index-Data Pair

ohci0@pci0:0:18:0:	class=0x0c0310 card=0x78071022 chip=0x78071022 rev=0x11 hdr=0x00
    vendor     = 'Advanced Micro Devices, Inc. [AMD]'
    device     = 'FCH USB OHCI Controller'
    class      = serial bus
    subclass   = USB
    bar   [10] = type Memory, range 32, base 0xfeb70000, size 4096, enabled

ehci1@pci0:0:18:2:	class=0x0c0320 card=0x78081022 chip=0x78081022 rev=0x11 hdr=0x00
    vendor     = 'Advanced Micro Devices, Inc. [AMD]'
    device     = 'FCH USB EHCI Controller'
    class      = serial bus
    subclass   = USB
    bar   [10] = type Memory, range 32, base 0xfeb6f000, size 256, enabled
    cap 01[c0] = powerspec 2  supports D0 D1 D2 D3  current D0
    cap 0a[e4] = EHCI Debug Port at offset 0xe0 in map 0x14

ohci1@pci0:0:19:0:	class=0x0c0310 card=0x78071022 chip=0x78071022 rev=0x11 hdr=0x00
    vendor     = 'Advanced Micro Devices, Inc. [AMD]'
    device     = 'FCH USB OHCI Controller'
    class      = serial bus
    subclass   = USB
    bar   [10] = type Memory, range 32, base 0xfeb6e000, size 4096, enabled

ehci2@pci0:0:19:2:	class=0x0c0320 card=0x78081022 chip=0x78081022 rev=0x11 hdr=0x00
    vendor     = 'Advanced Micro Devices, Inc. [AMD]'
    device     = 'FCH USB EHCI Controller'
    class      = serial bus
    subclass   = USB
    bar   [10] = type Memory, range 32, base 0xfeb6d000, size 256, enabled
    cap 01[c0] = powerspec 2  supports D0 D1 D2 D3  current D0
    cap 0a[e4] = EHCI Debug Port at offset 0xe0 in map 0x14

intsmb0@pci0:0:20:0:	class=0x0c0500 card=0x780b1022 chip=0x780b1022 rev=0x16 hdr=0x00
    vendor     = 'Advanced Micro Devices, Inc. [AMD]'
    device     = 'FCH SMBus Controller'
    class      = serial bus
    subclass   = SMBus

atapci0@pci0:0:20:1:	class=0x01018a card=0x780c1022 chip=0x780c1022 rev=0x00 hdr=0x00
    vendor     = 'Advanced Micro Devices, Inc. [AMD]'
    device     = 'FCH IDE Controller'
    class      = mass storage
    subclass   = ATA
    bar   [20] = type I/O Port, range 32, base 0xf100, size 16, enabled

hdac1@pci0:0:20:2:	class=0x040300 card=0x780d1022 chip=0x780d1022 rev=0x01 hdr=0x00
    vendor     = 'Advanced Micro Devices, Inc. [AMD]'
    device     = 'FCH Azalia Controller'
    class      = multimedia
    subclass   = HDA
    bar   [10] = type Memory, range 64, base 0xfeb60000, size 16384, enabled
    cap 01[50] = powerspec 2  supports D0 D3  current D0

isab0@pci0:0:20:3:	class=0x060100 card=0x780e1022 chip=0x780e1022 rev=0x11 hdr=0x00
    vendor     = 'Advanced Micro Devices, Inc. [AMD]'
    device     = 'FCH LPC Bridge'
    class      = bridge
    subclass   = PCI-ISA

pcib4@pci0:0:20:4:	class=0x060401 card=0x00000000 chip=0x780f1022 rev=0x40 hdr=0x01
    vendor     = 'Advanced Micro Devices, Inc. [AMD]'
    device     = 'FCH PCI Bridge'
    class      = bridge
    subclass   = PCI-PCI

ohci2@pci0:0:20:5:	class=0x0c0310 card=0x78091022 chip=0x78091022 rev=0x11 hdr=0x00
    vendor     = 'Advanced Micro Devices, Inc. [AMD]'
    device     = 'FCH USB OHCI Controller'
    class      = serial bus
    subclass   = USB
    bar   [10] = type Memory, range 32, base 0xfeb6c000, size 4096, enabled

hostb4@pci0:0:24:0:	class=0x060000 card=0x00000000 chip=0x141a1022 rev=0x00 hdr=0x00
    vendor     = 'Advanced Micro Devices, Inc. [AMD]'
    device     = 'Family 15h (Models 30h-3fh) Processor Function 0'
    class      = bridge
    subclass   = HOST-PCI

hostb5@pci0:0:24:1:	class=0x060000 card=0x00000000 chip=0x141b1022 rev=0x00 hdr=0x00
    vendor     = 'Advanced Micro Devices, Inc. [AMD]'
    device     = 'Family 15h (Models 30h-3fh) Processor Function 1'
    class      = bridge
    subclass   = HOST-PCI

hostb6@pci0:0:24:2:	class=0x060000 card=0x00000000 chip=0x141c1022 rev=0x00 hdr=0x00
    vendor     = 'Advanced Micro Devices, Inc. [AMD]'
    device     = 'Family 15h (Models 30h-3fh) Processor Function 2'
    class      = bridge
    subclass   = HOST-PCI

hostb7@pci0:0:24:3:	class=0x060000 card=0x00000000 chip=0x141d1022 rev=0x00 hdr=0x00
    vendor     = 'Advanced Micro Devices, Inc. [AMD]'
    device     = 'Family 15h (Models 30h-3fh) Processor Function 3'
    class      = bridge
    subclass   = HOST-PCI
    cap 0f[f0] = unknown

hostb8@pci0:0:24:4:	class=0x060000 card=0x00000000 chip=0x141e1022 rev=0x00 hdr=0x00
    vendor     = 'Advanced Micro Devices, Inc. [AMD]'
    device     = 'Family 15h (Models 30h-3fh) Processor Function 4'
    class      = bridge
    subclass   = HOST-PCI

hostb9@pci0:0:24:5:	class=0x060000 card=0x00000000 chip=0x141f1022 rev=0x00 hdr=0x00
    vendor     = 'Advanced Micro Devices, Inc. [AMD]'
    device     = 'Family 15h (Models 30h-3fh) Processor Function 5'
    class      = bridge
    subclass   = HOST-PCI

em0@pci0:1:0:0:	class=0x020000 card=0xa01f8086 chip=0x10d38086 rev=0x00 hdr=0x00
    vendor     = 'Intel Corporation'
    device     = '82574L Gigabit Network Connection'
    class      = network
    subclass   = ethernet
    bar   [10] = type Memory, range 32, base 0xfeac0000, size 131072, enabled
    bar   [14] = type Memory, range 32, base 0xfea00000, size 524288, enabled
    bar   [18] = type I/O Port, range 32, base 0xe000, size 32, enabled
    bar   [1c] = type Memory, range 32, base 0xfeae0000, size 16384, enabled
    cap 01[c8] = powerspec 2  supports D0 D3  current D0
    cap 05[d0] = MSI supports 1 message, 64 bit 
    cap 10[e0] = PCI-Express 1 endpoint max data 256(256) RO NS
                 link x1(x1) speed 2.5(2.5) ASPM disabled(L0s/L1)
    cap 11[a0] = MSI-X supports 5 messages, enabled
                 Table in map 0x1c[0x0], PBA in map 0x1c[0x2000]
    ecap 0001[100] = AER 1 0 fatal 0 non-fatal 1 corrected
    ecap 0003[140] = Serial 1 6805caffff43c72a

igb0@pci0:2:0:0:	class=0x020000 card=0x100a15bd chip=0x15338086 rev=0x03 hdr=0x00
    vendor     = 'Intel Corporation'
    device     = 'I210 Gigabit Network Connection'
    class      = network
    subclass   = ethernet
    bar   [10] = type Memory, range 32, base 0xfe900000, size 524288, enabled
    bar   [18] = type I/O Port, range 32, base 0xd000, size 32, enabled
    bar   [1c] = type Memory, range 32, base 0xfe980000, size 16384, enabled
    cap 01[40] = powerspec 3  supports D0 D3  current D0
    cap 05[50] = MSI supports 1 message, 64 bit, vector masks 
    cap 11[70] = MSI-X supports 5 messages, enabled
                 Table in map 0x1c[0x0], PBA in map 0x1c[0x2000]
    cap 10[a0] = PCI-Express 2 endpoint max data 512(512) FLR RO NS
                 link x1(x1) speed 2.5(2.5) ASPM disabled(L0s/L1)
    ecap 0001[100] = AER 2 0 fatal 0 non-fatal 0 corrected
    ecap 0003[140] = Serial 1 000129ffff62392a
    ecap 0017[1a0] = TPH Requester 1

re0@pci0:3:0:0:	class=0x020000 card=0x100a15bd chip=0x816810ec rev=0x0e hdr=0x00
    vendor     = 'Realtek Semiconductor Co., Ltd.'
    device     = 'RTL8111/8168/8411 PCI Express Gigabit Ethernet Controller'
    class      = network
    subclass   = ethernet
    bar   [10] = type I/O Port, range 32, base 0xc300, size 256, enabled
    bar   [18] = type Memory, range 64, base 0xfe818000, size 4096, enabled
    bar   [20] = type Memory, range 64, base 0xfe810000, size 16384, enabled
    cap 01[40] = powerspec 3  supports D0 D1 D2 D3  current D0
    cap 05[50] = MSI supports 1 message, 64 bit 
    cap 10[70] = PCI-Express 2 endpoint MSI 1 max data 128(128) RO
                 link x1(x1) speed 2.5(2.5) ASPM disabled(L0s/L1)
    cap 11[b0] = MSI-X supports 4 messages, enabled
                 Table in map 0x20[0x0], PBA in map 0x20[0x800]
    cap 03[d0] = VPD
    ecap 0001[100] = AER 2 0 fatal 0 non-fatal 1 corrected
    ecap 0002[140] = VC 1 max VC0
    ecap 0003[160] = Serial 1 01000000684ce000
    ecap 0018[170] = LTR 1
    ecap 001e[178] = unknown 1

none0@pci0:3:0:1:	class=0x070002 card=0x100a15bd chip=0x816a10ec rev=0x0e hdr=0x00
    vendor     = 'Realtek Semiconductor Co., Ltd.'
    class      = simple comms
    subclass   = UART
    bar   [10] = type I/O Port, range 32, base 0xc200, size 256, enabled
    bar   [18] = type Memory, range 64, base 0xfe817000, size 4096, enabled
    bar   [20] = type Memory, range 64, base 0xfe80c000, size 16384, enabled
    cap 01[40] = powerspec 3  supports D0 D1 D2 D3  current D0
    cap 05[50] = MSI supports 1 message, 64 bit 
    cap 10[70] = PCI-Express 2 endpoint MSI 1 max data 128(128) RO
                 link x1(x1) speed 2.5(2.5) ASPM disabled(L0s/L1)
    cap 11[b0] = MSI-X supports 4 messages
                 Table in map 0x20[0x0], PBA in map 0x20[0x800]
    cap 03[d0] = VPD
    ecap 0001[100] = AER 2 0 fatal 0 non-fatal 1 corrected
    ecap 0003[160] = Serial 1 0000000000000000
    ecap 0018[170] = LTR 1
    ecap 001e[178] = unknown 1

none1@pci0:3:0:2:	class=0x070002 card=0x100a15bd chip=0x816b10ec rev=0x0e hdr=0x00
    vendor     = 'Realtek Semiconductor Co., Ltd.'
    class      = simple comms
    subclass   = UART
    bar   [10] = type I/O Port, range 32, base 0xc100, size 256, enabled
    bar   [18] = type Memory, range 64, base 0xfe816000, size 4096, enabled
    bar   [20] = type Memory, range 64, base 0xfe808000, size 16384, enabled
    cap 01[40] = powerspec 3  supports D0 D1 D2 D3  current D0
    cap 05[50] = MSI supports 1 message, 64 bit 
    cap 10[70] = PCI-Express 2 endpoint MSI 1 max data 128(128) RO
                 link x1(x1) speed 2.5(2.5) ASPM disabled(L0s/L1)
    cap 11[b0] = MSI-X supports 4 messages
                 Table in map 0x20[0x0], PBA in map 0x20[0x800]
    cap 03[d0] = VPD
    ecap 0001[100] = AER 2 0 fatal 0 non-fatal 1 corrected
    ecap 0003[160] = Serial 1 0000000000000000
    ecap 0018[170] = LTR 1
    ecap 001e[178] = unknown 1

none2@pci0:3:0:3:	class=0x0c0701 card=0x100a15bd chip=0x816c10ec rev=0x0e hdr=0x00
    vendor     = 'Realtek Semiconductor Co., Ltd.'
    class      = serial bus
    bar   [10] = type I/O Port, range 32, base 0xc000, size 256, enabled
    bar   [18] = type Memory, range 64, base 0xfe815000, size 4096, enabled
    bar   [20] = type Memory, range 64, base 0xfe804000, size 16384, enabled
    cap 01[40] = powerspec 3  supports D0 D1 D2 D3  current D0
    cap 05[50] = MSI supports 1 message, 64 bit 
    cap 10[70] = PCI-Express 2 endpoint MSI 1 max data 128(128) RO
                 link x1(x1) speed 2.5(2.5) ASPM disabled(L0s/L1)
    cap 11[b0] = MSI-X supports 4 messages
                 Table in map 0x20[0x0], PBA in map 0x20[0x800]
    cap 03[d0] = VPD
    ecap 0001[100] = AER 2 0 fatal 0 non-fatal 1 corrected
    ecap 0003[160] = Serial 1 0000000000000000
    ecap 0018[170] = LTR 1
    ecap 001e[178] = unknown 1

ehci0@pci0:3:0:4:	class=0x0c0320 card=0x100a15bd chip=0x816d10ec rev=0x0e hdr=0x00
    vendor     = 'Realtek Semiconductor Co., Ltd.'
    class      = serial bus
    subclass   = USB
    bar   [10] = type Memory, range 32, base 0xfe814000, size 4096, enabled
    bar   [18] = type Memory, range 64, base 0xfe800000, size 16384, enabled
    cap 01[40] = powerspec 3  supports D0 D3  current D0
    cap 05[50] = MSI supports 1 message, 64 bit 
    cap 10[70] = PCI-Express 2 endpoint MSI 1 max data 128(128) RO
                 link x1(x1) speed 2.5(2.5) ASPM disabled(L0s/L1)
    cap 11[b0] = MSI-X supports 4 messages
                 Table in map 0x18[0x0], PBA in map 0x18[0x800]
    cap 03[d0] = VPD
    ecap 0001[100] = AER 2 0 fatal 0 non-fatal 1 corrected
    ecap 0003[160] = Serial 1 0000000000000000
    ecap 0018[170] = LTR 1
    ecap 001e[178] = unknown 1
