hostb0@pci0:0:0:0:	class=0x060000 card=0x01588086 chip=0x01588086 rev=0x09 hdr=0x00
    vendor     = 'Intel Corporation'
    device     = 'Xeon E3-1200 v2/Ivy Bridge DRAM Controller'
    class      = bridge
    subclass   = HOST-PCI
    cap 09[e0] = vendor (length 12) Intel cap 0 version 1

pcib1@pci0:0:1:0:	class=0x060400 card=0x01518086 chip=0x01518086 rev=0x09 hdr=0x01
    vendor     = 'Intel Corporation'
    device     = 'Xeon E3-1200 v2/3rd Gen Core processor PCI Express Root Port'
    class      = bridge
    subclass   = PCI-PCI
    cap 0d[88] = PCI Bridge card=0x01518086
    cap 01[80] = powerspec 3  supports D0 D3  current D0
    cap 05[90] = MSI supports 1 message 
    cap 10[a0] = PCI-Express 2 root port max data 128(256)
                 link x8(x8) speed 5.0(8.0) ASPM disabled(L0s/L1)
                 slot 1 power limit 75000 mW
    ecap 0002[100] = VC 1 max VC0
    ecap 0005[140] = Root Complex Link Declaration 1
    ecap 0019[d94] = PCIe Sec 1 lane errors 0

pcib2@pci0:0:6:0:	class=0x060400 card=0x015d8086 chip=0x015d8086 rev=0x09 hdr=0x01
    vendor     = 'Intel Corporation'
    device     = 'Xeon E3-1200 v2/3rd Gen Core processor PCI Express Root Port'
    class      = bridge
    subclass   = PCI-PCI
    cap 0d[88] = PCI Bridge card=0x015d8086
    cap 01[80] = powerspec 3  supports D0 D3  current D0
    cap 05[90] = MSI supports 1 message 
    cap 10[a0] = PCI-Express 2 root port max data 128(128)
                 link x4(x4) speed 5.0(5.0) ASPM disabled(L0s/L1)
                 slot 4 power limit 75000 mW
    ecap 0002[100] = VC 1 max VC0
    ecap 0005[140] = Root Complex Link Declaration 1

ehci0@pci0:0:26:0:	class=0x0c0320 card=0x1c2d8086 chip=0x1c2d8086 rev=0x05 hdr=0x00
    vendor     = 'Intel Corporation'
    device     = '6 Series/C200 Series Chipset Family USB Enhanced Host Controller'
    class      = serial bus
    subclass   = USB
    bar   [10] = type Memory, range 32, base 0xf7104000, size 1024, enabled
    cap 01[50] = powerspec 2  supports D0 D3  current D0
    cap 0a[58] = EHCI Debug Port at offset 0xa0 in map 0x14
    cap 13[98] = PCI Advanced Features: FLR TP

pcib3@pci0:0:28:0:	class=0x060400 card=0x1c108086 chip=0x1c108086 rev=0xb5 hdr=0x01
    vendor     = 'Intel Corporation'
    device     = '6 Series/C200 Series Chipset Family PCI Express Root Port 1'
    class      = bridge
    subclass   = PCI-PCI
    cap 10[40] = PCI-Express 2 root port max data 128(128)
                 link x0(x1) speed 0.0(5.0) ASPM disabled(L0s/L1)
                 slot 0 power limit 100 mW
    cap 05[80] = MSI supports 1 message 
    cap 0d[90] = PCI Bridge card=0x1c108086
    cap 01[a0] = powerspec 2  supports D0 D3  current D0

pcib4@pci0:0:28:6:	class=0x060400 card=0x1c1c8086 chip=0x1c1c8086 rev=0xb5 hdr=0x01
    vendor     = 'Intel Corporation'
    device     = '6 Series/C200 Series Chipset Family PCI Express Root Port 7'
    class      = bridge
    subclass   = PCI-PCI
    cap 10[40] = PCI-Express 2 root port max data 128(128)
                 link x1(x1) speed 2.5(5.0) ASPM disabled(L0s/L1)
                 slot 6 power limit 100 mW
    cap 05[80] = MSI supports 1 message 
    cap 0d[90] = PCI Bridge card=0x1c1c8086
    cap 01[a0] = powerspec 2  supports D0 D3  current D0

ehci1@pci0:0:29:0:	class=0x0c0320 card=0x1c268086 chip=0x1c268086 rev=0x05 hdr=0x00
    vendor     = 'Intel Corporation'
    device     = '6 Series/C200 Series Chipset Family USB Enhanced Host Controller'
    class      = serial bus
    subclass   = USB
    bar   [10] = type Memory, range 32, base 0xf7103000, size 1024, enabled
    cap 01[50] = powerspec 2  supports D0 D3  current D0
    cap 0a[58] = EHCI Debug Port at offset 0xa0 in map 0x14
    cap 13[98] = PCI Advanced Features: FLR TP

pcib6@pci0:0:30:0:	class=0x060401 card=0x244e8086 chip=0x244e8086 rev=0xa5 hdr=0x01
    vendor     = 'Intel Corporation'
    device     = '82801 PCI Bridge'
    class      = bridge
    subclass   = PCI-PCI
    cap 0d[50] = PCI Bridge card=0x244e8086

isab0@pci0:0:31:0:	class=0x060100 card=0x1c548086 chip=0x1c548086 rev=0x05 hdr=0x00
    vendor     = 'Intel Corporation'
    device     = 'C204 Chipset LPC Controller'
    class      = bridge
    subclass   = PCI-ISA
    cap 09[e0] = vendor (length 12) Intel cap 1 version 0
		 features: AMT, 4 PCI-e x1 slots

ahci0@pci0:0:31:2:	class=0x010601 card=0x1c028086 chip=0x1c028086 rev=0x05 hdr=0x00
    vendor     = 'Intel Corporation'
    device     = '6 Series/C200 Series Chipset Family 6 port Desktop SATA AHCI Controller'
    class      = mass storage
    subclass   = SATA
    bar   [10] = type I/O Port, range 32, base 0xf070, size 8, enabled
    bar   [14] = type I/O Port, range 32, base 0xf060, size 4, enabled
    bar   [18] = type I/O Port, range 32, base 0xf050, size 8, enabled
    bar   [1c] = type I/O Port, range 32, base 0xf040, size 4, enabled
    bar   [20] = type I/O Port, range 32, base 0xf020, size 32, enabled
    bar   [24] = type Memory, range 32, base 0xf7102000, size 2048, enabled
    cap 05[80] = MSI supports 1 message enabled with 1 message
    cap 01[70] = powerspec 3  supports D0 D3  current D0
    cap 12[a8] = SATA Index-Data Pair
    cap 13[b0] = PCI Advanced Features: FLR TP

none0@pci0:0:31:3:	class=0x0c0500 card=0x1c228086 chip=0x1c228086 rev=0x05 hdr=0x00
    vendor     = 'Intel Corporation'
    device     = '6 Series/C200 Series Chipset Family SMBus Controller'
    class      = serial bus
    subclass   = SMBus
    bar   [10] = type Memory, range 64, base 0xf7101000, size 256, enabled
    bar   [20] = type I/O Port, range 32, base 0xf000, size 32, enabled

ql0@pci0:1:0:0:	class=0x020000 card=0x3733103c chip=0x80201077 rev=0x54 hdr=0x00
    vendor     = 'QLogic Corp.'
    device     = 'cLOM8214 1/10GbE Controller'
    class      = network
    subclass   = ethernet
    bar   [10] = type Memory, range 64, base 0xf7400000, size 2097152, enabled
    bar   [20] = type Memory, range 64, base 0xf7690000, size 65536, enabled
    cap 11[40] = MSI-X supports 32 messages, enabled
                 Table in map 0x10[0x90000], PBA in map 0x10[0x90800]
    cap 01[80] = powerspec 3  supports D0 D3  current D0
    cap 03[88] = VPD
    cap 05[a0] = MSI supports 32 messages, 64 bit 
    cap 10[c0] = PCI-Express 2 endpoint max data 128(128) FLR
                 link x8(x8) speed 5.0(5.0)
    ecap 0001[100] = AER 1 0 fatal 0 non-fatal 1 corrected
    ecap 0003[140] = Serial 1 fe73bbc0a01d48ff

ql1@pci0:1:0:1:	class=0x020000 card=0x3733103c chip=0x80201077 rev=0x54 hdr=0x00
    vendor     = 'QLogic Corp.'
    device     = 'cLOM8214 1/10GbE Controller'
    class      = network
    subclass   = ethernet
    bar   [10] = type Memory, range 64, base 0xf7200000, size 2097152, enabled
    bar   [20] = type Memory, range 64, base 0xf7680000, size 65536, enabled
    cap 11[40] = MSI-X supports 32 messages, enabled
                 Table in map 0x10[0x91000], PBA in map 0x10[0x91800]
    cap 01[80] = powerspec 3  supports D0 D3  current D0
    cap 03[88] = VPD
    cap 05[a0] = MSI supports 32 messages, 64 bit 
    cap 10[c0] = PCI-Express 2 endpoint max data 128(128) FLR
                 link x8(x8) speed 5.0(5.0)
    ecap 0001[100] = AER 1 0 fatal 0 non-fatal 1 corrected
    ecap 0003[140] = Serial 1 fe73bbc0a01d48ff

mps0@pci0:2:0:0:	class=0x010400 card=0x00721000 chip=0x00721000 rev=0x03 hdr=0x00
    vendor     = 'Broadcom / LSI'
    device     = 'SAS2008 PCI-Express Fusion-MPT SAS-2 [Falcon]'
    class      = mass storage
    subclass   = RAID
    bar   [10] = type I/O Port, range 32, base 0xe000, size 256, enabled
    bar   [14] = type Memory, range 64, base 0xf7d00000, size 16384, enabled
    bar   [1c] = type Memory, range 64, base 0xf7c80000, size 262144, enabled
    cap 01[50] = powerspec 3  supports D0 D1 D2 D3  current D0
    cap 10[68] = PCI-Express 2 endpoint max data 128(4096) FLR NS
                 link x4(x8) speed 5.0(5.0) ASPM disabled(L0s)
    cap 03[d0] = VPD
    cap 05[a8] = MSI supports 1 message, 64 bit 
    cap 11[c0] = MSI-X supports 15 messages, enabled
                 Table in map 0x14[0x2000], PBA in map 0x14[0x3800]
    ecap 0001[100] = AER 1 0 fatal 0 non-fatal 1 corrected
    ecap 0004[138] = Power Budgeting 1
    ecap 0010[150] = SR-IOV 1 IOV disabled, Memory Space disabled, ARI disabled
                     0 VFs configured out of 16 supported
                     First VF RID Offset 0x0001, VF RID Stride 0x0001
                     VF Device ID 0x0072
                     Page Sizes: 4096 (enabled), 8192, 65536, 262144, 1048576, 4194304
    ecap 000e[190] = ARI 1

pcib5@pci0:4:0:0:	class=0x060400 card=0x11501a03 chip=0x11501a03 rev=0x02 hdr=0x01
    vendor     = 'ASPEED Technology, Inc.'
    device     = 'AST1150 PCI-to-PCI Bridge'
    class      = bridge
    subclass   = PCI-PCI
    cap 05[50] = MSI supports 1 message, 64 bit 
    cap 01[78] = powerspec 3  supports D0 D1 D2 D3  current D0
    cap 10[80] = PCI-Express 1 PCI bridge max data 128(128) NS
                 link x1(x1) speed 2.5(2.5) ASPM disabled(L0s/L1)
    cap 0d[a4] = PCI Bridge card=0x11501a03
    ecap 0002[100] = VC 1 max VC0

vgapci0@pci0:5:0:0:	class=0x030000 card=0x20001a03 chip=0x20001a03 rev=0x10 hdr=0x00
    vendor     = 'ASPEED Technology, Inc.'
    device     = 'ASPEED Graphics Family'
    class      = display
    subclass   = VGA
    bar   [10] = type Memory, range 32, base 0xf6800000, size 8388608, enabled
    bar   [14] = type Memory, range 32, base 0xf7000000, size 131072, enabled
    bar   [18] = type I/O Port, range 32, base 0xd000, size 128, enabled
    cap 01[40] = powerspec 3  supports D0 D1 D2 D3  current D0
