hostb0@pci0:0:0:0:	class=0x060000 card=0x05111025 chip=0x01048086 rev=0x09 hdr=0x00
    vendor     = 'Intel Corporation'
    device     = '2nd Generation Core Processor Family DRAM Controller'
    class      = bridge
    subclass   = HOST-PCI
    cap 09[e0] = vendor (length 12) Intel cap 0 version 1

vgapci0@pci0:0:2:0:	class=0x030000 card=0x05111025 chip=0x01068086 rev=0x09 hdr=0x00
    vendor     = 'Intel Corporation'
    device     = '2nd Generation Core Processor Family Integrated Graphics Controller'
    class      = display
    subclass   = VGA
    bar   [10] = type Memory, range 64, base 0xc0000000, size 4194304, enabled
    bar   [18] = type Prefetchable Memory, range 64, base 0xb0000000, size 268435456, enabled
    bar   [20] = type I/O Port, range 32, base 0x2000, size 64, enabled
    cap 05[90] = MSI supports 1 message enabled with 1 message
    cap 01[d0] = powerspec 2  supports D0 D3  current D0
    cap 13[a4] = PCI Advanced Features: FLR TP

none0@pci0:0:22:0:	class=0x078000 card=0x05111025 chip=0x1c3a8086 rev=0x04 hdr=0x00
    vendor     = 'Intel Corporation'
    device     = '6 Series/C200 Series Chipset Family MEI Controller'
    class      = simple comms
    bar   [10] = type Memory, range 64, base 0xc0604000, size 16, enabled
    cap 01[50] = powerspec 3  supports D0 D3  current D0
    cap 05[8c] = MSI supports 1 message, 64 bit 

ehci0@pci0:0:26:0:	class=0x0c0320 card=0x05111025 chip=0x1c2d8086 rev=0x04 hdr=0x00
    vendor     = 'Intel Corporation'
    device     = '6 Series/C200 Series Chipset Family USB Enhanced Host Controller'
    class      = serial bus
    subclass   = USB
    bar   [10] = type Memory, range 32, base 0xc060a000, size 1024, enabled
    cap 01[50] = powerspec 2  supports D0 D3  current D0
    cap 0a[58] = EHCI Debug Port at offset 0xa0 in map 0x14
    cap 13[98] = PCI Advanced Features: FLR TP

hdac0@pci0:0:27:0:	class=0x040300 card=0x05111025 chip=0x1c208086 rev=0x04 hdr=0x00
    vendor     = 'Intel Corporation'
    device     = '6 Series/C200 Series Chipset Family High Definition Audio Controller'
    class      = multimedia
    subclass   = HDA
    bar   [10] = type Memory, range 64, base 0xc0600000, size 16384, enabled
    cap 01[50] = powerspec 2  supports D0 D3  current D0
    cap 05[60] = MSI supports 1 message, 64 bit enabled with 1 message
    cap 10[70] = PCI-Express 1 root endpoint max data 128(128) FLR NS
    ecap 0002[100] = VC 1 max VC1
    ecap 0005[130] = Root Complex Link Declaration 1

pcib1@pci0:0:28:0:	class=0x060400 card=0x05111025 chip=0x1c108086 rev=0xb4 hdr=0x01
    vendor     = 'Intel Corporation'
    device     = '6 Series/C200 Series Chipset Family PCI Express Root Port 1'
    class      = bridge
    subclass   = PCI-PCI
    cap 10[40] = PCI-Express 2 root port max data 128(128)
                 link x1(x1) speed 2.5(5.0) ASPM L1(L0s/L1)
                 slot 0 power limit 100 mW
    cap 05[80] = MSI supports 1 message 
    cap 0d[90] = PCI Bridge card=0x05111025
    cap 01[a0] = powerspec 2  supports D0 D3  current D0

pcib2@pci0:0:28:1:	class=0x060400 card=0x05111025 chip=0x1c128086 rev=0xb4 hdr=0x01
    vendor     = 'Intel Corporation'
    device     = '6 Series/C200 Series Chipset Family PCI Express Root Port 2'
    class      = bridge
    subclass   = PCI-PCI
    cap 10[40] = PCI-Express 2 root port max data 128(128)
                 link x1(x1) speed 2.5(5.0) ASPM L1(L0s/L1)
                 slot 1 power limit 100 mW
    cap 05[80] = MSI supports 1 message 
    cap 0d[90] = PCI Bridge card=0x05111025
    cap 01[a0] = powerspec 2  supports D0 D3  current D0

ehci1@pci0:0:29:0:	class=0x0c0320 card=0x05111025 chip=0x1c268086 rev=0x04 hdr=0x00
    vendor     = 'Intel Corporation'
    device     = '6 Series/C200 Series Chipset Family USB Enhanced Host Controller'
    class      = serial bus
    subclass   = USB
    bar   [10] = type Memory, range 32, base 0xc0609000, size 1024, enabled
    cap 01[50] = powerspec 2  supports D0 D3  current D0
    cap 0a[58] = EHCI Debug Port at offset 0xa0 in map 0x14
    cap 13[98] = PCI Advanced Features: FLR TP

isab0@pci0:0:31:0:	class=0x060100 card=0x05111025 chip=0x1c498086 rev=0x04 hdr=0x00
    vendor     = 'Intel Corporation'
    device     = 'HM65 Express Chipset LPC Controller'
    class      = bridge
    subclass   = PCI-ISA
    cap 09[e0] = vendor (length 12) Intel cap 1 version 0
		 features: AMT, 4 PCI-e x1 slots

ahci0@pci0:0:31:2:	class=0x010601 card=0x05111025 chip=0x1c038086 rev=0x04 hdr=0x00
    vendor     = 'Intel Corporation'
    device     = '6 Series/C200 Series Chipset Family 6 port Mobile SATA AHCI Controller'
    class      = mass storage
    subclass   = SATA
    bar   [10] = type I/O Port, range 32, base 0x2098, size 8, enabled
    bar   [14] = type I/O Port, range 32, base 0x20bc, size 4, enabled
    bar   [18] = type I/O Port, range 32, base 0x2090, size 8, enabled
    bar   [1c] = type I/O Port, range 32, base 0x20b8, size 4, enabled
    bar   [20] = type I/O Port, range 32, base 0x2060, size 32, enabled
    bar   [24] = type Memory, range 32, base 0xc0608000, size 2048, enabled
    cap 05[80] = MSI supports 1 message enabled with 1 message
    cap 01[70] = powerspec 3  supports D0 D3  current D0
    cap 12[a8] = SATA Index-Data Pair
    cap 13[b0] = PCI Advanced Features: FLR TP

none1@pci0:0:31:3:	class=0x0c0500 card=0x05111025 chip=0x1c228086 rev=0x04 hdr=0x00
    vendor     = 'Intel Corporation'
    device     = '6 Series/C200 Series Chipset Family SMBus Controller'
    class      = serial bus
    subclass   = SMBus
    bar   [10] = type Memory, range 64, base 0xc0606000, size 256, enabled
    bar   [20] = type I/O Port, range 32, base 0x2040, size 32, enabled

bge0@pci0:2:0:0:	class=0x020000 card=0x05041025 chip=0x16b514e4 rev=0x10 hdr=0x00
    vendor     = 'Broadcom Inc. and subsidiaries'
    device     = 'NetLink BCM57785 Gigabit Ethernet PCIe'
    class      = network
    subclass   = ethernet
    bar   [10] = type Prefetchable Memory, range 64, base 0xc0430000, size 65536, enabled
    bar   [18] = type Prefetchable Memory, range 64, base 0xc0440000, size 65536, enabled
    cap 01[48] = powerspec 3  supports D0 D3  current D0
    cap 05[58] = MSI supports 8 messages, 64 bit enabled with 1 message
    cap 11[a0] = MSI-X supports 5 messages
                 Table in map 0x18[0x0], PBA in map 0x18[0x120]
    cap 10[ac] = PCI-Express 2 endpoint max data 128(128)
                 link x1(x1) speed 2.5(2.5) ASPM L1(L0s/L1)
    ecap 0001[100] = AER 1 0 fatal 0 non-fatal 1 corrected
    ecap 0003[13c] = Serial 1 0000dc0ea1a883e4
    ecap 0004[150] = Power Budgeting 1
    ecap 0002[160] = VC 1 max VC0

sdhci_pci0@pci0:2:0:1:	class=0x080501 card=0x05041025 chip=0x16bc14e4 rev=0x10 hdr=0x00
    vendor     = 'Broadcom Inc. and subsidiaries'
    device     = 'BCM57765/57785 SDXC/MMC Card Reader'
    class      = base peripheral
    subclass   = SD host controller
    bar   [10] = type Prefetchable Memory, range 64, base 0xc0400000, size 65536, enabled
    cap 01[48] = powerspec 3  supports D0 D3  current D0
    cap 05[58] = MSI supports 1 message, 64 bit enabled with 1 message
    cap 10[ac] = PCI-Express 2 endpoint max data 128(128) RO NS
                 link x1(x1) speed 2.5(2.5) ASPM L1(L0s/L1)
    ecap 0001[100] = AER 1 0 fatal 0 non-fatal 1 corrected
    ecap 0004[150] = Power Budgeting 1
    ecap 0002[160] = VC 1 max VC0

none2@pci0:2:0:2:	class=0x088000 card=0x05041025 chip=0x16be14e4 rev=0x10 hdr=0x00
    vendor     = 'Broadcom Inc. and subsidiaries'
    device     = 'BCM57765/57785 MS Card Reader'
    class      = base peripheral
    bar   [10] = type Prefetchable Memory, range 64, base 0xc0410000, size 65536, enabled
    cap 01[48] = powerspec 3  supports D0 D3  current D0
    cap 05[58] = MSI supports 1 message, 64 bit 
    cap 10[ac] = PCI-Express 2 endpoint max data 128(128) RO NS
                 link x1(x1) speed 2.5(2.5) ASPM L1(L0s/L1)
    ecap 0001[100] = AER 1 0 fatal 0 non-fatal 1 corrected
    ecap 0004[150] = Power Budgeting 1
    ecap 0002[160] = VC 1 max VC0

none3@pci0:2:0:3:	class=0x088000 card=0x05041025 chip=0x16bf14e4 rev=0x10 hdr=0x00
    vendor     = 'Broadcom Inc. and subsidiaries'
    device     = 'BCM57765/57785 xD-Picture Card Reader'
    class      = base peripheral
    bar   [10] = type Prefetchable Memory, range 64, base 0xc0420000, size 65536, enabled
    cap 01[48] = powerspec 3  supports D0 D3  current D0
    cap 05[58] = MSI supports 1 message, 64 bit 
    cap 10[ac] = PCI-Express 2 endpoint max data 128(128) RO NS
                 link x1(x1) speed 2.5(2.5) ASPM L1(L0s/L1)
    ecap 0001[100] = AER 1 0 fatal 0 non-fatal 1 corrected
    ecap 0004[150] = Power Budgeting 1
    ecap 0002[160] = VC 1 max VC0

ath0@pci0:3:0:0:	class=0x028000 card=0x660311ad chip=0x002e168c rev=0x01 hdr=0x00
    vendor     = 'Qualcomm Atheros'
    device     = 'AR9287 Wireless Network Adapter (PCI-Express)'
    class      = network
    bar   [10] = type Memory, range 64, base 0xc0500000, size 65536, enabled
    cap 01[40] = powerspec 3  supports D0 D1 D3  current D0
    cap 05[50] = MSI supports 1 message 
    cap 10[60] = PCI-Express 2 legacy endpoint max data 128(128) RO
                 link x1(x1) speed 2.5(2.5) ASPM L1(L0s/L1)
    ecap 0001[100] = AER 1 0 fatal 0 non-fatal 1 corrected
    ecap 0002[140] = VC 1 max VC0
    ecap 0003[160] = Serial 1 001517ffff241412
    ecap 0004[170] = Power Budgeting 1
