hostb0@pci0:0:0:0:	class=0x060000 rev=0x00 hdr=0x00 vendor=0x8086 device=0xa010 subvendor=0x17aa subdevice=0x21a6
    vendor     = 'Intel Corporation'
    device     = 'Atom Processor D4xx/D5xx/N4xx/N5xx DMI Bridge'
    class      = bridge
    subclass   = HOST-PCI
    cap 09[e0] = vendor (length 8) Intel cap 5 version 1

vgapci0@pci0:0:2:0:	class=0x030000 rev=0x00 hdr=0x00 vendor=0x8086 device=0xa011 subvendor=0x17aa subdevice=0x21a7
    vendor     = 'Intel Corporation'
    device     = 'Atom Processor D4xx/D5xx/N4xx/N5xx Integrated Graphics Controller'
    class      = display
    subclass   = VGA
    bar   [10] = type Memory, range 32, base 0xf0200000, size 524288, enabled
    bar   [14] = type I/O Port, range 32, base 0x18e8, size 8, enabled
    bar   [18] = type Prefetchable Memory, range 32, base 0xd0000000, size 268435456, enabled
    bar   [1c] = type Memory, range 32, base 0xf0000000, size 1048576, enabled
    cap 05[90] = MSI supports 1 message 
    cap 01[d0] = powerspec 2  supports D0 D3  current D0

vgapci1@pci0:0:2:1:	class=0x038000 rev=0x00 hdr=0x00 vendor=0x8086 device=0xa012 subvendor=0x17aa subdevice=0x21a7
    vendor     = 'Intel Corporation'
    device     = 'Atom Processor D4xx/D5xx/N4xx/N5xx Integrated Graphics Controller'
    class      = display
    bar   [10] = type Memory, range 32, base 0xf0280000, size 524288, enabled
    cap 01[d0] = powerspec 2  supports D0 D3  current D0

hdac0@pci0:0:27:0:	class=0x040300 rev=0x02 hdr=0x00 vendor=0x8086 device=0x27d8 subvendor=0x17aa subdevice=0x21a8
    vendor     = 'Intel Corporation'
    device     = 'NM10/ICH7 Family High Definition Audio Controller'
    class      = multimedia
    subclass   = HDA
    bar   [10] = type Memory, range 64, base 0xf0500000, size 16384, enabled
    cap 01[50] = powerspec 2  supports D0 D3  current D0
    cap 05[60] = MSI supports 1 message, 64 bit enabled with 1 message
    cap 10[70] = PCI-Express 1 root endpoint max data 128(128) NS
                 max read 128
    ecap 0002[100] = VC 1 max VC1
    ecap 0005[130] = Root Complex Link Declaration 1

pcib1@pci0:0:28:0:	class=0x060400 rev=0x02 hdr=0x01 vendor=0x8086 device=0x27d0 subvendor=0x17aa subdevice=0x27d0
    vendor     = 'Intel Corporation'
    device     = 'NM10/ICH7 Family PCI Express Port 1'
    class      = bridge
    subclass   = PCI-PCI
    cap 10[40] = PCI-Express 1 root port max data 128(128)
                 max read 128
                 link x0(x1) speed 0.0(2.5) ASPM disabled(L0s/L1)
                 slot 0 power limit 0 mW HotPlug(empty) surprise
    cap 05[80] = MSI supports 1 message 
    cap 0d[90] = PCI Bridge subvendor=0x17aa subdevice=0x27d0
    cap 01[a0] = powerspec 2  supports D0 D3  current D0
    ecap 0002[100] = VC 1 max VC1
    ecap 0005[180] = Root Complex Link Declaration 1

pcib2@pci0:0:28:1:	class=0x060400 rev=0x02 hdr=0x01 vendor=0x8086 device=0x27d2 subvendor=0x17aa subdevice=0x27d2
    vendor     = 'Intel Corporation'
    device     = 'NM10/ICH7 Family PCI Express Port 2'
    class      = bridge
    subclass   = PCI-PCI
    cap 10[40] = PCI-Express 1 root port max data 128(128)
                 max read 128
                 link x1(x1) speed 2.5(2.5) ASPM L1(L0s/L1)
                 slot 2 power limit 10000 mW HotPlug(present) surprise
    cap 05[80] = MSI supports 1 message 
    cap 0d[90] = PCI Bridge subvendor=0x17aa subdevice=0x27d2
    cap 01[a0] = powerspec 2  supports D0 D3  current D0
    ecap 0002[100] = VC 1 max VC1
    ecap 0005[180] = Root Complex Link Declaration 1

pcib3@pci0:0:28:2:	class=0x060400 rev=0x02 hdr=0x01 vendor=0x8086 device=0x27d4 subvendor=0x17aa subdevice=0x27d4
    vendor     = 'Intel Corporation'
    device     = 'NM10/ICH7 Family PCI Express Port 3'
    class      = bridge
    subclass   = PCI-PCI
    cap 10[40] = PCI-Express 1 root port max data 128(128)
                 max read 128
                 link x0(x1) speed 0.0(2.5) ASPM disabled(L0s/L1)
                 slot 0 power limit 0 mW HotPlug(empty) surprise
    cap 05[80] = MSI supports 1 message 
    cap 0d[90] = PCI Bridge subvendor=0x17aa subdevice=0x27d4
    cap 01[a0] = powerspec 2  supports D0 D3  current D0
    ecap 0002[100] = VC 1 max VC1
    ecap 0005[180] = Root Complex Link Declaration 1

pcib4@pci0:0:28:3:	class=0x060400 rev=0x02 hdr=0x01 vendor=0x8086 device=0x27d6 subvendor=0x17aa subdevice=0x27d6
    vendor     = 'Intel Corporation'
    device     = 'NM10/ICH7 Family PCI Express Port 4'
    class      = bridge
    subclass   = PCI-PCI
    cap 10[40] = PCI-Express 1 root port max data 128(128)
                 max read 128
                 link x1(x1) speed 2.5(2.5) ASPM L0s/L1(L0s/L1)
                 slot 4 power limit 10000 mW HotPlug(present) surprise
    cap 05[80] = MSI supports 1 message 
    cap 0d[90] = PCI Bridge subvendor=0x17aa subdevice=0x27d6
    cap 01[a0] = powerspec 2  supports D0 D3  current D0
    ecap 0002[100] = VC 1 max VC1
    ecap 0005[180] = Root Complex Link Declaration 1

uhci0@pci0:0:29:0:	class=0x0c0300 rev=0x02 hdr=0x00 vendor=0x8086 device=0x27c8 subvendor=0x17aa subdevice=0x21a9
    vendor     = 'Intel Corporation'
    device     = 'NM10/ICH7 Family USB UHCI Controller'
    class      = serial bus
    subclass   = USB
    bar   [20] = type I/O Port, range 32, base 0x1820, size 32, enabled

uhci1@pci0:0:29:1:	class=0x0c0300 rev=0x02 hdr=0x00 vendor=0x8086 device=0x27c9 subvendor=0x17aa subdevice=0x21aa
    vendor     = 'Intel Corporation'
    device     = 'NM10/ICH7 Family USB UHCI Controller'
    class      = serial bus
    subclass   = USB
    bar   [20] = type I/O Port, range 32, base 0x1840, size 32, enabled

uhci2@pci0:0:29:2:	class=0x0c0300 rev=0x02 hdr=0x00 vendor=0x8086 device=0x27ca subvendor=0x17aa subdevice=0x21ab
    vendor     = 'Intel Corporation'
    device     = 'NM10/ICH7 Family USB UHCI Controller'
    class      = serial bus
    subclass   = USB
    bar   [20] = type I/O Port, range 32, base 0x1860, size 32, enabled

uhci3@pci0:0:29:3:	class=0x0c0300 rev=0x02 hdr=0x00 vendor=0x8086 device=0x27cb subvendor=0x17aa subdevice=0x21ac
    vendor     = 'Intel Corporation'
    device     = 'NM10/ICH7 Family USB UHCI Controller'
    class      = serial bus
    subclass   = USB
    bar   [20] = type I/O Port, range 32, base 0x1880, size 32, enabled

ehci0@pci0:0:29:7:	class=0x0c0320 rev=0x02 hdr=0x00 vendor=0x8086 device=0x27cc subvendor=0x17aa subdevice=0x21ad
    vendor     = 'Intel Corporation'
    device     = 'NM10/ICH7 Family USB2 EHCI Controller'
    class      = serial bus
    subclass   = USB
    bar   [10] = type Memory, range 32, base 0xf0504000, size 1024, enabled
    cap 01[50] = powerspec 2  supports D0 D3  current D0
    cap 0a[58] = EHCI Debug Port at offset 0xa0 in map 0x14

pcib5@pci0:0:30:0:	class=0x060401 rev=0xe2 hdr=0x01 vendor=0x8086 device=0x2448 subvendor=0x17aa subdevice=0x244e
    vendor     = 'Intel Corporation'
    device     = '82801 Mobile PCI Bridge'
    class      = bridge
    subclass   = PCI-PCI
    cap 0d[50] = PCI Bridge subvendor=0x17aa subdevice=0x244e

isab0@pci0:0:31:0:	class=0x060100 rev=0x02 hdr=0x00 vendor=0x8086 device=0x27bc subvendor=0x17aa subdevice=0x27b0
    vendor     = 'Intel Corporation'
    device     = 'NM10 Family LPC Controller'
    class      = bridge
    subclass   = PCI-ISA
    cap 09[e0] = vendor (length 12) Intel cap 1 version 0
		 features: Quick Resume, SATA RAID-5, Mobile, 6 PCI-e x1 slots, SATA RAID-0/1/10

ahci0@pci0:0:31:2:	class=0x010601 rev=0x02 hdr=0x00 vendor=0x8086 device=0x27c1 subvendor=0x17aa subdevice=0x21ae
    vendor     = 'Intel Corporation'
    device     = 'NM10/ICH7 Family SATA Controller [AHCI mode]'
    class      = mass storage
    subclass   = SATA
    bar   [10] = type I/O Port, range 32, base 0x18e0, size 8, enabled
    bar   [14] = type I/O Port, range 32, base 0x18d4, size 4, enabled
    bar   [18] = type I/O Port, range 32, base 0x18d8, size 8, enabled
    bar   [1c] = type I/O Port, range 32, base 0x18d0, size 4, enabled
    bar   [20] = type I/O Port, range 32, base 0x18c0, size 16, enabled
    bar   [24] = type Memory, range 32, base 0xf0504400, size 1024, enabled
    cap 05[80] = MSI supports 1 message enabled with 1 message
    cap 01[70] = powerspec 2  supports D0 D3  current D0

ichsmb0@pci0:0:31:3:	class=0x0c0500 rev=0x02 hdr=0x00 vendor=0x8086 device=0x27da subvendor=0x17aa subdevice=0x21b0
    vendor     = 'Intel Corporation'
    device     = 'NM10/ICH7 Family SMBus Controller'
    class      = serial bus
    subclass   = SMBus
    bar   [20] = type I/O Port, range 32, base 0x18a0, size 32, enabled

iwn0@pci0:7:0:0:	class=0x028000 rev=0x00 hdr=0x00 vendor=0x8086 device=0x4237 subvendor=0x8086 subdevice=0x1311
    vendor     = 'Intel Corporation'
    device     = 'PRO/Wireless 5100 AGN [Shiloh] Network Connection'
    class      = network
    bar   [10] = type Memory, range 64, base 0xf0100000, size 8192, enabled
    cap 01[c8] = powerspec 3  supports D0 D3  current D0
    cap 05[d0] = MSI supports 1 message, 64 bit enabled with 1 message
    cap 10[e0] = PCI-Express 1 endpoint max data 128(128) FLR RO NS
                 max read 128
                 link x1(x1) speed 2.5(2.5) ASPM L1(L0s/L1) ClockPM disabled
    ecap 0001[100] = AER 1 0 fatal 0 non-fatal 1 corrected
    ecap 0003[140] = Serial 1 0024d6ffffad2d4c

re0@pci0:11:0:0:	class=0x020000 rev=0x03 hdr=0x00 vendor=0x10ec device=0x8168 subvendor=0x17aa subdevice=0x2131
    vendor     = 'Realtek Semiconductor Co., Ltd.'
    device     = 'RTL8111/8168/8411 PCI Express Gigabit Ethernet Controller'
    class      = network
    subclass   = ethernet
    bar   [10] = type I/O Port, range 32, base 0x2000, size 256, enabled
    bar   [18] = type Prefetchable Memory, range 64, base 0x80100000, size 4096, enabled
    bar   [20] = type Prefetchable Memory, range 64, base 0x80104000, size 16384, enabled
    cap 01[40] = powerspec 3  supports D0 D1 D2 D3  current D0
    cap 05[50] = MSI supports 1 message, 64 bit 
    cap 10[70] = PCI-Express 2 endpoint MSI 1 max data 128(256) RO
                 max read 512
                 link x1(x1) speed 2.5(2.5) ASPM disabled(L0s/L1) ClockPM disabled
    cap 11[ac] = MSI-X supports 4 messages, enabled
                 Table in map 0x20[0x0], PBA in map 0x20[0x800]
    cap 03[cc] = VPD
    ecap 0001[100] = AER 1 0 fatal 1 non-fatal 2 corrected
    ecap 0002[140] = VC 1 max VC0
    ecap 0003[160] = Serial 1 5e000000684ce000
