hostb0@pci0:0:0:0:	class=0x060000 rev=0x00 hdr=0x00 vendor=0x1022 device=0x15d0 subvendor=0x103c subdevice=0x8522
    vendor     = 'Advanced Micro Devices, Inc. [AMD]'
    device     = 'Raven/Raven2 Root Complex'
    class      = bridge
    subclass   = HOST-PCI

none0@pci0:0:0:2:	class=0x080600 rev=0x00 hdr=0x00 vendor=0x1022 device=0x15d1 subvendor=0x103c subdevice=0x8522
    vendor     = 'Advanced Micro Devices, Inc. [AMD]'
    device     = 'Raven/Raven2 IOMMU'
    class      = base peripheral
    subclass   = IOMMU
    cap 0f[40] = unknown
    cap 05[64] = MSI supports 4 messages, 64 bit 
    cap 08[74] = HT MSI fixed address window enabled at 0xfee00000

hostb1@pci0:0:1:0:	class=0x060000 rev=0x00 hdr=0x00 vendor=0x1022 device=0x1452 subvendor=0x0000 subdevice=0x0000
    vendor     = 'Advanced Micro Devices, Inc. [AMD]'
    device     = 'Family 17h (Models 00h-1fh) PCIe Dummy Host Bridge'
    class      = bridge
    subclass   = HOST-PCI

pcib1@pci0:0:1:1:	class=0x060400 rev=0x00 hdr=0x01 vendor=0x1022 device=0x15d3 subvendor=0x103c subdevice=0x8522
    vendor     = 'Advanced Micro Devices, Inc. [AMD]'
    device     = 'Raven/Raven2 PCIe GPP Bridge [6:0]'
    class      = bridge
    subclass   = PCI-PCI
    cap 01[50] = powerspec 3  supports D0 D3  current D0
    cap 10[58] = PCI-Express 2 root port max data 512(512) NS ARI enabled
                 max read 128
                 link x8(x8) speed 5.0(8.0) ASPM disabled(L1)
                 slot 0 power limit 0 mW
    cap 05[a0] = MSI supports 1 message, 64 bit 
    cap 0d[c0] = PCI Bridge subvendor=0x103c subdevice=0x8522
    cap 08[c8] = HT MSI fixed address window enabled at 0xfee00000
    ecap 000b[100] = Vendor [1] ID 0001 Rev 1 Length 16
    ecap 0001[150] = AER 2 0 fatal 0 non-fatal 0 corrected
    ecap 0019[270] = PCIe Sec 1 lane errors 0xff
    ecap 000d[2a0] = ACS 1
    ecap 001e[370] = L1 PM Substates 1

pcib2@pci0:0:1:2:	class=0x060400 rev=0x00 hdr=0x01 vendor=0x1022 device=0x15d3 subvendor=0x103c subdevice=0x8522
    vendor     = 'Advanced Micro Devices, Inc. [AMD]'
    device     = 'Raven/Raven2 PCIe GPP Bridge [6:0]'
    class      = bridge
    subclass   = PCI-PCI
    cap 01[50] = powerspec 3  supports D0 D3  current D0
    cap 10[58] = PCI-Express 2 root port max data 128(512) NS ARI disabled
                 max read 128
                 link x1(x1) speed 2.5(8.0) ASPM disabled(L1)
                 slot 0 power limit 0 mW
    cap 05[a0] = MSI supports 1 message, 64 bit 
    cap 0d[c0] = PCI Bridge subvendor=0x103c subdevice=0x8522
    cap 08[c8] = HT MSI fixed address window enabled at 0xfee00000
    ecap 000b[100] = Vendor [1] ID 0001 Rev 1 Length 16
    ecap 0001[150] = AER 2 0 fatal 0 non-fatal 0 corrected
    ecap 0019[270] = PCIe Sec 1 lane errors 0x1
    ecap 000d[2a0] = ACS 1
    ecap 001e[370] = L1 PM Substates 1

hostb2@pci0:0:8:0:	class=0x060000 rev=0x00 hdr=0x00 vendor=0x1022 device=0x1452 subvendor=0x0000 subdevice=0x0000
    vendor     = 'Advanced Micro Devices, Inc. [AMD]'
    device     = 'Family 17h (Models 00h-1fh) PCIe Dummy Host Bridge'
    class      = bridge
    subclass   = HOST-PCI

pcib3@pci0:0:8:1:	class=0x060400 rev=0x00 hdr=0x01 vendor=0x1022 device=0x15db subvendor=0x1022 subdevice=0x0000
    vendor     = 'Advanced Micro Devices, Inc. [AMD]'
    device     = 'Raven/Raven2 Internal PCIe GPP Bridge 0 to Bus A'
    class      = bridge
    subclass   = PCI-PCI
    cap 01[50] = powerspec 3  supports D0 D3  current D0
    cap 10[58] = PCI-Express 2 root port max data 256(512) NS
                 max read 512
                 link x16(x16) speed 8.0(8.0) ASPM disabled(L0s/L1)
    cap 05[a0] = MSI supports 1 message, 64 bit 
    cap 0d[c0] = PCI Bridge subvendor=0x1022 subdevice=0x0000
    ecap 000b[100] = Vendor [1] ID 0001 Rev 1 Length 16
    ecap 0019[270] = PCIe Sec 1 lane errors 0
    ecap 000d[2a0] = ACS 1

pcib4@pci0:0:8:2:	class=0x060400 rev=0x00 hdr=0x01 vendor=0x1022 device=0x15dc subvendor=0x1022 subdevice=0x0000
    vendor     = 'Advanced Micro Devices, Inc. [AMD]'
    device     = 'Raven/Raven2 Internal PCIe GPP Bridge 0 to Bus B'
    class      = bridge
    subclass   = PCI-PCI
    cap 01[50] = powerspec 3  supports D0 D3  current D0
    cap 10[58] = PCI-Express 2 root port max data 256(512) NS
                 max read 512
                 link x16(x16) speed 8.0(8.0) ASPM disabled(L0s/L1)
    cap 05[a0] = MSI supports 1 message, 64 bit 
    cap 0d[c0] = PCI Bridge subvendor=0x1022 subdevice=0x0000
    ecap 000b[100] = Vendor [1] ID 0001 Rev 1 Length 16
    ecap 0019[270] = PCIe Sec 1 lane errors 0

intsmb0@pci0:0:20:0:	class=0x0c0500 rev=0x61 hdr=0x00 vendor=0x1022 device=0x790b subvendor=0x103c subdevice=0x8522
    vendor     = 'Advanced Micro Devices, Inc. [AMD]'
    device     = 'FCH SMBus Controller'
    class      = serial bus
    subclass   = SMBus

isab0@pci0:0:20:3:	class=0x060100 rev=0x51 hdr=0x00 vendor=0x1022 device=0x790e subvendor=0x103c subdevice=0x8522
    vendor     = 'Advanced Micro Devices, Inc. [AMD]'
    device     = 'FCH LPC Bridge'
    class      = bridge
    subclass   = PCI-ISA

hostb3@pci0:0:24:0:	class=0x060000 rev=0x00 hdr=0x00 vendor=0x1022 device=0x15e8 subvendor=0x0000 subdevice=0x0000
    vendor     = 'Advanced Micro Devices, Inc. [AMD]'
    device     = 'Raven/Raven2 Device 24: Function 0'
    class      = bridge
    subclass   = HOST-PCI

hostb4@pci0:0:24:1:	class=0x060000 rev=0x00 hdr=0x00 vendor=0x1022 device=0x15e9 subvendor=0x0000 subdevice=0x0000
    vendor     = 'Advanced Micro Devices, Inc. [AMD]'
    device     = 'Raven/Raven2 Device 24: Function 1'
    class      = bridge
    subclass   = HOST-PCI

hostb5@pci0:0:24:2:	class=0x060000 rev=0x00 hdr=0x00 vendor=0x1022 device=0x15ea subvendor=0x0000 subdevice=0x0000
    vendor     = 'Advanced Micro Devices, Inc. [AMD]'
    device     = 'Raven/Raven2 Device 24: Function 2'
    class      = bridge
    subclass   = HOST-PCI

hostb6@pci0:0:24:3:	class=0x060000 rev=0x00 hdr=0x00 vendor=0x1022 device=0x15eb subvendor=0x0000 subdevice=0x0000
    vendor     = 'Advanced Micro Devices, Inc. [AMD]'
    device     = 'Raven/Raven2 Device 24: Function 3'
    class      = bridge
    subclass   = HOST-PCI

hostb7@pci0:0:24:4:	class=0x060000 rev=0x00 hdr=0x00 vendor=0x1022 device=0x15ec subvendor=0x0000 subdevice=0x0000
    vendor     = 'Advanced Micro Devices, Inc. [AMD]'
    device     = 'Raven/Raven2 Device 24: Function 4'
    class      = bridge
    subclass   = HOST-PCI

hostb8@pci0:0:24:5:	class=0x060000 rev=0x00 hdr=0x00 vendor=0x1022 device=0x15ed subvendor=0x0000 subdevice=0x0000
    vendor     = 'Advanced Micro Devices, Inc. [AMD]'
    device     = 'Raven/Raven2 Device 24: Function 5'
    class      = bridge
    subclass   = HOST-PCI

hostb9@pci0:0:24:6:	class=0x060000 rev=0x00 hdr=0x00 vendor=0x1022 device=0x15ee subvendor=0x0000 subdevice=0x0000
    vendor     = 'Advanced Micro Devices, Inc. [AMD]'
    device     = 'Raven/Raven2 Device 24: Function 6'
    class      = bridge
    subclass   = HOST-PCI

hostb10@pci0:0:24:7:	class=0x060000 rev=0x00 hdr=0x00 vendor=0x1022 device=0x15ef subvendor=0x0000 subdevice=0x0000
    vendor     = 'Advanced Micro Devices, Inc. [AMD]'
    device     = 'Raven/Raven2 Device 24: Function 7'
    class      = bridge
    subclass   = HOST-PCI

t4iov0@pci0:1:0:0:	class=0x020000 rev=0x00 hdr=0x00 vendor=0x1425 device=0x4002 subvendor=0x1014 subdevice=0x03e5
    vendor     = 'Chelsio Communications Inc'
    device     = 'T422-CR Unified Wire Ethernet Controller'
    class      = network
    subclass   = ethernet
    bar   [10] = type Memory, range 64, base 0xf7280000, size 262144, enabled
    bar   [20] = type Memory, range 64, base 0xf72cc000, size 8192, enabled
    cap 01[40] = powerspec 3  supports D0 D3  current D0
    cap 05[48] = MSI supports 8 messages, 64 bit, vector masks 
    cap 11[60] = MSI-X supports 8 messages
                 Table in map 0x20[0x0], PBA in map 0x20[0x1000]
    cap 10[6c] = PCI-Express 2 endpoint max data 512(2048) FLR NS
                 max read 512
                 link x8(x8) speed 5.0(5.0) ASPM disabled(L0s/L1)
    cap 03[a8] = VPD
    ecap 0001[100] = AER 1 0 fatal 0 non-fatal 0 corrected
    ecap 0008[138] = MFVC 1
    ecap 0003[1b8] = Serial 1 0000000000000000
    ecap 0010[1c4] = SR-IOV 1 IOV disabled, Memory Space disabled, ARI disabled
                     0 VFs configured out of 16 supported
                     First VF RID Offset 0x0008, VF RID Stride 0x0004
                     VF Device ID 0x4802
                     Page Sizes: 4096 (enabled)
    ecap 000e[204] = ARI 1

t4iov1@pci0:1:0:1:	class=0x020000 rev=0x00 hdr=0x00 vendor=0x1425 device=0x4002 subvendor=0x1014 subdevice=0x03e5
    vendor     = 'Chelsio Communications Inc'
    device     = 'T422-CR Unified Wire Ethernet Controller'
    class      = network
    subclass   = ethernet
    bar   [10] = type Memory, range 64, base 0xf7200000, size 262144, enabled
    bar   [20] = type Memory, range 64, base 0xf72ca000, size 8192, enabled
    cap 01[40] = powerspec 3  supports D0 D3  current D0
    cap 05[48] = MSI supports 8 messages, 64 bit, vector masks 
    cap 11[60] = MSI-X supports 8 messages
                 Table in map 0x20[0x0], PBA in map 0x20[0x1000]
    cap 10[6c] = PCI-Express 2 endpoint max data 512(2048) FLR NS
                 max read 512
                 link x8(x8) speed 5.0(5.0) ASPM disabled(L0s/L1)
    cap 03[a8] = VPD
    ecap 0001[100] = AER 1 0 fatal 0 non-fatal 0 corrected
    ecap 0003[138] = Serial 1 0000000000000000
    ecap 0010[144] = SR-IOV 1 IOV disabled, Memory Space disabled, ARI disabled
                     0 VFs configured out of 16 supported
                     First VF RID Offset 0x0008, VF RID Stride 0x0004
                     VF Device ID 0x4802
                     Page Sizes: 4096 (enabled)
    ecap 000e[184] = ARI 1

none1@pci0:1:0:2:	class=0x020000 rev=0x00 hdr=0x00 vendor=0x1425 device=0x4102 subvendor=0x1014 subdevice=0x03e5
    vendor     = 'Chelsio Communications Inc'
    class      = network
    subclass   = ethernet
    bar   [10] = type Memory, range 64, base 0xf7180000, size 262144, enabled
    bar   [20] = type Memory, range 64, base 0xf72c8000, size 8192, enabled
    cap 01[40] = powerspec 3  supports D0 D3  current D0
    cap 05[48] = MSI supports 8 messages, 64 bit, vector masks 
    cap 11[60] = MSI-X supports 8 messages
                 Table in map 0x20[0x0], PBA in map 0x20[0x1000]
    cap 10[6c] = PCI-Express 2 endpoint max data 512(2048) FLR NS
                 max read 512
                 link x8(x8) speed 5.0(5.0) ASPM disabled(L0s/L1)
    cap 03[a8] = VPD
    ecap 0001[100] = AER 1 0 fatal 0 non-fatal 0 corrected
    ecap 0003[138] = Serial 1 0000000000000000
    ecap 0010[144] = SR-IOV 1 IOV disabled, Memory Space disabled, ARI disabled
                     0 VFs configured out of 16 supported
                     First VF RID Offset 0x0008, VF RID Stride 0x0004
                     VF Device ID 0x4802
                     Page Sizes: 4096 (enabled)
    ecap 000e[184] = ARI 1

none2@pci0:1:0:3:	class=0x020000 rev=0x00 hdr=0x00 vendor=0x1425 device=0x4102 subvendor=0x1014 subdevice=0x03e5
    vendor     = 'Chelsio Communications Inc'
    class      = network
    subclass   = ethernet
    bar   [10] = type Memory, range 64, base 0xf7100000, size 262144, enabled
    bar   [20] = type Memory, range 64, base 0xf72c6000, size 8192, enabled
    cap 01[40] = powerspec 3  supports D0 D3  current D0
    cap 05[48] = MSI supports 8 messages, 64 bit, vector masks 
    cap 11[60] = MSI-X supports 8 messages
                 Table in map 0x20[0x0], PBA in map 0x20[0x1000]
    cap 10[6c] = PCI-Express 2 endpoint max data 512(2048) FLR NS
                 max read 512
                 link x8(x8) speed 5.0(5.0) ASPM disabled(L0s/L1)
    cap 03[a8] = VPD
    ecap 0001[100] = AER 1 0 fatal 0 non-fatal 0 corrected
    ecap 0003[138] = Serial 1 0000000000000000
    ecap 0010[144] = SR-IOV 1 IOV disabled, Memory Space disabled, ARI disabled
                     0 VFs configured out of 16 supported
                     First VF RID Offset 0x0008, VF RID Stride 0x0004
                     VF Device ID 0x4802
                     Page Sizes: 4096 (enabled)
    ecap 000e[184] = ARI 1

t4nex0@pci0:1:0:4:	class=0x020000 rev=0x00 hdr=0x00 vendor=0x1425 device=0x4402 subvendor=0x1014 subdevice=0x03e5
    vendor     = 'Chelsio Communications Inc'
    device     = 'T422-CR Unified Wire Ethernet Controller'
    class      = network
    subclass   = ethernet
    bar   [10] = type Memory, range 64, base 0xf7080000, size 262144, enabled
    bar   [18] = type Memory, range 64, base 0xf6800000, size 8388608, enabled
    bar   [20] = type Memory, range 64, base 0xf72c4000, size 8192, enabled
    cap 01[40] = powerspec 3  supports D0 D3  current D0
    cap 05[48] = MSI supports 32 messages, 64 bit, vector masks 
    cap 11[60] = MSI-X supports 128 messages, enabled
                 Table in map 0x20[0x0], PBA in map 0x20[0x1000]
    cap 10[6c] = PCI-Express 2 endpoint max data 512(2048) FLR RO NS
                 max read 4096
                 link x8(x8) speed 5.0(5.0) ASPM disabled(L0s/L1)
    cap 03[a8] = VPD
    ecap 0001[100] = AER 1 0 fatal 0 non-fatal 0 corrected
    ecap 0003[138] = Serial 1 0000000000000000
    ecap 000e[144] = ARI 1

none3@pci0:1:0:5:	class=0x010000 rev=0x00 hdr=0x00 vendor=0x1425 device=0x4502 subvendor=0x1014 subdevice=0x03e5
    vendor     = 'Chelsio Communications Inc'
    device     = 'T422-CR Unified Wire Storage Controller'
    class      = mass storage
    subclass   = SCSI
    bar   [10] = type Memory, range 64, base 0xf7040000, size 262144, enabled
    bar   [20] = type Memory, range 64, base 0xf72c2000, size 8192, enabled
    cap 01[40] = powerspec 3  supports D0 D3  current D0
    cap 05[48] = MSI supports 32 messages, 64 bit, vector masks 
    cap 11[60] = MSI-X supports 32 messages
                 Table in map 0x20[0x0], PBA in map 0x20[0x1000]
    cap 10[6c] = PCI-Express 2 endpoint max data 512(2048) FLR NS
                 max read 512
                 link x8(x8) speed 5.0(5.0) ASPM disabled(L0s/L1)
    cap 03[a8] = VPD
    ecap 0001[100] = AER 1 0 fatal 0 non-fatal 0 corrected
    ecap 0003[138] = Serial 1 0000000000000000
    ecap 000e[144] = ARI 1

none4@pci0:1:0:6:	class=0x0c0400 rev=0x00 hdr=0x00 vendor=0x1425 device=0x4602 subvendor=0x1014 subdevice=0x03e5
    vendor     = 'Chelsio Communications Inc'
    device     = 'T422-CR Unified Wire Storage Controller'
    class      = serial bus
    subclass   = Fibre Channel
    bar   [10] = type Memory, range 64, base 0xf7000000, size 262144, enabled
    bar   [20] = type Memory, range 64, base 0xf72c0000, size 8192, enabled
    cap 01[40] = powerspec 3  supports D0 D3  current D0
    cap 05[48] = MSI supports 32 messages, 64 bit, vector masks 
    cap 11[60] = MSI-X supports 32 messages
                 Table in map 0x20[0x0], PBA in map 0x20[0x1000]
    cap 10[6c] = PCI-Express 2 endpoint max data 512(2048) FLR NS
                 max read 512
                 link x8(x8) speed 5.0(5.0) ASPM disabled(L0s/L1)
    cap 03[a8] = VPD
    ecap 0001[100] = AER 1 0 fatal 0 non-fatal 0 corrected
    ecap 0003[138] = Serial 1 0000000000000000
    ecap 000e[144] = ARI 1

none5@pci0:1:0:7:	class=0x020000 rev=0x00 hdr=0x00 vendor=0x1425 device=0x0000 subvendor=0x1014 subdevice=0x03e5
    vendor     = 'Chelsio Communications Inc'
    class      = network
    subclass   = ethernet
    cap 01[40] = powerspec 3  supports D0 D3  current D0
    cap 05[48] = MSI supports 32 messages, 64 bit, vector masks 
    cap 11[60] = MSI-X supports 32 messages
                 Table in map 0x20[0x0], PBA in map 0x20[0x1000]
    cap 10[6c] = PCI-Express 2 endpoint max data 512(2048) FLR NS
                 max read 512
                 link x8(x8) speed 5.0(5.0) ASPM disabled(L0s/L1)
    cap 03[a8] = VPD
    ecap 0001[100] = AER 1 0 fatal 0 non-fatal 0 corrected
    ecap 0003[138] = Serial 1 0000000000000000
    ecap 000e[144] = ARI 1

re0@pci0:2:0:0:	class=0x020000 rev=0x0e hdr=0x00 vendor=0x10ec device=0x8168 subvendor=0x103c subdevice=0x8522
    vendor     = 'Realtek Semiconductor Co., Ltd.'
    device     = 'RTL8111/8168/8411 PCI Express Gigabit Ethernet Controller'
    class      = network
    subclass   = ethernet
    bar   [10] = type I/O Port, range 32, base 0xf400, size 256, enabled
    bar   [18] = type Memory, range 64, base 0xf7909000, size 4096, enabled
    bar   [20] = type Memory, range 64, base 0xf7904000, size 16384, enabled
    cap 01[40] = powerspec 3  supports D0 D1 D2 D3  current D0
    cap 05[50] = MSI supports 1 message, 64 bit 
    cap 10[70] = PCI-Express 2 endpoint MSI 1 max data 128(128)
                 max read 4096
                 link x1(x1) speed 2.5(2.5) ASPM disabled(L0s/L1) ClockPM disabled
    cap 11[b0] = MSI-X supports 4 messages, enabled
                 Table in map 0x20[0x0], PBA in map 0x20[0x800]
    cap 03[d0] = VPD
    ecap 0001[100] = AER 2 0 fatal 0 non-fatal 1 corrected
    ecap 0002[140] = VC 1 max VC0
    ecap 0003[160] = Serial 1 01000000684ce000
    ecap 0018[170] = LTR 1
    ecap 001e[178] = L1 PM Substates 1

none6@pci0:2:0:1:	class=0x070002 rev=0x0e hdr=0x00 vendor=0x10ec device=0x816a subvendor=0x103c subdevice=0x8522
    vendor     = 'Realtek Semiconductor Co., Ltd.'
    device     = 'RTL8111xP UART'
    class      = simple comms
    subclass   = UART
    bar   [10] = type I/O Port, range 32, base 0, size 256, disabled
    bar   [18] = type Memory, range 64, base 0, size 4096, disabled
    bar   [20] = type Memory, range 64, base 0, size 16384, disabled
    cap 01[40] = powerspec 3  supports D0 D1 D2 D3  current D0
    cap 05[50] = MSI supports 1 message, 64 bit 
    cap 10[70] = PCI-Express 2 endpoint MSI 1 max data 128(128) RO
                 max read 512
                 link x1(x1) speed 2.5(2.5) ASPM disabled(L0s/L1) ClockPM enabled
    cap 11[b0] = MSI-X supports 4 messages
                 Table in map 0x20[0x0], PBA in map 0x20[0x800]
    cap 03[d0] = VPD
    ecap 0001[100] = AER 2 0 fatal 0 non-fatal 1 corrected
    ecap 0003[160] = Serial 1 0000000000000000
    ecap 0018[170] = LTR 1
    ecap 001e[178] = L1 PM Substates 1

none7@pci0:2:0:2:	class=0x070002 rev=0x0e hdr=0x00 vendor=0x10ec device=0x816b subvendor=0x103c subdevice=0x8522
    vendor     = 'Realtek Semiconductor Co., Ltd.'
    device     = 'RTL8111xP UART'
    class      = simple comms
    subclass   = UART
    bar   [10] = type I/O Port, range 32, base 0, size 256, disabled
    bar   [18] = type Memory, range 64, base 0, size 4096, disabled
    bar   [20] = type Memory, range 64, base 0, size 16384, disabled
    cap 01[40] = powerspec 3  supports D0 D1 D2 D3  current D0
    cap 05[50] = MSI supports 1 message, 64 bit 
    cap 10[70] = PCI-Express 2 endpoint MSI 1 max data 128(128) RO
                 max read 512
                 link x1(x1) speed 2.5(2.5) ASPM disabled(L0s/L1) ClockPM enabled
    cap 11[b0] = MSI-X supports 4 messages
                 Table in map 0x20[0x0], PBA in map 0x20[0x800]
    cap 03[d0] = VPD
    ecap 0001[100] = AER 2 0 fatal 0 non-fatal 1 corrected
    ecap 0003[160] = Serial 1 0000000000000000
    ecap 0018[170] = LTR 1
    ecap 001e[178] = L1 PM Substates 1

none8@pci0:2:0:3:	class=0x0c0701 rev=0x0e hdr=0x00 vendor=0x10ec device=0x816c subvendor=0x103c subdevice=0x8522
    vendor     = 'Realtek Semiconductor Co., Ltd.'
    device     = 'RTL8111xP IPMI interface'
    class      = serial bus
    subclass   = IPMI
    bar   [10] = type I/O Port, range 32, base 0xf000, size 256, enabled
    bar   [18] = type Memory, range 64, base 0xf7908000, size 4096, enabled
    bar   [20] = type Memory, range 64, base 0xf7900000, size 16384, enabled
    cap 01[40] = powerspec 3  supports D0 D1 D2 D3  current D0
    cap 05[50] = MSI supports 1 message, 64 bit 
    cap 10[70] = PCI-Express 2 endpoint MSI 1 max data 128(128)
                 max read 512
                 link x1(x1) speed 2.5(2.5) ASPM disabled(L0s/L1) ClockPM enabled
    cap 11[b0] = MSI-X supports 4 messages
                 Table in map 0x20[0x0], PBA in map 0x20[0x800]
    cap 03[d0] = VPD
    ecap 0001[100] = AER 2 0 fatal 0 non-fatal 1 corrected
    ecap 0003[160] = Serial 1 0000000000000000
    ecap 0018[170] = LTR 1
    ecap 001e[178] = L1 PM Substates 1

ehci0@pci0:2:0:4:	class=0x0c0320 rev=0x0e hdr=0x00 vendor=0x10ec device=0x816d subvendor=0x103c subdevice=0x8522
    vendor     = 'Realtek Semiconductor Co., Ltd.'
    device     = 'RTL811x EHCI host controller'
    class      = serial bus
    subclass   = USB
    bar   [10] = type Memory, range 32, base 0xf790a000, size 4096, enabled
    bar   [18] = type Memory, range 64, base 0, size 16384, enabled
    cap 01[40] = powerspec 3  supports D0 D3  current D0
    cap 05[50] = MSI supports 1 message, 64 bit 
    cap 10[70] = PCI-Express 2 endpoint MSI 1 max data 128(128) RO
                 max read 512
                 link x1(x1) speed 2.5(2.5) ASPM disabled(L0s/L1) ClockPM enabled
    cap 11[b0] = MSI-X supports 4 messages
                 Table in map 0x18[0x0], PBA in map 0x18[0x800]
    cap 03[d0] = VPD
    ecap 0001[100] = AER 2 0 fatal 0 non-fatal 1 corrected
    ecap 0003[160] = Serial 1 0000000000000000
    ecap 0018[170] = LTR 1
    ecap 001e[178] = L1 PM Substates 1

vgapci0@pci0:3:0:0:	class=0x030000 rev=0x82 hdr=0x00 vendor=0x1002 device=0x15dd subvendor=0x103c subdevice=0x8522
    vendor     = 'Advanced Micro Devices, Inc. [AMD/ATI]'
    device     = 'Raven Ridge [Radeon Vega Series / Radeon Vega Mobile Series]'
    class      = display
    subclass   = VGA
    bar   [10] = type Prefetchable Memory, range 64, base 0xe0000000, size 268435456, enabled
    bar   [18] = type Prefetchable Memory, range 64, base 0xf0000000, size 2097152, enabled
    bar   [20] = type I/O Port, range 32, base 0xe000, size 256, enabled
    bar   [24] = type Memory, range 32, base 0xf7700000, size 524288, enabled
    cap 09[48] = vendor (length 8)
    cap 01[50] = powerspec 3  supports D0 D3  current D0
    cap 10[64] = PCI-Express 2 legacy endpoint max data 256(256) FLR NS
                 max read 512
                 link x16(x16) speed 8.0(8.0) ASPM disabled(L0s/L1)
    cap 05[a0] = MSI supports 4 messages, 64 bit 
    cap 11[c0] = MSI-X supports 3 messages
                 Table in map 0x24[0x42000], PBA in map 0x24[0x43000]
    ecap 000b[100] = Vendor [1] ID 0001 Rev 1 Length 16
    ecap 0015[200] = Resizable BAR 1
    ecap 0019[270] = PCIe Sec 1 lane errors 0
    ecap 000d[2a0] = ACS 1
    ecap 000f[2b0] = ATS 1
    ecap 0013[2c0] = Page Page Request 1
    ecap 001b[2d0] = Process Address Space ID 1
    ecap 0018[320] = LTR 1

hdac0@pci0:3:0:1:	class=0x040300 rev=0x00 hdr=0x00 vendor=0x1002 device=0x15de subvendor=0x1002 subdevice=0x15de
    vendor     = 'Advanced Micro Devices, Inc. [AMD/ATI]'
    device     = 'Raven/Raven2/Fenghuang HDMI/DP Audio Controller'
    class      = multimedia
    subclass   = HDA
    bar   [10] = type Memory, range 32, base 0xf77c8000, size 16384, enabled
    cap 09[48] = vendor (length 8)
    cap 01[50] = powerspec 3  supports D0 D3  current D0
    cap 10[64] = PCI-Express 2 legacy endpoint max data 256(256) FLR NS
                 max read 512
                 link x16(x16) speed 8.0(8.0) ASPM disabled(L0s/L1)
    cap 05[a0] = MSI supports 1 message, 64 bit enabled with 1 message
    ecap 000b[100] = Vendor [1] ID 0001 Rev 1 Length 16

none9@pci0:3:0:2:	class=0x108000 rev=0x00 hdr=0x00 vendor=0x1022 device=0x15df subvendor=0x103c subdevice=0x8522
    vendor     = 'Advanced Micro Devices, Inc. [AMD]'
    device     = 'Family 17h (Models 10h-1fh) Platform Security Processor'
    class      = encrypt/decrypt
    bar   [18] = type Memory, range 32, base 0xf7600000, size 1048576, enabled
    bar   [24] = type Memory, range 32, base 0xf77cc000, size 8192, enabled
    cap 09[48] = vendor (length 8)
    cap 01[50] = powerspec 3  supports D0 D3  current D0
    cap 10[64] = PCI-Express 2 endpoint max data 256(256) NS
                 max read 512
                 link x16(x16) speed 8.0(8.0) ASPM disabled(L0s/L1)
    cap 05[a0] = MSI supports 2 messages, 64 bit 
    cap 11[c0] = MSI-X supports 2 messages
                 Table in map 0x24[0x0], PBA in map 0x24[0x1000]
    ecap 000b[100] = Vendor [1] ID 0001 Rev 1 Length 16

xhci0@pci0:3:0:3:	class=0x0c0330 rev=0x00 hdr=0x00 vendor=0x1022 device=0x15e0 subvendor=0x103c subdevice=0x8522
    vendor     = 'Advanced Micro Devices, Inc. [AMD]'
    device     = 'Raven USB 3.1'
    class      = serial bus
    subclass   = USB
    bar   [10] = type Memory, range 64, base 0xf7500000, size 1048576, enabled
    cap 09[48] = vendor (length 8)
    cap 01[50] = powerspec 3  supports D0 D3  current D0
    cap 10[64] = PCI-Express 2 endpoint max data 256(256) NS
                 max read 512
                 link x16(x16) speed 8.0(8.0) ASPM disabled(L0s/L1)
    cap 05[a0] = MSI supports 8 messages, 64 bit 
    cap 11[c0] = MSI-X supports 8 messages, enabled
                 Table in map 0x10[0xfe000], PBA in map 0x10[0xff000]
    ecap 000b[100] = Vendor [1] ID 0001 Rev 1 Length 16

xhci1@pci0:3:0:4:	class=0x0c0330 rev=0x00 hdr=0x00 vendor=0x1022 device=0x15e1 subvendor=0x103c subdevice=0x8522
    vendor     = 'Advanced Micro Devices, Inc. [AMD]'
    device     = 'Raven USB 3.1'
    class      = serial bus
    subclass   = USB
    bar   [10] = type Memory, range 64, base 0xf7400000, size 1048576, enabled
    cap 09[48] = vendor (length 8)
    cap 01[50] = powerspec 3  supports D0 D3  current D0
    cap 10[64] = PCI-Express 2 endpoint max data 256(256) NS
                 max read 512
                 link x16(x16) speed 8.0(8.0) ASPM disabled(L0s/L1)
    cap 05[a0] = MSI supports 8 messages, 64 bit 
    cap 11[c0] = MSI-X supports 8 messages, enabled
                 Table in map 0x10[0xfe000], PBA in map 0x10[0xff000]
    ecap 000b[100] = Vendor [1] ID 0001 Rev 1 Length 16

none10@pci0:3:0:5:	class=0x048000 rev=0x00 hdr=0x00 vendor=0x1022 device=0x15e2 subvendor=0x103c subdevice=0x8522
    vendor     = 'Advanced Micro Devices, Inc. [AMD]'
    device     = 'Raven/Raven2/FireFlight/Renoir Audio Processor'
    class      = multimedia
    bar   [10] = type Memory, range 32, base 0xf7780000, size 262144, enabled
    cap 09[48] = vendor (length 8)
    cap 01[50] = powerspec 3  supports D0 D3  current D0
    cap 10[64] = PCI-Express 2 endpoint max data 256(256) NS
                 max read 512
                 link x16(x16) speed 8.0(8.0) ASPM disabled(L0s/L1)
    cap 05[a0] = MSI supports 1 message, 64 bit 
    ecap 000b[100] = Vendor [1] ID 0001 Rev 1 Length 16

hdac1@pci0:3:0:6:	class=0x040300 rev=0x00 hdr=0x00 vendor=0x1022 device=0x15e3 subvendor=0x103c subdevice=0x8522
    vendor     = 'Advanced Micro Devices, Inc. [AMD]'
    device     = 'Family 17h (Models 10h-1fh) HD Audio Controller'
    class      = multimedia
    subclass   = HDA
    bar   [10] = type Memory, range 32, base 0xf77c0000, size 32768, enabled
    cap 09[48] = vendor (length 8)
    cap 01[50] = powerspec 3  supports D0 D3  current D0
    cap 10[64] = PCI-Express 2 endpoint max data 256(256) NS
                 max read 512
                 link x16(x16) speed 8.0(8.0) ASPM disabled(L0s/L1)
    cap 05[a0] = MSI supports 1 message, 64 bit enabled with 1 message
    ecap 000b[100] = Vendor [1] ID 0001 Rev 1 Length 16

ahci0@pci0:4:0:0:	class=0x010601 rev=0x61 hdr=0x00 vendor=0x1022 device=0x7901 subvendor=0x103c subdevice=0x8522
    vendor     = 'Advanced Micro Devices, Inc. [AMD]'
    device     = 'FCH SATA Controller [AHCI mode]'
    class      = mass storage
    subclass   = SATA
    bar   [24] = type Memory, range 32, base 0xf7800000, size 2048, enabled
    cap 09[48] = vendor (length 8)
    cap 01[50] = powerspec 3  supports D0 D3  current D0
    cap 10[64] = PCI-Express 2 endpoint max data 256(256) NS
                 max read 512
                 link x16(x16) speed 8.0(8.0) ASPM disabled(L0s/L1)
    cap 05[a0] = MSI supports 2 messages, 64 bit enabled with 1 message
    cap 12[d0] = SATA Index-Data Pair
    ecap 000b[100] = Vendor [1] ID 0001 Rev 1 Length 16
    ecap 0019[270] = PCIe Sec 1 lane errors 0
