hostb0@pci0:0:0:0:	class=0x060000 rev=0x07 hdr=0x00 vendor=0x8086 device=0x2020 subvendor=0x17aa subdevice=0x7800
    vendor     = 'Intel Corporation'
    device     = 'Sky Lake-E DMI3 Registers'
    class      = bridge
    subclass   = HOST-PCI
    cap 10[90] = PCI-Express 2 root port max data 128(256)
                 max read 128
                 link x0(x4) speed 0.0(8.0)
    cap 01[e0] = powerspec 3  supports D0 D3  current D0
    ecap 000b[100] = Vendor [1] ID 0002 Rev 0 Length 12
    ecap 000b[144] = Vendor [1] ID 0004 Rev 1 Length 60
    ecap 000b[1d0] = Vendor [1] ID 0003 Rev 1 Length 10
    ecap 0019[250] = PCIe Sec 1 lane errors 0xf
    ecap 000b[280] = Vendor [1] ID 0005 Rev 3 Length 24
    ecap 000b[298] = Vendor [1] ID 0007 Rev 0 Length 36
    ecap 000b[300] = Vendor [1] ID 0008 Rev 0 Length 56

ioat0@pci0:0:4:0:	class=0x088000 rev=0x07 hdr=0x00 vendor=0x8086 device=0x2021 subvendor=0x17aa subdevice=0x7800
    vendor     = 'Intel Corporation'
    device     = 'Sky Lake-E CBDMA Registers'
    class      = base peripheral
    bar   [10] = type Memory, range 64, base 0x20ffff2c000, size 16384, enabled
    cap 11[80] = MSI-X supports 1 message, enabled
                 Table in map 0x10[0x2000], PBA in map 0x10[0x3000]
    cap 10[90] = PCI-Express 2 root endpoint max data 128(128)
                 max read 128
    cap 01[e0] = powerspec 3  supports D0 D3  current D0

ioat1@pci0:0:4:1:	class=0x088000 rev=0x07 hdr=0x00 vendor=0x8086 device=0x2021 subvendor=0x17aa subdevice=0x7800
    vendor     = 'Intel Corporation'
    device     = 'Sky Lake-E CBDMA Registers'
    class      = base peripheral
    bar   [10] = type Memory, range 64, base 0x20ffff28000, size 16384, enabled
    cap 11[80] = MSI-X supports 1 message, enabled
                 Table in map 0x10[0x2000], PBA in map 0x10[0x3000]
    cap 10[90] = PCI-Express 2 root endpoint max data 128(128)
                 max read 128
    cap 01[e0] = powerspec 3  supports D0 D3  current D0

ioat2@pci0:0:4:2:	class=0x088000 rev=0x07 hdr=0x00 vendor=0x8086 device=0x2021 subvendor=0x17aa subdevice=0x7800
    vendor     = 'Intel Corporation'
    device     = 'Sky Lake-E CBDMA Registers'
    class      = base peripheral
    bar   [10] = type Memory, range 64, base 0x20ffff24000, size 16384, enabled
    cap 11[80] = MSI-X supports 1 message, enabled
                 Table in map 0x10[0x2000], PBA in map 0x10[0x3000]
    cap 10[90] = PCI-Express 2 root endpoint max data 128(128)
                 max read 128
    cap 01[e0] = powerspec 3  supports D0 D3  current D0

ioat3@pci0:0:4:3:	class=0x088000 rev=0x07 hdr=0x00 vendor=0x8086 device=0x2021 subvendor=0x17aa subdevice=0x7800
    vendor     = 'Intel Corporation'
    device     = 'Sky Lake-E CBDMA Registers'
    class      = base peripheral
    bar   [10] = type Memory, range 64, base 0x20ffff20000, size 16384, enabled
    cap 11[80] = MSI-X supports 1 message, enabled
                 Table in map 0x10[0x2000], PBA in map 0x10[0x3000]
    cap 10[90] = PCI-Express 2 root endpoint max data 128(128)
                 max read 128
    cap 01[e0] = powerspec 3  supports D0 D3  current D0

ioat4@pci0:0:4:4:	class=0x088000 rev=0x07 hdr=0x00 vendor=0x8086 device=0x2021 subvendor=0x17aa subdevice=0x7800
    vendor     = 'Intel Corporation'
    device     = 'Sky Lake-E CBDMA Registers'
    class      = base peripheral
    bar   [10] = type Memory, range 64, base 0x20ffff1c000, size 16384, enabled
    cap 11[80] = MSI-X supports 1 message, enabled
                 Table in map 0x10[0x2000], PBA in map 0x10[0x3000]
    cap 10[90] = PCI-Express 2 root endpoint max data 128(128)
                 max read 128
    cap 01[e0] = powerspec 3  supports D0 D3  current D0

ioat5@pci0:0:4:5:	class=0x088000 rev=0x07 hdr=0x00 vendor=0x8086 device=0x2021 subvendor=0x17aa subdevice=0x7800
    vendor     = 'Intel Corporation'
    device     = 'Sky Lake-E CBDMA Registers'
    class      = base peripheral
    bar   [10] = type Memory, range 64, base 0x20ffff18000, size 16384, enabled
    cap 11[80] = MSI-X supports 1 message, enabled
                 Table in map 0x10[0x2000], PBA in map 0x10[0x3000]
    cap 10[90] = PCI-Express 2 root endpoint max data 128(128)
                 max read 128
    cap 01[e0] = powerspec 3  supports D0 D3  current D0

ioat6@pci0:0:4:6:	class=0x088000 rev=0x07 hdr=0x00 vendor=0x8086 device=0x2021 subvendor=0x17aa subdevice=0x7800
    vendor     = 'Intel Corporation'
    device     = 'Sky Lake-E CBDMA Registers'
    class      = base peripheral
    bar   [10] = type Memory, range 64, base 0x20ffff14000, size 16384, enabled
    cap 11[80] = MSI-X supports 1 message, enabled
                 Table in map 0x10[0x2000], PBA in map 0x10[0x3000]
    cap 10[90] = PCI-Express 2 root endpoint max data 128(128)
                 max read 128
    cap 01[e0] = powerspec 3  supports D0 D3  current D0

ioat7@pci0:0:4:7:	class=0x088000 rev=0x07 hdr=0x00 vendor=0x8086 device=0x2021 subvendor=0x17aa subdevice=0x7800
    vendor     = 'Intel Corporation'
    device     = 'Sky Lake-E CBDMA Registers'
    class      = base peripheral
    bar   [10] = type Memory, range 64, base 0x20ffff10000, size 16384, enabled
    cap 11[80] = MSI-X supports 1 message, enabled
                 Table in map 0x10[0x2000], PBA in map 0x10[0x3000]
    cap 10[90] = PCI-Express 2 root endpoint max data 128(128)
                 max read 128
    cap 01[e0] = powerspec 3  supports D0 D3  current D0

none0@pci0:0:5:0:	class=0x088000 rev=0x07 hdr=0x00 vendor=0x8086 device=0x2024 subvendor=0x17aa subdevice=0x7800
    vendor     = 'Intel Corporation'
    device     = 'Sky Lake-E MM/Vt-d Configuration Registers'
    class      = base peripheral
    cap 10[40] = PCI-Express 2 root endpoint max data 128(128)
                 max read 128

none1@pci0:0:5:2:	class=0x088000 rev=0x07 hdr=0x00 vendor=0x8086 device=0x2025 subvendor=0x17aa subdevice=0x7800
    vendor     = 'Intel Corporation'
    device     = 'Sky Lake-E RAS'
    class      = base peripheral
    cap 10[40] = PCI-Express 2 root endpoint max data 128(128)
                 max read 128

ioapic0@pci0:0:5:4:	class=0x080020 rev=0x07 hdr=0x00 vendor=0x8086 device=0x2026 subvendor=0x17aa subdevice=0x7800
    vendor     = 'Intel Corporation'
    device     = 'Sky Lake-E IOAPIC'
    class      = base peripheral
    subclass   = interrupt controller
    bar   [10] = type Memory, range 32, base 0xd9d1a000, size 4096, enabled
    cap 10[44] = PCI-Express 1 root endpoint max data 128(128)
                 max read 128
    cap 01[e0] = powerspec 3  supports D0 D3  current D0

none2@pci0:0:8:0:	class=0x088000 rev=0x07 hdr=0x00 vendor=0x8086 device=0x2014 subvendor=0x17aa subdevice=0x7800
    vendor     = 'Intel Corporation'
    device     = 'Sky Lake-E Ubox Registers'
    class      = base peripheral
    cap 10[40] = PCI-Express 2 root endpoint max data 128(128)
                 max read 128

none3@pci0:0:8:1:	class=0x110100 rev=0x07 hdr=0x00 vendor=0x8086 device=0x2015 subvendor=0x17aa subdevice=0x7800
    vendor     = 'Intel Corporation'
    device     = 'Sky Lake-E Ubox Registers'
    class      = dasp
    subclass   = performance counters

none4@pci0:0:8:2:	class=0x088000 rev=0x07 hdr=0x00 vendor=0x8086 device=0x2016 subvendor=0x17aa subdevice=0x7800
    vendor     = 'Intel Corporation'
    device     = 'Sky Lake-E Ubox Registers'
    class      = base peripheral
    cap 10[40] = PCI-Express 2 root endpoint max data 128(128)
                 max read 128

none5@pci0:0:17:0:	class=0xff0000 rev=0x09 hdr=0x00 vendor=0x8086 device=0xa1ec subvendor=0x17aa subdevice=0x7800
    vendor     = 'Intel Corporation'
    device     = 'C620 Series Chipset Family MROM 0'
    cap 01[80] = powerspec 3  supports D0 D3  current D0

ahci0@pci0:0:17:5:	class=0x010601 rev=0x09 hdr=0x00 vendor=0x8086 device=0xa1d2 subvendor=0x17aa subdevice=0x7800
    vendor     = 'Intel Corporation'
    device     = 'C620 Series Chipset Family SSATA Controller [AHCI mode]'
    class      = mass storage
    subclass   = SATA
    bar   [10] = type Memory, range 32, base 0xd9d16000, size 8192, enabled
    bar   [14] = type Memory, range 32, base 0xd9d19000, size 256, enabled
    bar   [18] = type I/O Port, range 32, base 0x2070, size 8, enabled
    bar   [1c] = type I/O Port, range 32, base 0x2060, size 4, enabled
    bar   [20] = type I/O Port, range 32, base 0x2020, size 32, enabled
    bar   [24] = type Memory, range 32, base 0xd9c80000, size 524288, enabled
    cap 05[80] = MSI supports 1 message enabled with 1 message
    cap 01[70] = powerspec 3  supports D0 D3  current D0
    cap 12[a8] = SATA Index-Data Pair

xhci0@pci0:0:20:0:	class=0x0c0330 rev=0x09 hdr=0x00 vendor=0x8086 device=0xa1af subvendor=0x17aa subdevice=0x7800
    vendor     = 'Intel Corporation'
    device     = 'C620 Series Chipset Family USB 3.0 xHCI Controller'
    class      = serial bus
    subclass   = USB
    bar   [10] = type Memory, range 64, base 0x20ffff00000, size 65536, enabled
    cap 01[70] = powerspec 2  supports D0 D3  current D0
    cap 05[80] = MSI supports 8 messages, 64 bit enabled with 1 message

pchtherm0@pci0:0:20:2:	class=0x118000 rev=0x09 hdr=0x00 vendor=0x8086 device=0xa1b1 subvendor=0x17aa subdevice=0x7800
    vendor     = 'Intel Corporation'
    device     = 'C620 Series Chipset Family Thermal Subsystem'
    class      = dasp
    bar   [10] = type Memory, range 64, base 0x20ffff33000, size 4096, enabled
    cap 01[50] = powerspec 3  supports D0 D3  current D0
    cap 05[80] = MSI supports 1 message 

none6@pci0:0:22:0:	class=0x078000 rev=0x09 hdr=0x00 vendor=0x8086 device=0xa1ba subvendor=0x17aa subdevice=0x7800
    vendor     = 'Intel Corporation'
    device     = 'C620 Series Chipset Family MEI Controller'
    class      = simple comms
    bar   [10] = type Memory, range 64, base 0x20ffff32000, size 4096, enabled
    cap 01[50] = powerspec 3  supports D0 D3  current D0
    cap 05[8c] = MSI supports 1 message, 64 bit 

none7@pci0:0:22:1:	class=0x078000 rev=0x09 hdr=0x00 vendor=0x8086 device=0xa1bb subvendor=0x17aa subdevice=0x7800
    vendor     = 'Intel Corporation'
    device     = 'C620 Series Chipset Family MEI Controller'
    class      = simple comms
    bar   [10] = type Memory, range 64, base 0x20ffff31000, size 4096, enabled
    cap 01[50] = powerspec 3  supports D0 D3  current D0
    cap 05[8c] = MSI supports 1 message, 64 bit 

none8@pci0:0:22:4:	class=0x078000 rev=0x09 hdr=0x00 vendor=0x8086 device=0xa1be subvendor=0x17aa subdevice=0x7800
    vendor     = 'Intel Corporation'
    device     = 'C620 Series Chipset Family MEI Controller'
    class      = simple comms
    bar   [10] = type Memory, range 64, base 0x20ffff30000, size 4096, enabled
    cap 01[50] = powerspec 3  supports D0 D3  current D0
    cap 05[8c] = MSI supports 1 message, 64 bit 

ahci1@pci0:0:23:0:	class=0x010601 rev=0x09 hdr=0x00 vendor=0x8086 device=0xa182 subvendor=0x17aa subdevice=0x7800
    vendor     = 'Intel Corporation'
    device     = 'C620 Series Chipset Family SATA Controller [AHCI mode]'
    class      = mass storage
    subclass   = SATA
    bar   [10] = type Memory, range 32, base 0xd9d14000, size 8192, enabled
    bar   [14] = type Memory, range 32, base 0xd9d18000, size 256, enabled
    bar   [18] = type I/O Port, range 32, base 0x2050, size 8, enabled
    bar   [1c] = type I/O Port, range 32, base 0x2040, size 4, enabled
    bar   [20] = type I/O Port, range 32, base 0x2000, size 32, enabled
    bar   [24] = type Memory, range 32, base 0xd9c00000, size 524288, enabled
    cap 05[80] = MSI supports 1 message enabled with 1 message
    cap 01[70] = powerspec 3  supports D0 D3  current D0
    cap 12[a8] = SATA Index-Data Pair

pcib1@pci0:0:28:0:	class=0x060400 rev=0xf9 hdr=0x01 vendor=0x8086 device=0xa190 subvendor=0x17aa subdevice=0x7800
    vendor     = 'Intel Corporation'
    device     = 'C620 Series Chipset Family PCI Express Root Port'
    class      = bridge
    subclass   = PCI-PCI
    cap 10[40] = PCI-Express 2 root port max data 128(128) ARI disabled
                 max read 128
                 link x1(x1) speed 5.0(8.0)
                 slot 0 power limit 100 mW
    cap 05[80] = MSI supports 1 message 
    cap 0d[90] = PCI Bridge subvendor=0x17aa subdevice=0x7800
    cap 01[a0] = powerspec 3  supports D0 D3  current D0
    ecap 0001[100] = AER 1 0 fatal 0 non-fatal 0 corrected
    ecap 000d[140] = ACS 1
    ecap 0019[220] = PCIe Sec 1 lane errors 0

isab0@pci0:0:31:0:	class=0x060100 rev=0x09 hdr=0x00 vendor=0x8086 device=0xa1c3 subvendor=0x17aa subdevice=0x7800
    vendor     = 'Intel Corporation'
    device     = 'C624 Series Chipset LPC/eSPI Controller'
    class      = bridge
    subclass   = PCI-ISA

none9@pci0:0:31:2:	class=0x058000 rev=0x09 hdr=0x00 vendor=0x8086 device=0xa1a1 subvendor=0x17aa subdevice=0x7800
    vendor     = 'Intel Corporation'
    device     = 'C620 Series Chipset Family Power Management Controller'
    class      = memory
    bar   [10] = type Memory, range 32, base 0xd9d10000, size 16384, enabled

ichsmb0@pci0:0:31:4:	class=0x0c0500 rev=0x09 hdr=0x00 vendor=0x8086 device=0xa1a3 subvendor=0x17aa subdevice=0x7800
    vendor     = 'Intel Corporation'
    device     = 'C620 Series Chipset Family SMBus'
    class      = serial bus
    subclass   = SMBus
    bar   [10] = type Memory, range 64, base 0, size 256, disabled
    bar   [20] = type I/O Port, range 32, base 0x780, size 32, enabled

none10@pci0:0:31:5:	class=0x0c8000 rev=0x09 hdr=0x00 vendor=0x8086 device=0xa1a4 subvendor=0x17aa subdevice=0x7800
    vendor     = 'Intel Corporation'
    device     = 'C620 Series Chipset Family SPI Controller'
    class      = serial bus
    bar   [10] = type Memory, range 32, base 0xfe010000, size 4096, enabled

pcib2@pci0:1:0:0:	class=0x060400 rev=0x00 hdr=0x01 vendor=0x19a2 device=0x0120 subvendor=0x0000 subdevice=0x0000
    vendor     = 'Emulex Corporation'
    device     = 'x1 PCIe Gen2 Bridge[Pilot4]'
    class      = bridge
    subclass   = PCI-PCI
    bar   [10] = type Memory, range 64, base 0xd9b00000, size 4096, enabled
    cap 01[40] = powerspec 3  supports D0 D3  current D0
    cap 05[50] = MSI supports 1 message, 64 bit 
    cap 10[60] = PCI-Express 2 PCI bridge max data 128(256) RO
                 max read 4096
                 link x1(x1) speed 5.0(5.0) ASPM disabled(L0s/L1)
    ecap 0001[100] = AER 1 0 fatal 0 non-fatal 1 corrected
    ecap 0003[150] = Serial 1 0000000000000000

vgapci0@pci0:2:0:0:	class=0x030000 rev=0x42 hdr=0x00 vendor=0x102b device=0x0522 subvendor=0x19a2 subdevice=0x0101
    vendor     = 'Matrox Electronics Systems Ltd.'
    device     = 'MGA G200e [Pilot] ServerEngines (SEP1)'
    class      = display
    subclass   = VGA
    bar   [10] = type Memory, range 32, base 0xd8000000, size 16777216, enabled
    bar   [14] = type Memory, range 32, base 0xd9a10000, size 16384, enabled
    bar   [18] = type Memory, range 32, base 0xd9000000, size 8388608, enabled
    cap 01[dc] = powerspec 2  supports D0 D3  current D0
    cap 05[54] = MSI supports 1 message 

pcib4@pci0:7:2:0:	class=0x060400 rev=0x07 hdr=0x01 vendor=0x8086 device=0x2032 subvendor=0x17aa subdevice=0x7800
    vendor     = 'Intel Corporation'
    device     = 'Sky Lake-E PCI Express Root Port C'
    class      = bridge
    subclass   = PCI-PCI
    cap 0d[40] = PCI Bridge subvendor=0x17aa subdevice=0x7800
    cap 05[60] = MSI supports 2 messages, vector masks 
    cap 10[90] = PCI-Express 2 root port max data 256(256) ARI disabled
                 max read 128
                 link x8(x8) speed 8.0(8.0) ASPM disabled(L1)
    cap 01[e0] = powerspec 3  supports D0 D3  current D0
    ecap 000b[100] = Vendor [1] ID 0002 Rev 0 Length 12
    ecap 000d[110] = ACS 1
    ecap 0001[148] = AER 1 0 fatal 0 non-fatal 0 corrected
    ecap 000b[1d0] = Vendor [1] ID 0003 Rev 1 Length 10
    ecap 0019[250] = PCIe Sec 1 lane errors 0
    ecap 000b[280] = Vendor [1] ID 0005 Rev 3 Length 24
    ecap 000b[298] = Vendor [1] ID 0007 Rev 0 Length 36
    ecap 000b[300] = Vendor [1] ID 0008 Rev 0 Length 56

none11@pci0:7:5:0:	class=0x088000 rev=0x07 hdr=0x00 vendor=0x8086 device=0x2034 subvendor=0x17aa subdevice=0x7800
    vendor     = 'Intel Corporation'
    device     = 'Sky Lake-E VT-d'
    class      = base peripheral
    cap 10[40] = PCI-Express 2 root endpoint max data 128(128)
                 max read 128

none12@pci0:7:5:2:	class=0x088000 rev=0x07 hdr=0x00 vendor=0x8086 device=0x2035 subvendor=0x17aa subdevice=0x7800
    vendor     = 'Intel Corporation'
    device     = 'Sky Lake-E RAS Configuration Registers'
    class      = base peripheral
    cap 10[40] = PCI-Express 2 root endpoint max data 128(128)
                 max read 128

ioapic1@pci0:7:5:4:	class=0x080020 rev=0x07 hdr=0x00 vendor=0x8086 device=0x2036 subvendor=0x17aa subdevice=0x7800
    vendor     = 'Intel Corporation'
    device     = 'Sky Lake-E IOxAPIC Configuration Registers'
    class      = base peripheral
    subclass   = interrupt controller
    bar   [10] = type Memory, range 32, base 0xe3f00000, size 4096, enabled
    cap 10[44] = PCI-Express 1 root endpoint max data 128(128)
                 max read 128
    cap 01[e0] = powerspec 3  supports D0 D3  current D0

none13@pci0:7:8:0:	class=0x088000 rev=0x07 hdr=0x00 vendor=0x8086 device=0x208d subvendor=0x17aa subdevice=0x7800
    vendor     = 'Intel Corporation'
    device     = 'Sky Lake-E CHA Registers'
    class      = base peripheral

none14@pci0:7:8:1:	class=0x088000 rev=0x07 hdr=0x00 vendor=0x8086 device=0x208d subvendor=0x17aa subdevice=0x7800
    vendor     = 'Intel Corporation'
    device     = 'Sky Lake-E CHA Registers'
    class      = base peripheral

none15@pci0:7:8:2:	class=0x088000 rev=0x07 hdr=0x00 vendor=0x8086 device=0x208d subvendor=0x17aa subdevice=0x7800
    vendor     = 'Intel Corporation'
    device     = 'Sky Lake-E CHA Registers'
    class      = base peripheral

none16@pci0:7:8:3:	class=0x088000 rev=0x07 hdr=0x00 vendor=0x8086 device=0x208d subvendor=0x17aa subdevice=0x7800
    vendor     = 'Intel Corporation'
    device     = 'Sky Lake-E CHA Registers'
    class      = base peripheral

none17@pci0:7:8:4:	class=0x088000 rev=0x07 hdr=0x00 vendor=0x8086 device=0x208d subvendor=0x17aa subdevice=0x7800
    vendor     = 'Intel Corporation'
    device     = 'Sky Lake-E CHA Registers'
    class      = base peripheral

none18@pci0:7:8:5:	class=0x088000 rev=0x07 hdr=0x00 vendor=0x8086 device=0x208d subvendor=0x17aa subdevice=0x7800
    vendor     = 'Intel Corporation'
    device     = 'Sky Lake-E CHA Registers'
    class      = base peripheral

none19@pci0:7:8:6:	class=0x088000 rev=0x07 hdr=0x00 vendor=0x8086 device=0x208d subvendor=0x17aa subdevice=0x7800
    vendor     = 'Intel Corporation'
    device     = 'Sky Lake-E CHA Registers'
    class      = base peripheral

none20@pci0:7:8:7:	class=0x088000 rev=0x07 hdr=0x00 vendor=0x8086 device=0x208d subvendor=0x17aa subdevice=0x7800
    vendor     = 'Intel Corporation'
    device     = 'Sky Lake-E CHA Registers'
    class      = base peripheral

none21@pci0:7:9:0:	class=0x088000 rev=0x07 hdr=0x00 vendor=0x8086 device=0x208d subvendor=0x17aa subdevice=0x7800
    vendor     = 'Intel Corporation'
    device     = 'Sky Lake-E CHA Registers'
    class      = base peripheral

none22@pci0:7:9:1:	class=0x088000 rev=0x07 hdr=0x00 vendor=0x8086 device=0x208d subvendor=0x17aa subdevice=0x7800
    vendor     = 'Intel Corporation'
    device     = 'Sky Lake-E CHA Registers'
    class      = base peripheral

none23@pci0:7:9:2:	class=0x088000 rev=0x07 hdr=0x00 vendor=0x8086 device=0x208d subvendor=0x17aa subdevice=0x7800
    vendor     = 'Intel Corporation'
    device     = 'Sky Lake-E CHA Registers'
    class      = base peripheral

none24@pci0:7:9:3:	class=0x088000 rev=0x07 hdr=0x00 vendor=0x8086 device=0x208d subvendor=0x17aa subdevice=0x7800
    vendor     = 'Intel Corporation'
    device     = 'Sky Lake-E CHA Registers'
    class      = base peripheral

none25@pci0:7:9:4:	class=0x088000 rev=0x07 hdr=0x00 vendor=0x8086 device=0x208d subvendor=0x17aa subdevice=0x7800
    vendor     = 'Intel Corporation'
    device     = 'Sky Lake-E CHA Registers'
    class      = base peripheral

none26@pci0:7:9:5:	class=0x088000 rev=0x07 hdr=0x00 vendor=0x8086 device=0x208d subvendor=0x17aa subdevice=0x7800
    vendor     = 'Intel Corporation'
    device     = 'Sky Lake-E CHA Registers'
    class      = base peripheral

none27@pci0:7:9:6:	class=0x088000 rev=0x07 hdr=0x00 vendor=0x8086 device=0x208d subvendor=0x17aa subdevice=0x7800
    vendor     = 'Intel Corporation'
    device     = 'Sky Lake-E CHA Registers'
    class      = base peripheral

none28@pci0:7:9:7:	class=0x088000 rev=0x07 hdr=0x00 vendor=0x8086 device=0x208d subvendor=0x17aa subdevice=0x7800
    vendor     = 'Intel Corporation'
    device     = 'Sky Lake-E CHA Registers'
    class      = base peripheral

none29@pci0:7:10:0:	class=0x088000 rev=0x07 hdr=0x00 vendor=0x8086 device=0x208d subvendor=0x17aa subdevice=0x7800
    vendor     = 'Intel Corporation'
    device     = 'Sky Lake-E CHA Registers'
    class      = base peripheral

none30@pci0:7:10:1:	class=0x088000 rev=0x07 hdr=0x00 vendor=0x8086 device=0x208d subvendor=0x17aa subdevice=0x7800
    vendor     = 'Intel Corporation'
    device     = 'Sky Lake-E CHA Registers'
    class      = base peripheral

none31@pci0:7:10:2:	class=0x088000 rev=0x07 hdr=0x00 vendor=0x8086 device=0x208d subvendor=0x17aa subdevice=0x7800
    vendor     = 'Intel Corporation'
    device     = 'Sky Lake-E CHA Registers'
    class      = base peripheral

none32@pci0:7:10:3:	class=0x088000 rev=0x07 hdr=0x00 vendor=0x8086 device=0x208d subvendor=0x17aa subdevice=0x7800
    vendor     = 'Intel Corporation'
    device     = 'Sky Lake-E CHA Registers'
    class      = base peripheral

none33@pci0:7:10:4:	class=0x088000 rev=0x07 hdr=0x00 vendor=0x8086 device=0x208d subvendor=0x17aa subdevice=0x7800
    vendor     = 'Intel Corporation'
    device     = 'Sky Lake-E CHA Registers'
    class      = base peripheral

none34@pci0:7:10:5:	class=0x088000 rev=0x07 hdr=0x00 vendor=0x8086 device=0x208d subvendor=0x17aa subdevice=0x7800
    vendor     = 'Intel Corporation'
    device     = 'Sky Lake-E CHA Registers'
    class      = base peripheral

none35@pci0:7:10:6:	class=0x088000 rev=0x07 hdr=0x00 vendor=0x8086 device=0x208d subvendor=0x17aa subdevice=0x7800
    vendor     = 'Intel Corporation'
    device     = 'Sky Lake-E CHA Registers'
    class      = base peripheral

none36@pci0:7:10:7:	class=0x088000 rev=0x07 hdr=0x00 vendor=0x8086 device=0x208d subvendor=0x17aa subdevice=0x7800
    vendor     = 'Intel Corporation'
    device     = 'Sky Lake-E CHA Registers'
    class      = base peripheral

none37@pci0:7:11:0:	class=0x088000 rev=0x07 hdr=0x00 vendor=0x8086 device=0x208d subvendor=0x17aa subdevice=0x7800
    vendor     = 'Intel Corporation'
    device     = 'Sky Lake-E CHA Registers'
    class      = base peripheral

none38@pci0:7:11:1:	class=0x088000 rev=0x07 hdr=0x00 vendor=0x8086 device=0x208d subvendor=0x17aa subdevice=0x7800
    vendor     = 'Intel Corporation'
    device     = 'Sky Lake-E CHA Registers'
    class      = base peripheral

none39@pci0:7:11:2:	class=0x088000 rev=0x07 hdr=0x00 vendor=0x8086 device=0x208d subvendor=0x17aa subdevice=0x7800
    vendor     = 'Intel Corporation'
    device     = 'Sky Lake-E CHA Registers'
    class      = base peripheral

none40@pci0:7:11:3:	class=0x088000 rev=0x07 hdr=0x00 vendor=0x8086 device=0x208d subvendor=0x17aa subdevice=0x7800
    vendor     = 'Intel Corporation'
    device     = 'Sky Lake-E CHA Registers'
    class      = base peripheral

none41@pci0:7:14:0:	class=0x088000 rev=0x07 hdr=0x00 vendor=0x8086 device=0x208e subvendor=0x17aa subdevice=0x7800
    vendor     = 'Intel Corporation'
    device     = 'Sky Lake-E CHA Registers'
    class      = base peripheral

none42@pci0:7:14:1:	class=0x088000 rev=0x07 hdr=0x00 vendor=0x8086 device=0x208e subvendor=0x17aa subdevice=0x7800
    vendor     = 'Intel Corporation'
    device     = 'Sky Lake-E CHA Registers'
    class      = base peripheral

none43@pci0:7:14:2:	class=0x088000 rev=0x07 hdr=0x00 vendor=0x8086 device=0x208e subvendor=0x17aa subdevice=0x7800
    vendor     = 'Intel Corporation'
    device     = 'Sky Lake-E CHA Registers'
    class      = base peripheral

none44@pci0:7:14:3:	class=0x088000 rev=0x07 hdr=0x00 vendor=0x8086 device=0x208e subvendor=0x17aa subdevice=0x7800
    vendor     = 'Intel Corporation'
    device     = 'Sky Lake-E CHA Registers'
    class      = base peripheral

none45@pci0:7:14:4:	class=0x088000 rev=0x07 hdr=0x00 vendor=0x8086 device=0x208e subvendor=0x17aa subdevice=0x7800
    vendor     = 'Intel Corporation'
    device     = 'Sky Lake-E CHA Registers'
    class      = base peripheral

none46@pci0:7:14:5:	class=0x088000 rev=0x07 hdr=0x00 vendor=0x8086 device=0x208e subvendor=0x17aa subdevice=0x7800
    vendor     = 'Intel Corporation'
    device     = 'Sky Lake-E CHA Registers'
    class      = base peripheral

none47@pci0:7:14:6:	class=0x088000 rev=0x07 hdr=0x00 vendor=0x8086 device=0x208e subvendor=0x17aa subdevice=0x7800
    vendor     = 'Intel Corporation'
    device     = 'Sky Lake-E CHA Registers'
    class      = base peripheral

none48@pci0:7:14:7:	class=0x088000 rev=0x07 hdr=0x00 vendor=0x8086 device=0x208e subvendor=0x17aa subdevice=0x7800
    vendor     = 'Intel Corporation'
    device     = 'Sky Lake-E CHA Registers'
    class      = base peripheral

none49@pci0:7:15:0:	class=0x088000 rev=0x07 hdr=0x00 vendor=0x8086 device=0x208e subvendor=0x17aa subdevice=0x7800
    vendor     = 'Intel Corporation'
    device     = 'Sky Lake-E CHA Registers'
    class      = base peripheral

none50@pci0:7:15:1:	class=0x088000 rev=0x07 hdr=0x00 vendor=0x8086 device=0x208e subvendor=0x17aa subdevice=0x7800
    vendor     = 'Intel Corporation'
    device     = 'Sky Lake-E CHA Registers'
    class      = base peripheral

none51@pci0:7:15:2:	class=0x088000 rev=0x07 hdr=0x00 vendor=0x8086 device=0x208e subvendor=0x17aa subdevice=0x7800
    vendor     = 'Intel Corporation'
    device     = 'Sky Lake-E CHA Registers'
    class      = base peripheral

none52@pci0:7:15:3:	class=0x088000 rev=0x07 hdr=0x00 vendor=0x8086 device=0x208e subvendor=0x17aa subdevice=0x7800
    vendor     = 'Intel Corporation'
    device     = 'Sky Lake-E CHA Registers'
    class      = base peripheral

none53@pci0:7:15:4:	class=0x088000 rev=0x07 hdr=0x00 vendor=0x8086 device=0x208e subvendor=0x17aa subdevice=0x7800
    vendor     = 'Intel Corporation'
    device     = 'Sky Lake-E CHA Registers'
    class      = base peripheral

none54@pci0:7:15:5:	class=0x088000 rev=0x07 hdr=0x00 vendor=0x8086 device=0x208e subvendor=0x17aa subdevice=0x7800
    vendor     = 'Intel Corporation'
    device     = 'Sky Lake-E CHA Registers'
    class      = base peripheral

none55@pci0:7:15:6:	class=0x088000 rev=0x07 hdr=0x00 vendor=0x8086 device=0x208e subvendor=0x17aa subdevice=0x7800
    vendor     = 'Intel Corporation'
    device     = 'Sky Lake-E CHA Registers'
    class      = base peripheral

none56@pci0:7:15:7:	class=0x088000 rev=0x07 hdr=0x00 vendor=0x8086 device=0x208e subvendor=0x17aa subdevice=0x7800
    vendor     = 'Intel Corporation'
    device     = 'Sky Lake-E CHA Registers'
    class      = base peripheral

none57@pci0:7:16:0:	class=0x088000 rev=0x07 hdr=0x00 vendor=0x8086 device=0x208e subvendor=0x17aa subdevice=0x7800
    vendor     = 'Intel Corporation'
    device     = 'Sky Lake-E CHA Registers'
    class      = base peripheral

none58@pci0:7:16:1:	class=0x088000 rev=0x07 hdr=0x00 vendor=0x8086 device=0x208e subvendor=0x17aa subdevice=0x7800
    vendor     = 'Intel Corporation'
    device     = 'Sky Lake-E CHA Registers'
    class      = base peripheral

none59@pci0:7:16:2:	class=0x088000 rev=0x07 hdr=0x00 vendor=0x8086 device=0x208e subvendor=0x17aa subdevice=0x7800
    vendor     = 'Intel Corporation'
    device     = 'Sky Lake-E CHA Registers'
    class      = base peripheral

none60@pci0:7:16:3:	class=0x088000 rev=0x07 hdr=0x00 vendor=0x8086 device=0x208e subvendor=0x17aa subdevice=0x7800
    vendor     = 'Intel Corporation'
    device     = 'Sky Lake-E CHA Registers'
    class      = base peripheral

none61@pci0:7:16:4:	class=0x088000 rev=0x07 hdr=0x00 vendor=0x8086 device=0x208e subvendor=0x17aa subdevice=0x7800
    vendor     = 'Intel Corporation'
    device     = 'Sky Lake-E CHA Registers'
    class      = base peripheral

none62@pci0:7:16:5:	class=0x088000 rev=0x07 hdr=0x00 vendor=0x8086 device=0x208e subvendor=0x17aa subdevice=0x7800
    vendor     = 'Intel Corporation'
    device     = 'Sky Lake-E CHA Registers'
    class      = base peripheral

none63@pci0:7:16:6:	class=0x088000 rev=0x07 hdr=0x00 vendor=0x8086 device=0x208e subvendor=0x17aa subdevice=0x7800
    vendor     = 'Intel Corporation'
    device     = 'Sky Lake-E CHA Registers'
    class      = base peripheral

none64@pci0:7:16:7:	class=0x088000 rev=0x07 hdr=0x00 vendor=0x8086 device=0x208e subvendor=0x17aa subdevice=0x7800
    vendor     = 'Intel Corporation'
    device     = 'Sky Lake-E CHA Registers'
    class      = base peripheral

none65@pci0:7:17:0:	class=0x088000 rev=0x07 hdr=0x00 vendor=0x8086 device=0x208e subvendor=0x17aa subdevice=0x7800
    vendor     = 'Intel Corporation'
    device     = 'Sky Lake-E CHA Registers'
    class      = base peripheral

none66@pci0:7:17:1:	class=0x088000 rev=0x07 hdr=0x00 vendor=0x8086 device=0x208e subvendor=0x17aa subdevice=0x7800
    vendor     = 'Intel Corporation'
    device     = 'Sky Lake-E CHA Registers'
    class      = base peripheral

none67@pci0:7:17:2:	class=0x088000 rev=0x07 hdr=0x00 vendor=0x8086 device=0x208e subvendor=0x17aa subdevice=0x7800
    vendor     = 'Intel Corporation'
    device     = 'Sky Lake-E CHA Registers'
    class      = base peripheral

none68@pci0:7:17:3:	class=0x088000 rev=0x07 hdr=0x00 vendor=0x8086 device=0x208e subvendor=0x17aa subdevice=0x7800
    vendor     = 'Intel Corporation'
    device     = 'Sky Lake-E CHA Registers'
    class      = base peripheral

none69@pci0:7:29:0:	class=0x088000 rev=0x07 hdr=0x00 vendor=0x8086 device=0x2054 subvendor=0x17aa subdevice=0x7800
    vendor     = 'Intel Corporation'
    device     = 'Sky Lake-E CHA Registers'
    class      = base peripheral

none70@pci0:7:29:1:	class=0x088000 rev=0x07 hdr=0x00 vendor=0x8086 device=0x2055 subvendor=0x17aa subdevice=0x7800
    vendor     = 'Intel Corporation'
    device     = 'Sky Lake-E CHA Registers'
    class      = base peripheral

none71@pci0:7:29:2:	class=0x088000 rev=0x07 hdr=0x00 vendor=0x8086 device=0x2056 subvendor=0x17aa subdevice=0x7800
    vendor     = 'Intel Corporation'
    device     = 'Sky Lake-E CHA Registers'
    class      = base peripheral

none72@pci0:7:29:3:	class=0x088000 rev=0x07 hdr=0x00 vendor=0x8086 device=0x2057 subvendor=0x17aa subdevice=0x7800
    vendor     = 'Intel Corporation'
    device     = 'Sky Lake-E CHA Registers'
    class      = base peripheral

none73@pci0:7:30:0:	class=0x088000 rev=0x07 hdr=0x00 vendor=0x8086 device=0x2080 subvendor=0x17aa subdevice=0x7800
    vendor     = 'Intel Corporation'
    device     = 'Sky Lake-E PCU Registers'
    class      = base peripheral

none74@pci0:7:30:1:	class=0x088000 rev=0x07 hdr=0x00 vendor=0x8086 device=0x2081 subvendor=0x17aa subdevice=0x7800
    vendor     = 'Intel Corporation'
    device     = 'Sky Lake-E PCU Registers'
    class      = base peripheral

none75@pci0:7:30:2:	class=0x088000 rev=0x07 hdr=0x00 vendor=0x8086 device=0x2082 subvendor=0x17aa subdevice=0x7800
    vendor     = 'Intel Corporation'
    device     = 'Sky Lake-E PCU Registers'
    class      = base peripheral

none76@pci0:7:30:3:	class=0x088000 rev=0x07 hdr=0x00 vendor=0x8086 device=0x2083 subvendor=0x17aa subdevice=0x7800
    vendor     = 'Intel Corporation'
    device     = 'Sky Lake-E PCU Registers'
    class      = base peripheral

none77@pci0:7:30:4:	class=0x088000 rev=0x07 hdr=0x00 vendor=0x8086 device=0x2084 subvendor=0x17aa subdevice=0x7800
    vendor     = 'Intel Corporation'
    device     = 'Sky Lake-E PCU Registers'
    class      = base peripheral

none78@pci0:7:30:5:	class=0x088000 rev=0x07 hdr=0x00 vendor=0x8086 device=0x2085 subvendor=0x17aa subdevice=0x7800
    vendor     = 'Intel Corporation'
    device     = 'Sky Lake-E PCU Registers'
    class      = base peripheral

none79@pci0:7:30:6:	class=0x088000 rev=0x07 hdr=0x00 vendor=0x8086 device=0x2086 subvendor=0x17aa subdevice=0x7800
    vendor     = 'Intel Corporation'
    device     = 'Sky Lake-E PCU Registers'
    class      = base peripheral

pcib5@pci0:8:0:0:	class=0x060400 rev=0x09 hdr=0x01 vendor=0x8086 device=0x37c0 subvendor=0xbeef subdevice=0xdead
    vendor     = 'Intel Corporation'
    class      = bridge
    subclass   = PCI-PCI
    bar   [10] = type Memory, range 64, base 0xe3e00000, size 131072, enabled
    cap 10[40] = PCI-Express 2 upstream port max data 256(512)
                 max read 512
                 link x8(x16) speed 8.0(8.0) ASPM disabled(L1)
    cap 01[80] = powerspec 3  supports D0 D3  current D0
    cap 0d[88] = PCI Bridge subvendor=0xbeef subdevice=0xdead
    ecap 0001[100] = AER 1 0 fatal 0 non-fatal 1 corrected
    ecap 0019[200] = PCIe Sec 1 lane errors 0

pcib6@pci0:9:3:0:	class=0x060400 rev=0x09 hdr=0x01 vendor=0x8086 device=0x37c5 subvendor=0xbeef subdevice=0xdead
    vendor     = 'Intel Corporation'
    class      = bridge
    subclass   = PCI-PCI
    cap 10[40] = PCI-Express 2 downstream port max data 256(512) ARI enabled
                 max read 128
                 link x1(x1) speed 2.5(2.5) ASPM disabled(L0s/L1)
    cap 01[80] = powerspec 3  supports D0 D3  current D0
    cap 0d[88] = PCI Bridge subvendor=0xbeef subdevice=0xdead
    ecap 0001[100] = AER 1 0 fatal 0 non-fatal 0 corrected
    ecap 000d[138] = ACS 1

ixl0@pci0:10:0:0:	class=0x020000 rev=0x09 hdr=0x00 vendor=0x8086 device=0x37d2 subvendor=0x17aa subdevice=0x4021
    vendor     = 'Intel Corporation'
    device     = 'Ethernet Connection X722 for 10GBASE-T'
    class      = network
    subclass   = ethernet
    bar   [10] = type Prefetchable Memory, range 64, base 0x21ffe000000, size 16777216, enabled
    bar   [1c] = type Prefetchable Memory, range 64, base 0x21fff808000, size 32768, enabled
    cap 01[40] = powerspec 3  supports D0 D3  current D0
    cap 05[50] = MSI supports 1 message, 64 bit, vector masks 
    cap 11[70] = MSI-X supports 129 messages, enabled
                 Table in map 0x1c[0x0], PBA in map 0x1c[0x1000]
    cap 10[a0] = PCI-Express 2 endpoint max data 256(512) FLR RO
                 max read 4096
                 link x1(x1) speed 2.5(2.5) ASPM disabled(L0s/L1)
    cap 03[e0] = VPD
    ecap 0001[100] = AER 2 0 fatal 0 non-fatal 1 corrected
    ecap 000e[150] = ARI 1
    ecap 0010[160] = SR-IOV 1 IOV disabled, Memory Space disabled, ARI enabled
                     0 VFs configured out of 32 supported
                     First VF RID Offset 0x0010, VF RID Stride 0x0001
                     VF Device ID 0x37cd
                     Page Sizes: 4096 (enabled), 8192, 65536, 262144, 1048576, 4194304
    ecap 0017[1a0] = TPH Requester 1
    ecap 000d[1b0] = ACS 1

ixl1@pci0:10:0:1:	class=0x020000 rev=0x09 hdr=0x00 vendor=0x8086 device=0x37d2 subvendor=0x17aa subdevice=0x4021
    vendor     = 'Intel Corporation'
    device     = 'Ethernet Connection X722 for 10GBASE-T'
    class      = network
    subclass   = ethernet
    bar   [10] = type Prefetchable Memory, range 64, base 0x21ffd000000, size 16777216, enabled
    bar   [1c] = type Prefetchable Memory, range 64, base 0x21fff800000, size 32768, enabled
    cap 01[40] = powerspec 3  supports D0 D3  current D0
    cap 05[50] = MSI supports 1 message, 64 bit, vector masks 
    cap 11[70] = MSI-X supports 129 messages, enabled
                 Table in map 0x1c[0x0], PBA in map 0x1c[0x1000]
    cap 10[a0] = PCI-Express 2 endpoint max data 256(512) FLR RO
                 max read 4096
                 link x1(x1) speed 2.5(2.5) ASPM disabled(L0s/L1)
    cap 03[e0] = VPD
    ecap 0001[100] = AER 2 0 fatal 0 non-fatal 1 corrected
    ecap 000e[150] = ARI 1
    ecap 0010[160] = SR-IOV 1 IOV disabled, Memory Space disabled, ARI disabled
                     0 VFs configured out of 32 supported
                     First VF RID Offset 0x002f, VF RID Stride 0x0001
                     VF Device ID 0x37cd
                     Page Sizes: 4096 (enabled), 8192, 65536, 262144, 1048576, 4194304
    ecap 0017[1a0] = TPH Requester 1
    ecap 000d[1b0] = ACS 1

none80@pci0:90:5:0:	class=0x088000 rev=0x07 hdr=0x00 vendor=0x8086 device=0x2034 subvendor=0x17aa subdevice=0x7800
    vendor     = 'Intel Corporation'
    device     = 'Sky Lake-E VT-d'
    class      = base peripheral
    cap 10[40] = PCI-Express 2 root endpoint max data 128(128)
                 max read 128

none81@pci0:90:5:2:	class=0x088000 rev=0x07 hdr=0x00 vendor=0x8086 device=0x2035 subvendor=0x17aa subdevice=0x7800
    vendor     = 'Intel Corporation'
    device     = 'Sky Lake-E RAS Configuration Registers'
    class      = base peripheral
    cap 10[40] = PCI-Express 2 root endpoint max data 128(128)
                 max read 128

ioapic2@pci0:90:5:4:	class=0x080020 rev=0x07 hdr=0x00 vendor=0x8086 device=0x2036 subvendor=0x17aa subdevice=0x7800
    vendor     = 'Intel Corporation'
    device     = 'Sky Lake-E IOxAPIC Configuration Registers'
    class      = base peripheral
    subclass   = interrupt controller
    bar   [10] = type Memory, range 32, base 0xedf00000, size 4096, enabled
    cap 10[44] = PCI-Express 1 root endpoint max data 128(128)
                 max read 128
    cap 01[e0] = powerspec 3  supports D0 D3  current D0

none82@pci0:90:8:0:	class=0x088000 rev=0x07 hdr=0x00 vendor=0x8086 device=0x2066 subvendor=0x17aa subdevice=0x7800
    vendor     = 'Intel Corporation'
    device     = 'Sky Lake-E Integrated Memory Controller'
    class      = base peripheral
    cap 10[40] = PCI-Express 1 root endpoint max data 128(128)
                 max read 128

none83@pci0:90:9:0:	class=0x088000 rev=0x07 hdr=0x00 vendor=0x8086 device=0x2066 subvendor=0x17aa subdevice=0x7800
    vendor     = 'Intel Corporation'
    device     = 'Sky Lake-E Integrated Memory Controller'
    class      = base peripheral
    cap 10[40] = PCI-Express 1 root endpoint max data 128(128)
                 max read 128

none84@pci0:90:10:0:	class=0x088000 rev=0x07 hdr=0x00 vendor=0x8086 device=0x2040 subvendor=0x17aa subdevice=0x7800
    vendor     = 'Intel Corporation'
    device     = 'Sky Lake-E Integrated Memory Controller'
    class      = base peripheral
    cap 10[40] = PCI-Express 1 root endpoint max data 128(128)
                 max read 128

none85@pci0:90:10:1:	class=0x088000 rev=0x07 hdr=0x00 vendor=0x8086 device=0x2041 subvendor=0x17aa subdevice=0x7800
    vendor     = 'Intel Corporation'
    device     = 'Sky Lake-E Integrated Memory Controller'
    class      = base peripheral
    cap 10[40] = PCI-Express 1 root endpoint max data 128(128)
                 max read 128

none86@pci0:90:10:2:	class=0x088000 rev=0x07 hdr=0x00 vendor=0x8086 device=0x2042 subvendor=0x17aa subdevice=0x7800
    vendor     = 'Intel Corporation'
    device     = 'Sky Lake-E Integrated Memory Controller'
    class      = base peripheral
    cap 10[40] = PCI-Express 1 root endpoint max data 128(128)
                 max read 128

none87@pci0:90:10:3:	class=0x088000 rev=0x07 hdr=0x00 vendor=0x8086 device=0x2043 subvendor=0x17aa subdevice=0x7800
    vendor     = 'Intel Corporation'
    device     = 'Sky Lake-E Integrated Memory Controller'
    class      = base peripheral
    cap 10[40] = PCI-Express 1 root endpoint max data 128(128)
                 max read 128

none88@pci0:90:10:4:	class=0x088000 rev=0x07 hdr=0x00 vendor=0x8086 device=0x2044 subvendor=0x17aa subdevice=0x7800
    vendor     = 'Intel Corporation'
    device     = 'Sky Lake-E Integrated Memory Controller'
    class      = base peripheral
    cap 10[40] = PCI-Express 1 root endpoint max data 128(128)
                 max read 128

none89@pci0:90:10:5:	class=0x088000 rev=0x07 hdr=0x00 vendor=0x8086 device=0x2045 subvendor=0x17aa subdevice=0x7800
    vendor     = 'Intel Corporation'
    device     = 'Sky Lake-E LM Channel 1'
    class      = base peripheral
    cap 10[40] = PCI-Express 1 root endpoint max data 128(128)
                 max read 128

none90@pci0:90:10:6:	class=0x088000 rev=0x07 hdr=0x00 vendor=0x8086 device=0x2046 subvendor=0x17aa subdevice=0x7800
    vendor     = 'Intel Corporation'
    device     = 'Sky Lake-E LMS Channel 1'
    class      = base peripheral
    cap 10[40] = PCI-Express 1 root endpoint max data 128(128)
                 max read 128

none91@pci0:90:10:7:	class=0x088000 rev=0x07 hdr=0x00 vendor=0x8086 device=0x2047 subvendor=0x17aa subdevice=0x7800
    vendor     = 'Intel Corporation'
    device     = 'Sky Lake-E LMDP Channel 1'
    class      = base peripheral
    cap 10[40] = PCI-Express 1 root endpoint max data 128(128)
                 max read 128

none92@pci0:90:11:0:	class=0x088000 rev=0x07 hdr=0x00 vendor=0x8086 device=0x2048 subvendor=0x17aa subdevice=0x7800
    vendor     = 'Intel Corporation'
    device     = 'Sky Lake-E DECS Channel 2'
    class      = base peripheral
    cap 10[40] = PCI-Express 1 root endpoint max data 128(128)
                 max read 128

none93@pci0:90:11:1:	class=0x088000 rev=0x07 hdr=0x00 vendor=0x8086 device=0x2049 subvendor=0x17aa subdevice=0x7800
    vendor     = 'Intel Corporation'
    device     = 'Sky Lake-E LM Channel 2'
    class      = base peripheral
    cap 10[40] = PCI-Express 1 root endpoint max data 128(128)
                 max read 128

none94@pci0:90:11:2:	class=0x088000 rev=0x07 hdr=0x00 vendor=0x8086 device=0x204a subvendor=0x17aa subdevice=0x7800
    vendor     = 'Intel Corporation'
    device     = 'Sky Lake-E LMS Channel 2'
    class      = base peripheral
    cap 10[40] = PCI-Express 1 root endpoint max data 128(128)
                 max read 128

none95@pci0:90:11:3:	class=0x088000 rev=0x07 hdr=0x00 vendor=0x8086 device=0x204b subvendor=0x17aa subdevice=0x7800
    vendor     = 'Intel Corporation'
    device     = 'Sky Lake-E LMDP Channel 2'
    class      = base peripheral
    cap 10[40] = PCI-Express 1 root endpoint max data 128(128)
                 max read 128

none96@pci0:90:12:0:	class=0x088000 rev=0x07 hdr=0x00 vendor=0x8086 device=0x2040 subvendor=0x17aa subdevice=0x7800
    vendor     = 'Intel Corporation'
    device     = 'Sky Lake-E Integrated Memory Controller'
    class      = base peripheral
    cap 10[40] = PCI-Express 1 root endpoint max data 128(128)
                 max read 128

none97@pci0:90:12:1:	class=0x088000 rev=0x07 hdr=0x00 vendor=0x8086 device=0x2041 subvendor=0x17aa subdevice=0x7800
    vendor     = 'Intel Corporation'
    device     = 'Sky Lake-E Integrated Memory Controller'
    class      = base peripheral
    cap 10[40] = PCI-Express 1 root endpoint max data 128(128)
                 max read 128

none98@pci0:90:12:2:	class=0x088000 rev=0x07 hdr=0x00 vendor=0x8086 device=0x2042 subvendor=0x17aa subdevice=0x7800
    vendor     = 'Intel Corporation'
    device     = 'Sky Lake-E Integrated Memory Controller'
    class      = base peripheral
    cap 10[40] = PCI-Express 1 root endpoint max data 128(128)
                 max read 128

none99@pci0:90:12:3:	class=0x088000 rev=0x07 hdr=0x00 vendor=0x8086 device=0x2043 subvendor=0x17aa subdevice=0x7800
    vendor     = 'Intel Corporation'
    device     = 'Sky Lake-E Integrated Memory Controller'
    class      = base peripheral
    cap 10[40] = PCI-Express 1 root endpoint max data 128(128)
                 max read 128

none100@pci0:90:12:4:	class=0x088000 rev=0x07 hdr=0x00 vendor=0x8086 device=0x2044 subvendor=0x17aa subdevice=0x7800
    vendor     = 'Intel Corporation'
    device     = 'Sky Lake-E Integrated Memory Controller'
    class      = base peripheral
    cap 10[40] = PCI-Express 1 root endpoint max data 128(128)
                 max read 128

none101@pci0:90:12:5:	class=0x088000 rev=0x07 hdr=0x00 vendor=0x8086 device=0x2045 subvendor=0x17aa subdevice=0x7800
    vendor     = 'Intel Corporation'
    device     = 'Sky Lake-E LM Channel 1'
    class      = base peripheral
    cap 10[40] = PCI-Express 1 root endpoint max data 128(128)
                 max read 128

none102@pci0:90:12:6:	class=0x088000 rev=0x07 hdr=0x00 vendor=0x8086 device=0x2046 subvendor=0x17aa subdevice=0x7800
    vendor     = 'Intel Corporation'
    device     = 'Sky Lake-E LMS Channel 1'
    class      = base peripheral
    cap 10[40] = PCI-Express 1 root endpoint max data 128(128)
                 max read 128

none103@pci0:90:12:7:	class=0x088000 rev=0x07 hdr=0x00 vendor=0x8086 device=0x2047 subvendor=0x17aa subdevice=0x7800
    vendor     = 'Intel Corporation'
    device     = 'Sky Lake-E LMDP Channel 1'
    class      = base peripheral
    cap 10[40] = PCI-Express 1 root endpoint max data 128(128)
                 max read 128

none104@pci0:90:13:0:	class=0x088000 rev=0x07 hdr=0x00 vendor=0x8086 device=0x2048 subvendor=0x17aa subdevice=0x7800
    vendor     = 'Intel Corporation'
    device     = 'Sky Lake-E DECS Channel 2'
    class      = base peripheral
    cap 10[40] = PCI-Express 1 root endpoint max data 128(128)
                 max read 128

none105@pci0:90:13:1:	class=0x088000 rev=0x07 hdr=0x00 vendor=0x8086 device=0x2049 subvendor=0x17aa subdevice=0x7800
    vendor     = 'Intel Corporation'
    device     = 'Sky Lake-E LM Channel 2'
    class      = base peripheral
    cap 10[40] = PCI-Express 1 root endpoint max data 128(128)
                 max read 128

none106@pci0:90:13:2:	class=0x088000 rev=0x07 hdr=0x00 vendor=0x8086 device=0x204a subvendor=0x17aa subdevice=0x7800
    vendor     = 'Intel Corporation'
    device     = 'Sky Lake-E LMS Channel 2'
    class      = base peripheral
    cap 10[40] = PCI-Express 1 root endpoint max data 128(128)
                 max read 128

none107@pci0:90:13:3:	class=0x088000 rev=0x07 hdr=0x00 vendor=0x8086 device=0x204b subvendor=0x17aa subdevice=0x7800
    vendor     = 'Intel Corporation'
    device     = 'Sky Lake-E LMDP Channel 2'
    class      = base peripheral
    cap 10[40] = PCI-Express 1 root endpoint max data 128(128)
                 max read 128

pcib9@pci0:173:2:0:	class=0x060400 rev=0x07 hdr=0x01 vendor=0x8086 device=0x2032 subvendor=0x17aa subdevice=0x7800
    vendor     = 'Intel Corporation'
    device     = 'Sky Lake-E PCI Express Root Port C'
    class      = bridge
    subclass   = PCI-PCI
    cap 0d[40] = PCI Bridge subvendor=0x17aa subdevice=0x7800
    cap 05[60] = MSI supports 2 messages, vector masks 
    cap 10[90] = PCI-Express 2 root port max data 256(256) ARI enabled
                 max read 128
                 link x8(x8) speed 8.0(8.0) ASPM disabled(L1)
                 slot 7 power limit 0 mW
    cap 01[e0] = powerspec 3  supports D0 D3  current D0
    ecap 000b[100] = Vendor [1] ID 0002 Rev 0 Length 12
    ecap 000d[110] = ACS 1
    ecap 0001[148] = AER 1 0 fatal 0 non-fatal 0 corrected
    ecap 000b[1d0] = Vendor [1] ID 0003 Rev 1 Length 10
    ecap 0019[250] = PCIe Sec 1 lane errors 0
    ecap 000b[280] = Vendor [1] ID 0005 Rev 3 Length 24
    ecap 000b[298] = Vendor [1] ID 0007 Rev 0 Length 36
    ecap 000b[300] = Vendor [1] ID 0008 Rev 0 Length 56

none108@pci0:173:5:0:	class=0x088000 rev=0x07 hdr=0x00 vendor=0x8086 device=0x2034 subvendor=0x17aa subdevice=0x7800
    vendor     = 'Intel Corporation'
    device     = 'Sky Lake-E VT-d'
    class      = base peripheral
    cap 10[40] = PCI-Express 2 root endpoint max data 128(128)
                 max read 128

none109@pci0:173:5:2:	class=0x088000 rev=0x07 hdr=0x00 vendor=0x8086 device=0x2035 subvendor=0x17aa subdevice=0x7800
    vendor     = 'Intel Corporation'
    device     = 'Sky Lake-E RAS Configuration Registers'
    class      = base peripheral
    cap 10[40] = PCI-Express 2 root endpoint max data 128(128)
                 max read 128

ioapic3@pci0:173:5:4:	class=0x080020 rev=0x07 hdr=0x00 vendor=0x8086 device=0x2036 subvendor=0x17aa subdevice=0x7800
    vendor     = 'Intel Corporation'
    device     = 'Sky Lake-E IOxAPIC Configuration Registers'
    class      = base peripheral
    subclass   = interrupt controller
    bar   [10] = type Memory, range 32, base 0xf7f00000, size 4096, enabled
    cap 10[44] = PCI-Express 1 root endpoint max data 128(128)
                 max read 128
    cap 01[e0] = powerspec 3  supports D0 D3  current D0

none110@pci0:173:14:0:	class=0x110100 rev=0x07 hdr=0x00 vendor=0x8086 device=0x2058 subvendor=0x17aa subdevice=0x7800
    vendor     = 'Intel Corporation'
    device     = 'Sky Lake-E KTI 0'
    class      = dasp
    subclass   = performance counters
    cap 10[40] = PCI-Express 2 root endpoint max data 128(128)
                 max read 128

none111@pci0:173:14:1:	class=0x088000 rev=0x07 hdr=0x00 vendor=0x8086 device=0x2059 subvendor=0x17aa subdevice=0x7800
    vendor     = 'Intel Corporation'
    device     = 'Sky Lake-E UPI Registers'
    class      = base peripheral
    cap 10[40] = PCI-Express 2 root endpoint max data 128(128)
                 max read 128
    ecap 000b[100] = Vendor [0] ID 0001 Rev 0 Length 240

none112@pci0:173:15:0:	class=0x110100 rev=0x07 hdr=0x00 vendor=0x8086 device=0x2058 subvendor=0x17aa subdevice=0x7800
    vendor     = 'Intel Corporation'
    device     = 'Sky Lake-E KTI 0'
    class      = dasp
    subclass   = performance counters
    cap 10[40] = PCI-Express 2 root endpoint max data 128(128)
                 max read 128

none113@pci0:173:15:1:	class=0x088000 rev=0x07 hdr=0x00 vendor=0x8086 device=0x2059 subvendor=0x17aa subdevice=0x7800
    vendor     = 'Intel Corporation'
    device     = 'Sky Lake-E UPI Registers'
    class      = base peripheral
    cap 10[40] = PCI-Express 2 root endpoint max data 128(128)
                 max read 128
    ecap 000b[100] = Vendor [0] ID 0001 Rev 0 Length 240

none114@pci0:173:16:0:	class=0x110100 rev=0x07 hdr=0x00 vendor=0x8086 device=0x2058 subvendor=0x0000 subdevice=0x0000
    vendor     = 'Intel Corporation'
    device     = 'Sky Lake-E KTI 0'
    class      = dasp
    subclass   = performance counters
    cap 00[40] = unknown

none115@pci0:173:16:1:	class=0x088000 rev=0x07 hdr=0x00 vendor=0x8086 device=0x2059 subvendor=0x0000 subdevice=0x0000
    vendor     = 'Intel Corporation'
    device     = 'Sky Lake-E UPI Registers'
    class      = base peripheral
    cap 00[40] = unknown

none116@pci0:173:18:0:	class=0x110100 rev=0x07 hdr=0x00 vendor=0x8086 device=0x204c subvendor=0x17aa subdevice=0x7800
    vendor     = 'Intel Corporation'
    device     = 'Sky Lake-E M3KTI Registers'
    class      = dasp
    subclass   = performance counters
    cap 10[40] = PCI-Express 2 root endpoint max data 128(128)
                 max read 128

none117@pci0:173:18:1:	class=0x110100 rev=0x07 hdr=0x00 vendor=0x8086 device=0x204d subvendor=0x17aa subdevice=0x7800
    vendor     = 'Intel Corporation'
    device     = 'Sky Lake-E M3KTI Registers'
    class      = dasp
    subclass   = performance counters

none118@pci0:173:18:2:	class=0x088000 rev=0x07 hdr=0x00 vendor=0x8086 device=0x204e subvendor=0x17aa subdevice=0x7800
    vendor     = 'Intel Corporation'
    device     = 'Sky Lake-E M3KTI Registers'
    class      = base peripheral

none119@pci0:173:18:4:	class=0x110100 rev=0x07 hdr=0x00 vendor=0x8086 device=0x204c subvendor=0x17aa subdevice=0x7800
    vendor     = 'Intel Corporation'
    device     = 'Sky Lake-E M3KTI Registers'
    class      = dasp
    subclass   = performance counters
    cap 10[40] = PCI-Express 2 root endpoint max data 128(128)
                 max read 128

none120@pci0:173:18:5:	class=0x110100 rev=0x07 hdr=0x00 vendor=0x8086 device=0x204d subvendor=0x17aa subdevice=0x7800
    vendor     = 'Intel Corporation'
    device     = 'Sky Lake-E M3KTI Registers'
    class      = dasp
    subclass   = performance counters

none121@pci0:173:21:0:	class=0x088000 rev=0x07 hdr=0x00 vendor=0x8086 device=0x2018 subvendor=0x17aa subdevice=0x7800
    vendor     = 'Intel Corporation'
    device     = 'Sky Lake-E M2PCI Registers'
    class      = base peripheral

none122@pci0:173:21:1:	class=0x110100 rev=0x07 hdr=0x00 vendor=0x8086 device=0x2088 subvendor=0x17aa subdevice=0x7800
    vendor     = 'Intel Corporation'
    device     = 'Sky Lake-E DDRIO Registers'
    class      = dasp
    subclass   = performance counters

none123@pci0:173:22:0:	class=0x088000 rev=0x07 hdr=0x00 vendor=0x8086 device=0x2018 subvendor=0x17aa subdevice=0x7800
    vendor     = 'Intel Corporation'
    device     = 'Sky Lake-E M2PCI Registers'
    class      = base peripheral

none124@pci0:173:22:1:	class=0x110100 rev=0x07 hdr=0x00 vendor=0x8086 device=0x2088 subvendor=0x17aa subdevice=0x7800
    vendor     = 'Intel Corporation'
    device     = 'Sky Lake-E DDRIO Registers'
    class      = dasp
    subclass   = performance counters

none125@pci0:173:22:4:	class=0x088000 rev=0x07 hdr=0x00 vendor=0x8086 device=0x2018 subvendor=0x17aa subdevice=0x7800
    vendor     = 'Intel Corporation'
    device     = 'Sky Lake-E M2PCI Registers'
    class      = base peripheral

none126@pci0:173:22:5:	class=0x110100 rev=0x07 hdr=0x00 vendor=0x8086 device=0x2088 subvendor=0x17aa subdevice=0x7800
    vendor     = 'Intel Corporation'
    device     = 'Sky Lake-E DDRIO Registers'
    class      = dasp
    subclass   = performance counters

none127@pci0:173:23:0:	class=0x088000 rev=0x07 hdr=0x00 vendor=0x8086 device=0x2018 subvendor=0x17aa subdevice=0x7800
    vendor     = 'Intel Corporation'
    device     = 'Sky Lake-E M2PCI Registers'
    class      = base peripheral

none128@pci0:173:23:1:	class=0x110100 rev=0x07 hdr=0x00 vendor=0x8086 device=0x2088 subvendor=0x17aa subdevice=0x7800
    vendor     = 'Intel Corporation'
    device     = 'Sky Lake-E DDRIO Registers'
    class      = dasp
    subclass   = performance counters

mrsas0@pci0:174:0:0:	class=0x010400 rev=0x01 hdr=0x00 vendor=0x1000 device=0x0016 subvendor=0x1d49 subdevice=0x0601
    vendor     = 'Broadcom / LSI'
    device     = 'MegaRAID Tri-Mode SAS3508'
    class      = mass storage
    subclass   = RAID
    bar   [10] = type Prefetchable Memory, range 64, base 0x23ffff00000, size 1048576, enabled
    bar   [18] = type Prefetchable Memory, range 64, base 0x23fffe00000, size 1048576, enabled
    bar   [20] = type Memory, range 32, base 0xf7e00000, size 1048576, enabled
    bar   [24] = type I/O Port, range 32, base 0xf000, size 256, enabled
    cap 01[40] = powerspec 3  supports D0 D1 D2 D3  current D0
    cap 05[50] = MSI supports 1 message, 64 bit, vector masks 
    cap 10[70] = PCI-Express 2 endpoint max data 256(1024) FLR RO NS
                 max read 4096
                 link x8(x8) speed 8.0(8.0) ASPM disabled(L0s)
    cap 11[b0] = MSI-X supports 17 messages, enabled
                 Table in map 0x10[0x2000], PBA in map 0x10[0x4800]
    ecap 0001[100] = AER 2 0 fatal 0 non-fatal 1 corrected
    ecap 0004[148] = Power Budgeting 1
    ecap 000e[158] = ARI 1
    ecap 0019[168] = PCIe Sec 1 lane errors 0
    ecap 0016[254] = DPA 1
    ecap 000b[284] = Vendor [1] ID 0002 Rev 1 Length 256
    ecap 000b[384] = Vendor [1] ID 0001 Rev 1 Length 56
    ecap 0015[3bc] = Resizable BAR 1
