hostb0@pci0:0:0:0:	class=0x060000 card=0x19998086 chip=0x19808086 rev=0x11 hdr=0x00
    vendor     = 'Intel Corporation'
    class      = bridge
    subclass   = HOST-PCI

hostb1@pci0:0:4:0:	class=0x060000 card=0x00008086 chip=0x19a18086 rev=0x11 hdr=0x00
    vendor     = 'Intel Corporation'
    class      = bridge
    subclass   = HOST-PCI
    cap 10[40] = PCI-Express 2 root endpoint max data 256(256)

none0@pci0:0:5:0:	class=0x080700 card=0x00008086 chip=0x19a28086 rev=0x11 hdr=0x00
    vendor     = 'Intel Corporation'
    class      = base peripheral
    cap 10[40] = PCI-Express 2 event collector max data 256(256)
    cap 01[80] = powerspec 3  supports D0 D3  current D0
    cap 05[90] = MSI supports 1 message, vector masks 
    ecap 0001[100] = AER 1 0 fatal 0 non-fatal 1 corrected
    ecap 0007[150] = Root Complex Event Collector ASsociation 1

pcib1@pci0:0:6:0:	class=0x060400 card=0x00008086 chip=0x19a38086 rev=0x11 hdr=0x01
    vendor     = 'Intel Corporation'
    class      = bridge
    subclass   = PCI-PCI
    cap 10[40] = PCI-Express 2 root port max data 128(128) ARI enabled
                 link x1(x1) speed 2.5(2.5) ASPM disabled(L0s/L1)
    cap 01[80] = powerspec 3  supports D0 D3  current D0
    cap 0d[88] = PCI Bridge card=0x00008086
    cap 05[90] = MSI supports 1 message, vector masks 
    ecap 0001[100] = AER 1 0 fatal 0 non-fatal 1 corrected
    ecap 000d[138] = ACS 1

pcib2@pci0:0:9:0:	class=0x060400 card=0x00008086 chip=0x19a48086 rev=0x11 hdr=0x01
    vendor     = 'Intel Corporation'
    class      = bridge
    subclass   = PCI-PCI
    bar   [10] = type Memory, range 64, base 0xdff60000, size 131072, enabled
    cap 10[40] = PCI-Express 2 root port max data 256(256) ARI disabled
                 link x0(x2) speed 0.0(8.0)
    cap 01[80] = powerspec 3  supports D0 D3  current D0
    cap 0d[88] = PCI Bridge card=0x00008086
    cap 05[90] = MSI supports 1 message, vector masks 
    ecap 0001[100] = AER 1 0 fatal 0 non-fatal 0 corrected
    ecap 000d[138] = ACS 1
    ecap 0012[150] = Multicast 1
    ecap 000b[180] = Vendor 1 ID 3
    ecap 001d[190] = unknown 1
    ecap 001e[1d0] = unknown 1
    ecap 0019[200] = PCIe Sec 1 lane errors 0

pcib3@pci0:0:10:0:	class=0x060400 card=0x19a58086 chip=0x19a58086 rev=0x11 hdr=0x01
    vendor     = 'Intel Corporation'
    class      = bridge
    subclass   = PCI-PCI
    bar   [10] = type Memory, range 64, base 0xdff40000, size 131072, enabled
    cap 10[40] = PCI-Express 2 root port max data 256(256) ARI disabled
                 link x0(x2) speed 0.0(8.0)
    cap 01[80] = powerspec 3  supports D0 D3  current D0
    cap 0d[88] = PCI Bridge card=0x19a58086
    cap 05[90] = MSI supports 1 message, vector masks 
    ecap 0001[100] = AER 1 0 fatal 0 non-fatal 0 corrected
    ecap 000d[138] = ACS 1
    ecap 0012[150] = Multicast 1
    ecap 000b[180] = Vendor 1 ID 3
    ecap 001d[190] = unknown 1
    ecap 001e[1d0] = unknown 1
    ecap 0019[200] = PCIe Sec 1 lane errors 0

pcib4@pci0:0:11:0:	class=0x060400 card=0x19a68086 chip=0x19a68086 rev=0x11 hdr=0x01
    vendor     = 'Intel Corporation'
    class      = bridge
    subclass   = PCI-PCI
    bar   [10] = type Memory, range 64, base 0xdff20000, size 131072, enabled
    cap 10[40] = PCI-Express 2 root port max data 256(256) ARI disabled
                 link x0(x0)
    cap 01[80] = powerspec 3  supports D0 D3  current D0
    cap 0d[88] = PCI Bridge card=0x19a68086
    cap 05[90] = MSI supports 1 message, vector masks 
    ecap 0001[100] = AER 1 0 fatal 0 non-fatal 0 corrected
    ecap 000d[138] = ACS 1
    ecap 0012[150] = Multicast 1
    ecap 000b[180] = Vendor 1 ID 3
    ecap 001d[190] = unknown 1
    ecap 001e[1d0] = unknown 1
    ecap 0019[200] = PCIe Sec 1 lane errors 0

pcib5@pci0:0:14:0:	class=0x060400 card=0x19a88086 chip=0x19a88086 rev=0x11 hdr=0x01
    vendor     = 'Intel Corporation'
    class      = bridge
    subclass   = PCI-PCI
    bar   [10] = type Memory, range 64, base 0xdff00000, size 131072, enabled
    cap 10[40] = PCI-Express 2 root port max data 256(256) ARI disabled
                 link x1(x1) speed 2.5(8.0)
    cap 01[80] = powerspec 3  supports D0 D3  current D0
    cap 0d[88] = PCI Bridge card=0x19a88086
    cap 05[90] = MSI supports 1 message, vector masks 
    ecap 0001[100] = AER 1 0 fatal 0 non-fatal 0 corrected
    ecap 000d[138] = ACS 1
    ecap 0012[150] = Multicast 1
    ecap 000b[180] = Vendor 1 ID 3
    ecap 001d[190] = unknown 1
    ecap 001e[1d0] = unknown 1
    ecap 0019[200] = PCIe Sec 1 lane errors 0

none1@pci0:0:18:0:	class=0x088000 card=0x00008086 chip=0x19ac8086 rev=0x11 hdr=0x00
    vendor     = 'Intel Corporation'
    device     = 'Atom Processor C3000 Series SMBus Contoller - Host'
    class      = base peripheral
    bar   [10] = type Memory, range 64, base 0xdff9c000, size 1024, enabled
    cap 10[40] = PCI-Express 2 root endpoint max data 256(256) FLR NS
    cap 01[80] = powerspec 3  supports D0 D3  current D0
    cap 05[8c] = MSI supports 1 message, 64 bit, vector masks 
    ecap 0001[100] = AER 1 0 fatal 0 non-fatal 0 corrected

ahci0@pci0:0:19:0:	class=0x010601 card=0x72708086 chip=0x19b28086 rev=0x11 hdr=0x00
    vendor     = 'Intel Corporation'
    device     = 'Atom Processor C3000 Series SATA Controller 0'
    class      = mass storage
    subclass   = SATA
    bar   [10] = type Memory, range 32, base 0xdff94000, size 8192, enabled
    bar   [14] = type Memory, range 32, base 0xdff9b000, size 256, enabled
    bar   [18] = type I/O Port, range 32, base 0xf050, size 8, enabled
    bar   [1c] = type I/O Port, range 32, base 0xf040, size 4, enabled
    bar   [20] = type I/O Port, range 32, base 0xf020, size 32, enabled
    bar   [24] = type Memory, range 32, base 0xdff9a000, size 2048, enabled
    cap 05[80] = MSI supports 1 message 
    cap 01[70] = powerspec 3  supports D0 D3  current D0
    cap 12[a8] = SATA Index-Data Pair
    cap 11[d0] = MSI-X supports 8 messages, enabled
                 Table in map 0x10[0x0], PBA in map 0x14[0x0]

xhci0@pci0:0:21:0:	class=0x0c0330 card=0x72708086 chip=0x19d08086 rev=0x11 hdr=0x00
    vendor     = 'Intel Corporation'
    device     = 'Atom Processor C3000 Series USB 3.0 xHCI Controller'
    class      = serial bus
    subclass   = USB
    bar   [10] = type Memory, range 64, base 0xdff80000, size 65536, enabled
    cap 01[70] = powerspec 2  supports D0 D3  current D0
    cap 05[80] = MSI supports 8 messages, 64 bit enabled with 1 message

pcib6@pci0:0:22:0:	class=0x060400 card=0x00008086 chip=0x19d18086 rev=0x11 hdr=0x01
    vendor     = 'Intel Corporation'
    class      = bridge
    subclass   = PCI-PCI
    cap 10[40] = PCI-Express 2 root port max data 128(128) ARI enabled
                 link x1(x1) speed 2.5(2.5) ASPM disabled(L0s/L1)
    cap 01[80] = powerspec 3  supports D0 D3  current D0
    cap 0d[88] = PCI Bridge card=0x00008086
    cap 05[90] = MSI supports 1 message, vector masks 
    ecap 0001[100] = AER 1 0 fatal 0 non-fatal 1 corrected
    ecap 000d[138] = ACS 1

pcib7@pci0:0:23:0:	class=0x060400 card=0x00008086 chip=0x19d28086 rev=0x11 hdr=0x01
    vendor     = 'Intel Corporation'
    class      = bridge
    subclass   = PCI-PCI
    cap 10[40] = PCI-Express 2 root port max data 128(128) ARI enabled
                 link x1(x1) speed 2.5(2.5) ASPM disabled(L0s/L1)
    cap 01[80] = powerspec 3  supports D0 D3  current D0
    cap 0d[88] = PCI Bridge card=0x00008086
    cap 05[90] = MSI supports 1 message, vector masks 
    ecap 0001[100] = AER 1 0 fatal 0 non-fatal 1 corrected
    ecap 000d[138] = ACS 1

none2@pci0:0:24:0:	class=0x078000 card=0x19d38086 chip=0x19d38086 rev=0x11 hdr=0x00
    vendor     = 'Intel Corporation'
    class      = simple comms
    bar   [10] = type Memory, range 64, base 0xdff99000, size 4096, enabled
    cap 01[50] = powerspec 3  supports D0 D3  current D0
    cap 05[8c] = MSI supports 1 message, 64 bit 

sdhci_pci0@pci0:0:28:0:	class=0x080501 card=0x72708086 chip=0x19db8086 rev=0x11 hdr=0x00
    vendor     = 'Intel Corporation'
    class      = base peripheral
    subclass   = SD host controller
    bar   [10] = type Memory, range 64, base 0xdff98000, size 4096, enabled
    bar   [18] = type Memory, range 64, base 0xdff97000, size 4096, enabled
    cap 01[80] = powerspec 3  supports D0 D3  current D0
    cap 09[90] = vendor (length 20) Intel cap 15 version 0

isab0@pci0:0:31:0:	class=0x060100 card=0x72708086 chip=0x19dc8086 rev=0x11 hdr=0x00
    vendor     = 'Intel Corporation'
    device     = 'Atom Processor C3000 Series LPC or eSPI'
    class      = bridge
    subclass   = PCI-ISA

none3@pci0:0:31:2:	class=0x058000 card=0x72708086 chip=0x19de8086 rev=0x11 hdr=0x00
    vendor     = 'Intel Corporation'
    class      = memory
    bar   [10] = type Memory, range 32, base 0xdff90000, size 16384, enabled

none4@pci0:0:31:4:	class=0x0c0500 card=0x72708086 chip=0x19df8086 rev=0x11 hdr=0x00
    vendor     = 'Intel Corporation'
    device     = 'Atom Processor C3000 Series SMBus controller'
    class      = serial bus
    subclass   = SMBus
    bar   [10] = type Memory, range 64, base 0xdff96000, size 256, enabled
    bar   [20] = type I/O Port, range 32, base 0xf000, size 32, enabled

none5@pci0:0:31:5:	class=0x0c8000 card=0x72708086 chip=0x19e08086 rev=0x11 hdr=0x00
    vendor     = 'Intel Corporation'
    device     = 'Atom Processor C3000 Series SPI Controller'
    class      = serial bus
    bar   [10] = type Memory, range 32, base 0xfe010000, size 4096, enabled

none6@pci0:1:0:0:	class=0x0b4000 card=0x00008086 chip=0x19e28086 rev=0x11 hdr=0x00
    vendor     = 'Intel Corporation'
    device     = 'Atom Processor C3000 Series QuickAssist Technology'
    class      = processor
    bar   [18] = type Memory, range 64, base 0xdfe40000, size 262144, enabled
    bar   [20] = type Memory, range 64, base 0xdfe00000, size 262144, enabled
    cap 05[b0] = MSI supports 1 message, 64 bit, vector masks 
    cap 11[60] = MSI-X supports 17 messages
                 Table in map 0x18[0x3b000], PBA in map 0x18[0x3b800]
    cap 01[6c] = powerspec 3  supports D0 D3  current D0
    cap 10[74] = PCI-Express 2 endpoint max data 128(16384) FLR RO NS
                 link x16(x16) speed 5.0(5.0) ASPM disabled(L0s/L1)
    ecap 0001[100] = AER 1 0 fatal 1 non-fatal 0 corrected
    ecap 000e[138] = ARI 1
    ecap 0010[140] = SR-IOV 1 IOV disabled, Memory Space disabled, ARI disabled
                     0 VFs configured out of 16 supported
                     First VF RID Offset 0x0008, VF RID Stride 0x0001
                     VF Device ID 0x19e3
                     Page Sizes: 4096 (enabled), 8192, 65536, 262144, 1048576, 4194304
    ecap 000d[1b0] = ACS 1

none7@pci0:5:0:0:	class=0x028000 card=0x02611dac chip=0x003e168c rev=0x32 hdr=0x00
    vendor     = 'Qualcomm Atheros'
    device     = 'QCA6174 802.11ac Wireless Network Adapter'
    class      = network
    bar   [10] = type Memory, range 64, base 0xdfa00000, size 2097152, enabled
    cap 01[40] = powerspec 3  supports D0 D3  current D0
    cap 05[50] = MSI supports 8 messages, vector masks 
    cap 10[70] = PCI-Express 2 endpoint max data 256(256) RO
                 link x1(x1) speed 2.5(2.5) ASPM disabled(L0s/L1)
    ecap 0001[100] = AER 2 0 fatal 0 non-fatal 1 corrected
    ecap 0002[148] = VC 1 max VC0
    ecap 0003[168] = Serial 1 0000000000000000
    ecap 0018[178] = LTR 1
    ecap 001e[180] = unknown 1

ix0@pci0:6:0:0:	class=0x020000 card=0x00008086 chip=0x15e48086 rev=0x11 hdr=0x00
    vendor     = 'Intel Corporation'
    device     = 'Ethernet Connection X553 1GbE'
    class      = network
    subclass   = ethernet
    bar   [10] = type Prefetchable Memory, range 64, base 0xdf600000, size 2097152, enabled
    bar   [20] = type Prefetchable Memory, range 64, base 0xdf804000, size 16384, enabled
    cap 01[40] = powerspec 3  supports D0 D3  current D0
    cap 05[50] = MSI supports 1 message, 64 bit, vector masks 
    cap 11[70] = MSI-X supports 64 messages, enabled
                 Table in map 0x20[0x0], PBA in map 0x20[0x2000]
    cap 10[a0] = PCI-Express 2 endpoint max data 128(128) FLR RO
                 link x1(x1) speed 2.5(2.5) ASPM disabled(L0s/L1)
    ecap 0001[100] = AER 2 0 fatal 0 non-fatal 1 corrected
    ecap 0003[140] = Serial 1 0000c9ffff000000
    ecap 000e[150] = ARI 1
    ecap 0010[160] = SR-IOV 1 IOV disabled, Memory Space disabled, ARI disabled
                     0 VFs configured out of 64 supported
                     First VF RID Offset 0x0180, VF RID Stride 0x0002
                     VF Device ID 0x15c5
                     Page Sizes: 4096 (enabled), 8192, 65536, 262144, 1048576, 4194304
    ecap 000d[1b0] = ACS 1

ix1@pci0:6:0:1:	class=0x020000 card=0x00008086 chip=0x15e48086 rev=0x11 hdr=0x00
    vendor     = 'Intel Corporation'
    device     = 'Ethernet Connection X553 1GbE'
    class      = network
    subclass   = ethernet
    bar   [10] = type Prefetchable Memory, range 64, base 0xdf400000, size 2097152, enabled
    bar   [20] = type Prefetchable Memory, range 64, base 0xdf800000, size 16384, enabled
    cap 01[40] = powerspec 3  supports D0 D3  current D0
    cap 05[50] = MSI supports 1 message, 64 bit, vector masks 
    cap 11[70] = MSI-X supports 64 messages, enabled
                 Table in map 0x20[0x0], PBA in map 0x20[0x2000]
    cap 10[a0] = PCI-Express 2 endpoint max data 128(128) FLR RO
                 link x1(x1) speed 2.5(2.5) ASPM disabled(L0s/L1)
    ecap 0001[100] = AER 2 0 fatal 0 non-fatal 1 corrected
    ecap 0003[140] = Serial 1 0000c9ffff000000
    ecap 000e[150] = ARI 1
    ecap 0010[160] = SR-IOV 1 IOV disabled, Memory Space disabled, ARI disabled
                     0 VFs configured out of 64 supported
                     First VF RID Offset 0x0180, VF RID Stride 0x0002
                     VF Device ID 0x15c5
                     Page Sizes: 4096 (enabled), 8192, 65536, 262144, 1048576, 4194304
    ecap 000d[1b0] = ACS 1

ix2@pci0:7:0:0:	class=0x020000 card=0x00008086 chip=0x15e58086 rev=0x11 hdr=0x00
    vendor     = 'Intel Corporation'
    device     = 'Ethernet Connection X553 1GbE'
    class      = network
    subclass   = ethernet
    bar   [10] = type Prefetchable Memory, range 64, base 0xdf000000, size 2097152, enabled
    bar   [20] = type Prefetchable Memory, range 64, base 0xdf204000, size 16384, enabled
    cap 01[40] = powerspec 3  supports D0 D3  current D0
    cap 05[50] = MSI supports 1 message, 64 bit, vector masks 
    cap 11[70] = MSI-X supports 64 messages, enabled
                 Table in map 0x20[0x0], PBA in map 0x20[0x2000]
    cap 10[a0] = PCI-Express 2 endpoint max data 128(128) FLR RO
                 link x1(x1) speed 2.5(2.5) ASPM disabled(L0s/L1)
    ecap 0001[100] = AER 2 0 fatal 0 non-fatal 1 corrected
    ecap 0003[140] = Serial 1 0100c9ffff000000
    ecap 000e[150] = ARI 1
    ecap 0010[160] = SR-IOV 1 IOV disabled, Memory Space disabled, ARI disabled
                     0 VFs configured out of 64 supported
                     First VF RID Offset 0x0180, VF RID Stride 0x0002
                     VF Device ID 0x15c5
                     Page Sizes: 4096 (enabled), 8192, 65536, 262144, 1048576, 4194304
    ecap 000d[1b0] = ACS 1

ix3@pci0:7:0:1:	class=0x020000 card=0x00008086 chip=0x15e58086 rev=0x11 hdr=0x00
    vendor     = 'Intel Corporation'
    device     = 'Ethernet Connection X553 1GbE'
    class      = network
    subclass   = ethernet
    bar   [10] = type Prefetchable Memory, range 64, base 0xdee00000, size 2097152, enabled
    bar   [20] = type Prefetchable Memory, range 64, base 0xdf200000, size 16384, enabled
    cap 01[40] = powerspec 3  supports D0 D3  current D0
    cap 05[50] = MSI supports 1 message, 64 bit, vector masks 
    cap 11[70] = MSI-X supports 64 messages, enabled
                 Table in map 0x20[0x0], PBA in map 0x20[0x2000]
    cap 10[a0] = PCI-Express 2 endpoint max data 128(128) FLR RO
                 link x1(x1) speed 2.5(2.5) ASPM disabled(L0s/L1)
    ecap 0001[100] = AER 2 0 fatal 0 non-fatal 1 corrected
    ecap 0003[140] = Serial 1 0100c9ffff000000
    ecap 000e[150] = ARI 1
    ecap 0010[160] = SR-IOV 1 IOV disabled, Memory Space disabled, ARI disabled
                     0 VFs configured out of 64 supported
                     First VF RID Offset 0x0180, VF RID Stride 0x0002
                     VF Device ID 0x15c5
                     Page Sizes: 4096 (enabled), 8192, 65536, 262144, 1048576, 4194304
    ecap 000d[1b0] = ACS 1
