none0@pci0:254:8:0:	class=0x088000 card=0x782f1849 chip=0x782f8086 rev=0x10 hdr=0x00
    vendor     = 'Intel Corporation'
    class      = base peripheral

none1@pci0:254:8:1:	class=0x088000 card=0x782f1849 chip=0x782f8086 rev=0x10 hdr=0x00
    vendor     = 'Intel Corporation'
    class      = base peripheral

none2@pci0:254:8:2:	class=0x088000 card=0x782f1849 chip=0x782f8086 rev=0x10 hdr=0x00
    vendor     = 'Intel Corporation'
    class      = base peripheral

none3@pci0:254:8:3:	class=0x088000 card=0x782f1849 chip=0x782f8086 rev=0x10 hdr=0x00
    vendor     = 'Intel Corporation'
    class      = base peripheral

none4@pci0:254:8:4:	class=0x088000 card=0x782f1849 chip=0x782f8086 rev=0x10 hdr=0x00
    vendor     = 'Intel Corporation'
    class      = base peripheral

none5@pci0:254:8:5:	class=0x088000 card=0x782f1849 chip=0x782f8086 rev=0x10 hdr=0x00
    vendor     = 'Intel Corporation'
    class      = base peripheral

none6@pci0:254:8:6:	class=0x088000 card=0x782f1849 chip=0x782f8086 rev=0x10 hdr=0x00
    vendor     = 'Intel Corporation'
    class      = base peripheral

none7@pci0:254:8:7:	class=0x088000 card=0x782f1849 chip=0x782f8086 rev=0x10 hdr=0x00
    vendor     = 'Intel Corporation'
    class      = base peripheral

none8@pci0:254:9:0:	class=0x088000 card=0x782f1849 chip=0x782f8086 rev=0x10 hdr=0x00
    vendor     = 'Intel Corporation'
    class      = base peripheral

none9@pci0:254:9:1:	class=0x088000 card=0x782f1849 chip=0x782f8086 rev=0x10 hdr=0x00
    vendor     = 'Intel Corporation'
    class      = base peripheral

none10@pci0:254:9:2:	class=0x088000 card=0x782f1849 chip=0x782f8086 rev=0x10 hdr=0x00
    vendor     = 'Intel Corporation'
    class      = base peripheral

none11@pci0:254:9:3:	class=0x088000 card=0x782f1849 chip=0x782f8086 rev=0x10 hdr=0x00
    vendor     = 'Intel Corporation'
    class      = base peripheral

none12@pci0:254:9:4:	class=0x088000 card=0x782f1849 chip=0x782f8086 rev=0x10 hdr=0x00
    vendor     = 'Intel Corporation'
    class      = base peripheral

none13@pci0:254:9:5:	class=0x088000 card=0x782f1849 chip=0x782f8086 rev=0x10 hdr=0x00
    vendor     = 'Intel Corporation'
    class      = base peripheral

none14@pci0:254:9:6:	class=0x088000 card=0x782f1849 chip=0x782f8086 rev=0x10 hdr=0x00
    vendor     = 'Intel Corporation'
    class      = base peripheral

none15@pci0:254:9:7:	class=0x088000 card=0x782f1849 chip=0x782f8086 rev=0x10 hdr=0x00
    vendor     = 'Intel Corporation'
    class      = base peripheral

none16@pci0:254:10:0:	class=0x088000 card=0x782f1849 chip=0x782f8086 rev=0x10 hdr=0x00
    vendor     = 'Intel Corporation'
    class      = base peripheral

none17@pci0:254:10:1:	class=0x088000 card=0x782f1849 chip=0x782f8086 rev=0x10 hdr=0x00
    vendor     = 'Intel Corporation'
    class      = base peripheral

none18@pci0:254:10:2:	class=0x088000 card=0x782f1849 chip=0x782f8086 rev=0x10 hdr=0x00
    vendor     = 'Intel Corporation'
    class      = base peripheral

none19@pci0:254:10:3:	class=0x088000 card=0x782f1849 chip=0x782f8086 rev=0x10 hdr=0x00
    vendor     = 'Intel Corporation'
    class      = base peripheral

none20@pci0:254:10:4:	class=0x088000 card=0x782f1849 chip=0x782f8086 rev=0x10 hdr=0x00
    vendor     = 'Intel Corporation'
    class      = base peripheral

none21@pci0:254:10:5:	class=0x088000 card=0x782f1849 chip=0x782f8086 rev=0x10 hdr=0x00
    vendor     = 'Intel Corporation'
    class      = base peripheral

none22@pci0:254:10:6:	class=0x088000 card=0x782f1849 chip=0x782f8086 rev=0x10 hdr=0x00
    vendor     = 'Intel Corporation'
    class      = base peripheral

none23@pci0:254:10:7:	class=0x088000 card=0x782f1849 chip=0x782f8086 rev=0x10 hdr=0x00
    vendor     = 'Intel Corporation'
    class      = base peripheral

none24@pci0:254:11:0:	class=0x088000 card=0x782f1849 chip=0x782f8086 rev=0x10 hdr=0x00
    vendor     = 'Intel Corporation'
    class      = base peripheral

none25@pci0:254:11:1:	class=0x088000 card=0x782f1849 chip=0x782f8086 rev=0x10 hdr=0x00
    vendor     = 'Intel Corporation'
    class      = base peripheral

none26@pci0:254:11:2:	class=0x088000 card=0x782f1849 chip=0x782f8086 rev=0x10 hdr=0x00
    vendor     = 'Intel Corporation'
    class      = base peripheral

none27@pci0:254:11:3:	class=0x088000 card=0x782f1849 chip=0x782f8086 rev=0x10 hdr=0x00
    vendor     = 'Intel Corporation'
    class      = base peripheral

none28@pci0:254:11:4:	class=0x088000 card=0x782f1849 chip=0x782f8086 rev=0x10 hdr=0x00
    vendor     = 'Intel Corporation'
    class      = base peripheral

none29@pci0:254:11:5:	class=0x088000 card=0x782f1849 chip=0x782f8086 rev=0x10 hdr=0x00
    vendor     = 'Intel Corporation'
    class      = base peripheral

none30@pci0:254:11:6:	class=0x088000 card=0x782f1849 chip=0x782f8086 rev=0x10 hdr=0x00
    vendor     = 'Intel Corporation'
    class      = base peripheral

none31@pci0:254:11:7:	class=0x088000 card=0x782f1849 chip=0x782f8086 rev=0x10 hdr=0x00
    vendor     = 'Intel Corporation'
    class      = base peripheral

none32@pci0:254:12:0:	class=0x088000 card=0x782f1849 chip=0x782f8086 rev=0x10 hdr=0x00
    vendor     = 'Intel Corporation'
    class      = base peripheral

none33@pci0:254:12:1:	class=0x088000 card=0x782f1849 chip=0x782f8086 rev=0x10 hdr=0x00
    vendor     = 'Intel Corporation'
    class      = base peripheral

none34@pci0:254:12:2:	class=0x088000 card=0x782f1849 chip=0x782f8086 rev=0x10 hdr=0x00
    vendor     = 'Intel Corporation'
    class      = base peripheral

none35@pci0:254:12:3:	class=0x088000 card=0x782f1849 chip=0x782f8086 rev=0x10 hdr=0x00
    vendor     = 'Intel Corporation'
    class      = base peripheral

none36@pci0:254:12:4:	class=0x088000 card=0x782f1849 chip=0x782f8086 rev=0x10 hdr=0x00
    vendor     = 'Intel Corporation'
    class      = base peripheral

none37@pci0:254:12:5:	class=0x088000 card=0x782f1849 chip=0x782f8086 rev=0x10 hdr=0x00
    vendor     = 'Intel Corporation'
    class      = base peripheral

none38@pci0:254:14:0:	class=0x088000 card=0x782c1849 chip=0x782c8086 rev=0x10 hdr=0x00
    vendor     = 'Intel Corporation'
    class      = base peripheral

none39@pci0:254:14:1:	class=0x088000 card=0x782c1849 chip=0x782c8086 rev=0x10 hdr=0x00
    vendor     = 'Intel Corporation'
    class      = base peripheral

none40@pci0:254:14:2:	class=0x088000 card=0x782c1849 chip=0x782c8086 rev=0x10 hdr=0x00
    vendor     = 'Intel Corporation'
    class      = base peripheral

none41@pci0:254:14:3:	class=0x088000 card=0x782c1849 chip=0x782c8086 rev=0x10 hdr=0x00
    vendor     = 'Intel Corporation'
    class      = base peripheral

none42@pci0:254:14:4:	class=0x088000 card=0x782c1849 chip=0x782c8086 rev=0x10 hdr=0x00
    vendor     = 'Intel Corporation'
    class      = base peripheral

none43@pci0:254:14:5:	class=0x088000 card=0x782c1849 chip=0x782c8086 rev=0x10 hdr=0x00
    vendor     = 'Intel Corporation'
    class      = base peripheral

none44@pci0:254:14:6:	class=0x088000 card=0x782c1849 chip=0x782c8086 rev=0x10 hdr=0x00
    vendor     = 'Intel Corporation'
    class      = base peripheral

none45@pci0:254:14:7:	class=0x088000 card=0x782c1849 chip=0x782c8086 rev=0x10 hdr=0x00
    vendor     = 'Intel Corporation'
    class      = base peripheral

none46@pci0:254:15:0:	class=0x088000 card=0x782c1849 chip=0x782c8086 rev=0x10 hdr=0x00
    vendor     = 'Intel Corporation'
    class      = base peripheral

none47@pci0:254:15:1:	class=0x088000 card=0x782c1849 chip=0x782c8086 rev=0x10 hdr=0x00
    vendor     = 'Intel Corporation'
    class      = base peripheral

none48@pci0:254:15:2:	class=0x088000 card=0x782c1849 chip=0x782c8086 rev=0x10 hdr=0x00
    vendor     = 'Intel Corporation'
    class      = base peripheral

none49@pci0:254:15:3:	class=0x088000 card=0x782c1849 chip=0x782c8086 rev=0x10 hdr=0x00
    vendor     = 'Intel Corporation'
    class      = base peripheral

none50@pci0:254:15:4:	class=0x088000 card=0x782c1849 chip=0x782c8086 rev=0x10 hdr=0x00
    vendor     = 'Intel Corporation'
    class      = base peripheral

none51@pci0:254:15:5:	class=0x088000 card=0x782c1849 chip=0x782c8086 rev=0x10 hdr=0x00
    vendor     = 'Intel Corporation'
    class      = base peripheral

none52@pci0:254:15:6:	class=0x088000 card=0x782c1849 chip=0x782c8086 rev=0x10 hdr=0x00
    vendor     = 'Intel Corporation'
    class      = base peripheral

none53@pci0:254:15:7:	class=0x088000 card=0x782c1849 chip=0x782c8086 rev=0x10 hdr=0x00
    vendor     = 'Intel Corporation'
    class      = base peripheral

none54@pci0:254:16:0:	class=0x088000 card=0x782c1849 chip=0x782c8086 rev=0x10 hdr=0x00
    vendor     = 'Intel Corporation'
    class      = base peripheral

none55@pci0:254:16:1:	class=0x088000 card=0x782c1849 chip=0x782c8086 rev=0x10 hdr=0x00
    vendor     = 'Intel Corporation'
    class      = base peripheral

none56@pci0:254:16:2:	class=0x088000 card=0x782c1849 chip=0x782c8086 rev=0x10 hdr=0x00
    vendor     = 'Intel Corporation'
    class      = base peripheral

none57@pci0:254:16:3:	class=0x088000 card=0x782c1849 chip=0x782c8086 rev=0x10 hdr=0x00
    vendor     = 'Intel Corporation'
    class      = base peripheral

none58@pci0:254:16:4:	class=0x088000 card=0x782c1849 chip=0x782c8086 rev=0x10 hdr=0x00
    vendor     = 'Intel Corporation'
    class      = base peripheral

none59@pci0:254:16:5:	class=0x088000 card=0x782c1849 chip=0x782c8086 rev=0x10 hdr=0x00
    vendor     = 'Intel Corporation'
    class      = base peripheral

none60@pci0:254:16:6:	class=0x088000 card=0x782c1849 chip=0x782c8086 rev=0x10 hdr=0x00
    vendor     = 'Intel Corporation'
    class      = base peripheral

none61@pci0:254:16:7:	class=0x088000 card=0x782c1849 chip=0x782c8086 rev=0x10 hdr=0x00
    vendor     = 'Intel Corporation'
    class      = base peripheral

none62@pci0:254:17:0:	class=0x088000 card=0x782c1849 chip=0x782c8086 rev=0x10 hdr=0x00
    vendor     = 'Intel Corporation'
    class      = base peripheral

none63@pci0:254:17:1:	class=0x088000 card=0x782c1849 chip=0x782c8086 rev=0x10 hdr=0x00
    vendor     = 'Intel Corporation'
    class      = base peripheral

none64@pci0:254:17:2:	class=0x088000 card=0x782c1849 chip=0x782c8086 rev=0x10 hdr=0x00
    vendor     = 'Intel Corporation'
    class      = base peripheral

none65@pci0:254:17:3:	class=0x088000 card=0x782c1849 chip=0x782c8086 rev=0x10 hdr=0x00
    vendor     = 'Intel Corporation'
    class      = base peripheral

none66@pci0:254:17:4:	class=0x088000 card=0x782c1849 chip=0x782c8086 rev=0x10 hdr=0x00
    vendor     = 'Intel Corporation'
    class      = base peripheral

none67@pci0:254:17:5:	class=0x088000 card=0x782c1849 chip=0x782c8086 rev=0x10 hdr=0x00
    vendor     = 'Intel Corporation'
    class      = base peripheral

none68@pci0:254:17:6:	class=0x088000 card=0x782c1849 chip=0x782c8086 rev=0x10 hdr=0x00
    vendor     = 'Intel Corporation'
    class      = base peripheral

none69@pci0:254:17:7:	class=0x088000 card=0x782c1849 chip=0x782c8086 rev=0x10 hdr=0x00
    vendor     = 'Intel Corporation'
    class      = base peripheral

none70@pci0:254:18:0:	class=0x088000 card=0x782c1849 chip=0x782c8086 rev=0x10 hdr=0x00
    vendor     = 'Intel Corporation'
    class      = base peripheral

none71@pci0:254:18:1:	class=0x088000 card=0x782c1849 chip=0x782c8086 rev=0x10 hdr=0x00
    vendor     = 'Intel Corporation'
    class      = base peripheral

none72@pci0:254:18:2:	class=0x088000 card=0x782c1849 chip=0x782c8086 rev=0x10 hdr=0x00
    vendor     = 'Intel Corporation'
    class      = base peripheral

none73@pci0:254:18:3:	class=0x088000 card=0x782c1849 chip=0x782c8086 rev=0x10 hdr=0x00
    vendor     = 'Intel Corporation'
    class      = base peripheral

none74@pci0:254:18:4:	class=0x088000 card=0x782c1849 chip=0x782c8086 rev=0x10 hdr=0x00
    vendor     = 'Intel Corporation'
    class      = base peripheral

none75@pci0:254:18:5:	class=0x088000 card=0x782c1849 chip=0x782c8086 rev=0x10 hdr=0x00
    vendor     = 'Intel Corporation'
    class      = base peripheral

none76@pci0:254:20:0:	class=0x088000 card=0x781f1849 chip=0x781f8086 rev=0x10 hdr=0x00
    vendor     = 'Intel Corporation'
    class      = base peripheral

none77@pci0:254:20:1:	class=0x088000 card=0x781f1849 chip=0x781f8086 rev=0x10 hdr=0x00
    vendor     = 'Intel Corporation'
    class      = base peripheral

none78@pci0:254:20:2:	class=0x088000 card=0x781f1849 chip=0x781f8086 rev=0x10 hdr=0x00
    vendor     = 'Intel Corporation'
    class      = base peripheral

none79@pci0:254:20:3:	class=0x088000 card=0x781f1849 chip=0x781f8086 rev=0x10 hdr=0x00
    vendor     = 'Intel Corporation'
    class      = base peripheral

none80@pci0:254:20:4:	class=0x088000 card=0x781f1849 chip=0x781f8086 rev=0x10 hdr=0x00
    vendor     = 'Intel Corporation'
    class      = base peripheral

none81@pci0:254:20:5:	class=0x088000 card=0x781f1849 chip=0x781f8086 rev=0x10 hdr=0x00
    vendor     = 'Intel Corporation'
    class      = base peripheral

none82@pci0:254:20:6:	class=0x088000 card=0x781f1849 chip=0x781f8086 rev=0x10 hdr=0x00
    vendor     = 'Intel Corporation'
    class      = base peripheral

none83@pci0:254:20:7:	class=0x088000 card=0x781f1849 chip=0x781f8086 rev=0x10 hdr=0x00
    vendor     = 'Intel Corporation'
    class      = base peripheral

none84@pci0:254:21:0:	class=0x088000 card=0x781f1849 chip=0x781f8086 rev=0x10 hdr=0x00
    vendor     = 'Intel Corporation'
    class      = base peripheral

none85@pci0:254:21:1:	class=0x088000 card=0x781f1849 chip=0x781f8086 rev=0x10 hdr=0x00
    vendor     = 'Intel Corporation'
    class      = base peripheral

none86@pci0:254:21:2:	class=0x088000 card=0x781f1849 chip=0x781f8086 rev=0x10 hdr=0x00
    vendor     = 'Intel Corporation'
    class      = base peripheral

none87@pci0:254:21:3:	class=0x088000 card=0x781f1849 chip=0x781f8086 rev=0x10 hdr=0x00
    vendor     = 'Intel Corporation'
    class      = base peripheral

none88@pci0:254:21:4:	class=0x088000 card=0x781f1849 chip=0x781f8086 rev=0x10 hdr=0x00
    vendor     = 'Intel Corporation'
    class      = base peripheral

none89@pci0:254:21:5:	class=0x088000 card=0x781f1849 chip=0x781f8086 rev=0x10 hdr=0x00
    vendor     = 'Intel Corporation'
    class      = base peripheral

none90@pci0:254:21:6:	class=0x088000 card=0x781f1849 chip=0x781f8086 rev=0x10 hdr=0x00
    vendor     = 'Intel Corporation'
    class      = base peripheral

none91@pci0:254:21:7:	class=0x088000 card=0x781f1849 chip=0x781f8086 rev=0x10 hdr=0x00
    vendor     = 'Intel Corporation'
    class      = base peripheral

none92@pci0:254:22:0:	class=0x088000 card=0x781f1849 chip=0x781f8086 rev=0x10 hdr=0x00
    vendor     = 'Intel Corporation'
    class      = base peripheral

none93@pci0:254:22:1:	class=0x088000 card=0x781f1849 chip=0x781f8086 rev=0x10 hdr=0x00
    vendor     = 'Intel Corporation'
    class      = base peripheral

none94@pci0:254:22:2:	class=0x088000 card=0x781f1849 chip=0x781f8086 rev=0x10 hdr=0x00
    vendor     = 'Intel Corporation'
    class      = base peripheral

none95@pci0:254:22:3:	class=0x088000 card=0x781f1849 chip=0x781f8086 rev=0x10 hdr=0x00
    vendor     = 'Intel Corporation'
    class      = base peripheral

none96@pci0:254:22:4:	class=0x088000 card=0x781f1849 chip=0x781f8086 rev=0x10 hdr=0x00
    vendor     = 'Intel Corporation'
    class      = base peripheral

none97@pci0:254:22:5:	class=0x088000 card=0x781f1849 chip=0x781f8086 rev=0x10 hdr=0x00
    vendor     = 'Intel Corporation'
    class      = base peripheral

none98@pci0:254:22:6:	class=0x088000 card=0x781f1849 chip=0x781f8086 rev=0x10 hdr=0x00
    vendor     = 'Intel Corporation'
    class      = base peripheral

none99@pci0:254:22:7:	class=0x088000 card=0x781f1849 chip=0x781f8086 rev=0x10 hdr=0x00
    vendor     = 'Intel Corporation'
    class      = base peripheral

none100@pci0:254:23:0:	class=0x088000 card=0x781f1849 chip=0x781f8086 rev=0x10 hdr=0x00
    vendor     = 'Intel Corporation'
    class      = base peripheral

none101@pci0:254:23:1:	class=0x088000 card=0x781f1849 chip=0x781f8086 rev=0x10 hdr=0x00
    vendor     = 'Intel Corporation'
    class      = base peripheral

none102@pci0:254:23:2:	class=0x088000 card=0x781f1849 chip=0x781f8086 rev=0x10 hdr=0x00
    vendor     = 'Intel Corporation'
    class      = base peripheral

none103@pci0:254:23:3:	class=0x088000 card=0x781f1849 chip=0x781f8086 rev=0x10 hdr=0x00
    vendor     = 'Intel Corporation'
    class      = base peripheral

none104@pci0:254:23:4:	class=0x088000 card=0x781f1849 chip=0x781f8086 rev=0x10 hdr=0x00
    vendor     = 'Intel Corporation'
    class      = base peripheral

none105@pci0:254:23:5:	class=0x088000 card=0x781f1849 chip=0x781f8086 rev=0x10 hdr=0x00
    vendor     = 'Intel Corporation'
    class      = base peripheral

none106@pci0:254:23:6:	class=0x088000 card=0x781f1849 chip=0x781f8086 rev=0x10 hdr=0x00
    vendor     = 'Intel Corporation'
    class      = base peripheral

none107@pci0:254:23:7:	class=0x088000 card=0x781f1849 chip=0x781f8086 rev=0x10 hdr=0x00
    vendor     = 'Intel Corporation'
    class      = base peripheral

none108@pci0:254:24:0:	class=0x088000 card=0x781f1849 chip=0x781f8086 rev=0x10 hdr=0x00
    vendor     = 'Intel Corporation'
    class      = base peripheral

none109@pci0:254:24:1:	class=0x088000 card=0x781f1849 chip=0x781f8086 rev=0x10 hdr=0x00
    vendor     = 'Intel Corporation'
    class      = base peripheral

none110@pci0:254:24:2:	class=0x088000 card=0x781f1849 chip=0x781f8086 rev=0x10 hdr=0x00
    vendor     = 'Intel Corporation'
    class      = base peripheral

none111@pci0:254:24:3:	class=0x088000 card=0x781f1849 chip=0x781f8086 rev=0x10 hdr=0x00
    vendor     = 'Intel Corporation'
    class      = base peripheral

none112@pci0:254:24:4:	class=0x088000 card=0x781f1849 chip=0x781f8086 rev=0x10 hdr=0x00
    vendor     = 'Intel Corporation'
    class      = base peripheral

none113@pci0:254:24:5:	class=0x088000 card=0x781f1849 chip=0x781f8086 rev=0x10 hdr=0x00
    vendor     = 'Intel Corporation'
    class      = base peripheral

none114@pci0:254:29:0:	class=0x088000 card=0x782a1849 chip=0x782a8086 rev=0x10 hdr=0x00
    vendor     = 'Intel Corporation'
    class      = base peripheral

none115@pci0:254:29:1:	class=0x088000 card=0x782b1849 chip=0x782b8086 rev=0x10 hdr=0x00
    vendor     = 'Intel Corporation'
    class      = base peripheral

none116@pci0:254:29:2:	class=0x088000 card=0x782f1849 chip=0x782e8086 rev=0x10 hdr=0x00
    vendor     = 'Intel Corporation'
    class      = base peripheral

none117@pci0:254:29:3:	class=0x088000 card=0x782d1849 chip=0x782d8086 rev=0x10 hdr=0x00
    vendor     = 'Intel Corporation'
    class      = base peripheral

none118@pci0:254:30:0:	class=0x088000 card=0x78201849 chip=0x78208086 rev=0x10 hdr=0x00
    vendor     = 'Intel Corporation'
    class      = base peripheral

none119@pci0:254:30:1:	class=0x088000 card=0x78211849 chip=0x78218086 rev=0x10 hdr=0x00
    vendor     = 'Intel Corporation'
    class      = base peripheral

none120@pci0:254:30:2:	class=0x088000 card=0x78221849 chip=0x78228086 rev=0x10 hdr=0x00
    vendor     = 'Intel Corporation'
    class      = base peripheral

none121@pci0:254:30:3:	class=0x088000 card=0x78231849 chip=0x78238086 rev=0x10 hdr=0x00
    vendor     = 'Intel Corporation'
    class      = base peripheral

none122@pci0:254:30:4:	class=0x088000 card=0x78241849 chip=0x78248086 rev=0x10 hdr=0x00
    vendor     = 'Intel Corporation'
    class      = base peripheral

none123@pci0:254:30:5:	class=0x088000 card=0x78251849 chip=0x78258086 rev=0x10 hdr=0x00
    vendor     = 'Intel Corporation'
    class      = base peripheral

none124@pci0:254:30:6:	class=0x088000 card=0x78261849 chip=0x78268086 rev=0x10 hdr=0x00
    vendor     = 'Intel Corporation'
    class      = base peripheral

none125@pci0:254:30:7:	class=0xffffff card=0x00000000 chip=0x00000000 rev=0x10 hdr=0x00

none126@pci0:255:8:0:	class=0x088000 card=0x78401849 chip=0x78408086 rev=0x10 hdr=0x00
    vendor     = 'Intel Corporation'
    class      = base peripheral
    cap 10[40] = PCI-Express 2 root endpoint max data 128(128)

none127@pci0:255:8:1:	class=0x088000 card=0x78421849 chip=0x78428086 rev=0x10 hdr=0x00
    vendor     = 'Intel Corporation'
    class      = base peripheral
    cap 10[40] = PCI-Express 2 root endpoint max data 128(128)

none128@pci0:255:8:2:	class=0x088000 card=0x78431849 chip=0x78438086 rev=0x10 hdr=0x00
    vendor     = 'Intel Corporation'
    class      = base peripheral
    cap 10[40] = PCI-Express 2 root endpoint max data 128(128)

none129@pci0:255:8:3:	class=0x088000 card=0x78431849 chip=0x78438086 rev=0x10 hdr=0x00
    vendor     = 'Intel Corporation'
    class      = base peripheral
    cap 10[40] = PCI-Express 2 root endpoint max data 128(128)

none130@pci0:255:8:4:	class=0x088000 card=0x78431849 chip=0x78438086 rev=0x10 hdr=0x00
    vendor     = 'Intel Corporation'
    class      = base peripheral
    cap 10[40] = PCI-Express 2 root endpoint max data 128(128)

none131@pci0:255:9:0:	class=0x088000 card=0x78401849 chip=0x78408086 rev=0x10 hdr=0x00
    vendor     = 'Intel Corporation'
    class      = base peripheral
    cap 10[40] = PCI-Express 2 root endpoint max data 128(128)

none132@pci0:255:9:1:	class=0x088000 card=0x78421849 chip=0x78428086 rev=0x10 hdr=0x00
    vendor     = 'Intel Corporation'
    class      = base peripheral
    cap 10[40] = PCI-Express 2 root endpoint max data 128(128)

none133@pci0:255:9:2:	class=0x088000 card=0x78431849 chip=0x78438086 rev=0x10 hdr=0x00
    vendor     = 'Intel Corporation'
    class      = base peripheral
    cap 10[40] = PCI-Express 2 root endpoint max data 128(128)

none134@pci0:255:9:3:	class=0x088000 card=0x78431849 chip=0x78438086 rev=0x10 hdr=0x00
    vendor     = 'Intel Corporation'
    class      = base peripheral
    cap 10[40] = PCI-Express 2 root endpoint max data 128(128)

none135@pci0:255:9:4:	class=0x088000 card=0x78431849 chip=0x78438086 rev=0x10 hdr=0x00
    vendor     = 'Intel Corporation'
    class      = base peripheral
    cap 10[40] = PCI-Express 2 root endpoint max data 128(128)

none136@pci0:255:10:0:	class=0x088000 card=0x78411849 chip=0x78418086 rev=0x10 hdr=0x00
    vendor     = 'Intel Corporation'
    class      = base peripheral
    cap 10[40] = PCI-Express 2 root endpoint max data 128(128)

none137@pci0:255:10:1:	class=0x088000 card=0x78441849 chip=0x78448086 rev=0x10 hdr=0x00
    vendor     = 'Intel Corporation'
    class      = base peripheral
    cap 10[40] = PCI-Express 2 root endpoint max data 128(128)

none138@pci0:255:10:2:	class=0x088000 card=0x781f1849 chip=0x781f8086 rev=0x10 hdr=0x00
    vendor     = 'Intel Corporation'
    class      = base peripheral

none139@pci0:255:11:0:	class=0x088000 card=0x78411849 chip=0x78418086 rev=0x10 hdr=0x00
    vendor     = 'Intel Corporation'
    class      = base peripheral
    cap 10[40] = PCI-Express 2 root endpoint max data 128(128)

none140@pci0:255:11:1:	class=0x088000 card=0x78441849 chip=0x78448086 rev=0x10 hdr=0x00
    vendor     = 'Intel Corporation'
    class      = base peripheral
    cap 10[40] = PCI-Express 2 root endpoint max data 128(128)

none141@pci0:255:11:2:	class=0x088000 card=0x781f1849 chip=0x781f8086 rev=0x10 hdr=0x00
    vendor     = 'Intel Corporation'
    class      = base peripheral

none142@pci0:255:12:0:	class=0x088000 card=0x78161849 chip=0x78168086 rev=0x10 hdr=0x00
    vendor     = 'Intel Corporation'
    class      = base peripheral

none143@pci0:255:12:1:	class=0x110100 card=0x78171849 chip=0x78178086 rev=0x10 hdr=0x00
    vendor     = 'Intel Corporation'
    class      = dasp
    subclass   = performance counters

none144@pci0:255:12:2:	class=0x088000 card=0x781f1849 chip=0x781f8086 rev=0x10 hdr=0x00
    vendor     = 'Intel Corporation'
    class      = base peripheral

none145@pci0:255:15:0:	class=0x088000 card=0x78331849 chip=0x78338086 rev=0x10 hdr=0x00
    vendor     = 'Intel Corporation'
    class      = base peripheral

none146@pci0:255:15:1:	class=0x088000 card=0x78391849 chip=0x78398086 rev=0x10 hdr=0x00
    vendor     = 'Intel Corporation'
    class      = base peripheral

none147@pci0:255:15:2:	class=0x088000 card=0x781f1849 chip=0x781f8086 rev=0x10 hdr=0x00
    vendor     = 'Intel Corporation'
    class      = base peripheral

none148@pci0:255:16:0:	class=0x088000 card=0x78331849 chip=0x78338086 rev=0x10 hdr=0x00
    vendor     = 'Intel Corporation'
    class      = base peripheral

none149@pci0:255:16:1:	class=0x088000 card=0x78391849 chip=0x78398086 rev=0x10 hdr=0x00
    vendor     = 'Intel Corporation'
    class      = base peripheral

none150@pci0:255:16:2:	class=0x088000 card=0x781f1849 chip=0x781f8086 rev=0x10 hdr=0x00
    vendor     = 'Intel Corporation'
    class      = base peripheral

none151@pci0:255:16:5:	class=0x088000 card=0x00000000 chip=0x78488086 rev=0x10 hdr=0x00
    vendor     = 'Intel Corporation'
    class      = base peripheral

none152@pci0:255:16:6:	class=0x088000 card=0x00000000 chip=0x78488086 rev=0x10 hdr=0x00
    vendor     = 'Intel Corporation'
    class      = base peripheral

none153@pci0:255:16:7:	class=0x088000 card=0x00000000 chip=0x78488086 rev=0x10 hdr=0x00
    vendor     = 'Intel Corporation'
    class      = base peripheral

none154@pci0:255:17:0:	class=0x088000 card=0x78331849 chip=0x78338086 rev=0x10 hdr=0x00
    vendor     = 'Intel Corporation'
    class      = base peripheral

none155@pci0:255:17:1:	class=0x088000 card=0x78391849 chip=0x78398086 rev=0x10 hdr=0x00
    vendor     = 'Intel Corporation'
    class      = base peripheral

none156@pci0:255:17:2:	class=0x088000 card=0x781f1849 chip=0x781f8086 rev=0x10 hdr=0x00
    vendor     = 'Intel Corporation'
    class      = base peripheral

none157@pci0:255:17:5:	class=0x088000 card=0x00000000 chip=0x78498086 rev=0x10 hdr=0x00
    vendor     = 'Intel Corporation'
    class      = base peripheral

none158@pci0:255:17:6:	class=0x088000 card=0x00000000 chip=0x78498086 rev=0x10 hdr=0x00
    vendor     = 'Intel Corporation'
    class      = base peripheral

none159@pci0:255:17:7:	class=0x088000 card=0x00000000 chip=0x78498086 rev=0x10 hdr=0x00
    vendor     = 'Intel Corporation'
    class      = base peripheral

none160@pci0:255:18:0:	class=0x088000 card=0x78331849 chip=0x78338086 rev=0x10 hdr=0x00
    vendor     = 'Intel Corporation'
    class      = base peripheral

none161@pci0:255:18:1:	class=0x088000 card=0x78391849 chip=0x78398086 rev=0x10 hdr=0x00
    vendor     = 'Intel Corporation'
    class      = base peripheral

none162@pci0:255:18:2:	class=0x088000 card=0x781f1849 chip=0x781f8086 rev=0x10 hdr=0x00
    vendor     = 'Intel Corporation'
    class      = base peripheral

none163@pci0:255:18:5:	class=0x088000 card=0x00000000 chip=0x78488086 rev=0x10 hdr=0x00
    vendor     = 'Intel Corporation'
    class      = base peripheral

none164@pci0:255:18:6:	class=0x088000 card=0x00000000 chip=0x78488086 rev=0x10 hdr=0x00
    vendor     = 'Intel Corporation'
    class      = base peripheral

none165@pci0:255:18:7:	class=0x088000 card=0x00000000 chip=0x78488086 rev=0x10 hdr=0x00
    vendor     = 'Intel Corporation'
    class      = base peripheral

none166@pci0:255:19:0:	class=0x088000 card=0x78331849 chip=0x78338086 rev=0x10 hdr=0x00
    vendor     = 'Intel Corporation'
    class      = base peripheral

none167@pci0:255:19:1:	class=0x088000 card=0x78391849 chip=0x78398086 rev=0x10 hdr=0x00
    vendor     = 'Intel Corporation'
    class      = base peripheral

none168@pci0:255:19:2:	class=0x088000 card=0x781f1849 chip=0x781f8086 rev=0x10 hdr=0x00
    vendor     = 'Intel Corporation'
    class      = base peripheral

none169@pci0:255:19:5:	class=0x088000 card=0x00000000 chip=0x78498086 rev=0x10 hdr=0x00
    vendor     = 'Intel Corporation'
    class      = base peripheral

none170@pci0:255:19:6:	class=0x088000 card=0x00000000 chip=0x78498086 rev=0x10 hdr=0x00
    vendor     = 'Intel Corporation'
    class      = base peripheral

none171@pci0:255:19:7:	class=0x088000 card=0x00000000 chip=0x78498086 rev=0x10 hdr=0x00
    vendor     = 'Intel Corporation'
    class      = base peripheral

none172@pci0:255:20:0:	class=0x088000 card=0x78331849 chip=0x78338086 rev=0x10 hdr=0x00
    vendor     = 'Intel Corporation'
    class      = base peripheral

none173@pci0:255:20:1:	class=0x088000 card=0x78391849 chip=0x78398086 rev=0x10 hdr=0x00
    vendor     = 'Intel Corporation'
    class      = base peripheral

none174@pci0:255:20:2:	class=0x088000 card=0x781f1849 chip=0x781f8086 rev=0x10 hdr=0x00
    vendor     = 'Intel Corporation'
    class      = base peripheral

none175@pci0:255:20:6:	class=0x088000 card=0x00000000 chip=0x78458086 rev=0x10 hdr=0x00
    vendor     = 'Intel Corporation'
    class      = base peripheral

none176@pci0:255:20:7:	class=0x088000 card=0x00000000 chip=0x78468086 rev=0x10 hdr=0x00
    vendor     = 'Intel Corporation'
    class      = base peripheral

none177@pci0:255:21:0:	class=0x088000 card=0x78331849 chip=0x78338086 rev=0x10 hdr=0x00
    vendor     = 'Intel Corporation'
    class      = base peripheral

none178@pci0:255:21:1:	class=0x088000 card=0x78391849 chip=0x78398086 rev=0x10 hdr=0x00
    vendor     = 'Intel Corporation'
    class      = base peripheral

none179@pci0:255:21:2:	class=0x088000 card=0x781f1849 chip=0x781f8086 rev=0x10 hdr=0x00
    vendor     = 'Intel Corporation'
    class      = base peripheral

none180@pci0:255:21:6:	class=0x088000 card=0x00000000 chip=0x78458086 rev=0x10 hdr=0x00
    vendor     = 'Intel Corporation'
    class      = base peripheral

none181@pci0:255:21:7:	class=0x088000 card=0x00000000 chip=0x78478086 rev=0x10 hdr=0x00
    vendor     = 'Intel Corporation'
    class      = base peripheral

none182@pci0:255:22:0:	class=0x088000 card=0x78331849 chip=0x78338086 rev=0x10 hdr=0x00
    vendor     = 'Intel Corporation'
    class      = base peripheral

none183@pci0:255:22:1:	class=0x088000 card=0x78391849 chip=0x78398086 rev=0x10 hdr=0x00
    vendor     = 'Intel Corporation'
    class      = base peripheral

none184@pci0:255:22:2:	class=0x088000 card=0x781f1849 chip=0x781f8086 rev=0x10 hdr=0x00
    vendor     = 'Intel Corporation'
    class      = base peripheral

none185@pci0:255:24:0:	class=0x088000 card=0x78311849 chip=0x78318086 rev=0x10 hdr=0x00
    vendor     = 'Intel Corporation'
    class      = base peripheral
    cap 10[40] = PCI-Express 2 root endpoint max data 128(128)

none186@pci0:255:24:1:	class=0x088000 card=0x78371849 chip=0x78378086 rev=0x10 hdr=0x00
    vendor     = 'Intel Corporation'
    class      = base peripheral

none187@pci0:255:24:2:	class=0x088000 card=0x78351849 chip=0x78358086 rev=0x10 hdr=0x00
    vendor     = 'Intel Corporation'
    class      = base peripheral
    cap 10[40] = PCI-Express 2 root endpoint max data 128(128)

none188@pci0:255:25:0:	class=0x088000 card=0x78311849 chip=0x78318086 rev=0x10 hdr=0x00
    vendor     = 'Intel Corporation'
    class      = base peripheral
    cap 10[40] = PCI-Express 2 root endpoint max data 128(128)

none189@pci0:255:25:1:	class=0x088000 card=0x78371849 chip=0x78378086 rev=0x10 hdr=0x00
    vendor     = 'Intel Corporation'
    class      = base peripheral

none190@pci0:255:25:2:	class=0x088000 card=0x78351849 chip=0x78358086 rev=0x10 hdr=0x00
    vendor     = 'Intel Corporation'
    class      = base peripheral
    cap 10[40] = PCI-Express 2 root endpoint max data 128(128)

none191@pci0:255:26:0:	class=0x088000 card=0x78311849 chip=0x78318086 rev=0x10 hdr=0x00
    vendor     = 'Intel Corporation'
    class      = base peripheral
    cap 10[40] = PCI-Express 2 root endpoint max data 128(128)

none192@pci0:255:26:1:	class=0x088000 card=0x78371849 chip=0x78378086 rev=0x10 hdr=0x00
    vendor     = 'Intel Corporation'
    class      = base peripheral

none193@pci0:255:26:2:	class=0x088000 card=0x78351849 chip=0x78358086 rev=0x10 hdr=0x00
    vendor     = 'Intel Corporation'
    class      = base peripheral
    cap 10[40] = PCI-Express 2 root endpoint max data 128(128)

none194@pci0:255:27:0:	class=0x088000 card=0x78311849 chip=0x78318086 rev=0x10 hdr=0x00
    vendor     = 'Intel Corporation'
    class      = base peripheral
    cap 10[40] = PCI-Express 2 root endpoint max data 128(128)

none195@pci0:255:27:1:	class=0x088000 card=0x78371849 chip=0x78378086 rev=0x10 hdr=0x00
    vendor     = 'Intel Corporation'
    class      = base peripheral

none196@pci0:255:27:2:	class=0x088000 card=0x78351849 chip=0x78358086 rev=0x10 hdr=0x00
    vendor     = 'Intel Corporation'
    class      = base peripheral
    cap 10[40] = PCI-Express 2 root endpoint max data 128(128)

none197@pci0:255:28:0:	class=0x088000 card=0x78311849 chip=0x78318086 rev=0x10 hdr=0x00
    vendor     = 'Intel Corporation'
    class      = base peripheral
    cap 10[40] = PCI-Express 2 root endpoint max data 128(128)

none198@pci0:255:28:1:	class=0x088000 card=0x78371849 chip=0x78378086 rev=0x10 hdr=0x00
    vendor     = 'Intel Corporation'
    class      = base peripheral

none199@pci0:255:28:2:	class=0x088000 card=0x78351849 chip=0x78358086 rev=0x10 hdr=0x00
    vendor     = 'Intel Corporation'
    class      = base peripheral
    cap 10[40] = PCI-Express 2 root endpoint max data 128(128)

none200@pci0:255:29:0:	class=0x088000 card=0x78311849 chip=0x78318086 rev=0x10 hdr=0x00
    vendor     = 'Intel Corporation'
    class      = base peripheral
    cap 10[40] = PCI-Express 2 root endpoint max data 128(128)

none201@pci0:255:29:1:	class=0x088000 card=0x78371849 chip=0x78378086 rev=0x10 hdr=0x00
    vendor     = 'Intel Corporation'
    class      = base peripheral

none202@pci0:255:29:2:	class=0x088000 card=0x78351849 chip=0x78358086 rev=0x10 hdr=0x00
    vendor     = 'Intel Corporation'
    class      = base peripheral
    cap 10[40] = PCI-Express 2 root endpoint max data 128(128)

none203@pci0:255:30:0:	class=0x088000 card=0x78311849 chip=0x78318086 rev=0x10 hdr=0x00
    vendor     = 'Intel Corporation'
    class      = base peripheral
    cap 10[40] = PCI-Express 2 root endpoint max data 128(128)

none204@pci0:255:30:1:	class=0x088000 card=0x78371849 chip=0x78378086 rev=0x10 hdr=0x00
    vendor     = 'Intel Corporation'
    class      = base peripheral

none205@pci0:255:30:2:	class=0x088000 card=0x78351849 chip=0x78358086 rev=0x10 hdr=0x00
    vendor     = 'Intel Corporation'
    class      = base peripheral
    cap 10[40] = PCI-Express 2 root endpoint max data 128(128)

none206@pci0:255:31:0:	class=0x088000 card=0x78311849 chip=0x78318086 rev=0x10 hdr=0x00
    vendor     = 'Intel Corporation'
    class      = base peripheral
    cap 10[40] = PCI-Express 2 root endpoint max data 128(128)

none207@pci0:255:31:1:	class=0x088000 card=0x78371849 chip=0x78378086 rev=0x10 hdr=0x00
    vendor     = 'Intel Corporation'
    class      = base peripheral

none208@pci0:255:31:2:	class=0x088000 card=0x78351849 chip=0x78358086 rev=0x10 hdr=0x00
    vendor     = 'Intel Corporation'
    class      = base peripheral
    cap 10[40] = PCI-Express 2 root endpoint max data 128(128)

hostb0@pci0:0:0:0:	class=0x060000 card=0x780e1849 chip=0x783c8086 rev=0x10 hdr=0x00
    vendor     = 'Intel Corporation'
    class      = bridge
    subclass   = HOST-PCI
    cap 10[90] = PCI-Express 2 root port max data 128(128)
                 link x0(x4) speed 0.0(2.5) ASPM disabled(L1)
    cap 01[e0] = powerspec 3  supports D0 D3  current D0
    ecap 000b[100] = Vendor 1 ID 2
    ecap 000b[144] = Vendor 1 ID 4
    ecap 000b[1d0] = Vendor 1 ID 3
    ecap 0019[250] = PCIe Sec 1 lane errors 0xf
    ecap 000b[280] = Vendor 1 ID 5
    ecap 000b[298] = Vendor 1 ID 7

pcib3@pci0:0:0:2:	class=0x060400 card=0x78081849 chip=0x78088086 rev=0x10 hdr=0x01
    vendor     = 'Intel Corporation'
    class      = bridge
    subclass   = PCI-PCI
    cap 0d[40] = PCI Bridge card=0x78081849
    cap 05[60] = MSI supports 2 messages, vector masks 
    cap 10[90] = PCI-Express 2 root port max data 256(256) ARI enabled
                 link x4(x4) speed 5.0(8.0) ASPM L1(L1)
                 slot 2 power limit 0 mW Attn Button PC(on)
    cap 01[e0] = powerspec 3  supports D0 D3  current D0
    ecap 000b[100] = Vendor 1 ID 2
    ecap 000d[110] = ACS 1
    ecap 0001[148] = AER 1 0 fatal 0 non-fatal 0 corrected
    ecap 000b[1d0] = Vendor 1 ID 3
    ecap 0019[250] = PCIe Sec 1 lane errors 0xf
    ecap 000b[280] = Vendor 1 ID 5
    ecap 000b[298] = Vendor 1 ID 7

none209@pci0:0:5:0:	class=0x088000 card=0x78101849 chip=0x78108086 rev=0x10 hdr=0x00
    vendor     = 'Intel Corporation'
    class      = base peripheral
    cap 10[40] = PCI-Express 2 root endpoint max data 128(128)
    cap 00[e0] = unknown

none210@pci0:0:5:2:	class=0x088000 card=0x78121849 chip=0x78128086 rev=0x10 hdr=0x00
    vendor     = 'Intel Corporation'
    class      = base peripheral
    cap 10[40] = PCI-Express 2 root endpoint max data 128(128) NS

ioapic0@pci0:0:5:4:	class=0x080020 card=0x78131849 chip=0x78138086 rev=0x10 hdr=0x00
    vendor     = 'Intel Corporation'
    class      = base peripheral
    subclass   = interrupt controller
    bar   [10] = type Memory, range 32, base 0xfb219000, size 4096, enabled
    cap 10[44] = PCI-Express 1 root endpoint max data 128(128)
    cap 01[e0] = powerspec 3  supports D0 D3  current D0

none211@pci0:0:5:6:	class=0x110100 card=0x78141849 chip=0x78148086 rev=0x10 hdr=0x00
    vendor     = 'Intel Corporation'
    class      = dasp
    subclass   = performance counters
    cap 10[40] = PCI-Express 2 root endpoint max data 128(128)

none212@pci0:0:8:0:	class=0x088000 card=0x781a1849 chip=0x781a8086 rev=0x10 hdr=0x00
    vendor     = 'Intel Corporation'
    class      = base peripheral

none213@pci0:0:8:1:	class=0x110100 card=0x781b1849 chip=0x781b8086 rev=0x10 hdr=0x00
    vendor     = 'Intel Corporation'
    class      = dasp
    subclass   = performance counters

none214@pci0:0:8:2:	class=0x088000 card=0x781c1849 chip=0x781c8086 rev=0x10 hdr=0x00
    vendor     = 'Intel Corporation'
    class      = base peripheral

none215@pci0:0:17:0:	class=0xff0000 card=0x8d7c1849 chip=0x8d7c8086 rev=0x05 hdr=0x00
    vendor     = 'Intel Corporation'
    device     = 'C610/X99 series chipset SPSR'
    cap 10[40] = PCI-Express 2 root endpoint max data 128(128)
                 link x1(x1) speed 2.5(2.5) ASPM disabled(L0s/L1)
    cap 01[80] = powerspec 3  supports D0 D3  current D0

ahci0@pci0:0:17:4:	class=0x010601 card=0x8d621849 chip=0x8d628086 rev=0x05 hdr=0x00
    vendor     = 'Intel Corporation'
    device     = 'C610/X99 series chipset sSATA Controller [AHCI mode]'
    class      = mass storage
    subclass   = SATA
    bar   [10] = type I/O Port, range 32, base 0xf130, size 8, enabled
    bar   [14] = type I/O Port, range 32, base 0xf120, size 4, enabled
    bar   [18] = type I/O Port, range 32, base 0xf110, size 8, enabled
    bar   [1c] = type I/O Port, range 32, base 0xf100, size 4, enabled
    bar   [20] = type I/O Port, range 32, base 0xf040, size 32, enabled
    bar   [24] = type Memory, range 32, base 0xfb218000, size 2048, enabled
    cap 05[80] = MSI supports 1 message enabled with 1 message
    cap 01[70] = powerspec 3  supports D0 D3  current D0
    cap 12[a8] = SATA Index-Data Pair

xhci0@pci0:0:20:0:	class=0x0c0330 card=0x8d311849 chip=0x8d318086 rev=0x05 hdr=0x00
    vendor     = 'Intel Corporation'
    device     = 'C610/X99 series chipset USB xHCI Host Controller'
    class      = serial bus
    subclass   = USB
    bar   [10] = type Memory, range 64, base 0xfb200000, size 65536, enabled
    cap 01[70] = powerspec 2  supports D0 D3  current D0
    cap 05[80] = MSI supports 8 messages, 64 bit enabled with 1 message

none216@pci0:0:22:0:	class=0x078000 card=0x8d3a1849 chip=0x8d3a8086 rev=0x05 hdr=0x00
    vendor     = 'Intel Corporation'
    device     = 'C610/X99 series chipset MEI Controller'
    class      = simple comms
    bar   [10] = type Memory, range 64, base 0xfb217000, size 16, enabled
    cap 01[50] = powerspec 3  supports D0 D3  current D0
    cap 05[8c] = MSI supports 1 message, 64 bit 

none217@pci0:0:22:1:	class=0x078000 card=0x8d3b1849 chip=0x8d3b8086 rev=0x05 hdr=0x00
    vendor     = 'Intel Corporation'
    device     = 'C610/X99 series chipset MEI Controller'
    class      = simple comms
    bar   [10] = type Memory, range 64, base 0xfb216000, size 16, enabled
    cap 01[50] = powerspec 3  supports D0 D3  current D0
    cap 05[8c] = MSI supports 1 message, 64 bit 

ehci0@pci0:0:26:0:	class=0x0c0320 card=0x8d2d1849 chip=0x8d2d8086 rev=0x05 hdr=0x00
    vendor     = 'Intel Corporation'
    device     = 'C610/X99 series chipset USB Enhanced Host Controller'
    class      = serial bus
    subclass   = USB
    bar   [10] = type Memory, range 32, base 0xfb214000, size 1024, enabled
    cap 01[50] = powerspec 2  supports D0 D3  current D0
    cap 0a[58] = EHCI Debug Port at offset 0xa0 in map 0x14
    cap 13[98] = PCI Advanced Features: FLR TP

pcib4@pci0:0:28:0:	class=0x060400 card=0x8d101849 chip=0x8d108086 rev=0xd5 hdr=0x01
    vendor     = 'Intel Corporation'
    device     = 'C610/X99 series chipset PCI Express Root Port'
    class      = bridge
    subclass   = PCI-PCI
    cap 10[40] = PCI-Express 2 root port max data 128(128)
                 link x0(x1) speed 0.0(5.0) ASPM disabled(L0s/L1)
    cap 05[80] = MSI supports 1 message 
    cap 0d[90] = PCI Bridge card=0x8d101849
    cap 01[a0] = powerspec 3  supports D0 D3  current D0

pcib5@pci0:0:28:1:	class=0x060400 card=0x8d121849 chip=0x8d128086 rev=0xd5 hdr=0x01
    vendor     = 'Intel Corporation'
    device     = 'C610/X99 series chipset PCI Express Root Port'
    class      = bridge
    subclass   = PCI-PCI
    cap 10[40] = PCI-Express 2 root port max data 128(128)
                 link x1(x1) speed 2.5(5.0) ASPM disabled(L0s/L1)
                 slot 1 power limit 100 mW
    cap 05[80] = MSI supports 1 message enabled with 1 message
    cap 0d[90] = PCI Bridge card=0x8d121849
    cap 01[a0] = powerspec 3  supports D0 D3  current D0

ehci1@pci0:0:29:0:	class=0x0c0320 card=0x8d261849 chip=0x8d268086 rev=0x05 hdr=0x00
    vendor     = 'Intel Corporation'
    device     = 'C610/X99 series chipset USB Enhanced Host Controller'
    class      = serial bus
    subclass   = USB
    bar   [10] = type Memory, range 32, base 0xfb213000, size 1024, enabled
    cap 01[50] = powerspec 2  supports D0 D3  current D0
    cap 0a[58] = EHCI Debug Port at offset 0xa0 in map 0x14
    cap 13[98] = PCI Advanced Features: FLR TP

isab0@pci0:0:31:0:	class=0x060100 card=0x8d441849 chip=0x8d448086 rev=0x05 hdr=0x00
    vendor     = 'Intel Corporation'
    device     = 'C610/X99 series chipset LPC Controller'
    class      = bridge
    subclass   = PCI-ISA
    cap 09[e0] = vendor (length 12) Intel cap 1 version 0
		 features: AMT, 4 PCI-e x1 slots

ahci1@pci0:0:31:2:	class=0x010601 card=0x8d021849 chip=0x8d028086 rev=0x05 hdr=0x00
    vendor     = 'Intel Corporation'
    device     = 'C610/X99 series chipset 6-Port SATA Controller [AHCI mode]'
    class      = mass storage
    subclass   = SATA
    bar   [10] = type I/O Port, range 32, base 0xf090, size 8, enabled
    bar   [14] = type I/O Port, range 32, base 0xf080, size 4, enabled
    bar   [18] = type I/O Port, range 32, base 0xf070, size 8, enabled
    bar   [1c] = type I/O Port, range 32, base 0xf060, size 4, enabled
    bar   [20] = type I/O Port, range 32, base 0xf020, size 32, enabled
    bar   [24] = type Memory, range 32, base 0xfb212000, size 2048, enabled
    cap 05[80] = MSI supports 1 message enabled with 1 message
    cap 01[70] = powerspec 3  supports D0 D3  current D0
    cap 12[a8] = SATA Index-Data Pair

none218@pci0:0:31:3:	class=0x0c0500 card=0x8d221849 chip=0x8d228086 rev=0x05 hdr=0x00
    vendor     = 'Intel Corporation'
    device     = 'C610/X99 series chipset SMBus Controller'
    class      = serial bus
    subclass   = SMBus
    bar   [10] = type Memory, range 64, base 0xfb211000, size 256, enabled
    bar   [20] = type I/O Port, range 32, base 0xf000, size 32, enabled

none219@pci0:0:31:6:	class=0x118000 card=0x00001849 chip=0x8d248086 rev=0x05 hdr=0x00
    vendor     = 'Intel Corporation'
    device     = 'C610/X99 series chipset Thermal Subsystem'
    class      = dasp
    bar   [10] = type Memory, range 64, base 0xfb210000, size 4096, enabled
    cap 01[50] = powerspec 3  supports D0 D3  current D0
    cap 05[80] = MSI supports 1 message 

igb0@pci0:1:0:0:	class=0x020000 card=0x15211849 chip=0x15218086 rev=0x01 hdr=0x00
    vendor     = 'Intel Corporation'
    device     = 'I350 Gigabit Network Connection'
    class      = network
    subclass   = ethernet
    bar   [10] = type Memory, range 32, base 0xfb120000, size 131072, enabled
    bar   [18] = type I/O Port, range 32, base 0xe020, size 32, enabled
    bar   [1c] = type Memory, range 32, base 0xfb144000, size 16384, enabled
    cap 01[40] = powerspec 3  supports D0 D3  current D0
    cap 05[50] = MSI supports 1 message, 64 bit, vector masks 
    cap 11[70] = MSI-X supports 10 messages, enabled
                 Table in map 0x1c[0x0], PBA in map 0x1c[0x2000]
    cap 10[a0] = PCI-Express 2 endpoint max data 256(512) FLR NS
                 link x4(x4) speed 5.0(5.0) ASPM L1(L0s/L1)
    ecap 0001[100] = AER 2 0 fatal 0 non-fatal 1 corrected
    ecap 0003[140] = Serial 1 d05099ffffd05f75
    ecap 000e[150] = ARI 1
    ecap 0010[160] = SR-IOV 1 IOV disabled, Memory Space disabled, ARI disabled
                     0 VFs configured out of 8 supported
                     First VF RID Offset 0x0180, VF RID Stride 0x0004
                     VF Device ID 0x1520
                     Page Sizes: 4096 (enabled), 8192, 65536, 262144, 1048576, 4194304
    ecap 0017[1a0] = TPH Requester 1
    ecap 0018[1c0] = LTR 1
    ecap 000d[1d0] = ACS 1

igb1@pci0:1:0:1:	class=0x020000 card=0x15211849 chip=0x15218086 rev=0x01 hdr=0x00
    vendor     = 'Intel Corporation'
    device     = 'I350 Gigabit Network Connection'
    class      = network
    subclass   = ethernet
    bar   [10] = type Memory, range 32, base 0xfb100000, size 131072, enabled
    bar   [18] = type I/O Port, range 32, base 0xe000, size 32, enabled
    bar   [1c] = type Memory, range 32, base 0xfb140000, size 16384, enabled
    cap 01[40] = powerspec 3  supports D0 D3  current D0
    cap 05[50] = MSI supports 1 message, 64 bit, vector masks 
    cap 11[70] = MSI-X supports 10 messages, enabled
                 Table in map 0x1c[0x0], PBA in map 0x1c[0x2000]
    cap 10[a0] = PCI-Express 2 endpoint max data 256(512) FLR NS
                 link x4(x4) speed 5.0(5.0) ASPM L1(L0s/L1)
    ecap 0001[100] = AER 2 0 fatal 0 non-fatal 1 corrected
    ecap 0003[140] = Serial 1 d05099ffffd05f75
    ecap 000e[150] = ARI 1
    ecap 0010[160] = SR-IOV 1 IOV disabled, Memory Space disabled, ARI disabled
                     0 VFs configured out of 8 supported
                     First VF RID Offset 0x0180, VF RID Stride 0x0004
                     VF Device ID 0x1520
                     Page Sizes: 4096 (enabled), 8192, 65536, 262144, 1048576, 4194304
    ecap 0017[1a0] = TPH Requester 1
    ecap 000d[1d0] = ACS 1

pcib6@pci0:4:0:0:	class=0x060400 card=0x11501849 chip=0x11501a03 rev=0x03 hdr=0x01
    vendor     = 'ASPEED Technology, Inc.'
    device     = 'AST1150 PCI-to-PCI Bridge'
    class      = bridge
    subclass   = PCI-PCI
    cap 05[50] = MSI supports 1 message, 64 bit 
    cap 01[78] = powerspec 3  supports D0 D1 D2 D3  current D0
    cap 10[80] = PCI-Express 1 PCI bridge max data 128(128) NS
                 link x1(x1) speed 2.5(2.5) ASPM disabled(L0s/L1)
    cap 0d[a4] = PCI Bridge card=0x11501849
    ecap 0002[100] = VC 1 max VC0
    ecap 0001[800] = AER 1 0 fatal 0 non-fatal 0 corrected

vgapci0@pci0:5:0:0:	class=0x030000 card=0x20001849 chip=0x20001a03 rev=0x30 hdr=0x00
    vendor     = 'ASPEED Technology, Inc.'
    device     = 'ASPEED Graphics Family'
    class      = display
    subclass   = VGA
    bar   [10] = type Memory, range 32, base 0xfa000000, size 16777216, enabled
    bar   [14] = type Memory, range 32, base 0xfb000000, size 131072, enabled
    bar   [18] = type I/O Port, range 32, base 0xd000, size 128, enabled
    cap 01[40] = powerspec 3  supports D0 D1 D2 D3  current D0
    cap 05[50] = MSI supports 4 messages, 64 bit 
