hostb0@pci0:0:0:0:	class=0x060000 card=0x50001458 chip=0x29c08086 rev=0x02 hdr=0x00
    vendor     = 'Intel Corporation'
    device     = '82G33/G31/P35/P31 Express DRAM Controller'
    class      = bridge
    subclass   = HOST-PCI
    cap 09[e0] = vendor (length 11) Intel cap 0 version 1

pcib1@pci0:0:1:0:	class=0x060400 card=0x50001458 chip=0x29c18086 rev=0x02 hdr=0x01
    vendor     = 'Intel Corporation'
    device     = '82G33/G31/P35/P31 Express PCI Express Root Port'
    class      = bridge
    subclass   = PCI-PCI
    cap 0d[88] = PCI Bridge card=0x50001458
    cap 01[80] = powerspec 3  supports D0 D3  current D0
    cap 05[90] = MSI supports 1 message 
    cap 10[a0] = PCI-Express 1 root port max data 128(128)
                 link x16(x16) speed 2.5(2.5) ASPM disabled(L0s)
                 slot 32 power limit 75000 mW
    ecap 0002[100] = VC 1 max VC0
    ecap 0005[140] = Root Complex Link Declaration 1

uhci0@pci0:0:26:0:	class=0x0c0300 card=0x50041458 chip=0x29378086 rev=0x02 hdr=0x00
    vendor     = 'Intel Corporation'
    device     = '82801I (ICH9 Family) USB UHCI Controller'
    class      = serial bus
    subclass   = USB
    bar   [20] = type I/O Port, range 32, base 0xe200, size 32, enabled
    cap 13[50] = PCI Advanced Features: FLR TP

uhci1@pci0:0:26:1:	class=0x0c0300 card=0x50041458 chip=0x29388086 rev=0x02 hdr=0x00
    vendor     = 'Intel Corporation'
    device     = '82801I (ICH9 Family) USB UHCI Controller'
    class      = serial bus
    subclass   = USB
    bar   [20] = type I/O Port, range 32, base 0xe000, size 32, enabled
    cap 13[50] = PCI Advanced Features: FLR TP

uhci2@pci0:0:26:2:	class=0x0c0300 card=0x50041458 chip=0x29398086 rev=0x02 hdr=0x00
    vendor     = 'Intel Corporation'
    device     = '82801I (ICH9 Family) USB UHCI Controller'
    class      = serial bus
    subclass   = USB
    bar   [20] = type I/O Port, range 32, base 0xe100, size 32, enabled
    cap 13[50] = PCI Advanced Features: FLR TP

ehci0@pci0:0:26:7:	class=0x0c0320 card=0x50061458 chip=0x293c8086 rev=0x02 hdr=0x00
    vendor     = 'Intel Corporation'
    device     = '82801I (ICH9 Family) USB2 EHCI Controller'
    class      = serial bus
    subclass   = USB
    bar   [10] = type Memory, range 32, base 0xf9000000, size 1024, enabled
    cap 01[50] = powerspec 2  supports D0 D3  current D0

pcib2@pci0:0:28:0:	class=0x060400 card=0x50011458 chip=0x29408086 rev=0x02 hdr=0x01
    vendor     = 'Intel Corporation'
    device     = '82801I (ICH9 Family) PCI Express Port 1'
    class      = bridge
    subclass   = PCI-PCI
    cap 10[40] = PCI-Express 1 root port max data 128(128)
                 link x0(x1) speed 0.0(2.5) ASPM disabled(L0s)
                 slot 16 power limit 10000 mW HotPlug(empty) surprise
    cap 05[80] = MSI supports 1 message enabled with 1 message
    cap 0d[90] = PCI Bridge card=0x50011458
    cap 01[a0] = powerspec 2  supports D0 D3  current D0
    ecap 0002[100] = VC 1 max VC0
    ecap 0005[180] = Root Complex Link Declaration 1

pcib3@pci0:0:28:3:	class=0x060400 card=0x50011458 chip=0x29468086 rev=0x02 hdr=0x01
    vendor     = 'Intel Corporation'
    device     = '82801I (ICH9 Family) PCI Express Port 4'
    class      = bridge
    subclass   = PCI-PCI
    cap 10[40] = PCI-Express 1 root port max data 128(128)
                 link x0(x1) speed 0.0(2.5) ASPM disabled(L0s)
                 slot 19 power limit 10000 mW HotPlug(present) surprise
    cap 05[80] = MSI supports 1 message enabled with 1 message
    cap 0d[90] = PCI Bridge card=0x50011458
    cap 01[a0] = powerspec 2  supports D0 D3  current D0
    ecap 0002[100] = VC 1 max VC0
    ecap 0005[180] = Root Complex Link Declaration 1

pcib4@pci0:0:28:4:	class=0x060400 card=0x50011458 chip=0x29488086 rev=0x02 hdr=0x01
    vendor     = 'Intel Corporation'
    device     = '82801I (ICH9 Family) PCI Express Port 5'
    class      = bridge
    subclass   = PCI-PCI
    cap 10[40] = PCI-Express 1 root port max data 128(128)
                 link x1(x1) speed 2.5(2.5) ASPM disabled(L0s)
                 slot 20 power limit 10000 mW HotPlug(present) surprise
    cap 05[80] = MSI supports 1 message enabled with 1 message
    cap 0d[90] = PCI Bridge card=0x50011458
    cap 01[a0] = powerspec 2  supports D0 D3  current D0
    ecap 0002[100] = VC 1 max VC0
    ecap 0005[180] = Root Complex Link Declaration 1

uhci3@pci0:0:29:0:	class=0x0c0300 card=0x50041458 chip=0x29348086 rev=0x02 hdr=0x00
    vendor     = 'Intel Corporation'
    device     = '82801I (ICH9 Family) USB UHCI Controller'
    class      = serial bus
    subclass   = USB
    bar   [20] = type I/O Port, range 32, base 0xe300, size 32, enabled
    cap 13[50] = PCI Advanced Features: FLR TP

uhci4@pci0:0:29:1:	class=0x0c0300 card=0x50041458 chip=0x29358086 rev=0x02 hdr=0x00
    vendor     = 'Intel Corporation'
    device     = '82801I (ICH9 Family) USB UHCI Controller'
    class      = serial bus
    subclass   = USB
    bar   [20] = type I/O Port, range 32, base 0xe400, size 32, enabled
    cap 13[50] = PCI Advanced Features: FLR TP

uhci5@pci0:0:29:2:	class=0x0c0300 card=0x50041458 chip=0x29368086 rev=0x02 hdr=0x00
    vendor     = 'Intel Corporation'
    device     = '82801I (ICH9 Family) USB UHCI Controller'
    class      = serial bus
    subclass   = USB
    bar   [20] = type I/O Port, range 32, base 0xe500, size 32, enabled
    cap 13[50] = PCI Advanced Features: FLR TP

ehci1@pci0:0:29:7:	class=0x0c0320 card=0x50061458 chip=0x293a8086 rev=0x02 hdr=0x00
    vendor     = 'Intel Corporation'
    device     = '82801I (ICH9 Family) USB2 EHCI Controller'
    class      = serial bus
    subclass   = USB
    bar   [10] = type Memory, range 32, base 0xf9001000, size 1024, enabled
    cap 01[50] = powerspec 2  supports D0 D3  current D0

pcib5@pci0:0:30:0:	class=0x060401 card=0x50001458 chip=0x244e8086 rev=0x92 hdr=0x01
    vendor     = 'Intel Corporation'
    device     = '82801 PCI Bridge'
    class      = bridge
    subclass   = PCI-PCI
    cap 0d[50] = PCI Bridge card=0x50001458

isab0@pci0:0:31:0:	class=0x060100 card=0x50011458 chip=0x29168086 rev=0x02 hdr=0x00
    vendor     = 'Intel Corporation'
    device     = '82801IR (ICH9R) LPC Interface Controller'
    class      = bridge
    subclass   = PCI-ISA
    cap 09[e0] = vendor (length 12) Intel cap 1 version 0
		 features: SATA RAID-5, 4 PCI-e x1 slots

ahci0@pci0:0:31:2:	class=0x010601 card=0xb0051458 chip=0x29228086 rev=0x02 hdr=0x00
    vendor     = 'Intel Corporation'
    device     = '82801IR/IO/IH (ICH9R/DO/DH) 6 port SATA Controller [AHCI mode]'
    class      = mass storage
    subclass   = SATA
    bar   [10] = type I/O Port, range 32, base 0xe600, size 8, enabled
    bar   [14] = type I/O Port, range 32, base 0xe700, size 4, enabled
    bar   [18] = type I/O Port, range 32, base 0xe800, size 8, enabled
    bar   [1c] = type I/O Port, range 32, base 0xe900, size 4, enabled
    bar   [20] = type I/O Port, range 32, base 0xea00, size 32, enabled
    bar   [24] = type Memory, range 32, base 0xf9002000, size 2048, enabled
    cap 05[80] = MSI supports 16 messages enabled with 16 messages
    cap 01[70] = powerspec 3  supports D0 D3  current D0
    cap 12[a8] = SATA Index-Data Pair
    cap 13[b0] = PCI Advanced Features: FLR TP

none0@pci0:0:31:3:	class=0x0c0500 card=0x50011458 chip=0x29308086 rev=0x02 hdr=0x00
    vendor     = 'Intel Corporation'
    device     = '82801I (ICH9 Family) SMBus Controller'
    class      = serial bus
    subclass   = SMBus
    bar   [10] = type Memory, range 64, base 0xf9003000, size 256, enabled
    bar   [20] = type I/O Port, range 32, base 0x500, size 32, enabled

vgapci0@pci0:1:0:0:	class=0x030000 card=0x040110b0 chip=0x108110de rev=0xa1 hdr=0x00
    vendor     = 'NVIDIA Corporation'
    device     = 'GF110 [GeForce GTX 570]'
    class      = display
    subclass   = VGA
    bar   [10] = type Memory, range 32, base 0xf4000000, size 16777216, enabled
    bar   [14] = type Prefetchable Memory, range 64, base 0xe0000000, size 134217728, enabled
    bar   [1c] = type Prefetchable Memory, range 64, base 0xe8000000, size 33554432, enabled
    bar   [24] = type I/O Port, range 32, base 0xc000, size 128, enabled
    cap 01[60] = powerspec 3  supports D0 D3  current D0
    cap 05[68] = MSI supports 1 message, 64 bit enabled with 1 message
    cap 10[78] = PCI-Express 2 endpoint max data 128(128) RO NS
                 link x16(x16) speed 2.5(2.5) ASPM disabled(L0s/L1)
    cap 09[b4] = vendor (length 20)
    ecap 0002[100] = VC 1 max VC0
    ecap 0004[128] = Power Budgeting 1
    ecap 000b[600] = Vendor 1 ID 1

hdac0@pci0:1:0:1:	class=0x040300 card=0x040110b0 chip=0x0e0910de rev=0xa1 hdr=0x00
    vendor     = 'NVIDIA Corporation'
    device     = 'GF110 High Definition Audio Controller'
    class      = multimedia
    subclass   = HDA
    bar   [10] = type Memory, range 32, base 0xf6000000, size 16384, enabled
    cap 01[60] = powerspec 3  supports D0 D3  current D0
    cap 05[68] = MSI supports 1 message, 64 bit 
    cap 10[78] = PCI-Express 2 endpoint max data 128(128) RO NS
                 link x16(x16) speed 2.5(2.5) ASPM L0s/L1(L0s/L1)

re0@pci0:4:0:0:	class=0x020000 card=0xe0001458 chip=0x816810ec rev=0x01 hdr=0x00
    vendor     = 'Realtek Semiconductor Co., Ltd.'
    device     = 'RTL8111/8168/8411 PCI Express Gigabit Ethernet Controller'
    class      = network
    subclass   = ethernet
    bar   [10] = type I/O Port, range 32, base 0xd000, size 256, enabled
    bar   [18] = type Memory, range 64, base 0xf8000000, size 4096, enabled
    cap 01[40] = powerspec 2  supports D0 D1 D2 D3  current D0
    cap 03[48] = VPD
    cap 05[50] = MSI supports 2 messages, 64 bit enabled with 1 message
    cap 10[60] = PCI-Express 1 endpoint max data 128(1024) RO NS
                 link x1(x1) speed 2.5(2.5) ASPM disabled(L0s)
    cap 09[84] = vendor (length 76)
    ecap 0001[100] = AER 1 0 fatal 2 non-fatal 0 corrected
    ecap 0002[12c] = VC 1 max VC0
    ecap 0003[148] = Serial 1 0000000010ec8168
    ecap 0004[154] = Power Budgeting 1
