hostb0@pci0:0:0:0:	class=0x060000 rev=0x02 hdr=0x00 vendor=0x8086 device=0x29c0 subvendor=0x1043 subdevice=0x8276
    vendor     = 'Intel Corporation'
    device     = '82G33/G31/P35/P31 Express DRAM Controller'
    class      = bridge
    subclass   = HOST-PCI
    cap 09[e0] = vendor (length 11) Intel cap 0 version 1

pcib1@pci0:0:1:0:	class=0x060400 rev=0x02 hdr=0x01 vendor=0x8086 device=0x29c1 subvendor=0x1043 subdevice=0x8276
    vendor     = 'Intel Corporation'
    device     = '82G33/G31/P35/P31 Express PCI Express Root Port'
    class      = bridge
    subclass   = PCI-PCI
    cap 0d[88] = PCI Bridge subvendor=0x1043 subdevice=0x8276
    cap 01[80] = powerspec 3  supports D0 D3  current D0
    cap 05[90] = MSI supports 1 message 
    cap 10[a0] = PCI-Express 1 root port max data 128(128)
                 max read 128
                 link x16(x16) speed 2.5(2.5) ASPM disabled(L0s)
                 slot 0 power limit 75000 mW
    ecap 0002[100] = VC 1 max VC0
    ecap 0005[140] = Root Complex Link Declaration 1

uhci0@pci0:0:26:0:	class=0x0c0300 rev=0x02 hdr=0x00 vendor=0x8086 device=0x2937 subvendor=0x1043 subdevice=0x8277
    vendor     = 'Intel Corporation'
    device     = '82801I (ICH9 Family) USB UHCI Controller'
    class      = serial bus
    subclass   = USB
    bar   [20] = type I/O Port, range 32, base 0xd800, size 32, enabled
    cap 09[50] = vendor (length 6) Intel cap 2 version 0

uhci1@pci0:0:26:1:	class=0x0c0300 rev=0x02 hdr=0x00 vendor=0x8086 device=0x2938 subvendor=0x1043 subdevice=0x8277
    vendor     = 'Intel Corporation'
    device     = '82801I (ICH9 Family) USB UHCI Controller'
    class      = serial bus
    subclass   = USB
    bar   [20] = type I/O Port, range 32, base 0xd880, size 32, enabled
    cap 09[50] = vendor (length 6) Intel cap 2 version 0

uhci2@pci0:0:26:2:	class=0x0c0300 rev=0x02 hdr=0x00 vendor=0x8086 device=0x2939 subvendor=0x1043 subdevice=0x8277
    vendor     = 'Intel Corporation'
    device     = '82801I (ICH9 Family) USB UHCI Controller'
    class      = serial bus
    subclass   = USB
    bar   [20] = type I/O Port, range 32, base 0xdc00, size 32, enabled
    cap 09[50] = vendor (length 6) Intel cap 2 version 0

ehci0@pci0:0:26:7:	class=0x0c0320 rev=0x02 hdr=0x00 vendor=0x8086 device=0x293c subvendor=0x1043 subdevice=0x8277
    vendor     = 'Intel Corporation'
    device     = '82801I (ICH9 Family) USB2 EHCI Controller'
    class      = serial bus
    subclass   = USB
    bar   [10] = type Memory, range 32, base 0xfbfffc00, size 1024, enabled
    cap 01[50] = powerspec 2  supports D0 D3  current D0
    cap 0a[58] = EHCI Debug Port at offset 0xa0 in map 0x14
    cap 09[98] = vendor (length 6) Intel cap 2 version 0

hdac0@pci0:0:27:0:	class=0x040300 rev=0x02 hdr=0x00 vendor=0x8086 device=0x293e subvendor=0x1043 subdevice=0x829f
    vendor     = 'Intel Corporation'
    device     = '82801I (ICH9 Family) HD Audio Controller'
    class      = multimedia
    subclass   = HDA
    bar   [10] = type Memory, range 64, base 0xfbff8000, size 16384, enabled
    cap 01[50] = powerspec 2  supports D0 D3  current D0
    cap 05[60] = MSI supports 1 message, 64 bit enabled with 1 message
    cap 10[70] = PCI-Express 1 root endpoint max data 128(128) FLR NS
                 max read 128
    ecap 0002[100] = VC 1 max VC1
    ecap 0005[130] = Root Complex Link Declaration 1

pcib2@pci0:0:28:0:	class=0x060400 rev=0x02 hdr=0x01 vendor=0x8086 device=0x2940 subvendor=0x1043 subdevice=0x8277
    vendor     = 'Intel Corporation'
    device     = '82801I (ICH9 Family) PCI Express Port 1'
    class      = bridge
    subclass   = PCI-PCI
    cap 10[40] = PCI-Express 1 root port max data 128(128)
                 max read 128
                 link x0(x1) speed 0.0(2.5) ASPM disabled(L0s/L1)
                 slot 0 power limit 10000 mW HotPlug(empty) surprise
    cap 05[80] = MSI supports 1 message enabled with 1 message
    cap 0d[90] = PCI Bridge subvendor=0x1043 subdevice=0x8277
    cap 01[a0] = powerspec 2  supports D0 D3  current D0
    ecap 0002[100] = VC 1 max VC0
    ecap 0005[180] = Root Complex Link Declaration 1

pcib3@pci0:0:28:4:	class=0x060400 rev=0x02 hdr=0x01 vendor=0x8086 device=0x2948 subvendor=0x1043 subdevice=0x8277
    vendor     = 'Intel Corporation'
    device     = '82801I (ICH9 Family) PCI Express Port 5'
    class      = bridge
    subclass   = PCI-PCI
    cap 10[40] = PCI-Express 1 root port max data 128(128)
                 max read 128
                 link x1(x1) speed 2.5(2.5) ASPM disabled(L0s/L1)
                 slot 0 power limit 10000 mW HotPlug(present) surprise
    cap 05[80] = MSI supports 1 message enabled with 1 message
    cap 0d[90] = PCI Bridge subvendor=0x1043 subdevice=0x8277
    cap 01[a0] = powerspec 2  supports D0 D3  current D0
    ecap 0002[100] = VC 1 max VC0
    ecap 0005[180] = Root Complex Link Declaration 1

pcib4@pci0:0:28:5:	class=0x060400 rev=0x02 hdr=0x01 vendor=0x8086 device=0x294a subvendor=0x1043 subdevice=0x8277
    vendor     = 'Intel Corporation'
    device     = '82801I (ICH9 Family) PCI Express Port 6'
    class      = bridge
    subclass   = PCI-PCI
    cap 10[40] = PCI-Express 1 root port max data 128(128)
                 max read 128
                 link x1(x1) speed 2.5(2.5) ASPM disabled(L0s/L1)
                 slot 0 power limit 10000 mW HotPlug(present) surprise
    cap 05[80] = MSI supports 1 message enabled with 1 message
    cap 0d[90] = PCI Bridge subvendor=0x1043 subdevice=0x8277
    cap 01[a0] = powerspec 2  supports D0 D3  current D0
    ecap 0002[100] = VC 1 max VC0
    ecap 0005[180] = Root Complex Link Declaration 1

uhci3@pci0:0:29:0:	class=0x0c0300 rev=0x02 hdr=0x00 vendor=0x8086 device=0x2934 subvendor=0x1043 subdevice=0x8277
    vendor     = 'Intel Corporation'
    device     = '82801I (ICH9 Family) USB UHCI Controller'
    class      = serial bus
    subclass   = USB
    bar   [20] = type I/O Port, range 32, base 0xd080, size 32, enabled
    cap 09[50] = vendor (length 6) Intel cap 2 version 0

uhci4@pci0:0:29:1:	class=0x0c0300 rev=0x02 hdr=0x00 vendor=0x8086 device=0x2935 subvendor=0x1043 subdevice=0x8277
    vendor     = 'Intel Corporation'
    device     = '82801I (ICH9 Family) USB UHCI Controller'
    class      = serial bus
    subclass   = USB
    bar   [20] = type I/O Port, range 32, base 0xd400, size 32, enabled
    cap 09[50] = vendor (length 6) Intel cap 2 version 0

uhci5@pci0:0:29:2:	class=0x0c0300 rev=0x02 hdr=0x00 vendor=0x8086 device=0x2936 subvendor=0x1043 subdevice=0x8277
    vendor     = 'Intel Corporation'
    device     = '82801I (ICH9 Family) USB UHCI Controller'
    class      = serial bus
    subclass   = USB
    bar   [20] = type I/O Port, range 32, base 0xd480, size 32, enabled
    cap 09[50] = vendor (length 6) Intel cap 2 version 0

ehci1@pci0:0:29:7:	class=0x0c0320 rev=0x02 hdr=0x00 vendor=0x8086 device=0x293a subvendor=0x1043 subdevice=0x8277
    vendor     = 'Intel Corporation'
    device     = '82801I (ICH9 Family) USB2 EHCI Controller'
    class      = serial bus
    subclass   = USB
    bar   [10] = type Memory, range 32, base 0xfbfff800, size 1024, enabled
    cap 01[50] = powerspec 2  supports D0 D3  current D0
    cap 0a[58] = EHCI Debug Port at offset 0xa0 in map 0x14
    cap 09[98] = vendor (length 6) Intel cap 2 version 0

pcib5@pci0:0:30:0:	class=0x060401 rev=0x92 hdr=0x01 vendor=0x8086 device=0x244e subvendor=0x1043 subdevice=0x8277
    vendor     = 'Intel Corporation'
    device     = '82801 PCI Bridge'
    class      = bridge
    subclass   = PCI-PCI
    cap 0d[50] = PCI Bridge subvendor=0x1043 subdevice=0x8277

isab0@pci0:0:31:0:	class=0x060100 rev=0x02 hdr=0x00 vendor=0x8086 device=0x2918 subvendor=0x1043 subdevice=0x8277
    vendor     = 'Intel Corporation'
    device     = '82801IB (ICH9) LPC Interface Controller'
    class      = bridge
    subclass   = PCI-ISA
    cap 09[e0] = vendor (length 12) Intel cap 1 version 0
		 features: Quick Resume, SATA RAID-5, 4 PCI-e x1 slots, SATA RAID-0/1/10

ahci1@pci0:0:31:2:	class=0x010601 rev=0x02 hdr=0x00 vendor=0x8086 device=0x2923 subvendor=0x1043 subdevice=0x8277
    vendor     = 'Intel Corporation'
    device     = '82801IB (ICH9) 4 port SATA Controller [AHCI mode]'
    class      = mass storage
    subclass   = SATA
    bar   [10] = type I/O Port, range 32, base 0xcc00, size 8, enabled
    bar   [14] = type I/O Port, range 32, base 0xc880, size 4, enabled
    bar   [18] = type I/O Port, range 32, base 0xc800, size 8, enabled
    bar   [1c] = type I/O Port, range 32, base 0xc480, size 4, enabled
    bar   [20] = type I/O Port, range 32, base 0xc400, size 32, enabled
    bar   [24] = type Memory, range 32, base 0xfbffe800, size 2048, enabled
    cap 05[80] = MSI supports 16 messages enabled with 16 messages
    cap 01[70] = powerspec 3  supports D0 D3  current D0
    cap 12[a8] = SATA Index-Data Pair
    cap 09[b0] = vendor (length 6) Intel cap 2 version 0

ichsmb0@pci0:0:31:3:	class=0x0c0500 rev=0x02 hdr=0x00 vendor=0x8086 device=0x2930 subvendor=0x1043 subdevice=0x8277
    vendor     = 'Intel Corporation'
    device     = '82801I (ICH9 Family) SMBus Controller'
    class      = serial bus
    subclass   = SMBus
    bar   [10] = type Memory, range 64, base 0xfbfff400, size 256, enabled
    bar   [20] = type I/O Port, range 32, base 0x400, size 32, enabled

vgapci0@pci0:1:0:0:	class=0x030000 rev=0xa1 hdr=0x00 vendor=0x10de device=0x01d3 subvendor=0x0000 subdevice=0x0000
    vendor     = 'NVIDIA Corporation'
    device     = 'G72 [GeForce 7200 GS / 7300 SE]'
    class      = display
    subclass   = VGA
    bar   [10] = type Memory, range 32, base 0xfd000000, size 16777216, enabled
    bar   [14] = type Prefetchable Memory, range 64, base 0xd0000000, size 268435456, enabled
    bar   [1c] = type Memory, range 64, base 0xfc000000, size 16777216, enabled
    cap 01[60] = powerspec 2  supports D0 D3  current D0
    cap 05[68] = MSI supports 1 message, 64 bit 
    cap 10[78] = PCI-Express 1 endpoint max data 128(128) RO NS
                 max read 512
                 link x16(x16) speed 2.5(2.5) ASPM disabled(L0s/L1)
    ecap 0002[100] = VC 1 max VC0
    ecap 0004[128] = Power Budgeting 1

atapci0@pci0:3:0:0:	class=0x01018f rev=0xb2 hdr=0x00 vendor=0x11ab device=0x6121 subvendor=0x1043 subdevice=0x82a2
    vendor     = 'Marvell Technology Group Ltd.'
    device     = '88SE6111/6121 SATA II / PATA Controller'
    class      = mass storage
    subclass   = ATA
    bar   [10] = type I/O Port, range 32, base 0xec00, size 8, enabled
    bar   [14] = type I/O Port, range 32, base 0xe880, size 4, enabled
    bar   [18] = type I/O Port, range 32, base 0xe800, size 8, enabled
    bar   [1c] = type I/O Port, range 32, base 0xe480, size 4, enabled
    bar   [20] = type I/O Port, range 32, base 0xe400, size 16, enabled
    bar   [24] = type Memory, range 32, base 0xfebffc00, size 1024, enabled
    cap 01[48] = powerspec 2  supports D0 D1 D3  current D0
    cap 05[50] = MSI supports 1 message 
    cap 10[e0] = PCI-Express 1 legacy endpoint max data 128(128)
                 max read 512
                 link x1(x1) speed 2.5(2.5) ASPM disabled(L0s)
    ecap 0001[100] = AER 1 0 fatal 0 non-fatal 1 corrected

age0@pci0:2:0:0:	class=0x020000 rev=0xb0 hdr=0x00 vendor=0x1969 device=0x1048 subvendor=0x1043 subdevice=0x8226
    vendor     = 'Qualcomm Atheros'
    device     = 'Attansic L1 Gigabit Ethernet'
    class      = network
    subclass   = ethernet
    bar   [10] = type Memory, range 64, base 0xfeac0000, size 262144, enabled
    cap 01[40] = powerspec 2  supports D0 D3  current D0
    cap 05[48] = MSI supports 1 message, 64 bit enabled with 1 message
    cap 10[58] = PCI-Express 1 endpoint max data 128(128)
                 max read 512
                 link x1(x1) speed 2.5(2.5) ASPM disabled(L0s)
    ecap 0001[100] = AER 1 0 fatal 1 non-fatal 0 corrected
