hostb0@pci0:0:0:0:	class=0x060000 card=0xb1591462 chip=0x59048086 rev=0x02 hdr=0x00
    vendor     = 'Intel Corporation'
    device     = 'Xeon E3-1200 v6/7th Gen Core Processor Host Bridge/DRAM Registers'
    class      = bridge
    subclass   = HOST-PCI
    cap 09[e0] = vendor (length 16) Intel cap 0 version 1

vgapci0@pci0:0:2:0:	class=0x030000 card=0xb1591462 chip=0x59168086 rev=0x02 hdr=0x00
    vendor     = 'Intel Corporation'
    device     = 'HD Graphics 620'
    class      = display
    subclass   = VGA
    bar   [10] = type Memory, range 64, base 0xde000000, size 16777216, enabled
    bar   [18] = type Prefetchable Memory, range 64, base 0xc0000000, size 268435456, enabled
    bar   [20] = type I/O Port, range 32, base 0xf000, size 64, enabled
    cap 09[40] = vendor (length 12) Intel cap 0 version 1
    cap 10[70] = PCI-Express 2 root endpoint max data 128(128) FLR
    cap 05[ac] = MSI supports 1 message 
    cap 01[d0] = powerspec 2  supports D0 D3  current D0
    ecap 001b[100] = unknown 1
    ecap 000f[200] = ATS 1
    ecap 0013[300] = unknown 1

none0@pci0:0:8:0:	class=0x088000 card=0xb1591462 chip=0x19118086 rev=0x00 hdr=0x00
    vendor     = 'Intel Corporation'
    device     = 'Xeon E3-1200 v5/v6 / E3-1500 v5 / 6th/7th Gen Core Processor Gaussian Mixture Model'
    class      = base peripheral
    bar   [10] = type Memory, range 64, base 0xdf24f000, size 4096, enabled
    cap 05[90] = MSI supports 1 message 
    cap 01[dc] = powerspec 2  supports D0 D3  current D0
    cap 13[f0] = PCI Advanced Features: FLR TP

xhci0@pci0:0:20:0:	class=0x0c0330 card=0xb1591462 chip=0x9d2f8086 rev=0x21 hdr=0x00
    vendor     = 'Intel Corporation'
    device     = 'Sunrise Point-LP USB 3.0 xHCI Controller'
    class      = serial bus
    subclass   = USB
    bar   [10] = type Memory, range 64, base 0xdf230000, size 65536, enabled
    cap 01[70] = powerspec 2  supports D0 D3  current D0
    cap 05[80] = MSI supports 8 messages, 64 bit enabled with 1 message

none1@pci0:0:20:2:	class=0x118000 card=0xb1591462 chip=0x9d318086 rev=0x21 hdr=0x00
    vendor     = 'Intel Corporation'
    device     = 'Sunrise Point-LP Thermal subsystem'
    class      = dasp
    bar   [10] = type Memory, range 64, base 0xdf24e000, size 4096, enabled
    cap 01[50] = powerspec 3  supports D0 D3  current D0
    cap 05[80] = MSI supports 1 message 

none2@pci0:0:22:0:	class=0x078000 card=0xb1591462 chip=0x9d3a8086 rev=0x21 hdr=0x00
    vendor     = 'Intel Corporation'
    device     = 'Sunrise Point-LP CSME HECI'
    class      = simple comms
    bar   [10] = type Memory, range 64, base 0xdf24d000, size 4096, enabled
    cap 01[50] = powerspec 3  supports D0 D3  current D0
    cap 05[8c] = MSI supports 1 message, 64 bit 

ahci0@pci0:0:23:0:	class=0x010601 card=0xb1591462 chip=0x9d038086 rev=0x21 hdr=0x00
    vendor     = 'Intel Corporation'
    device     = 'Sunrise Point-LP SATA Controller [AHCI mode]'
    class      = mass storage
    subclass   = SATA
    bar   [10] = type Memory, range 32, base 0xdf248000, size 8192, enabled
    bar   [14] = type Memory, range 32, base 0xdf24c000, size 256, enabled
    bar   [18] = type I/O Port, range 32, base 0xf090, size 8, enabled
    bar   [1c] = type I/O Port, range 32, base 0xf080, size 4, enabled
    bar   [20] = type I/O Port, range 32, base 0xf060, size 32, enabled
    bar   [24] = type Memory, range 32, base 0xdf24b000, size 2048, enabled
    cap 05[80] = MSI supports 1 message enabled with 1 message
    cap 01[70] = powerspec 3  supports D0 D3  current D0
    cap 12[a8] = SATA Index-Data Pair

pcib1@pci0:0:28:0:	class=0x060400 card=0xb1591462 chip=0x9d108086 rev=0xf1 hdr=0x01
    vendor     = 'Intel Corporation'
    device     = 'Sunrise Point-LP PCI Express Root Port'
    class      = bridge
    subclass   = PCI-PCI
    cap 10[40] = PCI-Express 2 root port max data 128(256) ARI disabled
                 link x0(x1) speed 0.0(8.0) ASPM disabled(L0s/L1)
    cap 05[80] = MSI supports 1 message 
    cap 0d[90] = PCI Bridge card=0xb1591462
    cap 01[a0] = powerspec 3  supports D0 D3  current D0

pcib2@pci0:0:28:3:	class=0x060400 card=0xb1591462 chip=0x9d138086 rev=0xf1 hdr=0x01
    vendor     = 'Intel Corporation'
    class      = bridge
    subclass   = PCI-PCI
    cap 10[40] = PCI-Express 2 root port max data 128(256) ARI disabled
                 link x1(x1) speed 2.5(8.0)
                 slot 7 power limit 100 mW
    cap 05[80] = MSI supports 1 message 
    cap 0d[90] = PCI Bridge card=0xb1591462
    cap 01[a0] = powerspec 3  supports D0 D3  current D0
    ecap 0001[100] = AER 1 0 fatal 0 non-fatal 0 corrected
    ecap 000d[140] = ACS 1
    ecap 0019[220] = PCIe Sec 1 lane errors 0

pcib3@pci0:0:28:5:	class=0x060400 card=0xb1591462 chip=0x9d158086 rev=0xf1 hdr=0x01
    vendor     = 'Intel Corporation'
    device     = 'Sunrise Point-LP PCI Express Root Port'
    class      = bridge
    subclass   = PCI-PCI
    cap 10[40] = PCI-Express 2 root port max data 256(256) ARI disabled
                 link x1(x1) speed 2.5(8.0)
                 slot 9 power limit 100 mW
    cap 05[80] = MSI supports 1 message 
    cap 0d[90] = PCI Bridge card=0xb1591462
    cap 01[a0] = powerspec 3  supports D0 D3  current D0
    ecap 0001[100] = AER 1 0 fatal 0 non-fatal 0 corrected
    ecap 000d[140] = ACS 1
    ecap 0019[220] = PCIe Sec 1 lane errors 0

isab0@pci0:0:31:0:	class=0x060100 card=0xb1591462 chip=0x9d4e8086 rev=0x21 hdr=0x00
    vendor     = 'Intel Corporation'
    device     = 'Intel(R) 100 Series Chipset Family LPC Controller/eSPI Controller - 9D4E'
    class      = bridge
    subclass   = PCI-ISA

none3@pci0:0:31:2:	class=0x058000 card=0xb1591462 chip=0x9d218086 rev=0x21 hdr=0x00
    vendor     = 'Intel Corporation'
    device     = 'Sunrise Point-LP PMC'
    class      = memory
    bar   [10] = type Memory, range 32, base 0xdf244000, size 16384, enabled

hdac0@pci0:0:31:3:	class=0x040300 card=0xb1591462 chip=0x9d718086 rev=0x21 hdr=0x00
    vendor     = 'Intel Corporation'
    device     = 'Sunrise Point-LP HD Audio'
    class      = multimedia
    subclass   = HDA
    bar   [10] = type Memory, range 64, base 0xdf240000, size 16384, enabled
    bar   [20] = type Memory, range 64, base 0xdf220000, size 65536, enabled
    cap 01[50] = powerspec 3  supports D0 D3  current D0
    cap 05[60] = MSI supports 1 message, 64 bit enabled with 1 message

none4@pci0:0:31:4:	class=0x0c0500 card=0xb1591462 chip=0x9d238086 rev=0x21 hdr=0x00
    vendor     = 'Intel Corporation'
    device     = 'Sunrise Point-LP SMBus'
    class      = serial bus
    subclass   = SMBus
    bar   [10] = type Memory, range 64, base 0xdf24a000, size 256, enabled
    bar   [20] = type I/O Port, range 32, base 0xf040, size 32, enabled

em0@pci0:0:31:6:	class=0x020000 card=0xb1591462 chip=0x15b88086 rev=0x21 hdr=0x00
    vendor     = 'Intel Corporation'
    device     = 'Ethernet Connection (2) I219-V'
    class      = network
    subclass   = ethernet
    bar   [10] = type Memory, range 32, base 0xdf200000, size 131072, enabled
    cap 01[c8] = powerspec 3  supports D0 D3  current D0
    cap 05[d0] = MSI supports 1 message, 64 bit enabled with 1 message
    cap 13[e0] = PCI Advanced Features: FLR TP

iwm0@pci0:2:0:0:	class=0x028000 card=0x21108086 chip=0x24fb8086 rev=0x10 hdr=0x00
    vendor     = 'Intel Corporation'
    device     = 'Dual Band Wireless-AC 3168NGW [Stone Peak]'
    class      = network
    bar   [10] = type Memory, range 64, base 0xdf100000, size 8192, enabled
    cap 01[c8] = powerspec 3  supports D0 D3  current D0
    cap 05[d0] = MSI supports 1 message, 64 bit enabled with 1 message
    cap 10[40] = PCI-Express 2 endpoint max data 128(128) FLR RO NS
                 link x1(x1) speed 2.5(2.5) ASPM disabled(L1)
    ecap 0001[100] = AER 1 0 fatal 0 non-fatal 0 corrected
    ecap 0003[140] = Serial 1 48f17fffffd61a05
    ecap 0018[14c] = LTR 1
    ecap 001e[154] = unknown 1

igb0@pci0:3:0:0:	class=0x020000 card=0xb1591462 chip=0x15398086 rev=0x03 hdr=0x00
    vendor     = 'Intel Corporation'
    device     = 'I211 Gigabit Network Connection'
    class      = network
    subclass   = ethernet
    bar   [10] = type Memory, range 32, base 0xdf000000, size 131072, enabled
    bar   [18] = type I/O Port, range 32, base 0xe000, size 32, enabled
    bar   [1c] = type Memory, range 32, base 0xdf020000, size 16384, enabled
    cap 01[40] = powerspec 3  supports D0 D3  current D0
    cap 05[50] = MSI supports 1 message, 64 bit, vector masks 
    cap 11[70] = MSI-X supports 5 messages, enabled
                 Table in map 0x1c[0x0], PBA in map 0x1c[0x2000]
    cap 10[a0] = PCI-Express 2 endpoint max data 256(512) FLR RO NS
                 link x1(x1) speed 2.5(2.5) ASPM disabled(L0s/L1)
    ecap 0001[100] = AER 2 0 fatal 0 non-fatal 0 corrected
    ecap 0003[140] = Serial 1 00d861ffff37b2f5
    ecap 0017[1a0] = TPH Requester 1
