hostb0@pci0:0:0:0:	class=0x060000 rev=0x02 hdr=0x00 vendor=0x8086 device=0x29d0 subvendor=0x103c subdevice=0x281e
    vendor     = 'Intel Corporation'
    device     = '82Q33 Express DRAM Controller'
    class      = bridge
    subclass   = HOST-PCI
    cap 09[e0] = vendor (length 11) Intel cap 11 version 1

vgapci0@pci0:0:2:0:	class=0x030000 rev=0x02 hdr=0x00 vendor=0x8086 device=0x29d2 subvendor=0x103c subdevice=0x281e
    vendor     = 'Intel Corporation'
    device     = '82Q33 Express Integrated Graphics Controller'
    class      = display
    subclass   = VGA
    bar   [10] = type Memory, range 32, base 0xf0100000, size 524288, enabled
    bar   [14] = type I/O Port, range 32, base 0x2240, size 8, enabled
    bar   [18] = type Prefetchable Memory, range 32, base 0xe0000000, size 268435456, enabled
    bar   [1c] = type Memory, range 32, base 0xf0000000, size 1048576, enabled
    cap 05[90] = MSI supports 1 message 
    cap 01[d0] = powerspec 2  supports D0 D3  current D0

none0@pci0:0:3:0:	class=0x078000 rev=0x02 hdr=0x00 vendor=0x8086 device=0x29d4 subvendor=0x103c subdevice=0x281e
    vendor     = 'Intel Corporation'
    device     = '82Q33 Express MEI Controller'
    class      = simple comms
    bar   [10] = type Memory, range 64, base 0xf01a5900, size 16, enabled
    cap 01[50] = powerspec 3  supports D0 D3  current D0
    cap 05[8c] = MSI supports 1 message, 64 bit 

em0@pci0:0:25:0:	class=0x020000 rev=0x02 hdr=0x00 vendor=0x8086 device=0x10bd subvendor=0x103c subdevice=0x281e
    vendor     = 'Intel Corporation'
    device     = '82566DM-2 Gigabit Network Connection'
    class      = network
    subclass   = ethernet
    bar   [10] = type Memory, range 32, base 0xf0180000, size 131072, enabled
    bar   [14] = type Memory, range 32, base 0xf01a4000, size 4096, enabled
    bar   [18] = type I/O Port, range 32, base 0x2100, size 32, enabled
    cap 01[c8] = powerspec 2  supports D0 D3  current D0
    cap 05[d0] = MSI supports 1 message, 64 bit enabled with 1 message
    cap 13[e0] = PCI Advanced Features: FLR TP

uhci0@pci0:0:26:0:	class=0x0c0300 rev=0x02 hdr=0x00 vendor=0x8086 device=0x2937 subvendor=0x103c subdevice=0x281e
    vendor     = 'Intel Corporation'
    device     = '82801I (ICH9 Family) USB UHCI Controller'
    class      = serial bus
    subclass   = USB
    bar   [20] = type I/O Port, range 32, base 0x2120, size 32, enabled
    cap 13[50] = PCI Advanced Features: FLR TP

uhci1@pci0:0:26:1:	class=0x0c0300 rev=0x02 hdr=0x00 vendor=0x8086 device=0x2938 subvendor=0x103c subdevice=0x281e
    vendor     = 'Intel Corporation'
    device     = '82801I (ICH9 Family) USB UHCI Controller'
    class      = serial bus
    subclass   = USB
    bar   [20] = type I/O Port, range 32, base 0x2140, size 32, enabled
    cap 13[50] = PCI Advanced Features: FLR TP

uhci2@pci0:0:26:2:	class=0x0c0300 rev=0x02 hdr=0x00 vendor=0x8086 device=0x2939 subvendor=0x103c subdevice=0x281e
    vendor     = 'Intel Corporation'
    device     = '82801I (ICH9 Family) USB UHCI Controller'
    class      = serial bus
    subclass   = USB
    bar   [20] = type I/O Port, range 32, base 0x2160, size 32, enabled
    cap 13[50] = PCI Advanced Features: FLR TP

ehci0@pci0:0:26:7:	class=0x0c0320 rev=0x02 hdr=0x00 vendor=0x8086 device=0x293c subvendor=0x103c subdevice=0x281e
    vendor     = 'Intel Corporation'
    device     = '82801I (ICH9 Family) USB2 EHCI Controller'
    class      = serial bus
    subclass   = USB
    bar   [10] = type Memory, range 32, base 0xf01a5000, size 1024, enabled
    cap 01[50] = powerspec 2  supports D0 D3  current D0
    cap 0a[58] = EHCI Debug Port at offset 0xa0 in map 0x14
    cap 13[98] = PCI Advanced Features: FLR TP

hdac0@pci0:0:27:0:	class=0x040300 rev=0x02 hdr=0x00 vendor=0x8086 device=0x293e subvendor=0x103c subdevice=0x281e
    vendor     = 'Intel Corporation'
    device     = '82801I (ICH9 Family) HD Audio Controller'
    class      = multimedia
    subclass   = HDA
    bar   [10] = type Memory, range 64, base 0xf01a0000, size 16384, enabled
    cap 01[50] = powerspec 2  supports D0 D3  current D0
    cap 05[60] = MSI supports 1 message, 64 bit enabled with 1 message
    cap 10[70] = PCI-Express 1 root endpoint max data 128(128) FLR NS
                 max read 128
    ecap 0002[100] = VC 1 max VC1
    ecap 0005[130] = Root Complex Link Declaration 1

pcib1@pci0:0:28:0:	class=0x060400 rev=0x02 hdr=0x01 vendor=0x8086 device=0x2940 subvendor=0x103c subdevice=0x281e
    vendor     = 'Intel Corporation'
    device     = '82801I (ICH9 Family) PCI Express Port 1'
    class      = bridge
    subclass   = PCI-PCI
    cap 10[40] = PCI-Express 1 root port max data 128(128)
                 max read 128
                 link x0(x1) speed 0.0(2.5) ASPM disabled(L0s/L1)
                 slot 2 power limit 10000 mW HotPlug(empty) surprise
    cap 05[80] = MSI supports 1 message 
    cap 0d[90] = PCI Bridge subvendor=0x103c subdevice=0x281e
    cap 01[a0] = powerspec 2  supports D0 D3  current D0
    ecap 0002[100] = VC 1 max VC0
    ecap 0005[180] = Root Complex Link Declaration 1

pcib2@pci0:0:28:1:	class=0x060400 rev=0x02 hdr=0x01 vendor=0x8086 device=0x2942 subvendor=0x103c subdevice=0x281e
    vendor     = 'Intel Corporation'
    device     = '82801I (ICH9 Family) PCI Express Port 2'
    class      = bridge
    subclass   = PCI-PCI
    cap 10[40] = PCI-Express 1 root port max data 128(128)
                 max read 128
                 link x0(x1) speed 0.0(2.5) ASPM disabled(L0s/L1)
                 slot 0 power limit 0 mW HotPlug(empty) surprise
    cap 05[80] = MSI supports 1 message 
    cap 0d[90] = PCI Bridge subvendor=0x103c subdevice=0x281e
    cap 01[a0] = powerspec 2  supports D0 D3  current D0
    ecap 0002[100] = VC 1 max VC0
    ecap 0005[180] = Root Complex Link Declaration 1

uhci3@pci0:0:29:0:	class=0x0c0300 rev=0x02 hdr=0x00 vendor=0x8086 device=0x2934 subvendor=0x103c subdevice=0x281e
    vendor     = 'Intel Corporation'
    device     = '82801I (ICH9 Family) USB UHCI Controller'
    class      = serial bus
    subclass   = USB
    bar   [20] = type I/O Port, range 32, base 0x2180, size 32, enabled
    cap 13[50] = PCI Advanced Features: FLR TP

uhci4@pci0:0:29:1:	class=0x0c0300 rev=0x02 hdr=0x00 vendor=0x8086 device=0x2935 subvendor=0x103c subdevice=0x281e
    vendor     = 'Intel Corporation'
    device     = '82801I (ICH9 Family) USB UHCI Controller'
    class      = serial bus
    subclass   = USB
    bar   [20] = type I/O Port, range 32, base 0x21a0, size 32, enabled
    cap 13[50] = PCI Advanced Features: FLR TP

uhci5@pci0:0:29:2:	class=0x0c0300 rev=0x02 hdr=0x00 vendor=0x8086 device=0x2936 subvendor=0x103c subdevice=0x281e
    vendor     = 'Intel Corporation'
    device     = '82801I (ICH9 Family) USB UHCI Controller'
    class      = serial bus
    subclass   = USB
    bar   [20] = type I/O Port, range 32, base 0x21c0, size 32, enabled
    cap 13[50] = PCI Advanced Features: FLR TP

ehci1@pci0:0:29:7:	class=0x0c0320 rev=0x02 hdr=0x00 vendor=0x8086 device=0x293a subvendor=0x103c subdevice=0x281e
    vendor     = 'Intel Corporation'
    device     = '82801I (ICH9 Family) USB2 EHCI Controller'
    class      = serial bus
    subclass   = USB
    bar   [10] = type Memory, range 32, base 0xf01a5400, size 1024, enabled
    cap 01[50] = powerspec 2  supports D0 D3  current D0
    cap 0a[58] = EHCI Debug Port at offset 0xa0 in map 0x14
    cap 13[98] = PCI Advanced Features: FLR TP

pcib3@pci0:0:30:0:	class=0x060401 rev=0x92 hdr=0x01 vendor=0x8086 device=0x244e subvendor=0x103c subdevice=0x281e
    vendor     = 'Intel Corporation'
    device     = '82801 PCI Bridge'
    class      = bridge
    subclass   = PCI-PCI
    cap 0d[50] = PCI Bridge subvendor=0x103c subdevice=0x281e

isab0@pci0:0:31:0:	class=0x060100 rev=0x02 hdr=0x00 vendor=0x8086 device=0x2918 subvendor=0x103c subdevice=0x281e
    vendor     = 'Intel Corporation'
    device     = '82801IB (ICH9) LPC Interface Controller'
    class      = bridge
    subclass   = PCI-ISA
    cap 09[e0] = vendor (length 12) Intel cap 1 version 0
		 features: Quick Resume, SATA RAID-5, 4 PCI-e x1 slots, SATA RAID-0/1/10

atapci0@pci0:0:31:2:	class=0x01018a rev=0x02 hdr=0x00 vendor=0x8086 device=0x2921 subvendor=0x103c subdevice=0x281e
    vendor     = 'Intel Corporation'
    device     = '82801IB (ICH9) 2 port SATA Controller [IDE mode]'
    class      = mass storage
    subclass   = ATA
    bar   [20] = type I/O Port, range 32, base 0x2200, size 16, enabled
    bar   [24] = type I/O Port, range 32, base 0x2210, size 16, enabled
    cap 01[70] = powerspec 3  supports D0 D3  current D0
    cap 13[b0] = PCI Advanced Features: FLR TP

atapci1@pci0:0:31:5:	class=0x010185 rev=0x02 hdr=0x00 vendor=0x8086 device=0x2926 subvendor=0x103c subdevice=0x281e
    vendor     = 'Intel Corporation'
    device     = '82801I (ICH9 Family) 2 port SATA Controller [IDE mode]'
    class      = mass storage
    subclass   = ATA
    bar   [10] = type I/O Port, range 32, base 0x2258, size 8, enabled
    bar   [14] = type I/O Port, range 32, base 0x2270, size 4, enabled
    bar   [18] = type I/O Port, range 32, base 0x2260, size 8, enabled
    bar   [1c] = type I/O Port, range 32, base 0x2274, size 4, enabled
    bar   [20] = type I/O Port, range 32, base 0x2220, size 16, enabled
    bar   [24] = type I/O Port, range 32, base 0x2230, size 16, enabled
    cap 01[70] = powerspec 3  supports D0 D3  current D0
    cap 13[b0] = PCI Advanced Features: FLR TP

rl0@pci0:7:4:0:	class=0x020000 rev=0x10 hdr=0x00 vendor=0x10ec device=0x8139 subvendor=0x10ec subdevice=0x8139
    vendor     = 'Realtek Semiconductor Co., Ltd.'
    device     = 'RTL-8100/8101L/8139 PCI Fast Ethernet Adapter'
    class      = network
    subclass   = ethernet
    bar   [10] = type I/O Port, range 32, base 0x1100, size 256, enabled
    bar   [14] = type Memory, range 32, base 0xf0200000, size 256, enabled
    cap 01[50] = powerspec 2  supports D0 D1 D2 D3  current D0
