hostb0@pci0:0:0:0:	class=0x060000 rev=0x09 hdr=0x00 vendor=0x8086 device=0x0100 subvendor=0x1734 subdevice=0x11b9
    vendor     = 'Intel Corporation'
    device     = '2nd Generation Core Processor Family DRAM Controller'
    class      = bridge
    subclass   = HOST-PCI
    cap 09[e0] = vendor (length 12) Intel cap 0 version 1

none0@pci0:0:22:0:	class=0x078000 rev=0x04 hdr=0x00 vendor=0x8086 device=0x1c3a subvendor=0x1734 subdevice=0x11cb
    vendor     = 'Intel Corporation'
    device     = '6 Series/C200 Series Chipset Family MEI Controller'
    class      = simple comms
    bar   [10] = type Memory, range 64, base 0xfb225000, size 16, enabled
    cap 01[50] = powerspec 3  supports D0 D3  current D0
    cap 05[8c] = MSI supports 1 message, 64 bit 

none1@pci0:0:22:1:	class=0x078000 rev=0x04 hdr=0x00 vendor=0x8086 device=0x1c3b subvendor=0x1734 subdevice=0x11cb
    vendor     = 'Intel Corporation'
    device     = '6 Series/C200 Series Chipset Family MEI Controller'
    class      = simple comms
    bar   [10] = type Memory, range 64, base 0xfb224000, size 16, enabled
    cap 01[50] = powerspec 3  supports D0 D3  current D0
    cap 05[8c] = MSI supports 1 message, 64 bit 

em0@pci0:0:25:0:	class=0x020000 rev=0x04 hdr=0x00 vendor=0x8086 device=0x1502 subvendor=0x1734 subdevice=0x11b7
    vendor     = 'Intel Corporation'
    device     = '82579LM Gigabit Network Connection (Lewisville)'
    class      = network
    subclass   = ethernet
    bar   [10] = type Memory, range 32, base 0xfb200000, size 131072, enabled
    bar   [14] = type Memory, range 32, base 0xfb223000, size 4096, enabled
    bar   [18] = type I/O Port, range 32, base 0xf020, size 32, enabled
    cap 01[c8] = powerspec 2  supports D0 D3  current D0
    cap 05[d0] = MSI supports 1 message, 64 bit enabled with 1 message
    cap 13[e0] = PCI Advanced Features: FLR TP

ehci0@pci0:0:26:0:	class=0x0c0320 rev=0x04 hdr=0x00 vendor=0x8086 device=0x1c2d subvendor=0x1734 subdevice=0x11cb
    vendor     = 'Intel Corporation'
    device     = '6 Series/C200 Series Chipset Family USB Enhanced Host Controller'
    class      = serial bus
    subclass   = USB
    bar   [10] = type Memory, range 32, base 0xfb222000, size 1024, enabled
    cap 01[50] = powerspec 2  supports D0 D3  current D0
    cap 0a[58] = EHCI Debug Port at offset 0xa0 in map 0x14
    cap 13[98] = PCI Advanced Features: FLR TP

pcib1@pci0:0:28:0:	class=0x060400 rev=0xb4 hdr=0x01 vendor=0x8086 device=0x1c10 subvendor=0x1734 subdevice=0x11cb
    vendor     = 'Intel Corporation'
    device     = '6 Series/C200 Series Chipset Family PCI Express Root Port 1'
    class      = bridge
    subclass   = PCI-PCI
    cap 10[40] = PCI-Express 2 root port max data 128(128)
                 max read 128
                 link x0(x4) speed 0.0(5.0) ASPM disabled(L0s/L1)
                 slot 0 power limit 250 mW
    cap 05[80] = MSI supports 1 message 
    cap 0d[90] = PCI Bridge subvendor=0x1734 subdevice=0x11cb
    cap 01[a0] = powerspec 2  supports D0 D3  current D0

pcib2@pci0:0:28:4:	class=0x060400 rev=0xb4 hdr=0x01 vendor=0x8086 device=0x1c18 subvendor=0x1734 subdevice=0x11cb
    vendor     = 'Intel Corporation'
    device     = '6 Series/C200 Series Chipset Family PCI Express Root Port 5'
    class      = bridge
    subclass   = PCI-PCI
    cap 10[40] = PCI-Express 2 root port max data 128(128)
                 max read 128
                 link x1(x1) speed 2.5(5.0) ASPM disabled(L0s/L1)
                 slot 4 power limit 100 mW
    cap 05[80] = MSI supports 1 message 
    cap 0d[90] = PCI Bridge subvendor=0x1734 subdevice=0x11cb
    cap 01[a0] = powerspec 2  supports D0 D3  current D0

pcib3@pci0:0:28:6:	class=0x060400 rev=0xb4 hdr=0x01 vendor=0x8086 device=0x1c1c subvendor=0x1734 subdevice=0x11cb
    vendor     = 'Intel Corporation'
    device     = '6 Series/C200 Series Chipset Family PCI Express Root Port 7'
    class      = bridge
    subclass   = PCI-PCI
    cap 10[40] = PCI-Express 2 root port max data 128(128)
                 max read 128
                 link x1(x1) speed 2.5(5.0) ASPM disabled(L0s/L1)
                 slot 6 power limit 100 mW
    cap 05[80] = MSI supports 1 message 
    cap 0d[90] = PCI Bridge subvendor=0x1734 subdevice=0x11cb
    cap 01[a0] = powerspec 2  supports D0 D3  current D0

ehci1@pci0:0:29:0:	class=0x0c0320 rev=0x04 hdr=0x00 vendor=0x8086 device=0x1c26 subvendor=0x1734 subdevice=0x11cb
    vendor     = 'Intel Corporation'
    device     = '6 Series/C200 Series Chipset Family USB Enhanced Host Controller'
    class      = serial bus
    subclass   = USB
    bar   [10] = type Memory, range 32, base 0xfb221000, size 1024, enabled
    cap 01[50] = powerspec 2  supports D0 D3  current D0
    cap 0a[58] = EHCI Debug Port at offset 0xa0 in map 0x14
    cap 13[98] = PCI Advanced Features: FLR TP

isab0@pci0:0:31:0:	class=0x060100 rev=0x04 hdr=0x00 vendor=0x8086 device=0x1c52 subvendor=0x1734 subdevice=0x11cb
    vendor     = 'Intel Corporation'
    device     = 'C202 Chipset LPC Controller'
    class      = bridge
    subclass   = PCI-ISA
    cap 09[e0] = vendor (length 12) Intel cap 1 version 0
		 features: AMT, 4 PCI-e x1 slots

atapci0@pci0:0:31:2:	class=0x01018a rev=0x04 hdr=0x00 vendor=0x8086 device=0x1c00 subvendor=0x1734 subdevice=0x11b8
    vendor     = 'Intel Corporation'
    device     = '6 Series/C200 Series Chipset Family Desktop SATA Controller (IDE mode, ports 0-3)'
    class      = mass storage
    subclass   = ATA
    bar   [20] = type I/O Port, range 32, base 0xf0b0, size 16, enabled
    bar   [24] = type I/O Port, range 32, base 0xf0a0, size 16, enabled
    cap 01[70] = powerspec 3  supports D0 D3  current D0
    cap 13[b0] = PCI Advanced Features: FLR TP

ichsmb0@pci0:0:31:3:	class=0x0c0500 rev=0x04 hdr=0x00 vendor=0x8086 device=0x1c22 subvendor=0x1734 subdevice=0x11cb
    vendor     = 'Intel Corporation'
    device     = '6 Series/C200 Series Chipset Family SMBus Controller'
    class      = serial bus
    subclass   = SMBus
    bar   [10] = type Memory, range 64, base 0xfb220000, size 256, enabled
    bar   [20] = type I/O Port, range 32, base 0xf000, size 32, enabled

atapci1@pci0:0:31:5:	class=0x010185 rev=0x04 hdr=0x00 vendor=0x8086 device=0x1c08 subvendor=0x1734 subdevice=0x11cb
    vendor     = 'Intel Corporation'
    device     = '6 Series/C200 Series Chipset Family Desktop SATA Controller (IDE mode, ports 4-5)'
    class      = mass storage
    subclass   = ATA
    bar   [10] = type I/O Port, range 32, base 0xf090, size 8, enabled
    bar   [14] = type I/O Port, range 32, base 0xf080, size 4, enabled
    bar   [18] = type I/O Port, range 32, base 0xf070, size 8, enabled
    bar   [1c] = type I/O Port, range 32, base 0xf060, size 4, enabled
    bar   [20] = type I/O Port, range 32, base 0xf050, size 16, enabled
    bar   [24] = type I/O Port, range 32, base 0xf040, size 16, enabled
    cap 01[70] = powerspec 3  supports D0 D3  current D0
    cap 13[b0] = PCI Advanced Features: FLR TP

vgapci0@pci0:2:0:0:	class=0x030000 rev=0xa1 hdr=0x00 vendor=0x10de device=0x040e subvendor=0x10de subdevice=0x0474
    vendor     = 'NVIDIA Corporation'
    device     = 'G84GL [Quadro FX 570]'
    class      = display
    subclass   = VGA
    bar   [10] = type Memory, range 32, base 0xfa000000, size 16777216, enabled
    bar   [14] = type Prefetchable Memory, range 64, base 0xd0000000, size 268435456, enabled
    bar   [1c] = type Memory, range 64, base 0xf8000000, size 33554432, enabled
    bar   [24] = type I/O Port, range 32, base 0xe000, size 128, enabled
    cap 01[60] = powerspec 2  supports D0 D3  current D0
    cap 05[68] = MSI supports 1 message, 64 bit enabled with 1 message
    cap 10[78] = PCI-Express 1 endpoint max data 128(128) NS
                 max read 512
                 link x1(x16) speed 2.5(2.5) ASPM disabled(L0s/L1)
    ecap 0002[100] = VC 1 max VC0
    ecap 0004[128] = Power Budgeting 1
    ecap 000b[600] = Vendor [1] ID 0001 Rev 1 Length 36

em1@pci0:3:0:0:	class=0x020000 rev=0x00 hdr=0x00 vendor=0x8086 device=0x10d3 subvendor=0x1734 subdevice=0x1192
    vendor     = 'Intel Corporation'
    device     = '82574L Gigabit Network Connection'
    class      = network
    subclass   = ethernet
    bar   [10] = type Memory, range 32, base 0xfb100000, size 131072, enabled
    bar   [18] = type I/O Port, range 32, base 0xd000, size 32, enabled
    bar   [1c] = type Memory, range 32, base 0xfb120000, size 16384, enabled
    cap 01[c8] = powerspec 2  supports D0 D3  current D0
    cap 05[d0] = MSI supports 1 message, 64 bit 
    cap 10[e0] = PCI-Express 1 endpoint max data 128(256) NS
                 max read 512
                 link x1(x1) speed 2.5(2.5) ASPM disabled(L0s/L1)
    cap 11[a0] = MSI-X supports 5 messages, enabled
                 Table in map 0x1c[0x0], PBA in map 0x1c[0x2000]
    ecap 0001[100] = AER 1 0 fatal 0 non-fatal 0 corrected
    ecap 0003[140] = Serial 1 001999ffffc5b03e
