hostb0@pci0:0:0:0:	class=0x060000 card=0xff501179 chip=0x2a408086 rev=0x07 hdr=0x00
    vendor     = 'Intel Corporation'
    device     = 'Mobile 4 Series Chipset Memory Controller Hub'
    class      = bridge
    subclass   = HOST-PCI
    cap 09[e0] = vendor (length 10) Intel cap 1 version 1

vgapci0@pci0:0:2:0:	class=0x030000 card=0xff501179 chip=0x2a428086 rev=0x07 hdr=0x00
    vendor     = 'Intel Corporation'
    device     = 'Mobile 4 Series Chipset Integrated Graphics Controller'
    class      = display
    subclass   = VGA
    bar   [10] = type Memory, range 64, base 0xf4000000, size 4194304, enabled
    bar   [18] = type Prefetchable Memory, range 64, base 0xd0000000, size 268435456, enabled
    bar   [20] = type I/O Port, range 32, base 0x1800, size 8, enabled
    cap 05[90] = MSI supports 1 message 
    cap 01[d0] = powerspec 3  supports D0 D3  current D0

vgapci1@pci0:0:2:1:	class=0x038000 card=0xff501179 chip=0x2a438086 rev=0x07 hdr=0x00
    vendor     = 'Intel Corporation'
    device     = 'Mobile 4 Series Chipset Integrated Graphics Controller'
    class      = display
    bar   [10] = type Memory, range 64, base 0xf4400000, size 1048576, enabled
    cap 01[d0] = powerspec 3  supports D0 D3  current D0

uhci0@pci0:0:26:0:	class=0x0c0300 card=0xff501179 chip=0x29378086 rev=0x03 hdr=0x00
    vendor     = 'Intel Corporation'
    device     = '82801I (ICH9 Family) USB UHCI Controller'
    class      = serial bus
    subclass   = USB
    bar   [20] = type I/O Port, range 32, base 0x1820, size 32, enabled
    cap 13[50] = PCI Advanced Features: FLR TP

uhci1@pci0:0:26:1:	class=0x0c0300 card=0xff501179 chip=0x29388086 rev=0x03 hdr=0x00
    vendor     = 'Intel Corporation'
    device     = '82801I (ICH9 Family) USB UHCI Controller'
    class      = serial bus
    subclass   = USB
    bar   [20] = type I/O Port, range 32, base 0x1840, size 32, enabled
    cap 13[50] = PCI Advanced Features: FLR TP

uhci2@pci0:0:26:2:	class=0x0c0300 card=0xff501179 chip=0x29398086 rev=0x03 hdr=0x00
    vendor     = 'Intel Corporation'
    device     = '82801I (ICH9 Family) USB UHCI Controller'
    class      = serial bus
    subclass   = USB
    bar   [20] = type I/O Port, range 32, base 0x1860, size 32, enabled
    cap 13[50] = PCI Advanced Features: FLR TP

ehci0@pci0:0:26:7:	class=0x0c0320 card=0xff501179 chip=0x293c8086 rev=0x03 hdr=0x00
    vendor     = 'Intel Corporation'
    device     = '82801I (ICH9 Family) USB2 EHCI Controller'
    class      = serial bus
    subclass   = USB
    bar   [10] = type Memory, range 32, base 0xf4a04800, size 1024, enabled
    cap 01[50] = powerspec 2  supports D0 D3  current D0
    cap 0a[58] = EHCI Debug Port at offset 0xa0 in map 0x14
    cap 13[98] = PCI Advanced Features: FLR TP

hdac0@pci0:0:27:0:	class=0x040300 card=0xff501179 chip=0x293e8086 rev=0x03 hdr=0x00
    vendor     = 'Intel Corporation'
    device     = '82801I (ICH9 Family) HD Audio Controller'
    class      = multimedia
    subclass   = HDA
    bar   [10] = type Memory, range 64, base 0xf4800000, size 16384, enabled
    cap 01[50] = powerspec 2  supports D0 D3  current D0
    cap 05[60] = MSI supports 1 message, 64 bit enabled with 1 message
    cap 10[70] = PCI-Express 1 root endpoint max data 128(128) FLR NS
    ecap 0002[100] = VC 1 max VC1
    ecap 0005[130] = Root Complex Link Declaration 1

pcib1@pci0:0:28:0:	class=0x060400 card=0xff501179 chip=0x29408086 rev=0x03 hdr=0x01
    vendor     = 'Intel Corporation'
    device     = '82801I (ICH9 Family) PCI Express Port 1'
    class      = bridge
    subclass   = PCI-PCI
    cap 10[40] = PCI-Express 1 root port max data 128(128)
                 link x0(x1) speed 0.0(2.5) ASPM disabled(L0s/L1)
                 slot 0 power limit 65 mW HotPlug(empty) surprise
    cap 05[80] = MSI supports 1 message enabled with 1 message
    cap 0d[90] = PCI Bridge card=0xff501179
    cap 01[a0] = powerspec 2  supports D0 D3  current D0
    ecap 0002[100] = VC 1 max VC0
    ecap 0005[180] = Root Complex Link Declaration 1

pcib2@pci0:0:28:4:	class=0x060400 card=0xff501179 chip=0x29488086 rev=0x03 hdr=0x01
    vendor     = 'Intel Corporation'
    device     = '82801I (ICH9 Family) PCI Express Port 5'
    class      = bridge
    subclass   = PCI-PCI
    cap 10[40] = PCI-Express 1 root port max data 128(128)
                 link x1(x1) speed 2.5(2.5) ASPM disabled(L0s/L1)
                 slot 4 power limit 65 mW HotPlug(present) surprise
    cap 05[80] = MSI supports 1 message enabled with 1 message
    cap 0d[90] = PCI Bridge card=0xff501179
    cap 01[a0] = powerspec 2  supports D0 D3  current D0
    ecap 0002[100] = VC 1 max VC0
    ecap 0005[180] = Root Complex Link Declaration 1

pcib3@pci0:0:28:5:	class=0x060400 card=0xff501179 chip=0x294a8086 rev=0x03 hdr=0x01
    vendor     = 'Intel Corporation'
    device     = '82801I (ICH9 Family) PCI Express Port 6'
    class      = bridge
    subclass   = PCI-PCI
    cap 10[40] = PCI-Express 1 root port max data 128(128)
                 link x1(x1) speed 2.5(2.5) ASPM disabled(L0s/L1)
                 slot 5 power limit 65 mW HotPlug(present) surprise
    cap 05[80] = MSI supports 1 message enabled with 1 message
    cap 0d[90] = PCI Bridge card=0xff501179
    cap 01[a0] = powerspec 2  supports D0 D3  current D0
    ecap 0002[100] = VC 1 max VC0
    ecap 0005[180] = Root Complex Link Declaration 1

uhci3@pci0:0:29:0:	class=0x0c0300 card=0xff501179 chip=0x29348086 rev=0x03 hdr=0x00
    vendor     = 'Intel Corporation'
    device     = '82801I (ICH9 Family) USB UHCI Controller'
    class      = serial bus
    subclass   = USB
    bar   [20] = type I/O Port, range 32, base 0x1880, size 32, enabled
    cap 13[50] = PCI Advanced Features: FLR TP

uhci4@pci0:0:29:1:	class=0x0c0300 card=0xff501179 chip=0x29358086 rev=0x03 hdr=0x00
    vendor     = 'Intel Corporation'
    device     = '82801I (ICH9 Family) USB UHCI Controller'
    class      = serial bus
    subclass   = USB
    bar   [20] = type I/O Port, range 32, base 0x18a0, size 32, enabled
    cap 13[50] = PCI Advanced Features: FLR TP

uhci5@pci0:0:29:2:	class=0x0c0300 card=0xff501179 chip=0x29368086 rev=0x03 hdr=0x00
    vendor     = 'Intel Corporation'
    device     = '82801I (ICH9 Family) USB UHCI Controller'
    class      = serial bus
    subclass   = USB
    bar   [20] = type I/O Port, range 32, base 0x18c0, size 32, enabled
    cap 13[50] = PCI Advanced Features: FLR TP

ehci1@pci0:0:29:7:	class=0x0c0320 card=0xff501179 chip=0x293a8086 rev=0x03 hdr=0x00
    vendor     = 'Intel Corporation'
    device     = '82801I (ICH9 Family) USB2 EHCI Controller'
    class      = serial bus
    subclass   = USB
    bar   [10] = type Memory, range 32, base 0xf4a04c00, size 1024, enabled
    cap 01[50] = powerspec 2  supports D0 D3  current D0
    cap 0a[58] = EHCI Debug Port at offset 0xa0 in map 0x14
    cap 13[98] = PCI Advanced Features: FLR TP

pcib4@pci0:0:30:0:	class=0x060401 card=0xff501179 chip=0x24488086 rev=0x93 hdr=0x01
    vendor     = 'Intel Corporation'
    device     = '82801 Mobile PCI Bridge'
    class      = bridge
    subclass   = PCI-PCI
    cap 0d[50] = PCI Bridge card=0xff501179

isab0@pci0:0:31:0:	class=0x060100 card=0xff501179 chip=0x29198086 rev=0x03 hdr=0x00
    vendor     = 'Intel Corporation'
    device     = 'ICH9M LPC Interface Controller'
    class      = bridge
    subclass   = PCI-ISA
    cap 09[e0] = vendor (length 12) Intel cap 1 version 0
		 features: Quick Resume, SATA RAID-5, Mobile, 4 PCI-e x1 slots, SATA RAID-0/1/10

ahci0@pci0:0:31:2:	class=0x010601 card=0xff501179 chip=0x29298086 rev=0x03 hdr=0x00
    vendor     = 'Intel Corporation'
    device     = '82801IBM/IEM (ICH9M/ICH9M-E) 4 port SATA Controller [AHCI mode]'
    class      = mass storage
    subclass   = SATA
    bar   [10] = type I/O Port, range 32, base 0x1818, size 8, enabled
    bar   [14] = type I/O Port, range 32, base 0x180c, size 4, enabled
    bar   [18] = type I/O Port, range 32, base 0x1810, size 8, enabled
    bar   [1c] = type I/O Port, range 32, base 0x1808, size 4, enabled
    bar   [20] = type I/O Port, range 32, base 0x18e0, size 32, enabled
    bar   [24] = type Memory, range 32, base 0xf4a04000, size 2048, enabled
    cap 05[80] = MSI supports 16 messages enabled with 16 messages
    cap 01[70] = powerspec 3  supports D0 D3  current D0
    cap 12[a8] = SATA Index-Data Pair
    cap 13[b0] = PCI Advanced Features: FLR TP

none0@pci0:0:31:3:	class=0x0c0500 card=0xff501179 chip=0x29308086 rev=0x03 hdr=0x00
    vendor     = 'Intel Corporation'
    device     = '82801I (ICH9 Family) SMBus Controller'
    class      = serial bus
    subclass   = SMBus
    bar   [10] = type Memory, range 64, base 0, size 256, enabled
    bar   [20] = type I/O Port, range 32, base 0x1c00, size 32, enabled

mskc0@pci0:7:0:0:	class=0x020000 card=0xff501179 chip=0x436c11ab rev=0x16 hdr=0x00
    vendor     = 'Marvell Technology Group Ltd.'
    device     = '88E8072 PCI-E Gigabit Ethernet Controller'
    class      = network
    subclass   = ethernet
    bar   [10] = type Memory, range 64, base 0xc0100000, size 16384, enabled
    bar   [18] = type I/O Port, range 32, base 0, size 256, disabled
    cap 01[48] = powerspec 3  supports D0 D1 D2 D3  current D0
    cap 05[5c] = MSI supports 1 message, 64 bit enabled with 1 message
    cap 10[c0] = PCI-Express 2 legacy endpoint max data 128(128)
                 link x1(x1) speed 2.5(2.5) ASPM disabled(L0s/L1) ClockPM enabled
    ecap 0001[100] = AER 1 0 fatal 0 non-fatal 1 corrected
    ecap 0003[130] = Serial 1 e13ef5ffff8b2300

ath0@pci0:8:0:0:	class=0x028000 card=0x7141144f chip=0x002a168c rev=0x01 hdr=0x00
    vendor     = 'Qualcomm Atheros'
    device     = 'AR928X Wireless Network Adapter (PCI-Express)'
    class      = network
    bar   [10] = type Memory, range 64, base 0xc0200000, size 65536, enabled
    cap 01[40] = powerspec 2  supports D0 D1 D3  current D0
    cap 05[50] = MSI supports 1 message 
    cap 10[60] = PCI-Express 1 legacy endpoint max data 128(128) RO
                 link x1(x1) speed 2.5(2.5) ASPM disabled(L1)
    cap 11[90] = MSI-X supports 1 message
                 Table in map 0x10[0x0], PBA in map 0x10[0x0]
    ecap 0001[100] = AER 1 0 fatal 1 non-fatal 0 corrected
    ecap 0002[140] = VC 1 max VC0
    ecap 0003[160] = Serial 1 0000000000000000

none1@pci0:10:1:0:	class=0x0c0010 card=0xff501179 chip=0x00f71217 rev=0x02 hdr=0x00
    vendor     = 'O2 Micro, Inc.'
    device     = 'Firewire (IEEE 1394)'
    class      = serial bus
    subclass   = FireWire
    bar   [10] = type Memory, range 32, base 0xff501000, size 4096, enabled
    bar   [14] = type Memory, range 32, base 0xf4700000, size 2048, enabled
    cap 01[60] = powerspec 2  supports D0 D1 D2 D3  current D0

sdhci_pci0@pci0:10:1:2:	class=0x080501 card=0xff501179 chip=0x71201217 rev=0x02 hdr=0x00
    vendor     = 'O2 Micro, Inc.'
    device     = 'Integrated MMC/SD Controller'
    class      = base peripheral
    subclass   = SD host controller
    bar   [10] = type Memory, range 32, base 0xf4700800, size 256, enabled
    cap 01[a0] = powerspec 2  supports D0 D1 D2 D3  current D0

none2@pci0:10:1:3:	class=0x018000 card=0xff501179 chip=0x71301217 rev=0x01 hdr=0x00
    vendor     = 'O2 Micro, Inc.'
    device     = 'Integrated MS/xD Controller'
    class      = mass storage
    bar   [10] = type Memory, range 32, base 0xf4702000, size 4096, enabled
    cap 01[a0] = powerspec 2  supports D0 D1 D2 D3  current D0
