hostb0@pci0:0:0:0:	class=0x060000 card=0xff1e1179 chip=0x15101022 rev=0x00 hdr=0x00
    vendor     = 'Advanced Micro Devices, Inc. [AMD]'
    device     = 'Family 14h Processor Root Complex'
    class      = bridge
    subclass   = HOST-PCI

vgapci0@pci0:0:1:0:	class=0x030000 card=0xfde81179 chip=0x98041002 rev=0x00 hdr=0x00
    vendor     = 'Advanced Micro Devices, Inc. [AMD/ATI]'
    device     = 'Wrestler [Radeon HD 6250]'
    class      = display
    subclass   = VGA
    bar   [10] = type Prefetchable Memory, range 32, base 0xc0000000, size 268435456, enabled
    bar   [14] = type I/O Port, range 32, base 0x4000, size 256, enabled
    bar   [18] = type Memory, range 32, base 0xd0300000, size 262144, enabled
    cap 01[50] = powerspec 3  supports D0 D1 D2 D3  current D0
    cap 10[58] = PCI-Express 2 root endpoint max data 128(128) RO NS
    cap 05[a0] = MSI supports 1 message, 64 bit 
    ecap 000b[100] = Vendor 1 ID 1

ahci0@pci0:0:17:0:	class=0x010601 card=0xff1e1179 chip=0x43911002 rev=0x00 hdr=0x00
    vendor     = 'Advanced Micro Devices, Inc. [AMD/ATI]'
    device     = 'SB7x0/SB8x0/SB9x0 SATA Controller [AHCI mode]'
    class      = mass storage
    subclass   = SATA
    bar   [10] = type I/O Port, range 32, base 0x4138, size 8, enabled
    bar   [14] = type I/O Port, range 32, base 0x414c, size 4, enabled
    bar   [18] = type I/O Port, range 32, base 0x4130, size 8, enabled
    bar   [1c] = type I/O Port, range 32, base 0x4148, size 4, enabled
    bar   [20] = type I/O Port, range 32, base 0x4110, size 16, enabled
    bar   [24] = type Memory, range 32, base 0xd034a000, size 1024, enabled
    cap 12[70] = SATA Index-Data Pair
    cap 13[a4] = PCI Advanced Features: FLR TP

ohci0@pci0:0:18:0:	class=0x0c0310 card=0xff1e1179 chip=0x43971002 rev=0x00 hdr=0x00
    vendor     = 'Advanced Micro Devices, Inc. [AMD/ATI]'
    device     = 'SB7x0/SB8x0/SB9x0 USB OHCI0 Controller'
    class      = serial bus
    subclass   = USB
    bar   [10] = type Memory, range 32, base 0xd0349000, size 4096, enabled

ehci0@pci0:0:18:2:	class=0x0c0320 card=0xff1e1179 chip=0x43961002 rev=0x00 hdr=0x00
    vendor     = 'Advanced Micro Devices, Inc. [AMD/ATI]'
    device     = 'SB7x0/SB8x0/SB9x0 USB EHCI Controller'
    class      = serial bus
    subclass   = USB
    bar   [10] = type Memory, range 32, base 0xd0348000, size 256, enabled
    cap 01[c0] = powerspec 2  supports D0 D1 D2 D3  current D0
    cap 0a[e4] = EHCI Debug Port at offset 0xe0 in map 0x14

ohci1@pci0:0:19:0:	class=0x0c0310 card=0xff1e1179 chip=0x43971002 rev=0x00 hdr=0x00
    vendor     = 'Advanced Micro Devices, Inc. [AMD/ATI]'
    device     = 'SB7x0/SB8x0/SB9x0 USB OHCI0 Controller'
    class      = serial bus
    subclass   = USB
    bar   [10] = type Memory, range 32, base 0xd0347000, size 4096, enabled

ehci1@pci0:0:19:2:	class=0x0c0320 card=0xff1e1179 chip=0x43961002 rev=0x00 hdr=0x00
    vendor     = 'Advanced Micro Devices, Inc. [AMD/ATI]'
    device     = 'SB7x0/SB8x0/SB9x0 USB EHCI Controller'
    class      = serial bus
    subclass   = USB
    bar   [10] = type Memory, range 32, base 0xd0346000, size 256, enabled
    cap 01[c0] = powerspec 2  supports D0 D1 D2 D3  current D0
    cap 0a[e4] = EHCI Debug Port at offset 0xe0 in map 0x14

intsmb0@pci0:0:20:0:	class=0x0c0500 card=0xff1e1179 chip=0x43851002 rev=0x42 hdr=0x00
    vendor     = 'Advanced Micro Devices, Inc. [AMD/ATI]'
    device     = 'SBx00 SMBus Controller'
    class      = serial bus
    subclass   = SMBus

none0@pci0:0:20:2:	class=0x040300 card=0xff1e1179 chip=0x43831002 rev=0x40 hdr=0x00
    vendor     = 'Advanced Micro Devices, Inc. [AMD/ATI]'
    device     = 'SBx00 Azalia (Intel HDA)'
    class      = multimedia
    subclass   = HDA
    bar   [10] = type Memory, range 64, base 0xd0340000, size 16384, enabled
    cap 01[50] = powerspec 2  supports D0 D3  current D0

isab0@pci0:0:20:3:	class=0x060100 card=0xff1e1179 chip=0x439d1002 rev=0x40 hdr=0x00
    vendor     = 'Advanced Micro Devices, Inc. [AMD/ATI]'
    device     = 'SB7x0/SB8x0/SB9x0 LPC host controller'
    class      = bridge
    subclass   = PCI-ISA

pcib1@pci0:0:20:4:	class=0x060400 card=0x00000000 chip=0x43841002 rev=0x40 hdr=0x01
    vendor     = 'Advanced Micro Devices, Inc. [AMD/ATI]'
    device     = 'SBx00 PCI to PCI Bridge'
    class      = bridge
    subclass   = PCI-PCI

pcib2@pci0:0:21:0:	class=0x060400 card=0x00001002 chip=0x43a01002 rev=0x00 hdr=0x01
    vendor     = 'Advanced Micro Devices, Inc. [AMD/ATI]'
    device     = 'SB700/SB800/SB900 PCI to PCI bridge (PCIE port 0)'
    class      = bridge
    subclass   = PCI-PCI
    cap 01[50] = powerspec 3  supports D0 D1 D2 D3  current D0
    cap 10[58] = PCI-Express 2 root port max data 128(128) RO NS
                 link x1(x1) speed 2.5(2.5) ASPM L1(L0s/L1)
                 slot 0 power limit 0 mW HotPlug(present)
    cap 05[a0] = MSI supports 1 message, 64 bit enabled with 1 message
    cap 0d[b0] = PCI Bridge card=0x00001002
    cap 08[b8] = HT MSI fixed address window enabled at 0xfee00000
    ecap 000b[100] = Vendor 1 ID 1

pcib3@pci0:0:21:1:	class=0x060400 card=0x00001002 chip=0x43a11002 rev=0x00 hdr=0x01
    vendor     = 'Advanced Micro Devices, Inc. [AMD/ATI]'
    device     = 'SB700/SB800/SB900 PCI to PCI bridge (PCIE port 1)'
    class      = bridge
    subclass   = PCI-PCI
    cap 01[50] = powerspec 3  supports D0 D1 D2 D3  current D0
    cap 10[58] = PCI-Express 2 root port max data 128(128) RO NS
                 link x1(x1) speed 2.5(2.5) ASPM L1(L0s/L1)
    cap 05[a0] = MSI supports 1 message, 64 bit 
    cap 0d[b0] = PCI Bridge card=0x00001002
    cap 08[b8] = HT MSI fixed address window enabled at 0xfee00000
    ecap 000b[100] = Vendor 1 ID 1

ohci2@pci0:0:22:0:	class=0x0c0310 card=0xff1e1179 chip=0x43971002 rev=0x00 hdr=0x00
    vendor     = 'Advanced Micro Devices, Inc. [AMD/ATI]'
    device     = 'SB7x0/SB8x0/SB9x0 USB OHCI0 Controller'
    class      = serial bus
    subclass   = USB
    bar   [10] = type Memory, range 32, base 0xd0345000, size 4096, enabled

ehci2@pci0:0:22:2:	class=0x0c0320 card=0xff1e1179 chip=0x43961002 rev=0x00 hdr=0x00
    vendor     = 'Advanced Micro Devices, Inc. [AMD/ATI]'
    device     = 'SB7x0/SB8x0/SB9x0 USB EHCI Controller'
    class      = serial bus
    subclass   = USB
    bar   [10] = type Memory, range 32, base 0xd0344000, size 256, enabled
    cap 01[c0] = powerspec 2  supports D0 D1 D2 D3  current D0
    cap 0a[e4] = EHCI Debug Port at offset 0xe0 in map 0x14

hostb1@pci0:0:24:0:	class=0x060000 card=0x00000000 chip=0x17001022 rev=0x43 hdr=0x00
    vendor     = 'Advanced Micro Devices, Inc. [AMD]'
    device     = 'Family 12h/14h Processor Function 0'
    class      = bridge
    subclass   = HOST-PCI

hostb2@pci0:0:24:1:	class=0x060000 card=0x00000000 chip=0x17011022 rev=0x00 hdr=0x00
    vendor     = 'Advanced Micro Devices, Inc. [AMD]'
    device     = 'Family 12h/14h Processor Function 1'
    class      = bridge
    subclass   = HOST-PCI

hostb3@pci0:0:24:2:	class=0x060000 card=0x00000000 chip=0x17021022 rev=0x00 hdr=0x00
    vendor     = 'Advanced Micro Devices, Inc. [AMD]'
    device     = 'Family 12h/14h Processor Function 2'
    class      = bridge
    subclass   = HOST-PCI

hostb4@pci0:0:24:3:	class=0x060000 card=0x00000000 chip=0x17031022 rev=0x00 hdr=0x00
    vendor     = 'Advanced Micro Devices, Inc. [AMD]'
    device     = 'Family 12h/14h Processor Function 3'
    class      = bridge
    subclass   = HOST-PCI
    cap 0f[f0] = unknown

hostb5@pci0:0:24:4:	class=0x060000 card=0x00000000 chip=0x17041022 rev=0x00 hdr=0x00
    vendor     = 'Advanced Micro Devices, Inc. [AMD]'
    device     = 'Family 12h/14h Processor Function 4'
    class      = bridge
    subclass   = HOST-PCI

hostb6@pci0:0:24:5:	class=0x060000 card=0x00000000 chip=0x17181022 rev=0x00 hdr=0x00
    vendor     = 'Advanced Micro Devices, Inc. [AMD]'
    device     = 'Family 12h/14h Processor Function 6'
    class      = bridge
    subclass   = HOST-PCI

hostb7@pci0:0:24:6:	class=0x060000 card=0x00000000 chip=0x17161022 rev=0x00 hdr=0x00
    vendor     = 'Advanced Micro Devices, Inc. [AMD]'
    device     = 'Family 12h/14h Processor Function 5'
    class      = bridge
    subclass   = HOST-PCI

hostb8@pci0:0:24:7:	class=0x060000 card=0x00000000 chip=0x17191022 rev=0x00 hdr=0x00
    vendor     = 'Advanced Micro Devices, Inc. [AMD]'
    device     = 'Family 12h/14h Processor Function 7'
    class      = bridge
    subclass   = HOST-PCI

rtwn0@pci0:2:0:0:	class=0x028000 card=0x818110ec chip=0x817610ec rev=0x01 hdr=0x00
    vendor     = 'Realtek Semiconductor Co., Ltd.'
    device     = 'RTL8188CE 802.11b/g/n WiFi Adapter'
    class      = network
    bar   [10] = type I/O Port, range 32, base 0x3000, size 256, enabled
    bar   [18] = type Memory, range 64, base 0xd0200000, size 16384, enabled
    cap 01[40] = powerspec 3  supports D0 D1 D2 D3  current D0
    cap 05[50] = MSI supports 1 message, 64 bit enabled with 1 message
    cap 10[70] = PCI-Express 2 endpoint max data 128(128) RO
                 link x1(x1) speed 2.5(2.5) ASPM disabled(L0s/L1)
    ecap 0001[100] = AER 1 0 fatal 0 non-fatal 1 corrected
    ecap 0002[140] = VC 1 max VC0
    ecap 0003[160] = Serial 1 019181feff4ce000

alc0@pci0:6:0:0:	class=0x020000 card=0xff1e1179 chip=0x20621969 rev=0xc1 hdr=0x00
    vendor     = 'Qualcomm Atheros'
    device     = 'AR8152 v2.0 Fast Ethernet'
    class      = network
    subclass   = ethernet
    bar   [10] = type Memory, range 64, base 0xd0100000, size 262144, enabled
    bar   [18] = type I/O Port, range 32, base 0x2000, size 128, enabled
    cap 01[40] = powerspec 3  supports D0 D3  current D0
    cap 05[48] = MSI supports 1 message, 64 bit enabled with 1 message
    cap 10[58] = PCI-Express 1 endpoint max data 128(4096)
                 link x1(x1) speed 2.5(2.5) ASPM L1(L0s/L1)
    cap 03[6c] = VPD
    ecap 0001[100] = AER 1 0 fatal 0 non-fatal 0 corrected
    ecap 0003[180] = Serial 1 ffbd153200266cff
