hostb0@pci0:0:0:0:	class=0x060000 card=0x00008086 chip=0xd1308086 rev=0x11 hdr=0x00
    vendor     = 'Intel Corporation'
    device     = 'Core Processor DMI'
    class      = bridge
    subclass   = HOST-PCI
    cap 00[40] = unknown

pcib1@pci0:0:3:0:	class=0x060400 card=0x03771014 chip=0xd1388086 rev=0x11 hdr=0x01
    vendor     = 'Intel Corporation'
    device     = 'Core Processor PCI Express Root Port 1'
    class      = bridge
    subclass   = PCI-PCI
    cap 0d[40] = PCI Bridge card=0x03771014
    cap 05[60] = MSI supports 2 messages, vector masks enabled with 1 message
    cap 10[90] = PCI-Express 2 root port max data 128(256) ARI disabled
                 link x4(x8) speed 2.5(5.0)
                 slot 19 power limit 0 mW
    cap 01[e0] = powerspec 3  supports D0 D3  current D0
    ecap 0001[100] = AER 1 0 fatal 0 non-fatal 0 corrected
    ecap 000d[150] = ACS 1
    ecap 000b[160] = Vendor 0pcib3@pci0:0:5:0:	class=0x060400 card=0x03771014 chip=0xd13a8086 rev=0x11 hdr=0x01
    vendor     = 'Intel Corporation'
    device     = 'Core Processor PCI Express Root Port 3'
    class      = bridge
    subclass   = PCI-PCI
    cap 0d[40] = PCI Bridge card=0x03771014
    cap 05[60] = MSI supports 2 messages, vector masks enabled with 1 message
    cap 10[90] = PCI-Express 2 root port max data 256(256) ARI disabled
                 link x8(x8) speed 5.0(5.0)
                 slot 21 power limit 0 mW
    cap 01[e0] = powerspec 3  supports D0 D3  current D0
    ecap 0001[100] = AER 1 0 fatal 0 non-fatal 0 corrected
    ecap 000d[150] = ACS 1
    ecap 0000[160] = unknown 0

none0@pci0:0:8:0:	class=0x088000 card=0x00000000 chip=0xd1558086 rev=0x11 hdr=0x00
    vendor     = 'Intel Corporation'
    device     = 'Core Processor System Management Registers'
    class      = base peripheral
    cap 10[40] = PCI-Express 2 root endpoint max data 128(128)
                 link x0(x0) ASPM disabled(L0s)
    ecap 000b[100] = Vendor 0none1@pci0:0:8:1:	class=0x088000 card=0x00000000 chip=0xd1568086 rev=0x11 hdr=0x00
    vendor     = 'Intel Corporation'
    device     = 'Core Processor Semaphore and Scratchpad Registers'
    class      = base peripheral
    cap 10[40] = PCI-Express 2 root endpoint max data 128(128)
                 link x0(x0) ASPM disabled(L0s)
    ecap 000b[100] = Vendor 0none2@pci0:0:8:2:	class=0x088000 card=0x00000000 chip=0xd1578086 rev=0x11 hdr=0x00
    vendor     = 'Intel Corporation'
    device     = 'Core Processor System Control and Status Registers'
    class      = base peripheral
    cap 10[40] = PCI-Express 2 root endpoint max data 128(128)
                 link x0(x0) ASPM disabled(L0s)
    ecap 000b[100] = Vendor 0none3@pci0:0:8:3:	class=0x088000 card=0x00000000 chip=0xd1588086 rev=0x11 hdr=0x00
    vendor     = 'Intel Corporation'
    device     = 'Core Processor Miscellaneous Registers'
    class      = base peripheral

none4@pci0:0:16:0:	class=0x088000 card=0x00000000 chip=0xd1508086 rev=0x11 hdr=0x00
    vendor     = 'Intel Corporation'
    device     = 'Core Processor QPI Link'
    class      = base peripheral

none5@pci0:0:16:1:	class=0x088000 card=0x00000000 chip=0xd1518086 rev=0x11 hdr=0x00
    vendor     = 'Intel Corporation'
    device     = 'Core Processor QPI Routing and Protocol Registers'
    class      = base peripheral

ehci0@pci0:0:26:0:	class=0x0c0320 card=0x03771014 chip=0x3b3c8086 rev=0x05 hdr=0x00
    vendor     = 'Intel Corporation'
    device     = '5 Series/3400 Series Chipset USB2 Enhanced Host Controller'
    class      = serial bus
    subclass   = USB
    bar   [10] = type Memory, range 32, base 0x93c01000, size 1024, enabled
    cap 01[50] = powerspec 2  supports D0 D3  current D0
    cap 0a[58] = EHCI Debug Port at offset 0xa0 in map 0x14
    cap 13[98] = PCI Advanced Features: FLR TP

pcib4@pci0:0:28:0:	class=0x060400 card=0x03771014 chip=0x3b428086 rev=0x05 hdr=0x01
    vendor     = 'Intel Corporation'
    device     = '5 Series/3400 Series Chipset PCI Express Root Port 1'
    class      = bridge
    subclass   = PCI-PCI
    cap 10[40] = PCI-Express 2 root port max data 128(128)
                 link x0(x4) speed 0.0(2.5) ASPM disabled(L0s/L1)
                 slot 5 power limit 0 mW HotPlug(empty) surprise
    cap 05[80] = MSI supports 1 message 
    cap 0d[90] = PCI Bridge card=0x03771014
    cap 01[a0] = powerspec 2  supports D0 D3  current D0

pcib5@pci0:0:28:4:	class=0x060400 card=0x03771014 chip=0x3b4a8086 rev=0x05 hdr=0x01
    vendor     = 'Intel Corporation'
    device     = '5 Series/3400 Series Chipset PCI Express Root Port 5'
    class      = bridge
    subclass   = PCI-PCI
    cap 10[40] = PCI-Express 2 root port max data 128(128)
                 link x1(x1) speed 2.5(2.5) ASPM disabled(L0s/L1)
                 slot 4 power limit 100 mW HotPlug(present) surprise
    cap 05[80] = MSI supports 1 message 
    cap 0d[90] = PCI Bridge card=0x03771014
    cap 01[a0] = powerspec 2  supports D0 D3  current D0

pcib7@pci0:0:28:5:	class=0x060400 card=0x03771014 chip=0x3b4c8086 rev=0x05 hdr=0x01
    vendor     = 'Intel Corporation'
    device     = '5 Series/3400 Series Chipset PCI Express Root Port 6'
    class      = bridge
    subclass   = PCI-PCI
    cap 10[40] = PCI-Express 2 root port max data 128(128)
                 link x1(x1) speed 2.5(2.5) ASPM disabled(L0s/L1)
                 slot 5 power limit 100 mW HotPlug(present) surprise
    cap 05[80] = MSI supports 1 message 
    cap 0d[90] = PCI Bridge card=0x03771014
    cap 01[a0] = powerspec 2  supports D0 D3  current D0

pcib8@pci0:0:28:6:	class=0x060400 card=0x03771014 chip=0x3b4e8086 rev=0x05 hdr=0x01
    vendor     = 'Intel Corporation'
    device     = '5 Series/3400 Series Chipset PCI Express Root Port 7'
    class      = bridge
    subclass   = PCI-PCI
    cap 10[40] = PCI-Express 2 root port max data 128(128)
                 link x0(x1) speed 0.0(2.5) ASPM disabled(L0s/L1)
                 slot 6 power limit 100 mW HotPlug(empty) surprise
    cap 05[80] = MSI supports 1 message 
    cap 0d[90] = PCI Bridge card=0x03771014
    cap 01[a0] = powerspec 2  supports D0 D3  current D0

pcib9@pci0:0:28:7:	class=0x060400 card=0x03771014 chip=0x3b508086 rev=0x05 hdr=0x01
    vendor     = 'Intel Corporation'
    device     = '5 Series/3400 Series Chipset PCI Express Root Port 8'
    class      = bridge
    subclass   = PCI-PCI
    cap 10[40] = PCI-Express 2 root port max data 128(128)
                 link x1(x1) speed 2.5(2.5) ASPM disabled(L0s/L1)
                 slot 7 power limit 100 mW HotPlug(present) surprise
    cap 05[80] = MSI supports 1 message 
    cap 0d[90] = PCI Bridge card=0x03771014
    cap 01[a0] = powerspec 2  supports D0 D3  current D0

ehci1@pci0:0:29:0:	class=0x0c0320 card=0x03771014 chip=0x3b348086 rev=0x05 hdr=0x00
    vendor     = 'Intel Corporation'
    device     = '5 Series/3400 Series Chipset USB2 Enhanced Host Controller'
    class      = serial bus
    subclass   = USB
    bar   [10] = type Memory, range 32, base 0x93c00000, size 1024, enabled
    cap 01[50] = powerspec 2  supports D0 D3  current D0
    cap 0a[58] = EHCI Debug Port at offset 0xa0 in map 0x14
    cap 13[98] = PCI Advanced Features: FLR TP

pcib10@pci0:0:30:0:	class=0x060401 card=0x03771014 chip=0x244e8086 rev=0xa5 hdr=0x01
    vendor     = 'Intel Corporation'
    device     = '82801 PCI Bridge'
    class      = bridge
    subclass   = PCI-PCI
    cap 0d[50] = PCI Bridge card=0x03771014

isab0@pci0:0:31:0:	class=0x060100 card=0x03771014 chip=0x3b148086 rev=0x05 hdr=0x00
    vendor     = 'Intel Corporation'
    device     = '3420 Chipset LPC Interface Controller'
    class      = bridge
    subclass   = PCI-ISA
    cap 09[e0] = vendor (length 16) Intel cap 1 version 1

atapci0@pci0:0:31:2:	class=0x01018f card=0x03771014 chip=0x3b208086 rev=0x05 hdr=0x00
    vendor     = 'Intel Corporation'
    device     = '5 Series/3400 Series Chipset 4 port SATA IDE Controller'
    class      = mass storage
    subclass   = ATA
    bar   [10] = type I/O Port, range 32, base 0x4078, size 8, enabled
    bar   [14] = type I/O Port, range 32, base 0x408c, size 4, enabled
    bar   [18] = type I/O Port, range 32, base 0x4070, size 8, enabled
    bar   [1c] = type I/O Port, range 32, base 0x4088, size 4, enabled
    bar   [20] = type I/O Port, range 32, base 0x4050, size 16, enabled
    bar   [24] = type I/O Port, range 32, base 0x4040, size 16, enabled
    cap 01[70] = powerspec 3  supports D0 D3  current D0
    cap 13[b0] = PCI Advanced Features: FLR TP

none6@pci0:0:31:3:	class=0x0c0500 card=0x03771014 chip=0x3b308086 rev=0x05 hdr=0x00
    vendor     = 'Intel Corporation'
    device     = '5 Series/3400 Series Chipset SMBus Controller'
    class      = serial bus
    subclass   = SMBus
    bar   [10] = type Memory, range 64, base 0x93c02000, size 256, enabled
    bar   [20] = type I/O Port, range 32, base 0x4000, size 32, enabled

atapci1@pci0:0:31:5:	class=0x010185 card=0x03771014 chip=0x3b268086 rev=0x05 hdr=0x00
    vendor     = 'Intel Corporation'
    device     = '5 Series/3400 Series Chipset 2 port SATA IDE Controller'
    class      = mass storage
    subclass   = ATA
    bar   [10] = type I/O Port, range 32, base 0x4068, size 8, enabled
    bar   [14] = type I/O Port, range 32, base 0x4084, size 4, enabled
    bar   [18] = type I/O Port, range 32, base 0x4060, size 8, enabled
    bar   [1c] = type I/O Port, range 32, base 0x4080, size 4, enabled
    bar   [20] = type I/O Port, range 32, base 0x4030, size 16, enabled
    bar   [24] = type I/O Port, range 32, base 0x4020, size 16, enabled
    cap 01[70] = powerspec 3  supports D0 D3  current D0
    cap 13[b0] = PCI Advanced Features: FLR TP

pcib2@pci0:26:0:0:	class=0x060400 card=0x00000000 chip=0x01031166 rev=0xc3 hdr=0x01
    vendor     = 'Broadcom'
    device     = 'EPB PCI-Express to PCI-X Bridge'
    class      = bridge
    subclass   = PCI-PCI
    cap 10[60] = PCI-Express 1 PCI bridge max data 128(128)
                 link x4(x4) speed 2.5(2.5) ASPM disabled(L0s/L1)
    cap 07[90] = PCI-X bridge 
    cap 01[b0] = powerspec 2  supports D0 D3  current D0
    ecap 0001[100] = AER 1 0 fatal 1 non-fatal 0 corrected
    ecap 0004[14c] = Power Budgeting 1
    ecap 0003[160] = Serial 1 001018fffe4c7a26

bce0@pci0:27:0:0:	class=0x020000 card=0x164c14e4 chip=0x164c14e4 rev=0x12 hdr=0x00
    vendor     = 'Broadcom Inc. and subsidiaries'
    device     = 'NetXtreme II BCM5708 Gigabit Ethernet'
    class      = network
    subclass   = ethernet
    bar   [10] = type Memory, range 64, base 0x90000000, size 33554432, enabled
    cap 07[40] = PCI-X 64-bit supports 133MHz, 512 burst read, 8 split transactions
    cap 01[48] = powerspec 2  supports D0 D3  current D0
    cap 03[50] = VPD
    cap 05[58] = MSI supports 1 message, 64 bit enabled with 1 message

mfi0@pci0:31:0:0:	class=0x010400 card=0x03b11014 chip=0x00731000 rev=0x03 hdr=0x00
    vendor     = 'LSI Logic / Symbios Logic'
    device     = 'MegaRAID SAS 2008 [Falcon]'
    class      = mass storage
    subclass   = RAID
    bar   [10] = type I/O Port, range 32, base 0x3000, size 256, enabled
    bar   [14] = type Memory, range 64, base 0x93b40000, size 16384, enabled
    bar   [1c] = type Memory, range 64, base 0x93b00000, size 262144, enabled
    cap 01[50] = powerspec 3  supports D0 D1 D2 D3  current D0
    cap 10[68] = PCI-Express 2 endpoint max data 256(4096) FLR RO NS
                 link x8(x8) speed 5.0(5.0) ASPM disabled(L0s)
    cap 03[d0] = VPD
    cap 05[a8] = MSI supports 1 message, 64 bit enabled with 1 message
    cap 11[c0] = MSI-X supports 15 messages
                 Table in map 0x14[0x2000], PBA in map 0x14[0x3800]
    ecap 0001[100] = AER 1 0 fatal 0 non-fatal 1 corrected
    ecap 0004[138] = Power Budgeting 1

pcib6@pci0:6:0:0:	class=0x060400 card=0x03691014 chip=0x0452101b rev=0x01 hdr=0x01
    vendor     = 'Vitesse Semiconductor'
    device     = 'VSC452 [SuperBMC]'
    class      = bridge
    subclass   = PCI-PCI
    cap 05[50] = MSI supports 2 messages, 64 bit 
    cap 01[78] = powerspec 3  supports D0 D3  current D0
    cap 10[80] = PCI-Express 1 PCI bridge max data 128(128) RO NS
                 link x1(x1) speed 2.5(2.5) ASPM disabled(L0s)
    cap 0d[a4] = PCI Bridge card=0x03691014
    ecap 0002[100] = VC 1 max VC0

vgapci0@pci0:7:0:0:	class=0x030000 card=0x03691014 chip=0x0530102b rev=0x00 hdr=0x00
    vendor     = 'Matrox Electronics Systems Ltd.'
    device     = 'MGA G200EV'
    class      = display
    subclass   = VGA
    bar   [10] = type Prefetchable Memory, range 32, base 0x92000000, size 16777216, enabled
    bar   [14] = type Memory, range 32, base 0x93800000, size 16384, enabled
    bar   [18] = type Memory, range 32, base 0x93000000, size 8388608, enabled
    cap 01[dc] = powerspec 1  supports D0 D3  current D0

em0@pci0:11:0:0:	class=0x020000 card=0x03bd1014 chip=0x10d38086 rev=0x00 hdr=0x00
    vendor     = 'Intel Corporation'
    device     = '82574L Gigabit Network Connection'
    class      = network
    subclass   = ethernet
    bar   [10] = type Memory, range 32, base 0x93a80000, size 131072, enabled
    bar   [14] = type Memory, range 32, base 0x93a00000, size 524288, enabled
    bar   [18] = type I/O Port, range 32, base 0x2000, size 32, enabled
    bar   [1c] = type Memory, range 32, base 0x93aa0000, size 16384, enabled
    cap 01[c8] = powerspec 2  supports D0 D3  current D0
    cap 05[d0] = MSI supports 1 message, 64 bit 
    cap 10[e0] = PCI-Express 1 endpoint max data 128(256) RO NS
                 link x1(x1) speed 2.5(2.5) ASPM disabled(L0s/L1)
    cap 11[a0] = MSI-X supports 5 messages, enabled
                 Table in map 0x1c[0x0], PBA in map 0x1c[0x2000]
    ecap 0001[100] = AER 1 0 fatal 0 non-fatal 1 corrected
    ecap 0003[140] = Serial 1 5cf3fcfffff16c9c

em1@pci0:21:0:0:	class=0x020000 card=0x03bd1014 chip=0x10d38086 rev=0x00 hdr=0x00
    vendor     = 'Intel Corporation'
    device     = '82574L Gigabit Network Connection'
    class      = network
    subclass   = ethernet
    bar   [10] = type Memory, range 32, base 0x93980000, size 131072, enabled
    bar   [14] = type Memory, range 32, base 0x93900000, size 524288, enabled
    bar   [18] = type I/O Port, range 32, base 0x1000, size 32, enabled
    bar   [1c] = type Memory, range 32, base 0x939a0000, size 16384, enabled
    cap 01[c8] = powerspec 2  supports D0 D3  current D0
    cap 05[d0] = MSI supports 1 message, 64 bit 
    cap 10[e0] = PCI-Express 1 endpoint max data 128(256) RO NS
                 link x1(x1) speed 2.5(2.5) ASPM disabled(L0s/L1)
    cap 11[a0] = MSI-X supports 5 messages, enabled
                 Table in map 0x1c[0x0], PBA in map 0x1c[0x2000]
    ecap 0001[100] = AER 1 0 fatal 0 non-fatal 1 corrected
    ecap 0003[140] = Serial 1 5cf3fcfffff16c9d
