hostb0@pci0:0:0:0:	class=0x060000 card=0x04ce1028 chip=0x0e008086 rev=0x04 hdr=0x00
    vendor     = 'Intel Corporation'
    device     = 'Xeon E7 v2/Xeon E5 v2/Core i7 DMI2'
    class      = bridge
    subclass   = HOST-PCI
    cap 10[90] = PCI-Express 2 root port max data 128(128)
                 link x0(x4) speed 0.0(2.5) ASPM disabled(L1)
    cap 01[e0] = powerspec 3  supports D0 D3  current D0
    ecap 000b[100] = Vendor 1 ID 2
    ecap 000b[144] = Vendor 1 ID 4
    ecap 000b[1d0] = Vendor 1 ID 3
    ecap 000b[280] = Vendor 1 ID 5

pcib1@pci0:0:1:0:	class=0x060400 card=0x04ce1028 chip=0x0e028086 rev=0x04 hdr=0x01
    vendor     = 'Intel Corporation'
    device     = 'Xeon E7 v2/Xeon E5 v2/Core i7 PCI Express Root Port 1a'
    class      = bridge
    subclass   = PCI-PCI
    cap 0d[40] = PCI Bridge card=0x04ce1028
    cap 05[60] = MSI supports 2 messages, vector masks 
    cap 10[90] = PCI-Express 2 root port max data 256(256) ARI disabled
                 link x1(x4) speed 5.0(8.0) ASPM disabled(L1)
    cap 01[e0] = powerspec 3  supports D0 D3  current D0
    ecap 000b[100] = Vendor 1 ID 2
    ecap 000d[110] = ACS 1
    ecap 0001[148] = AER 1 0 fatal 0 non-fatal 0 corrected
    ecap 000b[1d0] = Vendor 1 ID 3
    ecap 0019[250] = PCIe Sec 1 lane errors 0
    ecap 000b[280] = Vendor 1 ID 5

pcib2@pci0:0:1:1:	class=0x060400 card=0x04ce1028 chip=0x0e038086 rev=0x04 hdr=0x01
    vendor     = 'Intel Corporation'
    device     = 'Xeon E7 v2/Xeon E5 v2/Core i7 PCI Express Root Port 1b'
    class      = bridge
    subclass   = PCI-PCI
    cap 0d[40] = PCI Bridge card=0x04ce1028
    cap 05[60] = MSI supports 2 messages, vector masks 
    cap 10[90] = PCI-Express 2 root port max data 256(256) ARI disabled
                 link x1(x4) speed 5.0(8.0) ASPM disabled(L1)
    cap 01[e0] = powerspec 3  supports D0 D3  current D0
    ecap 000b[100] = Vendor 1 ID 2
    ecap 000d[110] = ACS 1
    ecap 0001[148] = AER 1 0 fatal 0 non-fatal 0 corrected
    ecap 000b[1d0] = Vendor 1 ID 3
    ecap 0019[250] = PCIe Sec 1 lane errors 0
    ecap 000b[280] = Vendor 1 ID 5

pcib3@pci0:0:2:0:	class=0x060400 card=0x04ce1028 chip=0x0e048086 rev=0x04 hdr=0x01
    vendor     = 'Intel Corporation'
    device     = 'Xeon E7 v2/Xeon E5 v2/Core i7 PCI Express Root Port 2a'
    class      = bridge
    subclass   = PCI-PCI
    cap 0d[40] = PCI Bridge card=0x04ce1028
    cap 05[60] = MSI supports 2 messages, vector masks 
    cap 10[90] = PCI-Express 2 root port max data 128(256) ARI disabled
                 link x0(x8) speed 0.0(8.0) ASPM disabled(L1)
    cap 01[e0] = powerspec 3  supports D0 D3  current D0
    ecap 000b[100] = Vendor 1 ID 2
    ecap 000d[110] = ACS 1
    ecap 0001[148] = AER 1 0 fatal 0 non-fatal 0 corrected
    ecap 000b[1d0] = Vendor 1 ID 3
    ecap 0019[250] = PCIe Sec 1 lane errors 0xff00
    ecap 000b[280] = Vendor 1 ID 5

pcib4@pci0:0:2:2:	class=0x060400 card=0x04ce1028 chip=0x0e068086 rev=0x04 hdr=0x01
    vendor     = 'Intel Corporation'
    device     = 'Xeon E7 v2/Xeon E5 v2/Core i7 PCI Express Root Port 2c'
    class      = bridge
    subclass   = PCI-PCI
    cap 0d[40] = PCI Bridge card=0x04ce1028
    cap 05[60] = MSI supports 2 messages, vector masks 
    cap 10[90] = PCI-Express 2 root port max data 256(256) ARI enabled
                 link x8(x8) speed 5.0(8.0) ASPM disabled(L1)
    cap 01[e0] = powerspec 3  supports D0 D3  current D0
    ecap 000b[100] = Vendor 1 ID 2
    ecap 000d[110] = ACS 1
    ecap 0001[148] = AER 1 0 fatal 0 non-fatal 0 corrected
    ecap 000b[1d0] = Vendor 1 ID 3
    ecap 0019[250] = PCIe Sec 1 lane errors 0xff
    ecap 000b[280] = Vendor 1 ID 5

pcib5@pci0:0:3:0:	class=0x060400 card=0x04ce1028 chip=0x0e088086 rev=0x04 hdr=0x01
    vendor     = 'Intel Corporation'
    device     = 'Xeon E7 v2/Xeon E5 v2/Core i7 PCI Express Root Port 3a'
    class      = bridge
    subclass   = PCI-PCI
    cap 0d[40] = PCI Bridge card=0x04ce1028
    cap 05[60] = MSI supports 2 messages, vector masks 
    cap 10[90] = PCI-Express 2 root port max data 256(256) ARI disabled
                 link x4(x16) speed 5.0(8.0) ASPM disabled(L1)
                 slot 3 power limit 25000 mW
    cap 01[e0] = powerspec 3  supports D0 D3  current D0
    ecap 000b[100] = Vendor 1 ID 2
    ecap 000d[110] = ACS 1
    ecap 0001[148] = AER 1 0 fatal 0 non-fatal 0 corrected
    ecap 000b[1d0] = Vendor 1 ID 3
    ecap 0019[250] = PCIe Sec 1 lane errors 0
    ecap 000b[280] = Vendor 1 ID 5

none0@pci0:0:5:0:	class=0x088000 card=0x04ce1028 chip=0x0e288086 rev=0x04 hdr=0x00
    vendor     = 'Intel Corporation'
    device     = 'Xeon E7 v2/Xeon E5 v2/Core i7 VTd/Memory Map/Misc'
    class      = base peripheral
    cap 10[40] = PCI-Express 2 root endpoint max data 128(128)

none1@pci0:0:5:2:	class=0x088000 card=0x04ce1028 chip=0x0e2a8086 rev=0x04 hdr=0x00
    vendor     = 'Intel Corporation'
    device     = 'Xeon E7 v2/Xeon E5 v2/Core i7 IIO RAS'
    class      = base peripheral
    cap 10[40] = PCI-Express 2 root endpoint max data 128(128)

pcib6@pci0:0:17:0:	class=0x060400 card=0x04ce1028 chip=0x1d3e8086 rev=0x05 hdr=0x01
    vendor     = 'Intel Corporation'
    device     = 'C600/X79 series chipset PCI Express Virtual Root Port'
    class      = bridge
    subclass   = PCI-PCI
    cap 10[40] = PCI-Express 2 root port max data 128(128) ARI disabled
                 link x1(x1) speed 2.5(2.5) ASPM disabled(L0s/L1)
    cap 01[80] = powerspec 3  supports D0 D3  current D0
    cap 0d[88] = PCI Bridge card=0x04ce1028
    cap 05[90] = MSI supports 1 message 
    ecap 0001[100] = AER 1 0 fatal 0 non-fatal 0 corrected
    ecap 000d[138] = ACS 1

none2@pci0:0:22:0:	class=0x078000 card=0x04ce1028 chip=0x1d3a8086 rev=0x05 hdr=0x00
    vendor     = 'Intel Corporation'
    device     = 'C600/X79 series chipset MEI Controller'
    class      = simple comms
    bar   [10] = type Memory, range 64, base 0xdc0fb000, size 16, enabled
    cap 01[50] = powerspec 3  supports D0 D3  current D0
    cap 05[8c] = MSI supports 1 message, 64 bit 

none3@pci0:0:22:1:	class=0x078000 card=0x04ce1028 chip=0x1d3b8086 rev=0x05 hdr=0x00
    vendor     = 'Intel Corporation'
    device     = 'C600/X79 series chipset MEI Controller'
    class      = simple comms
    bar   [10] = type Memory, range 64, base 0xdc0fc000, size 16, enabled
    cap 01[50] = powerspec 3  supports D0 D3  current D0
    cap 05[8c] = MSI supports 1 message, 64 bit 

ehci0@pci0:0:26:0:	class=0x0c0320 card=0x04ce1028 chip=0x1d2d8086 rev=0x05 hdr=0x00
    vendor     = 'Intel Corporation'
    device     = 'C600/X79 series chipset USB2 Enhanced Host Controller'
    class      = serial bus
    subclass   = USB
    bar   [10] = type Memory, range 32, base 0xdc0fd000, size 1024, enabled
    cap 01[50] = powerspec 2  supports D0 D3  current D0
    cap 0a[58] = EHCI Debug Port at offset 0xa0 in map 0x14
    cap 13[98] = PCI Advanced Features: FLR TP

pcib7@pci0:0:28:0:	class=0x060400 card=0x04ce1028 chip=0x1d108086 rev=0xb5 hdr=0x01
    vendor     = 'Intel Corporation'
    device     = 'C600/X79 series chipset PCI Express Root Port 1'
    class      = bridge
    subclass   = PCI-PCI
    cap 10[40] = PCI-Express 2 root port max data 128(128)
                 link x0(x4) speed 0.0(5.0) ASPM disabled(L0s/L1)
    cap 05[80] = MSI supports 1 message 
    cap 0d[90] = PCI Bridge card=0x04ce1028
    cap 01[a0] = powerspec 2  supports D0 D3  current D0
    ecap 0001[100] = AER 1 0 fatal 0 non-fatal 0 corrected

pcib8@pci0:0:28:7:	class=0x060400 card=0x04ce1028 chip=0x1d1e8086 rev=0xb5 hdr=0x01
    vendor     = 'Intel Corporation'
    device     = 'C600/X79 series chipset PCI Express Root Port 8'
    class      = bridge
    subclass   = PCI-PCI
    cap 10[40] = PCI-Express 2 root port max data 128(128)
                 link x1(x1) speed 2.5(5.0) ASPM disabled(L0s/L1)
    cap 05[80] = MSI supports 1 message 
    cap 0d[90] = PCI Bridge card=0x04ce1028
    cap 01[a0] = powerspec 2  supports D0 D3  current D0
    ecap 0001[100] = AER 1 0 fatal 0 non-fatal 0 corrected

ehci1@pci0:0:29:0:	class=0x0c0320 card=0x04ce1028 chip=0x1d268086 rev=0x05 hdr=0x00
    vendor     = 'Intel Corporation'
    device     = 'C600/X79 series chipset USB2 Enhanced Host Controller'
    class      = serial bus
    subclass   = USB
    bar   [10] = type Memory, range 32, base 0xdc0fe000, size 1024, enabled
    cap 01[50] = powerspec 2  supports D0 D3  current D0
    cap 0a[58] = EHCI Debug Port at offset 0xa0 in map 0x14
    cap 13[98] = PCI Advanced Features: FLR TP

pcib13@pci0:0:30:0:	class=0x060401 card=0x04ce1028 chip=0x244e8086 rev=0xa5 hdr=0x01
    vendor     = 'Intel Corporation'
    device     = '82801 PCI Bridge'
    class      = bridge
    subclass   = PCI-PCI
    cap 0d[50] = PCI Bridge card=0x04ce1028

isab0@pci0:0:31:0:	class=0x060100 card=0x04ce1028 chip=0x1d418086 rev=0x05 hdr=0x00
    vendor     = 'Intel Corporation'
    device     = 'C600/X79 series chipset LPC Controller'
    class      = bridge
    subclass   = PCI-ISA
    cap 09[e0] = vendor (length 12) Intel cap 1 version 0
		 features: AMT, 4 PCI-e x1 slots

ahci0@pci0:0:31:2:	class=0x010601 card=0x04ce1028 chip=0x1d028086 rev=0x05 hdr=0x00
    vendor     = 'Intel Corporation'
    device     = 'C600/X79 series chipset 6-Port SATA AHCI Controller'
    class      = mass storage
    subclass   = SATA
    bar   [10] = type I/O Port, range 32, base 0xece8, size 8, enabled
    bar   [14] = type I/O Port, range 32, base 0xecf8, size 4, enabled
    bar   [18] = type I/O Port, range 32, base 0xecf0, size 8, enabled
    bar   [1c] = type I/O Port, range 32, base 0xecfc, size 4, enabled
    bar   [20] = type I/O Port, range 32, base 0xecc0, size 32, enabled
    bar   [24] = type Memory, range 32, base 0xdc0ff000, size 2048, enabled
    cap 05[80] = MSI supports 1 message enabled with 1 message
    cap 01[70] = powerspec 3  supports D0 D3  current D0
    cap 12[a8] = SATA Index-Data Pair
    cap 13[b0] = PCI Advanced Features: FLR TP

bge0@pci0:2:0:0:	class=0x020000 card=0x1f5b1028 chip=0x165f14e4 rev=0x00 hdr=0x00
    vendor     = 'Broadcom Inc. and subsidiaries'
    device     = 'NetXtreme BCM5720 2-port Gigabit Ethernet PCIe'
    class      = network
    subclass   = ethernet
    bar   [10] = type Prefetchable Memory, range 64, base 0xd50a0000, size 65536, enabled
    bar   [18] = type Prefetchable Memory, range 64, base 0xd50b0000, size 65536, enabled
    bar   [20] = type Prefetchable Memory, range 64, base 0xd50c0000, size 65536, enabled
    cap 01[48] = powerspec 3  supports D0 D3  current D0
    cap 03[50] = VPD
    cap 05[58] = MSI supports 8 messages, 64 bit enabled with 1 message
    cap 11[a0] = MSI-X supports 17 messages
                 Table in map 0x20[0x0], PBA in map 0x20[0x1000]
    cap 10[ac] = PCI-Express 2 endpoint max data 256(256) FLR
                 link x1(x2) speed 5.0(5.0) ASPM disabled(L0s/L1)
    ecap 0001[100] = AER 1 0 fatal 0 non-fatal 1 corrected
    ecap 0003[13c] = Serial 1 0000549f3510f1fa
    ecap 0004[150] = Power Budgeting 1
    ecap 0002[160] = VC 1 max VC0

bge1@pci0:2:0:1:	class=0x020000 card=0x1f5b1028 chip=0x165f14e4 rev=0x00 hdr=0x00
    vendor     = 'Broadcom Inc. and subsidiaries'
    device     = 'NetXtreme BCM5720 2-port Gigabit Ethernet PCIe'
    class      = network
    subclass   = ethernet
    bar   [10] = type Prefetchable Memory, range 64, base 0xd50d0000, size 65536, enabled
    bar   [18] = type Prefetchable Memory, range 64, base 0xd50e0000, size 65536, enabled
    bar   [20] = type Prefetchable Memory, range 64, base 0xd50f0000, size 65536, enabled
    cap 01[48] = powerspec 3  supports D0 D3  current D0
    cap 03[50] = VPD
    cap 05[58] = MSI supports 8 messages, 64 bit enabled with 1 message
    cap 11[a0] = MSI-X supports 17 messages
                 Table in map 0x20[0x0], PBA in map 0x20[0x1000]
    cap 10[ac] = PCI-Express 2 endpoint max data 256(256) FLR
                 link x1(x2) speed 5.0(5.0) ASPM disabled(L0s/L1)
    ecap 0001[100] = AER 1 0 fatal 0 non-fatal 1 corrected
    ecap 0003[13c] = Serial 1 0000549f3510f1fb
    ecap 0004[150] = Power Budgeting 1
    ecap 0002[160] = VC 1 max VC0

bge2@pci0:1:0:0:	class=0x020000 card=0x1f5b1028 chip=0x165f14e4 rev=0x00 hdr=0x00
    vendor     = 'Broadcom Inc. and subsidiaries'
    device     = 'NetXtreme BCM5720 2-port Gigabit Ethernet PCIe'
    class      = network
    subclass   = ethernet
    bar   [10] = type Prefetchable Memory, range 64, base 0xd51a0000, size 65536, enabled
    bar   [18] = type Prefetchable Memory, range 64, base 0xd51b0000, size 65536, enabled
    bar   [20] = type Prefetchable Memory, range 64, base 0xd51c0000, size 65536, enabled
    cap 01[48] = powerspec 3  supports D0 D3  current D0
    cap 03[50] = VPD
    cap 05[58] = MSI supports 8 messages, 64 bit enabled with 1 message
    cap 11[a0] = MSI-X supports 17 messages
                 Table in map 0x20[0x0], PBA in map 0x20[0x1000]
    cap 10[ac] = PCI-Express 2 endpoint max data 256(256) FLR
                 link x1(x2) speed 5.0(5.0) ASPM disabled(L0s/L1)
    ecap 0001[100] = AER 1 0 fatal 0 non-fatal 1 corrected
    ecap 0003[13c] = Serial 1 0000549f3510f1f8
    ecap 0004[150] = Power Budgeting 1
    ecap 0002[160] = VC 1 max VC0

bge3@pci0:1:0:1:	class=0x020000 card=0x1f5b1028 chip=0x165f14e4 rev=0x00 hdr=0x00
    vendor     = 'Broadcom Inc. and subsidiaries'
    device     = 'NetXtreme BCM5720 2-port Gigabit Ethernet PCIe'
    class      = network
    subclass   = ethernet
    bar   [10] = type Prefetchable Memory, range 64, base 0xd51d0000, size 65536, enabled
    bar   [18] = type Prefetchable Memory, range 64, base 0xd51e0000, size 65536, enabled
    bar   [20] = type Prefetchable Memory, range 64, base 0xd51f0000, size 65536, enabled
    cap 01[48] = powerspec 3  supports D0 D3  current D0
    cap 03[50] = VPD
    cap 05[58] = MSI supports 8 messages, 64 bit enabled with 1 message
    cap 11[a0] = MSI-X supports 17 messages
                 Table in map 0x20[0x0], PBA in map 0x20[0x1000]
    cap 10[ac] = PCI-Express 2 endpoint max data 256(256) FLR
                 link x1(x2) speed 5.0(5.0) ASPM disabled(L0s/L1)
    ecap 0001[100] = AER 1 0 fatal 0 non-fatal 1 corrected
    ecap 0003[13c] = Serial 1 0000549f3510f1f9
    ecap 0004[150] = Power Budgeting 1
    ecap 0002[160] = VC 1 max VC0

mfi0@pci0:3:0:0:	class=0x010400 card=0x1f341028 chip=0x005b1000 rev=0x01 hdr=0x00
    vendor     = 'LSI Logic / Symbios Logic'
    device     = 'MegaRAID SAS 2208 [Thunderbolt]'
    class      = mass storage
    subclass   = RAID
    bar   [10] = type I/O Port, range 32, base 0xfc00, size 256, enabled
    bar   [14] = type Memory, range 64, base 0xd9ffc000, size 16384, enabled
    bar   [1c] = type Memory, range 64, base 0xd9f80000, size 262144, enabled
    cap 01[50] = powerspec 3  supports D0 D1 D2 D3  current D0
    cap 10[68] = PCI-Express 2 endpoint max data 256(4096) FLR RO NS
                 link x8(x8) speed 5.0(5.0) ASPM disabled(L0s)
    cap 03[d0] = VPD
    cap 05[a8] = MSI supports 1 message, 64 bit enabled with 1 message
    cap 11[c0] = MSI-X supports 16 messages
                 Table in map 0x14[0x2000], PBA in map 0x14[0x3000]
    ecap 0001[100] = AER 2 0 fatal 0 non-fatal 0 corrected
    ecap 0019[1e0] = PCIe Sec 1 lane errors 0
    ecap 0004[1c0] = Power Budgeting 1
    ecap 0016[190] = DPA 1
    ecap 000e[148] = ARI 1

bge4@pci0:5:0:0:	class=0x020000 card=0x190414e4 chip=0x165714e4 rev=0x01 hdr=0x00
    vendor     = 'Broadcom Inc. and subsidiaries'
    device     = 'NetXtreme BCM5719 Gigabit Ethernet PCIe'
    class      = network
    subclass   = ethernet
    bar   [10] = type Prefetchable Memory, range 64, base 0xd5240000, size 65536, enabled
    bar   [18] = type Prefetchable Memory, range 64, base 0xd5250000, size 65536, enabled
    bar   [20] = type Prefetchable Memory, range 64, base 0xd5260000, size 65536, enabled
    cap 01[48] = powerspec 3  supports D0 D3  current D0
    cap 03[50] = VPD
    cap 05[58] = MSI supports 8 messages, 64 bit enabled with 1 message
    cap 11[a0] = MSI-X supports 17 messages
                 Table in map 0x20[0x0], PBA in map 0x20[0x1000]
    cap 10[ac] = PCI-Express 2 endpoint max data 256(256) FLR
                 link x4(x4) speed 5.0(5.0) ASPM disabled(L0s/L1)
    ecap 0001[100] = AER 1 0 fatal 0 non-fatal 1 corrected
    ecap 0003[13c] = Serial 1 0000000af77df040
    ecap 0004[150] = Power Budgeting 1
    ecap 0002[160] = VC 1 max VC0

bge5@pci0:5:0:1:	class=0x020000 card=0x190414e4 chip=0x165714e4 rev=0x01 hdr=0x00
    vendor     = 'Broadcom Inc. and subsidiaries'
    device     = 'NetXtreme BCM5719 Gigabit Ethernet PCIe'
    class      = network
    subclass   = ethernet
    bar   [10] = type Prefetchable Memory, range 64, base 0xd5270000, size 65536, enabled
    bar   [18] = type Prefetchable Memory, range 64, base 0xd5280000, size 65536, enabled
    bar   [20] = type Prefetchable Memory, range 64, base 0xd5290000, size 65536, enabled
    cap 01[48] = powerspec 3  supports D0 D3  current D0
    cap 03[50] = VPD
    cap 05[58] = MSI supports 8 messages, 64 bit enabled with 1 message
    cap 11[a0] = MSI-X supports 17 messages
                 Table in map 0x20[0x0], PBA in map 0x20[0x1000]
    cap 10[ac] = PCI-Express 2 endpoint max data 256(256) FLR
                 link x4(x4) speed 5.0(5.0) ASPM disabled(L0s/L1)
    ecap 0001[100] = AER 1 0 fatal 0 non-fatal 1 corrected
    ecap 0003[13c] = Serial 1 0000000af77df041
    ecap 0004[150] = Power Budgeting 1
    ecap 0002[160] = VC 1 max VC0

bge6@pci0:5:0:2:	class=0x020000 card=0x190414e4 chip=0x165714e4 rev=0x01 hdr=0x00
    vendor     = 'Broadcom Inc. and subsidiaries'
    device     = 'NetXtreme BCM5719 Gigabit Ethernet PCIe'
    class      = network
    subclass   = ethernet
    bar   [10] = type Prefetchable Memory, range 64, base 0xd52a0000, size 65536, enabled
    bar   [18] = type Prefetchable Memory, range 64, base 0xd52b0000, size 65536, enabled
    bar   [20] = type Prefetchable Memory, range 64, base 0xd52c0000, size 65536, enabled
    cap 01[48] = powerspec 3  supports D0 D3  current D0
    cap 03[50] = VPD
    cap 05[58] = MSI supports 8 messages, 64 bit enabled with 1 message
    cap 11[a0] = MSI-X supports 17 messages
                 Table in map 0x20[0x0], PBA in map 0x20[0x1000]
    cap 10[ac] = PCI-Express 2 endpoint max data 256(256) FLR
                 link x4(x4) speed 5.0(5.0) ASPM disabled(L0s/L1)
    ecap 0001[100] = AER 1 0 fatal 0 non-fatal 1 corrected
    ecap 0003[13c] = Serial 1 0000000af77df042
    ecap 0004[150] = Power Budgeting 1
    ecap 0002[160] = VC 1 max VC0

bge7@pci0:5:0:3:	class=0x020000 card=0x190414e4 chip=0x165714e4 rev=0x01 hdr=0x00
    vendor     = 'Broadcom Inc. and subsidiaries'
    device     = 'NetXtreme BCM5719 Gigabit Ethernet PCIe'
    class      = network
    subclass   = ethernet
    bar   [10] = type Prefetchable Memory, range 64, base 0xd52d0000, size 65536, enabled
    bar   [18] = type Prefetchable Memory, range 64, base 0xd52e0000, size 65536, enabled
    bar   [20] = type Prefetchable Memory, range 64, base 0xd52f0000, size 65536, enabled
    cap 01[48] = powerspec 3  supports D0 D3  current D0
    cap 03[50] = VPD
    cap 05[58] = MSI supports 8 messages, 64 bit enabled with 1 message
    cap 11[a0] = MSI-X supports 17 messages
                 Table in map 0x20[0x0], PBA in map 0x20[0x1000]
    cap 10[ac] = PCI-Express 2 endpoint max data 256(256) FLR
                 link x4(x4) speed 5.0(5.0) ASPM disabled(L0s/L1)
    ecap 0001[100] = AER 1 0 fatal 0 non-fatal 1 corrected
    ecap 0003[13c] = Serial 1 0000000af77df043
    ecap 0004[150] = Power Budgeting 1
    ecap 0002[160] = VC 1 max VC0

pcib9@pci0:8:0:0:	class=0x060400 card=0x00131912 chip=0x00131912 rev=0x00 hdr=0x01
    vendor     = 'Renesas Technology Corp.'
    device     = 'SH7757 PCIe Switch [PS]'
    class      = bridge
    subclass   = PCI-PCI
    cap 01[40] = powerspec 3  supports D0 D3  current D0
    cap 05[50] = MSI supports 1 message, 64 bit 
    cap 10[70] = PCI-Express 2 upstream port max data 128(128) RO NS
                 link x1(x1) speed 2.5(2.5) ASPM disabled(L0s)
    cap 0d[b0] = PCI Bridge card=0x00131912
    ecap 0001[100] = AER 1 0 fatal 0 non-fatal 0 corrected

pcib10@pci0:9:0:0:	class=0x060400 card=0x00131912 chip=0x00131912 rev=0x00 hdr=0x01
    vendor     = 'Renesas Technology Corp.'
    device     = 'SH7757 PCIe Switch [PS]'
    class      = bridge
    subclass   = PCI-PCI
    cap 01[40] = powerspec 3  supports D0 D3  current D0
    cap 05[50] = MSI supports 1 message, 64 bit 
    cap 10[70] = PCI-Express 2 downstream port max data 128(128) RO NS
                 link x1(x1) speed 2.5(2.5)
    cap 0d[b0] = PCI Bridge card=0x00131912
    ecap 0001[100] = AER 1 0 fatal 0 non-fatal 1 corrected

pcib12@pci0:9:1:0:	class=0x060400 card=0x00131912 chip=0x00131912 rev=0x00 hdr=0x01
    vendor     = 'Renesas Technology Corp.'
    device     = 'SH7757 PCIe Switch [PS]'
    class      = bridge
    subclass   = PCI-PCI
    cap 01[40] = powerspec 3  supports D0 D3  current D0
    cap 05[50] = MSI supports 1 message, 64 bit 
    cap 10[70] = PCI-Express 2 downstream port max data 128(128) RO NS
                 link x1(x1) speed 2.5(2.5)
    cap 0d[b0] = PCI Bridge card=0x00131912
    ecap 0001[100] = AER 1 0 fatal 0 non-fatal 0 corrected
    ecap 000d[150] = ACS 1

pcib11@pci0:10:0:0:	class=0x060400 card=0x00121912 chip=0x00121912 rev=0x00 hdr=0x01
    vendor     = 'Renesas Technology Corp.'
    device     = 'SH7757 PCIe-PCI Bridge [PPB]'
    class      = bridge
    subclass   = PCI-PCI
    cap 01[40] = powerspec 3  supports D0 D3  current D0
    cap 05[50] = MSI supports 1 message, 64 bit 
    cap 10[70] = PCI-Express 2 PCI bridge max data 128(128) RO NS
                 link x1(x1) speed 2.5(2.5)
    cap 0d[b0] = PCI Bridge card=0x00121912
    ecap 0001[100] = AER 1 0 fatal 0 non-fatal 1 corrected

vgapci0@pci0:11:0:0:	class=0x030000 card=0x04ce1028 chip=0x0534102b rev=0x00 hdr=0x00
    vendor     = 'Matrox Electronics Systems Ltd.'
    device     = 'G200eR2'
    class      = display
    subclass   = VGA
    bar   [10] = type Prefetchable Memory, range 32, base 0xd4000000, size 16777216, enabled
    bar   [14] = type Memory, range 32, base 0xdb7fc000, size 16384, enabled
    bar   [18] = type Memory, range 32, base 0xda800000, size 8388608, enabled
    cap 01[dc] = powerspec 1  supports D0 D3  current D0

pcib15@pci0:64:1:0:	class=0x060400 card=0x04ce1028 chip=0x0e028086 rev=0x04 hdr=0x01
    vendor     = 'Intel Corporation'
    device     = 'Xeon E7 v2/Xeon E5 v2/Core i7 PCI Express Root Port 1a'
    class      = bridge
    subclass   = PCI-PCI
    cap 0d[40] = PCI Bridge card=0x04ce1028
    cap 05[60] = MSI supports 2 messages, vector masks 
    cap 10[90] = PCI-Express 2 root port max data 128(256) ARI disabled
                 link x0(x8) speed 0.0(8.0) ASPM disabled(L1)
                 slot 1 power limit 25000 mW
    cap 01[e0] = powerspec 3  supports D0 D3  current D0
    ecap 000b[100] = Vendor 1 ID 2
    ecap 000d[110] = ACS 1
    ecap 0001[148] = AER 1 0 fatal 0 non-fatal 0 corrected
    ecap 000b[1d0] = Vendor 1 ID 3
    ecap 0019[250] = PCIe Sec 1 lane errors 0
    ecap 000b[280] = Vendor 1 ID 5

pcib16@pci0:64:3:0:	class=0x060400 card=0x04ce1028 chip=0x0e088086 rev=0x04 hdr=0x01
    vendor     = 'Intel Corporation'
    device     = 'Xeon E7 v2/Xeon E5 v2/Core i7 PCI Express Root Port 3a'
    class      = bridge
    subclass   = PCI-PCI
    cap 0d[40] = PCI Bridge card=0x04ce1028
    cap 05[60] = MSI supports 2 messages, vector masks 
    cap 10[90] = PCI-Express 2 root port max data 128(256) ARI disabled
                 link x0(x16) speed 0.0(8.0) ASPM disabled(L1)
                 slot 2 power limit 25000 mW
    cap 01[e0] = powerspec 3  supports D0 D3  current D0
    ecap 000b[100] = Vendor 1 ID 2
    ecap 000d[110] = ACS 1
    ecap 0001[148] = AER 1 0 fatal 0 non-fatal 0 corrected
    ecap 000b[1d0] = Vendor 1 ID 3
    ecap 0019[250] = PCIe Sec 1 lane errors 0
    ecap 000b[280] = Vendor 1 ID 5

none4@pci0:64:5:0:	class=0x088000 card=0x04ce1028 chip=0x0e288086 rev=0x04 hdr=0x00
    vendor     = 'Intel Corporation'
    device     = 'Xeon E7 v2/Xeon E5 v2/Core i7 VTd/Memory Map/Misc'
    class      = base peripheral
    cap 10[40] = PCI-Express 2 root endpoint max data 128(128)

none5@pci0:64:5:2:	class=0x088000 card=0x04ce1028 chip=0x0e2a8086 rev=0x04 hdr=0x00
    vendor     = 'Intel Corporation'
    device     = 'Xeon E7 v2/Xeon E5 v2/Core i7 IIO RAS'
    class      = base peripheral
    cap 10[40] = PCI-Express 2 root endpoint max data 128(128)

none6@pci0:63:8:0:	class=0x088000 card=0x00008086 chip=0x0e808086 rev=0x04 hdr=0x00
    vendor     = 'Intel Corporation'
    device     = 'Xeon E7 v2/Xeon E5 v2/Core i7 QPI Link 0'
    class      = base peripheral

none7@pci0:63:9:0:	class=0x088000 card=0x00008086 chip=0x0e908086 rev=0x04 hdr=0x00
    vendor     = 'Intel Corporation'
    device     = 'Xeon E7 v2/Xeon E5 v2/Core i7 QPI Link 1'
    class      = base peripheral

none8@pci0:63:10:0:	class=0x088000 card=0x00008086 chip=0x0ec08086 rev=0x04 hdr=0x00
    vendor     = 'Intel Corporation'
    device     = 'Xeon E7 v2/Xeon E5 v2/Core i7 Power Control Unit 0'
    class      = base peripheral

none9@pci0:63:10:1:	class=0x088000 card=0x00008086 chip=0x0ec18086 rev=0x04 hdr=0x00
    vendor     = 'Intel Corporation'
    device     = 'Xeon E7 v2/Xeon E5 v2/Core i7 Power Control Unit 1'
    class      = base peripheral

none10@pci0:63:10:2:	class=0x088000 card=0x00008086 chip=0x0ec28086 rev=0x04 hdr=0x00
    vendor     = 'Intel Corporation'
    device     = 'Xeon E7 v2/Xeon E5 v2/Core i7 Power Control Unit 2'
    class      = base peripheral

none11@pci0:63:10:3:	class=0x088000 card=0x00008086 chip=0x0ec38086 rev=0x04 hdr=0x00
    vendor     = 'Intel Corporation'
    device     = 'Xeon E7 v2/Xeon E5 v2/Core i7 Power Control Unit 3'
    class      = base peripheral

none12@pci0:63:11:0:	class=0x088000 card=0x00008086 chip=0x0e1e8086 rev=0x04 hdr=0x00
    vendor     = 'Intel Corporation'
    device     = 'Xeon E7 v2/Xeon E5 v2/Core i7 UBOX Registers'
    class      = base peripheral

none13@pci0:63:11:3:	class=0x088000 card=0x00008086 chip=0x0e1f8086 rev=0x04 hdr=0x00
    vendor     = 'Intel Corporation'
    device     = 'Xeon E7 v2/Xeon E5 v2/Core i7 UBOX Registers'
    class      = base peripheral

none14@pci0:63:12:0:	class=0x088000 card=0x00008086 chip=0x0ee08086 rev=0x04 hdr=0x00
    vendor     = 'Intel Corporation'
    device     = 'Xeon E7 v2/Xeon E5 v2/Core i7 Unicast Registers'
    class      = base peripheral

none15@pci0:63:12:1:	class=0x088000 card=0x00008086 chip=0x0ee28086 rev=0x04 hdr=0x00
    vendor     = 'Intel Corporation'
    device     = 'Xeon E7 v2/Xeon E5 v2/Core i7 Unicast Registers'
    class      = base peripheral

none16@pci0:63:12:2:	class=0x088000 card=0x00008086 chip=0x0ee48086 rev=0x04 hdr=0x00
    vendor     = 'Intel Corporation'
    device     = 'Xeon E7 v2/Xeon E5 v2/Core i7 Unicast Registers'
    class      = base peripheral

none17@pci0:63:12:3:	class=0x088000 card=0x00008086 chip=0x0ee68086 rev=0x04 hdr=0x00
    vendor     = 'Intel Corporation'
    device     = 'Xeon E7 v2/Xeon E5 v2/Core i7 Unicast Registers'
    class      = base peripheral

none18@pci0:63:13:0:	class=0x088000 card=0x00008086 chip=0x0ee18086 rev=0x04 hdr=0x00
    vendor     = 'Intel Corporation'
    device     = 'Xeon E7 v2/Xeon E5 v2/Core i7 Unicast Registers'
    class      = base peripheral

none19@pci0:63:13:1:	class=0x088000 card=0x00008086 chip=0x0ee38086 rev=0x04 hdr=0x00
    vendor     = 'Intel Corporation'
    device     = 'Xeon E7 v2/Xeon E5 v2/Core i7 Unicast Registers'
    class      = base peripheral

none20@pci0:63:13:2:	class=0x088000 card=0x00008086 chip=0x0ee58086 rev=0x04 hdr=0x00
    vendor     = 'Intel Corporation'
    device     = 'Xeon E7 v2/Xeon E5 v2/Core i7 Unicast Registers'
    class      = base peripheral

none21@pci0:63:13:3:	class=0x088000 card=0x00008086 chip=0x0ee78086 rev=0x04 hdr=0x00
    vendor     = 'Intel Corporation'
    device     = 'Xeon E7 v2/Xeon E5 v2/Core i7 Unicast Registers'
    class      = base peripheral

none22@pci0:63:14:0:	class=0x088000 card=0x04ce1028 chip=0x0ea08086 rev=0x04 hdr=0x00
    vendor     = 'Intel Corporation'
    device     = 'Xeon E7 v2/Xeon E5 v2/Core i7 Home Agent 0'
    class      = base peripheral

none23@pci0:63:14:1:	class=0x110100 card=0x04ce1028 chip=0x0e308086 rev=0x04 hdr=0x00
    vendor     = 'Intel Corporation'
    device     = 'Xeon E7 v2/Xeon E5 v2/Core i7 Home Agent 0'
    class      = dasp
    subclass   = performance counters

none24@pci0:63:15:0:	class=0x088000 card=0x00008086 chip=0x0ea88086 rev=0x04 hdr=0x00
    vendor     = 'Intel Corporation'
    device     = 'Xeon E7 v2/Xeon E5 v2/Core i7 Integrated Memory Controller 0 Target Address/Thermal Registers'
    class      = base peripheral
    cap 10[40] = PCI-Express 1 root endpoint max data 128(128)

none25@pci0:63:15:1:	class=0x088000 card=0x00008086 chip=0x0e718086 rev=0x04 hdr=0x00
    vendor     = 'Intel Corporation'
    device     = 'Xeon E7 v2/Xeon E5 v2/Core i7 Integrated Memory Controller 0 RAS Registers'
    class      = base peripheral
    cap 10[40] = PCI-Express 1 root endpoint max data 128(128)

none26@pci0:63:15:2:	class=0x088000 card=0x00008086 chip=0x0eaa8086 rev=0x04 hdr=0x00
    vendor     = 'Intel Corporation'
    device     = 'Xeon E7 v2/Xeon E5 v2/Core i7 Integrated Memory Controller 0 Channel Target Address Decoder Registers'
    class      = base peripheral
    cap 10[40] = PCI-Express 1 root endpoint max data 128(128)

none27@pci0:63:15:3:	class=0x088000 card=0x00008086 chip=0x0eab8086 rev=0x04 hdr=0x00
    vendor     = 'Intel Corporation'
    device     = 'Xeon E7 v2/Xeon E5 v2/Core i7 Integrated Memory Controller 0 Channel Target Address Decoder Registers'
    class      = base peripheral
    cap 10[40] = PCI-Express 1 root endpoint max data 128(128)

none28@pci0:63:15:4:	class=0x088000 card=0x00008086 chip=0x0eac8086 rev=0x04 hdr=0x00
    vendor     = 'Intel Corporation'
    device     = 'Xeon E7 v2/Xeon E5 v2/Core i7 Integrated Memory Controller 0 Channel Target Address Decoder Registers'
    class      = base peripheral
    cap 10[40] = PCI-Express 1 root endpoint max data 128(128)

none29@pci0:63:15:5:	class=0x088000 card=0x00008086 chip=0x0ead8086 rev=0x04 hdr=0x00
    vendor     = 'Intel Corporation'
    device     = 'Xeon E7 v2/Xeon E5 v2/Core i7 Integrated Memory Controller 0 Channel Target Address Decoder Registers'
    class      = base peripheral
    cap 10[40] = PCI-Express 1 root endpoint max data 128(128)

none30@pci0:63:16:0:	class=0x088000 card=0x00008086 chip=0x0eb08086 rev=0x04 hdr=0x00
    vendor     = 'Intel Corporation'
    device     = 'Xeon E7 v2/Xeon E5 v2/Core i7 Integrated Memory Controller 1 Channel 0-3 Thermal Control 0'
    class      = base peripheral
    cap 10[40] = PCI-Express 1 root endpoint max data 128(128)

none31@pci0:63:16:1:	class=0x088000 card=0x00008086 chip=0x0eb18086 rev=0x04 hdr=0x00
    vendor     = 'Intel Corporation'
    device     = 'Xeon E7 v2/Xeon E5 v2/Core i7 Integrated Memory Controller 1 Channel 0-3 Thermal Control 1'
    class      = base peripheral
    cap 10[40] = PCI-Express 1 root endpoint max data 128(128)

none32@pci0:63:16:2:	class=0x088000 card=0x00008086 chip=0x0eb28086 rev=0x04 hdr=0x00
    vendor     = 'Intel Corporation'
    device     = 'Xeon E7 v2/Xeon E5 v2/Core i7 Integrated Memory Controller 1 Channel 0-3 ERROR Registers 0'
    class      = base peripheral
    cap 10[40] = PCI-Express 1 root endpoint max data 128(128)

none33@pci0:63:16:3:	class=0x088000 card=0x00008086 chip=0x0eb38086 rev=0x04 hdr=0x00
    vendor     = 'Intel Corporation'
    device     = 'Xeon E7 v2/Xeon E5 v2/Core i7 Integrated Memory Controller 1 Channel 0-3 ERROR Registers 1'
    class      = base peripheral
    cap 10[40] = PCI-Express 1 root endpoint max data 128(128)

none34@pci0:63:16:4:	class=0x088000 card=0x00008086 chip=0x0eb48086 rev=0x04 hdr=0x00
    vendor     = 'Intel Corporation'
    device     = 'Xeon E7 v2/Xeon E5 v2/Core i7 Integrated Memory Controller 1 Channel 0-3 Thermal Control 2'
    class      = base peripheral
    cap 10[40] = PCI-Express 1 root endpoint max data 128(128)

none35@pci0:63:16:5:	class=0x088000 card=0x00008086 chip=0x0eb58086 rev=0x04 hdr=0x00
    vendor     = 'Intel Corporation'
    device     = 'Xeon E7 v2/Xeon E5 v2/Core i7 Integrated Memory Controller 1 Channel 0-3 Thermal Control 3'
    class      = base peripheral
    cap 10[40] = PCI-Express 1 root endpoint max data 128(128)

none36@pci0:63:16:7:	class=0x088000 card=0x00008086 chip=0x0eb78086 rev=0x04 hdr=0x00
    vendor     = 'Intel Corporation'
    device     = 'Xeon E7 v2/Xeon E5 v2/Core i7 Integrated Memory Controller 1 Channel 0-3 ERROR Registers 3'
    class      = base peripheral
    cap 10[40] = PCI-Express 1 root endpoint max data 128(128)

none37@pci0:63:19:0:	class=0x088000 card=0x00008086 chip=0x0e1d8086 rev=0x04 hdr=0x00
    vendor     = 'Intel Corporation'
    device     = 'Xeon E7 v2/Xeon E5 v2/Core i7 R2PCIe'
    class      = base peripheral

none38@pci0:63:19:1:	class=0x110100 card=0x04ce1028 chip=0x0e348086 rev=0x04 hdr=0x00
    vendor     = 'Intel Corporation'
    device     = 'Xeon E7 v2/Xeon E5 v2/Core i7 R2PCIe'
    class      = dasp
    subclass   = performance counters

none39@pci0:63:19:4:	class=0x088000 card=0x04ce1028 chip=0x0e818086 rev=0x04 hdr=0x00
    vendor     = 'Intel Corporation'
    device     = 'Xeon E7 v2/Xeon E5 v2/Core i7 QPI Ring Registers'
    class      = base peripheral

none40@pci0:63:19:5:	class=0x110100 card=0x04ce1028 chip=0x0e368086 rev=0x04 hdr=0x00
    vendor     = 'Intel Corporation'
    device     = 'Xeon E7 v2/Xeon E5 v2/Core i7 QPI Ring Performance Ring Monitoring'
    class      = dasp
    subclass   = performance counters

none41@pci0:63:22:0:	class=0x088000 card=0x00008086 chip=0x0ec88086 rev=0x04 hdr=0x00
    vendor     = 'Intel Corporation'
    device     = 'Xeon E7 v2/Xeon E5 v2/Core i7 System Address Decoder'
    class      = base peripheral

none42@pci0:63:22:1:	class=0x088000 card=0x00008086 chip=0x0ec98086 rev=0x04 hdr=0x00
    vendor     = 'Intel Corporation'
    device     = 'Xeon E7 v2/Xeon E5 v2/Core i7 Broadcast Registers'
    class      = base peripheral

none43@pci0:63:22:2:	class=0x088000 card=0x00008086 chip=0x0eca8086 rev=0x04 hdr=0x00
    vendor     = 'Intel Corporation'
    device     = 'Xeon E7 v2/Xeon E5 v2/Core i7 Broadcast Registers'
    class      = base peripheral

none44@pci0:127:8:0:	class=0x088000 card=0x00008086 chip=0x0e808086 rev=0x04 hdr=0x00
    vendor     = 'Intel Corporation'
    device     = 'Xeon E7 v2/Xeon E5 v2/Core i7 QPI Link 0'
    class      = base peripheral

none45@pci0:127:9:0:	class=0x088000 card=0x00008086 chip=0x0e908086 rev=0x04 hdr=0x00
    vendor     = 'Intel Corporation'
    device     = 'Xeon E7 v2/Xeon E5 v2/Core i7 QPI Link 1'
    class      = base peripheral

none46@pci0:127:10:0:	class=0x088000 card=0x00008086 chip=0x0ec08086 rev=0x04 hdr=0x00
    vendor     = 'Intel Corporation'
    device     = 'Xeon E7 v2/Xeon E5 v2/Core i7 Power Control Unit 0'
    class      = base peripheral

none47@pci0:127:10:1:	class=0x088000 card=0x00008086 chip=0x0ec18086 rev=0x04 hdr=0x00
    vendor     = 'Intel Corporation'
    device     = 'Xeon E7 v2/Xeon E5 v2/Core i7 Power Control Unit 1'
    class      = base peripheral

none48@pci0:127:10:2:	class=0x088000 card=0x00008086 chip=0x0ec28086 rev=0x04 hdr=0x00
    vendor     = 'Intel Corporation'
    device     = 'Xeon E7 v2/Xeon E5 v2/Core i7 Power Control Unit 2'
    class      = base peripheral

none49@pci0:127:10:3:	class=0x088000 card=0x00008086 chip=0x0ec38086 rev=0x04 hdr=0x00
    vendor     = 'Intel Corporation'
    device     = 'Xeon E7 v2/Xeon E5 v2/Core i7 Power Control Unit 3'
    class      = base peripheral

none50@pci0:127:11:0:	class=0x088000 card=0x00008086 chip=0x0e1e8086 rev=0x04 hdr=0x00
    vendor     = 'Intel Corporation'
    device     = 'Xeon E7 v2/Xeon E5 v2/Core i7 UBOX Registers'
    class      = base peripheral

none51@pci0:127:11:3:	class=0x088000 card=0x00008086 chip=0x0e1f8086 rev=0x04 hdr=0x00
    vendor     = 'Intel Corporation'
    device     = 'Xeon E7 v2/Xeon E5 v2/Core i7 UBOX Registers'
    class      = base peripheral

none52@pci0:127:12:0:	class=0x088000 card=0x00008086 chip=0x0ee08086 rev=0x04 hdr=0x00
    vendor     = 'Intel Corporation'
    device     = 'Xeon E7 v2/Xeon E5 v2/Core i7 Unicast Registers'
    class      = base peripheral

none53@pci0:127:12:1:	class=0x088000 card=0x00008086 chip=0x0ee28086 rev=0x04 hdr=0x00
    vendor     = 'Intel Corporation'
    device     = 'Xeon E7 v2/Xeon E5 v2/Core i7 Unicast Registers'
    class      = base peripheral

none54@pci0:127:12:2:	class=0x088000 card=0x00008086 chip=0x0ee48086 rev=0x04 hdr=0x00
    vendor     = 'Intel Corporation'
    device     = 'Xeon E7 v2/Xeon E5 v2/Core i7 Unicast Registers'
    class      = base peripheral

none55@pci0:127:12:3:	class=0x088000 card=0x00008086 chip=0x0ee68086 rev=0x04 hdr=0x00
    vendor     = 'Intel Corporation'
    device     = 'Xeon E7 v2/Xeon E5 v2/Core i7 Unicast Registers'
    class      = base peripheral

none56@pci0:127:13:0:	class=0x088000 card=0x00008086 chip=0x0ee18086 rev=0x04 hdr=0x00
    vendor     = 'Intel Corporation'
    device     = 'Xeon E7 v2/Xeon E5 v2/Core i7 Unicast Registers'
    class      = base peripheral

none57@pci0:127:13:1:	class=0x088000 card=0x00008086 chip=0x0ee38086 rev=0x04 hdr=0x00
    vendor     = 'Intel Corporation'
    device     = 'Xeon E7 v2/Xeon E5 v2/Core i7 Unicast Registers'
    class      = base peripheral

none58@pci0:127:13:2:	class=0x088000 card=0x00008086 chip=0x0ee58086 rev=0x04 hdr=0x00
    vendor     = 'Intel Corporation'
    device     = 'Xeon E7 v2/Xeon E5 v2/Core i7 Unicast Registers'
    class      = base peripheral

none59@pci0:127:13:3:	class=0x088000 card=0x00008086 chip=0x0ee78086 rev=0x04 hdr=0x00
    vendor     = 'Intel Corporation'
    device     = 'Xeon E7 v2/Xeon E5 v2/Core i7 Unicast Registers'
    class      = base peripheral

none60@pci0:127:14:0:	class=0x088000 card=0x04ce1028 chip=0x0ea08086 rev=0x04 hdr=0x00
    vendor     = 'Intel Corporation'
    device     = 'Xeon E7 v2/Xeon E5 v2/Core i7 Home Agent 0'
    class      = base peripheral

none61@pci0:127:14:1:	class=0x110100 card=0x04ce1028 chip=0x0e308086 rev=0x04 hdr=0x00
    vendor     = 'Intel Corporation'
    device     = 'Xeon E7 v2/Xeon E5 v2/Core i7 Home Agent 0'
    class      = dasp
    subclass   = performance counters

none62@pci0:127:15:0:	class=0x088000 card=0x00008086 chip=0x0ea88086 rev=0x04 hdr=0x00
    vendor     = 'Intel Corporation'
    device     = 'Xeon E7 v2/Xeon E5 v2/Core i7 Integrated Memory Controller 0 Target Address/Thermal Registers'
    class      = base peripheral
    cap 10[40] = PCI-Express 1 root endpoint max data 128(128)

none63@pci0:127:15:1:	class=0x088000 card=0x00008086 chip=0x0e718086 rev=0x04 hdr=0x00
    vendor     = 'Intel Corporation'
    device     = 'Xeon E7 v2/Xeon E5 v2/Core i7 Integrated Memory Controller 0 RAS Registers'
    class      = base peripheral
    cap 10[40] = PCI-Express 1 root endpoint max data 128(128)

none64@pci0:127:15:2:	class=0x088000 card=0x00008086 chip=0x0eaa8086 rev=0x04 hdr=0x00
    vendor     = 'Intel Corporation'
    device     = 'Xeon E7 v2/Xeon E5 v2/Core i7 Integrated Memory Controller 0 Channel Target Address Decoder Registers'
    class      = base peripheral
    cap 10[40] = PCI-Express 1 root endpoint max data 128(128)

none65@pci0:127:15:3:	class=0x088000 card=0x00008086 chip=0x0eab8086 rev=0x04 hdr=0x00
    vendor     = 'Intel Corporation'
    device     = 'Xeon E7 v2/Xeon E5 v2/Core i7 Integrated Memory Controller 0 Channel Target Address Decoder Registers'
    class      = base peripheral
    cap 10[40] = PCI-Express 1 root endpoint max data 128(128)

none66@pci0:127:15:4:	class=0x088000 card=0x00008086 chip=0x0eac8086 rev=0x04 hdr=0x00
    vendor     = 'Intel Corporation'
    device     = 'Xeon E7 v2/Xeon E5 v2/Core i7 Integrated Memory Controller 0 Channel Target Address Decoder Registers'
    class      = base peripheral
    cap 10[40] = PCI-Express 1 root endpoint max data 128(128)

none67@pci0:127:15:5:	class=0x088000 card=0x00008086 chip=0x0ead8086 rev=0x04 hdr=0x00
    vendor     = 'Intel Corporation'
    device     = 'Xeon E7 v2/Xeon E5 v2/Core i7 Integrated Memory Controller 0 Channel Target Address Decoder Registers'
    class      = base peripheral
    cap 10[40] = PCI-Express 1 root endpoint max data 128(128)

none68@pci0:127:16:0:	class=0x088000 card=0x00008086 chip=0x0eb08086 rev=0x04 hdr=0x00
    vendor     = 'Intel Corporation'
    device     = 'Xeon E7 v2/Xeon E5 v2/Core i7 Integrated Memory Controller 1 Channel 0-3 Thermal Control 0'
    class      = base peripheral
    cap 10[40] = PCI-Express 1 root endpoint max data 128(128)

none69@pci0:127:16:1:	class=0x088000 card=0x00008086 chip=0x0eb18086 rev=0x04 hdr=0x00
    vendor     = 'Intel Corporation'
    device     = 'Xeon E7 v2/Xeon E5 v2/Core i7 Integrated Memory Controller 1 Channel 0-3 Thermal Control 1'
    class      = base peripheral
    cap 10[40] = PCI-Express 1 root endpoint max data 128(128)

none70@pci0:127:16:2:	class=0x088000 card=0x00008086 chip=0x0eb28086 rev=0x04 hdr=0x00
    vendor     = 'Intel Corporation'
    device     = 'Xeon E7 v2/Xeon E5 v2/Core i7 Integrated Memory Controller 1 Channel 0-3 ERROR Registers 0'
    class      = base peripheral
    cap 10[40] = PCI-Express 1 root endpoint max data 128(128)

none71@pci0:127:16:3:	class=0x088000 card=0x00008086 chip=0x0eb38086 rev=0x04 hdr=0x00
    vendor     = 'Intel Corporation'
    device     = 'Xeon E7 v2/Xeon E5 v2/Core i7 Integrated Memory Controller 1 Channel 0-3 ERROR Registers 1'
    class      = base peripheral
    cap 10[40] = PCI-Express 1 root endpoint max data 128(128)

none72@pci0:127:16:4:	class=0x088000 card=0x00008086 chip=0x0eb48086 rev=0x04 hdr=0x00
    vendor     = 'Intel Corporation'
    device     = 'Xeon E7 v2/Xeon E5 v2/Core i7 Integrated Memory Controller 1 Channel 0-3 Thermal Control 2'
    class      = base peripheral
    cap 10[40] = PCI-Express 1 root endpoint max data 128(128)

none73@pci0:127:16:5:	class=0x088000 card=0x00008086 chip=0x0eb58086 rev=0x04 hdr=0x00
    vendor     = 'Intel Corporation'
    device     = 'Xeon E7 v2/Xeon E5 v2/Core i7 Integrated Memory Controller 1 Channel 0-3 Thermal Control 3'
    class      = base peripheral
    cap 10[40] = PCI-Express 1 root endpoint max data 128(128)

none74@pci0:127:16:7:	class=0x088000 card=0x00008086 chip=0x0eb78086 rev=0x04 hdr=0x00
    vendor     = 'Intel Corporation'
    device     = 'Xeon E7 v2/Xeon E5 v2/Core i7 Integrated Memory Controller 1 Channel 0-3 ERROR Registers 3'
    class      = base peripheral
    cap 10[40] = PCI-Express 1 root endpoint max data 128(128)

none75@pci0:127:19:0:	class=0x088000 card=0x00008086 chip=0x0e1d8086 rev=0x04 hdr=0x00
    vendor     = 'Intel Corporation'
    device     = 'Xeon E7 v2/Xeon E5 v2/Core i7 R2PCIe'
    class      = base peripheral

none76@pci0:127:19:1:	class=0x110100 card=0x04ce1028 chip=0x0e348086 rev=0x04 hdr=0x00
    vendor     = 'Intel Corporation'
    device     = 'Xeon E7 v2/Xeon E5 v2/Core i7 R2PCIe'
    class      = dasp
    subclass   = performance counters

none77@pci0:127:19:4:	class=0x088000 card=0x04ce1028 chip=0x0e818086 rev=0x04 hdr=0x00
    vendor     = 'Intel Corporation'
    device     = 'Xeon E7 v2/Xeon E5 v2/Core i7 QPI Ring Registers'
    class      = base peripheral

none78@pci0:127:19:5:	class=0x110100 card=0x04ce1028 chip=0x0e368086 rev=0x04 hdr=0x00
    vendor     = 'Intel Corporation'
    device     = 'Xeon E7 v2/Xeon E5 v2/Core i7 QPI Ring Performance Ring Monitoring'
    class      = dasp
    subclass   = performance counters

none79@pci0:127:22:0:	class=0x088000 card=0x00008086 chip=0x0ec88086 rev=0x04 hdr=0x00
    vendor     = 'Intel Corporation'
    device     = 'Xeon E7 v2/Xeon E5 v2/Core i7 System Address Decoder'
    class      = base peripheral

none80@pci0:127:22:1:	class=0x088000 card=0x00008086 chip=0x0ec98086 rev=0x04 hdr=0x00
    vendor     = 'Intel Corporation'
    device     = 'Xeon E7 v2/Xeon E5 v2/Core i7 Broadcast Registers'
    class      = base peripheral

none81@pci0:127:22:2:	class=0x088000 card=0x00008086 chip=0x0eca8086 rev=0x04 hdr=0x00
    vendor     = 'Intel Corporation'
    device     = 'Xeon E7 v2/Xeon E5 v2/Core i7 Broadcast Registers'
    class      = base peripheral
