hostb0@pci0:0:0:0:	class=0x060000 rev=0x0e hdr=0x00 vendor=0x8086 device=0x0f00 subvendor=0x1028 subdevice=0x0703
    vendor     = 'Intel Corporation'
    device     = 'Atom Processor Z36xxx/Z37xxx Series SoC Transaction Register'
    class      = bridge
    subclass   = HOST-PCI

vgapci0@pci0:0:2:0:	class=0x030000 rev=0x0e hdr=0x00 vendor=0x8086 device=0x0f31 subvendor=0x1028 subdevice=0x0703
    vendor     = 'Intel Corporation'
    device     = 'Atom Processor Z36xxx/Z37xxx Series Graphics & Display'
    class      = display
    subclass   = VGA
    bar   [10] = type Memory, range 32, base 0xd0000000, size 4194304, enabled
    bar   [18] = type Prefetchable Memory, range 32, base 0xc0000000, size 268435456, enabled
    bar   [20] = type I/O Port, range 32, base 0xf080, size 8, enabled
    cap 01[d0] = powerspec 2  supports D0 D3  current D0
    cap 05[90] = MSI supports 1 message 
    cap 09[b0] = vendor (length 7) Intel cap 0 version 1

ahci0@pci0:0:19:0:	class=0x010601 rev=0x0e hdr=0x00 vendor=0x8086 device=0x0f23 subvendor=0x1028 subdevice=0x0703
    vendor     = 'Intel Corporation'
    device     = 'Atom Processor E3800 Series SATA AHCI Controller'
    class      = mass storage
    subclass   = SATA
    bar   [10] = type I/O Port, range 32, base 0xf070, size 8, enabled
    bar   [14] = type I/O Port, range 32, base 0xf060, size 4, enabled
    bar   [18] = type I/O Port, range 32, base 0xf050, size 8, enabled
    bar   [1c] = type I/O Port, range 32, base 0xf040, size 4, enabled
    bar   [20] = type I/O Port, range 32, base 0xf020, size 32, enabled
    bar   [24] = type Memory, range 32, base 0xd0915000, size 2048, enabled
    cap 05[80] = MSI supports 1 message enabled with 1 message
    cap 01[70] = powerspec 3  supports D0 D3  current D0
    cap 12[a8] = SATA Index-Data Pair

xhci0@pci0:0:20:0:	class=0x0c0330 rev=0x0e hdr=0x00 vendor=0x8086 device=0x0f35 subvendor=0x1028 subdevice=0x0703
    vendor     = 'Intel Corporation'
    device     = 'Atom Processor Z36xxx/Z37xxx, Celeron N2000 Series USB xHCI'
    class      = serial bus
    subclass   = USB
    bar   [10] = type Memory, range 64, base 0xd0900000, size 65536, enabled
    cap 01[70] = powerspec 2  supports D0 D3  current D0
    cap 05[80] = MSI supports 8 messages, 64 bit enabled with 1 message

none0@pci0:0:26:0:	class=0x108000 rev=0x0e hdr=0x00 vendor=0x8086 device=0x0f18 subvendor=0x1028 subdevice=0x0703
    vendor     = 'Intel Corporation'
    device     = 'Atom Processor Z36xxx/Z37xxx Series Trusted Execution Engine'
    class      = encrypt/decrypt
    bar   [10] = type Memory, range 32, base 0xd0500000, size 1048576, enabled
    bar   [14] = type Memory, range 32, base 0xd0400000, size 1048576, enabled
    cap 01[80] = powerspec 3  supports D0 D3  current D0
    cap 05[a0] = MSI supports 1 message 

hdac0@pci0:0:27:0:	class=0x040300 rev=0x0e hdr=0x00 vendor=0x8086 device=0x0f04 subvendor=0x1028 subdevice=0x0703
    vendor     = 'Intel Corporation'
    device     = 'Atom Processor Z36xxx/Z37xxx Series High Definition Audio Controller'
    class      = multimedia
    subclass   = HDA
    bar   [10] = type Memory, range 64, base 0xd0910000, size 16384, enabled
    cap 01[50] = powerspec 2  supports D0 D3  current D0
    cap 05[60] = MSI supports 1 message, 64 bit enabled with 1 message

pcib1@pci0:0:28:0:	class=0x060400 rev=0x0e hdr=0x01 vendor=0x8086 device=0x0f48 subvendor=0x1028 subdevice=0x0703
    vendor     = 'Intel Corporation'
    device     = 'Atom Processor E3800 Series PCI Express Root Port 1'
    class      = bridge
    subclass   = PCI-PCI
    cap 10[40] = PCI-Express 2 root port max data 128(128)
                 max read 128
                 link x0(x1) speed 0.0(5.0) ASPM L0s/L1(L0s/L1)
                 slot 0 power limit 100 mW HotPlug(empty) surprise
    cap 05[80] = MSI supports 1 message 
    cap 0d[90] = PCI Bridge subvendor=0x1028 subdevice=0x0703
    cap 01[a0] = powerspec 3  supports D0 D3  current D0

pcib2@pci0:0:28:1:	class=0x060400 rev=0x0e hdr=0x01 vendor=0x8086 device=0x0f4a subvendor=0x1028 subdevice=0x0703
    vendor     = 'Intel Corporation'
    device     = 'Atom Processor E3800 Series PCI Express Root Port 2'
    class      = bridge
    subclass   = PCI-PCI
    cap 10[40] = PCI-Express 2 root port max data 128(128)
                 max read 128
                 link x1(x1) speed 2.5(5.0) ASPM L1(L0s/L1)
                 slot 1 power limit 100 mW HotPlug(present) surprise
    cap 05[80] = MSI supports 1 message 
    cap 0d[90] = PCI Bridge subvendor=0x1028 subdevice=0x0703
    cap 01[a0] = powerspec 3  supports D0 D3  current D0

pcib3@pci0:0:28:2:	class=0x060400 rev=0x0e hdr=0x01 vendor=0x8086 device=0x0f4c subvendor=0x1028 subdevice=0x0703
    vendor     = 'Intel Corporation'
    device     = 'Atom Processor E3800 Series PCI Express Root Port 3'
    class      = bridge
    subclass   = PCI-PCI
    cap 10[40] = PCI-Express 2 root port max data 128(128)
                 max read 128
                 link x1(x1) speed 2.5(5.0) ASPM L0s/L1(L0s/L1)
                 slot 2 power limit 100 mW HotPlug(present) surprise
    cap 05[80] = MSI supports 1 message 
    cap 0d[90] = PCI Bridge subvendor=0x1028 subdevice=0x0703
    cap 01[a0] = powerspec 3  supports D0 D3  current D0

pcib4@pci0:0:28:3:	class=0x060400 rev=0x0e hdr=0x01 vendor=0x8086 device=0x0f4e subvendor=0x1028 subdevice=0x0703
    vendor     = 'Intel Corporation'
    device     = 'Atom Processor E3800 Series PCI Express Root Port 4'
    class      = bridge
    subclass   = PCI-PCI
    cap 10[40] = PCI-Express 2 root port max data 128(128)
                 max read 128
                 link x1(x1) speed 2.5(5.0) ASPM L1(L0s/L1)
                 slot 3 power limit 100 mW HotPlug(present) surprise
    cap 05[80] = MSI supports 1 message 
    cap 0d[90] = PCI Bridge subvendor=0x1028 subdevice=0x0703
    cap 01[a0] = powerspec 3  supports D0 D3  current D0

isab0@pci0:0:31:0:	class=0x060100 rev=0x0e hdr=0x00 vendor=0x8086 device=0x0f1c subvendor=0x1028 subdevice=0x0703
    vendor     = 'Intel Corporation'
    device     = 'Atom Processor Z36xxx/Z37xxx Series Power Control Unit'
    class      = bridge
    subclass   = PCI-ISA
    cap 09[e0] = vendor (length 12) Intel cap 1 version 0
		 features: 4 PCI-e x1 slots

ichsmb0@pci0:0:31:3:	class=0x0c0500 rev=0x0e hdr=0x00 vendor=0x8086 device=0x0f12 subvendor=0x1028 subdevice=0x0703
    vendor     = 'Intel Corporation'
    device     = 'Atom Processor E3800/CE2700 Series SMBus Controller'
    class      = serial bus
    subclass   = SMBus
    bar   [10] = type Memory, range 32, base 0xd0914000, size 32, enabled
    bar   [20] = type I/O Port, range 32, base 0xf000, size 32, enabled
    cap 01[50] = powerspec 3  supports D0 D3  current D0

iwm0@pci0:2:0:0:	class=0x028000 rev=0x83 hdr=0x00 vendor=0x8086 device=0x08b3 subvendor=0x8086 subdevice=0x8470
    vendor     = 'Intel Corporation'
    device     = 'Wireless 3160'
    class      = network
    bar   [10] = type Memory, range 64, base 0xd0800000, size 8192, enabled
    cap 01[c8] = powerspec 3  supports D0 D3  current D0
    cap 05[d0] = MSI supports 1 message, 64 bit enabled with 1 message
    cap 10[40] = PCI-Express 2 endpoint max data 128(128) FLR NS
                 max read 128
                 link x1(x1) speed 2.5(2.5) ASPM L1(L0s/L1) ClockPM disabled
    ecap 0001[100] = AER 1 0 fatal 0 non-fatal 2 corrected
    ecap 0003[140] = Serial 1 34e6adffff294d34
    ecap 0018[14c] = LTR 1
    ecap 000b[154] = Vendor [1] ID cafe Rev 1 Length 20

rtsx0@pci0:3:0:0:	class=0xff0000 rev=0x01 hdr=0x00 vendor=0x10ec device=0x5229 subvendor=0x10ec subdevice=0x5229
    vendor     = 'Realtek Semiconductor Co., Ltd.'
    device     = 'RTS5229 PCI Express Card Reader'
    bar   [10] = type Memory, range 32, base 0xd0700000, size 4096, enabled
    cap 01[40] = powerspec 3  supports D0 D1 D2 D3  current D0
    cap 05[50] = MSI supports 1 message, 64 bit enabled with 1 message
    cap 10[70] = PCI-Express 2 endpoint max data 128(128)
                 max read 512
                 link x1(x1) speed 2.5(2.5) ASPM disabled(L0s/L1) ClockPM enabled
    ecap 0001[100] = AER 1 0 fatal 0 non-fatal 3 corrected
    ecap 0003[140] = Serial 1 00000001004ce000

re0@pci0:4:0:0:	class=0x020000 rev=0x0c hdr=0x00 vendor=0x10ec device=0x8168 subvendor=0x1028 subdevice=0x0703
    vendor     = 'Realtek Semiconductor Co., Ltd.'
    device     = 'RTL8111/8168/8411 PCI Express Gigabit Ethernet Controller'
    class      = network
    subclass   = ethernet
    bar   [10] = type I/O Port, range 32, base 0xe000, size 256, enabled
    bar   [18] = type Memory, range 64, base 0xd0604000, size 4096, enabled
    bar   [20] = type Prefetchable Memory, range 64, base 0xd0600000, size 16384, enabled
    cap 01[40] = powerspec 3  supports D0 D1 D2 D3  current D0
    cap 05[50] = MSI supports 1 message, 64 bit 
    cap 10[70] = PCI-Express 2 endpoint MSI 1 max data 128(128)
                 max read 4096
                 link x1(x1) speed 2.5(2.5) ASPM disabled(L0s/L1) ClockPM disabled
    cap 11[b0] = MSI-X supports 4 messages, enabled
                 Table in map 0x20[0x0], PBA in map 0x20[0x800]
    cap 03[d0] = VPD
    ecap 0001[100] = AER 1 0 fatal 0 non-fatal 2 corrected
    ecap 0002[140] = VC 1 max VC0
    ecap 0003[160] = Serial 1 01000000684ce000
    ecap 0018[170] = LTR 1
