hostb0@pci0:63:0:0:	class=0x060000 card=0x11261734 chip=0x2c708086 rev=0x02 hdr=0x00
    vendor     = 'Intel Corporation'
    device     = 'Xeon 5600 Series QuickPath Architecture Generic Non-core Registers'
    class      = bridge
    subclass   = HOST-PCI

hostb1@pci0:63:0:1:	class=0x060000 card=0x11261734 chip=0x2d818086 rev=0x02 hdr=0x00
    vendor     = 'Intel Corporation'
    device     = 'Xeon 5600 Series QuickPath Architecture System Address Decoder'
    class      = bridge
    subclass   = HOST-PCI

hostb2@pci0:63:2:0:	class=0x060000 card=0x11261734 chip=0x2d908086 rev=0x02 hdr=0x00
    vendor     = 'Intel Corporation'
    device     = 'Xeon 5600 Series QPI Link 0'
    class      = bridge
    subclass   = HOST-PCI

hostb3@pci0:63:2:1:	class=0x060000 card=0x11261734 chip=0x2d918086 rev=0x02 hdr=0x00
    vendor     = 'Intel Corporation'
    device     = 'Xeon 5600 Series QPI Physical 0'
    class      = bridge
    subclass   = HOST-PCI

hostb4@pci0:63:2:2:	class=0x060000 card=0x11261734 chip=0x2d928086 rev=0x02 hdr=0x00
    vendor     = 'Intel Corporation'
    device     = 'Xeon 5600 Series Mirror Port Link 0'
    class      = bridge
    subclass   = HOST-PCI

hostb5@pci0:63:2:3:	class=0x060000 card=0x11261734 chip=0x2d938086 rev=0x02 hdr=0x00
    vendor     = 'Intel Corporation'
    device     = 'Xeon 5600 Series Mirror Port Link 1'
    class      = bridge
    subclass   = HOST-PCI

hostb6@pci0:63:2:4:	class=0x060000 card=0x11261734 chip=0x2d948086 rev=0x02 hdr=0x00
    vendor     = 'Intel Corporation'
    device     = 'Xeon 5600 Series QPI Link 1'
    class      = bridge
    subclass   = HOST-PCI

hostb7@pci0:63:2:5:	class=0x060000 card=0x11261734 chip=0x2d958086 rev=0x02 hdr=0x00
    vendor     = 'Intel Corporation'
    device     = 'Xeon 5600 Series QPI Physical 1'
    class      = bridge
    subclass   = HOST-PCI

hostb8@pci0:63:3:0:	class=0x060000 card=0x11261734 chip=0x2d988086 rev=0x02 hdr=0x00
    vendor     = 'Intel Corporation'
    device     = 'Xeon 5600 Series Integrated Memory Controller Registers'
    class      = bridge
    subclass   = HOST-PCI

hostb9@pci0:63:3:1:	class=0x060000 card=0x11261734 chip=0x2d998086 rev=0x02 hdr=0x00
    vendor     = 'Intel Corporation'
    device     = 'Xeon 5600 Series Integrated Memory Controller Target Address Decoder'
    class      = bridge
    subclass   = HOST-PCI

hostb10@pci0:63:3:2:	class=0x060000 card=0x11261734 chip=0x2d9a8086 rev=0x02 hdr=0x00
    vendor     = 'Intel Corporation'
    device     = 'Xeon 5600 Series Integrated Memory Controller RAS Registers'
    class      = bridge
    subclass   = HOST-PCI

hostb11@pci0:63:3:4:	class=0x060000 card=0x11261734 chip=0x2d9c8086 rev=0x02 hdr=0x00
    vendor     = 'Intel Corporation'
    device     = 'Xeon 5600 Series Integrated Memory Controller Test Registers'
    class      = bridge
    subclass   = HOST-PCI

hostb12@pci0:63:4:0:	class=0x060000 card=0x11261734 chip=0x2da08086 rev=0x02 hdr=0x00
    vendor     = 'Intel Corporation'
    device     = 'Xeon 5600 Series Integrated Memory Controller Channel 0 Control'
    class      = bridge
    subclass   = HOST-PCI

hostb13@pci0:63:4:1:	class=0x060000 card=0x11261734 chip=0x2da18086 rev=0x02 hdr=0x00
    vendor     = 'Intel Corporation'
    device     = 'Xeon 5600 Series Integrated Memory Controller Channel 0 Address'
    class      = bridge
    subclass   = HOST-PCI

hostb14@pci0:63:4:2:	class=0x060000 card=0x11261734 chip=0x2da28086 rev=0x02 hdr=0x00
    vendor     = 'Intel Corporation'
    device     = 'Xeon 5600 Series Integrated Memory Controller Channel 0 Rank'
    class      = bridge
    subclass   = HOST-PCI

hostb15@pci0:63:4:3:	class=0x060000 card=0x11261734 chip=0x2da38086 rev=0x02 hdr=0x00
    vendor     = 'Intel Corporation'
    device     = 'Xeon 5600 Series Integrated Memory Controller Channel 0 Thermal Control'
    class      = bridge
    subclass   = HOST-PCI

hostb16@pci0:63:5:0:	class=0x060000 card=0x11261734 chip=0x2da88086 rev=0x02 hdr=0x00
    vendor     = 'Intel Corporation'
    device     = 'Xeon 5600 Series Integrated Memory Controller Channel 1 Control'
    class      = bridge
    subclass   = HOST-PCI

hostb17@pci0:63:5:1:	class=0x060000 card=0x11261734 chip=0x2da98086 rev=0x02 hdr=0x00
    vendor     = 'Intel Corporation'
    device     = 'Xeon 5600 Series Integrated Memory Controller Channel 1 Address'
    class      = bridge
    subclass   = HOST-PCI

hostb18@pci0:63:5:2:	class=0x060000 card=0x11261734 chip=0x2daa8086 rev=0x02 hdr=0x00
    vendor     = 'Intel Corporation'
    device     = 'Xeon 5600 Series Integrated Memory Controller Channel 1 Rank'
    class      = bridge
    subclass   = HOST-PCI

hostb19@pci0:63:5:3:	class=0x060000 card=0x11261734 chip=0x2dab8086 rev=0x02 hdr=0x00
    vendor     = 'Intel Corporation'
    device     = 'Xeon 5600 Series Integrated Memory Controller Channel 1 Thermal Control'
    class      = bridge
    subclass   = HOST-PCI

hostb20@pci0:63:6:0:	class=0x060000 card=0x11261734 chip=0x2db08086 rev=0x02 hdr=0x00
    vendor     = 'Intel Corporation'
    device     = 'Xeon 5600 Series Integrated Memory Controller Channel 2 Control'
    class      = bridge
    subclass   = HOST-PCI

hostb21@pci0:63:6:1:	class=0x060000 card=0x11261734 chip=0x2db18086 rev=0x02 hdr=0x00
    vendor     = 'Intel Corporation'
    device     = 'Xeon 5600 Series Integrated Memory Controller Channel 2 Address'
    class      = bridge
    subclass   = HOST-PCI

hostb22@pci0:63:6:2:	class=0x060000 card=0x11261734 chip=0x2db28086 rev=0x02 hdr=0x00
    vendor     = 'Intel Corporation'
    device     = 'Xeon 5600 Series Integrated Memory Controller Channel 2 Rank'
    class      = bridge
    subclass   = HOST-PCI

hostb23@pci0:63:6:3:	class=0x060000 card=0x11261734 chip=0x2db38086 rev=0x02 hdr=0x00
    vendor     = 'Intel Corporation'
    device     = 'Xeon 5600 Series Integrated Memory Controller Channel 2 Thermal Control'
    class      = bridge
    subclass   = HOST-PCI

hostb24@pci0:0:0:0:	class=0x060000 card=0x11271734 chip=0x34058086 rev=0x13 hdr=0x00
    vendor     = 'Intel Corporation'
    device     = '5520/5500/X58 I/O Hub to ESI Port'
    class      = bridge
    subclass   = HOST-PCI
    cap 05[60] = MSI supports 2 messages, vector masks 
    cap 10[90] = PCI-Express 2 root port max data 128(128) ARI disabled
                 link x4(x4) speed 2.5(2.5) ASPM disabled(L0s/L1)
                 slot 0 power limit 0 mW
    cap 01[e0] = powerspec 3  supports D0 D3  current D0
    ecap 0001[100] = AER 1 0 fatal 0 non-fatal 0 corrected
    ecap 000d[150] = ACS 1
    ecap 000b[160] = Vendor 0pcib3@pci0:0:1:0:	class=0x060400 card=0x11271734 chip=0x34088086 rev=0x13 hdr=0x01
    vendor     = 'Intel Corporation'
    device     = '5520/5500/X58 I/O Hub PCI Express Root Port 1'
    class      = bridge
    subclass   = PCI-PCI
    cap 0d[40] = PCI Bridge card=0x11271734
    cap 05[60] = MSI supports 2 messages, vector masks 
    cap 10[90] = PCI-Express 2 root port max data 128(256) ARI disabled
                 link x1(x1) speed 2.5(5.0) ASPM disabled(L0s/L1)
                 slot 1 power limit 25000 mW
    cap 01[e0] = powerspec 3  supports D0 D3  current D0
    ecap 0001[100] = AER 1 0 fatal 0 non-fatal 0 corrected
    ecap 000d[150] = ACS 1
    ecap 000b[160] = Vendor 0pcib4@pci0:0:3:0:	class=0x060400 card=0x11271734 chip=0x340a8086 rev=0x13 hdr=0x01
    vendor     = 'Intel Corporation'
    device     = '5520/5500/X58 I/O Hub PCI Express Root Port 3'
    class      = bridge
    subclass   = PCI-PCI
    cap 0d[40] = PCI Bridge card=0x11271734
    cap 05[60] = MSI supports 2 messages, vector masks 
    cap 10[90] = PCI-Express 2 root port max data 128(256) ARI disabled
                 link x16(x16) speed 2.5(5.0) ASPM disabled(L0s/L1)
                 slot 7 power limit 25000 mW
    cap 01[e0] = powerspec 3  supports D0 D3  current D0
    ecap 0001[100] = AER 1 0 fatal 0 non-fatal 0 corrected
    ecap 000d[150] = ACS 1
    ecap 000b[160] = Vendor 0pcib5@pci0:0:7:0:	class=0x060400 card=0x11271734 chip=0x340e8086 rev=0x13 hdr=0x01
    vendor     = 'Intel Corporation'
    device     = '5520/5500/X58 I/O Hub PCI Express Root Port 7'
    class      = bridge
    subclass   = PCI-PCI
    cap 0d[40] = PCI Bridge card=0x11271734
    cap 05[60] = MSI supports 2 messages, vector masks 
    cap 10[90] = PCI-Express 2 root port max data 128(256) ARI disabled
                 link x4(x4) speed 2.5(5.0) ASPM disabled(L0s/L1)
                 slot 5 power limit 25000 mW
    cap 01[e0] = powerspec 3  supports D0 D3  current D0
    ecap 0001[100] = AER 1 0 fatal 0 non-fatal 0 corrected
    ecap 000d[150] = ACS 1
    ecap 000b[160] = Vendor 0none0@pci0:0:20:0:	class=0x080000 card=0x00000000 chip=0x342e8086 rev=0x13 hdr=0x00
    vendor     = 'Intel Corporation'
    device     = '7500/5520/5500/X58 I/O Hub System Management Registers'
    class      = base peripheral
    subclass   = interrupt controller
    cap 10[40] = PCI-Express 2 root endpoint max data 128(128)
                 link x0(x0) ASPM disabled(L0s)

none1@pci0:0:20:1:	class=0x080000 card=0x00000000 chip=0x34228086 rev=0x13 hdr=0x00
    vendor     = 'Intel Corporation'
    device     = '7500/5520/5500/X58 I/O Hub GPIO and Scratch Pad Registers'
    class      = base peripheral
    subclass   = interrupt controller
    cap 10[40] = PCI-Express 2 root endpoint max data 128(128)
                 link x0(x0) ASPM disabled(L0s)

none2@pci0:0:20:2:	class=0x080000 card=0x00000000 chip=0x34238086 rev=0x13 hdr=0x00
    vendor     = 'Intel Corporation'
    device     = '7500/5520/5500/X58 I/O Hub Control Status and RAS Registers'
    class      = base peripheral
    subclass   = interrupt controller
    cap 10[40] = PCI-Express 2 root endpoint max data 128(128)
                 link x0(x0) ASPM disabled(L0s)

uhci0@pci0:0:26:0:	class=0x0c0300 card=0x114d1734 chip=0x3a378086 rev=0x00 hdr=0x00
    vendor     = 'Intel Corporation'
    device     = '82801JI (ICH10 Family) USB UHCI Controller'
    class      = serial bus
    subclass   = USB
    bar   [20] = type I/O Port, range 32, base 0x1820, size 32, enabled
    cap 13[50] = PCI Advanced Features: FLR TP

uhci1@pci0:0:26:1:	class=0x0c0300 card=0x114d1734 chip=0x3a388086 rev=0x00 hdr=0x00
    vendor     = 'Intel Corporation'
    device     = '82801JI (ICH10 Family) USB UHCI Controller'
    class      = serial bus
    subclass   = USB
    bar   [20] = type I/O Port, range 32, base 0x1840, size 32, enabled
    cap 13[50] = PCI Advanced Features: FLR TP

uhci2@pci0:0:26:2:	class=0x0c0300 card=0x114d1734 chip=0x3a398086 rev=0x00 hdr=0x00
    vendor     = 'Intel Corporation'
    device     = '82801JI (ICH10 Family) USB UHCI Controller'
    class      = serial bus
    subclass   = USB
    bar   [20] = type I/O Port, range 32, base 0x1860, size 32, enabled
    cap 13[50] = PCI Advanced Features: FLR TP

ehci0@pci0:0:26:7:	class=0x0c0320 card=0x114d1734 chip=0x3a3c8086 rev=0x00 hdr=0x00
    vendor     = 'Intel Corporation'
    device     = '82801JI (ICH10 Family) USB2 EHCI Controller'
    class      = serial bus
    subclass   = USB
    bar   [10] = type Memory, range 32, base 0xf6a00000, size 1024, enabled
    cap 01[50] = powerspec 2  supports D0 D3  current D0
    cap 0a[58] = EHCI Debug Port at offset 0xa0 in map 0x14
    cap 13[98] = PCI Advanced Features: FLR TP

pcib6@pci0:0:28:0:	class=0x060400 card=0x114d1734 chip=0x3a408086 rev=0x00 hdr=0x01
    vendor     = 'Intel Corporation'
    device     = '82801JI (ICH10 Family) PCI Express Root Port 1'
    class      = bridge
    subclass   = PCI-PCI
    cap 10[40] = PCI-Express 1 root port max data 128(128)
                 link x4(x4) speed 2.5(2.5) ASPM disabled(L0s/L1)
                 slot 1 power limit 25000 mW HotPlug(present) surprise
    cap 05[80] = MSI supports 1 message enabled with 1 message
    cap 0d[90] = PCI Bridge card=0x114d1734
    cap 01[a0] = powerspec 2  supports D0 D3  current D0
    ecap 0002[100] = VC 1 max VC0
    ecap 0005[180] = Root Complex Link Declaration 1

pcib7@pci0:0:28:4:	class=0x060400 card=0x114d1734 chip=0x3a488086 rev=0x00 hdr=0x01
    vendor     = 'Intel Corporation'
    device     = '82801JI (ICH10 Family) PCI Express Root Port 5'
    class      = bridge
    subclass   = PCI-PCI
    cap 10[40] = PCI-Express 1 root port max data 128(128)
                 link x1(x1) speed 2.5(2.5) ASPM disabled(L0s/L1)
                 slot 5 power limit 10000 mW HotPlug(present) surprise
    cap 05[80] = MSI supports 1 message enabled with 1 message
    cap 0d[90] = PCI Bridge card=0x114d1734
    cap 01[a0] = powerspec 2  supports D0 D3  current D0
    ecap 0002[100] = VC 1 max VC0
    ecap 0005[180] = Root Complex Link Declaration 1

pcib8@pci0:0:28:5:	class=0x060400 card=0x114d1734 chip=0x3a4a8086 rev=0x00 hdr=0x01
    vendor     = 'Intel Corporation'
    device     = '82801JI (ICH10 Family) PCI Express Root Port 6'
    class      = bridge
    subclass   = PCI-PCI
    cap 10[40] = PCI-Express 1 root port max data 128(128)
                 link x0(x1) speed 0.0(2.5) ASPM disabled(L0s/L1)
                 slot 0 power limit 25000 mW HotPlug(empty) surprise
    cap 05[80] = MSI supports 1 message enabled with 1 message
    cap 0d[90] = PCI Bridge card=0x114d1734
    cap 01[a0] = powerspec 2  supports D0 D3  current D0
    ecap 0002[100] = VC 1 max VC0
    ecap 0005[180] = Root Complex Link Declaration 1

uhci3@pci0:0:29:0:	class=0x0c0300 card=0x114d1734 chip=0x3a348086 rev=0x00 hdr=0x00
    vendor     = 'Intel Corporation'
    device     = '82801JI (ICH10 Family) USB UHCI Controller'
    class      = serial bus
    subclass   = USB
    bar   [20] = type I/O Port, range 32, base 0x1880, size 32, enabled
    cap 13[50] = PCI Advanced Features: FLR TP

uhci4@pci0:0:29:1:	class=0x0c0300 card=0x114d1734 chip=0x3a358086 rev=0x00 hdr=0x00
    vendor     = 'Intel Corporation'
    device     = '82801JI (ICH10 Family) USB UHCI Controller'
    class      = serial bus
    subclass   = USB
    bar   [20] = type I/O Port, range 32, base 0x18a0, size 32, enabled
    cap 13[50] = PCI Advanced Features: FLR TP

uhci5@pci0:0:29:2:	class=0x0c0300 card=0x114d1734 chip=0x3a368086 rev=0x00 hdr=0x00
    vendor     = 'Intel Corporation'
    device     = '82801JI (ICH10 Family) USB UHCI Controller'
    class      = serial bus
    subclass   = USB
    bar   [20] = type I/O Port, range 32, base 0x18c0, size 32, enabled
    cap 13[50] = PCI Advanced Features: FLR TP

ehci1@pci0:0:29:7:	class=0x0c0320 card=0x114d1734 chip=0x3a3a8086 rev=0x00 hdr=0x00
    vendor     = 'Intel Corporation'
    device     = '82801JI (ICH10 Family) USB2 EHCI Controller'
    class      = serial bus
    subclass   = USB
    bar   [10] = type Memory, range 32, base 0xf6a01000, size 1024, enabled
    cap 01[50] = powerspec 2  supports D0 D3  current D0
    cap 0a[58] = EHCI Debug Port at offset 0xa0 in map 0x14
    cap 13[98] = PCI Advanced Features: FLR TP

pcib9@pci0:0:30:0:	class=0x060401 card=0x114d1734 chip=0x244e8086 rev=0x90 hdr=0x01
    vendor     = 'Intel Corporation'
    device     = '82801 PCI Bridge'
    class      = bridge
    subclass   = PCI-PCI
    cap 0d[50] = PCI Bridge card=0x114d1734

isab0@pci0:0:31:0:	class=0x060100 card=0x114d1734 chip=0x3a168086 rev=0x00 hdr=0x00
    vendor     = 'Intel Corporation'
    device     = '82801JIR (ICH10R) LPC Interface Controller'
    class      = bridge
    subclass   = PCI-ISA
    cap 09[e0] = vendor (length 12) Intel cap 1 version 0
		 features: SATA RAID-5, 4 PCI-e x1 slots

ahci0@pci0:0:31:2:	class=0x010601 card=0x114d1734 chip=0x3a228086 rev=0x00 hdr=0x00
    vendor     = 'Intel Corporation'
    device     = '82801JI (ICH10 Family) SATA AHCI Controller'
    class      = mass storage
    subclass   = SATA
    bar   [10] = type I/O Port, range 32, base 0x1c30, size 8, enabled
    bar   [14] = type I/O Port, range 32, base 0x1c24, size 4, enabled
    bar   [18] = type I/O Port, range 32, base 0x1c28, size 8, enabled
    bar   [1c] = type I/O Port, range 32, base 0x1c20, size 4, enabled
    bar   [20] = type I/O Port, range 32, base 0x18e0, size 32, enabled
    bar   [24] = type Memory, range 32, base 0xf6a02000, size 2048, enabled
    cap 05[80] = MSI supports 16 messages enabled with 16 messages
    cap 01[70] = powerspec 3  supports D0 D3  current D0
    cap 12[a8] = SATA Index-Data Pair
    cap 13[b0] = PCI Advanced Features: FLR TP

none3@pci0:0:31:3:	class=0x0c0500 card=0x114d1734 chip=0x3a308086 rev=0x00 hdr=0x00
    vendor     = 'Intel Corporation'
    device     = '82801JI (ICH10 Family) SMBus Controller'
    class      = serial bus
    subclass   = SMBus
    bar   [10] = type Memory, range 64, base 0xf6a03000, size 256, enabled
    bar   [20] = type I/O Port, range 32, base 0x1c00, size 32, enabled

em0@pci0:1:0:0:	class=0x020000 card=0x00018086 chip=0x10d38086 rev=0x00 hdr=0x00
    vendor     = 'Intel Corporation'
    device     = '82574L Gigabit Network Connection'
    class      = network
    subclass   = ethernet
    bar   [10] = type Memory, range 32, base 0xf6140000, size 131072, enabled
    bar   [14] = type Memory, range 32, base 0xf6180000, size 524288, enabled
    bar   [18] = type I/O Port, range 32, base 0x2000, size 32, enabled
    bar   [1c] = type Memory, range 32, base 0xf6160000, size 16384, enabled
    cap 01[c8] = powerspec 2  supports D0 D3  current D0
    cap 05[d0] = MSI supports 1 message, 64 bit 
    cap 10[e0] = PCI-Express 1 endpoint max data 128(256) RO NS
                 link x1(x1) speed 2.5(2.5) ASPM disabled(L0s/L1)
    cap 11[a0] = MSI-X supports 5 messages, enabled
                 Table in map 0x1c[0x0], PBA in map 0x1c[0x2000]
    ecap 0001[100] = AER 1 0 fatal 0 non-fatal 1 corrected
    ecap 0003[140] = Serial 1 6805caffff3e11f5

vgapci0@pci0:2:0:0:	class=0x030000 card=0x084a10de chip=0x0dd810de rev=0xa1 hdr=0x00
    vendor     = 'NVIDIA Corporation'
    device     = 'GF106GL [Quadro 2000]'
    class      = display
    subclass   = VGA
    bar   [10] = type Memory, range 32, base 0xf4000000, size 33554432, enabled
    bar   [14] = type Prefetchable Memory, range 64, base 0xe8000000, size 134217728, enabled
    bar   [1c] = type Prefetchable Memory, range 64, base 0xe4000000, size 67108864, enabled
    bar   [24] = type I/O Port, range 32, base 0x3000, size 128, enabled
    cap 01[60] = powerspec 3  supports D0 D3  current D0
    cap 05[68] = MSI supports 1 message, 64 bit 
    cap 10[78] = PCI-Express 1 endpoint max data 128(128) RO NS
                 link x16(x16) speed 2.5(2.5) ASPM disabled(L0s/L1)
    cap 09[b4] = vendor (length 20)
    ecap 0002[100] = VC 1 max VC0
    ecap 0004[128] = Power Budgeting 1
    ecap 000b[600] = Vendor 1 ID 1

hdac0@pci0:2:0:1:	class=0x040300 card=0x084a10de chip=0x0be910de rev=0xa1 hdr=0x00
    vendor     = 'NVIDIA Corporation'
    device     = 'GF106 High Definition Audio Controller'
    class      = multimedia
    subclass   = HDA
    bar   [10] = type Memory, range 32, base 0xf6080000, size 16384, enabled
    cap 01[60] = powerspec 3  supports D0 D3  current D0
    cap 05[68] = MSI supports 1 message, 64 bit 
    cap 10[78] = PCI-Express 1 endpoint max data 128(128) RO NS
                 link x16(x16) speed 2.5(2.5) ASPM L0s/L1(L0s/L1)

none4@pci0:3:0:0:	class=0x020000 card=0x00371374 chip=0x00371374 rev=0x06 hdr=0x00
    vendor     = 'Silicom Ltd.'
    device     = 'Silicom Dual port Copper Ethernet PCI-E Intel based Bypass Server Adapter'
    class      = network
    subclass   = ethernet
    bar   [10] = type Memory, range 32, base 0xf6720000, size 131072, enabled
    bar   [18] = type I/O Port, range 32, base 0x4000, size 32, enabled
    cap 01[c8] = powerspec 2  supports D0 D3  current D0
    cap 05[d0] = MSI supports 1 message, 64 bit 
    cap 10[e0] = PCI-Express 1 endpoint max data 128(256) RO NS
                 link x4(x4) speed 2.5(2.5) ASPM disabled(L0s/L1)
    ecap 0001[100] = AER 1 0 fatal 1 non-fatal 0 corrected
    ecap 0003[140] = Serial 1 000eb6ffff8731f4

none5@pci0:3:0:1:	class=0x020000 card=0x00371374 chip=0x00371374 rev=0x06 hdr=0x00
    vendor     = 'Silicom Ltd.'
    device     = 'Silicom Dual port Copper Ethernet PCI-E Intel based Bypass Server Adapter'
    class      = network
    subclass   = ethernet
    bar   [10] = type Memory, range 32, base 0xf6760000, size 131072, enabled
    bar   [18] = type I/O Port, range 32, base 0x4020, size 32, enabled
    cap 01[c8] = powerspec 2  supports D0 D3  current D0
    cap 05[d0] = MSI supports 1 message, 64 bit 
    cap 10[e0] = PCI-Express 1 endpoint max data 128(256) RO NS
                 link x4(x4) speed 2.5(2.5) ASPM disabled(L0s/L1)
    ecap 0001[100] = AER 1 0 fatal 1 non-fatal 0 corrected
    ecap 0003[140] = Serial 1 000eb6ffff8731f4

mpt0@pci0:4:0:0:	class=0x010000 card=0x11311734 chip=0x00561000 rev=0x08 hdr=0x00
    vendor     = 'LSI Logic / Symbios Logic'
    device     = 'SAS1064ET PCI-Express Fusion-MPT SAS'
    class      = mass storage
    subclass   = SCSI
    bar   [10] = type I/O Port, range 32, base 0x5000, size 256, disabled
    bar   [14] = type Memory, range 64, base 0xf6610000, size 16384, enabled
    bar   [1c] = type Memory, range 64, base 0xf6600000, size 65536, enabled
    cap 01[50] = powerspec 2  supports D0 D1 D2 D3  current D0
    cap 10[68] = PCI-Express 1 endpoint max data 128(4096) RO NS
                 link x4(x8) speed 2.5(2.5) ASPM disabled(L0s/L1)
    cap 05[98] = MSI supports 1 message, 64 bit 
    cap 11[b0] = MSI-X supports 1 message, enabled
                 Table in map 0x14[0x2000], PBA in map 0x14[0x3000]
    ecap 0001[100] = AER 1 0 fatal 1 non-fatal 0 corrected

re0@pci0:5:0:0:	class=0x020000 card=0x11781734 chip=0x816810ec rev=0x04 hdr=0x00
    vendor     = 'Realtek Semiconductor Co., Ltd.'
    device     = 'RTL8111/8168/8411 PCI Express Gigabit Ethernet Controller'
    class      = network
    subclass   = ethernet
    bar   [10] = type I/O Port, range 32, base 0x6000, size 256, enabled
    bar   [18] = type Prefetchable Memory, range 64, base 0xf6b04000, size 4096, enabled
    bar   [20] = type Prefetchable Memory, range 64, base 0xf6b00000, size 16384, enabled
    cap 01[40] = powerspec 3  supports D0 D1 D2 D3  current D0
    cap 05[50] = MSI supports 1 message, 64 bit 
    cap 10[70] = PCI-Express 2 endpoint MSI 1 max data 128(256) RO
                 link x1(x1) speed 2.5(2.5) ASPM disabled(L0s/L1)
    cap 11[b0] = MSI-X supports 4 messages, enabled
                 Table in map 0x20[0x0], PBA in map 0x20[0x800]
    cap 03[d0] = VPD
    ecap 0001[100] = AER 1 0 fatal 0 non-fatal 2 corrected
    ecap 0002[140] = VC 1 max VC0
    ecap 0003[160] = Serial 1 61000000684ce000

none6@pci0:5:0:1:	class=0x070002 card=0x11781734 chip=0x816a10ec rev=0x01 hdr=0x00
    vendor     = 'Realtek Semiconductor Co., Ltd.'
    class      = simple comms
    subclass   = UART
    bar   [10] = type I/O Port, range 32, base 0x6400, size 256, enabled
    bar   [18] = type Memory, range 64, base 0xf680c000, size 4096, enabled
    bar   [20] = type Memory, range 64, base 0xf6800000, size 16384, enabled
    cap 01[40] = powerspec 3  supports D0 D1 D2 D3  current D0
    cap 05[50] = MSI supports 1 message, 64 bit 
    cap 10[70] = PCI-Express 2 endpoint MSI 1 max data 128(256) RO
                 link x1(x1) speed 2.5(2.5) ASPM disabled(L0s/L1)
    cap 11[b0] = MSI-X supports 4 messages
                 Table in map 0x20[0x0], PBA in map 0x20[0x800]
    cap 03[d0] = VPD
    ecap 0001[100] = AER 1 0 fatal 0 non-fatal 2 corrected

none7@pci0:5:0:2:	class=0x070002 card=0x11781734 chip=0x816b10ec rev=0x01 hdr=0x00
    vendor     = 'Realtek Semiconductor Co., Ltd.'
    class      = simple comms
    subclass   = UART
    bar   [10] = type I/O Port, range 32, base 0x6800, size 256, enabled
    bar   [18] = type Memory, range 64, base 0xf680d000, size 4096, enabled
    bar   [20] = type Memory, range 64, base 0xf6804000, size 16384, enabled
    cap 01[40] = powerspec 3  supports D0 D1 D2 D3  current D0
    cap 05[50] = MSI supports 1 message, 64 bit 
    cap 10[70] = PCI-Express 2 endpoint MSI 1 max data 128(256) RO
                 link x1(x1) speed 2.5(2.5) ASPM disabled(L0s/L1)
    cap 11[b0] = MSI-X supports 4 messages
                 Table in map 0x20[0x0], PBA in map 0x20[0x800]
    cap 03[d0] = VPD
    ecap 0001[100] = AER 1 0 fatal 0 non-fatal 2 corrected

none8@pci0:5:0:3:	class=0x0c0701 card=0x11781734 chip=0x816c10ec rev=0x01 hdr=0x00
    vendor     = 'Realtek Semiconductor Co., Ltd.'
    class      = serial bus
    bar   [10] = type I/O Port, range 32, base 0x6c00, size 256, enabled
    bar   [18] = type Memory, range 64, base 0xf680e000, size 256, enabled
    bar   [20] = type Memory, range 64, base 0xf6808000, size 16384, enabled
    cap 01[40] = powerspec 3  supports D0 D1 D2 D3  current D0
    cap 05[50] = MSI supports 1 message, 64 bit 
    cap 10[70] = PCI-Express 2 endpoint MSI 1 max data 128(256) RO
                 link x1(x1) speed 2.5(2.5) ASPM disabled(L0s/L1)
    cap 11[b0] = MSI-X supports 4 messages
                 Table in map 0x20[0x0], PBA in map 0x20[0x800]
    cap 03[d0] = VPD
    ecap 0001[100] = AER 1 0 fatal 0 non-fatal 2 corrected

none9@pci0:7:9:0:	class=0x0c0010 card=0x10261734 chip=0x581111c1 rev=0x70 hdr=0x00
    vendor     = 'LSI Corporation'
    device     = 'FW322/323 [TrueFire] 1394a Controller'
    class      = serial bus
    subclass   = FireWire
    bar   [10] = type Memory, range 32, base 0xf6900000, size 4096, enabled
    cap 01[44] = powerspec 2  supports D0 D1 D2 D3  current D0
