none0@pci0:0:0:0:	class=0x050000 card=0x534b108e chip=0x036910de rev=0xa2 hdr=0x00
    vendor     = 'NVIDIA Corporation'
    device     = 'MCP55 Memory Controller'
    class      = memory
    subclass   = RAM
    cap 08[44] = HT slave
    cap 08[dc] = HT MSI address window enabled at 0xfee00000

isab0@pci0:0:1:0:	class=0x060100 card=0x534b108e chip=0x036410de rev=0xa3 hdr=0x00
    vendor     = 'NVIDIA Corporation'
    device     = 'MCP55 LPC Bridge'
    class      = bridge
    subclass   = PCI-ISA

none1@pci0:0:1:1:	class=0x0c0500 card=0x534b108e chip=0x036810de rev=0xa3 hdr=0x00
    vendor     = 'NVIDIA Corporation'
    device     = 'MCP55 SMBus Controller'
    class      = serial bus
    subclass   = SMBus
    bar   [10] = type I/O Port, range 32, base 0xcc00, size 64, enabled
    bar   [20] = type I/O Port, range 32, base 0x2d00, size 64, enabled
    bar   [24] = type I/O Port, range 32, base 0x2e00, size 64, enabled
    cap 01[44] = powerspec 2  supports D0 D3  current D0

ohci0@pci0:0:2:0:	class=0x0c0310 card=0x534b108e chip=0x036c10de rev=0xa1 hdr=0x00
    vendor     = 'NVIDIA Corporation'
    device     = 'MCP55 USB Controller'
    class      = serial bus
    subclass   = USB
    bar   [10] = type Memory, range 32, base 0xfcffb000, size 4096, enabled
    cap 01[44] = powerspec 2  supports D0 D1 D2 D3  current D0

ehci0@pci0:0:2:1:	class=0x0c0320 card=0x534b108e chip=0x036d10de rev=0xa2 hdr=0x00
    vendor     = 'NVIDIA Corporation'
    device     = 'MCP55 USB Controller'
    class      = serial bus
    subclass   = USB
    bar   [10] = type Memory, range 32, base 0xfcffac00, size 256, enabled
    cap 0a[44] = EHCI Debug Port at offset 0x98 in map 0x14
    cap 01[80] = powerspec 2  supports D0 D1 D2 D3  current D0

atapci0@pci0:0:4:0:	class=0x01018a card=0x534b108e chip=0x036e10de rev=0xa1 hdr=0x00
    vendor     = 'NVIDIA Corporation'
    device     = 'MCP55 IDE'
    class      = mass storage
    subclass   = ATA
    bar   [20] = type I/O Port, range 32, base 0xffa0, size 16, enabled
    cap 01[44] = powerspec 2  supports D0 D3  current D0

atapci1@pci0:0:5:0:	class=0x010185 card=0x534b108e chip=0x037f10de rev=0xa3 hdr=0x00
    vendor     = 'NVIDIA Corporation'
    device     = 'MCP55 SATA Controller'
    class      = mass storage
    subclass   = ATA
    bar   [10] = type I/O Port, range 32, base 0xc480, size 8, enabled
    bar   [14] = type I/O Port, range 32, base 0xc400, size 4, enabled
    bar   [18] = type I/O Port, range 32, base 0xc080, size 8, enabled
    bar   [1c] = type I/O Port, range 32, base 0xc000, size 4, enabled
    bar   [20] = type I/O Port, range 32, base 0xbc00, size 16, enabled
    bar   [24] = type Memory, range 32, base 0xfcff9000, size 4096, enabled
    cap 01[44] = powerspec 2  supports D0 D3  current D0
    cap 05[b0] = MSI supports 4 messages, 64 bit 
    cap 08[cc] = HT MSI fixed address window disabled at 0xfee00000

pcib1@pci0:0:6:0:	class=0x060401 card=0x00000000 chip=0x037010de rev=0xa2 hdr=0x01
    vendor     = 'NVIDIA Corporation'
    device     = 'MCP55 PCI bridge'
    class      = bridge
    subclass   = PCI-PCI
    cap 0d[b8] = PCI Bridge card=0x00000000
    cap 08[8c] = HT MSI address window disabled at 0xfee00000

nfe0@pci0:0:8:0:	class=0x068000 card=0x534b108e chip=0x037310de rev=0xa3 hdr=0x00
    vendor     = 'NVIDIA Corporation'
    device     = 'MCP55 Ethernet'
    class      = bridge
    bar   [10] = type Memory, range 32, base 0xfcff8000, size 4096, enabled
    bar   [14] = type I/O Port, range 32, base 0xb880, size 8, enabled
    bar   [18] = type Memory, range 32, base 0xfcffa800, size 256, enabled
    bar   [1c] = type Memory, range 32, base 0xfcffa400, size 16, enabled
    cap 01[44] = powerspec 2  supports D0 D1 D2 D3  current D0
    cap 11[70] = MSI-X supports 8 messages, enabled
                 Table in map 0x18[0x0], PBA in map 0x1c[0x0]
    cap 05[50] = MSI supports 8 messages, 64 bit, vector masks 
    cap 08[6c] = HT MSI fixed address window enabled at 0xfee00000

nfe1@pci0:0:9:0:	class=0x068000 card=0x534b108e chip=0x037310de rev=0xa3 hdr=0x00
    vendor     = 'NVIDIA Corporation'
    device     = 'MCP55 Ethernet'
    class      = bridge
    bar   [10] = type Memory, range 32, base 0xfcff7000, size 4096, enabled
    bar   [14] = type I/O Port, range 32, base 0xb800, size 8, enabled
    bar   [18] = type Memory, range 32, base 0xfcffa000, size 256, enabled
    bar   [1c] = type Memory, range 32, base 0xfcff6c00, size 16, enabled
    cap 01[44] = powerspec 2  supports D0 D1 D2 D3  current D0
    cap 11[70] = MSI-X supports 8 messages, enabled
                 Table in map 0x18[0x0], PBA in map 0x1c[0x0]
    cap 05[50] = MSI supports 8 messages, 64 bit, vector masks 
    cap 08[6c] = HT MSI fixed address window enabled at 0xfee00000

pcib2@pci0:0:10:0:	class=0x060400 card=0x000010de chip=0x037610de rev=0xa3 hdr=0x01
    vendor     = 'NVIDIA Corporation'
    device     = 'MCP55 PCI Express bridge'
    class      = bridge
    subclass   = PCI-PCI
    cap 0d[40] = PCI Bridge card=0x000010de
    cap 01[48] = powerspec 2  supports D0 D3  current D0
    cap 05[50] = MSI supports 2 messages, 64 bit 
    cap 08[60] = HT MSI address window enabled at 0xfee00000
    cap 10[80] = PCI-Express 1 root port max data 128(256) RO NS
                 link x8(x8) speed 2.5(2.5) ASPM disabled(L0s/L1)
                 slot 0 power limit 0 mW

pcib3@pci0:0:11:0:	class=0x060400 card=0x000010de chip=0x037410de rev=0xa3 hdr=0x01
    vendor     = 'NVIDIA Corporation'
    device     = 'MCP55 PCI Express bridge'
    class      = bridge
    subclass   = PCI-PCI
    cap 0d[40] = PCI Bridge card=0x000010de
    cap 01[48] = powerspec 2  supports D0 D3  current D0
    cap 05[50] = MSI supports 2 messages, 64 bit 
    cap 08[60] = HT MSI address window disabled at 0xfee00000
    cap 10[80] = PCI-Express 1 root port max data 128(256) RO NS
                 link x4(x4) speed 2.5(2.5) ASPM disabled(L0s/L1)
                 slot 0 power limit 0 mW

pcib4@pci0:0:12:0:	class=0x060400 card=0x000010de chip=0x037410de rev=0xa3 hdr=0x01
    vendor     = 'NVIDIA Corporation'
    device     = 'MCP55 PCI Express bridge'
    class      = bridge
    subclass   = PCI-PCI
    cap 0d[40] = PCI Bridge card=0x000010de
    cap 01[48] = powerspec 2  supports D0 D3  current D0
    cap 05[50] = MSI supports 2 messages, 64 bit 
    cap 08[60] = HT MSI address window disabled at 0xfee00000
    cap 10[80] = PCI-Express 1 root port max data 128(256) RO NS
                 link x4(x4) speed 2.5(2.5) ASPM disabled(L0s/L1)
                 slot 0 power limit 0 mW

pcib5@pci0:0:13:0:	class=0x060400 card=0x000010de chip=0x037810de rev=0xa3 hdr=0x01
    vendor     = 'NVIDIA Corporation'
    device     = 'MCP55 PCI Express bridge'
    class      = bridge
    subclass   = PCI-PCI
    cap 0d[40] = PCI Bridge card=0x000010de
    cap 01[48] = powerspec 2  supports D0 D3  current D0
    cap 05[50] = MSI supports 2 messages, 64 bit 
    cap 08[60] = HT MSI address window enabled at 0xfee00000
    cap 10[80] = PCI-Express 1 root port max data 128(256) RO NS
                 link x4(x4) speed 2.5(2.5) ASPM disabled(L0s/L1)
                 slot 0 power limit 0 mW

pcib7@pci0:0:15:0:	class=0x060400 card=0x000010de chip=0x037710de rev=0xa3 hdr=0x01
    vendor     = 'NVIDIA Corporation'
    device     = 'MCP55 PCI Express bridge'
    class      = bridge
    subclass   = PCI-PCI
    cap 0d[40] = PCI Bridge card=0x000010de
    cap 01[48] = powerspec 2  supports D0 D3  current D0
    cap 05[50] = MSI supports 2 messages, 64 bit 
    cap 08[60] = HT MSI address window disabled at 0xfee00000
    cap 10[80] = PCI-Express 1 root port max data 128(256) RO NS
                 link x16(x8) speed 2.5(2.5) ASPM disabled(L0s/L1)
                 slot 0 power limit 0 mW

hostb0@pci0:0:24:0:	class=0x060000 card=0x00000000 chip=0x11001022 rev=0x00 hdr=0x00
    vendor     = 'Advanced Micro Devices, Inc. [AMD]'
    device     = 'K8 [Athlon64/Opteron] HyperTransport Technology Configuration'
    class      = bridge
    subclass   = HOST-PCI
    cap 08[80] = HT host
    cap 08[a0] = HT host
    cap 08[c0] = HT host

hostb1@pci0:0:24:1:	class=0x060000 card=0x00000000 chip=0x11011022 rev=0x00 hdr=0x00
    vendor     = 'Advanced Micro Devices, Inc. [AMD]'
    device     = 'K8 [Athlon64/Opteron] Address Map'
    class      = bridge
    subclass   = HOST-PCI

hostb2@pci0:0:24:2:	class=0x060000 card=0x00000000 chip=0x11021022 rev=0x00 hdr=0x00
    vendor     = 'Advanced Micro Devices, Inc. [AMD]'
    device     = 'K8 [Athlon64/Opteron] DRAM Controller'
    class      = bridge
    subclass   = HOST-PCI

hostb3@pci0:0:24:3:	class=0x060000 card=0x00000000 chip=0x11031022 rev=0x00 hdr=0x00
    vendor     = 'Advanced Micro Devices, Inc. [AMD]'
    device     = 'K8 [Athlon64/Opteron] Miscellaneous Control'
    class      = bridge
    subclass   = HOST-PCI
    cap 0f[f0] = unknown

hostb4@pci0:0:25:0:	class=0x060000 card=0x00000000 chip=0x11001022 rev=0x00 hdr=0x00
    vendor     = 'Advanced Micro Devices, Inc. [AMD]'
    device     = 'K8 [Athlon64/Opteron] HyperTransport Technology Configuration'
    class      = bridge
    subclass   = HOST-PCI
    cap 08[80] = HT host
    cap 08[a0] = HT host
    cap 08[c0] = HT host

hostb5@pci0:0:25:1:	class=0x060000 card=0x00000000 chip=0x11011022 rev=0x00 hdr=0x00
    vendor     = 'Advanced Micro Devices, Inc. [AMD]'
    device     = 'K8 [Athlon64/Opteron] Address Map'
    class      = bridge
    subclass   = HOST-PCI

hostb6@pci0:0:25:2:	class=0x060000 card=0x00000000 chip=0x11021022 rev=0x00 hdr=0x00
    vendor     = 'Advanced Micro Devices, Inc. [AMD]'
    device     = 'K8 [Athlon64/Opteron] DRAM Controller'
    class      = bridge
    subclass   = HOST-PCI

hostb7@pci0:0:25:3:	class=0x060000 card=0x00000000 chip=0x11031022 rev=0x00 hdr=0x00
    vendor     = 'Advanced Micro Devices, Inc. [AMD]'
    device     = 'K8 [Athlon64/Opteron] Miscellaneous Control'
    class      = bridge
    subclass   = HOST-PCI
    cap 0f[f0] = unknown

vgapci0@pci0:1:5:0:	class=0x030000 card=0x534b108e chip=0x20001a03 rev=0x00 hdr=0x00
    vendor     = 'ASPEED Technology, Inc.'
    device     = 'ASPEED Graphics Family'
    class      = display
    subclass   = VGA
    bar   [10] = type Memory, range 32, base 0xfd000000, size 8388608, enabled
    bar   [14] = type Memory, range 32, base 0xfdae0000, size 131072, enabled
    bar   [18] = type I/O Port, range 32, base 0xdc00, size 128, enabled
    cap 01[40] = powerspec 2  supports D0 D1 D2 D3  current D0

ix0@pci0:2:0:0:	class=0x020000 card=0x17d3103c chip=0x10fb8086 rev=0x01 hdr=0x00
    vendor     = 'Intel Corporation'
    device     = '82599ES 10-Gigabit SFI/SFP+ Network Connection'
    class      = network
    subclass   = ethernet
    bar   [10] = type Memory, range 32, base 0xfde00000, size 1048576, enabled
    bar   [18] = type I/O Port, range 32, base 0xec00, size 32, enabled
    bar   [1c] = type Memory, range 32, base 0xfddfc000, size 16384, enabled
    cap 01[40] = powerspec 3  supports D0 D3  current D0
    cap 05[50] = MSI supports 1 message, 64 bit, vector masks 
    cap 11[70] = MSI-X supports 64 messages, enabled
                 Table in map 0x1c[0x0], PBA in map 0x1c[0x2000]
    cap 10[a0] = PCI-Express 2 endpoint max data 128(512) FLR RO NS
                 link x8(x8) speed 2.5(5.0) ASPM disabled(L0s)
    cap 03[e0] = VPD

ix1@pci0:2:0:1:	class=0x020000 card=0x17d3103c chip=0x10fb8086 rev=0x01 hdr=0x00
    vendor     = 'Intel Corporation'
    device     = '82599ES 10-Gigabit SFI/SFP+ Network Connection'
    class      = network
    subclass   = ethernet
    bar   [10] = type Memory, range 32, base 0xfdc00000, size 1048576, enabled
    bar   [18] = type I/O Port, range 32, base 0xe880, size 32, enabled
    bar   [1c] = type Memory, range 32, base 0xfddf8000, size 16384, enabled
    cap 01[40] = powerspec 3  supports D0 D3  current D0
    cap 05[50] = MSI supports 1 message, 64 bit, vector masks 
    cap 11[70] = MSI-X supports 64 messages, enabled
                 Table in map 0x1c[0x0], PBA in map 0x1c[0x2000]
    cap 10[a0] = PCI-Express 2 endpoint max data 128(512) FLR RO NS
                 link x8(x8) speed 2.5(5.0) ASPM disabled(L0s)
    cap 03[e0] = VPD

pcib6@pci0:5:0:0:	class=0x060400 card=0x00000000 chip=0x01031166 rev=0xb5 hdr=0x01
    vendor     = 'Broadcom'
    device     = 'EPB PCI-Express to PCI-X Bridge'
    class      = bridge
    subclass   = PCI-PCI
    cap 10[60] = PCI-Express 1 PCI bridge max data 128(128)
                 link x4(x4) speed 2.5(2.5) ASPM disabled(L0s/L1)
    cap 07[90] = PCI-X bridge 
    cap 01[b0] = powerspec 2  supports D0 D3  current D0

bge0@pci0:6:4:0:	class=0x020000 card=0x534b108e chip=0x167814e4 rev=0xa3 hdr=0x00
    vendor     = 'Broadcom Inc. and subsidiaries'
    device     = 'NetXtreme BCM5715 Gigabit Ethernet'
    class      = network
    subclass   = ethernet
    bar   [10] = type Memory, range 64, base 0xfdff0000, size 65536, enabled
    bar   [18] = type Memory, range 64, base 0xfdfe0000, size 65536, enabled
    cap 07[40] = PCI-X 64-bit supports 133MHz, 2048 burst read, 1 split transaction
    cap 01[48] = powerspec 2  supports D0 D3  current D0
    cap 03[50] = VPD
    cap 05[58] = MSI supports 8 messages, 64 bit enabled with 1 message

bge1@pci0:6:4:1:	class=0x020000 card=0x534b108e chip=0x167814e4 rev=0xa3 hdr=0x00
    vendor     = 'Broadcom Inc. and subsidiaries'
    device     = 'NetXtreme BCM5715 Gigabit Ethernet'
    class      = network
    subclass   = ethernet
    bar   [10] = type Memory, range 64, base 0xfdfc0000, size 65536, enabled
    bar   [18] = type Memory, range 64, base 0xfdfb0000, size 65536, enabled
    cap 07[40] = PCI-X 64-bit supports 133MHz, 2048 burst read, 1 split transaction
    cap 01[48] = powerspec 2  supports D0 D3  current D0
    cap 03[50] = VPD
    cap 05[58] = MSI supports 8 messages, 64 bit enabled with 1 message
