hostb0@pci0:0:0:0:	class=0x060000 rev=0x07 hdr=0x00 vendor=0x8086 device=0x3c00 subvendor=0x1734 subdevice=0x11b5
    vendor     = 'Intel Corporation'
    device     = 'Xeon E5/Core i7 DMI2'
    class      = bridge
    subclass   = HOST-PCI
    cap 10[90] = PCI-Express 2 root port max data 128(128)
                 max read 128
                 link x0(x4) speed 0.0(2.5) ASPM disabled(L0s/L1)
    cap 01[e0] = powerspec 3  supports D0 D3  current D0
    ecap 000b[100] = Vendor [1] ID 0002 Rev 0 Length 12
    ecap 000b[144] = Vendor [1] ID 0004 Rev 1 Length 60
    ecap 000b[1d0] = Vendor [1] ID 0003 Rev 1 Length 10
    ecap 000b[280] = Vendor [1] ID 0004 Rev 2 Length 24

pcib1@pci0:0:1:0:	class=0x060400 rev=0x07 hdr=0x01 vendor=0x8086 device=0x3c02 subvendor=0x1734 subdevice=0x11b5
    vendor     = 'Intel Corporation'
    device     = 'Xeon E5/Core i7 IIO PCI Express Root Port 1a'
    class      = bridge
    subclass   = PCI-PCI
    cap 0d[40] = PCI Bridge subvendor=0x1734 subdevice=0x11b5
    cap 05[60] = MSI supports 2 messages, vector masks 
    cap 10[90] = PCI-Express 2 root port max data 128(256) ARI disabled
                 max read 128
                 link x0(x4) speed 0.0(8.0) ASPM disabled(L1)
                 slot 0 power limit 25000 mW
    cap 01[e0] = powerspec 3  supports D0 D3  current D0
    ecap 000b[100] = Vendor [1] ID 0002 Rev 0 Length 12
    ecap 000d[110] = ACS 1
    ecap 0001[148] = AER 1 0 fatal 0 non-fatal 0 corrected
    ecap 000b[1d0] = Vendor [1] ID 0003 Rev 1 Length 10
    ecap 0019[250] = PCIe Sec 1 lane errors 0
    ecap 000b[280] = Vendor [1] ID 0004 Rev 2 Length 24

pcib2@pci0:0:1:1:	class=0x060400 rev=0x07 hdr=0x01 vendor=0x8086 device=0x3c03 subvendor=0x1734 subdevice=0x11b5
    vendor     = 'Intel Corporation'
    device     = 'Xeon E5/Core i7 IIO PCI Express Root Port 1b'
    class      = bridge
    subclass   = PCI-PCI
    cap 0d[40] = PCI Bridge subvendor=0x1734 subdevice=0x11b5
    cap 05[60] = MSI supports 2 messages, vector masks 
    cap 10[90] = PCI-Express 2 root port max data 128(256) ARI disabled
                 max read 128
                 link x0(x4) speed 0.0(8.0) ASPM disabled(L1)
                 slot 4 power limit 25000 mW
    cap 01[e0] = powerspec 3  supports D0 D3  current D0
    ecap 000b[100] = Vendor [1] ID 0002 Rev 0 Length 12
    ecap 000d[110] = ACS 1
    ecap 0001[148] = AER 1 0 fatal 0 non-fatal 0 corrected
    ecap 000b[1d0] = Vendor [1] ID 0003 Rev 1 Length 10
    ecap 0019[250] = PCIe Sec 1 lane errors 0
    ecap 000b[280] = Vendor [1] ID 0004 Rev 2 Length 24

pcib3@pci0:0:2:0:	class=0x060400 rev=0x07 hdr=0x01 vendor=0x8086 device=0x3c04 subvendor=0x1734 subdevice=0x11b5
    vendor     = 'Intel Corporation'
    device     = 'Xeon E5/Core i7 IIO PCI Express Root Port 2a'
    class      = bridge
    subclass   = PCI-PCI
    cap 0d[40] = PCI Bridge subvendor=0x1734 subdevice=0x11b5
    cap 05[60] = MSI supports 2 messages, vector masks 
    cap 10[90] = PCI-Express 2 root port max data 128(256) ARI disabled
                 max read 128
                 link x0(x16) speed 0.0(8.0) ASPM disabled(L1)
                 slot 3 power limit 25000 mW
    cap 01[e0] = powerspec 3  supports D0 D3  current D0
    ecap 000b[100] = Vendor [1] ID 0002 Rev 0 Length 12
    ecap 000d[110] = ACS 1
    ecap 0001[148] = AER 1 0 fatal 0 non-fatal 0 corrected
    ecap 000b[1d0] = Vendor [1] ID 0003 Rev 1 Length 10
    ecap 0019[250] = PCIe Sec 1 lane errors 0
    ecap 000b[280] = Vendor [1] ID 0004 Rev 2 Length 24

pcib4@pci0:0:3:0:	class=0x060400 rev=0x07 hdr=0x01 vendor=0x8086 device=0x3c08 subvendor=0x1734 subdevice=0x11b5
    vendor     = 'Intel Corporation'
    device     = 'Xeon E5/Core i7 IIO PCI Express Root Port 3a in PCI Express Mode'
    class      = bridge
    subclass   = PCI-PCI
    cap 0d[40] = PCI Bridge subvendor=0x1734 subdevice=0x11b5
    cap 05[60] = MSI supports 2 messages, vector masks 
    cap 10[90] = PCI-Express 2 root port max data 128(256) ARI disabled
                 max read 128
                 link x16(x16) speed 2.5(8.0) ASPM L1(L1)
                 slot 0 power limit 25000 mW
    cap 01[e0] = powerspec 3  supports D0 D3  current D0
    ecap 000b[100] = Vendor [1] ID 0002 Rev 0 Length 12
    ecap 000d[110] = ACS 1
    ecap 0001[148] = AER 1 0 fatal 0 non-fatal 0 corrected
    ecap 000b[1d0] = Vendor [1] ID 0003 Rev 1 Length 10
    ecap 0019[250] = PCIe Sec 1 lane errors 0
    ecap 000b[280] = Vendor [1] ID 0004 Rev 2 Length 24

none0@pci0:0:5:0:	class=0x088000 rev=0x07 hdr=0x00 vendor=0x8086 device=0x3c28 subvendor=0x1734 subdevice=0x11b5
    vendor     = 'Intel Corporation'
    device     = 'Xeon E5/Core i7 Address Map, VTd_Misc, System Management'
    class      = base peripheral
    cap 10[40] = PCI-Express 2 root endpoint max data 128(128)
                 max read 128

none1@pci0:0:5:2:	class=0x088000 rev=0x07 hdr=0x00 vendor=0x8086 device=0x3c2a subvendor=0x1734 subdevice=0x11b5
    vendor     = 'Intel Corporation'
    device     = 'Xeon E5/Core i7 Control Status and Global Errors'
    class      = base peripheral
    cap 10[40] = PCI-Express 2 root endpoint max data 128(128) RO NS
                 max read 128

ioapic0@pci0:0:5:4:	class=0x080020 rev=0x07 hdr=0x00 vendor=0x8086 device=0x3c2c subvendor=0x1734 subdevice=0x11b5
    vendor     = 'Intel Corporation'
    device     = 'Xeon E5/Core i7 I/O APIC'
    class      = base peripheral
    subclass   = interrupt controller
    bar   [10] = type Memory, range 32, base 0xfb32b000, size 4096, enabled
    cap 01[6c] = powerspec 3  supports D0 D3  current D0

pcib5@pci0:0:17:0:	class=0x060400 rev=0x05 hdr=0x01 vendor=0x8086 device=0x1d3e subvendor=0x1734 subdevice=0x11b5
    vendor     = 'Intel Corporation'
    device     = 'C600/X79 series chipset PCI Express Virtual Root Port'
    class      = bridge
    subclass   = PCI-PCI
    cap 10[40] = PCI-Express 2 root port max data 128(128) ARI enabled
                 max read 128
                 link x1(x1) speed 2.5(2.5) ASPM L0s/L1(L0s/L1)
    cap 01[80] = powerspec 3  supports D0 D3  current D0
    cap 0d[88] = PCI Bridge subvendor=0x1734 subdevice=0x11b5
    cap 05[90] = MSI supports 1 message 
    ecap 0001[100] = AER 1 0 fatal 0 non-fatal 0 corrected
    ecap 000d[138] = ACS 1

none2@pci0:0:22:0:	class=0x078000 rev=0x05 hdr=0x00 vendor=0x8086 device=0x1d3a subvendor=0x1734 subdevice=0x11b6
    vendor     = 'Intel Corporation'
    device     = 'C600/X79 series chipset MEI Controller'
    class      = simple comms
    bar   [10] = type Memory, range 64, base 0xfb32a000, size 16, enabled
    cap 01[50] = powerspec 3  supports D0 D3  current D0
    cap 05[8c] = MSI supports 1 message, 64 bit 

em0@pci0:0:25:0:	class=0x020000 rev=0x05 hdr=0x00 vendor=0x8086 device=0x1502 subvendor=0x1734 subdevice=0x11ca
    vendor     = 'Intel Corporation'
    device     = '82579LM Gigabit Network Connection (Lewisville)'
    class      = network
    subclass   = ethernet
    bar   [10] = type Memory, range 32, base 0xfb300000, size 131072, enabled
    bar   [14] = type Memory, range 32, base 0xfb329000, size 4096, enabled
    bar   [18] = type I/O Port, range 32, base 0xf040, size 32, enabled
    cap 01[c8] = powerspec 2  supports D0 D3  current D0
    cap 05[d0] = MSI supports 1 message, 64 bit enabled with 1 message
    cap 13[e0] = PCI Advanced Features: FLR TP

ehci0@pci0:0:26:0:	class=0x0c0320 rev=0x05 hdr=0x00 vendor=0x8086 device=0x1d2d subvendor=0x1734 subdevice=0x11b6
    vendor     = 'Intel Corporation'
    device     = 'C600/X79 series chipset USB2 Enhanced Host Controller'
    class      = serial bus
    subclass   = USB
    bar   [10] = type Memory, range 32, base 0xfb328000, size 1024, enabled
    cap 01[50] = powerspec 2  supports D0 D3  current D0
    cap 0a[58] = EHCI Debug Port at offset 0xa0 in map 0x14
    cap 13[98] = PCI Advanced Features: FLR TP

hdac1@pci0:0:27:0:	class=0x040300 rev=0x05 hdr=0x00 vendor=0x8086 device=0x1d20 subvendor=0x1734 subdevice=0x11bc
    vendor     = 'Intel Corporation'
    device     = 'C600/X79 series chipset High Definition Audio Controller'
    class      = multimedia
    subclass   = HDA
    bar   [10] = type Memory, range 64, base 0xfb320000, size 16384, enabled
    cap 01[50] = powerspec 2  supports D0 D3  current D0
    cap 05[60] = MSI supports 1 message, 64 bit enabled with 1 message
    cap 10[70] = PCI-Express 1 root endpoint max data 128(128) FLR
                 max read 128
    ecap 0002[100] = VC 1 max VC1
    ecap 0005[130] = Root Complex Link Declaration 1

pcib6@pci0:0:28:0:	class=0x060400 rev=0xb5 hdr=0x01 vendor=0x8086 device=0x1d10 subvendor=0x1734 subdevice=0x11b6
    vendor     = 'Intel Corporation'
    device     = 'C600/X79 series chipset PCI Express Root Port 1'
    class      = bridge
    subclass   = PCI-PCI
    cap 10[40] = PCI-Express 2 root port max data 128(128)
                 max read 128
                 link x0(x4) speed 0.0(5.0)
    cap 05[80] = MSI supports 1 message 
    cap 0d[90] = PCI Bridge subvendor=0x1734 subdevice=0x11b6
    cap 01[a0] = powerspec 2  supports D0 D3  current D0

pcib7@pci0:0:28:6:	class=0x060400 rev=0xb5 hdr=0x01 vendor=0x8086 device=0x1d1c subvendor=0x1734 subdevice=0x11b6
    vendor     = 'Intel Corporation'
    device     = 'C600/X79 series chipset PCI Express Root Port 7'
    class      = bridge
    subclass   = PCI-PCI
    cap 10[40] = PCI-Express 2 root port max data 128(128)
                 max read 128
                 link x1(x1) speed 5.0(5.0)
    cap 05[80] = MSI supports 1 message 
    cap 0d[90] = PCI Bridge subvendor=0x1734 subdevice=0x11b6
    cap 01[a0] = powerspec 2  supports D0 D3  current D0

ehci1@pci0:0:29:0:	class=0x0c0320 rev=0x05 hdr=0x00 vendor=0x8086 device=0x1d26 subvendor=0x1734 subdevice=0x11b6
    vendor     = 'Intel Corporation'
    device     = 'C600/X79 series chipset USB2 Enhanced Host Controller'
    class      = serial bus
    subclass   = USB
    bar   [10] = type Memory, range 32, base 0xfb327000, size 1024, enabled
    cap 01[50] = powerspec 2  supports D0 D3  current D0
    cap 0a[58] = EHCI Debug Port at offset 0xa0 in map 0x14
    cap 13[98] = PCI Advanced Features: FLR TP

pcib8@pci0:0:30:0:	class=0x060401 rev=0xa5 hdr=0x01 vendor=0x8086 device=0x244e subvendor=0x1734 subdevice=0x11b6
    vendor     = 'Intel Corporation'
    device     = '82801 PCI Bridge'
    class      = bridge
    subclass   = PCI-PCI
    cap 0d[50] = PCI Bridge subvendor=0x1734 subdevice=0x11b6

isab0@pci0:0:31:0:	class=0x060100 rev=0x05 hdr=0x00 vendor=0x8086 device=0x1d41 subvendor=0x1734 subdevice=0x11b6
    vendor     = 'Intel Corporation'
    device     = 'C600/X79 series chipset LPC Controller'
    class      = bridge
    subclass   = PCI-ISA
    cap 09[e0] = vendor (length 12) Intel cap 1 version 0
		 features: AMT, 4 PCI-e x1 slots

ahci0@pci0:0:31:2:	class=0x010601 rev=0x05 hdr=0x00 vendor=0x8086 device=0x1d02 subvendor=0x1734 subdevice=0x11b6
    vendor     = 'Intel Corporation'
    device     = 'C600/X79 series chipset 6-Port SATA AHCI Controller'
    class      = mass storage
    subclass   = SATA
    bar   [10] = type I/O Port, range 32, base 0xf090, size 8, enabled
    bar   [14] = type I/O Port, range 32, base 0xf080, size 4, enabled
    bar   [18] = type I/O Port, range 32, base 0xf070, size 8, enabled
    bar   [1c] = type I/O Port, range 32, base 0xf060, size 4, enabled
    bar   [20] = type I/O Port, range 32, base 0xf020, size 32, enabled
    bar   [24] = type Memory, range 32, base 0xfb326000, size 2048, enabled
    cap 05[80] = MSI supports 1 message enabled with 1 message
    cap 01[70] = powerspec 3  supports D0 D3  current D0
    cap 12[a8] = SATA Index-Data Pair
    cap 13[b0] = PCI Advanced Features: FLR TP

ichsmb0@pci0:0:31:3:	class=0x0c0500 rev=0x05 hdr=0x00 vendor=0x8086 device=0x1d22 subvendor=0x1734 subdevice=0x11b6
    vendor     = 'Intel Corporation'
    device     = 'C600/X79 series chipset SMBus Host Controller'
    class      = serial bus
    subclass   = SMBus
    bar   [10] = type Memory, range 64, base 0xfb325000, size 256, enabled
    bar   [20] = type I/O Port, range 32, base 0xf000, size 32, enabled

none3@pci0:0:31:6:	class=0x118000 rev=0x05 hdr=0x00 vendor=0x8086 device=0x1d24 subvendor=0x1734 subdevice=0x11b6
    vendor     = 'Intel Corporation'
    device     = 'C600/X79 series chipset Thermal Management Controller'
    class      = dasp
    bar   [10] = type Memory, range 64, base 0xfb324000, size 4096, enabled
    cap 01[50] = powerspec 3  supports D0 D3  current D0

vgapci0@pci0:4:0:0:	class=0x030000 rev=0xa1 hdr=0x00 vendor=0x10de device=0x104a subvendor=0x19da subdevice=0x5215
    vendor     = 'NVIDIA Corporation'
    device     = 'GF119 [GeForce GT 610]'
    class      = display
    subclass   = VGA
    bar   [10] = type Memory, range 32, base 0xfa000000, size 16777216, enabled
    bar   [14] = type Prefetchable Memory, range 64, base 0xe8000000, size 134217728, enabled
    bar   [1c] = type Prefetchable Memory, range 64, base 0xf0000000, size 33554432, enabled
    bar   [24] = type I/O Port, range 32, base 0xe000, size 128, enabled
    cap 01[60] = powerspec 3  supports D0 D3  current D0
    cap 05[68] = MSI supports 1 message, 64 bit enabled with 1 message
    cap 10[78] = PCI-Express 1 endpoint max data 128(128) NS
                 max read 512
                 link x16(x16) speed 2.5(2.5) ASPM L1(L0s/L1) ClockPM disabled
    cap 09[b4] = vendor (length 20)
    ecap 0002[100] = VC 1 max VC0
    ecap 0004[128] = Power Budgeting 1
    ecap 000b[600] = Vendor [1] ID 0001 Rev 1 Length 36

hdac0@pci0:4:0:1:	class=0x040300 rev=0xa1 hdr=0x00 vendor=0x10de device=0x0e08 subvendor=0x19da subdevice=0x5215
    vendor     = 'NVIDIA Corporation'
    device     = 'GF119 HDMI Audio Controller'
    class      = multimedia
    subclass   = HDA
    bar   [10] = type Memory, range 32, base 0xfb080000, size 16384, enabled
    cap 01[60] = powerspec 3  supports D0 D3  current D0
    cap 05[68] = MSI supports 1 message, 64 bit enabled with 1 message
    cap 10[78] = PCI-Express 1 endpoint max data 128(128) NS
                 max read 512
                 link x16(x16) speed 2.5(2.5) ASPM L0s/L1(L0s/L1) ClockPM disabled

isci0@pci0:5:0:0:	class=0x010700 rev=0x05 hdr=0x00 vendor=0x8086 device=0x1d6b subvendor=0x1734 subdevice=0x11b6
    vendor     = 'Intel Corporation'
    device     = 'C602 chipset 4-Port SATA Storage Control Unit'
    class      = mass storage
    subclass   = SAS
    bar   [10] = type Prefetchable Memory, range 64, base 0xf287c000, size 16384, enabled
    bar   [18] = type Prefetchable Memory, range 64, base 0xf2400000, size 4194304, enabled
    bar   [20] = type I/O Port, range 32, base 0xd000, size 256, enabled
    cap 01[98] = powerspec 3  supports D0 D3  current D0
    cap 10[c4] = PCI-Express 2 endpoint max data 128(1024) FLR NS
                 max read 1024
                 link x1(x1) speed 2.5(2.5) ASPM L0s/L1(L0s/L1)
    cap 11[a0] = MSI-X supports 2 messages, enabled
                 Table in map 0x10[0x2000], PBA in map 0x10[0x3000]
    ecap 0001[100] = AER 1 0 fatal 0 non-fatal 1 corrected
    ecap 000e[138] = ARI 1
    ecap 0017[180] = TPH Requester 1
    ecap 0010[140] = SR-IOV 1 IOV disabled, Memory Space disabled, ARI disabled
                     0 VFs configured out of 31 supported
                     First VF RID Offset 0x0008, VF RID Stride 0x0001
                     VF Device ID 0x1d5b
                     Page Sizes: 4096 (enabled), 8192, 65536, 262144, 1048576, 4194304

none4@pci0:5:0:3:	class=0x0c0500 rev=0x05 hdr=0x00 vendor=0x8086 device=0x1d70 subvendor=0x1734 subdevice=0x11b6
    vendor     = 'Intel Corporation'
    device     = 'C600/X79 series chipset SMBus Controller 0'
    class      = serial bus
    subclass   = SMBus
    bar   [10] = type Memory, range 32, base 0xfb200000, size 4096, enabled
    bar   [20] = type I/O Port, range 32, base 0xd100, size 32, enabled
    cap 10[90] = PCI-Express 2 endpoint max data 128(256)
                 max read 128
                 link x1(x1) speed 2.5(2.5) ASPM L0s/L1(L0s/L1)
    cap 01[cc] = powerspec 3  supports D0 D3  current D0
    cap 05[d4] = MSI supports 1 message 
    ecap 000e[100] = ARI 1

xhci0@pci0:7:0:0:	class=0x0c0330 rev=0x02 hdr=0x00 vendor=0x104c device=0x8241 subvendor=0x1734 subdevice=0x11e3
    vendor     = 'Texas Instruments'
    device     = 'TUSB73x0 SuperSpeed USB 3.0 xHCI Host Controller'
    class      = serial bus
    subclass   = USB
    bar   [10] = type Memory, range 64, base 0xfb100000, size 65536, enabled
    bar   [18] = type Memory, range 64, base 0xfb110000, size 8192, enabled
    cap 01[40] = powerspec 3  supports D0 D1 D2 D3  current D0
    cap 05[48] = MSI supports 8 messages, 64 bit 
    cap 10[70] = PCI-Express 2 endpoint max data 128(1024)
                 max read 512
                 link x1(x1) speed 5.0(5.0) ASPM L1(L0s/L1) ClockPM disabled
    cap 11[c0] = MSI-X supports 8 messages, enabled
                 Table in map 0x18[0x0], PBA in map 0x18[0x1000]
    ecap 0001[100] = AER 2 0 fatal 0 non-fatal 1 corrected
    ecap 0003[150] = Serial 1 0800280000200000

none5@pci0:255:8:0:	class=0x088000 rev=0x07 hdr=0x00 vendor=0x8086 device=0x3c80 subvendor=0x1734 subdevice=0x11b5
    vendor     = 'Intel Corporation'
    device     = 'Xeon E5/Core i7 QPI Link 0'
    class      = base peripheral

none6@pci0:255:8:3:	class=0x088000 rev=0x07 hdr=0x00 vendor=0x8086 device=0x3c83 subvendor=0x1734 subdevice=0x11b5
    vendor     = 'Intel Corporation'
    device     = 'Xeon E5/Core i7 QPI Link Reut 0'
    class      = base peripheral
    cap 10[40] = PCI-Express 1 root endpoint max data 128(128)
                 max read 128
    ecap 000b[100] = Vendor [0] ID 0001 Rev 0 Length 240

none7@pci0:255:8:4:	class=0x088000 rev=0x07 hdr=0x00 vendor=0x8086 device=0x3c84 subvendor=0x1734 subdevice=0x11b5
    vendor     = 'Intel Corporation'
    device     = 'Xeon E5/Core i7 QPI Link Reut 0'
    class      = base peripheral
    cap 10[40] = PCI-Express 1 root endpoint max data 128(128)
                 max read 128

none8@pci0:255:9:0:	class=0x088000 rev=0x07 hdr=0x00 vendor=0x8086 device=0x3c90 subvendor=0x1734 subdevice=0x11b5
    vendor     = 'Intel Corporation'
    device     = 'Xeon E5/Core i7 QPI Link 1'
    class      = base peripheral

none9@pci0:255:9:3:	class=0x088000 rev=0x07 hdr=0x00 vendor=0x8086 device=0x3c93 subvendor=0x1734 subdevice=0x11b5
    vendor     = 'Intel Corporation'
    device     = 'Xeon E5/Core i7 QPI Link Reut 1'
    class      = base peripheral
    cap 10[40] = PCI-Express 1 root endpoint max data 128(128)
                 max read 128
    ecap 000b[100] = Vendor [0] ID 0001 Rev 0 Length 240

none10@pci0:255:9:4:	class=0x088000 rev=0x07 hdr=0x00 vendor=0x8086 device=0x3c94 subvendor=0x1734 subdevice=0x11b5
    vendor     = 'Intel Corporation'
    device     = 'Xeon E5/Core i7 QPI Link Reut 1'
    class      = base peripheral
    cap 10[40] = PCI-Express 1 root endpoint max data 128(128)
                 max read 128

none11@pci0:255:10:0:	class=0x088000 rev=0x07 hdr=0x00 vendor=0x8086 device=0x3cc0 subvendor=0x1734 subdevice=0x11b5
    vendor     = 'Intel Corporation'
    device     = 'Xeon E5/Core i7 Power Control Unit 0'
    class      = base peripheral

none12@pci0:255:10:1:	class=0x088000 rev=0x07 hdr=0x00 vendor=0x8086 device=0x3cc1 subvendor=0x1734 subdevice=0x11b5
    vendor     = 'Intel Corporation'
    device     = 'Xeon E5/Core i7 Power Control Unit 1'
    class      = base peripheral

none13@pci0:255:10:2:	class=0x088000 rev=0x07 hdr=0x00 vendor=0x8086 device=0x3cc2 subvendor=0x1734 subdevice=0x11b5
    vendor     = 'Intel Corporation'
    device     = 'Xeon E5/Core i7 Power Control Unit 2'
    class      = base peripheral

none14@pci0:255:10:3:	class=0x088000 rev=0x07 hdr=0x00 vendor=0x8086 device=0x3cd0 subvendor=0x1734 subdevice=0x11b5
    vendor     = 'Intel Corporation'
    device     = 'Xeon E5/Core i7 Power Control Unit 3'
    class      = base peripheral

none15@pci0:255:11:0:	class=0x088000 rev=0x07 hdr=0x00 vendor=0x8086 device=0x3ce0 subvendor=0x1734 subdevice=0x11b5
    vendor     = 'Intel Corporation'
    device     = 'Xeon E5/Core i7 Interrupt Control Registers'
    class      = base peripheral

none16@pci0:255:11:3:	class=0x088000 rev=0x07 hdr=0x00 vendor=0x8086 device=0x3ce3 subvendor=0x1734 subdevice=0x11b5
    vendor     = 'Intel Corporation'
    device     = 'Xeon E5/Core i7 Semaphore and Scratchpad Configuration Registers'
    class      = base peripheral

none17@pci0:255:12:0:	class=0x088000 rev=0x07 hdr=0x00 vendor=0x8086 device=0x3ce8 subvendor=0x1734 subdevice=0x11b5
    vendor     = 'Intel Corporation'
    device     = 'Xeon E5/Core i7 Unicast Register 0'
    class      = base peripheral

none18@pci0:255:12:1:	class=0x088000 rev=0x07 hdr=0x00 vendor=0x8086 device=0x3ce8 subvendor=0x1734 subdevice=0x11b5
    vendor     = 'Intel Corporation'
    device     = 'Xeon E5/Core i7 Unicast Register 0'
    class      = base peripheral

none19@pci0:255:12:6:	class=0x088000 rev=0x07 hdr=0x00 vendor=0x8086 device=0x3cf4 subvendor=0x1734 subdevice=0x11b5
    vendor     = 'Intel Corporation'
    device     = 'Xeon E5/Core i7 Integrated Memory Controller System Address Decoder 0'
    class      = base peripheral

none20@pci0:255:12:7:	class=0x088000 rev=0x07 hdr=0x00 vendor=0x8086 device=0x3cf6 subvendor=0x1734 subdevice=0x11b5
    vendor     = 'Intel Corporation'
    device     = 'Xeon E5/Core i7 System Address Decoder'
    class      = base peripheral

none21@pci0:255:13:0:	class=0x088000 rev=0x07 hdr=0x00 vendor=0x8086 device=0x3ce8 subvendor=0x1734 subdevice=0x11b5
    vendor     = 'Intel Corporation'
    device     = 'Xeon E5/Core i7 Unicast Register 0'
    class      = base peripheral

none22@pci0:255:13:1:	class=0x088000 rev=0x07 hdr=0x00 vendor=0x8086 device=0x3ce8 subvendor=0x1734 subdevice=0x11b5
    vendor     = 'Intel Corporation'
    device     = 'Xeon E5/Core i7 Unicast Register 0'
    class      = base peripheral

none23@pci0:255:13:6:	class=0x088000 rev=0x07 hdr=0x00 vendor=0x8086 device=0x3cf5 subvendor=0x1734 subdevice=0x11b5
    vendor     = 'Intel Corporation'
    device     = 'Xeon E5/Core i7 Integrated Memory Controller System Address Decoder 1'
    class      = base peripheral

none24@pci0:255:14:0:	class=0x088000 rev=0x07 hdr=0x00 vendor=0x8086 device=0x3ca0 subvendor=0x1734 subdevice=0x11b5
    vendor     = 'Intel Corporation'
    device     = 'Xeon E5/Core i7 Processor Home Agent'
    class      = base peripheral

none25@pci0:255:14:1:	class=0x110100 rev=0x07 hdr=0x00 vendor=0x8086 device=0x3c46 subvendor=0x1734 subdevice=0x11b5
    vendor     = 'Intel Corporation'
    device     = 'Xeon E5/Core i7 Processor Home Agent Performance Monitoring'
    class      = dasp
    subclass   = performance counters

none26@pci0:255:15:0:	class=0x088000 rev=0x07 hdr=0x00 vendor=0x8086 device=0x3ca8 subvendor=0x1734 subdevice=0x11b5
    vendor     = 'Intel Corporation'
    device     = 'Xeon E5/Core i7 Integrated Memory Controller Registers'
    class      = base peripheral
    cap 10[40] = PCI-Express 1 root endpoint max data 128(128)
                 max read 128

none27@pci0:255:15:1:	class=0x088000 rev=0x07 hdr=0x00 vendor=0x8086 device=0x3c71 subvendor=0x1734 subdevice=0x11b5
    vendor     = 'Intel Corporation'
    device     = 'Xeon E5/Core i7 Integrated Memory Controller RAS Registers'
    class      = base peripheral
    cap 10[40] = PCI-Express 1 root endpoint max data 128(128)
                 max read 128

none28@pci0:255:15:2:	class=0x088000 rev=0x07 hdr=0x00 vendor=0x8086 device=0x3caa subvendor=0x1734 subdevice=0x11b5
    vendor     = 'Intel Corporation'
    device     = 'Xeon E5/Core i7 Integrated Memory Controller Target Address Decoder 0'
    class      = base peripheral
    cap 10[40] = PCI-Express 1 root endpoint max data 128(128)
                 max read 128

none29@pci0:255:15:3:	class=0x088000 rev=0x07 hdr=0x00 vendor=0x8086 device=0x3cab subvendor=0x1734 subdevice=0x11b5
    vendor     = 'Intel Corporation'
    device     = 'Xeon E5/Core i7 Integrated Memory Controller Target Address Decoder 1'
    class      = base peripheral
    cap 10[40] = PCI-Express 1 root endpoint max data 128(128)
                 max read 128

none30@pci0:255:15:4:	class=0x088000 rev=0x07 hdr=0x00 vendor=0x8086 device=0x3cac subvendor=0x1734 subdevice=0x11b5
    vendor     = 'Intel Corporation'
    device     = 'Xeon E5/Core i7 Integrated Memory Controller Target Address Decoder 2'
    class      = base peripheral
    cap 10[40] = PCI-Express 1 root endpoint max data 128(128)
                 max read 128

none31@pci0:255:15:5:	class=0x088000 rev=0x07 hdr=0x00 vendor=0x8086 device=0x3cad subvendor=0x1734 subdevice=0x11b5
    vendor     = 'Intel Corporation'
    device     = 'Xeon E5/Core i7 Integrated Memory Controller Target Address Decoder 3'
    class      = base peripheral
    cap 10[40] = PCI-Express 1 root endpoint max data 128(128)
                 max read 128

none32@pci0:255:15:6:	class=0x088000 rev=0x07 hdr=0x00 vendor=0x8086 device=0x3cae subvendor=0x1734 subdevice=0x11b5
    vendor     = 'Intel Corporation'
    device     = 'Xeon E5/Core i7 Integrated Memory Controller Target Address Decoder 4'
    class      = base peripheral

none33@pci0:255:16:0:	class=0x088000 rev=0x07 hdr=0x00 vendor=0x8086 device=0x3cb0 subvendor=0x1734 subdevice=0x11b5
    vendor     = 'Intel Corporation'
    device     = 'Xeon E5/Core i7 Integrated Memory Controller Channel 0-3 Thermal Control 0'
    class      = base peripheral
    cap 10[40] = PCI-Express 1 root endpoint max data 128(128)
                 max read 128

none34@pci0:255:16:1:	class=0x088000 rev=0x07 hdr=0x00 vendor=0x8086 device=0x3cb1 subvendor=0x1734 subdevice=0x11b5
    vendor     = 'Intel Corporation'
    device     = 'Xeon E5/Core i7 Integrated Memory Controller Channel 0-3 Thermal Control 1'
    class      = base peripheral
    cap 10[40] = PCI-Express 1 root endpoint max data 128(128)
                 max read 128

none35@pci0:255:16:2:	class=0x088000 rev=0x07 hdr=0x00 vendor=0x8086 device=0x3cb2 subvendor=0x1734 subdevice=0x11b5
    vendor     = 'Intel Corporation'
    device     = 'Xeon E5/Core i7 Integrated Memory Controller ERROR Registers 0'
    class      = base peripheral
    cap 10[40] = PCI-Express 1 root endpoint max data 128(128)
                 max read 128

none36@pci0:255:16:3:	class=0x088000 rev=0x07 hdr=0x00 vendor=0x8086 device=0x3cb3 subvendor=0x1734 subdevice=0x11b5
    vendor     = 'Intel Corporation'
    device     = 'Xeon E5/Core i7 Integrated Memory Controller ERROR Registers 1'
    class      = base peripheral
    cap 10[40] = PCI-Express 1 root endpoint max data 128(128)
                 max read 128

none37@pci0:255:16:4:	class=0x088000 rev=0x07 hdr=0x00 vendor=0x8086 device=0x3cb4 subvendor=0x1734 subdevice=0x11b5
    vendor     = 'Intel Corporation'
    device     = 'Xeon E5/Core i7 Integrated Memory Controller Channel 0-3 Thermal Control 2'
    class      = base peripheral
    cap 10[40] = PCI-Express 1 root endpoint max data 128(128)
                 max read 128

none38@pci0:255:16:5:	class=0x088000 rev=0x07 hdr=0x00 vendor=0x8086 device=0x3cb5 subvendor=0x1734 subdevice=0x11b5
    vendor     = 'Intel Corporation'
    device     = 'Xeon E5/Core i7 Integrated Memory Controller Channel 0-3 Thermal Control 3'
    class      = base peripheral
    cap 10[40] = PCI-Express 1 root endpoint max data 128(128)
                 max read 128

none39@pci0:255:16:6:	class=0x088000 rev=0x07 hdr=0x00 vendor=0x8086 device=0x3cb6 subvendor=0x1734 subdevice=0x11b5
    vendor     = 'Intel Corporation'
    device     = 'Xeon E5/Core i7 Integrated Memory Controller ERROR Registers 2'
    class      = base peripheral
    cap 10[40] = PCI-Express 1 root endpoint max data 128(128)
                 max read 128

none40@pci0:255:16:7:	class=0x088000 rev=0x07 hdr=0x00 vendor=0x8086 device=0x3cb7 subvendor=0x1734 subdevice=0x11b5
    vendor     = 'Intel Corporation'
    device     = 'Xeon E5/Core i7 Integrated Memory Controller ERROR Registers 3'
    class      = base peripheral
    cap 10[40] = PCI-Express 1 root endpoint max data 128(128)
                 max read 128

none41@pci0:255:17:0:	class=0x088000 rev=0x07 hdr=0x00 vendor=0x8086 device=0x3cb8 subvendor=0x1734 subdevice=0x11b5
    vendor     = 'Intel Corporation'
    device     = 'Xeon E5/Core i7 DDRIO'
    class      = base peripheral

none42@pci0:255:19:0:	class=0x088000 rev=0x07 hdr=0x00 vendor=0x8086 device=0x3ce4 subvendor=0x1734 subdevice=0x11b5
    vendor     = 'Intel Corporation'
    device     = 'Xeon E5/Core i7 R2PCIe'
    class      = base peripheral

none43@pci0:255:19:1:	class=0x110100 rev=0x07 hdr=0x00 vendor=0x8086 device=0x3c43 subvendor=0x1734 subdevice=0x11b5
    vendor     = 'Intel Corporation'
    device     = 'Xeon E5/Core i7 Ring to PCI Express Performance Monitor'
    class      = dasp
    subclass   = performance counters

none44@pci0:255:19:4:	class=0x110100 rev=0x07 hdr=0x00 vendor=0x8086 device=0x3ce6 subvendor=0x1734 subdevice=0x11b5
    vendor     = 'Intel Corporation'
    device     = 'Xeon E5/Core i7 QuickPath Interconnect Agent Ring Registers'
    class      = dasp
    subclass   = performance counters

none45@pci0:255:19:5:	class=0x110100 rev=0x07 hdr=0x00 vendor=0x8086 device=0x3c44 subvendor=0x1734 subdevice=0x11b5
    vendor     = 'Intel Corporation'
    device     = 'Xeon E5/Core i7 Ring to QuickPath Interconnect Link 0 Performance Monitor'
    class      = dasp
    subclass   = performance counters

none46@pci0:255:19:6:	class=0x088000 rev=0x07 hdr=0x00 vendor=0x8086 device=0x3c45 subvendor=0x1734 subdevice=0x11b5
    vendor     = 'Intel Corporation'
    device     = 'Xeon E5/Core i7 Ring to QuickPath Interconnect Link 1 Performance Monitor'
    class      = base peripheral
