hostb0@pci0:0:0:0:	class=0x060000 card=0x50001458 chip=0x01008086 rev=0x09 hdr=0x00
    vendor     = 'Intel Corporation'
    device     = '2nd Generation Core Processor Family DRAM Controller'
    class      = bridge
    subclass   = HOST-PCI
    cap 09[e0] = vendor (length 12) Intel cap 0 version 1

pcib1@pci0:0:1:0:	class=0x060400 card=0x50001458 chip=0x01018086 rev=0x09 hdr=0x01
    vendor     = 'Intel Corporation'
    device     = 'Xeon E3-1200/2nd Generation Core Processor Family PCI Express Root Port'
    class      = bridge
    subclass   = PCI-PCI
    cap 0d[88] = PCI Bridge card=0x50001458
    cap 01[80] = powerspec 3  supports D0 D3  current D0
    cap 05[90] = MSI supports 1 message 
    cap 10[a0] = PCI-Express 2 root port max data 128(128)
                 link x8(x8) speed 5.0(5.0) ASPM disabled(L0s/L1)
                 slot 1 power limit 75000 mW
    ecap 0002[100] = VC 1 max VC0
    ecap 0005[140] = Root Complex Link Declaration 1

pcib2@pci0:0:1:1:	class=0x060400 card=0x50001458 chip=0x01058086 rev=0x09 hdr=0x01
    vendor     = 'Intel Corporation'
    device     = 'Xeon E3-1200/2nd Generation Core Processor Family PCI Express Root Port'
    class      = bridge
    subclass   = PCI-PCI
    cap 0d[88] = PCI Bridge card=0x50001458
    cap 01[80] = powerspec 3  supports D0 D3  current D0
    cap 05[90] = MSI supports 1 message 
    cap 10[a0] = PCI-Express 2 root port max data 128(128)
                 link x1(x8) speed 2.5(5.0) ASPM disabled(L0s/L1)
                 slot 2 power limit 75000 mW
    ecap 0002[100] = VC 1 max VC0
    ecap 0005[140] = Root Complex Link Declaration 1

none0@pci0:0:22:0:	class=0x078000 card=0x1c3a1458 chip=0x1c3a8086 rev=0x04 hdr=0x00
    vendor     = 'Intel Corporation'
    device     = '6 Series/C200 Series Chipset Family MEI Controller'
    class      = simple comms
    bar   [10] = type Memory, range 64, base 0xf730b000, size 16, enabled
    cap 01[50] = powerspec 3  supports D0 D3  current D0
    cap 05[8c] = MSI supports 1 message, 64 bit 

ehci0@pci0:0:26:0:	class=0x0c0320 card=0x50061458 chip=0x1c2d8086 rev=0x05 hdr=0x00
    vendor     = 'Intel Corporation'
    device     = '6 Series/C200 Series Chipset Family USB Enhanced Host Controller'
    class      = serial bus
    subclass   = USB
    bar   [10] = type Memory, range 32, base 0xf7308000, size 1024, enabled
    cap 01[50] = powerspec 2  supports D0 D3  current D0
    cap 0a[58] = EHCI Debug Port at offset 0xa0 in map 0x14
    cap 13[98] = PCI Advanced Features: FLR TP

hdac1@pci0:0:27:0:	class=0x040300 card=0xa0021458 chip=0x1c208086 rev=0x05 hdr=0x00
    vendor     = 'Intel Corporation'
    device     = '6 Series/C200 Series Chipset Family High Definition Audio Controller'
    class      = multimedia
    subclass   = HDA
    bar   [10] = type Memory, range 64, base 0xf7300000, size 16384, enabled
    cap 01[50] = powerspec 2  supports D0 D3  current D0
    cap 05[60] = MSI supports 1 message, 64 bit enabled with 1 message
    cap 10[70] = PCI-Express 1 root endpoint max data 128(128) FLR NS
    ecap 0002[100] = VC 1 max VC1
    ecap 0005[130] = Root Complex Link Declaration 1

pcib3@pci0:0:28:0:	class=0x060400 card=0x50011458 chip=0x1c108086 rev=0xb5 hdr=0x01
    vendor     = 'Intel Corporation'
    device     = '6 Series/C200 Series Chipset Family PCI Express Root Port 1'
    class      = bridge
    subclass   = PCI-PCI
    cap 10[40] = PCI-Express 2 root port max data 128(128)
                 link x0(x1) speed 0.0(5.0)
                 slot 0 power limit 100 mW
    cap 05[80] = MSI supports 1 message 
    cap 0d[90] = PCI Bridge card=0x50011458
    cap 01[a0] = powerspec 2  supports D0 D3  current D0

pcib4@pci0:0:28:6:	class=0x060400 card=0x50011458 chip=0x1c1c8086 rev=0xb5 hdr=0x01
    vendor     = 'Intel Corporation'
    device     = '6 Series/C200 Series Chipset Family PCI Express Root Port 7'
    class      = bridge
    subclass   = PCI-PCI
    cap 10[40] = PCI-Express 2 root port max data 128(128)
                 link x1(x1) speed 2.5(5.0)
                 slot 6 power limit 100 mW
    cap 05[80] = MSI supports 1 message 
    cap 0d[90] = PCI Bridge card=0x50011458
    cap 01[a0] = powerspec 2  supports D0 D3  current D0

pcib5@pci0:0:28:7:	class=0x060400 card=0x50011458 chip=0x1c1e8086 rev=0xb5 hdr=0x01
    vendor     = 'Intel Corporation'
    device     = '6 Series/C200 Series Chipset Family PCI Express Root Port 8'
    class      = bridge
    subclass   = PCI-PCI
    cap 10[40] = PCI-Express 2 root port max data 128(128)
                 link x1(x1) speed 5.0(5.0)
                 slot 7 power limit 100 mW
    cap 05[80] = MSI supports 1 message 
    cap 0d[90] = PCI Bridge card=0x50011458
    cap 01[a0] = powerspec 2  supports D0 D3  current D0

ehci1@pci0:0:29:0:	class=0x0c0320 card=0x50061458 chip=0x1c268086 rev=0x05 hdr=0x00
    vendor     = 'Intel Corporation'
    device     = '6 Series/C200 Series Chipset Family USB Enhanced Host Controller'
    class      = serial bus
    subclass   = USB
    bar   [10] = type Memory, range 32, base 0xf7307000, size 1024, enabled
    cap 01[50] = powerspec 2  supports D0 D3  current D0
    cap 0a[58] = EHCI Debug Port at offset 0xa0 in map 0x14
    cap 13[98] = PCI Advanced Features: FLR TP

isab0@pci0:0:31:0:	class=0x060100 card=0x50011458 chip=0x1c448086 rev=0x05 hdr=0x00
    vendor     = 'Intel Corporation'
    device     = 'Z68 Express Chipset LPC Controller'
    class      = bridge
    subclass   = PCI-ISA
    cap 09[e0] = vendor (length 12) Intel cap 1 version 0
		 features: AMT, 4 PCI-e x1 slots

ahci0@pci0:0:31:2:	class=0x010601 card=0xb0051458 chip=0x1c028086 rev=0x05 hdr=0x00
    vendor     = 'Intel Corporation'
    device     = '6 Series/C200 Series Chipset Family 6 port Desktop SATA AHCI Controller'
    class      = mass storage
    subclass   = SATA
    bar   [10] = type I/O Port, range 32, base 0xf070, size 8, enabled
    bar   [14] = type I/O Port, range 32, base 0xf060, size 4, enabled
    bar   [18] = type I/O Port, range 32, base 0xf050, size 8, enabled
    bar   [1c] = type I/O Port, range 32, base 0xf040, size 4, enabled
    bar   [20] = type I/O Port, range 32, base 0xf020, size 32, enabled
    bar   [24] = type Memory, range 32, base 0xf7306000, size 2048, enabled
    cap 05[80] = MSI supports 1 message enabled with 1 message
    cap 01[70] = powerspec 3  supports D0 D3  current D0
    cap 12[a8] = SATA Index-Data Pair
    cap 13[b0] = PCI Advanced Features: FLR TP

none1@pci0:0:31:3:	class=0x0c0500 card=0x50011458 chip=0x1c228086 rev=0x05 hdr=0x00
    vendor     = 'Intel Corporation'
    device     = '6 Series/C200 Series Chipset Family SMBus Controller'
    class      = serial bus
    subclass   = SMBus
    bar   [10] = type Memory, range 64, base 0xf7305000, size 256, enabled
    bar   [20] = type I/O Port, range 32, base 0xf000, size 32, enabled

vgapci0@pci0:1:0:0:	class=0x030000 card=0x32011462 chip=0x140110de rev=0xa1 hdr=0x00
    vendor     = 'NVIDIA Corporation'
    device     = 'GM206 [GeForce GTX 960]'
    class      = display
    subclass   = VGA
    bar   [10] = type Memory, range 32, base 0xf6000000, size 16777216, enabled
    bar   [14] = type Prefetchable Memory, range 64, base 0xe0000000, size 268435456, enabled
    bar   [1c] = type Prefetchable Memory, range 64, base 0xf0000000, size 33554432, enabled
    bar   [24] = type I/O Port, range 32, base 0xe000, size 128, enabled
    cap 01[60] = powerspec 3  supports D0 D3  current D0
    cap 05[68] = MSI supports 1 message, 64 bit enabled with 1 message
    cap 10[78] = PCI-Express 2 legacy endpoint max data 128(256) RO NS
                 link x8(x16) speed 5.0(5.0)
    ecap 0002[100] = VC 1 max VC0
    ecap 001e[258] = unknown 1
    ecap 0004[128] = Power Budgeting 1
    ecap 0001[420] = AER 2 0 fatal 0 non-fatal 0 corrected
    ecap 000b[600] = Vendor 1 ID 1

hdac0@pci0:1:0:1:	class=0x040300 card=0x32011462 chip=0x0fba10de rev=0xa1 hdr=0x00
    vendor     = 'NVIDIA Corporation'
    device     = 'GM206 High Definition Audio Controller'
    class      = multimedia
    subclass   = HDA
    bar   [10] = type Memory, range 32, base 0xf7080000, size 16384, enabled
    cap 01[60] = powerspec 3  supports D0 D3  current D0
    cap 05[68] = MSI supports 1 message, 64 bit enabled with 1 message
    cap 10[78] = PCI-Express 2 endpoint max data 128(256) NS
                 link x8(x16) speed 5.0(5.0)

em0@pci0:2:0:0:	class=0x020000 card=0xa01f8086 chip=0x10d38086 rev=0x00 hdr=0x00
    vendor     = 'Intel Corporation'
    device     = '82574L Gigabit Network Connection'
    class      = network
    subclass   = ethernet
    bar   [10] = type Memory, range 32, base 0xf72c0000, size 131072, enabled
    bar   [14] = type Memory, range 32, base 0xf7200000, size 524288, enabled
    bar   [18] = type I/O Port, range 32, base 0xd000, size 32, enabled
    bar   [1c] = type Memory, range 32, base 0xf72e0000, size 16384, enabled
    cap 01[c8] = powerspec 2  supports D0 D3  current D0
    cap 05[d0] = MSI supports 1 message, 64 bit 
    cap 10[e0] = PCI-Express 1 endpoint max data 128(256) NS
                 link x1(x1) speed 2.5(2.5) ASPM disabled(L0s/L1)
    cap 11[a0] = MSI-X supports 5 messages, enabled
                 Table in map 0x1c[0x0], PBA in map 0x1c[0x2000]
    ecap 0001[100] = AER 1 0 fatal 0 non-fatal 1 corrected
    ecap 0003[140] = Serial 1 001b21ffff61b001

xhci0@pci0:5:0:0:	class=0x0c0330 card=0x50071458 chip=0x70231b6f rev=0x01 hdr=0x00
    vendor     = 'Etron Technology, Inc.'
    device     = 'EJ168 USB 3.0 Host Controller'
    class      = serial bus
    subclass   = USB
    bar   [10] = type Memory, range 64, base 0xf7100000, size 32768, enabled
    cap 01[50] = powerspec 3  supports D0 D1 D2 D3  current D0
    cap 05[70] = MSI supports 4 messages, 64 bit, vector masks enabled with 1 message
    cap 10[a0] = PCI-Express 2 endpoint max data 128(1024) FLR NS
                 link x1(x1) speed 5.0(5.0) ASPM disabled(L0s/L1)
    ecap 0001[100] = AER 1 0 fatal 0 non-fatal 0 corrected
    ecap 0003[190] = Serial 1 0101010101010101
