hostb0@pci0:0:0:0:	class=0x060000 rev=0x04 hdr=0x00 vendor=0x8086 device=0x2020 subvendor=0x8086 subdevice=0x0000
    vendor     = 'Intel Corporation'
    device     = 'Sky Lake-E DMI3 Registers'
    class      = bridge
    subclass   = HOST-PCI
    cap 10[90] = PCI-Express 2 root port max data 128(256)
                 max read 128
                 link x0(x4) speed 0.0(8.0)
    cap 01[e0] = powerspec 3  supports D0 D3  current D0
    ecap 000b[100] = Vendor [1] ID 0002 Rev 0 Length 12
    ecap 000b[144] = Vendor [1] ID 0004 Rev 1 Length 60
    ecap 000b[1d0] = Vendor [1] ID 0003 Rev 1 Length 10
    ecap 0019[250] = PCIe Sec 1 lane errors 0xf
    ecap 000b[280] = Vendor [1] ID 0005 Rev 3 Length 24
    ecap 000b[298] = Vendor [1] ID 0007 Rev 0 Length 36
    ecap 000b[300] = Vendor [1] ID 0008 Rev 0 Length 56

none0@pci0:0:5:0:	class=0x088000 rev=0x04 hdr=0x00 vendor=0x8086 device=0x2024 subvendor=0x8086 subdevice=0x0000
    vendor     = 'Intel Corporation'
    device     = 'Sky Lake-E MM/Vt-d Configuration Registers'
    class      = base peripheral
    cap 10[40] = PCI-Express 2 root endpoint max data 128(128)
                 max read 128

none1@pci0:0:5:2:	class=0x088000 rev=0x04 hdr=0x00 vendor=0x8086 device=0x2025 subvendor=0x0000 subdevice=0x0000
    vendor     = 'Intel Corporation'
    device     = 'Sky Lake-E RAS'
    class      = base peripheral
    cap 10[40] = PCI-Express 2 root endpoint max data 128(128)
                 max read 128

ioapic0@pci0:0:5:4:	class=0x080020 rev=0x04 hdr=0x00 vendor=0x8086 device=0x2026 subvendor=0x8086 subdevice=0x2026
    vendor     = 'Intel Corporation'
    device     = 'Sky Lake-E IOAPIC'
    class      = base peripheral
    subclass   = interrupt controller
    bar   [10] = type Memory, range 32, base 0x93020000, size 4096, enabled
    cap 10[44] = PCI-Express 1 root endpoint max data 128(128)
                 max read 128
    cap 01[e0] = powerspec 3  supports D0 D3  current D0

none2@pci0:0:8:0:	class=0x088000 rev=0x04 hdr=0x00 vendor=0x8086 device=0x2014 subvendor=0x8086 subdevice=0x0000
    vendor     = 'Intel Corporation'
    device     = 'Sky Lake-E Ubox Registers'
    class      = base peripheral
    cap 10[40] = PCI-Express 2 root endpoint max data 128(128)
                 max read 128

none3@pci0:0:8:1:	class=0x110100 rev=0x04 hdr=0x00 vendor=0x8086 device=0x2015 subvendor=0x8086 subdevice=0x0000
    vendor     = 'Intel Corporation'
    device     = 'Sky Lake-E Ubox Registers'
    class      = dasp
    subclass   = performance counters

none4@pci0:0:8:2:	class=0x088000 rev=0x04 hdr=0x00 vendor=0x8086 device=0x2016 subvendor=0x8086 subdevice=0x0000
    vendor     = 'Intel Corporation'
    device     = 'Sky Lake-E Ubox Registers'
    class      = base peripheral
    cap 10[40] = PCI-Express 2 root endpoint max data 128(128)
                 max read 128

none5@pci0:0:17:0:	class=0xff0000 rev=0x09 hdr=0x00 vendor=0x8086 device=0xa1ec subvendor=0x1028 subdevice=0x07c9
    vendor     = 'Intel Corporation'
    device     = 'C620 Series Chipset Family MROM 0'
    cap 01[80] = powerspec 3  supports D0 D3  current D0

ahci0@pci0:0:17:5:	class=0x010601 rev=0x09 hdr=0x00 vendor=0x8086 device=0xa1d2 subvendor=0x1028 subdevice=0x07c9
    vendor     = 'Intel Corporation'
    device     = 'C620 Series Chipset Family SSATA Controller [AHCI mode]'
    class      = mass storage
    subclass   = SATA
    bar   [10] = type Memory, range 32, base 0x93016000, size 8192, enabled
    bar   [14] = type Memory, range 32, base 0x9301f000, size 256, enabled
    bar   [18] = type I/O Port, range 32, base 0x2068, size 8, enabled
    bar   [1c] = type I/O Port, range 32, base 0x2074, size 4, enabled
    bar   [20] = type I/O Port, range 32, base 0x2040, size 32, enabled
    bar   [24] = type Memory, range 32, base 0x92f80000, size 524288, enabled
    cap 05[80] = MSI supports 1 message enabled with 1 message
    cap 01[70] = powerspec 3  supports D0 D3  current D0
    cap 12[a8] = SATA Index-Data Pair

xhci0@pci0:0:20:0:	class=0x0c0330 rev=0x09 hdr=0x00 vendor=0x8086 device=0xa1af subvendor=0x1028 subdevice=0x07c9
    vendor     = 'Intel Corporation'
    device     = 'C620 Series Chipset Family USB 3.0 xHCI Controller'
    class      = serial bus
    subclass   = USB
    bar   [10] = type Memory, range 64, base 0x93000000, size 65536, enabled
    cap 01[70] = powerspec 2  supports D0 D3  current D0
    cap 05[80] = MSI supports 8 messages, 64 bit enabled with 1 message

pchtherm0@pci0:0:20:2:	class=0x118000 rev=0x09 hdr=0x00 vendor=0x8086 device=0xa1b1 subvendor=0x1028 subdevice=0x07c9
    vendor     = 'Intel Corporation'
    device     = 'C620 Series Chipset Family Thermal Subsystem'
    class      = dasp
    bar   [10] = type Memory, range 64, base 0x9301c000, size 4096, enabled
    cap 01[50] = powerspec 3  supports D0 D3  current D0
    cap 05[80] = MSI supports 1 message 

none6@pci0:0:22:0:	class=0x078000 rev=0x09 hdr=0x00 vendor=0x8086 device=0xa1ba subvendor=0x1028 subdevice=0x07c9
    vendor     = 'Intel Corporation'
    device     = 'C620 Series Chipset Family MEI Controller'
    class      = simple comms
    bar   [10] = type Memory, range 64, base 0x9301b000, size 4096, enabled
    cap 01[50] = powerspec 3  supports D0 D3  current D0
    cap 05[8c] = MSI supports 1 message, 64 bit 

none7@pci0:0:22:1:	class=0x078000 rev=0x09 hdr=0x00 vendor=0x8086 device=0xa1bb subvendor=0x1028 subdevice=0x07c9
    vendor     = 'Intel Corporation'
    device     = 'C620 Series Chipset Family MEI Controller'
    class      = simple comms
    bar   [10] = type Memory, range 64, base 0x9301a000, size 4096, enabled
    cap 01[50] = powerspec 3  supports D0 D3  current D0
    cap 05[8c] = MSI supports 1 message, 64 bit 

none8@pci0:0:22:4:	class=0x078000 rev=0x09 hdr=0x00 vendor=0x8086 device=0xa1be subvendor=0x1028 subdevice=0x07c9
    vendor     = 'Intel Corporation'
    device     = 'C620 Series Chipset Family MEI Controller'
    class      = simple comms
    bar   [10] = type Memory, range 64, base 0x93019000, size 4096, enabled
    cap 01[50] = powerspec 3  supports D0 D3  current D0
    cap 05[8c] = MSI supports 1 message, 64 bit 

ahci1@pci0:0:23:0:	class=0x010601 rev=0x09 hdr=0x00 vendor=0x8086 device=0xa182 subvendor=0x1028 subdevice=0x07c9
    vendor     = 'Intel Corporation'
    device     = 'C620 Series Chipset Family SATA Controller [AHCI mode]'
    class      = mass storage
    subclass   = SATA
    bar   [10] = type Memory, range 32, base 0x93014000, size 8192, enabled
    bar   [14] = type Memory, range 32, base 0x9301e000, size 256, enabled
    bar   [18] = type I/O Port, range 32, base 0x2060, size 8, enabled
    bar   [1c] = type I/O Port, range 32, base 0x2070, size 4, enabled
    bar   [20] = type I/O Port, range 32, base 0x2020, size 32, enabled
    bar   [24] = type Memory, range 32, base 0x92f00000, size 524288, enabled
    cap 05[80] = MSI supports 1 message enabled with 1 message
    cap 01[70] = powerspec 3  supports D0 D3  current D0
    cap 12[a8] = SATA Index-Data Pair

pcib1@pci0:0:28:0:	class=0x060400 rev=0xf9 hdr=0x01 vendor=0x8086 device=0xa190 subvendor=0x1028 subdevice=0x07c9
    vendor     = 'Intel Corporation'
    device     = 'C620 Series Chipset Family PCI Express Root Port'
    class      = bridge
    subclass   = PCI-PCI
    cap 10[40] = PCI-Express 2 root port max data 128(256) ARI disabled
                 max read 128
                 link x0(x4) speed 0.0(8.0) ASPM disabled(L0s/L1)
                 slot 0 power limit 0 mW HotPlug(empty) surprise
    cap 05[80] = MSI supports 1 message enabled with 1 message
    cap 0d[90] = PCI Bridge subvendor=0x1028 subdevice=0x07c9
    cap 01[a0] = powerspec 3  supports D0 D3  current D0

pcib2@pci0:0:28:4:	class=0x060400 rev=0xf9 hdr=0x01 vendor=0x8086 device=0xa194 subvendor=0x1028 subdevice=0x07c9
    vendor     = 'Intel Corporation'
    device     = 'C620 Series Chipset Family PCI Express Root Port'
    class      = bridge
    subclass   = PCI-PCI
    cap 10[40] = PCI-Express 2 root port max data 128(128) ARI disabled
                 max read 128
                 link x1(x1) speed 5.0(5.0) ASPM disabled(L1)
                 slot 0 power limit 100 mW
    cap 05[80] = MSI supports 1 message 
    cap 0d[90] = PCI Bridge subvendor=0x1028 subdevice=0x07c9
    cap 01[a0] = powerspec 3  supports D0 D3  current D0
    ecap 0001[100] = AER 1 0 fatal 0 non-fatal 0 corrected
    ecap 000d[140] = ACS 1

pcib4@pci0:0:28:5:	class=0x060400 rev=0xf9 hdr=0x01 vendor=0x8086 device=0xa195 subvendor=0x1028 subdevice=0x07c9
    vendor     = 'Intel Corporation'
    device     = 'C620 Series Chipset Family PCI Express Root Port'
    class      = bridge
    subclass   = PCI-PCI
    cap 10[40] = PCI-Express 2 root port max data 128(128) ARI disabled
                 max read 128
                 link x1(x1) speed 5.0(8.0) ASPM disabled(L1)
    cap 05[80] = MSI supports 1 message 
    cap 0d[90] = PCI Bridge subvendor=0x1028 subdevice=0x07c9
    cap 01[a0] = powerspec 3  supports D0 D3  current D0
    ecap 0001[100] = AER 1 0 fatal 0 non-fatal 0 corrected
    ecap 000d[140] = ACS 1
    ecap 0019[220] = PCIe Sec 1 lane errors 0

isab0@pci0:0:31:0:	class=0x060100 rev=0x09 hdr=0x00 vendor=0x8086 device=0xa1c1 subvendor=0x1028 subdevice=0x07c9
    vendor     = 'Intel Corporation'
    device     = 'C621 Series Chipset LPC/eSPI Controller'
    class      = bridge
    subclass   = PCI-ISA

none9@pci0:0:31:2:	class=0x058000 rev=0x09 hdr=0x00 vendor=0x8086 device=0xa1a1 subvendor=0x1028 subdevice=0x07c9
    vendor     = 'Intel Corporation'
    device     = 'C620 Series Chipset Family Power Management Controller'
    class      = memory
    bar   [10] = type Memory, range 32, base 0x93010000, size 16384, enabled

ichsmb0@pci0:0:31:4:	class=0x0c0500 rev=0x09 hdr=0x00 vendor=0x8086 device=0xa1a3 subvendor=0x1028 subdevice=0x07c9
    vendor     = 'Intel Corporation'
    device     = 'C620 Series Chipset Family SMBus'
    class      = serial bus
    subclass   = SMBus
    bar   [10] = type Memory, range 64, base 0x93018000, size 256, enabled
    bar   [20] = type I/O Port, range 32, base 0x2000, size 32, enabled

none10@pci0:0:31:5:	class=0x0c8000 rev=0x09 hdr=0x00 vendor=0x8086 device=0xa1a4 subvendor=0x1028 subdevice=0x07c9
    vendor     = 'Intel Corporation'
    device     = 'C620 Series Chipset Family SPI Controller'
    class      = serial bus
    bar   [10] = type Memory, range 32, base 0xfe010000, size 4096, enabled

pcib3@pci0:2:0:0:	class=0x060400 rev=0x02 hdr=0x01 vendor=0x1556 device=0xbe00 subvendor=0x0000 subdevice=0x0000
    vendor     = 'PLDA'
    device     = 'PCI Express Bridge'
    class      = bridge
    subclass   = PCI-PCI
    cap 05[50] = MSI supports 1 message, 64 bit 
    cap 01[78] = powerspec 3  supports D0 D3  current D0
    cap 10[80] = PCI-Express 2 PCI bridge max data 128(128) RO NS
                 max read 512
                 link x1(x1) speed 5.0(5.0) ASPM disabled(L0s/L1) ClockPM disabled
    ecap 0002[100] = VC 1 max VC0
    ecap 0001[800] = AER 1 0 fatal 0 non-fatal 1 corrected

vgapci0@pci0:3:0:0:	class=0x030000 rev=0x04 hdr=0x00 vendor=0x102b device=0x0536 subvendor=0x1028 subdevice=0x07c9
    vendor     = 'Matrox Electronics Systems Ltd.'
    device     = 'Integrated Matrox G200eW3 Graphics Controller'
    class      = display
    subclass   = VGA
    bar   [10] = type Prefetchable Memory, range 32, base 0x91000000, size 16777216, enabled
    bar   [14] = type Memory, range 32, base 0x92808000, size 16384, enabled
    bar   [18] = type Memory, range 32, base 0x92000000, size 8388608, enabled
    cap 01[dc] = powerspec 3  supports D0 D3  current D0

bge0@pci0:4:0:0:	class=0x020000 rev=0x00 hdr=0x00 vendor=0x14e4 device=0x165f subvendor=0x1028 subdevice=0x001f
    vendor     = 'Broadcom Inc. and subsidiaries'
    device     = 'NetXtreme BCM5720 Gigabit Ethernet PCIe'
    class      = network
    subclass   = ethernet
    bar   [10] = type Prefetchable Memory, range 64, base 0x92e30000, size 65536, enabled
    bar   [18] = type Prefetchable Memory, range 64, base 0x92e40000, size 65536, enabled
    bar   [20] = type Prefetchable Memory, range 64, base 0x92e50000, size 65536, enabled
    cap 01[48] = powerspec 3  supports D0 D3  current D0
    cap 03[50] = VPD
    cap 05[58] = MSI supports 8 messages, 64 bit enabled with 1 message
    cap 11[a0] = MSI-X supports 17 messages
                 Table in map 0x20[0x0], PBA in map 0x20[0x1000]
    cap 10[ac] = PCI-Express 2 endpoint max data 128(256) FLR
                 max read 2048
                 link x1(x2) speed 5.0(5.0) ClockPM enabled
    ecap 0001[100] = AER 1 0 fatal 0 non-fatal 1 corrected
    ecap 0003[13c] = Serial 1 00002cea7fb50944
    ecap 0004[150] = Power Budgeting 1
    ecap 0002[160] = VC 1 max VC0

bge1@pci0:4:0:1:	class=0x020000 rev=0x00 hdr=0x00 vendor=0x14e4 device=0x165f subvendor=0x1028 subdevice=0x001f
    vendor     = 'Broadcom Inc. and subsidiaries'
    device     = 'NetXtreme BCM5720 Gigabit Ethernet PCIe'
    class      = network
    subclass   = ethernet
    bar   [10] = type Prefetchable Memory, range 64, base 0x92e00000, size 65536, enabled
    bar   [18] = type Prefetchable Memory, range 64, base 0x92e10000, size 65536, enabled
    bar   [20] = type Prefetchable Memory, range 64, base 0x92e20000, size 65536, enabled
    cap 01[48] = powerspec 3  supports D0 D3  current D0
    cap 03[50] = VPD
    cap 05[58] = MSI supports 8 messages, 64 bit enabled with 1 message
    cap 11[a0] = MSI-X supports 17 messages
                 Table in map 0x20[0x0], PBA in map 0x20[0x1000]
    cap 10[ac] = PCI-Express 2 endpoint max data 128(256) FLR
                 max read 2048
                 link x1(x2) speed 5.0(5.0) ClockPM enabled
    ecap 0001[100] = AER 1 0 fatal 0 non-fatal 1 corrected
    ecap 0003[13c] = Serial 1 00002cea7fb50945
    ecap 0004[150] = Power Budgeting 1
    ecap 0002[160] = VC 1 max VC0

pcib6@pci0:23:2:0:	class=0x060400 rev=0x04 hdr=0x01 vendor=0x8086 device=0x2032 subvendor=0x8086 subdevice=0x0000
    vendor     = 'Intel Corporation'
    device     = 'Sky Lake-E PCI Express Root Port C'
    class      = bridge
    subclass   = PCI-PCI
    cap 0d[40] = PCI Bridge subvendor=0x8086 subdevice=0x0000
    cap 05[60] = MSI supports 2 messages, vector masks 
    cap 10[90] = PCI-Express 2 root port max data 256(256) ARI enabled
                 max read 128
                 link x8(x8) speed 8.0(8.0) ASPM disabled(L1)
                 slot 0 power limit 25000 mW
    cap 01[e0] = powerspec 3  supports D0 D3  current D0
    ecap 000b[100] = Vendor [1] ID 0002 Rev 0 Length 12
    ecap 000d[110] = ACS 1
    ecap 0001[148] = AER 1 0 fatal 0 non-fatal 0 corrected
    ecap 000b[1d0] = Vendor [1] ID 0003 Rev 1 Length 10
    ecap 0019[250] = PCIe Sec 1 lane errors 0
    ecap 000b[280] = Vendor [1] ID 0005 Rev 3 Length 24
    ecap 000b[298] = Vendor [1] ID 0007 Rev 0 Length 36
    ecap 000b[300] = Vendor [1] ID 0008 Rev 0 Length 56

none11@pci0:23:5:0:	class=0x088000 rev=0x04 hdr=0x00 vendor=0x8086 device=0x2034 subvendor=0x8086 subdevice=0x0000
    vendor     = 'Intel Corporation'
    device     = 'Sky Lake-E VT-d'
    class      = base peripheral
    cap 10[40] = PCI-Express 2 root endpoint max data 128(128)
                 max read 128

none12@pci0:23:5:2:	class=0x088000 rev=0x04 hdr=0x00 vendor=0x8086 device=0x2035 subvendor=0x0000 subdevice=0x0000
    vendor     = 'Intel Corporation'
    device     = 'Sky Lake-E RAS Configuration Registers'
    class      = base peripheral
    cap 10[40] = PCI-Express 2 root endpoint max data 128(128)
                 max read 128

ioapic1@pci0:23:5:4:	class=0x080020 rev=0x04 hdr=0x00 vendor=0x8086 device=0x2036 subvendor=0x8086 subdevice=0x2036
    vendor     = 'Intel Corporation'
    device     = 'Sky Lake-E IOxAPIC Configuration Registers'
    class      = base peripheral
    subclass   = interrupt controller
    bar   [10] = type Memory, range 32, base 0x9da00000, size 4096, enabled
    cap 10[44] = PCI-Express 1 root endpoint max data 128(128)
                 max read 128
    cap 01[e0] = powerspec 3  supports D0 D3  current D0

none13@pci0:23:8:0:	class=0x088000 rev=0x04 hdr=0x00 vendor=0x8086 device=0x208d subvendor=0x8086 subdevice=0x0000
    vendor     = 'Intel Corporation'
    device     = 'Sky Lake-E CHA Registers'
    class      = base peripheral

none14@pci0:23:8:1:	class=0x088000 rev=0x04 hdr=0x00 vendor=0x8086 device=0x208d subvendor=0x8086 subdevice=0x0000
    vendor     = 'Intel Corporation'
    device     = 'Sky Lake-E CHA Registers'
    class      = base peripheral

none15@pci0:23:8:2:	class=0x088000 rev=0x04 hdr=0x00 vendor=0x8086 device=0x208d subvendor=0x8086 subdevice=0x0000
    vendor     = 'Intel Corporation'
    device     = 'Sky Lake-E CHA Registers'
    class      = base peripheral

none16@pci0:23:8:3:	class=0x088000 rev=0x04 hdr=0x00 vendor=0x8086 device=0x208d subvendor=0x8086 subdevice=0x0000
    vendor     = 'Intel Corporation'
    device     = 'Sky Lake-E CHA Registers'
    class      = base peripheral

none17@pci0:23:8:4:	class=0x088000 rev=0x04 hdr=0x00 vendor=0x8086 device=0x208d subvendor=0x8086 subdevice=0x0000
    vendor     = 'Intel Corporation'
    device     = 'Sky Lake-E CHA Registers'
    class      = base peripheral

none18@pci0:23:8:5:	class=0x088000 rev=0x04 hdr=0x00 vendor=0x8086 device=0x208d subvendor=0x8086 subdevice=0x0000
    vendor     = 'Intel Corporation'
    device     = 'Sky Lake-E CHA Registers'
    class      = base peripheral

none19@pci0:23:8:6:	class=0x088000 rev=0x04 hdr=0x00 vendor=0x8086 device=0x208d subvendor=0x8086 subdevice=0x0000
    vendor     = 'Intel Corporation'
    device     = 'Sky Lake-E CHA Registers'
    class      = base peripheral

none20@pci0:23:8:7:	class=0x088000 rev=0x04 hdr=0x00 vendor=0x8086 device=0x208d subvendor=0x8086 subdevice=0x0000
    vendor     = 'Intel Corporation'
    device     = 'Sky Lake-E CHA Registers'
    class      = base peripheral

none21@pci0:23:9:0:	class=0x088000 rev=0x04 hdr=0x00 vendor=0x8086 device=0x208d subvendor=0x8086 subdevice=0x0000
    vendor     = 'Intel Corporation'
    device     = 'Sky Lake-E CHA Registers'
    class      = base peripheral

none22@pci0:23:9:1:	class=0x088000 rev=0x04 hdr=0x00 vendor=0x8086 device=0x208d subvendor=0x8086 subdevice=0x0000
    vendor     = 'Intel Corporation'
    device     = 'Sky Lake-E CHA Registers'
    class      = base peripheral

none23@pci0:23:9:2:	class=0x088000 rev=0x04 hdr=0x00 vendor=0x8086 device=0x208d subvendor=0x8086 subdevice=0x0000
    vendor     = 'Intel Corporation'
    device     = 'Sky Lake-E CHA Registers'
    class      = base peripheral

none24@pci0:23:9:3:	class=0x088000 rev=0x04 hdr=0x00 vendor=0x8086 device=0x208d subvendor=0x8086 subdevice=0x0000
    vendor     = 'Intel Corporation'
    device     = 'Sky Lake-E CHA Registers'
    class      = base peripheral

none25@pci0:23:9:4:	class=0x088000 rev=0x04 hdr=0x00 vendor=0x8086 device=0x208d subvendor=0x8086 subdevice=0x0000
    vendor     = 'Intel Corporation'
    device     = 'Sky Lake-E CHA Registers'
    class      = base peripheral

none26@pci0:23:9:5:	class=0x088000 rev=0x04 hdr=0x00 vendor=0x8086 device=0x208d subvendor=0x8086 subdevice=0x0000
    vendor     = 'Intel Corporation'
    device     = 'Sky Lake-E CHA Registers'
    class      = base peripheral

none27@pci0:23:9:6:	class=0x088000 rev=0x04 hdr=0x00 vendor=0x8086 device=0x208d subvendor=0x8086 subdevice=0x0000
    vendor     = 'Intel Corporation'
    device     = 'Sky Lake-E CHA Registers'
    class      = base peripheral

none28@pci0:23:9:7:	class=0x088000 rev=0x04 hdr=0x00 vendor=0x8086 device=0x208d subvendor=0x8086 subdevice=0x0000
    vendor     = 'Intel Corporation'
    device     = 'Sky Lake-E CHA Registers'
    class      = base peripheral

none29@pci0:23:10:0:	class=0x088000 rev=0x04 hdr=0x00 vendor=0x8086 device=0x208d subvendor=0x8086 subdevice=0x0000
    vendor     = 'Intel Corporation'
    device     = 'Sky Lake-E CHA Registers'
    class      = base peripheral

none30@pci0:23:10:1:	class=0x088000 rev=0x04 hdr=0x00 vendor=0x8086 device=0x208d subvendor=0x8086 subdevice=0x0000
    vendor     = 'Intel Corporation'
    device     = 'Sky Lake-E CHA Registers'
    class      = base peripheral

none31@pci0:23:10:2:	class=0x088000 rev=0x04 hdr=0x00 vendor=0x8086 device=0x208d subvendor=0x8086 subdevice=0x0000
    vendor     = 'Intel Corporation'
    device     = 'Sky Lake-E CHA Registers'
    class      = base peripheral

none32@pci0:23:10:3:	class=0x088000 rev=0x04 hdr=0x00 vendor=0x8086 device=0x208d subvendor=0x8086 subdevice=0x0000
    vendor     = 'Intel Corporation'
    device     = 'Sky Lake-E CHA Registers'
    class      = base peripheral

none33@pci0:23:10:4:	class=0x088000 rev=0x04 hdr=0x00 vendor=0x8086 device=0x208d subvendor=0x8086 subdevice=0x0000
    vendor     = 'Intel Corporation'
    device     = 'Sky Lake-E CHA Registers'
    class      = base peripheral

none34@pci0:23:10:5:	class=0x088000 rev=0x04 hdr=0x00 vendor=0x8086 device=0x208d subvendor=0x8086 subdevice=0x0000
    vendor     = 'Intel Corporation'
    device     = 'Sky Lake-E CHA Registers'
    class      = base peripheral

none35@pci0:23:10:6:	class=0x088000 rev=0x04 hdr=0x00 vendor=0x8086 device=0x208d subvendor=0x8086 subdevice=0x0000
    vendor     = 'Intel Corporation'
    device     = 'Sky Lake-E CHA Registers'
    class      = base peripheral

none36@pci0:23:10:7:	class=0x088000 rev=0x04 hdr=0x00 vendor=0x8086 device=0x208d subvendor=0x8086 subdevice=0x0000
    vendor     = 'Intel Corporation'
    device     = 'Sky Lake-E CHA Registers'
    class      = base peripheral

none37@pci0:23:11:0:	class=0x088000 rev=0x04 hdr=0x00 vendor=0x8086 device=0x208d subvendor=0x8086 subdevice=0x0000
    vendor     = 'Intel Corporation'
    device     = 'Sky Lake-E CHA Registers'
    class      = base peripheral

none38@pci0:23:11:1:	class=0x088000 rev=0x04 hdr=0x00 vendor=0x8086 device=0x208d subvendor=0x8086 subdevice=0x0000
    vendor     = 'Intel Corporation'
    device     = 'Sky Lake-E CHA Registers'
    class      = base peripheral

none39@pci0:23:11:2:	class=0x088000 rev=0x04 hdr=0x00 vendor=0x8086 device=0x208d subvendor=0x8086 subdevice=0x0000
    vendor     = 'Intel Corporation'
    device     = 'Sky Lake-E CHA Registers'
    class      = base peripheral

none40@pci0:23:11:3:	class=0x088000 rev=0x04 hdr=0x00 vendor=0x8086 device=0x208d subvendor=0x8086 subdevice=0x0000
    vendor     = 'Intel Corporation'
    device     = 'Sky Lake-E CHA Registers'
    class      = base peripheral

none41@pci0:23:14:0:	class=0x088000 rev=0x04 hdr=0x00 vendor=0x8086 device=0x208e subvendor=0x8086 subdevice=0x0000
    vendor     = 'Intel Corporation'
    device     = 'Sky Lake-E CHA Registers'
    class      = base peripheral

none42@pci0:23:14:1:	class=0x088000 rev=0x04 hdr=0x00 vendor=0x8086 device=0x208e subvendor=0x8086 subdevice=0x0000
    vendor     = 'Intel Corporation'
    device     = 'Sky Lake-E CHA Registers'
    class      = base peripheral

none43@pci0:23:14:2:	class=0x088000 rev=0x04 hdr=0x00 vendor=0x8086 device=0x208e subvendor=0x8086 subdevice=0x0000
    vendor     = 'Intel Corporation'
    device     = 'Sky Lake-E CHA Registers'
    class      = base peripheral

none44@pci0:23:14:3:	class=0x088000 rev=0x04 hdr=0x00 vendor=0x8086 device=0x208e subvendor=0x8086 subdevice=0x0000
    vendor     = 'Intel Corporation'
    device     = 'Sky Lake-E CHA Registers'
    class      = base peripheral

none45@pci0:23:14:4:	class=0x088000 rev=0x04 hdr=0x00 vendor=0x8086 device=0x208e subvendor=0x8086 subdevice=0x0000
    vendor     = 'Intel Corporation'
    device     = 'Sky Lake-E CHA Registers'
    class      = base peripheral

none46@pci0:23:14:5:	class=0x088000 rev=0x04 hdr=0x00 vendor=0x8086 device=0x208e subvendor=0x8086 subdevice=0x0000
    vendor     = 'Intel Corporation'
    device     = 'Sky Lake-E CHA Registers'
    class      = base peripheral

none47@pci0:23:14:6:	class=0x088000 rev=0x04 hdr=0x00 vendor=0x8086 device=0x208e subvendor=0x8086 subdevice=0x0000
    vendor     = 'Intel Corporation'
    device     = 'Sky Lake-E CHA Registers'
    class      = base peripheral

none48@pci0:23:14:7:	class=0x088000 rev=0x04 hdr=0x00 vendor=0x8086 device=0x208e subvendor=0x8086 subdevice=0x0000
    vendor     = 'Intel Corporation'
    device     = 'Sky Lake-E CHA Registers'
    class      = base peripheral

none49@pci0:23:15:0:	class=0x088000 rev=0x04 hdr=0x00 vendor=0x8086 device=0x208e subvendor=0x8086 subdevice=0x0000
    vendor     = 'Intel Corporation'
    device     = 'Sky Lake-E CHA Registers'
    class      = base peripheral

none50@pci0:23:15:1:	class=0x088000 rev=0x04 hdr=0x00 vendor=0x8086 device=0x208e subvendor=0x8086 subdevice=0x0000
    vendor     = 'Intel Corporation'
    device     = 'Sky Lake-E CHA Registers'
    class      = base peripheral

none51@pci0:23:15:2:	class=0x088000 rev=0x04 hdr=0x00 vendor=0x8086 device=0x208e subvendor=0x8086 subdevice=0x0000
    vendor     = 'Intel Corporation'
    device     = 'Sky Lake-E CHA Registers'
    class      = base peripheral

none52@pci0:23:15:3:	class=0x088000 rev=0x04 hdr=0x00 vendor=0x8086 device=0x208e subvendor=0x8086 subdevice=0x0000
    vendor     = 'Intel Corporation'
    device     = 'Sky Lake-E CHA Registers'
    class      = base peripheral

none53@pci0:23:15:4:	class=0x088000 rev=0x04 hdr=0x00 vendor=0x8086 device=0x208e subvendor=0x8086 subdevice=0x0000
    vendor     = 'Intel Corporation'
    device     = 'Sky Lake-E CHA Registers'
    class      = base peripheral

none54@pci0:23:15:5:	class=0x088000 rev=0x04 hdr=0x00 vendor=0x8086 device=0x208e subvendor=0x8086 subdevice=0x0000
    vendor     = 'Intel Corporation'
    device     = 'Sky Lake-E CHA Registers'
    class      = base peripheral

none55@pci0:23:15:6:	class=0x088000 rev=0x04 hdr=0x00 vendor=0x8086 device=0x208e subvendor=0x8086 subdevice=0x0000
    vendor     = 'Intel Corporation'
    device     = 'Sky Lake-E CHA Registers'
    class      = base peripheral

none56@pci0:23:15:7:	class=0x088000 rev=0x04 hdr=0x00 vendor=0x8086 device=0x208e subvendor=0x8086 subdevice=0x0000
    vendor     = 'Intel Corporation'
    device     = 'Sky Lake-E CHA Registers'
    class      = base peripheral

none57@pci0:23:16:0:	class=0x088000 rev=0x04 hdr=0x00 vendor=0x8086 device=0x208e subvendor=0x8086 subdevice=0x0000
    vendor     = 'Intel Corporation'
    device     = 'Sky Lake-E CHA Registers'
    class      = base peripheral

none58@pci0:23:16:1:	class=0x088000 rev=0x04 hdr=0x00 vendor=0x8086 device=0x208e subvendor=0x8086 subdevice=0x0000
    vendor     = 'Intel Corporation'
    device     = 'Sky Lake-E CHA Registers'
    class      = base peripheral

none59@pci0:23:16:2:	class=0x088000 rev=0x04 hdr=0x00 vendor=0x8086 device=0x208e subvendor=0x8086 subdevice=0x0000
    vendor     = 'Intel Corporation'
    device     = 'Sky Lake-E CHA Registers'
    class      = base peripheral

none60@pci0:23:16:3:	class=0x088000 rev=0x04 hdr=0x00 vendor=0x8086 device=0x208e subvendor=0x8086 subdevice=0x0000
    vendor     = 'Intel Corporation'
    device     = 'Sky Lake-E CHA Registers'
    class      = base peripheral

none61@pci0:23:16:4:	class=0x088000 rev=0x04 hdr=0x00 vendor=0x8086 device=0x208e subvendor=0x8086 subdevice=0x0000
    vendor     = 'Intel Corporation'
    device     = 'Sky Lake-E CHA Registers'
    class      = base peripheral

none62@pci0:23:16:5:	class=0x088000 rev=0x04 hdr=0x00 vendor=0x8086 device=0x208e subvendor=0x8086 subdevice=0x0000
    vendor     = 'Intel Corporation'
    device     = 'Sky Lake-E CHA Registers'
    class      = base peripheral

none63@pci0:23:16:6:	class=0x088000 rev=0x04 hdr=0x00 vendor=0x8086 device=0x208e subvendor=0x8086 subdevice=0x0000
    vendor     = 'Intel Corporation'
    device     = 'Sky Lake-E CHA Registers'
    class      = base peripheral

none64@pci0:23:16:7:	class=0x088000 rev=0x04 hdr=0x00 vendor=0x8086 device=0x208e subvendor=0x8086 subdevice=0x0000
    vendor     = 'Intel Corporation'
    device     = 'Sky Lake-E CHA Registers'
    class      = base peripheral

none65@pci0:23:17:0:	class=0x088000 rev=0x04 hdr=0x00 vendor=0x8086 device=0x208e subvendor=0x8086 subdevice=0x0000
    vendor     = 'Intel Corporation'
    device     = 'Sky Lake-E CHA Registers'
    class      = base peripheral

none66@pci0:23:17:1:	class=0x088000 rev=0x04 hdr=0x00 vendor=0x8086 device=0x208e subvendor=0x8086 subdevice=0x0000
    vendor     = 'Intel Corporation'
    device     = 'Sky Lake-E CHA Registers'
    class      = base peripheral

none67@pci0:23:17:2:	class=0x088000 rev=0x04 hdr=0x00 vendor=0x8086 device=0x208e subvendor=0x8086 subdevice=0x0000
    vendor     = 'Intel Corporation'
    device     = 'Sky Lake-E CHA Registers'
    class      = base peripheral

none68@pci0:23:17:3:	class=0x088000 rev=0x04 hdr=0x00 vendor=0x8086 device=0x208e subvendor=0x8086 subdevice=0x0000
    vendor     = 'Intel Corporation'
    device     = 'Sky Lake-E CHA Registers'
    class      = base peripheral

none69@pci0:23:29:0:	class=0x088000 rev=0x04 hdr=0x00 vendor=0x8086 device=0x2054 subvendor=0x8086 subdevice=0x0000
    vendor     = 'Intel Corporation'
    device     = 'Sky Lake-E CHA Registers'
    class      = base peripheral

none70@pci0:23:29:1:	class=0x088000 rev=0x04 hdr=0x00 vendor=0x8086 device=0x2055 subvendor=0x8086 subdevice=0x0000
    vendor     = 'Intel Corporation'
    device     = 'Sky Lake-E CHA Registers'
    class      = base peripheral

none71@pci0:23:29:2:	class=0x088000 rev=0x04 hdr=0x00 vendor=0x8086 device=0x2056 subvendor=0x8086 subdevice=0x0000
    vendor     = 'Intel Corporation'
    device     = 'Sky Lake-E CHA Registers'
    class      = base peripheral

none72@pci0:23:29:3:	class=0x088000 rev=0x04 hdr=0x00 vendor=0x8086 device=0x2057 subvendor=0x8086 subdevice=0x0000
    vendor     = 'Intel Corporation'
    device     = 'Sky Lake-E CHA Registers'
    class      = base peripheral

none73@pci0:23:30:0:	class=0x088000 rev=0x04 hdr=0x00 vendor=0x8086 device=0x2080 subvendor=0x8086 subdevice=0x0000
    vendor     = 'Intel Corporation'
    device     = 'Sky Lake-E PCU Registers'
    class      = base peripheral

none74@pci0:23:30:1:	class=0x088000 rev=0x04 hdr=0x00 vendor=0x8086 device=0x2081 subvendor=0x8086 subdevice=0x0000
    vendor     = 'Intel Corporation'
    device     = 'Sky Lake-E PCU Registers'
    class      = base peripheral

none75@pci0:23:30:2:	class=0x088000 rev=0x04 hdr=0x00 vendor=0x8086 device=0x2082 subvendor=0x8086 subdevice=0x0000
    vendor     = 'Intel Corporation'
    device     = 'Sky Lake-E PCU Registers'
    class      = base peripheral

none76@pci0:23:30:3:	class=0x088000 rev=0x04 hdr=0x00 vendor=0x8086 device=0x2083 subvendor=0x8086 subdevice=0x0000
    vendor     = 'Intel Corporation'
    device     = 'Sky Lake-E PCU Registers'
    class      = base peripheral

none77@pci0:23:30:4:	class=0x088000 rev=0x04 hdr=0x00 vendor=0x8086 device=0x2084 subvendor=0x8086 subdevice=0x0000
    vendor     = 'Intel Corporation'
    device     = 'Sky Lake-E PCU Registers'
    class      = base peripheral

none78@pci0:23:30:5:	class=0x088000 rev=0x04 hdr=0x00 vendor=0x8086 device=0x2085 subvendor=0x8086 subdevice=0x0000
    vendor     = 'Intel Corporation'
    device     = 'Sky Lake-E PCU Registers'
    class      = base peripheral

none79@pci0:23:30:6:	class=0x088000 rev=0x04 hdr=0x00 vendor=0x8086 device=0x2086 subvendor=0x8086 subdevice=0x0000
    vendor     = 'Intel Corporation'
    device     = 'Sky Lake-E PCU Registers'
    class      = base peripheral

mfi0@pci0:24:0:0:	class=0x010400 rev=0x02 hdr=0x00 vendor=0x1000 device=0x005d subvendor=0x1028 subdevice=0x1f47
    vendor     = 'Broadcom / LSI'
    device     = 'MegaRAID SAS-3 3108 [Invader]'
    class      = mass storage
    subclass   = RAID
    bar   [10] = type I/O Port, range 32, base 0x4000, size 256, enabled
    bar   [14] = type Memory, range 64, base 0x9d900000, size 65536, enabled
    bar   [1c] = type Memory, range 64, base 0x9d800000, size 1048576, enabled
    cap 01[50] = powerspec 3  supports D0 D1 D2 D3  current D0
    cap 10[68] = PCI-Express 2 endpoint max data 256(4096) RO NS
                 max read 512
                 link x8(x8) speed 8.0(8.0) ASPM disabled(L0s)
    cap 05[a8] = MSI supports 1 message, 64 bit, vector masks enabled with 1 message
    cap 11[c0] = MSI-X supports 97 messages
                 Table in map 0x14[0xe000], PBA in map 0x14[0xf000]
    ecap 0001[100] = AER 2 0 fatal 0 non-fatal 1 corrected
    ecap 0019[1e0] = PCIe Sec 1 lane errors 0
    ecap 0004[1c0] = Power Budgeting 1
    ecap 000e[148] = ARI 1

pcib8@pci0:58:0:0:	class=0x060400 rev=0x04 hdr=0x01 vendor=0x8086 device=0x2030 subvendor=0x8086 subdevice=0x0000
    vendor     = 'Intel Corporation'
    device     = 'Sky Lake-E PCI Express Root Port A'
    class      = bridge
    subclass   = PCI-PCI
    cap 0d[40] = PCI Bridge subvendor=0x8086 subdevice=0x0000
    cap 05[60] = MSI supports 2 messages, vector masks 
    cap 10[90] = PCI-Express 2 root port max data 256(256) ARI enabled
                 max read 128
                 link x8(x16) speed 8.0(8.0) ASPM disabled(L1)
                 slot 2 power limit 75000 mW
    cap 01[e0] = powerspec 3  supports D0 D3  current D0
    ecap 000b[100] = Vendor [1] ID 0002 Rev 0 Length 12
    ecap 000d[110] = ACS 1
    ecap 0001[148] = AER 1 0 fatal 0 non-fatal 0 corrected
    ecap 000b[1d0] = Vendor [1] ID 0003 Rev 1 Length 10
    ecap 0019[250] = PCIe Sec 1 lane errors 0xff
    ecap 000b[280] = Vendor [1] ID 0005 Rev 3 Length 24
    ecap 000b[298] = Vendor [1] ID 0007 Rev 0 Length 36
    ecap 000b[300] = Vendor [1] ID 0008 Rev 0 Length 56

none80@pci0:58:5:0:	class=0x088000 rev=0x04 hdr=0x00 vendor=0x8086 device=0x2034 subvendor=0x8086 subdevice=0x0000
    vendor     = 'Intel Corporation'
    device     = 'Sky Lake-E VT-d'
    class      = base peripheral
    cap 10[40] = PCI-Express 2 root endpoint max data 128(128)
                 max read 128

none81@pci0:58:5:2:	class=0x088000 rev=0x04 hdr=0x00 vendor=0x8086 device=0x2035 subvendor=0x0000 subdevice=0x0000
    vendor     = 'Intel Corporation'
    device     = 'Sky Lake-E RAS Configuration Registers'
    class      = base peripheral
    cap 10[40] = PCI-Express 2 root endpoint max data 128(128)
                 max read 128

ioapic2@pci0:58:5:4:	class=0x080020 rev=0x04 hdr=0x00 vendor=0x8086 device=0x2036 subvendor=0x8086 subdevice=0x2036
    vendor     = 'Intel Corporation'
    device     = 'Sky Lake-E IOxAPIC Configuration Registers'
    class      = base peripheral
    subclass   = interrupt controller
    bar   [10] = type Memory, range 32, base 0xab300000, size 4096, enabled
    cap 10[44] = PCI-Express 1 root endpoint max data 128(128)
                 max read 128
    cap 01[e0] = powerspec 3  supports D0 D3  current D0

none82@pci0:58:8:0:	class=0x088000 rev=0x04 hdr=0x00 vendor=0x8086 device=0x2066 subvendor=0x8086 subdevice=0x0000
    vendor     = 'Intel Corporation'
    device     = 'Sky Lake-E Integrated Memory Controller'
    class      = base peripheral
    cap 10[40] = PCI-Express 1 root endpoint max data 128(128)
                 max read 128

none83@pci0:58:9:0:	class=0x088000 rev=0x04 hdr=0x00 vendor=0x8086 device=0x2066 subvendor=0x8086 subdevice=0x0000
    vendor     = 'Intel Corporation'
    device     = 'Sky Lake-E Integrated Memory Controller'
    class      = base peripheral
    cap 10[40] = PCI-Express 1 root endpoint max data 128(128)
                 max read 128

none84@pci0:58:10:0:	class=0x088000 rev=0x04 hdr=0x00 vendor=0x8086 device=0x2040 subvendor=0x8086 subdevice=0x0000
    vendor     = 'Intel Corporation'
    device     = 'Sky Lake-E Integrated Memory Controller'
    class      = base peripheral
    cap 10[40] = PCI-Express 1 root endpoint max data 128(128)
                 max read 128

none85@pci0:58:10:1:	class=0x088000 rev=0x04 hdr=0x00 vendor=0x8086 device=0x2041 subvendor=0x8086 subdevice=0x0000
    vendor     = 'Intel Corporation'
    device     = 'Sky Lake-E Integrated Memory Controller'
    class      = base peripheral
    cap 10[40] = PCI-Express 1 root endpoint max data 128(128)
                 max read 128

none86@pci0:58:10:2:	class=0x088000 rev=0x04 hdr=0x00 vendor=0x8086 device=0x2042 subvendor=0x8086 subdevice=0x0000
    vendor     = 'Intel Corporation'
    device     = 'Sky Lake-E Integrated Memory Controller'
    class      = base peripheral
    cap 10[40] = PCI-Express 1 root endpoint max data 128(128)
                 max read 128

none87@pci0:58:10:3:	class=0x088000 rev=0x04 hdr=0x00 vendor=0x8086 device=0x2043 subvendor=0x8086 subdevice=0x0000
    vendor     = 'Intel Corporation'
    device     = 'Sky Lake-E Integrated Memory Controller'
    class      = base peripheral
    cap 10[40] = PCI-Express 1 root endpoint max data 128(128)
                 max read 128

none88@pci0:58:10:4:	class=0x088000 rev=0x04 hdr=0x00 vendor=0x8086 device=0x2044 subvendor=0x8086 subdevice=0x0000
    vendor     = 'Intel Corporation'
    device     = 'Sky Lake-E Integrated Memory Controller'
    class      = base peripheral
    cap 10[40] = PCI-Express 1 root endpoint max data 128(128)
                 max read 128

none89@pci0:58:10:5:	class=0x088000 rev=0x04 hdr=0x00 vendor=0x8086 device=0x2045 subvendor=0x8086 subdevice=0x0000
    vendor     = 'Intel Corporation'
    device     = 'Sky Lake-E LM Channel 1'
    class      = base peripheral
    cap 10[40] = PCI-Express 1 root endpoint max data 128(128)
                 max read 128

none90@pci0:58:10:6:	class=0x088000 rev=0x04 hdr=0x00 vendor=0x8086 device=0x2046 subvendor=0x8086 subdevice=0x0000
    vendor     = 'Intel Corporation'
    device     = 'Sky Lake-E LMS Channel 1'
    class      = base peripheral
    cap 10[40] = PCI-Express 1 root endpoint max data 128(128)
                 max read 128

none91@pci0:58:10:7:	class=0x088000 rev=0x04 hdr=0x00 vendor=0x8086 device=0x2047 subvendor=0x8086 subdevice=0x0000
    vendor     = 'Intel Corporation'
    device     = 'Sky Lake-E LMDP Channel 1'
    class      = base peripheral
    cap 10[40] = PCI-Express 1 root endpoint max data 128(128)
                 max read 128

none92@pci0:58:11:0:	class=0x088000 rev=0x04 hdr=0x00 vendor=0x8086 device=0x2048 subvendor=0x8086 subdevice=0x0000
    vendor     = 'Intel Corporation'
    device     = 'Sky Lake-E DECS Channel 2'
    class      = base peripheral
    cap 10[40] = PCI-Express 1 root endpoint max data 128(128)
                 max read 128

none93@pci0:58:11:1:	class=0x088000 rev=0x04 hdr=0x00 vendor=0x8086 device=0x2049 subvendor=0x8086 subdevice=0x0000
    vendor     = 'Intel Corporation'
    device     = 'Sky Lake-E LM Channel 2'
    class      = base peripheral
    cap 10[40] = PCI-Express 1 root endpoint max data 128(128)
                 max read 128

none94@pci0:58:11:2:	class=0x088000 rev=0x04 hdr=0x00 vendor=0x8086 device=0x204a subvendor=0x8086 subdevice=0x0000
    vendor     = 'Intel Corporation'
    device     = 'Sky Lake-E LMS Channel 2'
    class      = base peripheral
    cap 10[40] = PCI-Express 1 root endpoint max data 128(128)
                 max read 128

none95@pci0:58:11:3:	class=0x088000 rev=0x04 hdr=0x00 vendor=0x8086 device=0x204b subvendor=0x8086 subdevice=0x0000
    vendor     = 'Intel Corporation'
    device     = 'Sky Lake-E LMDP Channel 2'
    class      = base peripheral
    cap 10[40] = PCI-Express 1 root endpoint max data 128(128)
                 max read 128

none96@pci0:58:12:0:	class=0x088000 rev=0x04 hdr=0x00 vendor=0x8086 device=0x2040 subvendor=0x8086 subdevice=0x0000
    vendor     = 'Intel Corporation'
    device     = 'Sky Lake-E Integrated Memory Controller'
    class      = base peripheral
    cap 10[40] = PCI-Express 1 root endpoint max data 128(128)
                 max read 128

none97@pci0:58:12:1:	class=0x088000 rev=0x04 hdr=0x00 vendor=0x8086 device=0x2041 subvendor=0x8086 subdevice=0x0000
    vendor     = 'Intel Corporation'
    device     = 'Sky Lake-E Integrated Memory Controller'
    class      = base peripheral
    cap 10[40] = PCI-Express 1 root endpoint max data 128(128)
                 max read 128

none98@pci0:58:12:2:	class=0x088000 rev=0x04 hdr=0x00 vendor=0x8086 device=0x2042 subvendor=0x8086 subdevice=0x0000
    vendor     = 'Intel Corporation'
    device     = 'Sky Lake-E Integrated Memory Controller'
    class      = base peripheral
    cap 10[40] = PCI-Express 1 root endpoint max data 128(128)
                 max read 128

none99@pci0:58:12:3:	class=0x088000 rev=0x04 hdr=0x00 vendor=0x8086 device=0x2043 subvendor=0x8086 subdevice=0x0000
    vendor     = 'Intel Corporation'
    device     = 'Sky Lake-E Integrated Memory Controller'
    class      = base peripheral
    cap 10[40] = PCI-Express 1 root endpoint max data 128(128)
                 max read 128

none100@pci0:58:12:4:	class=0x088000 rev=0x04 hdr=0x00 vendor=0x8086 device=0x2044 subvendor=0x8086 subdevice=0x0000
    vendor     = 'Intel Corporation'
    device     = 'Sky Lake-E Integrated Memory Controller'
    class      = base peripheral
    cap 10[40] = PCI-Express 1 root endpoint max data 128(128)
                 max read 128

none101@pci0:58:12:5:	class=0x088000 rev=0x04 hdr=0x00 vendor=0x8086 device=0x2045 subvendor=0x8086 subdevice=0x0000
    vendor     = 'Intel Corporation'
    device     = 'Sky Lake-E LM Channel 1'
    class      = base peripheral
    cap 10[40] = PCI-Express 1 root endpoint max data 128(128)
                 max read 128

none102@pci0:58:12:6:	class=0x088000 rev=0x04 hdr=0x00 vendor=0x8086 device=0x2046 subvendor=0x8086 subdevice=0x0000
    vendor     = 'Intel Corporation'
    device     = 'Sky Lake-E LMS Channel 1'
    class      = base peripheral
    cap 10[40] = PCI-Express 1 root endpoint max data 128(128)
                 max read 128

none103@pci0:58:12:7:	class=0x088000 rev=0x04 hdr=0x00 vendor=0x8086 device=0x2047 subvendor=0x8086 subdevice=0x0000
    vendor     = 'Intel Corporation'
    device     = 'Sky Lake-E LMDP Channel 1'
    class      = base peripheral
    cap 10[40] = PCI-Express 1 root endpoint max data 128(128)
                 max read 128

none104@pci0:58:13:0:	class=0x088000 rev=0x04 hdr=0x00 vendor=0x8086 device=0x2048 subvendor=0x8086 subdevice=0x0000
    vendor     = 'Intel Corporation'
    device     = 'Sky Lake-E DECS Channel 2'
    class      = base peripheral
    cap 10[40] = PCI-Express 1 root endpoint max data 128(128)
                 max read 128

none105@pci0:58:13:1:	class=0x088000 rev=0x04 hdr=0x00 vendor=0x8086 device=0x2049 subvendor=0x8086 subdevice=0x0000
    vendor     = 'Intel Corporation'
    device     = 'Sky Lake-E LM Channel 2'
    class      = base peripheral
    cap 10[40] = PCI-Express 1 root endpoint max data 128(128)
                 max read 128

none106@pci0:58:13:2:	class=0x088000 rev=0x04 hdr=0x00 vendor=0x8086 device=0x204a subvendor=0x8086 subdevice=0x0000
    vendor     = 'Intel Corporation'
    device     = 'Sky Lake-E LMS Channel 2'
    class      = base peripheral
    cap 10[40] = PCI-Express 1 root endpoint max data 128(128)
                 max read 128

none107@pci0:58:13:3:	class=0x088000 rev=0x04 hdr=0x00 vendor=0x8086 device=0x204b subvendor=0x8086 subdevice=0x0000
    vendor     = 'Intel Corporation'
    device     = 'Sky Lake-E LMDP Channel 2'
    class      = base peripheral
    cap 10[40] = PCI-Express 1 root endpoint max data 128(128)
                 max read 128

none108@pci0:59:0:0:	class=0x020000 rev=0x01 hdr=0x00 vendor=0x14e4 device=0x16d8 subvendor=0x14e4 subdevice=0x4161
    vendor     = 'Broadcom Inc. and subsidiaries'
    device     = 'BCM57416 NetXtreme-E Dual-Media 10G RDMA Ethernet Controller'
    class      = network
    subclass   = ethernet
    bar   [10] = type Prefetchable Memory, range 64, base 0xab210000, size 65536, enabled
    bar   [18] = type Prefetchable Memory, range 64, base 0xab100000, size 1048576, enabled
    bar   [20] = type Prefetchable Memory, range 64, base 0xab222000, size 8192, enabled
    cap 01[48] = powerspec 3  supports D0 D3  current D0
    cap 03[50] = VPD
    cap 05[58] = MSI supports 8 messages, 64 bit 
    cap 11[a0] = MSI-X supports 74 messages
                 Table in map 0x20[0x0], PBA in map 0x20[0x4a0]
    cap 10[ac] = PCI-Express 2 endpoint max data 256(512) FLR RO NS
                 max read 512
                 link x8(x8) speed 8.0(8.0) ClockPM disabled
    ecap 0001[100] = AER 1 0 fatal 0 non-fatal 2 corrected
    ecap 0003[13c] = Serial 1 e43d1afffe71f830
    ecap 0004[150] = Power Budgeting 1
    ecap 0002[160] = VC 1 max VC0
    ecap 000b[180] = Vendor [1] ID 0000 Rev 0 Length 32
    ecap 0018[1b0] = LTR 1
    ecap 000e[1b8] = ARI 1
    ecap 0017[230] = TPH Requester 1
    ecap 0019[300] = PCIe Sec 1 lane errors 0
    ecap 001f[200] = Precision Time Measurement 1

none109@pci0:59:0:1:	class=0x020000 rev=0x01 hdr=0x00 vendor=0x14e4 device=0x16d8 subvendor=0x14e4 subdevice=0x4161
    vendor     = 'Broadcom Inc. and subsidiaries'
    device     = 'BCM57416 NetXtreme-E Dual-Media 10G RDMA Ethernet Controller'
    class      = network
    subclass   = ethernet
    bar   [10] = type Prefetchable Memory, range 64, base 0xab200000, size 65536, enabled
    bar   [18] = type Prefetchable Memory, range 64, base 0xab000000, size 1048576, enabled
    bar   [20] = type Prefetchable Memory, range 64, base 0xab220000, size 8192, enabled
    cap 01[48] = powerspec 3  supports D0 D3  current D0
    cap 03[50] = VPD
    cap 05[58] = MSI supports 8 messages, 64 bit 
    cap 11[a0] = MSI-X supports 74 messages
                 Table in map 0x20[0x0], PBA in map 0x20[0x4a0]
    cap 10[ac] = PCI-Express 2 endpoint max data 256(512) FLR RO NS
                 max read 512
                 link x8(x8) speed 8.0(8.0) ClockPM disabled
    ecap 0001[100] = AER 1 0 fatal 0 non-fatal 2 corrected
    ecap 0003[13c] = Serial 1 e43d1afffe71f830
    ecap 0004[150] = Power Budgeting 1
    ecap 000b[180] = Vendor [1] ID 0000 Rev 0 Length 32
    ecap 000e[1b8] = ARI 1
    ecap 0017[230] = TPH Requester 1

none110@pci0:93:5:0:	class=0x088000 rev=0x04 hdr=0x00 vendor=0x8086 device=0x2034 subvendor=0x8086 subdevice=0x0000
    vendor     = 'Intel Corporation'
    device     = 'Sky Lake-E VT-d'
    class      = base peripheral
    cap 10[40] = PCI-Express 2 root endpoint max data 128(128)
                 max read 128

none111@pci0:93:5:2:	class=0x088000 rev=0x04 hdr=0x00 vendor=0x8086 device=0x2035 subvendor=0x0000 subdevice=0x0000
    vendor     = 'Intel Corporation'
    device     = 'Sky Lake-E RAS Configuration Registers'
    class      = base peripheral
    cap 10[40] = PCI-Express 2 root endpoint max data 128(128)
                 max read 128

ioapic3@pci0:93:5:4:	class=0x080020 rev=0x04 hdr=0x00 vendor=0x8086 device=0x2036 subvendor=0x8086 subdevice=0x2036
    vendor     = 'Intel Corporation'
    device     = 'Sky Lake-E IOxAPIC Configuration Registers'
    class      = base peripheral
    subclass   = interrupt controller
    bar   [10] = type Memory, range 32, base 0xb8800000, size 4096, enabled
    cap 10[44] = PCI-Express 1 root endpoint max data 128(128)
                 max read 128
    cap 01[e0] = powerspec 3  supports D0 D3  current D0

none112@pci0:93:14:0:	class=0x110100 rev=0x04 hdr=0x00 vendor=0x8086 device=0x2058 subvendor=0x8086 subdevice=0x0000
    vendor     = 'Intel Corporation'
    device     = 'Sky Lake-E KTI 0'
    class      = dasp
    subclass   = performance counters
    cap 10[40] = PCI-Express 2 root endpoint max data 128(128)
                 max read 128

none113@pci0:93:14:1:	class=0x088000 rev=0x04 hdr=0x00 vendor=0x8086 device=0x2059 subvendor=0x8086 subdevice=0x0000
    vendor     = 'Intel Corporation'
    device     = 'Sky Lake-E UPI Registers'
    class      = base peripheral
    cap 10[40] = PCI-Express 2 root endpoint max data 128(128)
                 max read 128
    ecap 000b[100] = Vendor [0] ID 0001 Rev 0 Length 240

none114@pci0:93:15:0:	class=0x110100 rev=0x04 hdr=0x00 vendor=0x8086 device=0x2058 subvendor=0x8086 subdevice=0x0000
    vendor     = 'Intel Corporation'
    device     = 'Sky Lake-E KTI 0'
    class      = dasp
    subclass   = performance counters
    cap 10[40] = PCI-Express 2 root endpoint max data 128(128)
                 max read 128

none115@pci0:93:15:1:	class=0x088000 rev=0x04 hdr=0x00 vendor=0x8086 device=0x2059 subvendor=0x8086 subdevice=0x0000
    vendor     = 'Intel Corporation'
    device     = 'Sky Lake-E UPI Registers'
    class      = base peripheral
    cap 10[40] = PCI-Express 2 root endpoint max data 128(128)
                 max read 128
    ecap 000b[100] = Vendor [0] ID 0001 Rev 0 Length 240

none116@pci0:93:16:0:	class=0x110100 rev=0x04 hdr=0x00 vendor=0x8086 device=0x2058 subvendor=0x8086 subdevice=0x0000
    vendor     = 'Intel Corporation'
    device     = 'Sky Lake-E KTI 0'
    class      = dasp
    subclass   = performance counters
    cap 10[40] = PCI-Express 2 root endpoint max data 128(128)
                 max read 128

none117@pci0:93:16:1:	class=0x088000 rev=0x04 hdr=0x00 vendor=0x8086 device=0x2059 subvendor=0x8086 subdevice=0x0000
    vendor     = 'Intel Corporation'
    device     = 'Sky Lake-E UPI Registers'
    class      = base peripheral
    cap 10[40] = PCI-Express 2 root endpoint max data 128(128)
                 max read 128
    ecap 000b[100] = Vendor [0] ID 0001 Rev 0 Length 240

none118@pci0:93:18:0:	class=0x110100 rev=0x04 hdr=0x00 vendor=0x8086 device=0x204c subvendor=0x8086 subdevice=0x0000
    vendor     = 'Intel Corporation'
    device     = 'Sky Lake-E M3KTI Registers'
    class      = dasp
    subclass   = performance counters
    cap 10[40] = PCI-Express 2 root endpoint max data 128(128)
                 max read 128

none119@pci0:93:18:1:	class=0x110100 rev=0x04 hdr=0x00 vendor=0x8086 device=0x204d subvendor=0x8086 subdevice=0x0000
    vendor     = 'Intel Corporation'
    device     = 'Sky Lake-E M3KTI Registers'
    class      = dasp
    subclass   = performance counters

none120@pci0:93:18:2:	class=0x088000 rev=0x04 hdr=0x00 vendor=0x8086 device=0x204e subvendor=0x8086 subdevice=0x0000
    vendor     = 'Intel Corporation'
    device     = 'Sky Lake-E M3KTI Registers'
    class      = base peripheral

none121@pci0:93:18:4:	class=0x110100 rev=0x04 hdr=0x00 vendor=0x8086 device=0x204c subvendor=0x8086 subdevice=0x0000
    vendor     = 'Intel Corporation'
    device     = 'Sky Lake-E M3KTI Registers'
    class      = dasp
    subclass   = performance counters
    cap 10[40] = PCI-Express 2 root endpoint max data 128(128)
                 max read 128

none122@pci0:93:18:5:	class=0x110100 rev=0x04 hdr=0x00 vendor=0x8086 device=0x204d subvendor=0x8086 subdevice=0x0000
    vendor     = 'Intel Corporation'
    device     = 'Sky Lake-E M3KTI Registers'
    class      = dasp
    subclass   = performance counters

none123@pci0:93:21:0:	class=0x088000 rev=0x04 hdr=0x00 vendor=0x8086 device=0x2018 subvendor=0x8086 subdevice=0x0000
    vendor     = 'Intel Corporation'
    device     = 'Sky Lake-E M2PCI Registers'
    class      = base peripheral

none124@pci0:93:22:0:	class=0x088000 rev=0x04 hdr=0x00 vendor=0x8086 device=0x2018 subvendor=0x8086 subdevice=0x0000
    vendor     = 'Intel Corporation'
    device     = 'Sky Lake-E M2PCI Registers'
    class      = base peripheral

none125@pci0:93:22:4:	class=0x088000 rev=0x04 hdr=0x00 vendor=0x8086 device=0x2018 subvendor=0x8086 subdevice=0x0000
    vendor     = 'Intel Corporation'
    device     = 'Sky Lake-E M2PCI Registers'
    class      = base peripheral

none126@pci0:93:23:0:	class=0x088000 rev=0x04 hdr=0x00 vendor=0x8086 device=0x2018 subvendor=0x8086 subdevice=0x0000
    vendor     = 'Intel Corporation'
    device     = 'Sky Lake-E M2PCI Registers'
    class      = base peripheral

none127@pci0:128:5:0:	class=0x088000 rev=0x04 hdr=0x00 vendor=0x8086 device=0x2024 subvendor=0x8086 subdevice=0x0000
    vendor     = 'Intel Corporation'
    device     = 'Sky Lake-E MM/Vt-d Configuration Registers'
    class      = base peripheral
    cap 10[40] = PCI-Express 2 root endpoint max data 128(128)
                 max read 128

none128@pci0:128:5:2:	class=0x088000 rev=0x04 hdr=0x00 vendor=0x8086 device=0x2025 subvendor=0x0000 subdevice=0x0000
    vendor     = 'Intel Corporation'
    device     = 'Sky Lake-E RAS'
    class      = base peripheral
    cap 10[40] = PCI-Express 2 root endpoint max data 128(128)
                 max read 128

ioapic4@pci0:128:5:4:	class=0x080020 rev=0x04 hdr=0x00 vendor=0x8086 device=0x2026 subvendor=0x8086 subdevice=0x2026
    vendor     = 'Intel Corporation'
    device     = 'Sky Lake-E IOAPIC'
    class      = base peripheral
    subclass   = interrupt controller
    bar   [10] = type Memory, range 32, base 0xc6000000, size 4096, enabled
    cap 10[44] = PCI-Express 1 root endpoint max data 128(128)
                 max read 128
    cap 01[e0] = powerspec 3  supports D0 D3  current D0

none129@pci0:128:8:0:	class=0x088000 rev=0x04 hdr=0x00 vendor=0x8086 device=0x2014 subvendor=0x8086 subdevice=0x0000
    vendor     = 'Intel Corporation'
    device     = 'Sky Lake-E Ubox Registers'
    class      = base peripheral
    cap 10[40] = PCI-Express 2 root endpoint max data 128(128)
                 max read 128

none130@pci0:128:8:1:	class=0x110100 rev=0x04 hdr=0x00 vendor=0x8086 device=0x2015 subvendor=0x8086 subdevice=0x0000
    vendor     = 'Intel Corporation'
    device     = 'Sky Lake-E Ubox Registers'
    class      = dasp
    subclass   = performance counters

none131@pci0:128:8:2:	class=0x088000 rev=0x04 hdr=0x00 vendor=0x8086 device=0x2016 subvendor=0x8086 subdevice=0x0000
    vendor     = 'Intel Corporation'
    device     = 'Sky Lake-E Ubox Registers'
    class      = base peripheral
    cap 10[40] = PCI-Express 2 root endpoint max data 128(128)
                 max read 128

none132@pci0:133:5:0:	class=0x088000 rev=0x04 hdr=0x00 vendor=0x8086 device=0x2034 subvendor=0x8086 subdevice=0x0000
    vendor     = 'Intel Corporation'
    device     = 'Sky Lake-E VT-d'
    class      = base peripheral
    cap 10[40] = PCI-Express 2 root endpoint max data 128(128)
                 max read 128

none133@pci0:133:5:2:	class=0x088000 rev=0x04 hdr=0x00 vendor=0x8086 device=0x2035 subvendor=0x0000 subdevice=0x0000
    vendor     = 'Intel Corporation'
    device     = 'Sky Lake-E RAS Configuration Registers'
    class      = base peripheral
    cap 10[40] = PCI-Express 2 root endpoint max data 128(128)
                 max read 128

ioapic5@pci0:133:5:4:	class=0x080020 rev=0x04 hdr=0x00 vendor=0x8086 device=0x2036 subvendor=0x8086 subdevice=0x2036
    vendor     = 'Intel Corporation'
    device     = 'Sky Lake-E IOxAPIC Configuration Registers'
    class      = base peripheral
    subclass   = interrupt controller
    bar   [10] = type Memory, range 32, base 0xd3800000, size 4096, enabled
    cap 10[44] = PCI-Express 1 root endpoint max data 128(128)
                 max read 128
    cap 01[e0] = powerspec 3  supports D0 D3  current D0

none134@pci0:133:8:0:	class=0x088000 rev=0x04 hdr=0x00 vendor=0x8086 device=0x208d subvendor=0x8086 subdevice=0x0000
    vendor     = 'Intel Corporation'
    device     = 'Sky Lake-E CHA Registers'
    class      = base peripheral

none135@pci0:133:8:1:	class=0x088000 rev=0x04 hdr=0x00 vendor=0x8086 device=0x208d subvendor=0x8086 subdevice=0x0000
    vendor     = 'Intel Corporation'
    device     = 'Sky Lake-E CHA Registers'
    class      = base peripheral

none136@pci0:133:8:2:	class=0x088000 rev=0x04 hdr=0x00 vendor=0x8086 device=0x208d subvendor=0x8086 subdevice=0x0000
    vendor     = 'Intel Corporation'
    device     = 'Sky Lake-E CHA Registers'
    class      = base peripheral

none137@pci0:133:8:3:	class=0x088000 rev=0x04 hdr=0x00 vendor=0x8086 device=0x208d subvendor=0x8086 subdevice=0x0000
    vendor     = 'Intel Corporation'
    device     = 'Sky Lake-E CHA Registers'
    class      = base peripheral

none138@pci0:133:8:4:	class=0x088000 rev=0x04 hdr=0x00 vendor=0x8086 device=0x208d subvendor=0x8086 subdevice=0x0000
    vendor     = 'Intel Corporation'
    device     = 'Sky Lake-E CHA Registers'
    class      = base peripheral

none139@pci0:133:8:5:	class=0x088000 rev=0x04 hdr=0x00 vendor=0x8086 device=0x208d subvendor=0x8086 subdevice=0x0000
    vendor     = 'Intel Corporation'
    device     = 'Sky Lake-E CHA Registers'
    class      = base peripheral

none140@pci0:133:8:6:	class=0x088000 rev=0x04 hdr=0x00 vendor=0x8086 device=0x208d subvendor=0x8086 subdevice=0x0000
    vendor     = 'Intel Corporation'
    device     = 'Sky Lake-E CHA Registers'
    class      = base peripheral

none141@pci0:133:8:7:	class=0x088000 rev=0x04 hdr=0x00 vendor=0x8086 device=0x208d subvendor=0x8086 subdevice=0x0000
    vendor     = 'Intel Corporation'
    device     = 'Sky Lake-E CHA Registers'
    class      = base peripheral

none142@pci0:133:9:0:	class=0x088000 rev=0x04 hdr=0x00 vendor=0x8086 device=0x208d subvendor=0x8086 subdevice=0x0000
    vendor     = 'Intel Corporation'
    device     = 'Sky Lake-E CHA Registers'
    class      = base peripheral

none143@pci0:133:9:1:	class=0x088000 rev=0x04 hdr=0x00 vendor=0x8086 device=0x208d subvendor=0x8086 subdevice=0x0000
    vendor     = 'Intel Corporation'
    device     = 'Sky Lake-E CHA Registers'
    class      = base peripheral

none144@pci0:133:9:2:	class=0x088000 rev=0x04 hdr=0x00 vendor=0x8086 device=0x208d subvendor=0x8086 subdevice=0x0000
    vendor     = 'Intel Corporation'
    device     = 'Sky Lake-E CHA Registers'
    class      = base peripheral

none145@pci0:133:9:3:	class=0x088000 rev=0x04 hdr=0x00 vendor=0x8086 device=0x208d subvendor=0x8086 subdevice=0x0000
    vendor     = 'Intel Corporation'
    device     = 'Sky Lake-E CHA Registers'
    class      = base peripheral

none146@pci0:133:9:4:	class=0x088000 rev=0x04 hdr=0x00 vendor=0x8086 device=0x208d subvendor=0x8086 subdevice=0x0000
    vendor     = 'Intel Corporation'
    device     = 'Sky Lake-E CHA Registers'
    class      = base peripheral

none147@pci0:133:9:5:	class=0x088000 rev=0x04 hdr=0x00 vendor=0x8086 device=0x208d subvendor=0x8086 subdevice=0x0000
    vendor     = 'Intel Corporation'
    device     = 'Sky Lake-E CHA Registers'
    class      = base peripheral

none148@pci0:133:9:6:	class=0x088000 rev=0x04 hdr=0x00 vendor=0x8086 device=0x208d subvendor=0x8086 subdevice=0x0000
    vendor     = 'Intel Corporation'
    device     = 'Sky Lake-E CHA Registers'
    class      = base peripheral

none149@pci0:133:9:7:	class=0x088000 rev=0x04 hdr=0x00 vendor=0x8086 device=0x208d subvendor=0x8086 subdevice=0x0000
    vendor     = 'Intel Corporation'
    device     = 'Sky Lake-E CHA Registers'
    class      = base peripheral

none150@pci0:133:10:0:	class=0x088000 rev=0x04 hdr=0x00 vendor=0x8086 device=0x208d subvendor=0x8086 subdevice=0x0000
    vendor     = 'Intel Corporation'
    device     = 'Sky Lake-E CHA Registers'
    class      = base peripheral

none151@pci0:133:10:1:	class=0x088000 rev=0x04 hdr=0x00 vendor=0x8086 device=0x208d subvendor=0x8086 subdevice=0x0000
    vendor     = 'Intel Corporation'
    device     = 'Sky Lake-E CHA Registers'
    class      = base peripheral

none152@pci0:133:10:2:	class=0x088000 rev=0x04 hdr=0x00 vendor=0x8086 device=0x208d subvendor=0x8086 subdevice=0x0000
    vendor     = 'Intel Corporation'
    device     = 'Sky Lake-E CHA Registers'
    class      = base peripheral

none153@pci0:133:10:3:	class=0x088000 rev=0x04 hdr=0x00 vendor=0x8086 device=0x208d subvendor=0x8086 subdevice=0x0000
    vendor     = 'Intel Corporation'
    device     = 'Sky Lake-E CHA Registers'
    class      = base peripheral

none154@pci0:133:10:4:	class=0x088000 rev=0x04 hdr=0x00 vendor=0x8086 device=0x208d subvendor=0x8086 subdevice=0x0000
    vendor     = 'Intel Corporation'
    device     = 'Sky Lake-E CHA Registers'
    class      = base peripheral

none155@pci0:133:10:5:	class=0x088000 rev=0x04 hdr=0x00 vendor=0x8086 device=0x208d subvendor=0x8086 subdevice=0x0000
    vendor     = 'Intel Corporation'
    device     = 'Sky Lake-E CHA Registers'
    class      = base peripheral

none156@pci0:133:10:6:	class=0x088000 rev=0x04 hdr=0x00 vendor=0x8086 device=0x208d subvendor=0x8086 subdevice=0x0000
    vendor     = 'Intel Corporation'
    device     = 'Sky Lake-E CHA Registers'
    class      = base peripheral

none157@pci0:133:10:7:	class=0x088000 rev=0x04 hdr=0x00 vendor=0x8086 device=0x208d subvendor=0x8086 subdevice=0x0000
    vendor     = 'Intel Corporation'
    device     = 'Sky Lake-E CHA Registers'
    class      = base peripheral

none158@pci0:133:11:0:	class=0x088000 rev=0x04 hdr=0x00 vendor=0x8086 device=0x208d subvendor=0x8086 subdevice=0x0000
    vendor     = 'Intel Corporation'
    device     = 'Sky Lake-E CHA Registers'
    class      = base peripheral

none159@pci0:133:11:1:	class=0x088000 rev=0x04 hdr=0x00 vendor=0x8086 device=0x208d subvendor=0x8086 subdevice=0x0000
    vendor     = 'Intel Corporation'
    device     = 'Sky Lake-E CHA Registers'
    class      = base peripheral

none160@pci0:133:11:2:	class=0x088000 rev=0x04 hdr=0x00 vendor=0x8086 device=0x208d subvendor=0x8086 subdevice=0x0000
    vendor     = 'Intel Corporation'
    device     = 'Sky Lake-E CHA Registers'
    class      = base peripheral

none161@pci0:133:11:3:	class=0x088000 rev=0x04 hdr=0x00 vendor=0x8086 device=0x208d subvendor=0x8086 subdevice=0x0000
    vendor     = 'Intel Corporation'
    device     = 'Sky Lake-E CHA Registers'
    class      = base peripheral

none162@pci0:133:14:0:	class=0x088000 rev=0x04 hdr=0x00 vendor=0x8086 device=0x208e subvendor=0x8086 subdevice=0x0000
    vendor     = 'Intel Corporation'
    device     = 'Sky Lake-E CHA Registers'
    class      = base peripheral

none163@pci0:133:14:1:	class=0x088000 rev=0x04 hdr=0x00 vendor=0x8086 device=0x208e subvendor=0x8086 subdevice=0x0000
    vendor     = 'Intel Corporation'
    device     = 'Sky Lake-E CHA Registers'
    class      = base peripheral

none164@pci0:133:14:2:	class=0x088000 rev=0x04 hdr=0x00 vendor=0x8086 device=0x208e subvendor=0x8086 subdevice=0x0000
    vendor     = 'Intel Corporation'
    device     = 'Sky Lake-E CHA Registers'
    class      = base peripheral

none165@pci0:133:14:3:	class=0x088000 rev=0x04 hdr=0x00 vendor=0x8086 device=0x208e subvendor=0x8086 subdevice=0x0000
    vendor     = 'Intel Corporation'
    device     = 'Sky Lake-E CHA Registers'
    class      = base peripheral

none166@pci0:133:14:4:	class=0x088000 rev=0x04 hdr=0x00 vendor=0x8086 device=0x208e subvendor=0x8086 subdevice=0x0000
    vendor     = 'Intel Corporation'
    device     = 'Sky Lake-E CHA Registers'
    class      = base peripheral

none167@pci0:133:14:5:	class=0x088000 rev=0x04 hdr=0x00 vendor=0x8086 device=0x208e subvendor=0x8086 subdevice=0x0000
    vendor     = 'Intel Corporation'
    device     = 'Sky Lake-E CHA Registers'
    class      = base peripheral

none168@pci0:133:14:6:	class=0x088000 rev=0x04 hdr=0x00 vendor=0x8086 device=0x208e subvendor=0x8086 subdevice=0x0000
    vendor     = 'Intel Corporation'
    device     = 'Sky Lake-E CHA Registers'
    class      = base peripheral

none169@pci0:133:14:7:	class=0x088000 rev=0x04 hdr=0x00 vendor=0x8086 device=0x208e subvendor=0x8086 subdevice=0x0000
    vendor     = 'Intel Corporation'
    device     = 'Sky Lake-E CHA Registers'
    class      = base peripheral

none170@pci0:133:15:0:	class=0x088000 rev=0x04 hdr=0x00 vendor=0x8086 device=0x208e subvendor=0x8086 subdevice=0x0000
    vendor     = 'Intel Corporation'
    device     = 'Sky Lake-E CHA Registers'
    class      = base peripheral

none171@pci0:133:15:1:	class=0x088000 rev=0x04 hdr=0x00 vendor=0x8086 device=0x208e subvendor=0x8086 subdevice=0x0000
    vendor     = 'Intel Corporation'
    device     = 'Sky Lake-E CHA Registers'
    class      = base peripheral

none172@pci0:133:15:2:	class=0x088000 rev=0x04 hdr=0x00 vendor=0x8086 device=0x208e subvendor=0x8086 subdevice=0x0000
    vendor     = 'Intel Corporation'
    device     = 'Sky Lake-E CHA Registers'
    class      = base peripheral

none173@pci0:133:15:3:	class=0x088000 rev=0x04 hdr=0x00 vendor=0x8086 device=0x208e subvendor=0x8086 subdevice=0x0000
    vendor     = 'Intel Corporation'
    device     = 'Sky Lake-E CHA Registers'
    class      = base peripheral

none174@pci0:133:15:4:	class=0x088000 rev=0x04 hdr=0x00 vendor=0x8086 device=0x208e subvendor=0x8086 subdevice=0x0000
    vendor     = 'Intel Corporation'
    device     = 'Sky Lake-E CHA Registers'
    class      = base peripheral

none175@pci0:133:15:5:	class=0x088000 rev=0x04 hdr=0x00 vendor=0x8086 device=0x208e subvendor=0x8086 subdevice=0x0000
    vendor     = 'Intel Corporation'
    device     = 'Sky Lake-E CHA Registers'
    class      = base peripheral

none176@pci0:133:15:6:	class=0x088000 rev=0x04 hdr=0x00 vendor=0x8086 device=0x208e subvendor=0x8086 subdevice=0x0000
    vendor     = 'Intel Corporation'
    device     = 'Sky Lake-E CHA Registers'
    class      = base peripheral

none177@pci0:133:15:7:	class=0x088000 rev=0x04 hdr=0x00 vendor=0x8086 device=0x208e subvendor=0x8086 subdevice=0x0000
    vendor     = 'Intel Corporation'
    device     = 'Sky Lake-E CHA Registers'
    class      = base peripheral

none178@pci0:133:16:0:	class=0x088000 rev=0x04 hdr=0x00 vendor=0x8086 device=0x208e subvendor=0x8086 subdevice=0x0000
    vendor     = 'Intel Corporation'
    device     = 'Sky Lake-E CHA Registers'
    class      = base peripheral

none179@pci0:133:16:1:	class=0x088000 rev=0x04 hdr=0x00 vendor=0x8086 device=0x208e subvendor=0x8086 subdevice=0x0000
    vendor     = 'Intel Corporation'
    device     = 'Sky Lake-E CHA Registers'
    class      = base peripheral

none180@pci0:133:16:2:	class=0x088000 rev=0x04 hdr=0x00 vendor=0x8086 device=0x208e subvendor=0x8086 subdevice=0x0000
    vendor     = 'Intel Corporation'
    device     = 'Sky Lake-E CHA Registers'
    class      = base peripheral

none181@pci0:133:16:3:	class=0x088000 rev=0x04 hdr=0x00 vendor=0x8086 device=0x208e subvendor=0x8086 subdevice=0x0000
    vendor     = 'Intel Corporation'
    device     = 'Sky Lake-E CHA Registers'
    class      = base peripheral

none182@pci0:133:16:4:	class=0x088000 rev=0x04 hdr=0x00 vendor=0x8086 device=0x208e subvendor=0x8086 subdevice=0x0000
    vendor     = 'Intel Corporation'
    device     = 'Sky Lake-E CHA Registers'
    class      = base peripheral

none183@pci0:133:16:5:	class=0x088000 rev=0x04 hdr=0x00 vendor=0x8086 device=0x208e subvendor=0x8086 subdevice=0x0000
    vendor     = 'Intel Corporation'
    device     = 'Sky Lake-E CHA Registers'
    class      = base peripheral

none184@pci0:133:16:6:	class=0x088000 rev=0x04 hdr=0x00 vendor=0x8086 device=0x208e subvendor=0x8086 subdevice=0x0000
    vendor     = 'Intel Corporation'
    device     = 'Sky Lake-E CHA Registers'
    class      = base peripheral

none185@pci0:133:16:7:	class=0x088000 rev=0x04 hdr=0x00 vendor=0x8086 device=0x208e subvendor=0x8086 subdevice=0x0000
    vendor     = 'Intel Corporation'
    device     = 'Sky Lake-E CHA Registers'
    class      = base peripheral

none186@pci0:133:17:0:	class=0x088000 rev=0x04 hdr=0x00 vendor=0x8086 device=0x208e subvendor=0x8086 subdevice=0x0000
    vendor     = 'Intel Corporation'
    device     = 'Sky Lake-E CHA Registers'
    class      = base peripheral

none187@pci0:133:17:1:	class=0x088000 rev=0x04 hdr=0x00 vendor=0x8086 device=0x208e subvendor=0x8086 subdevice=0x0000
    vendor     = 'Intel Corporation'
    device     = 'Sky Lake-E CHA Registers'
    class      = base peripheral

none188@pci0:133:17:2:	class=0x088000 rev=0x04 hdr=0x00 vendor=0x8086 device=0x208e subvendor=0x8086 subdevice=0x0000
    vendor     = 'Intel Corporation'
    device     = 'Sky Lake-E CHA Registers'
    class      = base peripheral

none189@pci0:133:17:3:	class=0x088000 rev=0x04 hdr=0x00 vendor=0x8086 device=0x208e subvendor=0x8086 subdevice=0x0000
    vendor     = 'Intel Corporation'
    device     = 'Sky Lake-E CHA Registers'
    class      = base peripheral

none190@pci0:133:29:0:	class=0x088000 rev=0x04 hdr=0x00 vendor=0x8086 device=0x2054 subvendor=0x8086 subdevice=0x0000
    vendor     = 'Intel Corporation'
    device     = 'Sky Lake-E CHA Registers'
    class      = base peripheral

none191@pci0:133:29:1:	class=0x088000 rev=0x04 hdr=0x00 vendor=0x8086 device=0x2055 subvendor=0x8086 subdevice=0x0000
    vendor     = 'Intel Corporation'
    device     = 'Sky Lake-E CHA Registers'
    class      = base peripheral

none192@pci0:133:29:2:	class=0x088000 rev=0x04 hdr=0x00 vendor=0x8086 device=0x2056 subvendor=0x8086 subdevice=0x0000
    vendor     = 'Intel Corporation'
    device     = 'Sky Lake-E CHA Registers'
    class      = base peripheral

none193@pci0:133:29:3:	class=0x088000 rev=0x04 hdr=0x00 vendor=0x8086 device=0x2057 subvendor=0x8086 subdevice=0x0000
    vendor     = 'Intel Corporation'
    device     = 'Sky Lake-E CHA Registers'
    class      = base peripheral

none194@pci0:133:30:0:	class=0x088000 rev=0x04 hdr=0x00 vendor=0x8086 device=0x2080 subvendor=0x8086 subdevice=0x0000
    vendor     = 'Intel Corporation'
    device     = 'Sky Lake-E PCU Registers'
    class      = base peripheral

none195@pci0:133:30:1:	class=0x088000 rev=0x04 hdr=0x00 vendor=0x8086 device=0x2081 subvendor=0x8086 subdevice=0x0000
    vendor     = 'Intel Corporation'
    device     = 'Sky Lake-E PCU Registers'
    class      = base peripheral

none196@pci0:133:30:2:	class=0x088000 rev=0x04 hdr=0x00 vendor=0x8086 device=0x2082 subvendor=0x8086 subdevice=0x0000
    vendor     = 'Intel Corporation'
    device     = 'Sky Lake-E PCU Registers'
    class      = base peripheral

none197@pci0:133:30:3:	class=0x088000 rev=0x04 hdr=0x00 vendor=0x8086 device=0x2083 subvendor=0x8086 subdevice=0x0000
    vendor     = 'Intel Corporation'
    device     = 'Sky Lake-E PCU Registers'
    class      = base peripheral

none198@pci0:133:30:4:	class=0x088000 rev=0x04 hdr=0x00 vendor=0x8086 device=0x2084 subvendor=0x8086 subdevice=0x0000
    vendor     = 'Intel Corporation'
    device     = 'Sky Lake-E PCU Registers'
    class      = base peripheral

none199@pci0:133:30:5:	class=0x088000 rev=0x04 hdr=0x00 vendor=0x8086 device=0x2085 subvendor=0x8086 subdevice=0x0000
    vendor     = 'Intel Corporation'
    device     = 'Sky Lake-E PCU Registers'
    class      = base peripheral

none200@pci0:133:30:6:	class=0x088000 rev=0x04 hdr=0x00 vendor=0x8086 device=0x2086 subvendor=0x8086 subdevice=0x0000
    vendor     = 'Intel Corporation'
    device     = 'Sky Lake-E PCU Registers'
    class      = base peripheral

none201@pci0:174:5:0:	class=0x088000 rev=0x04 hdr=0x00 vendor=0x8086 device=0x2034 subvendor=0x8086 subdevice=0x0000
    vendor     = 'Intel Corporation'
    device     = 'Sky Lake-E VT-d'
    class      = base peripheral
    cap 10[40] = PCI-Express 2 root endpoint max data 128(128)
                 max read 128

none202@pci0:174:5:2:	class=0x088000 rev=0x04 hdr=0x00 vendor=0x8086 device=0x2035 subvendor=0x0000 subdevice=0x0000
    vendor     = 'Intel Corporation'
    device     = 'Sky Lake-E RAS Configuration Registers'
    class      = base peripheral
    cap 10[40] = PCI-Express 2 root endpoint max data 128(128)
                 max read 128

ioapic6@pci0:174:5:4:	class=0x080020 rev=0x04 hdr=0x00 vendor=0x8086 device=0x2036 subvendor=0x8086 subdevice=0x2036
    vendor     = 'Intel Corporation'
    device     = 'Sky Lake-E IOxAPIC Configuration Registers'
    class      = base peripheral
    subclass   = interrupt controller
    bar   [10] = type Memory, range 32, base 0xe1000000, size 4096, enabled
    cap 10[44] = PCI-Express 1 root endpoint max data 128(128)
                 max read 128
    cap 01[e0] = powerspec 3  supports D0 D3  current D0

none203@pci0:174:8:0:	class=0x088000 rev=0x04 hdr=0x00 vendor=0x8086 device=0x2066 subvendor=0x8086 subdevice=0x0000
    vendor     = 'Intel Corporation'
    device     = 'Sky Lake-E Integrated Memory Controller'
    class      = base peripheral
    cap 10[40] = PCI-Express 1 root endpoint max data 128(128)
                 max read 128

none204@pci0:174:9:0:	class=0x088000 rev=0x04 hdr=0x00 vendor=0x8086 device=0x2066 subvendor=0x8086 subdevice=0x0000
    vendor     = 'Intel Corporation'
    device     = 'Sky Lake-E Integrated Memory Controller'
    class      = base peripheral
    cap 10[40] = PCI-Express 1 root endpoint max data 128(128)
                 max read 128

none205@pci0:174:10:0:	class=0x088000 rev=0x04 hdr=0x00 vendor=0x8086 device=0x2040 subvendor=0x8086 subdevice=0x0000
    vendor     = 'Intel Corporation'
    device     = 'Sky Lake-E Integrated Memory Controller'
    class      = base peripheral
    cap 10[40] = PCI-Express 1 root endpoint max data 128(128)
                 max read 128

none206@pci0:174:10:1:	class=0x088000 rev=0x04 hdr=0x00 vendor=0x8086 device=0x2041 subvendor=0x8086 subdevice=0x0000
    vendor     = 'Intel Corporation'
    device     = 'Sky Lake-E Integrated Memory Controller'
    class      = base peripheral
    cap 10[40] = PCI-Express 1 root endpoint max data 128(128)
                 max read 128

none207@pci0:174:10:2:	class=0x088000 rev=0x04 hdr=0x00 vendor=0x8086 device=0x2042 subvendor=0x8086 subdevice=0x0000
    vendor     = 'Intel Corporation'
    device     = 'Sky Lake-E Integrated Memory Controller'
    class      = base peripheral
    cap 10[40] = PCI-Express 1 root endpoint max data 128(128)
                 max read 128

none208@pci0:174:10:3:	class=0x088000 rev=0x04 hdr=0x00 vendor=0x8086 device=0x2043 subvendor=0x8086 subdevice=0x0000
    vendor     = 'Intel Corporation'
    device     = 'Sky Lake-E Integrated Memory Controller'
    class      = base peripheral
    cap 10[40] = PCI-Express 1 root endpoint max data 128(128)
                 max read 128

none209@pci0:174:10:4:	class=0x088000 rev=0x04 hdr=0x00 vendor=0x8086 device=0x2044 subvendor=0x8086 subdevice=0x0000
    vendor     = 'Intel Corporation'
    device     = 'Sky Lake-E Integrated Memory Controller'
    class      = base peripheral
    cap 10[40] = PCI-Express 1 root endpoint max data 128(128)
                 max read 128

none210@pci0:174:10:5:	class=0x088000 rev=0x04 hdr=0x00 vendor=0x8086 device=0x2045 subvendor=0x8086 subdevice=0x0000
    vendor     = 'Intel Corporation'
    device     = 'Sky Lake-E LM Channel 1'
    class      = base peripheral
    cap 10[40] = PCI-Express 1 root endpoint max data 128(128)
                 max read 128

none211@pci0:174:10:6:	class=0x088000 rev=0x04 hdr=0x00 vendor=0x8086 device=0x2046 subvendor=0x8086 subdevice=0x0000
    vendor     = 'Intel Corporation'
    device     = 'Sky Lake-E LMS Channel 1'
    class      = base peripheral
    cap 10[40] = PCI-Express 1 root endpoint max data 128(128)
                 max read 128

none212@pci0:174:10:7:	class=0x088000 rev=0x04 hdr=0x00 vendor=0x8086 device=0x2047 subvendor=0x8086 subdevice=0x0000
    vendor     = 'Intel Corporation'
    device     = 'Sky Lake-E LMDP Channel 1'
    class      = base peripheral
    cap 10[40] = PCI-Express 1 root endpoint max data 128(128)
                 max read 128

none213@pci0:174:11:0:	class=0x088000 rev=0x04 hdr=0x00 vendor=0x8086 device=0x2048 subvendor=0x8086 subdevice=0x0000
    vendor     = 'Intel Corporation'
    device     = 'Sky Lake-E DECS Channel 2'
    class      = base peripheral
    cap 10[40] = PCI-Express 1 root endpoint max data 128(128)
                 max read 128

none214@pci0:174:11:1:	class=0x088000 rev=0x04 hdr=0x00 vendor=0x8086 device=0x2049 subvendor=0x8086 subdevice=0x0000
    vendor     = 'Intel Corporation'
    device     = 'Sky Lake-E LM Channel 2'
    class      = base peripheral
    cap 10[40] = PCI-Express 1 root endpoint max data 128(128)
                 max read 128

none215@pci0:174:11:2:	class=0x088000 rev=0x04 hdr=0x00 vendor=0x8086 device=0x204a subvendor=0x8086 subdevice=0x0000
    vendor     = 'Intel Corporation'
    device     = 'Sky Lake-E LMS Channel 2'
    class      = base peripheral
    cap 10[40] = PCI-Express 1 root endpoint max data 128(128)
                 max read 128

none216@pci0:174:11:3:	class=0x088000 rev=0x04 hdr=0x00 vendor=0x8086 device=0x204b subvendor=0x8086 subdevice=0x0000
    vendor     = 'Intel Corporation'
    device     = 'Sky Lake-E LMDP Channel 2'
    class      = base peripheral
    cap 10[40] = PCI-Express 1 root endpoint max data 128(128)
                 max read 128

none217@pci0:174:12:0:	class=0x088000 rev=0x04 hdr=0x00 vendor=0x8086 device=0x2040 subvendor=0x8086 subdevice=0x0000
    vendor     = 'Intel Corporation'
    device     = 'Sky Lake-E Integrated Memory Controller'
    class      = base peripheral
    cap 10[40] = PCI-Express 1 root endpoint max data 128(128)
                 max read 128

none218@pci0:174:12:1:	class=0x088000 rev=0x04 hdr=0x00 vendor=0x8086 device=0x2041 subvendor=0x8086 subdevice=0x0000
    vendor     = 'Intel Corporation'
    device     = 'Sky Lake-E Integrated Memory Controller'
    class      = base peripheral
    cap 10[40] = PCI-Express 1 root endpoint max data 128(128)
                 max read 128

none219@pci0:174:12:2:	class=0x088000 rev=0x04 hdr=0x00 vendor=0x8086 device=0x2042 subvendor=0x8086 subdevice=0x0000
    vendor     = 'Intel Corporation'
    device     = 'Sky Lake-E Integrated Memory Controller'
    class      = base peripheral
    cap 10[40] = PCI-Express 1 root endpoint max data 128(128)
                 max read 128

none220@pci0:174:12:3:	class=0x088000 rev=0x04 hdr=0x00 vendor=0x8086 device=0x2043 subvendor=0x8086 subdevice=0x0000
    vendor     = 'Intel Corporation'
    device     = 'Sky Lake-E Integrated Memory Controller'
    class      = base peripheral
    cap 10[40] = PCI-Express 1 root endpoint max data 128(128)
                 max read 128

none221@pci0:174:12:4:	class=0x088000 rev=0x04 hdr=0x00 vendor=0x8086 device=0x2044 subvendor=0x8086 subdevice=0x0000
    vendor     = 'Intel Corporation'
    device     = 'Sky Lake-E Integrated Memory Controller'
    class      = base peripheral
    cap 10[40] = PCI-Express 1 root endpoint max data 128(128)
                 max read 128

none222@pci0:174:12:5:	class=0x088000 rev=0x04 hdr=0x00 vendor=0x8086 device=0x2045 subvendor=0x8086 subdevice=0x0000
    vendor     = 'Intel Corporation'
    device     = 'Sky Lake-E LM Channel 1'
    class      = base peripheral
    cap 10[40] = PCI-Express 1 root endpoint max data 128(128)
                 max read 128

none223@pci0:174:12:6:	class=0x088000 rev=0x04 hdr=0x00 vendor=0x8086 device=0x2046 subvendor=0x8086 subdevice=0x0000
    vendor     = 'Intel Corporation'
    device     = 'Sky Lake-E LMS Channel 1'
    class      = base peripheral
    cap 10[40] = PCI-Express 1 root endpoint max data 128(128)
                 max read 128

none224@pci0:174:12:7:	class=0x088000 rev=0x04 hdr=0x00 vendor=0x8086 device=0x2047 subvendor=0x8086 subdevice=0x0000
    vendor     = 'Intel Corporation'
    device     = 'Sky Lake-E LMDP Channel 1'
    class      = base peripheral
    cap 10[40] = PCI-Express 1 root endpoint max data 128(128)
                 max read 128

none225@pci0:174:13:0:	class=0x088000 rev=0x04 hdr=0x00 vendor=0x8086 device=0x2048 subvendor=0x8086 subdevice=0x0000
    vendor     = 'Intel Corporation'
    device     = 'Sky Lake-E DECS Channel 2'
    class      = base peripheral
    cap 10[40] = PCI-Express 1 root endpoint max data 128(128)
                 max read 128

none226@pci0:174:13:1:	class=0x088000 rev=0x04 hdr=0x00 vendor=0x8086 device=0x2049 subvendor=0x8086 subdevice=0x0000
    vendor     = 'Intel Corporation'
    device     = 'Sky Lake-E LM Channel 2'
    class      = base peripheral
    cap 10[40] = PCI-Express 1 root endpoint max data 128(128)
                 max read 128

none227@pci0:174:13:2:	class=0x088000 rev=0x04 hdr=0x00 vendor=0x8086 device=0x204a subvendor=0x8086 subdevice=0x0000
    vendor     = 'Intel Corporation'
    device     = 'Sky Lake-E LMS Channel 2'
    class      = base peripheral
    cap 10[40] = PCI-Express 1 root endpoint max data 128(128)
                 max read 128

none228@pci0:174:13:3:	class=0x088000 rev=0x04 hdr=0x00 vendor=0x8086 device=0x204b subvendor=0x8086 subdevice=0x0000
    vendor     = 'Intel Corporation'
    device     = 'Sky Lake-E LMDP Channel 2'
    class      = base peripheral
    cap 10[40] = PCI-Express 1 root endpoint max data 128(128)
                 max read 128

none229@pci0:215:5:0:	class=0x088000 rev=0x04 hdr=0x00 vendor=0x8086 device=0x2034 subvendor=0x8086 subdevice=0x0000
    vendor     = 'Intel Corporation'
    device     = 'Sky Lake-E VT-d'
    class      = base peripheral
    cap 10[40] = PCI-Express 2 root endpoint max data 128(128)
                 max read 128

none230@pci0:215:5:2:	class=0x088000 rev=0x04 hdr=0x00 vendor=0x8086 device=0x2035 subvendor=0x0000 subdevice=0x0000
    vendor     = 'Intel Corporation'
    device     = 'Sky Lake-E RAS Configuration Registers'
    class      = base peripheral
    cap 10[40] = PCI-Express 2 root endpoint max data 128(128)
                 max read 128

ioapic7@pci0:215:5:4:	class=0x080020 rev=0x04 hdr=0x00 vendor=0x8086 device=0x2036 subvendor=0x8086 subdevice=0x2036
    vendor     = 'Intel Corporation'
    device     = 'Sky Lake-E IOxAPIC Configuration Registers'
    class      = base peripheral
    subclass   = interrupt controller
    bar   [10] = type Memory, range 32, base 0xee800000, size 4096, enabled
    cap 10[44] = PCI-Express 1 root endpoint max data 128(128)
                 max read 128
    cap 01[e0] = powerspec 3  supports D0 D3  current D0

none231@pci0:215:14:0:	class=0x110100 rev=0x04 hdr=0x00 vendor=0x8086 device=0x2058 subvendor=0x8086 subdevice=0x0000
    vendor     = 'Intel Corporation'
    device     = 'Sky Lake-E KTI 0'
    class      = dasp
    subclass   = performance counters
    cap 10[40] = PCI-Express 2 root endpoint max data 128(128)
                 max read 128

none232@pci0:215:14:1:	class=0x088000 rev=0x04 hdr=0x00 vendor=0x8086 device=0x2059 subvendor=0x8086 subdevice=0x0000
    vendor     = 'Intel Corporation'
    device     = 'Sky Lake-E UPI Registers'
    class      = base peripheral
    cap 10[40] = PCI-Express 2 root endpoint max data 128(128)
                 max read 128
    ecap 000b[100] = Vendor [0] ID 0001 Rev 0 Length 240

none233@pci0:215:15:0:	class=0x110100 rev=0x04 hdr=0x00 vendor=0x8086 device=0x2058 subvendor=0x8086 subdevice=0x0000
    vendor     = 'Intel Corporation'
    device     = 'Sky Lake-E KTI 0'
    class      = dasp
    subclass   = performance counters
    cap 10[40] = PCI-Express 2 root endpoint max data 128(128)
                 max read 128

none234@pci0:215:15:1:	class=0x088000 rev=0x04 hdr=0x00 vendor=0x8086 device=0x2059 subvendor=0x8086 subdevice=0x0000
    vendor     = 'Intel Corporation'
    device     = 'Sky Lake-E UPI Registers'
    class      = base peripheral
    cap 10[40] = PCI-Express 2 root endpoint max data 128(128)
                 max read 128
    ecap 000b[100] = Vendor [0] ID 0001 Rev 0 Length 240

none235@pci0:215:16:0:	class=0x110100 rev=0x04 hdr=0x00 vendor=0x8086 device=0x2058 subvendor=0x8086 subdevice=0x0000
    vendor     = 'Intel Corporation'
    device     = 'Sky Lake-E KTI 0'
    class      = dasp
    subclass   = performance counters
    cap 10[40] = PCI-Express 2 root endpoint max data 128(128)
                 max read 128

none236@pci0:215:16:1:	class=0x088000 rev=0x04 hdr=0x00 vendor=0x8086 device=0x2059 subvendor=0x8086 subdevice=0x0000
    vendor     = 'Intel Corporation'
    device     = 'Sky Lake-E UPI Registers'
    class      = base peripheral
    cap 10[40] = PCI-Express 2 root endpoint max data 128(128)
                 max read 128
    ecap 000b[100] = Vendor [0] ID 0001 Rev 0 Length 240

none237@pci0:215:18:0:	class=0x110100 rev=0x04 hdr=0x00 vendor=0x8086 device=0x204c subvendor=0x8086 subdevice=0x0000
    vendor     = 'Intel Corporation'
    device     = 'Sky Lake-E M3KTI Registers'
    class      = dasp
    subclass   = performance counters
    cap 10[40] = PCI-Express 2 root endpoint max data 128(128)
                 max read 128

none238@pci0:215:18:1:	class=0x110100 rev=0x04 hdr=0x00 vendor=0x8086 device=0x204d subvendor=0x8086 subdevice=0x0000
    vendor     = 'Intel Corporation'
    device     = 'Sky Lake-E M3KTI Registers'
    class      = dasp
    subclass   = performance counters

none239@pci0:215:18:2:	class=0x088000 rev=0x04 hdr=0x00 vendor=0x8086 device=0x204e subvendor=0x8086 subdevice=0x0000
    vendor     = 'Intel Corporation'
    device     = 'Sky Lake-E M3KTI Registers'
    class      = base peripheral

none240@pci0:215:18:4:	class=0x110100 rev=0x04 hdr=0x00 vendor=0x8086 device=0x204c subvendor=0x8086 subdevice=0x0000
    vendor     = 'Intel Corporation'
    device     = 'Sky Lake-E M3KTI Registers'
    class      = dasp
    subclass   = performance counters
    cap 10[40] = PCI-Express 2 root endpoint max data 128(128)
                 max read 128

none241@pci0:215:18:5:	class=0x110100 rev=0x04 hdr=0x00 vendor=0x8086 device=0x204d subvendor=0x8086 subdevice=0x0000
    vendor     = 'Intel Corporation'
    device     = 'Sky Lake-E M3KTI Registers'
    class      = dasp
    subclass   = performance counters

none242@pci0:215:21:0:	class=0x088000 rev=0x04 hdr=0x00 vendor=0x8086 device=0x2018 subvendor=0x8086 subdevice=0x0000
    vendor     = 'Intel Corporation'
    device     = 'Sky Lake-E M2PCI Registers'
    class      = base peripheral

none243@pci0:215:22:0:	class=0x088000 rev=0x04 hdr=0x00 vendor=0x8086 device=0x2018 subvendor=0x8086 subdevice=0x0000
    vendor     = 'Intel Corporation'
    device     = 'Sky Lake-E M2PCI Registers'
    class      = base peripheral

none244@pci0:215:22:4:	class=0x088000 rev=0x04 hdr=0x00 vendor=0x8086 device=0x2018 subvendor=0x8086 subdevice=0x0000
    vendor     = 'Intel Corporation'
    device     = 'Sky Lake-E M2PCI Registers'
    class      = base peripheral

none245@pci0:215:23:0:	class=0x088000 rev=0x04 hdr=0x00 vendor=0x8086 device=0x2018 subvendor=0x8086 subdevice=0x0000
    vendor     = 'Intel Corporation'
    device     = 'Sky Lake-E M2PCI Registers'
    class      = base peripheral
