hostb0@pci0:0:0:0:	class=0x060000 rev=0x07 hdr=0x00 vendor=0x8086 device=0x3c00 subvendor=0x1043 subdevice=0x84ef
    vendor     = 'Intel Corporation'
    device     = 'Xeon E5/Core i7 DMI2'
    class      = bridge
    subclass   = HOST-PCI
    cap 10[90] = PCI-Express 2 root port max data 128(128)
                 max read 128
                 link x0(x4) speed 0.0(2.5) ASPM disabled(L0s/L1)
    cap 01[e0] = powerspec 3  supports D0 D3  current D0
    ecap 000b[100] = Vendor [1] ID 0002 Rev 0 Length 12
    ecap 000b[144] = Vendor [1] ID 0004 Rev 1 Length 60
    ecap 000b[1d0] = Vendor [1] ID 0003 Rev 1 Length 10
    ecap 000b[280] = Vendor [1] ID 0004 Rev 2 Length 24

pcib1@pci0:0:1:0:	class=0x060400 rev=0x07 hdr=0x01 vendor=0x8086 device=0x3c02 subvendor=0x1043 subdevice=0x84ef
    vendor     = 'Intel Corporation'
    device     = 'Xeon E5/Core i7 IIO PCI Express Root Port 1a'
    class      = bridge
    subclass   = PCI-PCI
    cap 0d[40] = PCI Bridge subvendor=0x1043 subdevice=0x84ef
    cap 05[60] = MSI supports 2 messages, vector masks 
    cap 10[90] = PCI-Express 2 root port max data 128(256) ARI disabled
                 max read 128
                 link x0(x4) speed 0.0(8.0)
                 slot 1 power limit 25000 mW
    cap 01[e0] = powerspec 3  supports D0 D3  current D0
    ecap 000b[100] = Vendor [1] ID 0002 Rev 0 Length 12
    ecap 000d[110] = ACS 1
    ecap 0001[148] = AER 1 0 fatal 0 non-fatal 0 corrected
    ecap 000b[1d0] = Vendor [1] ID 0003 Rev 1 Length 10
    ecap 0019[250] = PCIe Sec 1 lane errors 0
    ecap 000b[280] = Vendor [1] ID 0004 Rev 2 Length 24

pcib2@pci0:0:1:1:	class=0x060400 rev=0x07 hdr=0x01 vendor=0x8086 device=0x3c03 subvendor=0x1043 subdevice=0x84ef
    vendor     = 'Intel Corporation'
    device     = 'Xeon E5/Core i7 IIO PCI Express Root Port 1b'
    class      = bridge
    subclass   = PCI-PCI
    cap 0d[40] = PCI Bridge subvendor=0x1043 subdevice=0x84ef
    cap 05[60] = MSI supports 2 messages, vector masks 
    cap 10[90] = PCI-Express 2 root port max data 128(256) ARI disabled
                 max read 128
                 link x0(x4) speed 0.0(8.0)
                 slot 2 power limit 25000 mW
    cap 01[e0] = powerspec 3  supports D0 D3  current D0
    ecap 000b[100] = Vendor [1] ID 0002 Rev 0 Length 12
    ecap 000d[110] = ACS 1
    ecap 0001[148] = AER 1 0 fatal 0 non-fatal 0 corrected
    ecap 000b[1d0] = Vendor [1] ID 0003 Rev 1 Length 10
    ecap 0019[250] = PCIe Sec 1 lane errors 0
    ecap 000b[280] = Vendor [1] ID 0004 Rev 2 Length 24

pcib3@pci0:0:2:0:	class=0x060400 rev=0x07 hdr=0x01 vendor=0x8086 device=0x3c04 subvendor=0x1043 subdevice=0x84ef
    vendor     = 'Intel Corporation'
    device     = 'Xeon E5/Core i7 IIO PCI Express Root Port 2a'
    class      = bridge
    subclass   = PCI-PCI
    cap 0d[40] = PCI Bridge subvendor=0x1043 subdevice=0x84ef
    cap 05[60] = MSI supports 2 messages, vector masks 
    cap 10[90] = PCI-Express 2 root port max data 256(256) ARI disabled
                 max read 128
                 link x8(x8) speed 2.5(8.0)
                 slot 4 power limit 25000 mW
    cap 01[e0] = powerspec 3  supports D0 D3  current D0
    ecap 000b[100] = Vendor [1] ID 0002 Rev 0 Length 12
    ecap 000d[110] = ACS 1
    ecap 0001[148] = AER 1 0 fatal 0 non-fatal 0 corrected
    ecap 000b[1d0] = Vendor [1] ID 0003 Rev 1 Length 10
    ecap 0019[250] = PCIe Sec 1 lane errors 0
    ecap 000b[280] = Vendor [1] ID 0004 Rev 2 Length 24

pcib4@pci0:0:2:2:	class=0x060400 rev=0x07 hdr=0x01 vendor=0x8086 device=0x3c06 subvendor=0x1043 subdevice=0x84ef
    vendor     = 'Intel Corporation'
    device     = 'Xeon E5/Core i7 IIO PCI Express Root Port 2c'
    class      = bridge
    subclass   = PCI-PCI
    cap 0d[40] = PCI Bridge subvendor=0x1043 subdevice=0x84ef
    cap 05[60] = MSI supports 2 messages, vector masks 
    cap 10[90] = PCI-Express 2 root port max data 256(256) ARI enabled
                 max read 128
                 link x8(x8) speed 5.0(8.0)
                 slot 5 power limit 25000 mW
    cap 01[e0] = powerspec 3  supports D0 D3  current D0
    ecap 000b[100] = Vendor [1] ID 0002 Rev 0 Length 12
    ecap 000d[110] = ACS 1
    ecap 0001[148] = AER 1 0 fatal 0 non-fatal 0 corrected
    ecap 000b[1d0] = Vendor [1] ID 0003 Rev 1 Length 10
    ecap 0019[250] = PCIe Sec 1 lane errors 0
    ecap 000b[280] = Vendor [1] ID 0004 Rev 2 Length 24

pcib5@pci0:0:3:0:	class=0x060400 rev=0x07 hdr=0x01 vendor=0x8086 device=0x3c08 subvendor=0x1043 subdevice=0x84ef
    vendor     = 'Intel Corporation'
    device     = 'Xeon E5/Core i7 IIO PCI Express Root Port 3a in PCI Express Mode'
    class      = bridge
    subclass   = PCI-PCI
    cap 0d[40] = PCI Bridge subvendor=0x1043 subdevice=0x84ef
    cap 05[60] = MSI supports 2 messages, vector masks 
    cap 10[90] = PCI-Express 2 root port max data 256(256) ARI enabled
                 max read 128
                 link x8(x16) speed 5.0(8.0)
                 slot 3 power limit 75000 mW
    cap 01[e0] = powerspec 3  supports D0 D3  current D0
    ecap 000b[100] = Vendor [1] ID 0002 Rev 0 Length 12
    ecap 000d[110] = ACS 1
    ecap 0001[148] = AER 1 0 fatal 0 non-fatal 0 corrected
    ecap 000b[1d0] = Vendor [1] ID 0003 Rev 1 Length 10
    ecap 0019[250] = PCIe Sec 1 lane errors 0
    ecap 000b[280] = Vendor [1] ID 0004 Rev 2 Length 24

none0@pci0:0:5:0:	class=0x088000 rev=0x07 hdr=0x00 vendor=0x8086 device=0x3c28 subvendor=0x1043 subdevice=0x84ef
    vendor     = 'Intel Corporation'
    device     = 'Xeon E5/Core i7 Address Map, VTd_Misc, System Management'
    class      = base peripheral
    cap 10[40] = PCI-Express 2 root endpoint max data 128(128)
                 max read 128

none1@pci0:0:5:2:	class=0x088000 rev=0x07 hdr=0x00 vendor=0x8086 device=0x3c2a subvendor=0x1043 subdevice=0x84ef
    vendor     = 'Intel Corporation'
    device     = 'Xeon E5/Core i7 Control Status and Global Errors'
    class      = base peripheral
    cap 10[40] = PCI-Express 2 root endpoint max data 128(128) RO NS
                 max read 128

ioapic0@pci0:0:5:4:	class=0x080020 rev=0x07 hdr=0x00 vendor=0x8086 device=0x3c2c subvendor=0x1043 subdevice=0x84ef
    vendor     = 'Intel Corporation'
    device     = 'Xeon E5/Core i7 I/O APIC'
    class      = base peripheral
    subclass   = interrupt controller
    bar   [10] = type Memory, range 32, base 0xfbf25000, size 4096, enabled
    cap 01[6c] = powerspec 3  supports D0 D3  current D0

pcib6@pci0:0:17:0:	class=0x060400 rev=0x06 hdr=0x01 vendor=0x8086 device=0x1d3e subvendor=0x1043 subdevice=0x84ef
    vendor     = 'Intel Corporation'
    device     = 'C600/X79 series chipset PCI Express Virtual Root Port'
    class      = bridge
    subclass   = PCI-PCI
    cap 10[40] = PCI-Express 2 root port max data 128(128) ARI disabled
                 max read 128
                 link x1(x1) speed 2.5(2.5) ASPM disabled(L0s/L1)
    cap 01[80] = powerspec 3  supports D0 D3  current D0
    cap 0d[88] = PCI Bridge subvendor=0x1043 subdevice=0x84ef
    cap 05[90] = MSI supports 1 message 
    ecap 0001[100] = AER 1 0 fatal 0 non-fatal 0 corrected
    ecap 000d[138] = ACS 1

none2@pci0:0:22:0:	class=0x078000 rev=0x05 hdr=0x00 vendor=0x8086 device=0x1d3a subvendor=0x1043 subdevice=0x84ef
    vendor     = 'Intel Corporation'
    device     = 'C600/X79 series chipset MEI Controller'
    class      = simple comms
    bar   [10] = type Memory, range 64, base 0xfbf24000, size 16, enabled
    cap 01[50] = powerspec 3  supports D0 D3  current D0
    cap 05[8c] = MSI supports 1 message, 64 bit 

em0@pci0:0:25:0:	class=0x020000 rev=0x06 hdr=0x00 vendor=0x8086 device=0x1503 subvendor=0x1043 subdevice=0x844e
    vendor     = 'Intel Corporation'
    device     = '82579V Gigabit Network Connection'
    class      = network
    subclass   = ethernet
    bar   [10] = type Memory, range 32, base 0xfbf00000, size 131072, enabled
    bar   [14] = type Memory, range 32, base 0xfbf23000, size 4096, enabled
    bar   [18] = type I/O Port, range 32, base 0xf040, size 32, enabled
    cap 01[c8] = powerspec 2  supports D0 D3  current D0
    cap 05[d0] = MSI supports 1 message, 64 bit enabled with 1 message
    cap 13[e0] = PCI Advanced Features: FLR TP

ehci0@pci0:0:26:0:	class=0x0c0320 rev=0x06 hdr=0x00 vendor=0x8086 device=0x1d2d subvendor=0x1043 subdevice=0x84ef
    vendor     = 'Intel Corporation'
    device     = 'C600/X79 series chipset USB2 Enhanced Host Controller'
    class      = serial bus
    subclass   = USB
    bar   [10] = type Memory, range 32, base 0xfbf22000, size 1024, enabled
    cap 01[50] = powerspec 2  supports D0 D3  current D0
    cap 0a[58] = EHCI Debug Port at offset 0xa0 in map 0x14
    cap 13[98] = PCI Advanced Features: FLR TP

pcib7@pci0:0:28:0:	class=0x060400 rev=0xb6 hdr=0x01 vendor=0x8086 device=0x1d10 subvendor=0x1043 subdevice=0x84ef
    vendor     = 'Intel Corporation'
    device     = 'C600/X79 series chipset PCI Express Root Port 1'
    class      = bridge
    subclass   = PCI-PCI
    cap 10[40] = PCI-Express 2 root port max data 128(128)
                 max read 128
                 link x0(x1) speed 0.0(5.0) ASPM disabled(L0s/L1)
                 slot 0 power limit 100 mW
    cap 05[80] = MSI supports 1 message 
    cap 0d[90] = PCI Bridge subvendor=0x1043 subdevice=0x84ef
    cap 01[a0] = powerspec 2  supports D0 D3  current D0

pcib8@pci0:0:28:2:	class=0x060400 rev=0xb6 hdr=0x01 vendor=0x8086 device=0x1d14 subvendor=0x1043 subdevice=0x84ef
    vendor     = 'Intel Corporation'
    device     = 'C600/X79 series chipset PCI Express Root Port 3'
    class      = bridge
    subclass   = PCI-PCI
    cap 10[40] = PCI-Express 2 root port max data 128(128)
                 max read 128
                 link x1(x1) speed 5.0(5.0) ASPM disabled(L0s/L1)
                 slot 2 power limit 100 mW
    cap 05[80] = MSI supports 1 message 
    cap 0d[90] = PCI Bridge subvendor=0x1043 subdevice=0x84ef
    cap 01[a0] = powerspec 2  supports D0 D3  current D0

pcib9@pci0:0:28:4:	class=0x060400 rev=0xb6 hdr=0x01 vendor=0x8086 device=0x1d18 subvendor=0x1043 subdevice=0x84ef
    vendor     = 'Intel Corporation'
    device     = 'C600/X79 series chipset PCI Express Root Port 5'
    class      = bridge
    subclass   = PCI-PCI
    cap 10[40] = PCI-Express 2 root port max data 128(128)
                 max read 128
                 link x1(x1) speed 5.0(5.0) ASPM disabled(L0s/L1)
                 slot 4 power limit 100 mW
    cap 05[80] = MSI supports 1 message 
    cap 0d[90] = PCI Bridge subvendor=0x1043 subdevice=0x84ef
    cap 01[a0] = powerspec 2  supports D0 D3  current D0

pcib10@pci0:0:28:5:	class=0x060400 rev=0xb6 hdr=0x01 vendor=0x8086 device=0x1d1a subvendor=0x1043 subdevice=0x84ef
    vendor     = 'Intel Corporation'
    device     = 'C600/X79 series chipset PCI Express Root Port 6'
    class      = bridge
    subclass   = PCI-PCI
    cap 10[40] = PCI-Express 2 root port max data 128(128)
                 max read 128
                 link x1(x1) speed 5.0(5.0) ASPM disabled(L0s/L1)
                 slot 5 power limit 100 mW
    cap 05[80] = MSI supports 1 message 
    cap 0d[90] = PCI Bridge subvendor=0x1043 subdevice=0x84ef
    cap 01[a0] = powerspec 2  supports D0 D3  current D0

pcib11@pci0:0:28:7:	class=0x060400 rev=0xb6 hdr=0x01 vendor=0x8086 device=0x1d1e subvendor=0x1043 subdevice=0x84ef
    vendor     = 'Intel Corporation'
    device     = 'C600/X79 series chipset PCI Express Root Port 8'
    class      = bridge
    subclass   = PCI-PCI
    cap 10[40] = PCI-Express 2 root port max data 128(128)
                 max read 128
                 link x1(x1) speed 2.5(5.0) ASPM disabled(L0s/L1)
                 slot 7 power limit 100 mW
    cap 05[80] = MSI supports 1 message 
    cap 0d[90] = PCI Bridge subvendor=0x1043 subdevice=0x84ef
    cap 01[a0] = powerspec 2  supports D0 D3  current D0

ehci1@pci0:0:29:0:	class=0x0c0320 rev=0x06 hdr=0x00 vendor=0x8086 device=0x1d26 subvendor=0x1043 subdevice=0x84ef
    vendor     = 'Intel Corporation'
    device     = 'C600/X79 series chipset USB2 Enhanced Host Controller'
    class      = serial bus
    subclass   = USB
    bar   [10] = type Memory, range 32, base 0xfbf21000, size 1024, enabled
    cap 01[50] = powerspec 2  supports D0 D3  current D0
    cap 0a[58] = EHCI Debug Port at offset 0xa0 in map 0x14
    cap 13[98] = PCI Advanced Features: FLR TP

pcib12@pci0:0:30:0:	class=0x060401 rev=0xa6 hdr=0x01 vendor=0x8086 device=0x244e subvendor=0x1043 subdevice=0x84ef
    vendor     = 'Intel Corporation'
    device     = '82801 PCI Bridge'
    class      = bridge
    subclass   = PCI-PCI
    cap 0d[50] = PCI Bridge subvendor=0x1043 subdevice=0x84ef

isab0@pci0:0:31:0:	class=0x060100 rev=0x06 hdr=0x00 vendor=0x8086 device=0x1d41 subvendor=0x1043 subdevice=0x84ef
    vendor     = 'Intel Corporation'
    device     = 'C600/X79 series chipset LPC Controller'
    class      = bridge
    subclass   = PCI-ISA
    cap 09[e0] = vendor (length 12) Intel cap 1 version 0
		 features: 4 PCI-e x1 slots

ahci1@pci0:0:31:2:	class=0x010601 rev=0x06 hdr=0x00 vendor=0x8086 device=0x1d02 subvendor=0x1043 subdevice=0x84ef
    vendor     = 'Intel Corporation'
    device     = 'C600/X79 series chipset 6-Port SATA AHCI Controller'
    class      = mass storage
    subclass   = SATA
    bar   [10] = type I/O Port, range 32, base 0xf090, size 8, enabled
    bar   [14] = type I/O Port, range 32, base 0xf080, size 4, enabled
    bar   [18] = type I/O Port, range 32, base 0xf070, size 8, enabled
    bar   [1c] = type I/O Port, range 32, base 0xf060, size 4, enabled
    bar   [20] = type I/O Port, range 32, base 0xf020, size 32, enabled
    bar   [24] = type Memory, range 32, base 0xfbf20000, size 2048, enabled
    cap 05[80] = MSI supports 1 message enabled with 1 message
    cap 01[70] = powerspec 3  supports D0 D3  current D0
    cap 12[a8] = SATA Index-Data Pair
    cap 13[b0] = PCI Advanced Features: FLR TP

ichsmb0@pci0:0:31:3:	class=0x0c0500 rev=0x06 hdr=0x00 vendor=0x8086 device=0x1d22 subvendor=0x1043 subdevice=0x84ef
    vendor     = 'Intel Corporation'
    device     = 'C600/X79 series chipset SMBus Host Controller'
    class      = serial bus
    subclass   = SMBus
    bar   [10] = type Memory, range 64, base 0x381ffff00000, size 256, enabled
    bar   [20] = type I/O Port, range 32, base 0xf000, size 32, enabled

vgapci0@pci0:1:0:0:	class=0x030000 rev=0x00 hdr=0x00 vendor=0x1002 device=0x68e1 subvendor=0x174b subdevice=0x6000
    vendor     = 'Advanced Micro Devices, Inc. [AMD/ATI]'
    device     = 'Park [Mobility Radeon HD 5430]'
    class      = display
    subclass   = VGA
    bar   [10] = type Prefetchable Memory, range 64, base 0xd0000000, size 268435456, enabled
    bar   [18] = type Memory, range 64, base 0xfbe20000, size 131072, enabled
    bar   [20] = type I/O Port, range 32, base 0xe000, size 256, enabled
    cap 01[50] = powerspec 3  supports D0 D1 D2 D3  current D0
    cap 10[58] = PCI-Express 2 legacy endpoint max data 256(256) NS
                 max read 512
                 link x8(x16) speed 2.5(2.5) ASPM disabled(L0s/L1)
    cap 05[a0] = MSI supports 1 message, 64 bit 
    ecap 000b[100] = Vendor [1] ID 0001 Rev 1 Length 16
    ecap 0001[150] = AER 1 0 fatal 1 non-fatal 1 corrected

hdac0@pci0:1:0:1:	class=0x040300 rev=0x00 hdr=0x00 vendor=0x1002 device=0xaa68 subvendor=0x174b subdevice=0xaa68
    vendor     = 'Advanced Micro Devices, Inc. [AMD/ATI]'
    device     = 'Cedar HDMI Audio [Radeon HD 5400/6300/7300 Series]'
    class      = multimedia
    subclass   = HDA
    bar   [10] = type Memory, range 64, base 0xfbe40000, size 16384, enabled
    cap 01[50] = powerspec 3  supports D0 D1 D2 D3  current D0
    cap 10[58] = PCI-Express 2 legacy endpoint max data 256(256) NS
                 max read 512
                 link x8(x16) speed 2.5(2.5) ASPM disabled(L0s/L1)
    cap 05[a0] = MSI supports 1 message, 64 bit enabled with 1 message
    ecap 000b[100] = Vendor [1] ID 0001 Rev 1 Length 16
    ecap 0001[150] = AER 1 0 fatal 1 non-fatal 1 corrected

mps0@pci0:2:0:0:	class=0x010700 rev=0x03 hdr=0x00 vendor=0x1000 device=0x0072 subvendor=0x1000 subdevice=0x3020
    vendor     = 'Broadcom / LSI'
    device     = 'SAS2008 PCI-Express Fusion-MPT SAS-2 [Falcon]'
    class      = mass storage
    subclass   = SAS
    bar   [10] = type I/O Port, range 32, base 0xd000, size 256, enabled
    bar   [14] = type Memory, range 64, base 0xfbdc0000, size 16384, enabled
    bar   [1c] = type Memory, range 64, base 0xfbd80000, size 262144, enabled
    cap 01[50] = powerspec 3  supports D0 D1 D2 D3  current D0
    cap 10[68] = PCI-Express 2 endpoint max data 256(4096) FLR NS
                 max read 512
                 link x8(x8) speed 5.0(5.0) ASPM disabled(L0s)
    cap 03[d0] = VPD
    cap 05[a8] = MSI supports 1 message, 64 bit 
    cap 11[c0] = MSI-X supports 15 messages, enabled
                 Table in map 0x14[0x2000], PBA in map 0x14[0x3800]
    ecap 0001[100] = AER 1 0 fatal 0 non-fatal 1 corrected
    ecap 0004[138] = Power Budgeting 1
    ecap 0010[150] = SR-IOV 1 IOV disabled, Memory Space disabled, ARI disabled
                     0 VFs configured out of 16 supported
                     First VF RID Offset 0x0001, VF RID Stride 0x0001
                     VF Device ID 0x0072
                     Page Sizes: 4096 (enabled), 8192, 65536, 262144, 1048576, 4194304
    ecap 000e[190] = ARI 1

mps1@pci0:3:0:0:	class=0x010700 rev=0x03 hdr=0x00 vendor=0x1000 device=0x0072 subvendor=0x1000 subdevice=0x3020
    vendor     = 'Broadcom / LSI'
    device     = 'SAS2008 PCI-Express Fusion-MPT SAS-2 [Falcon]'
    class      = mass storage
    subclass   = SAS
    bar   [10] = type I/O Port, range 32, base 0xc000, size 256, enabled
    bar   [14] = type Memory, range 64, base 0xfbcc0000, size 16384, enabled
    bar   [1c] = type Memory, range 64, base 0xfbc80000, size 262144, enabled
    cap 01[50] = powerspec 3  supports D0 D1 D2 D3  current D0
    cap 10[68] = PCI-Express 2 endpoint max data 256(4096) FLR NS
                 max read 512
                 link x8(x8) speed 5.0(5.0) ASPM disabled(L0s)
    cap 03[d0] = VPD
    cap 05[a8] = MSI supports 1 message, 64 bit 
    cap 11[c0] = MSI-X supports 15 messages, enabled
                 Table in map 0x14[0x2000], PBA in map 0x14[0x3800]
    ecap 0001[100] = AER 1 0 fatal 0 non-fatal 1 corrected
    ecap 0004[138] = Power Budgeting 1
    ecap 0010[150] = SR-IOV 1 IOV disabled, Memory Space disabled, ARI disabled
                     0 VFs configured out of 16 supported
                     First VF RID Offset 0x0001, VF RID Stride 0x0001
                     VF Device ID 0x0072
                     Page Sizes: 4096 (enabled), 8192, 65536, 262144, 1048576, 4194304
    ecap 000e[190] = ARI 1

ahci0@pci0:8:0:0:	class=0x010601 rev=0x11 hdr=0x00 vendor=0x1b4b device=0x9130 subvendor=0x1043 subdevice=0x8438
    vendor     = 'Marvell Technology Group Ltd.'
    device     = '88SE9128 PCIe SATA 6 Gb/s RAID controller with HyperDuo'
    class      = mass storage
    subclass   = SATA
    bar   [10] = type I/O Port, range 32, base 0xb040, size 8, enabled
    bar   [14] = type I/O Port, range 32, base 0xb030, size 4, enabled
    bar   [18] = type I/O Port, range 32, base 0xb020, size 8, enabled
    bar   [1c] = type I/O Port, range 32, base 0xb010, size 4, enabled
    bar   [20] = type I/O Port, range 32, base 0xb000, size 16, enabled
    bar   [24] = type Memory, range 32, base 0xfbb10000, size 2048, enabled
    cap 01[40] = powerspec 3  supports D0 D3  current D0
    cap 05[50] = MSI supports 1 message enabled with 1 message
    cap 10[70] = PCI-Express 2 legacy endpoint max data 128(512)
                 max read 512
                 link x1(x1) speed 5.0(5.0) ASPM disabled(L0s/L1)
    ecap 0001[100] = AER 1 0 fatal 0 non-fatal 0 corrected

xhci0@pci0:9:0:0:	class=0x0c0330 rev=0x00 hdr=0x00 vendor=0x1b21 device=0x1042 subvendor=0x1043 subdevice=0x8488
    vendor     = 'ASMedia Technology Inc.'
    device     = 'ASM1042 SuperSpeed USB Host Controller'
    class      = serial bus
    subclass   = USB
    bar   [10] = type Memory, range 64, base 0xfba00000, size 32768, enabled
    cap 05[50] = MSI supports 8 messages, 64 bit 
    cap 11[68] = MSI-X supports 8 messages, enabled
                 Table in map 0x10[0x2000], PBA in map 0x10[0x2080]
    cap 01[78] = powerspec 3  supports D0 D3  current D0
    cap 10[80] = PCI-Express 2 legacy endpoint max data 128(512) NS
                 max read 512
                 link x1(x1) speed 5.0(5.0) ASPM disabled(L0s/L1)
    ecap 0002[100] = VC 1 max VC0

xhci1@pci0:10:0:0:	class=0x0c0330 rev=0x00 hdr=0x00 vendor=0x1b21 device=0x1042 subvendor=0x1043 subdevice=0x8488
    vendor     = 'ASMedia Technology Inc.'
    device     = 'ASM1042 SuperSpeed USB Host Controller'
    class      = serial bus
    subclass   = USB
    bar   [10] = type Memory, range 64, base 0xfb900000, size 32768, enabled
    cap 05[50] = MSI supports 8 messages, 64 bit 
    cap 11[68] = MSI-X supports 8 messages, enabled
                 Table in map 0x10[0x2000], PBA in map 0x10[0x2080]
    cap 01[78] = powerspec 3  supports D0 D3  current D0
    cap 10[80] = PCI-Express 2 legacy endpoint max data 128(512) NS
                 max read 512
                 link x1(x1) speed 5.0(5.0) ASPM disabled(L0s/L1)
    ecap 0002[100] = VC 1 max VC0

em1@pci0:11:0:0:	class=0x020000 rev=0x00 hdr=0x00 vendor=0x8086 device=0x10d3 subvendor=0x1043 subdevice=0x8369
    vendor     = 'Intel Corporation'
    device     = '82574L Gigabit Network Connection'
    class      = network
    subclass   = ethernet
    bar   [10] = type Memory, range 32, base 0xfb800000, size 131072, enabled
    bar   [18] = type I/O Port, range 32, base 0xa000, size 32, enabled
    bar   [1c] = type Memory, range 32, base 0xfb820000, size 16384, enabled
    cap 01[c8] = powerspec 2  supports D0 D3  current D0
    cap 05[d0] = MSI supports 1 message, 64 bit 
    cap 10[e0] = PCI-Express 1 endpoint max data 128(256) NS
                 max read 512
                 link x1(x1) speed 2.5(2.5) ASPM disabled(L1)
    cap 11[a0] = MSI-X supports 5 messages, enabled
                 Table in map 0x1c[0x0], PBA in map 0x1c[0x2000]
    ecap 0001[100] = AER 1 0 fatal 0 non-fatal 0 corrected
    ecap 0003[140] = Serial 1 08606effff471e76

none3@pci0:255:8:0:	class=0x088000 rev=0x07 hdr=0x00 vendor=0x8086 device=0x3c80 subvendor=0x1043 subdevice=0x84ef
    vendor     = 'Intel Corporation'
    device     = 'Xeon E5/Core i7 QPI Link 0'
    class      = base peripheral

none4@pci0:255:8:3:	class=0x088000 rev=0x07 hdr=0x00 vendor=0x8086 device=0x3c83 subvendor=0x1043 subdevice=0x84ef
    vendor     = 'Intel Corporation'
    device     = 'Xeon E5/Core i7 QPI Link Reut 0'
    class      = base peripheral
    cap 10[40] = PCI-Express 1 root endpoint max data 128(128)
                 max read 128
    ecap 000b[100] = Vendor [0] ID 0001 Rev 0 Length 240

none5@pci0:255:8:4:	class=0x088000 rev=0x07 hdr=0x00 vendor=0x8086 device=0x3c84 subvendor=0x1043 subdevice=0x84ef
    vendor     = 'Intel Corporation'
    device     = 'Xeon E5/Core i7 QPI Link Reut 0'
    class      = base peripheral
    cap 10[40] = PCI-Express 1 root endpoint max data 128(128)
                 max read 128

none6@pci0:255:9:0:	class=0x088000 rev=0x07 hdr=0x00 vendor=0x8086 device=0x3c90 subvendor=0x1043 subdevice=0x84ef
    vendor     = 'Intel Corporation'
    device     = 'Xeon E5/Core i7 QPI Link 1'
    class      = base peripheral

none7@pci0:255:9:3:	class=0x088000 rev=0x07 hdr=0x00 vendor=0x8086 device=0x3c93 subvendor=0x1043 subdevice=0x84ef
    vendor     = 'Intel Corporation'
    device     = 'Xeon E5/Core i7 QPI Link Reut 1'
    class      = base peripheral
    cap 10[40] = PCI-Express 1 root endpoint max data 128(128)
                 max read 128
    ecap 000b[100] = Vendor [0] ID 0001 Rev 0 Length 240

none8@pci0:255:9:4:	class=0x088000 rev=0x07 hdr=0x00 vendor=0x8086 device=0x3c94 subvendor=0x1043 subdevice=0x84ef
    vendor     = 'Intel Corporation'
    device     = 'Xeon E5/Core i7 QPI Link Reut 1'
    class      = base peripheral
    cap 10[40] = PCI-Express 1 root endpoint max data 128(128)
                 max read 128

none9@pci0:255:10:0:	class=0x088000 rev=0x07 hdr=0x00 vendor=0x8086 device=0x3cc0 subvendor=0x1043 subdevice=0x84ef
    vendor     = 'Intel Corporation'
    device     = 'Xeon E5/Core i7 Power Control Unit 0'
    class      = base peripheral

none10@pci0:255:10:1:	class=0x088000 rev=0x07 hdr=0x00 vendor=0x8086 device=0x3cc1 subvendor=0x1043 subdevice=0x84ef
    vendor     = 'Intel Corporation'
    device     = 'Xeon E5/Core i7 Power Control Unit 1'
    class      = base peripheral

none11@pci0:255:10:2:	class=0x088000 rev=0x07 hdr=0x00 vendor=0x8086 device=0x3cc2 subvendor=0x1043 subdevice=0x84ef
    vendor     = 'Intel Corporation'
    device     = 'Xeon E5/Core i7 Power Control Unit 2'
    class      = base peripheral

none12@pci0:255:10:3:	class=0x088000 rev=0x07 hdr=0x00 vendor=0x8086 device=0x3cd0 subvendor=0x1043 subdevice=0x84ef
    vendor     = 'Intel Corporation'
    device     = 'Xeon E5/Core i7 Power Control Unit 3'
    class      = base peripheral

none13@pci0:255:11:0:	class=0x088000 rev=0x07 hdr=0x00 vendor=0x8086 device=0x3ce0 subvendor=0x1043 subdevice=0x84ef
    vendor     = 'Intel Corporation'
    device     = 'Xeon E5/Core i7 Interrupt Control Registers'
    class      = base peripheral

none14@pci0:255:11:3:	class=0x088000 rev=0x07 hdr=0x00 vendor=0x8086 device=0x3ce3 subvendor=0x1043 subdevice=0x84ef
    vendor     = 'Intel Corporation'
    device     = 'Xeon E5/Core i7 Semaphore and Scratchpad Configuration Registers'
    class      = base peripheral

none15@pci0:255:12:0:	class=0x088000 rev=0x07 hdr=0x00 vendor=0x8086 device=0x3ce8 subvendor=0x1043 subdevice=0x84ef
    vendor     = 'Intel Corporation'
    device     = 'Xeon E5/Core i7 Unicast Register 0'
    class      = base peripheral

none16@pci0:255:12:1:	class=0x088000 rev=0x07 hdr=0x00 vendor=0x8086 device=0x3ce8 subvendor=0x1043 subdevice=0x84ef
    vendor     = 'Intel Corporation'
    device     = 'Xeon E5/Core i7 Unicast Register 0'
    class      = base peripheral

none17@pci0:255:12:6:	class=0x088000 rev=0x07 hdr=0x00 vendor=0x8086 device=0x3cf4 subvendor=0x1043 subdevice=0x84ef
    vendor     = 'Intel Corporation'
    device     = 'Xeon E5/Core i7 Integrated Memory Controller System Address Decoder 0'
    class      = base peripheral

none18@pci0:255:12:7:	class=0x088000 rev=0x07 hdr=0x00 vendor=0x8086 device=0x3cf6 subvendor=0x1043 subdevice=0x84ef
    vendor     = 'Intel Corporation'
    device     = 'Xeon E5/Core i7 System Address Decoder'
    class      = base peripheral

none19@pci0:255:13:0:	class=0x088000 rev=0x07 hdr=0x00 vendor=0x8086 device=0x3ce8 subvendor=0x1043 subdevice=0x84ef
    vendor     = 'Intel Corporation'
    device     = 'Xeon E5/Core i7 Unicast Register 0'
    class      = base peripheral

none20@pci0:255:13:1:	class=0x088000 rev=0x07 hdr=0x00 vendor=0x8086 device=0x3ce8 subvendor=0x1043 subdevice=0x84ef
    vendor     = 'Intel Corporation'
    device     = 'Xeon E5/Core i7 Unicast Register 0'
    class      = base peripheral

none21@pci0:255:13:6:	class=0x088000 rev=0x07 hdr=0x00 vendor=0x8086 device=0x3cf5 subvendor=0x1043 subdevice=0x84ef
    vendor     = 'Intel Corporation'
    device     = 'Xeon E5/Core i7 Integrated Memory Controller System Address Decoder 1'
    class      = base peripheral

none22@pci0:255:14:0:	class=0x088000 rev=0x07 hdr=0x00 vendor=0x8086 device=0x3ca0 subvendor=0x1043 subdevice=0x84ef
    vendor     = 'Intel Corporation'
    device     = 'Xeon E5/Core i7 Processor Home Agent'
    class      = base peripheral

none23@pci0:255:14:1:	class=0x110100 rev=0x07 hdr=0x00 vendor=0x8086 device=0x3c46 subvendor=0x1043 subdevice=0x84ef
    vendor     = 'Intel Corporation'
    device     = 'Xeon E5/Core i7 Processor Home Agent Performance Monitoring'
    class      = dasp
    subclass   = performance counters

none24@pci0:255:15:0:	class=0x088000 rev=0x07 hdr=0x00 vendor=0x8086 device=0x3ca8 subvendor=0x1043 subdevice=0x84ef
    vendor     = 'Intel Corporation'
    device     = 'Xeon E5/Core i7 Integrated Memory Controller Registers'
    class      = base peripheral
    cap 10[40] = PCI-Express 1 root endpoint max data 128(128)
                 max read 128

none25@pci0:255:15:1:	class=0x088000 rev=0x07 hdr=0x00 vendor=0x8086 device=0x3c71 subvendor=0x1043 subdevice=0x84ef
    vendor     = 'Intel Corporation'
    device     = 'Xeon E5/Core i7 Integrated Memory Controller RAS Registers'
    class      = base peripheral
    cap 10[40] = PCI-Express 1 root endpoint max data 128(128)
                 max read 128

none26@pci0:255:15:2:	class=0x088000 rev=0x07 hdr=0x00 vendor=0x8086 device=0x3caa subvendor=0x1043 subdevice=0x84ef
    vendor     = 'Intel Corporation'
    device     = 'Xeon E5/Core i7 Integrated Memory Controller Target Address Decoder 0'
    class      = base peripheral
    cap 10[40] = PCI-Express 1 root endpoint max data 128(128)
                 max read 128

none27@pci0:255:15:3:	class=0x088000 rev=0x07 hdr=0x00 vendor=0x8086 device=0x3cab subvendor=0x1043 subdevice=0x84ef
    vendor     = 'Intel Corporation'
    device     = 'Xeon E5/Core i7 Integrated Memory Controller Target Address Decoder 1'
    class      = base peripheral
    cap 10[40] = PCI-Express 1 root endpoint max data 128(128)
                 max read 128

none28@pci0:255:15:4:	class=0x088000 rev=0x07 hdr=0x00 vendor=0x8086 device=0x3cac subvendor=0x1043 subdevice=0x84ef
    vendor     = 'Intel Corporation'
    device     = 'Xeon E5/Core i7 Integrated Memory Controller Target Address Decoder 2'
    class      = base peripheral
    cap 10[40] = PCI-Express 1 root endpoint max data 128(128)
                 max read 128

none29@pci0:255:15:5:	class=0x088000 rev=0x07 hdr=0x00 vendor=0x8086 device=0x3cad subvendor=0x1043 subdevice=0x84ef
    vendor     = 'Intel Corporation'
    device     = 'Xeon E5/Core i7 Integrated Memory Controller Target Address Decoder 3'
    class      = base peripheral
    cap 10[40] = PCI-Express 1 root endpoint max data 128(128)
                 max read 128

none30@pci0:255:15:6:	class=0x088000 rev=0x07 hdr=0x00 vendor=0x8086 device=0x3cae subvendor=0x1043 subdevice=0x84ef
    vendor     = 'Intel Corporation'
    device     = 'Xeon E5/Core i7 Integrated Memory Controller Target Address Decoder 4'
    class      = base peripheral

none31@pci0:255:16:0:	class=0x088000 rev=0x07 hdr=0x00 vendor=0x8086 device=0x3cb0 subvendor=0x1043 subdevice=0x84ef
    vendor     = 'Intel Corporation'
    device     = 'Xeon E5/Core i7 Integrated Memory Controller Channel 0-3 Thermal Control 0'
    class      = base peripheral
    cap 10[40] = PCI-Express 1 root endpoint max data 128(128)
                 max read 128

none32@pci0:255:16:1:	class=0x088000 rev=0x07 hdr=0x00 vendor=0x8086 device=0x3cb1 subvendor=0x1043 subdevice=0x84ef
    vendor     = 'Intel Corporation'
    device     = 'Xeon E5/Core i7 Integrated Memory Controller Channel 0-3 Thermal Control 1'
    class      = base peripheral
    cap 10[40] = PCI-Express 1 root endpoint max data 128(128)
                 max read 128

none33@pci0:255:16:2:	class=0x088000 rev=0x07 hdr=0x00 vendor=0x8086 device=0x3cb2 subvendor=0x1043 subdevice=0x84ef
    vendor     = 'Intel Corporation'
    device     = 'Xeon E5/Core i7 Integrated Memory Controller ERROR Registers 0'
    class      = base peripheral
    cap 10[40] = PCI-Express 1 root endpoint max data 128(128)
                 max read 128

none34@pci0:255:16:3:	class=0x088000 rev=0x07 hdr=0x00 vendor=0x8086 device=0x3cb3 subvendor=0x1043 subdevice=0x84ef
    vendor     = 'Intel Corporation'
    device     = 'Xeon E5/Core i7 Integrated Memory Controller ERROR Registers 1'
    class      = base peripheral
    cap 10[40] = PCI-Express 1 root endpoint max data 128(128)
                 max read 128

none35@pci0:255:16:4:	class=0x088000 rev=0x07 hdr=0x00 vendor=0x8086 device=0x3cb4 subvendor=0x1043 subdevice=0x84ef
    vendor     = 'Intel Corporation'
    device     = 'Xeon E5/Core i7 Integrated Memory Controller Channel 0-3 Thermal Control 2'
    class      = base peripheral
    cap 10[40] = PCI-Express 1 root endpoint max data 128(128)
                 max read 128

none36@pci0:255:16:5:	class=0x088000 rev=0x07 hdr=0x00 vendor=0x8086 device=0x3cb5 subvendor=0x1043 subdevice=0x84ef
    vendor     = 'Intel Corporation'
    device     = 'Xeon E5/Core i7 Integrated Memory Controller Channel 0-3 Thermal Control 3'
    class      = base peripheral
    cap 10[40] = PCI-Express 1 root endpoint max data 128(128)
                 max read 128

none37@pci0:255:16:6:	class=0x088000 rev=0x07 hdr=0x00 vendor=0x8086 device=0x3cb6 subvendor=0x1043 subdevice=0x84ef
    vendor     = 'Intel Corporation'
    device     = 'Xeon E5/Core i7 Integrated Memory Controller ERROR Registers 2'
    class      = base peripheral
    cap 10[40] = PCI-Express 1 root endpoint max data 128(128)
                 max read 128

none38@pci0:255:16:7:	class=0x088000 rev=0x07 hdr=0x00 vendor=0x8086 device=0x3cb7 subvendor=0x1043 subdevice=0x84ef
    vendor     = 'Intel Corporation'
    device     = 'Xeon E5/Core i7 Integrated Memory Controller ERROR Registers 3'
    class      = base peripheral
    cap 10[40] = PCI-Express 1 root endpoint max data 128(128)
                 max read 128

none39@pci0:255:17:0:	class=0x088000 rev=0x07 hdr=0x00 vendor=0x8086 device=0x3cb8 subvendor=0x1043 subdevice=0x84ef
    vendor     = 'Intel Corporation'
    device     = 'Xeon E5/Core i7 DDRIO'
    class      = base peripheral

none40@pci0:255:19:0:	class=0x088000 rev=0x07 hdr=0x00 vendor=0x8086 device=0x3ce4 subvendor=0x1043 subdevice=0x84ef
    vendor     = 'Intel Corporation'
    device     = 'Xeon E5/Core i7 R2PCIe'
    class      = base peripheral

none41@pci0:255:19:1:	class=0x110100 rev=0x07 hdr=0x00 vendor=0x8086 device=0x3c43 subvendor=0x1043 subdevice=0x84ef
    vendor     = 'Intel Corporation'
    device     = 'Xeon E5/Core i7 Ring to PCI Express Performance Monitor'
    class      = dasp
    subclass   = performance counters

none42@pci0:255:19:4:	class=0x110100 rev=0x07 hdr=0x00 vendor=0x8086 device=0x3ce6 subvendor=0x1043 subdevice=0x84ef
    vendor     = 'Intel Corporation'
    device     = 'Xeon E5/Core i7 QuickPath Interconnect Agent Ring Registers'
    class      = dasp
    subclass   = performance counters

none43@pci0:255:19:5:	class=0x110100 rev=0x07 hdr=0x00 vendor=0x8086 device=0x3c44 subvendor=0x1043 subdevice=0x84ef
    vendor     = 'Intel Corporation'
    device     = 'Xeon E5/Core i7 Ring to QuickPath Interconnect Link 0 Performance Monitor'
    class      = dasp
    subclass   = performance counters

none44@pci0:255:19:6:	class=0x088000 rev=0x07 hdr=0x00 vendor=0x8086 device=0x3c45 subvendor=0x1043 subdevice=0x84ef
    vendor     = 'Intel Corporation'
    device     = 'Xeon E5/Core i7 Ring to QuickPath Interconnect Link 1 Performance Monitor'
    class      = base peripheral
