hostb0@pci0:0:0:0:	class=0x060000 rev=0x05 hdr=0x00 vendor=0x8086 device=0x591f subvendor=0x1028 subdevice=0x07a2
    vendor     = 'Intel Corporation'
    device     = 'Xeon E3-1200 v6/7th Gen Core Processor Host Bridge/DRAM Registers'
    class      = bridge
    subclass   = HOST-PCI
    cap 09[e0] = vendor (length 16) Intel cap 0 version 1

pcib1@pci0:0:1:0:	class=0x060400 rev=0x05 hdr=0x01 vendor=0x8086 device=0x1901 subvendor=0x1028 subdevice=0x07a2
    vendor     = 'Intel Corporation'
    device     = '6th-10th Gen Core Processor PCIe Controller (x16)'
    class      = bridge
    subclass   = PCI-PCI
    cap 0d[88] = PCI Bridge subvendor=0x1028 subdevice=0x07a2
    cap 01[80] = powerspec 3  supports D0 D3  current D0
    cap 05[90] = MSI supports 1 message 
    cap 10[a0] = PCI-Express 2 root port max data 256(256)
                 max read 128
                 link x8(x16) speed 8.0(8.0) ASPM disabled(L0s/L1)
                 slot 2 power limit 75000 mW
    ecap 0002[100] = VC 1 max VC0
    ecap 0005[140] = Root Complex Link Declaration 1
    ecap 0019[d94] = PCIe Sec 1 lane errors 0

vgapci0@pci0:0:2:0:	class=0x030000 rev=0x04 hdr=0x00 vendor=0x8086 device=0x5912 subvendor=0x1028 subdevice=0x07a2
    vendor     = 'Intel Corporation'
    device     = 'HD Graphics 630'
    class      = display
    subclass   = VGA
    bar   [10] = type Memory, range 64, base 0xf5000000, size 16777216, enabled
    bar   [18] = type Prefetchable Memory, range 64, base 0xe0000000, size 268435456, enabled
    bar   [20] = type I/O Port, range 32, base 0xf000, size 64, enabled
    cap 09[40] = vendor (length 12) Intel cap 0 version 1
    cap 10[70] = PCI-Express 2 root endpoint max data 128(128) FLR
                 max read 128
    cap 05[ac] = MSI supports 1 message 
    cap 01[d0] = powerspec 2  supports D0 D3  current D0
    ecap 001b[100] = Process Address Space ID 1
    ecap 000f[200] = ATS 1
    ecap 0013[300] = Page Page Request 1

xhci0@pci0:0:20:0:	class=0x0c0330 rev=0x00 hdr=0x00 vendor=0x8086 device=0xa2af subvendor=0x1028 subdevice=0x07a2
    vendor     = 'Intel Corporation'
    device     = '200 Series/Z370 Chipset Family USB 3.0 xHCI Controller'
    class      = serial bus
    subclass   = USB
    bar   [10] = type Memory, range 64, base 0xf7a30000, size 65536, enabled
    cap 01[70] = powerspec 2  supports D0 D3  current D0
    cap 05[80] = MSI supports 8 messages, 64 bit enabled with 1 message

none0@pci0:0:20:2:	class=0x118000 rev=0x00 hdr=0x00 vendor=0x8086 device=0xa2b1 subvendor=0x1028 subdevice=0x07a2
    vendor     = 'Intel Corporation'
    device     = '200 Series PCH Thermal Subsystem'
    class      = dasp
    bar   [10] = type Memory, range 64, base 0xf7a4f000, size 4096, enabled
    cap 01[50] = powerspec 3  supports D0 D3  current D0
    cap 05[80] = MSI supports 1 message 

none1@pci0:0:22:0:	class=0x078000 rev=0x00 hdr=0x00 vendor=0x8086 device=0xa2ba subvendor=0x1028 subdevice=0x07a2
    vendor     = 'Intel Corporation'
    device     = '200 Series PCH CSME HECI'
    class      = simple comms
    bar   [10] = type Memory, range 64, base 0xf7a4e000, size 4096, enabled
    cap 01[50] = powerspec 3  supports D0 D3  current D0
    cap 05[8c] = MSI supports 1 message, 64 bit 

none2@pci0:0:22:3:	class=0x070002 rev=0x00 hdr=0x00 vendor=0x8086 device=0xa2bd subvendor=0x1028 subdevice=0x07a2
    vendor     = 'Intel Corporation'
    class      = simple comms
    subclass   = UART
    bar   [10] = type I/O Port, range 32, base 0xf0a0, size 8, enabled
    bar   [14] = type Memory, range 32, base 0xf7a4d000, size 4096, enabled
    cap 05[40] = MSI supports 1 message, 64 bit 
    cap 01[50] = powerspec 3  supports D0 D3  current D0

ahci0@pci0:0:23:0:	class=0x010601 rev=0x00 hdr=0x00 vendor=0x8086 device=0xa282 subvendor=0x1028 subdevice=0x07a2
    vendor     = 'Intel Corporation'
    device     = '200 Series PCH SATA controller [AHCI mode]'
    class      = mass storage
    subclass   = SATA
    bar   [10] = type Memory, range 32, base 0xf7a48000, size 8192, enabled
    bar   [14] = type Memory, range 32, base 0xf7a4c000, size 256, enabled
    bar   [18] = type I/O Port, range 32, base 0xf090, size 8, enabled
    bar   [1c] = type I/O Port, range 32, base 0xf080, size 4, enabled
    bar   [20] = type I/O Port, range 32, base 0xf060, size 32, enabled
    bar   [24] = type Memory, range 32, base 0xf7a4b000, size 2048, enabled
    cap 05[80] = MSI supports 1 message enabled with 1 message
    cap 01[70] = powerspec 3  supports D0 D3  current D0
    cap 12[a8] = SATA Index-Data Pair

pcib2@pci0:0:27:0:	class=0x060400 rev=0xf0 hdr=0x01 vendor=0x8086 device=0xa2e7 subvendor=0x1028 subdevice=0x07a2
    vendor     = 'Intel Corporation'
    device     = '200 Series PCH PCI Express Root Port'
    class      = bridge
    subclass   = PCI-PCI
    cap 10[40] = PCI-Express 2 root port max data 128(256) ARI disabled
                 max read 128
                 link x2(x4) speed 8.0(8.0)
                 slot 3 power limit 250 mW
    cap 05[80] = MSI supports 1 message 
    cap 0d[90] = PCI Bridge subvendor=0x1028 subdevice=0x07a2
    cap 01[a0] = powerspec 3  supports D0 D3  current D0
    ecap 0001[100] = AER 1 0 fatal 0 non-fatal 0 corrected
    ecap 000d[140] = ACS 1
    ecap 0019[220] = PCIe Sec 1 lane errors 0

isab0@pci0:0:31:0:	class=0x060100 rev=0x00 hdr=0x00 vendor=0x8086 device=0xa2c6 subvendor=0x1028 subdevice=0x07a2
    vendor     = 'Intel Corporation'
    device     = '200 Series PCH LPC Controller (Q270)'
    class      = bridge
    subclass   = PCI-ISA

none3@pci0:0:31:2:	class=0x058000 rev=0x00 hdr=0x00 vendor=0x8086 device=0xa2a1 subvendor=0x1028 subdevice=0x07a2
    vendor     = 'Intel Corporation'
    device     = '200 Series/Z370 Chipset Family Power Management Controller'
    class      = memory
    bar   [10] = type Memory, range 32, base 0xf7a44000, size 16384, enabled

hdac0@pci0:0:31:3:	class=0x040300 rev=0x00 hdr=0x00 vendor=0x8086 device=0xa2f0 subvendor=0x1028 subdevice=0x07a2
    vendor     = 'Intel Corporation'
    device     = '200 Series PCH HD Audio'
    class      = multimedia
    subclass   = HDA
    bar   [10] = type Memory, range 64, base 0xf7a40000, size 16384, enabled
    bar   [20] = type Memory, range 64, base 0xf7a20000, size 65536, enabled
    cap 01[50] = powerspec 3  supports D0 D3  current D0
    cap 05[60] = MSI supports 1 message, 64 bit enabled with 1 message

ichsmb0@pci0:0:31:4:	class=0x0c0500 rev=0x00 hdr=0x00 vendor=0x8086 device=0xa2a3 subvendor=0x1028 subdevice=0x07a2
    vendor     = 'Intel Corporation'
    device     = '200 Series/Z370 Chipset Family SMBus Controller'
    class      = serial bus
    subclass   = SMBus
    bar   [10] = type Memory, range 64, base 0xf7a4a000, size 256, enabled
    bar   [20] = type I/O Port, range 32, base 0xf040, size 32, enabled

em0@pci0:0:31:6:	class=0x020000 rev=0x00 hdr=0x00 vendor=0x8086 device=0x15d6 subvendor=0x1028 subdevice=0x07a2
    vendor     = 'Intel Corporation'
    device     = 'Ethernet Connection (5) I219-V'
    class      = network
    subclass   = ethernet
    bar   [10] = type Memory, range 32, base 0xf7a00000, size 131072, enabled
    cap 01[c8] = powerspec 3  supports D0 D3  current D0
    cap 05[d0] = MSI supports 1 message, 64 bit enabled with 1 message
    cap 13[e0] = PCI Advanced Features: FLR TP

t5iov0@pci0:1:0:0:	class=0x020000 rev=0x00 hdr=0x00 vendor=0x1425 device=0x5001 subvendor=0x1425 subdevice=0x0000
    vendor     = 'Chelsio Communications Inc'
    device     = 'T520-CR Unified Wire Ethernet Controller'
    class      = network
    subclass   = ethernet
    bar   [10] = type Memory, range 64, base 0xf7800000, size 524288, enabled
    bar   [18] = type Memory, range 64, base 0xf7780000, size 524288, enabled
    bar   [20] = type Memory, range 64, base 0xf788c000, size 8192, enabled
    cap 01[40] = powerspec 3  supports D0 D3  current D0
    cap 05[50] = MSI supports 8 messages, 64 bit, vector masks 
    cap 10[70] = PCI-Express 2 endpoint max data 256(2048) FLR RO
                 max read 512
                 link x8(x8) speed 8.0(8.0)
    cap 11[b0] = MSI-X supports 8 messages
                 Table in map 0x20[0x0], PBA in map 0x20[0x1000]
    cap 03[d0] = VPD
    ecap 0001[100] = AER 2 0 fatal 0 non-fatal 4 corrected
    ecap 0002[140] = VC 1 max VC1
    ecap 0003[170] = Serial 1 0000000000000000
    ecap 000e[190] = ARI 1
    ecap 0019[1a0] = PCIe Sec 1 lane errors 0
    ecap 0010[1c0] = SR-IOV 1 IOV disabled, Memory Space disabled, ARI disabled
                     0 VFs configured out of 16 supported
                     First VF RID Offset 0x0008, VF RID Stride 0x0004
                     VF Device ID 0x5801
                     Page Sizes: 4096 (enabled), 8192, 65536, 262144, 1048576, 4194304
    ecap 0017[200] = TPH Requester 1

t5iov1@pci0:1:0:1:	class=0x020000 rev=0x00 hdr=0x00 vendor=0x1425 device=0x5001 subvendor=0x1425 subdevice=0x0000
    vendor     = 'Chelsio Communications Inc'
    device     = 'T520-CR Unified Wire Ethernet Controller'
    class      = network
    subclass   = ethernet
    bar   [10] = type Memory, range 64, base 0xf7680000, size 524288, enabled
    bar   [18] = type Memory, range 64, base 0xf7600000, size 524288, enabled
    bar   [20] = type Memory, range 64, base 0xf788a000, size 8192, enabled
    cap 01[40] = powerspec 3  supports D0 D3  current D0
    cap 05[50] = MSI supports 8 messages, 64 bit, vector masks 
    cap 10[70] = PCI-Express 2 endpoint max data 256(2048) FLR RO
                 max read 512
                 link x8(x8) speed 8.0(8.0)
    cap 11[b0] = MSI-X supports 8 messages
                 Table in map 0x20[0x0], PBA in map 0x20[0x1000]
    cap 03[d0] = VPD
    ecap 0001[100] = AER 2 0 fatal 0 non-fatal 4 corrected
    ecap 0003[170] = Serial 1 0000000000000000
    ecap 000e[190] = ARI 1
    ecap 0019[1a0] = PCIe Sec 1 lane errors 0
    ecap 0010[1c0] = SR-IOV 1 IOV disabled, Memory Space disabled, ARI disabled
                     0 VFs configured out of 16 supported
                     First VF RID Offset 0x0008, VF RID Stride 0x0004
                     VF Device ID 0x5801
                     Page Sizes: 4096 (enabled), 8192, 65536, 262144, 1048576, 4194304
    ecap 0017[200] = TPH Requester 1

t5iov2@pci0:1:0:2:	class=0x020000 rev=0x00 hdr=0x00 vendor=0x1425 device=0x5001 subvendor=0x1425 subdevice=0x0000
    vendor     = 'Chelsio Communications Inc'
    device     = 'T520-CR Unified Wire Ethernet Controller'
    class      = network
    subclass   = ethernet
    bar   [10] = type Memory, range 64, base 0xf7500000, size 524288, enabled
    bar   [18] = type Memory, range 64, base 0xf7480000, size 524288, enabled
    bar   [20] = type Memory, range 64, base 0xf7888000, size 8192, enabled
    cap 01[40] = powerspec 3  supports D0 D3  current D0
    cap 05[50] = MSI supports 8 messages, 64 bit, vector masks 
    cap 10[70] = PCI-Express 2 endpoint max data 256(2048) FLR RO
                 max read 512
                 link x8(x8) speed 8.0(8.0)
    cap 11[b0] = MSI-X supports 8 messages
                 Table in map 0x20[0x0], PBA in map 0x20[0x1000]
    cap 03[d0] = VPD
    ecap 0001[100] = AER 2 0 fatal 0 non-fatal 4 corrected
    ecap 0003[170] = Serial 1 0000000000000000
    ecap 000e[190] = ARI 1
    ecap 0019[1a0] = PCIe Sec 1 lane errors 0
    ecap 0010[1c0] = SR-IOV 1 IOV disabled, Memory Space disabled, ARI disabled
                     0 VFs configured out of 16 supported
                     First VF RID Offset 0x0008, VF RID Stride 0x0004
                     VF Device ID 0x5801
                     Page Sizes: 4096 (enabled), 8192, 65536, 262144, 1048576, 4194304
    ecap 0017[200] = TPH Requester 1

t5iov3@pci0:1:0:3:	class=0x020000 rev=0x00 hdr=0x00 vendor=0x1425 device=0x5001 subvendor=0x1425 subdevice=0x0000
    vendor     = 'Chelsio Communications Inc'
    device     = 'T520-CR Unified Wire Ethernet Controller'
    class      = network
    subclass   = ethernet
    bar   [10] = type Memory, range 64, base 0xf7400000, size 524288, enabled
    bar   [18] = type Memory, range 64, base 0xf7380000, size 524288, enabled
    bar   [20] = type Memory, range 64, base 0xf7886000, size 8192, enabled
    cap 01[40] = powerspec 3  supports D0 D3  current D0
    cap 05[50] = MSI supports 8 messages, 64 bit, vector masks 
    cap 10[70] = PCI-Express 2 endpoint max data 256(2048) FLR RO
                 max read 512
                 link x8(x8) speed 8.0(8.0)
    cap 11[b0] = MSI-X supports 8 messages
                 Table in map 0x20[0x0], PBA in map 0x20[0x1000]
    cap 03[d0] = VPD
    ecap 0001[100] = AER 2 0 fatal 0 non-fatal 4 corrected
    ecap 0003[170] = Serial 1 0000000000000000
    ecap 000e[190] = ARI 1
    ecap 0019[1a0] = PCIe Sec 1 lane errors 0
    ecap 0010[1c0] = SR-IOV 1 IOV disabled, Memory Space disabled, ARI disabled
                     0 VFs configured out of 16 supported
                     First VF RID Offset 0x0008, VF RID Stride 0x0004
                     VF Device ID 0x5801
                     Page Sizes: 4096 (enabled), 8192, 65536, 262144, 1048576, 4194304
    ecap 0017[200] = TPH Requester 1

t5nex0@pci0:1:0:4:	class=0x020000 rev=0x00 hdr=0x00 vendor=0x1425 device=0x5401 subvendor=0x1425 subdevice=0x0000
    vendor     = 'Chelsio Communications Inc'
    device     = 'T520-CR Unified Wire Ethernet Controller'
    class      = network
    subclass   = ethernet
    bar   [10] = type Memory, range 64, base 0xf7300000, size 524288, enabled
    bar   [18] = type Memory, range 64, base 0xf6000000, size 16777216, enabled
    bar   [20] = type Memory, range 64, base 0xf7884000, size 8192, enabled
    cap 01[40] = powerspec 3  supports D0 D3  current D0
    cap 05[50] = MSI supports 32 messages, 64 bit, vector masks 
    cap 10[70] = PCI-Express 2 endpoint max data 256(2048) FLR
                 max read 4096
                 link x8(x8) speed 8.0(8.0)
    cap 11[b0] = MSI-X supports 128 messages, enabled
                 Table in map 0x20[0x0], PBA in map 0x20[0x1000]
    cap 03[d0] = VPD
    ecap 0001[100] = AER 2 0 fatal 0 non-fatal 4 corrected
    ecap 0003[170] = Serial 1 0000000000000000
    ecap 000e[190] = ARI 1
    ecap 0019[1a0] = PCIe Sec 1 lane errors 0
    ecap 0010[1c0] = SR-IOV 1 IOV disabled, Memory Space disabled, ARI disabled
                     0 VFs configured out of 0 supported
                     First VF RID Offset 0x0008, VF RID Stride 0x0004
                     VF Device ID 0x5801
                     Page Sizes: 4096 (enabled), 8192, 65536, 262144, 1048576, 4194304
    ecap 0017[200] = TPH Requester 1

none4@pci0:1:0:5:	class=0x010000 rev=0x00 hdr=0x00 vendor=0x1425 device=0x5501 subvendor=0x1425 subdevice=0x0000
    vendor     = 'Chelsio Communications Inc'
    device     = 'T520-CR Unified Wire Storage Controller'
    class      = mass storage
    subclass   = SCSI
    bar   [10] = type Memory, range 64, base 0xf7280000, size 524288, enabled
    bar   [18] = type Memory, range 64, base 0xf7200000, size 524288, enabled
    bar   [20] = type Memory, range 64, base 0xf7882000, size 8192, enabled
    cap 01[40] = powerspec 3  supports D0 D3  current D0
    cap 05[50] = MSI supports 32 messages, 64 bit, vector masks 
    cap 10[70] = PCI-Express 2 endpoint max data 256(2048) FLR RO
                 max read 512
                 link x8(x8) speed 8.0(8.0)
    cap 11[b0] = MSI-X supports 40 messages
                 Table in map 0x20[0x0], PBA in map 0x20[0x1000]
    cap 03[d0] = VPD
    ecap 0001[100] = AER 2 0 fatal 0 non-fatal 4 corrected
    ecap 0003[170] = Serial 1 0000000000000000
    ecap 000e[190] = ARI 1
    ecap 0019[1a0] = PCIe Sec 1 lane errors 0
    ecap 0010[1c0] = SR-IOV 1 IOV disabled, Memory Space disabled, ARI disabled
                     0 VFs configured out of 0 supported
                     First VF RID Offset 0x0008, VF RID Stride 0x0004
                     VF Device ID 0x5801
                     Page Sizes: 4096 (enabled), 8192, 65536, 262144, 1048576, 4194304
    ecap 0017[200] = TPH Requester 1

none5@pci0:1:0:6:	class=0x0c0400 rev=0x00 hdr=0x00 vendor=0x1425 device=0x5601 subvendor=0x1425 subdevice=0x0000
    vendor     = 'Chelsio Communications Inc'
    device     = 'T520-CR Unified Wire Storage Controller'
    class      = serial bus
    subclass   = Fibre Channel
    bar   [10] = type Memory, range 64, base 0xf7100000, size 524288, enabled
    bar   [18] = type Memory, range 64, base 0xf7080000, size 524288, enabled
    bar   [20] = type Memory, range 64, base 0xf7880000, size 8192, enabled
    cap 01[40] = powerspec 3  supports D0 D3  current D0
    cap 05[50] = MSI supports 32 messages, 64 bit, vector masks 
    cap 10[70] = PCI-Express 2 endpoint max data 256(2048) FLR RO
                 max read 512
                 link x8(x8) speed 8.0(8.0)
    cap 11[b0] = MSI-X supports 40 messages
                 Table in map 0x20[0x0], PBA in map 0x20[0x1000]
    cap 03[d0] = VPD
    ecap 0001[100] = AER 2 0 fatal 0 non-fatal 4 corrected
    ecap 0003[170] = Serial 1 0000000000000000
    ecap 000e[190] = ARI 1
    ecap 0019[1a0] = PCIe Sec 1 lane errors 0
    ecap 0010[1c0] = SR-IOV 1 IOV disabled, Memory Space disabled, ARI disabled
                     0 VFs configured out of 0 supported
                     First VF RID Offset 0x0008, VF RID Stride 0x0004
                     VF Device ID 0x5801
                     Page Sizes: 4096 (enabled), 8192, 65536, 262144, 1048576, 4194304
    ecap 0017[200] = TPH Requester 1

nvme0@pci0:2:0:0:	class=0x010802 rev=0xb0 hdr=0x00 vendor=0x1d97 device=0x1160 subvendor=0x1d97 subdevice=0x1160
    vendor     = 'Shenzhen Longsys Electronics Co., Ltd.'
    class      = mass storage
    subclass   = NVM
    bar   [10] = type Memory, range 64, base 0xf7900000, size 16384, enabled
    bar   [18] = type I/O Port, range 32, base 0xe000, size 256, enabled
    cap 01[40] = powerspec 3  supports D0 D3  current D0
    cap 05[50] = MSI supports 32 messages, 64 bit 
    cap 10[70] = PCI-Express 2 endpoint max data 128(128) FLR RO
                 max read 512
                 link x2(x2) speed 8.0(8.0) ASPM disabled(L0s/L1)
    cap 11[b0] = MSI-X supports 32 messages, enabled
                 Table in map 0x10[0x2000], PBA in map 0x10[0x3000]
    ecap 0001[100] = AER 2 0 fatal 0 non-fatal 1 corrected
    ecap 0019[148] = PCIe Sec 1 lane errors 0
    ecap 0018[168] = LTR 1
    ecap 001e[170] = L1 PM Substates 1
