hostb0@pci0:0:0:0:	class=0x060000 card=0x72708086 chip=0x5af08086 rev=0x0b hdr=0x00
    vendor     = 'Intel Corporation'
    device     = 'Celeron N3350/Pentium N4200/Atom E3900 Series Host Bridge'
    class      = bridge
    subclass   = HOST-PCI

vgapci0@pci0:0:2:0:	class=0x030000 card=0x22128086 chip=0x5a858086 rev=0x0b hdr=0x00
    vendor     = 'Intel Corporation'
    class      = display
    subclass   = VGA
    bar   [10] = type Memory, range 64, base 0x90000000, size 16777216, enabled
    bar   [18] = type Prefetchable Memory, range 64, base 0x80000000, size 268435456, enabled
    bar   [20] = type I/O Port, range 32, base 0xf000, size 64, enabled
    cap 09[40] = vendor (length 12) Intel cap 0 version 1
    cap 10[70] = PCI-Express 2 root endpoint max data 128(128) FLR
    cap 05[ac] = MSI supports 1 message 
    cap 01[d0] = powerspec 2  supports D0 D3  current D0
    ecap 001b[100] = unknown 1
    ecap 000f[200] = ATS 1
    ecap 0013[300] = unknown 1

none0@pci0:0:14:0:	class=0x040100 card=0x72708086 chip=0x5a988086 rev=0x0b hdr=0x00
    vendor     = 'Intel Corporation'
    device     = 'Celeron N3350/Pentium N4200/Atom E3900 Series Audio Cluster'
    class      = multimedia
    subclass   = audio
    bar   [10] = type Memory, range 64, base 0x91510000, size 16384, enabled
    bar   [20] = type Memory, range 64, base 0x91200000, size 1048576, enabled
    cap 01[50] = powerspec 3  supports D0 D3  current D0
    cap 09[80] = vendor (length 20) Intel cap 15 version 0
    cap 05[60] = MSI supports 1 message, 64 bit 
    cap 10[70] = PCI-Express 1 root endpoint max data 128(128) FLR NS
                 link x1(x0)

none1@pci0:0:15:0:	class=0x078000 card=0x72708086 chip=0x5a9a8086 rev=0x0b hdr=0x00
    vendor     = 'Intel Corporation'
    device     = 'Celeron N3350/Pentium N4200/Atom E3900 Series Trusted Execution Engine'
    class      = simple comms
    bar   [10] = type Memory, range 64, base 0x9153c000, size 4096, enabled
    cap 01[50] = powerspec 3  supports D0 D3  current D0
    cap 05[8c] = MSI supports 1 message, 64 bit 
    cap 09[a4] = vendor (length 20) Intel cap 15 version 0

ahci0@pci0:0:18:0:	class=0x010601 card=0x72708086 chip=0x5ae38086 rev=0x0b hdr=0x00
    vendor     = 'Intel Corporation'
    device     = 'Celeron N3350/Pentium N4200/Atom E3900 Series SATA AHCI Controller'
    class      = mass storage
    subclass   = SATA
    bar   [10] = type Memory, range 32, base 0x91514000, size 8192, enabled
    bar   [14] = type Memory, range 32, base 0x91539000, size 256, enabled
    bar   [18] = type I/O Port, range 32, base 0xf090, size 8, enabled
    bar   [1c] = type I/O Port, range 32, base 0xf080, size 4, enabled
    bar   [20] = type I/O Port, range 32, base 0xf060, size 32, enabled
    bar   [24] = type Memory, range 32, base 0x91538000, size 2048, enabled
    cap 05[80] = MSI supports 1 message enabled with 1 message
    cap 01[70] = powerspec 3  supports D0 D3  current D0
    cap 12[a8] = SATA Index-Data Pair

pcib1@pci0:0:19:0:	class=0x060400 card=0x00000000 chip=0x5ad88086 rev=0xfb hdr=0x01
    vendor     = 'Intel Corporation'
    device     = 'Celeron N3350/Pentium N4200/Atom E3900 Series PCI Express Port A'
    class      = bridge
    subclass   = PCI-PCI
    cap 10[40] = PCI-Express 2 root port max data 256(256) ARI disabled
                 link x0(x1) speed 0.0(5.0)
                 slot 2 power limit 100 mW
    cap 05[80] = MSI supports 1 message 
    cap 0d[90] = PCI Bridge card=0x00000000
    cap 01[a0] = powerspec 3  supports D0 D3  current D0
    ecap 0000[100] = unknown 0
    ecap 000d[140] = ACS 1
    ecap 001f[150] = unknown 1
    ecap 0000[200] = unknown 0
    ecap 0000[220] = unknown 0

pcib2@pci0:0:19:1:	class=0x060400 card=0x00000000 chip=0x5ad98086 rev=0xfb hdr=0x01
    vendor     = 'Intel Corporation'
    device     = 'Celeron N3350/Pentium N4200/Atom E3900 Series PCI Express Port A'
    class      = bridge
    subclass   = PCI-PCI
    cap 10[40] = PCI-Express 2 root port max data 256(256) ARI disabled
                 link x1(x1) speed 2.5(5.0)
                 slot 3 power limit 100 mW
    cap 05[80] = MSI supports 1 message 
    cap 0d[90] = PCI Bridge card=0x00000000
    cap 01[a0] = powerspec 3  supports D0 D3  current D0
    ecap 0000[100] = unknown 0
    ecap 000d[140] = ACS 1
    ecap 001f[150] = unknown 1
    ecap 0000[200] = unknown 0
    ecap 0000[220] = unknown 0

pcib3@pci0:0:19:2:	class=0x060400 card=0x00000000 chip=0x5ada8086 rev=0xfb hdr=0x01
    vendor     = 'Intel Corporation'
    device     = 'Celeron N3350/Pentium N4200/Atom E3900 Series PCI Express Port A'
    class      = bridge
    subclass   = PCI-PCI
    cap 10[40] = PCI-Express 2 root port max data 256(256) ARI disabled
                 link x1(x1) speed 2.5(5.0)
                 slot 4 power limit 100 mW
    cap 05[80] = MSI supports 1 message 
    cap 0d[90] = PCI Bridge card=0x00000000
    cap 01[a0] = powerspec 3  supports D0 D3  current D0
    ecap 0000[100] = unknown 0
    ecap 000d[140] = ACS 1
    ecap 001f[150] = unknown 1
    ecap 0000[200] = unknown 0
    ecap 0000[220] = unknown 0

pcib4@pci0:0:19:3:	class=0x060400 card=0x00000000 chip=0x5adb8086 rev=0xfb hdr=0x01
    vendor     = 'Intel Corporation'
    device     = 'Celeron N3350/Pentium N4200/Atom E3900 Series PCI Express Port A'
    class      = bridge
    subclass   = PCI-PCI
    cap 10[40] = PCI-Express 2 root port max data 256(256) ARI disabled
                 link x0(x1) speed 0.0(5.0)
                 slot 5 power limit 100 mW
    cap 05[80] = MSI supports 1 message 
    cap 0d[90] = PCI Bridge card=0x00000000
    cap 01[a0] = powerspec 3  supports D0 D3  current D0
    ecap 0000[100] = unknown 0
    ecap 000d[140] = ACS 1
    ecap 001f[150] = unknown 1
    ecap 0000[200] = unknown 0
    ecap 0000[220] = unknown 0

pcib5@pci0:0:20:0:	class=0x060400 card=0x00000000 chip=0x5ad68086 rev=0xfb hdr=0x01
    vendor     = 'Intel Corporation'
    device     = 'Celeron N3350/Pentium N4200/Atom E3900 Series PCI Express Port B'
    class      = bridge
    subclass   = PCI-PCI
    cap 10[40] = PCI-Express 2 root port max data 256(256) ARI disabled
                 link x0(x1) speed 0.0(5.0)
    cap 05[80] = MSI supports 1 message 
    cap 0d[90] = PCI Bridge card=0x00000000
    cap 01[a0] = powerspec 3  supports D0 D3  current D0
    ecap 0000[100] = unknown 0
    ecap 000d[140] = ACS 1
    ecap 001f[150] = unknown 1
    ecap 0000[200] = unknown 0
    ecap 0000[220] = unknown 0

pcib6@pci0:0:20:1:	class=0x060400 card=0x00000000 chip=0x5ad78086 rev=0xfb hdr=0x01
    vendor     = 'Intel Corporation'
    device     = 'Celeron N3350/Pentium N4200/Atom E3900 Series PCI Express Port B'
    class      = bridge
    subclass   = PCI-PCI
    cap 10[40] = PCI-Express 2 root port max data 256(256) ARI disabled
                 link x0(x1) speed 0.0(5.0)
    cap 05[80] = MSI supports 1 message 
    cap 0d[90] = PCI Bridge card=0x00000000
    cap 01[a0] = powerspec 3  supports D0 D3  current D0
    ecap 0000[100] = unknown 0
    ecap 000d[140] = ACS 1
    ecap 001f[150] = unknown 1
    ecap 0000[200] = unknown 0
    ecap 0000[220] = unknown 0

xhci0@pci0:0:21:0:	class=0x0c0330 card=0x72708086 chip=0x5aa88086 rev=0x0b hdr=0x00
    vendor     = 'Intel Corporation'
    device     = 'Celeron N3350/Pentium N4200/Atom E3900 Series USB xHCI'
    class      = serial bus
    subclass   = USB
    bar   [10] = type Memory, range 64, base 0x91500000, size 65536, enabled
    cap 01[70] = powerspec 2  supports D0 D3  current D0
    cap 05[80] = MSI supports 8 messages, 64 bit enabled with 1 message
    cap 09[90] = vendor (length 20) Intel cap 15 version 0

none2@pci0:0:21:1:	class=0x0c03fe card=0x72708086 chip=0x5aaa8086 rev=0x0b hdr=0x00
    vendor     = 'Intel Corporation'
    class      = serial bus
    subclass   = USB
    bar   [10] = type Memory, range 64, base 0x91000000, size 2097152, enabled
    bar   [18] = type Memory, range 64, base 0x91537000, size 4096, enabled
    cap 01[80] = powerspec 3  supports D0 D3  current D0
    cap 09[90] = vendor (length 20) Intel cap 15 version 0

none3@pci0:0:22:0:	class=0x118000 card=0x72708086 chip=0x5aac8086 rev=0x0b hdr=0x00
    vendor     = 'Intel Corporation'
    device     = 'Celeron N3350/Pentium N4200/Atom E3900 Series I2C Controller'
    class      = dasp
    bar   [10] = type Memory, range 64, base 0x91536000, size 4096, enabled
    bar   [18] = type Memory, range 64, base 0x91535000, size 4096, enabled
    cap 01[80] = powerspec 3  supports D0 D3  current D0
    cap 09[90] = vendor (length 20) Intel cap 15 version 0

none4@pci0:0:22:1:	class=0x118000 card=0x72708086 chip=0x5aae8086 rev=0x0b hdr=0x00
    vendor     = 'Intel Corporation'
    device     = 'Celeron N3350/Pentium N4200/Atom E3900 Series I2C Controller'
    class      = dasp
    bar   [10] = type Memory, range 64, base 0x91534000, size 4096, enabled
    bar   [18] = type Memory, range 64, base 0x91533000, size 4096, enabled
    cap 01[80] = powerspec 3  supports D0 D3  current D0
    cap 09[90] = vendor (length 20) Intel cap 15 version 0

none5@pci0:0:22:2:	class=0x118000 card=0x72708086 chip=0x5ab08086 rev=0x0b hdr=0x00
    vendor     = 'Intel Corporation'
    device     = 'Celeron N3350/Pentium N4200/Atom E3900 Series I2C Controller'
    class      = dasp
    bar   [10] = type Memory, range 64, base 0x91532000, size 4096, enabled
    bar   [18] = type Memory, range 64, base 0x91531000, size 4096, enabled
    cap 01[80] = powerspec 3  supports D0 D3  current D0
    cap 09[90] = vendor (length 20) Intel cap 15 version 0

none6@pci0:0:22:3:	class=0x118000 card=0x72708086 chip=0x5ab28086 rev=0x0b hdr=0x00
    vendor     = 'Intel Corporation'
    device     = 'Celeron N3350/Pentium N4200/Atom E3900 Series I2C Controller'
    class      = dasp
    bar   [10] = type Memory, range 64, base 0x91530000, size 4096, enabled
    bar   [18] = type Memory, range 64, base 0x9152f000, size 4096, enabled
    cap 01[80] = powerspec 3  supports D0 D3  current D0
    cap 09[90] = vendor (length 20) Intel cap 15 version 0

none7@pci0:0:23:0:	class=0x118000 card=0x72708086 chip=0x5ab48086 rev=0x0b hdr=0x00
    vendor     = 'Intel Corporation'
    device     = 'Celeron N3350/Pentium N4200/Atom E3900 Series I2C Controller'
    class      = dasp
    bar   [10] = type Memory, range 64, base 0x9152e000, size 4096, enabled
    bar   [18] = type Memory, range 64, base 0x9152d000, size 4096, enabled
    cap 01[80] = powerspec 3  supports D0 D3  current D0
    cap 09[90] = vendor (length 20) Intel cap 15 version 0

none8@pci0:0:23:1:	class=0x118000 card=0x72708086 chip=0x5ab68086 rev=0x0b hdr=0x00
    vendor     = 'Intel Corporation'
    device     = 'Celeron N3350/Pentium N4200/Atom E3900 Series I2C Controller'
    class      = dasp
    bar   [10] = type Memory, range 64, base 0x9152c000, size 4096, enabled
    bar   [18] = type Memory, range 64, base 0x9152b000, size 4096, enabled
    cap 01[80] = powerspec 3  supports D0 D3  current D0
    cap 09[90] = vendor (length 20) Intel cap 15 version 0

none9@pci0:0:23:2:	class=0x118000 card=0x72708086 chip=0x5ab88086 rev=0x0b hdr=0x00
    vendor     = 'Intel Corporation'
    device     = 'Celeron N3350/Pentium N4200/Atom E3900 Series I2C Controller'
    class      = dasp
    bar   [10] = type Memory, range 64, base 0x9152a000, size 4096, enabled
    bar   [18] = type Memory, range 64, base 0x91529000, size 4096, enabled
    cap 01[80] = powerspec 3  supports D0 D3  current D0
    cap 09[90] = vendor (length 20) Intel cap 15 version 0

none10@pci0:0:23:3:	class=0x118000 card=0x72708086 chip=0x5aba8086 rev=0x0b hdr=0x00
    vendor     = 'Intel Corporation'
    device     = 'Celeron N3350/Pentium N4200/Atom E3900 Series I2C Controller'
    class      = dasp
    bar   [10] = type Memory, range 64, base 0x91528000, size 4096, enabled
    bar   [18] = type Memory, range 64, base 0x91527000, size 4096, enabled
    cap 01[80] = powerspec 3  supports D0 D3  current D0
    cap 09[90] = vendor (length 20) Intel cap 15 version 0

none11@pci0:0:24:0:	class=0x118000 card=0x72708086 chip=0x5abc8086 rev=0x0b hdr=0x00
    vendor     = 'Intel Corporation'
    device     = 'Celeron N3350/Pentium N4200/Atom E3900 Series HSUART Controller'
    class      = dasp
    bar   [10] = type Memory, range 64, base 0x91526000, size 4096, enabled
    bar   [18] = type Memory, range 64, base 0x91525000, size 4096, enabled
    cap 01[80] = powerspec 3  supports D0 D3  current D0
    cap 09[90] = vendor (length 20) Intel cap 15 version 0

none12@pci0:0:24:1:	class=0x118000 card=0x72708086 chip=0x5abe8086 rev=0x0b hdr=0x00
    vendor     = 'Intel Corporation'
    device     = 'Celeron N3350/Pentium N4200/Atom E3900 Series HSUART Controller'
    class      = dasp
    bar   [10] = type Memory, range 64, base 0x91524000, size 4096, enabled
    bar   [18] = type Memory, range 64, base 0x91523000, size 4096, enabled
    cap 01[80] = powerspec 3  supports D0 D3  current D0
    cap 09[90] = vendor (length 20) Intel cap 15 version 0

none13@pci0:0:25:0:	class=0x118000 card=0x72708086 chip=0x5ac28086 rev=0x0b hdr=0x00
    vendor     = 'Intel Corporation'
    device     = 'Celeron N3350/Pentium N4200/Atom E3900 Series SPI Controller'
    class      = dasp
    bar   [10] = type Memory, range 64, base 0x91522000, size 4096, enabled
    bar   [18] = type Memory, range 64, base 0x91521000, size 4096, enabled
    cap 01[80] = powerspec 3  supports D0 D3  current D0
    cap 09[90] = vendor (length 20) Intel cap 15 version 0

none14@pci0:0:25:1:	class=0x118000 card=0x72708086 chip=0x5ac48086 rev=0x0b hdr=0x00
    vendor     = 'Intel Corporation'
    device     = 'Celeron N3350/Pentium N4200/Atom E3900 Series SPI Controller'
    class      = dasp
    bar   [10] = type Memory, range 64, base 0x91520000, size 4096, enabled
    bar   [18] = type Memory, range 64, base 0x9151f000, size 4096, enabled
    cap 01[80] = powerspec 3  supports D0 D3  current D0
    cap 09[90] = vendor (length 20) Intel cap 15 version 0

none15@pci0:0:25:2:	class=0x118000 card=0x72708086 chip=0x5ac68086 rev=0x0b hdr=0x00
    vendor     = 'Intel Corporation'
    device     = 'Celeron N3350/Pentium N4200/Atom E3900 Series SPI Controller'
    class      = dasp
    bar   [10] = type Memory, range 64, base 0x9151e000, size 4096, enabled
    bar   [18] = type Memory, range 64, base 0x9151d000, size 4096, enabled
    cap 01[80] = powerspec 3  supports D0 D3  current D0
    cap 09[90] = vendor (length 20) Intel cap 15 version 0

none16@pci0:0:26:0:	class=0x0c8000 card=0x72708086 chip=0x5ac88086 rev=0x0b hdr=0x00
    vendor     = 'Intel Corporation'
    device     = 'Celeron N3350/Pentium N4200/Atom E3900 Series PWM Pin Controller'
    class      = serial bus
    bar   [10] = type Memory, range 64, base 0x9151c000, size 4096, enabled
    bar   [18] = type Memory, range 64, base 0x9151b000, size 4096, enabled
    cap 01[80] = powerspec 3  supports D0 D3  current D0
    cap 09[90] = vendor (length 20) Intel cap 15 version 0

sdhci_pci0@pci0:0:28:0:	class=0x080501 card=0x72708086 chip=0x5acc8086 rev=0x0b hdr=0x00
    vendor     = 'Intel Corporation'
    device     = 'Celeron N3350/Pentium N4200/Atom E3900 Series eMMC Controller'
    class      = base peripheral
    subclass   = SD host controller
    bar   [10] = type Memory, range 64, base 0x9151a000, size 4096, enabled
    bar   [18] = type Memory, range 64, base 0x91519000, size 4096, enabled
    cap 01[80] = powerspec 3  supports D0 D3  current D0
    cap 09[90] = vendor (length 20) Intel cap 15 version 0

sdhci_pci1@pci0:0:30:0:	class=0x080501 card=0x72708086 chip=0x5ad08086 rev=0x0b hdr=0x00
    vendor     = 'Intel Corporation'
    device     = 'Celeron N3350/Pentium N4200/Atom E3900 Series SDIO Controller'
    class      = base peripheral
    subclass   = SD host controller
    bar   [10] = type Memory, range 64, base 0x91518000, size 4096, enabled
    bar   [18] = type Memory, range 64, base 0x91517000, size 4096, enabled
    cap 01[80] = powerspec 3  supports D0 D3  current D0
    cap 09[90] = vendor (length 20) Intel cap 15 version 0

isab0@pci0:0:31:0:	class=0x060100 card=0x72708086 chip=0x5ae88086 rev=0x0b hdr=0x00
    vendor     = 'Intel Corporation'
    device     = 'Celeron N3350/Pentium N4200/Atom E3900 Series Low Pin Count Interface'
    class      = bridge
    subclass   = PCI-ISA

none17@pci0:0:31:1:	class=0x0c0500 card=0x72708086 chip=0x5ad48086 rev=0x0b hdr=0x00
    vendor     = 'Intel Corporation'
    device     = 'Celeron N3350/Pentium N4200/Atom E3900 Series SMBus Controller'
    class      = serial bus
    subclass   = SMBus
    bar   [10] = type Memory, range 64, base 0x91516000, size 256, enabled
    bar   [20] = type I/O Port, range 32, base 0xf040, size 32, enabled

re0@pci0:2:0:0:	class=0x020000 card=0x012310ec chip=0x816810ec rev=0x0c hdr=0x00
    vendor     = 'Realtek Semiconductor Co., Ltd.'
    device     = 'RTL8111/8168/8411 PCI Express Gigabit Ethernet Controller'
    class      = network
    subclass   = ethernet
    bar   [10] = type I/O Port, range 32, base 0xe000, size 256, enabled
    bar   [18] = type Memory, range 64, base 0x91404000, size 4096, enabled
    bar   [20] = type Prefetchable Memory, range 64, base 0x91400000, size 16384, enabled
    cap 01[40] = powerspec 3  supports D0 D1 D2 D3  current D0
    cap 05[50] = MSI supports 1 message, 64 bit 
    cap 10[70] = PCI-Express 2 endpoint MSI 1 max data 128(128) RO
                 link x1(x1) speed 2.5(2.5) ASPM disabled(L0s/L1)
    cap 11[b0] = MSI-X supports 4 messages, enabled
                 Table in map 0x20[0x0], PBA in map 0x20[0x800]
    cap 03[d0] = VPD
    ecap 0001[100] = AER 1 0 fatal 0 non-fatal 0 corrected
    ecap 0002[140] = VC 1 max VC0
    ecap 0003[160] = Serial 1 01000000684ce000
    ecap 0018[170] = LTR 1

re1@pci0:3:0:0:	class=0x020000 card=0x012310ec chip=0x816810ec rev=0x0c hdr=0x00
    vendor     = 'Realtek Semiconductor Co., Ltd.'
    device     = 'RTL8111/8168/8411 PCI Express Gigabit Ethernet Controller'
    class      = network
    subclass   = ethernet
    bar   [10] = type I/O Port, range 32, base 0xd000, size 256, enabled
    bar   [18] = type Memory, range 64, base 0x91304000, size 4096, enabled
    bar   [20] = type Prefetchable Memory, range 64, base 0x91300000, size 16384, enabled
    cap 01[40] = powerspec 3  supports D0 D1 D2 D3  current D0
    cap 05[50] = MSI supports 1 message, 64 bit 
    cap 10[70] = PCI-Express 2 endpoint MSI 1 max data 128(128) RO
                 link x1(x1) speed 2.5(2.5) ASPM disabled(L0s/L1)
    cap 11[b0] = MSI-X supports 4 messages, enabled
                 Table in map 0x20[0x0], PBA in map 0x20[0x800]
    cap 03[d0] = VPD
    ecap 0001[100] = AER 1 0 fatal 0 non-fatal 0 corrected
    ecap 0002[140] = VC 1 max VC0
    ecap 0003[160] = Serial 1 01000000684ce000
    ecap 0018[170] = LTR 1
