hostb0@pci0:0:0:0:	class=0x060000 rev=0x06 hdr=0x00 vendor=0x8086 device=0x0c00 subvendor=0x1849 subdevice=0x0c00
    vendor     = 'Intel Corporation'
    device     = '4th Gen Core Processor DRAM Controller'
    class      = bridge
    subclass   = HOST-PCI
    cap 09[e0] = vendor (length 12) Intel cap 0 version 1

pcib1@pci0:0:1:0:	class=0x060400 rev=0x06 hdr=0x01 vendor=0x8086 device=0x0c01 subvendor=0x1849 subdevice=0x0c01
    vendor     = 'Intel Corporation'
    device     = 'Xeon E3-1200 v3/4th Gen Core Processor PCI Express x16 Controller'
    class      = bridge
    subclass   = PCI-PCI
    cap 0d[88] = PCI Bridge subvendor=0x1849 subdevice=0x0c01
    cap 01[80] = powerspec 3  supports D0 D3  current D0
    cap 05[90] = MSI supports 1 message 
    cap 10[a0] = PCI-Express 2 root port max data 128(128)
                 max read 128
                 link x4(x16) speed 5.0(8.0) ASPM disabled(L0s/L1)
                 slot 1 power limit 75000 mW
    ecap 0002[100] = VC 1 max VC0
    ecap 0005[140] = Root Complex Link Declaration 1
    ecap 0019[d94] = PCIe Sec 1 lane errors 0

vgapci0@pci0:0:2:0:	class=0x030000 rev=0x06 hdr=0x00 vendor=0x8086 device=0x0412 subvendor=0x1849 subdevice=0x0412
    vendor     = 'Intel Corporation'
    device     = 'Xeon E3-1200 v3/4th Gen Core Processor Integrated Graphics Controller'
    class      = display
    subclass   = VGA
    bar   [10] = type Memory, range 64, base 0xf0000000, size 4194304, enabled
    bar   [18] = type Prefetchable Memory, range 64, base 0xe0000000, size 268435456, enabled
    bar   [20] = type I/O Port, range 32, base 0xf000, size 64, enabled
    cap 05[90] = MSI supports 1 message 
    cap 01[d0] = powerspec 2  supports D0 D3  current D0
    cap 13[a4] = PCI Advanced Features: FLR TP

hdac0@pci0:0:3:0:	class=0x040300 rev=0x06 hdr=0x00 vendor=0x8086 device=0x0c0c subvendor=0x1849 subdevice=0x0c0c
    vendor     = 'Intel Corporation'
    device     = 'Xeon E3-1200 v3/4th Gen Core Processor HD Audio Controller'
    class      = multimedia
    subclass   = HDA
    bar   [10] = type Memory, range 64, base 0xf0a14000, size 16384, enabled
    cap 01[50] = powerspec 2  supports D0 D3  current D0
    cap 05[60] = MSI supports 1 message enabled with 1 message
    cap 10[70] = PCI-Express 1 root endpoint max data 128(128) FLR NS
                 max read 128

xhci0@pci0:0:20:0:	class=0x0c0330 rev=0x05 hdr=0x00 vendor=0x8086 device=0x8c31 subvendor=0x1849 subdevice=0x8c31
    vendor     = 'Intel Corporation'
    device     = '8 Series/C220 Series Chipset Family USB xHCI'
    class      = serial bus
    subclass   = USB
    bar   [10] = type Memory, range 64, base 0xf0a00000, size 65536, enabled
    cap 01[70] = powerspec 2  supports D0 D3  current D0
    cap 05[80] = MSI supports 8 messages, 64 bit enabled with 1 message

none0@pci0:0:22:0:	class=0x078000 rev=0x04 hdr=0x00 vendor=0x8086 device=0x8c3a subvendor=0x1849 subdevice=0x8c3a
    vendor     = 'Intel Corporation'
    device     = '8 Series/C220 Series Chipset Family MEI Controller'
    class      = simple comms
    bar   [10] = type Memory, range 64, base 0xf0a1f000, size 16, enabled
    cap 01[50] = powerspec 3  supports D0 D3  current D0
    cap 05[8c] = MSI supports 1 message, 64 bit 

ehci0@pci0:0:26:0:	class=0x0c0320 rev=0x05 hdr=0x00 vendor=0x8086 device=0x8c2d subvendor=0x1849 subdevice=0x8c2d
    vendor     = 'Intel Corporation'
    device     = '8 Series/C220 Series Chipset Family USB EHCI'
    class      = serial bus
    subclass   = USB
    bar   [10] = type Memory, range 32, base 0xf0a1c000, size 1024, enabled
    cap 01[50] = powerspec 2  supports D0 D3  current D0
    cap 0a[58] = EHCI Debug Port at offset 0xa0 in map 0x14
    cap 13[98] = PCI Advanced Features: FLR TP

hdac1@pci0:0:27:0:	class=0x040300 rev=0x05 hdr=0x00 vendor=0x8086 device=0x8c20 subvendor=0x1849 subdevice=0xc892
    vendor     = 'Intel Corporation'
    device     = '8 Series/C220 Series Chipset High Definition Audio Controller'
    class      = multimedia
    subclass   = HDA
    bar   [10] = type Memory, range 64, base 0xf0a10000, size 16384, enabled
    cap 01[50] = powerspec 2  supports D0 D3  current D0
    cap 05[60] = MSI supports 1 message, 64 bit enabled with 1 message
    cap 10[70] = PCI-Express 1 root endpoint max data 128(128) FLR NS
                 max read 128
    ecap 0002[100] = VC 1 max VC1

pcib2@pci0:0:28:0:	class=0x060400 rev=0xd5 hdr=0x01 vendor=0x8086 device=0x8c10 subvendor=0x1849 subdevice=0x8c10
    vendor     = 'Intel Corporation'
    device     = '8 Series/C220 Series Chipset Family PCI Express Root Port'
    class      = bridge
    subclass   = PCI-PCI
    cap 10[40] = PCI-Express 2 root port max data 128(128)
                 max read 128
                 link x0(x1) speed 0.0(5.0) ASPM disabled(L0s/L1)
                 slot 0 power limit 0 mW HotPlug(empty) surprise
    cap 05[80] = MSI supports 1 message 
    cap 0d[90] = PCI Bridge subvendor=0x1849 subdevice=0x8c10
    cap 01[a0] = powerspec 3  supports D0 D3  current D0

pcib3@pci0:0:28:2:	class=0x060400 rev=0xd5 hdr=0x01 vendor=0x8086 device=0x8c14 subvendor=0x1849 subdevice=0x8c14
    vendor     = 'Intel Corporation'
    device     = '8 Series/C220 Series Chipset Family PCI Express Root Port'
    class      = bridge
    subclass   = PCI-PCI
    cap 10[40] = PCI-Express 2 root port max data 128(128)
                 max read 128
                 link x1(x1) speed 2.5(5.0) ASPM disabled(L0s/L1)
                 slot 2 power limit 100 mW
    cap 05[80] = MSI supports 1 message 
    cap 0d[90] = PCI Bridge subvendor=0x1849 subdevice=0x8c14
    cap 01[a0] = powerspec 3  supports D0 D3  current D0

ehci1@pci0:0:29:0:	class=0x0c0320 rev=0x05 hdr=0x00 vendor=0x8086 device=0x8c26 subvendor=0x1849 subdevice=0x8c26
    vendor     = 'Intel Corporation'
    device     = '8 Series/C220 Series Chipset Family USB EHCI'
    class      = serial bus
    subclass   = USB
    bar   [10] = type Memory, range 32, base 0xf0a1b000, size 1024, enabled
    cap 01[50] = powerspec 2  supports D0 D3  current D0
    cap 0a[58] = EHCI Debug Port at offset 0xa0 in map 0x14
    cap 13[98] = PCI Advanced Features: FLR TP

isab0@pci0:0:31:0:	class=0x060100 rev=0x05 hdr=0x00 vendor=0x8086 device=0x8c50 subvendor=0x1849 subdevice=0x8c50
    vendor     = 'Intel Corporation'
    device     = 'B85 Express LPC Controller'
    class      = bridge
    subclass   = PCI-ISA
    cap 09[e0] = vendor (length 12) Intel cap 1 version 0
		 features: AMT, 4 PCI-e x1 slots

ahci0@pci0:0:31:2:	class=0x010601 rev=0x05 hdr=0x00 vendor=0x8086 device=0x8c02 subvendor=0x1849 subdevice=0x8c02
    vendor     = 'Intel Corporation'
    device     = '8 Series/C220 Series Chipset Family 6-port SATA Controller 1 [AHCI mode]'
    class      = mass storage
    subclass   = SATA
    bar   [10] = type I/O Port, range 32, base 0xf0b0, size 8, enabled
    bar   [14] = type I/O Port, range 32, base 0xf0a0, size 4, enabled
    bar   [18] = type I/O Port, range 32, base 0xf090, size 8, enabled
    bar   [1c] = type I/O Port, range 32, base 0xf080, size 4, enabled
    bar   [20] = type I/O Port, range 32, base 0xf060, size 32, enabled
    bar   [24] = type Memory, range 32, base 0xf0a1a000, size 2048, enabled
    cap 05[80] = MSI supports 1 message enabled with 1 message
    cap 01[70] = powerspec 3  supports D0 D3  current D0
    cap 12[a8] = SATA Index-Data Pair

ichsmb0@pci0:0:31:3:	class=0x0c0500 rev=0x05 hdr=0x00 vendor=0x8086 device=0x8c22 subvendor=0x1849 subdevice=0x8c22
    vendor     = 'Intel Corporation'
    device     = '8 Series/C220 Series Chipset Family SMBus Controller'
    class      = serial bus
    subclass   = SMBus
    bar   [10] = type Memory, range 64, base 0xf0a19000, size 256, enabled
    bar   [20] = type I/O Port, range 32, base 0xf040, size 32, enabled

igb0@pci0:1:0:0:	class=0x020000 rev=0x01 hdr=0x00 vendor=0x8086 device=0x1521 subvendor=0x8086 subdevice=0x00a1
    vendor     = 'Intel Corporation'
    device     = 'I350 Gigabit Network Connection'
    class      = network
    subclass   = ethernet
    bar   [10] = type Memory, range 32, base 0xf0700000, size 1048576, enabled
    bar   [1c] = type Memory, range 32, base 0xf088c000, size 16384, enabled
    cap 01[40] = powerspec 3  supports D0 D3  current D0
    cap 05[50] = MSI supports 1 message, 64 bit, vector masks 
    cap 11[70] = MSI-X supports 10 messages, enabled
                 Table in map 0x1c[0x0], PBA in map 0x1c[0x2000]
    cap 10[a0] = PCI-Express 2 endpoint max data 128(512) FLR NS
                 max read 512
                 link x4(x4) speed 5.0(5.0) ASPM disabled(L0s/L1)
    ecap 0001[100] = AER 2 0 fatal 0 non-fatal 1 corrected
    ecap 0003[140] = Serial 1 a0369fffff4272b4
    ecap 000e[150] = ARI 1
    ecap 0010[160] = SR-IOV 1 IOV disabled, Memory Space disabled, ARI disabled
                     0 VFs configured out of 8 supported
                     First VF RID Offset 0x0180, VF RID Stride 0x0004
                     VF Device ID 0x1520
                     Page Sizes: 4096 (enabled), 8192, 65536, 262144, 1048576, 4194304
    ecap 0017[1a0] = TPH Requester 1
    ecap 0018[1c0] = LTR 1
    ecap 000d[1d0] = ACS 1

igb1@pci0:1:0:1:	class=0x020000 rev=0x01 hdr=0x00 vendor=0x8086 device=0x1521 subvendor=0x8086 subdevice=0x00a1
    vendor     = 'Intel Corporation'
    device     = 'I350 Gigabit Network Connection'
    class      = network
    subclass   = ethernet
    bar   [10] = type Memory, range 32, base 0xf0600000, size 1048576, enabled
    bar   [1c] = type Memory, range 32, base 0xf0888000, size 16384, enabled
    cap 01[40] = powerspec 3  supports D0 D3  current D0
    cap 05[50] = MSI supports 1 message, 64 bit, vector masks 
    cap 11[70] = MSI-X supports 10 messages, enabled
                 Table in map 0x1c[0x0], PBA in map 0x1c[0x2000]
    cap 10[a0] = PCI-Express 2 endpoint max data 128(512) FLR NS
                 max read 512
                 link x4(x4) speed 5.0(5.0) ASPM disabled(L0s/L1)
    ecap 0001[100] = AER 2 0 fatal 0 non-fatal 1 corrected
    ecap 0003[140] = Serial 1 a0369fffff4272b4
    ecap 000e[150] = ARI 1
    ecap 0010[160] = SR-IOV 1 IOV disabled, Memory Space disabled, ARI disabled
                     0 VFs configured out of 8 supported
                     First VF RID Offset 0x0180, VF RID Stride 0x0004
                     VF Device ID 0x1520
                     Page Sizes: 4096 (enabled), 8192, 65536, 262144, 1048576, 4194304
    ecap 0017[1a0] = TPH Requester 1
    ecap 000d[1d0] = ACS 1

igb2@pci0:1:0:2:	class=0x020000 rev=0x01 hdr=0x00 vendor=0x8086 device=0x1521 subvendor=0x8086 subdevice=0x00a1
    vendor     = 'Intel Corporation'
    device     = 'I350 Gigabit Network Connection'
    class      = network
    subclass   = ethernet
    bar   [10] = type Memory, range 32, base 0xf0500000, size 1048576, enabled
    bar   [1c] = type Memory, range 32, base 0xf0884000, size 16384, enabled
    cap 01[40] = powerspec 3  supports D0 D3  current D0
    cap 05[50] = MSI supports 1 message, 64 bit, vector masks 
    cap 11[70] = MSI-X supports 10 messages, enabled
                 Table in map 0x1c[0x0], PBA in map 0x1c[0x2000]
    cap 10[a0] = PCI-Express 2 endpoint max data 128(512) FLR NS
                 max read 512
                 link x4(x4) speed 5.0(5.0) ASPM disabled(L0s/L1)
    ecap 0001[100] = AER 2 0 fatal 0 non-fatal 1 corrected
    ecap 0003[140] = Serial 1 a0369fffff4272b4
    ecap 000e[150] = ARI 1
    ecap 0010[160] = SR-IOV 1 IOV disabled, Memory Space disabled, ARI disabled
                     0 VFs configured out of 8 supported
                     First VF RID Offset 0x0180, VF RID Stride 0x0004
                     VF Device ID 0x1520
                     Page Sizes: 4096 (enabled), 8192, 65536, 262144, 1048576, 4194304
    ecap 0017[1a0] = TPH Requester 1
    ecap 000d[1d0] = ACS 1

igb3@pci0:1:0:3:	class=0x020000 rev=0x01 hdr=0x00 vendor=0x8086 device=0x1521 subvendor=0x8086 subdevice=0x00a1
    vendor     = 'Intel Corporation'
    device     = 'I350 Gigabit Network Connection'
    class      = network
    subclass   = ethernet
    bar   [10] = type Memory, range 32, base 0xf0400000, size 1048576, enabled
    bar   [1c] = type Memory, range 32, base 0xf0880000, size 16384, enabled
    cap 01[40] = powerspec 3  supports D0 D3  current D0
    cap 05[50] = MSI supports 1 message, 64 bit, vector masks 
    cap 11[70] = MSI-X supports 10 messages, enabled
                 Table in map 0x1c[0x0], PBA in map 0x1c[0x2000]
    cap 10[a0] = PCI-Express 2 endpoint max data 128(512) FLR NS
                 max read 512
                 link x4(x4) speed 5.0(5.0) ASPM disabled(L0s/L1)
    ecap 0001[100] = AER 2 0 fatal 0 non-fatal 1 corrected
    ecap 0003[140] = Serial 1 a0369fffff4272b4
    ecap 000e[150] = ARI 1
    ecap 0010[160] = SR-IOV 1 IOV disabled, Memory Space disabled, ARI disabled
                     0 VFs configured out of 8 supported
                     First VF RID Offset 0x0180, VF RID Stride 0x0004
                     VF Device ID 0x1520
                     Page Sizes: 4096 (enabled), 8192, 65536, 262144, 1048576, 4194304
    ecap 0017[1a0] = TPH Requester 1
    ecap 000d[1d0] = ACS 1

alc0@pci0:3:0:0:	class=0x020000 rev=0x10 hdr=0x00 vendor=0x1969 device=0x10a1 subvendor=0x1849 subdevice=0x10a1
    vendor     = 'Qualcomm Atheros'
    device     = 'QCA8171 Gigabit Ethernet'
    class      = network
    subclass   = ethernet
    bar   [10] = type Memory, range 64, base 0xf0900000, size 262144, enabled
    bar   [18] = type I/O Port, range 32, base 0xe000, size 128, enabled
    cap 01[40] = powerspec 3  supports D0 D3  current D0
    cap 10[58] = PCI-Express 1 endpoint max data 128(4096)
                 max read 512
                 link x1(x1) speed 2.5(2.5) ASPM disabled(L0s/L1) ClockPM enabled
    cap 05[c0] = MSI supports 16 messages, 64 bit, vector masks 
    cap 11[d8] = MSI-X supports 16 messages, enabled
                 Table in map 0x10[0x2000], PBA in map 0x10[0x3000]
    ecap 0001[100] = AER 1 0 fatal 0 non-fatal 0 corrected
    ecap 0003[180] = Serial 1 ff53bc2ad05099ff
