hostb0@pci0:0:0:0:	class=0x060000 rev=0x07 hdr=0x00 vendor=0x8086 device=0x191f subvendor=0x103c subdevice=0x8054
    vendor     = 'Intel Corporation'
    device     = 'Xeon E3-1200 v5/E3-1500 v5/6th Gen Core Processor Host Bridge/DRAM Registers'
    class      = bridge
    subclass   = HOST-PCI
    cap 09[e0] = vendor (length 16) Intel cap 0 version 1

pcib1@pci0:0:1:0:	class=0x060400 rev=0x07 hdr=0x01 vendor=0x8086 device=0x1901 subvendor=0x103c subdevice=0x8054
    vendor     = 'Intel Corporation'
    device     = '6th-10th Gen Core Processor PCIe Controller (x16)'
    class      = bridge
    subclass   = PCI-PCI
    cap 0d[88] = PCI Bridge subvendor=0x103c subdevice=0x8054
    cap 01[80] = powerspec 3  supports D0 D3  current D0
    cap 05[90] = MSI supports 1 message 
    cap 10[a0] = PCI-Express 2 root port max data 256(256)
                 max read 128
                 link x4(x16) speed 2.5(8.0) ASPM disabled(L0s/L1)
                 slot 1 power limit 75000 mW
    ecap 0002[100] = VC 1 max VC0
    ecap 0005[140] = Root Complex Link Declaration 1
    ecap 0019[d94] = PCIe Sec 1 lane errors 0

vgapci0@pci0:0:2:0:	class=0x030000 rev=0x06 hdr=0x00 vendor=0x8086 device=0x1912 subvendor=0x103c subdevice=0x8054
    vendor     = 'Intel Corporation'
    device     = 'HD Graphics 530'
    class      = display
    subclass   = VGA
    bar   [10] = type Memory, range 64, base 0xd0000000, size 16777216, enabled
    bar   [18] = type Prefetchable Memory, range 64, base 0xc0000000, size 268435456, enabled
    bar   [20] = type I/O Port, range 32, base 0x4000, size 64, enabled
    cap 09[40] = vendor (length 12) Intel cap 0 version 1
    cap 10[70] = PCI-Express 2 root endpoint max data 128(128) FLR
                 max read 128
    cap 05[ac] = MSI supports 1 message 
    cap 01[d0] = powerspec 2  supports D0 D3  current D0
    ecap 001b[100] = Process Address Space ID 1
    ecap 000f[200] = ATS 1
    ecap 0013[300] = Page Page Request 1

xhci0@pci0:0:20:0:	class=0x0c0330 rev=0x31 hdr=0x00 vendor=0x8086 device=0xa12f subvendor=0x103c subdevice=0x8054
    vendor     = 'Intel Corporation'
    device     = '100 Series/C230 Series Chipset Family USB 3.0 xHCI Controller'
    class      = serial bus
    subclass   = USB
    bar   [10] = type Memory, range 64, base 0xd1120000, size 65536, enabled
    cap 01[70] = powerspec 2  supports D0 D3  current D0
    cap 05[80] = MSI supports 8 messages, 64 bit enabled with 1 message

pchtherm0@pci0:0:20:2:	class=0x118000 rev=0x31 hdr=0x00 vendor=0x8086 device=0xa131 subvendor=0x103c subdevice=0x8054
    vendor     = 'Intel Corporation'
    device     = '100 Series/C230 Series Chipset Family Thermal Subsystem'
    class      = dasp
    bar   [10] = type Memory, range 64, base 0xd114a000, size 4096, enabled
    cap 01[50] = powerspec 3  supports D0 D3  current D0
    cap 05[80] = MSI supports 1 message 

ahci0@pci0:0:23:0:	class=0x010601 rev=0x31 hdr=0x00 vendor=0x8086 device=0xa102 subvendor=0x103c subdevice=0x8054
    vendor     = 'Intel Corporation'
    device     = 'Q170/Q150/B150/H170/H110/Z170/CM236 Chipset SATA Controller [AHCI Mode]'
    class      = mass storage
    subclass   = SATA
    bar   [10] = type Memory, range 32, base 0xd1148000, size 8192, enabled
    bar   [14] = type Memory, range 32, base 0xd114e000, size 256, enabled
    bar   [18] = type I/O Port, range 32, base 0x4080, size 8, enabled
    bar   [1c] = type I/O Port, range 32, base 0x4088, size 4, enabled
    bar   [20] = type I/O Port, range 32, base 0x4040, size 32, enabled
    bar   [24] = type Memory, range 32, base 0xd114c000, size 2048, enabled
    cap 05[80] = MSI supports 1 message enabled with 1 message
    cap 01[70] = powerspec 3  supports D0 D3  current D0
    cap 12[a8] = SATA Index-Data Pair

pcib2@pci0:0:28:0:	class=0x060400 rev=0xf1 hdr=0x01 vendor=0x8086 device=0xa115 subvendor=0x103c subdevice=0x8054
    vendor     = 'Intel Corporation'
    device     = '100 Series/C230 Series Chipset Family PCI Express Root Port'
    class      = bridge
    subclass   = PCI-PCI
    cap 10[40] = PCI-Express 2 root port max data 128(256) ARI disabled
                 max read 128
                 link x0(x1) speed 0.0(8.0)
                 slot 5 power limit 100 mW HotPlug(empty) surprise
    cap 05[80] = MSI supports 1 message enabled with 1 message
    cap 0d[90] = PCI Bridge subvendor=0x103c subdevice=0x8054
    cap 01[a0] = powerspec 3  supports D0 D3  current D0
    ecap 0001[100] = AER 1 0 fatal 0 non-fatal 0 corrected
    ecap 000d[140] = ACS 1
    ecap 0019[220] = PCIe Sec 1 lane errors 0

pcib3@pci0:0:28:6:	class=0x060400 rev=0xf1 hdr=0x01 vendor=0x8086 device=0xa116 subvendor=0x103c subdevice=0x8054
    vendor     = 'Intel Corporation'
    device     = '100 Series/C230 Series Chipset Family PCI Express Root Port'
    class      = bridge
    subclass   = PCI-PCI
    cap 10[40] = PCI-Express 2 root port max data 128(256) ARI disabled
                 max read 128
                 link x0(x1) speed 0.0(8.0)
                 slot 6 power limit 100 mW HotPlug(empty) surprise
    cap 05[80] = MSI supports 1 message enabled with 1 message
    cap 0d[90] = PCI Bridge subvendor=0x103c subdevice=0x8054
    cap 01[a0] = powerspec 3  supports D0 D3  current D0
    ecap 0001[100] = AER 1 0 fatal 0 non-fatal 0 corrected
    ecap 000d[140] = ACS 1
    ecap 0019[220] = PCIe Sec 1 lane errors 0

pcib4@pci0:0:29:0:	class=0x060400 rev=0xf1 hdr=0x01 vendor=0x8086 device=0xa118 subvendor=0x103c subdevice=0x8054
    vendor     = 'Intel Corporation'
    device     = '100 Series/C230 Series Chipset Family PCI Express Root Port'
    class      = bridge
    subclass   = PCI-PCI
    cap 10[40] = PCI-Express 2 root port max data 128(256) ARI disabled
                 max read 128
                 link x0(x4) speed 0.0(8.0)
                 slot 8 power limit 250 mW HotPlug(empty) surprise
    cap 05[80] = MSI supports 1 message enabled with 1 message
    cap 0d[90] = PCI Bridge subvendor=0x103c subdevice=0x8054
    cap 01[a0] = powerspec 3  supports D0 D3  current D0
    ecap 0001[100] = AER 1 0 fatal 0 non-fatal 0 corrected
    ecap 000d[140] = ACS 1
    ecap 0019[220] = PCIe Sec 1 lane errors 0

isab0@pci0:0:31:0:	class=0x060100 rev=0x31 hdr=0x00 vendor=0x8086 device=0xa146 subvendor=0x103c subdevice=0x8054
    vendor     = 'Intel Corporation'
    device     = 'Q170 Chipset LPC/eSPI Controller'
    class      = bridge
    subclass   = PCI-ISA

none0@pci0:0:31:2:	class=0x058000 rev=0x31 hdr=0x00 vendor=0x8086 device=0xa121 subvendor=0x103c subdevice=0x8054
    vendor     = 'Intel Corporation'
    device     = '100 Series/C230 Series Chipset Family Power Management Controller'
    class      = memory
    bar   [10] = type Memory, range 32, base 0xd1140000, size 16384, enabled

hdac0@pci0:0:31:3:	class=0x040300 rev=0x31 hdr=0x00 vendor=0x8086 device=0xa170 subvendor=0x103c subdevice=0x8054
    vendor     = 'Intel Corporation'
    device     = '100 Series/C230 Series Chipset Family HD Audio Controller'
    class      = multimedia
    subclass   = HDA
    bar   [10] = type Memory, range 64, base 0xd1144000, size 16384, enabled
    bar   [20] = type Memory, range 64, base 0xd1130000, size 65536, enabled
    cap 01[50] = powerspec 3  supports D0 D3  current D0
    cap 05[60] = MSI supports 1 message, 64 bit enabled with 1 message

ichsmb0@pci0:0:31:4:	class=0x0c0500 rev=0x31 hdr=0x00 vendor=0x8086 device=0xa123 subvendor=0x103c subdevice=0x8054
    vendor     = 'Intel Corporation'
    device     = '100 Series/C230 Series Chipset Family SMBus'
    class      = serial bus
    subclass   = SMBus
    bar   [10] = type Memory, range 64, base 0xd114d000, size 256, enabled
    bar   [20] = type I/O Port, range 32, base 0xefa0, size 32, enabled

em2@pci0:0:31:6:	class=0x020000 rev=0x31 hdr=0x00 vendor=0x8086 device=0x15b7 subvendor=0x103c subdevice=0x8053
    vendor     = 'Intel Corporation'
    device     = 'Ethernet Connection (2) I219-LM'
    class      = network
    subclass   = ethernet
    bar   [10] = type Memory, range 32, base 0xd1100000, size 131072, enabled
    cap 01[c8] = powerspec 3  supports D0 D3  current D0
    cap 05[d0] = MSI supports 1 message, 64 bit enabled with 1 message
    cap 13[e0] = PCI Advanced Features: FLR TP

em0@pci0:1:0:0:	class=0x020000 rev=0x06 hdr=0x00 vendor=0x8086 device=0x105e subvendor=0x1014 subdevice=0x0340
    vendor     = 'Intel Corporation'
    device     = '82571EB/82571GB Gigabit Ethernet Controller D0/D1 (copper applications)'
    class      = network
    subclass   = ethernet
    bar   [10] = type Memory, range 32, base 0xd1000000, size 131072, enabled
    bar   [14] = type Memory, range 32, base 0xd1020000, size 131072, enabled
    bar   [18] = type I/O Port, range 32, base 0x3000, size 32, enabled
    cap 01[c8] = powerspec 2  supports D0 D3  current D0
    cap 05[d0] = MSI supports 1 message, 64 bit enabled with 1 message
    cap 10[e0] = PCI-Express 1 endpoint max data 256(256) RO NS
                 max read 512
                 link x4(x4) speed 2.5(2.5) ASPM disabled(L0s)
    ecap 0001[100] = AER 1 0 fatal 1 non-fatal 0 corrected
    ecap 0003[140] = Serial 1 5cf3fcffffeb9a16

em1@pci0:1:0:1:	class=0x020000 rev=0x06 hdr=0x00 vendor=0x8086 device=0x105e subvendor=0x1014 subdevice=0x0340
    vendor     = 'Intel Corporation'
    device     = '82571EB/82571GB Gigabit Ethernet Controller D0/D1 (copper applications)'
    class      = network
    subclass   = ethernet
    bar   [10] = type Memory, range 32, base 0xd1040000, size 131072, enabled
    bar   [14] = type Memory, range 32, base 0xd1060000, size 131072, enabled
    bar   [18] = type I/O Port, range 32, base 0x3020, size 32, enabled
    cap 01[c8] = powerspec 2  supports D0 D3  current D0
    cap 05[d0] = MSI supports 1 message, 64 bit enabled with 1 message
    cap 10[e0] = PCI-Express 1 endpoint max data 256(256) RO NS
                 max read 512
                 link x4(x4) speed 2.5(2.5) ASPM disabled(L0s)
    ecap 0001[100] = AER 1 0 fatal 1 non-fatal 0 corrected
    ecap 0003[140] = Serial 1 5cf3fcffffeb9a16
