hostb0@pci0:0:0:0:	class=0x060000 rev=0x01 hdr=0x00 vendor=0x1022 device=0x14b5 subvendor=0x1022 subdevice=0x14b5
    vendor     = 'Advanced Micro Devices, Inc. [AMD]'
    class      = bridge
    subclass   = HOST-PCI

none0@pci0:0:0:2:	class=0x080600 rev=0x00 hdr=0x00 vendor=0x1022 device=0x14b6 subvendor=0x1022 subdevice=0x14b6
    vendor     = 'Advanced Micro Devices, Inc. [AMD]'
    class      = base peripheral
    subclass   = IOMMU
    cap 0f[40] = unknown
    cap 05[64] = MSI supports 4 messages, 64 bit 
    cap 08[74] = HT MSI fixed address window enabled at 0xfee00000

hostb1@pci0:0:1:0:	class=0x060000 rev=0x01 hdr=0x00 vendor=0x1022 device=0x14b7 subvendor=0x0000 subdevice=0x0000
    vendor     = 'Advanced Micro Devices, Inc. [AMD]'
    class      = bridge
    subclass   = HOST-PCI

pcib1@pci0:0:1:1:	class=0x060400 rev=0x00 hdr=0x01 vendor=0x1022 device=0x14b8 subvendor=0x1043 subdevice=0x1d42
    vendor     = 'Advanced Micro Devices, Inc. [AMD]'
    class      = bridge
    subclass   = PCI-PCI
    cap 01[50] = powerspec 3  supports D0 D3  current D0
    cap 10[58] = PCI-Express 2 root port max data 256(256) RO NS ARI disabled
                 max read 256
                 link x8(x8) speed 16.0(16.0)
                 slot 0 power limit 75000 mW HotPlug(present)
    cap 05[a0] = MSI supports 1 message, 64 bit enabled with 1 message
    cap 0d[c0] = PCI Bridge subvendor=0x1043 subdevice=0x1d42
    cap 08[c8] = HT MSI fixed address window enabled at 0xfee00000
    ecap 000b[100] = Vendor [1] ID 0001 Rev 1 Length 16
    ecap 0001[150] = AER 2 0 fatal 0 non-fatal 0 corrected
    ecap 0019[270] = PCIe Sec 1 lane errors 0
    ecap 000d[2a0] = ACS 1
    ecap 0025[400] = Data Link Feature 1
    ecap 0026[410] = Physical Layer 16.0 GT/s 1
    ecap 0027[440] = Lane Margining at Receiver 1

hostb2@pci0:0:2:0:	class=0x060000 rev=0x01 hdr=0x00 vendor=0x1022 device=0x14b7 subvendor=0x0000 subdevice=0x0000
    vendor     = 'Advanced Micro Devices, Inc. [AMD]'
    class      = bridge
    subclass   = HOST-PCI

pcib4@pci0:0:2:1:	class=0x060400 rev=0x00 hdr=0x01 vendor=0x1022 device=0x14ba subvendor=0x1043 subdevice=0x1d42
    vendor     = 'Advanced Micro Devices, Inc. [AMD]'
    class      = bridge
    subclass   = PCI-PCI
    cap 01[50] = powerspec 3  supports D0 D3  current D0
    cap 10[58] = PCI-Express 2 root port max data 128(256) RO NS ARI disabled
                 max read 128
                 link x1(x1) speed 2.5(16.0) ASPM L1(L1)
                 slot 0 power limit 75000 mW
    cap 05[a0] = MSI supports 1 message, 64 bit 
    cap 0d[c0] = PCI Bridge subvendor=0x1043 subdevice=0x1d42
    cap 08[c8] = HT MSI fixed address window enabled at 0xfee00000
    ecap 000b[100] = Vendor [1] ID 0001 Rev 1 Length 16
    ecap 0001[150] = AER 2 0 fatal 0 non-fatal 0 corrected
    ecap 0019[270] = PCIe Sec 1 lane errors 0
    ecap 000d[2a0] = ACS 1
    ecap 001e[370] = L1 PM Substates 1
    ecap 0025[400] = Data Link Feature 1
    ecap 0026[410] = Physical Layer 16.0 GT/s 1
    ecap 0027[440] = Lane Margining at Receiver 1

pcib5@pci0:0:2:2:	class=0x060400 rev=0x00 hdr=0x01 vendor=0x1022 device=0x14ba subvendor=0x1043 subdevice=0x1d42
    vendor     = 'Advanced Micro Devices, Inc. [AMD]'
    class      = bridge
    subclass   = PCI-PCI
    cap 01[50] = powerspec 3  supports D0 D3  current D0
    cap 10[58] = PCI-Express 2 root port max data 128(256) RO NS ARI disabled
                 max read 128
                 link x1(x1) speed 5.0(16.0) ASPM L1(L1)
                 slot 0 power limit 75000 mW
    cap 05[a0] = MSI supports 1 message, 64 bit 
    cap 0d[c0] = PCI Bridge subvendor=0x1043 subdevice=0x1d42
    cap 08[c8] = HT MSI fixed address window enabled at 0xfee00000
    ecap 000b[100] = Vendor [1] ID 0001 Rev 1 Length 16
    ecap 0001[150] = AER 2 0 fatal 0 non-fatal 0 corrected
    ecap 0019[270] = PCIe Sec 1 lane errors 0
    ecap 000d[2a0] = ACS 1
    ecap 001e[370] = L1 PM Substates 1
    ecap 0025[400] = Data Link Feature 1
    ecap 0026[410] = Physical Layer 16.0 GT/s 1
    ecap 0027[440] = Lane Margining at Receiver 1

pcib6@pci0:0:2:4:	class=0x060400 rev=0x00 hdr=0x01 vendor=0x1022 device=0x14ba subvendor=0x1043 subdevice=0x1d42
    vendor     = 'Advanced Micro Devices, Inc. [AMD]'
    class      = bridge
    subclass   = PCI-PCI
    cap 01[50] = powerspec 3  supports D0 D3  current D0
    cap 10[58] = PCI-Express 2 root port max data 256(256) RO NS ARI enabled
                 max read 256
                 link x4(x4) speed 16.0(16.0) ASPM L1(L1)
                 slot 0 power limit 75000 mW
    cap 05[a0] = MSI supports 1 message, 64 bit 
    cap 0d[c0] = PCI Bridge subvendor=0x1043 subdevice=0x1d42
    cap 08[c8] = HT MSI fixed address window enabled at 0xfee00000
    ecap 000b[100] = Vendor [1] ID 0001 Rev 1 Length 16
    ecap 0001[150] = AER 2 0 fatal 0 non-fatal 0 corrected
    ecap 0019[270] = PCIe Sec 1 lane errors 0
    ecap 000d[2a0] = ACS 1
    ecap 001e[370] = L1 PM Substates 1
    ecap 0025[400] = Data Link Feature 1
    ecap 0026[410] = Physical Layer 16.0 GT/s 1
    ecap 0027[440] = Lane Margining at Receiver 1

hostb3@pci0:0:3:0:	class=0x060000 rev=0x01 hdr=0x00 vendor=0x1022 device=0x14b7 subvendor=0x0000 subdevice=0x0000
    vendor     = 'Advanced Micro Devices, Inc. [AMD]'
    class      = bridge
    subclass   = HOST-PCI

hostb4@pci0:0:4:0:	class=0x060000 rev=0x01 hdr=0x00 vendor=0x1022 device=0x14b7 subvendor=0x0000 subdevice=0x0000
    vendor     = 'Advanced Micro Devices, Inc. [AMD]'
    class      = bridge
    subclass   = HOST-PCI

hostb5@pci0:0:8:0:	class=0x060000 rev=0x01 hdr=0x00 vendor=0x1022 device=0x14b7 subvendor=0x0000 subdevice=0x0000
    vendor     = 'Advanced Micro Devices, Inc. [AMD]'
    class      = bridge
    subclass   = HOST-PCI

pcib7@pci0:0:8:1:	class=0x060400 rev=0x10 hdr=0x01 vendor=0x1022 device=0x14b9 subvendor=0x1022 subdevice=0x14b9
    vendor     = 'Advanced Micro Devices, Inc. [AMD]'
    class      = bridge
    subclass   = PCI-PCI
    cap 01[50] = powerspec 3  supports D0 D3  current D0
    cap 10[58] = PCI-Express 2 root port max data 256(512) RO NS
                 max read 512
                 link x16(x16) speed 16.0(16.0) ASPM disabled(L0s/L1)
    cap 05[a0] = MSI supports 1 message, 64 bit 
    cap 0d[c0] = PCI Bridge subvendor=0x1022 subdevice=0x14b9
    ecap 000b[100] = Vendor [1] ID 0001 Rev 1 Length 16
    ecap 0019[270] = PCIe Sec 1 lane errors 0
    ecap 000d[2a0] = ACS 1
    ecap 0025[400] = Data Link Feature 1
    ecap 0026[410] = Physical Layer 16.0 GT/s 1
    ecap 0027[450] = Lane Margining at Receiver 1

pcib8@pci0:0:8:3:	class=0x060400 rev=0x10 hdr=0x01 vendor=0x1022 device=0x14b9 subvendor=0x1022 subdevice=0x14b9
    vendor     = 'Advanced Micro Devices, Inc. [AMD]'
    class      = bridge
    subclass   = PCI-PCI
    cap 01[50] = powerspec 3  supports D0 D3  current D0
    cap 10[58] = PCI-Express 2 root port max data 256(512) RO NS
                 max read 512
                 link x16(x16) speed 16.0(16.0) ASPM disabled(L0s/L1)
    cap 05[a0] = MSI supports 1 message, 64 bit 
    cap 0d[c0] = PCI Bridge subvendor=0x1022 subdevice=0x14b9
    ecap 000b[100] = Vendor [1] ID 0001 Rev 1 Length 16
    ecap 0001[150] = AER 2 0 fatal 0 non-fatal 0 corrected
    ecap 0019[270] = PCIe Sec 1 lane errors 0
    ecap 000d[2a0] = ACS 1
    ecap 0025[400] = Data Link Feature 1
    ecap 0026[410] = Physical Layer 16.0 GT/s 1
    ecap 0027[450] = Lane Margining at Receiver 1

none1@pci0:0:20:0:	class=0x0c0500 rev=0x71 hdr=0x00 vendor=0x1022 device=0x790b subvendor=0x1043 subdevice=0x1d42
    vendor     = 'Advanced Micro Devices, Inc. [AMD]'
    device     = 'FCH SMBus Controller'
    class      = serial bus
    subclass   = SMBus

isab0@pci0:0:20:3:	class=0x060100 rev=0x51 hdr=0x00 vendor=0x1022 device=0x790e subvendor=0x1043 subdevice=0x1d42
    vendor     = 'Advanced Micro Devices, Inc. [AMD]'
    device     = 'FCH LPC Bridge'
    class      = bridge
    subclass   = PCI-ISA

hostb6@pci0:0:24:0:	class=0x060000 rev=0x00 hdr=0x00 vendor=0x1022 device=0x1679 subvendor=0x0000 subdevice=0x0000
    vendor     = 'Advanced Micro Devices, Inc. [AMD]'
    class      = bridge
    subclass   = HOST-PCI

hostb7@pci0:0:24:1:	class=0x060000 rev=0x00 hdr=0x00 vendor=0x1022 device=0x167a subvendor=0x0000 subdevice=0x0000
    vendor     = 'Advanced Micro Devices, Inc. [AMD]'
    class      = bridge
    subclass   = HOST-PCI

hostb8@pci0:0:24:2:	class=0x060000 rev=0x00 hdr=0x00 vendor=0x1022 device=0x167b subvendor=0x0000 subdevice=0x0000
    vendor     = 'Advanced Micro Devices, Inc. [AMD]'
    class      = bridge
    subclass   = HOST-PCI

hostb9@pci0:0:24:3:	class=0x060000 rev=0x00 hdr=0x00 vendor=0x1022 device=0x167c subvendor=0x0000 subdevice=0x0000
    vendor     = 'Advanced Micro Devices, Inc. [AMD]'
    class      = bridge
    subclass   = HOST-PCI

hostb10@pci0:0:24:4:	class=0x060000 rev=0x00 hdr=0x00 vendor=0x1022 device=0x167d subvendor=0x0000 subdevice=0x0000
    vendor     = 'Advanced Micro Devices, Inc. [AMD]'
    class      = bridge
    subclass   = HOST-PCI

hostb11@pci0:0:24:5:	class=0x060000 rev=0x00 hdr=0x00 vendor=0x1022 device=0x167e subvendor=0x0000 subdevice=0x0000
    vendor     = 'Advanced Micro Devices, Inc. [AMD]'
    class      = bridge
    subclass   = HOST-PCI

hostb12@pci0:0:24:6:	class=0x060000 rev=0x00 hdr=0x00 vendor=0x1022 device=0x167f subvendor=0x0000 subdevice=0x0000
    vendor     = 'Advanced Micro Devices, Inc. [AMD]'
    class      = bridge
    subclass   = HOST-PCI

hostb13@pci0:0:24:7:	class=0x060000 rev=0x00 hdr=0x00 vendor=0x1022 device=0x1680 subvendor=0x0000 subdevice=0x0000
    vendor     = 'Advanced Micro Devices, Inc. [AMD]'
    class      = bridge
    subclass   = HOST-PCI

pcib2@pci0:1:0:0:	class=0x060400 rev=0xc2 hdr=0x01 vendor=0x1002 device=0x1478 subvendor=0x0000 subdevice=0x0000
    vendor     = 'Advanced Micro Devices, Inc. [AMD/ATI]'
    device     = 'Navi 10 XL Upstream Port of PCI Express Switch'
    class      = bridge
    subclass   = PCI-PCI
    bar   [10] = type Memory, range 32, base 0xfcc00000, size 16384, enabled
    cap 09[48] = vendor (length 8)
    cap 01[50] = powerspec 3  supports D0 D3  current D0
    cap 10[58] = PCI-Express 2 upstream port max data 256(512) RO NS
                 max read 512
                 link x8(x8) speed 16.0(16.0) ASPM disabled(L1)
    cap 05[a0] = MSI supports 1 message, 64 bit 
    ecap 000b[100] = Vendor [1] ID 0001 Rev 1 Length 16
    ecap 0001[150] = AER 2 0 fatal 0 non-fatal 1 corrected
    ecap 0019[270] = PCIe Sec 1 lane errors 0
    ecap 0018[320] = LTR 1
    ecap 001e[370] = L1 PM Substates 1
    ecap 0025[400] = Data Link Feature 1
    ecap 0026[410] = Physical Layer 16.0 GT/s 1
    ecap 0027[440] = Lane Margining at Receiver 1

pcib3@pci0:2:0:0:	class=0x060400 rev=0x00 hdr=0x01 vendor=0x1002 device=0x1479 subvendor=0x1002 subdevice=0x1479
    vendor     = 'Advanced Micro Devices, Inc. [AMD/ATI]'
    device     = 'Navi 10 XL Downstream Port of PCI Express Switch'
    class      = bridge
    subclass   = PCI-PCI
    cap 01[50] = powerspec 3  supports D0 D3  current D0
    cap 10[58] = PCI-Express 2 downstream port max data 256(512) RO NS
                 max read 512
                 link x16(x16) speed 16.0(16.0) ASPM disabled(L0s/L1)
    cap 05[a0] = MSI supports 1 message, 64 bit 
    cap 0d[c0] = PCI Bridge subvendor=0x1002 subdevice=0x1479
    ecap 000b[100] = Vendor [1] ID 0001 Rev 1 Length 16
    ecap 0001[150] = AER 2 0 fatal 0 non-fatal 1 corrected
    ecap 0019[270] = PCIe Sec 1 lane errors 0
    ecap 000d[2a0] = ACS 1
    ecap 0025[400] = Data Link Feature 1
    ecap 0026[410] = Physical Layer 16.0 GT/s 1
    ecap 0027[440] = Lane Margining at Receiver 1

vgapci0@pci0:3:0:0:	class=0x030000 rev=0xc2 hdr=0x00 vendor=0x1002 device=0x73ef subvendor=0x1043 subdevice=0x1dec
    vendor     = 'Advanced Micro Devices, Inc. [AMD/ATI]'
    class      = display
    subclass   = VGA
    bar   [10] = type Prefetchable Memory, range 64, base 0xfc00000000, size 8589934592, enabled
    bar   [18] = type Prefetchable Memory, range 64, base 0xfe00000000, size 268435456, enabled
    bar   [20] = type I/O Port, range 32, base 0xf000, size 256, enabled
    bar   [24] = type Memory, range 32, base 0xfca00000, size 1048576, enabled
    cap 09[48] = vendor (length 8)
    cap 01[50] = powerspec 3  supports D0 D3  current D0
    cap 10[64] = PCI-Express 2 legacy endpoint max data 256(256) RO NS
                 max read 512
                 link x16(x16) speed 16.0(16.0) ASPM disabled(L0s/L1) ClockPM enabled
    cap 05[a0] = MSI supports 1 message, 64 bit 
    ecap 000b[100] = Vendor [1] ID 0001 Rev 1 Length 16
    ecap 0001[150] = AER 2 0 fatal 0 non-fatal 1 corrected
    ecap 0015[200] = Resizable BAR 1
    ecap 0004[240] = Power Budgeting 1
    ecap 0019[270] = PCIe Sec 1 lane errors 0
    ecap 000d[2a0] = ACS 1
    ecap 001b[2d0] = Process Address Space ID 1
    ecap 0018[320] = LTR 1
    ecap 0026[410] = Physical Layer 16.0 GT/s 1
    ecap 0027[440] = Lane Margining at Receiver 1

hdac0@pci0:3:0:1:	class=0x040300 rev=0x00 hdr=0x00 vendor=0x1002 device=0xab28 subvendor=0x1043 subdevice=0x1dec
    vendor     = 'Advanced Micro Devices, Inc. [AMD/ATI]'
    device     = 'Navi 21 HDMI Audio [Radeon RX 6800/6800 XT / 6900 XT]'
    class      = multimedia
    subclass   = HDA
    bar   [10] = type Memory, range 32, base 0xfcb20000, size 16384, enabled
    cap 09[48] = vendor (length 8)
    cap 01[50] = powerspec 3  supports D0 D3  current D0
    cap 10[64] = PCI-Express 2 legacy endpoint max data 256(256) RO NS
                 max read 512
                 link x16(x16) speed 16.0(16.0) ASPM disabled(L0s/L1) ClockPM enabled
    cap 05[a0] = MSI supports 1 message, 64 bit enabled with 1 message
    ecap 000b[100] = Vendor [1] ID 0001 Rev 1 Length 16
    ecap 0001[150] = AER 2 0 fatal 0 non-fatal 1 corrected
    ecap 000d[2a0] = ACS 1

sdhci_pci0@pci0:4:0:0:	class=0x080501 rev=0x01 hdr=0x00 vendor=0x1217 device=0x8520 subvendor=0x1043 subdevice=0x202f
    vendor     = 'O2 Micro, Inc.'
    device     = 'SD/MMC Card Reader Controller'
    class      = base peripheral
    subclass   = SD host controller
    bar   [10] = type Memory, range 32, base 0xfcf01000, size 4096, enabled
    bar   [14] = type Memory, range 32, base 0xfcf00000, size 2048, enabled
    cap 01[6c] = powerspec 3  supports D0 D3  current D0
    cap 05[48] = MSI supports 1 message, 64 bit, vector masks enabled with 1 message
    cap 10[80] = PCI-Express 2 endpoint max data 128(128) RO NS
                 max read 128
                 link x1(x1) speed 2.5(2.5) ASPM L1(L0s/L1) ClockPM enabled
    ecap 0002[100] = VC 1 max VC0
    ecap 0018[230] = LTR 1
    ecap 001e[240] = L1 PM Substates 1

none2@pci0:5:0:0:	class=0x028000 rev=0x00 hdr=0x00 vendor=0x14c3 device=0x7922 subvendor=0x1a3b subdevice=0x5300
    vendor     = 'MEDIATEK Corp.'
    class      = network
    bar   [10] = type Prefetchable Memory, range 64, base 0xfe30300000, size 1048576, enabled
    bar   [18] = type Memory, range 64, base 0xfce00000, size 32768, enabled
    cap 10[80] = PCI-Express 2 endpoint max data 128(128) FLR RO NS
                 max read 512
                 link x1(x1) speed 5.0(5.0) ASPM L1(L0s/L1) ClockPM enabled
    cap 05[e0] = MSI supports 32 messages, 64 bit, vector masks 
    cap 01[f8] = powerspec 3  supports D0 D3  current D0
    ecap 000b[100] = Vendor [1] ID 1556 Rev 1 Length 8
    ecap 0018[108] = LTR 1
    ecap 001e[110] = L1 PM Substates 1
    ecap 0001[200] = AER 2 0 fatal 0 non-fatal 1 corrected

nvme0@pci0:6:0:0:	class=0x010802 rev=0x01 hdr=0x00 vendor=0x1344 device=0x5411 subvendor=0x1344 subdevice=0x2100
    vendor     = 'Micron Technology Inc'
    class      = mass storage
    subclass   = NVM
    bar   [10] = type Memory, range 64, base 0xfcd00000, size 16384, enabled
    cap 10[80] = PCI-Express 2 endpoint max data 256(256) FLR RO NS
                 max read 512
                 link x4(x4) speed 16.0(16.0) ASPM L1(L1)
    cap 11[d0] = MSI-X supports 9 messages, enabled
                 Table in map 0x10[0x2000], PBA in map 0x10[0x3000]
    cap 05[e0] = MSI supports 8 messages, 64 bit, vector masks 
    cap 01[f8] = powerspec 3  supports D0 D3  current D0
    ecap 0018[100] = LTR 1
    ecap 001e[110] = L1 PM Substates 1
    ecap 000e[128] = ARI 1
    ecap 0025[1e0] = Data Link Feature 1
    ecap 0001[200] = AER 2 0 fatal 0 non-fatal 1 corrected
    ecap 0019[300] = PCIe Sec 1 lane errors 0
    ecap 0026[340] = Physical Layer 16.0 GT/s 1
    ecap 0027[378] = Lane Margining at Receiver 1

vgapci1@pci0:7:0:0:	class=0x030000 rev=0xc7 hdr=0x00 vendor=0x1002 device=0x1681 subvendor=0x1043 subdevice=0x1dec
    vendor     = 'Advanced Micro Devices, Inc. [AMD/ATI]'
    device     = 'Rembrandt'
    class      = display
    subclass   = VGA
    bar   [10] = type Prefetchable Memory, range 64, base 0xfe20000000, size 268435456, enabled
    bar   [18] = type Prefetchable Memory, range 64, base 0xfe30000000, size 2097152, enabled
    bar   [20] = type I/O Port, range 32, base 0xe000, size 256, enabled
    bar   [24] = type Memory, range 32, base 0xfc600000, size 524288, enabled
    cap 09[48] = vendor (length 8)
    cap 01[50] = powerspec 3  supports D0 D3  current D0
    cap 10[64] = PCI-Express 2 legacy endpoint max data 256(256) RO NS
                 max read 512
                 link x16(x16) speed 16.0(16.0) ASPM disabled(L0s/L1)
    cap 05[a0] = MSI supports 4 messages, 64 bit 
    cap 11[c0] = MSI-X supports 4 messages
                 Table in map 0x24[0x42000], PBA in map 0x24[0x43000]
    ecap 000b[100] = Vendor [1] ID 0001 Rev 1 Length 16
    ecap 0019[270] = PCIe Sec 1 lane errors 0
    ecap 000d[2a0] = ACS 1
    ecap 000f[2b0] = ATS 1
    ecap 0013[2c0] = Page Page Request 1
    ecap 001b[2d0] = Process Address Space ID 1
    ecap 0026[410] = Physical Layer 16.0 GT/s 1
    ecap 0027[450] = Lane Margining at Receiver 1

hdac1@pci0:7:0:1:	class=0x040300 rev=0x00 hdr=0x00 vendor=0x1002 device=0x1640 subvendor=0x1002 subdevice=0x1640
    vendor     = 'Advanced Micro Devices, Inc. [AMD/ATI]'
    class      = multimedia
    subclass   = HDA
    bar   [10] = type Memory, range 32, base 0xfc6c8000, size 16384, enabled
    cap 09[48] = vendor (length 8)
    cap 01[50] = powerspec 3  supports D0 D3  current D0
    cap 10[64] = PCI-Express 2 legacy endpoint max data 256(256) RO NS
                 max read 512
                 link x16(x16) speed 16.0(16.0) ASPM disabled(L0s/L1)
    cap 05[a0] = MSI supports 1 message, 64 bit enabled with 1 message
    ecap 000b[100] = Vendor [1] ID 0001 Rev 1 Length 16
    ecap 000d[2a0] = ACS 1

none3@pci0:7:0:2:	class=0x108000 rev=0x00 hdr=0x00 vendor=0x1022 device=0x1649 subvendor=0x1022 subdevice=0x1649
    vendor     = 'Advanced Micro Devices, Inc. [AMD]'
    device     = 'VanGogh PSP/CCP'
    class      = encrypt/decrypt
    bar   [18] = type Memory, range 32, base 0xfc500000, size 1048576, enabled
    bar   [24] = type Memory, range 32, base 0xfc6cc000, size 8192, enabled
    cap 09[48] = vendor (length 8)
    cap 01[50] = powerspec 3  supports D0 D3  current D0
    cap 10[64] = PCI-Express 2 endpoint max data 256(256) RO NS
                 max read 512
                 link x16(x16) speed 16.0(16.0) ASPM disabled(L0s/L1)
    cap 05[a0] = MSI supports 2 messages, 64 bit 
    cap 11[c0] = MSI-X supports 2 messages
                 Table in map 0x24[0x0], PBA in map 0x24[0x1000]
    ecap 000b[100] = Vendor [1] ID 0001 Rev 1 Length 16
    ecap 000d[2a0] = ACS 1

xhci0@pci0:7:0:3:	class=0x0c0330 rev=0x00 hdr=0x00 vendor=0x1022 device=0x161d subvendor=0x1043 subdevice=0x201f
    vendor     = 'Advanced Micro Devices, Inc. [AMD]'
    class      = serial bus
    subclass   = USB
    bar   [10] = type Memory, range 64, base 0xfc400000, size 1048576, enabled
    cap 09[48] = vendor (length 8)
    cap 01[50] = powerspec 3  supports D0 D3  current D0
    cap 10[64] = PCI-Express 2 endpoint max data 256(256) RO NS
                 max read 512
                 link x16(x16) speed 16.0(16.0) ASPM disabled(L0s/L1)
    cap 05[a0] = MSI supports 8 messages, 64 bit 
    cap 11[c0] = MSI-X supports 8 messages, enabled
                 Table in map 0x10[0xfe000], PBA in map 0x10[0xff000]
    ecap 000b[100] = Vendor [1] ID 0001 Rev 1 Length 16
    ecap 000d[2a0] = ACS 1

xhci1@pci0:7:0:4:	class=0x0c0330 rev=0x00 hdr=0x00 vendor=0x1022 device=0x161e subvendor=0x1043 subdevice=0x201f
    vendor     = 'Advanced Micro Devices, Inc. [AMD]'
    class      = serial bus
    subclass   = USB
    bar   [10] = type Memory, range 64, base 0xfc300000, size 1048576, enabled
    cap 09[48] = vendor (length 8)
    cap 01[50] = powerspec 3  supports D0 D3  current D0
    cap 10[64] = PCI-Express 2 endpoint max data 256(256) RO NS
                 max read 512
                 link x16(x16) speed 16.0(16.0) ASPM disabled(L0s/L1)
    cap 05[a0] = MSI supports 8 messages, 64 bit 
    cap 11[c0] = MSI-X supports 8 messages, enabled
                 Table in map 0x10[0xfe000], PBA in map 0x10[0xff000]
    ecap 000b[100] = Vendor [1] ID 0001 Rev 1 Length 16
    ecap 000d[2a0] = ACS 1

none4@pci0:7:0:5:	class=0x048000 rev=0x60 hdr=0x00 vendor=0x1022 device=0x15e2 subvendor=0x1043 subdevice=0x1d42
    vendor     = 'Advanced Micro Devices, Inc. [AMD]'
    device     = 'Raven/Raven2/FireFlight/Renoir Audio Processor'
    class      = multimedia
    bar   [10] = type Memory, range 32, base 0xfc680000, size 262144, enabled
    cap 09[48] = vendor (length 8)
    cap 01[50] = powerspec 3  supports D0 D3  current D0
    cap 10[64] = PCI-Express 2 endpoint max data 256(256) RO NS
                 max read 512
                 link x16(x16) speed 16.0(16.0) ASPM disabled(L0s/L1)
    cap 05[a0] = MSI supports 1 message, 64 bit 
    ecap 000b[100] = Vendor [1] ID 0001 Rev 1 Length 16
    ecap 000d[2a0] = ACS 1

hdac2@pci0:7:0:6:	class=0x040300 rev=0x00 hdr=0x00 vendor=0x1022 device=0x15e3 subvendor=0x1043 subdevice=0x1d42
    vendor     = 'Advanced Micro Devices, Inc. [AMD]'
    device     = 'Family 17h (Models 10h-1fh) HD Audio Controller'
    class      = multimedia
    subclass   = HDA
    bar   [10] = type Memory, range 32, base 0xfc6c0000, size 32768, enabled
    cap 09[48] = vendor (length 8)
    cap 01[50] = powerspec 3  supports D0 D3  current D0
    cap 10[64] = PCI-Express 2 endpoint max data 256(256) RO NS
                 max read 512
                 link x16(x16) speed 16.0(16.0) ASPM disabled(L0s/L1)
    cap 05[a0] = MSI supports 1 message, 64 bit enabled with 1 message
    ecap 000b[100] = Vendor [1] ID 0001 Rev 1 Length 16
    ecap 000d[2a0] = ACS 1

xhci2@pci0:8:0:0:	class=0x0c0330 rev=0x00 hdr=0x00 vendor=0x1022 device=0x161f subvendor=0x1043 subdevice=0x201f
    vendor     = 'Advanced Micro Devices, Inc. [AMD]'
    class      = serial bus
    subclass   = USB
    bar   [10] = type Memory, range 64, base 0xfc900000, size 1048576, enabled
    cap 09[48] = vendor (length 8)
    cap 01[50] = powerspec 3  supports D0 D3  current D0
    cap 10[64] = PCI-Express 2 endpoint max data 256(256) RO NS
                 max read 512
                 link x16(x16) speed 16.0(16.0) ASPM disabled(L0s/L1)
    cap 05[a0] = MSI supports 8 messages, 64 bit 
    cap 11[c0] = MSI-X supports 8 messages, enabled
                 Table in map 0x10[0xfe000], PBA in map 0x10[0xff000]
    ecap 000b[100] = Vendor [1] ID 0001 Rev 1 Length 16
    ecap 0019[270] = PCIe Sec 1 lane errors 0
    ecap 000d[2a0] = ACS 1
    ecap 0026[410] = Physical Layer 16.0 GT/s 1
    ecap 0027[450] = Lane Margining at Receiver 1

xhci3@pci0:8:0:3:	class=0x0c0330 rev=0x00 hdr=0x00 vendor=0x1022 device=0x15d6 subvendor=0x1022 subdevice=0x15d6
    vendor     = 'Advanced Micro Devices, Inc. [AMD]'
    class      = serial bus
    subclass   = USB
    bar   [10] = type Memory, range 64, base 0xfc800000, size 1048576, enabled
    cap 09[48] = vendor (length 8)
    cap 01[50] = powerspec 3  supports D0 D3  current D0
    cap 10[64] = PCI-Express 2 endpoint max data 256(256) RO NS
                 max read 512
                 link x16(x16) speed 16.0(16.0) ASPM disabled(L0s/L1)
    cap 05[a0] = MSI supports 8 messages, 64 bit 
    cap 11[c0] = MSI-X supports 8 messages, enabled
                 Table in map 0x10[0xfe000], PBA in map 0x10[0xff000]
    ecap 000b[100] = Vendor [1] ID 0001 Rev 1 Length 16
    ecap 000d[2a0] = ACS 1

xhci4@pci0:8:0:4:	class=0x0c0330 rev=0x00 hdr=0x00 vendor=0x1022 device=0x15d7 subvendor=0x1022 subdevice=0x15d7
    vendor     = 'Advanced Micro Devices, Inc. [AMD]'
    class      = serial bus
    subclass   = USB
    bar   [10] = type Memory, range 64, base 0xfc700000, size 1048576, enabled
    cap 09[48] = vendor (length 8)
    cap 01[50] = powerspec 3  supports D0 D3  current D0
    cap 10[64] = PCI-Express 2 endpoint max data 256(256) RO NS
                 max read 512
                 link x16(x16) speed 16.0(16.0) ASPM disabled(L0s/L1)
    cap 05[a0] = MSI supports 8 messages, 64 bit 
    cap 11[c0] = MSI-X supports 8 messages, enabled
                 Table in map 0x10[0xfe000], PBA in map 0x10[0xff000]
    ecap 000b[100] = Vendor [1] ID 0001 Rev 1 Length 16
    ecap 000d[2a0] = ACS 1
