hostb0@pci0:0:0:0:	class=0x060000 card=0x087a1028 chip=0x59148086 rev=0x08 hdr=0x00
    vendor     = 'Intel Corporation'
    device     = 'Xeon E3-1200 v6/7th Gen Core Processor Host Bridge/DRAM Registers'
    class      = bridge
    subclass   = HOST-PCI
    cap 09[e0] = vendor (length 16) Intel cap 0 version 1

vgapci0@pci0:0:2:0:	class=0x030000 card=0x087a1028 chip=0x59178086 rev=0x07 hdr=0x00
    vendor     = 'Intel Corporation'
    device     = 'UHD Graphics 620'
    class      = display
    subclass   = VGA
    bar   [10] = type Memory, range 64, base 0xd0000000, size 16777216, enabled
    bar   [18] = type Prefetchable Memory, range 64, base 0xc0000000, size 268435456, enabled
    bar   [20] = type I/O Port, range 32, base 0xf000, size 64, enabled
    cap 09[40] = vendor (length 12) Intel cap 0 version 1
    cap 10[70] = PCI-Express 2 root endpoint max data 128(128) FLR
    cap 05[ac] = MSI supports 1 message 
    cap 01[d0] = powerspec 2  supports D0 D3  current D0
    ecap 001b[100] = unknown 1
    ecap 000f[200] = ATS 1
    ecap 0013[300] = unknown 1

none0@pci0:0:4:0:	class=0x118000 card=0x087a1028 chip=0x19038086 rev=0x08 hdr=0x00
    vendor     = 'Intel Corporation'
    device     = 'Xeon E3-1200 v5/E3-1500 v5/6th Gen Core Processor Thermal Subsystem'
    class      = dasp
    bar   [10] = type Memory, range 64, base 0xd1c30000, size 32768, enabled
    cap 05[90] = MSI supports 1 message 
    cap 01[d0] = powerspec 3  supports D0 D3  current D0
    cap 09[e0] = vendor (length 12) Intel cap 0 version 1

xhci0@pci0:0:20:0:	class=0x0c0330 card=0x087a1028 chip=0x9d2f8086 rev=0x21 hdr=0x00
    vendor     = 'Intel Corporation'
    device     = 'Sunrise Point-LP USB 3.0 xHCI Controller'
    class      = serial bus
    subclass   = USB
    bar   [10] = type Memory, range 64, base 0xd1c20000, size 65536, enabled
    cap 01[70] = powerspec 2  supports D0 D3  current D0
    cap 05[80] = MSI supports 8 messages, 64 bit enabled with 1 message

none1@pci0:0:20:2:	class=0x118000 card=0x087a1028 chip=0x9d318086 rev=0x21 hdr=0x00
    vendor     = 'Intel Corporation'
    device     = 'Sunrise Point-LP Thermal subsystem'
    class      = dasp
    bar   [10] = type Memory, range 64, base 0xd1c41000, size 4096, enabled
    cap 01[50] = powerspec 3  supports D0 D3  current D0
    cap 05[80] = MSI supports 1 message 

none2@pci0:0:21:0:	class=0x118000 card=0x087a1028 chip=0x9d608086 rev=0x21 hdr=0x00
    vendor     = 'Intel Corporation'
    device     = 'Sunrise Point-LP Serial IO I2C Controller'
    class      = dasp
    bar   [10] = type Memory, range 64, base 0xd1c40000, size 4096, enabled
    cap 01[80] = powerspec 3  supports D0 D3  current D0
    cap 09[90] = vendor (length 20) Intel cap 15 version 0

none3@pci0:0:21:1:	class=0x118000 card=0x087a1028 chip=0x9d618086 rev=0x21 hdr=0x00
    vendor     = 'Intel Corporation'
    device     = 'Sunrise Point-LP Serial IO I2C Controller'
    class      = dasp
    bar   [10] = type Memory, range 64, base 0xd1c3f000, size 4096, enabled
    cap 01[80] = powerspec 3  supports D0 D3  current D0
    cap 09[90] = vendor (length 20) Intel cap 15 version 0

none4@pci0:0:22:0:	class=0x078000 card=0x087a1028 chip=0x9d3a8086 rev=0x21 hdr=0x00
    vendor     = 'Intel Corporation'
    device     = 'Sunrise Point-LP CSME HECI'
    class      = simple comms
    bar   [10] = type Memory, range 64, base 0xd1c3e000, size 4096, enabled
    cap 01[50] = powerspec 3  supports D0 D3  current D0
    cap 05[8c] = MSI supports 1 message, 64 bit 

none5@pci0:0:22:3:	class=0x070002 card=0x087a1028 chip=0x9d3d8086 rev=0x21 hdr=0x00
    vendor     = 'Intel Corporation'
    device     = 'Sunrise Point-LP Active Management Technology - SOL'
    class      = simple comms
    subclass   = UART
    bar   [10] = type I/O Port, range 32, base 0xf060, size 8, enabled
    bar   [14] = type Memory, range 32, base 0xd1c3d000, size 4096, enabled
    cap 05[40] = MSI supports 1 message, 64 bit 
    cap 01[50] = powerspec 3  supports D0 D3  current D0

pcib1@pci0:0:28:0:	class=0x060400 card=0x087a1028 chip=0x9d118086 rev=0xf1 hdr=0x01
    vendor     = 'Intel Corporation'
    class      = bridge
    subclass   = PCI-PCI
    cap 10[40] = PCI-Express 2 root port max data 128(256) ARI disabled
                 link x0(x1) speed 0.0(8.0) ASPM L0s/L1(L0s/L1)
                 slot 5 power limit 100 mW HotPlug(empty) surprise
    cap 05[80] = MSI supports 1 message 
    cap 0d[90] = PCI Bridge card=0x087a1028
    cap 01[a0] = powerspec 3  supports D0 D3  current D0
    ecap 0001[100] = AER 1 0 fatal 0 non-fatal 0 corrected
    ecap 000d[140] = ACS 1
    ecap 001e[200] = unknown 1
    ecap 0019[220] = PCIe Sec 1 lane errors 0

pcib2@pci0:0:28:2:	class=0x060400 card=0x087a1028 chip=0x9d128086 rev=0xf1 hdr=0x01
    vendor     = 'Intel Corporation'
    device     = 'Sunrise Point-LP PCI Express Root Port'
    class      = bridge
    subclass   = PCI-PCI
    cap 10[40] = PCI-Express 2 root port max data 128(256) ARI disabled
                 link x1(x1) speed 2.5(8.0) ASPM L1(L1)
                 slot 6 power limit 100 mW
    cap 05[80] = MSI supports 1 message 
    cap 0d[90] = PCI Bridge card=0x087a1028
    cap 01[a0] = powerspec 3  supports D0 D3  current D0
    ecap 0001[100] = AER 1 0 fatal 0 non-fatal 0 corrected
    ecap 000d[140] = ACS 1
    ecap 001e[200] = unknown 1
    ecap 0019[220] = PCIe Sec 1 lane errors 0

pcib3@pci0:0:28:4:	class=0x060400 card=0x087a1028 chip=0x9d148086 rev=0xf1 hdr=0x01
    vendor     = 'Intel Corporation'
    device     = 'Sunrise Point-LP PCI Express Root Port'
    class      = bridge
    subclass   = PCI-PCI
    cap 10[40] = PCI-Express 2 root port max data 256(256) ARI disabled
                 link x4(x4) speed 8.0(8.0) ASPM L1(L1)
                 slot 8 power limit 250 mW
    cap 05[80] = MSI supports 1 message 
    cap 0d[90] = PCI Bridge card=0x087a1028
    cap 01[a0] = powerspec 3  supports D0 D3  current D0
    ecap 0001[100] = AER 1 0 fatal 0 non-fatal 1 corrected
    ecap 000d[140] = ACS 1
    ecap 001e[200] = unknown 1
    ecap 0019[220] = PCIe Sec 1 lane errors 0

pcib4@pci0:0:29:0:	class=0x060400 card=0x087a1028 chip=0x9d188086 rev=0xf1 hdr=0x01
    vendor     = 'Intel Corporation'
    device     = 'Sunrise Point-LP PCI Express Root Port'
    class      = bridge
    subclass   = PCI-PCI
    cap 10[40] = PCI-Express 2 root port max data 128(256) ARI disabled
                 link x0(x4) speed 0.0(8.0)
                 slot 12 power limit 250 mW
    cap 05[80] = MSI supports 1 message 
    cap 0d[90] = PCI Bridge card=0x087a1028
    cap 01[a0] = powerspec 3  supports D0 D3  current D0
    ecap 0001[100] = AER 1 0 fatal 0 non-fatal 0 corrected
    ecap 000d[140] = ACS 1
    ecap 001e[200] = unknown 1
    ecap 0019[220] = PCIe Sec 1 lane errors 0

isab0@pci0:0:31:0:	class=0x060100 card=0x087a1028 chip=0x9d4e8086 rev=0x21 hdr=0x00
    vendor     = 'Intel Corporation'
    device     = 'Intel(R) 100 Series Chipset Family LPC Controller/eSPI Controller - 9D4E'
    class      = bridge
    subclass   = PCI-ISA

none6@pci0:0:31:2:	class=0x058000 card=0x087a1028 chip=0x9d218086 rev=0x21 hdr=0x00
    vendor     = 'Intel Corporation'
    device     = 'Sunrise Point-LP PMC'
    class      = memory
    bar   [10] = type Memory, range 32, base 0xd1c38000, size 16384, enabled

none7@pci0:0:31:4:	class=0x0c0500 card=0x087a1028 chip=0x9d238086 rev=0x21 hdr=0x00
    vendor     = 'Intel Corporation'
    device     = 'Sunrise Point-LP SMBus'
    class      = serial bus
    subclass   = SMBus
    bar   [10] = type Memory, range 64, base 0xd1c3c000, size 256, enabled
    bar   [20] = type I/O Port, range 32, base 0xf040, size 32, enabled

em0@pci0:0:31:6:	class=0x020000 card=0x087a1028 chip=0x15d78086 rev=0x21 hdr=0x00
    vendor     = 'Intel Corporation'
    device     = 'Ethernet Connection (4) I219-LM'
    class      = network
    subclass   = ethernet
    bar   [10] = type Memory, range 32, base 0xd1c00000, size 131072, enabled
    cap 01[c8] = powerspec 3  supports D0 D3  current D0
    cap 05[d0] = MSI supports 1 message, 64 bit enabled with 1 message
    cap 13[e0] = PCI Advanced Features: FLR TP

iwm0@pci0:2:0:0:	class=0x028000 card=0x00508086 chip=0x24fd8086 rev=0x78 hdr=0x00
    vendor     = 'Intel Corporation'
    device     = 'Wireless 8265 / 8275'
    class      = network
    bar   [10] = type Memory, range 64, base 0xd1b00000, size 8192, enabled
    cap 01[c8] = powerspec 3  supports D0 D3  current D0
    cap 05[d0] = MSI supports 1 message, 64 bit enabled with 1 message
    cap 10[40] = PCI-Express 2 endpoint max data 128(128) FLR RO NS
                 link x1(x1) speed 2.5(2.5) ASPM L1(L1)
    ecap 0001[100] = AER 1 0 fatal 0 non-fatal 1 corrected
    ecap 0003[140] = Serial 1 c0b6f9ffffd502e6
    ecap 0018[14c] = LTR 1
    ecap 001e[154] = unknown 1

nvme0@pci0:3:0:0:	class=0x010802 card=0xa801144d chip=0xa808144d rev=0x00 hdr=0x00
    vendor     = 'Samsung Electronics Co Ltd'
    device     = 'NVMe SSD Controller SM981/PM981'
    class      = mass storage
    subclass   = NVM
    bar   [10] = type Memory, range 64, base 0xd1a00000, size 16384, enabled
    cap 01[40] = powerspec 3  supports D0 D3  current D0
    cap 05[50] = MSI supports 32 messages, 64 bit 
    cap 10[70] = PCI-Express 2 endpoint max data 256(256) FLR RO NS
                 link x4(x4) speed 8.0(8.0) ASPM L1(L1)
    cap 11[b0] = MSI-X supports 33 messages, enabled
                 Table in map 0x10[0x3000], PBA in map 0x10[0x2000]
    ecap 0001[100] = AER 2 0 fatal 0 non-fatal 4 corrected
    ecap 0003[148] = Serial 1 0000000000000000
    ecap 0004[158] = Power Budgeting 1
    ecap 0019[168] = PCIe Sec 1 lane errors 0x8
    ecap 0018[188] = LTR 1
    ecap 001e[190] = unknown 1
