hostb0@pci0:0:0:0:	class=0x060000 rev=0x06 hdr=0x00 vendor=0x8086 device=0x0c00 subvendor=0x8086 subdevice=0x0c00
    vendor     = 'Intel Corporation'
    device     = '4th Gen Core Processor DRAM Controller'
    class      = bridge
    subclass   = HOST-PCI
    cap 09[e0] = vendor (length 12) Intel cap 0 version 1

pcib1@pci0:0:1:0:	class=0x060400 rev=0x06 hdr=0x01 vendor=0x8086 device=0x0c01 subvendor=0x8086 subdevice=0x0c01
    vendor     = 'Intel Corporation'
    device     = 'Xeon E3-1200 v3/4th Gen Core Processor PCI Express x16 Controller'
    class      = bridge
    subclass   = PCI-PCI
    cap 0d[88] = PCI Bridge subvendor=0x8086 subdevice=0x0c01
    cap 01[80] = powerspec 3  supports D0 D3  current D0
    cap 05[90] = MSI supports 1 message 
    cap 10[a0] = PCI-Express 2 root port max data 128(128)
                 max read 128
                 link x0(x8) speed 0.0(8.0) ASPM disabled(L0s/L1)
                 slot 1 power limit 75000 mW
    ecap 0002[100] = VC 1 max VC0
    ecap 0005[140] = Root Complex Link Declaration 1
    ecap 0019[d94] = PCIe Sec 1 lane errors 0

pcib2@pci0:0:1:1:	class=0x060400 rev=0x06 hdr=0x01 vendor=0x8086 device=0x0c05 subvendor=0x8086 subdevice=0x0c05
    vendor     = 'Intel Corporation'
    device     = 'Xeon E3-1200 v3/4th Gen Core Processor PCI Express x8 Controller'
    class      = bridge
    subclass   = PCI-PCI
    cap 0d[88] = PCI Bridge subvendor=0x8086 subdevice=0x0c05
    cap 01[80] = powerspec 3  supports D0 D3  current D0
    cap 05[90] = MSI supports 1 message 
    cap 10[a0] = PCI-Express 2 root port max data 128(128)
                 max read 128
                 link x8(x8) speed 5.0(8.0) ASPM disabled(L0s/L1)
                 slot 2 power limit 75000 mW
    ecap 0002[100] = VC 1 max VC0
    ecap 0005[140] = Root Complex Link Declaration 1
    ecap 0019[d94] = PCIe Sec 1 lane errors 0

vgapci0@pci0:0:2:0:	class=0x030000 rev=0x06 hdr=0x00 vendor=0x8086 device=0x0402 subvendor=0x8086 subdevice=0x0402
    vendor     = 'Intel Corporation'
    device     = 'Xeon E3-1200 v3/4th Gen Core Processor Integrated Graphics Controller'
    class      = display
    subclass   = VGA
    bar   [10] = type Memory, range 64, base 0xdec00000, size 4194304, enabled
    bar   [18] = type Prefetchable Memory, range 64, base 0xc0000000, size 268435456, enabled
    bar   [20] = type I/O Port, range 32, base 0xf000, size 64, enabled
    cap 05[90] = MSI supports 1 message 
    cap 01[d0] = powerspec 2  supports D0 D3  current D0
    cap 13[a4] = PCI Advanced Features: FLR TP

ehci0@pci0:0:26:0:	class=0x0c0320 rev=0x05 hdr=0x00 vendor=0x8086 device=0x8c2d subvendor=0x8086 subdevice=0x7270
    vendor     = 'Intel Corporation'
    device     = '8 Series/C220 Series Chipset Family USB EHCI'
    class      = serial bus
    subclass   = USB
    bar   [10] = type Memory, range 32, base 0xdfd03000, size 1024, enabled
    cap 01[50] = powerspec 2  supports D0 D3  current D0
    cap 0a[58] = EHCI Debug Port at offset 0xa0 in map 0x14
    cap 13[98] = PCI Advanced Features: FLR TP

pcib6@pci0:0:28:0:	class=0x060400 rev=0xd5 hdr=0x01 vendor=0x8086 device=0x8c10 subvendor=0x8086 subdevice=0x7270
    vendor     = 'Intel Corporation'
    device     = '8 Series/C220 Series Chipset Family PCI Express Root Port'
    class      = bridge
    subclass   = PCI-PCI
    cap 10[40] = PCI-Express 2 root port max data 128(128)
                 max read 128
                 link x1(x1) speed 2.5(5.0) ASPM disabled(L0s/L1)
                 slot 0 power limit 100 mW
    cap 05[80] = MSI supports 1 message 
    cap 0d[90] = PCI Bridge subvendor=0x8086 subdevice=0x7270
    cap 01[a0] = powerspec 3  supports D0 D3  current D0

pcib7@pci0:0:28:1:	class=0x060400 rev=0xd5 hdr=0x01 vendor=0x8086 device=0x8c12 subvendor=0x8086 subdevice=0x7270
    vendor     = 'Intel Corporation'
    device     = '8 Series/C220 Series Chipset Family PCI Express Root Port'
    class      = bridge
    subclass   = PCI-PCI
    cap 10[40] = PCI-Express 2 root port max data 128(128)
                 max read 128
                 link x1(x1) speed 2.5(5.0) ASPM disabled(L0s/L1)
                 slot 1 power limit 100 mW
    cap 05[80] = MSI supports 1 message 
    cap 0d[90] = PCI Bridge subvendor=0x8086 subdevice=0x7270
    cap 01[a0] = powerspec 3  supports D0 D3  current D0

pcib8@pci0:0:28:2:	class=0x060400 rev=0xd5 hdr=0x01 vendor=0x8086 device=0x8c14 subvendor=0x8086 subdevice=0x7270
    vendor     = 'Intel Corporation'
    device     = '8 Series/C220 Series Chipset Family PCI Express Root Port'
    class      = bridge
    subclass   = PCI-PCI
    cap 10[40] = PCI-Express 2 root port max data 128(128)
                 max read 128
                 link x1(x1) speed 2.5(5.0) ASPM disabled(L0s/L1)
                 slot 2 power limit 100 mW
    cap 05[80] = MSI supports 1 message 
    cap 0d[90] = PCI Bridge subvendor=0x8086 subdevice=0x7270
    cap 01[a0] = powerspec 3  supports D0 D3  current D0

pcib9@pci0:0:28:3:	class=0x060400 rev=0xd5 hdr=0x01 vendor=0x8086 device=0x8c16 subvendor=0x8086 subdevice=0x7270
    vendor     = 'Intel Corporation'
    device     = '8 Series/C220 Series Chipset Family PCI Express Root Port'
    class      = bridge
    subclass   = PCI-PCI
    cap 10[40] = PCI-Express 2 root port max data 128(128)
                 max read 128
                 link x1(x1) speed 2.5(5.0) ASPM disabled(L0s/L1)
                 slot 3 power limit 100 mW
    cap 05[80] = MSI supports 1 message 
    cap 0d[90] = PCI Bridge subvendor=0x8086 subdevice=0x7270
    cap 01[a0] = powerspec 3  supports D0 D3  current D0

pcib10@pci0:0:28:4:	class=0x060400 rev=0xd5 hdr=0x01 vendor=0x8086 device=0x8c18 subvendor=0x8086 subdevice=0x7270
    vendor     = 'Intel Corporation'
    device     = '8 Series/C220 Series Chipset Family PCI Express Root Port'
    class      = bridge
    subclass   = PCI-PCI
    cap 10[40] = PCI-Express 2 root port max data 128(128)
                 max read 128
                 link x1(x1) speed 2.5(5.0) ASPM disabled(L0s/L1)
                 slot 4 power limit 100 mW
    cap 05[80] = MSI supports 1 message 
    cap 0d[90] = PCI Bridge subvendor=0x8086 subdevice=0x7270
    cap 01[a0] = powerspec 3  supports D0 D3  current D0

pcib11@pci0:0:28:5:	class=0x060400 rev=0xd5 hdr=0x01 vendor=0x8086 device=0x8c1a subvendor=0x8086 subdevice=0x7270
    vendor     = 'Intel Corporation'
    device     = '8 Series/C220 Series Chipset Family PCI Express Root Port'
    class      = bridge
    subclass   = PCI-PCI
    cap 10[40] = PCI-Express 2 root port max data 128(128)
                 max read 128
                 link x1(x1) speed 2.5(5.0) ASPM disabled(L0s/L1)
                 slot 5 power limit 100 mW
    cap 05[80] = MSI supports 1 message 
    cap 0d[90] = PCI Bridge subvendor=0x8086 subdevice=0x7270
    cap 01[a0] = powerspec 3  supports D0 D3  current D0

ehci1@pci0:0:29:0:	class=0x0c0320 rev=0x05 hdr=0x00 vendor=0x8086 device=0x8c26 subvendor=0x8086 subdevice=0x7270
    vendor     = 'Intel Corporation'
    device     = '8 Series/C220 Series Chipset Family USB EHCI'
    class      = serial bus
    subclass   = USB
    bar   [10] = type Memory, range 32, base 0xdfd02000, size 1024, enabled
    cap 01[50] = powerspec 2  supports D0 D3  current D0
    cap 0a[58] = EHCI Debug Port at offset 0xa0 in map 0x14
    cap 13[98] = PCI Advanced Features: FLR TP

isab0@pci0:0:31:0:	class=0x060100 rev=0x05 hdr=0x00 vendor=0x8086 device=0x8c56 subvendor=0x8086 subdevice=0x7270
    vendor     = 'Intel Corporation'
    device     = 'C226 Series Chipset Family Server Advanced SKU LPC Controller'
    class      = bridge
    subclass   = PCI-ISA
    cap 09[e0] = vendor (length 12) Intel cap 1 version 0
		 features: AMT, 4 PCI-e x1 slots

ahci0@pci0:0:31:2:	class=0x010601 rev=0x05 hdr=0x00 vendor=0x8086 device=0x8c02 subvendor=0x8086 subdevice=0x7270
    vendor     = 'Intel Corporation'
    device     = '8 Series/C220 Series Chipset Family 6-port SATA Controller 1 [AHCI mode]'
    class      = mass storage
    subclass   = SATA
    bar   [10] = type I/O Port, range 32, base 0xf0b0, size 8, enabled
    bar   [14] = type I/O Port, range 32, base 0xf0a0, size 4, enabled
    bar   [18] = type I/O Port, range 32, base 0xf090, size 8, enabled
    bar   [1c] = type I/O Port, range 32, base 0xf080, size 4, enabled
    bar   [20] = type I/O Port, range 32, base 0xf060, size 32, enabled
    bar   [24] = type Memory, range 32, base 0xdfd01000, size 2048, enabled
    cap 05[80] = MSI supports 1 message enabled with 1 message
    cap 01[70] = powerspec 3  supports D0 D3  current D0
    cap 12[a8] = SATA Index-Data Pair

ichsmb0@pci0:0:31:3:	class=0x0c0500 rev=0x05 hdr=0x00 vendor=0x8086 device=0x8c22 subvendor=0x8086 subdevice=0x7270
    vendor     = 'Intel Corporation'
    device     = '8 Series/C220 Series Chipset Family SMBus Controller'
    class      = serial bus
    subclass   = SMBus
    bar   [10] = type Memory, range 64, base 0xdfd00000, size 256, enabled
    bar   [20] = type I/O Port, range 32, base 0xf040, size 32, enabled

pcib3@pci0:2:0:0:	class=0x060400 rev=0xba hdr=0x01 vendor=0x10b5 device=0x8617 subvendor=0x10b5 subdevice=0x8617
    vendor     = 'PLX Technology, Inc.'
    device     = 'PEX 8617 16-lane, 4-Port PCI Express Gen 2 (5.0 GT/s) Switch with P2P'
    class      = bridge
    subclass   = PCI-PCI
    bar   [10] = type Memory, range 32, base 0xdf600000, size 131072, enabled
    cap 01[40] = powerspec 3  supports D0 D3  current D0
    cap 05[48] = MSI supports 4 messages, 64 bit, vector masks 
    cap 10[68] = PCI-Express 2 upstream port max data 128(2048)
                 max read 128
                 link x8(x8) speed 5.0(5.0) ASPM disabled(L0s/L1)
    cap 0d[a4] = PCI Bridge subvendor=0x10b5 subdevice=0x8617
    ecap 0003[100] = Serial 1 ba860110b5df0e00
    ecap 0001[fb4] = AER 1 0 fatal 0 non-fatal 1 corrected
    ecap 0004[138] = Power Budgeting 1
    ecap 0002[148] = VC 1 max VC1 lowpri VC0-VC1
    ecap 000b[448] = Vendor [1] ID 0000 Rev 0 Length 204
    ecap 000b[950] = Vendor [1] ID 0001 Rev 0 Length 16

pcib4@pci0:3:1:0:	class=0x060400 rev=0xba hdr=0x01 vendor=0x10b5 device=0x8617 subvendor=0x10b5 subdevice=0x8617
    vendor     = 'PLX Technology, Inc.'
    device     = 'PEX 8617 16-lane, 4-Port PCI Express Gen 2 (5.0 GT/s) Switch with P2P'
    class      = bridge
    subclass   = PCI-PCI
    cap 01[40] = powerspec 3  supports D0 D3  current D0
    cap 05[48] = MSI supports 4 messages, 64 bit, vector masks 
    cap 10[68] = PCI-Express 2 downstream port max data 128(2048) ARI disabled
                 max read 128
                 link x4(x4) speed 5.0(5.0) ASPM disabled(L0s/L1)
                 slot 113 power limit 25000 mW
    cap 0d[a4] = PCI Bridge subvendor=0x10b5 subdevice=0x8617
    ecap 0003[100] = Serial 1 ba860110b5df0e00
    ecap 0001[fb4] = AER 1 0 fatal 1 non-fatal 1 corrected
    ecap 0002[148] = VC 1 max VC1 lowpri VC0-VC1
    ecap 000d[520] = ACS 1
    ecap 000b[950] = Vendor [1] ID 0001 Rev 0 Length 16

pcib5@pci0:3:3:0:	class=0x060400 rev=0xba hdr=0x01 vendor=0x10b5 device=0x8617 subvendor=0x10b5 subdevice=0x8617
    vendor     = 'PLX Technology, Inc.'
    device     = 'PEX 8617 16-lane, 4-Port PCI Express Gen 2 (5.0 GT/s) Switch with P2P'
    class      = bridge
    subclass   = PCI-PCI
    cap 01[40] = powerspec 3  supports D0 D3  current D0
    cap 05[48] = MSI supports 4 messages, 64 bit, vector masks 
    cap 10[68] = PCI-Express 2 downstream port max data 128(2048) ARI disabled
                 max read 128
                 link x4(x4) speed 5.0(5.0) ASPM disabled(L0s/L1)
                 slot 115 power limit 25000 mW
    cap 0d[a4] = PCI Bridge subvendor=0x10b5 subdevice=0x8617
    ecap 0003[100] = Serial 1 ba860110b5df0e00
    ecap 0001[fb4] = AER 1 0 fatal 1 non-fatal 1 corrected
    ecap 0002[148] = VC 1 max VC1 lowpri VC0-VC1
    ecap 000d[520] = ACS 1
    ecap 000b[950] = Vendor [1] ID 0001 Rev 0 Length 16

igb0@pci0:4:0:0:	class=0x020000 rev=0x01 hdr=0x00 vendor=0x8086 device=0x150e subvendor=0x1374 subdevice=0x0432
    vendor     = 'Intel Corporation'
    device     = '82580 Gigabit Network Connection'
    class      = network
    subclass   = ethernet
    bar   [10] = type Memory, range 32, base 0xdf480000, size 524288, enabled
    bar   [18] = type I/O Port, range 32, base 0x8060, size 32, enabled
    bar   [1c] = type Memory, range 32, base 0xdf50c000, size 16384, enabled
    cap 01[40] = powerspec 3  supports D0 D3  current D0
    cap 05[50] = MSI supports 1 message, 64 bit, vector masks 
    cap 11[70] = MSI-X supports 10 messages, enabled
                 Table in map 0x1c[0x0], PBA in map 0x1c[0x2000]
    cap 10[a0] = PCI-Express 2 endpoint max data 128(512) FLR NS
                 max read 512
                 link x4(x4) speed 5.0(5.0) ASPM disabled(L0s/L1)
    cap 03[e0] = VPD
    ecap 0001[100] = AER 1 0 fatal 0 non-fatal 1 corrected
    ecap 0003[140] = Serial 1 001c7fffff659c7c
    ecap 0017[1a0] = TPH Requester 1
    ecap 0018[1c0] = LTR 1

igb1@pci0:4:0:1:	class=0x020000 rev=0x01 hdr=0x00 vendor=0x8086 device=0x150e subvendor=0x1374 subdevice=0x0432
    vendor     = 'Intel Corporation'
    device     = '82580 Gigabit Network Connection'
    class      = network
    subclass   = ethernet
    bar   [10] = type Memory, range 32, base 0xdf400000, size 524288, enabled
    bar   [18] = type I/O Port, range 32, base 0x8040, size 32, enabled
    bar   [1c] = type Memory, range 32, base 0xdf508000, size 16384, enabled
    cap 01[40] = powerspec 3  supports D0 D3  current D0
    cap 05[50] = MSI supports 1 message, 64 bit, vector masks 
    cap 11[70] = MSI-X supports 10 messages, enabled
                 Table in map 0x1c[0x0], PBA in map 0x1c[0x2000]
    cap 10[a0] = PCI-Express 2 endpoint max data 128(512) FLR NS
                 max read 512
                 link x4(x4) speed 5.0(5.0) ASPM disabled(L0s/L1)
    cap 03[e0] = VPD
    ecap 0001[100] = AER 1 0 fatal 0 non-fatal 1 corrected
    ecap 0003[140] = Serial 1 001c7fffff659c7c
    ecap 0017[1a0] = TPH Requester 1

igb2@pci0:4:0:2:	class=0x020000 rev=0x01 hdr=0x00 vendor=0x8086 device=0x150e subvendor=0x1374 subdevice=0x0432
    vendor     = 'Intel Corporation'
    device     = '82580 Gigabit Network Connection'
    class      = network
    subclass   = ethernet
    bar   [10] = type Memory, range 32, base 0xdf380000, size 524288, enabled
    bar   [18] = type I/O Port, range 32, base 0x8020, size 32, enabled
    bar   [1c] = type Memory, range 32, base 0xdf504000, size 16384, enabled
    cap 01[40] = powerspec 3  supports D0 D3  current D0
    cap 05[50] = MSI supports 1 message, 64 bit, vector masks 
    cap 11[70] = MSI-X supports 10 messages, enabled
                 Table in map 0x1c[0x0], PBA in map 0x1c[0x2000]
    cap 10[a0] = PCI-Express 2 endpoint max data 128(512) FLR NS
                 max read 512
                 link x4(x4) speed 5.0(5.0) ASPM disabled(L0s/L1)
    cap 03[e0] = VPD
    ecap 0001[100] = AER 1 0 fatal 0 non-fatal 1 corrected
    ecap 0003[140] = Serial 1 001c7fffff659c7c
    ecap 0017[1a0] = TPH Requester 1

igb3@pci0:4:0:3:	class=0x020000 rev=0x01 hdr=0x00 vendor=0x8086 device=0x150e subvendor=0x1374 subdevice=0x0432
    vendor     = 'Intel Corporation'
    device     = '82580 Gigabit Network Connection'
    class      = network
    subclass   = ethernet
    bar   [10] = type Memory, range 32, base 0xdf300000, size 524288, enabled
    bar   [18] = type I/O Port, range 32, base 0x8000, size 32, enabled
    bar   [1c] = type Memory, range 32, base 0xdf500000, size 16384, enabled
    cap 01[40] = powerspec 3  supports D0 D3  current D0
    cap 05[50] = MSI supports 1 message, 64 bit, vector masks 
    cap 11[70] = MSI-X supports 10 messages, enabled
                 Table in map 0x1c[0x0], PBA in map 0x1c[0x2000]
    cap 10[a0] = PCI-Express 2 endpoint max data 128(512) FLR NS
                 max read 512
                 link x4(x4) speed 5.0(5.0) ASPM disabled(L0s/L1)
    cap 03[e0] = VPD
    ecap 0001[100] = AER 1 0 fatal 0 non-fatal 1 corrected
    ecap 0003[140] = Serial 1 001c7fffff659c7c
    ecap 0017[1a0] = TPH Requester 1

igb4@pci0:5:0:0:	class=0x020000 rev=0x01 hdr=0x00 vendor=0x8086 device=0x150e subvendor=0x1374 subdevice=0x0432
    vendor     = 'Intel Corporation'
    device     = '82580 Gigabit Network Connection'
    class      = network
    subclass   = ethernet
    bar   [10] = type Memory, range 32, base 0xdf180000, size 524288, enabled
    bar   [18] = type I/O Port, range 32, base 0x7060, size 32, enabled
    bar   [1c] = type Memory, range 32, base 0xdf20c000, size 16384, enabled
    cap 01[40] = powerspec 3  supports D0 D3  current D0
    cap 05[50] = MSI supports 1 message, 64 bit, vector masks 
    cap 11[70] = MSI-X supports 10 messages, enabled
                 Table in map 0x1c[0x0], PBA in map 0x1c[0x2000]
    cap 10[a0] = PCI-Express 2 endpoint max data 128(512) FLR NS
                 max read 512
                 link x4(x4) speed 5.0(5.0) ASPM disabled(L0s/L1)
    cap 03[e0] = VPD
    ecap 0001[100] = AER 1 0 fatal 0 non-fatal 1 corrected
    ecap 0003[140] = Serial 1 001c7fffff659c80
    ecap 0017[1a0] = TPH Requester 1
    ecap 0018[1c0] = LTR 1

igb5@pci0:5:0:1:	class=0x020000 rev=0x01 hdr=0x00 vendor=0x8086 device=0x150e subvendor=0x1374 subdevice=0x0432
    vendor     = 'Intel Corporation'
    device     = '82580 Gigabit Network Connection'
    class      = network
    subclass   = ethernet
    bar   [10] = type Memory, range 32, base 0xdf100000, size 524288, enabled
    bar   [18] = type I/O Port, range 32, base 0x7040, size 32, enabled
    bar   [1c] = type Memory, range 32, base 0xdf208000, size 16384, enabled
    cap 01[40] = powerspec 3  supports D0 D3  current D0
    cap 05[50] = MSI supports 1 message, 64 bit, vector masks 
    cap 11[70] = MSI-X supports 10 messages, enabled
                 Table in map 0x1c[0x0], PBA in map 0x1c[0x2000]
    cap 10[a0] = PCI-Express 2 endpoint max data 128(512) FLR NS
                 max read 512
                 link x4(x4) speed 5.0(5.0) ASPM disabled(L0s/L1)
    cap 03[e0] = VPD
    ecap 0001[100] = AER 1 0 fatal 0 non-fatal 1 corrected
    ecap 0003[140] = Serial 1 001c7fffff659c80
    ecap 0017[1a0] = TPH Requester 1

igb6@pci0:5:0:2:	class=0x020000 rev=0x01 hdr=0x00 vendor=0x8086 device=0x150e subvendor=0x1374 subdevice=0x0432
    vendor     = 'Intel Corporation'
    device     = '82580 Gigabit Network Connection'
    class      = network
    subclass   = ethernet
    bar   [10] = type Memory, range 32, base 0xdf080000, size 524288, enabled
    bar   [18] = type I/O Port, range 32, base 0x7020, size 32, enabled
    bar   [1c] = type Memory, range 32, base 0xdf204000, size 16384, enabled
    cap 01[40] = powerspec 3  supports D0 D3  current D0
    cap 05[50] = MSI supports 1 message, 64 bit, vector masks 
    cap 11[70] = MSI-X supports 10 messages, enabled
                 Table in map 0x1c[0x0], PBA in map 0x1c[0x2000]
    cap 10[a0] = PCI-Express 2 endpoint max data 128(512) FLR NS
                 max read 512
                 link x4(x4) speed 5.0(5.0) ASPM disabled(L0s/L1)
    cap 03[e0] = VPD
    ecap 0001[100] = AER 1 0 fatal 0 non-fatal 1 corrected
    ecap 0003[140] = Serial 1 001c7fffff659c80
    ecap 0017[1a0] = TPH Requester 1

igb7@pci0:5:0:3:	class=0x020000 rev=0x01 hdr=0x00 vendor=0x8086 device=0x150e subvendor=0x1374 subdevice=0x0432
    vendor     = 'Intel Corporation'
    device     = '82580 Gigabit Network Connection'
    class      = network
    subclass   = ethernet
    bar   [10] = type Memory, range 32, base 0xdf000000, size 524288, enabled
    bar   [18] = type I/O Port, range 32, base 0x7000, size 32, enabled
    bar   [1c] = type Memory, range 32, base 0xdf200000, size 16384, enabled
    cap 01[40] = powerspec 3  supports D0 D3  current D0
    cap 05[50] = MSI supports 1 message, 64 bit, vector masks 
    cap 11[70] = MSI-X supports 10 messages, enabled
                 Table in map 0x1c[0x0], PBA in map 0x1c[0x2000]
    cap 10[a0] = PCI-Express 2 endpoint max data 128(512) FLR NS
                 max read 512
                 link x4(x4) speed 5.0(5.0) ASPM disabled(L0s/L1)
    cap 03[e0] = VPD
    ecap 0001[100] = AER 1 0 fatal 0 non-fatal 1 corrected
    ecap 0003[140] = Serial 1 001c7fffff659c80
    ecap 0017[1a0] = TPH Requester 1

igb8@pci0:6:0:0:	class=0x020000 rev=0x03 hdr=0x00 vendor=0x8086 device=0x1539 subvendor=0x8086 subdevice=0x0000
    vendor     = 'Intel Corporation'
    device     = 'I211 Gigabit Network Connection'
    class      = network
    subclass   = ethernet
    bar   [10] = type Memory, range 32, base 0xdfc00000, size 131072, enabled
    bar   [18] = type I/O Port, range 32, base 0xe000, size 32, enabled
    bar   [1c] = type Memory, range 32, base 0xdfc20000, size 16384, enabled
    cap 01[40] = powerspec 3  supports D0 D3  current D0
    cap 05[50] = MSI supports 1 message, 64 bit, vector masks 
    cap 11[70] = MSI-X supports 5 messages, enabled
                 Table in map 0x1c[0x0], PBA in map 0x1c[0x2000]
    cap 10[a0] = PCI-Express 2 endpoint max data 128(512) FLR NS
                 max read 512
                 link x1(x1) speed 2.5(2.5) ASPM disabled(L0s/L1)
    ecap 0001[100] = AER 2 0 fatal 0 non-fatal 0 corrected
    ecap 0003[140] = Serial 1 001c7fffff848b1e
    ecap 0017[1a0] = TPH Requester 1

igb9@pci0:7:0:0:	class=0x020000 rev=0x03 hdr=0x00 vendor=0x8086 device=0x1539 subvendor=0x8086 subdevice=0x0000
    vendor     = 'Intel Corporation'
    device     = 'I211 Gigabit Network Connection'
    class      = network
    subclass   = ethernet
    bar   [10] = type Memory, range 32, base 0xdfb00000, size 131072, enabled
    bar   [18] = type I/O Port, range 32, base 0xd000, size 32, enabled
    bar   [1c] = type Memory, range 32, base 0xdfb20000, size 16384, enabled
    cap 01[40] = powerspec 3  supports D0 D3  current D0
    cap 05[50] = MSI supports 1 message, 64 bit, vector masks 
    cap 11[70] = MSI-X supports 5 messages, enabled
                 Table in map 0x1c[0x0], PBA in map 0x1c[0x2000]
    cap 10[a0] = PCI-Express 2 endpoint max data 128(512) FLR NS
                 max read 512
                 link x1(x1) speed 2.5(2.5) ASPM disabled(L0s/L1)
    ecap 0001[100] = AER 2 0 fatal 0 non-fatal 0 corrected
    ecap 0003[140] = Serial 1 001c7fffff848b1f
    ecap 0017[1a0] = TPH Requester 1

igb10@pci0:8:0:0:	class=0x020000 rev=0x03 hdr=0x00 vendor=0x8086 device=0x1539 subvendor=0x8086 subdevice=0x0000
    vendor     = 'Intel Corporation'
    device     = 'I211 Gigabit Network Connection'
    class      = network
    subclass   = ethernet
    bar   [10] = type Memory, range 32, base 0xdfa00000, size 131072, enabled
    bar   [18] = type I/O Port, range 32, base 0xc000, size 32, enabled
    bar   [1c] = type Memory, range 32, base 0xdfa20000, size 16384, enabled
    cap 01[40] = powerspec 3  supports D0 D3  current D0
    cap 05[50] = MSI supports 1 message, 64 bit, vector masks 
    cap 11[70] = MSI-X supports 5 messages, enabled
                 Table in map 0x1c[0x0], PBA in map 0x1c[0x2000]
    cap 10[a0] = PCI-Express 2 endpoint max data 128(512) FLR NS
                 max read 512
                 link x1(x1) speed 2.5(2.5) ASPM disabled(L0s/L1)
    ecap 0001[100] = AER 2 0 fatal 0 non-fatal 0 corrected
    ecap 0003[140] = Serial 1 001c7fffff848b20
    ecap 0017[1a0] = TPH Requester 1

igb11@pci0:9:0:0:	class=0x020000 rev=0x03 hdr=0x00 vendor=0x8086 device=0x1539 subvendor=0x8086 subdevice=0x0000
    vendor     = 'Intel Corporation'
    device     = 'I211 Gigabit Network Connection'
    class      = network
    subclass   = ethernet
    bar   [10] = type Memory, range 32, base 0xdf900000, size 131072, enabled
    bar   [18] = type I/O Port, range 32, base 0xb000, size 32, enabled
    bar   [1c] = type Memory, range 32, base 0xdf920000, size 16384, enabled
    cap 01[40] = powerspec 3  supports D0 D3  current D0
    cap 05[50] = MSI supports 1 message, 64 bit, vector masks 
    cap 11[70] = MSI-X supports 5 messages, enabled
                 Table in map 0x1c[0x0], PBA in map 0x1c[0x2000]
    cap 10[a0] = PCI-Express 2 endpoint max data 128(512) FLR NS
                 max read 512
                 link x1(x1) speed 2.5(2.5) ASPM disabled(L0s/L1)
    ecap 0001[100] = AER 2 0 fatal 0 non-fatal 0 corrected
    ecap 0003[140] = Serial 1 001c7fffff848b21
    ecap 0017[1a0] = TPH Requester 1

igb12@pci0:10:0:0:	class=0x020000 rev=0x03 hdr=0x00 vendor=0x8086 device=0x1539 subvendor=0x8086 subdevice=0x0000
    vendor     = 'Intel Corporation'
    device     = 'I211 Gigabit Network Connection'
    class      = network
    subclass   = ethernet
    bar   [10] = type Memory, range 32, base 0xdf800000, size 131072, enabled
    bar   [18] = type I/O Port, range 32, base 0xa000, size 32, enabled
    bar   [1c] = type Memory, range 32, base 0xdf820000, size 16384, enabled
    cap 01[40] = powerspec 3  supports D0 D3  current D0
    cap 05[50] = MSI supports 1 message, 64 bit, vector masks 
    cap 11[70] = MSI-X supports 5 messages, enabled
                 Table in map 0x1c[0x0], PBA in map 0x1c[0x2000]
    cap 10[a0] = PCI-Express 2 endpoint max data 128(512) FLR NS
                 max read 512
                 link x1(x1) speed 2.5(2.5) ASPM disabled(L0s/L1)
    ecap 0001[100] = AER 2 0 fatal 0 non-fatal 0 corrected
    ecap 0003[140] = Serial 1 001c7fffff848b22
    ecap 0017[1a0] = TPH Requester 1

igb13@pci0:11:0:0:	class=0x020000 rev=0x03 hdr=0x00 vendor=0x8086 device=0x1539 subvendor=0x8086 subdevice=0x0000
    vendor     = 'Intel Corporation'
    device     = 'I211 Gigabit Network Connection'
    class      = network
    subclass   = ethernet
    bar   [10] = type Memory, range 32, base 0xdf700000, size 131072, enabled
    bar   [18] = type I/O Port, range 32, base 0x9000, size 32, enabled
    bar   [1c] = type Memory, range 32, base 0xdf720000, size 16384, enabled
    cap 01[40] = powerspec 3  supports D0 D3  current D0
    cap 05[50] = MSI supports 1 message, 64 bit, vector masks 
    cap 11[70] = MSI-X supports 5 messages, enabled
                 Table in map 0x1c[0x0], PBA in map 0x1c[0x2000]
    cap 10[a0] = PCI-Express 2 endpoint max data 128(512) FLR NS
                 max read 512
                 link x1(x1) speed 2.5(2.5) ASPM disabled(L0s/L1)
    ecap 0001[100] = AER 2 0 fatal 0 non-fatal 0 corrected
    ecap 0003[140] = Serial 1 001c7fffff848b23
    ecap 0017[1a0] = TPH Requester 1
