hostb0@pci0:0:0:0:	class=0x060000 card=0x2a8c103c chip=0x2e308086 rev=0x03 hdr=0x00
    vendor     = 'Intel Corporation'
    device     = '4 Series Chipset DRAM Controller'
    class      = bridge
    subclass   = HOST-PCI
    cap 09[e0] = vendor (length 12) Intel cap 6 version 1

pcib1@pci0:0:1:0:	class=0x060400 card=0x2a8c103c chip=0x2e318086 rev=0x03 hdr=0x01
    vendor     = 'Intel Corporation'
    device     = '4 Series Chipset PCI Express Root Port'
    class      = bridge
    subclass   = PCI-PCI
    cap 0d[88] = PCI Bridge card=0x2a8c103c
    cap 01[80] = powerspec 3  supports D0 D3  current D0
    cap 05[90] = MSI supports 1 message 
    cap 10[a0] = PCI-Express 2 root port max data 128(128)
                 link x4(x16) speed 2.5(2.5) ASPM disabled(L0s/L1)
                 slot 0 power limit 10000 mW
    ecap 0002[100] = VC 1 max VC0
    ecap 0005[140] = Root Complex Link Declaration 1

vgapci0@pci0:0:2:0:	class=0x030000 card=0x2a8c103c chip=0x2e328086 rev=0x03 hdr=0x00
    vendor     = 'Intel Corporation'
    device     = '4 Series Chipset Integrated Graphics Controller'
    class      = display
    subclass   = VGA
    bar   [10] = type Memory, range 64, base 0xfe400000, size 4194304, enabled
    bar   [18] = type Prefetchable Memory, range 64, base 0xd0000000, size 268435456, enabled
    bar   [20] = type I/O Port, range 32, base 0xdc00, size 8, enabled
    cap 05[90] = MSI supports 1 message 
    cap 01[d0] = powerspec 2  supports D0 D3  current D0
    cap 13[a4] = PCI Advanced Features: FLR TP

hdac0@pci0:0:27:0:	class=0x040300 card=0x2a8c103c chip=0x27d88086 rev=0x01 hdr=0x00
    vendor     = 'Intel Corporation'
    device     = 'NM10/ICH7 Family High Definition Audio Controller'
    class      = multimedia
    subclass   = HDA
    bar   [10] = type Memory, range 64, base 0xfe3f8000, size 16384, enabled
    cap 01[50] = powerspec 2  supports D0 D3  current D0
    cap 05[60] = MSI supports 1 message, 64 bit enabled with 1 message
    cap 10[70] = PCI-Express 1 root endpoint max data 128(128) NS
    ecap 0002[100] = VC 1 max VC1
    ecap 0005[130] = Root Complex Link Declaration 1

pcib2@pci0:0:28:0:	class=0x060400 card=0x2a8c103c chip=0x27d08086 rev=0x01 hdr=0x01
    vendor     = 'Intel Corporation'
    device     = 'NM10/ICH7 Family PCI Express Port 1'
    class      = bridge
    subclass   = PCI-PCI
    cap 10[40] = PCI-Express 1 root port max data 128(128)
                 link x0(x1) speed 0.0(2.5) ASPM disabled(L0s/L1)
                 slot 32 power limit 25000 mW HotPlug(empty) surprise
    cap 05[80] = MSI supports 1 message 
    cap 0d[90] = PCI Bridge card=0x2a8c103c
    cap 01[a0] = powerspec 2  supports D0 D3  current D0
    ecap 0002[100] = VC 1 max VC1
    ecap 0005[180] = Root Complex Link Declaration 1

pcib3@pci0:0:28:1:	class=0x060400 card=0x2a8c103c chip=0x27d28086 rev=0x01 hdr=0x01
    vendor     = 'Intel Corporation'
    device     = 'NM10/ICH7 Family PCI Express Port 2'
    class      = bridge
    subclass   = PCI-PCI
    cap 10[40] = PCI-Express 1 root port max data 128(128)
                 link x1(x1) speed 2.5(2.5) ASPM disabled(L0s/L1)
                 slot 33 power limit 10000 mW HotPlug(present) surprise
    cap 05[80] = MSI supports 1 message 
    cap 0d[90] = PCI Bridge card=0x2a8c103c
    cap 01[a0] = powerspec 2  supports D0 D3  current D0
    ecap 0002[100] = VC 1 max VC1
    ecap 0005[180] = Root Complex Link Declaration 1

pcib4@pci0:0:28:3:	class=0x060400 card=0x2a8c103c chip=0x27d68086 rev=0x01 hdr=0x01
    vendor     = 'Intel Corporation'
    device     = 'NM10/ICH7 Family PCI Express Port 4'
    class      = bridge
    subclass   = PCI-PCI
    cap 10[40] = PCI-Express 1 root port max data 128(128)
                 link x1(x1) speed 2.5(2.5) ASPM disabled(L0s/L1)
                 slot 35 power limit 10000 mW HotPlug(present) surprise
    cap 05[80] = MSI supports 1 message 
    cap 0d[90] = PCI Bridge card=0x2a8c103c
    cap 01[a0] = powerspec 2  supports D0 D3  current D0
    ecap 0002[100] = VC 1 max VC1
    ecap 0005[180] = Root Complex Link Declaration 1

uhci0@pci0:0:29:0:	class=0x0c0300 card=0x2a8c103c chip=0x27c88086 rev=0x01 hdr=0x00
    vendor     = 'Intel Corporation'
    device     = 'NM10/ICH7 Family USB UHCI Controller'
    class      = serial bus
    subclass   = USB
    bar   [20] = type I/O Port, range 32, base 0xd880, size 32, enabled

uhci1@pci0:0:29:1:	class=0x0c0300 card=0x2a8c103c chip=0x27c98086 rev=0x01 hdr=0x00
    vendor     = 'Intel Corporation'
    device     = 'NM10/ICH7 Family USB UHCI Controller'
    class      = serial bus
    subclass   = USB
    bar   [20] = type I/O Port, range 32, base 0xd800, size 32, enabled

uhci2@pci0:0:29:2:	class=0x0c0300 card=0x2a8c103c chip=0x27ca8086 rev=0x01 hdr=0x00
    vendor     = 'Intel Corporation'
    device     = 'NM10/ICH7 Family USB UHCI Controller'
    class      = serial bus
    subclass   = USB
    bar   [20] = type I/O Port, range 32, base 0xd480, size 32, enabled

uhci3@pci0:0:29:3:	class=0x0c0300 card=0x2a8c103c chip=0x27cb8086 rev=0x01 hdr=0x00
    vendor     = 'Intel Corporation'
    device     = 'NM10/ICH7 Family USB UHCI Controller'
    class      = serial bus
    subclass   = USB
    bar   [20] = type I/O Port, range 32, base 0xd400, size 32, enabled

ehci0@pci0:0:29:7:	class=0x0c0320 card=0x2a8c103c chip=0x27cc8086 rev=0x01 hdr=0x00
    vendor     = 'Intel Corporation'
    device     = 'NM10/ICH7 Family USB2 EHCI Controller'
    class      = serial bus
    subclass   = USB
    bar   [10] = type Memory, range 32, base 0xfe3f7c00, size 1024, enabled
    cap 01[50] = powerspec 2  supports D0 D3  current D0
    cap 0a[58] = EHCI Debug Port at offset 0xa0 in map 0x14

pcib5@pci0:0:30:0:	class=0x060401 card=0x2a8c103c chip=0x244e8086 rev=0xe1 hdr=0x01
    vendor     = 'Intel Corporation'
    device     = '82801 PCI Bridge'
    class      = bridge
    subclass   = PCI-PCI
    cap 0d[50] = PCI Bridge card=0x2a8c103c

isab0@pci0:0:31:0:	class=0x060100 card=0x2a8c103c chip=0x27b88086 rev=0x01 hdr=0x00
    vendor     = 'Intel Corporation'
    device     = '82801GB/GR (ICH7 Family) LPC Interface Bridge'
    class      = bridge
    subclass   = PCI-ISA
    cap 09[e0] = vendor (length 12) Intel cap 1 version 0
		 features: Quick Resume, SATA RAID-5, 6 PCI-e x1 slots, SATA RAID-0/1/10, SATA AHCI

atapci0@pci0:0:31:1:	class=0x01018a card=0x2a8c103c chip=0x27df8086 rev=0x01 hdr=0x00
    vendor     = 'Intel Corporation'
    device     = '82801G (ICH7 Family) IDE Controller'
    class      = mass storage
    subclass   = ATA
    bar   [20] = type I/O Port, range 32, base 0xffa0, size 16, enabled

atapci1@pci0:0:31:2:	class=0x01018f card=0x2a8c103c chip=0x27c08086 rev=0x01 hdr=0x00
    vendor     = 'Intel Corporation'
    device     = 'NM10/ICH7 Family SATA Controller [IDE mode]'
    class      = mass storage
    subclass   = ATA
    bar   [10] = type I/O Port, range 32, base 0xd080, size 8, enabled
    bar   [14] = type I/O Port, range 32, base 0xd000, size 4, enabled
    bar   [18] = type I/O Port, range 32, base 0xcc00, size 8, enabled
    bar   [1c] = type I/O Port, range 32, base 0xc880, size 4, enabled
    bar   [20] = type I/O Port, range 32, base 0xc800, size 16, enabled
    cap 01[70] = powerspec 2  supports D0 D3  current D0

none0@pci0:0:31:3:	class=0x0c0500 card=0x2a8c103c chip=0x27da8086 rev=0x01 hdr=0x00
    vendor     = 'Intel Corporation'
    device     = 'NM10/ICH7 Family SMBus Controller'
    class      = serial bus
    subclass   = SMBus
    bar   [20] = type I/O Port, range 32, base 0x400, size 32, enabled

bge0@pci0:1:0:0:	class=0x020000 card=0x04201014 chip=0x165714e4 rev=0x01 hdr=0x00
    vendor     = 'Broadcom Inc. and subsidiaries'
    device     = 'NetXtreme BCM5719 Gigabit Ethernet PCIe'
    class      = network
    subclass   = ethernet
    bar   [10] = type Prefetchable Memory, range 64, base 0xfdef0000, size 65536, enabled
    bar   [18] = type Prefetchable Memory, range 64, base 0xfdee0000, size 65536, enabled
    bar   [20] = type Prefetchable Memory, range 64, base 0xfded0000, size 65536, enabled
    cap 01[48] = powerspec 3  supports D0 D3  current D0
    cap 03[50] = VPD
    cap 05[58] = MSI supports 8 messages, 64 bit enabled with 1 message
    cap 11[a0] = MSI-X supports 17 messages
                 Table in map 0x20[0x0], PBA in map 0x20[0x120]
    cap 10[ac] = PCI-Express 2 endpoint max data 128(256) FLR
                 link x4(x4) speed 2.5(5.0) ASPM disabled(L0s/L1)
    ecap 0001[100] = AER 1 0 fatal 0 non-fatal 1 corrected
    ecap 0003[13c] = Serial 1 00006cae8b009db8
    ecap 0004[150] = Power Budgeting 1
    ecap 0002[160] = VC 1 max VC0
    ecap 0017[230] = TPH Requester 1

bge1@pci0:1:0:1:	class=0x020000 card=0x04201014 chip=0x165714e4 rev=0x01 hdr=0x00
    vendor     = 'Broadcom Inc. and subsidiaries'
    device     = 'NetXtreme BCM5719 Gigabit Ethernet PCIe'
    class      = network
    subclass   = ethernet
    bar   [10] = type Prefetchable Memory, range 64, base 0xfdec0000, size 65536, enabled
    bar   [18] = type Prefetchable Memory, range 64, base 0xfdeb0000, size 65536, enabled
    bar   [20] = type Prefetchable Memory, range 64, base 0xfdea0000, size 65536, enabled
    cap 01[48] = powerspec 3  supports D0 D3  current D0
    cap 03[50] = VPD
    cap 05[58] = MSI supports 8 messages, 64 bit enabled with 1 message
    cap 11[a0] = MSI-X supports 17 messages
                 Table in map 0x20[0x0], PBA in map 0x20[0x120]
    cap 10[ac] = PCI-Express 2 endpoint max data 128(256) FLR
                 link x4(x4) speed 2.5(5.0) ASPM disabled(L0s/L1)
    ecap 0001[100] = AER 1 0 fatal 0 non-fatal 1 corrected
    ecap 0003[13c] = Serial 1 00006cae8b009db9
    ecap 0004[150] = Power Budgeting 1
    ecap 0002[160] = VC 1 max VC0
    ecap 0017[230] = TPH Requester 1

bge2@pci0:1:0:2:	class=0x020000 card=0x04201014 chip=0x165714e4 rev=0x01 hdr=0x00
    vendor     = 'Broadcom Inc. and subsidiaries'
    device     = 'NetXtreme BCM5719 Gigabit Ethernet PCIe'
    class      = network
    subclass   = ethernet
    bar   [10] = type Prefetchable Memory, range 64, base 0xfde90000, size 65536, enabled
    bar   [18] = type Prefetchable Memory, range 64, base 0xfde80000, size 65536, enabled
    bar   [20] = type Prefetchable Memory, range 64, base 0xfde70000, size 65536, enabled
    cap 01[48] = powerspec 3  supports D0 D3  current D0
    cap 03[50] = VPD
    cap 05[58] = MSI supports 8 messages, 64 bit enabled with 1 message
    cap 11[a0] = MSI-X supports 17 messages
                 Table in map 0x20[0x0], PBA in map 0x20[0x120]
    cap 10[ac] = PCI-Express 2 endpoint max data 128(256) FLR
                 link x4(x4) speed 2.5(5.0) ASPM disabled(L0s/L1)
    ecap 0001[100] = AER 1 0 fatal 0 non-fatal 1 corrected
    ecap 0003[13c] = Serial 1 00006cae8b009dba
    ecap 0004[150] = Power Budgeting 1
    ecap 0002[160] = VC 1 max VC0
    ecap 0017[230] = TPH Requester 1

bge3@pci0:1:0:3:	class=0x020000 card=0x04201014 chip=0x165714e4 rev=0x01 hdr=0x00
    vendor     = 'Broadcom Inc. and subsidiaries'
    device     = 'NetXtreme BCM5719 Gigabit Ethernet PCIe'
    class      = network
    subclass   = ethernet
    bar   [10] = type Prefetchable Memory, range 64, base 0xfde60000, size 65536, enabled
    bar   [18] = type Prefetchable Memory, range 64, base 0xfde50000, size 65536, enabled
    bar   [20] = type Prefetchable Memory, range 64, base 0xfde40000, size 65536, enabled
    cap 01[48] = powerspec 3  supports D0 D3  current D0
    cap 03[50] = VPD
    cap 05[58] = MSI supports 8 messages, 64 bit enabled with 1 message
    cap 11[a0] = MSI-X supports 17 messages
                 Table in map 0x20[0x0], PBA in map 0x20[0x120]
    cap 10[ac] = PCI-Express 2 endpoint max data 128(256) FLR
                 link x4(x4) speed 2.5(5.0) ASPM disabled(L0s/L1)
    ecap 0001[100] = AER 1 0 fatal 0 non-fatal 1 corrected
    ecap 0003[13c] = Serial 1 00006cae8b009dbb
    ecap 0004[150] = Power Budgeting 1
    ecap 0002[160] = VC 1 max VC0
    ecap 0017[230] = TPH Requester 1

re0@pci0:3:0:0:	class=0x020000 card=0x2a8c103c chip=0x813610ec rev=0x02 hdr=0x00
    vendor     = 'Realtek Semiconductor Co., Ltd.'
    device     = 'RTL810xE PCI Express Fast Ethernet controller'
    class      = network
    subclass   = ethernet
    bar   [10] = type I/O Port, range 32, base 0xe800, size 256, enabled
    bar   [18] = type Memory, range 64, base 0xfeaff000, size 4096, enabled
    bar   [20] = type Prefetchable Memory, range 64, base 0xfdff0000, size 65536, enabled
    cap 01[40] = powerspec 3  supports D0 D1 D2 D3  current D0
    cap 05[50] = MSI supports 1 message, 64 bit 
    cap 10[70] = PCI-Express 2 endpoint MSI 1 max data 128(256) RO
                 link x1(x1) speed 2.5(2.5) ASPM disabled(L0s/L1)
    cap 11[ac] = MSI-X supports 2 messages
                 Table in map 0x20[0x0], PBA in map 0x20[0x800]
    cap 03[cc] = VPD
    ecap 0001[100] = AER 1 0 fatal 0 non-fatal 1 corrected
    ecap 0002[140] = VC 1 max VC0
    ecap 0003[160] = Serial 1 20000000364ce000

iwn0@pci0:4:0:0:	class=0x028000 card=0x11218086 chip=0x42298086 rev=0x61 hdr=0x00
    vendor     = 'Intel Corporation'
    device     = 'PRO/Wireless 4965 AG or AGN [Kedron] Network Connection'
    class      = network
    bar   [10] = type Memory, range 64, base 0xfebfe000, size 8192, enabled
    cap 01[c8] = powerspec 3  supports D0 D3  current D0
    cap 05[d0] = MSI supports 1 message, 64 bit enabled with 1 message
    cap 10[e0] = PCI-Express 1 endpoint max data 128(128) RO NS
                 link x1(x1) speed 2.5(2.5) ASPM disabled(L0s/L1)
    ecap 0001[100] = AER 1 0 fatal 0 non-fatal 0 corrected
    ecap 0003[140] = Serial 1 001f3bffff62fff9
