hostb0@pci0:0:0:0:	class=0x060000 card=0x040d15d9 chip=0xd1308086 rev=0x11 hdr=0x00
    vendor     = 'Intel Corporation'
    device     = 'Core Processor DMI'
    class      = bridge
    subclass   = HOST-PCI
    cap 00[40] = unknown

pcib1@pci0:0:3:0:	class=0x060400 card=0x040d15d9 chip=0xd1388086 rev=0x11 hdr=0x01
    vendor     = 'Intel Corporation'
    device     = 'Core Processor PCI Express Root Port 1'
    class      = bridge
    subclass   = PCI-PCI
    cap 0d[40] = PCI Bridge card=0x040d15d9
    cap 05[60] = MSI supports 2 messages, vector masks 
    cap 10[90] = PCI-Express 2 root port max data 256(256) ARI disabled
                 link x1(x8) speed 5.0(5.0) ASPM disabled(L0s/L1)
                 slot 3 power limit 10000 mW
    cap 01[e0] = powerspec 3  supports D0 D3  current D0
    ecap 0001[100] = AER 1 0 fatal 0 non-fatal 0 corrected
    ecap 000d[150] = ACS 1
    ecap 000b[160] = Vendor 0pcib2@pci0:0:5:0:	class=0x060400 card=0x040d15d9 chip=0xd13a8086 rev=0x11 hdr=0x01
    vendor     = 'Intel Corporation'
    device     = 'Core Processor PCI Express Root Port 3'
    class      = bridge
    subclass   = PCI-PCI
    cap 0d[40] = PCI Bridge card=0x040d15d9
    cap 05[60] = MSI supports 2 messages, vector masks 
    cap 10[90] = PCI-Express 2 root port max data 256(256) ARI enabled
                 link x8(x8) speed 5.0(5.0) ASPM disabled(L0s/L1)
    cap 01[e0] = powerspec 3  supports D0 D3  current D0
    ecap 0001[100] = AER 1 0 fatal 0 non-fatal 0 corrected
    ecap 000d[150] = ACS 1
    ecap 0000[160] = unknown 0

none0@pci0:0:8:0:	class=0x088000 card=0x000d00d9 chip=0xd1558086 rev=0x11 hdr=0x00
    vendor     = 'Intel Corporation'
    device     = 'Core Processor System Management Registers'
    class      = base peripheral
    cap 10[40] = PCI-Express 2 root endpoint max data 128(128)
                 link x0(x0) ASPM disabled(L0s)
    ecap 000b[100] = Vendor 0none1@pci0:0:8:1:	class=0x088000 card=0x000d00d9 chip=0xd1568086 rev=0x11 hdr=0x00
    vendor     = 'Intel Corporation'
    device     = 'Core Processor Semaphore and Scratchpad Registers'
    class      = base peripheral
    cap 10[40] = PCI-Express 2 root endpoint max data 128(128)
                 link x0(x0) ASPM disabled(L0s)
    ecap 000b[100] = Vendor 0none2@pci0:0:8:2:	class=0x088000 card=0x000d00d9 chip=0xd1578086 rev=0x11 hdr=0x00
    vendor     = 'Intel Corporation'
    device     = 'Core Processor System Control and Status Registers'
    class      = base peripheral
    cap 10[40] = PCI-Express 2 root endpoint max data 128(128)
                 link x0(x0) ASPM disabled(L0s)
    ecap 000b[100] = Vendor 0none3@pci0:0:8:3:	class=0x088000 card=0x000d00d9 chip=0xd1588086 rev=0x11 hdr=0x00
    vendor     = 'Intel Corporation'
    device     = 'Core Processor Miscellaneous Registers'
    class      = base peripheral

none4@pci0:0:16:0:	class=0x088000 card=0x000d00d9 chip=0xd1508086 rev=0x11 hdr=0x00
    vendor     = 'Intel Corporation'
    device     = 'Core Processor QPI Link'
    class      = base peripheral

none5@pci0:0:16:1:	class=0x088000 card=0x000d00d9 chip=0xd1518086 rev=0x11 hdr=0x00
    vendor     = 'Intel Corporation'
    device     = 'Core Processor QPI Routing and Protocol Registers'
    class      = base peripheral

ehci0@pci0:0:26:0:	class=0x0c0320 card=0x040d15d9 chip=0x3b3c8086 rev=0x05 hdr=0x00
    vendor     = 'Intel Corporation'
    device     = '5 Series/3400 Series Chipset USB2 Enhanced Host Controller'
    class      = serial bus
    subclass   = USB
    bar   [10] = type Memory, range 32, base 0xfb0fc000, size 1024, enabled
    cap 01[50] = powerspec 2  supports D0 D3  current D0
    cap 0a[58] = EHCI Debug Port at offset 0xa0 in map 0x14
    cap 13[98] = PCI Advanced Features: FLR TP

pcib3@pci0:0:28:0:	class=0x060400 card=0x040d15d9 chip=0x3b428086 rev=0x05 hdr=0x01
    vendor     = 'Intel Corporation'
    device     = '5 Series/3400 Series Chipset PCI Express Root Port 1'
    class      = bridge
    subclass   = PCI-PCI
    cap 10[40] = PCI-Express 2 root port max data 128(128)
                 link x4(x4) speed 2.5(2.5) ASPM L0s/L1(L0s/L1)
                 slot 2 power limit 25000 mW HotPlug(present) surprise
    cap 05[80] = MSI supports 1 message 
    cap 0d[90] = PCI Bridge card=0x040d15d9
    cap 01[a0] = powerspec 2  supports D0 D3  current D0

pcib4@pci0:0:28:4:	class=0x060400 card=0x040d15d9 chip=0x3b4a8086 rev=0x05 hdr=0x01
    vendor     = 'Intel Corporation'
    device     = '5 Series/3400 Series Chipset PCI Express Root Port 5'
    class      = bridge
    subclass   = PCI-PCI
    cap 10[40] = PCI-Express 2 root port max data 128(128)
                 link x1(x1) speed 2.5(2.5) ASPM L0s/L1(L0s/L1)
                 slot 0 power limit 0 mW HotPlug(present) surprise
    cap 05[80] = MSI supports 1 message 
    cap 0d[90] = PCI Bridge card=0x040d15d9
    cap 01[a0] = powerspec 2  supports D0 D3  current D0

pcib5@pci0:0:28:5:	class=0x060400 card=0x040d15d9 chip=0x3b4c8086 rev=0x05 hdr=0x01
    vendor     = 'Intel Corporation'
    device     = '5 Series/3400 Series Chipset PCI Express Root Port 6'
    class      = bridge
    subclass   = PCI-PCI
    cap 10[40] = PCI-Express 2 root port max data 128(128)
                 link x1(x1) speed 2.5(2.5) ASPM L0s/L1(L0s/L1)
                 slot 0 power limit 0 mW HotPlug(present) surprise
    cap 05[80] = MSI supports 1 message 
    cap 0d[90] = PCI Bridge card=0x040d15d9
    cap 01[a0] = powerspec 2  supports D0 D3  current D0

ehci1@pci0:0:29:0:	class=0x0c0320 card=0x040d15d9 chip=0x3b348086 rev=0x05 hdr=0x00
    vendor     = 'Intel Corporation'
    device     = '5 Series/3400 Series Chipset USB2 Enhanced Host Controller'
    class      = serial bus
    subclass   = USB
    bar   [10] = type Memory, range 32, base 0xfb0fa000, size 1024, enabled
    cap 01[50] = powerspec 2  supports D0 D3  current D0
    cap 0a[58] = EHCI Debug Port at offset 0xa0 in map 0x14
    cap 13[98] = PCI Advanced Features: FLR TP

pcib6@pci0:0:30:0:	class=0x060401 card=0x040d15d9 chip=0x244e8086 rev=0xa5 hdr=0x01
    vendor     = 'Intel Corporation'
    device     = '82801 PCI Bridge'
    class      = bridge
    subclass   = PCI-PCI
    cap 0d[50] = PCI Bridge card=0x040d15d9

isab0@pci0:0:31:0:	class=0x060100 card=0x040d15d9 chip=0x3b148086 rev=0x05 hdr=0x00
    vendor     = 'Intel Corporation'
    device     = '3420 Chipset LPC Interface Controller'
    class      = bridge
    subclass   = PCI-ISA
    cap 09[e0] = vendor (length 16) Intel cap 1 version 1

ahci1@pci0:0:31:2:	class=0x010601 card=0x040d15d9 chip=0x3b228086 rev=0x05 hdr=0x00
    vendor     = 'Intel Corporation'
    device     = '5 Series/3400 Series Chipset 6 port SATA AHCI Controller'
    class      = mass storage
    subclass   = SATA
    bar   [10] = type I/O Port, range 32, base 0x9400, size 8, enabled
    bar   [14] = type I/O Port, range 32, base 0x9c00, size 4, enabled
    bar   [18] = type I/O Port, range 32, base 0x9880, size 8, enabled
    bar   [1c] = type I/O Port, range 32, base 0x9800, size 4, enabled
    bar   [20] = type I/O Port, range 32, base 0x9480, size 32, enabled
    bar   [24] = type Memory, range 32, base 0xfb0f8000, size 2048, enabled
    cap 05[80] = MSI supports 1 message enabled with 1 message
    cap 01[70] = powerspec 3  supports D0 D3  current D0
    cap 12[a8] = SATA Index-Data Pair
    cap 13[b0] = PCI Advanced Features: FLR TP

none6@pci0:0:31:3:	class=0x0c0500 card=0x040d15d9 chip=0x3b308086 rev=0x05 hdr=0x00
    vendor     = 'Intel Corporation'
    device     = '5 Series/3400 Series Chipset SMBus Controller'
    class      = serial bus
    subclass   = SMBus
    bar   [10] = type Memory, range 64, base 0xfb0f6000, size 256, enabled
    bar   [20] = type I/O Port, range 32, base 0x400, size 32, enabled

ahci0@pci0:1:0:0:	class=0x010601 card=0x92151b4b chip=0x92151b4b rev=0x11 hdr=0x00
    vendor     = 'Marvell Technology Group Ltd.'
    class      = mass storage
    subclass   = SATA
    bar   [10] = type I/O Port, range 32, base 0xa480, size 8, enabled
    bar   [14] = type I/O Port, range 32, base 0xa400, size 4, enabled
    bar   [18] = type I/O Port, range 32, base 0xac00, size 8, enabled
    bar   [1c] = type I/O Port, range 32, base 0xa880, size 4, enabled
    bar   [20] = type I/O Port, range 32, base 0xa800, size 32, enabled
    bar   [24] = type Memory, range 32, base 0xfb1bf800, size 2048, enabled
    cap 01[40] = powerspec 3  supports D0 D3  current D0
    cap 05[50] = MSI supports 1 message enabled with 1 message
    cap 10[70] = PCI-Express 2 legacy endpoint max data 256(512) RO
                 link x1(x1) speed 5.0(5.0) ASPM disabled(L0s/L1)
    cap 12[e0] = SATA Index-Data Pair
    ecap 0001[100] = AER 1 0 fatal 0 non-fatal 1 corrected

mps0@pci0:2:0:0:	class=0x010700 card=0x040015d9 chip=0x00721000 rev=0x03 hdr=0x00
    vendor     = 'Broadcom / LSI'
    device     = 'SAS2008 PCI-Express Fusion-MPT SAS-2 [Falcon]'
    class      = mass storage
    subclass   = SAS
    bar   [10] = type I/O Port, range 32, base 0xb000, size 256, enabled
    bar   [14] = type Memory, range 64, base 0xfb23c000, size 16384, enabled
    bar   [1c] = type Memory, range 64, base 0xfb240000, size 262144, enabled
    cap 01[50] = powerspec 3  supports D0 D1 D2 D3  current D0
    cap 10[68] = PCI-Express 2 endpoint max data 256(4096) FLR RO NS
                 link x8(x8) speed 5.0(5.0) ASPM disabled(L0s)
    cap 03[d0] = VPD
    cap 05[a8] = MSI supports 1 message, 64 bit 
    cap 11[c0] = MSI-X supports 15 messages, enabled
                 Table in map 0x14[0x2000], PBA in map 0x14[0x3800]
    ecap 0001[100] = AER 1 0 fatal 0 non-fatal 1 corrected
    ecap 0004[138] = Power Budgeting 1
    ecap 0010[150] = SR-IOV 1 IOV disabled, Memory Space disabled, ARI disabled
                     0 VFs configured out of 16 supported
                     First VF RID Offset 0x0001, VF RID Stride 0x0001
                     VF Device ID 0x0072
                     Page Sizes: 4096 (enabled), 8192, 65536, 262144, 1048576, 4194304
    ecap 000e[190] = ARI 1

ciss0@pci0:3:0:0:	class=0x010400 card=0x3234103c chip=0x3230103c rev=0x03 hdr=0x00
    vendor     = 'Hewlett-Packard Company'
    device     = 'Smart Array Controller'
    class      = mass storage
    subclass   = RAID
    bar   [10] = type Memory, range 64, base 0xfb400000, size 1048576, enabled
    bar   [18] = type I/O Port, range 32, base 0xc800, size 256, enabled
    bar   [1c] = type Memory, range 64, base 0xfb3bf000, size 4096, enabled
    cap 10[b0] = PCI-Express 1 endpoint max data 128(512) RO NS
                 link x4(x8) speed 2.5(2.5) ASPM L0s/L1(L0s)
    cap 11[d4] = MSI-X supports 4 messages, enabled
                 Table in map 0x10[0xfe000], PBA in map 0x10[0xff000]
    cap 01[e0] = powerspec 2  supports D0 D1 D3  current D0
    cap 03[ec] = VPD
    ecap 0004[100] = Power Budgeting 1

em0@pci0:4:0:0:	class=0x020000 card=0x000015d9 chip=0x10d38086 rev=0x00 hdr=0x00
    vendor     = 'Intel Corporation'
    device     = '82574L Gigabit Network Connection'
    class      = network
    subclass   = ethernet
    bar   [10] = type Memory, range 32, base 0xfb5e0000, size 131072, enabled
    bar   [18] = type I/O Port, range 32, base 0xdc00, size 32, enabled
    bar   [1c] = type Memory, range 32, base 0xfb5dc000, size 16384, enabled
    cap 01[c8] = powerspec 2  supports D0 D3  current D0
    cap 05[d0] = MSI supports 1 message, 64 bit 
    cap 10[e0] = PCI-Express 1 endpoint max data 128(256) RO NS
                 link x1(x1) speed 2.5(2.5) ASPM disabled(L0s/L1)
    cap 11[a0] = MSI-X supports 5 messages, enabled
                 Table in map 0x1c[0x0], PBA in map 0x1c[0x2000]
    ecap 0001[100] = AER 1 1 fatal 0 non-fatal 5 corrected
    ecap 0003[140] = Serial 1 204e7fffffc790fc

em1@pci0:5:0:0:	class=0x020000 card=0x000015d9 chip=0x10d38086 rev=0x00 hdr=0x00
    vendor     = 'Intel Corporation'
    device     = '82574L Gigabit Network Connection'
    class      = network
    subclass   = ethernet
    bar   [10] = type Memory, range 32, base 0xfb6e0000, size 131072, enabled
    bar   [18] = type I/O Port, range 32, base 0xec00, size 32, enabled
    bar   [1c] = type Memory, range 32, base 0xfb6dc000, size 16384, enabled

vgapci0@pci0:6:3:0:	class=0x030000 card=0x040d15d9 chip=0x0532102b rev=0x0a hdr=0x00
    vendor     = 'Matrox Electronics Systems Ltd.'
    device     = 'MGA G200eW WPCM450'
    class      = display
    subclass   = VGA
    bar   [10] = type Prefetchable Memory, range 32, base 0xfa000000, size 16777216, enabled
    bar   [14] = type Memory, range 32, base 0xfb7fc000, size 16384, enabled
    bar   [18] = type Memory, range 32, base 0xfb800000, size 8388608, enabled
    cap 01[dc] = powerspec 1  supports D0 D3  current D0
