hostb0@pci0:0:0:0:	class=0x060000 rev=0x02 hdr=0x00 vendor=0x1002 device=0x5a14 subvendor=0x1462 subdevice=0x7693
    vendor     = 'Advanced Micro Devices, Inc. [AMD/ATI]'
    device     = 'RD9x0/RX980 Host Bridge'
    class      = bridge
    subclass   = HOST-PCI
    cap 08[f0] = HT MSI fixed address window enabled at 0xfee00000
    cap 08[c4] = HT slave
    cap 08[40] = HT retry mode
    cap 08[54] = HT unit ID clumping
    cap 08[9c] = HT Gen3
    cap 05[70] = MSI supports 4 messages 

none0@pci0:0:0:2:	class=0x080600 rev=0x00 hdr=0x00 vendor=0x1002 device=0x5a23 subvendor=0x1462 subdevice=0x7693
    vendor     = 'Advanced Micro Devices, Inc. [AMD/ATI]'
    device     = 'RD890S/RD990 I/O Memory Management Unit (IOMMU)'
    class      = base peripheral
    subclass   = IOMMU
    cap 0f[40] = unknown
    cap 05[54] = MSI supports 1 message, 64 bit 
    cap 08[64] = HT MSI fixed address window enabled at 0xfee00000

pcib1@pci0:0:2:0:	class=0x060400 rev=0x00 hdr=0x01 vendor=0x1002 device=0x5a16 subvendor=0x1462 subdevice=0x7693
    vendor     = 'Advanced Micro Devices, Inc. [AMD/ATI]'
    device     = 'RD890/RD9x0/RX980 PCI to PCI bridge (PCI Express GFX port 0)'
    class      = bridge
    subclass   = PCI-PCI
    cap 01[50] = powerspec 3  supports D0 D3  current D0
    cap 10[58] = PCI-Express 2 root port max data 128(128) NS ARI disabled
                 max read 128
                 link x2(x8) speed 5.0(5.0) ASPM disabled(L0s/L1)
                 slot 2 power limit 75000 mW
    cap 05[a0] = MSI supports 1 message 
    cap 0d[b0] = PCI Bridge subvendor=0x1462 subdevice=0x7693
    cap 08[b8] = HT MSI fixed address window enabled at 0xfee00000
    ecap 000b[100] = Vendor [1] ID 0001 Rev 1 Length 16
    ecap 000d[190] = ACS 1

pcib7@pci0:0:3:0:	class=0x060400 rev=0x00 hdr=0x01 vendor=0x1002 device=0x5a17 subvendor=0x1462 subdevice=0x7693
    vendor     = 'Advanced Micro Devices, Inc. [AMD/ATI]'
    device     = 'RD890/RD9x0 PCI to PCI bridge (PCI Express GFX port 1)'
    class      = bridge
    subclass   = PCI-PCI
    cap 01[50] = powerspec 3  supports D0 D3  current D0
    cap 10[58] = PCI-Express 2 root port max data 128(128) NS ARI disabled
                 max read 128
                 link x8(x8) speed 2.5(5.0) ASPM disabled(L0s/L1)
                 slot 3 power limit 75000 mW
    cap 05[a0] = MSI supports 1 message 
    cap 0d[b0] = PCI Bridge subvendor=0x1462 subdevice=0x7693
    cap 08[b8] = HT MSI fixed address window enabled at 0xfee00000
    ecap 000b[100] = Vendor [1] ID 0001 Rev 1 Length 16
    ecap 000d[190] = ACS 1

pcib8@pci0:0:9:0:	class=0x060400 rev=0x00 hdr=0x01 vendor=0x1002 device=0x5a1c subvendor=0x1462 subdevice=0x7693
    vendor     = 'Advanced Micro Devices, Inc. [AMD/ATI]'
    device     = 'RD890/RD9x0/RX980 PCI to PCI bridge (PCI Express GPP Port 4)'
    class      = bridge
    subclass   = PCI-PCI
    cap 01[50] = powerspec 3  supports D0 D3  current D0
    cap 10[58] = PCI-Express 2 root port max data 128(128) NS ARI disabled
                 max read 128
                 link x1(x1) speed 5.0(5.0) ASPM disabled(L0s/L1)
                 slot 9 power limit 75000 mW
    cap 05[a0] = MSI supports 1 message 
    cap 0d[b0] = PCI Bridge subvendor=0x1462 subdevice=0x7693
    cap 08[b8] = HT MSI fixed address window enabled at 0xfee00000
    ecap 000b[100] = Vendor [1] ID 0001 Rev 1 Length 16
    ecap 000d[190] = ACS 1

ahci0@pci0:0:17:0:	class=0x010601 rev=0x40 hdr=0x00 vendor=0x1002 device=0x4391 subvendor=0x1462 subdevice=0x7992
    vendor     = 'Advanced Micro Devices, Inc. [AMD/ATI]'
    device     = 'SB7x0/SB8x0/SB9x0 SATA Controller [AHCI mode]'
    class      = mass storage
    subclass   = SATA
    bar   [10] = type I/O Port, range 32, base 0xf040, size 8, enabled
    bar   [14] = type I/O Port, range 32, base 0xf030, size 4, enabled
    bar   [18] = type I/O Port, range 32, base 0xf020, size 8, enabled
    bar   [1c] = type I/O Port, range 32, base 0xf010, size 4, enabled
    bar   [20] = type I/O Port, range 32, base 0xf000, size 16, enabled
    bar   [24] = type Memory, range 32, base 0xfe70b000, size 1024, enabled
    cap 12[70] = SATA Index-Data Pair
    cap 13[a4] = PCI Advanced Features: FLR TP

ohci0@pci0:0:18:0:	class=0x0c0310 rev=0x00 hdr=0x00 vendor=0x1002 device=0x4397 subvendor=0x1462 subdevice=0x7992
    vendor     = 'Advanced Micro Devices, Inc. [AMD/ATI]'
    device     = 'SB7x0/SB8x0/SB9x0 USB OHCI0 Controller'
    class      = serial bus
    subclass   = USB
    bar   [10] = type Memory, range 32, base 0xfe70a000, size 4096, enabled

ehci0@pci0:0:18:2:	class=0x0c0320 rev=0x00 hdr=0x00 vendor=0x1002 device=0x4396 subvendor=0x1462 subdevice=0x7992
    vendor     = 'Advanced Micro Devices, Inc. [AMD/ATI]'
    device     = 'SB7x0/SB8x0/SB9x0 USB EHCI Controller'
    class      = serial bus
    subclass   = USB
    bar   [10] = type Memory, range 32, base 0xfe709000, size 256, enabled
    cap 01[c0] = powerspec 2  supports D0 D1 D2 D3  current D0
    cap 0a[e4] = EHCI Debug Port at offset 0xe0 in map 0x14

ohci1@pci0:0:19:0:	class=0x0c0310 rev=0x00 hdr=0x00 vendor=0x1002 device=0x4397 subvendor=0x1462 subdevice=0x7992
    vendor     = 'Advanced Micro Devices, Inc. [AMD/ATI]'
    device     = 'SB7x0/SB8x0/SB9x0 USB OHCI0 Controller'
    class      = serial bus
    subclass   = USB
    bar   [10] = type Memory, range 32, base 0xfe708000, size 4096, enabled

ehci1@pci0:0:19:2:	class=0x0c0320 rev=0x00 hdr=0x00 vendor=0x1002 device=0x4396 subvendor=0x1462 subdevice=0x7992
    vendor     = 'Advanced Micro Devices, Inc. [AMD/ATI]'
    device     = 'SB7x0/SB8x0/SB9x0 USB EHCI Controller'
    class      = serial bus
    subclass   = USB
    bar   [10] = type Memory, range 32, base 0xfe707000, size 256, enabled
    cap 01[c0] = powerspec 2  supports D0 D1 D2 D3  current D0
    cap 0a[e4] = EHCI Debug Port at offset 0xe0 in map 0x14

intsmb0@pci0:0:20:0:	class=0x0c0500 rev=0x42 hdr=0x00 vendor=0x1002 device=0x4385 subvendor=0x1462 subdevice=0x7992
    vendor     = 'Advanced Micro Devices, Inc. [AMD/ATI]'
    device     = 'SBx00 SMBus Controller'
    class      = serial bus
    subclass   = SMBus

hdac1@pci0:0:20:2:	class=0x040300 rev=0x40 hdr=0x00 vendor=0x1002 device=0x4383 subvendor=0x1462 subdevice=0xd992
    vendor     = 'Advanced Micro Devices, Inc. [AMD/ATI]'
    device     = 'SBx00 Azalia (Intel HDA)'
    class      = multimedia
    subclass   = HDA
    bar   [10] = type Memory, range 64, base 0xfe700000, size 16384, enabled
    cap 01[50] = powerspec 2  supports D0 D3  current D0

isab0@pci0:0:20:3:	class=0x060100 rev=0x40 hdr=0x00 vendor=0x1002 device=0x439d subvendor=0x1462 subdevice=0x7992
    vendor     = 'Advanced Micro Devices, Inc. [AMD/ATI]'
    device     = 'SB7x0/SB8x0/SB9x0 LPC host controller'
    class      = bridge
    subclass   = PCI-ISA

pcib9@pci0:0:20:4:	class=0x060401 rev=0x40 hdr=0x01 vendor=0x1002 device=0x4384 subvendor=0x0000 subdevice=0x0000
    vendor     = 'Advanced Micro Devices, Inc. [AMD/ATI]'
    device     = 'SBx00 PCI to PCI Bridge'
    class      = bridge
    subclass   = PCI-PCI

ohci2@pci0:0:20:5:	class=0x0c0310 rev=0x00 hdr=0x00 vendor=0x1002 device=0x4399 subvendor=0x1462 subdevice=0x7992
    vendor     = 'Advanced Micro Devices, Inc. [AMD/ATI]'
    device     = 'SB7x0/SB8x0/SB9x0 USB OHCI2 Controller'
    class      = serial bus
    subclass   = USB
    bar   [10] = type Memory, range 32, base 0xfe706000, size 4096, enabled

pcib10@pci0:0:21:0:	class=0x060400 rev=0x00 hdr=0x01 vendor=0x1002 device=0x43a0 subvendor=0x1002 subdevice=0x0000
    vendor     = 'Advanced Micro Devices, Inc. [AMD/ATI]'
    device     = 'SB700/SB800/SB900 PCI to PCI bridge (PCIE port 0)'
    class      = bridge
    subclass   = PCI-PCI
    cap 01[50] = powerspec 3  supports D0 D1 D2 D3  current D0
    cap 10[58] = PCI-Express 2 root port max data 128(128) NS
                 max read 128
                 link x2(x2) speed 5.0(5.0) ASPM disabled(L0s/L1)
    cap 05[a0] = MSI supports 1 message, 64 bit 
    cap 0d[b0] = PCI Bridge subvendor=0x1002 subdevice=0x0000
    cap 08[b8] = HT MSI fixed address window enabled at 0xfee00000
    ecap 000b[100] = Vendor [1] ID 0001 Rev 1 Length 16

pcib11@pci0:0:21:1:	class=0x060400 rev=0x00 hdr=0x01 vendor=0x1002 device=0x43a1 subvendor=0x1002 subdevice=0x0000
    vendor     = 'Advanced Micro Devices, Inc. [AMD/ATI]'
    device     = 'SB700/SB800/SB900 PCI to PCI bridge (PCIE port 1)'
    class      = bridge
    subclass   = PCI-PCI
    cap 01[50] = powerspec 3  supports D0 D1 D2 D3  current D0
    cap 10[58] = PCI-Express 2 root port max data 128(128) NS
                 max read 128
                 link x1(x1) speed 2.5(5.0) ASPM disabled(L0s/L1)
    cap 05[a0] = MSI supports 1 message, 64 bit 
    cap 0d[b0] = PCI Bridge subvendor=0x1002 subdevice=0x0000
    cap 08[b8] = HT MSI fixed address window enabled at 0xfee00000
    ecap 000b[100] = Vendor [1] ID 0001 Rev 1 Length 16

pcib12@pci0:0:21:2:	class=0x060400 rev=0x00 hdr=0x01 vendor=0x1002 device=0x43a2 subvendor=0x1002 subdevice=0x0000
    vendor     = 'Advanced Micro Devices, Inc. [AMD/ATI]'
    device     = 'SB900 PCI to PCI bridge (PCIE port 2)'
    class      = bridge
    subclass   = PCI-PCI
    cap 01[50] = powerspec 3  supports D0 D1 D2 D3  current D0
    cap 10[58] = PCI-Express 2 root port max data 128(128) NS
                 max read 128
                 link x1(x1) speed 5.0(5.0) ASPM disabled(L0s/L1)
    cap 05[a0] = MSI supports 1 message, 64 bit 
    cap 0d[b0] = PCI Bridge subvendor=0x1002 subdevice=0x0000
    cap 08[b8] = HT MSI fixed address window enabled at 0xfee00000
    ecap 000b[100] = Vendor [1] ID 0001 Rev 1 Length 16

ohci3@pci0:0:22:0:	class=0x0c0310 rev=0x00 hdr=0x00 vendor=0x1002 device=0x4397 subvendor=0x1462 subdevice=0x7992
    vendor     = 'Advanced Micro Devices, Inc. [AMD/ATI]'
    device     = 'SB7x0/SB8x0/SB9x0 USB OHCI0 Controller'
    class      = serial bus
    subclass   = USB
    bar   [10] = type Memory, range 32, base 0xfe705000, size 4096, enabled

ehci2@pci0:0:22:2:	class=0x0c0320 rev=0x00 hdr=0x00 vendor=0x1002 device=0x4396 subvendor=0x1462 subdevice=0x7992
    vendor     = 'Advanced Micro Devices, Inc. [AMD/ATI]'
    device     = 'SB7x0/SB8x0/SB9x0 USB EHCI Controller'
    class      = serial bus
    subclass   = USB
    bar   [10] = type Memory, range 32, base 0xfe704000, size 256, enabled
    cap 01[c0] = powerspec 2  supports D0 D1 D2 D3  current D0
    cap 0a[e4] = EHCI Debug Port at offset 0xe0 in map 0x14

hostb1@pci0:0:24:0:	class=0x060000 rev=0x00 hdr=0x00 vendor=0x1022 device=0x1600 subvendor=0x0000 subdevice=0x0000
    vendor     = 'Advanced Micro Devices, Inc. [AMD]'
    device     = 'Family 15h Processor Function 0'
    class      = bridge
    subclass   = HOST-PCI
    cap 08[80] = HT host

hostb2@pci0:0:24:1:	class=0x060000 rev=0x00 hdr=0x00 vendor=0x1022 device=0x1601 subvendor=0x0000 subdevice=0x0000
    vendor     = 'Advanced Micro Devices, Inc. [AMD]'
    device     = 'Family 15h Processor Function 1'
    class      = bridge
    subclass   = HOST-PCI

hostb3@pci0:0:24:2:	class=0x060000 rev=0x00 hdr=0x00 vendor=0x1022 device=0x1602 subvendor=0x0000 subdevice=0x0000
    vendor     = 'Advanced Micro Devices, Inc. [AMD]'
    device     = 'Family 15h Processor Function 2'
    class      = bridge
    subclass   = HOST-PCI

hostb4@pci0:0:24:3:	class=0x060000 rev=0x00 hdr=0x00 vendor=0x1022 device=0x1603 subvendor=0x0000 subdevice=0x0000
    vendor     = 'Advanced Micro Devices, Inc. [AMD]'
    device     = 'Family 15h Processor Function 3'
    class      = bridge
    subclass   = HOST-PCI
    cap 0f[f0] = unknown

hostb5@pci0:0:24:4:	class=0x060000 rev=0x00 hdr=0x00 vendor=0x1022 device=0x1604 subvendor=0x0000 subdevice=0x0000
    vendor     = 'Advanced Micro Devices, Inc. [AMD]'
    device     = 'Family 15h Processor Function 4'
    class      = bridge
    subclass   = HOST-PCI

hostb6@pci0:0:24:5:	class=0x060000 rev=0x00 hdr=0x00 vendor=0x1022 device=0x1605 subvendor=0x0000 subdevice=0x0000
    vendor     = 'Advanced Micro Devices, Inc. [AMD]'
    device     = 'Family 15h Processor Function 5'
    class      = bridge
    subclass   = HOST-PCI

pcib2@pci0:1:0:0:	class=0x060400 rev=0x01 hdr=0x01 vendor=0x1b21 device=0x1806 subvendor=0x0000 subdevice=0x0000
    vendor     = 'ASMedia Technology Inc.'
    class      = bridge
    subclass   = PCI-PCI
    cap 01[40] = powerspec 3  supports D0 D3  current D0
    cap 05[50] = MSI supports 1 message, 64 bit 
    cap 10[80] = PCI-Express 2 upstream port max data 128(512) NS ARI disabled
                 max read 128
                 link x2(x8) speed 5.0(5.0) ASPM disabled(L0s/L1) ClockPM disabled
    cap 0d[c0] = PCI Bridge subvendor=0x0000 subdevice=0x0000
    ecap 0001[100] = AER 1 0 fatal 1 non-fatal 1 corrected
    ecap 0004[140] = Power Budgeting 1
    ecap 0018[160] = LTR 1
    ecap 0012[180] = Multicast 1
    ecap 0019[1c0] = PCIe Sec 1 lane errors 0
    ecap 001e[200] = L1 PM Substates 1

pcib3@pci0:2:0:0:	class=0x060400 rev=0x01 hdr=0x01 vendor=0x1b21 device=0x1806 subvendor=0x0000 subdevice=0x0000
    vendor     = 'ASMedia Technology Inc.'
    class      = bridge
    subclass   = PCI-PCI
    cap 01[40] = powerspec 3  supports D0 D3  current D0
    cap 05[50] = MSI supports 1 message, 64 bit 
    cap 10[80] = PCI-Express 2 downstream port max data 128(512) NS ARI disabled
                 max read 128
                 link x1(x1) speed 5.0(5.0) ASPM disabled(L0s/L1) ClockPM disabled
                 slot 1 power limit 0 mW
    cap 0d[c0] = PCI Bridge subvendor=0x0000 subdevice=0x0000
    ecap 0001[100] = AER 1 0 fatal 0 non-fatal 0 corrected
    ecap 0004[140] = Power Budgeting 1
    ecap 000d[150] = ACS 1
    ecap 0012[180] = Multicast 1
    ecap 0019[1c0] = PCIe Sec 1 lane errors 0
    ecap 001e[200] = L1 PM Substates 1

pcib4@pci0:2:2:0:	class=0x060400 rev=0x01 hdr=0x01 vendor=0x1b21 device=0x1806 subvendor=0x0000 subdevice=0x0000
    vendor     = 'ASMedia Technology Inc.'
    class      = bridge
    subclass   = PCI-PCI
    cap 01[40] = powerspec 3  supports D0 D3  current D0
    cap 05[50] = MSI supports 1 message, 64 bit 
    cap 10[80] = PCI-Express 2 downstream port max data 128(512) NS ARI disabled
                 max read 128
                 link x1(x1) speed 5.0(5.0) ASPM disabled(L0s/L1) ClockPM disabled
                 slot 3 power limit 0 mW
    cap 0d[c0] = PCI Bridge subvendor=0x0000 subdevice=0x0000
    ecap 0001[100] = AER 1 0 fatal 0 non-fatal 0 corrected
    ecap 0004[140] = Power Budgeting 1
    ecap 000d[150] = ACS 1
    ecap 0012[180] = Multicast 1
    ecap 0019[1c0] = PCIe Sec 1 lane errors 0
    ecap 001e[200] = L1 PM Substates 1

pcib5@pci0:2:6:0:	class=0x060400 rev=0x01 hdr=0x01 vendor=0x1b21 device=0x1806 subvendor=0x0000 subdevice=0x0000
    vendor     = 'ASMedia Technology Inc.'
    class      = bridge
    subclass   = PCI-PCI
    cap 01[40] = powerspec 3  supports D0 D3  current D0
    cap 05[50] = MSI supports 1 message, 64 bit 
    cap 10[80] = PCI-Express 2 downstream port max data 128(512) RO NS ARI disabled
                 max read 128
                 link x1(x1) speed 2.5(5.0) ASPM disabled(L0s/L1) ClockPM disabled
                 slot 7 power limit 0 mW
    cap 0d[c0] = PCI Bridge subvendor=0x0000 subdevice=0x0000
    ecap 0001[100] = AER 1 0 fatal 1 non-fatal 1 corrected
    ecap 0004[140] = Power Budgeting 1
    ecap 000d[150] = ACS 1
    ecap 0012[180] = Multicast 1
    ecap 0019[1c0] = PCIe Sec 1 lane errors 0
    ecap 001e[200] = L1 PM Substates 1

pcib6@pci0:2:14:0:	class=0x060400 rev=0x01 hdr=0x01 vendor=0x1b21 device=0x1806 subvendor=0x0000 subdevice=0x0000
    vendor     = 'ASMedia Technology Inc.'
    class      = bridge
    subclass   = PCI-PCI
    cap 01[40] = powerspec 3  supports D0 D3  current D0
    cap 05[50] = MSI supports 1 message, 64 bit 
    cap 10[80] = PCI-Express 2 downstream port max data 128(512) RO NS ARI disabled
                 max read 128
                 link x1(x1) speed 2.5(5.0) ASPM disabled(L0s/L1) ClockPM disabled
                 slot 15 power limit 0 mW
    cap 0d[c0] = PCI Bridge subvendor=0x0000 subdevice=0x0000
    ecap 0001[100] = AER 1 0 fatal 1 non-fatal 1 corrected
    ecap 0004[140] = Power Budgeting 1
    ecap 000d[150] = ACS 1
    ecap 0012[180] = Multicast 1
    ecap 0019[1c0] = PCIe Sec 1 lane errors 0
    ecap 001e[200] = L1 PM Substates 1

re0@pci0:3:0:0:	class=0x020000 rev=0x04 hdr=0x00 vendor=0x10ec device=0x8125 subvendor=0x1b21 subdevice=0x5354
    vendor     = 'Realtek Semiconductor Co., Ltd.'
    device     = 'RTL8125 2.5GbE Controller'
    class      = network
    subclass   = ethernet
    bar   [10] = type I/O Port, range 32, base 0xc000, size 256, enabled
    bar   [18] = type Memory, range 64, base 0xfe210000, size 65536, enabled
    bar   [20] = type Memory, range 64, base 0xfe220000, size 16384, enabled
    cap 01[40] = powerspec 3  supports D0 D1 D2 D3  current D0
    cap 05[50] = MSI supports 1 message, 64 bit, vector masks 
    cap 10[70] = PCI-Express 2 endpoint MSI 1 max data 128(256)
                 max read 4096
                 link x1(x1) speed 5.0(5.0) ASPM disabled(L0s/L1) ClockPM disabled
    cap 11[b0] = MSI-X supports 32 messages, enabled
                 Table in map 0x20[0x0], PBA in map 0x20[0x800]
    cap 03[d0] = VPD
    ecap 0001[100] = AER 2 0 fatal 0 non-fatal 1 corrected
    ecap 0002[148] = VC 1 max VC0
    ecap 0003[168] = Serial 1 01000000684ce000
    ecap 0017[178] = TPH Requester 1
    ecap 0018[204] = LTR 1
    ecap 001e[20c] = L1 PM Substates 1
    ecap 000b[21c] = Vendor [1] ID 0002 Rev 4 Length 256

re1@pci0:4:0:0:	class=0x020000 rev=0x04 hdr=0x00 vendor=0x10ec device=0x8125 subvendor=0x1b21 subdevice=0x5354
    vendor     = 'Realtek Semiconductor Co., Ltd.'
    device     = 'RTL8125 2.5GbE Controller'
    class      = network
    subclass   = ethernet
    bar   [10] = type I/O Port, range 32, base 0xb000, size 256, enabled
    bar   [18] = type Memory, range 64, base 0xfe110000, size 65536, enabled
    bar   [20] = type Memory, range 64, base 0xfe120000, size 16384, enabled
    cap 01[40] = powerspec 3  supports D0 D1 D2 D3  current D0
    cap 05[50] = MSI supports 1 message, 64 bit, vector masks 
    cap 10[70] = PCI-Express 2 endpoint MSI 1 max data 128(256)
                 max read 4096
                 link x1(x1) speed 5.0(5.0) ASPM disabled(L0s/L1) ClockPM disabled
    cap 11[b0] = MSI-X supports 32 messages, enabled
                 Table in map 0x20[0x0], PBA in map 0x20[0x800]
    cap 03[d0] = VPD
    ecap 0001[100] = AER 2 0 fatal 0 non-fatal 1 corrected
    ecap 0002[148] = VC 1 max VC0
    ecap 0003[168] = Serial 1 01000000684ce000
    ecap 0017[178] = TPH Requester 1
    ecap 0018[204] = LTR 1
    ecap 001e[20c] = L1 PM Substates 1
    ecap 000b[21c] = Vendor [1] ID 0002 Rev 4 Length 256

vgapci0@pci0:7:0:0:	class=0x030000 rev=0xa1 hdr=0x00 vendor=0x10de device=0x0f02 subvendor=0x1462 subdevice=0x8a9f
    vendor     = 'NVIDIA Corporation'
    device     = 'GF108 [GeForce GT 730]'
    class      = display
    subclass   = VGA
    bar   [10] = type Memory, range 32, base 0xfd000000, size 16777216, enabled
    bar   [14] = type Prefetchable Memory, range 64, base 0xf0000000, size 134217728, enabled
    bar   [1c] = type Prefetchable Memory, range 64, base 0xf8000000, size 33554432, enabled
    bar   [24] = type I/O Port, range 32, base 0xe000, size 128, enabled
    cap 01[60] = powerspec 3  supports D0 D3  current D0
    cap 05[68] = MSI supports 1 message, 64 bit 
    cap 10[78] = PCI-Express 1 endpoint max data 128(128) NS
                 max read 512
                 link x8(x16) speed 2.5(2.5) ASPM disabled(L0s/L1) ClockPM disabled
    cap 09[b4] = vendor (length 20)
    ecap 0002[100] = VC 1 max VC0
    ecap 0004[128] = Power Budgeting 1
    ecap 000b[600] = Vendor [1] ID 0001 Rev 1 Length 36

hdac0@pci0:7:0:1:	class=0x040300 rev=0xa1 hdr=0x00 vendor=0x10de device=0x0bea subvendor=0x1462 subdevice=0x8a9f
    vendor     = 'NVIDIA Corporation'
    device     = 'GF108 High Definition Audio Controller'
    class      = multimedia
    subclass   = HDA
    bar   [10] = type Memory, range 32, base 0xfe080000, size 16384, enabled
    cap 01[60] = powerspec 3  supports D0 D3  current D0
    cap 05[68] = MSI supports 1 message, 64 bit 
    cap 10[78] = PCI-Express 1 endpoint max data 128(128) NS
                 max read 512
                 link x8(x16) speed 2.5(2.5) ASPM L0s/L1(L0s/L1) ClockPM disabled

xhci0@pci0:8:0:0:	class=0x0c0330 rev=0x00 hdr=0x00 vendor=0x1b21 device=0x1343 subvendor=0x1462 subdevice=0x7992
    vendor     = 'ASMedia Technology Inc.'
    device     = 'ASM1143 USB 3.1 Host Controller'
    class      = serial bus
    subclass   = USB
    bar   [10] = type Memory, range 64, base 0xfe600000, size 32768, enabled
    cap 05[50] = MSI supports 8 messages, 64 bit 
    cap 11[68] = MSI-X supports 8 messages, enabled
                 Table in map 0x10[0x2000], PBA in map 0x10[0x2080]
    cap 01[78] = powerspec 3  supports D0 D3  current D0
    cap 10[80] = PCI-Express 2 endpoint max data 128(512) NS
                 max read 512
                 link x1(x2) speed 5.0(8.0) ASPM disabled(L1)
    ecap 0002[100] = VC 1 max VC0
    ecap 0001[200] = AER 1 0 fatal 0 non-fatal 0 corrected
    ecap 0019[280] = PCIe Sec 1 lane errors 0
    ecap 0018[300] = LTR 1

xhci1@pci0:10:0:0:	class=0x0c0330 rev=0x00 hdr=0x00 vendor=0x1b21 device=0x1343 subvendor=0x1462 subdevice=0x7992
    vendor     = 'ASMedia Technology Inc.'
    device     = 'ASM1143 USB 3.1 Host Controller'
    class      = serial bus
    subclass   = USB
    bar   [10] = type Memory, range 64, base 0xfe500000, size 32768, enabled
    cap 05[50] = MSI supports 8 messages, 64 bit 
    cap 11[68] = MSI-X supports 8 messages, enabled
                 Table in map 0x10[0x2000], PBA in map 0x10[0x2080]
    cap 01[78] = powerspec 3  supports D0 D3  current D0
    cap 10[80] = PCI-Express 2 endpoint max data 128(512) NS
                 max read 512
                 link x2(x2) speed 5.0(5.0) ASPM disabled(L1)
    ecap 0002[100] = VC 1 max VC0
    ecap 0001[200] = AER 1 0 fatal 0 non-fatal 0 corrected
    ecap 0019[280] = PCIe Sec 1 lane errors 0
    ecap 0018[300] = LTR 1

igb0@pci0:11:0:0:	class=0x020000 rev=0x03 hdr=0x00 vendor=0x8086 device=0x1539 subvendor=0x1462 subdevice=0x7992
    vendor     = 'Intel Corporation'
    device     = 'I211 Gigabit Network Connection'
    class      = network
    subclass   = ethernet
    bar   [10] = type Memory, range 32, base 0xfe400000, size 131072, enabled
    bar   [18] = type I/O Port, range 32, base 0xd000, size 32, enabled
    bar   [1c] = type Memory, range 32, base 0xfe420000, size 16384, enabled
    cap 01[40] = powerspec 3  supports D0 D3  current D0
    cap 05[50] = MSI supports 1 message, 64 bit, vector masks 
    cap 11[70] = MSI-X supports 5 messages, enabled
                 Table in map 0x1c[0x0], PBA in map 0x1c[0x2000]
    cap 10[a0] = PCI-Express 2 endpoint max data 128(512) FLR NS
                 max read 512
                 link x1(x1) speed 2.5(2.5) ASPM disabled(L0s/L1)
    ecap 0001[100] = AER 2 0 fatal 0 non-fatal 1 corrected
    ecap 0003[140] = Serial 1 4ccc6affff6dfefe
    ecap 0017[1a0] = TPH Requester 1

xhci2@pci0:12:0:0:	class=0x0c0330 rev=0x00 hdr=0x00 vendor=0x1b21 device=0x1343 subvendor=0x1462 subdevice=0x7992
    vendor     = 'ASMedia Technology Inc.'
    device     = 'ASM1143 USB 3.1 Host Controller'
    class      = serial bus
    subclass   = USB
    bar   [10] = type Memory, range 64, base 0xfe300000, size 32768, enabled
    cap 05[50] = MSI supports 8 messages, 64 bit 
    cap 11[68] = MSI-X supports 8 messages, enabled
                 Table in map 0x10[0x2000], PBA in map 0x10[0x2080]
    cap 01[78] = powerspec 3  supports D0 D3  current D0
    cap 10[80] = PCI-Express 2 endpoint max data 128(512) NS
                 max read 512
                 link x1(x2) speed 5.0(8.0) ASPM disabled(L1)
    ecap 0002[100] = VC 1 max VC0
    ecap 0001[200] = AER 1 0 fatal 0 non-fatal 0 corrected
    ecap 0019[280] = PCIe Sec 1 lane errors 0
    ecap 0018[300] = LTR 1
