hostb0@pci0:0:0:0:	class=0x060000 rev=0x0b hdr=0x00 vendor=0x8086 device=0x3e34 subvendor=0x1043 subdevice=0x1691
    vendor     = 'Intel Corporation'
    device     = 'Coffee Lake HOST and DRAM Controller'
    class      = bridge
    subclass   = HOST-PCI
    cap 09[e0] = vendor (length 16) Intel cap 0 version 1

vgapci0@pci0:0:2:0:	class=0x030000 rev=0x00 hdr=0x00 vendor=0x8086 device=0x3ea0 subvendor=0x1043 subdevice=0x1691
    vendor     = 'Intel Corporation'
    device     = 'WhiskeyLake-U GT2 [UHD Graphics 620]'
    class      = display
    subclass   = VGA
    bar   [10] = type Memory, range 64, base 0x604a000000, size 16777216, enabled
    bar   [18] = type Prefetchable Memory, range 64, base 0x4000000000, size 268435456, enabled
    bar   [20] = type I/O Port, range 32, base 0x3000, size 64, enabled
    cap 09[40] = vendor (length 12) Intel cap 0 version 1
    cap 10[70] = PCI-Express 2 root endpoint max data 128(128) FLR
                 max read 128
    cap 05[ac] = MSI supports 1 message enabled with 1 message
    cap 01[d0] = powerspec 2  supports D0 D3  current D0
    ecap 001b[100] = Process Address Space ID 1
    ecap 000f[200] = ATS 1
    ecap 0013[300] = Page Page Request 1

none0@pci0:0:4:0:	class=0x118000 rev=0x0b hdr=0x00 vendor=0x8086 device=0x1903 subvendor=0x1043 subdevice=0x1691
    vendor     = 'Intel Corporation'
    device     = 'Xeon E3-1200 v5/E3-1500 v5/6th Gen Core Processor Thermal Subsystem'
    class      = dasp
    bar   [10] = type Memory, range 64, base 0x604b110000, size 32768, enabled
    cap 05[90] = MSI supports 1 message 
    cap 01[d0] = powerspec 3  supports D0 D3  current D0
    cap 09[e0] = vendor (length 12) Intel cap 0 version 1

none1@pci0:0:8:0:	class=0x088000 rev=0x00 hdr=0x00 vendor=0x8086 device=0x1911 subvendor=0x1043 subdevice=0x1691
    vendor     = 'Intel Corporation'
    device     = 'Xeon E3-1200 v5/v6 / E3-1500 v5 / 6th/7th/8th Gen Core Processor Gaussian Mixture Model'
    class      = base peripheral
    bar   [10] = type Memory, range 64, base 0x604b12c000, size 4096, enabled
    cap 05[90] = MSI supports 1 message 
    cap 01[dc] = powerspec 2  supports D0 D3  current D0
    cap 13[f0] = PCI Advanced Features: FLR TP

pchtherm0@pci0:0:18:0:	class=0x118000 rev=0x30 hdr=0x00 vendor=0x8086 device=0x9df9 subvendor=0x1043 subdevice=0x1691
    vendor     = 'Intel Corporation'
    device     = 'Cannon Point-LP Thermal Controller'
    class      = dasp
    bar   [10] = type Memory, range 64, base 0x604b12b000, size 4096, enabled
    cap 01[50] = powerspec 3  supports D0 D3  current D0
    cap 05[80] = MSI supports 1 message 

xhci0@pci0:0:20:0:	class=0x0c0330 rev=0x30 hdr=0x00 vendor=0x8086 device=0x9ded subvendor=0x1043 subdevice=0x201f
    vendor     = 'Intel Corporation'
    device     = 'Cannon Point-LP USB 3.1 xHCI Controller'
    class      = serial bus
    subclass   = USB
    bar   [10] = type Memory, range 64, base 0x604b100000, size 65536, enabled
    cap 01[70] = powerspec 2  supports D0 D3  current D0
    cap 05[80] = MSI supports 8 messages, 64 bit enabled with 1 message
    cap 09[90] = vendor (length 20) Intel cap 15 version 0

none2@pci0:0:20:2:	class=0x050000 rev=0x30 hdr=0x00 vendor=0x8086 device=0x9def subvendor=0x8086 subdevice=0x7270
    vendor     = 'Intel Corporation'
    device     = 'Cannon Point-LP Shared SRAM'
    class      = memory
    subclass   = RAM
    bar   [10] = type Memory, range 64, base 0x604b120000, size 8192, enabled
    bar   [18] = type Memory, range 64, base 0x604b12a000, size 4096, enabled
    cap 01[80] = powerspec 3  supports D0 D3  current D0

iwm0@pci0:0:20:3:	class=0x028000 rev=0x30 hdr=0x00 vendor=0x8086 device=0x9df0 subvendor=0x8086 subdevice=0x0034
    vendor     = 'Intel Corporation'
    device     = 'Cannon Point-LP CNVi [Wireless-AC]'
    class      = network
    bar   [10] = type Memory, range 64, base 0x604b11c000, size 16384, enabled
    cap 01[c8] = powerspec 3  supports D0 D3  current D0
    cap 05[d0] = MSI supports 1 message, 64 bit enabled with 1 message
    cap 10[40] = PCI-Express 2 root endpoint max data 128(128) FLR RO NS
                 max read 128
    cap 11[80] = MSI-X supports 16 messages
                 Table in map 0x10[0x2000], PBA in map 0x10[0x3000]
    ecap 0000[100] = unknown 0
    ecap 0018[14c] = LTR 1
    ecap 000b[164] = Vendor [1] ID 0010 Rev 0 Length 20

ig4iic0@pci0:0:21:0:	class=0x0c8000 rev=0x30 hdr=0x00 vendor=0x8086 device=0x9de8 subvendor=0x1043 subdevice=0x1691
    vendor     = 'Intel Corporation'
    device     = 'Cannon Point-LP Serial IO I2C Controller'
    class      = serial bus
    bar   [10] = type Memory, range 64, base 0xae100000, size 4096, enabled
    cap 01[80] = powerspec 3  supports D0 D3  current D0
    cap 09[90] = vendor (length 20) Intel cap 15 version 0

ig4iic1@pci0:0:21:1:	class=0x0c8000 rev=0x30 hdr=0x00 vendor=0x8086 device=0x9de9 subvendor=0x1043 subdevice=0x1691
    vendor     = 'Intel Corporation'
    device     = 'Cannon Point-LP Serial IO I2C Controller'
    class      = serial bus
    bar   [10] = type Memory, range 64, base 0xae101000, size 4096, enabled
    cap 01[80] = powerspec 3  supports D0 D3  current D0
    cap 09[90] = vendor (length 20) Intel cap 15 version 0

none3@pci0:0:22:0:	class=0x078000 rev=0x30 hdr=0x00 vendor=0x8086 device=0x9de0 subvendor=0x1043 subdevice=0x1691
    vendor     = 'Intel Corporation'
    device     = 'Cannon Point-LP MEI Controller'
    class      = simple comms
    bar   [10] = type Memory, range 64, base 0x604b127000, size 4096, enabled
    cap 01[50] = powerspec 3  supports D0 D3  current D0
    cap 05[8c] = MSI supports 1 message, 64 bit 
    cap 09[a4] = vendor (length 20) Intel cap 15 version 0

ig4iic2@pci0:0:25:0:	class=0x0c8000 rev=0x30 hdr=0x00 vendor=0x8086 device=0x9dc5 subvendor=0x1043 subdevice=0x1691
    vendor     = 'Intel Corporation'
    device     = 'Cannon Point-LP Serial IO I2C Host Controller'
    class      = serial bus
    bar   [10] = type Memory, range 64, base 0xae102000, size 4096, enabled
    cap 01[80] = powerspec 3  supports D0 D3  current D0
    cap 09[90] = vendor (length 20) Intel cap 15 version 0

pcib1@pci0:0:28:0:	class=0x060400 rev=0xf0 hdr=0x01 vendor=0x8086 device=0x9dbc subvendor=0x1043 subdevice=0x1691
    vendor     = 'Intel Corporation'
    device     = 'Cannon Point-LP PCI Express Root Port'
    class      = bridge
    subclass   = PCI-PCI
    cap 10[40] = PCI-Express 2 root port max data 128(128) ARI disabled
                 max read 128
                 link x0(x4) speed 0.0(8.0) ASPM L1(L1)
                 slot 8 power limit 250 mW HotPlug(empty) surprise
    cap 05[80] = MSI supports 1 message enabled with 1 message
    cap 0d[90] = PCI Bridge subvendor=0x1043 subdevice=0x1691
    cap 01[a0] = powerspec 3  supports D0 D3  current D0
    ecap 0001[100] = AER 1 0 fatal 0 non-fatal 0 corrected
    ecap 000d[140] = ACS 1
    ecap 001f[150] = Precision Time Measurement 1
    ecap 0019[220] = PCIe Sec 1 lane errors 0
    ecap 001d[250] = Downstream Port Containment 1

pcib2@pci0:0:29:0:	class=0x060400 rev=0xf0 hdr=0x01 vendor=0x8086 device=0x9db4 subvendor=0x1043 subdevice=0x1691
    vendor     = 'Intel Corporation'
    device     = 'Cannon Point-LP PCI Express Root Port'
    class      = bridge
    subclass   = PCI-PCI
    cap 10[40] = PCI-Express 2 root port max data 128(128) ARI disabled
                 max read 128
                 link x4(x4) speed 8.0(8.0) ASPM L1(L0s/L1)
                 slot 16 power limit 250 mW
    cap 05[80] = MSI supports 1 message 
    cap 0d[90] = PCI Bridge subvendor=0x1043 subdevice=0x1691
    cap 01[a0] = powerspec 3  supports D0 D3  current D0
    ecap 0001[100] = AER 1 0 fatal 0 non-fatal 0 corrected
    ecap 000d[140] = ACS 1
    ecap 001f[150] = Precision Time Measurement 1
    ecap 001e[200] = L1 PM Substates 1
    ecap 0019[220] = PCIe Sec 1 lane errors 0
    ecap 001d[250] = Downstream Port Containment 1

none4@pci0:0:30:0:	class=0x078000 rev=0x30 hdr=0x00 vendor=0x8086 device=0x9da8 subvendor=0x1043 subdevice=0x1691
    vendor     = 'Intel Corporation'
    device     = 'Cannon Point-LP Serial IO UART Controller'
    class      = simple comms
    bar   [10] = type Memory, range 64, base 0x604b125000, size 4096, enabled
    bar   [18] = type Memory, range 64, base 0x604b124000, size 4096, enabled
    cap 01[80] = powerspec 3  supports D0 D3  current D0
    cap 09[90] = vendor (length 20) Intel cap 15 version 0

none5@pci0:0:30:2:	class=0x0c8000 rev=0x30 hdr=0x00 vendor=0x8086 device=0x9daa subvendor=0x1043 subdevice=0x1691
    vendor     = 'Intel Corporation'
    device     = 'Cannon Point-LP Serial IO SPI Controller'
    class      = serial bus
    bar   [10] = type Memory, range 64, base 0, size 4096, disabled
    cap 01[80] = powerspec 3  supports D0 D3  current D0
    cap 09[90] = vendor (length 20) Intel cap 15 version 0

isab0@pci0:0:31:0:	class=0x060100 rev=0x30 hdr=0x00 vendor=0x8086 device=0x9d84 subvendor=0x1043 subdevice=0x1691
    vendor     = 'Intel Corporation'
    device     = 'Cannon Point-LP LPC Controller'
    class      = bridge
    subclass   = PCI-ISA

hdac0@pci0:0:31:3:	class=0x040380 rev=0x30 hdr=0x00 vendor=0x8086 device=0x9dc8 subvendor=0x1043 subdevice=0x10a1
    vendor     = 'Intel Corporation'
    device     = 'Cannon Point-LP High Definition Audio Controller'
    class      = multimedia
    subclass   = HDA
    bar   [10] = type Memory, range 64, base 0x604b118000, size 16384, enabled
    bar   [20] = type Memory, range 64, base 0x604b000000, size 1048576, enabled
    cap 01[50] = powerspec 3  supports D0 D3  current D0
    cap 09[80] = vendor (length 20) Intel cap 15 version 0
    cap 05[60] = MSI supports 1 message, 64 bit enabled with 1 message

none6@pci0:0:31:4:	class=0x0c0500 rev=0x30 hdr=0x00 vendor=0x8086 device=0x9da3 subvendor=0x1043 subdevice=0x1691
    vendor     = 'Intel Corporation'
    device     = 'Cannon Point-LP SMBus Controller'
    class      = serial bus
    subclass   = SMBus
    bar   [10] = type Memory, range 64, base 0x604b122000, size 256, enabled
    bar   [20] = type I/O Port, range 32, base 0xefa0, size 32, enabled

none7@pci0:0:31:5:	class=0x0c8000 rev=0x30 hdr=0x00 vendor=0x8086 device=0x9da4 subvendor=0x8086 subdevice=0x7270
    vendor     = 'Intel Corporation'
    device     = 'Cannon Point-LP SPI Controller'
    class      = serial bus
    bar   [10] = type Memory, range 32, base 0xfe010000, size 4096, enabled

nvme0@pci0:108:0:0:	class=0x010802 rev=0x00 hdr=0x00 vendor=0x144d device=0xa808 subvendor=0x144d subdevice=0xa801
    vendor     = 'Samsung Electronics Co Ltd'
    device     = 'NVMe SSD Controller SM981/PM981/PM983'
    class      = mass storage
    subclass   = NVM
    bar   [10] = type Memory, range 64, base 0xae200000, size 16384, enabled
    cap 01[40] = powerspec 3  supports D0 D3  current D0
    cap 05[50] = MSI supports 32 messages, 64 bit 
    cap 10[70] = PCI-Express 2 endpoint max data 128(256) FLR RO NS
                 max read 512
                 link x4(x4) speed 8.0(8.0) ASPM L1(L1) ClockPM enabled
    cap 11[b0] = MSI-X supports 33 messages, enabled
                 Table in map 0x10[0x3000], PBA in map 0x10[0x2000]
    ecap 0001[100] = AER 2 0 fatal 0 non-fatal 0 corrected
    ecap 0003[148] = Serial 1 0000000000000000
    ecap 0004[158] = Power Budgeting 1
    ecap 0019[168] = PCIe Sec 1 lane errors 0
    ecap 0018[188] = LTR 1
    ecap 001e[190] = L1 PM Substates 1
