hostb0@pci0:0:0:0:	class=0x060000 rev=0x11 hdr=0x00 vendor=0x8086 device=0xd130 subvendor=0x15d9 subdevice=0x0605
    vendor     = 'Intel Corporation'
    device     = 'Core Processor DMI'
    class      = bridge
    subclass   = HOST-PCI
    cap 00[40] = unknown

pcib1@pci0:0:3:0:	class=0x060400 rev=0x11 hdr=0x01 vendor=0x8086 device=0xd138 subvendor=0x15d9 subdevice=0x0605
    vendor     = 'Intel Corporation'
    device     = 'Core Processor PCI Express Root Port 1'
    class      = bridge
    subclass   = PCI-PCI
    cap 0d[40] = PCI Bridge subvendor=0x15d9 subdevice=0x0605
    cap 05[60] = MSI supports 2 messages, vector masks 
    cap 10[90] = PCI-Express 2 root port max data 256(256) ARI disabled
                 max read 128
                 link x4(x8) speed 2.5(5.0) ASPM disabled(L0s/L1)
                 slot 3 power limit 25000 mW
    cap 01[e0] = powerspec 3  supports D0 D3  current D0
    ecap 0001[100] = AER 1 0 fatal 0 non-fatal 0 corrected
    ecap 000d[150] = ACS 1
    ecap 000b[160] = Vendor [0] ID 0002 Rev 0 Length 12

pcib5@pci0:0:5:0:	class=0x060400 rev=0x11 hdr=0x01 vendor=0x8086 device=0xd13a subvendor=0x15d9 subdevice=0x0605
    vendor     = 'Intel Corporation'
    device     = 'Core Processor PCI Express Root Port 3'
    class      = bridge
    subclass   = PCI-PCI
    cap 0d[40] = PCI Bridge subvendor=0x15d9 subdevice=0x0605
    cap 05[60] = MSI supports 2 messages, vector masks 
    cap 10[90] = PCI-Express 2 root port max data 256(256) ARI disabled
                 max read 128
                 link x4(x8) speed 2.5(5.0) ASPM disabled(L0s/L1)
                 slot 4 power limit 25000 mW
    cap 01[e0] = powerspec 3  supports D0 D3  current D0
    ecap 0001[100] = AER 1 0 fatal 0 non-fatal 0 corrected
    ecap 000d[150] = ACS 1
    ecap 0000[160] = unknown 0

none0@pci0:0:8:0:	class=0x088000 rev=0x11 hdr=0x00 vendor=0x8086 device=0xd155 subvendor=0x00d9 subdevice=0x0005
    vendor     = 'Intel Corporation'
    device     = 'Core Processor System Management Registers'
    class      = base peripheral
    cap 10[40] = PCI-Express 2 root endpoint max data 128(128)
                 max read 128
                 link x0(x0) ASPM disabled(L0s)
    ecap 000b[100] = Vendor [0] ID 0000 Rev 0 Length 3840

none1@pci0:0:8:1:	class=0x088000 rev=0x11 hdr=0x00 vendor=0x8086 device=0xd156 subvendor=0x00d9 subdevice=0x0005
    vendor     = 'Intel Corporation'
    device     = 'Core Processor Semaphore and Scratchpad Registers'
    class      = base peripheral
    cap 10[40] = PCI-Express 2 root endpoint max data 128(128)
                 max read 128
                 link x0(x0) ASPM disabled(L0s)
    ecap 000b[100] = Vendor [0] ID 0000 Rev 0 Length 3840

none2@pci0:0:8:2:	class=0x088000 rev=0x11 hdr=0x00 vendor=0x8086 device=0xd157 subvendor=0x00d9 subdevice=0x0005
    vendor     = 'Intel Corporation'
    device     = 'Core Processor System Control and Status Registers'
    class      = base peripheral
    cap 10[40] = PCI-Express 2 root endpoint max data 128(128)
                 max read 128
                 link x0(x0) ASPM disabled(L0s)
    ecap 000b[100] = Vendor [0] ID 0000 Rev 0 Length 3840

none3@pci0:0:8:3:	class=0x088000 rev=0x11 hdr=0x00 vendor=0x8086 device=0xd158 subvendor=0x00d9 subdevice=0x0005
    vendor     = 'Intel Corporation'
    device     = 'Core Processor Miscellaneous Registers'
    class      = base peripheral

none4@pci0:0:16:0:	class=0x088000 rev=0x11 hdr=0x00 vendor=0x8086 device=0xd150 subvendor=0x00d9 subdevice=0x0005
    vendor     = 'Intel Corporation'
    device     = 'Core Processor QPI Link'
    class      = base peripheral

none5@pci0:0:16:1:	class=0x088000 rev=0x11 hdr=0x00 vendor=0x8086 device=0xd151 subvendor=0x00d9 subdevice=0x0005
    vendor     = 'Intel Corporation'
    device     = 'Core Processor QPI Routing and Protocol Registers'
    class      = base peripheral

pcib9@pci0:0:28:0:	class=0x060400 rev=0x05 hdr=0x01 vendor=0x8086 device=0x3b42 subvendor=0x15d9 subdevice=0x0605
    vendor     = 'Intel Corporation'
    device     = '5 Series/3400 Series Chipset PCI Express Root Port 1'
    class      = bridge
    subclass   = PCI-PCI
    cap 10[40] = PCI-Express 2 root port max data 128(128)
                 max read 128
                 link x1(x4) speed 2.5(2.5) ASPM disabled(L0s/L1)
                 slot 2 power limit 10000 mW HotPlug(present) surprise
    cap 05[80] = MSI supports 1 message 
    cap 0d[90] = PCI Bridge subvendor=0x15d9 subdevice=0x0605
    cap 01[a0] = powerspec 2  supports D0 D3  current D0

pcib10@pci0:0:28:4:	class=0x060400 rev=0x05 hdr=0x01 vendor=0x8086 device=0x3b4a subvendor=0x15d9 subdevice=0x0605
    vendor     = 'Intel Corporation'
    device     = '5 Series/3400 Series Chipset PCI Express Root Port 5'
    class      = bridge
    subclass   = PCI-PCI
    cap 10[40] = PCI-Express 2 root port max data 128(128)
                 max read 128
                 link x1(x1) speed 2.5(2.5) ASPM L0s/L1(L0s/L1)
                 slot 0 power limit 0 mW HotPlug(present) surprise
    cap 05[80] = MSI supports 1 message 
    cap 0d[90] = PCI Bridge subvendor=0x15d9 subdevice=0x0605
    cap 01[a0] = powerspec 2  supports D0 D3  current D0

pcib11@pci0:0:28:5:	class=0x060400 rev=0x05 hdr=0x01 vendor=0x8086 device=0x3b4c subvendor=0x15d9 subdevice=0x0605
    vendor     = 'Intel Corporation'
    device     = '5 Series/3400 Series Chipset PCI Express Root Port 6'
    class      = bridge
    subclass   = PCI-PCI
    cap 10[40] = PCI-Express 2 root port max data 128(128)
                 max read 128
                 link x1(x1) speed 2.5(2.5) ASPM L0s/L1(L0s/L1)
                 slot 0 power limit 0 mW HotPlug(present) surprise
    cap 05[80] = MSI supports 1 message 
    cap 0d[90] = PCI Bridge subvendor=0x15d9 subdevice=0x0605
    cap 01[a0] = powerspec 2  supports D0 D3  current D0

ehci0@pci0:0:29:0:	class=0x0c0320 rev=0x05 hdr=0x00 vendor=0x8086 device=0x3b34 subvendor=0x15d9 subdevice=0x0605
    vendor     = 'Intel Corporation'
    device     = '5 Series/3400 Series Chipset USB2 Enhanced Host Controller'
    class      = serial bus
    subclass   = USB
    bar   [10] = type Memory, range 32, base 0xfaffc000, size 1024, enabled
    cap 01[50] = powerspec 2  supports D0 D3  current D0
    cap 0a[58] = EHCI Debug Port at offset 0xa0 in map 0x14
    cap 13[98] = PCI Advanced Features: FLR TP

pcib12@pci0:0:30:0:	class=0x060401 rev=0xa5 hdr=0x01 vendor=0x8086 device=0x244e subvendor=0x15d9 subdevice=0x0605
    vendor     = 'Intel Corporation'
    device     = '82801 PCI Bridge'
    class      = bridge
    subclass   = PCI-PCI
    cap 0d[50] = PCI Bridge subvendor=0x15d9 subdevice=0x0605

isab0@pci0:0:31:0:	class=0x060100 rev=0x05 hdr=0x00 vendor=0x8086 device=0x3b12 subvendor=0x15d9 subdevice=0x0605
    vendor     = 'Intel Corporation'
    device     = '3400 Series Chipset LPC Interface Controller'
    class      = bridge
    subclass   = PCI-ISA
    cap 09[e0] = vendor (length 16) Intel cap 1 version 1

ahci0@pci0:0:31:2:	class=0x010601 rev=0x05 hdr=0x00 vendor=0x8086 device=0x3b23 subvendor=0x15d9 subdevice=0x0605
    vendor     = 'Intel Corporation'
    device     = '5 Series/3400 Series Chipset 4 port SATA AHCI Controller'
    class      = mass storage
    subclass   = SATA
    bar   [10] = type I/O Port, range 32, base 0x8400, size 8, enabled
    bar   [14] = type I/O Port, range 32, base 0x8c00, size 4, enabled
    bar   [18] = type I/O Port, range 32, base 0x8880, size 8, enabled
    bar   [1c] = type I/O Port, range 32, base 0x8800, size 4, enabled
    bar   [20] = type I/O Port, range 32, base 0x8480, size 32, enabled
    bar   [24] = type Memory, range 32, base 0xfaffa000, size 2048, enabled
    cap 05[80] = MSI supports 1 message enabled with 1 message
    cap 01[70] = powerspec 3  supports D0 D3  current D0
    cap 12[a8] = SATA Index-Data Pair
    cap 13[b0] = PCI Advanced Features: FLR TP

ichsmb0@pci0:0:31:3:	class=0x0c0500 rev=0x05 hdr=0x00 vendor=0x8086 device=0x3b30 subvendor=0x15d9 subdevice=0x0605
    vendor     = 'Intel Corporation'
    device     = '5 Series/3400 Series Chipset SMBus Controller'
    class      = serial bus
    subclass   = SMBus
    bar   [10] = type Memory, range 64, base 0xfaff8000, size 256, enabled
    bar   [20] = type I/O Port, range 32, base 0x400, size 32, enabled

pcib2@pci0:1:0:0:	class=0x060400 rev=0x0e hdr=0x01 vendor=0x111d device=0x8018 subvendor=0x0000 subdevice=0x0000
    vendor     = 'Microsemi / PMC / IDT'
    device     = 'PES12N3A 12-lane 3-Port PCI Express Switch'
    class      = bridge
    subclass   = PCI-PCI
    cap 10[40] = PCI-Express 1 upstream port max data 256(2048)
                 max read 128
                 link x4(x4) speed 2.5(2.5) ASPM disabled(L0s/L1)
    cap 01[c0] = powerspec 3  supports D0 D3  current D0
    ecap 0001[100] = AER 1 0 fatal 0 non-fatal 1 corrected
    ecap 0002[200] = VC 1 max VC0

pcib3@pci0:2:2:0:	class=0x060400 rev=0x0e hdr=0x01 vendor=0x111d device=0x8018 subvendor=0x0000 subdevice=0x0000
    vendor     = 'Microsemi / PMC / IDT'
    device     = 'PES12N3A 12-lane 3-Port PCI Express Switch'
    class      = bridge
    subclass   = PCI-PCI
    cap 10[40] = PCI-Express 1 downstream port max data 256(2048)
                 max read 128
                 link x4(x4) speed 2.5(2.5) ASPM disabled(L0s/L1)
    cap 01[c0] = powerspec 3  supports D0 D3  current D0
    cap 05[d0] = MSI supports 1 message, 64 bit 
    ecap 0001[100] = AER 1 0 fatal 0 non-fatal 1 corrected
    ecap 0002[200] = VC 1 max VC0

pcib4@pci0:2:4:0:	class=0x060400 rev=0x0e hdr=0x01 vendor=0x111d device=0x8018 subvendor=0x0000 subdevice=0x0000
    vendor     = 'Microsemi / PMC / IDT'
    device     = 'PES12N3A 12-lane 3-Port PCI Express Switch'
    class      = bridge
    subclass   = PCI-PCI
    cap 10[40] = PCI-Express 1 downstream port max data 256(2048)
                 max read 128
                 link x4(x4) speed 2.5(2.5) ASPM disabled(L0s/L1)
    cap 01[c0] = powerspec 3  supports D0 D3  current D0
    cap 05[d0] = MSI supports 1 message, 64 bit 
    ecap 0001[100] = AER 1 0 fatal 0 non-fatal 1 corrected
    ecap 0002[200] = VC 1 max VC0

em0@pci0:3:0:0:	class=0x020000 rev=0x06 hdr=0x00 vendor=0x8086 device=0x10bc subvendor=0x8086 subdevice=0x10bc
    vendor     = 'Intel Corporation'
    device     = '82571EB/82571GB Gigabit Ethernet Controller (Copper)'
    class      = network
    subclass   = ethernet
    bar   [10] = type Memory, range 32, base 0xfb0e0000, size 131072, enabled
    bar   [14] = type Memory, range 32, base 0xfb0c0000, size 131072, enabled
    bar   [18] = type I/O Port, range 32, base 0x9c00, size 32, enabled
    cap 01[c8] = powerspec 2  supports D0 D3  current D0
    cap 05[d0] = MSI supports 1 message, 64 bit enabled with 1 message
    cap 10[e0] = PCI-Express 1 endpoint max data 256(256) RO NS
                 max read 512
                 link x4(x4) speed 2.5(2.5) ASPM disabled(L0s)
    ecap 0001[100] = AER 1 0 fatal 1 non-fatal 0 corrected
    ecap 0003[140] = Serial 1 a0369fffff19a608

em1@pci0:3:0:1:	class=0x020000 rev=0x06 hdr=0x00 vendor=0x8086 device=0x10bc subvendor=0x8086 subdevice=0x10bc
    vendor     = 'Intel Corporation'
    device     = '82571EB/82571GB Gigabit Ethernet Controller (Copper)'
    class      = network
    subclass   = ethernet
    bar   [10] = type Memory, range 32, base 0xfb080000, size 131072, enabled
    bar   [14] = type Memory, range 32, base 0xfb060000, size 131072, enabled
    bar   [18] = type I/O Port, range 32, base 0x9880, size 32, enabled
    cap 01[c8] = powerspec 2  supports D0 D3  current D0
    cap 05[d0] = MSI supports 1 message, 64 bit enabled with 1 message
    cap 10[e0] = PCI-Express 1 endpoint max data 256(256) RO NS
                 max read 512
                 link x4(x4) speed 2.5(2.5) ASPM disabled(L0s)
    ecap 0001[100] = AER 1 0 fatal 1 non-fatal 0 corrected
    ecap 0003[140] = Serial 1 a0369fffff19a608

em2@pci0:4:0:0:	class=0x020000 rev=0x06 hdr=0x00 vendor=0x8086 device=0x10bc subvendor=0x8086 subdevice=0x10bc
    vendor     = 'Intel Corporation'
    device     = '82571EB/82571GB Gigabit Ethernet Controller (Copper)'
    class      = network
    subclass   = ethernet
    bar   [10] = type Memory, range 32, base 0xfb1e0000, size 131072, enabled
    bar   [14] = type Memory, range 32, base 0xfb1c0000, size 131072, enabled
    bar   [18] = type I/O Port, range 32, base 0xac00, size 32, enabled
    cap 01[c8] = powerspec 2  supports D0 D3  current D0
    cap 05[d0] = MSI supports 1 message, 64 bit enabled with 1 message
    cap 10[e0] = PCI-Express 1 endpoint max data 256(256) RO NS
                 max read 512
                 link x4(x4) speed 2.5(2.5) ASPM disabled(L0s)
    ecap 0001[100] = AER 1 0 fatal 1 non-fatal 0 corrected
    ecap 0003[140] = Serial 1 a0369fffff19a60a

em3@pci0:4:0:1:	class=0x020000 rev=0x06 hdr=0x00 vendor=0x8086 device=0x10bc subvendor=0x8086 subdevice=0x10bc
    vendor     = 'Intel Corporation'
    device     = '82571EB/82571GB Gigabit Ethernet Controller (Copper)'
    class      = network
    subclass   = ethernet
    bar   [10] = type Memory, range 32, base 0xfb180000, size 131072, enabled
    bar   [14] = type Memory, range 32, base 0xfb160000, size 131072, enabled
    bar   [18] = type I/O Port, range 32, base 0xa880, size 32, enabled
    cap 01[c8] = powerspec 2  supports D0 D3  current D0
    cap 05[d0] = MSI supports 1 message, 64 bit enabled with 1 message
    cap 10[e0] = PCI-Express 1 endpoint max data 256(256) RO NS
                 max read 512
                 link x4(x4) speed 2.5(2.5) ASPM disabled(L0s)
    ecap 0001[100] = AER 1 0 fatal 1 non-fatal 0 corrected
    ecap 0003[140] = Serial 1 a0369fffff19a60a

pcib6@pci0:5:0:0:	class=0x060400 rev=0x0e hdr=0x01 vendor=0x111d device=0x8018 subvendor=0x0000 subdevice=0x0000
    vendor     = 'Microsemi / PMC / IDT'
    device     = 'PES12N3A 12-lane 3-Port PCI Express Switch'
    class      = bridge
    subclass   = PCI-PCI
    cap 10[40] = PCI-Express 1 upstream port max data 256(2048)
                 max read 128
                 link x4(x4) speed 2.5(2.5) ASPM disabled(L0s/L1)
    cap 01[c0] = powerspec 3  supports D0 D3  current D0
    ecap 0001[100] = AER 1 0 fatal 0 non-fatal 1 corrected
    ecap 0002[200] = VC 1 max VC0

pcib7@pci0:6:2:0:	class=0x060400 rev=0x0e hdr=0x01 vendor=0x111d device=0x8018 subvendor=0x0000 subdevice=0x0000
    vendor     = 'Microsemi / PMC / IDT'
    device     = 'PES12N3A 12-lane 3-Port PCI Express Switch'
    class      = bridge
    subclass   = PCI-PCI
    cap 10[40] = PCI-Express 1 downstream port max data 256(2048)
                 max read 128
                 link x4(x4) speed 2.5(2.5) ASPM disabled(L0s/L1)
    cap 01[c0] = powerspec 3  supports D0 D3  current D0
    cap 05[d0] = MSI supports 1 message, 64 bit 
    ecap 0001[100] = AER 1 0 fatal 0 non-fatal 1 corrected
    ecap 0002[200] = VC 1 max VC0

pcib8@pci0:6:4:0:	class=0x060400 rev=0x0e hdr=0x01 vendor=0x111d device=0x8018 subvendor=0x0000 subdevice=0x0000
    vendor     = 'Microsemi / PMC / IDT'
    device     = 'PES12N3A 12-lane 3-Port PCI Express Switch'
    class      = bridge
    subclass   = PCI-PCI
    cap 10[40] = PCI-Express 1 downstream port max data 256(2048)
                 max read 128
                 link x4(x4) speed 2.5(2.5) ASPM disabled(L0s/L1)
    cap 01[c0] = powerspec 3  supports D0 D3  current D0
    cap 05[d0] = MSI supports 1 message, 64 bit 
    ecap 0001[100] = AER 1 0 fatal 0 non-fatal 1 corrected
    ecap 0002[200] = VC 1 max VC0

em4@pci0:7:0:0:	class=0x020000 rev=0x06 hdr=0x00 vendor=0x8086 device=0x10bc subvendor=0x8086 subdevice=0x10bc
    vendor     = 'Intel Corporation'
    device     = '82571EB/82571GB Gigabit Ethernet Controller (Copper)'
    class      = network
    subclass   = ethernet
    bar   [10] = type Memory, range 32, base 0xfb2e0000, size 131072, enabled
    bar   [14] = type Memory, range 32, base 0xfb2c0000, size 131072, enabled
    bar   [18] = type I/O Port, range 32, base 0xbc00, size 32, enabled
    cap 01[c8] = powerspec 2  supports D0 D3  current D0
    cap 05[d0] = MSI supports 1 message, 64 bit enabled with 1 message
    cap 10[e0] = PCI-Express 1 endpoint max data 256(256) RO NS
                 max read 512
                 link x4(x4) speed 2.5(2.5) ASPM disabled(L0s)
    ecap 0001[100] = AER 1 0 fatal 1 non-fatal 0 corrected
    ecap 0003[140] = Serial 1 a0369fffff19a684

em5@pci0:7:0:1:	class=0x020000 rev=0x06 hdr=0x00 vendor=0x8086 device=0x10bc subvendor=0x8086 subdevice=0x10bc
    vendor     = 'Intel Corporation'
    device     = '82571EB/82571GB Gigabit Ethernet Controller (Copper)'
    class      = network
    subclass   = ethernet
    bar   [10] = type Memory, range 32, base 0xfb280000, size 131072, enabled
    bar   [14] = type Memory, range 32, base 0xfb260000, size 131072, enabled
    bar   [18] = type I/O Port, range 32, base 0xb880, size 32, enabled
    cap 01[c8] = powerspec 2  supports D0 D3  current D0
    cap 05[d0] = MSI supports 1 message, 64 bit enabled with 1 message
    cap 10[e0] = PCI-Express 1 endpoint max data 256(256) RO NS
                 max read 512
                 link x4(x4) speed 2.5(2.5) ASPM disabled(L0s)
    ecap 0001[100] = AER 1 0 fatal 1 non-fatal 0 corrected
    ecap 0003[140] = Serial 1 a0369fffff19a684

em6@pci0:8:0:0:	class=0x020000 rev=0x06 hdr=0x00 vendor=0x8086 device=0x10bc subvendor=0x8086 subdevice=0x10bc
    vendor     = 'Intel Corporation'
    device     = '82571EB/82571GB Gigabit Ethernet Controller (Copper)'
    class      = network
    subclass   = ethernet
    bar   [10] = type Memory, range 32, base 0xfb3e0000, size 131072, enabled
    bar   [14] = type Memory, range 32, base 0xfb3c0000, size 131072, enabled
    bar   [18] = type I/O Port, range 32, base 0xcc00, size 32, enabled
    cap 01[c8] = powerspec 2  supports D0 D3  current D0
    cap 05[d0] = MSI supports 1 message, 64 bit enabled with 1 message
    cap 10[e0] = PCI-Express 1 endpoint max data 256(256) RO NS
                 max read 512
                 link x4(x4) speed 2.5(2.5) ASPM disabled(L0s)
    ecap 0001[100] = AER 1 0 fatal 1 non-fatal 0 corrected
    ecap 0003[140] = Serial 1 a0369fffff19a686

em7@pci0:8:0:1:	class=0x020000 rev=0x06 hdr=0x00 vendor=0x8086 device=0x10bc subvendor=0x8086 subdevice=0x10bc
    vendor     = 'Intel Corporation'
    device     = '82571EB/82571GB Gigabit Ethernet Controller (Copper)'
    class      = network
    subclass   = ethernet
    bar   [10] = type Memory, range 32, base 0xfb380000, size 131072, enabled
    bar   [14] = type Memory, range 32, base 0xfb360000, size 131072, enabled
    bar   [18] = type I/O Port, range 32, base 0xc880, size 32, enabled
    cap 01[c8] = powerspec 2  supports D0 D3  current D0
    cap 05[d0] = MSI supports 1 message, 64 bit enabled with 1 message
    cap 10[e0] = PCI-Express 1 endpoint max data 256(256) RO NS
                 max read 512
                 link x4(x4) speed 2.5(2.5) ASPM disabled(L0s)
    ecap 0001[100] = AER 1 0 fatal 1 non-fatal 0 corrected
    ecap 0003[140] = Serial 1 a0369fffff19a686

ral0@pci0:9:0:0:	class=0x028000 rev=0x00 hdr=0x00 vendor=0x1814 device=0x0781 subvendor=0x1814 subdevice=0x2790
    vendor     = 'Ralink corp.'
    device     = 'RT2790 Wireless 802.11n 1T/2R PCIe'
    class      = network
    bar   [10] = type Memory, range 32, base 0xfb4f0000, size 65536, enabled
    cap 01[40] = powerspec 3  supports D0 D3  current D0
    cap 05[50] = MSI supports 32 messages, 64 bit enabled with 1 message
    cap 10[70] = PCI-Express 1 endpoint max data 128(128) RO
                 max read 512
                 link x1(x1) speed 2.5(2.5) ASPM disabled(L0s/L1) ClockPM disabled
    ecap 0001[100] = AER 1 0 fatal 1 non-fatal 1 corrected

em8@pci0:10:0:0:	class=0x020000 rev=0x00 hdr=0x00 vendor=0x8086 device=0x10d3 subvendor=0x15d9 subdevice=0x0605
    vendor     = 'Intel Corporation'
    device     = '82574L Gigabit Network Connection'
    class      = network
    subclass   = ethernet
    bar   [10] = type Memory, range 32, base 0xfb5e0000, size 131072, enabled
    bar   [18] = type I/O Port, range 32, base 0xdc00, size 32, enabled
    bar   [1c] = type Memory, range 32, base 0xfb5dc000, size 16384, enabled
    cap 01[c8] = powerspec 2  supports D0 D3  current D0
    cap 05[d0] = MSI supports 1 message, 64 bit 
    cap 10[e0] = PCI-Express 1 endpoint max data 128(256) RO NS
                 max read 512
                 link x1(x1) speed 2.5(2.5) ASPM disabled(L0s/L1)
    cap 11[a0] = MSI-X supports 5 messages, enabled
                 Table in map 0x1c[0x0], PBA in map 0x1c[0x2000]
    ecap 0001[100] = AER 1 1 fatal 0 non-fatal 6 corrected
    ecap 0003[140] = Serial 1 002590ffff0e4834

em9@pci0:11:0:0:	class=0x020000 rev=0x00 hdr=0x00 vendor=0x8086 device=0x10d3 subvendor=0x15d9 subdevice=0x0605
    vendor     = 'Intel Corporation'
    device     = '82574L Gigabit Network Connection'
    class      = network
    subclass   = ethernet
    bar   [10] = type Memory, range 32, base 0xfb6e0000, size 131072, enabled
    bar   [18] = type I/O Port, range 32, base 0xec00, size 32, enabled
    bar   [1c] = type Memory, range 32, base 0xfb6dc000, size 16384, enabled
    cap 01[c8] = powerspec 2  supports D0 D3  current D0
    cap 05[d0] = MSI supports 1 message, 64 bit 
    cap 10[e0] = PCI-Express 1 endpoint max data 128(256) RO NS
                 max read 512
                 link x1(x1) speed 2.5(2.5) ASPM disabled(L0s/L1)
    cap 11[a0] = MSI-X supports 5 messages, enabled
                 Table in map 0x1c[0x0], PBA in map 0x1c[0x2000]
    ecap 0001[100] = AER 1 0 fatal 0 non-fatal 6 corrected
    ecap 0003[140] = Serial 1 002590ffff0e4835

vgapci0@pci0:12:3:0:	class=0x030000 rev=0x0a hdr=0x00 vendor=0x102b device=0x0532 subvendor=0x15d9 subdevice=0x0605
    vendor     = 'Matrox Electronics Systems Ltd.'
    device     = 'MGA G200eW WPCM450'
    class      = display
    subclass   = VGA
    bar   [10] = type Prefetchable Memory, range 32, base 0xf9000000, size 16777216, enabled
    bar   [14] = type Memory, range 32, base 0xfb7fc000, size 16384, enabled
    bar   [18] = type Memory, range 32, base 0xfb800000, size 8388608, enabled
    cap 01[dc] = powerspec 1  supports D0 D3  current D0
