hostb0@pci0:0:0:0:	class=0x060000 rev=0x07 hdr=0x00 vendor=0x8086 device=0x191f subvendor=0x8086 subdevice=0x2015
    vendor     = 'Intel Corporation'
    device     = 'Xeon E3-1200 v5/E3-1500 v5/6th Gen Core Processor Host Bridge/DRAM Registers'
    class      = bridge
    subclass   = HOST-PCI
    cap 09[e0] = vendor (length 16) Intel cap 0 version 1

pcib1@pci0:0:1:0:	class=0x060400 rev=0x07 hdr=0x01 vendor=0x8086 device=0x1901 subvendor=0x8086 subdevice=0x2015
    vendor     = 'Intel Corporation'
    device     = '6th-10th Gen Core Processor PCIe Controller (x16)'
    class      = bridge
    subclass   = PCI-PCI
    cap 0d[88] = PCI Bridge subvendor=0x8086 subdevice=0x2015
    cap 01[80] = powerspec 3  supports D0 D3  current D0
    cap 05[90] = MSI supports 1 message 
    cap 10[a0] = PCI-Express 2 root port max data 256(256)
                 max read 128
                 link x0(x16) speed 0.0(8.0) ASPM disabled(L0s/L1)
                 slot 1 power limit 75000 mW
    ecap 0002[100] = VC 1 max VC0
    ecap 0005[140] = Root Complex Link Declaration 1
    ecap 0019[d94] = PCIe Sec 1 lane errors 0

pcib2@pci0:0:1:1:	class=0x060400 rev=0x07 hdr=0x01 vendor=0x8086 device=0x1905 subvendor=0x8086 subdevice=0x2015
    vendor     = 'Intel Corporation'
    device     = 'Xeon E3-1200 v5/E3-1500 v5/6th Gen Core Processor PCIe Controller (x8)'
    class      = bridge
    subclass   = PCI-PCI
    cap 0d[88] = PCI Bridge subvendor=0x8086 subdevice=0x2015
    cap 01[80] = powerspec 3  supports D0 D3  current D0
    cap 05[90] = MSI supports 1 message 
    cap 10[a0] = PCI-Express 2 root port max data 256(256)
                 max read 128
                 link x0(x8) speed 0.0(8.0) ASPM disabled(L0s/L1)
                 slot 2 power limit 75000 mW
    ecap 0002[100] = VC 1 max VC0
    ecap 0005[140] = Root Complex Link Declaration 1
    ecap 0019[d94] = PCIe Sec 1 lane errors 0

vgapci0@pci0:0:2:0:	class=0x030000 rev=0x06 hdr=0x00 vendor=0x8086 device=0x1912 subvendor=0x8086 subdevice=0x0000
    vendor     = 'Intel Corporation'
    device     = 'HD Graphics 530'
    class      = display
    subclass   = VGA
    bar   [10] = type Memory, range 64, base 0xde000000, size 16777216, enabled
    bar   [18] = type Prefetchable Memory, range 64, base 0xc0000000, size 268435456, enabled
    bar   [20] = type I/O Port, range 32, base 0xf000, size 64, enabled
    cap 09[40] = vendor (length 12) Intel cap 0 version 1
    cap 10[70] = PCI-Express 2 root endpoint max data 128(128) FLR
                 max read 128
    cap 05[ac] = MSI supports 1 message 
    cap 01[d0] = powerspec 2  supports D0 D3  current D0
    ecap 001b[100] = Process Address Space ID 1
    ecap 000f[200] = ATS 1
    ecap 0013[300] = Page Page Request 1

xhci0@pci0:0:20:0:	class=0x0c0330 rev=0x31 hdr=0x00 vendor=0x8086 device=0xa12f subvendor=0x8086 subdevice=0x7270
    vendor     = 'Intel Corporation'
    device     = '100 Series/C230 Series Chipset Family USB 3.0 xHCI Controller'
    class      = serial bus
    subclass   = USB
    bar   [10] = type Memory, range 64, base 0xdff10000, size 65536, enabled
    cap 01[70] = powerspec 2  supports D0 D3  current D0
    cap 05[80] = MSI supports 8 messages, 64 bit enabled with 1 message

pchtherm0@pci0:0:20:2:	class=0x118000 rev=0x31 hdr=0x00 vendor=0x8086 device=0xa131 subvendor=0x8086 subdevice=0x7270
    vendor     = 'Intel Corporation'
    device     = '100 Series/C230 Series Chipset Family Thermal Subsystem'
    class      = dasp
    bar   [10] = type Memory, range 64, base 0xdff2e000, size 4096, enabled
    cap 01[50] = powerspec 3  supports D0 D3  current D0
    cap 05[80] = MSI supports 1 message 

none0@pci0:0:22:0:	class=0x078000 rev=0x31 hdr=0x00 vendor=0x8086 device=0xa13a subvendor=0x8086 subdevice=0x1999
    vendor     = 'Intel Corporation'
    device     = '100 Series/C230 Series Chipset Family MEI Controller'
    class      = simple comms
    bar   [10] = type Memory, range 64, base 0xdff2d000, size 4096, enabled
    cap 01[50] = powerspec 3  supports D0 D3  current D0
    cap 05[8c] = MSI supports 1 message, 64 bit 

ahci0@pci0:0:23:0:	class=0x010601 rev=0x31 hdr=0x00 vendor=0x8086 device=0xa102 subvendor=0x8086 subdevice=0x7270
    vendor     = 'Intel Corporation'
    device     = 'Q170/Q150/B150/H170/H110/Z170/CM236 Chipset SATA Controller [AHCI Mode]'
    class      = mass storage
    subclass   = SATA
    bar   [10] = type Memory, range 32, base 0xdff28000, size 8192, enabled
    bar   [14] = type Memory, range 32, base 0xdff2c000, size 256, enabled
    bar   [18] = type I/O Port, range 32, base 0xf090, size 8, enabled
    bar   [1c] = type I/O Port, range 32, base 0xf080, size 4, enabled
    bar   [20] = type I/O Port, range 32, base 0xf060, size 32, enabled
    bar   [24] = type Memory, range 32, base 0xdff2b000, size 2048, enabled
    cap 05[80] = MSI supports 1 message enabled with 1 message
    cap 01[70] = powerspec 3  supports D0 D3  current D0
    cap 12[a8] = SATA Index-Data Pair

pcib3@pci0:0:28:0:	class=0x060400 rev=0xf1 hdr=0x01 vendor=0x8086 device=0xa110 subvendor=0x8086 subdevice=0x7270
    vendor     = 'Intel Corporation'
    device     = '100 Series/C230 Series Chipset Family PCI Express Root Port'
    class      = bridge
    subclass   = PCI-PCI
    cap 10[40] = PCI-Express 2 root port max data 256(256) ARI disabled
                 max read 128
                 link x1(x1) speed 2.5(8.0)
                 slot 4 power limit 100 mW
    cap 05[80] = MSI supports 1 message 
    cap 0d[90] = PCI Bridge subvendor=0x8086 subdevice=0x7270
    cap 01[a0] = powerspec 3  supports D0 D3  current D0
    ecap 0001[100] = AER 1 0 fatal 0 non-fatal 0 corrected
    ecap 000d[140] = ACS 1
    ecap 0019[220] = PCIe Sec 1 lane errors 0

pcib4@pci0:0:28:1:	class=0x060400 rev=0xf1 hdr=0x01 vendor=0x8086 device=0xa111 subvendor=0x8086 subdevice=0x7270
    vendor     = 'Intel Corporation'
    device     = '100 Series/C230 Series Chipset Family PCI Express Root Port'
    class      = bridge
    subclass   = PCI-PCI
    cap 10[40] = PCI-Express 2 root port max data 256(256) ARI disabled
                 max read 128
                 link x1(x1) speed 2.5(8.0)
                 slot 5 power limit 100 mW
    cap 05[80] = MSI supports 1 message 
    cap 0d[90] = PCI Bridge subvendor=0x8086 subdevice=0x7270
    cap 01[a0] = powerspec 3  supports D0 D3  current D0
    ecap 0001[100] = AER 1 0 fatal 0 non-fatal 0 corrected
    ecap 000d[140] = ACS 1
    ecap 0019[220] = PCIe Sec 1 lane errors 0

pcib5@pci0:0:28:2:	class=0x060400 rev=0xf1 hdr=0x01 vendor=0x8086 device=0xa112 subvendor=0x8086 subdevice=0x7270
    vendor     = 'Intel Corporation'
    device     = '100 Series/C230 Series Chipset Family PCI Express Root Port'
    class      = bridge
    subclass   = PCI-PCI
    cap 10[40] = PCI-Express 2 root port max data 256(256) ARI disabled
                 max read 128
                 link x1(x1) speed 2.5(8.0)
                 slot 6 power limit 100 mW
    cap 05[80] = MSI supports 1 message 
    cap 0d[90] = PCI Bridge subvendor=0x8086 subdevice=0x7270
    cap 01[a0] = powerspec 3  supports D0 D3  current D0
    ecap 0001[100] = AER 1 0 fatal 0 non-fatal 0 corrected
    ecap 000d[140] = ACS 1
    ecap 0019[220] = PCIe Sec 1 lane errors 0

pcib6@pci0:0:28:3:	class=0x060400 rev=0xf1 hdr=0x01 vendor=0x8086 device=0xa113 subvendor=0x8086 subdevice=0x7270
    vendor     = 'Intel Corporation'
    device     = '100 Series/C230 Series Chipset Family PCI Express Root Port'
    class      = bridge
    subclass   = PCI-PCI
    cap 10[40] = PCI-Express 2 root port max data 256(256) ARI disabled
                 max read 128
                 link x1(x1) speed 2.5(8.0)
                 slot 7 power limit 100 mW
    cap 05[80] = MSI supports 1 message 
    cap 0d[90] = PCI Bridge subvendor=0x8086 subdevice=0x7270
    cap 01[a0] = powerspec 3  supports D0 D3  current D0
    ecap 0001[100] = AER 1 0 fatal 0 non-fatal 0 corrected
    ecap 000d[140] = ACS 1
    ecap 001e[200] = L1 PM Substates 1
    ecap 0019[220] = PCIe Sec 1 lane errors 0

pcib7@pci0:0:28:4:	class=0x060400 rev=0xf1 hdr=0x01 vendor=0x8086 device=0xa114 subvendor=0x8086 subdevice=0x7270
    vendor     = 'Intel Corporation'
    device     = '100 Series/C230 Series Chipset Family PCI Express Root Port'
    class      = bridge
    subclass   = PCI-PCI
    cap 10[40] = PCI-Express 2 root port max data 256(256) ARI disabled
                 max read 128
                 link x1(x1) speed 2.5(8.0)
                 slot 8 power limit 100 mW
    cap 05[80] = MSI supports 1 message 
    cap 0d[90] = PCI Bridge subvendor=0x8086 subdevice=0x7270
    cap 01[a0] = powerspec 3  supports D0 D3  current D0
    ecap 0001[100] = AER 1 0 fatal 0 non-fatal 0 corrected
    ecap 000d[140] = ACS 1
    ecap 001e[200] = L1 PM Substates 1
    ecap 0019[220] = PCIe Sec 1 lane errors 0

pcib8@pci0:0:28:5:	class=0x060400 rev=0xf1 hdr=0x01 vendor=0x8086 device=0xa115 subvendor=0x8086 subdevice=0x7270
    vendor     = 'Intel Corporation'
    device     = '100 Series/C230 Series Chipset Family PCI Express Root Port'
    class      = bridge
    subclass   = PCI-PCI
    cap 10[40] = PCI-Express 2 root port max data 256(256) ARI disabled
                 max read 128
                 link x1(x1) speed 2.5(8.0)
                 slot 9 power limit 100 mW
    cap 05[80] = MSI supports 1 message 
    cap 0d[90] = PCI Bridge subvendor=0x8086 subdevice=0x7270
    cap 01[a0] = powerspec 3  supports D0 D3  current D0
    ecap 0001[100] = AER 1 0 fatal 0 non-fatal 0 corrected
    ecap 000d[140] = ACS 1
    ecap 001e[200] = L1 PM Substates 1
    ecap 0019[220] = PCIe Sec 1 lane errors 0

pcib9@pci0:0:28:6:	class=0x060400 rev=0xf1 hdr=0x01 vendor=0x8086 device=0xa116 subvendor=0x8086 subdevice=0x7270
    vendor     = 'Intel Corporation'
    device     = '100 Series/C230 Series Chipset Family PCI Express Root Port'
    class      = bridge
    subclass   = PCI-PCI
    cap 10[40] = PCI-Express 2 root port max data 256(256) ARI disabled
                 max read 128
                 link x1(x1) speed 2.5(8.0)
                 slot 10 power limit 100 mW
    cap 05[80] = MSI supports 1 message 
    cap 0d[90] = PCI Bridge subvendor=0x8086 subdevice=0x7270
    cap 01[a0] = powerspec 3  supports D0 D3  current D0
    ecap 0001[100] = AER 1 0 fatal 0 non-fatal 0 corrected
    ecap 000d[140] = ACS 1
    ecap 001e[200] = L1 PM Substates 1
    ecap 0019[220] = PCIe Sec 1 lane errors 0

pcib10@pci0:0:28:7:	class=0x060400 rev=0xf1 hdr=0x01 vendor=0x8086 device=0xa117 subvendor=0x8086 subdevice=0x7270
    vendor     = 'Intel Corporation'
    device     = '100 Series/C230 Series Chipset Family PCI Express Root Port'
    class      = bridge
    subclass   = PCI-PCI
    cap 10[40] = PCI-Express 2 root port max data 256(256) ARI disabled
                 max read 128
                 link x1(x1) speed 2.5(8.0)
                 slot 11 power limit 100 mW
    cap 05[80] = MSI supports 1 message 
    cap 0d[90] = PCI Bridge subvendor=0x8086 subdevice=0x7270
    cap 01[a0] = powerspec 3  supports D0 D3  current D0
    ecap 0001[100] = AER 1 0 fatal 0 non-fatal 0 corrected
    ecap 000d[140] = ACS 1
    ecap 001e[200] = L1 PM Substates 1
    ecap 0019[220] = PCIe Sec 1 lane errors 0

pcib11@pci0:0:29:0:	class=0x060400 rev=0xf1 hdr=0x01 vendor=0x8086 device=0xa118 subvendor=0x8086 subdevice=0x7270
    vendor     = 'Intel Corporation'
    device     = '100 Series/C230 Series Chipset Family PCI Express Root Port'
    class      = bridge
    subclass   = PCI-PCI
    cap 10[40] = PCI-Express 2 root port max data 128(256) ARI disabled
                 max read 128
                 link x0(x1) speed 0.0(8.0) ASPM disabled(L0s/L1)
    cap 05[80] = MSI supports 1 message 
    cap 0d[90] = PCI Bridge subvendor=0x8086 subdevice=0x7270
    cap 01[a0] = powerspec 3  supports D0 D3  current D0

pcib12@pci0:0:29:2:	class=0x060400 rev=0xf1 hdr=0x01 vendor=0x8086 device=0xa11a subvendor=0x8086 subdevice=0x7270
    vendor     = 'Intel Corporation'
    device     = '100 Series/C230 Series Chipset Family PCI Express Root Port'
    class      = bridge
    subclass   = PCI-PCI
    cap 10[40] = PCI-Express 2 root port max data 256(256) ARI disabled
                 max read 128
                 link x1(x1) speed 2.5(8.0)
                 slot 14 power limit 100 mW
    cap 05[80] = MSI supports 1 message 
    cap 0d[90] = PCI Bridge subvendor=0x8086 subdevice=0x7270
    cap 01[a0] = powerspec 3  supports D0 D3  current D0
    ecap 0001[100] = AER 1 0 fatal 0 non-fatal 0 corrected
    ecap 000d[140] = ACS 1
    ecap 0019[220] = PCIe Sec 1 lane errors 0

pcib13@pci0:0:29:3:	class=0x060400 rev=0xf1 hdr=0x01 vendor=0x8086 device=0xa11b subvendor=0x8086 subdevice=0x7270
    vendor     = 'Intel Corporation'
    device     = '100 Series/C230 Series Chipset Family PCI Express Root Port'
    class      = bridge
    subclass   = PCI-PCI
    cap 10[40] = PCI-Express 2 root port max data 256(256) ARI disabled
                 max read 128
                 link x1(x1) speed 2.5(8.0)
                 slot 15 power limit 100 mW
    cap 05[80] = MSI supports 1 message 
    cap 0d[90] = PCI Bridge subvendor=0x8086 subdevice=0x7270
    cap 01[a0] = powerspec 3  supports D0 D3  current D0
    ecap 0001[100] = AER 1 0 fatal 0 non-fatal 0 corrected
    ecap 000d[140] = ACS 1
    ecap 0019[220] = PCIe Sec 1 lane errors 0

pcib14@pci0:0:29:4:	class=0x060400 rev=0xf1 hdr=0x01 vendor=0x8086 device=0xa11c subvendor=0x8086 subdevice=0x7270
    vendor     = 'Intel Corporation'
    device     = '100 Series/C230 Series Chipset Family PCI Express Root Port'
    class      = bridge
    subclass   = PCI-PCI
    cap 10[40] = PCI-Express 2 root port max data 256(256) ARI enabled
                 max read 128
                 link x4(x4) speed 5.0(8.0)
                 slot 16 power limit 250 mW
    cap 05[80] = MSI supports 1 message 
    cap 0d[90] = PCI Bridge subvendor=0x8086 subdevice=0x7270
    cap 01[a0] = powerspec 3  supports D0 D3  current D0
    ecap 0001[100] = AER 1 0 fatal 0 non-fatal 0 corrected
    ecap 000d[140] = ACS 1
    ecap 0019[220] = PCIe Sec 1 lane errors 0

isab0@pci0:0:31:0:	class=0x060100 rev=0x31 hdr=0x00 vendor=0x8086 device=0xa146 subvendor=0x8086 subdevice=0x7270
    vendor     = 'Intel Corporation'
    device     = 'Q170 Chipset LPC/eSPI Controller'
    class      = bridge
    subclass   = PCI-ISA

none1@pci0:0:31:2:	class=0x058000 rev=0x31 hdr=0x00 vendor=0x8086 device=0xa121 subvendor=0x8086 subdevice=0x7270
    vendor     = 'Intel Corporation'
    device     = '100 Series/C230 Series Chipset Family Power Management Controller'
    class      = memory
    bar   [10] = type Memory, range 32, base 0xdff24000, size 16384, enabled

hdac0@pci0:0:31:3:	class=0x040380 rev=0x31 hdr=0x00 vendor=0x8086 device=0xa170 subvendor=0x8086 subdevice=0x7270
    vendor     = 'Intel Corporation'
    device     = '100 Series/C230 Series Chipset Family HD Audio Controller'
    class      = multimedia
    subclass   = HDA
    bar   [10] = type Memory, range 64, base 0xdff20000, size 16384, enabled
    bar   [20] = type Memory, range 64, base 0xdff00000, size 65536, enabled
    cap 01[50] = powerspec 3  supports D0 D3  current D0
    cap 05[60] = MSI supports 1 message, 64 bit enabled with 1 message

ichsmb0@pci0:0:31:4:	class=0x0c0500 rev=0x31 hdr=0x00 vendor=0x8086 device=0xa123 subvendor=0x8086 subdevice=0x7270
    vendor     = 'Intel Corporation'
    device     = '100 Series/C230 Series Chipset Family SMBus'
    class      = serial bus
    subclass   = SMBus
    bar   [10] = type Memory, range 64, base 0xdff2a000, size 256, enabled
    bar   [20] = type I/O Port, range 32, base 0xf040, size 32, enabled

igb0@pci0:3:0:0:	class=0x020000 rev=0x03 hdr=0x00 vendor=0x8086 device=0x1539 subvendor=0x15bb subdevice=0x34e6
    vendor     = 'Intel Corporation'
    device     = 'I211 Gigabit Network Connection'
    class      = network
    subclass   = ethernet
    bar   [10] = type Memory, range 32, base 0xdfe00000, size 131072, enabled
    bar   [18] = type I/O Port, range 32, base 0xe000, size 32, enabled
    bar   [1c] = type Memory, range 32, base 0xdfe20000, size 16384, enabled
    cap 01[40] = powerspec 3  supports D0 D3  current D0
    cap 05[50] = MSI supports 1 message, 64 bit, vector masks 
    cap 11[70] = MSI-X supports 5 messages, enabled
                 Table in map 0x1c[0x0], PBA in map 0x1c[0x2000]
    cap 10[a0] = PCI-Express 2 endpoint max data 256(512) FLR NS
                 max read 512
                 link x1(x1) speed 2.5(2.5) ASPM disabled(L0s/L1)
    ecap 0001[100] = AER 2 0 fatal 0 non-fatal 0 corrected
    ecap 0003[140] = Serial 1 7c5a1cffff540648
    ecap 0017[1a0] = TPH Requester 1

igb1@pci0:4:0:0:	class=0x020000 rev=0x03 hdr=0x00 vendor=0x8086 device=0x1539 subvendor=0x15bb subdevice=0x34e6
    vendor     = 'Intel Corporation'
    device     = 'I211 Gigabit Network Connection'
    class      = network
    subclass   = ethernet
    bar   [10] = type Memory, range 32, base 0xdfd00000, size 131072, enabled
    bar   [18] = type I/O Port, range 32, base 0xd000, size 32, enabled
    bar   [1c] = type Memory, range 32, base 0xdfd20000, size 16384, enabled
    cap 01[40] = powerspec 3  supports D0 D3  current D0
    cap 05[50] = MSI supports 1 message, 64 bit, vector masks 
    cap 11[70] = MSI-X supports 5 messages, enabled
                 Table in map 0x1c[0x0], PBA in map 0x1c[0x2000]
    cap 10[a0] = PCI-Express 2 endpoint max data 256(512) FLR NS
                 max read 512
                 link x1(x1) speed 2.5(2.5) ASPM disabled(L0s/L1)
    ecap 0001[100] = AER 2 0 fatal 0 non-fatal 0 corrected
    ecap 0003[140] = Serial 1 7c5a1cffff540649
    ecap 0017[1a0] = TPH Requester 1

igb2@pci0:5:0:0:	class=0x020000 rev=0x03 hdr=0x00 vendor=0x8086 device=0x1539 subvendor=0x15bb subdevice=0x34e6
    vendor     = 'Intel Corporation'
    device     = 'I211 Gigabit Network Connection'
    class      = network
    subclass   = ethernet
    bar   [10] = type Memory, range 32, base 0xdfc00000, size 131072, enabled
    bar   [18] = type I/O Port, range 32, base 0xc000, size 32, enabled
    bar   [1c] = type Memory, range 32, base 0xdfc20000, size 16384, enabled
    cap 01[40] = powerspec 3  supports D0 D3  current D0
    cap 05[50] = MSI supports 1 message, 64 bit, vector masks 
    cap 11[70] = MSI-X supports 5 messages, enabled
                 Table in map 0x1c[0x0], PBA in map 0x1c[0x2000]
    cap 10[a0] = PCI-Express 2 endpoint max data 256(512) FLR NS
                 max read 512
                 link x1(x1) speed 2.5(2.5) ASPM disabled(L0s/L1)
    ecap 0001[100] = AER 2 0 fatal 0 non-fatal 0 corrected
    ecap 0003[140] = Serial 1 7c5a1cffff54064a
    ecap 0017[1a0] = TPH Requester 1

igb3@pci0:6:0:0:	class=0x020000 rev=0x03 hdr=0x00 vendor=0x8086 device=0x1539 subvendor=0x15bb subdevice=0x34e6
    vendor     = 'Intel Corporation'
    device     = 'I211 Gigabit Network Connection'
    class      = network
    subclass   = ethernet
    bar   [10] = type Memory, range 32, base 0xdfb00000, size 131072, enabled
    bar   [18] = type I/O Port, range 32, base 0xb000, size 32, enabled
    bar   [1c] = type Memory, range 32, base 0xdfb20000, size 16384, enabled
    cap 01[40] = powerspec 3  supports D0 D3  current D0
    cap 05[50] = MSI supports 1 message, 64 bit, vector masks 
    cap 11[70] = MSI-X supports 5 messages, enabled
                 Table in map 0x1c[0x0], PBA in map 0x1c[0x2000]
    cap 10[a0] = PCI-Express 2 endpoint max data 256(512) FLR NS
                 max read 512
                 link x1(x1) speed 2.5(2.5) ASPM disabled(L0s/L1)
    ecap 0001[100] = AER 2 0 fatal 0 non-fatal 0 corrected
    ecap 0003[140] = Serial 1 7c5a1cffff54064b
    ecap 0017[1a0] = TPH Requester 1

igb4@pci0:7:0:0:	class=0x020000 rev=0x03 hdr=0x00 vendor=0x8086 device=0x1539 subvendor=0x15bb subdevice=0x0000
    vendor     = 'Intel Corporation'
    device     = 'I211 Gigabit Network Connection'
    class      = network
    subclass   = ethernet
    bar   [10] = type Memory, range 32, base 0xdfa00000, size 131072, enabled
    bar   [18] = type I/O Port, range 32, base 0xa000, size 32, enabled
    bar   [1c] = type Memory, range 32, base 0xdfa20000, size 16384, enabled
    cap 01[40] = powerspec 3  supports D0 D3  current D0
    cap 05[50] = MSI supports 1 message, 64 bit, vector masks 
    cap 11[70] = MSI-X supports 5 messages, enabled
                 Table in map 0x1c[0x0], PBA in map 0x1c[0x2000]
    cap 10[a0] = PCI-Express 2 endpoint max data 256(512) FLR NS
                 max read 512
                 link x1(x1) speed 2.5(2.5) ASPM disabled(L0s/L1)
    ecap 0001[100] = AER 2 0 fatal 0 non-fatal 0 corrected
    ecap 0003[140] = Serial 1 7c5a1cffff54064c
    ecap 0017[1a0] = TPH Requester 1

igb5@pci0:8:0:0:	class=0x020000 rev=0x03 hdr=0x00 vendor=0x8086 device=0x1539 subvendor=0x15bb subdevice=0x0000
    vendor     = 'Intel Corporation'
    device     = 'I211 Gigabit Network Connection'
    class      = network
    subclass   = ethernet
    bar   [10] = type Memory, range 32, base 0xdf900000, size 131072, enabled
    bar   [18] = type I/O Port, range 32, base 0x9000, size 32, enabled
    bar   [1c] = type Memory, range 32, base 0xdf920000, size 16384, enabled
    cap 01[40] = powerspec 3  supports D0 D3  current D0
    cap 05[50] = MSI supports 1 message, 64 bit, vector masks 
    cap 11[70] = MSI-X supports 5 messages, enabled
                 Table in map 0x1c[0x0], PBA in map 0x1c[0x2000]
    cap 10[a0] = PCI-Express 2 endpoint max data 256(512) FLR NS
                 max read 512
                 link x1(x1) speed 2.5(2.5) ASPM disabled(L0s/L1)
    ecap 0001[100] = AER 2 0 fatal 0 non-fatal 0 corrected
    ecap 0003[140] = Serial 1 7c5a1cffff54064d
    ecap 0017[1a0] = TPH Requester 1

igb6@pci0:9:0:0:	class=0x020000 rev=0x03 hdr=0x00 vendor=0x8086 device=0x1539 subvendor=0x15bb subdevice=0x0000
    vendor     = 'Intel Corporation'
    device     = 'I211 Gigabit Network Connection'
    class      = network
    subclass   = ethernet
    bar   [10] = type Memory, range 32, base 0xdf800000, size 131072, enabled
    bar   [18] = type I/O Port, range 32, base 0x8000, size 32, enabled
    bar   [1c] = type Memory, range 32, base 0xdf820000, size 16384, enabled
    cap 01[40] = powerspec 3  supports D0 D3  current D0
    cap 05[50] = MSI supports 1 message, 64 bit, vector masks 
    cap 11[70] = MSI-X supports 5 messages, enabled
                 Table in map 0x1c[0x0], PBA in map 0x1c[0x2000]
    cap 10[a0] = PCI-Express 2 endpoint max data 256(512) FLR NS
                 max read 512
                 link x1(x1) speed 2.5(2.5) ASPM disabled(L0s/L1)
    ecap 0001[100] = AER 2 0 fatal 0 non-fatal 0 corrected
    ecap 0003[140] = Serial 1 7c5a1cffff54064e
    ecap 0017[1a0] = TPH Requester 1

igb7@pci0:10:0:0:	class=0x020000 rev=0x03 hdr=0x00 vendor=0x8086 device=0x1539 subvendor=0x15bb subdevice=0x0000
    vendor     = 'Intel Corporation'
    device     = 'I211 Gigabit Network Connection'
    class      = network
    subclass   = ethernet
    bar   [10] = type Memory, range 32, base 0xdf700000, size 131072, enabled
    bar   [18] = type I/O Port, range 32, base 0x7000, size 32, enabled
    bar   [1c] = type Memory, range 32, base 0xdf720000, size 16384, enabled
    cap 01[40] = powerspec 3  supports D0 D3  current D0
    cap 05[50] = MSI supports 1 message, 64 bit, vector masks 
    cap 11[70] = MSI-X supports 5 messages, enabled
                 Table in map 0x1c[0x0], PBA in map 0x1c[0x2000]
    cap 10[a0] = PCI-Express 2 endpoint max data 256(512) FLR NS
                 max read 512
                 link x1(x1) speed 2.5(2.5) ASPM disabled(L0s/L1)
    ecap 0001[100] = AER 2 0 fatal 0 non-fatal 0 corrected
    ecap 0003[140] = Serial 1 7c5a1cffff54064f
    ecap 0017[1a0] = TPH Requester 1

igb8@pci0:12:0:0:	class=0x020000 rev=0x03 hdr=0x00 vendor=0x8086 device=0x1536 subvendor=0x15bb subdevice=0x0000
    vendor     = 'Intel Corporation'
    device     = 'I210 Gigabit Fiber Network Connection'
    class      = network
    subclass   = ethernet
    bar   [10] = type Memory, range 32, base 0xdf400000, size 1048576, enabled
    bar   [18] = type I/O Port, range 32, base 0x6000, size 32, enabled
    bar   [1c] = type Memory, range 32, base 0xdf500000, size 16384, enabled
    cap 01[40] = powerspec 3  supports D0 D3  current D0
    cap 05[50] = MSI supports 1 message, 64 bit, vector masks 
    cap 11[70] = MSI-X supports 5 messages, enabled
                 Table in map 0x1c[0x0], PBA in map 0x1c[0x2000]
    cap 10[a0] = PCI-Express 2 endpoint max data 256(512) FLR NS
                 max read 512
                 link x1(x1) speed 2.5(2.5) ASPM disabled(L0s/L1)
    ecap 0001[100] = AER 2 0 fatal 0 non-fatal 0 corrected
    ecap 0003[140] = Serial 1 7c5a1cffff540650
    ecap 0017[1a0] = TPH Requester 1

igb9@pci0:13:0:0:	class=0x020000 rev=0x03 hdr=0x00 vendor=0x8086 device=0x1536 subvendor=0x15bb subdevice=0x0000
    vendor     = 'Intel Corporation'
    device     = 'I210 Gigabit Fiber Network Connection'
    class      = network
    subclass   = ethernet
    bar   [10] = type Memory, range 32, base 0xdf100000, size 1048576, enabled
    bar   [18] = type I/O Port, range 32, base 0x5000, size 32, enabled
    bar   [1c] = type Memory, range 32, base 0xdf200000, size 16384, enabled
    cap 01[40] = powerspec 3  supports D0 D3  current D0
    cap 05[50] = MSI supports 1 message, 64 bit, vector masks 
    cap 11[70] = MSI-X supports 5 messages, enabled
                 Table in map 0x1c[0x0], PBA in map 0x1c[0x2000]
    cap 10[a0] = PCI-Express 2 endpoint max data 256(512) FLR NS
                 max read 512
                 link x1(x1) speed 2.5(2.5) ASPM disabled(L0s/L1)
    ecap 0001[100] = AER 2 0 fatal 0 non-fatal 0 corrected
    ecap 0003[140] = Serial 1 7c5a1cffff540651
    ecap 0017[1a0] = TPH Requester 1

ix0@pci0:14:0:0:	class=0x020000 rev=0x01 hdr=0x00 vendor=0x8086 device=0x10fb subvendor=0x15bb subdevice=0x0000
    vendor     = 'Intel Corporation'
    device     = '82599ES 10-Gigabit SFI/SFP+ Network Connection'
    class      = network
    subclass   = ethernet
    bar   [10] = type Memory, range 64, base 0xdf620000, size 131072, enabled
    bar   [18] = type I/O Port, range 32, base 0x4020, size 32, enabled
    bar   [20] = type Memory, range 64, base 0xdf644000, size 16384, enabled
    cap 01[40] = powerspec 3  supports D0 D3  current D0
    cap 05[50] = MSI supports 1 message, 64 bit, vector masks 
    cap 11[70] = MSI-X supports 64 messages, enabled
                 Table in map 0x20[0x0], PBA in map 0x20[0x2000]
    cap 10[a0] = PCI-Express 2 endpoint max data 256(512) FLR NS
                 max read 512
                 link x4(x8) speed 5.0(5.0) ASPM disabled(L0s)
    cap 03[e0] = VPD
    ecap 0001[100] = AER 1 0 fatal 0 non-fatal 1 corrected
    ecap 0003[140] = Serial 1 7c5a1cffff540652
    ecap 000e[150] = ARI 1
    ecap 0010[160] = SR-IOV 1 IOV disabled, Memory Space disabled, ARI disabled
                     0 VFs configured out of 64 supported
                     First VF RID Offset 0x0180, VF RID Stride 0x0002
                     VF Device ID 0x10ed
                     Page Sizes: 4096 (enabled), 8192, 65536, 262144, 1048576, 4194304

ix1@pci0:14:0:1:	class=0x020000 rev=0x01 hdr=0x00 vendor=0x8086 device=0x10fb subvendor=0x15bb subdevice=0x0000
    vendor     = 'Intel Corporation'
    device     = '82599ES 10-Gigabit SFI/SFP+ Network Connection'
    class      = network
    subclass   = ethernet
    bar   [10] = type Memory, range 64, base 0xdf600000, size 131072, enabled
    bar   [18] = type I/O Port, range 32, base 0x4000, size 32, enabled
    bar   [20] = type Memory, range 64, base 0xdf640000, size 16384, enabled
    cap 01[40] = powerspec 3  supports D0 D3  current D0
    cap 05[50] = MSI supports 1 message, 64 bit, vector masks 
    cap 11[70] = MSI-X supports 64 messages, enabled
                 Table in map 0x20[0x0], PBA in map 0x20[0x2000]
    cap 10[a0] = PCI-Express 2 endpoint max data 256(512) FLR NS
                 max read 512
                 link x4(x8) speed 5.0(5.0) ASPM disabled(L0s)
    cap 03[e0] = VPD
    ecap 0001[100] = AER 1 0 fatal 0 non-fatal 1 corrected
    ecap 0003[140] = Serial 1 7c5a1cffff540652
    ecap 000e[150] = ARI 1
    ecap 0010[160] = SR-IOV 1 IOV disabled, Memory Space disabled, ARI disabled
                     0 VFs configured out of 64 supported
                     First VF RID Offset 0x0180, VF RID Stride 0x0002
                     VF Device ID 0x10ed
                     Page Sizes: 4096 (enabled), 8192, 65536, 262144, 1048576, 4194304
