hostb0@pci0:0:0:0:	class=0x060000 card=0x25808086 chip=0x25808086 rev=0x04 hdr=0x00
    vendor     = 'Intel Corporation'
    device     = '82915G/P/GV/GL/PL/910GL Memory Controller Hub'
    class      = bridge
    subclass   = HOST-PCI
    cap 09[e0] = vendor (length 9) Intel cap 2 version 1

pcib1@pci0:0:1:0:	class=0x060400 card=0x00008086 chip=0x25818086 rev=0x04 hdr=0x01
    vendor     = 'Intel Corporation'
    device     = '82915G/P/GV/GL/PL/910GL PCI Express Root Port'
    class      = bridge
    subclass   = PCI-PCI
    cap 0d[88] = PCI Bridge card=0x00008086
    cap 01[80] = powerspec 2  supports D0 D3  current D0
    cap 05[90] = MSI supports 1 message 
    cap 10[a0] = PCI-Express 1 root port max data 128(128)
                 link x16(x16) speed 2.5(2.5) ASPM disabled(L0s/L1)
                 slot 0 power limit 75000 mW
    ecap 0002[100] = VC 1 max VC1
    ecap 0005[140] = Root Complex Link Declaration 1

hdac0@pci0:0:27:0:	class=0x040300 card=0x813d1043 chip=0x26688086 rev=0x03 hdr=0x00
    vendor     = 'Intel Corporation'
    device     = '82801FB/FBM/FR/FW/FRW (ICH6 Family) High Definition Audio Controller'
    class      = multimedia
    subclass   = HDA
    bar   [10] = type Memory, range 64, base 0xd7cf4000, size 16384, enabled
    cap 01[50] = powerspec 2  supports D0 D3  current D0
    cap 05[60] = MSI supports 1 message, 64 bit 
    cap 10[70] = PCI-Express 1 root endpoint max data 128(128) NS
    ecap 0002[100] = VC 1 max VC1
    ecap 0005[130] = Root Complex Link Declaration 1

pcib2@pci0:0:28:0:	class=0x060400 card=0x00000000 chip=0x26608086 rev=0x03 hdr=0x01
    vendor     = 'Intel Corporation'
    device     = '82801FB/FBM/FR/FW/FRW (ICH6 Family) PCI Express Port 1'
    class      = bridge
    subclass   = PCI-PCI
    cap 10[40] = PCI-Express 1 root port max data 128(128)
                 link x0(x1) speed 0.0(2.5) ASPM disabled(L0s/L1)
                 slot 1 power limit 0 mW HotPlug(empty) surprise
    cap 05[80] = MSI supports 1 message 
    cap 0d[90] = PCI Bridge card=0x00000000
    cap 01[a0] = powerspec 2  supports D0 D3  current D0
    ecap 0002[100] = VC 1 max VC1
    ecap 0005[180] = Root Complex Link Declaration 1

pcib3@pci0:0:28:1:	class=0x060400 card=0x00000000 chip=0x26628086 rev=0x03 hdr=0x01
    vendor     = 'Intel Corporation'
    device     = '82801FB/FBM/FR/FW/FRW (ICH6 Family) PCI Express Port 2'
    class      = bridge
    subclass   = PCI-PCI
    cap 10[40] = PCI-Express 1 root port max data 128(128)
                 link x1(x1) speed 2.5(2.5) ASPM disabled(L0s/L1)
                 slot 2 power limit 0 mW HotPlug(present) surprise
    cap 05[80] = MSI supports 1 message 
    cap 0d[90] = PCI Bridge card=0x00000000
    cap 01[a0] = powerspec 2  supports D0 D3  current D0
    ecap 0002[100] = VC 1 max VC1
    ecap 0005[180] = Root Complex Link Declaration 1

uhci0@pci0:0:29:0:	class=0x0c0300 card=0x80a61043 chip=0x26588086 rev=0x03 hdr=0x00
    vendor     = 'Intel Corporation'
    device     = '82801FB/FBM/FR/FW/FRW (ICH6 Family) USB UHCI'
    class      = serial bus
    subclass   = USB
    bar   [20] = type I/O Port, range 32, base 0x7000, size 32, enabled

uhci1@pci0:0:29:1:	class=0x0c0300 card=0x80a61043 chip=0x26598086 rev=0x03 hdr=0x00
    vendor     = 'Intel Corporation'
    device     = '82801FB/FBM/FR/FW/FRW (ICH6 Family) USB UHCI'
    class      = serial bus
    subclass   = USB
    bar   [20] = type I/O Port, range 32, base 0x7400, size 32, enabled

uhci2@pci0:0:29:2:	class=0x0c0300 card=0x80a61043 chip=0x265a8086 rev=0x03 hdr=0x00
    vendor     = 'Intel Corporation'
    device     = '82801FB/FBM/FR/FW/FRW (ICH6 Family) USB UHCI'
    class      = serial bus
    subclass   = USB
    bar   [20] = type I/O Port, range 32, base 0x7800, size 32, enabled

uhci3@pci0:0:29:3:	class=0x0c0300 card=0x80a61043 chip=0x265b8086 rev=0x03 hdr=0x00
    vendor     = 'Intel Corporation'
    device     = '82801FB/FBM/FR/FW/FRW (ICH6 Family) USB UHCI'
    class      = serial bus
    subclass   = USB
    bar   [20] = type I/O Port, range 32, base 0x8000, size 32, enabled

ehci0@pci0:0:29:7:	class=0x0c0320 card=0x80a61043 chip=0x265c8086 rev=0x03 hdr=0x00
    vendor     = 'Intel Corporation'
    device     = '82801FB/FBM/FR/FW/FRW (ICH6 Family) USB2 EHCI Controller'
    class      = serial bus
    subclass   = USB
    bar   [10] = type Memory, range 32, base 0xd7cff800, size 1024, enabled
    cap 01[50] = powerspec 2  supports D0 D3  current D0
    cap 0a[58] = EHCI Debug Port at offset 0xa0 in map 0x14

pcib4@pci0:0:30:0:	class=0x060401 card=0x00000000 chip=0x244e8086 rev=0xd3 hdr=0x01
    vendor     = 'Intel Corporation'
    device     = '82801 PCI Bridge'
    class      = bridge
    subclass   = PCI-PCI
    cap 0d[50] = PCI Bridge card=0x00000000

isab0@pci0:0:31:0:	class=0x060100 card=0x00000000 chip=0x26408086 rev=0x03 hdr=0x00
    vendor     = 'Intel Corporation'
    device     = '82801FB/FR (ICH6/ICH6R) LPC Interface Bridge'
    class      = bridge
    subclass   = PCI-ISA

atapci1@pci0:0:31:1:	class=0x01018a card=0x80a61043 chip=0x266f8086 rev=0x03 hdr=0x00
    vendor     = 'Intel Corporation'
    device     = '82801FB/FBM/FR/FW/FRW (ICH6 Family) IDE Controller'
    class      = mass storage
    subclass   = ATA
    bar   [20] = type I/O Port, range 32, base 0xffa0, size 16, enabled

ahci0@pci0:0:31:2:	class=0x010601 card=0x26061043 chip=0x26528086 rev=0x03 hdr=0x00
    vendor     = 'Intel Corporation'
    device     = '82801FR/FRW (ICH6R/ICH6RW) SATA Controller'
    class      = mass storage
    subclass   = SATA
    bar   [10] = type I/O Port, range 32, base 0x9800, size 8, enabled
    bar   [14] = type I/O Port, range 32, base 0x9400, size 4, enabled
    bar   [18] = type I/O Port, range 32, base 0x9000, size 8, enabled
    bar   [1c] = type I/O Port, range 32, base 0x8800, size 4, enabled
    bar   [20] = type I/O Port, range 32, base 0x8400, size 16, enabled
    bar   [24] = type Memory, range 32, base 0xd7cffc00, size 1024, enabled
    cap 01[70] = powerspec 2  supports D0 D3  current D0

ichsmb0@pci0:0:31:3:	class=0x0c0500 card=0x80a61043 chip=0x266a8086 rev=0x03 hdr=0x00
    vendor     = 'Intel Corporation'
    device     = '82801FB/FBM/FR/FW/FRW (ICH6 Family) SMBus Controller'
    class      = serial bus
    subclass   = SMBus
    bar   [20] = type I/O Port, range 32, base 0x400, size 32, enabled

vgapci0@pci0:4:0:0:	class=0x030000 card=0x005c1043 chip=0x5b601002 rev=0x00 hdr=0x00
    vendor     = 'Advanced Micro Devices, Inc. [AMD/ATI]'
    device     = 'RV370 [Radeon X300]'
    class      = display
    subclass   = VGA
    bar   [10] = type Prefetchable Memory, range 32, base 0xd8000000, size 134217728, enabled
    bar   [14] = type I/O Port, range 32, base 0xe000, size 256, enabled
    bar   [18] = type Memory, range 32, base 0xd7fe0000, size 65536, enabled
    cap 01[50] = powerspec 2  supports D0 D1 D2 D3  current D0
    cap 10[58] = PCI-Express 1 endpoint max data 128(128) RO NS
                 link x16(x16) speed 2.5(2.5) ASPM disabled(L0s/L1)
    cap 05[80] = MSI supports 1 message, 64 bit 
    ecap 0001[100] = AER 1 0 fatal 0 non-fatal 0 corrected

vgapci1@pci0:4:0:1:	class=0x038000 card=0x005d1043 chip=0x5b701002 rev=0x00 hdr=0x00
    vendor     = 'Advanced Micro Devices, Inc. [AMD/ATI]'
    device     = 'RV370 [Radeon X300 SE]'
    class      = display
    bar   [10] = type Memory, range 32, base 0xd7ff0000, size 65536, enabled
    cap 01[50] = powerspec 2  supports D0 D1 D2 D3  current D0
    cap 10[58] = PCI-Express 1 endpoint max data 128(128)
                 link x16(x16) speed 2.5(2.5) ASPM disabled(L0s/L1)

mskc0@pci0:2:0:0:	class=0x020000 card=0x81421043 chip=0x436211ab rev=0x15 hdr=0x00
    vendor     = 'Marvell Technology Group Ltd.'
    device     = '88E8053 PCI-E Gigabit Ethernet Controller'
    class      = network
    subclass   = ethernet
    bar   [10] = type Memory, range 64, base 0xd7efc000, size 16384, enabled
    bar   [18] = type I/O Port, range 32, base 0xc800, size 256, enabled
    cap 01[48] = powerspec 2  supports D0 D1 D2 D3  current D0
    cap 03[50] = VPD
    cap 05[5c] = MSI supports 2 messages, 64 bit 
    cap 10[e0] = PCI-Express 1 legacy endpoint max data 128(128)
                 link x1(x1) speed 2.5(2.5) ASPM disabled(L0s)
    ecap 0001[100] = AER 1 0 fatal 0 non-fatal 0 corrected

fwohci0@pci0:1:3:0:	class=0x0c0010 card=0x808b1043 chip=0x8023104c rev=0x00 hdr=0x00
    vendor     = 'Texas Instruments'
    device     = 'TSB43AB22A IEEE-1394a-2000 Controller (PHY/Link) [iOHCI-Lynx]'
    class      = serial bus
    subclass   = FireWire
    bar   [10] = type Memory, range 32, base 0xd7dff000, size 2048, enabled
    bar   [14] = type Memory, range 32, base 0xd7df8000, size 16384, enabled
    cap 01[44] = powerspec 2  supports D0 D1 D2 D3  current D0

atapci0@pci0:1:5:0:	class=0x018000 card=0x81361043 chip=0x31141095 rev=0x02 hdr=0x00
    vendor     = 'Silicon Image, Inc.'
    device     = 'SiI 3114 [SATALink/SATARaid] Serial ATA Controller'
    class      = mass storage
    bar   [10] = type I/O Port, range 32, base 0xb800, size 8, enabled
    bar   [14] = type I/O Port, range 32, base 0xb400, size 4, enabled
    bar   [18] = type I/O Port, range 32, base 0xb000, size 8, enabled
    bar   [1c] = type I/O Port, range 32, base 0xa800, size 4, enabled
    bar   [20] = type I/O Port, range 32, base 0xa400, size 16, enabled
    bar   [24] = type Memory, range 32, base 0xd7dffc00, size 1024, enabled
    cap 01[60] = powerspec 2  supports D0 D1 D2 D3  current D0
