hostb0@pci0:0:0:0:	class=0x060000 rev=0xb1 hdr=0x00 vendor=0x8086 device=0x25d8 subvendor=0x103c subdevice=0x31fd
    vendor     = 'Intel Corporation'
    device     = '5000P Chipset Memory Controller Hub'
    class      = bridge
    subclass   = HOST-PCI
    cap 01[50] = powerspec 2  supports D0 D3  current D0
    cap 05[58] = MSI supports 2 messages 
    cap 10[6c] = PCI-Express 1 root port max data 256(256) NS
                 max read 4096
                 link x4(x4) speed 2.5(2.5) ASPM disabled(L0s)
    ecap 0001[100] = AER 1 0 fatal 0 non-fatal 0 corrected

pcib1@pci0:0:2:0:	class=0x060400 rev=0xb1 hdr=0x01 vendor=0x8086 device=0x25e2 subvendor=0x0000 subdevice=0x0000
    vendor     = 'Intel Corporation'
    device     = '5000 Series Chipset PCI Express x4 Port 2'
    class      = bridge
    subclass   = PCI-PCI
    cap 01[50] = powerspec 2  supports D0 D3  current D0
    cap 05[58] = MSI supports 2 messages 
    cap 10[6c] = PCI-Express 1 root port max data 256(256) NS
                 max read 4096
                 link x4(x4) speed 2.5(2.5) ASPM disabled(L0s)
    ecap 0001[100] = AER 1 0 fatal 0 non-fatal 0 corrected

pcib7@pci0:0:3:0:	class=0x060400 rev=0xb1 hdr=0x01 vendor=0x8086 device=0x25e3 subvendor=0x0000 subdevice=0x0000
    vendor     = 'Intel Corporation'
    device     = '5000 Series Chipset PCI Express x4 Port 3'
    class      = bridge
    subclass   = PCI-PCI
    cap 01[50] = powerspec 2  supports D0 D3  current D0
    cap 05[58] = MSI supports 2 messages 
    cap 10[6c] = PCI-Express 1 root port max data 256(256) NS
                 max read 4096
                 link x4(x4) speed 2.5(2.5) ASPM disabled(L0s)
    ecap 0001[100] = AER 1 0 fatal 0 non-fatal 0 corrected

pcib8@pci0:0:4:0:	class=0x060400 rev=0xb1 hdr=0x01 vendor=0x8086 device=0x25f8 subvendor=0x0000 subdevice=0x0000
    vendor     = 'Intel Corporation'
    device     = '5000 Series Chipset PCI Express x8 Port 4-5'
    class      = bridge
    subclass   = PCI-PCI
    cap 01[50] = powerspec 2  supports D0 D3  current D0
    cap 05[58] = MSI supports 2 messages 
    cap 10[6c] = PCI-Express 1 root port max data 256(256) NS
                 max read 4096
                 link x8(x8) speed 2.5(2.5) ASPM disabled(L0s)
    ecap 0001[100] = AER 1 0 fatal 0 non-fatal 0 corrected

pcib9@pci0:0:5:0:	class=0x060400 rev=0xb1 hdr=0x01 vendor=0x8086 device=0x25e5 subvendor=0x0000 subdevice=0x0000
    vendor     = 'Intel Corporation'
    device     = '5000 Series Chipset PCI Express x4 Port 5'
    class      = bridge
    subclass   = PCI-PCI
    cap 01[50] = powerspec 2  supports D0 D3  current D0
    cap 05[58] = MSI supports 2 messages 
    cap 10[6c] = PCI-Express 1 root port max data 256(256) NS
                 max read 4096
                 link x0(x4) speed 0.0(2.5) ASPM disabled(L0s)
    ecap 0001[100] = AER 1 0 fatal 0 non-fatal 0 corrected

pcib10@pci0:0:6:0:	class=0x060400 rev=0xb1 hdr=0x01 vendor=0x8086 device=0x25e6 subvendor=0x0000 subdevice=0x0000
    vendor     = 'Intel Corporation'
    device     = '5000 Series Chipset PCI Express x4 Port 6'
    class      = bridge
    subclass   = PCI-PCI
    cap 01[50] = powerspec 2  supports D0 D3  current D0
    cap 05[58] = MSI supports 2 messages 
    cap 10[6c] = PCI-Express 1 root port max data 128(256) NS
                 max read 4096
                 link x4(x4) speed 2.5(2.5) ASPM disabled(L0s)
    ecap 0001[100] = AER 1 0 fatal 0 non-fatal 0 corrected

pcib12@pci0:0:7:0:	class=0x060400 rev=0xb1 hdr=0x01 vendor=0x8086 device=0x25e7 subvendor=0x0000 subdevice=0x0000
    vendor     = 'Intel Corporation'
    device     = '5000 Series Chipset PCI Express x4 Port 7'
    class      = bridge
    subclass   = PCI-PCI
    cap 01[50] = powerspec 2  supports D0 D3  current D0
    cap 05[58] = MSI supports 2 messages 
    cap 10[6c] = PCI-Express 1 root port max data 128(256) NS
                 max read 4096
                 link x4(x4) speed 2.5(2.5) ASPM disabled(L0s)
    ecap 0001[100] = AER 1 0 fatal 0 non-fatal 0 corrected

hostb1@pci0:0:16:0:	class=0x060000 rev=0xb1 hdr=0x00 vendor=0x8086 device=0x25f0 subvendor=0x103c subdevice=0x31fd
    vendor     = 'Intel Corporation'
    device     = '5000 Series Chipset FSB Registers'
    class      = bridge
    subclass   = HOST-PCI

hostb2@pci0:0:16:1:	class=0x060000 rev=0xb1 hdr=0x00 vendor=0x8086 device=0x25f0 subvendor=0x103c subdevice=0x31fd
    vendor     = 'Intel Corporation'
    device     = '5000 Series Chipset FSB Registers'
    class      = bridge
    subclass   = HOST-PCI

hostb3@pci0:0:16:2:	class=0x060000 rev=0xb1 hdr=0x00 vendor=0x8086 device=0x25f0 subvendor=0x103c subdevice=0x31fd
    vendor     = 'Intel Corporation'
    device     = '5000 Series Chipset FSB Registers'
    class      = bridge
    subclass   = HOST-PCI

hostb4@pci0:0:17:0:	class=0x060000 rev=0xb1 hdr=0x00 vendor=0x8086 device=0x25f1 subvendor=0x103c subdevice=0x31fd
    vendor     = 'Intel Corporation'
    device     = '5000 Series Chipset Reserved Registers'
    class      = bridge
    subclass   = HOST-PCI

hostb5@pci0:0:19:0:	class=0x060000 rev=0xb1 hdr=0x00 vendor=0x8086 device=0x25f3 subvendor=0x103c subdevice=0x31fd
    vendor     = 'Intel Corporation'
    device     = '5000 Series Chipset Reserved Registers'
    class      = bridge
    subclass   = HOST-PCI

hostb6@pci0:0:21:0:	class=0x060000 rev=0xb1 hdr=0x00 vendor=0x8086 device=0x25f5 subvendor=0x103c subdevice=0x31fd
    vendor     = 'Intel Corporation'
    device     = '5000 Series Chipset FBD Registers'
    class      = bridge
    subclass   = HOST-PCI

hostb7@pci0:0:22:0:	class=0x060000 rev=0xb1 hdr=0x00 vendor=0x8086 device=0x25f6 subvendor=0x103c subdevice=0x31fd
    vendor     = 'Intel Corporation'
    device     = '5000 Series Chipset FBD Registers'
    class      = bridge
    subclass   = HOST-PCI

uhci0@pci0:0:29:0:	class=0x0c0300 rev=0x09 hdr=0x00 vendor=0x8086 device=0x2688 subvendor=0x103c subdevice=0x31fe
    vendor     = 'Intel Corporation'
    device     = '631xESB/632xESB/3100 Chipset UHCI USB Controller'
    class      = serial bus
    subclass   = USB
    bar   [20] = type I/O Port, range 32, base 0x1000, size 32, enabled

uhci1@pci0:0:29:1:	class=0x0c0300 rev=0x09 hdr=0x00 vendor=0x8086 device=0x2689 subvendor=0x103c subdevice=0x31fe
    vendor     = 'Intel Corporation'
    device     = '631xESB/632xESB/3100 Chipset UHCI USB Controller'
    class      = serial bus
    subclass   = USB
    bar   [20] = type I/O Port, range 32, base 0x1020, size 32, enabled

uhci2@pci0:0:29:2:	class=0x0c0300 rev=0x09 hdr=0x00 vendor=0x8086 device=0x268a subvendor=0x103c subdevice=0x31fe
    vendor     = 'Intel Corporation'
    device     = '631xESB/632xESB/3100 Chipset UHCI USB Controller'
    class      = serial bus
    subclass   = USB
    bar   [20] = type I/O Port, range 32, base 0x1040, size 32, enabled

uhci3@pci0:0:29:3:	class=0x0c0300 rev=0x09 hdr=0x00 vendor=0x8086 device=0x268b subvendor=0x103c subdevice=0x31fe
    vendor     = 'Intel Corporation'
    device     = '631xESB/632xESB/3100 Chipset UHCI USB Controller'
    class      = serial bus
    subclass   = USB
    bar   [20] = type I/O Port, range 32, base 0x1060, size 32, enabled

ehci0@pci0:0:29:7:	class=0x0c0320 rev=0x09 hdr=0x00 vendor=0x8086 device=0x268c subvendor=0x103c subdevice=0x31fe
    vendor     = 'Intel Corporation'
    device     = '631xESB/632xESB/3100 Chipset EHCI USB2 Controller'
    class      = serial bus
    subclass   = USB
    bar   [10] = type Memory, range 32, base 0xf7df0000, size 1024, enabled
    cap 01[50] = powerspec 2  supports D0 D3  current D0
    cap 0a[58] = EHCI Debug Port at offset 0xa0 in map 0x14

pcib14@pci0:0:30:0:	class=0x060401 rev=0xd9 hdr=0x01 vendor=0x8086 device=0x244e subvendor=0x103c subdevice=0x31fe
    vendor     = 'Intel Corporation'
    device     = '82801 PCI Bridge'
    class      = bridge
    subclass   = PCI-PCI
    cap 0d[50] = PCI Bridge subvendor=0x103c subdevice=0x31fe

isab0@pci0:0:31:0:	class=0x060100 rev=0x09 hdr=0x00 vendor=0x8086 device=0x2670 subvendor=0x0000 subdevice=0x0000
    vendor     = 'Intel Corporation'
    device     = '631xESB/632xESB/3100 Chipset LPC Interface Controller'
    class      = bridge
    subclass   = PCI-ISA

atapci0@pci0:0:31:1:	class=0x01018a rev=0x09 hdr=0x00 vendor=0x8086 device=0x269e subvendor=0x103c subdevice=0x31fe
    vendor     = 'Intel Corporation'
    device     = '631xESB/632xESB IDE Controller'
    class      = mass storage
    subclass   = ATA
    bar   [20] = type I/O Port, range 32, base 0x500, size 16, enabled

pcib2@pci0:9:0:0:	class=0x060400 rev=0x01 hdr=0x01 vendor=0x8086 device=0x3500 subvendor=0x0000 subdevice=0x0000
    vendor     = 'Intel Corporation'
    device     = '6311ESB/6321ESB PCI Express Upstream Port'
    class      = bridge
    subclass   = PCI-PCI
    cap 10[44] = PCI-Express 1 upstream port max data 256(256)
                 max read 4096
                 link x4(x8) speed 2.5(2.5) ASPM disabled(L0s)
    cap 01[70] = powerspec 2  supports D0 D3  current D0
    cap 0d[80] = PCI Bridge subvendor=0x0000 subdevice=0x0000
    ecap 0001[100] = AER 1 1 fatal 0 non-fatal 0 corrected

pcib6@pci0:9:0:3:	class=0x060400 rev=0x01 hdr=0x01 vendor=0x8086 device=0x350c subvendor=0x0000 subdevice=0x0000
    vendor     = 'Intel Corporation'
    device     = '6311ESB/6321ESB PCI Express to PCI-X Bridge'
    class      = bridge
    subclass   = PCI-PCI
    cap 10[44] = PCI-Express 1 PCI bridge max data 256(256)
                 max read 4096
                 link x4(x8) speed 2.5(2.5) ASPM disabled(L0s)
    cap 01[6c] = powerspec 2  supports D0 D3  current D0
    cap 0d[80] = PCI Bridge subvendor=0x0000 subdevice=0x0000
    cap 07[d8] = PCI-X bridge 
    ecap 0001[100] = AER 1 1 fatal 0 non-fatal 0 corrected

pcib3@pci0:10:0:0:	class=0x060400 rev=0x01 hdr=0x01 vendor=0x8086 device=0x3510 subvendor=0x0000 subdevice=0x0000
    vendor     = 'Intel Corporation'
    device     = '6311ESB/6321ESB PCI Express Downstream Port E1'
    class      = bridge
    subclass   = PCI-PCI
    cap 10[44] = PCI-Express 1 downstream port max data 256(256)
                 max read 4096
                 link x8(x8) speed 2.5(2.5) ASPM disabled(L0s)
    cap 05[60] = MSI supports 1 message, 64 bit 
    cap 01[70] = powerspec 2  supports D0 D3  current D0
    cap 0d[80] = PCI Bridge subvendor=0x0000 subdevice=0x0000
    ecap 0001[100] = AER 1 0 fatal 0 non-fatal 0 corrected

pcib4@pci0:10:1:0:	class=0x060400 rev=0x01 hdr=0x01 vendor=0x8086 device=0x3514 subvendor=0x0000 subdevice=0x0000
    vendor     = 'Intel Corporation'
    device     = '6311ESB/6321ESB PCI Express Downstream Port E2'
    class      = bridge
    subclass   = PCI-PCI
    cap 10[44] = PCI-Express 1 downstream port max data 256(256)
                 max read 4096
                 link x0(x4) speed 0.0(2.5) ASPM disabled(L0s)
    cap 05[60] = MSI supports 1 message, 64 bit 
    cap 01[70] = powerspec 2  supports D0 D3  current D0
    cap 0d[80] = PCI Bridge subvendor=0x0000 subdevice=0x0000
    ecap 0001[100] = AER 1 0 fatal 0 non-fatal 0 corrected

pcib5@pci0:10:2:0:	class=0x060400 rev=0x01 hdr=0x01 vendor=0x8086 device=0x3518 subvendor=0x0000 subdevice=0x0000
    vendor     = 'Intel Corporation'
    device     = '6311ESB/6321ESB PCI Express Downstream Port E3'
    class      = bridge
    subclass   = PCI-PCI
    cap 10[44] = PCI-Express 1 downstream port max data 256(256)
                 max read 4096
                 link x4(x4) speed 2.5(2.5) ASPM disabled(L0s)
    cap 05[60] = MSI supports 1 message, 64 bit 
    cap 01[70] = powerspec 2  supports D0 D3  current D0
    cap 0d[80] = PCI Bridge subvendor=0x0000 subdevice=0x0000
    ecap 0001[100] = AER 1 0 fatal 0 non-fatal 0 corrected

ix0@pci0:11:0:0:	class=0x020000 rev=0x01 hdr=0x00 vendor=0x8086 device=0x10fb subvendor=0x8086 subdevice=0x000c
    vendor     = 'Intel Corporation'
    device     = '82599ES 10-Gigabit SFI/SFP+ Network Connection'
    class      = network
    subclass   = ethernet
    bar   [10] = type Prefetchable Memory, range 64, base 0xf7b80000, size 524288, enabled
    bar   [18] = type I/O Port, range 32, base 0x5000, size 32, enabled
    bar   [20] = type Prefetchable Memory, range 64, base 0xf7b70000, size 16384, enabled
    cap 01[40] = powerspec 3  supports D0 D3  current D0
    cap 05[50] = MSI supports 1 message, 64 bit, vector masks 
    cap 11[70] = MSI-X supports 64 messages, enabled
                 Table in map 0x20[0x0], PBA in map 0x20[0x2000]
    cap 10[a0] = PCI-Express 2 endpoint max data 256(512) FLR RO NS
                 max read 4096
                 link x8(x8) speed 2.5(5.0) ASPM disabled(L0s)
    ecap 0001[100] = AER 1 1 fatal 0 non-fatal 0 corrected
    ecap 0003[140] = Serial 1 90e2baffff862abc
    ecap 000e[150] = ARI 1
    ecap 0010[160] = SR-IOV 1 IOV disabled, Memory Space disabled, ARI disabled
                     0 VFs configured out of 64 supported
                     First VF RID Offset 0x0180, VF RID Stride 0x0002
                     VF Device ID 0x10ed
                     Page Sizes: 4096 (enabled), 8192, 65536, 262144, 1048576, 4194304

ix1@pci0:11:0:1:	class=0x020000 rev=0x01 hdr=0x00 vendor=0x8086 device=0x10fb subvendor=0x8086 subdevice=0x000c
    vendor     = 'Intel Corporation'
    device     = '82599ES 10-Gigabit SFI/SFP+ Network Connection'
    class      = network
    subclass   = ethernet
    bar   [10] = type Prefetchable Memory, range 64, base 0xf7a80000, size 524288, enabled
    bar   [18] = type I/O Port, range 32, base 0x5020, size 32, enabled
    bar   [20] = type Prefetchable Memory, range 64, base 0xf7a70000, size 16384, enabled
    cap 01[40] = powerspec 3  supports D0 D3  current D0
    cap 05[50] = MSI supports 1 message, 64 bit, vector masks 
    cap 11[70] = MSI-X supports 64 messages, enabled
                 Table in map 0x20[0x0], PBA in map 0x20[0x2000]
    cap 10[a0] = PCI-Express 2 endpoint max data 256(512) FLR RO NS
                 max read 4096
                 link x8(x8) speed 2.5(5.0) ASPM disabled(L0s)
    ecap 0001[100] = AER 1 1 fatal 0 non-fatal 0 corrected
    ecap 0003[140] = Serial 1 90e2baffff862abc
    ecap 000e[150] = ARI 1
    ecap 0010[160] = SR-IOV 1 IOV disabled, Memory Space disabled, ARI disabled
                     0 VFs configured out of 64 supported
                     First VF RID Offset 0x0180, VF RID Stride 0x0002
                     VF Device ID 0x10ed
                     Page Sizes: 4096 (enabled), 8192, 65536, 262144, 1048576, 4194304

ciss0@pci0:6:0:0:	class=0x010400 rev=0x03 hdr=0x00 vendor=0x103c device=0x3230 subvendor=0x103c subdevice=0x3235
    vendor     = 'Hewlett-Packard Company'
    device     = 'Smart Array Controller'
    class      = mass storage
    subclass   = RAID
    bar   [10] = type Memory, range 64, base 0xfde00000, size 1048576, enabled
    bar   [18] = type I/O Port, range 32, base 0x4000, size 256, enabled
    bar   [1c] = type Memory, range 64, base 0xfddf0000, size 4096, enabled
    cap 10[b0] = PCI-Express 1 endpoint max data 256(512) RO NS
                 max read 4096
                 link x4(x8) speed 2.5(2.5) ASPM disabled(L0s)
    cap 11[d4] = MSI-X supports 4 messages, enabled
                 Table in map 0x10[0xfe000], PBA in map 0x10[0xff000]
    cap 01[e0] = powerspec 2  supports D0 D1 D3  current D0
    cap 03[ec] = VPD
    ecap 0004[100] = Power Budgeting 1

ix2@pci0:19:0:0:	class=0x020000 rev=0x01 hdr=0x00 vendor=0x8086 device=0x1557 subvendor=0x1dcf subdevice=0x0317
    vendor     = 'Intel Corporation'
    device     = '82599 10 Gigabit Network Connection'
    class      = network
    subclass   = ethernet
    bar   [10] = type Prefetchable Memory, range 64, base 0xf7c80000, size 524288, enabled
    bar   [18] = type I/O Port, range 32, base 0x6000, size 32, enabled
    bar   [20] = type Prefetchable Memory, range 64, base 0xf7c70000, size 16384, enabled
    cap 01[40] = powerspec 3  supports D0 D3  current D0
    cap 05[50] = MSI supports 1 message, 64 bit, vector masks 
    cap 11[70] = MSI-X supports 64 messages, enabled
                 Table in map 0x20[0x0], PBA in map 0x20[0x2000]
    cap 10[a0] = PCI-Express 2 endpoint max data 256(512) FLR RO NS
                 max read 4096
                 link x8(x8) speed 2.5(5.0) ASPM disabled(L0s)
    cap 03[e0] = VPD
    ecap 0001[100] = AER 1 0 fatal 0 non-fatal 1 corrected
    ecap 0003[140] = Serial 1 80615fffff1549a5
    ecap 000e[150] = ARI 1
    ecap 0010[160] = SR-IOV 1 IOV disabled, Memory Space disabled, ARI disabled
                     0 VFs configured out of 64 supported
                     First VF RID Offset 0x0180, VF RID Stride 0x0002
                     VF Device ID 0x10ed
                     Page Sizes: 4096 (enabled), 8192, 65536, 262144, 1048576, 4194304

pcib11@pci0:2:0:0:	class=0x060400 rev=0xc3 hdr=0x01 vendor=0x1166 device=0x0103 subvendor=0x0000 subdevice=0x0000
    vendor     = 'Broadcom'
    device     = 'EPB PCI-Express to PCI-X Bridge'
    class      = bridge
    subclass   = PCI-PCI
    cap 10[60] = PCI-Express 1 PCI bridge max data 128(128)
                 max read 128
                 link x4(x4) speed 2.5(2.5) ASPM disabled(L0s/L1)
    cap 07[90] = PCI-X bridge 
    cap 01[b0] = powerspec 2  supports D0 D3  current D0
    ecap 0001[100] = AER 1 0 fatal 0 non-fatal 0 corrected
    ecap 0004[14c] = Power Budgeting 1
    ecap 0003[160] = Serial 1 001cc4fffe411678

bce0@pci0:3:0:0:	class=0x020000 rev=0x12 hdr=0x00 vendor=0x14e4 device=0x164c subvendor=0x103c subdevice=0x7038
    vendor     = 'Broadcom Inc. and subsidiaries'
    device     = 'NetXtreme II BCM5708 Gigabit Ethernet'
    class      = network
    subclass   = ethernet
    bar   [10] = type Memory, range 64, base 0xf8000000, size 33554432, enabled
    cap 07[40] = PCI-X 64-bit supports 133MHz, 512 burst read, 8 split transactions
    cap 01[48] = powerspec 2  supports D0 D3  current D0
    cap 03[50] = VPD
    cap 05[58] = MSI supports 1 message, 64 bit enabled with 1 message

pcib13@pci0:4:0:0:	class=0x060400 rev=0xc3 hdr=0x01 vendor=0x1166 device=0x0103 subvendor=0x0000 subdevice=0x0000
    vendor     = 'Broadcom'
    device     = 'EPB PCI-Express to PCI-X Bridge'
    class      = bridge
    subclass   = PCI-PCI
    cap 10[60] = PCI-Express 1 PCI bridge max data 128(128)
                 max read 128
                 link x4(x4) speed 2.5(2.5) ASPM disabled(L0s/L1)
    cap 07[90] = PCI-X bridge 
    cap 01[b0] = powerspec 2  supports D0 D3  current D0
    ecap 0001[100] = AER 1 0 fatal 0 non-fatal 0 corrected
    ecap 0004[14c] = Power Budgeting 1
    ecap 0003[160] = Serial 1 001cc4fffe412600

bce1@pci0:5:0:0:	class=0x020000 rev=0x12 hdr=0x00 vendor=0x14e4 device=0x164c subvendor=0x103c subdevice=0x7038
    vendor     = 'Broadcom Inc. and subsidiaries'
    device     = 'NetXtreme II BCM5708 Gigabit Ethernet'
    class      = network
    subclass   = ethernet
    bar   [10] = type Memory, range 64, base 0xfa000000, size 33554432, enabled
    cap 07[40] = PCI-X 64-bit supports 133MHz, 512 burst read, 8 split transactions
    cap 01[48] = powerspec 2  supports D0 D3  current D0
    cap 03[50] = VPD
    cap 05[58] = MSI supports 1 message, 64 bit enabled with 1 message

vgapci0@pci0:1:3:0:	class=0x030000 rev=0x02 hdr=0x00 vendor=0x1002 device=0x515e subvendor=0x103c subdevice=0x31fb
    vendor     = 'Advanced Micro Devices, Inc. [AMD/ATI]'
    device     = 'ES1000'
    class      = display
    subclass   = VGA
    bar   [10] = type Prefetchable Memory, range 32, base 0xd8000000, size 134217728, enabled
    bar   [14] = type I/O Port, range 32, base 0x3000, size 256, enabled
    bar   [18] = type Memory, range 32, base 0xf7ff0000, size 65536, enabled
    cap 01[50] = powerspec 2  supports D0 D1 D2 D3  current D0

none0@pci0:1:4:0:	class=0x088000 rev=0x03 hdr=0x00 vendor=0x0e11 device=0xb203 subvendor=0x103c subdevice=0x3305
    vendor     = 'Compaq Computer Corporation'
    device     = 'Integrated Lights Out Controller'
    class      = base peripheral
    bar   [10] = type I/O Port, range 32, base 0x2800, size 256, enabled
    bar   [14] = type Memory, range 32, base 0xf7fe0000, size 512, enabled
    cap 01[f0] = powerspec 3  supports D0 D3  current D0

none1@pci0:1:4:2:	class=0x088000 rev=0x03 hdr=0x00 vendor=0x0e11 device=0xb204 subvendor=0x103c subdevice=0x3305
    vendor     = 'Compaq Computer Corporation'
    device     = 'Integrated Lights Out  Processor'
    class      = base peripheral
    bar   [10] = type I/O Port, range 32, base 0x3400, size 256, enabled
    bar   [14] = type Memory, range 32, base 0xf7fd0000, size 2048, enabled
    bar   [18] = type Memory, range 32, base 0xf7fc0000, size 16384, enabled
    bar   [1c] = type Memory, range 32, base 0xf7f00000, size 524288, enabled
    cap 01[f0] = powerspec 3  supports D0 D3  current D0

uhci4@pci0:1:4:4:	class=0x0c0300 rev=0x00 hdr=0x00 vendor=0x103c device=0x3300 subvendor=0x103c subdevice=0x3305
    vendor     = 'Hewlett-Packard Company'
    device     = 'Integrated Lights-Out Standard Virtual USB Controller'
    class      = serial bus
    subclass   = USB
    bar   [20] = type I/O Port, range 32, base 0x3800, size 32, enabled
    cap 01[f0] = powerspec 3  supports D0 D3  current D0

none2@pci0:1:4:6:	class=0x0c0701 rev=0x00 hdr=0x00 vendor=0x103c device=0x3302 subvendor=0x103c subdevice=0x3305
    vendor     = 'Hewlett-Packard Company'
    device     = 'Integrated Lights-Out Standard KCS Interface'
    class      = serial bus
    subclass   = IPMI
    bar   [10] = type Memory, range 32, base 0xf7ef0000, size 256, enabled
    cap 01[f0] = powerspec 3  supports D0 D3  current D0
