hostb0@pci0:0:0:0:	class=0x060000 card=0x130a103c chip=0x34068086 rev=0x13 hdr=0x00
    vendor     = 'Intel Corporation'
    device     = '5520 I/O Hub to ESI Port'
    class      = bridge
    subclass   = HOST-PCI
    cap 05[60] = MSI supports 2 messages, vector masks 
    cap 10[90] = PCI-Express 2 root port max data 128(128) ARI disabled
                 link x4(x4) speed 2.5(2.5) ASPM disabled(L0s/L1)
    cap 01[e0] = powerspec 3  supports D0 D3  current D0
    ecap 0001[100] = AER 1 0 fatal 0 non-fatal 0 corrected
    ecap 000d[150] = ACS 1
    ecap 000b[160] = Vendor 0pcib1@pci0:0:1:0:	class=0x060400 card=0x130a103c chip=0x34088086 rev=0x13 hdr=0x01
    vendor     = 'Intel Corporation'
    device     = '5520/5500/X58 I/O Hub PCI Express Root Port 1'
    class      = bridge
    subclass   = PCI-PCI
    cap 0d[40] = PCI Bridge card=0x130a103c
    cap 05[60] = MSI supports 2 messages, vector masks 
    cap 10[90] = PCI-Express 2 root port max data 256(256) ARI disabled
                 link x4(x4) speed 2.5(5.0) ASPM disabled(L0s/L1)
                 slot 0 power limit 0 mW
    cap 01[e0] = powerspec 3  supports D0 D3  current D0
    ecap 0001[100] = AER 1 0 fatal 0 non-fatal 0 corrected
    ecap 000d[150] = ACS 1
    ecap 000b[160] = Vendor 0pcib2@pci0:0:3:0:	class=0x060400 card=0x130a103c chip=0x340a8086 rev=0x13 hdr=0x01
    vendor     = 'Intel Corporation'
    device     = '5520/5500/X58 I/O Hub PCI Express Root Port 3'
    class      = bridge
    subclass   = PCI-PCI
    cap 0d[40] = PCI Bridge card=0x130a103c
    cap 05[60] = MSI supports 2 messages, vector masks 
    cap 10[90] = PCI-Express 2 root port max data 256(256) ARI enabled
                 link x16(x16) speed 2.5(5.0) ASPM disabled(L0s/L1)
                 slot 2 power limit 75000 mW
    cap 01[e0] = powerspec 3  supports D0 D3  current D0
    ecap 0001[100] = AER 1 0 fatal 0 non-fatal 0 corrected
    ecap 000d[150] = ACS 1
    ecap 000b[160] = Vendor 0pcib3@pci0:0:7:0:	class=0x060400 card=0x130a103c chip=0x340e8086 rev=0x13 hdr=0x01
    vendor     = 'Intel Corporation'
    device     = '5520/5500/X58 I/O Hub PCI Express Root Port 7'
    class      = bridge
    subclass   = PCI-PCI
    cap 0d[40] = PCI Bridge card=0x130a103c
    cap 05[60] = MSI supports 2 messages, vector masks 
    cap 10[90] = PCI-Express 2 root port max data 128(256) ARI disabled
                 link x0(x16) speed 0.0(5.0) ASPM disabled(L0s/L1)
                 slot 4 power limit 75000 mW
    cap 01[e0] = powerspec 3  supports D0 D3  current D0
    ecap 0001[100] = AER 1 0 fatal 0 non-fatal 0 corrected
    ecap 000d[150] = ACS 1
    ecap 000b[160] = Vendor 0none0@pci0:0:16:0:	class=0x080000 card=0x00000000 chip=0x34258086 rev=0x13 hdr=0x00
    vendor     = 'Intel Corporation'
    device     = '7500/5520/5500/X58 Physical and Link Layer Registers Port 0'
    class      = base peripheral
    subclass   = interrupt controller
    cap 09[50] = vendor (length 255) Intel cap 15 version 0

none1@pci0:0:16:1:	class=0x080000 card=0x00000000 chip=0x34268086 rev=0x13 hdr=0x00
    vendor     = 'Intel Corporation'
    device     = '7500/5520/5500/X58 Routing and Protocol Layer Registers Port 0'
    class      = base peripheral
    subclass   = interrupt controller

none2@pci0:0:17:0:	class=0x080000 card=0x00000000 chip=0x34278086 rev=0x13 hdr=0x00
    vendor     = 'Intel Corporation'
    device     = '7500/5520/5500 Physical and Link Layer Registers Port 1'
    class      = base peripheral
    subclass   = interrupt controller
    cap 09[50] = vendor (length 255) Intel cap 15 version 0

none3@pci0:0:17:1:	class=0x080000 card=0x00000000 chip=0x34288086 rev=0x13 hdr=0x00
    vendor     = 'Intel Corporation'
    device     = '7500/5520/5500 Routing & Protocol Layer Register Port 1'
    class      = base peripheral
    subclass   = interrupt controller

none4@pci0:0:20:0:	class=0x080000 card=0x00000000 chip=0x342e8086 rev=0x13 hdr=0x00
    vendor     = 'Intel Corporation'
    device     = '7500/5520/5500/X58 I/O Hub System Management Registers'
    class      = base peripheral
    subclass   = interrupt controller
    cap 10[40] = PCI-Express 2 root endpoint max data 128(128)
                 link x0(x0) ASPM disabled(L0s)

none5@pci0:0:20:1:	class=0x080000 card=0x00000000 chip=0x34228086 rev=0x13 hdr=0x00
    vendor     = 'Intel Corporation'
    device     = '7500/5520/5500/X58 I/O Hub GPIO and Scratch Pad Registers'
    class      = base peripheral
    subclass   = interrupt controller
    cap 10[40] = PCI-Express 2 root endpoint max data 128(128)
                 link x0(x0) ASPM disabled(L0s)

none6@pci0:0:20:2:	class=0x080000 card=0x00000000 chip=0x34238086 rev=0x13 hdr=0x00
    vendor     = 'Intel Corporation'
    device     = '7500/5520/5500/X58 I/O Hub Control Status and RAS Registers'
    class      = base peripheral
    subclass   = interrupt controller
    cap 10[40] = PCI-Express 2 root endpoint max data 128(128)
                 link x0(x0) ASPM disabled(L0s)

none7@pci0:0:21:0:	class=0x080020 card=0x00000000 chip=0x342f8086 rev=0x13 hdr=0x00
    vendor     = 'Intel Corporation'
    device     = '7500/5520/5500/X58 Trusted Execution Technology Registers'
    class      = base peripheral
    subclass   = interrupt controller

uhci0@pci0:0:26:0:	class=0x0c0300 card=0x130a103c chip=0x3a378086 rev=0x00 hdr=0x00
    vendor     = 'Intel Corporation'
    device     = '82801JI (ICH10 Family) USB UHCI Controller'
    class      = serial bus
    subclass   = USB
    bar   [20] = type I/O Port, range 32, base 0xc000, size 32, enabled
    cap 13[50] = PCI Advanced Features: FLR TP

uhci1@pci0:0:26:1:	class=0x0c0300 card=0x130a103c chip=0x3a388086 rev=0x00 hdr=0x00
    vendor     = 'Intel Corporation'
    device     = '82801JI (ICH10 Family) USB UHCI Controller'
    class      = serial bus
    subclass   = USB
    bar   [20] = type I/O Port, range 32, base 0xc020, size 32, enabled
    cap 13[50] = PCI Advanced Features: FLR TP

uhci2@pci0:0:26:2:	class=0x0c0300 card=0x130a103c chip=0x3a398086 rev=0x00 hdr=0x00
    vendor     = 'Intel Corporation'
    device     = '82801JI (ICH10 Family) USB UHCI Controller'
    class      = serial bus
    subclass   = USB
    bar   [20] = type I/O Port, range 32, base 0xc040, size 32, enabled
    cap 13[50] = PCI Advanced Features: FLR TP

ehci0@pci0:0:26:7:	class=0x0c0320 card=0x130a103c chip=0x3a3c8086 rev=0x00 hdr=0x00
    vendor     = 'Intel Corporation'
    device     = '82801JI (ICH10 Family) USB2 EHCI Controller'
    class      = serial bus
    subclass   = USB
    bar   [10] = type Memory, range 32, base 0xe4004800, size 1024, enabled
    cap 01[50] = powerspec 2  supports D0 D3  current D0
    cap 0a[58] = EHCI Debug Port at offset 0xa0 in map 0x14
    cap 13[98] = PCI Advanced Features: FLR TP

hdac1@pci0:0:27:0:	class=0x040300 card=0x130a103c chip=0x3a3e8086 rev=0x00 hdr=0x00
    vendor     = 'Intel Corporation'
    device     = '82801JI (ICH10 Family) HD Audio Controller'
    class      = multimedia
    subclass   = HDA
    bar   [10] = type Memory, range 64, base 0xe4000000, size 16384, enabled
    cap 01[50] = powerspec 2  supports D0 D3  current D0
    cap 05[60] = MSI supports 1 message, 64 bit enabled with 1 message
    cap 10[70] = PCI-Express 1 root endpoint max data 128(128) FLR NS
    ecap 0002[100] = VC 1 max VC1
    ecap 0005[130] = Root Complex Link Declaration 1

pcib4@pci0:0:28:0:	class=0x060400 card=0x130a103c chip=0x3a408086 rev=0x00 hdr=0x01
    vendor     = 'Intel Corporation'
    device     = '82801JI (ICH10 Family) PCI Express Root Port 1'
    class      = bridge
    subclass   = PCI-PCI
    cap 10[40] = PCI-Express 1 root port max data 128(128)
                 link x0(x4) speed 0.0(2.5) ASPM disabled(L0s/L1)
                 slot 3 power limit 10000 mW HotPlug(empty) surprise
    cap 05[80] = MSI supports 1 message 
    cap 0d[90] = PCI Bridge card=0x130a103c
    cap 01[a0] = powerspec 2  supports D0 D3  current D0
    ecap 0002[100] = VC 1 max VC0
    ecap 0005[180] = Root Complex Link Declaration 1

pcib5@pci0:0:28:5:	class=0x060400 card=0x130a103c chip=0x3a4a8086 rev=0x00 hdr=0x01
    vendor     = 'Intel Corporation'
    device     = '82801JI (ICH10 Family) PCI Express Root Port 6'
    class      = bridge
    subclass   = PCI-PCI
    cap 10[40] = PCI-Express 1 root port max data 128(128)
                 link x1(x1) speed 2.5(2.5) ASPM disabled(L0s/L1)
                 slot 0 power limit 0 mW HotPlug(present) surprise
    cap 05[80] = MSI supports 1 message 
    cap 0d[90] = PCI Bridge card=0x130a103c
    cap 01[a0] = powerspec 2  supports D0 D3  current D0
    ecap 0002[100] = VC 1 max VC0
    ecap 0005[180] = Root Complex Link Declaration 1

uhci3@pci0:0:29:0:	class=0x0c0300 card=0x130a103c chip=0x3a348086 rev=0x00 hdr=0x00
    vendor     = 'Intel Corporation'
    device     = '82801JI (ICH10 Family) USB UHCI Controller'
    class      = serial bus
    subclass   = USB
    bar   [20] = type I/O Port, range 32, base 0xc060, size 32, enabled
    cap 13[50] = PCI Advanced Features: FLR TP

uhci4@pci0:0:29:1:	class=0x0c0300 card=0x130a103c chip=0x3a358086 rev=0x00 hdr=0x00
    vendor     = 'Intel Corporation'
    device     = '82801JI (ICH10 Family) USB UHCI Controller'
    class      = serial bus
    subclass   = USB
    bar   [20] = type I/O Port, range 32, base 0xc080, size 32, enabled
    cap 13[50] = PCI Advanced Features: FLR TP

uhci5@pci0:0:29:2:	class=0x0c0300 card=0x130a103c chip=0x3a368086 rev=0x00 hdr=0x00
    vendor     = 'Intel Corporation'
    device     = '82801JI (ICH10 Family) USB UHCI Controller'
    class      = serial bus
    subclass   = USB
    bar   [20] = type I/O Port, range 32, base 0xc0a0, size 32, enabled
    cap 13[50] = PCI Advanced Features: FLR TP

ehci1@pci0:0:29:7:	class=0x0c0320 card=0x130a103c chip=0x3a3a8086 rev=0x00 hdr=0x00
    vendor     = 'Intel Corporation'
    device     = '82801JI (ICH10 Family) USB2 EHCI Controller'
    class      = serial bus
    subclass   = USB
    bar   [10] = type Memory, range 32, base 0xe4004c00, size 1024, enabled
    cap 01[50] = powerspec 2  supports D0 D3  current D0
    cap 0a[58] = EHCI Debug Port at offset 0xa0 in map 0x14
    cap 13[98] = PCI Advanced Features: FLR TP

pcib6@pci0:0:30:0:	class=0x060401 card=0x130a103c chip=0x244e8086 rev=0x90 hdr=0x01
    vendor     = 'Intel Corporation'
    device     = '82801 PCI Bridge'
    class      = bridge
    subclass   = PCI-PCI
    cap 0d[50] = PCI Bridge card=0x130a103c

isab0@pci0:0:31:0:	class=0x060100 card=0x130a103c chip=0x3a168086 rev=0x00 hdr=0x00
    vendor     = 'Intel Corporation'
    device     = '82801JIR (ICH10R) LPC Interface Controller'
    class      = bridge
    subclass   = PCI-ISA
    cap 09[e0] = vendor (length 12) Intel cap 1 version 0
		 features: SATA RAID-5, 4 PCI-e x1 slots

ahci0@pci0:0:31:2:	class=0x010400 card=0x130a103c chip=0x28228086 rev=0x00 hdr=0x00
    vendor     = 'Intel Corporation'
    device     = 'SATA Controller [RAID mode]'
    class      = mass storage
    subclass   = RAID
    bar   [10] = type I/O Port, range 32, base 0xc100, size 8, enabled
    bar   [14] = type I/O Port, range 32, base 0xc110, size 4, enabled
    bar   [18] = type I/O Port, range 32, base 0xc108, size 8, enabled
    bar   [1c] = type I/O Port, range 32, base 0xc114, size 4, enabled
    bar   [20] = type I/O Port, range 32, base 0xc0c0, size 32, enabled
    bar   [24] = type Memory, range 32, base 0xe4004000, size 2048, enabled
    cap 05[80] = MSI supports 16 messages enabled with 16 messages
    cap 01[70] = powerspec 3  supports D0 D3  current D0
    cap 12[a8] = SATA Index-Data Pair
    cap 13[b0] = PCI Advanced Features: FLR TP

em0@pci0:3:0:0:	class=0x020000 card=0x115e8086 chip=0x105e8086 rev=0x06 hdr=0x00
    vendor     = 'Intel Corporation'
    device     = '82571EB/82571GB Gigabit Ethernet Controller D0/D1 (copper applications)'
    class      = network
    subclass   = ethernet
    bar   [10] = type Memory, range 32, base 0xe2000000, size 131072, enabled
    bar   [14] = type Memory, range 32, base 0xe2020000, size 131072, enabled
    bar   [18] = type I/O Port, range 32, base 0xd000, size 32, enabled
    cap 01[c8] = powerspec 2  supports D0 D3  current D0
    cap 05[d0] = MSI supports 1 message, 64 bit enabled with 1 message
    cap 10[e0] = PCI-Express 1 endpoint max data 256(256) RO NS
                 link x4(x4) speed 2.5(2.5) ASPM disabled(L0s)
    ecap 0001[100] = AER 1 0 fatal 1 non-fatal 0 corrected
    ecap 0003[140] = Serial 1 6805caffff33deb0

em1@pci0:3:0:1:	class=0x020000 card=0x115e8086 chip=0x105e8086 rev=0x06 hdr=0x00
    vendor     = 'Intel Corporation'
    device     = '82571EB/82571GB Gigabit Ethernet Controller D0/D1 (copper applications)'
    class      = network
    subclass   = ethernet
    bar   [10] = type Memory, range 32, base 0xe2040000, size 131072, enabled
    bar   [14] = type Memory, range 32, base 0xe2060000, size 131072, enabled
    bar   [18] = type I/O Port, range 32, base 0xd020, size 32, enabled
    cap 01[c8] = powerspec 2  supports D0 D3  current D0
    cap 05[d0] = MSI supports 1 message, 64 bit enabled with 1 message
    cap 10[e0] = PCI-Express 1 endpoint max data 256(256) RO NS
                 link x4(x4) speed 2.5(2.5) ASPM disabled(L0s)
    ecap 0001[100] = AER 1 0 fatal 1 non-fatal 0 corrected
    ecap 0003[140] = Serial 1 6805caffff33deb0

vgapci0@pci0:15:0:0:	class=0x030000 card=0xc5801682 chip=0x67df1002 rev=0xe7 hdr=0x00
    vendor     = 'Advanced Micro Devices, Inc. [AMD/ATI]'
    device     = 'Ellesmere [Radeon RX 470/480/570/570X/580/580X/590]'
    class      = display
    subclass   = VGA
    bar   [10] = type Prefetchable Memory, range 64, base 0xd0000000, size 268435456, enabled
    bar   [18] = type Prefetchable Memory, range 64, base 0xe0000000, size 2097152, enabled
    bar   [20] = type I/O Port, range 32, base 0xe000, size 256, enabled
    bar   [24] = type Memory, range 32, base 0xe1000000, size 262144, enabled
    cap 09[48] = vendor (length 8)
    cap 01[50] = powerspec 3  supports D0 D1 D2 D3  current D0
    cap 10[58] = PCI-Express 2 legacy endpoint max data 256(256) RO NS
                 link x16(x16) speed 2.5(8.0) ASPM disabled(L1)
    cap 05[a0] = MSI supports 1 message, 64 bit enabled with 1 message
    ecap 000b[100] = Vendor 1 ID 1
    ecap 0001[150] = AER 2 0 fatal 1 non-fatal 1 corrected
    ecap 0015[200] = Resizable BAR 1
    ecap 0019[270] = PCIe Sec 1 lane errors 0
    ecap 000f[2b0] = ATS 1
    ecap 0013[2c0] = unknown 1
    ecap 001b[2d0] = unknown 1
    ecap 0018[320] = LTR 1
    ecap 000e[328] = ARI 1
    ecap 001e[370] = unknown 1

hdac0@pci0:15:0:1:	class=0x040300 card=0xaaf01682 chip=0xaaf01002 rev=0x00 hdr=0x00
    vendor     = 'Advanced Micro Devices, Inc. [AMD/ATI]'
    device     = 'Ellesmere HDMI Audio [Radeon RX 470/480 / 570/580/590]'
    class      = multimedia
    subclass   = HDA
    bar   [10] = type Memory, range 64, base 0xe1040000, size 16384, enabled
    cap 09[48] = vendor (length 8)
    cap 01[50] = powerspec 3  supports D0 D1 D2 D3  current D0
    cap 10[58] = PCI-Express 2 legacy endpoint max data 256(256) RO NS
                 link x16(x16) speed 2.5(8.0) ASPM disabled(L1)
    cap 05[a0] = MSI supports 1 message, 64 bit enabled with 1 message
    ecap 000b[100] = Vendor 1 ID 1
    ecap 0001[150] = AER 2 0 fatal 1 non-fatal 1 corrected
    ecap 000e[328] = ARI 1

bge0@pci0:1:0:0:	class=0x020000 card=0x130a103c chip=0x168414e4 rev=0x10 hdr=0x00
    vendor     = 'Broadcom Inc. and subsidiaries'
    device     = 'NetXtreme BCM5764M Gigabit Ethernet PCIe'
    class      = network
    subclass   = ethernet
    bar   [10] = type Memory, range 64, base 0xe3000000, size 65536, enabled
    cap 01[48] = powerspec 3  supports D0 D3  current D0
    cap 03[40] = VPD
    cap 09[60] = vendor (length 108)
    cap 05[50] = MSI supports 1 message, 64 bit 
    cap 10[cc] = PCI-Express 2 endpoint max data 128(256)
                 link x1(x1) speed 2.5(2.5) ASPM disabled(L0s/L1)
    ecap 0001[100] = AER 1 0 fatal 0 non-fatal 0 corrected
    ecap 0002[13c] = VC 1 max VC0
    ecap 0003[160] = Serial 1 78e7d1fffec5d150
    ecap 0004[16c] = Power Budgeting 1

none8@pci0:55:5:0:	class=0x0c0010 card=0x130a103c chip=0x581111c1 rev=0x70 hdr=0x00
    vendor     = 'LSI Corporation'
    device     = 'FW322/323 [TrueFire] 1394a Controller'
    class      = serial bus
    subclass   = FireWire
    bar   [10] = type Memory, range 32, base 0xe5000000, size 4096, enabled
    cap 01[44] = powerspec 2  supports D0 D1 D2 D3  current D0

hostb1@pci0:63:0:0:	class=0x060000 card=0x130a103c chip=0x2c708086 rev=0x02 hdr=0x00
    vendor     = 'Intel Corporation'
    device     = 'Xeon 5600 Series QuickPath Architecture Generic Non-core Registers'
    class      = bridge
    subclass   = HOST-PCI

hostb2@pci0:63:0:1:	class=0x060000 card=0x130a103c chip=0x2d818086 rev=0x02 hdr=0x00
    vendor     = 'Intel Corporation'
    device     = 'Xeon 5600 Series QuickPath Architecture System Address Decoder'
    class      = bridge
    subclass   = HOST-PCI

hostb3@pci0:63:2:0:	class=0x060000 card=0x130a103c chip=0x2d908086 rev=0x02 hdr=0x00
    vendor     = 'Intel Corporation'
    device     = 'Xeon 5600 Series QPI Link 0'
    class      = bridge
    subclass   = HOST-PCI

hostb4@pci0:63:2:1:	class=0x060000 card=0x130a103c chip=0x2d918086 rev=0x02 hdr=0x00
    vendor     = 'Intel Corporation'
    device     = 'Xeon 5600 Series QPI Physical 0'
    class      = bridge
    subclass   = HOST-PCI

hostb5@pci0:63:2:2:	class=0x060000 card=0x130a103c chip=0x2d928086 rev=0x02 hdr=0x00
    vendor     = 'Intel Corporation'
    device     = 'Xeon 5600 Series Mirror Port Link 0'
    class      = bridge
    subclass   = HOST-PCI

hostb6@pci0:63:2:3:	class=0x060000 card=0x130a103c chip=0x2d938086 rev=0x02 hdr=0x00
    vendor     = 'Intel Corporation'
    device     = 'Xeon 5600 Series Mirror Port Link 1'
    class      = bridge
    subclass   = HOST-PCI

hostb7@pci0:63:2:4:	class=0x060000 card=0x130a103c chip=0x2d948086 rev=0x02 hdr=0x00
    vendor     = 'Intel Corporation'
    device     = 'Xeon 5600 Series QPI Link 1'
    class      = bridge
    subclass   = HOST-PCI

hostb8@pci0:63:2:5:	class=0x060000 card=0x130a103c chip=0x2d958086 rev=0x02 hdr=0x00
    vendor     = 'Intel Corporation'
    device     = 'Xeon 5600 Series QPI Physical 1'
    class      = bridge
    subclass   = HOST-PCI

hostb9@pci0:63:3:0:	class=0x060000 card=0x130a103c chip=0x2d988086 rev=0x02 hdr=0x00
    vendor     = 'Intel Corporation'
    device     = 'Xeon 5600 Series Integrated Memory Controller Registers'
    class      = bridge
    subclass   = HOST-PCI

hostb10@pci0:63:3:1:	class=0x060000 card=0x130a103c chip=0x2d998086 rev=0x02 hdr=0x00
    vendor     = 'Intel Corporation'
    device     = 'Xeon 5600 Series Integrated Memory Controller Target Address Decoder'
    class      = bridge
    subclass   = HOST-PCI

hostb11@pci0:63:3:2:	class=0x060000 card=0x130a103c chip=0x2d9a8086 rev=0x02 hdr=0x00
    vendor     = 'Intel Corporation'
    device     = 'Xeon 5600 Series Integrated Memory Controller RAS Registers'
    class      = bridge
    subclass   = HOST-PCI

hostb12@pci0:63:3:4:	class=0x060000 card=0x130a103c chip=0x2d9c8086 rev=0x02 hdr=0x00
    vendor     = 'Intel Corporation'
    device     = 'Xeon 5600 Series Integrated Memory Controller Test Registers'
    class      = bridge
    subclass   = HOST-PCI

hostb13@pci0:63:4:0:	class=0x060000 card=0x130a103c chip=0x2da08086 rev=0x02 hdr=0x00
    vendor     = 'Intel Corporation'
    device     = 'Xeon 5600 Series Integrated Memory Controller Channel 0 Control'
    class      = bridge
    subclass   = HOST-PCI

hostb14@pci0:63:4:1:	class=0x060000 card=0x130a103c chip=0x2da18086 rev=0x02 hdr=0x00
    vendor     = 'Intel Corporation'
    device     = 'Xeon 5600 Series Integrated Memory Controller Channel 0 Address'
    class      = bridge
    subclass   = HOST-PCI

hostb15@pci0:63:4:2:	class=0x060000 card=0x130a103c chip=0x2da28086 rev=0x02 hdr=0x00
    vendor     = 'Intel Corporation'
    device     = 'Xeon 5600 Series Integrated Memory Controller Channel 0 Rank'
    class      = bridge
    subclass   = HOST-PCI

hostb16@pci0:63:4:3:	class=0x060000 card=0x130a103c chip=0x2da38086 rev=0x02 hdr=0x00
    vendor     = 'Intel Corporation'
    device     = 'Xeon 5600 Series Integrated Memory Controller Channel 0 Thermal Control'
    class      = bridge
    subclass   = HOST-PCI

hostb17@pci0:63:5:0:	class=0x060000 card=0x130a103c chip=0x2da88086 rev=0x02 hdr=0x00
    vendor     = 'Intel Corporation'
    device     = 'Xeon 5600 Series Integrated Memory Controller Channel 1 Control'
    class      = bridge
    subclass   = HOST-PCI

hostb18@pci0:63:5:1:	class=0x060000 card=0x130a103c chip=0x2da98086 rev=0x02 hdr=0x00
    vendor     = 'Intel Corporation'
    device     = 'Xeon 5600 Series Integrated Memory Controller Channel 1 Address'
    class      = bridge
    subclass   = HOST-PCI

hostb19@pci0:63:5:2:	class=0x060000 card=0x130a103c chip=0x2daa8086 rev=0x02 hdr=0x00
    vendor     = 'Intel Corporation'
    device     = 'Xeon 5600 Series Integrated Memory Controller Channel 1 Rank'
    class      = bridge
    subclass   = HOST-PCI

hostb20@pci0:63:5:3:	class=0x060000 card=0x130a103c chip=0x2dab8086 rev=0x02 hdr=0x00
    vendor     = 'Intel Corporation'
    device     = 'Xeon 5600 Series Integrated Memory Controller Channel 1 Thermal Control'
    class      = bridge
    subclass   = HOST-PCI

hostb21@pci0:63:6:0:	class=0x060000 card=0x130a103c chip=0x2db08086 rev=0x02 hdr=0x00
    vendor     = 'Intel Corporation'
    device     = 'Xeon 5600 Series Integrated Memory Controller Channel 2 Control'
    class      = bridge
    subclass   = HOST-PCI

hostb22@pci0:63:6:1:	class=0x060000 card=0x130a103c chip=0x2db18086 rev=0x02 hdr=0x00
    vendor     = 'Intel Corporation'
    device     = 'Xeon 5600 Series Integrated Memory Controller Channel 2 Address'
    class      = bridge
    subclass   = HOST-PCI

hostb23@pci0:63:6:2:	class=0x060000 card=0x130a103c chip=0x2db28086 rev=0x02 hdr=0x00
    vendor     = 'Intel Corporation'
    device     = 'Xeon 5600 Series Integrated Memory Controller Channel 2 Rank'
    class      = bridge
    subclass   = HOST-PCI

hostb24@pci0:63:6:3:	class=0x060000 card=0x130a103c chip=0x2db38086 rev=0x02 hdr=0x00
    vendor     = 'Intel Corporation'
    device     = 'Xeon 5600 Series Integrated Memory Controller Channel 2 Thermal Control'
    class      = bridge
    subclass   = HOST-PCI

hostb25@pci0:62:0:0:	class=0x060000 card=0x130a103c chip=0x2c708086 rev=0x02 hdr=0x00
    vendor     = 'Intel Corporation'
    device     = 'Xeon 5600 Series QuickPath Architecture Generic Non-core Registers'
    class      = bridge
    subclass   = HOST-PCI

hostb26@pci0:62:0:1:	class=0x060000 card=0x130a103c chip=0x2d818086 rev=0x02 hdr=0x00
    vendor     = 'Intel Corporation'
    device     = 'Xeon 5600 Series QuickPath Architecture System Address Decoder'
    class      = bridge
    subclass   = HOST-PCI

hostb27@pci0:62:2:0:	class=0x060000 card=0x130a103c chip=0x2d908086 rev=0x02 hdr=0x00
    vendor     = 'Intel Corporation'
    device     = 'Xeon 5600 Series QPI Link 0'
    class      = bridge
    subclass   = HOST-PCI

hostb28@pci0:62:2:1:	class=0x060000 card=0x130a103c chip=0x2d918086 rev=0x02 hdr=0x00
    vendor     = 'Intel Corporation'
    device     = 'Xeon 5600 Series QPI Physical 0'
    class      = bridge
    subclass   = HOST-PCI

hostb29@pci0:62:2:2:	class=0x060000 card=0x130a103c chip=0x2d928086 rev=0x02 hdr=0x00
    vendor     = 'Intel Corporation'
    device     = 'Xeon 5600 Series Mirror Port Link 0'
    class      = bridge
    subclass   = HOST-PCI

hostb30@pci0:62:2:3:	class=0x060000 card=0x130a103c chip=0x2d938086 rev=0x02 hdr=0x00
    vendor     = 'Intel Corporation'
    device     = 'Xeon 5600 Series Mirror Port Link 1'
    class      = bridge
    subclass   = HOST-PCI

hostb31@pci0:62:2:4:	class=0x060000 card=0x130a103c chip=0x2d948086 rev=0x02 hdr=0x00
    vendor     = 'Intel Corporation'
    device     = 'Xeon 5600 Series QPI Link 1'
    class      = bridge
    subclass   = HOST-PCI

hostb32@pci0:62:2:5:	class=0x060000 card=0x130a103c chip=0x2d958086 rev=0x02 hdr=0x00
    vendor     = 'Intel Corporation'
    device     = 'Xeon 5600 Series QPI Physical 1'
    class      = bridge
    subclass   = HOST-PCI

hostb33@pci0:62:3:0:	class=0x060000 card=0x130a103c chip=0x2d988086 rev=0x02 hdr=0x00
    vendor     = 'Intel Corporation'
    device     = 'Xeon 5600 Series Integrated Memory Controller Registers'
    class      = bridge
    subclass   = HOST-PCI

hostb34@pci0:62:3:1:	class=0x060000 card=0x130a103c chip=0x2d998086 rev=0x02 hdr=0x00
    vendor     = 'Intel Corporation'
    device     = 'Xeon 5600 Series Integrated Memory Controller Target Address Decoder'
    class      = bridge
    subclass   = HOST-PCI

hostb35@pci0:62:3:2:	class=0x060000 card=0x130a103c chip=0x2d9a8086 rev=0x02 hdr=0x00
    vendor     = 'Intel Corporation'
    device     = 'Xeon 5600 Series Integrated Memory Controller RAS Registers'
    class      = bridge
    subclass   = HOST-PCI

hostb36@pci0:62:3:4:	class=0x060000 card=0x130a103c chip=0x2d9c8086 rev=0x02 hdr=0x00
    vendor     = 'Intel Corporation'
    device     = 'Xeon 5600 Series Integrated Memory Controller Test Registers'
    class      = bridge
    subclass   = HOST-PCI

hostb37@pci0:62:4:0:	class=0x060000 card=0x130a103c chip=0x2da08086 rev=0x02 hdr=0x00
    vendor     = 'Intel Corporation'
    device     = 'Xeon 5600 Series Integrated Memory Controller Channel 0 Control'
    class      = bridge
    subclass   = HOST-PCI

hostb38@pci0:62:4:1:	class=0x060000 card=0x130a103c chip=0x2da18086 rev=0x02 hdr=0x00
    vendor     = 'Intel Corporation'
    device     = 'Xeon 5600 Series Integrated Memory Controller Channel 0 Address'
    class      = bridge
    subclass   = HOST-PCI

hostb39@pci0:62:4:2:	class=0x060000 card=0x130a103c chip=0x2da28086 rev=0x02 hdr=0x00
    vendor     = 'Intel Corporation'
    device     = 'Xeon 5600 Series Integrated Memory Controller Channel 0 Rank'
    class      = bridge
    subclass   = HOST-PCI

hostb40@pci0:62:4:3:	class=0x060000 card=0x130a103c chip=0x2da38086 rev=0x02 hdr=0x00
    vendor     = 'Intel Corporation'
    device     = 'Xeon 5600 Series Integrated Memory Controller Channel 0 Thermal Control'
    class      = bridge
    subclass   = HOST-PCI

hostb41@pci0:62:5:0:	class=0x060000 card=0x130a103c chip=0x2da88086 rev=0x02 hdr=0x00
    vendor     = 'Intel Corporation'
    device     = 'Xeon 5600 Series Integrated Memory Controller Channel 1 Control'
    class      = bridge
    subclass   = HOST-PCI

hostb42@pci0:62:5:1:	class=0x060000 card=0x130a103c chip=0x2da98086 rev=0x02 hdr=0x00
    vendor     = 'Intel Corporation'
    device     = 'Xeon 5600 Series Integrated Memory Controller Channel 1 Address'
    class      = bridge
    subclass   = HOST-PCI

hostb43@pci0:62:5:2:	class=0x060000 card=0x130a103c chip=0x2daa8086 rev=0x02 hdr=0x00
    vendor     = 'Intel Corporation'
    device     = 'Xeon 5600 Series Integrated Memory Controller Channel 1 Rank'
    class      = bridge
    subclass   = HOST-PCI

hostb44@pci0:62:5:3:	class=0x060000 card=0x130a103c chip=0x2dab8086 rev=0x02 hdr=0x00
    vendor     = 'Intel Corporation'
    device     = 'Xeon 5600 Series Integrated Memory Controller Channel 1 Thermal Control'
    class      = bridge
    subclass   = HOST-PCI

hostb45@pci0:62:6:0:	class=0x060000 card=0x130a103c chip=0x2db08086 rev=0x02 hdr=0x00
    vendor     = 'Intel Corporation'
    device     = 'Xeon 5600 Series Integrated Memory Controller Channel 2 Control'
    class      = bridge
    subclass   = HOST-PCI

hostb46@pci0:62:6:1:	class=0x060000 card=0x130a103c chip=0x2db18086 rev=0x02 hdr=0x00
    vendor     = 'Intel Corporation'
    device     = 'Xeon 5600 Series Integrated Memory Controller Channel 2 Address'
    class      = bridge
    subclass   = HOST-PCI

hostb47@pci0:62:6:2:	class=0x060000 card=0x130a103c chip=0x2db28086 rev=0x02 hdr=0x00
    vendor     = 'Intel Corporation'
    device     = 'Xeon 5600 Series Integrated Memory Controller Channel 2 Rank'
    class      = bridge
    subclass   = HOST-PCI

hostb48@pci0:62:6:3:	class=0x060000 card=0x130a103c chip=0x2db38086 rev=0x02 hdr=0x00
    vendor     = 'Intel Corporation'
    device     = 'Xeon 5600 Series Integrated Memory Controller Channel 2 Thermal Control'
    class      = bridge
    subclass   = HOST-PCI
