none0@pci0:255:11:0:	class=0x088000 card=0x2f811849 chip=0x2f818086 rev=0x02 hdr=0x00
    vendor     = 'Intel Corporation'
    device     = 'Xeon E7 v3/Xeon E5 v3/Core i7 R3 QPI Link 0 & 1 Monitoring'
    class      = base peripheral

none1@pci0:255:11:1:	class=0x110100 card=0x2f361849 chip=0x2f368086 rev=0x02 hdr=0x00
    vendor     = 'Intel Corporation'
    device     = 'Xeon E7 v3/Xeon E5 v3/Core i7 R3 QPI Link 0 & 1 Monitoring'
    class      = dasp
    subclass   = performance counters

none2@pci0:255:11:2:	class=0x110100 card=0x2f371849 chip=0x2f378086 rev=0x02 hdr=0x00
    vendor     = 'Intel Corporation'
    device     = 'Xeon E7 v3/Xeon E5 v3/Core i7 R3 QPI Link 0 & 1 Monitoring'
    class      = dasp
    subclass   = performance counters

none3@pci0:255:12:0:	class=0x088000 card=0x2fe01849 chip=0x2fe08086 rev=0x02 hdr=0x00
    vendor     = 'Intel Corporation'
    device     = 'Xeon E7 v3/Xeon E5 v3/Core i7 Unicast Registers'
    class      = base peripheral

none4@pci0:255:12:1:	class=0x088000 card=0x2fe11849 chip=0x2fe18086 rev=0x02 hdr=0x00
    vendor     = 'Intel Corporation'
    device     = 'Xeon E7 v3/Xeon E5 v3/Core i7 Unicast Registers'
    class      = base peripheral

none5@pci0:255:12:2:	class=0x088000 card=0x2fe21849 chip=0x2fe28086 rev=0x02 hdr=0x00
    vendor     = 'Intel Corporation'
    device     = 'Xeon E7 v3/Xeon E5 v3/Core i7 Unicast Registers'
    class      = base peripheral

none6@pci0:255:12:3:	class=0x088000 card=0x2fe31849 chip=0x2fe38086 rev=0x02 hdr=0x00
    vendor     = 'Intel Corporation'
    device     = 'Xeon E7 v3/Xeon E5 v3/Core i7 Unicast Registers'
    class      = base peripheral

none7@pci0:255:12:4:	class=0x088000 card=0x2fe41849 chip=0x2fe48086 rev=0x02 hdr=0x00
    vendor     = 'Intel Corporation'
    device     = 'Xeon E7 v3/Xeon E5 v3/Core i7 Unicast Registers'
    class      = base peripheral

none8@pci0:255:12:5:	class=0x088000 card=0x2fe51849 chip=0x2fe58086 rev=0x02 hdr=0x00
    vendor     = 'Intel Corporation'
    device     = 'Xeon E7 v3/Xeon E5 v3/Core i7 Unicast Registers'
    class      = base peripheral

none9@pci0:255:15:0:	class=0x088000 card=0x00000000 chip=0x2ff88086 rev=0x02 hdr=0x00
    vendor     = 'Intel Corporation'
    device     = 'Xeon E7 v3/Xeon E5 v3/Core i7 Buffered Ring Agent'
    class      = base peripheral

none10@pci0:255:15:1:	class=0x088000 card=0x00000000 chip=0x2ff98086 rev=0x02 hdr=0x00
    vendor     = 'Intel Corporation'
    device     = 'Xeon E7 v3/Xeon E5 v3/Core i7 Buffered Ring Agent'
    class      = base peripheral

none11@pci0:255:15:4:	class=0x088000 card=0x2fe01849 chip=0x2ffc8086 rev=0x02 hdr=0x00
    vendor     = 'Intel Corporation'
    device     = 'Xeon E7 v3/Xeon E5 v3/Core i7 System Address Decoder & Broadcast Registers'
    class      = base peripheral

none12@pci0:255:15:5:	class=0x088000 card=0x2fe01849 chip=0x2ffd8086 rev=0x02 hdr=0x00
    vendor     = 'Intel Corporation'
    device     = 'Xeon E7 v3/Xeon E5 v3/Core i7 System Address Decoder & Broadcast Registers'
    class      = base peripheral

none13@pci0:255:15:6:	class=0x088000 card=0x2fe01849 chip=0x2ffe8086 rev=0x02 hdr=0x00
    vendor     = 'Intel Corporation'
    device     = 'Xeon E7 v3/Xeon E5 v3/Core i7 System Address Decoder & Broadcast Registers'
    class      = base peripheral

none14@pci0:255:16:0:	class=0x088000 card=0x2f1d1849 chip=0x2f1d8086 rev=0x02 hdr=0x00
    vendor     = 'Intel Corporation'
    device     = 'Xeon E7 v3/Xeon E5 v3/Core i7 PCIe Ring Interface'
    class      = base peripheral

none15@pci0:255:16:1:	class=0x110100 card=0x2f341849 chip=0x2f348086 rev=0x02 hdr=0x00
    vendor     = 'Intel Corporation'
    device     = 'Xeon E7 v3/Xeon E5 v3/Core i7 PCIe Ring Interface'
    class      = dasp
    subclass   = performance counters

none16@pci0:255:16:5:	class=0x088000 card=0x2f1e1849 chip=0x2f1e8086 rev=0x02 hdr=0x00
    vendor     = 'Intel Corporation'
    device     = 'Xeon E7 v3/Xeon E5 v3/Core i7 Scratchpad & Semaphore Registers'
    class      = base peripheral

none17@pci0:255:16:6:	class=0x110100 card=0x2f7d1849 chip=0x2f7d8086 rev=0x02 hdr=0x00
    vendor     = 'Intel Corporation'
    device     = 'Xeon E7 v3/Xeon E5 v3/Core i7 Scratchpad & Semaphore Registers'
    class      = dasp
    subclass   = performance counters

none18@pci0:255:16:7:	class=0x088000 card=0x2f1f1849 chip=0x2f1f8086 rev=0x02 hdr=0x00
    vendor     = 'Intel Corporation'
    device     = 'Xeon E7 v3/Xeon E5 v3/Core i7 Scratchpad & Semaphore Registers'
    class      = base peripheral

none19@pci0:255:18:0:	class=0x088000 card=0x2fa01849 chip=0x2fa08086 rev=0x02 hdr=0x00
    vendor     = 'Intel Corporation'
    device     = 'Xeon E7 v3/Xeon E5 v3/Core i7 Home Agent 0'
    class      = base peripheral

none20@pci0:255:18:1:	class=0x110100 card=0x2f301849 chip=0x2f308086 rev=0x02 hdr=0x00
    vendor     = 'Intel Corporation'
    device     = 'Xeon E7 v3/Xeon E5 v3/Core i7 Home Agent 0'
    class      = dasp
    subclass   = performance counters

none21@pci0:255:19:0:	class=0x088000 card=0x2fa81849 chip=0x2fa88086 rev=0x02 hdr=0x00
    vendor     = 'Intel Corporation'
    device     = 'Xeon E7 v3/Xeon E5 v3/Core i7 Integrated Memory Controller 0 Target Address, Thermal & RAS Registers'
    class      = base peripheral

none22@pci0:255:19:1:	class=0x088000 card=0x2f711849 chip=0x2f718086 rev=0x02 hdr=0x00
    vendor     = 'Intel Corporation'
    device     = 'Xeon E7 v3/Xeon E5 v3/Core i7 Integrated Memory Controller 0 Target Address, Thermal & RAS Registers'
    class      = base peripheral

none23@pci0:255:19:2:	class=0x088000 card=0x2faa1849 chip=0x2faa8086 rev=0x02 hdr=0x00
    vendor     = 'Intel Corporation'
    device     = 'Xeon E7 v3/Xeon E5 v3/Core i7 Integrated Memory Controller 0 Channel Target Address Decoder'
    class      = base peripheral

none24@pci0:255:19:3:	class=0x088000 card=0x2fab1849 chip=0x2fab8086 rev=0x02 hdr=0x00
    vendor     = 'Intel Corporation'
    device     = 'Xeon E7 v3/Xeon E5 v3/Core i7 Integrated Memory Controller 0 Channel Target Address Decoder'
    class      = base peripheral

none25@pci0:255:19:4:	class=0x088000 card=0x2fac1849 chip=0x2fac8086 rev=0x02 hdr=0x00
    vendor     = 'Intel Corporation'
    device     = 'Xeon E7 v3/Xeon E5 v3/Core i7 Integrated Memory Controller 0 Channel Target Address Decoder'
    class      = base peripheral

none26@pci0:255:19:5:	class=0x088000 card=0x2fad1849 chip=0x2fad8086 rev=0x02 hdr=0x00
    vendor     = 'Intel Corporation'
    device     = 'Xeon E7 v3/Xeon E5 v3/Core i7 Integrated Memory Controller 0 Channel Target Address Decoder'
    class      = base peripheral

none27@pci0:255:19:6:	class=0x088000 card=0x00000000 chip=0x2fae8086 rev=0x02 hdr=0x00
    vendor     = 'Intel Corporation'
    device     = 'Xeon E7 v3/Xeon E5 v3/Core i7 DDRIO Channel 0/1 Broadcast'
    class      = base peripheral

none28@pci0:255:19:7:	class=0x088000 card=0x00000000 chip=0x2faf8086 rev=0x02 hdr=0x00
    vendor     = 'Intel Corporation'
    device     = 'Xeon E7 v3/Xeon E5 v3/Core i7 DDRIO Global Broadcast'
    class      = base peripheral

none29@pci0:255:20:0:	class=0x088000 card=0x2fb01849 chip=0x2fb08086 rev=0x02 hdr=0x00
    vendor     = 'Intel Corporation'
    device     = 'Xeon E7 v3/Xeon E5 v3/Core i7 Integrated Memory Controller 0 Channel 0 Thermal Control'
    class      = base peripheral

none30@pci0:255:20:1:	class=0x088000 card=0x2fb11849 chip=0x2fb18086 rev=0x02 hdr=0x00
    vendor     = 'Intel Corporation'
    device     = 'Xeon E7 v3/Xeon E5 v3/Core i7 Integrated Memory Controller 0 Channel 1 Thermal Control'
    class      = base peripheral

none31@pci0:255:20:2:	class=0x088000 card=0x2fb21849 chip=0x2fb28086 rev=0x02 hdr=0x00
    vendor     = 'Intel Corporation'
    device     = 'Xeon E7 v3/Xeon E5 v3/Core i7 Integrated Memory Controller 0 Channel 0 ERROR Registers'
    class      = base peripheral

none32@pci0:255:20:3:	class=0x088000 card=0x2fb31849 chip=0x2fb38086 rev=0x02 hdr=0x00
    vendor     = 'Intel Corporation'
    device     = 'Xeon E7 v3/Xeon E5 v3/Core i7 Integrated Memory Controller 0 Channel 1 ERROR Registers'
    class      = base peripheral

none33@pci0:255:20:4:	class=0x088000 card=0x00000000 chip=0x2fbc8086 rev=0x02 hdr=0x00
    vendor     = 'Intel Corporation'
    device     = 'Xeon E7 v3/Xeon E5 v3/Core i7 DDRIO (VMSE) 0 & 1'
    class      = base peripheral

none34@pci0:255:20:5:	class=0x088000 card=0x00000000 chip=0x2fbd8086 rev=0x02 hdr=0x00
    vendor     = 'Intel Corporation'
    device     = 'Xeon E7 v3/Xeon E5 v3/Core i7 DDRIO (VMSE) 0 & 1'
    class      = base peripheral

none35@pci0:255:20:6:	class=0x088000 card=0x00000000 chip=0x2fbe8086 rev=0x02 hdr=0x00
    vendor     = 'Intel Corporation'
    device     = 'Xeon E7 v3/Xeon E5 v3/Core i7 DDRIO (VMSE) 0 & 1'
    class      = base peripheral

none36@pci0:255:20:7:	class=0x088000 card=0x00000000 chip=0x2fbf8086 rev=0x02 hdr=0x00
    vendor     = 'Intel Corporation'
    device     = 'Xeon E7 v3/Xeon E5 v3/Core i7 DDRIO (VMSE) 0 & 1'
    class      = base peripheral

none37@pci0:255:21:0:	class=0x088000 card=0x2fb41849 chip=0x2fb48086 rev=0x02 hdr=0x00
    vendor     = 'Intel Corporation'
    device     = 'Xeon E7 v3/Xeon E5 v3/Core i7 Integrated Memory Controller 0 Channel 2 Thermal Control'
    class      = base peripheral

none38@pci0:255:21:1:	class=0x088000 card=0x2fb51849 chip=0x2fb58086 rev=0x02 hdr=0x00
    vendor     = 'Intel Corporation'
    device     = 'Xeon E7 v3/Xeon E5 v3/Core i7 Integrated Memory Controller 0 Channel 3 Thermal Control'
    class      = base peripheral

none39@pci0:255:21:2:	class=0x088000 card=0x2fb61849 chip=0x2fb68086 rev=0x02 hdr=0x00
    vendor     = 'Intel Corporation'
    device     = 'Xeon E7 v3/Xeon E5 v3/Core i7 Integrated Memory Controller 0 Channel 2 ERROR Registers'
    class      = base peripheral

none40@pci0:255:21:3:	class=0x088000 card=0x2fb71849 chip=0x2fb78086 rev=0x02 hdr=0x00
    vendor     = 'Intel Corporation'
    device     = 'Xeon E7 v3/Xeon E5 v3/Core i7 Integrated Memory Controller 0 Channel 3 ERROR Registers'
    class      = base peripheral

none41@pci0:255:22:0:	class=0x088000 card=0x00000000 chip=0x2f688086 rev=0x02 hdr=0x00
    vendor     = 'Intel Corporation'
    device     = 'Xeon E7 v3/Xeon E5 v3/Core i7 Integrated Memory Controller 1 Target Address, Thermal & RAS Registers'
    class      = base peripheral

none42@pci0:255:22:6:	class=0x088000 card=0x00000000 chip=0x2f6e8086 rev=0x02 hdr=0x00
    vendor     = 'Intel Corporation'
    device     = 'Xeon E7 v3/Xeon E5 v3/Core i7 DDRIO Channel 2/3 Broadcast'
    class      = base peripheral

none43@pci0:255:22:7:	class=0x088000 card=0x00000000 chip=0x2f6f8086 rev=0x02 hdr=0x00
    vendor     = 'Intel Corporation'
    device     = 'Xeon E7 v3/Xeon E5 v3/Core i7 DDRIO Global Broadcast'
    class      = base peripheral

none44@pci0:255:23:0:	class=0x088000 card=0x00000000 chip=0x2fd08086 rev=0x02 hdr=0x00
    vendor     = 'Intel Corporation'
    device     = 'Xeon E7 v3/Xeon E5 v3/Core i7 Integrated Memory Controller 1 Channel 0 Thermal Control'
    class      = base peripheral

none45@pci0:255:23:4:	class=0x088000 card=0x00000000 chip=0x2fb88086 rev=0x02 hdr=0x00
    vendor     = 'Intel Corporation'
    device     = 'Xeon E7 v3/Xeon E5 v3/Core i7 DDRIO (VMSE) 2 & 3'
    class      = base peripheral

none46@pci0:255:23:5:	class=0x088000 card=0x00000000 chip=0x2fb98086 rev=0x02 hdr=0x00
    vendor     = 'Intel Corporation'
    device     = 'Xeon E7 v3/Xeon E5 v3/Core i7 DDRIO (VMSE) 2 & 3'
    class      = base peripheral

none47@pci0:255:23:6:	class=0x088000 card=0x00000000 chip=0x2fba8086 rev=0x02 hdr=0x00
    vendor     = 'Intel Corporation'
    device     = 'Xeon E7 v3/Xeon E5 v3/Core i7 DDRIO (VMSE) 2 & 3'
    class      = base peripheral

none48@pci0:255:23:7:	class=0x088000 card=0x00000000 chip=0x2fbb8086 rev=0x02 hdr=0x00
    vendor     = 'Intel Corporation'
    device     = 'Xeon E7 v3/Xeon E5 v3/Core i7 DDRIO (VMSE) 2 & 3'
    class      = base peripheral

none49@pci0:255:30:0:	class=0x088000 card=0x2f981849 chip=0x2f988086 rev=0x02 hdr=0x00
    vendor     = 'Intel Corporation'
    device     = 'Xeon E7 v3/Xeon E5 v3/Core i7 Power Control Unit'
    class      = base peripheral

none50@pci0:255:30:1:	class=0x088000 card=0x2f991849 chip=0x2f998086 rev=0x02 hdr=0x00
    vendor     = 'Intel Corporation'
    device     = 'Xeon E7 v3/Xeon E5 v3/Core i7 Power Control Unit'
    class      = base peripheral

none51@pci0:255:30:2:	class=0x088000 card=0x2f9a1849 chip=0x2f9a8086 rev=0x02 hdr=0x00
    vendor     = 'Intel Corporation'
    device     = 'Xeon E7 v3/Xeon E5 v3/Core i7 Power Control Unit'
    class      = base peripheral

none52@pci0:255:30:3:	class=0x088000 card=0x2fc01849 chip=0x2fc08086 rev=0x02 hdr=0x00
    vendor     = 'Intel Corporation'
    device     = 'Xeon E7 v3/Xeon E5 v3/Core i7 Power Control Unit'
    class      = base peripheral

none53@pci0:255:30:4:	class=0x088000 card=0x2f9c1849 chip=0x2f9c8086 rev=0x02 hdr=0x00
    vendor     = 'Intel Corporation'
    device     = 'Xeon E7 v3/Xeon E5 v3/Core i7 Power Control Unit'
    class      = base peripheral

none54@pci0:255:31:0:	class=0x088000 card=0x00000000 chip=0x2f888086 rev=0x02 hdr=0x00
    vendor     = 'Intel Corporation'
    device     = 'Xeon E7 v3/Xeon E5 v3/Core i7 VCU'
    class      = base peripheral

none55@pci0:255:31:2:	class=0x088000 card=0x00000000 chip=0x2f8a8086 rev=0x02 hdr=0x00
    vendor     = 'Intel Corporation'
    device     = 'Xeon E7 v3/Xeon E5 v3/Core i7 VCU'
    class      = base peripheral

hostb0@pci0:0:0:0:	class=0x060000 card=0x2f001849 chip=0x2f008086 rev=0x02 hdr=0x00
    vendor     = 'Intel Corporation'
    device     = 'Xeon E7 v3/Xeon E5 v3/Core i7 DMI2'
    class      = bridge
    subclass   = HOST-PCI
    cap 10[90] = PCI-Express 2 root port max data 128(128)
                 link x0(x4) speed 0.0(5.0) ASPM disabled(L1)
    cap 01[e0] = powerspec 3  supports D0 D3  current D0
    ecap 000b[100] = Vendor 1 ID 2
    ecap 000b[144] = Vendor 1 ID 4
    ecap 000b[1d0] = Vendor 1 ID 3
    ecap 000b[280] = Vendor 1 ID 5
    ecap 000b[300] = Vendor 1 ID 8

pcib2@pci0:0:1:0:	class=0x060400 card=0x2f021849 chip=0x2f028086 rev=0x02 hdr=0x01
    vendor     = 'Intel Corporation'
    device     = 'Xeon E7 v3/Xeon E5 v3/Core i7 PCI Express Root Port 1'
    class      = bridge
    subclass   = PCI-PCI
    cap 0d[40] = PCI Bridge card=0x2f021849
    cap 05[60] = MSI supports 2 messages, vector masks enabled with 1 message
    cap 10[90] = PCI-Express 2 root port max data 256(256) ARI disabled
                 link x4(x4) speed 8.0(8.0)
                 slot 2 power limit 0 mW
    cap 01[e0] = powerspec 3  supports D0 D3  current D0
    ecap 000b[100] = Vendor 1 ID 2
    ecap 000d[110] = ACS 1
    ecap 0001[148] = AER 1 0 fatal 0 non-fatal 0 corrected
    ecap 000b[1d0] = Vendor 1 ID 3
    ecap 0019[250] = PCIe Sec 1 lane errors 0
    ecap 000b[280] = Vendor 1 ID 5
    ecap 000b[300] = Vendor 1 ID 8

pcib3@pci0:0:1:1:	class=0x060400 card=0x00008086 chip=0x2f038086 rev=0x02 hdr=0x01
    vendor     = 'Intel Corporation'
    device     = 'Xeon E7 v3/Xeon E5 v3/Core i7 PCI Express Root Port 1'
    class      = bridge
    subclass   = PCI-PCI
    cap 0d[40] = PCI Bridge card=0x00008086
    cap 05[60] = MSI supports 2 messages, vector masks enabled with 1 message
    cap 10[90] = PCI-Express 2 root port max data 128(256) ARI disabled
                 link x0(x4) speed 0.0(8.0)
                 slot 2 power limit 0 mW
    cap 01[e0] = powerspec 3  supports D0 D3  current D0
    ecap 000b[100] = Vendor 1 ID 2
    ecap 000d[110] = ACS 1
    ecap 0001[148] = AER 1 0 fatal 0 non-fatal 0 corrected
    ecap 000b[1d0] = Vendor 1 ID 3
    ecap 0019[250] = PCIe Sec 1 lane errors 0
    ecap 000b[280] = Vendor 1 ID 5
    ecap 000b[300] = Vendor 1 ID 8

pcib4@pci0:0:2:0:	class=0x060400 card=0x2f041849 chip=0x2f048086 rev=0x02 hdr=0x01
    vendor     = 'Intel Corporation'
    device     = 'Xeon E7 v3/Xeon E5 v3/Core i7 PCI Express Root Port 2'
    class      = bridge
    subclass   = PCI-PCI
    cap 0d[40] = PCI Bridge card=0x2f041849
    cap 05[60] = MSI supports 2 messages, vector masks enabled with 1 message
    cap 10[90] = PCI-Express 2 root port max data 128(256) ARI disabled
                 link x16(x16) speed 2.5(8.0)
                 slot 6 power limit 0 mW
    cap 01[e0] = powerspec 3  supports D0 D3  current D0
    ecap 000b[100] = Vendor 1 ID 2
    ecap 000d[110] = ACS 1
    ecap 0001[148] = AER 1 0 fatal 0 non-fatal 0 corrected
    ecap 000b[1d0] = Vendor 1 ID 3
    ecap 0019[250] = PCIe Sec 1 lane errors 0
    ecap 000b[280] = Vendor 1 ID 5
    ecap 000b[300] = Vendor 1 ID 8

pcib5@pci0:0:3:0:	class=0x060400 card=0x2f081849 chip=0x2f088086 rev=0x02 hdr=0x01
    vendor     = 'Intel Corporation'
    device     = 'Xeon E7 v3/Xeon E5 v3/Core i7 PCI Express Root Port 3'
    class      = bridge
    subclass   = PCI-PCI
    cap 0d[40] = PCI Bridge card=0x2f081849
    cap 05[60] = MSI supports 2 messages, vector masks enabled with 1 message
    cap 10[90] = PCI-Express 2 root port max data 256(256) ARI disabled
                 link x16(x16) speed 8.0(8.0)
                 slot 4 power limit 0 mW
    cap 01[e0] = powerspec 3  supports D0 D3  current D0
    ecap 000b[100] = Vendor 1 ID 2
    ecap 000d[110] = ACS 1
    ecap 0001[148] = AER 1 0 fatal 0 non-fatal 0 corrected
    ecap 000b[1d0] = Vendor 1 ID 3
    ecap 0019[250] = PCIe Sec 1 lane errors 0
    ecap 000b[280] = Vendor 1 ID 5
    ecap 000b[300] = Vendor 1 ID 8

none56@pci0:0:5:0:	class=0x088000 card=0x2f281849 chip=0x2f288086 rev=0x02 hdr=0x00
    vendor     = 'Intel Corporation'
    device     = 'Xeon E7 v3/Xeon E5 v3/Core i7 Address Map, VTd_Misc, System Management'
    class      = base peripheral
    cap 10[40] = PCI-Express 2 root endpoint max data 128(128)

none57@pci0:0:5:1:	class=0x088000 card=0x2f291849 chip=0x2f298086 rev=0x02 hdr=0x00
    vendor     = 'Intel Corporation'
    device     = 'Xeon E7 v3/Xeon E5 v3/Core i7 Hot Plug'
    class      = base peripheral
    cap 10[40] = PCI-Express 1 root endpoint max data 128(128)
    cap 05[80] = MSI supports 1 message, 64 bit 
    ecap 000b[100] = Vendor 1 ID 6
    ecap 000b[110] = Vendor 1 ID 6
    ecap 000b[120] = Vendor 1 ID 6
    ecap 000b[130] = Vendor 1 ID 6

none58@pci0:0:5:2:	class=0x088000 card=0x2f2a1849 chip=0x2f2a8086 rev=0x02 hdr=0x00
    vendor     = 'Intel Corporation'
    device     = 'Xeon E7 v3/Xeon E5 v3/Core i7 RAS, Control Status and Global Errors'
    class      = base peripheral
    cap 10[40] = PCI-Express 2 root endpoint max data 128(128) RO NS

ioapic0@pci0:0:5:4:	class=0x080020 card=0x2f2c1849 chip=0x2f2c8086 rev=0x02 hdr=0x00
    vendor     = 'Intel Corporation'
    device     = 'Xeon E7 v3/Xeon E5 v3/Core i7 I/O APIC'
    class      = base peripheral
    subclass   = interrupt controller
    bar   [10] = type Memory, range 32, base 0xfb63e000, size 4096, enabled
    cap 10[44] = PCI-Express 1 root endpoint max data 128(128)
    cap 01[e0] = powerspec 3  supports D0 D3  current D0

none59@pci0:0:17:0:	class=0xff0000 card=0x8d7c1849 chip=0x8d7c8086 rev=0x05 hdr=0x00
    vendor     = 'Intel Corporation'
    device     = 'C610/X99 series chipset SPSR'
    cap 10[40] = PCI-Express 2 root endpoint max data 128(128)
                 link x1(x1) speed 2.5(2.5) ASPM disabled(L0s/L1)
    cap 01[80] = powerspec 3  supports D0 D3  current D0

ahci0@pci0:0:17:4:	class=0x010601 card=0x8d621849 chip=0x8d628086 rev=0x05 hdr=0x00
    vendor     = 'Intel Corporation'
    device     = 'C610/X99 series chipset sSATA Controller [AHCI mode]'
    class      = mass storage
    subclass   = SATA
    bar   [10] = type I/O Port, range 32, base 0xf130, size 8, enabled
    bar   [14] = type I/O Port, range 32, base 0xf120, size 4, enabled
    bar   [18] = type I/O Port, range 32, base 0xf110, size 8, enabled
    bar   [1c] = type I/O Port, range 32, base 0xf100, size 4, enabled
    bar   [20] = type I/O Port, range 32, base 0xf040, size 32, enabled
    bar   [24] = type Memory, range 32, base 0xfb63d000, size 2048, enabled
    cap 05[80] = MSI supports 1 message enabled with 1 message
    cap 01[70] = powerspec 3  supports D0 D3  current D0
    cap 12[a8] = SATA Index-Data Pair

xhci0@pci0:0:20:0:	class=0x0c0330 card=0x8d311849 chip=0x8d318086 rev=0x05 hdr=0x00
    vendor     = 'Intel Corporation'
    device     = 'C610/X99 series chipset USB xHCI Host Controller'
    class      = serial bus
    subclass   = USB
    bar   [10] = type Memory, range 64, base 0xfb620000, size 65536, enabled
    cap 01[70] = powerspec 2  supports D0 D3  current D0

none60@pci0:0:22:0:	class=0x078000 card=0x8d3a1849 chip=0x8d3a8086 rev=0x05 hdr=0x00
    vendor     = 'Intel Corporation'
    device     = 'C610/X99 series chipset MEI Controller'
    class      = simple comms
    bar   [10] = type Memory, range 64, base 0xfb63c000, size 16, enabled
    cap 01[50] = powerspec 3  supports D0 D3  current D0
    cap 05[8c] = MSI supports 1 message, 64 bit 

em0@pci0:0:25:0:	class=0x020000 card=0x15a11849 chip=0x15a18086 rev=0x05 hdr=0x00
    vendor     = 'Intel Corporation'
    device     = 'Ethernet Connection (2) I218-V'
    class      = network
    subclass   = ethernet
    bar   [10] = type Memory, range 32, base 0xfb600000, size 131072, enabled
    bar   [14] = type Memory, range 32, base 0xfb639000, size 4096, enabled
    bar   [18] = type I/O Port, range 32, base 0xf020, size 32, enabled
    cap 01[c8] = powerspec 2  supports D0 D3  current D0
    cap 05[d0] = MSI supports 1 message, 64 bit enabled with 1 message
    cap 13[e0] = PCI Advanced Features: FLR TP

ehci0@pci0:0:26:0:	class=0x0c0320 card=0x8d2d1849 chip=0x8d2d8086 rev=0x05 hdr=0x00
    vendor     = 'Intel Corporation'
    device     = 'C610/X99 series chipset USB Enhanced Host Controller'
    class      = serial bus
    subclass   = USB
    bar   [10] = type Memory, range 32, base 0xfb638000, size 1024, enabled
    cap 01[50] = powerspec 2  supports D0 D3  current D0
    cap 0a[58] = EHCI Debug Port at offset 0xa0 in map 0x14
    cap 13[98] = PCI Advanced Features: FLR TP

hdac2@pci0:0:27:0:	class=0x040300 card=0x11511849 chip=0x8d208086 rev=0x05 hdr=0x00
    vendor     = 'Intel Corporation'
    device     = 'C610/X99 series chipset HD Audio Controller'
    class      = multimedia
    subclass   = HDA
    bar   [10] = type Memory, range 64, base 0xfb630000, size 16384, enabled
    cap 01[50] = powerspec 2  supports D0 D3  current D0
    cap 05[60] = MSI supports 1 message, 64 bit enabled with 1 message
    cap 10[70] = PCI-Express 1 root endpoint max data 128(128) FLR NS
    ecap 0002[100] = VC 1 max VC1

pcib6@pci0:0:28:0:	class=0x060400 card=0x8d101849 chip=0x8d108086 rev=0xd5 hdr=0x01
    vendor     = 'Intel Corporation'
    device     = 'C610/X99 series chipset PCI Express Root Port'
    class      = bridge
    subclass   = PCI-PCI
    cap 10[40] = PCI-Express 2 root port max data 128(128)
                 link x0(x2) speed 0.0(5.0) ASPM disabled(L0s/L1)
    cap 05[80] = MSI supports 1 message 
    cap 0d[90] = PCI Bridge card=0x8d101849
    cap 01[a0] = powerspec 3  supports D0 D3  current D0

pcib7@pci0:0:28:2:	class=0x060400 card=0x8d141849 chip=0x8d148086 rev=0xd5 hdr=0x01
    vendor     = 'Intel Corporation'
    device     = 'C610/X99 series chipset PCI Express Root Port'
    class      = bridge
    subclass   = PCI-PCI
    cap 10[40] = PCI-Express 2 root port max data 128(128)
                 link x1(x1) speed 2.5(5.0)
                 slot 0 power limit 0 mW
    cap 05[80] = MSI supports 1 message enabled with 1 message
    cap 0d[90] = PCI Bridge card=0x8d141849
    cap 01[a0] = powerspec 3  supports D0 D3  current D0

pcib8@pci0:0:28:3:	class=0x060400 card=0x8d161849 chip=0x8d168086 rev=0xd5 hdr=0x01
    vendor     = 'Intel Corporation'
    device     = 'C610/X99 series chipset PCI Express Root Port'
    class      = bridge
    subclass   = PCI-PCI
    cap 10[40] = PCI-Express 2 root port max data 128(128)
                 link x1(x1) speed 2.5(5.0)
                 slot 0 power limit 0 mW
    cap 05[80] = MSI supports 1 message enabled with 1 message
    cap 0d[90] = PCI Bridge card=0x8d161849
    cap 01[a0] = powerspec 3  supports D0 D3  current D0

pcib9@pci0:0:28:4:	class=0x060400 card=0x8d181849 chip=0x8d188086 rev=0xd5 hdr=0x01
    vendor     = 'Intel Corporation'
    device     = 'C610/X99 series chipset PCI Express Root Port'
    class      = bridge
    subclass   = PCI-PCI
    cap 10[40] = PCI-Express 2 root port max data 128(128)
                 link x2(x2) speed 5.0(5.0)
                 slot 0 power limit 0 mW
    cap 05[80] = MSI supports 1 message enabled with 1 message
    cap 0d[90] = PCI Bridge card=0x8d181849
    cap 01[a0] = powerspec 3  supports D0 D3  current D0

ehci1@pci0:0:29:0:	class=0x0c0320 card=0x8d261849 chip=0x8d268086 rev=0x05 hdr=0x00
    vendor     = 'Intel Corporation'
    device     = 'C610/X99 series chipset USB Enhanced Host Controller'
    class      = serial bus
    subclass   = USB
    bar   [10] = type Memory, range 32, base 0xfb637000, size 1024, enabled
    cap 01[50] = powerspec 2  supports D0 D3  current D0
    cap 0a[58] = EHCI Debug Port at offset 0xa0 in map 0x14
    cap 13[98] = PCI Advanced Features: FLR TP

isab0@pci0:0:31:0:	class=0x060100 card=0x8d471849 chip=0x8d478086 rev=0x05 hdr=0x00
    vendor     = 'Intel Corporation'
    device     = 'C610/X99 series chipset LPC Controller'
    class      = bridge
    subclass   = PCI-ISA
    cap 09[e0] = vendor (length 12) Intel cap 1 version 0
		 features: AMT, 4 PCI-e x1 slots

ahci1@pci0:0:31:2:	class=0x010601 card=0x8d021849 chip=0x8d028086 rev=0x05 hdr=0x00
    vendor     = 'Intel Corporation'
    device     = 'C610/X99 series chipset 6-Port SATA Controller [AHCI mode]'
    class      = mass storage
    subclass   = SATA
    bar   [10] = type I/O Port, range 32, base 0xf090, size 8, enabled
    bar   [14] = type I/O Port, range 32, base 0xf080, size 4, enabled
    bar   [18] = type I/O Port, range 32, base 0xf070, size 8, enabled
    bar   [1c] = type I/O Port, range 32, base 0xf060, size 4, enabled
    bar   [20] = type I/O Port, range 32, base 0xf000, size 32, enabled
    bar   [24] = type Memory, range 32, base 0xfb636000, size 2048, enabled
    cap 05[80] = MSI supports 1 message enabled with 1 message
    cap 01[70] = powerspec 3  supports D0 D3  current D0
    cap 12[a8] = SATA Index-Data Pair

none61@pci0:0:31:3:	class=0x0c0500 card=0x8d221849 chip=0x8d228086 rev=0x05 hdr=0x00
    vendor     = 'Intel Corporation'
    device     = 'C610/X99 series chipset SMBus Controller'
    class      = serial bus
    subclass   = SMBus
    bar   [10] = type Memory, range 64, base 0xfb635000, size 256, enabled
    bar   [20] = type I/O Port, range 32, base 0x580, size 32, enabled

nvme0@pci0:1:0:0:	class=0x010802 card=0x500615b7 chip=0x500615b7 rev=0x00 hdr=0x00
    vendor     = 'Sandisk Corp'
    device     = 'WD Black SN750 / PC SN730 NVMe SSD'
    class      = mass storage
    subclass   = NVM
    bar   [10] = type Memory, range 64, base 0xfb500000, size 16384, enabled
    bar   [20] = type Memory, range 64, base 0xfb504000, size 256, enabled
    cap 01[80] = powerspec 3  supports D0 D3  current D0
    cap 05[90] = MSI supports 32 messages, 64 bit 
    cap 11[b0] = MSI-X supports 65 messages, enabled
                 Table in map 0x10[0x2000], PBA in map 0x20[0x0]
    cap 10[c0] = PCI-Express 2 endpoint max data 256(512) FLR NS
                 link x4(x4) speed 8.0(8.0) ASPM disabled(L1) ClockPM disabled
    ecap 0001[100] = AER 2 0 fatal 0 non-fatal 0 corrected
    ecap 0003[150] = Serial 1 0000000000000000
    ecap 0018[1b8] = LTR 1
    ecap 0019[300] = PCIe Sec 1 lane errors 0
    ecap 001e[900] = L1 PM Substates 1

vgapci0@pci0:3:0:0:	class=0x030000 card=0x16181462 chip=0x954f1002 rev=0x00 hdr=0x00
    vendor     = 'Advanced Micro Devices, Inc. [AMD/ATI]'
    device     = 'RV710 [Radeon HD 4350/4550]'
    class      = display
    subclass   = VGA
    bar   [10] = type Prefetchable Memory, range 64, base 0xe0000000, size 268435456, enabled
    bar   [18] = type Memory, range 64, base 0xfb420000, size 65536, enabled
    bar   [20] = type I/O Port, range 32, base 0xe000, size 256, enabled
    cap 01[50] = powerspec 3  supports D0 D1 D2 D3  current D0
    cap 10[58] = PCI-Express 2 legacy endpoint max data 128(128) NS
                 link x16(x16) speed 2.5(2.5) ASPM disabled(L0s/L1)
    cap 05[a0] = MSI supports 1 message, 64 bit 
    ecap 000b[100] = Vendor 1 ID 1

hdac0@pci0:3:0:1:	class=0x040300 card=0xaa381462 chip=0xaa381002 rev=0x00 hdr=0x00
    vendor     = 'Advanced Micro Devices, Inc. [AMD/ATI]'
    device     = 'RV710/730 HDMI Audio [Radeon HD 4000 series]'
    class      = multimedia
    subclass   = HDA
    bar   [10] = type Memory, range 64, base 0xfb430000, size 16384, enabled
    cap 01[50] = powerspec 3  supports D0 D1 D2 D3  current D0
    cap 10[58] = PCI-Express 2 legacy endpoint max data 128(128) NS
                 link x16(x16) speed 2.5(2.5) ASPM disabled(L0s/L1)
    cap 05[a0] = MSI supports 1 message, 64 bit enabled with 1 message
    ecap 000b[100] = Vendor 1 ID 1

vgapci1@pci0:4:0:0:	class=0x030000 card=0x39753842 chip=0x13c210de rev=0xa1 hdr=0x00
    vendor     = 'NVIDIA Corporation'
    device     = 'GM204 [GeForce GTX 970]'
    class      = display
    subclass   = VGA
    bar   [10] = type Memory, range 32, base 0xfa000000, size 16777216, enabled
    bar   [14] = type Prefetchable Memory, range 64, base 0xc0000000, size 268435456, enabled
    bar   [1c] = type Prefetchable Memory, range 64, base 0xd0000000, size 33554432, enabled
    bar   [24] = type I/O Port, range 32, base 0xd000, size 128, enabled
    cap 01[60] = powerspec 3  supports D0 D3  current D0
    cap 05[68] = MSI supports 1 message, 64 bit enabled with 1 message
    cap 10[78] = PCI-Express 2 legacy endpoint max data 256(256) RO
                 link x16(x16) speed 8.0(8.0) ASPM disabled(L0s/L1) ClockPM enabled
    ecap 0002[100] = VC 1 max VC0
    ecap 001e[258] = L1 PM Substates 1
    ecap 0004[128] = Power Budgeting 1
    ecap 000b[600] = Vendor 1 ID 1
    ecap 0019[900] = PCIe Sec 1 lane errors 0

hdac1@pci0:4:0:1:	class=0x040300 card=0x39753842 chip=0x0fbb10de rev=0xa1 hdr=0x00
    vendor     = 'NVIDIA Corporation'
    device     = 'GM204 High Definition Audio Controller'
    class      = multimedia
    subclass   = HDA
    bar   [10] = type Memory, range 32, base 0xfb080000, size 16384, enabled
    cap 01[60] = powerspec 3  supports D0 D3  current D0
    cap 05[68] = MSI supports 1 message, 64 bit enabled with 1 message
    cap 10[78] = PCI-Express 2 endpoint max data 256(256) NS
                 link x16(x16) speed 8.0(8.0) ASPM L0s/L1(L0s/L1) ClockPM enabled

igb0@pci0:6:0:0:	class=0x020000 card=0x15391849 chip=0x15398086 rev=0x03 hdr=0x00
    vendor     = 'Intel Corporation'
    device     = 'I211 Gigabit Network Connection'
    class      = network
    subclass   = ethernet
    bar   [10] = type Memory, range 32, base 0xfb300000, size 131072, enabled
    bar   [18] = type I/O Port, range 32, base 0xc000, size 32, enabled
    bar   [1c] = type Memory, range 32, base 0xfb320000, size 16384, enabled
    cap 01[40] = powerspec 3  supports D0 D3  current D0
    cap 05[50] = MSI supports 1 message, 64 bit, vector masks 
    cap 11[70] = MSI-X supports 5 messages, enabled
                 Table in map 0x1c[0x0], PBA in map 0x1c[0x2000]
    cap 10[a0] = PCI-Express 2 endpoint max data 128(512) FLR NS
                 link x1(x1) speed 2.5(2.5) ASPM disabled(L0s/L1)
    ecap 0001[100] = AER 2 0 fatal 0 non-fatal 0 corrected
    ecap 0003[140] = Serial 1 7085c2ffff236fa0
    ecap 0017[1a0] = TPH Requester 1

iwm0@pci0:7:0:0:	class=0x028000 card=0x80708086 chip=0x08b38086 rev=0x83 hdr=0x00
    vendor     = 'Intel Corporation'
    device     = 'Wireless 3160'
    class      = network
    bar   [10] = type Memory, range 64, base 0xfb200000, size 8192, enabled
    cap 01[c8] = powerspec 3  supports D0 D3  current D0
    cap 05[d0] = MSI supports 1 message, 64 bit enabled with 1 message
    cap 10[40] = PCI-Express 2 endpoint max data 128(128) FLR NS
                 link x1(x1) speed 2.5(2.5) ASPM disabled(L0s/L1) ClockPM disabled
    ecap 0001[100] = AER 1 0 fatal 0 non-fatal 0 corrected
    ecap 0003[140] = Serial 1 e4029bffff7b78bb
    ecap 0018[14c] = LTR 1
    ecap 000b[154] = Vendor 1 ID 51966

xhci1@pci0:8:0:0:	class=0x0c0330 card=0x12421b21 chip=0x12421b21 rev=0x00 hdr=0x00
    vendor     = 'ASMedia Technology Inc.'
    device     = 'ASM1142 USB 3.1 Host Controller'
    class      = serial bus
    subclass   = USB
    bar   [10] = type Memory, range 64, base 0xfb100000, size 32768, enabled
    cap 05[50] = MSI supports 8 messages, 64 bit enabled with 1 message
    cap 11[68] = MSI-X supports 8 messages
                 Table in map 0x10[0x2000], PBA in map 0x10[0x2080]
    cap 01[78] = powerspec 3  supports D0 D3  current D0
    cap 10[80] = PCI-Express 2 endpoint max data 128(512) NS
                 link x2(x2) speed 5.0(5.0) ASPM disabled(L1)
    ecap 0002[100] = VC 1 max VC0
    ecap 0001[200] = AER 1 0 fatal 0 non-fatal 0 corrected
    ecap 0019[280] = PCIe Sec 1 lane errors 0
    ecap 0018[300] = LTR 1
