hostb0@pci0:0:0:0:	class=0x060000 card=0x1493103c chip=0x2e408086 rev=0x03 hdr=0x00
    vendor     = 'Intel Corporation'
    device     = '4 Series Chipset DRAM Controller'
    class      = bridge
    subclass   = HOST-PCI
    cap 09[e0] = vendor (length 12) Intel cap 10 version 1

vgapci0@pci0:0:2:0:	class=0x030000 card=0x1493103c chip=0x2e428086 rev=0x03 hdr=0x00
    vendor     = 'Intel Corporation'
    device     = '4 Series Chipset Integrated Graphics Controller'
    class      = display
    subclass   = VGA
    bar   [10] = type Memory, range 64, base 0xf0000000, size 4194304, enabled
    bar   [18] = type Prefetchable Memory, range 64, base 0xe0000000, size 268435456, enabled
    bar   [20] = type I/O Port, range 32, base 0x2220, size 8, enabled
    cap 05[90] = MSI supports 1 message 
    cap 01[d0] = powerspec 2  supports D0 D3  current D0

vgapci1@pci0:0:2:1:	class=0x038000 card=0x1493103c chip=0x2e438086 rev=0x03 hdr=0x00
    vendor     = 'Intel Corporation'
    device     = '4 Series Chipset Integrated Graphics Controller'
    class      = display
    bar   [10] = type Memory, range 64, base 0xf0400000, size 1048576, enabled
    cap 01[d0] = powerspec 2  supports D0 D3  current D0

em0@pci0:0:25:0:	class=0x020000 card=0x1493103c chip=0x15258086 rev=0x02 hdr=0x00
    vendor     = 'Intel Corporation'
    device     = '82567V-4 Gigabit Network Connection'
    class      = network
    subclass   = ethernet
    bar   [10] = type Memory, range 32, base 0xf0500000, size 131072, enabled
    bar   [14] = type Memory, range 32, base 0xf0524000, size 4096, enabled
    bar   [18] = type I/O Port, range 32, base 0x2100, size 32, enabled
    cap 01[c8] = powerspec 2  supports D0 D3  current D0
    cap 05[d0] = MSI supports 1 message, 64 bit enabled with 1 message
    cap 13[e0] = PCI Advanced Features: FLR TP

uhci0@pci0:0:26:0:	class=0x0c0300 card=0x1493103c chip=0x3a678086 rev=0x02 hdr=0x00
    vendor     = 'Intel Corporation'
    device     = '82801JD/DO (ICH10 Family) USB UHCI Controller'
    class      = serial bus
    subclass   = USB
    bar   [20] = type I/O Port, range 32, base 0x2120, size 32, enabled
    cap 13[50] = PCI Advanced Features: FLR TP

uhci1@pci0:0:26:1:	class=0x0c0300 card=0x1493103c chip=0x3a688086 rev=0x02 hdr=0x00
    vendor     = 'Intel Corporation'
    device     = '82801JD/DO (ICH10 Family) USB UHCI Controller'
    class      = serial bus
    subclass   = USB
    bar   [20] = type I/O Port, range 32, base 0x2140, size 32, enabled
    cap 13[50] = PCI Advanced Features: FLR TP

uhci2@pci0:0:26:2:	class=0x0c0300 card=0x1493103c chip=0x3a698086 rev=0x02 hdr=0x00
    vendor     = 'Intel Corporation'
    device     = '82801JD/DO (ICH10 Family) USB UHCI Controller'
    class      = serial bus
    subclass   = USB
    bar   [20] = type I/O Port, range 32, base 0x2160, size 32, enabled
    cap 13[50] = PCI Advanced Features: FLR TP

ehci0@pci0:0:26:7:	class=0x0c0320 card=0x1493103c chip=0x3a6c8086 rev=0x02 hdr=0x00
    vendor     = 'Intel Corporation'
    device     = '82801JD/DO (ICH10 Family) USB2 EHCI Controller'
    class      = serial bus
    subclass   = USB
    bar   [10] = type Memory, range 32, base 0xf0525800, size 1024, enabled
    cap 01[50] = powerspec 2  supports D0 D3  current D0
    cap 0a[58] = EHCI Debug Port at offset 0xa0 in map 0x14
    cap 13[98] = PCI Advanced Features: FLR TP

hdac0@pci0:0:27:0:	class=0x040300 card=0x1493103c chip=0x3a6e8086 rev=0x02 hdr=0x00
    vendor     = 'Intel Corporation'
    device     = '82801JD/DO (ICH10 Family) HD Audio Controller'
    class      = multimedia
    subclass   = HDA
    bar   [10] = type Memory, range 64, base 0xf0520000, size 16384, enabled
    cap 01[50] = powerspec 2  supports D0 D3  current D0
    cap 05[60] = MSI supports 1 message, 64 bit enabled with 1 message
    cap 10[70] = PCI-Express 1 root endpoint max data 128(128) FLR NS
    ecap 0002[100] = VC 1 max VC1
    ecap 0005[130] = Root Complex Link Declaration 1

pcib1@pci0:0:28:0:	class=0x060400 card=0x1493103c chip=0x3a708086 rev=0x02 hdr=0x01
    vendor     = 'Intel Corporation'
    device     = '82801JD/DO (ICH10 Family) PCI Express Port 1'
    class      = bridge
    subclass   = PCI-PCI
    cap 10[40] = PCI-Express 2 root port max data 128(128)
                 link x1(x1) speed 2.5(2.5) ASPM disabled(L0s/L1)
                 slot 2 power limit 10000 mW HotPlug(present) surprise
    cap 05[80] = MSI supports 1 message 
    cap 0d[90] = PCI Bridge card=0x1493103c
    cap 01[a0] = powerspec 2  supports D0 D3  current D0
    ecap 0002[100] = VC 1 max VC0
    ecap 0005[180] = Root Complex Link Declaration 1

uhci3@pci0:0:29:0:	class=0x0c0300 card=0x1493103c chip=0x3a648086 rev=0x02 hdr=0x00
    vendor     = 'Intel Corporation'
    device     = '82801JD/DO (ICH10 Family) USB UHCI Controller'
    class      = serial bus
    subclass   = USB
    bar   [20] = type I/O Port, range 32, base 0x2180, size 32, enabled
    cap 13[50] = PCI Advanced Features: FLR TP

uhci4@pci0:0:29:1:	class=0x0c0300 card=0x1493103c chip=0x3a658086 rev=0x02 hdr=0x00
    vendor     = 'Intel Corporation'
    device     = '82801JD/DO (ICH10 Family) USB UHCI Controller'
    class      = serial bus
    subclass   = USB
    bar   [20] = type I/O Port, range 32, base 0x21a0, size 32, enabled
    cap 13[50] = PCI Advanced Features: FLR TP

uhci5@pci0:0:29:2:	class=0x0c0300 card=0x1493103c chip=0x3a668086 rev=0x02 hdr=0x00
    vendor     = 'Intel Corporation'
    device     = '82801JD/DO (ICH10 Family) USB UHCI Controller'
    class      = serial bus
    subclass   = USB
    bar   [20] = type I/O Port, range 32, base 0x21c0, size 32, enabled
    cap 13[50] = PCI Advanced Features: FLR TP

ehci1@pci0:0:29:7:	class=0x0c0320 card=0x1493103c chip=0x3a6a8086 rev=0x02 hdr=0x00
    vendor     = 'Intel Corporation'
    device     = '82801JD/DO (ICH10 Family) USB2 EHCI Controller'
    class      = serial bus
    subclass   = USB
    bar   [10] = type Memory, range 32, base 0xf0525c00, size 1024, enabled
    cap 01[50] = powerspec 2  supports D0 D3  current D0
    cap 0a[58] = EHCI Debug Port at offset 0xa0 in map 0x14
    cap 13[98] = PCI Advanced Features: FLR TP

pcib2@pci0:0:30:0:	class=0x060401 card=0x1493103c chip=0x244e8086 rev=0xa2 hdr=0x01
    vendor     = 'Intel Corporation'
    device     = '82801 PCI Bridge'
    class      = bridge
    subclass   = PCI-PCI
    cap 0d[50] = PCI Bridge card=0x1493103c

isab0@pci0:0:31:0:	class=0x060100 card=0x1493103c chip=0x3a1a8086 rev=0x02 hdr=0x00
    vendor     = 'Intel Corporation'
    device     = '82801JD (ICH10D) LPC Interface Controller'
    class      = bridge
    subclass   = PCI-ISA
    cap 09[e0] = vendor (length 12) Intel cap 1 version 0
		 features: AMT, Quick Resume, SATA RAID-5, 4 PCI-e x1 slots, SATA RAID-0/1/10

ahci0@pci0:0:31:2:	class=0x010601 card=0x1493103c chip=0x3a028086 rev=0x02 hdr=0x00
    vendor     = 'Intel Corporation'
    device     = '82801JD/DO (ICH10 Family) SATA AHCI Controller'
    class      = mass storage
    subclass   = SATA
    bar   [10] = type I/O Port, range 32, base 0x2228, size 8, enabled
    bar   [14] = type I/O Port, range 32, base 0x2238, size 4, enabled
    bar   [18] = type I/O Port, range 32, base 0x2230, size 8, enabled
    bar   [1c] = type I/O Port, range 32, base 0x223c, size 4, enabled
    bar   [20] = type I/O Port, range 32, base 0x21e0, size 32, enabled
    bar   [24] = type Memory, range 32, base 0xf0525000, size 2048, enabled
    cap 05[80] = MSI supports 8 messages enabled with 8 messages
    cap 01[70] = powerspec 3  supports D0 D3  current D0
    cap 12[a8] = SATA Index-Data Pair
    cap 13[b0] = PCI Advanced Features: FLR TP

re0@pci0:32:0:0:	class=0x020000 card=0x34687470 chip=0x816810ec rev=0x06 hdr=0x00
    vendor     = 'Realtek Semiconductor Co., Ltd.'
    device     = 'RTL8111/8168/8411 PCI Express Gigabit Ethernet Controller'
    class      = network
    subclass   = ethernet
    bar   [10] = type I/O Port, range 32, base 0x1100, size 256, enabled
    bar   [18] = type Memory, range 64, base 0xf0700000, size 4096, enabled
    bar   [20] = type Prefetchable Memory, range 64, base 0xf0600000, size 16384, enabled
    cap 01[40] = powerspec 3  supports D0 D1 D2 D3  current D0
    cap 05[50] = MSI supports 1 message, 64 bit 
    cap 10[70] = PCI-Express 2 endpoint MSI 1 max data 128(128) RO
                 link x1(x1) speed 2.5(2.5) ASPM disabled(L0s/L1)
    cap 11[b0] = MSI-X supports 4 messages, enabled
                 Table in map 0x20[0x0], PBA in map 0x20[0x800]
    cap 03[d0] = VPD
    ecap 0001[100] = AER 1 0 fatal 0 non-fatal 1 corrected
    ecap 0002[140] = VC 1 max VC0
    ecap 0003[160] = Serial 1 c3420000684ce000
