hostb0@pci0:0:0:0:	class=0x060000 rev=0x05 hdr=0x00 vendor=0x8086 device=0x4650 subvendor=0x1462 subdevice=0x7d46
    vendor     = 'Intel Corporation'
    class      = bridge
    subclass   = HOST-PCI

vgapci0@pci0:0:2:0:	class=0x030000 rev=0x0c hdr=0x00 vendor=0x8086 device=0x4692 subvendor=0x1462 subdevice=0x7d46
    vendor     = 'Intel Corporation'
    class      = display
    subclass   = VGA
    bar   [10] = type Memory, range 64, base 0x6000000000, size 16777216, enabled
    bar   [18] = type Prefetchable Memory, range 64, base 0x4000000000, size 268435456, enabled
    bar   [20] = type I/O Port, range 32, base 0x3000, size 64, enabled
    cap 09[40] = vendor (length 12) Intel cap 0 version 1
    cap 10[70] = PCI-Express 2 root endpoint max data 128(128) FLR
                 max read 128
    cap 05[ac] = MSI supports 1 message, vector masks 
    cap 01[d0] = powerspec 2  supports D0 D3  current D0
    ecap 001b[100] = Process Address Space ID 1
    ecap 000f[200] = ATS 1
    ecap 0013[300] = Page Page Request 1
    ecap 0010[320] = SR-IOV 1 IOV disabled, Memory Space disabled, ARI disabled
                     0 VFs configured out of 7 supported
                     First VF RID Offset 0x0001, VF RID Stride 0x0001
                     VF Device ID 0x4692
                     Page Sizes: 4096 (enabled), 8192, 65536, 262144, 1048576, 4194304

none0@pci0:0:8:0:	class=0x088000 rev=0x05 hdr=0x00 vendor=0x8086 device=0x464f subvendor=0x1462 subdevice=0x7d46
    vendor     = 'Intel Corporation'
    class      = base peripheral
    bar   [10] = type Memory, range 64, base 0x6001123000, size 4096, enabled
    cap 05[90] = MSI supports 1 message 
    cap 09[a0] = vendor (length 20) Intel cap 15 version 0
    cap 01[dc] = powerspec 2  supports D0 D3  current D3
    cap 13[f0] = PCI Advanced Features: FLR TP

none1@pci0:0:10:0:	class=0x118000 rev=0x01 hdr=0x00 vendor=0x8086 device=0x467d subvendor=0x0000 subdevice=0x0000
    vendor     = 'Intel Corporation'
    class      = dasp
    bar   [10] = type Memory, range 64, base 0x6001110000, size 32768, enabled
    cap 10[70] = PCI-Express 2 root endpoint max data 128(128)
                 max read 128
    cap 01[d0] = powerspec 3  supports D0 D3  current D3
    ecap 0023[100] = Designated Vendor-Specific 1
    ecap 0023[110] = Designated Vendor-Specific 1
    ecap 0023[120] = Designated Vendor-Specific 1

xhci0@pci0:0:20:0:	class=0x0c0330 rev=0x11 hdr=0x00 vendor=0x8086 device=0x7ae0 subvendor=0x1462 subdevice=0x7d46
    vendor     = 'Intel Corporation'
    class      = serial bus
    subclass   = USB
    bar   [10] = type Memory, range 64, base 0x6001100000, size 65536, enabled
    cap 01[70] = powerspec 2  supports D0 D3  current D0
    cap 05[80] = MSI supports 8 messages, 64 bit enabled with 1 message
    cap 09[90] = vendor (length 20) Intel cap 15 version 0
    cap 09[b0] = vendor (length 0) Intel cap 0 version 1

none2@pci0:0:20:2:	class=0x050000 rev=0x11 hdr=0x00 vendor=0x8086 device=0x7aa7 subvendor=0x0000 subdevice=0x0000
    vendor     = 'Intel Corporation'
    class      = memory
    subclass   = RAM
    bar   [10] = type Memory, range 64, base 0x600111c000, size 16384, enabled
    bar   [18] = type Memory, range 64, base 0x6001122000, size 4096, enabled
    cap 01[80] = powerspec 3  supports D0 D3  current D3

none3@pci0:0:22:0:	class=0x078000 rev=0x11 hdr=0x00 vendor=0x8086 device=0x7ae8 subvendor=0x1462 subdevice=0x7d46
    vendor     = 'Intel Corporation'
    class      = simple comms
    bar   [10] = type Memory, range 64, base 0x6001121000, size 4096, enabled
    cap 01[50] = powerspec 3  supports D0 D3  current D3
    cap 05[8c] = MSI supports 1 message, 64 bit 
    cap 09[a4] = vendor (length 20) Intel cap 15 version 0

ahci0@pci0:0:23:0:	class=0x010601 rev=0x11 hdr=0x00 vendor=0x8086 device=0x7ae2 subvendor=0x1462 subdevice=0x7d46
    vendor     = 'Intel Corporation'
    class      = mass storage
    subclass   = SATA
    bar   [10] = type Memory, range 32, base 0x80920000, size 8192, enabled
    bar   [14] = type Memory, range 32, base 0x80923000, size 256, enabled
    bar   [18] = type I/O Port, range 32, base 0x3090, size 8, enabled
    bar   [1c] = type I/O Port, range 32, base 0x3080, size 4, enabled
    bar   [20] = type I/O Port, range 32, base 0x3060, size 32, enabled
    bar   [24] = type Memory, range 32, base 0x80922000, size 2048, enabled
    cap 05[80] = MSI supports 1 message enabled with 1 message
    cap 01[70] = powerspec 3  supports D0 D3  current D0
    cap 12[a8] = SATA Index-Data Pair

pcib1@pci0:0:28:0:	class=0x060400 rev=0x11 hdr=0x01 vendor=0x8086 device=0x7ab8 subvendor=0x1462 subdevice=0x7d46
    vendor     = 'Intel Corporation'
    class      = bridge
    subclass   = PCI-PCI
    cap 10[40] = PCI-Express 2 root port max data 128(256) ARI disabled
                 max read 128
                 link x4(x4) speed 8.0(8.0)
                 slot 4 power limit 250 mW
    cap 05[80] = MSI supports 1 message, 64 bit 
    cap 0d[98] = PCI Bridge subvendor=0x1462 subdevice=0x7d46
    cap 01[a0] = powerspec 3  supports D0 D3  current D0
    ecap 0000[100] = unknown 0
    ecap 000d[220] = ACS 1
    ecap 001f[150] = Precision Time Measurement 1
    ecap 0019[a30] = PCIe Sec 1 lane errors 0
    ecap 0025[a90] = Data Link Feature 1

isab0@pci0:0:31:0:	class=0x060100 rev=0x11 hdr=0x00 vendor=0x8086 device=0x7a87 subvendor=0x1462 subdevice=0x7d46
    vendor     = 'Intel Corporation'
    class      = bridge
    subclass   = PCI-ISA

hdac0@pci0:0:31:3:	class=0x040300 rev=0x11 hdr=0x00 vendor=0x8086 device=0x7ad0 subvendor=0x1462 subdevice=0x9d46
    vendor     = 'Intel Corporation'
    class      = multimedia
    subclass   = HDA
    bar   [10] = type Memory, range 64, base 0x6001118000, size 16384, enabled
    bar   [20] = type Memory, range 64, base 0x6001000000, size 1048576, enabled
    cap 01[50] = powerspec 3  supports D0 D3  current D0
    cap 09[80] = vendor (length 20) Intel cap 15 version 0
    cap 05[60] = MSI supports 1 message, 64 bit enabled with 1 message

ichsmb0@pci0:0:31:4:	class=0x0c0500 rev=0x11 hdr=0x00 vendor=0x8086 device=0x7aa3 subvendor=0x1462 subdevice=0x7d46
    vendor     = 'Intel Corporation'
    class      = serial bus
    subclass   = SMBus
    bar   [10] = type Memory, range 64, base 0x6001120000, size 256, enabled
    bar   [20] = type I/O Port, range 32, base 0xefa0, size 32, enabled

none4@pci0:0:31:5:	class=0x0c8000 rev=0x11 hdr=0x00 vendor=0x8086 device=0x7aa4 subvendor=0x1462 subdevice=0x7d46
    vendor     = 'Intel Corporation'
    class      = serial bus
    bar   [10] = type Memory, range 32, base 0xfe010000, size 4096, enabled

em0@pci0:0:31:6:	class=0x020000 rev=0x11 hdr=0x00 vendor=0x8086 device=0x1a1d subvendor=0x1462 subdevice=0x7d46
    vendor     = 'Intel Corporation'
    device     = 'Ethernet Connection (17) I219-V'
    class      = network
    subclass   = ethernet
    bar   [10] = type Memory, range 32, base 0x80900000, size 131072, enabled
    cap 01[c8] = powerspec 3  supports D0 D3  current D0
    cap 05[d0] = MSI supports 1 message, 64 bit enabled with 1 message

nvme0@pci0:1:0:0:	class=0x010802 rev=0x03 hdr=0x00 vendor=0x126f device=0x2263 subvendor=0x126f subdevice=0x2263
    vendor     = 'Silicon Motion, Inc.'
    device     = 'SM2263EN/SM2263XT SSD Controller'
    class      = mass storage
    subclass   = NVM
    bar   [10] = type Memory, range 64, base 0x80800000, size 16384, enabled
    cap 01[40] = powerspec 3  supports D0 D3  current D0
    cap 05[50] = MSI supports 8 messages, 64 bit, vector masks 
    cap 10[70] = PCI-Express 2 endpoint max data 128(128) FLR RO
                 max read 512
                 link x4(x4) speed 8.0(8.0) ASPM disabled(L1) ClockPM enabled
    cap 11[b0] = MSI-X supports 16 messages, enabled
                 Table in map 0x10[0x2000], PBA in map 0x10[0x2100]
    ecap 0001[100] = AER 2 0 fatal 0 non-fatal 0 corrected
    ecap 0019[158] = PCIe Sec 1 lane errors 0
    ecap 0018[178] = LTR 1
    ecap 001e[180] = L1 PM Substates 1
