hostb0@pci0:0:0:0:	class=0x060000 card=0x22128086 chip=0x0f008086 rev=0x11 hdr=0x00
    vendor     = 'Intel Corporation'
    device     = 'Atom Processor Z36xxx/Z37xxx Series SoC Transaction Register'
    class      = bridge
    subclass   = HOST-PCI

vgapci0@pci0:0:2:0:	class=0x030000 card=0x22128086 chip=0x0f318086 rev=0x11 hdr=0x00
    vendor     = 'Intel Corporation'
    device     = 'Atom Processor Z36xxx/Z37xxx Series Graphics & Display'
    class      = display
    subclass   = VGA
    bar   [10] = type Memory, range 32, base 0xd0000000, size 4194304, enabled
    bar   [18] = type Prefetchable Memory, range 32, base 0xc0000000, size 268435456, enabled
    bar   [20] = type I/O Port, range 32, base 0xf080, size 8, enabled
    cap 01[d0] = powerspec 2  supports D0 D3  current D0
    cap 05[90] = MSI supports 1 message 
    cap 09[b0] = vendor (length 7) Intel cap 0 version 1

ahci0@pci0:0:19:0:	class=0x010601 card=0x72708086 chip=0x0f238086 rev=0x11 hdr=0x00
    vendor     = 'Intel Corporation'
    device     = 'Atom Processor E3800 Series SATA AHCI Controller'
    class      = mass storage
    subclass   = SATA
    bar   [10] = type I/O Port, range 32, base 0xf070, size 8, enabled
    bar   [14] = type I/O Port, range 32, base 0xf060, size 4, enabled
    bar   [18] = type I/O Port, range 32, base 0xf050, size 8, enabled
    bar   [1c] = type I/O Port, range 32, base 0xf040, size 4, enabled
    bar   [20] = type I/O Port, range 32, base 0xf020, size 32, enabled
    bar   [24] = type Memory, range 32, base 0xd0c06000, size 2048, enabled
    cap 05[80] = MSI supports 1 message enabled with 1 message
    cap 01[70] = powerspec 3  supports D0 D3  current D0
    cap 12[a8] = SATA Index-Data Pair

none0@pci0:0:26:0:	class=0x108000 card=0x72708086 chip=0x0f188086 rev=0x11 hdr=0x00
    vendor     = 'Intel Corporation'
    device     = 'Atom Processor Z36xxx/Z37xxx Series Trusted Execution Engine'
    class      = encrypt/decrypt
    bar   [10] = type Memory, range 32, base 0xd0500000, size 1048576, enabled
    bar   [14] = type Memory, range 32, base 0xd0400000, size 1048576, enabled
    cap 01[80] = powerspec 3  supports D0 D3  current D0
    cap 05[a0] = MSI supports 1 message 

hdac0@pci0:0:27:0:	class=0x040300 card=0x72708086 chip=0x0f048086 rev=0x11 hdr=0x00
    vendor     = 'Intel Corporation'
    device     = 'Atom Processor Z36xxx/Z37xxx Series High Definition Audio Controller'
    class      = multimedia
    subclass   = HDA
    bar   [10] = type Memory, range 64, base 0xd0c00000, size 16384, enabled
    cap 01[50] = powerspec 2  supports D0 D3  current D0
    cap 05[60] = MSI supports 1 message, 64 bit enabled with 1 message

pcib1@pci0:0:28:0:	class=0x060400 card=0x72708086 chip=0x0f488086 rev=0x11 hdr=0x01
    vendor     = 'Intel Corporation'
    device     = 'Atom Processor E3800 Series PCI Express Root Port 1'
    class      = bridge
    subclass   = PCI-PCI
    cap 10[40] = PCI-Express 2 root port max data 128(128)
                 link x1(x1) speed 2.5(5.0) ASPM disabled(L0s/L1)
                 slot 0 power limit 100 mW HotPlug(present) surprise
    cap 05[80] = MSI supports 1 message 
    cap 0d[90] = PCI Bridge card=0x72708086
    cap 01[a0] = powerspec 3  supports D0 D3  current D0

pcib2@pci0:0:28:1:	class=0x060400 card=0x72708086 chip=0x0f4a8086 rev=0x11 hdr=0x01
    vendor     = 'Intel Corporation'
    device     = 'Atom Processor E3800 Series PCI Express Root Port 2'
    class      = bridge
    subclass   = PCI-PCI
    cap 10[40] = PCI-Express 2 root port max data 128(128)
                 link x1(x1) speed 2.5(5.0) ASPM disabled(L0s/L1)
                 slot 1 power limit 100 mW HotPlug(present) surprise
    cap 05[80] = MSI supports 1 message 
    cap 0d[90] = PCI Bridge card=0x72708086
    cap 01[a0] = powerspec 3  supports D0 D3  current D0

pcib3@pci0:0:28:2:	class=0x060400 card=0x72708086 chip=0x0f4c8086 rev=0x11 hdr=0x01
    vendor     = 'Intel Corporation'
    device     = 'Atom Processor E3800 Series PCI Express Root Port 3'
    class      = bridge
    subclass   = PCI-PCI
    cap 10[40] = PCI-Express 2 root port max data 128(128)
                 link x1(x1) speed 2.5(5.0) ASPM disabled(L0s/L1)
                 slot 2 power limit 100 mW HotPlug(present) surprise
    cap 05[80] = MSI supports 1 message 
    cap 0d[90] = PCI Bridge card=0x72708086
    cap 01[a0] = powerspec 3  supports D0 D3  current D0

pcib4@pci0:0:28:3:	class=0x060400 card=0x72708086 chip=0x0f4e8086 rev=0x11 hdr=0x01
    vendor     = 'Intel Corporation'
    device     = 'Atom Processor E3800 Series PCI Express Root Port 4'
    class      = bridge
    subclass   = PCI-PCI
    cap 10[40] = PCI-Express 2 root port max data 128(128)
                 link x1(x1) speed 5.0(5.0) ASPM disabled(L0s/L1)
                 slot 3 power limit 100 mW HotPlug(present) surprise
    cap 05[80] = MSI supports 1 message 
    cap 0d[90] = PCI Bridge card=0x72708086
    cap 01[a0] = powerspec 3  supports D0 D3  current D0

ehci0@pci0:0:29:0:	class=0x0c0320 card=0x72708086 chip=0x0f348086 rev=0x11 hdr=0x00
    vendor     = 'Intel Corporation'
    device     = 'Atom Processor Z36xxx/Z37xxx Series USB EHCI'
    class      = serial bus
    subclass   = USB
    bar   [10] = type Memory, range 32, base 0xd0c05000, size 1024, enabled
    cap 01[50] = powerspec 3  supports D0 D3  current D0
    cap 0a[58] = EHCI Debug Port at offset 0xa0 in map 0x14
    cap 13[98] = PCI Advanced Features: FLR TP

isab0@pci0:0:31:0:	class=0x060100 card=0x72708086 chip=0x0f1c8086 rev=0x11 hdr=0x00
    vendor     = 'Intel Corporation'
    device     = 'Atom Processor Z36xxx/Z37xxx Series Power Control Unit'
    class      = bridge
    subclass   = PCI-ISA
    cap 09[e0] = vendor (length 12) Intel cap 1 version 0
		 features: 4 PCI-e x1 slots

none1@pci0:0:31:3:	class=0x0c0500 card=0x72708086 chip=0x0f128086 rev=0x11 hdr=0x00
    vendor     = 'Intel Corporation'
    device     = 'Atom Processor E3800 Series SMBus Controller'
    class      = serial bus
    subclass   = SMBus
    bar   [10] = type Memory, range 32, base 0xd0c04000, size 32, enabled
    bar   [20] = type I/O Port, range 32, base 0xf000, size 32, enabled
    cap 01[50] = powerspec 3  supports D0 D3  current D0

igb0@pci0:1:0:0:	class=0x020000 card=0x00008086 chip=0x15398086 rev=0x03 hdr=0x00
    vendor     = 'Intel Corporation'
    device     = 'I211 Gigabit Network Connection'
    class      = network
    subclass   = ethernet
    bar   [10] = type Memory, range 32, base 0xd0b00000, size 131072, enabled
    bar   [18] = type I/O Port, range 32, base 0xe000, size 32, enabled
    bar   [1c] = type Memory, range 32, base 0xd0b20000, size 16384, enabled
    cap 01[40] = powerspec 3  supports D0 D3  current D0
    cap 05[50] = MSI supports 1 message, 64 bit, vector masks 
    cap 11[70] = MSI-X supports 5 messages, enabled
                 Table in map 0x1c[0x0], PBA in map 0x1c[0x2000]
    cap 10[a0] = PCI-Express 2 endpoint max data 128(512) FLR NS
                 link x1(x1) speed 2.5(2.5) ASPM disabled(L0s/L1)
    ecap 0001[100] = AER 2 0 fatal 0 non-fatal 0 corrected
    ecap 0003[140] = Serial 1 00e269ffff1a1092
    ecap 0017[1a0] = TPH Requester 1

igb1@pci0:2:0:0:	class=0x020000 card=0x00008086 chip=0x15398086 rev=0x03 hdr=0x00
    vendor     = 'Intel Corporation'
    device     = 'I211 Gigabit Network Connection'
    class      = network
    subclass   = ethernet
    bar   [10] = type Memory, range 32, base 0xd0a00000, size 131072, enabled
    bar   [18] = type I/O Port, range 32, base 0xd000, size 32, enabled
    bar   [1c] = type Memory, range 32, base 0xd0a20000, size 16384, enabled
    cap 01[40] = powerspec 3  supports D0 D3  current D0
    cap 05[50] = MSI supports 1 message, 64 bit, vector masks 
    cap 11[70] = MSI-X supports 5 messages, enabled
                 Table in map 0x1c[0x0], PBA in map 0x1c[0x2000]
    cap 10[a0] = PCI-Express 2 endpoint max data 128(512) FLR NS
                 link x1(x1) speed 2.5(2.5) ASPM disabled(L0s/L1)
    ecap 0001[100] = AER 2 0 fatal 0 non-fatal 0 corrected
    ecap 0003[140] = Serial 1 00e269ffff1a1093
    ecap 0017[1a0] = TPH Requester 1

igb2@pci0:3:0:0:	class=0x020000 card=0x00008086 chip=0x15398086 rev=0x03 hdr=0x00
    vendor     = 'Intel Corporation'
    device     = 'I211 Gigabit Network Connection'
    class      = network
    subclass   = ethernet
    bar   [10] = type Memory, range 32, base 0xd0900000, size 131072, enabled
    bar   [18] = type I/O Port, range 32, base 0xc000, size 32, enabled
    bar   [1c] = type Memory, range 32, base 0xd0920000, size 16384, enabled
    cap 01[40] = powerspec 3  supports D0 D3  current D0
    cap 05[50] = MSI supports 1 message, 64 bit, vector masks 
    cap 11[70] = MSI-X supports 5 messages, enabled
                 Table in map 0x1c[0x0], PBA in map 0x1c[0x2000]
    cap 10[a0] = PCI-Express 2 endpoint max data 128(512) FLR NS
                 link x1(x1) speed 2.5(2.5) ASPM disabled(L0s/L1)
    ecap 0001[100] = AER 2 0 fatal 0 non-fatal 0 corrected
    ecap 0003[140] = Serial 1 00e269ffff1a1094
    ecap 0017[1a0] = TPH Requester 1

pcib5@pci0:4:0:0:	class=0x060400 card=0x118f1b21 chip=0x11841b21 rev=0x00 hdr=0x01
    vendor     = 'ASMedia Technology Inc.'
    device     = 'ASM1184e PCIe Switch Port'
    class      = bridge
    subclass   = PCI-PCI
    cap 05[50] = MSI supports 1 message, 64 bit 
    cap 01[78] = powerspec 3  supports D0 D3  current D0
    cap 10[80] = PCI-Express 2 upstream port max data 128(256) NS
                 link x1(x1) speed 5.0(5.0) ASPM disabled(L0s/L1)
    cap 0d[c0] = PCI Bridge card=0x118f1b21
    ecap 0002[100] = VC 1 max VC0
    ecap 0001[200] = AER 1 0 fatal 0 non-fatal 1 corrected
    ecap 000b[300] = Vendor 1 ID 0

pcib6@pci0:5:1:0:	class=0x060400 card=0x118f1b21 chip=0x11841b21 rev=0x00 hdr=0x01
    vendor     = 'ASMedia Technology Inc.'
    device     = 'ASM1184e PCIe Switch Port'
    class      = bridge
    subclass   = PCI-PCI
    cap 05[50] = MSI supports 1 message, 64 bit 
    cap 01[78] = powerspec 3  supports D0 D3  current D0
    cap 10[80] = PCI-Express 2 downstream port max data 128(256) NS
                 link x1(x1) speed 2.5(5.0) ASPM disabled(L0s/L1)
                 slot 1 power limit 26000 mW
    cap 0d[c0] = PCI Bridge card=0x118f1b21
    ecap 0002[100] = VC 1 max VC0
    ecap 0001[200] = AER 1 0 fatal 0 non-fatal 0 corrected

pcib7@pci0:5:3:0:	class=0x060400 card=0x118f1b21 chip=0x11841b21 rev=0x00 hdr=0x01
    vendor     = 'ASMedia Technology Inc.'
    device     = 'ASM1184e PCIe Switch Port'
    class      = bridge
    subclass   = PCI-PCI
    cap 05[50] = MSI supports 1 message, 64 bit 
    cap 01[78] = powerspec 3  supports D0 D3  current D0
    cap 10[80] = PCI-Express 2 downstream port max data 128(256) RO NS
                 link x1(x1) speed 2.5(5.0) ASPM disabled(L0s/L1)
                 slot 3 power limit 26000 mW
    cap 0d[c0] = PCI Bridge card=0x118f1b21
    ecap 0002[100] = VC 1 max VC0
    ecap 0001[200] = AER 1 0 fatal 0 non-fatal 0 corrected

pcib8@pci0:5:5:0:	class=0x060400 card=0x118f1b21 chip=0x11841b21 rev=0x00 hdr=0x01
    vendor     = 'ASMedia Technology Inc.'
    device     = 'ASM1184e PCIe Switch Port'
    class      = bridge
    subclass   = PCI-PCI
    cap 05[50] = MSI supports 1 message, 64 bit 
    cap 01[78] = powerspec 3  supports D0 D3  current D0
    cap 10[80] = PCI-Express 2 downstream port max data 128(256) NS
                 link x1(x1) speed 2.5(5.0) ASPM disabled(L0s/L1)
                 slot 5 power limit 26000 mW
    cap 0d[c0] = PCI Bridge card=0x118f1b21
    ecap 0002[100] = VC 1 max VC0
    ecap 0001[200] = AER 1 0 fatal 0 non-fatal 0 corrected

pcib9@pci0:5:7:0:	class=0x060400 card=0x118f1b21 chip=0x11841b21 rev=0x00 hdr=0x01
    vendor     = 'ASMedia Technology Inc.'
    device     = 'ASM1184e PCIe Switch Port'
    class      = bridge
    subclass   = PCI-PCI
    cap 05[50] = MSI supports 1 message, 64 bit 
    cap 01[78] = powerspec 3  supports D0 D3  current D0
    cap 10[80] = PCI-Express 2 downstream port max data 128(256) NS
                 link x1(x1) speed 2.5(5.0) ASPM disabled(L0s/L1)
                 slot 7 power limit 26000 mW
    cap 0d[c0] = PCI Bridge card=0x118f1b21
    ecap 0002[100] = VC 1 max VC0
    ecap 0001[200] = AER 1 0 fatal 0 non-fatal 0 corrected

igb3@pci0:6:0:0:	class=0x020000 card=0x00008086 chip=0x15398086 rev=0x03 hdr=0x00
    vendor     = 'Intel Corporation'
    device     = 'I211 Gigabit Network Connection'
    class      = network
    subclass   = ethernet
    bar   [10] = type Memory, range 32, base 0xd0800000, size 131072, enabled
    bar   [18] = type I/O Port, range 32, base 0xb000, size 32, enabled
    bar   [1c] = type Memory, range 32, base 0xd0820000, size 16384, enabled
    cap 01[40] = powerspec 3  supports D0 D3  current D0
    cap 05[50] = MSI supports 1 message, 64 bit, vector masks 
    cap 11[70] = MSI-X supports 5 messages, enabled
                 Table in map 0x1c[0x0], PBA in map 0x1c[0x2000]
    cap 10[a0] = PCI-Express 2 endpoint max data 128(512) FLR NS
                 link x1(x1) speed 2.5(2.5) ASPM disabled(L0s/L1)
    ecap 0001[100] = AER 2 0 fatal 0 non-fatal 1 corrected
    ecap 0003[140] = Serial 1 00e269ffff1a1095
    ecap 0017[1a0] = TPH Requester 1

igb4@pci0:8:0:0:	class=0x020000 card=0x00008086 chip=0x15398086 rev=0x03 hdr=0x00
    vendor     = 'Intel Corporation'
    device     = 'I211 Gigabit Network Connection'
    class      = network
    subclass   = ethernet
    bar   [10] = type Memory, range 32, base 0xd0700000, size 131072, enabled
    bar   [18] = type I/O Port, range 32, base 0xa000, size 32, enabled
    bar   [1c] = type Memory, range 32, base 0xd0720000, size 16384, enabled
    cap 01[40] = powerspec 3  supports D0 D3  current D0
    cap 05[50] = MSI supports 1 message, 64 bit, vector masks 
    cap 11[70] = MSI-X supports 5 messages, enabled
                 Table in map 0x1c[0x0], PBA in map 0x1c[0x2000]
    cap 10[a0] = PCI-Express 2 endpoint max data 128(512) FLR NS
                 link x1(x1) speed 2.5(2.5) ASPM disabled(L0s/L1)
    ecap 0001[100] = AER 2 0 fatal 0 non-fatal 0 corrected
    ecap 0003[140] = Serial 1 00e269ffff1a1096
    ecap 0017[1a0] = TPH Requester 1

igb5@pci0:9:0:0:	class=0x020000 card=0x00008086 chip=0x15398086 rev=0x03 hdr=0x00
    vendor     = 'Intel Corporation'
    device     = 'I211 Gigabit Network Connection'
    class      = network
    subclass   = ethernet
    bar   [10] = type Memory, range 32, base 0xd0600000, size 131072, enabled
    bar   [18] = type I/O Port, range 32, base 0x9000, size 32, enabled
    bar   [1c] = type Memory, range 32, base 0xd0620000, size 16384, enabled
    cap 01[40] = powerspec 3  supports D0 D3  current D0
    cap 05[50] = MSI supports 1 message, 64 bit, vector masks 
    cap 11[70] = MSI-X supports 5 messages, enabled
                 Table in map 0x1c[0x0], PBA in map 0x1c[0x2000]
    cap 10[a0] = PCI-Express 2 endpoint max data 128(512) FLR NS
                 link x1(x1) speed 2.5(2.5) ASPM disabled(L0s/L1)
    ecap 0001[100] = AER 2 0 fatal 0 non-fatal 0 corrected
    ecap 0003[140] = Serial 1 00e269ffff1a1097
    ecap 0017[1a0] = TPH Requester 1
