hostb0@pci0:0:0:0:	class=0x060000 rev=0x06 hdr=0x00 vendor=0x8086 device=0x31f0 subvendor=0x8086 subdevice=0x31f0
    vendor     = 'Intel Corporation'
    device     = 'Gemini Lake Host Bridge'
    class      = bridge
    subclass   = HOST-PCI

none0@pci0:0:0:1:	class=0x118000 rev=0x06 hdr=0x00 vendor=0x8086 device=0x318c subvendor=0x8086 subdevice=0x318c
    vendor     = 'Intel Corporation'
    device     = 'Celeron/Pentium Silver Processor Dynamic Platform and Thermal Framework Processor Participant'
    class      = dasp
    bar   [10] = type Memory, range 64, base 0x91110000, size 32768, enabled
    cap 01[d0] = powerspec 3  supports D0 D3  current D0
    cap 09[e0] = vendor (length 12) Intel cap 0 version 1

vgapci0@pci0:0:2:0:	class=0x038000 rev=0x06 hdr=0x00 vendor=0x8086 device=0x3185 subvendor=0x0000 subdevice=0x0000
    vendor     = 'Intel Corporation'
    device     = 'GeminiLake [UHD Graphics 600]'
    class      = display
    bar   [10] = type Memory, range 64, base 0x90000000, size 16777216, enabled
    bar   [18] = type Prefetchable Memory, range 64, base 0x80000000, size 268435456, enabled
    bar   [20] = type I/O Port, range 32, base 0x1000, size 64, enabled
    cap 09[40] = vendor (length 12) Intel cap 0 version 1
    cap 10[70] = PCI-Express 2 root endpoint max data 128(128) FLR
                 max read 128
    cap 05[ac] = MSI supports 1 message enabled with 1 message
    cap 01[d0] = powerspec 2  supports D0 D3  current D0
    ecap 001b[100] = Process Address Space ID 1
    ecap 000f[200] = ATS 1
    ecap 0013[300] = Page Page Request 1

iwm0@pci0:0:12:0:	class=0x028000 rev=0x06 hdr=0x00 vendor=0x8086 device=0x31dc subvendor=0x8086 subdevice=0x0234
    vendor     = 'Intel Corporation'
    device     = 'Gemini Lake PCH CNVi WiFi'
    class      = network
    bar   [10] = type Memory, range 64, base 0x91118000, size 16384, enabled
    cap 01[c8] = powerspec 3  supports D0 D3  current D0
    cap 05[d0] = MSI supports 1 message, 64 bit enabled with 1 message
    cap 10[40] = PCI-Express 2 root endpoint max data 128(128) FLR RO NS
                 max read 128
    cap 11[80] = MSI-X supports 16 messages
                 Table in map 0x10[0x2000], PBA in map 0x10[0x3000]
    ecap 0000[100] = unknown 0
    ecap 0018[14c] = LTR 1
    ecap 000b[164] = Vendor [1] ID 0010 Rev 0 Length 20

hdac0@pci0:0:14:0:	class=0x040100 rev=0x06 hdr=0x00 vendor=0x8086 device=0x3198 subvendor=0x0000 subdevice=0x0000
    vendor     = 'Intel Corporation'
    device     = 'Celeron/Pentium Silver Processor High Definition Audio'
    class      = multimedia
    subclass   = audio
    bar   [10] = type Memory, range 64, base 0x9111c000, size 16384, enabled
    bar   [20] = type Memory, range 64, base 0x91000000, size 1048576, enabled
    cap 01[50] = powerspec 3  supports D0 D3  current D0
    cap 09[80] = vendor (length 20) Intel cap 15 version 0
    cap 05[60] = MSI supports 1 message, 64 bit enabled with 1 message
    cap 10[70] = PCI-Express 1 root endpoint max data 128(128) FLR NS
                 max read 512
                 link x1(x0)

xhci0@pci0:0:21:0:	class=0x0c0330 rev=0x06 hdr=0x00 vendor=0x8086 device=0x31a8 subvendor=0x8086 subdevice=0x31a8
    vendor     = 'Intel Corporation'
    device     = 'Celeron/Pentium Silver Processor USB 3.0 xHCI Controller'
    class      = serial bus
    subclass   = USB
    bar   [10] = type Memory, range 64, base 0x91100000, size 65536, enabled
    cap 01[70] = powerspec 2  supports D0 D3  current D0
    cap 05[80] = MSI supports 8 messages, 64 bit enabled with 1 message
    cap 09[90] = vendor (length 20) Intel cap 15 version 0

ig4iic0@pci0:0:22:0:	class=0x118000 rev=0x06 hdr=0x00 vendor=0x8086 device=0x31ac subvendor=0x8086 subdevice=0x31ac
    vendor     = 'Intel Corporation'
    device     = 'Celeron/Pentium Silver Processor I2C 0'
    class      = dasp
    bar   [10] = type Memory, range 64, base 0x91125000, size 4096, enabled
    bar   [18] = type Memory, range 64, base 0x91126000, size 4096, enabled
    cap 01[80] = powerspec 3  supports D0 D3  current D0
    cap 09[90] = vendor (length 20) Intel cap 15 version 0

ig4iic1@pci0:0:23:0:	class=0x118000 rev=0x06 hdr=0x00 vendor=0x8086 device=0x31b4 subvendor=0x8086 subdevice=0x31b4
    vendor     = 'Intel Corporation'
    device     = 'Celeron/Pentium Silver Processor I2C 4'
    class      = dasp
    bar   [10] = type Memory, range 64, base 0x91127000, size 4096, enabled
    bar   [18] = type Memory, range 64, base 0x91128000, size 4096, enabled
    cap 01[80] = powerspec 3  supports D0 D3  current D0
    cap 09[90] = vendor (length 20) Intel cap 15 version 0

ig4iic2@pci0:0:23:1:	class=0x118000 rev=0x06 hdr=0x00 vendor=0x8086 device=0x31b6 subvendor=0x8086 subdevice=0x31b6
    vendor     = 'Intel Corporation'
    device     = 'Celeron/Pentium Silver Processor I2C 5'
    class      = dasp
    bar   [10] = type Memory, range 64, base 0x91129000, size 4096, enabled
    bar   [18] = type Memory, range 64, base 0x9112a000, size 4096, enabled
    cap 01[80] = powerspec 3  supports D0 D3  current D0
    cap 09[90] = vendor (length 20) Intel cap 15 version 0

ig4iic3@pci0:0:23:2:	class=0x118000 rev=0x06 hdr=0x00 vendor=0x8086 device=0x31b8 subvendor=0x8086 subdevice=0x31b8
    vendor     = 'Intel Corporation'
    device     = 'Celeron/Pentium Silver Processor I2C 6'
    class      = dasp
    bar   [10] = type Memory, range 64, base 0x9112b000, size 4096, enabled
    bar   [18] = type Memory, range 64, base 0x9112c000, size 4096, enabled
    cap 01[80] = powerspec 3  supports D0 D3  current D0
    cap 09[90] = vendor (length 20) Intel cap 15 version 0

uart2@pci0:0:24:0:	class=0x118000 rev=0x06 hdr=0x00 vendor=0x8086 device=0x31bc subvendor=0x8086 subdevice=0x31bc
    vendor     = 'Intel Corporation'
    device     = 'Celeron/Pentium Silver Processor Serial IO UART Host Controller'
    class      = dasp
    bar   [10] = type Memory, range 64, base 0x9112d000, size 4096, enabled
    bar   [18] = type Memory, range 64, base 0x9112e000, size 4096, enabled
    cap 01[80] = powerspec 3  supports D0 D3  current D0
    cap 09[90] = vendor (length 20) Intel cap 15 version 0

uart3@pci0:0:24:2:	class=0x118000 rev=0x06 hdr=0x00 vendor=0x8086 device=0x31c0 subvendor=0x8086 subdevice=0x31c0
    vendor     = 'Intel Corporation'
    device     = 'Celeron/Pentium Silver Processor Serial IO UART Host Controller'
    class      = dasp
    bar   [10] = type Memory, range 64, base 0xddffc000, size 4096, enabled
    bar   [18] = type Memory, range 64, base 0x9112f000, size 4096, enabled
    cap 01[80] = powerspec 3  supports D0 D3  current D0
    cap 09[90] = vendor (length 20) Intel cap 15 version 0

none1@pci0:0:25:0:	class=0x118000 rev=0x06 hdr=0x00 vendor=0x8086 device=0x31c2 subvendor=0x8086 subdevice=0x31c2
    vendor     = 'Intel Corporation'
    device     = 'Celeron/Pentium Silver Processor Serial IO SPI Host Controller'
    class      = dasp
    bar   [10] = type Memory, range 64, base 0x91130000, size 4096, enabled
    bar   [18] = type Memory, range 64, base 0x91131000, size 4096, enabled
    cap 01[80] = powerspec 3  supports D0 D3  current D0
    cap 09[90] = vendor (length 20) Intel cap 15 version 0

none2@pci0:0:25:2:	class=0x118000 rev=0x06 hdr=0x00 vendor=0x8086 device=0x31c6 subvendor=0x8086 subdevice=0x31c6
    vendor     = 'Intel Corporation'
    device     = 'Celeron/Pentium Silver Processor Serial IO SPI Host Controller'
    class      = dasp
    bar   [10] = type Memory, range 64, base 0x91132000, size 4096, enabled
    bar   [18] = type Memory, range 64, base 0x91133000, size 4096, enabled
    cap 01[80] = powerspec 3  supports D0 D3  current D0
    cap 09[90] = vendor (length 20) Intel cap 15 version 0

sdhci_pci0@pci0:0:28:0:	class=0x080501 rev=0x06 hdr=0x00 vendor=0x8086 device=0x31cc subvendor=0x8086 subdevice=0x31cc
    vendor     = 'Intel Corporation'
    device     = 'Celeron/Pentium Silver Processor SDA Standard Compliant SD Host Controller'
    class      = base peripheral
    subclass   = SD host controller
    bar   [10] = type Memory, range 64, base 0x91134000, size 4096, enabled
    bar   [18] = type Memory, range 64, base 0x91135000, size 4096, enabled
    cap 01[80] = powerspec 3  supports D0 D3  current D0
    cap 09[90] = vendor (length 20) Intel cap 15 version 0

isab0@pci0:0:31:0:	class=0x060100 rev=0x06 hdr=0x00 vendor=0x8086 device=0x3197 subvendor=0x8086 subdevice=0x3197
    vendor     = 'Intel Corporation'
    device     = 'Celeron/Pentium Silver Processor PCI-default ISA-bridge'
    class      = bridge
    subclass   = PCI-ISA

ichsmb0@pci0:0:31:1:	class=0x0c0500 rev=0x06 hdr=0x00 vendor=0x8086 device=0x31d4 subvendor=0x8086 subdevice=0x31d4
    vendor     = 'Intel Corporation'
    device     = 'Celeron/Pentium Silver Processor Gaussian Mixture Model'
    class      = serial bus
    subclass   = SMBus
    bar   [10] = type Memory, range 64, base 0x91136000, size 256, enabled
    bar   [20] = type I/O Port, range 32, base 0xefa0, size 32, enabled
