hostb0@pci0:0:0:0:	class=0x060000 rev=0x02 hdr=0x00 vendor=0x8086 device=0x2770 subvendor=0x1014 subdevice=0x02f9
    vendor     = 'Intel Corporation'
    device     = '82945G/GZ/P/PL Memory Controller Hub'
    class      = bridge
    subclass   = HOST-PCI
    cap 09[e0] = vendor (length 9) Intel cap 5 version 1

vgapci0@pci0:0:2:0:	class=0x030000 rev=0x02 hdr=0x00 vendor=0x8086 device=0x2772 subvendor=0x1014 subdevice=0x02f9
    vendor     = 'Intel Corporation'
    device     = '82945G/GZ Integrated Graphics Controller'
    class      = display
    subclass   = VGA
    bar   [10] = type Memory, range 32, base 0xd0100000, size 524288, enabled
    bar   [14] = type I/O Port, range 32, base 0x30c0, size 8, enabled
    bar   [18] = type Prefetchable Memory, range 32, base 0xc0000000, size 268435456, enabled
    bar   [1c] = type Memory, range 32, base 0xd0180000, size 262144, enabled
    cap 05[90] = MSI supports 1 message 
    cap 01[d0] = powerspec 2  supports D0 D3  current D0

vgapci1@pci0:0:2:1:	class=0x038000 rev=0x02 hdr=0x00 vendor=0x8086 device=0x2776 subvendor=0x1014 subdevice=0x02f9
    vendor     = 'Intel Corporation'
    device     = '82945G/GZ Integrated Graphics Controller'
    class      = display
    bar   [10] = type Memory, range 32, base 0, size 524288, disabled
    cap 01[d0] = powerspec 2  supports D0 D3  current D0

hdac0@pci0:0:27:0:	class=0x040300 rev=0x01 hdr=0x00 vendor=0x8086 device=0x27d8 subvendor=0x1014 subdevice=0x02f9
    vendor     = 'Intel Corporation'
    device     = 'NM10/ICH7 Family High Definition Audio Controller'
    class      = multimedia
    subclass   = HDA
    bar   [10] = type Memory, range 64, base 0xd01c0000, size 16384, enabled
    cap 01[50] = powerspec 2  supports D0 D3  current D0
    cap 05[60] = MSI supports 1 message, 64 bit enabled with 1 message
    cap 10[70] = PCI-Express 1 root endpoint max data 128(128) NS
                 max read 128
    ecap 0002[100] = VC 1 max VC1
    ecap 0005[130] = Root Complex Link Declaration 1

pcib1@pci0:0:28:0:	class=0x060400 rev=0x01 hdr=0x01 vendor=0x8086 device=0x27d0 subvendor=0x1014 subdevice=0x02f9
    vendor     = 'Intel Corporation'
    device     = 'NM10/ICH7 Family PCI Express Port 1'
    class      = bridge
    subclass   = PCI-PCI
    cap 10[40] = PCI-Express 1 root port max data 128(128)
                 max read 128
                 link x1(x1) speed 2.5(2.5) ASPM disabled(L0s/L1)
                 slot 1 power limit 10000 mW HotPlug(present) surprise
    cap 05[80] = MSI supports 1 message 
    cap 0d[90] = PCI Bridge subvendor=0x1014 subdevice=0x02f9
    cap 01[a0] = powerspec 2  supports D0 D3  current D0
    ecap 0002[100] = VC 1 max VC1
    ecap 0005[180] = Root Complex Link Declaration 1

pcib2@pci0:0:28:1:	class=0x060400 rev=0x01 hdr=0x01 vendor=0x8086 device=0x27d2 subvendor=0x1014 subdevice=0x02f9
    vendor     = 'Intel Corporation'
    device     = 'NM10/ICH7 Family PCI Express Port 2'
    class      = bridge
    subclass   = PCI-PCI
    cap 10[40] = PCI-Express 1 root port max data 128(128)
                 max read 128
                 link x0(x1) speed 0.0(2.5) ASPM disabled(L0s/L1)
                 slot 0 power limit 0 mW HotPlug(empty) surprise
    cap 05[80] = MSI supports 1 message 
    cap 0d[90] = PCI Bridge subvendor=0x1014 subdevice=0x02f9
    cap 01[a0] = powerspec 2  supports D0 D3  current D0
    ecap 0002[100] = VC 1 max VC1
    ecap 0005[180] = Root Complex Link Declaration 1

uhci0@pci0:0:29:0:	class=0x0c0300 rev=0x01 hdr=0x00 vendor=0x8086 device=0x27c8 subvendor=0x1014 subdevice=0x02f9
    vendor     = 'Intel Corporation'
    device     = 'NM10/ICH7 Family USB UHCI Controller'
    class      = serial bus
    subclass   = USB
    bar   [20] = type I/O Port, range 32, base 0x3000, size 32, enabled

uhci1@pci0:0:29:1:	class=0x0c0300 rev=0x01 hdr=0x00 vendor=0x8086 device=0x27c9 subvendor=0x1014 subdevice=0x02f9
    vendor     = 'Intel Corporation'
    device     = 'NM10/ICH7 Family USB UHCI Controller'
    class      = serial bus
    subclass   = USB
    bar   [20] = type I/O Port, range 32, base 0x3020, size 32, enabled

uhci2@pci0:0:29:2:	class=0x0c0300 rev=0x01 hdr=0x00 vendor=0x8086 device=0x27ca subvendor=0x1014 subdevice=0x02f9
    vendor     = 'Intel Corporation'
    device     = 'NM10/ICH7 Family USB UHCI Controller'
    class      = serial bus
    subclass   = USB
    bar   [20] = type I/O Port, range 32, base 0x3040, size 32, enabled

uhci3@pci0:0:29:3:	class=0x0c0300 rev=0x01 hdr=0x00 vendor=0x8086 device=0x27cb subvendor=0x1014 subdevice=0x02f9
    vendor     = 'Intel Corporation'
    device     = 'NM10/ICH7 Family USB UHCI Controller'
    class      = serial bus
    subclass   = USB
    bar   [20] = type I/O Port, range 32, base 0x3060, size 32, enabled

ehci0@pci0:0:29:7:	class=0x0c0320 rev=0x01 hdr=0x00 vendor=0x8086 device=0x27cc subvendor=0x1014 subdevice=0x02f9
    vendor     = 'Intel Corporation'
    device     = 'NM10/ICH7 Family USB2 EHCI Controller'
    class      = serial bus
    subclass   = USB
    bar   [10] = type Memory, range 32, base 0xd03c4000, size 1024, enabled
    cap 01[50] = powerspec 2  supports D0 D3  current D0
    cap 0a[58] = EHCI Debug Port at offset 0xa0 in map 0x14

pcib3@pci0:0:30:0:	class=0x060401 rev=0xe1 hdr=0x01 vendor=0x8086 device=0x244e subvendor=0x1014 subdevice=0x02f9
    vendor     = 'Intel Corporation'
    device     = '82801 PCI Bridge'
    class      = bridge
    subclass   = PCI-PCI
    cap 0d[50] = PCI Bridge subvendor=0x1014 subdevice=0x02f9

isab0@pci0:0:31:0:	class=0x060100 rev=0x01 hdr=0x00 vendor=0x8086 device=0x27b8 subvendor=0x1014 subdevice=0x02f9
    vendor     = 'Intel Corporation'
    device     = '82801GB/GR (ICH7 Family) LPC Interface Bridge'
    class      = bridge
    subclass   = PCI-ISA
    cap 09[e0] = vendor (length 12) Intel cap 1 version 0
		 features: Quick Resume, SATA RAID-5, 6 PCI-e x1 slots, SATA RAID-0/1/10, SATA AHCI

atapci0@pci0:0:31:2:	class=0x01018a rev=0x01 hdr=0x00 vendor=0x8086 device=0x27c0 subvendor=0x1014 subdevice=0x02f9
    vendor     = 'Intel Corporation'
    device     = 'NM10/ICH7 Family SATA Controller [IDE mode]'
    class      = mass storage
    subclass   = ATA
    bar   [20] = type I/O Port, range 32, base 0x30b0, size 16, enabled
    cap 01[70] = powerspec 2  supports D0 D3  current D0

ichsmb0@pci0:0:31:3:	class=0x0c0500 rev=0x01 hdr=0x00 vendor=0x8086 device=0x27da subvendor=0x1014 subdevice=0x02f9
    vendor     = 'Intel Corporation'
    device     = 'NM10/ICH7 Family SMBus Controller'
    class      = serial bus
    subclass   = SMBus
    bar   [20] = type I/O Port, range 32, base 0x3080, size 32, enabled

em0@pci0:2:0:0:	class=0x020000 rev=0x03 hdr=0x00 vendor=0x8086 device=0x108c subvendor=0x1014 subdevice=0x02f9
    vendor     = 'Intel Corporation'
    device     = '82573E Gigabit Ethernet Controller (Copper)'
    class      = network
    subclass   = ethernet
    bar   [10] = type Memory, range 32, base 0xd0080000, size 131072, enabled
    bar   [14] = type Memory, range 32, base 0xd0000000, size 524288, enabled
    bar   [18] = type I/O Port, range 32, base 0x4000, size 32, enabled
    cap 01[c8] = powerspec 2  supports D0 D3  current D0
    cap 05[d0] = MSI supports 1 message, 64 bit enabled with 1 message
    cap 10[e0] = PCI-Express 1 endpoint max data 128(256) RO NS
                 max read 512
                 link x1(x1) speed 2.5(2.5)
    ecap 0001[100] = AER 1 0 fatal 1 non-fatal 0 corrected
    ecap 0003[140] = Serial 1 001641ffff30a4aa
