hostb0@pci0:0:0:0:	class=0x060000 rev=0x09 hdr=0x00 vendor=0x8086 device=0x0104 subvendor=0x1043 subdevice=0x13d7
    vendor     = 'Intel Corporation'
    device     = '2nd Generation Core Processor Family DRAM Controller'
    class      = bridge
    subclass   = HOST-PCI
    cap 09[e0] = vendor (length 12) Intel cap 0 version 1

vgapci0@pci0:0:2:0:	class=0x030000 rev=0x09 hdr=0x00 vendor=0x8086 device=0x0116 subvendor=0x1043 subdevice=0x13d7
    vendor     = 'Intel Corporation'
    device     = '2nd Generation Core Processor Family Integrated Graphics Controller'
    class      = display
    subclass   = VGA
    bar   [10] = type Memory, range 64, base 0xdd000000, size 4194304, enabled
    bar   [18] = type Prefetchable Memory, range 64, base 0xc0000000, size 268435456, enabled
    bar   [20] = type I/O Port, range 32, base 0xe000, size 64, enabled
    cap 05[90] = MSI supports 1 message enabled with 1 message
    cap 01[d0] = powerspec 2  supports D0 D3  current D0
    cap 13[a4] = PCI Advanced Features: FLR TP

none0@pci0:0:22:0:	class=0x078000 rev=0x04 hdr=0x00 vendor=0x8086 device=0x1c3a subvendor=0x1043 subdevice=0x13d7
    vendor     = 'Intel Corporation'
    device     = '6 Series/C200 Series Chipset Family MEI Controller'
    class      = simple comms
    bar   [10] = type Memory, range 64, base 0xdfc0a000, size 16, enabled
    cap 01[50] = powerspec 3  supports D0 D3  current D0
    cap 05[8c] = MSI supports 1 message, 64 bit 

ehci0@pci0:0:26:0:	class=0x0c0320 rev=0x05 hdr=0x00 vendor=0x8086 device=0x1c2d subvendor=0x1043 subdevice=0x13d7
    vendor     = 'Intel Corporation'
    device     = '6 Series/C200 Series Chipset Family USB Enhanced Host Controller'
    class      = serial bus
    subclass   = USB
    bar   [10] = type Memory, range 32, base 0xdfc07000, size 1024, enabled
    cap 01[50] = powerspec 2  supports D0 D3  current D0
    cap 0a[58] = EHCI Debug Port at offset 0xa0 in map 0x14
    cap 13[98] = PCI Advanced Features: FLR TP

hdac0@pci0:0:27:0:	class=0x040300 rev=0x05 hdr=0x00 vendor=0x8086 device=0x1c20 subvendor=0x1043 subdevice=0x13d7
    vendor     = 'Intel Corporation'
    device     = '6 Series/C200 Series Chipset Family High Definition Audio Controller'
    class      = multimedia
    subclass   = HDA
    bar   [10] = type Memory, range 64, base 0xdfc00000, size 16384, enabled
    cap 01[50] = powerspec 2  supports D0 D3  current D0
    cap 05[60] = MSI supports 1 message, 64 bit enabled with 1 message
    cap 10[70] = PCI-Express 1 root endpoint max data 128(128) FLR NS
                 max read 128
    ecap 0002[100] = VC 1 max VC1
    ecap 0005[130] = Root Complex Link Declaration 1

pcib1@pci0:0:28:0:	class=0x060400 rev=0xb5 hdr=0x01 vendor=0x8086 device=0x1c10 subvendor=0x1043 subdevice=0x13d7
    vendor     = 'Intel Corporation'
    device     = '6 Series/C200 Series Chipset Family PCI Express Root Port 1'
    class      = bridge
    subclass   = PCI-PCI
    cap 10[40] = PCI-Express 2 root port max data 128(128)
                 max read 128
                 link x0(x1) speed 0.0(5.0) ASPM L0s/L1(L0s/L1)
                 slot 0 power limit 100 mW
    cap 05[80] = MSI supports 1 message 
    cap 0d[90] = PCI Bridge subvendor=0x1043 subdevice=0x13d7
    cap 01[a0] = powerspec 2  supports D0 D3  current D0

pcib2@pci0:0:28:1:	class=0x060400 rev=0xb5 hdr=0x01 vendor=0x8086 device=0x1c12 subvendor=0x1043 subdevice=0x13d7
    vendor     = 'Intel Corporation'
    device     = '6 Series/C200 Series Chipset Family PCI Express Root Port 2'
    class      = bridge
    subclass   = PCI-PCI
    cap 10[40] = PCI-Express 2 root port max data 128(128)
                 max read 128
                 link x1(x1) speed 2.5(5.0) ASPM L1(L0s/L1)
                 slot 1 power limit 100 mW
    cap 05[80] = MSI supports 1 message 
    cap 0d[90] = PCI Bridge subvendor=0x1043 subdevice=0x13d7
    cap 01[a0] = powerspec 2  supports D0 D3  current D0

pcib3@pci0:0:28:3:	class=0x060400 rev=0xb5 hdr=0x01 vendor=0x8086 device=0x1c16 subvendor=0x1043 subdevice=0x13d7
    vendor     = 'Intel Corporation'
    device     = '6 Series/C200 Series Chipset Family PCI Express Root Port 4'
    class      = bridge
    subclass   = PCI-PCI
    cap 10[40] = PCI-Express 2 root port max data 128(128)
                 max read 128
                 link x1(x1) speed 5.0(5.0) ASPM disabled(L0s/L1)
                 slot 3 power limit 100 mW
    cap 05[80] = MSI supports 1 message 
    cap 0d[90] = PCI Bridge subvendor=0x1043 subdevice=0x13d7
    cap 01[a0] = powerspec 2  supports D0 D3  current D0

pcib4@pci0:0:28:5:	class=0x060400 rev=0xb5 hdr=0x01 vendor=0x8086 device=0x1c1a subvendor=0x1043 subdevice=0x13d7
    vendor     = 'Intel Corporation'
    device     = '6 Series/C200 Series Chipset Family PCI Express Root Port 6'
    class      = bridge
    subclass   = PCI-PCI
    cap 10[40] = PCI-Express 2 root port max data 128(128)
                 max read 128
                 link x1(x1) speed 2.5(5.0) ASPM L1(L0s/L1)
                 slot 5 power limit 100 mW
    cap 05[80] = MSI supports 1 message 
    cap 0d[90] = PCI Bridge subvendor=0x1043 subdevice=0x13d7
    cap 01[a0] = powerspec 2  supports D0 D3  current D0

ehci1@pci0:0:29:0:	class=0x0c0320 rev=0x05 hdr=0x00 vendor=0x8086 device=0x1c26 subvendor=0x1043 subdevice=0x13d7
    vendor     = 'Intel Corporation'
    device     = '6 Series/C200 Series Chipset Family USB Enhanced Host Controller'
    class      = serial bus
    subclass   = USB
    bar   [10] = type Memory, range 32, base 0xdfc06000, size 1024, enabled
    cap 01[50] = powerspec 2  supports D0 D3  current D0
    cap 0a[58] = EHCI Debug Port at offset 0xa0 in map 0x14
    cap 13[98] = PCI Advanced Features: FLR TP

isab0@pci0:0:31:0:	class=0x060100 rev=0x05 hdr=0x00 vendor=0x8086 device=0x1c49 subvendor=0x1043 subdevice=0x13d7
    vendor     = 'Intel Corporation'
    device     = 'HM65 Express Chipset LPC Controller'
    class      = bridge
    subclass   = PCI-ISA
    cap 09[e0] = vendor (length 12) Intel cap 1 version 0
		 features: AMT, 4 PCI-e x1 slots

atapci0@pci0:0:31:2:	class=0x01018f rev=0x05 hdr=0x00 vendor=0x8086 device=0x1c01 subvendor=0x1043 subdevice=0x13d7
    vendor     = 'Intel Corporation'
    device     = '6 Series/C200 Series Chipset Family Mobile SATA Controller (IDE mode, ports 0-3)'
    class      = mass storage
    subclass   = ATA
    bar   [10] = type I/O Port, range 32, base 0xe110, size 8, enabled
    bar   [14] = type I/O Port, range 32, base 0xe100, size 4, enabled
    bar   [18] = type I/O Port, range 32, base 0xe0f0, size 8, enabled
    bar   [1c] = type I/O Port, range 32, base 0xe0e0, size 4, enabled
    bar   [20] = type I/O Port, range 32, base 0xe0d0, size 16, enabled
    bar   [24] = type I/O Port, range 32, base 0xe0c0, size 16, enabled
    cap 01[70] = powerspec 3  supports D0 D3  current D0
    cap 13[b0] = PCI Advanced Features: FLR TP

ichsmb0@pci0:0:31:3:	class=0x0c0500 rev=0x05 hdr=0x00 vendor=0x8086 device=0x1c22 subvendor=0x1043 subdevice=0x13d7
    vendor     = 'Intel Corporation'
    device     = '6 Series/C200 Series Chipset Family SMBus Controller'
    class      = serial bus
    subclass   = SMBus
    bar   [10] = type Memory, range 64, base 0xdfc05000, size 256, enabled
    bar   [20] = type I/O Port, range 32, base 0xe040, size 32, enabled

atapci1@pci0:0:31:5:	class=0x010185 rev=0x05 hdr=0x00 vendor=0x8086 device=0x1c09 subvendor=0x1043 subdevice=0x13d7
    vendor     = 'Intel Corporation'
    device     = '6 Series/C200 Series Chipset Family Mobile SATA Controller (IDE mode, ports 4-5)'
    class      = mass storage
    subclass   = ATA
    bar   [10] = type I/O Port, range 32, base 0xe0b0, size 8, enabled
    bar   [14] = type I/O Port, range 32, base 0xe0a0, size 4, enabled
    bar   [18] = type I/O Port, range 32, base 0xe090, size 8, enabled
    bar   [1c] = type I/O Port, range 32, base 0xe080, size 4, enabled
    bar   [20] = type I/O Port, range 32, base 0xe070, size 16, enabled
    bar   [24] = type I/O Port, range 32, base 0xe060, size 16, enabled
    cap 01[70] = powerspec 3  supports D0 D3  current D0
    cap 13[b0] = PCI Advanced Features: FLR TP

ath0@pci0:2:0:0:	class=0x028000 rev=0x01 hdr=0x00 vendor=0x168c device=0x002b subvendor=0x1a3b subdevice=0x1089
    vendor     = 'Qualcomm Atheros'
    device     = 'AR9285 Wireless Network Adapter (PCI-Express)'
    class      = network
    bar   [10] = type Memory, range 64, base 0xde800000, size 65536, enabled
    cap 01[40] = powerspec 3  supports D0 D1 D3  current D0
    cap 05[50] = MSI supports 1 message 
    cap 10[60] = PCI-Express 2 legacy endpoint max data 128(128) RO
                 max read 512
                 link x1(x1) speed 2.5(2.5) ASPM L1(L0s/L1)
    ecap 0001[100] = AER 1 0 fatal 0 non-fatal 1 corrected
    ecap 0002[140] = VC 1 max VC0
    ecap 0003[160] = Serial 1 001517ffff241412
    ecap 0004[170] = Power Budgeting 1

xhci0@pci0:3:0:0:	class=0x0c0330 rev=0x00 hdr=0x00 vendor=0x1b21 device=0x1042 subvendor=0x1043 subdevice=0x1059
    vendor     = 'ASMedia Technology Inc.'
    device     = 'ASM1042 SuperSpeed USB Host Controller'
    class      = serial bus
    subclass   = USB
    bar   [10] = type Memory, range 64, base 0xdde00000, size 32768, enabled
    cap 05[50] = MSI supports 8 messages, 64 bit 
    cap 11[68] = MSI-X supports 8 messages, enabled
                 Table in map 0x10[0x2000], PBA in map 0x10[0x2080]
    cap 01[78] = powerspec 3  supports D0 D3  current D0
    cap 10[80] = PCI-Express 2 legacy endpoint max data 128(512) RO NS
                 max read 512
                 link x1(x1) speed 5.0(5.0) ASPM disabled(L0s/L1)
    ecap 0002[100] = VC 1 max VC0

re0@pci0:4:0:0:	class=0x020000 rev=0x06 hdr=0x00 vendor=0x10ec device=0x8168 subvendor=0x1043 subdevice=0x13d7
    vendor     = 'Realtek Semiconductor Co., Ltd.'
    device     = 'RTL8111/8168/8411 PCI Express Gigabit Ethernet Controller'
    class      = network
    subclass   = ethernet
    bar   [10] = type I/O Port, range 32, base 0xa000, size 256, enabled
    bar   [18] = type Prefetchable Memory, range 64, base 0xd0004000, size 4096, enabled
    bar   [20] = type Prefetchable Memory, range 64, base 0xd0000000, size 16384, enabled
    cap 01[40] = powerspec 3  supports D0 D1 D2 D3  current D0
    cap 05[50] = MSI supports 1 message, 64 bit 
    cap 10[70] = PCI-Express 2 endpoint MSI 1 max data 128(128) RO
                 max read 4096
                 link x1(x1) speed 2.5(2.5) ASPM disabled(L0s/L1) ClockPM disabled
    cap 11[b0] = MSI-X supports 4 messages, enabled
                 Table in map 0x20[0x0], PBA in map 0x20[0x800]
    cap 03[d0] = VPD
    ecap 0001[100] = AER 1 0 fatal 0 non-fatal 1 corrected
    ecap 0002[140] = VC 1 max VC0
    ecap 0003[160] = Serial 1 10936810684ce000
