hostb0@pci0:0:0:0:	class=0x060000 rev=0x09 hdr=0x00 vendor=0x8086 device=0x0104 subvendor=0x1028 subdevice=0x0494
    vendor     = 'Intel Corporation'
    device     = '2nd Generation Core Processor Family DRAM Controller'
    class      = bridge
    subclass   = HOST-PCI
    cap 09[e0] = vendor (length 12) Intel cap 0 version 1

vgapci0@pci0:0:2:0:	class=0x030000 rev=0x09 hdr=0x00 vendor=0x8086 device=0x0126 subvendor=0x1028 subdevice=0x0494
    vendor     = 'Intel Corporation'
    device     = '2nd Generation Core Processor Family Integrated Graphics Controller'
    class      = display
    subclass   = VGA
    bar   [10] = type Memory, range 64, base 0xe1400000, size 4194304, enabled
    bar   [18] = type Prefetchable Memory, range 64, base 0xd0000000, size 268435456, enabled
    bar   [20] = type I/O Port, range 32, base 0x4000, size 64, enabled
    cap 05[90] = MSI supports 1 message 
    cap 01[d0] = powerspec 2  supports D0 D3  current D0
    cap 13[a4] = PCI Advanced Features: FLR TP

none0@pci0:0:22:0:	class=0x078000 rev=0x04 hdr=0x00 vendor=0x8086 device=0x1c3a subvendor=0x1028 subdevice=0x0494
    vendor     = 'Intel Corporation'
    device     = '6 Series/C200 Series Chipset Family MEI Controller'
    class      = simple comms
    bar   [10] = type Memory, range 64, base 0xe2ea0000, size 16, enabled
    cap 01[50] = powerspec 3  supports D0 D3  current D0
    cap 05[8c] = MSI supports 1 message, 64 bit 

em0@pci0:0:25:0:	class=0x020000 rev=0x04 hdr=0x00 vendor=0x8086 device=0x1502 subvendor=0x1028 subdevice=0x0494
    vendor     = 'Intel Corporation'
    device     = '82579LM Gigabit Network Connection (Lewisville)'
    class      = network
    subclass   = ethernet
    bar   [10] = type Memory, range 32, base 0xe2e00000, size 131072, enabled
    bar   [14] = type Memory, range 32, base 0xe2e70000, size 4096, enabled
    bar   [18] = type I/O Port, range 32, base 0x4060, size 32, enabled
    cap 01[c8] = powerspec 2  supports D0 D3  current D0
    cap 05[d0] = MSI supports 1 message, 64 bit enabled with 1 message
    cap 13[e0] = PCI Advanced Features: FLR TP

ehci0@pci0:0:26:0:	class=0x0c0320 rev=0x04 hdr=0x00 vendor=0x8086 device=0x1c2d subvendor=0x1028 subdevice=0x0494
    vendor     = 'Intel Corporation'
    device     = '6 Series/C200 Series Chipset Family USB Enhanced Host Controller'
    class      = serial bus
    subclass   = USB
    bar   [10] = type Memory, range 32, base 0xe2e60000, size 1024, enabled
    cap 01[50] = powerspec 2  supports D0 D3  current D0
    cap 0a[58] = EHCI Debug Port at offset 0xa0 in map 0x14
    cap 13[98] = PCI Advanced Features: FLR TP

hdac0@pci0:0:27:0:	class=0x040300 rev=0x04 hdr=0x00 vendor=0x8086 device=0x1c20 subvendor=0x1028 subdevice=0x0494
    vendor     = 'Intel Corporation'
    device     = '6 Series/C200 Series Chipset Family High Definition Audio Controller'
    class      = multimedia
    subclass   = HDA
    bar   [10] = type Memory, range 64, base 0xe2e50000, size 16384, enabled
    cap 01[50] = powerspec 2  supports D0 D3  current D0
    cap 05[60] = MSI supports 1 message, 64 bit enabled with 1 message
    cap 10[70] = PCI-Express 1 root endpoint max data 128(128) FLR NS
                 max read 128
    ecap 0002[100] = VC 1 max VC1
    ecap 0005[130] = Root Complex Link Declaration 1

pcib1@pci0:0:28:0:	class=0x060400 rev=0xb4 hdr=0x01 vendor=0x8086 device=0x1c10 subvendor=0x1028 subdevice=0x0494
    vendor     = 'Intel Corporation'
    device     = '6 Series/C200 Series Chipset Family PCI Express Root Port 1'
    class      = bridge
    subclass   = PCI-PCI
    cap 10[40] = PCI-Express 2 root port max data 128(128)
                 max read 128
                 link x0(x1) speed 0.0(5.0) ASPM L0s/L1(L0s/L1)
                 slot 0 power limit 100 mW
    cap 05[80] = MSI supports 1 message 
    cap 0d[90] = PCI Bridge subvendor=0x1028 subdevice=0x0494
    cap 01[a0] = powerspec 2  supports D0 D3  current D0

pcib2@pci0:0:28:1:	class=0x060400 rev=0xb4 hdr=0x01 vendor=0x8086 device=0x1c12 subvendor=0x1028 subdevice=0x0494
    vendor     = 'Intel Corporation'
    device     = '6 Series/C200 Series Chipset Family PCI Express Root Port 2'
    class      = bridge
    subclass   = PCI-PCI
    cap 10[40] = PCI-Express 2 root port max data 128(128)
                 max read 128
                 link x1(x1) speed 2.5(5.0) ASPM L1(L0s/L1)
                 slot 1 power limit 100 mW
    cap 05[80] = MSI supports 1 message 
    cap 0d[90] = PCI Bridge subvendor=0x1028 subdevice=0x0494
    cap 01[a0] = powerspec 2  supports D0 D3  current D0

pcib3@pci0:0:28:2:	class=0x060400 rev=0xb4 hdr=0x01 vendor=0x8086 device=0x1c14 subvendor=0x1028 subdevice=0x0494
    vendor     = 'Intel Corporation'
    device     = '6 Series/C200 Series Chipset Family PCI Express Root Port 3'
    class      = bridge
    subclass   = PCI-PCI
    cap 10[40] = PCI-Express 2 root port max data 128(128)
                 max read 128
                 link x0(x1) speed 0.0(5.0) ASPM L0s/L1(L0s/L1)
                 slot 2 power limit 100 mW HotPlug(empty) surprise
    cap 05[80] = MSI supports 1 message enabled with 1 message
    cap 0d[90] = PCI Bridge subvendor=0x1028 subdevice=0x0494
    cap 01[a0] = powerspec 2  supports D0 D3  current D0

pcib4@pci0:0:28:3:	class=0x060400 rev=0xb4 hdr=0x01 vendor=0x8086 device=0x1c16 subvendor=0x1028 subdevice=0x0494
    vendor     = 'Intel Corporation'
    device     = '6 Series/C200 Series Chipset Family PCI Express Root Port 4'
    class      = bridge
    subclass   = PCI-PCI
    cap 10[40] = PCI-Express 2 root port max data 128(128)
                 max read 128
                 link x0(x1) speed 0.0(5.0) ASPM L0s/L1(L0s/L1)
                 slot 3 power limit 100 mW HotPlug(empty) surprise
    cap 05[80] = MSI supports 1 message enabled with 1 message
    cap 0d[90] = PCI Bridge subvendor=0x1028 subdevice=0x0494
    cap 01[a0] = powerspec 2  supports D0 D3  current D0

pcib5@pci0:0:28:5:	class=0x060400 rev=0xb4 hdr=0x01 vendor=0x8086 device=0x1c1a subvendor=0x1028 subdevice=0x0494
    vendor     = 'Intel Corporation'
    device     = '6 Series/C200 Series Chipset Family PCI Express Root Port 6'
    class      = bridge
    subclass   = PCI-PCI
    cap 10[40] = PCI-Express 2 root port max data 128(128)
                 max read 128
                 link x1(x1) speed 2.5(5.0) ASPM L0s(L0s/L1)
                 slot 5 power limit 100 mW
    cap 05[80] = MSI supports 1 message 
    cap 0d[90] = PCI Bridge subvendor=0x1028 subdevice=0x0494
    cap 01[a0] = powerspec 2  supports D0 D3  current D0

ehci1@pci0:0:29:0:	class=0x0c0320 rev=0x04 hdr=0x00 vendor=0x8086 device=0x1c26 subvendor=0x1028 subdevice=0x0494
    vendor     = 'Intel Corporation'
    device     = '6 Series/C200 Series Chipset Family USB Enhanced Host Controller'
    class      = serial bus
    subclass   = USB
    bar   [10] = type Memory, range 32, base 0xe2e40000, size 1024, enabled
    cap 01[50] = powerspec 2  supports D0 D3  current D0
    cap 0a[58] = EHCI Debug Port at offset 0xa0 in map 0x14
    cap 13[98] = PCI Advanced Features: FLR TP

isab0@pci0:0:31:0:	class=0x060100 rev=0x04 hdr=0x00 vendor=0x8086 device=0x1c4f subvendor=0x1028 subdevice=0x0494
    vendor     = 'Intel Corporation'
    device     = 'QM67 Express Chipset LPC Controller'
    class      = bridge
    subclass   = PCI-ISA
    cap 09[e0] = vendor (length 12) Intel cap 1 version 0
		 features: AMT, 4 PCI-e x1 slots

atapci0@pci0:0:31:2:	class=0x01018f rev=0x04 hdr=0x00 vendor=0x8086 device=0x1c01 subvendor=0x1028 subdevice=0x0494
    vendor     = 'Intel Corporation'
    device     = '6 Series/C200 Series Chipset Family Mobile SATA Controller (IDE mode, ports 0-3)'
    class      = mass storage
    subclass   = ATA
    bar   [10] = type I/O Port, range 32, base 0x4130, size 8, enabled
    bar   [14] = type I/O Port, range 32, base 0x4120, size 4, enabled
    bar   [18] = type I/O Port, range 32, base 0x4110, size 8, enabled
    bar   [1c] = type I/O Port, range 32, base 0x4100, size 4, enabled
    bar   [20] = type I/O Port, range 32, base 0x40f0, size 16, enabled
    bar   [24] = type I/O Port, range 32, base 0x40e0, size 16, enabled
    cap 01[70] = powerspec 3  supports D0 D3  current D0
    cap 13[b0] = PCI Advanced Features: FLR TP

ichsmb0@pci0:0:31:3:	class=0x0c0500 rev=0x04 hdr=0x00 vendor=0x8086 device=0x1c22 subvendor=0x1028 subdevice=0x0494
    vendor     = 'Intel Corporation'
    device     = '6 Series/C200 Series Chipset Family SMBus Controller'
    class      = serial bus
    subclass   = SMBus
    bar   [10] = type Memory, range 64, base 0xe2e30000, size 256, enabled
    bar   [20] = type I/O Port, range 32, base 0x4040, size 32, enabled

atapci1@pci0:0:31:5:	class=0x010185 rev=0x04 hdr=0x00 vendor=0x8086 device=0x1c09 subvendor=0x1028 subdevice=0x0494
    vendor     = 'Intel Corporation'
    device     = '6 Series/C200 Series Chipset Family Mobile SATA Controller (IDE mode, ports 4-5)'
    class      = mass storage
    subclass   = ATA
    bar   [10] = type I/O Port, range 32, base 0x40d0, size 8, enabled
    bar   [14] = type I/O Port, range 32, base 0x40c0, size 4, enabled
    bar   [18] = type I/O Port, range 32, base 0x40b0, size 8, enabled
    bar   [1c] = type I/O Port, range 32, base 0x40a0, size 4, enabled
    bar   [20] = type I/O Port, range 32, base 0x4090, size 16, enabled
    bar   [24] = type I/O Port, range 32, base 0x4080, size 16, enabled
    cap 01[70] = powerspec 3  supports D0 D3  current D0
    cap 13[b0] = PCI Advanced Features: FLR TP

iwn0@pci0:2:0:0:	class=0x028000 rev=0x34 hdr=0x00 vendor=0x8086 device=0x0082 subvendor=0x8086 subdevice=0x1321
    vendor     = 'Intel Corporation'
    device     = 'Centrino Advanced-N 6205 [Taylor Peak]'
    class      = network
    bar   [10] = type Memory, range 64, base 0xe2d00000, size 8192, enabled
    cap 01[c8] = powerspec 3  supports D0 D3  current D0
    cap 05[d0] = MSI supports 1 message, 64 bit enabled with 1 message
    cap 10[e0] = PCI-Express 1 endpoint max data 128(128) FLR RO NS
                 max read 128
                 link x1(x1) speed 2.5(2.5) ASPM L1(L0s/L1) ClockPM enabled
    ecap 0001[100] = AER 1 0 fatal 0 non-fatal 1 corrected
    ecap 0003[140] = Serial 1 8c705affff8a27a0

none1@pci0:10:0:0:	class=0x0c0010 rev=0x05 hdr=0x00 vendor=0x1217 device=0x13f7 subvendor=0x1028 subdevice=0x0494
    vendor     = 'O2 Micro, Inc.'
    device     = '1394 OHCI Compliant Host Controller'
    class      = serial bus
    subclass   = FireWire
    bar   [10] = type Memory, range 32, base 0xe2c30000, size 4096, enabled
    cap 01[a0] = powerspec 3  supports D0 D1 D2 D3  current D0
    cap 05[48] = MSI supports 1 message, 64 bit, vector masks 
    cap 10[80] = PCI-Express 1 endpoint max data 128(128) RO NS
                 max read 512
                 link x1(x1) speed 2.5(2.5) ASPM L0s(L0s/L1) ClockPM enabled
    ecap 0002[100] = VC 1 max VC0
    ecap 0001[200] = AER 1 0 fatal 0 non-fatal 1 corrected

sdhci_pci0@pci0:10:0:1:	class=0x080501 rev=0x05 hdr=0x00 vendor=0x1217 device=0x8321 subvendor=0x1028 subdevice=0x0494
    vendor     = 'O2 Micro, Inc.'
    device     = 'OZ600RJ0/OZ900RJ0/OZ600RJS SD/MMC Card Reader Controller'
    class      = base peripheral
    subclass   = SD host controller
    bar   [10] = type Memory, range 32, base 0xe2c20000, size 512, enabled
    cap 01[a0] = powerspec 3  supports D0 D1 D2 D3  current D0
    cap 05[48] = MSI supports 1 message, 64 bit, vector masks 
    cap 10[80] = PCI-Express 1 endpoint max data 128(128) RO NS
                 max read 512
                 link x1(x1) speed 2.5(2.5) ASPM L0s(L0s/L1) ClockPM enabled
    ecap 0002[100] = VC 1 max VC0
    ecap 0001[200] = AER 1 0 fatal 0 non-fatal 1 corrected

none2@pci0:10:0:2:	class=0x018000 rev=0x05 hdr=0x00 vendor=0x1217 device=0x8331 subvendor=0x1028 subdevice=0x0494
    vendor     = 'O2 Micro, Inc.'
    device     = 'O2 Flash Memory Card'
    class      = mass storage
    bar   [10] = type Memory, range 32, base 0xe2c10000, size 1024, enabled
    bar   [18] = type Memory, range 32, base 0xe2c00000, size 1024, enabled
    cap 01[a0] = powerspec 3  supports D0 D1 D2 D3  current D0
    cap 05[48] = MSI supports 1 message, 64 bit, vector masks 
    cap 10[80] = PCI-Express 1 endpoint max data 128(128) RO NS
                 max read 512
                 link x1(x1) speed 2.5(2.5) ASPM L0s(L0s/L1) ClockPM enabled
    ecap 0002[100] = VC 1 max VC0
    ecap 0001[200] = AER 1 0 fatal 0 non-fatal 1 corrected
