hostb0@pci0:0:0:0:	class=0x060000 rev=0x06 hdr=0x00 vendor=0x8086 device=0x0c00 subvendor=0x103c subdevice=0x8076
    vendor     = 'Intel Corporation'
    device     = '4th Gen Core Processor DRAM Controller'
    class      = bridge
    subclass   = HOST-PCI
    cap 09[e0] = vendor (length 12) Intel cap 0 version 1

vgapci0@pci0:0:2:0:	class=0x030000 rev=0x06 hdr=0x00 vendor=0x8086 device=0x0412 subvendor=0x103c subdevice=0x8076
    vendor     = 'Intel Corporation'
    device     = 'Xeon E3-1200 v3/4th Gen Core Processor Integrated Graphics Controller'
    class      = display
    subclass   = VGA
    bar   [10] = type Memory, range 64, base 0xf7400000, size 4194304, enabled
    bar   [18] = type Prefetchable Memory, range 64, base 0xe0000000, size 268435456, enabled
    bar   [20] = type I/O Port, range 32, base 0xf000, size 64, enabled
    cap 05[90] = MSI supports 1 message 
    cap 01[d0] = powerspec 2  supports D0 D3  current D0
    cap 13[a4] = PCI Advanced Features: FLR TP

hdac0@pci0:0:3:0:	class=0x040300 rev=0x06 hdr=0x00 vendor=0x8086 device=0x0c0c subvendor=0x103c subdevice=0x8076
    vendor     = 'Intel Corporation'
    device     = 'Xeon E3-1200 v3/4th Gen Core Processor HD Audio Controller'
    class      = multimedia
    subclass   = HDA
    bar   [10] = type Memory, range 64, base 0xf7c34000, size 16384, enabled
    cap 01[50] = powerspec 2  supports D0 D3  current D0
    cap 05[60] = MSI supports 1 message enabled with 1 message
    cap 10[70] = PCI-Express 1 root endpoint max data 128(128) FLR NS
                 max read 128

xhci0@pci0:0:20:0:	class=0x0c0330 rev=0x05 hdr=0x00 vendor=0x8086 device=0x8c31 subvendor=0x103c subdevice=0x8076
    vendor     = 'Intel Corporation'
    device     = '8 Series/C220 Series Chipset Family USB xHCI'
    class      = serial bus
    subclass   = USB
    bar   [10] = type Memory, range 64, base 0xf7c20000, size 65536, enabled
    cap 01[70] = powerspec 2  supports D0 D3  current D0
    cap 05[80] = MSI supports 8 messages, 64 bit enabled with 1 message

none0@pci0:0:22:0:	class=0x078000 rev=0x04 hdr=0x00 vendor=0x8086 device=0x8c3a subvendor=0x103c subdevice=0x8076
    vendor     = 'Intel Corporation'
    device     = '8 Series/C220 Series Chipset Family MEI Controller'
    class      = simple comms
    bar   [10] = type Memory, range 64, base 0xf7c3d000, size 16, enabled
    cap 01[50] = powerspec 3  supports D0 D3  current D0
    cap 05[8c] = MSI supports 1 message, 64 bit 

em0@pci0:0:25:0:	class=0x020000 rev=0x05 hdr=0x00 vendor=0x8086 device=0x153a subvendor=0x103c subdevice=0x8076
    vendor     = 'Intel Corporation'
    device     = 'Ethernet Connection I217-LM'
    class      = network
    subclass   = ethernet
    bar   [10] = type Memory, range 32, base 0xf7c00000, size 131072, enabled
    bar   [14] = type Memory, range 32, base 0xf7c3b000, size 4096, enabled
    bar   [18] = type I/O Port, range 32, base 0xf060, size 32, enabled
    cap 01[c8] = powerspec 2  supports D0 D3  current D0
    cap 05[d0] = MSI supports 1 message, 64 bit enabled with 1 message
    cap 13[e0] = PCI Advanced Features: FLR TP

ehci0@pci0:0:26:0:	class=0x0c0320 rev=0x05 hdr=0x00 vendor=0x8086 device=0x8c2d subvendor=0x103c subdevice=0x8076
    vendor     = 'Intel Corporation'
    device     = '8 Series/C220 Series Chipset Family USB EHCI'
    class      = serial bus
    subclass   = USB
    bar   [10] = type Memory, range 32, base 0xf7c3a000, size 1024, enabled
    cap 01[50] = powerspec 2  supports D0 D3  current D0
    cap 0a[58] = EHCI Debug Port at offset 0xa0 in map 0x14
    cap 13[98] = PCI Advanced Features: FLR TP

hdac1@pci0:0:27:0:	class=0x040300 rev=0x05 hdr=0x00 vendor=0x8086 device=0x8c20 subvendor=0x103c subdevice=0x8076
    vendor     = 'Intel Corporation'
    device     = '8 Series/C220 Series Chipset High Definition Audio Controller'
    class      = multimedia
    subclass   = HDA
    bar   [10] = type Memory, range 64, base 0xf7c30000, size 16384, enabled
    cap 01[50] = powerspec 2  supports D0 D3  current D0
    cap 05[60] = MSI supports 1 message, 64 bit enabled with 1 message
    cap 10[70] = PCI-Express 1 root endpoint max data 128(128) FLR
                 max read 128
    ecap 0002[100] = VC 1 max VC1

pcib1@pci0:0:28:0:	class=0x060400 rev=0xd5 hdr=0x01 vendor=0x8086 device=0x8c10 subvendor=0x103c subdevice=0x8076
    vendor     = 'Intel Corporation'
    device     = '8 Series/C220 Series Chipset Family PCI Express Root Port'
    class      = bridge
    subclass   = PCI-PCI
    cap 10[40] = PCI-Express 2 root port max data 128(128)
                 max read 128
                 link x4(x4) speed 5.0(5.0) ASPM L1(L0s/L1)
                 slot 0 power limit 250 mW
    cap 05[80] = MSI supports 1 message 
    cap 0d[90] = PCI Bridge subvendor=0x103c subdevice=0x8076
    cap 01[a0] = powerspec 3  supports D0 D3  current D0

pcib2@pci0:0:28:4:	class=0x060400 rev=0xd5 hdr=0x01 vendor=0x8086 device=0x8c18 subvendor=0x103c subdevice=0x8076
    vendor     = 'Intel Corporation'
    device     = '8 Series/C220 Series Chipset Family PCI Express Root Port'
    class      = bridge
    subclass   = PCI-PCI
    cap 10[40] = PCI-Express 2 root port max data 128(128)
                 max read 128
                 link x1(x1) speed 2.5(5.0) ASPM L1(L0s/L1)
                 slot 4 power limit 100 mW
    cap 05[80] = MSI supports 1 message 
    cap 0d[90] = PCI Bridge subvendor=0x103c subdevice=0x8076
    cap 01[a0] = powerspec 3  supports D0 D3  current D0

ehci1@pci0:0:29:0:	class=0x0c0320 rev=0x05 hdr=0x00 vendor=0x8086 device=0x8c26 subvendor=0x103c subdevice=0x8076
    vendor     = 'Intel Corporation'
    device     = '8 Series/C220 Series Chipset Family USB EHCI'
    class      = serial bus
    subclass   = USB
    bar   [10] = type Memory, range 32, base 0xf7c39000, size 1024, enabled
    cap 01[50] = powerspec 2  supports D0 D3  current D0
    cap 0a[58] = EHCI Debug Port at offset 0xa0 in map 0x14
    cap 13[98] = PCI Advanced Features: FLR TP

isab0@pci0:0:31:0:	class=0x060100 rev=0x05 hdr=0x00 vendor=0x8086 device=0x8c5c subvendor=0x103c subdevice=0x8076
    vendor     = 'Intel Corporation'
    device     = 'H81 Express LPC Controller'
    class      = bridge
    subclass   = PCI-ISA
    cap 09[e0] = vendor (length 12) Intel cap 1 version 0
		 features: AMT, 4 PCI-e x1 slots

ichsmb0@pci0:0:31:3:	class=0x0c0500 rev=0x05 hdr=0x00 vendor=0x8086 device=0x8c22 subvendor=0x103c subdevice=0x8076
    vendor     = 'Intel Corporation'
    device     = '8 Series/C220 Series Chipset Family SMBus Controller'
    class      = serial bus
    subclass   = SMBus
    bar   [10] = type Memory, range 64, base 0xf7c38000, size 256, enabled
    bar   [20] = type I/O Port, range 32, base 0xf040, size 32, enabled

nvme0@pci0:1:0:0:	class=0x010802 rev=0x01 hdr=0x00 vendor=0x15b7 device=0x5017 subvendor=0x15b7 subdevice=0x5017
    vendor     = 'Sandisk Corp'
    class      = mass storage
    subclass   = NVM
    bar   [10] = type Memory, range 64, base 0xf7b00000, size 16384, enabled
    cap 01[80] = powerspec 3  supports D0 D3  current D0
    cap 05[90] = MSI supports 32 messages, 64 bit 
    cap 11[b0] = MSI-X supports 65 messages, enabled
                 Table in map 0x10[0x3000], PBA in map 0x10[0x2000]
    cap 10[c0] = PCI-Express 2 endpoint max data 128(512) FLR NS
                 max read 512
                 link x4(x4) speed 5.0(16.0) ASPM L1(L1) ClockPM disabled
    ecap 0001[100] = AER 2 0 fatal 0 non-fatal 1 corrected
    ecap 0018[1b8] = LTR 1
    ecap 0019[300] = PCIe Sec 1 lane errors 0
    ecap 001e[900] = L1 PM Substates 1
    ecap 0025[910] = Data Link Feature 1
    ecap 0027[920] = Lane Margining at Receiver 1
    ecap 0026[9c0] = Physical Layer 16.0 GT/s 1

igb0@pci0:2:0:0:	class=0x020000 rev=0x03 hdr=0x00 vendor=0x8086 device=0x1533 subvendor=0x0000 subdevice=0x0000
    vendor     = 'Intel Corporation'
    device     = 'I210 Gigabit Network Connection'
    class      = network
    subclass   = ethernet
    bar   [10] = type Memory, range 32, base 0xf7900000, size 1048576, enabled
    bar   [1c] = type Memory, range 32, base 0xf7a00000, size 16384, enabled
    cap 01[40] = powerspec 3  supports D0 D3  current D0
    cap 05[50] = MSI supports 1 message, 64 bit, vector masks 
    cap 11[70] = MSI-X supports 5 messages, enabled
                 Table in map 0x1c[0x0], PBA in map 0x1c[0x2000]
    cap 10[a0] = PCI-Express 2 endpoint max data 128(512) FLR NS
                 max read 512
                 link x1(x1) speed 2.5(2.5) ASPM L1(L0s/L1)
    ecap 0001[100] = AER 2 0 fatal 0 non-fatal 0 corrected
    ecap 0003[140] = Serial 1 6cb311ffff541159
    ecap 0017[1a0] = TPH Requester 1
