hostb0@pci0:0:0:0:	class=0x060000 rev=0x08 hdr=0x00 vendor=0x8086 device=0x3ed0 subvendor=0x8086 subdevice=0x2074
    vendor     = 'Intel Corporation'
    device     = '8th Gen Core Processor Host Bridge/DRAM Registers'
    class      = bridge
    subclass   = HOST-PCI
    cap 09[e0] = vendor (length 16) Intel cap 0 version 1

vgapci0@pci0:0:2:0:	class=0x030000 rev=0x01 hdr=0x00 vendor=0x8086 device=0x3ea5 subvendor=0x8086 subdevice=0x2074
    vendor     = 'Intel Corporation'
    device     = 'CoffeeLake-U GT3e [Iris Plus Graphics 655]'
    class      = display
    subclass   = VGA
    bar   [10] = type Memory, range 64, base 0x8f000000, size 16777216, enabled
    bar   [18] = type Prefetchable Memory, range 64, base 0x40000000, size 536870912, enabled
    bar   [20] = type I/O Port, range 32, base 0x3000, size 64, enabled
    cap 09[40] = vendor (length 12) Intel cap 0 version 1
    cap 10[70] = PCI-Express 2 root endpoint max data 128(128) FLR
                 max read 128
    cap 05[ac] = MSI supports 1 message enabled with 1 message
    cap 01[d0] = powerspec 2  supports D0 D3  current D0
    ecap 001b[100] = Process Address Space ID 1
    ecap 000f[200] = ATS 1
    ecap 0013[300] = Page Page Request 1

none0@pci0:0:8:0:	class=0x088000 rev=0x00 hdr=0x00 vendor=0x8086 device=0x1911 subvendor=0x8086 subdevice=0x2074
    vendor     = 'Intel Corporation'
    device     = 'Xeon E3-1200 v5/v6 / E3-1500 v5 / 6th/7th/8th Gen Core Processor Gaussian Mixture Model'
    class      = base peripheral
    bar   [10] = type Memory, range 64, base 0x404a116000, size 4096, enabled
    cap 05[90] = MSI supports 1 message 
    cap 01[dc] = powerspec 2  supports D0 D3  current D0
    cap 13[f0] = PCI Advanced Features: FLR TP

pchtherm0@pci0:0:18:0:	class=0x118000 rev=0x30 hdr=0x00 vendor=0x8086 device=0x9df9 subvendor=0x8086 subdevice=0x2074
    vendor     = 'Intel Corporation'
    device     = 'Cannon Point-LP Thermal Controller'
    class      = dasp
    bar   [10] = type Memory, range 64, base 0x404a115000, size 4096, enabled
    cap 01[50] = powerspec 3  supports D0 D3  current D0
    cap 05[80] = MSI supports 1 message 

xhci0@pci0:0:20:0:	class=0x0c0330 rev=0x30 hdr=0x00 vendor=0x8086 device=0x9ded subvendor=0x8086 subdevice=0x2074
    vendor     = 'Intel Corporation'
    device     = 'Cannon Point-LP USB 3.1 xHCI Controller'
    class      = serial bus
    subclass   = USB
    bar   [10] = type Memory, range 64, base 0x404a100000, size 65536, enabled
    cap 01[70] = powerspec 2  supports D0 D3  current D0
    cap 05[80] = MSI supports 8 messages, 64 bit enabled with 1 message
    cap 09[90] = vendor (length 20) Intel cap 15 version 0

none1@pci0:0:20:2:	class=0x050000 rev=0x30 hdr=0x00 vendor=0x8086 device=0x9def subvendor=0x8086 subdevice=0x2074
    vendor     = 'Intel Corporation'
    device     = 'Cannon Point-LP Shared SRAM'
    class      = memory
    subclass   = RAM
    bar   [10] = type Memory, range 64, base 0x404a110000, size 8192, enabled
    bar   [18] = type Memory, range 64, base 0x404a114000, size 4096, enabled
    cap 01[80] = powerspec 3  supports D0 D3  current D0

none2@pci0:0:22:0:	class=0x078000 rev=0x30 hdr=0x00 vendor=0x8086 device=0x9de0 subvendor=0x8086 subdevice=0x2074
    vendor     = 'Intel Corporation'
    device     = 'Cannon Point-LP MEI Controller'
    class      = simple comms
    bar   [10] = type Memory, range 64, base 0x404a113000, size 4096, enabled
    cap 01[50] = powerspec 3  supports D0 D3  current D0
    cap 05[8c] = MSI supports 1 message, 64 bit 
    cap 09[a4] = vendor (length 20) Intel cap 15 version 0

ahci0@pci0:0:23:0:	class=0x010601 rev=0x30 hdr=0x00 vendor=0x8086 device=0x9dd3 subvendor=0x8086 subdevice=0x2074
    vendor     = 'Intel Corporation'
    device     = 'Cannon Point-LP SATA Controller [AHCI Mode]'
    class      = mass storage
    subclass   = SATA
    bar   [10] = type Memory, range 32, base 0x90124000, size 8192, enabled
    bar   [14] = type Memory, range 32, base 0x90127000, size 256, enabled
    bar   [18] = type I/O Port, range 32, base 0x3090, size 8, enabled
    bar   [1c] = type I/O Port, range 32, base 0x3080, size 4, enabled
    bar   [20] = type I/O Port, range 32, base 0x3060, size 32, enabled
    bar   [24] = type Memory, range 32, base 0x90126000, size 2048, enabled
    cap 05[80] = MSI supports 1 message enabled with 1 message
    cap 01[70] = powerspec 3  supports D0 D3  current D0
    cap 12[a8] = SATA Index-Data Pair

pcib1@pci0:0:28:0:	class=0x060400 rev=0xf0 hdr=0x01 vendor=0x8086 device=0x9db8 subvendor=0x8086 subdevice=0x2074
    vendor     = 'Intel Corporation'
    device     = 'Cannon Point-LP PCI Express Root Port'
    class      = bridge
    subclass   = PCI-PCI
    cap 10[40] = PCI-Express 2 root port max data 128(256) ARI disabled
                 max read 128
                 link x0(x1) speed 0.0(8.0) ASPM L0s/L1(L0s/L1)
    cap 05[80] = MSI supports 1 message 
    cap 0d[90] = PCI Bridge subvendor=0x8086 subdevice=0x2074
    cap 01[a0] = powerspec 3  supports D0 D3  current D0

pcib2@pci0:0:28:4:	class=0x060400 rev=0xf0 hdr=0x01 vendor=0x8086 device=0x9dbc subvendor=0x8086 subdevice=0x2074
    vendor     = 'Intel Corporation'
    device     = 'Cannon Point-LP PCI Express Root Port'
    class      = bridge
    subclass   = PCI-PCI
    cap 10[40] = PCI-Express 2 root port max data 128(128) ARI disabled
                 max read 128
                 link x4(x4) speed 8.0(8.0) ASPM disabled(L1)
                 slot 8 power limit 250 mW HotPlug(present) surprise
    cap 05[80] = MSI supports 1 message enabled with 1 message
    cap 0d[90] = PCI Bridge subvendor=0x8086 subdevice=0x2074
    cap 01[a0] = powerspec 3  supports D0 D3  current D0
    ecap 0001[100] = AER 1 0 fatal 0 non-fatal 0 corrected
    ecap 000d[140] = ACS 1
    ecap 001f[150] = Precision Time Measurement 1
    ecap 0019[220] = PCIe Sec 1 lane errors 0
    ecap 001d[250] = Downstream Port Containment 1

pcib7@pci0:0:29:0:	class=0x060400 rev=0xf0 hdr=0x01 vendor=0x8086 device=0x9db0 subvendor=0x8086 subdevice=0x2074
    vendor     = 'Intel Corporation'
    device     = 'Cannon Point-LP PCI Express Root Port'
    class      = bridge
    subclass   = PCI-PCI
    cap 10[40] = PCI-Express 2 root port max data 256(256) ARI disabled
                 max read 128
                 link x4(x4) speed 8.0(8.0) ASPM L1(L0s/L1)
                 slot 12 power limit 250 mW
    cap 05[80] = MSI supports 1 message 
    cap 0d[90] = PCI Bridge subvendor=0x8086 subdevice=0x2074
    cap 01[a0] = powerspec 3  supports D0 D3  current D0
    ecap 0001[100] = AER 1 0 fatal 0 non-fatal 0 corrected
    ecap 000d[140] = ACS 1
    ecap 001f[150] = Precision Time Measurement 1
    ecap 001e[200] = L1 PM Substates 1
    ecap 0019[220] = PCIe Sec 1 lane errors 0
    ecap 001d[250] = Downstream Port Containment 1

isab0@pci0:0:31:0:	class=0x060100 rev=0x30 hdr=0x00 vendor=0x8086 device=0x9d84 subvendor=0x8086 subdevice=0x2074
    vendor     = 'Intel Corporation'
    device     = 'Cannon Point-LP LPC Controller'
    class      = bridge
    subclass   = PCI-ISA

hdac0@pci0:0:31:3:	class=0x040380 rev=0x30 hdr=0x00 vendor=0x8086 device=0x9dc8 subvendor=0x8086 subdevice=0x2074
    vendor     = 'Intel Corporation'
    device     = 'Cannon Point-LP High Definition Audio Controller'
    class      = multimedia
    subclass   = HDA
    bar   [10] = type Memory, range 64, base 0x90120000, size 16384, enabled
    bar   [20] = type Memory, range 64, base 0x404a000000, size 1048576, enabled
    cap 01[50] = powerspec 3  supports D0 D3  current D0
    cap 09[80] = vendor (length 20) Intel cap 15 version 0
    cap 05[60] = MSI supports 1 message, 64 bit enabled with 1 message

none3@pci0:0:31:4:	class=0x0c0500 rev=0x30 hdr=0x00 vendor=0x8086 device=0x9da3 subvendor=0x8086 subdevice=0x2074
    vendor     = 'Intel Corporation'
    device     = 'Cannon Point-LP SMBus Controller'
    class      = serial bus
    subclass   = SMBus
    bar   [10] = type Memory, range 64, base 0x404a112000, size 256, enabled
    bar   [20] = type I/O Port, range 32, base 0xefa0, size 32, enabled

none4@pci0:0:31:5:	class=0x0c8000 rev=0x30 hdr=0x00 vendor=0x8086 device=0x9da4 subvendor=0x8086 subdevice=0x2074
    vendor     = 'Intel Corporation'
    device     = 'Cannon Point-LP SPI Controller'
    class      = serial bus
    bar   [10] = type Memory, range 32, base 0xfe010000, size 4096, enabled

em0@pci0:0:31:6:	class=0x020000 rev=0x30 hdr=0x00 vendor=0x8086 device=0x15be subvendor=0x8086 subdevice=0x2074
    vendor     = 'Intel Corporation'
    device     = 'Ethernet Connection (6) I219-V'
    class      = network
    subclass   = ethernet
    bar   [10] = type Memory, range 32, base 0x90100000, size 131072, enabled
    cap 01[c8] = powerspec 3  supports D0 D3  current D0
    cap 05[d0] = MSI supports 1 message, 64 bit enabled with 1 message

pcib3@pci0:2:0:0:	class=0x060400 rev=0x02 hdr=0x01 vendor=0x8086 device=0x15da subvendor=0x8086 subdevice=0x2074
    vendor     = 'Intel Corporation'
    device     = 'JHL6340 Thunderbolt 3 Bridge (C step) [Alpine Ridge 2C 2016]'
    class      = bridge
    subclass   = PCI-PCI
    cap 01[80] = powerspec 3  supports D0 D1 D2 D3  current D0
    cap 05[88] = MSI supports 1 message, 64 bit 
    cap 0d[ac] = PCI Bridge subvendor=0x8086 subdevice=0x2074
    cap 10[c0] = PCI-Express 2 upstream port max data 128(128) RO NS
                 max read 512
                 link x4(x4) speed 8.0(8.0) ASPM disabled(L0s/L1) ClockPM enabled
    ecap 0003[100] = Serial 1 59aa40082d00aa00
    ecap 0001[200] = AER 1 0 fatal 0 non-fatal 2 corrected
    ecap 0002[300] = VC 1 max VC0
    ecap 0004[400] = Power Budgeting 1
    ecap 000b[500] = Vendor [1] ID 1234 Rev 1 Length 216
    ecap 0018[600] = LTR 1
    ecap 0019[700] = PCIe Sec 1 lane errors 0xf

pcib4@pci0:3:0:0:	class=0x060400 rev=0x02 hdr=0x01 vendor=0x8086 device=0x15da subvendor=0x8086 subdevice=0x2074
    vendor     = 'Intel Corporation'
    device     = 'JHL6340 Thunderbolt 3 Bridge (C step) [Alpine Ridge 2C 2016]'
    class      = bridge
    subclass   = PCI-PCI
    cap 01[80] = powerspec 3  supports D0 D1 D2 D3  current D0
    cap 05[88] = MSI supports 1 message, 64 bit 
    cap 0d[ac] = PCI Bridge subvendor=0x8086 subdevice=0x2074
    cap 10[c0] = PCI-Express 2 downstream port max data 128(128) RO NS
                 max read 512
                 link x4(x4) speed 2.5(2.5) ASPM L0s/L1(L0s/L1)
                 slot 0 power limit 0 mW
    ecap 0003[100] = Serial 1 59aa40082d00aa00
    ecap 0001[200] = AER 1 0 fatal 0 non-fatal 0 corrected
    ecap 0002[300] = VC 1 max VC1 lowpri VC0-VC1
    ecap 0004[400] = Power Budgeting 1
    ecap 000b[500] = Vendor [1] ID 1234 Rev 1 Length 216
    ecap 0019[700] = PCIe Sec 1 lane errors 0

pcib5@pci0:3:1:0:	class=0x060400 rev=0x02 hdr=0x01 vendor=0x8086 device=0x15da subvendor=0x8086 subdevice=0x2074
    vendor     = 'Intel Corporation'
    device     = 'JHL6340 Thunderbolt 3 Bridge (C step) [Alpine Ridge 2C 2016]'
    class      = bridge
    subclass   = PCI-PCI
    cap 01[80] = powerspec 3  supports D0 D1 D2 D3  current D0
    cap 05[88] = MSI supports 1 message, 64 bit enabled with 1 message
    cap 0d[ac] = PCI Bridge subvendor=0x8086 subdevice=0x2074
    cap 10[c0] = PCI-Express 2 downstream port max data 128(128) RO NS
                 max read 512
                 link x4(x4) speed 2.5(2.5) ASPM L0s/L1(L0s/L1)
                 slot 1 power limit 0 mW HotPlug(empty) surprise
    ecap 0003[100] = Serial 1 59aa40082d00aa00
    ecap 0001[200] = AER 1 0 fatal 0 non-fatal 0 corrected
    ecap 0002[300] = VC 1 max VC0
    ecap 0004[400] = Power Budgeting 1
    ecap 000b[500] = Vendor [1] ID 1234 Rev 1 Length 216
    ecap 0019[700] = PCIe Sec 1 lane errors 0

pcib6@pci0:3:2:0:	class=0x060400 rev=0x02 hdr=0x01 vendor=0x8086 device=0x15da subvendor=0x8086 subdevice=0x2074
    vendor     = 'Intel Corporation'
    device     = 'JHL6340 Thunderbolt 3 Bridge (C step) [Alpine Ridge 2C 2016]'
    class      = bridge
    subclass   = PCI-PCI
    cap 01[80] = powerspec 3  supports D0 D1 D2 D3  current D0
    cap 05[88] = MSI supports 1 message, 64 bit 
    cap 0d[ac] = PCI Bridge subvendor=0x8086 subdevice=0x2074
    cap 10[c0] = PCI-Express 2 downstream port max data 128(128) RO NS
                 max read 512
                 link x4(x4) speed 2.5(2.5) ASPM L0s/L1(L0s/L1)
                 slot 0 power limit 0 mW
    ecap 0003[100] = Serial 1 59aa40082d00aa00
    ecap 0001[200] = AER 1 0 fatal 0 non-fatal 0 corrected
    ecap 0002[300] = VC 1 max VC0
    ecap 0004[400] = Power Budgeting 1
    ecap 000b[500] = Vendor [1] ID 1234 Rev 1 Length 216
    ecap 0019[700] = PCIe Sec 1 lane errors 0

xhci1@pci0:108:0:0:	class=0x0c0330 rev=0x02 hdr=0x00 vendor=0x8086 device=0x15db subvendor=0x8086 subdevice=0x2074
    vendor     = 'Intel Corporation'
    device     = 'JHL6340 Thunderbolt 3 USB 3.1 Controller (C step) [Alpine Ridge 2C 2016]'
    class      = serial bus
    subclass   = USB
    bar   [10] = type Memory, range 32, base 0x8df00000, size 65536, enabled
    cap 01[80] = powerspec 3  supports D0 D1 D2 D3  current D0
    cap 05[88] = MSI supports 8 messages, 64 bit enabled with 1 message
    cap 10[c0] = PCI-Express 2 endpoint max data 128(128) RO NS
                 max read 512
                 link x4(x4) speed 2.5(2.5) ASPM L0s/L1(L0s/L1) ClockPM enabled
    ecap 0003[100] = Serial 1 59aa40082d00aa00
    ecap 0001[200] = AER 1 0 fatal 0 non-fatal 1 corrected
    ecap 0002[300] = VC 1 max VC0
    ecap 0004[400] = Power Budgeting 1
    ecap 000b[500] = Vendor [1] ID 1234 Rev 1 Length 216
    ecap 0018[600] = LTR 1
    ecap 0019[700] = PCIe Sec 1 lane errors 0

nvme0@pci0:109:0:0:	class=0x010802 rev=0x00 hdr=0x00 vendor=0x144d device=0xa808 subvendor=0x144d subdevice=0xa801
    vendor     = 'Samsung Electronics Co Ltd'
    device     = 'NVMe SSD Controller SM981/PM981/PM983'
    class      = mass storage
    subclass   = NVM
    bar   [10] = type Memory, range 64, base 0x90000000, size 16384, enabled
    cap 01[40] = powerspec 3  supports D0 D3  current D0
    cap 05[50] = MSI supports 1 message, 64 bit 
    cap 10[70] = PCI-Express 2 endpoint max data 256(256) FLR RO NS
                 max read 512
                 link x4(x4) speed 8.0(8.0) ASPM L1(L1) ClockPM enabled
    cap 11[b0] = MSI-X supports 33 messages, enabled
                 Table in map 0x10[0x3000], PBA in map 0x10[0x2000]
    ecap 0001[100] = AER 2 0 fatal 0 non-fatal 0 corrected
    ecap 0003[148] = Serial 1 0000000000000000
    ecap 0004[158] = Power Budgeting 1
    ecap 0019[168] = PCIe Sec 1 lane errors 0
    ecap 0018[188] = LTR 1
    ecap 001e[190] = L1 PM Substates 1
