hostb0@pci0:0:0:0:	class=0x060000 card=0x063115d9 chip=0x01588086 rev=0x09 hdr=0x00
    vendor     = 'Intel Corporation'
    device     = 'Xeon E3-1200 v2/Ivy Bridge DRAM Controller'
    class      = bridge
    subclass   = HOST-PCI
    cap 09[e0] = vendor (length 12) Intel cap 0 version 1

pcib1@pci0:0:1:0:	class=0x060400 card=0x063115d9 chip=0x01518086 rev=0x09 hdr=0x01
    vendor     = 'Intel Corporation'
    device     = 'Xeon E3-1200 v2/3rd Gen Core processor PCI Express Root Port'
    class      = bridge
    subclass   = PCI-PCI
    cap 0d[88] = PCI Bridge card=0x063115d9
    cap 01[80] = powerspec 3  supports D0 D3  current D0
    cap 05[90] = MSI supports 1 message 
    cap 10[a0] = PCI-Express 2 root port max data 256(256)
                 link x8(x16) speed 8.0(8.0) ASPM disabled(L0s/L1)
                 slot 1 power limit 75000 mW
    ecap 0002[100] = VC 1 max VC0
    ecap 0005[140] = Root Complex Link Declaration 1
    ecap 0019[d94] = PCIe Sec 1 lane errors 0

none0@pci0:0:22:0:	class=0x078000 card=0x063115d9 chip=0x1c3a8086 rev=0x04 hdr=0x00
    vendor     = 'Intel Corporation'
    device     = '6 Series/C200 Series Chipset Family MEI Controller'
    class      = simple comms
    bar   [10] = type Memory, range 64, base 0xdec07000, size 16, enabled
    cap 01[50] = powerspec 3  supports D0 D3  current D0
    cap 05[8c] = MSI supports 1 message, 64 bit 

none1@pci0:0:22:1:	class=0x078000 card=0x063115d9 chip=0x1c3b8086 rev=0x04 hdr=0x00
    vendor     = 'Intel Corporation'
    device     = '6 Series/C200 Series Chipset Family MEI Controller'
    class      = simple comms
    bar   [10] = type Memory, range 64, base 0xdec06000, size 16, enabled
    cap 01[50] = powerspec 3  supports D0 D3  current D0
    cap 05[8c] = MSI supports 1 message, 64 bit 

ehci0@pci0:0:26:0:	class=0x0c0320 card=0x063115d9 chip=0x1c2d8086 rev=0x05 hdr=0x00
    vendor     = 'Intel Corporation'
    device     = '6 Series/C200 Series Chipset Family USB Enhanced Host Controller'
    class      = serial bus
    subclass   = USB
    bar   [10] = type Memory, range 32, base 0xdec04000, size 1024, enabled
    cap 01[50] = powerspec 2  supports D0 D3  current D0
    cap 0a[58] = EHCI Debug Port at offset 0xa0 in map 0x14
    cap 13[98] = PCI Advanced Features: FLR TP

pcib2@pci0:0:28:0:	class=0x060400 card=0x063115d9 chip=0x1c108086 rev=0xb5 hdr=0x01
    vendor     = 'Intel Corporation'
    device     = '6 Series/C200 Series Chipset Family PCI Express Root Port 1'
    class      = bridge
    subclass   = PCI-PCI
    cap 10[40] = PCI-Express 2 root port max data 128(128)
                 link x0(x4) speed 0.0(5.0) ASPM disabled(L0s/L1)
                 slot 0 power limit 250 mW
    cap 05[80] = MSI supports 1 message 
    cap 0d[90] = PCI Bridge card=0x063115d9
    cap 01[a0] = powerspec 2  supports D0 D3  current D0

pcib3@pci0:0:28:4:	class=0x060400 card=0x063115d9 chip=0x1c188086 rev=0xb5 hdr=0x01
    vendor     = 'Intel Corporation'
    device     = '6 Series/C200 Series Chipset Family PCI Express Root Port 5'
    class      = bridge
    subclass   = PCI-PCI
    cap 10[40] = PCI-Express 2 root port max data 128(128)
                 link x1(x1) speed 2.5(5.0) ASPM disabled(L0s/L1)
                 slot 4 power limit 100 mW
    cap 05[80] = MSI supports 1 message 
    cap 0d[90] = PCI Bridge card=0x063115d9
    cap 01[a0] = powerspec 2  supports D0 D3  current D0

pcib4@pci0:0:28:5:	class=0x060400 card=0x063115d9 chip=0x1c1a8086 rev=0xb5 hdr=0x01
    vendor     = 'Intel Corporation'
    device     = '6 Series/C200 Series Chipset Family PCI Express Root Port 6'
    class      = bridge
    subclass   = PCI-PCI
    cap 10[40] = PCI-Express 2 root port max data 128(128)
                 link x1(x1) speed 2.5(5.0) ASPM disabled(L0s/L1)
                 slot 5 power limit 100 mW
    cap 05[80] = MSI supports 1 message 
    cap 0d[90] = PCI Bridge card=0x063115d9
    cap 01[a0] = powerspec 2  supports D0 D3  current D0

pcib5@pci0:0:28:6:	class=0x060400 card=0x063115d9 chip=0x1c1c8086 rev=0xb5 hdr=0x01
    vendor     = 'Intel Corporation'
    device     = '6 Series/C200 Series Chipset Family PCI Express Root Port 7'
    class      = bridge
    subclass   = PCI-PCI
    cap 10[40] = PCI-Express 2 root port max data 128(128)
                 link x1(x1) speed 2.5(5.0) ASPM disabled(L0s/L1)
                 slot 6 power limit 100 mW
    cap 05[80] = MSI supports 1 message 
    cap 0d[90] = PCI Bridge card=0x063115d9
    cap 01[a0] = powerspec 2  supports D0 D3  current D0

pcib6@pci0:0:28:7:	class=0x060400 card=0x063115d9 chip=0x1c1e8086 rev=0xb5 hdr=0x01
    vendor     = 'Intel Corporation'
    device     = '6 Series/C200 Series Chipset Family PCI Express Root Port 8'
    class      = bridge
    subclass   = PCI-PCI
    cap 10[40] = PCI-Express 2 root port max data 128(128)
                 link x1(x1) speed 2.5(5.0) ASPM disabled(L0s/L1)
                 slot 7 power limit 100 mW
    cap 05[80] = MSI supports 1 message 
    cap 0d[90] = PCI Bridge card=0x063115d9
    cap 01[a0] = powerspec 2  supports D0 D3  current D0

ehci1@pci0:0:29:0:	class=0x0c0320 card=0x063115d9 chip=0x1c268086 rev=0x05 hdr=0x00
    vendor     = 'Intel Corporation'
    device     = '6 Series/C200 Series Chipset Family USB Enhanced Host Controller'
    class      = serial bus
    subclass   = USB
    bar   [10] = type Memory, range 32, base 0xdec03000, size 1024, enabled
    cap 01[50] = powerspec 2  supports D0 D3  current D0
    cap 0a[58] = EHCI Debug Port at offset 0xa0 in map 0x14
    cap 13[98] = PCI Advanced Features: FLR TP

pcib7@pci0:0:30:0:	class=0x060401 card=0x063115d9 chip=0x244e8086 rev=0xa5 hdr=0x01
    vendor     = 'Intel Corporation'
    device     = '82801 PCI Bridge'
    class      = bridge
    subclass   = PCI-PCI
    cap 0d[50] = PCI Bridge card=0x063115d9

isab0@pci0:0:31:0:	class=0x060100 card=0x063115d9 chip=0x1c548086 rev=0x05 hdr=0x00
    vendor     = 'Intel Corporation'
    device     = 'C204 Chipset LPC Controller'
    class      = bridge
    subclass   = PCI-ISA
    cap 09[e0] = vendor (length 12) Intel cap 1 version 0
		 features: AMT, 4 PCI-e x1 slots

ahci0@pci0:0:31:2:	class=0x010601 card=0x063115d9 chip=0x1c028086 rev=0x05 hdr=0x00
    vendor     = 'Intel Corporation'
    device     = '6 Series/C200 Series Chipset Family 6 port Desktop SATA AHCI Controller'
    class      = mass storage
    subclass   = SATA
    bar   [10] = type I/O Port, range 32, base 0xf050, size 8, enabled
    bar   [14] = type I/O Port, range 32, base 0xf040, size 4, enabled
    bar   [18] = type I/O Port, range 32, base 0xf030, size 8, enabled
    bar   [1c] = type I/O Port, range 32, base 0xf020, size 4, enabled
    bar   [20] = type I/O Port, range 32, base 0xf000, size 32, enabled
    bar   [24] = type Memory, range 32, base 0xdec02000, size 2048, enabled
    cap 05[80] = MSI supports 1 message enabled with 1 message
    cap 01[70] = powerspec 3  supports D0 D3  current D0
    cap 12[a8] = SATA Index-Data Pair
    cap 13[b0] = PCI Advanced Features: FLR TP

none2@pci0:0:31:3:	class=0x0c0500 card=0x063115d9 chip=0x1c228086 rev=0x05 hdr=0x00
    vendor     = 'Intel Corporation'
    device     = '6 Series/C200 Series Chipset Family SMBus Controller'
    class      = serial bus
    subclass   = SMBus
    bar   [10] = type Memory, range 64, base 0xdec01000, size 256, enabled
    bar   [20] = type I/O Port, range 32, base 0x580, size 32, enabled

t5iov0@pci0:1:0:0:	class=0x020000 card=0x00001425 chip=0x50011425 rev=0x00 hdr=0x00
    vendor     = 'Chelsio Communications Inc'
    device     = 'T520-CR Unified Wire Ethernet Controller'
    class      = network
    subclass   = ethernet
    bar   [10] = type Memory, range 64, base 0xde800000, size 524288, enabled
    bar   [18] = type Memory, range 64, base 0xde780000, size 524288, enabled
    bar   [20] = type Memory, range 64, base 0xdeb0c000, size 8192, enabled
    cap 01[40] = powerspec 3  supports D0 D3  current D0
    cap 05[50] = MSI supports 8 messages, 64 bit, vector masks 
    cap 10[70] = PCI-Express 2 endpoint max data 256(2048) FLR NS
                 link x8(x8) speed 8.0(8.0) ASPM disabled(L0s/L1)
    cap 11[b0] = MSI-X supports 8 messages
                 Table in map 0x20[0x0], PBA in map 0x20[0x1000]
    cap 03[d0] = VPD
    ecap 0001[100] = AER 2 0 fatal 0 non-fatal 1 corrected
    ecap 0002[140] = VC 1 max VC1
    ecap 0003[170] = Serial 1 0000000000000000
    ecap 000e[190] = ARI 1
    ecap 0019[1a0] = PCIe Sec 1 lane errors 0
    ecap 0010[1c0] = SR-IOV 1 IOV disabled, Memory Space disabled, ARI disabled
                     0 VFs configured out of 16 supported
                     First VF RID Offset 0x0008, VF RID Stride 0x0004
                     VF Device ID 0x5801
                     Page Sizes: 4096 (enabled), 8192, 65536, 262144, 1048576, 4194304
    ecap 0017[200] = TPH Requester 1

t5iov1@pci0:1:0:1:	class=0x020000 card=0x00001425 chip=0x50011425 rev=0x00 hdr=0x00
    vendor     = 'Chelsio Communications Inc'
    device     = 'T520-CR Unified Wire Ethernet Controller'
    class      = network
    subclass   = ethernet
    bar   [10] = type Memory, range 64, base 0xde680000, size 524288, enabled
    bar   [18] = type Memory, range 64, base 0xde600000, size 524288, enabled
    bar   [20] = type Memory, range 64, base 0xdeb0a000, size 8192, enabled
    cap 01[40] = powerspec 3  supports D0 D3  current D0
    cap 05[50] = MSI supports 8 messages, 64 bit, vector masks 
    cap 10[70] = PCI-Express 2 endpoint max data 256(2048) FLR NS
                 link x8(x8) speed 8.0(8.0) ASPM disabled(L0s/L1)
    cap 11[b0] = MSI-X supports 8 messages
                 Table in map 0x20[0x0], PBA in map 0x20[0x1000]
    cap 03[d0] = VPD
    ecap 0001[100] = AER 2 0 fatal 0 non-fatal 1 corrected
    ecap 0003[170] = Serial 1 0000000000000000
    ecap 000e[190] = ARI 1
    ecap 0019[1a0] = PCIe Sec 1 lane errors 0
    ecap 0010[1c0] = SR-IOV 1 IOV disabled, Memory Space disabled, ARI disabled
                     0 VFs configured out of 16 supported
                     First VF RID Offset 0x0008, VF RID Stride 0x0004
                     VF Device ID 0x5801
                     Page Sizes: 4096 (enabled), 8192, 65536, 262144, 1048576, 4194304
    ecap 0017[200] = TPH Requester 1

t5iov2@pci0:1:0:2:	class=0x020000 card=0x00001425 chip=0x50011425 rev=0x00 hdr=0x00
    vendor     = 'Chelsio Communications Inc'
    device     = 'T520-CR Unified Wire Ethernet Controller'
    class      = network
    subclass   = ethernet
    bar   [10] = type Memory, range 64, base 0xde500000, size 524288, enabled
    bar   [18] = type Memory, range 64, base 0xde480000, size 524288, enabled
    bar   [20] = type Memory, range 64, base 0xdeb08000, size 8192, enabled
    cap 01[40] = powerspec 3  supports D0 D3  current D0
    cap 05[50] = MSI supports 8 messages, 64 bit, vector masks 
    cap 10[70] = PCI-Express 2 endpoint max data 256(2048) FLR NS
                 link x8(x8) speed 8.0(8.0) ASPM disabled(L0s/L1)
    cap 11[b0] = MSI-X supports 8 messages
                 Table in map 0x20[0x0], PBA in map 0x20[0x1000]
    cap 03[d0] = VPD
    ecap 0001[100] = AER 2 0 fatal 0 non-fatal 1 corrected
    ecap 0003[170] = Serial 1 0000000000000000
    ecap 000e[190] = ARI 1
    ecap 0019[1a0] = PCIe Sec 1 lane errors 0
    ecap 0010[1c0] = SR-IOV 1 IOV disabled, Memory Space disabled, ARI disabled
                     0 VFs configured out of 16 supported
                     First VF RID Offset 0x0008, VF RID Stride 0x0004
                     VF Device ID 0x5801
                     Page Sizes: 4096 (enabled), 8192, 65536, 262144, 1048576, 4194304
    ecap 0017[200] = TPH Requester 1

t5iov3@pci0:1:0:3:	class=0x020000 card=0x00001425 chip=0x50011425 rev=0x00 hdr=0x00
    vendor     = 'Chelsio Communications Inc'
    device     = 'T520-CR Unified Wire Ethernet Controller'
    class      = network
    subclass   = ethernet
    bar   [10] = type Memory, range 64, base 0xde400000, size 524288, enabled
    bar   [18] = type Memory, range 64, base 0xde380000, size 524288, enabled
    bar   [20] = type Memory, range 64, base 0xdeb06000, size 8192, enabled
    cap 01[40] = powerspec 3  supports D0 D3  current D0
    cap 05[50] = MSI supports 8 messages, 64 bit, vector masks 
    cap 10[70] = PCI-Express 2 endpoint max data 256(2048) FLR NS
                 link x8(x8) speed 8.0(8.0) ASPM disabled(L0s/L1)
    cap 11[b0] = MSI-X supports 8 messages
                 Table in map 0x20[0x0], PBA in map 0x20[0x1000]
    cap 03[d0] = VPD
    ecap 0001[100] = AER 2 0 fatal 0 non-fatal 1 corrected
    ecap 0003[170] = Serial 1 0000000000000000
    ecap 000e[190] = ARI 1
    ecap 0019[1a0] = PCIe Sec 1 lane errors 0
    ecap 0010[1c0] = SR-IOV 1 IOV disabled, Memory Space disabled, ARI disabled
                     0 VFs configured out of 16 supported
                     First VF RID Offset 0x0008, VF RID Stride 0x0004
                     VF Device ID 0x5801
                     Page Sizes: 4096 (enabled), 8192, 65536, 262144, 1048576, 4194304
    ecap 0017[200] = TPH Requester 1

t5nex0@pci0:1:0:4:	class=0x020000 card=0x00001425 chip=0x54011425 rev=0x00 hdr=0x00
    vendor     = 'Chelsio Communications Inc'
    device     = 'T520-CR Unified Wire Ethernet Controller'
    class      = network
    subclass   = ethernet
    bar   [10] = type Memory, range 64, base 0xde300000, size 524288, enabled
    bar   [18] = type Memory, range 64, base 0xdd000000, size 16777216, enabled
    bar   [20] = type Memory, range 64, base 0xdeb04000, size 8192, enabled
    cap 01[40] = powerspec 3  supports D0 D3  current D0
    cap 05[50] = MSI supports 32 messages, 64 bit, vector masks 
    cap 10[70] = PCI-Express 2 endpoint max data 256(2048) FLR NS
                 link x8(x8) speed 8.0(8.0) ASPM disabled(L0s/L1)
    cap 11[b0] = MSI-X supports 128 messages, enabled
                 Table in map 0x20[0x0], PBA in map 0x20[0x1000]
    cap 03[d0] = VPD
    ecap 0001[100] = AER 2 0 fatal 0 non-fatal 1 corrected
    ecap 0003[170] = Serial 1 0000000000000000
    ecap 000e[190] = ARI 1
    ecap 0019[1a0] = PCIe Sec 1 lane errors 0
    ecap 0010[1c0] = SR-IOV 1 IOV disabled, Memory Space disabled, ARI disabled
                     0 VFs configured out of 0 supported
                     First VF RID Offset 0x0008, VF RID Stride 0x0004
                     VF Device ID 0x5801
                     Page Sizes: 4096 (enabled), 8192, 65536, 262144, 1048576, 4194304
    ecap 0017[200] = TPH Requester 1

none3@pci0:1:0:5:	class=0x010000 card=0x00001425 chip=0x55011425 rev=0x00 hdr=0x00
    vendor     = 'Chelsio Communications Inc'
    device     = 'T520-CR Unified Wire Storage Controller'
    class      = mass storage
    subclass   = SCSI
    bar   [10] = type Memory, range 64, base 0xde280000, size 524288, enabled
    bar   [18] = type Memory, range 64, base 0xde200000, size 524288, enabled
    bar   [20] = type Memory, range 64, base 0xdeb02000, size 8192, enabled
    cap 01[40] = powerspec 3  supports D0 D3  current D0
    cap 05[50] = MSI supports 32 messages, 64 bit, vector masks 
    cap 10[70] = PCI-Express 2 endpoint max data 256(2048) FLR NS
                 link x8(x8) speed 8.0(8.0) ASPM disabled(L0s/L1)
    cap 11[b0] = MSI-X supports 40 messages
                 Table in map 0x20[0x0], PBA in map 0x20[0x1000]
    cap 03[d0] = VPD
    ecap 0001[100] = AER 2 0 fatal 0 non-fatal 1 corrected
    ecap 0003[170] = Serial 1 0000000000000000
    ecap 000e[190] = ARI 1
    ecap 0019[1a0] = PCIe Sec 1 lane errors 0
    ecap 0010[1c0] = SR-IOV 1 IOV disabled, Memory Space disabled, ARI disabled
                     0 VFs configured out of 0 supported
                     First VF RID Offset 0x0008, VF RID Stride 0x0004
                     VF Device ID 0x5801
                     Page Sizes: 4096 (enabled), 8192, 65536, 262144, 1048576, 4194304
    ecap 0017[200] = TPH Requester 1

none4@pci0:1:0:6:	class=0x0c0400 card=0x00001425 chip=0x56011425 rev=0x00 hdr=0x00
    vendor     = 'Chelsio Communications Inc'
    device     = 'T520-CR Unified Wire Storage Controller'
    class      = serial bus
    subclass   = Fibre Channel
    bar   [10] = type Memory, range 64, base 0xde100000, size 524288, enabled
    bar   [18] = type Memory, range 64, base 0xde080000, size 524288, enabled
    bar   [20] = type Memory, range 64, base 0xdeb00000, size 8192, enabled
    cap 01[40] = powerspec 3  supports D0 D3  current D0
    cap 05[50] = MSI supports 32 messages, 64 bit, vector masks 
    cap 10[70] = PCI-Express 2 endpoint max data 256(2048) FLR NS
                 link x8(x8) speed 8.0(8.0) ASPM disabled(L0s/L1)
    cap 11[b0] = MSI-X supports 40 messages
                 Table in map 0x20[0x0], PBA in map 0x20[0x1000]
    cap 03[d0] = VPD
    ecap 0001[100] = AER 2 0 fatal 0 non-fatal 1 corrected
    ecap 0003[170] = Serial 1 0000000000000000
    ecap 000e[190] = ARI 1
    ecap 0019[1a0] = PCIe Sec 1 lane errors 0
    ecap 0010[1c0] = SR-IOV 1 IOV disabled, Memory Space disabled, ARI disabled
                     0 VFs configured out of 0 supported
                     First VF RID Offset 0x0008, VF RID Stride 0x0004
                     VF Device ID 0x5801
                     Page Sizes: 4096 (enabled), 8192, 65536, 262144, 1048576, 4194304
    ecap 0017[200] = TPH Requester 1

em0@pci0:3:0:0:	class=0x020000 card=0x000015d9 chip=0x10d38086 rev=0x00 hdr=0x00
    vendor     = 'Intel Corporation'
    device     = '82574L Gigabit Network Connection'
    class      = network
    subclass   = ethernet
    bar   [10] = type Memory, range 32, base 0xdfd00000, size 131072, enabled
    bar   [18] = type I/O Port, range 32, base 0xe000, size 32, enabled
    bar   [1c] = type Memory, range 32, base 0xdfd20000, size 16384, enabled
    cap 01[c8] = powerspec 2  supports D0 D3  current D0
    cap 05[d0] = MSI supports 1 message, 64 bit 
    cap 10[e0] = PCI-Express 1 endpoint max data 128(256) NS
                 link x1(x1) speed 2.5(2.5) ASPM disabled(L0s/L1)
    cap 11[a0] = MSI-X supports 5 messages, enabled
                 Table in map 0x1c[0x0], PBA in map 0x1c[0x2000]
    ecap 0001[100] = AER 1 0 fatal 0 non-fatal 1 corrected
    ecap 0003[140] = Serial 1 002590ffff73168c

em1@pci0:4:0:0:	class=0x020000 card=0x000015d9 chip=0x10d38086 rev=0x00 hdr=0x00
    vendor     = 'Intel Corporation'
    device     = '82574L Gigabit Network Connection'
    class      = network
    subclass   = ethernet
    bar   [10] = type Memory, range 32, base 0xdfc00000, size 131072, enabled
    bar   [18] = type I/O Port, range 32, base 0xd000, size 32, enabled
    bar   [1c] = type Memory, range 32, base 0xdfc20000, size 16384, enabled
    cap 01[c8] = powerspec 2  supports D0 D3  current D0
    cap 05[d0] = MSI supports 1 message, 64 bit 
    cap 10[e0] = PCI-Express 1 endpoint max data 128(256) NS
                 link x1(x1) speed 2.5(2.5) ASPM disabled(L0s/L1)
    cap 11[a0] = MSI-X supports 5 messages, enabled
                 Table in map 0x1c[0x0], PBA in map 0x1c[0x2000]
    ecap 0001[100] = AER 1 0 fatal 0 non-fatal 1 corrected
    ecap 0003[140] = Serial 1 002590ffff73168d

em2@pci0:5:0:0:	class=0x020000 card=0x000015d9 chip=0x10d38086 rev=0x00 hdr=0x00
    vendor     = 'Intel Corporation'
    device     = '82574L Gigabit Network Connection'
    class      = network
    subclass   = ethernet
    bar   [10] = type Memory, range 32, base 0xdfb00000, size 131072, enabled
    bar   [18] = type I/O Port, range 32, base 0xc000, size 32, enabled
    bar   [1c] = type Memory, range 32, base 0xdfb20000, size 16384, enabled
    cap 01[c8] = powerspec 2  supports D0 D3  current D0
    cap 05[d0] = MSI supports 1 message, 64 bit 
    cap 10[e0] = PCI-Express 1 endpoint max data 128(256) NS
                 link x1(x1) speed 2.5(2.5) ASPM disabled(L0s/L1)
    cap 11[a0] = MSI-X supports 5 messages, enabled
                 Table in map 0x1c[0x0], PBA in map 0x1c[0x2000]
    ecap 0001[100] = AER 1 0 fatal 0 non-fatal 1 corrected
    ecap 0003[140] = Serial 1 002590ffff73168e

em3@pci0:6:0:0:	class=0x020000 card=0x000015d9 chip=0x10d38086 rev=0x00 hdr=0x00
    vendor     = 'Intel Corporation'
    device     = '82574L Gigabit Network Connection'
    class      = network
    subclass   = ethernet
    bar   [10] = type Memory, range 32, base 0xdfa00000, size 131072, enabled
    bar   [18] = type I/O Port, range 32, base 0xb000, size 32, enabled
    bar   [1c] = type Memory, range 32, base 0xdfa20000, size 16384, enabled
    cap 01[c8] = powerspec 2  supports D0 D3  current D0
    cap 05[d0] = MSI supports 1 message, 64 bit 
    cap 10[e0] = PCI-Express 1 endpoint max data 128(256) NS
                 link x1(x1) speed 2.5(2.5) ASPM disabled(L0s/L1)
    cap 11[a0] = MSI-X supports 5 messages, enabled
                 Table in map 0x1c[0x0], PBA in map 0x1c[0x2000]
    ecap 0001[100] = AER 1 0 fatal 0 non-fatal 1 corrected
    ecap 0003[140] = Serial 1 002590ffff73168f

vgapci0@pci0:7:3:0:	class=0x030000 card=0x063115d9 chip=0x0532102b rev=0x0a hdr=0x00
    vendor     = 'Matrox Electronics Systems Ltd.'
    device     = 'MGA G200eW WPCM450'
    class      = display
    subclass   = VGA
    bar   [10] = type Prefetchable Memory, range 32, base 0xdc000000, size 16777216, enabled
    bar   [14] = type Memory, range 32, base 0xdf800000, size 16384, enabled
    bar   [18] = type Memory, range 32, base 0xdf000000, size 8388608, enabled
    cap 01[dc] = powerspec 1  supports D0 D3  current D0
