hostb0@pci0:0:0:0:	class=0x060000 rev=0x10 hdr=0x00 vendor=0x8086 device=0x29c0 subvendor=0x1043 subdevice=0x82b0
    vendor     = 'Intel Corporation'
    device     = '82G33/G31/P35/P31 Express DRAM Controller'
    class      = bridge
    subclass   = HOST-PCI
    cap 09[e0] = vendor (length 11) Intel cap 11 version 1

pcib1@pci0:0:1:0:	class=0x060400 rev=0x10 hdr=0x01 vendor=0x8086 device=0x29c1 subvendor=0x1043 subdevice=0x82b0
    vendor     = 'Intel Corporation'
    device     = '82G33/G31/P35/P31 Express PCI Express Root Port'
    class      = bridge
    subclass   = PCI-PCI
    cap 0d[88] = PCI Bridge subvendor=0x1043 subdevice=0x82b0
    cap 01[80] = powerspec 3  supports D0 D3  current D0
    cap 05[90] = MSI supports 1 message 
    cap 10[a0] = PCI-Express 1 root port max data 128(128)
                 max read 128
                 link x16(x16) speed 2.5(2.5) ASPM disabled(L0s)
                 slot 0 power limit 75000 mW
    ecap 0002[100] = VC 1 max VC0
    ecap 0005[140] = Root Complex Link Declaration 1

hdac0@pci0:0:27:0:	class=0x040300 rev=0x01 hdr=0x00 vendor=0x8086 device=0x27d8 subvendor=0x1043 subdevice=0x8290
    vendor     = 'Intel Corporation'
    device     = 'NM10/ICH7 Family High Definition Audio Controller'
    class      = multimedia
    subclass   = HDA
    bar   [10] = type Memory, range 64, base 0xf9ffc000, size 16384, enabled
    cap 01[50] = powerspec 2  supports D0 D3  current D0
    cap 05[60] = MSI supports 1 message, 64 bit enabled with 1 message
    cap 10[70] = PCI-Express 1 root endpoint max data 128(128) NS
                 max read 128
    ecap 0002[100] = VC 1 max VC1
    ecap 0005[130] = Root Complex Link Declaration 1

pcib2@pci0:0:28:0:	class=0x060400 rev=0x01 hdr=0x01 vendor=0x8086 device=0x27d0 subvendor=0x1043 subdevice=0x8179
    vendor     = 'Intel Corporation'
    device     = 'NM10/ICH7 Family PCI Express Port 1'
    class      = bridge
    subclass   = PCI-PCI
    cap 10[40] = PCI-Express 1 root port max data 128(128)
                 max read 128
                 link x0(x1) speed 0.0(2.5) ASPM disabled(L0s/L1)
                 slot 4 power limit 25000 mW HotPlug(empty) surprise
    cap 05[80] = MSI supports 1 message enabled with 1 message
    cap 0d[90] = PCI Bridge subvendor=0x1043 subdevice=0x8179
    cap 01[a0] = powerspec 2  supports D0 D3  current D0
    ecap 0002[100] = VC 1 max VC1
    ecap 0005[180] = Root Complex Link Declaration 1

pcib3@pci0:0:28:1:	class=0x060400 rev=0x01 hdr=0x01 vendor=0x8086 device=0x27d2 subvendor=0x1043 subdevice=0x8179
    vendor     = 'Intel Corporation'
    device     = 'NM10/ICH7 Family PCI Express Port 2'
    class      = bridge
    subclass   = PCI-PCI
    cap 10[40] = PCI-Express 1 root port max data 128(128)
                 max read 128
                 link x1(x1) speed 2.5(2.5) ASPM disabled(L0s/L1)
                 slot 0 power limit 0 mW HotPlug(present) surprise
    cap 05[80] = MSI supports 1 message enabled with 1 message
    cap 0d[90] = PCI Bridge subvendor=0x1043 subdevice=0x8179
    cap 01[a0] = powerspec 2  supports D0 D3  current D0
    ecap 0002[100] = VC 1 max VC1
    ecap 0005[180] = Root Complex Link Declaration 1

uhci0@pci0:0:29:0:	class=0x0c0300 rev=0x01 hdr=0x00 vendor=0x8086 device=0x27c8 subvendor=0x1043 subdevice=0x8179
    vendor     = 'Intel Corporation'
    device     = 'NM10/ICH7 Family USB UHCI Controller'
    class      = serial bus
    subclass   = USB
    bar   [20] = type I/O Port, range 32, base 0xd480, size 32, enabled

uhci1@pci0:0:29:1:	class=0x0c0300 rev=0x01 hdr=0x00 vendor=0x8086 device=0x27c9 subvendor=0x1043 subdevice=0x8179
    vendor     = 'Intel Corporation'
    device     = 'NM10/ICH7 Family USB UHCI Controller'
    class      = serial bus
    subclass   = USB
    bar   [20] = type I/O Port, range 32, base 0xd800, size 32, enabled

uhci2@pci0:0:29:2:	class=0x0c0300 rev=0x01 hdr=0x00 vendor=0x8086 device=0x27ca subvendor=0x1043 subdevice=0x8179
    vendor     = 'Intel Corporation'
    device     = 'NM10/ICH7 Family USB UHCI Controller'
    class      = serial bus
    subclass   = USB
    bar   [20] = type I/O Port, range 32, base 0xd880, size 32, enabled

uhci3@pci0:0:29:3:	class=0x0c0300 rev=0x01 hdr=0x00 vendor=0x8086 device=0x27cb subvendor=0x1043 subdevice=0x8179
    vendor     = 'Intel Corporation'
    device     = 'NM10/ICH7 Family USB UHCI Controller'
    class      = serial bus
    subclass   = USB
    bar   [20] = type I/O Port, range 32, base 0xdc00, size 32, enabled

ehci0@pci0:0:29:7:	class=0x0c0320 rev=0x01 hdr=0x00 vendor=0x8086 device=0x27cc subvendor=0x1043 subdevice=0x8179
    vendor     = 'Intel Corporation'
    device     = 'NM10/ICH7 Family USB2 EHCI Controller'
    class      = serial bus
    subclass   = USB
    bar   [10] = type Memory, range 32, base 0xf9ffbc00, size 1024, enabled
    cap 01[50] = powerspec 2  supports D0 D3  current D0
    cap 0a[58] = EHCI Debug Port at offset 0xa0 in map 0x14

pcib4@pci0:0:30:0:	class=0x060401 rev=0xe1 hdr=0x01 vendor=0x8086 device=0x244e subvendor=0x1043 subdevice=0x8179
    vendor     = 'Intel Corporation'
    device     = '82801 PCI Bridge'
    class      = bridge
    subclass   = PCI-PCI
    cap 0d[50] = PCI Bridge subvendor=0x1043 subdevice=0x8179

isab0@pci0:0:31:0:	class=0x060100 rev=0x01 hdr=0x00 vendor=0x8086 device=0x27b8 subvendor=0x1043 subdevice=0x8179
    vendor     = 'Intel Corporation'
    device     = '82801GB/GR (ICH7 Family) LPC Interface Bridge'
    class      = bridge
    subclass   = PCI-ISA
    cap 09[e0] = vendor (length 12) Intel cap 1 version 0
		 features: Quick Resume, SATA RAID-5, 6 PCI-e x1 slots, SATA RAID-0/1/10, SATA AHCI

atapci0@pci0:0:31:1:	class=0x01018a rev=0x01 hdr=0x00 vendor=0x8086 device=0x27df subvendor=0x1043 subdevice=0x8179
    vendor     = 'Intel Corporation'
    device     = '82801G (ICH7 Family) IDE Controller'
    class      = mass storage
    subclass   = ATA
    bar   [20] = type I/O Port, range 32, base 0xffa0, size 16, enabled

atapci1@pci0:0:31:2:	class=0x01018f rev=0x01 hdr=0x00 vendor=0x8086 device=0x27c0 subvendor=0x1043 subdevice=0x8179
    vendor     = 'Intel Corporation'
    device     = 'NM10/ICH7 Family SATA Controller [IDE mode]'
    class      = mass storage
    subclass   = ATA
    bar   [10] = type I/O Port, range 32, base 0xd400, size 8, enabled
    bar   [14] = type I/O Port, range 32, base 0xd080, size 4, enabled
    bar   [18] = type I/O Port, range 32, base 0xd000, size 8, enabled
    bar   [1c] = type I/O Port, range 32, base 0xcc00, size 4, enabled
    bar   [20] = type I/O Port, range 32, base 0xc880, size 16, enabled
    cap 01[70] = powerspec 2  supports D0 D3  current D0

ichsmb0@pci0:0:31:3:	class=0x0c0500 rev=0x01 hdr=0x00 vendor=0x8086 device=0x27da subvendor=0x1043 subdevice=0x8179
    vendor     = 'Intel Corporation'
    device     = 'NM10/ICH7 Family SMBus Controller'
    class      = serial bus
    subclass   = SMBus
    bar   [20] = type I/O Port, range 32, base 0x400, size 32, enabled

vgapci0@pci0:1:0:0:	class=0x030000 rev=0xa1 hdr=0x00 vendor=0x10de device=0x0640 subvendor=0x1043 subdevice=0x82fd
    vendor     = 'NVIDIA Corporation'
    device     = 'G96C [GeForce 9500 GT]'
    class      = display
    subclass   = VGA
    bar   [10] = type Memory, range 32, base 0xfd000000, size 16777216, enabled
    bar   [14] = type Prefetchable Memory, range 64, base 0xe0000000, size 268435456, enabled
    bar   [1c] = type Memory, range 64, base 0xfa000000, size 33554432, enabled
    bar   [24] = type I/O Port, range 32, base 0xec00, size 128, enabled
    cap 01[60] = powerspec 3  supports D0 D3  current D0
    cap 05[68] = MSI supports 1 message, 64 bit enabled with 1 message
    cap 10[78] = PCI-Express 1 endpoint max data 128(128) RO NS
                 max read 512
                 link x16(x16) speed 2.5(2.5) ASPM disabled(L0s/L1)
    cap 09[b4] = vendor (length 20)
    ecap 0002[100] = VC 1 max VC0
    ecap 0004[128] = Power Budgeting 1
    ecap 000b[600] = Vendor [1] ID 0001 Rev 1 Length 36

age0@pci0:2:0:0:	class=0x020000 rev=0xb0 hdr=0x00 vendor=0x1969 device=0x1048 subvendor=0x1043 subdevice=0x8226
    vendor     = 'Qualcomm Atheros'
    device     = 'Attansic L1 Gigabit Ethernet'
    class      = network
    subclass   = ethernet
    bar   [10] = type Memory, range 64, base 0xfebc0000, size 262144, enabled
    cap 01[40] = powerspec 2  supports D0 D3  current D0
    cap 05[48] = MSI supports 1 message, 64 bit enabled with 1 message
    cap 10[58] = PCI-Express 1 endpoint max data 128(128)
                 max read 512
                 link x1(x1) speed 2.5(2.5) ASPM disabled(L0s)
    cap 03[6c] = VPD
    ecap 0001[100] = AER 1 0 fatal 1 non-fatal 0 corrected
