hostb0@pci0:0:0:0:	class=0x060000 rev=0x13 hdr=0x00 vendor=0x8086 device=0x3403 subvendor=0x1028 subdevice=0x028c
    vendor     = 'Intel Corporation'
    device     = '5500 I/O Hub to ESI Port'
    class      = bridge
    subclass   = HOST-PCI
    cap 05[60] = MSI supports 2 messages, vector masks 
    cap 10[90] = PCI-Express 2 root port max data 128(128) ARI disabled
                 max read 128
                 link x4(x4) speed 2.5(2.5) ASPM disabled(L0s/L1)
    cap 01[e0] = powerspec 3  supports D0 D3  current D0
    ecap 0001[100] = AER 1 0 fatal 0 non-fatal 0 corrected
    ecap 000d[150] = ACS 1
    ecap 000b[160] = Vendor [0] ID 0002 Rev 0 Length 12

pcib1@pci0:0:1:0:	class=0x060400 rev=0x13 hdr=0x01 vendor=0x8086 device=0x3408 subvendor=0x1028 subdevice=0x028c
    vendor     = 'Intel Corporation'
    device     = '5520/5500/X58 I/O Hub PCI Express Root Port 1'
    class      = bridge
    subclass   = PCI-PCI
    cap 0d[40] = PCI Bridge subvendor=0x1028 subdevice=0x028c
    cap 05[60] = MSI supports 2 messages, vector masks 
    cap 10[90] = PCI-Express 2 root port max data 256(256) ARI disabled
                 max read 128
                 link x4(x4) speed 2.5(5.0) ASPM disabled(L0s/L1)
    cap 01[e0] = powerspec 3  supports D0 D3  current D0
    ecap 0001[100] = AER 1 0 fatal 0 non-fatal 0 corrected
    ecap 000d[150] = ACS 1
    ecap 000b[160] = Vendor [0] ID 0002 Rev 0 Length 12

pcib2@pci0:0:3:0:	class=0x060400 rev=0x13 hdr=0x01 vendor=0x8086 device=0x340a subvendor=0x1028 subdevice=0x028c
    vendor     = 'Intel Corporation'
    device     = '5520/5500/X58 I/O Hub PCI Express Root Port 3'
    class      = bridge
    subclass   = PCI-PCI
    cap 0d[40] = PCI Bridge subvendor=0x1028 subdevice=0x028c
    cap 05[60] = MSI supports 2 messages, vector masks 
    cap 10[90] = PCI-Express 2 root port max data 128(256) ARI disabled
                 max read 128
                 link x0(x4) speed 0.0(5.0) ASPM disabled(L0s/L1)
    cap 01[e0] = powerspec 3  supports D0 D3  current D0
    ecap 0001[100] = AER 1 0 fatal 0 non-fatal 0 corrected
    ecap 000d[150] = ACS 1
    ecap 000b[160] = Vendor [0] ID 0002 Rev 0 Length 12

pcib3@pci0:0:7:0:	class=0x060400 rev=0x13 hdr=0x01 vendor=0x8086 device=0x340e subvendor=0x1028 subdevice=0x028c
    vendor     = 'Intel Corporation'
    device     = '5520/5500/X58 I/O Hub PCI Express Root Port 7'
    class      = bridge
    subclass   = PCI-PCI
    cap 0d[40] = PCI Bridge subvendor=0x1028 subdevice=0x028c
    cap 05[60] = MSI supports 2 messages, vector masks 
    cap 10[90] = PCI-Express 2 root port max data 256(256) ARI disabled
                 max read 128
                 link x8(x16) speed 2.5(5.0) ASPM disabled(L0s/L1)
                 slot 1 power limit 25000 mW
    cap 01[e0] = powerspec 3  supports D0 D3  current D0
    ecap 0001[100] = AER 1 0 fatal 0 non-fatal 0 corrected
    ecap 000d[150] = ACS 1
    ecap 000b[160] = Vendor [0] ID 0002 Rev 0 Length 12

none0@pci0:0:20:0:	class=0x080000 rev=0x13 hdr=0x00 vendor=0x8086 device=0x342e subvendor=0x0000 subdevice=0x0000
    vendor     = 'Intel Corporation'
    device     = '7500/5520/5500/X58 I/O Hub System Management Registers'
    class      = base peripheral
    subclass   = interrupt controller
    cap 10[40] = PCI-Express 2 root endpoint max data 128(128)
                 max read 128
                 link x0(x0) ASPM disabled(L0s)

none1@pci0:0:20:1:	class=0x080000 rev=0x13 hdr=0x00 vendor=0x8086 device=0x3422 subvendor=0x0000 subdevice=0x0000
    vendor     = 'Intel Corporation'
    device     = '7500/5520/5500/X58 I/O Hub GPIO and Scratch Pad Registers'
    class      = base peripheral
    subclass   = interrupt controller
    cap 10[40] = PCI-Express 2 root endpoint max data 128(128)
                 max read 128
                 link x0(x0) ASPM disabled(L0s)

none2@pci0:0:20:2:	class=0x080000 rev=0x13 hdr=0x00 vendor=0x8086 device=0x3423 subvendor=0x0000 subdevice=0x0000
    vendor     = 'Intel Corporation'
    device     = '7500/5520/5500/X58 I/O Hub Control Status and RAS Registers'
    class      = base peripheral
    subclass   = interrupt controller
    cap 10[40] = PCI-Express 2 root endpoint max data 128(128)
                 max read 128
                 link x0(x0) ASPM disabled(L0s)

uhci0@pci0:0:26:0:	class=0x0c0300 rev=0x00 hdr=0x00 vendor=0x8086 device=0x3a37 subvendor=0x1028 subdevice=0x028c
    vendor     = 'Intel Corporation'
    device     = '82801JI (ICH10 Family) USB UHCI Controller'
    class      = serial bus
    subclass   = USB
    bar   [20] = type I/O Port, range 32, base 0xec40, size 32, enabled
    cap 13[50] = PCI Advanced Features: FLR TP

uhci1@pci0:0:26:1:	class=0x0c0300 rev=0x00 hdr=0x00 vendor=0x8086 device=0x3a38 subvendor=0x1028 subdevice=0x028c
    vendor     = 'Intel Corporation'
    device     = '82801JI (ICH10 Family) USB UHCI Controller'
    class      = serial bus
    subclass   = USB
    bar   [20] = type I/O Port, range 32, base 0xec60, size 32, enabled
    cap 13[50] = PCI Advanced Features: FLR TP

ehci0@pci0:0:26:7:	class=0x0c0320 rev=0x00 hdr=0x00 vendor=0x8086 device=0x3a3c subvendor=0x1028 subdevice=0x028c
    vendor     = 'Intel Corporation'
    device     = '82801JI (ICH10 Family) USB2 EHCI Controller'
    class      = serial bus
    subclass   = USB
    bar   [10] = type Memory, range 32, base 0xdf0fe000, size 1024, enabled
    cap 01[50] = powerspec 2  supports D0 D3  current D0
    cap 0a[58] = EHCI Debug Port at offset 0xa0 in map 0x14
    cap 13[98] = PCI Advanced Features: FLR TP

uhci2@pci0:0:29:0:	class=0x0c0300 rev=0x00 hdr=0x00 vendor=0x8086 device=0x3a34 subvendor=0x1028 subdevice=0x028c
    vendor     = 'Intel Corporation'
    device     = '82801JI (ICH10 Family) USB UHCI Controller'
    class      = serial bus
    subclass   = USB
    bar   [20] = type I/O Port, range 32, base 0xec80, size 32, enabled
    cap 13[50] = PCI Advanced Features: FLR TP

uhci3@pci0:0:29:1:	class=0x0c0300 rev=0x00 hdr=0x00 vendor=0x8086 device=0x3a35 subvendor=0x1028 subdevice=0x028c
    vendor     = 'Intel Corporation'
    device     = '82801JI (ICH10 Family) USB UHCI Controller'
    class      = serial bus
    subclass   = USB
    bar   [20] = type I/O Port, range 32, base 0xeca0, size 32, enabled
    cap 13[50] = PCI Advanced Features: FLR TP

uhci4@pci0:0:29:2:	class=0x0c0300 rev=0x00 hdr=0x00 vendor=0x8086 device=0x3a36 subvendor=0x1028 subdevice=0x028c
    vendor     = 'Intel Corporation'
    device     = '82801JI (ICH10 Family) USB UHCI Controller'
    class      = serial bus
    subclass   = USB
    bar   [20] = type I/O Port, range 32, base 0xecc0, size 32, enabled
    cap 13[50] = PCI Advanced Features: FLR TP

uhci5@pci0:0:29:3:	class=0x0c0300 rev=0x00 hdr=0x00 vendor=0x8086 device=0x3a39 subvendor=0x1028 subdevice=0x028c
    vendor     = 'Intel Corporation'
    device     = '82801JI (ICH10 Family) USB UHCI Controller'
    class      = serial bus
    subclass   = USB
    bar   [20] = type I/O Port, range 32, base 0xece0, size 32, enabled
    cap 13[50] = PCI Advanced Features: FLR TP

ehci1@pci0:0:29:7:	class=0x0c0320 rev=0x00 hdr=0x00 vendor=0x8086 device=0x3a3a subvendor=0x1028 subdevice=0x028c
    vendor     = 'Intel Corporation'
    device     = '82801JI (ICH10 Family) USB2 EHCI Controller'
    class      = serial bus
    subclass   = USB
    bar   [10] = type Memory, range 32, base 0xdf0ff000, size 1024, enabled
    cap 01[50] = powerspec 2  supports D0 D3  current D0
    cap 0a[58] = EHCI Debug Port at offset 0xa0 in map 0x14
    cap 13[98] = PCI Advanced Features: FLR TP

pcib4@pci0:0:30:0:	class=0x060401 rev=0x90 hdr=0x01 vendor=0x8086 device=0x244e subvendor=0x1028 subdevice=0x028c
    vendor     = 'Intel Corporation'
    device     = '82801 PCI Bridge'
    class      = bridge
    subclass   = PCI-PCI
    cap 0d[50] = PCI Bridge subvendor=0x1028 subdevice=0x028c

isab0@pci0:0:31:0:	class=0x060100 rev=0x00 hdr=0x00 vendor=0x8086 device=0x3a16 subvendor=0x1028 subdevice=0x028c
    vendor     = 'Intel Corporation'
    device     = '82801JIR (ICH10R) LPC Interface Controller'
    class      = bridge
    subclass   = PCI-ISA
    cap 09[e0] = vendor (length 12) Intel cap 1 version 0
		 features: SATA RAID-5, 4 PCI-e x1 slots

atapci0@pci0:0:31:2:	class=0x01018f rev=0x00 hdr=0x00 vendor=0x8086 device=0x3a20 subvendor=0x1028 subdevice=0x028c
    vendor     = 'Intel Corporation'
    device     = '82801JI (ICH10 Family) 4 port SATA IDE Controller'
    class      = mass storage
    subclass   = ATA
    bar   [10] = type I/O Port, range 32, base 0xe8e0, size 8, enabled
    bar   [14] = type I/O Port, range 32, base 0xe8d0, size 4, enabled
    bar   [18] = type I/O Port, range 32, base 0xe8e8, size 8, enabled
    bar   [1c] = type I/O Port, range 32, base 0xe8d4, size 4, enabled
    bar   [20] = type I/O Port, range 32, base 0xec00, size 16, enabled
    bar   [24] = type I/O Port, range 32, base 0xec10, size 16, enabled
    cap 01[70] = powerspec 3  supports D0 D3  current D0
    cap 13[b0] = PCI Advanced Features: FLR TP

atapci1@pci0:0:31:5:	class=0x010185 rev=0x00 hdr=0x00 vendor=0x8086 device=0x3a26 subvendor=0x1028 subdevice=0x028c
    vendor     = 'Intel Corporation'
    device     = '82801JI (ICH10 Family) 2 port SATA IDE Controller'
    class      = mass storage
    subclass   = ATA
    bar   [10] = type I/O Port, range 32, base 0xe8f0, size 8, enabled
    bar   [14] = type I/O Port, range 32, base 0xe8d8, size 4, enabled
    bar   [18] = type I/O Port, range 32, base 0xe8f8, size 8, enabled
    bar   [1c] = type I/O Port, range 32, base 0xe8dc, size 4, enabled
    bar   [20] = type I/O Port, range 32, base 0xec20, size 16, enabled
    bar   [24] = type I/O Port, range 32, base 0xec30, size 16, enabled
    cap 01[70] = powerspec 3  supports D0 D3  current D0
    cap 13[b0] = PCI Advanced Features: FLR TP

bce0@pci0:1:0:0:	class=0x020000 rev=0x20 hdr=0x00 vendor=0x14e4 device=0x163b subvendor=0x1028 subdevice=0x028c
    vendor     = 'Broadcom Inc. and subsidiaries'
    device     = 'NetXtreme II BCM5716 Gigabit Ethernet'
    class      = network
    subclass   = ethernet
    bar   [10] = type Memory, range 64, base 0xda000000, size 33554432, enabled
    cap 01[48] = powerspec 3  supports D0 D3  current D0
    cap 03[50] = VPD
    cap 05[58] = MSI supports 16 messages, 64 bit enabled with 1 message
    cap 11[a0] = MSI-X supports 9 messages
                 Table in map 0x10[0xc000], PBA in map 0x10[0xe000]
    cap 10[ac] = PCI-Express 2 endpoint max data 256(512) RO NS
                 max read 512
                 link x4(x4) speed 2.5(2.5) ASPM disabled(L0s/L1)
    ecap 0003[100] = Serial 1 782bcbfffe0ab618
    ecap 0001[110] = AER 1 0 fatal 0 non-fatal 1 corrected
    ecap 0004[150] = Power Budgeting 1
    ecap 0002[160] = VC 1 max VC0

bce1@pci0:1:0:1:	class=0x020000 rev=0x20 hdr=0x00 vendor=0x14e4 device=0x163b subvendor=0x1028 subdevice=0x028c
    vendor     = 'Broadcom Inc. and subsidiaries'
    device     = 'NetXtreme II BCM5716 Gigabit Ethernet'
    class      = network
    subclass   = ethernet
    bar   [10] = type Memory, range 64, base 0xdc000000, size 33554432, enabled
    cap 01[48] = powerspec 3  supports D0 D3  current D0
    cap 03[50] = VPD
    cap 05[58] = MSI supports 16 messages, 64 bit enabled with 1 message
    cap 11[a0] = MSI-X supports 9 messages
                 Table in map 0x10[0xc000], PBA in map 0x10[0xe000]
    cap 10[ac] = PCI-Express 2 endpoint max data 256(512) RO NS
                 max read 512
                 link x4(x4) speed 2.5(2.5) ASPM disabled(L0s/L1)
    ecap 0003[100] = Serial 1 782bcbfffe0ab619
    ecap 0001[110] = AER 1 0 fatal 0 non-fatal 1 corrected
    ecap 0004[150] = Power Budgeting 1
    ecap 0002[160] = VC 1 max VC0

mpt0@pci0:3:0:0:	class=0x010000 rev=0x08 hdr=0x00 vendor=0x1000 device=0x0058 subvendor=0x1028 subdevice=0x1f10
    vendor     = 'Broadcom / LSI'
    device     = 'SAS1068E PCI-Express Fusion-MPT SAS'
    class      = mass storage
    subclass   = SCSI
    bar   [10] = type I/O Port, range 32, base 0xfc00, size 256, disabled
    bar   [14] = type Memory, range 64, base 0xdf2ec000, size 16384, enabled
    bar   [1c] = type Memory, range 64, base 0xdf2f0000, size 65536, enabled
    cap 01[50] = powerspec 2  supports D0 D1 D2 D3  current D0
    cap 10[68] = PCI-Express 1 endpoint max data 256(4096) RO NS
                 max read 512
                 link x8(x8) speed 2.5(2.5) ASPM disabled(L0s/L1)
    cap 05[98] = MSI supports 1 message, 64 bit 
    cap 11[b0] = MSI-X supports 1 message, enabled
                 Table in map 0x14[0x2000], PBA in map 0x14[0x3000]
    ecap 0001[100] = AER 1 0 fatal 0 non-fatal 0 corrected

vgapci0@pci0:4:3:0:	class=0x030000 rev=0x0a hdr=0x00 vendor=0x102b device=0x0532 subvendor=0x1028 subdevice=0x028c
    vendor     = 'Matrox Electronics Systems Ltd.'
    device     = 'MGA G200eW WPCM450'
    class      = display
    subclass   = VGA
    bar   [10] = type Prefetchable Memory, range 32, base 0xd9800000, size 8388608, enabled
    bar   [14] = type Memory, range 32, base 0xde7fc000, size 16384, enabled
    bar   [18] = type Memory, range 32, base 0xde800000, size 8388608, enabled
    cap 01[dc] = powerspec 1  supports D0 D3  current D0
