none0@pci0:255:8:0:	class=0x088000 rev=0x02 hdr=0x00 vendor=0x8086 device=0x2f80 subvendor=0x8086 subdevice=0x2f80
    vendor     = 'Intel Corporation'
    device     = 'Xeon E7 v3/Xeon E5 v3/Core i7 QPI Link 0'
    class      = base peripheral

none1@pci0:255:8:2:	class=0x110100 rev=0x02 hdr=0x00 vendor=0x8086 device=0x2f32 subvendor=0x8086 subdevice=0x2f32
    vendor     = 'Intel Corporation'
    device     = 'Xeon E7 v3/Xeon E5 v3/Core i7 QPI Link 0'
    class      = dasp
    subclass   = performance counters

none2@pci0:255:8:3:	class=0x088000 rev=0x02 hdr=0x00 vendor=0x8086 device=0x2f83 subvendor=0x8086 subdevice=0x2f83
    vendor     = 'Intel Corporation'
    device     = 'Xeon E7 v3/Xeon E5 v3/Core i7 QPI Link 0'
    class      = base peripheral

none3@pci0:255:11:0:	class=0x088000 rev=0x02 hdr=0x00 vendor=0x8086 device=0x2f81 subvendor=0x8086 subdevice=0x2f81
    vendor     = 'Intel Corporation'
    device     = 'Xeon E7 v3/Xeon E5 v3/Core i7 R3 QPI Link 0 & 1 Monitoring'
    class      = base peripheral

none4@pci0:255:11:1:	class=0x110100 rev=0x02 hdr=0x00 vendor=0x8086 device=0x2f36 subvendor=0x8086 subdevice=0x2f36
    vendor     = 'Intel Corporation'
    device     = 'Xeon E7 v3/Xeon E5 v3/Core i7 R3 QPI Link 0 & 1 Monitoring'
    class      = dasp
    subclass   = performance counters

none5@pci0:255:11:2:	class=0x110100 rev=0x02 hdr=0x00 vendor=0x8086 device=0x2f37 subvendor=0x8086 subdevice=0x2f37
    vendor     = 'Intel Corporation'
    device     = 'Xeon E7 v3/Xeon E5 v3/Core i7 R3 QPI Link 0 & 1 Monitoring'
    class      = dasp
    subclass   = performance counters

none6@pci0:255:12:0:	class=0x088000 rev=0x02 hdr=0x00 vendor=0x8086 device=0x2fe0 subvendor=0x8086 subdevice=0x2fe0
    vendor     = 'Intel Corporation'
    device     = 'Xeon E7 v3/Xeon E5 v3/Core i7 Unicast Registers'
    class      = base peripheral

none7@pci0:255:12:1:	class=0x088000 rev=0x02 hdr=0x00 vendor=0x8086 device=0x2fe1 subvendor=0x8086 subdevice=0x2fe1
    vendor     = 'Intel Corporation'
    device     = 'Xeon E7 v3/Xeon E5 v3/Core i7 Unicast Registers'
    class      = base peripheral

none8@pci0:255:12:2:	class=0x088000 rev=0x02 hdr=0x00 vendor=0x8086 device=0x2fe2 subvendor=0x8086 subdevice=0x2fe2
    vendor     = 'Intel Corporation'
    device     = 'Xeon E7 v3/Xeon E5 v3/Core i7 Unicast Registers'
    class      = base peripheral

none9@pci0:255:12:3:	class=0x088000 rev=0x02 hdr=0x00 vendor=0x8086 device=0x2fe3 subvendor=0x8086 subdevice=0x2fe3
    vendor     = 'Intel Corporation'
    device     = 'Xeon E7 v3/Xeon E5 v3/Core i7 Unicast Registers'
    class      = base peripheral

none10@pci0:255:12:4:	class=0x088000 rev=0x02 hdr=0x00 vendor=0x8086 device=0x2fe4 subvendor=0x8086 subdevice=0x2fe4
    vendor     = 'Intel Corporation'
    device     = 'Xeon E7 v3/Xeon E5 v3/Core i7 Unicast Registers'
    class      = base peripheral

none11@pci0:255:12:5:	class=0x088000 rev=0x02 hdr=0x00 vendor=0x8086 device=0x2fe5 subvendor=0x8086 subdevice=0x2fe5
    vendor     = 'Intel Corporation'
    device     = 'Xeon E7 v3/Xeon E5 v3/Core i7 Unicast Registers'
    class      = base peripheral

none12@pci0:255:12:6:	class=0x088000 rev=0x02 hdr=0x00 vendor=0x8086 device=0x2fe6 subvendor=0x8086 subdevice=0x2fe6
    vendor     = 'Intel Corporation'
    device     = 'Xeon E7 v3/Xeon E5 v3/Core i7 Unicast Registers'
    class      = base peripheral

none13@pci0:255:12:7:	class=0x088000 rev=0x02 hdr=0x00 vendor=0x8086 device=0x2fe7 subvendor=0x8086 subdevice=0x2fe7
    vendor     = 'Intel Corporation'
    device     = 'Xeon E7 v3/Xeon E5 v3/Core i7 Unicast Registers'
    class      = base peripheral

none14@pci0:255:15:0:	class=0x088000 rev=0x02 hdr=0x00 vendor=0x8086 device=0x2ff8 subvendor=0x0000 subdevice=0x0000
    vendor     = 'Intel Corporation'
    device     = 'Xeon E7 v3/Xeon E5 v3/Core i7 Buffered Ring Agent'
    class      = base peripheral

none15@pci0:255:15:1:	class=0x088000 rev=0x02 hdr=0x00 vendor=0x8086 device=0x2ff9 subvendor=0x0000 subdevice=0x0000
    vendor     = 'Intel Corporation'
    device     = 'Xeon E7 v3/Xeon E5 v3/Core i7 Buffered Ring Agent'
    class      = base peripheral

none16@pci0:255:15:4:	class=0x088000 rev=0x02 hdr=0x00 vendor=0x8086 device=0x2ffc subvendor=0x8086 subdevice=0x2fe0
    vendor     = 'Intel Corporation'
    device     = 'Xeon E7 v3/Xeon E5 v3/Core i7 System Address Decoder & Broadcast Registers'
    class      = base peripheral

none17@pci0:255:15:5:	class=0x088000 rev=0x02 hdr=0x00 vendor=0x8086 device=0x2ffd subvendor=0x8086 subdevice=0x2fe0
    vendor     = 'Intel Corporation'
    device     = 'Xeon E7 v3/Xeon E5 v3/Core i7 System Address Decoder & Broadcast Registers'
    class      = base peripheral

none18@pci0:255:15:6:	class=0x088000 rev=0x02 hdr=0x00 vendor=0x8086 device=0x2ffe subvendor=0x8086 subdevice=0x2fe0
    vendor     = 'Intel Corporation'
    device     = 'Xeon E7 v3/Xeon E5 v3/Core i7 System Address Decoder & Broadcast Registers'
    class      = base peripheral

none19@pci0:255:16:0:	class=0x088000 rev=0x02 hdr=0x00 vendor=0x8086 device=0x2f1d subvendor=0x8086 subdevice=0x2f1d
    vendor     = 'Intel Corporation'
    device     = 'Xeon E7 v3/Xeon E5 v3/Core i7 PCIe Ring Interface'
    class      = base peripheral

none20@pci0:255:16:1:	class=0x110100 rev=0x02 hdr=0x00 vendor=0x8086 device=0x2f34 subvendor=0x8086 subdevice=0x2f34
    vendor     = 'Intel Corporation'
    device     = 'Xeon E7 v3/Xeon E5 v3/Core i7 PCIe Ring Interface'
    class      = dasp
    subclass   = performance counters

none21@pci0:255:16:5:	class=0x088000 rev=0x02 hdr=0x00 vendor=0x8086 device=0x2f1e subvendor=0x8086 subdevice=0x2f1e
    vendor     = 'Intel Corporation'
    device     = 'Xeon E7 v3/Xeon E5 v3/Core i7 Scratchpad & Semaphore Registers'
    class      = base peripheral

none22@pci0:255:16:6:	class=0x110100 rev=0x02 hdr=0x00 vendor=0x8086 device=0x2f7d subvendor=0x8086 subdevice=0x2f7d
    vendor     = 'Intel Corporation'
    device     = 'Xeon E7 v3/Xeon E5 v3/Core i7 Scratchpad & Semaphore Registers'
    class      = dasp
    subclass   = performance counters

none23@pci0:255:16:7:	class=0x088000 rev=0x02 hdr=0x00 vendor=0x8086 device=0x2f1f subvendor=0x8086 subdevice=0x2f1f
    vendor     = 'Intel Corporation'
    device     = 'Xeon E7 v3/Xeon E5 v3/Core i7 Scratchpad & Semaphore Registers'
    class      = base peripheral

none24@pci0:255:18:0:	class=0x088000 rev=0x02 hdr=0x00 vendor=0x8086 device=0x2fa0 subvendor=0x8086 subdevice=0x2fa0
    vendor     = 'Intel Corporation'
    device     = 'Xeon E7 v3/Xeon E5 v3/Core i7 Home Agent 0'
    class      = base peripheral

none25@pci0:255:18:1:	class=0x110100 rev=0x02 hdr=0x00 vendor=0x8086 device=0x2f30 subvendor=0x8086 subdevice=0x2f30
    vendor     = 'Intel Corporation'
    device     = 'Xeon E7 v3/Xeon E5 v3/Core i7 Home Agent 0'
    class      = dasp
    subclass   = performance counters

none26@pci0:255:19:0:	class=0x088000 rev=0x02 hdr=0x00 vendor=0x8086 device=0x2fa8 subvendor=0x8086 subdevice=0x2fa8
    vendor     = 'Intel Corporation'
    device     = 'Xeon E7 v3/Xeon E5 v3/Core i7 Integrated Memory Controller 0 Target Address, Thermal & RAS Registers'
    class      = base peripheral

none27@pci0:255:19:1:	class=0x088000 rev=0x02 hdr=0x00 vendor=0x8086 device=0x2f71 subvendor=0x8086 subdevice=0x2f71
    vendor     = 'Intel Corporation'
    device     = 'Xeon E7 v3/Xeon E5 v3/Core i7 Integrated Memory Controller 0 Target Address, Thermal & RAS Registers'
    class      = base peripheral

none28@pci0:255:19:2:	class=0x088000 rev=0x02 hdr=0x00 vendor=0x8086 device=0x2faa subvendor=0x8086 subdevice=0x2faa
    vendor     = 'Intel Corporation'
    device     = 'Xeon E7 v3/Xeon E5 v3/Core i7 Integrated Memory Controller 0 Channel Target Address Decoder'
    class      = base peripheral

none29@pci0:255:19:3:	class=0x088000 rev=0x02 hdr=0x00 vendor=0x8086 device=0x2fab subvendor=0x8086 subdevice=0x2fab
    vendor     = 'Intel Corporation'
    device     = 'Xeon E7 v3/Xeon E5 v3/Core i7 Integrated Memory Controller 0 Channel Target Address Decoder'
    class      = base peripheral

none30@pci0:255:19:4:	class=0x088000 rev=0x02 hdr=0x00 vendor=0x8086 device=0x2fac subvendor=0x8086 subdevice=0x2fac
    vendor     = 'Intel Corporation'
    device     = 'Xeon E7 v3/Xeon E5 v3/Core i7 Integrated Memory Controller 0 Channel Target Address Decoder'
    class      = base peripheral

none31@pci0:255:19:5:	class=0x088000 rev=0x02 hdr=0x00 vendor=0x8086 device=0x2fad subvendor=0x8086 subdevice=0x2fad
    vendor     = 'Intel Corporation'
    device     = 'Xeon E7 v3/Xeon E5 v3/Core i7 Integrated Memory Controller 0 Channel Target Address Decoder'
    class      = base peripheral

none32@pci0:255:19:6:	class=0x088000 rev=0x02 hdr=0x00 vendor=0x8086 device=0x2fae subvendor=0x0000 subdevice=0x0000
    vendor     = 'Intel Corporation'
    device     = 'Xeon E7 v3/Xeon E5 v3/Core i7 DDRIO Channel 0/1 Broadcast'
    class      = base peripheral

none33@pci0:255:19:7:	class=0x088000 rev=0x02 hdr=0x00 vendor=0x8086 device=0x2faf subvendor=0x0000 subdevice=0x0000
    vendor     = 'Intel Corporation'
    device     = 'Xeon E7 v3/Xeon E5 v3/Core i7 DDRIO Global Broadcast'
    class      = base peripheral

none34@pci0:255:20:0:	class=0x088000 rev=0x02 hdr=0x00 vendor=0x8086 device=0x2fb0 subvendor=0x8086 subdevice=0x2fb0
    vendor     = 'Intel Corporation'
    device     = 'Xeon E7 v3/Xeon E5 v3/Core i7 Integrated Memory Controller 0 Channel 0 Thermal Control'
    class      = base peripheral

none35@pci0:255:20:1:	class=0x088000 rev=0x02 hdr=0x00 vendor=0x8086 device=0x2fb1 subvendor=0x8086 subdevice=0x2fb1
    vendor     = 'Intel Corporation'
    device     = 'Xeon E7 v3/Xeon E5 v3/Core i7 Integrated Memory Controller 0 Channel 1 Thermal Control'
    class      = base peripheral

none36@pci0:255:20:2:	class=0x088000 rev=0x02 hdr=0x00 vendor=0x8086 device=0x2fb2 subvendor=0x8086 subdevice=0x2fb2
    vendor     = 'Intel Corporation'
    device     = 'Xeon E7 v3/Xeon E5 v3/Core i7 Integrated Memory Controller 0 Channel 0 ERROR Registers'
    class      = base peripheral

none37@pci0:255:20:3:	class=0x088000 rev=0x02 hdr=0x00 vendor=0x8086 device=0x2fb3 subvendor=0x8086 subdevice=0x2fb3
    vendor     = 'Intel Corporation'
    device     = 'Xeon E7 v3/Xeon E5 v3/Core i7 Integrated Memory Controller 0 Channel 1 ERROR Registers'
    class      = base peripheral

none38@pci0:255:20:6:	class=0x088000 rev=0x02 hdr=0x00 vendor=0x8086 device=0x2fbe subvendor=0x0000 subdevice=0x0000
    vendor     = 'Intel Corporation'
    device     = 'Xeon E7 v3/Xeon E5 v3/Core i7 DDRIO (VMSE) 0 & 1'
    class      = base peripheral

none39@pci0:255:20:7:	class=0x088000 rev=0x02 hdr=0x00 vendor=0x8086 device=0x2fbf subvendor=0x0000 subdevice=0x0000
    vendor     = 'Intel Corporation'
    device     = 'Xeon E7 v3/Xeon E5 v3/Core i7 DDRIO (VMSE) 0 & 1'
    class      = base peripheral

none40@pci0:255:21:0:	class=0x088000 rev=0x02 hdr=0x00 vendor=0x8086 device=0x2fb4 subvendor=0x8086 subdevice=0x2fb4
    vendor     = 'Intel Corporation'
    device     = 'Xeon E7 v3/Xeon E5 v3/Core i7 Integrated Memory Controller 0 Channel 2 Thermal Control'
    class      = base peripheral

none41@pci0:255:21:1:	class=0x088000 rev=0x02 hdr=0x00 vendor=0x8086 device=0x2fb5 subvendor=0x8086 subdevice=0x2fb5
    vendor     = 'Intel Corporation'
    device     = 'Xeon E7 v3/Xeon E5 v3/Core i7 Integrated Memory Controller 0 Channel 3 Thermal Control'
    class      = base peripheral

none42@pci0:255:21:2:	class=0x088000 rev=0x02 hdr=0x00 vendor=0x8086 device=0x2fb6 subvendor=0x8086 subdevice=0x2fb6
    vendor     = 'Intel Corporation'
    device     = 'Xeon E7 v3/Xeon E5 v3/Core i7 Integrated Memory Controller 0 Channel 2 ERROR Registers'
    class      = base peripheral

none43@pci0:255:21:3:	class=0x088000 rev=0x02 hdr=0x00 vendor=0x8086 device=0x2fb7 subvendor=0x8086 subdevice=0x2fb7
    vendor     = 'Intel Corporation'
    device     = 'Xeon E7 v3/Xeon E5 v3/Core i7 Integrated Memory Controller 0 Channel 3 ERROR Registers'
    class      = base peripheral

none44@pci0:255:22:0:	class=0x088000 rev=0x02 hdr=0x00 vendor=0x8086 device=0x2f68 subvendor=0x0000 subdevice=0x0000
    vendor     = 'Intel Corporation'
    device     = 'Xeon E7 v3/Xeon E5 v3/Core i7 Integrated Memory Controller 1 Target Address, Thermal & RAS Registers'
    class      = base peripheral

none45@pci0:255:22:6:	class=0x088000 rev=0x02 hdr=0x00 vendor=0x8086 device=0x2f6e subvendor=0x0000 subdevice=0x0000
    vendor     = 'Intel Corporation'
    device     = 'Xeon E7 v3/Xeon E5 v3/Core i7 DDRIO Channel 2/3 Broadcast'
    class      = base peripheral

none46@pci0:255:22:7:	class=0x088000 rev=0x02 hdr=0x00 vendor=0x8086 device=0x2f6f subvendor=0x0000 subdevice=0x0000
    vendor     = 'Intel Corporation'
    device     = 'Xeon E7 v3/Xeon E5 v3/Core i7 DDRIO Global Broadcast'
    class      = base peripheral

none47@pci0:255:23:0:	class=0x088000 rev=0x02 hdr=0x00 vendor=0x8086 device=0x2fd0 subvendor=0x0000 subdevice=0x0000
    vendor     = 'Intel Corporation'
    device     = 'Xeon E7 v3/Xeon E5 v3/Core i7 Integrated Memory Controller 1 Channel 0 Thermal Control'
    class      = base peripheral

none48@pci0:255:23:4:	class=0x088000 rev=0x02 hdr=0x00 vendor=0x8086 device=0x2fb8 subvendor=0x0000 subdevice=0x0000
    vendor     = 'Intel Corporation'
    device     = 'Xeon E7 v3/Xeon E5 v3/Core i7 DDRIO (VMSE) 2 & 3'
    class      = base peripheral

none49@pci0:255:23:5:	class=0x088000 rev=0x02 hdr=0x00 vendor=0x8086 device=0x2fb9 subvendor=0x0000 subdevice=0x0000
    vendor     = 'Intel Corporation'
    device     = 'Xeon E7 v3/Xeon E5 v3/Core i7 DDRIO (VMSE) 2 & 3'
    class      = base peripheral

none50@pci0:255:23:6:	class=0x088000 rev=0x02 hdr=0x00 vendor=0x8086 device=0x2fba subvendor=0x0000 subdevice=0x0000
    vendor     = 'Intel Corporation'
    device     = 'Xeon E7 v3/Xeon E5 v3/Core i7 DDRIO (VMSE) 2 & 3'
    class      = base peripheral

none51@pci0:255:23:7:	class=0x088000 rev=0x02 hdr=0x00 vendor=0x8086 device=0x2fbb subvendor=0x0000 subdevice=0x0000
    vendor     = 'Intel Corporation'
    device     = 'Xeon E7 v3/Xeon E5 v3/Core i7 DDRIO (VMSE) 2 & 3'
    class      = base peripheral

none52@pci0:255:30:0:	class=0x088000 rev=0x02 hdr=0x00 vendor=0x8086 device=0x2f98 subvendor=0x8086 subdevice=0x2f98
    vendor     = 'Intel Corporation'
    device     = 'Xeon E7 v3/Xeon E5 v3/Core i7 Power Control Unit'
    class      = base peripheral

none53@pci0:255:30:1:	class=0x088000 rev=0x02 hdr=0x00 vendor=0x8086 device=0x2f99 subvendor=0x8086 subdevice=0x2f99
    vendor     = 'Intel Corporation'
    device     = 'Xeon E7 v3/Xeon E5 v3/Core i7 Power Control Unit'
    class      = base peripheral

none54@pci0:255:30:2:	class=0x088000 rev=0x02 hdr=0x00 vendor=0x8086 device=0x2f9a subvendor=0x8086 subdevice=0x2f9a
    vendor     = 'Intel Corporation'
    device     = 'Xeon E7 v3/Xeon E5 v3/Core i7 Power Control Unit'
    class      = base peripheral

none55@pci0:255:30:3:	class=0x088000 rev=0x02 hdr=0x00 vendor=0x8086 device=0x2fc0 subvendor=0x8086 subdevice=0x2fc0
    vendor     = 'Intel Corporation'
    device     = 'Xeon E7 v3/Xeon E5 v3/Core i7 Power Control Unit'
    class      = base peripheral
    bar   [10] = type Prefetchable Memory, range 32, base 0x10, size 16, disabled

none56@pci0:255:30:4:	class=0x088000 rev=0x02 hdr=0x00 vendor=0x8086 device=0x2f9c subvendor=0x8086 subdevice=0x2f9c
    vendor     = 'Intel Corporation'
    device     = 'Xeon E7 v3/Xeon E5 v3/Core i7 Power Control Unit'
    class      = base peripheral

none57@pci0:255:31:0:	class=0x088000 rev=0x02 hdr=0x00 vendor=0x8086 device=0x2f88 subvendor=0x0000 subdevice=0x0000
    vendor     = 'Intel Corporation'
    device     = 'Xeon E7 v3/Xeon E5 v3/Core i7 VCU'
    class      = base peripheral

none58@pci0:255:31:2:	class=0x088000 rev=0x02 hdr=0x00 vendor=0x8086 device=0x2f8a subvendor=0x0000 subdevice=0x0000
    vendor     = 'Intel Corporation'
    device     = 'Xeon E7 v3/Xeon E5 v3/Core i7 VCU'
    class      = base peripheral

none59@pci0:127:8:0:	class=0x088000 rev=0x02 hdr=0x00 vendor=0x8086 device=0x2f80 subvendor=0x8086 subdevice=0x2f80
    vendor     = 'Intel Corporation'
    device     = 'Xeon E7 v3/Xeon E5 v3/Core i7 QPI Link 0'
    class      = base peripheral

none60@pci0:127:8:2:	class=0x110100 rev=0x02 hdr=0x00 vendor=0x8086 device=0x2f32 subvendor=0x8086 subdevice=0x2f32
    vendor     = 'Intel Corporation'
    device     = 'Xeon E7 v3/Xeon E5 v3/Core i7 QPI Link 0'
    class      = dasp
    subclass   = performance counters

none61@pci0:127:8:3:	class=0x088000 rev=0x02 hdr=0x00 vendor=0x8086 device=0x2f83 subvendor=0x8086 subdevice=0x2f83
    vendor     = 'Intel Corporation'
    device     = 'Xeon E7 v3/Xeon E5 v3/Core i7 QPI Link 0'
    class      = base peripheral

none62@pci0:127:11:0:	class=0x088000 rev=0x02 hdr=0x00 vendor=0x8086 device=0x2f81 subvendor=0x8086 subdevice=0x2f81
    vendor     = 'Intel Corporation'
    device     = 'Xeon E7 v3/Xeon E5 v3/Core i7 R3 QPI Link 0 & 1 Monitoring'
    class      = base peripheral

none63@pci0:127:11:1:	class=0x110100 rev=0x02 hdr=0x00 vendor=0x8086 device=0x2f36 subvendor=0x8086 subdevice=0x2f36
    vendor     = 'Intel Corporation'
    device     = 'Xeon E7 v3/Xeon E5 v3/Core i7 R3 QPI Link 0 & 1 Monitoring'
    class      = dasp
    subclass   = performance counters

none64@pci0:127:11:2:	class=0x110100 rev=0x02 hdr=0x00 vendor=0x8086 device=0x2f37 subvendor=0x8086 subdevice=0x2f37
    vendor     = 'Intel Corporation'
    device     = 'Xeon E7 v3/Xeon E5 v3/Core i7 R3 QPI Link 0 & 1 Monitoring'
    class      = dasp
    subclass   = performance counters

none65@pci0:127:12:0:	class=0x088000 rev=0x02 hdr=0x00 vendor=0x8086 device=0x2fe0 subvendor=0x8086 subdevice=0x2fe0
    vendor     = 'Intel Corporation'
    device     = 'Xeon E7 v3/Xeon E5 v3/Core i7 Unicast Registers'
    class      = base peripheral

none66@pci0:127:12:1:	class=0x088000 rev=0x02 hdr=0x00 vendor=0x8086 device=0x2fe1 subvendor=0x8086 subdevice=0x2fe1
    vendor     = 'Intel Corporation'
    device     = 'Xeon E7 v3/Xeon E5 v3/Core i7 Unicast Registers'
    class      = base peripheral

none67@pci0:127:12:2:	class=0x088000 rev=0x02 hdr=0x00 vendor=0x8086 device=0x2fe2 subvendor=0x8086 subdevice=0x2fe2
    vendor     = 'Intel Corporation'
    device     = 'Xeon E7 v3/Xeon E5 v3/Core i7 Unicast Registers'
    class      = base peripheral

none68@pci0:127:12:3:	class=0x088000 rev=0x02 hdr=0x00 vendor=0x8086 device=0x2fe3 subvendor=0x8086 subdevice=0x2fe3
    vendor     = 'Intel Corporation'
    device     = 'Xeon E7 v3/Xeon E5 v3/Core i7 Unicast Registers'
    class      = base peripheral

none69@pci0:127:12:4:	class=0x088000 rev=0x02 hdr=0x00 vendor=0x8086 device=0x2fe4 subvendor=0x8086 subdevice=0x2fe4
    vendor     = 'Intel Corporation'
    device     = 'Xeon E7 v3/Xeon E5 v3/Core i7 Unicast Registers'
    class      = base peripheral

none70@pci0:127:12:5:	class=0x088000 rev=0x02 hdr=0x00 vendor=0x8086 device=0x2fe5 subvendor=0x8086 subdevice=0x2fe5
    vendor     = 'Intel Corporation'
    device     = 'Xeon E7 v3/Xeon E5 v3/Core i7 Unicast Registers'
    class      = base peripheral

none71@pci0:127:12:6:	class=0x088000 rev=0x02 hdr=0x00 vendor=0x8086 device=0x2fe6 subvendor=0x8086 subdevice=0x2fe6
    vendor     = 'Intel Corporation'
    device     = 'Xeon E7 v3/Xeon E5 v3/Core i7 Unicast Registers'
    class      = base peripheral

none72@pci0:127:12:7:	class=0x088000 rev=0x02 hdr=0x00 vendor=0x8086 device=0x2fe7 subvendor=0x8086 subdevice=0x2fe7
    vendor     = 'Intel Corporation'
    device     = 'Xeon E7 v3/Xeon E5 v3/Core i7 Unicast Registers'
    class      = base peripheral

none73@pci0:127:15:0:	class=0x088000 rev=0x02 hdr=0x00 vendor=0x8086 device=0x2ff8 subvendor=0x0000 subdevice=0x0000
    vendor     = 'Intel Corporation'
    device     = 'Xeon E7 v3/Xeon E5 v3/Core i7 Buffered Ring Agent'
    class      = base peripheral

none74@pci0:127:15:1:	class=0x088000 rev=0x02 hdr=0x00 vendor=0x8086 device=0x2ff9 subvendor=0x0000 subdevice=0x0000
    vendor     = 'Intel Corporation'
    device     = 'Xeon E7 v3/Xeon E5 v3/Core i7 Buffered Ring Agent'
    class      = base peripheral

none75@pci0:127:15:4:	class=0x088000 rev=0x02 hdr=0x00 vendor=0x8086 device=0x2ffc subvendor=0x8086 subdevice=0x2fe0
    vendor     = 'Intel Corporation'
    device     = 'Xeon E7 v3/Xeon E5 v3/Core i7 System Address Decoder & Broadcast Registers'
    class      = base peripheral

none76@pci0:127:15:5:	class=0x088000 rev=0x02 hdr=0x00 vendor=0x8086 device=0x2ffd subvendor=0x8086 subdevice=0x2fe0
    vendor     = 'Intel Corporation'
    device     = 'Xeon E7 v3/Xeon E5 v3/Core i7 System Address Decoder & Broadcast Registers'
    class      = base peripheral

none77@pci0:127:15:6:	class=0x088000 rev=0x02 hdr=0x00 vendor=0x8086 device=0x2ffe subvendor=0x8086 subdevice=0x2fe0
    vendor     = 'Intel Corporation'
    device     = 'Xeon E7 v3/Xeon E5 v3/Core i7 System Address Decoder & Broadcast Registers'
    class      = base peripheral

none78@pci0:127:16:0:	class=0x088000 rev=0x02 hdr=0x00 vendor=0x8086 device=0x2f1d subvendor=0x8086 subdevice=0x2f1d
    vendor     = 'Intel Corporation'
    device     = 'Xeon E7 v3/Xeon E5 v3/Core i7 PCIe Ring Interface'
    class      = base peripheral

none79@pci0:127:16:1:	class=0x110100 rev=0x02 hdr=0x00 vendor=0x8086 device=0x2f34 subvendor=0x8086 subdevice=0x2f34
    vendor     = 'Intel Corporation'
    device     = 'Xeon E7 v3/Xeon E5 v3/Core i7 PCIe Ring Interface'
    class      = dasp
    subclass   = performance counters

none80@pci0:127:16:5:	class=0x088000 rev=0x02 hdr=0x00 vendor=0x8086 device=0x2f1e subvendor=0x8086 subdevice=0x2f1e
    vendor     = 'Intel Corporation'
    device     = 'Xeon E7 v3/Xeon E5 v3/Core i7 Scratchpad & Semaphore Registers'
    class      = base peripheral

none81@pci0:127:16:6:	class=0x110100 rev=0x02 hdr=0x00 vendor=0x8086 device=0x2f7d subvendor=0x8086 subdevice=0x2f7d
    vendor     = 'Intel Corporation'
    device     = 'Xeon E7 v3/Xeon E5 v3/Core i7 Scratchpad & Semaphore Registers'
    class      = dasp
    subclass   = performance counters

none82@pci0:127:16:7:	class=0x088000 rev=0x02 hdr=0x00 vendor=0x8086 device=0x2f1f subvendor=0x8086 subdevice=0x2f1f
    vendor     = 'Intel Corporation'
    device     = 'Xeon E7 v3/Xeon E5 v3/Core i7 Scratchpad & Semaphore Registers'
    class      = base peripheral

none83@pci0:127:18:0:	class=0x088000 rev=0x02 hdr=0x00 vendor=0x8086 device=0x2fa0 subvendor=0x8086 subdevice=0x2fa0
    vendor     = 'Intel Corporation'
    device     = 'Xeon E7 v3/Xeon E5 v3/Core i7 Home Agent 0'
    class      = base peripheral

none84@pci0:127:18:1:	class=0x110100 rev=0x02 hdr=0x00 vendor=0x8086 device=0x2f30 subvendor=0x8086 subdevice=0x2f30
    vendor     = 'Intel Corporation'
    device     = 'Xeon E7 v3/Xeon E5 v3/Core i7 Home Agent 0'
    class      = dasp
    subclass   = performance counters

none85@pci0:127:19:0:	class=0x088000 rev=0x02 hdr=0x00 vendor=0x8086 device=0x2fa8 subvendor=0x8086 subdevice=0x2fa8
    vendor     = 'Intel Corporation'
    device     = 'Xeon E7 v3/Xeon E5 v3/Core i7 Integrated Memory Controller 0 Target Address, Thermal & RAS Registers'
    class      = base peripheral

none86@pci0:127:19:1:	class=0x088000 rev=0x02 hdr=0x00 vendor=0x8086 device=0x2f71 subvendor=0x8086 subdevice=0x2f71
    vendor     = 'Intel Corporation'
    device     = 'Xeon E7 v3/Xeon E5 v3/Core i7 Integrated Memory Controller 0 Target Address, Thermal & RAS Registers'
    class      = base peripheral

none87@pci0:127:19:2:	class=0x088000 rev=0x02 hdr=0x00 vendor=0x8086 device=0x2faa subvendor=0x8086 subdevice=0x2faa
    vendor     = 'Intel Corporation'
    device     = 'Xeon E7 v3/Xeon E5 v3/Core i7 Integrated Memory Controller 0 Channel Target Address Decoder'
    class      = base peripheral

none88@pci0:127:19:3:	class=0x088000 rev=0x02 hdr=0x00 vendor=0x8086 device=0x2fab subvendor=0x8086 subdevice=0x2fab
    vendor     = 'Intel Corporation'
    device     = 'Xeon E7 v3/Xeon E5 v3/Core i7 Integrated Memory Controller 0 Channel Target Address Decoder'
    class      = base peripheral

none89@pci0:127:19:4:	class=0x088000 rev=0x02 hdr=0x00 vendor=0x8086 device=0x2fac subvendor=0x8086 subdevice=0x2fac
    vendor     = 'Intel Corporation'
    device     = 'Xeon E7 v3/Xeon E5 v3/Core i7 Integrated Memory Controller 0 Channel Target Address Decoder'
    class      = base peripheral

none90@pci0:127:19:5:	class=0x088000 rev=0x02 hdr=0x00 vendor=0x8086 device=0x2fad subvendor=0x8086 subdevice=0x2fad
    vendor     = 'Intel Corporation'
    device     = 'Xeon E7 v3/Xeon E5 v3/Core i7 Integrated Memory Controller 0 Channel Target Address Decoder'
    class      = base peripheral

none91@pci0:127:19:6:	class=0x088000 rev=0x02 hdr=0x00 vendor=0x8086 device=0x2fae subvendor=0x0000 subdevice=0x0000
    vendor     = 'Intel Corporation'
    device     = 'Xeon E7 v3/Xeon E5 v3/Core i7 DDRIO Channel 0/1 Broadcast'
    class      = base peripheral

none92@pci0:127:19:7:	class=0x088000 rev=0x02 hdr=0x00 vendor=0x8086 device=0x2faf subvendor=0x0000 subdevice=0x0000
    vendor     = 'Intel Corporation'
    device     = 'Xeon E7 v3/Xeon E5 v3/Core i7 DDRIO Global Broadcast'
    class      = base peripheral

none93@pci0:127:20:0:	class=0x088000 rev=0x02 hdr=0x00 vendor=0x8086 device=0x2fb0 subvendor=0x8086 subdevice=0x2fb0
    vendor     = 'Intel Corporation'
    device     = 'Xeon E7 v3/Xeon E5 v3/Core i7 Integrated Memory Controller 0 Channel 0 Thermal Control'
    class      = base peripheral

none94@pci0:127:20:1:	class=0x088000 rev=0x02 hdr=0x00 vendor=0x8086 device=0x2fb1 subvendor=0x8086 subdevice=0x2fb1
    vendor     = 'Intel Corporation'
    device     = 'Xeon E7 v3/Xeon E5 v3/Core i7 Integrated Memory Controller 0 Channel 1 Thermal Control'
    class      = base peripheral

none95@pci0:127:20:2:	class=0x088000 rev=0x02 hdr=0x00 vendor=0x8086 device=0x2fb2 subvendor=0x8086 subdevice=0x2fb2
    vendor     = 'Intel Corporation'
    device     = 'Xeon E7 v3/Xeon E5 v3/Core i7 Integrated Memory Controller 0 Channel 0 ERROR Registers'
    class      = base peripheral

none96@pci0:127:20:3:	class=0x088000 rev=0x02 hdr=0x00 vendor=0x8086 device=0x2fb3 subvendor=0x8086 subdevice=0x2fb3
    vendor     = 'Intel Corporation'
    device     = 'Xeon E7 v3/Xeon E5 v3/Core i7 Integrated Memory Controller 0 Channel 1 ERROR Registers'
    class      = base peripheral

none97@pci0:127:20:6:	class=0x088000 rev=0x02 hdr=0x00 vendor=0x8086 device=0x2fbe subvendor=0x0000 subdevice=0x0000
    vendor     = 'Intel Corporation'
    device     = 'Xeon E7 v3/Xeon E5 v3/Core i7 DDRIO (VMSE) 0 & 1'
    class      = base peripheral

none98@pci0:127:20:7:	class=0x088000 rev=0x02 hdr=0x00 vendor=0x8086 device=0x2fbf subvendor=0x0000 subdevice=0x0000
    vendor     = 'Intel Corporation'
    device     = 'Xeon E7 v3/Xeon E5 v3/Core i7 DDRIO (VMSE) 0 & 1'
    class      = base peripheral

none99@pci0:127:21:0:	class=0x088000 rev=0x02 hdr=0x00 vendor=0x8086 device=0x2fb4 subvendor=0x8086 subdevice=0x2fb4
    vendor     = 'Intel Corporation'
    device     = 'Xeon E7 v3/Xeon E5 v3/Core i7 Integrated Memory Controller 0 Channel 2 Thermal Control'
    class      = base peripheral

none100@pci0:127:21:1:	class=0x088000 rev=0x02 hdr=0x00 vendor=0x8086 device=0x2fb5 subvendor=0x8086 subdevice=0x2fb5
    vendor     = 'Intel Corporation'
    device     = 'Xeon E7 v3/Xeon E5 v3/Core i7 Integrated Memory Controller 0 Channel 3 Thermal Control'
    class      = base peripheral

none101@pci0:127:21:2:	class=0x088000 rev=0x02 hdr=0x00 vendor=0x8086 device=0x2fb6 subvendor=0x8086 subdevice=0x2fb6
    vendor     = 'Intel Corporation'
    device     = 'Xeon E7 v3/Xeon E5 v3/Core i7 Integrated Memory Controller 0 Channel 2 ERROR Registers'
    class      = base peripheral

none102@pci0:127:21:3:	class=0x088000 rev=0x02 hdr=0x00 vendor=0x8086 device=0x2fb7 subvendor=0x8086 subdevice=0x2fb7
    vendor     = 'Intel Corporation'
    device     = 'Xeon E7 v3/Xeon E5 v3/Core i7 Integrated Memory Controller 0 Channel 3 ERROR Registers'
    class      = base peripheral

none103@pci0:127:22:0:	class=0x088000 rev=0x02 hdr=0x00 vendor=0x8086 device=0x2f68 subvendor=0x0000 subdevice=0x0000
    vendor     = 'Intel Corporation'
    device     = 'Xeon E7 v3/Xeon E5 v3/Core i7 Integrated Memory Controller 1 Target Address, Thermal & RAS Registers'
    class      = base peripheral

none104@pci0:127:22:6:	class=0x088000 rev=0x02 hdr=0x00 vendor=0x8086 device=0x2f6e subvendor=0x0000 subdevice=0x0000
    vendor     = 'Intel Corporation'
    device     = 'Xeon E7 v3/Xeon E5 v3/Core i7 DDRIO Channel 2/3 Broadcast'
    class      = base peripheral

none105@pci0:127:22:7:	class=0x088000 rev=0x02 hdr=0x00 vendor=0x8086 device=0x2f6f subvendor=0x0000 subdevice=0x0000
    vendor     = 'Intel Corporation'
    device     = 'Xeon E7 v3/Xeon E5 v3/Core i7 DDRIO Global Broadcast'
    class      = base peripheral

none106@pci0:127:23:0:	class=0x088000 rev=0x02 hdr=0x00 vendor=0x8086 device=0x2fd0 subvendor=0x0000 subdevice=0x0000
    vendor     = 'Intel Corporation'
    device     = 'Xeon E7 v3/Xeon E5 v3/Core i7 Integrated Memory Controller 1 Channel 0 Thermal Control'
    class      = base peripheral

none107@pci0:127:23:4:	class=0x088000 rev=0x02 hdr=0x00 vendor=0x8086 device=0x2fb8 subvendor=0x0000 subdevice=0x0000
    vendor     = 'Intel Corporation'
    device     = 'Xeon E7 v3/Xeon E5 v3/Core i7 DDRIO (VMSE) 2 & 3'
    class      = base peripheral

none108@pci0:127:23:5:	class=0x088000 rev=0x02 hdr=0x00 vendor=0x8086 device=0x2fb9 subvendor=0x0000 subdevice=0x0000
    vendor     = 'Intel Corporation'
    device     = 'Xeon E7 v3/Xeon E5 v3/Core i7 DDRIO (VMSE) 2 & 3'
    class      = base peripheral

none109@pci0:127:23:6:	class=0x088000 rev=0x02 hdr=0x00 vendor=0x8086 device=0x2fba subvendor=0x0000 subdevice=0x0000
    vendor     = 'Intel Corporation'
    device     = 'Xeon E7 v3/Xeon E5 v3/Core i7 DDRIO (VMSE) 2 & 3'
    class      = base peripheral

none110@pci0:127:23:7:	class=0x088000 rev=0x02 hdr=0x00 vendor=0x8086 device=0x2fbb subvendor=0x0000 subdevice=0x0000
    vendor     = 'Intel Corporation'
    device     = 'Xeon E7 v3/Xeon E5 v3/Core i7 DDRIO (VMSE) 2 & 3'
    class      = base peripheral

none111@pci0:127:30:0:	class=0x088000 rev=0x02 hdr=0x00 vendor=0x8086 device=0x2f98 subvendor=0x8086 subdevice=0x2f98
    vendor     = 'Intel Corporation'
    device     = 'Xeon E7 v3/Xeon E5 v3/Core i7 Power Control Unit'
    class      = base peripheral

none112@pci0:127:30:1:	class=0x088000 rev=0x02 hdr=0x00 vendor=0x8086 device=0x2f99 subvendor=0x8086 subdevice=0x2f99
    vendor     = 'Intel Corporation'
    device     = 'Xeon E7 v3/Xeon E5 v3/Core i7 Power Control Unit'
    class      = base peripheral

none113@pci0:127:30:2:	class=0x088000 rev=0x02 hdr=0x00 vendor=0x8086 device=0x2f9a subvendor=0x8086 subdevice=0x2f9a
    vendor     = 'Intel Corporation'
    device     = 'Xeon E7 v3/Xeon E5 v3/Core i7 Power Control Unit'
    class      = base peripheral

none114@pci0:127:30:3:	class=0x088000 rev=0x02 hdr=0x00 vendor=0x8086 device=0x2fc0 subvendor=0x8086 subdevice=0x2fc0
    vendor     = 'Intel Corporation'
    device     = 'Xeon E7 v3/Xeon E5 v3/Core i7 Power Control Unit'
    class      = base peripheral
    bar   [10] = type Prefetchable Memory, range 32, base 0x10, size 16, disabled

none115@pci0:127:30:4:	class=0x088000 rev=0x02 hdr=0x00 vendor=0x8086 device=0x2f9c subvendor=0x8086 subdevice=0x2f9c
    vendor     = 'Intel Corporation'
    device     = 'Xeon E7 v3/Xeon E5 v3/Core i7 Power Control Unit'
    class      = base peripheral

none116@pci0:127:31:0:	class=0x088000 rev=0x02 hdr=0x00 vendor=0x8086 device=0x2f88 subvendor=0x0000 subdevice=0x0000
    vendor     = 'Intel Corporation'
    device     = 'Xeon E7 v3/Xeon E5 v3/Core i7 VCU'
    class      = base peripheral

none117@pci0:127:31:2:	class=0x088000 rev=0x02 hdr=0x00 vendor=0x8086 device=0x2f8a subvendor=0x0000 subdevice=0x0000
    vendor     = 'Intel Corporation'
    device     = 'Xeon E7 v3/Xeon E5 v3/Core i7 VCU'
    class      = base peripheral

hostb0@pci0:0:0:0:	class=0x060000 rev=0x02 hdr=0x00 vendor=0x8086 device=0x2f00 subvendor=0x8086 subdevice=0x0000
    vendor     = 'Intel Corporation'
    device     = 'Xeon E7 v3/Xeon E5 v3/Core i7 DMI2'
    class      = bridge
    subclass   = HOST-PCI
    cap 10[90] = PCI-Express 2 root port max data 128(128)
                 max read 128
                 link x0(x4) speed 0.0(2.5)
    cap 01[e0] = powerspec 3  supports D0 D3  current D0
    ecap 000b[100] = Vendor [1] ID 0002 Rev 0 Length 12
    ecap 000b[144] = Vendor [1] ID 0004 Rev 1 Length 60
    ecap 000b[1d0] = Vendor [1] ID 0003 Rev 1 Length 10
    ecap 000b[280] = Vendor [1] ID 0005 Rev 3 Length 24
    ecap 000b[300] = Vendor [1] ID 0008 Rev 0 Length 56

pcib3@pci0:0:1:0:	class=0x060400 rev=0x02 hdr=0x01 vendor=0x8086 device=0x2f02 subvendor=0x8086 subdevice=0x0000
    vendor     = 'Intel Corporation'
    device     = 'Xeon E7 v3/Xeon E5 v3/Core i7 PCI Express Root Port 1'
    class      = bridge
    subclass   = PCI-PCI
    cap 0d[40] = PCI Bridge subvendor=0x8086 subdevice=0x0000
    cap 05[60] = MSI supports 2 messages, vector masks 
    cap 10[90] = PCI-Express 2 root port max data 128(256) ARI disabled
                 max read 128
                 link x0(x8) speed 0.0(8.0)
                 slot 11 power limit 0 mW Attn Button PC(on)
    cap 01[e0] = powerspec 3  supports D0 D3  current D0
    ecap 000b[100] = Vendor [1] ID 0002 Rev 0 Length 12
    ecap 000d[110] = ACS 1
    ecap 0001[148] = AER 1 0 fatal 0 non-fatal 0 corrected
    ecap 000b[1d0] = Vendor [1] ID 0003 Rev 1 Length 10
    ecap 0019[250] = PCIe Sec 1 lane errors 0
    ecap 000b[280] = Vendor [1] ID 0005 Rev 3 Length 24
    ecap 000b[300] = Vendor [1] ID 0008 Rev 0 Length 56

pcib4@pci0:0:2:0:	class=0x060400 rev=0x02 hdr=0x01 vendor=0x8086 device=0x2f04 subvendor=0x8086 subdevice=0x0000
    vendor     = 'Intel Corporation'
    device     = 'Xeon E7 v3/Xeon E5 v3/Core i7 PCI Express Root Port 2'
    class      = bridge
    subclass   = PCI-PCI
    cap 0d[40] = PCI Bridge subvendor=0x8086 subdevice=0x0000
    cap 05[60] = MSI supports 2 messages, vector masks 
    cap 10[90] = PCI-Express 2 root port max data 128(256) ARI disabled
                 max read 128
                 link x0(x8) speed 0.0(8.0)
    cap 01[e0] = powerspec 3  supports D0 D3  current D0
    ecap 000b[100] = Vendor [1] ID 0002 Rev 0 Length 12
    ecap 000d[110] = ACS 1
    ecap 0001[148] = AER 1 0 fatal 0 non-fatal 0 corrected
    ecap 000b[1d0] = Vendor [1] ID 0003 Rev 1 Length 10
    ecap 0019[250] = PCIe Sec 1 lane errors 0
    ecap 000b[280] = Vendor [1] ID 0005 Rev 3 Length 24
    ecap 000b[300] = Vendor [1] ID 0008 Rev 0 Length 56

pcib5@pci0:0:2:2:	class=0x060400 rev=0x02 hdr=0x01 vendor=0x8086 device=0x2f06 subvendor=0x8086 subdevice=0x0000
    vendor     = 'Intel Corporation'
    device     = 'Xeon E7 v3/Xeon E5 v3/Core i7 PCI Express Root Port 2'
    class      = bridge
    subclass   = PCI-PCI
    cap 0d[40] = PCI Bridge subvendor=0x8086 subdevice=0x0000
    cap 05[60] = MSI supports 2 messages, vector masks 
    cap 10[90] = PCI-Express 2 root port max data 128(256) ARI disabled
                 max read 128
                 link x0(x8) speed 0.0(8.0)
                 slot 15 power limit 0 mW
    cap 01[e0] = powerspec 3  supports D0 D3  current D0
    ecap 000b[100] = Vendor [1] ID 0002 Rev 0 Length 12
    ecap 000d[110] = ACS 1
    ecap 0001[148] = AER 1 0 fatal 0 non-fatal 0 corrected
    ecap 000b[1d0] = Vendor [1] ID 0003 Rev 1 Length 10
    ecap 0019[250] = PCIe Sec 1 lane errors 0
    ecap 000b[280] = Vendor [1] ID 0005 Rev 3 Length 24
    ecap 000b[300] = Vendor [1] ID 0008 Rev 0 Length 56

pcib6@pci0:0:3:0:	class=0x060400 rev=0x02 hdr=0x01 vendor=0x8086 device=0x2f08 subvendor=0x8086 subdevice=0x0000
    vendor     = 'Intel Corporation'
    device     = 'Xeon E7 v3/Xeon E5 v3/Core i7 PCI Express Root Port 3'
    class      = bridge
    subclass   = PCI-PCI
    cap 0d[40] = PCI Bridge subvendor=0x8086 subdevice=0x0000
    cap 05[60] = MSI supports 2 messages, vector masks 
    cap 10[90] = PCI-Express 2 root port max data 128(256) ARI disabled
                 max read 128
                 link x0(x8) speed 0.0(8.0)
                 slot 1 power limit 0 mW
    cap 01[e0] = powerspec 3  supports D0 D3  current D0
    ecap 000b[100] = Vendor [1] ID 0002 Rev 0 Length 12
    ecap 000d[110] = ACS 1
    ecap 0001[148] = AER 1 0 fatal 0 non-fatal 0 corrected
    ecap 000b[1d0] = Vendor [1] ID 0003 Rev 1 Length 10
    ecap 0019[250] = PCIe Sec 1 lane errors 0
    ecap 000b[280] = Vendor [1] ID 0005 Rev 3 Length 24
    ecap 000b[300] = Vendor [1] ID 0008 Rev 0 Length 56

pcib7@pci0:0:3:2:	class=0x060400 rev=0x02 hdr=0x01 vendor=0x8086 device=0x2f0a subvendor=0x8086 subdevice=0x0000
    vendor     = 'Intel Corporation'
    device     = 'Xeon E7 v3/Xeon E5 v3/Core i7 PCI Express Root Port 3'
    class      = bridge
    subclass   = PCI-PCI
    cap 0d[40] = PCI Bridge subvendor=0x8086 subdevice=0x0000
    cap 05[60] = MSI supports 2 messages, vector masks 
    cap 10[90] = PCI-Express 2 root port max data 128(256) ARI disabled
                 max read 128
                 link x0(x8) speed 0.0(8.0)
    cap 01[e0] = powerspec 3  supports D0 D3  current D0
    ecap 000b[100] = Vendor [1] ID 0002 Rev 0 Length 12
    ecap 000d[110] = ACS 1
    ecap 0001[148] = AER 1 0 fatal 0 non-fatal 0 corrected
    ecap 000b[1d0] = Vendor [1] ID 0003 Rev 1 Length 10
    ecap 0019[250] = PCIe Sec 1 lane errors 0
    ecap 000b[280] = Vendor [1] ID 0005 Rev 3 Length 24
    ecap 000b[300] = Vendor [1] ID 0008 Rev 0 Length 56

none118@pci0:0:5:0:	class=0x088000 rev=0x02 hdr=0x00 vendor=0x8086 device=0x2f28 subvendor=0x0000 subdevice=0x0000
    vendor     = 'Intel Corporation'
    device     = 'Xeon E7 v3/Xeon E5 v3/Core i7 Address Map, VTd_Misc, System Management'
    class      = base peripheral
    cap 10[40] = PCI-Express 2 root endpoint max data 128(128)
                 max read 128

none119@pci0:0:5:1:	class=0x088000 rev=0x02 hdr=0x00 vendor=0x8086 device=0x2f29 subvendor=0x0000 subdevice=0x0000
    vendor     = 'Intel Corporation'
    device     = 'Xeon E7 v3/Xeon E5 v3/Core i7 Hot Plug'
    class      = base peripheral
    cap 10[40] = PCI-Express 1 root endpoint max data 128(128)
                 max read 128
    cap 05[80] = MSI supports 1 message, 64 bit 
    ecap 000b[100] = Vendor [1] ID 0006 Rev 1 Length 16
    ecap 000b[110] = Vendor [1] ID 0006 Rev 1 Length 16
    ecap 000b[120] = Vendor [1] ID 0006 Rev 1 Length 16
    ecap 000b[130] = Vendor [1] ID 0006 Rev 1 Length 16

none120@pci0:0:5:2:	class=0x088000 rev=0x02 hdr=0x00 vendor=0x8086 device=0x2f2a subvendor=0x0000 subdevice=0x0000
    vendor     = 'Intel Corporation'
    device     = 'Xeon E7 v3/Xeon E5 v3/Core i7 RAS, Control Status and Global Errors'
    class      = base peripheral
    cap 10[40] = PCI-Express 2 root endpoint max data 128(128) RO NS
                 max read 128

ioapic0@pci0:0:5:4:	class=0x080020 rev=0x02 hdr=0x00 vendor=0x8086 device=0x2f2c subvendor=0x8086 subdevice=0x0000
    vendor     = 'Intel Corporation'
    device     = 'Xeon E7 v3/Xeon E5 v3/Core i7 I/O APIC'
    class      = base peripheral
    subclass   = interrupt controller
    bar   [10] = type Memory, range 32, base 0xc7318000, size 4096, enabled
    cap 10[44] = PCI-Express 1 root endpoint max data 128(128)
                 max read 128
    cap 01[e0] = powerspec 3  supports D0 D3  current D0

none121@pci0:0:17:0:	class=0xff0000 rev=0x05 hdr=0x00 vendor=0x8086 device=0x8d7c subvendor=0x8086 subdevice=0x7270
    vendor     = 'Intel Corporation'
    device     = 'C610/X99 series chipset SPSR'
    cap 10[40] = PCI-Express 2 root endpoint max data 128(128)
                 max read 128
                 link x1(x1) speed 2.5(2.5) ASPM disabled(L0s/L1)
    cap 01[80] = powerspec 3  supports D0 D3  current D0

ehci0@pci0:0:26:0:	class=0x0c0320 rev=0x05 hdr=0x00 vendor=0x8086 device=0x8d2d subvendor=0x8086 subdevice=0x7270
    vendor     = 'Intel Corporation'
    device     = 'C610/X99 series chipset USB Enhanced Host Controller'
    class      = serial bus
    subclass   = USB
    bar   [10] = type Memory, range 32, base 0xc7314000, size 1024, enabled
    cap 01[50] = powerspec 2  supports D0 D3  current D0
    cap 0a[58] = EHCI Debug Port at offset 0xa0 in map 0x14
    cap 13[98] = PCI Advanced Features: FLR TP

pcib8@pci0:0:28:0:	class=0x060400 rev=0xd5 hdr=0x01 vendor=0x8086 device=0x8d10 subvendor=0x8086 subdevice=0x7270
    vendor     = 'Intel Corporation'
    device     = 'C610/X99 series chipset PCI Express Root Port'
    class      = bridge
    subclass   = PCI-PCI
    cap 10[40] = PCI-Express 2 root port max data 128(128)
                 max read 128
                 link x0(x1) speed 0.0(5.0) ASPM disabled(L0s/L1)
    cap 05[80] = MSI supports 1 message 
    cap 0d[90] = PCI Bridge subvendor=0x8086 subdevice=0x7270
    cap 01[a0] = powerspec 3  supports D0 D3  current D0

pcib9@pci0:0:28:2:	class=0x060400 rev=0xd5 hdr=0x01 vendor=0x8086 device=0x8d14 subvendor=0x8086 subdevice=0x7270
    vendor     = 'Intel Corporation'
    device     = 'C610/X99 series chipset PCI Express Root Port'
    class      = bridge
    subclass   = PCI-PCI
    cap 10[40] = PCI-Express 2 root port max data 128(128)
                 max read 128
                 link x1(x1) speed 2.5(5.0)
                 slot 0 power limit 0 mW
    cap 05[80] = MSI supports 1 message enabled with 1 message
    cap 0d[90] = PCI Bridge subvendor=0x8086 subdevice=0x7270
    cap 01[a0] = powerspec 3  supports D0 D3  current D0

pcib10@pci0:0:28:3:	class=0x060400 rev=0xd5 hdr=0x01 vendor=0x8086 device=0x8d16 subvendor=0x8086 subdevice=0x7270
    vendor     = 'Intel Corporation'
    device     = 'C610/X99 series chipset PCI Express Root Port'
    class      = bridge
    subclass   = PCI-PCI
    cap 10[40] = PCI-Express 2 root port max data 128(128)
                 max read 128
                 link x1(x1) speed 2.5(5.0)
                 slot 0 power limit 0 mW
    cap 05[80] = MSI supports 1 message enabled with 1 message
    cap 0d[90] = PCI Bridge subvendor=0x8086 subdevice=0x7270
    cap 01[a0] = powerspec 3  supports D0 D3  current D0

pcib11@pci0:0:28:4:	class=0x060400 rev=0xd5 hdr=0x01 vendor=0x8086 device=0x8d18 subvendor=0x8086 subdevice=0x7270
    vendor     = 'Intel Corporation'
    device     = 'C610/X99 series chipset PCI Express Root Port'
    class      = bridge
    subclass   = PCI-PCI
    cap 10[40] = PCI-Express 2 root port max data 128(128)
                 max read 128
                 link x1(x1) speed 2.5(5.0)
                 slot 4 power limit 100 mW
    cap 05[80] = MSI supports 1 message enabled with 1 message
    cap 0d[90] = PCI Bridge subvendor=0x8086 subdevice=0x7270
    cap 01[a0] = powerspec 3  supports D0 D3  current D0

ehci1@pci0:0:29:0:	class=0x0c0320 rev=0x05 hdr=0x00 vendor=0x8086 device=0x8d26 subvendor=0x8086 subdevice=0x7270
    vendor     = 'Intel Corporation'
    device     = 'C610/X99 series chipset USB Enhanced Host Controller'
    class      = serial bus
    subclass   = USB
    bar   [10] = type Memory, range 32, base 0xc7313000, size 1024, enabled
    cap 01[50] = powerspec 2  supports D0 D3  current D0
    cap 0a[58] = EHCI Debug Port at offset 0xa0 in map 0x14
    cap 13[98] = PCI Advanced Features: FLR TP

isab0@pci0:0:31:0:	class=0x060100 rev=0x05 hdr=0x00 vendor=0x8086 device=0x8d44 subvendor=0x8086 subdevice=0x7270
    vendor     = 'Intel Corporation'
    device     = 'C610/X99 series chipset LPC Controller'
    class      = bridge
    subclass   = PCI-ISA
    cap 09[e0] = vendor (length 12) Intel cap 1 version 0
		 features: AMT, 4 PCI-e x1 slots

ahci0@pci0:0:31:2:	class=0x010601 rev=0x05 hdr=0x00 vendor=0x8086 device=0x8d02 subvendor=0x8086 subdevice=0x7270
    vendor     = 'Intel Corporation'
    device     = 'C610/X99 series chipset 6-Port SATA Controller [AHCI mode]'
    class      = mass storage
    subclass   = SATA
    bar   [10] = type I/O Port, range 32, base 0x7050, size 8, enabled
    bar   [14] = type I/O Port, range 32, base 0x7040, size 4, enabled
    bar   [18] = type I/O Port, range 32, base 0x7030, size 8, enabled
    bar   [1c] = type I/O Port, range 32, base 0x7020, size 4, enabled
    bar   [20] = type I/O Port, range 32, base 0x7000, size 32, enabled
    bar   [24] = type Memory, range 32, base 0xc7312000, size 2048, enabled
    cap 05[80] = MSI supports 1 message enabled with 1 message
    cap 01[70] = powerspec 3  supports D0 D3  current D0
    cap 12[a8] = SATA Index-Data Pair

ichsmb0@pci0:0:31:3:	class=0x0c0500 rev=0x05 hdr=0x00 vendor=0x8086 device=0x8d22 subvendor=0x8086 subdevice=0x7270
    vendor     = 'Intel Corporation'
    device     = 'C610/X99 series chipset SMBus Controller'
    class      = serial bus
    subclass   = SMBus
    bar   [10] = type Memory, range 64, base 0xc7311000, size 256, enabled
    bar   [20] = type I/O Port, range 32, base 0x580, size 32, enabled

igb0@pci0:7:0:0:	class=0x020000 rev=0x03 hdr=0x00 vendor=0x8086 device=0x1539 subvendor=0x8086 subdevice=0x0000
    vendor     = 'Intel Corporation'
    device     = 'I211 Gigabit Network Connection'
    class      = network
    subclass   = ethernet
    bar   [10] = type Memory, range 32, base 0xc7200000, size 131072, enabled
    bar   [18] = type I/O Port, range 32, base 0x6000, size 32, enabled
    bar   [1c] = type Memory, range 32, base 0xc7220000, size 16384, enabled
    cap 01[40] = powerspec 3  supports D0 D3  current D0
    cap 05[50] = MSI supports 1 message, 64 bit, vector masks 
    cap 11[70] = MSI-X supports 5 messages, enabled
                 Table in map 0x1c[0x0], PBA in map 0x1c[0x2000]
    cap 10[a0] = PCI-Express 2 endpoint max data 128(512) FLR NS
                 max read 512
                 link x1(x1) speed 2.5(2.5) ASPM disabled(L0s/L1)
    ecap 0001[100] = AER 2 0 fatal 0 non-fatal 0 corrected
    ecap 0003[140] = Serial 1 001c7fffff44014a
    ecap 0017[1a0] = TPH Requester 1

igb1@pci0:8:0:0:	class=0x020000 rev=0x03 hdr=0x00 vendor=0x8086 device=0x1539 subvendor=0x8086 subdevice=0x0000
    vendor     = 'Intel Corporation'
    device     = 'I211 Gigabit Network Connection'
    class      = network
    subclass   = ethernet
    bar   [10] = type Memory, range 32, base 0xc7100000, size 131072, enabled
    bar   [18] = type I/O Port, range 32, base 0x5000, size 32, enabled
    bar   [1c] = type Memory, range 32, base 0xc7120000, size 16384, enabled
    cap 01[40] = powerspec 3  supports D0 D3  current D0
    cap 05[50] = MSI supports 1 message, 64 bit, vector masks 
    cap 11[70] = MSI-X supports 5 messages, enabled
                 Table in map 0x1c[0x0], PBA in map 0x1c[0x2000]
    cap 10[a0] = PCI-Express 2 endpoint max data 128(512) FLR NS
                 max read 512
                 link x1(x1) speed 2.5(2.5) ASPM disabled(L0s/L1)
    ecap 0001[100] = AER 2 0 fatal 0 non-fatal 0 corrected
    ecap 0003[140] = Serial 1 001c7fffff44014b
    ecap 0017[1a0] = TPH Requester 1

pcib12@pci0:9:0:0:	class=0x060400 rev=0x02 hdr=0x01 vendor=0x1a03 device=0x1150 subvendor=0x1a03 subdevice=0x1150
    vendor     = 'ASPEED Technology, Inc.'
    device     = 'AST1150 PCI-to-PCI Bridge'
    class      = bridge
    subclass   = PCI-PCI
    cap 05[50] = MSI supports 1 message, 64 bit 
    cap 01[78] = powerspec 3  supports D0 D1 D2 D3  current D0
    cap 10[80] = PCI-Express 1 PCI bridge max data 128(128) NS
                 max read 512
                 link x1(x1) speed 2.5(2.5) ASPM disabled(L0s/L1)
    cap 0d[a4] = PCI Bridge subvendor=0x1a03 subdevice=0x1150
    ecap 0002[100] = VC 1 max VC0

vgapci0@pci0:10:0:0:	class=0x030000 rev=0x21 hdr=0x00 vendor=0x1a03 device=0x2000 subvendor=0x1a03 subdevice=0x2000
    vendor     = 'ASPEED Technology, Inc.'
    device     = 'ASPEED Graphics Family'
    class      = display
    subclass   = VGA
    bar   [10] = type Memory, range 32, base 0xc6000000, size 16777216, enabled
    bar   [14] = type Memory, range 32, base 0xc7020000, size 131072, enabled
    bar   [18] = type I/O Port, range 32, base 0x4000, size 128, enabled
    cap 01[40] = powerspec 3  supports D0 D1 D2 D3  current D0

pcib14@pci0:128:0:0:	class=0x060400 rev=0x02 hdr=0x01 vendor=0x8086 device=0x2f01 subvendor=0x8086 subdevice=0x0000
    vendor     = 'Intel Corporation'
    device     = 'Xeon E7 v3/Xeon E5 v3/Core i7 PCI Express Root Port 0'
    class      = bridge
    subclass   = PCI-PCI
    cap 0d[40] = PCI Bridge subvendor=0x8086 subdevice=0x0000
    cap 05[60] = MSI supports 2 messages, vector masks 
    cap 10[90] = PCI-Express 2 root port max data 128(128) ARI disabled
                 max read 128
                 link x0(x4) speed 0.0(5.0)
    cap 01[e0] = powerspec 3  supports D0 D3  current D0
    ecap 000b[100] = Vendor [1] ID 0002 Rev 0 Length 12
    ecap 000d[110] = ACS 1
    ecap 0001[148] = AER 1 0 fatal 0 non-fatal 0 corrected
    ecap 000b[1d0] = Vendor [1] ID 0003 Rev 1 Length 10
    ecap 000b[280] = Vendor [1] ID 0005 Rev 3 Length 24
    ecap 000b[300] = Vendor [1] ID 0008 Rev 0 Length 56

pcib15@pci0:128:1:0:	class=0x060400 rev=0x02 hdr=0x01 vendor=0x8086 device=0x2f02 subvendor=0x8086 subdevice=0x0000
    vendor     = 'Intel Corporation'
    device     = 'Xeon E7 v3/Xeon E5 v3/Core i7 PCI Express Root Port 1'
    class      = bridge
    subclass   = PCI-PCI
    cap 0d[40] = PCI Bridge subvendor=0x8086 subdevice=0x0000
    cap 05[60] = MSI supports 2 messages, vector masks 
    cap 10[90] = PCI-Express 2 root port max data 128(256) ARI disabled
                 max read 128
                 link x0(x8) speed 0.0(8.0)
                 slot 3 power limit 0 mW
    cap 01[e0] = powerspec 3  supports D0 D3  current D0
    ecap 000b[100] = Vendor [1] ID 0002 Rev 0 Length 12
    ecap 000d[110] = ACS 1
    ecap 0001[148] = AER 1 0 fatal 0 non-fatal 0 corrected
    ecap 000b[1d0] = Vendor [1] ID 0003 Rev 1 Length 10
    ecap 0019[250] = PCIe Sec 1 lane errors 0
    ecap 000b[280] = Vendor [1] ID 0005 Rev 3 Length 24
    ecap 000b[300] = Vendor [1] ID 0008 Rev 0 Length 56

pcib16@pci0:128:2:0:	class=0x060400 rev=0x02 hdr=0x01 vendor=0x8086 device=0x2f04 subvendor=0x8086 subdevice=0x0000
    vendor     = 'Intel Corporation'
    device     = 'Xeon E7 v3/Xeon E5 v3/Core i7 PCI Express Root Port 2'
    class      = bridge
    subclass   = PCI-PCI
    cap 0d[40] = PCI Bridge subvendor=0x8086 subdevice=0x0000
    cap 05[60] = MSI supports 2 messages, vector masks 
    cap 10[90] = PCI-Express 2 root port max data 128(256) ARI disabled
                 max read 128
                 link x0(x16) speed 0.0(8.0)
                 slot 4 power limit 0 mW
    cap 01[e0] = powerspec 3  supports D0 D3  current D0
    ecap 000b[100] = Vendor [1] ID 0002 Rev 0 Length 12
    ecap 000d[110] = ACS 1
    ecap 0001[148] = AER 1 0 fatal 0 non-fatal 0 corrected
    ecap 000b[1d0] = Vendor [1] ID 0003 Rev 1 Length 10
    ecap 0019[250] = PCIe Sec 1 lane errors 0
    ecap 000b[280] = Vendor [1] ID 0005 Rev 3 Length 24
    ecap 000b[300] = Vendor [1] ID 0008 Rev 0 Length 56

pcib17@pci0:128:3:0:	class=0x060400 rev=0x02 hdr=0x01 vendor=0x8086 device=0x2f08 subvendor=0x8086 subdevice=0x0000
    vendor     = 'Intel Corporation'
    device     = 'Xeon E7 v3/Xeon E5 v3/Core i7 PCI Express Root Port 3'
    class      = bridge
    subclass   = PCI-PCI
    cap 0d[40] = PCI Bridge subvendor=0x8086 subdevice=0x0000
    cap 05[60] = MSI supports 2 messages, vector masks 
    cap 10[90] = PCI-Express 2 root port max data 128(256) ARI disabled
                 max read 128
                 link x0(x8) speed 0.0(8.0)
                 slot 14 power limit 0 mW
    cap 01[e0] = powerspec 3  supports D0 D3  current D0
    ecap 000b[100] = Vendor [1] ID 0002 Rev 0 Length 12
    ecap 000d[110] = ACS 1
    ecap 0001[148] = AER 1 0 fatal 0 non-fatal 0 corrected
    ecap 000b[1d0] = Vendor [1] ID 0003 Rev 1 Length 10
    ecap 0019[250] = PCIe Sec 1 lane errors 0
    ecap 000b[280] = Vendor [1] ID 0005 Rev 3 Length 24
    ecap 000b[300] = Vendor [1] ID 0008 Rev 0 Length 56

pcib18@pci0:128:3:2:	class=0x060400 rev=0x02 hdr=0x01 vendor=0x8086 device=0x2f0a subvendor=0x8086 subdevice=0x0000
    vendor     = 'Intel Corporation'
    device     = 'Xeon E7 v3/Xeon E5 v3/Core i7 PCI Express Root Port 3'
    class      = bridge
    subclass   = PCI-PCI
    cap 0d[40] = PCI Bridge subvendor=0x8086 subdevice=0x0000
    cap 05[60] = MSI supports 2 messages, vector masks 
    cap 10[90] = PCI-Express 2 root port max data 256(256) ARI disabled
                 max read 128
                 link x8(x8) speed 5.0(8.0)
                 slot 6 power limit 0 mW
    cap 01[e0] = powerspec 3  supports D0 D3  current D0
    ecap 000b[100] = Vendor [1] ID 0002 Rev 0 Length 12
    ecap 000d[110] = ACS 1
    ecap 0001[148] = AER 1 0 fatal 0 non-fatal 0 corrected
    ecap 000b[1d0] = Vendor [1] ID 0003 Rev 1 Length 10
    ecap 0019[250] = PCIe Sec 1 lane errors 0
    ecap 000b[280] = Vendor [1] ID 0005 Rev 3 Length 24
    ecap 000b[300] = Vendor [1] ID 0008 Rev 0 Length 56

none122@pci0:128:5:0:	class=0x088000 rev=0x02 hdr=0x00 vendor=0x8086 device=0x2f28 subvendor=0x0000 subdevice=0x0000
    vendor     = 'Intel Corporation'
    device     = 'Xeon E7 v3/Xeon E5 v3/Core i7 Address Map, VTd_Misc, System Management'
    class      = base peripheral
    cap 10[40] = PCI-Express 2 root endpoint max data 128(128)
                 max read 128

none123@pci0:128:5:1:	class=0x088000 rev=0x02 hdr=0x00 vendor=0x8086 device=0x2f29 subvendor=0x0000 subdevice=0x0000
    vendor     = 'Intel Corporation'
    device     = 'Xeon E7 v3/Xeon E5 v3/Core i7 Hot Plug'
    class      = base peripheral
    cap 10[40] = PCI-Express 1 root endpoint max data 128(128)
                 max read 128
    cap 05[80] = MSI supports 1 message, 64 bit 
    ecap 000b[100] = Vendor [1] ID 0006 Rev 1 Length 16
    ecap 000b[110] = Vendor [1] ID 0006 Rev 1 Length 16
    ecap 000b[120] = Vendor [1] ID 0006 Rev 1 Length 16
    ecap 000b[130] = Vendor [1] ID 0006 Rev 1 Length 16

none124@pci0:128:5:2:	class=0x088000 rev=0x02 hdr=0x00 vendor=0x8086 device=0x2f2a subvendor=0x0000 subdevice=0x0000
    vendor     = 'Intel Corporation'
    device     = 'Xeon E7 v3/Xeon E5 v3/Core i7 RAS, Control Status and Global Errors'
    class      = base peripheral
    cap 10[40] = PCI-Express 2 root endpoint max data 128(128) RO NS
                 max read 128

ioapic1@pci0:128:5:4:	class=0x080020 rev=0x02 hdr=0x00 vendor=0x8086 device=0x2f2c subvendor=0x8086 subdevice=0x0000
    vendor     = 'Intel Corporation'
    device     = 'Xeon E7 v3/Xeon E5 v3/Core i7 I/O APIC'
    class      = base peripheral
    subclass   = interrupt controller
    bar   [10] = type Memory, range 32, base 0xfbf00000, size 4096, enabled
    cap 10[44] = PCI-Express 1 root endpoint max data 128(128)
                 max read 128
    cap 01[e0] = powerspec 3  supports D0 D3  current D0

pcib19@pci0:133:0:0:	class=0x060400 rev=0xba hdr=0x01 vendor=0x10b5 device=0x8617 subvendor=0x10b5 subdevice=0x8617
    vendor     = 'PLX Technology, Inc.'
    device     = 'PEX 8617 16-lane, 4-Port PCI Express Gen 2 (5.0 GT/s) Switch with P2P'
    class      = bridge
    subclass   = PCI-PCI
    bar   [10] = type Memory, range 32, base 0xfbe00000, size 131072, enabled
    cap 01[40] = powerspec 3  supports D0 D3  current D0
    cap 05[48] = MSI supports 4 messages, 64 bit, vector masks 
    cap 10[68] = PCI-Express 2 upstream port max data 256(2048)
                 max read 128
                 link x8(x8) speed 5.0(5.0) ASPM disabled(L0s/L1)
    cap 0d[a4] = PCI Bridge subvendor=0x10b5 subdevice=0x8617
    ecap 0003[100] = Serial 1 ba860110b5df0e00
    ecap 0001[fb4] = AER 1 0 fatal 0 non-fatal 1 corrected
    ecap 0004[138] = Power Budgeting 1
    ecap 0002[148] = VC 1 max VC1 lowpri VC0-VC1
    ecap 000b[448] = Vendor [1] ID 0000 Rev 0 Length 204
    ecap 000b[950] = Vendor [1] ID 0001 Rev 0 Length 16

pcib20@pci0:134:1:0:	class=0x060400 rev=0xba hdr=0x01 vendor=0x10b5 device=0x8617 subvendor=0x10b5 subdevice=0x8617
    vendor     = 'PLX Technology, Inc.'
    device     = 'PEX 8617 16-lane, 4-Port PCI Express Gen 2 (5.0 GT/s) Switch with P2P'
    class      = bridge
    subclass   = PCI-PCI
    cap 01[40] = powerspec 3  supports D0 D3  current D0
    cap 05[48] = MSI supports 4 messages, 64 bit, vector masks 
    cap 10[68] = PCI-Express 2 downstream port max data 256(2048) ARI enabled
                 max read 128
                 link x4(x4) speed 5.0(5.0) ASPM disabled(L0s/L1)
                 slot 113 power limit 25000 mW
    cap 0d[a4] = PCI Bridge subvendor=0x10b5 subdevice=0x8617
    ecap 0003[100] = Serial 1 ba860110b5df0e00
    ecap 0001[fb4] = AER 1 0 fatal 0 non-fatal 1 corrected
    ecap 0002[148] = VC 1 max VC1 lowpri VC0-VC1
    ecap 000d[520] = ACS 1
    ecap 000b[950] = Vendor [1] ID 0001 Rev 0 Length 16

pcib21@pci0:134:3:0:	class=0x060400 rev=0xba hdr=0x01 vendor=0x10b5 device=0x8617 subvendor=0x10b5 subdevice=0x8617
    vendor     = 'PLX Technology, Inc.'
    device     = 'PEX 8617 16-lane, 4-Port PCI Express Gen 2 (5.0 GT/s) Switch with P2P'
    class      = bridge
    subclass   = PCI-PCI
    cap 01[40] = powerspec 3  supports D0 D3  current D0
    cap 05[48] = MSI supports 4 messages, 64 bit, vector masks 
    cap 10[68] = PCI-Express 2 downstream port max data 256(2048) ARI enabled
                 max read 128
                 link x4(x4) speed 5.0(5.0) ASPM disabled(L0s/L1)
                 slot 115 power limit 25000 mW
    cap 0d[a4] = PCI Bridge subvendor=0x10b5 subdevice=0x8617
    ecap 0003[100] = Serial 1 ba860110b5df0e00
    ecap 0001[fb4] = AER 1 0 fatal 0 non-fatal 1 corrected
    ecap 0002[148] = VC 1 max VC1 lowpri VC0-VC1
    ecap 000d[520] = ACS 1
    ecap 000b[950] = Vendor [1] ID 0001 Rev 0 Length 16

igb2@pci0:135:0:0:	class=0x020000 rev=0x01 hdr=0x00 vendor=0x8086 device=0x1521 subvendor=0x1374 subdevice=0x04a2
    vendor     = 'Intel Corporation'
    device     = 'I350 Gigabit Network Connection'
    class      = network
    subclass   = ethernet
    bar   [10] = type Memory, range 32, base 0xfbd60000, size 131072, enabled
    bar   [1c] = type Memory, range 32, base 0xfbd8c000, size 16384, enabled
    cap 01[40] = powerspec 3  supports D0 D3  current D0
    cap 05[50] = MSI supports 1 message, 64 bit, vector masks 
    cap 11[70] = MSI-X supports 10 messages, enabled
                 Table in map 0x1c[0x0], PBA in map 0x1c[0x2000]
    cap 10[a0] = PCI-Express 2 endpoint max data 256(512) FLR NS
                 max read 512
                 link x4(x4) speed 5.0(5.0) ASPM disabled(L0s/L1)
    cap 03[e0] = VPD
    ecap 0001[100] = AER 2 0 fatal 0 non-fatal 1 corrected
    ecap 0003[140] = Serial 1 001c7fffff657f88
    ecap 000e[150] = ARI 1
    ecap 0010[160] = SR-IOV 1 IOV disabled, Memory Space disabled, ARI disabled
                     0 VFs configured out of 8 supported
                     First VF RID Offset 0x0180, VF RID Stride 0x0004
                     VF Device ID 0x1520
                     Page Sizes: 4096 (enabled), 8192, 65536, 262144, 1048576, 4194304
    ecap 0017[1a0] = TPH Requester 1
    ecap 0018[1c0] = LTR 1
    ecap 000d[1d0] = ACS 1

igb3@pci0:135:0:1:	class=0x020000 rev=0x01 hdr=0x00 vendor=0x8086 device=0x1521 subvendor=0x1374 subdevice=0x04a2
    vendor     = 'Intel Corporation'
    device     = 'I350 Gigabit Network Connection'
    class      = network
    subclass   = ethernet
    bar   [10] = type Memory, range 32, base 0xfbd40000, size 131072, enabled
    bar   [1c] = type Memory, range 32, base 0xfbd88000, size 16384, enabled
    cap 01[40] = powerspec 3  supports D0 D3  current D0
    cap 05[50] = MSI supports 1 message, 64 bit, vector masks 
    cap 11[70] = MSI-X supports 10 messages, enabled
                 Table in map 0x1c[0x0], PBA in map 0x1c[0x2000]
    cap 10[a0] = PCI-Express 2 endpoint max data 256(512) FLR NS
                 max read 512
                 link x4(x4) speed 5.0(5.0) ASPM disabled(L0s/L1)
    cap 03[e0] = VPD
    ecap 0001[100] = AER 2 0 fatal 0 non-fatal 1 corrected
    ecap 0003[140] = Serial 1 001c7fffff657f88
    ecap 000e[150] = ARI 1
    ecap 0010[160] = SR-IOV 1 IOV disabled, Memory Space disabled, ARI disabled
                     0 VFs configured out of 8 supported
                     First VF RID Offset 0x0180, VF RID Stride 0x0004
                     VF Device ID 0x1520
                     Page Sizes: 4096 (enabled), 8192, 65536, 262144, 1048576, 4194304
    ecap 0017[1a0] = TPH Requester 1
    ecap 000d[1d0] = ACS 1

igb4@pci0:135:0:2:	class=0x020000 rev=0x01 hdr=0x00 vendor=0x8086 device=0x1521 subvendor=0x1374 subdevice=0x04a2
    vendor     = 'Intel Corporation'
    device     = 'I350 Gigabit Network Connection'
    class      = network
    subclass   = ethernet
    bar   [10] = type Memory, range 32, base 0xfbd20000, size 131072, enabled
    bar   [1c] = type Memory, range 32, base 0xfbd84000, size 16384, enabled
    cap 01[40] = powerspec 3  supports D0 D3  current D0
    cap 05[50] = MSI supports 1 message, 64 bit, vector masks 
    cap 11[70] = MSI-X supports 10 messages, enabled
                 Table in map 0x1c[0x0], PBA in map 0x1c[0x2000]
    cap 10[a0] = PCI-Express 2 endpoint max data 256(512) FLR NS
                 max read 512
                 link x4(x4) speed 5.0(5.0) ASPM disabled(L0s/L1)
    cap 03[e0] = VPD
    ecap 0001[100] = AER 2 0 fatal 0 non-fatal 1 corrected
    ecap 0003[140] = Serial 1 001c7fffff657f88
    ecap 000e[150] = ARI 1
    ecap 0010[160] = SR-IOV 1 IOV disabled, Memory Space disabled, ARI disabled
                     0 VFs configured out of 8 supported
                     First VF RID Offset 0x0180, VF RID Stride 0x0004
                     VF Device ID 0x1520
                     Page Sizes: 4096 (enabled), 8192, 65536, 262144, 1048576, 4194304
    ecap 0017[1a0] = TPH Requester 1
    ecap 000d[1d0] = ACS 1

igb5@pci0:135:0:3:	class=0x020000 rev=0x01 hdr=0x00 vendor=0x8086 device=0x1521 subvendor=0x1374 subdevice=0x04a2
    vendor     = 'Intel Corporation'
    device     = 'I350 Gigabit Network Connection'
    class      = network
    subclass   = ethernet
    bar   [10] = type Memory, range 32, base 0xfbd00000, size 131072, enabled
    bar   [1c] = type Memory, range 32, base 0xfbd80000, size 16384, enabled
    cap 01[40] = powerspec 3  supports D0 D3  current D0
    cap 05[50] = MSI supports 1 message, 64 bit, vector masks 
    cap 11[70] = MSI-X supports 10 messages, enabled
                 Table in map 0x1c[0x0], PBA in map 0x1c[0x2000]
    cap 10[a0] = PCI-Express 2 endpoint max data 256(512) FLR NS
                 max read 512
                 link x4(x4) speed 5.0(5.0) ASPM disabled(L0s/L1)
    cap 03[e0] = VPD
    ecap 0001[100] = AER 2 0 fatal 0 non-fatal 1 corrected
    ecap 0003[140] = Serial 1 001c7fffff657f88
    ecap 000e[150] = ARI 1
    ecap 0010[160] = SR-IOV 1 IOV disabled, Memory Space disabled, ARI disabled
                     0 VFs configured out of 8 supported
                     First VF RID Offset 0x0180, VF RID Stride 0x0004
                     VF Device ID 0x1520
                     Page Sizes: 4096 (enabled), 8192, 65536, 262144, 1048576, 4194304
    ecap 0017[1a0] = TPH Requester 1
    ecap 000d[1d0] = ACS 1

igb6@pci0:136:0:0:	class=0x020000 rev=0x01 hdr=0x00 vendor=0x8086 device=0x1521 subvendor=0x1374 subdevice=0x04a2
    vendor     = 'Intel Corporation'
    device     = 'I350 Gigabit Network Connection'
    class      = network
    subclass   = ethernet
    bar   [10] = type Memory, range 32, base 0xfbc60000, size 131072, enabled
    bar   [1c] = type Memory, range 32, base 0xfbc8c000, size 16384, enabled
    cap 01[40] = powerspec 3  supports D0 D3  current D0
    cap 05[50] = MSI supports 1 message, 64 bit, vector masks 
    cap 11[70] = MSI-X supports 10 messages, enabled
                 Table in map 0x1c[0x0], PBA in map 0x1c[0x2000]
    cap 10[a0] = PCI-Express 2 endpoint max data 256(512) FLR NS
                 max read 512
                 link x4(x4) speed 5.0(5.0) ASPM disabled(L0s/L1)
    cap 03[e0] = VPD
    ecap 0001[100] = AER 2 0 fatal 0 non-fatal 1 corrected
    ecap 0003[140] = Serial 1 001c7fffff657f8c
    ecap 000e[150] = ARI 1
    ecap 0010[160] = SR-IOV 1 IOV disabled, Memory Space disabled, ARI disabled
                     0 VFs configured out of 8 supported
                     First VF RID Offset 0x0180, VF RID Stride 0x0004
                     VF Device ID 0x1520
                     Page Sizes: 4096 (enabled), 8192, 65536, 262144, 1048576, 4194304
    ecap 0017[1a0] = TPH Requester 1
    ecap 0018[1c0] = LTR 1
    ecap 000d[1d0] = ACS 1

igb7@pci0:136:0:1:	class=0x020000 rev=0x01 hdr=0x00 vendor=0x8086 device=0x1521 subvendor=0x1374 subdevice=0x04a2
    vendor     = 'Intel Corporation'
    device     = 'I350 Gigabit Network Connection'
    class      = network
    subclass   = ethernet
    bar   [10] = type Memory, range 32, base 0xfbc40000, size 131072, enabled
    bar   [1c] = type Memory, range 32, base 0xfbc88000, size 16384, enabled
    cap 01[40] = powerspec 3  supports D0 D3  current D0
    cap 05[50] = MSI supports 1 message, 64 bit, vector masks 
    cap 11[70] = MSI-X supports 10 messages, enabled
                 Table in map 0x1c[0x0], PBA in map 0x1c[0x2000]
    cap 10[a0] = PCI-Express 2 endpoint max data 256(512) FLR NS
                 max read 512
                 link x4(x4) speed 5.0(5.0) ASPM disabled(L0s/L1)
    cap 03[e0] = VPD
    ecap 0001[100] = AER 2 0 fatal 0 non-fatal 1 corrected
    ecap 0003[140] = Serial 1 001c7fffff657f8c
    ecap 000e[150] = ARI 1
    ecap 0010[160] = SR-IOV 1 IOV disabled, Memory Space disabled, ARI disabled
                     0 VFs configured out of 8 supported
                     First VF RID Offset 0x0180, VF RID Stride 0x0004
                     VF Device ID 0x1520
                     Page Sizes: 4096 (enabled), 8192, 65536, 262144, 1048576, 4194304
    ecap 0017[1a0] = TPH Requester 1
    ecap 000d[1d0] = ACS 1

igb8@pci0:136:0:2:	class=0x020000 rev=0x01 hdr=0x00 vendor=0x8086 device=0x1521 subvendor=0x1374 subdevice=0x04a2
    vendor     = 'Intel Corporation'
    device     = 'I350 Gigabit Network Connection'
    class      = network
    subclass   = ethernet
    bar   [10] = type Memory, range 32, base 0xfbc20000, size 131072, enabled
    bar   [1c] = type Memory, range 32, base 0xfbc84000, size 16384, enabled
    cap 01[40] = powerspec 3  supports D0 D3  current D0
    cap 05[50] = MSI supports 1 message, 64 bit, vector masks 
    cap 11[70] = MSI-X supports 10 messages, enabled
                 Table in map 0x1c[0x0], PBA in map 0x1c[0x2000]
    cap 10[a0] = PCI-Express 2 endpoint max data 256(512) FLR NS
                 max read 512
                 link x4(x4) speed 5.0(5.0) ASPM disabled(L0s/L1)
    cap 03[e0] = VPD
    ecap 0001[100] = AER 2 0 fatal 0 non-fatal 1 corrected
    ecap 0003[140] = Serial 1 001c7fffff657f8c
    ecap 000e[150] = ARI 1
    ecap 0010[160] = SR-IOV 1 IOV disabled, Memory Space disabled, ARI disabled
                     0 VFs configured out of 8 supported
                     First VF RID Offset 0x0180, VF RID Stride 0x0004
                     VF Device ID 0x1520
                     Page Sizes: 4096 (enabled), 8192, 65536, 262144, 1048576, 4194304
    ecap 0017[1a0] = TPH Requester 1
    ecap 000d[1d0] = ACS 1

igb9@pci0:136:0:3:	class=0x020000 rev=0x01 hdr=0x00 vendor=0x8086 device=0x1521 subvendor=0x1374 subdevice=0x04a2
    vendor     = 'Intel Corporation'
    device     = 'I350 Gigabit Network Connection'
    class      = network
    subclass   = ethernet
    bar   [10] = type Memory, range 32, base 0xfbc00000, size 131072, enabled
    bar   [1c] = type Memory, range 32, base 0xfbc80000, size 16384, enabled
    cap 01[40] = powerspec 3  supports D0 D3  current D0
    cap 05[50] = MSI supports 1 message, 64 bit, vector masks 
    cap 11[70] = MSI-X supports 10 messages, enabled
                 Table in map 0x1c[0x0], PBA in map 0x1c[0x2000]
    cap 10[a0] = PCI-Express 2 endpoint max data 256(512) FLR NS
                 max read 512
                 link x4(x4) speed 5.0(5.0) ASPM disabled(L0s/L1)
    cap 03[e0] = VPD
    ecap 0001[100] = AER 2 0 fatal 0 non-fatal 1 corrected
    ecap 0003[140] = Serial 1 001c7fffff657f8c
    ecap 000e[150] = ARI 1
    ecap 0010[160] = SR-IOV 1 IOV disabled, Memory Space disabled, ARI disabled
                     0 VFs configured out of 8 supported
                     First VF RID Offset 0x0180, VF RID Stride 0x0004
                     VF Device ID 0x1520
                     Page Sizes: 4096 (enabled), 8192, 65536, 262144, 1048576, 4194304
    ecap 0017[1a0] = TPH Requester 1
    ecap 000d[1d0] = ACS 1
