hostb0@pci0:0:0:0:	class=0x060000 card=0x85341043 chip=0x0f008086 rev=0x0e hdr=0x00
    vendor     = 'Intel Corporation'
    device     = 'Atom Processor Z36xxx/Z37xxx Series SoC Transaction Register'
    class      = bridge
    subclass   = HOST-PCI

vgapci0@pci0:0:2:0:	class=0x030000 card=0x85341043 chip=0x0f318086 rev=0x0e hdr=0x00
    vendor     = 'Intel Corporation'
    device     = 'Atom Processor Z36xxx/Z37xxx Series Graphics & Display'
    class      = display
    subclass   = VGA
    bar   [10] = type Memory, range 32, base 0x90000000, size 4194304, enabled
    bar   [18] = type Prefetchable Memory, range 32, base 0x80000000, size 268435456, enabled
    bar   [20] = type I/O Port, range 32, base 0xf080, size 8, enabled
    cap 01[d0] = powerspec 2  supports D0 D3  current D0
    cap 05[90] = MSI supports 1 message 
    cap 09[b0] = vendor (length 7) Intel cap 0 version 1

ahci0@pci0:0:19:0:	class=0x010601 card=0x85341043 chip=0x0f238086 rev=0x0e hdr=0x00
    vendor     = 'Intel Corporation'
    device     = 'Atom Processor E3800 Series SATA AHCI Controller'
    class      = mass storage
    subclass   = SATA
    bar   [10] = type I/O Port, range 32, base 0xf070, size 8, enabled
    bar   [14] = type I/O Port, range 32, base 0xf060, size 4, enabled
    bar   [18] = type I/O Port, range 32, base 0xf050, size 8, enabled
    bar   [1c] = type I/O Port, range 32, base 0xf040, size 4, enabled
    bar   [20] = type I/O Port, range 32, base 0xf020, size 32, enabled
    bar   [24] = type Memory, range 32, base 0x90912000, size 2048, enabled
    cap 05[80] = MSI supports 1 message enabled with 1 message
    cap 01[70] = powerspec 3  supports D0 D3  current D0
    cap 12[a8] = SATA Index-Data Pair

xhci0@pci0:0:20:0:	class=0x0c0330 card=0x85341043 chip=0x0f358086 rev=0x0e hdr=0x00
    vendor     = 'Intel Corporation'
    device     = 'Atom Processor Z36xxx/Z37xxx, Celeron N2000 Series USB xHCI'
    class      = serial bus
    subclass   = USB
    bar   [10] = type Memory, range 64, base 0x90900000, size 65536, enabled
    cap 01[70] = powerspec 2  supports D0 D3  current D0
    cap 05[80] = MSI supports 8 messages, 64 bit enabled with 1 message

none0@pci0:0:26:0:	class=0x108000 card=0x85341043 chip=0x0f188086 rev=0x0e hdr=0x00
    vendor     = 'Intel Corporation'
    device     = 'Atom Processor Z36xxx/Z37xxx Series Trusted Execution Engine'
    class      = encrypt/decrypt
    bar   [10] = type Memory, range 32, base 0x90500000, size 1048576, enabled
    bar   [14] = type Memory, range 32, base 0x90400000, size 1048576, enabled
    cap 01[80] = powerspec 3  supports D0 D3  current D0
    cap 05[a0] = MSI supports 1 message 

pcib1@pci0:0:28:0:	class=0x060400 card=0x85341043 chip=0x0f488086 rev=0x0e hdr=0x01
    vendor     = 'Intel Corporation'
    device     = 'Atom Processor E3800 Series PCI Express Root Port 1'
    class      = bridge
    subclass   = PCI-PCI
    cap 10[40] = PCI-Express 2 root port max data 128(128)
                 link x0(x1) speed 0.0(5.0) ASPM disabled(L0s/L1)
                 slot 0 power limit 100 mW HotPlug(empty) surprise
    cap 05[80] = MSI supports 1 message 
    cap 0d[90] = PCI Bridge card=0x85341043
    cap 01[a0] = powerspec 3  supports D0 D3  current D0

pcib2@pci0:0:28:1:	class=0x060400 card=0x85341043 chip=0x0f4a8086 rev=0x0e hdr=0x01
    vendor     = 'Intel Corporation'
    device     = 'Atom Processor E3800 Series PCI Express Root Port 2'
    class      = bridge
    subclass   = PCI-PCI
    cap 10[40] = PCI-Express 2 root port max data 128(128)
                 link x1(x1) speed 2.5(5.0) ASPM disabled(L0s/L1)
                 slot 1 power limit 100 mW HotPlug(present) surprise
    cap 05[80] = MSI supports 1 message 
    cap 0d[90] = PCI Bridge card=0x85341043
    cap 01[a0] = powerspec 3  supports D0 D3  current D0

pcib3@pci0:0:28:2:	class=0x060400 card=0x85341043 chip=0x0f4c8086 rev=0x0e hdr=0x01
    vendor     = 'Intel Corporation'
    device     = 'Atom Processor E3800 Series PCI Express Root Port 3'
    class      = bridge
    subclass   = PCI-PCI
    cap 10[40] = PCI-Express 2 root port max data 128(128)
                 link x1(x1) speed 5.0(5.0) ASPM disabled(L0s/L1)
                 slot 2 power limit 100 mW HotPlug(present) surprise
    cap 05[80] = MSI supports 1 message 
    cap 0d[90] = PCI Bridge card=0x85341043
    cap 01[a0] = powerspec 3  supports D0 D3  current D0

pcib7@pci0:0:28:3:	class=0x060400 card=0x85341043 chip=0x0f4e8086 rev=0x0e hdr=0x01
    vendor     = 'Intel Corporation'
    device     = 'Atom Processor E3800 Series PCI Express Root Port 4'
    class      = bridge
    subclass   = PCI-PCI
    cap 10[40] = PCI-Express 2 root port max data 128(128)
                 link x0(x1) speed 0.0(5.0) ASPM disabled(L0s/L1)
                 slot 3 power limit 100 mW HotPlug(empty) surprise
    cap 05[80] = MSI supports 1 message 
    cap 0d[90] = PCI Bridge card=0x85341043
    cap 01[a0] = powerspec 3  supports D0 D3  current D0

isab0@pci0:0:31:0:	class=0x060100 card=0x85341043 chip=0x0f1c8086 rev=0x0e hdr=0x00
    vendor     = 'Intel Corporation'
    device     = 'Atom Processor Z36xxx/Z37xxx Series Power Control Unit'
    class      = bridge
    subclass   = PCI-ISA
    cap 09[e0] = vendor (length 12) Intel cap 1 version 0
		 features: 4 PCI-e x1 slots

none1@pci0:0:31:3:	class=0x0c0500 card=0x85341043 chip=0x0f128086 rev=0x0e hdr=0x00
    vendor     = 'Intel Corporation'
    device     = 'Atom Processor E3800 Series SMBus Controller'
    class      = serial bus
    subclass   = SMBus
    bar   [10] = type Memory, range 32, base 0x90910000, size 32, enabled
    bar   [20] = type I/O Port, range 32, base 0xf000, size 32, enabled
    cap 01[50] = powerspec 3  supports D0 D3  current D0

re0@pci0:2:0:0:	class=0x020000 card=0x85541043 chip=0x816810ec rev=0x0c hdr=0x00
    vendor     = 'Realtek Semiconductor Co., Ltd.'
    device     = 'RTL8111/8168/8411 PCI Express Gigabit Ethernet Controller'
    class      = network
    subclass   = ethernet
    bar   [10] = type I/O Port, range 32, base 0xe000, size 256, enabled
    bar   [18] = type Memory, range 64, base 0x90804000, size 4096, enabled
    bar   [20] = type Prefetchable Memory, range 64, base 0x90800000, size 16384, enabled
    cap 01[40] = powerspec 3  supports D0 D1 D2 D3  current D0
    cap 05[50] = MSI supports 1 message, 64 bit 
    cap 10[70] = PCI-Express 2 endpoint MSI 1 max data 128(128)
                 link x1(x1) speed 2.5(2.5) ASPM disabled(L0s/L1)
    cap 11[b0] = MSI-X supports 4 messages, enabled
                 Table in map 0x20[0x0], PBA in map 0x20[0x800]
    cap 03[d0] = VPD
    ecap 0001[100] = AER 1 0 fatal 0 non-fatal 0 corrected
    ecap 0002[140] = VC 1 max VC0
    ecap 0003[160] = Serial 1 01000000684ce000
    ecap 0018[170] = LTR 1

pcib4@pci0:3:0:0:	class=0x060400 card=0x118f1b21 chip=0x11821b21 rev=0x00 hdr=0x01
    vendor     = 'ASMedia Technology Inc.'
    class      = bridge
    subclass   = PCI-PCI
    cap 05[50] = MSI supports 1 message, 64 bit 
    cap 01[78] = powerspec 3  supports D0 D3  current D0
    cap 10[80] = PCI-Express 2 upstream port max data 128(256) NS
                 link x1(x1) speed 5.0(5.0) ASPM disabled(L0s/L1)
    cap 0d[c0] = PCI Bridge card=0x118f1b21
    ecap 0002[100] = VC 1 max VC0
    ecap 0001[200] = AER 1 0 fatal 0 non-fatal 0 corrected
    ecap 000b[300] = Vendor 1 ID 0

pcib5@pci0:4:3:0:	class=0x060400 card=0x118f1b21 chip=0x11821b21 rev=0x00 hdr=0x01
    vendor     = 'ASMedia Technology Inc.'
    class      = bridge
    subclass   = PCI-PCI
    cap 05[50] = MSI supports 1 message, 64 bit 
    cap 01[78] = powerspec 3  supports D0 D3  current D0
    cap 10[80] = PCI-Express 2 downstream port max data 128(256) NS
                 link x1(x1) speed 2.5(5.0) ASPM disabled(L0s/L1)
                 slot 3 power limit 26000 mW
    cap 0d[c0] = PCI Bridge card=0x118f1b21
    ecap 0002[100] = VC 1 max VC0
    ecap 0001[200] = AER 1 0 fatal 0 non-fatal 0 corrected

pcib6@pci0:4:7:0:	class=0x060400 card=0x118f1b21 chip=0x11821b21 rev=0x00 hdr=0x01
    vendor     = 'ASMedia Technology Inc.'
    class      = bridge
    subclass   = PCI-PCI
    cap 05[50] = MSI supports 1 message, 64 bit 
    cap 01[78] = powerspec 3  supports D0 D3  current D0
    cap 10[80] = PCI-Express 2 downstream port max data 128(256) NS
                 link x1(x1) speed 2.5(5.0) ASPM disabled(L0s/L1)
                 slot 7 power limit 26000 mW
    cap 0d[c0] = PCI Bridge card=0x118f1b21
    ecap 0002[100] = VC 1 max VC0
    ecap 0001[200] = AER 1 0 fatal 0 non-fatal 0 corrected

re1@pci0:5:0:0:	class=0x020000 card=0x012310ec chip=0x816810ec rev=0x07 hdr=0x00
    vendor     = 'Realtek Semiconductor Co., Ltd.'
    device     = 'RTL8111/8168/8411 PCI Express Gigabit Ethernet Controller'
    class      = network
    subclass   = ethernet
    bar   [10] = type I/O Port, range 32, base 0xd000, size 256, enabled
    bar   [18] = type Memory, range 64, base 0x90704000, size 4096, enabled
    bar   [20] = type Prefetchable Memory, range 64, base 0x90700000, size 16384, enabled
    cap 01[40] = powerspec 3  supports D0 D1 D2 D3  current D0
    cap 05[50] = MSI supports 1 message, 64 bit 
    cap 10[70] = PCI-Express 2 endpoint MSI 1 max data 128(128)
                 link x1(x1) speed 2.5(2.5) ASPM disabled(L0s/L1)
    cap 11[b0] = MSI-X supports 4 messages, enabled
                 Table in map 0x20[0x0], PBA in map 0x20[0x800]
    cap 03[d0] = VPD
    ecap 0001[100] = AER 1 0 fatal 0 non-fatal 0 corrected
    ecap 0002[140] = VC 1 max VC0
    ecap 0003[160] = Serial 1 01000000684ce000

re2@pci0:6:0:0:	class=0x020000 card=0x816810ec chip=0x816810ec rev=0x07 hdr=0x00
    vendor     = 'Realtek Semiconductor Co., Ltd.'
    device     = 'RTL8111/8168/8411 PCI Express Gigabit Ethernet Controller'
    class      = network
    subclass   = ethernet
    bar   [10] = type I/O Port, range 32, base 0xc000, size 256, enabled
    bar   [18] = type Prefetchable Memory, range 64, base 0x90604000, size 4096, enabled
    bar   [20] = type Prefetchable Memory, range 64, base 0x90600000, size 16384, enabled
    cap 01[40] = powerspec 3  supports D0 D1 D2 D3  current D0
    cap 05[50] = MSI supports 1 message, 64 bit 
    cap 10[70] = PCI-Express 2 endpoint MSI 1 max data 128(128)
                 link x1(x1) speed 2.5(2.5) ASPM disabled(L0s/L1)
    cap 11[b0] = MSI-X supports 4 messages, enabled
                 Table in map 0x20[0x0], PBA in map 0x20[0x800]
    cap 03[d0] = VPD
    ecap 0001[100] = AER 1 0 fatal 0 non-fatal 0 corrected
    ecap 0002[140] = VC 1 max VC0
    ecap 0003[160] = Serial 1 0000000000000000
