hostb0@pci0:0:0:0:	class=0x060000 rev=0x01 hdr=0x00 vendor=0x8086 device=0x2560 subvendor=0x1028 subdevice=0x0160
    vendor     = 'Intel Corporation'
    device     = '82845G/GL[Brookdale-G]/GE/PE DRAM Controller/Host-Hub Interface'
    class      = bridge
    subclass   = HOST-PCI
    bar   [10] = type Prefetchable Memory, range 32, base 0xf0000000, size 134217728, enabled
    cap 09[e4] = vendor (length 5) Intel cap 1 version 1

vgapci0@pci0:0:2:0:	class=0x030000 rev=0x01 hdr=0x00 vendor=0x8086 device=0x2562 subvendor=0x1028 subdevice=0x0160
    vendor     = 'Intel Corporation'
    device     = '82845G/GL[Brookdale-G]/GE Chipset Integrated Graphics Device'
    class      = display
    subclass   = VGA
    bar   [10] = type Prefetchable Memory, range 32, base 0xe8000000, size 134217728, enabled
    bar   [14] = type Memory, range 32, base 0xfeb80000, size 524288, enabled
    cap 01[d0] = powerspec 1  supports D0 D3  current D0

uhci0@pci0:0:29:0:	class=0x0c0300 rev=0x01 hdr=0x00 vendor=0x8086 device=0x24c2 subvendor=0x1028 subdevice=0x0160
    vendor     = 'Intel Corporation'
    device     = '82801DB/DBL/DBM (ICH4/ICH4-L/ICH4-M) USB UHCI Controller'
    class      = serial bus
    subclass   = USB
    bar   [20] = type I/O Port, range 32, base 0xff80, size 32, enabled

uhci1@pci0:0:29:1:	class=0x0c0300 rev=0x01 hdr=0x00 vendor=0x8086 device=0x24c4 subvendor=0x1028 subdevice=0x0160
    vendor     = 'Intel Corporation'
    device     = '82801DB/DBL/DBM (ICH4/ICH4-L/ICH4-M) USB UHCI Controller'
    class      = serial bus
    subclass   = USB
    bar   [20] = type I/O Port, range 32, base 0xff60, size 32, enabled

uhci2@pci0:0:29:2:	class=0x0c0300 rev=0x01 hdr=0x00 vendor=0x8086 device=0x24c7 subvendor=0x1028 subdevice=0x0160
    vendor     = 'Intel Corporation'
    device     = '82801DB/DBL/DBM (ICH4/ICH4-L/ICH4-M) USB UHCI Controller'
    class      = serial bus
    subclass   = USB
    bar   [20] = type I/O Port, range 32, base 0xff40, size 32, enabled

ehci0@pci0:0:29:7:	class=0x0c0320 rev=0x01 hdr=0x00 vendor=0x8086 device=0x24cd subvendor=0x1028 subdevice=0x0160
    vendor     = 'Intel Corporation'
    device     = '82801DB/DBM (ICH4/ICH4-M) USB2 EHCI Controller'
    class      = serial bus
    subclass   = USB
    bar   [10] = type Memory, range 32, base 0xffa80800, size 1024, enabled
    cap 01[50] = powerspec 2  supports D0 D3  current D0
    cap 0a[58] = EHCI Debug Port at offset 0x80 in map 0x14

pcib1@pci0:0:30:0:	class=0x060400 rev=0x81 hdr=0x01 vendor=0x8086 device=0x244e subvendor=0x0000 subdevice=0x0000
    vendor     = 'Intel Corporation'
    device     = '82801 PCI Bridge'
    class      = bridge
    subclass   = PCI-PCI

isab0@pci0:0:31:0:	class=0x060100 rev=0x01 hdr=0x00 vendor=0x8086 device=0x24c0 subvendor=0x0000 subdevice=0x0000
    vendor     = 'Intel Corporation'
    device     = '82801DB/DBL (ICH4/ICH4-L) LPC Interface Bridge'
    class      = bridge
    subclass   = PCI-ISA

atapci0@pci0:0:31:1:	class=0x01018a rev=0x01 hdr=0x00 vendor=0x8086 device=0x24cb subvendor=0x1028 subdevice=0x0160
    vendor     = 'Intel Corporation'
    device     = '82801DB (ICH4) IDE Controller'
    class      = mass storage
    subclass   = ATA
    bar   [20] = type I/O Port, range 32, base 0xffa0, size 16, enabled
    bar   [24] = type Memory, range 32, base 0xfeb7fc00, size 1024, enabled

ichsmb0@pci0:0:31:3:	class=0x0c0500 rev=0x01 hdr=0x00 vendor=0x8086 device=0x24c3 subvendor=0x1028 subdevice=0x0160
    vendor     = 'Intel Corporation'
    device     = '82801DB/DBL/DBM (ICH4/ICH4-L/ICH4-M) SMBus Controller'
    class      = serial bus
    subclass   = SMBus
    bar   [20] = type I/O Port, range 32, base 0xeda0, size 32, enabled

pcm0@pci0:0:31:5:	class=0x040100 rev=0x01 hdr=0x00 vendor=0x8086 device=0x24c5 subvendor=0x1028 subdevice=0x0160
    vendor     = 'Intel Corporation'
    device     = '82801DB/DBL/DBM (ICH4/ICH4-L/ICH4-M) AC'97 Audio Controller'
    class      = multimedia
    subclass   = audio
    bar   [10] = type I/O Port, range 32, base 0xee00, size 256, enabled
    bar   [14] = type I/O Port, range 32, base 0xedc0, size 64, enabled
    bar   [18] = type Memory, range 32, base 0xfeb7fa00, size 512, enabled
    bar   [1c] = type Memory, range 32, base 0xfeb7f900, size 256, enabled
    cap 01[50] = powerspec 2  supports D0 D3  current D0

bfe0@pci0:1:9:0:	class=0x020000 rev=0x01 hdr=0x00 vendor=0x14e4 device=0x4401 subvendor=0x1028 subdevice=0x8127
    vendor     = 'Broadcom Inc. and subsidiaries'
    device     = 'BCM4401 100Base-T'
    class      = network
    subclass   = ethernet
    bar   [10] = type Memory, range 32, base 0xfe9fe000, size 8192, enabled
    cap 01[40] = powerspec 2  supports D0 D1 D2 D3  current D0
