hostb0@pci0:0:0:0:	class=0x060000 rev=0x01 hdr=0x00 vendor=0x8086 device=0x4c53 subvendor=0x1043 subdevice=0x8694
    vendor     = 'Intel Corporation'
    class      = bridge
    subclass   = HOST-PCI

pcib1@pci0:0:1:0:	class=0x060400 rev=0x01 hdr=0x01 vendor=0x8086 device=0x4c01 subvendor=0x1043 subdevice=0x8694
    vendor     = 'Intel Corporation'
    class      = bridge
    subclass   = PCI-PCI
    cap 10[40] = PCI-Express 2 root port max data 256(256) ARI enabled
                 max read 128
                 link x8(x16) speed 8.0(16.0)
                 slot 1 power limit 75000 mW
    cap 05[80] = MSI supports 1 message 
    cap 0d[90] = PCI Bridge subvendor=0x1043 subdevice=0x8694
    cap 01[a0] = powerspec 3  supports D0 D3  current D0
    ecap 0001[100] = AER 1 0 fatal 0 non-fatal 0 corrected
    ecap 000d[220] = ACS 1
    ecap 001f[150] = Precision Time Measurement 1
    ecap 0002[280] = VC 1 max VC0
    ecap 001d[a00] = Downstream Port Containment 1
    ecap 0019[a30] = PCIe Sec 1 lane errors 0
    ecap 0025[a90] = Data Link Feature 1
    ecap 0026[a9c] = Physical Layer 16.0 GT/s 1
    ecap 0027[edc] = Lane Margining at Receiver 1

pcib2@pci0:0:1:1:	class=0x060400 rev=0x01 hdr=0x01 vendor=0x8086 device=0x4c05 subvendor=0x1043 subdevice=0x8694
    vendor     = 'Intel Corporation'
    class      = bridge
    subclass   = PCI-PCI
    cap 10[40] = PCI-Express 2 root port max data 256(256) ARI disabled
                 max read 128
                 link x4(x4) speed 2.5(16.0)
                 slot 2 power limit 75000 mW
    cap 05[80] = MSI supports 1 message 
    cap 0d[90] = PCI Bridge subvendor=0x1043 subdevice=0x8694
    cap 01[a0] = powerspec 3  supports D0 D3  current D0
    ecap 0001[100] = AER 1 0 fatal 0 non-fatal 0 corrected
    ecap 000d[220] = ACS 1
    ecap 001f[150] = Precision Time Measurement 1
    ecap 0002[280] = VC 1 max VC0
    ecap 001d[a00] = Downstream Port Containment 1
    ecap 0019[a30] = PCIe Sec 1 lane errors 0
    ecap 0025[a90] = Data Link Feature 1
    ecap 0026[a9c] = Physical Layer 16.0 GT/s 1
    ecap 0027[edc] = Lane Margining at Receiver 1

vgapci0@pci0:0:2:0:	class=0x030000 rev=0x04 hdr=0x00 vendor=0x8086 device=0x4c8a subvendor=0x1043 subdevice=0x8694
    vendor     = 'Intel Corporation'
    device     = 'RocketLake-S GT1 [UHD Graphics 750]'
    class      = display
    subclass   = VGA
    bar   [10] = type Memory, range 64, base 0x6000000000, size 16777216, enabled
    bar   [18] = type Prefetchable Memory, range 64, base 0x4000000000, size 268435456, enabled
    bar   [20] = type I/O Port, range 32, base 0x8000, size 64, enabled
    cap 09[40] = vendor (length 12) Intel cap 0 version 1
    cap 10[70] = PCI-Express 2 root endpoint max data 128(128) FLR
                 max read 128
    cap 05[ac] = MSI supports 1 message, vector masks 
    cap 01[d0] = powerspec 2  supports D0 D3  current D0
    ecap 001b[100] = Process Address Space ID 1
    ecap 000f[200] = ATS 1
    ecap 0013[300] = Page Page Request 1

xhci0@pci0:0:20:0:	class=0x0c0330 rev=0x11 hdr=0x00 vendor=0x8086 device=0x43ed subvendor=0x1043 subdevice=0x8694
    vendor     = 'Intel Corporation'
    device     = 'Tiger Lake-H USB 3.2 Gen 2x1 xHCI Host Controller'
    class      = serial bus
    subclass   = USB
    bar   [10] = type Memory, range 64, base 0x6001000000, size 65536, enabled
    cap 01[70] = powerspec 2  supports D0 D3  current D0
    cap 05[80] = MSI supports 8 messages, 64 bit enabled with 1 message
    cap 09[90] = vendor (length 20) Intel cap 15 version 0
    cap 09[b0] = vendor (length 0) Intel cap 0 version 1

none0@pci0:0:20:2:	class=0x050000 rev=0x11 hdr=0x00 vendor=0x8086 device=0x43ef subvendor=0x1043 subdevice=0x8694
    vendor     = 'Intel Corporation'
    device     = 'Tiger Lake-H Shared SRAM'
    class      = memory
    subclass   = RAM
    bar   [10] = type Memory, range 64, base 0x6001010000, size 16384, enabled
    bar   [18] = type Memory, range 64, base 0x6001018000, size 4096, enabled
    cap 01[80] = powerspec 3  supports D0 D3  current D0

ig4iic0@pci0:0:21:0:	class=0x0c8000 rev=0x11 hdr=0x00 vendor=0x8086 device=0x43e8 subvendor=0x1043 subdevice=0x8694
    vendor     = 'Intel Corporation'
    device     = 'Tiger Lake-H Serial IO I2C Controller'
    class      = serial bus
    bar   [10] = type Memory, range 64, base 0xa1900000, size 4096, enabled
    cap 01[80] = powerspec 3  supports D0 D3  current D0
    cap 09[90] = vendor (length 20) Intel cap 15 version 0

ig4iic1@pci0:0:21:1:	class=0x0c8000 rev=0x11 hdr=0x00 vendor=0x8086 device=0x43e9 subvendor=0x1043 subdevice=0x8694
    vendor     = 'Intel Corporation'
    class      = serial bus
    bar   [10] = type Memory, range 64, base 0xa1901000, size 4096, enabled
    cap 01[80] = powerspec 3  supports D0 D3  current D0
    cap 09[90] = vendor (length 20) Intel cap 15 version 0

none1@pci0:0:22:0:	class=0x078000 rev=0x11 hdr=0x00 vendor=0x8086 device=0x43e0 subvendor=0x1043 subdevice=0x8694
    vendor     = 'Intel Corporation'
    device     = 'Tiger Lake-H Management Engine Interface'
    class      = simple comms
    bar   [10] = type Memory, range 64, base 0x6001015000, size 4096, enabled
    cap 01[50] = powerspec 3  supports D0 D3  current D0
    cap 05[8c] = MSI supports 1 message, 64 bit 
    cap 09[a4] = vendor (length 20) Intel cap 15 version 0

ahci0@pci0:0:23:0:	class=0x010601 rev=0x11 hdr=0x00 vendor=0x8086 device=0x43d2 subvendor=0x1043 subdevice=0x8694
    vendor     = 'Intel Corporation'
    class      = mass storage
    subclass   = SATA
    bar   [10] = type Memory, range 32, base 0xa4000000, size 8192, enabled
    bar   [14] = type Memory, range 32, base 0xa4003000, size 256, enabled
    bar   [18] = type I/O Port, range 32, base 0x8090, size 8, enabled
    bar   [1c] = type I/O Port, range 32, base 0x8080, size 4, enabled
    bar   [20] = type I/O Port, range 32, base 0x8060, size 32, enabled
    bar   [24] = type Memory, range 32, base 0xa4002000, size 2048, enabled
    cap 05[80] = MSI supports 1 message enabled with 1 message
    cap 01[70] = powerspec 3  supports D0 D3  current D0
    cap 12[a8] = SATA Index-Data Pair

pcib6@pci0:0:27:0:	class=0x060400 rev=0x11 hdr=0x01 vendor=0x8086 device=0x43c0 subvendor=0x1043 subdevice=0x8694
    vendor     = 'Intel Corporation'
    class      = bridge
    subclass   = PCI-PCI
    cap 10[40] = PCI-Express 2 root port max data 128(256) ARI disabled
                 max read 128
                 link x0(x1) speed 0.0(8.0) ASPM L0s/L1(L0s/L1)
    cap 05[80] = MSI supports 1 message 
    cap 0d[90] = PCI Bridge subvendor=0x1043 subdevice=0x8694
    cap 01[a0] = powerspec 3  supports D0 D3  current D0

pcib7@pci0:0:27:3:	class=0x060400 rev=0x11 hdr=0x01 vendor=0x8086 device=0x43c3 subvendor=0x1043 subdevice=0x8694
    vendor     = 'Intel Corporation'
    class      = bridge
    subclass   = PCI-PCI
    cap 10[40] = PCI-Express 2 root port max data 128(256) ARI disabled
                 max read 128
                 link x1(x1) speed 5.0(8.0)
                 slot 23 power limit 100 mW
    cap 05[80] = MSI supports 1 message 
    cap 0d[90] = PCI Bridge subvendor=0x1043 subdevice=0x8694
    cap 01[a0] = powerspec 3  supports D0 D3  current D0
    ecap 0001[100] = AER 1 0 fatal 0 non-fatal 0 corrected
    ecap 000d[220] = ACS 1
    ecap 001f[150] = Precision Time Measurement 1
    ecap 0019[a30] = PCIe Sec 1 lane errors 0
    ecap 001d[a00] = Downstream Port Containment 1

pcib8@pci0:0:28:0:	class=0x060400 rev=0x11 hdr=0x01 vendor=0x8086 device=0x43b8 subvendor=0x1043 subdevice=0x8694
    vendor     = 'Intel Corporation'
    class      = bridge
    subclass   = PCI-PCI
    cap 10[40] = PCI-Express 2 root port max data 128(256) ARI disabled
                 max read 128
                 link x0(x1) speed 0.0(8.0) ASPM L0s/L1(L0s/L1)
    cap 05[80] = MSI supports 1 message 
    cap 0d[90] = PCI Bridge subvendor=0x1043 subdevice=0x8694
    cap 01[a0] = powerspec 3  supports D0 D3  current D0

pcib9@pci0:0:28:4:	class=0x060400 rev=0x11 hdr=0x01 vendor=0x8086 device=0x43bc subvendor=0x1043 subdevice=0x8694
    vendor     = 'Intel Corporation'
    device     = 'Tiger Lake-H PCI Express Root Port'
    class      = bridge
    subclass   = PCI-PCI
    cap 10[40] = PCI-Express 2 root port max data 256(256) ARI enabled
                 max read 128
                 link x4(x4) speed 8.0(8.0)
                 slot 8 power limit 250 mW
    cap 05[80] = MSI supports 1 message 
    cap 0d[90] = PCI Bridge subvendor=0x1043 subdevice=0x8694
    cap 01[a0] = powerspec 3  supports D0 D3  current D0
    ecap 0001[100] = AER 1 0 fatal 0 non-fatal 0 corrected
    ecap 000d[220] = ACS 1
    ecap 001f[150] = Precision Time Measurement 1
    ecap 0019[a30] = PCIe Sec 1 lane errors 0
    ecap 001d[a00] = Downstream Port Containment 1

pcib10@pci0:0:29:0:	class=0x060400 rev=0x11 hdr=0x01 vendor=0x8086 device=0x43b0 subvendor=0x1043 subdevice=0x8694
    vendor     = 'Intel Corporation'
    device     = 'Tiger Lake-H PCI Express Root Port'
    class      = bridge
    subclass   = PCI-PCI
    cap 10[40] = PCI-Express 2 root port max data 128(256) ARI disabled
                 max read 128
                 link x0(x4) speed 0.0(8.0) ASPM L0s/L1(L0s/L1)
                 slot 0 power limit 0 mW HotPlug(empty) surprise
    cap 05[80] = MSI supports 1 message enabled with 1 message
    cap 0d[90] = PCI Bridge subvendor=0x1043 subdevice=0x8694
    cap 01[a0] = powerspec 3  supports D0 D3  current D0

isab0@pci0:0:31:0:	class=0x060100 rev=0x11 hdr=0x00 vendor=0x8086 device=0x4385 subvendor=0x1043 subdevice=0x8694
    vendor     = 'Intel Corporation'
    class      = bridge
    subclass   = PCI-ISA

ichsmb0@pci0:0:31:4:	class=0x0c0500 rev=0x11 hdr=0x00 vendor=0x8086 device=0x43a3 subvendor=0x1043 subdevice=0x8694
    vendor     = 'Intel Corporation'
    device     = 'Tiger Lake-H SMBus Controller'
    class      = serial bus
    subclass   = SMBus
    bar   [10] = type Memory, range 64, base 0x6001014000, size 256, enabled
    bar   [20] = type I/O Port, range 32, base 0xefa0, size 32, enabled

none2@pci0:0:31:5:	class=0x0c8000 rev=0x11 hdr=0x00 vendor=0x8086 device=0x43a4 subvendor=0x1043 subdevice=0x8694
    vendor     = 'Intel Corporation'
    device     = 'Tiger Lake-H SPI Controller'
    class      = serial bus
    bar   [10] = type Memory, range 32, base 0xfe010000, size 4096, enabled

none3@pci0:1:0:0:	class=0x020000 rev=0x01 hdr=0x00 vendor=0x1924 device=0x0903 subvendor=0x1924 subdevice=0x800d
    vendor     = 'Solarflare Communications'
    device     = 'SFC9120 10G Ethernet Controller'
    class      = network
    subclass   = ethernet
    bar   [10] = type I/O Port, range 32, base 0x7100, size 256, enabled
    bar   [18] = type Memory, range 64, base 0xa2800000, size 8388608, enabled
    bar   [20] = type Memory, range 64, base 0xa3084000, size 16384, enabled
    cap 01[40] = powerspec 3  supports D0 D1 D2 D3  current D0
    cap 05[50] = MSI supports 1 message, 64 bit 
    cap 10[70] = PCI-Express 2 endpoint max data 256(2048) FLR RO NS
                 max read 512
                 link x8(x8) speed 8.0(8.0) ASPM disabled(L0s/L1)
    cap 11[b0] = MSI-X supports 32 messages
                 Table in map 0x20[0x0], PBA in map 0x20[0x2000]
    cap 03[d0] = VPD
    ecap 0001[100] = AER 2 0 fatal 0 non-fatal 1 corrected
    ecap 0003[140] = Serial 1 000f53ffff30e640
    ecap 000e[150] = ARI 1
    ecap 0019[160] = PCIe Sec 1 lane errors 0
    ecap 0010[180] = SR-IOV 1 IOV disabled, Memory Space disabled, ARI disabled
                     0 VFs configured out of 0 supported
                     First VF RID Offset 0x0002, VF RID Stride 0x0001
                     VF Device ID 0x1903
                     Page Sizes: 4096 (enabled), 8192, 65536, 262144, 1048576, 4194304
    ecap 0017[1c0] = TPH Requester 1
    ecap 0018[290] = LTR 1

none4@pci0:1:0:1:	class=0x020000 rev=0x01 hdr=0x00 vendor=0x1924 device=0x0903 subvendor=0x1924 subdevice=0x800d
    vendor     = 'Solarflare Communications'
    device     = 'SFC9120 10G Ethernet Controller'
    class      = network
    subclass   = ethernet
    bar   [10] = type I/O Port, range 32, base 0x7000, size 256, enabled
    bar   [18] = type Memory, range 64, base 0xa2000000, size 8388608, enabled
    bar   [20] = type Memory, range 64, base 0xa3080000, size 16384, enabled
    cap 01[40] = powerspec 3  supports D0 D1 D2 D3  current D0
    cap 05[50] = MSI supports 1 message, 64 bit 
    cap 10[70] = PCI-Express 2 endpoint max data 256(2048) FLR RO NS
                 max read 512
                 link x8(x8) speed 8.0(8.0) ASPM disabled(L0s/L1)
    cap 11[b0] = MSI-X supports 32 messages
                 Table in map 0x20[0x0], PBA in map 0x20[0x2000]
    cap 03[d0] = VPD
    ecap 0001[100] = AER 2 0 fatal 0 non-fatal 1 corrected
    ecap 0003[140] = Serial 1 000f53ffff30e640
    ecap 000e[150] = ARI 1
    ecap 0019[160] = PCIe Sec 1 lane errors 0
    ecap 0010[180] = SR-IOV 1 IOV disabled, Memory Space disabled, ARI disabled
                     0 VFs configured out of 0 supported
                     First VF RID Offset 0x0001, VF RID Stride 0x0001
                     VF Device ID 0x1903
                     Page Sizes: 4096 (enabled), 8192, 65536, 262144, 1048576, 4194304
    ecap 0017[1c0] = TPH Requester 1

pcib3@pci0:2:0:0:	class=0x060400 rev=0x0e hdr=0x01 vendor=0x111d device=0x8018 subvendor=0x0000 subdevice=0x0000
    vendor     = 'Microsemi / PMC / IDT'
    device     = 'PES12N3A 12-lane 3-Port PCI Express Switch'
    class      = bridge
    subclass   = PCI-PCI
    cap 10[40] = PCI-Express 1 upstream port max data 256(2048)
                 max read 128
                 link x4(x4) speed 2.5(2.5) ASPM disabled(L0s/L1)
    cap 01[c0] = powerspec 3  supports D0 D3  current D0
    ecap 0001[100] = AER 1 0 fatal 0 non-fatal 1 corrected
    ecap 0002[200] = VC 1 max VC0

pcib4@pci0:3:2:0:	class=0x060400 rev=0x0e hdr=0x01 vendor=0x111d device=0x8018 subvendor=0x0000 subdevice=0x0000
    vendor     = 'Microsemi / PMC / IDT'
    device     = 'PES12N3A 12-lane 3-Port PCI Express Switch'
    class      = bridge
    subclass   = PCI-PCI
    cap 10[40] = PCI-Express 1 downstream port max data 256(2048)
                 max read 128
                 link x4(x4) speed 2.5(2.5) ASPM disabled(L0s/L1)
    cap 01[c0] = powerspec 3  supports D0 D3  current D0
    cap 05[d0] = MSI supports 1 message, 64 bit 
    ecap 0001[100] = AER 1 0 fatal 0 non-fatal 1 corrected
    ecap 0002[200] = VC 1 max VC0

pcib5@pci0:3:4:0:	class=0x060400 rev=0x0e hdr=0x01 vendor=0x111d device=0x8018 subvendor=0x0000 subdevice=0x0000
    vendor     = 'Microsemi / PMC / IDT'
    device     = 'PES12N3A 12-lane 3-Port PCI Express Switch'
    class      = bridge
    subclass   = PCI-PCI
    cap 10[40] = PCI-Express 1 downstream port max data 256(2048)
                 max read 128
                 link x4(x4) speed 2.5(2.5) ASPM disabled(L0s/L1)
    cap 01[c0] = powerspec 3  supports D0 D3  current D0
    cap 05[d0] = MSI supports 1 message, 64 bit 
    ecap 0001[100] = AER 1 0 fatal 0 non-fatal 1 corrected
    ecap 0002[200] = VC 1 max VC0

em0@pci0:4:0:0:	class=0x020000 rev=0x06 hdr=0x00 vendor=0x8086 device=0x10bc subvendor=0x103c subdevice=0x704b
    vendor     = 'Intel Corporation'
    device     = '82571EB/82571GB Gigabit Ethernet Controller (Copper)'
    class      = network
    subclass   = ethernet
    bar   [10] = type Memory, range 32, base 0xa3e20000, size 131072, enabled
    bar   [14] = type Memory, range 32, base 0xa3d80000, size 524288, enabled
    bar   [18] = type I/O Port, range 32, base 0x4020, size 32, enabled
    cap 01[c8] = powerspec 2  supports D0 D3  current D0
    cap 05[d0] = MSI supports 1 message, 64 bit enabled with 1 message
    cap 10[e0] = PCI-Express 1 endpoint max data 256(256) RO NS
                 max read 512
                 link x4(x4) speed 2.5(2.5) ASPM disabled(L0s)
    ecap 0001[100] = AER 1 0 fatal 1 non-fatal 3 corrected
    ecap 0003[140] = Serial 1 002481ffff7d657c

em1@pci0:4:0:1:	class=0x020000 rev=0x06 hdr=0x00 vendor=0x8086 device=0x10bc subvendor=0x103c subdevice=0x704b
    vendor     = 'Intel Corporation'
    device     = '82571EB/82571GB Gigabit Ethernet Controller (Copper)'
    class      = network
    subclass   = ethernet
    bar   [10] = type Memory, range 32, base 0xa3e00000, size 131072, enabled
    bar   [14] = type Memory, range 32, base 0xa3d00000, size 524288, enabled
    bar   [18] = type I/O Port, range 32, base 0x4000, size 32, enabled
    cap 01[c8] = powerspec 2  supports D0 D3  current D0
    cap 05[d0] = MSI supports 1 message, 64 bit enabled with 1 message
    cap 10[e0] = PCI-Express 1 endpoint max data 256(256) RO NS
                 max read 512
                 link x4(x4) speed 2.5(2.5) ASPM disabled(L0s)
    ecap 0001[100] = AER 1 0 fatal 1 non-fatal 3 corrected
    ecap 0003[140] = Serial 1 002481ffff7d657c

em2@pci0:5:0:0:	class=0x020000 rev=0x06 hdr=0x00 vendor=0x8086 device=0x10bc subvendor=0x103c subdevice=0x704b
    vendor     = 'Intel Corporation'
    device     = '82571EB/82571GB Gigabit Ethernet Controller (Copper)'
    class      = network
    subclass   = ethernet
    bar   [10] = type Memory, range 32, base 0xa3c20000, size 131072, enabled
    bar   [14] = type Memory, range 32, base 0xa3b80000, size 524288, enabled
    bar   [18] = type I/O Port, range 32, base 0x3020, size 32, enabled
    cap 01[c8] = powerspec 2  supports D0 D3  current D0
    cap 05[d0] = MSI supports 1 message, 64 bit enabled with 1 message
    cap 10[e0] = PCI-Express 1 endpoint max data 256(256) RO NS
                 max read 512
                 link x4(x4) speed 2.5(2.5) ASPM disabled(L0s)
    ecap 0001[100] = AER 1 0 fatal 1 non-fatal 0 corrected
    ecap 0003[140] = Serial 1 002481ffff7d657e

em3@pci0:5:0:1:	class=0x020000 rev=0x06 hdr=0x00 vendor=0x8086 device=0x10bc subvendor=0x103c subdevice=0x704b
    vendor     = 'Intel Corporation'
    device     = '82571EB/82571GB Gigabit Ethernet Controller (Copper)'
    class      = network
    subclass   = ethernet
    bar   [10] = type Memory, range 32, base 0xa3c00000, size 131072, enabled
    bar   [14] = type Memory, range 32, base 0xa3b00000, size 524288, enabled
    bar   [18] = type I/O Port, range 32, base 0x3000, size 32, enabled
    cap 01[c8] = powerspec 2  supports D0 D3  current D0
    cap 05[d0] = MSI supports 1 message, 64 bit enabled with 1 message
    cap 10[e0] = PCI-Express 1 endpoint max data 256(256) RO NS
                 max read 512
                 link x4(x4) speed 2.5(2.5) ASPM disabled(L0s)
    ecap 0001[100] = AER 1 0 fatal 1 non-fatal 0 corrected
    ecap 0003[140] = Serial 1 002481ffff7d657e

none5@pci0:9:0:0:	class=0x020000 rev=0x01 hdr=0x00 vendor=0x1924 device=0x0903 subvendor=0x1924 subdevice=0x800d
    vendor     = 'Solarflare Communications'
    device     = 'SFC9120 10G Ethernet Controller'
    class      = network
    subclass   = ethernet
    bar   [10] = type I/O Port, range 32, base 0x6100, size 256, enabled
    bar   [18] = type Memory, range 64, base 0xa1000000, size 8388608, enabled
    bar   [20] = type Memory, range 64, base 0xa1884000, size 16384, enabled
    cap 01[40] = powerspec 3  supports D0 D1 D2 D3  current D0
    cap 05[50] = MSI supports 1 message, 64 bit 
    cap 10[70] = PCI-Express 2 endpoint max data 256(2048) FLR RO NS
                 max read 512
                 link x4(x8) speed 8.0(8.0) ASPM disabled(L0s/L1)
    cap 11[b0] = MSI-X supports 32 messages
                 Table in map 0x20[0x0], PBA in map 0x20[0x2000]
    cap 03[d0] = VPD
    ecap 0001[100] = AER 2 0 fatal 0 non-fatal 1 corrected
    ecap 0003[140] = Serial 1 000f53ffff2ed9d0
    ecap 000e[150] = ARI 1
    ecap 0019[160] = PCIe Sec 1 lane errors 0
    ecap 0010[180] = SR-IOV 1 IOV disabled, Memory Space disabled, ARI disabled
                     0 VFs configured out of 0 supported
                     First VF RID Offset 0x0002, VF RID Stride 0x0001
                     VF Device ID 0x1903
                     Page Sizes: 4096 (enabled), 8192, 65536, 262144, 1048576, 4194304
    ecap 0017[1c0] = TPH Requester 1
    ecap 0018[290] = LTR 1

none6@pci0:9:0:1:	class=0x020000 rev=0x01 hdr=0x00 vendor=0x1924 device=0x0903 subvendor=0x1924 subdevice=0x800d
    vendor     = 'Solarflare Communications'
    device     = 'SFC9120 10G Ethernet Controller'
    class      = network
    subclass   = ethernet
    bar   [10] = type I/O Port, range 32, base 0x6000, size 256, enabled
    bar   [18] = type Memory, range 64, base 0xa0800000, size 8388608, enabled
    bar   [20] = type Memory, range 64, base 0xa1880000, size 16384, enabled
    cap 01[40] = powerspec 3  supports D0 D1 D2 D3  current D0
    cap 05[50] = MSI supports 1 message, 64 bit 
    cap 10[70] = PCI-Express 2 endpoint max data 256(2048) FLR RO NS
                 max read 512
                 link x4(x8) speed 8.0(8.0) ASPM disabled(L0s/L1)
    cap 11[b0] = MSI-X supports 32 messages
                 Table in map 0x20[0x0], PBA in map 0x20[0x2000]
    cap 03[d0] = VPD
    ecap 0001[100] = AER 2 0 fatal 0 non-fatal 1 corrected
    ecap 0003[140] = Serial 1 000f53ffff2ed9d0
    ecap 000e[150] = ARI 1
    ecap 0019[160] = PCIe Sec 1 lane errors 0
    ecap 0010[180] = SR-IOV 1 IOV disabled, Memory Space disabled, ARI disabled
                     0 VFs configured out of 0 supported
                     First VF RID Offset 0x0001, VF RID Stride 0x0001
                     VF Device ID 0x1903
                     Page Sizes: 4096 (enabled), 8192, 65536, 262144, 1048576, 4194304
    ecap 0017[1c0] = TPH Requester 1
