hostb0@pci0:0:0:0:	class=0x060000 card=0x06ba1028 chip=0x191f8086 rev=0x07 hdr=0x00
    vendor     = 'Intel Corporation'
    device     = 'Xeon E3-1200 v5/E3-1500 v5/6th Gen Core Processor Host Bridge/DRAM Registers'
    class      = bridge
    subclass   = HOST-PCI
    cap 09[e0] = vendor (length 16) Intel cap 0 version 1

pcib1@pci0:0:1:0:	class=0x060400 card=0x06ba1028 chip=0x19018086 rev=0x07 hdr=0x01
    vendor     = 'Intel Corporation'
    device     = 'Xeon E3-1200 v5/E3-1500 v5/6th Gen Core Processor PCIe Controller (x16)'
    class      = bridge
    subclass   = PCI-PCI
    cap 0d[88] = PCI Bridge card=0x06ba1028
    cap 01[80] = powerspec 3  supports D0 D3  current D0
    cap 05[90] = MSI supports 1 message 
    cap 10[a0] = PCI-Express 2 root port max data 256(256)
                 link x8(x16) speed 5.0(8.0) ASPM disabled(L0s/L1)
                 slot 2 power limit 75000 mW
    ecap 0002[100] = VC 1 max VC0
    ecap 0005[140] = Root Complex Link Declaration 1
    ecap 0019[d94] = PCIe Sec 1 lane errors 0

vgapci0@pci0:0:2:0:	class=0x030000 card=0x06ba1028 chip=0x19128086 rev=0x06 hdr=0x00
    vendor     = 'Intel Corporation'
    device     = 'HD Graphics 530'
    class      = display
    subclass   = VGA
    bar   [10] = type Memory, range 64, base 0xf6000000, size 16777216, enabled
    bar   [18] = type Prefetchable Memory, range 64, base 0xe0000000, size 268435456, enabled
    bar   [20] = type I/O Port, range 32, base 0xf000, size 64, enabled
    cap 09[40] = vendor (length 12) Intel cap 0 version 1
    cap 10[70] = PCI-Express 2 root endpoint max data 128(128) FLR
    cap 05[ac] = MSI supports 1 message 
    cap 01[d0] = powerspec 2  supports D0 D3  current D0
    ecap 001b[100] = unknown 1
    ecap 000f[200] = ATS 1
    ecap 0013[300] = unknown 1

xhci0@pci0:0:20:0:	class=0x0c0330 card=0x06ba1028 chip=0xa12f8086 rev=0x31 hdr=0x00
    vendor     = 'Intel Corporation'
    device     = '100 Series/C230 Series Chipset Family USB 3.0 xHCI Controller'
    class      = serial bus
    subclass   = USB
    bar   [10] = type Memory, range 64, base 0xf7330000, size 65536, enabled
    cap 01[70] = powerspec 2  supports D0 D3  current D0
    cap 05[80] = MSI supports 8 messages, 64 bit enabled with 1 message

none0@pci0:0:20:2:	class=0x118000 card=0x06ba1028 chip=0xa1318086 rev=0x31 hdr=0x00
    vendor     = 'Intel Corporation'
    device     = '100 Series/C230 Series Chipset Family Thermal Subsystem'
    class      = dasp
    bar   [10] = type Memory, range 64, base 0xf734e000, size 4096, enabled
    cap 01[50] = powerspec 3  supports D0 D3  current D0
    cap 05[80] = MSI supports 1 message 

none1@pci0:0:22:0:	class=0x078000 card=0x06ba1028 chip=0xa13a8086 rev=0x31 hdr=0x00
    vendor     = 'Intel Corporation'
    device     = '100 Series/C230 Series Chipset Family MEI Controller'
    class      = simple comms
    bar   [10] = type Memory, range 64, base 0xf734d000, size 4096, enabled
    cap 01[50] = powerspec 3  supports D0 D3  current D0
    cap 05[8c] = MSI supports 1 message, 64 bit 

ahci0@pci0:0:23:0:	class=0x010400 card=0x06ba1028 chip=0x28228086 rev=0x31 hdr=0x00
    vendor     = 'Intel Corporation'
    device     = 'SATA Controller [RAID mode]'
    class      = mass storage
    subclass   = RAID
    bar   [10] = type Memory, range 32, base 0xf7348000, size 8192, enabled
    bar   [14] = type Memory, range 32, base 0xf734c000, size 256, enabled
    bar   [18] = type I/O Port, range 32, base 0xf090, size 8, enabled
    bar   [1c] = type I/O Port, range 32, base 0xf080, size 4, enabled
    bar   [20] = type I/O Port, range 32, base 0xf060, size 32, enabled
    bar   [24] = type Memory, range 32, base 0xf734b000, size 2048, enabled
    cap 05[80] = MSI supports 1 message enabled with 1 message
    cap 01[70] = powerspec 3  supports D0 D3  current D0
    cap 12[a8] = SATA Index-Data Pair

pcib2@pci0:0:27:0:	class=0x060400 card=0x06ba1028 chip=0xa1678086 rev=0xf1 hdr=0x01
    vendor     = 'Intel Corporation'
    device     = '100 Series/C230 Series Chipset Family PCI Express Root Port'
    class      = bridge
    subclass   = PCI-PCI
    cap 10[40] = PCI-Express 2 root port max data 128(256) ARI disabled
                 link x4(x4) speed 8.0(8.0)
                 slot 3 power limit 250 mW
    cap 05[80] = MSI supports 1 message 
    cap 0d[90] = PCI Bridge card=0x06ba1028
    cap 01[a0] = powerspec 3  supports D0 D3  current D0
    ecap 0001[100] = AER 1 0 fatal 0 non-fatal 2 corrected
    ecap 000d[140] = ACS 1
    ecap 0019[220] = PCIe Sec 1 lane errors 0

pcib3@pci0:0:29:0:	class=0x060400 card=0x06ba1028 chip=0xa1188086 rev=0xf1 hdr=0x01
    vendor     = 'Intel Corporation'
    device     = '100 Series/C230 Series Chipset Family PCI Express Root Port'
    class      = bridge
    subclass   = PCI-PCI
    cap 10[40] = PCI-Express 2 root port max data 256(256) ARI disabled
                 link x1(x4) speed 2.5(8.0)
                 slot 1 power limit 250 mW
    cap 05[80] = MSI supports 1 message 
    cap 0d[90] = PCI Bridge card=0x06ba1028
    cap 01[a0] = powerspec 3  supports D0 D3  current D0
    ecap 0001[100] = AER 1 0 fatal 0 non-fatal 0 corrected
    ecap 000d[140] = ACS 1
    ecap 0019[220] = PCIe Sec 1 lane errors 0

isab0@pci0:0:31:0:	class=0x060100 card=0x06ba1028 chip=0xa1468086 rev=0x31 hdr=0x00
    vendor     = 'Intel Corporation'
    device     = 'Q170 Chipset LPC/eSPI Controller'
    class      = bridge
    subclass   = PCI-ISA

none2@pci0:0:31:2:	class=0x058000 card=0x06ba1028 chip=0xa1218086 rev=0x31 hdr=0x00
    vendor     = 'Intel Corporation'
    device     = '100 Series/C230 Series Chipset Family Power Management Controller'
    class      = memory
    bar   [10] = type Memory, range 32, base 0xf7344000, size 16384, enabled

hdac0@pci0:0:31:3:	class=0x040300 card=0x06ba1028 chip=0xa1708086 rev=0x31 hdr=0x00
    vendor     = 'Intel Corporation'
    device     = '100 Series/C230 Series Chipset Family HD Audio Controller'
    class      = multimedia
    subclass   = HDA
    bar   [10] = type Memory, range 64, base 0xf7340000, size 16384, enabled
    bar   [20] = type Memory, range 64, base 0xf7320000, size 65536, enabled
    cap 01[50] = powerspec 3  supports D0 D3  current D0
    cap 05[60] = MSI supports 1 message, 64 bit enabled with 1 message

none3@pci0:0:31:4:	class=0x0c0500 card=0x06ba1028 chip=0xa1238086 rev=0x31 hdr=0x00
    vendor     = 'Intel Corporation'
    device     = '100 Series/C230 Series Chipset Family SMBus'
    class      = serial bus
    subclass   = SMBus
    bar   [10] = type Memory, range 64, base 0xf734a000, size 256, enabled
    bar   [20] = type I/O Port, range 32, base 0xf040, size 32, enabled

em1@pci0:0:31:6:	class=0x020000 card=0x06ba1028 chip=0x15b88086 rev=0x31 hdr=0x00
    vendor     = 'Intel Corporation'
    device     = 'Ethernet Connection (2) I219-V'
    class      = network
    subclass   = ethernet
    bar   [10] = type Memory, range 32, base 0xf7300000, size 131072, enabled
    cap 01[c8] = powerspec 3  supports D0 D3  current D0
    cap 05[d0] = MSI supports 1 message, 64 bit enabled with 1 message
    cap 13[e0] = PCI Advanced Features: FLR TP

ix0@pci0:1:0:0:	class=0x020000 card=0x00018086 chip=0x15288086 rev=0x01 hdr=0x00
    vendor     = 'Intel Corporation'
    device     = 'Ethernet Controller 10-Gigabit X540-AT2'
    class      = network
    subclass   = ethernet
    bar   [10] = type Prefetchable Memory, range 64, base 0xf0200000, size 2097152, enabled
    bar   [20] = type Prefetchable Memory, range 64, base 0xf0404000, size 16384, enabled
    cap 01[40] = powerspec 3  supports D0 D3  current D0
    cap 05[50] = MSI supports 1 message, 64 bit, vector masks 
    cap 11[70] = MSI-X supports 64 messages, enabled
                 Table in map 0x20[0x0], PBA in map 0x20[0x2000]
    cap 10[a0] = PCI-Express 2 endpoint max data 256(512) FLR RO NS
                 link x8(x8) speed 5.0(5.0) ASPM disabled(L0s/L1)
    ecap 0001[100] = AER 2 0 fatal 0 non-fatal 1 corrected
    ecap 0003[140] = Serial 1 a0369fffff3e4538
    ecap 000e[150] = ARI 1
    ecap 0010[160] = SR-IOV 1 IOV disabled, Memory Space disabled, ARI disabled
                     0 VFs configured out of 64 supported
                     First VF RID Offset 0x0180, VF RID Stride 0x0002
                     VF Device ID 0x1515
                     Page Sizes: 4096 (enabled), 8192, 65536, 262144, 1048576, 4194304
    ecap 000d[1d0] = ACS 1

ix1@pci0:1:0:1:	class=0x020000 card=0x00018086 chip=0x15288086 rev=0x01 hdr=0x00
    vendor     = 'Intel Corporation'
    device     = 'Ethernet Controller 10-Gigabit X540-AT2'
    class      = network
    subclass   = ethernet
    bar   [10] = type Prefetchable Memory, range 64, base 0xf0000000, size 2097152, enabled
    bar   [20] = type Prefetchable Memory, range 64, base 0xf0400000, size 16384, enabled
    cap 01[40] = powerspec 3  supports D0 D3  current D0
    cap 05[50] = MSI supports 1 message, 64 bit, vector masks 
    cap 11[70] = MSI-X supports 64 messages, enabled
                 Table in map 0x20[0x0], PBA in map 0x20[0x2000]
    cap 10[a0] = PCI-Express 2 endpoint max data 256(512) FLR RO NS
                 link x8(x8) speed 5.0(5.0) ASPM disabled(L0s/L1)
    ecap 0001[100] = AER 2 0 fatal 0 non-fatal 1 corrected
    ecap 0003[140] = Serial 1 a0369fffff3e4538
    ecap 000e[150] = ARI 1
    ecap 0010[160] = SR-IOV 1 IOV disabled, Memory Space disabled, ARI disabled
                     0 VFs configured out of 64 supported
                     First VF RID Offset 0x0180, VF RID Stride 0x0002
                     VF Device ID 0x1515
                     Page Sizes: 4096 (enabled), 8192, 65536, 262144, 1048576, 4194304
    ecap 000d[1d0] = ACS 1

nvme0@pci0:2:0:0:	class=0x010802 card=0xa801144d chip=0xa802144d rev=0x01 hdr=0x00
    vendor     = 'Samsung Electronics Co Ltd'
    device     = 'NVMe SSD Controller SM951/PM951'
    class      = mass storage
    subclass   = NVM
    bar   [10] = type Memory, range 64, base 0xf7100000, size 16384, enabled
    bar   [18] = type I/O Port, range 32, base 0xe000, size 256, enabled
    cap 01[40] = powerspec 3  supports D0 D3  current D0
    cap 05[50] = MSI supports 8 messages, 64 bit 
    cap 10[70] = PCI-Express 2 endpoint max data 128(128) FLR RO NS
                 link x4(x4) speed 8.0(8.0) ASPM disabled(L1)
    cap 11[b0] = MSI-X supports 9 messages, enabled
                 Table in map 0x10[0x3000], PBA in map 0x10[0x2000]
    ecap 0001[100] = AER 2 1 fatal 0 non-fatal 1 corrected
    ecap 0003[148] = Serial 1 0000000000000000
    ecap 0004[158] = Power Budgeting 1
    ecap 0019[168] = PCIe Sec 1 lane errors 0
    ecap 0018[188] = LTR 1
    ecap 001e[190] = unknown 1

em0@pci0:3:0:0:	class=0x020000 card=0xa01f8086 chip=0x10d38086 rev=0x00 hdr=0x00
    vendor     = 'Intel Corporation'
    device     = '82574L Gigabit Network Connection'
    class      = network
    subclass   = ethernet
    bar   [10] = type Memory, range 32, base 0xf70c0000, size 131072, enabled
    bar   [14] = type Memory, range 32, base 0xf7000000, size 524288, enabled
    bar   [18] = type I/O Port, range 32, base 0xd000, size 32, enabled
    bar   [1c] = type Memory, range 32, base 0xf70e0000, size 16384, enabled
    cap 01[c8] = powerspec 2  supports D0 D3  current D0
    cap 05[d0] = MSI supports 1 message, 64 bit 
    cap 10[e0] = PCI-Express 1 endpoint max data 256(256) RO NS
                 link x1(x1) speed 2.5(2.5) ASPM disabled(L0s/L1)
    cap 11[a0] = MSI-X supports 5 messages, enabled
                 Table in map 0x1c[0x0], PBA in map 0x1c[0x2000]
    ecap 0001[100] = AER 1 0 fatal 0 non-fatal 1 corrected
    ecap 0003[140] = Serial 1 6805caffff84c650
