hostb0@pci0:0:0:0:	class=0x060000 rev=0x13 hdr=0x00 vendor=0x8086 device=0x3406 subvendor=0x1028 subdevice=0x0235
    vendor     = 'Intel Corporation'
    device     = '5520 I/O Hub to ESI Port'
    class      = bridge
    subclass   = HOST-PCI
    cap 05[60] = MSI supports 2 messages, vector masks 
    cap 10[90] = PCI-Express 2 root port max data 128(128) ARI disabled
                 max read 128
                 link x4(x4) speed 2.5(2.5) ASPM disabled(L0s/L1)
    cap 01[e0] = powerspec 3  supports D0 D3  current D0
    ecap 0001[100] = AER 1 0 fatal 0 non-fatal 0 corrected
    ecap 000d[150] = ACS 1
    ecap 000b[160] = Vendor [0] ID 0002 Rev 0 Length 12

pcib1@pci0:0:1:0:	class=0x060400 rev=0x13 hdr=0x01 vendor=0x8086 device=0x3408 subvendor=0x1028 subdevice=0x0235
    vendor     = 'Intel Corporation'
    device     = '5520/5500/X58 I/O Hub PCI Express Root Port 1'
    class      = bridge
    subclass   = PCI-PCI
    cap 0d[40] = PCI Bridge subvendor=0x1028 subdevice=0x0235
    cap 05[60] = MSI supports 2 messages, vector masks 
    cap 10[90] = PCI-Express 2 root port max data 256(256) ARI disabled
                 max read 128
                 link x4(x4) speed 2.5(5.0) ASPM disabled(L0s/L1)
    cap 01[e0] = powerspec 3  supports D0 D3  current D0
    ecap 0001[100] = AER 1 0 fatal 0 non-fatal 0 corrected
    ecap 000d[150] = ACS 1
    ecap 000b[160] = Vendor [0] ID 0002 Rev 0 Length 12

pcib2@pci0:0:3:0:	class=0x060400 rev=0x13 hdr=0x01 vendor=0x8086 device=0x340a subvendor=0x1028 subdevice=0x0235
    vendor     = 'Intel Corporation'
    device     = '5520/5500/X58 I/O Hub PCI Express Root Port 3'
    class      = bridge
    subclass   = PCI-PCI
    cap 0d[40] = PCI Bridge subvendor=0x1028 subdevice=0x0235
    cap 05[60] = MSI supports 2 messages, vector masks 
    cap 10[90] = PCI-Express 2 root port max data 256(256) ARI disabled
                 max read 128
                 link x4(x4) speed 2.5(5.0) ASPM disabled(L0s/L1)
    cap 01[e0] = powerspec 3  supports D0 D3  current D0
    ecap 0001[100] = AER 1 0 fatal 0 non-fatal 0 corrected
    ecap 000d[150] = ACS 1
    ecap 000b[160] = Vendor [0] ID 0002 Rev 0 Length 12

pcib3@pci0:0:4:0:	class=0x060400 rev=0x13 hdr=0x01 vendor=0x8086 device=0x340b subvendor=0x1028 subdevice=0x0235
    vendor     = 'Intel Corporation'
    device     = '5520/X58 I/O Hub PCI Express Root Port 4'
    class      = bridge
    subclass   = PCI-PCI
    cap 0d[40] = PCI Bridge subvendor=0x1028 subdevice=0x0235
    cap 05[60] = MSI supports 2 messages, vector masks 
    cap 10[90] = PCI-Express 2 root port max data 256(256) ARI disabled
                 max read 128
                 link x4(x4) speed 5.0(5.0) ASPM disabled(L0s/L1)
    cap 01[e0] = powerspec 3  supports D0 D3  current D0
    ecap 0001[100] = AER 1 0 fatal 0 non-fatal 0 corrected
    ecap 000d[150] = ACS 1

pcib4@pci0:0:5:0:	class=0x060400 rev=0x13 hdr=0x01 vendor=0x8086 device=0x340c subvendor=0x1028 subdevice=0x0235
    vendor     = 'Intel Corporation'
    device     = '5520/X58 I/O Hub PCI Express Root Port 5'
    class      = bridge
    subclass   = PCI-PCI
    cap 0d[40] = PCI Bridge subvendor=0x1028 subdevice=0x0235
    cap 05[60] = MSI supports 2 messages, vector masks 
    cap 10[90] = PCI-Express 2 root port max data 256(256) ARI disabled
                 max read 128
                 link x4(x4) speed 5.0(5.0) ASPM disabled(L0s/L1)
                 slot 2 power limit 25000 mW
    cap 01[e0] = powerspec 3  supports D0 D3  current D0
    ecap 0001[100] = AER 1 0 fatal 0 non-fatal 0 corrected
    ecap 000d[150] = ACS 1

pcib5@pci0:0:6:0:	class=0x060400 rev=0x13 hdr=0x01 vendor=0x8086 device=0x340d subvendor=0x1028 subdevice=0x0235
    vendor     = 'Intel Corporation'
    device     = '5520/X58 I/O Hub PCI Express Root Port 6'
    class      = bridge
    subclass   = PCI-PCI
    cap 0d[40] = PCI Bridge subvendor=0x1028 subdevice=0x0235
    cap 05[60] = MSI supports 2 messages, vector masks 
    cap 10[90] = PCI-Express 2 root port max data 128(256) ARI disabled
                 max read 128
                 link x4(x4) speed 5.0(5.0) ASPM disabled(L0s/L1)
                 slot 1 power limit 25000 mW
    cap 01[e0] = powerspec 3  supports D0 D3  current D0
    ecap 0001[100] = AER 1 0 fatal 0 non-fatal 0 corrected
    ecap 000d[150] = ACS 1

pcib6@pci0:0:7:0:	class=0x060400 rev=0x13 hdr=0x01 vendor=0x8086 device=0x340e subvendor=0x1028 subdevice=0x0235
    vendor     = 'Intel Corporation'
    device     = '5520/5500/X58 I/O Hub PCI Express Root Port 7'
    class      = bridge
    subclass   = PCI-PCI
    cap 0d[40] = PCI Bridge subvendor=0x1028 subdevice=0x0235
    cap 05[60] = MSI supports 2 messages, vector masks 
    cap 10[90] = PCI-Express 2 root port max data 128(256) ARI disabled
                 max read 128
                 link x0(x8) speed 0.0(5.0) ASPM disabled(L0s/L1)
                 slot 4 power limit 25000 mW
    cap 01[e0] = powerspec 3  supports D0 D3  current D0
    ecap 0001[100] = AER 1 0 fatal 0 non-fatal 0 corrected
    ecap 000d[150] = ACS 1
    ecap 000b[160] = Vendor [0] ID 0002 Rev 0 Length 12

pcib7@pci0:0:9:0:	class=0x060400 rev=0x13 hdr=0x01 vendor=0x8086 device=0x3410 subvendor=0x1028 subdevice=0x0235
    vendor     = 'Intel Corporation'
    device     = '7500/5520/5500/X58 I/O Hub PCI Express Root Port 9'
    class      = bridge
    subclass   = PCI-PCI
    cap 0d[40] = PCI Bridge subvendor=0x1028 subdevice=0x0235
    cap 05[60] = MSI supports 2 messages, vector masks 
    cap 10[90] = PCI-Express 2 root port max data 128(256) ARI disabled
                 max read 128
                 link x0(x8) speed 0.0(5.0) ASPM disabled(L0s/L1)
                 slot 3 power limit 25000 mW
    cap 01[e0] = powerspec 3  supports D0 D3  current D0
    ecap 0001[100] = AER 1 0 fatal 0 non-fatal 0 corrected
    ecap 000d[150] = ACS 1

none0@pci0:0:20:0:	class=0x080000 rev=0x13 hdr=0x00 vendor=0x8086 device=0x342e subvendor=0x0000 subdevice=0x0000
    vendor     = 'Intel Corporation'
    device     = '7500/5520/5500/X58 I/O Hub System Management Registers'
    class      = base peripheral
    subclass   = interrupt controller
    cap 10[40] = PCI-Express 2 root endpoint max data 128(128)
                 max read 128
                 link x0(x0) ASPM disabled(L0s)

none1@pci0:0:20:1:	class=0x080000 rev=0x13 hdr=0x00 vendor=0x8086 device=0x3422 subvendor=0x0000 subdevice=0x0000
    vendor     = 'Intel Corporation'
    device     = '7500/5520/5500/X58 I/O Hub GPIO and Scratch Pad Registers'
    class      = base peripheral
    subclass   = interrupt controller
    cap 10[40] = PCI-Express 2 root endpoint max data 128(128)
                 max read 128
                 link x0(x0) ASPM disabled(L0s)

none2@pci0:0:20:2:	class=0x080000 rev=0x13 hdr=0x00 vendor=0x8086 device=0x3423 subvendor=0x0000 subdevice=0x0000
    vendor     = 'Intel Corporation'
    device     = '7500/5520/5500/X58 I/O Hub Control Status and RAS Registers'
    class      = base peripheral
    subclass   = interrupt controller
    cap 10[40] = PCI-Express 2 root endpoint max data 128(128)
                 max read 128
                 link x0(x0) ASPM disabled(L0s)

uhci0@pci0:0:26:0:	class=0x0c0300 rev=0x02 hdr=0x00 vendor=0x8086 device=0x2937 subvendor=0x1028 subdevice=0x0235
    vendor     = 'Intel Corporation'
    device     = '82801I (ICH9 Family) USB UHCI Controller'
    class      = serial bus
    subclass   = USB
    bar   [20] = type I/O Port, range 32, base 0xdc40, size 32, enabled
    cap 13[50] = PCI Advanced Features: FLR TP

uhci1@pci0:0:26:1:	class=0x0c0300 rev=0x02 hdr=0x00 vendor=0x8086 device=0x2938 subvendor=0x1028 subdevice=0x0235
    vendor     = 'Intel Corporation'
    device     = '82801I (ICH9 Family) USB UHCI Controller'
    class      = serial bus
    subclass   = USB
    bar   [20] = type I/O Port, range 32, base 0xdc60, size 32, enabled
    cap 13[50] = PCI Advanced Features: FLR TP

ehci0@pci0:0:26:7:	class=0x0c0320 rev=0x02 hdr=0x00 vendor=0x8086 device=0x293c subvendor=0x1028 subdevice=0x0235
    vendor     = 'Intel Corporation'
    device     = '82801I (ICH9 Family) USB2 EHCI Controller'
    class      = serial bus
    subclass   = USB
    bar   [10] = type Memory, range 32, base 0xdf0fe000, size 1024, enabled
    cap 01[50] = powerspec 2  supports D0 D3  current D0
    cap 0a[58] = EHCI Debug Port at offset 0xa0 in map 0x14
    cap 13[98] = PCI Advanced Features: FLR TP

uhci2@pci0:0:29:0:	class=0x0c0300 rev=0x02 hdr=0x00 vendor=0x8086 device=0x2934 subvendor=0x1028 subdevice=0x0235
    vendor     = 'Intel Corporation'
    device     = '82801I (ICH9 Family) USB UHCI Controller'
    class      = serial bus
    subclass   = USB
    bar   [20] = type I/O Port, range 32, base 0xdc80, size 32, enabled
    cap 13[50] = PCI Advanced Features: FLR TP

uhci3@pci0:0:29:1:	class=0x0c0300 rev=0x02 hdr=0x00 vendor=0x8086 device=0x2935 subvendor=0x1028 subdevice=0x0235
    vendor     = 'Intel Corporation'
    device     = '82801I (ICH9 Family) USB UHCI Controller'
    class      = serial bus
    subclass   = USB
    bar   [20] = type I/O Port, range 32, base 0xdca0, size 32, enabled
    cap 13[50] = PCI Advanced Features: FLR TP

ehci1@pci0:0:29:7:	class=0x0c0320 rev=0x02 hdr=0x00 vendor=0x8086 device=0x293a subvendor=0x1028 subdevice=0x0235
    vendor     = 'Intel Corporation'
    device     = '82801I (ICH9 Family) USB2 EHCI Controller'
    class      = serial bus
    subclass   = USB
    bar   [10] = type Memory, range 32, base 0xdf0ff000, size 1024, enabled
    cap 01[50] = powerspec 2  supports D0 D3  current D0
    cap 0a[58] = EHCI Debug Port at offset 0xa0 in map 0x14
    cap 13[98] = PCI Advanced Features: FLR TP

pcib8@pci0:0:30:0:	class=0x060401 rev=0x92 hdr=0x01 vendor=0x8086 device=0x244e subvendor=0x1028 subdevice=0x0235
    vendor     = 'Intel Corporation'
    device     = '82801 PCI Bridge'
    class      = bridge
    subclass   = PCI-PCI
    cap 0d[50] = PCI Bridge subvendor=0x1028 subdevice=0x0235

isab0@pci0:0:31:0:	class=0x060100 rev=0x02 hdr=0x00 vendor=0x8086 device=0x2918 subvendor=0x1028 subdevice=0x0235
    vendor     = 'Intel Corporation'
    device     = '82801IB (ICH9) LPC Interface Controller'
    class      = bridge
    subclass   = PCI-ISA
    cap 09[e0] = vendor (length 12) Intel cap 1 version 0
		 features: Quick Resume, SATA RAID-5, 4 PCI-e x1 slots, SATA RAID-0/1/10

atapci0@pci0:0:31:2:	class=0x01018f rev=0x02 hdr=0x00 vendor=0x8086 device=0x2921 subvendor=0x1028 subdevice=0x0235
    vendor     = 'Intel Corporation'
    device     = '82801IB (ICH9) 2 port SATA Controller [IDE mode]'
    class      = mass storage
    subclass   = ATA
    bar   [10] = type I/O Port, range 32, base 0xdc10, size 8, enabled
    bar   [14] = type I/O Port, range 32, base 0xdc08, size 4, enabled
    bar   [18] = type I/O Port, range 32, base 0xdc18, size 8, enabled
    bar   [1c] = type I/O Port, range 32, base 0xdc0c, size 4, enabled
    bar   [20] = type I/O Port, range 32, base 0xdc20, size 16, enabled
    bar   [24] = type I/O Port, range 32, base 0xdc30, size 16, enabled
    cap 01[70] = powerspec 3  supports D0 D3  current D0
    cap 13[b0] = PCI Advanced Features: FLR TP

bce0@pci0:1:0:0:	class=0x020000 rev=0x20 hdr=0x00 vendor=0x14e4 device=0x1639 subvendor=0x1028 subdevice=0x0235
    vendor     = 'Broadcom Inc. and subsidiaries'
    device     = 'NetXtreme II BCM5709 Gigabit Ethernet'
    class      = network
    subclass   = ethernet
    bar   [10] = type Memory, range 64, base 0xd6000000, size 33554432, enabled
    cap 01[48] = powerspec 3  supports D0 D3  current D0
    cap 03[50] = VPD
    cap 05[58] = MSI supports 16 messages, 64 bit enabled with 1 message
    cap 11[a0] = MSI-X supports 9 messages
                 Table in map 0x10[0xc000], PBA in map 0x10[0xe000]
    cap 10[ac] = PCI-Express 2 endpoint max data 256(512) RO NS
                 max read 512
                 link x4(x4) speed 2.5(2.5) ASPM disabled(L0s/L1)
    ecap 0003[100] = Serial 1 d4ae52fffeba3fb1
    ecap 0001[110] = AER 1 0 fatal 0 non-fatal 1 corrected
    ecap 0004[150] = Power Budgeting 1
    ecap 0002[160] = VC 1 max VC0

bce1@pci0:1:0:1:	class=0x020000 rev=0x20 hdr=0x00 vendor=0x14e4 device=0x1639 subvendor=0x1028 subdevice=0x0235
    vendor     = 'Broadcom Inc. and subsidiaries'
    device     = 'NetXtreme II BCM5709 Gigabit Ethernet'
    class      = network
    subclass   = ethernet
    bar   [10] = type Memory, range 64, base 0xd8000000, size 33554432, enabled
    cap 01[48] = powerspec 3  supports D0 D3  current D0
    cap 03[50] = VPD
    cap 05[58] = MSI supports 16 messages, 64 bit enabled with 1 message
    cap 11[a0] = MSI-X supports 9 messages
                 Table in map 0x10[0xc000], PBA in map 0x10[0xe000]
    cap 10[ac] = PCI-Express 2 endpoint max data 256(512) RO NS
                 max read 512
                 link x4(x4) speed 2.5(2.5) ASPM disabled(L0s/L1)
    ecap 0003[100] = Serial 1 d4ae52fffeba3fb3
    ecap 0001[110] = AER 1 0 fatal 0 non-fatal 1 corrected
    ecap 0004[150] = Power Budgeting 1
    ecap 0002[160] = VC 1 max VC0

bce2@pci0:2:0:0:	class=0x020000 rev=0x20 hdr=0x00 vendor=0x14e4 device=0x1639 subvendor=0x1028 subdevice=0x0235
    vendor     = 'Broadcom Inc. and subsidiaries'
    device     = 'NetXtreme II BCM5709 Gigabit Ethernet'
    class      = network
    subclass   = ethernet
    bar   [10] = type Memory, range 64, base 0xda000000, size 33554432, enabled
    cap 01[48] = powerspec 3  supports D0 D3  current D0
    cap 03[50] = VPD
    cap 05[58] = MSI supports 16 messages, 64 bit enabled with 1 message
    cap 11[a0] = MSI-X supports 9 messages
                 Table in map 0x10[0xc000], PBA in map 0x10[0xe000]
    cap 10[ac] = PCI-Express 2 endpoint max data 256(512) RO NS
                 max read 512
                 link x4(x4) speed 2.5(2.5) ASPM disabled(L0s/L1)
    ecap 0003[100] = Serial 1 d4ae52fffeba3fb5
    ecap 0001[110] = AER 1 0 fatal 0 non-fatal 1 corrected
    ecap 0004[150] = Power Budgeting 1
    ecap 0002[160] = VC 1 max VC0

bce3@pci0:2:0:1:	class=0x020000 rev=0x20 hdr=0x00 vendor=0x14e4 device=0x1639 subvendor=0x1028 subdevice=0x0235
    vendor     = 'Broadcom Inc. and subsidiaries'
    device     = 'NetXtreme II BCM5709 Gigabit Ethernet'
    class      = network
    subclass   = ethernet
    bar   [10] = type Memory, range 64, base 0xdc000000, size 33554432, enabled
    cap 01[48] = powerspec 3  supports D0 D3  current D0
    cap 03[50] = VPD
    cap 05[58] = MSI supports 16 messages, 64 bit enabled with 1 message
    cap 11[a0] = MSI-X supports 9 messages
                 Table in map 0x10[0xc000], PBA in map 0x10[0xe000]
    cap 10[ac] = PCI-Express 2 endpoint max data 256(512) RO NS
                 max read 512
                 link x4(x4) speed 2.5(2.5) ASPM disabled(L0s/L1)
    ecap 0003[100] = Serial 1 d4ae52fffeba3fb7
    ecap 0001[110] = AER 1 0 fatal 0 non-fatal 1 corrected
    ecap 0004[150] = Power Budgeting 1
    ecap 0002[160] = VC 1 max VC0

mfi0@pci0:3:0:0:	class=0x010400 rev=0x05 hdr=0x00 vendor=0x1000 device=0x0079 subvendor=0x1028 subdevice=0x1f17
    vendor     = 'Broadcom / LSI'
    device     = 'MegaRAID SAS 2108 [Liberator]'
    class      = mass storage
    subclass   = RAID
    bar   [10] = type I/O Port, range 32, base 0xfc00, size 256, enabled
    bar   [14] = type Memory, range 64, base 0xdf1bc000, size 16384, enabled
    bar   [1c] = type Memory, range 64, base 0xdf1c0000, size 262144, enabled
    cap 01[50] = powerspec 3  supports D0 D1 D2 D3  current D0
    cap 10[68] = PCI-Express 2 endpoint max data 256(4096) FLR RO NS
                 max read 512
                 link x4(x8) speed 5.0(5.0) ASPM disabled(L0s)
    cap 03[d0] = VPD
    cap 05[a8] = MSI supports 1 message, 64 bit enabled with 1 message
    cap 11[c0] = MSI-X supports 15 messages
                 Table in map 0x14[0x2000], PBA in map 0x14[0x3800]
    ecap 0001[100] = AER 1 0 fatal 0 non-fatal 0 corrected
    ecap 0004[138] = Power Budgeting 1

mps0@pci0:4:0:0:	class=0x010700 rev=0x03 hdr=0x00 vendor=0x1000 device=0x0072 subvendor=0x1028 subdevice=0x1f1e
    vendor     = 'Broadcom / LSI'
    device     = 'SAS2008 PCI-Express Fusion-MPT SAS-2 [Falcon]'
    class      = mass storage
    subclass   = SAS
    bar   [10] = type I/O Port, range 32, base 0xec00, size 256, enabled
    bar   [14] = type Memory, range 64, base 0xdf3b0000, size 65536, enabled
    bar   [1c] = type Memory, range 64, base 0xdf3c0000, size 262144, enabled
    cap 01[50] = powerspec 3  supports D0 D1 D2 D3  current D0
    cap 10[68] = PCI-Express 2 endpoint max data 256(4096) FLR RO NS
                 max read 512
                 link x4(x8) speed 5.0(5.0) ASPM disabled(L0s)
    cap 03[d0] = VPD
    cap 05[a8] = MSI supports 1 message, 64 bit 
    cap 11[c0] = MSI-X supports 15 messages, enabled
                 Table in map 0x14[0xe000], PBA in map 0x14[0xf800]
    ecap 0001[100] = AER 1 0 fatal 0 non-fatal 0 corrected
    ecap 0004[138] = Power Budgeting 1

ql0@pci0:5:0:0:	class=0x020000 rev=0x58 hdr=0x00 vendor=0x1077 device=0x8020 subvendor=0x1077 subdevice=0x0228
    vendor     = 'QLogic Corp.'
    device     = 'cLOM8214 1/10GbE Controller'
    class      = network
    subclass   = ethernet
    bar   [10] = type Prefetchable Memory, range 64, base 0xd5800000, size 2097152, enabled
    bar   [20] = type Memory, range 64, base 0xdf4e0000, size 65536, enabled
    cap 11[40] = MSI-X supports 32 messages, enabled
                 Table in map 0x10[0x90000], PBA in map 0x10[0x90800]
    cap 01[80] = powerspec 3  supports D0 D3  current D0
    cap 03[88] = VPD
    cap 05[a0] = MSI supports 32 messages, 64 bit 
    cap 10[c0] = PCI-Express 2 endpoint max data 128(128) FLR
                 max read 256
                 link x4(x8) speed 5.0(5.0)
    ecap 0001[100] = AER 1 0 fatal 0 non-fatal 1 corrected
    ecap 0003[140] = Serial 1 fe0a5598000e1eff

ql1@pci0:5:0:1:	class=0x020000 rev=0x58 hdr=0x00 vendor=0x1077 device=0x8020 subvendor=0x1077 subdevice=0x0228
    vendor     = 'QLogic Corp.'
    device     = 'cLOM8214 1/10GbE Controller'
    class      = network
    subclass   = ethernet
    bar   [10] = type Prefetchable Memory, range 64, base 0xd5a00000, size 2097152, enabled
    bar   [20] = type Memory, range 64, base 0xdf4f0000, size 65536, enabled
    cap 11[40] = MSI-X supports 32 messages, enabled
                 Table in map 0x10[0x91000], PBA in map 0x10[0x91800]
    cap 01[80] = powerspec 3  supports D0 D3  current D0
    cap 03[88] = VPD
    cap 05[a0] = MSI supports 32 messages, 64 bit 
    cap 10[c0] = PCI-Express 2 endpoint max data 128(128) FLR
                 max read 256
                 link x4(x8) speed 5.0(5.0)
    ecap 0001[100] = AER 1 0 fatal 0 non-fatal 1 corrected
    ecap 0003[140] = Serial 1 fe0a5598000e1eff

vgapci0@pci0:8:3:0:	class=0x030000 rev=0x0a hdr=0x00 vendor=0x102b device=0x0532 subvendor=0x1028 subdevice=0x0235
    vendor     = 'Matrox Electronics Systems Ltd.'
    device     = 'MGA G200eW WPCM450'
    class      = display
    subclass   = VGA
    bar   [10] = type Prefetchable Memory, range 32, base 0xd5000000, size 8388608, enabled
    bar   [14] = type Memory, range 32, base 0xde7fc000, size 16384, enabled
    bar   [18] = type Memory, range 32, base 0xde800000, size 8388608, enabled
    cap 01[dc] = powerspec 1  supports D0 D3  current D0
