hostb0@pci0:0:0:0:	class=0x060000 rev=0x00 hdr=0x00 vendor=0x1022 device=0x1450 subvendor=0x1043 subdevice=0x8747
    vendor     = 'Advanced Micro Devices, Inc. [AMD]'
    device     = 'Family 17h (Models 00h-0fh) Root Complex'
    class      = bridge
    subclass   = HOST-PCI

none0@pci0:0:0:2:	class=0x080600 rev=0x00 hdr=0x00 vendor=0x1022 device=0x1451 subvendor=0x1043 subdevice=0x8747
    vendor     = 'Advanced Micro Devices, Inc. [AMD]'
    device     = 'Family 17h (Models 00h-0fh) I/O Memory Management Unit'
    class      = base peripheral
    subclass   = IOMMU
    cap 0f[40] = unknown
    cap 05[64] = MSI supports 4 messages, 64 bit 
    cap 08[74] = HT MSI fixed address window enabled at 0xfee00000

hostb1@pci0:0:1:0:	class=0x060000 rev=0x00 hdr=0x00 vendor=0x1022 device=0x1452 subvendor=0x0000 subdevice=0x0000
    vendor     = 'Advanced Micro Devices, Inc. [AMD]'
    device     = 'Family 17h (Models 00h-1fh) PCIe Dummy Host Bridge'
    class      = bridge
    subclass   = HOST-PCI

pcib1@pci0:0:1:1:	class=0x060400 rev=0x00 hdr=0x01 vendor=0x1022 device=0x1453 subvendor=0x1043 subdevice=0x8747
    vendor     = 'Advanced Micro Devices, Inc. [AMD]'
    device     = 'Family 17h (Models 00h-0fh) PCIe GPP Bridge'
    class      = bridge
    subclass   = PCI-PCI
    cap 01[50] = powerspec 3  supports D0 D3  current D0
    cap 10[58] = PCI-Express 2 root port max data 256(512) RO NS ARI enabled
                 max read 128
                 link x4(x4) speed 8.0(8.0) ASPM disabled(L1)
                 slot 0 power limit 0 mW
    cap 05[a0] = MSI supports 1 message, 64 bit 
    cap 0d[c0] = PCI Bridge subvendor=0x1043 subdevice=0x8747
    cap 08[c8] = HT MSI fixed address window enabled at 0xfee00000
    ecap 000b[100] = Vendor [1] ID 0001 Rev 1 Length 16
    ecap 0001[150] = AER 2 0 fatal 0 non-fatal 0 corrected
    ecap 0019[270] = PCIe Sec 1 lane errors 0xf
    ecap 000d[2a0] = ACS 1
    ecap 001e[370] = L1 PM Substates 1
    ecap 0023[3c4] = Designated Vendor-Specific 1

pcib2@pci0:0:1:3:	class=0x060400 rev=0x00 hdr=0x01 vendor=0x1022 device=0x1453 subvendor=0x1043 subdevice=0x8747
    vendor     = 'Advanced Micro Devices, Inc. [AMD]'
    device     = 'Family 17h (Models 00h-0fh) PCIe GPP Bridge'
    class      = bridge
    subclass   = PCI-PCI
    cap 01[50] = powerspec 3  supports D0 D3  current D0
    cap 10[58] = PCI-Express 2 root port max data 512(512) RO NS ARI disabled
                 max read 128
                 link x4(x4) speed 8.0(8.0) ASPM disabled(L1)
                 slot 0 power limit 0 mW
    cap 05[a0] = MSI supports 1 message, 64 bit 
    cap 0d[c0] = PCI Bridge subvendor=0x1043 subdevice=0x8747
    cap 08[c8] = HT MSI fixed address window enabled at 0xfee00000
    ecap 000b[100] = Vendor [1] ID 0001 Rev 1 Length 16
    ecap 0001[150] = AER 2 0 fatal 0 non-fatal 0 corrected
    ecap 0019[270] = PCIe Sec 1 lane errors 0xf
    ecap 000d[2a0] = ACS 1
    ecap 001e[370] = L1 PM Substates 1
    ecap 0023[3c4] = Designated Vendor-Specific 1

hostb2@pci0:0:2:0:	class=0x060000 rev=0x00 hdr=0x00 vendor=0x1022 device=0x1452 subvendor=0x0000 subdevice=0x0000
    vendor     = 'Advanced Micro Devices, Inc. [AMD]'
    device     = 'Family 17h (Models 00h-1fh) PCIe Dummy Host Bridge'
    class      = bridge
    subclass   = HOST-PCI

hostb3@pci0:0:3:0:	class=0x060000 rev=0x00 hdr=0x00 vendor=0x1022 device=0x1452 subvendor=0x0000 subdevice=0x0000
    vendor     = 'Advanced Micro Devices, Inc. [AMD]'
    device     = 'Family 17h (Models 00h-1fh) PCIe Dummy Host Bridge'
    class      = bridge
    subclass   = HOST-PCI

pcib9@pci0:0:3:1:	class=0x060400 rev=0x00 hdr=0x01 vendor=0x1022 device=0x1453 subvendor=0x1043 subdevice=0x8747
    vendor     = 'Advanced Micro Devices, Inc. [AMD]'
    device     = 'Family 17h (Models 00h-0fh) PCIe GPP Bridge'
    class      = bridge
    subclass   = PCI-PCI
    cap 01[50] = powerspec 3  supports D0 D3  current D0
    cap 10[58] = PCI-Express 2 root port max data 256(512) RO NS ARI enabled
                 max read 128
                 link x8(x8) speed 2.5(8.0) ASPM disabled(L1)
                 slot 0 power limit 0 mW
    cap 05[a0] = MSI supports 1 message, 64 bit 
    cap 0d[c0] = PCI Bridge subvendor=0x1043 subdevice=0x8747
    cap 08[c8] = HT MSI fixed address window enabled at 0xfee00000
    ecap 000b[100] = Vendor [1] ID 0001 Rev 1 Length 16
    ecap 0001[150] = AER 2 0 fatal 0 non-fatal 1 corrected
    ecap 0019[270] = PCIe Sec 1 lane errors 0xff
    ecap 000d[2a0] = ACS 1
    ecap 001e[370] = L1 PM Substates 1
    ecap 0023[3c4] = Designated Vendor-Specific 1

pcib10@pci0:0:3:4:	class=0x060400 rev=0x00 hdr=0x01 vendor=0x1022 device=0x1453 subvendor=0x1043 subdevice=0x8747
    vendor     = 'Advanced Micro Devices, Inc. [AMD]'
    device     = 'Family 17h (Models 00h-0fh) PCIe GPP Bridge'
    class      = bridge
    subclass   = PCI-PCI
    cap 01[50] = powerspec 3  supports D0 D3  current D0
    cap 10[58] = PCI-Express 2 root port max data 512(512) RO NS ARI disabled
                 max read 128
                 link x4(x4) speed 8.0(8.0) ASPM disabled(L1)
                 slot 0 power limit 0 mW
    cap 05[a0] = MSI supports 1 message, 64 bit 
    cap 0d[c0] = PCI Bridge subvendor=0x1043 subdevice=0x8747
    cap 08[c8] = HT MSI fixed address window enabled at 0xfee00000
    ecap 000b[100] = Vendor [1] ID 0001 Rev 1 Length 16
    ecap 0001[150] = AER 2 0 fatal 0 non-fatal 0 corrected
    ecap 0019[270] = PCIe Sec 1 lane errors 0xf
    ecap 000d[2a0] = ACS 1
    ecap 001e[370] = L1 PM Substates 1
    ecap 0023[3c4] = Designated Vendor-Specific 1

hostb4@pci0:0:4:0:	class=0x060000 rev=0x00 hdr=0x00 vendor=0x1022 device=0x1452 subvendor=0x0000 subdevice=0x0000
    vendor     = 'Advanced Micro Devices, Inc. [AMD]'
    device     = 'Family 17h (Models 00h-1fh) PCIe Dummy Host Bridge'
    class      = bridge
    subclass   = HOST-PCI

hostb5@pci0:0:7:0:	class=0x060000 rev=0x00 hdr=0x00 vendor=0x1022 device=0x1452 subvendor=0x0000 subdevice=0x0000
    vendor     = 'Advanced Micro Devices, Inc. [AMD]'
    device     = 'Family 17h (Models 00h-1fh) PCIe Dummy Host Bridge'
    class      = bridge
    subclass   = HOST-PCI

pcib11@pci0:0:7:1:	class=0x060400 rev=0x00 hdr=0x01 vendor=0x1022 device=0x1454 subvendor=0x1043 subdevice=0x8747
    vendor     = 'Advanced Micro Devices, Inc. [AMD]'
    device     = 'Family 17h (Models 00h-0fh) Internal PCIe GPP Bridge 0 to Bus B'
    class      = bridge
    subclass   = PCI-PCI
    cap 01[50] = powerspec 3  supports D0 D3  current D0
    cap 10[58] = PCI-Express 2 root port max data 256(512) RO NS
                 max read 512
                 link x16(x16) speed 8.0(8.0) ASPM disabled(L0s/L1)
    cap 05[a0] = MSI supports 1 message, 64 bit 
    cap 0d[c0] = PCI Bridge subvendor=0x1043 subdevice=0x8747
    cap 08[c8] = HT MSI fixed address window enabled at 0xfee00000
    ecap 000b[100] = Vendor [1] ID 0001 Rev 1 Length 16
    ecap 0001[150] = AER 2 0 fatal 0 non-fatal 0 corrected
    ecap 0019[270] = PCIe Sec 1 lane errors 0
    ecap 000d[2a0] = ACS 1

hostb6@pci0:0:8:0:	class=0x060000 rev=0x00 hdr=0x00 vendor=0x1022 device=0x1452 subvendor=0x0000 subdevice=0x0000
    vendor     = 'Advanced Micro Devices, Inc. [AMD]'
    device     = 'Family 17h (Models 00h-1fh) PCIe Dummy Host Bridge'
    class      = bridge
    subclass   = HOST-PCI

pcib12@pci0:0:8:1:	class=0x060400 rev=0x00 hdr=0x01 vendor=0x1022 device=0x1454 subvendor=0x1043 subdevice=0x8747
    vendor     = 'Advanced Micro Devices, Inc. [AMD]'
    device     = 'Family 17h (Models 00h-0fh) Internal PCIe GPP Bridge 0 to Bus B'
    class      = bridge
    subclass   = PCI-PCI
    cap 01[50] = powerspec 3  supports D0 D3  current D0
    cap 10[58] = PCI-Express 2 root port max data 256(512) RO NS
                 max read 512
                 link x16(x16) speed 8.0(8.0) ASPM disabled(L0s/L1)
    cap 05[a0] = MSI supports 1 message, 64 bit 
    cap 0d[c0] = PCI Bridge subvendor=0x1043 subdevice=0x8747
    cap 08[c8] = HT MSI fixed address window enabled at 0xfee00000
    ecap 000b[100] = Vendor [1] ID 0001 Rev 1 Length 16
    ecap 0001[150] = AER 2 0 fatal 0 non-fatal 0 corrected
    ecap 0019[270] = PCIe Sec 1 lane errors 0
    ecap 000d[2a0] = ACS 1

intsmb0@pci0:0:20:0:	class=0x0c0500 rev=0x59 hdr=0x00 vendor=0x1022 device=0x790b subvendor=0x1043 subdevice=0x8747
    vendor     = 'Advanced Micro Devices, Inc. [AMD]'
    device     = 'FCH SMBus Controller'
    class      = serial bus
    subclass   = SMBus

isab0@pci0:0:20:3:	class=0x060100 rev=0x51 hdr=0x00 vendor=0x1022 device=0x790e subvendor=0x1043 subdevice=0x8747
    vendor     = 'Advanced Micro Devices, Inc. [AMD]'
    device     = 'FCH LPC Bridge'
    class      = bridge
    subclass   = PCI-ISA

hostb7@pci0:0:24:0:	class=0x060000 rev=0x00 hdr=0x00 vendor=0x1022 device=0x1460 subvendor=0x0000 subdevice=0x0000
    vendor     = 'Advanced Micro Devices, Inc. [AMD]'
    device     = 'Family 17h (Models 00h-0fh) Data Fabric: Device 18h; Function 0'
    class      = bridge
    subclass   = HOST-PCI

hostb8@pci0:0:24:1:	class=0x060000 rev=0x00 hdr=0x00 vendor=0x1022 device=0x1461 subvendor=0x0000 subdevice=0x0000
    vendor     = 'Advanced Micro Devices, Inc. [AMD]'
    device     = 'Family 17h (Models 00h-0fh) Data Fabric: Device 18h; Function 1'
    class      = bridge
    subclass   = HOST-PCI

hostb9@pci0:0:24:2:	class=0x060000 rev=0x00 hdr=0x00 vendor=0x1022 device=0x1462 subvendor=0x0000 subdevice=0x0000
    vendor     = 'Advanced Micro Devices, Inc. [AMD]'
    device     = 'Family 17h (Models 00h-0fh) Data Fabric: Device 18h; Function 2'
    class      = bridge
    subclass   = HOST-PCI

hostb10@pci0:0:24:3:	class=0x060000 rev=0x00 hdr=0x00 vendor=0x1022 device=0x1463 subvendor=0x0000 subdevice=0x0000
    vendor     = 'Advanced Micro Devices, Inc. [AMD]'
    device     = 'Family 17h (Models 00h-0fh) Data Fabric: Device 18h; Function 3'
    class      = bridge
    subclass   = HOST-PCI

hostb11@pci0:0:24:4:	class=0x060000 rev=0x00 hdr=0x00 vendor=0x1022 device=0x1464 subvendor=0x0000 subdevice=0x0000
    vendor     = 'Advanced Micro Devices, Inc. [AMD]'
    device     = 'Family 17h (Models 00h-0fh) Data Fabric: Device 18h; Function 4'
    class      = bridge
    subclass   = HOST-PCI

hostb12@pci0:0:24:5:	class=0x060000 rev=0x00 hdr=0x00 vendor=0x1022 device=0x1465 subvendor=0x0000 subdevice=0x0000
    vendor     = 'Advanced Micro Devices, Inc. [AMD]'
    device     = 'Family 17h (Models 00h-0fh) Data Fabric: Device 18h; Function 5'
    class      = bridge
    subclass   = HOST-PCI

hostb13@pci0:0:24:6:	class=0x060000 rev=0x00 hdr=0x00 vendor=0x1022 device=0x1466 subvendor=0x0000 subdevice=0x0000
    vendor     = 'Advanced Micro Devices, Inc. [AMD]'
    device     = 'Family 17h (Models 00h-0fh) Data Fabric: Device 18h; Function 6'
    class      = bridge
    subclass   = HOST-PCI

hostb14@pci0:0:24:7:	class=0x060000 rev=0x00 hdr=0x00 vendor=0x1022 device=0x1467 subvendor=0x0000 subdevice=0x0000
    vendor     = 'Advanced Micro Devices, Inc. [AMD]'
    device     = 'Family 17h (Models 00h-0fh) Data Fabric: Device 18h; Function 7'
    class      = bridge
    subclass   = HOST-PCI

nvme0@pci0:1:0:0:	class=0x010802 rev=0x00 hdr=0x00 vendor=0x144d device=0xa80a subvendor=0x144d subdevice=0xa801
    vendor     = 'Samsung Electronics Co Ltd'
    device     = 'NVMe SSD Controller PM9A1/PM9A3/980PRO'
    class      = mass storage
    subclass   = NVM
    bar   [10] = type Memory, range 64, base 0xfcf00000, size 16384, enabled
    cap 01[40] = powerspec 3  supports D0 D3  current D0
    cap 05[50] = MSI supports 32 messages, 64 bit 
    cap 10[70] = PCI-Express 2 endpoint max data 256(256) FLR RO NS
                 max read 512
                 link x4(x4) speed 8.0(16.0) ASPM disabled(L1) ClockPM disabled
    cap 11[b0] = MSI-X supports 130 messages, enabled
                 Table in map 0x10[0x3000], PBA in map 0x10[0x2000]
    ecap 0001[100] = AER 2 0 fatal 0 non-fatal 0 corrected
    ecap 000e[168] = ARI 1
    ecap 0019[178] = PCIe Sec 1 lane errors 0
    ecap 0026[198] = Physical Layer 16.0 GT/s 1
    ecap 0027[1bc] = Lane Margining at Receiver 1
    ecap 0018[214] = LTR 1
    ecap 001e[21c] = L1 PM Substates 1
    ecap 0025[3a0] = Data Link Feature 1

xhci0@pci0:2:0:0:	class=0x0c0330 rev=0x01 hdr=0x00 vendor=0x1022 device=0x43d5 subvendor=0x1b21 subdevice=0x1142
    vendor     = 'Advanced Micro Devices, Inc. [AMD]'
    device     = '400 Series Chipset USB 3.1 XHCI Controller'
    class      = serial bus
    subclass   = USB
    bar   [10] = type Memory, range 64, base 0xfcb00000, size 32768, enabled
    cap 05[50] = MSI supports 8 messages, 64 bit 
    cap 11[68] = MSI-X supports 8 messages, enabled
                 Table in map 0x10[0x2000], PBA in map 0x10[0x2080]
    cap 01[78] = powerspec 3  supports D0 D3  current D0
    cap 10[80] = PCI-Express 2 legacy endpoint max data 512(512) RO NS
                 max read 512
                 link x4(x4) speed 8.0(8.0) ASPM disabled(L0s/L1)
    ecap 0001[100] = AER 1 0 fatal 0 non-fatal 1 corrected
    ecap 0019[200] = PCIe Sec 1 lane errors 0
    ecap 0018[300] = LTR 1
    ecap 001e[400] = L1 PM Substates 1

pcib3@pci0:2:0:2:	class=0x060400 rev=0x01 hdr=0x01 vendor=0x1022 device=0x43c6 subvendor=0x1b21 subdevice=0x0201
    vendor     = 'Advanced Micro Devices, Inc. [AMD]'
    device     = '400 Series Chipset PCIe Bridge'
    class      = bridge
    subclass   = PCI-PCI
    cap 05[50] = MSI supports 1 message, 64 bit 
    cap 01[78] = powerspec 3  supports D0 D3  current D0
    cap 10[80] = PCI-Express 2 upstream port max data 512(512) RO NS
                 max read 512
                 link x4(x4) speed 8.0(8.0) ASPM disabled(L0s/L1)
    cap 0d[c0] = PCI Bridge subvendor=0x1b21 subdevice=0x0201
    ecap 0001[100] = AER 1 0 fatal 0 non-fatal 1 corrected

pcib4@pci0:3:0:0:	class=0x060400 rev=0x01 hdr=0x01 vendor=0x1022 device=0x43c7 subvendor=0x1b21 subdevice=0x3306
    vendor     = 'Advanced Micro Devices, Inc. [AMD]'
    device     = '400 Series Chipset PCIe Port'
    class      = bridge
    subclass   = PCI-PCI
    cap 05[50] = MSI supports 1 message, 64 bit 
    cap 01[78] = powerspec 3  supports D0 D3  current D0
    cap 10[80] = PCI-Express 2 downstream port max data 512(512) RO NS
                 max read 512
                 link x1(x1) speed 2.5(5.0) ASPM disabled(L0s/L1)
                 slot 1 power limit 26000 mW
    cap 0d[c0] = PCI Bridge subvendor=0x1b21 subdevice=0x3306
    ecap 0001[100] = AER 1 0 fatal 0 non-fatal 0 corrected
    ecap 0019[200] = PCIe Sec 1 lane errors 0
    ecap 001e[400] = L1 PM Substates 1

pcib5@pci0:3:1:0:	class=0x060400 rev=0x01 hdr=0x01 vendor=0x1022 device=0x43c7 subvendor=0x1b21 subdevice=0x3306
    vendor     = 'Advanced Micro Devices, Inc. [AMD]'
    device     = '400 Series Chipset PCIe Port'
    class      = bridge
    subclass   = PCI-PCI
    cap 05[50] = MSI supports 1 message, 64 bit 
    cap 01[78] = powerspec 3  supports D0 D3  current D0
    cap 10[80] = PCI-Express 2 downstream port max data 512(512) RO NS
                 max read 512
                 link x1(x1) speed 2.5(5.0) ASPM disabled(L0s/L1)
                 slot 1 power limit 26000 mW
    cap 0d[c0] = PCI Bridge subvendor=0x1b21 subdevice=0x3306
    ecap 0001[100] = AER 1 0 fatal 0 non-fatal 0 corrected
    ecap 0019[200] = PCIe Sec 1 lane errors 0
    ecap 001e[400] = L1 PM Substates 1

pcib6@pci0:3:4:0:	class=0x060400 rev=0x01 hdr=0x01 vendor=0x1022 device=0x43c7 subvendor=0x1b21 subdevice=0x3306
    vendor     = 'Advanced Micro Devices, Inc. [AMD]'
    device     = '400 Series Chipset PCIe Port'
    class      = bridge
    subclass   = PCI-PCI
    cap 05[50] = MSI supports 1 message, 64 bit 
    cap 01[78] = powerspec 3  supports D0 D3  current D0
    cap 10[80] = PCI-Express 2 downstream port max data 512(512) RO NS
                 max read 512
                 link x0(x2) speed 0.0(5.0) ASPM disabled(L0s/L1)
                 slot 1 power limit 26000 mW
    cap 0d[c0] = PCI Bridge subvendor=0x1b21 subdevice=0x3306
    ecap 0001[100] = AER 1 0 fatal 0 non-fatal 0 corrected
    ecap 0019[200] = PCIe Sec 1 lane errors 0
    ecap 001e[400] = L1 PM Substates 1

pcib7@pci0:3:6:0:	class=0x060400 rev=0x01 hdr=0x01 vendor=0x1022 device=0x43c7 subvendor=0x1b21 subdevice=0x3306
    vendor     = 'Advanced Micro Devices, Inc. [AMD]'
    device     = '400 Series Chipset PCIe Port'
    class      = bridge
    subclass   = PCI-PCI
    cap 05[50] = MSI supports 1 message, 64 bit 
    cap 01[78] = powerspec 3  supports D0 D3  current D0
    cap 10[80] = PCI-Express 2 downstream port max data 512(512) RO NS
                 max read 512
                 link x1(x1) speed 2.5(5.0) ASPM disabled(L0s/L1)
                 slot 1 power limit 26000 mW
    cap 0d[c0] = PCI Bridge subvendor=0x1b21 subdevice=0x3306
    ecap 0001[100] = AER 1 0 fatal 0 non-fatal 0 corrected
    ecap 0019[200] = PCIe Sec 1 lane errors 0
    ecap 001e[400] = L1 PM Substates 1

pcib8@pci0:3:7:0:	class=0x060400 rev=0x01 hdr=0x01 vendor=0x1022 device=0x43c7 subvendor=0x1b21 subdevice=0x3306
    vendor     = 'Advanced Micro Devices, Inc. [AMD]'
    device     = '400 Series Chipset PCIe Port'
    class      = bridge
    subclass   = PCI-PCI
    cap 05[50] = MSI supports 1 message, 64 bit 
    cap 01[78] = powerspec 3  supports D0 D3  current D0
    cap 10[80] = PCI-Express 2 downstream port max data 512(512) RO NS
                 max read 512
                 link x1(x1) speed 2.5(5.0) ASPM disabled(L0s/L1)
                 slot 1 power limit 26000 mW
    cap 0d[c0] = PCI Bridge subvendor=0x1b21 subdevice=0x3306
    ecap 0001[100] = AER 1 0 fatal 0 non-fatal 0 corrected
    ecap 0019[200] = PCIe Sec 1 lane errors 0
    ecap 001e[400] = L1 PM Substates 1

igb0@pci0:4:0:0:	class=0x020000 rev=0x03 hdr=0x00 vendor=0x8086 device=0x1539 subvendor=0x1043 subdevice=0x85f0
    vendor     = 'Intel Corporation'
    device     = 'I211 Gigabit Network Connection'
    class      = network
    subclass   = ethernet
    bar   [10] = type Memory, range 32, base 0xfca00000, size 131072, enabled
    bar   [18] = type I/O Port, range 32, base 0xe000, size 32, enabled
    bar   [1c] = type Memory, range 32, base 0xfca20000, size 16384, enabled
    cap 01[40] = powerspec 3  supports D0 D3  current D0
    cap 05[50] = MSI supports 1 message, 64 bit, vector masks 
    cap 11[70] = MSI-X supports 5 messages, enabled
                 Table in map 0x1c[0x0], PBA in map 0x1c[0x2000]
    cap 10[a0] = PCI-Express 2 endpoint max data 512(512) FLR RO NS
                 max read 512
                 link x1(x1) speed 2.5(2.5) ASPM disabled(L0s/L1)
    ecap 0001[100] = AER 2 0 fatal 0 non-fatal 0 corrected
    ecap 0003[140] = Serial 1 d45d64ffff51e7d2
    ecap 0017[1a0] = TPH Requester 1

vgapci0@pci0:9:0:0:	class=0x030000 rev=0xef hdr=0x00 vendor=0x1002 device=0x67df subvendor=0x1682 subdevice=0xc570
    vendor     = 'Advanced Micro Devices, Inc. [AMD/ATI]'
    device     = 'Ellesmere [Radeon RX 470/480/570/570X/580/580X/590]'
    class      = display
    subclass   = VGA
    bar   [10] = type Prefetchable Memory, range 64, base 0xd0000000, size 268435456, enabled
    bar   [18] = type Prefetchable Memory, range 64, base 0xe0000000, size 2097152, enabled
    bar   [20] = type I/O Port, range 32, base 0xd000, size 256, enabled
    bar   [24] = type Memory, range 32, base 0xfce00000, size 262144, enabled
    cap 09[48] = vendor (length 8)
    cap 01[50] = powerspec 3  supports D0 D1 D2 D3  current D0
    cap 10[58] = PCI-Express 2 legacy endpoint max data 256(256) RO NS
                 max read 512
                 link x8(x16) speed 2.5(8.0) ASPM disabled(L1)
    cap 05[a0] = MSI supports 1 message, 64 bit enabled with 1 message
    ecap 000b[100] = Vendor [1] ID 0001 Rev 1 Length 16
    ecap 0001[150] = AER 2 0 fatal 1 non-fatal 1 corrected
    ecap 0015[200] = Resizable BAR 1
    ecap 0019[270] = PCIe Sec 1 lane errors 0
    ecap 000f[2b0] = ATS 1
    ecap 0013[2c0] = Page Page Request 1
    ecap 001b[2d0] = Process Address Space ID 1
    ecap 0018[320] = LTR 1
    ecap 000e[328] = ARI 1
    ecap 001e[370] = L1 PM Substates 1

hdac0@pci0:9:0:1:	class=0x040300 rev=0x00 hdr=0x00 vendor=0x1002 device=0xaaf0 subvendor=0x1682 subdevice=0xaaf0
    vendor     = 'Advanced Micro Devices, Inc. [AMD/ATI]'
    device     = 'Ellesmere HDMI Audio [Radeon RX 470/480 / 570/580/590]'
    class      = multimedia
    subclass   = HDA
    bar   [10] = type Memory, range 64, base 0xfce60000, size 16384, enabled
    cap 09[48] = vendor (length 8)
    cap 01[50] = powerspec 3  supports D0 D1 D2 D3  current D0
    cap 10[58] = PCI-Express 2 legacy endpoint max data 256(256) RO NS
                 max read 512
                 link x8(x16) speed 2.5(8.0) ASPM disabled(L1)
    cap 05[a0] = MSI supports 1 message, 64 bit enabled with 1 message
    ecap 000b[100] = Vendor [1] ID 0001 Rev 1 Length 16
    ecap 0001[150] = AER 2 0 fatal 1 non-fatal 1 corrected
    ecap 000e[328] = ARI 1

nvme1@pci0:10:0:0:	class=0x010802 rev=0x01 hdr=0x00 vendor=0x15b7 device=0x5009 subvendor=0x15b7 subdevice=0x5009
    vendor     = 'Sandisk Corp'
    device     = 'WD Blue SN550 NVMe SSD'
    class      = mass storage
    subclass   = NVM
    bar   [10] = type Memory, range 64, base 0xfcd00000, size 16384, enabled
    bar   [20] = type Memory, range 64, base 0xfcd04000, size 256, enabled
    cap 01[80] = powerspec 3  supports D0 D3  current D0
    cap 05[90] = MSI supports 32 messages, 64 bit 
    cap 11[b0] = MSI-X supports 17 messages, enabled
                 Table in map 0x10[0x2000], PBA in map 0x20[0x0]
    cap 10[c0] = PCI-Express 2 endpoint max data 512(512) FLR RO NS
                 max read 512
                 link x4(x4) speed 8.0(8.0) ASPM disabled(L1) ClockPM disabled
    ecap 0001[100] = AER 2 0 fatal 0 non-fatal 0 corrected
    ecap 0003[150] = Serial 1 0000000000000000
    ecap 0018[1b8] = LTR 1
    ecap 0019[300] = PCIe Sec 1 lane errors 0
    ecap 001e[900] = L1 PM Substates 1

none1@pci0:11:0:0:	class=0x130000 rev=0x00 hdr=0x00 vendor=0x1022 device=0x145a subvendor=0x1043 subdevice=0x8747
    vendor     = 'Advanced Micro Devices, Inc. [AMD]'
    device     = 'Zeppelin/Raven/Raven2 PCIe Dummy Function'
    class      = non-essential instrumentation
    cap 09[48] = vendor (length 8)
    cap 01[50] = powerspec 3  supports D0 D3  current D0
    cap 10[64] = PCI-Express 2 endpoint max data 256(256) RO NS
                 max read 512
                 link x16(x16) speed 8.0(8.0) ASPM disabled(L0s/L1)
    ecap 000b[100] = Vendor [1] ID 0001 Rev 1 Length 16
    ecap 0001[150] = AER 2 0 fatal 0 non-fatal 1 corrected
    ecap 0019[270] = PCIe Sec 1 lane errors 0
    ecap 000d[2a0] = ACS 1

none2@pci0:11:0:2:	class=0x108000 rev=0x00 hdr=0x00 vendor=0x1022 device=0x1456 subvendor=0x1043 subdevice=0x8747
    vendor     = 'Advanced Micro Devices, Inc. [AMD]'
    device     = 'Family 17h (Models 00h-0fh) Platform Security Processor'
    class      = encrypt/decrypt
    bar   [18] = type Memory, range 32, base 0xfc800000, size 1048576, enabled
    bar   [24] = type Memory, range 32, base 0xfc900000, size 8192, enabled
    cap 09[48] = vendor (length 8)
    cap 01[50] = powerspec 3  supports D0 D3  current D0
    cap 10[64] = PCI-Express 2 endpoint max data 256(256) RO NS
                 max read 512
                 link x16(x16) speed 8.0(8.0) ASPM disabled(L0s/L1)
    cap 05[a0] = MSI supports 2 messages, 64 bit 
    cap 11[c0] = MSI-X supports 2 messages
                 Table in map 0x24[0x0], PBA in map 0x24[0x1000]
    ecap 000b[100] = Vendor [1] ID 0001 Rev 1 Length 16
    ecap 0001[150] = AER 2 0 fatal 0 non-fatal 1 corrected
    ecap 000d[2a0] = ACS 1

xhci1@pci0:11:0:3:	class=0x0c0330 rev=0x00 hdr=0x00 vendor=0x1022 device=0x145f subvendor=0x1043 subdevice=0x8747
    vendor     = 'Advanced Micro Devices, Inc. [AMD]'
    device     = 'Zeppelin USB 3.0 Host controller'
    class      = serial bus
    subclass   = USB
    bar   [10] = type Memory, range 64, base 0xfc700000, size 1048576, enabled
    cap 09[48] = vendor (length 8)
    cap 01[50] = powerspec 3  supports D0 D3  current D0
    cap 10[64] = PCI-Express 2 endpoint max data 256(256) RO NS
                 max read 512
                 link x16(x16) speed 8.0(8.0) ASPM disabled(L0s/L1)
    cap 05[a0] = MSI supports 8 messages, 64 bit 
    cap 11[c0] = MSI-X supports 8 messages, enabled
                 Table in map 0x10[0xfe000], PBA in map 0x10[0xff000]
    ecap 000b[100] = Vendor [1] ID 0001 Rev 1 Length 16
    ecap 0001[150] = AER 2 0 fatal 0 non-fatal 1 corrected
    ecap 000d[2a0] = ACS 1

none3@pci0:12:0:0:	class=0x130000 rev=0x00 hdr=0x00 vendor=0x1022 device=0x1455 subvendor=0x1043 subdevice=0x8747
    vendor     = 'Advanced Micro Devices, Inc. [AMD]'
    device     = 'Zeppelin/Renoir PCIe Dummy Function'
    class      = non-essential instrumentation
    cap 09[48] = vendor (length 8)
    cap 01[50] = powerspec 3  supports D0 D3  current D0
    cap 10[64] = PCI-Express 2 endpoint max data 256(256) RO NS
                 max read 512
                 link x16(x16) speed 8.0(8.0) ASPM disabled(L0s/L1)
    ecap 000b[100] = Vendor [1] ID 0001 Rev 1 Length 16
    ecap 0001[150] = AER 2 0 fatal 0 non-fatal 1 corrected
    ecap 0019[270] = PCIe Sec 1 lane errors 0
    ecap 000d[2a0] = ACS 1

hdac1@pci0:12:0:3:	class=0x040300 rev=0x00 hdr=0x00 vendor=0x1022 device=0x1457 subvendor=0x1043 subdevice=0x8723
    vendor     = 'Advanced Micro Devices, Inc. [AMD]'
    device     = 'Family 17h (Models 00h-0fh) HD Audio Controller'
    class      = multimedia
    subclass   = HDA
    bar   [10] = type Memory, range 32, base 0xfcc00000, size 32768, enabled
    cap 09[48] = vendor (length 8)
    cap 01[50] = powerspec 3  supports D0 D3  current D0
    cap 10[64] = PCI-Express 2 endpoint max data 256(256) RO NS
                 max read 512
                 link x16(x16) speed 8.0(8.0) ASPM disabled(L0s/L1)
    cap 05[a0] = MSI supports 1 message, 64 bit enabled with 1 message
    ecap 000b[100] = Vendor [1] ID 0001 Rev 1 Length 16
    ecap 0001[150] = AER 2 0 fatal 0 non-fatal 1 corrected
    ecap 000d[2a0] = ACS 1
