hostb0@pci0:0:0:0:	class=0x060000 rev=0x03 hdr=0x00 vendor=0x8086 device=0x2e30 subvendor=0x8086 subdevice=0x2e30
    vendor     = 'Intel Corporation'
    device     = '4 Series Chipset DRAM Controller'
    class      = bridge
    subclass   = HOST-PCI
    cap 09[e0] = vendor (length 12) Intel cap 6 version 1

pcib1@pci0:0:1:0:	class=0x060400 rev=0x03 hdr=0x01 vendor=0x8086 device=0x2e31 subvendor=0x8086 subdevice=0x2e31
    vendor     = 'Intel Corporation'
    device     = '4 Series Chipset PCI Express Root Port'
    class      = bridge
    subclass   = PCI-PCI
    cap 0d[88] = PCI Bridge subvendor=0x8086 subdevice=0x2e31
    cap 01[80] = powerspec 3  supports D0 D3  current D0
    cap 05[90] = MSI supports 1 message 
    cap 10[a0] = PCI-Express 2 root port max data 128(128)
                 max read 128
                 link x4(x16) speed 2.5(2.5) ASPM disabled(L0s/L1)
                 slot 0 power limit 10000 mW
    ecap 0002[100] = VC 1 max VC0
    ecap 0005[140] = Root Complex Link Declaration 1

vgapci0@pci0:0:2:0:	class=0x030000 rev=0x03 hdr=0x00 vendor=0x8086 device=0x2e32 subvendor=0x8086 subdevice=0x2e32
    vendor     = 'Intel Corporation'
    device     = '4 Series Chipset Integrated Graphics Controller'
    class      = display
    subclass   = VGA
    bar   [10] = type Memory, range 64, base 0xfe000000, size 4194304, enabled
    bar   [18] = type Prefetchable Memory, range 64, base 0xd0000000, size 268435456, enabled
    bar   [20] = type I/O Port, range 32, base 0x6800, size 8, enabled
    cap 05[90] = MSI supports 1 message 
    cap 01[d0] = powerspec 2  supports D0 D3  current D0
    cap 13[a4] = PCI Advanced Features: FLR TP

pcib2@pci0:0:28:0:	class=0x060400 rev=0x01 hdr=0x01 vendor=0x8086 device=0x27d0 subvendor=0x8086 subdevice=0x27d0
    vendor     = 'Intel Corporation'
    device     = 'NM10/ICH7 Family PCI Express Port 1'
    class      = bridge
    subclass   = PCI-PCI
    cap 10[40] = PCI-Express 1 root port max data 128(128)
                 max read 128
                 link x1(x1) speed 2.5(2.5) ASPM disabled(L0s/L1)
                 slot 32 power limit 10000 mW HotPlug(present) surprise
    cap 05[80] = MSI supports 1 message enabled with 1 message
    cap 0d[90] = PCI Bridge subvendor=0x8086 subdevice=0x27d0
    cap 01[a0] = powerspec 2  supports D0 D3  current D0
    ecap 0002[100] = VC 1 max VC1
    ecap 0005[180] = Root Complex Link Declaration 1

pcib3@pci0:0:28:1:	class=0x060400 rev=0x01 hdr=0x01 vendor=0x8086 device=0x27d2 subvendor=0x8086 subdevice=0x27d2
    vendor     = 'Intel Corporation'
    device     = 'NM10/ICH7 Family PCI Express Port 2'
    class      = bridge
    subclass   = PCI-PCI
    cap 10[40] = PCI-Express 1 root port max data 128(128)
                 max read 128
                 link x1(x1) speed 2.5(2.5) ASPM disabled(L0s/L1)
                 slot 33 power limit 10000 mW HotPlug(present) surprise
    cap 05[80] = MSI supports 1 message enabled with 1 message
    cap 0d[90] = PCI Bridge subvendor=0x8086 subdevice=0x27d2
    cap 01[a0] = powerspec 2  supports D0 D3  current D0
    ecap 0002[100] = VC 1 max VC1
    ecap 0005[180] = Root Complex Link Declaration 1

pcib4@pci0:0:28:2:	class=0x060400 rev=0x01 hdr=0x01 vendor=0x8086 device=0x27d4 subvendor=0x8086 subdevice=0x27d4
    vendor     = 'Intel Corporation'
    device     = 'NM10/ICH7 Family PCI Express Port 3'
    class      = bridge
    subclass   = PCI-PCI
    cap 10[40] = PCI-Express 1 root port max data 128(128)
                 max read 128
                 link x1(x1) speed 2.5(2.5) ASPM disabled(L0s/L1)
                 slot 34 power limit 10000 mW HotPlug(present) surprise
    cap 05[80] = MSI supports 1 message enabled with 1 message
    cap 0d[90] = PCI Bridge subvendor=0x8086 subdevice=0x27d4
    cap 01[a0] = powerspec 2  supports D0 D3  current D0
    ecap 0002[100] = VC 1 max VC1
    ecap 0005[180] = Root Complex Link Declaration 1

pcib5@pci0:0:28:3:	class=0x060400 rev=0x01 hdr=0x01 vendor=0x8086 device=0x27d6 subvendor=0x8086 subdevice=0x27d6
    vendor     = 'Intel Corporation'
    device     = 'NM10/ICH7 Family PCI Express Port 4'
    class      = bridge
    subclass   = PCI-PCI
    cap 10[40] = PCI-Express 1 root port max data 128(128)
                 max read 128
                 link x1(x1) speed 2.5(2.5) ASPM disabled(L0s/L1)
                 slot 35 power limit 10000 mW HotPlug(present) surprise
    cap 05[80] = MSI supports 1 message enabled with 1 message
    cap 0d[90] = PCI Bridge subvendor=0x8086 subdevice=0x27d6
    cap 01[a0] = powerspec 2  supports D0 D3  current D0
    ecap 0002[100] = VC 1 max VC1
    ecap 0005[180] = Root Complex Link Declaration 1

pcib6@pci0:0:28:4:	class=0x060400 rev=0x01 hdr=0x01 vendor=0x8086 device=0x27e0 subvendor=0x8086 subdevice=0x27e0
    vendor     = 'Intel Corporation'
    device     = '82801GR/GH/GHM (ICH7 Family) PCI Express Port 5'
    class      = bridge
    subclass   = PCI-PCI
    cap 10[40] = PCI-Express 1 root port max data 128(128)
                 max read 128
                 link x1(x1) speed 2.5(2.5) ASPM disabled(L0s/L1)
                 slot 36 power limit 10000 mW HotPlug(present) surprise
    cap 05[80] = MSI supports 1 message enabled with 1 message
    cap 0d[90] = PCI Bridge subvendor=0x8086 subdevice=0x27e0
    cap 01[a0] = powerspec 2  supports D0 D3  current D0
    ecap 0002[100] = VC 1 max VC1
    ecap 0005[180] = Root Complex Link Declaration 1

pcib7@pci0:0:28:5:	class=0x060400 rev=0x01 hdr=0x01 vendor=0x8086 device=0x27e2 subvendor=0x8086 subdevice=0x27e2
    vendor     = 'Intel Corporation'
    device     = '82801GR/GH/GHM (ICH7 Family) PCI Express Port 6'
    class      = bridge
    subclass   = PCI-PCI
    cap 10[40] = PCI-Express 1 root port max data 128(128)
                 max read 128
                 link x1(x1) speed 2.5(2.5) ASPM disabled(L0s/L1)
                 slot 37 power limit 10000 mW HotPlug(present) surprise
    cap 05[80] = MSI supports 1 message enabled with 1 message
    cap 0d[90] = PCI Bridge subvendor=0x8086 subdevice=0x27e2
    cap 01[a0] = powerspec 2  supports D0 D3  current D0
    ecap 0002[100] = VC 1 max VC1
    ecap 0005[180] = Root Complex Link Declaration 1

uhci0@pci0:0:29:0:	class=0x0c0300 rev=0x01 hdr=0x00 vendor=0x8086 device=0x27c8 subvendor=0x8086 subdevice=0x27c8
    vendor     = 'Intel Corporation'
    device     = 'NM10/ICH7 Family USB UHCI Controller'
    class      = serial bus
    subclass   = USB
    bar   [20] = type I/O Port, range 32, base 0x7080, size 32, enabled

uhci1@pci0:0:29:1:	class=0x0c0300 rev=0x01 hdr=0x00 vendor=0x8086 device=0x27c9 subvendor=0x8086 subdevice=0x27c9
    vendor     = 'Intel Corporation'
    device     = 'NM10/ICH7 Family USB UHCI Controller'
    class      = serial bus
    subclass   = USB
    bar   [20] = type I/O Port, range 32, base 0x7000, size 32, enabled

uhci2@pci0:0:29:2:	class=0x0c0300 rev=0x01 hdr=0x00 vendor=0x8086 device=0x27ca subvendor=0x8086 subdevice=0x27ca
    vendor     = 'Intel Corporation'
    device     = 'NM10/ICH7 Family USB UHCI Controller'
    class      = serial bus
    subclass   = USB
    bar   [20] = type I/O Port, range 32, base 0x6c00, size 32, enabled

uhci3@pci0:0:29:3:	class=0x0c0300 rev=0x01 hdr=0x00 vendor=0x8086 device=0x27cb subvendor=0x8086 subdevice=0x27cb
    vendor     = 'Intel Corporation'
    device     = 'NM10/ICH7 Family USB UHCI Controller'
    class      = serial bus
    subclass   = USB
    bar   [20] = type I/O Port, range 32, base 0x6880, size 32, enabled

ehci0@pci0:0:29:7:	class=0x0c0320 rev=0x01 hdr=0x00 vendor=0x8086 device=0x27cc subvendor=0x8086 subdevice=0x27cc
    vendor     = 'Intel Corporation'
    device     = 'NM10/ICH7 Family USB2 EHCI Controller'
    class      = serial bus
    subclass   = USB
    bar   [10] = type Memory, range 32, base 0xfe4ff800, size 1024, enabled
    cap 01[50] = powerspec 2  supports D0 D3  current D0
    cap 0a[58] = EHCI Debug Port at offset 0xa0 in map 0x14

pcib8@pci0:0:30:0:	class=0x060401 rev=0xe1 hdr=0x01 vendor=0x8086 device=0x244e subvendor=0x8086 subdevice=0x244e
    vendor     = 'Intel Corporation'
    device     = '82801 PCI Bridge'
    class      = bridge
    subclass   = PCI-PCI
    cap 0d[50] = PCI Bridge subvendor=0x8086 subdevice=0x244e

isab0@pci0:0:31:0:	class=0x060100 rev=0x01 hdr=0x00 vendor=0x8086 device=0x27b8 subvendor=0x8086 subdevice=0x27b8
    vendor     = 'Intel Corporation'
    device     = '82801GB/GR (ICH7 Family) LPC Interface Bridge'
    class      = bridge
    subclass   = PCI-ISA
    cap 09[e0] = vendor (length 12) Intel cap 1 version 0
		 features: Quick Resume, 4 PCI-e x1 slots

atapci0@pci0:0:31:1:	class=0x01018a rev=0x01 hdr=0x00 vendor=0x8086 device=0x27df subvendor=0x8086 subdevice=0x27df
    vendor     = 'Intel Corporation'
    device     = '82801G (ICH7 Family) IDE Controller'
    class      = mass storage
    subclass   = ATA
    bar   [20] = type I/O Port, range 32, base 0xffa0, size 16, enabled

atapci1@pci0:0:31:2:	class=0x01018f rev=0x01 hdr=0x00 vendor=0x8086 device=0x27c0 subvendor=0x8086 subdevice=0x27c0
    vendor     = 'Intel Corporation'
    device     = 'NM10/ICH7 Family SATA Controller [IDE mode]'
    class      = mass storage
    subclass   = ATA
    bar   [10] = type I/O Port, range 32, base 0x7c00, size 8, enabled
    bar   [14] = type I/O Port, range 32, base 0x7880, size 4, enabled
    bar   [18] = type I/O Port, range 32, base 0x7800, size 8, enabled
    bar   [1c] = type I/O Port, range 32, base 0x7480, size 4, enabled
    bar   [20] = type I/O Port, range 32, base 0x7400, size 16, enabled
    bar   [24] = type Memory, range 32, base 0xfe4ffc00, size 1024, enabled
    cap 01[70] = powerspec 2  supports D0 D3  current D0

ichsmb0@pci0:0:31:3:	class=0x0c0500 rev=0x01 hdr=0x00 vendor=0x8086 device=0x27da subvendor=0x8086 subdevice=0x27da
    vendor     = 'Intel Corporation'
    device     = 'NM10/ICH7 Family SMBus Controller'
    class      = serial bus
    subclass   = SMBus
    bar   [20] = type I/O Port, range 32, base 0x400, size 32, enabled

none0@pci0:8:0:0:	class=0x100000 rev=0x01 hdr=0x00 vendor=0x177d device=0x0010 subvendor=0x177d subdevice=0x0001
    vendor     = 'Cavium, Inc.'
    device     = 'CN15XX/CN16XX [Nitrox PX]'
    class      = encrypt/decrypt
    subclass   = network/computer crypto
    bar   [10] = type Prefetchable Memory, range 64, base 0xfdfff000, size 4096, enabled
    cap 01[40] = powerspec 3  supports D0 D3  current D0
    cap 05[50] = MSI supports 1 message, 64 bit 
    cap 10[70] = PCI-Express 1 endpoint max data 128(256) RO NS
                 max read 512
                 link x4(x4) speed 2.5(2.5) ASPM disabled(L0s/L1)
    ecap 0001[100] = AER 1 0 fatal 0 non-fatal 1 corrected

em0@pci0:2:0:0:	class=0x020000 rev=0x00 hdr=0x00 vendor=0x8086 device=0x10d3 subvendor=0x8086 subdevice=0x0000
    vendor     = 'Intel Corporation'
    device     = '82574L Gigabit Network Connection'
    class      = network
    subclass   = ethernet
    bar   [10] = type Memory, range 32, base 0xfe6e0000, size 131072, enabled
    bar   [18] = type I/O Port, range 32, base 0x9c00, size 32, enabled
    bar   [1c] = type Memory, range 32, base 0xfe6dc000, size 16384, enabled
    cap 01[c8] = powerspec 2  supports D0 D3  current D0
    cap 05[d0] = MSI supports 1 message, 64 bit 
    cap 10[e0] = PCI-Express 1 endpoint max data 128(256) RO NS
                 max read 512
                 link x1(x1) speed 2.5(2.5) ASPM disabled(L0s/L1)
    cap 11[a0] = MSI-X supports 5 messages, enabled
                 Table in map 0x1c[0x0], PBA in map 0x1c[0x2000]
    ecap 0001[100] = AER 1 0 fatal 0 non-fatal 1 corrected
    ecap 0003[140] = Serial 1 00907fffff97d811

em1@pci0:3:0:0:	class=0x020000 rev=0x00 hdr=0x00 vendor=0x8086 device=0x10d3 subvendor=0x8086 subdevice=0x0000
    vendor     = 'Intel Corporation'
    device     = '82574L Gigabit Network Connection'
    class      = network
    subclass   = ethernet
    bar   [10] = type Memory, range 32, base 0xfe7e0000, size 131072, enabled
    bar   [18] = type I/O Port, range 32, base 0xac00, size 32, enabled
    bar   [1c] = type Memory, range 32, base 0xfe7dc000, size 16384, enabled
    cap 01[c8] = powerspec 2  supports D0 D3  current D0
    cap 05[d0] = MSI supports 1 message, 64 bit 
    cap 10[e0] = PCI-Express 1 endpoint max data 128(256) RO NS
                 max read 512
                 link x1(x1) speed 2.5(2.5) ASPM disabled(L0s/L1)
    cap 11[a0] = MSI-X supports 5 messages, enabled
                 Table in map 0x1c[0x0], PBA in map 0x1c[0x2000]
    ecap 0001[100] = AER 1 0 fatal 0 non-fatal 1 corrected
    ecap 0003[140] = Serial 1 00907fffff97d812

em2@pci0:4:0:0:	class=0x020000 rev=0x00 hdr=0x00 vendor=0x8086 device=0x10d3 subvendor=0x8086 subdevice=0x0000
    vendor     = 'Intel Corporation'
    device     = '82574L Gigabit Network Connection'
    class      = network
    subclass   = ethernet
    bar   [10] = type Memory, range 32, base 0xfe8e0000, size 131072, enabled
    bar   [18] = type I/O Port, range 32, base 0xbc00, size 32, enabled
    bar   [1c] = type Memory, range 32, base 0xfe8dc000, size 16384, enabled
    cap 01[c8] = powerspec 2  supports D0 D3  current D0
    cap 05[d0] = MSI supports 1 message, 64 bit 
    cap 10[e0] = PCI-Express 1 endpoint max data 128(256) RO NS
                 max read 512
                 link x1(x1) speed 2.5(2.5) ASPM disabled(L0s/L1)
    cap 11[a0] = MSI-X supports 5 messages, enabled
                 Table in map 0x1c[0x0], PBA in map 0x1c[0x2000]
    ecap 0001[100] = AER 1 0 fatal 0 non-fatal 1 corrected
    ecap 0003[140] = Serial 1 00907fffff97d813

em3@pci0:5:0:0:	class=0x020000 rev=0x00 hdr=0x00 vendor=0x8086 device=0x10d3 subvendor=0x8086 subdevice=0x0000
    vendor     = 'Intel Corporation'
    device     = '82574L Gigabit Network Connection'
    class      = network
    subclass   = ethernet
    bar   [10] = type Memory, range 32, base 0xfe9e0000, size 131072, enabled
    bar   [18] = type I/O Port, range 32, base 0xcc00, size 32, enabled
    bar   [1c] = type Memory, range 32, base 0xfe9dc000, size 16384, enabled
    cap 01[c8] = powerspec 2  supports D0 D3  current D0
    cap 05[d0] = MSI supports 1 message, 64 bit 
    cap 10[e0] = PCI-Express 1 endpoint max data 128(256) RO NS
                 max read 512
                 link x1(x1) speed 2.5(2.5) ASPM disabled(L0s/L1)
    cap 11[a0] = MSI-X supports 5 messages, enabled
                 Table in map 0x1c[0x0], PBA in map 0x1c[0x2000]
    ecap 0001[100] = AER 1 0 fatal 0 non-fatal 1 corrected
    ecap 0003[140] = Serial 1 00907fffff97d814

em4@pci0:6:0:0:	class=0x020000 rev=0x00 hdr=0x00 vendor=0x8086 device=0x10d3 subvendor=0x8086 subdevice=0x0000
    vendor     = 'Intel Corporation'
    device     = '82574L Gigabit Network Connection'
    class      = network
    subclass   = ethernet
    bar   [10] = type Memory, range 32, base 0xfeae0000, size 131072, enabled
    bar   [18] = type I/O Port, range 32, base 0xdc00, size 32, enabled
    bar   [1c] = type Memory, range 32, base 0xfeadc000, size 16384, enabled
    cap 01[c8] = powerspec 2  supports D0 D3  current D0
    cap 05[d0] = MSI supports 1 message, 64 bit 
    cap 10[e0] = PCI-Express 1 endpoint max data 128(256) RO NS
                 max read 512
                 link x1(x1) speed 2.5(2.5) ASPM disabled(L0s/L1)
    cap 11[a0] = MSI-X supports 5 messages, enabled
                 Table in map 0x1c[0x0], PBA in map 0x1c[0x2000]
    ecap 0001[100] = AER 1 0 fatal 0 non-fatal 1 corrected
    ecap 0003[140] = Serial 1 00907fffff97d815

em5@pci0:7:0:0:	class=0x020000 rev=0x00 hdr=0x00 vendor=0x8086 device=0x10d3 subvendor=0x8086 subdevice=0x0000
    vendor     = 'Intel Corporation'
    device     = '82574L Gigabit Network Connection'
    class      = network
    subclass   = ethernet
    bar   [10] = type Memory, range 32, base 0xfebe0000, size 131072, enabled
    bar   [18] = type I/O Port, range 32, base 0xec00, size 32, enabled
    bar   [1c] = type Memory, range 32, base 0xfebdc000, size 16384, enabled
    cap 01[c8] = powerspec 2  supports D0 D3  current D0
    cap 05[d0] = MSI supports 1 message, 64 bit 
    cap 10[e0] = PCI-Express 1 endpoint max data 128(256) RO NS
                 max read 512
                 link x1(x1) speed 2.5(2.5) ASPM disabled(L0s/L1)
    cap 11[a0] = MSI-X supports 5 messages, enabled
                 Table in map 0x1c[0x0], PBA in map 0x1c[0x2000]
    ecap 0001[100] = AER 1 0 fatal 0 non-fatal 1 corrected
    ecap 0003[140] = Serial 1 00907fffff97d816

fxp0@pci0:1:8:0:	class=0x020000 rev=0x01 hdr=0x00 vendor=0x8086 device=0x27dc subvendor=0x8086 subdevice=0x27dc
    vendor     = 'Intel Corporation'
    device     = 'NM10/ICH7 Family LAN Controller'
    class      = network
    subclass   = ethernet
    bar   [10] = type Memory, range 32, base 0xfe5ff000, size 4096, enabled
    bar   [14] = type I/O Port, range 32, base 0x8c00, size 64, enabled
    cap 01[dc] = powerspec 2  supports D0 D1 D2 D3  current D0
