hostb0@pci0:0:0:0:	class=0x060000 card=0x01b61028 chip=0x27788086 rev=0x00 hdr=0x00
    vendor     = 'Intel Corporation'
    device     = 'E7230/3000/3010 Memory Controller Hub'
    class      = bridge
    subclass   = HOST-PCI
    cap 09[e0] = vendor (length 9) Intel cap 4 version 1

pcib1@pci0:0:1:0:	class=0x060400 card=0x01b61028 chip=0x27798086 rev=0x00 hdr=0x01
    vendor     = 'Intel Corporation'
    device     = 'E7230/3000/3010 PCI Express Root Port'
    class      = bridge
    subclass   = PCI-PCI
    cap 0d[88] = PCI Bridge card=0x01b61028
    cap 01[80] = powerspec 2  supports D0 D3  current D0
    cap 05[90] = MSI supports 1 message 
    cap 10[a0] = PCI-Express 1 root port max data 128(128)
                 link x1(x8) speed 2.5(2.5) ASPM disabled(L0s)
                 slot 2 power limit 25000 mW
    ecap 0002[100] = VC 1 max VC0
    ecap 0005[140] = Root Complex Link Declaration 1

pcib2@pci0:0:28:0:	class=0x060400 card=0x01b61028 chip=0x27d08086 rev=0x01 hdr=0x01
    vendor     = 'Intel Corporation'
    device     = 'NM10/ICH7 Family PCI Express Port 1'
    class      = bridge
    subclass   = PCI-PCI
    cap 10[40] = PCI-Express 1 root port max data 128(128)
                 link x4(x4) speed 2.5(2.5) ASPM disabled(L0s/L1)
    cap 05[80] = MSI supports 1 message 
    cap 0d[90] = PCI Bridge card=0x01b61028
    cap 01[a0] = powerspec 2  supports D0 D3  current D0
    ecap 0002[100] = VC 1 max VC1
    ecap 0005[180] = Root Complex Link Declaration 1

pcib5@pci0:0:28:4:	class=0x060400 card=0x01b61028 chip=0x27e08086 rev=0x01 hdr=0x01
    vendor     = 'Intel Corporation'
    device     = '82801GR/GH/GHM (ICH7 Family) PCI Express Port 5'
    class      = bridge
    subclass   = PCI-PCI
    cap 10[40] = PCI-Express 1 root port max data 128(128)
                 link x1(x1) speed 2.5(2.5) ASPM disabled(L0s/L1)
    cap 05[80] = MSI supports 1 message 
    cap 0d[90] = PCI Bridge card=0x01b61028
    cap 01[a0] = powerspec 2  supports D0 D3  current D0
    ecap 0002[100] = VC 1 max VC1
    ecap 0005[180] = Root Complex Link Declaration 1

pcib6@pci0:0:28:5:	class=0x060400 card=0x01b61028 chip=0x27e28086 rev=0x01 hdr=0x01
    vendor     = 'Intel Corporation'
    device     = '82801GR/GH/GHM (ICH7 Family) PCI Express Port 6'
    class      = bridge
    subclass   = PCI-PCI
    cap 10[40] = PCI-Express 1 root port max data 128(128)
                 link x1(x1) speed 2.5(2.5) ASPM disabled(L0s/L1)
    cap 05[80] = MSI supports 1 message 
    cap 0d[90] = PCI Bridge card=0x01b61028
    cap 01[a0] = powerspec 2  supports D0 D3  current D0
    ecap 0002[100] = VC 1 max VC1
    ecap 0005[180] = Root Complex Link Declaration 1

uhci0@pci0:0:29:0:	class=0x0c0300 card=0x01b61028 chip=0x27c88086 rev=0x01 hdr=0x00
    vendor     = 'Intel Corporation'
    device     = 'NM10/ICH7 Family USB UHCI Controller'
    class      = serial bus
    subclass   = USB
    bar   [20] = type I/O Port, range 32, base 0xace0, size 32, enabled

uhci1@pci0:0:29:1:	class=0x0c0300 card=0x01b61028 chip=0x27c98086 rev=0x01 hdr=0x00
    vendor     = 'Intel Corporation'
    device     = 'NM10/ICH7 Family USB UHCI Controller'
    class      = serial bus
    subclass   = USB
    bar   [20] = type I/O Port, range 32, base 0xacc0, size 32, enabled

uhci2@pci0:0:29:2:	class=0x0c0300 card=0x01b61028 chip=0x27ca8086 rev=0x01 hdr=0x00
    vendor     = 'Intel Corporation'
    device     = 'NM10/ICH7 Family USB UHCI Controller'
    class      = serial bus
    subclass   = USB
    bar   [20] = type I/O Port, range 32, base 0xaca0, size 32, enabled

ehci0@pci0:0:29:7:	class=0x0c0320 card=0x01b61028 chip=0x27cc8086 rev=0x01 hdr=0x00
    vendor     = 'Intel Corporation'
    device     = 'NM10/ICH7 Family USB2 EHCI Controller'
    class      = serial bus
    subclass   = USB
    bar   [10] = type Memory, range 32, base 0xdff00400, size 1024, enabled
    cap 01[50] = powerspec 2  supports D0 D3  current D0
    cap 0a[58] = EHCI Debug Port at offset 0xa0 in map 0x14

pcib7@pci0:0:30:0:	class=0x060401 card=0x01b61028 chip=0x244e8086 rev=0xe1 hdr=0x01
    vendor     = 'Intel Corporation'
    device     = '82801 PCI Bridge'
    class      = bridge
    subclass   = PCI-PCI
    cap 0d[50] = PCI Bridge card=0x01b61028

isab0@pci0:0:31:0:	class=0x060100 card=0x01b61028 chip=0x27b88086 rev=0x01 hdr=0x00
    vendor     = 'Intel Corporation'
    device     = '82801GB/GR (ICH7 Family) LPC Interface Bridge'
    class      = bridge
    subclass   = PCI-ISA
    cap 09[e0] = vendor (length 12) Intel cap 1 version 0
		 features: Quick Resume, 4 PCI-e x1 slots

atapci1@pci0:0:31:1:	class=0x01018a card=0x01b61028 chip=0x27df8086 rev=0x01 hdr=0x00
    vendor     = 'Intel Corporation'
    device     = '82801G (ICH7 Family) IDE Controller'
    class      = mass storage
    subclass   = ATA
    bar   [20] = type I/O Port, range 32, base 0xfc00, size 16, enabled

atapci2@pci0:0:31:2:	class=0x01018f card=0x01b61028 chip=0x27c08086 rev=0x01 hdr=0x00
    vendor     = 'Intel Corporation'
    device     = 'NM10/ICH7 Family SATA Controller [IDE mode]'
    class      = mass storage
    subclass   = ATA
    bar   [10] = type I/O Port, range 32, base 0xac98, size 8, enabled
    bar   [14] = type I/O Port, range 32, base 0xac90, size 4, enabled
    bar   [18] = type I/O Port, range 32, base 0xac80, size 8, enabled
    bar   [1c] = type I/O Port, range 32, base 0xac78, size 4, enabled
    bar   [20] = type I/O Port, range 32, base 0xac60, size 16, enabled
    bar   [24] = type Memory, range 32, base 0xdff00000, size 1024, enabled
    cap 01[70] = powerspec 2  supports D0 D3  current D0

none0@pci0:0:31:3:	class=0x0c0500 card=0x01b61028 chip=0x27da8086 rev=0x01 hdr=0x00
    vendor     = 'Intel Corporation'
    device     = 'NM10/ICH7 Family SMBus Controller'
    class      = serial bus
    subclass   = SMBus
    bar   [20] = type I/O Port, range 32, base 0x8c0, size 32, enabled

bge0@pci0:1:0:0:	class=0x020000 card=0x165914e4 chip=0x165914e4 rev=0x11 hdr=0x00
    vendor     = 'Broadcom Inc. and subsidiaries'
    device     = 'NetXtreme BCM5721 Gigabit Ethernet PCI Express'
    class      = network
    subclass   = ethernet
    bar   [10] = type Memory, range 64, base 0xdfdf0000, size 65536, enabled
    cap 01[48] = powerspec 2  supports D0 D3  current D0
    cap 03[50] = VPD
    cap 05[58] = MSI supports 8 messages, 64 bit 
    cap 10[d0] = PCI-Express 1 endpoint max data 128(128)
                 link x1(x1) speed 2.5(2.5) ASPM disabled(L0s)
    ecap 0001[100] = AER 1 0 fatal 0 non-fatal 0 corrected
    ecap 0002[13c] = VC 1 max VC0

pcib3@pci0:2:0:0:	class=0x060400 card=0x00000000 chip=0x032c8086 rev=0x09 hdr=0x01
    vendor     = 'Intel Corporation'
    device     = '6702PXH PCI Express-to-PCI Bridge A'
    class      = bridge
    subclass   = PCI-PCI
    cap 10[44] = PCI-Express 1 PCI bridge max data 128(256)
                 link x4(x8) speed 2.5(2.5) ASPM disabled(L0s)
    cap 05[5c] = MSI supports 1 message, 64 bit 
    cap 01[6c] = powerspec 2  supports D0 D3  current D0
    cap 07[d8] = PCI-X bridge 
    ecap 0001[100] = AER 1 0 fatal 1 non-fatal 0 corrected
    ecap 0004[300] = Power Budgeting 1

pcib4@pci0:3:2:0:	class=0x060400 card=0x00000000 chip=0x00223388 rev=0x04 hdr=0x01
    vendor     = 'Hint Corp'
    device     = 'HiNT HB4 PCI-PCI Bridge (PCI6150)'
    class      = bridge
    subclass   = PCI-PCI
    cap 01[dc] = powerspec 1  supports D0 D1 D2 D3  current D0
    cap 06[e4] = unknown
    cap 03[e8] = VPD

vgapci0@pci0:4:2:0:	class=0x030000 card=0x01831028 chip=0x51591002 rev=0x00 hdr=0x00
    vendor     = 'Advanced Micro Devices, Inc. [AMD/ATI]'
    device     = 'RV100 [Radeon 7000 / Radeon VE]'
    class      = display
    subclass   = VGA
    bar   [10] = type Prefetchable Memory, range 32, base 0xd0000000, size 134217728, enabled
    bar   [14] = type I/O Port, range 32, base 0xdc00, size 256, enabled
    bar   [18] = type Memory, range 32, base 0xdfbf0000, size 65536, enabled
    cap 01[50] = powerspec 2  supports D0 D1 D2 D3  current D0

none1@pci0:4:4:0:	class=0xff0000 card=0x00101028 chip=0x00101028 rev=0x00 hdr=0x00
    vendor     = 'Dell'
    device     = 'Remote Access Card 4'
    bar   [10] = type Prefetchable Memory, range 32, base 0xcffff000, size 4096, enabled
    bar   [14] = type I/O Port, range 32, base 0xd8f8, size 8, enabled
    bar   [18] = type I/O Port, range 32, base 0xd8e8, size 8, enabled
    cap 01[48] = powerspec 2  supports D0 D3  current D0

uart2@pci0:4:4:1:	class=0xff0000 card=0x00121028 chip=0x00121028 rev=0x00 hdr=0x00
    vendor     = 'Dell'
    device     = 'Remote Access Card 4 Daughter Card Virtual UART'
    bar   [10] = type Memory, range 32, base 0xdfbef000, size 4096, enabled
    bar   [14] = type I/O Port, range 32, base 0xd880, size 64, enabled
    bar   [18] = type Prefetchable Memory, range 32, base 0xcff00000, size 524288, enabled
    cap 01[48] = powerspec 2  supports D0 D3  current D0

none2@pci0:4:4:2:	class=0xff0000 card=0x00141028 chip=0x00141028 rev=0x00 hdr=0x00
    vendor     = 'Dell'
    device     = 'Remote Access Card 4 Daughter Card SMIC interface'
    cap 01[48] = powerspec 2  supports D0 D3  current D0

atapci0@pci0:4:7:0:	class=0x010185 card=0x06801095 chip=0x06801095 rev=0x02 hdr=0x00
    vendor     = 'Silicon Image, Inc.'
    device     = 'PCI0680 Ultra ATA-133 Host Controller'
    class      = mass storage
    subclass   = ATA
    bar   [10] = type I/O Port, range 32, base 0xd8f0, size 8, enabled
    bar   [14] = type I/O Port, range 32, base 0xd8e4, size 4, enabled
    bar   [18] = type I/O Port, range 32, base 0xd8d8, size 8, enabled
    bar   [1c] = type I/O Port, range 32, base 0xd8d0, size 4, enabled
    bar   [20] = type I/O Port, range 32, base 0xd870, size 16, enabled
    bar   [24] = type Memory, range 32, base 0xdfbeec00, size 256, enabled
    cap 01[60] = powerspec 2  supports D0 D1 D2 D3  current D0

bge1@pci0:5:0:0:	class=0x020000 card=0x01b61028 chip=0x165914e4 rev=0x11 hdr=0x00
    vendor     = 'Broadcom Inc. and subsidiaries'
    device     = 'NetXtreme BCM5721 Gigabit Ethernet PCI Express'
    class      = network
    subclass   = ethernet
    bar   [10] = type Memory, range 64, base 0xdf7f0000, size 65536, enabled
    cap 01[48] = powerspec 2  supports D0 D3  current D0
    cap 03[50] = VPD
    cap 05[58] = MSI supports 8 messages, 64 bit 
    cap 10[d0] = PCI-Express 1 endpoint max data 128(128)
                 link x1(x1) speed 2.5(2.5) ASPM disabled(L0s)
    ecap 0001[100] = AER 1 0 fatal 0 non-fatal 0 corrected
    ecap 0002[13c] = VC 1 max VC0

bge2@pci0:6:0:0:	class=0x020000 card=0x01b61028 chip=0x165914e4 rev=0x11 hdr=0x00
    vendor     = 'Broadcom Inc. and subsidiaries'
    device     = 'NetXtreme BCM5721 Gigabit Ethernet PCI Express'
    class      = network
    subclass   = ethernet
    bar   [10] = type Memory, range 64, base 0xdf5f0000, size 65536, enabled
    cap 01[48] = powerspec 2  supports D0 D3  current D0
    cap 03[50] = VPD
    cap 05[58] = MSI supports 8 messages, 64 bit 
    cap 10[d0] = PCI-Express 1 endpoint max data 128(128)
                 link x1(x1) speed 2.5(2.5) ASPM disabled(L0s)
    ecap 0001[100] = AER 1 0 fatal 0 non-fatal 0 corrected
    ecap 0002[13c] = VC 1 max VC0
