hostb0@pci0:0:0:0:	class=0x060000 rev=0x01 hdr=0x00 vendor=0x8086 device=0x29f0 subvendor=0x1043 subdevice=0x82a5
    vendor     = 'Intel Corporation'
    device     = '3200/3210 Chipset DRAM Controller'
    class      = bridge
    subclass   = HOST-PCI
    cap 09[e0] = vendor (length 12) Intel cap 9 version 1

pcib1@pci0:0:1:0:	class=0x060400 rev=0x01 hdr=0x01 vendor=0x8086 device=0x29f1 subvendor=0x1043 subdevice=0x82a5
    vendor     = 'Intel Corporation'
    device     = '3200/3210 Chipset Host-Primary PCI Express Bridge'
    class      = bridge
    subclass   = PCI-PCI
    cap 0d[88] = PCI Bridge subvendor=0x1043 subdevice=0x82a5
    cap 01[80] = powerspec 3  supports D0 D3  current D0
    cap 05[90] = MSI supports 1 message 
    cap 10[a0] = PCI-Express 2 root port max data 128(128)
                 max read 128
                 link x0(x8) speed 0.0(2.5) ASPM L1(L0s/L1)
                 slot 0 power limit 10000 mW
    ecap 0002[100] = VC 1 max VC0
    ecap 0005[140] = Root Complex Link Declaration 1

pcib2@pci0:0:28:0:	class=0x060400 rev=0x01 hdr=0x01 vendor=0x8086 device=0x27d0 subvendor=0x1043 subdevice=0x819e
    vendor     = 'Intel Corporation'
    device     = 'NM10/ICH7 Family PCI Express Port 1'
    class      = bridge
    subclass   = PCI-PCI
    cap 10[40] = PCI-Express 1 root port max data 128(128)
                 max read 128
                 link x4(x4) speed 2.5(2.5) ASPM disabled(L0s/L1)
                 slot 2 power limit 25000 mW HotPlug(present) surprise
    cap 05[80] = MSI supports 1 message enabled with 1 message
    cap 0d[90] = PCI Bridge subvendor=0x1043 subdevice=0x819e
    cap 01[a0] = powerspec 2  supports D0 D3  current D0
    ecap 0002[100] = VC 1 max VC1
    ecap 0005[180] = Root Complex Link Declaration 1

pcib8@pci0:0:28:4:	class=0x060400 rev=0x01 hdr=0x01 vendor=0x8086 device=0x27e0 subvendor=0x1043 subdevice=0x819e
    vendor     = 'Intel Corporation'
    device     = '82801GR/GH/GHM (ICH7 Family) PCI Express Port 5'
    class      = bridge
    subclass   = PCI-PCI
    cap 10[40] = PCI-Express 1 root port max data 128(128)
                 max read 128
                 link x1(x1) speed 2.5(2.5) ASPM disabled(L0s/L1)
                 slot 0 power limit 0 mW HotPlug(present) surprise
    cap 05[80] = MSI supports 1 message enabled with 1 message
    cap 0d[90] = PCI Bridge subvendor=0x1043 subdevice=0x819e
    cap 01[a0] = powerspec 2  supports D0 D3  current D0
    ecap 0002[100] = VC 1 max VC1
    ecap 0005[180] = Root Complex Link Declaration 1

pcib9@pci0:0:28:5:	class=0x060400 rev=0x01 hdr=0x01 vendor=0x8086 device=0x27e2 subvendor=0x1043 subdevice=0x819e
    vendor     = 'Intel Corporation'
    device     = '82801GR/GH/GHM (ICH7 Family) PCI Express Port 6'
    class      = bridge
    subclass   = PCI-PCI
    cap 10[40] = PCI-Express 1 root port max data 128(128)
                 max read 128
                 link x1(x1) speed 2.5(2.5) ASPM disabled(L0s/L1)
                 slot 0 power limit 0 mW HotPlug(present) surprise
    cap 05[80] = MSI supports 1 message enabled with 1 message
    cap 0d[90] = PCI Bridge subvendor=0x1043 subdevice=0x819e
    cap 01[a0] = powerspec 2  supports D0 D3  current D0
    ecap 0002[100] = VC 1 max VC1
    ecap 0005[180] = Root Complex Link Declaration 1

uhci0@pci0:0:29:0:	class=0x0c0300 rev=0x01 hdr=0x00 vendor=0x8086 device=0x27c8 subvendor=0x1043 subdevice=0x819e
    vendor     = 'Intel Corporation'
    device     = 'NM10/ICH7 Family USB UHCI Controller'
    class      = serial bus
    subclass   = USB
    bar   [20] = type I/O Port, range 32, base 0xbc00, size 32, enabled

uhci1@pci0:0:29:1:	class=0x0c0300 rev=0x01 hdr=0x00 vendor=0x8086 device=0x27c9 subvendor=0x1043 subdevice=0x819e
    vendor     = 'Intel Corporation'
    device     = 'NM10/ICH7 Family USB UHCI Controller'
    class      = serial bus
    subclass   = USB
    bar   [20] = type I/O Port, range 32, base 0xc000, size 32, enabled

uhci2@pci0:0:29:2:	class=0x0c0300 rev=0x01 hdr=0x00 vendor=0x8086 device=0x27ca subvendor=0x1043 subdevice=0x819e
    vendor     = 'Intel Corporation'
    device     = 'NM10/ICH7 Family USB UHCI Controller'
    class      = serial bus
    subclass   = USB
    bar   [20] = type I/O Port, range 32, base 0xc080, size 32, enabled

ehci0@pci0:0:29:7:	class=0x0c0320 rev=0x01 hdr=0x00 vendor=0x8086 device=0x27cc subvendor=0x1043 subdevice=0x819e
    vendor     = 'Intel Corporation'
    device     = 'NM10/ICH7 Family USB2 EHCI Controller'
    class      = serial bus
    subclass   = USB
    bar   [10] = type Memory, range 32, base 0xfb9ff800, size 1024, enabled
    cap 01[50] = powerspec 2  supports D0 D3  current D0
    cap 0a[58] = EHCI Debug Port at offset 0xa0 in map 0x14

pcib10@pci0:0:30:0:	class=0x060401 rev=0xe1 hdr=0x01 vendor=0x8086 device=0x244e subvendor=0x1043 subdevice=0x819e
    vendor     = 'Intel Corporation'
    device     = '82801 PCI Bridge'
    class      = bridge
    subclass   = PCI-PCI
    cap 0d[50] = PCI Bridge subvendor=0x1043 subdevice=0x819e

isab0@pci0:0:31:0:	class=0x060100 rev=0x01 hdr=0x00 vendor=0x8086 device=0x27b8 subvendor=0x1043 subdevice=0x819e
    vendor     = 'Intel Corporation'
    device     = '82801GB/GR (ICH7 Family) LPC Interface Bridge'
    class      = bridge
    subclass   = PCI-ISA
    cap 09[e0] = vendor (length 12) Intel cap 1 version 0
		 features: Quick Resume, 4 PCI-e x1 slots

atapci0@pci0:0:31:1:	class=0x01018a rev=0x01 hdr=0x00 vendor=0x8086 device=0x27df subvendor=0x1043 subdevice=0x819e
    vendor     = 'Intel Corporation'
    device     = '82801G (ICH7 Family) IDE Controller'
    class      = mass storage
    subclass   = ATA
    bar   [20] = type I/O Port, range 32, base 0xffa0, size 16, enabled

atapci1@pci0:0:31:2:	class=0x01018f rev=0x01 hdr=0x00 vendor=0x8086 device=0x27c0 subvendor=0x1043 subdevice=0x819e
    vendor     = 'Intel Corporation'
    device     = 'NM10/ICH7 Family SATA Controller [IDE mode]'
    class      = mass storage
    subclass   = ATA
    bar   [10] = type I/O Port, range 32, base 0xcc00, size 8, enabled
    bar   [14] = type I/O Port, range 32, base 0xc880, size 4, enabled
    bar   [18] = type I/O Port, range 32, base 0xc800, size 8, enabled
    bar   [1c] = type I/O Port, range 32, base 0xc480, size 4, enabled
    bar   [20] = type I/O Port, range 32, base 0xc400, size 16, enabled
    bar   [24] = type Memory, range 32, base 0xfb9ffc00, size 1024, enabled
    cap 01[70] = powerspec 2  supports D0 D3  current D0

ichsmb0@pci0:0:31:3:	class=0x0c0500 rev=0x01 hdr=0x00 vendor=0x8086 device=0x27da subvendor=0x1043 subdevice=0x819e
    vendor     = 'Intel Corporation'
    device     = 'NM10/ICH7 Family SMBus Controller'
    class      = serial bus
    subclass   = SMBus
    bar   [20] = type I/O Port, range 32, base 0x400, size 32, enabled

pcib3@pci0:4:0:0:	class=0x060400 rev=0xba hdr=0x01 vendor=0x10b5 device=0x8608 subvendor=0x10b5 subdevice=0x8608
    vendor     = 'PLX Technology, Inc.'
    device     = 'PEX 8608 8-lane, 8-Port PCI Express Gen 2 (5.0 GT/s) Switch'
    class      = bridge
    subclass   = PCI-PCI
    bar   [10] = type Memory, range 32, base 0xfbde0000, size 131072, enabled
    cap 01[40] = powerspec 3  supports D0 D3  current D0
    cap 05[48] = MSI supports 4 messages, 64 bit, vector masks 
    cap 10[68] = PCI-Express 2 upstream port max data 128(512)
                 max read 128
                 link x4(x4) speed 2.5(5.0) ASPM disabled(L0s/L1)
    cap 0d[a4] = PCI Bridge subvendor=0x10b5 subdevice=0x8608
    ecap 0003[100] = Serial 1 ba860110b5df0e00
    ecap 0001[fb4] = AER 1 0 fatal 0 non-fatal 1 corrected
    ecap 0004[138] = Power Budgeting 1
    ecap 0002[148] = VC 1 max VC1 lowpri VC0-VC1
    ecap 000b[448] = Vendor [1] ID 0000 Rev 0 Length 204
    ecap 000b[950] = Vendor [1] ID 0001 Rev 0 Length 16

pcib4@pci0:5:1:0:	class=0x060400 rev=0xba hdr=0x01 vendor=0x10b5 device=0x8608 subvendor=0x10b5 subdevice=0x8608
    vendor     = 'PLX Technology, Inc.'
    device     = 'PEX 8608 8-lane, 8-Port PCI Express Gen 2 (5.0 GT/s) Switch'
    class      = bridge
    subclass   = PCI-PCI
    cap 01[40] = powerspec 3  supports D0 D3  current D0
    cap 05[48] = MSI supports 4 messages, 64 bit, vector masks 
    cap 10[68] = PCI-Express 2 downstream port max data 128(512) ARI disabled
                 max read 128
                 link x1(x1) speed 5.0(5.0) ASPM disabled(L0s/L1)
                 slot 113 power limit 25000 mW
    cap 0d[a4] = PCI Bridge subvendor=0x10b5 subdevice=0x8608
    ecap 0003[100] = Serial 1 ba860110b5df0e00
    ecap 0001[fb4] = AER 1 0 fatal 0 non-fatal 4 corrected
    ecap 0002[148] = VC 1 max VC1 lowpri VC0-VC1
    ecap 000d[520] = ACS 1
    ecap 000b[950] = Vendor [1] ID 0001 Rev 0 Length 16

pcib5@pci0:5:5:0:	class=0x060400 rev=0xba hdr=0x01 vendor=0x10b5 device=0x8608 subvendor=0x10b5 subdevice=0x8608
    vendor     = 'PLX Technology, Inc.'
    device     = 'PEX 8608 8-lane, 8-Port PCI Express Gen 2 (5.0 GT/s) Switch'
    class      = bridge
    subclass   = PCI-PCI
    cap 01[40] = powerspec 3  supports D0 D3  current D0
    cap 05[48] = MSI supports 4 messages, 64 bit, vector masks 
    cap 10[68] = PCI-Express 2 downstream port max data 128(512) ARI disabled
                 max read 128
                 link x1(x1) speed 5.0(5.0) ASPM disabled(L0s/L1)
                 slot 117 power limit 25000 mW
    cap 0d[a4] = PCI Bridge subvendor=0x10b5 subdevice=0x8608
    ecap 0003[100] = Serial 1 ba860110b5df0e00
    ecap 0001[fb4] = AER 1 0 fatal 0 non-fatal 1 corrected
    ecap 0002[148] = VC 1 max VC1 lowpri VC0-VC1
    ecap 000d[520] = ACS 1
    ecap 000b[950] = Vendor [1] ID 0001 Rev 0 Length 16

pcib6@pci0:5:7:0:	class=0x060400 rev=0xba hdr=0x01 vendor=0x10b5 device=0x8608 subvendor=0x10b5 subdevice=0x8608
    vendor     = 'PLX Technology, Inc.'
    device     = 'PEX 8608 8-lane, 8-Port PCI Express Gen 2 (5.0 GT/s) Switch'
    class      = bridge
    subclass   = PCI-PCI
    cap 01[40] = powerspec 3  supports D0 D3  current D0
    cap 05[48] = MSI supports 4 messages, 64 bit, vector masks 
    cap 10[68] = PCI-Express 2 downstream port max data 128(512) ARI disabled
                 max read 128
                 link x0(x1) speed 0.0(5.0) ASPM disabled(L0s/L1)
                 slot 119 power limit 25000 mW
    cap 0d[a4] = PCI Bridge subvendor=0x10b5 subdevice=0x8608
    ecap 0003[100] = Serial 1 ba860110b5df0e00
    ecap 0001[fb4] = AER 1 0 fatal 0 non-fatal 1 corrected
    ecap 0002[148] = VC 1 max VC1 lowpri VC0-VC1
    ecap 000d[520] = ACS 1
    ecap 000b[950] = Vendor [1] ID 0001 Rev 0 Length 16

pcib7@pci0:5:9:0:	class=0x060400 rev=0xba hdr=0x01 vendor=0x10b5 device=0x8608 subvendor=0x10b5 subdevice=0x8608
    vendor     = 'PLX Technology, Inc.'
    device     = 'PEX 8608 8-lane, 8-Port PCI Express Gen 2 (5.0 GT/s) Switch'
    class      = bridge
    subclass   = PCI-PCI
    cap 01[40] = powerspec 3  supports D0 D3  current D0
    cap 05[48] = MSI supports 4 messages, 64 bit, vector masks 
    cap 10[68] = PCI-Express 2 downstream port max data 128(512) ARI disabled
                 max read 128
                 link x0(x1) speed 0.0(5.0) ASPM disabled(L0s/L1)
                 slot 121 power limit 25000 mW
    cap 0d[a4] = PCI Bridge subvendor=0x10b5 subdevice=0x8608
    ecap 0003[100] = Serial 1 ba860110b5df0e00
    ecap 0001[fb4] = AER 1 0 fatal 0 non-fatal 1 corrected
    ecap 0002[148] = VC 1 max VC1 lowpri VC0-VC1
    ecap 000d[520] = ACS 1
    ecap 000b[950] = Vendor [1] ID 0001 Rev 0 Length 16

xhci0@pci0:9:0:0:	class=0x0c0330 rev=0x03 hdr=0x00 vendor=0x1033 device=0x0194 subvendor=0x1043 subdevice=0x8413
    vendor     = 'NEC Corporation'
    device     = 'uPD720200 USB 3.0 Host Controller'
    class      = serial bus
    subclass   = USB
    bar   [10] = type Memory, range 64, base 0xfbffe000, size 8192, enabled
    cap 01[50] = powerspec 3  supports D0 D3  current D0
    cap 05[70] = MSI supports 8 messages, 64 bit 
    cap 11[90] = MSI-X supports 8 messages, enabled
                 Table in map 0x10[0x1000], PBA in map 0x10[0x1080]
    cap 10[a0] = PCI-Express 2 endpoint max data 128(128) NS
                 max read 512
                 link x1(x1) speed 5.0(5.0) ASPM disabled(L0s/L1) ClockPM enabled
    ecap 0001[100] = AER 1 0 fatal 0 non-fatal 3 corrected
    ecap 0003[140] = Serial 1 ffffffffffffffff
    ecap 0018[150] = LTR 1

ahci0@pci0:8:0:0:	class=0x010601 rev=0x12 hdr=0x00 vendor=0x1b4b device=0x9120 subvendor=0x1043 subdevice=0x8400
    vendor     = 'Marvell Technology Group Ltd.'
    device     = '88SE9120 SATA 6Gb/s Controller'
    class      = mass storage
    subclass   = SATA
    bar   [10] = type I/O Port, range 32, base 0xec00, size 8, enabled
    bar   [14] = type I/O Port, range 32, base 0xe880, size 4, enabled
    bar   [18] = type I/O Port, range 32, base 0xe800, size 8, enabled
    bar   [1c] = type I/O Port, range 32, base 0xe480, size 4, enabled
    bar   [20] = type I/O Port, range 32, base 0xe400, size 16, enabled
    bar   [24] = type Memory, range 32, base 0xfbeff800, size 2048, enabled
    cap 01[40] = powerspec 3  supports D0 D3  current D0
    cap 05[50] = MSI supports 1 message enabled with 1 message
    cap 10[70] = PCI-Express 2 legacy endpoint max data 128(512) RO
                 max read 512
                 link x1(x1) speed 5.0(5.0) ASPM disabled(L0s/L1)
    ecap 0001[100] = AER 1 0 fatal 0 non-fatal 1 corrected

bge0@pci0:3:0:0:	class=0x020000 rev=0x21 hdr=0x00 vendor=0x14e4 device=0x1659 subvendor=0x1043 subdevice=0x8149
    vendor     = 'Broadcom Inc. and subsidiaries'
    device     = 'NetXtreme BCM5721 Gigabit Ethernet PCI Express'
    class      = network
    subclass   = ethernet
    bar   [10] = type Memory, range 64, base 0xfbcf0000, size 65536, enabled
    cap 01[48] = powerspec 2  supports D0 D3  current D0
    cap 03[50] = VPD
    cap 05[58] = MSI supports 8 messages, 64 bit enabled with 1 message
    cap 10[d0] = PCI-Express 1 endpoint max data 128(128)
                 max read 4096
                 link x1(x1) speed 2.5(2.5) ASPM disabled(L0s/L1)
    ecap 0001[100] = AER 1 0 fatal 1 non-fatal 0 corrected
    ecap 0002[13c] = VC 1 max VC0
    ecap 0003[160] = Serial 1 e0cb4efffe296184
    ecap 0004[16c] = Power Budgeting 1

bge1@pci0:2:0:0:	class=0x020000 rev=0x21 hdr=0x00 vendor=0x14e4 device=0x1659 subvendor=0x1043 subdevice=0x8149
    vendor     = 'Broadcom Inc. and subsidiaries'
    device     = 'NetXtreme BCM5721 Gigabit Ethernet PCI Express'
    class      = network
    subclass   = ethernet
    bar   [10] = type Memory, range 64, base 0xfbbf0000, size 65536, enabled
    cap 01[48] = powerspec 2  supports D0 D3  current D0
    cap 03[50] = VPD
    cap 05[58] = MSI supports 8 messages, 64 bit enabled with 1 message
    cap 10[d0] = PCI-Express 1 endpoint max data 128(128)
                 max read 4096
                 link x1(x1) speed 2.5(2.5) ASPM disabled(L0s/L1)
    ecap 0001[100] = AER 1 0 fatal 1 non-fatal 0 corrected
    ecap 0002[13c] = VC 1 max VC0
    ecap 0003[160] = Serial 1 e0cb4efffe295f90
    ecap 0004[16c] = Power Budgeting 1

vgapci0@pci0:1:3:0:	class=0x030000 rev=0x00 hdr=0x00 vendor=0x18ca device=0x0020 subvendor=0x1043 subdevice=0x82b4
    vendor     = 'XGI Technology Inc. (eXtreme Graphics Innovation)'
    device     = 'Z7/Z9 (XG20 core)'
    class      = display
    subclass   = VGA
    bar   [10] = type Prefetchable Memory, range 32, base 0xf4000000, size 67108864, enabled
    bar   [14] = type Memory, range 32, base 0xfbac0000, size 262144, enabled
    bar   [18] = type I/O Port, range 32, base 0xdc00, size 128, enabled
    cap 01[40] = powerspec 2  supports D0 D1 D2 D3  current D0
