hostb0@pci0:0:0:0:	class=0x060000 card=0x5af01849 chip=0x5af08086 rev=0x0b hdr=0x00
    vendor     = 'Intel Corporation'
    device     = 'Celeron N3350/Pentium N4200/Atom E3900 Series Host Bridge'
    class      = bridge
    subclass   = HOST-PCI

vgapci0@pci0:0:2:0:	class=0x030000 card=0x5a851849 chip=0x5a858086 rev=0x0b hdr=0x00
    vendor     = 'Intel Corporation'
    class      = display
    subclass   = VGA
    bar   [10] = type Memory, range 64, base 0x90000000, size 16777216, enabled
    bar   [18] = type Prefetchable Memory, range 64, base 0x80000000, size 268435456, enabled
    bar   [20] = type I/O Port, range 32, base 0xf000, size 64, enabled
    cap 09[40] = vendor (length 12) Intel cap 0 version 1
    cap 10[70] = PCI-Express 2 root endpoint max data 128(128) FLR
    cap 05[ac] = MSI supports 1 message 
    cap 01[d0] = powerspec 2  supports D0 D3  current D0
    ecap 001b[100] = unknown 1
    ecap 000f[200] = ATS 1
    ecap 0013[300] = unknown 1

none0@pci0:0:15:0:	class=0x078000 card=0x5a9a1849 chip=0x5a9a8086 rev=0x0b hdr=0x00
    vendor     = 'Intel Corporation'
    device     = 'Celeron N3350/Pentium N4200/Atom E3900 Series Trusted Execution Engine'
    class      = simple comms
    bar   [10] = type Memory, range 64, base 0x91417000, size 4096, enabled
    cap 01[50] = powerspec 3  supports D0 D3  current D0
    cap 05[8c] = MSI supports 1 message, 64 bit 
    cap 09[a4] = vendor (length 20) Intel cap 15 version 0

ahci0@pci0:0:18:0:	class=0x010601 card=0x5ae31849 chip=0x5ae38086 rev=0x0b hdr=0x00
    vendor     = 'Intel Corporation'
    device     = 'Celeron N3350/Pentium N4200/Atom E3900 Series SATA AHCI Controller'
    class      = mass storage
    subclass   = SATA
    bar   [10] = type Memory, range 32, base 0x91410000, size 8192, enabled
    bar   [14] = type Memory, range 32, base 0x91414000, size 256, enabled
    bar   [18] = type I/O Port, range 32, base 0xf090, size 8, enabled
    bar   [1c] = type I/O Port, range 32, base 0xf080, size 4, enabled
    bar   [20] = type I/O Port, range 32, base 0xf060, size 32, enabled
    bar   [24] = type Memory, range 32, base 0x91413000, size 2048, enabled
    cap 05[80] = MSI supports 1 message enabled with 1 message
    cap 01[70] = powerspec 3  supports D0 D3  current D0
    cap 12[a8] = SATA Index-Data Pair

pcib1@pci0:0:19:0:	class=0x060400 card=0x5ad81849 chip=0x5ad88086 rev=0xfb hdr=0x01
    vendor     = 'Intel Corporation'
    device     = 'Celeron N3350/Pentium N4200/Atom E3900 Series PCI Express Port A'
    class      = bridge
    subclass   = PCI-PCI
    cap 10[40] = PCI-Express 2 root port max data 256(256) ARI disabled
                 link x1(x1) speed 2.5(5.0)
                 slot 2 power limit 100 mW
    cap 05[80] = MSI supports 1 message 
    cap 0d[90] = PCI Bridge card=0x5ad81849
    cap 01[a0] = powerspec 3  supports D0 D3  current D0
    ecap 0000[100] = unknown 0
    ecap 000d[140] = ACS 1
    ecap 0000[150] = unknown 0
    ecap 001e[200] = unknown 1
    ecap 0000[220] = unknown 0

pcib2@pci0:0:19:1:	class=0x060400 card=0x5ad91849 chip=0x5ad98086 rev=0xfb hdr=0x01
    vendor     = 'Intel Corporation'
    device     = 'Celeron N3350/Pentium N4200/Atom E3900 Series PCI Express Port A'
    class      = bridge
    subclass   = PCI-PCI
    cap 10[40] = PCI-Express 2 root port max data 256(256) ARI disabled
                 link x0(x1) speed 0.0(5.0)
                 slot 3 power limit 100 mW
    cap 05[80] = MSI supports 1 message 
    cap 0d[90] = PCI Bridge card=0x5ad91849
    cap 01[a0] = powerspec 3  supports D0 D3  current D0
    ecap 0000[100] = unknown 0
    ecap 000d[140] = ACS 1
    ecap 0000[150] = unknown 0
    ecap 001e[200] = unknown 1
    ecap 0000[220] = unknown 0

pcib3@pci0:0:19:2:	class=0x060400 card=0x5ada1849 chip=0x5ada8086 rev=0xfb hdr=0x01
    vendor     = 'Intel Corporation'
    device     = 'Celeron N3350/Pentium N4200/Atom E3900 Series PCI Express Port A'
    class      = bridge
    subclass   = PCI-PCI
    cap 10[40] = PCI-Express 2 root port max data 256(256) ARI disabled
                 link x1(x1) speed 5.0(5.0)
                 slot 4 power limit 100 mW
    cap 05[80] = MSI supports 1 message 
    cap 0d[90] = PCI Bridge card=0x5ada1849
    cap 01[a0] = powerspec 3  supports D0 D3  current D0
    ecap 0000[100] = unknown 0
    ecap 000d[140] = ACS 1
    ecap 0000[150] = unknown 0
    ecap 001e[200] = unknown 1
    ecap 0000[220] = unknown 0

pcib4@pci0:0:19:3:	class=0x060400 card=0x5adb1849 chip=0x5adb8086 rev=0xfb hdr=0x01
    vendor     = 'Intel Corporation'
    device     = 'Celeron N3350/Pentium N4200/Atom E3900 Series PCI Express Port A'
    class      = bridge
    subclass   = PCI-PCI
    cap 10[40] = PCI-Express 2 root port max data 256(256) ARI disabled
                 link x0(x1) speed 0.0(5.0)
                 slot 5 power limit 100 mW
    cap 05[80] = MSI supports 1 message 
    cap 0d[90] = PCI Bridge card=0x5adb1849
    cap 01[a0] = powerspec 3  supports D0 D3  current D0
    ecap 0000[100] = unknown 0
    ecap 000d[140] = ACS 1
    ecap 0000[150] = unknown 0
    ecap 001e[200] = unknown 1
    ecap 0000[220] = unknown 0

xhci0@pci0:0:21:0:	class=0x0c0330 card=0x5aa81849 chip=0x5aa88086 rev=0x0b hdr=0x00
    vendor     = 'Intel Corporation'
    device     = 'Celeron N3350/Pentium N4200/Atom E3900 Series USB xHCI'
    class      = serial bus
    subclass   = USB
    bar   [10] = type Memory, range 64, base 0x91400000, size 65536, enabled
    cap 01[70] = powerspec 2  supports D0 D3  current D0
    cap 05[80] = MSI supports 8 messages, 64 bit enabled with 1 message
    cap 09[90] = vendor (length 20) Intel cap 15 version 0

isab0@pci0:0:31:0:	class=0x060100 card=0x5ae81849 chip=0x5ae88086 rev=0x0b hdr=0x00
    vendor     = 'Intel Corporation'
    device     = 'Celeron N3350/Pentium N4200/Atom E3900 Series Low Pin Count Interface'
    class      = bridge
    subclass   = PCI-ISA

none1@pci0:0:31:1:	class=0x0c0500 card=0x5ad41849 chip=0x5ad48086 rev=0x0b hdr=0x00
    vendor     = 'Intel Corporation'
    device     = 'Celeron N3350/Pentium N4200/Atom E3900 Series SMBus Controller'
    class      = serial bus
    subclass   = SMBus
    bar   [10] = type Memory, range 64, base 0x91412000, size 256, enabled
    bar   [20] = type I/O Port, range 32, base 0xf040, size 32, enabled

re0@pci0:1:0:0:	class=0x020000 card=0x81681849 chip=0x816810ec rev=0x06 hdr=0x00
    vendor     = 'Realtek Semiconductor Co., Ltd.'
    device     = 'RTL8111/8168/8411 PCI Express Gigabit Ethernet Controller'
    class      = network
    subclass   = ethernet
    bar   [10] = type I/O Port, range 32, base 0xe000, size 256, enabled
    bar   [18] = type Memory, range 64, base 0x91304000, size 4096, enabled
    bar   [20] = type Prefetchable Memory, range 64, base 0x91300000, size 16384, enabled
    cap 01[40] = powerspec 3  supports D0 D1 D2 D3  current D0
    cap 05[50] = MSI supports 1 message, 64 bit 
    cap 10[70] = PCI-Express 2 endpoint MSI 1 max data 128(128) RO
                 link x1(x1) speed 2.5(2.5) ASPM disabled(L0s/L1)
    cap 11[b0] = MSI-X supports 4 messages, enabled
                 Table in map 0x20[0x0], PBA in map 0x20[0x800]
    cap 03[d0] = VPD
    ecap 0001[100] = AER 1 0 fatal 0 non-fatal 0 corrected
    ecap 0002[140] = VC 1 max VC0
    ecap 0003[160] = Serial 1 01000000684ce000

igb0@pci0:3:0:0:	class=0x020000 card=0x1780103c chip=0x150e8086 rev=0x01 hdr=0x00
    vendor     = 'Intel Corporation'
    device     = '82580 Gigabit Network Connection'
    class      = network
    subclass   = ethernet
    bar   [10] = type Memory, range 64, base 0x91180000, size 524288, enabled
    bar   [20] = type Memory, range 64, base 0x9120c000, size 16384, enabled
    cap 01[40] = powerspec 3  supports D0 D3  current D0
    cap 05[50] = MSI supports 1 message, 64 bit, vector masks 
    cap 11[70] = MSI-X supports 10 messages, enabled
                 Table in map 0x20[0x0], PBA in map 0x20[0x2000]
    cap 10[a0] = PCI-Express 2 endpoint max data 256(512) FLR RO NS
                 link x1(x4) speed 5.0(5.0) ASPM disabled(L0s/L1)
    cap 03[e0] = VPD
    ecap 0001[100] = AER 1 0 fatal 0 non-fatal 1 corrected
    ecap 0003[140] = Serial 1 f4ce46ffffa92fa7
    ecap 0017[1a0] = TPH Requester 1
    ecap 0018[1c0] = LTR 1

igb1@pci0:3:0:1:	class=0x020000 card=0x1780103c chip=0x150e8086 rev=0x01 hdr=0x00
    vendor     = 'Intel Corporation'
    device     = '82580 Gigabit Network Connection'
    class      = network
    subclass   = ethernet
    bar   [10] = type Memory, range 64, base 0x91100000, size 524288, enabled
    bar   [20] = type Memory, range 64, base 0x91208000, size 16384, enabled
    cap 01[40] = powerspec 3  supports D0 D3  current D0
    cap 05[50] = MSI supports 1 message, 64 bit, vector masks 
    cap 11[70] = MSI-X supports 10 messages, enabled
                 Table in map 0x20[0x0], PBA in map 0x20[0x2000]
    cap 10[a0] = PCI-Express 2 endpoint max data 256(512) FLR RO NS
                 link x1(x4) speed 5.0(5.0) ASPM disabled(L0s/L1)
    cap 03[e0] = VPD
    ecap 0001[100] = AER 1 0 fatal 0 non-fatal 1 corrected
    ecap 0003[140] = Serial 1 f4ce46ffffa92fa7
    ecap 0017[1a0] = TPH Requester 1

igb2@pci0:3:0:2:	class=0x020000 card=0x1780103c chip=0x150e8086 rev=0x01 hdr=0x00
    vendor     = 'Intel Corporation'
    device     = '82580 Gigabit Network Connection'
    class      = network
    subclass   = ethernet
    bar   [10] = type Memory, range 64, base 0x91080000, size 524288, enabled
    bar   [20] = type Memory, range 64, base 0x91204000, size 16384, enabled
    cap 01[40] = powerspec 3  supports D0 D3  current D0
    cap 05[50] = MSI supports 1 message, 64 bit, vector masks 
    cap 11[70] = MSI-X supports 10 messages, enabled
                 Table in map 0x20[0x0], PBA in map 0x20[0x2000]
    cap 10[a0] = PCI-Express 2 endpoint max data 256(512) FLR RO NS
                 link x1(x4) speed 5.0(5.0) ASPM disabled(L0s/L1)
    cap 03[e0] = VPD
    ecap 0001[100] = AER 1 0 fatal 0 non-fatal 1 corrected
    ecap 0003[140] = Serial 1 f4ce46ffffa92fa7
    ecap 0017[1a0] = TPH Requester 1

igb3@pci0:3:0:3:	class=0x020000 card=0x1780103c chip=0x150e8086 rev=0x01 hdr=0x00
    vendor     = 'Intel Corporation'
    device     = '82580 Gigabit Network Connection'
    class      = network
    subclass   = ethernet
    bar   [10] = type Memory, range 64, base 0x91000000, size 524288, enabled
    bar   [20] = type Memory, range 64, base 0x91200000, size 16384, enabled
    cap 01[40] = powerspec 3  supports D0 D3  current D0
    cap 05[50] = MSI supports 1 message, 64 bit, vector masks 
    cap 11[70] = MSI-X supports 10 messages, enabled
                 Table in map 0x20[0x0], PBA in map 0x20[0x2000]
    cap 10[a0] = PCI-Express 2 endpoint max data 256(512) FLR RO NS
                 link x1(x4) speed 5.0(5.0) ASPM disabled(L0s/L1)
    cap 03[e0] = VPD
    ecap 0001[100] = AER 1 0 fatal 0 non-fatal 1 corrected
    ecap 0003[140] = Serial 1 f4ce46ffffa92fa7
    ecap 0017[1a0] = TPH Requester 1
