hostb0@pci0:0:0:0:	class=0x060000 card=0x222717aa chip=0x16048086 rev=0x09 hdr=0x00
    vendor     = 'Intel Corporation'
    device     = 'Broadwell-U Host Bridge -OPI'
    class      = bridge
    subclass   = HOST-PCI
    cap 09[e0] = vendor (length 12) Intel cap 0 version 1

vgapci0@pci0:0:2:0:	class=0x030000 card=0x222717aa chip=0x16168086 rev=0x09 hdr=0x00
    vendor     = 'Intel Corporation'
    device     = 'HD Graphics 5500'
    class      = display
    subclass   = VGA
    bar   [10] = type Memory, range 64, base 0xe0000000, size 16777216, enabled
    bar   [18] = type Prefetchable Memory, range 64, base 0xc0000000, size 536870912, enabled
    bar   [20] = type I/O Port, range 32, base 0x3000, size 64, enabled
    cap 05[90] = MSI supports 1 message enabled with 1 message
    cap 01[d0] = powerspec 2  supports D0 D3  current D0
    cap 13[a4] = PCI Advanced Features: FLR TP

hdac0@pci0:0:3:0:	class=0x040300 card=0x222717aa chip=0x160c8086 rev=0x09 hdr=0x00
    vendor     = 'Intel Corporation'
    device     = 'Broadwell-U Audio Controller'
    class      = multimedia
    subclass   = HDA
    bar   [10] = type Memory, range 64, base 0xe1230000, size 16384, enabled
    cap 01[50] = powerspec 2  supports D0 D3  current D0
    cap 05[60] = MSI supports 1 message enabled with 1 message
    cap 10[70] = PCI-Express 1 root endpoint max data 128(128) FLR NS

xhci0@pci0:0:20:0:	class=0x0c0330 card=0x222717aa chip=0x9cb18086 rev=0x03 hdr=0x00
    vendor     = 'Intel Corporation'
    device     = 'Wildcat Point-LP USB xHCI Controller'
    class      = serial bus
    subclass   = USB
    bar   [10] = type Memory, range 64, base 0xe1220000, size 65536, enabled
    cap 01[70] = powerspec 2  supports D0 D3  current D0
    cap 05[80] = MSI supports 8 messages, 64 bit enabled with 1 message

none0@pci0:0:22:0:	class=0x078000 card=0x222717aa chip=0x9cba8086 rev=0x03 hdr=0x00
    vendor     = 'Intel Corporation'
    device     = 'Wildcat Point-LP MEI Controller'
    class      = simple comms
    bar   [10] = type Memory, range 64, base 0xe1239000, size 32, enabled
    cap 01[50] = powerspec 3  supports D0 D3  current D0
    cap 05[8c] = MSI supports 1 message, 64 bit 

em0@pci0:0:25:0:	class=0x020000 card=0x222717aa chip=0x15a38086 rev=0x03 hdr=0x00
    vendor     = 'Intel Corporation'
    device     = 'Ethernet Connection (3) I218-V'
    class      = network
    subclass   = ethernet
    bar   [10] = type Memory, range 32, base 0xe1200000, size 131072, enabled
    bar   [14] = type Memory, range 32, base 0xe123d000, size 4096, enabled
    bar   [18] = type I/O Port, range 32, base 0x3060, size 32, enabled
    cap 01[c8] = powerspec 2  supports D0 D3  current D0
    cap 05[d0] = MSI supports 1 message, 64 bit enabled with 1 message
    cap 13[e0] = PCI Advanced Features: FLR TP

hdac1@pci0:0:27:0:	class=0x040300 card=0x222717aa chip=0x9ca08086 rev=0x03 hdr=0x00
    vendor     = 'Intel Corporation'
    device     = 'Wildcat Point-LP High Definition Audio Controller'
    class      = multimedia
    subclass   = HDA
    bar   [10] = type Memory, range 64, base 0xe1234000, size 16384, enabled
    cap 01[50] = powerspec 3  supports D0 D3  current D0
    cap 05[60] = MSI supports 1 message, 64 bit enabled with 1 message

pcib1@pci0:0:28:0:	class=0x060400 card=0x222717aa chip=0x9c928086 rev=0xe3 hdr=0x01
    vendor     = 'Intel Corporation'
    device     = 'Wildcat Point-LP PCI Express Root Port'
    class      = bridge
    subclass   = PCI-PCI
    cap 10[40] = PCI-Express 2 root port max data 128(128)
                 link x0(x1) speed 0.0(5.0) ASPM L0s/L1(L0s/L1)
                 slot 0 power limit 0 mW HotPlug(empty) surprise
    cap 05[80] = MSI supports 1 message enabled with 1 message
    cap 0d[90] = PCI Bridge card=0x222717aa
    cap 01[a0] = powerspec 3  supports D0 D3  current D0

pcib2@pci0:0:28:1:	class=0x060400 card=0x222717aa chip=0x9c948086 rev=0xe3 hdr=0x01
    vendor     = 'Intel Corporation'
    device     = 'Wildcat Point-LP PCI Express Root Port'
    class      = bridge
    subclass   = PCI-PCI
    cap 10[40] = PCI-Express 2 root port max data 128(128)
                 link x1(x1) speed 2.5(5.0) ASPM L1(L0s/L1)
                 slot 2 power limit 100 mW
    cap 05[80] = MSI supports 1 message 
    cap 0d[90] = PCI Bridge card=0x222717aa
    cap 01[a0] = powerspec 3  supports D0 D3  current D0
    ecap 0000[100] = unknown 0
    ecap 001e[200] = unknown 1

pcib3@pci0:0:28:5:	class=0x060400 card=0x222717aa chip=0x9c9a8086 rev=0xe3 hdr=0x01
    vendor     = 'Intel Corporation'
    device     = 'Wildcat Point-LP PCI Express Root Port'
    class      = bridge
    subclass   = PCI-PCI
    cap 10[40] = PCI-Express 2 root port max data 128(128)
                 link x4(x4) speed 5.0(5.0) ASPM L1(L0s/L1)
                 slot 5 power limit 250 mW
    cap 05[80] = MSI supports 1 message 
    cap 0d[90] = PCI Bridge card=0x222717aa
    cap 01[a0] = powerspec 3  supports D0 D3  current D0
    ecap 0000[100] = unknown 0
    ecap 001e[200] = unknown 1

ehci0@pci0:0:29:0:	class=0x0c0320 card=0x222717aa chip=0x9ca68086 rev=0x03 hdr=0x00
    vendor     = 'Intel Corporation'
    device     = 'Wildcat Point-LP USB EHCI Controller'
    class      = serial bus
    subclass   = USB
    bar   [10] = type Memory, range 32, base 0xe123c000, size 1024, enabled
    cap 01[50] = powerspec 3  supports D0 D3  current D0
    cap 0a[58] = EHCI Debug Port at offset 0xa0 in map 0x14
    cap 13[98] = PCI Advanced Features: FLR TP

isab0@pci0:0:31:0:	class=0x060100 card=0x222717aa chip=0x9cc38086 rev=0x03 hdr=0x00
    vendor     = 'Intel Corporation'
    device     = 'Wildcat Point-LP LPC Controller'
    class      = bridge
    subclass   = PCI-ISA
    cap 09[e0] = vendor (length 12) Intel cap 1 version 0
		 features: AMT, 4 PCI-e x1 slots

none1@pci0:0:31:3:	class=0x0c0500 card=0x222717aa chip=0x9ca28086 rev=0x03 hdr=0x00
    vendor     = 'Intel Corporation'
    device     = 'Wildcat Point-LP SMBus Controller'
    class      = serial bus
    subclass   = SMBus
    bar   [10] = type Memory, range 64, base 0xe1238000, size 256, enabled
    bar   [20] = type I/O Port, range 32, base 0xefa0, size 32, enabled

none2@pci0:0:31:6:	class=0x118000 card=0x222717aa chip=0x9ca48086 rev=0x03 hdr=0x00
    vendor     = 'Intel Corporation'
    device     = 'Wildcat Point-LP Thermal Management Controller'
    class      = dasp
    bar   [10] = type Memory, range 64, base 0xe123b000, size 4096, enabled
    cap 01[50] = powerspec 3  supports D0 D3  current D0
    cap 05[80] = MSI supports 1 message 

iwm0@pci0:4:0:0:	class=0x028000 card=0x52108086 chip=0x095b8086 rev=0x59 hdr=0x00
    vendor     = 'Intel Corporation'
    device     = 'Wireless 7265'
    class      = network
    bar   [10] = type Memory, range 64, base 0xe1100000, size 8192, enabled
    cap 01[c8] = powerspec 3  supports D0 D3  current D0
    cap 05[d0] = MSI supports 1 message, 64 bit enabled with 1 message
    cap 10[40] = PCI-Express 2 endpoint max data 128(128) FLR RO NS
                 link x1(x1) speed 2.5(2.5) ASPM L1(L1)
    ecap 0001[100] = AER 1 0 fatal 0 non-fatal 0 corrected
    ecap 0003[140] = Serial 1 4c3488ffff3f47fb
    ecap 0018[14c] = LTR 1
    ecap 001e[154] = unknown 1

ahci0@pci0:10:0:0:	class=0x010601 card=0xa801144d chip=0xa801144d rev=0x01 hdr=0x00
    vendor     = 'Samsung Electronics Co Ltd'
    class      = mass storage
    subclass   = SATA
    bar   [24] = type Memory, range 32, base 0xe1000000, size 8192, enabled
    cap 01[40] = powerspec 3  supports D0 D3  current D0
    cap 05[50] = MSI supports 8 messages, 64 bit enabled with 8 messages
    cap 10[70] = PCI-Express 2 endpoint max data 128(128) FLR RO NS
                 link x4(x4) speed 5.0(8.0) ASPM L1(L1)
    ecap 0001[100] = AER 2 0 fatal 0 non-fatal 0 corrected
    ecap 0003[148] = Serial 1 0000000000000000
    ecap 0004[158] = Power Budgeting 1
    ecap 0019[168] = PCIe Sec 1 lane errors 0
    ecap 0018[188] = LTR 1
    ecap 001e[190] = unknown 1
