hostb0@pci0:0:0:0:	class=0x060000 rev=0x00 hdr=0x00 vendor=0x1022 device=0x1630 subvendor=0x1022 subdevice=0x1630
    vendor     = 'Advanced Micro Devices, Inc. [AMD]'
    device     = 'Renoir/Cezanne Root Complex'
    class      = bridge
    subclass   = HOST-PCI

hostb1@pci0:0:1:0:	class=0x060000 rev=0x00 hdr=0x00 vendor=0x1022 device=0x1632 subvendor=0x0000 subdevice=0x0000
    vendor     = 'Advanced Micro Devices, Inc. [AMD]'
    device     = 'Renoir PCIe Dummy Host Bridge'
    class      = bridge
    subclass   = HOST-PCI

pcib1@pci0:0:1:1:	class=0x060400 rev=0x00 hdr=0x01 vendor=0x1022 device=0x1633 subvendor=0x1022 subdevice=0x1453
    vendor     = 'Advanced Micro Devices, Inc. [AMD]'
    device     = 'Renoir PCIe GPP Bridge'
    class      = bridge
    subclass   = PCI-PCI
    cap 01[50] = powerspec 3  supports D0 D3  current D0
    cap 10[58] = PCI-Express 2 root port max data 512(512) RO NS ARI enabled
                 max read 128
                 link x8(x16) speed 8.0(8.0) ASPM L1(L1)
                 slot 0 power limit 75000 mW
    cap 05[a0] = MSI supports 1 message, 64 bit 
    cap 0d[c0] = PCI Bridge subvendor=0x1022 subdevice=0x1453
    cap 08[c8] = HT MSI fixed address window enabled at 0xfee00000
    ecap 000b[100] = Vendor [1] ID 0001 Rev 1 Length 16
    ecap 0019[270] = PCIe Sec 1 lane errors 0

hostb2@pci0:0:2:0:	class=0x060000 rev=0x00 hdr=0x00 vendor=0x1022 device=0x1632 subvendor=0x0000 subdevice=0x0000
    vendor     = 'Advanced Micro Devices, Inc. [AMD]'
    device     = 'Renoir PCIe Dummy Host Bridge'
    class      = bridge
    subclass   = HOST-PCI

pcib2@pci0:0:2:1:	class=0x060400 rev=0x00 hdr=0x01 vendor=0x1022 device=0x1634 subvendor=0x1022 subdevice=0x1453
    vendor     = 'Advanced Micro Devices, Inc. [AMD]'
    device     = 'Renoir/Cezanne PCIe GPP Bridge'
    class      = bridge
    subclass   = PCI-PCI
    cap 01[50] = powerspec 3  supports D0 D3  current D0
    cap 10[58] = PCI-Express 2 root port max data 128(512) RO NS ARI disabled
                 max read 128
                 link x4(x4) speed 8.0(8.0) ASPM L1(L1)
                 slot 0 power limit 75000 mW
    cap 05[a0] = MSI supports 1 message, 64 bit 
    cap 0d[c0] = PCI Bridge subvendor=0x1022 subdevice=0x1453
    cap 08[c8] = HT MSI fixed address window enabled at 0xfee00000
    ecap 000b[100] = Vendor [1] ID 0001 Rev 1 Length 16
    ecap 0019[270] = PCIe Sec 1 lane errors 0

pcib5@pci0:0:2:2:	class=0x060400 rev=0x00 hdr=0x01 vendor=0x1022 device=0x1634 subvendor=0x1022 subdevice=0x1453
    vendor     = 'Advanced Micro Devices, Inc. [AMD]'
    device     = 'Renoir/Cezanne PCIe GPP Bridge'
    class      = bridge
    subclass   = PCI-PCI
    cap 01[50] = powerspec 3  supports D0 D3  current D0
    cap 10[58] = PCI-Express 2 root port max data 256(512) RO NS ARI disabled
                 max read 128
                 link x4(x4) speed 8.0(8.0) ASPM L1(L1)
                 slot 0 power limit 75000 mW
    cap 05[a0] = MSI supports 1 message, 64 bit 
    cap 0d[c0] = PCI Bridge subvendor=0x1022 subdevice=0x1453
    cap 08[c8] = HT MSI fixed address window enabled at 0xfee00000
    ecap 000b[100] = Vendor [1] ID 0001 Rev 1 Length 16
    ecap 0019[270] = PCIe Sec 1 lane errors 0

hostb3@pci0:0:8:0:	class=0x060000 rev=0x00 hdr=0x00 vendor=0x1022 device=0x1632 subvendor=0x0000 subdevice=0x0000
    vendor     = 'Advanced Micro Devices, Inc. [AMD]'
    device     = 'Renoir PCIe Dummy Host Bridge'
    class      = bridge
    subclass   = HOST-PCI

pcib6@pci0:0:8:1:	class=0x060400 rev=0x00 hdr=0x01 vendor=0x1022 device=0x1635 subvendor=0x1022 subdevice=0x1635
    vendor     = 'Advanced Micro Devices, Inc. [AMD]'
    device     = 'Renoir Internal PCIe GPP Bridge to Bus'
    class      = bridge
    subclass   = PCI-PCI
    cap 01[50] = powerspec 3  supports D0 D3  current D0
    cap 10[58] = PCI-Express 2 root port max data 256(512) RO NS
                 max read 512
                 link x16(x16) speed 8.0(8.0) ASPM disabled(L0s/L1)
    cap 05[a0] = MSI supports 1 message, 64 bit 
    cap 0d[c0] = PCI Bridge subvendor=0x1022 subdevice=0x1635
    ecap 000b[100] = Vendor [1] ID 0001 Rev 1 Length 16
    ecap 0019[270] = PCIe Sec 1 lane errors 0
    ecap 0025[400] = Data Link Feature 1
    ecap 0026[410] = Physical Layer 16.0 GT/s 1
    ecap 0027[440] = Lane Margining at Receiver 1

intsmb0@pci0:0:20:0:	class=0x0c0500 rev=0x51 hdr=0x00 vendor=0x1022 device=0x790b subvendor=0x1849 subdevice=0xffff
    vendor     = 'Advanced Micro Devices, Inc. [AMD]'
    device     = 'FCH SMBus Controller'
    class      = serial bus
    subclass   = SMBus

isab0@pci0:0:20:3:	class=0x060100 rev=0x51 hdr=0x00 vendor=0x1022 device=0x790e subvendor=0x1849 subdevice=0xffff
    vendor     = 'Advanced Micro Devices, Inc. [AMD]'
    device     = 'FCH LPC Bridge'
    class      = bridge
    subclass   = PCI-ISA

hostb4@pci0:0:24:0:	class=0x060000 rev=0x00 hdr=0x00 vendor=0x1022 device=0x1448 subvendor=0x0000 subdevice=0x0000
    vendor     = 'Advanced Micro Devices, Inc. [AMD]'
    device     = 'Renoir Device 24: Function 0'
    class      = bridge
    subclass   = HOST-PCI

hostb5@pci0:0:24:1:	class=0x060000 rev=0x00 hdr=0x00 vendor=0x1022 device=0x1449 subvendor=0x0000 subdevice=0x0000
    vendor     = 'Advanced Micro Devices, Inc. [AMD]'
    device     = 'Renoir Device 24: Function 1'
    class      = bridge
    subclass   = HOST-PCI

hostb6@pci0:0:24:2:	class=0x060000 rev=0x00 hdr=0x00 vendor=0x1022 device=0x144a subvendor=0x0000 subdevice=0x0000
    vendor     = 'Advanced Micro Devices, Inc. [AMD]'
    device     = 'Renoir Device 24: Function 2'
    class      = bridge
    subclass   = HOST-PCI

hostb7@pci0:0:24:3:	class=0x060000 rev=0x00 hdr=0x00 vendor=0x1022 device=0x144b subvendor=0x0000 subdevice=0x0000
    vendor     = 'Advanced Micro Devices, Inc. [AMD]'
    device     = 'Renoir Device 24: Function 3'
    class      = bridge
    subclass   = HOST-PCI

hostb8@pci0:0:24:4:	class=0x060000 rev=0x00 hdr=0x00 vendor=0x1022 device=0x144c subvendor=0x0000 subdevice=0x0000
    vendor     = 'Advanced Micro Devices, Inc. [AMD]'
    device     = 'Renoir Device 24: Function 4'
    class      = bridge
    subclass   = HOST-PCI

hostb9@pci0:0:24:5:	class=0x060000 rev=0x00 hdr=0x00 vendor=0x1022 device=0x144d subvendor=0x0000 subdevice=0x0000
    vendor     = 'Advanced Micro Devices, Inc. [AMD]'
    device     = 'Renoir Device 24: Function 5'
    class      = bridge
    subclass   = HOST-PCI

hostb10@pci0:0:24:6:	class=0x060000 rev=0x00 hdr=0x00 vendor=0x1022 device=0x144e subvendor=0x0000 subdevice=0x0000
    vendor     = 'Advanced Micro Devices, Inc. [AMD]'
    device     = 'Renoir Device 24: Function 6'
    class      = bridge
    subclass   = HOST-PCI

hostb11@pci0:0:24:7:	class=0x060000 rev=0x00 hdr=0x00 vendor=0x1022 device=0x144f subvendor=0x0000 subdevice=0x0000
    vendor     = 'Advanced Micro Devices, Inc. [AMD]'
    device     = 'Renoir Device 24: Function 7'
    class      = bridge
    subclass   = HOST-PCI

ixl0@pci0:1:0:0:	class=0x020000 rev=0x02 hdr=0x00 vendor=0x8086 device=0x1572 subvendor=0x8086 subdevice=0x0000
    vendor     = 'Intel Corporation'
    device     = 'Ethernet Controller X710 for 10GbE SFP+'
    class      = network
    subclass   = ethernet
    bar   [10] = type Prefetchable Memory, range 64, base 0xe2000000, size 8388608, enabled
    bar   [1c] = type Prefetchable Memory, range 64, base 0xe2818000, size 32768, enabled
    cap 01[40] = powerspec 3  supports D0 D3  current D0
    cap 05[50] = MSI supports 1 message, 64 bit, vector masks 
    cap 11[70] = MSI-X supports 129 messages, enabled
                 Table in map 0x1c[0x0], PBA in map 0x1c[0x1000]
    cap 10[a0] = PCI-Express 2 endpoint max data 512(2048) FLR RO
                 max read 512
                 link x8(x8) speed 8.0(8.0) ASPM L1(L1)
    ecap 0001[100] = AER 2 0 fatal 0 non-fatal 4 corrected
    ecap 0003[140] = Serial 1 edb227ffff6aeae8
    ecap 000e[150] = ARI 1
    ecap 0010[160] = SR-IOV 1 IOV disabled, Memory Space disabled, ARI disabled
                     0 VFs configured out of 32 supported
                     First VF RID Offset 0x0110, VF RID Stride 0x0001
                     VF Device ID 0x154c
                     Page Sizes: 4096 (enabled), 8192, 65536, 262144, 1048576, 4194304
    ecap 0017[1a0] = TPH Requester 1
    ecap 000d[1b0] = ACS 1
    ecap 0019[1d0] = PCIe Sec 1 lane errors 0xff

ixl1@pci0:1:0:1:	class=0x020000 rev=0x02 hdr=0x00 vendor=0x8086 device=0x1572 subvendor=0x8086 subdevice=0x0000
    vendor     = 'Intel Corporation'
    device     = 'Ethernet Controller X710 for 10GbE SFP+'
    class      = network
    subclass   = ethernet
    bar   [10] = type Prefetchable Memory, range 64, base 0xe1800000, size 8388608, enabled
    bar   [1c] = type Prefetchable Memory, range 64, base 0xe2810000, size 32768, enabled
    cap 01[40] = powerspec 3  supports D0 D3  current D0
    cap 05[50] = MSI supports 1 message, 64 bit, vector masks 
    cap 11[70] = MSI-X supports 129 messages, enabled
                 Table in map 0x1c[0x0], PBA in map 0x1c[0x1000]
    cap 10[a0] = PCI-Express 2 endpoint max data 512(2048) FLR RO
                 max read 512
                 link x8(x8) speed 8.0(8.0) ASPM L1(L1)
    ecap 0001[100] = AER 2 0 fatal 0 non-fatal 4 corrected
    ecap 0003[140] = Serial 1 edb227ffff6aeae8
    ecap 000e[150] = ARI 1
    ecap 0010[160] = SR-IOV 1 IOV disabled, Memory Space disabled, ARI disabled
                     0 VFs configured out of 32 supported
                     First VF RID Offset 0x012f, VF RID Stride 0x0001
                     VF Device ID 0x154c
                     Page Sizes: 4096 (enabled), 8192, 65536, 262144, 1048576, 4194304
    ecap 0017[1a0] = TPH Requester 1
    ecap 000d[1b0] = ACS 1

ixl2@pci0:1:0:2:	class=0x020000 rev=0x02 hdr=0x00 vendor=0x8086 device=0x1572 subvendor=0x8086 subdevice=0x0000
    vendor     = 'Intel Corporation'
    device     = 'Ethernet Controller X710 for 10GbE SFP+'
    class      = network
    subclass   = ethernet
    bar   [10] = type Prefetchable Memory, range 64, base 0xe1000000, size 8388608, enabled
    bar   [1c] = type Prefetchable Memory, range 64, base 0xe2808000, size 32768, enabled
    cap 01[40] = powerspec 3  supports D0 D3  current D0
    cap 05[50] = MSI supports 1 message, 64 bit, vector masks 
    cap 11[70] = MSI-X supports 129 messages, enabled
                 Table in map 0x1c[0x0], PBA in map 0x1c[0x1000]
    cap 10[a0] = PCI-Express 2 endpoint max data 512(2048) FLR RO
                 max read 512
                 link x8(x8) speed 8.0(8.0) ASPM L1(L1)
    ecap 0001[100] = AER 2 0 fatal 0 non-fatal 4 corrected
    ecap 0003[140] = Serial 1 edb227ffff6aeae8
    ecap 000e[150] = ARI 1
    ecap 0010[160] = SR-IOV 1 IOV disabled, Memory Space disabled, ARI disabled
                     0 VFs configured out of 32 supported
                     First VF RID Offset 0x014e, VF RID Stride 0x0001
                     VF Device ID 0x154c
                     Page Sizes: 4096 (enabled), 8192, 65536, 262144, 1048576, 4194304
    ecap 0017[1a0] = TPH Requester 1
    ecap 000d[1b0] = ACS 1

ixl3@pci0:1:0:3:	class=0x020000 rev=0x02 hdr=0x00 vendor=0x8086 device=0x1572 subvendor=0x8086 subdevice=0x0000
    vendor     = 'Intel Corporation'
    device     = 'Ethernet Controller X710 for 10GbE SFP+'
    class      = network
    subclass   = ethernet
    bar   [10] = type Prefetchable Memory, range 64, base 0xe0800000, size 8388608, enabled
    bar   [1c] = type Prefetchable Memory, range 64, base 0xe2800000, size 32768, enabled
    cap 01[40] = powerspec 3  supports D0 D3  current D0
    cap 05[50] = MSI supports 1 message, 64 bit, vector masks 
    cap 11[70] = MSI-X supports 129 messages, enabled
                 Table in map 0x1c[0x0], PBA in map 0x1c[0x1000]
    cap 10[a0] = PCI-Express 2 endpoint max data 512(2048) FLR RO
                 max read 512
                 link x8(x8) speed 8.0(8.0) ASPM L1(L1)
    ecap 0001[100] = AER 2 0 fatal 0 non-fatal 4 corrected
    ecap 0003[140] = Serial 1 edb227ffff6aeae8
    ecap 000e[150] = ARI 1
    ecap 0010[160] = SR-IOV 1 IOV disabled, Memory Space disabled, ARI disabled
                     0 VFs configured out of 32 supported
                     First VF RID Offset 0x016d, VF RID Stride 0x0001
                     VF Device ID 0x154c
                     Page Sizes: 4096 (enabled), 8192, 65536, 262144, 1048576, 4194304
    ecap 0017[1a0] = TPH Requester 1
    ecap 000d[1b0] = ACS 1

xhci0@pci0:2:0:0:	class=0x0c0330 rev=0x00 hdr=0x00 vendor=0x1022 device=0x43ec subvendor=0x1b21 subdevice=0x1142
    vendor     = 'Advanced Micro Devices, Inc. [AMD]'
    class      = serial bus
    subclass   = USB
    bar   [10] = type Memory, range 64, base 0xfcca0000, size 32768, enabled
    cap 05[50] = MSI supports 8 messages, 64 bit 
    cap 11[68] = MSI-X supports 8 messages, enabled
                 Table in map 0x10[0x2000], PBA in map 0x10[0x2080]
    cap 01[78] = powerspec 3  supports D0 D3  current D0
    cap 10[80] = PCI-Express 2 legacy endpoint max data 128(512) RO NS
                 max read 512
                 link x4(x4) speed 8.0(8.0) ASPM L1(L0s/L1)
    ecap 0001[100] = AER 1 0 fatal 0 non-fatal 1 corrected
    ecap 0019[200] = PCIe Sec 1 lane errors 0
    ecap 0018[300] = LTR 1

ahci0@pci0:2:0:1:	class=0x010601 rev=0x00 hdr=0x00 vendor=0x1022 device=0x43eb subvendor=0x1b21 subdevice=0x1062
    vendor     = 'Advanced Micro Devices, Inc. [AMD]'
    class      = mass storage
    subclass   = SATA
    bar   [24] = type Memory, range 32, base 0xfcc80000, size 131072, enabled
    cap 05[50] = MSI supports 1 message, 64 bit enabled with 1 message
    cap 01[78] = powerspec 3  supports D0 D3  current D0
    cap 10[80] = PCI-Express 2 legacy endpoint max data 128(512) RO NS
                 max read 512
                 link x4(x4) speed 8.0(8.0) ASPM L1(L0s/L1)
    ecap 0001[100] = AER 1 0 fatal 0 non-fatal 1 corrected

pcib3@pci0:2:0:2:	class=0x060400 rev=0x00 hdr=0x01 vendor=0x1022 device=0x43e9 subvendor=0x1b21 subdevice=0x0201
    vendor     = 'Advanced Micro Devices, Inc. [AMD]'
    class      = bridge
    subclass   = PCI-PCI
    cap 05[50] = MSI supports 1 message, 64 bit 
    cap 01[78] = powerspec 3  supports D0 D3  current D0
    cap 10[80] = PCI-Express 2 upstream port max data 128(512) RO NS
                 max read 512
                 link x4(x4) speed 8.0(8.0) ASPM L1(L0s/L1)
    cap 0d[c0] = PCI Bridge subvendor=0x1b21 subdevice=0x0201
    ecap 0001[100] = AER 1 0 fatal 0 non-fatal 1 corrected

pcib4@pci0:3:0:0:	class=0x060400 rev=0x00 hdr=0x01 vendor=0x1022 device=0x43ea subvendor=0x1b21 subdevice=0x3308
    vendor     = 'Advanced Micro Devices, Inc. [AMD]'
    class      = bridge
    subclass   = PCI-PCI
    cap 05[50] = MSI supports 1 message, 64 bit 
    cap 01[78] = powerspec 3  supports D0 D3  current D0
    cap 10[80] = PCI-Express 2 downstream port max data 128(512) RO NS
                 max read 512
                 link x1(x1) speed 2.5(8.0) ASPM L1(L1)
                 slot 1 power limit 26000 mW
    cap 0d[c0] = PCI Bridge subvendor=0x1b21 subdevice=0x3308
    ecap 0001[100] = AER 1 0 fatal 0 non-fatal 0 corrected
    ecap 0019[200] = PCIe Sec 1 lane errors 0

none0@pci0:4:0:0:	class=0x020000 rev=0x15 hdr=0x00 vendor=0x10ec device=0x8168 subvendor=0x1849 subdevice=0x8168
    vendor     = 'Realtek Semiconductor Co., Ltd.'
    device     = 'RTL8111/8168/8411 PCI Express Gigabit Ethernet Controller'
    class      = network
    subclass   = ethernet
    bar   [10] = type I/O Port, range 32, base 0xf000, size 256, enabled
    bar   [18] = type Memory, range 64, base 0xfcb04000, size 4096, enabled
    bar   [20] = type Memory, range 64, base 0xfcb00000, size 16384, enabled
    cap 01[40] = powerspec 3  supports D0 D1 D2 D3  current D0
    cap 05[50] = MSI supports 1 message, 64 bit 
    cap 10[70] = PCI-Express 2 endpoint MSI 1 max data 128(128) RO
                 max read 512
                 link x1(x1) speed 2.5(2.5) ASPM disabled(L0s/L1) ClockPM disabled
    cap 11[b0] = MSI-X supports 4 messages
                 Table in map 0x20[0x0], PBA in map 0x20[0x800]
    ecap 0001[100] = AER 2 0 fatal 0 non-fatal 0 corrected
    ecap 0002[140] = VC 1 max VC0
    ecap 0003[160] = Serial 1 3cc35559a1a80000
    ecap 0018[170] = LTR 1
    ecap 001e[178] = L1 PM Substates 1

nvme0@pci0:5:0:0:	class=0x010802 rev=0x00 hdr=0x00 vendor=0x144d device=0xa809 subvendor=0x144d subdevice=0xa801
    vendor     = 'Samsung Electronics Co Ltd'
    device     = 'NVMe SSD Controller 980'
    class      = mass storage
    subclass   = NVM
    bar   [10] = type Memory, range 64, base 0xfcf00000, size 16384, enabled
    cap 01[40] = powerspec 3  supports D0 D3  current D0
    cap 05[50] = MSI supports 32 messages, 64 bit 
    cap 10[70] = PCI-Express 2 endpoint max data 256(256) FLR RO NS
                 max read 512
                 link x4(x4) speed 8.0(8.0) ASPM L1(L1) ClockPM enabled
    cap 11[b0] = MSI-X supports 13 messages, enabled
                 Table in map 0x10[0x3000], PBA in map 0x10[0x2000]
    ecap 0001[100] = AER 2 0 fatal 0 non-fatal 1 corrected
    ecap 0003[148] = Serial 1 0000000000000000
    ecap 0004[158] = Power Budgeting 1
    ecap 0019[168] = PCIe Sec 1 lane errors 0
    ecap 0018[188] = LTR 1
    ecap 001e[190] = L1 PM Substates 1

vgapci0@pci0:6:0:0:	class=0x030000 rev=0xd9 hdr=0x00 vendor=0x1002 device=0x1636 subvendor=0x1002 subdevice=0x1636
    vendor     = 'Advanced Micro Devices, Inc. [AMD/ATI]'
    device     = 'Renoir'
    class      = display
    subclass   = VGA
    bar   [10] = type Prefetchable Memory, range 64, base 0xd0000000, size 268435456, enabled
    bar   [18] = type Prefetchable Memory, range 64, base 0xe0000000, size 2097152, enabled
    bar   [20] = type I/O Port, range 32, base 0xe000, size 256, enabled
    bar   [24] = type Memory, range 32, base 0xfca00000, size 524288, enabled
    cap 09[48] = vendor (length 8)
    cap 01[50] = powerspec 3  supports D0 D3  current D0
    cap 10[64] = PCI-Express 2 legacy endpoint max data 256(256) RO NS
                 max read 512
                 link x16(x16) speed 8.0(8.0) ASPM disabled(L0s/L1)
    cap 05[a0] = MSI supports 4 messages, 64 bit 
    cap 11[c0] = MSI-X supports 4 messages
                 Table in map 0x24[0x42000], PBA in map 0x24[0x43000]
    ecap 000b[100] = Vendor [1] ID 0001 Rev 1 Length 16
    ecap 0019[270] = PCIe Sec 1 lane errors 0
    ecap 000f[2b0] = ATS 1
    ecap 0013[2c0] = Page Page Request 1
    ecap 001b[2d0] = Process Address Space ID 1
    ecap 0025[400] = Data Link Feature 1
    ecap 0026[410] = Physical Layer 16.0 GT/s 1
    ecap 0027[440] = Lane Margining at Receiver 1

hdac0@pci0:6:0:1:	class=0x040300 rev=0x00 hdr=0x00 vendor=0x1002 device=0x1637 subvendor=0x1002 subdevice=0x1637
    vendor     = 'Advanced Micro Devices, Inc. [AMD/ATI]'
    device     = 'Renoir Radeon High Definition Audio Controller'
    class      = multimedia
    subclass   = HDA
    bar   [10] = type Memory, range 32, base 0xfca88000, size 16384, enabled
    cap 09[48] = vendor (length 8)
    cap 01[50] = powerspec 3  supports D0 D3  current D0
    cap 10[64] = PCI-Express 2 legacy endpoint max data 256(256) RO NS
                 max read 512
                 link x16(x16) speed 8.0(8.0) ASPM disabled(L0s/L1)
    cap 05[a0] = MSI supports 1 message, 64 bit enabled with 1 message
    ecap 000b[100] = Vendor [1] ID 0001 Rev 1 Length 16

none1@pci0:6:0:2:	class=0x108000 rev=0x00 hdr=0x00 vendor=0x1022 device=0x15df subvendor=0x1022 subdevice=0x15df
    vendor     = 'Advanced Micro Devices, Inc. [AMD]'
    device     = 'Family 17h (Models 10h-1fh) Platform Security Processor'
    class      = encrypt/decrypt
    bar   [18] = type Memory, range 32, base 0xfc900000, size 1048576, enabled
    bar   [24] = type Memory, range 32, base 0xfca8c000, size 8192, enabled
    cap 09[48] = vendor (length 8)
    cap 01[50] = powerspec 3  supports D0 D3  current D0
    cap 10[64] = PCI-Express 2 endpoint max data 256(256) RO NS
                 max read 512
                 link x16(x16) speed 8.0(8.0) ASPM disabled(L0s/L1)
    cap 05[a0] = MSI supports 2 messages, 64 bit 
    cap 11[c0] = MSI-X supports 2 messages
                 Table in map 0x24[0x0], PBA in map 0x24[0x1000]
    ecap 000b[100] = Vendor [1] ID 0001 Rev 1 Length 16

xhci1@pci0:6:0:3:	class=0x0c0330 rev=0x00 hdr=0x00 vendor=0x1022 device=0x1639 subvendor=0x1849 subdevice=0xffff
    vendor     = 'Advanced Micro Devices, Inc. [AMD]'
    device     = 'Renoir/Cezanne USB 3.1'
    class      = serial bus
    subclass   = USB
    bar   [10] = type Memory, range 64, base 0xfc800000, size 1048576, enabled
    cap 09[48] = vendor (length 8)
    cap 01[50] = powerspec 3  supports D0 D3  current D0
    cap 10[64] = PCI-Express 2 endpoint max data 256(256) RO NS
                 max read 512
                 link x16(x16) speed 8.0(8.0) ASPM disabled(L0s/L1)
    cap 05[a0] = MSI supports 8 messages, 64 bit 
    cap 11[c0] = MSI-X supports 8 messages, enabled
                 Table in map 0x10[0xfe000], PBA in map 0x10[0xff000]
    ecap 000b[100] = Vendor [1] ID 0001 Rev 1 Length 16

xhci2@pci0:6:0:4:	class=0x0c0330 rev=0x00 hdr=0x00 vendor=0x1022 device=0x1639 subvendor=0x1849 subdevice=0xffff
    vendor     = 'Advanced Micro Devices, Inc. [AMD]'
    device     = 'Renoir/Cezanne USB 3.1'
    class      = serial bus
    subclass   = USB
    bar   [10] = type Memory, range 64, base 0xfc700000, size 1048576, enabled
    cap 09[48] = vendor (length 8)
    cap 01[50] = powerspec 3  supports D0 D3  current D0
    cap 10[64] = PCI-Express 2 endpoint max data 256(256) RO NS
                 max read 512
                 link x16(x16) speed 8.0(8.0) ASPM disabled(L0s/L1)
    cap 05[a0] = MSI supports 8 messages, 64 bit 
    cap 11[c0] = MSI-X supports 8 messages, enabled
                 Table in map 0x10[0xfe000], PBA in map 0x10[0xff000]
    ecap 000b[100] = Vendor [1] ID 0001 Rev 1 Length 16

hdac1@pci0:6:0:6:	class=0x040300 rev=0x00 hdr=0x00 vendor=0x1022 device=0x15e3 subvendor=0x1849 subdevice=0x288a
    vendor     = 'Advanced Micro Devices, Inc. [AMD]'
    device     = 'Family 17h (Models 10h-1fh) HD Audio Controller'
    class      = multimedia
    subclass   = HDA
    bar   [10] = type Memory, range 32, base 0xfca80000, size 32768, enabled
    cap 09[48] = vendor (length 8)
    cap 01[50] = powerspec 3  supports D0 D3  current D0
    cap 10[64] = PCI-Express 2 endpoint max data 256(256) RO NS
                 max read 512
                 link x16(x16) speed 8.0(8.0) ASPM disabled(L0s/L1)
    cap 05[a0] = MSI supports 1 message, 64 bit enabled with 1 message
    ecap 000b[100] = Vendor [1] ID 0001 Rev 1 Length 16
