hostb0@pci0:0:0:0:	class=0x060000 rev=0x00 hdr=0x00 vendor=0x1022 device=0x1630 subvendor=0x1022 subdevice=0x1630
    vendor     = 'Advanced Micro Devices, Inc. [AMD]'
    device     = 'Renoir/Cezanne Root Complex'
    class      = bridge
    subclass   = HOST-PCI

none0@pci0:0:0:2:	class=0x080600 rev=0x00 hdr=0x00 vendor=0x1022 device=0x1631 subvendor=0x1022 subdevice=0x1631
    vendor     = 'Advanced Micro Devices, Inc. [AMD]'
    device     = 'Renoir/Cezanne IOMMU'
    class      = base peripheral
    subclass   = IOMMU
    cap 0f[40] = unknown
    cap 05[64] = MSI supports 4 messages, 64 bit 
    cap 08[74] = HT MSI fixed address window enabled at 0xfee00000

hostb1@pci0:0:1:0:	class=0x060000 rev=0x00 hdr=0x00 vendor=0x1022 device=0x1632 subvendor=0x0000 subdevice=0x0000
    vendor     = 'Advanced Micro Devices, Inc. [AMD]'
    device     = 'Renoir PCIe Dummy Host Bridge'
    class      = bridge
    subclass   = HOST-PCI

pcib1@pci0:0:1:3:	class=0x060400 rev=0x00 hdr=0x01 vendor=0x1022 device=0x1634 subvendor=0x1022 subdevice=0x1453
    vendor     = 'Advanced Micro Devices, Inc. [AMD]'
    device     = 'Renoir/Cezanne PCIe GPP Bridge'
    class      = bridge
    subclass   = PCI-PCI
    cap 01[50] = powerspec 3  supports D0 D3  current D0
    cap 10[58] = PCI-Express 2 root port max data 128(512) RO NS ARI disabled
                 max read 128
                 link x1(x1) speed 2.5(8.0) ASPM L1(L1)
                 slot 0 power limit 75000 mW
    cap 05[a0] = MSI supports 1 message, 64 bit 
    cap 0d[c0] = PCI Bridge subvendor=0x1022 subdevice=0x1453
    cap 08[c8] = HT MSI fixed address window enabled at 0xfee00000
    ecap 000b[100] = Vendor [1] ID 0001 Rev 1 Length 16
    ecap 0019[270] = PCIe Sec 1 lane errors 0
    ecap 000d[2a0] = ACS 1
    ecap 001e[370] = L1 PM Substates 1

hostb2@pci0:0:2:0:	class=0x060000 rev=0x00 hdr=0x00 vendor=0x1022 device=0x1632 subvendor=0x0000 subdevice=0x0000
    vendor     = 'Advanced Micro Devices, Inc. [AMD]'
    device     = 'Renoir PCIe Dummy Host Bridge'
    class      = bridge
    subclass   = HOST-PCI

pcib2@pci0:0:2:3:	class=0x060400 rev=0x00 hdr=0x01 vendor=0x1022 device=0x1634 subvendor=0x1022 subdevice=0x1453
    vendor     = 'Advanced Micro Devices, Inc. [AMD]'
    device     = 'Renoir/Cezanne PCIe GPP Bridge'
    class      = bridge
    subclass   = PCI-PCI
    cap 01[50] = powerspec 3  supports D0 D3  current D0
    cap 10[58] = PCI-Express 2 root port max data 512(512) RO NS ARI disabled
                 max read 128
                 link x4(x8) speed 5.0(8.0) ASPM L1(L1)
                 slot 0 power limit 75000 mW
    cap 05[a0] = MSI supports 1 message, 64 bit 
    cap 0d[c0] = PCI Bridge subvendor=0x1022 subdevice=0x1453
    cap 08[c8] = HT MSI fixed address window enabled at 0xfee00000
    ecap 000b[100] = Vendor [1] ID 0001 Rev 1 Length 16
    ecap 0019[270] = PCIe Sec 1 lane errors 0
    ecap 000d[2a0] = ACS 1

hostb3@pci0:0:8:0:	class=0x060000 rev=0x00 hdr=0x00 vendor=0x1022 device=0x1632 subvendor=0x0000 subdevice=0x0000
    vendor     = 'Advanced Micro Devices, Inc. [AMD]'
    device     = 'Renoir PCIe Dummy Host Bridge'
    class      = bridge
    subclass   = HOST-PCI

pcib3@pci0:0:8:1:	class=0x060400 rev=0x00 hdr=0x01 vendor=0x1022 device=0x1635 subvendor=0x1022 subdevice=0x1635
    vendor     = 'Advanced Micro Devices, Inc. [AMD]'
    device     = 'Renoir Internal PCIe GPP Bridge to Bus'
    class      = bridge
    subclass   = PCI-PCI
    cap 01[50] = powerspec 3  supports D0 D3  current D0
    cap 10[58] = PCI-Express 2 root port max data 256(512) RO NS
                 max read 512
                 link x16(x16) speed 8.0(8.0) ASPM disabled(L0s/L1)
    cap 05[a0] = MSI supports 1 message, 64 bit 
    cap 0d[c0] = PCI Bridge subvendor=0x1022 subdevice=0x1635
    ecap 000b[100] = Vendor [1] ID 0001 Rev 1 Length 16
    ecap 0019[270] = PCIe Sec 1 lane errors 0
    ecap 000d[2a0] = ACS 1
    ecap 0025[400] = Data Link Feature 1
    ecap 0026[410] = Physical Layer 16.0 GT/s 1
    ecap 0027[440] = Lane Margining at Receiver 1

none1@pci0:0:20:0:	class=0x0c0500 rev=0x51 hdr=0x00 vendor=0x1022 device=0x790b subvendor=0x1022 subdevice=0x790b
    vendor     = 'Advanced Micro Devices, Inc. [AMD]'
    device     = 'FCH SMBus Controller'
    class      = serial bus
    subclass   = SMBus

isab0@pci0:0:20:3:	class=0x060100 rev=0x51 hdr=0x00 vendor=0x1022 device=0x790e subvendor=0x1022 subdevice=0x790e
    vendor     = 'Advanced Micro Devices, Inc. [AMD]'
    device     = 'FCH LPC Bridge'
    class      = bridge
    subclass   = PCI-ISA

hostb4@pci0:0:24:0:	class=0x060000 rev=0x00 hdr=0x00 vendor=0x1022 device=0x166a subvendor=0x0000 subdevice=0x0000
    vendor     = 'Advanced Micro Devices, Inc. [AMD]'
    device     = 'Cezanne Data Fabric; Function 0'
    class      = bridge
    subclass   = HOST-PCI

hostb5@pci0:0:24:1:	class=0x060000 rev=0x00 hdr=0x00 vendor=0x1022 device=0x166b subvendor=0x0000 subdevice=0x0000
    vendor     = 'Advanced Micro Devices, Inc. [AMD]'
    device     = 'Cezanne Data Fabric; Function 1'
    class      = bridge
    subclass   = HOST-PCI

hostb6@pci0:0:24:2:	class=0x060000 rev=0x00 hdr=0x00 vendor=0x1022 device=0x166c subvendor=0x0000 subdevice=0x0000
    vendor     = 'Advanced Micro Devices, Inc. [AMD]'
    device     = 'Cezanne Data Fabric; Function 2'
    class      = bridge
    subclass   = HOST-PCI

hostb7@pci0:0:24:3:	class=0x060000 rev=0x00 hdr=0x00 vendor=0x1022 device=0x166d subvendor=0x0000 subdevice=0x0000
    vendor     = 'Advanced Micro Devices, Inc. [AMD]'
    device     = 'Cezanne Data Fabric; Function 3'
    class      = bridge
    subclass   = HOST-PCI

hostb8@pci0:0:24:4:	class=0x060000 rev=0x00 hdr=0x00 vendor=0x1022 device=0x166e subvendor=0x0000 subdevice=0x0000
    vendor     = 'Advanced Micro Devices, Inc. [AMD]'
    device     = 'Cezanne Data Fabric; Function 4'
    class      = bridge
    subclass   = HOST-PCI

hostb9@pci0:0:24:5:	class=0x060000 rev=0x00 hdr=0x00 vendor=0x1022 device=0x166f subvendor=0x0000 subdevice=0x0000
    vendor     = 'Advanced Micro Devices, Inc. [AMD]'
    device     = 'Cezanne Data Fabric; Function 5'
    class      = bridge
    subclass   = HOST-PCI

hostb10@pci0:0:24:6:	class=0x060000 rev=0x00 hdr=0x00 vendor=0x1022 device=0x1670 subvendor=0x0000 subdevice=0x0000
    vendor     = 'Advanced Micro Devices, Inc. [AMD]'
    device     = 'Cezanne Data Fabric; Function 6'
    class      = bridge
    subclass   = HOST-PCI

hostb11@pci0:0:24:7:	class=0x060000 rev=0x00 hdr=0x00 vendor=0x1022 device=0x1671 subvendor=0x0000 subdevice=0x0000
    vendor     = 'Advanced Micro Devices, Inc. [AMD]'
    device     = 'Cezanne Data Fabric; Function 7'
    class      = bridge
    subclass   = HOST-PCI

iwm0@pci0:1:0:0:	class=0x028000 rev=0x59 hdr=0x00 vendor=0x8086 device=0x095a subvendor=0x8086 subdevice=0x5010
    vendor     = 'Intel Corporation'
    device     = 'Wireless 7265'
    class      = network
    bar   [10] = type Memory, range 64, base 0xfcf00000, size 8192, enabled
    cap 01[c8] = powerspec 3  supports D0 D3  current D0
    cap 05[d0] = MSI supports 1 message, 64 bit enabled with 1 message
    cap 10[40] = PCI-Express 2 endpoint max data 128(128) FLR RO NS
                 max read 128
                 link x1(x1) speed 2.5(2.5) ASPM L1(L1) ClockPM disabled
    ecap 0001[100] = AER 1 0 fatal 0 non-fatal 0 corrected
    ecap 0003[140] = Serial 1 2c8db1ffff48b3a9
    ecap 0018[14c] = LTR 1
    ecap 001e[154] = L1 PM Substates 1

nvme0@pci0:2:0:0:	class=0x010802 rev=0x01 hdr=0x00 vendor=0x1d97 device=0x5216 subvendor=0x1d97 subdevice=0x5216
    vendor     = 'Shenzhen Longsys Electronics Co., Ltd.'
    class      = mass storage
    subclass   = NVM
    bar   [10] = type Memory, range 64, base 0xfce20000, size 16384, enabled
    cap 01[40] = powerspec 3  supports D0 D3  current D0
    cap 05[50] = MSI supports 1 message, 64 bit, vector masks 
    cap 10[70] = PCI-Express 2 endpoint max data 512(512) FLR RO
                 max read 512
                 link x4(x4) speed 5.0(8.0) ASPM L1(L1)
    cap 11[b0] = MSI-X supports 9 messages, enabled
                 Table in map 0x10[0x2000], PBA in map 0x10[0x3000]
    ecap 0001[100] = AER 2 0 fatal 0 non-fatal 0 corrected
    ecap 0019[148] = PCIe Sec 1 lane errors 0
    ecap 0018[168] = LTR 1
    ecap 001e[170] = L1 PM Substates 1
    ecap 000b[180] = Vendor [1] ID 0001 Rev 1 Length 56
    ecap 0025[1b8] = Data Link Feature 1

vgapci0@pci0:3:0:0:	class=0x030000 rev=0xc1 hdr=0x00 vendor=0x1002 device=0x15e7 subvendor=0x1002 subdevice=0x1636
    vendor     = 'Advanced Micro Devices, Inc. [AMD/ATI]'
    device     = 'Barcelo'
    class      = display
    subclass   = VGA
    bar   [10] = type Prefetchable Memory, range 64, base 0xd0000000, size 268435456, enabled
    bar   [18] = type Prefetchable Memory, range 64, base 0xe0000000, size 2097152, enabled
    bar   [20] = type I/O Port, range 32, base 0xf000, size 256, enabled
    bar   [24] = type Memory, range 32, base 0xfcd00000, size 524288, enabled
    cap 09[48] = vendor (length 8)
    cap 01[50] = powerspec 3  supports D0 D3  current D0
    cap 10[64] = PCI-Express 2 legacy endpoint max data 256(256) RO NS
                 max read 512
                 link x16(x16) speed 8.0(8.0) ASPM disabled(L0s/L1)
    cap 05[a0] = MSI supports 4 messages, 64 bit enabled with 1 message
    cap 11[c0] = MSI-X supports 4 messages
                 Table in map 0x24[0x42000], PBA in map 0x24[0x43000]
    ecap 000b[100] = Vendor [1] ID 0001 Rev 1 Length 16
    ecap 0019[270] = PCIe Sec 1 lane errors 0
    ecap 000d[2a0] = ACS 1
    ecap 000f[2b0] = ATS 1
    ecap 0013[2c0] = Page Page Request 1
    ecap 001b[2d0] = Process Address Space ID 1
    ecap 0025[400] = Data Link Feature 1
    ecap 0026[410] = Physical Layer 16.0 GT/s 1
    ecap 0027[440] = Lane Margining at Receiver 1

hdac0@pci0:3:0:1:	class=0x040300 rev=0x00 hdr=0x00 vendor=0x1002 device=0x1637 subvendor=0x1002 subdevice=0x1637
    vendor     = 'Advanced Micro Devices, Inc. [AMD/ATI]'
    device     = 'Renoir Radeon High Definition Audio Controller'
    class      = multimedia
    subclass   = HDA
    bar   [10] = type Memory, range 32, base 0xfcdc8000, size 16384, enabled
    cap 09[48] = vendor (length 8)
    cap 01[50] = powerspec 3  supports D0 D3  current D0
    cap 10[64] = PCI-Express 2 legacy endpoint max data 256(256) RO NS
                 max read 512
                 link x16(x16) speed 8.0(8.0) ASPM disabled(L0s/L1)
    cap 05[a0] = MSI supports 1 message, 64 bit enabled with 1 message
    ecap 000b[100] = Vendor [1] ID 0001 Rev 1 Length 16
    ecap 000d[2a0] = ACS 1

none2@pci0:3:0:2:	class=0x108000 rev=0x00 hdr=0x00 vendor=0x1022 device=0x15df subvendor=0x1022 subdevice=0x15df
    vendor     = 'Advanced Micro Devices, Inc. [AMD]'
    device     = 'Family 17h (Models 10h-1fh) Platform Security Processor'
    class      = encrypt/decrypt
    bar   [18] = type Memory, range 32, base 0xfcc00000, size 1048576, enabled
    bar   [24] = type Memory, range 32, base 0xfcdce000, size 8192, enabled
    cap 09[48] = vendor (length 8)
    cap 01[50] = powerspec 3  supports D0 D3  current D0
    cap 10[64] = PCI-Express 2 endpoint max data 256(256) RO NS
                 max read 512
                 link x16(x16) speed 8.0(8.0) ASPM disabled(L0s/L1)
    cap 05[a0] = MSI supports 2 messages, 64 bit 
    cap 11[c0] = MSI-X supports 2 messages
                 Table in map 0x24[0x0], PBA in map 0x24[0x1000]
    ecap 000b[100] = Vendor [1] ID 0001 Rev 1 Length 16
    ecap 000d[2a0] = ACS 1

xhci0@pci0:3:0:3:	class=0x0c0330 rev=0x00 hdr=0x00 vendor=0x1022 device=0x1639 subvendor=0x1022 subdevice=0x1639
    vendor     = 'Advanced Micro Devices, Inc. [AMD]'
    device     = 'Renoir/Cezanne USB 3.1'
    class      = serial bus
    subclass   = USB
    bar   [10] = type Memory, range 64, base 0xfcb00000, size 1048576, enabled
    cap 09[48] = vendor (length 8)
    cap 01[50] = powerspec 3  supports D0 D3  current D0
    cap 10[64] = PCI-Express 2 endpoint max data 256(256) RO NS
                 max read 512
                 link x16(x16) speed 8.0(8.0) ASPM disabled(L0s/L1)
    cap 05[a0] = MSI supports 8 messages, 64 bit 
    cap 11[c0] = MSI-X supports 8 messages, enabled
                 Table in map 0x10[0xfe000], PBA in map 0x10[0xff000]
    ecap 000b[100] = Vendor [1] ID 0001 Rev 1 Length 16
    ecap 000d[2a0] = ACS 1

xhci1@pci0:3:0:4:	class=0x0c0330 rev=0x00 hdr=0x00 vendor=0x1022 device=0x1639 subvendor=0x1022 subdevice=0x1639
    vendor     = 'Advanced Micro Devices, Inc. [AMD]'
    device     = 'Renoir/Cezanne USB 3.1'
    class      = serial bus
    subclass   = USB
    bar   [10] = type Memory, range 64, base 0xfca00000, size 1048576, enabled
    cap 09[48] = vendor (length 8)
    cap 01[50] = powerspec 3  supports D0 D3  current D0
    cap 10[64] = PCI-Express 2 endpoint max data 256(256) RO NS
                 max read 512
                 link x16(x16) speed 8.0(8.0) ASPM disabled(L0s/L1)
    cap 05[a0] = MSI supports 8 messages, 64 bit 
    cap 11[c0] = MSI-X supports 8 messages, enabled
                 Table in map 0x10[0xfe000], PBA in map 0x10[0xff000]
    ecap 000b[100] = Vendor [1] ID 0001 Rev 1 Length 16
    ecap 000d[2a0] = ACS 1

none3@pci0:3:0:5:	class=0x048000 rev=0x01 hdr=0x00 vendor=0x1022 device=0x15e2 subvendor=0x1022 subdevice=0x15e2
    vendor     = 'Advanced Micro Devices, Inc. [AMD]'
    device     = 'ACP/ACP3X/ACP6x Audio Coprocessor'
    class      = multimedia
    bar   [10] = type Memory, range 32, base 0xfcd80000, size 262144, enabled
    cap 09[48] = vendor (length 8)
    cap 01[50] = powerspec 3  supports D0 D3  current D0
    cap 10[64] = PCI-Express 2 endpoint max data 256(256) RO NS
                 max read 512
                 link x16(x16) speed 8.0(8.0) ASPM disabled(L0s/L1)
    cap 05[a0] = MSI supports 1 message, 64 bit 
    ecap 000b[100] = Vendor [1] ID 0001 Rev 1 Length 16
    ecap 000d[2a0] = ACS 1

hdac1@pci0:3:0:6:	class=0x040300 rev=0x00 hdr=0x00 vendor=0x1022 device=0x15e3 subvendor=0x1e63 subdevice=0x6d9a
    vendor     = 'Advanced Micro Devices, Inc. [AMD]'
    device     = 'Family 17h/19h HD Audio Controller'
    class      = multimedia
    subclass   = HDA
    bar   [10] = type Memory, range 32, base 0xfcdc0000, size 32768, enabled
    cap 09[48] = vendor (length 8)
    cap 01[50] = powerspec 3  supports D0 D3  current D0
    cap 10[64] = PCI-Express 2 endpoint max data 256(256) RO NS
                 max read 512
                 link x16(x16) speed 8.0(8.0) ASPM disabled(L0s/L1)
    cap 05[a0] = MSI supports 1 message, 64 bit enabled with 1 message
    ecap 000b[100] = Vendor [1] ID 0001 Rev 1 Length 16
    ecap 000d[2a0] = ACS 1

none4@pci0:3:0:7:	class=0x118000 rev=0x00 hdr=0x00 vendor=0x1022 device=0x15e4 subvendor=0x1022 subdevice=0x15e4
    vendor     = 'Advanced Micro Devices, Inc. [AMD]'
    device     = 'Sensor Fusion Hub'
    class      = dasp
    bar   [18] = type Memory, range 32, base 0xfc900000, size 1048576, enabled
    bar   [24] = type Memory, range 32, base 0xfcdcc000, size 8192, enabled
    cap 09[48] = vendor (length 8)
    cap 01[50] = powerspec 3  supports D0 D3  current D0
    cap 10[64] = PCI-Express 2 endpoint max data 256(256) RO NS
                 max read 512
                 link x16(x16) speed 8.0(8.0) ASPM disabled(L0s/L1)
    cap 05[a0] = MSI supports 2 messages, 64 bit 
    cap 11[c0] = MSI-X supports 2 messages
                 Table in map 0x24[0x0], PBA in map 0x24[0x1000]
    ecap 000b[100] = Vendor [1] ID 0001 Rev 1 Length 16
    ecap 000d[2a0] = ACS 1
