hostb0@pci0:0:0:0:	class=0x060000 card=0x11d71734 chip=0x01588086 rev=0x09 hdr=0x00
    vendor     = 'Intel Corporation'
    device     = 'Xeon E3-1200 v2/Ivy Bridge DRAM Controller'
    class      = bridge
    subclass   = HOST-PCI
    cap 09[e0] = vendor (length 12) Intel cap 0 version 1

em0@pci0:0:25:0:	class=0x020000 card=0x11b71734 chip=0x15028086 rev=0x04 hdr=0x00
    vendor     = 'Intel Corporation'
    device     = '82579LM Gigabit Network Connection (Lewisville)'
    class      = network
    subclass   = ethernet
    bar   [10] = type Memory, range 32, base 0xefb00000, size 131072, enabled
    bar   [14] = type Memory, range 32, base 0xefb25000, size 4096, enabled
    bar   [18] = type I/O Port, range 32, base 0xf040, size 32, enabled
    cap 01[c8] = powerspec 2  supports D0 D3  current D0
    cap 05[d0] = MSI supports 1 message, 64 bit enabled with 1 message
    cap 13[e0] = PCI Advanced Features: FLR TP

ehci0@pci0:0:26:0:	class=0x0c0320 card=0x11cb1734 chip=0x1c2d8086 rev=0x04 hdr=0x00
    vendor     = 'Intel Corporation'
    device     = '6 Series/C200 Series Chipset Family USB Enhanced Host Controller'
    class      = serial bus
    subclass   = USB
    bar   [10] = type Memory, range 32, base 0xefb24000, size 1024, enabled
    cap 01[50] = powerspec 2  supports D0 D3  current D0
    cap 0a[58] = EHCI Debug Port at offset 0xa0 in map 0x14
    cap 13[98] = PCI Advanced Features: FLR TP

pcib1@pci0:0:28:0:	class=0x060400 card=0x11cb1734 chip=0x1c108086 rev=0xb4 hdr=0x01
    vendor     = 'Intel Corporation'
    device     = '6 Series/C200 Series Chipset Family PCI Express Root Port 1'
    class      = bridge
    subclass   = PCI-PCI
    cap 10[40] = PCI-Express 2 root port max data 128(128)
                 link x0(x4) speed 0.0(5.0) ASPM disabled(L0s/L1)
                 slot 1 power limit 250 mW
    cap 05[80] = MSI supports 1 message 
    cap 0d[90] = PCI Bridge card=0x11cb1734
    cap 01[a0] = powerspec 2  supports D0 D3  current D0

pcib2@pci0:0:28:4:	class=0x060400 card=0x11cb1734 chip=0x1c188086 rev=0xb4 hdr=0x01
    vendor     = 'Intel Corporation'
    device     = '6 Series/C200 Series Chipset Family PCI Express Root Port 5'
    class      = bridge
    subclass   = PCI-PCI
    cap 10[40] = PCI-Express 2 root port max data 128(128)
                 link x1(x1) speed 2.5(5.0) ASPM disabled(L0s/L1)
                 slot 2 power limit 100 mW
    cap 05[80] = MSI supports 1 message 
    cap 0d[90] = PCI Bridge card=0x11cb1734
    cap 01[a0] = powerspec 2  supports D0 D3  current D0

pcib3@pci0:0:28:6:	class=0x060400 card=0x11cb1734 chip=0x1c1c8086 rev=0xb4 hdr=0x01
    vendor     = 'Intel Corporation'
    device     = '6 Series/C200 Series Chipset Family PCI Express Root Port 7'
    class      = bridge
    subclass   = PCI-PCI
    cap 10[40] = PCI-Express 2 root port max data 128(128)
                 link x1(x1) speed 2.5(5.0) ASPM disabled(L0s/L1)
    cap 05[80] = MSI supports 1 message 
    cap 0d[90] = PCI Bridge card=0x11cb1734
    cap 01[a0] = powerspec 2  supports D0 D3  current D0

pcib4@pci0:0:28:7:	class=0x060400 card=0x11cb1734 chip=0x1c1e8086 rev=0xb4 hdr=0x01
    vendor     = 'Intel Corporation'
    device     = '6 Series/C200 Series Chipset Family PCI Express Root Port 8'
    class      = bridge
    subclass   = PCI-PCI
    cap 10[40] = PCI-Express 2 root port max data 128(128)
                 link x1(x1) speed 2.5(5.0) ASPM disabled(L0s/L1)
    cap 05[80] = MSI supports 1 message 
    cap 0d[90] = PCI Bridge card=0x11cb1734
    cap 01[a0] = powerspec 2  supports D0 D3  current D0

ehci1@pci0:0:29:0:	class=0x0c0320 card=0x11cb1734 chip=0x1c268086 rev=0x04 hdr=0x00
    vendor     = 'Intel Corporation'
    device     = '6 Series/C200 Series Chipset Family USB Enhanced Host Controller'
    class      = serial bus
    subclass   = USB
    bar   [10] = type Memory, range 32, base 0xefb23000, size 1024, enabled
    cap 01[50] = powerspec 2  supports D0 D3  current D0
    cap 0a[58] = EHCI Debug Port at offset 0xa0 in map 0x14
    cap 13[98] = PCI Advanced Features: FLR TP

pcib5@pci0:0:30:0:	class=0x060401 card=0x11cb1734 chip=0x244e8086 rev=0xa4 hdr=0x01
    vendor     = 'Intel Corporation'
    device     = '82801 PCI Bridge'
    class      = bridge
    subclass   = PCI-PCI
    cap 0d[50] = PCI Bridge card=0x11cb1734

isab0@pci0:0:31:0:	class=0x060100 card=0x11cb1734 chip=0x1c528086 rev=0x04 hdr=0x00
    vendor     = 'Intel Corporation'
    device     = 'C202 Chipset LPC Controller'
    class      = bridge
    subclass   = PCI-ISA
    cap 09[e0] = vendor (length 12) Intel cap 1 version 0
		 features: AMT, 4 PCI-e x1 slots

ahci0@pci0:0:31:2:	class=0x010601 card=0x11cb1734 chip=0x1c028086 rev=0x04 hdr=0x00
    vendor     = 'Intel Corporation'
    device     = '6 Series/C200 Series Chipset Family 6 port Desktop SATA AHCI Controller'
    class      = mass storage
    subclass   = SATA
    bar   [10] = type I/O Port, range 32, base 0xf090, size 8, enabled
    bar   [14] = type I/O Port, range 32, base 0xf080, size 4, enabled
    bar   [18] = type I/O Port, range 32, base 0xf070, size 8, enabled
    bar   [1c] = type I/O Port, range 32, base 0xf060, size 4, enabled
    bar   [20] = type I/O Port, range 32, base 0xf020, size 32, enabled
    bar   [24] = type Memory, range 32, base 0xefb22000, size 2048, enabled
    cap 05[80] = MSI supports 1 message enabled with 1 message
    cap 01[70] = powerspec 3  supports D0 D3  current D0
    cap 12[a8] = SATA Index-Data Pair
    cap 13[b0] = PCI Advanced Features: FLR TP

none0@pci0:0:31:3:	class=0x0c0500 card=0x11cb1734 chip=0x1c228086 rev=0x04 hdr=0x00
    vendor     = 'Intel Corporation'
    device     = '6 Series/C200 Series Chipset Family SMBus Controller'
    class      = serial bus
    subclass   = SMBus
    bar   [10] = type Memory, range 64, base 0xefb21000, size 256, enabled
    bar   [20] = type I/O Port, range 32, base 0xf000, size 32, enabled

em1@pci0:2:0:0:	class=0x020000 card=0xa01f8086 chip=0x10d38086 rev=0x00 hdr=0x00
    vendor     = 'Intel Corporation'
    device     = '82574L Gigabit Network Connection'
    class      = network
    subclass   = ethernet
    bar   [10] = type Memory, range 32, base 0xefac0000, size 131072, enabled
    bar   [14] = type Memory, range 32, base 0xefa00000, size 524288, enabled
    bar   [18] = type I/O Port, range 32, base 0xe000, size 32, enabled
    bar   [1c] = type Memory, range 32, base 0xefae0000, size 16384, enabled
    cap 01[c8] = powerspec 2  supports D0 D3  current D0
    cap 05[d0] = MSI supports 1 message, 64 bit 
    cap 10[e0] = PCI-Express 1 endpoint max data 128(256) NS
                 link x1(x1) speed 2.5(2.5) ASPM disabled(L0s/L1)
    cap 11[a0] = MSI-X supports 5 messages, enabled
                 Table in map 0x1c[0x0], PBA in map 0x1c[0x2000]
    ecap 0001[100] = AER 1 0 fatal 0 non-fatal 0 corrected
    ecap 0003[140] = Serial 1 6805caffff0cb8d8

em2@pci0:3:0:0:	class=0x020000 card=0x11921734 chip=0x10d38086 rev=0x00 hdr=0x00
    vendor     = 'Intel Corporation'
    device     = '82574L Gigabit Network Connection'
    class      = network
    subclass   = ethernet
    bar   [10] = type Memory, range 32, base 0xef900000, size 131072, enabled
    bar   [18] = type I/O Port, range 32, base 0xd000, size 32, enabled
    bar   [1c] = type Memory, range 32, base 0xef920000, size 16384, enabled
    cap 01[c8] = powerspec 2  supports D0 D3  current D0
    cap 05[d0] = MSI supports 1 message, 64 bit 
    cap 10[e0] = PCI-Express 1 endpoint max data 128(256) NS
                 link x1(x1) speed 2.5(2.5) ASPM disabled(L0s/L1)
    cap 11[a0] = MSI-X supports 5 messages, enabled
                 Table in map 0x1c[0x0], PBA in map 0x1c[0x2000]
    ecap 0001[100] = AER 1 0 fatal 0 non-fatal 0 corrected
    ecap 0003[140] = Serial 1 00224dffff684ae8

vgapci0@pci0:4:0:0:	class=0x030000 card=0x11cc1734 chip=0x0522102b rev=0x05 hdr=0x00
    vendor     = 'Matrox Electronics Systems Ltd.'
    device     = 'MGA G200e [Pilot] ServerEngines (SEP1)'
    class      = display
    subclass   = VGA
    bar   [10] = type Memory, range 32, base 0xee000000, size 16777216, enabled
    bar   [14] = type Memory, range 32, base 0xef800000, size 16384, enabled
    bar   [18] = type Memory, range 32, base 0xef000000, size 8388608, enabled
    cap 01[dc] = powerspec 2  supports D0 D3  current D0
    cap 10[e4] = PCI-Express 1 legacy endpoint max data 128(256)
                 link x1(x1) speed 2.5(2.5) ASPM disabled(L0s)
    cap 05[54] = MSI supports 1 message 
