hostb0@pci0:0:0:0:	class=0x060000 card=0x15d01022 chip=0x15d01022 rev=0x00 hdr=0x00
    vendor     = 'Advanced Micro Devices, Inc. [AMD]'
    class      = bridge
    subclass   = HOST-PCI

none0@pci0:0:0:2:	class=0x080600 card=0x15d11022 chip=0x15d11022 rev=0x00 hdr=0x00
    vendor     = 'Advanced Micro Devices, Inc. [AMD]'
    class      = base peripheral
    subclass   = IOMMU
    cap 0f[40] = unknown
    cap 05[64] = MSI supports 4 messages, 64 bit 
    cap 08[74] = HT MSI fixed address window enabled at 0xfee00000

hostb1@pci0:0:1:0:	class=0x060000 card=0x00000000 chip=0x14521022 rev=0x00 hdr=0x00
    vendor     = 'Advanced Micro Devices, Inc. [AMD]'
    device     = 'Family 17h (Models 00h-1fh) PCIe Dummy Host Bridge'
    class      = bridge
    subclass   = HOST-PCI

pcib1@pci0:0:1:1:	class=0x060400 card=0x14531022 chip=0x15d31022 rev=0x00 hdr=0x01
    vendor     = 'Advanced Micro Devices, Inc. [AMD]'
    class      = bridge
    subclass   = PCI-PCI
    cap 01[50] = powerspec 3  supports D0 D3  current D0
    cap 10[58] = PCI-Express 2 root port max data 512(512) RO NS ARI enabled
                 link x1(x8) speed 5.0(8.0) ASPM disabled(L1)
                 slot 0 power limit 0 mW
    cap 05[a0] = MSI supports 1 message, 64 bit 
    cap 0d[c0] = PCI Bridge card=0x14531022
    cap 08[c8] = HT MSI fixed address window enabled at 0xfee00000
    ecap 000b[100] = Vendor 1 ID 1
    ecap 0001[150] = AER 2 0 fatal 0 non-fatal 0 corrected
    ecap 0019[270] = PCIe Sec 1 lane errors 0
    ecap 000d[2a0] = ACS 1
    ecap 001e[370] = unknown 1
    ecap 0023[3c4] = unknown 1

pcib2@pci0:0:1:2:	class=0x060400 card=0x14531022 chip=0x15d31022 rev=0x00 hdr=0x01
    vendor     = 'Advanced Micro Devices, Inc. [AMD]'
    class      = bridge
    subclass   = PCI-PCI
    cap 01[50] = powerspec 3  supports D0 D3  current D0
    cap 10[58] = PCI-Express 2 root port max data 256(512) RO NS ARI disabled
                 link x4(x4) speed 8.0(8.0) ASPM disabled(L1)
                 slot 0 power limit 0 mW
    cap 05[a0] = MSI supports 1 message, 64 bit 
    cap 0d[c0] = PCI Bridge card=0x14531022
    cap 08[c8] = HT MSI fixed address window enabled at 0xfee00000
    ecap 000b[100] = Vendor 1 ID 1
    ecap 0001[150] = AER 2 0 fatal 0 non-fatal 0 corrected
    ecap 0019[270] = PCIe Sec 1 lane errors 0xf
    ecap 000d[2a0] = ACS 1
    ecap 001e[370] = unknown 1
    ecap 0023[3c4] = unknown 1

hostb2@pci0:0:8:0:	class=0x060000 card=0x00000000 chip=0x14521022 rev=0x00 hdr=0x00
    vendor     = 'Advanced Micro Devices, Inc. [AMD]'
    device     = 'Family 17h (Models 00h-1fh) PCIe Dummy Host Bridge'
    class      = bridge
    subclass   = HOST-PCI

pcib10@pci0:0:8:1:	class=0x060400 card=0x00001022 chip=0x15db1022 rev=0x00 hdr=0x01
    vendor     = 'Advanced Micro Devices, Inc. [AMD]'
    class      = bridge
    subclass   = PCI-PCI
    cap 01[50] = powerspec 3  supports D0 D3  current D0
    cap 10[58] = PCI-Express 2 root port max data 256(512) RO NS
                 link x16(x16) speed 8.0(8.0) ASPM disabled(L0s/L1)
    cap 05[a0] = MSI supports 1 message, 64 bit 
    cap 0d[c0] = PCI Bridge card=0x00001022
    ecap 000b[100] = Vendor 1 ID 1
    ecap 0019[270] = PCIe Sec 1 lane errors 0
    ecap 000d[2a0] = ACS 1

intsmb0@pci0:0:20:0:	class=0x0c0500 card=0x7c371462 chip=0x790b1022 rev=0x61 hdr=0x00
    vendor     = 'Advanced Micro Devices, Inc. [AMD]'
    device     = 'FCH SMBus Controller'
    class      = serial bus
    subclass   = SMBus

isab0@pci0:0:20:3:	class=0x060100 card=0x7c371462 chip=0x790e1022 rev=0x51 hdr=0x00
    vendor     = 'Advanced Micro Devices, Inc. [AMD]'
    device     = 'FCH LPC Bridge'
    class      = bridge
    subclass   = PCI-ISA

hostb3@pci0:0:24:0:	class=0x060000 card=0x00000000 chip=0x15e81022 rev=0x00 hdr=0x00
    vendor     = 'Advanced Micro Devices, Inc. [AMD]'
    class      = bridge
    subclass   = HOST-PCI

hostb4@pci0:0:24:1:	class=0x060000 card=0x00000000 chip=0x15e91022 rev=0x00 hdr=0x00
    vendor     = 'Advanced Micro Devices, Inc. [AMD]'
    class      = bridge
    subclass   = HOST-PCI

hostb5@pci0:0:24:2:	class=0x060000 card=0x00000000 chip=0x15ea1022 rev=0x00 hdr=0x00
    vendor     = 'Advanced Micro Devices, Inc. [AMD]'
    class      = bridge
    subclass   = HOST-PCI

hostb6@pci0:0:24:3:	class=0x060000 card=0x00000000 chip=0x15eb1022 rev=0x00 hdr=0x00
    vendor     = 'Advanced Micro Devices, Inc. [AMD]'
    class      = bridge
    subclass   = HOST-PCI

hostb7@pci0:0:24:4:	class=0x060000 card=0x00000000 chip=0x15ec1022 rev=0x00 hdr=0x00
    vendor     = 'Advanced Micro Devices, Inc. [AMD]'
    class      = bridge
    subclass   = HOST-PCI

hostb8@pci0:0:24:5:	class=0x060000 card=0x00000000 chip=0x15ed1022 rev=0x00 hdr=0x00
    vendor     = 'Advanced Micro Devices, Inc. [AMD]'
    class      = bridge
    subclass   = HOST-PCI

hostb9@pci0:0:24:6:	class=0x060000 card=0x00000000 chip=0x15ee1022 rev=0x00 hdr=0x00
    vendor     = 'Advanced Micro Devices, Inc. [AMD]'
    class      = bridge
    subclass   = HOST-PCI

hostb10@pci0:0:24:7:	class=0x060000 card=0x00000000 chip=0x15ef1022 rev=0x00 hdr=0x00
    vendor     = 'Advanced Micro Devices, Inc. [AMD]'
    class      = bridge
    subclass   = HOST-PCI

ix0@pci0:16:0:0:	class=0x020000 card=0x030a1dcf chip=0x10fb8086 rev=0x01 hdr=0x00
    vendor     = 'Intel Corporation'
    device     = '82599ES 10-Gigabit SFI/SFP+ Network Connection'
    class      = network
    subclass   = ethernet
    bar   [10] = type Prefetchable Memory, range 64, base 0x7ff0380000, size 524288, enabled
    bar   [18] = type I/O Port, range 32, base 0xf020, size 32, enabled
    bar   [20] = type Prefetchable Memory, range 64, base 0x7ff0404000, size 16384, enabled
    cap 01[40] = powerspec 3  supports D0 D3  current D0
    cap 05[50] = MSI supports 1 message, 64 bit, vector masks 
    cap 11[70] = MSI-X supports 64 messages, enabled
                 Table in map 0x20[0x0], PBA in map 0x20[0x2000]
    cap 10[a0] = PCI-Express 2 endpoint max data 512(512) FLR RO NS
                 link x1(x8) speed 5.0(5.0) ASPM disabled(L0s)
    cap 03[e0] = VPD
    ecap 0001[100] = AER 1 0 fatal 0 non-fatal 2 corrected
    ecap 0003[140] = Serial 1 80615fffff047f08
    ecap 000e[150] = ARI 1
    ecap 0010[160] = SR-IOV 1 IOV disabled, Memory Space disabled, ARI disabled
                     0 VFs configured out of 64 supported
                     First VF RID Offset 0x0180, VF RID Stride 0x0002
                     VF Device ID 0x10ed
                     Page Sizes: 4096 (enabled), 8192, 65536, 262144, 1048576, 4194304

ix1@pci0:16:0:1:	class=0x020000 card=0x030a1dcf chip=0x10fb8086 rev=0x01 hdr=0x00
    vendor     = 'Intel Corporation'
    device     = '82599ES 10-Gigabit SFI/SFP+ Network Connection'
    class      = network
    subclass   = ethernet
    bar   [10] = type Prefetchable Memory, range 64, base 0x7ff0300000, size 524288, enabled
    bar   [18] = type I/O Port, range 32, base 0xf000, size 32, enabled
    bar   [20] = type Prefetchable Memory, range 64, base 0x7ff0400000, size 16384, enabled
    cap 01[40] = powerspec 3  supports D0 D3  current D0
    cap 05[50] = MSI supports 1 message, 64 bit, vector masks 
    cap 11[70] = MSI-X supports 64 messages, enabled
                 Table in map 0x20[0x0], PBA in map 0x20[0x2000]
    cap 10[a0] = PCI-Express 2 endpoint max data 512(512) FLR RO NS
                 link x1(x8) speed 5.0(5.0) ASPM disabled(L0s)
    cap 03[e0] = VPD
    ecap 0001[100] = AER 1 0 fatal 0 non-fatal 2 corrected
    ecap 0003[140] = Serial 1 80615fffff047f08
    ecap 000e[150] = ARI 1
    ecap 0010[160] = SR-IOV 1 IOV disabled, Memory Space disabled, ARI disabled
                     0 VFs configured out of 64 supported
                     First VF RID Offset 0x0180, VF RID Stride 0x0002
                     VF Device ID 0x10ed
                     Page Sizes: 4096 (enabled), 8192, 65536, 262144, 1048576, 4194304

pcib3@pci0:32:0:0:	class=0x060400 card=0x00000000 chip=0x57ad1022 rev=0x00 hdr=0x01
    vendor     = 'Advanced Micro Devices, Inc. [AMD]'
    class      = bridge
    subclass   = PCI-PCI
    cap 01[50] = powerspec 3  supports D0 D3  current D0
    cap 10[58] = PCI-Express 2 upstream port max data 256(512) RO NS
                 link x4(x8) speed 8.0(16.0) ASPM disabled(L1)
    cap 05[a0] = MSI supports 1 message, 64 bit 
    ecap 000b[100] = Vendor 1 ID 1
    ecap 0019[270] = PCIe Sec 1 lane errors 0
    ecap 001e[370] = unknown 1
    ecap 0025[400] = unknown 1
    ecap 0026[410] = unknown 1
    ecap 0027[440] = unknown 1

pcib4@pci0:33:1:0:	class=0x060400 card=0x14531022 chip=0x57a31022 rev=0x00 hdr=0x01
    vendor     = 'Advanced Micro Devices, Inc. [AMD]'
    class      = bridge
    subclass   = PCI-PCI
    cap 01[50] = powerspec 3  supports D0 D3  current D0
    cap 10[58] = PCI-Express 2 downstream port max data 256(512) RO NS
                 link x4(x4) speed 5.0(16.0) ASPM disabled(L1)
                 slot 0 power limit 0 mW
    cap 05[a0] = MSI supports 1 message, 64 bit 
    cap 0d[c0] = PCI Bridge card=0x14531022
    cap 08[c8] = HT MSI fixed address window enabled at 0xfee00000
    ecap 000b[100] = Vendor 1 ID 1
    ecap 0001[150] = AER 2 0 fatal 0 non-fatal 0 corrected
    ecap 0019[270] = PCIe Sec 1 lane errors 0
    ecap 000d[2a0] = ACS 1
    ecap 001e[370] = unknown 1
    ecap 0025[400] = unknown 1
    ecap 0026[410] = unknown 1
    ecap 0027[440] = unknown 1

pcib5@pci0:33:3:0:	class=0x060400 card=0x14531022 chip=0x57a31022 rev=0x00 hdr=0x01
    vendor     = 'Advanced Micro Devices, Inc. [AMD]'
    class      = bridge
    subclass   = PCI-PCI
    cap 01[50] = powerspec 3  supports D0 D3  current D0
    cap 10[58] = PCI-Express 2 downstream port max data 256(512) RO NS
                 link x1(x2) speed 2.5(16.0) ASPM disabled(L1)
                 slot 0 power limit 0 mW
    cap 05[a0] = MSI supports 1 message, 64 bit 
    cap 0d[c0] = PCI Bridge card=0x14531022
    cap 08[c8] = HT MSI fixed address window enabled at 0xfee00000
    ecap 000b[100] = Vendor 1 ID 1
    ecap 0001[150] = AER 2 0 fatal 0 non-fatal 0 corrected
    ecap 0019[270] = PCIe Sec 1 lane errors 0
    ecap 000d[2a0] = ACS 1
    ecap 001e[370] = unknown 1
    ecap 0025[400] = unknown 1
    ecap 0026[410] = unknown 1
    ecap 0027[440] = unknown 1

pcib6@pci0:33:4:0:	class=0x060400 card=0x14531022 chip=0x57a31022 rev=0x00 hdr=0x01
    vendor     = 'Advanced Micro Devices, Inc. [AMD]'
    class      = bridge
    subclass   = PCI-PCI
    cap 01[50] = powerspec 3  supports D0 D3  current D0
    cap 10[58] = PCI-Express 2 downstream port max data 256(256) RO NS
                 link x1(x1) speed 5.0(16.0) ASPM disabled(L1)
                 slot 0 power limit 0 mW
    cap 05[a0] = MSI supports 1 message, 64 bit 
    cap 0d[c0] = PCI Bridge card=0x14531022
    cap 08[c8] = HT MSI fixed address window enabled at 0xfee00000
    ecap 000b[100] = Vendor 1 ID 1
    ecap 0001[150] = AER 2 0 fatal 0 non-fatal 0 corrected
    ecap 0019[270] = PCIe Sec 1 lane errors 0
    ecap 000d[2a0] = ACS 1
    ecap 001e[370] = unknown 1
    ecap 0025[400] = unknown 1
    ecap 0026[410] = unknown 1
    ecap 0027[440] = unknown 1

pcib7@pci0:33:8:0:	class=0x060400 card=0x14841022 chip=0x57a41022 rev=0x00 hdr=0x01
    vendor     = 'Advanced Micro Devices, Inc. [AMD]'
    class      = bridge
    subclass   = PCI-PCI
    cap 01[50] = powerspec 3  supports D0 D3  current D0
    cap 10[58] = PCI-Express 2 downstream port max data 256(512) RO NS
                 link x16(x16) speed 16.0(16.0) ASPM disabled(L0s/L1)
    cap 05[a0] = MSI supports 1 message, 64 bit 
    cap 0d[c0] = PCI Bridge card=0x14841022
    cap 08[c8] = HT MSI fixed address window enabled at 0xfee00000
    ecap 000b[100] = Vendor 1 ID 1
    ecap 0019[270] = PCIe Sec 1 lane errors 0
    ecap 0025[400] = unknown 1
    ecap 0026[410] = unknown 1
    ecap 0027[440] = unknown 1

pcib8@pci0:33:9:0:	class=0x060400 card=0x14841022 chip=0x57a41022 rev=0x00 hdr=0x01
    vendor     = 'Advanced Micro Devices, Inc. [AMD]'
    class      = bridge
    subclass   = PCI-PCI
    cap 01[50] = powerspec 3  supports D0 D3  current D0
    cap 10[58] = PCI-Express 2 downstream port max data 256(512) RO NS
                 link x16(x16) speed 16.0(16.0) ASPM disabled(L0s/L1)
    cap 05[a0] = MSI supports 1 message, 64 bit 
    cap 0d[c0] = PCI Bridge card=0x14841022
    cap 08[c8] = HT MSI fixed address window enabled at 0xfee00000
    ecap 000b[100] = Vendor 1 ID 1
    ecap 0019[270] = PCIe Sec 1 lane errors 0
    ecap 0025[400] = unknown 1
    ecap 0026[410] = unknown 1
    ecap 0027[440] = unknown 1

pcib9@pci0:33:10:0:	class=0x060400 card=0x14841022 chip=0x57a41022 rev=0x00 hdr=0x01
    vendor     = 'Advanced Micro Devices, Inc. [AMD]'
    class      = bridge
    subclass   = PCI-PCI
    cap 01[50] = powerspec 3  supports D0 D3  current D0
    cap 10[58] = PCI-Express 2 downstream port max data 256(512) RO NS
                 link x16(x16) speed 16.0(16.0) ASPM disabled(L0s/L1)
    cap 05[a0] = MSI supports 1 message, 64 bit 
    cap 0d[c0] = PCI Bridge card=0x14841022
    cap 08[c8] = HT MSI fixed address window enabled at 0xfee00000
    ecap 000b[100] = Vendor 1 ID 1
    ecap 0019[270] = PCIe Sec 1 lane errors 0
    ecap 0025[400] = unknown 1
    ecap 0026[410] = unknown 1
    ecap 0027[440] = unknown 1

igb0@pci0:35:0:0:	class=0x020000 card=0x03081dcf chip=0x15218086 rev=0x01 hdr=0x00
    vendor     = 'Intel Corporation'
    device     = 'I350 Gigabit Network Connection'
    class      = network
    subclass   = ethernet
    bar   [10] = type Memory, range 32, base 0xfc380000, size 524288, enabled
    bar   [18] = type I/O Port, range 32, base 0xd020, size 32, enabled
    bar   [1c] = type Memory, range 32, base 0xfc404000, size 16384, enabled
    cap 01[40] = powerspec 3  supports D0 D3  current D0
    cap 05[50] = MSI supports 1 message, 64 bit, vector masks 
    cap 11[70] = MSI-X supports 10 messages, enabled
                 Table in map 0x1c[0x0], PBA in map 0x1c[0x2000]
    cap 10[a0] = PCI-Express 2 endpoint max data 256(512) FLR RO NS
                 link x4(x4) speed 5.0(5.0) ASPM disabled(L0s/L1)
    ecap 0001[100] = AER 2 0 fatal 0 non-fatal 1 corrected
    ecap 0003[140] = Serial 1 80615fffff080af0
    ecap 000e[150] = ARI 1
    ecap 0017[1a0] = TPH Requester 1
    ecap 0018[1c0] = LTR 1
    ecap 000d[1d0] = ACS 1

igb1@pci0:35:0:1:	class=0x020000 card=0x03081dcf chip=0x15218086 rev=0x01 hdr=0x00
    vendor     = 'Intel Corporation'
    device     = 'I350 Gigabit Network Connection'
    class      = network
    subclass   = ethernet
    bar   [10] = type Memory, range 32, base 0xfc280000, size 524288, enabled
    bar   [18] = type I/O Port, range 32, base 0xd000, size 32, enabled
    bar   [1c] = type Memory, range 32, base 0xfc400000, size 16384, enabled
    cap 01[40] = powerspec 3  supports D0 D3  current D0
    cap 05[50] = MSI supports 1 message, 64 bit, vector masks 
    cap 11[70] = MSI-X supports 10 messages, enabled
                 Table in map 0x1c[0x0], PBA in map 0x1c[0x2000]
    cap 10[a0] = PCI-Express 2 endpoint max data 256(512) FLR RO NS
                 link x4(x4) speed 5.0(5.0) ASPM disabled(L0s/L1)
    ecap 0001[100] = AER 2 0 fatal 0 non-fatal 1 corrected
    ecap 0003[140] = Serial 1 80615fffff080af0
    ecap 000e[150] = ARI 1
    ecap 0017[1a0] = TPH Requester 1
    ecap 000d[1d0] = ACS 1

igb2@pci0:37:0:0:	class=0x020000 card=0xa03c8086 chip=0x10c98086 rev=0x01 hdr=0x00
    vendor     = 'Intel Corporation'
    device     = '82576 Gigabit Network Connection'
    class      = network
    subclass   = ethernet
    bar   [10] = type Memory, range 32, base 0xfc020000, size 131072, enabled
    bar   [14] = type Memory, range 32, base 0xfbc00000, size 4194304, enabled
    bar   [18] = type I/O Port, range 32, base 0xc020, size 32, enabled
    bar   [1c] = type Memory, range 32, base 0xfc044000, size 16384, enabled
    cap 01[40] = powerspec 3  supports D0 D3  current D0
    cap 05[50] = MSI supports 1 message, 64 bit, vector masks 
    cap 11[70] = MSI-X supports 10 messages, enabled
                 Table in map 0x1c[0x0], PBA in map 0x1c[0x2000]
    cap 10[a0] = PCI-Express 2 endpoint max data 256(512) FLR RO NS
                 link x1(x4) speed 2.5(2.5) ASPM disabled(L0s/L1)
    ecap 0001[100] = AER 1 0 fatal 0 non-fatal 2 corrected
    ecap 0003[140] = Serial 1 6cb311ffff1c5e56
    ecap 000e[150] = ARI 1
    ecap 0010[160] = SR-IOV 1 IOV disabled, Memory Space disabled, ARI disabled
                     0 VFs configured out of 8 supported
                     First VF RID Offset 0x0180, VF RID Stride 0x0002
                     VF Device ID 0x10ca
                     Page Sizes: 4096 (enabled), 8192, 65536, 262144, 1048576, 4194304

igb3@pci0:37:0:1:	class=0x020000 card=0xa03c8086 chip=0x10c98086 rev=0x01 hdr=0x00
    vendor     = 'Intel Corporation'
    device     = '82576 Gigabit Network Connection'
    class      = network
    subclass   = ethernet
    bar   [10] = type Memory, range 32, base 0xfc000000, size 131072, enabled
    bar   [14] = type Memory, range 32, base 0xfb400000, size 4194304, enabled
    bar   [18] = type I/O Port, range 32, base 0xc000, size 32, enabled
    bar   [1c] = type Memory, range 32, base 0xfc040000, size 16384, enabled
    cap 01[40] = powerspec 3  supports D0 D3  current D0
    cap 05[50] = MSI supports 1 message, 64 bit, vector masks 
    cap 11[70] = MSI-X supports 10 messages, enabled
                 Table in map 0x1c[0x0], PBA in map 0x1c[0x2000]
    cap 10[a0] = PCI-Express 2 endpoint max data 256(512) FLR RO NS
                 link x1(x4) speed 2.5(2.5) ASPM disabled(L0s/L1)
    ecap 0001[100] = AER 1 0 fatal 0 non-fatal 2 corrected
    ecap 0003[140] = Serial 1 6cb311ffff1c5e56
    ecap 000e[150] = ARI 1
    ecap 0010[160] = SR-IOV 1 IOV disabled, Memory Space disabled, ARI disabled
                     0 VFs configured out of 8 supported
                     First VF RID Offset 0x0180, VF RID Stride 0x0002
                     VF Device ID 0x10ca
                     Page Sizes: 4096 (enabled), 8192, 65536, 262144, 1048576, 4194304

ahci0@pci0:38:0:0:	class=0x010601 card=0x10601b21 chip=0x06121b21 rev=0x02 hdr=0x00
    vendor     = 'ASMedia Technology Inc.'
    device     = 'ASM1062 Serial ATA Controller'
    class      = mass storage
    subclass   = SATA
    bar   [10] = type I/O Port, range 32, base 0xb050, size 8, enabled
    bar   [14] = type I/O Port, range 32, base 0xb040, size 4, enabled
    bar   [18] = type I/O Port, range 32, base 0xb030, size 8, enabled
    bar   [1c] = type I/O Port, range 32, base 0xb020, size 4, enabled
    bar   [20] = type I/O Port, range 32, base 0xb000, size 32, enabled
    bar   [24] = type Memory, range 32, base 0xfc900000, size 512, enabled
    cap 05[50] = MSI supports 1 message enabled with 1 message
    cap 01[78] = powerspec 3  supports D0 D3  current D0
    cap 10[80] = PCI-Express 2 legacy endpoint max data 256(512) RO NS
                 link x1(x1) speed 5.0(5.0)
    ecap 0002[100] = VC 1 max VC0

none1@pci0:42:0:0:	class=0x130000 card=0x14851022 chip=0x14851022 rev=0x00 hdr=0x00
    vendor     = 'Advanced Micro Devices, Inc. [AMD]'
    class      = non-essential instrumentation
    cap 09[48] = vendor (length 8)
    cap 01[50] = powerspec 3  supports D0 D3  current D0
    cap 10[64] = PCI-Express 2 endpoint max data 256(256) RO NS
                 link x16(x16) speed 16.0(16.0) ASPM disabled(L0s/L1)
    ecap 000b[100] = Vendor 1 ID 1
    ecap 0019[270] = PCIe Sec 1 lane errors 0
    ecap 0025[400] = unknown 1
    ecap 0026[410] = unknown 1
    ecap 0027[440] = unknown 1

xhci0@pci0:42:0:1:	class=0x0c0330 card=0x14861022 chip=0x149c1022 rev=0x00 hdr=0x00
    vendor     = 'Advanced Micro Devices, Inc. [AMD]'
    class      = serial bus
    subclass   = USB
    bar   [10] = type Memory, range 64, base 0xfc600000, size 1048576, enabled
    cap 09[48] = vendor (length 8)
    cap 01[50] = powerspec 3  supports D0 D3  current D0
    cap 10[64] = PCI-Express 2 endpoint max data 256(256) RO NS
                 link x16(x16) speed 16.0(16.0) ASPM disabled(L0s/L1)
    cap 05[a0] = MSI supports 1 message, 64 bit enabled with 1 message
    ecap 000b[100] = Vendor 1 ID 1

xhci1@pci0:42:0:3:	class=0x0c0330 card=0x148c1022 chip=0x149c1022 rev=0x00 hdr=0x00
    vendor     = 'Advanced Micro Devices, Inc. [AMD]'
    class      = serial bus
    subclass   = USB
    bar   [10] = type Memory, range 64, base 0xfc500000, size 1048576, enabled
    cap 09[48] = vendor (length 8)
    cap 01[50] = powerspec 3  supports D0 D3  current D0
    cap 10[64] = PCI-Express 2 endpoint max data 256(256) RO NS
                 link x16(x16) speed 16.0(16.0) ASPM disabled(L0s/L1)
    cap 05[a0] = MSI supports 8 messages, 64 bit enabled with 1 message
    cap 11[c0] = MSI-X supports 8 messages
                 Table in map 0x10[0xfe000], PBA in map 0x10[0xff000]
    ecap 000b[100] = Vendor 1 ID 1

ahci1@pci0:43:0:0:	class=0x010601 card=0x79011022 chip=0x79011022 rev=0x51 hdr=0x00
    vendor     = 'Advanced Micro Devices, Inc. [AMD]'
    device     = 'FCH SATA Controller [AHCI mode]'
    class      = mass storage
    subclass   = SATA
    bar   [24] = type Memory, range 32, base 0xfc800000, size 2048, enabled
    cap 09[48] = vendor (length 8)
    cap 01[50] = powerspec 3  supports D0 D3  current D0
    cap 10[64] = PCI-Express 2 endpoint max data 256(256) RO NS
                 link x16(x16) speed 16.0(16.0) ASPM disabled(L0s/L1)
    cap 05[a0] = MSI supports 16 messages, 64 bit enabled with 16 messages
    cap 12[d0] = SATA Index-Data Pair
    ecap 000b[100] = Vendor 1 ID 1
    ecap 0019[270] = PCIe Sec 1 lane errors 0
    ecap 0025[400] = unknown 1
    ecap 0026[410] = unknown 1
    ecap 0027[440] = unknown 1

ahci2@pci0:44:0:0:	class=0x010601 card=0x79011022 chip=0x79011022 rev=0x51 hdr=0x00
    vendor     = 'Advanced Micro Devices, Inc. [AMD]'
    device     = 'FCH SATA Controller [AHCI mode]'
    class      = mass storage
    subclass   = SATA
    bar   [24] = type Memory, range 32, base 0xfc700000, size 2048, enabled
    cap 09[48] = vendor (length 8)
    cap 01[50] = powerspec 3  supports D0 D3  current D0
    cap 10[64] = PCI-Express 2 endpoint max data 256(256) RO NS
                 link x16(x16) speed 16.0(16.0) ASPM disabled(L0s/L1)
    cap 05[a0] = MSI supports 16 messages, 64 bit enabled with 16 messages
    cap 12[d0] = SATA Index-Data Pair
    ecap 000b[100] = Vendor 1 ID 1
    ecap 0019[270] = PCIe Sec 1 lane errors 0
    ecap 0025[400] = unknown 1
    ecap 0026[410] = unknown 1
    ecap 0027[440] = unknown 1

vgapci0@pci0:45:0:0:	class=0x030000 card=0x15d81002 chip=0x15d81002 rev=0xc8 hdr=0x00
    vendor     = 'Advanced Micro Devices, Inc. [AMD/ATI]'
    device     = 'Picasso'
    class      = display
    subclass   = VGA
    bar   [10] = type Prefetchable Memory, range 64, base 0x7fe0000000, size 268435456, enabled
    bar   [18] = type Prefetchable Memory, range 64, base 0x7ff0000000, size 2097152, enabled
    bar   [20] = type I/O Port, range 32, base 0xe000, size 256, enabled
    bar   [24] = type Memory, range 32, base 0xfce00000, size 524288, enabled
    cap 09[48] = vendor (length 8)
    cap 01[50] = powerspec 3  supports D0 D3  current D0
    cap 10[64] = PCI-Express 2 legacy endpoint max data 256(256) FLR RO NS
                 link x16(x16) speed 8.0(8.0) ASPM disabled(L0s/L1)
    cap 05[a0] = MSI supports 4 messages, 64 bit 
    cap 11[c0] = MSI-X supports 3 messages
                 Table in map 0x24[0x42000], PBA in map 0x24[0x43000]
    ecap 000b[100] = Vendor 1 ID 1
    ecap 0015[200] = Resizable BAR 1
    ecap 0019[270] = PCIe Sec 1 lane errors 0
    ecap 000d[2a0] = ACS 1
    ecap 000f[2b0] = ATS 1
    ecap 0013[2c0] = unknown 1
    ecap 001b[2d0] = unknown 1
    ecap 0018[320] = LTR 1

hdac0@pci0:45:0:1:	class=0x040300 card=0x9c371462 chip=0x15de1002 rev=0x00 hdr=0x00
    vendor     = 'Advanced Micro Devices, Inc. [AMD/ATI]'
    device     = 'Raven Ridge HDMI/DP Audio Controller'
    class      = multimedia
    subclass   = HDA
    bar   [10] = type Memory, range 32, base 0xfce80000, size 16384, enabled
    cap 09[48] = vendor (length 8)
    cap 01[50] = powerspec 3  supports D0 D3  current D0
    cap 10[64] = PCI-Express 2 legacy endpoint max data 256(256) FLR RO NS
                 link x16(x16) speed 8.0(8.0) ASPM disabled(L0s/L1)
    cap 05[a0] = MSI supports 1 message, 64 bit enabled with 1 message
    ecap 000b[100] = Vendor 1 ID 1

none2@pci0:45:0:2:	class=0x108000 card=0x15df1022 chip=0x15df1022 rev=0x00 hdr=0x00
    vendor     = 'Advanced Micro Devices, Inc. [AMD]'
    device     = 'Family 17h (Models 10h-1fh) Platform Security Processor'
    class      = encrypt/decrypt
    bar   [18] = type Memory, range 32, base 0xfcd00000, size 1048576, enabled
    bar   [24] = type Memory, range 32, base 0xfce84000, size 8192, enabled
    cap 09[48] = vendor (length 8)
    cap 01[50] = powerspec 3  supports D0 D3  current D0
    cap 10[64] = PCI-Express 2 endpoint max data 256(256) RO NS
                 link x16(x16) speed 8.0(8.0) ASPM disabled(L0s/L1)
    cap 05[a0] = MSI supports 2 messages, 64 bit 
    cap 11[c0] = MSI-X supports 2 messages
                 Table in map 0x24[0x0], PBA in map 0x24[0x1000]
    ecap 000b[100] = Vendor 1 ID 1

xhci2@pci0:45:0:3:	class=0x0c0330 card=0x7c371462 chip=0x15e01022 rev=0x00 hdr=0x00
    vendor     = 'Advanced Micro Devices, Inc. [AMD]'
    class      = serial bus
    subclass   = USB
    bar   [10] = type Memory, range 64, base 0xfcc00000, size 1048576, enabled
    cap 09[48] = vendor (length 8)
    cap 01[50] = powerspec 3  supports D0 D3  current D0
    cap 10[64] = PCI-Express 2 endpoint max data 256(256) RO NS
                 link x16(x16) speed 8.0(8.0) ASPM disabled(L0s/L1)
    cap 05[a0] = MSI supports 8 messages, 64 bit enabled with 1 message
    cap 11[c0] = MSI-X supports 8 messages
                 Table in map 0x10[0xfe000], PBA in map 0x10[0xff000]
    ecap 000b[100] = Vendor 1 ID 1

xhci3@pci0:45:0:4:	class=0x0c0330 card=0x7c371462 chip=0x15e11022 rev=0x00 hdr=0x00
    vendor     = 'Advanced Micro Devices, Inc. [AMD]'
    class      = serial bus
    subclass   = USB
    bar   [10] = type Memory, range 64, base 0xfcb00000, size 1048576, enabled
    cap 09[48] = vendor (length 8)
    cap 01[50] = powerspec 3  supports D0 D3  current D0
    cap 10[64] = PCI-Express 2 endpoint max data 256(256) RO NS
                 link x16(x16) speed 8.0(8.0) ASPM disabled(L0s/L1)
    cap 05[a0] = MSI supports 8 messages, 64 bit enabled with 1 message
    cap 11[c0] = MSI-X supports 8 messages
                 Table in map 0x10[0xfe000], PBA in map 0x10[0xff000]
    ecap 000b[100] = Vendor 1 ID 1
