hostb0@pci0:0:0:0:	class=0x060000 card=0x50001458 chip=0x3ec48086 rev=0x0a hdr=0x00
    vendor     = 'Intel Corporation'
    device     = '8th Gen Core Processor Host Bridge/DRAM Registers'
    class      = bridge
    subclass   = HOST-PCI
    cap 09[e0] = vendor (length 16) Intel cap 0 version 1

pcib1@pci0:0:1:0:	class=0x060400 card=0x50001458 chip=0x19018086 rev=0x0a hdr=0x01
    vendor     = 'Intel Corporation'
    device     = '6th-10th Gen Core Processor PCIe Controller (x16)'
    class      = bridge
    subclass   = PCI-PCI
    cap 0d[88] = PCI Bridge card=0x50001458
    cap 01[80] = powerspec 3  supports D0 D3  current D0
    cap 05[90] = MSI supports 1 message 
    cap 10[a0] = PCI-Express 2 root port max data 128(256) LTR disabled link x16(x16) ASPM disabled(L0s/L1)
                 slot 1 power limit 75000 mW

ecap 0002[100] = VC 1 max VC0

ecap 0005[140] = unknown 1

ecap 0019[d94] = unknown 1

none0@pci0:0:8:0:	class=0x088000 card=0x50001458 chip=0x19118086 rev=0x00 hdr=0x00
    vendor     = 'Intel Corporation'
    device     = 'Xeon E3-1200 v5/v6 / E3-1500 v5 / 6th/7th/8th Gen Core Processor Gaussian Mixture Model'
    class      = base peripheral
    bar   [10] = type Memory, range 64, base 0xf7f2d000, size 4096, enabled
    cap 05[90] = MSI supports 1 message 
    cap 01[dc] = powerspec 2  supports D0 D3  current D0
    cap 13[f0] = PCI Advanced Features: FLR TP

xhci0@pci0:0:20:0:	class=0x0c0330 card=0x50071458 chip=0xa2af8086 rev=0x00 hdr=0x00
    vendor     = 'Intel Corporation'
    device     = '200 Series/Z370 Chipset Family USB 3.0 xHCI Controller'
    class      = serial bus
    subclass   = USB
    bar   [10] = type Memory, range 64, base 0xf7f10000, size 65536, enabled
    cap 01[70] = powerspec 2  supports D0 D3  current D0
    cap 05[80] = MSI supports 8 messages, 64 bit enabled with 1 message

ahci0@pci0:0:23:0:	class=0x010601 card=0xb0051458 chip=0xa2828086 rev=0x00 hdr=0x00
    vendor     = 'Intel Corporation'
    device     = '200 Series PCH SATA controller [AHCI mode]'
    class      = mass storage
    subclass   = SATA
    bar   [10] = type Memory, range 32, base 0xf7f28000, size 8192, enabled
    bar   [14] = type Memory, range 32, base 0xf7f2c000, size 256, enabled
    bar   [18] = type I/O Port, range 32, base 0xf050, size  8, enabled
    bar   [1c] = type I/O Port, range 32, base 0xf040, size  4, enabled
    bar   [20] = type I/O Port, range 32, base 0xf020, size 32, enabled
    bar   [24] = type Memory, range 32, base 0xf7f2b000, size 2048, enabled
    cap 05[80] = MSI supports 1 message enabled with 1 message
    cap 01[70] = powerspec 3  supports D0 D3  current D0
    cap 12[a8] = SATA Index-Data Pair

pcib2@pci0:0:27:0:	class=0x060400 card=0x50011458 chip=0xa2e78086 rev=0xf0 hdr=0x01
    vendor     = 'Intel Corporation'
    device     = '200 Series PCH PCI Express Root Port'
    class      = bridge
    subclass   = PCI-PCI
    cap 10[40] = PCI-Express 2 root port max data 128(256) ARI disabled LTR enabled link x0(x2) ASPM disabled(L0s/L1)
    cap 05[80] = MSI supports 1 message 
    cap 0d[90] = PCI Bridge card=0x50011458
    cap 01[a0] = powerspec 3  supports D0 D3  current D0

pcib3@pci0:0:27:2:	class=0x060400 card=0x50011458 chip=0xa2e98086 rev=0xf0 hdr=0x01
    vendor     = 'Intel Corporation'
    device     = '200 Series PCH PCI Express Root Port'
    class      = bridge
    subclass   = PCI-PCI
    cap 10[40] = PCI-Express 2 root port max data 128(256) ARI disabled LTR enabled link x0(x1)
                 slot 22 power limit 100 mW
    cap 05[80] = MSI supports 1 message 
    cap 0d[90] = PCI Bridge card=0x50011458
    cap 01[a0] = powerspec 3  supports D0 D3  current D0

ecap 0001[100] = AER 1 0 fatal 0 non-fatal 0 corrected

ecap 000d[140] = unknown 1

ecap 0019[220] = unknown 1

pcib4@pci0:0:27:3:	class=0x060400 card=0x50011458 chip=0xa2ea8086 rev=0xf0 hdr=0x01
    vendor     = 'Intel Corporation'
    device     = '200 Series PCH PCI Express Root Port'
    class      = bridge
    subclass   = PCI-PCI
    cap 10[40] = PCI-Express 2 root port max data 128(256) ARI disabled LTR enabled link x0(x1)
                 slot 23 power limit 100 mW
    cap 05[80] = MSI supports 1 message 
    cap 0d[90] = PCI Bridge card=0x50011458
    cap 01[a0] = powerspec 3  supports D0 D3  current D0

ecap 0001[100] = AER 1 0 fatal 0 non-fatal 0 corrected

ecap 000d[140] = unknown 1

ecap 0019[220] = unknown 1

pcib5@pci0:0:27:4:	class=0x060400 card=0x50011458 chip=0xa2eb8086 rev=0xf0 hdr=0x01
    vendor     = 'Intel Corporation'
    device     = '200 Series PCH PCI Express Root Port'
    class      = bridge
    subclass   = PCI-PCI
    cap 10[40] = PCI-Express 2 root port max data 128(256) ARI disabled LTR enabled link x0(x4)
                 slot 24 power limit 250 mW
    cap 05[80] = MSI supports 1 message 
    cap 0d[90] = PCI Bridge card=0x50011458
    cap 01[a0] = powerspec 3  supports D0 D3  current D0

ecap 0001[100] = AER 1 0 fatal 0 non-fatal 0 corrected

ecap 000d[140] = unknown 1

ecap 0019[220] = unknown 1

pcib6@pci0:0:28:0:	class=0x060400 card=0x50011458 chip=0xa2908086 rev=0xf0 hdr=0x01
    vendor     = 'Intel Corporation'
    device     = '200 Series PCH PCI Express Root Port'
    class      = bridge
    subclass   = PCI-PCI
    cap 10[40] = PCI-Express 2 root port max data 128(256) ARI disabled LTR enabled link x0(x1) ASPM disabled(L0s/L1)
    cap 05[80] = MSI supports 1 message 
    cap 0d[90] = PCI Bridge card=0x50011458
    cap 01[a0] = powerspec 3  supports D0 D3  current D0

pcib7@pci0:0:28:2:	class=0x060400 card=0x50011458 chip=0xa2928086 rev=0xf0 hdr=0x01
    vendor     = 'Intel Corporation'
    device     = '200 Series PCH PCI Express Root Port'
    class      = bridge
    subclass   = PCI-PCI
    cap 10[40] = PCI-Express 2 root port max data 128(256) ARI disabled LTR enabled link x1(x1)
                 slot 6 power limit 100 mW
    cap 05[80] = MSI supports 1 message 
    cap 0d[90] = PCI Bridge card=0x50011458
    cap 01[a0] = powerspec 3  supports D0 D3  current D0

ecap 0001[100] = AER 1 0 fatal 0 non-fatal 0 corrected

ecap 000d[140] = unknown 1

ecap 0019[220] = unknown 1

pcib8@pci0:0:28:3:	class=0x060400 card=0x50011458 chip=0xa2938086 rev=0xf0 hdr=0x01
    vendor     = 'Intel Corporation'
    device     = '200 Series PCH PCI Express Root Port'
    class      = bridge
    subclass   = PCI-PCI
    cap 10[40] = PCI-Express 2 root port max data 128(256) ARI disabled LTR enabled link x0(x1)
                 slot 7 power limit 100 mW
    cap 05[80] = MSI supports 1 message 
    cap 0d[90] = PCI Bridge card=0x50011458
    cap 01[a0] = powerspec 3  supports D0 D3  current D0

ecap 0001[100] = AER 1 0 fatal 0 non-fatal 0 corrected

ecap 000d[140] = unknown 1

ecap 0019[220] = unknown 1

pcib9@pci0:0:28:4:	class=0x060400 card=0x50011458 chip=0xa2948086 rev=0xf0 hdr=0x01
    vendor     = 'Intel Corporation'
    device     = '200 Series PCH PCI Express Root Port'
    class      = bridge
    subclass   = PCI-PCI
    cap 10[40] = PCI-Express 2 root port max data 128(256) ARI disabled LTR enabled link x0(x4)
                 slot 8 power limit 250 mW
    cap 05[80] = MSI supports 1 message 
    cap 0d[90] = PCI Bridge card=0x50011458
    cap 01[a0] = powerspec 3  supports D0 D3  current D0

ecap 0001[100] = AER 1 0 fatal 0 non-fatal 0 corrected

ecap 000d[140] = unknown 1

ecap 0019[220] = unknown 1

pcib10@pci0:0:29:0:	class=0x060400 card=0x50011458 chip=0xa2988086 rev=0xf0 hdr=0x01
    vendor     = 'Intel Corporation'
    device     = '200 Series PCH PCI Express Root Port'
    class      = bridge
    subclass   = PCI-PCI
    cap 10[40] = PCI-Express 2 root port max data 128(256) ARI disabled LTR enabled link x4(x4)
                 slot 12 power limit 250 mW
    cap 05[80] = MSI supports 1 message 
    cap 0d[90] = PCI Bridge card=0x50011458
    cap 01[a0] = powerspec 3  supports D0 D3  current D0

ecap 0001[100] = AER 1 0 fatal 0 non-fatal 0 corrected

ecap 000d[140] = unknown 1

ecap 0019[220] = unknown 1

isab0@pci0:0:31:0:	class=0x060100 card=0x50011458 chip=0xa2c98086 rev=0x00 hdr=0x00
    vendor     = 'Intel Corporation'
    device     = 'Z370 Chipset LPC/eSPI Controller'
    class      = bridge
    subclass   = PCI-ISA

none1@pci0:0:31:2:	class=0x058000 card=0x50011458 chip=0xa2a18086 rev=0x00 hdr=0x00
    vendor     = 'Intel Corporation'
    device     = '200 Series/Z370 Chipset Family Power Management Controller'
    class      = memory
    bar   [10] = type Memory, range 32, base 0xf7f24000, size 16384, enabled

hdac1@pci0:0:31:3:	class=0x040300 card=0xa1821458 chip=0xa2f08086 rev=0x00 hdr=0x00
    vendor     = 'Intel Corporation'
    device     = '200 Series PCH HD Audio'
    class      = multimedia
    subclass   = HDA
    bar   [10] = type Memory, range 64, base 0xf7f20000, size 16384, enabled
    bar   [20] = type Memory, range 64, base 0xf7f00000, size 65536, enabled
    cap 01[50] = powerspec 3  supports D0 D3  current D0
    cap 05[60] = MSI supports 1 message, 64 bit enabled with 1 message

none2@pci0:0:31:4:	class=0x0c0500 card=0x50011458 chip=0xa2a38086 rev=0x00 hdr=0x00
    vendor     = 'Intel Corporation'
    device     = '200 Series/Z370 Chipset Family SMBus Controller'
    class      = serial bus
    subclass   = SMBus
    bar   [10] = type Memory, range 64, base 0xf7f2a000, size 256, enabled
    bar   [20] = type I/O Port, range 32, base 0xf000, size 32, enabled

vgapci0@pci0:1:0:0:	class=0x030000 card=0xe233174b chip=0x68f91002 rev=0x00 hdr=0x00
    vendor     = 'Advanced Micro Devices, Inc. [AMD/ATI]'
    device     = 'Cedar [Radeon HD 5000/6000/7350/8350 Series]'
    class      = display
    subclass   = VGA
    bar   [10] = type Prefetchable Memory, range 64, base 0xe0000000, size 268435456, enabled
    bar   [18] = type Memory, range 64, base 0xf7e20000, size 131072, enabled
    bar   [20] = type I/O Port, range 32, base 0xe000, size 256, enabled
    cap 01[50] = powerspec 3  supports D0 D1 D2 D3  current D0
    cap 10[58] = PCI-Express 2 legacy endpoint max data 128(256) RO NS link x16(x16) ASPM disabled(L0s/L1)
    cap 05[a0] = MSI supports 1 message, 64 bit enabled with 1 message

ecap 000b[100] = unknown 1

ecap 0001[150] = AER 1 0 fatal 0 non-fatal 1 corrected

hdac0@pci0:1:0:1:	class=0x040300 card=0xaa68174b chip=0xaa681002 rev=0x00 hdr=0x00
    vendor     = 'Advanced Micro Devices, Inc. [AMD/ATI]'
    device     = 'Cedar HDMI Audio [Radeon HD 5400/6300/7300 Series]'
    class      = multimedia
    subclass   = HDA
    bar   [10] = type Memory, range 64, base 0xf7e40000, size 16384, enabled
    cap 01[50] = powerspec 3  supports D0 D1 D2 D3  current D0
    cap 10[58] = PCI-Express 2 legacy endpoint max data 128(256) RO link x16(x16) ASPM disabled(L0s/L1)
    cap 05[a0] = MSI supports 1 message, 64 bit enabled with 1 message

ecap 000b[100] = unknown 1

ecap 0001[150] = AER 1 0 fatal 0 non-fatal 1 corrected

re0@pci0:7:0:0:	class=0x020000 card=0xe0001458 chip=0x816810ec rev=0x0c hdr=0x00
    vendor     = 'Realtek Semiconductor Co., Ltd.'
    device     = 'RTL8111/8168/8411 PCI Express Gigabit Ethernet Controller'
    class      = network
    subclass   = ethernet
    bar   [10] = type I/O Port, range 32, base 0xd000, size 256, enabled
    bar   [18] = type Memory, range 64, base 0xf7d00000, size 4096, enabled
    bar   [20] = type Prefetchable Memory, range 64, base 0xf0000000, size 16384, enabled
    cap 01[40] = powerspec 3  supports D0 D1 D2 D3  current D0
    cap 05[50] = MSI supports 1 message, 64 bit enabled with 1 message
    cap 10[70] = PCI-Express 2 endpoint IRQ 2 max data 128(128) RO LTR disabled link x1(x1) ASPM disabled(L0s/L1)
    cap 11[b0] = MSI-X supports 4 messages in map 0x20
    cap 03[d0] = VPD

ecap 0001[100] = AER 1 0 fatal 0 non-fatal 0 corrected

ecap 0002[140] = VC 1 max VC0

ecap 0003[160] = Serial 1 01000000684ce000

ecap 0018[170] = unknown 1

nvme0@pci0:10:0:0:	class=0x010802 card=0x1100c0a9 chip=0x5403c0a9 rev=0x03 hdr=0x00
    vendor     = 'Micron/Crucial Technology'
    class      = mass storage
    bar   [10] = type Memory, range 64, base 0xf7c00000, size 16384, enabled
    cap 01[40] = powerspec 3  supports D0 D3  current D0
    cap 05[50] = MSI supports 8 messages, 64 bit, vector masks 
    cap 10[70] = PCI-Express 2 endpoint max data 128(256) FLR RO LTR disabled link x4(x4) ASPM disabled(L1)
    cap 11[b0] = MSI-X supports 16 messages in map 0x10 enabled

ecap 0001[100] = AER 2 0 fatal 0 non-fatal 0 corrected

ecap 0019[158] = unknown 1

ecap 0018[178] = unknown 1

ecap 001e[180] = unknown 1
