hostb0@pci0:0:0:0:	class=0x060000 rev=0x06 hdr=0x00 vendor=0x8086 device=0x0c00 subvendor=0x8086 subdevice=0x0c00
    vendor     = 'Intel Corporation'
    device     = '4th Gen Core Processor DRAM Controller'
    class      = bridge
    subclass   = HOST-PCI
    cap 09[e0] = vendor (length 12) Intel cap 0 version 1

pcib1@pci0:0:1:0:	class=0x060400 rev=0x06 hdr=0x01 vendor=0x8086 device=0x0c01 subvendor=0x8086 subdevice=0x0c01
    vendor     = 'Intel Corporation'
    device     = 'Xeon E3-1200 v3/4th Gen Core Processor PCI Express x16 Controller'
    class      = bridge
    subclass   = PCI-PCI
    cap 0d[88] = PCI Bridge subvendor=0x8086 subdevice=0x0c01
    cap 01[80] = powerspec 3  supports D0 D3  current D0
    cap 05[90] = MSI supports 1 message 
    cap 10[a0] = PCI-Express 2 root port max data 256(256)
                 max read 128
                 link x16(x16) speed 2.5(8.0) ASPM disabled(L0s/L1)
                 slot 1 power limit 75000 mW
    ecap 0002[100] = VC 1 max VC0
    ecap 0005[140] = Root Complex Link Declaration 1
    ecap 0019[d94] = PCIe Sec 1 lane errors 0

xhci0@pci0:0:20:0:	class=0x0c0330 rev=0x05 hdr=0x00 vendor=0x8086 device=0x8c31 subvendor=0x8086 subdevice=0x8c31
    vendor     = 'Intel Corporation'
    device     = '8 Series/C220 Series Chipset Family USB xHCI'
    class      = serial bus
    subclass   = USB
    bar   [10] = type Memory, range 64, base 0xf3220000, size 65536, enabled
    cap 01[70] = powerspec 2  supports D0 D3  current D0
    cap 05[80] = MSI supports 8 messages, 64 bit enabled with 1 message

none0@pci0:0:22:0:	class=0x078000 rev=0x04 hdr=0x00 vendor=0x8086 device=0x8c3a subvendor=0x8086 subdevice=0x8c3a
    vendor     = 'Intel Corporation'
    device     = '8 Series/C220 Series Chipset Family MEI Controller'
    class      = simple comms
    bar   [10] = type Memory, range 64, base 0xf323c000, size 16, enabled
    cap 01[50] = powerspec 3  supports D0 D3  current D0
    cap 05[8c] = MSI supports 1 message, 64 bit 

uart2@pci0:0:22:3:	class=0x070002 rev=0x04 hdr=0x00 vendor=0x8086 device=0x8c3d subvendor=0x8086 subdevice=0x8c3d
    vendor     = 'Intel Corporation'
    device     = '8 Series/C220 Series Chipset Family KT Controller'
    class      = simple comms
    subclass   = UART
    bar   [10] = type I/O Port, range 32, base 0xf0a0, size 8, enabled
    bar   [14] = type Memory, range 32, base 0xf323a000, size 4096, enabled
    cap 01[c8] = powerspec 3  supports D0 D3  current D0
    cap 05[d0] = MSI supports 1 message, 64 bit enabled with 1 message

em0@pci0:0:25:0:	class=0x020000 rev=0x05 hdr=0x00 vendor=0x8086 device=0x153a subvendor=0x8086 subdevice=0x153a
    vendor     = 'Intel Corporation'
    device     = 'Ethernet Connection I217-LM'
    class      = network
    subclass   = ethernet
    bar   [10] = type Memory, range 32, base 0xf3200000, size 131072, enabled
    bar   [14] = type Memory, range 32, base 0xf3239000, size 4096, enabled
    bar   [18] = type I/O Port, range 32, base 0xf040, size 32, enabled
    cap 01[c8] = powerspec 2  supports D0 D3  current D0
    cap 05[d0] = MSI supports 1 message, 64 bit enabled with 1 message
    cap 13[e0] = PCI Advanced Features: FLR TP

ehci0@pci0:0:26:0:	class=0x0c0320 rev=0x05 hdr=0x00 vendor=0x8086 device=0x8c2d subvendor=0x8086 subdevice=0x8c2d
    vendor     = 'Intel Corporation'
    device     = '8 Series/C220 Series Chipset Family USB EHCI'
    class      = serial bus
    subclass   = USB
    bar   [10] = type Memory, range 32, base 0xf3238000, size 1024, enabled
    cap 01[50] = powerspec 2  supports D0 D3  current D0
    cap 0a[58] = EHCI Debug Port at offset 0xa0 in map 0x14
    cap 13[98] = PCI Advanced Features: FLR TP

hdac1@pci0:0:27:0:	class=0x040300 rev=0x05 hdr=0x00 vendor=0x8086 device=0x8c20 subvendor=0x10ec subdevice=0x8662
    vendor     = 'Intel Corporation'
    device     = '8 Series/C220 Series Chipset High Definition Audio Controller'
    class      = multimedia
    subclass   = HDA
    bar   [10] = type Memory, range 64, base 0xf3230000, size 16384, enabled
    cap 01[50] = powerspec 2  supports D0 D3  current D0
    cap 05[60] = MSI supports 1 message, 64 bit enabled with 1 message
    cap 10[70] = PCI-Express 1 root endpoint max data 128(128) FLR NS
                 max read 128
    ecap 0002[100] = VC 1 max VC1

pcib2@pci0:0:28:0:	class=0x060400 rev=0xd5 hdr=0x01 vendor=0x8086 device=0x8c10 subvendor=0x8086 subdevice=0x8c10
    vendor     = 'Intel Corporation'
    device     = '8 Series/C220 Series Chipset Family PCI Express Root Port'
    class      = bridge
    subclass   = PCI-PCI
    cap 10[40] = PCI-Express 2 root port max data 128(128)
                 max read 128
                 link x0(x4) speed 0.0(5.0) ASPM disabled(L0s/L1)
                 slot 0 power limit 250 mW
    cap 05[80] = MSI supports 1 message 
    cap 0d[90] = PCI Bridge subvendor=0x8086 subdevice=0x8c10
    cap 01[a0] = powerspec 3  supports D0 D3  current D0

pcib3@pci0:0:28:5:	class=0x060401 rev=0xd5 hdr=0x01 vendor=0x8086 device=0x244e subvendor=0x8086 subdevice=0x8c1a
    vendor     = 'Intel Corporation'
    device     = '82801 PCI Bridge'
    class      = bridge
    subclass   = PCI-PCI
    cap 10[40] = PCI-Express 2 root port max data 128(128)
                 max read 128
                 link x1(x1) speed 2.5(5.0) ASPM disabled(L0s/L1)
                 slot 5 power limit 100 mW
    cap 05[80] = MSI supports 1 message 
    cap 0d[90] = PCI Bridge subvendor=0x8086 subdevice=0x8c1a
    cap 01[a0] = powerspec 3  supports D0 D3  current D0

pcib5@pci0:0:28:6:	class=0x060400 rev=0xd5 hdr=0x01 vendor=0x8086 device=0x8c1c subvendor=0x8086 subdevice=0x8c1c
    vendor     = 'Intel Corporation'
    device     = '8 Series/C220 Series Chipset Family PCI Express Root Port'
    class      = bridge
    subclass   = PCI-PCI
    cap 10[40] = PCI-Express 2 root port max data 128(128)
                 max read 128
                 link x1(x1) speed 2.5(5.0) ASPM disabled(L0s/L1)
                 slot 6 power limit 100 mW
    cap 05[80] = MSI supports 1 message 
    cap 0d[90] = PCI Bridge subvendor=0x8086 subdevice=0x8c1c
    cap 01[a0] = powerspec 3  supports D0 D3  current D0

pcib6@pci0:0:28:7:	class=0x060400 rev=0xd5 hdr=0x01 vendor=0x8086 device=0x8c1e subvendor=0x8086 subdevice=0x8c1e
    vendor     = 'Intel Corporation'
    device     = '8 Series/C220 Series Chipset Family PCI Express Root Port'
    class      = bridge
    subclass   = PCI-PCI
    cap 10[40] = PCI-Express 2 root port max data 128(128)
                 max read 128
                 link x0(x1) speed 0.0(5.0) ASPM disabled(L0s/L1)
                 slot 7 power limit 100 mW
    cap 05[80] = MSI supports 1 message 
    cap 0d[90] = PCI Bridge subvendor=0x8086 subdevice=0x8c1e
    cap 01[a0] = powerspec 3  supports D0 D3  current D0

ehci1@pci0:0:29:0:	class=0x0c0320 rev=0x05 hdr=0x00 vendor=0x8086 device=0x8c26 subvendor=0x8086 subdevice=0x8c26
    vendor     = 'Intel Corporation'
    device     = '8 Series/C220 Series Chipset Family USB EHCI'
    class      = serial bus
    subclass   = USB
    bar   [10] = type Memory, range 32, base 0xf3237000, size 1024, enabled
    cap 01[50] = powerspec 2  supports D0 D3  current D0
    cap 0a[58] = EHCI Debug Port at offset 0xa0 in map 0x14
    cap 13[98] = PCI Advanced Features: FLR TP

isab0@pci0:0:31:0:	class=0x060100 rev=0x05 hdr=0x00 vendor=0x8086 device=0x8c4e subvendor=0x8086 subdevice=0x8c4e
    vendor     = 'Intel Corporation'
    device     = 'Q87 Express LPC Controller'
    class      = bridge
    subclass   = PCI-ISA
    cap 09[e0] = vendor (length 12) Intel cap 1 version 0
		 features: AMT, 4 PCI-e x1 slots

ahci0@pci0:0:31:2:	class=0x010601 rev=0x05 hdr=0x00 vendor=0x8086 device=0x8c02 subvendor=0x8086 subdevice=0x8c02
    vendor     = 'Intel Corporation'
    device     = '8 Series/C220 Series Chipset Family 6-port SATA Controller 1 [AHCI mode]'
    class      = mass storage
    subclass   = SATA
    bar   [10] = type I/O Port, range 32, base 0xf090, size 8, enabled
    bar   [14] = type I/O Port, range 32, base 0xf080, size 4, enabled
    bar   [18] = type I/O Port, range 32, base 0xf070, size 8, enabled
    bar   [1c] = type I/O Port, range 32, base 0xf060, size 4, enabled
    bar   [20] = type I/O Port, range 32, base 0xf020, size 32, enabled
    bar   [24] = type Memory, range 32, base 0xf3236000, size 2048, enabled
    cap 05[80] = MSI supports 1 message enabled with 1 message
    cap 01[70] = powerspec 3  supports D0 D3  current D0
    cap 12[a8] = SATA Index-Data Pair

ichsmb0@pci0:0:31:3:	class=0x0c0500 rev=0x05 hdr=0x00 vendor=0x8086 device=0x8c22 subvendor=0x8086 subdevice=0x8c22
    vendor     = 'Intel Corporation'
    device     = '8 Series/C220 Series Chipset Family SMBus Controller'
    class      = serial bus
    subclass   = SMBus
    bar   [10] = type Memory, range 64, base 0xf3235000, size 256, enabled
    bar   [20] = type I/O Port, range 32, base 0xf000, size 32, enabled

vgapci0@pci0:1:0:0:	class=0x030000 rev=0xa1 hdr=0x00 vendor=0x10de device=0x1189 subvendor=0x1458 subdevice=0x3542
    vendor     = 'NVIDIA Corporation'
    device     = 'GK104 [GeForce GTX 670]'
    class      = display
    subclass   = VGA
    bar   [10] = type Memory, range 32, base 0xf2000000, size 16777216, enabled
    bar   [14] = type Prefetchable Memory, range 64, base 0xe8000000, size 134217728, enabled
    bar   [1c] = type Prefetchable Memory, range 64, base 0xf0000000, size 33554432, enabled
    bar   [24] = type I/O Port, range 32, base 0xe000, size 128, enabled
    cap 01[60] = powerspec 3  supports D0 D3  current D0
    cap 05[68] = MSI supports 1 message, 64 bit 
    cap 10[78] = PCI-Express 2 endpoint max data 256(256) NS
                 max read 512
                 link x16(x16) speed 2.5(8.0) ASPM disabled(L0s/L1) ClockPM disabled
    cap 09[b4] = vendor (length 20)
    ecap 0002[100] = VC 1 max VC0
    ecap 0004[128] = Power Budgeting 1
    ecap 000b[600] = Vendor [1] ID 0001 Rev 1 Length 36
    ecap 0019[900] = PCIe Sec 1 lane errors 0

hdac0@pci0:1:0:1:	class=0x040300 rev=0xa1 hdr=0x00 vendor=0x10de device=0x0e0a subvendor=0x1458 subdevice=0x3542
    vendor     = 'NVIDIA Corporation'
    device     = 'GK104 HDMI Audio Controller'
    class      = multimedia
    subclass   = HDA
    bar   [10] = type Memory, range 32, base 0xf3080000, size 16384, enabled
    cap 01[60] = powerspec 3  supports D0 D3  current D0
    cap 05[68] = MSI supports 1 message, 64 bit enabled with 1 message
    cap 10[78] = PCI-Express 2 endpoint max data 256(256) NS
                 max read 512
                 link x16(x16) speed 2.5(8.0) ASPM disabled(L0s/L1) ClockPM disabled

pcib4@pci0:3:0:0:	class=0x060401 rev=0x03 hdr=0x01 vendor=0x1b21 device=0x1080 subvendor=0x1b21 subdevice=0x1080
    vendor     = 'ASMedia Technology Inc.'
    device     = 'ASM1083/1085 PCIe to PCI Bridge'
    class      = bridge
    subclass   = PCI-PCI
    cap 0d[c0] = PCI Bridge subvendor=0x1b21 subdevice=0x1080

none1@pci0:4:2:0:	class=0x040100 rev=0x00 hdr=0x00 vendor=0x13f6 device=0x8788 subvendor=0x1043 subdevice=0x834f
    vendor     = 'C-Media Electronics Inc'
    device     = 'CMI8788 [Oxygen HD Audio]'
    class      = multimedia
    subclass   = audio
    bar   [10] = type I/O Port, range 32, base 0xd000, size 256, enabled
    cap 01[c0] = powerspec 2  supports D0 D1 D2 D3  current D0

igb0@pci0:5:0:0:	class=0x020000 rev=0x03 hdr=0x00 vendor=0x8086 device=0x1533 subvendor=0x1849 subdevice=0x1533
    vendor     = 'Intel Corporation'
    device     = 'I210 Gigabit Network Connection'
    class      = network
    subclass   = ethernet
    bar   [10] = type Memory, range 32, base 0xf3100000, size 524288, enabled
    bar   [18] = type I/O Port, range 32, base 0xc000, size 32, enabled
    bar   [1c] = type Memory, range 32, base 0xf3180000, size 16384, enabled
    cap 01[40] = powerspec 3  supports D0 D3  current D0
    cap 05[50] = MSI supports 1 message, 64 bit, vector masks 
    cap 11[70] = MSI-X supports 5 messages, enabled
                 Table in map 0x1c[0x0], PBA in map 0x1c[0x2000]
    cap 10[a0] = PCI-Express 2 endpoint max data 128(512) FLR NS
                 max read 512
                 link x1(x1) speed 2.5(2.5) ASPM disabled(L0s/L1)
    ecap 0001[100] = AER 2 0 fatal 0 non-fatal 0 corrected
    ecap 0003[140] = Serial 1 7085c2ffff11c38f
    ecap 0017[1a0] = TPH Requester 1
