hostb0@pci0:0:0:0:	class=0x060000 card=0x04661028 chip=0x00448086 rev=0x02 hdr=0x00
    vendor     = 'Intel Corporation'
    device     = 'Core Processor DRAM Controller'
    class      = bridge
    subclass   = HOST-PCI
    cap 09[e0] = vendor (length 12) Intel cap 0 version 1

vgapci0@pci0:0:2:0:	class=0x030000 card=0x04661028 chip=0x00468086 rev=0x02 hdr=0x00
    vendor     = 'Intel Corporation'
    device     = 'Core Processor Integrated Graphics Controller'
    class      = display
    subclass   = VGA
    bar   [10] = type Memory, range 64, base 0xfac00000, size 4194304, enabled
    bar   [18] = type Prefetchable Memory, range 64, base 0xc0000000, size 268435456, enabled
    bar   [20] = type I/O Port, range 32, base 0xf080, size 8, enabled
    cap 05[90] = MSI supports 1 message 
    cap 01[d0] = powerspec 2  supports D0 D3  current D0
    cap 13[a4] = PCI Advanced Features: FLR TP

none0@pci0:0:22:0:	class=0x078000 card=0x04661028 chip=0x3b648086 rev=0x06 hdr=0x00
    vendor     = 'Intel Corporation'
    device     = '5 Series/3400 Series Chipset HECI Controller'
    class      = simple comms
    bar   [10] = type Memory, range 64, base 0xfbc09000, size 16, enabled
    cap 01[50] = powerspec 3  supports D0 D3  current D0
    cap 05[8c] = MSI supports 1 message, 64 bit 

ehci0@pci0:0:26:0:	class=0x0c0320 card=0x04661028 chip=0x3b3c8086 rev=0x05 hdr=0x00
    vendor     = 'Intel Corporation'
    device     = '5 Series/3400 Series Chipset USB2 Enhanced Host Controller'
    class      = serial bus
    subclass   = USB
    bar   [10] = type Memory, range 32, base 0xfbc08000, size 1024, enabled
    cap 01[50] = powerspec 2  supports D0 D3  current D0
    cap 0a[58] = EHCI Debug Port at offset 0xa0 in map 0x14
    cap 13[98] = PCI Advanced Features: FLR TP

hdac0@pci0:0:27:0:	class=0x040300 card=0x04661028 chip=0x3b568086 rev=0x05 hdr=0x00
    vendor     = 'Intel Corporation'
    device     = '5 Series/3400 Series Chipset High Definition Audio'
    class      = multimedia
    subclass   = HDA
    bar   [10] = type Memory, range 64, base 0xfbc00000, size 16384, enabled
    cap 01[50] = powerspec 2  supports D0 D3  current D0
    cap 05[60] = MSI supports 1 message, 64 bit enabled with 1 message
    cap 10[70] = PCI-Express 1 root endpoint max data 128(128) FLR NS
    ecap 0002[100] = VC 1 max VC1
    ecap 0005[130] = Root Complex Link Declaration 1

pcib1@pci0:0:28:0:	class=0x060400 card=0x04661028 chip=0x3b428086 rev=0x05 hdr=0x01
    vendor     = 'Intel Corporation'
    device     = '5 Series/3400 Series Chipset PCI Express Root Port 1'
    class      = bridge
    subclass   = PCI-PCI
    cap 10[40] = PCI-Express 2 root port max data 128(128)
                 link x0(x1) speed 0.0(2.5) ASPM disabled(L0s/L1)
                 slot 0 power limit 0 mW HotPlug(empty) surprise
    cap 05[80] = MSI supports 1 message 
    cap 0d[90] = PCI Bridge card=0x04661028
    cap 01[a0] = powerspec 2  supports D0 D3  current D0

pcib2@pci0:0:28:1:	class=0x060400 card=0x04661028 chip=0x3b448086 rev=0x05 hdr=0x01
    vendor     = 'Intel Corporation'
    device     = '5 Series/3400 Series Chipset PCI Express Root Port 2'
    class      = bridge
    subclass   = PCI-PCI
    cap 10[40] = PCI-Express 2 root port max data 128(128)
                 link x1(x1) speed 2.5(2.5) ASPM L1(L0s/L1)
                 slot 0 power limit 0 mW HotPlug(present) surprise
    cap 05[80] = MSI supports 1 message 
    cap 0d[90] = PCI Bridge card=0x04661028
    cap 01[a0] = powerspec 2  supports D0 D3  current D0

pcib3@pci0:0:28:2:	class=0x060400 card=0x04661028 chip=0x3b468086 rev=0x05 hdr=0x01
    vendor     = 'Intel Corporation'
    device     = '5 Series/3400 Series Chipset PCI Express Root Port 3'
    class      = bridge
    subclass   = PCI-PCI
    cap 10[40] = PCI-Express 2 root port max data 128(128)
                 link x1(x1) speed 2.5(2.5) ASPM L1(L0s/L1)
                 slot 0 power limit 0 mW HotPlug(present) surprise
    cap 05[80] = MSI supports 1 message 
    cap 0d[90] = PCI Bridge card=0x04661028
    cap 01[a0] = powerspec 2  supports D0 D3  current D0

pcib4@pci0:0:28:4:	class=0x060400 card=0x04661028 chip=0x3b4a8086 rev=0x05 hdr=0x01
    vendor     = 'Intel Corporation'
    device     = '5 Series/3400 Series Chipset PCI Express Root Port 5'
    class      = bridge
    subclass   = PCI-PCI
    cap 10[40] = PCI-Express 2 root port max data 128(128)
                 link x0(x1) speed 0.0(2.5) ASPM disabled(L0s/L1)
                 slot 0 power limit 0 mW HotPlug(empty) surprise
    cap 05[80] = MSI supports 1 message 
    cap 0d[90] = PCI Bridge card=0x04661028
    cap 01[a0] = powerspec 2  supports D0 D3  current D0

ehci1@pci0:0:29:0:	class=0x0c0320 card=0x04661028 chip=0x3b348086 rev=0x05 hdr=0x00
    vendor     = 'Intel Corporation'
    device     = '5 Series/3400 Series Chipset USB2 Enhanced Host Controller'
    class      = serial bus
    subclass   = USB
    bar   [10] = type Memory, range 32, base 0xfbc07000, size 1024, enabled
    cap 01[50] = powerspec 2  supports D0 D3  current D0
    cap 0a[58] = EHCI Debug Port at offset 0xa0 in map 0x14
    cap 13[98] = PCI Advanced Features: FLR TP

pcib5@pci0:0:30:0:	class=0x060401 card=0x04661028 chip=0x24488086 rev=0xa5 hdr=0x01
    vendor     = 'Intel Corporation'
    device     = '82801 Mobile PCI Bridge'
    class      = bridge
    subclass   = PCI-PCI
    cap 0d[50] = PCI Bridge card=0x04661028

isab0@pci0:0:31:0:	class=0x060100 card=0x04661028 chip=0x3b0b8086 rev=0x05 hdr=0x00
    vendor     = 'Intel Corporation'
    device     = 'HM57 Chipset LPC Interface Controller'
    class      = bridge
    subclass   = PCI-ISA
    cap 09[e0] = vendor (length 16) Intel cap 1 version 1

ahci0@pci0:0:31:2:	class=0x010601 card=0x04661028 chip=0x3b2f8086 rev=0x05 hdr=0x00
    vendor     = 'Intel Corporation'
    device     = '5 Series/3400 Series Chipset 6 port SATA AHCI Controller'
    class      = mass storage
    subclass   = SATA
    bar   [10] = type I/O Port, range 32, base 0xf070, size 8, enabled
    bar   [14] = type I/O Port, range 32, base 0xf060, size 4, enabled
    bar   [18] = type I/O Port, range 32, base 0xf050, size 8, enabled
    bar   [1c] = type I/O Port, range 32, base 0xf040, size 4, enabled
    bar   [20] = type I/O Port, range 32, base 0xf020, size 32, enabled
    bar   [24] = type Memory, range 32, base 0xfbc06000, size 2048, enabled
    cap 05[80] = MSI supports 1 message enabled with 1 message
    cap 01[70] = powerspec 3  supports D0 D3  current D0
    cap 12[a8] = SATA Index-Data Pair
    cap 13[b0] = PCI Advanced Features: FLR TP

none1@pci0:0:31:3:	class=0x0c0500 card=0x04661028 chip=0x3b308086 rev=0x05 hdr=0x00
    vendor     = 'Intel Corporation'
    device     = '5 Series/3400 Series Chipset SMBus Controller'
    class      = serial bus
    subclass   = SMBus
    bar   [10] = type Memory, range 64, base 0xfbc05000, size 256, enabled
    bar   [20] = type I/O Port, range 32, base 0xf000, size 32, enabled

none2@pci0:0:31:6:	class=0x118000 card=0x04661028 chip=0x3b328086 rev=0x05 hdr=0x00
    vendor     = 'Intel Corporation'
    device     = '5 Series/3400 Series Chipset Thermal Subsystem'
    class      = dasp
    bar   [10] = type Memory, range 64, base 0xfbc04000, size 4096, enabled
    cap 01[50] = powerspec 3  supports D0 D3  current D0
    cap 05[80] = MSI supports 1 message 

none3@pci0:18:0:0:	class=0x028000 card=0x00101028 chip=0x472714e4 rev=0x01 hdr=0x00
    vendor     = 'Broadcom Inc. and subsidiaries'
    device     = 'BCM4313 802.11bgn Wireless Network Adapter'
    class      = network
    bar   [10] = type Memory, range 64, base 0xfbb00000, size 16384, enabled
    cap 01[40] = powerspec 3  supports D0 D1 D2 D3  current D0
    cap 09[58] = vendor (length 120)
    cap 05[48] = MSI supports 1 message, 64 bit 
    cap 10[d0] = PCI-Express 1 endpoint max data 128(128)
                 link x1(x1) speed 2.5(2.5) ASPM L1(L0s/L1)
    ecap 0001[100] = AER 1 0 fatal 0 non-fatal 0 corrected
    ecap 0002[13c] = VC 1 max VC0
    ecap 0003[160] = Serial 1 000038ffff87c0cb
    ecap 0004[16c] = Power Budgeting 1

alc0@pci0:19:0:0:	class=0x020000 card=0x04661028 chip=0x20621969 rev=0xc1 hdr=0x00
    vendor     = 'Qualcomm Atheros'
    device     = 'AR8152 v2.0 Fast Ethernet'
    class      = network
    subclass   = ethernet
    bar   [10] = type Memory, range 64, base 0xfba00000, size 262144, enabled
    bar   [18] = type I/O Port, range 32, base 0xe000, size 128, enabled
    cap 01[40] = powerspec 3  supports D0 D3  current D0
    cap 05[48] = MSI supports 1 message, 64 bit enabled with 1 message
    cap 10[58] = PCI-Express 1 endpoint max data 128(4096)
                 link x1(x1) speed 2.5(2.5) ASPM L1(L0s/L1)
    cap 03[6c] = VPD
    ecap 0001[100] = AER 1 0 fatal 1 non-fatal 2 corrected
    ecap 0003[180] = Serial 1 ffc6972df04da2ff
