hostb0@pci0:0:0:0:	class=0x060000 rev=0x03 hdr=0x00 vendor=0x8086 device=0x2a00 subvendor=0x106b subdevice=0x00a1
    vendor     = 'Intel Corporation'
    device     = 'Mobile PM965/GM965/GL960 Memory Controller Hub'
    class      = bridge
    subclass   = HOST-PCI
    cap 09[e0] = vendor (length 10) Intel cap 9 version 1

vgapci0@pci0:0:2:0:	class=0x030000 rev=0x03 hdr=0x00 vendor=0x8086 device=0x2a02 subvendor=0x106b subdevice=0x00a1
    vendor     = 'Intel Corporation'
    device     = 'Mobile GM965/GL960 Integrated Graphics Controller (primary)'
    class      = display
    subclass   = VGA
    bar   [10] = type Memory, range 64, base 0xd0000000, size 1048576, enabled
    bar   [18] = type Prefetchable Memory, range 64, base 0xc0000000, size 268435456, enabled
    bar   [20] = type I/O Port, range 32, base 0x3110, size 8, enabled
    cap 05[90] = MSI supports 1 message 
    cap 01[d0] = powerspec 3  supports D0 D3  current D0

vgapci1@pci0:0:2:1:	class=0x038000 rev=0x03 hdr=0x00 vendor=0x8086 device=0x2a03 subvendor=0x106b subdevice=0x00a1
    vendor     = 'Intel Corporation'
    device     = 'Mobile GM965/GL960 Integrated Graphics Controller (secondary)'
    class      = display
    bar   [10] = type Memory, range 64, base 0xd0100000, size 1048576, enabled
    cap 01[d0] = powerspec 3  supports D0 D3  current D0

uhci0@pci0:0:26:0:	class=0x0c0300 rev=0x03 hdr=0x00 vendor=0x8086 device=0x2834 subvendor=0x0000 subdevice=0x0000
    vendor     = 'Intel Corporation'
    device     = '82801H (ICH8 Family) USB UHCI Controller'
    class      = serial bus
    subclass   = USB
    bar   [20] = type I/O Port, range 32, base 0x30c0, size 32, enabled

uhci1@pci0:0:26:1:	class=0x0c0300 rev=0x03 hdr=0x00 vendor=0x8086 device=0x2835 subvendor=0x106b subdevice=0x00a1
    vendor     = 'Intel Corporation'
    device     = '82801H (ICH8 Family) USB UHCI Controller'
    class      = serial bus
    subclass   = USB
    bar   [20] = type I/O Port, range 32, base 0x30a0, size 32, enabled

ehci0@pci0:0:26:7:	class=0x0c0320 rev=0x03 hdr=0x00 vendor=0x8086 device=0x283a subvendor=0x106b subdevice=0x00a1
    vendor     = 'Intel Corporation'
    device     = '82801H (ICH8 Family) USB2 EHCI Controller'
    class      = serial bus
    subclass   = USB
    bar   [10] = type Memory, range 32, base 0xd0604c00, size 1024, enabled
    cap 01[50] = powerspec 2  supports D0 D3  current D0
    cap 0a[58] = EHCI Debug Port at offset 0xa0 in map 0x14

hdac0@pci0:0:27:0:	class=0x040300 rev=0x03 hdr=0x00 vendor=0x8086 device=0x284b subvendor=0x106b subdevice=0x00a1
    vendor     = 'Intel Corporation'
    device     = '82801H (ICH8 Family) HD Audio Controller'
    class      = multimedia
    subclass   = HDA
    bar   [10] = type Memory, range 64, base 0xd0600000, size 16384, enabled
    cap 01[50] = powerspec 2  supports D0 D3  current D0
    cap 05[60] = MSI supports 1 message, 64 bit enabled with 1 message
    cap 10[70] = PCI-Express 1 root endpoint max data 128(128) NS
                 max read 128
    ecap 0002[100] = VC 1 max VC1
    ecap 0005[130] = Root Complex Link Declaration 1

pcib1@pci0:0:28:0:	class=0x060400 rev=0x03 hdr=0x01 vendor=0x8086 device=0x283f subvendor=0x0000 subdevice=0x0000
    vendor     = 'Intel Corporation'
    device     = '82801H (ICH8 Family) PCI Express Port 1'
    class      = bridge
    subclass   = PCI-PCI
    cap 10[40] = PCI-Express 1 root port max data 128(128)
                 max read 128
                 link x0(x1) speed 0.0(2.5) ASPM disabled(L0s/L1)
                 slot 0 power limit 65 mW HotPlug(empty) surprise
    cap 05[80] = MSI supports 1 message enabled with 1 message
    cap 0d[90] = PCI Bridge subvendor=0x0000 subdevice=0x0000
    cap 01[a0] = powerspec 2  supports D0 D3  current D0
    ecap 0002[100] = VC 1 max VC0
    ecap 0005[180] = Root Complex Link Declaration 1

pcib2@pci0:0:28:4:	class=0x060400 rev=0x03 hdr=0x01 vendor=0x8086 device=0x2847 subvendor=0x0000 subdevice=0x0000
    vendor     = 'Intel Corporation'
    device     = '82801H (ICH8 Family) PCI Express Port 5'
    class      = bridge
    subclass   = PCI-PCI
    cap 10[40] = PCI-Express 1 root port max data 128(128)
                 max read 128
                 link x1(x1) speed 2.5(2.5) ASPM L1(L0s/L1)
                 slot 4 power limit 65 mW HotPlug(present) surprise
    cap 05[80] = MSI supports 1 message enabled with 1 message
    cap 0d[90] = PCI Bridge subvendor=0x0000 subdevice=0x0000
    cap 01[a0] = powerspec 2  supports D0 D3  current D0
    ecap 0002[100] = VC 1 max VC0
    ecap 0005[180] = Root Complex Link Declaration 1

pcib3@pci0:0:28:5:	class=0x060400 rev=0x03 hdr=0x01 vendor=0x8086 device=0x2849 subvendor=0x0000 subdevice=0x0000
    vendor     = 'Intel Corporation'
    device     = '82801H (ICH8 Family) PCI Express Port 6'
    class      = bridge
    subclass   = PCI-PCI
    cap 10[40] = PCI-Express 1 root port max data 128(128)
                 max read 128
                 link x1(x1) speed 2.5(2.5) ASPM L1(L0s/L1)
                 slot 5 power limit 65 mW HotPlug(present) surprise
    cap 05[80] = MSI supports 1 message enabled with 1 message
    cap 0d[90] = PCI Bridge subvendor=0x0000 subdevice=0x0000
    cap 01[a0] = powerspec 2  supports D0 D3  current D0
    ecap 0002[100] = VC 1 max VC0
    ecap 0005[180] = Root Complex Link Declaration 1

uhci2@pci0:0:29:0:	class=0x0c0300 rev=0x03 hdr=0x00 vendor=0x8086 device=0x2830 subvendor=0x106b subdevice=0x00a1
    vendor     = 'Intel Corporation'
    device     = '82801H (ICH8 Family) USB UHCI Controller'
    class      = serial bus
    subclass   = USB
    bar   [20] = type I/O Port, range 32, base 0x3080, size 32, enabled

uhci3@pci0:0:29:1:	class=0x0c0300 rev=0x03 hdr=0x00 vendor=0x8086 device=0x2831 subvendor=0x106b subdevice=0x00a1
    vendor     = 'Intel Corporation'
    device     = '82801H (ICH8 Family) USB UHCI Controller'
    class      = serial bus
    subclass   = USB
    bar   [20] = type I/O Port, range 32, base 0x3060, size 32, enabled

uhci4@pci0:0:29:2:	class=0x0c0300 rev=0x03 hdr=0x00 vendor=0x8086 device=0x2832 subvendor=0x106b subdevice=0x00a1
    vendor     = 'Intel Corporation'
    device     = '82801H (ICH8 Family) USB UHCI Controller'
    class      = serial bus
    subclass   = USB
    bar   [20] = type I/O Port, range 32, base 0x3040, size 32, enabled

ehci1@pci0:0:29:7:	class=0x0c0320 rev=0x03 hdr=0x00 vendor=0x8086 device=0x2836 subvendor=0x106b subdevice=0x00a1
    vendor     = 'Intel Corporation'
    device     = '82801H (ICH8 Family) USB2 EHCI Controller'
    class      = serial bus
    subclass   = USB
    bar   [10] = type Memory, range 32, base 0xd0604800, size 1024, enabled
    cap 01[50] = powerspec 2  supports D0 D3  current D0
    cap 0a[58] = EHCI Debug Port at offset 0xa0 in map 0x14

pcib4@pci0:0:30:0:	class=0x060401 rev=0xf3 hdr=0x01 vendor=0x8086 device=0x2448 subvendor=0x0000 subdevice=0x0000
    vendor     = 'Intel Corporation'
    device     = '82801 Mobile PCI Bridge'
    class      = bridge
    subclass   = PCI-PCI
    cap 0d[50] = PCI Bridge subvendor=0x0000 subdevice=0x0000

isab0@pci0:0:31:0:	class=0x060100 rev=0x03 hdr=0x00 vendor=0x8086 device=0x2815 subvendor=0x106b subdevice=0x00a1
    vendor     = 'Intel Corporation'
    device     = '82801HM (ICH8M) LPC Interface Controller'
    class      = bridge
    subclass   = PCI-ISA
    cap 09[e0] = vendor (length 12) Intel cap 1 version 0
		 features: SATA RAID-5, Mobile, 4 PCI-e x1 slots, SATA RAID-0/1/10

atapci0@pci0:0:31:1:	class=0x01018f rev=0x03 hdr=0x00 vendor=0x8086 device=0x2850 subvendor=0x106b subdevice=0x00a1
    vendor     = 'Intel Corporation'
    device     = '82801HM/HEM (ICH8M/ICH8M-E) IDE Controller'
    class      = mass storage
    subclass   = ATA
    bar   [10] = type I/O Port, range 32, base 0x3108, size 8, enabled
    bar   [14] = type I/O Port, range 32, base 0x3124, size 4, enabled
    bar   [18] = type I/O Port, range 32, base 0x3100, size 8, enabled
    bar   [1c] = type I/O Port, range 32, base 0x3120, size 4, enabled
    bar   [20] = type I/O Port, range 32, base 0x30e0, size 16, enabled

ahci0@pci0:0:31:2:	class=0x010601 rev=0x03 hdr=0x00 vendor=0x8086 device=0x2829 subvendor=0x106b subdevice=0x00a1
    vendor     = 'Intel Corporation'
    device     = '82801HM/HEM (ICH8M/ICH8M-E) SATA Controller [AHCI mode]'
    class      = mass storage
    subclass   = SATA
    bar   [10] = type I/O Port, range 32, base 0x30f8, size 8, enabled
    bar   [14] = type I/O Port, range 32, base 0x311c, size 4, enabled
    bar   [18] = type I/O Port, range 32, base 0x30f0, size 8, enabled
    bar   [1c] = type I/O Port, range 32, base 0x3118, size 4, enabled
    bar   [20] = type I/O Port, range 32, base 0x3020, size 32, enabled
    bar   [24] = type Memory, range 32, base 0xd0604000, size 2048, enabled
    cap 05[80] = MSI supports 4 messages enabled with 4 messages
    cap 01[70] = powerspec 3  supports D0 D3  current D0
    cap 12[a8] = SATA Index-Data Pair

ichsmb0@pci0:0:31:3:	class=0x0c0500 rev=0x03 hdr=0x00 vendor=0x8086 device=0x283e subvendor=0x106b subdevice=0x00a1
    vendor     = 'Intel Corporation'
    device     = '82801H (ICH8 Family) SMBus Controller'
    class      = serial bus
    subclass   = SMBus
    bar   [10] = type Memory, range 32, base 0xd0605000, size 256, enabled
    bar   [20] = type I/O Port, range 32, base 0xefa0, size 32, enabled

ath0@pci0:2:0:0:	class=0x020000 rev=0x01 hdr=0x00 vendor=0x168c device=0x001c subvendor=0x106b subdevice=0x0086
    vendor     = 'Qualcomm Atheros'
    device     = 'AR242x / AR542x Wireless Network Adapter (PCI-Express)'
    class      = network
    subclass   = ethernet
    bar   [10] = type Memory, range 64, base 0xd0400000, size 65536, enabled
    cap 01[40] = powerspec 2  supports D0 D3  current D0
    cap 05[50] = MSI supports 1 message 
    cap 10[60] = PCI-Express 1 legacy endpoint max data 128(128) RO
                 max read 512
                 link x1(x1) speed 2.5(2.5) ASPM L1(L0s/L1)
    cap 11[90] = MSI-X supports 1 message
                 Table in map 0x10[0x0], PBA in map 0x10[0x0]
    ecap 0001[100] = AER 1 0 fatal 1 non-fatal 0 corrected
    ecap 0002[140] = VC 1 max VC0

mskc0@pci0:3:0:0:	class=0x020000 rev=0x13 hdr=0x00 vendor=0x11ab device=0x436a subvendor=0x11ab subdevice=0x00ba
    vendor     = 'Marvell Technology Group Ltd.'
    device     = '88E8058 PCI-E Gigabit Ethernet Controller'
    class      = network
    subclass   = ethernet
    bar   [10] = type Memory, range 64, base 0xd0300000, size 16384, enabled
    bar   [18] = type I/O Port, range 32, base 0x2000, size 256, enabled
    cap 01[48] = powerspec 3  supports D0 D1 D2 D3  current D0
    cap 03[50] = VPD
    cap 05[5c] = MSI supports 1 message, 64 bit enabled with 1 message
    cap 10[e0] = PCI-Express 1 legacy endpoint max data 128(128)
                 max read 2048
                 link x1(x1) speed 2.5(2.5) ASPM L0s/L1(L0s/L1) ClockPM enabled
    ecap 0001[100] = AER 1 0 fatal 0 non-fatal 1 corrected

fwohci0@pci0:4:3:0:	class=0x0c0010 rev=0x61 hdr=0x00 vendor=0x11c1 device=0x5811 subvendor=0x11c1 subdevice=0x5811
    vendor     = 'LSI Corporation'
    device     = 'FW322/323 [TrueFire] 1394a Controller'
    class      = serial bus
    subclass   = FireWire
    bar   [10] = type Memory, range 32, base 0xd0201000, size 4096, enabled
    cap 01[44] = powerspec 2  supports D0 D1 D2 D3  current D0
