none0@pci0:0:0:0:	class=0x050000 rev=0xa1 hdr=0x00 vendor=0x10de device=0x03ea subvendor=0x147b subdevice=0x1c2a
    vendor     = 'NVIDIA Corporation'
    device     = 'MCP61 Memory Controller'
    class      = memory
    subclass   = RAM
    cap 08[44] = HT slave
    cap 08[dc] = HT MSI address window enabled at 0xfee00000

isab0@pci0:0:1:0:	class=0x060100 rev=0xa2 hdr=0x00 vendor=0x10de device=0x03e0 subvendor=0x147b subdevice=0x1c2a
    vendor     = 'NVIDIA Corporation'
    device     = 'MCP61 LPC Bridge'
    class      = bridge
    subclass   = PCI-ISA

none1@pci0:0:1:1:	class=0x0c0500 rev=0xa2 hdr=0x00 vendor=0x10de device=0x03eb subvendor=0x147b subdevice=0x1c2a
    vendor     = 'NVIDIA Corporation'
    device     = 'MCP61 SMBus'
    class      = serial bus
    subclass   = SMBus
    bar   [10] = type I/O Port, range 32, base 0xfc00, size 64, enabled
    bar   [20] = type I/O Port, range 32, base 0x1c00, size 64, enabled
    bar   [24] = type I/O Port, range 32, base 0xf400, size 64, enabled
    cap 01[44] = powerspec 2  supports D0 D3  current D0

none2@pci0:0:1:2:	class=0x050000 rev=0xa2 hdr=0x00 vendor=0x10de device=0x03f5 subvendor=0x147b subdevice=0x1c2a
    vendor     = 'NVIDIA Corporation'
    device     = 'MCP61 Memory Controller'
    class      = memory
    subclass   = RAM

ohci0@pci0:0:2:0:	class=0x0c0310 rev=0xa3 hdr=0x00 vendor=0x10de device=0x03f1 subvendor=0x147b subdevice=0x1c2a
    vendor     = 'NVIDIA Corporation'
    device     = 'MCP61 USB 1.1 Controller'
    class      = serial bus
    subclass   = USB
    bar   [10] = type Memory, range 32, base 0xfe02f000, size 4096, enabled
    cap 01[44] = powerspec 2  supports D0 D1 D2 D3  current D0

ehci0@pci0:0:2:1:	class=0x0c0320 rev=0xa3 hdr=0x00 vendor=0x10de device=0x03f2 subvendor=0x147b subdevice=0x1c2a
    vendor     = 'NVIDIA Corporation'
    device     = 'MCP61 USB 2.0 Controller'
    class      = serial bus
    subclass   = USB
    bar   [10] = type Memory, range 32, base 0xfe02e000, size 256, enabled
    cap 0a[44] = EHCI Debug Port at offset 0x98 in map 0x14
    cap 01[80] = powerspec 2  supports D0 D1 D2 D3  current D0

pcib1@pci0:0:4:0:	class=0x060401 rev=0xa1 hdr=0x01 vendor=0x10de device=0x03f3 subvendor=0x10de subdevice=0xcb84
    vendor     = 'NVIDIA Corporation'
    device     = 'MCP61 PCI bridge'
    class      = bridge
    subclass   = PCI-PCI
    cap 0d[b8] = PCI Bridge subvendor=0x10de subdevice=0xcb84
    cap 08[8c] = HT MSI address window disabled at 0xfee00000

hdac0@pci0:0:5:0:	class=0x040300 rev=0xa2 hdr=0x00 vendor=0x10de device=0x03f0 subvendor=0x147b subdevice=0x1c2a
    vendor     = 'NVIDIA Corporation'
    device     = 'MCP61 High Definition Audio'
    class      = multimedia
    subclass   = HDA
    bar   [10] = type Memory, range 32, base 0xfe024000, size 16384, enabled
    cap 01[44] = powerspec 2  supports D0 D3  current D0
    cap 05[50] = MSI supports 1 message, 64 bit, vector masks enabled with 1 message
    cap 08[6c] = HT MSI fixed address window enabled at 0xfee00000

atapci0@pci0:0:6:0:	class=0x01018a rev=0xa2 hdr=0x00 vendor=0x10de device=0x03ec subvendor=0x147b subdevice=0x1c2a
    vendor     = 'NVIDIA Corporation'
    device     = 'MCP61 IDE'
    class      = mass storage
    subclass   = ATA
    bar   [20] = type I/O Port, range 32, base 0xf000, size 16, enabled
    cap 01[44] = powerspec 2  supports D0 D3  current D0

nfe0@pci0:0:7:0:	class=0x068000 rev=0xa2 hdr=0x00 vendor=0x10de device=0x03ef subvendor=0x147b subdevice=0x1c2a
    vendor     = 'NVIDIA Corporation'
    device     = 'MCP61 Ethernet'
    class      = bridge
    bar   [10] = type Memory, range 32, base 0xfe02d000, size 4096, enabled
    bar   [14] = type I/O Port, range 32, base 0xec00, size 8, enabled
    cap 01[44] = powerspec 2  supports D0 D1 D2 D3  current D0
    cap 05[50] = MSI supports 8 messages, 64 bit, vector masks enabled with 8 messages
    cap 08[6c] = HT MSI fixed address window enabled at 0xfee00000

atapci1@pci0:0:8:0:	class=0x010185 rev=0xa2 hdr=0x00 vendor=0x10de device=0x03f6 subvendor=0x147b subdevice=0x1c2a
    vendor     = 'NVIDIA Corporation'
    device     = 'MCP61 SATA Controller'
    class      = mass storage
    subclass   = ATA
    bar   [10] = type I/O Port, range 32, base 0x9f0, size 8, enabled
    bar   [14] = type I/O Port, range 32, base 0xbf0, size 4, enabled
    bar   [18] = type I/O Port, range 32, base 0x970, size 8, enabled
    bar   [1c] = type I/O Port, range 32, base 0xb70, size 4, enabled
    bar   [20] = type I/O Port, range 32, base 0xd800, size 16, enabled
    bar   [24] = type Memory, range 32, base 0xfe02c000, size 4096, enabled
    cap 01[44] = powerspec 2  supports D0 D3  current D0
    cap 05[b0] = MSI supports 4 messages, 64 bit 
    cap 08[cc] = HT MSI fixed address window disabled at 0xfee00000

atapci2@pci0:0:8:1:	class=0x010185 rev=0xa2 hdr=0x00 vendor=0x10de device=0x03f6 subvendor=0x147b subdevice=0x1c2a
    vendor     = 'NVIDIA Corporation'
    device     = 'MCP61 SATA Controller'
    class      = mass storage
    subclass   = ATA
    bar   [10] = type I/O Port, range 32, base 0x9e0, size 8, enabled
    bar   [14] = type I/O Port, range 32, base 0xbe0, size 4, enabled
    bar   [18] = type I/O Port, range 32, base 0x960, size 8, enabled
    bar   [1c] = type I/O Port, range 32, base 0xb60, size 4, enabled
    bar   [20] = type I/O Port, range 32, base 0xc400, size 16, enabled
    bar   [24] = type Memory, range 32, base 0xfe02b000, size 4096, enabled
    cap 01[44] = powerspec 2  supports D0 D3  current D0
    cap 05[b0] = MSI supports 4 messages, 64 bit 
    cap 08[cc] = HT MSI fixed address window disabled at 0xfee00000

pcib2@pci0:0:9:0:	class=0x060400 rev=0xa2 hdr=0x01 vendor=0x10de device=0x03e8 subvendor=0x10de subdevice=0x0000
    vendor     = 'NVIDIA Corporation'
    device     = 'MCP61 PCI Express bridge'
    class      = bridge
    subclass   = PCI-PCI
    cap 0d[40] = PCI Bridge subvendor=0x10de subdevice=0x0000
    cap 01[48] = powerspec 2  supports D0 D3  current D0
    cap 05[50] = MSI supports 2 messages, 64 bit 
    cap 08[60] = HT MSI address window enabled at 0xfee00000
    cap 10[80] = PCI-Express 1 root port max data 128(256) RO NS
                 max read 512
                 link x16(x16) speed 2.5(2.5) ASPM disabled(L0s/L1)
                 slot 1 power limit 75000 mW
    ecap 0002[100] = VC 1 max VC0

pcib3@pci0:0:11:0:	class=0x060400 rev=0xa2 hdr=0x01 vendor=0x10de device=0x03e9 subvendor=0x10de subdevice=0x0000
    vendor     = 'NVIDIA Corporation'
    device     = 'MCP61 PCI Express bridge'
    class      = bridge
    subclass   = PCI-PCI
    cap 0d[40] = PCI Bridge subvendor=0x10de subdevice=0x0000
    cap 01[48] = powerspec 2  supports D0 D3  current D0
    cap 05[50] = MSI supports 2 messages, 64 bit 
    cap 08[60] = HT MSI address window disabled at 0xfee00000
    cap 10[80] = PCI-Express 1 root port max data 256(256) RO NS
                 max read 512
                 link x1(x1) speed 2.5(2.5) ASPM disabled(L0s/L1)
                 slot 2 power limit 10000 mW
    ecap 0002[100] = VC 1 max VC0

pcib4@pci0:0:12:0:	class=0x060400 rev=0xa2 hdr=0x01 vendor=0x10de device=0x03e9 subvendor=0x10de subdevice=0x0000
    vendor     = 'NVIDIA Corporation'
    device     = 'MCP61 PCI Express bridge'
    class      = bridge
    subclass   = PCI-PCI
    cap 0d[40] = PCI Bridge subvendor=0x10de subdevice=0x0000
    cap 01[48] = powerspec 2  supports D0 D3  current D0
    cap 05[50] = MSI supports 2 messages, 64 bit 
    cap 08[60] = HT MSI address window disabled at 0xfee00000
    cap 10[80] = PCI-Express 1 root port max data 256(256) RO NS
                 max read 512
                 link x1(x1) speed 2.5(2.5) ASPM disabled(L0s/L1)
                 slot 3 power limit 10000 mW
    ecap 0002[100] = VC 1 max VC0

hostb0@pci0:0:24:0:	class=0x060000 rev=0x00 hdr=0x00 vendor=0x1022 device=0x1100 subvendor=0x0000 subdevice=0x0000
    vendor     = 'Advanced Micro Devices, Inc. [AMD]'
    device     = 'K8 [Athlon64/Opteron] HyperTransport Technology Configuration'
    class      = bridge
    subclass   = HOST-PCI
    cap 08[80] = HT host

hostb1@pci0:0:24:1:	class=0x060000 rev=0x00 hdr=0x00 vendor=0x1022 device=0x1101 subvendor=0x0000 subdevice=0x0000
    vendor     = 'Advanced Micro Devices, Inc. [AMD]'
    device     = 'K8 [Athlon64/Opteron] Address Map'
    class      = bridge
    subclass   = HOST-PCI

hostb2@pci0:0:24:2:	class=0x060000 rev=0x00 hdr=0x00 vendor=0x1022 device=0x1102 subvendor=0x0000 subdevice=0x0000
    vendor     = 'Advanced Micro Devices, Inc. [AMD]'
    device     = 'K8 [Athlon64/Opteron] DRAM Controller'
    class      = bridge
    subclass   = HOST-PCI

hostb3@pci0:0:24:3:	class=0x060000 rev=0x00 hdr=0x00 vendor=0x1022 device=0x1103 subvendor=0x0000 subdevice=0x0000
    vendor     = 'Advanced Micro Devices, Inc. [AMD]'
    device     = 'K8 [Athlon64/Opteron] Miscellaneous Control'
    class      = bridge
    subclass   = HOST-PCI
    cap 0f[f0] = unknown

re0@pci0:1:6:0:	class=0x020000 rev=0x10 hdr=0x00 vendor=0x1186 device=0x4300 subvendor=0x1186 subdevice=0x4c00
    vendor     = 'D-Link System Inc'
    device     = 'DGE-528T Gigabit Ethernet Adapter'
    class      = network
    subclass   = ethernet
    bar   [10] = type I/O Port, range 32, base 0xbc00, size 256, enabled
    bar   [14] = type Memory, range 32, base 0xfdfff000, size 256, enabled
    cap 01[dc] = powerspec 2  supports D0 D1 D2 D3  current D0

none3@pci0:1:9:0:	class=0x0c0010 rev=0x80 hdr=0x00 vendor=0x1106 device=0x3044 subvendor=0x103c subdevice=0x2a61
    vendor     = 'VIA Technologies, Inc.'
    device     = 'VT6306/7/8 [Fire II(M)] IEEE 1394 OHCI Controller'
    class      = serial bus
    subclass   = FireWire
    bar   [10] = type Memory, range 32, base 0xfdffe000, size 2048, enabled
    bar   [14] = type I/O Port, range 32, base 0xb800, size 128, enabled
    cap 01[50] = powerspec 2  supports D0 D2 D3  current D0

vgapci0@pci0:2:0:0:	class=0x030000 rev=0xa1 hdr=0x00 vendor=0x10de device=0x0de1 subvendor=0x0000 subdevice=0x0000
    vendor     = 'NVIDIA Corporation'
    device     = 'GF108 [GeForce GT 430]'
    class      = display
    subclass   = VGA
    bar   [10] = type Memory, range 32, base 0xfb000000, size 16777216, enabled
    bar   [14] = type Prefetchable Memory, range 64, base 0xd8000000, size 134217728, enabled
    bar   [1c] = type Prefetchable Memory, range 64, base 0xe6000000, size 33554432, enabled
    bar   [24] = type I/O Port, range 32, base 0xac00, size 128, enabled
    cap 01[60] = powerspec 3  supports D0 D3  current D0
    cap 05[68] = MSI supports 1 message, 64 bit enabled with 1 message
    cap 10[78] = PCI-Express 2 endpoint max data 128(128) RO NS
                 max read 512
                 link x16(x16) speed 2.5(2.5) ASPM disabled(L0s/L1) ClockPM enabled
    cap 09[b4] = vendor (length 20)
    ecap 0002[100] = VC 1 max VC0
    ecap 0004[128] = Power Budgeting 1
    ecap 000b[600] = Vendor [1] ID 0001 Rev 1 Length 36

hdac1@pci0:2:0:1:	class=0x040300 rev=0xa1 hdr=0x00 vendor=0x10de device=0x0bea subvendor=0x0000 subdevice=0x0000
    vendor     = 'NVIDIA Corporation'
    device     = 'GF108 High Definition Audio Controller'
    class      = multimedia
    subclass   = HDA
    bar   [10] = type Memory, range 32, base 0xfcffc000, size 16384, enabled
    cap 01[60] = powerspec 3  supports D0 D3  current D0
    cap 05[68] = MSI supports 1 message, 64 bit 
    cap 10[78] = PCI-Express 2 endpoint max data 128(128) RO NS
                 max read 512
                 link x16(x16) speed 2.5(2.5) ASPM L0s/L1(L0s/L1) ClockPM enabled
