hostb0@pci0:0:0:0:	class=0x060000 card=0x4c531849 chip=0x4c538086 rev=0x01 hdr=0x00
    vendor     = 'Intel Corporation'
    class      = bridge
    subclass   = HOST-PCI

pcib1@pci0:0:1:0:	class=0x060400 card=0x4c011849 chip=0x4c018086 rev=0x01 hdr=0x01
    vendor     = 'Intel Corporation'
    class      = bridge
    subclass   = PCI-PCI
    cap 10[40] = PCI-Express 2 root port max data 256(256) ARI enabled
                 link x8(x16) speed 5.0(16.0)
                 slot 1 power limit 75000 mW
    cap 05[80] = MSI supports 1 message 
    cap 0d[90] = PCI Bridge card=0x4c011849
    cap 01[a0] = powerspec 3  supports D0 D3  current D0
    ecap 0000[100] = unknown 0
    ecap 000d[220] = ACS 1
    ecap 001f[150] = unknown 1
    ecap 0002[280] = VC 1 max VC0
    ecap 001d[a00] = unknown 1
    ecap 0019[a30] = PCIe Sec 1 lane errors 0
    ecap 0025[a90] = unknown 1
    ecap 0026[a9c] = unknown 1
    ecap 0027[edc] = unknown 1

vgapci0@pci0:0:2:0:	class=0x030000 card=0x4c8b1849 chip=0x4c8b8086 rev=0x04 hdr=0x00
    vendor     = 'Intel Corporation'
    class      = display
    subclass   = VGA
    bar   [10] = type Memory, range 64, base 0xa0000000, size 16777216, enabled
    bar   [18] = type Prefetchable Memory, range 64, base 0x90000000, size 268435456, enabled
    bar   [20] = type I/O Port, range 32, base 0x5000, size 64, enabled
    cap 09[40] = vendor (length 12) Intel cap 0 version 1
    cap 10[70] = PCI-Express 2 root endpoint max data 128(128) FLR
    cap 05[ac] = MSI supports 1 message, vector masks 
    cap 01[d0] = powerspec 2  supports D0 D3  current D0
    ecap 001b[100] = unknown 1
    ecap 000f[200] = ATS 1
    ecap 0013[300] = unknown 1

pcib2@pci0:0:6:0:	class=0x060400 card=0x00000000 chip=0x4c098086 rev=0x01 hdr=0x01
    vendor     = 'Intel Corporation'
    class      = bridge
    subclass   = PCI-PCI
    cap 10[40] = PCI-Express 2 root port max data 256(256) ARI disabled
                 link x4(x4) speed 16.0(16.0)
                 slot 0 power limit 75000 mW
    cap 05[80] = MSI supports 1 message 
    cap 0d[90] = PCI Bridge card=0x00000000
    cap 01[a0] = powerspec 3  supports D0 D3  current D0
    ecap 0000[100] = unknown 0
    ecap 000d[220] = ACS 1
    ecap 001f[150] = unknown 1
    ecap 0002[280] = VC 1 max VC0
    ecap 001d[a00] = unknown 1
    ecap 0019[a30] = PCIe Sec 1 lane errors 0
    ecap 0025[a90] = unknown 1
    ecap 0026[a9c] = unknown 1
    ecap 0027[edc] = unknown 1

none0@pci0:0:8:0:	class=0x088000 card=0x4c111849 chip=0x4c118086 rev=0x01 hdr=0x00
    vendor     = 'Intel Corporation'
    class      = base peripheral
    bar   [10] = type Memory, range 64, base 0xa143b000, size 4096, enabled
    cap 05[90] = MSI supports 1 message 
    cap 09[a0] = vendor (length 20) Intel cap 15 version 0
    cap 01[dc] = powerspec 2  supports D0 D3  current D0
    cap 13[f0] = PCI Advanced Features: FLR TP

xhci0@pci0:0:20:0:	class=0x0c0330 card=0x43ed1849 chip=0x43ed8086 rev=0x11 hdr=0x00
    vendor     = 'Intel Corporation'
    class      = serial bus
    subclass   = USB
    bar   [10] = type Memory, range 64, base 0xa1420000, size 65536, enabled
    cap 01[70] = powerspec 2  supports D0 D3  current D0
    cap 05[80] = MSI supports 8 messages, 64 bit enabled with 1 message
    cap 09[90] = vendor (length 20) Intel cap 15 version 0
    cap 09[b0] = vendor (length 0) Intel cap 0 version 1

none1@pci0:0:20:2:	class=0x050000 card=0x00000000 chip=0x43ef8086 rev=0x11 hdr=0x00
    vendor     = 'Intel Corporation'
    class      = memory
    subclass   = RAM
    bar   [10] = type Memory, range 64, base 0xa1430000, size 16384, enabled
    bar   [18] = type Memory, range 64, base 0xa143a000, size 4096, enabled
    cap 01[80] = powerspec 3  supports D0 D3  current D0

none2@pci0:0:22:0:	class=0x078000 card=0x43e01849 chip=0x43e08086 rev=0x11 hdr=0x00
    vendor     = 'Intel Corporation'
    class      = simple comms
    bar   [10] = type Memory, range 64, base 0xa1439000, size 4096, enabled
    cap 01[50] = powerspec 3  supports D0 D3  current D0
    cap 05[8c] = MSI supports 1 message, 64 bit 
    cap 09[a4] = vendor (length 20) Intel cap 15 version 0

ahci0@pci0:0:23:0:	class=0x010601 card=0x43d21849 chip=0x43d28086 rev=0x11 hdr=0x00
    vendor     = 'Intel Corporation'
    class      = mass storage
    subclass   = SATA
    bar   [10] = type Memory, range 32, base 0xa1434000, size 8192, enabled
    bar   [14] = type Memory, range 32, base 0xa1438000, size 256, enabled
    bar   [18] = type I/O Port, range 32, base 0x5090, size 8, enabled
    bar   [1c] = type I/O Port, range 32, base 0x5080, size 4, enabled
    bar   [20] = type I/O Port, range 32, base 0x5060, size 32, enabled
    bar   [24] = type Memory, range 32, base 0xa1437000, size 2048, enabled
    cap 05[80] = MSI supports 1 message enabled with 1 message
    cap 01[70] = powerspec 3  supports D0 D3  current D0
    cap 12[a8] = SATA Index-Data Pair

pcib3@pci0:0:28:0:	class=0x060400 card=0x43bd1849 chip=0x43bd8086 rev=0x11 hdr=0x01
    vendor     = 'Intel Corporation'
    class      = bridge
    subclass   = PCI-PCI
    cap 10[40] = PCI-Express 2 root port max data 256(256) ARI disabled
                 link x1(x1) speed 5.0(8.0)
                 slot 9 power limit 100 mW
    cap 05[80] = MSI supports 1 message 
    cap 0d[90] = PCI Bridge card=0x43bd1849
    cap 01[a0] = powerspec 3  supports D0 D3  current D0
    ecap 0000[100] = unknown 0
    ecap 000d[220] = ACS 1
    ecap 001f[150] = unknown 1
    ecap 0019[a30] = PCIe Sec 1 lane errors 0
    ecap 001d[a00] = unknown 1

isab0@pci0:0:31:0:	class=0x060100 card=0x43861849 chip=0x43868086 rev=0x11 hdr=0x00
    vendor     = 'Intel Corporation'
    class      = bridge
    subclass   = PCI-ISA

none3@pci0:0:31:4:	class=0x0c0500 card=0x43a31849 chip=0x43a38086 rev=0x11 hdr=0x00
    vendor     = 'Intel Corporation'
    class      = serial bus
    subclass   = SMBus
    bar   [10] = type Memory, range 64, base 0xa1436000, size 256, enabled
    bar   [20] = type I/O Port, range 32, base 0xefa0, size 32, enabled

none4@pci0:0:31:5:	class=0x0c8000 card=0x43a41849 chip=0x43a48086 rev=0x11 hdr=0x00
    vendor     = 'Intel Corporation'
    class      = serial bus
    bar   [10] = type Memory, range 32, base 0xfe010000, size 4096, enabled

none5@pci0:0:31:6:	class=0x020000 card=0x15fa1849 chip=0x15fa8086 rev=0x11 hdr=0x00
    vendor     = 'Intel Corporation'
    class      = network
    subclass   = ethernet
    bar   [10] = type Memory, range 32, base 0xa1400000, size 131072, enabled
    cap 01[c8] = powerspec 3  supports D0 D3  current D0
    cap 05[d0] = MSI supports 1 message, 64 bit 

ix0@pci0:1:0:0:	class=0x020000 card=0x03171dcf chip=0x15578086 rev=0x01 hdr=0x00
    vendor     = 'Intel Corporation'
    device     = '82599 10 Gigabit Network Connection'
    class      = network
    subclass   = ethernet
    bar   [10] = type Prefetchable Memory, range 64, base 0xa1080000, size 524288, enabled
    bar   [18] = type I/O Port, range 32, base 0x4000, size 32, enabled
    bar   [20] = type Prefetchable Memory, range 64, base 0xa1100000, size 16384, enabled
    cap 01[40] = powerspec 3  supports D0 D3  current D0
    cap 05[50] = MSI supports 1 message, 64 bit, vector masks 
    cap 11[70] = MSI-X supports 64 messages, enabled
                 Table in map 0x20[0x0], PBA in map 0x20[0x2000]
    cap 10[a0] = PCI-Express 2 endpoint max data 256(512) FLR RO NS
                 link x8(x8) speed 5.0(5.0) ASPM disabled(L0s)
    cap 03[e0] = VPD
    ecap 0001[100] = AER 1 0 fatal 0 non-fatal 0 corrected
    ecap 0003[140] = Serial 1 80615fffff07460c
    ecap 000e[150] = ARI 1
    ecap 0010[160] = SR-IOV 1 IOV disabled, Memory Space disabled, ARI disabled
                     0 VFs configured out of 64 supported
                     First VF RID Offset 0x0180, VF RID Stride 0x0002
                     VF Device ID 0x10ed
                     Page Sizes: 4096 (enabled), 8192, 65536, 262144, 1048576, 4194304

nvme0@pci0:2:0:0:	class=0x010802 card=0x501115b7 chip=0x501115b7 rev=0x01 hdr=0x00
    vendor     = 'Sandisk Corp'
    class      = mass storage
    subclass   = NVM
    bar   [10] = type Memory, range 64, base 0xa1300000, size 16384, enabled
    cap 01[80] = powerspec 3  supports D0 D3  current D0
    cap 05[90] = MSI supports 32 messages, 64 bit 
    cap 11[b0] = MSI-X supports 65 messages, enabled
                 Table in map 0x10[0x3000], PBA in map 0x10[0x2000]
    cap 10[c0] = PCI-Express 2 endpoint max data 256(512) FLR RO NS
                 link x4(x4) speed 16.0(16.0) ASPM disabled(L1)
    ecap 0001[100] = AER 2 0 fatal 0 non-fatal 0 corrected
    ecap 0003[150] = Serial 1 0000000000000000
    ecap 0018[1b8] = LTR 1
    ecap 0019[300] = PCIe Sec 1 lane errors 0
    ecap 001e[900] = unknown 1
    ecap 0025[910] = unknown 1
    ecap 0027[920] = unknown 1
    ecap 0026[1c8] = unknown 1

re0@pci0:3:0:0:	class=0x020000 card=0x81251849 chip=0x812510ec rev=0x05 hdr=0x00
    vendor     = 'Realtek Semiconductor Co., Ltd.'
    class      = network
    subclass   = ethernet
    bar   [10] = type I/O Port, range 32, base 0x3000, size 256, enabled
    bar   [18] = type Memory, range 64, base 0xa1200000, size 65536, enabled
    bar   [20] = type Memory, range 64, base 0xa1210000, size 16384, enabled
    cap 01[40] = powerspec 3  supports D0 D1 D2 D3  current D0
    cap 05[50] = MSI supports 1 message, 64 bit, vector masks 
    cap 10[70] = PCI-Express 2 endpoint MSI 1 max data 256(256) RO
                 link x1(x1) speed 5.0(5.0) ASPM disabled(L0s/L1)
    cap 11[b0] = MSI-X supports 32 messages, enabled
                 Table in map 0x20[0x0], PBA in map 0x20[0x800]
    cap 03[d0] = VPD
    ecap 0001[100] = AER 2 0 fatal 0 non-fatal 0 corrected
    ecap 0002[148] = VC 1 max VC0
    ecap 0003[168] = Serial 1 bb9a6c59a1a80000
    ecap 0017[178] = TPH Requester 1
    ecap 0018[204] = LTR 1
    ecap 001e[20c] = unknown 1
    ecap 000b[21c] = Vendor 1 ID 2
