none0@pci0:255:8:0:	class=0x088000 rev=0x01 hdr=0x00 vendor=0x8086 device=0x6f80 subvendor=0x8086 subdevice=0x6f80
    vendor     = 'Intel Corporation'
    device     = 'Xeon E7 v4/Xeon E5 v4/Xeon E3 v4/Xeon D QPI Link 0'
    class      = base peripheral

none1@pci0:255:8:2:	class=0x110100 rev=0x01 hdr=0x00 vendor=0x8086 device=0x6f32 subvendor=0x8086 subdevice=0x6f32
    vendor     = 'Intel Corporation'
    device     = 'Xeon E7 v4/Xeon E5 v4/Xeon E3 v4/Xeon D QPI Link 0'
    class      = dasp
    subclass   = performance counters

none2@pci0:255:8:3:	class=0x088000 rev=0x01 hdr=0x00 vendor=0x8086 device=0x6f83 subvendor=0x8086 subdevice=0x6f83
    vendor     = 'Intel Corporation'
    device     = 'Xeon E7 v4/Xeon E5 v4/Xeon E3 v4/Xeon D QPI Link 0'
    class      = base peripheral
    cap 10[40] = PCI-Express 1 root endpoint max data 128(128)
                 max read 128
    ecap 000b[100] = Vendor [0] ID 0001 Rev 0 Length 240

none3@pci0:255:9:0:	class=0x088000 rev=0x01 hdr=0x00 vendor=0x8086 device=0x6f90 subvendor=0x8086 subdevice=0x6f90
    vendor     = 'Intel Corporation'
    device     = 'Xeon E7 v4/Xeon E5 v4/Xeon E3 v4/Xeon D QPI Link 1'
    class      = base peripheral

none4@pci0:255:9:2:	class=0x110100 rev=0x01 hdr=0x00 vendor=0x8086 device=0x6f33 subvendor=0x8086 subdevice=0x6f33
    vendor     = 'Intel Corporation'
    device     = 'Xeon E7 v4/Xeon E5 v4/Xeon E3 v4/Xeon D QPI Link 1'
    class      = dasp
    subclass   = performance counters

none5@pci0:255:9:3:	class=0x088000 rev=0x01 hdr=0x00 vendor=0x8086 device=0x6f93 subvendor=0x8086 subdevice=0x6f93
    vendor     = 'Intel Corporation'
    device     = 'Xeon E7 v4/Xeon E5 v4/Xeon E3 v4/Xeon D QPI Link 1'
    class      = base peripheral
    cap 10[40] = PCI-Express 1 root endpoint max data 128(128)
                 max read 128
    ecap 000b[100] = Vendor [0] ID 0001 Rev 0 Length 240

none6@pci0:255:11:0:	class=0x088000 rev=0x01 hdr=0x00 vendor=0x8086 device=0x6f81 subvendor=0x8086 subdevice=0x6f81
    vendor     = 'Intel Corporation'
    device     = 'Xeon E7 v4/Xeon E5 v4/Xeon E3 v4/Xeon D R3 QPI Link 0/1'
    class      = base peripheral

none7@pci0:255:11:1:	class=0x110100 rev=0x01 hdr=0x00 vendor=0x8086 device=0x6f36 subvendor=0x8086 subdevice=0x6f36
    vendor     = 'Intel Corporation'
    device     = 'Xeon E7 v4/Xeon E5 v4/Xeon E3 v4/Xeon D R3 QPI Link 0/1'
    class      = dasp
    subclass   = performance counters

none8@pci0:255:11:2:	class=0x110100 rev=0x01 hdr=0x00 vendor=0x8086 device=0x6f37 subvendor=0x8086 subdevice=0x6f37
    vendor     = 'Intel Corporation'
    device     = 'Xeon E7 v4/Xeon E5 v4/Xeon E3 v4/Xeon D R3 QPI Link 0/1'
    class      = dasp
    subclass   = performance counters

none9@pci0:255:11:3:	class=0x088000 rev=0x01 hdr=0x00 vendor=0x8086 device=0x6f76 subvendor=0x0000 subdevice=0x0000
    vendor     = 'Intel Corporation'
    device     = 'Xeon E7 v4/Xeon E5 v4/Xeon E3 v4/Xeon D R3 QPI Link Debug'
    class      = base peripheral

none10@pci0:255:12:0:	class=0x088000 rev=0x01 hdr=0x00 vendor=0x8086 device=0x6fe0 subvendor=0x8086 subdevice=0x6fe0
    vendor     = 'Intel Corporation'
    device     = 'Xeon E7 v4/Xeon E5 v4/Xeon E3 v4/Xeon D Caching Agent'
    class      = base peripheral

none11@pci0:255:12:1:	class=0x088000 rev=0x01 hdr=0x00 vendor=0x8086 device=0x6fe1 subvendor=0x8086 subdevice=0x6fe1
    vendor     = 'Intel Corporation'
    device     = 'Xeon E7 v4/Xeon E5 v4/Xeon E3 v4/Xeon D Caching Agent'
    class      = base peripheral

none12@pci0:255:12:2:	class=0x088000 rev=0x01 hdr=0x00 vendor=0x8086 device=0x6fe2 subvendor=0x8086 subdevice=0x6fe2
    vendor     = 'Intel Corporation'
    device     = 'Xeon E7 v4/Xeon E5 v4/Xeon E3 v4/Xeon D Caching Agent'
    class      = base peripheral

none13@pci0:255:12:3:	class=0x088000 rev=0x01 hdr=0x00 vendor=0x8086 device=0x6fe3 subvendor=0x8086 subdevice=0x6fe3
    vendor     = 'Intel Corporation'
    device     = 'Xeon E7 v4/Xeon E5 v4/Xeon E3 v4/Xeon D Caching Agent'
    class      = base peripheral

none14@pci0:255:12:4:	class=0x088000 rev=0x01 hdr=0x00 vendor=0x8086 device=0x6fe4 subvendor=0x8086 subdevice=0x6fe4
    vendor     = 'Intel Corporation'
    device     = 'Xeon E7 v4/Xeon E5 v4/Xeon E3 v4/Xeon D Caching Agent'
    class      = base peripheral

none15@pci0:255:12:5:	class=0x088000 rev=0x01 hdr=0x00 vendor=0x8086 device=0x6fe5 subvendor=0x8086 subdevice=0x6fe5
    vendor     = 'Intel Corporation'
    device     = 'Xeon E7 v4/Xeon E5 v4/Xeon E3 v4/Xeon D Caching Agent'
    class      = base peripheral

none16@pci0:255:12:6:	class=0x088000 rev=0x01 hdr=0x00 vendor=0x8086 device=0x6fe6 subvendor=0x8086 subdevice=0x6fe6
    vendor     = 'Intel Corporation'
    device     = 'Xeon E7 v4/Xeon E5 v4/Xeon E3 v4/Xeon D Caching Agent'
    class      = base peripheral

none17@pci0:255:12:7:	class=0x088000 rev=0x01 hdr=0x00 vendor=0x8086 device=0x6fe7 subvendor=0x8086 subdevice=0x6fe7
    vendor     = 'Intel Corporation'
    device     = 'Xeon E7 v4/Xeon E5 v4/Xeon E3 v4/Xeon D Caching Agent'
    class      = base peripheral

none18@pci0:255:13:0:	class=0x088000 rev=0x01 hdr=0x00 vendor=0x8086 device=0x6fe8 subvendor=0x8086 subdevice=0x6fe8
    vendor     = 'Intel Corporation'
    device     = 'Xeon E7 v4/Xeon E5 v4/Xeon E3 v4/Xeon D Caching Agent'
    class      = base peripheral

none19@pci0:255:13:1:	class=0x088000 rev=0x01 hdr=0x00 vendor=0x8086 device=0x6fe9 subvendor=0x8086 subdevice=0x6fe9
    vendor     = 'Intel Corporation'
    device     = 'Xeon E7 v4/Xeon E5 v4/Xeon E3 v4/Xeon D Caching Agent'
    class      = base peripheral

none20@pci0:255:15:0:	class=0x088000 rev=0x01 hdr=0x00 vendor=0x8086 device=0x6ff8 subvendor=0x8086 subdevice=0x6ff8
    vendor     = 'Intel Corporation'
    device     = 'Xeon E7 v4/Xeon E5 v4/Xeon E3 v4/Xeon D Caching Agent'
    class      = base peripheral

none21@pci0:255:15:1:	class=0x088000 rev=0x01 hdr=0x00 vendor=0x8086 device=0x6ff9 subvendor=0x8086 subdevice=0x6ff9
    vendor     = 'Intel Corporation'
    device     = 'Xeon E7 v4/Xeon E5 v4/Xeon E3 v4/Xeon D Caching Agent'
    class      = base peripheral

none22@pci0:255:15:4:	class=0x088000 rev=0x01 hdr=0x00 vendor=0x8086 device=0x6ffc subvendor=0x8086 subdevice=0x6fe0
    vendor     = 'Intel Corporation'
    device     = 'Xeon E7 v4/Xeon E5 v4/Xeon E3 v4/Xeon D Caching Agent'
    class      = base peripheral

none23@pci0:255:15:5:	class=0x088000 rev=0x01 hdr=0x00 vendor=0x8086 device=0x6ffd subvendor=0x8086 subdevice=0x6fe0
    vendor     = 'Intel Corporation'
    device     = 'Xeon E7 v4/Xeon E5 v4/Xeon E3 v4/Xeon D Caching Agent'
    class      = base peripheral

none24@pci0:255:15:6:	class=0x088000 rev=0x01 hdr=0x00 vendor=0x8086 device=0x6ffe subvendor=0x8086 subdevice=0x6fe0
    vendor     = 'Intel Corporation'
    device     = 'Xeon E7 v4/Xeon E5 v4/Xeon E3 v4/Xeon D Caching Agent'
    class      = base peripheral

none25@pci0:255:16:0:	class=0x088000 rev=0x01 hdr=0x00 vendor=0x8086 device=0x6f1d subvendor=0x8086 subdevice=0x6f1d
    vendor     = 'Intel Corporation'
    device     = 'Xeon E7 v4/Xeon E5 v4/Xeon E3 v4/Xeon D R2PCIe Agent'
    class      = base peripheral

none26@pci0:255:16:1:	class=0x110100 rev=0x01 hdr=0x00 vendor=0x8086 device=0x6f34 subvendor=0x8086 subdevice=0x6f34
    vendor     = 'Intel Corporation'
    device     = 'Xeon E7 v4/Xeon E5 v4/Xeon E3 v4/Xeon D R2PCIe Agent'
    class      = dasp
    subclass   = performance counters

none27@pci0:255:16:5:	class=0x088000 rev=0x01 hdr=0x00 vendor=0x8086 device=0x6f1e subvendor=0x8086 subdevice=0x6f1e
    vendor     = 'Intel Corporation'
    device     = 'Xeon E7 v4/Xeon E5 v4/Xeon E3 v4/Xeon D Ubox'
    class      = base peripheral

none28@pci0:255:16:6:	class=0x110100 rev=0x01 hdr=0x00 vendor=0x8086 device=0x6f7d subvendor=0x8086 subdevice=0x6f7d
    vendor     = 'Intel Corporation'
    device     = 'Xeon E7 v4/Xeon E5 v4/Xeon E3 v4/Xeon D Ubox'
    class      = dasp
    subclass   = performance counters

none29@pci0:255:16:7:	class=0x088000 rev=0x01 hdr=0x00 vendor=0x8086 device=0x6f1f subvendor=0x8086 subdevice=0x6f1f
    vendor     = 'Intel Corporation'
    device     = 'Xeon E7 v4/Xeon E5 v4/Xeon E3 v4/Xeon D Ubox'
    class      = base peripheral

none30@pci0:255:18:0:	class=0x088000 rev=0x01 hdr=0x00 vendor=0x8086 device=0x6fa0 subvendor=0x8086 subdevice=0x6fa0
    vendor     = 'Intel Corporation'
    device     = 'Xeon E7 v4/Xeon E5 v4/Xeon E3 v4/Xeon D Home Agent 0'
    class      = base peripheral
    bar   [18] = type Memory, range 32, base 0, size 64, disabled
    bar   [20] = type Memory, range 32, base 0, size 64, disabled

none31@pci0:255:18:1:	class=0x110100 rev=0x01 hdr=0x00 vendor=0x8086 device=0x6f30 subvendor=0x8086 subdevice=0x6f30
    vendor     = 'Intel Corporation'
    device     = 'Xeon E7 v4/Xeon E5 v4/Xeon E3 v4/Xeon D Home Agent 0'
    class      = dasp
    subclass   = performance counters

none32@pci0:255:19:0:	class=0x088000 rev=0x01 hdr=0x00 vendor=0x8086 device=0x6fa8 subvendor=0x8086 subdevice=0x6fa8
    vendor     = 'Intel Corporation'
    device     = 'Xeon E7 v4/Xeon E5 v4/Xeon E3 v4/Xeon D Memory Controller 0 - Target Address/Thermal/RAS'
    class      = base peripheral
    cap 10[40] = PCI-Express 1 root endpoint max data 128(128)
                 max read 128

none33@pci0:255:19:1:	class=0x088000 rev=0x01 hdr=0x00 vendor=0x8086 device=0x6f71 subvendor=0x8086 subdevice=0x6f71
    vendor     = 'Intel Corporation'
    device     = 'Xeon E7 v4/Xeon E5 v4/Xeon E3 v4/Xeon D Memory Controller 0 - Target Address/Thermal/RAS'
    class      = base peripheral
    cap 10[40] = PCI-Express 1 root endpoint max data 128(128)
                 max read 128

none34@pci0:255:19:2:	class=0x088000 rev=0x01 hdr=0x00 vendor=0x8086 device=0x6faa subvendor=0x8086 subdevice=0x6faa
    vendor     = 'Intel Corporation'
    device     = 'Xeon E7 v4/Xeon E5 v4/Xeon E3 v4/Xeon D Memory Controller 0 - Channel Target Address Decoder'
    class      = base peripheral
    cap 10[40] = PCI-Express 1 root endpoint max data 128(128)
                 max read 128

none35@pci0:255:19:3:	class=0x088000 rev=0x01 hdr=0x00 vendor=0x8086 device=0x6fab subvendor=0x8086 subdevice=0x6fab
    vendor     = 'Intel Corporation'
    device     = 'Xeon E7 v4/Xeon E5 v4/Xeon E3 v4/Xeon D Memory Controller 0 - Channel Target Address Decoder'
    class      = base peripheral
    cap 10[40] = PCI-Express 1 root endpoint max data 128(128)
                 max read 128

none36@pci0:255:19:4:	class=0x088000 rev=0x01 hdr=0x00 vendor=0x8086 device=0x6fac subvendor=0x8086 subdevice=0x6fac
    vendor     = 'Intel Corporation'
    device     = 'Xeon E7 v4/Xeon E5 v4/Xeon E3 v4/Xeon D Memory Controller 0 - Channel Target Address Decoder'
    class      = base peripheral
    cap 10[40] = PCI-Express 1 root endpoint max data 128(128)
                 max read 128

none37@pci0:255:19:5:	class=0x088000 rev=0x01 hdr=0x00 vendor=0x8086 device=0x6fad subvendor=0x8086 subdevice=0x6fad
    vendor     = 'Intel Corporation'
    device     = 'Xeon E7 v4/Xeon E5 v4/Xeon E3 v4/Xeon D Memory Controller 0 - Channel Target Address Decoder'
    class      = base peripheral
    cap 10[40] = PCI-Express 1 root endpoint max data 128(128)
                 max read 128

none38@pci0:255:19:6:	class=0x088000 rev=0x01 hdr=0x00 vendor=0x8086 device=0x6fae subvendor=0x0000 subdevice=0x0000
    vendor     = 'Intel Corporation'
    device     = 'Xeon E7 v4/Xeon E5 v4/Xeon E3 v4/Xeon D DDRIO Channel 0/1 Broadcast'
    class      = base peripheral

none39@pci0:255:19:7:	class=0x088000 rev=0x01 hdr=0x00 vendor=0x8086 device=0x6faf subvendor=0x0000 subdevice=0x0000
    vendor     = 'Intel Corporation'
    device     = 'Xeon E7 v4/Xeon E5 v4/Xeon E3 v4/Xeon D DDRIO Global Broadcast'
    class      = base peripheral

none40@pci0:255:20:0:	class=0x088000 rev=0x01 hdr=0x00 vendor=0x8086 device=0x6fb0 subvendor=0x8086 subdevice=0x6fb0
    vendor     = 'Intel Corporation'
    device     = 'Xeon E7 v4/Xeon E5 v4/Xeon E3 v4/Xeon D Memory Controller 0 - Channel 0 Thermal Control'
    class      = base peripheral
    cap 10[40] = PCI-Express 1 root endpoint max data 128(128)
                 max read 128

none41@pci0:255:20:1:	class=0x088000 rev=0x01 hdr=0x00 vendor=0x8086 device=0x6fb1 subvendor=0x8086 subdevice=0x6fb1
    vendor     = 'Intel Corporation'
    device     = 'Xeon E7 v4/Xeon E5 v4/Xeon E3 v4/Xeon D Memory Controller 0 - Channel 1 Thermal Control'
    class      = base peripheral
    cap 10[40] = PCI-Express 1 root endpoint max data 128(128)
                 max read 128

none42@pci0:255:20:2:	class=0x088000 rev=0x01 hdr=0x00 vendor=0x8086 device=0x6fb2 subvendor=0x8086 subdevice=0x6fb2
    vendor     = 'Intel Corporation'
    device     = 'Xeon E7 v4/Xeon E5 v4/Xeon E3 v4/Xeon D Memory Controller 0 - Channel 0 Error'
    class      = base peripheral
    cap 10[40] = PCI-Express 1 root endpoint max data 128(128)
                 max read 128

none43@pci0:255:20:3:	class=0x088000 rev=0x01 hdr=0x00 vendor=0x8086 device=0x6fb3 subvendor=0x8086 subdevice=0x6fb3
    vendor     = 'Intel Corporation'
    device     = 'Xeon E7 v4/Xeon E5 v4/Xeon E3 v4/Xeon D Memory Controller 0 - Channel 1 Error'
    class      = base peripheral
    cap 10[40] = PCI-Express 1 root endpoint max data 128(128)
                 max read 128

none44@pci0:255:20:4:	class=0x088000 rev=0x01 hdr=0x00 vendor=0x8086 device=0x6fbc subvendor=0x0000 subdevice=0x0000
    vendor     = 'Intel Corporation'
    device     = 'Xeon E7 v4/Xeon E5 v4/Xeon E3 v4/Xeon D DDRIO Channel 0/1 Interface'
    class      = base peripheral

none45@pci0:255:20:5:	class=0x088000 rev=0x01 hdr=0x00 vendor=0x8086 device=0x6fbd subvendor=0x0000 subdevice=0x0000
    vendor     = 'Intel Corporation'
    device     = 'Xeon E7 v4/Xeon E5 v4/Xeon E3 v4/Xeon D DDRIO Channel 0/1 Interface'
    class      = base peripheral

none46@pci0:255:20:6:	class=0x088000 rev=0x01 hdr=0x00 vendor=0x8086 device=0x6fbe subvendor=0x0000 subdevice=0x0000
    vendor     = 'Intel Corporation'
    device     = 'Xeon E7 v4/Xeon E5 v4/Xeon E3 v4/Xeon D DDRIO Channel 0/1 Interface'
    class      = base peripheral

none47@pci0:255:20:7:	class=0x088000 rev=0x01 hdr=0x00 vendor=0x8086 device=0x6fbf subvendor=0x0000 subdevice=0x0000
    vendor     = 'Intel Corporation'
    device     = 'Xeon E7 v4/Xeon E5 v4/Xeon E3 v4/Xeon D DDRIO Channel 0/1 Interface'
    class      = base peripheral

none48@pci0:255:21:0:	class=0x088000 rev=0x01 hdr=0x00 vendor=0x8086 device=0x6fb4 subvendor=0x8086 subdevice=0x6fb4
    vendor     = 'Intel Corporation'
    device     = 'Xeon E7 v4/Xeon E5 v4/Xeon E3 v4/Xeon D Memory Controller 0 - Channel 2 Thermal Control'
    class      = base peripheral
    cap 10[40] = PCI-Express 1 root endpoint max data 128(128)
                 max read 128

none49@pci0:255:21:1:	class=0x088000 rev=0x01 hdr=0x00 vendor=0x8086 device=0x6fb5 subvendor=0x8086 subdevice=0x6fb5
    vendor     = 'Intel Corporation'
    device     = 'Xeon E7 v4/Xeon E5 v4/Xeon E3 v4/Xeon D Memory Controller 0 - Channel 3 Thermal Control'
    class      = base peripheral
    cap 10[40] = PCI-Express 1 root endpoint max data 128(128)
                 max read 128

none50@pci0:255:21:2:	class=0x088000 rev=0x01 hdr=0x00 vendor=0x8086 device=0x6fb6 subvendor=0x8086 subdevice=0x6fb6
    vendor     = 'Intel Corporation'
    device     = 'Xeon E7 v4/Xeon E5 v4/Xeon E3 v4/Xeon D Memory Controller 0 - Channel 2 Error'
    class      = base peripheral
    cap 10[40] = PCI-Express 1 root endpoint max data 128(128)
                 max read 128

none51@pci0:255:21:3:	class=0x088000 rev=0x01 hdr=0x00 vendor=0x8086 device=0x6fb7 subvendor=0x8086 subdevice=0x6fb7
    vendor     = 'Intel Corporation'
    device     = 'Xeon E7 v4/Xeon E5 v4/Xeon E3 v4/Xeon D Memory Controller 0 - Channel 3 Error'
    class      = base peripheral
    cap 10[40] = PCI-Express 1 root endpoint max data 128(128)
                 max read 128

none52@pci0:255:22:0:	class=0x088000 rev=0x01 hdr=0x00 vendor=0x8086 device=0x6f68 subvendor=0x0000 subdevice=0x0000
    vendor     = 'Intel Corporation'
    device     = 'Xeon E7 v4/Xeon E5 v4/Xeon E3 v4/Xeon D Target Address/Thermal/RAS'
    class      = base peripheral
    cap 00[40] = unknown

none53@pci0:255:22:6:	class=0x088000 rev=0x01 hdr=0x00 vendor=0x8086 device=0x6f6e subvendor=0x0000 subdevice=0x0000
    vendor     = 'Intel Corporation'
    device     = 'Xeon E7 v4/Xeon E5 v4/Xeon E3 v4/Xeon D DDRIO Channel 2/3 Broadcast'
    class      = base peripheral

none54@pci0:255:22:7:	class=0x088000 rev=0x01 hdr=0x00 vendor=0x8086 device=0x6f6f subvendor=0x0000 subdevice=0x0000
    vendor     = 'Intel Corporation'
    device     = 'Xeon E7 v4/Xeon E5 v4/Xeon E3 v4/Xeon D DDRIO Global Broadcast'
    class      = base peripheral

none55@pci0:255:23:0:	class=0x088000 rev=0x01 hdr=0x00 vendor=0x8086 device=0x6fd0 subvendor=0x0000 subdevice=0x0000
    vendor     = 'Intel Corporation'
    device     = 'Xeon E7 v4/Xeon E5 v4/Xeon E3 v4/Xeon D Memory Controller 1 - Channel 0 Thermal Control'
    class      = base peripheral
    cap 00[40] = unknown

none56@pci0:255:23:4:	class=0x088000 rev=0x01 hdr=0x00 vendor=0x8086 device=0x6fb8 subvendor=0x0000 subdevice=0x0000
    vendor     = 'Intel Corporation'
    device     = 'Xeon E7 v4/Xeon E5 v4/Xeon E3 v4/Xeon D DDRIO Channel 2/3 Interface'
    class      = base peripheral

none57@pci0:255:23:5:	class=0x088000 rev=0x01 hdr=0x00 vendor=0x8086 device=0x6fb9 subvendor=0x0000 subdevice=0x0000
    vendor     = 'Intel Corporation'
    device     = 'Xeon E7 v4/Xeon E5 v4/Xeon E3 v4/Xeon D DDRIO Channel 2/3 Interface'
    class      = base peripheral

none58@pci0:255:23:6:	class=0x088000 rev=0x01 hdr=0x00 vendor=0x8086 device=0x6fba subvendor=0x0000 subdevice=0x0000
    vendor     = 'Intel Corporation'
    device     = 'Xeon E7 v4/Xeon E5 v4/Xeon E3 v4/Xeon D DDRIO Channel 2/3 Interface'
    class      = base peripheral

none59@pci0:255:23:7:	class=0x088000 rev=0x01 hdr=0x00 vendor=0x8086 device=0x6fbb subvendor=0x0000 subdevice=0x0000
    vendor     = 'Intel Corporation'
    device     = 'Xeon E7 v4/Xeon E5 v4/Xeon E3 v4/Xeon D DDRIO Channel 2/3 Interface'
    class      = base peripheral

none60@pci0:255:30:0:	class=0x088000 rev=0x01 hdr=0x00 vendor=0x8086 device=0x6f98 subvendor=0x8086 subdevice=0x6f98
    vendor     = 'Intel Corporation'
    device     = 'Xeon E7 v4/Xeon E5 v4/Xeon E3 v4/Xeon D Power Control Unit'
    class      = base peripheral

none61@pci0:255:30:1:	class=0x088000 rev=0x01 hdr=0x00 vendor=0x8086 device=0x6f99 subvendor=0x8086 subdevice=0x6f99
    vendor     = 'Intel Corporation'
    device     = 'Xeon E7 v4/Xeon E5 v4/Xeon E3 v4/Xeon D Power Control Unit'
    class      = base peripheral

none62@pci0:255:30:2:	class=0x088000 rev=0x01 hdr=0x00 vendor=0x8086 device=0x6f9a subvendor=0x8086 subdevice=0x6f9a
    vendor     = 'Intel Corporation'
    device     = 'Xeon E7 v4/Xeon E5 v4/Xeon E3 v4/Xeon D Power Control Unit'
    class      = base peripheral

none63@pci0:255:30:3:	class=0x088000 rev=0x01 hdr=0x00 vendor=0x8086 device=0x6fc0 subvendor=0x8086 subdevice=0x6fc0
    vendor     = 'Intel Corporation'
    device     = 'Xeon E7 v4/Xeon E5 v4/Xeon E3 v4/Xeon D Power Control Unit'
    class      = base peripheral
    bar   [10] = type Prefetchable Memory, range 32, base 0x10, size 16, disabled

none64@pci0:255:30:4:	class=0x088000 rev=0x01 hdr=0x00 vendor=0x8086 device=0x6f9c subvendor=0x8086 subdevice=0x6f9c
    vendor     = 'Intel Corporation'
    device     = 'Xeon E7 v4/Xeon E5 v4/Xeon E3 v4/Xeon D Power Control Unit'
    class      = base peripheral

none65@pci0:255:31:0:	class=0x088000 rev=0x01 hdr=0x00 vendor=0x8086 device=0x6f88 subvendor=0x0000 subdevice=0x0000
    vendor     = 'Intel Corporation'
    device     = 'Xeon E7 v4/Xeon E5 v4/Xeon E3 v4/Xeon D Power Control Unit'
    class      = base peripheral

none66@pci0:255:31:2:	class=0x088000 rev=0x01 hdr=0x00 vendor=0x8086 device=0x6f8a subvendor=0x0000 subdevice=0x0000
    vendor     = 'Intel Corporation'
    device     = 'Xeon E7 v4/Xeon E5 v4/Xeon E3 v4/Xeon D Power Control Unit'
    class      = base peripheral

none67@pci0:127:8:0:	class=0x088000 rev=0x01 hdr=0x00 vendor=0x8086 device=0x6f80 subvendor=0x8086 subdevice=0x6f80
    vendor     = 'Intel Corporation'
    device     = 'Xeon E7 v4/Xeon E5 v4/Xeon E3 v4/Xeon D QPI Link 0'
    class      = base peripheral

none68@pci0:127:8:2:	class=0x110100 rev=0x01 hdr=0x00 vendor=0x8086 device=0x6f32 subvendor=0x8086 subdevice=0x6f32
    vendor     = 'Intel Corporation'
    device     = 'Xeon E7 v4/Xeon E5 v4/Xeon E3 v4/Xeon D QPI Link 0'
    class      = dasp
    subclass   = performance counters

none69@pci0:127:8:3:	class=0x088000 rev=0x01 hdr=0x00 vendor=0x8086 device=0x6f83 subvendor=0x8086 subdevice=0x6f83
    vendor     = 'Intel Corporation'
    device     = 'Xeon E7 v4/Xeon E5 v4/Xeon E3 v4/Xeon D QPI Link 0'
    class      = base peripheral
    cap 10[40] = PCI-Express 1 root endpoint max data 128(128)
                 max read 128
    ecap 000b[100] = Vendor [0] ID 0001 Rev 0 Length 240

none70@pci0:127:9:0:	class=0x088000 rev=0x01 hdr=0x00 vendor=0x8086 device=0x6f90 subvendor=0x8086 subdevice=0x6f90
    vendor     = 'Intel Corporation'
    device     = 'Xeon E7 v4/Xeon E5 v4/Xeon E3 v4/Xeon D QPI Link 1'
    class      = base peripheral

none71@pci0:127:9:2:	class=0x110100 rev=0x01 hdr=0x00 vendor=0x8086 device=0x6f33 subvendor=0x8086 subdevice=0x6f33
    vendor     = 'Intel Corporation'
    device     = 'Xeon E7 v4/Xeon E5 v4/Xeon E3 v4/Xeon D QPI Link 1'
    class      = dasp
    subclass   = performance counters

none72@pci0:127:9:3:	class=0x088000 rev=0x01 hdr=0x00 vendor=0x8086 device=0x6f93 subvendor=0x8086 subdevice=0x6f93
    vendor     = 'Intel Corporation'
    device     = 'Xeon E7 v4/Xeon E5 v4/Xeon E3 v4/Xeon D QPI Link 1'
    class      = base peripheral
    cap 10[40] = PCI-Express 1 root endpoint max data 128(128)
                 max read 128
    ecap 000b[100] = Vendor [0] ID 0001 Rev 0 Length 240

none73@pci0:127:11:0:	class=0x088000 rev=0x01 hdr=0x00 vendor=0x8086 device=0x6f81 subvendor=0x8086 subdevice=0x6f81
    vendor     = 'Intel Corporation'
    device     = 'Xeon E7 v4/Xeon E5 v4/Xeon E3 v4/Xeon D R3 QPI Link 0/1'
    class      = base peripheral

none74@pci0:127:11:1:	class=0x110100 rev=0x01 hdr=0x00 vendor=0x8086 device=0x6f36 subvendor=0x8086 subdevice=0x6f36
    vendor     = 'Intel Corporation'
    device     = 'Xeon E7 v4/Xeon E5 v4/Xeon E3 v4/Xeon D R3 QPI Link 0/1'
    class      = dasp
    subclass   = performance counters

none75@pci0:127:11:2:	class=0x110100 rev=0x01 hdr=0x00 vendor=0x8086 device=0x6f37 subvendor=0x8086 subdevice=0x6f37
    vendor     = 'Intel Corporation'
    device     = 'Xeon E7 v4/Xeon E5 v4/Xeon E3 v4/Xeon D R3 QPI Link 0/1'
    class      = dasp
    subclass   = performance counters

none76@pci0:127:11:3:	class=0x088000 rev=0x01 hdr=0x00 vendor=0x8086 device=0x6f76 subvendor=0x0000 subdevice=0x0000
    vendor     = 'Intel Corporation'
    device     = 'Xeon E7 v4/Xeon E5 v4/Xeon E3 v4/Xeon D R3 QPI Link Debug'
    class      = base peripheral

none77@pci0:127:12:0:	class=0x088000 rev=0x01 hdr=0x00 vendor=0x8086 device=0x6fe0 subvendor=0x8086 subdevice=0x6fe0
    vendor     = 'Intel Corporation'
    device     = 'Xeon E7 v4/Xeon E5 v4/Xeon E3 v4/Xeon D Caching Agent'
    class      = base peripheral

none78@pci0:127:12:1:	class=0x088000 rev=0x01 hdr=0x00 vendor=0x8086 device=0x6fe1 subvendor=0x8086 subdevice=0x6fe1
    vendor     = 'Intel Corporation'
    device     = 'Xeon E7 v4/Xeon E5 v4/Xeon E3 v4/Xeon D Caching Agent'
    class      = base peripheral

none79@pci0:127:12:2:	class=0x088000 rev=0x01 hdr=0x00 vendor=0x8086 device=0x6fe2 subvendor=0x8086 subdevice=0x6fe2
    vendor     = 'Intel Corporation'
    device     = 'Xeon E7 v4/Xeon E5 v4/Xeon E3 v4/Xeon D Caching Agent'
    class      = base peripheral

none80@pci0:127:12:3:	class=0x088000 rev=0x01 hdr=0x00 vendor=0x8086 device=0x6fe3 subvendor=0x8086 subdevice=0x6fe3
    vendor     = 'Intel Corporation'
    device     = 'Xeon E7 v4/Xeon E5 v4/Xeon E3 v4/Xeon D Caching Agent'
    class      = base peripheral

none81@pci0:127:12:4:	class=0x088000 rev=0x01 hdr=0x00 vendor=0x8086 device=0x6fe4 subvendor=0x8086 subdevice=0x6fe4
    vendor     = 'Intel Corporation'
    device     = 'Xeon E7 v4/Xeon E5 v4/Xeon E3 v4/Xeon D Caching Agent'
    class      = base peripheral

none82@pci0:127:12:5:	class=0x088000 rev=0x01 hdr=0x00 vendor=0x8086 device=0x6fe5 subvendor=0x8086 subdevice=0x6fe5
    vendor     = 'Intel Corporation'
    device     = 'Xeon E7 v4/Xeon E5 v4/Xeon E3 v4/Xeon D Caching Agent'
    class      = base peripheral

none83@pci0:127:12:6:	class=0x088000 rev=0x01 hdr=0x00 vendor=0x8086 device=0x6fe6 subvendor=0x8086 subdevice=0x6fe6
    vendor     = 'Intel Corporation'
    device     = 'Xeon E7 v4/Xeon E5 v4/Xeon E3 v4/Xeon D Caching Agent'
    class      = base peripheral

none84@pci0:127:12:7:	class=0x088000 rev=0x01 hdr=0x00 vendor=0x8086 device=0x6fe7 subvendor=0x8086 subdevice=0x6fe7
    vendor     = 'Intel Corporation'
    device     = 'Xeon E7 v4/Xeon E5 v4/Xeon E3 v4/Xeon D Caching Agent'
    class      = base peripheral

none85@pci0:127:13:0:	class=0x088000 rev=0x01 hdr=0x00 vendor=0x8086 device=0x6fe8 subvendor=0x8086 subdevice=0x6fe8
    vendor     = 'Intel Corporation'
    device     = 'Xeon E7 v4/Xeon E5 v4/Xeon E3 v4/Xeon D Caching Agent'
    class      = base peripheral

none86@pci0:127:13:1:	class=0x088000 rev=0x01 hdr=0x00 vendor=0x8086 device=0x6fe9 subvendor=0x8086 subdevice=0x6fe9
    vendor     = 'Intel Corporation'
    device     = 'Xeon E7 v4/Xeon E5 v4/Xeon E3 v4/Xeon D Caching Agent'
    class      = base peripheral

none87@pci0:127:15:0:	class=0x088000 rev=0x01 hdr=0x00 vendor=0x8086 device=0x6ff8 subvendor=0x8086 subdevice=0x6ff8
    vendor     = 'Intel Corporation'
    device     = 'Xeon E7 v4/Xeon E5 v4/Xeon E3 v4/Xeon D Caching Agent'
    class      = base peripheral

none88@pci0:127:15:1:	class=0x088000 rev=0x01 hdr=0x00 vendor=0x8086 device=0x6ff9 subvendor=0x8086 subdevice=0x6ff9
    vendor     = 'Intel Corporation'
    device     = 'Xeon E7 v4/Xeon E5 v4/Xeon E3 v4/Xeon D Caching Agent'
    class      = base peripheral

none89@pci0:127:15:4:	class=0x088000 rev=0x01 hdr=0x00 vendor=0x8086 device=0x6ffc subvendor=0x8086 subdevice=0x6fe0
    vendor     = 'Intel Corporation'
    device     = 'Xeon E7 v4/Xeon E5 v4/Xeon E3 v4/Xeon D Caching Agent'
    class      = base peripheral

none90@pci0:127:15:5:	class=0x088000 rev=0x01 hdr=0x00 vendor=0x8086 device=0x6ffd subvendor=0x8086 subdevice=0x6fe0
    vendor     = 'Intel Corporation'
    device     = 'Xeon E7 v4/Xeon E5 v4/Xeon E3 v4/Xeon D Caching Agent'
    class      = base peripheral

none91@pci0:127:15:6:	class=0x088000 rev=0x01 hdr=0x00 vendor=0x8086 device=0x6ffe subvendor=0x8086 subdevice=0x6fe0
    vendor     = 'Intel Corporation'
    device     = 'Xeon E7 v4/Xeon E5 v4/Xeon E3 v4/Xeon D Caching Agent'
    class      = base peripheral

none92@pci0:127:16:0:	class=0x088000 rev=0x01 hdr=0x00 vendor=0x8086 device=0x6f1d subvendor=0x8086 subdevice=0x6f1d
    vendor     = 'Intel Corporation'
    device     = 'Xeon E7 v4/Xeon E5 v4/Xeon E3 v4/Xeon D R2PCIe Agent'
    class      = base peripheral

none93@pci0:127:16:1:	class=0x110100 rev=0x01 hdr=0x00 vendor=0x8086 device=0x6f34 subvendor=0x8086 subdevice=0x6f34
    vendor     = 'Intel Corporation'
    device     = 'Xeon E7 v4/Xeon E5 v4/Xeon E3 v4/Xeon D R2PCIe Agent'
    class      = dasp
    subclass   = performance counters

none94@pci0:127:16:5:	class=0x088000 rev=0x01 hdr=0x00 vendor=0x8086 device=0x6f1e subvendor=0x8086 subdevice=0x6f1e
    vendor     = 'Intel Corporation'
    device     = 'Xeon E7 v4/Xeon E5 v4/Xeon E3 v4/Xeon D Ubox'
    class      = base peripheral

none95@pci0:127:16:6:	class=0x110100 rev=0x01 hdr=0x00 vendor=0x8086 device=0x6f7d subvendor=0x8086 subdevice=0x6f7d
    vendor     = 'Intel Corporation'
    device     = 'Xeon E7 v4/Xeon E5 v4/Xeon E3 v4/Xeon D Ubox'
    class      = dasp
    subclass   = performance counters

none96@pci0:127:16:7:	class=0x088000 rev=0x01 hdr=0x00 vendor=0x8086 device=0x6f1f subvendor=0x8086 subdevice=0x6f1f
    vendor     = 'Intel Corporation'
    device     = 'Xeon E7 v4/Xeon E5 v4/Xeon E3 v4/Xeon D Ubox'
    class      = base peripheral

none97@pci0:127:18:0:	class=0x088000 rev=0x01 hdr=0x00 vendor=0x8086 device=0x6fa0 subvendor=0x8086 subdevice=0x6fa0
    vendor     = 'Intel Corporation'
    device     = 'Xeon E7 v4/Xeon E5 v4/Xeon E3 v4/Xeon D Home Agent 0'
    class      = base peripheral
    bar   [18] = type Memory, range 32, base 0, size 64, disabled
    bar   [20] = type Memory, range 32, base 0, size 64, disabled

none98@pci0:127:18:1:	class=0x110100 rev=0x01 hdr=0x00 vendor=0x8086 device=0x6f30 subvendor=0x8086 subdevice=0x6f30
    vendor     = 'Intel Corporation'
    device     = 'Xeon E7 v4/Xeon E5 v4/Xeon E3 v4/Xeon D Home Agent 0'
    class      = dasp
    subclass   = performance counters

none99@pci0:127:19:0:	class=0x088000 rev=0x01 hdr=0x00 vendor=0x8086 device=0x6fa8 subvendor=0x8086 subdevice=0x6fa8
    vendor     = 'Intel Corporation'
    device     = 'Xeon E7 v4/Xeon E5 v4/Xeon E3 v4/Xeon D Memory Controller 0 - Target Address/Thermal/RAS'
    class      = base peripheral
    cap 10[40] = PCI-Express 1 root endpoint max data 128(128)
                 max read 128

none100@pci0:127:19:1:	class=0x088000 rev=0x01 hdr=0x00 vendor=0x8086 device=0x6f71 subvendor=0x8086 subdevice=0x6f71
    vendor     = 'Intel Corporation'
    device     = 'Xeon E7 v4/Xeon E5 v4/Xeon E3 v4/Xeon D Memory Controller 0 - Target Address/Thermal/RAS'
    class      = base peripheral
    cap 10[40] = PCI-Express 1 root endpoint max data 128(128)
                 max read 128

none101@pci0:127:19:2:	class=0x088000 rev=0x01 hdr=0x00 vendor=0x8086 device=0x6faa subvendor=0x8086 subdevice=0x6faa
    vendor     = 'Intel Corporation'
    device     = 'Xeon E7 v4/Xeon E5 v4/Xeon E3 v4/Xeon D Memory Controller 0 - Channel Target Address Decoder'
    class      = base peripheral
    cap 10[40] = PCI-Express 1 root endpoint max data 128(128)
                 max read 128

none102@pci0:127:19:3:	class=0x088000 rev=0x01 hdr=0x00 vendor=0x8086 device=0x6fab subvendor=0x8086 subdevice=0x6fab
    vendor     = 'Intel Corporation'
    device     = 'Xeon E7 v4/Xeon E5 v4/Xeon E3 v4/Xeon D Memory Controller 0 - Channel Target Address Decoder'
    class      = base peripheral
    cap 10[40] = PCI-Express 1 root endpoint max data 128(128)
                 max read 128

none103@pci0:127:19:4:	class=0x088000 rev=0x01 hdr=0x00 vendor=0x8086 device=0x6fac subvendor=0x8086 subdevice=0x6fac
    vendor     = 'Intel Corporation'
    device     = 'Xeon E7 v4/Xeon E5 v4/Xeon E3 v4/Xeon D Memory Controller 0 - Channel Target Address Decoder'
    class      = base peripheral
    cap 10[40] = PCI-Express 1 root endpoint max data 128(128)
                 max read 128

none104@pci0:127:19:5:	class=0x088000 rev=0x01 hdr=0x00 vendor=0x8086 device=0x6fad subvendor=0x8086 subdevice=0x6fad
    vendor     = 'Intel Corporation'
    device     = 'Xeon E7 v4/Xeon E5 v4/Xeon E3 v4/Xeon D Memory Controller 0 - Channel Target Address Decoder'
    class      = base peripheral
    cap 10[40] = PCI-Express 1 root endpoint max data 128(128)
                 max read 128

none105@pci0:127:19:6:	class=0x088000 rev=0x01 hdr=0x00 vendor=0x8086 device=0x6fae subvendor=0x0000 subdevice=0x0000
    vendor     = 'Intel Corporation'
    device     = 'Xeon E7 v4/Xeon E5 v4/Xeon E3 v4/Xeon D DDRIO Channel 0/1 Broadcast'
    class      = base peripheral

none106@pci0:127:19:7:	class=0x088000 rev=0x01 hdr=0x00 vendor=0x8086 device=0x6faf subvendor=0x0000 subdevice=0x0000
    vendor     = 'Intel Corporation'
    device     = 'Xeon E7 v4/Xeon E5 v4/Xeon E3 v4/Xeon D DDRIO Global Broadcast'
    class      = base peripheral

none107@pci0:127:20:0:	class=0x088000 rev=0x01 hdr=0x00 vendor=0x8086 device=0x6fb0 subvendor=0x8086 subdevice=0x6fb0
    vendor     = 'Intel Corporation'
    device     = 'Xeon E7 v4/Xeon E5 v4/Xeon E3 v4/Xeon D Memory Controller 0 - Channel 0 Thermal Control'
    class      = base peripheral
    cap 10[40] = PCI-Express 1 root endpoint max data 128(128)
                 max read 128

none108@pci0:127:20:1:	class=0x088000 rev=0x01 hdr=0x00 vendor=0x8086 device=0x6fb1 subvendor=0x8086 subdevice=0x6fb1
    vendor     = 'Intel Corporation'
    device     = 'Xeon E7 v4/Xeon E5 v4/Xeon E3 v4/Xeon D Memory Controller 0 - Channel 1 Thermal Control'
    class      = base peripheral
    cap 10[40] = PCI-Express 1 root endpoint max data 128(128)
                 max read 128

none109@pci0:127:20:2:	class=0x088000 rev=0x01 hdr=0x00 vendor=0x8086 device=0x6fb2 subvendor=0x8086 subdevice=0x6fb2
    vendor     = 'Intel Corporation'
    device     = 'Xeon E7 v4/Xeon E5 v4/Xeon E3 v4/Xeon D Memory Controller 0 - Channel 0 Error'
    class      = base peripheral
    cap 10[40] = PCI-Express 1 root endpoint max data 128(128)
                 max read 128

none110@pci0:127:20:3:	class=0x088000 rev=0x01 hdr=0x00 vendor=0x8086 device=0x6fb3 subvendor=0x8086 subdevice=0x6fb3
    vendor     = 'Intel Corporation'
    device     = 'Xeon E7 v4/Xeon E5 v4/Xeon E3 v4/Xeon D Memory Controller 0 - Channel 1 Error'
    class      = base peripheral
    cap 10[40] = PCI-Express 1 root endpoint max data 128(128)
                 max read 128

none111@pci0:127:20:4:	class=0x088000 rev=0x01 hdr=0x00 vendor=0x8086 device=0x6fbc subvendor=0x0000 subdevice=0x0000
    vendor     = 'Intel Corporation'
    device     = 'Xeon E7 v4/Xeon E5 v4/Xeon E3 v4/Xeon D DDRIO Channel 0/1 Interface'
    class      = base peripheral

none112@pci0:127:20:5:	class=0x088000 rev=0x01 hdr=0x00 vendor=0x8086 device=0x6fbd subvendor=0x0000 subdevice=0x0000
    vendor     = 'Intel Corporation'
    device     = 'Xeon E7 v4/Xeon E5 v4/Xeon E3 v4/Xeon D DDRIO Channel 0/1 Interface'
    class      = base peripheral

none113@pci0:127:20:6:	class=0x088000 rev=0x01 hdr=0x00 vendor=0x8086 device=0x6fbe subvendor=0x0000 subdevice=0x0000
    vendor     = 'Intel Corporation'
    device     = 'Xeon E7 v4/Xeon E5 v4/Xeon E3 v4/Xeon D DDRIO Channel 0/1 Interface'
    class      = base peripheral

none114@pci0:127:20:7:	class=0x088000 rev=0x01 hdr=0x00 vendor=0x8086 device=0x6fbf subvendor=0x0000 subdevice=0x0000
    vendor     = 'Intel Corporation'
    device     = 'Xeon E7 v4/Xeon E5 v4/Xeon E3 v4/Xeon D DDRIO Channel 0/1 Interface'
    class      = base peripheral

none115@pci0:127:21:0:	class=0x088000 rev=0x01 hdr=0x00 vendor=0x8086 device=0x6fb4 subvendor=0x8086 subdevice=0x6fb4
    vendor     = 'Intel Corporation'
    device     = 'Xeon E7 v4/Xeon E5 v4/Xeon E3 v4/Xeon D Memory Controller 0 - Channel 2 Thermal Control'
    class      = base peripheral
    cap 10[40] = PCI-Express 1 root endpoint max data 128(128)
                 max read 128

none116@pci0:127:21:1:	class=0x088000 rev=0x01 hdr=0x00 vendor=0x8086 device=0x6fb5 subvendor=0x8086 subdevice=0x6fb5
    vendor     = 'Intel Corporation'
    device     = 'Xeon E7 v4/Xeon E5 v4/Xeon E3 v4/Xeon D Memory Controller 0 - Channel 3 Thermal Control'
    class      = base peripheral
    cap 10[40] = PCI-Express 1 root endpoint max data 128(128)
                 max read 128

none117@pci0:127:21:2:	class=0x088000 rev=0x01 hdr=0x00 vendor=0x8086 device=0x6fb6 subvendor=0x8086 subdevice=0x6fb6
    vendor     = 'Intel Corporation'
    device     = 'Xeon E7 v4/Xeon E5 v4/Xeon E3 v4/Xeon D Memory Controller 0 - Channel 2 Error'
    class      = base peripheral
    cap 10[40] = PCI-Express 1 root endpoint max data 128(128)
                 max read 128

none118@pci0:127:21:3:	class=0x088000 rev=0x01 hdr=0x00 vendor=0x8086 device=0x6fb7 subvendor=0x8086 subdevice=0x6fb7
    vendor     = 'Intel Corporation'
    device     = 'Xeon E7 v4/Xeon E5 v4/Xeon E3 v4/Xeon D Memory Controller 0 - Channel 3 Error'
    class      = base peripheral
    cap 10[40] = PCI-Express 1 root endpoint max data 128(128)
                 max read 128

none119@pci0:127:22:0:	class=0x088000 rev=0x01 hdr=0x00 vendor=0x8086 device=0x6f68 subvendor=0x0000 subdevice=0x0000
    vendor     = 'Intel Corporation'
    device     = 'Xeon E7 v4/Xeon E5 v4/Xeon E3 v4/Xeon D Target Address/Thermal/RAS'
    class      = base peripheral
    cap 00[40] = unknown

none120@pci0:127:22:6:	class=0x088000 rev=0x01 hdr=0x00 vendor=0x8086 device=0x6f6e subvendor=0x0000 subdevice=0x0000
    vendor     = 'Intel Corporation'
    device     = 'Xeon E7 v4/Xeon E5 v4/Xeon E3 v4/Xeon D DDRIO Channel 2/3 Broadcast'
    class      = base peripheral

none121@pci0:127:22:7:	class=0x088000 rev=0x01 hdr=0x00 vendor=0x8086 device=0x6f6f subvendor=0x0000 subdevice=0x0000
    vendor     = 'Intel Corporation'
    device     = 'Xeon E7 v4/Xeon E5 v4/Xeon E3 v4/Xeon D DDRIO Global Broadcast'
    class      = base peripheral

none122@pci0:127:23:0:	class=0x088000 rev=0x01 hdr=0x00 vendor=0x8086 device=0x6fd0 subvendor=0x0000 subdevice=0x0000
    vendor     = 'Intel Corporation'
    device     = 'Xeon E7 v4/Xeon E5 v4/Xeon E3 v4/Xeon D Memory Controller 1 - Channel 0 Thermal Control'
    class      = base peripheral
    cap 00[40] = unknown

none123@pci0:127:23:4:	class=0x088000 rev=0x01 hdr=0x00 vendor=0x8086 device=0x6fb8 subvendor=0x0000 subdevice=0x0000
    vendor     = 'Intel Corporation'
    device     = 'Xeon E7 v4/Xeon E5 v4/Xeon E3 v4/Xeon D DDRIO Channel 2/3 Interface'
    class      = base peripheral

none124@pci0:127:23:5:	class=0x088000 rev=0x01 hdr=0x00 vendor=0x8086 device=0x6fb9 subvendor=0x0000 subdevice=0x0000
    vendor     = 'Intel Corporation'
    device     = 'Xeon E7 v4/Xeon E5 v4/Xeon E3 v4/Xeon D DDRIO Channel 2/3 Interface'
    class      = base peripheral

none125@pci0:127:23:6:	class=0x088000 rev=0x01 hdr=0x00 vendor=0x8086 device=0x6fba subvendor=0x0000 subdevice=0x0000
    vendor     = 'Intel Corporation'
    device     = 'Xeon E7 v4/Xeon E5 v4/Xeon E3 v4/Xeon D DDRIO Channel 2/3 Interface'
    class      = base peripheral

none126@pci0:127:23:7:	class=0x088000 rev=0x01 hdr=0x00 vendor=0x8086 device=0x6fbb subvendor=0x0000 subdevice=0x0000
    vendor     = 'Intel Corporation'
    device     = 'Xeon E7 v4/Xeon E5 v4/Xeon E3 v4/Xeon D DDRIO Channel 2/3 Interface'
    class      = base peripheral

none127@pci0:127:30:0:	class=0x088000 rev=0x01 hdr=0x00 vendor=0x8086 device=0x6f98 subvendor=0x8086 subdevice=0x6f98
    vendor     = 'Intel Corporation'
    device     = 'Xeon E7 v4/Xeon E5 v4/Xeon E3 v4/Xeon D Power Control Unit'
    class      = base peripheral

none128@pci0:127:30:1:	class=0x088000 rev=0x01 hdr=0x00 vendor=0x8086 device=0x6f99 subvendor=0x8086 subdevice=0x6f99
    vendor     = 'Intel Corporation'
    device     = 'Xeon E7 v4/Xeon E5 v4/Xeon E3 v4/Xeon D Power Control Unit'
    class      = base peripheral

none129@pci0:127:30:2:	class=0x088000 rev=0x01 hdr=0x00 vendor=0x8086 device=0x6f9a subvendor=0x8086 subdevice=0x6f9a
    vendor     = 'Intel Corporation'
    device     = 'Xeon E7 v4/Xeon E5 v4/Xeon E3 v4/Xeon D Power Control Unit'
    class      = base peripheral

none130@pci0:127:30:3:	class=0x088000 rev=0x01 hdr=0x00 vendor=0x8086 device=0x6fc0 subvendor=0x8086 subdevice=0x6fc0
    vendor     = 'Intel Corporation'
    device     = 'Xeon E7 v4/Xeon E5 v4/Xeon E3 v4/Xeon D Power Control Unit'
    class      = base peripheral
    bar   [10] = type Prefetchable Memory, range 32, base 0x10, size 16, disabled

none131@pci0:127:30:4:	class=0x088000 rev=0x01 hdr=0x00 vendor=0x8086 device=0x6f9c subvendor=0x8086 subdevice=0x6f9c
    vendor     = 'Intel Corporation'
    device     = 'Xeon E7 v4/Xeon E5 v4/Xeon E3 v4/Xeon D Power Control Unit'
    class      = base peripheral

none132@pci0:127:31:0:	class=0x088000 rev=0x01 hdr=0x00 vendor=0x8086 device=0x6f88 subvendor=0x0000 subdevice=0x0000
    vendor     = 'Intel Corporation'
    device     = 'Xeon E7 v4/Xeon E5 v4/Xeon E3 v4/Xeon D Power Control Unit'
    class      = base peripheral

none133@pci0:127:31:2:	class=0x088000 rev=0x01 hdr=0x00 vendor=0x8086 device=0x6f8a subvendor=0x0000 subdevice=0x0000
    vendor     = 'Intel Corporation'
    device     = 'Xeon E7 v4/Xeon E5 v4/Xeon E3 v4/Xeon D Power Control Unit'
    class      = base peripheral

hostb0@pci0:0:0:0:	class=0x060000 rev=0x01 hdr=0x00 vendor=0x8086 device=0x6f00 subvendor=0x8086 subdevice=0x0000
    vendor     = 'Intel Corporation'
    device     = 'Xeon E7 v4/Xeon E5 v4/Xeon E3 v4/Xeon D DMI2'
    class      = bridge
    subclass   = HOST-PCI
    cap 10[90] = PCI-Express 2 root port max data 128(128)
                 max read 128
                 link x0(x4) speed 0.0(5.0) ASPM disabled(L1)
    cap 01[e0] = powerspec 3  supports D0 D3  current D0
    ecap 000b[100] = Vendor [1] ID 0002 Rev 0 Length 12
    ecap 000b[144] = Vendor [1] ID 0004 Rev 1 Length 60
    ecap 000b[1d0] = Vendor [1] ID 0003 Rev 1 Length 10
    ecap 000b[280] = Vendor [1] ID 0005 Rev 3 Length 24
    ecap 000b[300] = Vendor [1] ID 0008 Rev 0 Length 56

pcib3@pci0:0:1:0:	class=0x060400 rev=0x01 hdr=0x01 vendor=0x8086 device=0x6f02 subvendor=0x8086 subdevice=0x0000
    vendor     = 'Intel Corporation'
    device     = 'Xeon E7 v4/Xeon E5 v4/Xeon E3 v4/Xeon D PCI Express Root Port 1'
    class      = bridge
    subclass   = PCI-PCI
    cap 0d[40] = PCI Bridge subvendor=0x8086 subdevice=0x0000
    cap 05[60] = MSI supports 2 messages, vector masks 
    cap 10[90] = PCI-Express 2 root port max data 128(256) ARI disabled
                 max read 128
                 link x0(x4) speed 0.0(8.0)
    cap 01[e0] = powerspec 3  supports D0 D3  current D0
    ecap 000b[100] = Vendor [1] ID 0002 Rev 0 Length 12
    ecap 000d[110] = ACS 1
    ecap 0001[148] = AER 1 0 fatal 0 non-fatal 0 corrected
    ecap 000b[1d0] = Vendor [1] ID 0003 Rev 1 Length 10
    ecap 0019[250] = PCIe Sec 1 lane errors 0
    ecap 000b[280] = Vendor [1] ID 0005 Rev 3 Length 24
    ecap 000b[300] = Vendor [1] ID 0008 Rev 0 Length 56

pcib4@pci0:0:1:1:	class=0x060400 rev=0x01 hdr=0x01 vendor=0x8086 device=0x6f03 subvendor=0x8086 subdevice=0x0000
    vendor     = 'Intel Corporation'
    device     = 'Xeon E7 v4/Xeon E5 v4/Xeon E3 v4/Xeon D PCI Express Root Port 1'
    class      = bridge
    subclass   = PCI-PCI
    cap 0d[40] = PCI Bridge subvendor=0x8086 subdevice=0x0000
    cap 05[60] = MSI supports 2 messages, vector masks 
    cap 10[90] = PCI-Express 2 root port max data 128(256) ARI disabled
                 max read 128
                 link x0(x4) speed 0.0(8.0)
    cap 01[e0] = powerspec 3  supports D0 D3  current D0
    ecap 000b[100] = Vendor [1] ID 0002 Rev 0 Length 12
    ecap 000d[110] = ACS 1
    ecap 0001[148] = AER 1 0 fatal 0 non-fatal 0 corrected
    ecap 000b[1d0] = Vendor [1] ID 0003 Rev 1 Length 10
    ecap 0019[250] = PCIe Sec 1 lane errors 0
    ecap 000b[280] = Vendor [1] ID 0005 Rev 3 Length 24
    ecap 000b[300] = Vendor [1] ID 0008 Rev 0 Length 56

pcib5@pci0:0:2:0:	class=0x060400 rev=0x01 hdr=0x01 vendor=0x8086 device=0x6f04 subvendor=0x8086 subdevice=0x0000
    vendor     = 'Intel Corporation'
    device     = 'Xeon E7 v4/Xeon E5 v4/Xeon E3 v4/Xeon D PCI Express Root Port 2'
    class      = bridge
    subclass   = PCI-PCI
    cap 0d[40] = PCI Bridge subvendor=0x8086 subdevice=0x0000
    cap 05[60] = MSI supports 2 messages, vector masks 
    cap 10[90] = PCI-Express 2 root port max data 256(256) ARI disabled
                 max read 128
                 link x8(x8) speed 8.0(8.0)
    cap 01[e0] = powerspec 3  supports D0 D3  current D0
    ecap 000b[100] = Vendor [1] ID 0002 Rev 0 Length 12
    ecap 000d[110] = ACS 1
    ecap 0001[148] = AER 1 0 fatal 0 non-fatal 0 corrected
    ecap 000b[1d0] = Vendor [1] ID 0003 Rev 1 Length 10
    ecap 0019[250] = PCIe Sec 1 lane errors 0
    ecap 000b[280] = Vendor [1] ID 0005 Rev 3 Length 24
    ecap 000b[300] = Vendor [1] ID 0008 Rev 0 Length 56

pcib14@pci0:0:2:2:	class=0x060400 rev=0x01 hdr=0x01 vendor=0x8086 device=0x6f06 subvendor=0x8086 subdevice=0x0000
    vendor     = 'Intel Corporation'
    device     = 'Xeon E7 v4/Xeon E5 v4/Xeon E3 v4/Xeon D PCI Express Root Port 2'
    class      = bridge
    subclass   = PCI-PCI
    cap 0d[40] = PCI Bridge subvendor=0x8086 subdevice=0x0000
    cap 05[60] = MSI supports 2 messages, vector masks 
    cap 10[90] = PCI-Express 2 root port max data 256(256) ARI disabled
                 max read 128
                 link x0(x8) speed 0.0(8.0)
    cap 01[e0] = powerspec 3  supports D0 D3  current D0
    ecap 000b[100] = Vendor [1] ID 0002 Rev 0 Length 12
    ecap 000d[110] = ACS 1
    ecap 0001[148] = AER 1 0 fatal 0 non-fatal 0 corrected
    ecap 000b[1d0] = Vendor [1] ID 0003 Rev 1 Length 10
    ecap 0019[250] = PCIe Sec 1 lane errors 0
    ecap 000b[280] = Vendor [1] ID 0005 Rev 3 Length 24
    ecap 000b[300] = Vendor [1] ID 0008 Rev 0 Length 56

pcib15@pci0:0:3:0:	class=0x060400 rev=0x01 hdr=0x01 vendor=0x8086 device=0x6f08 subvendor=0x8086 subdevice=0x0000
    vendor     = 'Intel Corporation'
    device     = 'Xeon E7 v4/Xeon E5 v4/Xeon E3 v4/Xeon D PCI Express Root Port 3'
    class      = bridge
    subclass   = PCI-PCI
    cap 0d[40] = PCI Bridge subvendor=0x8086 subdevice=0x0000
    cap 05[60] = MSI supports 2 messages, vector masks 
    cap 10[90] = PCI-Express 2 root port max data 128(256) ARI disabled
                 max read 128
                 link x0(x8) speed 0.0(8.0)
    cap 01[e0] = powerspec 3  supports D0 D3  current D0
    ecap 000b[100] = Vendor [1] ID 0002 Rev 0 Length 12
    ecap 000d[110] = ACS 1
    ecap 0001[148] = AER 1 0 fatal 0 non-fatal 0 corrected
    ecap 000b[1d0] = Vendor [1] ID 0003 Rev 1 Length 10
    ecap 0019[250] = PCIe Sec 1 lane errors 0
    ecap 000b[280] = Vendor [1] ID 0005 Rev 3 Length 24
    ecap 000b[300] = Vendor [1] ID 0008 Rev 0 Length 56

pcib16@pci0:0:3:2:	class=0x060400 rev=0x01 hdr=0x01 vendor=0x8086 device=0x6f0a subvendor=0x8086 subdevice=0x0000
    vendor     = 'Intel Corporation'
    device     = 'Xeon E7 v4/Xeon E5 v4/Xeon E3 v4/Xeon D PCI Express Root Port 3'
    class      = bridge
    subclass   = PCI-PCI
    cap 0d[40] = PCI Bridge subvendor=0x8086 subdevice=0x0000
    cap 05[60] = MSI supports 2 messages, vector masks 
    cap 10[90] = PCI-Express 2 root port max data 256(256) ARI enabled
                 max read 128
                 link x8(x8) speed 8.0(8.0)
    cap 01[e0] = powerspec 3  supports D0 D3  current D0
    ecap 000b[100] = Vendor [1] ID 0002 Rev 0 Length 12
    ecap 000d[110] = ACS 1
    ecap 0001[148] = AER 1 0 fatal 0 non-fatal 0 corrected
    ecap 000b[1d0] = Vendor [1] ID 0003 Rev 1 Length 10
    ecap 0019[250] = PCIe Sec 1 lane errors 0
    ecap 000b[280] = Vendor [1] ID 0005 Rev 3 Length 24
    ecap 000b[300] = Vendor [1] ID 0008 Rev 0 Length 56

none134@pci0:0:5:0:	class=0x088000 rev=0x01 hdr=0x00 vendor=0x8086 device=0x6f28 subvendor=0x0000 subdevice=0x0000
    vendor     = 'Intel Corporation'
    device     = 'Xeon E7 v4/Xeon E5 v4/Xeon E3 v4/Xeon D Map/VTd_Misc/System Management'
    class      = base peripheral
    cap 10[40] = PCI-Express 2 root endpoint max data 128(128)
                 max read 128

none135@pci0:0:5:1:	class=0x088000 rev=0x01 hdr=0x00 vendor=0x8086 device=0x6f29 subvendor=0x0000 subdevice=0x0000
    vendor     = 'Intel Corporation'
    device     = 'Xeon E7 v4/Xeon E5 v4/Xeon E3 v4/Xeon D IIO Hot Plug'
    class      = base peripheral
    cap 10[40] = PCI-Express 1 root endpoint max data 128(128)
                 max read 128
    cap 05[80] = MSI supports 1 message, 64 bit 
    ecap 000b[100] = Vendor [1] ID 0006 Rev 1 Length 16
    ecap 000b[110] = Vendor [1] ID 0006 Rev 1 Length 16
    ecap 000b[120] = Vendor [1] ID 0006 Rev 1 Length 16
    ecap 000b[130] = Vendor [1] ID 0006 Rev 1 Length 16

none136@pci0:0:5:2:	class=0x088000 rev=0x01 hdr=0x00 vendor=0x8086 device=0x6f2a subvendor=0x0000 subdevice=0x0000
    vendor     = 'Intel Corporation'
    device     = 'Xeon E7 v4/Xeon E5 v4/Xeon E3 v4/Xeon D IIO RAS/Control Status/Global Errors'
    class      = base peripheral
    cap 10[40] = PCI-Express 2 root endpoint max data 128(128) RO NS
                 max read 128

ioapic0@pci0:0:5:4:	class=0x080020 rev=0x01 hdr=0x00 vendor=0x8086 device=0x6f2c subvendor=0x8086 subdevice=0x0000
    vendor     = 'Intel Corporation'
    device     = 'Xeon E7 v4/Xeon E5 v4/Xeon E3 v4/Xeon D I/O APIC'
    class      = base peripheral
    subclass   = interrupt controller
    bar   [10] = type Memory, range 32, base 0xc7314000, size 4096, enabled
    cap 10[44] = PCI-Express 1 root endpoint max data 128(128)
                 max read 128
    cap 01[e0] = powerspec 3  supports D0 D3  current D0

none137@pci0:0:17:0:	class=0xff0000 rev=0x05 hdr=0x00 vendor=0x8086 device=0x8d7c subvendor=0x8086 subdevice=0x7270
    vendor     = 'Intel Corporation'
    device     = 'C610/X99 series chipset SPSR'
    cap 10[40] = PCI-Express 2 root endpoint max data 128(128)
                 max read 128
                 link x1(x1) speed 2.5(2.5) ASPM disabled(L0s/L1)
    cap 01[80] = powerspec 3  supports D0 D3  current D0

none138@pci0:0:22:0:	class=0x078000 rev=0x05 hdr=0x00 vendor=0x8086 device=0x8d3a subvendor=0x8086 subdevice=0x7270
    vendor     = 'Intel Corporation'
    device     = 'C610/X99 series chipset MEI Controller'
    class      = simple comms
    bar   [10] = type Memory, range 64, base 0x3bffff13000, size 16, enabled
    cap 01[50] = powerspec 3  supports D0 D3  current D0
    cap 05[8c] = MSI supports 1 message, 64 bit 

none139@pci0:0:22:1:	class=0x078000 rev=0x05 hdr=0x00 vendor=0x8086 device=0x8d3b subvendor=0x8086 subdevice=0x7270
    vendor     = 'Intel Corporation'
    device     = 'C610/X99 series chipset MEI Controller'
    class      = simple comms
    bar   [10] = type Memory, range 64, base 0x3bffff12000, size 16, enabled
    cap 01[50] = powerspec 3  supports D0 D3  current D0
    cap 05[8c] = MSI supports 1 message, 64 bit 

ehci0@pci0:0:26:0:	class=0x0c0320 rev=0x05 hdr=0x00 vendor=0x8086 device=0x8d2d subvendor=0x8086 subdevice=0x7270
    vendor     = 'Intel Corporation'
    device     = 'C610/X99 series chipset USB Enhanced Host Controller'
    class      = serial bus
    subclass   = USB
    bar   [10] = type Memory, range 32, base 0xc7312000, size 1024, enabled
    cap 01[50] = powerspec 2  supports D0 D3  current D0
    cap 0a[58] = EHCI Debug Port at offset 0xa0 in map 0x14
    cap 13[98] = PCI Advanced Features: FLR TP

pcib17@pci0:0:28:0:	class=0x060400 rev=0xd5 hdr=0x01 vendor=0x8086 device=0x8d10 subvendor=0x8086 subdevice=0x7270
    vendor     = 'Intel Corporation'
    device     = 'C610/X99 series chipset PCI Express Root Port'
    class      = bridge
    subclass   = PCI-PCI
    cap 10[40] = PCI-Express 2 root port max data 128(128)
                 max read 128
                 link x0(x1) speed 0.0(5.0) ASPM disabled(L0s/L1)
    cap 05[80] = MSI supports 1 message 
    cap 0d[90] = PCI Bridge subvendor=0x8086 subdevice=0x7270
    cap 01[a0] = powerspec 3  supports D0 D3  current D0

pcib18@pci0:0:28:7:	class=0x060400 rev=0xd5 hdr=0x01 vendor=0x8086 device=0x8d1e subvendor=0x8086 subdevice=0x7270
    vendor     = 'Intel Corporation'
    device     = 'C610/X99 series chipset PCI Express Root Port'
    class      = bridge
    subclass   = PCI-PCI
    cap 10[40] = PCI-Express 2 root port max data 128(128)
                 max read 128
                 link x1(x1) speed 2.5(5.0)
                 slot 0 power limit 0 mW
    cap 05[80] = MSI supports 1 message enabled with 1 message
    cap 0d[90] = PCI Bridge subvendor=0x8086 subdevice=0x7270
    cap 01[a0] = powerspec 3  supports D0 D3  current D0

ehci1@pci0:0:29:0:	class=0x0c0320 rev=0x05 hdr=0x00 vendor=0x8086 device=0x8d26 subvendor=0x8086 subdevice=0x7270
    vendor     = 'Intel Corporation'
    device     = 'C610/X99 series chipset USB Enhanced Host Controller'
    class      = serial bus
    subclass   = USB
    bar   [10] = type Memory, range 32, base 0xc7311000, size 1024, enabled
    cap 01[50] = powerspec 2  supports D0 D3  current D0
    cap 0a[58] = EHCI Debug Port at offset 0xa0 in map 0x14
    cap 13[98] = PCI Advanced Features: FLR TP

isab0@pci0:0:31:0:	class=0x060100 rev=0x05 hdr=0x00 vendor=0x8086 device=0x8d44 subvendor=0x8086 subdevice=0x7270
    vendor     = 'Intel Corporation'
    device     = 'C610/X99 series chipset LPC Controller'
    class      = bridge
    subclass   = PCI-ISA
    cap 09[e0] = vendor (length 12) Intel cap 1 version 0
		 features: AMT, 4 PCI-e x1 slots

ahci0@pci0:0:31:2:	class=0x010601 rev=0x05 hdr=0x00 vendor=0x8086 device=0x8d02 subvendor=0x1137 subdevice=0x0067
    vendor     = 'Intel Corporation'
    device     = 'C610/X99 series chipset 6-Port SATA Controller [AHCI mode]'
    class      = mass storage
    subclass   = SATA
    bar   [10] = type I/O Port, range 32, base 0x7050, size 8, enabled
    bar   [14] = type I/O Port, range 32, base 0x7040, size 4, enabled
    bar   [18] = type I/O Port, range 32, base 0x7030, size 8, enabled
    bar   [1c] = type I/O Port, range 32, base 0x7020, size 4, enabled
    bar   [20] = type I/O Port, range 32, base 0x7000, size 32, enabled
    bar   [24] = type Memory, range 32, base 0xc7310000, size 2048, enabled
    cap 05[80] = MSI supports 1 message enabled with 1 message
    cap 01[70] = powerspec 3  supports D0 D3  current D0
    cap 12[a8] = SATA Index-Data Pair

pcib6@pci0:3:0:0:	class=0x060400 rev=0x01 hdr=0x01 vendor=0x1137 device=0x007a subvendor=0x1137 subdevice=0x0157
    vendor     = 'Cisco Systems Inc'
    device     = 'VIC 1300 PCIe Upstream Port'
    class      = bridge
    subclass   = PCI-PCI
    cap 01[40] = powerspec 3  supports D0 D3  current D0
    cap 05[50] = MSI supports 1 message, 64 bit 
    cap 10[70] = PCI-Express 2 upstream port max data 256(256) NS
                 max read 512
                 link x8(x8) speed 8.0(8.0)
    cap 0d[f0] = PCI Bridge subvendor=0x1137 subdevice=0x0157
    ecap 0001[100] = AER 2 0 fatal 0 non-fatal 0 corrected
    ecap 0019[148] = PCIe Sec 1 lane errors 0
    ecap 0018[168] = LTR 1

pcib7@pci0:4:0:0:	class=0x060400 rev=0xa2 hdr=0x01 vendor=0x1137 device=0x0041 subvendor=0x1137 subdevice=0x0157
    vendor     = 'Cisco Systems Inc'
    device     = 'VIC PCIe Downstream Port'
    class      = bridge
    subclass   = PCI-PCI
    bar   [10] = type Memory, range 64, base 0xc6e00000, size 16384, enabled
    cap 01[40] = powerspec 2  supports D0 D3  current D0
    cap 10[60] = PCI-Express 2 downstream port max data 256(256) NS ARI enabled
                 max read 128
                 link x16(x16) speed 8.0(8.0) ASPM disabled(L0s/L1)
    cap 0d[a0] = PCI Bridge subvendor=0x1137 subdevice=0x0157
    ecap 000d[100] = ACS 1

pcib8@pci0:4:1:0:	class=0x060400 rev=0xa2 hdr=0x01 vendor=0x1137 device=0x0041 subvendor=0x1137 subdevice=0x0157
    vendor     = 'Cisco Systems Inc'
    device     = 'VIC PCIe Downstream Port'
    class      = bridge
    subclass   = PCI-PCI
    cap 01[40] = powerspec 2  supports D0 D3  current D0
    cap 10[60] = PCI-Express 2 downstream port max data 256(256) NS ARI enabled
                 max read 128
                 link x16(x16) speed 8.0(8.0) ASPM disabled(L0s/L1)
    cap 0d[a0] = PCI Bridge subvendor=0x1137 subdevice=0x0157
    ecap 000d[100] = ACS 1

none140@pci0:5:0:0:	class=0x00ff00 rev=0xa2 hdr=0x00 vendor=0x1137 device=0x0042 subvendor=0x1137 subdevice=0x0157
    vendor     = 'Cisco Systems Inc'
    device     = 'VIC Management Controller'
    class      = old
    bar   [10] = type Memory, range 64, base 0xc6d02000, size 4096, enabled
    bar   [18] = type Memory, range 64, base 0xc6d00000, size 8192, enabled
    cap 05[40] = MSI supports 4 messages, 64 bit 
    cap 11[60] = MSI-X supports 4 messages
                 Table in map 0x18[0x0], PBA in map 0x18[0x1000]
    cap 01[80] = powerspec 2  supports D0 D3  current D0
    cap 10[a0] = PCI-Express 2 endpoint max data 256(256) FLR NS
                 max read 512
                 link x16(x16) speed 8.0(8.0) ASPM disabled(L0s/L1)
    ecap 0001[100] = AER 1 0 fatal 0 non-fatal 0 corrected

pcib9@pci0:6:0:0:	class=0x060400 rev=0xa2 hdr=0x01 vendor=0x1137 device=0x0040 subvendor=0x1137 subdevice=0x0157
    vendor     = 'Cisco Systems Inc'
    device     = 'VIC PCIe Upstream Port'
    class      = bridge
    subclass   = PCI-PCI
    cap 01[40] = powerspec 2  supports D0 D3  current D0
    cap 10[60] = PCI-Express 2 upstream port max data 256(256) NS
                 max read 512
                 link x16(x16) speed 8.0(8.0) ASPM disabled(L0s/L1)
    cap 0d[a0] = PCI Bridge subvendor=0x1137 subdevice=0x0157

pcib10@pci0:7:0:0:	class=0x060400 rev=0xa2 hdr=0x01 vendor=0x1137 device=0x0041 subvendor=0x1137 subdevice=0x0157
    vendor     = 'Cisco Systems Inc'
    device     = 'VIC PCIe Downstream Port'
    class      = bridge
    subclass   = PCI-PCI
    cap 01[40] = powerspec 2  supports D0 D3  current D0
    cap 10[60] = PCI-Express 2 downstream port max data 256(256) NS ARI enabled
                 max read 128
                 link x16(x16) speed 8.0(8.0) ASPM disabled(L0s/L1)
    cap 0d[a0] = PCI Bridge subvendor=0x1137 subdevice=0x0157
    ecap 000d[100] = ACS 1

pcib11@pci0:7:1:0:	class=0x060400 rev=0xa2 hdr=0x01 vendor=0x1137 device=0x0041 subvendor=0x1137 subdevice=0x0157
    vendor     = 'Cisco Systems Inc'
    device     = 'VIC PCIe Downstream Port'
    class      = bridge
    subclass   = PCI-PCI
    cap 01[40] = powerspec 2  supports D0 D3  current D0
    cap 10[60] = PCI-Express 2 downstream port max data 256(256) NS ARI enabled
                 max read 128
                 link x16(x16) speed 8.0(8.0) ASPM disabled(L0s/L1)
    cap 0d[a0] = PCI Bridge subvendor=0x1137 subdevice=0x0157
    ecap 000d[100] = ACS 1

pcib12@pci0:7:2:0:	class=0x060400 rev=0xa2 hdr=0x01 vendor=0x1137 device=0x0041 subvendor=0x1137 subdevice=0x0157
    vendor     = 'Cisco Systems Inc'
    device     = 'VIC PCIe Downstream Port'
    class      = bridge
    subclass   = PCI-PCI
    cap 01[40] = powerspec 2  supports D0 D3  current D0
    cap 10[60] = PCI-Express 2 downstream port max data 256(256) NS ARI enabled
                 max read 128
                 link x16(x16) speed 8.0(8.0) ASPM disabled(L0s/L1)
    cap 0d[a0] = PCI Bridge subvendor=0x1137 subdevice=0x0157
    ecap 000d[100] = ACS 1

pcib13@pci0:7:3:0:	class=0x060400 rev=0xa2 hdr=0x01 vendor=0x1137 device=0x0041 subvendor=0x1137 subdevice=0x0157
    vendor     = 'Cisco Systems Inc'
    device     = 'VIC PCIe Downstream Port'
    class      = bridge
    subclass   = PCI-PCI
    cap 01[40] = powerspec 2  supports D0 D3  current D0
    cap 10[60] = PCI-Express 2 downstream port max data 256(256) NS ARI enabled
                 max read 128
                 link x16(x16) speed 8.0(8.0) ASPM disabled(L0s/L1)
    cap 0d[a0] = PCI Bridge subvendor=0x1137 subdevice=0x0157
    ecap 000d[100] = ACS 1

none141@pci0:8:0:0:	class=0x020000 rev=0xa2 hdr=0x00 vendor=0x1137 device=0x0043 subvendor=0x1137 subdevice=0x0157
    vendor     = 'Cisco Systems Inc'
    device     = 'VIC Ethernet NIC'
    class      = network
    subclass   = ethernet
    bar   [10] = type Memory, range 64, base 0xc6c00000, size 32768, enabled
    bar   [18] = type Memory, range 64, base 0xc6c08000, size 8192, enabled
    cap 05[40] = MSI supports 8 messages, 64 bit 
    cap 11[60] = MSI-X supports 8 messages
                 Table in map 0x18[0x0], PBA in map 0x18[0x1000]
    cap 01[80] = powerspec 2  supports D0 D3  current D0
    cap 10[a0] = PCI-Express 2 endpoint max data 256(256) FLR NS
                 max read 512
                 link x16(x16) speed 8.0(8.0) ASPM disabled(L0s/L1)
    ecap 0003[100] = Serial 1 3890a5ffff7ff724
    ecap 0001[120] = AER 1 0 fatal 0 non-fatal 0 corrected

none142@pci0:9:0:0:	class=0x020000 rev=0xa2 hdr=0x00 vendor=0x1137 device=0x0043 subvendor=0x1137 subdevice=0x0157
    vendor     = 'Cisco Systems Inc'
    device     = 'VIC Ethernet NIC'
    class      = network
    subclass   = ethernet
    bar   [10] = type Memory, range 64, base 0xc6b00000, size 32768, enabled
    bar   [18] = type Memory, range 64, base 0xc6b08000, size 8192, enabled
    cap 05[40] = MSI supports 8 messages, 64 bit 
    cap 11[60] = MSI-X supports 8 messages
                 Table in map 0x18[0x0], PBA in map 0x18[0x1000]
    cap 01[80] = powerspec 2  supports D0 D3  current D0
    cap 10[a0] = PCI-Express 2 endpoint max data 256(256) FLR NS
                 max read 512
                 link x16(x16) speed 8.0(8.0) ASPM disabled(L0s/L1)
    ecap 0003[100] = Serial 1 3890a5ffff7ff725
    ecap 0001[120] = AER 1 0 fatal 0 non-fatal 0 corrected

none143@pci0:10:0:0:	class=0x0c0400 rev=0xa2 hdr=0x00 vendor=0x1137 device=0x0045 subvendor=0x1137 subdevice=0x0157
    vendor     = 'Cisco Systems Inc'
    device     = 'VIC FCoE HBA'
    class      = serial bus
    subclass   = Fibre Channel
    bar   [10] = type Memory, range 64, base 0xc6a00000, size 32768, enabled
    bar   [18] = type Memory, range 64, base 0xc6a08000, size 8192, enabled
    cap 05[40] = MSI supports 4 messages, 64 bit 
    cap 11[60] = MSI-X supports 4 messages
                 Table in map 0x18[0x0], PBA in map 0x18[0x1000]
    cap 01[80] = powerspec 2  supports D0 D3  current D0
    cap 10[a0] = PCI-Express 2 endpoint max data 256(256) FLR NS
                 max read 512
                 link x16(x16) speed 8.0(8.0) ASPM disabled(L0s/L1)
    ecap 0003[100] = Serial 1 3890a5ffff7ff726
    ecap 0001[120] = AER 1 0 fatal 0 non-fatal 0 corrected

none144@pci0:11:0:0:	class=0x0c0400 rev=0xa2 hdr=0x00 vendor=0x1137 device=0x0045 subvendor=0x1137 subdevice=0x0157
    vendor     = 'Cisco Systems Inc'
    device     = 'VIC FCoE HBA'
    class      = serial bus
    subclass   = Fibre Channel
    bar   [10] = type Memory, range 64, base 0xc6900000, size 32768, enabled
    bar   [18] = type Memory, range 64, base 0xc6908000, size 8192, enabled
    cap 05[40] = MSI supports 4 messages, 64 bit 
    cap 11[60] = MSI-X supports 4 messages
                 Table in map 0x18[0x0], PBA in map 0x18[0x1000]
    cap 01[80] = powerspec 2  supports D0 D3  current D0
    cap 10[a0] = PCI-Express 2 endpoint max data 256(256) FLR NS
                 max read 512
                 link x16(x16) speed 8.0(8.0) ASPM disabled(L0s/L1)
    ecap 0003[100] = Serial 1 3890a5ffff7ff727
    ecap 0001[120] = AER 1 0 fatal 0 non-fatal 0 corrected

mrsas0@pci0:19:0:0:	class=0x010400 rev=0x01 hdr=0x00 vendor=0x1000 device=0x00ce subvendor=0x1137 subdevice=0x0197
    vendor     = 'Broadcom / LSI'
    device     = 'MegaRAID SAS-3 3316 [Intruder]'
    class      = mass storage
    subclass   = RAID
    bar   [10] = type I/O Port, range 32, base 0x6000, size 256, enabled
    bar   [14] = type Memory, range 64, base 0xc7040000, size 65536, enabled
    bar   [1c] = type Memory, range 64, base 0xc7000000, size 262144, enabled
    cap 01[50] = powerspec 3  supports D0 D1 D2 D3  current D0
    cap 10[68] = PCI-Express 2 endpoint max data 256(4096) NS
                 max read 512
                 link x8(x8) speed 8.0(8.0) ASPM disabled(L0s)
    cap 05[a8] = MSI supports 1 message, 64 bit, vector masks 
    cap 11[c0] = MSI-X supports 16 messages, enabled
                 Table in map 0x14[0xe000], PBA in map 0x14[0xf000]
    ecap 0001[100] = AER 2 0 fatal 0 non-fatal 0 corrected
    ecap 0019[1e0] = PCIe Sec 1 lane errors 0
    ecap 0004[1c0] = Power Budgeting 1
    ecap 000e[148] = ARI 1

vgapci0@pci0:21:0:0:	class=0x030000 rev=0x02 hdr=0x00 vendor=0x102b device=0x0522 subvendor=0x1137 subdevice=0x0101
    vendor     = 'Matrox Electronics Systems Ltd.'
    device     = 'MGA G200e [Pilot] ServerEngines (SEP1)'
    class      = display
    subclass   = VGA
    bar   [10] = type Memory, range 32, base 0xc5000000, size 16777216, enabled
    bar   [14] = type Memory, range 32, base 0xc6810000, size 16384, enabled
    bar   [18] = type Memory, range 32, base 0xc6000000, size 8388608, enabled
    cap 01[dc] = powerspec 2  supports D0 D3  current D0
    cap 10[e4] = PCI-Express 1 legacy endpoint max data 128(256)
                 max read 128
                 link x1(x1) speed 2.5(2.5) ASPM disabled(L0s)
    cap 05[54] = MSI supports 1 message 

pcib20@pci0:128:2:0:	class=0x060400 rev=0x01 hdr=0x01 vendor=0x8086 device=0x6f04 subvendor=0x8086 subdevice=0x0000
    vendor     = 'Intel Corporation'
    device     = 'Xeon E7 v4/Xeon E5 v4/Xeon E3 v4/Xeon D PCI Express Root Port 2'
    class      = bridge
    subclass   = PCI-PCI
    cap 0d[40] = PCI Bridge subvendor=0x8086 subdevice=0x0000
    cap 05[60] = MSI supports 2 messages, vector masks 
    cap 10[90] = PCI-Express 2 root port max data 128(256) ARI disabled
                 max read 128
                 link x0(x8) speed 0.0(8.0)
    cap 01[e0] = powerspec 3  supports D0 D3  current D0
    ecap 000b[100] = Vendor [1] ID 0002 Rev 0 Length 12
    ecap 000d[110] = ACS 1
    ecap 0001[148] = AER 1 0 fatal 0 non-fatal 0 corrected
    ecap 000b[1d0] = Vendor [1] ID 0003 Rev 1 Length 10
    ecap 0019[250] = PCIe Sec 1 lane errors 0
    ecap 000b[280] = Vendor [1] ID 0005 Rev 3 Length 24
    ecap 000b[300] = Vendor [1] ID 0008 Rev 0 Length 56

pcib21@pci0:128:2:2:	class=0x060400 rev=0x01 hdr=0x01 vendor=0x8086 device=0x6f06 subvendor=0x8086 subdevice=0x0000
    vendor     = 'Intel Corporation'
    device     = 'Xeon E7 v4/Xeon E5 v4/Xeon E3 v4/Xeon D PCI Express Root Port 2'
    class      = bridge
    subclass   = PCI-PCI
    cap 0d[40] = PCI Bridge subvendor=0x8086 subdevice=0x0000
    cap 05[60] = MSI supports 2 messages, vector masks 
    cap 10[90] = PCI-Express 2 root port max data 128(256) ARI disabled
                 max read 128
                 link x0(x8) speed 0.0(8.0)
    cap 01[e0] = powerspec 3  supports D0 D3  current D0
    ecap 000b[100] = Vendor [1] ID 0002 Rev 0 Length 12
    ecap 000d[110] = ACS 1
    ecap 0001[148] = AER 1 0 fatal 0 non-fatal 0 corrected
    ecap 000b[1d0] = Vendor [1] ID 0003 Rev 1 Length 10
    ecap 0019[250] = PCIe Sec 1 lane errors 0
    ecap 000b[280] = Vendor [1] ID 0005 Rev 3 Length 24
    ecap 000b[300] = Vendor [1] ID 0008 Rev 0 Length 56

none145@pci0:128:5:0:	class=0x088000 rev=0x01 hdr=0x00 vendor=0x8086 device=0x6f28 subvendor=0x0000 subdevice=0x0000
    vendor     = 'Intel Corporation'
    device     = 'Xeon E7 v4/Xeon E5 v4/Xeon E3 v4/Xeon D Map/VTd_Misc/System Management'
    class      = base peripheral
    cap 10[40] = PCI-Express 2 root endpoint max data 128(128)
                 max read 128

none146@pci0:128:5:1:	class=0x088000 rev=0x01 hdr=0x00 vendor=0x8086 device=0x6f29 subvendor=0x0000 subdevice=0x0000
    vendor     = 'Intel Corporation'
    device     = 'Xeon E7 v4/Xeon E5 v4/Xeon E3 v4/Xeon D IIO Hot Plug'
    class      = base peripheral
    cap 10[40] = PCI-Express 1 root endpoint max data 128(128)
                 max read 128
    cap 05[80] = MSI supports 1 message, 64 bit 
    ecap 000b[100] = Vendor [1] ID 0006 Rev 1 Length 16
    ecap 000b[110] = Vendor [1] ID 0006 Rev 1 Length 16
    ecap 000b[120] = Vendor [1] ID 0006 Rev 1 Length 16
    ecap 000b[130] = Vendor [1] ID 0006 Rev 1 Length 16

none147@pci0:128:5:2:	class=0x088000 rev=0x01 hdr=0x00 vendor=0x8086 device=0x6f2a subvendor=0x0000 subdevice=0x0000
    vendor     = 'Intel Corporation'
    device     = 'Xeon E7 v4/Xeon E5 v4/Xeon E3 v4/Xeon D IIO RAS/Control Status/Global Errors'
    class      = base peripheral
    cap 10[40] = PCI-Express 2 root endpoint max data 128(128) RO NS
                 max read 128

ioapic1@pci0:128:5:4:	class=0x080020 rev=0x01 hdr=0x00 vendor=0x8086 device=0x6f2c subvendor=0x8086 subdevice=0x0000
    vendor     = 'Intel Corporation'
    device     = 'Xeon E7 v4/Xeon E5 v4/Xeon E3 v4/Xeon D I/O APIC'
    class      = base peripheral
    subclass   = interrupt controller
    bar   [10] = type Memory, range 32, base 0xfbf00000, size 4096, enabled
    cap 10[44] = PCI-Express 1 root endpoint max data 128(128)
                 max read 128
    cap 01[e0] = powerspec 3  supports D0 D3  current D0
