hostb0@pci0:0:0:0:	class=0x060000 card=0x04f81028 chip=0x0e008086 rev=0x04 hdr=0x00
    vendor     = 'Intel Corporation'
    device     = 'Xeon E7 v2/Xeon E5 v2/Core i7 DMI2'
    class      = bridge
    subclass   = HOST-PCI
    cap 10[90] = PCI-Express 2 root port max data 128(128)
                 link x0(x4) speed 0.0(2.5) ASPM disabled(L1)
    cap 01[e0] = powerspec 3  supports D0 D3  current D0
    ecap 000b[100] = Vendor 1 ID 2
    ecap 000b[144] = Vendor 1 ID 4
    ecap 000b[1d0] = Vendor 1 ID 3
    ecap 000b[280] = Vendor 1 ID 5

pcib1@pci0:0:1:0:	class=0x060400 card=0x04f81028 chip=0x0e028086 rev=0x04 hdr=0x01
    vendor     = 'Intel Corporation'
    device     = 'Xeon E7 v2/Xeon E5 v2/Core i7 PCI Express Root Port 1a'
    class      = bridge
    subclass   = PCI-PCI
    cap 0d[40] = PCI Bridge card=0x04f81028
    cap 05[60] = MSI supports 2 messages, vector masks 
    cap 10[90] = PCI-Express 2 root port max data 256(256) ARI enabled
                 link x8(x8) speed 8.0(8.0) ASPM disabled(L1)
    cap 01[e0] = powerspec 3  supports D0 D3  current D0
    ecap 000b[100] = Vendor 1 ID 2
    ecap 000d[110] = ACS 1
    ecap 0001[148] = AER 1 0 fatal 0 non-fatal 0 corrected
    ecap 000b[1d0] = Vendor 1 ID 3
    ecap 0019[250] = PCIe Sec 1 lane errors 0
    ecap 000b[280] = Vendor 1 ID 5

pcib2@pci0:0:3:0:	class=0x060400 card=0x04f81028 chip=0x0e088086 rev=0x04 hdr=0x01
    vendor     = 'Intel Corporation'
    device     = 'Xeon E7 v2/Xeon E5 v2/Core i7 PCI Express Root Port 3a'
    class      = bridge
    subclass   = PCI-PCI
    cap 0d[40] = PCI Bridge card=0x04f81028
    cap 05[60] = MSI supports 2 messages, vector masks 
    cap 10[90] = PCI-Express 2 root port max data 256(256) ARI disabled
                 link x4(x16) speed 2.5(8.0) ASPM disabled(L1)
                 slot 2 power limit 25000 mW
    cap 01[e0] = powerspec 3  supports D0 D3  current D0
    ecap 000b[100] = Vendor 1 ID 2
    ecap 000d[110] = ACS 1
    ecap 0001[148] = AER 1 0 fatal 0 non-fatal 0 corrected
    ecap 000b[1d0] = Vendor 1 ID 3
    ecap 0019[250] = PCIe Sec 1 lane errors 0xf000
    ecap 000b[280] = Vendor 1 ID 5

none0@pci0:0:5:0:	class=0x088000 card=0x04f81028 chip=0x0e288086 rev=0x04 hdr=0x00
    vendor     = 'Intel Corporation'
    device     = 'Xeon E7 v2/Xeon E5 v2/Core i7 VTd/Memory Map/Misc'
    class      = base peripheral
    cap 10[40] = PCI-Express 2 root endpoint max data 128(128)

none1@pci0:0:5:2:	class=0x088000 card=0x04f81028 chip=0x0e2a8086 rev=0x04 hdr=0x00
    vendor     = 'Intel Corporation'
    device     = 'Xeon E7 v2/Xeon E5 v2/Core i7 IIO RAS'
    class      = base peripheral
    cap 10[40] = PCI-Express 2 root endpoint max data 128(128)

pcib6@pci0:0:17:0:	class=0x060400 card=0x04f81028 chip=0x1d3e8086 rev=0x05 hdr=0x01
    vendor     = 'Intel Corporation'
    device     = 'C600/X79 series chipset PCI Express Virtual Root Port'
    class      = bridge
    subclass   = PCI-PCI
    cap 10[40] = PCI-Express 2 root port max data 128(128) ARI disabled
                 link x1(x1) speed 2.5(2.5) ASPM disabled(L0s/L1)
    cap 01[80] = powerspec 3  supports D0 D3  current D0
    cap 0d[88] = PCI Bridge card=0x04f81028
    cap 05[90] = MSI supports 1 message 
    ecap 0001[100] = AER 1 0 fatal 0 non-fatal 0 corrected
    ecap 000d[138] = ACS 1

none2@pci0:0:22:0:	class=0x078000 card=0x04f81028 chip=0x1d3a8086 rev=0x05 hdr=0x00
    vendor     = 'Intel Corporation'
    device     = 'C600/X79 series chipset MEI Controller'
    class      = simple comms
    bar   [10] = type Memory, range 64, base 0xdd8fc000, size 16, enabled
    cap 01[50] = powerspec 3  supports D0 D3  current D0
    cap 05[8c] = MSI supports 1 message, 64 bit 

none3@pci0:0:22:1:	class=0x078000 card=0x04f81028 chip=0x1d3b8086 rev=0x05 hdr=0x00
    vendor     = 'Intel Corporation'
    device     = 'C600/X79 series chipset MEI Controller'
    class      = simple comms
    bar   [10] = type Memory, range 64, base 0xdd8fd000, size 16, enabled
    cap 01[50] = powerspec 3  supports D0 D3  current D0
    cap 05[8c] = MSI supports 1 message, 64 bit 

ehci0@pci0:0:26:0:	class=0x0c0320 card=0x04f81028 chip=0x1d2d8086 rev=0x05 hdr=0x00
    vendor     = 'Intel Corporation'
    device     = 'C600/X79 series chipset USB2 Enhanced Host Controller'
    class      = serial bus
    subclass   = USB
    bar   [10] = type Memory, range 32, base 0xdd8fe000, size 1024, enabled
    cap 01[50] = powerspec 2  supports D0 D3  current D0
    cap 0a[58] = EHCI Debug Port at offset 0xa0 in map 0x14
    cap 13[98] = PCI Advanced Features: FLR TP

pcib7@pci0:0:28:0:	class=0x060400 card=0x04f81028 chip=0x1d108086 rev=0xb5 hdr=0x01
    vendor     = 'Intel Corporation'
    device     = 'C600/X79 series chipset PCI Express Root Port 1'
    class      = bridge
    subclass   = PCI-PCI
    cap 10[40] = PCI-Express 2 root port max data 128(128)
                 link x4(x4) speed 5.0(5.0) ASPM disabled(L0s/L1)
                 slot 1 power limit 25000 mW
    cap 05[80] = MSI supports 1 message 
    cap 0d[90] = PCI Bridge card=0x04f81028
    cap 01[a0] = powerspec 2  supports D0 D3  current D0
    ecap 0001[100] = AER 1 0 fatal 0 non-fatal 0 corrected

pcib8@pci0:0:28:4:	class=0x060400 card=0x04f81028 chip=0x1d188086 rev=0xb5 hdr=0x01
    vendor     = 'Intel Corporation'
    device     = 'C600/X79 series chipset PCI Express Root Port 5'
    class      = bridge
    subclass   = PCI-PCI
    cap 10[40] = PCI-Express 2 root port max data 128(128)
                 link x1(x2) speed 5.0(5.0) ASPM disabled(L0s/L1)
    cap 05[80] = MSI supports 1 message 
    cap 0d[90] = PCI Bridge card=0x04f81028
    cap 01[a0] = powerspec 2  supports D0 D3  current D0
    ecap 0001[100] = AER 1 0 fatal 0 non-fatal 0 corrected

pcib9@pci0:0:28:7:	class=0x060400 card=0x04f81028 chip=0x1d1e8086 rev=0xb5 hdr=0x01
    vendor     = 'Intel Corporation'
    device     = 'C600/X79 series chipset PCI Express Root Port 8'
    class      = bridge
    subclass   = PCI-PCI
    cap 10[40] = PCI-Express 2 root port max data 128(128)
                 link x1(x1) speed 2.5(5.0) ASPM disabled(L0s/L1)
    cap 05[80] = MSI supports 1 message 
    cap 0d[90] = PCI Bridge card=0x04f81028
    cap 01[a0] = powerspec 2  supports D0 D3  current D0
    ecap 0001[100] = AER 1 0 fatal 0 non-fatal 0 corrected

ehci1@pci0:0:29:0:	class=0x0c0320 card=0x04f81028 chip=0x1d268086 rev=0x05 hdr=0x00
    vendor     = 'Intel Corporation'
    device     = 'C600/X79 series chipset USB2 Enhanced Host Controller'
    class      = serial bus
    subclass   = USB
    bar   [10] = type Memory, range 32, base 0xdd8ff000, size 1024, enabled
    cap 01[50] = powerspec 2  supports D0 D3  current D0
    cap 0a[58] = EHCI Debug Port at offset 0xa0 in map 0x14
    cap 13[98] = PCI Advanced Features: FLR TP

pcib14@pci0:0:30:0:	class=0x060401 card=0x04f81028 chip=0x244e8086 rev=0xa5 hdr=0x01
    vendor     = 'Intel Corporation'
    device     = '82801 PCI Bridge'
    class      = bridge
    subclass   = PCI-PCI
    cap 0d[50] = PCI Bridge card=0x04f81028

isab0@pci0:0:31:0:	class=0x060100 card=0x04f81028 chip=0x1d418086 rev=0x05 hdr=0x00
    vendor     = 'Intel Corporation'
    device     = 'C600/X79 series chipset LPC Controller'
    class      = bridge
    subclass   = PCI-ISA
    cap 09[e0] = vendor (length 12) Intel cap 1 version 0
		 features: AMT, 4 PCI-e x1 slots

mps0@pci0:1:0:0:	class=0x010700 card=0x1f381028 chip=0x00871000 rev=0x05 hdr=0x00
    vendor     = 'LSI Logic / Symbios Logic'
    device     = 'SAS2308 PCI-Express Fusion-MPT SAS-2'
    class      = mass storage
    subclass   = SAS
    bar   [10] = type I/O Port, range 32, base 0xfc00, size 256, enabled
    bar   [14] = type Memory, range 64, base 0xd8ff0000, size 65536, enabled
    bar   [1c] = type Memory, range 64, base 0xd8f80000, size 262144, enabled
    cap 01[50] = powerspec 3  supports D0 D1 D2 D3  current D0
    cap 10[68] = PCI-Express 2 endpoint max data 256(4096) FLR RO NS
                 link x8(x8) speed 8.0(8.0) ASPM disabled(L0s)
    cap 03[d0] = VPD
    cap 05[a8] = MSI supports 1 message, 64 bit 
    cap 11[c0] = MSI-X supports 16 messages, enabled
                 Table in map 0x14[0xe000], PBA in map 0x14[0xf000]
    ecap 0001[100] = AER 2 0 fatal 0 non-fatal 0 corrected
    ecap 0019[1e0] = PCIe Sec 1 lane errors 0
    ecap 0004[1c0] = Power Budgeting 1
    ecap 0016[190] = DPA 1
    ecap 000e[148] = ARI 1

pcib3@pci0:8:0:0:	class=0x060400 card=0x00000000 chip=0x8018111d rev=0x0e hdr=0x01
    vendor     = 'Microsemi / PMC / IDT'
    device     = 'PES12N3A 12-lane 3-Port PCI Express Switch'
    class      = bridge
    subclass   = PCI-PCI
    cap 10[40] = PCI-Express 1 upstream port max data 256(2048)
                 link x4(x4) speed 2.5(2.5) ASPM disabled(L0s/L1)
    cap 01[c0] = powerspec 3  supports D0 D3  current D0
    ecap 0001[100] = AER 1 0 fatal 0 non-fatal 1 corrected
    ecap 0002[200] = VC 1 max VC0

pcib4@pci0:9:2:0:	class=0x060400 card=0x00000000 chip=0x8018111d rev=0x0e hdr=0x01
    vendor     = 'Microsemi / PMC / IDT'
    device     = 'PES12N3A 12-lane 3-Port PCI Express Switch'
    class      = bridge
    subclass   = PCI-PCI
    cap 10[40] = PCI-Express 1 downstream port max data 256(2048)
                 link x4(x4) speed 2.5(2.5) ASPM disabled(L0s/L1)
    cap 01[c0] = powerspec 3  supports D0 D3  current D0
    cap 05[d0] = MSI supports 1 message, 64 bit 
    ecap 0001[100] = AER 1 0 fatal 0 non-fatal 1 corrected
    ecap 0002[200] = VC 1 max VC0

pcib5@pci0:9:4:0:	class=0x060400 card=0x00000000 chip=0x8018111d rev=0x0e hdr=0x01
    vendor     = 'Microsemi / PMC / IDT'
    device     = 'PES12N3A 12-lane 3-Port PCI Express Switch'
    class      = bridge
    subclass   = PCI-PCI
    cap 10[40] = PCI-Express 1 downstream port max data 256(2048)
                 link x4(x4) speed 2.5(2.5) ASPM disabled(L0s/L1)
    cap 01[c0] = powerspec 3  supports D0 D3  current D0
    cap 05[d0] = MSI supports 1 message, 64 bit 
    ecap 0001[100] = AER 1 0 fatal 0 non-fatal 1 corrected
    ecap 0002[200] = VC 1 max VC0

igb0@pci0:10:0:0:	class=0x020000 card=0xa02c8086 chip=0x10e88086 rev=0x01 hdr=0x00
    vendor     = 'Intel Corporation'
    device     = '82576 Gigabit Network Connection'
    class      = network
    subclass   = ethernet
    bar   [10] = type Memory, range 32, base 0xdcba0000, size 131072, enabled
    bar   [14] = type Memory, range 32, base 0xdc000000, size 4194304, enabled
    bar   [18] = type I/O Port, range 32, base 0xecc0, size 32, enabled
    bar   [1c] = type Memory, range 32, base 0xdcbf8000, size 16384, enabled
    cap 01[40] = powerspec 3  supports D0 D3  current D0
    cap 05[50] = MSI supports 1 message, 64 bit, vector masks 
    cap 11[70] = MSI-X supports 10 messages, enabled
                 Table in map 0x1c[0x0], PBA in map 0x1c[0x2000]
    cap 10[a0] = PCI-Express 2 endpoint max data 256(512) FLR RO NS
                 link x4(x4) speed 2.5(2.5) ASPM disabled(L0s/L1)
    ecap 0001[100] = AER 1 0 fatal 0 non-fatal 1 corrected
    ecap 0003[140] = Serial 1 001b21ffff8edbb0
    ecap 000e[150] = ARI 1
    ecap 0010[160] = SR-IOV 1 IOV disabled, Memory Space disabled, ARI disabled
                     0 VFs configured out of 8 supported
                     First VF RID Offset 0x0180, VF RID Stride 0x0002
                     VF Device ID 0x10ca
                     Page Sizes: 4096 (enabled), 8192, 65536, 262144, 1048576, 4194304

igb1@pci0:10:0:1:	class=0x020000 card=0xa02c8086 chip=0x10e88086 rev=0x01 hdr=0x00
    vendor     = 'Intel Corporation'
    device     = '82576 Gigabit Network Connection'
    class      = network
    subclass   = ethernet
    bar   [10] = type Memory, range 32, base 0xdcbc0000, size 131072, enabled
    bar   [14] = type Memory, range 32, base 0xdc400000, size 4194304, enabled
    bar   [18] = type I/O Port, range 32, base 0xece0, size 32, enabled
    bar   [1c] = type Memory, range 32, base 0xdcbfc000, size 16384, enabled
    cap 01[40] = powerspec 3  supports D0 D3  current D0
    cap 05[50] = MSI supports 1 message, 64 bit, vector masks 
    cap 11[70] = MSI-X supports 10 messages, enabled
                 Table in map 0x1c[0x0], PBA in map 0x1c[0x2000]
    cap 10[a0] = PCI-Express 2 endpoint max data 256(512) FLR RO NS
                 link x4(x4) speed 2.5(2.5) ASPM disabled(L0s/L1)
    ecap 0001[100] = AER 1 0 fatal 0 non-fatal 1 corrected
    ecap 0003[140] = Serial 1 001b21ffff8edbb0
    ecap 000e[150] = ARI 1
    ecap 0010[160] = SR-IOV 1 IOV disabled, Memory Space disabled, ARI disabled
                     0 VFs configured out of 8 supported
                     First VF RID Offset 0x0180, VF RID Stride 0x0002
                     VF Device ID 0x10ca
                     Page Sizes: 4096 (enabled), 8192, 65536, 262144, 1048576, 4194304

igb2@pci0:11:0:0:	class=0x020000 card=0xa02c8086 chip=0x10e88086 rev=0x01 hdr=0x00
    vendor     = 'Intel Corporation'
    device     = '82576 Gigabit Network Connection'
    class      = network
    subclass   = ethernet
    bar   [10] = type Memory, range 32, base 0xdd7a0000, size 131072, enabled
    bar   [14] = type Memory, range 32, base 0xdcc00000, size 4194304, enabled
    bar   [18] = type I/O Port, range 32, base 0xdcc0, size 32, enabled
    bar   [1c] = type Memory, range 32, base 0xdd7f8000, size 16384, enabled
    cap 01[40] = powerspec 3  supports D0 D3  current D0
    cap 05[50] = MSI supports 1 message, 64 bit, vector masks 
    cap 11[70] = MSI-X supports 10 messages, enabled
                 Table in map 0x1c[0x0], PBA in map 0x1c[0x2000]
    cap 10[a0] = PCI-Express 2 endpoint max data 256(512) FLR RO NS
                 link x4(x4) speed 2.5(2.5) ASPM disabled(L0s/L1)
    ecap 0001[100] = AER 1 0 fatal 0 non-fatal 1 corrected
    ecap 0003[140] = Serial 1 001b21ffff8edbb4
    ecap 000e[150] = ARI 1
    ecap 0010[160] = SR-IOV 1 IOV disabled, Memory Space disabled, ARI disabled
                     0 VFs configured out of 8 supported
                     First VF RID Offset 0x0180, VF RID Stride 0x0002
                     VF Device ID 0x10ca
                     Page Sizes: 4096 (enabled), 8192, 65536, 262144, 1048576, 4194304

igb3@pci0:11:0:1:	class=0x020000 card=0xa02c8086 chip=0x10e88086 rev=0x01 hdr=0x00
    vendor     = 'Intel Corporation'
    device     = '82576 Gigabit Network Connection'
    class      = network
    subclass   = ethernet
    bar   [10] = type Memory, range 32, base 0xdd7c0000, size 131072, enabled
    bar   [14] = type Memory, range 32, base 0xdd000000, size 4194304, enabled
    bar   [18] = type I/O Port, range 32, base 0xdce0, size 32, enabled
    bar   [1c] = type Memory, range 32, base 0xdd7fc000, size 16384, enabled
    cap 01[40] = powerspec 3  supports D0 D3  current D0
    cap 05[50] = MSI supports 1 message, 64 bit, vector masks 
    cap 11[70] = MSI-X supports 10 messages, enabled
                 Table in map 0x1c[0x0], PBA in map 0x1c[0x2000]
    cap 10[a0] = PCI-Express 2 endpoint max data 256(512) FLR RO NS
                 link x4(x4) speed 2.5(2.5) ASPM disabled(L0s/L1)
    ecap 0001[100] = AER 1 0 fatal 0 non-fatal 1 corrected
    ecap 0003[140] = Serial 1 001b21ffff8edbb4
    ecap 000e[150] = ARI 1
    ecap 0010[160] = SR-IOV 1 IOV disabled, Memory Space disabled, ARI disabled
                     0 VFs configured out of 8 supported
                     First VF RID Offset 0x0180, VF RID Stride 0x0002
                     VF Device ID 0x10ca
                     Page Sizes: 4096 (enabled), 8192, 65536, 262144, 1048576, 4194304

ix0@pci0:13:0:0:	class=0x020000 card=0x00068086 chip=0x10fb8086 rev=0x01 hdr=0x00
    vendor     = 'Intel Corporation'
    device     = '82599ES 10-Gigabit SFI/SFP+ Network Connection'
    class      = network
    subclass   = ethernet
    bar   [10] = type Memory, range 64, base 0xd9f00000, size 524288, enabled
    bar   [18] = type I/O Port, range 32, base 0xcce0, size 32, enabled
    bar   [20] = type Memory, range 64, base 0xd9ffc000, size 16384, enabled
    cap 01[40] = powerspec 3  supports D0 D3  current D0
    cap 05[50] = MSI supports 1 message, 64 bit, vector masks 
    cap 11[70] = MSI-X supports 64 messages, enabled
                 Table in map 0x20[0x0], PBA in map 0x20[0x2000]
    cap 10[a0] = PCI-Express 2 endpoint max data 128(512) FLR RO NS
                 link x4(x8) speed 5.0(5.0) ASPM disabled(L0s)
    cap 03[e0] = VPD
    ecap 0001[100] = AER 1 0 fatal 0 non-fatal 0 corrected
    ecap 0003[140] = Serial 1 001b21ffffbbf5b6
    ecap 000e[150] = ARI 1
    ecap 0010[160] = SR-IOV 1 IOV disabled, Memory Space disabled, ARI disabled
                     0 VFs configured out of 64 supported
                     First VF RID Offset 0x0180, VF RID Stride 0x0002
                     VF Device ID 0x10ed
                     Page Sizes: 4096 (enabled), 8192, 65536, 262144, 1048576, 4194304

bge0@pci0:2:0:0:	class=0x020000 card=0x04f81028 chip=0x165f14e4 rev=0x00 hdr=0x00
    vendor     = 'Broadcom Inc. and subsidiaries'
    device     = 'NetXtreme BCM5720 2-port Gigabit Ethernet PCIe'
    class      = network
    subclass   = ethernet
    bar   [10] = type Prefetchable Memory, range 64, base 0xd50a0000, size 65536, enabled
    bar   [18] = type Prefetchable Memory, range 64, base 0xd50b0000, size 65536, enabled
    bar   [20] = type Prefetchable Memory, range 64, base 0xd50c0000, size 65536, enabled
    cap 01[48] = powerspec 3  supports D0 D3  current D0
    cap 03[50] = VPD
    cap 05[58] = MSI supports 8 messages, 64 bit enabled with 1 message
    cap 11[a0] = MSI-X supports 17 messages
                 Table in map 0x20[0x0], PBA in map 0x20[0x1000]
    cap 10[ac] = PCI-Express 2 endpoint max data 128(256) FLR
                 link x1(x2) speed 5.0(5.0) ASPM disabled(L0s/L1)
    ecap 0001[100] = AER 1 0 fatal 0 non-fatal 1 corrected
    ecap 0003[13c] = Serial 1 0000f01fafde091f
    ecap 0004[150] = Power Budgeting 1
    ecap 0002[160] = VC 1 max VC0

bge1@pci0:2:0:1:	class=0x020000 card=0x04f81028 chip=0x165f14e4 rev=0x00 hdr=0x00
    vendor     = 'Broadcom Inc. and subsidiaries'
    device     = 'NetXtreme BCM5720 2-port Gigabit Ethernet PCIe'
    class      = network
    subclass   = ethernet
    bar   [10] = type Prefetchable Memory, range 64, base 0xd50d0000, size 65536, enabled
    bar   [18] = type Prefetchable Memory, range 64, base 0xd50e0000, size 65536, enabled
    bar   [20] = type Prefetchable Memory, range 64, base 0xd50f0000, size 65536, enabled
    cap 01[48] = powerspec 3  supports D0 D3  current D0
    cap 03[50] = VPD
    cap 05[58] = MSI supports 8 messages, 64 bit enabled with 1 message
    cap 11[a0] = MSI-X supports 17 messages
                 Table in map 0x20[0x0], PBA in map 0x20[0x1000]
    cap 10[ac] = PCI-Express 2 endpoint max data 128(256) FLR
                 link x1(x2) speed 5.0(5.0) ASPM disabled(L0s/L1)
    ecap 0001[100] = AER 1 0 fatal 0 non-fatal 1 corrected
    ecap 0003[13c] = Serial 1 0000f01fafde0920
    ecap 0004[150] = Power Budgeting 1
    ecap 0002[160] = VC 1 max VC0

pcib10@pci0:3:0:0:	class=0x060400 card=0x00131912 chip=0x00131912 rev=0x00 hdr=0x01
    vendor     = 'Renesas Technology Corp.'
    device     = 'SH7757 PCIe Switch [PS]'
    class      = bridge
    subclass   = PCI-PCI
    cap 01[40] = powerspec 3  supports D0 D3  current D0
    cap 05[50] = MSI supports 1 message, 64 bit 
    cap 10[70] = PCI-Express 2 upstream port max data 128(128) RO NS
                 link x1(x1) speed 2.5(2.5) ASPM disabled(L0s)
    cap 0d[b0] = PCI Bridge card=0x00131912
    ecap 0001[100] = AER 1 0 fatal 0 non-fatal 0 corrected

pcib11@pci0:4:0:0:	class=0x060400 card=0x00131912 chip=0x00131912 rev=0x00 hdr=0x01
    vendor     = 'Renesas Technology Corp.'
    device     = 'SH7757 PCIe Switch [PS]'
    class      = bridge
    subclass   = PCI-PCI
    cap 01[40] = powerspec 3  supports D0 D3  current D0
    cap 05[50] = MSI supports 1 message, 64 bit 
    cap 10[70] = PCI-Express 2 downstream port max data 128(128) RO NS
                 link x1(x1) speed 2.5(2.5)
    cap 0d[b0] = PCI Bridge card=0x00131912
    ecap 0001[100] = AER 1 0 fatal 0 non-fatal 1 corrected

pcib13@pci0:4:1:0:	class=0x060400 card=0x00131912 chip=0x00131912 rev=0x00 hdr=0x01
    vendor     = 'Renesas Technology Corp.'
    device     = 'SH7757 PCIe Switch [PS]'
    class      = bridge
    subclass   = PCI-PCI
    cap 01[40] = powerspec 3  supports D0 D3  current D0
    cap 05[50] = MSI supports 1 message, 64 bit 
    cap 10[70] = PCI-Express 2 downstream port max data 128(128) RO NS
                 link x1(x1) speed 2.5(2.5)
    cap 0d[b0] = PCI Bridge card=0x00131912
    ecap 0001[100] = AER 1 0 fatal 0 non-fatal 0 corrected
    ecap 000d[150] = ACS 1

pcib12@pci0:5:0:0:	class=0x060400 card=0x00121912 chip=0x00121912 rev=0x00 hdr=0x01
    vendor     = 'Renesas Technology Corp.'
    device     = 'SH7757 PCIe-PCI Bridge [PPB]'
    class      = bridge
    subclass   = PCI-PCI
    cap 01[40] = powerspec 3  supports D0 D3  current D0
    cap 05[50] = MSI supports 1 message, 64 bit 
    cap 10[70] = PCI-Express 2 PCI bridge max data 128(128) RO NS
                 link x1(x1) speed 2.5(2.5)
    cap 0d[b0] = PCI Bridge card=0x00121912
    ecap 0001[100] = AER 1 0 fatal 0 non-fatal 1 corrected

vgapci0@pci0:6:0:0:	class=0x030000 card=0x04f81028 chip=0x0534102b rev=0x00 hdr=0x00
    vendor     = 'Matrox Electronics Systems Ltd.'
    device     = 'G200eR2'
    class      = display
    subclass   = VGA
    bar   [10] = type Prefetchable Memory, range 32, base 0xd4000000, size 16777216, enabled
    bar   [14] = type Memory, range 32, base 0xdb7fc000, size 16384, enabled
    bar   [18] = type Memory, range 32, base 0xda800000, size 8388608, enabled
    cap 01[dc] = powerspec 1  supports D0 D3  current D0

none4@pci0:63:8:0:	class=0x088000 card=0x00008086 chip=0x0e808086 rev=0x04 hdr=0x00
    vendor     = 'Intel Corporation'
    device     = 'Xeon E7 v2/Xeon E5 v2/Core i7 QPI Link 0'
    class      = base peripheral

none5@pci0:63:9:0:	class=0x088000 card=0x00008086 chip=0x0e908086 rev=0x04 hdr=0x00
    vendor     = 'Intel Corporation'
    device     = 'Xeon E7 v2/Xeon E5 v2/Core i7 QPI Link 1'
    class      = base peripheral

none6@pci0:63:10:0:	class=0x088000 card=0x00008086 chip=0x0ec08086 rev=0x04 hdr=0x00
    vendor     = 'Intel Corporation'
    device     = 'Xeon E7 v2/Xeon E5 v2/Core i7 Power Control Unit 0'
    class      = base peripheral

none7@pci0:63:10:1:	class=0x088000 card=0x00008086 chip=0x0ec18086 rev=0x04 hdr=0x00
    vendor     = 'Intel Corporation'
    device     = 'Xeon E7 v2/Xeon E5 v2/Core i7 Power Control Unit 1'
    class      = base peripheral

none8@pci0:63:10:2:	class=0x088000 card=0x00008086 chip=0x0ec28086 rev=0x04 hdr=0x00
    vendor     = 'Intel Corporation'
    device     = 'Xeon E7 v2/Xeon E5 v2/Core i7 Power Control Unit 2'
    class      = base peripheral

none9@pci0:63:10:3:	class=0x088000 card=0x00008086 chip=0x0ec38086 rev=0x04 hdr=0x00
    vendor     = 'Intel Corporation'
    device     = 'Xeon E7 v2/Xeon E5 v2/Core i7 Power Control Unit 3'
    class      = base peripheral

none10@pci0:63:11:0:	class=0x088000 card=0x00008086 chip=0x0e1e8086 rev=0x04 hdr=0x00
    vendor     = 'Intel Corporation'
    device     = 'Xeon E7 v2/Xeon E5 v2/Core i7 UBOX Registers'
    class      = base peripheral

none11@pci0:63:11:3:	class=0x088000 card=0x00008086 chip=0x0e1f8086 rev=0x04 hdr=0x00
    vendor     = 'Intel Corporation'
    device     = 'Xeon E7 v2/Xeon E5 v2/Core i7 UBOX Registers'
    class      = base peripheral

none12@pci0:63:12:0:	class=0x088000 card=0x00008086 chip=0x0ee08086 rev=0x04 hdr=0x00
    vendor     = 'Intel Corporation'
    device     = 'Xeon E7 v2/Xeon E5 v2/Core i7 Unicast Registers'
    class      = base peripheral

none13@pci0:63:12:1:	class=0x088000 card=0x00008086 chip=0x0ee28086 rev=0x04 hdr=0x00
    vendor     = 'Intel Corporation'
    device     = 'Xeon E7 v2/Xeon E5 v2/Core i7 Unicast Registers'
    class      = base peripheral

none14@pci0:63:12:2:	class=0x088000 card=0x00008086 chip=0x0ee48086 rev=0x04 hdr=0x00
    vendor     = 'Intel Corporation'
    device     = 'Xeon E7 v2/Xeon E5 v2/Core i7 Unicast Registers'
    class      = base peripheral

none15@pci0:63:13:0:	class=0x088000 card=0x00008086 chip=0x0ee18086 rev=0x04 hdr=0x00
    vendor     = 'Intel Corporation'
    device     = 'Xeon E7 v2/Xeon E5 v2/Core i7 Unicast Registers'
    class      = base peripheral

none16@pci0:63:13:1:	class=0x088000 card=0x00008086 chip=0x0ee38086 rev=0x04 hdr=0x00
    vendor     = 'Intel Corporation'
    device     = 'Xeon E7 v2/Xeon E5 v2/Core i7 Unicast Registers'
    class      = base peripheral

none17@pci0:63:13:2:	class=0x088000 card=0x00008086 chip=0x0ee58086 rev=0x04 hdr=0x00
    vendor     = 'Intel Corporation'
    device     = 'Xeon E7 v2/Xeon E5 v2/Core i7 Unicast Registers'
    class      = base peripheral

none18@pci0:63:14:0:	class=0x088000 card=0x04f81028 chip=0x0ea08086 rev=0x04 hdr=0x00
    vendor     = 'Intel Corporation'
    device     = 'Xeon E7 v2/Xeon E5 v2/Core i7 Home Agent 0'
    class      = base peripheral

none19@pci0:63:14:1:	class=0x110100 card=0x04f81028 chip=0x0e308086 rev=0x04 hdr=0x00
    vendor     = 'Intel Corporation'
    device     = 'Xeon E7 v2/Xeon E5 v2/Core i7 Home Agent 0'
    class      = dasp
    subclass   = performance counters

none20@pci0:63:15:0:	class=0x088000 card=0x00008086 chip=0x0ea88086 rev=0x04 hdr=0x00
    vendor     = 'Intel Corporation'
    device     = 'Xeon E7 v2/Xeon E5 v2/Core i7 Integrated Memory Controller 0 Target Address/Thermal Registers'
    class      = base peripheral
    cap 10[40] = PCI-Express 1 root endpoint max data 128(128)

none21@pci0:63:15:1:	class=0x088000 card=0x00008086 chip=0x0e718086 rev=0x04 hdr=0x00
    vendor     = 'Intel Corporation'
    device     = 'Xeon E7 v2/Xeon E5 v2/Core i7 Integrated Memory Controller 0 RAS Registers'
    class      = base peripheral
    cap 10[40] = PCI-Express 1 root endpoint max data 128(128)

none22@pci0:63:15:2:	class=0x088000 card=0x00008086 chip=0x0eaa8086 rev=0x04 hdr=0x00
    vendor     = 'Intel Corporation'
    device     = 'Xeon E7 v2/Xeon E5 v2/Core i7 Integrated Memory Controller 0 Channel Target Address Decoder Registers'
    class      = base peripheral
    cap 10[40] = PCI-Express 1 root endpoint max data 128(128)

none23@pci0:63:15:3:	class=0x088000 card=0x00008086 chip=0x0eab8086 rev=0x04 hdr=0x00
    vendor     = 'Intel Corporation'
    device     = 'Xeon E7 v2/Xeon E5 v2/Core i7 Integrated Memory Controller 0 Channel Target Address Decoder Registers'
    class      = base peripheral
    cap 10[40] = PCI-Express 1 root endpoint max data 128(128)

none24@pci0:63:15:4:	class=0x088000 card=0x00008086 chip=0x0eac8086 rev=0x04 hdr=0x00
    vendor     = 'Intel Corporation'
    device     = 'Xeon E7 v2/Xeon E5 v2/Core i7 Integrated Memory Controller 0 Channel Target Address Decoder Registers'
    class      = base peripheral
    cap 10[40] = PCI-Express 1 root endpoint max data 128(128)

none25@pci0:63:15:5:	class=0x088000 card=0x00008086 chip=0x0ead8086 rev=0x04 hdr=0x00
    vendor     = 'Intel Corporation'
    device     = 'Xeon E7 v2/Xeon E5 v2/Core i7 Integrated Memory Controller 0 Channel Target Address Decoder Registers'
    class      = base peripheral
    cap 10[40] = PCI-Express 1 root endpoint max data 128(128)

none26@pci0:63:16:0:	class=0x088000 card=0x00008086 chip=0x0eb08086 rev=0x04 hdr=0x00
    vendor     = 'Intel Corporation'
    device     = 'Xeon E7 v2/Xeon E5 v2/Core i7 Integrated Memory Controller 1 Channel 0-3 Thermal Control 0'
    class      = base peripheral
    cap 10[40] = PCI-Express 1 root endpoint max data 128(128)

none27@pci0:63:16:1:	class=0x088000 card=0x00008086 chip=0x0eb18086 rev=0x04 hdr=0x00
    vendor     = 'Intel Corporation'
    device     = 'Xeon E7 v2/Xeon E5 v2/Core i7 Integrated Memory Controller 1 Channel 0-3 Thermal Control 1'
    class      = base peripheral
    cap 10[40] = PCI-Express 1 root endpoint max data 128(128)

none28@pci0:63:16:2:	class=0x088000 card=0x00008086 chip=0x0eb28086 rev=0x04 hdr=0x00
    vendor     = 'Intel Corporation'
    device     = 'Xeon E7 v2/Xeon E5 v2/Core i7 Integrated Memory Controller 1 Channel 0-3 ERROR Registers 0'
    class      = base peripheral
    cap 10[40] = PCI-Express 1 root endpoint max data 128(128)

none29@pci0:63:16:3:	class=0x088000 card=0x00008086 chip=0x0eb38086 rev=0x04 hdr=0x00
    vendor     = 'Intel Corporation'
    device     = 'Xeon E7 v2/Xeon E5 v2/Core i7 Integrated Memory Controller 1 Channel 0-3 ERROR Registers 1'
    class      = base peripheral
    cap 10[40] = PCI-Express 1 root endpoint max data 128(128)

none30@pci0:63:16:4:	class=0x088000 card=0x00008086 chip=0x0eb48086 rev=0x04 hdr=0x00
    vendor     = 'Intel Corporation'
    device     = 'Xeon E7 v2/Xeon E5 v2/Core i7 Integrated Memory Controller 1 Channel 0-3 Thermal Control 2'
    class      = base peripheral
    cap 10[40] = PCI-Express 1 root endpoint max data 128(128)

none31@pci0:63:16:5:	class=0x088000 card=0x00008086 chip=0x0eb58086 rev=0x04 hdr=0x00
    vendor     = 'Intel Corporation'
    device     = 'Xeon E7 v2/Xeon E5 v2/Core i7 Integrated Memory Controller 1 Channel 0-3 Thermal Control 3'
    class      = base peripheral
    cap 10[40] = PCI-Express 1 root endpoint max data 128(128)

none32@pci0:63:16:7:	class=0x088000 card=0x00008086 chip=0x0eb78086 rev=0x04 hdr=0x00
    vendor     = 'Intel Corporation'
    device     = 'Xeon E7 v2/Xeon E5 v2/Core i7 Integrated Memory Controller 1 Channel 0-3 ERROR Registers 3'
    class      = base peripheral
    cap 10[40] = PCI-Express 1 root endpoint max data 128(128)

none33@pci0:63:19:0:	class=0x088000 card=0x00008086 chip=0x0e1d8086 rev=0x04 hdr=0x00
    vendor     = 'Intel Corporation'
    device     = 'Xeon E7 v2/Xeon E5 v2/Core i7 R2PCIe'
    class      = base peripheral

none34@pci0:63:19:1:	class=0x110100 card=0x04f81028 chip=0x0e348086 rev=0x04 hdr=0x00
    vendor     = 'Intel Corporation'
    device     = 'Xeon E7 v2/Xeon E5 v2/Core i7 R2PCIe'
    class      = dasp
    subclass   = performance counters

none35@pci0:63:19:4:	class=0x088000 card=0x04f81028 chip=0x0e818086 rev=0x04 hdr=0x00
    vendor     = 'Intel Corporation'
    device     = 'Xeon E7 v2/Xeon E5 v2/Core i7 QPI Ring Registers'
    class      = base peripheral

none36@pci0:63:19:5:	class=0x110100 card=0x04f81028 chip=0x0e368086 rev=0x04 hdr=0x00
    vendor     = 'Intel Corporation'
    device     = 'Xeon E7 v2/Xeon E5 v2/Core i7 QPI Ring Performance Ring Monitoring'
    class      = dasp
    subclass   = performance counters

none37@pci0:63:22:0:	class=0x088000 card=0x00008086 chip=0x0ec88086 rev=0x04 hdr=0x00
    vendor     = 'Intel Corporation'
    device     = 'Xeon E7 v2/Xeon E5 v2/Core i7 System Address Decoder'
    class      = base peripheral

none38@pci0:63:22:1:	class=0x088000 card=0x00008086 chip=0x0ec98086 rev=0x04 hdr=0x00
    vendor     = 'Intel Corporation'
    device     = 'Xeon E7 v2/Xeon E5 v2/Core i7 Broadcast Registers'
    class      = base peripheral

none39@pci0:63:22:2:	class=0x088000 card=0x00008086 chip=0x0eca8086 rev=0x04 hdr=0x00
    vendor     = 'Intel Corporation'
    device     = 'Xeon E7 v2/Xeon E5 v2/Core i7 Broadcast Registers'
    class      = base peripheral
