hostb0@pci0:0:0:0:	class=0x060000 rev=0x02 hdr=0x00 vendor=0x1002 device=0x5a12 subvendor=0x15d9 subdevice=0xa811
    vendor     = 'Advanced Micro Devices, Inc. [AMD/ATI]'
    device     = 'RD890 Northbridge only dual slot (2x8) PCI-e GFX Hydra part'
    class      = bridge
    subclass   = HOST-PCI
    cap 08[f0] = HT MSI fixed address window enabled at 0xfee00000
    cap 08[c4] = HT slave
    cap 08[40] = HT retry mode
    cap 08[54] = HT unit ID clumping
    cap 08[9c] = HT Gen3
    cap 05[70] = MSI supports 4 messages 

amdiommu0@pci0:0:0:2:	class=0x080600 rev=0x00 hdr=0x00 vendor=0x1002 device=0x5a23 subvendor=0x1002 subdevice=0x5a23
    vendor     = 'Advanced Micro Devices, Inc. [AMD/ATI]'
    device     = 'RD890S/RD990 I/O Memory Management Unit (IOMMU)'
    class      = base peripheral
    subclass   = IOMMU
    cap 0f[40] = unknown
    cap 05[54] = MSI supports 1 message, 64 bit enabled with 1 message
    cap 08[64] = HT MSI fixed address window enabled at 0xfee00000

pcib1@pci0:0:4:0:	class=0x060400 rev=0x00 hdr=0x01 vendor=0x1002 device=0x5a18 subvendor=0x15d9 subdevice=0xa811
    vendor     = 'Advanced Micro Devices, Inc. [AMD/ATI]'
    device     = 'RD890/RD9x0/RX980 PCI to PCI bridge (PCI Express GPP Port 0)'
    class      = bridge
    subclass   = PCI-PCI
    cap 01[50] = powerspec 3  supports D0 D3  current D0
    cap 10[58] = PCI-Express 2 root port max data 128(128) RO NS ARI enabled
                 max read 128
                 link x4(x4) speed 2.5(5.0) ASPM disabled(L0s/L1)
                 slot 4 power limit 75000 mW
    cap 05[a0] = MSI supports 1 message 
    cap 0d[b0] = PCI Bridge subvendor=0x15d9 subdevice=0xa811
    cap 08[b8] = HT MSI fixed address window enabled at 0xfee00000
    ecap 000b[100] = Vendor [1] ID 0001 Rev 1 Length 16
    ecap 000d[190] = ACS 1

ahci0@pci0:0:17:0:	class=0x010601 rev=0x00 hdr=0x00 vendor=0x1002 device=0x4391 subvendor=0x1002 subdevice=0x4391
    vendor     = 'Advanced Micro Devices, Inc. [AMD/ATI]'
    device     = 'SB7x0/SB8x0/SB9x0 SATA Controller [AHCI mode]'
    class      = mass storage
    subclass   = SATA
    bar   [10] = type I/O Port, range 32, base 0xd000, size 8, enabled
    bar   [14] = type I/O Port, range 32, base 0xc000, size 4, enabled
    bar   [18] = type I/O Port, range 32, base 0xb000, size 8, enabled
    bar   [1c] = type I/O Port, range 32, base 0xa000, size 4, enabled
    bar   [20] = type I/O Port, range 32, base 0x9000, size 16, enabled
    bar   [24] = type Memory, range 32, base 0xfeafa400, size 1024, enabled
    cap 01[60] = powerspec 2  supports D0 D3  current D0
    cap 12[70] = SATA Index-Data Pair

ohci0@pci0:0:18:0:	class=0x0c0310 rev=0x00 hdr=0x00 vendor=0x1002 device=0x4397 subvendor=0x15d9 subdevice=0xa811
    vendor     = 'Advanced Micro Devices, Inc. [AMD/ATI]'
    device     = 'SB7x0/SB8x0/SB9x0 USB OHCI0 Controller'
    class      = serial bus
    subclass   = USB
    bar   [10] = type Memory, range 32, base 0xfeaf6000, size 4096, enabled

ohci1@pci0:0:18:1:	class=0x0c0310 rev=0x00 hdr=0x00 vendor=0x1002 device=0x4398 subvendor=0x15d9 subdevice=0xa811
    vendor     = 'Advanced Micro Devices, Inc. [AMD/ATI]'
    device     = 'SB7x0 USB OHCI1 Controller'
    class      = serial bus
    subclass   = USB
    bar   [10] = type Memory, range 32, base 0xfeaf7000, size 4096, enabled

ehci0@pci0:0:18:2:	class=0x0c0320 rev=0x00 hdr=0x00 vendor=0x1002 device=0x4396 subvendor=0x15d9 subdevice=0xa811
    vendor     = 'Advanced Micro Devices, Inc. [AMD/ATI]'
    device     = 'SB7x0/SB8x0/SB9x0 USB EHCI Controller'
    class      = serial bus
    subclass   = USB
    bar   [10] = type Memory, range 32, base 0xfeafa800, size 256, enabled
    cap 01[c0] = powerspec 2  supports D0 D1 D2 D3  current D0
    cap 0a[e4] = EHCI Debug Port at offset 0xe0 in map 0x14

ohci2@pci0:0:19:0:	class=0x0c0310 rev=0x00 hdr=0x00 vendor=0x1002 device=0x4397 subvendor=0x15d9 subdevice=0xa811
    vendor     = 'Advanced Micro Devices, Inc. [AMD/ATI]'
    device     = 'SB7x0/SB8x0/SB9x0 USB OHCI0 Controller'
    class      = serial bus
    subclass   = USB
    bar   [10] = type Memory, range 32, base 0xfeaf8000, size 4096, enabled

ohci3@pci0:0:19:1:	class=0x0c0310 rev=0x00 hdr=0x00 vendor=0x1002 device=0x4398 subvendor=0x15d9 subdevice=0xa811
    vendor     = 'Advanced Micro Devices, Inc. [AMD/ATI]'
    device     = 'SB7x0 USB OHCI1 Controller'
    class      = serial bus
    subclass   = USB
    bar   [10] = type Memory, range 32, base 0xfeaf9000, size 4096, enabled

ehci1@pci0:0:19:2:	class=0x0c0320 rev=0x00 hdr=0x00 vendor=0x1002 device=0x4396 subvendor=0x1002 subdevice=0x4396
    vendor     = 'Advanced Micro Devices, Inc. [AMD/ATI]'
    device     = 'SB7x0/SB8x0/SB9x0 USB EHCI Controller'
    class      = serial bus
    subclass   = USB
    bar   [10] = type Memory, range 32, base 0xfeafac00, size 256, enabled
    cap 01[c0] = powerspec 2  supports D0 D1 D2 D3  current D0
    cap 0a[e4] = EHCI Debug Port at offset 0xe0 in map 0x14

intsmb0@pci0:0:20:0:	class=0x0c0500 rev=0x3d hdr=0x00 vendor=0x1002 device=0x4385 subvendor=0x15d9 subdevice=0xa811
    vendor     = 'Advanced Micro Devices, Inc. [AMD/ATI]'
    device     = 'SBx00 SMBus Controller'
    class      = serial bus
    subclass   = SMBus
    cap 08[b0] = HT MSI fixed address window disabled at 0xfee00000

isab0@pci0:0:20:3:	class=0x060100 rev=0x00 hdr=0x00 vendor=0x1002 device=0x439d subvendor=0x15d9 subdevice=0xa811
    vendor     = 'Advanced Micro Devices, Inc. [AMD/ATI]'
    device     = 'SB7x0/SB8x0/SB9x0 LPC host controller'
    class      = bridge
    subclass   = PCI-ISA

pcib2@pci0:0:20:4:	class=0x060401 rev=0x00 hdr=0x01 vendor=0x1002 device=0x4384 subvendor=0x0000 subdevice=0x0000
    vendor     = 'Advanced Micro Devices, Inc. [AMD/ATI]'
    device     = 'SBx00 PCI to PCI Bridge'
    class      = bridge
    subclass   = PCI-PCI

ohci4@pci0:0:20:5:	class=0x0c0310 rev=0x00 hdr=0x00 vendor=0x1002 device=0x4399 subvendor=0x1002 subdevice=0x4396
    vendor     = 'Advanced Micro Devices, Inc. [AMD/ATI]'
    device     = 'SB7x0/SB8x0/SB9x0 USB OHCI2 Controller'
    class      = serial bus
    subclass   = USB
    bar   [10] = type Memory, range 32, base 0xfeafb000, size 4096, enabled

hostb1@pci0:0:24:0:	class=0x060000 rev=0x00 hdr=0x00 vendor=0x1022 device=0x1200 subvendor=0x0000 subdevice=0x0000
    vendor     = 'Advanced Micro Devices, Inc. [AMD]'
    device     = 'Family 10h Processor HyperTransport Configuration'
    class      = bridge
    subclass   = HOST-PCI
    cap 08[80] = HT host
    cap 08[a0] = HT host
    cap 08[c0] = HT host
    cap 08[e0] = HT host

hostb2@pci0:0:24:1:	class=0x060000 rev=0x00 hdr=0x00 vendor=0x1022 device=0x1201 subvendor=0x0000 subdevice=0x0000
    vendor     = 'Advanced Micro Devices, Inc. [AMD]'
    device     = 'Family 10h Processor Address Map'
    class      = bridge
    subclass   = HOST-PCI

hostb3@pci0:0:24:2:	class=0x060000 rev=0x00 hdr=0x00 vendor=0x1022 device=0x1202 subvendor=0x0000 subdevice=0x0000
    vendor     = 'Advanced Micro Devices, Inc. [AMD]'
    device     = 'Family 10h Processor DRAM Controller'
    class      = bridge
    subclass   = HOST-PCI

hostb4@pci0:0:24:3:	class=0x060000 rev=0x00 hdr=0x00 vendor=0x1022 device=0x1203 subvendor=0x0000 subdevice=0x0000
    vendor     = 'Advanced Micro Devices, Inc. [AMD]'
    device     = 'Family 10h Processor Miscellaneous Control'
    class      = bridge
    subclass   = HOST-PCI
    cap 0f[f0] = unknown

hostb5@pci0:0:24:4:	class=0x060000 rev=0x00 hdr=0x00 vendor=0x1022 device=0x1204 subvendor=0x0000 subdevice=0x0000
    vendor     = 'Advanced Micro Devices, Inc. [AMD]'
    device     = 'Family 10h Processor Link Control'
    class      = bridge
    subclass   = HOST-PCI
    cap 08[80] = HT host

hostb6@pci0:0:25:0:	class=0x060000 rev=0x00 hdr=0x00 vendor=0x1022 device=0x1200 subvendor=0x0000 subdevice=0x0000
    vendor     = 'Advanced Micro Devices, Inc. [AMD]'
    device     = 'Family 10h Processor HyperTransport Configuration'
    class      = bridge
    subclass   = HOST-PCI
    cap 08[80] = HT host
    cap 08[a0] = HT host
    cap 08[c0] = HT host

hostb7@pci0:0:25:1:	class=0x060000 rev=0x00 hdr=0x00 vendor=0x1022 device=0x1201 subvendor=0x0000 subdevice=0x0000
    vendor     = 'Advanced Micro Devices, Inc. [AMD]'
    device     = 'Family 10h Processor Address Map'
    class      = bridge
    subclass   = HOST-PCI

hostb8@pci0:0:25:2:	class=0x060000 rev=0x00 hdr=0x00 vendor=0x1022 device=0x1202 subvendor=0x0000 subdevice=0x0000
    vendor     = 'Advanced Micro Devices, Inc. [AMD]'
    device     = 'Family 10h Processor DRAM Controller'
    class      = bridge
    subclass   = HOST-PCI

hostb9@pci0:0:25:3:	class=0x060000 rev=0x00 hdr=0x00 vendor=0x1022 device=0x1203 subvendor=0x0000 subdevice=0x0000
    vendor     = 'Advanced Micro Devices, Inc. [AMD]'
    device     = 'Family 10h Processor Miscellaneous Control'
    class      = bridge
    subclass   = HOST-PCI
    cap 0f[f0] = unknown

hostb10@pci0:0:25:4:	class=0x060000 rev=0x00 hdr=0x00 vendor=0x1022 device=0x1204 subvendor=0x0000 subdevice=0x0000
    vendor     = 'Advanced Micro Devices, Inc. [AMD]'
    device     = 'Family 10h Processor Link Control'
    class      = bridge
    subclass   = HOST-PCI
    cap 08[80] = HT host

hostb11@pci0:0:26:0:	class=0x060000 rev=0x00 hdr=0x00 vendor=0x1022 device=0x1200 subvendor=0x0000 subdevice=0x0000
    vendor     = 'Advanced Micro Devices, Inc. [AMD]'
    device     = 'Family 10h Processor HyperTransport Configuration'
    class      = bridge
    subclass   = HOST-PCI
    cap 08[80] = HT host
    cap 08[a0] = HT host
    cap 08[c0] = HT host

hostb12@pci0:0:26:1:	class=0x060000 rev=0x00 hdr=0x00 vendor=0x1022 device=0x1201 subvendor=0x0000 subdevice=0x0000
    vendor     = 'Advanced Micro Devices, Inc. [AMD]'
    device     = 'Family 10h Processor Address Map'
    class      = bridge
    subclass   = HOST-PCI

hostb13@pci0:0:26:2:	class=0x060000 rev=0x00 hdr=0x00 vendor=0x1022 device=0x1202 subvendor=0x0000 subdevice=0x0000
    vendor     = 'Advanced Micro Devices, Inc. [AMD]'
    device     = 'Family 10h Processor DRAM Controller'
    class      = bridge
    subclass   = HOST-PCI

hostb14@pci0:0:26:3:	class=0x060000 rev=0x00 hdr=0x00 vendor=0x1022 device=0x1203 subvendor=0x0000 subdevice=0x0000
    vendor     = 'Advanced Micro Devices, Inc. [AMD]'
    device     = 'Family 10h Processor Miscellaneous Control'
    class      = bridge
    subclass   = HOST-PCI
    cap 0f[f0] = unknown

hostb15@pci0:0:26:4:	class=0x060000 rev=0x00 hdr=0x00 vendor=0x1022 device=0x1204 subvendor=0x0000 subdevice=0x0000
    vendor     = 'Advanced Micro Devices, Inc. [AMD]'
    device     = 'Family 10h Processor Link Control'
    class      = bridge
    subclass   = HOST-PCI
    cap 08[80] = HT host

hostb16@pci0:0:27:0:	class=0x060000 rev=0x00 hdr=0x00 vendor=0x1022 device=0x1200 subvendor=0x0000 subdevice=0x0000
    vendor     = 'Advanced Micro Devices, Inc. [AMD]'
    device     = 'Family 10h Processor HyperTransport Configuration'
    class      = bridge
    subclass   = HOST-PCI
    cap 08[80] = HT host
    cap 08[a0] = HT host
    cap 08[c0] = HT host
    cap 08[e0] = HT host

hostb17@pci0:0:27:1:	class=0x060000 rev=0x00 hdr=0x00 vendor=0x1022 device=0x1201 subvendor=0x0000 subdevice=0x0000
    vendor     = 'Advanced Micro Devices, Inc. [AMD]'
    device     = 'Family 10h Processor Address Map'
    class      = bridge
    subclass   = HOST-PCI

hostb18@pci0:0:27:2:	class=0x060000 rev=0x00 hdr=0x00 vendor=0x1022 device=0x1202 subvendor=0x0000 subdevice=0x0000
    vendor     = 'Advanced Micro Devices, Inc. [AMD]'
    device     = 'Family 10h Processor DRAM Controller'
    class      = bridge
    subclass   = HOST-PCI

hostb19@pci0:0:27:3:	class=0x060000 rev=0x00 hdr=0x00 vendor=0x1022 device=0x1203 subvendor=0x0000 subdevice=0x0000
    vendor     = 'Advanced Micro Devices, Inc. [AMD]'
    device     = 'Family 10h Processor Miscellaneous Control'
    class      = bridge
    subclass   = HOST-PCI
    cap 0f[f0] = unknown

hostb20@pci0:0:27:4:	class=0x060000 rev=0x00 hdr=0x00 vendor=0x1022 device=0x1204 subvendor=0x0000 subdevice=0x0000
    vendor     = 'Advanced Micro Devices, Inc. [AMD]'
    device     = 'Family 10h Processor Link Control'
    class      = bridge
    subclass   = HOST-PCI
    cap 08[80] = HT host
    cap 08[e0] = HT host

igb0@pci0:2:0:0:	class=0x020000 rev=0x01 hdr=0x00 vendor=0x8086 device=0x10c9 subvendor=0x15d9 subdevice=0xab11
    vendor     = 'Intel Corporation'
    device     = '82576 Gigabit Network Connection'
    class      = network
    subclass   = ethernet
    bar   [10] = type Memory, range 32, base 0xfeb60000, size 131072, enabled
    bar   [14] = type Memory, range 32, base 0xfeb40000, size 131072, enabled
    bar   [18] = type I/O Port, range 32, base 0xe400, size 32, enabled
    bar   [1c] = type Memory, range 32, base 0xfeb1c000, size 16384, enabled
    cap 01[40] = powerspec 3  supports D0 D3  current D0
    cap 05[50] = MSI supports 1 message, 64 bit, vector masks 
    cap 11[70] = MSI-X supports 10 messages, enabled
                 Table in map 0x1c[0x0], PBA in map 0x1c[0x2000]
    cap 10[a0] = PCI-Express 2 endpoint max data 128(512) FLR NS
                 max read 512
                 link x4(x4) speed 2.5(2.5) ASPM disabled(L0s/L1)
    ecap 0001[100] = AER 1 0 fatal 0 non-fatal 1 corrected
    ecap 0003[140] = Serial 1 002590ffff2a9146
    ecap 000e[150] = ARI 1
    ecap 0010[160] = SR-IOV 1 IOV disabled, Memory Space disabled, ARI disabled
                     0 VFs configured out of 8 supported
                     First VF RID Offset 0x0180, VF RID Stride 0x0002
                     VF Device ID 0x10ca
                     Page Sizes: 4096 (enabled), 8192, 65536, 262144, 1048576, 4194304

igb1@pci0:2:0:1:	class=0x020000 rev=0x01 hdr=0x00 vendor=0x8086 device=0x10c9 subvendor=0x15d9 subdevice=0xab11
    vendor     = 'Intel Corporation'
    device     = '82576 Gigabit Network Connection'
    class      = network
    subclass   = ethernet
    bar   [10] = type Memory, range 32, base 0xfebe0000, size 131072, enabled
    bar   [14] = type Memory, range 32, base 0xfebc0000, size 131072, enabled
    bar   [18] = type I/O Port, range 32, base 0xe800, size 32, enabled
    bar   [1c] = type Memory, range 32, base 0xfeb9c000, size 16384, enabled
    cap 01[40] = powerspec 3  supports D0 D3  current D0
    cap 05[50] = MSI supports 1 message, 64 bit, vector masks 
    cap 11[70] = MSI-X supports 10 messages, enabled
                 Table in map 0x1c[0x0], PBA in map 0x1c[0x2000]
    cap 10[a0] = PCI-Express 2 endpoint max data 128(512) FLR NS
                 max read 512
                 link x4(x4) speed 2.5(2.5) ASPM disabled(L0s/L1)
    ecap 0001[100] = AER 1 0 fatal 0 non-fatal 1 corrected
    ecap 0003[140] = Serial 1 002590ffff2a9146
    ecap 000e[150] = ARI 1
    ecap 0010[160] = SR-IOV 1 IOV disabled, Memory Space disabled, ARI disabled
                     0 VFs configured out of 8 supported
                     First VF RID Offset 0x0180, VF RID Stride 0x0002
                     VF Device ID 0x10ca
                     Page Sizes: 4096 (enabled), 8192, 65536, 262144, 1048576, 4194304

vgapci0@pci0:1:4:0:	class=0x030000 rev=0x0a hdr=0x00 vendor=0x102b device=0x0532 subvendor=0x15d9 subdevice=0xa811
    vendor     = 'Matrox Electronics Systems Ltd.'
    device     = 'MGA G200eW WPCM450'
    class      = display
    subclass   = VGA
    bar   [10] = type Prefetchable Memory, range 32, base 0xfc000000, size 16777216, enabled
    bar   [14] = type Memory, range 32, base 0xfdffc000, size 16384, enabled
    bar   [18] = type Memory, range 32, base 0xfe000000, size 8388608, enabled
    cap 01[dc] = powerspec 1  supports D0 D3  current D0
