hostb0@pci0:0:0:0:	class=0x060000 rev=0x06 hdr=0x00 vendor=0x8086 device=0x0c00 subvendor=0x1043 subdevice=0x8534
    vendor     = 'Intel Corporation'
    device     = '4th Gen Core Processor DRAM Controller'
    class      = bridge
    subclass   = HOST-PCI
    cap 09[e0] = vendor (length 12) Intel cap 0 version 1

pcib1@pci0:0:1:0:	class=0x060400 rev=0x06 hdr=0x01 vendor=0x8086 device=0x0c01 subvendor=0x1043 subdevice=0x8534
    vendor     = 'Intel Corporation'
    device     = 'Xeon E3-1200 v3/4th Gen Core Processor PCI Express x16 Controller'
    class      = bridge
    subclass   = PCI-PCI
    cap 0d[88] = PCI Bridge subvendor=0x1043 subdevice=0x8534
    cap 01[80] = powerspec 3  supports D0 D3  current D0
    cap 05[90] = MSI supports 1 message 
    cap 10[a0] = PCI-Express 2 root port max data 256(256)
                 max read 128
                 link x16(x16) speed 2.5(8.0) ASPM disabled(L0s/L1)
                 slot 1 power limit 75000 mW
    ecap 0002[100] = VC 1 max VC0
    ecap 0005[140] = Root Complex Link Declaration 1
    ecap 0019[d94] = PCIe Sec 1 lane errors 0

vgapci1@pci0:0:2:0:	class=0x038000 rev=0x06 hdr=0x00 vendor=0x8086 device=0x0412 subvendor=0x1043 subdevice=0x8534
    vendor     = 'Intel Corporation'
    device     = 'Xeon E3-1200 v3/4th Gen Core Processor Integrated Graphics Controller'
    class      = display
    bar   [10] = type Memory, range 64, base 0xdf400000, size 4194304, enabled
    bar   [18] = type Prefetchable Memory, range 64, base 0xb0000000, size 268435456, enabled
    bar   [20] = type I/O Port, range 32, base 0xf000, size 64, enabled
    cap 05[90] = MSI supports 1 message 
    cap 01[d0] = powerspec 2  supports D0 D3  current D0
    cap 13[a4] = PCI Advanced Features: FLR TP

hdac1@pci0:0:3:0:	class=0x040300 rev=0x06 hdr=0x00 vendor=0x8086 device=0x0c0c subvendor=0x1043 subdevice=0x8534
    vendor     = 'Intel Corporation'
    device     = 'Xeon E3-1200 v3/4th Gen Core Processor HD Audio Controller'
    class      = multimedia
    subclass   = HDA
    bar   [10] = type Memory, range 64, base 0xdff34000, size 16384, enabled
    cap 01[50] = powerspec 2  supports D0 D3  current D0
    cap 05[60] = MSI supports 1 message enabled with 1 message
    cap 10[70] = PCI-Express 1 root endpoint max data 128(128) FLR NS
                 max read 128

xhci0@pci0:0:20:0:	class=0x0c0330 rev=0x00 hdr=0x00 vendor=0x8086 device=0x8cb1 subvendor=0x1043 subdevice=0x8534
    vendor     = 'Intel Corporation'
    device     = '9 Series Chipset Family USB xHCI Controller'
    class      = serial bus
    subclass   = USB
    bar   [10] = type Memory, range 64, base 0xdff20000, size 65536, enabled
    cap 01[70] = powerspec 2  supports D0 D3  current D0
    cap 05[80] = MSI supports 8 messages, 64 bit enabled with 1 message

none0@pci0:0:22:0:	class=0x078000 rev=0x00 hdr=0x00 vendor=0x8086 device=0x8cba subvendor=0x1043 subdevice=0x8534
    vendor     = 'Intel Corporation'
    device     = '9 Series Chipset Family ME Interface'
    class      = simple comms
    bar   [10] = type Memory, range 64, base 0xdff3e000, size 16, enabled
    cap 01[50] = powerspec 3  supports D0 D3  current D0
    cap 05[8c] = MSI supports 1 message, 64 bit 

em0@pci0:0:25:0:	class=0x020000 rev=0x00 hdr=0x00 vendor=0x8086 device=0x15a1 subvendor=0x1043 subdevice=0x85c4
    vendor     = 'Intel Corporation'
    device     = 'Ethernet Connection (2) I218-V'
    class      = network
    subclass   = ethernet
    bar   [10] = type Memory, range 32, base 0xdff00000, size 131072, enabled
    bar   [14] = type Memory, range 32, base 0xdff3c000, size 4096, enabled
    bar   [18] = type I/O Port, range 32, base 0xf080, size 32, enabled
    cap 01[c8] = powerspec 2  supports D0 D3  current D0
    cap 05[d0] = MSI supports 1 message, 64 bit enabled with 1 message
    cap 13[e0] = PCI Advanced Features: FLR TP

ehci0@pci0:0:26:0:	class=0x0c0320 rev=0x00 hdr=0x00 vendor=0x8086 device=0x8cad subvendor=0x1043 subdevice=0x8534
    vendor     = 'Intel Corporation'
    device     = '9 Series Chipset Family USB EHCI Controller'
    class      = serial bus
    subclass   = USB
    bar   [10] = type Memory, range 32, base 0xdff3b000, size 1024, enabled
    cap 01[50] = powerspec 2  supports D0 D3  current D0
    cap 0a[58] = EHCI Debug Port at offset 0xa0 in map 0x14
    cap 13[98] = PCI Advanced Features: FLR TP

hdac2@pci0:0:27:0:	class=0x040300 rev=0x00 hdr=0x00 vendor=0x8086 device=0x8ca0 subvendor=0x1043 subdevice=0x8601
    vendor     = 'Intel Corporation'
    device     = '9 Series Chipset Family HD Audio Controller'
    class      = multimedia
    subclass   = HDA
    bar   [10] = type Memory, range 64, base 0xdff30000, size 16384, enabled
    cap 01[50] = powerspec 2  supports D0 D3  current D0
    cap 05[60] = MSI supports 1 message, 64 bit enabled with 1 message
    cap 10[70] = PCI-Express 1 root endpoint max data 128(128) FLR NS
                 max read 128
    ecap 0002[100] = VC 1 max VC1

pcib2@pci0:0:28:0:	class=0x060400 rev=0xd0 hdr=0x01 vendor=0x8086 device=0x8c90 subvendor=0x1043 subdevice=0x8534
    vendor     = 'Intel Corporation'
    device     = '9 Series Chipset Family PCI Express Root Port 1'
    class      = bridge
    subclass   = PCI-PCI
    cap 10[40] = PCI-Express 2 root port max data 128(128)
                 max read 128
                 link x0(x2) speed 0.0(5.0) ASPM disabled(L0s/L1)
    cap 05[80] = MSI supports 1 message 
    cap 0d[90] = PCI Bridge subvendor=0x1043 subdevice=0x8534
    cap 01[a0] = powerspec 3  supports D0 D3  current D0

pcib3@pci0:0:28:3:	class=0x060400 rev=0xd0 hdr=0x01 vendor=0x8086 device=0x8c96 subvendor=0x1043 subdevice=0x8534
    vendor     = 'Intel Corporation'
    device     = '9 Series Chipset Family PCI Express Root Port 4'
    class      = bridge
    subclass   = PCI-PCI
    cap 10[40] = PCI-Express 2 root port max data 128(128)
                 max read 128
                 link x1(x1) speed 5.0(5.0) ASPM disabled(L0s/L1)
                 slot 3 power limit 100 mW
    cap 05[80] = MSI supports 1 message 
    cap 0d[90] = PCI Bridge subvendor=0x1043 subdevice=0x8534
    cap 01[a0] = powerspec 3  supports D0 D3  current D0

pcib12@pci0:0:28:6:	class=0x060400 rev=0xd0 hdr=0x01 vendor=0x8086 device=0x8c9c subvendor=0x1043 subdevice=0x8534
    vendor     = 'Intel Corporation'
    device     = '9 Series Chipset Family PCI Express Root Port 7'
    class      = bridge
    subclass   = PCI-PCI
    cap 10[40] = PCI-Express 2 root port max data 128(128)
                 max read 128
                 link x1(x2) speed 5.0(5.0) ASPM disabled(L0s/L1)
                 slot 6 power limit 250 mW
    cap 05[80] = MSI supports 1 message 
    cap 0d[90] = PCI Bridge subvendor=0x1043 subdevice=0x8534
    cap 01[a0] = powerspec 3  supports D0 D3  current D0

ehci1@pci0:0:29:0:	class=0x0c0320 rev=0x00 hdr=0x00 vendor=0x8086 device=0x8ca6 subvendor=0x1043 subdevice=0x8534
    vendor     = 'Intel Corporation'
    device     = '9 Series Chipset Family USB EHCI Controller'
    class      = serial bus
    subclass   = USB
    bar   [10] = type Memory, range 32, base 0xdff3a000, size 1024, enabled
    cap 01[50] = powerspec 2  supports D0 D3  current D0
    cap 0a[58] = EHCI Debug Port at offset 0xa0 in map 0x14
    cap 13[98] = PCI Advanced Features: FLR TP

isab0@pci0:0:31:0:	class=0x060100 rev=0x00 hdr=0x00 vendor=0x8086 device=0x8cc4 subvendor=0x1043 subdevice=0x8534
    vendor     = 'Intel Corporation'
    device     = 'Z97 Chipset LPC Controller'
    class      = bridge
    subclass   = PCI-ISA
    cap 09[e0] = vendor (length 12) Intel cap 1 version 0
		 features: AMT, 4 PCI-e x1 slots

ahci2@pci0:0:31:2:	class=0x010601 rev=0x00 hdr=0x00 vendor=0x8086 device=0x8c82 subvendor=0x1043 subdevice=0x8534
    vendor     = 'Intel Corporation'
    device     = '9 Series Chipset Family SATA Controller [AHCI Mode]'
    class      = mass storage
    subclass   = SATA
    bar   [10] = type I/O Port, range 32, base 0xf0d0, size 8, enabled
    bar   [14] = type I/O Port, range 32, base 0xf0c0, size 4, enabled
    bar   [18] = type I/O Port, range 32, base 0xf0b0, size 8, enabled
    bar   [1c] = type I/O Port, range 32, base 0xf0a0, size 4, enabled
    bar   [20] = type I/O Port, range 32, base 0xf060, size 32, enabled
    bar   [24] = type Memory, range 32, base 0xdff39000, size 2048, enabled
    cap 05[80] = MSI supports 1 message enabled with 1 message
    cap 01[70] = powerspec 3  supports D0 D3  current D0
    cap 12[a8] = SATA Index-Data Pair

ichsmb0@pci0:0:31:3:	class=0x0c0500 rev=0x00 hdr=0x00 vendor=0x8086 device=0x8ca2 subvendor=0x1043 subdevice=0x8534
    vendor     = 'Intel Corporation'
    device     = '9 Series Chipset Family SMBus Controller'
    class      = serial bus
    subclass   = SMBus
    bar   [10] = type Memory, range 64, base 0xdff38000, size 256, enabled
    bar   [20] = type I/O Port, range 32, base 0xf040, size 32, enabled

vgapci0@pci0:1:0:0:	class=0x030000 rev=0xa1 hdr=0x00 vendor=0x10de device=0x1b81 subvendor=0x1458 subdevice=0x3773
    vendor     = 'NVIDIA Corporation'
    device     = 'GP104 [GeForce GTX 1070]'
    class      = display
    subclass   = VGA
    bar   [10] = type Memory, range 32, base 0xde000000, size 16777216, enabled
    bar   [14] = type Prefetchable Memory, range 64, base 0xc0000000, size 268435456, enabled
    bar   [1c] = type Prefetchable Memory, range 64, base 0xd0000000, size 33554432, enabled
    bar   [24] = type I/O Port, range 32, base 0xe000, size 128, enabled
    cap 01[60] = powerspec 3  supports D0 D3  current D0
    cap 05[68] = MSI supports 1 message, 64 bit 
    cap 10[78] = PCI-Express 2 legacy endpoint max data 256(256) NS
                 max read 512
                 link x16(x16) speed 2.5(8.0) ASPM disabled(L0s/L1) ClockPM disabled
    ecap 0002[100] = VC 1 max VC0
    ecap 0018[250] = LTR 1
    ecap 0004[128] = Power Budgeting 1
    ecap 0001[420] = AER 2 0 fatal 0 non-fatal 1 corrected
    ecap 000b[600] = Vendor [1] ID 0001 Rev 1 Length 36
    ecap 0019[900] = PCIe Sec 1 lane errors 0

hdac0@pci0:1:0:1:	class=0x040300 rev=0xa1 hdr=0x00 vendor=0x10de device=0x10f0 subvendor=0x1458 subdevice=0x3773
    vendor     = 'NVIDIA Corporation'
    device     = 'GP104 High Definition Audio Controller'
    class      = multimedia
    subclass   = HDA
    bar   [10] = type Memory, range 32, base 0xdf080000, size 16384, enabled
    cap 01[60] = powerspec 3  supports D0 D3  current D0
    cap 05[68] = MSI supports 1 message, 64 bit enabled with 1 message
    cap 10[78] = PCI-Express 2 endpoint max data 256(256) NS
                 max read 512
                 link x16(x16) speed 2.5(8.0) ASPM L0s/L1(L0s/L1) ClockPM disabled
    ecap 0001[100] = AER 2 0 fatal 0 non-fatal 1 corrected

pcib4@pci0:3:0:0:	class=0x060400 rev=0x00 hdr=0x01 vendor=0x1b21 device=0x1187 subvendor=0x1b21 subdevice=0x118f
    vendor     = 'ASMedia Technology Inc.'
    class      = bridge
    subclass   = PCI-PCI
    cap 05[50] = MSI supports 1 message, 64 bit 
    cap 01[78] = powerspec 3  supports D0 D3  current D0
    cap 10[80] = PCI-Express 2 upstream port max data 128(256) NS
                 max read 512
                 link x1(x1) speed 5.0(5.0) ASPM disabled(L0s/L1)
    cap 0d[c0] = PCI Bridge subvendor=0x1b21 subdevice=0x118f
    ecap 0002[100] = VC 1 max VC0
    ecap 0001[200] = AER 1 0 fatal 0 non-fatal 0 corrected
    ecap 000b[300] = Vendor [1] ID 0000 Rev 0 Length 3072

pcib5@pci0:4:1:0:	class=0x060400 rev=0x00 hdr=0x01 vendor=0x1b21 device=0x1187 subvendor=0x1b21 subdevice=0x118f
    vendor     = 'ASMedia Technology Inc.'
    class      = bridge
    subclass   = PCI-PCI
    cap 05[50] = MSI supports 1 message, 64 bit 
    cap 01[78] = powerspec 3  supports D0 D3  current D0
    cap 10[80] = PCI-Express 2 downstream port max data 128(256) RO NS
                 max read 512
                 link x1(x1) speed 2.5(5.0) ASPM disabled(L0s/L1)
                 slot 1 power limit 26000 mW
    cap 0d[c0] = PCI Bridge subvendor=0x1b21 subdevice=0x118f
    ecap 0002[100] = VC 1 max VC0
    ecap 0001[200] = AER 1 0 fatal 0 non-fatal 0 corrected

pcib6@pci0:4:2:0:	class=0x060400 rev=0x00 hdr=0x01 vendor=0x1b21 device=0x1187 subvendor=0x1b21 subdevice=0x118f
    vendor     = 'ASMedia Technology Inc.'
    class      = bridge
    subclass   = PCI-PCI
    cap 05[50] = MSI supports 1 message, 64 bit 
    cap 01[78] = powerspec 3  supports D0 D3  current D0
    cap 10[80] = PCI-Express 2 downstream port max data 128(256) NS
                 max read 512
                 link x1(x1) speed 2.5(5.0) ASPM disabled(L0s/L1)
                 slot 2 power limit 26000 mW
    cap 0d[c0] = PCI Bridge subvendor=0x1b21 subdevice=0x118f
    ecap 0002[100] = VC 1 max VC0
    ecap 0001[200] = AER 1 0 fatal 1 non-fatal 0 corrected

pcib7@pci0:4:3:0:	class=0x060400 rev=0x00 hdr=0x01 vendor=0x1b21 device=0x1187 subvendor=0x1b21 subdevice=0x118f
    vendor     = 'ASMedia Technology Inc.'
    class      = bridge
    subclass   = PCI-PCI
    cap 05[50] = MSI supports 1 message, 64 bit 
    cap 01[78] = powerspec 3  supports D0 D3  current D0
    cap 10[80] = PCI-Express 2 downstream port max data 128(256) NS
                 max read 512
                 link x1(x1) speed 5.0(5.0) ASPM disabled(L0s/L1)
                 slot 3 power limit 26000 mW
    cap 0d[c0] = PCI Bridge subvendor=0x1b21 subdevice=0x118f
    ecap 0002[100] = VC 1 max VC0
    ecap 0001[200] = AER 1 0 fatal 0 non-fatal 0 corrected

pcib8@pci0:4:4:0:	class=0x060400 rev=0x00 hdr=0x01 vendor=0x1b21 device=0x1187 subvendor=0x1b21 subdevice=0x118f
    vendor     = 'ASMedia Technology Inc.'
    class      = bridge
    subclass   = PCI-PCI
    cap 05[50] = MSI supports 1 message, 64 bit 
    cap 01[78] = powerspec 3  supports D0 D3  current D0
    cap 10[80] = PCI-Express 2 downstream port max data 128(256) RO NS
                 max read 512
                 link x0(x4) speed 0.0(5.0) ASPM disabled(L0s/L1)
                 slot 4 power limit 26000 mW
    cap 0d[c0] = PCI Bridge subvendor=0x1b21 subdevice=0x118f
    ecap 0002[100] = VC 1 max VC0
    ecap 0001[200] = AER 1 0 fatal 0 non-fatal 0 corrected

pcib9@pci0:4:5:0:	class=0x060400 rev=0x00 hdr=0x01 vendor=0x1b21 device=0x1187 subvendor=0x1b21 subdevice=0x118f
    vendor     = 'ASMedia Technology Inc.'
    class      = bridge
    subclass   = PCI-PCI
    cap 05[50] = MSI supports 1 message, 64 bit 
    cap 01[78] = powerspec 3  supports D0 D3  current D0
    cap 10[80] = PCI-Express 2 downstream port max data 128(256) RO NS
                 max read 512
                 link x1(x1) speed 2.5(5.0) ASPM disabled(L0s/L1)
                 slot 5 power limit 26000 mW
    cap 0d[c0] = PCI Bridge subvendor=0x1b21 subdevice=0x118f
    ecap 0002[100] = VC 1 max VC0
    ecap 0001[200] = AER 1 0 fatal 0 non-fatal 0 corrected

pcib10@pci0:4:6:0:	class=0x060400 rev=0x00 hdr=0x01 vendor=0x1b21 device=0x1187 subvendor=0x1b21 subdevice=0x118f
    vendor     = 'ASMedia Technology Inc.'
    class      = bridge
    subclass   = PCI-PCI
    cap 05[50] = MSI supports 1 message, 64 bit 
    cap 01[78] = powerspec 3  supports D0 D3  current D0
    cap 10[80] = PCI-Express 2 downstream port max data 128(256) NS
                 max read 512
                 link x1(x1) speed 5.0(5.0) ASPM disabled(L0s/L1)
                 slot 6 power limit 26000 mW
    cap 0d[c0] = PCI Bridge subvendor=0x1b21 subdevice=0x118f
    ecap 0002[100] = VC 1 max VC0
    ecap 0001[200] = AER 1 0 fatal 0 non-fatal 0 corrected

pcib11@pci0:4:7:0:	class=0x060400 rev=0x00 hdr=0x01 vendor=0x1b21 device=0x1187 subvendor=0x1b21 subdevice=0x118f
    vendor     = 'ASMedia Technology Inc.'
    class      = bridge
    subclass   = PCI-PCI
    cap 05[50] = MSI supports 1 message, 64 bit 
    cap 01[78] = powerspec 3  supports D0 D3  current D0
    cap 10[80] = PCI-Express 2 downstream port max data 128(256) RO NS
                 max read 512
                 link x1(x1) speed 2.5(5.0) ASPM disabled(L0s/L1)
                 slot 7 power limit 26000 mW
    cap 0d[c0] = PCI Bridge subvendor=0x1b21 subdevice=0x118f
    ecap 0002[100] = VC 1 max VC0
    ecap 0001[200] = AER 1 0 fatal 0 non-fatal 0 corrected

none1@pci0:6:0:0:	class=0x028000 rev=0x03 hdr=0x00 vendor=0x14e4 device=0x43b1 subvendor=0x1043 subdevice=0x855c
    vendor     = 'Broadcom Inc. and subsidiaries'
    device     = 'BCM4352 802.11ac Wireless Network Adapter'
    class      = network
    bar   [10] = type Memory, range 64, base 0xdfa00000, size 32768, enabled
    bar   [18] = type Memory, range 64, base 0xdf800000, size 2097152, enabled
    cap 01[48] = powerspec 3  supports D0 D1 D2 D3  current D0
    cap 05[58] = MSI supports 1 message, 64 bit 
    cap 09[68] = vendor (length 68)
    cap 10[ac] = PCI-Express 2 endpoint max data 128(256) NS
                 max read 512
                 link x1(x1) speed 2.5(2.5) ASPM disabled(L0s/L1) ClockPM disabled
    ecap 0001[100] = AER 1 0 fatal 0 non-fatal 0 corrected
    ecap 0003[13c] = Serial 1 6c7100ffff000001
    ecap 0004[150] = Power Budgeting 1
    ecap 0002[160] = VC 1 max VC0
    ecap 0018[1b0] = LTR 1
    ecap 0015[220] = Resizable BAR 1

ahci0@pci0:7:0:0:	class=0x010601 rev=0x02 hdr=0x00 vendor=0x1b21 device=0x0612 subvendor=0x1043 subdevice=0x858d
    vendor     = 'ASMedia Technology Inc.'
    device     = 'ASM1062 Serial ATA Controller'
    class      = mass storage
    subclass   = SATA
    bar   [10] = type I/O Port, range 32, base 0xd050, size 8, enabled
    bar   [14] = type I/O Port, range 32, base 0xd040, size 4, enabled
    bar   [18] = type I/O Port, range 32, base 0xd030, size 8, enabled
    bar   [1c] = type I/O Port, range 32, base 0xd020, size 4, enabled
    bar   [20] = type I/O Port, range 32, base 0xd000, size 32, enabled
    bar   [24] = type Memory, range 32, base 0xdfd00000, size 512, enabled
    cap 05[50] = MSI supports 1 message enabled with 1 message
    cap 01[78] = powerspec 3  supports D0 D3  current D0
    cap 10[80] = PCI-Express 2 legacy endpoint max data 128(512) NS
                 max read 512
                 link x1(x1) speed 5.0(5.0) ASPM disabled(L0s)
    ecap 0002[100] = VC 1 max VC0

xhci1@pci0:10:0:0:	class=0x0c0330 rev=0x00 hdr=0x00 vendor=0x1b21 device=0x1142 subvendor=0x1043 subdevice=0x85fd
    vendor     = 'ASMedia Technology Inc.'
    device     = 'ASM1042A USB 3.0 Host Controller'
    class      = serial bus
    subclass   = USB
    bar   [10] = type Memory, range 64, base 0xdfc00000, size 32768, enabled
    cap 05[50] = MSI supports 8 messages, 64 bit 
    cap 11[68] = MSI-X supports 8 messages, enabled
                 Table in map 0x10[0x2000], PBA in map 0x10[0x2080]
    cap 01[78] = powerspec 3  supports D0 D3  current D0
    cap 10[80] = PCI-Express 2 legacy endpoint max data 128(512) NS
                 max read 512
                 link x1(x1) speed 5.0(5.0) ASPM disabled(L0s/L1)
    ecap 0002[100] = VC 1 max VC0

ahci1@pci0:12:0:0:	class=0x010601 rev=0x02 hdr=0x00 vendor=0x1b21 device=0x0612 subvendor=0x1043 subdevice=0x85e2
    vendor     = 'ASMedia Technology Inc.'
    device     = 'ASM1062 Serial ATA Controller'
    class      = mass storage
    subclass   = SATA
    bar   [10] = type I/O Port, range 32, base 0xc050, size 8, enabled
    bar   [14] = type I/O Port, range 32, base 0xc040, size 4, enabled
    bar   [18] = type I/O Port, range 32, base 0xc030, size 8, enabled
    bar   [1c] = type I/O Port, range 32, base 0xc020, size 4, enabled
    bar   [20] = type I/O Port, range 32, base 0xc000, size 32, enabled
    bar   [24] = type Memory, range 32, base 0xdfe00000, size 512, enabled
    cap 05[50] = MSI supports 1 message enabled with 1 message
    cap 01[78] = powerspec 3  supports D0 D3  current D0
    cap 10[80] = PCI-Express 2 legacy endpoint max data 128(512) NS
                 max read 512
                 link x1(x1) speed 5.0(5.0) ASPM disabled(L0s)
    ecap 0002[100] = VC 1 max VC0
