hostb0@pci0:0:0:0:	class=0x060000 card=0x5a101002 chip=0x5a101002 rev=0x02 hdr=0x00
    vendor     = 'Advanced Micro Devices, Inc. [AMD/ATI]'
    device     = 'RD890 Northbridge only dual slot (2x16) PCI-e GFX Hydra part'
    class      = bridge
    subclass   = HOST-PCI
    bar   [1c] = type Memory, range 64, base 0xe0000000, size 268435456, enabled
    cap 08[f0] = HT MSI fixed address window enabled at 0xfee00000
    cap 08[c4] = HT slave
    cap 08[40] = HT retry mode
    cap 08[54] = HT unit ID clumping
    cap 08[9c] = HT Gen3
    cap 05[70] = MSI supports 4 messages 

none0@pci0:0:0:2:	class=0x080600 card=0x5a231002 chip=0x5a231002 rev=0x00 hdr=0x00
    vendor     = 'Advanced Micro Devices, Inc. [AMD/ATI]'
    device     = 'RD890S/RD990 I/O Memory Management Unit (IOMMU)'
    class      = base peripheral
    subclass   = IOMMU
    cap 0f[40] = unknown
    cap 05[54] = MSI supports 1 message, 64 bit 
    cap 08[64] = HT MSI fixed address window enabled at 0xfee00000

pcib1@pci0:0:2:0:	class=0x060400 card=0x5a101002 chip=0x5a161002 rev=0x00 hdr=0x01
    vendor     = 'Advanced Micro Devices, Inc. [AMD/ATI]'
    device     = 'RD890/RD9x0/RX980 PCI to PCI bridge (PCI Express GFX port 0)'
    class      = bridge
    subclass   = PCI-PCI
    cap 01[50] = powerspec 3  supports D0 D3  current D0
    cap 10[58] = PCI-Express 2 root port max data 128(128) RO NS ARI disabled
                 link x16(x16) speed undef(5.0) ASPM disabled(L0s/L1)
                 slot 2 power limit 0 mW HotPlug(empty) surprise Attn Button PC(off)
    cap 05[a0] = MSI supports 1 message enabled with 1 message
    cap 0d[b0] = PCI Bridge card=0x5a101002
    cap 08[b8] = HT MSI fixed address window enabled at 0xfee00000

pcib2@pci0:0:4:0:	class=0x060400 card=0x5a101002 chip=0x5a181002 rev=0x00 hdr=0x01
    vendor     = 'Advanced Micro Devices, Inc. [AMD/ATI]'
    device     = 'RD890/RD9x0/RX980 PCI to PCI bridge (PCI Express GPP Port 0)'
    class      = bridge
    subclass   = PCI-PCI
    cap 01[50] = powerspec 3  supports D0 D3  current D0
    cap 10[58] = PCI-Express 2 root port max data 128(128) RO NS ARI disabled
                 link x16(x4) speed undef(5.0) ASPM disabled(L0s/L1)
                 slot 4 power limit 0 mW HotPlug(empty) surprise Attn Button PC(off)
    cap 05[a0] = MSI supports 1 message enabled with 1 message
    cap 0d[b0] = PCI Bridge card=0x5a101002
    cap 08[b8] = HT MSI fixed address window enabled at 0xfee00000

pcib3@pci0:0:9:0:	class=0x060400 card=0x5a101002 chip=0x5a1c1002 rev=0x00 hdr=0x01
    vendor     = 'Advanced Micro Devices, Inc. [AMD/ATI]'
    device     = 'RD890/RD9x0/RX980 PCI to PCI bridge (PCI Express GPP Port 4)'
    class      = bridge
    subclass   = PCI-PCI
    cap 01[50] = powerspec 3  supports D0 D3  current D0
    cap 10[58] = PCI-Express 2 root port max data 128(128) RO NS ARI disabled
                 link x1(x2) speed 2.5(5.0) ASPM disabled(L0s/L1)
                 slot 9 power limit 0 mW HotPlug(present) surprise Attn Button PC(on)
    cap 05[a0] = MSI supports 1 message enabled with 1 message
    cap 0d[b0] = PCI Bridge card=0x5a101002
    cap 08[b8] = HT MSI fixed address window enabled at 0xfee00000

pcib4@pci0:0:10:0:	class=0x060400 card=0x5a101002 chip=0x5a1d1002 rev=0x00 hdr=0x01
    vendor     = 'Advanced Micro Devices, Inc. [AMD/ATI]'
    device     = 'RD890/RD9x0/RX980 PCI to PCI bridge (PCI Express GPP Port 5)'
    class      = bridge
    subclass   = PCI-PCI
    cap 01[50] = powerspec 3  supports D0 D3  current D0
    cap 10[58] = PCI-Express 2 root port max data 128(128) RO NS ARI disabled
                 link x1(x2) speed 2.5(5.0) ASPM disabled(L0s/L1)
                 slot 10 power limit 0 mW HotPlug(present) surprise Attn Button PC(on)
    cap 05[a0] = MSI supports 1 message enabled with 1 message
    cap 0d[b0] = PCI Bridge card=0x5a101002
    cap 08[b8] = HT MSI fixed address window enabled at 0xfee00000

pcib5@pci0:0:11:0:	class=0x060400 card=0x5a101002 chip=0x5a1f1002 rev=0x00 hdr=0x01
    vendor     = 'Advanced Micro Devices, Inc. [AMD/ATI]'
    device     = 'RD890/RD990 PCI to PCI bridge (PCI Express GFX2 port 0)'
    class      = bridge
    subclass   = PCI-PCI
    cap 01[50] = powerspec 3  supports D0 D3  current D0
    cap 10[58] = PCI-Express 2 root port max data 128(128) RO NS ARI disabled
                 link x16(x8) speed undef(5.0) ASPM disabled(L0s/L1)
                 slot 11 power limit 0 mW HotPlug(empty) surprise Attn Button PC(off)
    cap 05[a0] = MSI supports 1 message enabled with 1 message
    cap 0d[b0] = PCI Bridge card=0x5a101002
    cap 08[b8] = HT MSI fixed address window enabled at 0xfee00000

pcib6@pci0:0:12:0:	class=0x060400 card=0x5a101002 chip=0x5a201002 rev=0x00 hdr=0x01
    vendor     = 'Advanced Micro Devices, Inc. [AMD/ATI]'
    device     = 'RD890/RD990 PCI to PCI bridge (PCI Express GFX2 port 1)'
    class      = bridge
    subclass   = PCI-PCI
    cap 01[50] = powerspec 3  supports D0 D3  current D0
    cap 10[58] = PCI-Express 2 root port max data 128(128) RO NS ARI disabled
                 link x16(x8) speed undef(5.0) ASPM disabled(L0s/L1)
                 slot 12 power limit 0 mW HotPlug(empty) surprise Attn Button PC(off)
    cap 05[a0] = MSI supports 1 message enabled with 1 message
    cap 0d[b0] = PCI Bridge card=0x5a101002
    cap 08[b8] = HT MSI fixed address window enabled at 0xfee00000

pcib7@pci0:0:13:0:	class=0x060400 card=0x5a101002 chip=0x5a1e1002 rev=0x00 hdr=0x01
    vendor     = 'Advanced Micro Devices, Inc. [AMD/ATI]'
    device     = 'RD890/RD9x0/RX980 PCI to PCI bridge (PCI Express GPP2 Port 0)'
    class      = bridge
    subclass   = PCI-PCI
    cap 01[50] = powerspec 3  supports D0 D3  current D0
    cap 10[58] = PCI-Express 2 root port max data 128(128) RO NS ARI disabled
                 link x16(x4) speed undef(5.0) ASPM disabled(L0s/L1)
                 slot 13 power limit 0 mW HotPlug(empty) surprise Attn Button PC(off)
    cap 05[a0] = MSI supports 1 message enabled with 1 message
    cap 0d[b0] = PCI Bridge card=0x5a101002
    cap 08[b8] = HT MSI fixed address window enabled at 0xfee00000

ahci0@pci0:0:17:0:	class=0x010601 card=0x81631043 chip=0x43941002 rev=0x00 hdr=0x00
    vendor     = 'Advanced Micro Devices, Inc. [AMD/ATI]'
    device     = 'SB7x0/SB8x0/SB9x0 SATA Controller [AHCI mode]'
    class      = mass storage
    subclass   = SATA
    bar   [10] = type I/O Port, range 32, base 0x4020, size 8, enabled
    bar   [14] = type I/O Port, range 32, base 0x4040, size 4, enabled
    bar   [18] = type I/O Port, range 32, base 0x4028, size 8, enabled
    bar   [1c] = type I/O Port, range 32, base 0x4044, size 4, enabled
    bar   [20] = type I/O Port, range 32, base 0x4000, size 16, enabled
    bar   [24] = type Memory, range 32, base 0xf0b0d000, size 1024, enabled
    cap 12[70] = SATA Index-Data Pair

ohci0@pci0:0:18:0:	class=0x0c0310 card=0x81631043 chip=0x43971002 rev=0x00 hdr=0x00
    vendor     = 'Advanced Micro Devices, Inc. [AMD/ATI]'
    device     = 'SB7x0/SB8x0/SB9x0 USB OHCI0 Controller'
    class      = serial bus
    subclass   = USB
    bar   [10] = type Memory, range 32, base 0xf0b08000, size 4096, enabled

ohci1@pci0:0:18:1:	class=0x0c0310 card=0x81631043 chip=0x43981002 rev=0x00 hdr=0x00
    vendor     = 'Advanced Micro Devices, Inc. [AMD/ATI]'
    device     = 'SB7x0 USB OHCI1 Controller'
    class      = serial bus
    subclass   = USB
    bar   [10] = type Memory, range 32, base 0xf0b09000, size 4096, enabled

ehci0@pci0:0:18:2:	class=0x0c0320 card=0x81631043 chip=0x43961002 rev=0x00 hdr=0x00
    vendor     = 'Advanced Micro Devices, Inc. [AMD/ATI]'
    device     = 'SB7x0/SB8x0/SB9x0 USB EHCI Controller'
    class      = serial bus
    subclass   = USB
    bar   [10] = type Memory, range 32, base 0xf0b0e000, size 256, enabled
    cap 01[c0] = powerspec 2  supports D0 D1 D2 D3  current D0
    cap 0a[e4] = EHCI Debug Port at offset 0xe0 in map 0x14

ohci2@pci0:0:19:0:	class=0x0c0310 card=0x81631043 chip=0x43971002 rev=0x00 hdr=0x00
    vendor     = 'Advanced Micro Devices, Inc. [AMD/ATI]'
    device     = 'SB7x0/SB8x0/SB9x0 USB OHCI0 Controller'
    class      = serial bus
    subclass   = USB
    bar   [10] = type Memory, range 32, base 0xf0b0a000, size 4096, enabled

ohci3@pci0:0:19:1:	class=0x0c0310 card=0x81631043 chip=0x43981002 rev=0x00 hdr=0x00
    vendor     = 'Advanced Micro Devices, Inc. [AMD/ATI]'
    device     = 'SB7x0 USB OHCI1 Controller'
    class      = serial bus
    subclass   = USB
    bar   [10] = type Memory, range 32, base 0xf0b0b000, size 4096, enabled

ehci1@pci0:0:19:2:	class=0x0c0320 card=0x81631043 chip=0x43961002 rev=0x00 hdr=0x00
    vendor     = 'Advanced Micro Devices, Inc. [AMD/ATI]'
    device     = 'SB7x0/SB8x0/SB9x0 USB EHCI Controller'
    class      = serial bus
    subclass   = USB
    bar   [10] = type Memory, range 32, base 0xf0b0f000, size 256, enabled
    cap 01[c0] = powerspec 2  supports D0 D1 D2 D3  current D0
    cap 0a[e4] = EHCI Debug Port at offset 0xe0 in map 0x14

intsmb0@pci0:0:20:0:	class=0x0c0500 card=0x81631043 chip=0x43851002 rev=0x3d hdr=0x00
    vendor     = 'Advanced Micro Devices, Inc. [AMD/ATI]'
    device     = 'SBx00 SMBus Controller'
    class      = serial bus
    subclass   = SMBus
    cap 08[b0] = HT MSI fixed address window disabled at 0xfee00000

atapci0@pci0:0:20:1:	class=0x01018a card=0x81631043 chip=0x439c1002 rev=0x00 hdr=0x00
    vendor     = 'Advanced Micro Devices, Inc. [AMD/ATI]'
    device     = 'SB7x0/SB8x0/SB9x0 IDE Controller'
    class      = mass storage
    subclass   = ATA
    bar   [20] = type I/O Port, range 32, base 0x4010, size 16, enabled

hdac0@pci0:0:20:2:	class=0x040300 card=0x81631043 chip=0x43831002 rev=0x00 hdr=0x00
    vendor     = 'Advanced Micro Devices, Inc. [AMD/ATI]'
    device     = 'SBx00 Azalia (Intel HDA)'
    class      = multimedia
    subclass   = HDA
    bar   [10] = type Memory, range 64, base 0xf0b04000, size 16384, enabled
    cap 01[50] = powerspec 2  supports D0 D3  current D0

isab0@pci0:0:20:3:	class=0x060100 card=0x81631043 chip=0x439d1002 rev=0x00 hdr=0x00
    vendor     = 'Advanced Micro Devices, Inc. [AMD/ATI]'
    device     = 'SB7x0/SB8x0/SB9x0 LPC host controller'
    class      = bridge
    subclass   = PCI-ISA

pcib8@pci0:0:20:4:	class=0x060401 card=0x00000000 chip=0x43841002 rev=0x00 hdr=0x01
    vendor     = 'Advanced Micro Devices, Inc. [AMD/ATI]'
    device     = 'SBx00 PCI to PCI Bridge'
    class      = bridge
    subclass   = PCI-PCI

ohci4@pci0:0:20:5:	class=0x0c0310 card=0x81631043 chip=0x43991002 rev=0x00 hdr=0x00
    vendor     = 'Advanced Micro Devices, Inc. [AMD/ATI]'
    device     = 'SB7x0/SB8x0/SB9x0 USB OHCI2 Controller'
    class      = serial bus
    subclass   = USB
    bar   [10] = type Memory, range 32, base 0xf0b0c000, size 4096, enabled

hostb1@pci0:0:24:0:	class=0x060000 card=0x00000000 chip=0x16001022 rev=0x00 hdr=0x00
    vendor     = 'Advanced Micro Devices, Inc. [AMD]'
    device     = 'Family 15h Processor Function 0'
    class      = bridge
    subclass   = HOST-PCI
    cap 08[80] = HT host
    cap 08[a0] = HT host
    cap 08[c0] = HT host
    cap 08[e0] = HT host

hostb2@pci0:0:24:1:	class=0x060000 card=0x00000000 chip=0x16011022 rev=0x00 hdr=0x00
    vendor     = 'Advanced Micro Devices, Inc. [AMD]'
    device     = 'Family 15h Processor Function 1'
    class      = bridge
    subclass   = HOST-PCI

hostb3@pci0:0:24:2:	class=0x060000 card=0x00000000 chip=0x16021022 rev=0x00 hdr=0x00
    vendor     = 'Advanced Micro Devices, Inc. [AMD]'
    device     = 'Family 15h Processor Function 2'
    class      = bridge
    subclass   = HOST-PCI

hostb4@pci0:0:24:3:	class=0x060000 card=0x00000000 chip=0x16031022 rev=0x00 hdr=0x00
    vendor     = 'Advanced Micro Devices, Inc. [AMD]'
    device     = 'Family 15h Processor Function 3'
    class      = bridge
    subclass   = HOST-PCI
    cap 0f[f0] = unknown

hostb5@pci0:0:24:4:	class=0x060000 card=0x00000000 chip=0x16041022 rev=0x00 hdr=0x00
    vendor     = 'Advanced Micro Devices, Inc. [AMD]'
    device     = 'Family 15h Processor Function 4'
    class      = bridge
    subclass   = HOST-PCI
    cap 08[80] = HT host
    cap 08[e0] = HT host

hostb6@pci0:0:24:5:	class=0x060000 card=0x00000000 chip=0x16051022 rev=0x00 hdr=0x00
    vendor     = 'Advanced Micro Devices, Inc. [AMD]'
    device     = 'Family 15h Processor Function 5'
    class      = bridge
    subclass   = HOST-PCI

hostb7@pci0:0:25:0:	class=0x060000 card=0x00000000 chip=0x16001022 rev=0x00 hdr=0x00
    vendor     = 'Advanced Micro Devices, Inc. [AMD]'
    device     = 'Family 15h Processor Function 0'
    class      = bridge
    subclass   = HOST-PCI
    cap 08[80] = HT host
    cap 08[a0] = HT host
    cap 08[e0] = HT host

hostb8@pci0:0:25:1:	class=0x060000 card=0x00000000 chip=0x16011022 rev=0x00 hdr=0x00
    vendor     = 'Advanced Micro Devices, Inc. [AMD]'
    device     = 'Family 15h Processor Function 1'
    class      = bridge
    subclass   = HOST-PCI

hostb9@pci0:0:25:2:	class=0x060000 card=0x00000000 chip=0x16021022 rev=0x00 hdr=0x00
    vendor     = 'Advanced Micro Devices, Inc. [AMD]'
    device     = 'Family 15h Processor Function 2'
    class      = bridge
    subclass   = HOST-PCI

hostb10@pci0:0:25:3:	class=0x060000 card=0x00000000 chip=0x16031022 rev=0x00 hdr=0x00
    vendor     = 'Advanced Micro Devices, Inc. [AMD]'
    device     = 'Family 15h Processor Function 3'
    class      = bridge
    subclass   = HOST-PCI
    cap 0f[f0] = unknown

hostb11@pci0:0:25:4:	class=0x060000 card=0x00000000 chip=0x16041022 rev=0x00 hdr=0x00
    vendor     = 'Advanced Micro Devices, Inc. [AMD]'
    device     = 'Family 15h Processor Function 4'
    class      = bridge
    subclass   = HOST-PCI
    cap 08[80] = HT host
    cap 08[e0] = HT host

hostb12@pci0:0:25:5:	class=0x060000 card=0x00000000 chip=0x16051022 rev=0x00 hdr=0x00
    vendor     = 'Advanced Micro Devices, Inc. [AMD]'
    device     = 'Family 15h Processor Function 5'
    class      = bridge
    subclass   = HOST-PCI

em0@pci0:3:0:0:	class=0x020000 card=0x83691043 chip=0x10d38086 rev=0x00 hdr=0x00
    vendor     = 'Intel Corporation'
    device     = '82574L Gigabit Network Connection'
    class      = network
    subclass   = ethernet
    bar   [10] = type Memory, range 32, base 0xf0900000, size 131072, enabled
    bar   [18] = type I/O Port, range 32, base 0x1000, size 32, enabled
    bar   [1c] = type Memory, range 32, base 0xf0920000, size 16384, enabled
    cap 01[c8] = powerspec 2  supports D0 D3  current D0
    cap 05[d0] = MSI supports 1 message, 64 bit 
    cap 10[e0] = PCI-Express 1 endpoint max data 128(256) RO NS
                 link x1(x1) speed 2.5(2.5) ASPM disabled(L0s/L1)
    cap 11[a0] = MSI-X supports 5 messages, enabled
                 Table in map 0x1c[0x0], PBA in map 0x1c[0x2000]

em1@pci0:4:0:0:	class=0x020000 card=0x83691043 chip=0x10d38086 rev=0x00 hdr=0x00
    vendor     = 'Intel Corporation'
    device     = '82574L Gigabit Network Connection'
    class      = network
    subclass   = ethernet
    bar   [10] = type Memory, range 32, base 0xf0a00000, size 131072, enabled
    bar   [18] = type I/O Port, range 32, base 0x2000, size 32, enabled
    bar   [1c] = type Memory, range 32, base 0xf0a20000, size 16384, enabled
    cap 01[c8] = powerspec 2  supports D0 D3  current D0
    cap 05[d0] = MSI supports 1 message, 64 bit 
    cap 10[e0] = PCI-Express 1 endpoint max data 128(256) RO NS
                 link x1(x1) speed 2.5(2.5) ASPM disabled(L0s/L1)
    cap 11[a0] = MSI-X supports 5 messages, enabled
                 Table in map 0x1c[0x0], PBA in map 0x1c[0x2000]

vgapci0@pci0:8:1:0:	class=0x030000 card=0x20001a03 chip=0x20001a03 rev=0x10 hdr=0x00
    vendor     = 'ASPEED Technology, Inc.'
    device     = 'ASPEED Graphics Family'
    class      = display
    subclass   = VGA
    bar   [10] = type Memory, range 32, base 0xf0000000, size 8388608, enabled
    bar   [14] = type Memory, range 32, base 0xf0800000, size 131072, enabled
    bar   [18] = type I/O Port, range 32, base 0x3000, size 128, enabled
    cap 01[40] = powerspec 3  supports D0 D1 D2 D3  current D0
