hostb0@pci0:0:0:0:	class=0x060000 rev=0x12 hdr=0x00 vendor=0x8086 device=0x25c0 subvendor=0x8086 subdevice=0x8086
    vendor     = 'Intel Corporation'
    device     = '5000X Chipset Memory Controller Hub'
    class      = bridge
    subclass   = HOST-PCI
    cap 01[50] = powerspec 2  supports D0 D3  current D0
    cap 05[58] = MSI supports 2 messages 
    cap 10[6c] = PCI-Express 1 root port max data 128(256) NS
                 max read 128
                 link x4(x4) speed 2.5(2.5) ASPM disabled(L0s)
    ecap 0001[100] = AER 1 0 fatal 0 non-fatal 0 corrected

pcib1@pci0:0:2:0:	class=0x060400 rev=0x12 hdr=0x01 vendor=0x8086 device=0x25e2 subvendor=0x0000 subdevice=0x0000
    vendor     = 'Intel Corporation'
    device     = '5000 Series Chipset PCI Express x4 Port 2'
    class      = bridge
    subclass   = PCI-PCI
    cap 01[50] = powerspec 2  supports D0 D3  current D0
    cap 05[58] = MSI supports 2 messages 
    cap 10[6c] = PCI-Express 1 root port max data 128(256) NS
                 max read 128
                 link x4(x4) speed 2.5(2.5) ASPM disabled(L0s)
    ecap 0001[100] = AER 1 0 fatal 0 non-fatal 0 corrected

pcib7@pci0:0:3:0:	class=0x060400 rev=0x12 hdr=0x01 vendor=0x8086 device=0x25e3 subvendor=0x0000 subdevice=0x0000
    vendor     = 'Intel Corporation'
    device     = '5000 Series Chipset PCI Express x4 Port 3'
    class      = bridge
    subclass   = PCI-PCI
    cap 01[50] = powerspec 2  supports D0 D3  current D0
    cap 05[58] = MSI supports 2 messages 
    cap 10[6c] = PCI-Express 1 root port max data 256(256) NS
                 max read 128
                 link x4(x4) speed 2.5(2.5) ASPM disabled(L0s)
    ecap 0001[100] = AER 1 0 fatal 0 non-fatal 0 corrected

pcib8@pci0:0:4:0:	class=0x060400 rev=0x12 hdr=0x01 vendor=0x8086 device=0x25f8 subvendor=0x0000 subdevice=0x0000
    vendor     = 'Intel Corporation'
    device     = '5000 Series Chipset PCI Express x8 Port 4-5'
    class      = bridge
    subclass   = PCI-PCI
    cap 01[50] = powerspec 2  supports D0 D3  current D0
    cap 05[58] = MSI supports 2 messages 
    cap 10[6c] = PCI-Express 1 root port max data 128(256) NS
                 max read 128
                 link x4(x8) speed 2.5(2.5) ASPM disabled(L0s)
                 slot 1 power limit 25000 mW
    ecap 0001[100] = AER 1 0 fatal 0 non-fatal 0 corrected

pcib9@pci0:0:5:0:	class=0x060400 rev=0x12 hdr=0x01 vendor=0x8086 device=0x25e5 subvendor=0x0000 subdevice=0x0000
    vendor     = 'Intel Corporation'
    device     = '5000 Series Chipset PCI Express x4 Port 5'
    class      = bridge
    subclass   = PCI-PCI
    cap 01[50] = powerspec 2  supports D0 D3  current D0
    cap 05[58] = MSI supports 2 messages 
    cap 10[6c] = PCI-Express 1 root port max data 128(256) NS
                 max read 128
                 link x0(x4) speed 0.0(2.5) ASPM disabled(L0s)
    ecap 0001[100] = AER 1 0 fatal 0 non-fatal 0 corrected

pcib10@pci0:0:6:0:	class=0x060400 rev=0x12 hdr=0x01 vendor=0x8086 device=0x25f9 subvendor=0x0000 subdevice=0x0000
    vendor     = 'Intel Corporation'
    device     = '5000 Series Chipset PCI Express x8 Port 6-7'
    class      = bridge
    subclass   = PCI-PCI
    cap 01[50] = powerspec 2  supports D0 D3  current D0
    cap 05[58] = MSI supports 2 messages 
    cap 10[6c] = PCI-Express 1 root port max data 256(256) NS
                 max read 128
                 link x4(x8) speed 2.5(2.5) ASPM disabled(L0s)
                 slot 2 power limit 25000 mW
    ecap 0001[100] = AER 1 0 fatal 0 non-fatal 0 corrected

pcib14@pci0:0:7:0:	class=0x060400 rev=0x12 hdr=0x01 vendor=0x8086 device=0x25e7 subvendor=0x0000 subdevice=0x0000
    vendor     = 'Intel Corporation'
    device     = '5000 Series Chipset PCI Express x4 Port 7'
    class      = bridge
    subclass   = PCI-PCI
    cap 01[50] = powerspec 2  supports D0 D3  current D0
    cap 05[58] = MSI supports 2 messages 
    cap 10[6c] = PCI-Express 1 root port max data 128(256) NS
                 max read 128
                 link x0(x4) speed 0.0(2.5) ASPM disabled(L0s)
    ecap 0001[100] = AER 1 0 fatal 0 non-fatal 0 corrected

hostb1@pci0:0:16:0:	class=0x060000 rev=0x12 hdr=0x00 vendor=0x8086 device=0x25f0 subvendor=0x1028 subdevice=0x01b3
    vendor     = 'Intel Corporation'
    device     = '5000 Series Chipset FSB Registers'
    class      = bridge
    subclass   = HOST-PCI

hostb2@pci0:0:16:1:	class=0x060000 rev=0x12 hdr=0x00 vendor=0x8086 device=0x25f0 subvendor=0x1028 subdevice=0x01b3
    vendor     = 'Intel Corporation'
    device     = '5000 Series Chipset FSB Registers'
    class      = bridge
    subclass   = HOST-PCI

hostb3@pci0:0:16:2:	class=0x060000 rev=0x12 hdr=0x00 vendor=0x8086 device=0x25f0 subvendor=0x1028 subdevice=0x01b3
    vendor     = 'Intel Corporation'
    device     = '5000 Series Chipset FSB Registers'
    class      = bridge
    subclass   = HOST-PCI

hostb4@pci0:0:17:0:	class=0x060000 rev=0x12 hdr=0x00 vendor=0x8086 device=0x25f1 subvendor=0x8086 subdevice=0x8086
    vendor     = 'Intel Corporation'
    device     = '5000 Series Chipset Reserved Registers'
    class      = bridge
    subclass   = HOST-PCI

hostb5@pci0:0:19:0:	class=0x060000 rev=0x12 hdr=0x00 vendor=0x8086 device=0x25f3 subvendor=0x8086 subdevice=0x8086
    vendor     = 'Intel Corporation'
    device     = '5000 Series Chipset Reserved Registers'
    class      = bridge
    subclass   = HOST-PCI

hostb6@pci0:0:21:0:	class=0x060000 rev=0x12 hdr=0x00 vendor=0x8086 device=0x25f5 subvendor=0x8086 subdevice=0x8086
    vendor     = 'Intel Corporation'
    device     = '5000 Series Chipset FBD Registers'
    class      = bridge
    subclass   = HOST-PCI

hostb7@pci0:0:22:0:	class=0x060000 rev=0x12 hdr=0x00 vendor=0x8086 device=0x25f6 subvendor=0x8086 subdevice=0x8086
    vendor     = 'Intel Corporation'
    device     = '5000 Series Chipset FBD Registers'
    class      = bridge
    subclass   = HOST-PCI

pcib15@pci0:0:28:0:	class=0x060400 rev=0x09 hdr=0x01 vendor=0x8086 device=0x2690 subvendor=0x1028 subdevice=0x01b3
    vendor     = 'Intel Corporation'
    device     = '631xESB/632xESB/3100 Chipset PCI Express Root Port 1'
    class      = bridge
    subclass   = PCI-PCI
    cap 10[40] = PCI-Express 1 root port max data 128(128)
                 max read 128
                 link x4(x4) speed 2.5(2.5) ASPM disabled(L0s/L1)
    cap 05[80] = MSI supports 1 message 
    cap 0d[90] = PCI Bridge subvendor=0x1028 subdevice=0x01b3
    cap 01[a0] = powerspec 2  supports D0 D3  current D0
    ecap 0002[100] = VC 1 max VC1
    ecap 0005[180] = Root Complex Link Declaration 1

uhci0@pci0:0:29:0:	class=0x0c0300 rev=0x09 hdr=0x00 vendor=0x8086 device=0x2688 subvendor=0x1028 subdevice=0x01b3
    vendor     = 'Intel Corporation'
    device     = '631xESB/632xESB/3100 Chipset UHCI USB Controller'
    class      = serial bus
    subclass   = USB
    bar   [20] = type I/O Port, range 32, base 0xace0, size 32, enabled

uhci1@pci0:0:29:1:	class=0x0c0300 rev=0x09 hdr=0x00 vendor=0x8086 device=0x2689 subvendor=0x1028 subdevice=0x01b3
    vendor     = 'Intel Corporation'
    device     = '631xESB/632xESB/3100 Chipset UHCI USB Controller'
    class      = serial bus
    subclass   = USB
    bar   [20] = type I/O Port, range 32, base 0xacc0, size 32, enabled

uhci2@pci0:0:29:2:	class=0x0c0300 rev=0x09 hdr=0x00 vendor=0x8086 device=0x268a subvendor=0x1028 subdevice=0x01b3
    vendor     = 'Intel Corporation'
    device     = '631xESB/632xESB/3100 Chipset UHCI USB Controller'
    class      = serial bus
    subclass   = USB
    bar   [20] = type I/O Port, range 32, base 0xaca0, size 32, enabled

uhci3@pci0:0:29:3:	class=0x0c0300 rev=0x09 hdr=0x00 vendor=0x8086 device=0x268b subvendor=0x1028 subdevice=0x01b3
    vendor     = 'Intel Corporation'
    device     = '631xESB/632xESB/3100 Chipset UHCI USB Controller'
    class      = serial bus
    subclass   = USB
    bar   [20] = type I/O Port, range 32, base 0xac80, size 32, enabled

ehci0@pci0:0:29:7:	class=0x0c0320 rev=0x09 hdr=0x00 vendor=0x8086 device=0x268c subvendor=0x1028 subdevice=0x01b3
    vendor     = 'Intel Corporation'
    device     = '631xESB/632xESB/3100 Chipset EHCI USB2 Controller'
    class      = serial bus
    subclass   = USB
    bar   [10] = type Memory, range 32, base 0xfcd00000, size 1024, enabled
    cap 01[50] = powerspec 2  supports D0 D3  current D0
    cap 0a[58] = EHCI Debug Port at offset 0xa0 in map 0x14

pcib17@pci0:0:30:0:	class=0x060401 rev=0xd9 hdr=0x01 vendor=0x8086 device=0x244e subvendor=0x0000 subdevice=0x0000
    vendor     = 'Intel Corporation'
    device     = '82801 PCI Bridge'
    class      = bridge
    subclass   = PCI-PCI
    cap 0d[50] = PCI Bridge subvendor=0x0000 subdevice=0x0000

isab0@pci0:0:31:0:	class=0x060100 rev=0x09 hdr=0x00 vendor=0x8086 device=0x2670 subvendor=0x0000 subdevice=0x0000
    vendor     = 'Intel Corporation'
    device     = '631xESB/632xESB/3100 Chipset LPC Interface Controller'
    class      = bridge
    subclass   = PCI-ISA

pcib2@pci0:4:0:0:	class=0x060400 rev=0x01 hdr=0x01 vendor=0x8086 device=0x3500 subvendor=0x0000 subdevice=0x0000
    vendor     = 'Intel Corporation'
    device     = '6311ESB/6321ESB PCI Express Upstream Port'
    class      = bridge
    subclass   = PCI-PCI
    cap 10[44] = PCI-Express 1 upstream port max data 128(256)
                 max read 4096
                 link x4(x8) speed 2.5(2.5) ASPM disabled(L0s)
    cap 01[70] = powerspec 2  supports D0 D3  current D0
    cap 0d[80] = PCI Bridge subvendor=0x0000 subdevice=0x0000
    ecap 0001[100] = AER 1 0 fatal 1 non-fatal 0 corrected

pcib6@pci0:4:0:3:	class=0x060400 rev=0x01 hdr=0x01 vendor=0x8086 device=0x350c subvendor=0x0000 subdevice=0x0000
    vendor     = 'Intel Corporation'
    device     = '6311ESB/6321ESB PCI Express to PCI-X Bridge'
    class      = bridge
    subclass   = PCI-PCI
    cap 10[44] = PCI-Express 1 PCI bridge max data 128(256)
                 max read 256
                 link x4(x8) speed 2.5(2.5) ASPM disabled(L0s)
    cap 01[6c] = powerspec 2  supports D0 D3  current D0
    cap 0d[80] = PCI Bridge subvendor=0x0000 subdevice=0x0000
    cap 07[d8] = PCI-X bridge 
    ecap 0001[100] = AER 1 0 fatal 1 non-fatal 0 corrected

pcib3@pci0:5:0:0:	class=0x060400 rev=0x01 hdr=0x01 vendor=0x8086 device=0x3510 subvendor=0x0000 subdevice=0x0000
    vendor     = 'Intel Corporation'
    device     = '6311ESB/6321ESB PCI Express Downstream Port E1'
    class      = bridge
    subclass   = PCI-PCI
    cap 10[44] = PCI-Express 1 downstream port max data 128(256)
                 max read 4096
                 link x4(x4) speed 2.5(2.5) ASPM disabled(L0s)
    cap 05[60] = MSI supports 1 message, 64 bit 
    cap 01[70] = powerspec 2  supports D0 D3  current D0
    cap 0d[80] = PCI Bridge subvendor=0x0000 subdevice=0x0000
    ecap 0001[100] = AER 1 0 fatal 0 non-fatal 0 corrected

pcib5@pci0:5:1:0:	class=0x060400 rev=0x01 hdr=0x01 vendor=0x8086 device=0x3514 subvendor=0x0000 subdevice=0x0000
    vendor     = 'Intel Corporation'
    device     = '6311ESB/6321ESB PCI Express Downstream Port E2'
    class      = bridge
    subclass   = PCI-PCI
    cap 10[44] = PCI-Express 1 downstream port max data 128(256)
                 max read 4096
                 link x0(x4) speed 0.0(2.5) ASPM disabled(L0s)
    cap 05[60] = MSI supports 1 message, 64 bit 
    cap 01[70] = powerspec 2  supports D0 D3  current D0
    cap 0d[80] = PCI Bridge subvendor=0x0000 subdevice=0x0000
    ecap 0001[100] = AER 1 0 fatal 0 non-fatal 0 corrected

pcib4@pci0:6:0:0:	class=0x060400 rev=0xc3 hdr=0x01 vendor=0x1166 device=0x0103 subvendor=0x0000 subdevice=0x0000
    vendor     = 'Broadcom'
    device     = 'EPB PCI-Express to PCI-X Bridge'
    class      = bridge
    subclass   = PCI-PCI
    cap 10[60] = PCI-Express 1 PCI bridge max data 128(128)
                 max read 128
                 link x4(x4) speed 2.5(2.5) ASPM disabled(L0s/L1)
    cap 07[90] = PCI-X bridge 
    cap 01[b0] = powerspec 2  supports D0 D3  current D0
    ecap 0001[100] = AER 1 0 fatal 0 non-fatal 0 corrected
    ecap 0004[14c] = Power Budgeting 1
    ecap 0003[160] = Serial 1 002219fffe5d2d66

bce0@pci0:7:0:0:	class=0x020000 rev=0x12 hdr=0x00 vendor=0x14e4 device=0x164c subvendor=0x1028 subdevice=0x01b3
    vendor     = 'Broadcom Inc. and subsidiaries'
    device     = 'NetXtreme II BCM5708 Gigabit Ethernet'
    class      = network
    subclass   = ethernet
    bar   [10] = type Memory, range 64, base 0xf4000000, size 33554432, enabled
    cap 07[40] = PCI-X 64-bit supports 133MHz, 512 burst read, 8 split transactions
    cap 01[48] = powerspec 2  supports D0 D3  current D0
    cap 03[50] = VPD
    cap 05[58] = MSI supports 1 message, 64 bit enabled with 1 message

mfi0@pci0:1:0:0:	class=0x010400 rev=0x04 hdr=0x00 vendor=0x1000 device=0x0060 subvendor=0x1028 subdevice=0x1f0c
    vendor     = 'Broadcom / LSI'
    device     = 'MegaRAID SAS 1078'
    class      = mass storage
    subclass   = RAID
    bar   [10] = type Memory, range 64, base 0xfcc80000, size 262144, enabled
    bar   [18] = type I/O Port, range 32, base 0xec00, size 256, enabled
    bar   [1c] = type Memory, range 64, base 0xfcc40000, size 262144, enabled
    cap 10[b0] = PCI-Express 1 endpoint max data 256(256) RO NS
                 max read 2048
                 link x4(x8) speed 2.5(2.5) ASPM disabled(L0s)
    cap 05[c4] = MSI supports 4 messages, 64 bit enabled with 1 message
    cap 11[d4] = MSI-X supports 4 messages
                 Table in map 0x10[0x3e000], PBA in map 0x10[0xfff000]
    cap 01[e0] = powerspec 2  supports D0 D1 D3  current D0
    cap 03[ec] = VPD
    ecap 0004[100] = Power Budgeting 1

pcib11@pci0:12:0:0:	class=0x060400 rev=0x0e hdr=0x01 vendor=0x111d device=0x8018 subvendor=0x0000 subdevice=0x0000
    vendor     = 'Microsemi / PMC / IDT'
    device     = 'PES12N3A 12-lane 3-Port PCI Express Switch'
    class      = bridge
    subclass   = PCI-PCI
    cap 10[40] = PCI-Express 1 upstream port max data 256(2048)
                 max read 128
                 link x4(x4) speed 2.5(2.5) ASPM disabled(L0s/L1)
    cap 01[c0] = powerspec 3  supports D0 D3  current D0
    ecap 0001[100] = AER 1 0 fatal 1 non-fatal 1 corrected
    ecap 0002[200] = VC 1 max VC0

pcib12@pci0:13:2:0:	class=0x060400 rev=0x0e hdr=0x01 vendor=0x111d device=0x8018 subvendor=0x0000 subdevice=0x0000
    vendor     = 'Microsemi / PMC / IDT'
    device     = 'PES12N3A 12-lane 3-Port PCI Express Switch'
    class      = bridge
    subclass   = PCI-PCI
    cap 10[40] = PCI-Express 1 downstream port max data 256(2048)
                 max read 128
                 link x4(x4) speed 2.5(2.5) ASPM disabled(L0s/L1)
    cap 01[c0] = powerspec 3  supports D0 D3  current D0
    cap 05[d0] = MSI supports 1 message, 64 bit 
    ecap 0001[100] = AER 1 0 fatal 1 non-fatal 1 corrected
    ecap 0002[200] = VC 1 max VC0

pcib13@pci0:13:4:0:	class=0x060400 rev=0x0e hdr=0x01 vendor=0x111d device=0x8018 subvendor=0x0000 subdevice=0x0000
    vendor     = 'Microsemi / PMC / IDT'
    device     = 'PES12N3A 12-lane 3-Port PCI Express Switch'
    class      = bridge
    subclass   = PCI-PCI
    cap 10[40] = PCI-Express 1 downstream port max data 256(2048)
                 max read 128
                 link x4(x4) speed 2.5(2.5) ASPM disabled(L0s/L1)
    cap 01[c0] = powerspec 3  supports D0 D3  current D0
    cap 05[d0] = MSI supports 1 message, 64 bit 
    ecap 0001[100] = AER 1 0 fatal 1 non-fatal 1 corrected
    ecap 0002[200] = VC 1 max VC0

em0@pci0:14:0:0:	class=0x020000 rev=0x06 hdr=0x00 vendor=0x8086 device=0x10bc subvendor=0x103c subdevice=0x704b
    vendor     = 'Intel Corporation'
    device     = '82571EB/82571GB Gigabit Ethernet Controller (Copper)'
    class      = network
    subclass   = ethernet
    bar   [10] = type Memory, range 32, base 0xfc9e0000, size 131072, enabled
    bar   [14] = type Memory, range 32, base 0xfc900000, size 524288, enabled
    bar   [18] = type I/O Port, range 32, base 0xdce0, size 32, disabled
    cap 01[c8] = powerspec 2  supports D0 D3  current D0
    cap 05[d0] = MSI supports 1 message, 64 bit enabled with 1 message
    cap 10[e0] = PCI-Express 1 endpoint max data 256(256) RO NS
                 max read 512
                 link x4(x4) speed 2.5(2.5) ASPM disabled(L0s)
    ecap 0001[100] = AER 1 0 fatal 1 non-fatal 0 corrected
    ecap 0003[140] = Serial 1 002655ffffd91858

em1@pci0:14:0:1:	class=0x020000 rev=0x06 hdr=0x00 vendor=0x8086 device=0x10bc subvendor=0x103c subdevice=0x704b
    vendor     = 'Intel Corporation'
    device     = '82571EB/82571GB Gigabit Ethernet Controller (Copper)'
    class      = network
    subclass   = ethernet
    bar   [10] = type Memory, range 32, base 0xfc9c0000, size 131072, enabled
    bar   [14] = type Memory, range 32, base 0xfc880000, size 524288, enabled
    bar   [18] = type I/O Port, range 32, base 0xdcc0, size 32, disabled
    cap 01[c8] = powerspec 2  supports D0 D3  current D0
    cap 05[d0] = MSI supports 1 message, 64 bit enabled with 1 message
    cap 10[e0] = PCI-Express 1 endpoint max data 256(256) RO NS
                 max read 512
                 link x4(x4) speed 2.5(2.5) ASPM disabled(L0s)
    ecap 0001[100] = AER 1 0 fatal 1 non-fatal 0 corrected
    ecap 0003[140] = Serial 1 002655ffffd91858

em2@pci0:15:0:0:	class=0x020000 rev=0x06 hdr=0x00 vendor=0x8086 device=0x10bc subvendor=0x103c subdevice=0x704b
    vendor     = 'Intel Corporation'
    device     = '82571EB/82571GB Gigabit Ethernet Controller (Copper)'
    class      = network
    subclass   = ethernet
    bar   [10] = type Memory, range 32, base 0xfc6e0000, size 131072, enabled
    bar   [14] = type Memory, range 32, base 0xfc600000, size 524288, enabled
    bar   [18] = type I/O Port, range 32, base 0xcce0, size 32, disabled
    cap 01[c8] = powerspec 2  supports D0 D3  current D0
    cap 05[d0] = MSI supports 1 message, 64 bit enabled with 1 message
    cap 10[e0] = PCI-Express 1 endpoint max data 256(256) RO NS
                 max read 512
                 link x4(x4) speed 2.5(2.5) ASPM disabled(L0s)
    ecap 0001[100] = AER 1 0 fatal 1 non-fatal 0 corrected
    ecap 0003[140] = Serial 1 002655ffffd9185a

em3@pci0:15:0:1:	class=0x020000 rev=0x06 hdr=0x00 vendor=0x8086 device=0x10bc subvendor=0x103c subdevice=0x704b
    vendor     = 'Intel Corporation'
    device     = '82571EB/82571GB Gigabit Ethernet Controller (Copper)'
    class      = network
    subclass   = ethernet
    bar   [10] = type Memory, range 32, base 0xfc6c0000, size 131072, enabled
    bar   [14] = type Memory, range 32, base 0xfc580000, size 524288, enabled
    bar   [18] = type I/O Port, range 32, base 0xccc0, size 32, disabled
    cap 01[c8] = powerspec 2  supports D0 D3  current D0
    cap 05[d0] = MSI supports 1 message, 64 bit enabled with 1 message
    cap 10[e0] = PCI-Express 1 endpoint max data 256(256) RO NS
                 max read 512
                 link x4(x4) speed 2.5(2.5) ASPM disabled(L0s)
    ecap 0001[100] = AER 1 0 fatal 1 non-fatal 0 corrected
    ecap 0003[140] = Serial 1 002655ffffd9185a

pcib16@pci0:2:0:0:	class=0x060400 rev=0xc3 hdr=0x01 vendor=0x1166 device=0x0103 subvendor=0x0000 subdevice=0x0000
    vendor     = 'Broadcom'
    device     = 'EPB PCI-Express to PCI-X Bridge'
    class      = bridge
    subclass   = PCI-PCI
    cap 10[60] = PCI-Express 1 PCI bridge max data 128(128)
                 max read 128
                 link x4(x4) speed 2.5(2.5) ASPM disabled(L0s/L1)
    cap 07[90] = PCI-X bridge 
    cap 01[b0] = powerspec 2  supports D0 D3  current D0
    ecap 0001[100] = AER 1 0 fatal 0 non-fatal 0 corrected
    ecap 0004[14c] = Power Budgeting 1
    ecap 0003[160] = Serial 1 002219fffe5d2d64

bce1@pci0:3:0:0:	class=0x020000 rev=0x12 hdr=0x00 vendor=0x14e4 device=0x164c subvendor=0x1028 subdevice=0x01b3
    vendor     = 'Broadcom Inc. and subsidiaries'
    device     = 'NetXtreme II BCM5708 Gigabit Ethernet'
    class      = network
    subclass   = ethernet
    bar   [10] = type Memory, range 64, base 0xf8000000, size 33554432, enabled
    cap 07[40] = PCI-X 64-bit supports 133MHz, 512 burst read, 8 split transactions
    cap 01[48] = powerspec 2  supports D0 D3  current D0
    cap 03[50] = VPD
    cap 05[58] = MSI supports 1 message, 64 bit enabled with 1 message

vgapci0@pci0:17:13:0:	class=0x030000 rev=0x02 hdr=0x00 vendor=0x1002 device=0x515e subvendor=0x1028 subdevice=0x01b3
    vendor     = 'Advanced Micro Devices, Inc. [AMD/ATI]'
    device     = 'ES1000'
    class      = display
    subclass   = VGA
    bar   [10] = type Prefetchable Memory, range 32, base 0xd8000000, size 134217728, enabled
    bar   [14] = type I/O Port, range 32, base 0xbc00, size 256, enabled
    bar   [18] = type Memory, range 32, base 0xfc2d0000, size 65536, enabled
    cap 01[50] = powerspec 2  supports D0 D1 D2 D3  current D0
