pcib1@pci0:0:0:0:	class=0x060400 rev=0x01 hdr=0x01 vendor=0x1d87 device=0x3566 subvendor=0x0000 subdevice=0x0000
    vendor     = 'Rockchip Electronics Co., Ltd'
    device     = 'RK3568 Remote Signal Processor'
    class      = bridge
    subclass   = PCI-PCI
    cap 01[40] = powerspec 3  supports D0 D1 D2 D3  current D0
    cap 05[50] = MSI supports 32 messages, 64 bit 
    cap 10[70] = PCI-Express 2 root port max data 128(128) RO
                 max read 512
                 link x1(x1) speed 5.0(8.0) ASPM disabled(L0s/L1)
    cap 11[b0] = MSI-X supports 1 message
                 Table in map 0x10[0x0], PBA in map 0x10[0x10]
    ecap 0001[100] = AER 2 0 fatal 0 non-fatal 0 corrected
    ecap 0019[148] = PCIe Sec 1 lane errors 0
    ecap 001e[160] = L1 PM Substates 1
    ecap 000b[170] = Vendor [1] ID 0002 Rev 4 Length 256

none0@pci0:1:0:0:	class=0x020000 rev=0x05 hdr=0x00 vendor=0x10ec device=0x8125 subvendor=0x10ec subdevice=0x8125
    vendor     = 'Realtek Semiconductor Co., Ltd.'
    device     = 'RTL8125 2.5GbE Controller'
    class      = network
    subclass   = ethernet
    bar   [10] = type I/O Port, range 32, base 0, size 256, disabled
    bar   [18] = type Memory, range 64, base 0, size 65536, disabled
    bar   [20] = type Memory, range 64, base 0, size 16384, disabled
    cap 01[40] = powerspec 3  supports D0 D1 D2 D3  current D0
    cap 05[50] = MSI supports 1 message, 64 bit, vector masks 
    cap 10[70] = PCI-Express 2 endpoint MSI 1 max data 128(256) RO
                 max read 512
                 link x1(x1) speed 5.0(5.0) ASPM disabled(L0s/L1) ClockPM disabled
    cap 11[b0] = MSI-X supports 32 messages
                 Table in map 0x20[0x0], PBA in map 0x20[0x800]
    cap 03[d0] = VPD
    ecap 0001[100] = AER 2 0 fatal 0 non-fatal 0 corrected
    ecap 0002[148] = VC 1 max VC0
    ecap 0003[168] = Serial 1 0000000000000000
    ecap 0017[178] = TPH Requester 1
    ecap 0018[204] = LTR 1
    ecap 001e[20c] = L1 PM Substates 1
    ecap 000b[21c] = Vendor [1] ID 0002 Rev 4 Length 256

pcib3@pci2:0:0:0:	class=0x060400 rev=0x01 hdr=0x01 vendor=0x1d87 device=0x3566 subvendor=0x0000 subdevice=0x0000
    vendor     = 'Rockchip Electronics Co., Ltd'
    device     = 'RK3568 Remote Signal Processor'
    class      = bridge
    subclass   = PCI-PCI
    cap 01[40] = powerspec 3  supports D0 D1 D2 D3  current D0
    cap 05[50] = MSI supports 32 messages, 64 bit 
    cap 10[70] = PCI-Express 2 root port MSI 8 max data 128(256) RO
                 max read 512
                 link x1(x1) speed 5.0(8.0) ASPM disabled(L1)
    cap 11[b0] = MSI-X supports 128 messages
                 Table in map 0x20[0x20000], PBA in map 0x20[0x28000]
    ecap 0001[100] = AER 2 0 fatal 0 non-fatal 0 corrected
    ecap 0019[148] = PCIe Sec 1 lane errors 0
    ecap 001e[160] = L1 PM Substates 1
    ecap 000b[170] = Vendor [1] ID 0002 Rev 4 Length 256

none1@pci2:1:0:0:	class=0x020000 rev=0x05 hdr=0x00 vendor=0x10ec device=0x8125 subvendor=0x10ec subdevice=0x8125
    vendor     = 'Realtek Semiconductor Co., Ltd.'
    device     = 'RTL8125 2.5GbE Controller'
    class      = network
    subclass   = ethernet
    bar   [10] = type I/O Port, range 32, base 0, size 256, disabled
    bar   [18] = type Memory, range 64, base 0, size 65536, disabled
    bar   [20] = type Memory, range 64, base 0, size 16384, disabled
    cap 01[40] = powerspec 3  supports D0 D1 D2 D3  current D0
    cap 05[50] = MSI supports 1 message, 64 bit, vector masks 
    cap 10[70] = PCI-Express 2 endpoint MSI 1 max data 128(256) RO
                 max read 512
                 link x1(x1) speed 5.0(5.0) ASPM disabled(L0s/L1) ClockPM disabled
    cap 11[b0] = MSI-X supports 32 messages
                 Table in map 0x20[0x0], PBA in map 0x20[0x800]
    cap 03[d0] = VPD
    ecap 0001[100] = AER 2 0 fatal 0 non-fatal 0 corrected
    ecap 0002[148] = VC 1 max VC0
    ecap 0003[168] = Serial 1 0000000000000000
    ecap 0017[178] = TPH Requester 1
    ecap 0018[204] = LTR 1
    ecap 001e[20c] = L1 PM Substates 1
    ecap 000b[21c] = Vendor [1] ID 0002 Rev 4 Length 256

pcib5@pci4:0:0:0:	class=0x060400 rev=0x01 hdr=0x01 vendor=0x1d87 device=0x3566 subvendor=0x0000 subdevice=0x0000
    vendor     = 'Rockchip Electronics Co., Ltd'
    device     = 'RK3568 Remote Signal Processor'
    class      = bridge
    subclass   = PCI-PCI
    bar   [10] = type Memory, range 64, base 0, size 1073741824, enabled
    cap 01[40] = powerspec 3  supports D0 D1 D2 D3  current D0
    cap 05[50] = MSI supports 32 messages, 64 bit, vector masks 
    cap 10[70] = PCI-Express 2 root port MSI 8 max data 128(256) RO
                 max read 512
                 link x1(x2) speed 8.0(8.0) ASPM disabled(L1)
    cap 11[b0] = MSI-X supports 128 messages
                 Table in map 0x20[0x20000], PBA in map 0x20[0x28000]
    ecap 0001[100] = AER 2 0 fatal 0 non-fatal 0 corrected
    ecap 0019[148] = PCIe Sec 1 lane errors 0
    ecap 001e[160] = L1 PM Substates 1
    ecap 000b[1a0] = Vendor [1] ID 0002 Rev 4 Length 256
    ecap 000b[2a0] = Vendor [1] ID 0006 Rev 0 Length 24

nvme0@pci4:1:0:0:	class=0x010802 rev=0x03 hdr=0x00 vendor=0x126f device=0x2263 subvendor=0x126f subdevice=0x2263
    vendor     = 'Silicon Motion, Inc.'
    device     = 'SM2263EN/SM2263XT SSD Controller'
    class      = mass storage
    subclass   = NVM
    bar   [10] = type Memory, range 64, base 0, size 16384, enabled
    cap 01[40] = powerspec 3  supports D0 D3  current D0
    cap 05[50] = MSI supports 8 messages, 64 bit, vector masks 
    cap 10[70] = PCI-Express 2 endpoint max data 128(128) FLR RO
                 max read 512
                 link x1(x4) speed 8.0(8.0) ASPM disabled(L1) ClockPM disabled
    cap 11[b0] = MSI-X supports 16 messages, enabled
                 Table in map 0x10[0x2000], PBA in map 0x10[0x2100]
    ecap 0001[100] = AER 2 0 fatal 0 non-fatal 0 corrected
    ecap 0019[158] = PCIe Sec 1 lane errors 0
    ecap 0018[178] = LTR 1
    ecap 001e[180] = L1 PM Substates 1
