hostb0@pci0:0:0:0:	class=0x060000 card=0xff001179 chip=0x27a08086 rev=0x03 hdr=0x00
    vendor     = 'Intel Corporation'
    device     = 'Mobile 945GM/PM/GMS, 943/940GML and 945GT Express Memory Controller Hub'
    class      = bridge
    subclass   = HOST-PCI
    cap 09[e0] = vendor (length 9) Intel cap 5 version 1

pcib1@pci0:0:1:0:	class=0x060400 card=0xff001179 chip=0x27a18086 rev=0x03 hdr=0x01
    vendor     = 'Intel Corporation'
    device     = 'Mobile 945GM/PM/GMS, 943/940GML and 945GT Express PCI Express Root Port'
    class      = bridge
    subclass   = PCI-PCI
    cap 0d[88] = PCI Bridge card=0xff001179
    cap 01[80] = powerspec 2  supports D0 D3  current D0
    cap 05[90] = MSI supports 1 message 
    cap 10[a0] = PCI-Express 1 root port max data 128(128)
                 link x16(x16) speed 2.5(2.5) ASPM L0s/L1(L0s/L1)
                 slot 1 power limit 75000 mW
    ecap 0002[100] = VC 1 max VC0
    ecap 0005[140] = Root Complex Link Declaration 1

hdac0@pci0:0:27:0:	class=0x040300 card=0xff001179 chip=0x27d88086 rev=0x02 hdr=0x00
    vendor     = 'Intel Corporation'
    device     = 'NM10/ICH7 Family High Definition Audio Controller'
    class      = multimedia
    subclass   = HDA
    bar   [10] = type Memory, range 64, base 0xd0500000, size 16384, enabled
    cap 01[50] = powerspec 2  supports D0 D3  current D0
    cap 05[60] = MSI supports 1 message, 64 bit enabled with 1 message
    cap 10[70] = PCI-Express 1 root endpoint max data 128(128) NS
    ecap 0002[100] = VC 1 max VC1
    ecap 0005[130] = Root Complex Link Declaration 1

pcib2@pci0:0:28:0:	class=0x060400 card=0xff001179 chip=0x27d08086 rev=0x02 hdr=0x01
    vendor     = 'Intel Corporation'
    device     = 'NM10/ICH7 Family PCI Express Port 1'
    class      = bridge
    subclass   = PCI-PCI
    cap 10[40] = PCI-Express 1 root port max data 128(128)
                 link x0(x1) speed 0.0(2.5) ASPM disabled(L0s/L1)
                 slot 2 power limit 65 mW HotPlug(empty) surprise
    cap 05[80] = MSI supports 1 message enabled with 1 message
    cap 0d[90] = PCI Bridge card=0xff001179
    cap 01[a0] = powerspec 2  supports D0 D3  current D0
    ecap 0002[100] = VC 1 max VC1
    ecap 0005[180] = Root Complex Link Declaration 1

pcib3@pci0:0:28:1:	class=0x060400 card=0xff001179 chip=0x27d28086 rev=0x02 hdr=0x01
    vendor     = 'Intel Corporation'
    device     = 'NM10/ICH7 Family PCI Express Port 2'
    class      = bridge
    subclass   = PCI-PCI
    cap 10[40] = PCI-Express 1 root port max data 128(128)
                 link x1(x1) speed 2.5(2.5) ASPM disabled(L0s/L1)
                 slot 3 power limit 65 mW HotPlug(present) surprise
    cap 05[80] = MSI supports 1 message enabled with 1 message
    cap 0d[90] = PCI Bridge card=0xff001179
    cap 01[a0] = powerspec 2  supports D0 D3  current D0
    ecap 0002[100] = VC 1 max VC1
    ecap 0005[180] = Root Complex Link Declaration 1

uhci0@pci0:0:29:0:	class=0x0c0300 card=0xff001179 chip=0x27c88086 rev=0x02 hdr=0x00
    vendor     = 'Intel Corporation'
    device     = 'NM10/ICH7 Family USB UHCI Controller'
    class      = serial bus
    subclass   = USB
    bar   [20] = type I/O Port, range 32, base 0x1800, size 32, enabled

uhci1@pci0:0:29:1:	class=0x0c0300 card=0xff001179 chip=0x27c98086 rev=0x02 hdr=0x00
    vendor     = 'Intel Corporation'
    device     = 'NM10/ICH7 Family USB UHCI Controller'
    class      = serial bus
    subclass   = USB
    bar   [20] = type I/O Port, range 32, base 0x1820, size 32, enabled

uhci2@pci0:0:29:2:	class=0x0c0300 card=0xff001179 chip=0x27ca8086 rev=0x02 hdr=0x00
    vendor     = 'Intel Corporation'
    device     = 'NM10/ICH7 Family USB UHCI Controller'
    class      = serial bus
    subclass   = USB
    bar   [20] = type I/O Port, range 32, base 0x1840, size 32, enabled

uhci3@pci0:0:29:3:	class=0x0c0300 card=0xff001179 chip=0x27cb8086 rev=0x02 hdr=0x00
    vendor     = 'Intel Corporation'
    device     = 'NM10/ICH7 Family USB UHCI Controller'
    class      = serial bus
    subclass   = USB
    bar   [20] = type I/O Port, range 32, base 0x1860, size 32, enabled

ehci0@pci0:0:29:7:	class=0x0c0320 card=0xff001179 chip=0x27cc8086 rev=0x02 hdr=0x00
    vendor     = 'Intel Corporation'
    device     = 'NM10/ICH7 Family USB2 EHCI Controller'
    class      = serial bus
    subclass   = USB
    bar   [10] = type Memory, range 32, base 0xd0504000, size 1024, enabled
    cap 01[50] = powerspec 2  supports D0 D3  current D0
    cap 0a[58] = EHCI Debug Port at offset 0xa0 in map 0x14

pcib4@pci0:0:30:0:	class=0x060401 card=0xff001179 chip=0x24488086 rev=0xe2 hdr=0x01
    vendor     = 'Intel Corporation'
    device     = '82801 Mobile PCI Bridge'
    class      = bridge
    subclass   = PCI-PCI
    cap 0d[50] = PCI Bridge card=0xff001179

isab0@pci0:0:31:0:	class=0x060100 card=0xff001179 chip=0x27b98086 rev=0x02 hdr=0x00
    vendor     = 'Intel Corporation'
    device     = '82801GBM (ICH7-M) LPC Interface Bridge'
    class      = bridge
    subclass   = PCI-ISA
    cap 09[e0] = vendor (length 12) Intel cap 1 version 0
		 features: Quick Resume, SATA RAID-5, Mobile, 6 PCI-e x1 slots, SATA RAID-0/1/10

atapci0@pci0:0:31:2:	class=0x010180 card=0xff001179 chip=0x27c48086 rev=0x02 hdr=0x00
    vendor     = 'Intel Corporation'
    device     = '82801GBM/GHM (ICH7-M Family) SATA Controller [IDE mode]'
    class      = mass storage
    subclass   = ATA
    bar   [20] = type I/O Port, range 32, base 0x18b0, size 16, enabled
    cap 01[70] = powerspec 2  supports D0 D3  current D0

none0@pci0:0:31:3:	class=0x0c0500 card=0xff001179 chip=0x27da8086 rev=0x02 hdr=0x00
    vendor     = 'Intel Corporation'
    device     = 'NM10/ICH7 Family SMBus Controller'
    class      = serial bus
    subclass   = SMBus
    bar   [20] = type I/O Port, range 32, base 0x18c0, size 32, enabled

vgapci0@pci0:1:0:0:	class=0x030000 card=0xff001179 chip=0x71451002 rev=0x00 hdr=0x00
    vendor     = 'Advanced Micro Devices, Inc. [AMD/ATI]'
    device     = 'RV515/M54 [Mobility Radeon X1400]'
    class      = display
    subclass   = VGA
    bar   [10] = type Prefetchable Memory, range 32, base 0xc0000000, size 268435456, enabled
    bar   [14] = type I/O Port, range 32, base 0x2000, size 256, enabled
    bar   [18] = type Memory, range 32, base 0xd0000000, size 65536, enabled
    cap 01[50] = powerspec 2  supports D0 D1 D2 D3  current D0
    cap 10[58] = PCI-Express 1 legacy endpoint max data 128(128) RO NS
                 link x16(x16) speed 2.5(2.5) ASPM L0s/L1(L0s/L1)
    cap 05[80] = MSI supports 1 message, 64 bit 

wpi0@pci0:3:0:0:	class=0x028000 card=0x10448086 chip=0x42228086 rev=0x02 hdr=0x00
    vendor     = 'Intel Corporation'
    device     = 'PRO/Wireless 3945ABG [Golan] Network Connection'
    class      = network
    bar   [10] = type Memory, range 32, base 0xd0100000, size 4096, enabled
    cap 01[c8] = powerspec 2  supports D0 D3  current D0
    cap 05[d0] = MSI supports 1 message, 64 bit enabled with 1 message
    cap 10[e0] = PCI-Express 1 legacy endpoint max data 128(128) RO NS
                 link x1(x1) speed 2.5(2.5) ASPM disabled(L0s/L1) ClockPM enabled
    ecap 0001[100] = AER 1 0 fatal 1 non-fatal 1 corrected
    ecap 0003[140] = Serial 1 001302ffff7f8f75

cbb0@pci0:5:6:0:	class=0x060700 card=0xff001179 chip=0x8039104c rev=0x00 hdr=0x02
    vendor     = 'Texas Instruments'
    device     = 'PCIxx12 Cardbus Controller'
    class      = bridge
    subclass   = PCI-CardBus
    bar   [10] = type Memory, range 32, base 0xd0204000, size 4096, enabled
    cap 01[a0] = powerspec 2  supports D0 D1 D2 D3  current D0

none1@pci0:5:6:1:	class=0x0c0010 card=0xff001179 chip=0x803a104c rev=0x00 hdr=0x00
    vendor     = 'Texas Instruments'
    device     = 'PCIxx12 OHCI Compliant IEEE 1394 Host Controller'
    class      = serial bus
    subclass   = FireWire
    bar   [10] = type Memory, range 32, base 0xd0207000, size 2048, enabled
    bar   [14] = type Memory, range 32, base 0xd0200000, size 16384, enabled
    cap 01[44] = powerspec 2  supports D0 D1 D2 D3  current D0

none2@pci0:5:6:2:	class=0x018000 card=0xff001179 chip=0x803b104c rev=0x00 hdr=0x00
    vendor     = 'Texas Instruments'
    device     = 'PCIxx12 Flash Media Controller'
    class      = mass storage
    bar   [10] = type Memory, range 32, base 0xd0205000, size 4096, enabled
    cap 01[44] = powerspec 2  supports D0 D1 D2 D3  current D0

sdhci_pci0@pci0:5:6:3:	class=0x080501 card=0xff001179 chip=0x803c104c rev=0x00 hdr=0x00
    vendor     = 'Texas Instruments'
    device     = 'PCIxx12 SDA Standard Compliant SD Host Controller'
    class      = base peripheral
    subclass   = SD host controller
    bar   [10] = type Memory, range 32, base 0xd0207800, size 256, enabled
    cap 01[80] = powerspec 2  supports D0 D1 D2 D3  current D0

fxp0@pci0:5:8:0:	class=0x020000 card=0xff001179 chip=0x10938086 rev=0x02 hdr=0x00
    vendor     = 'Intel Corporation'
    device     = 'PRO/100 VM Network Connection'
    class      = network
    subclass   = ethernet
    bar   [10] = type Memory, range 32, base 0xd0206000, size 4096, enabled
    bar   [14] = type I/O Port, range 32, base 0x3000, size 64, enabled
    cap 01[dc] = powerspec 2  supports D0 D1 D2 D3  current D0
