none0@pci0:255:11:0:	class=0x088000 rev=0x02 hdr=0x00 vendor=0x8086 device=0x2f81 subvendor=0x8086 subdevice=0x2f81
    vendor     = 'Intel Corporation'
    device     = 'Xeon E7 v3/Xeon E5 v3/Core i7 R3 QPI Link 0 & 1 Monitoring'
    class      = base peripheral

none1@pci0:255:11:1:	class=0x110100 rev=0x02 hdr=0x00 vendor=0x8086 device=0x2f36 subvendor=0x8086 subdevice=0x2f36
    vendor     = 'Intel Corporation'
    device     = 'Xeon E7 v3/Xeon E5 v3/Core i7 R3 QPI Link 0 & 1 Monitoring'
    class      = dasp
    subclass   = performance counters

none2@pci0:255:11:2:	class=0x110100 rev=0x02 hdr=0x00 vendor=0x8086 device=0x2f37 subvendor=0x8086 subdevice=0x2f37
    vendor     = 'Intel Corporation'
    device     = 'Xeon E7 v3/Xeon E5 v3/Core i7 R3 QPI Link 0 & 1 Monitoring'
    class      = dasp
    subclass   = performance counters

none3@pci0:255:12:0:	class=0x088000 rev=0x02 hdr=0x00 vendor=0x8086 device=0x2fe0 subvendor=0x8086 subdevice=0x2fe0
    vendor     = 'Intel Corporation'
    device     = 'Xeon E7 v3/Xeon E5 v3/Core i7 Unicast Registers'
    class      = base peripheral

none4@pci0:255:12:1:	class=0x088000 rev=0x02 hdr=0x00 vendor=0x8086 device=0x2fe1 subvendor=0x8086 subdevice=0x2fe1
    vendor     = 'Intel Corporation'
    device     = 'Xeon E7 v3/Xeon E5 v3/Core i7 Unicast Registers'
    class      = base peripheral

none5@pci0:255:12:2:	class=0x088000 rev=0x02 hdr=0x00 vendor=0x8086 device=0x2fe2 subvendor=0x8086 subdevice=0x2fe2
    vendor     = 'Intel Corporation'
    device     = 'Xeon E7 v3/Xeon E5 v3/Core i7 Unicast Registers'
    class      = base peripheral

none6@pci0:255:12:3:	class=0x088000 rev=0x02 hdr=0x00 vendor=0x8086 device=0x2fe3 subvendor=0x8086 subdevice=0x2fe3
    vendor     = 'Intel Corporation'
    device     = 'Xeon E7 v3/Xeon E5 v3/Core i7 Unicast Registers'
    class      = base peripheral

none7@pci0:255:12:4:	class=0x088000 rev=0x02 hdr=0x00 vendor=0x8086 device=0x2fe4 subvendor=0x8086 subdevice=0x2fe4
    vendor     = 'Intel Corporation'
    device     = 'Xeon E7 v3/Xeon E5 v3/Core i7 Unicast Registers'
    class      = base peripheral

none8@pci0:255:12:5:	class=0x088000 rev=0x02 hdr=0x00 vendor=0x8086 device=0x2fe5 subvendor=0x8086 subdevice=0x2fe5
    vendor     = 'Intel Corporation'
    device     = 'Xeon E7 v3/Xeon E5 v3/Core i7 Unicast Registers'
    class      = base peripheral

none9@pci0:255:12:6:	class=0x088000 rev=0x02 hdr=0x00 vendor=0x8086 device=0x2fe6 subvendor=0x8086 subdevice=0x2fe6
    vendor     = 'Intel Corporation'
    device     = 'Xeon E7 v3/Xeon E5 v3/Core i7 Unicast Registers'
    class      = base peripheral

none10@pci0:255:12:7:	class=0x088000 rev=0x02 hdr=0x00 vendor=0x8086 device=0x2fe7 subvendor=0x8086 subdevice=0x2fe7
    vendor     = 'Intel Corporation'
    device     = 'Xeon E7 v3/Xeon E5 v3/Core i7 Unicast Registers'
    class      = base peripheral

none11@pci0:255:13:0:	class=0x088000 rev=0x02 hdr=0x00 vendor=0x8086 device=0x2fe8 subvendor=0x8086 subdevice=0x2fe8
    vendor     = 'Intel Corporation'
    device     = 'Xeon E7 v3/Xeon E5 v3/Core i7 Unicast Registers'
    class      = base peripheral

none12@pci0:255:13:1:	class=0x088000 rev=0x02 hdr=0x00 vendor=0x8086 device=0x2fe9 subvendor=0x8086 subdevice=0x2fe9
    vendor     = 'Intel Corporation'
    device     = 'Xeon E7 v3/Xeon E5 v3/Core i7 Unicast Registers'
    class      = base peripheral

none13@pci0:255:13:2:	class=0x088000 rev=0x02 hdr=0x00 vendor=0x8086 device=0x2fea subvendor=0x8086 subdevice=0x2fea
    vendor     = 'Intel Corporation'
    device     = 'Xeon E7 v3/Xeon E5 v3/Core i7 Unicast Registers'
    class      = base peripheral

none14@pci0:255:13:3:	class=0x088000 rev=0x02 hdr=0x00 vendor=0x8086 device=0x2feb subvendor=0x8086 subdevice=0x2feb
    vendor     = 'Intel Corporation'
    device     = 'Xeon E7 v3/Xeon E5 v3/Core i7 Unicast Registers'
    class      = base peripheral

none15@pci0:255:15:0:	class=0x088000 rev=0x02 hdr=0x00 vendor=0x8086 device=0x2ff8 subvendor=0x0000 subdevice=0x0000
    vendor     = 'Intel Corporation'
    device     = 'Xeon E7 v3/Xeon E5 v3/Core i7 Buffered Ring Agent'
    class      = base peripheral

none16@pci0:255:15:1:	class=0x088000 rev=0x02 hdr=0x00 vendor=0x8086 device=0x2ff9 subvendor=0x0000 subdevice=0x0000
    vendor     = 'Intel Corporation'
    device     = 'Xeon E7 v3/Xeon E5 v3/Core i7 Buffered Ring Agent'
    class      = base peripheral

none17@pci0:255:15:2:	class=0x088000 rev=0x02 hdr=0x00 vendor=0x8086 device=0x2ffa subvendor=0x0000 subdevice=0x0000
    vendor     = 'Intel Corporation'
    device     = 'Xeon E7 v3/Xeon E5 v3/Core i7 Buffered Ring Agent'
    class      = base peripheral

none18@pci0:255:15:3:	class=0x088000 rev=0x02 hdr=0x00 vendor=0x8086 device=0x2ffb subvendor=0x0000 subdevice=0x0000
    vendor     = 'Intel Corporation'
    device     = 'Xeon E7 v3/Xeon E5 v3/Core i7 Buffered Ring Agent'
    class      = base peripheral

none19@pci0:255:15:4:	class=0x088000 rev=0x02 hdr=0x00 vendor=0x8086 device=0x2ffc subvendor=0x8086 subdevice=0x2fe0
    vendor     = 'Intel Corporation'
    device     = 'Xeon E7 v3/Xeon E5 v3/Core i7 System Address Decoder & Broadcast Registers'
    class      = base peripheral

none20@pci0:255:15:5:	class=0x088000 rev=0x02 hdr=0x00 vendor=0x8086 device=0x2ffd subvendor=0x8086 subdevice=0x2fe0
    vendor     = 'Intel Corporation'
    device     = 'Xeon E7 v3/Xeon E5 v3/Core i7 System Address Decoder & Broadcast Registers'
    class      = base peripheral

none21@pci0:255:15:6:	class=0x088000 rev=0x02 hdr=0x00 vendor=0x8086 device=0x2ffe subvendor=0x8086 subdevice=0x2fe0
    vendor     = 'Intel Corporation'
    device     = 'Xeon E7 v3/Xeon E5 v3/Core i7 System Address Decoder & Broadcast Registers'
    class      = base peripheral

none22@pci0:255:16:0:	class=0x088000 rev=0x02 hdr=0x00 vendor=0x8086 device=0x2f1d subvendor=0x8086 subdevice=0x2f1d
    vendor     = 'Intel Corporation'
    device     = 'Xeon E7 v3/Xeon E5 v3/Core i7 PCIe Ring Interface'
    class      = base peripheral

none23@pci0:255:16:1:	class=0x110100 rev=0x02 hdr=0x00 vendor=0x8086 device=0x2f34 subvendor=0x8086 subdevice=0x2f34
    vendor     = 'Intel Corporation'
    device     = 'Xeon E7 v3/Xeon E5 v3/Core i7 PCIe Ring Interface'
    class      = dasp
    subclass   = performance counters

none24@pci0:255:16:5:	class=0x088000 rev=0x02 hdr=0x00 vendor=0x8086 device=0x2f1e subvendor=0x8086 subdevice=0x2f1e
    vendor     = 'Intel Corporation'
    device     = 'Xeon E7 v3/Xeon E5 v3/Core i7 Scratchpad & Semaphore Registers'
    class      = base peripheral

none25@pci0:255:16:6:	class=0x110100 rev=0x02 hdr=0x00 vendor=0x8086 device=0x2f7d subvendor=0x8086 subdevice=0x2f7d
    vendor     = 'Intel Corporation'
    device     = 'Xeon E7 v3/Xeon E5 v3/Core i7 Scratchpad & Semaphore Registers'
    class      = dasp
    subclass   = performance counters

none26@pci0:255:16:7:	class=0x088000 rev=0x02 hdr=0x00 vendor=0x8086 device=0x2f1f subvendor=0x8086 subdevice=0x2f1f
    vendor     = 'Intel Corporation'
    device     = 'Xeon E7 v3/Xeon E5 v3/Core i7 Scratchpad & Semaphore Registers'
    class      = base peripheral

none27@pci0:255:18:0:	class=0x088000 rev=0x02 hdr=0x00 vendor=0x8086 device=0x2fa0 subvendor=0x8086 subdevice=0x2fa0
    vendor     = 'Intel Corporation'
    device     = 'Xeon E7 v3/Xeon E5 v3/Core i7 Home Agent 0'
    class      = base peripheral

none28@pci0:255:18:1:	class=0x110100 rev=0x02 hdr=0x00 vendor=0x8086 device=0x2f30 subvendor=0x8086 subdevice=0x2f30
    vendor     = 'Intel Corporation'
    device     = 'Xeon E7 v3/Xeon E5 v3/Core i7 Home Agent 0'
    class      = dasp
    subclass   = performance counters

none29@pci0:255:18:4:	class=0x088000 rev=0x02 hdr=0x00 vendor=0x8086 device=0x2f60 subvendor=0x8086 subdevice=0x2f60
    vendor     = 'Intel Corporation'
    device     = 'Xeon E7 v3/Xeon E5 v3/Core i7 Home Agent 1'
    class      = base peripheral

none30@pci0:255:18:5:	class=0x110100 rev=0x02 hdr=0x00 vendor=0x8086 device=0x2f38 subvendor=0x8086 subdevice=0x2f38
    vendor     = 'Intel Corporation'
    device     = 'Xeon E7 v3/Xeon E5 v3/Core i7 Home Agent 1'
    class      = dasp
    subclass   = performance counters

none31@pci0:255:19:0:	class=0x088000 rev=0x02 hdr=0x00 vendor=0x8086 device=0x2fa8 subvendor=0x8086 subdevice=0x2fa8
    vendor     = 'Intel Corporation'
    device     = 'Xeon E7 v3/Xeon E5 v3/Core i7 Integrated Memory Controller 0 Target Address, Thermal & RAS Registers'
    class      = base peripheral

none32@pci0:255:19:1:	class=0x088000 rev=0x02 hdr=0x00 vendor=0x8086 device=0x2f71 subvendor=0x8086 subdevice=0x2f71
    vendor     = 'Intel Corporation'
    device     = 'Xeon E7 v3/Xeon E5 v3/Core i7 Integrated Memory Controller 0 Target Address, Thermal & RAS Registers'
    class      = base peripheral

none33@pci0:255:19:2:	class=0x088000 rev=0x02 hdr=0x00 vendor=0x8086 device=0x2faa subvendor=0x8086 subdevice=0x2faa
    vendor     = 'Intel Corporation'
    device     = 'Xeon E7 v3/Xeon E5 v3/Core i7 Integrated Memory Controller 0 Channel Target Address Decoder'
    class      = base peripheral

none34@pci0:255:19:3:	class=0x088000 rev=0x02 hdr=0x00 vendor=0x8086 device=0x2fab subvendor=0x8086 subdevice=0x2fab
    vendor     = 'Intel Corporation'
    device     = 'Xeon E7 v3/Xeon E5 v3/Core i7 Integrated Memory Controller 0 Channel Target Address Decoder'
    class      = base peripheral

none35@pci0:255:19:6:	class=0x088000 rev=0x02 hdr=0x00 vendor=0x8086 device=0x2fae subvendor=0x0000 subdevice=0x0000
    vendor     = 'Intel Corporation'
    device     = 'Xeon E7 v3/Xeon E5 v3/Core i7 DDRIO Channel 0/1 Broadcast'
    class      = base peripheral

none36@pci0:255:19:7:	class=0x088000 rev=0x02 hdr=0x00 vendor=0x8086 device=0x2faf subvendor=0x0000 subdevice=0x0000
    vendor     = 'Intel Corporation'
    device     = 'Xeon E7 v3/Xeon E5 v3/Core i7 DDRIO Global Broadcast'
    class      = base peripheral

none37@pci0:255:20:0:	class=0x088000 rev=0x02 hdr=0x00 vendor=0x8086 device=0x2fb0 subvendor=0x8086 subdevice=0x2fb0
    vendor     = 'Intel Corporation'
    device     = 'Xeon E7 v3/Xeon E5 v3/Core i7 Integrated Memory Controller 0 Channel 0 Thermal Control'
    class      = base peripheral

none38@pci0:255:20:1:	class=0x088000 rev=0x02 hdr=0x00 vendor=0x8086 device=0x2fb1 subvendor=0x8086 subdevice=0x2fb1
    vendor     = 'Intel Corporation'
    device     = 'Xeon E7 v3/Xeon E5 v3/Core i7 Integrated Memory Controller 0 Channel 1 Thermal Control'
    class      = base peripheral

none39@pci0:255:20:2:	class=0x088000 rev=0x02 hdr=0x00 vendor=0x8086 device=0x2fb2 subvendor=0x8086 subdevice=0x2fb2
    vendor     = 'Intel Corporation'
    device     = 'Xeon E7 v3/Xeon E5 v3/Core i7 Integrated Memory Controller 0 Channel 0 ERROR Registers'
    class      = base peripheral

none40@pci0:255:20:3:	class=0x088000 rev=0x02 hdr=0x00 vendor=0x8086 device=0x2fb3 subvendor=0x8086 subdevice=0x2fb3
    vendor     = 'Intel Corporation'
    device     = 'Xeon E7 v3/Xeon E5 v3/Core i7 Integrated Memory Controller 0 Channel 1 ERROR Registers'
    class      = base peripheral

none41@pci0:255:20:4:	class=0x088000 rev=0x02 hdr=0x00 vendor=0x8086 device=0x2fbc subvendor=0x0000 subdevice=0x0000
    vendor     = 'Intel Corporation'
    device     = 'Xeon E7 v3/Xeon E5 v3/Core i7 DDRIO (VMSE) 0 & 1'
    class      = base peripheral

none42@pci0:255:20:5:	class=0x088000 rev=0x02 hdr=0x00 vendor=0x8086 device=0x2fbd subvendor=0x0000 subdevice=0x0000
    vendor     = 'Intel Corporation'
    device     = 'Xeon E7 v3/Xeon E5 v3/Core i7 DDRIO (VMSE) 0 & 1'
    class      = base peripheral

none43@pci0:255:20:6:	class=0x088000 rev=0x02 hdr=0x00 vendor=0x8086 device=0x2fbe subvendor=0x0000 subdevice=0x0000
    vendor     = 'Intel Corporation'
    device     = 'Xeon E7 v3/Xeon E5 v3/Core i7 DDRIO (VMSE) 0 & 1'
    class      = base peripheral

none44@pci0:255:20:7:	class=0x088000 rev=0x02 hdr=0x00 vendor=0x8086 device=0x2fbf subvendor=0x0000 subdevice=0x0000
    vendor     = 'Intel Corporation'
    device     = 'Xeon E7 v3/Xeon E5 v3/Core i7 DDRIO (VMSE) 0 & 1'
    class      = base peripheral

none45@pci0:255:22:0:	class=0x088000 rev=0x02 hdr=0x00 vendor=0x8086 device=0x2f68 subvendor=0x8086 subdevice=0x2f68
    vendor     = 'Intel Corporation'
    device     = 'Xeon E7 v3/Xeon E5 v3/Core i7 Integrated Memory Controller 1 Target Address, Thermal & RAS Registers'
    class      = base peripheral

none46@pci0:255:22:1:	class=0x088000 rev=0x02 hdr=0x00 vendor=0x8086 device=0x2f79 subvendor=0x8086 subdevice=0x2f79
    vendor     = 'Intel Corporation'
    device     = 'Xeon E7 v3/Xeon E5 v3/Core i7 Integrated Memory Controller 1 Target Address, Thermal & RAS Registers'
    class      = base peripheral

none47@pci0:255:22:2:	class=0x088000 rev=0x02 hdr=0x00 vendor=0x8086 device=0x2f6a subvendor=0x8086 subdevice=0x2f6a
    vendor     = 'Intel Corporation'
    device     = 'Xeon E7 v3/Xeon E5 v3/Core i7 Integrated Memory Controller 1 Channel Target Address Decoder'
    class      = base peripheral

none48@pci0:255:22:3:	class=0x088000 rev=0x02 hdr=0x00 vendor=0x8086 device=0x2f6b subvendor=0x8086 subdevice=0x2f6b
    vendor     = 'Intel Corporation'
    device     = 'Xeon E7 v3/Xeon E5 v3/Core i7 Integrated Memory Controller 1 Channel Target Address Decoder'
    class      = base peripheral

none49@pci0:255:22:6:	class=0x088000 rev=0x02 hdr=0x00 vendor=0x8086 device=0x2f6e subvendor=0x0000 subdevice=0x0000
    vendor     = 'Intel Corporation'
    device     = 'Xeon E7 v3/Xeon E5 v3/Core i7 DDRIO Channel 2/3 Broadcast'
    class      = base peripheral

none50@pci0:255:22:7:	class=0x088000 rev=0x02 hdr=0x00 vendor=0x8086 device=0x2f6f subvendor=0x0000 subdevice=0x0000
    vendor     = 'Intel Corporation'
    device     = 'Xeon E7 v3/Xeon E5 v3/Core i7 DDRIO Global Broadcast'
    class      = base peripheral

none51@pci0:255:23:0:	class=0x088000 rev=0x02 hdr=0x00 vendor=0x8086 device=0x2fd0 subvendor=0x8086 subdevice=0x2fd0
    vendor     = 'Intel Corporation'
    device     = 'Xeon E7 v3/Xeon E5 v3/Core i7 Integrated Memory Controller 1 Channel 0 Thermal Control'
    class      = base peripheral

none52@pci0:255:23:1:	class=0x088000 rev=0x02 hdr=0x00 vendor=0x8086 device=0x2fd1 subvendor=0x8086 subdevice=0x2fd1
    vendor     = 'Intel Corporation'
    device     = 'Xeon E7 v3/Xeon E5 v3/Core i7 Integrated Memory Controller 1 Channel 1 Thermal Control'
    class      = base peripheral

none53@pci0:255:23:2:	class=0x088000 rev=0x02 hdr=0x00 vendor=0x8086 device=0x2fd2 subvendor=0x8086 subdevice=0x2fd2
    vendor     = 'Intel Corporation'
    device     = 'Xeon E7 v3/Xeon E5 v3/Core i7 Integrated Memory Controller 1 Channel 0 ERROR Registers'
    class      = base peripheral

none54@pci0:255:23:3:	class=0x088000 rev=0x02 hdr=0x00 vendor=0x8086 device=0x2fd3 subvendor=0x8086 subdevice=0x2fd3
    vendor     = 'Intel Corporation'
    device     = 'Xeon E7 v3/Xeon E5 v3/Core i7 Integrated Memory Controller 1 Channel 1 ERROR Registers'
    class      = base peripheral

none55@pci0:255:23:4:	class=0x088000 rev=0x02 hdr=0x00 vendor=0x8086 device=0x2fb8 subvendor=0x0000 subdevice=0x0000
    vendor     = 'Intel Corporation'
    device     = 'Xeon E7 v3/Xeon E5 v3/Core i7 DDRIO (VMSE) 2 & 3'
    class      = base peripheral

none56@pci0:255:23:5:	class=0x088000 rev=0x02 hdr=0x00 vendor=0x8086 device=0x2fb9 subvendor=0x0000 subdevice=0x0000
    vendor     = 'Intel Corporation'
    device     = 'Xeon E7 v3/Xeon E5 v3/Core i7 DDRIO (VMSE) 2 & 3'
    class      = base peripheral

none57@pci0:255:23:6:	class=0x088000 rev=0x02 hdr=0x00 vendor=0x8086 device=0x2fba subvendor=0x0000 subdevice=0x0000
    vendor     = 'Intel Corporation'
    device     = 'Xeon E7 v3/Xeon E5 v3/Core i7 DDRIO (VMSE) 2 & 3'
    class      = base peripheral

none58@pci0:255:23:7:	class=0x088000 rev=0x02 hdr=0x00 vendor=0x8086 device=0x2fbb subvendor=0x0000 subdevice=0x0000
    vendor     = 'Intel Corporation'
    device     = 'Xeon E7 v3/Xeon E5 v3/Core i7 DDRIO (VMSE) 2 & 3'
    class      = base peripheral

none59@pci0:255:30:0:	class=0x088000 rev=0x02 hdr=0x00 vendor=0x8086 device=0x2f98 subvendor=0x8086 subdevice=0x2f98
    vendor     = 'Intel Corporation'
    device     = 'Xeon E7 v3/Xeon E5 v3/Core i7 Power Control Unit'
    class      = base peripheral

none60@pci0:255:30:1:	class=0x088000 rev=0x02 hdr=0x00 vendor=0x8086 device=0x2f99 subvendor=0x8086 subdevice=0x2f99
    vendor     = 'Intel Corporation'
    device     = 'Xeon E7 v3/Xeon E5 v3/Core i7 Power Control Unit'
    class      = base peripheral

none61@pci0:255:30:2:	class=0x088000 rev=0x02 hdr=0x00 vendor=0x8086 device=0x2f9a subvendor=0x8086 subdevice=0x2f9a
    vendor     = 'Intel Corporation'
    device     = 'Xeon E7 v3/Xeon E5 v3/Core i7 Power Control Unit'
    class      = base peripheral

none62@pci0:255:30:3:	class=0x088000 rev=0x02 hdr=0x00 vendor=0x8086 device=0x2fc0 subvendor=0x8086 subdevice=0x2fc0
    vendor     = 'Intel Corporation'
    device     = 'Xeon E7 v3/Xeon E5 v3/Core i7 Power Control Unit'
    class      = base peripheral
    bar   [10] = type Prefetchable Memory, range 32, base 0x10, size 16, disabled

none63@pci0:255:30:4:	class=0x088000 rev=0x02 hdr=0x00 vendor=0x8086 device=0x2f9c subvendor=0x8086 subdevice=0x2f9c
    vendor     = 'Intel Corporation'
    device     = 'Xeon E7 v3/Xeon E5 v3/Core i7 Power Control Unit'
    class      = base peripheral

none64@pci0:255:31:0:	class=0x088000 rev=0x02 hdr=0x00 vendor=0x8086 device=0x2f88 subvendor=0x0000 subdevice=0x0000
    vendor     = 'Intel Corporation'
    device     = 'Xeon E7 v3/Xeon E5 v3/Core i7 VCU'
    class      = base peripheral

none65@pci0:255:31:2:	class=0x088000 rev=0x02 hdr=0x00 vendor=0x8086 device=0x2f8a subvendor=0x0000 subdevice=0x0000
    vendor     = 'Intel Corporation'
    device     = 'Xeon E7 v3/Xeon E5 v3/Core i7 VCU'
    class      = base peripheral

hostb0@pci0:0:0:0:	class=0x060000 rev=0x02 hdr=0x00 vendor=0x8086 device=0x2f00 subvendor=0x1028 subdevice=0x0617
    vendor     = 'Intel Corporation'
    device     = 'Xeon E7 v3/Xeon E5 v3/Core i7 DMI2'
    class      = bridge
    subclass   = HOST-PCI
    cap 10[90] = PCI-Express 2 root port max data 128(128)
                 max read 128
                 link x0(x4) speed 0.0(5.0) ASPM disabled(L1)
    cap 01[e0] = powerspec 3  supports D0 D3  current D0
    ecap 000b[100] = Vendor [1] ID 0002 Rev 0 Length 12
    ecap 000b[144] = Vendor [1] ID 0004 Rev 1 Length 60
    ecap 000b[1d0] = Vendor [1] ID 0003 Rev 1 Length 10
    ecap 000b[280] = Vendor [1] ID 0005 Rev 3 Length 24
    ecap 000b[300] = Vendor [1] ID 0008 Rev 0 Length 56

pcib2@pci0:0:1:0:	class=0x060400 rev=0x02 hdr=0x01 vendor=0x8086 device=0x2f02 subvendor=0x1028 subdevice=0x0617
    vendor     = 'Intel Corporation'
    device     = 'Xeon E7 v3/Xeon E5 v3/Core i7 PCI Express Root Port 1'
    class      = bridge
    subclass   = PCI-PCI
    cap 0d[40] = PCI Bridge subvendor=0x1028 subdevice=0x0617
    cap 05[60] = MSI supports 2 messages, vector masks 
    cap 10[90] = PCI-Express 2 root port max data 128(256) ARI disabled
                 max read 128
                 link x0(x4) speed 0.0(8.0)
                 slot 1 power limit 26000 mW
    cap 01[e0] = powerspec 3  supports D0 D3  current D0
    ecap 000b[100] = Vendor [1] ID 0002 Rev 0 Length 12
    ecap 000d[110] = ACS 1
    ecap 0001[148] = AER 1 0 fatal 0 non-fatal 0 corrected
    ecap 000b[1d0] = Vendor [1] ID 0003 Rev 1 Length 10
    ecap 0019[250] = PCIe Sec 1 lane errors 0
    ecap 000b[280] = Vendor [1] ID 0005 Rev 3 Length 24
    ecap 000b[300] = Vendor [1] ID 0008 Rev 0 Length 56

pcib3@pci0:0:1:1:	class=0x060400 rev=0x02 hdr=0x01 vendor=0x8086 device=0x2f03 subvendor=0x1028 subdevice=0x0617
    vendor     = 'Intel Corporation'
    device     = 'Xeon E7 v3/Xeon E5 v3/Core i7 PCI Express Root Port 1'
    class      = bridge
    subclass   = PCI-PCI
    cap 0d[40] = PCI Bridge subvendor=0x1028 subdevice=0x0617
    cap 05[60] = MSI supports 2 messages, vector masks 
    cap 10[90] = PCI-Express 2 root port max data 128(256) ARI disabled
                 max read 128
                 link x0(x4) speed 0.0(8.0)
                 slot 11 power limit 26000 mW
    cap 01[e0] = powerspec 3  supports D0 D3  current D0
    ecap 000b[100] = Vendor [1] ID 0002 Rev 0 Length 12
    ecap 000d[110] = ACS 1
    ecap 0001[148] = AER 1 0 fatal 0 non-fatal 0 corrected
    ecap 000b[1d0] = Vendor [1] ID 0003 Rev 1 Length 10
    ecap 0019[250] = PCIe Sec 1 lane errors 0
    ecap 000b[280] = Vendor [1] ID 0005 Rev 3 Length 24
    ecap 000b[300] = Vendor [1] ID 0008 Rev 0 Length 56

pcib4@pci0:0:2:0:	class=0x060400 rev=0x02 hdr=0x01 vendor=0x8086 device=0x2f04 subvendor=0x1028 subdevice=0x0617
    vendor     = 'Intel Corporation'
    device     = 'Xeon E7 v3/Xeon E5 v3/Core i7 PCI Express Root Port 2'
    class      = bridge
    subclass   = PCI-PCI
    cap 0d[40] = PCI Bridge subvendor=0x1028 subdevice=0x0617
    cap 05[60] = MSI supports 2 messages, vector masks 
    cap 10[90] = PCI-Express 2 root port max data 256(256) ARI disabled
                 max read 128
                 link x16(x16) speed 2.5(8.0)
                 slot 2 power limit 26000 mW
    cap 01[e0] = powerspec 3  supports D0 D3  current D0
    ecap 000b[100] = Vendor [1] ID 0002 Rev 0 Length 12
    ecap 000d[110] = ACS 1
    ecap 0001[148] = AER 1 0 fatal 0 non-fatal 0 corrected
    ecap 000b[1d0] = Vendor [1] ID 0003 Rev 1 Length 10
    ecap 0019[250] = PCIe Sec 1 lane errors 0
    ecap 000b[280] = Vendor [1] ID 0005 Rev 3 Length 24
    ecap 000b[300] = Vendor [1] ID 0008 Rev 0 Length 56

pcib5@pci0:0:3:0:	class=0x060400 rev=0x02 hdr=0x01 vendor=0x8086 device=0x2f08 subvendor=0x1028 subdevice=0x0617
    vendor     = 'Intel Corporation'
    device     = 'Xeon E7 v3/Xeon E5 v3/Core i7 PCI Express Root Port 3'
    class      = bridge
    subclass   = PCI-PCI
    cap 0d[40] = PCI Bridge subvendor=0x1028 subdevice=0x0617
    cap 05[60] = MSI supports 2 messages, vector masks 
    cap 10[90] = PCI-Express 2 root port max data 128(256) ARI disabled
                 max read 128
                 link x0(x4) speed 0.0(8.0)
                 slot 4 power limit 26000 mW
    cap 01[e0] = powerspec 3  supports D0 D3  current D0
    ecap 000b[100] = Vendor [1] ID 0002 Rev 0 Length 12
    ecap 000d[110] = ACS 1
    ecap 0001[148] = AER 1 0 fatal 0 non-fatal 0 corrected
    ecap 000b[1d0] = Vendor [1] ID 0003 Rev 1 Length 10
    ecap 0019[250] = PCIe Sec 1 lane errors 0
    ecap 000b[280] = Vendor [1] ID 0005 Rev 3 Length 24
    ecap 000b[300] = Vendor [1] ID 0008 Rev 0 Length 56

pcib6@pci0:0:3:1:	class=0x060400 rev=0x02 hdr=0x01 vendor=0x8086 device=0x2f09 subvendor=0x1028 subdevice=0x0617
    vendor     = 'Intel Corporation'
    device     = 'Xeon E7 v3/Xeon E5 v3/Core i7 PCI Express Root Port 3'
    class      = bridge
    subclass   = PCI-PCI
    cap 0d[40] = PCI Bridge subvendor=0x1028 subdevice=0x0617
    cap 05[60] = MSI supports 2 messages, vector masks 
    cap 10[90] = PCI-Express 2 root port max data 128(256) ARI disabled
                 max read 128
                 link x0(x4) speed 0.0(8.0)
                 slot 41 power limit 26000 mW
    cap 01[e0] = powerspec 3  supports D0 D3  current D0
    ecap 000b[100] = Vendor [1] ID 0002 Rev 0 Length 12
    ecap 000d[110] = ACS 1
    ecap 0001[148] = AER 1 0 fatal 0 non-fatal 0 corrected
    ecap 000b[1d0] = Vendor [1] ID 0003 Rev 1 Length 10
    ecap 0019[250] = PCIe Sec 1 lane errors 0
    ecap 000b[280] = Vendor [1] ID 0005 Rev 3 Length 24
    ecap 000b[300] = Vendor [1] ID 0008 Rev 0 Length 56

pcib7@pci0:0:3:2:	class=0x060400 rev=0x02 hdr=0x01 vendor=0x8086 device=0x2f0a subvendor=0x1028 subdevice=0x0617
    vendor     = 'Intel Corporation'
    device     = 'Xeon E7 v3/Xeon E5 v3/Core i7 PCI Express Root Port 3'
    class      = bridge
    subclass   = PCI-PCI
    cap 0d[40] = PCI Bridge subvendor=0x1028 subdevice=0x0617
    cap 05[60] = MSI supports 2 messages, vector masks 
    cap 10[90] = PCI-Express 2 root port max data 128(256) ARI disabled
                 max read 128
                 link x0(x4) speed 0.0(8.0)
                 slot 42 power limit 26000 mW
    cap 01[e0] = powerspec 3  supports D0 D3  current D0
    ecap 000b[100] = Vendor [1] ID 0002 Rev 0 Length 12
    ecap 000d[110] = ACS 1
    ecap 0001[148] = AER 1 0 fatal 0 non-fatal 0 corrected
    ecap 000b[1d0] = Vendor [1] ID 0003 Rev 1 Length 10
    ecap 0019[250] = PCIe Sec 1 lane errors 0
    ecap 000b[280] = Vendor [1] ID 0005 Rev 3 Length 24
    ecap 000b[300] = Vendor [1] ID 0008 Rev 0 Length 56

pcib8@pci0:0:3:3:	class=0x060400 rev=0x02 hdr=0x01 vendor=0x8086 device=0x2f0b subvendor=0x1028 subdevice=0x0617
    vendor     = 'Intel Corporation'
    device     = 'Xeon E7 v3/Xeon E5 v3/Core i7 PCI Express Root Port 3'
    class      = bridge
    subclass   = PCI-PCI
    cap 0d[40] = PCI Bridge subvendor=0x1028 subdevice=0x0617
    cap 05[60] = MSI supports 2 messages, vector masks 
    cap 10[90] = PCI-Express 2 root port max data 128(256) ARI disabled
                 max read 128
                 link x0(x4) speed 0.0(8.0)
                 slot 43 power limit 26000 mW
    cap 01[e0] = powerspec 3  supports D0 D3  current D0
    ecap 000b[100] = Vendor [1] ID 0002 Rev 0 Length 12
    ecap 000d[110] = ACS 1
    ecap 0001[148] = AER 1 0 fatal 0 non-fatal 0 corrected
    ecap 000b[1d0] = Vendor [1] ID 0003 Rev 1 Length 10
    ecap 0019[250] = PCIe Sec 1 lane errors 0
    ecap 000b[280] = Vendor [1] ID 0005 Rev 3 Length 24
    ecap 000b[300] = Vendor [1] ID 0008 Rev 0 Length 56

none66@pci0:0:5:0:	class=0x088000 rev=0x02 hdr=0x00 vendor=0x8086 device=0x2f28 subvendor=0x0000 subdevice=0x0000
    vendor     = 'Intel Corporation'
    device     = 'Xeon E7 v3/Xeon E5 v3/Core i7 Address Map, VTd_Misc, System Management'
    class      = base peripheral
    cap 10[40] = PCI-Express 2 root endpoint max data 128(128)
                 max read 128

none67@pci0:0:5:1:	class=0x088000 rev=0x02 hdr=0x00 vendor=0x8086 device=0x2f29 subvendor=0x0000 subdevice=0x0000
    vendor     = 'Intel Corporation'
    device     = 'Xeon E7 v3/Xeon E5 v3/Core i7 Hot Plug'
    class      = base peripheral
    cap 10[40] = PCI-Express 1 root endpoint max data 128(128)
                 max read 128
    cap 05[80] = MSI supports 1 message, 64 bit 
    ecap 000b[100] = Vendor [1] ID 0006 Rev 1 Length 16
    ecap 000b[110] = Vendor [1] ID 0006 Rev 1 Length 16
    ecap 000b[120] = Vendor [1] ID 0006 Rev 1 Length 16
    ecap 000b[130] = Vendor [1] ID 0006 Rev 1 Length 16

none68@pci0:0:5:2:	class=0x088000 rev=0x02 hdr=0x00 vendor=0x8086 device=0x2f2a subvendor=0x0000 subdevice=0x0000
    vendor     = 'Intel Corporation'
    device     = 'Xeon E7 v3/Xeon E5 v3/Core i7 RAS, Control Status and Global Errors'
    class      = base peripheral
    cap 10[40] = PCI-Express 2 root endpoint max data 128(128) RO NS
                 max read 128

ioapic0@pci0:0:5:4:	class=0x080020 rev=0x02 hdr=0x00 vendor=0x8086 device=0x2f2c subvendor=0x1028 subdevice=0x0617
    vendor     = 'Intel Corporation'
    device     = 'Xeon E7 v3/Xeon E5 v3/Core i7 I/O APIC'
    class      = base peripheral
    subclass   = interrupt controller
    bar   [10] = type Memory, range 32, base 0xf713d000, size 4096, enabled
    cap 10[44] = PCI-Express 1 root endpoint max data 128(128)
                 max read 128
    cap 01[e0] = powerspec 3  supports D0 D3  current D0

none69@pci0:0:17:0:	class=0xff0000 rev=0x05 hdr=0x00 vendor=0x8086 device=0x8d7c subvendor=0x1028 subdevice=0x0617
    vendor     = 'Intel Corporation'
    device     = 'C610/X99 series chipset SPSR'
    cap 10[40] = PCI-Express 2 root endpoint max data 128(128)
                 max read 128
                 link x1(x1) speed 2.5(2.5) ASPM disabled(L0s/L1)
    cap 01[80] = powerspec 3  supports D0 D3  current D0

xhci0@pci0:0:20:0:	class=0x0c0330 rev=0x05 hdr=0x00 vendor=0x8086 device=0x8d31 subvendor=0x1028 subdevice=0x0617
    vendor     = 'Intel Corporation'
    device     = 'C610/X99 series chipset USB xHCI Host Controller'
    class      = serial bus
    subclass   = USB
    bar   [10] = type Memory, range 64, base 0xf7120000, size 65536, enabled
    cap 01[70] = powerspec 2  supports D0 D3  current D0

none70@pci0:0:22:0:	class=0x078000 rev=0x05 hdr=0x00 vendor=0x8086 device=0x8d3a subvendor=0x1028 subdevice=0x0617
    vendor     = 'Intel Corporation'
    device     = 'C610/X99 series chipset MEI Controller'
    class      = simple comms
    bar   [10] = type Memory, range 64, base 0xf713c000, size 16, enabled
    cap 01[50] = powerspec 3  supports D0 D3  current D0
    cap 05[8c] = MSI supports 1 message, 64 bit 

em0@pci0:0:25:0:	class=0x020000 rev=0x05 hdr=0x00 vendor=0x8086 device=0x153a subvendor=0x1028 subdevice=0x0617
    vendor     = 'Intel Corporation'
    device     = 'Ethernet Connection I217-LM'
    class      = network
    subclass   = ethernet
    bar   [10] = type Memory, range 32, base 0xf7100000, size 131072, enabled
    bar   [14] = type Memory, range 32, base 0xf7139000, size 4096, enabled
    bar   [18] = type I/O Port, range 32, base 0xf020, size 32, enabled
    cap 01[c8] = powerspec 2  supports D0 D3  current D0
    cap 05[d0] = MSI supports 1 message, 64 bit enabled with 1 message
    cap 13[e0] = PCI Advanced Features: FLR TP

ehci0@pci0:0:26:0:	class=0x0c0320 rev=0x05 hdr=0x00 vendor=0x8086 device=0x8d2d subvendor=0x1028 subdevice=0x0617
    vendor     = 'Intel Corporation'
    device     = 'C610/X99 series chipset USB Enhanced Host Controller'
    class      = serial bus
    subclass   = USB
    bar   [10] = type Memory, range 32, base 0xf7138000, size 1024, enabled
    cap 01[50] = powerspec 2  supports D0 D3  current D0
    cap 0a[58] = EHCI Debug Port at offset 0xa0 in map 0x14
    cap 13[98] = PCI Advanced Features: FLR TP

hdac1@pci0:0:27:0:	class=0x040300 rev=0x05 hdr=0x00 vendor=0x8086 device=0x8d20 subvendor=0x1028 subdevice=0x0617
    vendor     = 'Intel Corporation'
    device     = 'C610/X99 series chipset HD Audio Controller'
    class      = multimedia
    subclass   = HDA
    bar   [10] = type Memory, range 64, base 0xf7130000, size 16384, enabled
    cap 01[50] = powerspec 2  supports D0 D3  current D0
    cap 05[60] = MSI supports 1 message, 64 bit enabled with 1 message
    cap 10[70] = PCI-Express 1 root endpoint max data 128(128) FLR NS
                 max read 128
    ecap 0002[100] = VC 1 max VC1

pcib9@pci0:0:28:0:	class=0x060400 rev=0xd5 hdr=0x01 vendor=0x8086 device=0x8d10 subvendor=0x1028 subdevice=0x0617
    vendor     = 'Intel Corporation'
    device     = 'C610/X99 series chipset PCI Express Root Port'
    class      = bridge
    subclass   = PCI-PCI
    cap 10[40] = PCI-Express 2 root port max data 128(128)
                 max read 128
                 link x0(x1) speed 0.0(5.0) ASPM disabled(L0s/L1)
                 slot 0 power limit 0 mW HotPlug(empty) surprise
    cap 05[80] = MSI supports 1 message 
    cap 0d[90] = PCI Bridge subvendor=0x1028 subdevice=0x0617
    cap 01[a0] = powerspec 3  supports D0 D3  current D0

pcib10@pci0:0:28:1:	class=0x060400 rev=0xd5 hdr=0x01 vendor=0x8086 device=0x8d12 subvendor=0x1028 subdevice=0x0617
    vendor     = 'Intel Corporation'
    device     = 'C610/X99 series chipset PCI Express Root Port'
    class      = bridge
    subclass   = PCI-PCI
    cap 10[40] = PCI-Express 2 root port max data 128(128)
                 max read 128
                 link x1(x1) speed 2.5(5.0) ASPM disabled(L1)
                 slot 6 power limit 100 mW
    cap 05[80] = MSI supports 1 message enabled with 1 message
    cap 0d[90] = PCI Bridge subvendor=0x1028 subdevice=0x0617
    cap 01[a0] = powerspec 3  supports D0 D3  current D0

ehci1@pci0:0:29:0:	class=0x0c0320 rev=0x05 hdr=0x00 vendor=0x8086 device=0x8d26 subvendor=0x1028 subdevice=0x0617
    vendor     = 'Intel Corporation'
    device     = 'C610/X99 series chipset USB Enhanced Host Controller'
    class      = serial bus
    subclass   = USB
    bar   [10] = type Memory, range 32, base 0xf7137000, size 1024, enabled
    cap 01[50] = powerspec 2  supports D0 D3  current D0
    cap 0a[58] = EHCI Debug Port at offset 0xa0 in map 0x14
    cap 13[98] = PCI Advanced Features: FLR TP

isab0@pci0:0:31:0:	class=0x060100 rev=0x05 hdr=0x00 vendor=0x8086 device=0x8d44 subvendor=0x1028 subdevice=0x0617
    vendor     = 'Intel Corporation'
    device     = 'C610/X99 series chipset LPC Controller'
    class      = bridge
    subclass   = PCI-ISA
    cap 09[e0] = vendor (length 12) Intel cap 1 version 0
		 features: AMT, 4 PCI-e x1 slots

ahci0@pci0:0:31:2:	class=0x010400 rev=0x05 hdr=0x00 vendor=0x8086 device=0x2826 subvendor=0x1028 subdevice=0x0617
    vendor     = 'Intel Corporation'
    device     = 'C600/X79 series chipset SATA RAID Controller'
    class      = mass storage
    subclass   = RAID
    bar   [10] = type I/O Port, range 32, base 0xf070, size 8, enabled
    bar   [14] = type I/O Port, range 32, base 0xf060, size 4, enabled
    bar   [18] = type I/O Port, range 32, base 0xf050, size 8, enabled
    bar   [1c] = type I/O Port, range 32, base 0xf040, size 4, enabled
    bar   [20] = type I/O Port, range 32, base 0xf000, size 32, enabled
    bar   [24] = type Memory, range 32, base 0xf7136000, size 2048, enabled
    cap 05[80] = MSI supports 1 message enabled with 1 message
    cap 01[70] = powerspec 3  supports D0 D3  current D0
    cap 12[a8] = SATA Index-Data Pair

ichsmb0@pci0:0:31:3:	class=0x0c0500 rev=0x05 hdr=0x00 vendor=0x8086 device=0x8d22 subvendor=0x1028 subdevice=0x0617
    vendor     = 'Intel Corporation'
    device     = 'C610/X99 series chipset SMBus Controller'
    class      = serial bus
    subclass   = SMBus
    bar   [10] = type Memory, range 64, base 0xf7135000, size 256, enabled
    bar   [20] = type I/O Port, range 32, base 0x580, size 32, enabled

vgapci0@pci0:3:0:0:	class=0x030000 rev=0xa1 hdr=0x00 vendor=0x10de device=0x1401 subvendor=0x1462 subdevice=0x3200
    vendor     = 'NVIDIA Corporation'
    device     = 'GM206 [GeForce GTX 960]'
    class      = display
    subclass   = VGA
    bar   [10] = type Memory, range 32, base 0xf6000000, size 16777216, enabled
    bar   [14] = type Prefetchable Memory, range 64, base 0xe0000000, size 268435456, enabled
    bar   [1c] = type Prefetchable Memory, range 64, base 0xf0000000, size 33554432, enabled
    bar   [24] = type I/O Port, range 32, base 0xe000, size 128, enabled
    cap 01[60] = powerspec 3  supports D0 D3  current D0
    cap 05[68] = MSI supports 1 message, 64 bit enabled with 1 message
    cap 10[78] = PCI-Express 2 legacy endpoint max data 256(256) RO
                 max read 512
                 link x16(x16) speed 2.5(8.0) ClockPM enabled
    ecap 0002[100] = VC 1 max VC0
    ecap 001e[258] = L1 PM Substates 1
    ecap 0004[128] = Power Budgeting 1
    ecap 0001[420] = AER 2 0 fatal 0 non-fatal 0 corrected
    ecap 000b[600] = Vendor [1] ID 0001 Rev 1 Length 36
    ecap 0019[900] = PCIe Sec 1 lane errors 0

hdac0@pci0:3:0:1:	class=0x040300 rev=0xa1 hdr=0x00 vendor=0x10de device=0x0fba subvendor=0x1462 subdevice=0x3200
    vendor     = 'NVIDIA Corporation'
    device     = 'GM206 High Definition Audio Controller'
    class      = multimedia
    subclass   = HDA
    bar   [10] = type Memory, range 32, base 0xf7080000, size 16384, enabled
    cap 01[60] = powerspec 3  supports D0 D3  current D0
    cap 05[68] = MSI supports 1 message, 64 bit enabled with 1 message
    cap 10[78] = PCI-Express 2 endpoint max data 256(256) NS
                 max read 512
                 link x16(x16) speed 2.5(8.0) ClockPM enabled
    ecap 0001[100] = AER 2 0 fatal 0 non-fatal 1 corrected

pcib11@pci0:9:0:0:	class=0x060400 rev=0x00 hdr=0x01 vendor=0x104c device=0x8240 subvendor=0x0000 subdevice=0x0000
    vendor     = 'Texas Instruments'
    device     = 'XIO2001 PCI Express-to-PCI Bridge'
    class      = bridge
    subclass   = PCI-PCI
    cap 0d[40] = PCI Bridge subvendor=0x0000 subdevice=0x0000
    cap 01[48] = powerspec 3  supports D0 D1 D2 D3  current D0
    cap 05[50] = MSI supports 16 messages, 64 bit 
    cap 10[70] = PCI-Express 2 PCI bridge max data 128(512)
                 max read 512
                 link x1(x1) speed 2.5(2.5) ASPM disabled(L0s/L1) ClockPM disabled
    ecap 0001[100] = AER 1 0 fatal 0 non-fatal 1 corrected
