hostb0@pci0:0:0:0:	class=0x060000 rev=0x0e hdr=0x00 vendor=0x8086 device=0x0f00 subvendor=0x0000 subdevice=0x0000
    vendor     = 'Intel Corporation'
    device     = 'Atom Processor Z36xxx/Z37xxx Series SoC Transaction Register'
    class      = bridge
    subclass   = HOST-PCI

ahci0@pci0:0:19:0:	class=0x010601 rev=0x0e hdr=0x00 vendor=0x8086 device=0x0f23 subvendor=0x1849 subdevice=0x0f23
    vendor     = 'Intel Corporation'
    device     = 'Atom Processor E3800 Series SATA AHCI Controller'
    class      = mass storage
    subclass   = SATA
    bar   [10] = type I/O Port, range 32, base 0xf070, size 8, enabled
    bar   [14] = type I/O Port, range 32, base 0xf060, size 4, enabled
    bar   [18] = type I/O Port, range 32, base 0xf050, size 8, enabled
    bar   [1c] = type I/O Port, range 32, base 0xf040, size 4, enabled
    bar   [20] = type I/O Port, range 32, base 0xf020, size 32, enabled
    bar   [24] = type Memory, range 32, base 0xb0616000, size 2048, enabled
    cap 05[80] = MSI supports 1 message enabled with 1 message
    cap 01[70] = powerspec 3  supports D0 D3  current D0
    cap 12[a8] = SATA Index-Data Pair

xhci0@pci0:0:20:0:	class=0x0c0330 rev=0x0e hdr=0x00 vendor=0x8086 device=0x0f35 subvendor=0x1849 subdevice=0x0f35
    vendor     = 'Intel Corporation'
    device     = 'Atom Processor Z36xxx/Z37xxx, Celeron N2000 Series USB xHCI'
    class      = serial bus
    subclass   = USB
    bar   [10] = type Memory, range 64, base 0xb0600000, size 65536, enabled
    cap 01[70] = powerspec 2  supports D0 D3  current D0
    cap 05[80] = MSI supports 8 messages, 64 bit enabled with 1 message

none0@pci0:0:26:0:	class=0x108000 rev=0x0e hdr=0x00 vendor=0x8086 device=0x0f18 subvendor=0x1849 subdevice=0x0f18
    vendor     = 'Intel Corporation'
    device     = 'Atom Processor Z36xxx/Z37xxx Series Trusted Execution Engine'
    class      = encrypt/decrypt
    bar   [10] = type Memory, range 32, base 0xb0400000, size 1048576, enabled
    bar   [14] = type Memory, range 32, base 0xb0300000, size 1048576, enabled
    cap 01[80] = powerspec 3  supports D0 D3  current D0
    cap 05[a0] = MSI supports 1 message 

hdac0@pci0:0:27:0:	class=0x040300 rev=0x0e hdr=0x00 vendor=0x8086 device=0x0f04 subvendor=0x1849 subdevice=0xa662
    vendor     = 'Intel Corporation'
    device     = 'Atom Processor Z36xxx/Z37xxx Series High Definition Audio Controller'
    class      = multimedia
    subclass   = HDA
    bar   [10] = type Memory, range 64, base 0xb0610000, size 16384, enabled
    cap 01[50] = powerspec 2  supports D0 D3  current D0
    cap 05[60] = MSI supports 1 message, 64 bit enabled with 1 message

pcib1@pci0:0:28:0:	class=0x060400 rev=0x0e hdr=0x01 vendor=0x8086 device=0x0f48 subvendor=0x1849 subdevice=0x0f48
    vendor     = 'Intel Corporation'
    device     = 'Atom Processor E3800 Series PCI Express Root Port 1'
    class      = bridge
    subclass   = PCI-PCI
    cap 10[40] = PCI-Express 2 root port max data 128(128)
                 max read 128
                 link x0(x1) speed 0.0(5.0) ASPM disabled(L0s/L1)
                 slot 0 power limit 100 mW HotPlug(empty) surprise
    cap 05[80] = MSI supports 1 message enabled with 1 message
    cap 0d[90] = PCI Bridge subvendor=0x1849 subdevice=0x0f48
    cap 01[a0] = powerspec 3  supports D0 D3  current D0

pcib2@pci0:0:28:1:	class=0x060400 rev=0x0e hdr=0x01 vendor=0x8086 device=0x0f4a subvendor=0x1849 subdevice=0x0f4a
    vendor     = 'Intel Corporation'
    device     = 'Atom Processor E3800 Series PCI Express Root Port 2'
    class      = bridge
    subclass   = PCI-PCI
    cap 10[40] = PCI-Express 2 root port max data 128(128)
                 max read 128
                 link x1(x1) speed 2.5(5.0) ASPM disabled(L0s/L1)
                 slot 1 power limit 100 mW HotPlug(present) surprise
    cap 05[80] = MSI supports 1 message enabled with 1 message
    cap 0d[90] = PCI Bridge subvendor=0x1849 subdevice=0x0f4a
    cap 01[a0] = powerspec 3  supports D0 D3  current D0

pcib3@pci0:0:28:2:	class=0x060400 rev=0x0e hdr=0x01 vendor=0x8086 device=0x0f4c subvendor=0x1849 subdevice=0x0f4c
    vendor     = 'Intel Corporation'
    device     = 'Atom Processor E3800 Series PCI Express Root Port 3'
    class      = bridge
    subclass   = PCI-PCI
    cap 10[40] = PCI-Express 2 root port max data 128(128)
                 max read 128
                 link x0(x1) speed 0.0(5.0) ASPM disabled(L0s/L1)
                 slot 2 power limit 100 mW HotPlug(empty) surprise
    cap 05[80] = MSI supports 1 message enabled with 1 message
    cap 0d[90] = PCI Bridge subvendor=0x1849 subdevice=0x0f4c
    cap 01[a0] = powerspec 3  supports D0 D3  current D0

pcib4@pci0:0:28:3:	class=0x060400 rev=0x0e hdr=0x01 vendor=0x8086 device=0x0f4e subvendor=0x1849 subdevice=0x0f4e
    vendor     = 'Intel Corporation'
    device     = 'Atom Processor E3800 Series PCI Express Root Port 4'
    class      = bridge
    subclass   = PCI-PCI
    cap 10[40] = PCI-Express 2 root port max data 128(128)
                 max read 128
                 link x1(x1) speed 2.5(5.0) ASPM disabled(L0s/L1)
                 slot 3 power limit 100 mW HotPlug(present) surprise
    cap 05[80] = MSI supports 1 message enabled with 1 message
    cap 0d[90] = PCI Bridge subvendor=0x1849 subdevice=0x0f4e
    cap 01[a0] = powerspec 3  supports D0 D3  current D0

isab0@pci0:0:31:0:	class=0x060100 rev=0x0e hdr=0x00 vendor=0x8086 device=0x0f1c subvendor=0x1849 subdevice=0x0f1c
    vendor     = 'Intel Corporation'
    device     = 'Atom Processor Z36xxx/Z37xxx Series Power Control Unit'
    class      = bridge
    subclass   = PCI-ISA
    cap 09[e0] = vendor (length 12) Intel cap 1 version 0
		 features: 4 PCI-e x1 slots

ichsmb0@pci0:0:31:3:	class=0x0c0500 rev=0x0e hdr=0x00 vendor=0x8086 device=0x0f12 subvendor=0x1849 subdevice=0x0f12
    vendor     = 'Intel Corporation'
    device     = 'Atom Processor E3800/CE2700 Series SMBus Controller'
    class      = serial bus
    subclass   = SMBus
    bar   [10] = type Memory, range 32, base 0xb0614000, size 32, enabled
    bar   [20] = type I/O Port, range 32, base 0xf000, size 32, enabled
    cap 01[50] = powerspec 3  supports D0 D3  current D0

vgapci0@pci0:2:0:0:	class=0x030000 rev=0xc7 hdr=0x00 vendor=0x1002 device=0x699f subvendor=0x1da2 subdevice=0xe367
    vendor     = 'Advanced Micro Devices, Inc. [AMD/ATI]'
    device     = 'Lexa PRO [Radeon 540/540X/550/550X / RX 540X/550/550X]'
    class      = display
    subclass   = VGA
    bar   [10] = type Prefetchable Memory, range 64, base 0xa0000000, size 268435456, enabled
    bar   [18] = type Prefetchable Memory, range 64, base 0xb0000000, size 2097152, enabled
    bar   [20] = type I/O Port, range 32, base 0xe000, size 256, enabled
    bar   [24] = type Memory, range 32, base 0xb0200000, size 262144, enabled
    cap 09[48] = vendor (length 8)
    cap 01[50] = powerspec 3  supports D0 D1 D2 D3  current D0
    cap 10[58] = PCI-Express 2 legacy endpoint max data 128(256) NS
                 max read 512
                 link x1(x8) speed 2.5(8.0) ASPM disabled(L1) ClockPM enabled
    cap 05[a0] = MSI supports 1 message, 64 bit enabled with 1 message
    ecap 000b[100] = Vendor [1] ID 0001 Rev 1 Length 16
    ecap 0001[150] = AER 2 0 fatal 1 non-fatal 1 corrected
    ecap 0015[200] = Resizable BAR 1
    ecap 0019[270] = PCIe Sec 1 lane errors 0
    ecap 000f[2b0] = ATS 1
    ecap 0013[2c0] = Page Page Request 1
    ecap 001b[2d0] = Process Address Space ID 1
    ecap 0018[320] = LTR 1
    ecap 000e[328] = ARI 1
    ecap 001e[370] = L1 PM Substates 1

hdac1@pci0:2:0:1:	class=0x040300 rev=0x00 hdr=0x00 vendor=0x1002 device=0xaae0 subvendor=0x1da2 subdevice=0xaae0
    vendor     = 'Advanced Micro Devices, Inc. [AMD/ATI]'
    device     = 'Baffin HDMI/DP Audio [Radeon RX 550 640SP / RX 560/560X]'
    class      = multimedia
    subclass   = HDA
    bar   [10] = type Memory, range 64, base 0xb0260000, size 16384, enabled
    cap 09[48] = vendor (length 8)
    cap 01[50] = powerspec 3  supports D0 D1 D2 D3  current D0
    cap 10[58] = PCI-Express 2 legacy endpoint max data 128(256) NS
                 max read 512
                 link x1(x8) speed 2.5(8.0) ASPM disabled(L1) ClockPM enabled
    cap 05[a0] = MSI supports 1 message, 64 bit enabled with 1 message
    ecap 000b[100] = Vendor [1] ID 0001 Rev 1 Length 16
    ecap 0001[150] = AER 2 0 fatal 1 non-fatal 1 corrected
    ecap 000e[328] = ARI 1

re0@pci0:4:0:0:	class=0x020000 rev=0x11 hdr=0x00 vendor=0x10ec device=0x8168 subvendor=0x1849 subdevice=0x8168
    vendor     = 'Realtek Semiconductor Co., Ltd.'
    device     = 'RTL8111/8168/8411 PCI Express Gigabit Ethernet Controller'
    class      = network
    subclass   = ethernet
    bar   [10] = type I/O Port, range 32, base 0xd000, size 256, enabled
    bar   [18] = type Memory, range 64, base 0xb0504000, size 4096, enabled
    bar   [20] = type Prefetchable Memory, range 64, base 0xb0500000, size 16384, enabled
    cap 01[40] = powerspec 3  supports D0 D1 D2 D3  current D0
    cap 05[50] = MSI supports 1 message, 64 bit 
    cap 10[70] = PCI-Express 2 endpoint MSI 1 max data 128(128)
                 max read 4096
                 link x1(x1) speed 2.5(2.5) ASPM disabled(L0s/L1) ClockPM disabled
    cap 11[b0] = MSI-X supports 4 messages, enabled
                 Table in map 0x20[0x0], PBA in map 0x20[0x800]
    cap 03[d0] = VPD
    ecap 0001[100] = AER 1 0 fatal 0 non-fatal 2 corrected
    ecap 0002[140] = VC 1 max VC0
    ecap 0003[160] = Serial 1 01000000684ce000
    ecap 0018[170] = LTR 1
