hostb0@pci0:0:0:0:	class=0x060000 rev=0x0c hdr=0x00 vendor=0x8086 device=0x3e34 subvendor=0x17aa subdevice=0x5072
    vendor     = 'Intel Corporation'
    device     = 'Coffee Lake HOST and DRAM Controller'
    class      = bridge
    subclass   = HOST-PCI
    cap 09[e0] = vendor (length 16) Intel cap 0 version 1

vgapci0@pci0:0:2:0:	class=0x030000 rev=0x02 hdr=0x00 vendor=0x8086 device=0x3ea0 subvendor=0x17aa subdevice=0x5073
    vendor     = 'Intel Corporation'
    device     = 'WhiskeyLake-U GT2 [UHD Graphics 620]'
    class      = display
    subclass   = VGA
    bar   [10] = type Memory, range 64, base 0xb1000000, size 16777216, enabled
    bar   [18] = type Prefetchable Memory, range 64, base 0x80000000, size 536870912, enabled
    bar   [20] = type I/O Port, range 32, base 0x5000, size 64, enabled
    cap 09[40] = vendor (length 12) Intel cap 0 version 1
    cap 10[70] = PCI-Express 2 root endpoint max data 128(128) FLR
                 max read 128
    cap 05[ac] = MSI supports 1 message enabled with 1 message
    cap 01[d0] = powerspec 2  supports D0 D3  current D0
    ecap 001b[100] = Process Address Space ID 1
    ecap 000f[200] = ATS 1
    ecap 0013[300] = Page Page Request 1

none0@pci0:0:4:0:	class=0x118000 rev=0x0c hdr=0x00 vendor=0x8086 device=0x1903 subvendor=0x17aa subdevice=0x5072
    vendor     = 'Intel Corporation'
    device     = 'Xeon E3-1200 v5/E3-1500 v5/6th Gen Core Processor Thermal Subsystem'
    class      = dasp
    bar   [10] = type Memory, range 64, base 0xb2510000, size 32768, enabled
    cap 05[90] = MSI supports 1 message 
    cap 01[d0] = powerspec 3  supports D0 D3  current D0
    cap 09[e0] = vendor (length 12) Intel cap 0 version 1

none1@pci0:0:8:0:	class=0x088000 rev=0x00 hdr=0x00 vendor=0x8086 device=0x1911 subvendor=0x17aa subdevice=0x5072
    vendor     = 'Intel Corporation'
    device     = 'Xeon E3-1200 v5/v6 / E3-1500 v5 / 6th/7th/8th Gen Core Processor Gaussian Mixture Model'
    class      = base peripheral
    bar   [10] = type Memory, range 64, base 0xb2520000, size 4096, enabled
    cap 05[90] = MSI supports 1 message 
    cap 01[dc] = powerspec 2  supports D0 D3  current D0
    cap 13[f0] = PCI Advanced Features: FLR TP

pchtherm0@pci0:0:18:0:	class=0x118000 rev=0x30 hdr=0x00 vendor=0x8086 device=0x9df9 subvendor=0x17aa subdevice=0x5072
    vendor     = 'Intel Corporation'
    device     = 'Cannon Point-LP Thermal Controller'
    class      = dasp
    bar   [10] = type Memory, range 64, base 0xb2521000, size 4096, enabled
    cap 01[50] = powerspec 3  supports D0 D3  current D0
    cap 05[80] = MSI supports 1 message 

xhci0@pci0:0:20:0:	class=0x0c0330 rev=0x30 hdr=0x00 vendor=0x8086 device=0x9ded subvendor=0x17aa subdevice=0x5072
    vendor     = 'Intel Corporation'
    device     = 'Cannon Point-LP USB 3.1 xHCI Controller'
    class      = serial bus
    subclass   = USB
    bar   [10] = type Memory, range 64, base 0xb2500000, size 65536, enabled
    cap 01[70] = powerspec 2  supports D0 D3  current D0
    cap 05[80] = MSI supports 8 messages, 64 bit enabled with 1 message
    cap 09[90] = vendor (length 20) Intel cap 15 version 0

none2@pci0:0:20:2:	class=0x050000 rev=0x30 hdr=0x00 vendor=0x8086 device=0x9def subvendor=0x0000 subdevice=0x0000
    vendor     = 'Intel Corporation'
    device     = 'Cannon Point-LP Shared SRAM'
    class      = memory
    subclass   = RAM
    bar   [10] = type Memory, range 64, base 0xb251c000, size 8192, enabled
    bar   [18] = type Memory, range 64, base 0xb2522000, size 4096, enabled
    cap 01[80] = powerspec 3  supports D0 D3  current D0

none3@pci0:0:22:0:	class=0x078000 rev=0x30 hdr=0x00 vendor=0x8086 device=0x9de0 subvendor=0x17aa subdevice=0x5072
    vendor     = 'Intel Corporation'
    device     = 'Cannon Point-LP MEI Controller'
    class      = simple comms
    bar   [10] = type Memory, range 64, base 0xb2523000, size 4096, enabled
    cap 01[50] = powerspec 3  supports D0 D3  current D0
    cap 05[8c] = MSI supports 1 message, 64 bit 
    cap 09[a4] = vendor (length 20) Intel cap 15 version 0

ahci0@pci0:0:23:0:	class=0x010601 rev=0x30 hdr=0x00 vendor=0x8086 device=0x9dd3 subvendor=0x17aa subdevice=0x5072
    vendor     = 'Intel Corporation'
    device     = 'Cannon Point-LP SATA Controller [AHCI Mode]'
    class      = mass storage
    subclass   = SATA
    bar   [10] = type Memory, range 32, base 0xb251e000, size 8192, enabled
    bar   [14] = type Memory, range 32, base 0xb2527000, size 256, enabled
    bar   [18] = type I/O Port, range 32, base 0x5080, size 8, enabled
    bar   [1c] = type I/O Port, range 32, base 0x5088, size 4, enabled
    bar   [20] = type I/O Port, range 32, base 0x5060, size 32, enabled
    bar   [24] = type Memory, range 32, base 0xb2526000, size 2048, enabled
    cap 05[80] = MSI supports 1 message enabled with 1 message
    cap 01[70] = powerspec 3  supports D0 D3  current D0
    cap 12[a8] = SATA Index-Data Pair

pcib1@pci0:0:28:0:	class=0x060400 rev=0xf0 hdr=0x01 vendor=0x8086 device=0x9db8 subvendor=0x17aa subdevice=0x5072
    vendor     = 'Intel Corporation'
    device     = 'Cannon Point-LP PCI Express Root Port'
    class      = bridge
    subclass   = PCI-PCI
    cap 10[40] = PCI-Express 2 root port max data 128(256) ARI disabled
                 max read 128
                 link x1(x1) speed 2.5(8.0) ASPM L0s/L1(L0s/L1)
                 slot 0 power limit 100 mW
    cap 05[80] = MSI supports 1 message 
    cap 0d[90] = PCI Bridge subvendor=0x17aa subdevice=0x5072
    cap 01[a0] = powerspec 3  supports D0 D3  current D0
    ecap 0001[100] = AER 1 0 fatal 0 non-fatal 0 corrected
    ecap 000d[140] = ACS 1
    ecap 001f[150] = Precision Time Measurement 1
    ecap 001e[200] = L1 PM Substates 1
    ecap 0019[220] = PCIe Sec 1 lane errors 0
    ecap 001d[250] = Downstream Port Containment 1

pcib2@pci0:0:28:4:	class=0x060400 rev=0xf0 hdr=0x01 vendor=0x8086 device=0x9dbc subvendor=0x17aa subdevice=0x5072
    vendor     = 'Intel Corporation'
    device     = 'Cannon Point-LP PCI Express Root Port'
    class      = bridge
    subclass   = PCI-PCI
    cap 10[40] = PCI-Express 2 root port max data 256(256) ARI disabled
                 max read 128
                 link x4(x4) speed 8.0(8.0)
                 slot 4 power limit 250 mW
    cap 05[80] = MSI supports 1 message 
    cap 0d[90] = PCI Bridge subvendor=0x17aa subdevice=0x5072
    cap 01[a0] = powerspec 3  supports D0 D3  current D0
    ecap 0001[100] = AER 1 0 fatal 0 non-fatal 0 corrected
    ecap 000d[140] = ACS 1
    ecap 001f[150] = Precision Time Measurement 1
    ecap 0019[220] = PCIe Sec 1 lane errors 0
    ecap 001d[250] = Downstream Port Containment 1

pcib3@pci0:0:29:0:	class=0x060400 rev=0xf0 hdr=0x01 vendor=0x8086 device=0x9db0 subvendor=0x17aa subdevice=0x5072
    vendor     = 'Intel Corporation'
    device     = 'Cannon Point-LP PCI Express Root Port'
    class      = bridge
    subclass   = PCI-PCI
    cap 10[40] = PCI-Express 2 root port max data 128(256) ARI disabled
                 max read 128
                 link x1(x1) speed 2.5(8.0) ASPM L1(L0s/L1)
                 slot 8 power limit 100 mW
    cap 05[80] = MSI supports 1 message 
    cap 0d[90] = PCI Bridge subvendor=0x17aa subdevice=0x5072
    cap 01[a0] = powerspec 3  supports D0 D3  current D0
    ecap 0001[100] = AER 1 0 fatal 0 non-fatal 0 corrected
    ecap 000d[140] = ACS 1
    ecap 001f[150] = Precision Time Measurement 1
    ecap 0019[220] = PCIe Sec 1 lane errors 0
    ecap 001d[250] = Downstream Port Containment 1

pcib4@pci0:0:29:2:	class=0x060400 rev=0xf0 hdr=0x01 vendor=0x8086 device=0x9db2 subvendor=0x17aa subdevice=0x5072
    vendor     = 'Intel Corporation'
    device     = 'Cannon Point-LP PCI Express Root Port'
    class      = bridge
    subclass   = PCI-PCI
    cap 10[40] = PCI-Express 2 root port max data 128(256) ARI disabled
                 max read 128
                 link x1(x1) speed 2.5(8.0) ASPM L0s/L1(L0s/L1)
                 slot 10 power limit 100 mW
    cap 05[80] = MSI supports 1 message 
    cap 0d[90] = PCI Bridge subvendor=0x17aa subdevice=0x5072
    cap 01[a0] = powerspec 3  supports D0 D3  current D0
    ecap 0001[100] = AER 1 0 fatal 0 non-fatal 0 corrected
    ecap 000d[140] = ACS 1
    ecap 001f[150] = Precision Time Measurement 1
    ecap 001e[200] = L1 PM Substates 1
    ecap 0019[220] = PCIe Sec 1 lane errors 0
    ecap 001d[250] = Downstream Port Containment 1

isab0@pci0:0:31:0:	class=0x060100 rev=0x30 hdr=0x00 vendor=0x8086 device=0x9d84 subvendor=0x17aa subdevice=0x5072
    vendor     = 'Intel Corporation'
    device     = 'Cannon Point-LP LPC Controller'
    class      = bridge
    subclass   = PCI-ISA

hdac0@pci0:0:31:3:	class=0x040380 rev=0x30 hdr=0x00 vendor=0x8086 device=0x9dc8 subvendor=0x17aa subdevice=0x5072
    vendor     = 'Intel Corporation'
    device     = 'Cannon Point-LP High Definition Audio Controller'
    class      = multimedia
    subclass   = HDA
    bar   [10] = type Memory, range 64, base 0xb2518000, size 16384, enabled
    bar   [20] = type Memory, range 64, base 0xb2000000, size 1048576, enabled
    cap 01[50] = powerspec 3  supports D0 D3  current D0
    cap 09[80] = vendor (length 20) Intel cap 15 version 0
    cap 05[60] = MSI supports 1 message, 64 bit enabled with 1 message

none4@pci0:0:31:4:	class=0x0c0500 rev=0x30 hdr=0x00 vendor=0x8086 device=0x9da3 subvendor=0x17aa subdevice=0x5072
    vendor     = 'Intel Corporation'
    device     = 'Cannon Point-LP SMBus Controller'
    class      = serial bus
    subclass   = SMBus
    bar   [10] = type Memory, range 64, base 0xb2524000, size 256, enabled
    bar   [20] = type I/O Port, range 32, base 0xefa0, size 32, enabled

none5@pci0:0:31:5:	class=0x0c8000 rev=0x30 hdr=0x00 vendor=0x8086 device=0x9da4 subvendor=0x17aa subdevice=0x5072
    vendor     = 'Intel Corporation'
    device     = 'Cannon Point-LP SPI Controller'
    class      = serial bus
    bar   [10] = type Memory, range 32, base 0xfe010000, size 4096, enabled

rtsx0@pci0:2:0:0:	class=0xff0000 rev=0x01 hdr=0x00 vendor=0x10ec device=0x522a subvendor=0x17aa subdevice=0x5072
    vendor     = 'Realtek Semiconductor Co., Ltd.'
    device     = 'RTS522A PCI Express Card Reader'
    bar   [10] = type Memory, range 32, base 0xb2400000, size 4096, enabled
    cap 01[40] = powerspec 3  supports D0 D1 D2 D3  current D0
    cap 05[50] = MSI supports 1 message, 64 bit enabled with 1 message
    cap 10[70] = PCI-Express 2 endpoint max data 128(128) RO
                 max read 512
                 link x1(x1) speed 2.5(2.5) ASPM disabled(L0s/L1) ClockPM enabled
    ecap 0001[100] = AER 2 0 fatal 0 non-fatal 2 corrected
    ecap 0003[140] = Serial 1 00000001004ce000
    ecap 0018[150] = LTR 1
    ecap 001e[158] = L1 PM Substates 1

vgapci1@pci0:3:0:0:	class=0x038000 rev=0xc0 hdr=0x00 vendor=0x1002 device=0x699f subvendor=0x17aa subdevice=0x5073
    vendor     = 'Advanced Micro Devices, Inc. [AMD/ATI]'
    device     = 'Lexa PRO [Radeon 540/540X/550/550X / RX 540X/550/550X]'
    class      = display
    bar   [10] = type Prefetchable Memory, range 64, base 0xa0000000, size 268435456, enabled
    bar   [18] = type Prefetchable Memory, range 64, base 0xb0000000, size 2097152, enabled
    bar   [20] = type I/O Port, range 32, base 0x4000, size 256, enabled
    bar   [24] = type Memory, range 32, base 0xb2300000, size 262144, enabled
    cap 09[48] = vendor (length 8)
    cap 01[50] = powerspec 3  supports D0 D1 D2 D3  current D0
    cap 10[58] = PCI-Express 2 legacy endpoint max data 256(256) RO NS
                 max read 512
                 link x4(x8) speed 8.0(8.0) ASPM disabled(L1)
    cap 05[a0] = MSI supports 1 message, 64 bit 
    ecap 000b[100] = Vendor [1] ID 0001 Rev 1 Length 16
    ecap 0019[270] = PCIe Sec 1 lane errors 0
    ecap 0018[320] = LTR 1
    ecap 001e[370] = L1 PM Substates 1

re0@pci0:4:0:0:	class=0x020000 rev=0x10 hdr=0x00 vendor=0x10ec device=0x8168 subvendor=0x17aa subdevice=0x5072
    vendor     = 'Realtek Semiconductor Co., Ltd.'
    device     = 'RTL8111/8168/8411 PCI Express Gigabit Ethernet Controller'
    class      = network
    subclass   = ethernet
    bar   [10] = type I/O Port, range 32, base 0x3000, size 256, enabled
    bar   [18] = type Memory, range 64, base 0xb2204000, size 4096, enabled
    bar   [20] = type Memory, range 64, base 0xb2200000, size 16384, enabled
    cap 01[40] = powerspec 3  supports D0 D1 D2 D3  current D0
    cap 05[50] = MSI supports 1 message, 64 bit 
    cap 10[70] = PCI-Express 2 endpoint MSI 1 max data 128(128) RO
                 max read 4096
                 link x1(x1) speed 2.5(2.5) ASPM disabled(L0s/L1) ClockPM disabled
    cap 11[b0] = MSI-X supports 4 messages, enabled
                 Table in map 0x20[0x0], PBA in map 0x20[0x800]
    cap 03[d0] = VPD
    ecap 0001[100] = AER 2 0 fatal 0 non-fatal 1 corrected
    ecap 0002[140] = VC 1 max VC0
    ecap 0003[160] = Serial 1 01000000684ce000
    ecap 0018[170] = LTR 1
    ecap 001e[178] = L1 PM Substates 1

none6@pci0:5:0:0:	class=0x028000 rev=0x00 hdr=0x00 vendor=0x10ec device=0xb822 subvendor=0x17aa subdevice=0xb023
    vendor     = 'Realtek Semiconductor Co., Ltd.'
    device     = 'RTL8822BE 802.11a/b/g/n/ac WiFi adapter'
    class      = network
    bar   [10] = type I/O Port, range 32, base 0x2000, size 256, enabled
    bar   [18] = type Memory, range 64, base 0xb2100000, size 65536, enabled
    cap 01[40] = powerspec 3  supports D0 D1 D2 D3  current D0
    cap 05[50] = MSI supports 1 message, 64 bit 
    cap 10[70] = PCI-Express 2 endpoint max data 128(128) RO
                 max read 512
                 link x1(x1) speed 2.5(2.5) ASPM L0s/L1(L0s/L1) ClockPM enabled
    ecap 0001[100] = AER 2 0 fatal 0 non-fatal 2 corrected
    ecap 0003[148] = Serial 1 00e04cfffeb82201
    ecap 0018[158] = LTR 1
    ecap 001e[160] = L1 PM Substates 1
