hostb0@pci0:0:0:0:	class=0x060000 rev=0x07 hdr=0x00 vendor=0x8086 device=0x3c00 subvendor=0x1028 subdevice=0x04ce
    vendor     = 'Intel Corporation'
    device     = 'Xeon E5/Core i7 DMI2'
    class      = bridge
    subclass   = HOST-PCI
    cap 10[90] = PCI-Express 2 root port max data 128(128)
                 max read 128
                 link x0(x4) speed 0.0(2.5) ASPM disabled(L0s/L1)
    cap 01[e0] = powerspec 3  supports D0 D3  current D0
    ecap 000b[100] = Vendor [1] ID 0002 Rev 0 Length 12
    ecap 000b[144] = Vendor [1] ID 0004 Rev 1 Length 60
    ecap 000b[1d0] = Vendor [1] ID 0003 Rev 1 Length 10
    ecap 000b[280] = Vendor [1] ID 0004 Rev 2 Length 24

pcib1@pci0:0:1:0:	class=0x060400 rev=0x07 hdr=0x01 vendor=0x8086 device=0x3c02 subvendor=0x1028 subdevice=0x04ce
    vendor     = 'Intel Corporation'
    device     = 'Xeon E5/Core i7 IIO PCI Express Root Port 1a'
    class      = bridge
    subclass   = PCI-PCI
    cap 0d[40] = PCI Bridge subvendor=0x1028 subdevice=0x04ce
    cap 05[60] = MSI supports 2 messages, vector masks 
    cap 10[90] = PCI-Express 2 root port max data 256(256) ARI disabled
                 max read 128
                 link x1(x4) speed 5.0(8.0) ASPM disabled(L1)
    cap 01[e0] = powerspec 3  supports D0 D3  current D0
    ecap 000b[100] = Vendor [1] ID 0002 Rev 0 Length 12
    ecap 000d[110] = ACS 1
    ecap 0001[148] = AER 1 0 fatal 0 non-fatal 0 corrected
    ecap 000b[1d0] = Vendor [1] ID 0003 Rev 1 Length 10
    ecap 0019[250] = PCIe Sec 1 lane errors 0
    ecap 000b[280] = Vendor [1] ID 0004 Rev 2 Length 24

pcib2@pci0:0:1:1:	class=0x060400 rev=0x07 hdr=0x01 vendor=0x8086 device=0x3c03 subvendor=0x1028 subdevice=0x04ce
    vendor     = 'Intel Corporation'
    device     = 'Xeon E5/Core i7 IIO PCI Express Root Port 1b'
    class      = bridge
    subclass   = PCI-PCI
    cap 0d[40] = PCI Bridge subvendor=0x1028 subdevice=0x04ce
    cap 05[60] = MSI supports 2 messages, vector masks 
    cap 10[90] = PCI-Express 2 root port max data 256(256) ARI disabled
                 max read 128
                 link x1(x4) speed 5.0(8.0) ASPM disabled(L1)
    cap 01[e0] = powerspec 3  supports D0 D3  current D0
    ecap 000b[100] = Vendor [1] ID 0002 Rev 0 Length 12
    ecap 000d[110] = ACS 1
    ecap 0001[148] = AER 1 0 fatal 0 non-fatal 0 corrected
    ecap 000b[1d0] = Vendor [1] ID 0003 Rev 1 Length 10
    ecap 0019[250] = PCIe Sec 1 lane errors 0
    ecap 000b[280] = Vendor [1] ID 0004 Rev 2 Length 24

pcib3@pci0:0:2:0:	class=0x060400 rev=0x07 hdr=0x01 vendor=0x8086 device=0x3c04 subvendor=0x1028 subdevice=0x04ce
    vendor     = 'Intel Corporation'
    device     = 'Xeon E5/Core i7 IIO PCI Express Root Port 2a'
    class      = bridge
    subclass   = PCI-PCI
    cap 0d[40] = PCI Bridge subvendor=0x1028 subdevice=0x04ce
    cap 05[60] = MSI supports 2 messages, vector masks 
    cap 10[90] = PCI-Express 2 root port max data 128(256) ARI disabled
                 max read 128
                 link x0(x8) speed 0.0(8.0) ASPM disabled(L1)
    cap 01[e0] = powerspec 3  supports D0 D3  current D0
    ecap 000b[100] = Vendor [1] ID 0002 Rev 0 Length 12
    ecap 000d[110] = ACS 1
    ecap 0001[148] = AER 1 0 fatal 0 non-fatal 0 corrected
    ecap 000b[1d0] = Vendor [1] ID 0003 Rev 1 Length 10
    ecap 0019[250] = PCIe Sec 1 lane errors 0
    ecap 000b[280] = Vendor [1] ID 0004 Rev 2 Length 24

pcib4@pci0:0:2:2:	class=0x060400 rev=0x07 hdr=0x01 vendor=0x8086 device=0x3c06 subvendor=0x1028 subdevice=0x04ce
    vendor     = 'Intel Corporation'
    device     = 'Xeon E5/Core i7 IIO PCI Express Root Port 2c'
    class      = bridge
    subclass   = PCI-PCI
    cap 0d[40] = PCI Bridge subvendor=0x1028 subdevice=0x04ce
    cap 05[60] = MSI supports 2 messages, vector masks 
    cap 10[90] = PCI-Express 2 root port max data 256(256) ARI enabled
                 max read 128
                 link x8(x8) speed 5.0(8.0) ASPM disabled(L1)
    cap 01[e0] = powerspec 3  supports D0 D3  current D0
    ecap 000b[100] = Vendor [1] ID 0002 Rev 0 Length 12
    ecap 000d[110] = ACS 1
    ecap 0001[148] = AER 1 0 fatal 0 non-fatal 0 corrected
    ecap 000b[1d0] = Vendor [1] ID 0003 Rev 1 Length 10
    ecap 0019[250] = PCIe Sec 1 lane errors 0
    ecap 000b[280] = Vendor [1] ID 0004 Rev 2 Length 24

pcib5@pci0:0:3:0:	class=0x060400 rev=0x07 hdr=0x01 vendor=0x8086 device=0x3c08 subvendor=0x1028 subdevice=0x04ce
    vendor     = 'Intel Corporation'
    device     = 'Xeon E5/Core i7 IIO PCI Express Root Port 3a in PCI Express Mode'
    class      = bridge
    subclass   = PCI-PCI
    cap 0d[40] = PCI Bridge subvendor=0x1028 subdevice=0x04ce
    cap 05[60] = MSI supports 2 messages, vector masks 
    cap 10[90] = PCI-Express 2 root port max data 128(256) ARI disabled
                 max read 128
                 link x0(x16) speed 0.0(8.0) ASPM disabled(L1)
                 slot 3 power limit 25000 mW
    cap 01[e0] = powerspec 3  supports D0 D3  current D0
    ecap 000b[100] = Vendor [1] ID 0002 Rev 0 Length 12
    ecap 000d[110] = ACS 1
    ecap 0001[148] = AER 1 0 fatal 0 non-fatal 0 corrected
    ecap 000b[1d0] = Vendor [1] ID 0003 Rev 1 Length 10
    ecap 0019[250] = PCIe Sec 1 lane errors 0
    ecap 000b[280] = Vendor [1] ID 0004 Rev 2 Length 24

none0@pci0:0:5:0:	class=0x088000 rev=0x07 hdr=0x00 vendor=0x8086 device=0x3c28 subvendor=0x1028 subdevice=0x04ce
    vendor     = 'Intel Corporation'
    device     = 'Xeon E5/Core i7 Address Map, VTd_Misc, System Management'
    class      = base peripheral
    cap 10[40] = PCI-Express 2 root endpoint max data 128(128)
                 max read 128

none1@pci0:0:5:2:	class=0x088000 rev=0x07 hdr=0x00 vendor=0x8086 device=0x3c2a subvendor=0x1028 subdevice=0x04ce
    vendor     = 'Intel Corporation'
    device     = 'Xeon E5/Core i7 Control Status and Global Errors'
    class      = base peripheral
    cap 10[40] = PCI-Express 2 root endpoint max data 128(128)
                 max read 128

pcib6@pci0:0:17:0:	class=0x060400 rev=0x05 hdr=0x01 vendor=0x8086 device=0x1d3e subvendor=0x1028 subdevice=0x04ce
    vendor     = 'Intel Corporation'
    device     = 'C600/X79 series chipset PCI Express Virtual Root Port'
    class      = bridge
    subclass   = PCI-PCI
    cap 10[40] = PCI-Express 2 root port max data 128(128) ARI disabled
                 max read 128
                 link x1(x1) speed 2.5(2.5) ASPM disabled(L0s/L1)
    cap 01[80] = powerspec 3  supports D0 D3  current D0
    cap 0d[88] = PCI Bridge subvendor=0x1028 subdevice=0x04ce
    cap 05[90] = MSI supports 1 message 
    ecap 0001[100] = AER 1 0 fatal 0 non-fatal 0 corrected
    ecap 000d[138] = ACS 1

none2@pci0:0:22:0:	class=0x078000 rev=0x05 hdr=0x00 vendor=0x8086 device=0x1d3a subvendor=0x1028 subdevice=0x04ce
    vendor     = 'Intel Corporation'
    device     = 'C600/X79 series chipset MEI Controller'
    class      = simple comms
    bar   [10] = type Memory, range 64, base 0xdf8fc000, size 16, enabled
    cap 01[50] = powerspec 3  supports D0 D3  current D0
    cap 05[8c] = MSI supports 1 message, 64 bit 

none3@pci0:0:22:1:	class=0x078000 rev=0x05 hdr=0x00 vendor=0x8086 device=0x1d3b subvendor=0x1028 subdevice=0x04ce
    vendor     = 'Intel Corporation'
    device     = 'C600/X79 series chipset MEI Controller'
    class      = simple comms
    bar   [10] = type Memory, range 64, base 0xdf8fd000, size 16, enabled
    cap 01[50] = powerspec 3  supports D0 D3  current D0
    cap 05[8c] = MSI supports 1 message, 64 bit 

ehci0@pci0:0:26:0:	class=0x0c0320 rev=0x05 hdr=0x00 vendor=0x8086 device=0x1d2d subvendor=0x1028 subdevice=0x04ce
    vendor     = 'Intel Corporation'
    device     = 'C600/X79 series chipset USB2 Enhanced Host Controller'
    class      = serial bus
    subclass   = USB
    bar   [10] = type Memory, range 32, base 0xdf8fe000, size 1024, enabled
    cap 01[50] = powerspec 2  supports D0 D3  current D0
    cap 0a[58] = EHCI Debug Port at offset 0xa0 in map 0x14
    cap 13[98] = PCI Advanced Features: FLR TP

pcib7@pci0:0:28:0:	class=0x060400 rev=0xb5 hdr=0x01 vendor=0x8086 device=0x1d10 subvendor=0x1028 subdevice=0x04ce
    vendor     = 'Intel Corporation'
    device     = 'C600/X79 series chipset PCI Express Root Port 1'
    class      = bridge
    subclass   = PCI-PCI
    cap 10[40] = PCI-Express 2 root port max data 128(128)
                 max read 128
                 link x0(x4) speed 0.0(5.0) ASPM disabled(L0s/L1)
    cap 05[80] = MSI supports 1 message 
    cap 0d[90] = PCI Bridge subvendor=0x1028 subdevice=0x04ce
    cap 01[a0] = powerspec 2  supports D0 D3  current D0
    ecap 0001[100] = AER 1 0 fatal 0 non-fatal 0 corrected

pcib8@pci0:0:28:7:	class=0x060400 rev=0xb5 hdr=0x01 vendor=0x8086 device=0x1d1e subvendor=0x1028 subdevice=0x04ce
    vendor     = 'Intel Corporation'
    device     = 'C600/X79 series chipset PCI Express Root Port 8'
    class      = bridge
    subclass   = PCI-PCI
    cap 10[40] = PCI-Express 2 root port max data 128(128)
                 max read 128
                 link x1(x1) speed 2.5(5.0) ASPM disabled(L0s/L1)
    cap 05[80] = MSI supports 1 message 
    cap 0d[90] = PCI Bridge subvendor=0x1028 subdevice=0x04ce
    cap 01[a0] = powerspec 2  supports D0 D3  current D0
    ecap 0001[100] = AER 1 0 fatal 0 non-fatal 0 corrected

ehci1@pci0:0:29:0:	class=0x0c0320 rev=0x05 hdr=0x00 vendor=0x8086 device=0x1d26 subvendor=0x1028 subdevice=0x04ce
    vendor     = 'Intel Corporation'
    device     = 'C600/X79 series chipset USB2 Enhanced Host Controller'
    class      = serial bus
    subclass   = USB
    bar   [10] = type Memory, range 32, base 0xdf8ff000, size 1024, enabled
    cap 01[50] = powerspec 2  supports D0 D3  current D0
    cap 0a[58] = EHCI Debug Port at offset 0xa0 in map 0x14
    cap 13[98] = PCI Advanced Features: FLR TP

pcib13@pci0:0:30:0:	class=0x060401 rev=0xa5 hdr=0x01 vendor=0x8086 device=0x244e subvendor=0x1028 subdevice=0x04ce
    vendor     = 'Intel Corporation'
    device     = '82801 PCI Bridge'
    class      = bridge
    subclass   = PCI-PCI
    cap 0d[50] = PCI Bridge subvendor=0x1028 subdevice=0x04ce

isab0@pci0:0:31:0:	class=0x060100 rev=0x05 hdr=0x00 vendor=0x8086 device=0x1d41 subvendor=0x1028 subdevice=0x04ce
    vendor     = 'Intel Corporation'
    device     = 'C600/X79 series chipset LPC Controller'
    class      = bridge
    subclass   = PCI-ISA
    cap 09[e0] = vendor (length 12) Intel cap 1 version 0
		 features: AMT, 4 PCI-e x1 slots

bge0@pci0:2:0:0:	class=0x020000 rev=0x00 hdr=0x00 vendor=0x14e4 device=0x165f subvendor=0x1028 subdevice=0x1f5b
    vendor     = 'Broadcom Inc. and subsidiaries'
    device     = 'NetXtreme BCM5720 Gigabit Ethernet PCIe'
    class      = network
    subclass   = ethernet
    bar   [10] = type Prefetchable Memory, range 64, base 0xd90a0000, size 65536, enabled
    bar   [18] = type Prefetchable Memory, range 64, base 0xd90b0000, size 65536, enabled
    bar   [20] = type Prefetchable Memory, range 64, base 0xd90c0000, size 65536, enabled
    cap 01[48] = powerspec 3  supports D0 D3  current D0
    cap 03[50] = VPD
    cap 05[58] = MSI supports 8 messages, 64 bit enabled with 1 message
    cap 11[a0] = MSI-X supports 17 messages
                 Table in map 0x20[0x0], PBA in map 0x20[0x1000]
    cap 10[ac] = PCI-Express 2 endpoint max data 256(256) FLR
                 max read 2048
                 link x1(x2) speed 5.0(5.0) ASPM disabled(L0s/L1) ClockPM disabled
    ecap 0001[100] = AER 1 0 fatal 0 non-fatal 1 corrected
    ecap 0003[13c] = Serial 1 0000c81f66b93f78
    ecap 0004[150] = Power Budgeting 1
    ecap 0002[160] = VC 1 max VC0

bge1@pci0:2:0:1:	class=0x020000 rev=0x00 hdr=0x00 vendor=0x14e4 device=0x165f subvendor=0x1028 subdevice=0x1f5b
    vendor     = 'Broadcom Inc. and subsidiaries'
    device     = 'NetXtreme BCM5720 Gigabit Ethernet PCIe'
    class      = network
    subclass   = ethernet
    bar   [10] = type Prefetchable Memory, range 64, base 0xd90d0000, size 65536, enabled
    bar   [18] = type Prefetchable Memory, range 64, base 0xd90e0000, size 65536, enabled
    bar   [20] = type Prefetchable Memory, range 64, base 0xd90f0000, size 65536, enabled
    cap 01[48] = powerspec 3  supports D0 D3  current D0
    cap 03[50] = VPD
    cap 05[58] = MSI supports 8 messages, 64 bit enabled with 1 message
    cap 11[a0] = MSI-X supports 17 messages
                 Table in map 0x20[0x0], PBA in map 0x20[0x1000]
    cap 10[ac] = PCI-Express 2 endpoint max data 256(256) FLR
                 max read 2048
                 link x1(x2) speed 5.0(5.0) ASPM disabled(L0s/L1) ClockPM disabled
    ecap 0001[100] = AER 1 0 fatal 0 non-fatal 1 corrected
    ecap 0003[13c] = Serial 1 0000c81f66b93f79
    ecap 0004[150] = Power Budgeting 1
    ecap 0002[160] = VC 1 max VC0

bge2@pci0:1:0:0:	class=0x020000 rev=0x00 hdr=0x00 vendor=0x14e4 device=0x165f subvendor=0x1028 subdevice=0x1f5b
    vendor     = 'Broadcom Inc. and subsidiaries'
    device     = 'NetXtreme BCM5720 Gigabit Ethernet PCIe'
    class      = network
    subclass   = ethernet
    bar   [10] = type Prefetchable Memory, range 64, base 0xd91a0000, size 65536, enabled
    bar   [18] = type Prefetchable Memory, range 64, base 0xd91b0000, size 65536, enabled
    bar   [20] = type Prefetchable Memory, range 64, base 0xd91c0000, size 65536, enabled
    cap 01[48] = powerspec 3  supports D0 D3  current D0
    cap 03[50] = VPD
    cap 05[58] = MSI supports 8 messages, 64 bit enabled with 1 message
    cap 11[a0] = MSI-X supports 17 messages
                 Table in map 0x20[0x0], PBA in map 0x20[0x1000]
    cap 10[ac] = PCI-Express 2 endpoint max data 256(256) FLR
                 max read 2048
                 link x1(x2) speed 5.0(5.0) ASPM disabled(L0s/L1) ClockPM disabled
    ecap 0001[100] = AER 1 0 fatal 0 non-fatal 1 corrected
    ecap 0003[13c] = Serial 1 0000c81f66b93f76
    ecap 0004[150] = Power Budgeting 1
    ecap 0002[160] = VC 1 max VC0

bge3@pci0:1:0:1:	class=0x020000 rev=0x00 hdr=0x00 vendor=0x14e4 device=0x165f subvendor=0x1028 subdevice=0x1f5b
    vendor     = 'Broadcom Inc. and subsidiaries'
    device     = 'NetXtreme BCM5720 Gigabit Ethernet PCIe'
    class      = network
    subclass   = ethernet
    bar   [10] = type Prefetchable Memory, range 64, base 0xd91d0000, size 65536, enabled
    bar   [18] = type Prefetchable Memory, range 64, base 0xd91e0000, size 65536, enabled
    bar   [20] = type Prefetchable Memory, range 64, base 0xd91f0000, size 65536, enabled
    cap 01[48] = powerspec 3  supports D0 D3  current D0
    cap 03[50] = VPD
    cap 05[58] = MSI supports 8 messages, 64 bit enabled with 1 message
    cap 11[a0] = MSI-X supports 17 messages
                 Table in map 0x20[0x0], PBA in map 0x20[0x1000]
    cap 10[ac] = PCI-Express 2 endpoint max data 256(256) FLR
                 max read 2048
                 link x1(x2) speed 5.0(5.0) ASPM disabled(L0s/L1) ClockPM disabled
    ecap 0001[100] = AER 1 0 fatal 0 non-fatal 1 corrected
    ecap 0003[13c] = Serial 1 0000c81f66b93f77
    ecap 0004[150] = Power Budgeting 1
    ecap 0002[160] = VC 1 max VC0

mfi0@pci0:3:0:0:	class=0x010400 rev=0x05 hdr=0x00 vendor=0x1000 device=0x005b subvendor=0x1028 subdevice=0x1f38
    vendor     = 'Broadcom / LSI'
    device     = 'MegaRAID SAS 2208 [Thunderbolt]'
    class      = mass storage
    subclass   = RAID
    bar   [10] = type I/O Port, range 32, base 0xfc00, size 256, enabled
    bar   [14] = type Memory, range 64, base 0xddffc000, size 16384, enabled
    bar   [1c] = type Memory, range 64, base 0xddf80000, size 262144, enabled
    cap 01[50] = powerspec 3  supports D0 D1 D2 D3  current D0
    cap 10[68] = PCI-Express 2 endpoint max data 256(4096) FLR RO NS
                 max read 512
                 link x8(x8) speed 5.0(5.0) ASPM disabled(L0s)
    cap 03[d0] = VPD
    cap 05[a8] = MSI supports 1 message, 64 bit enabled with 1 message
    cap 11[c0] = MSI-X supports 16 messages
                 Table in map 0x14[0x2000], PBA in map 0x14[0x3000]
    ecap 0001[100] = AER 2 0 fatal 0 non-fatal 0 corrected
    ecap 0019[1e0] = PCIe Sec 1 lane errors 0
    ecap 0004[1c0] = Power Budgeting 1
    ecap 0016[190] = DPA 1
    ecap 000e[148] = ARI 1

pcib9@pci0:8:0:0:	class=0x060400 rev=0x00 hdr=0x01 vendor=0x1912 device=0x0013 subvendor=0x1912 subdevice=0x0013
    vendor     = 'Renesas Technology Corp.'
    device     = 'SH7757 PCIe Switch [PS]'
    class      = bridge
    subclass   = PCI-PCI
    cap 01[40] = powerspec 3  supports D0 D3  current D0
    cap 05[50] = MSI supports 1 message, 64 bit 
    cap 10[70] = PCI-Express 2 upstream port max data 128(128) RO NS
                 max read 128
                 link x1(x1) speed 2.5(2.5) ASPM disabled(L0s)
    cap 0d[b0] = PCI Bridge subvendor=0x1912 subdevice=0x0013
    ecap 0001[100] = AER 1 0 fatal 0 non-fatal 0 corrected

pcib10@pci0:9:0:0:	class=0x060400 rev=0x00 hdr=0x01 vendor=0x1912 device=0x0013 subvendor=0x1912 subdevice=0x0013
    vendor     = 'Renesas Technology Corp.'
    device     = 'SH7757 PCIe Switch [PS]'
    class      = bridge
    subclass   = PCI-PCI
    cap 01[40] = powerspec 3  supports D0 D3  current D0
    cap 05[50] = MSI supports 1 message, 64 bit 
    cap 10[70] = PCI-Express 2 downstream port max data 128(128) RO NS
                 max read 128
                 link x1(x1) speed 2.5(2.5)
    cap 0d[b0] = PCI Bridge subvendor=0x1912 subdevice=0x0013
    ecap 0001[100] = AER 1 0 fatal 0 non-fatal 1 corrected

pcib12@pci0:9:1:0:	class=0x060400 rev=0x00 hdr=0x01 vendor=0x1912 device=0x0013 subvendor=0x1912 subdevice=0x0013
    vendor     = 'Renesas Technology Corp.'
    device     = 'SH7757 PCIe Switch [PS]'
    class      = bridge
    subclass   = PCI-PCI
    cap 01[40] = powerspec 3  supports D0 D3  current D0
    cap 05[50] = MSI supports 1 message, 64 bit 
    cap 10[70] = PCI-Express 2 downstream port max data 128(128) RO NS
                 max read 128
                 link x1(x1) speed 2.5(2.5)
    cap 0d[b0] = PCI Bridge subvendor=0x1912 subdevice=0x0013
    ecap 0001[100] = AER 1 0 fatal 0 non-fatal 0 corrected
    ecap 000d[150] = ACS 1

pcib11@pci0:10:0:0:	class=0x060400 rev=0x00 hdr=0x01 vendor=0x1912 device=0x0012 subvendor=0x1912 subdevice=0x0012
    vendor     = 'Renesas Technology Corp.'
    device     = 'SH7757 PCIe-PCI Bridge [PPB]'
    class      = bridge
    subclass   = PCI-PCI
    cap 01[40] = powerspec 3  supports D0 D3  current D0
    cap 05[50] = MSI supports 1 message, 64 bit 
    cap 10[70] = PCI-Express 2 PCI bridge max data 128(128) RO NS
                 max read 128
                 link x1(x1) speed 2.5(2.5)
    cap 0d[b0] = PCI Bridge subvendor=0x1912 subdevice=0x0012
    ecap 0001[100] = AER 1 0 fatal 0 non-fatal 1 corrected

vgapci0@pci0:11:0:0:	class=0x030000 rev=0x00 hdr=0x00 vendor=0x102b device=0x0534 subvendor=0x1028 subdevice=0x04ce
    vendor     = 'Matrox Electronics Systems Ltd.'
    device     = 'G200eR2'
    class      = display
    subclass   = VGA
    bar   [10] = type Prefetchable Memory, range 32, base 0xd8000000, size 16777216, enabled
    bar   [14] = type Memory, range 32, base 0xdeffc000, size 16384, enabled
    bar   [18] = type Memory, range 32, base 0xde000000, size 8388608, enabled
    cap 01[dc] = powerspec 1  supports D0 D3  current D0

none4@pci0:63:8:0:	class=0x088000 rev=0x07 hdr=0x00 vendor=0x8086 device=0x3c80 subvendor=0x8086 subdevice=0x0000
    vendor     = 'Intel Corporation'
    device     = 'Xeon E5/Core i7 QPI Link 0'
    class      = base peripheral

none5@pci0:63:9:0:	class=0x088000 rev=0x07 hdr=0x00 vendor=0x8086 device=0x3c90 subvendor=0x8086 subdevice=0x0000
    vendor     = 'Intel Corporation'
    device     = 'Xeon E5/Core i7 QPI Link 1'
    class      = base peripheral

none6@pci0:63:10:0:	class=0x088000 rev=0x07 hdr=0x00 vendor=0x8086 device=0x3cc0 subvendor=0x8086 subdevice=0x0000
    vendor     = 'Intel Corporation'
    device     = 'Xeon E5/Core i7 Power Control Unit 0'
    class      = base peripheral

none7@pci0:63:10:1:	class=0x088000 rev=0x07 hdr=0x00 vendor=0x8086 device=0x3cc1 subvendor=0x8086 subdevice=0x0000
    vendor     = 'Intel Corporation'
    device     = 'Xeon E5/Core i7 Power Control Unit 1'
    class      = base peripheral

none8@pci0:63:10:2:	class=0x088000 rev=0x07 hdr=0x00 vendor=0x8086 device=0x3cc2 subvendor=0x8086 subdevice=0x0000
    vendor     = 'Intel Corporation'
    device     = 'Xeon E5/Core i7 Power Control Unit 2'
    class      = base peripheral

none9@pci0:63:10:3:	class=0x088000 rev=0x07 hdr=0x00 vendor=0x8086 device=0x3cd0 subvendor=0x8086 subdevice=0x0000
    vendor     = 'Intel Corporation'
    device     = 'Xeon E5/Core i7 Power Control Unit 3'
    class      = base peripheral

none10@pci0:63:11:0:	class=0x088000 rev=0x07 hdr=0x00 vendor=0x8086 device=0x3ce0 subvendor=0x8086 subdevice=0x0000
    vendor     = 'Intel Corporation'
    device     = 'Xeon E5/Core i7 Interrupt Control Registers'
    class      = base peripheral

none11@pci0:63:11:3:	class=0x088000 rev=0x07 hdr=0x00 vendor=0x8086 device=0x3ce3 subvendor=0x8086 subdevice=0x0000
    vendor     = 'Intel Corporation'
    device     = 'Xeon E5/Core i7 Semaphore and Scratchpad Configuration Registers'
    class      = base peripheral

none12@pci0:63:12:0:	class=0x088000 rev=0x07 hdr=0x00 vendor=0x8086 device=0x3ce8 subvendor=0x8086 subdevice=0x0000
    vendor     = 'Intel Corporation'
    device     = 'Xeon E5/Core i7 Unicast Register 0'
    class      = base peripheral

none13@pci0:63:12:1:	class=0x088000 rev=0x07 hdr=0x00 vendor=0x8086 device=0x3ce8 subvendor=0x8086 subdevice=0x0000
    vendor     = 'Intel Corporation'
    device     = 'Xeon E5/Core i7 Unicast Register 0'
    class      = base peripheral

none14@pci0:63:12:2:	class=0x088000 rev=0x07 hdr=0x00 vendor=0x8086 device=0x3ce8 subvendor=0x8086 subdevice=0x0000
    vendor     = 'Intel Corporation'
    device     = 'Xeon E5/Core i7 Unicast Register 0'
    class      = base peripheral

none15@pci0:63:12:6:	class=0x088000 rev=0x07 hdr=0x00 vendor=0x8086 device=0x3cf4 subvendor=0x8086 subdevice=0x0000
    vendor     = 'Intel Corporation'
    device     = 'Xeon E5/Core i7 Integrated Memory Controller System Address Decoder 0'
    class      = base peripheral

none16@pci0:63:12:7:	class=0x088000 rev=0x07 hdr=0x00 vendor=0x8086 device=0x3cf6 subvendor=0x8086 subdevice=0x0000
    vendor     = 'Intel Corporation'
    device     = 'Xeon E5/Core i7 System Address Decoder'
    class      = base peripheral

none17@pci0:63:13:0:	class=0x088000 rev=0x07 hdr=0x00 vendor=0x8086 device=0x3ce8 subvendor=0x8086 subdevice=0x0000
    vendor     = 'Intel Corporation'
    device     = 'Xeon E5/Core i7 Unicast Register 0'
    class      = base peripheral

none18@pci0:63:13:1:	class=0x088000 rev=0x07 hdr=0x00 vendor=0x8086 device=0x3ce8 subvendor=0x8086 subdevice=0x0000
    vendor     = 'Intel Corporation'
    device     = 'Xeon E5/Core i7 Unicast Register 0'
    class      = base peripheral

none19@pci0:63:13:2:	class=0x088000 rev=0x07 hdr=0x00 vendor=0x8086 device=0x3ce8 subvendor=0x8086 subdevice=0x0000
    vendor     = 'Intel Corporation'
    device     = 'Xeon E5/Core i7 Unicast Register 0'
    class      = base peripheral

none20@pci0:63:13:6:	class=0x088000 rev=0x07 hdr=0x00 vendor=0x8086 device=0x3cf5 subvendor=0x8086 subdevice=0x0000
    vendor     = 'Intel Corporation'
    device     = 'Xeon E5/Core i7 Integrated Memory Controller System Address Decoder 1'
    class      = base peripheral

none21@pci0:63:14:0:	class=0x088000 rev=0x07 hdr=0x00 vendor=0x8086 device=0x3ca0 subvendor=0x1028 subdevice=0x04ce
    vendor     = 'Intel Corporation'
    device     = 'Xeon E5/Core i7 Processor Home Agent'
    class      = base peripheral

none22@pci0:63:14:1:	class=0x110100 rev=0x07 hdr=0x00 vendor=0x8086 device=0x3c46 subvendor=0x1028 subdevice=0x04ce
    vendor     = 'Intel Corporation'
    device     = 'Xeon E5/Core i7 Processor Home Agent Performance Monitoring'
    class      = dasp
    subclass   = performance counters

none23@pci0:63:15:0:	class=0x088000 rev=0x07 hdr=0x00 vendor=0x8086 device=0x3ca8 subvendor=0x8086 subdevice=0x0000
    vendor     = 'Intel Corporation'
    device     = 'Xeon E5/Core i7 Integrated Memory Controller Registers'
    class      = base peripheral
    cap 10[40] = PCI-Express 1 root endpoint max data 128(128)
                 max read 128

none24@pci0:63:15:1:	class=0x088000 rev=0x07 hdr=0x00 vendor=0x8086 device=0x3c71 subvendor=0x8086 subdevice=0x0000
    vendor     = 'Intel Corporation'
    device     = 'Xeon E5/Core i7 Integrated Memory Controller RAS Registers'
    class      = base peripheral
    cap 10[40] = PCI-Express 1 root endpoint max data 128(128)
                 max read 128

none25@pci0:63:15:2:	class=0x088000 rev=0x07 hdr=0x00 vendor=0x8086 device=0x3caa subvendor=0x8086 subdevice=0x0000
    vendor     = 'Intel Corporation'
    device     = 'Xeon E5/Core i7 Integrated Memory Controller Target Address Decoder 0'
    class      = base peripheral
    cap 10[40] = PCI-Express 1 root endpoint max data 128(128)
                 max read 128

none26@pci0:63:15:3:	class=0x088000 rev=0x07 hdr=0x00 vendor=0x8086 device=0x3cab subvendor=0x8086 subdevice=0x0000
    vendor     = 'Intel Corporation'
    device     = 'Xeon E5/Core i7 Integrated Memory Controller Target Address Decoder 1'
    class      = base peripheral
    cap 10[40] = PCI-Express 1 root endpoint max data 128(128)
                 max read 128

none27@pci0:63:15:4:	class=0x088000 rev=0x07 hdr=0x00 vendor=0x8086 device=0x3cac subvendor=0x8086 subdevice=0x0000
    vendor     = 'Intel Corporation'
    device     = 'Xeon E5/Core i7 Integrated Memory Controller Target Address Decoder 2'
    class      = base peripheral
    cap 10[40] = PCI-Express 1 root endpoint max data 128(128)
                 max read 128

none28@pci0:63:15:5:	class=0x088000 rev=0x07 hdr=0x00 vendor=0x8086 device=0x3cad subvendor=0x8086 subdevice=0x0000
    vendor     = 'Intel Corporation'
    device     = 'Xeon E5/Core i7 Integrated Memory Controller Target Address Decoder 3'
    class      = base peripheral
    cap 10[40] = PCI-Express 1 root endpoint max data 128(128)
                 max read 128

none29@pci0:63:15:6:	class=0x088000 rev=0x07 hdr=0x00 vendor=0x8086 device=0x3cae subvendor=0x8086 subdevice=0x0000
    vendor     = 'Intel Corporation'
    device     = 'Xeon E5/Core i7 Integrated Memory Controller Target Address Decoder 4'
    class      = base peripheral

none30@pci0:63:16:0:	class=0x088000 rev=0x07 hdr=0x00 vendor=0x8086 device=0x3cb0 subvendor=0x8086 subdevice=0x0000
    vendor     = 'Intel Corporation'
    device     = 'Xeon E5/Core i7 Integrated Memory Controller Channel 0-3 Thermal Control 0'
    class      = base peripheral
    cap 10[40] = PCI-Express 1 root endpoint max data 128(128)
                 max read 128

none31@pci0:63:16:1:	class=0x088000 rev=0x07 hdr=0x00 vendor=0x8086 device=0x3cb1 subvendor=0x8086 subdevice=0x0000
    vendor     = 'Intel Corporation'
    device     = 'Xeon E5/Core i7 Integrated Memory Controller Channel 0-3 Thermal Control 1'
    class      = base peripheral
    cap 10[40] = PCI-Express 1 root endpoint max data 128(128)
                 max read 128

none32@pci0:63:16:2:	class=0x088000 rev=0x07 hdr=0x00 vendor=0x8086 device=0x3cb2 subvendor=0x8086 subdevice=0x0000
    vendor     = 'Intel Corporation'
    device     = 'Xeon E5/Core i7 Integrated Memory Controller ERROR Registers 0'
    class      = base peripheral
    cap 10[40] = PCI-Express 1 root endpoint max data 128(128)
                 max read 128

none33@pci0:63:16:3:	class=0x088000 rev=0x07 hdr=0x00 vendor=0x8086 device=0x3cb3 subvendor=0x8086 subdevice=0x0000
    vendor     = 'Intel Corporation'
    device     = 'Xeon E5/Core i7 Integrated Memory Controller ERROR Registers 1'
    class      = base peripheral
    cap 10[40] = PCI-Express 1 root endpoint max data 128(128)
                 max read 128

none34@pci0:63:16:4:	class=0x088000 rev=0x07 hdr=0x00 vendor=0x8086 device=0x3cb4 subvendor=0x8086 subdevice=0x0000
    vendor     = 'Intel Corporation'
    device     = 'Xeon E5/Core i7 Integrated Memory Controller Channel 0-3 Thermal Control 2'
    class      = base peripheral
    cap 10[40] = PCI-Express 1 root endpoint max data 128(128)
                 max read 128

none35@pci0:63:16:5:	class=0x088000 rev=0x07 hdr=0x00 vendor=0x8086 device=0x3cb5 subvendor=0x8086 subdevice=0x0000
    vendor     = 'Intel Corporation'
    device     = 'Xeon E5/Core i7 Integrated Memory Controller Channel 0-3 Thermal Control 3'
    class      = base peripheral
    cap 10[40] = PCI-Express 1 root endpoint max data 128(128)
                 max read 128

none36@pci0:63:16:6:	class=0x088000 rev=0x07 hdr=0x00 vendor=0x8086 device=0x3cb6 subvendor=0x8086 subdevice=0x0000
    vendor     = 'Intel Corporation'
    device     = 'Xeon E5/Core i7 Integrated Memory Controller ERROR Registers 2'
    class      = base peripheral
    cap 10[40] = PCI-Express 1 root endpoint max data 128(128)
                 max read 128

none37@pci0:63:16:7:	class=0x088000 rev=0x07 hdr=0x00 vendor=0x8086 device=0x3cb7 subvendor=0x8086 subdevice=0x0000
    vendor     = 'Intel Corporation'
    device     = 'Xeon E5/Core i7 Integrated Memory Controller ERROR Registers 3'
    class      = base peripheral
    cap 10[40] = PCI-Express 1 root endpoint max data 128(128)
                 max read 128

none38@pci0:63:17:0:	class=0x088000 rev=0x07 hdr=0x00 vendor=0x8086 device=0x3cb8 subvendor=0x8086 subdevice=0x0000
    vendor     = 'Intel Corporation'
    device     = 'Xeon E5/Core i7 DDRIO'
    class      = base peripheral

none39@pci0:63:19:0:	class=0x088000 rev=0x07 hdr=0x00 vendor=0x8086 device=0x3ce4 subvendor=0x8086 subdevice=0x0000
    vendor     = 'Intel Corporation'
    device     = 'Xeon E5/Core i7 R2PCIe'
    class      = base peripheral

none40@pci0:63:19:1:	class=0x110100 rev=0x07 hdr=0x00 vendor=0x8086 device=0x3c43 subvendor=0x1028 subdevice=0x04ce
    vendor     = 'Intel Corporation'
    device     = 'Xeon E5/Core i7 Ring to PCI Express Performance Monitor'
    class      = dasp
    subclass   = performance counters

none41@pci0:63:19:4:	class=0x110100 rev=0x07 hdr=0x00 vendor=0x8086 device=0x3ce6 subvendor=0x1028 subdevice=0x04ce
    vendor     = 'Intel Corporation'
    device     = 'Xeon E5/Core i7 QuickPath Interconnect Agent Ring Registers'
    class      = dasp
    subclass   = performance counters

none42@pci0:63:19:5:	class=0x110100 rev=0x07 hdr=0x00 vendor=0x8086 device=0x3c44 subvendor=0x1028 subdevice=0x04ce
    vendor     = 'Intel Corporation'
    device     = 'Xeon E5/Core i7 Ring to QuickPath Interconnect Link 0 Performance Monitor'
    class      = dasp
    subclass   = performance counters

none43@pci0:63:19:6:	class=0x088000 rev=0x07 hdr=0x00 vendor=0x8086 device=0x3c45 subvendor=0x1028 subdevice=0x04ce
    vendor     = 'Intel Corporation'
    device     = 'Xeon E5/Core i7 Ring to QuickPath Interconnect Link 1 Performance Monitor'
    class      = base peripheral
