hostb0@pci0:0:0:0:	class=0x060000 card=0x8270103c chip=0x59108086 rev=0x05 hdr=0x00
    vendor     = 'Intel Corporation'
    device     = 'Xeon E3-1200 v6/7th Gen Core Processor Host Bridge/DRAM Registers'
    class      = bridge
    subclass   = HOST-PCI
    cap 09[e0] = vendor (length 16) Intel cap 0 version 1

pcib1@pci0:0:1:0:	class=0x060400 card=0x8270103c chip=0x19018086 rev=0x05 hdr=0x01
    vendor     = 'Intel Corporation'
    device     = '6th-9th Gen Core Processor PCIe Controller (x16)'
    class      = bridge
    subclass   = PCI-PCI
    cap 0d[88] = PCI Bridge card=0x8270103c
    cap 01[80] = powerspec 3  supports D0 D3  current D0
    cap 05[90] = MSI supports 1 message 
    cap 10[a0] = PCI-Express 2 root port max data 256(256)
                 link x16(x16) speed 2.5(8.0) ASPM L0s/L1(L0s/L1)
                 slot 1 power limit 75000 mW
    ecap 0002[100] = VC 1 max VC0
    ecap 0005[140] = Root Complex Link Declaration 1
    ecap 0019[d94] = PCIe Sec 1 lane errors 0

xhci0@pci0:0:20:0:	class=0x0c0330 card=0x8270103c chip=0xa12f8086 rev=0x31 hdr=0x00
    vendor     = 'Intel Corporation'
    device     = '100 Series/C230 Series Chipset Family USB 3.0 xHCI Controller'
    class      = serial bus
    subclass   = USB
    bar   [10] = type Memory, range 64, base 0xe4420000, size 65536, enabled
    cap 01[70] = powerspec 2  supports D0 D3  current D0
    cap 05[80] = MSI supports 8 messages, 64 bit enabled with 1 message

none0@pci0:0:20:2:	class=0x118000 card=0x8270103c chip=0xa1318086 rev=0x31 hdr=0x00
    vendor     = 'Intel Corporation'
    device     = '100 Series/C230 Series Chipset Family Thermal Subsystem'
    class      = dasp
    bar   [10] = type Memory, range 64, base 0x1ffa016000, size 4096, enabled
    cap 01[50] = powerspec 3  supports D0 D3  current D0
    cap 05[80] = MSI supports 1 message 

none1@pci0:0:22:0:	class=0x078000 card=0x8270103c chip=0xa13a8086 rev=0x31 hdr=0x00
    vendor     = 'Intel Corporation'
    device     = '100 Series/C230 Series Chipset Family MEI Controller'
    class      = simple comms
    bar   [10] = type Memory, range 64, base 0x1ffa015000, size 4096, enabled
    cap 01[50] = powerspec 3  supports D0 D3  current D0
    cap 05[8c] = MSI supports 1 message, 64 bit 

ahci0@pci0:0:23:0:	class=0x010601 card=0x8270103c chip=0xa1028086 rev=0x31 hdr=0x00
    vendor     = 'Intel Corporation'
    device     = 'Q170/Q150/B150/H170/H110/Z170/CM236 Chipset SATA Controller [AHCI Mode]'
    class      = mass storage
    subclass   = SATA
    bar   [10] = type Memory, range 32, base 0xe4434000, size 8192, enabled
    bar   [14] = type Memory, range 32, base 0xe4437000, size 256, enabled
    bar   [18] = type I/O Port, range 32, base 0x6040, size 8, enabled
    bar   [1c] = type I/O Port, range 32, base 0x6048, size 4, enabled
    bar   [20] = type I/O Port, range 32, base 0x6020, size 32, enabled
    bar   [24] = type Memory, range 32, base 0xe4436000, size 2048, enabled
    cap 05[80] = MSI supports 1 message enabled with 1 message
    cap 01[70] = powerspec 3  supports D0 D3  current D0
    cap 12[a8] = SATA Index-Data Pair

pcib2@pci0:0:27:0:	class=0x060400 card=0x8270103c chip=0xa1678086 rev=0xf1 hdr=0x01
    vendor     = 'Intel Corporation'
    device     = '100 Series/C230 Series Chipset Family PCI Express Root Port'
    class      = bridge
    subclass   = PCI-PCI
    cap 10[40] = PCI-Express 2 root port max data 256(256) ARI disabled
                 link x4(x4) speed 8.0(8.0) ASPM L1(L1)
                 slot 16 power limit 250 mW
    cap 05[80] = MSI supports 1 message 
    cap 0d[90] = PCI Bridge card=0x8270103c
    cap 01[a0] = powerspec 3  supports D0 D3  current D0
    ecap 0001[100] = AER 1 0 fatal 0 non-fatal 0 corrected
    ecap 000d[140] = ACS 1
    ecap 001e[200] = L1 PM Substates 1
    ecap 0019[220] = PCIe Sec 1 lane errors 0

pcib3@pci0:0:28:0:	class=0x060400 card=0x8270103c chip=0xa1108086 rev=0xf1 hdr=0x01
    vendor     = 'Intel Corporation'
    device     = '100 Series/C230 Series Chipset Family PCI Express Root Port'
    class      = bridge
    subclass   = PCI-PCI
    cap 10[40] = PCI-Express 2 root port max data 128(256) ARI disabled
                 link x1(x1) speed 2.5(8.0) ASPM L1(L0s/L1)
                 slot 0 power limit 100 mW
    cap 05[80] = MSI supports 1 message 
    cap 0d[90] = PCI Bridge card=0x8270103c
    cap 01[a0] = powerspec 3  supports D0 D3  current D0
    ecap 0001[100] = AER 1 0 fatal 0 non-fatal 0 corrected
    ecap 000d[140] = ACS 1
    ecap 001e[200] = L1 PM Substates 1
    ecap 0019[220] = PCIe Sec 1 lane errors 0

pcib4@pci0:0:28:1:	class=0x060400 card=0x8270103c chip=0xa1118086 rev=0xf1 hdr=0x01
    vendor     = 'Intel Corporation'
    device     = '100 Series/C230 Series Chipset Family PCI Express Root Port'
    class      = bridge
    subclass   = PCI-PCI
    cap 10[40] = PCI-Express 2 root port max data 128(128) ARI disabled
                 link x1(x1) speed 5.0(8.0) ASPM L1(L1)
                 slot 1 power limit 100 mW HotPlug(present) surprise
    cap 05[80] = MSI supports 1 message 
    cap 0d[90] = PCI Bridge card=0x8270103c
    cap 01[a0] = powerspec 3  supports D0 D3  current D0
    ecap 0001[100] = AER 1 0 fatal 0 non-fatal 0 corrected
    ecap 000d[140] = ACS 1
    ecap 001e[200] = L1 PM Substates 1
    ecap 0019[220] = PCIe Sec 1 lane errors 0

pcib5@pci0:0:28:4:	class=0x060400 card=0x8270103c chip=0xa1148086 rev=0xf1 hdr=0x01
    vendor     = 'Intel Corporation'
    device     = '100 Series/C230 Series Chipset Family PCI Express Root Port'
    class      = bridge
    subclass   = PCI-PCI
    cap 10[40] = PCI-Express 2 root port max data 128(128) ARI disabled
                 link x0(x4) speed 0.0(8.0)
                 slot 4 power limit 250 mW HotPlug(empty) surprise
    cap 05[80] = MSI supports 1 message 
    cap 0d[90] = PCI Bridge card=0x8270103c
    cap 01[a0] = powerspec 3  supports D0 D3  current D0
    ecap 0001[100] = AER 1 0 fatal 0 non-fatal 0 corrected
    ecap 000d[140] = ACS 1
    ecap 0019[220] = PCIe Sec 1 lane errors 0

isab0@pci0:0:31:0:	class=0x060100 card=0x8270103c chip=0xa1548086 rev=0x31 hdr=0x00
    vendor     = 'Intel Corporation'
    device     = 'CM238 Chipset LPC/eSPI Controller'
    class      = bridge
    subclass   = PCI-ISA

none2@pci0:0:31:2:	class=0x058000 card=0x8270103c chip=0xa1218086 rev=0x31 hdr=0x00
    vendor     = 'Intel Corporation'
    device     = '100 Series/C230 Series Chipset Family Power Management Controller'
    class      = memory
    bar   [10] = type Memory, range 32, base 0xe4430000, size 16384, enabled

hdac0@pci0:0:31:3:	class=0x040380 card=0x8270103c chip=0xa1718086 rev=0x31 hdr=0x00
    vendor     = 'Intel Corporation'
    device     = 'CM238 HD Audio Controller'
    class      = multimedia
    subclass   = HDA
    bar   [10] = type Memory, range 64, base 0x1ffa010000, size 16384, enabled
    bar   [20] = type Memory, range 64, base 0x1ffa000000, size 65536, enabled
    cap 01[50] = powerspec 3  supports D0 D3  current D0
    cap 05[60] = MSI supports 1 message, 64 bit enabled with 1 message

none3@pci0:0:31:4:	class=0x0c0500 card=0x8270103c chip=0xa1238086 rev=0x31 hdr=0x00
    vendor     = 'Intel Corporation'
    device     = '100 Series/C230 Series Chipset Family SMBus'
    class      = serial bus
    subclass   = SMBus
    bar   [10] = type Memory, range 64, base 0x1ffa014000, size 256, enabled
    bar   [20] = type I/O Port, range 32, base 0xefa0, size 32, enabled

em0@pci0:0:31:6:	class=0x020000 card=0x8270103c chip=0x15b78086 rev=0x31 hdr=0x00
    vendor     = 'Intel Corporation'
    device     = 'Ethernet Connection (2) I219-LM'
    class      = network
    subclass   = ethernet
    bar   [10] = type Memory, range 32, base 0xe4400000, size 131072, enabled
    cap 01[c8] = powerspec 3  supports D0 D3  current D0
    cap 05[d0] = MSI supports 1 message, 64 bit enabled with 1 message
    cap 13[e0] = PCI Advanced Features: FLR TP

vgapci0@pci0:1:0:0:	class=0x030000 card=0x8272103c chip=0x1bb710de rev=0xa1 hdr=0x00
    vendor     = 'NVIDIA Corporation'
    device     = 'GP104GLM [Quadro P4000 Mobile]'
    class      = display
    subclass   = VGA
    bar   [10] = type Memory, range 32, base 0xe3000000, size 16777216, enabled
    bar   [14] = type Prefetchable Memory, range 64, base 0xa0000000, size 268435456, enabled
    bar   [1c] = type Prefetchable Memory, range 64, base 0xb0000000, size 33554432, enabled
    bar   [24] = type I/O Port, range 32, base 0x5000, size 128, enabled
    cap 01[60] = powerspec 3  supports D0 D3  current D0
    cap 05[68] = MSI supports 1 message, 64 bit enabled with 1 message
    cap 10[78] = PCI-Express 2 endpoint max data 256(256) RO
                 link x16(x16) speed 2.5(8.0) ASPM L0s/L1(L0s/L1) ClockPM enabled
    ecap 0002[100] = VC 1 max VC0
    ecap 001e[258] = L1 PM Substates 1
    ecap 0004[128] = Power Budgeting 1
    ecap 0001[420] = AER 2 0 fatal 0 non-fatal 0 corrected
    ecap 000b[600] = Vendor 1 ID 1
    ecap 0019[900] = PCIe Sec 1 lane errors 0

nvme0@pci0:2:0:0:	class=0x010802 card=0xa801144d chip=0xa804144d rev=0x00 hdr=0x00
    vendor     = 'Samsung Electronics Co Ltd'
    device     = 'NVMe SSD Controller SM961/PM961'
    class      = mass storage
    subclass   = NVM
    bar   [10] = type Memory, range 64, base 0xe4300000, size 16384, enabled
    cap 01[40] = powerspec 3  supports D0 D3  current D0
    cap 05[50] = MSI supports 32 messages, 64 bit 
    cap 10[70] = PCI-Express 2 endpoint max data 256(256) FLR RO NS
                 link x4(x4) speed 8.0(8.0) ASPM L1(L1) ClockPM enabled
    cap 11[b0] = MSI-X supports 8 messages, enabled
                 Table in map 0x10[0x3000], PBA in map 0x10[0x2000]
    ecap 0001[100] = AER 2 0 fatal 0 non-fatal 0 corrected
    ecap 0003[148] = Serial 1 0000000000000000
    ecap 0004[158] = Power Budgeting 1
    ecap 0019[168] = PCIe Sec 1 lane errors 0
    ecap 0018[188] = LTR 1
    ecap 001e[190] = L1 PM Substates 1

iwm0@pci0:3:0:0:	class=0x028000 card=0x10108086 chip=0x24fd8086 rev=0x78 hdr=0x00
    vendor     = 'Intel Corporation'
    device     = 'Wireless 8265 / 8275'
    class      = network
    bar   [10] = type Memory, range 64, base 0xe4200000, size 8192, enabled
    cap 01[c8] = powerspec 3  supports D0 D3  current D0
    cap 05[d0] = MSI supports 1 message, 64 bit enabled with 1 message
    cap 10[40] = PCI-Express 2 endpoint max data 128(128) FLR RO NS
                 link x1(x1) speed 2.5(2.5) ASPM L1(L1) ClockPM enabled
    ecap 0001[100] = AER 1 0 fatal 0 non-fatal 0 corrected
    ecap 0003[140] = Serial 1 9061aefffffc04d6
    ecap 0018[14c] = LTR 1
    ecap 001e[154] = L1 PM Substates 1

none4@pci0:4:0:0:	class=0xff0000 card=0x8270103c chip=0x525a10ec rev=0x01 hdr=0x00
    vendor     = 'Realtek Semiconductor Co., Ltd.'
    device     = 'RTS525A PCI Express Card Reader'
    bar   [14] = type Memory, range 32, base 0xe4100000, size 4096, enabled
    cap 01[80] = powerspec 3  supports D0 D1 D2 D3  current D0
    cap 05[90] = MSI supports 1 message, 64 bit 
    cap 10[b0] = PCI-Express 2 endpoint max data 128(512) RO
                 link x1(x1) speed 5.0(5.0) ASPM L1(L0s/L1) ClockPM enabled
    ecap 0001[100] = AER 2 0 fatal 0 non-fatal 0 corrected
    ecap 0003[148] = Serial 1 00000001004ce000
    ecap 0018[158] = LTR 1
    ecap 001e[160] = L1 PM Substates 1
