hostb0@pci0:0:0:0:	class=0x060000 rev=0x00 hdr=0x00 vendor=0x1022 device=0x15d0 subvendor=0x103c subdevice=0x87b7
    vendor     = 'Advanced Micro Devices, Inc. [AMD]'
    device     = 'Raven/Raven2 Root Complex'
    class      = bridge
    subclass   = HOST-PCI

none0@pci0:0:0:2:	class=0x080600 rev=0x00 hdr=0x00 vendor=0x1022 device=0x15d1 subvendor=0x103c subdevice=0x87b7
    vendor     = 'Advanced Micro Devices, Inc. [AMD]'
    device     = 'Raven/Raven2 IOMMU'
    class      = base peripheral
    subclass   = IOMMU
    cap 0f[40] = unknown
    cap 05[64] = MSI supports 4 messages, 64 bit 
    cap 08[74] = HT MSI fixed address window enabled at 0xfee00000

hostb1@pci0:0:1:0:	class=0x060000 rev=0x00 hdr=0x00 vendor=0x1022 device=0x1452 subvendor=0x0000 subdevice=0x0000
    vendor     = 'Advanced Micro Devices, Inc. [AMD]'
    device     = 'Family 17h (Models 00h-1fh) PCIe Dummy Host Bridge'
    class      = bridge
    subclass   = HOST-PCI

pcib1@pci0:0:1:2:	class=0x060400 rev=0x00 hdr=0x01 vendor=0x1022 device=0x15d3 subvendor=0x1022 subdevice=0x1234
    vendor     = 'Advanced Micro Devices, Inc. [AMD]'
    device     = 'Raven/Raven2 PCIe GPP Bridge [6:0]'
    class      = bridge
    subclass   = PCI-PCI
    cap 01[50] = powerspec 3  supports D0 D3  current D0
    cap 10[58] = PCI-Express 2 root port max data 256(512) RO NS ARI disabled
                 max read 128
                 link x2(x2) speed 2.5(8.0) ASPM L1(L1)
                 slot 0 power limit 0 mW
    cap 05[a0] = MSI supports 1 message, 64 bit 
    cap 0d[c0] = PCI Bridge subvendor=0x1022 subdevice=0x1234
    cap 08[c8] = HT MSI fixed address window enabled at 0xfee00000
    ecap 000b[100] = Vendor [1] ID 0001 Rev 1 Length 16
    ecap 0001[150] = AER 2 0 fatal 0 non-fatal 0 corrected
    ecap 0019[270] = PCIe Sec 1 lane errors 0
    ecap 000d[2a0] = ACS 1
    ecap 001e[370] = L1 PM Substates 1

pcib2@pci0:0:1:6:	class=0x060400 rev=0x00 hdr=0x01 vendor=0x1022 device=0x15d3 subvendor=0x1022 subdevice=0x1234
    vendor     = 'Advanced Micro Devices, Inc. [AMD]'
    device     = 'Raven/Raven2 PCIe GPP Bridge [6:0]'
    class      = bridge
    subclass   = PCI-PCI
    cap 01[50] = powerspec 3  supports D0 D3  current D0
    cap 10[58] = PCI-Express 2 root port max data 128(512) RO NS ARI disabled
                 max read 128
                 link x1(x1) speed 2.5(8.0) ASPM L1(L1)
                 slot 0 power limit 0 mW
    cap 05[a0] = MSI supports 1 message, 64 bit 
    cap 0d[c0] = PCI Bridge subvendor=0x1022 subdevice=0x1234
    cap 08[c8] = HT MSI fixed address window enabled at 0xfee00000
    ecap 000b[100] = Vendor [1] ID 0001 Rev 1 Length 16
    ecap 0001[150] = AER 2 0 fatal 0 non-fatal 0 corrected
    ecap 0019[270] = PCIe Sec 1 lane errors 0
    ecap 000d[2a0] = ACS 1
    ecap 001e[370] = L1 PM Substates 1

pcib3@pci0:0:1:7:	class=0x060400 rev=0x00 hdr=0x01 vendor=0x1022 device=0x15d3 subvendor=0x1022 subdevice=0x1234
    vendor     = 'Advanced Micro Devices, Inc. [AMD]'
    device     = 'Raven/Raven2 PCIe GPP Bridge [6:0]'
    class      = bridge
    subclass   = PCI-PCI
    cap 01[50] = powerspec 3  supports D0 D3  current D0
    cap 10[58] = PCI-Express 2 root port max data 128(512) RO NS ARI disabled
                 max read 128
                 link x16(x1) speed 2.5(8.0) ASPM disabled(L1)
                 slot 0 power limit 0 mW HotPlug(empty)
    cap 05[a0] = MSI supports 1 message, 64 bit enabled with 1 message
    cap 0d[c0] = PCI Bridge subvendor=0x1022 subdevice=0x1234
    cap 08[c8] = HT MSI fixed address window enabled at 0xfee00000
    ecap 000b[100] = Vendor [1] ID 0001 Rev 1 Length 16
    ecap 0001[150] = AER 2 0 fatal 0 non-fatal 0 corrected
    ecap 0019[270] = PCIe Sec 1 lane errors 0
    ecap 000d[2a0] = ACS 1
    ecap 001e[370] = L1 PM Substates 1

hostb2@pci0:0:8:0:	class=0x060000 rev=0x00 hdr=0x00 vendor=0x1022 device=0x1452 subvendor=0x0000 subdevice=0x0000
    vendor     = 'Advanced Micro Devices, Inc. [AMD]'
    device     = 'Family 17h (Models 00h-1fh) PCIe Dummy Host Bridge'
    class      = bridge
    subclass   = HOST-PCI

pcib4@pci0:0:8:1:	class=0x060400 rev=0x00 hdr=0x01 vendor=0x1022 device=0x15db subvendor=0x103c subdevice=0x87b7
    vendor     = 'Advanced Micro Devices, Inc. [AMD]'
    device     = 'Raven/Raven2 Internal PCIe GPP Bridge 0 to Bus A'
    class      = bridge
    subclass   = PCI-PCI
    cap 01[50] = powerspec 3  supports D0 D3  current D0
    cap 10[58] = PCI-Express 2 root port max data 256(512) RO NS
                 max read 512
                 link x16(x16) speed 8.0(8.0) ASPM disabled(L0s/L1)
    cap 05[a0] = MSI supports 1 message, 64 bit 
    cap 0d[c0] = PCI Bridge subvendor=0x103c subdevice=0x87b7
    ecap 000b[100] = Vendor [1] ID 0001 Rev 1 Length 16
    ecap 0019[270] = PCIe Sec 1 lane errors 0
    ecap 000d[2a0] = ACS 1

intsmb0@pci0:0:20:0:	class=0x0c0500 rev=0x61 hdr=0x00 vendor=0x1022 device=0x790b subvendor=0x103c subdevice=0x87b7
    vendor     = 'Advanced Micro Devices, Inc. [AMD]'
    device     = 'FCH SMBus Controller'
    class      = serial bus
    subclass   = SMBus

isab0@pci0:0:20:3:	class=0x060100 rev=0x51 hdr=0x00 vendor=0x1022 device=0x790e subvendor=0x103c subdevice=0x87b7
    vendor     = 'Advanced Micro Devices, Inc. [AMD]'
    device     = 'FCH LPC Bridge'
    class      = bridge
    subclass   = PCI-ISA

hostb3@pci0:0:24:0:	class=0x060000 rev=0x00 hdr=0x00 vendor=0x1022 device=0x15e8 subvendor=0x0000 subdevice=0x0000
    vendor     = 'Advanced Micro Devices, Inc. [AMD]'
    device     = 'Raven/Raven2 Device 24: Function 0'
    class      = bridge
    subclass   = HOST-PCI

hostb4@pci0:0:24:1:	class=0x060000 rev=0x00 hdr=0x00 vendor=0x1022 device=0x15e9 subvendor=0x0000 subdevice=0x0000
    vendor     = 'Advanced Micro Devices, Inc. [AMD]'
    device     = 'Raven/Raven2 Device 24: Function 1'
    class      = bridge
    subclass   = HOST-PCI

hostb5@pci0:0:24:2:	class=0x060000 rev=0x00 hdr=0x00 vendor=0x1022 device=0x15ea subvendor=0x0000 subdevice=0x0000
    vendor     = 'Advanced Micro Devices, Inc. [AMD]'
    device     = 'Raven/Raven2 Device 24: Function 2'
    class      = bridge
    subclass   = HOST-PCI

hostb6@pci0:0:24:3:	class=0x060000 rev=0x00 hdr=0x00 vendor=0x1022 device=0x15eb subvendor=0x0000 subdevice=0x0000
    vendor     = 'Advanced Micro Devices, Inc. [AMD]'
    device     = 'Raven/Raven2 Device 24: Function 3'
    class      = bridge
    subclass   = HOST-PCI

hostb7@pci0:0:24:4:	class=0x060000 rev=0x00 hdr=0x00 vendor=0x1022 device=0x15ec subvendor=0x0000 subdevice=0x0000
    vendor     = 'Advanced Micro Devices, Inc. [AMD]'
    device     = 'Raven/Raven2 Device 24: Function 4'
    class      = bridge
    subclass   = HOST-PCI

hostb8@pci0:0:24:5:	class=0x060000 rev=0x00 hdr=0x00 vendor=0x1022 device=0x15ed subvendor=0x0000 subdevice=0x0000
    vendor     = 'Advanced Micro Devices, Inc. [AMD]'
    device     = 'Raven/Raven2 Device 24: Function 5'
    class      = bridge
    subclass   = HOST-PCI

hostb9@pci0:0:24:6:	class=0x060000 rev=0x00 hdr=0x00 vendor=0x1022 device=0x15ee subvendor=0x0000 subdevice=0x0000
    vendor     = 'Advanced Micro Devices, Inc. [AMD]'
    device     = 'Raven/Raven2 Device 24: Function 6'
    class      = bridge
    subclass   = HOST-PCI

hostb10@pci0:0:24:7:	class=0x060000 rev=0x00 hdr=0x00 vendor=0x1022 device=0x15ef subvendor=0x0000 subdevice=0x0000
    vendor     = 'Advanced Micro Devices, Inc. [AMD]'
    device     = 'Raven/Raven2 Device 24: Function 7'
    class      = bridge
    subclass   = HOST-PCI

nvme0@pci0:1:0:0:	class=0x010802 rev=0x01 hdr=0x00 vendor=0x15b7 device=0x5009 subvendor=0x15b7 subdevice=0x5009
    vendor     = 'Sandisk Corp'
    device     = 'WD Blue SN550 NVMe SSD'
    class      = mass storage
    subclass   = NVM
    bar   [10] = type Memory, range 64, base 0xfcf00000, size 16384, enabled
    bar   [20] = type Memory, range 64, base 0xfcf04000, size 256, enabled
    cap 01[80] = powerspec 3  supports D0 D3  current D0
    cap 05[90] = MSI supports 32 messages, 64 bit 
    cap 11[b0] = MSI-X supports 17 messages, enabled
                 Table in map 0x10[0x2000], PBA in map 0x20[0x0]
    cap 10[c0] = PCI-Express 2 endpoint max data 256(512) FLR RO NS
                 max read 512
                 link x2(x4) speed 2.5(8.0) ASPM L1(L1) ClockPM enabled
    ecap 0001[100] = AER 2 0 fatal 0 non-fatal 0 corrected
    ecap 0003[150] = Serial 1 0000000000000000
    ecap 0018[1b8] = LTR 1
    ecap 0019[300] = PCIe Sec 1 lane errors 0
    ecap 001e[900] = L1 PM Substates 1

rtw880@pci0:2:0:0:	class=0x028000 rev=0x00 hdr=0x00 vendor=0x10ec device=0xc822 subvendor=0x103c subdevice=0x85f7
    vendor     = 'Realtek Semiconductor Co., Ltd.'
    device     = 'RTL8822CE 802.11ac PCIe Wireless Network Adapter'
    class      = network
    bar   [10] = type I/O Port, range 32, base 0xf000, size 256, enabled
    bar   [18] = type Memory, range 64, base 0xfce00000, size 65536, enabled
    cap 01[40] = powerspec 3  supports D0 D1 D2 D3  current D0
    cap 05[50] = MSI supports 1 message, 64 bit enabled with 1 message
    cap 10[70] = PCI-Express 2 endpoint max data 128(128) RO
                 max read 512
                 link x1(x1) speed 2.5(2.5) ASPM L1(L0s/L1) ClockPM enabled
    ecap 0001[100] = AER 2 0 fatal 0 non-fatal 1 corrected
    ecap 0003[148] = Serial 1 00e04cfffec82201
    ecap 0018[158] = LTR 1
    ecap 001e[160] = L1 PM Substates 1

vgapci0@pci0:4:0:0:	class=0x030000 rev=0xce hdr=0x00 vendor=0x1002 device=0x15d8 subvendor=0x103c subdevice=0x87b7
    vendor     = 'Advanced Micro Devices, Inc. [AMD/ATI]'
    device     = 'Picasso/Raven 2 [Radeon Vega Series / Radeon Vega Mobile Series]'
    class      = display
    subclass   = VGA
    bar   [10] = type Prefetchable Memory, range 64, base 0xe0000000, size 268435456, enabled
    bar   [18] = type Prefetchable Memory, range 64, base 0xf0000000, size 2097152, enabled
    bar   [20] = type I/O Port, range 32, base 0xe000, size 256, enabled
    bar   [24] = type Memory, range 32, base 0xfcd00000, size 524288, enabled
    cap 09[48] = vendor (length 8)
    cap 01[50] = powerspec 3  supports D0 D3  current D0
    cap 10[64] = PCI-Express 2 legacy endpoint max data 256(256) FLR RO NS
                 max read 512
                 link x16(x16) speed 8.0(8.0) ASPM disabled(L0s/L1)
    cap 05[a0] = MSI supports 4 messages, 64 bit enabled with 1 message
    cap 11[c0] = MSI-X supports 3 messages
                 Table in map 0x24[0x42000], PBA in map 0x24[0x43000]
    ecap 000b[100] = Vendor [1] ID 0001 Rev 1 Length 16
    ecap 0015[200] = Resizable BAR 1
    ecap 0019[270] = PCIe Sec 1 lane errors 0
    ecap 000d[2a0] = ACS 1
    ecap 000f[2b0] = ATS 1
    ecap 0013[2c0] = Page Page Request 1
    ecap 001b[2d0] = Process Address Space ID 1
    ecap 0018[320] = LTR 1

hdac0@pci0:4:0:1:	class=0x040300 rev=0x00 hdr=0x00 vendor=0x1002 device=0x15de subvendor=0x103c subdevice=0x87b7
    vendor     = 'Advanced Micro Devices, Inc. [AMD/ATI]'
    device     = 'Raven/Raven2/Fenghuang HDMI/DP Audio Controller'
    class      = multimedia
    subclass   = HDA
    bar   [10] = type Memory, range 32, base 0xfcdc8000, size 16384, enabled
    cap 09[48] = vendor (length 8)
    cap 01[50] = powerspec 3  supports D0 D3  current D0
    cap 10[64] = PCI-Express 2 legacy endpoint max data 256(256) FLR RO NS
                 max read 512
                 link x16(x16) speed 8.0(8.0) ASPM disabled(L0s/L1)
    cap 05[a0] = MSI supports 1 message, 64 bit enabled with 1 message
    ecap 000b[100] = Vendor [1] ID 0001 Rev 1 Length 16

none1@pci0:4:0:2:	class=0x108000 rev=0x00 hdr=0x00 vendor=0x1022 device=0x15df subvendor=0x103c subdevice=0x87b7
    vendor     = 'Advanced Micro Devices, Inc. [AMD]'
    device     = 'Family 17h (Models 10h-1fh) Platform Security Processor'
    class      = encrypt/decrypt
    bar   [18] = type Memory, range 32, base 0xfcc00000, size 1048576, enabled
    bar   [24] = type Memory, range 32, base 0xfcdcc000, size 8192, enabled
    cap 09[48] = vendor (length 8)
    cap 01[50] = powerspec 3  supports D0 D3  current D0
    cap 10[64] = PCI-Express 2 endpoint max data 256(256) RO NS
                 max read 512
                 link x16(x16) speed 8.0(8.0) ASPM disabled(L0s/L1)
    cap 05[a0] = MSI supports 2 messages, 64 bit 
    cap 11[c0] = MSI-X supports 2 messages
                 Table in map 0x24[0x0], PBA in map 0x24[0x1000]
    ecap 000b[100] = Vendor [1] ID 0001 Rev 1 Length 16

xhci0@pci0:4:0:3:	class=0x0c0330 rev=0x00 hdr=0x00 vendor=0x1022 device=0x15e5 subvendor=0x103c subdevice=0x87b7
    vendor     = 'Advanced Micro Devices, Inc. [AMD]'
    device     = 'Raven2 USB 3.1'
    class      = serial bus
    subclass   = USB
    bar   [10] = type Memory, range 64, base 0xfcb00000, size 1048576, enabled
    cap 09[48] = vendor (length 8)
    cap 01[50] = powerspec 3  supports D0 D3  current D0
    cap 10[64] = PCI-Express 2 endpoint max data 256(256) RO NS
                 max read 512
                 link x16(x16) speed 8.0(8.0) ASPM disabled(L0s/L1)
    cap 05[a0] = MSI supports 8 messages, 64 bit 
    cap 11[c0] = MSI-X supports 8 messages, enabled
                 Table in map 0x10[0xfe000], PBA in map 0x10[0xff000]
    ecap 000b[100] = Vendor [1] ID 0001 Rev 1 Length 16

none2@pci0:4:0:5:	class=0x048000 rev=0x00 hdr=0x00 vendor=0x1022 device=0x15e2 subvendor=0x103c subdevice=0x87b7
    vendor     = 'Advanced Micro Devices, Inc. [AMD]'
    device     = 'ACP/ACP3X/ACP6x Audio Coprocessor'
    class      = multimedia
    bar   [10] = type Memory, range 32, base 0xfcd80000, size 262144, enabled
    cap 09[48] = vendor (length 8)
    cap 01[50] = powerspec 3  supports D0 D3  current D0
    cap 10[64] = PCI-Express 2 endpoint max data 256(256) RO NS
                 max read 512
                 link x16(x16) speed 8.0(8.0) ASPM disabled(L0s/L1)
    cap 05[a0] = MSI supports 1 message, 64 bit 
    ecap 000b[100] = Vendor [1] ID 0001 Rev 1 Length 16

hdac1@pci0:4:0:6:	class=0x040300 rev=0x00 hdr=0x00 vendor=0x1022 device=0x15e3 subvendor=0x103c subdevice=0x87b7
    vendor     = 'Advanced Micro Devices, Inc. [AMD]'
    device     = 'Family 17h/19h HD Audio Controller'
    class      = multimedia
    subclass   = HDA
    bar   [10] = type Memory, range 32, base 0xfcdc0000, size 32768, enabled
    cap 09[48] = vendor (length 8)
    cap 01[50] = powerspec 3  supports D0 D3  current D0
    cap 10[64] = PCI-Express 2 endpoint max data 256(256) RO NS
                 max read 512
                 link x16(x16) speed 8.0(8.0) ASPM disabled(L0s/L1)
    cap 05[a0] = MSI supports 1 message, 64 bit enabled with 1 message
    ecap 000b[100] = Vendor [1] ID 0001 Rev 1 Length 16
