none0@pci0:127:8:0:	class=0x088000 card=0x6f808086 chip=0x6f808086 rev=0x01 hdr=0x00
    vendor     = 'Intel Corporation'
    device     = 'Xeon E7 v4/Xeon E5 v4/Xeon E3 v4/Xeon D QPI Link 0'
    class      = base peripheral

none1@pci0:127:8:3:	class=0x088000 card=0x6f838086 chip=0x6f838086 rev=0x01 hdr=0x00
    vendor     = 'Intel Corporation'
    device     = 'Xeon E7 v4/Xeon E5 v4/Xeon E3 v4/Xeon D QPI Link 0'
    class      = base peripheral
    cap 10[40] = PCI-Express 1 root endpoint max data 128(128)
    ecap 000b[100] = Vendor 0none2@pci0:127:9:0:	class=0x088000 card=0x6f908086 chip=0x6f908086 rev=0x01 hdr=0x00
    vendor     = 'Intel Corporation'
    device     = 'Xeon E7 v4/Xeon E5 v4/Xeon E3 v4/Xeon D QPI Link 1'
    class      = base peripheral

none3@pci0:127:9:3:	class=0x088000 card=0x6f938086 chip=0x6f938086 rev=0x01 hdr=0x00
    vendor     = 'Intel Corporation'
    device     = 'Xeon E7 v4/Xeon E5 v4/Xeon E3 v4/Xeon D QPI Link 1'
    class      = base peripheral
    cap 10[40] = PCI-Express 1 root endpoint max data 128(128)
    ecap 000b[100] = Vendor 0none4@pci0:127:11:0:	class=0x088000 card=0x21ea103c chip=0x6f818086 rev=0x01 hdr=0x00
    vendor     = 'Intel Corporation'
    device     = 'Xeon E7 v4/Xeon E5 v4/Xeon E3 v4/Xeon D R3 QPI Link 0/1'
    class      = base peripheral

none5@pci0:127:11:1:	class=0x110100 card=0x21ea103c chip=0x6f368086 rev=0x01 hdr=0x00
    vendor     = 'Intel Corporation'
    device     = 'Xeon E7 v4/Xeon E5 v4/Xeon E3 v4/Xeon D R3 QPI Link 0/1'
    class      = dasp
    subclass   = performance counters

none6@pci0:127:11:2:	class=0x110100 card=0x21ea103c chip=0x6f378086 rev=0x01 hdr=0x00
    vendor     = 'Intel Corporation'
    device     = 'Xeon E7 v4/Xeon E5 v4/Xeon E3 v4/Xeon D R3 QPI Link 0/1'
    class      = dasp
    subclass   = performance counters

none7@pci0:127:11:3:	class=0x088000 card=0x00000000 chip=0x6f768086 rev=0x01 hdr=0x00
    vendor     = 'Intel Corporation'
    device     = 'Xeon E7 v4/Xeon E5 v4/Xeon E3 v4/Xeon D R3 QPI Link Debug'
    class      = base peripheral

none8@pci0:127:12:0:	class=0x088000 card=0x21ea103c chip=0x6fe08086 rev=0x01 hdr=0x00
    vendor     = 'Intel Corporation'
    device     = 'Xeon E7 v4/Xeon E5 v4/Xeon E3 v4/Xeon D Caching Agent'
    class      = base peripheral

none9@pci0:127:12:1:	class=0x088000 card=0x21ea103c chip=0x6fe18086 rev=0x01 hdr=0x00
    vendor     = 'Intel Corporation'
    device     = 'Xeon E7 v4/Xeon E5 v4/Xeon E3 v4/Xeon D Caching Agent'
    class      = base peripheral

none10@pci0:127:12:2:	class=0x088000 card=0x21ea103c chip=0x6fe28086 rev=0x01 hdr=0x00
    vendor     = 'Intel Corporation'
    device     = 'Xeon E7 v4/Xeon E5 v4/Xeon E3 v4/Xeon D Caching Agent'
    class      = base peripheral

none11@pci0:127:12:3:	class=0x088000 card=0x21ea103c chip=0x6fe38086 rev=0x01 hdr=0x00
    vendor     = 'Intel Corporation'
    device     = 'Xeon E7 v4/Xeon E5 v4/Xeon E3 v4/Xeon D Caching Agent'
    class      = base peripheral

none12@pci0:127:12:4:	class=0x088000 card=0x21ea103c chip=0x6fe48086 rev=0x01 hdr=0x00
    vendor     = 'Intel Corporation'
    device     = 'Xeon E7 v4/Xeon E5 v4/Xeon E3 v4/Xeon D Caching Agent'
    class      = base peripheral

none13@pci0:127:12:5:	class=0x088000 card=0x21ea103c chip=0x6fe58086 rev=0x01 hdr=0x00
    vendor     = 'Intel Corporation'
    device     = 'Xeon E7 v4/Xeon E5 v4/Xeon E3 v4/Xeon D Caching Agent'
    class      = base peripheral

none14@pci0:127:12:6:	class=0x088000 card=0x21ea103c chip=0x6fe68086 rev=0x01 hdr=0x00
    vendor     = 'Intel Corporation'
    device     = 'Xeon E7 v4/Xeon E5 v4/Xeon E3 v4/Xeon D Caching Agent'
    class      = base peripheral

none15@pci0:127:12:7:	class=0x088000 card=0x21ea103c chip=0x6fe78086 rev=0x01 hdr=0x00
    vendor     = 'Intel Corporation'
    device     = 'Xeon E7 v4/Xeon E5 v4/Xeon E3 v4/Xeon D Caching Agent'
    class      = base peripheral

none16@pci0:127:13:0:	class=0x088000 card=0x21ea103c chip=0x6fe88086 rev=0x01 hdr=0x00
    vendor     = 'Intel Corporation'
    device     = 'Xeon E7 v4/Xeon E5 v4/Xeon E3 v4/Xeon D Caching Agent'
    class      = base peripheral

none17@pci0:127:13:1:	class=0x088000 card=0x21ea103c chip=0x6fe98086 rev=0x01 hdr=0x00
    vendor     = 'Intel Corporation'
    device     = 'Xeon E7 v4/Xeon E5 v4/Xeon E3 v4/Xeon D Caching Agent'
    class      = base peripheral

none18@pci0:127:13:2:	class=0x088000 card=0x21ea103c chip=0x6fea8086 rev=0x01 hdr=0x00
    vendor     = 'Intel Corporation'
    device     = 'Xeon E7 v4/Xeon E5 v4/Xeon E3 v4/Xeon D Caching Agent'
    class      = base peripheral

none19@pci0:127:13:3:	class=0x088000 card=0x21ea103c chip=0x6feb8086 rev=0x01 hdr=0x00
    vendor     = 'Intel Corporation'
    device     = 'Xeon E7 v4/Xeon E5 v4/Xeon E3 v4/Xeon D Caching Agent'
    class      = base peripheral

none20@pci0:127:13:4:	class=0x088000 card=0x21ea103c chip=0x6fec8086 rev=0x01 hdr=0x00
    vendor     = 'Intel Corporation'
    device     = 'Xeon E7 v4/Xeon E5 v4/Xeon E3 v4/Xeon D Caching Agent'
    class      = base peripheral

none21@pci0:127:13:5:	class=0x088000 card=0x21ea103c chip=0x6fed8086 rev=0x01 hdr=0x00
    vendor     = 'Intel Corporation'
    device     = 'Xeon E7 v4/Xeon E5 v4/Xeon E3 v4/Xeon D Caching Agent'
    class      = base peripheral

none22@pci0:127:13:6:	class=0x088000 card=0x21ea103c chip=0x6fee8086 rev=0x01 hdr=0x00
    vendor     = 'Intel Corporation'
    device     = 'Xeon E7 v4/Xeon E5 v4/Xeon E3 v4/Xeon D Caching Agent'
    class      = base peripheral

none23@pci0:127:13:7:	class=0x088000 card=0x21ea103c chip=0x6fef8086 rev=0x01 hdr=0x00
    vendor     = 'Intel Corporation'
    device     = 'Xeon E7 v4/Xeon E5 v4/Xeon E3 v4/Xeon D Caching Agent'
    class      = base peripheral

none24@pci0:127:15:0:	class=0x088000 card=0x21ea103c chip=0x6ff88086 rev=0x01 hdr=0x00
    vendor     = 'Intel Corporation'
    device     = 'Xeon E7 v4/Xeon E5 v4/Xeon E3 v4/Xeon D Caching Agent'
    class      = base peripheral

none25@pci0:127:15:1:	class=0x088000 card=0x21ea103c chip=0x6ff98086 rev=0x01 hdr=0x00
    vendor     = 'Intel Corporation'
    device     = 'Xeon E7 v4/Xeon E5 v4/Xeon E3 v4/Xeon D Caching Agent'
    class      = base peripheral

none26@pci0:127:15:2:	class=0x088000 card=0x21ea103c chip=0x6ffa8086 rev=0x01 hdr=0x00
    vendor     = 'Intel Corporation'
    device     = 'Xeon E7 v4/Xeon E5 v4/Xeon E3 v4/Xeon D Caching Agent'
    class      = base peripheral

none27@pci0:127:15:3:	class=0x088000 card=0x21ea103c chip=0x6ffb8086 rev=0x01 hdr=0x00
    vendor     = 'Intel Corporation'
    device     = 'Xeon E7 v4/Xeon E5 v4/Xeon E3 v4/Xeon D Caching Agent'
    class      = base peripheral

none28@pci0:127:15:4:	class=0x088000 card=0x21ea103c chip=0x6ffc8086 rev=0x01 hdr=0x00
    vendor     = 'Intel Corporation'
    device     = 'Xeon E7 v4/Xeon E5 v4/Xeon E3 v4/Xeon D Caching Agent'
    class      = base peripheral

none29@pci0:127:15:5:	class=0x088000 card=0x21ea103c chip=0x6ffd8086 rev=0x01 hdr=0x00
    vendor     = 'Intel Corporation'
    device     = 'Xeon E7 v4/Xeon E5 v4/Xeon E3 v4/Xeon D Caching Agent'
    class      = base peripheral

none30@pci0:127:15:6:	class=0x088000 card=0x21ea103c chip=0x6ffe8086 rev=0x01 hdr=0x00
    vendor     = 'Intel Corporation'
    device     = 'Xeon E7 v4/Xeon E5 v4/Xeon E3 v4/Xeon D Caching Agent'
    class      = base peripheral

none31@pci0:127:16:0:	class=0x088000 card=0x21ea103c chip=0x6f1d8086 rev=0x01 hdr=0x00
    vendor     = 'Intel Corporation'
    device     = 'Xeon E7 v4/Xeon E5 v4/Xeon E3 v4/Xeon D R2PCIe Agent'
    class      = base peripheral

none32@pci0:127:16:1:	class=0x110100 card=0x21ea103c chip=0x6f348086 rev=0x01 hdr=0x00
    vendor     = 'Intel Corporation'
    device     = 'Xeon E7 v4/Xeon E5 v4/Xeon E3 v4/Xeon D R2PCIe Agent'
    class      = dasp
    subclass   = performance counters

none33@pci0:127:16:5:	class=0x088000 card=0x21ea103c chip=0x6f1e8086 rev=0x01 hdr=0x00
    vendor     = 'Intel Corporation'
    device     = 'Xeon E7 v4/Xeon E5 v4/Xeon E3 v4/Xeon D Ubox'
    class      = base peripheral

none34@pci0:127:16:6:	class=0x110100 card=0x21ea103c chip=0x6f7d8086 rev=0x01 hdr=0x00
    vendor     = 'Intel Corporation'
    device     = 'Xeon E7 v4/Xeon E5 v4/Xeon E3 v4/Xeon D Ubox'
    class      = dasp
    subclass   = performance counters

none35@pci0:127:16:7:	class=0x088000 card=0x21ea103c chip=0x6f1f8086 rev=0x01 hdr=0x00
    vendor     = 'Intel Corporation'
    device     = 'Xeon E7 v4/Xeon E5 v4/Xeon E3 v4/Xeon D Ubox'
    class      = base peripheral

none36@pci0:127:18:0:	class=0x088000 card=0x21ea103c chip=0x6fa08086 rev=0x01 hdr=0x00
    vendor     = 'Intel Corporation'
    device     = 'Xeon E7 v4/Xeon E5 v4/Xeon E3 v4/Xeon D Home Agent 0'
    class      = base peripheral
    bar   [18] = type Memory, range 32, base 0, size 64, disabled
    bar   [20] = type Memory, range 32, base 0, size 64, disabled

none37@pci0:127:18:1:	class=0x110100 card=0x21ea103c chip=0x6f308086 rev=0x01 hdr=0x00
    vendor     = 'Intel Corporation'
    device     = 'Xeon E7 v4/Xeon E5 v4/Xeon E3 v4/Xeon D Home Agent 0'
    class      = dasp
    subclass   = performance counters

none38@pci0:127:18:2:	class=0x088000 card=0x21ea103c chip=0x6f708086 rev=0x01 hdr=0x00
    vendor     = 'Intel Corporation'
    device     = 'Xeon E7 v4/Xeon E5 v4/Xeon E3 v4/Xeon D Home Agent 0 Debug'
    class      = base peripheral

none39@pci0:127:18:4:	class=0x088000 card=0x21ea103c chip=0x6f608086 rev=0x01 hdr=0x00
    vendor     = 'Intel Corporation'
    device     = 'Xeon E7 v4/Xeon E5 v4/Xeon E3 v4/Xeon D Home Agent 1'
    class      = base peripheral
    bar   [18] = type Memory, range 32, base 0, size 64, disabled
    bar   [20] = type Memory, range 32, base 0, size 64, disabled

none40@pci0:127:18:5:	class=0x110100 card=0x21ea103c chip=0x6f388086 rev=0x01 hdr=0x00
    vendor     = 'Intel Corporation'
    device     = 'Xeon E7 v4/Xeon E5 v4/Xeon E3 v4/Xeon D Home Agent 1'
    class      = dasp
    subclass   = performance counters

none41@pci0:127:18:6:	class=0x088000 card=0x21ea103c chip=0x6f788086 rev=0x01 hdr=0x00
    vendor     = 'Intel Corporation'
    device     = 'Xeon E7 v4/Xeon E5 v4/Xeon E3 v4/Xeon D Home Agent 1 Debug'
    class      = base peripheral

none42@pci0:127:19:0:	class=0x088000 card=0x21ea103c chip=0x6fa88086 rev=0x01 hdr=0x00
    vendor     = 'Intel Corporation'
    device     = 'Xeon E7 v4/Xeon E5 v4/Xeon E3 v4/Xeon D Memory Controller 0 - Target Address/Thermal/RAS'
    class      = base peripheral
    cap 10[40] = PCI-Express 1 root endpoint max data 128(128)

none43@pci0:127:19:1:	class=0x088000 card=0x21ea103c chip=0x6f718086 rev=0x01 hdr=0x00
    vendor     = 'Intel Corporation'
    device     = 'Xeon E7 v4/Xeon E5 v4/Xeon E3 v4/Xeon D Memory Controller 0 - Target Address/Thermal/RAS'
    class      = base peripheral
    cap 10[40] = PCI-Express 1 root endpoint max data 128(128)

none44@pci0:127:19:2:	class=0x088000 card=0x21ea103c chip=0x6faa8086 rev=0x01 hdr=0x00
    vendor     = 'Intel Corporation'
    device     = 'Xeon E7 v4/Xeon E5 v4/Xeon E3 v4/Xeon D Memory Controller 0 - Channel Target Address Decoder'
    class      = base peripheral
    cap 10[40] = PCI-Express 1 root endpoint max data 128(128)

none45@pci0:127:19:3:	class=0x088000 card=0x21ea103c chip=0x6fab8086 rev=0x01 hdr=0x00
    vendor     = 'Intel Corporation'
    device     = 'Xeon E7 v4/Xeon E5 v4/Xeon E3 v4/Xeon D Memory Controller 0 - Channel Target Address Decoder'
    class      = base peripheral
    cap 10[40] = PCI-Express 1 root endpoint max data 128(128)

none46@pci0:127:19:6:	class=0x088000 card=0x00000000 chip=0x6fae8086 rev=0x01 hdr=0x00
    vendor     = 'Intel Corporation'
    device     = 'Xeon E7 v4/Xeon E5 v4/Xeon E3 v4/Xeon D DDRIO Channel 0/1 Broadcast'
    class      = base peripheral

none47@pci0:127:19:7:	class=0x088000 card=0x00000000 chip=0x6faf8086 rev=0x01 hdr=0x00
    vendor     = 'Intel Corporation'
    device     = 'Xeon E7 v4/Xeon E5 v4/Xeon E3 v4/Xeon D DDRIO Global Broadcast'
    class      = base peripheral

none48@pci0:127:20:0:	class=0x088000 card=0x21ea103c chip=0x6fb08086 rev=0x01 hdr=0x00
    vendor     = 'Intel Corporation'
    device     = 'Xeon E7 v4/Xeon E5 v4/Xeon E3 v4/Xeon D Memory Controller 0 - Channel 0 Thermal Control'
    class      = base peripheral
    cap 10[40] = PCI-Express 1 root endpoint max data 128(128)

none49@pci0:127:20:1:	class=0x088000 card=0x21ea103c chip=0x6fb18086 rev=0x01 hdr=0x00
    vendor     = 'Intel Corporation'
    device     = 'Xeon E7 v4/Xeon E5 v4/Xeon E3 v4/Xeon D Memory Controller 0 - Channel 1 Thermal Control'
    class      = base peripheral
    cap 10[40] = PCI-Express 1 root endpoint max data 128(128)

none50@pci0:127:20:2:	class=0x088000 card=0x21ea103c chip=0x6fb28086 rev=0x01 hdr=0x00
    vendor     = 'Intel Corporation'
    device     = 'Xeon E7 v4/Xeon E5 v4/Xeon E3 v4/Xeon D Memory Controller 0 - Channel 0 Error'
    class      = base peripheral
    cap 10[40] = PCI-Express 1 root endpoint max data 128(128)

none51@pci0:127:20:3:	class=0x088000 card=0x21ea103c chip=0x6fb38086 rev=0x01 hdr=0x00
    vendor     = 'Intel Corporation'
    device     = 'Xeon E7 v4/Xeon E5 v4/Xeon E3 v4/Xeon D Memory Controller 0 - Channel 1 Error'
    class      = base peripheral
    cap 10[40] = PCI-Express 1 root endpoint max data 128(128)

none52@pci0:127:20:4:	class=0x088000 card=0x00000000 chip=0x6fbc8086 rev=0x01 hdr=0x00
    vendor     = 'Intel Corporation'
    device     = 'Xeon E7 v4/Xeon E5 v4/Xeon E3 v4/Xeon D DDRIO Channel 0/1 Interface'
    class      = base peripheral

none53@pci0:127:20:5:	class=0x088000 card=0x00000000 chip=0x6fbd8086 rev=0x01 hdr=0x00
    vendor     = 'Intel Corporation'
    device     = 'Xeon E7 v4/Xeon E5 v4/Xeon E3 v4/Xeon D DDRIO Channel 0/1 Interface'
    class      = base peripheral

none54@pci0:127:20:6:	class=0x088000 card=0x00000000 chip=0x6fbe8086 rev=0x01 hdr=0x00
    vendor     = 'Intel Corporation'
    device     = 'Xeon E7 v4/Xeon E5 v4/Xeon E3 v4/Xeon D DDRIO Channel 0/1 Interface'
    class      = base peripheral

none55@pci0:127:20:7:	class=0x088000 card=0x00000000 chip=0x6fbf8086 rev=0x01 hdr=0x00
    vendor     = 'Intel Corporation'
    device     = 'Xeon E7 v4/Xeon E5 v4/Xeon E3 v4/Xeon D DDRIO Channel 0/1 Interface'
    class      = base peripheral

none56@pci0:127:22:0:	class=0x088000 card=0x21ea103c chip=0x6f688086 rev=0x01 hdr=0x00
    vendor     = 'Intel Corporation'
    device     = 'Xeon E7 v4/Xeon E5 v4/Xeon E3 v4/Xeon D Target Address/Thermal/RAS'
    class      = base peripheral
    cap 10[40] = PCI-Express 1 root endpoint max data 128(128)

none57@pci0:127:22:1:	class=0x088000 card=0x21ea103c chip=0x6f798086 rev=0x01 hdr=0x00
    vendor     = 'Intel Corporation'
    device     = 'Xeon E7 v4/Xeon E5 v4/Xeon E3 v4/Xeon D Target Address/Thermal/RAS'
    class      = base peripheral
    cap 10[40] = PCI-Express 1 root endpoint max data 128(128)

none58@pci0:127:22:2:	class=0x088000 card=0x21ea103c chip=0x6f6a8086 rev=0x01 hdr=0x00
    vendor     = 'Intel Corporation'
    device     = 'Xeon E7 v4/Xeon E5 v4/Xeon E3 v4/Xeon D Channel Target Address Decoder'
    class      = base peripheral
    cap 10[40] = PCI-Express 1 root endpoint max data 128(128)

none59@pci0:127:22:3:	class=0x088000 card=0x21ea103c chip=0x6f6b8086 rev=0x01 hdr=0x00
    vendor     = 'Intel Corporation'
    device     = 'Xeon E7 v4/Xeon E5 v4/Xeon E3 v4/Xeon D Channel Target Address Decoder'
    class      = base peripheral
    cap 10[40] = PCI-Express 1 root endpoint max data 128(128)

none60@pci0:127:22:6:	class=0x088000 card=0x00000000 chip=0x6f6e8086 rev=0x01 hdr=0x00
    vendor     = 'Intel Corporation'
    device     = 'Xeon E7 v4/Xeon E5 v4/Xeon E3 v4/Xeon D DDRIO Channel 2/3 Broadcast'
    class      = base peripheral

none61@pci0:127:22:7:	class=0x088000 card=0x00000000 chip=0x6f6f8086 rev=0x01 hdr=0x00
    vendor     = 'Intel Corporation'
    device     = 'Xeon E7 v4/Xeon E5 v4/Xeon E3 v4/Xeon D DDRIO Global Broadcast'
    class      = base peripheral

none62@pci0:127:23:0:	class=0x088000 card=0x21ea103c chip=0x6fd08086 rev=0x01 hdr=0x00
    vendor     = 'Intel Corporation'
    device     = 'Xeon E7 v4/Xeon E5 v4/Xeon E3 v4/Xeon D Memory Controller 1 - Channel 0 Thermal Control'
    class      = base peripheral
    cap 10[40] = PCI-Express 1 root endpoint max data 128(128)

none63@pci0:127:23:1:	class=0x088000 card=0x21ea103c chip=0x6fd18086 rev=0x01 hdr=0x00
    vendor     = 'Intel Corporation'
    device     = 'Xeon E7 v4/Xeon E5 v4/Xeon E3 v4/Xeon D Memory Controller 1 - Channel 1 Thermal Control'
    class      = base peripheral
    cap 10[40] = PCI-Express 1 root endpoint max data 128(128)

none64@pci0:127:23:2:	class=0x088000 card=0x21ea103c chip=0x6fd28086 rev=0x01 hdr=0x00
    vendor     = 'Intel Corporation'
    device     = 'Xeon E7 v4/Xeon E5 v4/Xeon E3 v4/Xeon D Memory Controller 1 - Channel 0 Error'
    class      = base peripheral
    cap 10[40] = PCI-Express 1 root endpoint max data 128(128)

none65@pci0:127:23:3:	class=0x088000 card=0x21ea103c chip=0x6fd38086 rev=0x01 hdr=0x00
    vendor     = 'Intel Corporation'
    device     = 'Xeon E7 v4/Xeon E5 v4/Xeon E3 v4/Xeon D Memory Controller 1 - Channel 1 Error'
    class      = base peripheral
    cap 10[40] = PCI-Express 1 root endpoint max data 128(128)

none66@pci0:127:23:4:	class=0x088000 card=0x00000000 chip=0x6fb88086 rev=0x01 hdr=0x00
    vendor     = 'Intel Corporation'
    device     = 'Xeon E7 v4/Xeon E5 v4/Xeon E3 v4/Xeon D DDRIO Channel 2/3 Interface'
    class      = base peripheral

none67@pci0:127:23:5:	class=0x088000 card=0x00000000 chip=0x6fb98086 rev=0x01 hdr=0x00
    vendor     = 'Intel Corporation'
    device     = 'Xeon E7 v4/Xeon E5 v4/Xeon E3 v4/Xeon D DDRIO Channel 2/3 Interface'
    class      = base peripheral

none68@pci0:127:23:6:	class=0x088000 card=0x00000000 chip=0x6fba8086 rev=0x01 hdr=0x00
    vendor     = 'Intel Corporation'
    device     = 'Xeon E7 v4/Xeon E5 v4/Xeon E3 v4/Xeon D DDRIO Channel 2/3 Interface'
    class      = base peripheral

none69@pci0:127:23:7:	class=0x088000 card=0x00000000 chip=0x6fbb8086 rev=0x01 hdr=0x00
    vendor     = 'Intel Corporation'
    device     = 'Xeon E7 v4/Xeon E5 v4/Xeon E3 v4/Xeon D DDRIO Channel 2/3 Interface'
    class      = base peripheral

none70@pci0:127:30:0:	class=0x088000 card=0x21ea103c chip=0x6f988086 rev=0x01 hdr=0x00
    vendor     = 'Intel Corporation'
    device     = 'Xeon E7 v4/Xeon E5 v4/Xeon E3 v4/Xeon D Power Control Unit'
    class      = base peripheral

none71@pci0:127:30:1:	class=0x088000 card=0x21ea103c chip=0x6f998086 rev=0x01 hdr=0x00
    vendor     = 'Intel Corporation'
    device     = 'Xeon E7 v4/Xeon E5 v4/Xeon E3 v4/Xeon D Power Control Unit'
    class      = base peripheral

none72@pci0:127:30:2:	class=0x088000 card=0x21ea103c chip=0x6f9a8086 rev=0x01 hdr=0x00
    vendor     = 'Intel Corporation'
    device     = 'Xeon E7 v4/Xeon E5 v4/Xeon E3 v4/Xeon D Power Control Unit'
    class      = base peripheral

none73@pci0:127:30:3:	class=0x088000 card=0x21ea103c chip=0x6fc08086 rev=0x01 hdr=0x00
    vendor     = 'Intel Corporation'
    device     = 'Xeon E7 v4/Xeon E5 v4/Xeon E3 v4/Xeon D Power Control Unit'
    class      = base peripheral
    bar   [10] = type I/O Port, range 32, base 0x14, size 4, disabled

none74@pci0:127:30:4:	class=0x088000 card=0x21ea103c chip=0x6f9c8086 rev=0x01 hdr=0x00
    vendor     = 'Intel Corporation'
    device     = 'Xeon E7 v4/Xeon E5 v4/Xeon E3 v4/Xeon D Power Control Unit'
    class      = base peripheral

none75@pci0:127:31:0:	class=0x088000 card=0x00000000 chip=0x6f888086 rev=0x01 hdr=0x00
    vendor     = 'Intel Corporation'
    device     = 'Xeon E7 v4/Xeon E5 v4/Xeon E3 v4/Xeon D Power Control Unit'
    class      = base peripheral

none76@pci0:127:31:2:	class=0x088000 card=0x00000000 chip=0x6f8a8086 rev=0x01 hdr=0x00
    vendor     = 'Intel Corporation'
    device     = 'Xeon E7 v4/Xeon E5 v4/Xeon E3 v4/Xeon D Power Control Unit'
    class      = base peripheral

none77@pci0:255:8:0:	class=0x088000 card=0x6f808086 chip=0x6f808086 rev=0x01 hdr=0x00
    vendor     = 'Intel Corporation'
    device     = 'Xeon E7 v4/Xeon E5 v4/Xeon E3 v4/Xeon D QPI Link 0'
    class      = base peripheral

none78@pci0:255:8:3:	class=0x088000 card=0x6f838086 chip=0x6f838086 rev=0x01 hdr=0x00
    vendor     = 'Intel Corporation'
    device     = 'Xeon E7 v4/Xeon E5 v4/Xeon E3 v4/Xeon D QPI Link 0'
    class      = base peripheral
    cap 10[40] = PCI-Express 1 root endpoint max data 128(128)
    ecap 000b[100] = Vendor 0none79@pci0:255:9:0:	class=0x088000 card=0x6f908086 chip=0x6f908086 rev=0x01 hdr=0x00
    vendor     = 'Intel Corporation'
    device     = 'Xeon E7 v4/Xeon E5 v4/Xeon E3 v4/Xeon D QPI Link 1'
    class      = base peripheral

none80@pci0:255:9:3:	class=0x088000 card=0x6f938086 chip=0x6f938086 rev=0x01 hdr=0x00
    vendor     = 'Intel Corporation'
    device     = 'Xeon E7 v4/Xeon E5 v4/Xeon E3 v4/Xeon D QPI Link 1'
    class      = base peripheral
    cap 10[40] = PCI-Express 1 root endpoint max data 128(128)
    ecap 000b[100] = Vendor 0none81@pci0:255:11:0:	class=0x088000 card=0x21ea103c chip=0x6f818086 rev=0x01 hdr=0x00
    vendor     = 'Intel Corporation'
    device     = 'Xeon E7 v4/Xeon E5 v4/Xeon E3 v4/Xeon D R3 QPI Link 0/1'
    class      = base peripheral

none82@pci0:255:11:1:	class=0x110100 card=0x21ea103c chip=0x6f368086 rev=0x01 hdr=0x00
    vendor     = 'Intel Corporation'
    device     = 'Xeon E7 v4/Xeon E5 v4/Xeon E3 v4/Xeon D R3 QPI Link 0/1'
    class      = dasp
    subclass   = performance counters

none83@pci0:255:11:2:	class=0x110100 card=0x21ea103c chip=0x6f378086 rev=0x01 hdr=0x00
    vendor     = 'Intel Corporation'
    device     = 'Xeon E7 v4/Xeon E5 v4/Xeon E3 v4/Xeon D R3 QPI Link 0/1'
    class      = dasp
    subclass   = performance counters

none84@pci0:255:11:3:	class=0x088000 card=0x00000000 chip=0x6f768086 rev=0x01 hdr=0x00
    vendor     = 'Intel Corporation'
    device     = 'Xeon E7 v4/Xeon E5 v4/Xeon E3 v4/Xeon D R3 QPI Link Debug'
    class      = base peripheral

none85@pci0:255:12:0:	class=0x088000 card=0x21ea103c chip=0x6fe08086 rev=0x01 hdr=0x00
    vendor     = 'Intel Corporation'
    device     = 'Xeon E7 v4/Xeon E5 v4/Xeon E3 v4/Xeon D Caching Agent'
    class      = base peripheral

none86@pci0:255:12:1:	class=0x088000 card=0x21ea103c chip=0x6fe18086 rev=0x01 hdr=0x00
    vendor     = 'Intel Corporation'
    device     = 'Xeon E7 v4/Xeon E5 v4/Xeon E3 v4/Xeon D Caching Agent'
    class      = base peripheral

none87@pci0:255:12:2:	class=0x088000 card=0x21ea103c chip=0x6fe28086 rev=0x01 hdr=0x00
    vendor     = 'Intel Corporation'
    device     = 'Xeon E7 v4/Xeon E5 v4/Xeon E3 v4/Xeon D Caching Agent'
    class      = base peripheral

none88@pci0:255:12:3:	class=0x088000 card=0x21ea103c chip=0x6fe38086 rev=0x01 hdr=0x00
    vendor     = 'Intel Corporation'
    device     = 'Xeon E7 v4/Xeon E5 v4/Xeon E3 v4/Xeon D Caching Agent'
    class      = base peripheral

none89@pci0:255:12:4:	class=0x088000 card=0x21ea103c chip=0x6fe48086 rev=0x01 hdr=0x00
    vendor     = 'Intel Corporation'
    device     = 'Xeon E7 v4/Xeon E5 v4/Xeon E3 v4/Xeon D Caching Agent'
    class      = base peripheral

none90@pci0:255:12:5:	class=0x088000 card=0x21ea103c chip=0x6fe58086 rev=0x01 hdr=0x00
    vendor     = 'Intel Corporation'
    device     = 'Xeon E7 v4/Xeon E5 v4/Xeon E3 v4/Xeon D Caching Agent'
    class      = base peripheral

none91@pci0:255:12:6:	class=0x088000 card=0x21ea103c chip=0x6fe68086 rev=0x01 hdr=0x00
    vendor     = 'Intel Corporation'
    device     = 'Xeon E7 v4/Xeon E5 v4/Xeon E3 v4/Xeon D Caching Agent'
    class      = base peripheral

none92@pci0:255:12:7:	class=0x088000 card=0x21ea103c chip=0x6fe78086 rev=0x01 hdr=0x00
    vendor     = 'Intel Corporation'
    device     = 'Xeon E7 v4/Xeon E5 v4/Xeon E3 v4/Xeon D Caching Agent'
    class      = base peripheral

none93@pci0:255:13:0:	class=0x088000 card=0x21ea103c chip=0x6fe88086 rev=0x01 hdr=0x00
    vendor     = 'Intel Corporation'
    device     = 'Xeon E7 v4/Xeon E5 v4/Xeon E3 v4/Xeon D Caching Agent'
    class      = base peripheral

none94@pci0:255:13:1:	class=0x088000 card=0x21ea103c chip=0x6fe98086 rev=0x01 hdr=0x00
    vendor     = 'Intel Corporation'
    device     = 'Xeon E7 v4/Xeon E5 v4/Xeon E3 v4/Xeon D Caching Agent'
    class      = base peripheral

none95@pci0:255:13:2:	class=0x088000 card=0x21ea103c chip=0x6fea8086 rev=0x01 hdr=0x00
    vendor     = 'Intel Corporation'
    device     = 'Xeon E7 v4/Xeon E5 v4/Xeon E3 v4/Xeon D Caching Agent'
    class      = base peripheral

none96@pci0:255:13:3:	class=0x088000 card=0x21ea103c chip=0x6feb8086 rev=0x01 hdr=0x00
    vendor     = 'Intel Corporation'
    device     = 'Xeon E7 v4/Xeon E5 v4/Xeon E3 v4/Xeon D Caching Agent'
    class      = base peripheral

none97@pci0:255:13:4:	class=0x088000 card=0x21ea103c chip=0x6fec8086 rev=0x01 hdr=0x00
    vendor     = 'Intel Corporation'
    device     = 'Xeon E7 v4/Xeon E5 v4/Xeon E3 v4/Xeon D Caching Agent'
    class      = base peripheral

none98@pci0:255:13:5:	class=0x088000 card=0x21ea103c chip=0x6fed8086 rev=0x01 hdr=0x00
    vendor     = 'Intel Corporation'
    device     = 'Xeon E7 v4/Xeon E5 v4/Xeon E3 v4/Xeon D Caching Agent'
    class      = base peripheral

none99@pci0:255:13:6:	class=0x088000 card=0x21ea103c chip=0x6fee8086 rev=0x01 hdr=0x00
    vendor     = 'Intel Corporation'
    device     = 'Xeon E7 v4/Xeon E5 v4/Xeon E3 v4/Xeon D Caching Agent'
    class      = base peripheral

none100@pci0:255:13:7:	class=0x088000 card=0x21ea103c chip=0x6fef8086 rev=0x01 hdr=0x00
    vendor     = 'Intel Corporation'
    device     = 'Xeon E7 v4/Xeon E5 v4/Xeon E3 v4/Xeon D Caching Agent'
    class      = base peripheral

none101@pci0:255:15:0:	class=0x088000 card=0x21ea103c chip=0x6ff88086 rev=0x01 hdr=0x00
    vendor     = 'Intel Corporation'
    device     = 'Xeon E7 v4/Xeon E5 v4/Xeon E3 v4/Xeon D Caching Agent'
    class      = base peripheral

none102@pci0:255:15:1:	class=0x088000 card=0x21ea103c chip=0x6ff98086 rev=0x01 hdr=0x00
    vendor     = 'Intel Corporation'
    device     = 'Xeon E7 v4/Xeon E5 v4/Xeon E3 v4/Xeon D Caching Agent'
    class      = base peripheral

none103@pci0:255:15:2:	class=0x088000 card=0x21ea103c chip=0x6ffa8086 rev=0x01 hdr=0x00
    vendor     = 'Intel Corporation'
    device     = 'Xeon E7 v4/Xeon E5 v4/Xeon E3 v4/Xeon D Caching Agent'
    class      = base peripheral

none104@pci0:255:15:3:	class=0x088000 card=0x21ea103c chip=0x6ffb8086 rev=0x01 hdr=0x00
    vendor     = 'Intel Corporation'
    device     = 'Xeon E7 v4/Xeon E5 v4/Xeon E3 v4/Xeon D Caching Agent'
    class      = base peripheral

none105@pci0:255:15:4:	class=0x088000 card=0x21ea103c chip=0x6ffc8086 rev=0x01 hdr=0x00
    vendor     = 'Intel Corporation'
    device     = 'Xeon E7 v4/Xeon E5 v4/Xeon E3 v4/Xeon D Caching Agent'
    class      = base peripheral

none106@pci0:255:15:5:	class=0x088000 card=0x21ea103c chip=0x6ffd8086 rev=0x01 hdr=0x00
    vendor     = 'Intel Corporation'
    device     = 'Xeon E7 v4/Xeon E5 v4/Xeon E3 v4/Xeon D Caching Agent'
    class      = base peripheral

none107@pci0:255:15:6:	class=0x088000 card=0x21ea103c chip=0x6ffe8086 rev=0x01 hdr=0x00
    vendor     = 'Intel Corporation'
    device     = 'Xeon E7 v4/Xeon E5 v4/Xeon E3 v4/Xeon D Caching Agent'
    class      = base peripheral

none108@pci0:255:16:0:	class=0x088000 card=0x21ea103c chip=0x6f1d8086 rev=0x01 hdr=0x00
    vendor     = 'Intel Corporation'
    device     = 'Xeon E7 v4/Xeon E5 v4/Xeon E3 v4/Xeon D R2PCIe Agent'
    class      = base peripheral

none109@pci0:255:16:1:	class=0x110100 card=0x21ea103c chip=0x6f348086 rev=0x01 hdr=0x00
    vendor     = 'Intel Corporation'
    device     = 'Xeon E7 v4/Xeon E5 v4/Xeon E3 v4/Xeon D R2PCIe Agent'
    class      = dasp
    subclass   = performance counters

none110@pci0:255:16:5:	class=0x088000 card=0x21ea103c chip=0x6f1e8086 rev=0x01 hdr=0x00
    vendor     = 'Intel Corporation'
    device     = 'Xeon E7 v4/Xeon E5 v4/Xeon E3 v4/Xeon D Ubox'
    class      = base peripheral

none111@pci0:255:16:6:	class=0x110100 card=0x21ea103c chip=0x6f7d8086 rev=0x01 hdr=0x00
    vendor     = 'Intel Corporation'
    device     = 'Xeon E7 v4/Xeon E5 v4/Xeon E3 v4/Xeon D Ubox'
    class      = dasp
    subclass   = performance counters

none112@pci0:255:16:7:	class=0x088000 card=0x21ea103c chip=0x6f1f8086 rev=0x01 hdr=0x00
    vendor     = 'Intel Corporation'
    device     = 'Xeon E7 v4/Xeon E5 v4/Xeon E3 v4/Xeon D Ubox'
    class      = base peripheral

none113@pci0:255:18:0:	class=0x088000 card=0x21ea103c chip=0x6fa08086 rev=0x01 hdr=0x00
    vendor     = 'Intel Corporation'
    device     = 'Xeon E7 v4/Xeon E5 v4/Xeon E3 v4/Xeon D Home Agent 0'
    class      = base peripheral
    bar   [18] = type Memory, range 32, base 0, size 64, disabled
    bar   [20] = type Memory, range 32, base 0, size 64, disabled

none114@pci0:255:18:1:	class=0x110100 card=0x21ea103c chip=0x6f308086 rev=0x01 hdr=0x00
    vendor     = 'Intel Corporation'
    device     = 'Xeon E7 v4/Xeon E5 v4/Xeon E3 v4/Xeon D Home Agent 0'
    class      = dasp
    subclass   = performance counters

none115@pci0:255:18:2:	class=0x088000 card=0x21ea103c chip=0x6f708086 rev=0x01 hdr=0x00
    vendor     = 'Intel Corporation'
    device     = 'Xeon E7 v4/Xeon E5 v4/Xeon E3 v4/Xeon D Home Agent 0 Debug'
    class      = base peripheral

none116@pci0:255:18:4:	class=0x088000 card=0x21ea103c chip=0x6f608086 rev=0x01 hdr=0x00
    vendor     = 'Intel Corporation'
    device     = 'Xeon E7 v4/Xeon E5 v4/Xeon E3 v4/Xeon D Home Agent 1'
    class      = base peripheral
    bar   [18] = type Memory, range 32, base 0, size 64, disabled
    bar   [20] = type Memory, range 32, base 0, size 64, disabled

none117@pci0:255:18:5:	class=0x110100 card=0x21ea103c chip=0x6f388086 rev=0x01 hdr=0x00
    vendor     = 'Intel Corporation'
    device     = 'Xeon E7 v4/Xeon E5 v4/Xeon E3 v4/Xeon D Home Agent 1'
    class      = dasp
    subclass   = performance counters

none118@pci0:255:18:6:	class=0x088000 card=0x21ea103c chip=0x6f788086 rev=0x01 hdr=0x00
    vendor     = 'Intel Corporation'
    device     = 'Xeon E7 v4/Xeon E5 v4/Xeon E3 v4/Xeon D Home Agent 1 Debug'
    class      = base peripheral

none119@pci0:255:19:0:	class=0x088000 card=0x21ea103c chip=0x6fa88086 rev=0x01 hdr=0x00
    vendor     = 'Intel Corporation'
    device     = 'Xeon E7 v4/Xeon E5 v4/Xeon E3 v4/Xeon D Memory Controller 0 - Target Address/Thermal/RAS'
    class      = base peripheral
    cap 10[40] = PCI-Express 1 root endpoint max data 128(128)

none120@pci0:255:19:1:	class=0x088000 card=0x21ea103c chip=0x6f718086 rev=0x01 hdr=0x00
    vendor     = 'Intel Corporation'
    device     = 'Xeon E7 v4/Xeon E5 v4/Xeon E3 v4/Xeon D Memory Controller 0 - Target Address/Thermal/RAS'
    class      = base peripheral
    cap 10[40] = PCI-Express 1 root endpoint max data 128(128)

none121@pci0:255:19:2:	class=0x088000 card=0x21ea103c chip=0x6faa8086 rev=0x01 hdr=0x00
    vendor     = 'Intel Corporation'
    device     = 'Xeon E7 v4/Xeon E5 v4/Xeon E3 v4/Xeon D Memory Controller 0 - Channel Target Address Decoder'
    class      = base peripheral
    cap 10[40] = PCI-Express 1 root endpoint max data 128(128)

none122@pci0:255:19:3:	class=0x088000 card=0x21ea103c chip=0x6fab8086 rev=0x01 hdr=0x00
    vendor     = 'Intel Corporation'
    device     = 'Xeon E7 v4/Xeon E5 v4/Xeon E3 v4/Xeon D Memory Controller 0 - Channel Target Address Decoder'
    class      = base peripheral
    cap 10[40] = PCI-Express 1 root endpoint max data 128(128)

none123@pci0:255:19:6:	class=0x088000 card=0x00000000 chip=0x6fae8086 rev=0x01 hdr=0x00
    vendor     = 'Intel Corporation'
    device     = 'Xeon E7 v4/Xeon E5 v4/Xeon E3 v4/Xeon D DDRIO Channel 0/1 Broadcast'
    class      = base peripheral

none124@pci0:255:19:7:	class=0x088000 card=0x00000000 chip=0x6faf8086 rev=0x01 hdr=0x00
    vendor     = 'Intel Corporation'
    device     = 'Xeon E7 v4/Xeon E5 v4/Xeon E3 v4/Xeon D DDRIO Global Broadcast'
    class      = base peripheral

none125@pci0:255:20:0:	class=0x088000 card=0x21ea103c chip=0x6fb08086 rev=0x01 hdr=0x00
    vendor     = 'Intel Corporation'
    device     = 'Xeon E7 v4/Xeon E5 v4/Xeon E3 v4/Xeon D Memory Controller 0 - Channel 0 Thermal Control'
    class      = base peripheral
    cap 10[40] = PCI-Express 1 root endpoint max data 128(128)

none126@pci0:255:20:1:	class=0x088000 card=0x21ea103c chip=0x6fb18086 rev=0x01 hdr=0x00
    vendor     = 'Intel Corporation'
    device     = 'Xeon E7 v4/Xeon E5 v4/Xeon E3 v4/Xeon D Memory Controller 0 - Channel 1 Thermal Control'
    class      = base peripheral
    cap 10[40] = PCI-Express 1 root endpoint max data 128(128)

none127@pci0:255:20:2:	class=0x088000 card=0x21ea103c chip=0x6fb28086 rev=0x01 hdr=0x00
    vendor     = 'Intel Corporation'
    device     = 'Xeon E7 v4/Xeon E5 v4/Xeon E3 v4/Xeon D Memory Controller 0 - Channel 0 Error'
    class      = base peripheral
    cap 10[40] = PCI-Express 1 root endpoint max data 128(128)

none128@pci0:255:20:3:	class=0x088000 card=0x21ea103c chip=0x6fb38086 rev=0x01 hdr=0x00
    vendor     = 'Intel Corporation'
    device     = 'Xeon E7 v4/Xeon E5 v4/Xeon E3 v4/Xeon D Memory Controller 0 - Channel 1 Error'
    class      = base peripheral
    cap 10[40] = PCI-Express 1 root endpoint max data 128(128)

none129@pci0:255:20:4:	class=0x088000 card=0x00000000 chip=0x6fbc8086 rev=0x01 hdr=0x00
    vendor     = 'Intel Corporation'
    device     = 'Xeon E7 v4/Xeon E5 v4/Xeon E3 v4/Xeon D DDRIO Channel 0/1 Interface'
    class      = base peripheral

none130@pci0:255:20:5:	class=0x088000 card=0x00000000 chip=0x6fbd8086 rev=0x01 hdr=0x00
    vendor     = 'Intel Corporation'
    device     = 'Xeon E7 v4/Xeon E5 v4/Xeon E3 v4/Xeon D DDRIO Channel 0/1 Interface'
    class      = base peripheral

none131@pci0:255:20:6:	class=0x088000 card=0x00000000 chip=0x6fbe8086 rev=0x01 hdr=0x00
    vendor     = 'Intel Corporation'
    device     = 'Xeon E7 v4/Xeon E5 v4/Xeon E3 v4/Xeon D DDRIO Channel 0/1 Interface'
    class      = base peripheral

none132@pci0:255:20:7:	class=0x088000 card=0x00000000 chip=0x6fbf8086 rev=0x01 hdr=0x00
    vendor     = 'Intel Corporation'
    device     = 'Xeon E7 v4/Xeon E5 v4/Xeon E3 v4/Xeon D DDRIO Channel 0/1 Interface'
    class      = base peripheral

none133@pci0:255:22:0:	class=0x088000 card=0x21ea103c chip=0x6f688086 rev=0x01 hdr=0x00
    vendor     = 'Intel Corporation'
    device     = 'Xeon E7 v4/Xeon E5 v4/Xeon E3 v4/Xeon D Target Address/Thermal/RAS'
    class      = base peripheral
    cap 10[40] = PCI-Express 1 root endpoint max data 128(128)

none134@pci0:255:22:1:	class=0x088000 card=0x21ea103c chip=0x6f798086 rev=0x01 hdr=0x00
    vendor     = 'Intel Corporation'
    device     = 'Xeon E7 v4/Xeon E5 v4/Xeon E3 v4/Xeon D Target Address/Thermal/RAS'
    class      = base peripheral
    cap 10[40] = PCI-Express 1 root endpoint max data 128(128)

none135@pci0:255:22:2:	class=0x088000 card=0x21ea103c chip=0x6f6a8086 rev=0x01 hdr=0x00
    vendor     = 'Intel Corporation'
    device     = 'Xeon E7 v4/Xeon E5 v4/Xeon E3 v4/Xeon D Channel Target Address Decoder'
    class      = base peripheral
    cap 10[40] = PCI-Express 1 root endpoint max data 128(128)

none136@pci0:255:22:3:	class=0x088000 card=0x21ea103c chip=0x6f6b8086 rev=0x01 hdr=0x00
    vendor     = 'Intel Corporation'
    device     = 'Xeon E7 v4/Xeon E5 v4/Xeon E3 v4/Xeon D Channel Target Address Decoder'
    class      = base peripheral
    cap 10[40] = PCI-Express 1 root endpoint max data 128(128)

none137@pci0:255:22:6:	class=0x088000 card=0x00000000 chip=0x6f6e8086 rev=0x01 hdr=0x00
    vendor     = 'Intel Corporation'
    device     = 'Xeon E7 v4/Xeon E5 v4/Xeon E3 v4/Xeon D DDRIO Channel 2/3 Broadcast'
    class      = base peripheral

none138@pci0:255:22:7:	class=0x088000 card=0x00000000 chip=0x6f6f8086 rev=0x01 hdr=0x00
    vendor     = 'Intel Corporation'
    device     = 'Xeon E7 v4/Xeon E5 v4/Xeon E3 v4/Xeon D DDRIO Global Broadcast'
    class      = base peripheral

none139@pci0:255:23:0:	class=0x088000 card=0x21ea103c chip=0x6fd08086 rev=0x01 hdr=0x00
    vendor     = 'Intel Corporation'
    device     = 'Xeon E7 v4/Xeon E5 v4/Xeon E3 v4/Xeon D Memory Controller 1 - Channel 0 Thermal Control'
    class      = base peripheral
    cap 10[40] = PCI-Express 1 root endpoint max data 128(128)

none140@pci0:255:23:1:	class=0x088000 card=0x21ea103c chip=0x6fd18086 rev=0x01 hdr=0x00
    vendor     = 'Intel Corporation'
    device     = 'Xeon E7 v4/Xeon E5 v4/Xeon E3 v4/Xeon D Memory Controller 1 - Channel 1 Thermal Control'
    class      = base peripheral
    cap 10[40] = PCI-Express 1 root endpoint max data 128(128)

none141@pci0:255:23:2:	class=0x088000 card=0x21ea103c chip=0x6fd28086 rev=0x01 hdr=0x00
    vendor     = 'Intel Corporation'
    device     = 'Xeon E7 v4/Xeon E5 v4/Xeon E3 v4/Xeon D Memory Controller 1 - Channel 0 Error'
    class      = base peripheral
    cap 10[40] = PCI-Express 1 root endpoint max data 128(128)

none142@pci0:255:23:3:	class=0x088000 card=0x21ea103c chip=0x6fd38086 rev=0x01 hdr=0x00
    vendor     = 'Intel Corporation'
    device     = 'Xeon E7 v4/Xeon E5 v4/Xeon E3 v4/Xeon D Memory Controller 1 - Channel 1 Error'
    class      = base peripheral
    cap 10[40] = PCI-Express 1 root endpoint max data 128(128)

none143@pci0:255:23:4:	class=0x088000 card=0x00000000 chip=0x6fb88086 rev=0x01 hdr=0x00
    vendor     = 'Intel Corporation'
    device     = 'Xeon E7 v4/Xeon E5 v4/Xeon E3 v4/Xeon D DDRIO Channel 2/3 Interface'
    class      = base peripheral

none144@pci0:255:23:5:	class=0x088000 card=0x00000000 chip=0x6fb98086 rev=0x01 hdr=0x00
    vendor     = 'Intel Corporation'
    device     = 'Xeon E7 v4/Xeon E5 v4/Xeon E3 v4/Xeon D DDRIO Channel 2/3 Interface'
    class      = base peripheral

none145@pci0:255:23:6:	class=0x088000 card=0x00000000 chip=0x6fba8086 rev=0x01 hdr=0x00
    vendor     = 'Intel Corporation'
    device     = 'Xeon E7 v4/Xeon E5 v4/Xeon E3 v4/Xeon D DDRIO Channel 2/3 Interface'
    class      = base peripheral

none146@pci0:255:23:7:	class=0x088000 card=0x00000000 chip=0x6fbb8086 rev=0x01 hdr=0x00
    vendor     = 'Intel Corporation'
    device     = 'Xeon E7 v4/Xeon E5 v4/Xeon E3 v4/Xeon D DDRIO Channel 2/3 Interface'
    class      = base peripheral

none147@pci0:255:30:0:	class=0x088000 card=0x21ea103c chip=0x6f988086 rev=0x01 hdr=0x00
    vendor     = 'Intel Corporation'
    device     = 'Xeon E7 v4/Xeon E5 v4/Xeon E3 v4/Xeon D Power Control Unit'
    class      = base peripheral

none148@pci0:255:30:1:	class=0x088000 card=0x21ea103c chip=0x6f998086 rev=0x01 hdr=0x00
    vendor     = 'Intel Corporation'
    device     = 'Xeon E7 v4/Xeon E5 v4/Xeon E3 v4/Xeon D Power Control Unit'
    class      = base peripheral

none149@pci0:255:30:2:	class=0x088000 card=0x21ea103c chip=0x6f9a8086 rev=0x01 hdr=0x00
    vendor     = 'Intel Corporation'
    device     = 'Xeon E7 v4/Xeon E5 v4/Xeon E3 v4/Xeon D Power Control Unit'
    class      = base peripheral

none150@pci0:255:30:3:	class=0x088000 card=0x21ea103c chip=0x6fc08086 rev=0x01 hdr=0x00
    vendor     = 'Intel Corporation'
    device     = 'Xeon E7 v4/Xeon E5 v4/Xeon E3 v4/Xeon D Power Control Unit'
    class      = base peripheral
    bar   [10] = type I/O Port, range 32, base 0x14, size 4, disabled

none151@pci0:255:30:4:	class=0x088000 card=0x21ea103c chip=0x6f9c8086 rev=0x01 hdr=0x00
    vendor     = 'Intel Corporation'
    device     = 'Xeon E7 v4/Xeon E5 v4/Xeon E3 v4/Xeon D Power Control Unit'
    class      = base peripheral

none152@pci0:255:31:0:	class=0x088000 card=0x00000000 chip=0x6f888086 rev=0x01 hdr=0x00
    vendor     = 'Intel Corporation'
    device     = 'Xeon E7 v4/Xeon E5 v4/Xeon E3 v4/Xeon D Power Control Unit'
    class      = base peripheral

none153@pci0:255:31:2:	class=0x088000 card=0x00000000 chip=0x6f8a8086 rev=0x01 hdr=0x00
    vendor     = 'Intel Corporation'
    device     = 'Xeon E7 v4/Xeon E5 v4/Xeon E3 v4/Xeon D Power Control Unit'
    class      = base peripheral

hostb0@pci0:0:0:0:	class=0x060000 card=0x21ea103c chip=0x6f008086 rev=0x01 hdr=0x00
    vendor     = 'Intel Corporation'
    device     = 'Xeon E7 v4/Xeon E5 v4/Xeon E3 v4/Xeon D DMI2'
    class      = bridge
    subclass   = HOST-PCI
    cap 10[90] = PCI-Express 2 root port max data 128(128)
                 link x0(x4) speed 0.0(5.0) ASPM disabled(L1)
    cap 01[e0] = powerspec 3  supports D0 D3  current D0
    ecap 000b[100] = Vendor 1 ID 2
    ecap 000b[144] = Vendor 1 ID 4
    ecap 000b[1d0] = Vendor 1 ID 3
    ecap 000b[280] = Vendor 1 ID 5
    ecap 000b[300] = Vendor 1 ID 8

pcib3@pci0:0:1:0:	class=0x060400 card=0x21ea103c chip=0x6f028086 rev=0x01 hdr=0x01
    vendor     = 'Intel Corporation'
    device     = 'Xeon E7 v4/Xeon E5 v4/Xeon E3 v4/Xeon D PCI Express Root Port 1'
    class      = bridge
    subclass   = PCI-PCI
    cap 0d[40] = PCI Bridge card=0x21ea103c
    cap 05[60] = MSI supports 2 messages, vector masks 
    cap 10[90] = PCI-Express 2 root port max data 128(256) ARI disabled
                 link x0(x8) speed 0.0(8.0) ASPM disabled(L1)
    cap 01[e0] = powerspec 3  supports D0 D3  current D0
    ecap 000b[100] = Vendor 1 ID 2
    ecap 000d[110] = ACS 1
    ecap 0001[148] = AER 1 0 fatal 0 non-fatal 0 corrected
    ecap 000b[1d0] = Vendor 1 ID 3
    ecap 0019[250] = PCIe Sec 1 lane errors 0
    ecap 000b[280] = Vendor 1 ID 5
    ecap 000b[300] = Vendor 1 ID 8

pcib4@pci0:0:1:1:	class=0x060400 card=0x21ea103c chip=0x6f038086 rev=0x01 hdr=0x01
    vendor     = 'Intel Corporation'
    device     = 'Xeon E7 v4/Xeon E5 v4/Xeon E3 v4/Xeon D PCI Express Root Port 1'
    class      = bridge
    subclass   = PCI-PCI
    cap 0d[40] = PCI Bridge card=0x21ea103c
    cap 05[60] = MSI supports 2 messages, vector masks 
    cap 10[90] = PCI-Express 2 root port max data 128(256) ARI disabled
                 link x0(x4) speed 0.0(8.0) ASPM disabled(L1)
    cap 01[e0] = powerspec 3  supports D0 D3  current D0
    ecap 000b[100] = Vendor 1 ID 2
    ecap 000d[110] = ACS 1
    ecap 0001[148] = AER 1 0 fatal 0 non-fatal 0 corrected
    ecap 000b[1d0] = Vendor 1 ID 3
    ecap 0019[250] = PCIe Sec 1 lane errors 0
    ecap 000b[280] = Vendor 1 ID 5
    ecap 000b[300] = Vendor 1 ID 8

pcib5@pci0:0:2:0:	class=0x060400 card=0x21ea103c chip=0x6f048086 rev=0x01 hdr=0x01
    vendor     = 'Intel Corporation'
    device     = 'Xeon E7 v4/Xeon E5 v4/Xeon E3 v4/Xeon D PCI Express Root Port 2'
    class      = bridge
    subclass   = PCI-PCI
    cap 0d[40] = PCI Bridge card=0x21ea103c
    cap 05[60] = MSI supports 2 messages, vector masks 
    cap 10[90] = PCI-Express 2 root port max data 256(256) ARI disabled
                 link x8(x8) speed 8.0(8.0) ASPM disabled(L1)
                 slot 1 power limit 0 mW
    cap 01[e0] = powerspec 3  supports D0 D3  current D0
    ecap 000b[100] = Vendor 1 ID 2
    ecap 000d[110] = ACS 1
    ecap 0001[148] = AER 1 0 fatal 0 non-fatal 0 corrected
    ecap 000b[1d0] = Vendor 1 ID 3
    ecap 0019[250] = PCIe Sec 1 lane errors 0
    ecap 000b[280] = Vendor 1 ID 5
    ecap 000b[300] = Vendor 1 ID 8

pcib6@pci0:0:2:1:	class=0x060400 card=0x21ea103c chip=0x6f058086 rev=0x01 hdr=0x01
    vendor     = 'Intel Corporation'
    device     = 'Xeon E7 v4/Xeon E5 v4/Xeon E3 v4/Xeon D PCI Express Root Port 2'
    class      = bridge
    subclass   = PCI-PCI
    cap 0d[40] = PCI Bridge card=0x21ea103c
    cap 05[60] = MSI supports 2 messages, vector masks 
    cap 10[90] = PCI-Express 2 root port max data 128(256) ARI disabled
                 link x0(x4) speed 0.0(8.0) ASPM disabled(L1)
    cap 01[e0] = powerspec 3  supports D0 D3  current D0
    ecap 000b[100] = Vendor 1 ID 2
    ecap 000d[110] = ACS 1
    ecap 0001[148] = AER 1 0 fatal 0 non-fatal 0 corrected
    ecap 000b[1d0] = Vendor 1 ID 3
    ecap 0019[250] = PCIe Sec 1 lane errors 0
    ecap 000b[280] = Vendor 1 ID 5
    ecap 000b[300] = Vendor 1 ID 8

pcib7@pci0:0:2:2:	class=0x060400 card=0x21ea103c chip=0x6f068086 rev=0x01 hdr=0x01
    vendor     = 'Intel Corporation'
    device     = 'Xeon E7 v4/Xeon E5 v4/Xeon E3 v4/Xeon D PCI Express Root Port 2'
    class      = bridge
    subclass   = PCI-PCI
    cap 0d[40] = PCI Bridge card=0x21ea103c
    cap 05[60] = MSI supports 2 messages, vector masks 
    cap 10[90] = PCI-Express 2 root port max data 128(256) ARI disabled
                 link x0(x8) speed 0.0(8.0) ASPM disabled(L1)
    cap 01[e0] = powerspec 3  supports D0 D3  current D0
    ecap 000b[100] = Vendor 1 ID 2
    ecap 000d[110] = ACS 1
    ecap 0001[148] = AER 1 0 fatal 0 non-fatal 0 corrected
    ecap 000b[1d0] = Vendor 1 ID 3
    ecap 0019[250] = PCIe Sec 1 lane errors 0
    ecap 000b[280] = Vendor 1 ID 5
    ecap 000b[300] = Vendor 1 ID 8

pcib8@pci0:0:2:3:	class=0x060400 card=0x21ea103c chip=0x6f078086 rev=0x01 hdr=0x01
    vendor     = 'Intel Corporation'
    device     = 'Xeon E7 v4/Xeon E5 v4/Xeon E3 v4/Xeon D PCI Express Root Port 2'
    class      = bridge
    subclass   = PCI-PCI
    cap 0d[40] = PCI Bridge card=0x21ea103c
    cap 05[60] = MSI supports 2 messages, vector masks 
    cap 10[90] = PCI-Express 2 root port max data 128(256) ARI disabled
                 link x0(x4) speed 0.0(8.0) ASPM disabled(L1)
    cap 01[e0] = powerspec 3  supports D0 D3  current D0
    ecap 000b[100] = Vendor 1 ID 2
    ecap 000d[110] = ACS 1
    ecap 0001[148] = AER 1 0 fatal 0 non-fatal 0 corrected
    ecap 000b[1d0] = Vendor 1 ID 3
    ecap 0019[250] = PCIe Sec 1 lane errors 0
    ecap 000b[280] = Vendor 1 ID 5
    ecap 000b[300] = Vendor 1 ID 8

pcib9@pci0:0:3:0:	class=0x060400 card=0x21ea103c chip=0x6f088086 rev=0x01 hdr=0x01
    vendor     = 'Intel Corporation'
    device     = 'Xeon E7 v4/Xeon E5 v4/Xeon E3 v4/Xeon D PCI Express Root Port 3'
    class      = bridge
    subclass   = PCI-PCI
    cap 0d[40] = PCI Bridge card=0x21ea103c
    cap 05[60] = MSI supports 2 messages, vector masks 
    cap 10[90] = PCI-Express 2 root port max data 128(256) ARI disabled
                 link x0(x8) speed 0.0(8.0) ASPM disabled(L1)
                 slot 3 power limit 0 mW
    cap 01[e0] = powerspec 3  supports D0 D3  current D0
    ecap 000b[100] = Vendor 1 ID 2
    ecap 000d[110] = ACS 1
    ecap 0001[148] = AER 1 0 fatal 0 non-fatal 0 corrected
    ecap 000b[1d0] = Vendor 1 ID 3
    ecap 0019[250] = PCIe Sec 1 lane errors 0
    ecap 000b[280] = Vendor 1 ID 5
    ecap 000b[300] = Vendor 1 ID 8

pcib10@pci0:0:3:1:	class=0x060400 card=0x21ea103c chip=0x6f098086 rev=0x01 hdr=0x01
    vendor     = 'Intel Corporation'
    device     = 'Xeon E7 v4/Xeon E5 v4/Xeon E3 v4/Xeon D PCI Express Root Port 3'
    class      = bridge
    subclass   = PCI-PCI
    cap 0d[40] = PCI Bridge card=0x21ea103c
    cap 05[60] = MSI supports 2 messages, vector masks 
    cap 10[90] = PCI-Express 2 root port max data 128(256) ARI disabled
                 link x0(x4) speed 0.0(8.0) ASPM disabled(L1)
    cap 01[e0] = powerspec 3  supports D0 D3  current D0
    ecap 000b[100] = Vendor 1 ID 2
    ecap 000d[110] = ACS 1
    ecap 0001[148] = AER 1 0 fatal 0 non-fatal 0 corrected
    ecap 000b[1d0] = Vendor 1 ID 3
    ecap 0019[250] = PCIe Sec 1 lane errors 0
    ecap 000b[280] = Vendor 1 ID 5
    ecap 000b[300] = Vendor 1 ID 8

pcib11@pci0:0:3:2:	class=0x060400 card=0x21ea103c chip=0x6f0a8086 rev=0x01 hdr=0x01
    vendor     = 'Intel Corporation'
    device     = 'Xeon E7 v4/Xeon E5 v4/Xeon E3 v4/Xeon D PCI Express Root Port 3'
    class      = bridge
    subclass   = PCI-PCI
    cap 0d[40] = PCI Bridge card=0x21ea103c
    cap 05[60] = MSI supports 2 messages, vector masks 
    cap 10[90] = PCI-Express 2 root port max data 256(256) ARI disabled
                 link x8(x8) speed 8.0(8.0) ASPM disabled(L1)
                 slot 2 power limit 0 mW
    cap 01[e0] = powerspec 3  supports D0 D3  current D0
    ecap 000b[100] = Vendor 1 ID 2
    ecap 000d[110] = ACS 1
    ecap 0001[148] = AER 1 0 fatal 0 non-fatal 0 corrected
    ecap 000b[1d0] = Vendor 1 ID 3
    ecap 0019[250] = PCIe Sec 1 lane errors 0
    ecap 000b[280] = Vendor 1 ID 5
    ecap 000b[300] = Vendor 1 ID 8

pcib12@pci0:0:3:3:	class=0x060400 card=0x21ea103c chip=0x6f0b8086 rev=0x01 hdr=0x01
    vendor     = 'Intel Corporation'
    device     = 'Xeon E7 v4/Xeon E5 v4/Xeon E3 v4/Xeon D PCI Express Root Port 3'
    class      = bridge
    subclass   = PCI-PCI
    cap 0d[40] = PCI Bridge card=0x21ea103c
    cap 05[60] = MSI supports 2 messages, vector masks 
    cap 10[90] = PCI-Express 2 root port max data 128(256) ARI disabled
                 link x0(x4) speed 0.0(8.0) ASPM disabled(L1)
    cap 01[e0] = powerspec 3  supports D0 D3  current D0
    ecap 000b[100] = Vendor 1 ID 2
    ecap 000d[110] = ACS 1
    ecap 0001[148] = AER 1 0 fatal 0 non-fatal 0 corrected
    ecap 000b[1d0] = Vendor 1 ID 3
    ecap 0019[250] = PCIe Sec 1 lane errors 0
    ecap 000b[280] = Vendor 1 ID 5
    ecap 000b[300] = Vendor 1 ID 8

ioat0@pci0:0:4:0:	class=0x088000 card=0x21ea103c chip=0x6f208086 rev=0x01 hdr=0x00
    vendor     = 'Intel Corporation'
    device     = 'Xeon E7 v4/Xeon E5 v4/Xeon E3 v4/Xeon D Crystal Beach DMA Channel 0'
    class      = base peripheral
    bar   [10] = type Memory, range 64, base 0x39ffff2c000, size 16384, enabled
    cap 11[80] = MSI-X supports 1 message, enabled
                 Table in map 0x10[0x2000], PBA in map 0x10[0x3000]
    cap 10[90] = PCI-Express 2 root endpoint max data 128(128) NS
    cap 01[e0] = powerspec 3  supports D0 D3  current D0

ioat1@pci0:0:4:1:	class=0x088000 card=0x21ea103c chip=0x6f218086 rev=0x01 hdr=0x00
    vendor     = 'Intel Corporation'
    device     = 'Xeon E7 v4/Xeon E5 v4/Xeon E3 v4/Xeon D Crystal Beach DMA Channel 1'
    class      = base peripheral
    bar   [10] = type Memory, range 64, base 0x39ffff28000, size 16384, enabled
    cap 11[80] = MSI-X supports 1 message, enabled
                 Table in map 0x10[0x2000], PBA in map 0x10[0x3000]
    cap 10[90] = PCI-Express 2 root endpoint max data 128(128) NS
    cap 01[e0] = powerspec 3  supports D0 D3  current D0

ioat2@pci0:0:4:2:	class=0x088000 card=0x21ea103c chip=0x6f228086 rev=0x01 hdr=0x00
    vendor     = 'Intel Corporation'
    device     = 'Xeon E7 v4/Xeon E5 v4/Xeon E3 v4/Xeon D Crystal Beach DMA Channel 2'
    class      = base peripheral
    bar   [10] = type Memory, range 64, base 0x39ffff24000, size 16384, enabled
    cap 11[80] = MSI-X supports 1 message, enabled
                 Table in map 0x10[0x2000], PBA in map 0x10[0x3000]
    cap 10[90] = PCI-Express 2 root endpoint max data 128(128) NS
    cap 01[e0] = powerspec 3  supports D0 D3  current D0

ioat3@pci0:0:4:3:	class=0x088000 card=0x21ea103c chip=0x6f238086 rev=0x01 hdr=0x00
    vendor     = 'Intel Corporation'
    device     = 'Xeon E7 v4/Xeon E5 v4/Xeon E3 v4/Xeon D Crystal Beach DMA Channel 3'
    class      = base peripheral
    bar   [10] = type Memory, range 64, base 0x39ffff20000, size 16384, enabled
    cap 11[80] = MSI-X supports 1 message, enabled
                 Table in map 0x10[0x2000], PBA in map 0x10[0x3000]
    cap 10[90] = PCI-Express 2 root endpoint max data 128(128) NS
    cap 01[e0] = powerspec 3  supports D0 D3  current D0

ioat4@pci0:0:4:4:	class=0x088000 card=0x21ea103c chip=0x6f248086 rev=0x01 hdr=0x00
    vendor     = 'Intel Corporation'
    device     = 'Xeon E7 v4/Xeon E5 v4/Xeon E3 v4/Xeon D Crystal Beach DMA Channel 4'
    class      = base peripheral
    bar   [10] = type Memory, range 64, base 0x39ffff1c000, size 16384, enabled
    cap 11[80] = MSI-X supports 1 message, enabled
                 Table in map 0x10[0x2000], PBA in map 0x10[0x3000]
    cap 10[90] = PCI-Express 2 root endpoint max data 128(128) NS
    cap 01[e0] = powerspec 3  supports D0 D3  current D0

ioat5@pci0:0:4:5:	class=0x088000 card=0x21ea103c chip=0x6f258086 rev=0x01 hdr=0x00
    vendor     = 'Intel Corporation'
    device     = 'Xeon E7 v4/Xeon E5 v4/Xeon E3 v4/Xeon D Crystal Beach DMA Channel 5'
    class      = base peripheral
    bar   [10] = type Memory, range 64, base 0x39ffff18000, size 16384, enabled
    cap 11[80] = MSI-X supports 1 message, enabled
                 Table in map 0x10[0x2000], PBA in map 0x10[0x3000]
    cap 10[90] = PCI-Express 2 root endpoint max data 128(128) NS
    cap 01[e0] = powerspec 3  supports D0 D3  current D0

ioat6@pci0:0:4:6:	class=0x088000 card=0x21ea103c chip=0x6f268086 rev=0x01 hdr=0x00
    vendor     = 'Intel Corporation'
    device     = 'Xeon E7 v4/Xeon E5 v4/Xeon E3 v4/Xeon D Crystal Beach DMA Channel 6'
    class      = base peripheral
    bar   [10] = type Memory, range 64, base 0x39ffff14000, size 16384, enabled
    cap 11[80] = MSI-X supports 1 message, enabled
                 Table in map 0x10[0x2000], PBA in map 0x10[0x3000]
    cap 10[90] = PCI-Express 2 root endpoint max data 128(128) NS
    cap 01[e0] = powerspec 3  supports D0 D3  current D0

ioat7@pci0:0:4:7:	class=0x088000 card=0x21ea103c chip=0x6f278086 rev=0x01 hdr=0x00
    vendor     = 'Intel Corporation'
    device     = 'Xeon E7 v4/Xeon E5 v4/Xeon E3 v4/Xeon D Crystal Beach DMA Channel 7'
    class      = base peripheral
    bar   [10] = type Memory, range 64, base 0x39ffff10000, size 16384, enabled
    cap 11[80] = MSI-X supports 1 message, enabled
                 Table in map 0x10[0x2000], PBA in map 0x10[0x3000]
    cap 10[90] = PCI-Express 2 root endpoint max data 128(128) NS
    cap 01[e0] = powerspec 3  supports D0 D3  current D0

none154@pci0:0:5:0:	class=0x088000 card=0x21ea103c chip=0x6f288086 rev=0x01 hdr=0x00
    vendor     = 'Intel Corporation'
    device     = 'Xeon E7 v4/Xeon E5 v4/Xeon E3 v4/Xeon D Map/VTd_Misc/System Management'
    class      = base peripheral
    cap 10[40] = PCI-Express 2 root endpoint max data 128(128)

none155@pci0:0:5:1:	class=0x088000 card=0x21ea103c chip=0x6f298086 rev=0x01 hdr=0x00
    vendor     = 'Intel Corporation'
    device     = 'Xeon E7 v4/Xeon E5 v4/Xeon E3 v4/Xeon D IIO Hot Plug'
    class      = base peripheral
    cap 10[40] = PCI-Express 1 root endpoint max data 128(128)
    cap 05[80] = MSI supports 1 message, 64 bit 
    ecap 000b[100] = Vendor 1 ID 6
    ecap 000b[110] = Vendor 1 ID 6
    ecap 000b[120] = Vendor 1 ID 6
    ecap 000b[130] = Vendor 1 ID 6

none156@pci0:0:5:2:	class=0x088000 card=0x21ea103c chip=0x6f2a8086 rev=0x01 hdr=0x00
    vendor     = 'Intel Corporation'
    device     = 'Xeon E7 v4/Xeon E5 v4/Xeon E3 v4/Xeon D IIO RAS/Control Status/Global Errors'
    class      = base peripheral
    cap 10[40] = PCI-Express 2 root endpoint max data 128(128)

ioapic0@pci0:0:5:4:	class=0x080020 card=0x21ea103c chip=0x6f2c8086 rev=0x01 hdr=0x00
    vendor     = 'Intel Corporation'
    device     = 'Xeon E7 v4/Xeon E5 v4/Xeon E3 v4/Xeon D I/O APIC'
    class      = base peripheral
    subclass   = interrupt controller
    bar   [10] = type Memory, range 32, base 0x93003000, size 4096, enabled
    cap 10[44] = PCI-Express 1 root endpoint max data 128(128)
    cap 01[e0] = powerspec 3  supports D0 D3  current D0

none157@pci0:0:17:0:	class=0xff0000 card=0x8030103c chip=0x8d7c8086 rev=0x05 hdr=0x00
    vendor     = 'Intel Corporation'
    device     = 'C610/X99 series chipset SPSR'
    cap 10[40] = PCI-Express 2 root endpoint max data 128(128)
                 link x1(x1) speed 2.5(2.5) ASPM disabled(L0s/L1)
    cap 01[80] = powerspec 3  supports D0 D3  current D0

xhci0@pci0:0:20:0:	class=0x0c0330 card=0x8030103c chip=0x8d318086 rev=0x05 hdr=0x00
    vendor     = 'Intel Corporation'
    device     = 'C610/X99 series chipset USB xHCI Host Controller'
    class      = serial bus
    subclass   = USB
    bar   [10] = type Memory, range 64, base 0x39ffff00000, size 65536, enabled
    cap 01[70] = powerspec 2  supports D0 D3  current D0
    cap 05[80] = MSI supports 8 messages, 64 bit enabled with 1 message

ehci0@pci0:0:26:0:	class=0x0c0320 card=0x8030103c chip=0x8d2d8086 rev=0x05 hdr=0x00
    vendor     = 'Intel Corporation'
    device     = 'C610/X99 series chipset USB Enhanced Host Controller'
    class      = serial bus
    subclass   = USB
    bar   [10] = type Memory, range 32, base 0x93001000, size 1024, enabled
    cap 01[50] = powerspec 2  supports D0 D3  current D0
    cap 0a[58] = EHCI Debug Port at offset 0xa0 in map 0x14
    cap 13[98] = PCI Advanced Features: FLR TP

pcib13@pci0:0:28:0:	class=0x060401 card=0x8030103c chip=0x8d108086 rev=0xd5 hdr=0x01
    vendor     = 'Intel Corporation'
    device     = 'C610/X99 series chipset PCI Express Root Port'
    class      = bridge
    subclass   = PCI-PCI
    cap 10[40] = PCI-Express 2 root port max data 128(128)
                 link x0(x2) speed 0.0(5.0) ASPM disabled(L0s/L1)
    cap 05[80] = MSI supports 1 message 
    cap 0d[90] = PCI Bridge card=0x8030103c
    cap 01[a0] = powerspec 3  supports D0 D3  current D0

pcib14@pci0:0:28:2:	class=0x060400 card=0x8030103c chip=0x8d148086 rev=0xd5 hdr=0x01
    vendor     = 'Intel Corporation'
    device     = 'C610/X99 series chipset PCI Express Root Port'
    class      = bridge
    subclass   = PCI-PCI
    cap 10[40] = PCI-Express 2 root port max data 128(128)
                 link x1(x2) speed 2.5(5.0) ASPM L1(L0s/L1)
    cap 05[80] = MSI supports 1 message enabled with 1 message
    cap 0d[90] = PCI Bridge card=0x8030103c
    cap 01[a0] = powerspec 3  supports D0 D3  current D0
    ecap 0001[100] = AER 1 0 fatal 0 non-fatal 0 corrected

pcib15@pci0:0:28:4:	class=0x060400 card=0x8030103c chip=0x8d188086 rev=0xd5 hdr=0x01
    vendor     = 'Intel Corporation'
    device     = 'C610/X99 series chipset PCI Express Root Port'
    class      = bridge
    subclass   = PCI-PCI
    cap 10[40] = PCI-Express 2 root port max data 128(128)
                 link x2(x2) speed 5.0(5.0) ASPM L1(L0s/L1)
    cap 05[80] = MSI supports 1 message enabled with 1 message
    cap 0d[90] = PCI Bridge card=0x8030103c
    cap 01[a0] = powerspec 3  supports D0 D3  current D0
    ecap 0001[100] = AER 1 0 fatal 0 non-fatal 0 corrected

pcib16@pci0:0:28:6:	class=0x060400 card=0x8030103c chip=0x8d1c8086 rev=0xd5 hdr=0x01
    vendor     = 'Intel Corporation'
    device     = 'C610/X99 series chipset PCI Express Root Port'
    class      = bridge
    subclass   = PCI-PCI
    cap 10[40] = PCI-Express 2 root port max data 128(128)
                 link x0(x1) speed 0.0(5.0) ASPM L1(L0s/L1)
    cap 05[80] = MSI supports 1 message enabled with 1 message
    cap 0d[90] = PCI Bridge card=0x8030103c
    cap 01[a0] = powerspec 3  supports D0 D3  current D0
    ecap 0001[100] = AER 1 0 fatal 0 non-fatal 0 corrected

pcib17@pci0:0:28:7:	class=0x060400 card=0x8030103c chip=0x8d1e8086 rev=0xd5 hdr=0x01
    vendor     = 'Intel Corporation'
    device     = 'C610/X99 series chipset PCI Express Root Port'
    class      = bridge
    subclass   = PCI-PCI
    cap 10[40] = PCI-Express 2 root port max data 128(128)
                 link x0(x1) speed 0.0(5.0) ASPM L1(L0s/L1)
    cap 05[80] = MSI supports 1 message enabled with 1 message
    cap 0d[90] = PCI Bridge card=0x8030103c
    cap 01[a0] = powerspec 3  supports D0 D3  current D0
    ecap 0001[100] = AER 1 0 fatal 0 non-fatal 0 corrected

ehci1@pci0:0:29:0:	class=0x0c0320 card=0x8030103c chip=0x8d268086 rev=0x05 hdr=0x00
    vendor     = 'Intel Corporation'
    device     = 'C610/X99 series chipset USB Enhanced Host Controller'
    class      = serial bus
    subclass   = USB
    bar   [10] = type Memory, range 32, base 0x93000000, size 1024, enabled
    cap 01[50] = powerspec 2  supports D0 D3  current D0
    cap 0a[58] = EHCI Debug Port at offset 0xa0 in map 0x14
    cap 13[98] = PCI Advanced Features: FLR TP

isab0@pci0:0:31:0:	class=0x060100 card=0x8030103c chip=0x8d448086 rev=0x05 hdr=0x00
    vendor     = 'Intel Corporation'
    device     = 'C610/X99 series chipset LPC Controller'
    class      = bridge
    subclass   = PCI-ISA
    cap 09[e0] = vendor (length 12) Intel cap 1 version 0
		 features: AMT, 4 PCI-e x1 slots

none158@pci0:0:31:3:	class=0x0c0500 card=0x8030103c chip=0x8d228086 rev=0x05 hdr=0x00
    vendor     = 'Intel Corporation'
    device     = 'C610/X99 series chipset SMBus Controller'
    class      = serial bus
    subclass   = SMBus
    bar   [10] = type Memory, range 64, base 0x39ffff31000, size 256, enabled
    bar   [20] = type I/O Port, range 32, base 0x4000, size 32, enabled

ciss0@pci0:5:0:0:	class=0x010400 card=0x21cb103c chip=0x3239103c rev=0x01 hdr=0x00
    vendor     = 'Hewlett-Packard Company'
    device     = 'Smart Array Gen9 Controllers'
    class      = mass storage
    subclass   = RAID
    bar   [10] = type Memory, range 64, base 0x92e00000, size 1048576, enabled
    bar   [18] = type Memory, range 64, base 0x92f00000, size 1024, enabled
    bar   [20] = type I/O Port, range 32, base 0x3000, size 256, enabled
    cap 01[80] = powerspec 3  supports D0 D3  current D0
    cap 05[90] = MSI supports 32 messages, 64 bit 
    cap 11[b0] = MSI-X supports 64 messages, enabled
                 Table in map 0x10[0x2000], PBA in map 0x10[0x3000]
    cap 10[c0] = PCI-Express 2 endpoint max data 256(512) RO NS
                 link x8(x8) speed 8.0(8.0)
    ecap 0001[100] = AER 2 0 fatal 0 non-fatal 1 corrected
    ecap 0019[300] = PCIe Sec 1 lane errors 0

ciss1@pci0:11:0:0:	class=0x010400 card=0x21c5103c chip=0x3239103c rev=0x01 hdr=0x00
    vendor     = 'Hewlett-Packard Company'
    device     = 'Smart Array Gen9 Controllers'
    class      = mass storage
    subclass   = RAID
    bar   [10] = type Memory, range 64, base 0x92c00000, size 1048576, enabled
    bar   [18] = type Memory, range 64, base 0x92d00000, size 1024, enabled
    bar   [20] = type I/O Port, range 32, base 0x2000, size 256, enabled
    cap 01[80] = powerspec 3  supports D0 D3  current D0
    cap 05[90] = MSI supports 32 messages, 64 bit 
    cap 11[b0] = MSI-X supports 64 messages, enabled
                 Table in map 0x10[0x2000], PBA in map 0x10[0x3000]
    cap 10[c0] = PCI-Express 2 endpoint max data 256(512) RO NS
                 link x8(x8) speed 8.0(8.0)
    ecap 0001[100] = AER 2 0 fatal 0 non-fatal 1 corrected
    ecap 0019[300] = PCIe Sec 1 lane errors 0

none159@pci0:1:0:0:	class=0x088000 card=0x3381103c chip=0x3306103c rev=0x06 hdr=0x00
    vendor     = 'Hewlett-Packard Company'
    device     = 'Integrated Lights-Out Standard Slave Instrumentation & System Support'
    class      = base peripheral
    bar   [10] = type I/O Port, range 32, base 0x1200, size 256, enabled
    bar   [14] = type Memory, range 32, base 0x92a8d000, size 512, enabled
    bar   [18] = type I/O Port, range 32, base 0x1100, size 256, enabled
    cap 01[78] = powerspec 3  supports D0 D3  current D0
    cap 05[b0] = MSI supports 1 message, 64 bit 
    cap 10[c0] = PCI-Express 2 legacy endpoint max data 128(128)
                 link x1(x1) speed 2.5(2.5) ASPM disabled(L0s)
    ecap 0001[100] = AER 2 0 fatal 0 non-fatal 1 corrected

vgapci0@pci0:1:0:1:	class=0x030000 card=0x3381103c chip=0x0533102b rev=0x01 hdr=0x00
    vendor     = 'Matrox Electronics Systems Ltd.'
    device     = 'MGA G200EH'
    class      = display
    subclass   = VGA
    bar   [10] = type Prefetchable Memory, range 32, base 0x91000000, size 16777216, enabled
    bar   [14] = type Memory, range 32, base 0x92a88000, size 16384, enabled
    bar   [18] = type Memory, range 32, base 0x92000000, size 8388608, enabled
    cap 01[a8] = powerspec 3  supports D0 D3  current D0
    cap 05[b0] = MSI supports 1 message, 64 bit 
    cap 10[c0] = PCI-Express 2 legacy endpoint max data 128(128)
                 link x1(x1) speed 2.5(2.5) ASPM disabled(L0s)
    ecap 0001[100] = AER 2 0 fatal 0 non-fatal 1 corrected

none160@pci0:1:0:2:	class=0x088000 card=0x3381103c chip=0x3307103c rev=0x06 hdr=0x00
    vendor     = 'Hewlett-Packard Company'
    device     = 'Integrated Lights-Out Standard Management Processor Support and Messaging'
    class      = base peripheral
    bar   [10] = type I/O Port, range 32, base 0x1000, size 256, enabled
    bar   [14] = type Memory, range 32, base 0x92a8c000, size 256, enabled
    bar   [18] = type Memory, range 32, base 0x92900000, size 1048576, enabled
    bar   [1c] = type Memory, range 32, base 0x92a00000, size 524288, enabled
    bar   [20] = type Memory, range 32, base 0x92a80000, size 32768, enabled
    bar   [24] = type Memory, range 32, base 0x92800000, size 1048576, enabled
    cap 01[78] = powerspec 3  supports D0 D3  current D0
    cap 05[b0] = MSI supports 1 message, 64 bit 
    cap 10[c0] = PCI-Express 2 legacy endpoint max data 128(128)
                 link x1(x1) speed 2.5(2.5) ASPM disabled(L0s)
    ecap 0001[100] = AER 2 0 fatal 0 non-fatal 1 corrected

uhci0@pci0:1:0:4:	class=0x0c0300 card=0x3381103c chip=0x3300103c rev=0x03 hdr=0x00
    vendor     = 'Hewlett-Packard Company'
    device     = 'Integrated Lights-Out Standard Virtual USB Controller'
    class      = serial bus
    subclass   = USB
    bar   [20] = type I/O Port, range 32, base 0x1300, size 32, enabled
    cap 05[70] = MSI supports 1 message, 64 bit 
    cap 10[80] = PCI-Express 2 legacy endpoint max data 128(128)
                 link x1(x1) speed 2.5(2.5) ASPM disabled(L0s)
    cap 01[f0] = powerspec 3  supports D0 D3  current D0
    ecap 0001[100] = AER 2 0 fatal 0 non-fatal 1 corrected

bge0@pci0:2:0:0:	class=0x020000 card=0x22be103c chip=0x165714e4 rev=0x01 hdr=0x00
    vendor     = 'Broadcom Inc. and subsidiaries'
    device     = 'NetXtreme BCM5719 Gigabit Ethernet PCIe'
    class      = network
    subclass   = ethernet
    bar   [10] = type Prefetchable Memory, range 64, base 0x92b90000, size 65536, enabled
    bar   [18] = type Prefetchable Memory, range 64, base 0x92ba0000, size 65536, enabled
    bar   [20] = type Prefetchable Memory, range 64, base 0x92bb0000, size 65536, enabled
    cap 01[48] = powerspec 3  supports D0 D3  current D0
    cap 03[50] = VPD
    cap 05[58] = MSI supports 8 messages, 64 bit enabled with 1 message
    cap 11[a0] = MSI-X supports 17 messages
                 Table in map 0x20[0x0], PBA in map 0x20[0x1000]
    cap 10[ac] = PCI-Express 2 endpoint max data 128(256) FLR
                 link x2(x4) speed 5.0(5.0)
    ecap 0001[100] = AER 1 0 fatal 0 non-fatal 1 corrected
    ecap 0003[13c] = Serial 1 0000f4034344ae0c
    ecap 0004[150] = Power Budgeting 1
    ecap 0002[160] = VC 1 max VC0

bge1@pci0:2:0:1:	class=0x020000 card=0x22be103c chip=0x165714e4 rev=0x01 hdr=0x00
    vendor     = 'Broadcom Inc. and subsidiaries'
    device     = 'NetXtreme BCM5719 Gigabit Ethernet PCIe'
    class      = network
    subclass   = ethernet
    bar   [10] = type Prefetchable Memory, range 64, base 0x92b60000, size 65536, enabled
    bar   [18] = type Prefetchable Memory, range 64, base 0x92b70000, size 65536, enabled
    bar   [20] = type Prefetchable Memory, range 64, base 0x92b80000, size 65536, enabled
    cap 01[48] = powerspec 3  supports D0 D3  current D0
    cap 03[50] = VPD
    cap 05[58] = MSI supports 8 messages, 64 bit enabled with 1 message
    cap 11[a0] = MSI-X supports 17 messages
                 Table in map 0x20[0x0], PBA in map 0x20[0x1000]
    cap 10[ac] = PCI-Express 2 endpoint max data 128(256) FLR
                 link x2(x4) speed 5.0(5.0)
    ecap 0001[100] = AER 1 0 fatal 0 non-fatal 1 corrected
    ecap 0003[13c] = Serial 1 0000f4034344ae0d
    ecap 0004[150] = Power Budgeting 1
    ecap 0002[160] = VC 1 max VC0

bge2@pci0:2:0:2:	class=0x020000 card=0x22be103c chip=0x165714e4 rev=0x01 hdr=0x00
    vendor     = 'Broadcom Inc. and subsidiaries'
    device     = 'NetXtreme BCM5719 Gigabit Ethernet PCIe'
    class      = network
    subclass   = ethernet
    bar   [10] = type Prefetchable Memory, range 64, base 0x92b30000, size 65536, enabled
    bar   [18] = type Prefetchable Memory, range 64, base 0x92b40000, size 65536, enabled
    bar   [20] = type Prefetchable Memory, range 64, base 0x92b50000, size 65536, enabled
    cap 01[48] = powerspec 3  supports D0 D3  current D0
    cap 03[50] = VPD
    cap 05[58] = MSI supports 8 messages, 64 bit enabled with 1 message
    cap 11[a0] = MSI-X supports 17 messages
                 Table in map 0x20[0x0], PBA in map 0x20[0x1000]
    cap 10[ac] = PCI-Express 2 endpoint max data 128(256) FLR
                 link x2(x4) speed 5.0(5.0)
    ecap 0001[100] = AER 1 0 fatal 0 non-fatal 1 corrected
    ecap 0003[13c] = Serial 1 0000f4034344ae0e
    ecap 0004[150] = Power Budgeting 1
    ecap 0002[160] = VC 1 max VC0

bge3@pci0:2:0:3:	class=0x020000 card=0x22be103c chip=0x165714e4 rev=0x01 hdr=0x00
    vendor     = 'Broadcom Inc. and subsidiaries'
    device     = 'NetXtreme BCM5719 Gigabit Ethernet PCIe'
    class      = network
    subclass   = ethernet
    bar   [10] = type Prefetchable Memory, range 64, base 0x92b00000, size 65536, enabled
    bar   [18] = type Prefetchable Memory, range 64, base 0x92b10000, size 65536, enabled
    bar   [20] = type Prefetchable Memory, range 64, base 0x92b20000, size 65536, enabled
    cap 01[48] = powerspec 3  supports D0 D3  current D0
    cap 03[50] = VPD
    cap 05[58] = MSI supports 8 messages, 64 bit enabled with 1 message
    cap 11[a0] = MSI-X supports 17 messages
                 Table in map 0x20[0x0], PBA in map 0x20[0x1000]
    cap 10[ac] = PCI-Express 2 endpoint max data 128(256) FLR
                 link x2(x4) speed 5.0(5.0)
    ecap 0001[100] = AER 1 0 fatal 0 non-fatal 1 corrected
    ecap 0003[13c] = Serial 1 0000f4034344ae0f
    ecap 0004[150] = Power Budgeting 1
    ecap 0002[160] = VC 1 max VC0

pcib19@pci0:128:0:0:	class=0x060400 card=0x21ea103c chip=0x6f018086 rev=0x01 hdr=0x01
    vendor     = 'Intel Corporation'
    device     = 'Xeon E7 v4/Xeon E5 v4/Xeon E3 v4/Xeon D PCI Express Root Port 0'
    class      = bridge
    subclass   = PCI-PCI
    cap 0d[40] = PCI Bridge card=0x21ea103c
    cap 05[60] = MSI supports 2 messages, vector masks 
    cap 10[90] = PCI-Express 2 root port max data 128(128) ARI disabled
                 link x0(x4) speed 0.0(8.0) ASPM disabled(L1)
    cap 01[e0] = powerspec 3  supports D0 D3  current D0
    ecap 000b[100] = Vendor 1 ID 2
    ecap 000d[110] = ACS 1
    ecap 0001[148] = AER 1 0 fatal 0 non-fatal 0 corrected
    ecap 000b[1d0] = Vendor 1 ID 3
    ecap 000b[280] = Vendor 1 ID 5
    ecap 000b[300] = Vendor 1 ID 8

pcib20@pci0:128:1:0:	class=0x060400 card=0x21ea103c chip=0x6f028086 rev=0x01 hdr=0x01
    vendor     = 'Intel Corporation'
    device     = 'Xeon E7 v4/Xeon E5 v4/Xeon E3 v4/Xeon D PCI Express Root Port 1'
    class      = bridge
    subclass   = PCI-PCI
    cap 0d[40] = PCI Bridge card=0x21ea103c
    cap 05[60] = MSI supports 2 messages, vector masks 
    cap 10[90] = PCI-Express 2 root port max data 128(256) ARI disabled
                 link x0(x8) speed 0.0(8.0) ASPM disabled(L1)
                 slot 6 power limit 0 mW
    cap 01[e0] = powerspec 3  supports D0 D3  current D0
    ecap 000b[100] = Vendor 1 ID 2
    ecap 000d[110] = ACS 1
    ecap 0001[148] = AER 1 0 fatal 0 non-fatal 0 corrected
    ecap 000b[1d0] = Vendor 1 ID 3
    ecap 0019[250] = PCIe Sec 1 lane errors 0
    ecap 000b[280] = Vendor 1 ID 5
    ecap 000b[300] = Vendor 1 ID 8

pcib21@pci0:128:1:1:	class=0x060400 card=0x21ea103c chip=0x6f038086 rev=0x01 hdr=0x01
    vendor     = 'Intel Corporation'
    device     = 'Xeon E7 v4/Xeon E5 v4/Xeon E3 v4/Xeon D PCI Express Root Port 1'
    class      = bridge
    subclass   = PCI-PCI
    cap 0d[40] = PCI Bridge card=0x21ea103c
    cap 05[60] = MSI supports 2 messages, vector masks 
    cap 10[90] = PCI-Express 2 root port max data 128(256) ARI disabled
                 link x0(x4) speed 0.0(8.0) ASPM disabled(L1)
    cap 01[e0] = powerspec 3  supports D0 D3  current D0
    ecap 000b[100] = Vendor 1 ID 2
    ecap 000d[110] = ACS 1
    ecap 0001[148] = AER 1 0 fatal 0 non-fatal 0 corrected
    ecap 000b[1d0] = Vendor 1 ID 3
    ecap 0019[250] = PCIe Sec 1 lane errors 0
    ecap 000b[280] = Vendor 1 ID 5
    ecap 000b[300] = Vendor 1 ID 8

pcib22@pci0:128:2:0:	class=0x060400 card=0x21ea103c chip=0x6f048086 rev=0x01 hdr=0x01
    vendor     = 'Intel Corporation'
    device     = 'Xeon E7 v4/Xeon E5 v4/Xeon E3 v4/Xeon D PCI Express Root Port 2'
    class      = bridge
    subclass   = PCI-PCI
    cap 0d[40] = PCI Bridge card=0x21ea103c
    cap 05[60] = MSI supports 2 messages, vector masks 
    cap 10[90] = PCI-Express 2 root port max data 128(256) ARI disabled
                 link x0(x16) speed 0.0(8.0) ASPM disabled(L1)
                 slot 5 power limit 0 mW
    cap 01[e0] = powerspec 3  supports D0 D3  current D0
    ecap 000b[100] = Vendor 1 ID 2
    ecap 000d[110] = ACS 1
    ecap 0001[148] = AER 1 0 fatal 0 non-fatal 0 corrected
    ecap 000b[1d0] = Vendor 1 ID 3
    ecap 0019[250] = PCIe Sec 1 lane errors 0
    ecap 000b[280] = Vendor 1 ID 5
    ecap 000b[300] = Vendor 1 ID 8

pcib23@pci0:128:2:1:	class=0x060400 card=0x21ea103c chip=0x6f058086 rev=0x01 hdr=0x01
    vendor     = 'Intel Corporation'
    device     = 'Xeon E7 v4/Xeon E5 v4/Xeon E3 v4/Xeon D PCI Express Root Port 2'
    class      = bridge
    subclass   = PCI-PCI
    cap 0d[40] = PCI Bridge card=0x21ea103c
    cap 05[60] = MSI supports 2 messages, vector masks 
    cap 10[90] = PCI-Express 2 root port max data 128(256) ARI disabled
                 link x0(x4) speed 0.0(8.0) ASPM disabled(L1)
    cap 01[e0] = powerspec 3  supports D0 D3  current D0
    ecap 000b[100] = Vendor 1 ID 2
    ecap 000d[110] = ACS 1
    ecap 0001[148] = AER 1 0 fatal 0 non-fatal 0 corrected
    ecap 000b[1d0] = Vendor 1 ID 3
    ecap 0019[250] = PCIe Sec 1 lane errors 0
    ecap 000b[280] = Vendor 1 ID 5
    ecap 000b[300] = Vendor 1 ID 8

pcib24@pci0:128:2:2:	class=0x060400 card=0x21ea103c chip=0x6f068086 rev=0x01 hdr=0x01
    vendor     = 'Intel Corporation'
    device     = 'Xeon E7 v4/Xeon E5 v4/Xeon E3 v4/Xeon D PCI Express Root Port 2'
    class      = bridge
    subclass   = PCI-PCI
    cap 0d[40] = PCI Bridge card=0x21ea103c
    cap 05[60] = MSI supports 2 messages, vector masks 
    cap 10[90] = PCI-Express 2 root port max data 128(256) ARI disabled
                 link x0(x4) speed 0.0(8.0) ASPM disabled(L1)
    cap 01[e0] = powerspec 3  supports D0 D3  current D0
    ecap 000b[100] = Vendor 1 ID 2
    ecap 000d[110] = ACS 1
    ecap 0001[148] = AER 1 0 fatal 0 non-fatal 0 corrected
    ecap 000b[1d0] = Vendor 1 ID 3
    ecap 0019[250] = PCIe Sec 1 lane errors 0
    ecap 000b[280] = Vendor 1 ID 5
    ecap 000b[300] = Vendor 1 ID 8

pcib25@pci0:128:2:3:	class=0x060400 card=0x21ea103c chip=0x6f078086 rev=0x01 hdr=0x01
    vendor     = 'Intel Corporation'
    device     = 'Xeon E7 v4/Xeon E5 v4/Xeon E3 v4/Xeon D PCI Express Root Port 2'
    class      = bridge
    subclass   = PCI-PCI
    cap 0d[40] = PCI Bridge card=0x21ea103c
    cap 05[60] = MSI supports 2 messages, vector masks 
    cap 10[90] = PCI-Express 2 root port max data 128(256) ARI disabled
                 link x0(x4) speed 0.0(8.0) ASPM disabled(L1)
    cap 01[e0] = powerspec 3  supports D0 D3  current D0
    ecap 000b[100] = Vendor 1 ID 2
    ecap 000d[110] = ACS 1
    ecap 0001[148] = AER 1 0 fatal 0 non-fatal 0 corrected
    ecap 000b[1d0] = Vendor 1 ID 3
    ecap 0019[250] = PCIe Sec 1 lane errors 0
    ecap 000b[280] = Vendor 1 ID 5
    ecap 000b[300] = Vendor 1 ID 8

pcib26@pci0:128:3:0:	class=0x060400 card=0x21ea103c chip=0x6f088086 rev=0x01 hdr=0x01
    vendor     = 'Intel Corporation'
    device     = 'Xeon E7 v4/Xeon E5 v4/Xeon E3 v4/Xeon D PCI Express Root Port 3'
    class      = bridge
    subclass   = PCI-PCI
    cap 0d[40] = PCI Bridge card=0x21ea103c
    cap 05[60] = MSI supports 2 messages, vector masks 
    cap 10[90] = PCI-Express 2 root port max data 256(256) ARI disabled
                 link x4(x16) speed 5.0(8.0) ASPM disabled(L1)
                 slot 4 power limit 0 mW
    cap 01[e0] = powerspec 3  supports D0 D3  current D0
    ecap 000b[100] = Vendor 1 ID 2
    ecap 000d[110] = ACS 1
    ecap 0001[148] = AER 1 0 fatal 0 non-fatal 0 corrected
    ecap 000b[1d0] = Vendor 1 ID 3
    ecap 0019[250] = PCIe Sec 1 lane errors 0
    ecap 000b[280] = Vendor 1 ID 5
    ecap 000b[300] = Vendor 1 ID 8

pcib27@pci0:128:3:1:	class=0x060400 card=0x21ea103c chip=0x6f098086 rev=0x01 hdr=0x01
    vendor     = 'Intel Corporation'
    device     = 'Xeon E7 v4/Xeon E5 v4/Xeon E3 v4/Xeon D PCI Express Root Port 3'
    class      = bridge
    subclass   = PCI-PCI
    cap 0d[40] = PCI Bridge card=0x21ea103c
    cap 05[60] = MSI supports 2 messages, vector masks 
    cap 10[90] = PCI-Express 2 root port max data 128(256) ARI disabled
                 link x0(x4) speed 0.0(8.0) ASPM disabled(L1)
    cap 01[e0] = powerspec 3  supports D0 D3  current D0
    ecap 000b[100] = Vendor 1 ID 2
    ecap 000d[110] = ACS 1
    ecap 0001[148] = AER 1 0 fatal 0 non-fatal 0 corrected
    ecap 000b[1d0] = Vendor 1 ID 3
    ecap 0019[250] = PCIe Sec 1 lane errors 0
    ecap 000b[280] = Vendor 1 ID 5
    ecap 000b[300] = Vendor 1 ID 8

pcib28@pci0:128:3:2:	class=0x060400 card=0x21ea103c chip=0x6f0a8086 rev=0x01 hdr=0x01
    vendor     = 'Intel Corporation'
    device     = 'Xeon E7 v4/Xeon E5 v4/Xeon E3 v4/Xeon D PCI Express Root Port 3'
    class      = bridge
    subclass   = PCI-PCI
    cap 0d[40] = PCI Bridge card=0x21ea103c
    cap 05[60] = MSI supports 2 messages, vector masks 
    cap 10[90] = PCI-Express 2 root port max data 128(256) ARI disabled
                 link x0(x4) speed 0.0(8.0) ASPM disabled(L1)
    cap 01[e0] = powerspec 3  supports D0 D3  current D0
    ecap 000b[100] = Vendor 1 ID 2
    ecap 000d[110] = ACS 1
    ecap 0001[148] = AER 1 0 fatal 0 non-fatal 0 corrected
    ecap 000b[1d0] = Vendor 1 ID 3
    ecap 0019[250] = PCIe Sec 1 lane errors 0
    ecap 000b[280] = Vendor 1 ID 5
    ecap 000b[300] = Vendor 1 ID 8

pcib29@pci0:128:3:3:	class=0x060400 card=0x21ea103c chip=0x6f0b8086 rev=0x01 hdr=0x01
    vendor     = 'Intel Corporation'
    device     = 'Xeon E7 v4/Xeon E5 v4/Xeon E3 v4/Xeon D PCI Express Root Port 3'
    class      = bridge
    subclass   = PCI-PCI
    cap 0d[40] = PCI Bridge card=0x21ea103c
    cap 05[60] = MSI supports 2 messages, vector masks 
    cap 10[90] = PCI-Express 2 root port max data 128(256) ARI disabled
                 link x0(x4) speed 0.0(8.0) ASPM disabled(L1)
    cap 01[e0] = powerspec 3  supports D0 D3  current D0
    ecap 000b[100] = Vendor 1 ID 2
    ecap 000d[110] = ACS 1
    ecap 0001[148] = AER 1 0 fatal 0 non-fatal 0 corrected
    ecap 000b[1d0] = Vendor 1 ID 3
    ecap 0019[250] = PCIe Sec 1 lane errors 0
    ecap 000b[280] = Vendor 1 ID 5
    ecap 000b[300] = Vendor 1 ID 8

ioat8@pci0:128:4:0:	class=0x088000 card=0x21ea103c chip=0x6f208086 rev=0x01 hdr=0x00
    vendor     = 'Intel Corporation'
    device     = 'Xeon E7 v4/Xeon E5 v4/Xeon E3 v4/Xeon D Crystal Beach DMA Channel 0'
    class      = base peripheral
    bar   [10] = type Memory, range 64, base 0x3bffff1c000, size 16384, enabled
    cap 11[80] = MSI-X supports 1 message, enabled
                 Table in map 0x10[0x2000], PBA in map 0x10[0x3000]
    cap 10[90] = PCI-Express 2 root endpoint max data 128(128) NS
    cap 01[e0] = powerspec 3  supports D0 D3  current D0

ioat9@pci0:128:4:1:	class=0x088000 card=0x21ea103c chip=0x6f218086 rev=0x01 hdr=0x00
    vendor     = 'Intel Corporation'
    device     = 'Xeon E7 v4/Xeon E5 v4/Xeon E3 v4/Xeon D Crystal Beach DMA Channel 1'
    class      = base peripheral
    bar   [10] = type Memory, range 64, base 0x3bffff18000, size 16384, enabled
    cap 11[80] = MSI-X supports 1 message, enabled
                 Table in map 0x10[0x2000], PBA in map 0x10[0x3000]
    cap 10[90] = PCI-Express 2 root endpoint max data 128(128) NS
    cap 01[e0] = powerspec 3  supports D0 D3  current D0

ioat10@pci0:128:4:2:	class=0x088000 card=0x21ea103c chip=0x6f228086 rev=0x01 hdr=0x00
    vendor     = 'Intel Corporation'
    device     = 'Xeon E7 v4/Xeon E5 v4/Xeon E3 v4/Xeon D Crystal Beach DMA Channel 2'
    class      = base peripheral
    bar   [10] = type Memory, range 64, base 0x3bffff14000, size 16384, enabled
    cap 11[80] = MSI-X supports 1 message, enabled
                 Table in map 0x10[0x2000], PBA in map 0x10[0x3000]
    cap 10[90] = PCI-Express 2 root endpoint max data 128(128) NS
    cap 01[e0] = powerspec 3  supports D0 D3  current D0

ioat11@pci0:128:4:3:	class=0x088000 card=0x21ea103c chip=0x6f238086 rev=0x01 hdr=0x00
    vendor     = 'Intel Corporation'
    device     = 'Xeon E7 v4/Xeon E5 v4/Xeon E3 v4/Xeon D Crystal Beach DMA Channel 3'
    class      = base peripheral
    bar   [10] = type Memory, range 64, base 0x3bffff10000, size 16384, enabled
    cap 11[80] = MSI-X supports 1 message, enabled
                 Table in map 0x10[0x2000], PBA in map 0x10[0x3000]
    cap 10[90] = PCI-Express 2 root endpoint max data 128(128) NS
    cap 01[e0] = powerspec 3  supports D0 D3  current D0

ioat12@pci0:128:4:4:	class=0x088000 card=0x21ea103c chip=0x6f248086 rev=0x01 hdr=0x00
    vendor     = 'Intel Corporation'
    device     = 'Xeon E7 v4/Xeon E5 v4/Xeon E3 v4/Xeon D Crystal Beach DMA Channel 4'
    class      = base peripheral
    bar   [10] = type Memory, range 64, base 0x3bffff0c000, size 16384, enabled
    cap 11[80] = MSI-X supports 1 message, enabled
                 Table in map 0x10[0x2000], PBA in map 0x10[0x3000]
    cap 10[90] = PCI-Express 2 root endpoint max data 128(128) NS
    cap 01[e0] = powerspec 3  supports D0 D3  current D0

ioat13@pci0:128:4:5:	class=0x088000 card=0x21ea103c chip=0x6f258086 rev=0x01 hdr=0x00
    vendor     = 'Intel Corporation'
    device     = 'Xeon E7 v4/Xeon E5 v4/Xeon E3 v4/Xeon D Crystal Beach DMA Channel 5'
    class      = base peripheral
    bar   [10] = type Memory, range 64, base 0x3bffff08000, size 16384, enabled
    cap 11[80] = MSI-X supports 1 message, enabled
                 Table in map 0x10[0x2000], PBA in map 0x10[0x3000]
    cap 10[90] = PCI-Express 2 root endpoint max data 128(128) NS
    cap 01[e0] = powerspec 3  supports D0 D3  current D0

ioat14@pci0:128:4:6:	class=0x088000 card=0x21ea103c chip=0x6f268086 rev=0x01 hdr=0x00
    vendor     = 'Intel Corporation'
    device     = 'Xeon E7 v4/Xeon E5 v4/Xeon E3 v4/Xeon D Crystal Beach DMA Channel 6'
    class      = base peripheral
    bar   [10] = type Memory, range 64, base 0x3bffff04000, size 16384, enabled
    cap 11[80] = MSI-X supports 1 message, enabled
                 Table in map 0x10[0x2000], PBA in map 0x10[0x3000]
    cap 10[90] = PCI-Express 2 root endpoint max data 128(128) NS
    cap 01[e0] = powerspec 3  supports D0 D3  current D0

ioat15@pci0:128:4:7:	class=0x088000 card=0x21ea103c chip=0x6f278086 rev=0x01 hdr=0x00
    vendor     = 'Intel Corporation'
    device     = 'Xeon E7 v4/Xeon E5 v4/Xeon E3 v4/Xeon D Crystal Beach DMA Channel 7'
    class      = base peripheral
    bar   [10] = type Memory, range 64, base 0x3bffff00000, size 16384, enabled
    cap 11[80] = MSI-X supports 1 message, enabled
                 Table in map 0x10[0x2000], PBA in map 0x10[0x3000]
    cap 10[90] = PCI-Express 2 root endpoint max data 128(128) NS
    cap 01[e0] = powerspec 3  supports D0 D3  current D0

none161@pci0:128:5:0:	class=0x088000 card=0x21ea103c chip=0x6f288086 rev=0x01 hdr=0x00
    vendor     = 'Intel Corporation'
    device     = 'Xeon E7 v4/Xeon E5 v4/Xeon E3 v4/Xeon D Map/VTd_Misc/System Management'
    class      = base peripheral
    cap 10[40] = PCI-Express 2 root endpoint max data 128(128)

none162@pci0:128:5:1:	class=0x088000 card=0x21ea103c chip=0x6f298086 rev=0x01 hdr=0x00
    vendor     = 'Intel Corporation'
    device     = 'Xeon E7 v4/Xeon E5 v4/Xeon E3 v4/Xeon D IIO Hot Plug'
    class      = base peripheral
    cap 10[40] = PCI-Express 1 root endpoint max data 128(128)
    cap 05[80] = MSI supports 1 message, 64 bit 
    ecap 000b[100] = Vendor 1 ID 6
    ecap 000b[110] = Vendor 1 ID 6
    ecap 000b[120] = Vendor 1 ID 6
    ecap 000b[130] = Vendor 1 ID 6

none163@pci0:128:5:2:	class=0x088000 card=0x21ea103c chip=0x6f2a8086 rev=0x01 hdr=0x00
    vendor     = 'Intel Corporation'
    device     = 'Xeon E7 v4/Xeon E5 v4/Xeon E3 v4/Xeon D IIO RAS/Control Status/Global Errors'
    class      = base peripheral
    cap 10[40] = PCI-Express 2 root endpoint max data 128(128)

ioapic1@pci0:128:5:4:	class=0x080020 card=0x21ea103c chip=0x6f2c8086 rev=0x01 hdr=0x00
    vendor     = 'Intel Corporation'
    device     = 'Xeon E7 v4/Xeon E5 v4/Xeon E3 v4/Xeon D I/O APIC'
    class      = base peripheral
    subclass   = interrupt controller
    bar   [10] = type Memory, range 32, base 0xc8200000, size 4096, enabled
    cap 10[44] = PCI-Express 1 root endpoint max data 128(128)
    cap 01[e0] = powerspec 3  supports D0 D3  current D0

isp0@pci0:136:0:0:	class=0x0c0400 card=0x3262103c chip=0x25321077 rev=0x02 hdr=0x00
    vendor     = 'QLogic Corp.'
    device     = 'ISP2532-based 8Gb Fibre Channel to PCI Express HBA'
    class      = serial bus
    subclass   = Fibre Channel
    bar   [10] = type I/O Port, range 32, base 0xa000, size 256, enabled
    bar   [14] = type Memory, range 64, base 0xc8100000, size 16384, enabled
    bar   [1c] = type Memory, range 64, base 0xc8000000, size 1048576, enabled
    cap 01[44] = powerspec 3  supports D0 D3  current D0
    cap 10[4c] = PCI-Express 2 endpoint max data 256(1024) FLR RO NS
                 link x4(x8) speed 5.0(5.0) ASPM disabled(L0s)
    cap 05[88] = MSI supports 32 messages, 64 bit 
    cap 03[98] = VPD
    cap 11[a0] = MSI-X supports 32 messages, enabled
                 Table in map 0x14[0x2000], PBA in map 0x14[0x3000]
    ecap 0001[100] = AER 1 0 fatal 0 non-fatal 1 corrected
    ecap 0004[138] = Power Budgeting 1
