hostb0@pci0:0:0:0:	class=0x060000 rev=0x0c hdr=0x00 vendor=0x8086 device=0x3e34 subvendor=0x1297 subdevice=0x4076
    vendor     = 'Intel Corporation'
    device     = 'Coffee Lake HOST and DRAM Controller'
    class      = bridge
    subclass   = HOST-PCI
    cap 09[e0] = vendor (length 16) Intel cap 0 version 1

vgapci0@pci0:0:2:0:	class=0x030000 rev=0x02 hdr=0x00 vendor=0x8086 device=0x3ea0 subvendor=0x1297 subdevice=0x4076
    vendor     = 'Intel Corporation'
    device     = 'WhiskeyLake-U GT2 [UHD Graphics 620]'
    class      = display
    subclass   = VGA
    bar   [10] = type Memory, range 64, base 0xa0000000, size 16777216, enabled
    bar   [18] = type Prefetchable Memory, range 64, base 0x90000000, size 268435456, enabled
    bar   [20] = type I/O Port, range 32, base 0x4000, size 64, enabled
    cap 09[40] = vendor (length 12) Intel cap 0 version 1
    cap 10[70] = PCI-Express 2 root endpoint max data 128(128) FLR
                 max read 128
    cap 05[ac] = MSI supports 1 message 
    cap 01[d0] = powerspec 2  supports D0 D3  current D0
    ecap 001b[100] = Process Address Space ID 1
    ecap 000f[200] = ATS 1
    ecap 0013[300] = Page Page Request 1

none0@pci0:0:4:0:	class=0x118000 rev=0x0c hdr=0x00 vendor=0x8086 device=0x1903 subvendor=0x1297 subdevice=0x4076
    vendor     = 'Intel Corporation'
    device     = 'Xeon E3-1200 v5/E3-1500 v5/6th Gen Core Processor Thermal Subsystem'
    class      = dasp
    bar   [10] = type Memory, range 64, base 0xa1430000, size 32768, enabled
    cap 05[90] = MSI supports 1 message 
    cap 01[d0] = powerspec 3  supports D0 D3  current D0
    cap 09[e0] = vendor (length 12) Intel cap 0 version 1

pchtherm0@pci0:0:18:0:	class=0x118000 rev=0x30 hdr=0x00 vendor=0x8086 device=0x9df9 subvendor=0x1297 subdevice=0x4076
    vendor     = 'Intel Corporation'
    device     = 'Cannon Point-LP Thermal Controller'
    class      = dasp
    bar   [10] = type Memory, range 64, base 0xa1445000, size 4096, enabled
    cap 01[50] = powerspec 3  supports D0 D3  current D0
    cap 05[80] = MSI supports 1 message 

xhci0@pci0:0:20:0:	class=0x0c0330 rev=0x30 hdr=0x00 vendor=0x8086 device=0x9ded subvendor=0x1297 subdevice=0x4076
    vendor     = 'Intel Corporation'
    device     = 'Cannon Point-LP USB 3.1 xHCI Controller'
    class      = serial bus
    subclass   = USB
    bar   [10] = type Memory, range 64, base 0xa1420000, size 65536, enabled
    cap 01[70] = powerspec 2  supports D0 D3  current D0
    cap 05[80] = MSI supports 8 messages, 64 bit enabled with 1 message
    cap 09[90] = vendor (length 20) Intel cap 15 version 0

none1@pci0:0:20:2:	class=0x050000 rev=0x30 hdr=0x00 vendor=0x8086 device=0x9def subvendor=0x8086 subdevice=0x7270
    vendor     = 'Intel Corporation'
    device     = 'Cannon Point-LP Shared SRAM'
    class      = memory
    subclass   = RAM
    bar   [10] = type Memory, range 64, base 0xa143e000, size 8192, enabled
    bar   [18] = type Memory, range 64, base 0xa1444000, size 4096, enabled
    cap 01[80] = powerspec 3  supports D0 D3  current D0

none2@pci0:0:22:0:	class=0x078000 rev=0x30 hdr=0x00 vendor=0x8086 device=0x9de0 subvendor=0x1297 subdevice=0x4076
    vendor     = 'Intel Corporation'
    device     = 'Cannon Point-LP MEI Controller'
    class      = simple comms
    bar   [10] = type Memory, range 64, base 0xa1443000, size 4096, enabled
    cap 01[50] = powerspec 3  supports D0 D3  current D0
    cap 05[8c] = MSI supports 1 message, 64 bit 
    cap 09[a4] = vendor (length 20) Intel cap 15 version 0

ahci0@pci0:0:23:0:	class=0x010601 rev=0x30 hdr=0x00 vendor=0x8086 device=0x9dd3 subvendor=0x1297 subdevice=0x4076
    vendor     = 'Intel Corporation'
    device     = 'Cannon Point-LP SATA Controller [AHCI Mode]'
    class      = mass storage
    subclass   = SATA
    bar   [10] = type Memory, range 32, base 0xa143c000, size 8192, enabled
    bar   [14] = type Memory, range 32, base 0xa1442000, size 256, enabled
    bar   [18] = type I/O Port, range 32, base 0x4090, size 8, enabled
    bar   [1c] = type I/O Port, range 32, base 0x4080, size 4, enabled
    bar   [20] = type I/O Port, range 32, base 0x4060, size 32, enabled
    bar   [24] = type Memory, range 32, base 0xa1441000, size 2048, enabled
    cap 05[80] = MSI supports 1 message enabled with 1 message
    cap 01[70] = powerspec 3  supports D0 D3  current D0
    cap 12[a8] = SATA Index-Data Pair

pcib1@pci0:0:28:0:	class=0x060400 rev=0xf0 hdr=0x01 vendor=0x8086 device=0x9dbf subvendor=0x1297 subdevice=0x4076
    vendor     = 'Intel Corporation'
    device     = 'Cannon Point PCI Express Root Port'
    class      = bridge
    subclass   = PCI-PCI
    cap 10[40] = PCI-Express 2 root port max data 256(256) ARI disabled
                 max read 128
                 link x1(x1) speed 2.5(8.0) ASPM L1(L0s/L1)
                 slot 11 power limit 100 mW
    cap 05[80] = MSI supports 1 message 
    cap 0d[90] = PCI Bridge subvendor=0x1297 subdevice=0x4076
    cap 01[a0] = powerspec 3  supports D0 D3  current D0
    ecap 0001[100] = AER 1 0 fatal 0 non-fatal 0 corrected
    ecap 000d[140] = ACS 1
    ecap 001f[150] = Precision Time Measurement 1
    ecap 0019[220] = PCIe Sec 1 lane errors 0
    ecap 001d[250] = Downstream Port Containment 1

pcib2@pci0:0:29:0:	class=0x060400 rev=0xf0 hdr=0x01 vendor=0x8086 device=0x9db1 subvendor=0x1297 subdevice=0x4076
    vendor     = 'Intel Corporation'
    device     = 'Cannon Point-LP PCI Express Root Port'
    class      = bridge
    subclass   = PCI-PCI
    cap 10[40] = PCI-Express 2 root port max data 128(256) ARI disabled
                 max read 128
                 link x1(x1) speed 5.0(8.0) ASPM L1(L0s/L1)
                 slot 13 power limit 100 mW
    cap 05[80] = MSI supports 1 message 
    cap 0d[90] = PCI Bridge subvendor=0x1297 subdevice=0x4076
    cap 01[a0] = powerspec 3  supports D0 D3  current D0
    ecap 0001[100] = AER 1 0 fatal 0 non-fatal 0 corrected
    ecap 000d[140] = ACS 1
    ecap 001f[150] = Precision Time Measurement 1
    ecap 0019[220] = PCIe Sec 1 lane errors 0
    ecap 001d[250] = Downstream Port Containment 1

pcib3@pci0:0:29:4:	class=0x060400 rev=0xf0 hdr=0x01 vendor=0x8086 device=0x9db4 subvendor=0x1297 subdevice=0x4076
    vendor     = 'Intel Corporation'
    device     = 'Cannon Point-LP PCI Express Root Port'
    class      = bridge
    subclass   = PCI-PCI
    cap 10[40] = PCI-Express 2 root port max data 256(256) ARI disabled
                 max read 128
                 link x4(x4) speed 8.0(8.0) ASPM L1(L0s/L1)
                 slot 16 power limit 250 mW
    cap 05[80] = MSI supports 1 message 
    cap 0d[90] = PCI Bridge subvendor=0x1297 subdevice=0x4076
    cap 01[a0] = powerspec 3  supports D0 D3  current D0
    ecap 0001[100] = AER 1 0 fatal 0 non-fatal 1 corrected
    ecap 000d[140] = ACS 1
    ecap 001f[150] = Precision Time Measurement 1
    ecap 0019[220] = PCIe Sec 1 lane errors 0
    ecap 001d[250] = Downstream Port Containment 1

isab0@pci0:0:31:0:	class=0x060100 rev=0x30 hdr=0x00 vendor=0x8086 device=0x9d84 subvendor=0x1297 subdevice=0x4076
    vendor     = 'Intel Corporation'
    device     = 'Cannon Point-LP LPC Controller'
    class      = bridge
    subclass   = PCI-ISA

hdac0@pci0:0:31:3:	class=0x040300 rev=0x30 hdr=0x00 vendor=0x8086 device=0x9dc8 subvendor=0x1297 subdevice=0x4076
    vendor     = 'Intel Corporation'
    device     = 'Cannon Point-LP High Definition Audio Controller'
    class      = multimedia
    subclass   = HDA
    bar   [10] = type Memory, range 64, base 0xa1438000, size 16384, enabled
    bar   [20] = type Memory, range 64, base 0xa1000000, size 1048576, enabled
    cap 01[50] = powerspec 3  supports D0 D3  current D0
    cap 09[80] = vendor (length 20) Intel cap 15 version 0
    cap 05[60] = MSI supports 1 message, 64 bit enabled with 1 message

none3@pci0:0:31:4:	class=0x0c0500 rev=0x30 hdr=0x00 vendor=0x8086 device=0x9da3 subvendor=0x1297 subdevice=0x4076
    vendor     = 'Intel Corporation'
    device     = 'Cannon Point-LP SMBus Controller'
    class      = serial bus
    subclass   = SMBus
    bar   [10] = type Memory, range 64, base 0xa1440000, size 256, enabled
    bar   [20] = type I/O Port, range 32, base 0xefa0, size 32, enabled

none4@pci0:0:31:5:	class=0x0c8000 rev=0x30 hdr=0x00 vendor=0x8086 device=0x9da4 subvendor=0x1297 subdevice=0x4076
    vendor     = 'Intel Corporation'
    device     = 'Cannon Point-LP SPI Controller'
    class      = serial bus
    bar   [10] = type Memory, range 32, base 0xfe010000, size 4096, enabled

em0@pci0:0:31:6:	class=0x020000 rev=0x30 hdr=0x00 vendor=0x8086 device=0x15bd subvendor=0x8086 subdevice=0x0000
    vendor     = 'Intel Corporation'
    device     = 'Ethernet Connection (6) I219-LM'
    class      = network
    subclass   = ethernet
    bar   [10] = type Memory, range 32, base 0xa1400000, size 131072, enabled
    cap 01[c8] = powerspec 3  supports D0 D3  current D0
    cap 05[d0] = MSI supports 1 message, 64 bit enabled with 1 message

igb0@pci0:1:0:0:	class=0x020000 rev=0x03 hdr=0x00 vendor=0x8086 device=0x1539 subvendor=0x1297 subdevice=0x4076
    vendor     = 'Intel Corporation'
    device     = 'I211 Gigabit Network Connection'
    class      = network
    subclass   = ethernet
    bar   [10] = type Memory, range 32, base 0xa1300000, size 131072, enabled
    bar   [18] = type I/O Port, range 32, base 0x3000, size 32, enabled
    bar   [1c] = type Memory, range 32, base 0xa1320000, size 16384, enabled
    cap 01[40] = powerspec 3  supports D0 D3  current D0
    cap 05[50] = MSI supports 1 message, 64 bit, vector masks 
    cap 11[70] = MSI-X supports 5 messages, enabled
                 Table in map 0x1c[0x0], PBA in map 0x1c[0x2000]
    cap 10[a0] = PCI-Express 2 endpoint max data 256(512) FLR RO NS
                 max read 512
                 link x1(x1) speed 2.5(2.5) ASPM L1(L0s/L1)
    ecap 0001[100] = AER 2 0 fatal 0 non-fatal 0 corrected
    ecap 0003[140] = Serial 1 80ee73fffff1060c
    ecap 0017[1a0] = TPH Requester 1

none5@pci0:2:0:0:	class=0x028000 rev=0x1a hdr=0x00 vendor=0x8086 device=0x2725 subvendor=0x8086 subdevice=0x0024
    vendor     = 'Intel Corporation'
    device     = 'Wi-Fi 6 AX210/AX211/AX411 160MHz'
    class      = network
    bar   [10] = type Memory, range 64, base 0xa1200000, size 16384, enabled
    cap 01[c8] = powerspec 3  supports D0 D3  current D0
    cap 05[d0] = MSI supports 1 message, 64 bit 
    cap 10[40] = PCI-Express 2 endpoint max data 128(128) FLR RO NS
                 max read 128
                 link x1(x1) speed 5.0(5.0) ASPM L1(L1) ClockPM enabled
    cap 11[80] = MSI-X supports 16 messages
                 Table in map 0x10[0x2000], PBA in map 0x10[0x3000]
    ecap 0001[100] = AER 1 0 fatal 0 non-fatal 0 corrected
    ecap 0018[14c] = LTR 1
    ecap 001e[154] = L1 PM Substates 1

nvme0@pci0:3:0:0:	class=0x010802 rev=0x00 hdr=0x00 vendor=0x15b7 device=0x5006 subvendor=0x15b7 subdevice=0x5006
    vendor     = 'Sandisk Corp'
    device     = 'WD Black SN750 / PC SN730 NVMe SSD'
    class      = mass storage
    subclass   = NVM
    bar   [10] = type Memory, range 64, base 0xa1100000, size 16384, enabled
    bar   [20] = type Memory, range 64, base 0xa1104000, size 256, enabled
    cap 01[80] = powerspec 3  supports D0 D3  current D0
    cap 05[90] = MSI supports 32 messages, 64 bit 
    cap 11[b0] = MSI-X supports 65 messages, enabled
                 Table in map 0x10[0x2000], PBA in map 0x20[0x0]
    cap 10[c0] = PCI-Express 2 endpoint max data 256(512) FLR RO NS
                 max read 512
                 link x4(x4) speed 8.0(8.0) ASPM L1(L1) ClockPM enabled
    ecap 0001[100] = AER 2 0 fatal 0 non-fatal 1 corrected
    ecap 0003[150] = Serial 1 0000000000000000
    ecap 0018[1b8] = LTR 1
    ecap 0019[300] = PCIe Sec 1 lane errors 0
    ecap 001e[900] = L1 PM Substates 1
