hostb0@pci0:0:0:0:	class=0x060000 card=0x29c01849 chip=0x29c08086 rev=0x10 hdr=0x00
    vendor     = 'Intel Corporation'
    device     = '82G33/G31/P35/P31 Express DRAM Controller'
    class      = bridge
    subclass   = HOST-PCI
    cap 09[e0] = vendor (length 11) Intel cap 11 version 1

pcib1@pci0:0:1:0:	class=0x060400 card=0x29c11849 chip=0x29c18086 rev=0x10 hdr=0x01
    vendor     = 'Intel Corporation'
    device     = '82G33/G31/P35/P31 Express PCI Express Root Port'
    class      = bridge
    subclass   = PCI-PCI
    cap 0d[88] = PCI Bridge card=0x29c11849
    cap 01[80] = powerspec 3  supports D0 D3  current D0
    cap 05[90] = MSI supports 1 message 
    cap 10[a0] = PCI-Express 1 root port max data 128(128)
                 link x16(x16) speed 2.5(2.5) ASPM disabled(L0s)
                 slot 0 power limit 75000 mW
    ecap 0002[100] = VC 1 max VC0
    ecap 0005[140] = Root Complex Link Declaration 1

hdac0@pci0:0:27:0:	class=0x040300 card=0x03971849 chip=0x27d88086 rev=0x01 hdr=0x00
    vendor     = 'Intel Corporation'
    device     = 'NM10/ICH7 Family High Definition Audio Controller'
    class      = multimedia
    subclass   = HDA
    bar   [10] = type Memory, range 64, base 0xf9efc000, size 16384, enabled
    cap 01[50] = powerspec 2  supports D0 D3  current D0
    cap 05[60] = MSI supports 1 message, 64 bit enabled with 1 message
    cap 10[70] = PCI-Express 1 root endpoint max data 128(128) NS
    ecap 0002[100] = VC 1 max VC1
    ecap 0005[130] = Root Complex Link Declaration 1

pcib2@pci0:0:28:0:	class=0x060400 card=0x27d01849 chip=0x27d08086 rev=0x01 hdr=0x01
    vendor     = 'Intel Corporation'
    device     = 'NM10/ICH7 Family PCI Express Port 1'
    class      = bridge
    subclass   = PCI-PCI
    cap 10[40] = PCI-Express 1 root port max data 128(128)
                 link x0(x1) speed 0.0(2.5) ASPM disabled(L0s/L1)
                 slot 0 power limit 0 mW HotPlug(empty) surprise
    cap 05[80] = MSI supports 1 message 
    cap 0d[90] = PCI Bridge card=0x27d01849
    cap 01[a0] = powerspec 2  supports D0 D3  current D0
    ecap 0002[100] = VC 1 max VC1
    ecap 0005[180] = Root Complex Link Declaration 1

pcib3@pci0:0:28:1:	class=0x060400 card=0x27d21849 chip=0x27d28086 rev=0x01 hdr=0x01
    vendor     = 'Intel Corporation'
    device     = 'NM10/ICH7 Family PCI Express Port 2'
    class      = bridge
    subclass   = PCI-PCI
    cap 10[40] = PCI-Express 1 root port max data 128(128)
                 link x1(x1) speed 2.5(2.5) ASPM disabled(L0s/L1)
                 slot 0 power limit 0 mW HotPlug(present) surprise
    cap 05[80] = MSI supports 1 message 
    cap 0d[90] = PCI Bridge card=0x27d21849
    cap 01[a0] = powerspec 2  supports D0 D3  current D0
    ecap 0002[100] = VC 1 max VC1
    ecap 0005[180] = Root Complex Link Declaration 1

uhci0@pci0:0:29:0:	class=0x0c0300 card=0x27c81849 chip=0x27c88086 rev=0x01 hdr=0x00
    vendor     = 'Intel Corporation'
    device     = 'NM10/ICH7 Family USB UHCI Controller'
    class      = serial bus
    subclass   = USB
    bar   [20] = type I/O Port, range 32, base 0xc480, size 32, enabled

uhci1@pci0:0:29:1:	class=0x0c0300 card=0x27c91849 chip=0x27c98086 rev=0x01 hdr=0x00
    vendor     = 'Intel Corporation'
    device     = 'NM10/ICH7 Family USB UHCI Controller'
    class      = serial bus
    subclass   = USB
    bar   [20] = type I/O Port, range 32, base 0xc800, size 32, enabled

uhci2@pci0:0:29:2:	class=0x0c0300 card=0x27ca1849 chip=0x27ca8086 rev=0x01 hdr=0x00
    vendor     = 'Intel Corporation'
    device     = 'NM10/ICH7 Family USB UHCI Controller'
    class      = serial bus
    subclass   = USB
    bar   [20] = type I/O Port, range 32, base 0xc880, size 32, enabled

uhci3@pci0:0:29:3:	class=0x0c0300 card=0x27cb1849 chip=0x27cb8086 rev=0x01 hdr=0x00
    vendor     = 'Intel Corporation'
    device     = 'NM10/ICH7 Family USB UHCI Controller'
    class      = serial bus
    subclass   = USB
    bar   [20] = type I/O Port, range 32, base 0xcc00, size 32, enabled

ehci0@pci0:0:29:7:	class=0x0c0320 card=0x27cc1849 chip=0x27cc8086 rev=0x01 hdr=0x00
    vendor     = 'Intel Corporation'
    device     = 'NM10/ICH7 Family USB2 EHCI Controller'
    class      = serial bus
    subclass   = USB
    bar   [10] = type Memory, range 32, base 0xf9efbc00, size 1024, enabled
    cap 01[50] = powerspec 2  supports D0 D3  current D0
    cap 0a[58] = EHCI Debug Port at offset 0xa0 in map 0x14

pcib4@pci0:0:30:0:	class=0x060401 card=0x244e1849 chip=0x244e8086 rev=0xe1 hdr=0x01
    vendor     = 'Intel Corporation'
    device     = '82801 PCI Bridge'
    class      = bridge
    subclass   = PCI-PCI
    cap 0d[50] = PCI Bridge card=0x244e1849

isab0@pci0:0:31:0:	class=0x060100 card=0x27b81849 chip=0x27b88086 rev=0x01 hdr=0x00
    vendor     = 'Intel Corporation'
    device     = '82801GB/GR (ICH7 Family) LPC Interface Bridge'
    class      = bridge
    subclass   = PCI-ISA
    cap 09[e0] = vendor (length 12) Intel cap 1 version 0
		 features: Quick Resume, SATA RAID-5, 6 PCI-e x1 slots, SATA RAID-0/1/10, SATA AHCI

atapci0@pci0:0:31:1:	class=0x01018a card=0x27df1849 chip=0x27df8086 rev=0x01 hdr=0x00
    vendor     = 'Intel Corporation'
    device     = '82801G (ICH7 Family) IDE Controller'
    class      = mass storage
    subclass   = ATA
    bar   [20] = type I/O Port, range 32, base 0xffa0, size 16, enabled

atapci1@pci0:0:31:2:	class=0x01018f card=0x27c01849 chip=0x27c08086 rev=0x01 hdr=0x00
    vendor     = 'Intel Corporation'
    device     = 'NM10/ICH7 Family SATA Controller [IDE mode]'
    class      = mass storage
    subclass   = ATA
    bar   [10] = type I/O Port, range 32, base 0xc400, size 8, enabled
    bar   [14] = type I/O Port, range 32, base 0xc080, size 4, enabled
    bar   [18] = type I/O Port, range 32, base 0xc000, size 8, enabled
    bar   [1c] = type I/O Port, range 32, base 0xbc00, size 4, enabled
    bar   [20] = type I/O Port, range 32, base 0xb880, size 16, enabled
    cap 01[70] = powerspec 2  supports D0 D3  current D0

none0@pci0:0:31:3:	class=0x0c0500 card=0x27da1849 chip=0x27da8086 rev=0x01 hdr=0x00
    vendor     = 'Intel Corporation'
    device     = 'NM10/ICH7 Family SMBus Controller'
    class      = serial bus
    subclass   = SMBus
    bar   [20] = type I/O Port, range 32, base 0x400, size 32, enabled

vgapci0@pci0:4:0:0:	class=0x030000 card=0x00000000 chip=0x061510de rev=0xa2 hdr=0x00
    vendor     = 'NVIDIA Corporation'
    device     = 'G92 [GeForce GTS 250]'
    class      = display
    subclass   = VGA
    bar   [10] = type Memory, range 32, base 0xfd000000, size 16777216, enabled
    bar   [14] = type Prefetchable Memory, range 64, base 0xe0000000, size 268435456, enabled
    bar   [1c] = type Memory, range 64, base 0xfa000000, size 33554432, enabled
    bar   [24] = type I/O Port, range 32, base 0xec00, size 128, enabled
    cap 01[60] = powerspec 3  supports D0 D3  current D0
    cap 05[68] = MSI supports 1 message, 64 bit 
    cap 10[78] = PCI-Express 2 endpoint max data 128(128) RO NS
                 link x16(x16) speed 2.5(5.0) ASPM disabled(L0s/L1)
    ecap 0002[100] = VC 1 max VC0
    ecap 0004[128] = Power Budgeting 1
    ecap 000b[600] = Vendor 1 ID 1

re0@pci0:1:0:0:	class=0x020000 card=0x81361849 chip=0x813610ec rev=0x02 hdr=0x00
    vendor     = 'Realtek Semiconductor Co., Ltd.'
    device     = 'RTL810xE PCI Express Fast Ethernet controller'
    class      = network
    subclass   = ethernet
    bar   [10] = type I/O Port, range 32, base 0xd800, size 256, enabled
    bar   [18] = type Prefetchable Memory, range 64, base 0xdfeff000, size 4096, enabled
    bar   [20] = type Prefetchable Memory, range 64, base 0xdfee0000, size 65536, enabled
    cap 01[40] = powerspec 3  supports D0 D1 D2 D3  current D0
    cap 05[50] = MSI supports 1 message, 64 bit 
    cap 10[70] = PCI-Express 2 endpoint MSI 1 max data 128(256) RO
                 link x1(x1) speed 2.5(2.5) ASPM disabled(L0s/L1) ClockPM disabled
    cap 11[ac] = MSI-X supports 2 messages, enabled
                 Table in map 0x20[0x0], PBA in map 0x20[0x800]
    cap 03[cc] = VPD
    ecap 0001[100] = AER 1 0 fatal 0 non-fatal 2 corrected
    ecap 0002[140] = VC 1 max VC0
    ecap 0003[160] = Serial 1 01000000ffff0000
