hostb0@pci0:0:0:0:	class=0x060000 card=0x8055103c chip=0x190f8086 rev=0x07 hdr=0x00
    vendor     = 'Intel Corporation'
    device     = 'Xeon E3-1200 v5/E3-1500 v5/6th Gen Core Processor Host Bridge/DRAM Registers'
    class      = bridge
    subclass   = HOST-PCI
    cap 09[e0] = vendor (length 16) Intel cap 0 version 1

vgapci0@pci0:0:2:0:	class=0x030000 card=0x8055103c chip=0x19128086 rev=0x06 hdr=0x00
    vendor     = 'Intel Corporation'
    device     = 'HD Graphics 530'
    class      = display
    subclass   = VGA
    bar   [10] = type Memory, range 64, base 0xe0000000, size 16777216, enabled
    bar   [18] = type Prefetchable Memory, range 64, base 0xd0000000, size 268435456, enabled
    bar   [20] = type I/O Port, range 32, base 0x3000, size 64, enabled
    cap 09[40] = vendor (length 12) Intel cap 0 version 1
    cap 10[70] = PCI-Express 2 root endpoint max data 128(128) FLR
    cap 05[ac] = MSI supports 1 message enabled with 1 message
    cap 01[d0] = powerspec 2  supports D0 D3  current D0
    ecap 001b[100] = unknown 1
    ecap 000f[200] = ATS 1
    ecap 0013[300] = unknown 1

xhci0@pci0:0:20:0:	class=0x0c0330 card=0x8055103c chip=0xa12f8086 rev=0x31 hdr=0x00
    vendor     = 'Intel Corporation'
    device     = '100 Series/C230 Series Chipset Family USB 3.0 xHCI Controller'
    class      = serial bus
    subclass   = USB
    bar   [10] = type Memory, range 64, base 0xe1620000, size 65536, enabled
    cap 01[70] = powerspec 2  supports D0 D3  current D0
    cap 05[80] = MSI supports 8 messages, 64 bit enabled with 1 message

none0@pci0:0:20:2:	class=0x118000 card=0x8055103c chip=0xa1318086 rev=0x31 hdr=0x00
    vendor     = 'Intel Corporation'
    device     = '100 Series/C230 Series Chipset Family Thermal Subsystem'
    class      = dasp
    bar   [10] = type Memory, range 64, base 0xe164b000, size 4096, enabled
    cap 01[50] = powerspec 3  supports D0 D3  current D0
    cap 05[80] = MSI supports 1 message 

none1@pci0:0:22:0:	class=0x078000 card=0x8055103c chip=0xa13a8086 rev=0x31 hdr=0x00
    vendor     = 'Intel Corporation'
    device     = '100 Series/C230 Series Chipset Family MEI Controller'
    class      = simple comms
    bar   [10] = type Memory, range 64, base 0xe164c000, size 4096, enabled
    cap 01[50] = powerspec 3  supports D0 D3  current D0
    cap 05[8c] = MSI supports 1 message, 64 bit 

none2@pci0:0:22:3:	class=0x070002 card=0x8055103c chip=0xa13d8086 rev=0x31 hdr=0x00
    vendor     = 'Intel Corporation'
    device     = '100 Series/C230 Series Chipset Family KT Redirection'
    class      = simple comms
    subclass   = UART
    bar   [10] = type I/O Port, range 32, base 0x3080, size 8, enabled
    bar   [14] = type Memory, range 32, base 0xe164a000, size 4096, enabled
    cap 05[40] = MSI supports 1 message, 64 bit 
    cap 01[50] = powerspec 3  supports D0 D3  current D0

ahci0@pci0:0:23:0:	class=0x010601 card=0x8055103c chip=0xa1028086 rev=0x31 hdr=0x00
    vendor     = 'Intel Corporation'
    device     = 'Q170/Q150/B150/H170/H110/Z170/CM236 Chipset SATA Controller [AHCI Mode]'
    class      = mass storage
    subclass   = SATA
    bar   [10] = type Memory, range 32, base 0xe1648000, size 8192, enabled
    bar   [14] = type Memory, range 32, base 0xe164f000, size 256, enabled
    bar   [18] = type I/O Port, range 32, base 0x3088, size 8, enabled
    bar   [1c] = type I/O Port, range 32, base 0x3090, size 4, enabled
    bar   [20] = type I/O Port, range 32, base 0x3040, size 32, enabled
    bar   [24] = type Memory, range 32, base 0xe164d000, size 2048, enabled
    cap 05[80] = MSI supports 1 message enabled with 1 message
    cap 01[70] = powerspec 3  supports D0 D3  current D0
    cap 12[a8] = SATA Index-Data Pair

pcib1@pci0:0:28:0:	class=0x060400 card=0x8055103c chip=0xa1158086 rev=0xf1 hdr=0x01
    vendor     = 'Intel Corporation'
    device     = '100 Series/C230 Series Chipset Family PCI Express Root Port'
    class      = bridge
    subclass   = PCI-PCI
    cap 10[40] = PCI-Express 2 root port max data 256(256) ARI disabled
                 link x1(x1) speed 2.5(8.0) ASPM L0s/L1(L0s/L1)
                 slot 5 power limit 100 mW
    cap 05[80] = MSI supports 1 message 
    cap 0d[90] = PCI Bridge card=0x8055103c
    cap 01[a0] = powerspec 3  supports D0 D3  current D0
    ecap 0001[100] = AER 1 0 fatal 0 non-fatal 1 corrected
    ecap 000d[140] = ACS 1
    ecap 0019[220] = PCIe Sec 1 lane errors 0

pcib2@pci0:0:29:0:	class=0x060400 card=0x8055103c chip=0xa1188086 rev=0xf1 hdr=0x01
    vendor     = 'Intel Corporation'
    device     = '100 Series/C230 Series Chipset Family PCI Express Root Port'
    class      = bridge
    subclass   = PCI-PCI
    cap 10[40] = PCI-Express 2 root port max data 256(256) ARI enabled
                 link x4(x4) speed 8.0(8.0) ASPM L1(L1)
                 slot 8 power limit 250 mW
    cap 05[80] = MSI supports 1 message 
    cap 0d[90] = PCI Bridge card=0x8055103c
    cap 01[a0] = powerspec 3  supports D0 D3  current D0
    ecap 0001[100] = AER 1 0 fatal 0 non-fatal 0 corrected
    ecap 000d[140] = ACS 1
    ecap 0019[220] = PCIe Sec 1 lane errors 0

isab0@pci0:0:31:0:	class=0x060100 card=0x8055103c chip=0xa1468086 rev=0x31 hdr=0x00
    vendor     = 'Intel Corporation'
    device     = 'Q170 Chipset LPC/eSPI Controller'
    class      = bridge
    subclass   = PCI-ISA

none3@pci0:0:31:2:	class=0x058000 card=0x8055103c chip=0xa1218086 rev=0x31 hdr=0x00
    vendor     = 'Intel Corporation'
    device     = '100 Series/C230 Series Chipset Family Power Management Controller'
    class      = memory
    bar   [10] = type Memory, range 32, base 0xe1640000, size 16384, enabled

hdac0@pci0:0:31:3:	class=0x040300 card=0x8055103c chip=0xa1708086 rev=0x31 hdr=0x00
    vendor     = 'Intel Corporation'
    device     = '100 Series/C230 Series Chipset Family HD Audio Controller'
    class      = multimedia
    subclass   = HDA
    bar   [10] = type Memory, range 64, base 0xe1644000, size 16384, enabled
    bar   [20] = type Memory, range 64, base 0xe1630000, size 65536, enabled
    cap 01[50] = powerspec 3  supports D0 D3  current D0
    cap 05[60] = MSI supports 1 message, 64 bit enabled with 1 message

none4@pci0:0:31:4:	class=0x0c0500 card=0x8055103c chip=0xa1238086 rev=0x31 hdr=0x00
    vendor     = 'Intel Corporation'
    device     = '100 Series/C230 Series Chipset Family SMBus'
    class      = serial bus
    subclass   = SMBus
    bar   [10] = type Memory, range 64, base 0xe164e000, size 256, enabled
    bar   [20] = type I/O Port, range 32, base 0xefa0, size 32, enabled

em0@pci0:0:31:6:	class=0x020000 card=0x8056103c chip=0x15b78086 rev=0x31 hdr=0x00
    vendor     = 'Intel Corporation'
    device     = 'Ethernet Connection (2) I219-LM'
    class      = network
    subclass   = ethernet
    bar   [10] = type Memory, range 32, base 0xe1600000, size 131072, enabled
    cap 01[c8] = powerspec 3  supports D0 D3  current D0
    cap 05[d0] = MSI supports 1 message, 64 bit enabled with 1 message
    cap 13[e0] = PCI Advanced Features: FLR TP

none5@pci0:1:0:0:	class=0x028000 card=0x81b5103c chip=0x440d14e4 rev=0x02 hdr=0x00
    vendor     = 'Broadcom Inc. and subsidiaries'
    class      = network
    bar   [10] = type Memory, range 64, base 0xe1400000, size 32768, enabled
    bar   [18] = type Memory, range 64, base 0xe1000000, size 4194304, enabled
    cap 01[48] = powerspec 3  supports D0 D1 D2 D3  current D0
    cap 05[58] = MSI supports 16 messages, 64 bit 
    cap 09[68] = vendor (length 68)
    cap 10[ac] = PCI-Express 2 endpoint max data 256(256) RO NS
                 link x1(x1) speed 2.5(2.5) ASPM L0s/L1(L0s/L1)
    ecap 0001[100] = AER 1 0 fatal 0 non-fatal 0 corrected
    ecap 0003[13c] = Serial 1 0000a8ffffc2441c
    ecap 0004[150] = Power Budgeting 1
    ecap 0002[160] = VC 1 max VC0
    ecap 0018[1b0] = LTR 1
    ecap 0015[220] = Resizable BAR 1
    ecap 001e[240] = unknown 1

nvme0@pci0:2:0:0:	class=0x010802 card=0x50121987 chip=0x50121987 rev=0x01 hdr=0x00
    vendor     = 'Phison Electronics Corporation'
    device     = 'E12 NVMe Controller'
    class      = mass storage
    subclass   = NVM
    bar   [10] = type Memory, range 64, base 0xe1500000, size 16384, enabled
    cap 10[80] = PCI-Express 2 endpoint max data 256(256) FLR RO NS
                 link x4(x4) speed 8.0(8.0) ASPM L1(L1)
    cap 11[d0] = MSI-X supports 9 messages, enabled
                 Table in map 0x10[0x2000], PBA in map 0x10[0x3000]
    cap 05[e0] = MSI supports 8 messages, 64 bit 
    cap 01[f8] = powerspec 3  supports D0 D3  current D0
    ecap 0018[100] = LTR 1
    ecap 001e[110] = unknown 1
    ecap 000e[128] = ARI 1
    ecap 0001[200] = AER 2 0 fatal 0 non-fatal 0 corrected
    ecap 0019[300] = PCIe Sec 1 lane errors 0
