hostb0@pci0:0:0:0:	class=0x060000 card=0x0d4d105b chip=0x27708086 rev=0x02 hdr=0x00
    vendor     = 'Intel Corporation'
    device     = '82945G/GZ/P/PL Memory Controller Hub'
    class      = bridge
    subclass   = HOST-PCI
    cap 09[e0] = vendor (length 9) Intel cap 5 version 1

vgapci0@pci0:0:2:0:	class=0x030000 card=0x0d4d105b chip=0x27728086 rev=0x02 hdr=0x00
    vendor     = 'Intel Corporation'
    device     = '82945G/GZ Integrated Graphics Controller'
    class      = display
    subclass   = VGA
    bar   [10] = type Memory, range 32, base 0xffe80000, size 524288, enabled
    bar   [14] = type I/O Port, range 32, base 0xec00, size 8, enabled
    bar   [18] = type Prefetchable Memory, range 32, base 0xd0000000, size 268435456, enabled
    bar   [1c] = type Memory, range 32, base 0xffe40000, size 262144, enabled
    cap 05[90] = MSI supports 1 message 
    cap 01[d0] = powerspec 2  supports D0 D3  current D0

hdac0@pci0:0:27:0:	class=0x040300 card=0x0d4d105b chip=0x27d88086 rev=0x01 hdr=0x00
    vendor     = 'Intel Corporation'
    device     = 'NM10/ICH7 Family High Definition Audio Controller'
    class      = multimedia
    subclass   = HDA
    bar   [10] = type Memory, range 64, base 0xffe38000, size 16384, enabled
    cap 01[50] = powerspec 2  supports D0 D3  current D0
    cap 05[60] = MSI supports 1 message, 64 bit enabled with 1 message
    cap 10[70] = PCI-Express 1 root endpoint max data 128(128) NS
    ecap 0002[100] = VC 1 max VC1
    ecap 0005[130] = Root Complex Link Declaration 1

uhci0@pci0:0:29:0:	class=0x0c0300 card=0x0d4d105b chip=0x27c88086 rev=0x01 hdr=0x00
    vendor     = 'Intel Corporation'
    device     = 'NM10/ICH7 Family USB UHCI Controller'
    class      = serial bus
    subclass   = USB
    bar   [20] = type I/O Port, range 32, base 0xd800, size 32, enabled

uhci1@pci0:0:29:1:	class=0x0c0300 card=0x0d4d105b chip=0x27c98086 rev=0x01 hdr=0x00
    vendor     = 'Intel Corporation'
    device     = 'NM10/ICH7 Family USB UHCI Controller'
    class      = serial bus
    subclass   = USB
    bar   [20] = type I/O Port, range 32, base 0xd880, size 32, enabled

uhci2@pci0:0:29:2:	class=0x0c0300 card=0x0d4d105b chip=0x27ca8086 rev=0x01 hdr=0x00
    vendor     = 'Intel Corporation'
    device     = 'NM10/ICH7 Family USB UHCI Controller'
    class      = serial bus
    subclass   = USB
    bar   [20] = type I/O Port, range 32, base 0xdc00, size 32, enabled

uhci3@pci0:0:29:3:	class=0x0c0300 card=0x0d4d105b chip=0x27cb8086 rev=0x01 hdr=0x00
    vendor     = 'Intel Corporation'
    device     = 'NM10/ICH7 Family USB UHCI Controller'
    class      = serial bus
    subclass   = USB
    bar   [20] = type I/O Port, range 32, base 0xe000, size 32, enabled

ehci0@pci0:0:29:7:	class=0x0c0320 card=0x0d4d105b chip=0x27cc8086 rev=0x01 hdr=0x00
    vendor     = 'Intel Corporation'
    device     = 'NM10/ICH7 Family USB2 EHCI Controller'
    class      = serial bus
    subclass   = USB
    bar   [10] = type Memory, range 32, base 0xffe3fc00, size 1024, enabled
    cap 01[50] = powerspec 2  supports D0 D3  current D0
    cap 0a[58] = EHCI Debug Port at offset 0xa0 in map 0x14

pcib1@pci0:0:30:0:	class=0x060401 card=0x0d4d105b chip=0x244e8086 rev=0xe1 hdr=0x01
    vendor     = 'Intel Corporation'
    device     = '82801 PCI Bridge'
    class      = bridge
    subclass   = PCI-PCI
    cap 0d[50] = PCI Bridge card=0x0d4d105b

isab0@pci0:0:31:0:	class=0x060100 card=0x0d4d105b chip=0x27b88086 rev=0x01 hdr=0x00
    vendor     = 'Intel Corporation'
    device     = '82801GB/GR (ICH7 Family) LPC Interface Bridge'
    class      = bridge
    subclass   = PCI-ISA
    cap 09[e0] = vendor (length 12) Intel cap 1 version 0
		 features: Quick Resume, SATA RAID-5, 6 PCI-e x1 slots, SATA RAID-0/1/10, SATA AHCI

atapci0@pci0:0:31:1:	class=0x01018a card=0x0d4d105b chip=0x27df8086 rev=0x01 hdr=0x00
    vendor     = 'Intel Corporation'
    device     = '82801G (ICH7 Family) IDE Controller'
    class      = mass storage
    subclass   = ATA
    bar   [20] = type I/O Port, range 32, base 0xffa0, size 16, enabled

atapci1@pci0:0:31:2:	class=0x01018f card=0x0d4d105b chip=0x27c08086 rev=0x01 hdr=0x00
    vendor     = 'Intel Corporation'
    device     = 'NM10/ICH7 Family SATA Controller [IDE mode]'
    class      = mass storage
    subclass   = ATA
    bar   [10] = type I/O Port, range 32, base 0xe880, size 8, enabled
    bar   [14] = type I/O Port, range 32, base 0xe800, size 4, enabled
    bar   [18] = type I/O Port, range 32, base 0xe480, size 8, enabled
    bar   [1c] = type I/O Port, range 32, base 0xe400, size 4, enabled
    bar   [20] = type I/O Port, range 32, base 0xe080, size 16, enabled
    cap 01[70] = powerspec 2  supports D0 D3  current D0

none0@pci0:0:31:3:	class=0x0c0500 card=0x0d4d105b chip=0x27da8086 rev=0x01 hdr=0x00
    vendor     = 'Intel Corporation'
    device     = 'NM10/ICH7 Family SMBus Controller'
    class      = serial bus
    subclass   = SMBus
    bar   [20] = type I/O Port, range 32, base 0x400, size 32, enabled

re0@pci0:1:2:0:	class=0x020000 card=0x816910ec chip=0x816910ec rev=0x10 hdr=0x00
    vendor     = 'Realtek Semiconductor Co., Ltd.'
    device     = 'RTL8169 PCI Gigabit Ethernet Controller'
    class      = network
    subclass   = ethernet
    bar   [10] = type I/O Port, range 32, base 0xc400, size 256, enabled
    bar   [14] = type Memory, range 32, base 0xffcff800, size 256, enabled

rl0@pci0:1:6:0:	class=0x020000 card=0x0d4d105b chip=0x813910ec rev=0x10 hdr=0x00
    vendor     = 'Realtek Semiconductor Co., Ltd.'
    device     = 'RTL-8100/8101L/8139 PCI Fast Ethernet Adapter'
    class      = network
    subclass   = ethernet
    bar   [10] = type I/O Port, range 32, base 0xc800, size 256, enabled
    bar   [14] = type Memory, range 32, base 0xffcffc00, size 256, enabled
    cap 01[50] = powerspec 2  supports D0 D1 D2 D3  current D0
