hostb0@pci0:0:0:0:	class=0x060000 rev=0x22 hdr=0x00 vendor=0x8086 device=0x3403 subvendor=0x8086 subdevice=0x34da
    vendor     = 'Intel Corporation'
    device     = '5500 I/O Hub to ESI Port'
    class      = bridge
    subclass   = HOST-PCI
    cap 05[60] = MSI supports 2 messages, vector masks 
    cap 10[90] = PCI-Express 2 root port max data 128(128) ARI disabled
                 max read 128
                 link x4(x4) speed 2.5(2.5) ASPM disabled(L0s/L1)
    cap 01[e0] = powerspec 3  supports D0 D3  current D0
    ecap 0001[100] = AER 1 0 fatal 0 non-fatal 0 corrected
    ecap 000d[150] = ACS 1
    ecap 000b[160] = Vendor [0] ID 0002 Rev 0 Length 12

pcib1@pci0:0:1:0:	class=0x060400 rev=0x22 hdr=0x01 vendor=0x8086 device=0x3408 subvendor=0x8086 subdevice=0x34da
    vendor     = 'Intel Corporation'
    device     = '5520/5500/X58 I/O Hub PCI Express Root Port 1'
    class      = bridge
    subclass   = PCI-PCI
    cap 0d[40] = PCI Bridge subvendor=0x8086 subdevice=0x34da
    cap 05[60] = MSI supports 2 messages, vector masks 
    cap 10[90] = PCI-Express 2 root port max data 256(256) ARI disabled
                 max read 128
                 link x1(x2) speed 2.5(5.0)
    cap 01[e0] = powerspec 3  supports D0 D3  current D0
    ecap 0001[100] = AER 1 0 fatal 0 non-fatal 0 corrected
    ecap 000d[150] = ACS 1
    ecap 000b[160] = Vendor [0] ID 0002 Rev 0 Length 12

pcib2@pci0:0:3:0:	class=0x060400 rev=0x22 hdr=0x01 vendor=0x8086 device=0x340a subvendor=0x8086 subdevice=0x34da
    vendor     = 'Intel Corporation'
    device     = '5520/5500/X58 I/O Hub PCI Express Root Port 3'
    class      = bridge
    subclass   = PCI-PCI
    cap 0d[40] = PCI Bridge subvendor=0x8086 subdevice=0x34da
    cap 05[60] = MSI supports 2 messages, vector masks 
    cap 10[90] = PCI-Express 2 root port max data 256(256) ARI disabled
                 max read 128
                 link x0(x4) speed 0.0(5.0)
                 slot 160 power limit 25000 mW Attn Button PC(on) MRL(closed) EI(disengaged)
    cap 01[e0] = powerspec 3  supports D0 D3  current D0
    ecap 0001[100] = AER 1 0 fatal 0 non-fatal 0 corrected
    ecap 000d[150] = ACS 1
    ecap 000b[160] = Vendor [0] ID 0002 Rev 0 Length 12

pcib3@pci0:0:7:0:	class=0x060400 rev=0x22 hdr=0x01 vendor=0x8086 device=0x340e subvendor=0x8086 subdevice=0x34da
    vendor     = 'Intel Corporation'
    device     = '5520/5500/X58 I/O Hub PCI Express Root Port 7'
    class      = bridge
    subclass   = PCI-PCI
    cap 0d[40] = PCI Bridge subvendor=0x8086 subdevice=0x34da
    cap 05[60] = MSI supports 2 messages, vector masks 
    cap 10[90] = PCI-Express 2 root port max data 256(256) ARI disabled
                 max read 128
                 link x0(x8) speed 0.0(5.0)
                 slot 192 power limit 25000 mW Attn Button PC(on) MRL(closed) EI(disengaged)
    cap 01[e0] = powerspec 3  supports D0 D3  current D0
    ecap 0001[100] = AER 1 0 fatal 0 non-fatal 0 corrected
    ecap 000d[150] = ACS 1
    ecap 000b[160] = Vendor [0] ID 0002 Rev 0 Length 12

pcib4@pci0:0:9:0:	class=0x060400 rev=0x22 hdr=0x01 vendor=0x8086 device=0x3410 subvendor=0x8086 subdevice=0x34da
    vendor     = 'Intel Corporation'
    device     = '7500/5520/5500/X58 I/O Hub PCI Express Root Port 9'
    class      = bridge
    subclass   = PCI-PCI
    cap 0d[40] = PCI Bridge subvendor=0x8086 subdevice=0x34da
    cap 05[60] = MSI supports 2 messages, vector masks 
    cap 10[90] = PCI-Express 2 root port max data 256(256) ARI disabled
                 max read 128
                 link x0(x8) speed 0.0(5.0)
                 slot 224 power limit 25000 mW Attn Button PC(on) MRL(closed) EI(disengaged)
    cap 01[e0] = powerspec 3  supports D0 D3  current D0
    ecap 0001[100] = AER 1 0 fatal 0 non-fatal 0 corrected
    ecap 000d[150] = ACS 1

none0@pci0:0:16:0:	class=0x080000 rev=0x22 hdr=0x00 vendor=0x8086 device=0x3425 subvendor=0x0086 subdevice=0x00da
    vendor     = 'Intel Corporation'
    device     = '7500/5520/5500/X58 Physical and Link Layer Registers Port 0'
    class      = base peripheral
    subclass   = interrupt controller
    cap 09[50] = vendor (length 255) Intel cap 15 version 0

none1@pci0:0:16:1:	class=0x080000 rev=0x22 hdr=0x00 vendor=0x8086 device=0x3426 subvendor=0x0086 subdevice=0x00da
    vendor     = 'Intel Corporation'
    device     = '7500/5520/5500/X58 Routing and Protocol Layer Registers Port 0'
    class      = base peripheral
    subclass   = interrupt controller

none2@pci0:0:17:0:	class=0x080000 rev=0x22 hdr=0x00 vendor=0x8086 device=0x3427 subvendor=0x0086 subdevice=0x00da
    vendor     = 'Intel Corporation'
    device     = '7500/5520/5500 Physical and Link Layer Registers Port 1'
    class      = base peripheral
    subclass   = interrupt controller
    cap 09[50] = vendor (length 255) Intel cap 15 version 0

none3@pci0:0:17:1:	class=0x080000 rev=0x22 hdr=0x00 vendor=0x8086 device=0x3428 subvendor=0x0086 subdevice=0x00da
    vendor     = 'Intel Corporation'
    device     = '7500/5520/5500 Routing & Protocol Layer Register Port 1'
    class      = base peripheral
    subclass   = interrupt controller

ioapic0@pci0:0:19:0:	class=0x080020 rev=0x22 hdr=0x00 vendor=0x8086 device=0x342d subvendor=0x0086 subdevice=0x00da
    vendor     = 'Intel Corporation'
    device     = '7500/5520/5500/X58 I/O Hub I/OxAPIC Interrupt Controller'
    class      = base peripheral
    subclass   = interrupt controller
    bar   [10] = type Memory, range 32, base 0xb1b44000, size 4096, enabled
    cap 01[6c] = powerspec 3  supports D0 D3  current D0

none4@pci0:0:20:0:	class=0x080000 rev=0x22 hdr=0x00 vendor=0x8086 device=0x342e subvendor=0x0086 subdevice=0x00da
    vendor     = 'Intel Corporation'
    device     = '7500/5520/5500/X58 I/O Hub System Management Registers'
    class      = base peripheral
    subclass   = interrupt controller
    cap 10[40] = PCI-Express 2 root endpoint max data 128(128)
                 max read 128
                 link x0(x0) ASPM disabled(L0s)

none5@pci0:0:20:1:	class=0x080000 rev=0x22 hdr=0x00 vendor=0x8086 device=0x3422 subvendor=0x0086 subdevice=0x00da
    vendor     = 'Intel Corporation'
    device     = '7500/5520/5500/X58 I/O Hub GPIO and Scratch Pad Registers'
    class      = base peripheral
    subclass   = interrupt controller
    cap 10[40] = PCI-Express 2 root endpoint max data 128(128)
                 max read 128
                 link x0(x0) ASPM disabled(L0s)

none6@pci0:0:20:2:	class=0x080000 rev=0x22 hdr=0x00 vendor=0x8086 device=0x3423 subvendor=0x0086 subdevice=0x00da
    vendor     = 'Intel Corporation'
    device     = '7500/5520/5500/X58 I/O Hub Control Status and RAS Registers'
    class      = base peripheral
    subclass   = interrupt controller
    cap 10[40] = PCI-Express 2 root endpoint max data 128(128)
                 max read 128
                 link x0(x0) ASPM disabled(L0s)

none7@pci0:0:20:3:	class=0x080000 rev=0x22 hdr=0x00 vendor=0x8086 device=0x3438 subvendor=0x0086 subdevice=0x00da
    vendor     = 'Intel Corporation'
    device     = '7500/5520/5500/X58 I/O Hub Throttle Registers'
    class      = base peripheral
    subclass   = interrupt controller

none8@pci0:0:21:0:	class=0x080020 rev=0x22 hdr=0x00 vendor=0x8086 device=0x342f subvendor=0x0086 subdevice=0x00da
    vendor     = 'Intel Corporation'
    device     = '7500/5520/5500/X58 Trusted Execution Technology Registers'
    class      = base peripheral
    subclass   = interrupt controller

ioat0@pci0:0:22:0:	class=0x088000 rev=0x22 hdr=0x00 vendor=0x8086 device=0x3430 subvendor=0x8086 subdevice=0x34da
    vendor     = 'Intel Corporation'
    device     = '5520/5500/X58 Chipset QuickData Technology Device'
    class      = base peripheral
    bar   [10] = type Memory, range 64, base 0xb1b20000, size 16384, enabled
    cap 11[80] = MSI-X supports 1 message, enabled
                 Table in map 0x10[0x2000], PBA in map 0x10[0x3000]
    cap 10[90] = PCI-Express 2 root endpoint max data 128(128)
                 max read 128
    cap 01[e0] = powerspec 3  supports D0 D3  current D0

ioat1@pci0:0:22:1:	class=0x088000 rev=0x22 hdr=0x00 vendor=0x8086 device=0x3431 subvendor=0x8086 subdevice=0x34da
    vendor     = 'Intel Corporation'
    device     = '5520/5500/X58 Chipset QuickData Technology Device'
    class      = base peripheral
    bar   [10] = type Memory, range 64, base 0xb1b24000, size 16384, enabled
    cap 11[80] = MSI-X supports 1 message, enabled
                 Table in map 0x10[0x2000], PBA in map 0x10[0x3000]
    cap 10[90] = PCI-Express 2 root endpoint max data 128(128)
                 max read 128
    cap 01[e0] = powerspec 3  supports D0 D3  current D0

ioat2@pci0:0:22:2:	class=0x088000 rev=0x22 hdr=0x00 vendor=0x8086 device=0x3432 subvendor=0x8086 subdevice=0x34da
    vendor     = 'Intel Corporation'
    device     = '5520/5500/X58 Chipset QuickData Technology Device'
    class      = base peripheral
    bar   [10] = type Memory, range 64, base 0xb1b28000, size 16384, enabled
    cap 11[80] = MSI-X supports 1 message, enabled
                 Table in map 0x10[0x2000], PBA in map 0x10[0x3000]
    cap 10[90] = PCI-Express 2 root endpoint max data 128(128)
                 max read 128
    cap 01[e0] = powerspec 3  supports D0 D3  current D0

ioat3@pci0:0:22:3:	class=0x088000 rev=0x22 hdr=0x00 vendor=0x8086 device=0x3433 subvendor=0x8086 subdevice=0x34da
    vendor     = 'Intel Corporation'
    device     = '5520/5500/X58 Chipset QuickData Technology Device'
    class      = base peripheral
    bar   [10] = type Memory, range 64, base 0xb1b2c000, size 16384, enabled
    cap 11[80] = MSI-X supports 1 message, enabled
                 Table in map 0x10[0x2000], PBA in map 0x10[0x3000]
    cap 10[90] = PCI-Express 2 root endpoint max data 128(128)
                 max read 128
    cap 01[e0] = powerspec 3  supports D0 D3  current D0

ioat4@pci0:0:22:4:	class=0x088000 rev=0x22 hdr=0x00 vendor=0x8086 device=0x3429 subvendor=0x8086 subdevice=0x34da
    vendor     = 'Intel Corporation'
    device     = '5520/5500/X58 Chipset QuickData Technology Device'
    class      = base peripheral
    bar   [10] = type Memory, range 64, base 0xb1b30000, size 16384, enabled
    cap 11[80] = MSI-X supports 1 message, enabled
                 Table in map 0x10[0x2000], PBA in map 0x10[0x3000]
    cap 10[90] = PCI-Express 2 root endpoint max data 128(128)
                 max read 128
    cap 01[e0] = powerspec 3  supports D0 D3  current D0

ioat5@pci0:0:22:5:	class=0x088000 rev=0x22 hdr=0x00 vendor=0x8086 device=0x342a subvendor=0x8086 subdevice=0x34da
    vendor     = 'Intel Corporation'
    device     = '5520/5500/X58 Chipset QuickData Technology Device'
    class      = base peripheral
    bar   [10] = type Memory, range 64, base 0xb1b34000, size 16384, enabled
    cap 11[80] = MSI-X supports 1 message, enabled
                 Table in map 0x10[0x2000], PBA in map 0x10[0x3000]
    cap 10[90] = PCI-Express 2 root endpoint max data 128(128)
                 max read 128
    cap 01[e0] = powerspec 3  supports D0 D3  current D0

ioat6@pci0:0:22:6:	class=0x088000 rev=0x22 hdr=0x00 vendor=0x8086 device=0x342b subvendor=0x8086 subdevice=0x34da
    vendor     = 'Intel Corporation'
    device     = '5520/5500/X58 Chipset QuickData Technology Device'
    class      = base peripheral
    bar   [10] = type Memory, range 64, base 0xb1b38000, size 16384, enabled
    cap 11[80] = MSI-X supports 1 message, enabled
                 Table in map 0x10[0x2000], PBA in map 0x10[0x3000]
    cap 10[90] = PCI-Express 2 root endpoint max data 128(128)
                 max read 128
    cap 01[e0] = powerspec 3  supports D0 D3  current D0

ioat7@pci0:0:22:7:	class=0x088000 rev=0x22 hdr=0x00 vendor=0x8086 device=0x342c subvendor=0x8086 subdevice=0x34da
    vendor     = 'Intel Corporation'
    device     = '5520/5500/X58 Chipset QuickData Technology Device'
    class      = base peripheral
    bar   [10] = type Memory, range 64, base 0xb1b3c000, size 16384, enabled
    cap 11[80] = MSI-X supports 1 message, enabled
                 Table in map 0x10[0x2000], PBA in map 0x10[0x3000]
    cap 10[90] = PCI-Express 2 root endpoint max data 128(128)
                 max read 128
    cap 01[e0] = powerspec 3  supports D0 D3  current D0

em1@pci0:0:25:0:	class=0x020000 rev=0x00 hdr=0x00 vendor=0x8086 device=0x10cc subvendor=0x8086 subdevice=0x34da
    vendor     = 'Intel Corporation'
    device     = '82567LM-2 Gigabit Network Connection'
    class      = network
    subclass   = ethernet
    bar   [10] = type Memory, range 32, base 0xb1b00000, size 131072, enabled
    bar   [14] = type Memory, range 32, base 0xb1b43000, size 4096, enabled
    bar   [18] = type I/O Port, range 32, base 0x20e0, size 32, enabled
    cap 01[c8] = powerspec 2  supports D0 D3  current D0
    cap 05[d0] = MSI supports 1 message, 64 bit enabled with 1 message
    cap 13[e0] = PCI Advanced Features: FLR TP

uhci0@pci0:0:26:0:	class=0x0c0300 rev=0x00 hdr=0x00 vendor=0x8086 device=0x3a37 subvendor=0x8086 subdevice=0x34da
    vendor     = 'Intel Corporation'
    device     = '82801JI (ICH10 Family) USB UHCI Controller'
    class      = serial bus
    subclass   = USB
    bar   [20] = type I/O Port, range 32, base 0x20c0, size 32, enabled
    cap 13[50] = PCI Advanced Features: FLR TP

uhci1@pci0:0:26:1:	class=0x0c0300 rev=0x00 hdr=0x00 vendor=0x8086 device=0x3a38 subvendor=0x8086 subdevice=0x34da
    vendor     = 'Intel Corporation'
    device     = '82801JI (ICH10 Family) USB UHCI Controller'
    class      = serial bus
    subclass   = USB
    bar   [20] = type I/O Port, range 32, base 0x20a0, size 32, enabled
    cap 13[50] = PCI Advanced Features: FLR TP

uhci2@pci0:0:26:2:	class=0x0c0300 rev=0x00 hdr=0x00 vendor=0x8086 device=0x3a39 subvendor=0x8086 subdevice=0x34da
    vendor     = 'Intel Corporation'
    device     = '82801JI (ICH10 Family) USB UHCI Controller'
    class      = serial bus
    subclass   = USB
    bar   [20] = type I/O Port, range 32, base 0x2080, size 32, enabled
    cap 13[50] = PCI Advanced Features: FLR TP

ehci0@pci0:0:26:7:	class=0x0c0320 rev=0x00 hdr=0x00 vendor=0x8086 device=0x3a3c subvendor=0x8086 subdevice=0x34da
    vendor     = 'Intel Corporation'
    device     = '82801JI (ICH10 Family) USB2 EHCI Controller'
    class      = serial bus
    subclass   = USB
    bar   [10] = type Memory, range 32, base 0xb1b41000, size 1024, enabled
    cap 01[50] = powerspec 2  supports D0 D3  current D0
    cap 0a[58] = EHCI Debug Port at offset 0xa0 in map 0x14
    cap 13[98] = PCI Advanced Features: FLR TP

pcib5@pci0:0:28:0:	class=0x060400 rev=0x00 hdr=0x01 vendor=0x8086 device=0x3a40 subvendor=0x8086 subdevice=0x34da
    vendor     = 'Intel Corporation'
    device     = '82801JI (ICH10 Family) PCI Express Root Port 1'
    class      = bridge
    subclass   = PCI-PCI
    cap 10[40] = PCI-Express 1 root port max data 128(128)
                 max read 128
                 link x0(x4) speed 0.0(2.5) ASPM L0s/L1(L0s/L1)
                 slot 1 power limit 25000 mW HotPlug(empty) surprise
    cap 05[80] = MSI supports 1 message enabled with 1 message
    cap 0d[90] = PCI Bridge subvendor=0x8086 subdevice=0x34da
    cap 01[a0] = powerspec 2  supports D0 D3  current D0
    ecap 0002[100] = VC 1 max VC0
    ecap 0005[180] = Root Complex Link Declaration 1

pcib6@pci0:0:28:4:	class=0x060400 rev=0x00 hdr=0x01 vendor=0x8086 device=0x3a48 subvendor=0x8086 subdevice=0x34da
    vendor     = 'Intel Corporation'
    device     = '82801JI (ICH10 Family) PCI Express Root Port 5'
    class      = bridge
    subclass   = PCI-PCI
    cap 10[40] = PCI-Express 1 root port max data 128(128)
                 max read 128
                 link x1(x1) speed 2.5(2.5) ASPM disabled(L0s/L1)
                 slot 5 power limit 10000 mW HotPlug(present) surprise
    cap 05[80] = MSI supports 1 message enabled with 1 message
    cap 0d[90] = PCI Bridge subvendor=0x8086 subdevice=0x34da
    cap 01[a0] = powerspec 2  supports D0 D3  current D0
    ecap 0002[100] = VC 1 max VC0
    ecap 0005[180] = Root Complex Link Declaration 1

uhci3@pci0:0:29:0:	class=0x0c0300 rev=0x00 hdr=0x00 vendor=0x8086 device=0x3a34 subvendor=0x8086 subdevice=0x34da
    vendor     = 'Intel Corporation'
    device     = '82801JI (ICH10 Family) USB UHCI Controller'
    class      = serial bus
    subclass   = USB
    bar   [20] = type I/O Port, range 32, base 0x2060, size 32, enabled
    cap 13[50] = PCI Advanced Features: FLR TP

uhci4@pci0:0:29:1:	class=0x0c0300 rev=0x00 hdr=0x00 vendor=0x8086 device=0x3a35 subvendor=0x8086 subdevice=0x34da
    vendor     = 'Intel Corporation'
    device     = '82801JI (ICH10 Family) USB UHCI Controller'
    class      = serial bus
    subclass   = USB
    bar   [20] = type I/O Port, range 32, base 0x2040, size 32, enabled
    cap 13[50] = PCI Advanced Features: FLR TP

uhci5@pci0:0:29:2:	class=0x0c0300 rev=0x00 hdr=0x00 vendor=0x8086 device=0x3a36 subvendor=0x8086 subdevice=0x34da
    vendor     = 'Intel Corporation'
    device     = '82801JI (ICH10 Family) USB UHCI Controller'
    class      = serial bus
    subclass   = USB
    bar   [20] = type I/O Port, range 32, base 0x2020, size 32, enabled
    cap 13[50] = PCI Advanced Features: FLR TP

ehci1@pci0:0:29:7:	class=0x0c0320 rev=0x00 hdr=0x00 vendor=0x8086 device=0x3a3a subvendor=0x8086 subdevice=0x34da
    vendor     = 'Intel Corporation'
    device     = '82801JI (ICH10 Family) USB2 EHCI Controller'
    class      = serial bus
    subclass   = USB
    bar   [10] = type Memory, range 32, base 0xb1b40000, size 1024, enabled
    cap 01[50] = powerspec 2  supports D0 D3  current D0
    cap 0a[58] = EHCI Debug Port at offset 0xa0 in map 0x14
    cap 13[98] = PCI Advanced Features: FLR TP

pcib7@pci0:0:30:0:	class=0x060401 rev=0x90 hdr=0x01 vendor=0x8086 device=0x244e subvendor=0x8086 subdevice=0x34da
    vendor     = 'Intel Corporation'
    device     = '82801 PCI Bridge'
    class      = bridge
    subclass   = PCI-PCI
    cap 0d[50] = PCI Bridge subvendor=0x8086 subdevice=0x34da

isab0@pci0:0:31:0:	class=0x060100 rev=0x00 hdr=0x00 vendor=0x8086 device=0x3a16 subvendor=0x8086 subdevice=0x34da
    vendor     = 'Intel Corporation'
    device     = '82801JIR (ICH10R) LPC Interface Controller'
    class      = bridge
    subclass   = PCI-ISA
    cap 09[e0] = vendor (length 12) Intel cap 1 version 0
		 features: SATA RAID-5, 4 PCI-e x1 slots

atapci0@pci0:0:31:2:	class=0x01018f rev=0x00 hdr=0x00 vendor=0x8086 device=0x3a20 subvendor=0x8086 subdevice=0x34da
    vendor     = 'Intel Corporation'
    device     = '82801JI (ICH10 Family) 4 port SATA IDE Controller'
    class      = mass storage
    subclass   = ATA
    bar   [10] = type I/O Port, range 32, base 0x2158, size 8, enabled
    bar   [14] = type I/O Port, range 32, base 0x216c, size 4, enabled
    bar   [18] = type I/O Port, range 32, base 0x2150, size 8, enabled
    bar   [1c] = type I/O Port, range 32, base 0x2168, size 4, enabled
    bar   [20] = type I/O Port, range 32, base 0x2130, size 16, enabled
    bar   [24] = type I/O Port, range 32, base 0x2120, size 16, enabled
    cap 01[70] = powerspec 3  supports D0 D3  current D0
    cap 13[b0] = PCI Advanced Features: FLR TP

ichsmb0@pci0:0:31:3:	class=0x0c0500 rev=0x00 hdr=0x00 vendor=0x8086 device=0x3a30 subvendor=0x8086 subdevice=0x34da
    vendor     = 'Intel Corporation'
    device     = '82801JI (ICH10 Family) SMBus Controller'
    class      = serial bus
    subclass   = SMBus
    bar   [10] = type Memory, range 64, base 0xb1b42000, size 256, enabled
    bar   [20] = type I/O Port, range 32, base 0x2000, size 32, enabled

atapci1@pci0:0:31:5:	class=0x010185 rev=0x00 hdr=0x00 vendor=0x8086 device=0x3a26 subvendor=0x8086 subdevice=0x34da
    vendor     = 'Intel Corporation'
    device     = '82801JI (ICH10 Family) 2 port SATA IDE Controller'
    class      = mass storage
    subclass   = ATA
    bar   [10] = type I/O Port, range 32, base 0x2148, size 8, enabled
    bar   [14] = type I/O Port, range 32, base 0x2164, size 4, enabled
    bar   [18] = type I/O Port, range 32, base 0x2140, size 8, enabled
    bar   [1c] = type I/O Port, range 32, base 0x2160, size 4, enabled
    bar   [20] = type I/O Port, range 32, base 0x2110, size 16, enabled
    bar   [24] = type I/O Port, range 32, base 0x2100, size 16, enabled
    cap 01[70] = powerspec 3  supports D0 D3  current D0
    cap 13[b0] = PCI Advanced Features: FLR TP

em0@pci0:1:0:0:	class=0x020000 rev=0x00 hdr=0x00 vendor=0x8086 device=0x10d3 subvendor=0x8086 subdevice=0x34da
    vendor     = 'Intel Corporation'
    device     = '82574L Gigabit Network Connection'
    class      = network
    subclass   = ethernet
    bar   [10] = type Memory, range 32, base 0xb1a00000, size 131072, enabled
    bar   [14] = type Memory, range 32, base 0xb1900000, size 1048576, enabled
    bar   [18] = type I/O Port, range 32, base 0x1000, size 32, enabled
    bar   [1c] = type Memory, range 32, base 0xb1a20000, size 16384, enabled
    cap 01[c8] = powerspec 2  supports D0 D3  current D0
    cap 05[d0] = MSI supports 1 message, 64 bit 
    cap 10[e0] = PCI-Express 1 endpoint max data 256(256) RO NS
                 max read 512
                 link x1(x1) speed 2.5(2.5) ASPM disabled(L0s/L1)
    cap 11[a0] = MSI-X supports 5 messages, enabled
                 Table in map 0x1c[0x0], PBA in map 0x1c[0x2000]
    ecap 0001[100] = AER 1 0 fatal 0 non-fatal 1 corrected
    ecap 0003[140] = Serial 1 001517ffffeeed19

vgapci0@pci0:6:0:0:	class=0x030000 rev=0x02 hdr=0x00 vendor=0x102b device=0x0522 subvendor=0x8086 subdevice=0x0101
    vendor     = 'Matrox Electronics Systems Ltd.'
    device     = 'MGA G200e [Pilot] ServerEngines (SEP1)'
    class      = display
    subclass   = VGA
    bar   [10] = type Prefetchable Memory, range 32, base 0xb0000000, size 16777216, enabled
    bar   [14] = type Memory, range 32, base 0xb1800000, size 16384, enabled
    bar   [18] = type Memory, range 32, base 0xb1000000, size 8388608, enabled
    cap 01[dc] = powerspec 2  supports D0 D3  current D0
    cap 10[e4] = PCI-Express 1 legacy endpoint max data 128(128)
                 max read 128
                 link x1(x1) speed 2.5(2.5) ASPM disabled(L0s)
    cap 05[54] = MSI supports 1 message 
