hostb0@pci0:0:0:0:	class=0x060000 rev=0x0b hdr=0x00 vendor=0x8086 device=0x5af0 subvendor=0x8086 subdevice=0x7270
    vendor     = 'Intel Corporation'
    device     = 'Celeron N3350/Pentium N4200/Atom E3900 Series Host Bridge'
    class      = bridge
    subclass   = HOST-PCI

vgapci0@pci0:0:2:0:	class=0x030000 rev=0x0b hdr=0x00 vendor=0x8086 device=0x5a85 subvendor=0x8086 subdevice=0x2212
    vendor     = 'Intel Corporation'
    device     = 'HD Graphics 500'
    class      = display
    subclass   = VGA
    bar   [10] = type Memory, range 64, base 0x88000000, size 16777216, enabled
    bar   [18] = type Prefetchable Memory, range 64, base 0x80000000, size 134217728, enabled
    bar   [20] = type I/O Port, range 32, base 0xf000, size 64, enabled
    cap 09[40] = vendor (length 12) Intel cap 0 version 1
    cap 10[70] = PCI-Express 2 root endpoint max data 128(128) FLR
                 max read 128
    cap 05[ac] = MSI supports 1 message 
    cap 01[d0] = powerspec 2  supports D0 D3  current D0
    ecap 001b[100] = Process Address Space ID 1
    ecap 000f[200] = ATS 1
    ecap 0013[300] = Page Page Request 1

none0@pci0:0:15:0:	class=0x078000 rev=0x0b hdr=0x00 vendor=0x8086 device=0x5a9a subvendor=0x8086 subdevice=0x7270
    vendor     = 'Intel Corporation'
    device     = 'Celeron N3350/Pentium N4200/Atom E3900 Series Trusted Execution Engine'
    class      = simple comms
    bar   [10] = type Memory, range 64, base 0x89438000, size 4096, enabled
    cap 01[50] = powerspec 3  supports D0 D3  current D0
    cap 05[8c] = MSI supports 1 message, 64 bit 
    cap 09[a4] = vendor (length 20) Intel cap 15 version 0

ahci0@pci0:0:18:0:	class=0x010601 rev=0x0b hdr=0x00 vendor=0x8086 device=0x5ae3 subvendor=0x8086 subdevice=0x7270
    vendor     = 'Intel Corporation'
    device     = 'Celeron N3350/Pentium N4200/Atom E3900 Series SATA AHCI Controller'
    class      = mass storage
    subclass   = SATA
    bar   [10] = type Memory, range 32, base 0x89410000, size 8192, enabled
    bar   [14] = type Memory, range 32, base 0x89435000, size 256, enabled
    bar   [18] = type I/O Port, range 32, base 0xf090, size 8, enabled
    bar   [1c] = type I/O Port, range 32, base 0xf080, size 4, enabled
    bar   [20] = type I/O Port, range 32, base 0xf060, size 32, enabled
    bar   [24] = type Memory, range 32, base 0x89434000, size 2048, enabled
    cap 05[80] = MSI supports 1 message enabled with 1 message
    cap 01[70] = powerspec 3  supports D0 D3  current D0
    cap 12[a8] = SATA Index-Data Pair

pcib1@pci0:0:19:0:	class=0x060400 rev=0xfb hdr=0x01 vendor=0x8086 device=0x5ad8 subvendor=0x0000 subdevice=0x0000
    vendor     = 'Intel Corporation'
    device     = 'Celeron N3350/Pentium N4200/Atom E3900 Series PCI Express Port A'
    class      = bridge
    subclass   = PCI-PCI
    cap 10[40] = PCI-Express 2 root port max data 256(256) ARI disabled
                 max read 128
                 link x0(x1) speed 0.0(5.0)
                 slot 2 power limit 100 mW
    cap 05[80] = MSI supports 1 message 
    cap 0d[90] = PCI Bridge subvendor=0x0000 subdevice=0x0000
    cap 01[a0] = powerspec 3  supports D0 D3  current D0
    ecap 0000[100] = unknown 0
    ecap 000d[140] = ACS 1
    ecap 001f[150] = Precision Time Measurement 1
    ecap 0000[200] = unknown 0
    ecap 0000[220] = unknown 0

pcib2@pci0:0:19:1:	class=0x060400 rev=0xfb hdr=0x01 vendor=0x8086 device=0x5ad9 subvendor=0x0000 subdevice=0x0000
    vendor     = 'Intel Corporation'
    device     = 'Celeron N3350/Pentium N4200/Atom E3900 Series PCI Express Port A'
    class      = bridge
    subclass   = PCI-PCI
    cap 10[40] = PCI-Express 2 root port max data 128(256) ARI disabled
                 max read 128
                 link x1(x1) speed 2.5(5.0)
                 slot 3 power limit 100 mW
    cap 05[80] = MSI supports 1 message 
    cap 0d[90] = PCI Bridge subvendor=0x0000 subdevice=0x0000
    cap 01[a0] = powerspec 3  supports D0 D3  current D0
    ecap 0000[100] = unknown 0
    ecap 000d[140] = ACS 1
    ecap 001f[150] = Precision Time Measurement 1
    ecap 0000[200] = unknown 0
    ecap 0000[220] = unknown 0

pcib3@pci0:0:19:2:	class=0x060400 rev=0xfb hdr=0x01 vendor=0x8086 device=0x5ada subvendor=0x0000 subdevice=0x0000
    vendor     = 'Intel Corporation'
    device     = 'Celeron N3350/Pentium N4200/Atom E3900 Series PCI Express Port A'
    class      = bridge
    subclass   = PCI-PCI
    cap 10[40] = PCI-Express 2 root port max data 128(256) ARI disabled
                 max read 128
                 link x1(x1) speed 2.5(5.0)
                 slot 4 power limit 100 mW
    cap 05[80] = MSI supports 1 message 
    cap 0d[90] = PCI Bridge subvendor=0x0000 subdevice=0x0000
    cap 01[a0] = powerspec 3  supports D0 D3  current D0
    ecap 0000[100] = unknown 0
    ecap 000d[140] = ACS 1
    ecap 001f[150] = Precision Time Measurement 1
    ecap 0000[200] = unknown 0
    ecap 0000[220] = unknown 0

pcib4@pci0:0:19:3:	class=0x060400 rev=0xfb hdr=0x01 vendor=0x8086 device=0x5adb subvendor=0x0000 subdevice=0x0000
    vendor     = 'Intel Corporation'
    device     = 'Celeron N3350/Pentium N4200/Atom E3900 Series PCI Express Port A'
    class      = bridge
    subclass   = PCI-PCI
    cap 10[40] = PCI-Express 2 root port max data 256(256) ARI disabled
                 max read 128
                 link x0(x1) speed 0.0(5.0)
                 slot 5 power limit 100 mW
    cap 05[80] = MSI supports 1 message 
    cap 0d[90] = PCI Bridge subvendor=0x0000 subdevice=0x0000
    cap 01[a0] = powerspec 3  supports D0 D3  current D0
    ecap 0000[100] = unknown 0
    ecap 000d[140] = ACS 1
    ecap 001f[150] = Precision Time Measurement 1
    ecap 0000[200] = unknown 0
    ecap 0000[220] = unknown 0

pcib5@pci0:0:20:0:	class=0x060400 rev=0xfb hdr=0x01 vendor=0x8086 device=0x5ad6 subvendor=0x0000 subdevice=0x0000
    vendor     = 'Intel Corporation'
    device     = 'Celeron N3350/Pentium N4200/Atom E3900 Series PCI Express Port B'
    class      = bridge
    subclass   = PCI-PCI
    cap 10[40] = PCI-Express 2 root port max data 256(256) ARI disabled
                 max read 128
                 link x0(x1) speed 0.0(5.0)
    cap 05[80] = MSI supports 1 message 
    cap 0d[90] = PCI Bridge subvendor=0x0000 subdevice=0x0000
    cap 01[a0] = powerspec 3  supports D0 D3  current D0
    ecap 0000[100] = unknown 0
    ecap 000d[140] = ACS 1
    ecap 001f[150] = Precision Time Measurement 1
    ecap 0000[200] = unknown 0
    ecap 0000[220] = unknown 0

pcib6@pci0:0:20:1:	class=0x060400 rev=0xfb hdr=0x01 vendor=0x8086 device=0x5ad7 subvendor=0x0000 subdevice=0x0000
    vendor     = 'Intel Corporation'
    device     = 'Celeron N3350/Pentium N4200/Atom E3900 Series PCI Express Port B'
    class      = bridge
    subclass   = PCI-PCI
    cap 10[40] = PCI-Express 2 root port max data 256(256) ARI disabled
                 max read 128
                 link x0(x1) speed 0.0(5.0)
    cap 05[80] = MSI supports 1 message 
    cap 0d[90] = PCI Bridge subvendor=0x0000 subdevice=0x0000
    cap 01[a0] = powerspec 3  supports D0 D3  current D0
    ecap 0000[100] = unknown 0
    ecap 000d[140] = ACS 1
    ecap 001f[150] = Precision Time Measurement 1
    ecap 0000[200] = unknown 0
    ecap 0000[220] = unknown 0

xhci0@pci0:0:21:0:	class=0x0c0330 rev=0x0b hdr=0x00 vendor=0x8086 device=0x5aa8 subvendor=0x8086 subdevice=0x7270
    vendor     = 'Intel Corporation'
    device     = 'Celeron N3350/Pentium N4200/Atom E3900 Series USB xHCI'
    class      = serial bus
    subclass   = USB
    bar   [10] = type Memory, range 64, base 0x89400000, size 65536, enabled
    cap 01[70] = powerspec 2  supports D0 D3  current D0
    cap 05[80] = MSI supports 8 messages, 64 bit enabled with 1 message
    cap 09[90] = vendor (length 20) Intel cap 15 version 0

none1@pci0:0:21:1:	class=0x0c03fe rev=0x0b hdr=0x00 vendor=0x8086 device=0x5aaa subvendor=0x8086 subdevice=0x7270
    vendor     = 'Intel Corporation'
    class      = serial bus
    subclass   = USB
    bar   [10] = type Memory, range 64, base 0x89000000, size 2097152, enabled
    bar   [18] = type Memory, range 64, base 0x89433000, size 4096, enabled
    cap 01[80] = powerspec 3  supports D0 D3  current D0
    cap 09[90] = vendor (length 20) Intel cap 15 version 0

ig4iic0@pci0:0:22:0:	class=0x118000 rev=0x0b hdr=0x00 vendor=0x8086 device=0x5aac subvendor=0x8086 subdevice=0x7270
    vendor     = 'Intel Corporation'
    device     = 'Celeron N3350/Pentium N4200/Atom E3900 Series I2C Controller'
    class      = dasp
    bar   [10] = type Memory, range 64, base 0x89432000, size 4096, enabled
    bar   [18] = type Memory, range 64, base 0x89431000, size 4096, enabled
    cap 01[80] = powerspec 3  supports D0 D3  current D0
    cap 09[90] = vendor (length 20) Intel cap 15 version 0

ig4iic1@pci0:0:22:1:	class=0x118000 rev=0x0b hdr=0x00 vendor=0x8086 device=0x5aae subvendor=0x8086 subdevice=0x7270
    vendor     = 'Intel Corporation'
    device     = 'Celeron N3350/Pentium N4200/Atom E3900 Series I2C Controller'
    class      = dasp
    bar   [10] = type Memory, range 64, base 0x89430000, size 4096, enabled
    bar   [18] = type Memory, range 64, base 0x8942f000, size 4096, enabled
    cap 01[80] = powerspec 3  supports D0 D3  current D0
    cap 09[90] = vendor (length 20) Intel cap 15 version 0

ig4iic2@pci0:0:22:2:	class=0x118000 rev=0x0b hdr=0x00 vendor=0x8086 device=0x5ab0 subvendor=0x8086 subdevice=0x7270
    vendor     = 'Intel Corporation'
    device     = 'Celeron N3350/Pentium N4200/Atom E3900 Series I2C Controller'
    class      = dasp
    bar   [10] = type Memory, range 64, base 0x8942e000, size 4096, enabled
    bar   [18] = type Memory, range 64, base 0x8942d000, size 4096, enabled
    cap 01[80] = powerspec 3  supports D0 D3  current D0
    cap 09[90] = vendor (length 20) Intel cap 15 version 0

ig4iic3@pci0:0:22:3:	class=0x118000 rev=0x0b hdr=0x00 vendor=0x8086 device=0x5ab2 subvendor=0x8086 subdevice=0x7270
    vendor     = 'Intel Corporation'
    device     = 'Celeron N3350/Pentium N4200/Atom E3900 Series I2C Controller'
    class      = dasp
    bar   [10] = type Memory, range 64, base 0x8942c000, size 4096, enabled
    bar   [18] = type Memory, range 64, base 0x8942b000, size 4096, enabled
    cap 01[80] = powerspec 3  supports D0 D3  current D0
    cap 09[90] = vendor (length 20) Intel cap 15 version 0

ig4iic4@pci0:0:23:0:	class=0x118000 rev=0x0b hdr=0x00 vendor=0x8086 device=0x5ab4 subvendor=0x8086 subdevice=0x7270
    vendor     = 'Intel Corporation'
    device     = 'Celeron N3350/Pentium N4200/Atom E3900 Series I2C Controller'
    class      = dasp
    bar   [10] = type Memory, range 64, base 0x8942a000, size 4096, enabled
    bar   [18] = type Memory, range 64, base 0x89429000, size 4096, enabled
    cap 01[80] = powerspec 3  supports D0 D3  current D0
    cap 09[90] = vendor (length 20) Intel cap 15 version 0

ig4iic5@pci0:0:23:1:	class=0x118000 rev=0x0b hdr=0x00 vendor=0x8086 device=0x5ab6 subvendor=0x8086 subdevice=0x7270
    vendor     = 'Intel Corporation'
    device     = 'Celeron N3350/Pentium N4200/Atom E3900 Series I2C Controller'
    class      = dasp
    bar   [10] = type Memory, range 64, base 0x89428000, size 4096, enabled
    bar   [18] = type Memory, range 64, base 0x89427000, size 4096, enabled
    cap 01[80] = powerspec 3  supports D0 D3  current D0
    cap 09[90] = vendor (length 20) Intel cap 15 version 0

ig4iic6@pci0:0:23:2:	class=0x118000 rev=0x0b hdr=0x00 vendor=0x8086 device=0x5ab8 subvendor=0x8086 subdevice=0x7270
    vendor     = 'Intel Corporation'
    device     = 'Celeron N3350/Pentium N4200/Atom E3900 Series I2C Controller'
    class      = dasp
    bar   [10] = type Memory, range 64, base 0x89426000, size 4096, enabled
    bar   [18] = type Memory, range 64, base 0x89425000, size 4096, enabled
    cap 01[80] = powerspec 3  supports D0 D3  current D0
    cap 09[90] = vendor (length 20) Intel cap 15 version 0

ig4iic7@pci0:0:23:3:	class=0x118000 rev=0x0b hdr=0x00 vendor=0x8086 device=0x5aba subvendor=0x8086 subdevice=0x7270
    vendor     = 'Intel Corporation'
    device     = 'Celeron N3350/Pentium N4200/Atom E3900 Series I2C Controller'
    class      = dasp
    bar   [10] = type Memory, range 64, base 0x89424000, size 4096, enabled
    bar   [18] = type Memory, range 64, base 0x89423000, size 4096, enabled
    cap 01[80] = powerspec 3  supports D0 D3  current D0
    cap 09[90] = vendor (length 20) Intel cap 15 version 0

uart2@pci0:0:24:0:	class=0x118000 rev=0x0b hdr=0x00 vendor=0x8086 device=0x5abc subvendor=0x8086 subdevice=0x7270
    vendor     = 'Intel Corporation'
    device     = 'Celeron N3350/Pentium N4200/Atom E3900 Series HSUART Controller'
    class      = dasp
    bar   [10] = type Memory, range 64, base 0x89422000, size 4096, enabled
    bar   [18] = type Memory, range 64, base 0x89421000, size 4096, enabled
    cap 01[80] = powerspec 3  supports D0 D3  current D0
    cap 09[90] = vendor (length 20) Intel cap 15 version 0

uart3@pci0:0:24:1:	class=0x118000 rev=0x0b hdr=0x00 vendor=0x8086 device=0x5abe subvendor=0x8086 subdevice=0x7270
    vendor     = 'Intel Corporation'
    device     = 'Celeron N3350/Pentium N4200/Atom E3900 Series HSUART Controller'
    class      = dasp
    bar   [10] = type Memory, range 64, base 0x89420000, size 4096, enabled
    bar   [18] = type Memory, range 64, base 0x8941f000, size 4096, enabled
    cap 01[80] = powerspec 3  supports D0 D3  current D0
    cap 09[90] = vendor (length 20) Intel cap 15 version 0

none2@pci0:0:25:0:	class=0x118000 rev=0x0b hdr=0x00 vendor=0x8086 device=0x5ac2 subvendor=0x8086 subdevice=0x7270
    vendor     = 'Intel Corporation'
    device     = 'Celeron N3350/Pentium N4200/Atom E3900 Series SPI Controller'
    class      = dasp
    bar   [10] = type Memory, range 64, base 0x8941e000, size 4096, enabled
    bar   [18] = type Memory, range 64, base 0x8941d000, size 4096, enabled
    cap 01[80] = powerspec 3  supports D0 D3  current D0
    cap 09[90] = vendor (length 20) Intel cap 15 version 0

none3@pci0:0:25:1:	class=0x118000 rev=0x0b hdr=0x00 vendor=0x8086 device=0x5ac4 subvendor=0x8086 subdevice=0x7270
    vendor     = 'Intel Corporation'
    device     = 'Celeron N3350/Pentium N4200/Atom E3900 Series SPI Controller'
    class      = dasp
    bar   [10] = type Memory, range 64, base 0x8941c000, size 4096, enabled
    bar   [18] = type Memory, range 64, base 0x8941b000, size 4096, enabled
    cap 01[80] = powerspec 3  supports D0 D3  current D0
    cap 09[90] = vendor (length 20) Intel cap 15 version 0

none4@pci0:0:25:2:	class=0x118000 rev=0x0b hdr=0x00 vendor=0x8086 device=0x5ac6 subvendor=0x8086 subdevice=0x7270
    vendor     = 'Intel Corporation'
    device     = 'Celeron N3350/Pentium N4200/Atom E3900 Series SPI Controller'
    class      = dasp
    bar   [10] = type Memory, range 64, base 0x8941a000, size 4096, enabled
    bar   [18] = type Memory, range 64, base 0x89419000, size 4096, enabled
    cap 01[80] = powerspec 3  supports D0 D3  current D0
    cap 09[90] = vendor (length 20) Intel cap 15 version 0

none5@pci0:0:26:0:	class=0x0c8000 rev=0x0b hdr=0x00 vendor=0x8086 device=0x5ac8 subvendor=0x8086 subdevice=0x7270
    vendor     = 'Intel Corporation'
    device     = 'Celeron N3350/Pentium N4200/Atom E3900 Series PWM Pin Controller'
    class      = serial bus
    bar   [10] = type Memory, range 64, base 0x89418000, size 4096, enabled
    bar   [18] = type Memory, range 64, base 0x89417000, size 4096, enabled
    cap 01[80] = powerspec 3  supports D0 D3  current D0
    cap 09[90] = vendor (length 20) Intel cap 15 version 0

sdhci_pci0@pci0:0:28:0:	class=0x080501 rev=0x0b hdr=0x00 vendor=0x8086 device=0x5acc subvendor=0x8086 subdevice=0x7270
    vendor     = 'Intel Corporation'
    device     = 'Celeron N3350/Pentium N4200/Atom E3900 Series eMMC Controller'
    class      = base peripheral
    subclass   = SD host controller
    bar   [10] = type Memory, range 64, base 0x89416000, size 4096, enabled
    bar   [18] = type Memory, range 64, base 0x89415000, size 4096, enabled
    cap 01[80] = powerspec 3  supports D0 D3  current D0
    cap 09[90] = vendor (length 20) Intel cap 15 version 0

sdhci_pci1@pci0:0:30:0:	class=0x080501 rev=0x0b hdr=0x00 vendor=0x8086 device=0x5ad0 subvendor=0x8086 subdevice=0x7270
    vendor     = 'Intel Corporation'
    device     = 'Celeron N3350/Pentium N4200/Atom E3900 Series SDIO Controller'
    class      = base peripheral
    subclass   = SD host controller
    bar   [10] = type Memory, range 64, base 0x89414000, size 4096, enabled
    bar   [18] = type Memory, range 64, base 0x89413000, size 4096, enabled
    cap 01[80] = powerspec 3  supports D0 D3  current D0
    cap 09[90] = vendor (length 20) Intel cap 15 version 0

isab0@pci0:0:31:0:	class=0x060100 rev=0x0b hdr=0x00 vendor=0x8086 device=0x5ae8 subvendor=0x8086 subdevice=0x7270
    vendor     = 'Intel Corporation'
    device     = 'Celeron N3350/Pentium N4200/Atom E3900 Series Low Pin Count Interface'
    class      = bridge
    subclass   = PCI-ISA

none6@pci0:0:31:1:	class=0x0c0500 rev=0x0b hdr=0x00 vendor=0x8086 device=0x5ad4 subvendor=0x8086 subdevice=0x7270
    vendor     = 'Intel Corporation'
    device     = 'Celeron N3350/Pentium N4200/Atom E3900 Series SMBus Controller'
    class      = serial bus
    subclass   = SMBus
    bar   [10] = type Memory, range 64, base 0x89412000, size 256, enabled
    bar   [20] = type I/O Port, range 32, base 0xf040, size 32, enabled

re0@pci0:2:0:0:	class=0x020000 rev=0x0c hdr=0x00 vendor=0x10ec device=0x8168 subvendor=0x10ec subdevice=0x0123
    vendor     = 'Realtek Semiconductor Co., Ltd.'
    device     = 'RTL8111/8168/8411 PCI Express Gigabit Ethernet Controller'
    class      = network
    subclass   = ethernet
    bar   [10] = type I/O Port, range 32, base 0xe000, size 256, enabled
    bar   [18] = type Memory, range 64, base 0x89304000, size 4096, enabled
    bar   [20] = type Prefetchable Memory, range 64, base 0x89300000, size 16384, enabled
    cap 01[40] = powerspec 3  supports D0 D1 D2 D3  current D0
    cap 05[50] = MSI supports 1 message, 64 bit 
    cap 10[70] = PCI-Express 2 endpoint MSI 1 max data 128(128) RO
                 max read 4096
                 link x1(x1) speed 2.5(2.5) ASPM disabled(L0s/L1) ClockPM disabled
    cap 11[b0] = MSI-X supports 4 messages, enabled
                 Table in map 0x20[0x0], PBA in map 0x20[0x800]
    cap 03[d0] = VPD
    ecap 0001[100] = AER 1 0 fatal 0 non-fatal 0 corrected
    ecap 0002[140] = VC 1 max VC0
    ecap 0003[160] = Serial 1 01000000684ce000
    ecap 0018[170] = LTR 1

re1@pci0:3:0:0:	class=0x020000 rev=0x0c hdr=0x00 vendor=0x10ec device=0x8168 subvendor=0x10ec subdevice=0x0123
    vendor     = 'Realtek Semiconductor Co., Ltd.'
    device     = 'RTL8111/8168/8411 PCI Express Gigabit Ethernet Controller'
    class      = network
    subclass   = ethernet
    bar   [10] = type I/O Port, range 32, base 0xd000, size 256, enabled
    bar   [18] = type Memory, range 64, base 0x89204000, size 4096, enabled
    bar   [20] = type Prefetchable Memory, range 64, base 0x89200000, size 16384, enabled
    cap 01[40] = powerspec 3  supports D0 D1 D2 D3  current D0
    cap 05[50] = MSI supports 1 message, 64 bit 
    cap 10[70] = PCI-Express 2 endpoint MSI 1 max data 128(128) RO
                 max read 4096
                 link x1(x1) speed 2.5(2.5) ASPM disabled(L0s/L1) ClockPM disabled
    cap 11[b0] = MSI-X supports 4 messages, enabled
                 Table in map 0x20[0x0], PBA in map 0x20[0x800]
    cap 03[d0] = VPD
    ecap 0001[100] = AER 1 0 fatal 0 non-fatal 0 corrected
    ecap 0002[140] = VC 1 max VC0
    ecap 0003[160] = Serial 1 01000000684ce000
    ecap 0018[170] = LTR 1
