hostb0@pci0:0:0:0:	class=0x060000 rev=0x11 hdr=0x00 vendor=0x8086 device=0x1980 subvendor=0x1849 subdevice=0x1980
    vendor     = 'Intel Corporation'
    device     = 'Atom Processor C3000 Series System Agent'
    class      = bridge
    subclass   = HOST-PCI

hostb1@pci0:0:4:0:	class=0x060000 rev=0x11 hdr=0x00 vendor=0x8086 device=0x19a1 subvendor=0x1849 subdevice=0x19a1
    vendor     = 'Intel Corporation'
    device     = 'Atom Processor C3000 Series Error Registers'
    class      = bridge
    subclass   = HOST-PCI
    cap 10[40] = PCI-Express 2 root endpoint max data 256(256)
                 max read 128

none0@pci0:0:5:0:	class=0x080700 rev=0x11 hdr=0x00 vendor=0x8086 device=0x19a2 subvendor=0x1849 subdevice=0x19a2
    vendor     = 'Intel Corporation'
    device     = 'Atom Processor C3000 Series Root Complex Event Collector'
    class      = base peripheral
    subclass   = Root Complex Event Collector
    cap 10[40] = PCI-Express 2 event collector max data 256(256)
                 max read 128
    cap 01[80] = powerspec 3  supports D0 D3  current D0
    cap 05[90] = MSI supports 1 message, vector masks 
    ecap 0001[100] = AER 1 0 fatal 1 non-fatal 1 corrected
    ecap 0007[150] = Root Complex Event Collector ASsociation 1

pcib1@pci0:0:6:0:	class=0x060400 rev=0x11 hdr=0x01 vendor=0x8086 device=0x19a3 subvendor=0x1849 subdevice=0x19a3
    vendor     = 'Intel Corporation'
    device     = 'Atom Processor C3000 Series Integrated QAT Root Port'
    class      = bridge
    subclass   = PCI-PCI
    cap 10[40] = PCI-Express 2 root port max data 128(128) ARI enabled
                 max read 128
                 link x1(x1) speed 2.5(2.5) ASPM L0s/L1(L0s/L1)
    cap 01[80] = powerspec 3  supports D0 D3  current D0
    cap 0d[88] = PCI Bridge subvendor=0x1849 subdevice=0x19a3
    cap 05[90] = MSI supports 1 message, vector masks 
    ecap 0001[100] = AER 1 0 fatal 0 non-fatal 1 corrected
    ecap 000d[138] = ACS 1

pcib2@pci0:0:9:0:	class=0x060400 rev=0x11 hdr=0x01 vendor=0x8086 device=0x19a4 subvendor=0x1849 subdevice=0x19a4
    vendor     = 'Intel Corporation'
    device     = 'Atom Processor C3000 Series PCI Express Root Port'
    class      = bridge
    subclass   = PCI-PCI
    bar   [10] = type Memory, range 64, base 0xdf620000, size 131072, enabled
    cap 10[40] = PCI-Express 2 root port max data 256(256) ARI enabled
                 max read 128
                 link x4(x4) speed 5.0(8.0) ASPM disabled(L1)
    cap 01[80] = powerspec 3  supports D0 D3  current D0
    cap 0d[88] = PCI Bridge subvendor=0x1849 subdevice=0x19a4
    cap 05[90] = MSI supports 1 message, vector masks 
    ecap 0001[100] = AER 1 0 fatal 0 non-fatal 0 corrected
    ecap 000d[138] = ACS 1
    ecap 0012[150] = Multicast 1
    ecap 000b[180] = Vendor [1] ID 0003 Rev 0 Length 10
    ecap 001d[190] = Downstream Port Containment 1
    ecap 001e[1d0] = L1 PM Substates 1
    ecap 0019[200] = PCIe Sec 1 lane errors 0xf

pcib3@pci0:0:17:0:	class=0x060400 rev=0x11 hdr=0x01 vendor=0x8086 device=0x19ab subvendor=0x1849 subdevice=0x19ab
    vendor     = 'Intel Corporation'
    device     = 'Atom Processor C3000 Series PCI Express Root Port'
    class      = bridge
    subclass   = PCI-PCI
    bar   [10] = type Memory, range 64, base 0xdf600000, size 131072, enabled
    cap 10[40] = PCI-Express 2 root port max data 256(256) ARI disabled
                 max read 128
                 link x1(x1) speed 5.0(8.0) ASPM disabled(L1)
    cap 01[80] = powerspec 3  supports D0 D3  current D0
    cap 0d[88] = PCI Bridge subvendor=0x1849 subdevice=0x19ab
    cap 05[90] = MSI supports 1 message, vector masks 
    ecap 0001[100] = AER 1 0 fatal 0 non-fatal 0 corrected
    ecap 000d[138] = ACS 1
    ecap 0012[150] = Multicast 1
    ecap 000b[180] = Vendor [1] ID 0003 Rev 0 Length 10
    ecap 001d[190] = Downstream Port Containment 1
    ecap 001e[1d0] = L1 PM Substates 1
    ecap 0019[200] = PCIe Sec 1 lane errors 0

none1@pci0:0:18:0:	class=0x088000 rev=0x11 hdr=0x00 vendor=0x8086 device=0x19ac subvendor=0x1849 subdevice=0x19ac
    vendor     = 'Intel Corporation'
    device     = 'Atom Processor C3000 Series SMBus Contoller - Host'
    class      = base peripheral
    bar   [10] = type Memory, range 64, base 0xdf65e000, size 1024, enabled
    cap 10[40] = PCI-Express 2 root endpoint max data 256(256) FLR NS
                 max read 128
    cap 01[80] = powerspec 3  supports D0 D3  current D0
    cap 05[8c] = MSI supports 1 message, 64 bit, vector masks 
    ecap 0001[100] = AER 1 0 fatal 0 non-fatal 0 corrected

ahci0@pci0:0:19:0:	class=0x010601 rev=0x11 hdr=0x00 vendor=0x8086 device=0x19b2 subvendor=0x1849 subdevice=0x19b2
    vendor     = 'Intel Corporation'
    device     = 'Atom Processor C3000 Series SATA Controller 0'
    class      = mass storage
    subclass   = SATA
    bar   [10] = type Memory, range 32, base 0xdf656000, size 8192, enabled
    bar   [14] = type Memory, range 32, base 0xdf65d000, size 256, enabled
    bar   [18] = type I/O Port, range 32, base 0xe090, size 8, enabled
    bar   [1c] = type I/O Port, range 32, base 0xe080, size 4, enabled
    bar   [20] = type I/O Port, range 32, base 0xe040, size 32, enabled
    bar   [24] = type Memory, range 32, base 0xdf65c000, size 2048, enabled
    cap 05[80] = MSI supports 1 message 
    cap 01[70] = powerspec 3  supports D0 D3  current D0
    cap 12[a8] = SATA Index-Data Pair
    cap 11[d0] = MSI-X supports 8 messages, enabled
                 Table in map 0x10[0x0], PBA in map 0x14[0x0]

ahci1@pci0:0:20:0:	class=0x010601 rev=0x11 hdr=0x00 vendor=0x8086 device=0x19c2 subvendor=0x1849 subdevice=0x19c2
    vendor     = 'Intel Corporation'
    device     = 'Atom Processor C3000 Series SATA Controller 1'
    class      = mass storage
    subclass   = SATA
    bar   [10] = type Memory, range 32, base 0xdf654000, size 8192, enabled
    bar   [14] = type Memory, range 32, base 0xdf65b000, size 256, enabled
    bar   [18] = type I/O Port, range 32, base 0xe070, size 8, enabled
    bar   [1c] = type I/O Port, range 32, base 0xe060, size 4, enabled
    bar   [20] = type I/O Port, range 32, base 0xe020, size 32, enabled
    bar   [24] = type Memory, range 32, base 0xdf65a000, size 2048, enabled
    cap 05[80] = MSI supports 1 message 
    cap 01[70] = powerspec 3  supports D0 D3  current D0
    cap 12[a8] = SATA Index-Data Pair
    cap 11[d0] = MSI-X supports 8 messages, enabled
                 Table in map 0x10[0x0], PBA in map 0x14[0x0]

xhci0@pci0:0:21:0:	class=0x0c0330 rev=0x11 hdr=0x00 vendor=0x8086 device=0x19d0 subvendor=0x1849 subdevice=0x19d0
    vendor     = 'Intel Corporation'
    device     = 'Atom Processor C3000 Series USB 3.0 xHCI Controller'
    class      = serial bus
    subclass   = USB
    bar   [10] = type Memory, range 64, base 0xdf640000, size 65536, enabled
    cap 01[70] = powerspec 2  supports D0 D3  current D0
    cap 05[80] = MSI supports 8 messages, 64 bit enabled with 1 message

pcib5@pci0:0:22:0:	class=0x060400 rev=0x11 hdr=0x01 vendor=0x8086 device=0x19d1 subvendor=0x1849 subdevice=0x19d1
    vendor     = 'Intel Corporation'
    device     = 'Atom Processor C3000 Series Integrated LAN Root Port'
    class      = bridge
    subclass   = PCI-PCI
    cap 10[40] = PCI-Express 2 root port max data 128(128) ARI enabled
                 max read 128
                 link x1(x1) speed 2.5(2.5) ASPM L0s/L1(L0s/L1)
    cap 01[80] = powerspec 3  supports D0 D3  current D0
    cap 0d[88] = PCI Bridge subvendor=0x1849 subdevice=0x19d1
    cap 05[90] = MSI supports 1 message, vector masks 
    ecap 0001[100] = AER 1 0 fatal 0 non-fatal 1 corrected
    ecap 000d[138] = ACS 1

pcib6@pci0:0:23:0:	class=0x060400 rev=0x11 hdr=0x01 vendor=0x8086 device=0x19d2 subvendor=0x1849 subdevice=0x19d2
    vendor     = 'Intel Corporation'
    device     = 'Atom Processor C3000 Series Integrated LAN Root Port'
    class      = bridge
    subclass   = PCI-PCI
    cap 10[40] = PCI-Express 2 root port max data 128(128) ARI enabled
                 max read 128
                 link x1(x1) speed 2.5(2.5) ASPM L0s/L1(L0s/L1)
    cap 01[80] = powerspec 3  supports D0 D3  current D0
    cap 0d[88] = PCI Bridge subvendor=0x1849 subdevice=0x19d2
    cap 05[90] = MSI supports 1 message, vector masks 
    ecap 0001[100] = AER 1 0 fatal 0 non-fatal 1 corrected
    ecap 000d[138] = ACS 1

none2@pci0:0:24:0:	class=0x078000 rev=0x11 hdr=0x00 vendor=0x8086 device=0x19d3 subvendor=0x1849 subdevice=0x19d3
    vendor     = 'Intel Corporation'
    device     = 'Atom Processor C3000 Series ME HECI 1'
    class      = simple comms
    bar   [10] = type Memory, range 64, base 0xdf659000, size 4096, enabled
    cap 01[50] = powerspec 3  supports D0 D3  current D0
    cap 05[8c] = MSI supports 1 message, 64 bit 

isab0@pci0:0:31:0:	class=0x060100 rev=0x11 hdr=0x00 vendor=0x8086 device=0x19dc subvendor=0x1849 subdevice=0x19dc
    vendor     = 'Intel Corporation'
    device     = 'Atom Processor C3000 Series LPC or eSPI'
    class      = bridge
    subclass   = PCI-ISA

none3@pci0:0:31:2:	class=0x058000 rev=0x11 hdr=0x00 vendor=0x8086 device=0x19de subvendor=0x1849 subdevice=0x19de
    vendor     = 'Intel Corporation'
    device     = 'Atom Processor C3000 Series Power Management Controller'
    class      = memory
    bar   [10] = type Memory, range 32, base 0xdf650000, size 16384, enabled

ichsmb0@pci0:0:31:4:	class=0x0c0500 rev=0x11 hdr=0x00 vendor=0x8086 device=0x19df subvendor=0x1849 subdevice=0x19df
    vendor     = 'Intel Corporation'
    device     = 'Atom Processor C3000 Series SMBus controller'
    class      = serial bus
    subclass   = SMBus
    bar   [10] = type Memory, range 64, base 0xdf658000, size 256, enabled
    bar   [20] = type I/O Port, range 32, base 0xe000, size 32, enabled

none4@pci0:0:31:5:	class=0x0c8000 rev=0x11 hdr=0x00 vendor=0x8086 device=0x19e0 subvendor=0x1849 subdevice=0x19e0
    vendor     = 'Intel Corporation'
    device     = 'Atom Processor C3000 Series SPI Controller'
    class      = serial bus
    bar   [10] = type Memory, range 32, base 0xfe010000, size 4096, enabled

qat0@pci0:1:0:0:	class=0x0b4000 rev=0x11 hdr=0x00 vendor=0x8086 device=0x19e2 subvendor=0x8086 subdevice=0x19e2
    vendor     = 'Intel Corporation'
    device     = 'Atom Processor C3000 Series QuickAssist Technology'
    class      = processor
    bar   [18] = type Memory, range 64, base 0xdf540000, size 262144, enabled
    bar   [20] = type Memory, range 64, base 0xdf500000, size 262144, enabled
    cap 05[b0] = MSI supports 1 message, 64 bit, vector masks 
    cap 11[60] = MSI-X supports 17 messages, enabled
                 Table in map 0x18[0x3b000], PBA in map 0x18[0x3b800]
    cap 01[6c] = powerspec 3  supports D0 D3  current D0
    cap 10[74] = PCI-Express 2 endpoint max data 128(16384) FLR RO NS
                 max read undef
                 link x16(x16) speed 5.0(5.0) ASPM L0s/L1(L0s/L1)
    ecap 0001[100] = AER 1 0 fatal 0 non-fatal 1 corrected
    ecap 000e[138] = ARI 1
    ecap 0010[140] = SR-IOV 1 IOV disabled, Memory Space disabled, ARI disabled
                     0 VFs configured out of 16 supported
                     First VF RID Offset 0x0008, VF RID Stride 0x0001
                     VF Device ID 0x19e3
                     Page Sizes: 4096 (enabled), 8192, 65536, 262144, 1048576, 4194304
    ecap 000d[1b0] = ACS 1

ix0@pci0:2:0:0:	class=0x020000 rev=0x01 hdr=0x00 vendor=0x8086 device=0x10fb subvendor=0x8086 subdevice=0x000c
    vendor     = 'Intel Corporation'
    device     = '82599ES 10-Gigabit SFI/SFP+ Network Connection'
    class      = network
    subclass   = ethernet
    bar   [10] = type Memory, range 64, base 0xdf180000, size 524288, enabled
    bar   [18] = type I/O Port, range 32, base 0xd020, size 32, enabled
    bar   [20] = type Memory, range 64, base 0xdf204000, size 16384, enabled
    cap 01[40] = powerspec 3  supports D0 D3  current D0
    cap 05[50] = MSI supports 1 message, 64 bit, vector masks 
    cap 11[70] = MSI-X supports 64 messages, enabled
                 Table in map 0x20[0x0], PBA in map 0x20[0x2000]
    cap 10[a0] = PCI-Express 2 endpoint max data 256(512) FLR RO NS
                 max read 512
                 link x4(x8) speed 5.0(5.0) ASPM disabled(L0s)
    cap 03[e0] = VPD
    ecap 0001[100] = AER 1 0 fatal 0 non-fatal 1 corrected
    ecap 0003[140] = Serial 1 001b21ffffbc253c
    ecap 000e[150] = ARI 1
    ecap 0010[160] = SR-IOV 1 IOV disabled, Memory Space disabled, ARI disabled
                     0 VFs configured out of 64 supported
                     First VF RID Offset 0x0180, VF RID Stride 0x0002
                     VF Device ID 0x10ed
                     Page Sizes: 4096 (enabled), 8192, 65536, 262144, 1048576, 4194304

ix1@pci0:2:0:1:	class=0x020000 rev=0x01 hdr=0x00 vendor=0x8086 device=0x10fb subvendor=0x8086 subdevice=0x000c
    vendor     = 'Intel Corporation'
    device     = '82599ES 10-Gigabit SFI/SFP+ Network Connection'
    class      = network
    subclass   = ethernet
    bar   [10] = type Memory, range 64, base 0xdf100000, size 524288, enabled
    bar   [18] = type I/O Port, range 32, base 0xd000, size 32, enabled
    bar   [20] = type Memory, range 64, base 0xdf200000, size 16384, enabled
    cap 01[40] = powerspec 3  supports D0 D3  current D0
    cap 05[50] = MSI supports 1 message, 64 bit, vector masks 
    cap 11[70] = MSI-X supports 64 messages, enabled
                 Table in map 0x20[0x0], PBA in map 0x20[0x2000]
    cap 10[a0] = PCI-Express 2 endpoint max data 256(512) FLR RO NS
                 max read 512
                 link x4(x8) speed 5.0(5.0) ASPM disabled(L0s)
    cap 03[e0] = VPD
    ecap 0001[100] = AER 1 0 fatal 0 non-fatal 1 corrected
    ecap 0003[140] = Serial 1 001b21ffffbc253c
    ecap 000e[150] = ARI 1
    ecap 0010[160] = SR-IOV 1 IOV disabled, Memory Space disabled, ARI disabled
                     0 VFs configured out of 64 supported
                     First VF RID Offset 0x0180, VF RID Stride 0x0002
                     VF Device ID 0x10ed
                     Page Sizes: 4096 (enabled), 8192, 65536, 262144, 1048576, 4194304

pcib4@pci0:3:0:0:	class=0x060400 rev=0x04 hdr=0x01 vendor=0x1a03 device=0x1150 subvendor=0x1849 subdevice=0x1150
    vendor     = 'ASPEED Technology, Inc.'
    device     = 'AST1150 PCI-to-PCI Bridge'
    class      = bridge
    subclass   = PCI-PCI
    cap 05[50] = MSI supports 1 message, 64 bit 
    cap 01[78] = powerspec 3  supports D0 D1 D2 D3  current D0
    cap 10[80] = PCI-Express 2 PCI bridge max data 256(256) RO NS
                 max read 512
                 link x1(x1) speed 5.0(5.0) ASPM disabled(L0s/L1)
    cap 0d[c0] = PCI Bridge subvendor=0x1849 subdevice=0x1150
    ecap 0002[100] = VC 1 max VC0
    ecap 0001[800] = AER 1 0 fatal 0 non-fatal 1 corrected

vgapci0@pci0:4:0:0:	class=0x030000 rev=0x41 hdr=0x00 vendor=0x1a03 device=0x2000 subvendor=0x1849 subdevice=0x2000
    vendor     = 'ASPEED Technology, Inc.'
    device     = 'ASPEED Graphics Family'
    class      = display
    subclass   = VGA
    bar   [10] = type Memory, range 32, base 0xde000000, size 16777216, enabled
    bar   [14] = type Memory, range 32, base 0xdf000000, size 131072, enabled
    bar   [18] = type I/O Port, range 32, base 0xc000, size 128, enabled
    cap 01[40] = powerspec 3  supports D0 D1 D2 D3  current D0
    cap 05[50] = MSI supports 2 messages, 64 bit 

ix2@pci0:5:0:0:	class=0x020000 rev=0x11 hdr=0x00 vendor=0x8086 device=0x15e4 subvendor=0x1849 subdevice=0x15e4
    vendor     = 'Intel Corporation'
    device     = 'Ethernet Connection X553 1GbE'
    class      = network
    subclass   = ethernet
    bar   [10] = type Prefetchable Memory, range 64, base 0xddc00000, size 2097152, enabled
    bar   [20] = type Prefetchable Memory, range 64, base 0xdde04000, size 16384, enabled
    cap 01[40] = powerspec 3  supports D0 D3  current D0
    cap 05[50] = MSI supports 1 message, 64 bit, vector masks 
    cap 11[70] = MSI-X supports 64 messages, enabled
                 Table in map 0x20[0x0], PBA in map 0x20[0x2000]
    cap 10[a0] = PCI-Express 2 endpoint max data 128(128) FLR RO
                 max read 512
                 link x1(x1) speed 2.5(2.5) ASPM L0s/L1(L0s/L1)
    ecap 0001[100] = AER 2 0 fatal 0 non-fatal 1 corrected
    ecap 0003[140] = Serial 1 0000c9ffff000000
    ecap 000e[150] = ARI 1
    ecap 0010[160] = SR-IOV 1 IOV disabled, Memory Space disabled, ARI disabled
                     0 VFs configured out of 64 supported
                     First VF RID Offset 0x0180, VF RID Stride 0x0002
                     VF Device ID 0x15c5
                     Page Sizes: 4096 (enabled), 8192, 65536, 262144, 1048576, 4194304
    ecap 000d[1b0] = ACS 1

ix3@pci0:5:0:1:	class=0x020000 rev=0x11 hdr=0x00 vendor=0x8086 device=0x15e4 subvendor=0x1849 subdevice=0x15e4
    vendor     = 'Intel Corporation'
    device     = 'Ethernet Connection X553 1GbE'
    class      = network
    subclass   = ethernet
    bar   [10] = type Prefetchable Memory, range 64, base 0xdda00000, size 2097152, enabled
    bar   [20] = type Prefetchable Memory, range 64, base 0xdde00000, size 16384, enabled
    cap 01[40] = powerspec 3  supports D0 D3  current D0
    cap 05[50] = MSI supports 1 message, 64 bit, vector masks 
    cap 11[70] = MSI-X supports 64 messages, enabled
                 Table in map 0x20[0x0], PBA in map 0x20[0x2000]
    cap 10[a0] = PCI-Express 2 endpoint max data 128(128) FLR RO
                 max read 512
                 link x1(x1) speed 2.5(2.5) ASPM L0s/L1(L0s/L1)
    ecap 0001[100] = AER 2 0 fatal 0 non-fatal 1 corrected
    ecap 0003[140] = Serial 1 0000c9ffff000000
    ecap 000e[150] = ARI 1
    ecap 0010[160] = SR-IOV 1 IOV disabled, Memory Space disabled, ARI disabled
                     0 VFs configured out of 64 supported
                     First VF RID Offset 0x0180, VF RID Stride 0x0002
                     VF Device ID 0x15c5
                     Page Sizes: 4096 (enabled), 8192, 65536, 262144, 1048576, 4194304
    ecap 000d[1b0] = ACS 1

ix4@pci0:6:0:0:	class=0x020000 rev=0x11 hdr=0x00 vendor=0x8086 device=0x15e5 subvendor=0x1849 subdevice=0x15e5
    vendor     = 'Intel Corporation'
    device     = 'Ethernet Connection X553 1GbE'
    class      = network
    subclass   = ethernet
    bar   [10] = type Prefetchable Memory, range 64, base 0xdd600000, size 2097152, enabled
    bar   [20] = type Prefetchable Memory, range 64, base 0xdd804000, size 16384, enabled
    cap 01[40] = powerspec 3  supports D0 D3  current D0
    cap 05[50] = MSI supports 1 message, 64 bit, vector masks 
    cap 11[70] = MSI-X supports 64 messages, enabled
                 Table in map 0x20[0x0], PBA in map 0x20[0x2000]
    cap 10[a0] = PCI-Express 2 endpoint max data 128(128) FLR RO
                 max read 512
                 link x1(x1) speed 2.5(2.5) ASPM L0s/L1(L0s/L1)
    ecap 0001[100] = AER 2 0 fatal 0 non-fatal 1 corrected
    ecap 0003[140] = Serial 1 0100c9ffff000000
    ecap 000e[150] = ARI 1
    ecap 0010[160] = SR-IOV 1 IOV disabled, Memory Space disabled, ARI disabled
                     0 VFs configured out of 64 supported
                     First VF RID Offset 0x0180, VF RID Stride 0x0002
                     VF Device ID 0x15c5
                     Page Sizes: 4096 (enabled), 8192, 65536, 262144, 1048576, 4194304
    ecap 000d[1b0] = ACS 1

ix5@pci0:6:0:1:	class=0x020000 rev=0x11 hdr=0x00 vendor=0x8086 device=0x15e5 subvendor=0x1849 subdevice=0x15e5
    vendor     = 'Intel Corporation'
    device     = 'Ethernet Connection X553 1GbE'
    class      = network
    subclass   = ethernet
    bar   [10] = type Prefetchable Memory, range 64, base 0xdd400000, size 2097152, enabled
    bar   [20] = type Prefetchable Memory, range 64, base 0xdd800000, size 16384, enabled
    cap 01[40] = powerspec 3  supports D0 D3  current D0
    cap 05[50] = MSI supports 1 message, 64 bit, vector masks 
    cap 11[70] = MSI-X supports 64 messages, enabled
                 Table in map 0x20[0x0], PBA in map 0x20[0x2000]
    cap 10[a0] = PCI-Express 2 endpoint max data 128(128) FLR RO
                 max read 512
                 link x1(x1) speed 2.5(2.5) ASPM L0s/L1(L0s/L1)
    ecap 0001[100] = AER 2 0 fatal 0 non-fatal 1 corrected
    ecap 0003[140] = Serial 1 0100c9ffff000000
    ecap 000e[150] = ARI 1
    ecap 0010[160] = SR-IOV 1 IOV disabled, Memory Space disabled, ARI disabled
                     0 VFs configured out of 64 supported
                     First VF RID Offset 0x0180, VF RID Stride 0x0002
                     VF Device ID 0x15c5
                     Page Sizes: 4096 (enabled), 8192, 65536, 262144, 1048576, 4194304
    ecap 000d[1b0] = ACS 1
