hostb0@pci0:0:0:0:	class=0x060000 rev=0x00 hdr=0x00 vendor=0x1022 device=0x1576 subvendor=0x1022 subdevice=0x1576
    vendor     = 'Advanced Micro Devices, Inc. [AMD]'
    device     = 'Family 15h (Models 60h-6fh) Processor Root Complex'
    class      = bridge
    subclass   = HOST-PCI

none0@pci0:0:0:2:	class=0x080600 rev=0x00 hdr=0x00 vendor=0x1022 device=0x1577 subvendor=0x1022 subdevice=0x1577
    vendor     = 'Advanced Micro Devices, Inc. [AMD]'
    device     = 'Family 15h (Models 60h-6fh) I/O Memory Management Unit'
    class      = base peripheral
    subclass   = IOMMU
    cap 0f[40] = unknown
    cap 05[64] = MSI supports 4 messages, 64 bit 
    cap 08[74] = HT MSI fixed address window enabled at 0xfee00000

vgapci0@pci0:0:1:0:	class=0x030000 rev=0xc6 hdr=0x00 vendor=0x1002 device=0x9874 subvendor=0x103c subdevice=0x807e
    vendor     = 'Advanced Micro Devices, Inc. [AMD/ATI]'
    device     = 'Wani [Radeon R5/R6/R7 Graphics]'
    class      = display
    subclass   = VGA
    bar   [10] = type Prefetchable Memory, range 64, base 0xc0000000, size 268435456, enabled
    bar   [18] = type Prefetchable Memory, range 64, base 0xd0000000, size 8388608, enabled
    bar   [20] = type I/O Port, range 32, base 0x2000, size 256, enabled
    bar   [24] = type Memory, range 32, base 0xd0c00000, size 262144, enabled
    cap 09[48] = vendor (length 8)
    cap 01[50] = powerspec 3  supports D0 D1 D2 D3  current D0
    cap 10[58] = PCI-Express 2 root endpoint max data 128(256) RO NS
                 max read 512
    cap 05[a0] = MSI supports 1 message, 64 bit 
    ecap 000b[100] = Vendor [1] ID 0001 Rev 1 Length 16
    ecap 0019[270] = PCIe Sec 1 lane errors 0
    ecap 000f[2b0] = ATS 1
    ecap 0013[2c0] = Page Page Request 1
    ecap 001b[2d0] = Process Address Space ID 1

hdac0@pci0:0:1:1:	class=0x040300 rev=0x00 hdr=0x00 vendor=0x1002 device=0x9840 subvendor=0x103c subdevice=0x807e
    vendor     = 'Advanced Micro Devices, Inc. [AMD/ATI]'
    device     = 'Kabini HDMI/DP Audio'
    class      = multimedia
    subclass   = HDA
    bar   [10] = type Memory, range 64, base 0xd0c60000, size 16384, enabled
    cap 09[48] = vendor (length 8)
    cap 01[50] = powerspec 3  supports D0 D1 D2 D3  current D0
    cap 10[58] = PCI-Express 2 root endpoint max data 128(256) RO NS
                 max read 512
    cap 05[a0] = MSI supports 1 message, 64 bit enabled with 1 message
    ecap 000b[100] = Vendor [1] ID 0001 Rev 1 Length 16

hostb1@pci0:0:2:0:	class=0x060000 rev=0x00 hdr=0x00 vendor=0x1022 device=0x157b subvendor=0x0000 subdevice=0x0000
    vendor     = 'Advanced Micro Devices, Inc. [AMD]'
    device     = 'Family 15h (Models 60h-6fh) Host Bridge'
    class      = bridge
    subclass   = HOST-PCI

pcib1@pci0:0:2:1:	class=0x060400 rev=0x00 hdr=0x01 vendor=0x1022 device=0x157c subvendor=0x1022 subdevice=0x1234
    vendor     = 'Advanced Micro Devices, Inc. [AMD]'
    device     = 'Family 15h (Models 60h-6fh) Processor Root Port'
    class      = bridge
    subclass   = PCI-PCI
    cap 01[50] = powerspec 3  supports D0 D3  current D0
    cap 10[58] = PCI-Express 2 root port max data 256(512) RO NS
                 max read 512
                 link x1(x4) speed 2.5(2.5) ASPM L1(L0s/L1)
                 slot 0 power limit 0 mW HotPlug(present)
    cap 05[a0] = MSI supports 1 message, 64 bit enabled with 1 message
    cap 0d[c0] = PCI Bridge subvendor=0x1022 subdevice=0x1234
    cap 08[c8] = HT MSI fixed address window enabled at 0xfee00000
    ecap 000b[100] = Vendor [1] ID 0001 Rev 1 Length 16
    ecap 0019[270] = PCIe Sec 1 lane errors 0

pcib2@pci0:0:2:3:	class=0x060400 rev=0x00 hdr=0x01 vendor=0x1022 device=0x157c subvendor=0x1022 subdevice=0x1234
    vendor     = 'Advanced Micro Devices, Inc. [AMD]'
    device     = 'Family 15h (Models 60h-6fh) Processor Root Port'
    class      = bridge
    subclass   = PCI-PCI
    cap 01[50] = powerspec 3  supports D0 D3  current D0
    cap 10[58] = PCI-Express 2 root port max data 128(512) RO NS
                 max read 512
                 link x1(x2) speed 2.5(2.5) ASPM L1(L0s/L1)
                 slot 0 power limit 0 mW HotPlug(present)
    cap 05[a0] = MSI supports 1 message, 64 bit enabled with 1 message
    cap 0d[c0] = PCI Bridge subvendor=0x1022 subdevice=0x1234
    cap 08[c8] = HT MSI fixed address window enabled at 0xfee00000
    ecap 000b[100] = Vendor [1] ID 0001 Rev 1 Length 16
    ecap 0019[270] = PCIe Sec 1 lane errors 0

pcib3@pci0:0:2:5:	class=0x060400 rev=0x00 hdr=0x01 vendor=0x1022 device=0x157c subvendor=0x1022 subdevice=0x1234
    vendor     = 'Advanced Micro Devices, Inc. [AMD]'
    device     = 'Family 15h (Models 60h-6fh) Processor Root Port'
    class      = bridge
    subclass   = PCI-PCI
    cap 01[50] = powerspec 3  supports D0 D3  current D0
    cap 10[58] = PCI-Express 2 root port max data 128(512) RO NS
                 max read 512
                 link x16(x1) speed 2.5(2.5) ASPM disabled(L0s/L1)
                 slot 0 power limit 0 mW HotPlug(empty)
    cap 05[a0] = MSI supports 1 message, 64 bit enabled with 1 message
    cap 0d[c0] = PCI Bridge subvendor=0x1022 subdevice=0x1234
    cap 08[c8] = HT MSI fixed address window enabled at 0xfee00000
    ecap 000b[100] = Vendor [1] ID 0001 Rev 1 Length 16
    ecap 0019[270] = PCIe Sec 1 lane errors 0

hostb2@pci0:0:3:0:	class=0x060000 rev=0x00 hdr=0x00 vendor=0x1022 device=0x157b subvendor=0x0000 subdevice=0x0000
    vendor     = 'Advanced Micro Devices, Inc. [AMD]'
    device     = 'Family 15h (Models 60h-6fh) Host Bridge'
    class      = bridge
    subclass   = HOST-PCI

none1@pci0:0:8:0:	class=0x108000 rev=0x00 hdr=0x00 vendor=0x1022 device=0x1578 subvendor=0x1022 subdevice=0x1578
    vendor     = 'Advanced Micro Devices, Inc. [AMD]'
    device     = 'Carrizo Platform Security Processor'
    class      = encrypt/decrypt
    bar   [10] = type Prefetchable Memory, range 64, base 0xd0c40000, size 131072, enabled
    bar   [18] = type Memory, range 32, base 0xd0a00000, size 1048576, enabled
    bar   [1c] = type Memory, range 32, base 0xd0c6a000, size 4096, enabled
    bar   [24] = type Memory, range 32, base 0xd0c66000, size 8192, enabled
    cap 11[50] = MSI-X supports 2 messages
                 Table in map 0x24[0x0], PBA in map 0x24[0x1000]
    cap 08[5c] = HT MSI fixed address window enabled at 0xfee00000
    cap 01[60] = powerspec 3  supports D0 D3  current D0
    cap 13[a4] = PCI Advanced Features: TP

hostb3@pci0:0:9:0:	class=0x060000 rev=0x00 hdr=0x00 vendor=0x1022 device=0x157d subvendor=0x0000 subdevice=0x0000
    vendor     = 'Advanced Micro Devices, Inc. [AMD]'
    device     = 'Carrizo Audio Dummy Host Bridge'
    class      = bridge
    subclass   = HOST-PCI

xhci0@pci0:0:16:0:	class=0x0c0330 rev=0x20 hdr=0x00 vendor=0x1022 device=0x7914 subvendor=0x103c subdevice=0x807e
    vendor     = 'Advanced Micro Devices, Inc. [AMD]'
    device     = 'FCH USB XHCI Controller'
    class      = serial bus
    subclass   = USB
    bar   [10] = type Memory, range 64, base 0xd0c64000, size 8192, enabled
    cap 01[50] = powerspec 3  supports D0 D3  current D0
    cap 05[70] = MSI supports 8 messages, 64 bit 
    cap 11[90] = MSI-X supports 8 messages, enabled
                 Table in map 0x10[0x1000], PBA in map 0x10[0x1080]
    cap 10[a0] = PCI-Express 2 root endpoint max data 128(128) NS
                 max read 512
    ecap 0018[100] = LTR 1

ahci0@pci0:0:17:0:	class=0x010601 rev=0x49 hdr=0x00 vendor=0x1022 device=0x7901 subvendor=0x103c subdevice=0x807e
    vendor     = 'Advanced Micro Devices, Inc. [AMD]'
    device     = 'FCH SATA Controller [AHCI mode]'
    class      = mass storage
    subclass   = SATA
    bar   [10] = type I/O Port, range 32, base 0x2118, size 8, enabled
    bar   [14] = type I/O Port, range 32, base 0x2124, size 4, enabled
    bar   [18] = type I/O Port, range 32, base 0x2110, size 8, enabled
    bar   [1c] = type I/O Port, range 32, base 0x2120, size 4, enabled
    bar   [20] = type I/O Port, range 32, base 0x2100, size 16, enabled
    bar   [24] = type Memory, range 32, base 0xd0c68000, size 1024, enabled
    cap 01[60] = powerspec 3  supports D0 D3  current D0
    cap 12[70] = SATA Index-Data Pair

ehci0@pci0:0:18:0:	class=0x0c0320 rev=0x49 hdr=0x00 vendor=0x1022 device=0x7908 subvendor=0x103c subdevice=0x807e
    vendor     = 'Advanced Micro Devices, Inc. [AMD]'
    device     = 'FCH USB EHCI Controller'
    class      = serial bus
    subclass   = USB
    bar   [10] = type Memory, range 32, base 0xd0c69000, size 256, enabled
    cap 01[c0] = powerspec 2  supports D0 D1 D2 D3  current D0
    cap 0a[e4] = EHCI Debug Port at offset 0xe0 in map 0x14

intsmb0@pci0:0:20:0:	class=0x0c0500 rev=0x4a hdr=0x00 vendor=0x1022 device=0x790b subvendor=0x103c subdevice=0x807e
    vendor     = 'Advanced Micro Devices, Inc. [AMD]'
    device     = 'FCH SMBus Controller'
    class      = serial bus
    subclass   = SMBus

isab0@pci0:0:20:3:	class=0x060100 rev=0x11 hdr=0x00 vendor=0x1022 device=0x790e subvendor=0x103c subdevice=0x807e
    vendor     = 'Advanced Micro Devices, Inc. [AMD]'
    device     = 'FCH LPC Bridge'
    class      = bridge
    subclass   = PCI-ISA

hostb4@pci0:0:24:0:	class=0x060000 rev=0x00 hdr=0x00 vendor=0x1022 device=0x1570 subvendor=0x0000 subdevice=0x0000
    vendor     = 'Advanced Micro Devices, Inc. [AMD]'
    device     = 'Family 15h (Models 60h-6fh) Processor Function 0'
    class      = bridge
    subclass   = HOST-PCI

hostb5@pci0:0:24:1:	class=0x060000 rev=0x00 hdr=0x00 vendor=0x1022 device=0x1571 subvendor=0x0000 subdevice=0x0000
    vendor     = 'Advanced Micro Devices, Inc. [AMD]'
    device     = 'Family 15h (Models 60h-6fh) Processor Function 1'
    class      = bridge
    subclass   = HOST-PCI

hostb6@pci0:0:24:2:	class=0x060000 rev=0x00 hdr=0x00 vendor=0x1022 device=0x1572 subvendor=0x0000 subdevice=0x0000
    vendor     = 'Advanced Micro Devices, Inc. [AMD]'
    device     = 'Family 15h (Models 60h-6fh) Processor Function 2'
    class      = bridge
    subclass   = HOST-PCI

hostb7@pci0:0:24:3:	class=0x060000 rev=0x00 hdr=0x00 vendor=0x1022 device=0x1573 subvendor=0x0000 subdevice=0x0000
    vendor     = 'Advanced Micro Devices, Inc. [AMD]'
    device     = 'Family 15h (Models 60h-6fh) Processor Function 3'
    class      = bridge
    subclass   = HOST-PCI
    cap 0f[f0] = unknown

hostb8@pci0:0:24:4:	class=0x060000 rev=0x00 hdr=0x00 vendor=0x1022 device=0x1574 subvendor=0x0000 subdevice=0x0000
    vendor     = 'Advanced Micro Devices, Inc. [AMD]'
    device     = 'Family 15h (Models 60h-6fh) Processor Function 4'
    class      = bridge
    subclass   = HOST-PCI

hostb9@pci0:0:24:5:	class=0x060000 rev=0x00 hdr=0x00 vendor=0x1022 device=0x1575 subvendor=0x0000 subdevice=0x0000
    vendor     = 'Advanced Micro Devices, Inc. [AMD]'
    device     = 'Family 15h (Models 60h-6fh) Processor Function 5'
    class      = bridge
    subclass   = HOST-PCI

bge0@pci0:1:0:0:	class=0x020000 rev=0x10 hdr=0x00 vendor=0x14e4 device=0x1687 subvendor=0x103c subdevice=0x807e
    vendor     = 'Broadcom Inc. and subsidiaries'
    device     = 'NetXtreme BCM5762 Gigabit Ethernet PCIe'
    class      = network
    subclass   = ethernet
    bar   [10] = type Prefetchable Memory, range 64, base 0xd0820000, size 65536, enabled
    bar   [18] = type Prefetchable Memory, range 64, base 0xd0810000, size 65536, enabled
    bar   [20] = type Prefetchable Memory, range 64, base 0xd0800000, size 65536, enabled
    cap 01[48] = powerspec 3  supports D0 D3  current D0
    cap 03[50] = VPD
    cap 05[58] = MSI supports 8 messages, 64 bit enabled with 1 message
    cap 11[a0] = MSI-X supports 6 messages
                 Table in map 0x20[0x0], PBA in map 0x18[0x120]
    cap 10[ac] = PCI-Express 2 endpoint max data 256(256) FLR
                 max read 4096
                 link x1(x1) speed 2.5(5.0) ASPM L1(L0s/L1) ClockPM enabled
    ecap 0001[100] = AER 1 0 fatal 0 non-fatal 0 corrected
    ecap 0003[13c] = Serial 1 000098e7f4f1b5e2
    ecap 0004[150] = Power Budgeting 1
    ecap 0002[160] = VC 1 max VC0
    ecap 0018[1b0] = LTR 1
    ecap 0017[230] = TPH Requester 1
