pcib1@pci0:0:0:0:	class=0x060400 rev=0x00 hdr=0x01 vendor=0x1d87 device=0x0100 subvendor=0x0000 subdevice=0x0000
    vendor     = 'Rockchip Electronics Co., Ltd'
    device     = 'RK3399 PCI Express Root Port'
    class      = bridge
    subclass   = PCI-PCI
    cap 01[80] = powerspec 3  supports D0 D1 D3  current D0
    cap 05[90] = MSI supports 1 message, 64 bit, vector masks 
    cap 11[b0] = MSI-X supports 1 message
                 Table in map 0x10[0x0], PBA in map 0x10[0x8]
    cap 10[c0] = PCI-Express 2 root port max data 128(256) RO NS ARI disabled
                 max read 128
                 link x1(x4) speed 2.5(2.5) ASPM disabled(L0s/L1)
                 slot 0 power limit 0 mW
    ecap 0001[100] = AER 2 0 fatal 0 non-fatal 1 corrected
    ecap 0017[274] = TPH Requester 1

re0@pci0:1:0:0:	class=0x020000 rev=0x15 hdr=0x00 vendor=0x10ec device=0x8168 subvendor=0x10ec subdevice=0x8168
    vendor     = 'Realtek Semiconductor Co., Ltd.'
    device     = 'RTL8111/8168/8411 PCI Express Gigabit Ethernet Controller'
    class      = network
    subclass   = ethernet
    bar   [10] = type I/O Port, range 32, base 0, size 256, disabled
    bar   [18] = type Memory, range 64, base 0xfa000000, size 4096, enabled
    bar   [20] = type Memory, range 64, base 0xfa004000, size 16384, enabled
    cap 01[40] = powerspec 3  supports D0 D1 D2 D3  current D0
    cap 05[50] = MSI supports 1 message, 64 bit 
    cap 10[70] = PCI-Express 2 endpoint MSI 1 max data 128(128) RO
                 max read 4096
                 link x1(x1) speed 2.5(2.5) ASPM disabled(L0s/L1) ClockPM disabled
    cap 11[b0] = MSI-X supports 4 messages, enabled
                 Table in map 0x20[0x0], PBA in map 0x20[0x800]
    ecap 0001[100] = AER 2 0 fatal 0 non-fatal 0 corrected
    ecap 0002[140] = VC 1 max VC0
    ecap 0003[160] = Serial 1 0000000000000000
    ecap 0018[170] = LTR 1
    ecap 001e[178] = L1 PM Substates 1
