hostb0@pci0:0:0:0:	class=0x060000 card=0x8103103c chip=0x14221022 rev=0x00 hdr=0x00
    vendor     = 'Advanced Micro Devices, Inc. [AMD]'
    device     = 'Family 15h (Models 30h-3fh) Processor Root Complex'
    class      = bridge
    subclass   = HOST-PCI

none0@pci0:0:0:2:	class=0x080600 card=0x8103103c chip=0x14231022 rev=0x00 hdr=0x00
    vendor     = 'Advanced Micro Devices, Inc. [AMD]'
    device     = 'Family 15h (Models 30h-3fh) I/O Memory Management Unit'
    class      = base peripheral
    subclass   = IOMMU
    cap 0f[40] = unknown
    cap 05[54] = MSI supports 4 messages, 64 bit 
    cap 08[64] = HT MSI fixed address window enabled at 0xfee00000

vgapci0@pci0:0:1:0:	class=0x030000 card=0x8103103c chip=0x131c1002 rev=0x00 hdr=0x00
    vendor     = 'Advanced Micro Devices, Inc. [AMD/ATI]'
    device     = 'Kaveri [Radeon R7 Graphics]'
    class      = display
    subclass   = VGA
    bar   [10] = type Prefetchable Memory, range 64, base 0xc0000000, size 268435456, enabled
    bar   [18] = type Prefetchable Memory, range 64, base 0xd0000000, size 8388608, enabled
    bar   [20] = type I/O Port, range 32, base 0xf000, size 256, enabled
    bar   [24] = type Memory, range 32, base 0xfea00000, size 262144, enabled
    cap 09[48] = vendor (length 8)
    cap 01[50] = powerspec 3  supports D0 D1 D2 D3  current D0
    cap 10[58] = PCI-Express 2 root endpoint max data 128(256) RO NS
    cap 05[a0] = MSI supports 1 message, 64 bit 
    ecap 000b[100] = Vendor 1 ID 1
    ecap 0019[270] = PCIe Sec 1 lane errors 0
    ecap 000f[2b0] = ATS 1
    ecap 0013[2c0] = unknown 1
    ecap 001b[2d0] = unknown 1

hdac0@pci0:0:1:1:	class=0x040300 card=0x8103103c chip=0x13081002 rev=0x00 hdr=0x00
    vendor     = 'Advanced Micro Devices, Inc. [AMD/ATI]'
    device     = 'Kaveri HDMI/DP Audio Controller'
    class      = multimedia
    subclass   = HDA
    bar   [10] = type Memory, range 64, base 0xfea64000, size 16384, enabled
    cap 09[48] = vendor (length 8)
    cap 01[50] = powerspec 3  supports D0 D1 D2 D3  current D0
    cap 10[58] = PCI-Express 2 root endpoint max data 128(256) RO NS
    cap 05[a0] = MSI supports 1 message, 64 bit enabled with 1 message
    ecap 000b[100] = Vendor 1 ID 1

hostb1@pci0:0:2:0:	class=0x060000 card=0x00000000 chip=0x14241022 rev=0x00 hdr=0x00
    vendor     = 'Advanced Micro Devices, Inc. [AMD]'
    device     = 'Family 15h (Models 30h-3fh) Processor Root Port'
    class      = bridge
    subclass   = HOST-PCI

pcib1@pci0:0:2:1:	class=0x060400 card=0x8103103c chip=0x14251022 rev=0x00 hdr=0x01
    vendor     = 'Advanced Micro Devices, Inc. [AMD]'
    class      = bridge
    subclass   = PCI-PCI
    cap 01[50] = powerspec 3  supports D0 D3  current D0
    cap 10[58] = PCI-Express 2 root port max data 256(512) RO NS
                 link x4(x16) speed 2.5(8.0) ASPM L0s/L1(L0s/L1)
                 slot 0 power limit 0 mW
    cap 05[a0] = MSI supports 1 message, 64 bit 
    cap 0d[b0] = PCI Bridge card=0x8103103c
    cap 08[b8] = HT MSI fixed address window enabled at 0xfee00000
    ecap 000b[100] = Vendor 1 ID 1
    ecap 0019[270] = PCIe Sec 1 lane errors 0xf

hostb2@pci0:0:3:0:	class=0x060000 card=0x00000000 chip=0x14241022 rev=0x00 hdr=0x00
    vendor     = 'Advanced Micro Devices, Inc. [AMD]'
    device     = 'Family 15h (Models 30h-3fh) Processor Root Port'
    class      = bridge
    subclass   = HOST-PCI

pcib5@pci0:0:3:2:	class=0x060400 card=0x8103103c chip=0x14261022 rev=0x00 hdr=0x01
    vendor     = 'Advanced Micro Devices, Inc. [AMD]'
    device     = 'Family 15h (Models 30h-3fh) Processor Root Port'
    class      = bridge
    subclass   = PCI-PCI
    cap 01[50] = powerspec 3  supports D0 D3  current D0
    cap 10[58] = PCI-Express 2 root port max data 128(512) RO NS
                 link x1(x1) speed 2.5(5.0) ASPM disabled(L0s/L1)
                 slot 0 power limit 0 mW
    cap 05[a0] = MSI supports 1 message, 64 bit 
    cap 0d[b0] = PCI Bridge card=0x8103103c
    cap 08[b8] = HT MSI fixed address window enabled at 0xfee00000
    ecap 000b[100] = Vendor 1 ID 1
    ecap 0019[270] = PCIe Sec 1 lane errors 0x1

hostb3@pci0:0:4:0:	class=0x060000 card=0x00000000 chip=0x14241022 rev=0x00 hdr=0x00
    vendor     = 'Advanced Micro Devices, Inc. [AMD]'
    device     = 'Family 15h (Models 30h-3fh) Processor Root Port'
    class      = bridge
    subclass   = HOST-PCI

xhci0@pci0:0:16:0:	class=0x0c0330 card=0x8103103c chip=0x78141022 rev=0x09 hdr=0x00
    vendor     = 'Advanced Micro Devices, Inc. [AMD]'
    device     = 'FCH USB XHCI Controller'
    class      = serial bus
    subclass   = USB
    bar   [10] = type Memory, range 64, base 0xfea6a000, size 8192, enabled
    cap 01[50] = powerspec 3  supports D0 D3  current D0
    cap 05[70] = MSI supports 8 messages, 64 bit enabled with 1 message
    cap 11[90] = MSI-X supports 8 messages
                 Table in map 0x10[0x1000], PBA in map 0x10[0x1080]
    cap 10[a0] = PCI-Express 2 root endpoint max data 128(128) NS
    ecap 0018[100] = LTR 1

xhci1@pci0:0:16:1:	class=0x0c0330 card=0x8103103c chip=0x78141022 rev=0x09 hdr=0x00
    vendor     = 'Advanced Micro Devices, Inc. [AMD]'
    device     = 'FCH USB XHCI Controller'
    class      = serial bus
    subclass   = USB
    bar   [10] = type Memory, range 64, base 0xfea68000, size 8192, enabled
    cap 01[50] = powerspec 3  supports D0 D3  current D0
    cap 05[70] = MSI supports 8 messages, 64 bit enabled with 1 message
    cap 11[90] = MSI-X supports 8 messages
                 Table in map 0x10[0x1000], PBA in map 0x10[0x1080]
    cap 10[a0] = PCI-Express 2 root endpoint max data 128(128) NS

ahci0@pci0:0:17:0:	class=0x010601 card=0x8103103c chip=0x78011022 rev=0x40 hdr=0x00
    vendor     = 'Advanced Micro Devices, Inc. [AMD]'
    device     = 'FCH SATA Controller [AHCI mode]'
    class      = mass storage
    subclass   = SATA
    bar   [10] = type I/O Port, range 32, base 0xf190, size 8, enabled
    bar   [14] = type I/O Port, range 32, base 0xf180, size 4, enabled
    bar   [18] = type I/O Port, range 32, base 0xf170, size 8, enabled
    bar   [1c] = type I/O Port, range 32, base 0xf160, size 4, enabled
    bar   [20] = type I/O Port, range 32, base 0xf150, size 16, enabled
    bar   [24] = type Memory, range 32, base 0xfea70000, size 2048, enabled
    cap 05[50] = MSI supports 4 messages, 64 bit enabled with 4 messages
    cap 12[70] = SATA Index-Data Pair

ohci0@pci0:0:18:0:	class=0x0c0310 card=0x8103103c chip=0x78071022 rev=0x11 hdr=0x00
    vendor     = 'Advanced Micro Devices, Inc. [AMD]'
    device     = 'FCH USB OHCI Controller'
    class      = serial bus
    subclass   = USB
    bar   [10] = type Memory, range 32, base 0xfea6f000, size 4096, enabled

ehci0@pci0:0:18:2:	class=0x0c0320 card=0x8103103c chip=0x78081022 rev=0x11 hdr=0x00
    vendor     = 'Advanced Micro Devices, Inc. [AMD]'
    device     = 'FCH USB EHCI Controller'
    class      = serial bus
    subclass   = USB
    bar   [10] = type Memory, range 32, base 0xfea6e000, size 256, enabled
    cap 01[c0] = powerspec 2  supports D0 D1 D2 D3  current D0
    cap 0a[e4] = EHCI Debug Port at offset 0xe0 in map 0x14

ohci1@pci0:0:19:0:	class=0x0c0310 card=0x8103103c chip=0x78071022 rev=0x11 hdr=0x00
    vendor     = 'Advanced Micro Devices, Inc. [AMD]'
    device     = 'FCH USB OHCI Controller'
    class      = serial bus
    subclass   = USB
    bar   [10] = type Memory, range 32, base 0xfea6d000, size 4096, enabled

ehci1@pci0:0:19:2:	class=0x0c0320 card=0x8103103c chip=0x78081022 rev=0x11 hdr=0x00
    vendor     = 'Advanced Micro Devices, Inc. [AMD]'
    device     = 'FCH USB EHCI Controller'
    class      = serial bus
    subclass   = USB
    bar   [10] = type Memory, range 32, base 0xfea6c000, size 256, enabled
    cap 01[c0] = powerspec 2  supports D0 D1 D2 D3  current D0
    cap 0a[e4] = EHCI Debug Port at offset 0xe0 in map 0x14

intsmb0@pci0:0:20:0:	class=0x0c0500 card=0x8103103c chip=0x780b1022 rev=0x16 hdr=0x00
    vendor     = 'Advanced Micro Devices, Inc. [AMD]'
    device     = 'FCH SMBus Controller'
    class      = serial bus
    subclass   = SMBus

atapci0@pci0:0:20:1:	class=0x01018a card=0x8103103c chip=0x780c1022 rev=0x00 hdr=0x00
    vendor     = 'Advanced Micro Devices, Inc. [AMD]'
    device     = 'FCH IDE Controller'
    class      = mass storage
    subclass   = ATA
    bar   [20] = type I/O Port, range 32, base 0xf100, size 16, enabled

hdac1@pci0:0:20:2:	class=0x040300 card=0x8103103c chip=0x780d1022 rev=0x01 hdr=0x00
    vendor     = 'Advanced Micro Devices, Inc. [AMD]'
    device     = 'FCH Azalia Controller'
    class      = multimedia
    subclass   = HDA
    bar   [10] = type Memory, range 64, base 0xfea60000, size 16384, enabled
    cap 01[50] = powerspec 2  supports D0 D3  current D0

isab0@pci0:0:20:3:	class=0x060100 card=0x8103103c chip=0x780e1022 rev=0x11 hdr=0x00
    vendor     = 'Advanced Micro Devices, Inc. [AMD]'
    device     = 'FCH LPC Bridge'
    class      = bridge
    subclass   = PCI-ISA

pcib6@pci0:0:20:4:	class=0x060401 card=0x00000000 chip=0x780f1022 rev=0x40 hdr=0x01
    vendor     = 'Advanced Micro Devices, Inc. [AMD]'
    device     = 'FCH PCI Bridge'
    class      = bridge
    subclass   = PCI-PCI

hostb4@pci0:0:24:0:	class=0x060000 card=0x00000000 chip=0x141a1022 rev=0x00 hdr=0x00
    vendor     = 'Advanced Micro Devices, Inc. [AMD]'
    device     = 'Family 15h (Models 30h-3fh) Processor Function 0'
    class      = bridge
    subclass   = HOST-PCI

hostb5@pci0:0:24:1:	class=0x060000 card=0x00000000 chip=0x141b1022 rev=0x00 hdr=0x00
    vendor     = 'Advanced Micro Devices, Inc. [AMD]'
    device     = 'Family 15h (Models 30h-3fh) Processor Function 1'
    class      = bridge
    subclass   = HOST-PCI

hostb6@pci0:0:24:2:	class=0x060000 card=0x00000000 chip=0x141c1022 rev=0x00 hdr=0x00
    vendor     = 'Advanced Micro Devices, Inc. [AMD]'
    device     = 'Family 15h (Models 30h-3fh) Processor Function 2'
    class      = bridge
    subclass   = HOST-PCI

hostb7@pci0:0:24:3:	class=0x060000 card=0x00000000 chip=0x141d1022 rev=0x00 hdr=0x00
    vendor     = 'Advanced Micro Devices, Inc. [AMD]'
    device     = 'Family 15h (Models 30h-3fh) Processor Function 3'
    class      = bridge
    subclass   = HOST-PCI
    cap 0f[f0] = unknown

hostb8@pci0:0:24:4:	class=0x060000 card=0x00000000 chip=0x141e1022 rev=0x00 hdr=0x00
    vendor     = 'Advanced Micro Devices, Inc. [AMD]'
    device     = 'Family 15h (Models 30h-3fh) Processor Function 4'
    class      = bridge
    subclass   = HOST-PCI

hostb9@pci0:0:24:5:	class=0x060000 card=0x00000000 chip=0x141f1022 rev=0x00 hdr=0x00
    vendor     = 'Advanced Micro Devices, Inc. [AMD]'
    device     = 'Family 15h (Models 30h-3fh) Processor Function 5'
    class      = bridge
    subclass   = HOST-PCI

pcib2@pci0:1:0:0:	class=0x060400 card=0x00000000 chip=0x8018111d rev=0x0e hdr=0x01
    vendor     = 'Microsemi / PMC / IDT'
    device     = 'PES12N3A 12-lane 3-Port PCI Express Switch'
    class      = bridge
    subclass   = PCI-PCI
    cap 10[40] = PCI-Express 1 upstream port max data 256(2048)
                 link x4(x4) speed 2.5(2.5) ASPM L0s/L1(L0s/L1)
    cap 01[c0] = powerspec 3  supports D0 D3  current D0
    ecap 0001[100] = AER 1 0 fatal 0 non-fatal 2 corrected
    ecap 0002[200] = VC 1 max VC0

pcib3@pci0:2:2:0:	class=0x060400 card=0x00000000 chip=0x8018111d rev=0x0e hdr=0x01
    vendor     = 'Microsemi / PMC / IDT'
    device     = 'PES12N3A 12-lane 3-Port PCI Express Switch'
    class      = bridge
    subclass   = PCI-PCI
    cap 10[40] = PCI-Express 1 downstream port max data 256(2048)
                 link x4(x4) speed 2.5(2.5) ASPM L0s(L0s/L1)
    cap 01[c0] = powerspec 3  supports D0 D3  current D0
    cap 05[d0] = MSI supports 1 message, 64 bit 
    ecap 0001[100] = AER 1 0 fatal 0 non-fatal 2 corrected
    ecap 0002[200] = VC 1 max VC0

pcib4@pci0:2:4:0:	class=0x060400 card=0x00000000 chip=0x8018111d rev=0x0e hdr=0x01
    vendor     = 'Microsemi / PMC / IDT'
    device     = 'PES12N3A 12-lane 3-Port PCI Express Switch'
    class      = bridge
    subclass   = PCI-PCI
    cap 10[40] = PCI-Express 1 downstream port max data 256(2048)
                 link x4(x4) speed 2.5(2.5) ASPM L0s(L0s/L1)
    cap 01[c0] = powerspec 3  supports D0 D3  current D0
    cap 05[d0] = MSI supports 1 message, 64 bit 
    ecap 0001[100] = AER 1 0 fatal 0 non-fatal 2 corrected
    ecap 0002[200] = VC 1 max VC0

igb0@pci0:3:0:0:	class=0x020000 card=0x145a8086 chip=0x10d68086 rev=0x02 hdr=0x00
    vendor     = 'Intel Corporation'
    device     = '82575GB Gigabit Network Connection'
    class      = network
    subclass   = ethernet
    bar   [10] = type Memory, range 32, base 0xfe820000, size 131072, enabled
    bar   [14] = type Memory, range 32, base 0xfe600000, size 2097152, enabled
    bar   [18] = type I/O Port, range 32, base 0xd020, size 32, enabled
    bar   [1c] = type Memory, range 32, base 0xfe844000, size 16384, enabled
    cap 01[40] = powerspec 2  supports D0 D3  current D0
    cap 05[50] = MSI supports 1 message, 64 bit 
    cap 11[60] = MSI-X supports 10 messages, enabled
                 Table in map 0x1c[0x0], PBA in map 0x1c[0x2000]
    cap 10[a0] = PCI-Express 2 endpoint max data 256(256) RO NS
                 link x4(x4) speed 2.5(2.5)
    ecap 0001[100] = AER 1 0 fatal 0 non-fatal 4 corrected
    ecap 0003[140] = Serial 1 001b21ffff209478

igb1@pci0:3:0:1:	class=0x020000 card=0x145a8086 chip=0x10d68086 rev=0x02 hdr=0x00
    vendor     = 'Intel Corporation'
    device     = '82575GB Gigabit Network Connection'
    class      = network
    subclass   = ethernet
    bar   [10] = type Memory, range 32, base 0xfe800000, size 131072, enabled
    bar   [14] = type Memory, range 32, base 0xfe400000, size 2097152, enabled
    bar   [18] = type I/O Port, range 32, base 0xd000, size 32, enabled
    bar   [1c] = type Memory, range 32, base 0xfe840000, size 16384, enabled
    cap 01[40] = powerspec 2  supports D0 D3  current D0
    cap 05[50] = MSI supports 1 message, 64 bit 
    cap 11[60] = MSI-X supports 10 messages, enabled
                 Table in map 0x1c[0x0], PBA in map 0x1c[0x2000]
    cap 10[a0] = PCI-Express 2 endpoint max data 256(256) RO NS
                 link x4(x4) speed 2.5(2.5)
    ecap 0001[100] = AER 1 0 fatal 0 non-fatal 4 corrected
    ecap 0003[140] = Serial 1 001b21ffff209478

igb2@pci0:4:0:0:	class=0x020000 card=0x145a8086 chip=0x10d68086 rev=0x02 hdr=0x00
    vendor     = 'Intel Corporation'
    device     = '82575GB Gigabit Network Connection'
    class      = network
    subclass   = ethernet
    bar   [10] = type Memory, range 32, base 0xfe220000, size 131072, enabled
    bar   [14] = type Memory, range 32, base 0xfe000000, size 2097152, enabled
    bar   [18] = type I/O Port, range 32, base 0xc020, size 32, enabled
    bar   [1c] = type Memory, range 32, base 0xfe244000, size 16384, enabled
    cap 01[40] = powerspec 2  supports D0 D3  current D0
    cap 05[50] = MSI supports 1 message, 64 bit 
    cap 11[60] = MSI-X supports 10 messages, enabled
                 Table in map 0x1c[0x0], PBA in map 0x1c[0x2000]
    cap 10[a0] = PCI-Express 2 endpoint max data 256(256) RO NS
                 link x4(x4) speed 2.5(2.5)
    ecap 0001[100] = AER 1 0 fatal 0 non-fatal 3 corrected
    ecap 0003[140] = Serial 1 001b21ffff20947c

igb3@pci0:4:0:1:	class=0x020000 card=0x145a8086 chip=0x10d68086 rev=0x02 hdr=0x00
    vendor     = 'Intel Corporation'
    device     = '82575GB Gigabit Network Connection'
    class      = network
    subclass   = ethernet
    bar   [10] = type Memory, range 32, base 0xfe200000, size 131072, enabled
    bar   [14] = type Memory, range 32, base 0xfde00000, size 2097152, enabled
    bar   [18] = type I/O Port, range 32, base 0xc000, size 32, enabled
    bar   [1c] = type Memory, range 32, base 0xfe240000, size 16384, enabled
    cap 01[40] = powerspec 2  supports D0 D3  current D0
    cap 05[50] = MSI supports 1 message, 64 bit 
    cap 11[60] = MSI-X supports 10 messages, enabled
                 Table in map 0x1c[0x0], PBA in map 0x1c[0x2000]
    cap 10[a0] = PCI-Express 2 endpoint max data 256(256) RO NS
                 link x4(x4) speed 2.5(2.5)
    ecap 0001[100] = AER 1 0 fatal 0 non-fatal 3 corrected
    ecap 0003[140] = Serial 1 001b21ffff20947c

re0@pci0:5:0:0:	class=0x020000 card=0x8103103c chip=0x816810ec rev=0x15 hdr=0x00
    vendor     = 'Realtek Semiconductor Co., Ltd.'
    device     = 'RTL8111/8168/8411 PCI Express Gigabit Ethernet Controller'
    class      = network
    subclass   = ethernet
    bar   [10] = type I/O Port, range 32, base 0xe000, size 256, enabled
    bar   [18] = type Memory, range 64, base 0xfe904000, size 4096, enabled
    bar   [20] = type Memory, range 64, base 0xfe900000, size 16384, enabled
    cap 01[40] = powerspec 3  supports D0 D1 D2 D3  current D0
    cap 05[50] = MSI supports 1 message, 64 bit 
    cap 10[70] = PCI-Express 2 endpoint MSI 1 max data 128(128) RO
                 link x1(x1) speed 2.5(2.5) ASPM disabled(L0s/L1)
    cap 11[b0] = MSI-X supports 4 messages, enabled
                 Table in map 0x20[0x0], PBA in map 0x20[0x800]
    ecap 0001[100] = AER 2 0 fatal 0 non-fatal 1 corrected
    ecap 0002[140] = VC 1 max VC0
    ecap 0003[160] = Serial 1 01000000684ce000
    ecap 0018[170] = LTR 1
    ecap 001e[178] = unknown 1
