hostb0@pci0:0:0:0:	class=0x060000 card=0x14801022 chip=0x14801022 rev=0x00 hdr=0x00
    vendor     = 'Advanced Micro Devices, Inc. [AMD]'
    device     = 'Starship/Matisse Root Complex'
    class      = bridge
    subclass   = HOST-PCI

hostb1@pci0:0:1:0:	class=0x060000 card=0x00000000 chip=0x14821022 rev=0x00 hdr=0x00
    vendor     = 'Advanced Micro Devices, Inc. [AMD]'
    device     = 'Starship/Matisse PCIe Dummy Host Bridge'
    class      = bridge
    subclass   = HOST-PCI

pcib1@pci0:0:1:1:	class=0x060400 card=0x14531022 chip=0x14831022 rev=0x00 hdr=0x01
    vendor     = 'Advanced Micro Devices, Inc. [AMD]'
    device     = 'Starship/Matisse GPP Bridge'
    class      = bridge
    subclass   = PCI-PCI
    cap 01[50] = powerspec 3  supports D0 D3  current D0
    cap 10[58] = PCI-Express 2 root port max data 256(512) RO NS
                 link x4(x4) speed 16.0(16.0) ASPM disabled(L1)
                 slot 0 power limit 75000 mW
    cap 05[a0] = MSI supports 1 message, 64 bit 
    cap 0d[c0] = PCI Bridge card=0x14531022
    cap 08[c8] = HT MSI fixed address window enabled at 0xfee00000
    ecap 000b[100] = Vendor 1 ID 1
    ecap 0001[150] = AER 2 0 fatal 0 non-fatal 0 corrected
    ecap 0019[270] = PCIe Sec 1 lane errors 0xf
    ecap 000d[2a0] = ACS 1
    ecap 001e[370] = L1 PM Substates 1
    ecap 0023[3c4] = Designated Vendor-Specific 1
    ecap 0025[400] = Data Link Feature 1
    ecap 0026[410] = Physical Layer 16.0 GT/s 1
    ecap 0027[440] = Lane Margining at Receiver 1

pcib2@pci0:0:1:2:	class=0x060400 card=0x14531022 chip=0x14831022 rev=0x00 hdr=0x01
    vendor     = 'Advanced Micro Devices, Inc. [AMD]'
    device     = 'Starship/Matisse GPP Bridge'
    class      = bridge
    subclass   = PCI-PCI
    cap 01[50] = powerspec 3  supports D0 D3  current D0
    cap 10[58] = PCI-Express 2 root port max data 256(512) RO NS
                 link x4(x8) speed 16.0(16.0) ASPM disabled(L1)
                 slot 0 power limit 75000 mW
    cap 05[a0] = MSI supports 1 message, 64 bit 
    cap 0d[c0] = PCI Bridge card=0x14531022
    cap 08[c8] = HT MSI fixed address window enabled at 0xfee00000
    ecap 000b[100] = Vendor 1 ID 1
    ecap 0001[150] = AER 2 0 fatal 0 non-fatal 0 corrected
    ecap 0019[270] = PCIe Sec 1 lane errors 0
    ecap 000d[2a0] = ACS 1
    ecap 001e[370] = L1 PM Substates 1
    ecap 0023[3c4] = Designated Vendor-Specific 1
    ecap 0025[400] = Data Link Feature 1
    ecap 0026[410] = Physical Layer 16.0 GT/s 1
    ecap 0027[440] = Lane Margining at Receiver 1

hostb2@pci0:0:2:0:	class=0x060000 card=0x00000000 chip=0x14821022 rev=0x00 hdr=0x00
    vendor     = 'Advanced Micro Devices, Inc. [AMD]'
    device     = 'Starship/Matisse PCIe Dummy Host Bridge'
    class      = bridge
    subclass   = HOST-PCI

hostb3@pci0:0:3:0:	class=0x060000 card=0x00000000 chip=0x14821022 rev=0x00 hdr=0x00
    vendor     = 'Advanced Micro Devices, Inc. [AMD]'
    device     = 'Starship/Matisse PCIe Dummy Host Bridge'
    class      = bridge
    subclass   = HOST-PCI

hostb4@pci0:0:4:0:	class=0x060000 card=0x00000000 chip=0x14821022 rev=0x00 hdr=0x00
    vendor     = 'Advanced Micro Devices, Inc. [AMD]'
    device     = 'Starship/Matisse PCIe Dummy Host Bridge'
    class      = bridge
    subclass   = HOST-PCI

hostb5@pci0:0:5:0:	class=0x060000 card=0x00000000 chip=0x14821022 rev=0x00 hdr=0x00
    vendor     = 'Advanced Micro Devices, Inc. [AMD]'
    device     = 'Starship/Matisse PCIe Dummy Host Bridge'
    class      = bridge
    subclass   = HOST-PCI

hostb6@pci0:0:7:0:	class=0x060000 card=0x00000000 chip=0x14821022 rev=0x00 hdr=0x00
    vendor     = 'Advanced Micro Devices, Inc. [AMD]'
    device     = 'Starship/Matisse PCIe Dummy Host Bridge'
    class      = bridge
    subclass   = HOST-PCI

pcib9@pci0:0:7:1:	class=0x060400 card=0x14841022 chip=0x14841022 rev=0x00 hdr=0x01
    vendor     = 'Advanced Micro Devices, Inc. [AMD]'
    device     = 'Starship/Matisse Internal PCIe GPP Bridge 0 to bus[E:B]'
    class      = bridge
    subclass   = PCI-PCI
    cap 01[50] = powerspec 3  supports D0 D3  current D0
    cap 10[58] = PCI-Express 2 root port max data 256(512) RO NS
                 link x16(x16) speed 16.0(16.0) ASPM disabled(L0s/L1)
    cap 05[a0] = MSI supports 1 message, 64 bit 
    cap 0d[c0] = PCI Bridge card=0x14841022
    cap 08[c8] = HT MSI fixed address window enabled at 0xfee00000
    ecap 000b[100] = Vendor 1 ID 1
    ecap 0001[150] = AER 2 0 fatal 0 non-fatal 0 corrected
    ecap 0019[270] = PCIe Sec 1 lane errors 0
    ecap 000d[2a0] = ACS 1
    ecap 0025[400] = Data Link Feature 1
    ecap 0026[410] = Physical Layer 16.0 GT/s 1
    ecap 0027[440] = Lane Margining at Receiver 1

hostb7@pci0:0:8:0:	class=0x060000 card=0x00000000 chip=0x14821022 rev=0x00 hdr=0x00
    vendor     = 'Advanced Micro Devices, Inc. [AMD]'
    device     = 'Starship/Matisse PCIe Dummy Host Bridge'
    class      = bridge
    subclass   = HOST-PCI

pcib10@pci0:0:8:1:	class=0x060400 card=0x14841022 chip=0x14841022 rev=0x00 hdr=0x01
    vendor     = 'Advanced Micro Devices, Inc. [AMD]'
    device     = 'Starship/Matisse Internal PCIe GPP Bridge 0 to bus[E:B]'
    class      = bridge
    subclass   = PCI-PCI
    cap 01[50] = powerspec 3  supports D0 D3  current D0
    cap 10[58] = PCI-Express 2 root port max data 256(512) RO NS
                 link x16(x16) speed 16.0(16.0) ASPM disabled(L0s/L1)
    cap 05[a0] = MSI supports 1 message, 64 bit 
    cap 0d[c0] = PCI Bridge card=0x14841022
    cap 08[c8] = HT MSI fixed address window enabled at 0xfee00000
    ecap 000b[100] = Vendor 1 ID 1
    ecap 0001[150] = AER 2 0 fatal 0 non-fatal 0 corrected
    ecap 0019[270] = PCIe Sec 1 lane errors 0
    ecap 000d[2a0] = ACS 1
    ecap 0025[400] = Data Link Feature 1
    ecap 0026[410] = Physical Layer 16.0 GT/s 1
    ecap 0027[440] = Lane Margining at Receiver 1

intsmb0@pci0:0:20:0:	class=0x0c0500 card=0x790b1022 chip=0x790b1022 rev=0x61 hdr=0x00
    vendor     = 'Advanced Micro Devices, Inc. [AMD]'
    device     = 'FCH SMBus Controller'
    class      = serial bus
    subclass   = SMBus

isab0@pci0:0:20:3:	class=0x060100 card=0x790e1022 chip=0x790e1022 rev=0x51 hdr=0x00
    vendor     = 'Advanced Micro Devices, Inc. [AMD]'
    device     = 'FCH LPC Bridge'
    class      = bridge
    subclass   = PCI-ISA

hostb8@pci0:0:24:0:	class=0x060000 card=0x00000000 chip=0x14401022 rev=0x00 hdr=0x00
    vendor     = 'Advanced Micro Devices, Inc. [AMD]'
    device     = 'Matisse Device 24: Function 0'
    class      = bridge
    subclass   = HOST-PCI

hostb9@pci0:0:24:1:	class=0x060000 card=0x00000000 chip=0x14411022 rev=0x00 hdr=0x00
    vendor     = 'Advanced Micro Devices, Inc. [AMD]'
    device     = 'Matisse Device 24: Function 1'
    class      = bridge
    subclass   = HOST-PCI

hostb10@pci0:0:24:2:	class=0x060000 card=0x00000000 chip=0x14421022 rev=0x00 hdr=0x00
    vendor     = 'Advanced Micro Devices, Inc. [AMD]'
    device     = 'Matisse Device 24: Function 2'
    class      = bridge
    subclass   = HOST-PCI

hostb11@pci0:0:24:3:	class=0x060000 card=0x00000000 chip=0x14431022 rev=0x00 hdr=0x00
    vendor     = 'Advanced Micro Devices, Inc. [AMD]'
    device     = 'Matisse Device 24: Function 3'
    class      = bridge
    subclass   = HOST-PCI

hostb12@pci0:0:24:4:	class=0x060000 card=0x00000000 chip=0x14441022 rev=0x00 hdr=0x00
    vendor     = 'Advanced Micro Devices, Inc. [AMD]'
    device     = 'Matisse Device 24: Function 4'
    class      = bridge
    subclass   = HOST-PCI

hostb13@pci0:0:24:5:	class=0x060000 card=0x00000000 chip=0x14451022 rev=0x00 hdr=0x00
    vendor     = 'Advanced Micro Devices, Inc. [AMD]'
    device     = 'Matisse Device 24: Function 5'
    class      = bridge
    subclass   = HOST-PCI

hostb14@pci0:0:24:6:	class=0x060000 card=0x00000000 chip=0x14461022 rev=0x00 hdr=0x00
    vendor     = 'Advanced Micro Devices, Inc. [AMD]'
    device     = 'Matisse Device 24: Function 6'
    class      = bridge
    subclass   = HOST-PCI

hostb15@pci0:0:24:7:	class=0x060000 card=0x00000000 chip=0x14471022 rev=0x00 hdr=0x00
    vendor     = 'Advanced Micro Devices, Inc. [AMD]'
    device     = 'Matisse Device 24: Function 7'
    class      = bridge
    subclass   = HOST-PCI

nvme0@pci0:1:0:0:	class=0x010802 card=0x50161987 chip=0x50161987 rev=0x01 hdr=0x00
    vendor     = 'Phison Electronics Corporation'
    device     = 'E16 PCIe4 NVMe Controller'
    class      = mass storage
    subclass   = NVM
    bar   [10] = type Memory, range 64, base 0xfcf00000, size 16384, enabled
    cap 10[80] = PCI-Express 2 endpoint max data 256(256) FLR RO NS
                 link x4(x4) speed 16.0(16.0) ASPM disabled(L1)
    cap 11[d0] = MSI-X supports 9 messages, enabled
                 Table in map 0x10[0x2000], PBA in map 0x10[0x3000]
    cap 05[e0] = MSI supports 8 messages, 64 bit 
    cap 01[f8] = powerspec 3  supports D0 D3  current D0
    ecap 0018[100] = LTR 1
    ecap 001e[110] = L1 PM Substates 1
    ecap 000e[128] = ARI 1
    ecap 0025[1e0] = Data Link Feature 1
    ecap 0001[200] = AER 2 0 fatal 0 non-fatal 1 corrected
    ecap 0019[300] = PCIe Sec 1 lane errors 0
    ecap 0026[340] = Physical Layer 16.0 GT/s 1
    ecap 0027[378] = Lane Margining at Receiver 1

pcib3@pci0:2:0:0:	class=0x060400 card=0x00000000 chip=0x57ad1022 rev=0x00 hdr=0x01
    vendor     = 'Advanced Micro Devices, Inc. [AMD]'
    device     = 'Matisse Switch Upstream'
    class      = bridge
    subclass   = PCI-PCI
    cap 01[50] = powerspec 3  supports D0 D3  current D0
    cap 10[58] = PCI-Express 2 upstream port max data 256(512) RO NS
                 link x4(x8) speed 16.0(16.0) ASPM disabled(L1)
    cap 05[a0] = MSI supports 1 message, 64 bit 
    ecap 000b[100] = Vendor 1 ID 1
    ecap 0019[270] = PCIe Sec 1 lane errors 0
    ecap 001e[370] = L1 PM Substates 1
    ecap 0025[400] = Data Link Feature 1
    ecap 0026[410] = Physical Layer 16.0 GT/s 1
    ecap 0027[440] = Lane Margining at Receiver 1

pcib4@pci0:3:1:0:	class=0x060400 card=0x14531022 chip=0x57a31022 rev=0x00 hdr=0x01
    vendor     = 'Advanced Micro Devices, Inc. [AMD]'
    device     = 'Matisse PCIe GPP Bridge'
    class      = bridge
    subclass   = PCI-PCI
    cap 01[50] = powerspec 3  supports D0 D3  current D0
    cap 10[58] = PCI-Express 2 downstream port max data 256(512) RO NS
                 link x4(x4) speed 16.0(16.0) ASPM disabled(L1)
                 slot 0 power limit 0 mW
    cap 05[a0] = MSI supports 1 message, 64 bit 
    cap 0d[c0] = PCI Bridge card=0x14531022
    cap 08[c8] = HT MSI fixed address window enabled at 0xfee00000
    ecap 000b[100] = Vendor 1 ID 1
    ecap 0001[150] = AER 2 0 fatal 0 non-fatal 0 corrected
    ecap 0019[270] = PCIe Sec 1 lane errors 0
    ecap 000d[2a0] = ACS 1
    ecap 001e[370] = L1 PM Substates 1
    ecap 0025[400] = Data Link Feature 1
    ecap 0026[410] = Physical Layer 16.0 GT/s 1
    ecap 0027[440] = Lane Margining at Receiver 1

pcib5@pci0:3:6:0:	class=0x060400 card=0x14531022 chip=0x57a31022 rev=0x00 hdr=0x01
    vendor     = 'Advanced Micro Devices, Inc. [AMD]'
    device     = 'Matisse PCIe GPP Bridge'
    class      = bridge
    subclass   = PCI-PCI
    cap 01[50] = powerspec 3  supports D0 D3  current D0
    cap 10[58] = PCI-Express 2 downstream port max data 256(256) RO NS
                 link x1(x1) speed 2.5(16.0) ASPM disabled(L1)
                 slot 0 power limit 0 mW
    cap 05[a0] = MSI supports 1 message, 64 bit 
    cap 0d[c0] = PCI Bridge card=0x14531022
    cap 08[c8] = HT MSI fixed address window enabled at 0xfee00000
    ecap 000b[100] = Vendor 1 ID 1
    ecap 0001[150] = AER 2 0 fatal 0 non-fatal 0 corrected
    ecap 0019[270] = PCIe Sec 1 lane errors 0
    ecap 000d[2a0] = ACS 1
    ecap 001e[370] = L1 PM Substates 1
    ecap 0025[400] = Data Link Feature 1
    ecap 0026[410] = Physical Layer 16.0 GT/s 1
    ecap 0027[440] = Lane Margining at Receiver 1

pcib6@pci0:3:8:0:	class=0x060400 card=0x14841022 chip=0x57a41022 rev=0x00 hdr=0x01
    vendor     = 'Advanced Micro Devices, Inc. [AMD]'
    device     = 'Matisse PCIe GPP Bridge'
    class      = bridge
    subclass   = PCI-PCI
    cap 01[50] = powerspec 3  supports D0 D3  current D0
    cap 10[58] = PCI-Express 2 downstream port max data 256(512) RO NS
                 link x16(x16) speed 16.0(16.0) ASPM disabled(L0s/L1)
    cap 05[a0] = MSI supports 1 message, 64 bit 
    cap 0d[c0] = PCI Bridge card=0x14841022
    cap 08[c8] = HT MSI fixed address window enabled at 0xfee00000
    ecap 000b[100] = Vendor 1 ID 1
    ecap 0019[270] = PCIe Sec 1 lane errors 0
    ecap 0025[400] = Data Link Feature 1
    ecap 0026[410] = Physical Layer 16.0 GT/s 1
    ecap 0027[440] = Lane Margining at Receiver 1

pcib7@pci0:3:9:0:	class=0x060400 card=0x14841022 chip=0x57a41022 rev=0x00 hdr=0x01
    vendor     = 'Advanced Micro Devices, Inc. [AMD]'
    device     = 'Matisse PCIe GPP Bridge'
    class      = bridge
    subclass   = PCI-PCI
    cap 01[50] = powerspec 3  supports D0 D3  current D0
    cap 10[58] = PCI-Express 2 downstream port max data 256(512) RO NS
                 link x16(x16) speed 16.0(16.0) ASPM disabled(L0s/L1)
    cap 05[a0] = MSI supports 1 message, 64 bit 
    cap 0d[c0] = PCI Bridge card=0x14841022
    cap 08[c8] = HT MSI fixed address window enabled at 0xfee00000
    ecap 000b[100] = Vendor 1 ID 1
    ecap 0019[270] = PCIe Sec 1 lane errors 0
    ecap 0025[400] = Data Link Feature 1
    ecap 0026[410] = Physical Layer 16.0 GT/s 1
    ecap 0027[440] = Lane Margining at Receiver 1

pcib8@pci0:3:10:0:	class=0x060400 card=0x14841022 chip=0x57a41022 rev=0x00 hdr=0x01
    vendor     = 'Advanced Micro Devices, Inc. [AMD]'
    device     = 'Matisse PCIe GPP Bridge'
    class      = bridge
    subclass   = PCI-PCI
    cap 01[50] = powerspec 3  supports D0 D3  current D0
    cap 10[58] = PCI-Express 2 downstream port max data 256(512) RO NS
                 link x16(x16) speed 16.0(16.0) ASPM disabled(L0s/L1)
    cap 05[a0] = MSI supports 1 message, 64 bit 
    cap 0d[c0] = PCI Bridge card=0x14841022
    cap 08[c8] = HT MSI fixed address window enabled at 0xfee00000
    ecap 000b[100] = Vendor 1 ID 1
    ecap 0019[270] = PCIe Sec 1 lane errors 0
    ecap 0025[400] = Data Link Feature 1
    ecap 0026[410] = Physical Layer 16.0 GT/s 1
    ecap 0027[440] = Lane Margining at Receiver 1

nvme1@pci0:4:0:0:	class=0x010802 card=0x50161987 chip=0x50161987 rev=0x01 hdr=0x00
    vendor     = 'Phison Electronics Corporation'
    device     = 'E16 PCIe4 NVMe Controller'
    class      = mass storage
    subclass   = NVM
    bar   [10] = type Memory, range 64, base 0xfcb00000, size 16384, enabled
    cap 10[80] = PCI-Express 2 endpoint max data 256(256) FLR RO NS
                 link x4(x4) speed 16.0(16.0) ASPM disabled(L1)
    cap 11[d0] = MSI-X supports 9 messages, enabled
                 Table in map 0x10[0x2000], PBA in map 0x10[0x3000]
    cap 05[e0] = MSI supports 8 messages, 64 bit 
    cap 01[f8] = powerspec 3  supports D0 D3  current D0
    ecap 0018[100] = LTR 1
    ecap 001e[110] = L1 PM Substates 1
    ecap 000e[128] = ARI 1
    ecap 0025[1e0] = Data Link Feature 1
    ecap 0001[200] = AER 2 0 fatal 0 non-fatal 1 corrected
    ecap 0019[300] = PCIe Sec 1 lane errors 0
    ecap 0026[340] = Physical Layer 16.0 GT/s 1
    ecap 0027[378] = Lane Margining at Receiver 1

igb0@pci0:5:0:0:	class=0x020000 card=0x15391849 chip=0x15398086 rev=0x03 hdr=0x00
    vendor     = 'Intel Corporation'
    device     = 'I211 Gigabit Network Connection'
    class      = network
    subclass   = ethernet
    bar   [10] = type Memory, range 32, base 0xfca00000, size 131072, enabled
    bar   [18] = type I/O Port, range 32, base 0xf000, size 32, enabled
    bar   [1c] = type Memory, range 32, base 0xfca20000, size 16384, enabled
    cap 01[40] = powerspec 3  supports D0 D3  current D0
    cap 05[50] = MSI supports 1 message, 64 bit, vector masks 
    cap 11[70] = MSI-X supports 5 messages, enabled
                 Table in map 0x1c[0x0], PBA in map 0x1c[0x2000]
    cap 10[a0] = PCI-Express 2 endpoint max data 256(512) FLR RO NS
                 link x1(x1) speed 2.5(2.5) ASPM disabled(L0s/L1)
    ecap 0001[100] = AER 2 0 fatal 0 non-fatal 3 corrected
    ecap 0003[140] = Serial 1 a8a159ffff2a019c
    ecap 0017[1a0] = TPH Requester 1

none0@pci0:6:0:0:	class=0x130000 card=0x14851022 chip=0x14851022 rev=0x00 hdr=0x00
    vendor     = 'Advanced Micro Devices, Inc. [AMD]'
    device     = 'Starship/Matisse Reserved SPP'
    class      = non-essential instrumentation
    cap 09[48] = vendor (length 8)
    cap 01[50] = powerspec 3  supports D0 D3  current D0
    cap 10[64] = PCI-Express 2 endpoint max data 256(256) RO NS
                 link x16(x16) speed 16.0(16.0) ASPM disabled(L0s/L1)
    ecap 000b[100] = Vendor 1 ID 1
    ecap 0019[270] = PCIe Sec 1 lane errors 0
    ecap 0025[400] = Data Link Feature 1
    ecap 0026[410] = Physical Layer 16.0 GT/s 1
    ecap 0027[440] = Lane Margining at Receiver 1

xhci0@pci0:6:0:1:	class=0x0c0330 card=0x14861022 chip=0x149c1022 rev=0x00 hdr=0x00
    vendor     = 'Advanced Micro Devices, Inc. [AMD]'
    device     = 'Matisse USB 3.0 Host Controller'
    class      = serial bus
    subclass   = USB
    bar   [10] = type Memory, range 64, base 0xfc700000, size 1048576, enabled
    cap 09[48] = vendor (length 8)
    cap 01[50] = powerspec 3  supports D0 D3  current D0
    cap 10[64] = PCI-Express 2 endpoint max data 256(256) RO NS
                 link x16(x16) speed 16.0(16.0) ASPM disabled(L0s/L1)
    cap 05[a0] = MSI supports 1 message, 64 bit enabled with 1 message
    ecap 000b[100] = Vendor 1 ID 1

xhci1@pci0:6:0:3:	class=0x0c0330 card=0x148c1022 chip=0x149c1022 rev=0x00 hdr=0x00
    vendor     = 'Advanced Micro Devices, Inc. [AMD]'
    device     = 'Matisse USB 3.0 Host Controller'
    class      = serial bus
    subclass   = USB
    bar   [10] = type Memory, range 64, base 0xfc600000, size 1048576, enabled
    cap 09[48] = vendor (length 8)
    cap 01[50] = powerspec 3  supports D0 D3  current D0
    cap 10[64] = PCI-Express 2 endpoint max data 256(256) RO NS
                 link x16(x16) speed 16.0(16.0) ASPM disabled(L0s/L1)
    cap 05[a0] = MSI supports 8 messages, 64 bit enabled with 1 message
    cap 11[c0] = MSI-X supports 8 messages
                 Table in map 0x10[0xfe000], PBA in map 0x10[0xff000]
    ecap 000b[100] = Vendor 1 ID 1

ahci0@pci0:7:0:0:	class=0x010601 card=0x79011022 chip=0x79011022 rev=0x51 hdr=0x00
    vendor     = 'Advanced Micro Devices, Inc. [AMD]'
    device     = 'FCH SATA Controller [AHCI mode]'
    class      = mass storage
    subclass   = SATA
    bar   [24] = type Memory, range 32, base 0xfc900000, size 2048, enabled
    cap 09[48] = vendor (length 8)
    cap 01[50] = powerspec 3  supports D0 D3  current D0
    cap 10[64] = PCI-Express 2 endpoint max data 256(256) RO NS
                 link x16(x16) speed 16.0(16.0) ASPM disabled(L0s/L1)
    cap 05[a0] = MSI supports 16 messages, 64 bit enabled with 1 message
    cap 12[d0] = SATA Index-Data Pair
    ecap 000b[100] = Vendor 1 ID 1
    ecap 0019[270] = PCIe Sec 1 lane errors 0
    ecap 0025[400] = Data Link Feature 1
    ecap 0026[410] = Physical Layer 16.0 GT/s 1
    ecap 0027[440] = Lane Margining at Receiver 1

ahci1@pci0:8:0:0:	class=0x010601 card=0x79011022 chip=0x79011022 rev=0x51 hdr=0x00
    vendor     = 'Advanced Micro Devices, Inc. [AMD]'
    device     = 'FCH SATA Controller [AHCI mode]'
    class      = mass storage
    subclass   = SATA
    bar   [24] = type Memory, range 32, base 0xfc800000, size 2048, enabled
    cap 09[48] = vendor (length 8)
    cap 01[50] = powerspec 3  supports D0 D3  current D0
    cap 10[64] = PCI-Express 2 endpoint max data 256(256) RO NS
                 link x16(x16) speed 16.0(16.0) ASPM disabled(L0s/L1)
    cap 05[a0] = MSI supports 16 messages, 64 bit enabled with 1 message
    cap 12[d0] = SATA Index-Data Pair
    ecap 000b[100] = Vendor 1 ID 1
    ecap 0019[270] = PCIe Sec 1 lane errors 0
    ecap 0025[400] = Data Link Feature 1
    ecap 0026[410] = Physical Layer 16.0 GT/s 1
    ecap 0027[440] = Lane Margining at Receiver 1

none1@pci0:9:0:0:	class=0x130000 card=0x148a1022 chip=0x148a1022 rev=0x00 hdr=0x00
    vendor     = 'Advanced Micro Devices, Inc. [AMD]'
    device     = 'Starship/Matisse PCIe Dummy Function'
    class      = non-essential instrumentation
    cap 09[48] = vendor (length 8)
    cap 01[50] = powerspec 3  supports D0 D3  current D0
    cap 10[64] = PCI-Express 2 endpoint max data 256(256) FLR RO NS
                 link x16(x16) speed 16.0(16.0) ASPM disabled(L0s/L1)
    ecap 000b[100] = Vendor 1 ID 1
    ecap 0001[150] = AER 2 0 fatal 0 non-fatal 0 corrected
    ecap 0019[270] = PCIe Sec 1 lane errors 0
    ecap 000d[2a0] = ACS 1
    ecap 0025[400] = Data Link Feature 1
    ecap 0026[410] = Physical Layer 16.0 GT/s 1
    ecap 0027[440] = Lane Margining at Receiver 1

none2@pci0:10:0:0:	class=0x130000 card=0x14851022 chip=0x14851022 rev=0x00 hdr=0x00
    vendor     = 'Advanced Micro Devices, Inc. [AMD]'
    device     = 'Starship/Matisse Reserved SPP'
    class      = non-essential instrumentation
    cap 09[48] = vendor (length 8)
    cap 01[50] = powerspec 3  supports D0 D3  current D0
    cap 10[64] = PCI-Express 2 endpoint max data 256(256) FLR RO NS
                 link x16(x16) speed 16.0(16.0) ASPM disabled(L0s/L1)
    ecap 000b[100] = Vendor 1 ID 1
    ecap 0001[150] = AER 2 0 fatal 0 non-fatal 1 corrected
    ecap 0019[270] = PCIe Sec 1 lane errors 0
    ecap 000d[2a0] = ACS 1
    ecap 0025[400] = Data Link Feature 1
    ecap 0026[410] = Physical Layer 16.0 GT/s 1
    ecap 0027[440] = Lane Margining at Receiver 1

none3@pci0:10:0:1:	class=0x108000 card=0x14861022 chip=0x14861022 rev=0x00 hdr=0x00
    vendor     = 'Advanced Micro Devices, Inc. [AMD]'
    device     = 'Starship/Matisse Cryptographic Coprocessor PSPCPP'
    class      = encrypt/decrypt
    bar   [18] = type Memory, range 32, base 0xfcd00000, size 1048576, enabled
    bar   [24] = type Memory, range 32, base 0xfce08000, size 8192, enabled
    cap 09[48] = vendor (length 8)
    cap 01[50] = powerspec 3  supports D0 D3  current D0
    cap 10[64] = PCI-Express 2 endpoint max data 256(256) FLR RO NS
                 link x16(x16) speed 16.0(16.0) ASPM disabled(L0s/L1)
    cap 05[a0] = MSI supports 1 message, 64 bit 
    cap 11[c0] = MSI-X supports 2 messages
                 Table in map 0x24[0x0], PBA in map 0x24[0x1000]
    ecap 000b[100] = Vendor 1 ID 1
    ecap 0001[150] = AER 2 0 fatal 0 non-fatal 1 corrected
    ecap 000d[2a0] = ACS 1
    ecap 0017[370] = TPH Requester 1

xhci2@pci0:10:0:3:	class=0x0c0330 card=0x79141022 chip=0x149c1022 rev=0x00 hdr=0x00
    vendor     = 'Advanced Micro Devices, Inc. [AMD]'
    device     = 'Matisse USB 3.0 Host Controller'
    class      = serial bus
    subclass   = USB
    bar   [10] = type Memory, range 64, base 0xfcc00000, size 1048576, enabled
    cap 09[48] = vendor (length 8)
    cap 01[50] = powerspec 3  supports D0 D3  current D0
    cap 10[64] = PCI-Express 2 endpoint max data 256(256) FLR RO NS
                 link x16(x16) speed 16.0(16.0) ASPM disabled(L0s/L1)
    cap 05[a0] = MSI supports 8 messages, 64 bit enabled with 1 message
    cap 11[c0] = MSI-X supports 8 messages
                 Table in map 0x10[0xfe000], PBA in map 0x10[0xff000]
    ecap 000b[100] = Vendor 1 ID 1
    ecap 0001[150] = AER 2 0 fatal 0 non-fatal 1 corrected
    ecap 000d[2a0] = ACS 1
    ecap 0017[370] = TPH Requester 1

hdac0@pci0:10:0:4:	class=0x040300 card=0x12021849 chip=0x14871022 rev=0x00 hdr=0x00
    vendor     = 'Advanced Micro Devices, Inc. [AMD]'
    device     = 'Starship/Matisse HD Audio Controller'
    class      = multimedia
    subclass   = HDA
    bar   [10] = type Memory, range 32, base 0xfce00000, size 32768, enabled
    cap 09[48] = vendor (length 8)
    cap 01[50] = powerspec 3  supports D0 D3  current D0
    cap 10[64] = PCI-Express 2 endpoint max data 256(256) FLR RO NS
                 link x16(x16) speed 16.0(16.0) ASPM disabled(L0s/L1)
    cap 05[a0] = MSI supports 1 message, 64 bit enabled with 1 message
    ecap 000b[100] = Vendor 1 ID 1
    ecap 0001[150] = AER 2 0 fatal 0 non-fatal 1 corrected
    ecap 000d[2a0] = ACS 1
    ecap 0017[370] = TPH Requester 1
