hostb0@pci0:0:0:0:	class=0x060000 card=0x00008086 chip=0xd1318086 rev=0x11 hdr=0x00
    vendor     = 'Intel Corporation'
    device     = 'Core Processor DMI'
    class      = bridge
    subclass   = HOST-PCI
    cap 00[40] = unknown

pcib1@pci0:0:3:0:	class=0x060400 card=0x00008086 chip=0xd1388086 rev=0x11 hdr=0x01
    vendor     = 'Intel Corporation'
    device     = 'Core Processor PCI Express Root Port 1'
    class      = bridge
    subclass   = PCI-PCI
    cap 0d[40] = PCI Bridge card=0x00008086
    cap 05[60] = MSI supports 2 messages, vector masks 
    cap 10[90] = PCI-Express 2 root port max data 256(256) ARI disabled
                 link x16(x16) speed 5.0(5.0)
    cap 01[e0] = powerspec 3  supports D0 D3  current D0
    ecap 0001[100] = AER 1 0 fatal 0 non-fatal 0 corrected
    ecap 000d[150] = ACS 1
    ecap 000b[160] = Vendor 0none0@pci0:0:8:0:	class=0x088000 card=0x00000000 chip=0xd1558086 rev=0x11 hdr=0x00
    vendor     = 'Intel Corporation'
    device     = 'Core Processor System Management Registers'
    class      = base peripheral
    cap 10[40] = PCI-Express 2 root endpoint max data 128(128)
                 link x0(x0) ASPM disabled(L0s)
    ecap 000b[100] = Vendor 0none1@pci0:0:8:1:	class=0x088000 card=0x00000000 chip=0xd1568086 rev=0x11 hdr=0x00
    vendor     = 'Intel Corporation'
    device     = 'Core Processor Semaphore and Scratchpad Registers'
    class      = base peripheral
    cap 10[40] = PCI-Express 2 root endpoint max data 128(128)
                 link x0(x0) ASPM disabled(L0s)
    ecap 000b[100] = Vendor 0none2@pci0:0:8:2:	class=0x088000 card=0x00000000 chip=0xd1578086 rev=0x11 hdr=0x00
    vendor     = 'Intel Corporation'
    device     = 'Core Processor System Control and Status Registers'
    class      = base peripheral
    cap 10[40] = PCI-Express 2 root endpoint max data 128(128)
                 link x0(x0) ASPM disabled(L0s)
    ecap 000b[100] = Vendor 0none3@pci0:0:8:3:	class=0x088000 card=0x00000000 chip=0xd1588086 rev=0x11 hdr=0x00
    vendor     = 'Intel Corporation'
    device     = 'Core Processor Miscellaneous Registers'
    class      = base peripheral

none4@pci0:0:16:0:	class=0x088000 card=0x00000000 chip=0xd1508086 rev=0x11 hdr=0x00
    vendor     = 'Intel Corporation'
    device     = 'Core Processor QPI Link'
    class      = base peripheral

none5@pci0:0:16:1:	class=0x088000 card=0x00000000 chip=0xd1518086 rev=0x11 hdr=0x00
    vendor     = 'Intel Corporation'
    device     = 'Core Processor QPI Routing and Protocol Registers'
    class      = base peripheral

none6@pci0:0:26:0:	class=0x0c0300 card=0x72708086 chip=0x3b3b8086 rev=0x06 hdr=0x00
    vendor     = 'Intel Corporation'
    device     = '5 Series/3400 Series Chipset USB Universal Host Controller'
    class      = serial bus
    subclass   = USB
    bar   [20] = type I/O Port, range 32, base 0x3100, size 32, enabled
    cap 13[50] = PCI Advanced Features: FLR TP

ehci0@pci0:0:26:7:	class=0x0c0320 card=0x72708086 chip=0x3b3c8086 rev=0x06 hdr=0x00
    vendor     = 'Intel Corporation'
    device     = '5 Series/3400 Series Chipset USB2 Enhanced Host Controller'
    class      = serial bus
    subclass   = USB
    bar   [10] = type Memory, range 32, base 0xd0505c00, size 1024, enabled
    cap 01[50] = powerspec 2  supports D0 D3  current D0
    cap 0a[58] = EHCI Debug Port at offset 0xa0 in map 0x14
    cap 13[98] = PCI Advanced Features: FLR TP

hdac1@pci0:0:27:0:	class=0x040300 card=0x72708086 chip=0x3b568086 rev=0x06 hdr=0x00
    vendor     = 'Intel Corporation'
    device     = '5 Series/3400 Series Chipset High Definition Audio'
    class      = multimedia
    subclass   = HDA
    bar   [10] = type Memory, range 64, base 0xd0500000, size 16384, enabled
    cap 01[50] = powerspec 2  supports D0 D3  current D0
    cap 05[60] = MSI supports 1 message, 64 bit enabled with 1 message
    cap 10[70] = PCI-Express 1 root endpoint max data 128(128) FLR
    ecap 0002[100] = VC 1 max VC1
    ecap 0005[130] = Root Complex Link Declaration 1

pcib2@pci0:0:28:0:	class=0x060400 card=0x72708086 chip=0x3b428086 rev=0x06 hdr=0x01
    vendor     = 'Intel Corporation'
    device     = '5 Series/3400 Series Chipset PCI Express Root Port 1'
    class      = bridge
    subclass   = PCI-PCI
    cap 10[40] = PCI-Express 2 root port max data 128(128)
                 link x1(x1) speed 2.5(2.5) ASPM disabled(L0s/L1)
                 slot 0 power limit 100 mW HotPlug(present) surprise
    cap 05[80] = MSI supports 1 message enabled with 1 message
    cap 0d[90] = PCI Bridge card=0x72708086
    cap 01[a0] = powerspec 2  supports D0 D3  current D0

pcib3@pci0:0:28:1:	class=0x060400 card=0x72708086 chip=0x3b448086 rev=0x06 hdr=0x01
    vendor     = 'Intel Corporation'
    device     = '5 Series/3400 Series Chipset PCI Express Root Port 2'
    class      = bridge
    subclass   = PCI-PCI
    cap 10[40] = PCI-Express 2 root port max data 128(128)
                 link x1(x1) speed 2.5(2.5) ASPM disabled(L0s/L1)
                 slot 1 power limit 100 mW HotPlug(present) surprise
    cap 05[80] = MSI supports 1 message enabled with 1 message
    cap 0d[90] = PCI Bridge card=0x72708086
    cap 01[a0] = powerspec 2  supports D0 D3  current D0

pcib4@pci0:0:28:2:	class=0x060400 card=0x72708086 chip=0x3b468086 rev=0x06 hdr=0x01
    vendor     = 'Intel Corporation'
    device     = '5 Series/3400 Series Chipset PCI Express Root Port 3'
    class      = bridge
    subclass   = PCI-PCI
    cap 10[40] = PCI-Express 2 root port max data 128(128)
                 link x1(x1) speed 2.5(2.5) ASPM disabled(L0s/L1)
                 slot 2 power limit 100 mW HotPlug(present) surprise
    cap 05[80] = MSI supports 1 message enabled with 1 message
    cap 0d[90] = PCI Bridge card=0x72708086
    cap 01[a0] = powerspec 2  supports D0 D3  current D0

none7@pci0:0:29:0:	class=0x0c0300 card=0x72708086 chip=0x3b368086 rev=0x06 hdr=0x00
    vendor     = 'Intel Corporation'
    device     = '5 Series/3400 Series Chipset USB Universal Host Controller'
    class      = serial bus
    subclass   = USB
    bar   [20] = type I/O Port, range 32, base 0x30a0, size 32, enabled
    cap 13[50] = PCI Advanced Features: FLR TP

ehci1@pci0:0:29:7:	class=0x0c0320 card=0x72708086 chip=0x3b348086 rev=0x06 hdr=0x00
    vendor     = 'Intel Corporation'
    device     = '5 Series/3400 Series Chipset USB2 Enhanced Host Controller'
    class      = serial bus
    subclass   = USB
    bar   [10] = type Memory, range 32, base 0xd0505800, size 1024, enabled
    cap 01[50] = powerspec 2  supports D0 D3  current D0
    cap 0a[58] = EHCI Debug Port at offset 0xa0 in map 0x14
    cap 13[98] = PCI Advanced Features: FLR TP

pcib6@pci0:0:30:0:	class=0x060401 card=0x72708086 chip=0x244e8086 rev=0xa6 hdr=0x01
    vendor     = 'Intel Corporation'
    device     = '82801 PCI Bridge'
    class      = bridge
    subclass   = PCI-PCI
    cap 0d[50] = PCI Bridge card=0x72708086

isab0@pci0:0:31:0:	class=0x060100 card=0x72708086 chip=0x3b028086 rev=0x06 hdr=0x00
    vendor     = 'Intel Corporation'
    device     = 'P55 Chipset LPC Interface Controller'
    class      = bridge
    subclass   = PCI-ISA
    cap 09[e0] = vendor (length 16) Intel cap 1 version 1

ahci0@pci0:0:31:2:	class=0x010601 card=0x72708086 chip=0x3b228086 rev=0x06 hdr=0x00
    vendor     = 'Intel Corporation'
    device     = '5 Series/3400 Series Chipset 6 port SATA AHCI Controller'
    class      = mass storage
    subclass   = SATA
    bar   [10] = type I/O Port, range 32, base 0x3128, size 8, enabled
    bar   [14] = type I/O Port, range 32, base 0x3134, size 4, enabled
    bar   [18] = type I/O Port, range 32, base 0x3120, size 8, enabled
    bar   [1c] = type I/O Port, range 32, base 0x3130, size 4, enabled
    bar   [20] = type I/O Port, range 32, base 0x3020, size 32, enabled
    bar   [24] = type Memory, range 32, base 0xd0505000, size 2048, enabled
    cap 05[80] = MSI supports 1 message enabled with 1 message
    cap 01[70] = powerspec 3  supports D0 D3  current D0
    cap 12[a8] = SATA Index-Data Pair
    cap 13[b0] = PCI Advanced Features: FLR TP

none8@pci0:0:31:3:	class=0x0c0500 card=0x72708086 chip=0x3b308086 rev=0x06 hdr=0x00
    vendor     = 'Intel Corporation'
    device     = '5 Series/3400 Series Chipset SMBus Controller'
    class      = serial bus
    subclass   = SMBus
    bar   [10] = type Memory, range 64, base 0xd0506000, size 256, enabled
    bar   [20] = type I/O Port, range 32, base 0xefa0, size 32, enabled

none9@pci0:0:31:6:	class=0x118000 card=0x00008086 chip=0x3b328086 rev=0x06 hdr=0x00
    vendor     = 'Intel Corporation'
    device     = '5 Series/3400 Series Chipset Thermal Subsystem'
    class      = dasp
    bar   [10] = type Memory, range 64, base 0xd0504000, size 4096, enabled
    cap 01[50] = powerspec 3  supports D0 D3  current D0
    cap 05[80] = MSI supports 1 message 

vgapci0@pci0:1:0:0:	class=0x030000 card=0x00cc106b chip=0x68a11002 rev=0x00 hdr=0x00
    vendor     = 'Advanced Micro Devices, Inc. [AMD/ATI]'
    device     = 'Broadway PRO [Mobility Radeon HD 5850]'
    class      = display
    subclass   = VGA
    bar   [10] = type Prefetchable Memory, range 64, base 0xc0000000, size 268435456, enabled
    bar   [18] = type Memory, range 64, base 0xd0400000, size 131072, enabled
    bar   [20] = type I/O Port, range 32, base 0x2000, size 256, enabled
    cap 01[50] = powerspec 3  supports D0 D1 D2 D3  current D0
    cap 10[58] = PCI-Express 2 legacy endpoint max data 256(256) RO NS
                 link x16(x16) speed 5.0(5.0) ASPM disabled(L0s/L1)
    cap 05[a0] = MSI supports 1 message, 64 bit enabled with 1 message
    ecap 000b[100] = Vendor 1 ID 1
    ecap 0001[150] = AER 1 0 fatal 0 non-fatal 1 corrected

hdac0@pci0:1:0:1:	class=0x040300 card=0xaa58106b chip=0xaa581002 rev=0x00 hdr=0x00
    vendor     = 'Advanced Micro Devices, Inc. [AMD/ATI]'
    device     = 'Juniper HDMI Audio [Radeon HD 5700 Series]'
    class      = multimedia
    subclass   = HDA
    bar   [10] = type Memory, range 64, base 0xd0440000, size 16384, enabled
    cap 01[50] = powerspec 3  supports D0 D1 D2 D3  current D0
    cap 10[58] = PCI-Express 2 legacy endpoint max data 256(256) RO NS
                 link x16(x16) speed 5.0(5.0) ASPM disabled(L0s/L1)
    cap 05[a0] = MSI supports 1 message, 64 bit enabled with 1 message
    ecap 000b[100] = Vendor 1 ID 1
    ecap 0001[150] = AER 1 0 fatal 0 non-fatal 1 corrected

bge0@pci0:2:0:0:	class=0x020000 card=0x168414e4 chip=0x168414e4 rev=0x10 hdr=0x00
    vendor     = 'Broadcom Inc. and subsidiaries'
    device     = 'NetXtreme BCM5764M Gigabit Ethernet PCIe'
    class      = network
    subclass   = ethernet
    bar   [10] = type Memory, range 64, base 0xd0300000, size 65536, enabled
    cap 01[48] = powerspec 3  supports D0 D3  current D0
    cap 03[40] = VPD
    cap 09[60] = vendor (length 108)
    cap 05[50] = MSI supports 1 message, 64 bit 
    cap 10[cc] = PCI-Express 2 endpoint max data 128(256)
                 link x1(x1) speed 2.5(2.5) ASPM disabled(L0s/L1)
    ecap 0001[100] = AER 1 0 fatal 0 non-fatal 1 corrected
    ecap 0002[13c] = VC 1 max VC0
    ecap 0003[160] = Serial 1 c42c03fffe282870
    ecap 0004[16c] = Power Budgeting 1

ath0@pci0:3:0:0:	class=0x028000 card=0x008f106b chip=0x002a168c rev=0x01 hdr=0x00
    vendor     = 'Qualcomm Atheros'
    device     = 'AR928X Wireless Network Adapter (PCI-Express)'
    class      = network
    bar   [10] = type Memory, range 64, base 0xd0200000, size 65536, enabled
    cap 01[40] = powerspec 2  supports D0 D1 D3  current D0
    cap 05[50] = MSI supports 1 message 
    cap 10[60] = PCI-Express 1 legacy endpoint max data 128(128) RO
                 link x1(x1) speed 2.5(2.5) ASPM disabled(L1)
    cap 11[90] = MSI-X supports 1 message
                 Table in map 0x10[0x0], PBA in map 0x10[0x0]
    ecap 0001[100] = AER 1 0 fatal 1 non-fatal 0 corrected
    ecap 0002[140] = VC 1 max VC0
    ecap 0003[160] = Serial 1 0000000000000000

pcib5@pci0:4:0:0:	class=0x060400 card=0x00000000 chip=0x823e104c rev=0x01 hdr=0x01
    vendor     = 'Texas Instruments'
    device     = 'XIO2213A/B/XIO2221 PCI Express to PCI Bridge [Cheetah Express]'
    class      = bridge
    subclass   = PCI-PCI
    cap 01[50] = powerspec 3  supports D0 D1 D2 D3  current D0
    cap 05[60] = MSI supports 16 messages, 64 bit 
    cap 0d[80] = PCI Bridge card=0x00000000
    cap 10[90] = PCI-Express 1 PCI bridge max data 128(512) NS
                 link x1(x1) speed 2.5(2.5) ASPM disabled(L0s/L1)
    ecap 0001[100] = AER 1 0 fatal 1 non-fatal 1 corrected

fwohci0@pci0:5:0:0:	class=0x0c0010 card=0x00000000 chip=0x823f104c rev=0x01 hdr=0x00
    vendor     = 'Texas Instruments'
    device     = 'XIO2213A/B/XIO2221 IEEE-1394b OHCI Controller [Cheetah Express]'
    class      = serial bus
    subclass   = FireWire
    bar   [10] = type Memory, range 32, base 0xd0104000, size 2048, enabled
    bar   [14] = type Memory, range 32, base 0xd0100000, size 16384, enabled
    cap 01[44] = powerspec 3  supports D0 D1 D2 D3  current D0

hostb1@pci0:255:0:0:	class=0x060000 card=0x80868086 chip=0x2c518086 rev=0x04 hdr=0x00
    vendor     = 'Intel Corporation'
    device     = 'Core Processor QuickPath Architecture Generic Non-Core Registers'
    class      = bridge
    subclass   = HOST-PCI

hostb2@pci0:255:0:1:	class=0x060000 card=0x80868086 chip=0x2c818086 rev=0x04 hdr=0x00
    vendor     = 'Intel Corporation'
    device     = 'Core Processor QuickPath Architecture System Address Decoder'
    class      = bridge
    subclass   = HOST-PCI

hostb3@pci0:255:2:0:	class=0x060000 card=0x80868086 chip=0x2c908086 rev=0x04 hdr=0x00
    vendor     = 'Intel Corporation'
    device     = 'Core Processor QPI Link 0'
    class      = bridge
    subclass   = HOST-PCI

hostb4@pci0:255:2:1:	class=0x060000 card=0x80868086 chip=0x2c918086 rev=0x04 hdr=0x00
    vendor     = 'Intel Corporation'
    device     = 'Core Processor QPI Physical 0'
    class      = bridge
    subclass   = HOST-PCI

hostb5@pci0:255:3:0:	class=0x060000 card=0x80868086 chip=0x2c988086 rev=0x04 hdr=0x00
    vendor     = 'Intel Corporation'
    device     = 'Core Processor Integrated Memory Controller'
    class      = bridge
    subclass   = HOST-PCI

hostb6@pci0:255:3:1:	class=0x060000 card=0x80868086 chip=0x2c998086 rev=0x04 hdr=0x00
    vendor     = 'Intel Corporation'
    device     = 'Core Processor Integrated Memory Controller Target Address Decoder'
    class      = bridge
    subclass   = HOST-PCI

hostb7@pci0:255:3:4:	class=0x060000 card=0x80868086 chip=0x2c9c8086 rev=0x04 hdr=0x00
    vendor     = 'Intel Corporation'
    device     = 'Core Processor Integrated Memory Controller Test Registers'
    class      = bridge
    subclass   = HOST-PCI

hostb8@pci0:255:4:0:	class=0x060000 card=0x80868086 chip=0x2ca08086 rev=0x04 hdr=0x00
    vendor     = 'Intel Corporation'
    device     = 'Core Processor Integrated Memory Controller Channel 0 Control Registers'
    class      = bridge
    subclass   = HOST-PCI

hostb9@pci0:255:4:1:	class=0x060000 card=0x80868086 chip=0x2ca18086 rev=0x04 hdr=0x00
    vendor     = 'Intel Corporation'
    device     = 'Core Processor Integrated Memory Controller Channel 0 Address Registers'
    class      = bridge
    subclass   = HOST-PCI

hostb10@pci0:255:4:2:	class=0x060000 card=0x80868086 chip=0x2ca28086 rev=0x04 hdr=0x00
    vendor     = 'Intel Corporation'
    device     = 'Core Processor Integrated Memory Controller Channel 0 Rank Registers'
    class      = bridge
    subclass   = HOST-PCI

hostb11@pci0:255:4:3:	class=0x060000 card=0x80868086 chip=0x2ca38086 rev=0x04 hdr=0x00
    vendor     = 'Intel Corporation'
    device     = 'Core Processor Integrated Memory Controller Channel 0 Thermal Control Registers'
    class      = bridge
    subclass   = HOST-PCI

hostb12@pci0:255:5:0:	class=0x060000 card=0x80868086 chip=0x2ca88086 rev=0x04 hdr=0x00
    vendor     = 'Intel Corporation'
    device     = 'Core Processor Integrated Memory Controller Channel 1 Control Registers'
    class      = bridge
    subclass   = HOST-PCI

hostb13@pci0:255:5:1:	class=0x060000 card=0x80868086 chip=0x2ca98086 rev=0x04 hdr=0x00
    vendor     = 'Intel Corporation'
    device     = 'Core Processor Integrated Memory Controller Channel 1 Address Registers'
    class      = bridge
    subclass   = HOST-PCI

hostb14@pci0:255:5:2:	class=0x060000 card=0x80868086 chip=0x2caa8086 rev=0x04 hdr=0x00
    vendor     = 'Intel Corporation'
    device     = 'Core Processor Integrated Memory Controller Channel 1 Rank Registers'
    class      = bridge
    subclass   = HOST-PCI

hostb15@pci0:255:5:3:	class=0x060000 card=0x80868086 chip=0x2cab8086 rev=0x04 hdr=0x00
    vendor     = 'Intel Corporation'
    device     = 'Core Processor Integrated Memory Controller Channel 1 Thermal Control Registers'
    class      = bridge
    subclass   = HOST-PCI
