hostb0@pci0:0:0:0:	class=0x060000 rev=0x07 hdr=0x00 vendor=0x8086 device=0x2020 subvendor=0x8086 subdevice=0x0000
    vendor     = 'Intel Corporation'
    device     = 'Sky Lake-E DMI3 Registers'
    class      = bridge
    subclass   = HOST-PCI
    cap 10[90] = PCI-Express 2 root port max data 128(256)
                 max read 128
                 link x0(x4) speed 0.0(8.0)
    cap 01[e0] = powerspec 3  supports D0 D3  current D0
    ecap 000b[100] = Vendor [1] ID 0002 Rev 0 Length 12
    ecap 000b[144] = Vendor [1] ID 0004 Rev 1 Length 60
    ecap 000b[1d0] = Vendor [1] ID 0003 Rev 1 Length 10
    ecap 0019[250] = PCIe Sec 1 lane errors 0x7
    ecap 000b[280] = Vendor [1] ID 0005 Rev 3 Length 24
    ecap 000b[300] = Vendor [1] ID 0008 Rev 0 Length 56

ioat0@pci0:0:4:0:	class=0x088000 rev=0x07 hdr=0x00 vendor=0x8086 device=0x2021 subvendor=0x8086 subdevice=0x0000
    vendor     = 'Intel Corporation'
    device     = 'Sky Lake-E CBDMA Registers'
    class      = base peripheral
    bar   [10] = type Memory, range 64, base 0x38003ff40000, size 16384, enabled
    cap 11[80] = MSI-X supports 1 message, enabled
                 Table in map 0x10[0x2000], PBA in map 0x10[0x3000]
    cap 10[90] = PCI-Express 2 root endpoint max data 128(128)
                 max read 128
    cap 01[e0] = powerspec 3  supports D0 D3  current D0

ioat1@pci0:0:4:1:	class=0x088000 rev=0x07 hdr=0x00 vendor=0x8086 device=0x2021 subvendor=0x8086 subdevice=0x0000
    vendor     = 'Intel Corporation'
    device     = 'Sky Lake-E CBDMA Registers'
    class      = base peripheral
    bar   [10] = type Memory, range 64, base 0x38003ff3c000, size 16384, enabled
    cap 11[80] = MSI-X supports 1 message, enabled
                 Table in map 0x10[0x2000], PBA in map 0x10[0x3000]
    cap 10[90] = PCI-Express 2 root endpoint max data 128(128)
                 max read 128
    cap 01[e0] = powerspec 3  supports D0 D3  current D0

ioat2@pci0:0:4:2:	class=0x088000 rev=0x07 hdr=0x00 vendor=0x8086 device=0x2021 subvendor=0x8086 subdevice=0x0000
    vendor     = 'Intel Corporation'
    device     = 'Sky Lake-E CBDMA Registers'
    class      = base peripheral
    bar   [10] = type Memory, range 64, base 0x38003ff38000, size 16384, enabled
    cap 11[80] = MSI-X supports 1 message, enabled
                 Table in map 0x10[0x2000], PBA in map 0x10[0x3000]
    cap 10[90] = PCI-Express 2 root endpoint max data 128(128)
                 max read 128
    cap 01[e0] = powerspec 3  supports D0 D3  current D0

ioat3@pci0:0:4:3:	class=0x088000 rev=0x07 hdr=0x00 vendor=0x8086 device=0x2021 subvendor=0x8086 subdevice=0x0000
    vendor     = 'Intel Corporation'
    device     = 'Sky Lake-E CBDMA Registers'
    class      = base peripheral
    bar   [10] = type Memory, range 64, base 0x38003ff34000, size 16384, enabled
    cap 11[80] = MSI-X supports 1 message, enabled
                 Table in map 0x10[0x2000], PBA in map 0x10[0x3000]
    cap 10[90] = PCI-Express 2 root endpoint max data 128(128)
                 max read 128
    cap 01[e0] = powerspec 3  supports D0 D3  current D0

ioat4@pci0:0:4:4:	class=0x088000 rev=0x07 hdr=0x00 vendor=0x8086 device=0x2021 subvendor=0x8086 subdevice=0x0000
    vendor     = 'Intel Corporation'
    device     = 'Sky Lake-E CBDMA Registers'
    class      = base peripheral
    bar   [10] = type Memory, range 64, base 0x38003ff30000, size 16384, enabled
    cap 11[80] = MSI-X supports 1 message, enabled
                 Table in map 0x10[0x2000], PBA in map 0x10[0x3000]
    cap 10[90] = PCI-Express 2 root endpoint max data 128(128)
                 max read 128
    cap 01[e0] = powerspec 3  supports D0 D3  current D0

ioat5@pci0:0:4:5:	class=0x088000 rev=0x07 hdr=0x00 vendor=0x8086 device=0x2021 subvendor=0x8086 subdevice=0x0000
    vendor     = 'Intel Corporation'
    device     = 'Sky Lake-E CBDMA Registers'
    class      = base peripheral
    bar   [10] = type Memory, range 64, base 0x38003ff2c000, size 16384, enabled
    cap 11[80] = MSI-X supports 1 message, enabled
                 Table in map 0x10[0x2000], PBA in map 0x10[0x3000]
    cap 10[90] = PCI-Express 2 root endpoint max data 128(128)
                 max read 128
    cap 01[e0] = powerspec 3  supports D0 D3  current D0

ioat6@pci0:0:4:6:	class=0x088000 rev=0x07 hdr=0x00 vendor=0x8086 device=0x2021 subvendor=0x8086 subdevice=0x0000
    vendor     = 'Intel Corporation'
    device     = 'Sky Lake-E CBDMA Registers'
    class      = base peripheral
    bar   [10] = type Memory, range 64, base 0x38003ff28000, size 16384, enabled
    cap 11[80] = MSI-X supports 1 message, enabled
                 Table in map 0x10[0x2000], PBA in map 0x10[0x3000]
    cap 10[90] = PCI-Express 2 root endpoint max data 128(128)
                 max read 128
    cap 01[e0] = powerspec 3  supports D0 D3  current D0

ioat7@pci0:0:4:7:	class=0x088000 rev=0x07 hdr=0x00 vendor=0x8086 device=0x2021 subvendor=0x8086 subdevice=0x0000
    vendor     = 'Intel Corporation'
    device     = 'Sky Lake-E CBDMA Registers'
    class      = base peripheral
    bar   [10] = type Memory, range 64, base 0x38003ff24000, size 16384, enabled
    cap 11[80] = MSI-X supports 1 message, enabled
                 Table in map 0x10[0x2000], PBA in map 0x10[0x3000]
    cap 10[90] = PCI-Express 2 root endpoint max data 128(128)
                 max read 128
    cap 01[e0] = powerspec 3  supports D0 D3  current D0

none0@pci0:0:5:0:	class=0x088000 rev=0x07 hdr=0x00 vendor=0x8086 device=0x2024 subvendor=0x8086 subdevice=0x0000
    vendor     = 'Intel Corporation'
    device     = 'Sky Lake-E MM/Vt-d Configuration Registers'
    class      = base peripheral
    cap 10[40] = PCI-Express 2 root endpoint max data 128(128)
                 max read 128

none1@pci0:0:5:2:	class=0x088000 rev=0x07 hdr=0x00 vendor=0x8086 device=0x2025 subvendor=0x0000 subdevice=0x0000
    vendor     = 'Intel Corporation'
    device     = 'Sky Lake-E RAS'
    class      = base peripheral
    cap 10[40] = PCI-Express 2 root endpoint max data 128(128)
                 max read 128

ioapic0@pci0:0:5:4:	class=0x080020 rev=0x07 hdr=0x00 vendor=0x8086 device=0x2026 subvendor=0x8086 subdevice=0x2026
    vendor     = 'Intel Corporation'
    device     = 'Sky Lake-E IOAPIC'
    class      = base peripheral
    subclass   = interrupt controller
    bar   [10] = type Memory, range 32, base 0x903a8000, size 4096, enabled
    cap 10[44] = PCI-Express 1 root endpoint max data 128(128)
                 max read 128
    cap 01[e0] = powerspec 3  supports D0 D3  current D0

none2@pci0:0:8:0:	class=0x088000 rev=0x07 hdr=0x00 vendor=0x8086 device=0x2014 subvendor=0x8086 subdevice=0x0000
    vendor     = 'Intel Corporation'
    device     = 'Sky Lake-E Ubox Registers'
    class      = base peripheral
    cap 10[40] = PCI-Express 2 root endpoint max data 128(128)
                 max read 128

none3@pci0:0:8:1:	class=0x110100 rev=0x07 hdr=0x00 vendor=0x8086 device=0x2015 subvendor=0x8086 subdevice=0x0000
    vendor     = 'Intel Corporation'
    device     = 'Sky Lake-E Ubox Registers'
    class      = dasp
    subclass   = performance counters

none4@pci0:0:8:2:	class=0x088000 rev=0x07 hdr=0x00 vendor=0x8086 device=0x2016 subvendor=0x8086 subdevice=0x0000
    vendor     = 'Intel Corporation'
    device     = 'Sky Lake-E Ubox Registers'
    class      = base peripheral
    cap 10[40] = PCI-Express 2 root endpoint max data 128(128)
                 max read 128

none5@pci0:0:17:0:	class=0xff0000 rev=0x09 hdr=0x00 vendor=0x8086 device=0xa1ec subvendor=0x1028 subdevice=0x0739
    vendor     = 'Intel Corporation'
    device     = 'C620 Series Chipset Family MROM 0'
    cap 01[80] = powerspec 3  supports D0 D3  current D0

none6@pci0:0:17:1:	class=0xff0000 rev=0x09 hdr=0x00 vendor=0x8086 device=0xa1ed subvendor=0x1028 subdevice=0x0739
    vendor     = 'Intel Corporation'
    device     = 'C620 Series Chipset Family MROM 1'
    cap 01[80] = powerspec 3  supports D0 D3  current D0

xhci0@pci0:0:20:0:	class=0x0c0330 rev=0x09 hdr=0x00 vendor=0x8086 device=0xa1af subvendor=0x1028 subdevice=0x0739
    vendor     = 'Intel Corporation'
    device     = 'C620 Series Chipset Family USB 3.0 xHCI Controller'
    class      = serial bus
    subclass   = USB
    bar   [10] = type Memory, range 64, base 0x38003ff10000, size 65536, enabled
    cap 01[70] = powerspec 2  supports D0 D3  current D0
    cap 05[80] = MSI supports 8 messages, 64 bit enabled with 1 message

pchtherm0@pci0:0:20:2:	class=0x118000 rev=0x09 hdr=0x00 vendor=0x8086 device=0xa1b1 subvendor=0x1028 subdevice=0x0739
    vendor     = 'Intel Corporation'
    device     = 'C620 Series Chipset Family Thermal Subsystem'
    class      = dasp
    bar   [10] = type Memory, range 64, base 0x38003ff45000, size 4096, enabled
    cap 01[50] = powerspec 3  supports D0 D3  current D0
    cap 05[80] = MSI supports 1 message 

none7@pci0:0:22:0:	class=0x078000 rev=0x09 hdr=0x00 vendor=0x8086 device=0xa1ba subvendor=0x1028 subdevice=0x0739
    vendor     = 'Intel Corporation'
    device     = 'C620 Series Chipset Family MEI Controller'
    class      = simple comms
    bar   [10] = type Memory, range 64, base 0x38003ff44000, size 4096, enabled
    cap 01[50] = powerspec 3  supports D0 D3  current D0
    cap 05[8c] = MSI supports 1 message, 64 bit 

none8@pci0:0:22:2:	class=0x010185 rev=0x09 hdr=0x00 vendor=0x8086 device=0xa1bc subvendor=0x1028 subdevice=0x0739
    vendor     = 'Intel Corporation'
    device     = 'C620 Series Chipset Family IDE Redirection'
    class      = mass storage
    subclass   = ATA
    bar   [10] = type I/O Port, range 32, base 0x3090, size 8, enabled
    bar   [14] = type I/O Port, range 32, base 0x3080, size 4, enabled
    bar   [18] = type I/O Port, range 32, base 0x3070, size 8, enabled
    bar   [1c] = type I/O Port, range 32, base 0x3060, size 4, enabled
    bar   [20] = type I/O Port, range 32, base 0x3050, size 16, enabled
    cap 05[40] = MSI supports 1 message, 64 bit 
    cap 01[50] = powerspec 3  supports D0 D3  current D0

ahci0@pci0:0:23:0:	class=0x010400 rev=0x09 hdr=0x00 vendor=0x8086 device=0x2826 subvendor=0x1028 subdevice=0x0739
    vendor     = 'Intel Corporation'
    device     = 'C600/X79 series chipset SATA RAID Controller'
    class      = mass storage
    subclass   = RAID
    bar   [10] = type Memory, range 32, base 0x903a4000, size 8192, enabled
    bar   [14] = type Memory, range 32, base 0x903a6000, size 256, enabled
    bar   [18] = type I/O Port, range 32, base 0x3030, size 8, enabled
    bar   [1c] = type I/O Port, range 32, base 0x3020, size 4, enabled
    bar   [20] = type I/O Port, range 32, base 0x3000, size 32, enabled
    bar   [24] = type Memory, range 32, base 0x90300000, size 524288, enabled
    cap 05[80] = MSI supports 1 message enabled with 1 message
    cap 01[70] = powerspec 3  supports D0 D3  current D0
    cap 12[a8] = SATA Index-Data Pair

pcib1@pci0:0:28:0:	class=0x060400 rev=0xf9 hdr=0x01 vendor=0x8086 device=0xa190 subvendor=0x1028 subdevice=0x0739
    vendor     = 'Intel Corporation'
    device     = 'C620 Series Chipset Family PCI Express Root Port'
    class      = bridge
    subclass   = PCI-PCI
    cap 10[40] = PCI-Express 2 root port max data 128(256) ARI disabled
                 max read 128
                 link x0(x1) speed 0.0(8.0) ASPM L0s/L1(L0s/L1)
    cap 05[80] = MSI supports 1 message 
    cap 0d[90] = PCI Bridge subvendor=0x1028 subdevice=0x0739
    cap 01[a0] = powerspec 3  supports D0 D3  current D0

pcib2@pci0:0:28:7:	class=0x060400 rev=0xf9 hdr=0x01 vendor=0x8086 device=0xa197 subvendor=0x1028 subdevice=0x0739
    vendor     = 'Intel Corporation'
    device     = 'C620 Series Chipset Family PCI Express Root Port'
    class      = bridge
    subclass   = PCI-PCI
    cap 10[40] = PCI-Express 2 root port max data 128(128) ARI disabled
                 max read 128
                 link x1(x1) speed 2.5(8.0)
                 slot 0 power limit 100 mW
    cap 05[80] = MSI supports 1 message 
    cap 0d[90] = PCI Bridge subvendor=0x1028 subdevice=0x0739
    cap 01[a0] = powerspec 3  supports D0 D3  current D0
    ecap 0001[100] = AER 1 0 fatal 0 non-fatal 0 corrected
    ecap 000d[140] = ACS 1
    ecap 0019[220] = PCIe Sec 1 lane errors 0

isab0@pci0:0:31:0:	class=0x060100 rev=0x09 hdr=0x00 vendor=0x8086 device=0xa1c1 subvendor=0x1028 subdevice=0x0739
    vendor     = 'Intel Corporation'
    device     = 'C621 Series Chipset LPC/eSPI Controller'
    class      = bridge
    subclass   = PCI-ISA

none9@pci0:0:31:2:	class=0x058000 rev=0x09 hdr=0x00 vendor=0x8086 device=0xa1a1 subvendor=0x1028 subdevice=0x0739
    vendor     = 'Intel Corporation'
    device     = 'C620 Series Chipset Family Power Management Controller'
    class      = memory
    bar   [10] = type Memory, range 32, base 0x903a0000, size 16384, enabled

hdac0@pci0:0:31:3:	class=0x040300 rev=0x09 hdr=0x00 vendor=0x8086 device=0xa1f0 subvendor=0x1028 subdevice=0x0739
    vendor     = 'Intel Corporation'
    class      = multimedia
    subclass   = HDA
    bar   [10] = type Memory, range 64, base 0x38003ff20000, size 16384, enabled
    bar   [20] = type Memory, range 64, base 0x38003ff00000, size 65536, enabled
    cap 01[50] = powerspec 3  supports D0 D3  current D0
    cap 05[60] = MSI supports 1 message, 64 bit enabled with 1 message
    cap 10[70] = PCI-Express 1 root endpoint max data 128(128) FLR NS
                 max read 512

ichsmb0@pci0:0:31:4:	class=0x0c0500 rev=0x09 hdr=0x00 vendor=0x8086 device=0xa1a3 subvendor=0x1028 subdevice=0x0739
    vendor     = 'Intel Corporation'
    device     = 'C620 Series Chipset Family SMBus'
    class      = serial bus
    subclass   = SMBus
    bar   [10] = type Memory, range 64, base 0, size 256, disabled
    bar   [20] = type I/O Port, range 32, base 0x780, size 32, enabled

none10@pci0:0:31:5:	class=0x0c8000 rev=0x09 hdr=0x00 vendor=0x8086 device=0xa1a4 subvendor=0x1028 subdevice=0x0739
    vendor     = 'Intel Corporation'
    device     = 'C620 Series Chipset Family SPI Controller'
    class      = serial bus
    bar   [10] = type Memory, range 32, base 0xfe010000, size 4096, enabled

em0@pci0:0:31:6:	class=0x020000 rev=0x09 hdr=0x00 vendor=0x8086 device=0x15b9 subvendor=0x1028 subdevice=0x0739
    vendor     = 'Intel Corporation'
    device     = 'Ethernet Connection (3) I219-LM'
    class      = network
    subclass   = ethernet
    bar   [10] = type Memory, range 32, base 0x90380000, size 131072, enabled
    cap 01[c8] = powerspec 3  supports D0 D3  current D0
    cap 05[d0] = MSI supports 1 message, 64 bit enabled with 1 message

pcib3@pci0:2:0:0:	class=0x060400 rev=0x00 hdr=0x01 vendor=0x104c device=0x8240 subvendor=0x0000 subdevice=0x0000
    vendor     = 'Texas Instruments'
    device     = 'XIO2001 PCI Express-to-PCI Bridge'
    class      = bridge
    subclass   = PCI-PCI
    cap 0d[40] = PCI Bridge subvendor=0x0000 subdevice=0x0000
    cap 01[48] = powerspec 3  supports D0 D1 D2 D3  current D0
    cap 05[50] = MSI supports 16 messages, 64 bit 
    cap 10[70] = PCI-Express 2 PCI bridge max data 128(512)
                 max read 512
                 link x1(x1) speed 2.5(2.5) ASPM disabled(L0s/L1) ClockPM enabled
    ecap 0001[100] = AER 1 0 fatal 0 non-fatal 1 corrected

none11@pci0:23:5:0:	class=0x088000 rev=0x07 hdr=0x00 vendor=0x8086 device=0x2034 subvendor=0x8086 subdevice=0x0000
    vendor     = 'Intel Corporation'
    device     = 'Sky Lake-E VT-d'
    class      = base peripheral
    cap 10[40] = PCI-Express 2 root endpoint max data 128(128)
                 max read 128

none12@pci0:23:5:2:	class=0x088000 rev=0x07 hdr=0x00 vendor=0x8086 device=0x2035 subvendor=0x0000 subdevice=0x0000
    vendor     = 'Intel Corporation'
    device     = 'Sky Lake-E RAS Configuration Registers'
    class      = base peripheral
    cap 10[40] = PCI-Express 2 root endpoint max data 128(128)
                 max read 128

ioapic1@pci0:23:5:4:	class=0x080020 rev=0x07 hdr=0x00 vendor=0x8086 device=0x2036 subvendor=0x8086 subdevice=0x2036
    vendor     = 'Intel Corporation'
    device     = 'Sky Lake-E IOxAPIC Configuration Registers'
    class      = base peripheral
    subclass   = interrupt controller
    bar   [10] = type Memory, range 32, base 0x94000000, size 4096, enabled
    cap 10[44] = PCI-Express 1 root endpoint max data 128(128)
                 max read 128
    cap 01[e0] = powerspec 3  supports D0 D3  current D0

pcib5@pci0:23:5:5:	class=0x010400 rev=0x07 hdr=0x00 vendor=0x8086 device=0x201d subvendor=0x8086 subdevice=0x0000
    vendor     = 'Intel Corporation'
    device     = 'Volume Management Device NVMe RAID Controller'
    class      = mass storage
    subclass   = RAID
    bar   [10] = type Prefetchable Memory, range 64, base 0x38007c000000, size 33554432, enabled
    bar   [18] = type Memory, range 32, base 0x92000000, size 33554432, enabled
    bar   [20] = type Memory, range 64, base 0x38007ff00000, size 1048576, enabled
    cap 11[80] = MSI-X supports 33 messages, enabled
                 Table in map 0x20[0x0], PBA in map 0x20[0x1000]
    cap 01[e0] = powerspec 3  supports D0 D3  current D0

none13@pci0:23:8:0:	class=0x088000 rev=0x07 hdr=0x00 vendor=0x8086 device=0x208d subvendor=0x8086 subdevice=0x0000
    vendor     = 'Intel Corporation'
    device     = 'Sky Lake-E CHA Registers'
    class      = base peripheral

none14@pci0:23:8:1:	class=0x088000 rev=0x07 hdr=0x00 vendor=0x8086 device=0x208d subvendor=0x8086 subdevice=0x0000
    vendor     = 'Intel Corporation'
    device     = 'Sky Lake-E CHA Registers'
    class      = base peripheral

none15@pci0:23:8:2:	class=0x088000 rev=0x07 hdr=0x00 vendor=0x8086 device=0x208d subvendor=0x8086 subdevice=0x0000
    vendor     = 'Intel Corporation'
    device     = 'Sky Lake-E CHA Registers'
    class      = base peripheral

none16@pci0:23:8:3:	class=0x088000 rev=0x07 hdr=0x00 vendor=0x8086 device=0x208d subvendor=0x8086 subdevice=0x0000
    vendor     = 'Intel Corporation'
    device     = 'Sky Lake-E CHA Registers'
    class      = base peripheral

none17@pci0:23:8:4:	class=0x088000 rev=0x07 hdr=0x00 vendor=0x8086 device=0x208d subvendor=0x8086 subdevice=0x0000
    vendor     = 'Intel Corporation'
    device     = 'Sky Lake-E CHA Registers'
    class      = base peripheral

none18@pci0:23:8:5:	class=0x088000 rev=0x07 hdr=0x00 vendor=0x8086 device=0x208d subvendor=0x8086 subdevice=0x0000
    vendor     = 'Intel Corporation'
    device     = 'Sky Lake-E CHA Registers'
    class      = base peripheral

none19@pci0:23:8:6:	class=0x088000 rev=0x07 hdr=0x00 vendor=0x8086 device=0x208d subvendor=0x8086 subdevice=0x0000
    vendor     = 'Intel Corporation'
    device     = 'Sky Lake-E CHA Registers'
    class      = base peripheral

none20@pci0:23:8:7:	class=0x088000 rev=0x07 hdr=0x00 vendor=0x8086 device=0x208d subvendor=0x8086 subdevice=0x0000
    vendor     = 'Intel Corporation'
    device     = 'Sky Lake-E CHA Registers'
    class      = base peripheral

none21@pci0:23:9:0:	class=0x088000 rev=0x07 hdr=0x00 vendor=0x8086 device=0x208d subvendor=0x8086 subdevice=0x0000
    vendor     = 'Intel Corporation'
    device     = 'Sky Lake-E CHA Registers'
    class      = base peripheral

none22@pci0:23:9:1:	class=0x088000 rev=0x07 hdr=0x00 vendor=0x8086 device=0x208d subvendor=0x8086 subdevice=0x0000
    vendor     = 'Intel Corporation'
    device     = 'Sky Lake-E CHA Registers'
    class      = base peripheral

none23@pci0:23:14:0:	class=0x088000 rev=0x07 hdr=0x00 vendor=0x8086 device=0x208e subvendor=0x8086 subdevice=0x0000
    vendor     = 'Intel Corporation'
    device     = 'Sky Lake-E CHA Registers'
    class      = base peripheral

none24@pci0:23:14:1:	class=0x088000 rev=0x07 hdr=0x00 vendor=0x8086 device=0x208e subvendor=0x8086 subdevice=0x0000
    vendor     = 'Intel Corporation'
    device     = 'Sky Lake-E CHA Registers'
    class      = base peripheral

none25@pci0:23:14:2:	class=0x088000 rev=0x07 hdr=0x00 vendor=0x8086 device=0x208e subvendor=0x8086 subdevice=0x0000
    vendor     = 'Intel Corporation'
    device     = 'Sky Lake-E CHA Registers'
    class      = base peripheral

none26@pci0:23:14:3:	class=0x088000 rev=0x07 hdr=0x00 vendor=0x8086 device=0x208e subvendor=0x8086 subdevice=0x0000
    vendor     = 'Intel Corporation'
    device     = 'Sky Lake-E CHA Registers'
    class      = base peripheral

none27@pci0:23:14:4:	class=0x088000 rev=0x07 hdr=0x00 vendor=0x8086 device=0x208e subvendor=0x8086 subdevice=0x0000
    vendor     = 'Intel Corporation'
    device     = 'Sky Lake-E CHA Registers'
    class      = base peripheral

none28@pci0:23:14:5:	class=0x088000 rev=0x07 hdr=0x00 vendor=0x8086 device=0x208e subvendor=0x8086 subdevice=0x0000
    vendor     = 'Intel Corporation'
    device     = 'Sky Lake-E CHA Registers'
    class      = base peripheral

none29@pci0:23:14:6:	class=0x088000 rev=0x07 hdr=0x00 vendor=0x8086 device=0x208e subvendor=0x8086 subdevice=0x0000
    vendor     = 'Intel Corporation'
    device     = 'Sky Lake-E CHA Registers'
    class      = base peripheral

none30@pci0:23:14:7:	class=0x088000 rev=0x07 hdr=0x00 vendor=0x8086 device=0x208e subvendor=0x8086 subdevice=0x0000
    vendor     = 'Intel Corporation'
    device     = 'Sky Lake-E CHA Registers'
    class      = base peripheral

none31@pci0:23:15:0:	class=0x088000 rev=0x07 hdr=0x00 vendor=0x8086 device=0x208e subvendor=0x8086 subdevice=0x0000
    vendor     = 'Intel Corporation'
    device     = 'Sky Lake-E CHA Registers'
    class      = base peripheral

none32@pci0:23:15:1:	class=0x088000 rev=0x07 hdr=0x00 vendor=0x8086 device=0x208e subvendor=0x8086 subdevice=0x0000
    vendor     = 'Intel Corporation'
    device     = 'Sky Lake-E CHA Registers'
    class      = base peripheral

none33@pci0:23:29:0:	class=0x088000 rev=0x07 hdr=0x00 vendor=0x8086 device=0x2054 subvendor=0x8086 subdevice=0x0000
    vendor     = 'Intel Corporation'
    device     = 'Sky Lake-E CHA Registers'
    class      = base peripheral

none34@pci0:23:29:1:	class=0x088000 rev=0x07 hdr=0x00 vendor=0x8086 device=0x2055 subvendor=0x8086 subdevice=0x0000
    vendor     = 'Intel Corporation'
    device     = 'Sky Lake-E CHA Registers'
    class      = base peripheral

none35@pci0:23:29:2:	class=0x088000 rev=0x07 hdr=0x00 vendor=0x8086 device=0x2056 subvendor=0x8086 subdevice=0x0000
    vendor     = 'Intel Corporation'
    device     = 'Sky Lake-E CHA Registers'
    class      = base peripheral

none36@pci0:23:29:3:	class=0x088000 rev=0x07 hdr=0x00 vendor=0x8086 device=0x2057 subvendor=0x8086 subdevice=0x0000
    vendor     = 'Intel Corporation'
    device     = 'Sky Lake-E CHA Registers'
    class      = base peripheral

none37@pci0:23:30:0:	class=0x088000 rev=0x07 hdr=0x00 vendor=0x8086 device=0x2080 subvendor=0x8086 subdevice=0x0000
    vendor     = 'Intel Corporation'
    device     = 'Sky Lake-E PCU Registers'
    class      = base peripheral

none38@pci0:23:30:1:	class=0x088000 rev=0x07 hdr=0x00 vendor=0x8086 device=0x2081 subvendor=0x8086 subdevice=0x0000
    vendor     = 'Intel Corporation'
    device     = 'Sky Lake-E PCU Registers'
    class      = base peripheral

none39@pci0:23:30:2:	class=0x088000 rev=0x07 hdr=0x00 vendor=0x8086 device=0x2082 subvendor=0x8086 subdevice=0x0000
    vendor     = 'Intel Corporation'
    device     = 'Sky Lake-E PCU Registers'
    class      = base peripheral

none40@pci0:23:30:3:	class=0x088000 rev=0x07 hdr=0x00 vendor=0x8086 device=0x2083 subvendor=0x8086 subdevice=0x0000
    vendor     = 'Intel Corporation'
    device     = 'Sky Lake-E PCU Registers'
    class      = base peripheral

none41@pci0:23:30:4:	class=0x088000 rev=0x07 hdr=0x00 vendor=0x8086 device=0x2084 subvendor=0x8086 subdevice=0x0000
    vendor     = 'Intel Corporation'
    device     = 'Sky Lake-E PCU Registers'
    class      = base peripheral

none42@pci0:23:30:5:	class=0x088000 rev=0x07 hdr=0x00 vendor=0x8086 device=0x2085 subvendor=0x8086 subdevice=0x0000
    vendor     = 'Intel Corporation'
    device     = 'Sky Lake-E PCU Registers'
    class      = base peripheral

none43@pci0:23:30:6:	class=0x088000 rev=0x07 hdr=0x00 vendor=0x8086 device=0x2086 subvendor=0x8086 subdevice=0x0000
    vendor     = 'Intel Corporation'
    device     = 'Sky Lake-E PCU Registers'
    class      = base peripheral

pcib6@pci65530:0:2:0:	class=0x060400 rev=0x07 hdr=0x01 vendor=0x8086 device=0x2032 subvendor=0x8086 subdevice=0x0000
    vendor     = 'Intel Corporation'
    device     = 'Sky Lake-E PCI Express Root Port C'
    class      = bridge
    subclass   = PCI-PCI
    cap 0d[40] = PCI Bridge subvendor=0x8086 subdevice=0x0000
    cap 05[60] = MSI supports 2 messages, vector masks enabled with 1 message
    cap 10[90] = PCI-Express 2 root port max data 128(256) ARI enabled
                 max read 128
                 link x4(x4) speed 8.0(8.0) ASPM L1(L1)
                 slot 83 power limit 0 mW HotPlug(present) surprise
    cap 01[e0] = powerspec 3  supports D0 D3  current D0
    ecap 000b[100] = Vendor [1] ID 0002 Rev 0 Length 12
    ecap 000d[110] = ACS 1
    ecap 0001[148] = AER 1 0 fatal 0 non-fatal 0 corrected
    ecap 000b[1d0] = Vendor [1] ID 0003 Rev 1 Length 10
    ecap 0019[250] = PCIe Sec 1 lane errors 0
    ecap 000b[280] = Vendor [1] ID 0005 Rev 3 Length 24
    ecap 000b[300] = Vendor [1] ID 0008 Rev 0 Length 56

pcib7@pci65530:0:3:0:	class=0x060400 rev=0x07 hdr=0x01 vendor=0x8086 device=0x2033 subvendor=0x8086 subdevice=0x0000
    vendor     = 'Intel Corporation'
    device     = 'Sky Lake-E PCI Express Root Port D'
    class      = bridge
    subclass   = PCI-PCI
    cap 0d[40] = PCI Bridge subvendor=0x8086 subdevice=0x0000
    cap 05[60] = MSI supports 2 messages, vector masks enabled with 1 message
    cap 10[90] = PCI-Express 2 root port max data 128(256) ARI disabled
                 max read 128
                 link x0(x4) speed 0.0(8.0) ASPM L1(L1)
                 slot 84 power limit 0 mW HotPlug(empty) surprise
    cap 01[e0] = powerspec 3  supports D0 D3  current D0
    ecap 000b[100] = Vendor [1] ID 0002 Rev 0 Length 12
    ecap 000d[110] = ACS 1
    ecap 0001[148] = AER 1 0 fatal 0 non-fatal 0 corrected
    ecap 000b[1d0] = Vendor [1] ID 0003 Rev 1 Length 10
    ecap 0019[250] = PCIe Sec 1 lane errors 0
    ecap 000b[280] = Vendor [1] ID 0005 Rev 3 Length 24
    ecap 000b[300] = Vendor [1] ID 0008 Rev 0 Length 56

none44@pci0:90:5:0:	class=0x088000 rev=0x07 hdr=0x00 vendor=0x8086 device=0x2034 subvendor=0x8086 subdevice=0x0000
    vendor     = 'Intel Corporation'
    device     = 'Sky Lake-E VT-d'
    class      = base peripheral
    cap 10[40] = PCI-Express 2 root endpoint max data 128(128)
                 max read 128

none45@pci0:90:5:2:	class=0x088000 rev=0x07 hdr=0x00 vendor=0x8086 device=0x2035 subvendor=0x0000 subdevice=0x0000
    vendor     = 'Intel Corporation'
    device     = 'Sky Lake-E RAS Configuration Registers'
    class      = base peripheral
    cap 10[40] = PCI-Express 2 root endpoint max data 128(128)
                 max read 128

ioapic2@pci0:90:5:4:	class=0x080020 rev=0x07 hdr=0x00 vendor=0x8086 device=0x2036 subvendor=0x8086 subdevice=0x2036
    vendor     = 'Intel Corporation'
    device     = 'Sky Lake-E IOxAPIC Configuration Registers'
    class      = base peripheral
    subclass   = interrupt controller
    bar   [10] = type Memory, range 32, base 0x94700000, size 4096, enabled
    cap 10[44] = PCI-Express 1 root endpoint max data 128(128)
                 max read 128
    cap 01[e0] = powerspec 3  supports D0 D3  current D0

none46@pci0:90:8:0:	class=0x088000 rev=0x07 hdr=0x00 vendor=0x8086 device=0x2066 subvendor=0x8086 subdevice=0x0000
    vendor     = 'Intel Corporation'
    device     = 'Sky Lake-E Integrated Memory Controller'
    class      = base peripheral
    cap 10[40] = PCI-Express 1 root endpoint max data 128(128)
                 max read 128

none47@pci0:90:9:0:	class=0x088000 rev=0x07 hdr=0x00 vendor=0x8086 device=0x2066 subvendor=0x8086 subdevice=0x0000
    vendor     = 'Intel Corporation'
    device     = 'Sky Lake-E Integrated Memory Controller'
    class      = base peripheral
    cap 10[40] = PCI-Express 1 root endpoint max data 128(128)
                 max read 128

none48@pci0:90:10:0:	class=0x088000 rev=0x07 hdr=0x00 vendor=0x8086 device=0x2040 subvendor=0x8086 subdevice=0x0000
    vendor     = 'Intel Corporation'
    device     = 'Sky Lake-E Integrated Memory Controller'
    class      = base peripheral
    cap 10[40] = PCI-Express 1 root endpoint max data 128(128)
                 max read 128

none49@pci0:90:10:1:	class=0x088000 rev=0x07 hdr=0x00 vendor=0x8086 device=0x2041 subvendor=0x8086 subdevice=0x0000
    vendor     = 'Intel Corporation'
    device     = 'Sky Lake-E Integrated Memory Controller'
    class      = base peripheral
    cap 10[40] = PCI-Express 1 root endpoint max data 128(128)
                 max read 128

none50@pci0:90:10:2:	class=0x088000 rev=0x07 hdr=0x00 vendor=0x8086 device=0x2042 subvendor=0x8086 subdevice=0x0000
    vendor     = 'Intel Corporation'
    device     = 'Sky Lake-E Integrated Memory Controller'
    class      = base peripheral
    cap 10[40] = PCI-Express 1 root endpoint max data 128(128)
                 max read 128

none51@pci0:90:10:3:	class=0x088000 rev=0x07 hdr=0x00 vendor=0x8086 device=0x2043 subvendor=0x8086 subdevice=0x0000
    vendor     = 'Intel Corporation'
    device     = 'Sky Lake-E Integrated Memory Controller'
    class      = base peripheral
    cap 10[40] = PCI-Express 1 root endpoint max data 128(128)
                 max read 128

none52@pci0:90:10:4:	class=0x088000 rev=0x07 hdr=0x00 vendor=0x8086 device=0x2044 subvendor=0x8086 subdevice=0x0000
    vendor     = 'Intel Corporation'
    device     = 'Sky Lake-E Integrated Memory Controller'
    class      = base peripheral
    cap 10[40] = PCI-Express 1 root endpoint max data 128(128)
                 max read 128

none53@pci0:90:10:5:	class=0x088000 rev=0x07 hdr=0x00 vendor=0x8086 device=0x2045 subvendor=0x8086 subdevice=0x0000
    vendor     = 'Intel Corporation'
    device     = 'Sky Lake-E LM Channel 1'
    class      = base peripheral
    cap 10[40] = PCI-Express 1 root endpoint max data 128(128)
                 max read 128

none54@pci0:90:10:6:	class=0x088000 rev=0x07 hdr=0x00 vendor=0x8086 device=0x2046 subvendor=0x8086 subdevice=0x0000
    vendor     = 'Intel Corporation'
    device     = 'Sky Lake-E LMS Channel 1'
    class      = base peripheral
    cap 10[40] = PCI-Express 1 root endpoint max data 128(128)
                 max read 128

none55@pci0:90:10:7:	class=0x088000 rev=0x07 hdr=0x00 vendor=0x8086 device=0x2047 subvendor=0x8086 subdevice=0x0000
    vendor     = 'Intel Corporation'
    device     = 'Sky Lake-E LMDP Channel 1'
    class      = base peripheral
    cap 10[40] = PCI-Express 1 root endpoint max data 128(128)
                 max read 128

none56@pci0:90:11:0:	class=0x088000 rev=0x07 hdr=0x00 vendor=0x8086 device=0x2048 subvendor=0x8086 subdevice=0x0000
    vendor     = 'Intel Corporation'
    device     = 'Sky Lake-E DECS Channel 2'
    class      = base peripheral
    cap 10[40] = PCI-Express 1 root endpoint max data 128(128)
                 max read 128

none57@pci0:90:11:1:	class=0x088000 rev=0x07 hdr=0x00 vendor=0x8086 device=0x2049 subvendor=0x8086 subdevice=0x0000
    vendor     = 'Intel Corporation'
    device     = 'Sky Lake-E LM Channel 2'
    class      = base peripheral
    cap 10[40] = PCI-Express 1 root endpoint max data 128(128)
                 max read 128

none58@pci0:90:11:2:	class=0x088000 rev=0x07 hdr=0x00 vendor=0x8086 device=0x204a subvendor=0x8086 subdevice=0x0000
    vendor     = 'Intel Corporation'
    device     = 'Sky Lake-E LMS Channel 2'
    class      = base peripheral
    cap 10[40] = PCI-Express 1 root endpoint max data 128(128)
                 max read 128

none59@pci0:90:11:3:	class=0x088000 rev=0x07 hdr=0x00 vendor=0x8086 device=0x204b subvendor=0x8086 subdevice=0x0000
    vendor     = 'Intel Corporation'
    device     = 'Sky Lake-E LMDP Channel 2'
    class      = base peripheral
    cap 10[40] = PCI-Express 1 root endpoint max data 128(128)
                 max read 128

none60@pci0:90:12:0:	class=0x088000 rev=0x07 hdr=0x00 vendor=0x8086 device=0x2040 subvendor=0x8086 subdevice=0x0000
    vendor     = 'Intel Corporation'
    device     = 'Sky Lake-E Integrated Memory Controller'
    class      = base peripheral
    cap 10[40] = PCI-Express 1 root endpoint max data 128(128)
                 max read 128

none61@pci0:90:12:1:	class=0x088000 rev=0x07 hdr=0x00 vendor=0x8086 device=0x2041 subvendor=0x8086 subdevice=0x0000
    vendor     = 'Intel Corporation'
    device     = 'Sky Lake-E Integrated Memory Controller'
    class      = base peripheral
    cap 10[40] = PCI-Express 1 root endpoint max data 128(128)
                 max read 128

none62@pci0:90:12:2:	class=0x088000 rev=0x07 hdr=0x00 vendor=0x8086 device=0x2042 subvendor=0x8086 subdevice=0x0000
    vendor     = 'Intel Corporation'
    device     = 'Sky Lake-E Integrated Memory Controller'
    class      = base peripheral
    cap 10[40] = PCI-Express 1 root endpoint max data 128(128)
                 max read 128

none63@pci0:90:12:3:	class=0x088000 rev=0x07 hdr=0x00 vendor=0x8086 device=0x2043 subvendor=0x8086 subdevice=0x0000
    vendor     = 'Intel Corporation'
    device     = 'Sky Lake-E Integrated Memory Controller'
    class      = base peripheral
    cap 10[40] = PCI-Express 1 root endpoint max data 128(128)
                 max read 128

none64@pci0:90:12:4:	class=0x088000 rev=0x07 hdr=0x00 vendor=0x8086 device=0x2044 subvendor=0x8086 subdevice=0x0000
    vendor     = 'Intel Corporation'
    device     = 'Sky Lake-E Integrated Memory Controller'
    class      = base peripheral
    cap 10[40] = PCI-Express 1 root endpoint max data 128(128)
                 max read 128

none65@pci0:90:12:5:	class=0x088000 rev=0x07 hdr=0x00 vendor=0x8086 device=0x2045 subvendor=0x8086 subdevice=0x0000
    vendor     = 'Intel Corporation'
    device     = 'Sky Lake-E LM Channel 1'
    class      = base peripheral
    cap 10[40] = PCI-Express 1 root endpoint max data 128(128)
                 max read 128

none66@pci0:90:12:6:	class=0x088000 rev=0x07 hdr=0x00 vendor=0x8086 device=0x2046 subvendor=0x8086 subdevice=0x0000
    vendor     = 'Intel Corporation'
    device     = 'Sky Lake-E LMS Channel 1'
    class      = base peripheral
    cap 10[40] = PCI-Express 1 root endpoint max data 128(128)
                 max read 128

none67@pci0:90:12:7:	class=0x088000 rev=0x07 hdr=0x00 vendor=0x8086 device=0x2047 subvendor=0x8086 subdevice=0x0000
    vendor     = 'Intel Corporation'
    device     = 'Sky Lake-E LMDP Channel 1'
    class      = base peripheral
    cap 10[40] = PCI-Express 1 root endpoint max data 128(128)
                 max read 128

none68@pci0:90:13:0:	class=0x088000 rev=0x07 hdr=0x00 vendor=0x8086 device=0x2048 subvendor=0x8086 subdevice=0x0000
    vendor     = 'Intel Corporation'
    device     = 'Sky Lake-E DECS Channel 2'
    class      = base peripheral
    cap 10[40] = PCI-Express 1 root endpoint max data 128(128)
                 max read 128

none69@pci0:90:13:1:	class=0x088000 rev=0x07 hdr=0x00 vendor=0x8086 device=0x2049 subvendor=0x8086 subdevice=0x0000
    vendor     = 'Intel Corporation'
    device     = 'Sky Lake-E LM Channel 2'
    class      = base peripheral
    cap 10[40] = PCI-Express 1 root endpoint max data 128(128)
                 max read 128

none70@pci0:90:13:2:	class=0x088000 rev=0x07 hdr=0x00 vendor=0x8086 device=0x204a subvendor=0x8086 subdevice=0x0000
    vendor     = 'Intel Corporation'
    device     = 'Sky Lake-E LMS Channel 2'
    class      = base peripheral
    cap 10[40] = PCI-Express 1 root endpoint max data 128(128)
                 max read 128

none71@pci0:90:13:3:	class=0x088000 rev=0x07 hdr=0x00 vendor=0x8086 device=0x204b subvendor=0x8086 subdevice=0x0000
    vendor     = 'Intel Corporation'
    device     = 'Sky Lake-E LMDP Channel 2'
    class      = base peripheral
    cap 10[40] = PCI-Express 1 root endpoint max data 128(128)
                 max read 128

pcib10@pci0:157:0:0:	class=0x060400 rev=0x07 hdr=0x01 vendor=0x8086 device=0x2030 subvendor=0x8086 subdevice=0x0000
    vendor     = 'Intel Corporation'
    device     = 'Sky Lake-E PCI Express Root Port A'
    class      = bridge
    subclass   = PCI-PCI
    cap 0d[40] = PCI Bridge subvendor=0x8086 subdevice=0x0000
    cap 05[60] = MSI supports 2 messages, vector masks 
    cap 10[90] = PCI-Express 2 root port max data 256(256) ARI enabled
                 max read 128
                 link x8(x16) speed 8.0(8.0) ASPM L1(L1)
                 slot 2 power limit 0 mW
    cap 01[e0] = powerspec 3  supports D0 D3  current D0
    ecap 000b[100] = Vendor [1] ID 0002 Rev 0 Length 12
    ecap 000d[110] = ACS 1
    ecap 0001[148] = AER 1 0 fatal 0 non-fatal 0 corrected
    ecap 000b[1d0] = Vendor [1] ID 0003 Rev 1 Length 10
    ecap 0019[250] = PCIe Sec 1 lane errors 0
    ecap 000b[280] = Vendor [1] ID 0005 Rev 3 Length 24
    ecap 000b[300] = Vendor [1] ID 0008 Rev 0 Length 56

none72@pci0:157:5:0:	class=0x088000 rev=0x07 hdr=0x00 vendor=0x8086 device=0x2034 subvendor=0x8086 subdevice=0x0000
    vendor     = 'Intel Corporation'
    device     = 'Sky Lake-E VT-d'
    class      = base peripheral
    cap 10[40] = PCI-Express 2 root endpoint max data 128(128)
                 max read 128

none73@pci0:157:5:2:	class=0x088000 rev=0x07 hdr=0x00 vendor=0x8086 device=0x2035 subvendor=0x0000 subdevice=0x0000
    vendor     = 'Intel Corporation'
    device     = 'Sky Lake-E RAS Configuration Registers'
    class      = base peripheral
    cap 10[40] = PCI-Express 2 root endpoint max data 128(128)
                 max read 128

ioapic3@pci0:157:5:4:	class=0x080020 rev=0x07 hdr=0x00 vendor=0x8086 device=0x2036 subvendor=0x8086 subdevice=0x2036
    vendor     = 'Intel Corporation'
    device     = 'Sky Lake-E IOxAPIC Configuration Registers'
    class      = base peripheral
    subclass   = interrupt controller
    bar   [10] = type Memory, range 32, base 0xc5f00000, size 4096, enabled
    cap 10[44] = PCI-Express 1 root endpoint max data 128(128)
                 max read 128
    cap 01[e0] = powerspec 3  supports D0 D3  current D0

none74@pci0:157:14:0:	class=0x110100 rev=0x07 hdr=0x00 vendor=0x8086 device=0x2058 subvendor=0x8086 subdevice=0x0000
    vendor     = 'Intel Corporation'
    device     = 'Sky Lake-E KTI 0'
    class      = dasp
    subclass   = performance counters
    cap 10[40] = PCI-Express 2 root endpoint max data 128(128)
                 max read 128

none75@pci0:157:14:1:	class=0x088000 rev=0x07 hdr=0x00 vendor=0x8086 device=0x2059 subvendor=0x8086 subdevice=0x0000
    vendor     = 'Intel Corporation'
    device     = 'Sky Lake-E UPI Registers'
    class      = base peripheral
    cap 10[40] = PCI-Express 2 root endpoint max data 128(128)
                 max read 128
    ecap 000b[100] = Vendor [0] ID 0001 Rev 0 Length 240

none76@pci0:157:15:0:	class=0x110100 rev=0x07 hdr=0x00 vendor=0x8086 device=0x2058 subvendor=0x8086 subdevice=0x0000
    vendor     = 'Intel Corporation'
    device     = 'Sky Lake-E KTI 0'
    class      = dasp
    subclass   = performance counters
    cap 10[40] = PCI-Express 2 root endpoint max data 128(128)
                 max read 128

none77@pci0:157:15:1:	class=0x088000 rev=0x07 hdr=0x00 vendor=0x8086 device=0x2059 subvendor=0x8086 subdevice=0x0000
    vendor     = 'Intel Corporation'
    device     = 'Sky Lake-E UPI Registers'
    class      = base peripheral
    cap 10[40] = PCI-Express 2 root endpoint max data 128(128)
                 max read 128
    ecap 000b[100] = Vendor [0] ID 0001 Rev 0 Length 240

none78@pci0:157:18:0:	class=0x110100 rev=0x07 hdr=0x00 vendor=0x8086 device=0x204c subvendor=0x8086 subdevice=0x0000
    vendor     = 'Intel Corporation'
    device     = 'Sky Lake-E M3KTI Registers'
    class      = dasp
    subclass   = performance counters
    cap 10[40] = PCI-Express 2 root endpoint max data 128(128)
                 max read 128

none79@pci0:157:18:1:	class=0x110100 rev=0x07 hdr=0x00 vendor=0x8086 device=0x204d subvendor=0x8086 subdevice=0x0000
    vendor     = 'Intel Corporation'
    device     = 'Sky Lake-E M3KTI Registers'
    class      = dasp
    subclass   = performance counters

none80@pci0:157:18:2:	class=0x088000 rev=0x07 hdr=0x00 vendor=0x8086 device=0x204e subvendor=0x8086 subdevice=0x0000
    vendor     = 'Intel Corporation'
    device     = 'Sky Lake-E M3KTI Registers'
    class      = base peripheral

none81@pci0:157:21:0:	class=0x088000 rev=0x07 hdr=0x00 vendor=0x8086 device=0x2018 subvendor=0x8086 subdevice=0x0000
    vendor     = 'Intel Corporation'
    device     = 'Sky Lake-E M2PCI Registers'
    class      = base peripheral

none82@pci0:157:21:1:	class=0x110100 rev=0x07 hdr=0x00 vendor=0x8086 device=0x2088 subvendor=0x8086 subdevice=0x0000
    vendor     = 'Intel Corporation'
    device     = 'Sky Lake-E DDRIO Registers'
    class      = dasp
    subclass   = performance counters

none83@pci0:157:22:0:	class=0x088000 rev=0x07 hdr=0x00 vendor=0x8086 device=0x2018 subvendor=0x8086 subdevice=0x0000
    vendor     = 'Intel Corporation'
    device     = 'Sky Lake-E M2PCI Registers'
    class      = base peripheral

none84@pci0:157:22:1:	class=0x110100 rev=0x07 hdr=0x00 vendor=0x8086 device=0x2088 subvendor=0x8086 subdevice=0x0000
    vendor     = 'Intel Corporation'
    device     = 'Sky Lake-E DDRIO Registers'
    class      = dasp
    subclass   = performance counters

none85@pci0:157:22:4:	class=0x088000 rev=0x07 hdr=0x00 vendor=0x8086 device=0x2018 subvendor=0x8086 subdevice=0x0000
    vendor     = 'Intel Corporation'
    device     = 'Sky Lake-E M2PCI Registers'
    class      = base peripheral

none86@pci0:157:22:5:	class=0x110100 rev=0x07 hdr=0x00 vendor=0x8086 device=0x2088 subvendor=0x8086 subdevice=0x0000
    vendor     = 'Intel Corporation'
    device     = 'Sky Lake-E DDRIO Registers'
    class      = dasp
    subclass   = performance counters

vgapci0@pci0:158:0:0:	class=0x030000 rev=0x00 hdr=0x00 vendor=0x1002 device=0x6995 subvendor=0x1028 subdevice=0x0b0c
    vendor     = 'Advanced Micro Devices, Inc. [AMD/ATI]'
    device     = 'Lexa XT [Radeon PRO WX 2100]'
    class      = display
    subclass   = VGA
    bar   [10] = type Prefetchable Memory, range 64, base 0xb0000000, size 268435456, enabled
    bar   [18] = type Prefetchable Memory, range 64, base 0xc0000000, size 2097152, enabled
    bar   [20] = type I/O Port, range 32, base 0x9000, size 256, enabled
    bar   [24] = type Memory, range 32, base 0xc5e00000, size 262144, enabled
    cap 09[48] = vendor (length 8)
    cap 01[50] = powerspec 3  supports D0 D1 D2 D3  current D0
    cap 10[58] = PCI-Express 2 legacy endpoint max data 256(256) RO NS
                 max read 512
                 link x8(x8) speed 8.0(8.0) ASPM L1(L1) ClockPM disabled
    cap 05[a0] = MSI supports 1 message, 64 bit 
    ecap 000b[100] = Vendor [1] ID 0001 Rev 1 Length 16
    ecap 0001[150] = AER 2 0 fatal 1 non-fatal 1 corrected
    ecap 0015[200] = Resizable BAR 1
    ecap 0019[270] = PCIe Sec 1 lane errors 0
    ecap 000f[2b0] = ATS 1
    ecap 0013[2c0] = Page Page Request 1
    ecap 001b[2d0] = Process Address Space ID 1
    ecap 0018[320] = LTR 1
    ecap 000e[328] = ARI 1
    ecap 001e[370] = L1 PM Substates 1

hdac1@pci0:158:0:1:	class=0x040300 rev=0x00 hdr=0x00 vendor=0x1002 device=0xaae0 subvendor=0x1028 subdevice=0xaae0
    vendor     = 'Advanced Micro Devices, Inc. [AMD/ATI]'
    device     = 'Baffin HDMI/DP Audio [Radeon RX 550 640SP / RX 560/560X]'
    class      = multimedia
    subclass   = HDA
    bar   [10] = type Memory, range 64, base 0xc5e60000, size 16384, enabled
    cap 09[48] = vendor (length 8)
    cap 01[50] = powerspec 3  supports D0 D1 D2 D3  current D0
    cap 10[58] = PCI-Express 2 legacy endpoint max data 256(256) RO NS
                 max read 512
                 link x8(x8) speed 8.0(8.0) ASPM L1(L1) ClockPM disabled
    cap 05[a0] = MSI supports 1 message, 64 bit enabled with 1 message
    ecap 000b[100] = Vendor [1] ID 0001 Rev 1 Length 16
    ecap 0001[150] = AER 2 0 fatal 1 non-fatal 1 corrected
    ecap 000e[328] = ARI 1

ioat8@pci0:224:4:0:	class=0x088000 rev=0x07 hdr=0x00 vendor=0x8086 device=0x2021 subvendor=0x8086 subdevice=0x0000
    vendor     = 'Intel Corporation'
    device     = 'Sky Lake-E CBDMA Registers'
    class      = base peripheral
    bar   [10] = type Memory, range 64, base 0x38013ff1c000, size 16384, enabled
    cap 11[80] = MSI-X supports 1 message, enabled
                 Table in map 0x10[0x2000], PBA in map 0x10[0x3000]
    cap 10[90] = PCI-Express 2 root endpoint max data 128(128)
                 max read 128
    cap 01[e0] = powerspec 3  supports D0 D3  current D0

ioat9@pci0:224:4:1:	class=0x088000 rev=0x07 hdr=0x00 vendor=0x8086 device=0x2021 subvendor=0x8086 subdevice=0x0000
    vendor     = 'Intel Corporation'
    device     = 'Sky Lake-E CBDMA Registers'
    class      = base peripheral
    bar   [10] = type Memory, range 64, base 0x38013ff18000, size 16384, enabled
    cap 11[80] = MSI-X supports 1 message, enabled
                 Table in map 0x10[0x2000], PBA in map 0x10[0x3000]
    cap 10[90] = PCI-Express 2 root endpoint max data 128(128)
                 max read 128
    cap 01[e0] = powerspec 3  supports D0 D3  current D0

ioat10@pci0:224:4:2:	class=0x088000 rev=0x07 hdr=0x00 vendor=0x8086 device=0x2021 subvendor=0x8086 subdevice=0x0000
    vendor     = 'Intel Corporation'
    device     = 'Sky Lake-E CBDMA Registers'
    class      = base peripheral
    bar   [10] = type Memory, range 64, base 0x38013ff14000, size 16384, enabled
    cap 11[80] = MSI-X supports 1 message, enabled
                 Table in map 0x10[0x2000], PBA in map 0x10[0x3000]
    cap 10[90] = PCI-Express 2 root endpoint max data 128(128)
                 max read 128
    cap 01[e0] = powerspec 3  supports D0 D3  current D0

ioat11@pci0:224:4:3:	class=0x088000 rev=0x07 hdr=0x00 vendor=0x8086 device=0x2021 subvendor=0x8086 subdevice=0x0000
    vendor     = 'Intel Corporation'
    device     = 'Sky Lake-E CBDMA Registers'
    class      = base peripheral
    bar   [10] = type Memory, range 64, base 0x38013ff10000, size 16384, enabled
    cap 11[80] = MSI-X supports 1 message, enabled
                 Table in map 0x10[0x2000], PBA in map 0x10[0x3000]
    cap 10[90] = PCI-Express 2 root endpoint max data 128(128)
                 max read 128
    cap 01[e0] = powerspec 3  supports D0 D3  current D0

ioat12@pci0:224:4:4:	class=0x088000 rev=0x07 hdr=0x00 vendor=0x8086 device=0x2021 subvendor=0x8086 subdevice=0x0000
    vendor     = 'Intel Corporation'
    device     = 'Sky Lake-E CBDMA Registers'
    class      = base peripheral
    bar   [10] = type Memory, range 64, base 0x38013ff0c000, size 16384, enabled
    cap 11[80] = MSI-X supports 1 message, enabled
                 Table in map 0x10[0x2000], PBA in map 0x10[0x3000]
    cap 10[90] = PCI-Express 2 root endpoint max data 128(128)
                 max read 128
    cap 01[e0] = powerspec 3  supports D0 D3  current D0

ioat13@pci0:224:4:5:	class=0x088000 rev=0x07 hdr=0x00 vendor=0x8086 device=0x2021 subvendor=0x8086 subdevice=0x0000
    vendor     = 'Intel Corporation'
    device     = 'Sky Lake-E CBDMA Registers'
    class      = base peripheral
    bar   [10] = type Memory, range 64, base 0x38013ff08000, size 16384, enabled
    cap 11[80] = MSI-X supports 1 message, enabled
                 Table in map 0x10[0x2000], PBA in map 0x10[0x3000]
    cap 10[90] = PCI-Express 2 root endpoint max data 128(128)
                 max read 128
    cap 01[e0] = powerspec 3  supports D0 D3  current D0

ioat14@pci0:224:4:6:	class=0x088000 rev=0x07 hdr=0x00 vendor=0x8086 device=0x2021 subvendor=0x8086 subdevice=0x0000
    vendor     = 'Intel Corporation'
    device     = 'Sky Lake-E CBDMA Registers'
    class      = base peripheral
    bar   [10] = type Memory, range 64, base 0x38013ff04000, size 16384, enabled
    cap 11[80] = MSI-X supports 1 message, enabled
                 Table in map 0x10[0x2000], PBA in map 0x10[0x3000]
    cap 10[90] = PCI-Express 2 root endpoint max data 128(128)
                 max read 128
    cap 01[e0] = powerspec 3  supports D0 D3  current D0

ioat15@pci0:224:4:7:	class=0x088000 rev=0x07 hdr=0x00 vendor=0x8086 device=0x2021 subvendor=0x8086 subdevice=0x0000
    vendor     = 'Intel Corporation'
    device     = 'Sky Lake-E CBDMA Registers'
    class      = base peripheral
    bar   [10] = type Memory, range 64, base 0x38013ff00000, size 16384, enabled
    cap 11[80] = MSI-X supports 1 message, enabled
                 Table in map 0x10[0x2000], PBA in map 0x10[0x3000]
    cap 10[90] = PCI-Express 2 root endpoint max data 128(128)
                 max read 128
    cap 01[e0] = powerspec 3  supports D0 D3  current D0

none87@pci0:224:5:0:	class=0x088000 rev=0x07 hdr=0x00 vendor=0x8086 device=0x2024 subvendor=0x8086 subdevice=0x0000
    vendor     = 'Intel Corporation'
    device     = 'Sky Lake-E MM/Vt-d Configuration Registers'
    class      = base peripheral
    cap 10[40] = PCI-Express 2 root endpoint max data 128(128)
                 max read 128

none88@pci0:224:5:2:	class=0x088000 rev=0x07 hdr=0x00 vendor=0x8086 device=0x2025 subvendor=0x0000 subdevice=0x0000
    vendor     = 'Intel Corporation'
    device     = 'Sky Lake-E RAS'
    class      = base peripheral
    cap 10[40] = PCI-Express 2 root endpoint max data 128(128)
                 max read 128

ioapic4@pci0:224:5:4:	class=0x080020 rev=0x07 hdr=0x00 vendor=0x8086 device=0x2026 subvendor=0x8086 subdevice=0x2026
    vendor     = 'Intel Corporation'
    device     = 'Sky Lake-E IOAPIC'
    class      = base peripheral
    subclass   = interrupt controller
    bar   [10] = type Memory, range 32, base 0xd3700000, size 4096, enabled
    cap 10[44] = PCI-Express 1 root endpoint max data 128(128)
                 max read 128
    cap 01[e0] = powerspec 3  supports D0 D3  current D0

none89@pci0:224:8:0:	class=0x088000 rev=0x07 hdr=0x00 vendor=0x8086 device=0x2014 subvendor=0x8086 subdevice=0x0000
    vendor     = 'Intel Corporation'
    device     = 'Sky Lake-E Ubox Registers'
    class      = base peripheral
    cap 10[40] = PCI-Express 2 root endpoint max data 128(128)
                 max read 128

none90@pci0:224:8:1:	class=0x110100 rev=0x07 hdr=0x00 vendor=0x8086 device=0x2015 subvendor=0x8086 subdevice=0x0000
    vendor     = 'Intel Corporation'
    device     = 'Sky Lake-E Ubox Registers'
    class      = dasp
    subclass   = performance counters

none91@pci0:224:8:2:	class=0x088000 rev=0x07 hdr=0x00 vendor=0x8086 device=0x2016 subvendor=0x8086 subdevice=0x0000
    vendor     = 'Intel Corporation'
    device     = 'Sky Lake-E Ubox Registers'
    class      = base peripheral
    cap 10[40] = PCI-Express 2 root endpoint max data 128(128)
                 max read 128

none92@pci0:232:5:0:	class=0x088000 rev=0x07 hdr=0x00 vendor=0x8086 device=0x2034 subvendor=0x8086 subdevice=0x0000
    vendor     = 'Intel Corporation'
    device     = 'Sky Lake-E VT-d'
    class      = base peripheral
    cap 10[40] = PCI-Express 2 root endpoint max data 128(128)
                 max read 128

none93@pci0:232:5:2:	class=0x088000 rev=0x07 hdr=0x00 vendor=0x8086 device=0x2035 subvendor=0x0000 subdevice=0x0000
    vendor     = 'Intel Corporation'
    device     = 'Sky Lake-E RAS Configuration Registers'
    class      = base peripheral
    cap 10[40] = PCI-Express 2 root endpoint max data 128(128)
                 max read 128

ioapic5@pci0:232:5:4:	class=0x080020 rev=0x07 hdr=0x00 vendor=0x8086 device=0x2036 subvendor=0x8086 subdevice=0x2036
    vendor     = 'Intel Corporation'
    device     = 'Sky Lake-E IOxAPIC Configuration Registers'
    class      = base peripheral
    subclass   = interrupt controller
    bar   [10] = type Memory, range 32, base 0xe0f00000, size 4096, enabled
    cap 10[44] = PCI-Express 1 root endpoint max data 128(128)
                 max read 128
    cap 01[e0] = powerspec 3  supports D0 D3  current D0

none94@pci0:232:8:0:	class=0x088000 rev=0x07 hdr=0x00 vendor=0x8086 device=0x208d subvendor=0x8086 subdevice=0x0000
    vendor     = 'Intel Corporation'
    device     = 'Sky Lake-E CHA Registers'
    class      = base peripheral

none95@pci0:232:8:1:	class=0x088000 rev=0x07 hdr=0x00 vendor=0x8086 device=0x208d subvendor=0x8086 subdevice=0x0000
    vendor     = 'Intel Corporation'
    device     = 'Sky Lake-E CHA Registers'
    class      = base peripheral

none96@pci0:232:8:2:	class=0x088000 rev=0x07 hdr=0x00 vendor=0x8086 device=0x208d subvendor=0x8086 subdevice=0x0000
    vendor     = 'Intel Corporation'
    device     = 'Sky Lake-E CHA Registers'
    class      = base peripheral

none97@pci0:232:8:3:	class=0x088000 rev=0x07 hdr=0x00 vendor=0x8086 device=0x208d subvendor=0x8086 subdevice=0x0000
    vendor     = 'Intel Corporation'
    device     = 'Sky Lake-E CHA Registers'
    class      = base peripheral

none98@pci0:232:8:4:	class=0x088000 rev=0x07 hdr=0x00 vendor=0x8086 device=0x208d subvendor=0x8086 subdevice=0x0000
    vendor     = 'Intel Corporation'
    device     = 'Sky Lake-E CHA Registers'
    class      = base peripheral

none99@pci0:232:8:5:	class=0x088000 rev=0x07 hdr=0x00 vendor=0x8086 device=0x208d subvendor=0x8086 subdevice=0x0000
    vendor     = 'Intel Corporation'
    device     = 'Sky Lake-E CHA Registers'
    class      = base peripheral

none100@pci0:232:8:6:	class=0x088000 rev=0x07 hdr=0x00 vendor=0x8086 device=0x208d subvendor=0x8086 subdevice=0x0000
    vendor     = 'Intel Corporation'
    device     = 'Sky Lake-E CHA Registers'
    class      = base peripheral

none101@pci0:232:8:7:	class=0x088000 rev=0x07 hdr=0x00 vendor=0x8086 device=0x208d subvendor=0x8086 subdevice=0x0000
    vendor     = 'Intel Corporation'
    device     = 'Sky Lake-E CHA Registers'
    class      = base peripheral

none102@pci0:232:9:0:	class=0x088000 rev=0x07 hdr=0x00 vendor=0x8086 device=0x208d subvendor=0x8086 subdevice=0x0000
    vendor     = 'Intel Corporation'
    device     = 'Sky Lake-E CHA Registers'
    class      = base peripheral

none103@pci0:232:9:1:	class=0x088000 rev=0x07 hdr=0x00 vendor=0x8086 device=0x208d subvendor=0x8086 subdevice=0x0000
    vendor     = 'Intel Corporation'
    device     = 'Sky Lake-E CHA Registers'
    class      = base peripheral

none104@pci0:232:14:0:	class=0x088000 rev=0x07 hdr=0x00 vendor=0x8086 device=0x208e subvendor=0x8086 subdevice=0x0000
    vendor     = 'Intel Corporation'
    device     = 'Sky Lake-E CHA Registers'
    class      = base peripheral

none105@pci0:232:14:1:	class=0x088000 rev=0x07 hdr=0x00 vendor=0x8086 device=0x208e subvendor=0x8086 subdevice=0x0000
    vendor     = 'Intel Corporation'
    device     = 'Sky Lake-E CHA Registers'
    class      = base peripheral

none106@pci0:232:14:2:	class=0x088000 rev=0x07 hdr=0x00 vendor=0x8086 device=0x208e subvendor=0x8086 subdevice=0x0000
    vendor     = 'Intel Corporation'
    device     = 'Sky Lake-E CHA Registers'
    class      = base peripheral

none107@pci0:232:14:3:	class=0x088000 rev=0x07 hdr=0x00 vendor=0x8086 device=0x208e subvendor=0x8086 subdevice=0x0000
    vendor     = 'Intel Corporation'
    device     = 'Sky Lake-E CHA Registers'
    class      = base peripheral

none108@pci0:232:14:4:	class=0x088000 rev=0x07 hdr=0x00 vendor=0x8086 device=0x208e subvendor=0x8086 subdevice=0x0000
    vendor     = 'Intel Corporation'
    device     = 'Sky Lake-E CHA Registers'
    class      = base peripheral

none109@pci0:232:14:5:	class=0x088000 rev=0x07 hdr=0x00 vendor=0x8086 device=0x208e subvendor=0x8086 subdevice=0x0000
    vendor     = 'Intel Corporation'
    device     = 'Sky Lake-E CHA Registers'
    class      = base peripheral

none110@pci0:232:14:6:	class=0x088000 rev=0x07 hdr=0x00 vendor=0x8086 device=0x208e subvendor=0x8086 subdevice=0x0000
    vendor     = 'Intel Corporation'
    device     = 'Sky Lake-E CHA Registers'
    class      = base peripheral

none111@pci0:232:14:7:	class=0x088000 rev=0x07 hdr=0x00 vendor=0x8086 device=0x208e subvendor=0x8086 subdevice=0x0000
    vendor     = 'Intel Corporation'
    device     = 'Sky Lake-E CHA Registers'
    class      = base peripheral

none112@pci0:232:15:0:	class=0x088000 rev=0x07 hdr=0x00 vendor=0x8086 device=0x208e subvendor=0x8086 subdevice=0x0000
    vendor     = 'Intel Corporation'
    device     = 'Sky Lake-E CHA Registers'
    class      = base peripheral

none113@pci0:232:15:1:	class=0x088000 rev=0x07 hdr=0x00 vendor=0x8086 device=0x208e subvendor=0x8086 subdevice=0x0000
    vendor     = 'Intel Corporation'
    device     = 'Sky Lake-E CHA Registers'
    class      = base peripheral

none114@pci0:232:29:0:	class=0x088000 rev=0x07 hdr=0x00 vendor=0x8086 device=0x2054 subvendor=0x8086 subdevice=0x0000
    vendor     = 'Intel Corporation'
    device     = 'Sky Lake-E CHA Registers'
    class      = base peripheral

none115@pci0:232:29:1:	class=0x088000 rev=0x07 hdr=0x00 vendor=0x8086 device=0x2055 subvendor=0x8086 subdevice=0x0000
    vendor     = 'Intel Corporation'
    device     = 'Sky Lake-E CHA Registers'
    class      = base peripheral

none116@pci0:232:29:2:	class=0x088000 rev=0x07 hdr=0x00 vendor=0x8086 device=0x2056 subvendor=0x8086 subdevice=0x0000
    vendor     = 'Intel Corporation'
    device     = 'Sky Lake-E CHA Registers'
    class      = base peripheral

none117@pci0:232:29:3:	class=0x088000 rev=0x07 hdr=0x00 vendor=0x8086 device=0x2057 subvendor=0x8086 subdevice=0x0000
    vendor     = 'Intel Corporation'
    device     = 'Sky Lake-E CHA Registers'
    class      = base peripheral

none118@pci0:232:30:0:	class=0x088000 rev=0x07 hdr=0x00 vendor=0x8086 device=0x2080 subvendor=0x8086 subdevice=0x0000
    vendor     = 'Intel Corporation'
    device     = 'Sky Lake-E PCU Registers'
    class      = base peripheral

none119@pci0:232:30:1:	class=0x088000 rev=0x07 hdr=0x00 vendor=0x8086 device=0x2081 subvendor=0x8086 subdevice=0x0000
    vendor     = 'Intel Corporation'
    device     = 'Sky Lake-E PCU Registers'
    class      = base peripheral

none120@pci0:232:30:2:	class=0x088000 rev=0x07 hdr=0x00 vendor=0x8086 device=0x2082 subvendor=0x8086 subdevice=0x0000
    vendor     = 'Intel Corporation'
    device     = 'Sky Lake-E PCU Registers'
    class      = base peripheral

none121@pci0:232:30:3:	class=0x088000 rev=0x07 hdr=0x00 vendor=0x8086 device=0x2083 subvendor=0x8086 subdevice=0x0000
    vendor     = 'Intel Corporation'
    device     = 'Sky Lake-E PCU Registers'
    class      = base peripheral

none122@pci0:232:30:4:	class=0x088000 rev=0x07 hdr=0x00 vendor=0x8086 device=0x2084 subvendor=0x8086 subdevice=0x0000
    vendor     = 'Intel Corporation'
    device     = 'Sky Lake-E PCU Registers'
    class      = base peripheral

none123@pci0:232:30:5:	class=0x088000 rev=0x07 hdr=0x00 vendor=0x8086 device=0x2085 subvendor=0x8086 subdevice=0x0000
    vendor     = 'Intel Corporation'
    device     = 'Sky Lake-E PCU Registers'
    class      = base peripheral

none124@pci0:232:30:6:	class=0x088000 rev=0x07 hdr=0x00 vendor=0x8086 device=0x2086 subvendor=0x8086 subdevice=0x0000
    vendor     = 'Intel Corporation'
    device     = 'Sky Lake-E PCU Registers'
    class      = base peripheral

none125@pci0:240:5:0:	class=0x088000 rev=0x07 hdr=0x00 vendor=0x8086 device=0x2034 subvendor=0x8086 subdevice=0x0000
    vendor     = 'Intel Corporation'
    device     = 'Sky Lake-E VT-d'
    class      = base peripheral
    cap 10[40] = PCI-Express 2 root endpoint max data 128(128)
                 max read 128

none126@pci0:240:5:2:	class=0x088000 rev=0x07 hdr=0x00 vendor=0x8086 device=0x2035 subvendor=0x0000 subdevice=0x0000
    vendor     = 'Intel Corporation'
    device     = 'Sky Lake-E RAS Configuration Registers'
    class      = base peripheral
    cap 10[40] = PCI-Express 2 root endpoint max data 128(128)
                 max read 128

ioapic6@pci0:240:5:4:	class=0x080020 rev=0x07 hdr=0x00 vendor=0x8086 device=0x2036 subvendor=0x8086 subdevice=0x2036
    vendor     = 'Intel Corporation'
    device     = 'Sky Lake-E IOxAPIC Configuration Registers'
    class      = base peripheral
    subclass   = interrupt controller
    bar   [10] = type Memory, range 32, base 0xee700000, size 4096, enabled
    cap 10[44] = PCI-Express 1 root endpoint max data 128(128)
                 max read 128
    cap 01[e0] = powerspec 3  supports D0 D3  current D0

none127@pci0:240:8:0:	class=0x088000 rev=0x07 hdr=0x00 vendor=0x8086 device=0x2066 subvendor=0x8086 subdevice=0x0000
    vendor     = 'Intel Corporation'
    device     = 'Sky Lake-E Integrated Memory Controller'
    class      = base peripheral
    cap 10[40] = PCI-Express 1 root endpoint max data 128(128)
                 max read 128

none128@pci0:240:9:0:	class=0x088000 rev=0x07 hdr=0x00 vendor=0x8086 device=0x2066 subvendor=0x8086 subdevice=0x0000
    vendor     = 'Intel Corporation'
    device     = 'Sky Lake-E Integrated Memory Controller'
    class      = base peripheral
    cap 10[40] = PCI-Express 1 root endpoint max data 128(128)
                 max read 128

none129@pci0:240:10:0:	class=0x088000 rev=0x07 hdr=0x00 vendor=0x8086 device=0x2040 subvendor=0x8086 subdevice=0x0000
    vendor     = 'Intel Corporation'
    device     = 'Sky Lake-E Integrated Memory Controller'
    class      = base peripheral
    cap 10[40] = PCI-Express 1 root endpoint max data 128(128)
                 max read 128

none130@pci0:240:10:1:	class=0x088000 rev=0x07 hdr=0x00 vendor=0x8086 device=0x2041 subvendor=0x8086 subdevice=0x0000
    vendor     = 'Intel Corporation'
    device     = 'Sky Lake-E Integrated Memory Controller'
    class      = base peripheral
    cap 10[40] = PCI-Express 1 root endpoint max data 128(128)
                 max read 128

none131@pci0:240:10:2:	class=0x088000 rev=0x07 hdr=0x00 vendor=0x8086 device=0x2042 subvendor=0x8086 subdevice=0x0000
    vendor     = 'Intel Corporation'
    device     = 'Sky Lake-E Integrated Memory Controller'
    class      = base peripheral
    cap 10[40] = PCI-Express 1 root endpoint max data 128(128)
                 max read 128

none132@pci0:240:10:3:	class=0x088000 rev=0x07 hdr=0x00 vendor=0x8086 device=0x2043 subvendor=0x8086 subdevice=0x0000
    vendor     = 'Intel Corporation'
    device     = 'Sky Lake-E Integrated Memory Controller'
    class      = base peripheral
    cap 10[40] = PCI-Express 1 root endpoint max data 128(128)
                 max read 128

none133@pci0:240:10:4:	class=0x088000 rev=0x07 hdr=0x00 vendor=0x8086 device=0x2044 subvendor=0x8086 subdevice=0x0000
    vendor     = 'Intel Corporation'
    device     = 'Sky Lake-E Integrated Memory Controller'
    class      = base peripheral
    cap 10[40] = PCI-Express 1 root endpoint max data 128(128)
                 max read 128

none134@pci0:240:10:5:	class=0x088000 rev=0x07 hdr=0x00 vendor=0x8086 device=0x2045 subvendor=0x8086 subdevice=0x0000
    vendor     = 'Intel Corporation'
    device     = 'Sky Lake-E LM Channel 1'
    class      = base peripheral
    cap 10[40] = PCI-Express 1 root endpoint max data 128(128)
                 max read 128

none135@pci0:240:10:6:	class=0x088000 rev=0x07 hdr=0x00 vendor=0x8086 device=0x2046 subvendor=0x8086 subdevice=0x0000
    vendor     = 'Intel Corporation'
    device     = 'Sky Lake-E LMS Channel 1'
    class      = base peripheral
    cap 10[40] = PCI-Express 1 root endpoint max data 128(128)
                 max read 128

none136@pci0:240:10:7:	class=0x088000 rev=0x07 hdr=0x00 vendor=0x8086 device=0x2047 subvendor=0x8086 subdevice=0x0000
    vendor     = 'Intel Corporation'
    device     = 'Sky Lake-E LMDP Channel 1'
    class      = base peripheral
    cap 10[40] = PCI-Express 1 root endpoint max data 128(128)
                 max read 128

none137@pci0:240:11:0:	class=0x088000 rev=0x07 hdr=0x00 vendor=0x8086 device=0x2048 subvendor=0x8086 subdevice=0x0000
    vendor     = 'Intel Corporation'
    device     = 'Sky Lake-E DECS Channel 2'
    class      = base peripheral
    cap 10[40] = PCI-Express 1 root endpoint max data 128(128)
                 max read 128

none138@pci0:240:11:1:	class=0x088000 rev=0x07 hdr=0x00 vendor=0x8086 device=0x2049 subvendor=0x8086 subdevice=0x0000
    vendor     = 'Intel Corporation'
    device     = 'Sky Lake-E LM Channel 2'
    class      = base peripheral
    cap 10[40] = PCI-Express 1 root endpoint max data 128(128)
                 max read 128

none139@pci0:240:11:2:	class=0x088000 rev=0x07 hdr=0x00 vendor=0x8086 device=0x204a subvendor=0x8086 subdevice=0x0000
    vendor     = 'Intel Corporation'
    device     = 'Sky Lake-E LMS Channel 2'
    class      = base peripheral
    cap 10[40] = PCI-Express 1 root endpoint max data 128(128)
                 max read 128

none140@pci0:240:11:3:	class=0x088000 rev=0x07 hdr=0x00 vendor=0x8086 device=0x204b subvendor=0x8086 subdevice=0x0000
    vendor     = 'Intel Corporation'
    device     = 'Sky Lake-E LMDP Channel 2'
    class      = base peripheral
    cap 10[40] = PCI-Express 1 root endpoint max data 128(128)
                 max read 128

none141@pci0:240:12:0:	class=0x088000 rev=0x07 hdr=0x00 vendor=0x8086 device=0x2040 subvendor=0x8086 subdevice=0x0000
    vendor     = 'Intel Corporation'
    device     = 'Sky Lake-E Integrated Memory Controller'
    class      = base peripheral
    cap 10[40] = PCI-Express 1 root endpoint max data 128(128)
                 max read 128

none142@pci0:240:12:1:	class=0x088000 rev=0x07 hdr=0x00 vendor=0x8086 device=0x2041 subvendor=0x8086 subdevice=0x0000
    vendor     = 'Intel Corporation'
    device     = 'Sky Lake-E Integrated Memory Controller'
    class      = base peripheral
    cap 10[40] = PCI-Express 1 root endpoint max data 128(128)
                 max read 128

none143@pci0:240:12:2:	class=0x088000 rev=0x07 hdr=0x00 vendor=0x8086 device=0x2042 subvendor=0x8086 subdevice=0x0000
    vendor     = 'Intel Corporation'
    device     = 'Sky Lake-E Integrated Memory Controller'
    class      = base peripheral
    cap 10[40] = PCI-Express 1 root endpoint max data 128(128)
                 max read 128

none144@pci0:240:12:3:	class=0x088000 rev=0x07 hdr=0x00 vendor=0x8086 device=0x2043 subvendor=0x8086 subdevice=0x0000
    vendor     = 'Intel Corporation'
    device     = 'Sky Lake-E Integrated Memory Controller'
    class      = base peripheral
    cap 10[40] = PCI-Express 1 root endpoint max data 128(128)
                 max read 128

none145@pci0:240:12:4:	class=0x088000 rev=0x07 hdr=0x00 vendor=0x8086 device=0x2044 subvendor=0x8086 subdevice=0x0000
    vendor     = 'Intel Corporation'
    device     = 'Sky Lake-E Integrated Memory Controller'
    class      = base peripheral
    cap 10[40] = PCI-Express 1 root endpoint max data 128(128)
                 max read 128

none146@pci0:240:12:5:	class=0x088000 rev=0x07 hdr=0x00 vendor=0x8086 device=0x2045 subvendor=0x8086 subdevice=0x0000
    vendor     = 'Intel Corporation'
    device     = 'Sky Lake-E LM Channel 1'
    class      = base peripheral
    cap 10[40] = PCI-Express 1 root endpoint max data 128(128)
                 max read 128

none147@pci0:240:12:6:	class=0x088000 rev=0x07 hdr=0x00 vendor=0x8086 device=0x2046 subvendor=0x8086 subdevice=0x0000
    vendor     = 'Intel Corporation'
    device     = 'Sky Lake-E LMS Channel 1'
    class      = base peripheral
    cap 10[40] = PCI-Express 1 root endpoint max data 128(128)
                 max read 128

none148@pci0:240:12:7:	class=0x088000 rev=0x07 hdr=0x00 vendor=0x8086 device=0x2047 subvendor=0x8086 subdevice=0x0000
    vendor     = 'Intel Corporation'
    device     = 'Sky Lake-E LMDP Channel 1'
    class      = base peripheral
    cap 10[40] = PCI-Express 1 root endpoint max data 128(128)
                 max read 128

none149@pci0:240:13:0:	class=0x088000 rev=0x07 hdr=0x00 vendor=0x8086 device=0x2048 subvendor=0x8086 subdevice=0x0000
    vendor     = 'Intel Corporation'
    device     = 'Sky Lake-E DECS Channel 2'
    class      = base peripheral
    cap 10[40] = PCI-Express 1 root endpoint max data 128(128)
                 max read 128

none150@pci0:240:13:1:	class=0x088000 rev=0x07 hdr=0x00 vendor=0x8086 device=0x2049 subvendor=0x8086 subdevice=0x0000
    vendor     = 'Intel Corporation'
    device     = 'Sky Lake-E LM Channel 2'
    class      = base peripheral
    cap 10[40] = PCI-Express 1 root endpoint max data 128(128)
                 max read 128

none151@pci0:240:13:2:	class=0x088000 rev=0x07 hdr=0x00 vendor=0x8086 device=0x204a subvendor=0x8086 subdevice=0x0000
    vendor     = 'Intel Corporation'
    device     = 'Sky Lake-E LMS Channel 2'
    class      = base peripheral
    cap 10[40] = PCI-Express 1 root endpoint max data 128(128)
                 max read 128

none152@pci0:240:13:3:	class=0x088000 rev=0x07 hdr=0x00 vendor=0x8086 device=0x204b subvendor=0x8086 subdevice=0x0000
    vendor     = 'Intel Corporation'
    device     = 'Sky Lake-E LMDP Channel 2'
    class      = base peripheral
    cap 10[40] = PCI-Express 1 root endpoint max data 128(128)
                 max read 128

none153@pci0:248:5:0:	class=0x088000 rev=0x07 hdr=0x00 vendor=0x8086 device=0x2034 subvendor=0x8086 subdevice=0x0000
    vendor     = 'Intel Corporation'
    device     = 'Sky Lake-E VT-d'
    class      = base peripheral
    cap 10[40] = PCI-Express 2 root endpoint max data 128(128)
                 max read 128

none154@pci0:248:5:2:	class=0x088000 rev=0x07 hdr=0x00 vendor=0x8086 device=0x2035 subvendor=0x0000 subdevice=0x0000
    vendor     = 'Intel Corporation'
    device     = 'Sky Lake-E RAS Configuration Registers'
    class      = base peripheral
    cap 10[40] = PCI-Express 2 root endpoint max data 128(128)
                 max read 128

ioapic7@pci0:248:5:4:	class=0x080020 rev=0x07 hdr=0x00 vendor=0x8086 device=0x2036 subvendor=0x8086 subdevice=0x2036
    vendor     = 'Intel Corporation'
    device     = 'Sky Lake-E IOxAPIC Configuration Registers'
    class      = base peripheral
    subclass   = interrupt controller
    bar   [10] = type Memory, range 32, base 0xfbf00000, size 4096, enabled
    cap 10[44] = PCI-Express 1 root endpoint max data 128(128)
                 max read 128
    cap 01[e0] = powerspec 3  supports D0 D3  current D0

none155@pci0:248:14:0:	class=0x110100 rev=0x07 hdr=0x00 vendor=0x8086 device=0x2058 subvendor=0x8086 subdevice=0x0000
    vendor     = 'Intel Corporation'
    device     = 'Sky Lake-E KTI 0'
    class      = dasp
    subclass   = performance counters
    cap 10[40] = PCI-Express 2 root endpoint max data 128(128)
                 max read 128

none156@pci0:248:14:1:	class=0x088000 rev=0x07 hdr=0x00 vendor=0x8086 device=0x2059 subvendor=0x8086 subdevice=0x0000
    vendor     = 'Intel Corporation'
    device     = 'Sky Lake-E UPI Registers'
    class      = base peripheral
    cap 10[40] = PCI-Express 2 root endpoint max data 128(128)
                 max read 128
    ecap 000b[100] = Vendor [0] ID 0001 Rev 0 Length 240

none157@pci0:248:15:0:	class=0x110100 rev=0x07 hdr=0x00 vendor=0x8086 device=0x2058 subvendor=0x8086 subdevice=0x0000
    vendor     = 'Intel Corporation'
    device     = 'Sky Lake-E KTI 0'
    class      = dasp
    subclass   = performance counters
    cap 10[40] = PCI-Express 2 root endpoint max data 128(128)
                 max read 128

none158@pci0:248:15:1:	class=0x088000 rev=0x07 hdr=0x00 vendor=0x8086 device=0x2059 subvendor=0x8086 subdevice=0x0000
    vendor     = 'Intel Corporation'
    device     = 'Sky Lake-E UPI Registers'
    class      = base peripheral
    cap 10[40] = PCI-Express 2 root endpoint max data 128(128)
                 max read 128
    ecap 000b[100] = Vendor [0] ID 0001 Rev 0 Length 240

none159@pci0:248:18:0:	class=0x110100 rev=0x07 hdr=0x00 vendor=0x8086 device=0x204c subvendor=0x8086 subdevice=0x0000
    vendor     = 'Intel Corporation'
    device     = 'Sky Lake-E M3KTI Registers'
    class      = dasp
    subclass   = performance counters
    cap 10[40] = PCI-Express 2 root endpoint max data 128(128)
                 max read 128

none160@pci0:248:18:1:	class=0x110100 rev=0x07 hdr=0x00 vendor=0x8086 device=0x204d subvendor=0x8086 subdevice=0x0000
    vendor     = 'Intel Corporation'
    device     = 'Sky Lake-E M3KTI Registers'
    class      = dasp
    subclass   = performance counters

none161@pci0:248:18:2:	class=0x088000 rev=0x07 hdr=0x00 vendor=0x8086 device=0x204e subvendor=0x8086 subdevice=0x0000
    vendor     = 'Intel Corporation'
    device     = 'Sky Lake-E M3KTI Registers'
    class      = base peripheral

none162@pci0:248:21:0:	class=0x088000 rev=0x07 hdr=0x00 vendor=0x8086 device=0x2018 subvendor=0x8086 subdevice=0x0000
    vendor     = 'Intel Corporation'
    device     = 'Sky Lake-E M2PCI Registers'
    class      = base peripheral

none163@pci0:248:21:1:	class=0x110100 rev=0x07 hdr=0x00 vendor=0x8086 device=0x2088 subvendor=0x8086 subdevice=0x0000
    vendor     = 'Intel Corporation'
    device     = 'Sky Lake-E DDRIO Registers'
    class      = dasp
    subclass   = performance counters

none164@pci0:248:22:0:	class=0x088000 rev=0x07 hdr=0x00 vendor=0x8086 device=0x2018 subvendor=0x8086 subdevice=0x0000
    vendor     = 'Intel Corporation'
    device     = 'Sky Lake-E M2PCI Registers'
    class      = base peripheral

none165@pci0:248:22:1:	class=0x110100 rev=0x07 hdr=0x00 vendor=0x8086 device=0x2088 subvendor=0x8086 subdevice=0x0000
    vendor     = 'Intel Corporation'
    device     = 'Sky Lake-E DDRIO Registers'
    class      = dasp
    subclass   = performance counters

none166@pci0:248:22:4:	class=0x088000 rev=0x07 hdr=0x00 vendor=0x8086 device=0x2018 subvendor=0x8086 subdevice=0x0000
    vendor     = 'Intel Corporation'
    device     = 'Sky Lake-E M2PCI Registers'
    class      = base peripheral

none167@pci0:248:22:5:	class=0x110100 rev=0x07 hdr=0x00 vendor=0x8086 device=0x2088 subvendor=0x8086 subdevice=0x0000
    vendor     = 'Intel Corporation'
    device     = 'Sky Lake-E DDRIO Registers'
    class      = dasp
    subclass   = performance counters
