none0@pci0:255:11:0:	class=0x088000 card=0x2f818086 chip=0x2f818086 rev=0x02 hdr=0x00
    vendor     = 'Intel Corporation'
    device     = 'Xeon E7 v3/Xeon E5 v3/Core i7 R3 QPI Link 0 & 1 Monitoring'
    class      = base peripheral

none1@pci0:255:11:1:	class=0x110100 card=0x2f368086 chip=0x2f368086 rev=0x02 hdr=0x00
    vendor     = 'Intel Corporation'
    device     = 'Xeon E7 v3/Xeon E5 v3/Core i7 R3 QPI Link 0 & 1 Monitoring'
    class      = dasp
    subclass   = performance counters

none2@pci0:255:11:2:	class=0x110100 card=0x2f378086 chip=0x2f378086 rev=0x02 hdr=0x00
    vendor     = 'Intel Corporation'
    device     = 'Xeon E7 v3/Xeon E5 v3/Core i7 R3 QPI Link 0 & 1 Monitoring'
    class      = dasp
    subclass   = performance counters

none3@pci0:255:12:0:	class=0x088000 card=0x2fe08086 chip=0x2fe08086 rev=0x02 hdr=0x00
    vendor     = 'Intel Corporation'
    device     = 'Xeon E7 v3/Xeon E5 v3/Core i7 Unicast Registers'
    class      = base peripheral

none4@pci0:255:12:1:	class=0x088000 card=0x2fe18086 chip=0x2fe18086 rev=0x02 hdr=0x00
    vendor     = 'Intel Corporation'
    device     = 'Xeon E7 v3/Xeon E5 v3/Core i7 Unicast Registers'
    class      = base peripheral

none5@pci0:255:12:2:	class=0x088000 card=0x2fe28086 chip=0x2fe28086 rev=0x02 hdr=0x00
    vendor     = 'Intel Corporation'
    device     = 'Xeon E7 v3/Xeon E5 v3/Core i7 Unicast Registers'
    class      = base peripheral

none6@pci0:255:12:3:	class=0x088000 card=0x2fe38086 chip=0x2fe38086 rev=0x02 hdr=0x00
    vendor     = 'Intel Corporation'
    device     = 'Xeon E7 v3/Xeon E5 v3/Core i7 Unicast Registers'
    class      = base peripheral

none7@pci0:255:12:4:	class=0x088000 card=0x2fe48086 chip=0x2fe48086 rev=0x02 hdr=0x00
    vendor     = 'Intel Corporation'
    device     = 'Xeon E7 v3/Xeon E5 v3/Core i7 Unicast Registers'
    class      = base peripheral

none8@pci0:255:12:5:	class=0x088000 card=0x2fe58086 chip=0x2fe58086 rev=0x02 hdr=0x00
    vendor     = 'Intel Corporation'
    device     = 'Xeon E7 v3/Xeon E5 v3/Core i7 Unicast Registers'
    class      = base peripheral

none9@pci0:255:15:0:	class=0x088000 card=0x00000000 chip=0x2ff88086 rev=0x02 hdr=0x00
    vendor     = 'Intel Corporation'
    device     = 'Xeon E7 v3/Xeon E5 v3/Core i7 Buffered Ring Agent'
    class      = base peripheral

none10@pci0:255:15:1:	class=0x088000 card=0x00000000 chip=0x2ff98086 rev=0x02 hdr=0x00
    vendor     = 'Intel Corporation'
    device     = 'Xeon E7 v3/Xeon E5 v3/Core i7 Buffered Ring Agent'
    class      = base peripheral

none11@pci0:255:15:4:	class=0x088000 card=0x2fe08086 chip=0x2ffc8086 rev=0x02 hdr=0x00
    vendor     = 'Intel Corporation'
    device     = 'Xeon E7 v3/Xeon E5 v3/Core i7 System Address Decoder & Broadcast Registers'
    class      = base peripheral

none12@pci0:255:15:5:	class=0x088000 card=0x2fe08086 chip=0x2ffd8086 rev=0x02 hdr=0x00
    vendor     = 'Intel Corporation'
    device     = 'Xeon E7 v3/Xeon E5 v3/Core i7 System Address Decoder & Broadcast Registers'
    class      = base peripheral

none13@pci0:255:15:6:	class=0x088000 card=0x2fe08086 chip=0x2ffe8086 rev=0x02 hdr=0x00
    vendor     = 'Intel Corporation'
    device     = 'Xeon E7 v3/Xeon E5 v3/Core i7 System Address Decoder & Broadcast Registers'
    class      = base peripheral

none14@pci0:255:16:0:	class=0x088000 card=0x2f1d8086 chip=0x2f1d8086 rev=0x02 hdr=0x00
    vendor     = 'Intel Corporation'
    device     = 'Xeon E7 v3/Xeon E5 v3/Core i7 PCIe Ring Interface'
    class      = base peripheral

none15@pci0:255:16:1:	class=0x110100 card=0x2f348086 chip=0x2f348086 rev=0x02 hdr=0x00
    vendor     = 'Intel Corporation'
    device     = 'Xeon E7 v3/Xeon E5 v3/Core i7 PCIe Ring Interface'
    class      = dasp
    subclass   = performance counters

none16@pci0:255:16:5:	class=0x088000 card=0x2f1e8086 chip=0x2f1e8086 rev=0x02 hdr=0x00
    vendor     = 'Intel Corporation'
    device     = 'Xeon E7 v3/Xeon E5 v3/Core i7 Scratchpad & Semaphore Registers'
    class      = base peripheral

none17@pci0:255:16:6:	class=0x110100 card=0x2f7d8086 chip=0x2f7d8086 rev=0x02 hdr=0x00
    vendor     = 'Intel Corporation'
    device     = 'Xeon E7 v3/Xeon E5 v3/Core i7 Scratchpad & Semaphore Registers'
    class      = dasp
    subclass   = performance counters

none18@pci0:255:16:7:	class=0x088000 card=0x2f1f8086 chip=0x2f1f8086 rev=0x02 hdr=0x00
    vendor     = 'Intel Corporation'
    device     = 'Xeon E7 v3/Xeon E5 v3/Core i7 Scratchpad & Semaphore Registers'
    class      = base peripheral

none19@pci0:255:18:0:	class=0x088000 card=0x2fa08086 chip=0x2fa08086 rev=0x02 hdr=0x00
    vendor     = 'Intel Corporation'
    device     = 'Xeon E7 v3/Xeon E5 v3/Core i7 Home Agent 0'
    class      = base peripheral

none20@pci0:255:18:1:	class=0x110100 card=0x2f308086 chip=0x2f308086 rev=0x02 hdr=0x00
    vendor     = 'Intel Corporation'
    device     = 'Xeon E7 v3/Xeon E5 v3/Core i7 Home Agent 0'
    class      = dasp
    subclass   = performance counters

none21@pci0:255:18:2:	class=0x088000 card=0x2f708086 chip=0x2f708086 rev=0x02 hdr=0x00
    vendor     = 'Intel Corporation'
    device     = 'Xeon E7 v3/Xeon E5 v3/Core i7 Home Agent 0 Debug'
    class      = base peripheral

none22@pci0:255:19:0:	class=0x088000 card=0x2fa88086 chip=0x2fa88086 rev=0x02 hdr=0x00
    vendor     = 'Intel Corporation'
    device     = 'Xeon E7 v3/Xeon E5 v3/Core i7 Integrated Memory Controller 0 Target Address, Thermal & RAS Registers'
    class      = base peripheral

none23@pci0:255:19:1:	class=0x088000 card=0x2f718086 chip=0x2f718086 rev=0x02 hdr=0x00
    vendor     = 'Intel Corporation'
    device     = 'Xeon E7 v3/Xeon E5 v3/Core i7 Integrated Memory Controller 0 Target Address, Thermal & RAS Registers'
    class      = base peripheral

none24@pci0:255:19:2:	class=0x088000 card=0x2faa8086 chip=0x2faa8086 rev=0x02 hdr=0x00
    vendor     = 'Intel Corporation'
    device     = 'Xeon E7 v3/Xeon E5 v3/Core i7 Integrated Memory Controller 0 Channel Target Address Decoder'
    class      = base peripheral

none25@pci0:255:19:3:	class=0x088000 card=0x2fab8086 chip=0x2fab8086 rev=0x02 hdr=0x00
    vendor     = 'Intel Corporation'
    device     = 'Xeon E7 v3/Xeon E5 v3/Core i7 Integrated Memory Controller 0 Channel Target Address Decoder'
    class      = base peripheral

none26@pci0:255:19:4:	class=0x088000 card=0x2fac8086 chip=0x2fac8086 rev=0x02 hdr=0x00
    vendor     = 'Intel Corporation'
    device     = 'Xeon E7 v3/Xeon E5 v3/Core i7 Integrated Memory Controller 0 Channel Target Address Decoder'
    class      = base peripheral

none27@pci0:255:19:5:	class=0x088000 card=0x2fad8086 chip=0x2fad8086 rev=0x02 hdr=0x00
    vendor     = 'Intel Corporation'
    device     = 'Xeon E7 v3/Xeon E5 v3/Core i7 Integrated Memory Controller 0 Channel Target Address Decoder'
    class      = base peripheral

none28@pci0:255:19:6:	class=0x088000 card=0x00000000 chip=0x2fae8086 rev=0x02 hdr=0x00
    vendor     = 'Intel Corporation'
    device     = 'Xeon E7 v3/Xeon E5 v3/Core i7 DDRIO Channel 0/1 Broadcast'
    class      = base peripheral

none29@pci0:255:19:7:	class=0x088000 card=0x00000000 chip=0x2faf8086 rev=0x02 hdr=0x00
    vendor     = 'Intel Corporation'
    device     = 'Xeon E7 v3/Xeon E5 v3/Core i7 DDRIO Global Broadcast'
    class      = base peripheral

none30@pci0:255:20:0:	class=0x088000 card=0x2fb08086 chip=0x2fb08086 rev=0x02 hdr=0x00
    vendor     = 'Intel Corporation'
    device     = 'Xeon E7 v3/Xeon E5 v3/Core i7 Integrated Memory Controller 0 Channel 0 Thermal Control'
    class      = base peripheral

none31@pci0:255:20:1:	class=0x088000 card=0x2fb18086 chip=0x2fb18086 rev=0x02 hdr=0x00
    vendor     = 'Intel Corporation'
    device     = 'Xeon E7 v3/Xeon E5 v3/Core i7 Integrated Memory Controller 0 Channel 1 Thermal Control'
    class      = base peripheral

none32@pci0:255:20:2:	class=0x088000 card=0x2fb28086 chip=0x2fb28086 rev=0x02 hdr=0x00
    vendor     = 'Intel Corporation'
    device     = 'Xeon E7 v3/Xeon E5 v3/Core i7 Integrated Memory Controller 0 Channel 0 ERROR Registers'
    class      = base peripheral

none33@pci0:255:20:3:	class=0x088000 card=0x2fb38086 chip=0x2fb38086 rev=0x02 hdr=0x00
    vendor     = 'Intel Corporation'
    device     = 'Xeon E7 v3/Xeon E5 v3/Core i7 Integrated Memory Controller 0 Channel 1 ERROR Registers'
    class      = base peripheral

none34@pci0:255:20:4:	class=0x088000 card=0x00000000 chip=0x2fbc8086 rev=0x02 hdr=0x00
    vendor     = 'Intel Corporation'
    device     = 'Xeon E7 v3/Xeon E5 v3/Core i7 DDRIO (VMSE) 0 & 1'
    class      = base peripheral

none35@pci0:255:20:5:	class=0x088000 card=0x00000000 chip=0x2fbd8086 rev=0x02 hdr=0x00
    vendor     = 'Intel Corporation'
    device     = 'Xeon E7 v3/Xeon E5 v3/Core i7 DDRIO (VMSE) 0 & 1'
    class      = base peripheral

none36@pci0:255:20:6:	class=0x088000 card=0x00000000 chip=0x2fbe8086 rev=0x02 hdr=0x00
    vendor     = 'Intel Corporation'
    device     = 'Xeon E7 v3/Xeon E5 v3/Core i7 DDRIO (VMSE) 0 & 1'
    class      = base peripheral

none37@pci0:255:20:7:	class=0x088000 card=0x00000000 chip=0x2fbf8086 rev=0x02 hdr=0x00
    vendor     = 'Intel Corporation'
    device     = 'Xeon E7 v3/Xeon E5 v3/Core i7 DDRIO (VMSE) 0 & 1'
    class      = base peripheral

none38@pci0:255:21:0:	class=0x088000 card=0x2fb48086 chip=0x2fb48086 rev=0x02 hdr=0x00
    vendor     = 'Intel Corporation'
    device     = 'Xeon E7 v3/Xeon E5 v3/Core i7 Integrated Memory Controller 0 Channel 2 Thermal Control'
    class      = base peripheral

none39@pci0:255:21:1:	class=0x088000 card=0x2fb58086 chip=0x2fb58086 rev=0x02 hdr=0x00
    vendor     = 'Intel Corporation'
    device     = 'Xeon E7 v3/Xeon E5 v3/Core i7 Integrated Memory Controller 0 Channel 3 Thermal Control'
    class      = base peripheral

none40@pci0:255:21:2:	class=0x088000 card=0x2fb68086 chip=0x2fb68086 rev=0x02 hdr=0x00
    vendor     = 'Intel Corporation'
    device     = 'Xeon E7 v3/Xeon E5 v3/Core i7 Integrated Memory Controller 0 Channel 2 ERROR Registers'
    class      = base peripheral

none41@pci0:255:21:3:	class=0x088000 card=0x2fb78086 chip=0x2fb78086 rev=0x02 hdr=0x00
    vendor     = 'Intel Corporation'
    device     = 'Xeon E7 v3/Xeon E5 v3/Core i7 Integrated Memory Controller 0 Channel 3 ERROR Registers'
    class      = base peripheral

none42@pci0:255:22:0:	class=0x088000 card=0x00000000 chip=0x2f688086 rev=0x02 hdr=0x00
    vendor     = 'Intel Corporation'
    device     = 'Xeon E7 v3/Xeon E5 v3/Core i7 Integrated Memory Controller 1 Target Address, Thermal & RAS Registers'
    class      = base peripheral

none43@pci0:255:22:6:	class=0x088000 card=0x00000000 chip=0x2f6e8086 rev=0x02 hdr=0x00
    vendor     = 'Intel Corporation'
    device     = 'Xeon E7 v3/Xeon E5 v3/Core i7 DDRIO Channel 2/3 Broadcast'
    class      = base peripheral

none44@pci0:255:22:7:	class=0x088000 card=0x00000000 chip=0x2f6f8086 rev=0x02 hdr=0x00
    vendor     = 'Intel Corporation'
    device     = 'Xeon E7 v3/Xeon E5 v3/Core i7 DDRIO Global Broadcast'
    class      = base peripheral

none45@pci0:255:23:0:	class=0x088000 card=0x00000000 chip=0x2fd08086 rev=0x02 hdr=0x00
    vendor     = 'Intel Corporation'
    device     = 'Xeon E7 v3/Xeon E5 v3/Core i7 Integrated Memory Controller 1 Channel 0 Thermal Control'
    class      = base peripheral

none46@pci0:255:23:4:	class=0x088000 card=0x00000000 chip=0x2fb88086 rev=0x02 hdr=0x00
    vendor     = 'Intel Corporation'
    device     = 'Xeon E7 v3/Xeon E5 v3/Core i7 DDRIO (VMSE) 2 & 3'
    class      = base peripheral

none47@pci0:255:23:5:	class=0x088000 card=0x00000000 chip=0x2fb98086 rev=0x02 hdr=0x00
    vendor     = 'Intel Corporation'
    device     = 'Xeon E7 v3/Xeon E5 v3/Core i7 DDRIO (VMSE) 2 & 3'
    class      = base peripheral

none48@pci0:255:23:6:	class=0x088000 card=0x00000000 chip=0x2fba8086 rev=0x02 hdr=0x00
    vendor     = 'Intel Corporation'
    device     = 'Xeon E7 v3/Xeon E5 v3/Core i7 DDRIO (VMSE) 2 & 3'
    class      = base peripheral

none49@pci0:255:23:7:	class=0x088000 card=0x00000000 chip=0x2fbb8086 rev=0x02 hdr=0x00
    vendor     = 'Intel Corporation'
    device     = 'Xeon E7 v3/Xeon E5 v3/Core i7 DDRIO (VMSE) 2 & 3'
    class      = base peripheral

none50@pci0:255:30:0:	class=0x088000 card=0x2f988086 chip=0x2f988086 rev=0x02 hdr=0x00
    vendor     = 'Intel Corporation'
    device     = 'Xeon E7 v3/Xeon E5 v3/Core i7 Power Control Unit'
    class      = base peripheral

none51@pci0:255:30:1:	class=0x088000 card=0x2f998086 chip=0x2f998086 rev=0x02 hdr=0x00
    vendor     = 'Intel Corporation'
    device     = 'Xeon E7 v3/Xeon E5 v3/Core i7 Power Control Unit'
    class      = base peripheral

none52@pci0:255:30:2:	class=0x088000 card=0x2f9a8086 chip=0x2f9a8086 rev=0x02 hdr=0x00
    vendor     = 'Intel Corporation'
    device     = 'Xeon E7 v3/Xeon E5 v3/Core i7 Power Control Unit'
    class      = base peripheral

none53@pci0:255:30:3:	class=0x088000 card=0x2fc08086 chip=0x2fc08086 rev=0x02 hdr=0x00
    vendor     = 'Intel Corporation'
    device     = 'Xeon E7 v3/Xeon E5 v3/Core i7 Power Control Unit'
    class      = base peripheral
    bar   [10] = type Prefetchable Memory, range 32, base 0x10, size 16, disabled

none54@pci0:255:30:4:	class=0x088000 card=0x2f9c8086 chip=0x2f9c8086 rev=0x02 hdr=0x00
    vendor     = 'Intel Corporation'
    device     = 'Xeon E7 v3/Xeon E5 v3/Core i7 Power Control Unit'
    class      = base peripheral

none55@pci0:255:31:0:	class=0x088000 card=0x00000000 chip=0x2f888086 rev=0x02 hdr=0x00
    vendor     = 'Intel Corporation'
    device     = 'Xeon E7 v3/Xeon E5 v3/Core i7 VCU'
    class      = base peripheral

none56@pci0:255:31:2:	class=0x088000 card=0x00000000 chip=0x2f8a8086 rev=0x02 hdr=0x00
    vendor     = 'Intel Corporation'
    device     = 'Xeon E7 v3/Xeon E5 v3/Core i7 VCU'
    class      = base peripheral

hostb0@pci0:0:0:0:	class=0x060000 card=0x00008086 chip=0x2f008086 rev=0x02 hdr=0x00
    vendor     = 'Intel Corporation'
    device     = 'Xeon E7 v3/Xeon E5 v3/Core i7 DMI2'
    class      = bridge
    subclass   = HOST-PCI
    cap 10[90] = PCI-Express 2 root port max data 128(128)
                 link x0(x4) speed 0.0(2.5) ASPM disabled(L1)
    cap 01[e0] = powerspec 3  supports D0 D3  current D0
    ecap 000b[100] = Vendor 1 ID 2
    ecap 000b[144] = Vendor 1 ID 4
    ecap 000b[1d0] = Vendor 1 ID 3
    ecap 000b[280] = Vendor 1 ID 5
    ecap 000b[300] = Vendor 1 ID 8

pcib2@pci0:0:1:0:	class=0x060400 card=0x00008086 chip=0x2f028086 rev=0x02 hdr=0x01
    vendor     = 'Intel Corporation'
    device     = 'Xeon E7 v3/Xeon E5 v3/Core i7 PCI Express Root Port 1'
    class      = bridge
    subclass   = PCI-PCI
    cap 0d[40] = PCI Bridge card=0x00008086
    cap 05[60] = MSI supports 2 messages, vector masks 
    cap 10[90] = PCI-Express 2 root port max data 256(256) ARI enabled
                 link x8(x8) speed 8.0(8.0) ASPM disabled(L1)
    cap 01[e0] = powerspec 3  supports D0 D3  current D0
    ecap 000b[100] = Vendor 1 ID 2
    ecap 000d[110] = ACS 1
    ecap 0001[148] = AER 1 0 fatal 0 non-fatal 0 corrected
    ecap 000b[1d0] = Vendor 1 ID 3
    ecap 0019[250] = PCIe Sec 1 lane errors 0
    ecap 000b[280] = Vendor 1 ID 5
    ecap 000b[300] = Vendor 1 ID 8

pcib3@pci0:0:2:0:	class=0x060400 card=0x00008086 chip=0x2f048086 rev=0x02 hdr=0x01
    vendor     = 'Intel Corporation'
    device     = 'Xeon E7 v3/Xeon E5 v3/Core i7 PCI Express Root Port 2'
    class      = bridge
    subclass   = PCI-PCI
    cap 0d[40] = PCI Bridge card=0x00008086
    cap 05[60] = MSI supports 2 messages, vector masks 
    cap 10[90] = PCI-Express 2 root port max data 256(256) ARI disabled
                 link x0(x16) speed 0.0(8.0) ASPM disabled(L1)
                 slot 1 power limit 25000 mW
    cap 01[e0] = powerspec 3  supports D0 D3  current D0
    ecap 000b[100] = Vendor 1 ID 2
    ecap 000d[110] = ACS 1
    ecap 0001[148] = AER 1 0 fatal 0 non-fatal 0 corrected
    ecap 000b[1d0] = Vendor 1 ID 3
    ecap 0019[250] = PCIe Sec 1 lane errors 0
    ecap 000b[280] = Vendor 1 ID 5
    ecap 000b[300] = Vendor 1 ID 8

pcib4@pci0:0:3:0:	class=0x060400 card=0x00008086 chip=0x2f088086 rev=0x02 hdr=0x01
    vendor     = 'Intel Corporation'
    device     = 'Xeon E7 v3/Xeon E5 v3/Core i7 PCI Express Root Port 3'
    class      = bridge
    subclass   = PCI-PCI
    cap 0d[40] = PCI Bridge card=0x00008086
    cap 05[60] = MSI supports 2 messages, vector masks 
    cap 10[90] = PCI-Express 2 root port max data 256(256) ARI enabled
                 link x4(x16) speed 8.0(8.0) ASPM disabled(L1)
                 slot 2 power limit 25000 mW
    cap 01[e0] = powerspec 3  supports D0 D3  current D0
    ecap 000b[100] = Vendor 1 ID 2
    ecap 000d[110] = ACS 1
    ecap 0001[148] = AER 1 0 fatal 0 non-fatal 0 corrected
    ecap 000b[1d0] = Vendor 1 ID 3
    ecap 0019[250] = PCIe Sec 1 lane errors 0
    ecap 000b[280] = Vendor 1 ID 5
    ecap 000b[300] = Vendor 1 ID 8

none57@pci0:0:5:0:	class=0x088000 card=0x00000000 chip=0x2f288086 rev=0x02 hdr=0x00
    vendor     = 'Intel Corporation'
    device     = 'Xeon E7 v3/Xeon E5 v3/Core i7 Address Map, VTd_Misc, System Management'
    class      = base peripheral
    cap 10[40] = PCI-Express 2 root endpoint max data 128(128)

none58@pci0:0:5:1:	class=0x088000 card=0x00000000 chip=0x2f298086 rev=0x02 hdr=0x00
    vendor     = 'Intel Corporation'
    device     = 'Xeon E7 v3/Xeon E5 v3/Core i7 Hot Plug'
    class      = base peripheral
    cap 10[40] = PCI-Express 1 root endpoint max data 128(128)
    cap 05[80] = MSI supports 1 message, 64 bit 
    ecap 000b[100] = Vendor 1 ID 6
    ecap 000b[110] = Vendor 1 ID 6
    ecap 000b[120] = Vendor 1 ID 6
    ecap 000b[130] = Vendor 1 ID 6

none59@pci0:0:5:2:	class=0x088000 card=0x00000000 chip=0x2f2a8086 rev=0x02 hdr=0x00
    vendor     = 'Intel Corporation'
    device     = 'Xeon E7 v3/Xeon E5 v3/Core i7 RAS, Control Status and Global Errors'
    class      = base peripheral
    cap 10[40] = PCI-Express 2 root endpoint max data 128(128)

ioapic0@pci0:0:5:4:	class=0x080020 card=0x00008086 chip=0x2f2c8086 rev=0x02 hdr=0x00
    vendor     = 'Intel Corporation'
    device     = 'Xeon E7 v3/Xeon E5 v3/Core i7 I/O APIC'
    class      = base peripheral
    subclass   = interrupt controller
    bar   [10] = type Memory, range 32, base 0x91f14000, size 4096, enabled
    cap 10[44] = PCI-Express 1 root endpoint max data 128(128)
    cap 01[e0] = powerspec 3  supports D0 D3  current D0

none60@pci0:0:17:0:	class=0xff0000 card=0x06391028 chip=0x8d7c8086 rev=0x05 hdr=0x00
    vendor     = 'Intel Corporation'
    device     = 'C610/X99 series chipset SPSR'
    cap 10[40] = PCI-Express 2 root endpoint max data 128(128)
                 link x1(x1) speed 2.5(2.5) ASPM disabled(L0s/L1)
    cap 01[80] = powerspec 3  supports D0 D3  current D0

ahci0@pci0:0:17:4:	class=0x010601 card=0x06391028 chip=0x8d628086 rev=0x05 hdr=0x00
    vendor     = 'Intel Corporation'
    device     = 'C610/X99 series chipset sSATA Controller [AHCI mode]'
    class      = mass storage
    subclass   = SATA
    bar   [10] = type I/O Port, range 32, base 0x3078, size 8, enabled
    bar   [14] = type I/O Port, range 32, base 0x308c, size 4, enabled
    bar   [18] = type I/O Port, range 32, base 0x3070, size 8, enabled
    bar   [1c] = type I/O Port, range 32, base 0x3088, size 4, enabled
    bar   [20] = type I/O Port, range 32, base 0x3040, size 32, enabled
    bar   [24] = type Memory, range 32, base 0x91f11000, size 2048, enabled
    cap 05[80] = MSI supports 1 message enabled with 1 message
    cap 01[70] = powerspec 3  supports D0 D3  current D0
    cap 12[a8] = SATA Index-Data Pair

xhci0@pci0:0:20:0:	class=0x0c0330 card=0x06391028 chip=0x8d318086 rev=0x05 hdr=0x00
    vendor     = 'Intel Corporation'
    device     = 'C610/X99 series chipset USB xHCI Host Controller'
    class      = serial bus
    subclass   = USB
    bar   [10] = type Memory, range 64, base 0x91f00000, size 65536, enabled
    cap 01[70] = powerspec 2  supports D0 D3  current D0

none61@pci0:0:22:0:	class=0x078000 card=0x06391028 chip=0x8d3a8086 rev=0x05 hdr=0x00
    vendor     = 'Intel Corporation'
    device     = 'C610/X99 series chipset MEI Controller'
    class      = simple comms
    bar   [10] = type Memory, range 64, base 0x33ffff03000, size 16, enabled
    cap 01[50] = powerspec 3  supports D0 D3  current D0
    cap 05[8c] = MSI supports 1 message, 64 bit 

none62@pci0:0:22:1:	class=0x078000 card=0x06391028 chip=0x8d3b8086 rev=0x05 hdr=0x00
    vendor     = 'Intel Corporation'
    device     = 'C610/X99 series chipset MEI Controller'
    class      = simple comms
    bar   [10] = type Memory, range 64, base 0x33ffff02000, size 16, enabled
    cap 01[50] = powerspec 3  supports D0 D3  current D0
    cap 05[8c] = MSI supports 1 message, 64 bit 

ehci0@pci0:0:26:0:	class=0x0c0320 card=0x06391028 chip=0x8d2d8086 rev=0x05 hdr=0x00
    vendor     = 'Intel Corporation'
    device     = 'C610/X99 series chipset USB Enhanced Host Controller'
    class      = serial bus
    subclass   = USB
    bar   [10] = type Memory, range 32, base 0x91f13000, size 1024, enabled
    cap 01[50] = powerspec 2  supports D0 D3  current D0
    cap 0a[58] = EHCI Debug Port at offset 0xa0 in map 0x14
    cap 13[98] = PCI Advanced Features: FLR TP

pcib5@pci0:0:28:0:	class=0x060400 card=0x06391028 chip=0x8d108086 rev=0xd5 hdr=0x01
    vendor     = 'Intel Corporation'
    device     = 'C610/X99 series chipset PCI Express Root Port'
    class      = bridge
    subclass   = PCI-PCI
    cap 10[40] = PCI-Express 2 root port max data 128(128)
                 link x0(x1) speed 0.0(5.0) ASPM disabled(L0s/L1)
                 slot 0 power limit 0 mW HotPlug(empty) surprise
    cap 05[80] = MSI supports 1 message 
    cap 0d[90] = PCI Bridge card=0x06391028
    cap 01[a0] = powerspec 3  supports D0 D3  current D0

pcib6@pci0:0:28:1:	class=0x060400 card=0x06391028 chip=0x8d128086 rev=0xd5 hdr=0x01
    vendor     = 'Intel Corporation'
    device     = 'C610/X99 series chipset PCI Express Root Port'
    class      = bridge
    subclass   = PCI-PCI
    cap 10[40] = PCI-Express 2 root port max data 128(128)
                 link x1(x1) speed 2.5(5.0) ASPM disabled(L0s/L1)
                 slot 0 power limit 0 mW
    cap 05[80] = MSI supports 1 message 
    cap 0d[90] = PCI Bridge card=0x06391028
    cap 01[a0] = powerspec 3  supports D0 D3  current D0
    ecap 0001[100] = AER 1 0 fatal 0 non-fatal 0 corrected

pcib10@pci0:0:28:2:	class=0x060400 card=0x06391028 chip=0x8d148086 rev=0xd5 hdr=0x01
    vendor     = 'Intel Corporation'
    device     = 'C610/X99 series chipset PCI Express Root Port'
    class      = bridge
    subclass   = PCI-PCI
    cap 10[40] = PCI-Express 2 root port max data 128(128)
                 link x1(x1) speed 5.0(5.0) ASPM disabled(L0s/L1)
                 slot 0 power limit 0 mW
    cap 05[80] = MSI supports 1 message 
    cap 0d[90] = PCI Bridge card=0x06391028
    cap 01[a0] = powerspec 3  supports D0 D3  current D0
    ecap 0001[100] = AER 1 0 fatal 0 non-fatal 0 corrected

pcib11@pci0:0:28:3:	class=0x060400 card=0x06391028 chip=0x8d168086 rev=0xd5 hdr=0x01
    vendor     = 'Intel Corporation'
    device     = 'C610/X99 series chipset PCI Express Root Port'
    class      = bridge
    subclass   = PCI-PCI
    cap 10[40] = PCI-Express 2 root port max data 128(128)
                 link x1(x1) speed 5.0(5.0) ASPM disabled(L0s/L1)
                 slot 0 power limit 0 mW
    cap 05[80] = MSI supports 1 message 
    cap 0d[90] = PCI Bridge card=0x06391028
    cap 01[a0] = powerspec 3  supports D0 D3  current D0
    ecap 0001[100] = AER 1 0 fatal 0 non-fatal 0 corrected

ehci1@pci0:0:29:0:	class=0x0c0320 card=0x06391028 chip=0x8d268086 rev=0x05 hdr=0x00
    vendor     = 'Intel Corporation'
    device     = 'C610/X99 series chipset USB Enhanced Host Controller'
    class      = serial bus
    subclass   = USB
    bar   [10] = type Memory, range 32, base 0x91f12000, size 1024, enabled
    cap 01[50] = powerspec 2  supports D0 D3  current D0
    cap 0a[58] = EHCI Debug Port at offset 0xa0 in map 0x14
    cap 13[98] = PCI Advanced Features: FLR TP

isab0@pci0:0:31:0:	class=0x060100 card=0x06391028 chip=0x8d448086 rev=0x05 hdr=0x00
    vendor     = 'Intel Corporation'
    device     = 'C610/X99 series chipset LPC Controller'
    class      = bridge
    subclass   = PCI-ISA
    cap 09[e0] = vendor (length 12) Intel cap 1 version 0
		 features: AMT, 4 PCI-e x1 slots

ahci1@pci0:0:31:2:	class=0x010601 card=0x06391028 chip=0x8d028086 rev=0x05 hdr=0x00
    vendor     = 'Intel Corporation'
    device     = 'C610/X99 series chipset 6-Port SATA Controller [AHCI mode]'
    class      = mass storage
    subclass   = SATA
    bar   [10] = type I/O Port, range 32, base 0x3068, size 8, enabled
    bar   [14] = type I/O Port, range 32, base 0x3084, size 4, enabled
    bar   [18] = type I/O Port, range 32, base 0x3060, size 8, enabled
    bar   [1c] = type I/O Port, range 32, base 0x3080, size 4, enabled
    bar   [20] = type I/O Port, range 32, base 0x3020, size 32, enabled
    bar   [24] = type Memory, range 32, base 0x91f10000, size 2048, enabled
    cap 05[80] = MSI supports 1 message enabled with 1 message
    cap 01[70] = powerspec 3  supports D0 D3  current D0
    cap 12[a8] = SATA Index-Data Pair

mfi0@pci0:1:0:0:	class=0x010400 card=0x1f491028 chip=0x005d1000 rev=0x02 hdr=0x00
    vendor     = 'LSI Logic / Symbios Logic'
    device     = 'MegaRAID SAS-3 3108 [Invader]'
    class      = mass storage
    subclass   = RAID
    bar   [10] = type I/O Port, range 32, base 0x2000, size 256, enabled
    bar   [14] = type Memory, range 64, base 0x91e00000, size 65536, enabled
    bar   [1c] = type Memory, range 64, base 0x91d00000, size 1048576, enabled
    cap 01[50] = powerspec 3  supports D0 D1 D2 D3  current D0
    cap 10[68] = PCI-Express 2 endpoint max data 256(4096) FLR RO NS
                 link x8(x8) speed 8.0(8.0) ASPM disabled(L0s)
    cap 03[d0] = VPD
    cap 05[a8] = MSI supports 1 message, 64 bit, vector masks enabled with 1 message
    cap 11[c0] = MSI-X supports 97 messages
                 Table in map 0x14[0xe000], PBA in map 0x14[0xf000]
    ecap 0001[100] = AER 2 0 fatal 0 non-fatal 1 corrected
    ecap 0019[1e0] = PCIe Sec 1 lane errors 0
    ecap 0004[1c0] = Power Budgeting 1
    ecap 000e[148] = ARI 1

nvme0@pci0:5:0:0:	class=0x010802 card=0x50121987 chip=0x50121987 rev=0x01 hdr=0x00
    vendor     = 'Phison Electronics Corporation'
    device     = 'E12 NVMe Controller'
    class      = mass storage
    subclass   = NVM
    bar   [10] = type Memory, range 64, base 0x91c00000, size 16384, enabled
    cap 10[80] = PCI-Express 2 endpoint max data 256(256) FLR RO NS
                 link x4(x4) speed 8.0(8.0) ASPM disabled(L1)
    cap 11[d0] = MSI-X supports 9 messages, enabled
                 Table in map 0x10[0x2000], PBA in map 0x10[0x3000]
    cap 05[e0] = MSI supports 8 messages, 64 bit 
    cap 01[f8] = powerspec 3  supports D0 D3  current D0
    ecap 0018[100] = LTR 1
    ecap 001e[110] = unknown 1
    ecap 000e[128] = ARI 1
    ecap 0001[200] = AER 2 0 fatal 0 non-fatal 1 corrected
    ecap 0019[300] = PCIe Sec 1 lane errors 0

pcib7@pci0:7:0:0:	class=0x060400 card=0x001d1912 chip=0x001d1912 rev=0x00 hdr=0x01
    vendor     = 'Renesas Technology Corp.'
    device     = 'SH7758 PCIe Switch [PS]'
    class      = bridge
    subclass   = PCI-PCI
    cap 01[40] = powerspec 3  supports D0 D3  current D0
    cap 05[50] = MSI supports 1 message, 64 bit 
    cap 10[70] = PCI-Express 2 upstream port max data 128(128) RO NS
                 link x1(x1) speed 2.5(2.5) ASPM disabled(L0s)
    cap 0d[b0] = PCI Bridge card=0x001d1912
    ecap 0001[100] = AER 1 0 fatal 0 non-fatal 0 corrected

pcib8@pci0:8:0:0:	class=0x060400 card=0x001d1912 chip=0x001d1912 rev=0x00 hdr=0x01
    vendor     = 'Renesas Technology Corp.'
    device     = 'SH7758 PCIe Switch [PS]'
    class      = bridge
    subclass   = PCI-PCI
    cap 01[40] = powerspec 3  supports D0 D3  current D0
    cap 05[50] = MSI supports 1 message, 64 bit 
    cap 10[70] = PCI-Express 2 downstream port max data 128(128) RO NS
                 link x1(x1) speed 2.5(2.5)
    cap 0d[b0] = PCI Bridge card=0x001d1912
    ecap 0001[100] = AER 1 0 fatal 0 non-fatal 1 corrected

pcib9@pci0:9:0:0:	class=0x060400 card=0x001a1912 chip=0x001a1912 rev=0x00 hdr=0x01
    vendor     = 'Renesas Technology Corp.'
    device     = 'SH7758 PCIe-PCI Bridge [PPB]'
    class      = bridge
    subclass   = PCI-PCI
    cap 01[40] = powerspec 3  supports D0 D3  current D0
    cap 05[50] = MSI supports 1 message, 64 bit 
    cap 10[70] = PCI-Express 2 PCI bridge max data 128(128) RO NS
                 link x1(x1) speed 2.5(2.5)
    cap 0d[b0] = PCI Bridge card=0x001a1912
    ecap 0001[100] = AER 1 0 fatal 0 non-fatal 0 corrected

vgapci0@pci0:10:0:0:	class=0x030000 card=0x06391028 chip=0x0534102b rev=0x01 hdr=0x00
    vendor     = 'Matrox Electronics Systems Ltd.'
    device     = 'G200eR2'
    class      = display
    subclass   = VGA
    bar   [10] = type Prefetchable Memory, range 32, base 0x90000000, size 16777216, enabled
    bar   [14] = type Memory, range 32, base 0x91800000, size 16384, enabled
    bar   [18] = type Memory, range 32, base 0x91000000, size 8388608, enabled
    cap 01[dc] = powerspec 1  supports D0 D3  current D0

bge0@pci0:2:0:0:	class=0x020000 card=0x06391028 chip=0x165f14e4 rev=0x00 hdr=0x00
    vendor     = 'Broadcom Inc. and subsidiaries'
    device     = 'NetXtreme BCM5720 2-port Gigabit Ethernet PCIe'
    class      = network
    subclass   = ethernet
    bar   [10] = type Prefetchable Memory, range 64, base 0x91a30000, size 65536, enabled
    bar   [18] = type Prefetchable Memory, range 64, base 0x91a40000, size 65536, enabled
    bar   [20] = type Prefetchable Memory, range 64, base 0x91a50000, size 65536, enabled
    cap 01[48] = powerspec 3  supports D0 D3  current D0
    cap 03[50] = VPD
    cap 05[58] = MSI supports 8 messages, 64 bit enabled with 1 message
    cap 11[a0] = MSI-X supports 17 messages
                 Table in map 0x20[0x0], PBA in map 0x20[0x1000]
    cap 10[ac] = PCI-Express 2 endpoint max data 128(256) FLR
                 link x1(x2) speed 5.0(5.0) ASPM disabled(L0s/L1)
    ecap 0001[100] = AER 1 0 fatal 0 non-fatal 1 corrected
    ecap 0003[13c] = Serial 1 000044a8423c16fe
    ecap 0004[150] = Power Budgeting 1
    ecap 0002[160] = VC 1 max VC0

bge1@pci0:2:0:1:	class=0x020000 card=0x06391028 chip=0x165f14e4 rev=0x00 hdr=0x00
    vendor     = 'Broadcom Inc. and subsidiaries'
    device     = 'NetXtreme BCM5720 2-port Gigabit Ethernet PCIe'
    class      = network
    subclass   = ethernet
    bar   [10] = type Prefetchable Memory, range 64, base 0x91a00000, size 65536, enabled
    bar   [18] = type Prefetchable Memory, range 64, base 0x91a10000, size 65536, enabled
    bar   [20] = type Prefetchable Memory, range 64, base 0x91a20000, size 65536, enabled
    cap 01[48] = powerspec 3  supports D0 D3  current D0
    cap 03[50] = VPD
    cap 05[58] = MSI supports 8 messages, 64 bit enabled with 1 message
    cap 11[a0] = MSI-X supports 17 messages
                 Table in map 0x20[0x0], PBA in map 0x20[0x1000]
    cap 10[ac] = PCI-Express 2 endpoint max data 128(256) FLR
                 link x1(x2) speed 5.0(5.0) ASPM disabled(L0s/L1)
    ecap 0001[100] = AER 1 0 fatal 0 non-fatal 1 corrected
    ecap 0003[13c] = Serial 1 000044a8423c16ff
    ecap 0004[150] = Power Budgeting 1
    ecap 0002[160] = VC 1 max VC0

bge2@pci0:3:0:0:	class=0x020000 card=0x06391028 chip=0x165f14e4 rev=0x00 hdr=0x00
    vendor     = 'Broadcom Inc. and subsidiaries'
    device     = 'NetXtreme BCM5720 2-port Gigabit Ethernet PCIe'
    class      = network
    subclass   = ethernet
    bar   [10] = type Prefetchable Memory, range 64, base 0x91b30000, size 65536, enabled
    bar   [18] = type Prefetchable Memory, range 64, base 0x91b40000, size 65536, enabled
    bar   [20] = type Prefetchable Memory, range 64, base 0x91b50000, size 65536, enabled
    cap 01[48] = powerspec 3  supports D0 D3  current D0
    cap 03[50] = VPD
    cap 05[58] = MSI supports 8 messages, 64 bit enabled with 1 message
    cap 11[a0] = MSI-X supports 17 messages
                 Table in map 0x20[0x0], PBA in map 0x20[0x1000]
    cap 10[ac] = PCI-Express 2 endpoint max data 128(256) FLR
                 link x1(x2) speed 5.0(5.0) ASPM disabled(L0s/L1)
    ecap 0001[100] = AER 1 0 fatal 0 non-fatal 1 corrected
    ecap 0003[13c] = Serial 1 000044a8423c1700
    ecap 0004[150] = Power Budgeting 1
    ecap 0002[160] = VC 1 max VC0

bge3@pci0:3:0:1:	class=0x020000 card=0x06391028 chip=0x165f14e4 rev=0x00 hdr=0x00
    vendor     = 'Broadcom Inc. and subsidiaries'
    device     = 'NetXtreme BCM5720 2-port Gigabit Ethernet PCIe'
    class      = network
    subclass   = ethernet
    bar   [10] = type Prefetchable Memory, range 64, base 0x91b00000, size 65536, enabled
    bar   [18] = type Prefetchable Memory, range 64, base 0x91b10000, size 65536, enabled
    bar   [20] = type Prefetchable Memory, range 64, base 0x91b20000, size 65536, enabled
    cap 01[48] = powerspec 3  supports D0 D3  current D0
    cap 03[50] = VPD
    cap 05[58] = MSI supports 8 messages, 64 bit enabled with 1 message
    cap 11[a0] = MSI-X supports 17 messages
                 Table in map 0x20[0x0], PBA in map 0x20[0x1000]
    cap 10[ac] = PCI-Express 2 endpoint max data 128(256) FLR
                 link x1(x2) speed 5.0(5.0) ASPM disabled(L0s/L1)
    ecap 0001[100] = AER 1 0 fatal 0 non-fatal 1 corrected
    ecap 0003[13c] = Serial 1 000044a8423c1701
    ecap 0004[150] = Power Budgeting 1
    ecap 0002[160] = VC 1 max VC0
