hostb0@pci0:0:0:0:	class=0x060000 card=0x22128086 chip=0x0f008086 rev=0x0e hdr=0x00
    vendor     = 'Intel Corporation'
    device     = 'Atom Processor Z36xxx/Z37xxx Series SoC Transaction Register'
    class      = bridge
    subclass   = HOST-PCI

vgapci0@pci0:0:2:0:	class=0x030000 card=0x22128086 chip=0x0f318086 rev=0x0e hdr=0x00
    vendor     = 'Intel Corporation'
    device     = 'Atom Processor Z36xxx/Z37xxx Series Graphics & Display'
    class      = display
    subclass   = VGA
    bar   [10] = type Memory, range 32, base 0x90000000, size 4194304, enabled
    bar   [18] = type Prefetchable Memory, range 32, base 0x80000000, size 268435456, enabled
    bar   [20] = type I/O Port, range 32, base 0xe080, size 8, enabled
    cap 01[d0] = powerspec 2  supports D0 D3  current D0
    cap 05[90] = MSI supports 1 message 
    cap 09[b0] = vendor (length 7) Intel cap 0 version 1

sdhci_pci0@pci0:0:17:0:	class=0x080501 card=0x0f158086 chip=0x0f158086 rev=0x0e hdr=0x00
    vendor     = 'Intel Corporation'
    device     = 'Atom Processor Z36xxx/Z37xxx Series SDIO Controller'
    class      = base peripheral
    subclass   = SD host controller
    bar   [10] = type Memory, range 32, base 0x9083e000, size 4096, enabled
    bar   [14] = type Memory, range 32, base 0x9083d000, size 4096, enabled
    cap 01[80] = powerspec 3  supports D0 D3  current D0

sdhci_pci1@pci0:0:18:0:	class=0x080501 card=0x0f168086 chip=0x0f168086 rev=0x0e hdr=0x00
    vendor     = 'Intel Corporation'
    device     = 'Atom Processor Z36xxx/Z37xxx Series SDIO Controller'
    class      = base peripheral
    subclass   = SD host controller
    bar   [10] = type Memory, range 32, base 0x9083c000, size 4096, enabled
    bar   [14] = type Memory, range 32, base 0x9083b000, size 4096, enabled
    cap 01[80] = powerspec 3  supports D0 D3  current D0

ahci0@pci0:0:19:0:	class=0x010601 card=0x0f238086 chip=0x0f238086 rev=0x0e hdr=0x00
    vendor     = 'Intel Corporation'
    device     = 'Atom Processor E3800 Series SATA AHCI Controller'
    class      = mass storage
    subclass   = SATA
    bar   [10] = type I/O Port, range 32, base 0xe070, size 8, enabled
    bar   [14] = type I/O Port, range 32, base 0xe060, size 4, enabled
    bar   [18] = type I/O Port, range 32, base 0xe050, size 8, enabled
    bar   [1c] = type I/O Port, range 32, base 0xe040, size 4, enabled
    bar   [20] = type I/O Port, range 32, base 0xe020, size 32, enabled
    bar   [24] = type Memory, range 32, base 0x9083a000, size 2048, enabled
    cap 05[80] = MSI supports 1 message enabled with 1 message
    cap 01[70] = powerspec 3  supports D0 D3  current D0
    cap 12[a8] = SATA Index-Data Pair

xhci0@pci0:0:20:0:	class=0x0c0330 card=0x0f358086 chip=0x0f358086 rev=0x0e hdr=0x00
    vendor     = 'Intel Corporation'
    device     = 'Atom Processor Z36xxx/Z37xxx, Celeron N2000 Series USB xHCI'
    class      = serial bus
    subclass   = USB
    bar   [10] = type Memory, range 64, base 0x90800000, size 65536, enabled
    cap 01[70] = powerspec 2  supports D0 D3  current D0
    cap 05[80] = MSI supports 8 messages, 64 bit enabled with 1 message

sdhci_pci2@pci0:0:23:0:	class=0x080501 card=0x00000000 chip=0x0f508086 rev=0x0e hdr=0x00
    vendor     = 'Intel Corporation'
    device     = 'Atom Processor E3800 Series eMMC 4.5 Controller'
    class      = base peripheral
    subclass   = SD host controller
    bar   [10] = type Memory, range 32, base 0x90839000, size 4096, enabled
    bar   [14] = type Memory, range 32, base 0x90838000, size 4096, enabled
    cap 01[80] = powerspec 3  supports D0 D3  current D0

none0@pci0:0:24:0:	class=0x080102 card=0x0f408086 chip=0x0f408086 rev=0x0e hdr=0x00
    vendor     = 'Intel Corporation'
    device     = 'Atom Processor Z36xxx/Z37xxx Series LPIO2 DMA Controller'
    class      = base peripheral
    subclass   = DMA controller
    bar   [10] = type Memory, range 32, base 0x90818000, size 16384, enabled
    bar   [14] = type Memory, range 32, base 0x90837000, size 4096, enabled
    cap 01[80] = powerspec 3  supports D0 D3  current D0

none1@pci0:0:24:1:	class=0x0c8000 card=0x0f418086 chip=0x0f418086 rev=0x0e hdr=0x00
    vendor     = 'Intel Corporation'
    device     = 'Atom Processor Z36xxx/Z37xxx Series LPIO2 I2C Controller'
    class      = serial bus
    bar   [10] = type Memory, range 32, base 0x90836000, size 4096, enabled
    bar   [14] = type Memory, range 32, base 0x90835000, size 4096, enabled
    cap 01[80] = powerspec 3  supports D0 D3  current D0

none2@pci0:0:24:2:	class=0x0c8000 card=0x0f428086 chip=0x0f428086 rev=0x0e hdr=0x00
    vendor     = 'Intel Corporation'
    device     = 'Atom Processor Z36xxx/Z37xxx Series LPIO2 I2C Controller'
    class      = serial bus
    bar   [10] = type Memory, range 32, base 0x90834000, size 4096, enabled
    bar   [14] = type Memory, range 32, base 0x90833000, size 4096, enabled
    cap 01[80] = powerspec 3  supports D0 D3  current D0

none3@pci0:0:24:3:	class=0x0c8000 card=0x0f438086 chip=0x0f438086 rev=0x0e hdr=0x00
    vendor     = 'Intel Corporation'
    device     = 'Atom Processor Z36xxx/Z37xxx Series LPIO2 I2C Controller'
    class      = serial bus
    bar   [10] = type Memory, range 32, base 0x90832000, size 4096, enabled
    bar   [14] = type Memory, range 32, base 0x90831000, size 4096, enabled
    cap 01[80] = powerspec 3  supports D0 D3  current D0

none4@pci0:0:24:4:	class=0x0c8000 card=0x0f448086 chip=0x0f448086 rev=0x0e hdr=0x00
    vendor     = 'Intel Corporation'
    device     = 'Atom Processor Z36xxx/Z37xxx Series LPIO2 I2C Controller'
    class      = serial bus
    bar   [10] = type Memory, range 32, base 0x90830000, size 4096, enabled
    bar   [14] = type Memory, range 32, base 0x9082f000, size 4096, enabled
    cap 01[80] = powerspec 3  supports D0 D3  current D0

none5@pci0:0:24:5:	class=0x0c8000 card=0x0f458086 chip=0x0f458086 rev=0x0e hdr=0x00
    vendor     = 'Intel Corporation'
    device     = 'Atom Processor Z36xxx/Z37xxx Series LPIO2 I2C Controller'
    class      = serial bus
    bar   [10] = type Memory, range 32, base 0x9082e000, size 4096, enabled
    bar   [14] = type Memory, range 32, base 0x9082d000, size 4096, enabled
    cap 01[80] = powerspec 3  supports D0 D3  current D0

none6@pci0:0:24:6:	class=0x0c8000 card=0x0f468086 chip=0x0f468086 rev=0x0e hdr=0x00
    vendor     = 'Intel Corporation'
    device     = 'Atom Processor Z36xxx/Z37xxx Series LPIO2 I2C Controller'
    class      = serial bus
    bar   [10] = type Memory, range 32, base 0x9082c000, size 4096, enabled
    bar   [14] = type Memory, range 32, base 0x9082b000, size 4096, enabled
    cap 01[80] = powerspec 3  supports D0 D3  current D0

none7@pci0:0:24:7:	class=0x0c8000 card=0x0f478086 chip=0x0f478086 rev=0x0e hdr=0x00
    vendor     = 'Intel Corporation'
    device     = 'Atom Processor Z36xxx/Z37xxx Series LPIO2 I2C Controller'
    class      = serial bus
    bar   [10] = type Memory, range 32, base 0x9082a000, size 4096, enabled
    bar   [14] = type Memory, range 32, base 0x90829000, size 4096, enabled
    cap 01[80] = powerspec 3  supports D0 D3  current D0

hdac0@pci0:0:27:0:	class=0x040300 card=0x72708086 chip=0x0f048086 rev=0x0e hdr=0x00
    vendor     = 'Intel Corporation'
    device     = 'Atom Processor Z36xxx/Z37xxx Series High Definition Audio Controller'
    class      = multimedia
    subclass   = HDA
    bar   [10] = type Memory, range 64, base 0x90814000, size 16384, enabled
    cap 01[50] = powerspec 2  supports D0 D3  current D0
    cap 05[60] = MSI supports 1 message, 64 bit enabled with 1 message

pcib1@pci0:0:28:0:	class=0x060400 card=0x0f488086 chip=0x0f488086 rev=0x0e hdr=0x01
    vendor     = 'Intel Corporation'
    device     = 'Atom Processor E3800 Series PCI Express Root Port 1'
    class      = bridge
    subclass   = PCI-PCI
    cap 10[40] = PCI-Express 2 root port max data 128(128)
                 link x1(x1) speed 2.5(5.0) ASPM L1(L0s/L1)
                 slot 0 power limit 100 mW HotPlug(present) surprise
    cap 05[80] = MSI supports 1 message 
    cap 0d[90] = PCI Bridge card=0x0f488086
    cap 01[a0] = powerspec 3  supports D0 D3  current D0

pcib2@pci0:0:28:1:	class=0x060400 card=0x0f4a8086 chip=0x0f4a8086 rev=0x0e hdr=0x01
    vendor     = 'Intel Corporation'
    device     = 'Atom Processor E3800 Series PCI Express Root Port 2'
    class      = bridge
    subclass   = PCI-PCI
    cap 10[40] = PCI-Express 2 root port max data 128(128)
                 link x1(x1) speed 2.5(5.0) ASPM L1(L0s/L1)
                 slot 1 power limit 100 mW HotPlug(present) surprise
    cap 05[80] = MSI supports 1 message 
    cap 0d[90] = PCI Bridge card=0x0f4a8086
    cap 01[a0] = powerspec 3  supports D0 D3  current D0

pcib3@pci0:0:28:2:	class=0x060400 card=0x0f4c8086 chip=0x0f4c8086 rev=0x0e hdr=0x01
    vendor     = 'Intel Corporation'
    device     = 'Atom Processor E3800 Series PCI Express Root Port 3'
    class      = bridge
    subclass   = PCI-PCI
    cap 10[40] = PCI-Express 2 root port max data 128(128)
                 link x1(x1) speed 2.5(5.0) ASPM L1(L0s/L1)
                 slot 2 power limit 100 mW HotPlug(present) surprise
    cap 05[80] = MSI supports 1 message 
    cap 0d[90] = PCI Bridge card=0x0f4c8086
    cap 01[a0] = powerspec 3  supports D0 D3  current D0

pcib4@pci0:0:28:3:	class=0x060400 card=0x0f4e8086 chip=0x0f4e8086 rev=0x0e hdr=0x01
    vendor     = 'Intel Corporation'
    device     = 'Atom Processor E3800 Series PCI Express Root Port 4'
    class      = bridge
    subclass   = PCI-PCI
    cap 10[40] = PCI-Express 2 root port max data 128(128)
                 link x1(x1) speed 2.5(5.0) ASPM L1(L0s/L1)
                 slot 3 power limit 100 mW HotPlug(present) surprise
    cap 05[80] = MSI supports 1 message 
    cap 0d[90] = PCI Bridge card=0x0f4e8086
    cap 01[a0] = powerspec 3  supports D0 D3  current D0

ehci0@pci0:0:29:0:	class=0x0c0320 card=0x0f348086 chip=0x0f348086 rev=0x0e hdr=0x00
    vendor     = 'Intel Corporation'
    device     = 'Atom Processor Z36xxx/Z37xxx Series USB EHCI'
    class      = serial bus
    subclass   = USB
    bar   [10] = type Memory, range 32, base 0x90828000, size 1024, enabled
    cap 01[50] = powerspec 3  supports D0 D3  current D0
    cap 0a[58] = EHCI Debug Port at offset 0xa0 in map 0x14
    cap 13[98] = PCI Advanced Features: FLR TP

none8@pci0:0:30:0:	class=0x080102 card=0x0f068086 chip=0x0f068086 rev=0x0e hdr=0x00
    vendor     = 'Intel Corporation'
    device     = 'Atom Processor Z36xxx/Z37xxx Series LPIO1 DMA Controller'
    class      = base peripheral
    subclass   = DMA controller
    bar   [10] = type Memory, range 32, base 0x90810000, size 16384, enabled
    bar   [14] = type Memory, range 32, base 0x90827000, size 4096, enabled
    cap 01[80] = powerspec 3  supports D0 D3  current D0

none9@pci0:0:30:1:	class=0x0c8000 card=0x0f088086 chip=0x0f088086 rev=0x0e hdr=0x00
    vendor     = 'Intel Corporation'
    device     = 'Atom Processor Z36xxx/Z37xxx Series LPIO1 PWM Controller'
    class      = serial bus
    bar   [10] = type Memory, range 32, base 0x90826000, size 4096, enabled
    bar   [14] = type Memory, range 32, base 0x90825000, size 4096, enabled
    cap 01[80] = powerspec 3  supports D0 D3  current D0

none10@pci0:0:30:2:	class=0x0c8000 card=0x0f098086 chip=0x0f098086 rev=0x0e hdr=0x00
    vendor     = 'Intel Corporation'
    device     = 'Atom Processor Z36xxx/Z37xxx Series LPIO1 PWM Controller'
    class      = serial bus
    bar   [10] = type Memory, range 32, base 0x90824000, size 4096, enabled
    bar   [14] = type Memory, range 32, base 0x90823000, size 4096, enabled
    cap 01[80] = powerspec 3  supports D0 D3  current D0

uart2@pci0:0:30:3:	class=0x078000 card=0x0f0a8086 chip=0x0f0a8086 rev=0x0e hdr=0x00
    vendor     = 'Intel Corporation'
    device     = 'Atom Processor Z36xxx/Z37xxx Series LPIO1 HSUART Controller'
    class      = simple comms
    bar   [10] = type Memory, range 32, base 0x90822000, size 4096, enabled
    bar   [14] = type Memory, range 32, base 0x90821000, size 4096, enabled
    cap 01[80] = powerspec 3  supports D0 D3  current D0

uart3@pci0:0:30:4:	class=0x078000 card=0x0f0c8086 chip=0x0f0c8086 rev=0x0e hdr=0x00
    vendor     = 'Intel Corporation'
    device     = 'Atom Processor Z36xxx/Z37xxx Series LPIO1 HSUART Controller'
    class      = simple comms
    bar   [10] = type Memory, range 32, base 0x90820000, size 4096, enabled
    bar   [14] = type Memory, range 32, base 0x9081f000, size 4096, enabled
    cap 01[80] = powerspec 3  supports D0 D3  current D0

none11@pci0:0:30:5:	class=0x0c8000 card=0x0f0e8086 chip=0x0f0e8086 rev=0x0e hdr=0x00
    vendor     = 'Intel Corporation'
    device     = 'Atom Processor Z36xxx/Z37xxx Series LPIO1 SPI Controller'
    class      = serial bus
    bar   [10] = type Memory, range 32, base 0x9081e000, size 4096, enabled
    bar   [14] = type Memory, range 32, base 0x9081d000, size 4096, enabled
    cap 01[80] = powerspec 3  supports D0 D3  current D0

isab0@pci0:0:31:0:	class=0x060100 card=0x0f1c8086 chip=0x0f1c8086 rev=0x0e hdr=0x00
    vendor     = 'Intel Corporation'
    device     = 'Atom Processor Z36xxx/Z37xxx Series Power Control Unit'
    class      = bridge
    subclass   = PCI-ISA
    cap 09[e0] = vendor (length 12) Intel cap 1 version 0
		 features: 4 PCI-e x1 slots

none12@pci0:0:31:3:	class=0x0c0500 card=0x0f128086 chip=0x0f128086 rev=0x0e hdr=0x00
    vendor     = 'Intel Corporation'
    device     = 'Atom Processor E3800 Series SMBus Controller'
    class      = serial bus
    subclass   = SMBus
    bar   [10] = type Memory, range 32, base 0x9081c000, size 32, enabled
    bar   [20] = type I/O Port, range 32, base 0xe000, size 32, enabled
    cap 01[50] = powerspec 3  supports D0 D3  current D0

igb0@pci0:1:0:0:	class=0x020000 card=0x00008086 chip=0x15398086 rev=0x03 hdr=0x00
    vendor     = 'Intel Corporation'
    device     = 'I211 Gigabit Network Connection'
    class      = network
    subclass   = ethernet
    bar   [10] = type Memory, range 32, base 0x90700000, size 131072, enabled
    bar   [18] = type I/O Port, range 32, base 0xd000, size 32, enabled
    bar   [1c] = type Memory, range 32, base 0x90720000, size 16384, enabled
    cap 01[40] = powerspec 3  supports D0 D3  current D0
    cap 05[50] = MSI supports 1 message, 64 bit, vector masks 
    cap 11[70] = MSI-X supports 5 messages, enabled
                 Table in map 0x1c[0x0], PBA in map 0x1c[0x2000]
    cap 10[a0] = PCI-Express 2 endpoint max data 128(512) FLR NS
                 link x1(x1) speed 2.5(2.5) ASPM L1(L0s/L1)
    ecap 0001[100] = AER 2 0 fatal 0 non-fatal 0 corrected
    ecap 0003[140] = Serial 1 a03e6bffffa11365
    ecap 0017[1a0] = TPH Requester 1

igb1@pci0:2:0:0:	class=0x020000 card=0x00008086 chip=0x15398086 rev=0x03 hdr=0x00
    vendor     = 'Intel Corporation'
    device     = 'I211 Gigabit Network Connection'
    class      = network
    subclass   = ethernet
    bar   [10] = type Memory, range 32, base 0x90600000, size 131072, enabled
    bar   [18] = type I/O Port, range 32, base 0xc000, size 32, enabled
    bar   [1c] = type Memory, range 32, base 0x90620000, size 16384, enabled
    cap 01[40] = powerspec 3  supports D0 D3  current D0
    cap 05[50] = MSI supports 1 message, 64 bit, vector masks 
    cap 11[70] = MSI-X supports 5 messages, enabled
                 Table in map 0x1c[0x0], PBA in map 0x1c[0x2000]
    cap 10[a0] = PCI-Express 2 endpoint max data 128(512) FLR NS
                 link x1(x1) speed 2.5(2.5) ASPM L1(L0s/L1)
    ecap 0001[100] = AER 2 0 fatal 0 non-fatal 0 corrected
    ecap 0003[140] = Serial 1 a03e6bffffa11366
    ecap 0017[1a0] = TPH Requester 1

igb2@pci0:3:0:0:	class=0x020000 card=0x00008086 chip=0x15398086 rev=0x03 hdr=0x00
    vendor     = 'Intel Corporation'
    device     = 'I211 Gigabit Network Connection'
    class      = network
    subclass   = ethernet
    bar   [10] = type Memory, range 32, base 0x90500000, size 131072, enabled
    bar   [18] = type I/O Port, range 32, base 0xb000, size 32, enabled
    bar   [1c] = type Memory, range 32, base 0x90520000, size 16384, enabled
    cap 01[40] = powerspec 3  supports D0 D3  current D0
    cap 05[50] = MSI supports 1 message, 64 bit, vector masks 
    cap 11[70] = MSI-X supports 5 messages, enabled
                 Table in map 0x1c[0x0], PBA in map 0x1c[0x2000]
    cap 10[a0] = PCI-Express 2 endpoint max data 128(512) FLR NS
                 link x1(x1) speed 2.5(2.5) ASPM L1(L0s/L1)
    ecap 0001[100] = AER 2 0 fatal 0 non-fatal 0 corrected
    ecap 0003[140] = Serial 1 a03e6bffffa11367
    ecap 0017[1a0] = TPH Requester 1

igb3@pci0:4:0:0:	class=0x020000 card=0x00008086 chip=0x15398086 rev=0x03 hdr=0x00
    vendor     = 'Intel Corporation'
    device     = 'I211 Gigabit Network Connection'
    class      = network
    subclass   = ethernet
    bar   [10] = type Memory, range 32, base 0x90400000, size 131072, enabled
    bar   [18] = type I/O Port, range 32, base 0xa000, size 32, enabled
    bar   [1c] = type Memory, range 32, base 0x90420000, size 16384, enabled
    cap 01[40] = powerspec 3  supports D0 D3  current D0
    cap 05[50] = MSI supports 1 message, 64 bit, vector masks 
    cap 11[70] = MSI-X supports 5 messages, enabled
                 Table in map 0x1c[0x0], PBA in map 0x1c[0x2000]
    cap 10[a0] = PCI-Express 2 endpoint max data 128(512) FLR NS
                 link x1(x1) speed 2.5(2.5) ASPM L1(L0s/L1)
    ecap 0001[100] = AER 2 0 fatal 0 non-fatal 0 corrected
    ecap 0003[140] = Serial 1 a03e6bffffa11368
    ecap 0017[1a0] = TPH Requester 1
