hostb0@pci0:0:0:0:	class=0x060000 card=0x304b103c chip=0x00408086 rev=0x02 hdr=0x00
    vendor     = 'Intel Corporation'
    device     = 'Core Processor DRAM Controller'
    class      = bridge
    subclass   = HOST-PCI
    cap 09[e0] = vendor (length 12) Intel cap 0 version 1

vgapci0@pci0:0:2:0:	class=0x030000 card=0x304b103c chip=0x00428086 rev=0x02 hdr=0x00
    vendor     = 'Intel Corporation'
    device     = 'Core Processor Integrated Graphics Controller'
    class      = display
    subclass   = VGA
    bar   [10] = type Memory, range 64, base 0xf0000000, size 4194304, enabled
    bar   [18] = type Prefetchable Memory, range 64, base 0xe0000000, size 268435456, enabled
    bar   [20] = type I/O Port, range 32, base 0x1170, size 8, enabled
    cap 05[90] = MSI supports 1 message 
    cap 01[d0] = powerspec 2  supports D0 D3  current D0
    cap 13[a4] = PCI Advanced Features: FLR TP

none0@pci0:0:22:0:	class=0x078000 card=0x304b103c chip=0x3b648086 rev=0x06 hdr=0x00
    vendor     = 'Intel Corporation'
    device     = '5 Series/3400 Series Chipset HECI Controller'
    class      = simple comms
    bar   [10] = type Memory, range 64, base 0xf0427100, size 16, enabled
    cap 01[50] = powerspec 3  supports D0 D3  current D0
    cap 05[8c] = MSI supports 1 message, 64 bit 

uart2@pci0:0:22:3:	class=0x070002 card=0x304b103c chip=0x3b678086 rev=0x06 hdr=0x00
    vendor     = 'Intel Corporation'
    device     = '5 Series/3400 Series Chipset KT Controller'
    class      = simple comms
    subclass   = UART
    bar   [10] = type I/O Port, range 32, base 0x1188, size 8, enabled
    bar   [14] = type Memory, range 32, base 0xf0424000, size 4096, enabled
    cap 01[c8] = powerspec 3  supports D0 D3  current D0
    cap 05[d0] = MSI supports 1 message, 64 bit 

em0@pci0:0:25:0:	class=0x020000 card=0x304b103c chip=0x10ef8086 rev=0x05 hdr=0x00
    vendor     = 'Intel Corporation'
    device     = '82578DM Gigabit Network Connection'
    class      = network
    subclass   = ethernet
    bar   [10] = type Memory, range 32, base 0xf0400000, size 131072, enabled
    bar   [14] = type Memory, range 32, base 0xf0425000, size 4096, enabled
    bar   [18] = type I/O Port, range 32, base 0x1100, size 32, enabled
    cap 01[c8] = powerspec 2  supports D0 D3  current D0
    cap 05[d0] = MSI supports 1 message, 64 bit enabled with 1 message
    cap 13[e0] = PCI Advanced Features: FLR TP

ehci0@pci0:0:26:0:	class=0x0c0320 card=0x304b103c chip=0x3b3c8086 rev=0x05 hdr=0x00
    vendor     = 'Intel Corporation'
    device     = '5 Series/3400 Series Chipset USB2 Enhanced Host Controller'
    class      = serial bus
    subclass   = USB
    bar   [10] = type Memory, range 32, base 0xf0426800, size 1024, enabled
    cap 01[50] = powerspec 2  supports D0 D3  current D0
    cap 0a[58] = EHCI Debug Port at offset 0xa0 in map 0x14
    cap 13[98] = PCI Advanced Features: FLR TP

hdac0@pci0:0:27:0:	class=0x040300 card=0x304b103c chip=0x3b568086 rev=0x05 hdr=0x00
    vendor     = 'Intel Corporation'
    device     = '5 Series/3400 Series Chipset High Definition Audio'
    class      = multimedia
    subclass   = HDA
    bar   [10] = type Memory, range 64, base 0xf0420000, size 16384, enabled
    cap 01[50] = powerspec 2  supports D0 D3  current D0
    cap 05[60] = MSI supports 1 message, 64 bit enabled with 1 message
    cap 10[70] = PCI-Express 1 root endpoint max data 128(128) FLR link x0(x0)
    ecap 0002[100] = VC 1 max VC1
    ecap 0005[130] = Root Complex Link Declaration 1

pcib1@pci0:0:28:0:	class=0x060400 card=0x304b103c chip=0x3b428086 rev=0x05 hdr=0x01
    vendor     = 'Intel Corporation'
    device     = '5 Series/3400 Series Chipset PCI Express Root Port 1'
    class      = bridge
    subclass   = PCI-PCI
    cap 10[40] = PCI-Express 2 root port slot max data 128(128) link x0(x4)
                 speed 0.0(2.5) ASPM disabled(L0s/L1)
    cap 05[80] = MSI supports 1 message 
    cap 0d[90] = PCI Bridge card=0x304b103c
    cap 01[a0] = powerspec 2  supports D0 D3  current D0

pcib2@pci0:0:28:4:	class=0x060400 card=0x304b103c chip=0x3b4a8086 rev=0x05 hdr=0x01
    vendor     = 'Intel Corporation'
    device     = '5 Series/3400 Series Chipset PCI Express Root Port 5'
    class      = bridge
    subclass   = PCI-PCI
    cap 10[40] = PCI-Express 2 root port slot max data 128(128) link x0(x1)
                 speed 0.0(2.5) ASPM disabled(L0s/L1)
    cap 05[80] = MSI supports 1 message 
    cap 0d[90] = PCI Bridge card=0x304b103c
    cap 01[a0] = powerspec 2  supports D0 D3  current D0

pcib3@pci0:0:28:6:	class=0x060400 card=0x304b103c chip=0x3b4e8086 rev=0x05 hdr=0x01
    vendor     = 'Intel Corporation'
    device     = '5 Series/3400 Series Chipset PCI Express Root Port 7'
    class      = bridge
    subclass   = PCI-PCI
    cap 10[40] = PCI-Express 2 root port slot max data 128(128) link x0(x1)
                 speed 0.0(2.5) ASPM disabled(L0s/L1)
    cap 05[80] = MSI supports 1 message 
    cap 0d[90] = PCI Bridge card=0x304b103c
    cap 01[a0] = powerspec 2  supports D0 D3  current D0

ehci1@pci0:0:29:0:	class=0x0c0320 card=0x304b103c chip=0x3b348086 rev=0x05 hdr=0x00
    vendor     = 'Intel Corporation'
    device     = '5 Series/3400 Series Chipset USB2 Enhanced Host Controller'
    class      = serial bus
    subclass   = USB
    bar   [10] = type Memory, range 32, base 0xf0426c00, size 1024, enabled
    cap 01[50] = powerspec 2  supports D0 D3  current D0
    cap 0a[58] = EHCI Debug Port at offset 0xa0 in map 0x14
    cap 13[98] = PCI Advanced Features: FLR TP

pcib4@pci0:0:30:0:	class=0x060401 card=0x304b103c chip=0x244e8086 rev=0xa5 hdr=0x01
    vendor     = 'Intel Corporation'
    device     = '82801 PCI Bridge'
    class      = bridge
    subclass   = PCI-PCI
    cap 0d[50] = PCI Bridge card=0x304b103c

isab0@pci0:0:31:0:	class=0x060100 card=0x304b103c chip=0x3b0a8086 rev=0x05 hdr=0x00
    vendor     = 'Intel Corporation'
    device     = 'Q57 Chipset LPC Interface Controller'
    class      = bridge
    subclass   = PCI-ISA
    cap 09[e0] = vendor (length 16) Intel cap 1 version 1

ahci0@pci0:0:31:2:	class=0x010601 card=0x304b103c chip=0x3b228086 rev=0x05 hdr=0x00
    vendor     = 'Intel Corporation'
    device     = '5 Series/3400 Series Chipset 6 port SATA AHCI Controller'
    class      = mass storage
    subclass   = SATA
    bar   [10] = type I/O Port, range 32, base 0x1190, size 8, enabled
    bar   [14] = type I/O Port, range 32, base 0x11a8, size 4, enabled
    bar   [18] = type I/O Port, range 32, base 0x1198, size 8, enabled
    bar   [1c] = type I/O Port, range 32, base 0x11ac, size 4, enabled
    bar   [20] = type I/O Port, range 32, base 0x1120, size 32, enabled
    bar   [24] = type Memory, range 32, base 0xf0426000, size 2048, enabled
    cap 05[80] = MSI supports 1 message enabled with 1 message
    cap 01[70] = powerspec 3  supports D0 D3  current D0
    cap 12[a8] = SATA Index-Data Pair
    cap 13[b0] = PCI Advanced Features: FLR TP
