hostb0@pci0:0:0:0:	class=0x060000 rev=0x03 hdr=0x00 vendor=0x8086 device=0x2e10 subvendor=0x103c subdevice=0x3034
    vendor     = 'Intel Corporation'
    device     = '4 Series Chipset DRAM Controller'
    class      = bridge
    subclass   = HOST-PCI
    cap 09[e0] = vendor (length 12) Intel cap 6 version 1

vgapci0@pci0:0:2:0:	class=0x030000 rev=0x03 hdr=0x00 vendor=0x8086 device=0x2e12 subvendor=0x103c subdevice=0x3034
    vendor     = 'Intel Corporation'
    device     = '4 Series Chipset Integrated Graphics Controller'
    class      = display
    subclass   = VGA
    bar   [10] = type Memory, range 64, base 0xf0000000, size 4194304, enabled
    bar   [18] = type Prefetchable Memory, range 64, base 0xe0000000, size 268435456, enabled
    bar   [20] = type I/O Port, range 32, base 0x2250, size 8, enabled
    cap 05[90] = MSI supports 1 message 
    cap 01[d0] = powerspec 2  supports D0 D3  current D0

vgapci1@pci0:0:2:1:	class=0x038000 rev=0x03 hdr=0x00 vendor=0x8086 device=0x2e13 subvendor=0x103c subdevice=0x3034
    vendor     = 'Intel Corporation'
    device     = '4 Series Chipset Integrated Graphics Controller'
    class      = display
    bar   [10] = type Memory, range 64, base 0xf0400000, size 1048576, enabled
    cap 01[d0] = powerspec 2  supports D0 D3  current D0

none0@pci0:0:3:0:	class=0x078000 rev=0x03 hdr=0x00 vendor=0x8086 device=0x2e14 subvendor=0x103c subdevice=0x3034
    vendor     = 'Intel Corporation'
    device     = '4 Series Chipset HECI Controller'
    class      = simple comms
    bar   [10] = type Memory, range 64, base 0xf0529000, size 16, enabled
    cap 01[50] = powerspec 3  supports D0 D3  current D0
    cap 05[8c] = MSI supports 1 message, 64 bit 

atapci0@pci0:0:3:2:	class=0x010185 rev=0x03 hdr=0x00 vendor=0x8086 device=0x2e16 subvendor=0x103c subdevice=0x3034
    vendor     = 'Intel Corporation'
    device     = '4 Series Chipset PT IDER Controller'
    class      = mass storage
    subclass   = ATA
    bar   [10] = type I/O Port, range 32, base 0x2258, size 8, enabled
    bar   [14] = type I/O Port, range 32, base 0x2290, size 4, enabled
    bar   [18] = type I/O Port, range 32, base 0x2260, size 8, enabled
    bar   [1c] = type I/O Port, range 32, base 0x2294, size 4, enabled
    bar   [20] = type I/O Port, range 32, base 0x2200, size 16, enabled
    cap 01[c8] = powerspec 3  supports D0 D3  current D0
    cap 05[d0] = MSI supports 1 message, 64 bit 

uart2@pci0:0:3:3:	class=0x070002 rev=0x03 hdr=0x00 vendor=0x8086 device=0x2e17 subvendor=0x103c subdevice=0x3034
    vendor     = 'Intel Corporation'
    device     = '4 Series Chipset Serial KT Controller'
    class      = simple comms
    subclass   = UART
    bar   [10] = type I/O Port, range 32, base 0x2268, size 8, enabled
    bar   [14] = type Memory, range 32, base 0xf0524000, size 4096, enabled
    cap 01[c8] = powerspec 3  supports D0 D3  current D0
    cap 05[d0] = MSI supports 1 message, 64 bit enabled with 1 message

em0@pci0:0:25:0:	class=0x020000 rev=0x02 hdr=0x00 vendor=0x8086 device=0x10de subvendor=0x103c subdevice=0x3034
    vendor     = 'Intel Corporation'
    device     = '82567LM-3 Gigabit Network Connection'
    class      = network
    subclass   = ethernet
    bar   [10] = type Memory, range 32, base 0xf0500000, size 131072, enabled
    bar   [14] = type Memory, range 32, base 0xf0525000, size 4096, enabled
    bar   [18] = type I/O Port, range 32, base 0x2100, size 32, enabled
    cap 01[c8] = powerspec 2  supports D0 D3  current D0
    cap 05[d0] = MSI supports 1 message, 64 bit enabled with 1 message
    cap 13[e0] = PCI Advanced Features: FLR TP

uhci0@pci0:0:26:0:	class=0x0c0300 rev=0x02 hdr=0x00 vendor=0x8086 device=0x3a67 subvendor=0x103c subdevice=0x3034
    vendor     = 'Intel Corporation'
    device     = '82801JD/DO (ICH10 Family) USB UHCI Controller'
    class      = serial bus
    subclass   = USB
    bar   [20] = type I/O Port, range 32, base 0x2120, size 32, enabled
    cap 13[50] = PCI Advanced Features: FLR TP

uhci1@pci0:0:26:1:	class=0x0c0300 rev=0x02 hdr=0x00 vendor=0x8086 device=0x3a68 subvendor=0x103c subdevice=0x3034
    vendor     = 'Intel Corporation'
    device     = '82801JD/DO (ICH10 Family) USB UHCI Controller'
    class      = serial bus
    subclass   = USB
    bar   [20] = type I/O Port, range 32, base 0x2140, size 32, enabled
    cap 13[50] = PCI Advanced Features: FLR TP

uhci2@pci0:0:26:2:	class=0x0c0300 rev=0x02 hdr=0x00 vendor=0x8086 device=0x3a69 subvendor=0x103c subdevice=0x3034
    vendor     = 'Intel Corporation'
    device     = '82801JD/DO (ICH10 Family) USB UHCI Controller'
    class      = serial bus
    subclass   = USB
    bar   [20] = type I/O Port, range 32, base 0x2160, size 32, enabled
    cap 13[50] = PCI Advanced Features: FLR TP

ehci0@pci0:0:26:7:	class=0x0c0320 rev=0x02 hdr=0x00 vendor=0x8086 device=0x3a6c subvendor=0x103c subdevice=0x3034
    vendor     = 'Intel Corporation'
    device     = '82801JD/DO (ICH10 Family) USB2 EHCI Controller'
    class      = serial bus
    subclass   = USB
    bar   [10] = type Memory, range 32, base 0xf0526000, size 1024, enabled
    cap 01[50] = powerspec 2  supports D0 D3  current D0
    cap 0a[58] = EHCI Debug Port at offset 0xa0 in map 0x14
    cap 13[98] = PCI Advanced Features: FLR TP

hdac0@pci0:0:27:0:	class=0x040300 rev=0x02 hdr=0x00 vendor=0x8086 device=0x3a6e subvendor=0x103c subdevice=0x3034
    vendor     = 'Intel Corporation'
    device     = '82801JD/DO (ICH10 Family) HD Audio Controller'
    class      = multimedia
    subclass   = HDA
    bar   [10] = type Memory, range 64, base 0xf0520000, size 16384, enabled
    cap 01[50] = powerspec 2  supports D0 D3  current D0
    cap 05[60] = MSI supports 1 message, 64 bit enabled with 1 message
    cap 10[70] = PCI-Express 1 root endpoint max data 128(128) FLR NS
                 max read 128
    ecap 0002[100] = VC 1 max VC1
    ecap 0005[130] = Root Complex Link Declaration 1

pcib1@pci0:0:28:0:	class=0x060400 rev=0x02 hdr=0x01 vendor=0x8086 device=0x3a70 subvendor=0x103c subdevice=0x3034
    vendor     = 'Intel Corporation'
    device     = '82801JD/DO (ICH10 Family) PCI Express Port 1'
    class      = bridge
    subclass   = PCI-PCI
    cap 10[40] = PCI-Express 2 root port max data 128(128)
                 max read 128
                 link x0(x4) speed 0.0(2.5) ASPM disabled(L0s/L1)
                 slot 2 power limit 10000 mW HotPlug(empty) surprise
    cap 05[80] = MSI supports 1 message 
    cap 0d[90] = PCI Bridge subvendor=0x103c subdevice=0x3034
    cap 01[a0] = powerspec 2  supports D0 D3  current D0
    ecap 0002[100] = VC 1 max VC0
    ecap 0005[180] = Root Complex Link Declaration 1

pcib2@pci0:0:28:4:	class=0x060400 rev=0x02 hdr=0x01 vendor=0x8086 device=0x3a78 subvendor=0x103c subdevice=0x3034
    vendor     = 'Intel Corporation'
    device     = '82801JD/DO (ICH10 Family) PCI Express Port 5'
    class      = bridge
    subclass   = PCI-PCI
    cap 10[40] = PCI-Express 2 root port max data 128(128)
                 max read 128
                 link x1(x1) speed 2.5(2.5) ASPM disabled(L0s/L1)
                 slot 0 power limit 0 mW HotPlug(present) surprise
    cap 05[80] = MSI supports 1 message 
    cap 0d[90] = PCI Bridge subvendor=0x103c subdevice=0x3034
    cap 01[a0] = powerspec 2  supports D0 D3  current D0
    ecap 0002[100] = VC 1 max VC0
    ecap 0005[180] = Root Complex Link Declaration 1

uhci3@pci0:0:29:0:	class=0x0c0300 rev=0x02 hdr=0x00 vendor=0x8086 device=0x3a64 subvendor=0x103c subdevice=0x3034
    vendor     = 'Intel Corporation'
    device     = '82801JD/DO (ICH10 Family) USB UHCI Controller'
    class      = serial bus
    subclass   = USB
    bar   [20] = type I/O Port, range 32, base 0x2180, size 32, enabled
    cap 13[50] = PCI Advanced Features: FLR TP

uhci4@pci0:0:29:1:	class=0x0c0300 rev=0x02 hdr=0x00 vendor=0x8086 device=0x3a65 subvendor=0x103c subdevice=0x3034
    vendor     = 'Intel Corporation'
    device     = '82801JD/DO (ICH10 Family) USB UHCI Controller'
    class      = serial bus
    subclass   = USB
    bar   [20] = type I/O Port, range 32, base 0x21a0, size 32, enabled
    cap 13[50] = PCI Advanced Features: FLR TP

uhci5@pci0:0:29:2:	class=0x0c0300 rev=0x02 hdr=0x00 vendor=0x8086 device=0x3a66 subvendor=0x103c subdevice=0x3034
    vendor     = 'Intel Corporation'
    device     = '82801JD/DO (ICH10 Family) USB UHCI Controller'
    class      = serial bus
    subclass   = USB
    bar   [20] = type I/O Port, range 32, base 0x21c0, size 32, enabled
    cap 13[50] = PCI Advanced Features: FLR TP

ehci1@pci0:0:29:7:	class=0x0c0320 rev=0x02 hdr=0x00 vendor=0x8086 device=0x3a6a subvendor=0x103c subdevice=0x3034
    vendor     = 'Intel Corporation'
    device     = '82801JD/DO (ICH10 Family) USB2 EHCI Controller'
    class      = serial bus
    subclass   = USB
    bar   [10] = type Memory, range 32, base 0xf0527000, size 1024, enabled
    cap 01[50] = powerspec 2  supports D0 D3  current D0
    cap 0a[58] = EHCI Debug Port at offset 0xa0 in map 0x14
    cap 13[98] = PCI Advanced Features: FLR TP

pcib3@pci0:0:30:0:	class=0x060401 rev=0xa2 hdr=0x01 vendor=0x8086 device=0x244e subvendor=0x103c subdevice=0x3034
    vendor     = 'Intel Corporation'
    device     = '82801 PCI Bridge'
    class      = bridge
    subclass   = PCI-PCI
    cap 0d[50] = PCI Bridge subvendor=0x103c subdevice=0x3034

isab0@pci0:0:31:0:	class=0x060100 rev=0x02 hdr=0x00 vendor=0x8086 device=0x3a14 subvendor=0x103c subdevice=0x3034
    vendor     = 'Intel Corporation'
    device     = '82801JDO (ICH10DO) LPC Interface Controller'
    class      = bridge
    subclass   = PCI-ISA
    cap 09[e0] = vendor (length 12) Intel cap 1 version 0
		 features: SATA RAID-5, 4 PCI-e x1 slots

atapci1@pci0:0:31:2:	class=0x01018a rev=0x02 hdr=0x00 vendor=0x8086 device=0x3a00 subvendor=0x103c subdevice=0x3034
    vendor     = 'Intel Corporation'
    device     = '82801JD/DO (ICH10 Family) 4-port SATA IDE Controller'
    class      = mass storage
    subclass   = ATA
    bar   [20] = type I/O Port, range 32, base 0x2210, size 16, enabled
    bar   [24] = type I/O Port, range 32, base 0x2220, size 16, enabled
    cap 01[70] = powerspec 3  supports D0 D3  current D0
    cap 13[b0] = PCI Advanced Features: FLR TP

atapci2@pci0:0:31:5:	class=0x010185 rev=0x02 hdr=0x00 vendor=0x8086 device=0x3a06 subvendor=0x103c subdevice=0x3034
    vendor     = 'Intel Corporation'
    device     = '82801JD/DO (ICH10 Family) 2-port SATA IDE Controller'
    class      = mass storage
    subclass   = ATA
    bar   [10] = type I/O Port, range 32, base 0x2280, size 8, enabled
    bar   [14] = type I/O Port, range 32, base 0x22a0, size 4, enabled
    bar   [18] = type I/O Port, range 32, base 0x2288, size 8, enabled
    bar   [1c] = type I/O Port, range 32, base 0x22a4, size 4, enabled
    bar   [20] = type I/O Port, range 32, base 0x2230, size 16, enabled
    bar   [24] = type I/O Port, range 32, base 0x2240, size 16, enabled
    cap 01[70] = powerspec 3  supports D0 D3  current D0
    cap 13[b0] = PCI Advanced Features: FLR TP

re0@pci0:48:0:0:	class=0x020000 rev=0x02 hdr=0x00 vendor=0x10ec device=0x8168 subvendor=0x10ec subdevice=0x0123
    vendor     = 'Realtek Semiconductor Co., Ltd.'
    device     = 'RTL8111/8168/8411 PCI Express Gigabit Ethernet Controller'
    class      = network
    subclass   = ethernet
    bar   [10] = type I/O Port, range 32, base 0x1100, size 256, enabled
    bar   [18] = type Memory, range 64, base 0xf0700000, size 4096, enabled
    bar   [20] = type Prefetchable Memory, range 64, base 0xf0600000, size 65536, enabled
    cap 01[40] = powerspec 3  supports D0 D1 D2 D3  current D0
    cap 05[50] = MSI supports 1 message, 64 bit 
    cap 10[70] = PCI-Express 1 endpoint MSI 1 max data 128(256) RO
                 max read 4096
                 link x1(x1) speed 2.5(2.5) ASPM disabled(L0s/L1) ClockPM disabled
    cap 11[b0] = MSI-X supports 2 messages
                 Table in map 0x20[0x0], PBA in map 0x20[0x800]
    cap 03[d0] = VPD
    ecap 0001[100] = AER 1 0 fatal 0 non-fatal 2 corrected
    ecap 0002[140] = VC 1 max VC0
    ecap 0003[160] = Serial 1 f3db0000684ce000
