hostb0@pci0:0:0:0:	class=0x060000 rev=0x0d hdr=0x00 vendor=0x8086 device=0x3e20 subvendor=0x1028 subdevice=0x0926
    vendor     = 'Intel Corporation'
    class      = bridge
    subclass   = HOST-PCI
    cap 09[e0] = vendor (length 16) Intel cap 0 version 1

pcib1@pci0:0:1:0:	class=0x060400 rev=0x0d hdr=0x01 vendor=0x8086 device=0x1901 subvendor=0x1028 subdevice=0x0926
    vendor     = 'Intel Corporation'
    device     = 'Xeon E3-1200 v5/E3-1500 v5/6th Gen Core Processor PCIe Controller (x16)'
    class      = bridge
    subclass   = PCI-PCI
    cap 0d[88] = PCI Bridge subvendor=0x1028 subdevice=0x0926
    cap 01[80] = powerspec 3  supports D0 D3  current D0
    cap 05[90] = MSI supports 1 message 
    cap 10[a0] = PCI-Express 2 root port max data 128(256)
                 link x16(x16) speed 2.5(8.0) ASPM L0s(L0s/L1)
                 slot 1 power limit 75000 mW
    ecap 0002[100] = VC 1 max VC0
    ecap 0005[140] = Root Complex Link Declaration 1
    ecap 0019[d94] = PCIe Sec 1 lane errors 0

none0@pci0:0:4:0:	class=0x118000 rev=0x0d hdr=0x00 vendor=0x8086 device=0x1903 subvendor=0x1028 subdevice=0x0926
    vendor     = 'Intel Corporation'
    device     = 'Xeon E3-1200 v5/E3-1500 v5/6th Gen Core Processor Thermal Subsystem'
    class      = dasp
    bar   [10] = type Memory, range 64, base 0x404a100000, size 32768, enabled
    cap 05[90] = MSI supports 1 message 
    cap 01[d0] = powerspec 3  supports D0 D3  current D0
    cap 09[e0] = vendor (length 12) Intel cap 0 version 1

none1@pci0:0:8:0:	class=0x088000 rev=0x00 hdr=0x00 vendor=0x8086 device=0x1911 subvendor=0x1028 subdevice=0x0926
    vendor     = 'Intel Corporation'
    device     = 'Xeon E3-1200 v5/v6 / E3-1500 v5 / 6th/7th/8th Gen Core Processor Gaussian Mixture Model'
    class      = base peripheral
    bar   [10] = type Memory, range 64, base 0x404a10e000, size 4096, enabled
    cap 05[90] = MSI supports 1 message 
    cap 01[dc] = powerspec 2  supports D0 D3  current D0
    cap 13[f0] = PCI Advanced Features: FLR TP

none2@pci0:0:18:0:	class=0x118000 rev=0x10 hdr=0x00 vendor=0x8086 device=0xa379 subvendor=0x1028 subdevice=0x0926
    vendor     = 'Intel Corporation'
    device     = 'Cannon Lake PCH Thermal Controller'
    class      = dasp
    bar   [10] = type Memory, range 64, base 0xa2138000, size 4096, enabled
    cap 01[50] = powerspec 3  supports D0 D3  current D0
    cap 05[80] = MSI supports 1 message 

xhci1@pci0:0:20:0:	class=0x0c0330 rev=0x10 hdr=0x00 vendor=0x8086 device=0xa36d subvendor=0x1028 subdevice=0x0926
    vendor     = 'Intel Corporation'
    device     = 'Cannon Lake PCH USB 3.1 xHCI Host Controller'
    class      = serial bus
    subclass   = USB
    bar   [10] = type Memory, range 64, base 0xa2120000, size 65536, enabled
    cap 01[70] = powerspec 2  supports D0 D3  current D0
    cap 05[80] = MSI supports 8 messages, 64 bit enabled with 1 message
    cap 09[90] = vendor (length 20) Intel cap 15 version 0

none3@pci0:0:20:2:	class=0x050000 rev=0x10 hdr=0x00 vendor=0x8086 device=0xa36f subvendor=0x1028 subdevice=0x0926
    vendor     = 'Intel Corporation'
    device     = 'Cannon Lake PCH Shared SRAM'
    class      = memory
    subclass   = RAM
    bar   [10] = type Memory, range 64, base 0x404a108000, size 8192, enabled
    bar   [18] = type Memory, range 64, base 0x404a10d000, size 4096, enabled
    cap 01[80] = powerspec 3  supports D0 D3  current D0

ig4iic0@pci0:0:21:0:	class=0x0c8000 rev=0x10 hdr=0x00 vendor=0x8086 device=0xa368 subvendor=0x1028 subdevice=0x0926
    vendor     = 'Intel Corporation'
    device     = 'Cannon Lake PCH Serial IO I2C Controller'
    class      = serial bus
    bar   [10] = type Memory, range 64, base 0xa2139000, size 4096, enabled
    cap 01[80] = powerspec 3  supports D0 D3  current D0
    cap 09[90] = vendor (length 20) Intel cap 15 version 0

ig4iic1@pci0:0:21:1:	class=0x0c8000 rev=0x10 hdr=0x00 vendor=0x8086 device=0xa369 subvendor=0x1028 subdevice=0x0926
    vendor     = 'Intel Corporation'
    device     = 'Cannon Lake PCH Serial IO I2C Controller'
    class      = serial bus
    bar   [10] = type Memory, range 64, base 0xa213a000, size 4096, enabled
    cap 01[80] = powerspec 3  supports D0 D3  current D0
    cap 09[90] = vendor (length 20) Intel cap 15 version 0

ahci0@pci0:0:23:0:	class=0x010601 rev=0x10 hdr=0x00 vendor=0x8086 device=0xa353 subvendor=0x1028 subdevice=0x0926
    vendor     = 'Intel Corporation'
    device     = 'Cannon Lake Mobile PCH SATA AHCI Controller'
    class      = mass storage
    subclass   = SATA
    bar   [10] = type Memory, range 32, base 0xa2134000, size 8192, enabled
    bar   [14] = type Memory, range 32, base 0xa2137000, size 256, enabled
    bar   [18] = type I/O Port, range 32, base 0x4050, size 8, enabled
    bar   [1c] = type I/O Port, range 32, base 0x4040, size 4, enabled
    bar   [20] = type I/O Port, range 32, base 0x4020, size 32, enabled
    bar   [24] = type Memory, range 32, base 0xa2136000, size 2048, enabled
    cap 05[80] = MSI supports 1 message enabled with 1 message
    cap 01[70] = powerspec 3  supports D0 D3  current D0
    cap 12[a8] = SATA Index-Data Pair

pcib2@pci0:0:27:0:	class=0x060400 rev=0xf0 hdr=0x01 vendor=0x8086 device=0xa32c subvendor=0x1028 subdevice=0x0926
    vendor     = 'Intel Corporation'
    device     = 'Cannon Lake PCH PCI Express Root Port'
    class      = bridge
    subclass   = PCI-PCI
    cap 10[40] = PCI-Express 2 root port max data 256(256) ARI disabled
                 link x4(x4) speed 8.0(8.0) ASPM L1(L0s/L1)
                 slot 24 power limit 250 mW
    cap 05[80] = MSI supports 1 message 
    cap 0d[90] = PCI Bridge subvendor=0x1028 subdevice=0x0926
    cap 01[a0] = powerspec 3  supports D0 D3  current D0
    ecap 0001[100] = AER 1 0 fatal 0 non-fatal 0 corrected
    ecap 000d[140] = ACS 1
    ecap 001f[150] = Precision Time Measurement 1
    ecap 001e[200] = L1 PM Substates 1
    ecap 0019[220] = PCIe Sec 1 lane errors 0
    ecap 001d[250] = Downstream Port Containment 1

pcib3@pci0:0:28:0:	class=0x060400 rev=0xf0 hdr=0x01 vendor=0x8086 device=0xa338 subvendor=0x1028 subdevice=0x0926
    vendor     = 'Intel Corporation'
    device     = 'Cannon Lake PCH PCI Express Root Port'
    class      = bridge
    subclass   = PCI-PCI
    cap 10[40] = PCI-Express 2 root port max data 128(128) ARI disabled
                 link x4(x4) speed 8.0(8.0)
                 slot 4 power limit 250 mW HotPlug(present) surprise
    cap 05[80] = MSI supports 1 message enabled with 1 message
    cap 0d[90] = PCI Bridge subvendor=0x1028 subdevice=0x0926
    cap 01[a0] = powerspec 3  supports D0 D3  current D0
    ecap 0001[100] = AER 1 0 fatal 0 non-fatal 0 corrected
    ecap 000d[140] = ACS 1
    ecap 001f[150] = Precision Time Measurement 1
    ecap 0019[220] = PCIe Sec 1 lane errors 0
    ecap 001d[250] = Downstream Port Containment 1

pcib9@pci0:0:28:5:	class=0x060400 rev=0xf0 hdr=0x01 vendor=0x8086 device=0xa33d subvendor=0x1028 subdevice=0x0926
    vendor     = 'Intel Corporation'
    device     = 'Cannon Lake PCH PCI Express Root Port'
    class      = bridge
    subclass   = PCI-PCI
    cap 10[40] = PCI-Express 2 root port max data 256(256) ARI disabled
                 link x1(x1) speed 8.0(8.0) ASPM L0s/L1(L0s/L1)
                 slot 9 power limit 100 mW
    cap 05[80] = MSI supports 1 message 
    cap 0d[90] = PCI Bridge subvendor=0x1028 subdevice=0x0926
    cap 01[a0] = powerspec 3  supports D0 D3  current D0
    ecap 0001[100] = AER 1 0 fatal 0 non-fatal 0 corrected
    ecap 000d[140] = ACS 1
    ecap 001f[150] = Precision Time Measurement 1
    ecap 001e[200] = L1 PM Substates 1
    ecap 0019[220] = PCIe Sec 1 lane errors 0
    ecap 001d[250] = Downstream Port Containment 1

pcib10@pci0:0:28:6:	class=0x060400 rev=0xf0 hdr=0x01 vendor=0x8086 device=0xa33e subvendor=0x1028 subdevice=0x0926
    vendor     = 'Intel Corporation'
    device     = 'Cannon Lake PCH PCI Express Root Port'
    class      = bridge
    subclass   = PCI-PCI
    cap 10[40] = PCI-Express 2 root port max data 256(256) ARI disabled
                 link x1(x1) speed 2.5(8.0) ASPM L1(L1)
                 slot 10 power limit 100 mW
    cap 05[80] = MSI supports 1 message 
    cap 0d[90] = PCI Bridge subvendor=0x1028 subdevice=0x0926
    cap 01[a0] = powerspec 3  supports D0 D3  current D0
    ecap 0001[100] = AER 1 0 fatal 0 non-fatal 0 corrected
    ecap 000d[140] = ACS 1
    ecap 001f[150] = Precision Time Measurement 1
    ecap 001e[200] = L1 PM Substates 1
    ecap 0019[220] = PCIe Sec 1 lane errors 0
    ecap 001d[250] = Downstream Port Containment 1

isab0@pci0:0:31:0:	class=0x060100 rev=0x10 hdr=0x00 vendor=0x8086 device=0xa30e subvendor=0x1028 subdevice=0x0926
    vendor     = 'Intel Corporation'
    device     = 'Cannon Lake LPC Controller'
    class      = bridge
    subclass   = PCI-ISA

hdac1@pci0:0:31:3:	class=0x040300 rev=0x10 hdr=0x00 vendor=0x8086 device=0xa348 subvendor=0x1028 subdevice=0x0926
    vendor     = 'Intel Corporation'
    device     = 'Cannon Lake PCH cAVS'
    class      = multimedia
    subclass   = HDA
    bar   [10] = type Memory, range 64, base 0xa2130000, size 16384, enabled
    bar   [20] = type Memory, range 64, base 0x404a000000, size 1048576, enabled
    cap 01[50] = powerspec 3  supports D0 D3  current D0
    cap 09[80] = vendor (length 20) Intel cap 15 version 0
    cap 05[60] = MSI supports 1 message, 64 bit enabled with 1 message

none4@pci0:0:31:4:	class=0x0c0500 rev=0x10 hdr=0x00 vendor=0x8086 device=0xa323 subvendor=0x1028 subdevice=0x0926
    vendor     = 'Intel Corporation'
    device     = 'Cannon Lake PCH SMBus Controller'
    class      = serial bus
    subclass   = SMBus
    bar   [10] = type Memory, range 64, base 0x404a10a000, size 256, enabled
    bar   [20] = type I/O Port, range 32, base 0xefa0, size 32, enabled

none5@pci0:0:31:5:	class=0x0c8000 rev=0x10 hdr=0x00 vendor=0x8086 device=0xa324 subvendor=0x1028 subdevice=0x0926
    vendor     = 'Intel Corporation'
    device     = 'Cannon Lake PCH SPI Controller'
    class      = serial bus
    bar   [10] = type Memory, range 32, base 0xfe010000, size 4096, enabled

em0@pci0:0:31:6:	class=0x020000 rev=0x10 hdr=0x00 vendor=0x8086 device=0x15bb subvendor=0x1028 subdevice=0x0926
    vendor     = 'Intel Corporation'
    device     = 'Ethernet Connection (7) I219-LM'
    class      = network
    subclass   = ethernet
    bar   [10] = type Memory, range 32, base 0xa2100000, size 131072, enabled
    cap 01[c8] = powerspec 3  supports D0 D3  current D0
    cap 05[d0] = MSI supports 1 message, 64 bit enabled with 1 message

vgapci0@pci0:1:0:0:	class=0x030000 rev=0xa1 hdr=0x00 vendor=0x10de device=0x1f36 subvendor=0x1028 subdevice=0x1926
    vendor     = 'NVIDIA Corporation'
    device     = 'TU106GLM [Quadro RTX 3000 Mobile / Max-Q]'
    class      = display
    subclass   = VGA
    bar   [10] = type Memory, range 32, base 0xa3000000, size 16777216, enabled
    bar   [14] = type Prefetchable Memory, range 64, base 0x60000000, size 268435456, enabled
    bar   [1c] = type Prefetchable Memory, range 64, base 0x70000000, size 33554432, enabled
    bar   [24] = type I/O Port, range 32, base 0x3000, size 128, enabled
    cap 01[60] = powerspec 3  supports D0 D3  current D0
    cap 05[68] = MSI supports 1 message, 64 bit enabled with 1 message
    cap 10[78] = PCI-Express 2 legacy endpoint max data 128(256) FLR RO
                 link x16(x16) speed 2.5(8.0) ASPM L0s/L1(L0s/L1) ClockPM enabled
    ecap 0002[100] = VC 1 max VC0
    ecap 0018[250] = LTR 1
    ecap 001e[258] = L1 PM Substates 1
    ecap 0004[128] = Power Budgeting 1
    ecap 0001[420] = AER 2 0 fatal 0 non-fatal 0 corrected
    ecap 000b[600] = Vendor [1] ID 0001 Rev 1 Length 36
    ecap 0019[900] = PCIe Sec 1 lane errors 0
    ecap 0015[bb0] = Resizable BAR 1

hdac0@pci0:1:0:1:	class=0x040300 rev=0xa1 hdr=0x00 vendor=0x10de device=0x10f9 subvendor=0x1028 subdevice=0x1926
    vendor     = 'NVIDIA Corporation'
    device     = 'TU106 High Definition Audio Controller'
    class      = multimedia
    subclass   = HDA
    bar   [10] = type Memory, range 32, base 0xa4080000, size 16384, enabled
    cap 01[60] = powerspec 3  supports D0 D3  current D0
    cap 05[68] = MSI supports 1 message, 64 bit enabled with 1 message
    cap 10[78] = PCI-Express 2 endpoint max data 128(256) RO NS
                 link x16(x16) speed 2.5(8.0) ASPM L0s/L1(L0s/L1) ClockPM enabled
    ecap 0001[100] = AER 2 0 fatal 0 non-fatal 1 corrected

xhci0@pci0:1:0:2:	class=0x0c0330 rev=0xa1 hdr=0x00 vendor=0x10de device=0x1ada subvendor=0x10de subdevice=0x0000
    vendor     = 'NVIDIA Corporation'
    device     = 'TU106 USB 3.1 Host Controller'
    class      = serial bus
    subclass   = USB
    bar   [10] = type Prefetchable Memory, range 64, base 0x72000000, size 262144, enabled
    bar   [1c] = type Prefetchable Memory, range 64, base 0x72040000, size 65536, enabled
    cap 05[68] = MSI supports 1 message, 64 bit enabled with 1 message
    cap 10[78] = PCI-Express 2 endpoint max data 128(128) RO NS
                 link x16(x16) speed 2.5(8.0) ASPM L0s/L1(L0s/L1) ClockPM disabled
    cap 01[b4] = powerspec 3  supports D0 D3  current D0
    ecap 0001[100] = AER 2 0 fatal 0 non-fatal 1 corrected

none6@pci0:1:0:3:	class=0x0c8000 rev=0xa1 hdr=0x00 vendor=0x10de device=0x1adb subvendor=0x10de subdevice=0x0000
    vendor     = 'NVIDIA Corporation'
    device     = 'TU106 USB Type-C UCSI Controller'
    class      = serial bus
    bar   [10] = type Memory, range 32, base 0xa4084000, size 4096, enabled
    cap 05[68] = MSI supports 1 message, 64 bit 
    cap 10[78] = PCI-Express 2 endpoint max data 128(128) RO NS
                 link x16(x16) speed 2.5(8.0) ASPM L0s/L1(L0s/L1) ClockPM disabled
    cap 01[b4] = powerspec 3  supports D0 D3  current D0
    ecap 0001[100] = AER 2 0 fatal 0 non-fatal 1 corrected

nvme0@pci0:2:0:0:	class=0x010802 rev=0x00 hdr=0x00 vendor=0x1c5c device=0x1627 subvendor=0x1c5c subdevice=0x1627
    vendor     = 'SK hynix'
    class      = mass storage
    subclass   = NVM
    bar   [10] = type Memory, range 64, base 0xa4500000, size 16384, enabled
    bar   [18] = type Memory, range 32, base 0xa4505000, size 4096, enabled
    bar   [1c] = type Memory, range 32, base 0xa4504000, size 4096, enabled
    cap 01[80] = powerspec 3  supports D0 D3  current D0
    cap 05[90] = MSI supports 16 messages, 64 bit, vector masks 
    cap 11[b0] = MSI-X supports 17 messages, enabled
                 Table in map 0x10[0x2000], PBA in map 0x10[0x3000]
    cap 10[c0] = PCI-Express 2 endpoint max data 256(256) FLR RO NS
                 link x4(x4) speed 8.0(8.0) ASPM L1(L1)
    ecap 0001[100] = AER 2 0 fatal 1 non-fatal 2 corrected
    ecap 0003[150] = Serial 1 0000000000000000
    ecap 0004[160] = Power Budgeting 1
    ecap 0018[1b8] = LTR 1
    ecap 0019[300] = PCIe Sec 1 lane errors 0
    ecap 000b[400] = Vendor [1] ID 0001 Rev 1 Length 16
    ecap 001e[900] = L1 PM Substates 1

pcib4@pci0:3:0:0:	class=0x060400 rev=0x06 hdr=0x01 vendor=0x8086 device=0x15ea subvendor=0x1028 subdevice=0x0926
    vendor     = 'Intel Corporation'
    device     = 'JHL7540 Thunderbolt 3 Bridge [Titan Ridge 4C 2018]'
    class      = bridge
    subclass   = PCI-PCI
    cap 01[80] = powerspec 3  supports D0 D1 D2 D3  current D0
    cap 05[88] = MSI supports 1 message, 64 bit 
    cap 0d[ac] = PCI Bridge subvendor=0x1028 subdevice=0x0926
    cap 10[c0] = PCI-Express 2 upstream port max data 128(128) RO NS
                 link x4(x4) speed 8.0(8.0) ASPM disabled(L1) ClockPM enabled
    cap 15[50] = unknown
    ecap 0003[100] = Serial 1 0483fc8277b30200
    ecap 0001[200] = AER 1 0 fatal 0 non-fatal 1 corrected
    ecap 0002[300] = VC 1 max VC0
    ecap 0004[400] = Power Budgeting 1
    ecap 000b[500] = Vendor [1] ID 1234 Rev 1 Length 256
    ecap 000b[600] = Vendor [1] ID 8086 Rev 2 Length 76
    ecap 0019[700] = PCIe Sec 1 lane errors 0
    ecap 0018[800] = LTR 1
    ecap 001e[a00] = L1 PM Substates 1
    ecap 001f[b00] = Precision Time Measurement 1

pcib5@pci0:4:0:0:	class=0x060400 rev=0x06 hdr=0x01 vendor=0x8086 device=0x15ea subvendor=0x1028 subdevice=0x0926
    vendor     = 'Intel Corporation'
    device     = 'JHL7540 Thunderbolt 3 Bridge [Titan Ridge 4C 2018]'
    class      = bridge
    subclass   = PCI-PCI
    cap 01[80] = powerspec 3  supports D0 D1 D2 D3  current D0
    cap 05[88] = MSI supports 1 message, 64 bit 
    cap 0d[ac] = PCI Bridge subvendor=0x1028 subdevice=0x0926
    cap 10[c0] = PCI-Express 2 downstream port max data 128(128) RO NS
                 link x4(x4) speed 2.5(2.5) ASPM L1(L1)
                 slot 0 power limit 0 mW
    cap 15[50] = unknown
    ecap 0003[100] = Serial 1 0483fc8277b30200
    ecap 0001[200] = AER 1 0 fatal 0 non-fatal 0 corrected
    ecap 0002[300] = VC 1 max VC1 lowpri VC0-VC1
    ecap 0004[400] = Power Budgeting 1
    ecap 000b[500] = Vendor [1] ID 1234 Rev 1 Length 256
    ecap 000b[600] = Vendor [1] ID 8086 Rev 2 Length 76
    ecap 0019[700] = PCIe Sec 1 lane errors 0
    ecap 000d[900] = ACS 1

pcib6@pci0:4:1:0:	class=0x060400 rev=0x06 hdr=0x01 vendor=0x8086 device=0x15ea subvendor=0x1028 subdevice=0x0926
    vendor     = 'Intel Corporation'
    device     = 'JHL7540 Thunderbolt 3 Bridge [Titan Ridge 4C 2018]'
    class      = bridge
    subclass   = PCI-PCI
    cap 01[80] = powerspec 3  supports D0 D1 D2 D3  current D0
    cap 05[88] = MSI supports 1 message, 64 bit enabled with 1 message
    cap 0d[ac] = PCI Bridge subvendor=0x1028 subdevice=0x0926
    cap 10[c0] = PCI-Express 2 downstream port max data 128(128) RO NS
                 link x4(x4) speed 2.5(2.5) ASPM L1(L1)
                 slot 1 power limit 0 mW HotPlug(empty) surprise
    cap 15[50] = unknown
    ecap 0003[100] = Serial 1 0483fc8277b30200
    ecap 0001[200] = AER 1 0 fatal 0 non-fatal 0 corrected
    ecap 0002[300] = VC 1 max VC0
    ecap 0004[400] = Power Budgeting 1
    ecap 000b[500] = Vendor [1] ID 1234 Rev 1 Length 256
    ecap 000b[600] = Vendor [1] ID 8086 Rev 2 Length 76
    ecap 0019[700] = PCIe Sec 1 lane errors 0
    ecap 000d[900] = ACS 1

pcib7@pci0:4:2:0:	class=0x060400 rev=0x06 hdr=0x01 vendor=0x8086 device=0x15ea subvendor=0x1028 subdevice=0x0926
    vendor     = 'Intel Corporation'
    device     = 'JHL7540 Thunderbolt 3 Bridge [Titan Ridge 4C 2018]'
    class      = bridge
    subclass   = PCI-PCI
    cap 01[80] = powerspec 3  supports D0 D1 D2 D3  current D0
    cap 05[88] = MSI supports 1 message, 64 bit 
    cap 0d[ac] = PCI Bridge subvendor=0x1028 subdevice=0x0926
    cap 10[c0] = PCI-Express 2 downstream port max data 128(128) RO NS
                 link x4(x4) speed 2.5(2.5) ASPM L1(L1)
                 slot 0 power limit 0 mW
    cap 15[50] = unknown
    ecap 0003[100] = Serial 1 0483fc8277b30200
    ecap 0001[200] = AER 1 0 fatal 0 non-fatal 0 corrected
    ecap 0002[300] = VC 1 max VC0
    ecap 0004[400] = Power Budgeting 1
    ecap 000b[500] = Vendor [1] ID 1234 Rev 1 Length 256
    ecap 000b[600] = Vendor [1] ID 8086 Rev 2 Length 76
    ecap 0019[700] = PCIe Sec 1 lane errors 0
    ecap 000d[900] = ACS 1

pcib8@pci0:4:4:0:	class=0x060400 rev=0x06 hdr=0x01 vendor=0x8086 device=0x15ea subvendor=0x1028 subdevice=0x0926
    vendor     = 'Intel Corporation'
    device     = 'JHL7540 Thunderbolt 3 Bridge [Titan Ridge 4C 2018]'
    class      = bridge
    subclass   = PCI-PCI
    cap 01[80] = powerspec 3  supports D0 D1 D2 D3  current D0
    cap 05[88] = MSI supports 1 message, 64 bit enabled with 1 message
    cap 0d[ac] = PCI Bridge subvendor=0x1028 subdevice=0x0926
    cap 10[c0] = PCI-Express 2 downstream port max data 128(128) RO NS
                 link x4(x4) speed 2.5(2.5) ASPM L1(L1)
                 slot 4 power limit 0 mW HotPlug(empty) surprise
    cap 15[50] = unknown
    ecap 0003[100] = Serial 1 0483fc8277b30200
    ecap 0001[200] = AER 1 0 fatal 0 non-fatal 0 corrected
    ecap 0002[300] = VC 1 max VC0
    ecap 0004[400] = Power Budgeting 1
    ecap 000b[500] = Vendor [1] ID 1234 Rev 1 Length 256
    ecap 000b[600] = Vendor [1] ID 8086 Rev 2 Length 76
    ecap 0019[700] = PCIe Sec 1 lane errors 0
    ecap 000d[900] = ACS 1

none7@pci0:5:0:0:	class=0x088000 rev=0x06 hdr=0x00 vendor=0x8086 device=0x15eb subvendor=0x1028 subdevice=0x0926
    vendor     = 'Intel Corporation'
    device     = 'JHL7540 Thunderbolt 3 NHI [Titan Ridge 4C 2018]'
    class      = base peripheral
    bar   [10] = type Memory, range 32, base 0xa2000000, size 262144, enabled
    bar   [14] = type Memory, range 32, base 0xa2040000, size 4096, enabled
    cap 01[80] = powerspec 3  supports D0 D1 D2 D3  current D0
    cap 05[88] = MSI supports 1 message, 64 bit 
    cap 10[c0] = PCI-Express 2 endpoint max data 128(128) RO NS
                 link x4(x4) speed 2.5(2.5) ASPM L1(L1) ClockPM enabled
    cap 11[a0] = MSI-X supports 16 messages
                 Table in map 0x14[0x0], PBA in map 0x14[0xfa0]
    ecap 0003[100] = Serial 1 0483fc8277b30200
    ecap 0001[200] = AER 1 0 fatal 0 non-fatal 1 corrected
    ecap 0002[300] = VC 1 max VC0
    ecap 0004[400] = Power Budgeting 1
    ecap 000b[500] = Vendor [1] ID 1234 Rev 1 Length 256
    ecap 0018[600] = LTR 1

xhci2@pci0:57:0:0:	class=0x0c0330 rev=0x06 hdr=0x00 vendor=0x8086 device=0x15ec subvendor=0x1028 subdevice=0x0926
    vendor     = 'Intel Corporation'
    device     = 'JHL7540 Thunderbolt 3 USB Controller [Titan Ridge 4C 2018]'
    class      = serial bus
    subclass   = USB
    bar   [10] = type Memory, range 32, base 0x8bf00000, size 65536, enabled
    cap 01[80] = powerspec 3  supports D0 D1 D2 D3  current D0
    cap 05[88] = MSI supports 8 messages, 64 bit enabled with 1 message
    cap 10[c0] = PCI-Express 2 endpoint max data 128(128) RO NS
                 link x4(x4) speed 2.5(2.5) ASPM L1(L1) ClockPM enabled
    ecap 0003[100] = Serial 1 0483fc8277b30200
    ecap 0001[200] = AER 1 0 fatal 0 non-fatal 1 corrected
    ecap 0002[300] = VC 1 max VC0
    ecap 0004[400] = Power Budgeting 1
    ecap 000b[500] = Vendor [1] ID 1234 Rev 1 Length 256
    ecap 000b[600] = Vendor [1] ID 8086 Rev 2 Length 76
    ecap 0019[700] = PCIe Sec 1 lane errors 0
    ecap 0018[800] = LTR 1

none8@pci0:110:0:0:	class=0xff0000 rev=0x01 hdr=0x00 vendor=0x10ec device=0x5260 subvendor=0x1028 subdevice=0x0926
    vendor     = 'Realtek Semiconductor Co., Ltd.'
    device     = 'RTS5260 PCI Express Card Reader'
    bar   [10] = type Memory, range 32, base 0xa4400000, size 4096, enabled
    cap 01[40] = powerspec 3  supports D0 D1 D2 D3  current D0
    cap 05[50] = MSI supports 1 message, 64 bit 
    cap 10[70] = PCI-Express 2 endpoint max data 256(512) RO
                 link x1(x1) speed 8.0(8.0) ASPM L0s/L1(L0s/L1) ClockPM enabled
    ecap 0001[100] = AER 2 0 fatal 0 non-fatal 1 corrected
    ecap 0003[148] = Serial 1 00000001004ce000
    ecap 0019[158] = PCIe Sec 1 lane errors 0
    ecap 0018[168] = LTR 1
    ecap 001e[170] = L1 PM Substates 1

none9@pci0:111:0:0:	class=0x028000 rev=0x32 hdr=0x00 vendor=0x168c device=0x003e subvendor=0x1028 subdevice=0x0310
    vendor     = 'Qualcomm Atheros'
    device     = 'QCA6174 802.11ac Wireless Network Adapter'
    class      = network
    bar   [10] = type Memory, range 64, base 0xa4200000, size 2097152, enabled
    cap 01[40] = powerspec 3  supports D0 D3  current D0
    cap 05[50] = MSI supports 8 messages, vector masks 
    cap 10[70] = PCI-Express 2 endpoint max data 256(256) RO
                 link x1(x1) speed 2.5(2.5) ASPM L1(L0s/L1) ClockPM enabled
    ecap 0001[100] = AER 2 0 fatal 0 non-fatal 1 corrected
    ecap 0002[148] = VC 1 max VC0
    ecap 0003[168] = Serial 1 0000000000000000
    ecap 0018[178] = LTR 1
    ecap 001e[180] = L1 PM Substates 1
