hostb0@pci0:0:0:0:	class=0x060000 rev=0x0d hdr=0x00 vendor=0x8086 device=0x5af0 subvendor=0x15d9 subdevice=0x098d
    vendor     = 'Intel Corporation'
    device     = 'Celeron N3350/Pentium N4200/Atom E3900 Series Host Bridge'
    class      = bridge
    subclass   = HOST-PCI

vgapci0@pci0:0:2:0:	class=0x030000 rev=0x0d hdr=0x00 vendor=0x8086 device=0x5a85 subvendor=0x15d9 subdevice=0x098d
    vendor     = 'Intel Corporation'
    device     = 'HD Graphics 500'
    class      = display
    subclass   = VGA
    bar   [10] = type Memory, range 64, base 0x80000000, size 16777216, enabled
    bar   [18] = type Prefetchable Memory, range 64, base 0x90000000, size 268435456, enabled
    bar   [20] = type I/O Port, range 32, base 0xf000, size 64, enabled
    cap 09[40] = vendor (length 12) Intel cap 0 version 1
    cap 10[70] = PCI-Express 2 root endpoint max data 128(128) FLR
                 max read 128
    cap 05[ac] = MSI supports 1 message 
    cap 01[d0] = powerspec 2  supports D0 D3  current D0
    ecap 001b[100] = Process Address Space ID 1
    ecap 000f[200] = ATS 1
    ecap 0013[300] = Page Page Request 1

none0@pci0:0:15:0:	class=0x078000 rev=0x0d hdr=0x00 vendor=0x8086 device=0x5a9a subvendor=0x15d9 subdevice=0x098d
    vendor     = 'Intel Corporation'
    device     = 'Celeron N3350/Pentium N4200/Atom E3900 Series Trusted Execution Engine'
    class      = simple comms
    bar   [10] = type Memory, range 64, base 0x8161d000, size 4096, enabled
    cap 01[50] = powerspec 3  supports D0 D3  current D0
    cap 05[8c] = MSI supports 1 message, 64 bit 
    cap 09[a4] = vendor (length 20) Intel cap 15 version 0

ahci0@pci0:0:18:0:	class=0x010601 rev=0x0d hdr=0x00 vendor=0x8086 device=0x5ae3 subvendor=0x15d9 subdevice=0x098d
    vendor     = 'Intel Corporation'
    device     = 'Celeron N3350/Pentium N4200/Atom E3900 Series SATA AHCI Controller'
    class      = mass storage
    subclass   = SATA
    bar   [10] = type Memory, range 32, base 0x81610000, size 8192, enabled
    bar   [14] = type Memory, range 32, base 0x8161a000, size 256, enabled
    bar   [18] = type I/O Port, range 32, base 0xf090, size 8, enabled
    bar   [1c] = type I/O Port, range 32, base 0xf080, size 4, enabled
    bar   [20] = type I/O Port, range 32, base 0xf060, size 32, enabled
    bar   [24] = type Memory, range 32, base 0x81619000, size 2048, enabled
    cap 05[80] = MSI supports 1 message enabled with 1 message
    cap 01[70] = powerspec 3  supports D0 D3  current D0
    cap 12[a8] = SATA Index-Data Pair

pcib1@pci0:0:19:0:	class=0x060400 rev=0xfd hdr=0x01 vendor=0x8086 device=0x5ad8 subvendor=0x15d9 subdevice=0x098d
    vendor     = 'Intel Corporation'
    device     = 'Celeron N3350/Pentium N4200/Atom E3900 Series PCI Express Port A'
    class      = bridge
    subclass   = PCI-PCI
    cap 10[40] = PCI-Express 2 root port max data 256(256) ARI disabled
                 max read 128
                 link x0(x1) speed 0.0(5.0) ASPM L0s/L1(L0s/L1)
                 slot 2 power limit 100 mW
    cap 05[80] = MSI supports 1 message 
    cap 0d[90] = PCI Bridge subvendor=0x15d9 subdevice=0x098d
    cap 01[a0] = powerspec 3  supports D0 D3  current D0
    ecap 0000[100] = unknown 0
    ecap 000d[140] = ACS 1
    ecap 001f[150] = Precision Time Measurement 1
    ecap 001e[200] = L1 PM Substates 1
    ecap 0000[220] = unknown 0

pcib2@pci0:0:19:1:	class=0x060400 rev=0xfd hdr=0x01 vendor=0x8086 device=0x5ad9 subvendor=0x15d9 subdevice=0x098d
    vendor     = 'Intel Corporation'
    device     = 'Celeron N3350/Pentium N4200/Atom E3900 Series PCI Express Port A'
    class      = bridge
    subclass   = PCI-PCI
    cap 10[40] = PCI-Express 2 root port max data 256(256) ARI disabled
                 max read 128
                 link x1(x1) speed 2.5(5.0) ASPM L1(L0s/L1)
                 slot 3 power limit 100 mW
    cap 05[80] = MSI supports 1 message 
    cap 0d[90] = PCI Bridge subvendor=0x15d9 subdevice=0x098d
    cap 01[a0] = powerspec 3  supports D0 D3  current D0
    ecap 0000[100] = unknown 0
    ecap 000d[140] = ACS 1
    ecap 001f[150] = Precision Time Measurement 1
    ecap 001e[200] = L1 PM Substates 1
    ecap 0000[220] = unknown 0

pcib3@pci0:0:19:2:	class=0x060400 rev=0xfd hdr=0x01 vendor=0x8086 device=0x5ada subvendor=0x15d9 subdevice=0x098d
    vendor     = 'Intel Corporation'
    device     = 'Celeron N3350/Pentium N4200/Atom E3900 Series PCI Express Port A'
    class      = bridge
    subclass   = PCI-PCI
    cap 10[40] = PCI-Express 2 root port max data 256(256) ARI disabled
                 max read 128
                 link x1(x1) speed 2.5(5.0) ASPM L1(L0s/L1)
                 slot 4 power limit 100 mW
    cap 05[80] = MSI supports 1 message 
    cap 0d[90] = PCI Bridge subvendor=0x15d9 subdevice=0x098d
    cap 01[a0] = powerspec 3  supports D0 D3  current D0
    ecap 0000[100] = unknown 0
    ecap 000d[140] = ACS 1
    ecap 001f[150] = Precision Time Measurement 1
    ecap 001e[200] = L1 PM Substates 1
    ecap 0000[220] = unknown 0

pcib4@pci0:0:19:3:	class=0x060400 rev=0xfd hdr=0x01 vendor=0x8086 device=0x5adb subvendor=0x15d9 subdevice=0x098d
    vendor     = 'Intel Corporation'
    device     = 'Celeron N3350/Pentium N4200/Atom E3900 Series PCI Express Port A'
    class      = bridge
    subclass   = PCI-PCI
    cap 10[40] = PCI-Express 2 root port max data 256(256) ARI disabled
                 max read 128
                 link x0(x1) speed 0.0(5.0) ASPM L0s/L1(L0s/L1)
                 slot 5 power limit 100 mW
    cap 05[80] = MSI supports 1 message 
    cap 0d[90] = PCI Bridge subvendor=0x15d9 subdevice=0x098d
    cap 01[a0] = powerspec 3  supports D0 D3  current D0
    ecap 0000[100] = unknown 0
    ecap 000d[140] = ACS 1
    ecap 001f[150] = Precision Time Measurement 1
    ecap 001e[200] = L1 PM Substates 1
    ecap 0000[220] = unknown 0

pcib5@pci0:0:20:0:	class=0x060400 rev=0xfd hdr=0x01 vendor=0x8086 device=0x5ad6 subvendor=0x15d9 subdevice=0x098d
    vendor     = 'Intel Corporation'
    device     = 'Celeron N3350/Pentium N4200/Atom E3900 Series PCI Express Port B'
    class      = bridge
    subclass   = PCI-PCI
    cap 10[40] = PCI-Express 2 root port max data 256(256) ARI disabled
                 max read 128
                 link x1(x1) speed 5.0(5.0) ASPM disabled(L0s/L1)
                 slot 0 power limit 100 mW
    cap 05[80] = MSI supports 1 message 
    cap 0d[90] = PCI Bridge subvendor=0x15d9 subdevice=0x098d
    cap 01[a0] = powerspec 3  supports D0 D3  current D0
    ecap 0000[100] = unknown 0
    ecap 000d[140] = ACS 1
    ecap 001f[150] = Precision Time Measurement 1
    ecap 001e[200] = L1 PM Substates 1
    ecap 0000[220] = unknown 0

pcib10@pci0:0:20:1:	class=0x060400 rev=0xfd hdr=0x01 vendor=0x8086 device=0x5ad7 subvendor=0x15d9 subdevice=0x098d
    vendor     = 'Intel Corporation'
    device     = 'Celeron N3350/Pentium N4200/Atom E3900 Series PCI Express Port B'
    class      = bridge
    subclass   = PCI-PCI
    cap 10[40] = PCI-Express 2 root port max data 256(256) ARI disabled
                 max read 128
                 link x0(x1) speed 0.0(5.0) ASPM L0s/L1(L0s/L1)
                 slot 1 power limit 100 mW
    cap 05[80] = MSI supports 1 message 
    cap 0d[90] = PCI Bridge subvendor=0x15d9 subdevice=0x098d
    cap 01[a0] = powerspec 3  supports D0 D3  current D0
    ecap 0000[100] = unknown 0
    ecap 000d[140] = ACS 1
    ecap 001f[150] = Precision Time Measurement 1
    ecap 001e[200] = L1 PM Substates 1
    ecap 0000[220] = unknown 0

xhci0@pci0:0:21:0:	class=0x0c0330 rev=0x0d hdr=0x00 vendor=0x8086 device=0x5aa8 subvendor=0x15d9 subdevice=0x098d
    vendor     = 'Intel Corporation'
    device     = 'Celeron N3350/Pentium N4200/Atom E3900 Series USB xHCI'
    class      = serial bus
    subclass   = USB
    bar   [10] = type Memory, range 64, base 0x81600000, size 65536, enabled
    cap 01[70] = powerspec 2  supports D0 D3  current D0
    cap 05[80] = MSI supports 8 messages, 64 bit enabled with 1 message
    cap 09[90] = vendor (length 20) Intel cap 15 version 0

none1@pci0:0:25:0:	class=0x118000 rev=0x0d hdr=0x00 vendor=0x8086 device=0x5ac2 subvendor=0x15d9 subdevice=0x098d
    vendor     = 'Intel Corporation'
    device     = 'Celeron N3350/Pentium N4200/Atom E3900 Series SPI Controller'
    class      = dasp
    bar   [10] = type Memory, range 64, base 0x81618000, size 4096, enabled
    bar   [18] = type Memory, range 64, base 0x81617000, size 4096, enabled
    cap 01[80] = powerspec 3  supports D0 D3  current D0
    cap 09[90] = vendor (length 20) Intel cap 15 version 0

none2@pci0:0:25:1:	class=0x118000 rev=0x0d hdr=0x00 vendor=0x8086 device=0x5ac4 subvendor=0x15d9 subdevice=0x098d
    vendor     = 'Intel Corporation'
    device     = 'Celeron N3350/Pentium N4200/Atom E3900 Series SPI Controller'
    class      = dasp
    bar   [10] = type Memory, range 64, base 0x81616000, size 4096, enabled
    bar   [18] = type Memory, range 64, base 0x81615000, size 4096, enabled
    cap 01[80] = powerspec 3  supports D0 D3  current D0
    cap 09[90] = vendor (length 20) Intel cap 15 version 0

none3@pci0:0:25:2:	class=0x118000 rev=0x0d hdr=0x00 vendor=0x8086 device=0x5ac6 subvendor=0x15d9 subdevice=0x098d
    vendor     = 'Intel Corporation'
    device     = 'Celeron N3350/Pentium N4200/Atom E3900 Series SPI Controller'
    class      = dasp
    bar   [10] = type Memory, range 64, base 0x81614000, size 4096, enabled
    bar   [18] = type Memory, range 64, base 0x81613000, size 4096, enabled
    cap 01[80] = powerspec 3  supports D0 D3  current D0
    cap 09[90] = vendor (length 20) Intel cap 15 version 0

isab0@pci0:0:31:0:	class=0x060100 rev=0x0d hdr=0x00 vendor=0x8086 device=0x5ae8 subvendor=0x15d9 subdevice=0x098d
    vendor     = 'Intel Corporation'
    device     = 'Celeron N3350/Pentium N4200/Atom E3900 Series Low Pin Count Interface'
    class      = bridge
    subclass   = PCI-ISA

ichsmb0@pci0:0:31:1:	class=0x0c0500 rev=0x0d hdr=0x00 vendor=0x8086 device=0x5ad4 subvendor=0x15d9 subdevice=0x098d
    vendor     = 'Intel Corporation'
    device     = 'Celeron N3350/Pentium N4200/Atom E3900 Series SMBus Controller'
    class      = serial bus
    subclass   = SMBus
    bar   [10] = type Memory, range 64, base 0x81612000, size 256, enabled
    bar   [20] = type I/O Port, range 32, base 0xf040, size 32, enabled

igb0@pci0:2:0:0:	class=0x020000 rev=0x03 hdr=0x00 vendor=0x8086 device=0x1533 subvendor=0x15d9 subdevice=0x1533
    vendor     = 'Intel Corporation'
    device     = 'I210 Gigabit Network Connection'
    class      = network
    subclass   = ethernet
    bar   [10] = type Memory, range 32, base 0x81500000, size 524288, enabled
    bar   [18] = type I/O Port, range 32, base 0xe000, size 32, enabled
    bar   [1c] = type Memory, range 32, base 0x81580000, size 16384, enabled
    cap 01[40] = powerspec 3  supports D0 D3  current D0
    cap 05[50] = MSI supports 1 message, 64 bit, vector masks 
    cap 11[70] = MSI-X supports 5 messages, enabled
                 Table in map 0x1c[0x0], PBA in map 0x1c[0x2000]
    cap 10[a0] = PCI-Express 2 endpoint max data 256(512) FLR RO NS
                 max read 512
                 link x1(x1) speed 2.5(2.5) ASPM L1(L0s/L1)
    ecap 0001[100] = AER 2 0 fatal 0 non-fatal 0 corrected
    ecap 0003[140] = Serial 1 ac1f6bffffdd41e6
    ecap 0017[1a0] = TPH Requester 1

igb1@pci0:3:0:0:	class=0x020000 rev=0x03 hdr=0x00 vendor=0x8086 device=0x1533 subvendor=0x15d9 subdevice=0x1533
    vendor     = 'Intel Corporation'
    device     = 'I210 Gigabit Network Connection'
    class      = network
    subclass   = ethernet
    bar   [10] = type Memory, range 32, base 0x81400000, size 524288, enabled
    bar   [18] = type I/O Port, range 32, base 0xd000, size 32, enabled
    bar   [1c] = type Memory, range 32, base 0x81480000, size 16384, enabled
    cap 01[40] = powerspec 3  supports D0 D3  current D0
    cap 05[50] = MSI supports 1 message, 64 bit, vector masks 
    cap 11[70] = MSI-X supports 5 messages, enabled
                 Table in map 0x1c[0x0], PBA in map 0x1c[0x2000]
    cap 10[a0] = PCI-Express 2 endpoint max data 256(512) FLR RO NS
                 max read 512
                 link x1(x1) speed 2.5(2.5) ASPM L1(L0s/L1)
    ecap 0001[100] = AER 2 0 fatal 0 non-fatal 0 corrected
    ecap 0003[140] = Serial 1 ac1f6bffffdd41e7
    ecap 0017[1a0] = TPH Requester 1

pcib6@pci0:5:0:0:	class=0x060400 rev=0xab hdr=0x01 vendor=0x15d9 device=0x098d subvendor=0x10b5 subdevice=0x8605
    vendor     = 'Super Micro Computer Inc'
    class      = bridge
    subclass   = PCI-PCI
    bar   [10] = type Memory, range 32, base 0x81300000, size 16384, enabled
    cap 01[40] = powerspec 3  supports D0 D1 D2 D3  current D0
    cap 05[48] = MSI supports 4 messages, 64 bit, vector masks 
    cap 10[68] = PCI-Express 2 upstream port max data 256(256) RO NS
                 max read 128
                 link x1(x1) speed 5.0(5.0) ASPM disabled(L0s/L1)
    cap 0d[a4] = PCI Bridge subvendor=0x10b5 subdevice=0x8605
    ecap 0003[100] = Serial 1 ab860210b5df0e00
    ecap 0001[fb4] = AER 1 0 fatal 0 non-fatal 1 corrected
    ecap 0004[138] = Power Budgeting 1
    ecap 0002[148] = VC 1 max VC0
    ecap 000b[950] = Vendor [1] ID 0001 Rev 0 Length 40

pcib7@pci0:6:1:0:	class=0x060400 rev=0xab hdr=0x01 vendor=0x15d9 device=0x098d subvendor=0x10b5 subdevice=0x8605
    vendor     = 'Super Micro Computer Inc'
    class      = bridge
    subclass   = PCI-PCI
    cap 01[40] = powerspec 3  supports D0 D1 D2 D3  current D0
    cap 05[48] = MSI supports 4 messages, 64 bit, vector masks enabled with 1 message
    cap 10[68] = PCI-Express 2 downstream port max data 256(256) RO NS ARI disabled
                 max read 128
                 link x1(x1) speed 2.5(5.0) ASPM disabled(L0s/L1)
                 slot 1 power limit 25000 mW HotPlug(present)
    cap 0d[a4] = PCI Bridge subvendor=0x10b5 subdevice=0x8605
    ecap 0003[100] = Serial 1 ab860210b5df0e00
    ecap 0001[fb4] = AER 1 0 fatal 0 non-fatal 1 corrected
    ecap 0002[148] = VC 1 max VC0
    ecap 000d[520] = ACS 1
    ecap 000b[950] = Vendor [1] ID 0001 Rev 0 Length 40

pcib8@pci0:6:2:0:	class=0x060400 rev=0xab hdr=0x01 vendor=0x15d9 device=0x098d subvendor=0x10b5 subdevice=0x8605
    vendor     = 'Super Micro Computer Inc'
    class      = bridge
    subclass   = PCI-PCI
    cap 01[40] = powerspec 3  supports D0 D1 D2 D3  current D0
    cap 05[48] = MSI supports 4 messages, 64 bit, vector masks 
    cap 10[68] = PCI-Express 2 downstream port max data 256(256) RO NS ARI disabled
                 max read 128
                 link x1(x1) speed 2.5(5.0) ASPM disabled(L0s/L1)
                 slot 2 power limit 25000 mW
    cap 0d[a4] = PCI Bridge subvendor=0x10b5 subdevice=0x8605
    ecap 0003[100] = Serial 1 ab860210b5df0e00
    ecap 0001[fb4] = AER 1 0 fatal 0 non-fatal 1 corrected
    ecap 0002[148] = VC 1 max VC0
    ecap 000d[520] = ACS 1
    ecap 000b[950] = Vendor [1] ID 0001 Rev 0 Length 40

pcib9@pci0:6:3:0:	class=0x060400 rev=0xab hdr=0x01 vendor=0x15d9 device=0x098d subvendor=0x10b5 subdevice=0x8605
    vendor     = 'Super Micro Computer Inc'
    class      = bridge
    subclass   = PCI-PCI
    cap 01[40] = powerspec 3  supports D0 D1 D2 D3  current D0
    cap 05[48] = MSI supports 4 messages, 64 bit, vector masks 
    cap 10[68] = PCI-Express 2 downstream port max data 256(256) RO NS ARI disabled
                 max read 128
                 link x1(x1) speed 2.5(5.0) ASPM disabled(L0s/L1)
                 slot 3 power limit 25000 mW
    cap 0d[a4] = PCI Bridge subvendor=0x10b5 subdevice=0x8605
    ecap 0003[100] = Serial 1 ab860210b5df0e00
    ecap 0001[fb4] = AER 1 0 fatal 0 non-fatal 1 corrected
    ecap 0002[148] = VC 1 max VC0
    ecap 000d[520] = ACS 1
    ecap 000b[950] = Vendor [1] ID 0001 Rev 0 Length 40

igb2@pci0:7:0:0:	class=0x020000 rev=0x03 hdr=0x00 vendor=0x8086 device=0x1533 subvendor=0x15d9 subdevice=0x1b16
    vendor     = 'Intel Corporation'
    device     = 'I210 Gigabit Network Connection'
    class      = network
    subclass   = ethernet
    bar   [10] = type Memory, range 32, base 0x81200000, size 524288, enabled
    bar   [18] = type I/O Port, range 32, base 0xc000, size 32, enabled
    bar   [1c] = type Memory, range 32, base 0x81280000, size 16384, enabled
    cap 01[40] = powerspec 3  supports D0 D3  current D0
    cap 05[50] = MSI supports 1 message, 64 bit, vector masks 
    cap 11[70] = MSI-X supports 5 messages, enabled
                 Table in map 0x1c[0x0], PBA in map 0x1c[0x2000]
    cap 10[a0] = PCI-Express 2 endpoint max data 256(512) FLR RO NS
                 max read 512
                 link x1(x1) speed 2.5(2.5) ASPM disabled(L0s/L1)
    ecap 0001[100] = AER 2 0 fatal 0 non-fatal 1 corrected
    ecap 0003[140] = Serial 1 ac1f6bffffd70f1e
    ecap 0017[1a0] = TPH Requester 1

igb3@pci0:8:0:0:	class=0x020000 rev=0x03 hdr=0x00 vendor=0x8086 device=0x1533 subvendor=0x15d9 subdevice=0x1b16
    vendor     = 'Intel Corporation'
    device     = 'I210 Gigabit Network Connection'
    class      = network
    subclass   = ethernet
    bar   [10] = type Memory, range 32, base 0x81100000, size 524288, enabled
    bar   [18] = type I/O Port, range 32, base 0xb000, size 32, enabled
    bar   [1c] = type Memory, range 32, base 0x81180000, size 16384, enabled
    cap 01[40] = powerspec 3  supports D0 D3  current D0
    cap 05[50] = MSI supports 1 message, 64 bit, vector masks 
    cap 11[70] = MSI-X supports 5 messages, enabled
                 Table in map 0x1c[0x0], PBA in map 0x1c[0x2000]
    cap 10[a0] = PCI-Express 2 endpoint max data 256(512) FLR RO NS
                 max read 512
                 link x1(x1) speed 2.5(2.5) ASPM disabled(L0s/L1)
    ecap 0001[100] = AER 2 0 fatal 0 non-fatal 1 corrected
    ecap 0003[140] = Serial 1 ac1f6bffffd70f1f
    ecap 0017[1a0] = TPH Requester 1

igb4@pci0:9:0:0:	class=0x020000 rev=0x03 hdr=0x00 vendor=0x8086 device=0x1533 subvendor=0x15d9 subdevice=0x1b16
    vendor     = 'Intel Corporation'
    device     = 'I210 Gigabit Network Connection'
    class      = network
    subclass   = ethernet
    bar   [10] = type Memory, range 32, base 0x81000000, size 524288, enabled
    bar   [18] = type I/O Port, range 32, base 0xa000, size 32, enabled
    bar   [1c] = type Memory, range 32, base 0x81080000, size 16384, enabled
    cap 01[40] = powerspec 3  supports D0 D3  current D0
    cap 05[50] = MSI supports 1 message, 64 bit, vector masks 
    cap 11[70] = MSI-X supports 5 messages, enabled
                 Table in map 0x1c[0x0], PBA in map 0x1c[0x2000]
    cap 10[a0] = PCI-Express 2 endpoint max data 256(512) FLR RO NS
                 max read 512
                 link x1(x1) speed 2.5(2.5) ASPM disabled(L0s/L1)
    ecap 0001[100] = AER 2 0 fatal 0 non-fatal 1 corrected
    ecap 0003[140] = Serial 1 ac1f6bffffd70f20
    ecap 0017[1a0] = TPH Requester 1
