hostb0@pci0:0:0:0:	class=0x060000 rev=0x04 hdr=0x00 vendor=0x8086 device=0x0e00 subvendor=0x8086 subdevice=0x0e00
    vendor     = 'Intel Corporation'
    device     = 'Xeon E7 v2/Xeon E5 v2/Core i7 DMI2'
    class      = bridge
    subclass   = HOST-PCI
    cap 10[90] = PCI-Express 2 root port max data 128(128)
                 max read 128
                 link x0(x4) speed 0.0(2.5) ASPM disabled(L1)
    cap 01[e0] = powerspec 3  supports D0 D3  current D0
    ecap 000b[100] = Vendor [1] ID 0002 Rev 0 Length 12
    ecap 000b[144] = Vendor [1] ID 0004 Rev 1 Length 60
    ecap 000b[1d0] = Vendor [1] ID 0003 Rev 1 Length 10
    ecap 000b[280] = Vendor [1] ID 0005 Rev 3 Length 24

pcib1@pci0:0:1:0:	class=0x060400 rev=0x04 hdr=0x01 vendor=0x8086 device=0x0e02 subvendor=0x8086 subdevice=0x0e02
    vendor     = 'Intel Corporation'
    device     = 'Xeon E7 v2/Xeon E5 v2/Core i7 PCI Express Root Port 1a'
    class      = bridge
    subclass   = PCI-PCI
    cap 0d[40] = PCI Bridge subvendor=0x8086 subdevice=0x0e02
    cap 05[60] = MSI supports 2 messages, vector masks 
    cap 10[90] = PCI-Express 2 root port max data 128(256) ARI disabled
                 max read 128
                 link x0(x4) speed 0.0(5.0) ASPM disabled(L1)
                 slot 0 power limit 25000 mW
    cap 01[e0] = powerspec 3  supports D0 D3  current D0
    ecap 000b[100] = Vendor [1] ID 0002 Rev 0 Length 12
    ecap 000d[110] = ACS 1
    ecap 0001[148] = AER 1 0 fatal 0 non-fatal 0 corrected
    ecap 000b[1d0] = Vendor [1] ID 0003 Rev 1 Length 10
    ecap 0019[250] = PCIe Sec 1 lane errors 0
    ecap 000b[280] = Vendor [1] ID 0005 Rev 3 Length 24

pcib2@pci0:0:1:1:	class=0x060400 rev=0x04 hdr=0x01 vendor=0x8086 device=0x0e03 subvendor=0x8086 subdevice=0x0e03
    vendor     = 'Intel Corporation'
    device     = 'Xeon E7 v2/Xeon E5 v2/Core i7 PCI Express Root Port 1b'
    class      = bridge
    subclass   = PCI-PCI
    cap 0d[40] = PCI Bridge subvendor=0x8086 subdevice=0x0e03
    cap 05[60] = MSI supports 2 messages, vector masks 
    cap 10[90] = PCI-Express 2 root port max data 128(256) ARI disabled
                 max read 128
                 link x0(x4) speed 0.0(8.0) ASPM disabled(L1)
                 slot 5 power limit 25000 mW
    cap 01[e0] = powerspec 3  supports D0 D3  current D0
    ecap 000b[100] = Vendor [1] ID 0002 Rev 0 Length 12
    ecap 000d[110] = ACS 1
    ecap 0001[148] = AER 1 0 fatal 0 non-fatal 0 corrected
    ecap 000b[1d0] = Vendor [1] ID 0003 Rev 1 Length 10
    ecap 0019[250] = PCIe Sec 1 lane errors 0
    ecap 000b[280] = Vendor [1] ID 0005 Rev 3 Length 24

pcib3@pci0:0:3:0:	class=0x060400 rev=0x04 hdr=0x01 vendor=0x8086 device=0x0e08 subvendor=0x8086 subdevice=0x0e08
    vendor     = 'Intel Corporation'
    device     = 'Xeon E7 v2/Xeon E5 v2/Core i7 PCI Express Root Port 3a'
    class      = bridge
    subclass   = PCI-PCI
    cap 0d[40] = PCI Bridge subvendor=0x8086 subdevice=0x0e08
    cap 05[60] = MSI supports 2 messages, vector masks 
    cap 10[90] = PCI-Express 2 root port max data 256(256) ARI disabled
                 max read 128
                 link x16(x16) speed 2.5(8.0) ASPM disabled(L1)
                 slot 6 power limit 75000 mW
    cap 01[e0] = powerspec 3  supports D0 D3  current D0
    ecap 000b[100] = Vendor [1] ID 0002 Rev 0 Length 12
    ecap 000d[110] = ACS 1
    ecap 0001[148] = AER 1 0 fatal 0 non-fatal 0 corrected
    ecap 000b[1d0] = Vendor [1] ID 0003 Rev 1 Length 10
    ecap 0019[250] = PCIe Sec 1 lane errors 0
    ecap 000b[280] = Vendor [1] ID 0005 Rev 3 Length 24

ioat0@pci0:0:4:0:	class=0x088000 rev=0x04 hdr=0x00 vendor=0x8086 device=0x0e20 subvendor=0x15d9 subdevice=0x0635
    vendor     = 'Intel Corporation'
    device     = 'Xeon E7 v2/Xeon E5 v2/Core i7 Crystal Beach DMA Channel 0'
    class      = base peripheral
    bar   [10] = type Memory, range 64, base 0x380ffff20000, size 16384, enabled
    cap 11[80] = MSI-X supports 1 message, enabled
                 Table in map 0x10[0x2000], PBA in map 0x10[0x3000]
    cap 10[90] = PCI-Express 2 root endpoint max data 128(128)
                 max read 128
    cap 01[e0] = powerspec 3  supports D0 D3  current D0

ioat1@pci0:0:4:1:	class=0x088000 rev=0x04 hdr=0x00 vendor=0x8086 device=0x0e21 subvendor=0x15d9 subdevice=0x0635
    vendor     = 'Intel Corporation'
    device     = 'Xeon E7 v2/Xeon E5 v2/Core i7 Crystal Beach DMA Channel 1'
    class      = base peripheral
    bar   [10] = type Memory, range 64, base 0x380ffff1c000, size 16384, enabled
    cap 11[80] = MSI-X supports 1 message, enabled
                 Table in map 0x10[0x2000], PBA in map 0x10[0x3000]
    cap 10[90] = PCI-Express 2 root endpoint max data 128(128)
                 max read 128
    cap 01[e0] = powerspec 3  supports D0 D3  current D0

ioat2@pci0:0:4:2:	class=0x088000 rev=0x04 hdr=0x00 vendor=0x8086 device=0x0e22 subvendor=0x15d9 subdevice=0x0635
    vendor     = 'Intel Corporation'
    device     = 'Xeon E7 v2/Xeon E5 v2/Core i7 Crystal Beach DMA Channel 2'
    class      = base peripheral
    bar   [10] = type Memory, range 64, base 0x380ffff18000, size 16384, enabled
    cap 11[80] = MSI-X supports 1 message, enabled
                 Table in map 0x10[0x2000], PBA in map 0x10[0x3000]
    cap 10[90] = PCI-Express 2 root endpoint max data 128(128)
                 max read 128
    cap 01[e0] = powerspec 3  supports D0 D3  current D0

ioat3@pci0:0:4:3:	class=0x088000 rev=0x04 hdr=0x00 vendor=0x8086 device=0x0e23 subvendor=0x15d9 subdevice=0x0635
    vendor     = 'Intel Corporation'
    device     = 'Xeon E7 v2/Xeon E5 v2/Core i7 Crystal Beach DMA Channel 3'
    class      = base peripheral
    bar   [10] = type Memory, range 64, base 0x380ffff14000, size 16384, enabled
    cap 11[80] = MSI-X supports 1 message, enabled
                 Table in map 0x10[0x2000], PBA in map 0x10[0x3000]
    cap 10[90] = PCI-Express 2 root endpoint max data 128(128)
                 max read 128
    cap 01[e0] = powerspec 3  supports D0 D3  current D0

ioat4@pci0:0:4:4:	class=0x088000 rev=0x04 hdr=0x00 vendor=0x8086 device=0x0e24 subvendor=0x15d9 subdevice=0x0635
    vendor     = 'Intel Corporation'
    device     = 'Xeon E7 v2/Xeon E5 v2/Core i7 Crystal Beach DMA Channel 4'
    class      = base peripheral
    bar   [10] = type Memory, range 64, base 0x380ffff10000, size 16384, enabled
    cap 11[80] = MSI-X supports 1 message, enabled
                 Table in map 0x10[0x2000], PBA in map 0x10[0x3000]
    cap 10[90] = PCI-Express 2 root endpoint max data 128(128)
                 max read 128
    cap 01[e0] = powerspec 3  supports D0 D3  current D0

ioat5@pci0:0:4:5:	class=0x088000 rev=0x04 hdr=0x00 vendor=0x8086 device=0x0e25 subvendor=0x15d9 subdevice=0x0635
    vendor     = 'Intel Corporation'
    device     = 'Xeon E7 v2/Xeon E5 v2/Core i7 Crystal Beach DMA Channel 5'
    class      = base peripheral
    bar   [10] = type Memory, range 64, base 0x380ffff0c000, size 16384, enabled
    cap 11[80] = MSI-X supports 1 message, enabled
                 Table in map 0x10[0x2000], PBA in map 0x10[0x3000]
    cap 10[90] = PCI-Express 2 root endpoint max data 128(128)
                 max read 128
    cap 01[e0] = powerspec 3  supports D0 D3  current D0

ioat6@pci0:0:4:6:	class=0x088000 rev=0x04 hdr=0x00 vendor=0x8086 device=0x0e26 subvendor=0x15d9 subdevice=0x0635
    vendor     = 'Intel Corporation'
    device     = 'Xeon E7 v2/Xeon E5 v2/Core i7 Crystal Beach DMA Channel 6'
    class      = base peripheral
    bar   [10] = type Memory, range 64, base 0x380ffff08000, size 16384, enabled
    cap 11[80] = MSI-X supports 1 message, enabled
                 Table in map 0x10[0x2000], PBA in map 0x10[0x3000]
    cap 10[90] = PCI-Express 2 root endpoint max data 128(128)
                 max read 128
    cap 01[e0] = powerspec 3  supports D0 D3  current D0

ioat7@pci0:0:4:7:	class=0x088000 rev=0x04 hdr=0x00 vendor=0x8086 device=0x0e27 subvendor=0x15d9 subdevice=0x0635
    vendor     = 'Intel Corporation'
    device     = 'Xeon E7 v2/Xeon E5 v2/Core i7 Crystal Beach DMA Channel 7'
    class      = base peripheral
    bar   [10] = type Memory, range 64, base 0x380ffff04000, size 16384, enabled
    cap 11[80] = MSI-X supports 1 message, enabled
                 Table in map 0x10[0x2000], PBA in map 0x10[0x3000]
    cap 10[90] = PCI-Express 2 root endpoint max data 128(128)
                 max read 128
    cap 01[e0] = powerspec 3  supports D0 D3  current D0

none0@pci0:0:5:0:	class=0x088000 rev=0x04 hdr=0x00 vendor=0x8086 device=0x0e28 subvendor=0x15d9 subdevice=0x0635
    vendor     = 'Intel Corporation'
    device     = 'Xeon E7 v2/Xeon E5 v2/Core i7 VTd/Memory Map/Misc'
    class      = base peripheral
    cap 10[40] = PCI-Express 2 root endpoint max data 128(128)
                 max read 128

none1@pci0:0:5:2:	class=0x088000 rev=0x04 hdr=0x00 vendor=0x8086 device=0x0e2a subvendor=0x15d9 subdevice=0x0635
    vendor     = 'Intel Corporation'
    device     = 'Xeon E7 v2/Xeon E5 v2/Core i7 IIO RAS'
    class      = base peripheral
    cap 10[40] = PCI-Express 2 root endpoint max data 128(128) RO NS
                 max read 128

ioapic0@pci0:0:5:4:	class=0x080020 rev=0x04 hdr=0x00 vendor=0x8086 device=0x0e2c subvendor=0x8086 subdevice=0x0e2c
    vendor     = 'Intel Corporation'
    device     = 'Xeon E7 v2/Xeon E5 v2/Core i7 IOAPIC'
    class      = base peripheral
    subclass   = interrupt controller
    bar   [10] = type Memory, range 32, base 0xdff06000, size 4096, enabled
    cap 10[44] = PCI-Express 1 root endpoint max data 128(128)
                 max read 128
    cap 01[e0] = powerspec 3  supports D0 D3  current D0

pcib4@pci0:0:17:0:	class=0x060400 rev=0x06 hdr=0x01 vendor=0x8086 device=0x1d3e subvendor=0x15d9 subdevice=0x0635
    vendor     = 'Intel Corporation'
    device     = 'C600/X79 series chipset PCI Express Virtual Root Port'
    class      = bridge
    subclass   = PCI-PCI
    cap 10[40] = PCI-Express 2 root port max data 128(128) ARI enabled
                 max read 128
                 link x1(x1) speed 2.5(2.5) ASPM disabled(L0s/L1)
    cap 01[80] = powerspec 3  supports D0 D3  current D0
    cap 0d[88] = PCI Bridge subvendor=0x15d9 subdevice=0x0635
    cap 05[90] = MSI supports 1 message 
    ecap 0001[100] = AER 1 0 fatal 0 non-fatal 0 corrected
    ecap 000d[138] = ACS 1

none2@pci0:0:22:0:	class=0x078000 rev=0x05 hdr=0x00 vendor=0x8086 device=0x1d3a subvendor=0x15d9 subdevice=0x0635
    vendor     = 'Intel Corporation'
    device     = 'C600/X79 series chipset MEI Controller'
    class      = simple comms
    bar   [10] = type Memory, range 64, base 0xdff05000, size 16, enabled
    cap 01[50] = powerspec 3  supports D0 D3  current D0
    cap 05[8c] = MSI supports 1 message, 64 bit 

none3@pci0:0:22:1:	class=0x078000 rev=0x05 hdr=0x00 vendor=0x8086 device=0x1d3b subvendor=0x15d9 subdevice=0x0635
    vendor     = 'Intel Corporation'
    device     = 'C600/X79 series chipset MEI Controller'
    class      = simple comms
    bar   [10] = type Memory, range 64, base 0xdff04000, size 16, enabled
    cap 01[50] = powerspec 3  supports D0 D3  current D0
    cap 05[8c] = MSI supports 1 message, 64 bit 

ehci0@pci0:0:26:0:	class=0x0c0320 rev=0x06 hdr=0x00 vendor=0x8086 device=0x1d2d subvendor=0x15d9 subdevice=0x0635
    vendor     = 'Intel Corporation'
    device     = 'C600/X79 series chipset USB2 Enhanced Host Controller'
    class      = serial bus
    subclass   = USB
    bar   [10] = type Memory, range 32, base 0xdff02000, size 1024, enabled
    cap 01[50] = powerspec 2  supports D0 D3  current D0
    cap 0a[58] = EHCI Debug Port at offset 0xa0 in map 0x14
    cap 13[98] = PCI Advanced Features: FLR TP

hdac1@pci0:0:27:0:	class=0x040300 rev=0x06 hdr=0x00 vendor=0x8086 device=0x1d20 subvendor=0x15d9 subdevice=0x0635
    vendor     = 'Intel Corporation'
    device     = 'C600/X79 series chipset High Definition Audio Controller'
    class      = multimedia
    subclass   = HDA
    bar   [10] = type Memory, range 64, base 0x380ffff00000, size 16384, enabled
    cap 01[50] = powerspec 2  supports D0 D3  current D0
    cap 05[60] = MSI supports 1 message, 64 bit enabled with 1 message
    cap 10[70] = PCI-Express 1 root endpoint max data 128(128) FLR NS
                 max read 128
    ecap 0002[100] = VC 1 max VC1
    ecap 0005[130] = Root Complex Link Declaration 1

pcib5@pci0:0:28:0:	class=0x060400 rev=0xb6 hdr=0x01 vendor=0x8086 device=0x1d10 subvendor=0x15d9 subdevice=0x0635
    vendor     = 'Intel Corporation'
    device     = 'C600/X79 series chipset PCI Express Root Port 1'
    class      = bridge
    subclass   = PCI-PCI
    cap 10[40] = PCI-Express 2 root port max data 128(128)
                 max read 128
                 link x1(x1) speed 2.5(5.0) ASPM disabled(L1)
                 slot 0 power limit 100 mW
    cap 05[80] = MSI supports 1 message 
    cap 0d[90] = PCI Bridge subvendor=0x15d9 subdevice=0x0635
    cap 01[a0] = powerspec 2  supports D0 D3  current D0

pcib6@pci0:0:28:1:	class=0x060400 rev=0xb6 hdr=0x01 vendor=0x8086 device=0x1d12 subvendor=0x15d9 subdevice=0x0635
    vendor     = 'Intel Corporation'
    device     = 'C600/X79 series chipset PCI Express Root Port 2'
    class      = bridge
    subclass   = PCI-PCI
    cap 10[40] = PCI-Express 2 root port max data 128(128)
                 max read 128
                 link x1(x1) speed 2.5(5.0) ASPM disabled(L1)
                 slot 0 power limit 100 mW
    cap 05[80] = MSI supports 1 message 
    cap 0d[90] = PCI Bridge subvendor=0x15d9 subdevice=0x0635
    cap 01[a0] = powerspec 2  supports D0 D3  current D0

pcib7@pci0:0:28:2:	class=0x060400 rev=0xb6 hdr=0x01 vendor=0x8086 device=0x1d14 subvendor=0x15d9 subdevice=0x0635
    vendor     = 'Intel Corporation'
    device     = 'C600/X79 series chipset PCI Express Root Port 3'
    class      = bridge
    subclass   = PCI-PCI
    cap 10[40] = PCI-Express 2 root port max data 128(128)
                 max read 128
                 link x1(x1) speed 5.0(5.0) ASPM disabled(L1)
                 slot 0 power limit 100 mW
    cap 05[80] = MSI supports 1 message 
    cap 0d[90] = PCI Bridge subvendor=0x15d9 subdevice=0x0635
    cap 01[a0] = powerspec 2  supports D0 D3  current D0

pcib8@pci0:0:28:3:	class=0x060400 rev=0xb6 hdr=0x01 vendor=0x8086 device=0x1d16 subvendor=0x15d9 subdevice=0x0635
    vendor     = 'Intel Corporation'
    device     = 'C600/X79 series chipset PCI Express Root Port 4'
    class      = bridge
    subclass   = PCI-PCI
    cap 10[40] = PCI-Express 2 root port max data 128(128)
                 max read 128
                 link x1(x1) speed 5.0(5.0) ASPM disabled(L1)
                 slot 0 power limit 100 mW
    cap 05[80] = MSI supports 1 message 
    cap 0d[90] = PCI Bridge subvendor=0x15d9 subdevice=0x0635
    cap 01[a0] = powerspec 2  supports D0 D3  current D0

ehci1@pci0:0:29:0:	class=0x0c0320 rev=0x06 hdr=0x00 vendor=0x8086 device=0x1d26 subvendor=0x15d9 subdevice=0x0635
    vendor     = 'Intel Corporation'
    device     = 'C600/X79 series chipset USB2 Enhanced Host Controller'
    class      = serial bus
    subclass   = USB
    bar   [10] = type Memory, range 32, base 0xdff01000, size 1024, enabled
    cap 01[50] = powerspec 2  supports D0 D3  current D0
    cap 0a[58] = EHCI Debug Port at offset 0xa0 in map 0x14
    cap 13[98] = PCI Advanced Features: FLR TP

pcib9@pci0:0:30:0:	class=0x060401 rev=0xa6 hdr=0x01 vendor=0x8086 device=0x244e subvendor=0x15d9 subdevice=0x0635
    vendor     = 'Intel Corporation'
    device     = '82801 PCI Bridge'
    class      = bridge
    subclass   = PCI-PCI
    cap 0d[50] = PCI Bridge subvendor=0x15d9 subdevice=0x0635

isab0@pci0:0:31:0:	class=0x060100 rev=0x06 hdr=0x00 vendor=0x8086 device=0x1d41 subvendor=0x15d9 subdevice=0x0635
    vendor     = 'Intel Corporation'
    device     = 'C600/X79 series chipset LPC Controller'
    class      = bridge
    subclass   = PCI-ISA
    cap 09[e0] = vendor (length 12) Intel cap 1 version 0
		 features: AMT, 4 PCI-e x1 slots

ahci0@pci0:0:31:2:	class=0x010601 rev=0x06 hdr=0x00 vendor=0x8086 device=0x1d02 subvendor=0x15d9 subdevice=0x0635
    vendor     = 'Intel Corporation'
    device     = 'C600/X79 series chipset 6-Port SATA AHCI Controller'
    class      = mass storage
    subclass   = SATA
    bar   [10] = type I/O Port, range 32, base 0x9070, size 8, enabled
    bar   [14] = type I/O Port, range 32, base 0x9060, size 4, enabled
    bar   [18] = type I/O Port, range 32, base 0x9050, size 8, enabled
    bar   [1c] = type I/O Port, range 32, base 0x9040, size 4, enabled
    bar   [20] = type I/O Port, range 32, base 0x9020, size 32, enabled
    bar   [24] = type Memory, range 32, base 0xdff00000, size 2048, enabled
    cap 05[80] = MSI supports 1 message enabled with 1 message
    cap 01[70] = powerspec 3  supports D0 D3  current D0
    cap 12[a8] = SATA Index-Data Pair
    cap 13[b0] = PCI Advanced Features: FLR TP

ichsmb0@pci0:0:31:3:	class=0x0c0500 rev=0x06 hdr=0x00 vendor=0x8086 device=0x1d22 subvendor=0x15d9 subdevice=0x0635
    vendor     = 'Intel Corporation'
    device     = 'C600/X79 series chipset SMBus Host Controller'
    class      = serial bus
    subclass   = SMBus
    bar   [10] = type Memory, range 64, base 0x380ffff25000, size 256, enabled
    bar   [20] = type I/O Port, range 32, base 0x9000, size 32, enabled

none4@pci0:0:31:6:	class=0x118000 rev=0x06 hdr=0x00 vendor=0x8086 device=0x1d24 subvendor=0x15d9 subdevice=0x0635
    vendor     = 'Intel Corporation'
    device     = 'C600/X79 series chipset Thermal Management Controller'
    class      = dasp
    bar   [10] = type Memory, range 64, base 0x380ffff24000, size 4096, enabled
    cap 01[50] = powerspec 3  supports D0 D3  current D0

vgapci0@pci0:3:0:0:	class=0x030000 rev=0x00 hdr=0x00 vendor=0x1002 device=0x6758 subvendor=0x1787 subdevice=0x2309
    vendor     = 'Advanced Micro Devices, Inc. [AMD/ATI]'
    device     = 'Turks XT [Radeon HD 6670/7670]'
    class      = display
    subclass   = VGA
    bar   [10] = type Prefetchable Memory, range 64, base 0x380fe0000000, size 268435456, enabled
    bar   [18] = type Memory, range 64, base 0xdfe20000, size 131072, enabled
    bar   [20] = type I/O Port, range 32, base 0x8000, size 256, enabled
    cap 01[50] = powerspec 3  supports D0 D1 D2 D3  current D0
    cap 10[58] = PCI-Express 2 legacy endpoint max data 256(256) NS
                 max read 512
                 link x16(x16) speed 2.5(5.0) ASPM disabled(L0s/L1)
    cap 05[a0] = MSI supports 1 message, 64 bit enabled with 1 message
    ecap 000b[100] = Vendor [1] ID 0001 Rev 1 Length 16
    ecap 0001[150] = AER 1 0 fatal 1 non-fatal 1 corrected

hdac0@pci0:3:0:1:	class=0x040300 rev=0x00 hdr=0x00 vendor=0x1002 device=0xaa90 subvendor=0x1787 subdevice=0xaa90
    vendor     = 'Advanced Micro Devices, Inc. [AMD/ATI]'
    device     = 'Turks HDMI Audio [Radeon HD 6500/6600 / 6700M Series]'
    class      = multimedia
    subclass   = HDA
    bar   [10] = type Memory, range 64, base 0xdfe40000, size 16384, enabled
    cap 01[50] = powerspec 3  supports D0 D1 D2 D3  current D0
    cap 10[58] = PCI-Express 2 legacy endpoint max data 256(256) NS
                 max read 512
                 link x16(x16) speed 2.5(5.0) ASPM disabled(L0s/L1)
    cap 05[a0] = MSI supports 1 message, 64 bit enabled with 1 message
    ecap 000b[100] = Vendor [1] ID 0001 Rev 1 Length 16
    ecap 0001[150] = AER 1 0 fatal 1 non-fatal 1 corrected

isci0@pci0:4:0:0:	class=0x010700 rev=0x06 hdr=0x00 vendor=0x8086 device=0x1d6b subvendor=0x15d9 subdevice=0x0635
    vendor     = 'Intel Corporation'
    device     = 'C602 chipset 4-Port SATA Storage Control Unit'
    class      = mass storage
    subclass   = SAS
    bar   [10] = type Prefetchable Memory, range 64, base 0x380ff047c000, size 16384, enabled
    bar   [18] = type Prefetchable Memory, range 64, base 0x380ff0000000, size 4194304, enabled
    bar   [20] = type I/O Port, range 32, base 0x7000, size 256, enabled
    cap 01[98] = powerspec 3  supports D0 D3  current D0
    cap 10[c4] = PCI-Express 2 endpoint max data 128(1024) FLR NS
                 max read 1024
                 link x1(x1) speed 2.5(2.5) ASPM disabled(L0s/L1)
    cap 11[a0] = MSI-X supports 2 messages, enabled
                 Table in map 0x10[0x2000], PBA in map 0x10[0x3000]
    ecap 0001[100] = AER 1 0 fatal 0 non-fatal 1 corrected
    ecap 000e[138] = ARI 1
    ecap 0017[180] = TPH Requester 1
    ecap 0010[140] = SR-IOV 1 IOV disabled, Memory Space disabled, ARI disabled
                     0 VFs configured out of 31 supported
                     First VF RID Offset 0x0008, VF RID Stride 0x0001
                     VF Device ID 0x1d5b
                     Page Sizes: 4096 (enabled), 8192, 65536, 262144, 1048576, 4194304

none5@pci0:4:0:3:	class=0x0c0500 rev=0x06 hdr=0x00 vendor=0x8086 device=0x1d70 subvendor=0x15d9 subdevice=0x0635
    vendor     = 'Intel Corporation'
    device     = 'C600/X79 series chipset SMBus Controller 0'
    class      = serial bus
    subclass   = SMBus
    bar   [10] = type Memory, range 32, base 0xdfd00000, size 4096, enabled
    bar   [20] = type I/O Port, range 32, base 0x7100, size 32, enabled
    cap 10[90] = PCI-Express 2 endpoint max data 128(256)
                 max read 128
                 link x1(x1) speed 2.5(2.5) ASPM disabled(L0s/L1)
    cap 01[cc] = powerspec 3  supports D0 D3  current D0
    cap 05[d4] = MSI supports 1 message 
    ecap 000e[100] = ARI 1

em0@pci0:5:0:0:	class=0x020000 rev=0x00 hdr=0x00 vendor=0x8086 device=0x10d3 subvendor=0x15d9 subdevice=0x0000
    vendor     = 'Intel Corporation'
    device     = '82574L Gigabit Network Connection'
    class      = network
    subclass   = ethernet
    bar   [10] = type Memory, range 32, base 0xdfc00000, size 131072, enabled
    bar   [18] = type I/O Port, range 32, base 0x6000, size 32, enabled
    bar   [1c] = type Memory, range 32, base 0xdfc20000, size 16384, enabled
    cap 01[c8] = powerspec 2  supports D0 D3  current D0
    cap 05[d0] = MSI supports 1 message, 64 bit 
    cap 10[e0] = PCI-Express 1 endpoint max data 128(256) NS
                 max read 512
                 link x1(x1) speed 2.5(2.5) ASPM disabled(L0s/L1)
    cap 11[a0] = MSI-X supports 5 messages, enabled
                 Table in map 0x1c[0x0], PBA in map 0x1c[0x2000]
    ecap 0001[100] = AER 1 0 fatal 0 non-fatal 1 corrected
    ecap 0003[140] = Serial 1 0cc47affff55a924

em1@pci0:6:0:0:	class=0x020000 rev=0x00 hdr=0x00 vendor=0x8086 device=0x10d3 subvendor=0x15d9 subdevice=0x0000
    vendor     = 'Intel Corporation'
    device     = '82574L Gigabit Network Connection'
    class      = network
    subclass   = ethernet
    bar   [10] = type Memory, range 32, base 0xdfb00000, size 131072, enabled
    bar   [18] = type I/O Port, range 32, base 0x5000, size 32, enabled
    bar   [1c] = type Memory, range 32, base 0xdfb20000, size 16384, enabled
    cap 01[c8] = powerspec 2  supports D0 D3  current D0
    cap 05[d0] = MSI supports 1 message, 64 bit 
    cap 10[e0] = PCI-Express 1 endpoint max data 128(256) NS
                 max read 512
                 link x1(x1) speed 2.5(2.5) ASPM disabled(L0s/L1)
    cap 11[a0] = MSI-X supports 5 messages, enabled
                 Table in map 0x1c[0x0], PBA in map 0x1c[0x2000]
    ecap 0001[100] = AER 1 0 fatal 0 non-fatal 1 corrected
    ecap 0003[140] = Serial 1 0cc47affff55a925

xhci0@pci0:7:0:0:	class=0x0c0330 rev=0x04 hdr=0x00 vendor=0x1033 device=0x0194 subvendor=0x15d9 subdevice=0x0622
    vendor     = 'NEC Corporation'
    device     = 'uPD720200 USB 3.0 Host Controller'
    class      = serial bus
    subclass   = USB
    bar   [10] = type Memory, range 64, base 0xdfa00000, size 8192, enabled
    cap 01[50] = powerspec 3  supports D0 D3  current D0
    cap 05[70] = MSI supports 8 messages, 64 bit 
    cap 11[90] = MSI-X supports 8 messages, enabled
                 Table in map 0x10[0x1000], PBA in map 0x10[0x1080]
    cap 10[a0] = PCI-Express 2 endpoint max data 128(128) NS
                 max read 512
                 link x1(x1) speed 5.0(5.0) ASPM disabled(L0s/L1) ClockPM disabled
    ecap 0001[100] = AER 1 0 fatal 0 non-fatal 1 corrected
    ecap 0003[140] = Serial 1 ffffffffffffffff
    ecap 0018[150] = LTR 1

xhci1@pci0:8:0:0:	class=0x0c0330 rev=0x04 hdr=0x00 vendor=0x1033 device=0x0194 subvendor=0x15d9 subdevice=0x0622
    vendor     = 'NEC Corporation'
    device     = 'uPD720200 USB 3.0 Host Controller'
    class      = serial bus
    subclass   = USB
    bar   [10] = type Memory, range 64, base 0xdf900000, size 8192, enabled
    cap 01[50] = powerspec 3  supports D0 D3  current D0
    cap 05[70] = MSI supports 8 messages, 64 bit 
    cap 11[90] = MSI-X supports 8 messages, enabled
                 Table in map 0x10[0x1000], PBA in map 0x10[0x1080]
    cap 10[a0] = PCI-Express 2 endpoint max data 128(128) NS
                 max read 512
                 link x1(x1) speed 5.0(5.0) ASPM disabled(L0s/L1) ClockPM disabled
    ecap 0001[100] = AER 1 0 fatal 0 non-fatal 1 corrected
    ecap 0003[140] = Serial 1 ffffffffffffffff
    ecap 0018[150] = LTR 1

none6@pci0:127:8:0:	class=0x088000 rev=0x04 hdr=0x00 vendor=0x8086 device=0x0e80 subvendor=0x15d9 subdevice=0x0635
    vendor     = 'Intel Corporation'
    device     = 'Xeon E7 v2/Xeon E5 v2/Core i7 QPI Link 0'
    class      = base peripheral

none7@pci0:127:9:0:	class=0x088000 rev=0x04 hdr=0x00 vendor=0x8086 device=0x0e90 subvendor=0x15d9 subdevice=0x0635
    vendor     = 'Intel Corporation'
    device     = 'Xeon E7 v2/Xeon E5 v2/Core i7 QPI Link 1'
    class      = base peripheral

none8@pci0:127:10:0:	class=0x088000 rev=0x04 hdr=0x00 vendor=0x8086 device=0x0ec0 subvendor=0x15d9 subdevice=0x0635
    vendor     = 'Intel Corporation'
    device     = 'Xeon E7 v2/Xeon E5 v2/Core i7 Power Control Unit 0'
    class      = base peripheral

none9@pci0:127:10:1:	class=0x088000 rev=0x04 hdr=0x00 vendor=0x8086 device=0x0ec1 subvendor=0x15d9 subdevice=0x0635
    vendor     = 'Intel Corporation'
    device     = 'Xeon E7 v2/Xeon E5 v2/Core i7 Power Control Unit 1'
    class      = base peripheral

none10@pci0:127:10:2:	class=0x088000 rev=0x04 hdr=0x00 vendor=0x8086 device=0x0ec2 subvendor=0x15d9 subdevice=0x0635
    vendor     = 'Intel Corporation'
    device     = 'Xeon E7 v2/Xeon E5 v2/Core i7 Power Control Unit 2'
    class      = base peripheral

none11@pci0:127:10:3:	class=0x088000 rev=0x04 hdr=0x00 vendor=0x8086 device=0x0ec3 subvendor=0x15d9 subdevice=0x0635
    vendor     = 'Intel Corporation'
    device     = 'Xeon E7 v2/Xeon E5 v2/Core i7 Power Control Unit 3'
    class      = base peripheral

none12@pci0:127:11:0:	class=0x088000 rev=0x04 hdr=0x00 vendor=0x8086 device=0x0e1e subvendor=0x15d9 subdevice=0x0635
    vendor     = 'Intel Corporation'
    device     = 'Xeon E7 v2/Xeon E5 v2/Core i7 UBOX Registers'
    class      = base peripheral

none13@pci0:127:11:3:	class=0x088000 rev=0x04 hdr=0x00 vendor=0x8086 device=0x0e1f subvendor=0x15d9 subdevice=0x0635
    vendor     = 'Intel Corporation'
    device     = 'Xeon E7 v2/Xeon E5 v2/Core i7 UBOX Registers'
    class      = base peripheral

none14@pci0:127:12:0:	class=0x088000 rev=0x04 hdr=0x00 vendor=0x8086 device=0x0ee0 subvendor=0x15d9 subdevice=0x0635
    vendor     = 'Intel Corporation'
    device     = 'Xeon E7 v2/Xeon E5 v2/Core i7 Unicast Registers'
    class      = base peripheral

none15@pci0:127:12:1:	class=0x088000 rev=0x04 hdr=0x00 vendor=0x8086 device=0x0ee2 subvendor=0x15d9 subdevice=0x0635
    vendor     = 'Intel Corporation'
    device     = 'Xeon E7 v2/Xeon E5 v2/Core i7 Unicast Registers'
    class      = base peripheral

none16@pci0:127:13:0:	class=0x088000 rev=0x04 hdr=0x00 vendor=0x8086 device=0x0ee1 subvendor=0x15d9 subdevice=0x0635
    vendor     = 'Intel Corporation'
    device     = 'Xeon E7 v2/Xeon E5 v2/Core i7 Unicast Registers'
    class      = base peripheral

none17@pci0:127:13:1:	class=0x088000 rev=0x04 hdr=0x00 vendor=0x8086 device=0x0ee3 subvendor=0x15d9 subdevice=0x0635
    vendor     = 'Intel Corporation'
    device     = 'Xeon E7 v2/Xeon E5 v2/Core i7 Unicast Registers'
    class      = base peripheral

none18@pci0:127:14:0:	class=0x088000 rev=0x04 hdr=0x00 vendor=0x8086 device=0x0ea0 subvendor=0x15d9 subdevice=0x0635
    vendor     = 'Intel Corporation'
    device     = 'Xeon E7 v2/Xeon E5 v2/Core i7 Home Agent 0'
    class      = base peripheral

none19@pci0:127:14:1:	class=0x110100 rev=0x04 hdr=0x00 vendor=0x8086 device=0x0e30 subvendor=0x15d9 subdevice=0x0635
    vendor     = 'Intel Corporation'
    device     = 'Xeon E7 v2/Xeon E5 v2/Core i7 Home Agent 0'
    class      = dasp
    subclass   = performance counters

none20@pci0:127:15:0:	class=0x088000 rev=0x04 hdr=0x00 vendor=0x8086 device=0x0ea8 subvendor=0x15d9 subdevice=0x0635
    vendor     = 'Intel Corporation'
    device     = 'Xeon E7 v2/Xeon E5 v2/Core i7 Integrated Memory Controller 0 Target Address/Thermal Registers'
    class      = base peripheral
    cap 10[40] = PCI-Express 1 root endpoint max data 128(128)
                 max read 128

none21@pci0:127:15:1:	class=0x088000 rev=0x04 hdr=0x00 vendor=0x8086 device=0x0e71 subvendor=0x15d9 subdevice=0x0635
    vendor     = 'Intel Corporation'
    device     = 'Xeon E7 v2/Xeon E5 v2/Core i7 Integrated Memory Controller 0 RAS Registers'
    class      = base peripheral
    cap 10[40] = PCI-Express 1 root endpoint max data 128(128)
                 max read 128

none22@pci0:127:15:2:	class=0x088000 rev=0x04 hdr=0x00 vendor=0x8086 device=0x0eaa subvendor=0x15d9 subdevice=0x0635
    vendor     = 'Intel Corporation'
    device     = 'Xeon E7 v2/Xeon E5 v2/Core i7 Integrated Memory Controller 0 Channel Target Address Decoder Registers'
    class      = base peripheral
    cap 10[40] = PCI-Express 1 root endpoint max data 128(128)
                 max read 128

none23@pci0:127:15:3:	class=0x088000 rev=0x04 hdr=0x00 vendor=0x8086 device=0x0eab subvendor=0x15d9 subdevice=0x0635
    vendor     = 'Intel Corporation'
    device     = 'Xeon E7 v2/Xeon E5 v2/Core i7 Integrated Memory Controller 0 Channel Target Address Decoder Registers'
    class      = base peripheral
    cap 10[40] = PCI-Express 1 root endpoint max data 128(128)
                 max read 128

none24@pci0:127:15:4:	class=0x088000 rev=0x04 hdr=0x00 vendor=0x8086 device=0x0eac subvendor=0x15d9 subdevice=0x0635
    vendor     = 'Intel Corporation'
    device     = 'Xeon E7 v2/Xeon E5 v2/Core i7 Integrated Memory Controller 0 Channel Target Address Decoder Registers'
    class      = base peripheral
    cap 10[40] = PCI-Express 1 root endpoint max data 128(128)
                 max read 128

none25@pci0:127:15:5:	class=0x088000 rev=0x04 hdr=0x00 vendor=0x8086 device=0x0ead subvendor=0x15d9 subdevice=0x0635
    vendor     = 'Intel Corporation'
    device     = 'Xeon E7 v2/Xeon E5 v2/Core i7 Integrated Memory Controller 0 Channel Target Address Decoder Registers'
    class      = base peripheral
    cap 10[40] = PCI-Express 1 root endpoint max data 128(128)
                 max read 128

none26@pci0:127:16:0:	class=0x088000 rev=0x04 hdr=0x00 vendor=0x8086 device=0x0eb0 subvendor=0x15d9 subdevice=0x0635
    vendor     = 'Intel Corporation'
    device     = 'Xeon E7 v2/Xeon E5 v2/Core i7 Integrated Memory Controller 1 Channel 0-3 Thermal Control 0'
    class      = base peripheral
    cap 10[40] = PCI-Express 1 root endpoint max data 128(128)
                 max read 128

none27@pci0:127:16:1:	class=0x088000 rev=0x04 hdr=0x00 vendor=0x8086 device=0x0eb1 subvendor=0x15d9 subdevice=0x0635
    vendor     = 'Intel Corporation'
    device     = 'Xeon E7 v2/Xeon E5 v2/Core i7 Integrated Memory Controller 1 Channel 0-3 Thermal Control 1'
    class      = base peripheral
    cap 10[40] = PCI-Express 1 root endpoint max data 128(128)
                 max read 128

none28@pci0:127:16:2:	class=0x088000 rev=0x04 hdr=0x00 vendor=0x8086 device=0x0eb2 subvendor=0x15d9 subdevice=0x0635
    vendor     = 'Intel Corporation'
    device     = 'Xeon E7 v2/Xeon E5 v2/Core i7 Integrated Memory Controller 1 Channel 0-3 ERROR Registers 0'
    class      = base peripheral
    cap 10[40] = PCI-Express 1 root endpoint max data 128(128)
                 max read 128

none29@pci0:127:16:3:	class=0x088000 rev=0x04 hdr=0x00 vendor=0x8086 device=0x0eb3 subvendor=0x15d9 subdevice=0x0635
    vendor     = 'Intel Corporation'
    device     = 'Xeon E7 v2/Xeon E5 v2/Core i7 Integrated Memory Controller 1 Channel 0-3 ERROR Registers 1'
    class      = base peripheral
    cap 10[40] = PCI-Express 1 root endpoint max data 128(128)
                 max read 128

none30@pci0:127:16:4:	class=0x088000 rev=0x04 hdr=0x00 vendor=0x8086 device=0x0eb4 subvendor=0x15d9 subdevice=0x0635
    vendor     = 'Intel Corporation'
    device     = 'Xeon E7 v2/Xeon E5 v2/Core i7 Integrated Memory Controller 1 Channel 0-3 Thermal Control 2'
    class      = base peripheral
    cap 10[40] = PCI-Express 1 root endpoint max data 128(128)
                 max read 128

none31@pci0:127:16:5:	class=0x088000 rev=0x04 hdr=0x00 vendor=0x8086 device=0x0eb5 subvendor=0x15d9 subdevice=0x0635
    vendor     = 'Intel Corporation'
    device     = 'Xeon E7 v2/Xeon E5 v2/Core i7 Integrated Memory Controller 1 Channel 0-3 Thermal Control 3'
    class      = base peripheral
    cap 10[40] = PCI-Express 1 root endpoint max data 128(128)
                 max read 128

none32@pci0:127:16:6:	class=0x088000 rev=0x04 hdr=0x00 vendor=0x8086 device=0x0eb6 subvendor=0x15d9 subdevice=0x0635
    vendor     = 'Intel Corporation'
    device     = 'Xeon E7 v2/Xeon E5 v2/Core i7 Integrated Memory Controller 1 Channel 0-3 ERROR Registers 2'
    class      = base peripheral
    cap 10[40] = PCI-Express 1 root endpoint max data 128(128)
                 max read 128

none33@pci0:127:16:7:	class=0x088000 rev=0x04 hdr=0x00 vendor=0x8086 device=0x0eb7 subvendor=0x15d9 subdevice=0x0635
    vendor     = 'Intel Corporation'
    device     = 'Xeon E7 v2/Xeon E5 v2/Core i7 Integrated Memory Controller 1 Channel 0-3 ERROR Registers 3'
    class      = base peripheral
    cap 10[40] = PCI-Express 1 root endpoint max data 128(128)
                 max read 128

none34@pci0:127:19:0:	class=0x088000 rev=0x04 hdr=0x00 vendor=0x8086 device=0x0e1d subvendor=0x15d9 subdevice=0x0635
    vendor     = 'Intel Corporation'
    device     = 'Xeon E7 v2/Xeon E5 v2/Core i7 R2PCIe'
    class      = base peripheral

none35@pci0:127:19:1:	class=0x110100 rev=0x04 hdr=0x00 vendor=0x8086 device=0x0e34 subvendor=0x15d9 subdevice=0x0635
    vendor     = 'Intel Corporation'
    device     = 'Xeon E7 v2/Xeon E5 v2/Core i7 R2PCIe'
    class      = dasp
    subclass   = performance counters

none36@pci0:127:19:4:	class=0x088000 rev=0x04 hdr=0x00 vendor=0x8086 device=0x0e81 subvendor=0x15d9 subdevice=0x0635
    vendor     = 'Intel Corporation'
    device     = 'Xeon E7 v2/Xeon E5 v2/Core i7 QPI Ring Registers'
    class      = base peripheral

none37@pci0:127:19:5:	class=0x110100 rev=0x04 hdr=0x00 vendor=0x8086 device=0x0e36 subvendor=0x15d9 subdevice=0x0635
    vendor     = 'Intel Corporation'
    device     = 'Xeon E7 v2/Xeon E5 v2/Core i7 QPI Ring Performance Ring Monitoring'
    class      = dasp
    subclass   = performance counters

none38@pci0:127:22:0:	class=0x088000 rev=0x04 hdr=0x00 vendor=0x8086 device=0x0ec8 subvendor=0x15d9 subdevice=0x0635
    vendor     = 'Intel Corporation'
    device     = 'Xeon E7 v2/Xeon E5 v2/Core i7 System Address Decoder'
    class      = base peripheral

none39@pci0:127:22:1:	class=0x088000 rev=0x04 hdr=0x00 vendor=0x8086 device=0x0ec9 subvendor=0x15d9 subdevice=0x0635
    vendor     = 'Intel Corporation'
    device     = 'Xeon E7 v2/Xeon E5 v2/Core i7 Broadcast Registers'
    class      = base peripheral

none40@pci0:127:22:2:	class=0x088000 rev=0x04 hdr=0x00 vendor=0x8086 device=0x0eca subvendor=0x15d9 subdevice=0x0635
    vendor     = 'Intel Corporation'
    device     = 'Xeon E7 v2/Xeon E5 v2/Core i7 Broadcast Registers'
    class      = base peripheral

pcib12@pci0:128:1:0:	class=0x060400 rev=0x04 hdr=0x01 vendor=0x8086 device=0x0e02 subvendor=0x8086 subdevice=0x0e02
    vendor     = 'Intel Corporation'
    device     = 'Xeon E7 v2/Xeon E5 v2/Core i7 PCI Express Root Port 1a'
    class      = bridge
    subclass   = PCI-PCI
    cap 0d[40] = PCI Bridge subvendor=0x8086 subdevice=0x0e02
    cap 05[60] = MSI supports 2 messages, vector masks 
    cap 10[90] = PCI-Express 2 root port max data 128(256) ARI disabled
                 max read 128
                 link x0(x8) speed 0.0(8.0) ASPM disabled(L1)
    cap 01[e0] = powerspec 3  supports D0 D3  current D0
    ecap 000b[100] = Vendor [1] ID 0002 Rev 0 Length 12
    ecap 000d[110] = ACS 1
    ecap 0001[148] = AER 1 0 fatal 0 non-fatal 0 corrected
    ecap 000b[1d0] = Vendor [1] ID 0003 Rev 1 Length 10
    ecap 0019[250] = PCIe Sec 1 lane errors 0
    ecap 000b[280] = Vendor [1] ID 0005 Rev 3 Length 24

pcib13@pci0:128:3:0:	class=0x060400 rev=0x04 hdr=0x01 vendor=0x8086 device=0x0e08 subvendor=0x8086 subdevice=0x0e08
    vendor     = 'Intel Corporation'
    device     = 'Xeon E7 v2/Xeon E5 v2/Core i7 PCI Express Root Port 3a'
    class      = bridge
    subclass   = PCI-PCI
    cap 0d[40] = PCI Bridge subvendor=0x8086 subdevice=0x0e08
    cap 05[60] = MSI supports 2 messages, vector masks 
    cap 10[90] = PCI-Express 2 root port max data 128(256) ARI disabled
                 max read 128
                 link x0(x8) speed 0.0(8.0) ASPM disabled(L1)
    cap 01[e0] = powerspec 3  supports D0 D3  current D0
    ecap 000b[100] = Vendor [1] ID 0002 Rev 0 Length 12
    ecap 000d[110] = ACS 1
    ecap 0001[148] = AER 1 0 fatal 0 non-fatal 0 corrected
    ecap 000b[1d0] = Vendor [1] ID 0003 Rev 1 Length 10
    ecap 0019[250] = PCIe Sec 1 lane errors 0
    ecap 000b[280] = Vendor [1] ID 0005 Rev 3 Length 24

pcib14@pci0:128:3:2:	class=0x060400 rev=0x04 hdr=0x01 vendor=0x8086 device=0x0e0a subvendor=0x8086 subdevice=0x0e0a
    vendor     = 'Intel Corporation'
    device     = 'Xeon E7 v2/Xeon E5 v2/Core i7 PCI Express Root Port 3c'
    class      = bridge
    subclass   = PCI-PCI
    cap 0d[40] = PCI Bridge subvendor=0x8086 subdevice=0x0e0a
    cap 05[60] = MSI supports 2 messages, vector masks 
    cap 10[90] = PCI-Express 2 root port max data 128(256) ARI disabled
                 max read 128
                 link x0(x8) speed 0.0(8.0) ASPM disabled(L1)
    cap 01[e0] = powerspec 3  supports D0 D3  current D0
    ecap 000b[100] = Vendor [1] ID 0002 Rev 0 Length 12
    ecap 000d[110] = ACS 1
    ecap 0001[148] = AER 1 0 fatal 0 non-fatal 0 corrected
    ecap 000b[1d0] = Vendor [1] ID 0003 Rev 1 Length 10
    ecap 0019[250] = PCIe Sec 1 lane errors 0
    ecap 000b[280] = Vendor [1] ID 0005 Rev 3 Length 24

ioat8@pci0:128:4:0:	class=0x088000 rev=0x04 hdr=0x00 vendor=0x8086 device=0x0e20 subvendor=0x15d9 subdevice=0x0635
    vendor     = 'Intel Corporation'
    device     = 'Xeon E7 v2/Xeon E5 v2/Core i7 Crystal Beach DMA Channel 0'
    class      = base peripheral
    bar   [10] = type Memory, range 64, base 0x381ffff1c000, size 16384, enabled
    cap 11[80] = MSI-X supports 1 message, enabled
                 Table in map 0x10[0x2000], PBA in map 0x10[0x3000]
    cap 10[90] = PCI-Express 2 root endpoint max data 128(128)
                 max read 128
    cap 01[e0] = powerspec 3  supports D0 D3  current D0

ioat9@pci0:128:4:1:	class=0x088000 rev=0x04 hdr=0x00 vendor=0x8086 device=0x0e21 subvendor=0x15d9 subdevice=0x0635
    vendor     = 'Intel Corporation'
    device     = 'Xeon E7 v2/Xeon E5 v2/Core i7 Crystal Beach DMA Channel 1'
    class      = base peripheral
    bar   [10] = type Memory, range 64, base 0x381ffff18000, size 16384, enabled
    cap 11[80] = MSI-X supports 1 message, enabled
                 Table in map 0x10[0x2000], PBA in map 0x10[0x3000]
    cap 10[90] = PCI-Express 2 root endpoint max data 128(128)
                 max read 128
    cap 01[e0] = powerspec 3  supports D0 D3  current D0

ioat10@pci0:128:4:2:	class=0x088000 rev=0x04 hdr=0x00 vendor=0x8086 device=0x0e22 subvendor=0x15d9 subdevice=0x0635
    vendor     = 'Intel Corporation'
    device     = 'Xeon E7 v2/Xeon E5 v2/Core i7 Crystal Beach DMA Channel 2'
    class      = base peripheral
    bar   [10] = type Memory, range 64, base 0x381ffff14000, size 16384, enabled
    cap 11[80] = MSI-X supports 1 message, enabled
                 Table in map 0x10[0x2000], PBA in map 0x10[0x3000]
    cap 10[90] = PCI-Express 2 root endpoint max data 128(128)
                 max read 128
    cap 01[e0] = powerspec 3  supports D0 D3  current D0

ioat11@pci0:128:4:3:	class=0x088000 rev=0x04 hdr=0x00 vendor=0x8086 device=0x0e23 subvendor=0x15d9 subdevice=0x0635
    vendor     = 'Intel Corporation'
    device     = 'Xeon E7 v2/Xeon E5 v2/Core i7 Crystal Beach DMA Channel 3'
    class      = base peripheral
    bar   [10] = type Memory, range 64, base 0x381ffff10000, size 16384, enabled
    cap 11[80] = MSI-X supports 1 message, enabled
                 Table in map 0x10[0x2000], PBA in map 0x10[0x3000]
    cap 10[90] = PCI-Express 2 root endpoint max data 128(128)
                 max read 128
    cap 01[e0] = powerspec 3  supports D0 D3  current D0

ioat12@pci0:128:4:4:	class=0x088000 rev=0x04 hdr=0x00 vendor=0x8086 device=0x0e24 subvendor=0x15d9 subdevice=0x0635
    vendor     = 'Intel Corporation'
    device     = 'Xeon E7 v2/Xeon E5 v2/Core i7 Crystal Beach DMA Channel 4'
    class      = base peripheral
    bar   [10] = type Memory, range 64, base 0x381ffff0c000, size 16384, enabled
    cap 11[80] = MSI-X supports 1 message, enabled
                 Table in map 0x10[0x2000], PBA in map 0x10[0x3000]
    cap 10[90] = PCI-Express 2 root endpoint max data 128(128)
                 max read 128
    cap 01[e0] = powerspec 3  supports D0 D3  current D0

ioat13@pci0:128:4:5:	class=0x088000 rev=0x04 hdr=0x00 vendor=0x8086 device=0x0e25 subvendor=0x15d9 subdevice=0x0635
    vendor     = 'Intel Corporation'
    device     = 'Xeon E7 v2/Xeon E5 v2/Core i7 Crystal Beach DMA Channel 5'
    class      = base peripheral
    bar   [10] = type Memory, range 64, base 0x381ffff08000, size 16384, enabled
    cap 11[80] = MSI-X supports 1 message, enabled
                 Table in map 0x10[0x2000], PBA in map 0x10[0x3000]
    cap 10[90] = PCI-Express 2 root endpoint max data 128(128)
                 max read 128
    cap 01[e0] = powerspec 3  supports D0 D3  current D0

ioat14@pci0:128:4:6:	class=0x088000 rev=0x04 hdr=0x00 vendor=0x8086 device=0x0e26 subvendor=0x15d9 subdevice=0x0635
    vendor     = 'Intel Corporation'
    device     = 'Xeon E7 v2/Xeon E5 v2/Core i7 Crystal Beach DMA Channel 6'
    class      = base peripheral
    bar   [10] = type Memory, range 64, base 0x381ffff04000, size 16384, enabled
    cap 11[80] = MSI-X supports 1 message, enabled
                 Table in map 0x10[0x2000], PBA in map 0x10[0x3000]
    cap 10[90] = PCI-Express 2 root endpoint max data 128(128)
                 max read 128
    cap 01[e0] = powerspec 3  supports D0 D3  current D0

ioat15@pci0:128:4:7:	class=0x088000 rev=0x04 hdr=0x00 vendor=0x8086 device=0x0e27 subvendor=0x15d9 subdevice=0x0635
    vendor     = 'Intel Corporation'
    device     = 'Xeon E7 v2/Xeon E5 v2/Core i7 Crystal Beach DMA Channel 7'
    class      = base peripheral
    bar   [10] = type Memory, range 64, base 0x381ffff00000, size 16384, enabled
    cap 11[80] = MSI-X supports 1 message, enabled
                 Table in map 0x10[0x2000], PBA in map 0x10[0x3000]
    cap 10[90] = PCI-Express 2 root endpoint max data 128(128)
                 max read 128
    cap 01[e0] = powerspec 3  supports D0 D3  current D0

none41@pci0:128:5:0:	class=0x088000 rev=0x04 hdr=0x00 vendor=0x8086 device=0x0e28 subvendor=0x15d9 subdevice=0x0635
    vendor     = 'Intel Corporation'
    device     = 'Xeon E7 v2/Xeon E5 v2/Core i7 VTd/Memory Map/Misc'
    class      = base peripheral
    cap 10[40] = PCI-Express 2 root endpoint max data 128(128)
                 max read 128

none42@pci0:128:5:2:	class=0x088000 rev=0x04 hdr=0x00 vendor=0x8086 device=0x0e2a subvendor=0x15d9 subdevice=0x0635
    vendor     = 'Intel Corporation'
    device     = 'Xeon E7 v2/Xeon E5 v2/Core i7 IIO RAS'
    class      = base peripheral
    cap 10[40] = PCI-Express 2 root endpoint max data 128(128) RO NS
                 max read 128

ioapic1@pci0:128:5:4:	class=0x080020 rev=0x04 hdr=0x00 vendor=0x8086 device=0x0e2c subvendor=0x8086 subdevice=0x0e2c
    vendor     = 'Intel Corporation'
    device     = 'Xeon E7 v2/Xeon E5 v2/Core i7 IOAPIC'
    class      = base peripheral
    subclass   = interrupt controller
    bar   [10] = type Memory, range 32, base 0xfbf00000, size 4096, enabled
    cap 10[44] = PCI-Express 1 root endpoint max data 128(128)
                 max read 128
    cap 01[e0] = powerspec 3  supports D0 D3  current D0

none43@pci0:255:8:0:	class=0x088000 rev=0x04 hdr=0x00 vendor=0x8086 device=0x0e80 subvendor=0x15d9 subdevice=0x0635
    vendor     = 'Intel Corporation'
    device     = 'Xeon E7 v2/Xeon E5 v2/Core i7 QPI Link 0'
    class      = base peripheral

none44@pci0:255:9:0:	class=0x088000 rev=0x04 hdr=0x00 vendor=0x8086 device=0x0e90 subvendor=0x15d9 subdevice=0x0635
    vendor     = 'Intel Corporation'
    device     = 'Xeon E7 v2/Xeon E5 v2/Core i7 QPI Link 1'
    class      = base peripheral

none45@pci0:255:10:0:	class=0x088000 rev=0x04 hdr=0x00 vendor=0x8086 device=0x0ec0 subvendor=0x15d9 subdevice=0x0635
    vendor     = 'Intel Corporation'
    device     = 'Xeon E7 v2/Xeon E5 v2/Core i7 Power Control Unit 0'
    class      = base peripheral

none46@pci0:255:10:1:	class=0x088000 rev=0x04 hdr=0x00 vendor=0x8086 device=0x0ec1 subvendor=0x15d9 subdevice=0x0635
    vendor     = 'Intel Corporation'
    device     = 'Xeon E7 v2/Xeon E5 v2/Core i7 Power Control Unit 1'
    class      = base peripheral

none47@pci0:255:10:2:	class=0x088000 rev=0x04 hdr=0x00 vendor=0x8086 device=0x0ec2 subvendor=0x15d9 subdevice=0x0635
    vendor     = 'Intel Corporation'
    device     = 'Xeon E7 v2/Xeon E5 v2/Core i7 Power Control Unit 2'
    class      = base peripheral

none48@pci0:255:10:3:	class=0x088000 rev=0x04 hdr=0x00 vendor=0x8086 device=0x0ec3 subvendor=0x15d9 subdevice=0x0635
    vendor     = 'Intel Corporation'
    device     = 'Xeon E7 v2/Xeon E5 v2/Core i7 Power Control Unit 3'
    class      = base peripheral

none49@pci0:255:11:0:	class=0x088000 rev=0x04 hdr=0x00 vendor=0x8086 device=0x0e1e subvendor=0x15d9 subdevice=0x0635
    vendor     = 'Intel Corporation'
    device     = 'Xeon E7 v2/Xeon E5 v2/Core i7 UBOX Registers'
    class      = base peripheral

none50@pci0:255:11:3:	class=0x088000 rev=0x04 hdr=0x00 vendor=0x8086 device=0x0e1f subvendor=0x15d9 subdevice=0x0635
    vendor     = 'Intel Corporation'
    device     = 'Xeon E7 v2/Xeon E5 v2/Core i7 UBOX Registers'
    class      = base peripheral

none51@pci0:255:12:0:	class=0x088000 rev=0x04 hdr=0x00 vendor=0x8086 device=0x0ee0 subvendor=0x15d9 subdevice=0x0635
    vendor     = 'Intel Corporation'
    device     = 'Xeon E7 v2/Xeon E5 v2/Core i7 Unicast Registers'
    class      = base peripheral

none52@pci0:255:12:1:	class=0x088000 rev=0x04 hdr=0x00 vendor=0x8086 device=0x0ee2 subvendor=0x15d9 subdevice=0x0635
    vendor     = 'Intel Corporation'
    device     = 'Xeon E7 v2/Xeon E5 v2/Core i7 Unicast Registers'
    class      = base peripheral

none53@pci0:255:13:0:	class=0x088000 rev=0x04 hdr=0x00 vendor=0x8086 device=0x0ee1 subvendor=0x15d9 subdevice=0x0635
    vendor     = 'Intel Corporation'
    device     = 'Xeon E7 v2/Xeon E5 v2/Core i7 Unicast Registers'
    class      = base peripheral

none54@pci0:255:13:1:	class=0x088000 rev=0x04 hdr=0x00 vendor=0x8086 device=0x0ee3 subvendor=0x15d9 subdevice=0x0635
    vendor     = 'Intel Corporation'
    device     = 'Xeon E7 v2/Xeon E5 v2/Core i7 Unicast Registers'
    class      = base peripheral

none55@pci0:255:14:0:	class=0x088000 rev=0x04 hdr=0x00 vendor=0x8086 device=0x0ea0 subvendor=0x15d9 subdevice=0x0635
    vendor     = 'Intel Corporation'
    device     = 'Xeon E7 v2/Xeon E5 v2/Core i7 Home Agent 0'
    class      = base peripheral

none56@pci0:255:14:1:	class=0x110100 rev=0x04 hdr=0x00 vendor=0x8086 device=0x0e30 subvendor=0x15d9 subdevice=0x0635
    vendor     = 'Intel Corporation'
    device     = 'Xeon E7 v2/Xeon E5 v2/Core i7 Home Agent 0'
    class      = dasp
    subclass   = performance counters

none57@pci0:255:15:0:	class=0x088000 rev=0x04 hdr=0x00 vendor=0x8086 device=0x0ea8 subvendor=0x15d9 subdevice=0x0635
    vendor     = 'Intel Corporation'
    device     = 'Xeon E7 v2/Xeon E5 v2/Core i7 Integrated Memory Controller 0 Target Address/Thermal Registers'
    class      = base peripheral
    cap 10[40] = PCI-Express 1 root endpoint max data 128(128)
                 max read 128

none58@pci0:255:15:1:	class=0x088000 rev=0x04 hdr=0x00 vendor=0x8086 device=0x0e71 subvendor=0x15d9 subdevice=0x0635
    vendor     = 'Intel Corporation'
    device     = 'Xeon E7 v2/Xeon E5 v2/Core i7 Integrated Memory Controller 0 RAS Registers'
    class      = base peripheral
    cap 10[40] = PCI-Express 1 root endpoint max data 128(128)
                 max read 128

none59@pci0:255:15:2:	class=0x088000 rev=0x04 hdr=0x00 vendor=0x8086 device=0x0eaa subvendor=0x15d9 subdevice=0x0635
    vendor     = 'Intel Corporation'
    device     = 'Xeon E7 v2/Xeon E5 v2/Core i7 Integrated Memory Controller 0 Channel Target Address Decoder Registers'
    class      = base peripheral
    cap 10[40] = PCI-Express 1 root endpoint max data 128(128)
                 max read 128

none60@pci0:255:15:3:	class=0x088000 rev=0x04 hdr=0x00 vendor=0x8086 device=0x0eab subvendor=0x15d9 subdevice=0x0635
    vendor     = 'Intel Corporation'
    device     = 'Xeon E7 v2/Xeon E5 v2/Core i7 Integrated Memory Controller 0 Channel Target Address Decoder Registers'
    class      = base peripheral
    cap 10[40] = PCI-Express 1 root endpoint max data 128(128)
                 max read 128

none61@pci0:255:15:4:	class=0x088000 rev=0x04 hdr=0x00 vendor=0x8086 device=0x0eac subvendor=0x15d9 subdevice=0x0635
    vendor     = 'Intel Corporation'
    device     = 'Xeon E7 v2/Xeon E5 v2/Core i7 Integrated Memory Controller 0 Channel Target Address Decoder Registers'
    class      = base peripheral
    cap 10[40] = PCI-Express 1 root endpoint max data 128(128)
                 max read 128

none62@pci0:255:15:5:	class=0x088000 rev=0x04 hdr=0x00 vendor=0x8086 device=0x0ead subvendor=0x15d9 subdevice=0x0635
    vendor     = 'Intel Corporation'
    device     = 'Xeon E7 v2/Xeon E5 v2/Core i7 Integrated Memory Controller 0 Channel Target Address Decoder Registers'
    class      = base peripheral
    cap 10[40] = PCI-Express 1 root endpoint max data 128(128)
                 max read 128

none63@pci0:255:16:0:	class=0x088000 rev=0x04 hdr=0x00 vendor=0x8086 device=0x0eb0 subvendor=0x15d9 subdevice=0x0635
    vendor     = 'Intel Corporation'
    device     = 'Xeon E7 v2/Xeon E5 v2/Core i7 Integrated Memory Controller 1 Channel 0-3 Thermal Control 0'
    class      = base peripheral
    cap 10[40] = PCI-Express 1 root endpoint max data 128(128)
                 max read 128

none64@pci0:255:16:1:	class=0x088000 rev=0x04 hdr=0x00 vendor=0x8086 device=0x0eb1 subvendor=0x15d9 subdevice=0x0635
    vendor     = 'Intel Corporation'
    device     = 'Xeon E7 v2/Xeon E5 v2/Core i7 Integrated Memory Controller 1 Channel 0-3 Thermal Control 1'
    class      = base peripheral
    cap 10[40] = PCI-Express 1 root endpoint max data 128(128)
                 max read 128

none65@pci0:255:16:2:	class=0x088000 rev=0x04 hdr=0x00 vendor=0x8086 device=0x0eb2 subvendor=0x15d9 subdevice=0x0635
    vendor     = 'Intel Corporation'
    device     = 'Xeon E7 v2/Xeon E5 v2/Core i7 Integrated Memory Controller 1 Channel 0-3 ERROR Registers 0'
    class      = base peripheral
    cap 10[40] = PCI-Express 1 root endpoint max data 128(128)
                 max read 128

none66@pci0:255:16:3:	class=0x088000 rev=0x04 hdr=0x00 vendor=0x8086 device=0x0eb3 subvendor=0x15d9 subdevice=0x0635
    vendor     = 'Intel Corporation'
    device     = 'Xeon E7 v2/Xeon E5 v2/Core i7 Integrated Memory Controller 1 Channel 0-3 ERROR Registers 1'
    class      = base peripheral
    cap 10[40] = PCI-Express 1 root endpoint max data 128(128)
                 max read 128

none67@pci0:255:16:4:	class=0x088000 rev=0x04 hdr=0x00 vendor=0x8086 device=0x0eb4 subvendor=0x15d9 subdevice=0x0635
    vendor     = 'Intel Corporation'
    device     = 'Xeon E7 v2/Xeon E5 v2/Core i7 Integrated Memory Controller 1 Channel 0-3 Thermal Control 2'
    class      = base peripheral
    cap 10[40] = PCI-Express 1 root endpoint max data 128(128)
                 max read 128

none68@pci0:255:16:5:	class=0x088000 rev=0x04 hdr=0x00 vendor=0x8086 device=0x0eb5 subvendor=0x15d9 subdevice=0x0635
    vendor     = 'Intel Corporation'
    device     = 'Xeon E7 v2/Xeon E5 v2/Core i7 Integrated Memory Controller 1 Channel 0-3 Thermal Control 3'
    class      = base peripheral
    cap 10[40] = PCI-Express 1 root endpoint max data 128(128)
                 max read 128

none69@pci0:255:16:6:	class=0x088000 rev=0x04 hdr=0x00 vendor=0x8086 device=0x0eb6 subvendor=0x15d9 subdevice=0x0635
    vendor     = 'Intel Corporation'
    device     = 'Xeon E7 v2/Xeon E5 v2/Core i7 Integrated Memory Controller 1 Channel 0-3 ERROR Registers 2'
    class      = base peripheral
    cap 10[40] = PCI-Express 1 root endpoint max data 128(128)
                 max read 128

none70@pci0:255:16:7:	class=0x088000 rev=0x04 hdr=0x00 vendor=0x8086 device=0x0eb7 subvendor=0x15d9 subdevice=0x0635
    vendor     = 'Intel Corporation'
    device     = 'Xeon E7 v2/Xeon E5 v2/Core i7 Integrated Memory Controller 1 Channel 0-3 ERROR Registers 3'
    class      = base peripheral
    cap 10[40] = PCI-Express 1 root endpoint max data 128(128)
                 max read 128

none71@pci0:255:19:0:	class=0x088000 rev=0x04 hdr=0x00 vendor=0x8086 device=0x0e1d subvendor=0x15d9 subdevice=0x0635
    vendor     = 'Intel Corporation'
    device     = 'Xeon E7 v2/Xeon E5 v2/Core i7 R2PCIe'
    class      = base peripheral

none72@pci0:255:19:1:	class=0x110100 rev=0x04 hdr=0x00 vendor=0x8086 device=0x0e34 subvendor=0x15d9 subdevice=0x0635
    vendor     = 'Intel Corporation'
    device     = 'Xeon E7 v2/Xeon E5 v2/Core i7 R2PCIe'
    class      = dasp
    subclass   = performance counters

none73@pci0:255:19:4:	class=0x088000 rev=0x04 hdr=0x00 vendor=0x8086 device=0x0e81 subvendor=0x15d9 subdevice=0x0635
    vendor     = 'Intel Corporation'
    device     = 'Xeon E7 v2/Xeon E5 v2/Core i7 QPI Ring Registers'
    class      = base peripheral

none74@pci0:255:19:5:	class=0x110100 rev=0x04 hdr=0x00 vendor=0x8086 device=0x0e36 subvendor=0x15d9 subdevice=0x0635
    vendor     = 'Intel Corporation'
    device     = 'Xeon E7 v2/Xeon E5 v2/Core i7 QPI Ring Performance Ring Monitoring'
    class      = dasp
    subclass   = performance counters

none75@pci0:255:22:0:	class=0x088000 rev=0x04 hdr=0x00 vendor=0x8086 device=0x0ec8 subvendor=0x15d9 subdevice=0x0635
    vendor     = 'Intel Corporation'
    device     = 'Xeon E7 v2/Xeon E5 v2/Core i7 System Address Decoder'
    class      = base peripheral

none76@pci0:255:22:1:	class=0x088000 rev=0x04 hdr=0x00 vendor=0x8086 device=0x0ec9 subvendor=0x15d9 subdevice=0x0635
    vendor     = 'Intel Corporation'
    device     = 'Xeon E7 v2/Xeon E5 v2/Core i7 Broadcast Registers'
    class      = base peripheral

none77@pci0:255:22:2:	class=0x088000 rev=0x04 hdr=0x00 vendor=0x8086 device=0x0eca subvendor=0x15d9 subdevice=0x0635
    vendor     = 'Intel Corporation'
    device     = 'Xeon E7 v2/Xeon E5 v2/Core i7 Broadcast Registers'
    class      = base peripheral
