hostb0@pci0:0:0:0:	class=0x060000 card=0x590c8086 chip=0x590c8086 rev=0x02 hdr=0x00
    vendor     = 'Intel Corporation'
    device     = 'Xeon E3-1200 v6/7th Gen Core Processor Host Bridge/DRAM Registers'
    class      = bridge
    subclass   = HOST-PCI
    cap 09[e0] = vendor (length 16) Intel cap 0 version 1

vgapci0@pci0:0:2:0:	class=0x030000 card=0x591c8086 chip=0x591c8086 rev=0x02 hdr=0x00
    vendor     = 'Intel Corporation'
    device     = 'UHD Graphics 615'
    class      = display
    subclass   = VGA
    bar   [10] = type Memory, range 64, base 0xde000000, size 16777216, enabled
    bar   [18] = type Prefetchable Memory, range 64, base 0xc0000000, size 268435456, enabled
    bar   [20] = type I/O Port, range 32, base 0xf000, size 64, enabled
    cap 09[40] = vendor (length 12) Intel cap 0 version 1
    cap 10[70] = PCI-Express 2 root endpoint max data 128(128) FLR
    cap 05[ac] = MSI supports 1 message 
    cap 01[d0] = powerspec 2  supports D0 D3  current D0
    ecap 001b[100] = Process Address Space ID 1
    ecap 000f[200] = ATS 1
    ecap 0013[300] = Page Page Request 1

none0@pci0:0:4:0:	class=0x118000 card=0x19038086 chip=0x19038086 rev=0x02 hdr=0x00
    vendor     = 'Intel Corporation'
    device     = 'Xeon E3-1200 v5/E3-1500 v5/6th Gen Core Processor Thermal Subsystem'
    class      = dasp
    bar   [10] = type Memory, range 64, base 0xdf120000, size 32768, enabled
    cap 05[90] = MSI supports 1 message 
    cap 01[d0] = powerspec 3  supports D0 D3  current D0
    cap 09[e0] = vendor (length 12) Intel cap 0 version 1

none1@pci0:0:8:0:	class=0x088000 card=0x19118086 chip=0x19118086 rev=0x00 hdr=0x00
    vendor     = 'Intel Corporation'
    device     = 'Xeon E3-1200 v5/v6 / E3-1500 v5 / 6th/7th/8th Gen Core Processor Gaussian Mixture Model'
    class      = base peripheral
    bar   [10] = type Memory, range 64, base 0xdf13e000, size 4096, enabled
    cap 05[90] = MSI supports 1 message 
    cap 01[dc] = powerspec 2  supports D0 D3  current D0
    cap 13[f0] = PCI Advanced Features: FLR TP

xhci0@pci0:0:20:0:	class=0x0c0330 card=0x9d2f8086 chip=0x9d2f8086 rev=0x21 hdr=0x00
    vendor     = 'Intel Corporation'
    device     = 'Sunrise Point-LP USB 3.0 xHCI Controller'
    class      = serial bus
    subclass   = USB
    bar   [10] = type Memory, range 64, base 0xdf110000, size 65536, enabled
    cap 01[70] = powerspec 2  supports D0 D3  current D0
    cap 05[80] = MSI supports 8 messages, 64 bit enabled with 1 message

none2@pci0:0:20:2:	class=0x118000 card=0x9d318086 chip=0x9d318086 rev=0x21 hdr=0x00
    vendor     = 'Intel Corporation'
    device     = 'Sunrise Point-LP Thermal subsystem'
    class      = dasp
    bar   [10] = type Memory, range 64, base 0xdf13d000, size 4096, enabled
    cap 01[50] = powerspec 3  supports D0 D3  current D0
    cap 05[80] = MSI supports 1 message 

ig4iic0@pci0:0:21:0:	class=0x118000 card=0x9d608086 chip=0x9d608086 rev=0x21 hdr=0x00
    vendor     = 'Intel Corporation'
    device     = 'Sunrise Point-LP Serial IO I2C Controller'
    class      = dasp
    bar   [10] = type Memory, range 64, base 0xdf13c000, size 4096, enabled
    cap 01[80] = powerspec 3  supports D0 D3  current D0
    cap 09[90] = vendor (length 20) Intel cap 15 version 0

ig4iic1@pci0:0:21:1:	class=0x118000 card=0x9d618086 chip=0x9d618086 rev=0x21 hdr=0x00
    vendor     = 'Intel Corporation'
    device     = 'Sunrise Point-LP Serial IO I2C Controller'
    class      = dasp
    bar   [10] = type Memory, range 64, base 0xdf13b000, size 4096, enabled
    cap 01[80] = powerspec 3  supports D0 D3  current D0
    cap 09[90] = vendor (length 20) Intel cap 15 version 0

ig4iic2@pci0:0:21:2:	class=0x118000 card=0x9d628086 chip=0x9d628086 rev=0x21 hdr=0x00
    vendor     = 'Intel Corporation'
    device     = 'Sunrise Point-LP Serial IO I2C Controller'
    class      = dasp
    bar   [10] = type Memory, range 64, base 0xdf13a000, size 4096, enabled
    cap 01[80] = powerspec 3  supports D0 D3  current D0
    cap 09[90] = vendor (length 20) Intel cap 15 version 0

none3@pci0:0:22:0:	class=0x078000 card=0x9d3a8086 chip=0x9d3a8086 rev=0x21 hdr=0x00
    vendor     = 'Intel Corporation'
    device     = 'Sunrise Point-LP CSME HECI'
    class      = simple comms
    bar   [10] = type Memory, range 64, base 0xdf139000, size 4096, enabled
    cap 01[50] = powerspec 3  supports D0 D3  current D0
    cap 05[8c] = MSI supports 1 message, 64 bit 

ahci0@pci0:0:23:0:	class=0x010601 card=0x9d038086 chip=0x9d038086 rev=0x21 hdr=0x00
    vendor     = 'Intel Corporation'
    device     = 'Sunrise Point-LP SATA Controller [AHCI mode]'
    class      = mass storage
    subclass   = SATA
    bar   [10] = type Memory, range 32, base 0xdf130000, size 8192, enabled
    bar   [14] = type Memory, range 32, base 0xdf138000, size 256, enabled
    bar   [18] = type I/O Port, range 32, base 0xf090, size 8, enabled
    bar   [1c] = type I/O Port, range 32, base 0xf080, size 4, enabled
    bar   [20] = type I/O Port, range 32, base 0xf060, size 32, enabled
    bar   [24] = type Memory, range 32, base 0xdf137000, size 2048, enabled
    cap 05[80] = MSI supports 1 message enabled with 1 message
    cap 01[70] = powerspec 3  supports D0 D3  current D0
    cap 12[a8] = SATA Index-Data Pair

pcib1@pci0:0:28:0:	class=0x060400 card=0x9d158086 chip=0x9d158086 rev=0xf1 hdr=0x01
    vendor     = 'Intel Corporation'
    device     = 'Sunrise Point-LP PCI Express Root Port'
    class      = bridge
    subclass   = PCI-PCI
    cap 10[40] = PCI-Express 2 root port max data 128(256) ARI disabled
                 link x1(x1) speed 2.5(8.0) ASPM L1(L0s/L1)
                 slot 9 power limit 100 mW
    cap 05[80] = MSI supports 1 message 
    cap 0d[90] = PCI Bridge card=0x9d158086
    cap 01[a0] = powerspec 3  supports D0 D3  current D0
    ecap 0001[100] = AER 1 0 fatal 0 non-fatal 0 corrected
    ecap 000d[140] = ACS 1
    ecap 0019[220] = PCIe Sec 1 lane errors 0

none4@pci0:0:30:0:	class=0x118000 card=0x9d278086 chip=0x9d278086 rev=0x21 hdr=0x00
    vendor     = 'Intel Corporation'
    device     = 'Sunrise Point-LP Serial IO UART Controller'
    class      = dasp
    bar   [10] = type Memory, range 64, base 0xdf136000, size 4096, enabled
    cap 01[80] = powerspec 3  supports D0 D3  current D0
    cap 09[90] = vendor (length 20) Intel cap 15 version 0

none5@pci0:0:30:3:	class=0x118000 card=0x9d2a8086 chip=0x9d2a8086 rev=0x21 hdr=0x00
    vendor     = 'Intel Corporation'
    device     = 'Sunrise Point-LP Serial IO SPI Controller'
    class      = dasp
    bar   [10] = type Memory, range 64, base 0xdf135000, size 4096, enabled
    cap 01[80] = powerspec 3  supports D0 D3  current D0
    cap 09[90] = vendor (length 20) Intel cap 15 version 0

sdhci_pci0@pci0:0:30:4:	class=0x080501 card=0x9d2b8086 chip=0x9d2b8086 rev=0x21 hdr=0x00
    vendor     = 'Intel Corporation'
    class      = base peripheral
    subclass   = SD host controller
    bar   [10] = type Memory, range 64, base 0xdf134000, size 4096, enabled
    cap 01[80] = powerspec 3  supports D0 D3  current D0
    cap 09[90] = vendor (length 20) Intel cap 15 version 0

sdhci_pci1@pci0:0:30:6:	class=0x080501 card=0x9d2d8086 chip=0x9d2d8086 rev=0x21 hdr=0x00
    vendor     = 'Intel Corporation'
    device     = 'Sunrise Point-LP Secure Digital IO Controller'
    class      = base peripheral
    subclass   = SD host controller
    bar   [10] = type Memory, range 64, base 0xdf133000, size 4096, enabled
    cap 01[80] = powerspec 3  supports D0 D3  current D0
    cap 09[90] = vendor (length 20) Intel cap 15 version 0

isab0@pci0:0:31:0:	class=0x060100 card=0x9d4b8086 chip=0x9d4b8086 rev=0x21 hdr=0x00
    vendor     = 'Intel Corporation'
    class      = bridge
    subclass   = PCI-ISA

none6@pci0:0:31:2:	class=0x058000 card=0x9d218086 chip=0x9d218086 rev=0x21 hdr=0x00
    vendor     = 'Intel Corporation'
    device     = 'Sunrise Point-LP PMC'
    class      = memory
    bar   [10] = type Memory, range 32, base 0xdf12c000, size 16384, enabled

hdac0@pci0:0:31:3:	class=0x040380 card=0x9d718086 chip=0x9d718086 rev=0x21 hdr=0x00
    vendor     = 'Intel Corporation'
    device     = 'Sunrise Point-LP HD Audio'
    class      = multimedia
    subclass   = HDA
    bar   [10] = type Memory, range 64, base 0xdf128000, size 16384, enabled
    bar   [20] = type Memory, range 64, base 0xdf100000, size 65536, enabled
    cap 01[50] = powerspec 3  supports D0 D3  current D0
    cap 05[60] = MSI supports 1 message, 64 bit enabled with 1 message

none7@pci0:0:31:4:	class=0x0c0500 card=0x9d238086 chip=0x9d238086 rev=0x21 hdr=0x00
    vendor     = 'Intel Corporation'
    device     = 'Sunrise Point-LP SMBus'
    class      = serial bus
    subclass   = SMBus
    bar   [10] = type Memory, range 64, base 0xdf132000, size 256, enabled
    bar   [20] = type I/O Port, range 32, base 0xf040, size 32, enabled

iwm0@pci0:1:0:0:	class=0x028000 card=0x90108086 chip=0x095a8086 rev=0x59 hdr=0x00
    vendor     = 'Intel Corporation'
    device     = 'Wireless 7265'
    class      = network
    bar   [10] = type Memory, range 64, base 0xdf000000, size 8192, enabled
    cap 01[c8] = powerspec 3  supports D0 D3  current D0
    cap 05[d0] = MSI supports 1 message, 64 bit enabled with 1 message
    cap 10[40] = PCI-Express 2 endpoint max data 128(128) FLR RO NS
                 link x1(x1) speed 2.5(2.5) ASPM L1(L1) ClockPM enabled
    ecap 0001[100] = AER 1 0 fatal 0 non-fatal 1 corrected
    ecap 0003[140] = Serial 1 b89a2affff3f6123
    ecap 0018[14c] = LTR 1
    ecap 001e[154] = L1 PM Substates 1
