hostb0@pci0:0:0:0:	class=0x060000 card=0x53328086 chip=0x34058086 rev=0x13 hdr=0x00
    vendor     = 'Intel Corporation'
    device     = '5520/5500/X58 I/O Hub to ESI Port'
    class      = bridge
    subclass   = HOST-PCI
    cap 00[40] = unknown

pcib1@pci0:0:1:0:	class=0x060400 card=0x53328086 chip=0x34088086 rev=0x13 hdr=0x01
    vendor     = 'Intel Corporation'
    device     = '5520/5500/X58 I/O Hub PCI Express Root Port 1'
    class      = bridge
    subclass   = PCI-PCI
    cap 0d[40] = PCI Bridge card=0x53328086
    cap 05[60] = MSI supports 2 messages, vector masks 
    cap 10[90] = PCI-Express 2 root port max data 128(256) ARI disabled
                 link x1(x2) speed 5.0(5.0)
    cap 01[e0] = powerspec 3  supports D0 D3  current D0
    ecap 0001[100] = AER 1 0 fatal 0 non-fatal 1 corrected
    ecap 000d[150] = ACS 1
    ecap 000b[160] = Vendor 0pcib2@pci0:0:2:0:	class=0x060400 card=0x53328086 chip=0x34098086 rev=0x13 hdr=0x01
    vendor     = 'Intel Corporation'
    device     = '5520/5500/X58 I/O Hub PCI Express Root Port 2'
    class      = bridge
    subclass   = PCI-PCI
    cap 0d[40] = PCI Bridge card=0x53328086
    cap 05[60] = MSI supports 2 messages, vector masks 
    cap 10[90] = PCI-Express 2 root port max data 128(256) ARI disabled
                 link x1(x2) speed 5.0(5.0)
    cap 01[e0] = powerspec 3  supports D0 D3  current D0
    ecap 0001[100] = AER 1 0 fatal 0 non-fatal 1 corrected
    ecap 000d[150] = ACS 1

pcib3@pci0:0:3:0:	class=0x060400 card=0x53328086 chip=0x340a8086 rev=0x13 hdr=0x01
    vendor     = 'Intel Corporation'
    device     = '5520/5500/X58 I/O Hub PCI Express Root Port 3'
    class      = bridge
    subclass   = PCI-PCI
    cap 0d[40] = PCI Bridge card=0x53328086
    cap 05[60] = MSI supports 2 messages, vector masks 
    cap 10[90] = PCI-Express 2 root port max data 128(256) ARI disabled
                 link x16(x16) speed 2.5(5.0) ASPM L0s(L0s/L1)
                 slot 192 power limit 242000 mW Attn Button PC(off) MRL(closed) EI(disengaged)
    cap 01[e0] = powerspec 3  supports D0 D3  current D0
    ecap 0001[100] = AER 1 0 fatal 0 non-fatal 0 corrected
    ecap 000d[150] = ACS 1
    ecap 000b[160] = Vendor 0pcib4@pci0:0:7:0:	class=0x060400 card=0x53328086 chip=0x340e8086 rev=0x13 hdr=0x01
    vendor     = 'Intel Corporation'
    device     = '5520/5500/X58 I/O Hub PCI Express Root Port 7'
    class      = bridge
    subclass   = PCI-PCI
    cap 0d[40] = PCI Bridge card=0x53328086
    cap 05[60] = MSI supports 2 messages, vector masks 
    cap 10[90] = PCI-Express 2 root port max data 128(256) ARI disabled
                 link x0(x16) speed 0.0(5.0) ASPM disabled(L0s/L1)
                 slot 128 power limit 242000 mW Attn Button PC(off) MRL(closed) EI(disengaged)
    cap 01[e0] = powerspec 3  supports D0 D3  current D0
    ecap 0001[100] = AER 1 0 fatal 0 non-fatal 0 corrected
    ecap 000d[150] = ACS 1
    ecap 000b[160] = Vendor 0none0@pci0:0:16:0:	class=0x080000 card=0x00000000 chip=0x34258086 rev=0x13 hdr=0x00
    vendor     = 'Intel Corporation'
    device     = '7500/5520/5500/X58 Physical and Link Layer Registers Port 0'
    class      = base peripheral
    subclass   = interrupt controller
    cap 09[50] = vendor (length 255) Intel cap 15 version 0

none1@pci0:0:16:1:	class=0x080000 card=0x00000000 chip=0x34268086 rev=0x13 hdr=0x00
    vendor     = 'Intel Corporation'
    device     = '7500/5520/5500/X58 Routing and Protocol Layer Registers Port 0'
    class      = base peripheral
    subclass   = interrupt controller

none2@pci0:0:20:0:	class=0x080000 card=0x00000000 chip=0x342e8086 rev=0x13 hdr=0x00
    vendor     = 'Intel Corporation'
    device     = '7500/5520/5500/X58 I/O Hub System Management Registers'
    class      = base peripheral
    subclass   = interrupt controller
    cap 10[40] = PCI-Express 2 root endpoint max data 128(128)
                 link x0(x0) ASPM disabled(L0s)

none3@pci0:0:20:1:	class=0x080000 card=0x00000000 chip=0x34228086 rev=0x13 hdr=0x00
    vendor     = 'Intel Corporation'
    device     = '7500/5520/5500/X58 I/O Hub GPIO and Scratch Pad Registers'
    class      = base peripheral
    subclass   = interrupt controller
    cap 10[40] = PCI-Express 2 root endpoint max data 128(128)
                 link x0(x0) ASPM disabled(L0s)

none4@pci0:0:20:2:	class=0x080000 card=0x00000000 chip=0x34238086 rev=0x13 hdr=0x00
    vendor     = 'Intel Corporation'
    device     = '7500/5520/5500/X58 I/O Hub Control Status and RAS Registers'
    class      = base peripheral
    subclass   = interrupt controller
    cap 10[40] = PCI-Express 2 root endpoint max data 128(128)
                 link x0(x0) ASPM disabled(L0s)

none5@pci0:0:20:3:	class=0x080000 card=0x00000000 chip=0x34388086 rev=0x13 hdr=0x00
    vendor     = 'Intel Corporation'
    device     = '7500/5520/5500/X58 I/O Hub Throttle Registers'
    class      = base peripheral
    subclass   = interrupt controller

em0@pci0:0:25:0:	class=0x020000 card=0x53328086 chip=0x10cd8086 rev=0x00 hdr=0x00
    vendor     = 'Intel Corporation'
    device     = '82567LF-2 Gigabit Network Connection'
    class      = network
    subclass   = ethernet
    bar   [10] = type Memory, range 32, base 0xd3500000, size 131072, enabled
    bar   [14] = type Memory, range 32, base 0xd3523000, size 4096, enabled
    bar   [18] = type I/O Port, range 32, base 0x6100, size 32, enabled
    cap 01[c8] = powerspec 2  supports D0 D3  current D0
    cap 05[d0] = MSI supports 1 message, 64 bit enabled with 1 message

uhci0@pci0:0:26:0:	class=0x0c0300 card=0x53328086 chip=0x3a378086 rev=0x00 hdr=0x00
    vendor     = 'Intel Corporation'
    device     = '82801JI (ICH10 Family) USB UHCI Controller'
    class      = serial bus
    subclass   = USB
    bar   [20] = type I/O Port, range 32, base 0x60e0, size 32, enabled
    cap 13[50] = PCI Advanced Features: FLR TP

uhci1@pci0:0:26:1:	class=0x0c0300 card=0x53328086 chip=0x3a388086 rev=0x00 hdr=0x00
    vendor     = 'Intel Corporation'
    device     = '82801JI (ICH10 Family) USB UHCI Controller'
    class      = serial bus
    subclass   = USB
    bar   [20] = type I/O Port, range 32, base 0x60c0, size 32, enabled
    cap 13[50] = PCI Advanced Features: FLR TP

uhci2@pci0:0:26:2:	class=0x0c0300 card=0x53328086 chip=0x3a398086 rev=0x00 hdr=0x00
    vendor     = 'Intel Corporation'
    device     = '82801JI (ICH10 Family) USB UHCI Controller'
    class      = serial bus
    subclass   = USB
    bar   [20] = type I/O Port, range 32, base 0x60a0, size 32, enabled
    cap 13[50] = PCI Advanced Features: FLR TP

ehci0@pci0:0:26:7:	class=0x0c0320 card=0x53328086 chip=0x3a3c8086 rev=0x00 hdr=0x00
    vendor     = 'Intel Corporation'
    device     = '82801JI (ICH10 Family) USB2 EHCI Controller'
    class      = serial bus
    subclass   = USB
    bar   [10] = type Memory, range 32, base 0xd3522000, size 1024, enabled
    cap 01[50] = powerspec 2  supports D0 D3  current D0
    cap 0a[58] = EHCI Debug Port at offset 0xa0 in map 0x14

hdac0@pci0:0:27:0:	class=0x040300 card=0x00418086 chip=0x3a3e8086 rev=0x00 hdr=0x00
    vendor     = 'Intel Corporation'
    device     = '82801JI (ICH10 Family) HD Audio Controller'
    class      = multimedia
    subclass   = HDA
    bar   [10] = type Memory, range 64, base 0xf0000000, size 16384, enabled
    cap 01[50] = powerspec 2  supports D0 D3  current D0
    cap 05[60] = MSI supports 1 message, 64 bit enabled with 1 message
    cap 10[70] = PCI-Express 1 root endpoint max data 128(128) NS
    ecap 0002[100] = VC 1 max VC1
    ecap 0005[130] = Root Complex Link Declaration 1

pcib5@pci0:0:28:0:	class=0x060400 card=0x53328086 chip=0x3a408086 rev=0x00 hdr=0x01
    vendor     = 'Intel Corporation'
    device     = '82801JI (ICH10 Family) PCI Express Root Port 1'
    class      = bridge
    subclass   = PCI-PCI
    cap 10[40] = PCI-Express 1 root port max data 128(128)
                 link x0(x1) speed 0.0(2.5) ASPM L0s/L1(L0s/L1)
                 slot 5 power limit 100 mW HotPlug(empty) surprise
    cap 05[80] = MSI supports 1 message 
    cap 0d[90] = PCI Bridge card=0x53328086
    cap 01[a0] = powerspec 2  supports D0 D3  current D0
    ecap 0002[100] = VC 1 max VC0
    ecap 0005[180] = Root Complex Link Declaration 1

pcib6@pci0:0:28:1:	class=0x060400 card=0x53328086 chip=0x3a428086 rev=0x00 hdr=0x01
    vendor     = 'Intel Corporation'
    device     = '82801JI (ICH10 Family) PCI Express Port 2'
    class      = bridge
    subclass   = PCI-PCI
    cap 10[40] = PCI-Express 1 root port max data 128(128)
                 link x0(x1) speed 0.0(2.5) ASPM L0s/L1(L0s/L1)
                 slot 1 power limit 100 mW HotPlug(empty) surprise
    cap 05[80] = MSI supports 1 message 
    cap 0d[90] = PCI Bridge card=0x53328086
    cap 01[a0] = powerspec 2  supports D0 D3  current D0
    ecap 0002[100] = VC 1 max VC0
    ecap 0005[180] = Root Complex Link Declaration 1

pcib7@pci0:0:28:2:	class=0x060400 card=0x53328086 chip=0x3a448086 rev=0x00 hdr=0x01
    vendor     = 'Intel Corporation'
    device     = '82801JI (ICH10 Family) PCI Express Root Port 3'
    class      = bridge
    subclass   = PCI-PCI
    cap 10[40] = PCI-Express 1 root port max data 128(128)
                 link x1(x1) speed 2.5(2.5) ASPM L0s/L1(L0s/L1)
    cap 05[80] = MSI supports 1 message 
    cap 0d[90] = PCI Bridge card=0x53328086
    cap 01[a0] = powerspec 2  supports D0 D3  current D0
    ecap 0002[100] = VC 1 max VC0
    ecap 0005[180] = Root Complex Link Declaration 1

pcib8@pci0:0:28:3:	class=0x060400 card=0x53328086 chip=0x3a468086 rev=0x00 hdr=0x01
    vendor     = 'Intel Corporation'
    device     = '82801JI (ICH10 Family) PCI Express Root Port 4'
    class      = bridge
    subclass   = PCI-PCI
    cap 10[40] = PCI-Express 1 root port max data 128(128)
                 link x1(x1) speed 2.5(2.5) ASPM disabled(L0s/L1)
    cap 05[80] = MSI supports 1 message 
    cap 0d[90] = PCI Bridge card=0x53328086
    cap 01[a0] = powerspec 2  supports D0 D3  current D0
    ecap 0002[100] = VC 1 max VC0
    ecap 0005[180] = Root Complex Link Declaration 1

uhci3@pci0:0:29:0:	class=0x0c0300 card=0x53328086 chip=0x3a348086 rev=0x00 hdr=0x00
    vendor     = 'Intel Corporation'
    device     = '82801JI (ICH10 Family) USB UHCI Controller'
    class      = serial bus
    subclass   = USB
    bar   [20] = type I/O Port, range 32, base 0x6080, size 32, enabled
    cap 13[50] = PCI Advanced Features: FLR TP

uhci4@pci0:0:29:1:	class=0x0c0300 card=0x53328086 chip=0x3a358086 rev=0x00 hdr=0x00
    vendor     = 'Intel Corporation'
    device     = '82801JI (ICH10 Family) USB UHCI Controller'
    class      = serial bus
    subclass   = USB
    bar   [20] = type I/O Port, range 32, base 0x6060, size 32, enabled
    cap 13[50] = PCI Advanced Features: FLR TP

uhci5@pci0:0:29:2:	class=0x0c0300 card=0x53328086 chip=0x3a368086 rev=0x00 hdr=0x00
    vendor     = 'Intel Corporation'
    device     = '82801JI (ICH10 Family) USB UHCI Controller'
    class      = serial bus
    subclass   = USB
    bar   [20] = type I/O Port, range 32, base 0x6040, size 32, enabled
    cap 13[50] = PCI Advanced Features: FLR TP

ehci1@pci0:0:29:7:	class=0x0c0320 card=0x53328086 chip=0x3a3a8086 rev=0x00 hdr=0x00
    vendor     = 'Intel Corporation'
    device     = '82801JI (ICH10 Family) USB2 EHCI Controller'
    class      = serial bus
    subclass   = USB
    bar   [10] = type Memory, range 32, base 0xd3521000, size 1024, enabled
    cap 01[50] = powerspec 2  supports D0 D3  current D0
    cap 0a[58] = EHCI Debug Port at offset 0xa0 in map 0x14

pcib9@pci0:0:30:0:	class=0x060401 card=0x53328086 chip=0x244e8086 rev=0x90 hdr=0x01
    vendor     = 'Intel Corporation'
    device     = '82801 PCI Bridge'
    class      = bridge
    subclass   = PCI-PCI
    cap 0d[50] = PCI Bridge card=0x53328086

isab0@pci0:0:31:0:	class=0x060100 card=0x53328086 chip=0x3a168086 rev=0x00 hdr=0x00
    vendor     = 'Intel Corporation'
    device     = '82801JIR (ICH10R) LPC Interface Controller'
    class      = bridge
    subclass   = PCI-ISA
    cap 09[e0] = vendor (length 12) Intel cap 1 version 0
		 features: SATA RAID-5, 4 PCI-e x1 slots

ahci2@pci0:0:31:2:	class=0x010601 card=0x53328086 chip=0x3a228086 rev=0x00 hdr=0x00
    vendor     = 'Intel Corporation'
    device     = '82801JI (ICH10 Family) SATA AHCI Controller'
    class      = mass storage
    subclass   = SATA
    bar   [10] = type I/O Port, range 32, base 0x6128, size 8, enabled
    bar   [14] = type I/O Port, range 32, base 0x6134, size 4, enabled
    bar   [18] = type I/O Port, range 32, base 0x6120, size 8, enabled
    bar   [1c] = type I/O Port, range 32, base 0x6130, size 4, enabled
    bar   [20] = type I/O Port, range 32, base 0x6020, size 32, enabled
    bar   [24] = type Memory, range 32, base 0xd3520000, size 2048, enabled
    cap 05[80] = MSI supports 16 messages enabled with 16 messages
    cap 01[70] = powerspec 3  supports D0 D3  current D0
    cap 12[a8] = SATA Index-Data Pair

none6@pci0:0:31:3:	class=0x0c0500 card=0x53328086 chip=0x3a308086 rev=0x00 hdr=0x00
    vendor     = 'Intel Corporation'
    device     = '82801JI (ICH10 Family) SMBus Controller'
    class      = serial bus
    subclass   = SMBus
    bar   [10] = type Memory, range 64, base 0xf0004000, size 256, enabled
    bar   [20] = type I/O Port, range 32, base 0x6000, size 32, enabled

xhci0@pci0:1:0:0:	class=0x0c0330 card=0x53328086 chip=0x01941033 rev=0x03 hdr=0x00
    vendor     = 'NEC Corporation'
    device     = 'uPD720200 USB 3.0 Host Controller'
    class      = serial bus
    subclass   = USB
    bar   [10] = type Memory, range 64, base 0xd3400000, size 8192, enabled
    cap 01[50] = powerspec 3  supports D0 D3  current D0
    cap 05[70] = MSI supports 8 messages, 64 bit enabled with 1 message
    cap 11[90] = MSI-X supports 8 messages
                 Table in map 0x10[0x1000], PBA in map 0x10[0x1080]
    cap 10[a0] = PCI-Express 2 endpoint max data 128(128) NS
                 link x1(x1) speed 5.0(5.0) ASPM disabled(L0s/L1)
    ecap 0001[100] = AER 1 0 fatal 0 non-fatal 0 corrected
    ecap 0003[140] = Serial 1 ffffffffffffffff
    ecap 0018[150] = LTR 1

ahci0@pci0:2:0:0:	class=0x010601 card=0x53328086 chip=0x91231b4b rev=0x10 hdr=0x00
    vendor     = 'Marvell Technology Group Ltd.'
    device     = '88SE9123 PCIe SATA 6.0 Gb/s controller'
    class      = mass storage
    subclass   = SATA
    bar   [10] = type I/O Port, range 32, base 0x5038, size 8, enabled
    bar   [14] = type I/O Port, range 32, base 0x504c, size 4, enabled
    bar   [18] = type I/O Port, range 32, base 0x5030, size 8, enabled
    bar   [1c] = type I/O Port, range 32, base 0x5048, size 4, enabled
    bar   [20] = type I/O Port, range 32, base 0x5010, size 16, enabled
    bar   [24] = type Memory, range 32, base 0xd3300000, size 2048, enabled
    cap 01[40] = powerspec 3  supports D0 D3  current D0
    cap 05[50] = MSI supports 1 message enabled with 1 message
    cap 10[70] = PCI-Express 2 legacy endpoint max data 128(512) RO
                 link x1(x1) speed 5.0(5.0) ASPM disabled(L0s/L1)
    ecap 0001[100] = AER 1 0 fatal 0 non-fatal 1 corrected

atapci0@pci0:2:0:1:	class=0x01018f card=0x53328086 chip=0x91a41b4b rev=0x11 hdr=0x00
    vendor     = 'Marvell Technology Group Ltd.'
    device     = '88SE912x IDE Controller'
    class      = mass storage
    subclass   = ATA
    bar   [10] = type I/O Port, range 32, base 0x5028, size 8, enabled
    bar   [14] = type I/O Port, range 32, base 0x5044, size 4, enabled
    bar   [18] = type I/O Port, range 32, base 0x5020, size 8, enabled
    bar   [1c] = type I/O Port, range 32, base 0x5040, size 4, enabled
    bar   [20] = type I/O Port, range 32, base 0x5000, size 16, enabled
    bar   [24] = type Memory, range 32, base 0xd3301000, size 16, enabled
    cap 01[40] = powerspec 3  supports D0 D3  current D0
    cap 05[50] = MSI supports 1 message 
    cap 10[70] = PCI-Express 2 legacy endpoint max data 128(512) RO
                 link x1(x1) speed 5.0(5.0) ASPM disabled(L0s/L1)
    ecap 0001[100] = AER 1 0 fatal 0 non-fatal 1 corrected

vgapci0@pci0:3:0:0:	class=0x030000 card=0x040110b0 chip=0x061510de rev=0xa2 hdr=0x00
    vendor     = 'NVIDIA Corporation'
    device     = 'G92 [GeForce GTS 250]'
    class      = display
    subclass   = VGA
    bar   [10] = type Memory, range 32, base 0xd2000000, size 16777216, enabled
    bar   [14] = type Prefetchable Memory, range 64, base 0xe0000000, size 268435456, enabled
    bar   [1c] = type Memory, range 64, base 0xd0000000, size 33554432, enabled
    bar   [24] = type I/O Port, range 32, base 0x4000, size 128, enabled
    cap 01[60] = powerspec 3  supports D0 D3  current D0
    cap 05[68] = MSI supports 1 message, 64 bit 
    cap 10[78] = PCI-Express 1 endpoint max data 128(128) RO NS
                 link x16(x16) speed 2.5(2.5) ASPM disabled(L0s/L1)
    ecap 0002[100] = VC 1 max VC0
    ecap 0004[128] = Power Budgeting 1
    ecap 000b[600] = Vendor 1 ID 1

em1@pci0:7:0:0:	class=0x020000 card=0x53328086 chip=0x10d38086 rev=0x00 hdr=0x00
    vendor     = 'Intel Corporation'
    device     = '82574L Gigabit Network Connection'
    class      = network
    subclass   = ethernet
    bar   [10] = type Memory, range 32, base 0xd3200000, size 131072, enabled
    bar   [18] = type I/O Port, range 32, base 0x3000, size 32, enabled
    bar   [1c] = type Memory, range 32, base 0xd3220000, size 16384, enabled
    cap 01[c8] = powerspec 2  supports D0 D3  current D0
    cap 05[d0] = MSI supports 1 message, 64 bit 
    cap 10[e0] = PCI-Express 1 endpoint max data 128(256) RO NS
                 link x1(x1) speed 2.5(2.5) ASPM disabled(L0s/L1)
    cap 11[a0] = MSI-X supports 5 messages, enabled
                 Table in map 0x1c[0x0], PBA in map 0x1c[0x2000]
    ecap 0001[100] = AER 1 0 fatal 0 non-fatal 2 corrected
    ecap 0003[140] = Serial 1 e06995ffff57cb3b

atapci1@pci0:8:0:0:	class=0x01018f card=0x53328086 chip=0x612111ab rev=0xb2 hdr=0x00
    vendor     = 'Marvell Technology Group Ltd.'
    device     = '88SE6111/6121 SATA II / PATA Controller'
    class      = mass storage
    subclass   = ATA
    bar   [10] = type I/O Port, range 32, base 0x2018, size 8, enabled
    bar   [14] = type I/O Port, range 32, base 0x2024, size 4, enabled
    bar   [18] = type I/O Port, range 32, base 0x2010, size 8, enabled
    bar   [1c] = type I/O Port, range 32, base 0x2020, size 4, enabled
    bar   [20] = type I/O Port, range 32, base 0x2000, size 16, enabled
    bar   [24] = type Memory, range 32, base 0xd3100000, size 1024, enabled
    cap 01[48] = powerspec 2  supports D0 D1 D3  current D0
    cap 05[50] = MSI supports 1 message 
    cap 10[e0] = PCI-Express 1 legacy endpoint max data 128(128)
                 link x1(x1) speed 2.5(2.5) ASPM disabled(L0s)
    ecap 0001[100] = AER 1 0 fatal 0 non-fatal 1 corrected

em2@pci0:9:2:0:	class=0x020000 card=0x11768086 chip=0x10768086 rev=0x00 hdr=0x00
    vendor     = 'Intel Corporation'
    device     = '82541GI Gigabit Ethernet Controller'
    class      = network
    subclass   = ethernet
    bar   [10] = type Memory, range 32, base 0xd3020000, size 131072, enabled
    bar   [14] = type Memory, range 32, base 0xd3000000, size 131072, enabled
    bar   [18] = type I/O Port, range 32, base 0x1000, size 64, enabled
    cap 01[dc] = powerspec 2  supports D0 D3  current D0
    cap 07[e4] = PCI-X supports 2048 burst read, 1 split transaction
    cap 05[f0] = MSI supports 1 message, 64 bit 

none7@pci0:9:3:0:	class=0x0c0010 card=0x53328086 chip=0x581111c1 rev=0x70 hdr=0x00
    vendor     = 'LSI Corporation'
    device     = 'FW322/323 [TrueFire] 1394a Controller'
    class      = serial bus
    subclass   = FireWire
    bar   [10] = type Memory, range 32, base 0xd3040000, size 4096, enabled
    cap 01[44] = powerspec 2  supports D0 D1 D2 D3  current D0
