hostb0@pci0:0:0:0:	class=0x060000 rev=0x11 hdr=0x00 vendor=0x8086 device=0xd131 subvendor=0x1043 subdevice=0x8383
    vendor     = 'Intel Corporation'
    device     = 'Core Processor DMI'
    class      = bridge
    subclass   = HOST-PCI
    cap 00[40] = unknown

pcib1@pci0:0:3:0:	class=0x060400 rev=0x11 hdr=0x01 vendor=0x8086 device=0xd138 subvendor=0x1043 subdevice=0x8383
    vendor     = 'Intel Corporation'
    device     = 'Core Processor PCI Express Root Port 1'
    class      = bridge
    subclass   = PCI-PCI
    cap 0d[40] = PCI Bridge subvendor=0x1043 subdevice=0x8383
    cap 05[60] = MSI supports 2 messages, vector masks 
    cap 10[90] = PCI-Express 2 root port max data 128(256) ARI disabled
                 max read 128
                 link x2(x16) speed 2.5(5.0) ASPM disabled(L0s/L1)
                 slot 1 power limit 25000 mW
    cap 01[e0] = powerspec 3  supports D0 D3  current D0
    ecap 0001[100] = AER 1 0 fatal 0 non-fatal 0 corrected
    ecap 000d[150] = ACS 1
    ecap 000b[160] = Vendor [0] ID 0002 Rev 0 Length 12

none0@pci0:0:8:0:	class=0x088000 rev=0x11 hdr=0x00 vendor=0x8086 device=0xd155 subvendor=0x0000 subdevice=0x0000
    vendor     = 'Intel Corporation'
    device     = 'Core Processor System Management Registers'
    class      = base peripheral
    cap 10[40] = PCI-Express 2 root endpoint max data 128(128)
                 max read 128
                 link x0(x0) ASPM disabled(L0s)
    ecap 000b[100] = Vendor [0] ID 0000 Rev 0 Length 3840

none1@pci0:0:8:1:	class=0x088000 rev=0x11 hdr=0x00 vendor=0x8086 device=0xd156 subvendor=0x0000 subdevice=0x0000
    vendor     = 'Intel Corporation'
    device     = 'Core Processor Semaphore and Scratchpad Registers'
    class      = base peripheral
    cap 10[40] = PCI-Express 2 root endpoint max data 128(128)
                 max read 128
                 link x0(x0) ASPM disabled(L0s)
    ecap 000b[100] = Vendor [0] ID 0000 Rev 0 Length 3840

none2@pci0:0:8:2:	class=0x088000 rev=0x11 hdr=0x00 vendor=0x8086 device=0xd157 subvendor=0x0000 subdevice=0x0000
    vendor     = 'Intel Corporation'
    device     = 'Core Processor System Control and Status Registers'
    class      = base peripheral
    cap 10[40] = PCI-Express 2 root endpoint max data 128(128)
                 max read 128
                 link x0(x0) ASPM disabled(L0s)
    ecap 000b[100] = Vendor [0] ID 0000 Rev 0 Length 3840

none3@pci0:0:8:3:	class=0x088000 rev=0x11 hdr=0x00 vendor=0x8086 device=0xd158 subvendor=0x0000 subdevice=0x0000
    vendor     = 'Intel Corporation'
    device     = 'Core Processor Miscellaneous Registers'
    class      = base peripheral

none4@pci0:0:16:0:	class=0x088000 rev=0x11 hdr=0x00 vendor=0x8086 device=0xd150 subvendor=0x0000 subdevice=0x0000
    vendor     = 'Intel Corporation'
    device     = 'Core Processor QPI Link'
    class      = base peripheral

none5@pci0:0:16:1:	class=0x088000 rev=0x11 hdr=0x00 vendor=0x8086 device=0xd151 subvendor=0x0000 subdevice=0x0000
    vendor     = 'Intel Corporation'
    device     = 'Core Processor QPI Routing and Protocol Registers'
    class      = base peripheral

none6@pci0:0:22:0:	class=0x078000 rev=0x06 hdr=0x00 vendor=0x8086 device=0x3b64 subvendor=0x1043 subdevice=0x8383
    vendor     = 'Intel Corporation'
    device     = '5 Series/3400 Series Chipset HECI Controller'
    class      = simple comms
    bar   [10] = type Memory, range 64, base 0xf5fff000, size 16, enabled
    cap 01[50] = powerspec 3  supports D0 D3  current D0
    cap 05[8c] = MSI supports 1 message, 64 bit 

ehci0@pci0:0:26:0:	class=0x0c0320 rev=0x06 hdr=0x00 vendor=0x8086 device=0x3b3c subvendor=0x1043 subdevice=0x8383
    vendor     = 'Intel Corporation'
    device     = '5 Series/3400 Series Chipset USB2 Enhanced Host Controller'
    class      = serial bus
    subclass   = USB
    bar   [10] = type Memory, range 32, base 0xf5ffe000, size 1024, enabled
    cap 01[50] = powerspec 2  supports D0 D3  current D0
    cap 0a[58] = EHCI Debug Port at offset 0xa0 in map 0x14
    cap 13[98] = PCI Advanced Features: FLR TP

hdac1@pci0:0:27:0:	class=0x040300 rev=0x06 hdr=0x00 vendor=0x8086 device=0x3b56 subvendor=0x1043 subdevice=0x837b
    vendor     = 'Intel Corporation'
    device     = '5 Series/3400 Series Chipset High Definition Audio'
    class      = multimedia
    subclass   = HDA
    bar   [10] = type Memory, range 64, base 0xf5ff8000, size 16384, enabled
    cap 01[50] = powerspec 2  supports D0 D3  current D0
    cap 05[60] = MSI supports 1 message, 64 bit enabled with 1 message
    cap 10[70] = PCI-Express 1 root endpoint max data 128(128) FLR
                 max read 128
    ecap 0002[100] = VC 1 max VC1
    ecap 0005[130] = Root Complex Link Declaration 1

pcib2@pci0:0:28:0:	class=0x060400 rev=0x06 hdr=0x01 vendor=0x8086 device=0x3b42 subvendor=0x1043 subdevice=0x8383
    vendor     = 'Intel Corporation'
    device     = '5 Series/3400 Series Chipset PCI Express Root Port 1'
    class      = bridge
    subclass   = PCI-PCI
    cap 10[40] = PCI-Express 2 root port max data 128(128)
                 max read 128
                 link x0(x1) speed 0.0(2.5) ASPM disabled(L0s/L1)
    cap 05[80] = MSI supports 1 message 
    cap 0d[90] = PCI Bridge subvendor=0x1043 subdevice=0x8383
    cap 01[a0] = powerspec 2  supports D0 D3  current D0

pcib3@pci0:0:28:2:	class=0x060400 rev=0x06 hdr=0x01 vendor=0x8086 device=0x3b46 subvendor=0x1043 subdevice=0x8383
    vendor     = 'Intel Corporation'
    device     = '5 Series/3400 Series Chipset PCI Express Root Port 3'
    class      = bridge
    subclass   = PCI-PCI
    cap 10[40] = PCI-Express 2 root port max data 128(128)
                 max read 128
                 link x1(x1) speed 2.5(2.5) ASPM disabled(L0s/L1)
                 slot 0 power limit 0 mW HotPlug(present) surprise
    cap 05[80] = MSI supports 1 message enabled with 1 message
    cap 0d[90] = PCI Bridge subvendor=0x1043 subdevice=0x8383
    cap 01[a0] = powerspec 2  supports D0 D3  current D0

pcib4@pci0:0:28:3:	class=0x060400 rev=0x06 hdr=0x01 vendor=0x8086 device=0x3b48 subvendor=0x1043 subdevice=0x8383
    vendor     = 'Intel Corporation'
    device     = '5 Series/3400 Series Chipset PCI Express Root Port 4'
    class      = bridge
    subclass   = PCI-PCI
    cap 10[40] = PCI-Express 2 root port max data 128(128)
                 max read 128
                 link x1(x1) speed 2.5(2.5) ASPM disabled(L0s/L1)
                 slot 0 power limit 0 mW HotPlug(present) surprise
    cap 05[80] = MSI supports 1 message enabled with 1 message
    cap 0d[90] = PCI Bridge subvendor=0x1043 subdevice=0x8383
    cap 01[a0] = powerspec 2  supports D0 D3  current D0

ehci1@pci0:0:29:0:	class=0x0c0320 rev=0x06 hdr=0x00 vendor=0x8086 device=0x3b34 subvendor=0x1043 subdevice=0x8383
    vendor     = 'Intel Corporation'
    device     = '5 Series/3400 Series Chipset USB2 Enhanced Host Controller'
    class      = serial bus
    subclass   = USB
    bar   [10] = type Memory, range 32, base 0xf5ffd000, size 1024, enabled
    cap 01[50] = powerspec 2  supports D0 D3  current D0
    cap 0a[58] = EHCI Debug Port at offset 0xa0 in map 0x14
    cap 13[98] = PCI Advanced Features: FLR TP

pcib5@pci0:0:30:0:	class=0x060401 rev=0xa6 hdr=0x01 vendor=0x8086 device=0x244e subvendor=0x1043 subdevice=0x8383
    vendor     = 'Intel Corporation'
    device     = '82801 PCI Bridge'
    class      = bridge
    subclass   = PCI-PCI
    cap 0d[50] = PCI Bridge subvendor=0x1043 subdevice=0x8383

isab0@pci0:0:31:0:	class=0x060100 rev=0x06 hdr=0x00 vendor=0x8086 device=0x3b06 subvendor=0x1043 subdevice=0x8383
    vendor     = 'Intel Corporation'
    device     = 'H55 Chipset LPC Interface Controller'
    class      = bridge
    subclass   = PCI-ISA
    cap 09[e0] = vendor (length 16) Intel cap 1 version 1

ahci0@pci0:0:31:2:	class=0x010601 rev=0x06 hdr=0x00 vendor=0x8086 device=0x3b22 subvendor=0x1043 subdevice=0x8383
    vendor     = 'Intel Corporation'
    device     = '5 Series/3400 Series Chipset 6 port SATA AHCI Controller'
    class      = mass storage
    subclass   = SATA
    bar   [10] = type I/O Port, range 32, base 0xb880, size 8, enabled
    bar   [14] = type I/O Port, range 32, base 0xb800, size 4, enabled
    bar   [18] = type I/O Port, range 32, base 0xb480, size 8, enabled
    bar   [1c] = type I/O Port, range 32, base 0xb400, size 4, enabled
    bar   [20] = type I/O Port, range 32, base 0xb080, size 32, enabled
    bar   [24] = type Memory, range 32, base 0xf5ff7000, size 2048, enabled
    cap 05[80] = MSI supports 1 message enabled with 1 message
    cap 01[70] = powerspec 3  supports D0 D3  current D0
    cap 12[a8] = SATA Index-Data Pair
    cap 13[b0] = PCI Advanced Features: FLR TP

ichsmb0@pci0:0:31:3:	class=0x0c0500 rev=0x06 hdr=0x00 vendor=0x8086 device=0x3b30 subvendor=0x1043 subdevice=0x8383
    vendor     = 'Intel Corporation'
    device     = '5 Series/3400 Series Chipset SMBus Controller'
    class      = serial bus
    subclass   = SMBus
    bar   [10] = type Memory, range 64, base 0xf5ffc000, size 256, enabled
    bar   [20] = type I/O Port, range 32, base 0x400, size 32, enabled

vgapci0@pci0:1:0:0:	class=0x030000 rev=0xa1 hdr=0x00 vendor=0x10de device=0x128b subvendor=0x10de subdevice=0x128b
    vendor     = 'NVIDIA Corporation'
    device     = 'GK208B [GeForce GT 710]'
    class      = display
    subclass   = VGA
    bar   [10] = type Memory, range 32, base 0xf6000000, size 16777216, enabled
    bar   [14] = type Prefetchable Memory, range 64, base 0xe8000000, size 134217728, enabled
    bar   [1c] = type Prefetchable Memory, range 64, base 0xf2000000, size 33554432, enabled
    bar   [24] = type I/O Port, range 32, base 0xcc00, size 128, enabled
    cap 01[60] = powerspec 3  supports D0 D3  current D0
    cap 05[68] = MSI supports 1 message, 64 bit enabled with 1 message
    cap 10[78] = PCI-Express 2 legacy endpoint max data 128(256) RO NS
                 max read 512
                 link x2(x8) speed 2.5(5.0) ClockPM enabled
    ecap 0002[100] = VC 1 max VC0
    ecap 0004[128] = Power Budgeting 1
    ecap 000b[600] = Vendor [1] ID 0001 Rev 1 Length 36

hdac0@pci0:1:0:1:	class=0x040300 rev=0xa1 hdr=0x00 vendor=0x10de device=0x0e0f subvendor=0x10de subdevice=0x128b
    vendor     = 'NVIDIA Corporation'
    device     = 'GK208 HDMI/DP Audio Controller'
    class      = multimedia
    subclass   = HDA
    bar   [10] = type Memory, range 32, base 0xf7dfc000, size 16384, enabled
    cap 01[60] = powerspec 3  supports D0 D3  current D0
    cap 05[68] = MSI supports 1 message, 64 bit enabled with 1 message
    cap 10[78] = PCI-Express 2 endpoint max data 128(256) RO NS
                 max read 512
                 link x2(x8) speed 2.5(5.0) ClockPM enabled

re0@pci0:3:0:0:	class=0x020000 rev=0x03 hdr=0x00 vendor=0x10ec device=0x8168 subvendor=0x1043 subdevice=0x83a3
    vendor     = 'Realtek Semiconductor Co., Ltd.'
    device     = 'RTL8111/8168/8411 PCI Express Gigabit Ethernet Controller'
    class      = network
    subclass   = ethernet
    bar   [10] = type I/O Port, range 32, base 0xd800, size 256, enabled
    bar   [18] = type Prefetchable Memory, range 64, base 0xf4fff000, size 4096, enabled
    bar   [20] = type Prefetchable Memory, range 64, base 0xf4ff8000, size 16384, enabled
    cap 01[40] = powerspec 3  supports D0 D1 D2 D3  current D0
    cap 05[50] = MSI supports 1 message, 64 bit 
    cap 10[70] = PCI-Express 2 endpoint MSI 1 max data 128(256) RO
                 max read 4096
                 link x1(x1) speed 2.5(2.5) ASPM disabled(L0s/L1) ClockPM disabled
    cap 11[ac] = MSI-X supports 4 messages, enabled
                 Table in map 0x20[0x0], PBA in map 0x20[0x800]
    cap 03[cc] = VPD
    ecap 0001[100] = AER 1 0 fatal 0 non-fatal 2 corrected
    ecap 0002[140] = VC 1 max VC0
    ecap 0003[160] = Serial 1 0000000000000000

none7@pci0:2:0:0:	class=0x0c0010 rev=0x00 hdr=0x00 vendor=0x197b device=0x2380 subvendor=0x1043 subdevice=0x8313
    vendor     = 'JMicron Technology Corp.'
    device     = 'IEEE 1394 Host Controller'
    class      = serial bus
    subclass   = FireWire
    bar   [10] = type Memory, range 32, base 0xf7eff000, size 2048, enabled
    bar   [14] = type Memory, range 32, base 0xf7efe000, size 128, enabled
    bar   [20] = type Memory, range 32, base 0xf7efd000, size 128, enabled
    bar   [24] = type Memory, range 32, base 0xf7efc000, size 128, enabled
    cap 01[44] = powerspec 3  supports D0 D3  current D0
    cap 10[80] = PCI-Express 1 endpoint max data 128(128) RO
                 max read 512
                 link x1(x1) speed 2.5(2.5) ASPM disabled(L0s/L1)
    cap 05[94] = MSI supports 1 message 

pcm0@pci0:5:2:0:	class=0x040100 rev=0x01 hdr=0x00 vendor=0x1412 device=0x1724 subvendor=0x3031 subdevice=0x4553
    vendor     = 'VIA Technologies Inc.'
    device     = 'VT1720/24 [Envy24PT/HT] PCI Multi-Channel Audio Controller'
    class      = multimedia
    subclass   = audio
    bar   [10] = type I/O Port, range 32, base 0xec00, size 32, enabled
    bar   [14] = type I/O Port, range 32, base 0xe880, size 128, enabled
    cap 01[80] = powerspec 1  supports D0 D2 D3  current D0
