hostb0@pci0:0:0:0:	class=0x060000 card=0x15d01849 chip=0x15d01022 rev=0x00 hdr=0x00
    vendor     = 'Advanced Micro Devices, Inc. [AMD]'
    device     = 'Raven/Raven2 Root Complex'
    class      = bridge
    subclass   = HOST-PCI

none0@pci0:0:0:2:	class=0x080600 card=0x15d11022 chip=0x15d11022 rev=0x00 hdr=0x00
    vendor     = 'Advanced Micro Devices, Inc. [AMD]'
    device     = 'Raven/Raven2 IOMMU'
    class      = base peripheral
    subclass   = IOMMU
    cap 0f[40] = unknown
    cap 05[64] = MSI supports 4 messages, 64 bit enabled with 1 message
    cap 08[74] = HT MSI fixed address window enabled at 0xfee00000

hostb1@pci0:0:1:0:	class=0x060000 card=0x00000000 chip=0x14521022 rev=0x00 hdr=0x00
    vendor     = 'Advanced Micro Devices, Inc. [AMD]'
    device     = 'Family 17h (Models 00h-1fh) PCIe Dummy Host Bridge'
    class      = bridge
    subclass   = HOST-PCI

pcib1@pci0:0:1:2:	class=0x060400 card=0x14531022 chip=0x15d31022 rev=0x00 hdr=0x01
    vendor     = 'Advanced Micro Devices, Inc. [AMD]'
    device     = 'Raven/Raven2 PCIe GPP Bridge [6:0]'
    class      = bridge
    subclass   = PCI-PCI
    cap 01[50] = powerspec 3  supports D0 D3  current D0
    cap 10[58] = PCI-Express 2 root port max data 128(512) RO NS ARI disabled
                 link x4(x4) speed 8.0(8.0) ASPM disabled(L1)
                 slot 0 power limit 0 mW
    cap 05[a0] = MSI supports 1 message, 64 bit 
    cap 0d[c0] = PCI Bridge card=0x14531022
    cap 08[c8] = HT MSI fixed address window enabled at 0xfee00000
    ecap 000b[100] = Vendor 1 ID 1
    ecap 0001[150] = AER 2 0 fatal 0 non-fatal 0 corrected
    ecap 0019[270] = PCIe Sec 1 lane errors 0xf
    ecap 000d[2a0] = ACS 1
    ecap 001e[370] = L1 PM Substates 1
    ecap 0023[3c4] = Designated Vendor-Specific 1

pcib11@pci0:0:1:6:	class=0x060400 card=0x14531022 chip=0x15d31022 rev=0x00 hdr=0x01
    vendor     = 'Advanced Micro Devices, Inc. [AMD]'
    device     = 'Raven/Raven2 PCIe GPP Bridge [6:0]'
    class      = bridge
    subclass   = PCI-PCI
    cap 01[50] = powerspec 3  supports D0 D3  current D0
    cap 10[58] = PCI-Express 2 root port max data 256(512) RO NS ARI disabled
                 link x4(x4) speed 8.0(8.0) ASPM disabled(L1)
                 slot 0 power limit 0 mW HotPlug(present)
    cap 05[a0] = MSI supports 1 message, 64 bit 
    cap 0d[c0] = PCI Bridge card=0x14531022
    cap 08[c8] = HT MSI fixed address window enabled at 0xfee00000
    ecap 000b[100] = Vendor 1 ID 1
    ecap 0001[150] = AER 2 0 fatal 0 non-fatal 0 corrected
    ecap 0019[270] = PCIe Sec 1 lane errors 0
    ecap 000d[2a0] = ACS 1
    ecap 001e[370] = L1 PM Substates 1
    ecap 0023[3c4] = Designated Vendor-Specific 1

hostb2@pci0:0:8:0:	class=0x060000 card=0x00000000 chip=0x14521022 rev=0x00 hdr=0x00
    vendor     = 'Advanced Micro Devices, Inc. [AMD]'
    device     = 'Family 17h (Models 00h-1fh) PCIe Dummy Host Bridge'
    class      = bridge
    subclass   = HOST-PCI

pcib12@pci0:0:8:1:	class=0x060400 card=0x00001022 chip=0x15db1022 rev=0x00 hdr=0x01
    vendor     = 'Advanced Micro Devices, Inc. [AMD]'
    device     = 'Raven/Raven2 Internal PCIe GPP Bridge 0 to Bus A'
    class      = bridge
    subclass   = PCI-PCI
    cap 01[50] = powerspec 3  supports D0 D3  current D0
    cap 10[58] = PCI-Express 2 root port max data 256(512) RO NS
                 link x16(x16) speed 8.0(8.0) ASPM disabled(L0s/L1)
    cap 05[a0] = MSI supports 1 message, 64 bit 
    cap 0d[c0] = PCI Bridge card=0x00001022
    ecap 000b[100] = Vendor 1 ID 1
    ecap 0019[270] = PCIe Sec 1 lane errors 0
    ecap 000d[2a0] = ACS 1

pcib13@pci0:0:8:2:	class=0x060400 card=0x00001022 chip=0x15dc1022 rev=0x00 hdr=0x01
    vendor     = 'Advanced Micro Devices, Inc. [AMD]'
    device     = 'Raven/Raven2 Internal PCIe GPP Bridge 0 to Bus B'
    class      = bridge
    subclass   = PCI-PCI
    cap 01[50] = powerspec 3  supports D0 D3  current D0
    cap 10[58] = PCI-Express 2 root port max data 256(512) RO NS
                 link x16(x16) speed 8.0(8.0) ASPM disabled(L0s/L1)
    cap 05[a0] = MSI supports 1 message, 64 bit 
    cap 0d[c0] = PCI Bridge card=0x00001022
    ecap 000b[100] = Vendor 1 ID 1
    ecap 0019[270] = PCIe Sec 1 lane errors 0

intsmb0@pci0:0:20:0:	class=0x0c0500 card=0x790b1849 chip=0x790b1022 rev=0x61 hdr=0x00
    vendor     = 'Advanced Micro Devices, Inc. [AMD]'
    device     = 'FCH SMBus Controller'
    class      = serial bus
    subclass   = SMBus

isab0@pci0:0:20:3:	class=0x060100 card=0x790e1849 chip=0x790e1022 rev=0x51 hdr=0x00
    vendor     = 'Advanced Micro Devices, Inc. [AMD]'
    device     = 'FCH LPC Bridge'
    class      = bridge
    subclass   = PCI-ISA

hostb3@pci0:0:24:0:	class=0x060000 card=0x00000000 chip=0x15e81022 rev=0x00 hdr=0x00
    vendor     = 'Advanced Micro Devices, Inc. [AMD]'
    device     = 'Raven/Raven2 Device 24: Function 0'
    class      = bridge
    subclass   = HOST-PCI

hostb4@pci0:0:24:1:	class=0x060000 card=0x00000000 chip=0x15e91022 rev=0x00 hdr=0x00
    vendor     = 'Advanced Micro Devices, Inc. [AMD]'
    device     = 'Raven/Raven2 Device 24: Function 1'
    class      = bridge
    subclass   = HOST-PCI

hostb5@pci0:0:24:2:	class=0x060000 card=0x00000000 chip=0x15ea1022 rev=0x00 hdr=0x00
    vendor     = 'Advanced Micro Devices, Inc. [AMD]'
    device     = 'Raven/Raven2 Device 24: Function 2'
    class      = bridge
    subclass   = HOST-PCI

hostb6@pci0:0:24:3:	class=0x060000 card=0x00000000 chip=0x15eb1022 rev=0x00 hdr=0x00
    vendor     = 'Advanced Micro Devices, Inc. [AMD]'
    device     = 'Raven/Raven2 Device 24: Function 3'
    class      = bridge
    subclass   = HOST-PCI

hostb7@pci0:0:24:4:	class=0x060000 card=0x00000000 chip=0x15ec1022 rev=0x00 hdr=0x00
    vendor     = 'Advanced Micro Devices, Inc. [AMD]'
    device     = 'Raven/Raven2 Device 24: Function 4'
    class      = bridge
    subclass   = HOST-PCI

hostb8@pci0:0:24:5:	class=0x060000 card=0x00000000 chip=0x15ed1022 rev=0x00 hdr=0x00
    vendor     = 'Advanced Micro Devices, Inc. [AMD]'
    device     = 'Raven/Raven2 Device 24: Function 5'
    class      = bridge
    subclass   = HOST-PCI

hostb9@pci0:0:24:6:	class=0x060000 card=0x00000000 chip=0x15ee1022 rev=0x00 hdr=0x00
    vendor     = 'Advanced Micro Devices, Inc. [AMD]'
    device     = 'Raven/Raven2 Device 24: Function 6'
    class      = bridge
    subclass   = HOST-PCI

hostb10@pci0:0:24:7:	class=0x060000 card=0x00000000 chip=0x15ef1022 rev=0x00 hdr=0x00
    vendor     = 'Advanced Micro Devices, Inc. [AMD]'
    device     = 'Raven/Raven2 Device 24: Function 7'
    class      = bridge
    subclass   = HOST-PCI

xhci0@pci0:21:0:0:	class=0x0c0330 card=0x43d01849 chip=0x43b91022 rev=0x02 hdr=0x00
    vendor     = 'Advanced Micro Devices, Inc. [AMD]'
    device     = 'X370 Series Chipset USB 3.1 xHCI Controller'
    class      = serial bus
    subclass   = USB
    bar   [10] = type Memory, range 64, base 0xfe7a0000, size 32768, enabled
    cap 05[50] = MSI supports 8 messages, 64 bit enabled with 1 message
    cap 01[78] = powerspec 3  supports D0 D3  current D0
    cap 10[80] = PCI-Express 2 legacy endpoint max data 128(512) RO NS
                 link x4(x4) speed 8.0(8.0) ASPM disabled(L0s/L1)
    ecap 0001[100] = AER 1 0 fatal 0 non-fatal 1 corrected
    ecap 0019[200] = PCIe Sec 1 lane errors 0
    ecap 0018[300] = LTR 1
    ecap 001e[400] = L1 PM Substates 1

ahci0@pci0:21:0:1:	class=0x010601 card=0x43c81849 chip=0x43b51022 rev=0x02 hdr=0x00
    vendor     = 'Advanced Micro Devices, Inc. [AMD]'
    device     = 'X370 Series Chipset SATA Controller'
    class      = mass storage
    subclass   = SATA
    bar   [24] = type Memory, range 32, base 0xfe780000, size 131072, enabled
    cap 05[50] = MSI supports 1 message, 64 bit enabled with 1 message
    cap 01[78] = powerspec 3  supports D0 D3  current D0
    cap 10[80] = PCI-Express 2 legacy endpoint max data 128(512) RO NS
                 link x4(x4) speed 8.0(8.0) ASPM disabled(L0s/L1)
    ecap 0001[100] = AER 1 0 fatal 0 non-fatal 1 corrected

pcib2@pci0:21:0:2:	class=0x060400 card=0x43c61849 chip=0x43b01022 rev=0x02 hdr=0x01
    vendor     = 'Advanced Micro Devices, Inc. [AMD]'
    device     = 'X370 Series Chipset PCIe Upstream Port'
    class      = bridge
    subclass   = PCI-PCI
    cap 05[50] = MSI supports 1 message, 64 bit 
    cap 01[78] = powerspec 3  supports D0 D3  current D0
    cap 10[80] = PCI-Express 2 upstream port max data 128(512) RO NS
                 link x4(x4) speed 8.0(8.0) ASPM disabled(L0s/L1)
    cap 0d[c0] = PCI Bridge card=0x43c61849
    ecap 0001[100] = AER 1 0 fatal 0 non-fatal 1 corrected

pcib3@pci0:29:0:0:	class=0x060400 card=0x43c71849 chip=0x43b41022 rev=0x02 hdr=0x01
    vendor     = 'Advanced Micro Devices, Inc. [AMD]'
    device     = '300 Series Chipset PCIe Port'
    class      = bridge
    subclass   = PCI-PCI
    cap 05[50] = MSI supports 1 message, 64 bit 
    cap 01[78] = powerspec 3  supports D0 D3  current D0
    cap 10[80] = PCI-Express 2 downstream port max data 128(512) RO NS
                 link x0(x1) speed 0.0(5.0) ASPM disabled(L0s/L1)
                 slot 1 power limit 26000 mW
    cap 0d[c0] = PCI Bridge card=0x43c71849
    ecap 0001[100] = AER 1 0 fatal 0 non-fatal 0 corrected
    ecap 0019[200] = PCIe Sec 1 lane errors 0
    ecap 001e[400] = L1 PM Substates 1

pcib4@pci0:29:1:0:	class=0x060400 card=0x43c71849 chip=0x43b41022 rev=0x02 hdr=0x01
    vendor     = 'Advanced Micro Devices, Inc. [AMD]'
    device     = '300 Series Chipset PCIe Port'
    class      = bridge
    subclass   = PCI-PCI
    cap 05[50] = MSI supports 1 message, 64 bit 
    cap 01[78] = powerspec 3  supports D0 D3  current D0
    cap 10[80] = PCI-Express 2 downstream port max data 128(512) RO NS
                 link x1(x1) speed 2.5(5.0) ASPM disabled(L0s/L1)
                 slot 1 power limit 26000 mW
    cap 0d[c0] = PCI Bridge card=0x43c71849
    ecap 0001[100] = AER 1 0 fatal 0 non-fatal 0 corrected
    ecap 0019[200] = PCIe Sec 1 lane errors 0
    ecap 001e[400] = L1 PM Substates 1

pcib5@pci0:29:2:0:	class=0x060400 card=0x43c71849 chip=0x43b41022 rev=0x02 hdr=0x01
    vendor     = 'Advanced Micro Devices, Inc. [AMD]'
    device     = '300 Series Chipset PCIe Port'
    class      = bridge
    subclass   = PCI-PCI
    cap 05[50] = MSI supports 1 message, 64 bit 
    cap 01[78] = powerspec 3  supports D0 D3  current D0
    cap 10[80] = PCI-Express 2 downstream port max data 128(512) RO NS
                 link x1(x1) speed 2.5(5.0) ASPM disabled(L0s/L1)
                 slot 1 power limit 26000 mW
    cap 0d[c0] = PCI Bridge card=0x43c71849
    ecap 0001[100] = AER 1 0 fatal 0 non-fatal 0 corrected
    ecap 0019[200] = PCIe Sec 1 lane errors 0
    ecap 001e[400] = L1 PM Substates 1

pcib6@pci0:29:3:0:	class=0x060400 card=0x43c71849 chip=0x43b41022 rev=0x02 hdr=0x01
    vendor     = 'Advanced Micro Devices, Inc. [AMD]'
    device     = '300 Series Chipset PCIe Port'
    class      = bridge
    subclass   = PCI-PCI
    cap 05[50] = MSI supports 1 message, 64 bit 
    cap 01[78] = powerspec 3  supports D0 D3  current D0
    cap 10[80] = PCI-Express 2 downstream port max data 128(512) RO NS
                 link x1(x1) speed 2.5(5.0) ASPM disabled(L0s/L1)
                 slot 1 power limit 26000 mW
    cap 0d[c0] = PCI Bridge card=0x43c71849
    ecap 0001[100] = AER 1 0 fatal 0 non-fatal 0 corrected
    ecap 0019[200] = PCIe Sec 1 lane errors 0
    ecap 001e[400] = L1 PM Substates 1

pcib7@pci0:29:4:0:	class=0x060400 card=0x43c71849 chip=0x43b41022 rev=0x02 hdr=0x01
    vendor     = 'Advanced Micro Devices, Inc. [AMD]'
    device     = '300 Series Chipset PCIe Port'
    class      = bridge
    subclass   = PCI-PCI
    cap 05[50] = MSI supports 1 message, 64 bit 
    cap 01[78] = powerspec 3  supports D0 D3  current D0
    cap 10[80] = PCI-Express 2 downstream port max data 128(512) RO NS
                 link x0(x1) speed 0.0(5.0) ASPM disabled(L0s/L1)
                 slot 1 power limit 26000 mW
    cap 0d[c0] = PCI Bridge card=0x43c71849
    ecap 0001[100] = AER 1 0 fatal 0 non-fatal 0 corrected
    ecap 0019[200] = PCIe Sec 1 lane errors 0
    ecap 001e[400] = L1 PM Substates 1

pcib8@pci0:29:5:0:	class=0x060400 card=0x33061b21 chip=0x43b41022 rev=0x02 hdr=0x01
    vendor     = 'Advanced Micro Devices, Inc. [AMD]'
    device     = '300 Series Chipset PCIe Port'
    class      = bridge
    subclass   = PCI-PCI
    cap 05[50] = MSI supports 1 message, 64 bit 
    cap 01[78] = powerspec 3  supports D0 D3  current D0
    cap 10[80] = PCI-Express 2 downstream port max data 128(512) RO NS
                 link x1(x1) speed 2.5(5.0) ASPM disabled(L0s/L1)
                 slot 1 power limit 26000 mW
    cap 0d[c0] = PCI Bridge card=0x33061b21
    ecap 0001[100] = AER 1 0 fatal 0 non-fatal 0 corrected
    ecap 0019[200] = PCIe Sec 1 lane errors 0
    ecap 001e[400] = L1 PM Substates 1

pcib9@pci0:29:6:0:	class=0x060400 card=0x33061b21 chip=0x43b41022 rev=0x02 hdr=0x01
    vendor     = 'Advanced Micro Devices, Inc. [AMD]'
    device     = '300 Series Chipset PCIe Port'
    class      = bridge
    subclass   = PCI-PCI
    cap 05[50] = MSI supports 1 message, 64 bit 
    cap 01[78] = powerspec 3  supports D0 D3  current D0
    cap 10[80] = PCI-Express 2 downstream port max data 128(512) RO NS
                 link x1(x1) speed 2.5(5.0) ASPM disabled(L0s/L1)
                 slot 1 power limit 26000 mW
    cap 0d[c0] = PCI Bridge card=0x33061b21
    ecap 0001[100] = AER 1 0 fatal 0 non-fatal 0 corrected
    ecap 0019[200] = PCIe Sec 1 lane errors 0
    ecap 001e[400] = L1 PM Substates 1

pcib10@pci0:29:7:0:	class=0x060400 card=0x33061b21 chip=0x43b41022 rev=0x02 hdr=0x01
    vendor     = 'Advanced Micro Devices, Inc. [AMD]'
    device     = '300 Series Chipset PCIe Port'
    class      = bridge
    subclass   = PCI-PCI
    cap 05[50] = MSI supports 1 message, 64 bit 
    cap 01[78] = powerspec 3  supports D0 D3  current D0
    cap 10[80] = PCI-Express 2 downstream port max data 128(512) RO NS
                 link x1(x1) speed 2.5(5.0) ASPM disabled(L0s/L1)
                 slot 1 power limit 26000 mW
    cap 0d[c0] = PCI Bridge card=0x33061b21
    ecap 0001[100] = AER 1 0 fatal 0 non-fatal 0 corrected
    ecap 0019[200] = PCIe Sec 1 lane errors 0
    ecap 001e[400] = L1 PM Substates 1

iwm0@pci0:36:0:0:	class=0x028000 card=0x10108086 chip=0x24fd8086 rev=0x78 hdr=0x00
    vendor     = 'Intel Corporation'
    device     = 'Wireless 8265 / 8275'
    class      = network
    bar   [10] = type Memory, range 64, base 0xfe600000, size 8192, enabled
    cap 01[c8] = powerspec 3  supports D0 D3  current D0
    cap 05[d0] = MSI supports 1 message, 64 bit enabled with 1 message
    cap 10[40] = PCI-Express 2 endpoint max data 128(128) FLR NS
                 link x1(x1) speed 2.5(2.5) ASPM disabled(L1) ClockPM disabled
    ecap 0001[100] = AER 1 0 fatal 0 non-fatal 3 corrected
    ecap 0003[140] = Serial 1 cc2f71ffffff16b7
    ecap 0018[14c] = LTR 1
    ecap 001e[154] = L1 PM Substates 1

igb0@pci0:37:0:0:	class=0x020000 card=0x15391849 chip=0x15398086 rev=0x03 hdr=0x00
    vendor     = 'Intel Corporation'
    device     = 'I211 Gigabit Network Connection'
    class      = network
    subclass   = ethernet
    bar   [10] = type Memory, range 32, base 0xfe500000, size 131072, enabled
    bar   [18] = type I/O Port, range 32, base 0xf000, size 32, enabled
    bar   [1c] = type Memory, range 32, base 0xfe520000, size 16384, enabled
    cap 01[40] = powerspec 3  supports D0 D3  current D0
    cap 05[50] = MSI supports 1 message, 64 bit, vector masks 
    cap 11[70] = MSI-X supports 5 messages, enabled
                 Table in map 0x1c[0x0], PBA in map 0x1c[0x2000]
    cap 10[a0] = PCI-Express 2 endpoint max data 128(512) FLR RO NS
                 link x1(x1) speed 2.5(2.5) ASPM disabled(L0s/L1)
    ecap 0001[100] = AER 2 0 fatal 0 non-fatal 2 corrected
    ecap 0003[140] = Serial 1 7085c2ffff598206
    ecap 0017[1a0] = TPH Requester 1

nvme0@pci0:46:0:0:	class=0x010802 card=0xa801144d chip=0xa808144d rev=0x00 hdr=0x00
    vendor     = 'Samsung Electronics Co Ltd'
    device     = 'NVMe SSD Controller SM981/PM981/PM983'
    class      = mass storage
    subclass   = NVM
    bar   [10] = type Memory, range 64, base 0xfe900000, size 16384, enabled
    cap 01[40] = powerspec 3  supports D0 D3  current D0
    cap 05[50] = MSI supports 1 message, 64 bit 
    cap 10[70] = PCI-Express 2 endpoint max data 256(256) FLR RO NS
                 link x4(x4) speed 8.0(8.0) ASPM disabled(L1) ClockPM disabled
    cap 11[b0] = MSI-X supports 33 messages, enabled
                 Table in map 0x10[0x3000], PBA in map 0x10[0x2000]
    ecap 0001[100] = AER 2 0 fatal 0 non-fatal 1 corrected
    ecap 0003[148] = Serial 1 0000000000000000
    ecap 0004[158] = Power Budgeting 1
    ecap 0019[168] = PCIe Sec 1 lane errors 0
    ecap 0018[188] = LTR 1
    ecap 001e[190] = L1 PM Substates 1

vgapci0@pci0:56:0:0:	class=0x030000 card=0x15dd1002 chip=0x15dd1002 rev=0xc6 hdr=0x00
    vendor     = 'Advanced Micro Devices, Inc. [AMD/ATI]'
    device     = 'Raven Ridge [Radeon Vega Series / Radeon Vega Mobile Series]'
    class      = display
    subclass   = VGA
    bar   [10] = type Prefetchable Memory, range 64, base 0xe0000000, size 268435456, enabled
    bar   [18] = type Prefetchable Memory, range 64, base 0xf0000000, size 2097152, enabled
    bar   [20] = type I/O Port, range 32, base 0xe000, size 256, enabled
    bar   [24] = type Memory, range 32, base 0xfe400000, size 524288, enabled
    cap 09[48] = vendor (length 8)
    cap 01[50] = powerspec 3  supports D0 D3  current D0
    cap 10[64] = PCI-Express 2 legacy endpoint max data 256(256) FLR RO NS
                 link x16(x16) speed 8.0(8.0) ASPM disabled(L0s/L1)
    cap 05[a0] = MSI supports 4 messages, 64 bit enabled with 1 message
    cap 11[c0] = MSI-X supports 3 messages
                 Table in map 0x24[0x42000], PBA in map 0x24[0x43000]
    ecap 000b[100] = Vendor 1 ID 1
    ecap 0015[200] = Resizable BAR 1
    ecap 0019[270] = PCIe Sec 1 lane errors 0
    ecap 000d[2a0] = ACS 1
    ecap 000f[2b0] = ATS 1
    ecap 0013[2c0] = Page Page Request 1
    ecap 001b[2d0] = Process Address Space ID 1
    ecap 0018[320] = LTR 1

hdac0@pci0:56:0:1:	class=0x040300 card=0x15de1002 chip=0x15de1002 rev=0x00 hdr=0x00
    vendor     = 'Advanced Micro Devices, Inc. [AMD/ATI]'
    device     = 'Raven/Raven2/Fenghuang HDMI/DP Audio Controller'
    class      = multimedia
    subclass   = HDA
    bar   [10] = type Memory, range 32, base 0xfe488000, size 16384, enabled
    cap 09[48] = vendor (length 8)
    cap 01[50] = powerspec 3  supports D0 D3  current D0
    cap 10[64] = PCI-Express 2 legacy endpoint max data 256(256) FLR RO NS
                 link x16(x16) speed 8.0(8.0) ASPM disabled(L0s/L1)
    cap 05[a0] = MSI supports 1 message, 64 bit enabled with 1 message
    ecap 000b[100] = Vendor 1 ID 1

none1@pci0:56:0:2:	class=0x108000 card=0x15df1022 chip=0x15df1022 rev=0x00 hdr=0x00
    vendor     = 'Advanced Micro Devices, Inc. [AMD]'
    device     = 'Family 17h (Models 10h-1fh) Platform Security Processor'
    class      = encrypt/decrypt
    bar   [18] = type Memory, range 32, base 0xfe300000, size 1048576, enabled
    bar   [24] = type Memory, range 32, base 0xfe48c000, size 8192, enabled
    cap 09[48] = vendor (length 8)
    cap 01[50] = powerspec 3  supports D0 D3  current D0
    cap 10[64] = PCI-Express 2 endpoint max data 256(256) RO NS
                 link x16(x16) speed 8.0(8.0) ASPM disabled(L0s/L1)
    cap 05[a0] = MSI supports 2 messages, 64 bit 
    cap 11[c0] = MSI-X supports 2 messages
                 Table in map 0x24[0x0], PBA in map 0x24[0x1000]
    ecap 000b[100] = Vendor 1 ID 1

xhci1@pci0:56:0:3:	class=0x0c0330 card=0x79141849 chip=0x15e01022 rev=0x00 hdr=0x00
    vendor     = 'Advanced Micro Devices, Inc. [AMD]'
    device     = 'Raven USB 3.1'
    class      = serial bus
    subclass   = USB
    bar   [10] = type Memory, range 64, base 0xfe200000, size 1048576, enabled
    cap 09[48] = vendor (length 8)
    cap 01[50] = powerspec 3  supports D0 D3  current D0
    cap 10[64] = PCI-Express 2 endpoint max data 256(256) RO NS
                 link x16(x16) speed 8.0(8.0) ASPM disabled(L0s/L1)
    cap 05[a0] = MSI supports 8 messages, 64 bit enabled with 1 message
    cap 11[c0] = MSI-X supports 8 messages
                 Table in map 0x10[0xfe000], PBA in map 0x10[0xff000]
    ecap 000b[100] = Vendor 1 ID 1

xhci2@pci0:56:0:4:	class=0x0c0330 card=0x79141849 chip=0x15e11022 rev=0x00 hdr=0x00
    vendor     = 'Advanced Micro Devices, Inc. [AMD]'
    device     = 'Raven USB 3.1'
    class      = serial bus
    subclass   = USB
    bar   [10] = type Memory, range 64, base 0xfe100000, size 1048576, enabled
    cap 09[48] = vendor (length 8)
    cap 01[50] = powerspec 3  supports D0 D3  current D0
    cap 10[64] = PCI-Express 2 endpoint max data 256(256) RO NS
                 link x16(x16) speed 8.0(8.0) ASPM disabled(L0s/L1)
    cap 05[a0] = MSI supports 8 messages, 64 bit enabled with 1 message
    cap 11[c0] = MSI-X supports 8 messages
                 Table in map 0x10[0xfe000], PBA in map 0x10[0xff000]
    ecap 000b[100] = Vendor 1 ID 1

hdac1@pci0:56:0:6:	class=0x040300 card=0x12211849 chip=0x15e31022 rev=0x00 hdr=0x00
    vendor     = 'Advanced Micro Devices, Inc. [AMD]'
    device     = 'Family 17h (Models 10h-1fh) HD Audio Controller'
    class      = multimedia
    subclass   = HDA
    bar   [10] = type Memory, range 32, base 0xfe480000, size 32768, enabled
    cap 09[48] = vendor (length 8)
    cap 01[50] = powerspec 3  supports D0 D3  current D0
    cap 10[64] = PCI-Express 2 endpoint max data 256(256) RO NS
                 link x16(x16) speed 8.0(8.0) ASPM disabled(L0s/L1)
    cap 05[a0] = MSI supports 1 message, 64 bit enabled with 1 message
    ecap 000b[100] = Vendor 1 ID 1

ahci1@pci0:57:0:0:	class=0x010601 card=0x79011849 chip=0x79011022 rev=0x61 hdr=0x00
    vendor     = 'Advanced Micro Devices, Inc. [AMD]'
    device     = 'FCH SATA Controller [AHCI mode]'
    class      = mass storage
    subclass   = SATA
    bar   [24] = type Memory, range 32, base 0xfe800000, size 2048, enabled
    cap 09[48] = vendor (length 8)
    cap 01[50] = powerspec 3  supports D0 D3  current D0
    cap 10[64] = PCI-Express 2 endpoint max data 256(256) RO NS
                 link x16(x16) speed 8.0(8.0) ASPM disabled(L0s/L1)
    cap 05[a0] = MSI supports 2 messages, 64 bit enabled with 1 message
    cap 12[d0] = SATA Index-Data Pair
    ecap 000b[100] = Vendor 1 ID 1
    ecap 0019[270] = PCIe Sec 1 lane errors 0
