hostb0@pci0:0:0:0:	class=0x060000 rev=0x00 hdr=0x00 vendor=0x1022 device=0x1480 subvendor=0x1043 subdevice=0x87c0
    vendor     = 'Advanced Micro Devices, Inc. [AMD]'
    device     = 'Starship/Matisse Root Complex'
    class      = bridge
    subclass   = HOST-PCI

none0@pci0:0:0:2:	class=0x080600 rev=0x00 hdr=0x00 vendor=0x1022 device=0x1481 subvendor=0x1043 subdevice=0x87c0
    vendor     = 'Advanced Micro Devices, Inc. [AMD]'
    device     = 'Starship/Matisse IOMMU'
    class      = base peripheral
    subclass   = IOMMU
    cap 0f[40] = unknown
    cap 05[64] = MSI supports 4 messages, 64 bit 
    cap 08[74] = HT MSI fixed address window enabled at 0xfee00000
    cap 09[c8] = vendor (length 24)

hostb1@pci0:0:1:0:	class=0x060000 rev=0x00 hdr=0x00 vendor=0x1022 device=0x1482 subvendor=0x0000 subdevice=0x0000
    vendor     = 'Advanced Micro Devices, Inc. [AMD]'
    device     = 'Starship/Matisse PCIe Dummy Host Bridge'
    class      = bridge
    subclass   = HOST-PCI

pcib1@pci0:0:1:1:	class=0x060400 rev=0x00 hdr=0x01 vendor=0x1022 device=0x1483 subvendor=0x1022 subdevice=0x1234
    vendor     = 'Advanced Micro Devices, Inc. [AMD]'
    device     = 'Starship/Matisse GPP Bridge'
    class      = bridge
    subclass   = PCI-PCI
    cap 01[50] = powerspec 3  supports D0 D3  current D0
    cap 10[58] = PCI-Express 2 root port max data 256(512) RO NS
                 max read 512
                 link x4(x4) speed 8.0(8.0) ASPM disabled(L1)
                 slot 0 power limit 0 mW
    cap 05[a0] = MSI supports 1 message, 64 bit 
    cap 0d[c0] = PCI Bridge subvendor=0x1022 subdevice=0x1234
    cap 08[c8] = HT MSI fixed address window enabled at 0xfee00000
    ecap 000b[100] = Vendor [1] ID 0001 Rev 1 Length 16
    ecap 0019[270] = PCIe Sec 1 lane errors 0
    ecap 000d[2a0] = ACS 1
    ecap 001e[370] = L1 PM Substates 1
    ecap 0023[3c4] = Designated Vendor-Specific 1
    ecap 0025[400] = Data Link Feature 1
    ecap 0026[410] = Physical Layer 16.0 GT/s 1
    ecap 0027[440] = Lane Margining at Receiver 1

pcib2@pci0:0:1:3:	class=0x060400 rev=0x00 hdr=0x01 vendor=0x1022 device=0x1483 subvendor=0x1022 subdevice=0x1234
    vendor     = 'Advanced Micro Devices, Inc. [AMD]'
    device     = 'Starship/Matisse GPP Bridge'
    class      = bridge
    subclass   = PCI-PCI
    cap 01[50] = powerspec 3  supports D0 D3  current D0
    cap 10[58] = PCI-Express 2 root port max data 128(512) RO NS
                 max read 512
                 link x4(x8) speed 8.0(8.0) ASPM disabled(L1)
                 slot 0 power limit 0 mW
    cap 05[a0] = MSI supports 1 message, 64 bit 
    cap 0d[c0] = PCI Bridge subvendor=0x1022 subdevice=0x1234
    cap 08[c8] = HT MSI fixed address window enabled at 0xfee00000
    ecap 000b[100] = Vendor [1] ID 0001 Rev 1 Length 16
    ecap 0019[270] = PCIe Sec 1 lane errors 0
    ecap 000d[2a0] = ACS 1
    ecap 001e[370] = L1 PM Substates 1
    ecap 0023[3c4] = Designated Vendor-Specific 1
    ecap 0025[400] = Data Link Feature 1
    ecap 0026[410] = Physical Layer 16.0 GT/s 1
    ecap 0027[440] = Lane Margining at Receiver 1

hostb2@pci0:0:2:0:	class=0x060000 rev=0x00 hdr=0x00 vendor=0x1022 device=0x1482 subvendor=0x0000 subdevice=0x0000
    vendor     = 'Advanced Micro Devices, Inc. [AMD]'
    device     = 'Starship/Matisse PCIe Dummy Host Bridge'
    class      = bridge
    subclass   = HOST-PCI

hostb3@pci0:0:3:0:	class=0x060000 rev=0x00 hdr=0x00 vendor=0x1022 device=0x1482 subvendor=0x0000 subdevice=0x0000
    vendor     = 'Advanced Micro Devices, Inc. [AMD]'
    device     = 'Starship/Matisse PCIe Dummy Host Bridge'
    class      = bridge
    subclass   = HOST-PCI

pcib10@pci0:0:3:1:	class=0x060400 rev=0x00 hdr=0x01 vendor=0x1022 device=0x1483 subvendor=0x1022 subdevice=0x1234
    vendor     = 'Advanced Micro Devices, Inc. [AMD]'
    device     = 'Starship/Matisse GPP Bridge'
    class      = bridge
    subclass   = PCI-PCI
    cap 01[50] = powerspec 3  supports D0 D3  current D0
    cap 10[58] = PCI-Express 2 root port max data 128(512) RO NS
                 max read 512
                 link x16(x16) speed 2.5(8.0) ASPM disabled(L1)
                 slot 0 power limit 0 mW
    cap 05[a0] = MSI supports 1 message, 64 bit 
    cap 0d[c0] = PCI Bridge subvendor=0x1022 subdevice=0x1234
    cap 08[c8] = HT MSI fixed address window enabled at 0xfee00000
    ecap 000b[100] = Vendor [1] ID 0001 Rev 1 Length 16
    ecap 0019[270] = PCIe Sec 1 lane errors 0xffff
    ecap 000d[2a0] = ACS 1
    ecap 001e[370] = L1 PM Substates 1
    ecap 0023[3c4] = Designated Vendor-Specific 1
    ecap 0025[400] = Data Link Feature 1
    ecap 0026[410] = Physical Layer 16.0 GT/s 1
    ecap 0027[440] = Lane Margining at Receiver 1

hostb4@pci0:0:4:0:	class=0x060000 rev=0x00 hdr=0x00 vendor=0x1022 device=0x1482 subvendor=0x0000 subdevice=0x0000
    vendor     = 'Advanced Micro Devices, Inc. [AMD]'
    device     = 'Starship/Matisse PCIe Dummy Host Bridge'
    class      = bridge
    subclass   = HOST-PCI

hostb5@pci0:0:5:0:	class=0x060000 rev=0x00 hdr=0x00 vendor=0x1022 device=0x1482 subvendor=0x0000 subdevice=0x0000
    vendor     = 'Advanced Micro Devices, Inc. [AMD]'
    device     = 'Starship/Matisse PCIe Dummy Host Bridge'
    class      = bridge
    subclass   = HOST-PCI

hostb6@pci0:0:7:0:	class=0x060000 rev=0x00 hdr=0x00 vendor=0x1022 device=0x1482 subvendor=0x0000 subdevice=0x0000
    vendor     = 'Advanced Micro Devices, Inc. [AMD]'
    device     = 'Starship/Matisse PCIe Dummy Host Bridge'
    class      = bridge
    subclass   = HOST-PCI

pcib11@pci0:0:7:1:	class=0x060400 rev=0x00 hdr=0x01 vendor=0x1022 device=0x1484 subvendor=0x1022 subdevice=0x1484
    vendor     = 'Advanced Micro Devices, Inc. [AMD]'
    device     = 'Starship/Matisse Internal PCIe GPP Bridge 0 to bus[E:B]'
    class      = bridge
    subclass   = PCI-PCI
    cap 01[50] = powerspec 3  supports D0 D3  current D0
    cap 10[58] = PCI-Express 2 root port max data 256(512) RO NS
                 max read 512
                 link x16(x16) speed 16.0(16.0) ASPM disabled(L0s/L1)
    cap 05[a0] = MSI supports 1 message, 64 bit 
    cap 0d[c0] = PCI Bridge subvendor=0x1022 subdevice=0x1484
    cap 08[c8] = HT MSI fixed address window enabled at 0xfee00000
    ecap 000b[100] = Vendor [1] ID 0001 Rev 1 Length 16
    ecap 0001[150] = AER 2 0 fatal 0 non-fatal 0 corrected
    ecap 0019[270] = PCIe Sec 1 lane errors 0
    ecap 000d[2a0] = ACS 1
    ecap 0025[400] = Data Link Feature 1
    ecap 0026[410] = Physical Layer 16.0 GT/s 1
    ecap 0027[440] = Lane Margining at Receiver 1

hostb7@pci0:0:8:0:	class=0x060000 rev=0x00 hdr=0x00 vendor=0x1022 device=0x1482 subvendor=0x0000 subdevice=0x0000
    vendor     = 'Advanced Micro Devices, Inc. [AMD]'
    device     = 'Starship/Matisse PCIe Dummy Host Bridge'
    class      = bridge
    subclass   = HOST-PCI

pcib12@pci0:0:8:1:	class=0x060400 rev=0x00 hdr=0x01 vendor=0x1022 device=0x1484 subvendor=0x1022 subdevice=0x1484
    vendor     = 'Advanced Micro Devices, Inc. [AMD]'
    device     = 'Starship/Matisse Internal PCIe GPP Bridge 0 to bus[E:B]'
    class      = bridge
    subclass   = PCI-PCI
    cap 01[50] = powerspec 3  supports D0 D3  current D0
    cap 10[58] = PCI-Express 2 root port max data 256(512) RO NS
                 max read 512
                 link x16(x16) speed 16.0(16.0) ASPM disabled(L0s/L1)
    cap 05[a0] = MSI supports 1 message, 64 bit 
    cap 0d[c0] = PCI Bridge subvendor=0x1022 subdevice=0x1484
    cap 08[c8] = HT MSI fixed address window enabled at 0xfee00000
    ecap 000b[100] = Vendor [1] ID 0001 Rev 1 Length 16
    ecap 0001[150] = AER 2 0 fatal 0 non-fatal 0 corrected
    ecap 0019[270] = PCIe Sec 1 lane errors 0
    ecap 000d[2a0] = ACS 1
    ecap 0025[400] = Data Link Feature 1
    ecap 0026[410] = Physical Layer 16.0 GT/s 1
    ecap 0027[440] = Lane Margining at Receiver 1

pcib13@pci0:0:8:2:	class=0x060400 rev=0x00 hdr=0x01 vendor=0x1022 device=0x1484 subvendor=0x1022 subdevice=0x1484
    vendor     = 'Advanced Micro Devices, Inc. [AMD]'
    device     = 'Starship/Matisse Internal PCIe GPP Bridge 0 to bus[E:B]'
    class      = bridge
    subclass   = PCI-PCI
    cap 01[50] = powerspec 3  supports D0 D3  current D0
    cap 10[58] = PCI-Express 2 root port max data 256(512) RO NS
                 max read 512
                 link x16(x16) speed 16.0(16.0) ASPM disabled(L0s/L1)
    cap 05[a0] = MSI supports 1 message, 64 bit 
    cap 0d[c0] = PCI Bridge subvendor=0x1022 subdevice=0x1484
    cap 08[c8] = HT MSI fixed address window enabled at 0xfee00000
    ecap 000b[100] = Vendor [1] ID 0001 Rev 1 Length 16
    ecap 0001[150] = AER 2 0 fatal 0 non-fatal 0 corrected
    ecap 0019[270] = PCIe Sec 1 lane errors 0
    ecap 000d[2a0] = ACS 1
    ecap 0025[400] = Data Link Feature 1
    ecap 0026[410] = Physical Layer 16.0 GT/s 1
    ecap 0027[440] = Lane Margining at Receiver 1

pcib14@pci0:0:8:3:	class=0x060400 rev=0x00 hdr=0x01 vendor=0x1022 device=0x1484 subvendor=0x1022 subdevice=0x1484
    vendor     = 'Advanced Micro Devices, Inc. [AMD]'
    device     = 'Starship/Matisse Internal PCIe GPP Bridge 0 to bus[E:B]'
    class      = bridge
    subclass   = PCI-PCI
    cap 01[50] = powerspec 3  supports D0 D3  current D0
    cap 10[58] = PCI-Express 2 root port max data 256(512) RO NS
                 max read 512
                 link x16(x16) speed 16.0(16.0) ASPM disabled(L0s/L1)
    cap 05[a0] = MSI supports 1 message, 64 bit 
    cap 0d[c0] = PCI Bridge subvendor=0x1022 subdevice=0x1484
    cap 08[c8] = HT MSI fixed address window enabled at 0xfee00000
    ecap 000b[100] = Vendor [1] ID 0001 Rev 1 Length 16
    ecap 0001[150] = AER 2 0 fatal 0 non-fatal 0 corrected
    ecap 0019[270] = PCIe Sec 1 lane errors 0
    ecap 000d[2a0] = ACS 1
    ecap 0025[400] = Data Link Feature 1
    ecap 0026[410] = Physical Layer 16.0 GT/s 1
    ecap 0027[440] = Lane Margining at Receiver 1

intsmb0@pci0:0:20:0:	class=0x0c0500 rev=0x61 hdr=0x00 vendor=0x1022 device=0x790b subvendor=0x1043 subdevice=0x87c0
    vendor     = 'Advanced Micro Devices, Inc. [AMD]'
    device     = 'FCH SMBus Controller'
    class      = serial bus
    subclass   = SMBus

isab0@pci0:0:20:3:	class=0x060100 rev=0x51 hdr=0x00 vendor=0x1022 device=0x790e subvendor=0x1043 subdevice=0x87c0
    vendor     = 'Advanced Micro Devices, Inc. [AMD]'
    device     = 'FCH LPC Bridge'
    class      = bridge
    subclass   = PCI-ISA

hostb8@pci0:0:24:0:	class=0x060000 rev=0x00 hdr=0x00 vendor=0x1022 device=0x1440 subvendor=0x0000 subdevice=0x0000
    vendor     = 'Advanced Micro Devices, Inc. [AMD]'
    device     = 'Matisse Device 24: Function 0'
    class      = bridge
    subclass   = HOST-PCI

hostb9@pci0:0:24:1:	class=0x060000 rev=0x00 hdr=0x00 vendor=0x1022 device=0x1441 subvendor=0x0000 subdevice=0x0000
    vendor     = 'Advanced Micro Devices, Inc. [AMD]'
    device     = 'Matisse Device 24: Function 1'
    class      = bridge
    subclass   = HOST-PCI

hostb10@pci0:0:24:2:	class=0x060000 rev=0x00 hdr=0x00 vendor=0x1022 device=0x1442 subvendor=0x0000 subdevice=0x0000
    vendor     = 'Advanced Micro Devices, Inc. [AMD]'
    device     = 'Matisse Device 24: Function 2'
    class      = bridge
    subclass   = HOST-PCI

hostb11@pci0:0:24:3:	class=0x060000 rev=0x00 hdr=0x00 vendor=0x1022 device=0x1443 subvendor=0x0000 subdevice=0x0000
    vendor     = 'Advanced Micro Devices, Inc. [AMD]'
    device     = 'Matisse Device 24: Function 3'
    class      = bridge
    subclass   = HOST-PCI

hostb12@pci0:0:24:4:	class=0x060000 rev=0x00 hdr=0x00 vendor=0x1022 device=0x1444 subvendor=0x0000 subdevice=0x0000
    vendor     = 'Advanced Micro Devices, Inc. [AMD]'
    device     = 'Matisse Device 24: Function 4'
    class      = bridge
    subclass   = HOST-PCI

hostb13@pci0:0:24:5:	class=0x060000 rev=0x00 hdr=0x00 vendor=0x1022 device=0x1445 subvendor=0x0000 subdevice=0x0000
    vendor     = 'Advanced Micro Devices, Inc. [AMD]'
    device     = 'Matisse Device 24: Function 5'
    class      = bridge
    subclass   = HOST-PCI

hostb14@pci0:0:24:6:	class=0x060000 rev=0x00 hdr=0x00 vendor=0x1022 device=0x1446 subvendor=0x0000 subdevice=0x0000
    vendor     = 'Advanced Micro Devices, Inc. [AMD]'
    device     = 'Matisse Device 24: Function 6'
    class      = bridge
    subclass   = HOST-PCI

hostb15@pci0:0:24:7:	class=0x060000 rev=0x00 hdr=0x00 vendor=0x1022 device=0x1447 subvendor=0x0000 subdevice=0x0000
    vendor     = 'Advanced Micro Devices, Inc. [AMD]'
    device     = 'Matisse Device 24: Function 7'
    class      = bridge
    subclass   = HOST-PCI

nvme0@pci0:1:0:0:	class=0x010802 rev=0x03 hdr=0x00 vendor=0x1cc1 device=0x8201 subvendor=0x1cc1 subdevice=0x8201
    vendor     = 'ADATA Technology Co., Ltd.'
    device     = 'XPG SX8200 Pro PCIe Gen3x4 M.2 2280 Solid State Drive'
    class      = mass storage
    subclass   = NVM
    bar   [10] = type Memory, range 64, base 0xf6a00000, size 16384, enabled
    cap 01[40] = powerspec 3  supports D0 D3  current D0
    cap 05[50] = MSI supports 8 messages, 64 bit, vector masks 
    cap 10[70] = PCI-Express 2 endpoint max data 256(256) FLR RO
                 max read 512
                 link x4(x4) speed 8.0(8.0) ASPM disabled(L1) ClockPM disabled
    cap 11[b0] = MSI-X supports 16 messages, enabled
                 Table in map 0x10[0x2000], PBA in map 0x10[0x2100]
    ecap 0001[100] = AER 2 0 fatal 0 non-fatal 0 corrected
    ecap 0019[158] = PCIe Sec 1 lane errors 0
    ecap 0018[178] = LTR 1
    ecap 001e[180] = L1 PM Substates 1

xhci0@pci0:2:0:0:	class=0x0c0330 rev=0x01 hdr=0x00 vendor=0x1022 device=0x43d0 subvendor=0x1b21 subdevice=0x1142
    vendor     = 'Advanced Micro Devices, Inc. [AMD]'
    class      = serial bus
    subclass   = USB
    bar   [10] = type Memory, range 64, base 0xf67a0000, size 32768, enabled
    cap 05[50] = MSI supports 8 messages, 64 bit enabled with 1 message
    cap 01[78] = powerspec 3  supports D0 D3  current D0
    cap 10[80] = PCI-Express 2 legacy endpoint max data 128(512) RO NS
                 max read 512
                 link x4(x4) speed 8.0(8.0) ASPM disabled(L0s/L1)
    ecap 0001[100] = AER 1 0 fatal 0 non-fatal 1 corrected
    ecap 0019[200] = PCIe Sec 1 lane errors 0
    ecap 0018[300] = LTR 1
    ecap 001e[400] = L1 PM Substates 1

ahci0@pci0:2:0:1:	class=0x010601 rev=0x01 hdr=0x00 vendor=0x1022 device=0x43c8 subvendor=0x1b21 subdevice=0x1062
    vendor     = 'Advanced Micro Devices, Inc. [AMD]'
    device     = '400 Series Chipset SATA Controller'
    class      = mass storage
    subclass   = SATA
    bar   [24] = type Memory, range 32, base 0xf6780000, size 131072, enabled
    cap 05[50] = MSI supports 1 message, 64 bit enabled with 1 message
    cap 01[78] = powerspec 3  supports D0 D3  current D0
    cap 10[80] = PCI-Express 2 legacy endpoint max data 128(512) RO NS
                 max read 512
                 link x4(x4) speed 8.0(8.0) ASPM disabled(L0s/L1)
    ecap 0001[100] = AER 1 0 fatal 0 non-fatal 1 corrected

pcib3@pci0:2:0:2:	class=0x060400 rev=0x01 hdr=0x01 vendor=0x1022 device=0x43c6 subvendor=0x1b21 subdevice=0x0201
    vendor     = 'Advanced Micro Devices, Inc. [AMD]'
    device     = '400 Series Chipset PCIe Bridge'
    class      = bridge
    subclass   = PCI-PCI
    cap 05[50] = MSI supports 1 message, 64 bit 
    cap 01[78] = powerspec 3  supports D0 D3  current D0
    cap 10[80] = PCI-Express 2 upstream port max data 128(512) RO NS
                 max read 512
                 link x4(x4) speed 8.0(8.0) ASPM disabled(L0s/L1)
    cap 0d[c0] = PCI Bridge subvendor=0x1b21 subdevice=0x0201
    ecap 0001[100] = AER 1 0 fatal 0 non-fatal 1 corrected

pcib4@pci0:3:0:0:	class=0x060400 rev=0x01 hdr=0x01 vendor=0x1022 device=0x43c7 subvendor=0x1b21 subdevice=0x3306
    vendor     = 'Advanced Micro Devices, Inc. [AMD]'
    device     = '400 Series Chipset PCIe Port'
    class      = bridge
    subclass   = PCI-PCI
    cap 05[50] = MSI supports 1 message, 64 bit 
    cap 01[78] = powerspec 3  supports D0 D3  current D0
    cap 10[80] = PCI-Express 2 downstream port max data 128(512) RO NS
                 max read 512
                 link x1(x1) speed 2.5(5.0) ASPM disabled(L0s/L1)
                 slot 1 power limit 26000 mW
    cap 0d[c0] = PCI Bridge subvendor=0x1b21 subdevice=0x3306
    ecap 0001[100] = AER 1 0 fatal 0 non-fatal 0 corrected
    ecap 0019[200] = PCIe Sec 1 lane errors 0
    ecap 001e[400] = L1 PM Substates 1

pcib5@pci0:3:1:0:	class=0x060400 rev=0x01 hdr=0x01 vendor=0x1022 device=0x43c7 subvendor=0x1b21 subdevice=0x3306
    vendor     = 'Advanced Micro Devices, Inc. [AMD]'
    device     = '400 Series Chipset PCIe Port'
    class      = bridge
    subclass   = PCI-PCI
    cap 05[50] = MSI supports 1 message, 64 bit 
    cap 01[78] = powerspec 3  supports D0 D3  current D0
    cap 10[80] = PCI-Express 2 downstream port max data 128(512) RO NS
                 max read 512
                 link x1(x1) speed 2.5(5.0) ASPM disabled(L0s/L1)
                 slot 1 power limit 26000 mW
    cap 0d[c0] = PCI Bridge subvendor=0x1b21 subdevice=0x3306
    ecap 0001[100] = AER 1 0 fatal 0 non-fatal 0 corrected
    ecap 0019[200] = PCIe Sec 1 lane errors 0
    ecap 001e[400] = L1 PM Substates 1

pcib6@pci0:3:2:0:	class=0x060400 rev=0x01 hdr=0x01 vendor=0x1022 device=0x43c7 subvendor=0x1b21 subdevice=0x3306
    vendor     = 'Advanced Micro Devices, Inc. [AMD]'
    device     = '400 Series Chipset PCIe Port'
    class      = bridge
    subclass   = PCI-PCI
    cap 05[50] = MSI supports 1 message, 64 bit 
    cap 01[78] = powerspec 3  supports D0 D3  current D0
    cap 10[80] = PCI-Express 2 downstream port max data 128(512) RO NS
                 max read 512
                 link x1(x1) speed 2.5(5.0) ASPM disabled(L0s/L1)
                 slot 1 power limit 26000 mW
    cap 0d[c0] = PCI Bridge subvendor=0x1b21 subdevice=0x3306
    ecap 0001[100] = AER 1 0 fatal 0 non-fatal 0 corrected
    ecap 0019[200] = PCIe Sec 1 lane errors 0
    ecap 001e[400] = L1 PM Substates 1

pcib7@pci0:3:3:0:	class=0x060400 rev=0x01 hdr=0x01 vendor=0x1022 device=0x43c7 subvendor=0x1b21 subdevice=0x3306
    vendor     = 'Advanced Micro Devices, Inc. [AMD]'
    device     = '400 Series Chipset PCIe Port'
    class      = bridge
    subclass   = PCI-PCI
    cap 05[50] = MSI supports 1 message, 64 bit 
    cap 01[78] = powerspec 3  supports D0 D3  current D0
    cap 10[80] = PCI-Express 2 downstream port max data 128(512) RO NS
                 max read 512
                 link x1(x1) speed 2.5(5.0) ASPM disabled(L0s/L1)
                 slot 1 power limit 26000 mW
    cap 0d[c0] = PCI Bridge subvendor=0x1b21 subdevice=0x3306
    ecap 0001[100] = AER 1 0 fatal 0 non-fatal 0 corrected
    ecap 0019[200] = PCIe Sec 1 lane errors 0
    ecap 001e[400] = L1 PM Substates 1

pcib8@pci0:3:4:0:	class=0x060400 rev=0x01 hdr=0x01 vendor=0x1022 device=0x43c7 subvendor=0x1b21 subdevice=0x3306
    vendor     = 'Advanced Micro Devices, Inc. [AMD]'
    device     = '400 Series Chipset PCIe Port'
    class      = bridge
    subclass   = PCI-PCI
    cap 05[50] = MSI supports 1 message, 64 bit 
    cap 01[78] = powerspec 3  supports D0 D3  current D0
    cap 10[80] = PCI-Express 2 downstream port max data 128(512) RO NS
                 max read 512
                 link x0(x4) speed 0.0(5.0) ASPM disabled(L0s/L1)
                 slot 1 power limit 26000 mW
    cap 0d[c0] = PCI Bridge subvendor=0x1b21 subdevice=0x3306
    ecap 0001[100] = AER 1 0 fatal 0 non-fatal 0 corrected
    ecap 0019[200] = PCIe Sec 1 lane errors 0
    ecap 001e[400] = L1 PM Substates 1

pcib9@pci0:3:9:0:	class=0x060400 rev=0x01 hdr=0x01 vendor=0x1022 device=0x43c7 subvendor=0x1b21 subdevice=0x3306
    vendor     = 'Advanced Micro Devices, Inc. [AMD]'
    device     = '400 Series Chipset PCIe Port'
    class      = bridge
    subclass   = PCI-PCI
    cap 05[50] = MSI supports 1 message, 64 bit 
    cap 01[78] = powerspec 3  supports D0 D3  current D0
    cap 10[80] = PCI-Express 2 downstream port max data 128(512) RO NS
                 max read 512
                 link x0(x2) speed 0.0(8.0) ASPM disabled(L1)
                 slot 1 power limit 26000 mW
    cap 0d[c0] = PCI Bridge subvendor=0x1b21 subdevice=0x3306
    ecap 0001[100] = AER 1 0 fatal 0 non-fatal 0 corrected
    ecap 0019[200] = PCIe Sec 1 lane errors 0
    ecap 001e[400] = L1 PM Substates 1

re0@pci0:4:0:0:	class=0x020000 rev=0x15 hdr=0x00 vendor=0x10ec device=0x8168 subvendor=0x1043 subdevice=0x8677
    vendor     = 'Realtek Semiconductor Co., Ltd.'
    device     = 'RTL8111/8168/8411 PCI Express Gigabit Ethernet Controller'
    class      = network
    subclass   = ethernet
    bar   [10] = type I/O Port, range 32, base 0xe000, size 256, enabled
    bar   [18] = type Memory, range 64, base 0xf6604000, size 4096, enabled
    bar   [20] = type Memory, range 64, base 0xf6600000, size 16384, enabled
    cap 01[40] = powerspec 3  supports D0 D1 D2 D3  current D0
    cap 05[50] = MSI supports 1 message, 64 bit 
    cap 10[70] = PCI-Express 2 endpoint MSI 1 max data 128(128) RO
                 max read 4096
                 link x1(x1) speed 2.5(2.5) ASPM disabled(L0s/L1) ClockPM disabled
    cap 11[b0] = MSI-X supports 4 messages, enabled
                 Table in map 0x20[0x0], PBA in map 0x20[0x800]
    ecap 0001[100] = AER 2 0 fatal 0 non-fatal 0 corrected
    ecap 0002[140] = VC 1 max VC0
    ecap 0003[160] = Serial 1 01000000684ce000
    ecap 0018[170] = LTR 1
    ecap 001e[178] = L1 PM Substates 1

none1@pci0:5:0:0:	class=0x028000 rev=0x01 hdr=0x00 vendor=0x10ec device=0x8812 subvendor=0x10ec subdevice=0x8203
    vendor     = 'Realtek Semiconductor Co., Ltd.'
    device     = 'RTL8812AE 802.11ac PCIe Wireless Network Adapter'
    class      = network
    bar   [10] = type I/O Port, range 32, base 0xd000, size 256, enabled
    bar   [18] = type Memory, range 64, base 0xf6500000, size 16384, enabled
    cap 01[40] = powerspec 3  supports D0 D1 D2 D3  current D0
    cap 05[50] = MSI supports 1 message, 64 bit 
    cap 10[70] = PCI-Express 2 endpoint max data 128(128) RO
                 max read 512
                 link x1(x1) speed 2.5(2.5) ASPM disabled(L0s/L1) ClockPM disabled
    ecap 0001[100] = AER 1 1 fatal 0 non-fatal 1 corrected
    ecap 0003[140] = Serial 1 001288feff4ce000
    ecap 0018[150] = LTR 1
    ecap 001e[158] = L1 PM Substates 1

vgapci0@pci0:10:0:0:	class=0x030000 rev=0xa1 hdr=0x00 vendor=0x10de device=0x1f06 subvendor=0x1043 subdevice=0x870b
    vendor     = 'NVIDIA Corporation'
    device     = 'TU106 [GeForce RTX 2060 SUPER]'
    class      = display
    subclass   = VGA
    bar   [10] = type Memory, range 32, base 0xf5000000, size 16777216, enabled
    bar   [14] = type Prefetchable Memory, range 64, base 0xe0000000, size 268435456, enabled
    bar   [1c] = type Prefetchable Memory, range 64, base 0xf0000000, size 33554432, enabled
    bar   [24] = type I/O Port, range 32, base 0xf000, size 128, enabled
    cap 01[60] = powerspec 3  supports D0 D3  current D0
    cap 05[68] = MSI supports 1 message, 64 bit enabled with 1 message
    cap 10[78] = PCI-Express 2 legacy endpoint max data 128(256) FLR RO NS
                 max read 512
                 link x16(x16) speed 2.5(8.0) ASPM disabled(L0s/L1) ClockPM enabled
    ecap 0002[100] = VC 1 max VC0
    ecap 0018[250] = LTR 1
    ecap 001e[258] = L1 PM Substates 1
    ecap 0004[128] = Power Budgeting 1
    ecap 0001[420] = AER 2 0 fatal 0 non-fatal 0 corrected
    ecap 000b[600] = Vendor [1] ID 0001 Rev 1 Length 36
    ecap 0019[900] = PCIe Sec 1 lane errors 0
    ecap 0015[bb0] = Resizable BAR 1

hdac0@pci0:10:0:1:	class=0x040300 rev=0xa1 hdr=0x00 vendor=0x10de device=0x10f9 subvendor=0x1043 subdevice=0x870b
    vendor     = 'NVIDIA Corporation'
    device     = 'TU106 High Definition Audio Controller'
    class      = multimedia
    subclass   = HDA
    bar   [10] = type Memory, range 32, base 0xf6080000, size 16384, enabled
    cap 01[60] = powerspec 3  supports D0 D3  current D0
    cap 05[68] = MSI supports 1 message, 64 bit enabled with 1 message
    cap 10[78] = PCI-Express 2 endpoint max data 128(256) RO NS
                 max read 512
                 link x16(x16) speed 2.5(8.0) ASPM L0s/L1(L0s/L1) ClockPM enabled
    ecap 0001[100] = AER 2 0 fatal 0 non-fatal 1 corrected

xhci1@pci0:10:0:2:	class=0x0c0330 rev=0xa1 hdr=0x00 vendor=0x10de device=0x1ada subvendor=0x1043 subdevice=0x870b
    vendor     = 'NVIDIA Corporation'
    device     = 'TU106 USB 3.1 Host Controller'
    class      = serial bus
    subclass   = USB
    bar   [10] = type Prefetchable Memory, range 64, base 0xf2000000, size 262144, enabled
    bar   [1c] = type Prefetchable Memory, range 64, base 0xf2040000, size 65536, enabled
    cap 05[68] = MSI supports 1 message, 64 bit enabled with 1 message
    cap 10[78] = PCI-Express 2 endpoint max data 128(128) RO NS
                 max read 512
                 link x16(x16) speed 2.5(8.0) ASPM disabled(L0s/L1) ClockPM disabled
    cap 01[b4] = powerspec 3  supports D0 D3  current D0
    ecap 0001[100] = AER 2 0 fatal 0 non-fatal 1 corrected

none2@pci0:10:0:3:	class=0x0c8000 rev=0xa1 hdr=0x00 vendor=0x10de device=0x1adb subvendor=0x1043 subdevice=0x870b
    vendor     = 'NVIDIA Corporation'
    device     = 'TU106 USB Type-C UCSI Controller'
    class      = serial bus
    bar   [10] = type Memory, range 32, base 0xf6084000, size 4096, enabled
    cap 05[68] = MSI supports 1 message, 64 bit 
    cap 10[78] = PCI-Express 2 endpoint max data 128(128) RO NS
                 max read 512
                 link x16(x16) speed 2.5(8.0) ASPM disabled(L0s/L1) ClockPM disabled
    cap 01[b4] = powerspec 3  supports D0 D3  current D0
    ecap 0001[100] = AER 2 0 fatal 0 non-fatal 1 corrected

none3@pci0:11:0:0:	class=0x130000 rev=0x00 hdr=0x00 vendor=0x1022 device=0x148a subvendor=0x1043 subdevice=0x87c0
    vendor     = 'Advanced Micro Devices, Inc. [AMD]'
    device     = 'Starship/Matisse PCIe Dummy Function'
    class      = non-essential instrumentation
    cap 09[48] = vendor (length 8)
    cap 01[50] = powerspec 3  supports D0 D3  current D0
    cap 10[64] = PCI-Express 2 endpoint max data 256(256) FLR RO NS
                 max read 512
                 link x16(x16) speed 16.0(16.0) ASPM disabled(L0s/L1)
    ecap 000b[100] = Vendor [1] ID 0001 Rev 1 Length 16
    ecap 0001[150] = AER 2 0 fatal 0 non-fatal 0 corrected
    ecap 0019[270] = PCIe Sec 1 lane errors 0
    ecap 000d[2a0] = ACS 1
    ecap 0025[400] = Data Link Feature 1
    ecap 0026[410] = Physical Layer 16.0 GT/s 1
    ecap 0027[440] = Lane Margining at Receiver 1

none4@pci0:12:0:0:	class=0x130000 rev=0x00 hdr=0x00 vendor=0x1022 device=0x1485 subvendor=0x1043 subdevice=0x87c0
    vendor     = 'Advanced Micro Devices, Inc. [AMD]'
    device     = 'Starship/Matisse Reserved SPP'
    class      = non-essential instrumentation
    cap 09[48] = vendor (length 8)
    cap 01[50] = powerspec 3  supports D0 D3  current D0
    cap 10[64] = PCI-Express 2 endpoint max data 256(256) FLR RO NS
                 max read 512
                 link x16(x16) speed 16.0(16.0) ASPM disabled(L0s/L1)
    ecap 000b[100] = Vendor [1] ID 0001 Rev 1 Length 16
    ecap 0001[150] = AER 2 0 fatal 0 non-fatal 1 corrected
    ecap 0019[270] = PCIe Sec 1 lane errors 0
    ecap 000d[2a0] = ACS 1
    ecap 0025[400] = Data Link Feature 1
    ecap 0026[410] = Physical Layer 16.0 GT/s 1
    ecap 0027[440] = Lane Margining at Receiver 1

none5@pci0:12:0:1:	class=0x108000 rev=0x00 hdr=0x00 vendor=0x1022 device=0x1486 subvendor=0x1043 subdevice=0x87c0
    vendor     = 'Advanced Micro Devices, Inc. [AMD]'
    device     = 'Starship/Matisse Cryptographic Coprocessor PSPCPP'
    class      = encrypt/decrypt
    bar   [18] = type Memory, range 32, base 0xf6300000, size 1048576, enabled
    bar   [24] = type Memory, range 32, base 0xf6408000, size 8192, enabled
    cap 09[48] = vendor (length 8)
    cap 01[50] = powerspec 3  supports D0 D3  current D0
    cap 10[64] = PCI-Express 2 endpoint max data 256(256) FLR RO NS
                 max read 512
                 link x16(x16) speed 16.0(16.0) ASPM disabled(L0s/L1)
    cap 05[a0] = MSI supports 1 message, 64 bit 
    cap 11[c0] = MSI-X supports 2 messages
                 Table in map 0x24[0x0], PBA in map 0x24[0x1000]
    ecap 000b[100] = Vendor [1] ID 0001 Rev 1 Length 16
    ecap 0001[150] = AER 2 0 fatal 0 non-fatal 1 corrected
    ecap 000d[2a0] = ACS 1
    ecap 0017[370] = TPH Requester 1

xhci2@pci0:12:0:3:	class=0x0c0330 rev=0x00 hdr=0x00 vendor=0x1022 device=0x149c subvendor=0x1043 subdevice=0x87c0
    vendor     = 'Advanced Micro Devices, Inc. [AMD]'
    device     = 'Matisse USB 3.0 Host Controller'
    class      = serial bus
    subclass   = USB
    bar   [10] = type Memory, range 64, base 0xf6200000, size 1048576, enabled
    cap 09[48] = vendor (length 8)
    cap 01[50] = powerspec 3  supports D0 D3  current D0
    cap 10[64] = PCI-Express 2 endpoint max data 256(256) FLR RO NS
                 max read 512
                 link x16(x16) speed 16.0(16.0) ASPM disabled(L0s/L1)
    cap 05[a0] = MSI supports 8 messages, 64 bit 
    cap 11[c0] = MSI-X supports 8 messages, enabled
                 Table in map 0x10[0xfe000], PBA in map 0x10[0xff000]
    ecap 000b[100] = Vendor [1] ID 0001 Rev 1 Length 16
    ecap 0001[150] = AER 2 0 fatal 0 non-fatal 1 corrected
    ecap 000d[2a0] = ACS 1
    ecap 0017[370] = TPH Requester 1

hdac1@pci0:12:0:4:	class=0x040300 rev=0x00 hdr=0x00 vendor=0x1022 device=0x1487 subvendor=0x1043 subdevice=0x8760
    vendor     = 'Advanced Micro Devices, Inc. [AMD]'
    device     = 'Starship/Matisse HD Audio Controller'
    class      = multimedia
    subclass   = HDA
    bar   [10] = type Memory, range 32, base 0xf6400000, size 32768, enabled
    cap 09[48] = vendor (length 8)
    cap 01[50] = powerspec 3  supports D0 D3  current D0
    cap 10[64] = PCI-Express 2 endpoint max data 256(256) FLR RO NS
                 max read 512
                 link x16(x16) speed 16.0(16.0) ASPM disabled(L0s/L1)
    cap 05[a0] = MSI supports 1 message, 64 bit enabled with 1 message
    ecap 000b[100] = Vendor [1] ID 0001 Rev 1 Length 16
    ecap 0001[150] = AER 2 0 fatal 0 non-fatal 1 corrected
    ecap 000d[2a0] = ACS 1
    ecap 0017[370] = TPH Requester 1

ahci1@pci0:13:0:0:	class=0x010601 rev=0x51 hdr=0x00 vendor=0x1022 device=0x7901 subvendor=0x1043 subdevice=0x87c0
    vendor     = 'Advanced Micro Devices, Inc. [AMD]'
    device     = 'FCH SATA Controller [AHCI mode]'
    class      = mass storage
    subclass   = SATA
    bar   [24] = type Memory, range 32, base 0xf6900000, size 2048, enabled
    cap 09[48] = vendor (length 8)
    cap 01[50] = powerspec 3  supports D0 D3  current D0
    cap 10[64] = PCI-Express 2 endpoint max data 256(256) FLR RO NS
                 max read 512
                 link x16(x16) speed 16.0(16.0) ASPM disabled(L0s/L1)
    cap 05[a0] = MSI supports 16 messages, 64 bit enabled with 1 message
    cap 12[d0] = SATA Index-Data Pair
    ecap 000b[100] = Vendor [1] ID 0001 Rev 1 Length 16
    ecap 0001[150] = AER 2 0 fatal 0 non-fatal 0 corrected
    ecap 0019[270] = PCIe Sec 1 lane errors 0
    ecap 000d[2a0] = ACS 1
    ecap 0017[370] = TPH Requester 1
    ecap 0025[400] = Data Link Feature 1
    ecap 0026[410] = Physical Layer 16.0 GT/s 1
    ecap 0027[440] = Lane Margining at Receiver 1

ahci2@pci0:14:0:0:	class=0x010601 rev=0x51 hdr=0x00 vendor=0x1022 device=0x7901 subvendor=0x1043 subdevice=0x87c0
    vendor     = 'Advanced Micro Devices, Inc. [AMD]'
    device     = 'FCH SATA Controller [AHCI mode]'
    class      = mass storage
    subclass   = SATA
    bar   [24] = type Memory, range 32, base 0xf6800000, size 2048, enabled
    cap 09[48] = vendor (length 8)
    cap 01[50] = powerspec 3  supports D0 D3  current D0
    cap 10[64] = PCI-Express 2 endpoint max data 256(256) FLR RO NS
                 max read 512
                 link x16(x16) speed 16.0(16.0) ASPM disabled(L0s/L1)
    cap 05[a0] = MSI supports 16 messages, 64 bit enabled with 1 message
    cap 12[d0] = SATA Index-Data Pair
    ecap 000b[100] = Vendor [1] ID 0001 Rev 1 Length 16
    ecap 0001[150] = AER 2 0 fatal 0 non-fatal 0 corrected
    ecap 0019[270] = PCIe Sec 1 lane errors 0
    ecap 000d[2a0] = ACS 1
    ecap 0017[370] = TPH Requester 1
    ecap 0025[400] = Data Link Feature 1
    ecap 0026[410] = Physical Layer 16.0 GT/s 1
    ecap 0027[440] = Lane Margining at Receiver 1
