hostb0@pci0:0:0:0:	class=0x060000 card=0x31141565 chip=0x590f8086 rev=0x06 hdr=0x00
    vendor     = 'Intel Corporation'
    device     = 'Xeon E3-1200 v6/7th Gen Core Processor Host Bridge/DRAM Registers'
    class      = bridge
    subclass   = HOST-PCI
    cap 09[e0] = vendor (length 16) Intel cap 0 version 1

pcib1@pci0:0:1:0:	class=0x060400 card=0x31141565 chip=0x19018086 rev=0x06 hdr=0x01
    vendor     = 'Intel Corporation'
    device     = 'Xeon E3-1200 v5/E3-1500 v5/6th Gen Core Processor PCIe Controller (x16)'
    class      = bridge
    subclass   = PCI-PCI
    cap 0d[88] = PCI Bridge card=0x31141565
    cap 01[80] = powerspec 3  supports D0 D3  current D0
    cap 05[90] = MSI supports 1 message 
    cap 10[a0] = PCI-Express 2 root port max data 128(256)
                 link x4(x16) speed 5.0(8.0) ASPM disabled(L0s/L1)
                 slot 1 power limit 75000 mW
    ecap 0002[100] = VC 1 max VC0
    ecap 0005[140] = Root Complex Link Declaration 1
    ecap 0019[d94] = PCIe Sec 1 lane errors 0

vgapci0@pci0:0:2:0:	class=0x030000 card=0x31141565 chip=0x59128086 rev=0x04 hdr=0x00
    vendor     = 'Intel Corporation'
    device     = 'HD Graphics 630'
    class      = display
    subclass   = VGA
    bar   [10] = type Memory, range 64, base 0xde000000, size 16777216, enabled
    bar   [18] = type Prefetchable Memory, range 64, base 0xc0000000, size 268435456, enabled
    bar   [20] = type I/O Port, range 32, base 0xf000, size 64, enabled
    cap 09[40] = vendor (length 12) Intel cap 0 version 1
    cap 10[70] = PCI-Express 2 root endpoint max data 128(128) FLR
    cap 05[ac] = MSI supports 1 message 
    cap 01[d0] = powerspec 2  supports D0 D3  current D0
    ecap 001b[100] = unknown 1
    ecap 000f[200] = ATS 1
    ecap 0013[300] = unknown 1

none0@pci0:0:8:0:	class=0x088000 card=0x31141565 chip=0x19118086 rev=0x00 hdr=0x00
    vendor     = 'Intel Corporation'
    device     = 'Xeon E3-1200 v5/v6 / E3-1500 v5 / 6th/7th Gen Core Processor Gaussian Mixture Model'
    class      = base peripheral
    bar   [10] = type Memory, range 64, base 0xdf12e000, size 4096, enabled
    cap 05[90] = MSI supports 1 message 
    cap 01[dc] = powerspec 2  supports D0 D3  current D0
    cap 13[f0] = PCI Advanced Features: FLR TP

xhci0@pci0:0:20:0:	class=0x0c0330 card=0x64091565 chip=0xa2af8086 rev=0x00 hdr=0x00
    vendor     = 'Intel Corporation'
    device     = '200 Series/Z370 Chipset Family USB 3.0 xHCI Controller'
    class      = serial bus
    subclass   = USB
    bar   [10] = type Memory, range 64, base 0xdf110000, size 65536, enabled
    cap 01[70] = powerspec 2  supports D0 D3  current D0
    cap 05[80] = MSI supports 8 messages, 64 bit enabled with 1 message

none1@pci0:0:22:0:	class=0x078000 card=0x31141565 chip=0xa2ba8086 rev=0x00 hdr=0x00
    vendor     = 'Intel Corporation'
    device     = '200 Series PCH CSME HECI'
    class      = simple comms
    bar   [10] = type Memory, range 64, base 0xdf12d000, size 4096, enabled
    cap 01[50] = powerspec 3  supports D0 D3  current D0
    cap 05[8c] = MSI supports 1 message, 64 bit 

ahci0@pci0:0:23:0:	class=0x010601 card=0x52231565 chip=0xa2828086 rev=0x00 hdr=0x00
    vendor     = 'Intel Corporation'
    device     = '200 Series PCH SATA controller [AHCI mode]'
    class      = mass storage
    subclass   = SATA
    bar   [10] = type Memory, range 32, base 0xdf128000, size 8192, enabled
    bar   [14] = type Memory, range 32, base 0xdf12c000, size 256, enabled
    bar   [18] = type I/O Port, range 32, base 0xf090, size 8, enabled
    bar   [1c] = type I/O Port, range 32, base 0xf080, size 4, enabled
    bar   [20] = type I/O Port, range 32, base 0xf060, size 32, enabled
    bar   [24] = type Memory, range 32, base 0xdf12b000, size 2048, enabled
    cap 05[80] = MSI supports 1 message enabled with 1 message
    cap 01[70] = powerspec 3  supports D0 D3  current D0
    cap 12[a8] = SATA Index-Data Pair

pcib7@pci0:0:28:0:	class=0x060400 card=0x31141565 chip=0xa2948086 rev=0xf0 hdr=0x01
    vendor     = 'Intel Corporation'
    device     = '200 Series PCH PCI Express Root Port'
    class      = bridge
    subclass   = PCI-PCI
    cap 10[40] = PCI-Express 2 root port max data 128(256) ARI disabled
                 link x1(x1) speed 2.5(8.0)
                 slot 8 power limit 100 mW
    cap 05[80] = MSI supports 1 message 
    cap 0d[90] = PCI Bridge card=0x31141565
    cap 01[a0] = powerspec 3  supports D0 D3  current D0
    ecap 0001[100] = AER 1 0 fatal 0 non-fatal 0 corrected
    ecap 000d[140] = ACS 1
    ecap 0019[220] = PCIe Sec 1 lane errors 0

isab0@pci0:0:31:0:	class=0x060100 card=0x31141565 chip=0xa2c88086 rev=0x00 hdr=0x00
    vendor     = 'Intel Corporation'
    device     = '200 Series PCH LPC Controller (B250)'
    class      = bridge
    subclass   = PCI-ISA

none2@pci0:0:31:2:	class=0x058000 card=0x31141565 chip=0xa2a18086 rev=0x00 hdr=0x00
    vendor     = 'Intel Corporation'
    device     = '200 Series/Z370 Chipset Family Power Management Controller'
    class      = memory
    bar   [10] = type Memory, range 32, base 0xdf124000, size 16384, enabled

hdac0@pci0:0:31:3:	class=0x040300 card=0x824d1565 chip=0xa2f08086 rev=0x00 hdr=0x00
    vendor     = 'Intel Corporation'
    device     = '200 Series PCH HD Audio'
    class      = multimedia
    subclass   = HDA
    bar   [10] = type Memory, range 64, base 0xdf120000, size 16384, enabled
    bar   [20] = type Memory, range 64, base 0xdf100000, size 65536, enabled
    cap 01[50] = powerspec 3  supports D0 D3  current D0
    cap 05[60] = MSI supports 1 message, 64 bit enabled with 1 message

none3@pci0:0:31:4:	class=0x0c0500 card=0x31141565 chip=0xa2a38086 rev=0x00 hdr=0x00
    vendor     = 'Intel Corporation'
    device     = '200 Series/Z370 Chipset Family SMBus Controller'
    class      = serial bus
    subclass   = SMBus
    bar   [10] = type Memory, range 64, base 0xdf12a000, size 256, enabled
    bar   [20] = type I/O Port, range 32, base 0xf040, size 32, enabled

pcib2@pci0:1:0:0:	class=0x060400 card=0x00000000 chip=0x260812d8 rev=0x00 hdr=0x01
    vendor     = 'Pericom Semiconductor'
    device     = 'PI7C9X2G608GP PCIe2 6-Port/8-Lane Packet Switch'
    class      = bridge
    subclass   = PCI-PCI
    cap 01[40] = powerspec 3  supports D0 D1 D2 D3  current D0
    cap 03[5c] = VPD
    cap 09[64] = vendor (length 52)
    cap 0d[b0] = PCI Bridge card=0x00000000
    cap 10[c0] = PCI-Express 2 upstream port max data 128(256)
                 link x4(x4) speed 5.0(5.0)
    ecap 0001[100] = AER 1 0 fatal 0 non-fatal 1 corrected
    ecap 0002[140] = VC 1 max VC0
    ecap 0004[20c] = Power Budgeting 1
    ecap 0018[230] = LTR 1
    ecap 001e[240] = unknown 1

pcib3@pci0:2:1:0:	class=0x060400 card=0x00000000 chip=0x260812d8 rev=0x00 hdr=0x01
    vendor     = 'Pericom Semiconductor'
    device     = 'PI7C9X2G608GP PCIe2 6-Port/8-Lane Packet Switch'
    class      = bridge
    subclass   = PCI-PCI
    cap 01[40] = powerspec 3  supports D0 D1 D2 D3  current D0
    cap 05[4c] = MSI supports 1 message, 64 bit enabled with 1 message
    cap 09[64] = vendor (length 52)
    cap 0d[b0] = PCI Bridge card=0x00000000
    cap 10[c0] = PCI-Express 2 downstream port max data 128(256)
                 link x1(x1) speed 2.5(5.0)
                 slot 0 power limit 25000 mW HotPlug(present) Attn Button PC(on) MRL(closed)
    ecap 0001[100] = AER 1 0 fatal 0 non-fatal 0 corrected
    ecap 0002[140] = VC 1 max VC0
    ecap 0004[20c] = Power Budgeting 1
    ecap 000d[220] = ACS 1
    ecap 001e[240] = unknown 1

pcib4@pci0:2:2:0:	class=0x060400 card=0x00000000 chip=0x260812d8 rev=0x00 hdr=0x01
    vendor     = 'Pericom Semiconductor'
    device     = 'PI7C9X2G608GP PCIe2 6-Port/8-Lane Packet Switch'
    class      = bridge
    subclass   = PCI-PCI
    cap 01[40] = powerspec 3  supports D0 D1 D2 D3  current D0
    cap 05[4c] = MSI supports 1 message, 64 bit enabled with 1 message
    cap 09[64] = vendor (length 52)
    cap 0d[b0] = PCI Bridge card=0x00000000
    cap 10[c0] = PCI-Express 2 downstream port max data 128(256)
                 link x1(x1) speed 2.5(5.0)
                 slot 0 power limit 25000 mW HotPlug(present) Attn Button PC(on) MRL(closed)
    ecap 0001[100] = AER 1 0 fatal 0 non-fatal 0 corrected
    ecap 0002[140] = VC 1 max VC0
    ecap 0004[20c] = Power Budgeting 1
    ecap 000d[220] = ACS 1
    ecap 001e[240] = unknown 1

pcib5@pci0:2:3:0:	class=0x060400 card=0x00000000 chip=0x260812d8 rev=0x00 hdr=0x01
    vendor     = 'Pericom Semiconductor'
    device     = 'PI7C9X2G608GP PCIe2 6-Port/8-Lane Packet Switch'
    class      = bridge
    subclass   = PCI-PCI
    cap 01[40] = powerspec 3  supports D0 D1 D2 D3  current D0
    cap 05[4c] = MSI supports 1 message, 64 bit enabled with 1 message
    cap 09[64] = vendor (length 52)
    cap 0d[b0] = PCI Bridge card=0x00000000
    cap 10[c0] = PCI-Express 2 downstream port max data 128(256)
                 link x1(x1) speed 2.5(5.0)
                 slot 0 power limit 25000 mW HotPlug(present) Attn Button PC(on) MRL(closed)
    ecap 0001[100] = AER 1 0 fatal 0 non-fatal 0 corrected
    ecap 0002[140] = VC 1 max VC0
    ecap 0004[20c] = Power Budgeting 1
    ecap 000d[220] = ACS 1
    ecap 001e[240] = unknown 1

pcib6@pci0:2:4:0:	class=0x060400 card=0x00000000 chip=0x260812d8 rev=0x00 hdr=0x01
    vendor     = 'Pericom Semiconductor'
    device     = 'PI7C9X2G608GP PCIe2 6-Port/8-Lane Packet Switch'
    class      = bridge
    subclass   = PCI-PCI
    cap 01[40] = powerspec 3  supports D0 D1 D2 D3  current D0
    cap 05[4c] = MSI supports 1 message, 64 bit enabled with 1 message
    cap 09[64] = vendor (length 52)
    cap 0d[b0] = PCI Bridge card=0x00000000
    cap 10[c0] = PCI-Express 2 downstream port max data 128(256)
                 link x1(x1) speed 2.5(5.0)
                 slot 0 power limit 25000 mW HotPlug(present) Attn Button PC(on) MRL(closed)
    ecap 0001[100] = AER 1 0 fatal 0 non-fatal 0 corrected
    ecap 0002[140] = VC 1 max VC0
    ecap 0004[20c] = Power Budgeting 1
    ecap 000d[220] = ACS 1
    ecap 001e[240] = unknown 1

re0@pci0:3:0:0:	class=0x020000 card=0x012310ec chip=0x816810ec rev=0x06 hdr=0x00
    vendor     = 'Realtek Semiconductor Co., Ltd.'
    device     = 'RTL8111/8168/8411 PCI Express Gigabit Ethernet Controller'
    class      = network
    subclass   = ethernet
    bar   [10] = type I/O Port, range 32, base 0xd000, size 256, enabled
    bar   [18] = type Prefetchable Memory, range 64, base 0xd0304000, size 4096, enabled
    bar   [20] = type Prefetchable Memory, range 64, base 0xd0300000, size 16384, enabled
    cap 01[40] = powerspec 3  supports D0 D1 D2 D3  current D0
    cap 05[50] = MSI supports 1 message, 64 bit 
    cap 10[70] = PCI-Express 2 endpoint MSI 1 max data 128(128) RO
                 link x1(x1) speed 2.5(2.5) ASPM disabled(L0s/L1)
    cap 11[b0] = MSI-X supports 4 messages, enabled
                 Table in map 0x20[0x0], PBA in map 0x20[0x800]
    cap 03[d0] = VPD
    ecap 0001[100] = AER 1 0 fatal 0 non-fatal 1 corrected
    ecap 0002[140] = VC 1 max VC0
    ecap 0003[160] = Serial 1 a5370000684ce000

re1@pci0:4:0:0:	class=0x020000 card=0x012310ec chip=0x816810ec rev=0x06 hdr=0x00
    vendor     = 'Realtek Semiconductor Co., Ltd.'
    device     = 'RTL8111/8168/8411 PCI Express Gigabit Ethernet Controller'
    class      = network
    subclass   = ethernet
    bar   [10] = type I/O Port, range 32, base 0xc000, size 256, enabled
    bar   [18] = type Prefetchable Memory, range 64, base 0xd0204000, size 4096, enabled
    bar   [20] = type Prefetchable Memory, range 64, base 0xd0200000, size 16384, enabled
    cap 01[40] = powerspec 3  supports D0 D1 D2 D3  current D0
    cap 05[50] = MSI supports 1 message, 64 bit 
    cap 10[70] = PCI-Express 2 endpoint MSI 1 max data 128(128) RO
                 link x1(x1) speed 2.5(2.5) ASPM disabled(L0s/L1)
    cap 11[b0] = MSI-X supports 4 messages, enabled
                 Table in map 0x20[0x0], PBA in map 0x20[0x800]
    cap 03[d0] = VPD
    ecap 0001[100] = AER 1 0 fatal 0 non-fatal 1 corrected
    ecap 0002[140] = VC 1 max VC0
    ecap 0003[160] = Serial 1 a6370000684ce000

re2@pci0:5:0:0:	class=0x020000 card=0x012310ec chip=0x816810ec rev=0x06 hdr=0x00
    vendor     = 'Realtek Semiconductor Co., Ltd.'
    device     = 'RTL8111/8168/8411 PCI Express Gigabit Ethernet Controller'
    class      = network
    subclass   = ethernet
    bar   [10] = type I/O Port, range 32, base 0xb000, size 256, enabled
    bar   [18] = type Prefetchable Memory, range 64, base 0xd0104000, size 4096, enabled
    bar   [20] = type Prefetchable Memory, range 64, base 0xd0100000, size 16384, enabled
    cap 01[40] = powerspec 3  supports D0 D1 D2 D3  current D0
    cap 05[50] = MSI supports 1 message, 64 bit 
    cap 10[70] = PCI-Express 2 endpoint MSI 1 max data 128(128) RO
                 link x1(x1) speed 2.5(2.5) ASPM disabled(L0s/L1)
    cap 11[b0] = MSI-X supports 4 messages, enabled
                 Table in map 0x20[0x0], PBA in map 0x20[0x800]
    cap 03[d0] = VPD
    ecap 0001[100] = AER 1 0 fatal 0 non-fatal 1 corrected
    ecap 0002[140] = VC 1 max VC0
    ecap 0003[160] = Serial 1 a7370000684ce000

re3@pci0:6:0:0:	class=0x020000 card=0x012310ec chip=0x816810ec rev=0x06 hdr=0x00
    vendor     = 'Realtek Semiconductor Co., Ltd.'
    device     = 'RTL8111/8168/8411 PCI Express Gigabit Ethernet Controller'
    class      = network
    subclass   = ethernet
    bar   [10] = type I/O Port, range 32, base 0xa000, size 256, enabled
    bar   [18] = type Prefetchable Memory, range 64, base 0xd0004000, size 4096, enabled
    bar   [20] = type Prefetchable Memory, range 64, base 0xd0000000, size 16384, enabled
    cap 01[40] = powerspec 3  supports D0 D1 D2 D3  current D0
    cap 05[50] = MSI supports 1 message, 64 bit 
    cap 10[70] = PCI-Express 2 endpoint MSI 1 max data 128(128) RO
                 link x1(x1) speed 2.5(2.5) ASPM disabled(L0s/L1)
    cap 11[b0] = MSI-X supports 4 messages, enabled
                 Table in map 0x20[0x0], PBA in map 0x20[0x800]
    cap 03[d0] = VPD
    ecap 0001[100] = AER 1 0 fatal 0 non-fatal 1 corrected
    ecap 0002[140] = VC 1 max VC0
    ecap 0003[160] = Serial 1 a8370000684ce000

re4@pci0:7:0:0:	class=0x020000 card=0x23121565 chip=0x816810ec rev=0x15 hdr=0x00
    vendor     = 'Realtek Semiconductor Co., Ltd.'
    device     = 'RTL8111/8168/8411 PCI Express Gigabit Ethernet Controller'
    class      = network
    subclass   = ethernet
    bar   [10] = type I/O Port, range 32, base 0xe000, size 256, enabled
    bar   [18] = type Memory, range 64, base 0xdf004000, size 4096, enabled
    bar   [20] = type Memory, range 64, base 0xdf000000, size 16384, enabled
    cap 01[40] = powerspec 3  supports D0 D1 D2 D3  current D0
    cap 05[50] = MSI supports 1 message, 64 bit 
    cap 10[70] = PCI-Express 2 endpoint MSI 1 max data 128(128) RO
                 link x1(x1) speed 2.5(2.5) ASPM disabled(L0s/L1)
    cap 11[b0] = MSI-X supports 4 messages, enabled
                 Table in map 0x20[0x0], PBA in map 0x20[0x800]
    ecap 0001[100] = AER 2 0 fatal 0 non-fatal 0 corrected
    ecap 0002[140] = VC 1 max VC0
    ecap 0003[160] = Serial 1 01000000684ce000
    ecap 0018[170] = LTR 1
    ecap 001e[178] = unknown 1
