pcib1@pci0:0:0:0:	class=0x060400 rev=0x00 hdr=0x01 vendor=0x1014 device=0x04c1 subvendor=0x0000 subdevice=0x0000
    vendor     = 'IBM'
    device     = 'POWER9 Host Bridge (PHB4)'
    class      = bridge
    subclass   = PCI-PCI
    cap 01[40] = powerspec 3  supports D0 D3  current D0
    cap 10[48] = PCI-Express 2 root port max data 512(512) ARI enabled
                 max read 128
                 link x2(x16) speed 5.0(16.0)
    ecap 0001[100] = AER 1 0 fatal 0 non-fatal 0 corrected
    ecap 0019[148] = PCIe Sec 1 lane errors 0
    ecap 0026[174] = Physical Layer 16.0 GT/s 1
    ecap 0027[1a0] = Lane Margining at Receiver 1
    ecap 0025[1e8] = Data Link Feature 1

ahci0@pci0:1:0:0:	class=0x010601 rev=0x11 hdr=0x00 vendor=0x1b4b device=0x9235 subvendor=0x1b4b subdevice=0x9235
    vendor     = 'Marvell Technology Group Ltd.'
    device     = '88SE9235 PCIe 2.0 x2 4-port SATA 6 Gb/s Controller'
    class      = mass storage
    subclass   = SATA
    bar   [10] = type I/O Port, range 32, base 0x8000, size 8, disabled
    bar   [14] = type I/O Port, range 32, base 0x8040, size 4, disabled
    bar   [18] = type I/O Port, range 32, base 0x8100, size 8, disabled
    bar   [1c] = type I/O Port, range 32, base 0x8140, size 4, disabled
    bar   [20] = type I/O Port, range 32, base 0x800000, size 32, disabled
    bar   [24] = type Memory, range 32, base 0x80040000, size 2048, enabled
    cap 01[40] = powerspec 3  supports D0 D3  current D0
    cap 05[50] = MSI supports 1 message enabled with 1 message
    cap 10[70] = PCI-Express 2 legacy endpoint max data 512(512) RO
                 max read 512
                 link x2(x2) speed 5.0(5.0) ASPM disabled(L0s/L1)
    cap 12[e0] = SATA Index-Data Pair
    ecap 0001[100] = AER 1 0 fatal 0 non-fatal 0 corrected

pcib3@pci2:0:0:0:	class=0x060400 rev=0x00 hdr=0x01 vendor=0x1014 device=0x04c1 subvendor=0x0000 subdevice=0x0000
    vendor     = 'IBM'
    device     = 'POWER9 Host Bridge (PHB4)'
    class      = bridge
    subclass   = PCI-PCI
    cap 01[40] = powerspec 3  supports D0 D3  current D0
    cap 10[48] = PCI-Express 2 root port max data 128(512) ARI enabled
                 max read 128
                 link x4(x8) speed 8.0(16.0)
    ecap 0001[100] = AER 1 0 fatal 0 non-fatal 0 corrected
    ecap 0019[148] = PCIe Sec 1 lane errors 0
    ecap 0026[174] = Physical Layer 16.0 GT/s 1
    ecap 0027[1a0] = Lane Margining at Receiver 1
    ecap 0025[1e8] = Data Link Feature 1

nvme0@pci2:1:0:0:	class=0x010802 rev=0x03 hdr=0x00 vendor=0x126f device=0x2263 subvendor=0x126f subdevice=0x2263
    vendor     = 'Silicon Motion, Inc.'
    device     = 'SM2263EN/SM2263XT SSD Controller'
    class      = mass storage
    subclass   = NVM
    bar   [10] = type Memory, range 64, base 0x80000000, size 16384, enabled
    cap 01[40] = powerspec 3  supports D0 D3  current D0
    cap 05[50] = MSI supports 8 messages, 64 bit, vector masks 
    cap 10[70] = PCI-Express 2 endpoint max data 128(128) FLR RO
                 max read 512
                 link x4(x4) speed 8.0(8.0) ClockPM disabled
    cap 11[b0] = MSI-X supports 16 messages, enabled
                 Table in map 0x10[0x2000], PBA in map 0x10[0x2100]
    ecap 0001[100] = AER 2 0 fatal 0 non-fatal 0 corrected
    ecap 0019[158] = PCIe Sec 1 lane errors 0xe
    ecap 0018[178] = LTR 1
    ecap 001e[180] = L1 PM Substates 1

pcib5@pci4:0:0:0:	class=0x060400 rev=0x00 hdr=0x01 vendor=0x1014 device=0x04c1 subvendor=0x0000 subdevice=0x0000
    vendor     = 'IBM'
    device     = 'POWER9 Host Bridge (PHB4)'
    class      = bridge
    subclass   = PCI-PCI
    cap 01[40] = powerspec 3  supports D0 D3  current D0
    cap 10[48] = PCI-Express 2 root port max data 512(512) ARI enabled
                 max read 128
                 link x16(x8) speed 2.5(16.0)
    ecap 0001[100] = AER 1 0 fatal 0 non-fatal 0 corrected
    ecap 0019[148] = PCIe Sec 1 lane errors 0
    ecap 0026[174] = Physical Layer 16.0 GT/s 1
    ecap 0027[1a0] = Lane Margining at Receiver 1
    ecap 0025[1e8] = Data Link Feature 1

pcib7@pci6:0:0:0:	class=0x060400 rev=0x00 hdr=0x01 vendor=0x1014 device=0x04c1 subvendor=0x0000 subdevice=0x0000
    vendor     = 'IBM'
    device     = 'POWER9 Host Bridge (PHB4)'
    class      = bridge
    subclass   = PCI-PCI
    cap 01[40] = powerspec 3  supports D0 D3  current D0
    cap 10[48] = PCI-Express 2 root port max data 512(512) ARI enabled
                 max read 128
                 link x1(x16) speed 5.0(16.0)
    ecap 0001[100] = AER 1 0 fatal 0 non-fatal 0 corrected
    ecap 0019[148] = PCIe Sec 1 lane errors 0
    ecap 0026[174] = Physical Layer 16.0 GT/s 1
    ecap 0027[1a0] = Lane Margining at Receiver 1
    ecap 0025[1e8] = Data Link Feature 1

xhci0@pci6:1:0:0:	class=0x0c0330 rev=0x02 hdr=0x00 vendor=0x104c device=0x8241 subvendor=0x1014 subdevice=0x04b2
    vendor     = 'Texas Instruments'
    device     = 'TUSB73x0 SuperSpeed USB 3.0 xHCI Host Controller'
    class      = serial bus
    subclass   = USB
    bar   [10] = type Memory, range 64, base 0x80000000, size 65536, enabled
    bar   [18] = type Memory, range 64, base 0x80010000, size 8192, enabled
    cap 01[40] = powerspec 3  supports D0 D1 D2 D3  current D0
    cap 05[48] = MSI supports 8 messages, 64 bit 
    cap 10[70] = PCI-Express 2 endpoint max data 512(1024) RO
                 max read 512
                 link x1(x1) speed 5.0(5.0) ASPM disabled(L0s/L1) ClockPM disabled
    cap 11[c0] = MSI-X supports 8 messages, enabled
                 Table in map 0x18[0x0], PBA in map 0x18[0x1000]
    ecap 0001[100] = AER 2 0 fatal 0 non-fatal 0 corrected
    ecap 0003[150] = Serial 1 0800280000200000

pcib9@pci8:0:0:0:	class=0x060400 rev=0x00 hdr=0x01 vendor=0x1014 device=0x04c1 subvendor=0x0000 subdevice=0x0000
    vendor     = 'IBM'
    device     = 'POWER9 Host Bridge (PHB4)'
    class      = bridge
    subclass   = PCI-PCI
    cap 01[40] = powerspec 3  supports D0 D3  current D0
    cap 10[48] = PCI-Express 2 root port max data 256(512) ARI enabled
                 max read 128
                 link x2(x8) speed 5.0(16.0)
    ecap 0001[100] = AER 1 0 fatal 0 non-fatal 0 corrected
    ecap 0019[148] = PCIe Sec 1 lane errors 0
    ecap 0026[174] = Physical Layer 16.0 GT/s 1
    ecap 0027[1a0] = Lane Margining at Receiver 1
    ecap 0025[1e8] = Data Link Feature 1

bge0@pci8:1:0:0:	class=0x020000 rev=0x01 hdr=0x00 vendor=0x14e4 device=0x1657 subvendor=0x14e4 subdevice=0x1981
    vendor     = 'Broadcom Inc. and subsidiaries'
    device     = 'NetXtreme BCM5719 Gigabit Ethernet PCIe'
    class      = network
    subclass   = ethernet
    bar   [10] = type Prefetchable Memory, range 64, base 0x6024000000000, size 65536, enabled
    bar   [18] = type Prefetchable Memory, range 64, base 0x6024000010000, size 65536, enabled
    bar   [20] = type Prefetchable Memory, range 64, base 0x6024000020000, size 65536, enabled
    cap 01[48] = powerspec 3  supports D0 D3  current D0
    cap 03[50] = VPD
    cap 05[58] = MSI supports 8 messages, 64 bit enabled with 1 message
    cap 11[a0] = MSI-X supports 17 messages
                 Table in map 0x20[0x0], PBA in map 0x20[0x1000]
    cap 10[ac] = PCI-Express 2 endpoint max data 256(256) FLR
                 max read 2048
                 link x2(x4) speed 5.0(5.0) ASPM disabled(L0s/L1) ClockPM disabled
    ecap 0001[100] = AER 1 0 fatal 0 non-fatal 1 corrected
    ecap 0003[13c] = Serial 1 00002c094d00038b
    ecap 0004[150] = Power Budgeting 1
    ecap 0002[160] = VC 1 max VC0

bge1@pci8:1:0:1:	class=0x020000 rev=0x01 hdr=0x00 vendor=0x14e4 device=0x1657 subvendor=0x14e4 subdevice=0x1981
    vendor     = 'Broadcom Inc. and subsidiaries'
    device     = 'NetXtreme BCM5719 Gigabit Ethernet PCIe'
    class      = network
    subclass   = ethernet
    bar   [10] = type Prefetchable Memory, range 64, base 0x6024000030000, size 65536, enabled
    bar   [18] = type Prefetchable Memory, range 64, base 0x6024000040000, size 65536, enabled
    bar   [20] = type Prefetchable Memory, range 64, base 0x6024000050000, size 65536, enabled
    cap 01[48] = powerspec 3  supports D0 D3  current D0
    cap 03[50] = VPD
    cap 05[58] = MSI supports 8 messages, 64 bit enabled with 1 message
    cap 11[a0] = MSI-X supports 17 messages
                 Table in map 0x20[0x0], PBA in map 0x20[0x1000]
    cap 10[ac] = PCI-Express 2 endpoint max data 256(256) FLR
                 max read 2048
                 link x2(x4) speed 5.0(5.0) ASPM disabled(L0s/L1) ClockPM disabled
    ecap 0001[100] = AER 1 0 fatal 0 non-fatal 1 corrected
    ecap 0003[13c] = Serial 1 00002c094d00038c
    ecap 0004[150] = Power Budgeting 1
    ecap 0002[160] = VC 1 max VC0

pcib11@pci10:0:0:0:	class=0x060400 rev=0x00 hdr=0x01 vendor=0x1014 device=0x04c1 subvendor=0x0000 subdevice=0x0000
    vendor     = 'IBM'
    device     = 'POWER9 Host Bridge (PHB4)'
    class      = bridge
    subclass   = PCI-PCI
    cap 01[40] = powerspec 3  supports D0 D3  current D0
    cap 10[48] = PCI-Express 2 root port max data 256(512) ARI enabled
                 max read 128
                 link x1(x8) speed 5.0(16.0)
    ecap 0001[100] = AER 1 0 fatal 0 non-fatal 0 corrected
    ecap 0019[148] = PCIe Sec 1 lane errors 0
    ecap 0026[174] = Physical Layer 16.0 GT/s 1
    ecap 0027[1a0] = Lane Margining at Receiver 1
    ecap 0025[1e8] = Data Link Feature 1

pcib12@pci10:1:0:0:	class=0x060400 rev=0x04 hdr=0x01 vendor=0x1a03 device=0x1150 subvendor=0x1a03 subdevice=0x1150
    vendor     = 'ASPEED Technology, Inc.'
    device     = 'AST1150 PCI-to-PCI Bridge'
    class      = bridge
    subclass   = PCI-PCI
    cap 05[50] = MSI supports 1 message, 64 bit 
    cap 01[78] = powerspec 3  supports D0 D1 D2 D3  current D0
    cap 10[80] = PCI-Express 2 PCI bridge max data 256(256) RO NS
                 max read 512
                 link x1(x1) speed 5.0(5.0) ASPM disabled(L0s/L1)
    cap 0d[c0] = PCI Bridge subvendor=0x1a03 subdevice=0x1150
    ecap 0002[100] = VC 1 max VC0
    ecap 0001[800] = AER 1 0 fatal 0 non-fatal 0 corrected

vgapci0@pci10:2:0:0:	class=0x030000 rev=0x41 hdr=0x00 vendor=0x1a03 device=0x2000 subvendor=0x1a03 subdevice=0x2000
    vendor     = 'ASPEED Technology, Inc.'
    device     = 'ASPEED Graphics Family'
    class      = display
    subclass   = VGA
    bar   [10] = type Memory, range 32, base 0x80000000, size 16777216, enabled
    bar   [14] = type Memory, range 32, base 0x81000000, size 131072, enabled
    bar   [18] = type I/O Port, range 32, base 0, size 128, enabled
    cap 01[40] = powerspec 3  supports D0 D1 D2 D3  current D0
    cap 05[50] = MSI supports 2 messages, 64 bit 
