hostb0@pci0:0:0:0:	class=0x060000 rev=0x09 hdr=0x00 vendor=0x8086 device=0x0104 subvendor=0x17aa subdevice=0x21f3
    vendor     = 'Intel Corporation'
    device     = '2nd Generation Core Processor Family DRAM Controller'
    class      = bridge
    subclass   = HOST-PCI
    cap 09[e0] = vendor (length 12) Intel cap 0 version 1

pcib1@pci0:0:1:0:	class=0x060400 rev=0x09 hdr=0x01 vendor=0x8086 device=0x0101 subvendor=0x17aa subdevice=0x21f3
    vendor     = 'Intel Corporation'
    device     = 'Xeon E3-1200/2nd Generation Core Processor Family PCI Express Root Port'
    class      = bridge
    subclass   = PCI-PCI
    cap 0d[88] = PCI Bridge subvendor=0x17aa subdevice=0x21f3
    cap 01[80] = powerspec 3  supports D0 D3  current D0
    cap 05[90] = MSI supports 1 message 
    cap 10[a0] = PCI-Express 2 root port max data 128(128)
                 max read 128
                 link x16(x16) speed 2.5(5.0) ASPM L0s/L1(L0s/L1)
                 slot 1 power limit 75000 mW
    ecap 0002[100] = VC 1 max VC0
    ecap 0005[140] = Root Complex Link Declaration 1

xhci0@pci0:0:20:0:	class=0x0c0330 rev=0x04 hdr=0x00 vendor=0x8086 device=0x1e31 subvendor=0x17aa subdevice=0x21f3
    vendor     = 'Intel Corporation'
    device     = '7 Series/C210 Series Chipset Family USB xHCI Host Controller'
    class      = serial bus
    subclass   = USB
    bar   [10] = type Memory, range 64, base 0xf5220000, size 65536, enabled
    cap 01[70] = powerspec 2  supports D0 D3  current D0
    cap 05[80] = MSI supports 8 messages, 64 bit enabled with 1 message

none0@pci0:0:22:0:	class=0x078000 rev=0x04 hdr=0x00 vendor=0x8086 device=0x1e3a subvendor=0x17aa subdevice=0x21f3
    vendor     = 'Intel Corporation'
    device     = '7 Series/C216 Chipset Family MEI Controller'
    class      = simple comms
    bar   [10] = type Memory, range 64, base 0xf5235000, size 16, enabled
    cap 01[50] = powerspec 3  supports D0 D3  current D0
    cap 05[8c] = MSI supports 1 message, 64 bit 

em0@pci0:0:25:0:	class=0x020000 rev=0x04 hdr=0x00 vendor=0x8086 device=0x1502 subvendor=0x17aa subdevice=0x21f3
    vendor     = 'Intel Corporation'
    device     = '82579LM Gigabit Network Connection (Lewisville)'
    class      = network
    subclass   = ethernet
    bar   [10] = type Memory, range 32, base 0xf5200000, size 131072, enabled
    bar   [14] = type Memory, range 32, base 0xf523b000, size 4096, enabled
    bar   [18] = type I/O Port, range 32, base 0x6040, size 32, enabled
    cap 01[c8] = powerspec 2  supports D0 D3  current D0
    cap 05[d0] = MSI supports 1 message, 64 bit enabled with 1 message
    cap 13[e0] = PCI Advanced Features: FLR TP

ehci0@pci0:0:26:0:	class=0x0c0320 rev=0x04 hdr=0x00 vendor=0x8086 device=0x1e2d subvendor=0x17aa subdevice=0x21f3
    vendor     = 'Intel Corporation'
    device     = '7 Series/C216 Chipset Family USB Enhanced Host Controller'
    class      = serial bus
    subclass   = USB
    bar   [10] = type Memory, range 32, base 0xf523a000, size 1024, enabled
    cap 01[50] = powerspec 2  supports D0 D3  current D0
    cap 0a[58] = EHCI Debug Port at offset 0xa0 in map 0x14
    cap 13[98] = PCI Advanced Features: FLR TP

hdac1@pci0:0:27:0:	class=0x040300 rev=0x04 hdr=0x00 vendor=0x8086 device=0x1e20 subvendor=0x17aa subdevice=0x21f3
    vendor     = 'Intel Corporation'
    device     = '7 Series/C216 Chipset Family High Definition Audio Controller'
    class      = multimedia
    subclass   = HDA
    bar   [10] = type Memory, range 64, base 0xf5230000, size 16384, enabled
    cap 01[50] = powerspec 2  supports D0 D3  current D0
    cap 05[60] = MSI supports 1 message, 64 bit enabled with 1 message
    cap 10[70] = PCI-Express 1 root endpoint max data 128(128) FLR NS
                 max read 128
    ecap 0002[100] = VC 1 max VC1
    ecap 0005[130] = Root Complex Link Declaration 1

pcib2@pci0:0:28:0:	class=0x060400 rev=0xc4 hdr=0x01 vendor=0x8086 device=0x1e10 subvendor=0x17aa subdevice=0x21f3
    vendor     = 'Intel Corporation'
    device     = '7 Series/C216 Chipset Family PCI Express Root Port 1'
    class      = bridge
    subclass   = PCI-PCI
    cap 10[40] = PCI-Express 2 root port max data 128(128)
                 max read 128
                 link x1(x1) speed 2.5(5.0) ASPM L1(L0s/L1)
                 slot 0 power limit 100 mW HotPlug(present) surprise
    cap 05[80] = MSI supports 1 message enabled with 1 message
    cap 0d[90] = PCI Bridge subvendor=0x17aa subdevice=0x21f3
    cap 01[a0] = powerspec 2  supports D0 D3  current D0

pcib3@pci0:0:28:1:	class=0x060400 rev=0xc4 hdr=0x01 vendor=0x8086 device=0x1e12 subvendor=0x17aa subdevice=0x21f3
    vendor     = 'Intel Corporation'
    device     = '7 Series/C210 Series Chipset Family PCI Express Root Port 2'
    class      = bridge
    subclass   = PCI-PCI
    cap 10[40] = PCI-Express 2 root port max data 128(128)
                 max read 128
                 link x1(x1) speed 2.5(5.0) ASPM L1(L0s/L1)
                 slot 1 power limit 100 mW
    cap 05[80] = MSI supports 1 message 
    cap 0d[90] = PCI Bridge subvendor=0x17aa subdevice=0x21f3
    cap 01[a0] = powerspec 2  supports D0 D3  current D0

pcib4@pci0:0:28:2:	class=0x060400 rev=0xc4 hdr=0x01 vendor=0x8086 device=0x1e14 subvendor=0x17aa subdevice=0x21f3
    vendor     = 'Intel Corporation'
    device     = '7 Series/C210 Series Chipset Family PCI Express Root Port 3'
    class      = bridge
    subclass   = PCI-PCI
    cap 10[40] = PCI-Express 2 root port max data 128(128)
                 max read 128
                 link x0(x1) speed 0.0(5.0) ASPM L0s/L1(L0s/L1)
                 slot 2 power limit 100 mW HotPlug(empty) surprise
    cap 05[80] = MSI supports 1 message enabled with 1 message
    cap 0d[90] = PCI Bridge subvendor=0x17aa subdevice=0x21f3
    cap 01[a0] = powerspec 2  supports D0 D3  current D0

ehci1@pci0:0:29:0:	class=0x0c0320 rev=0x04 hdr=0x00 vendor=0x8086 device=0x1e26 subvendor=0x17aa subdevice=0x21f3
    vendor     = 'Intel Corporation'
    device     = '7 Series/C216 Chipset Family USB Enhanced Host Controller'
    class      = serial bus
    subclass   = USB
    bar   [10] = type Memory, range 32, base 0xf5239000, size 1024, enabled
    cap 01[50] = powerspec 2  supports D0 D3  current D0
    cap 0a[58] = EHCI Debug Port at offset 0xa0 in map 0x14
    cap 13[98] = PCI Advanced Features: FLR TP

isab0@pci0:0:31:0:	class=0x060100 rev=0x04 hdr=0x00 vendor=0x8086 device=0x1e55 subvendor=0x17aa subdevice=0x21f3
    vendor     = 'Intel Corporation'
    device     = 'QM77 Express Chipset LPC Controller'
    class      = bridge
    subclass   = PCI-ISA
    cap 09[e0] = vendor (length 12) Intel cap 1 version 0
		 features: AMT, 4 PCI-e x1 slots

ahci0@pci0:0:31:2:	class=0x010601 rev=0x04 hdr=0x00 vendor=0x8086 device=0x1e03 subvendor=0x17aa subdevice=0x21f3
    vendor     = 'Intel Corporation'
    device     = '7 Series Chipset Family 6-port SATA Controller [AHCI mode]'
    class      = mass storage
    subclass   = SATA
    bar   [10] = type I/O Port, range 32, base 0x6068, size 8, enabled
    bar   [14] = type I/O Port, range 32, base 0x6074, size 4, enabled
    bar   [18] = type I/O Port, range 32, base 0x6060, size 8, enabled
    bar   [1c] = type I/O Port, range 32, base 0x6070, size 4, enabled
    bar   [20] = type I/O Port, range 32, base 0x6020, size 32, enabled
    bar   [24] = type Memory, range 32, base 0xf5238000, size 2048, enabled
    cap 05[80] = MSI supports 1 message enabled with 1 message
    cap 01[70] = powerspec 3  supports D0 D3  current D0
    cap 12[a8] = SATA Index-Data Pair
    cap 13[b0] = PCI Advanced Features: FLR TP

ichsmb0@pci0:0:31:3:	class=0x0c0500 rev=0x04 hdr=0x00 vendor=0x8086 device=0x1e22 subvendor=0x17aa subdevice=0x21f3
    vendor     = 'Intel Corporation'
    device     = '7 Series/C216 Chipset Family SMBus Controller'
    class      = serial bus
    subclass   = SMBus
    bar   [10] = type Memory, range 64, base 0xf5234000, size 256, enabled
    bar   [20] = type I/O Port, range 32, base 0xefa0, size 32, enabled

vgapci0@pci0:1:0:0:	class=0x030000 rev=0xa1 hdr=0x00 vendor=0x10de device=0x0def subvendor=0x17aa subdevice=0x21f3
    vendor     = 'NVIDIA Corporation'
    device     = 'GF108M [NVS 5400M]'
    class      = display
    subclass   = VGA
    bar   [10] = type Memory, range 32, base 0xf2000000, size 16777216, enabled
    bar   [14] = type Prefetchable Memory, range 64, base 0xe0000000, size 268435456, enabled
    bar   [1c] = type Prefetchable Memory, range 64, base 0xf0000000, size 33554432, enabled
    bar   [24] = type I/O Port, range 32, base 0x5000, size 128, enabled
    cap 01[60] = powerspec 3  supports D0 D3  current D0
    cap 05[68] = MSI supports 1 message, 64 bit enabled with 1 message
    cap 10[78] = PCI-Express 2 endpoint max data 128(128) RO NS
                 max read 512
                 link x16(x16) speed 2.5(2.5) ASPM L0s/L1(L0s/L1) ClockPM enabled
    cap 09[b4] = vendor (length 20)
    ecap 0002[100] = VC 1 max VC0
    ecap 0004[128] = Power Budgeting 1
    ecap 000b[600] = Vendor [1] ID 0001 Rev 1 Length 36

hdac0@pci0:1:0:1:	class=0x040300 rev=0xa1 hdr=0x00 vendor=0x10de device=0x0bea subvendor=0x17aa subdevice=0x21f3
    vendor     = 'NVIDIA Corporation'
    device     = 'GF108 High Definition Audio Controller'
    class      = multimedia
    subclass   = HDA
    bar   [10] = type Memory, range 32, base 0xf3000000, size 16384, enabled
    cap 01[60] = powerspec 3  supports D0 D3  current D0
    cap 05[68] = MSI supports 1 message, 64 bit 
    cap 10[78] = PCI-Express 2 endpoint max data 128(128) RO NS
                 max read 512
                 link x16(x16) speed 2.5(2.5) ASPM L0s/L1(L0s/L1) ClockPM enabled

sdhci_pci0@pci0:2:0:0:	class=0x088001 rev=0x04 hdr=0x00 vendor=0x1180 device=0xe823 subvendor=0x17aa subdevice=0x21f3
    vendor     = 'Ricoh Co Ltd'
    device     = 'PCIe SDXC/MMC Host Controller'
    class      = base peripheral
    bar   [10] = type Memory, range 32, base 0xf4a00000, size 256, enabled
    cap 05[50] = MSI supports 1 message, 64 bit enabled with 1 message
    cap 01[78] = powerspec 3  supports D0 D1 D2 D3  current D0
    cap 10[80] = PCI-Express 1 endpoint max data 128(128) RO NS
                 max read 512
                 link x1(x1) speed 2.5(2.5) ASPM L1(L0s/L1) ClockPM enabled
    ecap 0002[100] = VC 1 max VC0
    ecap 0001[800] = AER 1 0 fatal 0 non-fatal 2 corrected

iwn0@pci0:3:0:0:	class=0x028000 rev=0xc4 hdr=0x00 vendor=0x8086 device=0x0891 subvendor=0x8086 subdevice=0x4222
    vendor     = 'Intel Corporation'
    device     = 'Centrino Wireless-N 2200'
    class      = network
    bar   [10] = type Memory, range 64, base 0xf4900000, size 8192, enabled
    cap 01[c8] = powerspec 3  supports D0 D3  current D0
    cap 05[d0] = MSI supports 1 message, 64 bit enabled with 1 message
    cap 10[e0] = PCI-Express 1 endpoint max data 128(128) FLR RO NS
                 max read 128
                 link x1(x1) speed 2.5(2.5) ASPM L1(L0s/L1) ClockPM enabled
    ecap 0001[100] = AER 1 0 fatal 0 non-fatal 1 corrected
    ecap 0003[140] = Serial 1 9c4e36ffff847174
