hostb0@pci0:0:0:0:	class=0x060000 card=0x50001458 chip=0x3ec28086 rev=0x0d hdr=0x00
    vendor     = 'Intel Corporation'
    device     = '8th Gen Core Processor Host Bridge/DRAM Registers'
    class      = bridge
    subclass   = HOST-PCI
    cap 09[e0] = vendor (length 16) Intel cap 0 version 1

pcib1@pci0:0:1:0:	class=0x060400 card=0x50001458 chip=0x19018086 rev=0x0d hdr=0x01
    vendor     = 'Intel Corporation'
    device     = 'Xeon E3-1200 v5/E3-1500 v5/6th Gen Core Processor PCIe Controller (x16)'
    class      = bridge
    subclass   = PCI-PCI
    cap 0d[88] = PCI Bridge card=0x50001458
    cap 01[80] = powerspec 3  supports D0 D3  current D0
    cap 05[90] = MSI supports 1 message 
    cap 10[a0] = PCI-Express 2 root port max data 256(256)
                 link x4(x16) speed 2.5(8.0) ASPM disabled(L0s/L1)
                 slot 1 power limit 75000 mW
    ecap 0002[100] = VC 1 max VC0
    ecap 0005[140] = Root Complex Link Declaration 1
    ecap 0019[d94] = PCIe Sec 1 lane errors 0

vgapci0@pci0:0:2:0:	class=0x030000 card=0xd0001458 chip=0x3e988086 rev=0x02 hdr=0x00
    vendor     = 'Intel Corporation'
    class      = display
    subclass   = VGA
    bar   [10] = type Memory, range 64, base 0xf6000000, size 16777216, enabled
    bar   [18] = type Prefetchable Memory, range 64, base 0xe0000000, size 268435456, enabled
    bar   [20] = type I/O Port, range 32, base 0xf000, size 64, enabled
    cap 09[40] = vendor (length 12) Intel cap 0 version 1
    cap 10[70] = PCI-Express 2 root endpoint max data 128(128) FLR
    cap 05[ac] = MSI supports 1 message 
    cap 01[d0] = powerspec 2  supports D0 D3  current D0
    ecap 001b[100] = unknown 1
    ecap 000f[200] = ATS 1
    ecap 0013[300] = unknown 1

none0@pci0:0:8:0:	class=0x088000 card=0x50001458 chip=0x19118086 rev=0x00 hdr=0x00
    vendor     = 'Intel Corporation'
    device     = 'Xeon E3-1200 v5/v6 / E3-1500 v5 / 6th/7th Gen Core Processor Gaussian Mixture Model'
    class      = base peripheral
    bar   [10] = type Memory, range 64, base 0xf724e000, size 4096, enabled
    cap 05[90] = MSI supports 1 message 
    cap 01[dc] = powerspec 2  supports D0 D3  current D0
    cap 13[f0] = PCI Advanced Features: FLR TP

xhci0@pci0:0:20:0:	class=0x0c0330 card=0x50071458 chip=0xa2af8086 rev=0x00 hdr=0x00
    vendor     = 'Intel Corporation'
    device     = '200 Series/Z370 Chipset Family USB 3.0 xHCI Controller'
    class      = serial bus
    subclass   = USB
    bar   [10] = type Memory, range 64, base 0xf7230000, size 65536, enabled
    cap 01[70] = powerspec 2  supports D0 D3  current D0
    cap 05[80] = MSI supports 8 messages, 64 bit enabled with 1 message

none1@pci0:0:22:0:	class=0x078000 card=0x1c3a1458 chip=0xa2ba8086 rev=0x00 hdr=0x00
    vendor     = 'Intel Corporation'
    device     = '200 Series PCH CSME HECI'
    class      = simple comms
    bar   [10] = type Memory, range 64, base 0xf724d000, size 4096, enabled
    cap 01[50] = powerspec 3  supports D0 D3  current D0
    cap 05[8c] = MSI supports 1 message, 64 bit 

ahci0@pci0:0:23:0:	class=0x010400 card=0xb0051458 chip=0x28228086 rev=0x00 hdr=0x00
    vendor     = 'Intel Corporation'
    device     = 'SATA Controller [RAID mode]'
    class      = mass storage
    subclass   = RAID
    bar   [10] = type Memory, range 32, base 0xf7248000, size 8192, enabled
    bar   [14] = type Memory, range 32, base 0xf724c000, size 256, enabled
    bar   [18] = type I/O Port, range 32, base 0xf090, size 8, enabled
    bar   [1c] = type I/O Port, range 32, base 0xf080, size 4, enabled
    bar   [20] = type I/O Port, range 32, base 0xf060, size 32, enabled
    bar   [24] = type Memory, range 32, base 0xf724b000, size 2048, enabled
    cap 05[80] = MSI supports 1 message enabled with 1 message
    cap 01[70] = powerspec 3  supports D0 D3  current D0
    cap 12[a8] = SATA Index-Data Pair

pcib5@pci0:0:27:0:	class=0x060400 card=0x50011458 chip=0xa2e98086 rev=0xf0 hdr=0x01
    vendor     = 'Intel Corporation'
    device     = '200 Series PCH PCI Express Root Port'
    class      = bridge
    subclass   = PCI-PCI
    cap 10[40] = PCI-Express 2 root port max data 128(256) ARI disabled
                 link x0(x1) speed 0.0(8.0)
                 slot 22 power limit 100 mW
    cap 05[80] = MSI supports 1 message 
    cap 0d[90] = PCI Bridge card=0x50011458
    cap 01[a0] = powerspec 3  supports D0 D3  current D0
    ecap 0001[100] = AER 1 0 fatal 0 non-fatal 0 corrected
    ecap 000d[140] = ACS 1
    ecap 0019[220] = PCIe Sec 1 lane errors 0

pcib6@pci0:0:27:3:	class=0x060400 card=0x50011458 chip=0xa2ea8086 rev=0xf0 hdr=0x01
    vendor     = 'Intel Corporation'
    device     = '200 Series PCH PCI Express Root Port'
    class      = bridge
    subclass   = PCI-PCI
    cap 10[40] = PCI-Express 2 root port max data 128(256) ARI disabled
                 link x0(x1) speed 0.0(8.0)
                 slot 23 power limit 100 mW
    cap 05[80] = MSI supports 1 message 
    cap 0d[90] = PCI Bridge card=0x50011458
    cap 01[a0] = powerspec 3  supports D0 D3  current D0
    ecap 0001[100] = AER 1 0 fatal 0 non-fatal 0 corrected
    ecap 000d[140] = ACS 1
    ecap 0019[220] = PCIe Sec 1 lane errors 0

pcib7@pci0:0:27:4:	class=0x060400 card=0x50011458 chip=0xa2eb8086 rev=0xf0 hdr=0x01
    vendor     = 'Intel Corporation'
    device     = '200 Series PCH PCI Express Root Port'
    class      = bridge
    subclass   = PCI-PCI
    cap 10[40] = PCI-Express 2 root port max data 128(256) ARI disabled
                 link x0(x4) speed 0.0(8.0)
                 slot 24 power limit 250 mW
    cap 05[80] = MSI supports 1 message 
    cap 0d[90] = PCI Bridge card=0x50011458
    cap 01[a0] = powerspec 3  supports D0 D3  current D0
    ecap 0001[100] = AER 1 0 fatal 0 non-fatal 0 corrected
    ecap 000d[140] = ACS 1
    ecap 0019[220] = PCIe Sec 1 lane errors 0

pcib8@pci0:0:28:0:	class=0x060400 card=0x50011458 chip=0xa2928086 rev=0xf0 hdr=0x01
    vendor     = 'Intel Corporation'
    device     = '200 Series PCH PCI Express Root Port'
    class      = bridge
    subclass   = PCI-PCI
    cap 10[40] = PCI-Express 2 root port max data 128(256) ARI disabled
                 link x0(x1) speed 0.0(8.0)
                 slot 6 power limit 100 mW
    cap 05[80] = MSI supports 1 message 
    cap 0d[90] = PCI Bridge card=0x50011458
    cap 01[a0] = powerspec 3  supports D0 D3  current D0
    ecap 0001[100] = AER 1 0 fatal 0 non-fatal 0 corrected
    ecap 000d[140] = ACS 1
    ecap 0019[220] = PCIe Sec 1 lane errors 0

pcib9@pci0:0:28:3:	class=0x060400 card=0x50011458 chip=0xa2938086 rev=0xf0 hdr=0x01
    vendor     = 'Intel Corporation'
    device     = '200 Series PCH PCI Express Root Port'
    class      = bridge
    subclass   = PCI-PCI
    cap 10[40] = PCI-Express 2 root port max data 128(256) ARI disabled
                 link x0(x1) speed 0.0(8.0)
                 slot 7 power limit 100 mW
    cap 05[80] = MSI supports 1 message 
    cap 0d[90] = PCI Bridge card=0x50011458
    cap 01[a0] = powerspec 3  supports D0 D3  current D0
    ecap 0001[100] = AER 1 0 fatal 0 non-fatal 0 corrected
    ecap 000d[140] = ACS 1
    ecap 0019[220] = PCIe Sec 1 lane errors 0

pcib10@pci0:0:28:5:	class=0x060400 card=0x50011458 chip=0xa2958086 rev=0xf0 hdr=0x01
    vendor     = 'Intel Corporation'
    device     = '200 Series PCH PCI Express Root Port'
    class      = bridge
    subclass   = PCI-PCI
    cap 10[40] = PCI-Express 2 root port max data 128(256) ARI disabled
                 link x0(x1) speed 0.0(8.0)
                 slot 9 power limit 100 mW
    cap 05[80] = MSI supports 1 message 
    cap 0d[90] = PCI Bridge card=0x50011458
    cap 01[a0] = powerspec 3  supports D0 D3  current D0
    ecap 0001[100] = AER 1 0 fatal 0 non-fatal 0 corrected
    ecap 000d[140] = ACS 1
    ecap 0019[220] = PCIe Sec 1 lane errors 0

pcib11@pci0:0:28:6:	class=0x060400 card=0x50011458 chip=0xa2968086 rev=0xf0 hdr=0x01
    vendor     = 'Intel Corporation'
    device     = '200 Series PCH PCI Express Root Port'
    class      = bridge
    subclass   = PCI-PCI
    cap 10[40] = PCI-Express 2 root port max data 128(256) ARI disabled
                 link x0(x1) speed 0.0(8.0)
                 slot 10 power limit 100 mW
    cap 05[80] = MSI supports 1 message 
    cap 0d[90] = PCI Bridge card=0x50011458
    cap 01[a0] = powerspec 3  supports D0 D3  current D0
    ecap 0001[100] = AER 1 0 fatal 0 non-fatal 0 corrected
    ecap 000d[140] = ACS 1
    ecap 0019[220] = PCIe Sec 1 lane errors 0

pcib12@pci0:0:28:7:	class=0x060400 card=0x50011458 chip=0xa2978086 rev=0xf0 hdr=0x01
    vendor     = 'Intel Corporation'
    device     = '200 Series PCH PCI Express Root Port'
    class      = bridge
    subclass   = PCI-PCI
    cap 10[40] = PCI-Express 2 root port max data 256(256) ARI disabled
                 link x1(x1) speed 2.5(8.0)
                 slot 11 power limit 100 mW
    cap 05[80] = MSI supports 1 message 
    cap 0d[90] = PCI Bridge card=0x50011458
    cap 01[a0] = powerspec 3  supports D0 D3  current D0
    ecap 0001[100] = AER 1 0 fatal 0 non-fatal 0 corrected
    ecap 000d[140] = ACS 1
    ecap 0019[220] = PCIe Sec 1 lane errors 0

pcib14@pci0:0:29:0:	class=0x060400 card=0x50011458 chip=0xa2988086 rev=0xf0 hdr=0x01
    vendor     = 'Intel Corporation'
    device     = '200 Series PCH PCI Express Root Port'
    class      = bridge
    subclass   = PCI-PCI
    cap 10[40] = PCI-Express 2 root port max data 128(256) ARI disabled
                 link x0(x4) speed 0.0(8.0)
                 slot 12 power limit 250 mW
    cap 05[80] = MSI supports 1 message 
    cap 0d[90] = PCI Bridge card=0x50011458
    cap 01[a0] = powerspec 3  supports D0 D3  current D0
    ecap 0001[100] = AER 1 0 fatal 0 non-fatal 0 corrected
    ecap 000d[140] = ACS 1
    ecap 0019[220] = PCIe Sec 1 lane errors 0

isab0@pci0:0:31:0:	class=0x060100 card=0x50011458 chip=0xa2cc8086 rev=0x00 hdr=0x00
    vendor     = 'Intel Corporation'
    class      = bridge
    subclass   = PCI-ISA

none2@pci0:0:31:2:	class=0x058000 card=0x50011458 chip=0xa2a18086 rev=0x00 hdr=0x00
    vendor     = 'Intel Corporation'
    device     = '200 Series/Z370 Chipset Family Power Management Controller'
    class      = memory
    bar   [10] = type Memory, range 32, base 0xf7244000, size 16384, enabled

hdac0@pci0:0:31:3:	class=0x040300 card=0xa1821458 chip=0xa2f08086 rev=0x00 hdr=0x00
    vendor     = 'Intel Corporation'
    device     = '200 Series PCH HD Audio'
    class      = multimedia
    subclass   = HDA
    bar   [10] = type Memory, range 64, base 0xf7240000, size 16384, enabled
    bar   [20] = type Memory, range 64, base 0xf7220000, size 65536, enabled
    cap 01[50] = powerspec 3  supports D0 D3  current D0
    cap 05[60] = MSI supports 1 message, 64 bit enabled with 1 message

none3@pci0:0:31:4:	class=0x0c0500 card=0x50011458 chip=0xa2a38086 rev=0x00 hdr=0x00
    vendor     = 'Intel Corporation'
    device     = '200 Series/Z370 Chipset Family SMBus Controller'
    class      = serial bus
    subclass   = SMBus
    bar   [10] = type Memory, range 64, base 0xf724a000, size 256, enabled
    bar   [20] = type I/O Port, range 32, base 0xf040, size 32, enabled

em4@pci0:0:31:6:	class=0x020000 card=0xe0001458 chip=0x15b88086 rev=0x00 hdr=0x00
    vendor     = 'Intel Corporation'
    device     = 'Ethernet Connection (2) I219-V'
    class      = network
    subclass   = ethernet
    bar   [10] = type Memory, range 32, base 0xf7200000, size 131072, enabled
    cap 01[c8] = powerspec 3  supports D0 D3  current D0
    cap 05[d0] = MSI supports 1 message, 64 bit enabled with 1 message
    cap 13[e0] = PCI Advanced Features: FLR TP

pcib2@pci0:1:0:0:	class=0x060400 card=0x00000000 chip=0x8018111d rev=0x0e hdr=0x01
    vendor     = 'Microsemi / PMC / IDT'
    device     = 'PES12N3A 12-lane 3-Port PCI Express Switch'
    class      = bridge
    subclass   = PCI-PCI
    cap 10[40] = PCI-Express 1 upstream port max data 256(2048)
                 link x4(x4) speed 2.5(2.5) ASPM disabled(L0s/L1)
    cap 01[c0] = powerspec 3  supports D0 D3  current D0
    ecap 0001[100] = AER 1 0 fatal 0 non-fatal 1 corrected
    ecap 0002[200] = VC 1 max VC0

pcib3@pci0:2:2:0:	class=0x060400 card=0x00000000 chip=0x8018111d rev=0x0e hdr=0x01
    vendor     = 'Microsemi / PMC / IDT'
    device     = 'PES12N3A 12-lane 3-Port PCI Express Switch'
    class      = bridge
    subclass   = PCI-PCI
    cap 10[40] = PCI-Express 1 downstream port max data 256(2048)
                 link x4(x4) speed 2.5(2.5) ASPM disabled(L0s/L1)
    cap 01[c0] = powerspec 3  supports D0 D3  current D0
    cap 05[d0] = MSI supports 1 message, 64 bit 
    ecap 0001[100] = AER 1 0 fatal 0 non-fatal 1 corrected
    ecap 0002[200] = VC 1 max VC0

pcib4@pci0:2:4:0:	class=0x060400 card=0x00000000 chip=0x8018111d rev=0x0e hdr=0x01
    vendor     = 'Microsemi / PMC / IDT'
    device     = 'PES12N3A 12-lane 3-Port PCI Express Switch'
    class      = bridge
    subclass   = PCI-PCI
    cap 10[40] = PCI-Express 1 downstream port max data 256(2048)
                 link x4(x4) speed 2.5(2.5) ASPM disabled(L0s/L1)
    cap 01[c0] = powerspec 3  supports D0 D3  current D0
    cap 05[d0] = MSI supports 1 message, 64 bit 
    ecap 0001[100] = AER 1 0 fatal 0 non-fatal 1 corrected
    ecap 0002[200] = VC 1 max VC0

em0@pci0:3:0:0:	class=0x020000 card=0x10bc8086 chip=0x10bc8086 rev=0x06 hdr=0x00
    vendor     = 'Intel Corporation'
    device     = '82571EB/82571GB Gigabit Ethernet Controller (Copper)'
    class      = network
    subclass   = ethernet
    bar   [10] = type Memory, range 32, base 0xf71a0000, size 131072, enabled
    bar   [14] = type Memory, range 32, base 0xf7180000, size 131072, enabled
    bar   [18] = type I/O Port, range 32, base 0xe020, size 32, enabled
    cap 01[c8] = powerspec 2  supports D0 D3  current D0
    cap 05[d0] = MSI supports 1 message, 64 bit enabled with 1 message
    cap 10[e0] = PCI-Express 1 endpoint max data 256(256) RO NS
                 link x4(x4) speed 2.5(2.5) ASPM disabled(L0s)
    ecap 0001[100] = AER 1 0 fatal 1 non-fatal 0 corrected
    ecap 0003[140] = Serial 1 a0369fffff189504

em1@pci0:3:0:1:	class=0x020000 card=0x10bc8086 chip=0x10bc8086 rev=0x06 hdr=0x00
    vendor     = 'Intel Corporation'
    device     = '82571EB/82571GB Gigabit Ethernet Controller (Copper)'
    class      = network
    subclass   = ethernet
    bar   [10] = type Memory, range 32, base 0xf7140000, size 131072, enabled
    bar   [14] = type Memory, range 32, base 0xf7120000, size 131072, enabled
    bar   [18] = type I/O Port, range 32, base 0xe000, size 32, enabled
    cap 01[c8] = powerspec 2  supports D0 D3  current D0
    cap 05[d0] = MSI supports 1 message, 64 bit enabled with 1 message
    cap 10[e0] = PCI-Express 1 endpoint max data 256(256) RO NS
                 link x4(x4) speed 2.5(2.5) ASPM disabled(L0s)
    ecap 0001[100] = AER 1 0 fatal 1 non-fatal 0 corrected
    ecap 0003[140] = Serial 1 a0369fffff189504

em2@pci0:4:0:0:	class=0x020000 card=0x10bc8086 chip=0x10bc8086 rev=0x06 hdr=0x00
    vendor     = 'Intel Corporation'
    device     = '82571EB/82571GB Gigabit Ethernet Controller (Copper)'
    class      = network
    subclass   = ethernet
    bar   [10] = type Memory, range 32, base 0xf70a0000, size 131072, enabled
    bar   [14] = type Memory, range 32, base 0xf7080000, size 131072, enabled
    bar   [18] = type I/O Port, range 32, base 0xd020, size 32, enabled
    cap 01[c8] = powerspec 2  supports D0 D3  current D0
    cap 05[d0] = MSI supports 1 message, 64 bit enabled with 1 message
    cap 10[e0] = PCI-Express 1 endpoint max data 256(256) RO NS
                 link x4(x4) speed 2.5(2.5) ASPM disabled(L0s)
    ecap 0001[100] = AER 1 0 fatal 1 non-fatal 0 corrected
    ecap 0003[140] = Serial 1 a0369fffff189506

em3@pci0:4:0:1:	class=0x020000 card=0x10bc8086 chip=0x10bc8086 rev=0x06 hdr=0x00
    vendor     = 'Intel Corporation'
    device     = '82571EB/82571GB Gigabit Ethernet Controller (Copper)'
    class      = network
    subclass   = ethernet
    bar   [10] = type Memory, range 32, base 0xf7040000, size 131072, enabled
    bar   [14] = type Memory, range 32, base 0xf7020000, size 131072, enabled
    bar   [18] = type I/O Port, range 32, base 0xd000, size 32, enabled
    cap 01[c8] = powerspec 2  supports D0 D3  current D0
    cap 05[d0] = MSI supports 1 message, 64 bit enabled with 1 message
    cap 10[e0] = PCI-Express 1 endpoint max data 256(256) RO NS
                 link x4(x4) speed 2.5(2.5) ASPM disabled(L0s)
    ecap 0001[100] = AER 1 0 fatal 1 non-fatal 0 corrected
    ecap 0003[140] = Serial 1 a0369fffff189506

pcib13@pci0:12:0:0:	class=0x060401 card=0x00000000 chip=0x88921283 rev=0x71 hdr=0x01
    vendor     = 'Integrated Technology Express, Inc.'
    device     = 'IT8892E PCIe to PCI Bridge'
    class      = bridge
    subclass   = PCI-PCI
    cap 01[90] = powerspec 2  supports D0 D1 D2 D3  current D0
    cap 0d[a0] = PCI Bridge card=0x00000000
