hostb0@pci0:0:0:0:	class=0x060000 rev=0x05 hdr=0x00 vendor=0x8086 device=0x4650 subvendor=0x1849 subdevice=0x4650
    vendor     = 'Intel Corporation'
    class      = bridge
    subclass   = HOST-PCI

pcib1@pci0:0:1:0:	class=0x060400 rev=0x05 hdr=0x01 vendor=0x8086 device=0x460d subvendor=0x1849 subdevice=0x460d
    vendor     = 'Intel Corporation'
    class      = bridge
    subclass   = PCI-PCI
    cap 10[40] = PCI-Express 2 root port max data 256(256) ARI enabled
                 max read 128
                 link x8(x16) speed 8.0(undef)
                 slot 1 power limit 75000 mW
    cap 05[80] = MSI supports 1 message, 64 bit 
    cap 0d[98] = PCI Bridge subvendor=0x1849 subdevice=0x460d
    cap 01[a0] = powerspec 3  supports D0 D3  current D0
    ecap 0000[100] = unknown 0
    ecap 000d[220] = ACS 1
    ecap 001f[150] = Precision Time Measurement 1
    ecap 0019[a30] = PCIe Sec 1 lane errors 0
    ecap 0025[a90] = Data Link Feature 1
    ecap 0026[a9c] = Physical Layer 16.0 GT/s 1
    ecap 0027[edc] = Lane Margining at Receiver 1
    ecap 002a[adc] = Physical Layer 32.0 GT/s 1

vgapci0@pci0:0:2:0:	class=0x030000 rev=0x0c hdr=0x00 vendor=0x8086 device=0x4690 subvendor=0x1849 subdevice=0x4690
    vendor     = 'Intel Corporation'
    class      = display
    subclass   = VGA
    bar   [10] = type Memory, range 64, base 0x6001000000, size 16777216, enabled
    bar   [18] = type Prefetchable Memory, range 64, base 0x4000000000, size 268435456, enabled
    bar   [20] = type I/O Port, range 32, base 0x3000, size 64, enabled
    cap 09[40] = vendor (length 12) Intel cap 0 version 1
    cap 10[70] = PCI-Express 2 root endpoint max data 128(128) FLR
                 max read 128
    cap 05[ac] = MSI supports 1 message, vector masks 
    cap 01[d0] = powerspec 2  supports D0 D3  current D0
    ecap 001b[100] = Process Address Space ID 1
    ecap 000f[200] = ATS 1
    ecap 0013[300] = Page Page Request 1
    ecap 0010[320] = SR-IOV 1 IOV disabled, Memory Space disabled, ARI disabled
                     0 VFs configured out of 7 supported
                     First VF RID Offset 0x0001, VF RID Stride 0x0001
                     VF Device ID 0x4690
                     Page Sizes: 4096 (enabled), 8192, 65536, 262144, 1048576, 4194304

pcib2@pci0:0:6:0:	class=0x060400 rev=0x05 hdr=0x01 vendor=0x8086 device=0x464d subvendor=0x0000 subdevice=0x0000
    vendor     = 'Intel Corporation'
    class      = bridge
    subclass   = PCI-PCI
    cap 10[40] = PCI-Express 2 root port max data 256(256) ARI enabled
                 max read 128
                 link x4(x4) speed 8.0(16.0)
                 slot 0 power limit 75000 mW
    cap 05[80] = MSI supports 1 message 
    cap 0d[90] = PCI Bridge subvendor=0x0000 subdevice=0x0000
    cap 01[a0] = powerspec 3  supports D0 D3  current D0
    ecap 0000[100] = unknown 0
    ecap 000d[220] = ACS 1
    ecap 001f[150] = Precision Time Measurement 1
    ecap 0002[280] = VC 1 max VC1
    ecap 0019[a30] = PCIe Sec 1 lane errors 0
    ecap 0025[a90] = Data Link Feature 1
    ecap 0026[a9c] = Physical Layer 16.0 GT/s 1
    ecap 0027[edc] = Lane Margining at Receiver 1

xhci0@pci0:0:20:0:	class=0x0c0330 rev=0x11 hdr=0x00 vendor=0x8086 device=0x7ae0 subvendor=0x1849 subdevice=0x7ae0
    vendor     = 'Intel Corporation'
    class      = serial bus
    subclass   = USB
    bar   [10] = type Memory, range 64, base 0x6002000000, size 65536, enabled
    cap 01[70] = powerspec 2  supports D0 D3  current D0
    cap 05[80] = MSI supports 8 messages, 64 bit enabled with 1 message
    cap 09[90] = vendor (length 20) Intel cap 15 version 0
    cap 09[b0] = vendor (length 0) Intel cap 0 version 1

none0@pci0:0:20:2:	class=0x050000 rev=0x11 hdr=0x00 vendor=0x8086 device=0x7aa7 subvendor=0x0000 subdevice=0x0000
    vendor     = 'Intel Corporation'
    class      = memory
    subclass   = RAM
    bar   [10] = type Memory, range 64, base 0x6002010000, size 16384, enabled
    bar   [18] = type Memory, range 64, base 0x6002017000, size 4096, enabled
    cap 01[80] = powerspec 3  supports D0 D3  current D0

ig4iic0@pci0:0:21:0:	class=0x0c8000 rev=0x11 hdr=0x00 vendor=0x8086 device=0x7acc subvendor=0x1849 subdevice=0x7acc
    vendor     = 'Intel Corporation'
    class      = serial bus
    bar   [10] = type Memory, range 64, base 0x80000000, size 4096, enabled
    cap 01[80] = powerspec 3  supports D0 D3  current D0
    cap 09[90] = vendor (length 20) Intel cap 15 version 0

none1@pci0:0:22:0:	class=0x078000 rev=0x11 hdr=0x00 vendor=0x8086 device=0x7ae8 subvendor=0x1849 subdevice=0x7ae8
    vendor     = 'Intel Corporation'
    class      = simple comms
    bar   [10] = type Memory, range 64, base 0x6002015000, size 4096, enabled
    cap 01[50] = powerspec 3  supports D0 D3  current D0
    cap 05[8c] = MSI supports 1 message, 64 bit 
    cap 09[a4] = vendor (length 20) Intel cap 15 version 0

isab0@pci0:0:31:0:	class=0x060100 rev=0x11 hdr=0x00 vendor=0x8086 device=0x7a84 subvendor=0x1849 subdevice=0x7a84
    vendor     = 'Intel Corporation'
    class      = bridge
    subclass   = PCI-ISA

ichsmb0@pci0:0:31:4:	class=0x0c0500 rev=0x11 hdr=0x00 vendor=0x8086 device=0x7aa3 subvendor=0x1849 subdevice=0x7aa3
    vendor     = 'Intel Corporation'
    class      = serial bus
    subclass   = SMBus
    bar   [10] = type Memory, range 64, base 0x6002014000, size 256, enabled
    bar   [20] = type I/O Port, range 32, base 0xefa0, size 32, enabled

none2@pci0:0:31:5:	class=0x0c8000 rev=0x11 hdr=0x00 vendor=0x8086 device=0x7aa4 subvendor=0x1849 subdevice=0x7aa4
    vendor     = 'Intel Corporation'
    class      = serial bus
    bar   [10] = type Memory, range 32, base 0xfe010000, size 4096, enabled

bnxt0@pci0:1:0:0:	class=0x020000 rev=0x01 hdr=0x00 vendor=0x14e4 device=0x16d6 subvendor=0x14e4 subdevice=0x4124
    vendor     = 'Broadcom Inc. and subsidiaries'
    device     = 'BCM57412 NetXtreme-E 10Gb RDMA Ethernet Controller'
    class      = network
    subclass   = ethernet
    bar   [10] = type Prefetchable Memory, range 64, base 0x6000120000, size 65536, enabled
    bar   [18] = type Prefetchable Memory, range 64, base 0x6000000000, size 1048576, enabled
    bar   [20] = type Prefetchable Memory, range 64, base 0x6000132000, size 8192, enabled
    cap 01[48] = powerspec 3  supports D0 D3  current D0
    cap 03[50] = VPD
    cap 05[58] = MSI supports 8 messages, 64 bit 
    cap 11[a0] = MSI-X supports 74 messages, enabled
                 Table in map 0x20[0x0], PBA in map 0x20[0x4a0]
    cap 10[ac] = PCI-Express 2 endpoint max data 256(512) FLR RO NS
                 max read 512
                 link x8(x8) speed 8.0(8.0) ClockPM enabled
    ecap 0001[100] = AER 1 0 fatal 0 non-fatal 1 corrected
    ecap 0003[13c] = Serial 1 84160cfffecc1080
    ecap 0004[150] = Power Budgeting 1
    ecap 0002[160] = VC 1 max VC0
    ecap 000b[180] = Vendor [1] ID 0000 Rev 0 Length 32
    ecap 0018[1b0] = LTR 1
    ecap 000e[1b8] = ARI 1
    ecap 0017[230] = TPH Requester 1
    ecap 0019[300] = PCIe Sec 1 lane errors 0
    ecap 001f[200] = Precision Time Measurement 1

bnxt1@pci0:1:0:1:	class=0x020000 rev=0x01 hdr=0x00 vendor=0x14e4 device=0x16d6 subvendor=0x14e4 subdevice=0x4124
    vendor     = 'Broadcom Inc. and subsidiaries'
    device     = 'BCM57412 NetXtreme-E 10Gb RDMA Ethernet Controller'
    class      = network
    subclass   = ethernet
    bar   [10] = type Prefetchable Memory, range 64, base 0x6000110000, size 65536, enabled
    bar   [18] = type Prefetchable Memory, range 64, base 0x6000100000, size 65536, enabled
    bar   [20] = type Prefetchable Memory, range 64, base 0x6000130000, size 8192, enabled
    cap 01[48] = powerspec 3  supports D0 D3  current D0
    cap 03[50] = VPD
    cap 05[58] = MSI supports 8 messages, 64 bit 
    cap 11[a0] = MSI-X supports 74 messages, enabled
                 Table in map 0x20[0x0], PBA in map 0x20[0x4a0]
    cap 10[ac] = PCI-Express 2 endpoint max data 256(512) FLR RO NS
                 max read 512
                 link x8(x8) speed 8.0(8.0) ClockPM enabled
    ecap 0001[100] = AER 1 0 fatal 0 non-fatal 1 corrected
    ecap 0003[13c] = Serial 1 84160cfffecc1080
    ecap 0004[150] = Power Budgeting 1
    ecap 000b[180] = Vendor [1] ID 0000 Rev 0 Length 32
    ecap 000e[1b8] = ARI 1
    ecap 0017[230] = TPH Requester 1

nvme0@pci0:2:0:0:	class=0x010802 rev=0x01 hdr=0x00 vendor=0xc0a9 device=0x540a subvendor=0xc0a9 subdevice=0x5021
    vendor     = 'Micron/Crucial Technology'
    device     = 'P2 NVMe PCIe SSD'
    class      = mass storage
    subclass   = NVM
    bar   [10] = type Memory, range 64, base 0x70800000, size 16384, enabled
    cap 10[80] = PCI-Express 2 endpoint max data 256(512) FLR RO NS
                 max read 512
                 link x4(x4) speed 8.0(8.0) ASPM disabled(L1)
    cap 11[d0] = MSI-X supports 9 messages, enabled
                 Table in map 0x10[0x2000], PBA in map 0x10[0x3000]
    cap 05[e0] = MSI supports 8 messages, 64 bit, vector masks 
    cap 01[f8] = powerspec 3  supports D0 D3  current D0
    ecap 0018[100] = LTR 1
    ecap 001e[110] = L1 PM Substates 1
    ecap 000e[128] = ARI 1
    ecap 0025[1e0] = Data Link Feature 1
    ecap 0001[200] = AER 2 0 fatal 0 non-fatal 0 corrected
    ecap 0019[300] = PCIe Sec 1 lane errors 0
