hostb0@pci0:0:0:0:	class=0x060000 rev=0x21 hdr=0x00 vendor=0x8086 device=0x2280 subvendor=0x1558 subdevice=0x5108
    vendor     = 'Intel Corporation'
    device     = 'Atom/Celeron/Pentium Processor x5-E8000/J3xxx/N3xxx Series SoC Transaction Register'
    class      = bridge
    subclass   = HOST-PCI

vgapci0@pci0:0:2:0:	class=0x030000 rev=0x21 hdr=0x00 vendor=0x8086 device=0x22b1 subvendor=0x1558 subdevice=0x5108
    vendor     = 'Intel Corporation'
    device     = 'Atom/Celeron/Pentium Processor x5-E8000/J3xxx/N3xxx Integrated Graphics Controller'
    class      = display
    subclass   = VGA
    bar   [10] = type Memory, range 64, base 0x80000000, size 16777216, enabled
    bar   [18] = type Prefetchable Memory, range 64, base 0x90000000, size 268435456, enabled
    bar   [20] = type I/O Port, range 32, base 0xf000, size 64, enabled
    cap 01[d0] = powerspec 2  supports D0 D3  current D0
    cap 05[90] = MSI supports 1 message enabled with 1 message
    cap 09[b0] = vendor (length 7) Intel cap 0 version 1

none0@pci0:0:11:0:	class=0x118000 rev=0x21 hdr=0x00 vendor=0x8086 device=0x22dc subvendor=0x0000 subdevice=0x0000
    vendor     = 'Intel Corporation'
    device     = 'Atom/Celeron/Pentium Processor x5-E8000/J3xxx/N3xxx Series Power Management Controller'
    class      = dasp
    bar   [10] = type Memory, range 64, base 0x8141f000, size 4096, enabled
    cap 05[40] = MSI supports 1 message 
    cap 01[50] = powerspec 3  supports D0 D3  current D0

ahci0@pci0:0:19:0:	class=0x010601 rev=0x21 hdr=0x00 vendor=0x8086 device=0x22a3 subvendor=0x1558 subdevice=0x5108
    vendor     = 'Intel Corporation'
    device     = 'Atom/Celeron/Pentium Processor x5-E8000/J3xxx/N3xxx Series SATA Controller'
    class      = mass storage
    subclass   = SATA
    bar   [20] = type I/O Port, range 32, base 0xf060, size 32, enabled
    bar   [24] = type Memory, range 32, base 0x8141e000, size 2048, enabled
    cap 05[80] = MSI supports 1 message enabled with 1 message
    cap 01[70] = powerspec 3  supports D0 D3  current D0
    cap 12[a8] = SATA Index-Data Pair

xhci0@pci0:0:20:0:	class=0x0c0330 rev=0x21 hdr=0x00 vendor=0x8086 device=0x22b5 subvendor=0x1558 subdevice=0x5108
    vendor     = 'Intel Corporation'
    device     = 'Atom/Celeron/Pentium Processor x5-E8000/J3xxx/N3xxx Series USB xHCI Controller'
    class      = serial bus
    subclass   = USB
    bar   [10] = type Memory, range 64, base 0x81400000, size 65536, enabled
    cap 01[70] = powerspec 2  supports D0 D3  current D0
    cap 05[80] = MSI supports 8 messages, 64 bit enabled with 1 message

none1@pci0:0:26:0:	class=0x108000 rev=0x21 hdr=0x00 vendor=0x8086 device=0x2298 subvendor=0x1558 subdevice=0x5108
    vendor     = 'Intel Corporation'
    device     = 'Atom/Celeron/Pentium Processor x5-E8000/J3xxx/N3xxx Series Trusted Execution Engine'
    class      = encrypt/decrypt
    bar   [10] = type Memory, range 32, base 0x81100000, size 1048576, enabled
    bar   [14] = type Memory, range 32, base 0x81000000, size 1048576, enabled
    cap 01[80] = powerspec 3  supports D0 D3  current D0
    cap 05[a0] = MSI supports 1 message 

hdac0@pci0:0:27:0:	class=0x040300 rev=0x21 hdr=0x00 vendor=0x8086 device=0x2284 subvendor=0x1558 subdevice=0x5108
    vendor     = 'Intel Corporation'
    device     = 'Atom/Celeron/Pentium Processor x5-E8000/J3xxx/N3xxx Series High Definition Audio Controller'
    class      = multimedia
    subclass   = HDA
    bar   [10] = type Memory, range 64, base 0x81414000, size 16384, enabled
    cap 01[50] = powerspec 2  supports D0 D3  current D0
    cap 05[60] = MSI supports 1 message, 64 bit enabled with 1 message

pcib1@pci0:0:28:0:	class=0x060400 rev=0x21 hdr=0x01 vendor=0x8086 device=0x22c8 subvendor=0x1558 subdevice=0x5108
    vendor     = 'Intel Corporation'
    device     = 'Atom/Celeron/Pentium Processor x5-E8000/J3xxx/N3xxx Series PCI Express Port'
    class      = bridge
    subclass   = PCI-PCI
    cap 10[40] = PCI-Express 2 root port max data 128(128)
                 max read 128
                 link x1(x1) speed 2.5(2.5) ASPM L1(L0s/L1)
                 slot 0 power limit 100 mW
    cap 05[80] = MSI supports 1 message 
    cap 0d[90] = PCI Bridge subvendor=0x1558 subdevice=0x5108
    cap 01[a0] = powerspec 3  supports D0 D3  current D0
    ecap 0000[100] = unknown 0
    ecap 001e[200] = L1 PM Substates 1

pcib2@pci0:0:28:1:	class=0x060400 rev=0x21 hdr=0x01 vendor=0x8086 device=0x22ca subvendor=0x1558 subdevice=0x5108
    vendor     = 'Intel Corporation'
    device     = 'Atom/Celeron/Pentium Processor x5-E8000/J3xxx/N3xxx Series PCI Express Port'
    class      = bridge
    subclass   = PCI-PCI
    cap 10[40] = PCI-Express 2 root port max data 128(128)
                 max read 128
                 link x1(x1) speed 2.5(5.0) ASPM disabled(L0s/L1)
                 slot 1 power limit 100 mW
    cap 05[80] = MSI supports 1 message 
    cap 0d[90] = PCI Bridge subvendor=0x1558 subdevice=0x5108
    cap 01[a0] = powerspec 3  supports D0 D3  current D0
    ecap 0000[100] = unknown 0
    ecap 001e[200] = L1 PM Substates 1

isab0@pci0:0:31:0:	class=0x060100 rev=0x21 hdr=0x00 vendor=0x8086 device=0x229c subvendor=0x1558 subdevice=0x5108
    vendor     = 'Intel Corporation'
    device     = 'Atom/Celeron/Pentium Processor x5-E8000/J3xxx/N3xxx Series PCU'
    class      = bridge
    subclass   = PCI-ISA
    cap 09[e0] = vendor (length 12) Intel cap 1 version 0
		 features: 4 PCI-e x1 slots

ichsmb0@pci0:0:31:3:	class=0x0c0500 rev=0x21 hdr=0x00 vendor=0x8086 device=0x2292 subvendor=0x1558 subdevice=0x5108
    vendor     = 'Intel Corporation'
    device     = 'Atom/Celeron/Pentium Processor x5-E8000/J3xxx/N3xxx SMBus Controller'
    class      = serial bus
    subclass   = SMBus
    bar   [10] = type Memory, range 32, base 0x81418000, size 32, enabled
    bar   [20] = type I/O Port, range 32, base 0xf040, size 32, enabled
    cap 01[50] = powerspec 3  supports D0 D3  current D0

none2@pci0:1:0:0:	class=0xff0000 rev=0x01 hdr=0x00 vendor=0x10ec device=0x5286 subvendor=0x1558 subdevice=0x5108
    vendor     = 'Realtek Semiconductor Co., Ltd.'
    device     = 'RTS5286 PCI Express Card Reader'
    bar   [10] = type Memory, range 32, base 0x81300000, size 65536, enabled
    cap 01[40] = powerspec 3  supports D0 D1 D2 D3  current D0
    cap 05[50] = MSI supports 1 message, 64 bit 
    cap 10[70] = PCI-Express 2 endpoint max data 128(128) RO
                 max read 512
                 link x1(x1) speed 2.5(2.5) ASPM L1(L0s/L1) ClockPM enabled
    cap 11[b0] = MSI-X supports 1 message
                 Table in map 0x10[0x0], PBA in map 0x10[0x0]
    cap 03[d0] = VPD
    ecap 0001[100] = AER 1 0 fatal 0 non-fatal 2 corrected
    ecap 0002[140] = VC 1 max VC0
    ecap 0003[160] = Serial 1 00000001004ce000

re0@pci0:1:0:2:	class=0x020000 rev=0x06 hdr=0x00 vendor=0x10ec device=0x8136 subvendor=0x1558 subdevice=0x5108
    vendor     = 'Realtek Semiconductor Co., Ltd.'
    device     = 'RTL810xE PCI Express Fast Ethernet controller'
    class      = network
    subclass   = ethernet
    bar   [10] = type I/O Port, range 32, base 0xe000, size 256, enabled
    bar   [18] = type Memory, range 64, base 0x81310000, size 4096, enabled
    bar   [20] = type Prefetchable Memory, range 64, base 0xa0000000, size 16384, enabled
    cap 01[40] = powerspec 3  supports D0 D1 D2 D3  current D0
    cap 05[50] = MSI supports 1 message, 64 bit 
    cap 10[70] = PCI-Express 2 endpoint MSI 1 max data 128(128) RO
                 max read 4096
                 link x1(x1) speed 2.5(2.5) ASPM disabled(L0s/L1) ClockPM disabled
    cap 11[b0] = MSI-X supports 4 messages, enabled
                 Table in map 0x20[0x0], PBA in map 0x20[0x800]
    cap 03[d0] = VPD
    ecap 0001[100] = AER 1 0 fatal 0 non-fatal 2 corrected
    ecap 0003[160] = Serial 1 01000000364ce000

iwm0@pci0:2:0:0:	class=0x028000 rev=0x61 hdr=0x00 vendor=0x8086 device=0x095a subvendor=0x8086 subdevice=0x5002
    vendor     = 'Intel Corporation'
    device     = 'Wireless 7265'
    class      = network
    bar   [10] = type Memory, range 64, base 0x81200000, size 8192, enabled
    cap 01[c8] = powerspec 3  supports D0 D3  current D0
    cap 05[d0] = MSI supports 1 message, 64 bit enabled with 1 message
    cap 10[40] = PCI-Express 2 endpoint max data 128(128) FLR RO NS
                 max read 128
                 link x1(x1) speed 2.5(2.5) ASPM disabled(L1) ClockPM enabled
    ecap 0001[100] = AER 1 0 fatal 0 non-fatal 1 corrected
    ecap 0003[140] = Serial 1 5ce0c5ffffa369bb
    ecap 0018[14c] = LTR 1
    ecap 001e[154] = L1 PM Substates 1
