hostb0@pci0:0:0:0:	class=0x060000 card=0x09f31028 chip=0x9b548086 rev=0x02 hdr=0x00
    vendor     = 'Intel Corporation'
    device     = '10th Gen Core Processor Host Bridge/DRAM Registers'
    class      = bridge
    subclass   = HOST-PCI
    cap 09[e0] = vendor (length 16) Intel cap 0 version 1

pcib1@pci0:0:1:0:	class=0x060400 card=0x09f31028 chip=0x19018086 rev=0x02 hdr=0x01
    vendor     = 'Intel Corporation'
    device     = '6th-10th Gen Core Processor PCIe Controller (x16)'
    class      = bridge
    subclass   = PCI-PCI
    cap 0d[88] = PCI Bridge card=0x09f31028
    cap 01[80] = powerspec 3  supports D0 D3  current D0
    cap 05[90] = MSI supports 1 message 
    cap 10[a0] = PCI-Express 2 root port max data 128(256)
                 max read 128
                 link x8(x8) speed 8.0(8.0) ASPM L0s/L1(L0s/L1)
                 slot 1 power limit 75000 mW
    ecap 0002[100] = VC 1 max VC0
    ecap 0005[140] = Root Complex Link Declaration 1
    ecap 0019[d94] = PCIe Sec 1 lane errors 0

vgapci1@pci0:0:2:0:	class=0x030000 card=0x09f31028 chip=0x9bc48086 rev=0x05 hdr=0x00
    vendor     = 'Intel Corporation'
    device     = 'CometLake-H GT2 [UHD Graphics]'
    class      = display
    subclass   = VGA
    bar   [10] = type Memory, range 64, base 0x6022000000, size 16777216, enabled
    bar   [18] = type Prefetchable Memory, range 64, base 0x4000000000, size 268435456, enabled
    bar   [20] = type I/O Port, range 32, base 0x5000, size 64, enabled
    cap 09[40] = vendor (length 12) Intel cap 0 version 1
    cap 10[70] = PCI-Express 2 root endpoint max data 128(128) FLR
                 max read 128
    cap 05[ac] = MSI supports 1 message 
    cap 01[d0] = powerspec 2  supports D0 D3  current D0
    ecap 001b[100] = Process Address Space ID 1
    ecap 000f[200] = ATS 1
    ecap 0013[300] = Page Page Request 1

none0@pci0:0:4:0:	class=0x118000 card=0x09f31028 chip=0x19038086 rev=0x02 hdr=0x00
    vendor     = 'Intel Corporation'
    device     = 'Xeon E3-1200 v5/E3-1500 v5/6th Gen Core Processor Thermal Subsystem'
    class      = dasp
    bar   [10] = type Memory, range 64, base 0x6023210000, size 32768, enabled
    cap 05[90] = MSI supports 1 message 
    cap 01[d0] = powerspec 3  supports D0 D3  current D0
    cap 09[e0] = vendor (length 12) Intel cap 0 version 1

none1@pci0:0:8:0:	class=0x088000 card=0x09f31028 chip=0x19118086 rev=0x00 hdr=0x00
    vendor     = 'Intel Corporation'
    device     = 'Xeon E3-1200 v5/v6 / E3-1500 v5 / 6th/7th/8th Gen Core Processor Gaussian Mixture Model'
    class      = base peripheral
    bar   [10] = type Memory, range 64, base 0x602322a000, size 4096, enabled
    cap 05[90] = MSI supports 1 message 
    cap 01[dc] = powerspec 2  supports D0 D3  current D0
    cap 13[f0] = PCI Advanced Features: FLR TP

none2@pci0:0:18:0:	class=0x118000 card=0x09f31028 chip=0x06f98086 rev=0x00 hdr=0x00
    vendor     = 'Intel Corporation'
    device     = 'Comet Lake PCH Thermal Controller'
    class      = dasp
    bar   [10] = type Memory, range 64, base 0x6023229000, size 4096, enabled
    cap 01[50] = powerspec 3  supports D0 D3  current D0
    cap 05[80] = MSI supports 1 message 

none3@pci0:0:19:0:	class=0x070000 card=0x09f31028 chip=0x06fc8086 rev=0x00 hdr=0x00
    vendor     = 'Intel Corporation'
    class      = simple comms
    subclass   = UART
    bar   [10] = type Memory, range 64, base 0x6023222000, size 8192, enabled
    cap 01[80] = powerspec 3  supports D0 D3  current D0
    cap 09[90] = vendor (length 20) Intel cap 15 version 0

xhci1@pci0:0:20:0:	class=0x0c0330 card=0x09f31028 chip=0x06ed8086 rev=0x00 hdr=0x00
    vendor     = 'Intel Corporation'
    device     = 'Comet Lake USB 3.1 xHCI Host Controller'
    class      = serial bus
    subclass   = USB
    bar   [10] = type Memory, range 64, base 0x6023200000, size 65536, enabled
    cap 01[70] = powerspec 2  supports D0 D3  current D0
    cap 05[80] = MSI supports 8 messages, 64 bit enabled with 1 message
    cap 09[90] = vendor (length 20) Intel cap 15 version 0

none4@pci0:0:20:2:	class=0x050000 card=0x09f31028 chip=0x06ef8086 rev=0x00 hdr=0x00
    vendor     = 'Intel Corporation'
    device     = 'Comet Lake PCH Shared SRAM'
    class      = memory
    subclass   = RAM
    bar   [10] = type Memory, range 64, base 0x6023220000, size 8192, enabled
    bar   [18] = type Memory, range 64, base 0x6023228000, size 4096, enabled
    cap 01[80] = powerspec 3  supports D0 D3  current D0

none5@pci0:0:20:3:	class=0x028000 card=0x16521a56 chip=0x06f08086 rev=0x00 hdr=0x00
    vendor     = 'Intel Corporation'
    device     = 'Comet Lake PCH CNVi WiFi'
    class      = network
    bar   [10] = type Memory, range 64, base 0x602321c000, size 16384, enabled
    cap 01[c8] = powerspec 3  supports D0 D3  current D0
    cap 05[d0] = MSI supports 1 message, 64 bit 
    cap 10[40] = PCI-Express 2 root endpoint max data 128(128) FLR RO NS
                 max read 128
    cap 11[80] = MSI-X supports 16 messages
                 Table in map 0x10[0x2000], PBA in map 0x10[0x3000]
    ecap 0018[100] = LTR 1
    ecap 000b[164] = Vendor 1 ID 16

ig4iic0@pci0:0:21:0:	class=0x0c8000 card=0x09f31028 chip=0x06e88086 rev=0x00 hdr=0x00
    vendor     = 'Intel Corporation'
    device     = 'Comet Lake PCH Serial IO I2C Controller'
    class      = serial bus
    bar   [10] = type Memory, range 64, base 0x83100000, size 4096, enabled
    cap 01[80] = powerspec 3  supports D0 D3  current D0
    cap 09[90] = vendor (length 20) Intel cap 15 version 0

ig4iic1@pci0:0:21:1:	class=0x0c8000 card=0x09f31028 chip=0x06e98086 rev=0x00 hdr=0x00
    vendor     = 'Intel Corporation'
    device     = 'Comet Lake PCH Serial IO I2C Controller'
    class      = serial bus
    bar   [10] = type Memory, range 64, base 0x83101000, size 4096, enabled
    cap 01[80] = powerspec 3  supports D0 D3  current D0
    cap 09[90] = vendor (length 20) Intel cap 15 version 0

none6@pci0:0:22:0:	class=0x078000 card=0x09f31028 chip=0x06e08086 rev=0x00 hdr=0x00
    vendor     = 'Intel Corporation'
    device     = 'Comet Lake HECI Controller'
    class      = simple comms
    bar   [10] = type Memory, range 64, base 0x6023225000, size 4096, enabled
    cap 01[50] = powerspec 3  supports D0 D3  current D0
    cap 05[8c] = MSI supports 1 message, 64 bit 
    cap 09[a4] = vendor (length 20) Intel cap 15 version 0

ahci0@pci0:0:23:0:	class=0x010601 card=0x09f31028 chip=0x06d38086 rev=0x00 hdr=0x00
    vendor     = 'Intel Corporation'
    class      = mass storage
    subclass   = SATA
    bar   [10] = type Memory, range 32, base 0x9a380000, size 8192, enabled
    bar   [14] = type Memory, range 32, base 0x9a384000, size 256, enabled
    bar   [18] = type I/O Port, range 32, base 0x5080, size 8, enabled
    bar   [1c] = type I/O Port, range 32, base 0x5088, size 4, enabled
    bar   [20] = type I/O Port, range 32, base 0x5060, size 32, enabled
    bar   [24] = type Memory, range 32, base 0x9a383000, size 2048, enabled
    cap 05[80] = MSI supports 1 message enabled with 1 message
    cap 01[70] = powerspec 3  supports D0 D3  current D0
    cap 12[a8] = SATA Index-Data Pair

pcib2@pci0:0:27:0:	class=0x060400 card=0x09f31028 chip=0x06c08086 rev=0xf0 hdr=0x01
    vendor     = 'Intel Corporation'
    device     = 'Comet Lake PCI Express Root Port'
    class      = bridge
    subclass   = PCI-PCI
    cap 10[40] = PCI-Express 2 root port max data 128(128) ARI disabled
                 max read 128
                 link x4(x4) speed 8.0(8.0) ASPM L1(L1)
                 slot 16 power limit 250 mW HotPlug(present) surprise
    cap 05[80] = MSI supports 1 message enabled with 1 message
    cap 0d[90] = PCI Bridge card=0x09f31028
    cap 01[a0] = powerspec 3  supports D0 D3  current D0
    ecap 0001[100] = AER 1 0 fatal 0 non-fatal 1 corrected
    ecap 000d[140] = ACS 1
    ecap 001f[150] = Precision Time Measurement 1
    ecap 0019[220] = PCIe Sec 1 lane errors 0
    ecap 001d[250] = Downstream Port Containment 1

pcib7@pci0:0:29:0:	class=0x060400 card=0x09f31028 chip=0x06b08086 rev=0xf0 hdr=0x01
    vendor     = 'Intel Corporation'
    device     = 'Comet Lake PCI Express Root Port'
    class      = bridge
    subclass   = PCI-PCI
    cap 10[40] = PCI-Express 2 root port max data 256(256) ARI disabled
                 max read 128
                 link x4(x4) speed 8.0(8.0) ASPM L1(L0s/L1)
                 slot 8 power limit 250 mW
    cap 05[80] = MSI supports 1 message 
    cap 0d[90] = PCI Bridge card=0x09f31028
    cap 01[a0] = powerspec 3  supports D0 D3  current D0
    ecap 0001[100] = AER 1 0 fatal 0 non-fatal 0 corrected
    ecap 000d[140] = ACS 1
    ecap 001f[150] = Precision Time Measurement 1
    ecap 001e[200] = L1 PM Substates 1
    ecap 0019[220] = PCIe Sec 1 lane errors 0
    ecap 001d[250] = Downstream Port Containment 1

pcib8@pci0:0:29:5:	class=0x060400 card=0x09f31028 chip=0x06b58086 rev=0xf0 hdr=0x01
    vendor     = 'Intel Corporation'
    class      = bridge
    subclass   = PCI-PCI
    cap 10[40] = PCI-Express 2 root port max data 128(256) ARI disabled
                 max read 128
                 link x1(x1) speed 2.5(8.0) ASPM L1(L0s/L1)
                 slot 13 power limit 100 mW
    cap 05[80] = MSI supports 1 message 
    cap 0d[90] = PCI Bridge card=0x09f31028
    cap 01[a0] = powerspec 3  supports D0 D3  current D0
    ecap 0001[100] = AER 1 0 fatal 0 non-fatal 0 corrected
    ecap 000d[140] = ACS 1
    ecap 001f[150] = Precision Time Measurement 1
    ecap 001e[200] = L1 PM Substates 1
    ecap 0019[220] = PCIe Sec 1 lane errors 0
    ecap 001d[250] = Downstream Port Containment 1

isab0@pci0:0:31:0:	class=0x060100 card=0x09f31028 chip=0x068d8086 rev=0x00 hdr=0x00
    vendor     = 'Intel Corporation'
    device     = 'Comet Lake LPC Controller'
    class      = bridge
    subclass   = PCI-ISA

hdac1@pci0:0:31:3:	class=0x040100 card=0x09f31028 chip=0x06c88086 rev=0x00 hdr=0x00
    vendor     = 'Intel Corporation'
    device     = 'Comet Lake PCH cAVS'
    class      = multimedia
    subclass   = audio
    bar   [10] = type Memory, range 64, base 0x6023218000, size 16384, enabled
    bar   [20] = type Memory, range 64, base 0x6023100000, size 1048576, enabled
    cap 01[50] = powerspec 3  supports D0 D3  current D0
    cap 09[80] = vendor (length 20) Intel cap 15 version 0
    cap 05[60] = MSI supports 1 message, 64 bit enabled with 1 message

none7@pci0:0:31:4:	class=0x0c0500 card=0x09f31028 chip=0x06a38086 rev=0x00 hdr=0x00
    vendor     = 'Intel Corporation'
    device     = 'Comet Lake PCH SMBus Controller'
    class      = serial bus
    subclass   = SMBus
    bar   [10] = type Memory, range 64, base 0x6023224000, size 256, enabled
    bar   [20] = type I/O Port, range 32, base 0xefa0, size 32, enabled

none8@pci0:0:31:5:	class=0x0c8000 card=0x09f31028 chip=0x06a48086 rev=0x00 hdr=0x00
    vendor     = 'Intel Corporation'
    device     = 'Comet Lake PCH SPI Controller'
    class      = serial bus
    bar   [10] = type Memory, range 32, base 0xfe010000, size 4096, enabled

vgapci0@pci0:1:0:0:	class=0x030000 card=0x09f31028 chip=0x1f1410de rev=0xa1 hdr=0x00
    vendor     = 'NVIDIA Corporation'
    device     = 'TU106M [GeForce RTX 2070 Mobile / Max-Q Refresh]'
    class      = display
    subclass   = VGA
    bar   [10] = type Memory, range 32, base 0x82000000, size 16777216, enabled
    bar   [14] = type Prefetchable Memory, range 64, base 0x70000000, size 268435456, enabled
    bar   [1c] = type Prefetchable Memory, range 64, base 0x80000000, size 33554432, enabled
    bar   [24] = type I/O Port, range 32, base 0x4000, size 128, enabled
    cap 01[60] = powerspec 3  supports D0 D3  current D0
    cap 05[68] = MSI supports 1 message, 64 bit 
    cap 10[78] = PCI-Express 2 legacy endpoint max data 128(256) FLR RO NS
                 max read 512
                 link x8(x16) speed 8.0(8.0) ASPM L0s/L1(L0s/L1) ClockPM disabled
    ecap 0002[100] = VC 1 max VC0
    ecap 0018[250] = LTR 1
    ecap 001e[258] = L1 PM Substates 1
    ecap 0004[128] = Power Budgeting 1
    ecap 0001[420] = AER 2 0 fatal 0 non-fatal 1 corrected
    ecap 000b[600] = Vendor 1 ID 1
    ecap 0019[900] = PCIe Sec 1 lane errors 0
    ecap 0015[bb0] = Resizable BAR 1

hdac0@pci0:1:0:1:	class=0x040300 card=0x09f31028 chip=0x10f910de rev=0xa1 hdr=0x00
    vendor     = 'NVIDIA Corporation'
    device     = 'TU106 High Definition Audio Controller'
    class      = multimedia
    subclass   = HDA
    bar   [10] = type Memory, range 32, base 0x83000000, size 16384, enabled
    cap 01[60] = powerspec 3  supports D0 D3  current D0
    cap 05[68] = MSI supports 1 message, 64 bit enabled with 1 message
    cap 10[78] = PCI-Express 2 endpoint max data 128(256) RO NS
                 max read 512
                 link x8(x16) speed 8.0(8.0) ASPM L0s/L1(L0s/L1) ClockPM disabled
    ecap 0001[100] = AER 2 0 fatal 0 non-fatal 1 corrected

xhci0@pci0:1:0:2:	class=0x0c0330 card=0x09f31028 chip=0x1ada10de rev=0xa1 hdr=0x00
    vendor     = 'NVIDIA Corporation'
    device     = 'TU106 USB 3.1 Host Controller'
    class      = serial bus
    subclass   = USB
    bar   [10] = type Prefetchable Memory, range 64, base 0x6023000000, size 262144, enabled
    bar   [1c] = type Prefetchable Memory, range 64, base 0x6023040000, size 65536, enabled
    cap 05[68] = MSI supports 1 message, 64 bit enabled with 1 message
    cap 10[78] = PCI-Express 2 endpoint max data 128(128) RO NS
                 max read 512
                 link x8(x16) speed 8.0(8.0) ASPM L0s/L1(L0s/L1) ClockPM disabled
    cap 01[b4] = powerspec 3  supports D0 D3  current D0
    ecap 0001[100] = AER 2 0 fatal 0 non-fatal 1 corrected

none9@pci0:1:0:3:	class=0x0c8000 card=0x09f31028 chip=0x1adb10de rev=0xa1 hdr=0x00
    vendor     = 'NVIDIA Corporation'
    device     = 'TU106 USB Type-C UCSI Controller'
    class      = serial bus
    bar   [10] = type Memory, range 32, base 0x83004000, size 4096, enabled
    cap 05[68] = MSI supports 1 message, 64 bit 
    cap 10[78] = PCI-Express 2 endpoint max data 128(128) RO NS
                 max read 512
                 link x8(x16) speed 8.0(8.0) ASPM L0s/L1(L0s/L1) ClockPM disabled
    cap 01[b4] = powerspec 3  supports D0 D3  current D0
    ecap 0001[100] = AER 2 0 fatal 0 non-fatal 1 corrected

pcib3@pci0:2:0:0:	class=0x060400 card=0x09f31028 chip=0x15e78086 rev=0x06 hdr=0x01
    vendor     = 'Intel Corporation'
    device     = 'JHL7540 Thunderbolt 3 Bridge [Titan Ridge 2C 2018]'
    class      = bridge
    subclass   = PCI-PCI
    cap 01[80] = powerspec 3  supports D0 D1 D2 D3  current D0
    cap 05[88] = MSI supports 1 message, 64 bit 
    cap 0d[ac] = PCI Bridge card=0x09f31028
    cap 10[c0] = PCI-Express 2 upstream port max data 128(128) RO NS
                 max read 512
                 link x4(x4) speed 8.0(8.0) ASPM L1(L1) ClockPM enabled
    cap 15[50] = unknown
    ecap 0003[100] = Serial 1 24f704184cb30200
    ecap 0001[200] = AER 1 0 fatal 0 non-fatal 2 corrected
    ecap 0002[300] = VC 1 max VC0
    ecap 0004[400] = Power Budgeting 1
    ecap 000b[500] = Vendor 1 ID 4660
    ecap 000b[600] = Vendor 1 ID 32902
    ecap 0019[700] = PCIe Sec 1 lane errors 0
    ecap 0018[800] = LTR 1
    ecap 001e[a00] = L1 PM Substates 1
    ecap 001f[b00] = Precision Time Measurement 1

pcib4@pci0:3:0:0:	class=0x060400 card=0x09f31028 chip=0x15e78086 rev=0x06 hdr=0x01
    vendor     = 'Intel Corporation'
    device     = 'JHL7540 Thunderbolt 3 Bridge [Titan Ridge 2C 2018]'
    class      = bridge
    subclass   = PCI-PCI
    cap 01[80] = powerspec 3  supports D0 D1 D2 D3  current D0
    cap 05[88] = MSI supports 1 message, 64 bit 
    cap 0d[ac] = PCI Bridge card=0x09f31028
    cap 10[c0] = PCI-Express 2 downstream port max data 128(128) RO NS
                 max read 512
                 link x4(x4) speed 2.5(2.5) ASPM L1(L1)
                 slot 0 power limit 0 mW
    cap 15[50] = unknown
    ecap 0003[100] = Serial 1 24f704184cb30200
    ecap 0001[200] = AER 1 0 fatal 0 non-fatal 0 corrected
    ecap 0002[300] = VC 1 max VC1 lowpri VC0-VC1
    ecap 0004[400] = Power Budgeting 1
    ecap 000b[500] = Vendor 1 ID 4660
    ecap 000b[600] = Vendor 1 ID 32902
    ecap 0019[700] = PCIe Sec 1 lane errors 0
    ecap 000d[900] = ACS 1

pcib5@pci0:3:1:0:	class=0x060400 card=0x09f31028 chip=0x15e78086 rev=0x06 hdr=0x01
    vendor     = 'Intel Corporation'
    device     = 'JHL7540 Thunderbolt 3 Bridge [Titan Ridge 2C 2018]'
    class      = bridge
    subclass   = PCI-PCI
    cap 01[80] = powerspec 3  supports D0 D1 D2 D3  current D0
    cap 05[88] = MSI supports 1 message, 64 bit enabled with 1 message
    cap 0d[ac] = PCI Bridge card=0x09f31028
    cap 10[c0] = PCI-Express 2 downstream port max data 128(128) RO NS
                 max read 512
                 link x4(x4) speed 2.5(2.5) ASPM L1(L1)
                 slot 1 power limit 0 mW HotPlug(empty) surprise
    cap 15[50] = unknown
    ecap 0003[100] = Serial 1 24f704184cb30200
    ecap 0001[200] = AER 1 0 fatal 0 non-fatal 0 corrected
    ecap 0002[300] = VC 1 max VC0
    ecap 0004[400] = Power Budgeting 1
    ecap 000b[500] = Vendor 1 ID 4660
    ecap 000b[600] = Vendor 1 ID 32902
    ecap 0019[700] = PCIe Sec 1 lane errors 0
    ecap 000d[900] = ACS 1

pcib6@pci0:3:2:0:	class=0x060400 card=0x09f31028 chip=0x15e78086 rev=0x06 hdr=0x01
    vendor     = 'Intel Corporation'
    device     = 'JHL7540 Thunderbolt 3 Bridge [Titan Ridge 2C 2018]'
    class      = bridge
    subclass   = PCI-PCI
    cap 01[80] = powerspec 3  supports D0 D1 D2 D3  current D0
    cap 05[88] = MSI supports 1 message, 64 bit 
    cap 0d[ac] = PCI Bridge card=0x09f31028
    cap 10[c0] = PCI-Express 2 downstream port max data 128(128) RO NS
                 max read 512
                 link x4(x4) speed 2.5(2.5) ASPM L1(L1)
                 slot 0 power limit 0 mW
    cap 15[50] = unknown
    ecap 0003[100] = Serial 1 24f704184cb30200
    ecap 0001[200] = AER 1 0 fatal 0 non-fatal 0 corrected
    ecap 0002[300] = VC 1 max VC0
    ecap 0004[400] = Power Budgeting 1
    ecap 000b[500] = Vendor 1 ID 4660
    ecap 000b[600] = Vendor 1 ID 32902
    ecap 0019[700] = PCIe Sec 1 lane errors 0
    ecap 000d[900] = ACS 1

none10@pci0:4:0:0:	class=0x088000 card=0x09f31028 chip=0x15e88086 rev=0x06 hdr=0x00
    vendor     = 'Intel Corporation'
    device     = 'JHL7540 Thunderbolt 3 NHI [Titan Ridge 2C 2018]'
    class      = base peripheral
    bar   [10] = type Memory, range 32, base 0x9a000000, size 262144, enabled
    bar   [14] = type Memory, range 32, base 0x9a040000, size 4096, enabled
    cap 01[80] = powerspec 3  supports D0 D1 D2 D3  current D0
    cap 05[88] = MSI supports 1 message, 64 bit 
    cap 10[c0] = PCI-Express 2 endpoint max data 128(128) RO NS
                 max read 512
                 link x4(x4) speed 2.5(2.5) ASPM L1(L1) ClockPM enabled
    cap 11[a0] = MSI-X supports 16 messages
                 Table in map 0x14[0x0], PBA in map 0x14[0xfa0]
    ecap 0003[100] = Serial 1 24f704184cb30200
    ecap 0001[200] = AER 1 0 fatal 0 non-fatal 1 corrected
    ecap 0002[300] = VC 1 max VC0
    ecap 0004[400] = Power Budgeting 1
    ecap 000b[500] = Vendor 1 ID 4660
    ecap 0018[600] = LTR 1

xhci2@pci0:57:0:0:	class=0x0c0330 card=0x09f31028 chip=0x15e98086 rev=0x06 hdr=0x00
    vendor     = 'Intel Corporation'
    device     = 'JHL7540 Thunderbolt 3 USB Controller [Titan Ridge 2C 2018]'
    class      = serial bus
    subclass   = USB
    bar   [10] = type Memory, range 32, base 0x84000000, size 65536, enabled
    cap 01[80] = powerspec 3  supports D0 D1 D2 D3  current D0
    cap 05[88] = MSI supports 8 messages, 64 bit enabled with 1 message
    cap 10[c0] = PCI-Express 2 endpoint max data 128(128) RO NS
                 max read 512
                 link x4(x4) speed 2.5(2.5) ASPM L1(L1) ClockPM enabled
    ecap 0003[100] = Serial 1 24f704184cb30200
    ecap 0001[200] = AER 1 0 fatal 0 non-fatal 1 corrected
    ecap 0002[300] = VC 1 max VC0
    ecap 0004[400] = Power Budgeting 1
    ecap 000b[500] = Vendor 1 ID 4660
    ecap 000b[600] = Vendor 1 ID 32902
    ecap 0019[700] = PCIe Sec 1 lane errors 0
    ecap 0018[800] = LTR 1

nvme0@pci0:58:0:0:	class=0x010802 card=0x01001344 chip=0x54101344 rev=0x01 hdr=0x00
    vendor     = 'Micron Technology Inc'
    class      = mass storage
    subclass   = NVM
    bar   [10] = type Memory, range 64, base 0x9a200000, size 16384, enabled
    cap 10[80] = PCI-Express 2 endpoint max data 256(256) FLR RO NS
                 max read 512
                 link x4(x4) speed 8.0(8.0) ASPM L1(L1)
    cap 11[d0] = MSI-X supports 32 messages, enabled
                 Table in map 0x10[0x3000], PBA in map 0x10[0x3200]
    cap 05[e0] = MSI supports 1 message, 64 bit 
    cap 01[f8] = powerspec 3  supports D0 D3  current D0
    ecap 000b[100] = Vendor 1 ID 5462
    ecap 0018[108] = LTR 1
    ecap 001e[110] = L1 PM Substates 1
    ecap 0001[200] = AER 1 0 fatal 0 non-fatal 1 corrected
    ecap 0019[300] = PCIe Sec 1 lane errors 0xf

none11@pci0:59:0:0:	class=0x020000 card=0x09f31028 chip=0x250210ec rev=0x1f hdr=0x00
    vendor     = 'Realtek Semiconductor Co., Ltd.'
    class      = network
    subclass   = ethernet
    bar   [10] = type I/O Port, range 32, base 0x3000, size 256, enabled
    bar   [18] = type Memory, range 64, base 0x9a104000, size 4096, enabled
    bar   [20] = type Memory, range 64, base 0x9a100000, size 16384, enabled
    cap 01[40] = powerspec 3  supports D0 D1 D2 D3  current D0
    cap 05[50] = MSI supports 1 message, 64 bit 
    cap 10[70] = PCI-Express 2 endpoint MSI 1 max data 128(128) RO
                 max read 4096
                 link x1(x1) speed 2.5(2.5) ASPM L1(L0s/L1) ClockPM enabled
    cap 11[b0] = MSI-X supports 4 messages
                 Table in map 0x20[0x0], PBA in map 0x20[0x800]
    ecap 0001[100] = AER 2 0 fatal 0 non-fatal 1 corrected
    ecap 0002[140] = VC 1 max VC0
    ecap 0003[160] = Serial 1 01000000684ce000
    ecap 0018[170] = LTR 1
    ecap 001e[178] = L1 PM Substates 1
