hostb0@pci0:0:0:0:	class=0x060000 card=0x0184107b chip=0x79101002 rev=0x00 hdr=0x00
    vendor     = 'Advanced Micro Devices, Inc. [AMD/ATI]'
    device     = 'RS690 Host Bridge'
    class      = bridge
    subclass   = HOST-PCI

pcib1@pci0:0:1:0:	class=0x060400 card=0x79121002 chip=0x79121002 rev=0x00 hdr=0x01
    vendor     = 'Advanced Micro Devices, Inc. [AMD/ATI]'
    device     = 'RS690/RS740 PCI to PCI Bridge (Internal gfx)'
    class      = bridge
    subclass   = PCI-PCI
    cap 08[44] = HT MSI fixed address window enabled at 0xfee00000
    cap 0d[b0] = PCI Bridge card=0x79121002

pcib2@pci0:0:6:0:	class=0x060400 card=0x0184107b chip=0x79161002 rev=0x00 hdr=0x01
    vendor     = 'Advanced Micro Devices, Inc. [AMD/ATI]'
    device     = 'RS690 PCI to PCI Bridge (PCI Express Port 2)'
    class      = bridge
    subclass   = PCI-PCI
    cap 01[50] = powerspec 3  supports D0 D3  current D0
    cap 10[58] = PCI-Express 1 root port max data 128(128) RO NS
                 link x1(x1) speed 2.5(2.5) ASPM L1(L0s/L1)
                 slot 6 power limit 25000 mW
    cap 05[80] = MSI supports 1 message 
    cap 0d[b0] = PCI Bridge card=0x0184107b
    cap 08[b8] = HT MSI fixed address window enabled at 0xfee00000
    ecap 0002[100] = VC 1 max VC0

pcib3@pci0:0:7:0:	class=0x060400 card=0x0184107b chip=0x79171002 rev=0x00 hdr=0x01
    vendor     = 'Advanced Micro Devices, Inc. [AMD/ATI]'
    device     = 'RS690 PCI to PCI Bridge (PCI Express Port 3)'
    class      = bridge
    subclass   = PCI-PCI
    cap 01[50] = powerspec 3  supports D0 D3  current D0
    cap 10[58] = PCI-Express 1 root port max data 128(128) RO NS
                 link x1(x1) speed 2.5(2.5) ASPM L1(L0s/L1)
                 slot 6 power limit 25000 mW
    cap 05[80] = MSI supports 1 message 
    cap 0d[b0] = PCI Bridge card=0x0184107b
    cap 08[b8] = HT MSI fixed address window enabled at 0xfee00000
    ecap 0002[100] = VC 1 max VC0

ahci0@pci0:0:18:0:	class=0x01018f card=0x0184107b chip=0x43801002 rev=0x00 hdr=0x00
    vendor     = 'Advanced Micro Devices, Inc. [AMD/ATI]'
    device     = 'SB600 Non-Raid-5 SATA'
    class      = mass storage
    subclass   = ATA
    bar   [10] = type I/O Port, range 32, base 0x8440, size 8, enabled
    bar   [14] = type I/O Port, range 32, base 0x8434, size 4, enabled
    bar   [18] = type I/O Port, range 32, base 0x8438, size 8, enabled
    bar   [1c] = type I/O Port, range 32, base 0x8430, size 4, enabled
    bar   [20] = type I/O Port, range 32, base 0x8400, size 16, enabled
    bar   [24] = type Memory, range 32, base 0xf0507000, size 1024, enabled
    cap 01[60] = powerspec 2  supports D0 D3  current D0

ohci0@pci0:0:19:0:	class=0x0c0310 card=0x0184107b chip=0x43871002 rev=0x00 hdr=0x00
    vendor     = 'Advanced Micro Devices, Inc. [AMD/ATI]'
    device     = 'SB600 USB (OHCI0)'
    class      = serial bus
    subclass   = USB
    bar   [10] = type Memory, range 32, base 0xf0504000, size 4096, enabled

ohci1@pci0:0:19:1:	class=0x0c0310 card=0x0184107b chip=0x43881002 rev=0x00 hdr=0x00
    vendor     = 'Advanced Micro Devices, Inc. [AMD/ATI]'
    device     = 'SB600 USB (OHCI1)'
    class      = serial bus
    subclass   = USB
    bar   [10] = type Memory, range 32, base 0xf0505000, size 4096, enabled

ohci2@pci0:0:19:4:	class=0x0c0310 card=0x0184107b chip=0x438b1002 rev=0x00 hdr=0x00
    vendor     = 'Advanced Micro Devices, Inc. [AMD/ATI]'
    device     = 'SB600 USB (OHCI4)'
    class      = serial bus
    subclass   = USB
    bar   [10] = type Memory, range 32, base 0xf0506000, size 4096, enabled

ehci0@pci0:0:19:5:	class=0x0c0320 card=0x0184107b chip=0x43861002 rev=0x00 hdr=0x00
    vendor     = 'Advanced Micro Devices, Inc. [AMD/ATI]'
    device     = 'SB600 USB Controller (EHCI)'
    class      = serial bus
    subclass   = USB
    bar   [10] = type Memory, range 32, base 0xf0507400, size 256, enabled
    cap 01[c0] = powerspec 2  supports D0 D1 D2 D3  current D0
    cap 0a[e4] = EHCI Debug Port at offset 0xe0 in map 0x14

intsmb0@pci0:0:20:0:	class=0x0c0500 card=0x43851002 chip=0x43851002 rev=0x14 hdr=0x00
    vendor     = 'Advanced Micro Devices, Inc. [AMD/ATI]'
    device     = 'SBx00 SMBus Controller'
    class      = serial bus
    subclass   = SMBus
    bar   [10] = type I/O Port, range 32, base 0x8410, size 16, enabled
    cap 08[b0] = HT MSI fixed address window disabled at 0xfee00000

atapci0@pci0:0:20:1:	class=0x01018a card=0x438c1002 chip=0x438c1002 rev=0x00 hdr=0x00
    vendor     = 'Advanced Micro Devices, Inc. [AMD/ATI]'
    device     = 'SB600 IDE'
    class      = mass storage
    subclass   = ATA
    bar   [20] = type I/O Port, range 32, base 0x8420, size 16, enabled

hdac0@pci0:0:20:2:	class=0x040300 card=0x0184107b chip=0x43831002 rev=0x00 hdr=0x00
    vendor     = 'Advanced Micro Devices, Inc. [AMD/ATI]'
    device     = 'SBx00 Azalia (Intel HDA)'
    class      = multimedia
    subclass   = HDA
    bar   [10] = type Memory, range 64, base 0xf0500000, size 16384, enabled
    cap 01[50] = powerspec 2  supports D0 D3  current D0

isab0@pci0:0:20:3:	class=0x060100 card=0x438d1002 chip=0x438d1002 rev=0x00 hdr=0x00
    vendor     = 'Advanced Micro Devices, Inc. [AMD/ATI]'
    device     = 'SB600 PCI to LPC Bridge'
    class      = bridge
    subclass   = PCI-ISA

pcib4@pci0:0:20:4:	class=0x060401 card=0x00000000 chip=0x43841002 rev=0x00 hdr=0x01
    vendor     = 'Advanced Micro Devices, Inc. [AMD/ATI]'
    device     = 'SBx00 PCI to PCI Bridge'
    class      = bridge
    subclass   = PCI-PCI

hostb1@pci0:0:24:0:	class=0x060000 card=0x00000000 chip=0x11001022 rev=0x00 hdr=0x00
    vendor     = 'Advanced Micro Devices, Inc. [AMD]'
    device     = 'K8 [Athlon64/Opteron] HyperTransport Technology Configuration'
    class      = bridge
    subclass   = HOST-PCI
    cap 08[80] = HT host

hostb2@pci0:0:24:1:	class=0x060000 card=0x00000000 chip=0x11011022 rev=0x00 hdr=0x00
    vendor     = 'Advanced Micro Devices, Inc. [AMD]'
    device     = 'K8 [Athlon64/Opteron] Address Map'
    class      = bridge
    subclass   = HOST-PCI

hostb3@pci0:0:24:2:	class=0x060000 card=0x00000000 chip=0x11021022 rev=0x00 hdr=0x00
    vendor     = 'Advanced Micro Devices, Inc. [AMD]'
    device     = 'K8 [Athlon64/Opteron] DRAM Controller'
    class      = bridge
    subclass   = HOST-PCI

hostb4@pci0:0:24:3:	class=0x060000 card=0x00000000 chip=0x11031022 rev=0x00 hdr=0x00
    vendor     = 'Advanced Micro Devices, Inc. [AMD]'
    device     = 'K8 [Athlon64/Opteron] Miscellaneous Control'
    class      = bridge
    subclass   = HOST-PCI
    cap 0f[f0] = unknown

vgapci0@pci0:1:5:0:	class=0x030000 card=0x0184107b chip=0x791f1002 rev=0x00 hdr=0x00
    vendor     = 'Advanced Micro Devices, Inc. [AMD/ATI]'
    device     = 'RS690M [Radeon Xpress 1200/1250/1270]'
    class      = display
    subclass   = VGA
    bar   [10] = type Prefetchable Memory, range 64, base 0xd0000000, size 268435456, enabled
    bar   [18] = type Memory, range 64, base 0xf0100000, size 65536, enabled
    bar   [20] = type I/O Port, range 32, base 0x9400, size 256, enabled
    bar   [24] = type Memory, range 32, base 0xf0000000, size 1048576, enabled
    cap 01[50] = powerspec 2  supports D0 D1 D2 D3  current D0
    cap 05[80] = MSI supports 1 message, 64 bit 

ath0@pci0:2:0:0:	class=0x020000 card=0x04281468 chip=0x001c168c rev=0x01 hdr=0x00
    vendor     = 'Qualcomm Atheros'
    device     = 'AR242x / AR542x Wireless Network Adapter (PCI-Express)'
    class      = network
    subclass   = ethernet
    bar   [10] = type Memory, range 64, base 0xf0200000, size 65536, enabled
    cap 01[40] = powerspec 2  supports D0 D3  current D0
    cap 05[50] = MSI supports 1 message 
    cap 10[60] = PCI-Express 1 legacy endpoint max data 128(128) RO
                 link x1(x1) speed 2.5(2.5) ASPM L1(L0s/L1)
    cap 11[90] = MSI-X supports 1 message
                 Table in map 0x10[0x0], PBA in map 0x10[0x0]
    ecap 0001[100] = AER 1 0 fatal 1 non-fatal 0 corrected
    ecap 0002[140] = VC 1 max VC0

re0@pci0:5:0:0:	class=0x020000 card=0x0184107b chip=0x813610ec rev=0x02 hdr=0x00
    vendor     = 'Realtek Semiconductor Co., Ltd.'
    device     = 'RTL810xE PCI Express Fast Ethernet controller'
    class      = network
    subclass   = ethernet
    bar   [10] = type I/O Port, range 32, base 0xa400, size 256, enabled
    bar   [18] = type Prefetchable Memory, range 64, base 0xcfdef000, size 4096, enabled
    bar   [20] = type Prefetchable Memory, range 64, base 0xcfdf0000, size 65536, enabled
    cap 01[40] = powerspec 3  supports D0 D1 D2 D3  current D0
    cap 05[50] = MSI supports 1 message, 64 bit 
    cap 10[70] = PCI-Express 2 endpoint MSI 1 max data 128(256) RO
                 link x1(x1) speed 2.5(2.5) ASPM disabled(L0s/L1) ClockPM disabled
    cap 11[ac] = MSI-X supports 2 messages, enabled
                 Table in map 0x20[0x0], PBA in map 0x20[0x800]
    cap 03[cc] = VPD
    ecap 0001[100] = AER 1 0 fatal 0 non-fatal 2 corrected
    ecap 0002[140] = VC 1 max VC0
    ecap 0003[160] = Serial 1 5b050000ffff0000
