hostb0@pci0:0:0:0:	class=0x060000 rev=0x01 hdr=0x00 vendor=0x8086 device=0x4c53 subvendor=0x1028 subdevice=0x0a4b
    vendor     = 'Intel Corporation'
    class      = bridge
    subclass   = HOST-PCI

vgapci0@pci0:0:2:0:	class=0x030000 rev=0x04 hdr=0x00 vendor=0x8086 device=0x4c8b subvendor=0x1028 subdevice=0x0a4b
    vendor     = 'Intel Corporation'
    device     = 'RocketLake-S GT1 [UHD Graphics 730]'
    class      = display
    subclass   = VGA
    bar   [10] = type Memory, range 64, base 0x6000000000, size 16777216, enabled
    bar   [18] = type Prefetchable Memory, range 64, base 0x4000000000, size 268435456, enabled
    bar   [20] = type I/O Port, range 32, base 0x4000, size 64, enabled
    cap 09[40] = vendor (length 12) Intel cap 0 version 1
    cap 10[70] = PCI-Express 2 root endpoint max data 128(128) FLR
                 max read 128
    cap 05[ac] = MSI supports 1 message, vector masks 
    cap 01[d0] = powerspec 2  supports D0 D3  current D0
    ecap 001b[100] = Process Address Space ID 1
    ecap 000f[200] = ATS 1
    ecap 0013[300] = Page Page Request 1

xhci0@pci0:0:20:0:	class=0x0c0330 rev=0x11 hdr=0x00 vendor=0x8086 device=0x43ed subvendor=0x1028 subdevice=0x0a4b
    vendor     = 'Intel Corporation'
    device     = 'Tiger Lake-H USB 3.2 Gen 2x1 xHCI Host Controller'
    class      = serial bus
    subclass   = USB
    bar   [10] = type Memory, range 64, base 0x6001100000, size 65536, enabled
    cap 01[70] = powerspec 2  supports D0 D3  current D0
    cap 05[80] = MSI supports 8 messages, 64 bit enabled with 1 message
    cap 09[90] = vendor (length 20) Intel cap 15 version 0
    cap 09[b0] = vendor (length 0) Intel cap 0 version 1

none0@pci0:0:20:2:	class=0x050000 rev=0x11 hdr=0x00 vendor=0x8086 device=0x43ef subvendor=0x1028 subdevice=0x0a4b
    vendor     = 'Intel Corporation'
    device     = 'Tiger Lake-H Shared SRAM'
    class      = memory
    subclass   = RAM
    bar   [10] = type Memory, range 64, base 0x6001114000, size 16384, enabled
    bar   [18] = type Memory, range 64, base 0x600111b000, size 4096, enabled
    cap 01[80] = powerspec 3  supports D0 D3  current D0

ig4iic0@pci0:0:21:0:	class=0x0c8000 rev=0x11 hdr=0x00 vendor=0x8086 device=0x43e8 subvendor=0x1028 subdevice=0x0a4b
    vendor     = 'Intel Corporation'
    device     = 'Tiger Lake-H Serial IO I2C Controller'
    class      = serial bus
    bar   [10] = type Memory, range 64, base 0x80000000, size 4096, enabled
    cap 01[80] = powerspec 3  supports D0 D3  current D0
    cap 09[90] = vendor (length 20) Intel cap 15 version 0

none1@pci0:0:22:0:	class=0x078000 rev=0x11 hdr=0x00 vendor=0x8086 device=0x43e0 subvendor=0x1028 subdevice=0x0a4b
    vendor     = 'Intel Corporation'
    device     = 'Tiger Lake-H Management Engine Interface'
    class      = simple comms
    bar   [10] = type Memory, range 64, base 0x6001119000, size 4096, enabled
    cap 01[50] = powerspec 3  supports D0 D3  current D0
    cap 05[8c] = MSI supports 1 message, 64 bit 
    cap 09[a4] = vendor (length 20) Intel cap 15 version 0

ahci0@pci0:0:23:0:	class=0x010601 rev=0x11 hdr=0x00 vendor=0x8086 device=0x43d2 subvendor=0x1028 subdevice=0x0a4b
    vendor     = 'Intel Corporation'
    class      = mass storage
    subclass   = SATA
    bar   [10] = type Memory, range 32, base 0x70a00000, size 8192, enabled
    bar   [14] = type Memory, range 32, base 0x70a04000, size 256, enabled
    bar   [18] = type I/O Port, range 32, base 0x4080, size 8, enabled
    bar   [1c] = type I/O Port, range 32, base 0x4088, size 4, enabled
    bar   [20] = type I/O Port, range 32, base 0x4060, size 32, enabled
    bar   [24] = type Memory, range 32, base 0x70a03000, size 2048, enabled
    cap 05[80] = MSI supports 1 message enabled with 1 message
    cap 01[70] = powerspec 3  supports D0 D3  current D0
    cap 12[a8] = SATA Index-Data Pair

pcib1@pci0:0:27:0:	class=0x060400 rev=0x11 hdr=0x01 vendor=0x8086 device=0x43c4 subvendor=0x0000 subdevice=0x0000
    vendor     = 'Intel Corporation'
    class      = bridge
    subclass   = PCI-PCI
    cap 10[40] = PCI-Express 2 root port max data 256(256) ARI disabled
                 max read 128
                 link x4(x4) speed 8.0(8.0) ASPM L1(L1)
                 slot 4 power limit 250 mW
    cap 05[80] = MSI supports 1 message 
    cap 0d[90] = PCI Bridge subvendor=0x0000 subdevice=0x0000
    cap 01[a0] = powerspec 3  supports D0 D3  current D0
    ecap 0001[100] = AER 1 0 fatal 0 non-fatal 0 corrected
    ecap 000d[220] = ACS 1
    ecap 001f[150] = Precision Time Measurement 1
    ecap 001e[200] = L1 PM Substates 1
    ecap 0019[a30] = PCIe Sec 1 lane errors 0
    ecap 001d[a00] = Downstream Port Containment 1

pcib2@pci0:0:28:0:	class=0x060400 rev=0x11 hdr=0x01 vendor=0x8086 device=0x43bc subvendor=0x0000 subdevice=0x0000
    vendor     = 'Intel Corporation'
    device     = 'Tiger Lake-H PCI Express Root Port'
    class      = bridge
    subclass   = PCI-PCI
    cap 10[40] = PCI-Express 2 root port max data 128(256) ARI disabled
                 max read 128
                 link x1(x1) speed 2.5(8.0) ASPM L1(L0s/L1)
                 slot 6 power limit 100 mW
    cap 05[80] = MSI supports 1 message 
    cap 0d[90] = PCI Bridge subvendor=0x0000 subdevice=0x0000
    cap 01[a0] = powerspec 3  supports D0 D3  current D0
    ecap 0001[100] = AER 1 0 fatal 0 non-fatal 0 corrected
    ecap 000d[220] = ACS 1
    ecap 001f[150] = Precision Time Measurement 1
    ecap 001e[200] = L1 PM Substates 1
    ecap 0019[a30] = PCIe Sec 1 lane errors 0
    ecap 001d[a00] = Downstream Port Containment 1

isab0@pci0:0:31:0:	class=0x060100 rev=0x11 hdr=0x00 vendor=0x8086 device=0x4387 subvendor=0x1028 subdevice=0x0a4b
    vendor     = 'Intel Corporation'
    class      = bridge
    subclass   = PCI-ISA

hdac0@pci0:0:31:3:	class=0x040300 rev=0x11 hdr=0x00 vendor=0x8086 device=0x43c8 subvendor=0x1028 subdevice=0x0a4b
    vendor     = 'Intel Corporation'
    device     = 'Tiger Lake-H HD Audio Controller'
    class      = multimedia
    subclass   = HDA
    bar   [10] = type Memory, range 64, base 0x6001110000, size 16384, enabled
    bar   [20] = type Memory, range 64, base 0x6001000000, size 1048576, enabled
    cap 01[50] = powerspec 3  supports D0 D3  current D0
    cap 09[80] = vendor (length 20) Intel cap 15 version 0
    cap 05[60] = MSI supports 1 message, 64 bit enabled with 1 message

none2@pci0:0:31:4:	class=0x0c0500 rev=0x11 hdr=0x00 vendor=0x8086 device=0x43a3 subvendor=0x1028 subdevice=0x0a4b
    vendor     = 'Intel Corporation'
    device     = 'Tiger Lake-H SMBus Controller'
    class      = serial bus
    subclass   = SMBus
    bar   [10] = type Memory, range 64, base 0x6001118000, size 256, enabled
    bar   [20] = type I/O Port, range 32, base 0xefa0, size 32, enabled

none3@pci0:0:31:5:	class=0x0c8000 rev=0x11 hdr=0x00 vendor=0x8086 device=0x43a4 subvendor=0x1028 subdevice=0x0a4b
    vendor     = 'Intel Corporation'
    device     = 'Tiger Lake-H SPI Controller'
    class      = serial bus
    bar   [10] = type Memory, range 32, base 0xfe010000, size 4096, enabled

nvme0@pci0:1:0:0:	class=0x010802 rev=0x00 hdr=0x00 vendor=0x1c5c device=0x174a subvendor=0x1c5c subdevice=0x174a
    vendor     = 'SK hynix'
    device     = 'Gold P31 SSD'
    class      = mass storage
    subclass   = NVM
    bar   [10] = type Memory, range 64, base 0x70900000, size 16384, enabled
    bar   [18] = type Memory, range 32, base 0x70905000, size 4096, enabled
    bar   [1c] = type Memory, range 32, base 0x70904000, size 4096, enabled
    cap 01[80] = powerspec 3  supports D0 D3  current D0
    cap 05[90] = MSI supports 16 messages, 64 bit, vector masks 
    cap 11[b0] = MSI-X supports 33 messages, enabled
                 Table in map 0x10[0x2000], PBA in map 0x10[0x3000]
    cap 10[c0] = PCI-Express 2 endpoint max data 256(512) FLR RO NS
                 max read 512
                 link x4(x4) speed 8.0(8.0) ASPM L1(L1) ClockPM enabled
    ecap 0001[100] = AER 2 0 fatal 1 non-fatal 2 corrected
    ecap 0003[150] = Serial 1 0000000000000000
    ecap 0004[160] = Power Budgeting 1
    ecap 0018[1b8] = LTR 1
    ecap 0019[300] = PCIe Sec 1 lane errors 0
    ecap 000b[400] = Vendor [1] ID 0001 Rev 1 Length 16
    ecap 001e[900] = L1 PM Substates 1

re0@pci0:2:0:0:	class=0x020000 rev=0x15 hdr=0x00 vendor=0x10ec device=0x8168 subvendor=0x1028 subdevice=0x0a4b
    vendor     = 'Realtek Semiconductor Co., Ltd.'
    device     = 'RTL8111/8168/8411 PCI Express Gigabit Ethernet Controller'
    class      = network
    subclass   = ethernet
    bar   [10] = type I/O Port, range 32, base 0x3000, size 256, enabled
    bar   [18] = type Memory, range 64, base 0x70804000, size 4096, enabled
    bar   [20] = type Memory, range 64, base 0x70800000, size 16384, enabled
    cap 01[40] = powerspec 3  supports D0 D1 D2 D3  current D0
    cap 05[50] = MSI supports 1 message, 64 bit 
    cap 10[70] = PCI-Express 2 endpoint MSI 1 max data 128(128) RO
                 max read 4096
                 link x1(x1) speed 2.5(2.5) ASPM disabled(L0s/L1) ClockPM disabled
    cap 11[b0] = MSI-X supports 4 messages, enabled
                 Table in map 0x20[0x0], PBA in map 0x20[0x800]
    ecap 0001[100] = AER 2 1 fatal 0 non-fatal 0 corrected
    ecap 0002[140] = VC 1 max VC0
    ecap 0003[160] = Serial 1 01000000684ce000
    ecap 0018[170] = LTR 1
    ecap 001e[178] = L1 PM Substates 1
