hostb0@pci0:0:0:0:	class=0x060000 card=0x306c103c chip=0x2a408086 rev=0x07 hdr=0x00
    vendor     = 'Intel Corporation'
    device     = 'Mobile 4 Series Chipset Memory Controller Hub'
    class      = bridge
    subclass   = HOST-PCI
    cap 09[e0] = vendor (length 10) Intel cap 1 version 1

pcib1@pci0:0:1:0:	class=0x060400 card=0x306c103c chip=0x2a418086 rev=0x07 hdr=0x01
    vendor     = 'Intel Corporation'
    device     = 'Mobile 4 Series Chipset PCI Express Graphics Port'
    class      = bridge
    subclass   = PCI-PCI
    cap 0d[88] = PCI Bridge card=0x306c103c
    cap 01[80] = powerspec 3  supports D0 D3  current D0
    cap 05[90] = MSI supports 1 message 
    cap 10[a0] = PCI-Express 1 root port max data 128(128)
                 link x16(x16) speed 2.5(2.5) ASPM L0s/L1(L0s/L1)
                 slot 1 power limit 75000 mW HotPlug(present)
    ecap 0002[100] = VC 1 max VC0
    ecap 0005[140] = Root Complex Link Declaration 1

uhci0@pci0:0:26:0:	class=0x0c0300 card=0x306c103c chip=0x29378086 rev=0x03 hdr=0x00
    vendor     = 'Intel Corporation'
    device     = '82801I (ICH9 Family) USB UHCI Controller'
    class      = serial bus
    subclass   = USB
    bar   [20] = type I/O Port, range 32, base 0x50e0, size 32, enabled
    cap 13[50] = PCI Advanced Features: FLR TP

uhci1@pci0:0:26:1:	class=0x0c0300 card=0x306c103c chip=0x29388086 rev=0x03 hdr=0x00
    vendor     = 'Intel Corporation'
    device     = '82801I (ICH9 Family) USB UHCI Controller'
    class      = serial bus
    subclass   = USB
    bar   [20] = type I/O Port, range 32, base 0x50c0, size 32, enabled
    cap 13[50] = PCI Advanced Features: FLR TP

ehci0@pci0:0:26:7:	class=0x0c0320 card=0x306c103c chip=0x293c8086 rev=0x03 hdr=0x00
    vendor     = 'Intel Corporation'
    device     = '82801I (ICH9 Family) USB2 EHCI Controller'
    class      = serial bus
    subclass   = USB
    bar   [10] = type Memory, range 32, base 0xd7005c00, size 1024, enabled
    cap 01[50] = powerspec 2  supports D0 D3  current D0
    cap 0a[58] = EHCI Debug Port at offset 0xa0 in map 0x14
    cap 13[98] = PCI Advanced Features: FLR TP

hdac0@pci0:0:27:0:	class=0x040300 card=0x306c103c chip=0x293e8086 rev=0x03 hdr=0x00
    vendor     = 'Intel Corporation'
    device     = '82801I (ICH9 Family) HD Audio Controller'
    class      = multimedia
    subclass   = HDA
    bar   [10] = type Memory, range 64, base 0xd7000000, size 16384, enabled
    cap 01[50] = powerspec 2  supports D0 D3  current D0
    cap 05[60] = MSI supports 1 message, 64 bit enabled with 1 message
    cap 10[70] = PCI-Express 1 root endpoint max data 128(128) FLR NS
    ecap 0002[100] = VC 1 max VC1
    ecap 0005[130] = Root Complex Link Declaration 1

pcib2@pci0:0:28:0:	class=0x060400 card=0x306c103c chip=0x29408086 rev=0x03 hdr=0x01
    vendor     = 'Intel Corporation'
    device     = '82801I (ICH9 Family) PCI Express Port 1'
    class      = bridge
    subclass   = PCI-PCI
    cap 10[40] = PCI-Express 1 root port max data 128(128)
                 link x1(x1) speed 2.5(2.5) ASPM L0s/L1(L0s/L1)
                 slot 0 power limit 65 mW HotPlug(present) surprise
    cap 05[80] = MSI supports 1 message 
    cap 0d[90] = PCI Bridge card=0x306c103c
    cap 01[a0] = powerspec 2  supports D0 D3  current D0
    ecap 0002[100] = VC 1 max VC0
    ecap 0005[180] = Root Complex Link Declaration 1

pcib3@pci0:0:28:1:	class=0x060400 card=0x306c103c chip=0x29428086 rev=0x03 hdr=0x01
    vendor     = 'Intel Corporation'
    device     = '82801I (ICH9 Family) PCI Express Port 2'
    class      = bridge
    subclass   = PCI-PCI
    cap 10[40] = PCI-Express 1 root port max data 128(128)
                 link x1(x1) speed 2.5(2.5) ASPM disabled(L0s/L1)
                 slot 1 power limit 65 mW HotPlug(present) surprise
    cap 05[80] = MSI supports 1 message 
    cap 0d[90] = PCI Bridge card=0x306c103c
    cap 01[a0] = powerspec 2  supports D0 D3  current D0
    ecap 0002[100] = VC 1 max VC0
    ecap 0005[180] = Root Complex Link Declaration 1

uhci2@pci0:0:29:0:	class=0x0c0300 card=0x306c103c chip=0x29348086 rev=0x03 hdr=0x00
    vendor     = 'Intel Corporation'
    device     = '82801I (ICH9 Family) USB UHCI Controller'
    class      = serial bus
    subclass   = USB
    bar   [20] = type I/O Port, range 32, base 0x50a0, size 32, enabled
    cap 13[50] = PCI Advanced Features: FLR TP

uhci3@pci0:0:29:1:	class=0x0c0300 card=0x306c103c chip=0x29358086 rev=0x03 hdr=0x00
    vendor     = 'Intel Corporation'
    device     = '82801I (ICH9 Family) USB UHCI Controller'
    class      = serial bus
    subclass   = USB
    bar   [20] = type I/O Port, range 32, base 0x5080, size 32, enabled
    cap 13[50] = PCI Advanced Features: FLR TP

uhci4@pci0:0:29:2:	class=0x0c0300 card=0x306c103c chip=0x29368086 rev=0x03 hdr=0x00
    vendor     = 'Intel Corporation'
    device     = '82801I (ICH9 Family) USB UHCI Controller'
    class      = serial bus
    subclass   = USB
    bar   [20] = type I/O Port, range 32, base 0x5060, size 32, enabled
    cap 13[50] = PCI Advanced Features: FLR TP

uhci5@pci0:0:29:3:	class=0x0c0300 card=0x306c103c chip=0x29398086 rev=0x03 hdr=0x00
    vendor     = 'Intel Corporation'
    device     = '82801I (ICH9 Family) USB UHCI Controller'
    class      = serial bus
    subclass   = USB
    bar   [20] = type I/O Port, range 32, base 0x5040, size 32, enabled
    cap 13[50] = PCI Advanced Features: FLR TP

ehci1@pci0:0:29:7:	class=0x0c0320 card=0x306c103c chip=0x293a8086 rev=0x03 hdr=0x00
    vendor     = 'Intel Corporation'
    device     = '82801I (ICH9 Family) USB2 EHCI Controller'
    class      = serial bus
    subclass   = USB
    bar   [10] = type Memory, range 32, base 0xd7005800, size 1024, enabled
    cap 01[50] = powerspec 2  supports D0 D3  current D0
    cap 0a[58] = EHCI Debug Port at offset 0xa0 in map 0x14
    cap 13[98] = PCI Advanced Features: FLR TP

pcib4@pci0:0:30:0:	class=0x060401 card=0x306c103c chip=0x24488086 rev=0x93 hdr=0x01
    vendor     = 'Intel Corporation'
    device     = '82801 Mobile PCI Bridge'
    class      = bridge
    subclass   = PCI-PCI
    cap 0d[50] = PCI Bridge card=0x306c103c

isab0@pci0:0:31:0:	class=0x060100 card=0x306c103c chip=0x29198086 rev=0x03 hdr=0x00
    vendor     = 'Intel Corporation'
    device     = 'ICH9M LPC Interface Controller'
    class      = bridge
    subclass   = PCI-ISA
    cap 09[e0] = vendor (length 12) Intel cap 1 version 0
		 features: Quick Resume, SATA RAID-5, Mobile, 4 PCI-e x1 slots, SATA RAID-0/1/10

ahci0@pci0:0:31:2:	class=0x010601 card=0x306c103c chip=0x29298086 rev=0x03 hdr=0x00
    vendor     = 'Intel Corporation'
    device     = '82801IBM/IEM (ICH9M/ICH9M-E) 4 port SATA Controller [AHCI mode]'
    class      = mass storage
    subclass   = SATA
    bar   [10] = type I/O Port, range 32, base 0x5108, size 8, enabled
    bar   [14] = type I/O Port, range 32, base 0x5114, size 4, enabled
    bar   [18] = type I/O Port, range 32, base 0x5100, size 8, enabled
    bar   [1c] = type I/O Port, range 32, base 0x5110, size 4, enabled
    bar   [20] = type I/O Port, range 32, base 0x5020, size 32, enabled
    bar   [24] = type Memory, range 32, base 0xd7005000, size 2048, enabled
    cap 05[80] = MSI supports 16 messages enabled with 16 messages
    cap 01[70] = powerspec 3  supports D0 D3  current D0
    cap 12[a8] = SATA Index-Data Pair
    cap 13[b0] = PCI Advanced Features: FLR TP

none0@pci0:0:31:3:	class=0x0c0500 card=0x306c103c chip=0x29308086 rev=0x03 hdr=0x00
    vendor     = 'Intel Corporation'
    device     = '82801I (ICH9 Family) SMBus Controller'
    class      = serial bus
    subclass   = SMBus
    bar   [10] = type Memory, range 64, base 0xd7006000, size 256, enabled
    bar   [20] = type I/O Port, range 32, base 0x5000, size 32, enabled

none1@pci0:0:31:6:	class=0x118000 card=0x306c103c chip=0x29328086 rev=0x03 hdr=0x00
    vendor     = 'Intel Corporation'
    device     = '82801I (ICH9 Family) Thermal Subsystem'
    class      = dasp
    bar   [10] = type Memory, range 64, base 0xd7004000, size 4096, enabled
    cap 01[50] = powerspec 3  supports D0 D3  current D0

vgapci0@pci0:1:0:0:	class=0x030000 card=0x306c103c chip=0x06ef10de rev=0xa1 hdr=0x00
    vendor     = 'NVIDIA Corporation'
    device     = 'G98M [GeForce G 103M]'
    class      = display
    subclass   = VGA
    bar   [10] = type Memory, range 32, base 0xd2000000, size 16777216, enabled
    bar   [14] = type Prefetchable Memory, range 64, base 0xc0000000, size 268435456, enabled
    bar   [1c] = type Memory, range 64, base 0xd0000000, size 33554432, enabled
    bar   [24] = type I/O Port, range 32, base 0x4000, size 128, enabled
    cap 01[60] = powerspec 3  supports D0 D3  current D0
    cap 05[68] = MSI supports 1 message, 64 bit enabled with 1 message
    cap 10[78] = PCI-Express 2 endpoint max data 128(128) RO NS
                 link x16(x16) speed 2.5(5.0) ASPM L0s/L1(L0s/L1)
    ecap 0002[100] = VC 1 max VC0
    ecap 0004[128] = Power Budgeting 1
    ecap 000b[600] = Vendor 1 ID 1

ath0@pci0:2:0:0:	class=0x028000 card=0x3040103c chip=0x002b168c rev=0x01 hdr=0x00
    vendor     = 'Qualcomm Atheros'
    device     = 'AR9285 Wireless Network Adapter (PCI-Express)'
    class      = network
    bar   [10] = type Memory, range 64, base 0xd6000000, size 65536, enabled
    cap 01[40] = powerspec 3  supports D0 D1 D3  current D0
    cap 05[50] = MSI supports 1 message 
    cap 10[60] = PCI-Express 2 legacy endpoint max data 128(128) RO
                 link x1(x1) speed 2.5(2.5) ASPM L0s/L1(L0s/L1)
    ecap 0001[100] = AER 1 0 fatal 0 non-fatal 3 corrected
    ecap 0002[140] = VC 1 max VC0
    ecap 0003[160] = Serial 1 001517ffff241412
    ecap 0004[170] = Power Budgeting 1

re0@pci0:3:0:0:	class=0x020000 card=0x306c103c chip=0x813610ec rev=0x02 hdr=0x00
    vendor     = 'Realtek Semiconductor Co., Ltd.'
    device     = 'RTL810xE PCI Express Fast Ethernet controller'
    class      = network
    subclass   = ethernet
    bar   [10] = type I/O Port, range 32, base 0x2000, size 256, enabled
    bar   [18] = type Prefetchable Memory, range 64, base 0xd4010000, size 4096, enabled
    bar   [20] = type Prefetchable Memory, range 64, base 0xd4000000, size 65536, enabled
    cap 01[40] = powerspec 3  supports D0 D1 D2 D3  current D0
    cap 05[50] = MSI supports 1 message, 64 bit 
    cap 10[70] = PCI-Express 2 endpoint MSI 1 max data 128(128) RO
                 link x1(x1) speed 2.5(2.5) ASPM disabled(L0s/L1)
    cap 11[ac] = MSI-X supports 2 messages, enabled
                 Table in map 0x20[0x0], PBA in map 0x20[0x800]
    cap 03[cc] = VPD
    ecap 0001[100] = AER 1 0 fatal 0 non-fatal 2 corrected
    ecap 0002[140] = VC 1 max VC0
    ecap 0003[160] = Serial 1 0000000000000000
