pcib1@pci0:0:0:0:	class=0x060400 rev=0x00 hdr=0x01 vendor=0x13b5 device=0x0100 subvendor=0x0000 subdevice=0x0000
    vendor     = 'ARM'
    class      = bridge
    subclass   = PCI-PCI
    cap 01[80] = powerspec 3  supports D0 D1 D3  current D0
    cap 05[90] = MSI supports 1 message, 64 bit, vector masks 
    cap 11[b0] = MSI-X supports 1 message
                 Table in map 0x10[0x0], PBA in map 0x10[0x8]
    cap 10[c0] = PCI-Express 2 root port max data 128(1024) RO NS ARI disabled
                 max read 128
                 link x16(x16) speed 8.0(8.0) ASPM disabled(L0s/L1)
    ecap 0001[100] = AER 2 0 fatal 0 non-fatal 0 corrected
    ecap 0003[150] = Serial 1 0000000000000000
    ecap 0017[274] = TPH Requester 1
    ecap 0019[300] = PCIe Sec 1 lane errors 0
    ecap 001e[900] = L1 PM Substates 1

pcib2@pci0:1:0:0:	class=0x060400 rev=0xca hdr=0x01 vendor=0x10b5 device=0x8749 subvendor=0x10b5 subdevice=0x8749
    vendor     = 'PLX Technology, Inc.'
    device     = 'PEX 8749 48-Lane, 18-Port PCI Express Gen 3 (8.0 GT/s) Multi-Root Switch with DMA'
    class      = bridge
    subclass   = PCI-PCI
    bar   [10] = type Memory, range 32, base 0x60300000, size 262144, enabled
    cap 01[40] = powerspec 3  supports D0 D3  current D0
    cap 05[48] = MSI supports 8 messages, 64 bit, vector masks 
    cap 10[68] = PCI-Express 2 upstream port max data 128(256) RO NS
                 max read 128
                 link x16(x16) speed 8.0(8.0) ASPM disabled(L1)
    cap 0d[a4] = PCI Bridge subvendor=0x10b5 subdevice=0x8749
    ecap 0003[100] = Serial 1 ca870010b5df0e00
    ecap 0001[fb4] = AER 1 0 fatal 0 non-fatal 1 corrected
    ecap 0004[138] = Power Budgeting 1
    ecap 0019[10c] = PCIe Sec 1 lane errors 0
    ecap 0002[148] = VC 1 max VC1 lowpri VC0-VC1
    ecap 0012[e00] = Multicast 1
    ecap 0018[b00] = LTR 1
    ecap 000b[b70] = Vendor [1] ID 0001 Rev 0 Length 16

none0@pci0:1:0:1:	class=0x088000 rev=0xca hdr=0x00 vendor=0x10b5 device=0x87d0 subvendor=0x10b5 subdevice=0x87d0
    vendor     = 'PLX Technology, Inc.'
    device     = 'PEX PCI Express Switch DMA interface'
    class      = base peripheral
    bar   [10] = type Memory, range 32, base 0x60346000, size 8192, enabled
    cap 01[40] = powerspec 3  supports D0 D3  current D0
    cap 05[48] = MSI supports 8 messages, 64 bit, vector masks 
    cap 10[68] = PCI-Express 2 endpoint max data 128(2048) FLR RO NS
                 max read 512
                 link x16(x16) speed 8.0(8.0) ASPM disabled(L1)
    ecap 0003[100] = Serial 1 ca870010b5df0e00
    ecap 0001[fb4] = AER 1 0 fatal 0 non-fatal 1 corrected
    ecap 000b[1f0] = Vendor [1] ID 0010 Rev 0 Length 196
    ecap 000b[b70] = Vendor [1] ID 0001 Rev 0 Length 16

none1@pci0:1:0:2:	class=0x088000 rev=0xca hdr=0x00 vendor=0x10b5 device=0x87d0 subvendor=0x10b5 subdevice=0x87d0
    vendor     = 'PLX Technology, Inc.'
    device     = 'PEX PCI Express Switch DMA interface'
    class      = base peripheral
    bar   [10] = type Memory, range 32, base 0x60344000, size 8192, enabled
    cap 01[40] = powerspec 3  supports D0 D3  current D0
    cap 05[48] = MSI supports 8 messages, 64 bit, vector masks 
    cap 10[68] = PCI-Express 2 endpoint max data 128(2048) FLR RO NS
                 max read 512
                 link x16(x16) speed 8.0(8.0) ASPM disabled(L1)
    ecap 0003[100] = Serial 1 ca870010b5df0e00
    ecap 0001[fb4] = AER 1 0 fatal 0 non-fatal 1 corrected
    ecap 000b[1f0] = Vendor [1] ID 0010 Rev 0 Length 196
    ecap 000b[b70] = Vendor [1] ID 0001 Rev 0 Length 16

none2@pci0:1:0:3:	class=0x088000 rev=0xca hdr=0x00 vendor=0x10b5 device=0x87d0 subvendor=0x10b5 subdevice=0x87d0
    vendor     = 'PLX Technology, Inc.'
    device     = 'PEX PCI Express Switch DMA interface'
    class      = base peripheral
    bar   [10] = type Memory, range 32, base 0x60342000, size 8192, enabled
    cap 01[40] = powerspec 3  supports D0 D3  current D0
    cap 05[48] = MSI supports 8 messages, 64 bit, vector masks 
    cap 10[68] = PCI-Express 2 endpoint max data 128(2048) FLR RO NS
                 max read 512
                 link x16(x16) speed 8.0(8.0) ASPM disabled(L1)
    ecap 0003[100] = Serial 1 ca870010b5df0e00
    ecap 0001[fb4] = AER 1 0 fatal 0 non-fatal 1 corrected
    ecap 000b[1f0] = Vendor [1] ID 0010 Rev 0 Length 196
    ecap 000b[b70] = Vendor [1] ID 0001 Rev 0 Length 16

none3@pci0:1:0:4:	class=0x088000 rev=0xca hdr=0x00 vendor=0x10b5 device=0x87d0 subvendor=0x10b5 subdevice=0x87d0
    vendor     = 'PLX Technology, Inc.'
    device     = 'PEX PCI Express Switch DMA interface'
    class      = base peripheral
    bar   [10] = type Memory, range 32, base 0x60340000, size 8192, enabled
    cap 01[40] = powerspec 3  supports D0 D3  current D0
    cap 05[48] = MSI supports 8 messages, 64 bit, vector masks 
    cap 10[68] = PCI-Express 2 endpoint max data 128(2048) FLR RO NS
                 max read 512
                 link x16(x16) speed 8.0(8.0) ASPM disabled(L1)
    ecap 0003[100] = Serial 1 ca870010b5df0e00
    ecap 0001[fb4] = AER 1 0 fatal 0 non-fatal 1 corrected
    ecap 000b[1f0] = Vendor [1] ID 0010 Rev 0 Length 196
    ecap 000b[b70] = Vendor [1] ID 0001 Rev 0 Length 16

pcib3@pci0:2:8:0:	class=0x060400 rev=0xca hdr=0x01 vendor=0x10b5 device=0x8749 subvendor=0x10b5 subdevice=0x8749
    vendor     = 'PLX Technology, Inc.'
    device     = 'PEX 8749 48-Lane, 18-Port PCI Express Gen 3 (8.0 GT/s) Multi-Root Switch with DMA'
    class      = bridge
    subclass   = PCI-PCI
    cap 01[40] = powerspec 3  supports D0 D3  current D0
    cap 05[48] = MSI supports 8 messages, 64 bit, vector masks 
    cap 10[68] = PCI-Express 2 downstream port max data 128(256) RO NS ARI disabled
                 max read 128
                 link x0(x16) speed 0.0(8.0) ASPM disabled(L1)
                 slot 8 power limit 25000 mW HotPlug(empty) Attn Button PC(off) MRL(open)
    cap 0d[a4] = PCI Bridge subvendor=0x10b5 subdevice=0x8749
    ecap 0003[100] = Serial 1 ca870010b5df0e00
    ecap 0001[fb4] = AER 1 0 fatal 0 non-fatal 1 corrected
    ecap 0004[138] = Power Budgeting 1
    ecap 0019[10c] = PCIe Sec 1 lane errors 0
    ecap 0002[148] = VC 1 max VC1 lowpri VC0-VC1
    ecap 0012[e00] = Multicast 1
    ecap 000d[f24] = ACS 1
    ecap 000b[b70] = Vendor [1] ID 0001 Rev 0 Length 16

pcib4@pci0:2:16:0:	class=0x060400 rev=0xca hdr=0x01 vendor=0x10b5 device=0x8749 subvendor=0x10b5 subdevice=0x8749
    vendor     = 'PLX Technology, Inc.'
    device     = 'PEX 8749 48-Lane, 18-Port PCI Express Gen 3 (8.0 GT/s) Multi-Root Switch with DMA'
    class      = bridge
    subclass   = PCI-PCI
    cap 01[40] = powerspec 3  supports D0 D3  current D0
    cap 05[48] = MSI supports 8 messages, 64 bit, vector masks 
    cap 10[68] = PCI-Express 2 downstream port max data 128(256) RO NS ARI disabled
                 max read 128
                 link x0(x8) speed 0.0(8.0) ASPM disabled(L1)
                 slot 16 power limit 25000 mW
    cap 0d[a4] = PCI Bridge subvendor=0x10b5 subdevice=0x8749
    ecap 0003[100] = Serial 1 ca870010b5df0e00
    ecap 0001[fb4] = AER 1 0 fatal 0 non-fatal 1 corrected
    ecap 0004[138] = Power Budgeting 1
    ecap 0019[10c] = PCIe Sec 1 lane errors 0
    ecap 0002[148] = VC 1 max VC1 lowpri VC0-VC1
    ecap 0012[e00] = Multicast 1
    ecap 000d[f24] = ACS 1
    ecap 000b[b70] = Vendor [1] ID 0001 Rev 0 Length 16

pcib5@pci0:2:17:0:	class=0x060400 rev=0xca hdr=0x01 vendor=0x10b5 device=0x8749 subvendor=0x10b5 subdevice=0x8749
    vendor     = 'PLX Technology, Inc.'
    device     = 'PEX 8749 48-Lane, 18-Port PCI Express Gen 3 (8.0 GT/s) Multi-Root Switch with DMA'
    class      = bridge
    subclass   = PCI-PCI
    cap 01[40] = powerspec 3  supports D0 D3  current D0
    cap 05[48] = MSI supports 8 messages, 64 bit, vector masks 
    cap 10[68] = PCI-Express 2 downstream port max data 128(256) RO NS ARI disabled
                 max read 128
                 link x0(x2) speed 0.0(8.0) ASPM disabled(L1)
                 slot 17 power limit 25000 mW HotPlug(empty) Attn Button PC(off) MRL(open)
    cap 0d[a4] = PCI Bridge subvendor=0x10b5 subdevice=0x8749
    ecap 0003[100] = Serial 1 ca870010b5df0e00
    ecap 0001[fb4] = AER 1 0 fatal 0 non-fatal 1 corrected
    ecap 0004[138] = Power Budgeting 1
    ecap 0019[10c] = PCIe Sec 1 lane errors 0
    ecap 0002[148] = VC 1 max VC1 lowpri VC0-VC1
    ecap 0012[e00] = Multicast 1
    ecap 000d[f24] = ACS 1
    ecap 000b[b70] = Vendor [1] ID 0001 Rev 0 Length 16

pcib6@pci0:2:18:0:	class=0x060400 rev=0xca hdr=0x01 vendor=0x10b5 device=0x8749 subvendor=0x10b5 subdevice=0x8749
    vendor     = 'PLX Technology, Inc.'
    device     = 'PEX 8749 48-Lane, 18-Port PCI Express Gen 3 (8.0 GT/s) Multi-Root Switch with DMA'
    class      = bridge
    subclass   = PCI-PCI
    cap 01[40] = powerspec 3  supports D0 D3  current D0
    cap 05[48] = MSI supports 8 messages, 64 bit, vector masks 
    cap 10[68] = PCI-Express 2 downstream port max data 128(256) RO NS ARI disabled
                 max read 128
                 link x1(x2) speed 5.0(8.0) ASPM disabled(L1)
    cap 0d[a4] = PCI Bridge subvendor=0x10b5 subdevice=0x8749
    ecap 0003[100] = Serial 1 ca870010b5df0e00
    ecap 0001[fb4] = AER 1 0 fatal 0 non-fatal 1 corrected
    ecap 0004[138] = Power Budgeting 1
    ecap 0019[10c] = PCIe Sec 1 lane errors 0
    ecap 0002[148] = VC 1 max VC1 lowpri VC0-VC1
    ecap 0012[e00] = Multicast 1
    ecap 000d[f24] = ACS 1
    ecap 000b[b70] = Vendor [1] ID 0001 Rev 0 Length 16

pcib7@pci0:2:19:0:	class=0x060400 rev=0xca hdr=0x01 vendor=0x10b5 device=0x8749 subvendor=0x10b5 subdevice=0x8749
    vendor     = 'PLX Technology, Inc.'
    device     = 'PEX 8749 48-Lane, 18-Port PCI Express Gen 3 (8.0 GT/s) Multi-Root Switch with DMA'
    class      = bridge
    subclass   = PCI-PCI
    cap 01[40] = powerspec 3  supports D0 D3  current D0
    cap 05[48] = MSI supports 8 messages, 64 bit, vector masks 
    cap 10[68] = PCI-Express 2 downstream port max data 128(256) RO NS ARI disabled
                 max read 128
                 link x1(x2) speed 2.5(8.0) ASPM disabled(L1)
    cap 0d[a4] = PCI Bridge subvendor=0x10b5 subdevice=0x8749
    ecap 0003[100] = Serial 1 ca870010b5df0e00
    ecap 0001[fb4] = AER 1 0 fatal 0 non-fatal 1 corrected
    ecap 0004[138] = Power Budgeting 1
    ecap 0019[10c] = PCIe Sec 1 lane errors 0
    ecap 0002[148] = VC 1 max VC1 lowpri VC0-VC1
    ecap 0012[e00] = Multicast 1
    ecap 000d[f24] = ACS 1
    ecap 000b[b70] = Vendor [1] ID 0001 Rev 0 Length 16

pcib8@pci0:2:20:0:	class=0x060400 rev=0xca hdr=0x01 vendor=0x10b5 device=0x8749 subvendor=0x10b5 subdevice=0x8749
    vendor     = 'PLX Technology, Inc.'
    device     = 'PEX 8749 48-Lane, 18-Port PCI Express Gen 3 (8.0 GT/s) Multi-Root Switch with DMA'
    class      = bridge
    subclass   = PCI-PCI
    cap 01[40] = powerspec 3  supports D0 D3  current D0
    cap 05[48] = MSI supports 8 messages, 64 bit, vector masks 
    cap 10[68] = PCI-Express 2 downstream port max data 128(256) RO NS ARI disabled
                 max read 128
                 link x1(x2) speed 5.0(8.0) ASPM disabled(L1)
    cap 0d[a4] = PCI Bridge subvendor=0x10b5 subdevice=0x8749
    ecap 0003[100] = Serial 1 ca870010b5df0e00
    ecap 0001[fb4] = AER 1 0 fatal 0 non-fatal 1 corrected
    ecap 0004[138] = Power Budgeting 1
    ecap 0019[10c] = PCIe Sec 1 lane errors 0
    ecap 0002[148] = VC 1 max VC1 lowpri VC0-VC1
    ecap 0012[e00] = Multicast 1
    ecap 000d[f24] = ACS 1
    ecap 000b[b70] = Vendor [1] ID 0001 Rev 0 Length 16

ahci0@pci0:6:0:0:	class=0x010601 rev=0x12 hdr=0x00 vendor=0x1b4b device=0x9170 subvendor=0x1b4b subdevice=0x9170
    vendor     = 'Marvell Technology Group Ltd.'
    class      = mass storage
    subclass   = SATA
    bar   [10] = type I/O Port, range 32, base 0x1018, size 8, enabled
    bar   [14] = type I/O Port, range 32, base 0x1024, size 4, enabled
    bar   [18] = type I/O Port, range 32, base 0x1010, size 8, enabled
    bar   [1c] = type I/O Port, range 32, base 0x1020, size 4, enabled
    bar   [20] = type I/O Port, range 32, base 0x1000, size 16, enabled
    bar   [24] = type Memory, range 32, base 0x60200000, size 512, enabled
    cap 01[40] = powerspec 3  supports D0 D3  current D0
    cap 05[50] = MSI supports 1 message enabled with 1 message
    cap 10[70] = PCI-Express 2 legacy endpoint max data 128(512) RO
                 max read 512
                 link x1(x1) speed 5.0(5.0) ASPM disabled(L0s/L1)
    ecap 0001[100] = AER 1 0 fatal 0 non-fatal 0 corrected

re0@pci0:7:0:0:	class=0x020000 rev=0x0c hdr=0x00 vendor=0x10ec device=0x8168 subvendor=0x10ec subdevice=0x0123
    vendor     = 'Realtek Semiconductor Co., Ltd.'
    device     = 'RTL8111/8168/8411 PCI Express Gigabit Ethernet Controller'
    class      = network
    subclass   = ethernet
    bar   [10] = type I/O Port, range 32, base 0, size 256, enabled
    bar   [18] = type Memory, range 64, base 0x60100000, size 4096, enabled
    bar   [20] = type Prefetchable Memory, range 64, base 0x900000000, size 16384, enabled
    cap 01[40] = powerspec 3  supports D0 D1 D2 D3  current D0
    cap 05[50] = MSI supports 1 message, 64 bit 
    cap 10[70] = PCI-Express 2 endpoint MSI 1 max data 128(128) RO
                 max read 4096
                 link x1(x1) speed 2.5(2.5) ASPM disabled(L0s/L1) ClockPM disabled
    cap 11[b0] = MSI-X supports 4 messages, enabled
                 Table in map 0x20[0x0], PBA in map 0x20[0x800]
    cap 03[d0] = VPD
    ecap 0001[100] = AER 1 0 fatal 0 non-fatal 0 corrected
    ecap 0002[140] = VC 1 max VC0
    ecap 0003[160] = Serial 1 01000000684ce000
    ecap 0018[170] = LTR 1

xhci0@pci0:8:0:0:	class=0x0c0330 rev=0x02 hdr=0x00 vendor=0x104c device=0x8241 subvendor=0x0000 subdevice=0x0000
    vendor     = 'Texas Instruments'
    device     = 'TUSB73x0 SuperSpeed USB 3.0 xHCI Host Controller'
    class      = serial bus
    subclass   = USB
    bar   [10] = type Memory, range 64, base 0x60000000, size 65536, enabled
    bar   [18] = type Memory, range 64, base 0x60010000, size 8192, enabled
    cap 01[40] = powerspec 3  supports D0 D1 D2 D3  current D0
    cap 05[48] = MSI supports 8 messages, 64 bit 
    cap 10[70] = PCI-Express 2 endpoint max data 128(1024) RO
                 max read 512
                 link x1(x1) speed 5.0(5.0) ASPM disabled(L0s/L1) ClockPM disabled
    cap 11[c0] = MSI-X supports 8 messages, enabled
                 Table in map 0x18[0x0], PBA in map 0x18[0x1000]
    ecap 0001[100] = AER 2 0 fatal 0 non-fatal 0 corrected
    ecap 0003[150] = Serial 1 0800280000200000
