hostb0@pci0:0:0:0:	class=0x060000 card=0xdb8015d9 chip=0x65c08086 rev=0x90 hdr=0x00
    vendor     = 'Intel Corporation'
    device     = '5100 Chipset Memory Controller Hub'
    class      = bridge
    subclass   = HOST-PCI
    cap 01[50] = powerspec 2  supports D0 D3  current D0
    cap 05[58] = MSI supports 1 message 
    cap 10[6c] = PCI-Express 1 root port max data 128(256) NS
                 link x4(x4) speed 2.5(2.5) ASPM disabled(L0s)
    ecap 0001[100] = AER 1 0 fatal 0 non-fatal 0 corrected

pcib1@pci0:0:2:0:	class=0x060400 card=0x00000000 chip=0x65f78086 rev=0x90 hdr=0x01
    vendor     = 'Intel Corporation'
    device     = '5100 Chipset PCI Express x8 Port 2-3'
    class      = bridge
    subclass   = PCI-PCI
    cap 01[50] = powerspec 2  supports D0 D3  current D0
    cap 05[58] = MSI supports 1 message 
    cap 10[6c] = PCI-Express 1 root port max data 128(256) NS
                 link x4(x8) speed 2.5(2.5) ASPM disabled(L0s)
                 slot 46 power limit 25000 mW
    ecap 0001[100] = AER 1 0 fatal 0 non-fatal 0 corrected

pcib2@pci0:0:3:0:	class=0x060400 card=0x00000000 chip=0x65e38086 rev=0x90 hdr=0x01
    vendor     = 'Intel Corporation'
    device     = '5100 Chipset PCI Express x4 Port 3'
    class      = bridge
    subclass   = PCI-PCI
    cap 01[50] = powerspec 2  supports D0 D3  current D0
    cap 05[58] = MSI supports 1 message 
    cap 10[6c] = PCI-Express 1 root port max data 128(256) NS
                 link x0(x4) speed 0.0(2.5) ASPM disabled(L0s)
                 slot 0 power limit 0 mW
    ecap 0001[100] = AER 1 0 fatal 0 non-fatal 0 corrected

pcib3@pci0:0:4:0:	class=0x060400 card=0x00000000 chip=0x65f88086 rev=0x90 hdr=0x01
    vendor     = 'Intel Corporation'
    device     = '5100 Chipset PCI Express x8 Port 4-5'
    class      = bridge
    subclass   = PCI-PCI
    cap 01[50] = powerspec 2  supports D0 D3  current D0
    cap 05[58] = MSI supports 1 message 
    cap 10[6c] = PCI-Express 1 root port max data 128(256) NS
                 link x8(x8) speed 2.5(2.5) ASPM disabled(L0s)
                 slot 48 power limit 25000 mW HotPlug(present) Attn Button PC(on) MRL(open)
    ecap 0001[100] = AER 1 0 fatal 0 non-fatal 1 corrected

pcib7@pci0:0:5:0:	class=0x060400 card=0x00000000 chip=0x65e58086 rev=0x90 hdr=0x01
    vendor     = 'Intel Corporation'
    device     = '5100 Chipset PCI Express x4 Port 5'
    class      = bridge
    subclass   = PCI-PCI
    cap 01[50] = powerspec 2  supports D0 D3  current D0
    cap 05[58] = MSI supports 1 message 
    cap 10[6c] = PCI-Express 1 root port max data 128(256) NS
                 link x0(x4) speed 0.0(2.5) ASPM disabled(L0s)
                 slot 0 power limit 0 mW
    ecap 0001[100] = AER 1 0 fatal 0 non-fatal 0 corrected

pcib8@pci0:0:6:0:	class=0x060400 card=0x00000000 chip=0x65f98086 rev=0x90 hdr=0x01
    vendor     = 'Intel Corporation'
    device     = '5100 Chipset PCI Express x8 Port 6-7'
    class      = bridge
    subclass   = PCI-PCI
    cap 01[50] = powerspec 2  supports D0 D3  current D0
    cap 05[58] = MSI supports 1 message enabled with 1 message
    cap 10[6c] = PCI-Express 1 root port max data 128(256) NS
                 link x4(x8) speed 2.5(2.5) ASPM disabled(L0s)
                 slot 50 power limit 25000 mW HotPlug(empty) Attn Button PC(off) MRL(open)
    ecap 0001[100] = AER 1 0 fatal 0 non-fatal 0 corrected

pcib9@pci0:0:7:0:	class=0x060400 card=0x00000000 chip=0x65e78086 rev=0x90 hdr=0x01
    vendor     = 'Intel Corporation'
    device     = '5100 Chipset PCI Express x4 Port 7'
    class      = bridge
    subclass   = PCI-PCI
    cap 01[50] = powerspec 2  supports D0 D3  current D0
    cap 05[58] = MSI supports 1 message 
    cap 10[6c] = PCI-Express 1 root port max data 128(256) NS
                 link x0(x4) speed 0.0(2.5) ASPM disabled(L0s)
                 slot 0 power limit 0 mW
    ecap 0001[100] = AER 1 0 fatal 0 non-fatal 0 corrected

none0@pci0:0:8:0:	class=0x088000 card=0xdb8015d9 chip=0x65ff8086 rev=0x90 hdr=0x00
    vendor     = 'Intel Corporation'
    device     = '5100 Chipset DMA Engine'
    class      = base peripheral
    bar   [10] = type Memory, range 64, base 0xfe700000, size 1024, enabled
    cap 01[50] = powerspec 2  supports D0 D3  current D0
    cap 05[58] = MSI supports 1 message 
    cap 10[6c] = PCI-Express 1 root endpoint max data 128(128) NS

hostb1@pci0:0:16:0:	class=0x060000 card=0xdb8015d9 chip=0x65f08086 rev=0x90 hdr=0x00
    vendor     = 'Intel Corporation'
    device     = '5100 Chipset FSB Registers'
    class      = bridge
    subclass   = HOST-PCI

hostb2@pci0:0:16:1:	class=0x060000 card=0xdb8015d9 chip=0x65f08086 rev=0x90 hdr=0x00
    vendor     = 'Intel Corporation'
    device     = '5100 Chipset FSB Registers'
    class      = bridge
    subclass   = HOST-PCI

hostb3@pci0:0:16:2:	class=0x060000 card=0xdb8015d9 chip=0x65f08086 rev=0x90 hdr=0x00
    vendor     = 'Intel Corporation'
    device     = '5100 Chipset FSB Registers'
    class      = bridge
    subclass   = HOST-PCI

hostb4@pci0:0:17:0:	class=0x060000 card=0xdb8015d9 chip=0x65f18086 rev=0x90 hdr=0x00
    vendor     = 'Intel Corporation'
    device     = '5100 Chipset Reserved Registers'
    class      = bridge
    subclass   = HOST-PCI

hostb5@pci0:0:19:0:	class=0x060000 card=0xdb8015d9 chip=0x65f38086 rev=0x90 hdr=0x00
    vendor     = 'Intel Corporation'
    device     = '5100 Chipset Reserved Registers'
    class      = bridge
    subclass   = HOST-PCI

hostb6@pci0:0:21:0:	class=0x060000 card=0xdb8015d9 chip=0x65f58086 rev=0x90 hdr=0x00
    vendor     = 'Intel Corporation'
    device     = '5100 Chipset DDR Channel 0 Registers'
    class      = bridge
    subclass   = HOST-PCI

hostb7@pci0:0:22:0:	class=0x060000 card=0xdb8015d9 chip=0x65f68086 rev=0x90 hdr=0x00
    vendor     = 'Intel Corporation'
    device     = '5100 Chipset DDR Channel 1 Registers'
    class      = bridge
    subclass   = HOST-PCI

uhci0@pci0:0:26:0:	class=0x0c0300 card=0xdb8015d9 chip=0x29378086 rev=0x02 hdr=0x00
    vendor     = 'Intel Corporation'
    device     = '82801I (ICH9 Family) USB UHCI Controller'
    class      = serial bus
    subclass   = USB
    bar   [20] = type I/O Port, range 32, base 0x1820, size 32, enabled
    cap 13[50] = PCI Advanced Features: FLR TP

ehci0@pci0:0:26:7:	class=0x0c0320 card=0xdb8015d9 chip=0x293c8086 rev=0x02 hdr=0x00
    vendor     = 'Intel Corporation'
    device     = '82801I (ICH9 Family) USB2 EHCI Controller'
    class      = serial bus
    subclass   = USB
    bar   [10] = type Memory, range 32, base 0xf8800800, size 1024, enabled
    cap 01[50] = powerspec 2  supports D0 D3  current D0
    cap 0a[58] = EHCI Debug Port at offset 0xa0 in map 0x14
    cap 13[98] = PCI Advanced Features: FLR TP

pcib10@pci0:0:28:0:	class=0x060400 card=0xdb8015d9 chip=0x29408086 rev=0x02 hdr=0x01
    vendor     = 'Intel Corporation'
    device     = '82801I (ICH9 Family) PCI Express Port 1'
    class      = bridge
    subclass   = PCI-PCI
    cap 10[40] = PCI-Express 1 root port max data 128(128)
                 link x4(x4) speed 2.5(2.5) ASPM disabled(L0s/L1)
                 slot 1 power limit 25000 mW HotPlug(present) surprise
    cap 05[80] = MSI supports 1 message enabled with 1 message
    cap 0d[90] = PCI Bridge card=0xdb8015d9
    cap 01[a0] = powerspec 2  supports D0 D3  current D0
    ecap 0002[100] = VC 1 max VC0
    ecap 0005[180] = Root Complex Link Declaration 1

pcib11@pci0:0:28:4:	class=0x060400 card=0xdb8015d9 chip=0x29488086 rev=0x02 hdr=0x01
    vendor     = 'Intel Corporation'
    device     = '82801I (ICH9 Family) PCI Express Port 5'
    class      = bridge
    subclass   = PCI-PCI
    cap 10[40] = PCI-Express 1 root port max data 128(128)
                 link x1(x1) speed 2.5(2.5) ASPM disabled(L0s/L1)
                 slot 5 power limit 10000 mW HotPlug(present) surprise
    cap 05[80] = MSI supports 1 message enabled with 1 message
    cap 0d[90] = PCI Bridge card=0xdb8015d9
    cap 01[a0] = powerspec 2  supports D0 D3  current D0
    ecap 0002[100] = VC 1 max VC0
    ecap 0005[180] = Root Complex Link Declaration 1

uhci1@pci0:0:29:0:	class=0x0c0300 card=0xdb8015d9 chip=0x29348086 rev=0x02 hdr=0x00
    vendor     = 'Intel Corporation'
    device     = '82801I (ICH9 Family) USB UHCI Controller'
    class      = serial bus
    subclass   = USB
    bar   [20] = type I/O Port, range 32, base 0x1840, size 32, enabled
    cap 13[50] = PCI Advanced Features: FLR TP

uhci2@pci0:0:29:1:	class=0x0c0300 card=0xdb8015d9 chip=0x29358086 rev=0x02 hdr=0x00
    vendor     = 'Intel Corporation'
    device     = '82801I (ICH9 Family) USB UHCI Controller'
    class      = serial bus
    subclass   = USB
    bar   [20] = type I/O Port, range 32, base 0x1860, size 32, enabled
    cap 13[50] = PCI Advanced Features: FLR TP

uhci3@pci0:0:29:2:	class=0x0c0300 card=0xdb8015d9 chip=0x29368086 rev=0x02 hdr=0x00
    vendor     = 'Intel Corporation'
    device     = '82801I (ICH9 Family) USB UHCI Controller'
    class      = serial bus
    subclass   = USB
    bar   [20] = type I/O Port, range 32, base 0x1880, size 32, enabled
    cap 13[50] = PCI Advanced Features: FLR TP

ehci1@pci0:0:29:7:	class=0x0c0320 card=0xdb8015d9 chip=0x293a8086 rev=0x02 hdr=0x00
    vendor     = 'Intel Corporation'
    device     = '82801I (ICH9 Family) USB2 EHCI Controller'
    class      = serial bus
    subclass   = USB
    bar   [10] = type Memory, range 32, base 0xf8800c00, size 1024, enabled
    cap 01[50] = powerspec 2  supports D0 D3  current D0
    cap 0a[58] = EHCI Debug Port at offset 0xa0 in map 0x14
    cap 13[98] = PCI Advanced Features: FLR TP

pcib12@pci0:0:30:0:	class=0x060401 card=0xdb8015d9 chip=0x244e8086 rev=0x92 hdr=0x01
    vendor     = 'Intel Corporation'
    device     = '82801 PCI Bridge'
    class      = bridge
    subclass   = PCI-PCI
    cap 0d[50] = PCI Bridge card=0xdb8015d9

isab0@pci0:0:31:0:	class=0x060100 card=0xdb8015d9 chip=0x29168086 rev=0x02 hdr=0x00
    vendor     = 'Intel Corporation'
    device     = '82801IR (ICH9R) LPC Interface Controller'
    class      = bridge
    subclass   = PCI-ISA
    cap 09[e0] = vendor (length 12) Intel cap 1 version 0
		 features: SATA RAID-5, 4 PCI-e x1 slots

ahci0@pci0:0:31:2:	class=0x010601 card=0xdb8015d9 chip=0x29228086 rev=0x02 hdr=0x00
    vendor     = 'Intel Corporation'
    device     = '82801IR/IO/IH (ICH9R/DO/DH) 6 port SATA Controller [AHCI mode]'
    class      = mass storage
    subclass   = SATA
    bar   [10] = type I/O Port, range 32, base 0x1c10, size 8, enabled
    bar   [14] = type I/O Port, range 32, base 0x1c04, size 4, enabled
    bar   [18] = type I/O Port, range 32, base 0x1c08, size 8, enabled
    bar   [1c] = type I/O Port, range 32, base 0x1c00, size 4, enabled
    bar   [20] = type I/O Port, range 32, base 0x18a0, size 32, enabled
    bar   [24] = type Memory, range 32, base 0xf8800000, size 2048, enabled
    cap 05[80] = MSI supports 16 messages enabled with 16 messages
    cap 01[70] = powerspec 3  supports D0 D3  current D0
    cap 12[a8] = SATA Index-Data Pair
    cap 13[b0] = PCI Advanced Features: FLR TP

none1@pci0:0:31:3:	class=0x0c0500 card=0xdb8015d9 chip=0x29308086 rev=0x02 hdr=0x00
    vendor     = 'Intel Corporation'
    device     = '82801I (ICH9 Family) SMBus Controller'
    class      = serial bus
    subclass   = SMBus
    bar   [10] = type Memory, range 64, base 0xf8801000, size 256, enabled
    bar   [20] = type I/O Port, range 32, base 0x1100, size 32, enabled

none2@pci0:1:0:0:	class=0x100000 card=0x0001177d chip=0x0010177d rev=0x01 hdr=0x00
    vendor     = 'Cavium, Inc.'
    device     = 'Nitrox XL NPX'
    class      = encrypt/decrypt
    subclass   = network/computer crypto
    bar   [10] = type Prefetchable Memory, range 64, base 0xf8000000, size 4096, enabled
    cap 01[40] = powerspec 3  supports D0 D3  current D0
    cap 05[50] = MSI supports 1 message, 64 bit 
    cap 10[70] = PCI-Express 1 endpoint max data 128(256) RO NS
                 link x4(x4) speed 2.5(2.5) ASPM disabled(L0s/L1)
    ecap 0001[100] = AER 1 0 fatal 0 non-fatal 0 corrected

pcib4@pci0:3:0:0:	class=0x060400 card=0x00000000 chip=0x851810b5 rev=0xac hdr=0x01
    vendor     = 'PLX Technology, Inc.'
    device     = 'PEX 8518 16-lane, 5-port PCI Express Switch'
    class      = bridge
    subclass   = PCI-PCI
    bar   [10] = type Memory, range 32, base 0xf8100000, size 131072, enabled
    cap 01[40] = powerspec 3  supports D0 D3  current D0
    cap 05[48] = MSI supports 1 message, 64 bit 
    cap 10[68] = PCI-Express 1 upstream port max data 128(256)
                 link x8(x8) speed 2.5(2.5) ASPM disabled(L0s/L1)
    ecap 0003[100] = Serial 1 0000000100000edf
    ecap 0001[fb4] = AER 1 0 fatal 1 non-fatal 0 corrected
    ecap 0004[138] = Power Budgeting 1
    ecap 0002[148] = VC 1 max VC1

pcib5@pci0:4:1:0:	class=0x060400 card=0x00000000 chip=0x851810b5 rev=0xac hdr=0x01
    vendor     = 'PLX Technology, Inc.'
    device     = 'PEX 8518 16-lane, 5-port PCI Express Switch'
    class      = bridge
    subclass   = PCI-PCI
    cap 01[40] = powerspec 3  supports D0 D3  current D0
    cap 05[48] = MSI supports 1 message, 64 bit enabled with 1 message
    cap 10[68] = PCI-Express 1 downstream port max data 128(256)
                 link x4(x4) speed 2.5(2.5) ASPM disabled(L0s/L1)
                 slot 0 power limit 25000 mW HotPlug(present) Attn Button PC(on) MRL(closed)
    ecap 0003[100] = Serial 1 0000000100000edf
    ecap 0001[fb4] = AER 1 0 fatal 1 non-fatal 0 corrected
    ecap 0004[138] = Power Budgeting 1
    ecap 0002[148] = VC 1 max VC1

pcib6@pci0:4:2:0:	class=0x060400 card=0x00000000 chip=0x851810b5 rev=0xac hdr=0x01
    vendor     = 'PLX Technology, Inc.'
    device     = 'PEX 8518 16-lane, 5-port PCI Express Switch'
    class      = bridge
    subclass   = PCI-PCI
    cap 01[40] = powerspec 3  supports D0 D3  current D0
    cap 05[48] = MSI supports 1 message, 64 bit enabled with 1 message
    cap 10[68] = PCI-Express 1 downstream port max data 128(256)
                 link x4(x4) speed 2.5(2.5) ASPM disabled(L0s/L1)
                 slot 0 power limit 25000 mW HotPlug(present) Attn Button PC(on) MRL(closed)
    ecap 0003[100] = Serial 1 0000000100000edf
    ecap 0001[fb4] = AER 1 0 fatal 1 non-fatal 0 corrected
    ecap 0004[138] = Power Budgeting 1
    ecap 0002[148] = VC 1 max VC1

igb0@pci0:5:0:0:	class=0x020000 card=0x10c98086 chip=0x10c98086 rev=0x01 hdr=0x00
    vendor     = 'Intel Corporation'
    device     = '82576 Gigabit Network Connection'
    class      = network
    subclass   = ethernet
    bar   [10] = type Memory, range 32, base 0xf8220000, size 131072, enabled
    bar   [14] = type Memory, range 32, base 0xf8200000, size 131072, enabled
    bar   [18] = type I/O Port, range 32, base 0x2000, size 32, enabled
    bar   [1c] = type Memory, range 32, base 0xf8280000, size 16384, enabled
    cap 01[40] = powerspec 3  supports D0 D3  current D0
    cap 05[50] = MSI supports 1 message, 64 bit, vector masks 
    cap 11[70] = MSI-X supports 10 messages, enabled
                 Table in map 0x1c[0x0], PBA in map 0x1c[0x2000]
    cap 10[a0] = PCI-Express 2 endpoint max data 128(512) FLR RO NS
                 link x4(x4) speed 2.5(2.5) ASPM disabled(L0s/L1)
    ecap 0001[100] = AER 1 0 fatal 0 non-fatal 1 corrected
    ecap 0003[140] = Serial 1 00e0edffff1f14ee
    ecap 000e[150] = ARI 1
    ecap 0010[160] = SR-IOV 1 IOV disabled, Memory Space disabled, ARI disabled
                     0 VFs configured out of 8 supported
                     First VF RID Offset 0x0180, VF RID Stride 0x0002
                     VF Device ID 0x10ca
                     Page Sizes: 4096 (enabled), 8192, 65536, 262144, 1048576, 4194304

igb1@pci0:5:0:1:	class=0x020000 card=0x10c98086 chip=0x10c98086 rev=0x01 hdr=0x00
    vendor     = 'Intel Corporation'
    device     = '82576 Gigabit Network Connection'
    class      = network
    subclass   = ethernet
    bar   [10] = type Memory, range 32, base 0xf8260000, size 131072, enabled
    bar   [14] = type Memory, range 32, base 0xf8240000, size 131072, enabled
    bar   [18] = type I/O Port, range 32, base 0x2020, size 32, enabled
    bar   [1c] = type Memory, range 32, base 0xf8284000, size 16384, enabled
    cap 01[40] = powerspec 3  supports D0 D3  current D0
    cap 05[50] = MSI supports 1 message, 64 bit, vector masks 
    cap 11[70] = MSI-X supports 10 messages, enabled
                 Table in map 0x1c[0x0], PBA in map 0x1c[0x2000]
    cap 10[a0] = PCI-Express 2 endpoint max data 128(512) FLR RO NS
                 link x4(x4) speed 2.5(2.5) ASPM disabled(L0s/L1)
    ecap 0001[100] = AER 1 0 fatal 0 non-fatal 1 corrected
    ecap 0003[140] = Serial 1 00e0edffff1f14ee
    ecap 000e[150] = ARI 1
    ecap 0010[160] = SR-IOV 1 IOV disabled, Memory Space disabled, ARI disabled
                     0 VFs configured out of 8 supported
                     First VF RID Offset 0x0180, VF RID Stride 0x0002
                     VF Device ID 0x10ca
                     Page Sizes: 4096 (enabled), 8192, 65536, 262144, 1048576, 4194304

igb2@pci0:6:0:0:	class=0x020000 card=0x10c98086 chip=0x10c98086 rev=0x01 hdr=0x00
    vendor     = 'Intel Corporation'
    device     = '82576 Gigabit Network Connection'
    class      = network
    subclass   = ethernet
    bar   [10] = type Memory, range 32, base 0xf8340000, size 131072, enabled
    bar   [14] = type Memory, range 32, base 0xf8320000, size 131072, enabled
    bar   [18] = type I/O Port, range 32, base 0x3000, size 32, enabled
    bar   [1c] = type Memory, range 32, base 0xf8300000, size 16384, enabled
    cap 01[40] = powerspec 3  supports D0 D3  current D0
    cap 05[50] = MSI supports 1 message, 64 bit, vector masks 
    cap 11[70] = MSI-X supports 10 messages, enabled
                 Table in map 0x1c[0x0], PBA in map 0x1c[0x2000]
    cap 10[a0] = PCI-Express 2 endpoint max data 128(512) FLR RO NS
                 link x4(x4) speed 2.5(2.5) ASPM disabled(L0s/L1)
    ecap 0001[100] = AER 1 0 fatal 0 non-fatal 1 corrected
    ecap 0003[140] = Serial 1 00e0edffff1f14f0
    ecap 000e[150] = ARI 1
    ecap 0010[160] = SR-IOV 1 IOV disabled, Memory Space disabled, ARI disabled
                     0 VFs configured out of 8 supported
                     First VF RID Offset 0x0180, VF RID Stride 0x0002
                     VF Device ID 0x10ca
                     Page Sizes: 4096 (enabled), 8192, 65536, 262144, 1048576, 4194304

igb3@pci0:6:0:1:	class=0x020000 card=0x10c98086 chip=0x10c98086 rev=0x01 hdr=0x00
    vendor     = 'Intel Corporation'
    device     = '82576 Gigabit Network Connection'
    class      = network
    subclass   = ethernet
    bar   [10] = type Memory, range 32, base 0xf8380000, size 131072, enabled
    bar   [14] = type Memory, range 32, base 0xf8360000, size 131072, enabled
    bar   [18] = type I/O Port, range 32, base 0x3020, size 32, enabled
    bar   [1c] = type Memory, range 32, base 0xf8304000, size 16384, enabled
    cap 01[40] = powerspec 3  supports D0 D3  current D0
    cap 05[50] = MSI supports 1 message, 64 bit, vector masks 
    cap 11[70] = MSI-X supports 10 messages, enabled
                 Table in map 0x1c[0x0], PBA in map 0x1c[0x2000]
    cap 10[a0] = PCI-Express 2 endpoint max data 128(512) FLR RO NS
                 link x4(x4) speed 2.5(2.5) ASPM disabled(L0s/L1)
    ecap 0001[100] = AER 1 0 fatal 0 non-fatal 1 corrected
    ecap 0003[140] = Serial 1 00e0edffff1f14f0
    ecap 000e[150] = ARI 1
    ecap 0010[160] = SR-IOV 1 IOV disabled, Memory Space disabled, ARI disabled
                     0 VFs configured out of 8 supported
                     First VF RID Offset 0x0180, VF RID Stride 0x0002
                     VF Device ID 0x10ca
                     Page Sizes: 4096 (enabled), 8192, 65536, 262144, 1048576, 4194304

igb4@pci0:10:0:0:	class=0x020000 card=0x10a715d9 chip=0x10a78086 rev=0x02 hdr=0x00
    vendor     = 'Intel Corporation'
    device     = '82575EB Gigabit Network Connection'
    class      = network
    subclass   = ethernet
    bar   [10] = type Memory, range 32, base 0xf8420000, size 131072, enabled
    bar   [14] = type Memory, range 32, base 0xf8400000, size 131072, enabled
    bar   [18] = type I/O Port, range 32, base 0x4000, size 32, enabled
    bar   [1c] = type Memory, range 32, base 0xf8480000, size 16384, enabled
    cap 01[40] = powerspec 2  supports D0 D3  current D0
    cap 05[50] = MSI supports 1 message, 64 bit 
    cap 11[60] = MSI-X supports 10 messages, enabled
                 Table in map 0x1c[0x0], PBA in map 0x1c[0x2000]
    cap 10[a0] = PCI-Express 2 endpoint max data 128(256) RO NS
                 link x4(x4) speed 2.5(2.5) ASPM disabled(L0s/L1)
    ecap 0001[100] = AER 1 0 fatal 1 non-fatal 1 corrected
    ecap 0003[140] = Serial 1 002590ffff27d470

igb5@pci0:10:0:1:	class=0x020000 card=0x10a715d9 chip=0x10a78086 rev=0x02 hdr=0x00
    vendor     = 'Intel Corporation'
    device     = '82575EB Gigabit Network Connection'
    class      = network
    subclass   = ethernet
    bar   [10] = type Memory, range 32, base 0xf8460000, size 131072, enabled
    bar   [14] = type Memory, range 32, base 0xf8440000, size 131072, enabled
    bar   [18] = type I/O Port, range 32, base 0x4020, size 32, enabled
    bar   [1c] = type Memory, range 32, base 0xf8484000, size 16384, enabled
    cap 01[40] = powerspec 2  supports D0 D3  current D0
    cap 05[50] = MSI supports 1 message, 64 bit 
    cap 11[60] = MSI-X supports 10 messages, enabled
                 Table in map 0x1c[0x0], PBA in map 0x1c[0x2000]
    cap 10[a0] = PCI-Express 2 endpoint max data 128(256) RO NS
                 link x4(x4) speed 2.5(2.5) ASPM disabled(L0s/L1)
    ecap 0001[100] = AER 1 0 fatal 1 non-fatal 1 corrected
    ecap 0003[140] = Serial 1 002590ffff27d470

atapci0@pci0:11:0:0:	class=0x010185 card=0x2368197b chip=0x2368197b rev=0x00 hdr=0x00
    vendor     = 'JMicron Technology Corp.'
    device     = 'JMB368 IDE controller'
    class      = mass storage
    subclass   = ATA
    bar   [10] = type I/O Port, range 32, base 0x5018, size 8, enabled
    bar   [14] = type I/O Port, range 32, base 0x5010, size 4, enabled
    bar   [18] = type I/O Port, range 32, base 0, size 8, enabled
    bar   [1c] = type I/O Port, range 32, base 0, size 4, enabled
    bar   [20] = type I/O Port, range 32, base 0x5000, size 16, enabled
    cap 01[68] = powerspec 2  supports D0 D3  current D0
    cap 10[50] = PCI-Express 1 legacy endpoint MSI 1 max data 128(128)
                 link x1(x1) speed 2.5(2.5) ASPM disabled(L0s)

vgapci0@pci0:12:1:0:	class=0x030000 card=0xdb8015d9 chip=0x515e1002 rev=0x02 hdr=0x00
    vendor     = 'Advanced Micro Devices, Inc. [AMD/ATI]'
    device     = 'ES1000'
    class      = display
    subclass   = VGA
    bar   [10] = type Prefetchable Memory, range 32, base 0xf0000000, size 134217728, enabled
    bar   [14] = type I/O Port, range 32, base 0x6000, size 256, enabled
    bar   [18] = type Memory, range 32, base 0xf8500000, size 65536, enabled
    cap 01[50] = powerspec 2  supports D0 D1 D2 D3  current D0
