hostb0@pci0:0:0:0:	class=0x060000 rev=0x03 hdr=0x00 vendor=0x8086 device=0x27ac subvendor=0x1462 subdevice=0x0110
    vendor     = 'Intel Corporation'
    device     = 'Mobile 945GSE Express Memory Controller Hub'
    class      = bridge
    subclass   = HOST-PCI
    cap 09[e0] = vendor (length 9) Intel cap 7 version 1

vgapci0@pci0:0:2:0:	class=0x030000 rev=0x03 hdr=0x00 vendor=0x8086 device=0x27ae subvendor=0x1462 subdevice=0x0110
    vendor     = 'Intel Corporation'
    device     = 'Mobile 945GSE Express Integrated Graphics Controller'
    class      = display
    subclass   = VGA
    bar   [10] = type Memory, range 32, base 0xdfe80000, size 524288, enabled
    bar   [14] = type I/O Port, range 32, base 0xd0f0, size 8, enabled
    bar   [18] = type Prefetchable Memory, range 32, base 0xc0000000, size 268435456, enabled
    bar   [1c] = type Memory, range 32, base 0xdff00000, size 262144, enabled
    cap 05[90] = MSI supports 1 message 
    cap 01[d0] = powerspec 2  supports D0 D3  current D0

vgapci1@pci0:0:2:1:	class=0x038000 rev=0x03 hdr=0x00 vendor=0x8086 device=0x27a6 subvendor=0x1462 subdevice=0x0110
    vendor     = 'Intel Corporation'
    device     = 'Mobile 945GM/GMS/GME, 943/940GML Express Integrated Graphics Controller'
    class      = display
    bar   [10] = type Memory, range 32, base 0xdfe00000, size 524288, enabled
    cap 01[d0] = powerspec 2  supports D0 D3  current D0

hdac0@pci0:0:27:0:	class=0x040300 rev=0x02 hdr=0x00 vendor=0x8086 device=0x27d8 subvendor=0x1462 subdevice=0x0110
    vendor     = 'Intel Corporation'
    device     = 'NM10/ICH7 Family High Definition Audio Controller'
    class      = multimedia
    subclass   = HDA
    bar   [10] = type Memory, range 64, base 0xffe00000, size 16384, enabled
    cap 01[50] = powerspec 2  supports D0 D3  current D0
    cap 05[60] = MSI supports 1 message, 64 bit enabled with 1 message
    cap 10[70] = PCI-Express 1 root endpoint max data 128(128) NS
                 max read 128
    ecap 0002[100] = VC 1 max VC1
    ecap 0005[130] = Root Complex Link Declaration 1

pcib1@pci0:0:28:0:	class=0x060400 rev=0x02 hdr=0x01 vendor=0x8086 device=0x27d0 subvendor=0x0000 subdevice=0x0000
    vendor     = 'Intel Corporation'
    device     = 'NM10/ICH7 Family PCI Express Port 1'
    class      = bridge
    subclass   = PCI-PCI
    cap 10[40] = PCI-Express 1 root port max data 128(128)
                 max read 128
                 link x1(x1) speed 2.5(2.5) ASPM disabled(L0s/L1)
                 slot 0 power limit 0 mW HotPlug(present) surprise
    cap 05[80] = MSI supports 1 message enabled with 1 message
    cap 0d[90] = PCI Bridge subvendor=0x0000 subdevice=0x0000
    cap 01[a0] = powerspec 2  supports D0 D3  current D0
    ecap 0002[100] = VC 1 max VC1
    ecap 0005[180] = Root Complex Link Declaration 1

pcib2@pci0:0:28:1:	class=0x060400 rev=0x02 hdr=0x01 vendor=0x8086 device=0x27d2 subvendor=0x0000 subdevice=0x0000
    vendor     = 'Intel Corporation'
    device     = 'NM10/ICH7 Family PCI Express Port 2'
    class      = bridge
    subclass   = PCI-PCI
    cap 10[40] = PCI-Express 1 root port max data 128(128)
                 max read 128
                 link x1(x1) speed 2.5(2.5) ASPM disabled(L0s/L1)
                 slot 0 power limit 0 mW HotPlug(present) surprise
    cap 05[80] = MSI supports 1 message enabled with 1 message
    cap 0d[90] = PCI Bridge subvendor=0x0000 subdevice=0x0000
    cap 01[a0] = powerspec 2  supports D0 D3  current D0
    ecap 0002[100] = VC 1 max VC1
    ecap 0005[180] = Root Complex Link Declaration 1

uhci0@pci0:0:29:0:	class=0x0c0300 rev=0x02 hdr=0x00 vendor=0x8086 device=0x27c8 subvendor=0x1462 subdevice=0x0110
    vendor     = 'Intel Corporation'
    device     = 'NM10/ICH7 Family USB UHCI Controller'
    class      = serial bus
    subclass   = USB
    bar   [20] = type I/O Port, range 32, base 0xd080, size 32, enabled

uhci1@pci0:0:29:1:	class=0x0c0300 rev=0x02 hdr=0x00 vendor=0x8086 device=0x27c9 subvendor=0x1462 subdevice=0x0110
    vendor     = 'Intel Corporation'
    device     = 'NM10/ICH7 Family USB UHCI Controller'
    class      = serial bus
    subclass   = USB
    bar   [20] = type I/O Port, range 32, base 0xd060, size 32, enabled

uhci2@pci0:0:29:2:	class=0x0c0300 rev=0x02 hdr=0x00 vendor=0x8086 device=0x27ca subvendor=0x1462 subdevice=0x0110
    vendor     = 'Intel Corporation'
    device     = 'NM10/ICH7 Family USB UHCI Controller'
    class      = serial bus
    subclass   = USB
    bar   [20] = type I/O Port, range 32, base 0xd040, size 32, enabled

uhci3@pci0:0:29:3:	class=0x0c0300 rev=0x02 hdr=0x00 vendor=0x8086 device=0x27cb subvendor=0x1462 subdevice=0x0110
    vendor     = 'Intel Corporation'
    device     = 'NM10/ICH7 Family USB UHCI Controller'
    class      = serial bus
    subclass   = USB
    bar   [20] = type I/O Port, range 32, base 0xd020, size 32, enabled

ehci0@pci0:0:29:7:	class=0x0c0320 rev=0x02 hdr=0x00 vendor=0x8086 device=0x27cc subvendor=0x1462 subdevice=0x0110
    vendor     = 'Intel Corporation'
    device     = 'NM10/ICH7 Family USB2 EHCI Controller'
    class      = serial bus
    subclass   = USB
    bar   [10] = type Memory, range 32, base 0xdff40000, size 1024, enabled
    cap 01[50] = powerspec 2  supports D0 D3  current D0
    cap 0a[58] = EHCI Debug Port at offset 0xa0 in map 0x14

pcib3@pci0:0:30:0:	class=0x060401 rev=0xe2 hdr=0x01 vendor=0x8086 device=0x2448 subvendor=0x8086 subdevice=0x2448
    vendor     = 'Intel Corporation'
    device     = '82801 Mobile PCI Bridge'
    class      = bridge
    subclass   = PCI-PCI
    cap 0d[50] = PCI Bridge subvendor=0x8086 subdevice=0x2448

isab0@pci0:0:31:0:	class=0x060100 rev=0x02 hdr=0x00 vendor=0x8086 device=0x27b9 subvendor=0x1462 subdevice=0x0110
    vendor     = 'Intel Corporation'
    device     = '82801GBM (ICH7-M) LPC Interface Bridge'
    class      = bridge
    subclass   = PCI-ISA
    cap 09[e0] = vendor (length 12) Intel cap 1 version 0
		 features: Quick Resume, SATA RAID-5, Mobile, 6 PCI-e x1 slots, SATA RAID-0/1/10

atapci0@pci0:0:31:2:	class=0x010180 rev=0x02 hdr=0x00 vendor=0x8086 device=0x27c4 subvendor=0x1462 subdevice=0x0110
    vendor     = 'Intel Corporation'
    device     = '82801GBM/GHM (ICH7-M Family) SATA Controller [IDE mode]'
    class      = mass storage
    subclass   = ATA
    bar   [20] = type I/O Port, range 32, base 0xd0a0, size 16, enabled
    cap 01[70] = powerspec 2  supports D0 D3  current D0

re0@pci0:1:0:0:	class=0x020000 rev=0x02 hdr=0x00 vendor=0x10ec device=0x8136 subvendor=0x1462 subdevice=0x0110
    vendor     = 'Realtek Semiconductor Co., Ltd.'
    device     = 'RTL810xE PCI Express Fast Ethernet controller'
    class      = network
    subclass   = ethernet
    bar   [10] = type I/O Port, range 32, base 0xc000, size 256, enabled
    bar   [18] = type Prefetchable Memory, range 64, base 0xffd10000, size 4096, enabled
    bar   [20] = type Prefetchable Memory, range 64, base 0xffd00000, size 65536, enabled
    cap 01[40] = powerspec 3  supports D0 D1 D2 D3  current D0
    cap 05[50] = MSI supports 1 message, 64 bit 
    cap 10[70] = PCI-Express 2 endpoint MSI 1 max data 128(256)
                 max read 128
                 link x1(x1) speed 2.5(2.5) ASPM disabled(L0s/L1) ClockPM disabled
    cap 11[ac] = MSI-X supports 2 messages, enabled
                 Table in map 0x20[0x0], PBA in map 0x20[0x800]
    cap 03[cc] = VPD
    ecap 0001[100] = AER 1 0 fatal 0 non-fatal 1 corrected
    ecap 0002[140] = VC 1 max VC0
    ecap 0003[160] = Serial 1 00000000ffff0000

none0@pci0:2:0:0:	class=0x028000 rev=0x22 hdr=0x00 vendor=0x10ec device=0x8199 subvendor=0x1462 subdevice=0x6894
    vendor     = 'Realtek Semiconductor Co., Ltd.'
    device     = 'RTL8187SE Wireless LAN Controller'
    class      = network
    bar   [10] = type I/O Port, range 32, base 0xb000, size 256, enabled
    bar   [14] = type Memory, range 32, base 0xdfc00000, size 16384, enabled
    cap 01[40] = powerspec 3  supports D0 D1 D2 D3  current D0
    cap 05[50] = MSI supports 1 message, 64 bit 
    cap 10[70] = PCI-Express 1 legacy endpoint max data 128(256)
                 max read 128
                 link x1(x1) speed 2.5(2.5) ASPM disabled(L0s/L1) ClockPM disabled
    ecap 0001[100] = AER 1 0 fatal 0 non-fatal 0 corrected
    ecap 0002[140] = VC 1 max VC0
    ecap 0003[160] = Serial 1 0000788cc9921d00
