hostb0@pci0:0:0:0:	class=0x060000 card=0x19998086 chip=0x0bf38086 rev=0x04 hdr=0x00
    vendor     = 'Intel Corporation'
    device     = 'Atom Processor D2xxx/N2xxx DRAM Controller'
    class      = bridge
    subclass   = HOST-PCI

vgapci0@pci0:0:2:0:	class=0x030000 card=0x19998086 chip=0x0be28086 rev=0x0b hdr=0x00
    vendor     = 'Intel Corporation'
    device     = 'Atom Processor D2xxx/N2xxx Integrated Graphics Controller'
    class      = display
    subclass   = VGA
    bar   [10] = type Memory, range 32, base 0xfe600000, size 1048576, enabled
    bar   [14] = type I/O Port, range 32, base 0xf100, size 8, enabled
    cap 01[d0] = powerspec 2  supports D0 D3  current D0
    cap 09[b0] = vendor (length 7) Intel cap 0 version 1
    cap 05[90] = MSI supports 1 message 

em0@pci0:0:25:0:	class=0x020000 card=0x00008086 chip=0x10cc8086 rev=0x00 hdr=0x00
    vendor     = 'Intel Corporation'
    device     = '82567LM-2 Gigabit Network Connection'
    class      = network
    subclass   = ethernet
    bar   [10] = type Memory, range 32, base 0xfeb00000, size 131072, enabled
    bar   [14] = type Memory, range 32, base 0xfeb27000, size 4096, enabled
    bar   [18] = type I/O Port, range 32, base 0xf0a0, size 32, enabled
    cap 01[c8] = powerspec 2  supports D0 D3  current D0
    cap 05[d0] = MSI supports 1 message, 64 bit enabled with 1 message
    cap 13[e0] = PCI Advanced Features: FLR TP

uhci0@pci0:0:26:0:	class=0x0c0300 card=0x3a378086 chip=0x3a378086 rev=0x00 hdr=0x00
    vendor     = 'Intel Corporation'
    device     = '82801JI (ICH10 Family) USB UHCI Controller'
    class      = serial bus
    subclass   = USB
    bar   [20] = type I/O Port, range 32, base 0xf080, size 32, enabled
    cap 13[50] = PCI Advanced Features: FLR TP

ehci0@pci0:0:26:7:	class=0x0c0320 card=0x3a3c8086 chip=0x3a3c8086 rev=0x00 hdr=0x00
    vendor     = 'Intel Corporation'
    device     = '82801JI (ICH10 Family) USB2 EHCI Controller'
    class      = serial bus
    subclass   = USB
    bar   [10] = type Memory, range 32, base 0xfeb26000, size 1024, enabled
    cap 01[50] = powerspec 2  supports D0 D3  current D0
    cap 0a[58] = EHCI Debug Port at offset 0xa0 in map 0x14
    cap 13[98] = PCI Advanced Features: FLR TP

hdac0@pci0:0:27:0:	class=0x040300 card=0x3a3e8086 chip=0x3a3e8086 rev=0x00 hdr=0x00
    vendor     = 'Intel Corporation'
    device     = '82801JI (ICH10 Family) HD Audio Controller'
    class      = multimedia
    subclass   = HDA
    bar   [10] = type Memory, range 64, base 0xfeb20000, size 16384, enabled
    cap 01[50] = powerspec 2  supports D0 D3  current D0
    cap 05[60] = MSI supports 1 message, 64 bit enabled with 1 message
    cap 10[70] = PCI-Express 1 root endpoint max data 128(128) FLR NS
    ecap 0002[100] = VC 1 max VC1
    ecap 0005[130] = Root Complex Link Declaration 1

pcib1@pci0:0:28:0:	class=0x060400 card=0x3a408086 chip=0x3a408086 rev=0x00 hdr=0x01
    vendor     = 'Intel Corporation'
    device     = '82801JI (ICH10 Family) PCI Express Root Port 1'
    class      = bridge
    subclass   = PCI-PCI
    cap 10[40] = PCI-Express 1 root port max data 128(128)
                 link x1(x1) speed 2.5(2.5) ASPM disabled(L0s/L1)
                 slot 0 power limit 0 mW HotPlug(present) surprise
    cap 05[80] = MSI supports 1 message 
    cap 0d[90] = PCI Bridge card=0x3a408086
    cap 01[a0] = powerspec 2  supports D0 D3  current D0
    ecap 0002[100] = VC 1 max VC0
    ecap 0005[180] = Root Complex Link Declaration 1

pcib2@pci0:0:28:1:	class=0x060400 card=0x3a428086 chip=0x3a428086 rev=0x00 hdr=0x01
    vendor     = 'Intel Corporation'
    device     = '82801JI (ICH10 Family) PCI Express Port 2'
    class      = bridge
    subclass   = PCI-PCI
    cap 10[40] = PCI-Express 1 root port max data 128(128)
                 link x1(x1) speed 2.5(2.5) ASPM disabled(L0s/L1)
                 slot 0 power limit 0 mW HotPlug(present) surprise
    cap 05[80] = MSI supports 1 message 
    cap 0d[90] = PCI Bridge card=0x3a428086
    cap 01[a0] = powerspec 2  supports D0 D3  current D0
    ecap 0002[100] = VC 1 max VC0
    ecap 0005[180] = Root Complex Link Declaration 1

pcib3@pci0:0:28:2:	class=0x060400 card=0x3a448086 chip=0x3a448086 rev=0x00 hdr=0x01
    vendor     = 'Intel Corporation'
    device     = '82801JI (ICH10 Family) PCI Express Root Port 3'
    class      = bridge
    subclass   = PCI-PCI
    cap 10[40] = PCI-Express 1 root port max data 128(128)
                 link x1(x1) speed 2.5(2.5) ASPM disabled(L0s/L1)
                 slot 0 power limit 0 mW HotPlug(present) surprise
    cap 05[80] = MSI supports 1 message 
    cap 0d[90] = PCI Bridge card=0x3a448086
    cap 01[a0] = powerspec 2  supports D0 D3  current D0
    ecap 0002[100] = VC 1 max VC0
    ecap 0005[180] = Root Complex Link Declaration 1

pcib4@pci0:0:28:3:	class=0x060400 card=0x3a468086 chip=0x3a468086 rev=0x00 hdr=0x01
    vendor     = 'Intel Corporation'
    device     = '82801JI (ICH10 Family) PCI Express Root Port 4'
    class      = bridge
    subclass   = PCI-PCI
    cap 10[40] = PCI-Express 1 root port max data 128(128)
                 link x1(x1) speed 2.5(2.5) ASPM disabled(L0s/L1)
                 slot 0 power limit 0 mW HotPlug(present) surprise
    cap 05[80] = MSI supports 1 message 
    cap 0d[90] = PCI Bridge card=0x3a468086
    cap 01[a0] = powerspec 2  supports D0 D3  current D0
    ecap 0002[100] = VC 1 max VC0
    ecap 0005[180] = Root Complex Link Declaration 1

pcib8@pci0:0:28:4:	class=0x060400 card=0x3a488086 chip=0x3a488086 rev=0x00 hdr=0x01
    vendor     = 'Intel Corporation'
    device     = '82801JI (ICH10 Family) PCI Express Root Port 5'
    class      = bridge
    subclass   = PCI-PCI
    cap 10[40] = PCI-Express 1 root port max data 128(128)
                 link x1(x1) speed 2.5(2.5) ASPM disabled(L0s/L1)
                 slot 0 power limit 0 mW HotPlug(present) surprise
    cap 05[80] = MSI supports 1 message 
    cap 0d[90] = PCI Bridge card=0x3a488086
    cap 01[a0] = powerspec 2  supports D0 D3  current D0
    ecap 0002[100] = VC 1 max VC0
    ecap 0005[180] = Root Complex Link Declaration 1

uhci1@pci0:0:29:0:	class=0x0c0300 card=0x3a348086 chip=0x3a348086 rev=0x00 hdr=0x00
    vendor     = 'Intel Corporation'
    device     = '82801JI (ICH10 Family) USB UHCI Controller'
    class      = serial bus
    subclass   = USB
    bar   [20] = type I/O Port, range 32, base 0xf060, size 32, enabled
    cap 13[50] = PCI Advanced Features: FLR TP

uhci2@pci0:0:29:1:	class=0x0c0300 card=0x3a358086 chip=0x3a358086 rev=0x00 hdr=0x00
    vendor     = 'Intel Corporation'
    device     = '82801JI (ICH10 Family) USB UHCI Controller'
    class      = serial bus
    subclass   = USB
    bar   [20] = type I/O Port, range 32, base 0xf040, size 32, enabled
    cap 13[50] = PCI Advanced Features: FLR TP

uhci3@pci0:0:29:2:	class=0x0c0300 card=0x3a368086 chip=0x3a368086 rev=0x00 hdr=0x00
    vendor     = 'Intel Corporation'
    device     = '82801JI (ICH10 Family) USB UHCI Controller'
    class      = serial bus
    subclass   = USB
    bar   [20] = type I/O Port, range 32, base 0xf020, size 32, enabled
    cap 13[50] = PCI Advanced Features: FLR TP

ehci1@pci0:0:29:7:	class=0x0c0320 card=0x3a3a8086 chip=0x3a3a8086 rev=0x00 hdr=0x00
    vendor     = 'Intel Corporation'
    device     = '82801JI (ICH10 Family) USB2 EHCI Controller'
    class      = serial bus
    subclass   = USB
    bar   [10] = type Memory, range 32, base 0xfeb25000, size 1024, enabled
    cap 01[50] = powerspec 2  supports D0 D3  current D0
    cap 0a[58] = EHCI Debug Port at offset 0xa0 in map 0x14
    cap 13[98] = PCI Advanced Features: FLR TP

pcib9@pci0:0:30:0:	class=0x060401 card=0x244e8086 chip=0x244e8086 rev=0x90 hdr=0x01
    vendor     = 'Intel Corporation'
    device     = '82801 PCI Bridge'
    class      = bridge
    subclass   = PCI-PCI
    cap 0d[50] = PCI Bridge card=0x244e8086

isab0@pci0:0:31:0:	class=0x060100 card=0x3a168086 chip=0x3a168086 rev=0x00 hdr=0x00
    vendor     = 'Intel Corporation'
    device     = '82801JIR (ICH10R) LPC Interface Controller'
    class      = bridge
    subclass   = PCI-ISA
    cap 09[e0] = vendor (length 12) Intel cap 1 version 0
		 features: SATA RAID-5, 4 PCI-e x1 slots

ahci0@pci0:0:31:2:	class=0x010601 card=0x3a208086 chip=0x3a228086 rev=0x00 hdr=0x00
    vendor     = 'Intel Corporation'
    device     = '82801JI (ICH10 Family) SATA AHCI Controller'
    class      = mass storage
    subclass   = SATA
    bar   [10] = type I/O Port, range 32, base 0xf0f0, size 8, enabled
    bar   [14] = type I/O Port, range 32, base 0xf0e0, size 4, enabled
    bar   [18] = type I/O Port, range 32, base 0xf0d0, size 8, enabled
    bar   [1c] = type I/O Port, range 32, base 0xf0c0, size 4, enabled
    bar   [20] = type I/O Port, range 32, base 0xf000, size 32, enabled
    bar   [24] = type Memory, range 32, base 0xfeb24000, size 2048, enabled
    cap 05[80] = MSI supports 16 messages enabled with 16 messages
    cap 01[70] = powerspec 3  supports D0 D3  current D0
    cap 12[a8] = SATA Index-Data Pair
    cap 13[b0] = PCI Advanced Features: FLR TP

none0@pci0:0:31:3:	class=0x0c0500 card=0x3a308086 chip=0x3a308086 rev=0x00 hdr=0x00
    vendor     = 'Intel Corporation'
    device     = '82801JI (ICH10 Family) SMBus Controller'
    class      = serial bus
    subclass   = SMBus
    bar   [10] = type Memory, range 64, base 0, size 256, disabled
    bar   [20] = type I/O Port, range 32, base 0x1180, size 32, enabled

em1@pci0:1:0:0:	class=0x020000 card=0x00008086 chip=0x10d38086 rev=0x00 hdr=0x00
    vendor     = 'Intel Corporation'
    device     = '82574L Gigabit Network Connection'
    class      = network
    subclass   = ethernet
    bar   [10] = type Memory, range 32, base 0xfea00000, size 131072, enabled
    bar   [18] = type I/O Port, range 32, base 0xe000, size 32, enabled
    bar   [1c] = type Memory, range 32, base 0xfea20000, size 16384, enabled
    cap 01[c8] = powerspec 2  supports D0 D3  current D0
    cap 05[d0] = MSI supports 1 message, 64 bit 
    cap 10[e0] = PCI-Express 1 endpoint max data 128(256) NS
                 link x1(x1) speed 2.5(2.5) ASPM disabled(L0s/L1)
    cap 11[a0] = MSI-X supports 5 messages, enabled
                 Table in map 0x1c[0x0], PBA in map 0x1c[0x2000]
    ecap 0001[100] = AER 1 0 fatal 0 non-fatal 1 corrected
    ecap 0003[140] = Serial 1 7072cfffff962e15

em2@pci0:2:0:0:	class=0x020000 card=0x00008086 chip=0x10d38086 rev=0x00 hdr=0x00
    vendor     = 'Intel Corporation'
    device     = '82574L Gigabit Network Connection'
    class      = network
    subclass   = ethernet
    bar   [10] = type Memory, range 32, base 0xfe900000, size 131072, enabled
    bar   [18] = type I/O Port, range 32, base 0xd000, size 32, enabled
    bar   [1c] = type Memory, range 32, base 0xfe920000, size 16384, enabled
    cap 01[c8] = powerspec 2  supports D0 D3  current D0
    cap 05[d0] = MSI supports 1 message, 64 bit 
    cap 10[e0] = PCI-Express 1 endpoint max data 128(256) NS
                 link x1(x1) speed 2.5(2.5) ASPM disabled(L0s/L1)
    cap 11[a0] = MSI-X supports 5 messages, enabled
                 Table in map 0x1c[0x0], PBA in map 0x1c[0x2000]
    ecap 0001[100] = AER 1 0 fatal 0 non-fatal 1 corrected
    ecap 0003[140] = Serial 1 7072cfffff962e16

em3@pci0:3:0:0:	class=0x020000 card=0x00008086 chip=0x10d38086 rev=0x00 hdr=0x00
    vendor     = 'Intel Corporation'
    device     = '82574L Gigabit Network Connection'
    class      = network
    subclass   = ethernet
    bar   [10] = type Memory, range 32, base 0xfe800000, size 131072, enabled
    bar   [18] = type I/O Port, range 32, base 0xc000, size 32, enabled
    bar   [1c] = type Memory, range 32, base 0xfe820000, size 16384, enabled
    cap 01[c8] = powerspec 2  supports D0 D3  current D0
    cap 05[d0] = MSI supports 1 message, 64 bit 
    cap 10[e0] = PCI-Express 1 endpoint max data 128(256) NS
                 link x1(x1) speed 2.5(2.5) ASPM disabled(L0s/L1)
    cap 11[a0] = MSI-X supports 5 messages, enabled
                 Table in map 0x1c[0x0], PBA in map 0x1c[0x2000]
    ecap 0001[100] = AER 1 0 fatal 0 non-fatal 1 corrected
    ecap 0003[140] = Serial 1 7072cfffff962e17

pcib5@pci0:4:0:0:	class=0x060400 card=0x860310b5 chip=0x860310b5 rev=0xab hdr=0x01
    vendor     = 'PLX Technology, Inc.'
    device     = 'PEX 8603 3-lane, 3-Port PCI Express Gen 2 (5.0 GT/s) Switch'
    class      = bridge
    subclass   = PCI-PCI
    bar   [10] = type Memory, range 32, base 0xfe500000, size 16384, enabled
    cap 01[40] = powerspec 3  supports D0 D1 D2 D3  current D0
    cap 05[48] = MSI supports 4 messages, 64 bit, vector masks 
    cap 10[68] = PCI-Express 2 upstream port max data 128(256) NS
                 link x1(x1) speed 2.5(5.0) ASPM disabled(L0s/L1)
    cap 0d[a4] = PCI Bridge card=0x860310b5
    ecap 0003[100] = Serial 1 ab860210b5df0e00
    ecap 0001[fb4] = AER 1 0 fatal 0 non-fatal 1 corrected
    ecap 0004[138] = Power Budgeting 1
    ecap 0002[148] = VC 1 max VC0
    ecap 000b[950] = Vendor 1 ID 1

pcib6@pci0:5:1:0:	class=0x060400 card=0x860310b5 chip=0x860310b5 rev=0xab hdr=0x01
    vendor     = 'PLX Technology, Inc.'
    device     = 'PEX 8603 3-lane, 3-Port PCI Express Gen 2 (5.0 GT/s) Switch'
    class      = bridge
    subclass   = PCI-PCI
    cap 01[40] = powerspec 3  supports D0 D1 D2 D3  current D0
    cap 05[48] = MSI supports 4 messages, 64 bit, vector masks 
    cap 10[68] = PCI-Express 2 downstream port max data 128(256) NS ARI disabled
                 link x1(x1) speed 2.5(5.0) ASPM disabled(L0s/L1)
                 slot 1 power limit 25000 mW HotPlug(present)
    cap 0d[a4] = PCI Bridge card=0x860310b5
    ecap 0003[100] = Serial 1 ab860210b5df0e00
    ecap 0001[fb4] = AER 1 0 fatal 0 non-fatal 1 corrected
    ecap 0002[148] = VC 1 max VC0
    ecap 000d[520] = ACS 1
    ecap 000b[950] = Vendor 1 ID 1

pcib7@pci0:5:2:0:	class=0x060400 card=0x860310b5 chip=0x860310b5 rev=0xab hdr=0x01
    vendor     = 'PLX Technology, Inc.'
    device     = 'PEX 8603 3-lane, 3-Port PCI Express Gen 2 (5.0 GT/s) Switch'
    class      = bridge
    subclass   = PCI-PCI
    cap 01[40] = powerspec 3  supports D0 D1 D2 D3  current D0
    cap 05[48] = MSI supports 4 messages, 64 bit, vector masks 
    cap 10[68] = PCI-Express 2 downstream port max data 128(256) NS ARI disabled
                 link x1(x1) speed 2.5(5.0) ASPM disabled(L0s/L1)
                 slot 2 power limit 25000 mW
    cap 0d[a4] = PCI Bridge card=0x860310b5
    ecap 0003[100] = Serial 1 ab860210b5df0e00
    ecap 0001[fb4] = AER 1 0 fatal 0 non-fatal 1 corrected
    ecap 0002[148] = VC 1 max VC0
    ecap 000d[520] = ACS 1
    ecap 000b[950] = Vendor 1 ID 1

none1@pci0:6:0:0:	class=0x028000 card=0x3363168c chip=0x003e168c rev=0x32 hdr=0x00
    vendor     = 'Qualcomm Atheros'
    device     = 'QCA6174 802.11ac Wireless Network Adapter'
    class      = network
    bar   [10] = type Memory, range 64, base 0xfe200000, size 2097152, enabled
    cap 01[40] = powerspec 3  supports D0 D3  current D0
    cap 05[50] = MSI supports 8 messages, vector masks 
    cap 10[70] = PCI-Express 2 endpoint max data 128(256)
                 link x1(x1) speed 2.5(2.5) ASPM disabled(L0s/L1)
    ecap 0001[100] = AER 2 0 fatal 0 non-fatal 0 corrected
    ecap 0002[148] = VC 1 max VC0
    ecap 0003[168] = Serial 1 0000000000000000
    ecap 0018[178] = LTR 1
    ecap 001e[180] = unknown 1

em4@pci0:7:0:0:	class=0x020000 card=0x00008086 chip=0x10d38086 rev=0x00 hdr=0x00
    vendor     = 'Intel Corporation'
    device     = '82574L Gigabit Network Connection'
    class      = network
    subclass   = ethernet
    bar   [10] = type Memory, range 32, base 0xfe400000, size 131072, enabled
    bar   [18] = type I/O Port, range 32, base 0xb000, size 32, enabled
    bar   [1c] = type Memory, range 32, base 0xfe420000, size 16384, enabled
    cap 01[c8] = powerspec 2  supports D0 D3  current D0
    cap 05[d0] = MSI supports 1 message, 64 bit 
    cap 10[e0] = PCI-Express 1 endpoint max data 128(256) NS
                 link x1(x1) speed 2.5(2.5) ASPM disabled(L0s/L1)
    cap 11[a0] = MSI-X supports 5 messages, enabled
                 Table in map 0x1c[0x0], PBA in map 0x1c[0x2000]
    ecap 0001[100] = AER 1 0 fatal 0 non-fatal 1 corrected
    ecap 0003[140] = Serial 1 7072cfffff962e18

em5@pci0:8:0:0:	class=0x020000 card=0x00008086 chip=0x10d38086 rev=0x00 hdr=0x00
    vendor     = 'Intel Corporation'
    device     = '82574L Gigabit Network Connection'
    class      = network
    subclass   = ethernet
    bar   [10] = type Memory, range 32, base 0xfe700000, size 131072, enabled
    bar   [18] = type I/O Port, range 32, base 0xa000, size 32, enabled
    bar   [1c] = type Memory, range 32, base 0xfe720000, size 16384, enabled
    cap 01[c8] = powerspec 2  supports D0 D3  current D0
    cap 05[d0] = MSI supports 1 message, 64 bit 
    cap 10[e0] = PCI-Express 1 endpoint max data 128(256) NS
                 link x1(x1) speed 2.5(2.5) ASPM disabled(L0s/L1)
    cap 11[a0] = MSI-X supports 5 messages, enabled
                 Table in map 0x1c[0x0], PBA in map 0x1c[0x2000]
    ecap 0001[100] = AER 1 0 fatal 0 non-fatal 1 corrected
    ecap 0003[140] = Serial 1 7072cfffff962e19
