hostb0@pci0:0:0:0:	class=0x060000 rev=0x02 hdr=0x00 vendor=0x8086 device=0x1f02 subvendor=0x0000 subdevice=0x0000
    vendor     = 'Intel Corporation'
    device     = 'Atom processor C2000 SoC Transaction Router'
    class      = bridge
    subclass   = HOST-PCI

pcib1@pci0:0:1:0:	class=0x060400 rev=0x02 hdr=0x01 vendor=0x8086 device=0x1f10 subvendor=0x1043 subdevice=0x8646
    vendor     = 'Intel Corporation'
    device     = 'Atom processor C2000 PCIe Root Port 1'
    class      = bridge
    subclass   = PCI-PCI
    bar   [10] = type Memory, range 64, base 0xde200000, size 131072, enabled
    cap 10[40] = PCI-Express 2 root port max data 128(256) ARI disabled
                 max read 128
                 link x1(x4) speed 2.5(5.0) ASPM disabled(L1)
                 slot 0 power limit 250 mW
    cap 01[80] = powerspec 3  supports D0 D3  current D0
    cap 0d[88] = PCI Bridge subvendor=0x1043 subdevice=0x8646
    cap 05[90] = MSI supports 1 message, vector masks 
    ecap 0001[100] = AER 1 0 fatal 0 non-fatal 0 corrected

pcib3@pci0:0:2:0:	class=0x060400 rev=0x02 hdr=0x01 vendor=0x8086 device=0x1f11 subvendor=0x1043 subdevice=0x8646
    vendor     = 'Intel Corporation'
    device     = 'Atom processor C2000 PCIe Root Port 2'
    class      = bridge
    subclass   = PCI-PCI
    bar   [10] = type Memory, range 64, base 0xde220000, size 131072, enabled
    cap 10[40] = PCI-Express 2 root port max data 256(256) ARI disabled
                 max read 128
                 link x1(x4) speed 5.0(5.0) ASPM disabled(L1)
                 slot 1 power limit 250 mW
    cap 01[80] = powerspec 3  supports D0 D3  current D0
    cap 0d[88] = PCI Bridge subvendor=0x1043 subdevice=0x8646
    cap 05[90] = MSI supports 1 message, vector masks 
    ecap 0001[100] = AER 1 0 fatal 0 non-fatal 0 corrected

pcib4@pci0:0:3:0:	class=0x060400 rev=0x02 hdr=0x01 vendor=0x8086 device=0x1f12 subvendor=0x1043 subdevice=0x8646
    vendor     = 'Intel Corporation'
    device     = 'Atom processor C2000 PCIe Root Port 3'
    class      = bridge
    subclass   = PCI-PCI
    bar   [10] = type Memory, range 64, base 0xde240000, size 131072, enabled
    cap 10[40] = PCI-Express 2 root port max data 128(256) ARI disabled
                 max read 128
                 link x0(x4) speed 0.0(5.0) ASPM disabled(L1)
                 slot 2 power limit 250 mW
    cap 01[80] = powerspec 3  supports D0 D3  current D0
    cap 0d[88] = PCI Bridge subvendor=0x1043 subdevice=0x8646
    cap 05[90] = MSI supports 1 message, vector masks 
    ecap 0001[100] = AER 1 0 fatal 0 non-fatal 0 corrected

pcib5@pci0:0:4:0:	class=0x060400 rev=0x02 hdr=0x01 vendor=0x8086 device=0x1f13 subvendor=0x8086 subdevice=0x8086
    vendor     = 'Intel Corporation'
    device     = 'Atom processor C2000 PCIe Root Port 4'
    class      = bridge
    subclass   = PCI-PCI
    bar   [10] = type Memory, range 64, base 0xde260000, size 131072, enabled
    cap 10[40] = PCI-Express 2 root port max data 128(256) ARI disabled
                 max read 128
                 link x0(x4) speed 0.0(5.0) ASPM disabled(L1)
                 slot 3 power limit 250 mW
    cap 01[80] = powerspec 3  supports D0 D3  current D0
    cap 0d[88] = PCI Bridge subvendor=0x8086 subdevice=0x8086
    cap 05[90] = MSI supports 1 message, vector masks 
    ecap 0001[100] = AER 1 0 fatal 0 non-fatal 0 corrected

hostb1@pci0:0:14:0:	class=0x060000 rev=0x02 hdr=0x00 vendor=0x8086 device=0x1f14 subvendor=0x8086 subdevice=0x0000
    vendor     = 'Intel Corporation'
    device     = 'Atom processor C2000 RAS'
    class      = bridge
    subclass   = HOST-PCI
    cap 10[40] = PCI-Express 2 root endpoint max data 256(256)
                 max read 128

none0@pci0:0:15:0:	class=0x080600 rev=0x02 hdr=0x00 vendor=0x8086 device=0x1f16 subvendor=0x8086 subdevice=0x0000
    vendor     = 'Intel Corporation'
    device     = 'Atom processor C2000 RCEC'
    class      = base peripheral
    subclass   = IOMMU
    cap 10[40] = PCI-Express 2 event collector max data 256(256)
                 max read 128
    cap 01[80] = powerspec 3  supports D0 D3  current D0
    cap 05[90] = MSI supports 1 message, vector masks 
    ecap 0001[100] = AER 1 0 fatal 0 non-fatal 0 corrected
    ecap 0007[150] = Root Complex Event Collector ASsociation 1

none1@pci0:0:19:0:	class=0x088000 rev=0x02 hdr=0x00 vendor=0x8086 device=0x1f15 subvendor=0x8086 subdevice=0x0000
    vendor     = 'Intel Corporation'
    device     = 'Atom processor C2000 SMBus 2.0'
    class      = base peripheral
    bar   [10] = type Memory, range 64, base 0xde310000, size 1024, enabled
    cap 10[40] = PCI-Express 2 root endpoint max data 256(256) FLR NS
                 max read 128
    cap 01[80] = powerspec 3  supports D0 D3  current D0
    cap 05[8c] = MSI supports 1 message, 64 bit, vector masks 
    ecap 0001[100] = AER 1 1 fatal 0 non-fatal 0 corrected

igb0@pci0:0:20:0:	class=0x020000 rev=0x03 hdr=0x00 vendor=0x8086 device=0x1f41 subvendor=0x1043 subdevice=0x8638
    vendor     = 'Intel Corporation'
    device     = 'Ethernet Connection I354'
    class      = network
    subclass   = ethernet
    bar   [10] = type Memory, range 64, base 0xde2e0000, size 131072, enabled
    bar   [18] = type I/O Port, range 32, base 0xe060, size 32, enabled
    bar   [20] = type Memory, range 64, base 0xde30c000, size 16384, enabled
    cap 01[40] = powerspec 3  supports D0 D3  current D0
    cap 05[50] = MSI supports 1 message, 64 bit, vector masks 
    cap 11[70] = MSI-X supports 10 messages, enabled
                 Table in map 0x20[0x0], PBA in map 0x20[0x2000]
    cap 10[a0] = PCI-Express 2 root endpoint max data 512(512) FLR NS
                 max read 512
    ecap 0001[100] = AER 2 0 fatal 0 non-fatal 0 corrected
    ecap 0003[140] = Serial 1 7824afffff829eb6
    ecap 0017[1a0] = TPH Requester 1
    ecap 000d[1d0] = ACS 1

igb1@pci0:0:20:1:	class=0x020000 rev=0x03 hdr=0x00 vendor=0x8086 device=0x1f41 subvendor=0x1043 subdevice=0x8638
    vendor     = 'Intel Corporation'
    device     = 'Ethernet Connection I354'
    class      = network
    subclass   = ethernet
    bar   [10] = type Memory, range 64, base 0xde2c0000, size 131072, enabled
    bar   [18] = type I/O Port, range 32, base 0xe040, size 32, enabled
    bar   [20] = type Memory, range 64, base 0xde308000, size 16384, enabled
    cap 01[40] = powerspec 3  supports D0 D3  current D0
    cap 05[50] = MSI supports 1 message, 64 bit, vector masks 
    cap 11[70] = MSI-X supports 10 messages, enabled
                 Table in map 0x20[0x0], PBA in map 0x20[0x2000]
    cap 10[a0] = PCI-Express 2 root endpoint max data 512(512) FLR NS
                 max read 512
    ecap 0001[100] = AER 2 0 fatal 0 non-fatal 0 corrected
    ecap 0003[140] = Serial 1 7824afffff829eb6
    ecap 0017[1a0] = TPH Requester 1
    ecap 000d[1d0] = ACS 1

igb2@pci0:0:20:2:	class=0x020000 rev=0x03 hdr=0x00 vendor=0x8086 device=0x1f41 subvendor=0x1043 subdevice=0x8638
    vendor     = 'Intel Corporation'
    device     = 'Ethernet Connection I354'
    class      = network
    subclass   = ethernet
    bar   [10] = type Memory, range 64, base 0xde2a0000, size 131072, enabled
    bar   [18] = type I/O Port, range 32, base 0xe020, size 32, enabled
    bar   [20] = type Memory, range 64, base 0xde304000, size 16384, enabled
    cap 01[40] = powerspec 3  supports D0 D3  current D0
    cap 05[50] = MSI supports 1 message, 64 bit, vector masks 
    cap 11[70] = MSI-X supports 10 messages, enabled
                 Table in map 0x20[0x0], PBA in map 0x20[0x2000]
    cap 10[a0] = PCI-Express 2 root endpoint max data 512(512) FLR NS
                 max read 512
    ecap 0001[100] = AER 2 0 fatal 0 non-fatal 0 corrected
    ecap 0003[140] = Serial 1 7824afffff829eb6
    ecap 0017[1a0] = TPH Requester 1
    ecap 000d[1d0] = ACS 1

igb3@pci0:0:20:3:	class=0x020000 rev=0x03 hdr=0x00 vendor=0x8086 device=0x1f41 subvendor=0x1043 subdevice=0x8638
    vendor     = 'Intel Corporation'
    device     = 'Ethernet Connection I354'
    class      = network
    subclass   = ethernet
    bar   [10] = type Memory, range 64, base 0xde280000, size 131072, enabled
    bar   [18] = type I/O Port, range 32, base 0xe000, size 32, enabled
    bar   [20] = type Memory, range 64, base 0xde300000, size 16384, enabled
    cap 01[40] = powerspec 3  supports D0 D3  current D0
    cap 05[50] = MSI supports 1 message, 64 bit, vector masks 
    cap 11[70] = MSI-X supports 10 messages, enabled
                 Table in map 0x20[0x0], PBA in map 0x20[0x2000]
    cap 10[a0] = PCI-Express 2 root endpoint max data 512(512) FLR NS
                 max read 512
    ecap 0001[100] = AER 2 0 fatal 0 non-fatal 0 corrected
    ecap 0003[140] = Serial 1 7824afffff829eb6
    ecap 0017[1a0] = TPH Requester 1
    ecap 000d[1d0] = ACS 1

ehci0@pci0:0:22:0:	class=0x0c0320 rev=0x02 hdr=0x00 vendor=0x8086 device=0x1f2c subvendor=0x1043 subdevice=0x8646
    vendor     = 'Intel Corporation'
    device     = 'Atom processor C2000 USB Enhanced Host Controller'
    class      = serial bus
    subclass   = USB
    bar   [10] = type Memory, range 32, base 0xde311000, size 1024, enabled
    cap 01[50] = powerspec 3  supports D0 D3  current D0
    cap 0a[58] = EHCI Debug Port at offset 0xa0 in map 0x14
    cap 13[98] = PCI Advanced Features: FLR TP

ahci0@pci0:0:24:0:	class=0x010601 rev=0x02 hdr=0x00 vendor=0x8086 device=0x1f32 subvendor=0x1043 subdevice=0x8646
    vendor     = 'Intel Corporation'
    device     = 'Atom processor C2000 AHCI SATA3 Controller'
    class      = mass storage
    subclass   = SATA
    bar   [10] = type I/O Port, range 32, base 0xe0f0, size 8, enabled
    bar   [14] = type I/O Port, range 32, base 0xe0e0, size 4, enabled
    bar   [18] = type I/O Port, range 32, base 0xe0d0, size 8, enabled
    bar   [1c] = type I/O Port, range 32, base 0xe0c0, size 4, enabled
    bar   [20] = type I/O Port, range 32, base 0xe080, size 32, enabled
    bar   [24] = type Memory, range 32, base 0xde312000, size 2048, enabled
    cap 05[80] = MSI supports 1 message enabled with 1 message
    cap 01[70] = powerspec 3  supports D0 D3  current D0
    cap 12[a8] = SATA Index-Data Pair

isab0@pci0:0:31:0:	class=0x060100 rev=0x02 hdr=0x00 vendor=0x8086 device=0x1f38 subvendor=0x1043 subdevice=0x8646
    vendor     = 'Intel Corporation'
    device     = 'Atom processor C2000 PCU'
    class      = bridge
    subclass   = PCI-ISA
    cap 09[e0] = vendor (length 12) Intel cap 1 version 0
		 features: 4 PCI-e x1 slots

ichsmb0@pci0:0:31:3:	class=0x0c0500 rev=0x02 hdr=0x00 vendor=0x8086 device=0x1f3c subvendor=0x1043 subdevice=0x8646
    vendor     = 'Intel Corporation'
    device     = 'Atom processor C2000 PCU SMBus'
    class      = serial bus
    subclass   = SMBus
    bar   [10] = type Memory, range 32, base 0xde313000, size 32, enabled
    bar   [20] = type I/O Port, range 32, base 0xe0a0, size 32, enabled

pcib2@pci0:4:0:0:	class=0x060400 rev=0x02 hdr=0x01 vendor=0x1a03 device=0x1150 subvendor=0x1a03 subdevice=0x1150
    vendor     = 'ASPEED Technology, Inc.'
    device     = 'AST1150 PCI-to-PCI Bridge'
    class      = bridge
    subclass   = PCI-PCI
    cap 05[50] = MSI supports 1 message, 64 bit 
    cap 01[78] = powerspec 3  supports D0 D1 D2 D3  current D0
    cap 10[80] = PCI-Express 1 PCI bridge max data 128(128) NS
                 max read 512
                 link x1(x1) speed 2.5(2.5) ASPM disabled(L0s/L1)
    cap 0d[a4] = PCI Bridge subvendor=0x1a03 subdevice=0x1150
    ecap 0002[100] = VC 1 max VC0

vgapci0@pci0:5:0:0:	class=0x030000 rev=0x21 hdr=0x00 vendor=0x1a03 device=0x2000 subvendor=0x1043 subdevice=0x84eb
    vendor     = 'ASPEED Technology, Inc.'
    device     = 'ASPEED Graphics Family'
    class      = display
    subclass   = VGA
    bar   [10] = type Memory, range 32, base 0xdc000000, size 33554432, enabled
    bar   [14] = type Memory, range 32, base 0xde000000, size 131072, enabled
    bar   [18] = type I/O Port, range 32, base 0xd000, size 128, enabled
    cap 01[40] = powerspec 3  supports D0 D1 D2 D3  current D0

bge0@pci0:3:0:0:	class=0x020000 rev=0x00 hdr=0x00 vendor=0x14e4 device=0x165f subvendor=0x14e4 subdevice=0x2009
    vendor     = 'Broadcom Inc. and subsidiaries'
    device     = 'NetXtreme BCM5720 Gigabit Ethernet PCIe'
    class      = network
    subclass   = ethernet
    bar   [10] = type Prefetchable Memory, range 64, base 0xdff50000, size 65536, enabled
    bar   [18] = type Prefetchable Memory, range 64, base 0xdff40000, size 65536, enabled
    bar   [20] = type Prefetchable Memory, range 64, base 0xdff30000, size 65536, enabled
    cap 01[48] = powerspec 3  supports D0 D3  current D0
    cap 03[50] = VPD
    cap 05[58] = MSI supports 8 messages, 64 bit enabled with 1 message
    cap 11[a0] = MSI-X supports 17 messages
                 Table in map 0x20[0x0], PBA in map 0x20[0x1000]
    cap 10[ac] = PCI-Express 2 endpoint max data 256(256) FLR
                 max read 2048
                 link x1(x2) speed 5.0(5.0) ASPM disabled(L0s/L1) ClockPM disabled
    ecap 0001[100] = AER 1 0 fatal 0 non-fatal 1 corrected
    ecap 0003[13c] = Serial 1 0000e43d1ab0784e
    ecap 0004[150] = Power Budgeting 1
    ecap 0002[160] = VC 1 max VC0

bge1@pci0:3:0:1:	class=0x020000 rev=0x00 hdr=0x00 vendor=0x14e4 device=0x165f subvendor=0x14e4 subdevice=0x2009
    vendor     = 'Broadcom Inc. and subsidiaries'
    device     = 'NetXtreme BCM5720 Gigabit Ethernet PCIe'
    class      = network
    subclass   = ethernet
    bar   [10] = type Prefetchable Memory, range 64, base 0xdff20000, size 65536, enabled
    bar   [18] = type Prefetchable Memory, range 64, base 0xdff10000, size 65536, enabled
    bar   [20] = type Prefetchable Memory, range 64, base 0xdff00000, size 65536, enabled
    cap 01[48] = powerspec 3  supports D0 D3  current D0
    cap 03[50] = VPD
    cap 05[58] = MSI supports 8 messages, 64 bit enabled with 1 message
    cap 11[a0] = MSI-X supports 17 messages
                 Table in map 0x20[0x0], PBA in map 0x20[0x1000]
    cap 10[ac] = PCI-Express 2 endpoint max data 256(256) FLR
                 max read 2048
                 link x1(x2) speed 5.0(5.0) ASPM disabled(L0s/L1) ClockPM disabled
    ecap 0001[100] = AER 1 0 fatal 0 non-fatal 1 corrected
    ecap 0003[13c] = Serial 1 0000e43d1ab0784f
    ecap 0004[150] = Power Budgeting 1
    ecap 0002[160] = VC 1 max VC0
