hostb0@pci0:0:0:0:	class=0x060000 rev=0x09 hdr=0x00 vendor=0x8086 device=0x3590 subvendor=0x1028 subdevice=0x016c
    vendor     = 'Intel Corporation'
    device     = 'E7520 Memory Controller Hub'
    class      = bridge
    subclass   = HOST-PCI
    cap 09[40] = vendor (length 5) Intel cap 4 version 1

pcib1@pci0:0:2:0:	class=0x060400 rev=0x09 hdr=0x01 vendor=0x8086 device=0x3595 subvendor=0x0000 subdevice=0x0000
    vendor     = 'Intel Corporation'
    device     = 'E7525/E7520/E7320 PCI Express Port A'
    class      = bridge
    subclass   = PCI-PCI
    cap 01[50] = powerspec 2  supports D0 D3  current D0
    cap 05[58] = MSI supports 2 messages 
    cap 10[64] = PCI-Express 1 root port max data 256(256)
                 max read 128
                 link x8(x8) speed 2.5(2.5) ASPM disabled(L0s)
    ecap 0001[100] = AER 1 0 fatal 0 non-fatal 0 corrected

pcib4@pci0:0:4:0:	class=0x060400 rev=0x09 hdr=0x01 vendor=0x8086 device=0x3597 subvendor=0x0000 subdevice=0x0000
    vendor     = 'Intel Corporation'
    device     = 'E7525/E7520 PCI Express Port B'
    class      = bridge
    subclass   = PCI-PCI
    cap 01[50] = powerspec 2  supports D0 D3  current D0
    cap 05[58] = MSI supports 2 messages 
    cap 10[64] = PCI-Express 1 root port max data 128(256)
                 max read 128
                 link x0(x8) speed 0.0(2.5) ASPM disabled(L0s)
    ecap 0001[100] = AER 1 0 fatal 1 non-fatal 0 corrected

pcib5@pci0:0:5:0:	class=0x060400 rev=0x09 hdr=0x01 vendor=0x8086 device=0x3598 subvendor=0x0000 subdevice=0x0000
    vendor     = 'Intel Corporation'
    device     = 'E7520 PCI Express Port B1'
    class      = bridge
    subclass   = PCI-PCI
    cap 01[50] = powerspec 2  supports D0 D3  current D0
    cap 05[58] = MSI supports 2 messages 
    cap 10[64] = PCI-Express 1 root port max data 256(256)
                 max read 128
                 link x4(x4) speed 2.5(2.5) ASPM disabled(L0s)
    ecap 0001[100] = AER 1 0 fatal 0 non-fatal 0 corrected

pcib8@pci0:0:6:0:	class=0x060400 rev=0x09 hdr=0x01 vendor=0x8086 device=0x3599 subvendor=0x0000 subdevice=0x0000
    vendor     = 'Intel Corporation'
    device     = 'E7520 PCI Express Port C'
    class      = bridge
    subclass   = PCI-PCI
    cap 01[50] = powerspec 2  supports D0 D3  current D0
    cap 05[58] = MSI supports 2 messages 
    cap 10[64] = PCI-Express 1 root port max data 128(256)
                 max read 128
                 link x0(x8) speed 0.0(2.5) ASPM disabled(L0s)
    ecap 0001[100] = AER 1 0 fatal 1 non-fatal 0 corrected

uhci0@pci0:0:29:0:	class=0x0c0300 rev=0x02 hdr=0x00 vendor=0x8086 device=0x24d2 subvendor=0x1028 subdevice=0x016c
    vendor     = 'Intel Corporation'
    device     = '82801EB/ER (ICH5/ICH5R) USB UHCI Controller'
    class      = serial bus
    subclass   = USB
    bar   [20] = type I/O Port, range 32, base 0xace0, size 32, enabled

uhci1@pci0:0:29:1:	class=0x0c0300 rev=0x02 hdr=0x00 vendor=0x8086 device=0x24d4 subvendor=0x1028 subdevice=0x016c
    vendor     = 'Intel Corporation'
    device     = '82801EB/ER (ICH5/ICH5R) USB UHCI Controller'
    class      = serial bus
    subclass   = USB
    bar   [20] = type I/O Port, range 32, base 0xacc0, size 32, enabled

uhci2@pci0:0:29:2:	class=0x0c0300 rev=0x02 hdr=0x00 vendor=0x8086 device=0x24d7 subvendor=0x1028 subdevice=0x016c
    vendor     = 'Intel Corporation'
    device     = '82801EB/ER (ICH5/ICH5R) USB UHCI Controller'
    class      = serial bus
    subclass   = USB
    bar   [20] = type I/O Port, range 32, base 0xaca0, size 32, enabled

ehci0@pci0:0:29:7:	class=0x0c0320 rev=0x02 hdr=0x00 vendor=0x8086 device=0x24dd subvendor=0x1028 subdevice=0x016c
    vendor     = 'Intel Corporation'
    device     = '82801EB/ER (ICH5/ICH5R) USB2 EHCI Controller'
    class      = serial bus
    subclass   = USB
    bar   [10] = type Memory, range 32, base 0xdff00000, size 1024, enabled
    cap 01[50] = powerspec 2  supports D0 D3  current D0
    cap 0a[58] = EHCI Debug Port at offset 0xa0 in map 0x14

pcib9@pci0:0:30:0:	class=0x060400 rev=0xc2 hdr=0x01 vendor=0x8086 device=0x244e subvendor=0x0000 subdevice=0x0000
    vendor     = 'Intel Corporation'
    device     = '82801 PCI Bridge'
    class      = bridge
    subclass   = PCI-PCI

isab0@pci0:0:31:0:	class=0x060100 rev=0x02 hdr=0x00 vendor=0x8086 device=0x24d0 subvendor=0x0000 subdevice=0x0000
    vendor     = 'Intel Corporation'
    device     = '82801EB/ER (ICH5/ICH5R) LPC Interface Bridge'
    class      = bridge
    subclass   = PCI-ISA

atapci1@pci0:0:31:1:	class=0x01018a rev=0x02 hdr=0x00 vendor=0x8086 device=0x24db subvendor=0x1028 subdevice=0x016c
    vendor     = 'Intel Corporation'
    device     = '82801EB/ER (ICH5/ICH5R) IDE Controller'
    class      = mass storage
    subclass   = ATA
    bar   [20] = type I/O Port, range 32, base 0xfc00, size 16, enabled
    bar   [24] = type Memory, range 32, base 0, size 1024, disabled

pcib2@pci0:1:0:0:	class=0x060400 rev=0x06 hdr=0x01 vendor=0x8086 device=0x0330 subvendor=0x0000 subdevice=0x0000
    vendor     = 'Intel Corporation'
    device     = '80332 [Dobson] I/O processor (A-Segment Bridge)'
    class      = bridge
    subclass   = PCI-PCI
    cap 10[44] = PCI-Express 1 PCI bridge max data 256(256)
                 max read 512
                 link x8(x8) speed 2.5(2.5) ASPM disabled(L0s)
    cap 05[5c] = MSI supports 1 message, 64 bit 
    cap 01[6c] = powerspec 2  supports D0 D3  current D0
    cap 07[d8] = PCI-X bridge 
    ecap 0001[100] = AER 1 0 fatal 1 non-fatal 0 corrected
    ecap 0004[300] = Power Budgeting 1

pcib3@pci0:1:0:2:	class=0x060400 rev=0x06 hdr=0x01 vendor=0x8086 device=0x0332 subvendor=0x0000 subdevice=0x0000
    vendor     = 'Intel Corporation'
    device     = '80332 [Dobson] I/O processor (B-Segment Bridge)'
    class      = bridge
    subclass   = PCI-PCI
    cap 10[44] = PCI-Express 1 PCI bridge max data 256(256)
                 max read 512
                 link x8(x8) speed 2.5(2.5) ASPM disabled(L0s)
    cap 05[5c] = MSI supports 1 message, 64 bit 
    cap 01[6c] = powerspec 2  supports D0 D3  current D0
    cap 07[d8] = PCI-X bridge 
    ecap 0001[100] = AER 1 0 fatal 1 non-fatal 0 corrected
    ecap 0004[300] = Power Budgeting 1

mpt0@pci0:2:5:0:	class=0x010000 rev=0x08 hdr=0x00 vendor=0x1000 device=0x0030 subvendor=0x1028 subdevice=0x016c
    vendor     = 'Broadcom / LSI'
    device     = '53c1030 PCI-X Fusion-MPT Dual Ultra320 SCSI'
    class      = mass storage
    subclass   = SCSI
    bar   [10] = type I/O Port, range 32, base 0xec00, size 256, enabled
    bar   [14] = type Memory, range 64, base 0xdfdf0000, size 65536, enabled
    bar   [1c] = type Memory, range 64, base 0xdfde0000, size 65536, enabled
    cap 01[50] = powerspec 2  supports D0 D1 D2 D3  current D0
    cap 05[58] = MSI supports 1 message, 64 bit 
    cap 07[68] = PCI-X 64-bit supports 133MHz, 2048 burst read, 8 split transactions

em0@pci0:2:12:0:	class=0x020000 rev=0x02 hdr=0x00 vendor=0x8086 device=0x1008 subvendor=0x8086 subdevice=0x1107
    vendor     = 'Intel Corporation'
    device     = '82544EI Gigabit Ethernet Controller (Copper)'
    class      = network
    subclass   = ethernet
    bar   [10] = type Memory, range 64, base 0xdfdc0000, size 131072, enabled
    bar   [18] = type Memory, range 64, base 0xdfda0000, size 131072, enabled
    bar   [20] = type I/O Port, range 32, base 0xe8e0, size 32, enabled
    cap 01[dc] = powerspec 2  supports D0 D3  current D0
    cap 07[e4] = PCI-X 64-bit supports 133MHz, 2048 burst read, 1 split transaction
    cap 05[f0] = MSI supports 1 message, 64 bit 

pcib6@pci0:5:0:0:	class=0x060400 rev=0x09 hdr=0x01 vendor=0x8086 device=0x0329 subvendor=0x0000 subdevice=0x0000
    vendor     = 'Intel Corporation'
    device     = '6700PXH PCI Express-to-PCI Bridge A'
    class      = bridge
    subclass   = PCI-PCI
    cap 10[44] = PCI-Express 1 PCI bridge max data 256(256)
                 max read 512
                 link x4(x8) speed 2.5(2.5) ASPM disabled(L0s)
    cap 05[5c] = MSI supports 1 message, 64 bit 
    cap 01[6c] = powerspec 2  supports D0 D3  current D0
    cap 07[d8] = PCI-X bridge 
    ecap 0001[100] = AER 1 0 fatal 1 non-fatal 0 corrected
    ecap 0004[300] = Power Budgeting 1

pcib7@pci0:5:0:2:	class=0x060400 rev=0x09 hdr=0x01 vendor=0x8086 device=0x032a subvendor=0x0000 subdevice=0x0000
    vendor     = 'Intel Corporation'
    device     = '6700PXH PCI Express-to-PCI Bridge B'
    class      = bridge
    subclass   = PCI-PCI
    cap 10[44] = PCI-Express 1 PCI bridge max data 256(256)
                 max read 512
                 link x4(x8) speed 2.5(2.5) ASPM disabled(L0s)
    cap 05[5c] = MSI supports 1 message, 64 bit 
    cap 01[6c] = powerspec 2  supports D0 D3  current D0
    cap 07[d8] = PCI-X bridge 
    ecap 0001[100] = AER 1 0 fatal 1 non-fatal 0 corrected
    ecap 0004[300] = Power Budgeting 1

em1@pci0:6:7:0:	class=0x020000 rev=0x05 hdr=0x00 vendor=0x8086 device=0x1076 subvendor=0x1028 subdevice=0x016d
    vendor     = 'Intel Corporation'
    device     = '82541GI Gigabit Ethernet Controller'
    class      = network
    subclass   = ethernet
    bar   [10] = type Memory, range 32, base 0xdfae0000, size 131072, enabled
    bar   [18] = type I/O Port, range 32, base 0xdcc0, size 64, enabled
    cap 01[dc] = powerspec 2  supports D0 D3  current D0
    cap 07[e4] = PCI-X supports 2048 burst read, 1 split transaction

em2@pci0:7:8:0:	class=0x020000 rev=0x05 hdr=0x00 vendor=0x8086 device=0x1076 subvendor=0x1028 subdevice=0x016d
    vendor     = 'Intel Corporation'
    device     = '82541GI Gigabit Ethernet Controller'
    class      = network
    subclass   = ethernet
    bar   [10] = type Memory, range 32, base 0xdf8e0000, size 131072, enabled
    bar   [18] = type I/O Port, range 32, base 0xccc0, size 64, enabled
    cap 01[dc] = powerspec 2  supports D0 D3  current D0
    cap 07[e4] = PCI-X supports 2048 burst read, 1 split transaction

none0@pci0:9:5:0:	class=0xff0000 rev=0x00 hdr=0x00 vendor=0x1028 device=0x0011 subvendor=0x1028 subdevice=0x0011
    vendor     = 'Dell'
    device     = 'Remote Access Card 4 Daughter Card'
    bar   [10] = type Prefetchable Memory, range 32, base 0xd7fff000, size 4096, enabled
    bar   [14] = type I/O Port, range 32, base 0xbcf8, size 8, enabled
    bar   [18] = type I/O Port, range 32, base 0xbce8, size 8, enabled
    cap 01[48] = powerspec 2  supports D0 D3  current D0

uart2@pci0:9:5:1:	class=0xff0000 rev=0x00 hdr=0x00 vendor=0x1028 device=0x0012 subvendor=0x1028 subdevice=0x0012
    vendor     = 'Dell'
    device     = 'Remote Access Card 4 Daughter Card Virtual UART'
    bar   [10] = type Memory, range 32, base 0xdf5ff000, size 4096, enabled
    bar   [14] = type I/O Port, range 32, base 0xbc80, size 64, enabled
    bar   [18] = type Prefetchable Memory, range 32, base 0xd7f00000, size 524288, enabled
    cap 01[48] = powerspec 2  supports D0 D3  current D0

none1@pci0:9:5:2:	class=0xff0000 rev=0x00 hdr=0x00 vendor=0x1028 device=0x0014 subvendor=0x1028 subdevice=0x0014
    vendor     = 'Dell'
    device     = 'Remote Access Card 4 Daughter Card SMIC interface'
    cap 01[48] = powerspec 2  supports D0 D3  current D0

atapci0@pci0:9:6:0:	class=0x010185 rev=0x02 hdr=0x00 vendor=0x1095 device=0x0680 subvendor=0x1095 subdevice=0x0680
    vendor     = 'Silicon Image, Inc.'
    device     = 'PCI0680 Ultra ATA-133 Host Controller'
    class      = mass storage
    subclass   = ATA
    bar   [10] = type I/O Port, range 32, base 0xbcf0, size 8, enabled
    bar   [14] = type I/O Port, range 32, base 0xbce4, size 4, enabled
    bar   [18] = type I/O Port, range 32, base 0xbcd8, size 8, enabled
    bar   [1c] = type I/O Port, range 32, base 0xbcd0, size 4, enabled
    bar   [20] = type I/O Port, range 32, base 0xbc70, size 16, enabled
    bar   [24] = type Memory, range 32, base 0xdf5fec00, size 256, enabled
    cap 01[60] = powerspec 2  supports D0 D1 D2 D3  current D0

vgapci0@pci0:9:13:0:	class=0x030000 rev=0x00 hdr=0x00 vendor=0x1002 device=0x5159 subvendor=0x1028 subdevice=0x016c
    vendor     = 'Advanced Micro Devices, Inc. [AMD/ATI]'
    device     = 'RV100 [Radeon 7000 / Radeon VE]'
    class      = display
    subclass   = VGA
    bar   [10] = type Prefetchable Memory, range 32, base 0xc8000000, size 134217728, enabled
    bar   [14] = type I/O Port, range 32, base 0xb800, size 256, enabled
    bar   [18] = type Memory, range 32, base 0xdf5e0000, size 65536, enabled
    cap 01[50] = powerspec 2  supports D0 D1 D2 D3  current D0
