hostb0@pci0:0:0:0:	class=0x060000 card=0x2802103c chip=0x29908086 rev=0x02 hdr=0x00
    vendor     = 'Intel Corporation'
    device     = '82Q963/Q965 Memory Controller Hub'
    class      = bridge
    subclass   = HOST-PCI
    cap 09[e0] = vendor (length 9) Intel cap 5 version 1

vgapci0@pci0:0:2:0:	class=0x030000 card=0x2802103c chip=0x29928086 rev=0x02 hdr=0x00
    vendor     = 'Intel Corporation'
    device     = '82Q963/Q965 Integrated Graphics Controller'
    class      = display
    subclass   = VGA
    bar   [10] = type Memory, range 32, base 0xf0800000, size 1048576, enabled
    bar   [18] = type Prefetchable Memory, range 64, base 0xe0000000, size 268435456, enabled
    bar   [20] = type I/O Port, range 32, base 0x2100, size 8, enabled
    cap 05[90] = MSI supports 1 message 
    cap 01[d0] = powerspec 2  supports D0 D3  current D0

none0@pci0:0:3:0:	class=0x078000 card=0x2802103c chip=0x29948086 rev=0x02 hdr=0x00
    vendor     = 'Intel Corporation'
    device     = '82Q963/Q965 HECI Controller'
    class      = simple comms
    bar   [10] = type Memory, range 64, base 0xf0925900, size 16, enabled
    cap 01[50] = powerspec 3  supports D0 D3  current D0
    cap 05[8c] = MSI supports 1 message, 64 bit 

em0@pci0:0:25:0:	class=0x020000 card=0x2800103c chip=0x104a8086 rev=0x02 hdr=0x00
    vendor     = 'Intel Corporation'
    device     = '82566DM Gigabit Network Connection'
    class      = network
    subclass   = ethernet
    bar   [10] = type Memory, range 32, base 0xf0900000, size 131072, enabled
    bar   [14] = type Memory, range 32, base 0xf0924000, size 4096, enabled
    bar   [18] = type I/O Port, range 32, base 0x2000, size 32, enabled
    cap 01[c8] = powerspec 2  supports D0 D3  current D0
    cap 05[d0] = MSI supports 1 message, 64 bit enabled with 1 message

uhci0@pci0:0:26:0:	class=0x0c0300 card=0x2802103c chip=0x28348086 rev=0x02 hdr=0x00
    vendor     = 'Intel Corporation'
    device     = '82801H (ICH8 Family) USB UHCI Controller'
    class      = serial bus
    subclass   = USB
    bar   [20] = type I/O Port, range 32, base 0x2020, size 32, enabled

uhci1@pci0:0:26:1:	class=0x0c0300 card=0x2802103c chip=0x28358086 rev=0x02 hdr=0x00
    vendor     = 'Intel Corporation'
    device     = '82801H (ICH8 Family) USB UHCI Controller'
    class      = serial bus
    subclass   = USB
    bar   [20] = type I/O Port, range 32, base 0x2040, size 32, enabled

ehci0@pci0:0:26:7:	class=0x0c0320 card=0x2802103c chip=0x283a8086 rev=0x02 hdr=0x00
    vendor     = 'Intel Corporation'
    device     = '82801H (ICH8 Family) USB2 EHCI Controller'
    class      = serial bus
    subclass   = USB
    bar   [10] = type Memory, range 32, base 0xf0925000, size 1024, enabled
    cap 01[50] = powerspec 2  supports D0 D3  current D0
    cap 0a[58] = EHCI Debug Port at offset 0xa0 in map 0x14

hdac0@pci0:0:27:0:	class=0x040300 card=0x2802103c chip=0x284b8086 rev=0x02 hdr=0x00
    vendor     = 'Intel Corporation'
    device     = '82801H (ICH8 Family) HD Audio Controller'
    class      = multimedia
    subclass   = HDA
    bar   [10] = type Memory, range 64, base 0xf0920000, size 16384, enabled
    cap 01[50] = powerspec 2  supports D0 D3  current D0
    cap 05[60] = MSI supports 1 message, 64 bit enabled with 1 message
    cap 10[70] = PCI-Express 1 root endpoint max data 128(128) NS
    ecap 0002[100] = VC 1 max VC1
    ecap 0005[130] = Root Complex Link Declaration 1

pcib1@pci0:0:28:0:	class=0x060400 card=0x2802103c chip=0x283f8086 rev=0x02 hdr=0x01
    vendor     = 'Intel Corporation'
    device     = '82801H (ICH8 Family) PCI Express Port 1'
    class      = bridge
    subclass   = PCI-PCI
    cap 10[40] = PCI-Express 1 root port max data 128(128)
                 link x0(x1) speed 0.0(2.5) ASPM disabled(L0s/L1)
                 slot 2 power limit 10000 mW HotPlug(empty) surprise
    cap 05[80] = MSI supports 1 message 
    cap 0d[90] = PCI Bridge card=0x2802103c
    cap 01[a0] = powerspec 2  supports D0 D3  current D0
    ecap 0002[100] = VC 1 max VC0
    ecap 0005[180] = Root Complex Link Declaration 1

uhci2@pci0:0:29:0:	class=0x0c0300 card=0x2802103c chip=0x28308086 rev=0x02 hdr=0x00
    vendor     = 'Intel Corporation'
    device     = '82801H (ICH8 Family) USB UHCI Controller'
    class      = serial bus
    subclass   = USB
    bar   [20] = type I/O Port, range 32, base 0x2060, size 32, enabled

uhci3@pci0:0:29:1:	class=0x0c0300 card=0x2802103c chip=0x28318086 rev=0x02 hdr=0x00
    vendor     = 'Intel Corporation'
    device     = '82801H (ICH8 Family) USB UHCI Controller'
    class      = serial bus
    subclass   = USB
    bar   [20] = type I/O Port, range 32, base 0x2080, size 32, enabled

ehci1@pci0:0:29:7:	class=0x0c0320 card=0x2802103c chip=0x28368086 rev=0x02 hdr=0x00
    vendor     = 'Intel Corporation'
    device     = '82801H (ICH8 Family) USB2 EHCI Controller'
    class      = serial bus
    subclass   = USB
    bar   [10] = type Memory, range 32, base 0xf0925400, size 1024, enabled
    cap 01[50] = powerspec 2  supports D0 D3  current D0
    cap 0a[58] = EHCI Debug Port at offset 0xa0 in map 0x14

pcib2@pci0:0:30:0:	class=0x060401 card=0x2802103c chip=0x244e8086 rev=0xf2 hdr=0x01
    vendor     = 'Intel Corporation'
    device     = '82801 PCI Bridge'
    class      = bridge
    subclass   = PCI-PCI
    cap 0d[50] = PCI Bridge card=0x2802103c

isab0@pci0:0:31:0:	class=0x060100 card=0x2802103c chip=0x28148086 rev=0x02 hdr=0x00
    vendor     = 'Intel Corporation'
    device     = '82801HO (ICH8DO) LPC Interface Controller'
    class      = bridge
    subclass   = PCI-ISA
    cap 09[e0] = vendor (length 12) Intel cap 1 version 0
		 features: 4 PCI-e x1 slots

atapci0@pci0:0:31:2:	class=0x01018a card=0x2802103c chip=0x28208086 rev=0x02 hdr=0x00
    vendor     = 'Intel Corporation'
    device     = '82801H (ICH8 Family) 4 port SATA Controller [IDE mode]'
    class      = mass storage
    subclass   = ATA
    bar   [20] = type I/O Port, range 32, base 0x20e0, size 16, enabled
    bar   [24] = type I/O Port, range 32, base 0x20f0, size 16, enabled
    cap 01[70] = powerspec 3  supports D0 D3  current D0

fxp0@pci0:7:4:0:	class=0x020000 card=0xb0d70e11 chip=0x12298086 rev=0x05 hdr=0x00
    vendor     = 'Intel Corporation'
    device     = '82557/8/9/0/1 Ethernet Pro 100'
    class      = network
    subclass   = ethernet
    bar   [10] = type Prefetchable Memory, range 32, base 0xf0c00000, size 4096, enabled
    bar   [14] = type I/O Port, range 32, base 0x1100, size 32, enabled
    bar   [18] = type Memory, range 32, base 0xf0400000, size 1048576, enabled
    cap 01[dc] = powerspec 1  supports D0 D1 D2 D3  current D0

tx0@pci0:7:9:0:	class=0x020000 card=0xa02010b8 chip=0x000510b8 rev=0x09 hdr=0x00
    vendor     = 'Standard Microsystems Corp [SMC]'
    device     = '83c170 EPIC/100 Fast Ethernet Adapter'
    class      = network
    subclass   = ethernet
    bar   [10] = type I/O Port, range 32, base 0x1000, size 256, enabled
    bar   [14] = type Memory, range 32, base 0xf0500000, size 4096, enabled
    cap 01[dc] = powerspec 1  supports D0 D1 D2 D3  current D0
