hostb0@pci0:0:0:0:	class=0x060000 card=0x5a141002 chip=0x5a141002 rev=0x02 hdr=0x00
    vendor     = 'Advanced Micro Devices, Inc. [AMD/ATI]'
    device     = 'RD9x0/RX980 Host Bridge'
    class      = bridge
    subclass   = HOST-PCI
    cap 08[f0] = HT MSI fixed address window enabled at 0xfee00000
    cap 08[c4] = HT slave
    cap 08[40] = HT retry mode
    cap 08[54] = HT unit ID clumping
    cap 08[9c] = HT Gen3
    cap 05[70] = MSI supports 4 messages 

none0@pci0:0:0:2:	class=0x080600 card=0x5a231002 chip=0x5a231002 rev=0x00 hdr=0x00
    vendor     = 'Advanced Micro Devices, Inc. [AMD/ATI]'
    device     = 'RD890S/RD990 I/O Memory Management Unit (IOMMU)'
    class      = base peripheral
    subclass   = IOMMU
    cap 0f[40] = unknown
    cap 05[54] = MSI supports 1 message, 64 bit 
    cap 08[64] = HT MSI fixed address window enabled at 0xfee00000

pcib1@pci0:0:9:0:	class=0x060400 card=0x5a141002 chip=0x5a1c1002 rev=0x00 hdr=0x01
    vendor     = 'Advanced Micro Devices, Inc. [AMD/ATI]'
    device     = 'RD890/RD9x0/RX980 PCI to PCI bridge (PCI Express GPP Port 4)'
    class      = bridge
    subclass   = PCI-PCI
    cap 01[50] = powerspec 3  supports D0 D3  current D0
    cap 10[58] = PCI-Express 2 root port max data 128(128) NS ARI disabled
                 link x1(x2) speed 5.0(5.0) ASPM disabled(L0s/L1)
                 slot 9 power limit 75000 mW
    cap 05[a0] = MSI supports 1 message 
    cap 0d[b0] = PCI Bridge card=0x5a141002
    cap 08[b8] = HT MSI fixed address window enabled at 0xfee00000
    ecap 000b[100] = Vendor 1 ID 1
    ecap 000d[190] = ACS 1

pcib2@pci0:0:10:0:	class=0x060400 card=0x5a141002 chip=0x5a1d1002 rev=0x00 hdr=0x01
    vendor     = 'Advanced Micro Devices, Inc. [AMD/ATI]'
    device     = 'RD890/RD9x0/RX980 PCI to PCI bridge (PCI Express GPP Port 5)'
    class      = bridge
    subclass   = PCI-PCI
    cap 01[50] = powerspec 3  supports D0 D3  current D0
    cap 10[58] = PCI-Express 2 root port max data 128(128) NS ARI disabled
                 link x1(x2) speed 5.0(5.0) ASPM disabled(L0s/L1)
                 slot 10 power limit 75000 mW
    cap 05[a0] = MSI supports 1 message 
    cap 0d[b0] = PCI Bridge card=0x5a141002
    cap 08[b8] = HT MSI fixed address window enabled at 0xfee00000
    ecap 000b[100] = Vendor 1 ID 1
    ecap 000d[190] = ACS 1

pcib3@pci0:0:11:0:	class=0x060400 card=0x5a141002 chip=0x5a1f1002 rev=0x00 hdr=0x01
    vendor     = 'Advanced Micro Devices, Inc. [AMD/ATI]'
    device     = 'RD890/RD990 PCI to PCI bridge (PCI Express GFX2 port 0)'
    class      = bridge
    subclass   = PCI-PCI
    cap 01[50] = powerspec 3  supports D0 D3  current D0
    cap 10[58] = PCI-Express 2 root port max data 128(128) NS ARI disabled
                 link x4(x16) speed 2.5(5.0) ASPM disabled(L0s/L1)
                 slot 11 power limit 75000 mW
    cap 05[a0] = MSI supports 1 message 
    cap 0d[b0] = PCI Bridge card=0x5a141002
    cap 08[b8] = HT MSI fixed address window enabled at 0xfee00000
    ecap 000b[100] = Vendor 1 ID 1
    ecap 000d[190] = ACS 1

ahci1@pci0:0:17:0:	class=0x010601 card=0xb0021458 chip=0x43911002 rev=0x40 hdr=0x00
    vendor     = 'Advanced Micro Devices, Inc. [AMD/ATI]'
    device     = 'SB7x0/SB8x0/SB9x0 SATA Controller [AHCI mode]'
    class      = mass storage
    subclass   = SATA
    bar   [10] = type I/O Port, range 32, base 0xf040, size 8, enabled
    bar   [14] = type I/O Port, range 32, base 0xf030, size 4, enabled
    bar   [18] = type I/O Port, range 32, base 0xf020, size 8, enabled
    bar   [1c] = type I/O Port, range 32, base 0xf010, size 4, enabled
    bar   [20] = type I/O Port, range 32, base 0xf000, size 16, enabled
    bar   [24] = type Memory, range 32, base 0xfe50b000, size 1024, enabled
    cap 12[70] = SATA Index-Data Pair
    cap 13[a4] = PCI Advanced Features: FLR TP

ohci0@pci0:0:18:0:	class=0x0c0310 card=0x50041458 chip=0x43971002 rev=0x00 hdr=0x00
    vendor     = 'Advanced Micro Devices, Inc. [AMD/ATI]'
    device     = 'SB7x0/SB8x0/SB9x0 USB OHCI0 Controller'
    class      = serial bus
    subclass   = USB
    bar   [10] = type Memory, range 32, base 0xfe50a000, size 4096, enabled

ehci0@pci0:0:18:2:	class=0x0c0320 card=0x50041458 chip=0x43961002 rev=0x00 hdr=0x00
    vendor     = 'Advanced Micro Devices, Inc. [AMD/ATI]'
    device     = 'SB7x0/SB8x0/SB9x0 USB EHCI Controller'
    class      = serial bus
    subclass   = USB
    bar   [10] = type Memory, range 32, base 0xfe509000, size 256, enabled
    cap 01[c0] = powerspec 2  supports D0 D1 D2 D3  current D0
    cap 0a[e4] = EHCI Debug Port at offset 0xe0 in map 0x14

ohci1@pci0:0:19:0:	class=0x0c0310 card=0x50041458 chip=0x43971002 rev=0x00 hdr=0x00
    vendor     = 'Advanced Micro Devices, Inc. [AMD/ATI]'
    device     = 'SB7x0/SB8x0/SB9x0 USB OHCI0 Controller'
    class      = serial bus
    subclass   = USB
    bar   [10] = type Memory, range 32, base 0xfe508000, size 4096, enabled

ehci1@pci0:0:19:2:	class=0x0c0320 card=0x50041458 chip=0x43961002 rev=0x00 hdr=0x00
    vendor     = 'Advanced Micro Devices, Inc. [AMD/ATI]'
    device     = 'SB7x0/SB8x0/SB9x0 USB EHCI Controller'
    class      = serial bus
    subclass   = USB
    bar   [10] = type Memory, range 32, base 0xfe507000, size 256, enabled
    cap 01[c0] = powerspec 2  supports D0 D1 D2 D3  current D0
    cap 0a[e4] = EHCI Debug Port at offset 0xe0 in map 0x14

intsmb0@pci0:0:20:0:	class=0x0c0500 card=0x43851002 chip=0x43851002 rev=0x42 hdr=0x00
    vendor     = 'Advanced Micro Devices, Inc. [AMD/ATI]'
    device     = 'SBx00 SMBus Controller'
    class      = serial bus
    subclass   = SMBus

hdac0@pci0:0:20:2:	class=0x040300 card=0xa1321458 chip=0x43831002 rev=0x40 hdr=0x00
    vendor     = 'Advanced Micro Devices, Inc. [AMD/ATI]'
    device     = 'SBx00 Azalia (Intel HDA)'
    class      = multimedia
    subclass   = HDA
    bar   [10] = type Memory, range 64, base 0xfe500000, size 16384, enabled
    cap 01[50] = powerspec 2  supports D0 D3  current D0

isab0@pci0:0:20:3:	class=0x060100 card=0x439d1002 chip=0x439d1002 rev=0x40 hdr=0x00
    vendor     = 'Advanced Micro Devices, Inc. [AMD/ATI]'
    device     = 'SB7x0/SB8x0/SB9x0 LPC host controller'
    class      = bridge
    subclass   = PCI-ISA

pcib4@pci0:0:20:4:	class=0x060401 card=0x00000000 chip=0x43841002 rev=0x40 hdr=0x01
    vendor     = 'Advanced Micro Devices, Inc. [AMD/ATI]'
    device     = 'SBx00 PCI to PCI Bridge'
    class      = bridge
    subclass   = PCI-PCI

ohci2@pci0:0:20:5:	class=0x0c0310 card=0x50041458 chip=0x43991002 rev=0x00 hdr=0x00
    vendor     = 'Advanced Micro Devices, Inc. [AMD/ATI]'
    device     = 'SB7x0/SB8x0/SB9x0 USB OHCI2 Controller'
    class      = serial bus
    subclass   = USB
    bar   [10] = type Memory, range 32, base 0xfe506000, size 4096, enabled

pcib5@pci0:0:21:0:	class=0x060400 card=0x00001002 chip=0x43a01002 rev=0x00 hdr=0x01
    vendor     = 'Advanced Micro Devices, Inc. [AMD/ATI]'
    device     = 'SB700/SB800/SB900 PCI to PCI bridge (PCIE port 0)'
    class      = bridge
    subclass   = PCI-PCI
    cap 01[50] = powerspec 3  supports D0 D1 D2 D3  current D0
    cap 10[58] = PCI-Express 2 root port max data 128(128) NS
                 link x1(x1) speed 2.5(5.0) ASPM disabled(L0s/L1)
    cap 05[a0] = MSI supports 1 message, 64 bit 
    cap 0d[b0] = PCI Bridge card=0x00001002
    cap 08[b8] = HT MSI fixed address window enabled at 0xfee00000
    ecap 000b[100] = Vendor 1 ID 1

ohci3@pci0:0:22:0:	class=0x0c0310 card=0x50041458 chip=0x43971002 rev=0x00 hdr=0x00
    vendor     = 'Advanced Micro Devices, Inc. [AMD/ATI]'
    device     = 'SB7x0/SB8x0/SB9x0 USB OHCI0 Controller'
    class      = serial bus
    subclass   = USB
    bar   [10] = type Memory, range 32, base 0xfe505000, size 4096, enabled

ehci2@pci0:0:22:2:	class=0x0c0320 card=0x50041458 chip=0x43961002 rev=0x00 hdr=0x00
    vendor     = 'Advanced Micro Devices, Inc. [AMD/ATI]'
    device     = 'SB7x0/SB8x0/SB9x0 USB EHCI Controller'
    class      = serial bus
    subclass   = USB
    bar   [10] = type Memory, range 32, base 0xfe504000, size 256, enabled
    cap 01[c0] = powerspec 2  supports D0 D1 D2 D3  current D0
    cap 0a[e4] = EHCI Debug Port at offset 0xe0 in map 0x14

hostb1@pci0:0:24:0:	class=0x060000 card=0x00000000 chip=0x16001022 rev=0x00 hdr=0x00
    vendor     = 'Advanced Micro Devices, Inc. [AMD]'
    device     = 'Family 15h Processor Function 0'
    class      = bridge
    subclass   = HOST-PCI
    cap 08[80] = HT host

hostb2@pci0:0:24:1:	class=0x060000 card=0x00000000 chip=0x16011022 rev=0x00 hdr=0x00
    vendor     = 'Advanced Micro Devices, Inc. [AMD]'
    device     = 'Family 15h Processor Function 1'
    class      = bridge
    subclass   = HOST-PCI

hostb3@pci0:0:24:2:	class=0x060000 card=0x00000000 chip=0x16021022 rev=0x00 hdr=0x00
    vendor     = 'Advanced Micro Devices, Inc. [AMD]'
    device     = 'Family 15h Processor Function 2'
    class      = bridge
    subclass   = HOST-PCI

hostb4@pci0:0:24:3:	class=0x060000 card=0x00000000 chip=0x16031022 rev=0x00 hdr=0x00
    vendor     = 'Advanced Micro Devices, Inc. [AMD]'
    device     = 'Family 15h Processor Function 3'
    class      = bridge
    subclass   = HOST-PCI
    cap 0f[f0] = unknown

hostb5@pci0:0:24:4:	class=0x060000 card=0x00000000 chip=0x16041022 rev=0x00 hdr=0x00
    vendor     = 'Advanced Micro Devices, Inc. [AMD]'
    device     = 'Family 15h Processor Function 4'
    class      = bridge
    subclass   = HOST-PCI

hostb6@pci0:0:24:5:	class=0x060000 card=0x00000000 chip=0x16051022 rev=0x00 hdr=0x00
    vendor     = 'Advanced Micro Devices, Inc. [AMD]'
    device     = 'Family 15h Processor Function 5'
    class      = bridge
    subclass   = HOST-PCI

xhci0@pci0:1:0:0:	class=0x0c0330 card=0x50071458 chip=0x34831106 rev=0x01 hdr=0x00
    vendor     = 'VIA Technologies, Inc.'
    device     = 'VL805 USB 3.0 Host Controller'
    class      = serial bus
    subclass   = USB
    bar   [10] = type Memory, range 64, base 0xfe400000, size 4096, enabled
    cap 01[80] = powerspec 3  supports D0 D3  current D0
    cap 05[90] = MSI supports 4 messages, 64 bit enabled with 1 message
    cap 10[c4] = PCI-Express 2 endpoint max data 128(256) NS
                 link x1(x1) speed 5.0(5.0) ASPM disabled(L0s/L1) ClockPM disabled
    ecap 0001[100] = AER 1 0 fatal 1 non-fatal 1 corrected

ahci0@pci0:2:0:0:	class=0x010601 card=0xb0001458 chip=0x91721b4b rev=0x11 hdr=0x00
    vendor     = 'Marvell Technology Group Ltd.'
    device     = '88SE9172 SATA 6Gb/s Controller'
    class      = mass storage
    subclass   = SATA
    bar   [10] = type I/O Port, range 32, base 0xe040, size 8, enabled
    bar   [14] = type I/O Port, range 32, base 0xe030, size 4, enabled
    bar   [18] = type I/O Port, range 32, base 0xe020, size 8, enabled
    bar   [1c] = type I/O Port, range 32, base 0xe010, size 4, enabled
    bar   [20] = type I/O Port, range 32, base 0xe000, size 16, enabled
    bar   [24] = type Memory, range 32, base 0xfe310000, size 512, enabled
    cap 01[40] = powerspec 3  supports D0 D3  current D0
    cap 05[50] = MSI supports 1 message enabled with 1 message
    cap 10[70] = PCI-Express 2 legacy endpoint max data 128(512)
                 link x1(x1) speed 5.0(5.0) ASPM disabled(L0s/L1)
    ecap 0001[100] = AER 1 0 fatal 0 non-fatal 1 corrected

em0@pci0:3:0:0:	class=0x020000 card=0x135e8086 chip=0x105e8086 rev=0x06 hdr=0x00
    vendor     = 'Intel Corporation'
    device     = '82571EB/82571GB Gigabit Ethernet Controller D0/D1 (copper applications)'
    class      = network
    subclass   = ethernet
    bar   [10] = type Memory, range 32, base 0xfe260000, size 131072, enabled
    bar   [14] = type Memory, range 32, base 0xfe240000, size 131072, enabled
    bar   [18] = type I/O Port, range 32, base 0xd020, size 32, enabled
    cap 01[c8] = powerspec 2  supports D0 D3  current D0
    cap 05[d0] = MSI supports 1 message, 64 bit enabled with 1 message
    cap 10[e0] = PCI-Express 1 endpoint max data 128(256) NS
                 link x4(x4) speed 2.5(2.5) ASPM disabled(L0s/L1)
    ecap 0001[100] = AER 1 0 fatal 1 non-fatal 0 corrected
    ecap 0003[140] = Serial 1 001517ffff684a78

em1@pci0:3:0:1:	class=0x020000 card=0x135e8086 chip=0x105e8086 rev=0x06 hdr=0x00
    vendor     = 'Intel Corporation'
    device     = '82571EB/82571GB Gigabit Ethernet Controller D0/D1 (copper applications)'
    class      = network
    subclass   = ethernet
    bar   [10] = type Memory, range 32, base 0xfe220000, size 131072, enabled
    bar   [14] = type Memory, range 32, base 0xfe200000, size 131072, enabled
    bar   [18] = type I/O Port, range 32, base 0xd000, size 32, enabled
    cap 01[c8] = powerspec 2  supports D0 D3  current D0
    cap 05[d0] = MSI supports 1 message, 64 bit enabled with 1 message
    cap 10[e0] = PCI-Express 1 endpoint max data 128(256) NS
                 link x4(x4) speed 2.5(2.5) ASPM disabled(L0s/L1)
    ecap 0001[100] = AER 1 0 fatal 1 non-fatal 0 corrected
    ecap 0003[140] = Serial 1 001517ffff684a78

vgapci0@pci0:4:6:0:	class=0x030000 card=0x80081002 chip=0x47521002 rev=0x27 hdr=0x00
    vendor     = 'Advanced Micro Devices, Inc. [AMD/ATI]'
    device     = 'Rage 3 [Rage XL PCI]'
    class      = display
    subclass   = VGA
    bar   [10] = type Memory, range 32, base 0xfd000000, size 16777216, enabled
    bar   [14] = type I/O Port, range 32, base 0xc000, size 256, enabled
    bar   [18] = type Memory, range 32, base 0xfe021000, size 4096, enabled
    cap 01[5c] = powerspec 2  supports D0 D1 D2 D3  current D0

none1@pci0:4:14:0:	class=0x0c0010 card=0x10001458 chip=0x30441106 rev=0xc0 hdr=0x00
    vendor     = 'VIA Technologies, Inc.'
    device     = 'VT6306/7/8 [Fire II(M)] IEEE 1394 OHCI Controller'
    class      = serial bus
    subclass   = FireWire
    bar   [10] = type Memory, range 32, base 0xfe020000, size 2048, enabled
    bar   [14] = type I/O Port, range 32, base 0xc100, size 128, enabled
    cap 01[50] = powerspec 2  supports D0 D2 D3  current D0

re0@pci0:5:0:0:	class=0x020000 card=0xe0001458 chip=0x816810ec rev=0x06 hdr=0x00
    vendor     = 'Realtek Semiconductor Co., Ltd.'
    device     = 'RTL8111/8168/8411 PCI Express Gigabit Ethernet Controller'
    class      = network
    subclass   = ethernet
    bar   [10] = type I/O Port, range 32, base 0xb000, size 256, enabled
    bar   [18] = type Memory, range 64, base 0xfe100000, size 4096, enabled
    bar   [20] = type Prefetchable Memory, range 64, base 0xfea00000, size 16384, enabled
    cap 01[40] = powerspec 3  supports D0 D1 D2 D3  current D0
    cap 05[50] = MSI supports 1 message, 64 bit 
    cap 10[70] = PCI-Express 2 endpoint MSI 1 max data 128(128)
                 link x1(x1) speed 2.5(2.5) ASPM disabled(L0s/L1) ClockPM disabled
    cap 11[b0] = MSI-X supports 4 messages, enabled
                 Table in map 0x20[0x0], PBA in map 0x20[0x800]
    cap 03[d0] = VPD
    ecap 0001[100] = AER 1 0 fatal 0 non-fatal 1 corrected
    ecap 0002[140] = VC 1 max VC0
    ecap 0003[160] = Serial 1 01000000684ce000
