hostb0@pci0:0:0:0:	class=0x060000 rev=0x00 hdr=0x00 vendor=0x1022 device=0x1410 subvendor=0x1022 subdevice=0x1410
    vendor     = 'Advanced Micro Devices, Inc. [AMD]'
    device     = 'Family 15h (Models 10h-1fh) Processor Root Complex'
    class      = bridge
    subclass   = HOST-PCI

none0@pci0:0:0:2:	class=0x080600 rev=0x00 hdr=0x00 vendor=0x1022 device=0x1419 subvendor=0x103c subdevice=0x1850
    vendor     = 'Advanced Micro Devices, Inc. [AMD]'
    device     = 'Family 15h (Models 10h-1fh) I/O Memory Management Unit'
    class      = base peripheral
    subclass   = IOMMU
    cap 0f[40] = unknown
    cap 05[54] = MSI supports 1 message, 64 bit 
    cap 08[64] = HT MSI fixed address window enabled at 0xfee00000

vgapci0@pci0:0:1:0:	class=0x030000 rev=0x00 hdr=0x00 vendor=0x1002 device=0x9993 subvendor=0x103c subdevice=0x1850
    vendor     = 'Advanced Micro Devices, Inc. [AMD/ATI]'
    device     = 'Trinity 2 [Radeon HD 7480D]'
    class      = display
    subclass   = VGA
    bar   [10] = type Prefetchable Memory, range 32, base 0xd0000000, size 268435456, enabled
    bar   [14] = type I/O Port, range 32, base 0xf000, size 256, enabled
    bar   [18] = type Memory, range 32, base 0xff700000, size 262144, enabled
    cap 01[50] = powerspec 3  supports D0 D1 D2 D3  current D0
    cap 10[58] = PCI-Express 2 root endpoint max data 128(128) RO NS
                 max read 128
    cap 05[a0] = MSI supports 1 message, 64 bit 
    ecap 000b[100] = Vendor [1] ID 0001 Rev 1 Length 16

none1@pci0:0:1:1:	class=0x040300 rev=0x00 hdr=0x00 vendor=0x1002 device=0x9902 subvendor=0x103c subdevice=0x1850
    vendor     = 'Advanced Micro Devices, Inc. [AMD/ATI]'
    device     = 'Trinity HDMI Audio Controller'
    class      = multimedia
    subclass   = HDA
    bar   [10] = type Memory, range 32, base 0xff744000, size 16384, enabled
    cap 01[50] = powerspec 3  supports D0 D1 D2 D3  current D0
    cap 10[58] = PCI-Express 2 root endpoint max data 128(128) RO NS
                 max read 128
    cap 05[a0] = MSI supports 1 message, 64 bit 
    ecap 000b[100] = Vendor [1] ID 0001 Rev 1 Length 16

xhci0@pci0:0:16:0:	class=0x0c0330 rev=0x03 hdr=0x00 vendor=0x1022 device=0x7812 subvendor=0x103c subdevice=0x1850
    vendor     = 'Advanced Micro Devices, Inc. [AMD]'
    device     = 'FCH USB XHCI Controller'
    class      = serial bus
    subclass   = USB
    bar   [10] = type Memory, range 64, base 0xff74a000, size 8192, enabled
    cap 01[50] = powerspec 3  supports D0 D3  current D0
    cap 05[70] = MSI supports 8 messages, 64 bit 
    cap 11[90] = MSI-X supports 8 messages, enabled
                 Table in map 0x10[0x1000], PBA in map 0x10[0x1080]
    cap 10[a0] = PCI-Express 2 root endpoint max data 128(128) NS
                 max read 512
    ecap 0018[100] = LTR 1

xhci1@pci0:0:16:1:	class=0x0c0330 rev=0x03 hdr=0x00 vendor=0x1022 device=0x7812 subvendor=0x103c subdevice=0x1850
    vendor     = 'Advanced Micro Devices, Inc. [AMD]'
    device     = 'FCH USB XHCI Controller'
    class      = serial bus
    subclass   = USB
    bar   [10] = type Memory, range 64, base 0xff748000, size 8192, enabled
    cap 01[50] = powerspec 3  supports D0 D3  current D0
    cap 05[70] = MSI supports 8 messages, 64 bit 
    cap 11[90] = MSI-X supports 8 messages, enabled
                 Table in map 0x10[0x1000], PBA in map 0x10[0x1080]
    cap 10[a0] = PCI-Express 2 root endpoint max data 128(128) NS
                 max read 512

ahci0@pci0:0:17:0:	class=0x01018a rev=0x40 hdr=0x00 vendor=0x1022 device=0x7800 subvendor=0x103c subdevice=0x1850
    vendor     = 'Advanced Micro Devices, Inc. [AMD]'
    device     = 'FCH SATA Controller [IDE mode]'
    class      = mass storage
    subclass   = ATA
    bar   [20] = type I/O Port, range 32, base 0xf100, size 16, enabled
    bar   [24] = type Memory, range 32, base 0xff751000, size 2048, enabled
    cap 12[70] = SATA Index-Data Pair

ohci0@pci0:0:18:0:	class=0x0c0310 rev=0x11 hdr=0x00 vendor=0x1022 device=0x7807 subvendor=0x103c subdevice=0x1850
    vendor     = 'Advanced Micro Devices, Inc. [AMD]'
    device     = 'FCH USB OHCI Controller'
    class      = serial bus
    subclass   = USB
    bar   [10] = type Memory, range 32, base 0xff750000, size 4096, enabled

ehci0@pci0:0:18:2:	class=0x0c0320 rev=0x11 hdr=0x00 vendor=0x1022 device=0x7808 subvendor=0x103c subdevice=0x1850
    vendor     = 'Advanced Micro Devices, Inc. [AMD]'
    device     = 'FCH USB EHCI Controller'
    class      = serial bus
    subclass   = USB
    bar   [10] = type Memory, range 32, base 0xff74f000, size 256, enabled
    cap 01[c0] = powerspec 2  supports D0 D1 D2 D3  current D0
    cap 0a[e4] = EHCI Debug Port at offset 0xe0 in map 0x14

ohci1@pci0:0:19:0:	class=0x0c0310 rev=0x11 hdr=0x00 vendor=0x1022 device=0x7807 subvendor=0x103c subdevice=0x1850
    vendor     = 'Advanced Micro Devices, Inc. [AMD]'
    device     = 'FCH USB OHCI Controller'
    class      = serial bus
    subclass   = USB
    bar   [10] = type Memory, range 32, base 0xff74e000, size 4096, enabled

ehci1@pci0:0:19:2:	class=0x0c0320 rev=0x11 hdr=0x00 vendor=0x1022 device=0x7808 subvendor=0x103c subdevice=0x1850
    vendor     = 'Advanced Micro Devices, Inc. [AMD]'
    device     = 'FCH USB EHCI Controller'
    class      = serial bus
    subclass   = USB
    bar   [10] = type Memory, range 32, base 0xff74d000, size 256, enabled
    cap 01[c0] = powerspec 2  supports D0 D1 D2 D3  current D0
    cap 0a[e4] = EHCI Debug Port at offset 0xe0 in map 0x14

intsmb0@pci0:0:20:0:	class=0x0c0500 rev=0x14 hdr=0x00 vendor=0x1022 device=0x780b subvendor=0x103c subdevice=0x1850
    vendor     = 'Advanced Micro Devices, Inc. [AMD]'
    device     = 'FCH SMBus Controller'
    class      = serial bus
    subclass   = SMBus

hdac0@pci0:0:20:2:	class=0x040300 rev=0x01 hdr=0x00 vendor=0x1022 device=0x780d subvendor=0x103c subdevice=0x1850
    vendor     = 'Advanced Micro Devices, Inc. [AMD]'
    device     = 'FCH Azalia Controller'
    class      = multimedia
    subclass   = HDA
    bar   [10] = type Memory, range 64, base 0xff740000, size 16384, enabled
    cap 01[50] = powerspec 2  supports D0 D3  current D0

isab0@pci0:0:20:3:	class=0x060100 rev=0x11 hdr=0x00 vendor=0x1022 device=0x780e subvendor=0x103c subdevice=0x1850
    vendor     = 'Advanced Micro Devices, Inc. [AMD]'
    device     = 'FCH LPC Bridge'
    class      = bridge
    subclass   = PCI-ISA

pcib1@pci0:0:20:4:	class=0x060401 rev=0x40 hdr=0x01 vendor=0x1022 device=0x780f subvendor=0x0000 subdevice=0x0000
    vendor     = 'Advanced Micro Devices, Inc. [AMD]'
    device     = 'FCH PCI Bridge'
    class      = bridge
    subclass   = PCI-PCI

ohci2@pci0:0:20:5:	class=0x0c0310 rev=0x11 hdr=0x00 vendor=0x1022 device=0x7809 subvendor=0x103c subdevice=0x1850
    vendor     = 'Advanced Micro Devices, Inc. [AMD]'
    device     = 'FCH USB OHCI Controller'
    class      = serial bus
    subclass   = USB
    bar   [10] = type Memory, range 32, base 0xff74c000, size 4096, enabled

pcib2@pci0:0:21:0:	class=0x060400 rev=0x00 hdr=0x01 vendor=0x1022 device=0x43a0 subvendor=0x1022 subdevice=0x0000
    vendor     = 'Advanced Micro Devices, Inc. [AMD]'
    device     = 'Hudson PCI to PCI bridge (PCIE port 0)'
    class      = bridge
    subclass   = PCI-PCI
    cap 01[50] = powerspec 3  supports D0 D1 D2 D3  current D0
    cap 10[58] = PCI-Express 2 root port max data 128(128) RO NS
                 max read 128
                 link x16(x1) speed undef(5.0) ASPM disabled(L0s/L1)
    cap 05[a0] = MSI supports 1 message, 64 bit 
    cap 0d[b0] = PCI Bridge subvendor=0x1022 subdevice=0x0000
    cap 08[b8] = HT MSI fixed address window enabled at 0xfee00000
    ecap 000b[100] = Vendor [1] ID 0001 Rev 1 Length 16

pcib3@pci0:0:21:2:	class=0x060400 rev=0x00 hdr=0x01 vendor=0x1022 device=0x43a2 subvendor=0x1022 subdevice=0x0000
    vendor     = 'Advanced Micro Devices, Inc. [AMD]'
    device     = 'Hudson PCI to PCI bridge (PCIE port 2)'
    class      = bridge
    subclass   = PCI-PCI
    cap 01[50] = powerspec 3  supports D0 D1 D2 D3  current D0
    cap 10[58] = PCI-Express 2 root port max data 128(128) NS
                 max read 128
                 link x1(x1) speed 2.5(5.0) ASPM L0s/L1(L0s/L1)
    cap 05[a0] = MSI supports 1 message, 64 bit 
    cap 0d[b0] = PCI Bridge subvendor=0x1022 subdevice=0x0000
    cap 08[b8] = HT MSI fixed address window enabled at 0xfee00000
    ecap 000b[100] = Vendor [1] ID 0001 Rev 1 Length 16

hostb1@pci0:0:24:0:	class=0x060000 rev=0x00 hdr=0x00 vendor=0x1022 device=0x1400 subvendor=0x0000 subdevice=0x0000
    vendor     = 'Advanced Micro Devices, Inc. [AMD]'
    device     = 'Family 15h (Models 10h-1fh) Processor Function 0'
    class      = bridge
    subclass   = HOST-PCI

hostb2@pci0:0:24:1:	class=0x060000 rev=0x00 hdr=0x00 vendor=0x1022 device=0x1401 subvendor=0x0000 subdevice=0x0000
    vendor     = 'Advanced Micro Devices, Inc. [AMD]'
    device     = 'Family 15h (Models 10h-1fh) Processor Function 1'
    class      = bridge
    subclass   = HOST-PCI

hostb3@pci0:0:24:2:	class=0x060000 rev=0x00 hdr=0x00 vendor=0x1022 device=0x1402 subvendor=0x0000 subdevice=0x0000
    vendor     = 'Advanced Micro Devices, Inc. [AMD]'
    device     = 'Family 15h (Models 10h-1fh) Processor Function 2'
    class      = bridge
    subclass   = HOST-PCI

hostb4@pci0:0:24:3:	class=0x060000 rev=0x00 hdr=0x00 vendor=0x1022 device=0x1403 subvendor=0x0000 subdevice=0x0000
    vendor     = 'Advanced Micro Devices, Inc. [AMD]'
    device     = 'Family 15h (Models 10h-1fh) Processor Function 3'
    class      = bridge
    subclass   = HOST-PCI
    cap 0f[f0] = unknown

hostb5@pci0:0:24:4:	class=0x060000 rev=0x00 hdr=0x00 vendor=0x1022 device=0x1404 subvendor=0x0000 subdevice=0x0000
    vendor     = 'Advanced Micro Devices, Inc. [AMD]'
    device     = 'Family 15h (Models 10h-1fh) Processor Function 4'
    class      = bridge
    subclass   = HOST-PCI

hostb6@pci0:0:24:5:	class=0x060000 rev=0x00 hdr=0x00 vendor=0x1022 device=0x1405 subvendor=0x0000 subdevice=0x0000
    vendor     = 'Advanced Micro Devices, Inc. [AMD]'
    device     = 'Family 15h (Models 10h-1fh) Processor Function 5'
    class      = bridge
    subclass   = HOST-PCI

bge0@pci0:3:0:0:	class=0x020000 rev=0x10 hdr=0x00 vendor=0x14e4 device=0x1681 subvendor=0x103c subdevice=0x1850
    vendor     = 'Broadcom Inc. and subsidiaries'
    device     = 'NetXtreme BCM5761 Gigabit Ethernet PCIe'
    class      = network
    subclass   = ethernet
    bar   [10] = type Memory, range 64, base 0xff610000, size 65536, enabled
    bar   [18] = type Memory, range 64, base 0xff600000, size 65536, enabled
    cap 01[48] = powerspec 3  supports D0 D3  current D0
    cap 03[40] = VPD
    cap 09[60] = vendor (length 108)
    cap 05[50] = MSI supports 1 message, 64 bit enabled with 1 message
    cap 10[cc] = PCI-Express 2 endpoint max data 128(256)
                 max read 4096
                 link x1(x1) speed 2.5(2.5) ASPM L0s/L1(L0s/L1) ClockPM disabled
    ecap 0001[100] = AER 1 0 fatal 0 non-fatal 0 corrected
    ecap 0002[13c] = VC 1 max VC0
    ecap 0003[160] = Serial 1 8851fbfffe70ec37
    ecap 0004[16c] = Power Budgeting 1
