hostb0@pci0:0:0:0:	class=0x060000 rev=0x09 hdr=0x00 vendor=0x8086 device=0x0104 subvendor=0x104d subdevice=0x907b
    vendor     = 'Intel Corporation'
    device     = '2nd Generation Core Processor Family DRAM Controller'
    class      = bridge
    subclass   = HOST-PCI
    cap 09[e0] = vendor (length 12) Intel cap 0 version 1

pcib1@pci0:0:1:0:	class=0x060400 rev=0x09 hdr=0x01 vendor=0x8086 device=0x0101 subvendor=0x104d subdevice=0x907b
    vendor     = 'Intel Corporation'
    device     = 'Xeon E3-1200/2nd Generation Core Processor Family PCI Express Root Port'
    class      = bridge
    subclass   = PCI-PCI
    cap 0d[88] = PCI Bridge subvendor=0x104d subdevice=0x907b
    cap 01[80] = powerspec 3  supports D0 D3  current D0
    cap 05[90] = MSI supports 1 message 
    cap 10[a0] = PCI-Express 2 root port max data 128(128)
                 max read 128
                 link x16(x16) speed 5.0(5.0) ASPM L0s/L1(L0s/L1)
                 slot 1 power limit 75000 mW
    ecap 0002[100] = VC 1 max VC0
    ecap 0005[140] = Root Complex Link Declaration 1

vgapci1@pci0:0:2:0:	class=0x030000 rev=0x09 hdr=0x00 vendor=0x8086 device=0x0116 subvendor=0x104d subdevice=0x907b
    vendor     = 'Intel Corporation'
    device     = '2nd Generation Core Processor Family Integrated Graphics Controller'
    class      = display
    subclass   = VGA
    bar   [10] = type Memory, range 64, base 0xc0000000, size 4194304, enabled
    bar   [18] = type Prefetchable Memory, range 64, base 0xb0000000, size 268435456, enabled
    bar   [20] = type I/O Port, range 32, base 0x8000, size 64, enabled
    cap 05[90] = MSI supports 1 message enabled with 1 message
    cap 01[d0] = powerspec 2  supports D0 D3  current D0
    cap 13[a4] = PCI Advanced Features: FLR TP

none0@pci0:0:22:0:	class=0x078000 rev=0x04 hdr=0x00 vendor=0x8086 device=0x1c3a subvendor=0x104d subdevice=0x907b
    vendor     = 'Intel Corporation'
    device     = '6 Series/C200 Series Chipset Family MEI Controller'
    class      = simple comms
    bar   [10] = type Memory, range 64, base 0xc9404000, size 16, enabled
    cap 01[50] = powerspec 3  supports D0 D3  current D0
    cap 05[8c] = MSI supports 1 message, 64 bit 

ehci0@pci0:0:26:0:	class=0x0c0320 rev=0x04 hdr=0x00 vendor=0x8086 device=0x1c2d subvendor=0x104d subdevice=0x907b
    vendor     = 'Intel Corporation'
    device     = '6 Series/C200 Series Chipset Family USB Enhanced Host Controller'
    class      = serial bus
    subclass   = USB
    bar   [10] = type Memory, range 32, base 0xc9409000, size 1024, enabled
    cap 01[50] = powerspec 2  supports D0 D3  current D0
    cap 0a[58] = EHCI Debug Port at offset 0xa0 in map 0x14
    cap 13[98] = PCI Advanced Features: FLR TP

hdac0@pci0:0:27:0:	class=0x040300 rev=0x04 hdr=0x00 vendor=0x8086 device=0x1c20 subvendor=0x104d subdevice=0x907b
    vendor     = 'Intel Corporation'
    device     = '6 Series/C200 Series Chipset Family High Definition Audio Controller'
    class      = multimedia
    subclass   = HDA
    bar   [10] = type Memory, range 64, base 0xc9400000, size 16384, enabled
    cap 01[50] = powerspec 2  supports D0 D3  current D0
    cap 05[60] = MSI supports 1 message, 64 bit enabled with 1 message
    cap 10[70] = PCI-Express 1 root endpoint max data 128(128) FLR NS
                 max read 128
    ecap 0002[100] = VC 1 max VC1
    ecap 0005[130] = Root Complex Link Declaration 1

pcib2@pci0:0:28:0:	class=0x060400 rev=0xb4 hdr=0x01 vendor=0x8086 device=0x1c10 subvendor=0x104d subdevice=0x907b
    vendor     = 'Intel Corporation'
    device     = '6 Series/C200 Series Chipset Family PCI Express Root Port 1'
    class      = bridge
    subclass   = PCI-PCI
    cap 10[40] = PCI-Express 2 root port max data 128(128)
                 max read 128
                 link x1(x1) speed 2.5(5.0) ASPM L1(L0s/L1)
                 slot 0 power limit 100 mW HotPlug(present) surprise
    cap 05[80] = MSI supports 1 message enabled with 1 message
    cap 0d[90] = PCI Bridge subvendor=0x104d subdevice=0x907b
    cap 01[a0] = powerspec 2  supports D0 D3  current D0

pcib3@pci0:0:28:1:	class=0x060400 rev=0xb4 hdr=0x01 vendor=0x8086 device=0x1c12 subvendor=0x104d subdevice=0x907b
    vendor     = 'Intel Corporation'
    device     = '6 Series/C200 Series Chipset Family PCI Express Root Port 2'
    class      = bridge
    subclass   = PCI-PCI
    cap 10[40] = PCI-Express 2 root port max data 128(128)
                 max read 128
                 link x1(x1) speed 2.5(5.0) ASPM disabled(L0s/L1)
                 slot 1 power limit 100 mW HotPlug(present) surprise
    cap 05[80] = MSI supports 1 message enabled with 1 message
    cap 0d[90] = PCI Bridge subvendor=0x104d subdevice=0x907b
    cap 01[a0] = powerspec 2  supports D0 D3  current D0

pcib4@pci0:0:28:2:	class=0x060400 rev=0xb4 hdr=0x01 vendor=0x8086 device=0x1c14 subvendor=0x104d subdevice=0x907b
    vendor     = 'Intel Corporation'
    device     = '6 Series/C200 Series Chipset Family PCI Express Root Port 3'
    class      = bridge
    subclass   = PCI-PCI
    cap 10[40] = PCI-Express 2 root port max data 128(128)
                 max read 128
                 link x1(x1) speed 5.0(5.0) ASPM L1(L0s/L1)
                 slot 2 power limit 100 mW HotPlug(present) surprise
    cap 05[80] = MSI supports 1 message enabled with 1 message
    cap 0d[90] = PCI Bridge subvendor=0x104d subdevice=0x907b
    cap 01[a0] = powerspec 2  supports D0 D3  current D0

pcib5@pci0:0:28:3:	class=0x060400 rev=0xb4 hdr=0x01 vendor=0x8086 device=0x1c16 subvendor=0x104d subdevice=0x907b
    vendor     = 'Intel Corporation'
    device     = '6 Series/C200 Series Chipset Family PCI Express Root Port 4'
    class      = bridge
    subclass   = PCI-PCI
    cap 10[40] = PCI-Express 2 root port max data 128(128)
                 max read 128
                 link x1(x1) speed 2.5(5.0) ASPM L0s/L1(L0s/L1)
                 slot 3 power limit 100 mW HotPlug(present) surprise
    cap 05[80] = MSI supports 1 message enabled with 1 message
    cap 0d[90] = PCI Bridge subvendor=0x104d subdevice=0x907b
    cap 01[a0] = powerspec 2  supports D0 D3  current D0

ehci1@pci0:0:29:0:	class=0x0c0320 rev=0x04 hdr=0x00 vendor=0x8086 device=0x1c26 subvendor=0x104d subdevice=0x907b
    vendor     = 'Intel Corporation'
    device     = '6 Series/C200 Series Chipset Family USB Enhanced Host Controller'
    class      = serial bus
    subclass   = USB
    bar   [10] = type Memory, range 32, base 0xc9408000, size 1024, enabled
    cap 01[50] = powerspec 2  supports D0 D3  current D0
    cap 0a[58] = EHCI Debug Port at offset 0xa0 in map 0x14
    cap 13[98] = PCI Advanced Features: FLR TP

isab0@pci0:0:31:0:	class=0x060100 rev=0x04 hdr=0x00 vendor=0x8086 device=0x1c49 subvendor=0x104d subdevice=0x907b
    vendor     = 'Intel Corporation'
    device     = 'HM65 Express Chipset LPC Controller'
    class      = bridge
    subclass   = PCI-ISA
    cap 09[e0] = vendor (length 12) Intel cap 1 version 0
		 features: AMT, 4 PCI-e x1 slots

ahci0@pci0:0:31:2:	class=0x010601 rev=0x04 hdr=0x00 vendor=0x8086 device=0x1c03 subvendor=0x104d subdevice=0x907b
    vendor     = 'Intel Corporation'
    device     = '6 Series/C200 Series Chipset Family 6 port Mobile SATA AHCI Controller'
    class      = mass storage
    subclass   = SATA
    bar   [10] = type I/O Port, range 32, base 0x8088, size 8, enabled
    bar   [14] = type I/O Port, range 32, base 0x8094, size 4, enabled
    bar   [18] = type I/O Port, range 32, base 0x8080, size 8, enabled
    bar   [1c] = type I/O Port, range 32, base 0x8090, size 4, enabled
    bar   [20] = type I/O Port, range 32, base 0x8060, size 32, enabled
    bar   [24] = type Memory, range 32, base 0xc9407000, size 2048, enabled
    cap 05[80] = MSI supports 1 message enabled with 1 message
    cap 01[70] = powerspec 3  supports D0 D3  current D0
    cap 12[a8] = SATA Index-Data Pair
    cap 13[b0] = PCI Advanced Features: FLR TP

ichsmb0@pci0:0:31:3:	class=0x0c0500 rev=0x04 hdr=0x00 vendor=0x8086 device=0x1c22 subvendor=0x104d subdevice=0x907b
    vendor     = 'Intel Corporation'
    device     = '6 Series/C200 Series Chipset Family SMBus Controller'
    class      = serial bus
    subclass   = SMBus
    bar   [10] = type Memory, range 64, base 0xc9405000, size 256, enabled
    bar   [20] = type I/O Port, range 32, base 0x8040, size 32, enabled

vgapci0@pci0:1:0:0:	class=0x030000 rev=0x00 hdr=0x00 vendor=0x1002 device=0x6760 subvendor=0x104d subdevice=0x907b
    vendor     = 'Advanced Micro Devices, Inc. [AMD/ATI]'
    device     = 'Seymour [Radeon HD 6400M/7400M Series]'
    class      = display
    subclass   = VGA
    bar   [10] = type Prefetchable Memory, range 64, base 0xa0000000, size 268435456, enabled
    bar   [18] = type Memory, range 64, base 0xc8400000, size 131072, enabled
    bar   [20] = type I/O Port, range 32, base 0x7000, size 256, enabled
    cap 01[50] = powerspec 3  supports D0 D1 D2 D3  current D0
    cap 10[58] = PCI-Express 2 legacy endpoint max data 128(256) RO NS
                 max read 512
                 link x16(x16) speed 5.0(5.0) ASPM L0s/L1(L0s/L1)
    cap 05[a0] = MSI supports 1 message, 64 bit 
    ecap 000b[100] = Vendor [1] ID 0001 Rev 1 Length 16
    ecap 0001[150] = AER 1 0 fatal 0 non-fatal 1 corrected

rtwn0@pci0:2:0:0:	class=0x028000 rev=0x01 hdr=0x00 vendor=0x10ec device=0x8176 subvendor=0x1a3b subdevice=0x1139
    vendor     = 'Realtek Semiconductor Co., Ltd.'
    device     = 'RTL8188CE 802.11b/g/n WiFi Adapter'
    class      = network
    bar   [10] = type I/O Port, range 32, base 0x6000, size 256, enabled
    bar   [18] = type Memory, range 64, base 0xc7400000, size 16384, enabled
    cap 01[40] = powerspec 3  supports D0 D1 D2 D3  current D0
    cap 05[50] = MSI supports 1 message, 64 bit enabled with 1 message
    cap 10[70] = PCI-Express 2 endpoint max data 128(128) RO
                 max read 512
                 link x1(x1) speed 2.5(2.5) ASPM disabled(L0s/L1) ClockPM enabled
    ecap 0001[100] = AER 1 0 fatal 0 non-fatal 1 corrected
    ecap 0002[140] = VC 1 max VC0
    ecap 0003[160] = Serial 1 019181feff4ce000

rtsx0@pci0:3:0:0:	class=0xff0000 rev=0x01 hdr=0x00 vendor=0x10ec device=0x5209 subvendor=0x104d subdevice=0x907b
    vendor     = 'Realtek Semiconductor Co., Ltd.'
    device     = 'RTS5209 PCI Express Card Reader'
    bar   [10] = type Memory, range 32, base 0xc6400000, size 4096, enabled
    cap 01[40] = powerspec 3  supports D0 D1 D2 D3  current D0
    cap 05[50] = MSI supports 1 message, 64 bit enabled with 1 message
    cap 10[70] = PCI-Express 2 endpoint max data 128(128) RO
                 max read 512
                 link x1(x1) speed 2.5(2.5) ASPM disabled(L0s/L1) ClockPM enabled
    ecap 0001[100] = AER 1 0 fatal 0 non-fatal 0 corrected
    ecap 0003[140] = Serial 1 00000001004ce000

xhci0@pci0:4:0:0:	class=0x0c0330 rev=0x04 hdr=0x00 vendor=0x1033 device=0x0194 subvendor=0x104d subdevice=0x907b
    vendor     = 'NEC Corporation'
    device     = 'uPD720200 USB 3.0 Host Controller'
    class      = serial bus
    subclass   = USB
    bar   [10] = type Memory, range 64, base 0xc5400000, size 8192, enabled
    cap 01[50] = powerspec 3  supports D0 D3  current D0
    cap 05[70] = MSI supports 8 messages, 64 bit 
    cap 11[90] = MSI-X supports 8 messages, enabled
                 Table in map 0x10[0x1000], PBA in map 0x10[0x1080]
    cap 10[a0] = PCI-Express 2 endpoint max data 128(128) NS
                 max read 512
                 link x1(x1) speed 5.0(5.0) ASPM L1(L0s/L1) ClockPM enabled
    ecap 0001[100] = AER 1 0 fatal 0 non-fatal 0 corrected
    ecap 0003[140] = Serial 1 ffffffffffffffff
    ecap 0018[150] = LTR 1

re0@pci0:5:0:0:	class=0x020000 rev=0x06 hdr=0x00 vendor=0x10ec device=0x8168 subvendor=0x104d subdevice=0x907b
    vendor     = 'Realtek Semiconductor Co., Ltd.'
    device     = 'RTL8111/8168/8411 PCI Express Gigabit Ethernet Controller'
    class      = network
    subclass   = ethernet
    bar   [10] = type I/O Port, range 32, base 0x3000, size 256, enabled
    bar   [18] = type Prefetchable Memory, range 64, base 0xc3404000, size 4096, enabled
    bar   [20] = type Prefetchable Memory, range 64, base 0xc3400000, size 16384, enabled
    cap 01[40] = powerspec 3  supports D0 D1 D2 D3  current D0
    cap 05[50] = MSI supports 1 message, 64 bit 
    cap 10[70] = PCI-Express 2 endpoint MSI 1 max data 128(256) RO
                 max read 4096
                 link x1(x1) speed 2.5(2.5) ASPM disabled(L0s/L1) ClockPM disabled
    cap 11[b0] = MSI-X supports 4 messages, enabled
                 Table in map 0x20[0x0], PBA in map 0x20[0x800]
    cap 03[d0] = VPD
    ecap 0001[100] = AER 1 0 fatal 0 non-fatal 1 corrected
    ecap 0002[140] = VC 1 max VC0
    ecap 0003[160] = Serial 1 961d0000684ce000
