hostb0@pci0:0:0:0:	class=0x060000 rev=0x00 hdr=0x00 vendor=0x1022 device=0x9600 subvendor=0x1043 subdevice=0x8388
    vendor     = 'Advanced Micro Devices, Inc. [AMD]'
    device     = 'RS780 Host Bridge'
    class      = bridge
    subclass   = HOST-PCI
    cap 08[c4] = HT slave
    cap 08[54] = HT unit ID clumping
    cap 08[40] = HT retry mode
    cap 08[9c] = HT Gen3
    cap 08[f8] = HT power management

pcib1@pci0:0:1:0:	class=0x060400 rev=0x00 hdr=0x01 vendor=0x1043 device=0x9602 subvendor=0x1043 subdevice=0x8388
    vendor     = 'ASUSTeK Computer Inc.'
    device     = 'AMD RS780/RS880 PCI to PCI bridge (int gfx)'
    class      = bridge
    subclass   = PCI-PCI
    cap 08[44] = HT MSI fixed address window enabled at 0xfee00000
    cap 0d[b0] = PCI Bridge subvendor=0x1043 subdevice=0x8388

pcib2@pci0:0:4:0:	class=0x060400 rev=0x00 hdr=0x01 vendor=0x1022 device=0x9604 subvendor=0x1043 subdevice=0x8388
    vendor     = 'Advanced Micro Devices, Inc. [AMD]'
    device     = 'RS780/RS880 PCI to PCI bridge (PCIE port 0)'
    class      = bridge
    subclass   = PCI-PCI
    cap 01[50] = powerspec 3  supports D0 D3  current D0
    cap 10[58] = PCI-Express 2 root port max data 128(128) RO NS
                 max read 128
                 link x1(x1) speed 2.5(5.0) ASPM disabled(L0s/L1)
                 slot 4 power limit 25000 mW
    cap 05[a0] = MSI supports 1 message 
    cap 0d[b0] = PCI Bridge subvendor=0x1043 subdevice=0x8388
    cap 08[b8] = HT MSI fixed address window enabled at 0xfee00000
    ecap 000b[100] = Vendor [1] ID 0001 Rev 1 Length 16
    ecap 0002[110] = VC 1 max VC0

ahci0@pci0:0:17:0:	class=0x01018f rev=0x00 hdr=0x00 vendor=0x1002 device=0x4390 subvendor=0x1043 subdevice=0x8389
    vendor     = 'Advanced Micro Devices, Inc. [AMD/ATI]'
    device     = 'SB7x0/SB8x0/SB9x0 SATA Controller [IDE mode]'
    class      = mass storage
    subclass   = ATA
    bar   [10] = type I/O Port, range 32, base 0xb000, size 8, enabled
    bar   [14] = type I/O Port, range 32, base 0xa000, size 4, enabled
    bar   [18] = type I/O Port, range 32, base 0x9000, size 8, enabled
    bar   [1c] = type I/O Port, range 32, base 0x8000, size 4, enabled
    bar   [20] = type I/O Port, range 32, base 0x7000, size 16, enabled
    bar   [24] = type Memory, range 32, base 0xfe8ffc00, size 1024, enabled
    cap 01[60] = powerspec 2  supports D0 D3  current D0
    cap 12[70] = SATA Index-Data Pair

ohci0@pci0:0:18:0:	class=0x0c0310 rev=0x00 hdr=0x00 vendor=0x1002 device=0x4397 subvendor=0x1043 subdevice=0x8389
    vendor     = 'Advanced Micro Devices, Inc. [AMD/ATI]'
    device     = 'SB7x0/SB8x0/SB9x0 USB OHCI0 Controller'
    class      = serial bus
    subclass   = USB
    bar   [10] = type Memory, range 32, base 0xfe8fe000, size 4096, enabled

ohci1@pci0:0:18:1:	class=0x0c0310 rev=0x00 hdr=0x00 vendor=0x1002 device=0x4398 subvendor=0x1043 subdevice=0x8389
    vendor     = 'Advanced Micro Devices, Inc. [AMD/ATI]'
    device     = 'SB7x0 USB OHCI1 Controller'
    class      = serial bus
    subclass   = USB
    bar   [10] = type Memory, range 32, base 0xfe8fd000, size 4096, enabled

ehci0@pci0:0:18:2:	class=0x0c0320 rev=0x00 hdr=0x00 vendor=0x1002 device=0x4396 subvendor=0x1043 subdevice=0x8389
    vendor     = 'Advanced Micro Devices, Inc. [AMD/ATI]'
    device     = 'SB7x0/SB8x0/SB9x0 USB EHCI Controller'
    class      = serial bus
    subclass   = USB
    bar   [10] = type Memory, range 32, base 0xfe8ff800, size 256, enabled
    cap 01[c0] = powerspec 2  supports D0 D1 D2 D3  current D0
    cap 0a[e4] = EHCI Debug Port at offset 0xe0 in map 0x14

ohci2@pci0:0:19:0:	class=0x0c0310 rev=0x00 hdr=0x00 vendor=0x1002 device=0x4397 subvendor=0x1043 subdevice=0x8389
    vendor     = 'Advanced Micro Devices, Inc. [AMD/ATI]'
    device     = 'SB7x0/SB8x0/SB9x0 USB OHCI0 Controller'
    class      = serial bus
    subclass   = USB
    bar   [10] = type Memory, range 32, base 0xfe8fc000, size 4096, enabled

ohci3@pci0:0:19:1:	class=0x0c0310 rev=0x00 hdr=0x00 vendor=0x1002 device=0x4398 subvendor=0x1043 subdevice=0x8389
    vendor     = 'Advanced Micro Devices, Inc. [AMD/ATI]'
    device     = 'SB7x0 USB OHCI1 Controller'
    class      = serial bus
    subclass   = USB
    bar   [10] = type Memory, range 32, base 0xfe8fb000, size 4096, enabled

ehci1@pci0:0:19:2:	class=0x0c0320 rev=0x00 hdr=0x00 vendor=0x1002 device=0x4396 subvendor=0x1043 subdevice=0x8389
    vendor     = 'Advanced Micro Devices, Inc. [AMD/ATI]'
    device     = 'SB7x0/SB8x0/SB9x0 USB EHCI Controller'
    class      = serial bus
    subclass   = USB
    bar   [10] = type Memory, range 32, base 0xfe8ff400, size 256, enabled
    cap 01[c0] = powerspec 2  supports D0 D1 D2 D3  current D0
    cap 0a[e4] = EHCI Debug Port at offset 0xe0 in map 0x14

intsmb0@pci0:0:20:0:	class=0x0c0500 rev=0x3c hdr=0x00 vendor=0x1002 device=0x4385 subvendor=0x1043 subdevice=0x8389
    vendor     = 'Advanced Micro Devices, Inc. [AMD/ATI]'
    device     = 'SBx00 SMBus Controller'
    class      = serial bus
    subclass   = SMBus
    cap 08[b0] = HT MSI fixed address window disabled at 0xfee00000

atapci0@pci0:0:20:1:	class=0x01018a rev=0x00 hdr=0x00 vendor=0x1002 device=0x439c subvendor=0x1043 subdevice=0x8389
    vendor     = 'Advanced Micro Devices, Inc. [AMD/ATI]'
    device     = 'SB7x0/SB8x0/SB9x0 IDE Controller'
    class      = mass storage
    subclass   = ATA
    bar   [20] = type I/O Port, range 32, base 0xff00, size 16, enabled
    cap 05[70] = MSI supports 2 messages 

hdac0@pci0:0:20:2:	class=0x040300 rev=0x00 hdr=0x00 vendor=0x1002 device=0x4383 subvendor=0x1043 subdevice=0x8445
    vendor     = 'Advanced Micro Devices, Inc. [AMD/ATI]'
    device     = 'SBx00 Azalia (Intel HDA)'
    class      = multimedia
    subclass   = HDA
    bar   [10] = type Memory, range 64, base 0xfe8f4000, size 16384, enabled
    cap 01[50] = powerspec 2  supports D0 D3  current D0

isab0@pci0:0:20:3:	class=0x060100 rev=0x00 hdr=0x00 vendor=0x1002 device=0x439d subvendor=0x1043 subdevice=0x8389
    vendor     = 'Advanced Micro Devices, Inc. [AMD/ATI]'
    device     = 'SB7x0/SB8x0/SB9x0 LPC host controller'
    class      = bridge
    subclass   = PCI-ISA

pcib3@pci0:0:20:4:	class=0x060401 rev=0x00 hdr=0x01 vendor=0x1002 device=0x4384 subvendor=0x0000 subdevice=0x0000
    vendor     = 'Advanced Micro Devices, Inc. [AMD/ATI]'
    device     = 'SBx00 PCI to PCI Bridge'
    class      = bridge
    subclass   = PCI-PCI

ohci4@pci0:0:20:5:	class=0x0c0310 rev=0x00 hdr=0x00 vendor=0x1002 device=0x4399 subvendor=0x1043 subdevice=0x8389
    vendor     = 'Advanced Micro Devices, Inc. [AMD/ATI]'
    device     = 'SB7x0/SB8x0/SB9x0 USB OHCI2 Controller'
    class      = serial bus
    subclass   = USB
    bar   [10] = type Memory, range 32, base 0xfe8fa000, size 4096, enabled

hostb1@pci0:0:24:0:	class=0x060000 rev=0x00 hdr=0x00 vendor=0x1022 device=0x1600 subvendor=0x0000 subdevice=0x0000
    vendor     = 'Advanced Micro Devices, Inc. [AMD]'
    device     = 'Family 15h Processor Function 0'
    class      = bridge
    subclass   = HOST-PCI
    cap 08[80] = HT host

hostb2@pci0:0:24:1:	class=0x060000 rev=0x00 hdr=0x00 vendor=0x1022 device=0x1601 subvendor=0x0000 subdevice=0x0000
    vendor     = 'Advanced Micro Devices, Inc. [AMD]'
    device     = 'Family 15h Processor Function 1'
    class      = bridge
    subclass   = HOST-PCI

hostb3@pci0:0:24:2:	class=0x060000 rev=0x00 hdr=0x00 vendor=0x1022 device=0x1602 subvendor=0x0000 subdevice=0x0000
    vendor     = 'Advanced Micro Devices, Inc. [AMD]'
    device     = 'Family 15h Processor Function 2'
    class      = bridge
    subclass   = HOST-PCI

hostb4@pci0:0:24:3:	class=0x060000 rev=0x00 hdr=0x00 vendor=0x1022 device=0x1603 subvendor=0x0000 subdevice=0x0000
    vendor     = 'Advanced Micro Devices, Inc. [AMD]'
    device     = 'Family 15h Processor Function 3'
    class      = bridge
    subclass   = HOST-PCI
    cap 0f[f0] = unknown

hostb5@pci0:0:24:4:	class=0x060000 rev=0x00 hdr=0x00 vendor=0x1022 device=0x1604 subvendor=0x0000 subdevice=0x0000
    vendor     = 'Advanced Micro Devices, Inc. [AMD]'
    device     = 'Family 15h Processor Function 4'
    class      = bridge
    subclass   = HOST-PCI

hostb6@pci0:0:24:5:	class=0x060000 rev=0x00 hdr=0x00 vendor=0x1022 device=0x1605 subvendor=0x0000 subdevice=0x0000
    vendor     = 'Advanced Micro Devices, Inc. [AMD]'
    device     = 'Family 15h Processor Function 5'
    class      = bridge
    subclass   = HOST-PCI

vgapci0@pci0:1:5:0:	class=0x030000 rev=0x00 hdr=0x00 vendor=0x1002 device=0x9616 subvendor=0x1043 subdevice=0x8388
    vendor     = 'Advanced Micro Devices, Inc. [AMD/ATI]'
    device     = 'RS780L [Radeon 3000]'
    class      = display
    subclass   = VGA
    bar   [10] = type Prefetchable Memory, range 32, base 0xd0000000, size 268435456, enabled
    bar   [14] = type I/O Port, range 32, base 0xc000, size 256, enabled
    bar   [18] = type Memory, range 32, base 0xfeae0000, size 65536, enabled
    bar   [24] = type Memory, range 32, base 0xfe900000, size 1048576, enabled
    cap 01[50] = powerspec 3  supports D0 D1 D2 D3  current D0
    cap 05[a0] = MSI supports 1 message, 64 bit 

re0@pci0:2:0:0:	class=0x020000 rev=0x09 hdr=0x00 vendor=0x10ec device=0x8168 subvendor=0x1043 subdevice=0x8505
    vendor     = 'Realtek Semiconductor Co., Ltd.'
    device     = 'RTL8111/8168/8411 PCI Express Gigabit Ethernet Controller'
    class      = network
    subclass   = ethernet
    bar   [10] = type I/O Port, range 32, base 0xd800, size 256, enabled
    bar   [18] = type Prefetchable Memory, range 64, base 0xfdfff000, size 4096, enabled
    bar   [20] = type Prefetchable Memory, range 64, base 0xfdff8000, size 16384, enabled
    cap 01[40] = powerspec 3  supports D0 D1 D2 D3  current D0
    cap 05[50] = MSI supports 1 message, 64 bit 
    cap 10[70] = PCI-Express 2 endpoint MSI 1 max data 128(128) RO
                 max read 4096
                 link x1(x1) speed 2.5(2.5) ASPM disabled(L0s/L1) ClockPM disabled
    cap 11[b0] = MSI-X supports 4 messages, enabled
                 Table in map 0x20[0x0], PBA in map 0x20[0x800]
    cap 03[d0] = VPD
    ecap 0001[100] = AER 1 0 fatal 0 non-fatal 3 corrected
    ecap 0002[140] = VC 1 max VC0
    ecap 0003[160] = Serial 1 0000000000000000

re1@pci0:3:5:0:	class=0x020000 rev=0x10 hdr=0x00 vendor=0x10ec device=0x8169 subvendor=0x1385 subdevice=0x311a
    vendor     = 'Realtek Semiconductor Co., Ltd.'
    device     = 'RTL8169 PCI Gigabit Ethernet Controller'
    class      = network
    subclass   = ethernet
    bar   [10] = type I/O Port, range 32, base 0xe800, size 256, enabled
    bar   [14] = type Memory, range 32, base 0xfebffc00, size 256, enabled
    cap 01[dc] = powerspec 2  supports D0 D1 D2 D3  current D0
