hostb0@pci0:0:0:0:	class=0x060000 card=0x312a17aa chip=0x3ec28086 rev=0x07 hdr=0x00
    vendor     = 'Intel Corporation'
    device     = '8th Gen Core Processor Host Bridge/DRAM Registers'
    class      = bridge
    subclass   = HOST-PCI
    cap 09[e0] = vendor (length 16) Intel cap 0 version 1

vgapci0@pci0:0:2:0:	class=0x030000 card=0x312a17aa chip=0x3e928086 rev=0x00 hdr=0x00
    vendor     = 'Intel Corporation'
    device     = 'CometLake-S GT2 [UHD Graphics 630]'
    class      = display
    subclass   = VGA
    bar   [10] = type Memory, range 64, base 0xb0000000, size 16777216, enabled
    bar   [18] = type Prefetchable Memory, range 64, base 0xa0000000, size 268435456, enabled
    bar   [20] = type I/O Port, range 32, base 0x4000, size 64, enabled
    cap 09[40] = vendor (length 12) Intel cap 0 version 1
    cap 10[70] = PCI-Express 2 root endpoint max data 128(128) FLR
    cap 05[ac] = MSI supports 1 message enabled with 1 message
    cap 01[d0] = powerspec 2  supports D0 D3  current D0
    ecap 001b[100] = Process Address Space ID 1
    ecap 000f[200] = ATS 1
    ecap 0013[300] = Page Page Request 1

none0@pci0:0:8:0:	class=0x088000 card=0x312a17aa chip=0x19118086 rev=0x00 hdr=0x00
    vendor     = 'Intel Corporation'
    device     = 'Xeon E3-1200 v5/v6 / E3-1500 v5 / 6th/7th/8th Gen Core Processor Gaussian Mixture Model'
    class      = base peripheral
    bar   [10] = type Memory, range 64, base 0xb133d000, size 4096, enabled
    cap 05[90] = MSI supports 1 message 
    cap 01[dc] = powerspec 2  supports D0 D3  current D0
    cap 13[f0] = PCI Advanced Features: FLR TP

xhci0@pci0:0:20:0:	class=0x0c0330 card=0x312a17aa chip=0xa36d8086 rev=0x10 hdr=0x00
    vendor     = 'Intel Corporation'
    device     = 'Cannon Lake PCH USB 3.1 xHCI Host Controller'
    class      = serial bus
    subclass   = USB
    bar   [10] = type Memory, range 64, base 0xb1320000, size 65536, enabled
    cap 01[70] = powerspec 2  supports D0 D3  current D0
    cap 05[80] = MSI supports 8 messages, 64 bit enabled with 1 message
    cap 09[90] = vendor (length 20) Intel cap 15 version 0

none1@pci0:0:20:2:	class=0x050000 card=0x312a17aa chip=0xa36f8086 rev=0x10 hdr=0x00
    vendor     = 'Intel Corporation'
    device     = 'Cannon Lake PCH Shared SRAM'
    class      = memory
    subclass   = RAM
    bar   [10] = type Memory, range 64, base 0xb1336000, size 8192, enabled
    bar   [18] = type Memory, range 64, base 0xb133c000, size 4096, enabled
    cap 01[80] = powerspec 3  supports D0 D3  current D0

none2@pci0:0:22:0:	class=0x078000 card=0x312a17aa chip=0xa3608086 rev=0x10 hdr=0x00
    vendor     = 'Intel Corporation'
    device     = 'Cannon Lake PCH HECI Controller'
    class      = simple comms
    bar   [10] = type Memory, range 64, base 0xb133b000, size 4096, enabled
    cap 01[50] = powerspec 3  supports D0 D3  current D0
    cap 05[8c] = MSI supports 1 message, 64 bit 
    cap 09[a4] = vendor (length 20) Intel cap 15 version 0

ahci0@pci0:0:23:0:	class=0x010601 card=0x312a17aa chip=0xa3528086 rev=0x10 hdr=0x00
    vendor     = 'Intel Corporation'
    device     = 'Cannon Lake PCH SATA AHCI Controller'
    class      = mass storage
    subclass   = SATA
    bar   [10] = type Memory, range 32, base 0xb1334000, size 8192, enabled
    bar   [14] = type Memory, range 32, base 0xb133a000, size 256, enabled
    bar   [18] = type I/O Port, range 32, base 0x4090, size 8, enabled
    bar   [1c] = type I/O Port, range 32, base 0x4080, size 4, enabled
    bar   [20] = type I/O Port, range 32, base 0x4060, size 32, enabled
    bar   [24] = type Memory, range 32, base 0xb1339000, size 2048, enabled
    cap 05[80] = MSI supports 1 message enabled with 1 message
    cap 01[70] = powerspec 3  supports D0 D3  current D0
    cap 12[a8] = SATA Index-Data Pair

pcib1@pci0:0:27:0:	class=0x060400 card=0x312a17aa chip=0xa32c8086 rev=0xf0 hdr=0x01
    vendor     = 'Intel Corporation'
    device     = 'Cannon Lake PCH PCI Express Root Port'
    class      = bridge
    subclass   = PCI-PCI
    cap 10[40] = PCI-Express 2 root port max data 256(256) ARI disabled
                 link x4(x4) speed 8.0(8.0) ASPM L1(L0s/L1)
                 slot 24 power limit 250 mW
    cap 05[80] = MSI supports 1 message 
    cap 0d[90] = PCI Bridge card=0x312a17aa
    cap 01[a0] = powerspec 3  supports D0 D3  current D0
    ecap 0001[100] = AER 1 0 fatal 0 non-fatal 0 corrected
    ecap 000d[140] = ACS 1
    ecap 001f[150] = Precision Time Measurement 1
    ecap 001e[200] = L1 PM Substates 1
    ecap 0019[220] = PCIe Sec 1 lane errors 0
    ecap 001d[250] = Downstream Port Containment 1

pcib2@pci0:0:29:0:	class=0x060400 card=0x312a17aa chip=0xa3308086 rev=0xf0 hdr=0x01
    vendor     = 'Intel Corporation'
    device     = 'Cannon Lake PCH PCI Express Root Port'
    class      = bridge
    subclass   = PCI-PCI
    cap 10[40] = PCI-Express 2 root port max data 128(256) ARI disabled
                 link x1(x4) speed 2.5(8.0) ASPM L1(L0s/L1)
                 slot 12 power limit 250 mW
    cap 05[80] = MSI supports 1 message 
    cap 0d[90] = PCI Bridge card=0x312a17aa
    cap 01[a0] = powerspec 3  supports D0 D3  current D0
    ecap 0001[100] = AER 1 0 fatal 0 non-fatal 0 corrected
    ecap 000d[140] = ACS 1
    ecap 001f[150] = Precision Time Measurement 1
    ecap 001e[200] = L1 PM Substates 1
    ecap 0019[220] = PCIe Sec 1 lane errors 0
    ecap 001d[250] = Downstream Port Containment 1

isab0@pci0:0:31:0:	class=0x060100 card=0x312a17aa chip=0xa3088086 rev=0x10 hdr=0x00
    vendor     = 'Intel Corporation'
    class      = bridge
    subclass   = PCI-ISA

hdac0@pci0:0:31:3:	class=0x040380 card=0x312a17aa chip=0xa3488086 rev=0x10 hdr=0x00
    vendor     = 'Intel Corporation'
    device     = 'Cannon Lake PCH cAVS'
    class      = multimedia
    subclass   = HDA
    bar   [10] = type Memory, range 64, base 0xb1330000, size 16384, enabled
    bar   [20] = type Memory, range 64, base 0xb1000000, size 1048576, enabled
    cap 01[50] = powerspec 3  supports D0 D3  current D0
    cap 09[80] = vendor (length 20) Intel cap 15 version 0
    cap 05[60] = MSI supports 1 message, 64 bit enabled with 1 message

none3@pci0:0:31:4:	class=0x0c0500 card=0x312a17aa chip=0xa3238086 rev=0x10 hdr=0x00
    vendor     = 'Intel Corporation'
    device     = 'Cannon Lake PCH SMBus Controller'
    class      = serial bus
    subclass   = SMBus
    bar   [10] = type Memory, range 64, base 0xb1338000, size 256, enabled
    bar   [20] = type I/O Port, range 32, base 0xefa0, size 32, enabled

none4@pci0:0:31:5:	class=0x0c8000 card=0x312a17aa chip=0xa3248086 rev=0x10 hdr=0x00
    vendor     = 'Intel Corporation'
    device     = 'Cannon Lake PCH SPI Controller'
    class      = serial bus
    bar   [10] = type Memory, range 32, base 0xfe010000, size 4096, enabled

em0@pci0:0:31:6:	class=0x020000 card=0x312a17aa chip=0x15bc8086 rev=0x10 hdr=0x00
    vendor     = 'Intel Corporation'
    device     = 'Ethernet Connection (7) I219-V'
    class      = network
    subclass   = ethernet
    bar   [10] = type Memory, range 32, base 0xb1300000, size 131072, enabled
    cap 01[c8] = powerspec 3  supports D0 D3  current D0
    cap 05[d0] = MSI supports 1 message, 64 bit enabled with 1 message

nvme0@pci0:1:0:0:	class=0x010802 card=0x00011179 chip=0x01161179 rev=0x00 hdr=0x00
    vendor     = 'Toshiba Corporation'
    class      = mass storage
    subclass   = NVM
    bar   [10] = type Memory, range 64, base 0xb1200000, size 16384, enabled
    cap 10[40] = PCI-Express 2 endpoint max data 256(256) FLR
                 link x4(x4) speed 8.0(8.0) ASPM L1(L1)
    cap 01[80] = powerspec 3  supports D0 D3  current D0
    cap 05[90] = MSI supports 32 messages, 64 bit, vector masks 
    cap 11[b0] = MSI-X supports 32 messages, enabled
                 Table in map 0x10[0x2000], PBA in map 0x10[0x3000]
    ecap 0001[100] = AER 2 0 fatal 0 non-fatal 0 corrected
    ecap 0018[260] = LTR 1
    ecap 0019[300] = PCIe Sec 1 lane errors 0
    ecap 001e[400] = L1 PM Substates 1

rtwn0@pci0:2:0:0:	class=0x028000 card=0x817810ec chip=0x817810ec rev=0x01 hdr=0x00
    vendor     = 'Realtek Semiconductor Co., Ltd.'
    device     = 'RTL8192CE PCIe Wireless Network Adapter'
    class      = network
    bar   [10] = type I/O Port, range 32, base 0x3000, size 256, enabled
    bar   [18] = type Memory, range 64, base 0xb1100000, size 16384, enabled
    cap 01[40] = powerspec 3  supports D0 D1 D2 D3  current D0
    cap 05[50] = MSI supports 1 message, 64 bit enabled with 1 message
    cap 10[70] = PCI-Express 2 endpoint max data 128(128) RO
                 link x1(x1) speed 2.5(2.5) ASPM disabled(L0s/L1) ClockPM enabled
    ecap 0001[100] = AER 1 0 fatal 0 non-fatal 0 corrected
    ecap 0002[140] = VC 1 max VC0
    ecap 0003[160] = Serial 1 019181feff4ce000
