pcib1@pci0:0:0:0:	class=0x060400 rev=0xa1 hdr=0x01 vendor=0x10de device=0x0fae subvendor=0x10de subdevice=0x0000
    vendor     = 'NVIDIA Corporation'
    class      = bridge
    subclass   = PCI-PCI
    cap 0d[40] = PCI Bridge subvendor=0x10de subdevice=0x0000
    cap 01[48] = powerspec 3  supports D0 D3  current D0
    cap 05[50] = MSI supports 2 messages, 64 bit 
    cap 08[60] = HT MSI address window disabled at 0xfee00000
    cap 10[80] = PCI-Express 2 root port max data 128(128) RO NS
                 link x1(x4) speed 2.5(5.0) ASPM disabled(L0s)
                 slot 0 power limit 0 mW
    ecap 0000[100] = unknown 0
    ecap 001e[140] = L1 PM Substates 1

pcib2@pci0:0:1:0:	class=0x060400 rev=0xa1 hdr=0x01 vendor=0x10de device=0x0faf subvendor=0x10de subdevice=0x0000
    vendor     = 'NVIDIA Corporation'
    class      = bridge
    subclass   = PCI-PCI
    cap 0d[40] = PCI Bridge subvendor=0x10de subdevice=0x0000
    cap 01[48] = powerspec 3  supports D0 D3  current D0
    cap 05[50] = MSI supports 2 messages, 64 bit 
    cap 08[60] = HT MSI address window disabled at 0xfee00000
    cap 10[80] = PCI-Express 2 root port max data 128(128) RO NS
                 link x1(x1) speed 2.5(5.0) ASPM disabled(L0s)
                 slot 0 power limit 0 mW
    ecap 0000[100] = unknown 0
    ecap 001e[140] = L1 PM Substates 1

re0@pci0:1:0:0:	class=0x020000 rev=0x06 hdr=0x00 vendor=0x10ec device=0x8168 subvendor=0x10ec subdevice=0x0123
    vendor     = 'Realtek Semiconductor Co., Ltd.'
    device     = 'RTL8111/8168/8411 PCI Express Gigabit Ethernet Controller'
    class      = network
    subclass   = ethernet
    bar   [10] = type I/O Port, range 32, base 0, size 256, disabled
    bar   [18] = type Prefetchable Memory, range 64, base 0x20000000, size 4096, enabled
    bar   [20] = type Prefetchable Memory, range 64, base 0x20004000, size 16384, enabled
    cap 01[40] = powerspec 3  supports D0 D1 D2 D3  current D0
    cap 05[50] = MSI supports 1 message, 64 bit enabled with 1 message
    cap 10[70] = PCI-Express 2 endpoint MSI 1 max data 128(256) RO
                 link x1(x1) speed 2.5(2.5) ASPM disabled(L0s/L1) ClockPM disabled
    cap 11[b0] = MSI-X supports 4 messages
                 Table in map 0x20[0x0], PBA in map 0x20[0x800]
    cap 03[d0] = VPD
    ecap 0001[100] = AER 1 1 fatal 0 non-fatal 5 corrected
    ecap 0002[140] = VC 1 max VC0
    ecap 0003[160] = Serial 1 01000000684ce000
