none0@pci0:0:0:0:	class=0x050000 card=0x26011019 chip=0x03ea10de rev=0xa1 hdr=0x00
    vendor     = 'NVIDIA Corporation'
    device     = 'MCP61 Memory Controller'
    class      = memory
    subclass   = RAM
    cap 08[44] = HT slave
    cap 08[dc] = HT MSI address window enabled at 0xfee00000

isab0@pci0:0:1:0:	class=0x060100 card=0x26011019 chip=0x03e010de rev=0xa2 hdr=0x00
    vendor     = 'NVIDIA Corporation'
    device     = 'MCP61 LPC Bridge'
    class      = bridge
    subclass   = PCI-ISA

none1@pci0:0:1:1:	class=0x0c0500 card=0x26011019 chip=0x03eb10de rev=0xa2 hdr=0x00
    vendor     = 'NVIDIA Corporation'
    device     = 'MCP61 SMBus'
    class      = serial bus
    subclass   = SMBus
    bar   [10] = type I/O Port, range 32, base 0xfc00, size 64, enabled
    bar   [20] = type I/O Port, range 32, base 0x1c00, size 64, enabled
    bar   [24] = type I/O Port, range 32, base 0xf400, size 64, enabled
    cap 01[44] = powerspec 2  supports D0 D3  current D0

none2@pci0:0:1:2:	class=0x050000 card=0x26011019 chip=0x03f510de rev=0xa2 hdr=0x00
    vendor     = 'NVIDIA Corporation'
    device     = 'MCP61 Memory Controller'
    class      = memory
    subclass   = RAM

ohci0@pci0:0:2:0:	class=0x0c0310 card=0x26011019 chip=0x03f110de rev=0xa2 hdr=0x00
    vendor     = 'NVIDIA Corporation'
    device     = 'MCP61 USB 1.1 Controller'
    class      = serial bus
    subclass   = USB
    bar   [10] = type Memory, range 32, base 0xfe02f000, size 4096, enabled
    cap 01[44] = powerspec 2  supports D0 D1 D2 D3  current D0

ehci0@pci0:0:2:1:	class=0x0c0320 card=0x26011019 chip=0x03f210de rev=0xa2 hdr=0x00
    vendor     = 'NVIDIA Corporation'
    device     = 'MCP61 USB 2.0 Controller'
    class      = serial bus
    subclass   = USB
    bar   [10] = type Memory, range 32, base 0xfe02e000, size 256, enabled
    cap 0a[44] = EHCI Debug Port at offset 0x98 in map 0x14
    cap 01[80] = powerspec 2  supports D0 D1 D2 D3  current D0

pcib1@pci0:0:4:0:	class=0x060401 card=0xcb8410de chip=0x03f310de rev=0xa1 hdr=0x01
    vendor     = 'NVIDIA Corporation'
    device     = 'MCP61 PCI bridge'
    class      = bridge
    subclass   = PCI-PCI
    cap 0d[b8] = PCI Bridge card=0xcb8410de
    cap 08[8c] = HT MSI address window disabled at 0xfee00000

hdac0@pci0:0:5:0:	class=0x040300 card=0xa88d1019 chip=0x03f010de rev=0xa2 hdr=0x00
    vendor     = 'NVIDIA Corporation'
    device     = 'MCP61 High Definition Audio'
    class      = multimedia
    subclass   = HDA
    bar   [10] = type Memory, range 32, base 0xfe028000, size 16384, enabled
    cap 01[44] = powerspec 2  supports D0 D3  current D0
    cap 05[50] = MSI supports 1 message, 64 bit, vector masks enabled with 1 message
    cap 08[6c] = HT MSI fixed address window enabled at 0xfee00000

atapci0@pci0:0:6:0:	class=0x01018a card=0x26011019 chip=0x03ec10de rev=0xa2 hdr=0x00
    vendor     = 'NVIDIA Corporation'
    device     = 'MCP61 IDE'
    class      = mass storage
    subclass   = ATA
    bar   [20] = type I/O Port, range 32, base 0xf000, size 16, enabled
    cap 01[44] = powerspec 2  supports D0 D3  current D0

atapci1@pci0:0:8:0:	class=0x010185 card=0x26011019 chip=0x03f610de rev=0xa2 hdr=0x00
    vendor     = 'NVIDIA Corporation'
    device     = 'MCP61 SATA Controller'
    class      = mass storage
    subclass   = ATA
    bar   [10] = type I/O Port, range 32, base 0x9f0, size 8, enabled
    bar   [14] = type I/O Port, range 32, base 0xbf0, size 4, enabled
    bar   [18] = type I/O Port, range 32, base 0x970, size 8, enabled
    bar   [1c] = type I/O Port, range 32, base 0xb70, size 4, enabled
    bar   [20] = type I/O Port, range 32, base 0xdc00, size 16, enabled
    bar   [24] = type Memory, range 32, base 0xfe02d000, size 4096, enabled
    cap 01[44] = powerspec 2  supports D0 D3  current D0
    cap 05[b0] = MSI supports 4 messages, 64 bit 
    cap 08[cc] = HT MSI fixed address window disabled at 0xfee00000

pcib2@pci0:0:9:0:	class=0x060400 card=0x000010de chip=0x03e810de rev=0xa2 hdr=0x01
    vendor     = 'NVIDIA Corporation'
    device     = 'MCP61 PCI Express bridge'
    class      = bridge
    subclass   = PCI-PCI
    cap 0d[40] = PCI Bridge card=0x000010de
    cap 01[48] = powerspec 2  supports D0 D3  current D0
    cap 05[50] = MSI supports 2 messages, 64 bit 
    cap 08[60] = HT MSI address window disabled at 0xfee00000
    cap 10[80] = PCI-Express 1 root port max data 256(256) RO NS
                 link x16(x16) speed 2.5(2.5) ASPM disabled(L0s/L1)
                 slot 1 power limit 75000 mW
    ecap 0002[100] = VC 1 max VC0

pcib3@pci0:0:11:0:	class=0x060400 card=0x000010de chip=0x03e910de rev=0xa2 hdr=0x01
    vendor     = 'NVIDIA Corporation'
    device     = 'MCP61 PCI Express bridge'
    class      = bridge
    subclass   = PCI-PCI
    cap 0d[40] = PCI Bridge card=0x000010de
    cap 01[48] = powerspec 2  supports D0 D3  current D0
    cap 05[50] = MSI supports 2 messages, 64 bit 
    cap 08[60] = HT MSI address window enabled at 0xfee00000
    cap 10[80] = PCI-Express 1 root port max data 128(256) RO NS
                 link x1(x1) speed 2.5(2.5) ASPM disabled(L0s/L1)
                 slot 2 power limit 10000 mW
    ecap 0002[100] = VC 1 max VC0

pcib4@pci0:0:12:0:	class=0x060400 card=0x000010de chip=0x03e910de rev=0xa2 hdr=0x01
    vendor     = 'NVIDIA Corporation'
    device     = 'MCP61 PCI Express bridge'
    class      = bridge
    subclass   = PCI-PCI
    cap 0d[40] = PCI Bridge card=0x000010de
    cap 01[48] = powerspec 2  supports D0 D3  current D0
    cap 05[50] = MSI supports 2 messages, 64 bit 
    cap 08[60] = HT MSI address window disabled at 0xfee00000
    cap 10[80] = PCI-Express 1 root port max data 256(256) RO NS
                 link x1(x1) speed 2.5(2.5) ASPM disabled(L0s/L1)
                 slot 3 power limit 10000 mW
    ecap 0002[100] = VC 1 max VC0

vgapci0@pci0:0:13:0:	class=0x030000 card=0x26011019 chip=0x03d110de rev=0xa2 hdr=0x00
    vendor     = 'NVIDIA Corporation'
    device     = 'C61 [GeForce 6100 nForce 405]'
    class      = display
    subclass   = VGA
    bar   [10] = type Memory, range 32, base 0xfb000000, size 16777216, enabled
    bar   [14] = type Prefetchable Memory, range 64, base 0xe0000000, size 268435456, enabled
    bar   [1c] = type Memory, range 64, base 0xfc000000, size 16777216, enabled
    cap 01[48] = powerspec 2  supports D0 D3  current D0
    cap 05[50] = MSI supports 1 message, 64 bit 

hostb0@pci0:0:24:0:	class=0x060000 card=0x00000000 chip=0x11001022 rev=0x00 hdr=0x00
    vendor     = 'Advanced Micro Devices, Inc. [AMD]'
    device     = 'K8 [Athlon64/Opteron] HyperTransport Technology Configuration'
    class      = bridge
    subclass   = HOST-PCI
    cap 08[80] = HT host

hostb1@pci0:0:24:1:	class=0x060000 card=0x00000000 chip=0x11011022 rev=0x00 hdr=0x00
    vendor     = 'Advanced Micro Devices, Inc. [AMD]'
    device     = 'K8 [Athlon64/Opteron] Address Map'
    class      = bridge
    subclass   = HOST-PCI

hostb2@pci0:0:24:2:	class=0x060000 card=0x00000000 chip=0x11021022 rev=0x00 hdr=0x00
    vendor     = 'Advanced Micro Devices, Inc. [AMD]'
    device     = 'K8 [Athlon64/Opteron] DRAM Controller'
    class      = bridge
    subclass   = HOST-PCI

hostb3@pci0:0:24:3:	class=0x060000 card=0x00000000 chip=0x11031022 rev=0x00 hdr=0x00
    vendor     = 'Advanced Micro Devices, Inc. [AMD]'
    device     = 'K8 [Athlon64/Opteron] Miscellaneous Control'
    class      = bridge
    subclass   = HOST-PCI
    cap 0f[f0] = unknown

none3@pci0:1:9:0:	class=0x0c0010 card=0x80561019 chip=0x8024104c rev=0x00 hdr=0x00
    vendor     = 'Texas Instruments'
    device     = 'TSB43AB23 IEEE-1394a-2000 Controller (PHY/Link)'
    class      = serial bus
    subclass   = FireWire
    bar   [10] = type Memory, range 32, base 0xfd8ff000, size 2048, enabled
    bar   [14] = type Memory, range 32, base 0xfd8f8000, size 16384, enabled
    cap 01[44] = powerspec 2  supports D0 D1 D2 D3  current D0

mskc0@pci0:3:0:0:	class=0x020000 card=0x80561019 chip=0x436411ab rev=0x12 hdr=0x00
    vendor     = 'Marvell Technology Group Ltd.'
    device     = '88E8056 PCI-E Gigabit Ethernet Controller'
    class      = network
    subclass   = ethernet
    bar   [10] = type Memory, range 64, base 0xfdcfc000, size 16384, enabled
    bar   [18] = type I/O Port, range 32, base 0xac00, size 256, enabled
    cap 01[48] = powerspec 3  supports D0 D1 D2 D3  current D0
    cap 03[50] = VPD
    cap 05[5c] = MSI supports 1 message, 64 bit enabled with 1 message
    cap 10[e0] = PCI-Express 1 legacy endpoint max data 128(128)
                 link x1(x1) speed 2.5(2.5) ASPM disabled(L0s)
    ecap 0001[100] = AER 1 0 fatal 0 non-fatal 1 corrected
