hostb0@pci0:0:0:0:	class=0x060000 card=0x380217aa chip=0x3ec48086 rev=0x07 hdr=0x00
    vendor     = 'Intel Corporation'
    device     = '8th Gen Core Processor Host Bridge/DRAM Registers'
    class      = bridge
    subclass   = HOST-PCI
    cap 09[e0] = vendor (length 16) Intel cap 0 version 1

pcib1@pci0:0:1:0:	class=0x060400 card=0x380c17aa chip=0x19018086 rev=0x07 hdr=0x01
    vendor     = 'Intel Corporation'
    device     = '6th-9th Gen Core Processor PCIe Controller (x16)'
    class      = bridge
    subclass   = PCI-PCI
    cap 0d[88] = PCI Bridge card=0x380c17aa
    cap 01[80] = powerspec 3  supports D0 D3  current D0
    cap 05[90] = MSI supports 1 message 
    cap 10[a0] = PCI-Express 2 root port max data 256(256)
                 link x16(x16) speed 8.0(8.0) ASPM disabled(L0s/L1)
                 slot 1 power limit 75000 mW
    ecap 0002[100] = VC 1 max VC0
    ecap 0005[140] = Root Complex Link Declaration 1
    ecap 0019[d94] = PCIe Sec 1 lane errors 0

vgapci1@pci0:0:2:0:	class=0x030000 card=0x39fd17aa chip=0x3e9b8086 rev=0x00 hdr=0x00
    vendor     = 'Intel Corporation'
    device     = 'UHD Graphics 630 (Mobile)'
    class      = display
    subclass   = VGA
    bar   [10] = type Memory, range 64, base 0xa2000000, size 16777216, enabled
    bar   [18] = type Prefetchable Memory, range 64, base 0xb0000000, size 268435456, enabled
    bar   [20] = type I/O Port, range 32, base 0x5000, size 64, enabled
    cap 09[40] = vendor (length 12) Intel cap 0 version 1
    cap 10[70] = PCI-Express 2 root endpoint max data 128(128) FLR
    cap 05[ac] = MSI supports 1 message enabled with 1 message
    cap 01[d0] = powerspec 2  supports D0 D3  current D0
    ecap 001b[100] = unknown 1
    ecap 000f[200] = ATS 1
    ecap 0013[300] = unknown 1

none0@pci0:0:4:0:	class=0x118000 card=0x381f17aa chip=0x19038086 rev=0x07 hdr=0x00
    vendor     = 'Intel Corporation'
    device     = 'Xeon E3-1200 v5/E3-1500 v5/6th Gen Core Processor Thermal Subsystem'
    class      = dasp
    bar   [10] = type Memory, range 64, base 0xa4510000, size 32768, enabled
    cap 05[90] = MSI supports 1 message 
    cap 01[d0] = powerspec 3  supports D0 D3  current D0
    cap 09[e0] = vendor (length 12) Intel cap 0 version 1

none1@pci0:0:8:0:	class=0x088000 card=0x384e17aa chip=0x19118086 rev=0x00 hdr=0x00
    vendor     = 'Intel Corporation'
    device     = 'Xeon E3-1200 v5/v6 / E3-1500 v5 / 6th/7th/8th Gen Core Processor Gaussian Mixture Model'
    class      = base peripheral
    bar   [10] = type Memory, range 64, base 0xa4520000, size 4096, enabled
    cap 05[90] = MSI supports 1 message 
    cap 01[dc] = powerspec 2  supports D0 D3  current D0
    cap 13[f0] = PCI Advanced Features: FLR TP

none2@pci0:0:18:0:	class=0x118000 card=0x380717aa chip=0xa3798086 rev=0x10 hdr=0x00
    vendor     = 'Intel Corporation'
    device     = 'Cannon Lake PCH Thermal Controller'
    class      = dasp
    bar   [10] = type Memory, range 64, base 0xa4521000, size 4096, enabled
    cap 01[50] = powerspec 3  supports D0 D3  current D0
    cap 05[80] = MSI supports 1 message 

xhci0@pci0:0:20:0:	class=0x0c0330 card=0x380317aa chip=0xa36d8086 rev=0x10 hdr=0x00
    vendor     = 'Intel Corporation'
    device     = 'Cannon Lake PCH USB 3.1 xHCI Host Controller'
    class      = serial bus
    subclass   = USB
    bar   [10] = type Memory, range 64, base 0xa4500000, size 65536, enabled
    cap 01[70] = powerspec 2  supports D0 D3  current D0
    cap 05[80] = MSI supports 8 messages, 64 bit enabled with 1 message
    cap 09[90] = vendor (length 20) Intel cap 15 version 0

none3@pci0:0:20:2:	class=0x050000 card=0x380117aa chip=0xa36f8086 rev=0x10 hdr=0x00
    vendor     = 'Intel Corporation'
    device     = 'Cannon Lake PCH Shared SRAM'
    class      = memory
    subclass   = RAM
    bar   [10] = type Memory, range 64, base 0xa451c000, size 8192, enabled
    bar   [18] = type Memory, range 64, base 0xa4522000, size 4096, enabled
    cap 01[80] = powerspec 3  supports D0 D3  current D0

none4@pci0:0:21:0:	class=0x0c8000 card=0x380617aa chip=0xa3688086 rev=0x10 hdr=0x00
    vendor     = 'Intel Corporation'
    device     = 'Cannon Lake PCH Serial IO I2C Controller'
    class      = serial bus
    bar   [10] = type Memory, range 64, base 0, size 4096, disabled
    cap 01[80] = powerspec 3  supports D0 D3  current D0
    cap 09[90] = vendor (length 20) Intel cap 15 version 0

none5@pci0:0:21:1:	class=0x0c8000 card=0x380917aa chip=0xa3698086 rev=0x10 hdr=0x00
    vendor     = 'Intel Corporation'
    device     = 'Cannon Lake PCH Serial IO I2C Controller'
    class      = serial bus
    bar   [10] = type Memory, range 64, base 0, size 4096, disabled
    cap 01[80] = powerspec 3  supports D0 D3  current D0
    cap 09[90] = vendor (length 20) Intel cap 15 version 0

none6@pci0:0:22:0:	class=0x078000 card=0x380e17aa chip=0xa3608086 rev=0x10 hdr=0x00
    vendor     = 'Intel Corporation'
    device     = 'Cannon Lake PCH HECI Controller'
    class      = simple comms
    bar   [10] = type Memory, range 64, base 0xa4525000, size 4096, enabled
    cap 01[50] = powerspec 3  supports D0 D3  current D0
    cap 05[8c] = MSI supports 1 message, 64 bit 
    cap 09[a4] = vendor (length 20) Intel cap 15 version 0

ahci0@pci0:0:23:0:	class=0x010601 card=0x380a17aa chip=0xa3538086 rev=0x10 hdr=0x00
    vendor     = 'Intel Corporation'
    device     = 'Cannon Lake Mobile PCH SATA AHCI Controller'
    class      = mass storage
    subclass   = SATA
    bar   [10] = type Memory, range 32, base 0xa451e000, size 8192, enabled
    bar   [14] = type Memory, range 32, base 0xa452a000, size 256, enabled
    bar   [18] = type I/O Port, range 32, base 0x5080, size 8, enabled
    bar   [1c] = type I/O Port, range 32, base 0x5088, size 4, enabled
    bar   [20] = type I/O Port, range 32, base 0x5060, size 32, enabled
    bar   [24] = type Memory, range 32, base 0xa4529000, size 2048, enabled
    cap 05[80] = MSI supports 1 message enabled with 1 message
    cap 01[70] = powerspec 3  supports D0 D3  current D0
    cap 12[a8] = SATA Index-Data Pair

pcib2@pci0:0:29:0:	class=0x060400 card=0xffffffff chip=0xa3308086 rev=0xf0 hdr=0x01
    vendor     = 'Intel Corporation'
    device     = 'Cannon Lake PCH PCI Express Root Port'
    class      = bridge
    subclass   = PCI-PCI
    cap 10[40] = PCI-Express 2 root port max data 256(256) ARI disabled
                 link x2(x4) speed 8.0(8.0) ASPM L1(L0s/L1)
                 slot 8 power limit 250 mW
    cap 05[80] = MSI supports 1 message 
    cap 0d[90] = PCI Bridge card=0xffffffff
    cap 01[a0] = powerspec 3  supports D0 D3  current D0
    ecap 0001[100] = AER 1 0 fatal 0 non-fatal 0 corrected
    ecap 000d[140] = ACS 1
    ecap 001f[150] = unknown 1
    ecap 001e[200] = unknown 1
    ecap 0019[220] = PCIe Sec 1 lane errors 0
    ecap 001d[250] = unknown 1

pcib3@pci0:0:29:4:	class=0x060400 card=0x382017aa chip=0xa3348086 rev=0xf0 hdr=0x01
    vendor     = 'Intel Corporation'
    device     = 'Cannon Lake PCH PCI Express Root Port'
    class      = bridge
    subclass   = PCI-PCI
    cap 10[40] = PCI-Express 2 root port max data 128(256) ARI disabled
                 link x1(x1) speed 2.5(8.0) ASPM L1(L0s/L1)
                 slot 12 power limit 100 mW
    cap 05[80] = MSI supports 1 message 
    cap 0d[90] = PCI Bridge card=0x382017aa
    cap 01[a0] = powerspec 3  supports D0 D3  current D0
    ecap 0000[100] = unknown 0
    ecap 000d[140] = ACS 1
    ecap 001f[150] = unknown 1
    ecap 001e[200] = unknown 1
    ecap 0019[220] = PCIe Sec 1 lane errors 0
    ecap 001d[250] = unknown 1

pcib4@pci0:0:29:5:	class=0x060400 card=0x382117aa chip=0xa3358086 rev=0xf0 hdr=0x01
    vendor     = 'Intel Corporation'
    device     = 'Cannon Lake PCH PCI Express Root Port'
    class      = bridge
    subclass   = PCI-PCI
    cap 10[40] = PCI-Express 2 root port max data 128(256) ARI disabled
                 link x1(x1) speed 2.5(8.0) ASPM L1(L0s/L1)
                 slot 13 power limit 100 mW
    cap 05[80] = MSI supports 1 message 
    cap 0d[90] = PCI Bridge card=0x382117aa
    cap 01[a0] = powerspec 3  supports D0 D3  current D0
    ecap 0001[100] = AER 1 0 fatal 0 non-fatal 0 corrected
    ecap 000d[140] = ACS 1
    ecap 001f[150] = unknown 1
    ecap 001e[200] = unknown 1
    ecap 0019[220] = PCIe Sec 1 lane errors 0
    ecap 001d[250] = unknown 1

none7@pci0:0:30:0:	class=0x078000 card=0x380f17aa chip=0xa3288086 rev=0x10 hdr=0x00
    vendor     = 'Intel Corporation'
    device     = 'Cannon Lake PCH Serial IO UART Host Controller'
    class      = simple comms
    bar   [10] = type Memory, range 64, base 0, size 4096, disabled
    cap 01[80] = powerspec 3  supports D0 D3  current D0
    cap 09[90] = vendor (length 20) Intel cap 15 version 0

isab0@pci0:0:31:0:	class=0x060100 card=0x381017aa chip=0xa30d8086 rev=0x10 hdr=0x00
    vendor     = 'Intel Corporation'
    device     = 'HM470 Chipset LPC/eSPI Controller'
    class      = bridge
    subclass   = PCI-ISA

hdac0@pci0:0:31:3:	class=0x040300 card=0x381217aa chip=0xa3488086 rev=0x10 hdr=0x00
    vendor     = 'Intel Corporation'
    device     = 'Cannon Lake PCH cAVS'
    class      = multimedia
    subclass   = HDA
    bar   [10] = type Memory, range 64, base 0xa4518000, size 16384, enabled
    bar   [20] = type Memory, range 64, base 0xa4100000, size 1048576, enabled
    cap 01[50] = powerspec 3  supports D0 D3  current D0
    cap 09[80] = vendor (length 20) Intel cap 15 version 0
    cap 05[60] = MSI supports 1 message, 64 bit enabled with 1 message

none8@pci0:0:31:4:	class=0x0c0500 card=0x381317aa chip=0xa3238086 rev=0x10 hdr=0x00
    vendor     = 'Intel Corporation'
    device     = 'Cannon Lake PCH SMBus Controller'
    class      = serial bus
    subclass   = SMBus
    bar   [10] = type Memory, range 64, base 0xa4527000, size 256, enabled
    bar   [20] = type I/O Port, range 32, base 0x5040, size 32, enabled

none9@pci0:0:31:5:	class=0x0c8000 card=0x380117aa chip=0xa3248086 rev=0x10 hdr=0x00
    vendor     = 'Intel Corporation'
    device     = 'Cannon Lake PCH SPI Controller'
    class      = serial bus
    bar   [10] = type Memory, range 32, base 0xfe010000, size 4096, enabled

vgapci0@pci0:1:0:0:	class=0x030000 card=0x39fd17aa chip=0x1c8c10de rev=0xa1 hdr=0x00
    vendor     = 'NVIDIA Corporation'
    device     = 'GP107M [GeForce GTX 1050 Ti Mobile]'
    class      = display
    subclass   = VGA
    bar   [10] = type Memory, range 32, base 0xa3000000, size 16777216, enabled
    bar   [14] = type Prefetchable Memory, range 64, base 0x90000000, size 268435456, enabled
    bar   [1c] = type Prefetchable Memory, range 64, base 0xa0000000, size 33554432, enabled
    bar   [24] = type I/O Port, range 32, base 0x4000, size 128, enabled
    cap 01[60] = powerspec 3  supports D0 D3  current D0
    cap 05[68] = MSI supports 1 message, 64 bit 
    cap 10[78] = PCI-Express 2 endpoint max data 256(256) RO NS
                 link x16(x16) speed 8.0(8.0) ASPM disabled(L0s/L1)
    ecap 0002[100] = VC 1 max VC0
    ecap 0018[250] = LTR 1
    ecap 001e[258] = unknown 1
    ecap 0004[128] = Power Budgeting 1
    ecap 0001[420] = AER 2 0 fatal 0 non-fatal 1 corrected
    ecap 000b[600] = Vendor 1 ID 1
    ecap 0019[900] = PCIe Sec 1 lane errors 0

nvme0@pci0:6:0:0:	class=0x010802 card=0x10ec5760 chip=0x576010ec rev=0x01 hdr=0x00
    vendor     = 'Realtek Semiconductor Co., Ltd.'
    class      = mass storage
    subclass   = NVM
    bar   [10] = type Memory, range 64, base 0xa4400000, size 16384, enabled
    bar   [24] = type Memory, range 32, base 0xa4404000, size 8192, enabled
    cap 01[40] = powerspec 3  supports D0 D3  current D0
    cap 05[50] = MSI supports 8 messages, 64 bit 
    cap 10[70] = PCI-Express 2 endpoint max data 256(512) FLR RO
                 link x2(x2) speed 8.0(8.0) ASPM L1(L1)
    cap 11[b0] = MSI-X supports 8 messages, enabled
                 Table in map 0x10[0x2000], PBA in map 0x10[0x3000]
    ecap 0001[100] = AER 2 0 fatal 0 non-fatal 0 corrected
    ecap 0003[148] = Serial 1 00000001004ce000
    ecap 0019[158] = PCIe Sec 1 lane errors 0
    ecap 0018[178] = LTR 1
    ecap 001e[180] = unknown 1

iwm0@pci0:7:0:0:	class=0x028000 card=0x42108086 chip=0x31668086 rev=0x99 hdr=0x00
    vendor     = 'Intel Corporation'
    device     = 'Dual Band Wireless-AC 3165 Plus Bluetooth'
    class      = network
    bar   [10] = type Memory, range 64, base 0xa4300000, size 8192, enabled
    cap 01[c8] = powerspec 3  supports D0 D3  current D0
    cap 05[d0] = MSI supports 1 message, 64 bit enabled with 1 message
    cap 10[40] = PCI-Express 2 endpoint max data 128(128) FLR RO NS
                 link x1(x1) speed 2.5(2.5) ASPM L1(L1)
    ecap 0001[100] = AER 1 0 fatal 0 non-fatal 0 corrected
    ecap 0003[140] = Serial 1 302432ffff213054
    ecap 0018[14c] = LTR 1
    ecap 001e[154] = unknown 1

re0@pci0:8:0:0:	class=0x020000 card=0x38b417aa chip=0x816810ec rev=0x15 hdr=0x00
    vendor     = 'Realtek Semiconductor Co., Ltd.'
    device     = 'RTL8111/8168/8411 PCI Express Gigabit Ethernet Controller'
    class      = network
    subclass   = ethernet
    bar   [10] = type I/O Port, range 32, base 0x3000, size 256, enabled
    bar   [18] = type Memory, range 64, base 0xa4204000, size 4096, enabled
    bar   [20] = type Memory, range 64, base 0xa4200000, size 16384, enabled
    cap 01[40] = powerspec 3  supports D0 D1 D2 D3  current D0
    cap 05[50] = MSI supports 1 message, 64 bit 
    cap 10[70] = PCI-Express 2 endpoint MSI 1 max data 128(128) RO
                 link x1(x1) speed 2.5(2.5) ASPM disabled(L0s/L1)
    cap 11[b0] = MSI-X supports 4 messages, enabled
                 Table in map 0x20[0x0], PBA in map 0x20[0x800]
    ecap 0001[100] = AER 2 0 fatal 0 non-fatal 0 corrected
    ecap 0002[140] = VC 1 max VC0
    ecap 0003[160] = Serial 1 01000000684ce000
    ecap 0018[170] = LTR 1
    ecap 001e[178] = unknown 1
