hostb0@pci0:0:0:0:	class=0x060000 rev=0x03 hdr=0x00 vendor=0x8086 device=0x1f0b subvendor=0x0000 subdevice=0x0000
    vendor     = 'Intel Corporation'
    device     = 'Atom processor C2000 SoC Transaction Router'
    class      = bridge
    subclass   = HOST-PCI

pcib1@pci0:0:1:0:	class=0x060400 rev=0x03 hdr=0x01 vendor=0x8086 device=0x1f10 subvendor=0x8086 subdevice=0x7270
    vendor     = 'Intel Corporation'
    device     = 'Atom processor C2000 PCIe Root Port 1'
    class      = bridge
    subclass   = PCI-PCI
    bar   [10] = type Memory, range 64, base 0xffff00000, size 131072, enabled
    cap 10[40] = PCI-Express 2 root port max data 128(256) ARI disabled
                 max read 128
                 link x2(x4) speed 5.0(5.0) ASPM L1(L1)
                 slot 0 power limit 250 mW
    cap 01[80] = powerspec 3  supports D0 D3  current D0
    cap 0d[88] = PCI Bridge subvendor=0x8086 subdevice=0x7270
    cap 05[90] = MSI supports 1 message, vector masks 
    ecap 0001[100] = AER 1 0 fatal 0 non-fatal 0 corrected

pcib5@pci0:0:2:0:	class=0x060400 rev=0x03 hdr=0x01 vendor=0x8086 device=0x1f11 subvendor=0x8086 subdevice=0x7270
    vendor     = 'Intel Corporation'
    device     = 'Atom processor C2000 PCIe Root Port 2'
    class      = bridge
    subclass   = PCI-PCI
    bar   [10] = type Memory, range 64, base 0xfffee0000, size 131072, enabled
    cap 10[40] = PCI-Express 2 root port max data 128(256) ARI disabled
                 max read 128
                 link x2(x4) speed 5.0(5.0) ASPM L1(L1)
                 slot 1 power limit 250 mW
    cap 01[80] = powerspec 3  supports D0 D3  current D0
    cap 0d[88] = PCI Bridge subvendor=0x8086 subdevice=0x7270
    cap 05[90] = MSI supports 1 message, vector masks 
    ecap 0001[100] = AER 1 0 fatal 0 non-fatal 0 corrected

pcib9@pci0:0:3:0:	class=0x060400 rev=0x03 hdr=0x01 vendor=0x8086 device=0x1f12 subvendor=0x8086 subdevice=0x7270
    vendor     = 'Intel Corporation'
    device     = 'Atom processor C2000 PCIe Root Port 3'
    class      = bridge
    subclass   = PCI-PCI
    bar   [10] = type Memory, range 64, base 0xfffec0000, size 131072, enabled
    cap 10[40] = PCI-Express 2 root port max data 128(256) ARI disabled
                 max read 128
                 link x1(x4) speed 2.5(5.0) ASPM disabled(L1)
                 slot 2 power limit 250 mW
    cap 01[80] = powerspec 3  supports D0 D3  current D0
    cap 0d[88] = PCI Bridge subvendor=0x8086 subdevice=0x7270
    cap 05[90] = MSI supports 1 message, vector masks 
    ecap 0001[100] = AER 1 0 fatal 1 non-fatal 1 corrected

pcib11@pci0:0:4:0:	class=0x060400 rev=0x03 hdr=0x01 vendor=0x8086 device=0x1f13 subvendor=0x8086 subdevice=0x8086
    vendor     = 'Intel Corporation'
    device     = 'Atom processor C2000 PCIe Root Port 4'
    class      = bridge
    subclass   = PCI-PCI
    bar   [10] = type Memory, range 64, base 0xfffea0000, size 131072, enabled
    cap 10[40] = PCI-Express 2 root port max data 128(256) ARI disabled
                 max read 128
                 link x0(x4) speed 0.0(5.0) ASPM disabled(L1)
                 slot 3 power limit 250 mW
    cap 01[80] = powerspec 3  supports D0 D3  current D0
    cap 0d[88] = PCI Bridge subvendor=0x8086 subdevice=0x8086
    cap 05[90] = MSI supports 1 message, vector masks 
    ecap 0001[100] = AER 1 0 fatal 0 non-fatal 0 corrected

qat0@pci0:0:11:0:	class=0x0b4000 rev=0x03 hdr=0x00 vendor=0x8086 device=0x1f18 subvendor=0x8086 subdevice=0x0000
    vendor     = 'Intel Corporation'
    device     = 'Atom processor C2000 QAT'
    class      = processor
    bar   [18] = type Memory, range 64, base 0xfffe80000, size 131072, enabled
    bar   [20] = type Memory, range 64, base 0xffff30000, size 16384, enabled
    cap 05[b0] = MSI supports 1 message, 64 bit, vector masks 
    cap 11[60] = MSI-X supports 17 messages, enabled
                 Table in map 0x18[0x1b000], PBA in map 0x18[0x1b800]
    cap 01[6c] = powerspec 3  supports D0 D3  current D0
    cap 10[74] = PCI-Express 2 root endpoint max data 256(256) FLR RO NS
                 max read 512
    ecap 0001[100] = AER 1 0 fatal 0 non-fatal 0 corrected

hostb1@pci0:0:14:0:	class=0x060000 rev=0x03 hdr=0x00 vendor=0x8086 device=0x1f14 subvendor=0x8086 subdevice=0x0000
    vendor     = 'Intel Corporation'
    device     = 'Atom processor C2000 RAS'
    class      = bridge
    subclass   = HOST-PCI
    cap 10[40] = PCI-Express 2 root endpoint max data 256(256)
                 max read 128

none0@pci0:0:15:0:	class=0x080600 rev=0x03 hdr=0x00 vendor=0x8086 device=0x1f16 subvendor=0x8086 subdevice=0x0000
    vendor     = 'Intel Corporation'
    device     = 'Atom processor C2000 RCEC'
    class      = base peripheral
    subclass   = IOMMU
    cap 10[40] = PCI-Express 2 event collector max data 256(256)
                 max read 128
    cap 01[80] = powerspec 3  supports D0 D3  current D0
    cap 05[90] = MSI supports 1 message, vector masks 
    ecap 0001[100] = AER 1 0 fatal 0 non-fatal 0 corrected
    ecap 0007[150] = Root Complex Event Collector ASsociation 1

none1@pci0:0:19:0:	class=0x088000 rev=0x03 hdr=0x00 vendor=0x8086 device=0x1f15 subvendor=0x8086 subdevice=0x0000
    vendor     = 'Intel Corporation'
    device     = 'Atom processor C2000 SMBus 2.0'
    class      = base peripheral
    bar   [10] = type Memory, range 64, base 0xffff34000, size 1024, enabled
    cap 10[40] = PCI-Express 2 root endpoint max data 256(256) FLR NS
                 max read 128
    cap 01[80] = powerspec 3  supports D0 D3  current D0
    cap 05[8c] = MSI supports 1 message, 64 bit, vector masks 
    ecap 0001[100] = AER 1 0 fatal 0 non-fatal 0 corrected

igb4@pci0:0:20:0:	class=0x020000 rev=0x03 hdr=0x00 vendor=0x8086 device=0x1f41 subvendor=0x8086 subdevice=0x1f41
    vendor     = 'Intel Corporation'
    device     = 'Ethernet Connection I354'
    class      = network
    subclass   = ethernet
    bar   [10] = type Memory, range 64, base 0xfffe60000, size 131072, enabled
    bar   [18] = type I/O Port, range 32, base 0xe0a0, size 32, enabled
    bar   [20] = type Memory, range 64, base 0xffff2c000, size 16384, enabled
    cap 01[40] = powerspec 3  supports D0 D3  current D0
    cap 05[50] = MSI supports 1 message, 64 bit, vector masks 
    cap 11[70] = MSI-X supports 10 messages, enabled
                 Table in map 0x20[0x0], PBA in map 0x20[0x2000]
    cap 10[a0] = PCI-Express 2 root endpoint max data 512(512) FLR RO NS
                 max read 512
    ecap 0001[100] = AER 2 0 fatal 0 non-fatal 0 corrected
    ecap 0003[140] = Serial 1 001a8cffff6ee518
    ecap 0017[1a0] = TPH Requester 1
    ecap 000d[1d0] = ACS 1

igb5@pci0:0:20:1:	class=0x020000 rev=0x03 hdr=0x00 vendor=0x8086 device=0x1f41 subvendor=0x8086 subdevice=0x1f41
    vendor     = 'Intel Corporation'
    device     = 'Ethernet Connection I354'
    class      = network
    subclass   = ethernet
    bar   [10] = type Memory, range 64, base 0xfffe40000, size 131072, enabled
    bar   [18] = type I/O Port, range 32, base 0xe080, size 32, enabled
    bar   [20] = type Memory, range 64, base 0xffff28000, size 16384, enabled
    cap 01[40] = powerspec 3  supports D0 D3  current D0
    cap 05[50] = MSI supports 1 message, 64 bit, vector masks 
    cap 11[70] = MSI-X supports 10 messages, enabled
                 Table in map 0x20[0x0], PBA in map 0x20[0x2000]
    cap 10[a0] = PCI-Express 2 root endpoint max data 512(512) FLR RO NS
                 max read 512
    ecap 0001[100] = AER 2 0 fatal 0 non-fatal 0 corrected
    ecap 0003[140] = Serial 1 001a8cffff6ee518
    ecap 0017[1a0] = TPH Requester 1
    ecap 000d[1d0] = ACS 1

igb6@pci0:0:20:2:	class=0x020000 rev=0x03 hdr=0x00 vendor=0x8086 device=0x1f41 subvendor=0x8086 subdevice=0x1f41
    vendor     = 'Intel Corporation'
    device     = 'Ethernet Connection I354'
    class      = network
    subclass   = ethernet
    bar   [10] = type Memory, range 64, base 0xfffe20000, size 131072, enabled
    bar   [18] = type I/O Port, range 32, base 0xe060, size 32, enabled
    bar   [20] = type Memory, range 64, base 0xffff24000, size 16384, enabled
    cap 01[40] = powerspec 3  supports D0 D3  current D0
    cap 05[50] = MSI supports 1 message, 64 bit, vector masks 
    cap 11[70] = MSI-X supports 10 messages, enabled
                 Table in map 0x20[0x0], PBA in map 0x20[0x2000]
    cap 10[a0] = PCI-Express 2 root endpoint max data 512(512) FLR RO NS
                 max read 512
    ecap 0001[100] = AER 2 0 fatal 0 non-fatal 0 corrected
    ecap 0003[140] = Serial 1 001a8cffff6ee518
    ecap 0017[1a0] = TPH Requester 1
    ecap 000d[1d0] = ACS 1

igb7@pci0:0:20:3:	class=0x020000 rev=0x03 hdr=0x00 vendor=0x8086 device=0x1f41 subvendor=0x8086 subdevice=0x1f41
    vendor     = 'Intel Corporation'
    device     = 'Ethernet Connection I354'
    class      = network
    subclass   = ethernet
    bar   [10] = type Memory, range 64, base 0xfffe00000, size 131072, enabled
    bar   [18] = type I/O Port, range 32, base 0xe040, size 32, enabled
    bar   [20] = type Memory, range 64, base 0xffff20000, size 16384, enabled
    cap 01[40] = powerspec 3  supports D0 D3  current D0
    cap 05[50] = MSI supports 1 message, 64 bit, vector masks 
    cap 11[70] = MSI-X supports 10 messages, enabled
                 Table in map 0x20[0x0], PBA in map 0x20[0x2000]
    cap 10[a0] = PCI-Express 2 root endpoint max data 512(512) FLR RO NS
                 max read 512
    ecap 0001[100] = AER 2 0 fatal 0 non-fatal 0 corrected
    ecap 0003[140] = Serial 1 001a8cffff6ee518
    ecap 0017[1a0] = TPH Requester 1
    ecap 000d[1d0] = ACS 1

ehci0@pci0:0:22:0:	class=0x0c0320 rev=0x03 hdr=0x00 vendor=0x8086 device=0x1f2c subvendor=0x8086 subdevice=0x7270
    vendor     = 'Intel Corporation'
    device     = 'Atom processor C2000 USB Enhanced Host Controller'
    class      = serial bus
    subclass   = USB
    bar   [10] = type Memory, range 32, base 0xfd000000, size 1024, enabled
    cap 01[50] = powerspec 3  supports D0 D3  current D0
    cap 0a[58] = EHCI Debug Port at offset 0xa0 in map 0x14
    cap 13[98] = PCI Advanced Features: FLR TP

ahci0@pci0:0:24:0:	class=0x010601 rev=0x03 hdr=0x00 vendor=0x8086 device=0x1f32 subvendor=0x8086 subdevice=0x7270
    vendor     = 'Intel Corporation'
    device     = 'Atom processor C2000 AHCI SATA3 Controller'
    class      = mass storage
    subclass   = SATA
    bar   [10] = type I/O Port, range 32, base 0xe0f0, size 8, enabled
    bar   [14] = type I/O Port, range 32, base 0xe0e0, size 4, enabled
    bar   [18] = type I/O Port, range 32, base 0xe0d0, size 8, enabled
    bar   [1c] = type I/O Port, range 32, base 0xe0c0, size 4, enabled
    bar   [20] = type I/O Port, range 32, base 0xe020, size 32, enabled
    bar   [24] = type Memory, range 32, base 0xdc701000, size 2048, enabled
    cap 05[80] = MSI supports 1 message enabled with 1 message
    cap 01[70] = powerspec 3  supports D0 D3  current D0
    cap 12[a8] = SATA Index-Data Pair

isab0@pci0:0:31:0:	class=0x060100 rev=0x03 hdr=0x00 vendor=0x8086 device=0x1f38 subvendor=0x8086 subdevice=0x7270
    vendor     = 'Intel Corporation'
    device     = 'Atom processor C2000 PCU'
    class      = bridge
    subclass   = PCI-ISA
    cap 09[e0] = vendor (length 12) Intel cap 1 version 0
		 features: 4 PCI-e x1 slots

ichsmb0@pci0:0:31:3:	class=0x0c0500 rev=0x03 hdr=0x00 vendor=0x8086 device=0x1f3c subvendor=0x8086 subdevice=0x7270
    vendor     = 'Intel Corporation'
    device     = 'Atom processor C2000 PCU SMBus'
    class      = serial bus
    subclass   = SMBus
    bar   [10] = type Memory, range 32, base 0xdc700000, size 32, enabled
    bar   [20] = type I/O Port, range 32, base 0xe000, size 32, enabled

pcib2@pci0:1:0:0:	class=0x060400 rev=0xab hdr=0x01 vendor=0x10b5 device=0x8605 subvendor=0x10b5 subdevice=0x8605
    vendor     = 'PLX Technology, Inc.'
    device     = 'PEX 8605 PCI Express 4-port Gen2 Switch'
    class      = bridge
    subclass   = PCI-PCI
    bar   [10] = type Memory, range 32, base 0xdc600000, size 16384, enabled
    cap 01[40] = powerspec 3  supports D0 D1 D2 D3  current D0
    cap 05[48] = MSI supports 4 messages, 64 bit, vector masks 
    cap 10[68] = PCI-Express 2 upstream port max data 128(256) RO NS
                 max read 128
                 link x2(x2) speed 5.0(5.0) ASPM L1(L0s/L1)
    cap 0d[a4] = PCI Bridge subvendor=0x10b5 subdevice=0x8605
    ecap 0003[100] = Serial 1 ab860210b5df0e00
    ecap 0001[fb4] = AER 1 0 fatal 0 non-fatal 1 corrected
    ecap 0004[138] = Power Budgeting 1
    ecap 0002[148] = VC 1 max VC0
    ecap 000b[950] = Vendor [1] ID 0001 Rev 0 Length 40

pcib3@pci0:2:2:0:	class=0x060400 rev=0xab hdr=0x01 vendor=0x10b5 device=0x8605 subvendor=0x10b5 subdevice=0x8605
    vendor     = 'PLX Technology, Inc.'
    device     = 'PEX 8605 PCI Express 4-port Gen2 Switch'
    class      = bridge
    subclass   = PCI-PCI
    cap 01[40] = powerspec 3  supports D0 D1 D2 D3  current D0
    cap 05[48] = MSI supports 4 messages, 64 bit, vector masks enabled with 1 message
    cap 10[68] = PCI-Express 2 downstream port max data 128(256) RO NS ARI disabled
                 max read 128
                 link x1(x1) speed 2.5(5.0) ASPM L1(L0s/L1)
                 slot 2 power limit 25000 mW HotPlug(present)
    cap 0d[a4] = PCI Bridge subvendor=0x10b5 subdevice=0x8605
    ecap 0003[100] = Serial 1 ab860210b5df0e00
    ecap 0001[fb4] = AER 1 0 fatal 0 non-fatal 1 corrected
    ecap 0002[148] = VC 1 max VC0
    ecap 000d[520] = ACS 1
    ecap 000b[950] = Vendor [1] ID 0001 Rev 0 Length 40

pcib4@pci0:2:3:0:	class=0x060400 rev=0xab hdr=0x01 vendor=0x10b5 device=0x8605 subvendor=0x10b5 subdevice=0x8605
    vendor     = 'PLX Technology, Inc.'
    device     = 'PEX 8605 PCI Express 4-port Gen2 Switch'
    class      = bridge
    subclass   = PCI-PCI
    cap 01[40] = powerspec 3  supports D0 D1 D2 D3  current D0
    cap 05[48] = MSI supports 4 messages, 64 bit, vector masks 
    cap 10[68] = PCI-Express 2 downstream port max data 128(256) RO NS ARI disabled
                 max read 128
                 link x1(x1) speed 2.5(5.0) ASPM L1(L0s/L1)
                 slot 3 power limit 25000 mW
    cap 0d[a4] = PCI Bridge subvendor=0x10b5 subdevice=0x8605
    ecap 0003[100] = Serial 1 ab860210b5df0e00
    ecap 0001[fb4] = AER 1 0 fatal 0 non-fatal 1 corrected
    ecap 0002[148] = VC 1 max VC0
    ecap 000d[520] = ACS 1
    ecap 000b[950] = Vendor [1] ID 0001 Rev 0 Length 40

igb0@pci0:3:0:0:	class=0x020000 rev=0x03 hdr=0x00 vendor=0x8086 device=0x1539 subvendor=0x8086 subdevice=0x0000
    vendor     = 'Intel Corporation'
    device     = 'I211 Gigabit Network Connection'
    class      = network
    subclass   = ethernet
    bar   [10] = type Memory, range 32, base 0xdc500000, size 131072, enabled
    bar   [18] = type I/O Port, range 32, base 0xc000, size 32, enabled
    bar   [1c] = type Memory, range 32, base 0xdc520000, size 16384, enabled
    cap 01[40] = powerspec 3  supports D0 D3  current D0
    cap 05[50] = MSI supports 1 message, 64 bit, vector masks 
    cap 11[70] = MSI-X supports 5 messages, enabled
                 Table in map 0x1c[0x0], PBA in map 0x1c[0x2000]
    cap 10[a0] = PCI-Express 2 endpoint max data 128(512) FLR RO NS
                 max read 512
                 link x1(x1) speed 2.5(2.5) ASPM L1(L0s/L1)
    ecap 0001[100] = AER 2 0 fatal 0 non-fatal 0 corrected
    ecap 0003[140] = Serial 1 001a8cffff6ee51c
    ecap 0017[1a0] = TPH Requester 1

igb1@pci0:4:0:0:	class=0x020000 rev=0x03 hdr=0x00 vendor=0x8086 device=0x1539 subvendor=0x8086 subdevice=0x0000
    vendor     = 'Intel Corporation'
    device     = 'I211 Gigabit Network Connection'
    class      = network
    subclass   = ethernet
    bar   [10] = type Memory, range 32, base 0xdc400000, size 131072, enabled
    bar   [18] = type I/O Port, range 32, base 0xb000, size 32, enabled
    bar   [1c] = type Memory, range 32, base 0xdc420000, size 16384, enabled
    cap 01[40] = powerspec 3  supports D0 D3  current D0
    cap 05[50] = MSI supports 1 message, 64 bit, vector masks 
    cap 11[70] = MSI-X supports 5 messages, enabled
                 Table in map 0x1c[0x0], PBA in map 0x1c[0x2000]
    cap 10[a0] = PCI-Express 2 endpoint max data 128(512) FLR RO NS
                 max read 512
                 link x1(x1) speed 2.5(2.5) ASPM L1(L0s/L1)
    ecap 0001[100] = AER 2 0 fatal 0 non-fatal 0 corrected
    ecap 0003[140] = Serial 1 001a8cffff6ee51d
    ecap 0017[1a0] = TPH Requester 1

pcib6@pci0:5:0:0:	class=0x060400 rev=0xab hdr=0x01 vendor=0x10b5 device=0x8605 subvendor=0x10b5 subdevice=0x8605
    vendor     = 'PLX Technology, Inc.'
    device     = 'PEX 8605 PCI Express 4-port Gen2 Switch'
    class      = bridge
    subclass   = PCI-PCI
    bar   [10] = type Memory, range 32, base 0xdc300000, size 16384, enabled
    cap 01[40] = powerspec 3  supports D0 D1 D2 D3  current D0
    cap 05[48] = MSI supports 4 messages, 64 bit, vector masks 
    cap 10[68] = PCI-Express 2 upstream port max data 128(256) RO NS
                 max read 128
                 link x2(x2) speed 5.0(5.0) ASPM L1(L0s/L1)
    cap 0d[a4] = PCI Bridge subvendor=0x10b5 subdevice=0x8605
    ecap 0003[100] = Serial 1 ab860210b5df0e00
    ecap 0001[fb4] = AER 1 0 fatal 0 non-fatal 1 corrected
    ecap 0004[138] = Power Budgeting 1
    ecap 0002[148] = VC 1 max VC0
    ecap 000b[950] = Vendor [1] ID 0001 Rev 0 Length 40

pcib7@pci0:6:2:0:	class=0x060400 rev=0xab hdr=0x01 vendor=0x10b5 device=0x8605 subvendor=0x10b5 subdevice=0x8605
    vendor     = 'PLX Technology, Inc.'
    device     = 'PEX 8605 PCI Express 4-port Gen2 Switch'
    class      = bridge
    subclass   = PCI-PCI
    cap 01[40] = powerspec 3  supports D0 D1 D2 D3  current D0
    cap 05[48] = MSI supports 4 messages, 64 bit, vector masks enabled with 1 message
    cap 10[68] = PCI-Express 2 downstream port max data 128(256) RO NS ARI disabled
                 max read 128
                 link x1(x1) speed 2.5(5.0) ASPM L1(L0s/L1)
                 slot 2 power limit 25000 mW HotPlug(present)
    cap 0d[a4] = PCI Bridge subvendor=0x10b5 subdevice=0x8605
    ecap 0003[100] = Serial 1 ab860210b5df0e00
    ecap 0001[fb4] = AER 1 0 fatal 0 non-fatal 1 corrected
    ecap 0002[148] = VC 1 max VC0
    ecap 000d[520] = ACS 1
    ecap 000b[950] = Vendor [1] ID 0001 Rev 0 Length 40

pcib8@pci0:6:3:0:	class=0x060400 rev=0xab hdr=0x01 vendor=0x10b5 device=0x8605 subvendor=0x10b5 subdevice=0x8605
    vendor     = 'PLX Technology, Inc.'
    device     = 'PEX 8605 PCI Express 4-port Gen2 Switch'
    class      = bridge
    subclass   = PCI-PCI
    cap 01[40] = powerspec 3  supports D0 D1 D2 D3  current D0
    cap 05[48] = MSI supports 4 messages, 64 bit, vector masks 
    cap 10[68] = PCI-Express 2 downstream port max data 128(256) RO NS ARI disabled
                 max read 128
                 link x1(x1) speed 2.5(5.0) ASPM L1(L0s/L1)
                 slot 3 power limit 25000 mW
    cap 0d[a4] = PCI Bridge subvendor=0x10b5 subdevice=0x8605
    ecap 0003[100] = Serial 1 ab860210b5df0e00
    ecap 0001[fb4] = AER 1 0 fatal 0 non-fatal 1 corrected
    ecap 0002[148] = VC 1 max VC0
    ecap 000d[520] = ACS 1
    ecap 000b[950] = Vendor [1] ID 0001 Rev 0 Length 40

igb2@pci0:7:0:0:	class=0x020000 rev=0x03 hdr=0x00 vendor=0x8086 device=0x1539 subvendor=0x8086 subdevice=0x0000
    vendor     = 'Intel Corporation'
    device     = 'I211 Gigabit Network Connection'
    class      = network
    subclass   = ethernet
    bar   [10] = type Memory, range 32, base 0xdc200000, size 131072, enabled
    bar   [18] = type I/O Port, range 32, base 0xa000, size 32, enabled
    bar   [1c] = type Memory, range 32, base 0xdc220000, size 16384, enabled
    cap 01[40] = powerspec 3  supports D0 D3  current D0
    cap 05[50] = MSI supports 1 message, 64 bit, vector masks 
    cap 11[70] = MSI-X supports 5 messages, enabled
                 Table in map 0x1c[0x0], PBA in map 0x1c[0x2000]
    cap 10[a0] = PCI-Express 2 endpoint max data 128(512) FLR RO NS
                 max read 512
                 link x1(x1) speed 2.5(2.5) ASPM L1(L0s/L1)
    ecap 0001[100] = AER 2 0 fatal 0 non-fatal 0 corrected
    ecap 0003[140] = Serial 1 001a8cffff6ee51e
    ecap 0017[1a0] = TPH Requester 1

igb3@pci0:8:0:0:	class=0x020000 rev=0x03 hdr=0x00 vendor=0x8086 device=0x1539 subvendor=0x8086 subdevice=0x0000
    vendor     = 'Intel Corporation'
    device     = 'I211 Gigabit Network Connection'
    class      = network
    subclass   = ethernet
    bar   [10] = type Memory, range 32, base 0xdc100000, size 131072, enabled
    bar   [18] = type I/O Port, range 32, base 0x9000, size 32, enabled
    bar   [1c] = type Memory, range 32, base 0xdc120000, size 16384, enabled
    cap 01[40] = powerspec 3  supports D0 D3  current D0
    cap 05[50] = MSI supports 1 message, 64 bit, vector masks 
    cap 11[70] = MSI-X supports 5 messages, enabled
                 Table in map 0x1c[0x0], PBA in map 0x1c[0x2000]
    cap 10[a0] = PCI-Express 2 endpoint max data 128(512) FLR RO NS
                 max read 512
                 link x1(x1) speed 2.5(2.5) ASPM L1(L0s/L1)
    ecap 0001[100] = AER 2 0 fatal 0 non-fatal 0 corrected
    ecap 0003[140] = Serial 1 001a8cffff6ee51f
    ecap 0017[1a0] = TPH Requester 1

pcib10@pci0:9:0:0:	class=0x060400 rev=0x02 hdr=0x01 vendor=0x1a03 device=0x1150 subvendor=0x1a03 subdevice=0x1150
    vendor     = 'ASPEED Technology, Inc.'
    device     = 'AST1150 PCI-to-PCI Bridge'
    class      = bridge
    subclass   = PCI-PCI
    cap 05[50] = MSI supports 1 message, 64 bit 
    cap 01[78] = powerspec 3  supports D0 D1 D2 D3  current D0
    cap 10[80] = PCI-Express 1 PCI bridge max data 128(128) RO NS
                 max read 512
                 link x1(x1) speed 2.5(2.5) ASPM disabled(L0s/L1)
    cap 0d[a4] = PCI Bridge subvendor=0x1a03 subdevice=0x1150
    ecap 0002[100] = VC 1 max VC0

vgapci0@pci0:10:0:0:	class=0x030000 rev=0x21 hdr=0x00 vendor=0x1a03 device=0x2000 subvendor=0x1a03 subdevice=0x2000
    vendor     = 'ASPEED Technology, Inc.'
    device     = 'ASPEED Graphics Family'
    class      = display
    subclass   = VGA
    bar   [10] = type Memory, range 32, base 0xd8000000, size 67108864, enabled
    bar   [14] = type Memory, range 32, base 0xdc000000, size 131072, enabled
    bar   [18] = type I/O Port, range 32, base 0xd000, size 128, enabled
    cap 01[40] = powerspec 3  supports D0 D1 D2 D3  current D0
