hostb0@pci0:0:0:0:	class=0x060000 rev=0x04 hdr=0x00 vendor=0x8086 device=0x0e00 subvendor=0x1849 subdevice=0x0e00
    vendor     = 'Intel Corporation'
    device     = 'Xeon E7 v2/Xeon E5 v2/Core i7 DMI2'
    class      = bridge
    subclass   = HOST-PCI
    cap 10[90] = PCI-Express 2 root port max data 128(128)
                 max read 128
                 link x0(x4) speed 0.0(2.5) ASPM disabled(L1)
    cap 01[e0] = powerspec 3  supports D0 D3  current D0
    ecap 000b[100] = Vendor [1] ID 0002 Rev 0 Length 12
    ecap 000b[144] = Vendor [1] ID 0004 Rev 1 Length 60
    ecap 000b[1d0] = Vendor [1] ID 0003 Rev 1 Length 10
    ecap 000b[280] = Vendor [1] ID 0005 Rev 3 Length 24

pcib1@pci0:0:1:0:	class=0x060400 rev=0x04 hdr=0x01 vendor=0x8086 device=0x0e02 subvendor=0x1849 subdevice=0x0e02
    vendor     = 'Intel Corporation'
    device     = 'Xeon E7 v2/Xeon E5 v2/Core i7 PCI Express Root Port 1a'
    class      = bridge
    subclass   = PCI-PCI
    cap 0d[40] = PCI Bridge subvendor=0x1849 subdevice=0x0e02
    cap 05[60] = MSI supports 2 messages, vector masks 
    cap 10[90] = PCI-Express 2 root port max data 128(256) ARI disabled
                 max read 128
                 link x1(x8) speed 2.5(8.0) ASPM disabled(L1)
                 slot 255 power limit 25000 mW
    cap 01[e0] = powerspec 3  supports D0 D3  current D0
    ecap 000b[100] = Vendor [1] ID 0002 Rev 0 Length 12
    ecap 000d[110] = ACS 1
    ecap 0001[148] = AER 1 0 fatal 0 non-fatal 0 corrected
    ecap 000b[1d0] = Vendor [1] ID 0003 Rev 1 Length 10
    ecap 0019[250] = PCIe Sec 1 lane errors 0
    ecap 000b[280] = Vendor [1] ID 0005 Rev 3 Length 24

pcib2@pci0:0:2:0:	class=0x060400 rev=0x04 hdr=0x01 vendor=0x8086 device=0x0e04 subvendor=0x1849 subdevice=0x0e04
    vendor     = 'Intel Corporation'
    device     = 'Xeon E7 v2/Xeon E5 v2/Core i7 PCI Express Root Port 2a'
    class      = bridge
    subclass   = PCI-PCI
    cap 0d[40] = PCI Bridge subvendor=0x1849 subdevice=0x0e04
    cap 05[60] = MSI supports 2 messages, vector masks 
    cap 10[90] = PCI-Express 2 root port max data 128(256) ARI disabled
                 max read 128
                 link x0(x16) speed 0.0(8.0) ASPM disabled(L1)
                 slot 3 power limit 75000 mW
    cap 01[e0] = powerspec 3  supports D0 D3  current D0
    ecap 000b[100] = Vendor [1] ID 0002 Rev 0 Length 12
    ecap 000d[110] = ACS 1
    ecap 0001[148] = AER 1 0 fatal 0 non-fatal 0 corrected
    ecap 000b[1d0] = Vendor [1] ID 0003 Rev 1 Length 10
    ecap 0019[250] = PCIe Sec 1 lane errors 0
    ecap 000b[280] = Vendor [1] ID 0005 Rev 3 Length 24

pcib3@pci0:0:3:0:	class=0x060400 rev=0x04 hdr=0x01 vendor=0x8086 device=0x0e08 subvendor=0x1849 subdevice=0x0e08
    vendor     = 'Intel Corporation'
    device     = 'Xeon E7 v2/Xeon E5 v2/Core i7 PCI Express Root Port 3a'
    class      = bridge
    subclass   = PCI-PCI
    cap 0d[40] = PCI Bridge subvendor=0x1849 subdevice=0x0e08
    cap 05[60] = MSI supports 2 messages, vector masks 
    cap 10[90] = PCI-Express 2 root port max data 256(256) ARI enabled
                 max read 128
                 link x4(x16) speed 5.0(8.0) ASPM disabled(L1)
                 slot 0 power limit 75000 mW
    cap 01[e0] = powerspec 3  supports D0 D3  current D0
    ecap 000b[100] = Vendor [1] ID 0002 Rev 0 Length 12
    ecap 000d[110] = ACS 1
    ecap 0001[148] = AER 1 0 fatal 0 non-fatal 0 corrected
    ecap 000b[1d0] = Vendor [1] ID 0003 Rev 1 Length 10
    ecap 0019[250] = PCIe Sec 1 lane errors 0xd000
    ecap 000b[280] = Vendor [1] ID 0005 Rev 3 Length 24

none0@pci0:0:5:0:	class=0x088000 rev=0x04 hdr=0x00 vendor=0x8086 device=0x0e28 subvendor=0x1849 subdevice=0x0e28
    vendor     = 'Intel Corporation'
    device     = 'Xeon E7 v2/Xeon E5 v2/Core i7 VTd/Memory Map/Misc'
    class      = base peripheral
    cap 10[40] = PCI-Express 2 root endpoint max data 128(128)
                 max read 128

none1@pci0:0:5:2:	class=0x088000 rev=0x04 hdr=0x00 vendor=0x8086 device=0x0e2a subvendor=0x1849 subdevice=0x0e2a
    vendor     = 'Intel Corporation'
    device     = 'Xeon E7 v2/Xeon E5 v2/Core i7 IIO RAS'
    class      = base peripheral
    cap 10[40] = PCI-Express 2 root endpoint max data 128(128) RO NS
                 max read 128

ioapic0@pci0:0:5:4:	class=0x080020 rev=0x04 hdr=0x00 vendor=0x8086 device=0x0e2c subvendor=0x1849 subdevice=0x0e2c
    vendor     = 'Intel Corporation'
    device     = 'Xeon E7 v2/Xeon E5 v2/Core i7 IOAPIC'
    class      = base peripheral
    subclass   = interrupt controller
    bar   [10] = type Memory, range 32, base 0xfbf09000, size 4096, enabled
    cap 10[44] = PCI-Express 1 root endpoint max data 128(128)
                 max read 128
    cap 01[e0] = powerspec 3  supports D0 D3  current D0

pcib4@pci0:0:17:0:	class=0x060400 rev=0x05 hdr=0x01 vendor=0x8086 device=0x1d3e subvendor=0x1849 subdevice=0x1d3e
    vendor     = 'Intel Corporation'
    device     = 'C600/X79 series chipset PCI Express Virtual Root Port'
    class      = bridge
    subclass   = PCI-PCI
    cap 10[40] = PCI-Express 2 root port max data 128(128) ARI disabled
                 max read 128
                 link x1(x1) speed 2.5(2.5) ASPM disabled(L0s/L1)
    cap 01[80] = powerspec 3  supports D0 D3  current D0
    cap 0d[88] = PCI Bridge subvendor=0x1849 subdevice=0x1d3e
    cap 05[90] = MSI supports 1 message 
    ecap 0001[100] = AER 1 0 fatal 0 non-fatal 0 corrected
    ecap 000d[138] = ACS 1

none2@pci0:0:22:0:	class=0x078000 rev=0x05 hdr=0x00 vendor=0x8086 device=0x1d3a subvendor=0x1849 subdevice=0x1d3a
    vendor     = 'Intel Corporation'
    device     = 'C600/X79 series chipset MEI Controller'
    class      = simple comms
    bar   [10] = type Memory, range 64, base 0xfbf08000, size 16, enabled
    cap 01[50] = powerspec 3  supports D0 D3  current D0
    cap 05[8c] = MSI supports 1 message, 64 bit 

ehci0@pci0:0:26:0:	class=0x0c0320 rev=0x05 hdr=0x00 vendor=0x8086 device=0x1d2d subvendor=0x1849 subdevice=0x1d2d
    vendor     = 'Intel Corporation'
    device     = 'C600/X79 series chipset USB2 Enhanced Host Controller'
    class      = serial bus
    subclass   = USB
    bar   [10] = type Memory, range 32, base 0xfbf07000, size 1024, enabled
    cap 01[50] = powerspec 2  supports D0 D3  current D0
    cap 0a[58] = EHCI Debug Port at offset 0xa0 in map 0x14
    cap 13[98] = PCI Advanced Features: FLR TP

hdac0@pci0:0:27:0:	class=0x040300 rev=0x05 hdr=0x00 vendor=0x8086 device=0x1d20 subvendor=0x1849 subdevice=0x0010
    vendor     = 'Intel Corporation'
    device     = 'C600/X79 series chipset High Definition Audio Controller'
    class      = multimedia
    subclass   = HDA
    bar   [10] = type Memory, range 64, base 0xfbf00000, size 16384, enabled
    cap 01[50] = powerspec 2  supports D0 D3  current D0
    cap 05[60] = MSI supports 1 message, 64 bit enabled with 1 message
    cap 10[70] = PCI-Express 1 root endpoint max data 128(128) FLR
                 max read 128
    ecap 0002[100] = VC 1 max VC1
    ecap 0005[130] = Root Complex Link Declaration 1

pcib5@pci0:0:28:0:	class=0x060400 rev=0xb5 hdr=0x01 vendor=0x8086 device=0x1d10 subvendor=0x1849 subdevice=0x1d10
    vendor     = 'Intel Corporation'
    device     = 'C600/X79 series chipset PCI Express Root Port 1'
    class      = bridge
    subclass   = PCI-PCI
    cap 10[40] = PCI-Express 2 root port max data 128(128)
                 max read 128
                 link x0(x1) speed 0.0(5.0) ASPM disabled(L1)
                 slot 0 power limit 100 mW
    cap 05[80] = MSI supports 1 message 
    cap 0d[90] = PCI Bridge subvendor=0x1849 subdevice=0x1d10
    cap 01[a0] = powerspec 2  supports D0 D3  current D0

pcib6@pci0:0:28:1:	class=0x060400 rev=0xb5 hdr=0x01 vendor=0x8086 device=0x1d12 subvendor=0x1849 subdevice=0x1d12
    vendor     = 'Intel Corporation'
    device     = 'C600/X79 series chipset PCI Express Root Port 2'
    class      = bridge
    subclass   = PCI-PCI
    cap 10[40] = PCI-Express 2 root port max data 128(128)
                 max read 128
                 link x1(x1) speed 5.0(5.0) ASPM disabled(L1)
                 slot 0 power limit 100 mW
    cap 05[80] = MSI supports 1 message 
    cap 0d[90] = PCI Bridge subvendor=0x1849 subdevice=0x1d12
    cap 01[a0] = powerspec 2  supports D0 D3  current D0

pcib7@pci0:0:28:2:	class=0x060400 rev=0xb5 hdr=0x01 vendor=0x8086 device=0x1d14 subvendor=0x1849 subdevice=0x1d14
    vendor     = 'Intel Corporation'
    device     = 'C600/X79 series chipset PCI Express Root Port 3'
    class      = bridge
    subclass   = PCI-PCI
    cap 10[40] = PCI-Express 2 root port max data 128(128)
                 max read 128
                 link x1(x1) speed 5.0(5.0) ASPM disabled(L1)
                 slot 0 power limit 100 mW
    cap 05[80] = MSI supports 1 message 
    cap 0d[90] = PCI Bridge subvendor=0x1849 subdevice=0x1d14
    cap 01[a0] = powerspec 2  supports D0 D3  current D0

pcib8@pci0:0:28:3:	class=0x060400 rev=0xb5 hdr=0x01 vendor=0x8086 device=0x1d16 subvendor=0x1849 subdevice=0x1d16
    vendor     = 'Intel Corporation'
    device     = 'C600/X79 series chipset PCI Express Root Port 4'
    class      = bridge
    subclass   = PCI-PCI
    cap 10[40] = PCI-Express 2 root port max data 128(128)
                 max read 128
                 link x1(x1) speed 2.5(5.0) ASPM disabled(L1)
                 slot 0 power limit 100 mW
    cap 05[80] = MSI supports 1 message 
    cap 0d[90] = PCI Bridge subvendor=0x1849 subdevice=0x1d16
    cap 01[a0] = powerspec 2  supports D0 D3  current D0

pcib9@pci0:0:28:5:	class=0x060400 rev=0xb5 hdr=0x01 vendor=0x8086 device=0x1d1a subvendor=0x1849 subdevice=0x1d1a
    vendor     = 'Intel Corporation'
    device     = 'C600/X79 series chipset PCI Express Root Port 6'
    class      = bridge
    subclass   = PCI-PCI
    cap 10[40] = PCI-Express 2 root port max data 128(128)
                 max read 128
                 link x1(x1) speed 2.5(5.0) ASPM disabled(L1)
                 slot 0 power limit 100 mW
    cap 05[80] = MSI supports 1 message 
    cap 0d[90] = PCI Bridge subvendor=0x1849 subdevice=0x1d1a
    cap 01[a0] = powerspec 2  supports D0 D3  current D0

pcib10@pci0:0:28:6:	class=0x060400 rev=0xb5 hdr=0x01 vendor=0x8086 device=0x1d1c subvendor=0x1849 subdevice=0x1d1c
    vendor     = 'Intel Corporation'
    device     = 'C600/X79 series chipset PCI Express Root Port 7'
    class      = bridge
    subclass   = PCI-PCI
    cap 10[40] = PCI-Express 2 root port max data 128(128)
                 max read 128
                 link x1(x1) speed 5.0(5.0) ASPM disabled(L1)
                 slot 0 power limit 100 mW
    cap 05[80] = MSI supports 1 message 
    cap 0d[90] = PCI Bridge subvendor=0x1849 subdevice=0x1d1c
    cap 01[a0] = powerspec 2  supports D0 D3  current D0

pcib11@pci0:0:28:7:	class=0x060400 rev=0xb5 hdr=0x01 vendor=0x8086 device=0x1d1e subvendor=0x1849 subdevice=0x1d1e
    vendor     = 'Intel Corporation'
    device     = 'C600/X79 series chipset PCI Express Root Port 8'
    class      = bridge
    subclass   = PCI-PCI
    cap 10[40] = PCI-Express 2 root port max data 128(128)
                 max read 128
                 link x1(x1) speed 5.0(5.0) ASPM disabled(L1)
                 slot 0 power limit 100 mW
    cap 05[80] = MSI supports 1 message 
    cap 0d[90] = PCI Bridge subvendor=0x1849 subdevice=0x1d1e
    cap 01[a0] = powerspec 2  supports D0 D3  current D0

ehci1@pci0:0:29:0:	class=0x0c0320 rev=0x05 hdr=0x00 vendor=0x8086 device=0x1d26 subvendor=0x1849 subdevice=0x1d26
    vendor     = 'Intel Corporation'
    device     = 'C600/X79 series chipset USB2 Enhanced Host Controller'
    class      = serial bus
    subclass   = USB
    bar   [10] = type Memory, range 32, base 0xfbf06000, size 1024, enabled
    cap 01[50] = powerspec 2  supports D0 D3  current D0
    cap 0a[58] = EHCI Debug Port at offset 0xa0 in map 0x14
    cap 13[98] = PCI Advanced Features: FLR TP

pcib12@pci0:0:30:0:	class=0x060401 rev=0xa5 hdr=0x01 vendor=0x8086 device=0x244e subvendor=0x1849 subdevice=0x244e
    vendor     = 'Intel Corporation'
    device     = '82801 PCI Bridge'
    class      = bridge
    subclass   = PCI-PCI
    cap 0d[50] = PCI Bridge subvendor=0x1849 subdevice=0x244e

isab0@pci0:0:31:0:	class=0x060100 rev=0x05 hdr=0x00 vendor=0x8086 device=0x1d41 subvendor=0x1849 subdevice=0x1d41
    vendor     = 'Intel Corporation'
    device     = 'C600/X79 series chipset LPC Controller'
    class      = bridge
    subclass   = PCI-ISA
    cap 09[e0] = vendor (length 12) Intel cap 1 version 0
		 features: AMT, 4 PCI-e x1 slots

ahci2@pci0:0:31:2:	class=0x010601 rev=0x05 hdr=0x00 vendor=0x8086 device=0x1d02 subvendor=0x1849 subdevice=0x1d02
    vendor     = 'Intel Corporation'
    device     = 'C600/X79 series chipset 6-Port SATA AHCI Controller'
    class      = mass storage
    subclass   = SATA
    bar   [10] = type I/O Port, range 32, base 0xf070, size 8, enabled
    bar   [14] = type I/O Port, range 32, base 0xf060, size 4, enabled
    bar   [18] = type I/O Port, range 32, base 0xf050, size 8, enabled
    bar   [1c] = type I/O Port, range 32, base 0xf040, size 4, enabled
    bar   [20] = type I/O Port, range 32, base 0xf020, size 32, enabled
    bar   [24] = type Memory, range 32, base 0xfbf05000, size 2048, enabled
    cap 05[80] = MSI supports 1 message enabled with 1 message
    cap 01[70] = powerspec 3  supports D0 D3  current D0
    cap 12[a8] = SATA Index-Data Pair
    cap 13[b0] = PCI Advanced Features: FLR TP

ichsmb0@pci0:0:31:3:	class=0x0c0500 rev=0x05 hdr=0x00 vendor=0x8086 device=0x1d22 subvendor=0x1849 subdevice=0x1d22
    vendor     = 'Intel Corporation'
    device     = 'C600/X79 series chipset SMBus Host Controller'
    class      = serial bus
    subclass   = SMBus
    bar   [10] = type Memory, range 64, base 0xfbf04000, size 256, enabled
    bar   [20] = type I/O Port, range 32, base 0xf000, size 32, enabled

bge0@pci0:1:0:0:	class=0x020000 rev=0x10 hdr=0x00 vendor=0x14e4 device=0x16b1 subvendor=0x1849 subdevice=0x96b1
    vendor     = 'Broadcom Inc. and subsidiaries'
    device     = 'NetLink BCM57781 Gigabit Ethernet PCIe'
    class      = network
    subclass   = ethernet
    bar   [10] = type Prefetchable Memory, range 64, base 0xfb410000, size 65536, enabled
    bar   [18] = type Prefetchable Memory, range 64, base 0xfb400000, size 65536, enabled
    cap 01[48] = powerspec 3  supports D0 D3  current D0
    cap 05[58] = MSI supports 8 messages, 64 bit enabled with 1 message
    cap 11[a0] = MSI-X supports 5 messages
                 Table in map 0x18[0x0], PBA in map 0x18[0x120]
    cap 10[ac] = PCI-Express 2 endpoint max data 128(128)
                 max read 4096
                 link x1(x1) speed 2.5(2.5) ASPM disabled(L0s/L1) ClockPM disabled
    ecap 0001[100] = AER 1 0 fatal 0 non-fatal 0 corrected
    ecap 0003[13c] = Serial 1 0000bc5ff44acb05
    ecap 0004[150] = Power Budgeting 1
    ecap 0002[160] = VC 1 max VC0

igb0@pci0:3:0:0:	class=0x020000 rev=0x01 hdr=0x00 vendor=0x8086 device=0x1521 subvendor=0x8086 subdevice=0x0002
    vendor     = 'Intel Corporation'
    device     = 'I350 Gigabit Network Connection'
    class      = network
    subclass   = ethernet
    bar   [10] = type Memory, range 32, base 0xfb600000, size 1048576, enabled
    bar   [1c] = type Memory, range 32, base 0xfb784000, size 16384, enabled
    cap 01[40] = powerspec 3  supports D0 D3  current D0
    cap 05[50] = MSI supports 1 message, 64 bit, vector masks 
    cap 11[70] = MSI-X supports 10 messages, enabled
                 Table in map 0x1c[0x0], PBA in map 0x1c[0x2000]
    cap 10[a0] = PCI-Express 2 endpoint max data 256(512) FLR NS
                 max read 512
                 link x4(x4) speed 5.0(5.0) ASPM disabled(L0s/L1)
    ecap 0001[100] = AER 2 0 fatal 0 non-fatal 1 corrected
    ecap 0003[140] = Serial 1 a0369fffff14bfd2
    ecap 000e[150] = ARI 1
    ecap 0010[160] = SR-IOV 1 IOV disabled, Memory Space disabled, ARI disabled
                     0 VFs configured out of 8 supported
                     First VF RID Offset 0x0180, VF RID Stride 0x0004
                     VF Device ID 0x1520
                     Page Sizes: 4096 (enabled), 8192, 65536, 262144, 1048576, 4194304
    ecap 0017[1a0] = TPH Requester 1
    ecap 0018[1c0] = LTR 1
    ecap 000d[1d0] = ACS 1

igb1@pci0:3:0:1:	class=0x020000 rev=0x01 hdr=0x00 vendor=0x8086 device=0x1521 subvendor=0x8086 subdevice=0x0002
    vendor     = 'Intel Corporation'
    device     = 'I350 Gigabit Network Connection'
    class      = network
    subclass   = ethernet
    bar   [10] = type Memory, range 32, base 0xfb500000, size 1048576, enabled
    bar   [1c] = type Memory, range 32, base 0xfb780000, size 16384, enabled
    cap 01[40] = powerspec 3  supports D0 D3  current D0
    cap 05[50] = MSI supports 1 message, 64 bit, vector masks 
    cap 11[70] = MSI-X supports 10 messages, enabled
                 Table in map 0x1c[0x0], PBA in map 0x1c[0x2000]
    cap 10[a0] = PCI-Express 2 endpoint max data 256(512) FLR NS
                 max read 512
                 link x4(x4) speed 5.0(5.0) ASPM disabled(L0s/L1)
    ecap 0001[100] = AER 2 0 fatal 0 non-fatal 1 corrected
    ecap 0003[140] = Serial 1 a0369fffff14bfd2
    ecap 000e[150] = ARI 1
    ecap 0010[160] = SR-IOV 1 IOV disabled, Memory Space disabled, ARI disabled
                     0 VFs configured out of 8 supported
                     First VF RID Offset 0x0180, VF RID Stride 0x0004
                     VF Device ID 0x1520
                     Page Sizes: 4096 (enabled), 8192, 65536, 262144, 1048576, 4194304
    ecap 0017[1a0] = TPH Requester 1
    ecap 000d[1d0] = ACS 1

xhci0@pci0:6:0:0:	class=0x0c0330 rev=0x02 hdr=0x00 vendor=0x104c device=0x8241 subvendor=0x1849 subdevice=0x8241
    vendor     = 'Texas Instruments'
    device     = 'TUSB73x0 SuperSpeed USB 3.0 xHCI Host Controller'
    class      = serial bus
    subclass   = USB
    bar   [10] = type Memory, range 64, base 0xfbd00000, size 65536, enabled
    bar   [18] = type Memory, range 64, base 0xfbd10000, size 8192, enabled
    cap 01[40] = powerspec 3  supports D0 D1 D2 D3  current D0
    cap 05[48] = MSI supports 8 messages, 64 bit 
    cap 10[70] = PCI-Express 2 endpoint max data 128(1024)
                 max read 512
                 link x1(x1) speed 5.0(5.0) ASPM disabled(L0s/L1) ClockPM disabled
    cap 11[c0] = MSI-X supports 8 messages, enabled
                 Table in map 0x18[0x0], PBA in map 0x18[0x1000]
    ecap 0001[100] = AER 2 0 fatal 0 non-fatal 1 corrected
    ecap 0003[150] = Serial 1 0800280000200000

xhci1@pci0:7:0:0:	class=0x0c0330 rev=0x00 hdr=0x00 vendor=0x1b21 device=0x1042 subvendor=0x1849 subdevice=0x1042
    vendor     = 'ASMedia Technology Inc.'
    device     = 'ASM1042 SuperSpeed USB Host Controller'
    class      = serial bus
    subclass   = USB
    bar   [10] = type Memory, range 64, base 0xfbc00000, size 32768, enabled
    cap 05[50] = MSI supports 8 messages, 64 bit 
    cap 11[68] = MSI-X supports 8 messages, enabled
                 Table in map 0x10[0x2000], PBA in map 0x10[0x2080]
    cap 01[78] = powerspec 3  supports D0 D3  current D0
    cap 10[80] = PCI-Express 2 legacy endpoint max data 128(512) NS
                 max read 512
                 link x1(x1) speed 5.0(5.0) ASPM disabled(L0s/L1)
    ecap 0002[100] = VC 1 max VC0

bge1@pci0:8:0:0:	class=0x020000 rev=0x10 hdr=0x00 vendor=0x14e4 device=0x16b1 subvendor=0x1849 subdevice=0x96b1
    vendor     = 'Broadcom Inc. and subsidiaries'
    device     = 'NetLink BCM57781 Gigabit Ethernet PCIe'
    class      = network
    subclass   = ethernet
    bar   [10] = type Prefetchable Memory, range 64, base 0xfb310000, size 65536, enabled
    bar   [18] = type Prefetchable Memory, range 64, base 0xfb300000, size 65536, enabled
    cap 01[48] = powerspec 3  supports D0 D3  current D0
    cap 05[58] = MSI supports 8 messages, 64 bit enabled with 1 message
    cap 11[a0] = MSI-X supports 5 messages
                 Table in map 0x18[0x0], PBA in map 0x18[0x120]
    cap 10[ac] = PCI-Express 2 endpoint max data 128(128)
                 max read 4096
                 link x1(x1) speed 2.5(2.5) ASPM disabled(L0s/L1) ClockPM disabled
    ecap 0001[100] = AER 1 0 fatal 0 non-fatal 1 corrected
    ecap 0003[13c] = Serial 1 0000bc5ff43ab2f8
    ecap 0004[150] = Power Budgeting 1
    ecap 0002[160] = VC 1 max VC0

none3@pci0:9:0:0:	class=0x0c0010 rev=0x01 hdr=0x00 vendor=0x1106 device=0x3403 subvendor=0x1849 subdevice=0x3403
    vendor     = 'VIA Technologies, Inc.'
    device     = 'VT6315 Series Firewire Controller'
    class      = serial bus
    subclass   = FireWire
    bar   [10] = type Memory, range 64, base 0xfba00000, size 2048, enabled
    bar   [18] = type I/O Port, range 32, base 0xe000, size 256, enabled
    cap 01[50] = powerspec 3  supports D0 D2 D3  current D0
    cap 05[80] = MSI supports 1 message, 64 bit, vector masks 
    cap 10[98] = PCI-Express 1 endpoint max data 128(128)
                 max read 512
                 link x1(x1) speed 2.5(2.5) ASPM disabled(L0s/L1) ClockPM disabled
    ecap 0001[100] = AER 1 0 fatal 0 non-fatal 1 corrected
    ecap 0003[130] = Serial 1 e6e811ffff8f1300

ahci0@pci0:10:0:0:	class=0x010601 rev=0x01 hdr=0x00 vendor=0x1b21 device=0x0612 subvendor=0x1849 subdevice=0x0612
    vendor     = 'ASMedia Technology Inc.'
    device     = 'ASM1062 Serial ATA Controller'
    class      = mass storage
    subclass   = SATA
    bar   [10] = type I/O Port, range 32, base 0xd050, size 8, enabled
    bar   [14] = type I/O Port, range 32, base 0xd040, size 4, enabled
    bar   [18] = type I/O Port, range 32, base 0xd030, size 8, enabled
    bar   [1c] = type I/O Port, range 32, base 0xd020, size 4, enabled
    bar   [20] = type I/O Port, range 32, base 0xd000, size 32, enabled
    bar   [24] = type Memory, range 32, base 0xfb900000, size 512, enabled
    cap 05[50] = MSI supports 1 message enabled with 1 message
    cap 01[78] = powerspec 3  supports D0 D3  current D0
    cap 10[80] = PCI-Express 2 legacy endpoint max data 128(512) NS
                 max read 512
                 link x1(x1) speed 5.0(5.0) ASPM disabled(L0s/L1)
    ecap 0002[100] = VC 1 max VC0

ahci1@pci0:11:0:0:	class=0x010601 rev=0x01 hdr=0x00 vendor=0x1b21 device=0x0612 subvendor=0x1849 subdevice=0x0612
    vendor     = 'ASMedia Technology Inc.'
    device     = 'ASM1062 Serial ATA Controller'
    class      = mass storage
    subclass   = SATA
    bar   [10] = type I/O Port, range 32, base 0xc050, size 8, enabled
    bar   [14] = type I/O Port, range 32, base 0xc040, size 4, enabled
    bar   [18] = type I/O Port, range 32, base 0xc030, size 8, enabled
    bar   [1c] = type I/O Port, range 32, base 0xc020, size 4, enabled
    bar   [20] = type I/O Port, range 32, base 0xc000, size 32, enabled
    bar   [24] = type Memory, range 32, base 0xfb800000, size 512, enabled
    cap 05[50] = MSI supports 1 message enabled with 1 message
    cap 01[78] = powerspec 3  supports D0 D3  current D0
    cap 10[80] = PCI-Express 2 legacy endpoint max data 128(512) NS
                 max read 512
                 link x1(x1) speed 5.0(5.0) ASPM disabled(L0s/L1)
    ecap 0002[100] = VC 1 max VC0

none4@pci0:255:8:0:	class=0x088000 rev=0x04 hdr=0x00 vendor=0x8086 device=0x0e80 subvendor=0x1849 subdevice=0x0e80
    vendor     = 'Intel Corporation'
    device     = 'Xeon E7 v2/Xeon E5 v2/Core i7 QPI Link 0'
    class      = base peripheral

none5@pci0:255:9:0:	class=0x088000 rev=0x04 hdr=0x00 vendor=0x8086 device=0x0e90 subvendor=0x1849 subdevice=0x0e90
    vendor     = 'Intel Corporation'
    device     = 'Xeon E7 v2/Xeon E5 v2/Core i7 QPI Link 1'
    class      = base peripheral

none6@pci0:255:10:0:	class=0x088000 rev=0x04 hdr=0x00 vendor=0x8086 device=0x0ec0 subvendor=0x1849 subdevice=0x0ec0
    vendor     = 'Intel Corporation'
    device     = 'Xeon E7 v2/Xeon E5 v2/Core i7 Power Control Unit 0'
    class      = base peripheral

none7@pci0:255:10:1:	class=0x088000 rev=0x04 hdr=0x00 vendor=0x8086 device=0x0ec1 subvendor=0x1849 subdevice=0x0ec1
    vendor     = 'Intel Corporation'
    device     = 'Xeon E7 v2/Xeon E5 v2/Core i7 Power Control Unit 1'
    class      = base peripheral

none8@pci0:255:10:2:	class=0x088000 rev=0x04 hdr=0x00 vendor=0x8086 device=0x0ec2 subvendor=0x1849 subdevice=0x0ec2
    vendor     = 'Intel Corporation'
    device     = 'Xeon E7 v2/Xeon E5 v2/Core i7 Power Control Unit 2'
    class      = base peripheral

none9@pci0:255:10:3:	class=0x088000 rev=0x04 hdr=0x00 vendor=0x8086 device=0x0ec3 subvendor=0x1849 subdevice=0x0ec3
    vendor     = 'Intel Corporation'
    device     = 'Xeon E7 v2/Xeon E5 v2/Core i7 Power Control Unit 3'
    class      = base peripheral

none10@pci0:255:11:0:	class=0x088000 rev=0x04 hdr=0x00 vendor=0x8086 device=0x0e1e subvendor=0x1849 subdevice=0x0e1e
    vendor     = 'Intel Corporation'
    device     = 'Xeon E7 v2/Xeon E5 v2/Core i7 UBOX Registers'
    class      = base peripheral

none11@pci0:255:11:3:	class=0x088000 rev=0x04 hdr=0x00 vendor=0x8086 device=0x0e1f subvendor=0x1849 subdevice=0x0e1f
    vendor     = 'Intel Corporation'
    device     = 'Xeon E7 v2/Xeon E5 v2/Core i7 UBOX Registers'
    class      = base peripheral

none12@pci0:255:12:0:	class=0x088000 rev=0x04 hdr=0x00 vendor=0x8086 device=0x0ee0 subvendor=0x1849 subdevice=0x0ee0
    vendor     = 'Intel Corporation'
    device     = 'Xeon E7 v2/Xeon E5 v2/Core i7 Unicast Registers'
    class      = base peripheral

none13@pci0:255:12:1:	class=0x088000 rev=0x04 hdr=0x00 vendor=0x8086 device=0x0ee2 subvendor=0x1849 subdevice=0x0ee2
    vendor     = 'Intel Corporation'
    device     = 'Xeon E7 v2/Xeon E5 v2/Core i7 Unicast Registers'
    class      = base peripheral

none14@pci0:255:12:2:	class=0x088000 rev=0x04 hdr=0x00 vendor=0x8086 device=0x0ee4 subvendor=0x1849 subdevice=0x0ee4
    vendor     = 'Intel Corporation'
    device     = 'Xeon E7 v2/Xeon E5 v2/Core i7 Unicast Registers'
    class      = base peripheral

none15@pci0:255:12:3:	class=0x088000 rev=0x04 hdr=0x00 vendor=0x8086 device=0x0ee6 subvendor=0x1849 subdevice=0x0ee6
    vendor     = 'Intel Corporation'
    device     = 'Xeon E7 v2/Xeon E5 v2/Core i7 Unicast Registers'
    class      = base peripheral

none16@pci0:255:12:4:	class=0x088000 rev=0x04 hdr=0x00 vendor=0x8086 device=0x0ee8 subvendor=0x1849 subdevice=0x0ee8
    vendor     = 'Intel Corporation'
    device     = 'Xeon E7 v2/Xeon E5 v2/Core i7 Unicast Registers'
    class      = base peripheral

none17@pci0:255:13:0:	class=0x088000 rev=0x04 hdr=0x00 vendor=0x8086 device=0x0ee1 subvendor=0x1849 subdevice=0x0ee1
    vendor     = 'Intel Corporation'
    device     = 'Xeon E7 v2/Xeon E5 v2/Core i7 Unicast Registers'
    class      = base peripheral

none18@pci0:255:13:1:	class=0x088000 rev=0x04 hdr=0x00 vendor=0x8086 device=0x0ee3 subvendor=0x1849 subdevice=0x0ee3
    vendor     = 'Intel Corporation'
    device     = 'Xeon E7 v2/Xeon E5 v2/Core i7 Unicast Registers'
    class      = base peripheral

none19@pci0:255:13:2:	class=0x088000 rev=0x04 hdr=0x00 vendor=0x8086 device=0x0ee5 subvendor=0x1849 subdevice=0x0ee5
    vendor     = 'Intel Corporation'
    device     = 'Xeon E7 v2/Xeon E5 v2/Core i7 Unicast Registers'
    class      = base peripheral

none20@pci0:255:13:3:	class=0x088000 rev=0x04 hdr=0x00 vendor=0x8086 device=0x0ee7 subvendor=0x1849 subdevice=0x0ee7
    vendor     = 'Intel Corporation'
    device     = 'Xeon E7 v2/Xeon E5 v2/Core i7 Unicast Registers'
    class      = base peripheral

none21@pci0:255:13:4:	class=0x088000 rev=0x04 hdr=0x00 vendor=0x8086 device=0x0ee9 subvendor=0x1849 subdevice=0x0ee9
    vendor     = 'Intel Corporation'
    device     = 'Xeon E7 v2/Xeon E5 v2/Core i7 Unicast Registers'
    class      = base peripheral

none22@pci0:255:14:0:	class=0x088000 rev=0x04 hdr=0x00 vendor=0x8086 device=0x0ea0 subvendor=0x1849 subdevice=0x0ea0
    vendor     = 'Intel Corporation'
    device     = 'Xeon E7 v2/Xeon E5 v2/Core i7 Home Agent 0'
    class      = base peripheral

none23@pci0:255:14:1:	class=0x110100 rev=0x04 hdr=0x00 vendor=0x8086 device=0x0e30 subvendor=0x1849 subdevice=0x0e30
    vendor     = 'Intel Corporation'
    device     = 'Xeon E7 v2/Xeon E5 v2/Core i7 Home Agent 0'
    class      = dasp
    subclass   = performance counters

none24@pci0:255:15:0:	class=0x088000 rev=0x04 hdr=0x00 vendor=0x8086 device=0x0ea8 subvendor=0x1849 subdevice=0x0ea8
    vendor     = 'Intel Corporation'
    device     = 'Xeon E7 v2/Xeon E5 v2/Core i7 Integrated Memory Controller 0 Target Address/Thermal Registers'
    class      = base peripheral
    cap 10[40] = PCI-Express 1 root endpoint max data 128(128)
                 max read 128

none25@pci0:255:15:1:	class=0x088000 rev=0x04 hdr=0x00 vendor=0x8086 device=0x0e71 subvendor=0x1849 subdevice=0x0e71
    vendor     = 'Intel Corporation'
    device     = 'Xeon E7 v2/Xeon E5 v2/Core i7 Integrated Memory Controller 0 RAS Registers'
    class      = base peripheral
    cap 10[40] = PCI-Express 1 root endpoint max data 128(128)
                 max read 128

none26@pci0:255:15:2:	class=0x088000 rev=0x04 hdr=0x00 vendor=0x8086 device=0x0eaa subvendor=0x1849 subdevice=0x0eaa
    vendor     = 'Intel Corporation'
    device     = 'Xeon E7 v2/Xeon E5 v2/Core i7 Integrated Memory Controller 0 Channel Target Address Decoder Registers'
    class      = base peripheral
    cap 10[40] = PCI-Express 1 root endpoint max data 128(128)
                 max read 128

none27@pci0:255:15:3:	class=0x088000 rev=0x04 hdr=0x00 vendor=0x8086 device=0x0eab subvendor=0x1849 subdevice=0x0eab
    vendor     = 'Intel Corporation'
    device     = 'Xeon E7 v2/Xeon E5 v2/Core i7 Integrated Memory Controller 0 Channel Target Address Decoder Registers'
    class      = base peripheral
    cap 10[40] = PCI-Express 1 root endpoint max data 128(128)
                 max read 128

none28@pci0:255:15:4:	class=0x088000 rev=0x04 hdr=0x00 vendor=0x8086 device=0x0eac subvendor=0x1849 subdevice=0x0eac
    vendor     = 'Intel Corporation'
    device     = 'Xeon E7 v2/Xeon E5 v2/Core i7 Integrated Memory Controller 0 Channel Target Address Decoder Registers'
    class      = base peripheral
    cap 10[40] = PCI-Express 1 root endpoint max data 128(128)
                 max read 128

none29@pci0:255:15:5:	class=0x088000 rev=0x04 hdr=0x00 vendor=0x8086 device=0x0ead subvendor=0x1849 subdevice=0x0ead
    vendor     = 'Intel Corporation'
    device     = 'Xeon E7 v2/Xeon E5 v2/Core i7 Integrated Memory Controller 0 Channel Target Address Decoder Registers'
    class      = base peripheral
    cap 10[40] = PCI-Express 1 root endpoint max data 128(128)
                 max read 128

none30@pci0:255:16:0:	class=0x088000 rev=0x04 hdr=0x00 vendor=0x8086 device=0x0eb0 subvendor=0x1849 subdevice=0x0eb0
    vendor     = 'Intel Corporation'
    device     = 'Xeon E7 v2/Xeon E5 v2/Core i7 Integrated Memory Controller 1 Channel 0-3 Thermal Control 0'
    class      = base peripheral
    cap 10[40] = PCI-Express 1 root endpoint max data 128(128)
                 max read 128

none31@pci0:255:16:1:	class=0x088000 rev=0x04 hdr=0x00 vendor=0x8086 device=0x0eb1 subvendor=0x1849 subdevice=0x0eb1
    vendor     = 'Intel Corporation'
    device     = 'Xeon E7 v2/Xeon E5 v2/Core i7 Integrated Memory Controller 1 Channel 0-3 Thermal Control 1'
    class      = base peripheral
    cap 10[40] = PCI-Express 1 root endpoint max data 128(128)
                 max read 128

none32@pci0:255:16:2:	class=0x088000 rev=0x04 hdr=0x00 vendor=0x8086 device=0x0eb2 subvendor=0x1849 subdevice=0x0eb2
    vendor     = 'Intel Corporation'
    device     = 'Xeon E7 v2/Xeon E5 v2/Core i7 Integrated Memory Controller 1 Channel 0-3 ERROR Registers 0'
    class      = base peripheral
    cap 10[40] = PCI-Express 1 root endpoint max data 128(128)
                 max read 128

none33@pci0:255:16:3:	class=0x088000 rev=0x04 hdr=0x00 vendor=0x8086 device=0x0eb3 subvendor=0x1849 subdevice=0x0eb3
    vendor     = 'Intel Corporation'
    device     = 'Xeon E7 v2/Xeon E5 v2/Core i7 Integrated Memory Controller 1 Channel 0-3 ERROR Registers 1'
    class      = base peripheral
    cap 10[40] = PCI-Express 1 root endpoint max data 128(128)
                 max read 128

none34@pci0:255:16:4:	class=0x088000 rev=0x04 hdr=0x00 vendor=0x8086 device=0x0eb4 subvendor=0x1849 subdevice=0x0eb4
    vendor     = 'Intel Corporation'
    device     = 'Xeon E7 v2/Xeon E5 v2/Core i7 Integrated Memory Controller 1 Channel 0-3 Thermal Control 2'
    class      = base peripheral
    cap 10[40] = PCI-Express 1 root endpoint max data 128(128)
                 max read 128

none35@pci0:255:16:5:	class=0x088000 rev=0x04 hdr=0x00 vendor=0x8086 device=0x0eb5 subvendor=0x1849 subdevice=0x0eb5
    vendor     = 'Intel Corporation'
    device     = 'Xeon E7 v2/Xeon E5 v2/Core i7 Integrated Memory Controller 1 Channel 0-3 Thermal Control 3'
    class      = base peripheral
    cap 10[40] = PCI-Express 1 root endpoint max data 128(128)
                 max read 128

none36@pci0:255:16:7:	class=0x088000 rev=0x04 hdr=0x00 vendor=0x8086 device=0x0eb7 subvendor=0x1849 subdevice=0x0eb7
    vendor     = 'Intel Corporation'
    device     = 'Xeon E7 v2/Xeon E5 v2/Core i7 Integrated Memory Controller 1 Channel 0-3 ERROR Registers 3'
    class      = base peripheral
    cap 10[40] = PCI-Express 1 root endpoint max data 128(128)
                 max read 128

none37@pci0:255:19:0:	class=0x088000 rev=0x04 hdr=0x00 vendor=0x8086 device=0x0e1d subvendor=0x1849 subdevice=0x0e1d
    vendor     = 'Intel Corporation'
    device     = 'Xeon E7 v2/Xeon E5 v2/Core i7 R2PCIe'
    class      = base peripheral

none38@pci0:255:19:1:	class=0x110100 rev=0x04 hdr=0x00 vendor=0x8086 device=0x0e34 subvendor=0x1849 subdevice=0x0e34
    vendor     = 'Intel Corporation'
    device     = 'Xeon E7 v2/Xeon E5 v2/Core i7 R2PCIe'
    class      = dasp
    subclass   = performance counters

none39@pci0:255:19:4:	class=0x088000 rev=0x04 hdr=0x00 vendor=0x8086 device=0x0e81 subvendor=0x1849 subdevice=0x0e81
    vendor     = 'Intel Corporation'
    device     = 'Xeon E7 v2/Xeon E5 v2/Core i7 QPI Ring Registers'
    class      = base peripheral

none40@pci0:255:19:5:	class=0x110100 rev=0x04 hdr=0x00 vendor=0x8086 device=0x0e36 subvendor=0x1849 subdevice=0x0e36
    vendor     = 'Intel Corporation'
    device     = 'Xeon E7 v2/Xeon E5 v2/Core i7 QPI Ring Performance Ring Monitoring'
    class      = dasp
    subclass   = performance counters

none41@pci0:255:22:0:	class=0x088000 rev=0x04 hdr=0x00 vendor=0x8086 device=0x0ec8 subvendor=0x1849 subdevice=0x0ee0
    vendor     = 'Intel Corporation'
    device     = 'Xeon E7 v2/Xeon E5 v2/Core i7 System Address Decoder'
    class      = base peripheral

none42@pci0:255:22:1:	class=0x088000 rev=0x04 hdr=0x00 vendor=0x8086 device=0x0ec9 subvendor=0x1849 subdevice=0x0ee0
    vendor     = 'Intel Corporation'
    device     = 'Xeon E7 v2/Xeon E5 v2/Core i7 Broadcast Registers'
    class      = base peripheral

none43@pci0:255:22:2:	class=0x088000 rev=0x04 hdr=0x00 vendor=0x8086 device=0x0eca subvendor=0x1849 subdevice=0x0ee0
    vendor     = 'Intel Corporation'
    device     = 'Xeon E7 v2/Xeon E5 v2/Core i7 Broadcast Registers'
    class      = base peripheral
