hostb0@pci0:0:0:0:	class=0x060000 rev=0x05 hdr=0x00 vendor=0x8086 device=0x591f subvendor=0x1043 subdevice=0x8694
    vendor     = 'Intel Corporation'
    device     = 'Xeon E3-1200 v6/7th Gen Core Processor Host Bridge/DRAM Registers'
    class      = bridge
    subclass   = HOST-PCI
    cap 09[e0] = vendor (length 16) Intel cap 0 version 1

pcib1@pci0:0:1:0:	class=0x060400 rev=0x05 hdr=0x01 vendor=0x8086 device=0x1901 subvendor=0x1043 subdevice=0x8694
    vendor     = 'Intel Corporation'
    device     = '6th-10th Gen Core Processor PCIe Controller (x16)'
    class      = bridge
    subclass   = PCI-PCI
    cap 0d[88] = PCI Bridge subvendor=0x1043 subdevice=0x8694
    cap 01[80] = powerspec 3  supports D0 D3  current D0
    cap 05[90] = MSI supports 1 message 
    cap 10[a0] = PCI-Express 2 root port max data 256(256)
                 max read 128
                 link x8(x16) speed 5.0(8.0) ASPM disabled(L0s/L1)
                 slot 1 power limit 75000 mW
    ecap 0002[100] = VC 1 max VC0
    ecap 0005[140] = Root Complex Link Declaration 1
    ecap 0019[d94] = PCIe Sec 1 lane errors 0

vgapci0@pci0:0:2:0:	class=0x030000 rev=0x04 hdr=0x00 vendor=0x8086 device=0x5912 subvendor=0x1043 subdevice=0x8694
    vendor     = 'Intel Corporation'
    device     = 'HD Graphics 630'
    class      = display
    subclass   = VGA
    bar   [10] = type Memory, range 64, base 0xf4000000, size 16777216, enabled
    bar   [18] = type Prefetchable Memory, range 64, base 0xe0000000, size 268435456, enabled
    bar   [20] = type I/O Port, range 32, base 0xf000, size 64, enabled
    cap 09[40] = vendor (length 12) Intel cap 0 version 1
    cap 10[70] = PCI-Express 2 root endpoint max data 128(128) FLR
                 max read 128
    cap 05[ac] = MSI supports 1 message 
    cap 01[d0] = powerspec 2  supports D0 D3  current D0
    ecap 001b[100] = Process Address Space ID 1
    ecap 000f[200] = ATS 1
    ecap 0013[300] = Page Page Request 1

xhci0@pci0:0:20:0:	class=0x0c0330 rev=0x00 hdr=0x00 vendor=0x8086 device=0xa2af subvendor=0x1043 subdevice=0x8694
    vendor     = 'Intel Corporation'
    device     = '200 Series/Z370 Chipset Family USB 3.0 xHCI Controller'
    class      = serial bus
    subclass   = USB
    bar   [10] = type Memory, range 64, base 0xf7330000, size 65536, enabled
    cap 01[70] = powerspec 2  supports D0 D3  current D0
    cap 05[80] = MSI supports 8 messages, 64 bit enabled with 1 message

none0@pci0:0:22:0:	class=0x078000 rev=0x00 hdr=0x00 vendor=0x8086 device=0xa2ba subvendor=0x1043 subdevice=0x8694
    vendor     = 'Intel Corporation'
    device     = '200 Series PCH CSME HECI'
    class      = simple comms
    bar   [10] = type Memory, range 64, base 0xf734d000, size 4096, enabled
    cap 01[50] = powerspec 3  supports D0 D3  current D0
    cap 05[8c] = MSI supports 1 message, 64 bit 

ahci0@pci0:0:23:0:	class=0x010601 rev=0x00 hdr=0x00 vendor=0x8086 device=0xa282 subvendor=0x1043 subdevice=0x8694
    vendor     = 'Intel Corporation'
    device     = '200 Series PCH SATA controller [AHCI mode]'
    class      = mass storage
    subclass   = SATA
    bar   [10] = type Memory, range 32, base 0xf7348000, size 8192, enabled
    bar   [14] = type Memory, range 32, base 0xf734c000, size 256, enabled
    bar   [18] = type I/O Port, range 32, base 0xf090, size 8, enabled
    bar   [1c] = type I/O Port, range 32, base 0xf080, size 4, enabled
    bar   [20] = type I/O Port, range 32, base 0xf060, size 32, enabled
    bar   [24] = type Memory, range 32, base 0xf734b000, size 2048, enabled
    cap 05[80] = MSI supports 1 message enabled with 1 message
    cap 01[70] = powerspec 3  supports D0 D3  current D0
    cap 12[a8] = SATA Index-Data Pair

pcib2@pci0:0:28:0:	class=0x060400 rev=0xf0 hdr=0x01 vendor=0x8086 device=0xa294 subvendor=0x1043 subdevice=0x8694
    vendor     = 'Intel Corporation'
    device     = '200 Series PCH PCI Express Root Port'
    class      = bridge
    subclass   = PCI-PCI
    cap 10[40] = PCI-Express 2 root port max data 128(256) ARI disabled
                 max read 128
                 link x0(x1) speed 0.0(8.0) ASPM disabled(L0s/L1)
    cap 05[80] = MSI supports 1 message 
    cap 0d[90] = PCI Bridge subvendor=0x1043 subdevice=0x8694
    cap 01[a0] = powerspec 3  supports D0 D3  current D0

pcib3@pci0:0:28:5:	class=0x060400 rev=0xf0 hdr=0x01 vendor=0x8086 device=0xa295 subvendor=0x1043 subdevice=0x8694
    vendor     = 'Intel Corporation'
    device     = '200 Series PCH PCI Express Root Port'
    class      = bridge
    subclass   = PCI-PCI
    cap 10[40] = PCI-Express 2 root port max data 128(256) ARI disabled
                 max read 128
                 link x1(x1) speed 2.5(8.0)
                 slot 9 power limit 100 mW
    cap 05[80] = MSI supports 1 message 
    cap 0d[90] = PCI Bridge subvendor=0x1043 subdevice=0x8694
    cap 01[a0] = powerspec 3  supports D0 D3  current D0
    ecap 0001[100] = AER 1 0 fatal 0 non-fatal 0 corrected
    ecap 000d[140] = ACS 1
    ecap 0019[220] = PCIe Sec 1 lane errors 0

pcib5@pci0:0:28:7:	class=0x060400 rev=0xf0 hdr=0x01 vendor=0x8086 device=0xa297 subvendor=0x1043 subdevice=0x8694
    vendor     = 'Intel Corporation'
    device     = '200 Series PCH PCI Express Root Port'
    class      = bridge
    subclass   = PCI-PCI
    cap 10[40] = PCI-Express 2 root port max data 256(256) ARI disabled
                 max read 128
                 link x1(x1) speed 5.0(8.0)
                 slot 11 power limit 100 mW
    cap 05[80] = MSI supports 1 message 
    cap 0d[90] = PCI Bridge subvendor=0x1043 subdevice=0x8694
    cap 01[a0] = powerspec 3  supports D0 D3  current D0
    ecap 0001[100] = AER 1 0 fatal 0 non-fatal 0 corrected
    ecap 000d[140] = ACS 1
    ecap 0019[220] = PCIe Sec 1 lane errors 0

pcib11@pci0:0:29:0:	class=0x060400 rev=0xf0 hdr=0x01 vendor=0x8086 device=0xa298 subvendor=0x1043 subdevice=0x8694
    vendor     = 'Intel Corporation'
    device     = '200 Series PCH PCI Express Root Port'
    class      = bridge
    subclass   = PCI-PCI
    cap 10[40] = PCI-Express 2 root port max data 128(256) ARI disabled
                 max read 128
                 link x0(x4) speed 0.0(8.0) ASPM disabled(L0s/L1)
                 slot 0 power limit 0 mW HotPlug(empty) surprise
    cap 05[80] = MSI supports 1 message enabled with 1 message
    cap 0d[90] = PCI Bridge subvendor=0x1043 subdevice=0x8694
    cap 01[a0] = powerspec 3  supports D0 D3  current D0

isab0@pci0:0:31:0:	class=0x060100 rev=0x00 hdr=0x00 vendor=0x8086 device=0xa2c8 subvendor=0x1043 subdevice=0x8694
    vendor     = 'Intel Corporation'
    device     = '200 Series PCH LPC Controller (B250)'
    class      = bridge
    subclass   = PCI-ISA

none1@pci0:0:31:2:	class=0x058000 rev=0x00 hdr=0x00 vendor=0x8086 device=0xa2a1 subvendor=0x1043 subdevice=0x8694
    vendor     = 'Intel Corporation'
    device     = '200 Series/Z370 Chipset Family Power Management Controller'
    class      = memory
    bar   [10] = type Memory, range 32, base 0xf7344000, size 16384, enabled

hdac0@pci0:0:31:3:	class=0x040300 rev=0x00 hdr=0x00 vendor=0x8086 device=0xa2f0 subvendor=0x1043 subdevice=0x86d4
    vendor     = 'Intel Corporation'
    device     = '200 Series PCH HD Audio'
    class      = multimedia
    subclass   = HDA
    bar   [10] = type Memory, range 64, base 0xf7340000, size 16384, enabled
    bar   [20] = type Memory, range 64, base 0xf7320000, size 65536, enabled
    cap 01[50] = powerspec 3  supports D0 D3  current D0
    cap 05[60] = MSI supports 1 message, 64 bit enabled with 1 message

ichsmb0@pci0:0:31:4:	class=0x0c0500 rev=0x00 hdr=0x00 vendor=0x8086 device=0xa2a3 subvendor=0x1043 subdevice=0x8694
    vendor     = 'Intel Corporation'
    device     = '200 Series/Z370 Chipset Family SMBus Controller'
    class      = serial bus
    subclass   = SMBus
    bar   [10] = type Memory, range 64, base 0xf734a000, size 256, enabled
    bar   [20] = type I/O Port, range 32, base 0xf040, size 32, enabled

em0@pci0:0:31:6:	class=0x020000 rev=0x00 hdr=0x00 vendor=0x8086 device=0x15b8 subvendor=0x1043 subdevice=0x8672
    vendor     = 'Intel Corporation'
    device     = 'Ethernet Connection (2) I219-V'
    class      = network
    subclass   = ethernet
    bar   [10] = type Memory, range 32, base 0xf7300000, size 131072, enabled
    cap 01[c8] = powerspec 3  supports D0 D3  current D0
    cap 05[d0] = MSI supports 1 message, 64 bit enabled with 1 message
    cap 13[e0] = PCI Advanced Features: FLR TP

sfxge0@pci0:1:0:0:	class=0x020000 rev=0x00 hdr=0x00 vendor=0x1924 device=0x0803 subvendor=0x1924 subdevice=0x7207
    vendor     = 'Solarflare Communications'
    device     = 'SFC9020 10G Ethernet Controller'
    class      = network
    subclass   = ethernet
    bar   [10] = type I/O Port, range 32, base 0xe100, size 256, enabled
    bar   [18] = type Memory, range 64, base 0xf6000000, size 16777216, enabled
    bar   [20] = type Memory, range 64, base 0xf7090000, size 65536, enabled
    cap 01[40] = powerspec 3  supports D0 D3  current D0
    cap 05[50] = MSI supports 1 message, 64 bit, vector masks 
    cap 10[70] = PCI-Express 2 endpoint max data 256(256) FLR RO
                 max read 512
                 link x8(x8) speed 5.0(5.0) ASPM disabled(L0s/L1)
    cap 11[b0] = MSI-X supports 32 messages, enabled
                 Table in map 0x20[0x0], PBA in map 0x20[0x8000]
    cap 03[d0] = VPD
    ecap 0001[100] = AER 1 0 fatal 0 non-fatal 1 corrected
    ecap 0003[140] = Serial 1 000f53ffff0d04bc
    ecap 000e[150] = ARI 1
    ecap 0010[160] = SR-IOV 1 IOV disabled, Memory Space disabled, ARI disabled
                     0 VFs configured out of 0 supported
                     First VF RID Offset 0x0002, VF RID Stride 0x0002
                     VF Device ID 0x1803
                     Page Sizes: 4096 (enabled), 8192, 16384, 32768, 65536, 131072, 262144, 524288, 1048576, 2097152, 4194304, 8388608, 16777216, 33554432, 67108864, 134217728

sfxge1@pci0:1:0:1:	class=0x020000 rev=0x00 hdr=0x00 vendor=0x1924 device=0x0803 subvendor=0x1924 subdevice=0x7207
    vendor     = 'Solarflare Communications'
    device     = 'SFC9020 10G Ethernet Controller'
    class      = network
    subclass   = ethernet
    bar   [10] = type I/O Port, range 32, base 0xe000, size 256, enabled
    bar   [18] = type Memory, range 64, base 0xf5000000, size 16777216, enabled
    bar   [20] = type Memory, range 64, base 0xf7080000, size 65536, enabled
    cap 01[40] = powerspec 3  supports D0 D3  current D0
    cap 05[50] = MSI supports 1 message, 64 bit, vector masks 
    cap 10[70] = PCI-Express 2 endpoint max data 256(256) FLR RO
                 max read 512
                 link x8(x8) speed 5.0(5.0) ASPM disabled(L0s/L1)
    cap 11[b0] = MSI-X supports 32 messages, enabled
                 Table in map 0x20[0x0], PBA in map 0x20[0x8000]
    cap 03[d0] = VPD
    ecap 0001[100] = AER 1 0 fatal 0 non-fatal 1 corrected
    ecap 0003[140] = Serial 1 000f53ffff0d04bc
    ecap 000e[150] = ARI 1
    ecap 0010[160] = SR-IOV 1 IOV disabled, Memory Space disabled, ARI disabled
                     0 VFs configured out of 0 supported
                     First VF RID Offset 0x0002, VF RID Stride 0x0002
                     VF Device ID 0x1803
                     Page Sizes: 4096 (enabled), 8192, 16384, 32768, 65536, 131072, 262144, 524288, 1048576, 2097152, 4194304, 8388608, 16777216, 33554432, 67108864, 134217728

pcib4@pci0:3:0:0:	class=0x060400 rev=0x04 hdr=0x01 vendor=0x1b21 device=0x1080 subvendor=0x1043 subdevice=0x8489
    vendor     = 'ASMedia Technology Inc.'
    device     = 'ASM1083/1085 PCIe to PCI Bridge'
    class      = bridge
    subclass   = PCI-PCI
    cap 05[50] = MSI supports 1 message, 64 bit 
    cap 01[78] = powerspec 3  supports D0 D1 D2 D3  current D0
    cap 10[80] = PCI-Express 1 PCI bridge max data 128(128) RO NS
                 max read 512
                 link x1(x1) speed 2.5(2.5) ASPM disabled(L0s/L1)
    cap 0d[c0] = PCI Bridge subvendor=0x1043 subdevice=0x8489
    ecap 0002[100] = VC 1 max VC0

pcib6@pci0:5:0:0:	class=0x060400 rev=0x01 hdr=0x01 vendor=0x1b21 device=0x1806 subvendor=0x0000 subdevice=0x0000
    vendor     = 'ASMedia Technology Inc.'
    class      = bridge
    subclass   = PCI-PCI
    cap 01[40] = powerspec 3  supports D0 D3  current D0
    cap 05[50] = MSI supports 1 message, 64 bit 
    cap 10[80] = PCI-Express 2 upstream port max data 256(512) RO NS ARI disabled
                 max read 128
                 link x1(x2) speed 5.0(5.0) ASPM disabled(L1) ClockPM enabled
    cap 0d[c0] = PCI Bridge subvendor=0x0000 subdevice=0x0000
    ecap 0001[100] = AER 1 0 fatal 1 non-fatal 1 corrected
    ecap 0004[140] = Power Budgeting 1
    ecap 0018[160] = LTR 1
    ecap 0012[180] = Multicast 1
    ecap 0019[1c0] = PCIe Sec 1 lane errors 0
    ecap 000b[200] = Vendor [1] ID 001a Rev 0 Length 3584

pcib7@pci0:6:0:0:	class=0x060400 rev=0x01 hdr=0x01 vendor=0x1b21 device=0x1806 subvendor=0x0000 subdevice=0x0000
    vendor     = 'ASMedia Technology Inc.'
    class      = bridge
    subclass   = PCI-PCI
    cap 01[40] = powerspec 3  supports D0 D3  current D0
    cap 05[50] = MSI supports 1 message, 64 bit 
    cap 10[80] = PCI-Express 2 downstream port max data 256(512) RO NS ARI disabled
                 max read 128
                 link x1(x1) speed 5.0(5.0) ASPM disabled(L1) ClockPM disabled
                 slot 0 power limit 0 mW
    cap 0d[c0] = PCI Bridge subvendor=0x0000 subdevice=0x0000
    ecap 0001[100] = AER 1 0 fatal 0 non-fatal 1 corrected
    ecap 0004[140] = Power Budgeting 1
    ecap 0018[160] = LTR 1
    ecap 0012[180] = Multicast 1
    ecap 0019[1c0] = PCIe Sec 1 lane errors 0
    ecap 000b[200] = Vendor [1] ID 001a Rev 0 Length 3584

pcib8@pci0:6:2:0:	class=0x060400 rev=0x01 hdr=0x01 vendor=0x1b21 device=0x1806 subvendor=0x0000 subdevice=0x0000
    vendor     = 'ASMedia Technology Inc.'
    class      = bridge
    subclass   = PCI-PCI
    cap 01[40] = powerspec 3  supports D0 D3  current D0
    cap 05[50] = MSI supports 1 message, 64 bit 
    cap 10[80] = PCI-Express 2 downstream port max data 256(512) RO NS ARI disabled
                 max read 128
                 link x1(x1) speed 2.5(5.0) ASPM disabled(L1) ClockPM disabled
                 slot 0 power limit 0 mW
    cap 0d[c0] = PCI Bridge subvendor=0x0000 subdevice=0x0000
    ecap 0001[100] = AER 1 0 fatal 1 non-fatal 1 corrected
    ecap 0004[140] = Power Budgeting 1
    ecap 0018[160] = LTR 1
    ecap 0012[180] = Multicast 1
    ecap 0019[1c0] = PCIe Sec 1 lane errors 0
    ecap 000b[200] = Vendor [1] ID 001a Rev 0 Length 3584

pcib9@pci0:6:6:0:	class=0x060400 rev=0x01 hdr=0x01 vendor=0x1b21 device=0x1806 subvendor=0x0000 subdevice=0x0000
    vendor     = 'ASMedia Technology Inc.'
    class      = bridge
    subclass   = PCI-PCI
    cap 01[40] = powerspec 3  supports D0 D3  current D0
    cap 05[50] = MSI supports 1 message, 64 bit 
    cap 10[80] = PCI-Express 2 downstream port max data 256(512) RO NS ARI disabled
                 max read 128
                 link x1(x1) speed 2.5(5.0) ASPM disabled(L1) ClockPM disabled
                 slot 0 power limit 0 mW
    cap 0d[c0] = PCI Bridge subvendor=0x0000 subdevice=0x0000
    ecap 0001[100] = AER 1 0 fatal 1 non-fatal 1 corrected
    ecap 0004[140] = Power Budgeting 1
    ecap 0018[160] = LTR 1
    ecap 0012[180] = Multicast 1
    ecap 0019[1c0] = PCIe Sec 1 lane errors 0
    ecap 000b[200] = Vendor [1] ID 001a Rev 0 Length 3584

pcib10@pci0:6:14:0:	class=0x060400 rev=0x01 hdr=0x01 vendor=0x1b21 device=0x1806 subvendor=0x0000 subdevice=0x0000
    vendor     = 'ASMedia Technology Inc.'
    class      = bridge
    subclass   = PCI-PCI
    cap 01[40] = powerspec 3  supports D0 D3  current D0
    cap 05[50] = MSI supports 1 message, 64 bit 
    cap 10[80] = PCI-Express 2 downstream port max data 256(512) RO NS ARI disabled
                 max read 128
                 link x1(x1) speed 5.0(5.0) ASPM disabled(L1) ClockPM disabled
                 slot 0 power limit 0 mW
    cap 0d[c0] = PCI Bridge subvendor=0x0000 subdevice=0x0000
    ecap 0001[100] = AER 1 0 fatal 0 non-fatal 1 corrected
    ecap 0004[140] = Power Budgeting 1
    ecap 0018[160] = LTR 1
    ecap 0012[180] = Multicast 1
    ecap 0019[1c0] = PCIe Sec 1 lane errors 0
    ecap 000b[200] = Vendor [1] ID 001a Rev 0 Length 3584

re0@pci0:7:0:0:	class=0x020000 rev=0x04 hdr=0x00 vendor=0x10ec device=0x8125 subvendor=0x10ec subdevice=0x0123
    vendor     = 'Realtek Semiconductor Co., Ltd.'
    device     = 'RTL8125 2.5GbE Controller'
    class      = network
    subclass   = ethernet
    bar   [10] = type I/O Port, range 32, base 0xd000, size 256, enabled
    bar   [18] = type Memory, range 64, base 0xf7210000, size 65536, enabled
    bar   [20] = type Memory, range 64, base 0xf7220000, size 16384, enabled
    cap 01[40] = powerspec 3  supports D0 D1 D2 D3  current D0
    cap 05[50] = MSI supports 1 message, 64 bit, vector masks 
    cap 10[70] = PCI-Express 2 endpoint MSI 1 max data 256(256) RO
                 max read 4096
                 link x1(x1) speed 5.0(5.0) ASPM disabled(L0s/L1) ClockPM disabled
    cap 11[b0] = MSI-X supports 32 messages, enabled
                 Table in map 0x20[0x0], PBA in map 0x20[0x800]
    cap 03[d0] = VPD
    ecap 0001[100] = AER 2 0 fatal 0 non-fatal 0 corrected
    ecap 0002[148] = VC 1 max VC0
    ecap 0003[168] = Serial 1 0000000000000000
    ecap 0017[178] = TPH Requester 1
    ecap 0018[204] = LTR 1
    ecap 001e[20c] = L1 PM Substates 1
    ecap 000b[21c] = Vendor [1] ID 0002 Rev 4 Length 256

re1@pci0:10:0:0:	class=0x020000 rev=0x04 hdr=0x00 vendor=0x10ec device=0x8125 subvendor=0x10ec subdevice=0x0123
    vendor     = 'Realtek Semiconductor Co., Ltd.'
    device     = 'RTL8125 2.5GbE Controller'
    class      = network
    subclass   = ethernet
    bar   [10] = type I/O Port, range 32, base 0xc000, size 256, enabled
    bar   [18] = type Memory, range 64, base 0xf7110000, size 65536, enabled
    bar   [20] = type Memory, range 64, base 0xf7120000, size 16384, enabled
    cap 01[40] = powerspec 3  supports D0 D1 D2 D3  current D0
    cap 05[50] = MSI supports 1 message, 64 bit, vector masks 
    cap 10[70] = PCI-Express 2 endpoint MSI 1 max data 256(256) RO
                 max read 4096
                 link x1(x1) speed 5.0(5.0) ASPM disabled(L0s/L1) ClockPM disabled
    cap 11[b0] = MSI-X supports 32 messages, enabled
                 Table in map 0x20[0x0], PBA in map 0x20[0x800]
    cap 03[d0] = VPD
    ecap 0001[100] = AER 2 0 fatal 0 non-fatal 0 corrected
    ecap 0002[148] = VC 1 max VC0
    ecap 0003[168] = Serial 1 0000000000000000
    ecap 0017[178] = TPH Requester 1
    ecap 0018[204] = LTR 1
    ecap 001e[20c] = L1 PM Substates 1
    ecap 000b[21c] = Vendor [1] ID 0002 Rev 4 Length 256
