hostb0@pci0:0:0:0:	class=0x060000 card=0x162a103c chip=0x01048086 rev=0x09 hdr=0x00
    vendor     = 'Intel Corporation'
    device     = '2nd Generation Core Processor Family DRAM Controller'
    class      = bridge
    subclass   = HOST-PCI
    cap 09[e0] = vendor (length 12) Intel cap 0 version 1

vgapci0@pci0:0:2:0:	class=0x030000 card=0x162a103c chip=0x01268086 rev=0x09 hdr=0x00
    vendor     = 'Intel Corporation'
    device     = '2nd Generation Core Processor Family Integrated Graphics Controller'
    class      = display
    subclass   = VGA
    bar   [10] = type Memory, range 64, base 0xd4000000, size 4194304, enabled
    bar   [18] = type Prefetchable Memory, range 64, base 0xc0000000, size 268435456, enabled
    bar   [20] = type I/O Port, range 32, base 0x4000, size 64, enabled
    cap 05[90] = MSI supports 1 message 
    cap 01[d0] = powerspec 2  supports D0 D3  current D0
    cap 13[a4] = PCI Advanced Features: FLR TP

none0@pci0:0:22:0:	class=0x078000 card=0x162a103c chip=0x1c3a8086 rev=0x04 hdr=0x00
    vendor     = 'Intel Corporation'
    device     = '6 Series/C200 Series Chipset Family MEI Controller'
    class      = simple comms
    bar   [10] = type Memory, range 64, base 0xd4624000, size 16, enabled
    cap 01[50] = powerspec 3  supports D0 D3  current D0
    cap 05[8c] = MSI supports 1 message, 64 bit 

uart2@pci0:0:22:3:	class=0x070002 card=0x162a103c chip=0x1c3d8086 rev=0x04 hdr=0x00
    vendor     = 'Intel Corporation'
    device     = '6 Series/C200 Series Chipset Family KT Controller'
    class      = simple comms
    subclass   = UART
    bar   [10] = type I/O Port, range 32, base 0x40c0, size 8, enabled
    bar   [14] = type Memory, range 32, base 0xd462a000, size 4096, enabled
    cap 01[c8] = powerspec 3  supports D0 D3  current D0
    cap 05[d0] = MSI supports 1 message, 64 bit enabled with 1 message

em0@pci0:0:25:0:	class=0x020000 card=0x162a103c chip=0x15028086 rev=0x04 hdr=0x00
    vendor     = 'Intel Corporation'
    device     = '82579LM Gigabit Network Connection (Lewisville)'
    class      = network
    subclass   = ethernet
    bar   [10] = type Memory, range 32, base 0xd4600000, size 131072, enabled
    bar   [14] = type Memory, range 32, base 0xd4629000, size 4096, enabled
    bar   [18] = type I/O Port, range 32, base 0x4040, size 32, enabled
    cap 01[c8] = powerspec 2  supports D0 D3  current D0
    cap 05[d0] = MSI supports 1 message, 64 bit enabled with 1 message
    cap 13[e0] = PCI Advanced Features: FLR TP

ehci0@pci0:0:26:0:	class=0x0c0320 card=0x162a103c chip=0x1c2d8086 rev=0x04 hdr=0x00
    vendor     = 'Intel Corporation'
    device     = '6 Series/C200 Series Chipset Family USB Enhanced Host Controller'
    class      = serial bus
    subclass   = USB
    bar   [10] = type Memory, range 32, base 0xd4628000, size 1024, enabled
    cap 01[50] = powerspec 2  supports D0 D3  current D0
    cap 0a[58] = EHCI Debug Port at offset 0xa0 in map 0x14
    cap 13[98] = PCI Advanced Features: FLR TP

hdac0@pci0:0:27:0:	class=0x040300 card=0x162a103c chip=0x1c208086 rev=0x04 hdr=0x00
    vendor     = 'Intel Corporation'
    device     = '6 Series/C200 Series Chipset Family High Definition Audio Controller'
    class      = multimedia
    subclass   = HDA
    bar   [10] = type Memory, range 64, base 0xd4620000, size 16384, enabled
    cap 01[50] = powerspec 2  supports D0 D3  current D0
    cap 05[60] = MSI supports 1 message, 64 bit enabled with 1 message
    cap 10[70] = PCI-Express 1 root endpoint max data 128(128) FLR NS
    ecap 0002[100] = VC 1 max VC1
    ecap 0005[130] = Root Complex Link Declaration 1

pcib1@pci0:0:28:0:	class=0x060400 card=0x162a103c chip=0x1c108086 rev=0xb4 hdr=0x01
    vendor     = 'Intel Corporation'
    device     = '6 Series/C200 Series Chipset Family PCI Express Root Port 1'
    class      = bridge
    subclass   = PCI-PCI
    cap 10[40] = PCI-Express 2 root port max data 128(128)
                 link x0(x1) speed 0.0(5.0) ASPM L0s/L1(L0s/L1)
                 slot 0 power limit 100 mW
    cap 05[80] = MSI supports 1 message 
    cap 0d[90] = PCI Bridge card=0x162a103c
    cap 01[a0] = powerspec 2  supports D0 D3  current D0

pcib2@pci0:0:28:1:	class=0x060400 card=0x162a103c chip=0x1c128086 rev=0xb4 hdr=0x01
    vendor     = 'Intel Corporation'
    device     = '6 Series/C200 Series Chipset Family PCI Express Root Port 2'
    class      = bridge
    subclass   = PCI-PCI
    cap 10[40] = PCI-Express 2 root port max data 128(128)
                 link x1(x1) speed 5.0(5.0) ASPM disabled(L0s/L1)
                 slot 1 power limit 100 mW HotPlug(present) surprise
    cap 05[80] = MSI supports 1 message 
    cap 0d[90] = PCI Bridge card=0x162a103c
    cap 01[a0] = powerspec 2  supports D0 D3  current D0

pcib3@pci0:0:28:2:	class=0x060400 card=0x162a103c chip=0x1c148086 rev=0xb4 hdr=0x01
    vendor     = 'Intel Corporation'
    device     = '6 Series/C200 Series Chipset Family PCI Express Root Port 3'
    class      = bridge
    subclass   = PCI-PCI
    cap 10[40] = PCI-Express 2 root port max data 128(128)
                 link x1(x1) speed 2.5(5.0) ASPM L1(L0s/L1)
                 slot 2 power limit 100 mW
    cap 05[80] = MSI supports 1 message 
    cap 0d[90] = PCI Bridge card=0x162a103c
    cap 01[a0] = powerspec 2  supports D0 D3  current D0

ehci1@pci0:0:29:0:	class=0x0c0320 card=0x162a103c chip=0x1c268086 rev=0x04 hdr=0x00
    vendor     = 'Intel Corporation'
    device     = '6 Series/C200 Series Chipset Family USB Enhanced Host Controller'
    class      = serial bus
    subclass   = USB
    bar   [10] = type Memory, range 32, base 0xd4627000, size 1024, enabled
    cap 01[50] = powerspec 2  supports D0 D3  current D0
    cap 0a[58] = EHCI Debug Port at offset 0xa0 in map 0x14
    cap 13[98] = PCI Advanced Features: FLR TP

isab0@pci0:0:31:0:	class=0x060100 card=0x162a103c chip=0x1c4f8086 rev=0x04 hdr=0x00
    vendor     = 'Intel Corporation'
    device     = 'QM67 Express Chipset LPC Controller'
    class      = bridge
    subclass   = PCI-ISA
    cap 09[e0] = vendor (length 12) Intel cap 1 version 0
		 features: AMT, 4 PCI-e x1 slots

atapci0@pci0:0:31:2:	class=0x01018a card=0x162a103c chip=0x1c018086 rev=0x04 hdr=0x00
    vendor     = 'Intel Corporation'
    device     = '6 Series/C200 Series Chipset Family Mobile SATA Controller (IDE mode, ports 0-3)'
    class      = mass storage
    subclass   = ATA
    bar   [20] = type I/O Port, range 32, base 0x4090, size 16, enabled
    bar   [24] = type I/O Port, range 32, base 0x4080, size 16, enabled
    cap 01[70] = powerspec 3  supports D0 D3  current D0
    cap 13[b0] = PCI Advanced Features: FLR TP

atapci1@pci0:0:31:5:	class=0x010185 card=0x162a103c chip=0x1c098086 rev=0x04 hdr=0x00
    vendor     = 'Intel Corporation'
    device     = '6 Series/C200 Series Chipset Family Mobile SATA Controller (IDE mode, ports 4-5)'
    class      = mass storage
    subclass   = ATA
    bar   [10] = type I/O Port, range 32, base 0x40a8, size 8, enabled
    bar   [14] = type I/O Port, range 32, base 0x40cc, size 4, enabled
    bar   [18] = type I/O Port, range 32, base 0x40a0, size 8, enabled
    bar   [1c] = type I/O Port, range 32, base 0x40c8, size 4, enabled
    bar   [20] = type I/O Port, range 32, base 0x4070, size 16, enabled
    bar   [24] = type I/O Port, range 32, base 0x4060, size 16, enabled
    cap 01[70] = powerspec 3  supports D0 D3  current D0
    cap 13[b0] = PCI Advanced Features: FLR TP

xhci0@pci0:2:0:0:	class=0x0c0330 card=0xffffffff chip=0x00151912 rev=0x02 hdr=0x00
    vendor     = 'Renesas Technology Corp.'
    device     = 'uPD720202 USB 3.0 Host Controller'
    class      = serial bus
    subclass   = USB
    bar   [10] = type Memory, range 64, base 0xd0000000, size 8192, enabled
    cap 01[50] = powerspec 3  supports D0 D3  current D0
    cap 05[70] = MSI supports 8 messages, 64 bit enabled with 1 message
    cap 11[90] = MSI-X supports 8 messages
                 Table in map 0x10[0x1000], PBA in map 0x10[0x1080]
    cap 10[a0] = PCI-Express 2 endpoint max data 128(128) NS
                 link x1(x1) speed 5.0(5.0) ASPM disabled(L0s/L1)
    ecap 0001[100] = AER 1 0 fatal 0 non-fatal 1 corrected
    ecap 0018[150] = LTR 1

none1@pci0:35:0:0:	class=0x0c0010 card=0x162a103c chip=0x2380197b rev=0x30 hdr=0x00
    vendor     = 'JMicron Technology Corp.'
    device     = 'IEEE 1394 Host Controller'
    class      = serial bus
    subclass   = FireWire
    bar   [10] = type Memory, range 32, base 0xd4400000, size 2048, enabled
    bar   [14] = type Memory, range 32, base 0xd4405000, size 256, enabled
    cap 01[44] = powerspec 3  supports D0 D3  current D0
    cap 10[80] = PCI-Express 1 endpoint max data 128(128) RO
                 link x1(x1) speed 2.5(2.5) ASPM L1(L0s/L1)
    cap 05[94] = MSI supports 1 message 

none2@pci0:35:0:1:	class=0x088000 card=0x162a103c chip=0x2392197b rev=0x30 hdr=0x00
    vendor     = 'JMicron Technology Corp.'
    device     = 'SD/MMC Host Controller'
    class      = base peripheral
    bar   [10] = type Memory, range 32, base 0xd4404000, size 256, enabled
    cap 01[a4] = powerspec 3  supports D0 D3  current D0
    cap 10[80] = PCI-Express 1 endpoint max data 128(128) RO
                 link x1(x1) speed 2.5(2.5) ASPM L1(L0s/L1)
    cap 05[94] = MSI supports 1 message 

sdhci_pci0@pci0:35:0:2:	class=0x080501 card=0x162a103c chip=0x2391197b rev=0x30 hdr=0x00
    vendor     = 'JMicron Technology Corp.'
    device     = 'Standard SD Host Controller'
    class      = base peripheral
    subclass   = SD host controller
    bar   [10] = type Memory, range 32, base 0xd4403000, size 256, enabled
    cap 01[a4] = powerspec 3  supports D0 D3  current D0
    cap 10[80] = PCI-Express 1 endpoint max data 128(128) RO
                 link x1(x1) speed 2.5(2.5) ASPM L1(L0s/L1)
    cap 05[94] = MSI supports 1 message enabled with 1 message
