hostb0@pci0:0:0:0:	class=0x060000 rev=0x02 hdr=0x00 vendor=0x8086 device=0x4660 subvendor=0x1462 subdevice=0x7d28
    vendor     = 'Intel Corporation'
    device     = '12th Gen Core Processor Host Bridge/DRAM Registers'
    class      = bridge
    subclass   = HOST-PCI

pcib1@pci0:0:1:0:	class=0x060400 rev=0x02 hdr=0x01 vendor=0x8086 device=0x460d subvendor=0x1462 subdevice=0x7d28
    vendor     = 'Intel Corporation'
    device     = '12th Gen Core Processor PCI Express x16 Controller'
    class      = bridge
    subclass   = PCI-PCI
    cap 10[40] = PCI-Express 2 root port max data 256(256) ARI disabled
                 max read 128
                 link x16(x16) speed 16.0(undef)
                 slot 1 power limit 75000 mW
    cap 05[80] = MSI supports 1 message, 64 bit 
    cap 0d[98] = PCI Bridge subvendor=0x1462 subdevice=0x7d28
    cap 01[a0] = powerspec 3  supports D0 D3  current D0
    ecap 0000[100] = unknown 0
    ecap 000d[220] = ACS 1
    ecap 001f[150] = Precision Time Measurement 1
    ecap 0019[a30] = PCIe Sec 1 lane errors 0
    ecap 0025[a90] = Data Link Feature 1
    ecap 0026[a9c] = Physical Layer 16.0 GT/s 1
    ecap 0027[edc] = Lane Margining at Receiver 1
    ecap 002a[adc] = Physical Layer 32.0 GT/s 1

pcib2@pci0:0:6:0:	class=0x060400 rev=0x02 hdr=0x01 vendor=0x8086 device=0x464d subvendor=0x0000 subdevice=0x0000
    vendor     = 'Intel Corporation'
    device     = '12th Gen Core Processor PCI Express x4 Controller'
    class      = bridge
    subclass   = PCI-PCI
    cap 10[40] = PCI-Express 2 root port max data 256(256) ARI disabled
                 max read 128
                 link x4(x4) speed 16.0(16.0)
                 slot 0 power limit 75000 mW
    cap 05[80] = MSI supports 1 message 
    cap 0d[90] = PCI Bridge subvendor=0x0000 subdevice=0x0000
    cap 01[a0] = powerspec 3  supports D0 D3  current D0
    ecap 0000[100] = unknown 0
    ecap 000d[220] = ACS 1
    ecap 001f[150] = Precision Time Measurement 1
    ecap 0002[280] = VC 1 max VC1
    ecap 0019[a30] = PCIe Sec 1 lane errors 0
    ecap 0025[a90] = Data Link Feature 1
    ecap 0026[a9c] = Physical Layer 16.0 GT/s 1
    ecap 0027[edc] = Lane Margining at Receiver 1

none0@pci0:0:8:0:	class=0x088000 rev=0x02 hdr=0x00 vendor=0x8086 device=0x464f subvendor=0x1462 subdevice=0x7d28
    vendor     = 'Intel Corporation'
    device     = '12th Gen Core Processor Gaussian & Neural Accelerator'
    class      = base peripheral
    bar   [10] = type Memory, range 64, base 0x401212f000, size 4096, enabled
    cap 05[90] = MSI supports 1 message 
    cap 09[a0] = vendor (length 20) Intel cap 15 version 0
    cap 01[dc] = powerspec 2  supports D0 D3  current D0
    cap 13[f0] = PCI Advanced Features: FLR TP

none1@pci0:0:10:0:	class=0x118000 rev=0x01 hdr=0x00 vendor=0x8086 device=0x467d subvendor=0x0000 subdevice=0x0000
    vendor     = 'Intel Corporation'
    device     = 'Platform Monitoring Technology'
    class      = dasp
    bar   [10] = type Memory, range 64, base 0x4012110000, size 32768, enabled
    cap 10[70] = PCI-Express 2 root endpoint max data 128(128)
                 max read 128
    cap 01[d0] = powerspec 3  supports D0 D3  current D0
    ecap 0023[100] = Designated Vendor-Specific 1
    ecap 0023[110] = Designated Vendor-Specific 1
    ecap 0023[120] = Designated Vendor-Specific 1

xhci0@pci0:0:20:0:	class=0x0c0330 rev=0x11 hdr=0x00 vendor=0x8086 device=0x7ae0 subvendor=0x1462 subdevice=0x7d28
    vendor     = 'Intel Corporation'
    device     = 'Alder Lake-S PCH USB 3.2 Gen 2x2 XHCI Controller'
    class      = serial bus
    subclass   = USB
    bar   [10] = type Memory, range 64, base 0x4012100000, size 65536, enabled
    cap 01[70] = powerspec 2  supports D0 D3  current D0
    cap 05[80] = MSI supports 8 messages, 64 bit enabled with 1 message
    cap 09[90] = vendor (length 20) Intel cap 15 version 0
    cap 09[b0] = vendor (length 0) Intel cap 0 version 1

none2@pci0:0:20:2:	class=0x050000 rev=0x11 hdr=0x00 vendor=0x8086 device=0x7aa7 subvendor=0x0000 subdevice=0x0000
    vendor     = 'Intel Corporation'
    device     = 'Alder Lake-S PCH Shared SRAM'
    class      = memory
    subclass   = RAM
    bar   [10] = type Memory, range 64, base 0x4012128000, size 16384, enabled
    bar   [18] = type Memory, range 64, base 0x401212e000, size 4096, enabled
    cap 01[80] = powerspec 3  supports D0 D3  current D0

iwlwifi0@pci0:0:20:3:	class=0x028000 rev=0x11 hdr=0x00 vendor=0x8086 device=0x7af0 subvendor=0x8086 subdevice=0x0094
    vendor     = 'Intel Corporation'
    device     = 'Alder Lake-S PCH CNVi WiFi'
    class      = network
    bar   [10] = type Memory, range 64, base 0x4012124000, size 16384, enabled
    cap 01[c8] = powerspec 3  supports D0 D3  current D0
    cap 05[d0] = MSI supports 1 message, 64 bit 
    cap 10[40] = PCI-Express 2 root endpoint max data 128(128) FLR RO NS
                 max read 128
    cap 11[80] = MSI-X supports 16 messages, enabled
                 Table in map 0x10[0x2000], PBA in map 0x10[0x3000]
    ecap 0018[100] = LTR 1
    ecap 000b[164] = Vendor [1] ID 0010 Rev 0 Length 20

none3@pci0:0:22:0:	class=0x078000 rev=0x11 hdr=0x00 vendor=0x8086 device=0x7ae8 subvendor=0x1462 subdevice=0x7d28
    vendor     = 'Intel Corporation'
    device     = 'Alder Lake-S PCH HECI Controller'
    class      = simple comms
    bar   [10] = type Memory, range 64, base 0x401212d000, size 4096, enabled
    cap 01[50] = powerspec 3  supports D0 D3  current D0
    cap 05[8c] = MSI supports 1 message, 64 bit 
    cap 09[a4] = vendor (length 20) Intel cap 15 version 0

ahci0@pci0:0:23:0:	class=0x010601 rev=0x11 hdr=0x00 vendor=0x8086 device=0x7ae2 subvendor=0x1462 subdevice=0x7d28
    vendor     = 'Intel Corporation'
    device     = 'Alder Lake-S PCH SATA Controller [AHCI Mode]'
    class      = mass storage
    subclass   = SATA
    bar   [10] = type Memory, range 32, base 0x52c00000, size 8192, enabled
    bar   [14] = type Memory, range 32, base 0x52c03000, size 256, enabled
    bar   [18] = type I/O Port, range 32, base 0x7050, size 8, enabled
    bar   [1c] = type I/O Port, range 32, base 0x7040, size 4, enabled
    bar   [20] = type I/O Port, range 32, base 0x7020, size 32, enabled
    bar   [24] = type Memory, range 32, base 0x52c02000, size 2048, enabled
    cap 05[80] = MSI supports 1 message enabled with 1 message
    cap 01[70] = powerspec 3  supports D0 D3  current D0
    cap 12[a8] = SATA Index-Data Pair

pcib3@pci0:0:28:0:	class=0x060400 rev=0x11 hdr=0x01 vendor=0x8086 device=0x7ab8 subvendor=0x0000 subdevice=0x0000
    vendor     = 'Intel Corporation'
    device     = 'Alder Lake-S PCH PCI Express Root Port'
    class      = bridge
    subclass   = PCI-PCI
    cap 10[40] = PCI-Express 2 root port max data 256(256) ARI disabled
                 max read 128
                 link x0(x1) speed 0.0(8.0) ASPM L0s/L1(L0s/L1)
                 slot 0 power limit 0 mW HotPlug(empty) surprise
    cap 05[80] = MSI supports 1 message, 64 bit 
    cap 00[90] = unknown

pcib4@pci0:0:28:1:	class=0x060400 rev=0x11 hdr=0x01 vendor=0x8086 device=0x7ab9 subvendor=0x1462 subdevice=0x7d28
    vendor     = 'Intel Corporation'
    device     = 'Alder Lake-S PCH PCI Express Root Port'
    class      = bridge
    subclass   = PCI-PCI
    cap 10[40] = PCI-Express 2 root port max data 256(256) ARI disabled
                 max read 128
                 link x1(x1) speed 5.0(8.0)
                 slot 5 power limit 100 mW
    cap 05[80] = MSI supports 1 message, 64 bit 
    cap 0d[98] = PCI Bridge subvendor=0x1462 subdevice=0x7d28
    cap 01[a0] = powerspec 3  supports D0 D3  current D0
    ecap 0000[100] = unknown 0
    ecap 000d[220] = ACS 1
    ecap 001f[150] = Precision Time Measurement 1
    ecap 0019[a30] = PCIe Sec 1 lane errors 0
    ecap 0025[a90] = Data Link Feature 1

pcib5@pci0:0:28:2:	class=0x060400 rev=0x11 hdr=0x01 vendor=0x8086 device=0x7aba subvendor=0x1462 subdevice=0x7d28
    vendor     = 'Intel Corporation'
    class      = bridge
    subclass   = PCI-PCI
    cap 10[40] = PCI-Express 2 root port max data 256(256) ARI disabled
                 max read 128
                 link x1(x1) speed 5.0(8.0)
                 slot 6 power limit 100 mW
    cap 05[80] = MSI supports 1 message, 64 bit 
    cap 0d[98] = PCI Bridge subvendor=0x1462 subdevice=0x7d28
    cap 01[a0] = powerspec 3  supports D0 D3  current D0
    ecap 0000[100] = unknown 0
    ecap 000d[220] = ACS 1
    ecap 001f[150] = Precision Time Measurement 1
    ecap 0019[a30] = PCIe Sec 1 lane errors 0
    ecap 0025[a90] = Data Link Feature 1

pcib6@pci0:0:28:3:	class=0x060400 rev=0x11 hdr=0x01 vendor=0x8086 device=0x7abb subvendor=0x1462 subdevice=0x7d28
    vendor     = 'Intel Corporation'
    class      = bridge
    subclass   = PCI-PCI
    cap 10[40] = PCI-Express 2 root port max data 256(256) ARI disabled
                 max read 128
                 link x1(x1) speed 5.0(8.0)
                 slot 7 power limit 100 mW
    cap 05[80] = MSI supports 1 message, 64 bit 
    cap 0d[98] = PCI Bridge subvendor=0x1462 subdevice=0x7d28
    cap 01[a0] = powerspec 3  supports D0 D3  current D0
    ecap 0000[100] = unknown 0
    ecap 000d[220] = ACS 1
    ecap 001f[150] = Precision Time Measurement 1
    ecap 0019[a30] = PCIe Sec 1 lane errors 0
    ecap 0025[a90] = Data Link Feature 1

pcib7@pci0:0:29:0:	class=0x060400 rev=0x11 hdr=0x01 vendor=0x8086 device=0x7ab0 subvendor=0x0000 subdevice=0x0000
    vendor     = 'Intel Corporation'
    device     = 'Alder Lake-S PCH PCI Express Root Port'
    class      = bridge
    subclass   = PCI-PCI
    cap 10[40] = PCI-Express 2 root port max data 256(256) ARI disabled
                 max read 128
                 link x0(x4) speed 0.0(8.0) ASPM L0s/L1(L0s/L1)
                 slot 0 power limit 0 mW HotPlug(empty) surprise
    cap 05[80] = MSI supports 1 message, 64 bit 
    cap 00[90] = unknown

pcib8@pci0:0:29:4:	class=0x060400 rev=0x11 hdr=0x01 vendor=0x8086 device=0x7ab4 subvendor=0x1462 subdevice=0x7d28
    vendor     = 'Intel Corporation'
    device     = 'Alder Lake-S PCH PCI Express Root Port'
    class      = bridge
    subclass   = PCI-PCI
    cap 10[40] = PCI-Express 2 root port max data 256(256) ARI disabled
                 max read 128
                 link x4(x4) speed 8.0(16.0)
                 slot 16 power limit 250 mW
    cap 05[80] = MSI supports 1 message, 64 bit 
    cap 0d[98] = PCI Bridge subvendor=0x1462 subdevice=0x7d28
    cap 01[a0] = powerspec 3  supports D0 D3  current D0
    ecap 0000[100] = unknown 0
    ecap 000d[220] = ACS 1
    ecap 001f[150] = Precision Time Measurement 1
    ecap 0019[a30] = PCIe Sec 1 lane errors 0
    ecap 0025[a90] = Data Link Feature 1
    ecap 0026[a9c] = Physical Layer 16.0 GT/s 1
    ecap 0027[edc] = Lane Margining at Receiver 1

isab0@pci0:0:31:0:	class=0x060100 rev=0x11 hdr=0x00 vendor=0x8086 device=0x7a84 subvendor=0x1462 subdevice=0x7d28
    vendor     = 'Intel Corporation'
    device     = 'Z690 Chipset LPC/eSPI Controller'
    class      = bridge
    subclass   = PCI-ISA

hdac1@pci0:0:31:3:	class=0x040300 rev=0x11 hdr=0x00 vendor=0x8086 device=0x7ad0 subvendor=0x1462 subdevice=0x7d28
    vendor     = 'Intel Corporation'
    device     = 'Alder Lake-S HD Audio Controller'
    class      = multimedia
    subclass   = HDA
    bar   [10] = type Memory, range 64, base 0x4012120000, size 16384, enabled
    bar   [20] = type Memory, range 64, base 0x4012000000, size 1048576, enabled
    cap 01[50] = powerspec 3  supports D0 D3  current D0
    cap 09[80] = vendor (length 20) Intel cap 15 version 0
    cap 05[60] = MSI supports 1 message, 64 bit enabled with 1 message

ichsmb0@pci0:0:31:4:	class=0x0c0500 rev=0x11 hdr=0x00 vendor=0x8086 device=0x7aa3 subvendor=0x1462 subdevice=0x7d28
    vendor     = 'Intel Corporation'
    device     = 'Alder Lake-S PCH SMBus Controller'
    class      = serial bus
    subclass   = SMBus
    bar   [10] = type Memory, range 64, base 0x401212c000, size 256, enabled
    bar   [20] = type I/O Port, range 32, base 0xefa0, size 32, enabled

none4@pci0:0:31:5:	class=0x0c8000 rev=0x11 hdr=0x00 vendor=0x8086 device=0x7aa4 subvendor=0x1462 subdevice=0x7d28
    vendor     = 'Intel Corporation'
    device     = 'Alder Lake-S PCH SPI Controller'
    class      = serial bus
    bar   [10] = type Memory, range 32, base 0xfe010000, size 4096, enabled

vgapci0@pci0:1:0:0:	class=0x030000 rev=0xa1 hdr=0x00 vendor=0x10de device=0x2206 subvendor=0x1028 subdevice=0x3891
    vendor     = 'NVIDIA Corporation'
    device     = 'GA102 [GeForce RTX 3080]'
    class      = display
    subclass   = VGA
    bar   [10] = type Memory, range 32, base 0x50000000, size 16777216, enabled
    bar   [14] = type Prefetchable Memory, range 64, base 0x4000000000, size 268435456, enabled
    bar   [1c] = type Prefetchable Memory, range 64, base 0x4010000000, size 33554432, enabled
    bar   [24] = type I/O Port, range 32, base 0x6000, size 128, enabled
    cap 01[60] = powerspec 3  supports D0 D3  current D0
    cap 05[68] = MSI supports 1 message, 64 bit enabled with 1 message
    cap 10[78] = PCI-Express 2 legacy endpoint max data 256(256) FLR RO NS
                 max read 512
                 link x16(x16) speed 16.0(16.0) ASPM disabled(L0s/L1) ClockPM enabled
    cap 09[b4] = vendor (length 20)
    ecap 0002[100] = VC 1 max VC0
    ecap 0018[250] = LTR 1
    ecap 001e[258] = L1 PM Substates 1
    ecap 0004[128] = Power Budgeting 1
    ecap 0001[420] = AER 2 0 fatal 0 non-fatal 1 corrected
    ecap 000b[600] = Vendor [1] ID 0001 Rev 1 Length 36
    ecap 0019[900] = PCIe Sec 1 lane errors 0
    ecap 0015[bb0] = Resizable BAR 1
    ecap 0026[c1c] = Physical Layer 16.0 GT/s 1
    ecap 0027[d00] = Lane Margining at Receiver 1
    ecap 0025[e00] = Data Link Feature 1

hdac0@pci0:1:0:1:	class=0x040300 rev=0xa1 hdr=0x00 vendor=0x10de device=0x1aef subvendor=0x1028 subdevice=0x3891
    vendor     = 'NVIDIA Corporation'
    device     = 'GA102 High Definition Audio Controller'
    class      = multimedia
    subclass   = HDA
    bar   [10] = type Memory, range 32, base 0x51080000, size 16384, enabled
    cap 01[60] = powerspec 3  supports D0 D3  current D0
    cap 05[68] = MSI supports 1 message, 64 bit enabled with 1 message
    cap 10[78] = PCI-Express 2 endpoint max data 256(256) RO NS
                 max read 512
                 link x16(x16) speed 16.0(16.0) ASPM disabled(L0s/L1) ClockPM enabled
    ecap 0001[100] = AER 2 0 fatal 0 non-fatal 1 corrected
    ecap 0025[160] = Data Link Feature 1

nvme0@pci0:2:0:0:	class=0x010802 rev=0x01 hdr=0x00 vendor=0x15b7 device=0x5011 subvendor=0x15b7 subdevice=0x5011
    vendor     = 'Sandisk Corp'
    device     = 'WD PC SN810 / Black SN850 NVMe SSD'
    class      = mass storage
    subclass   = NVM
    bar   [10] = type Memory, range 64, base 0x52b00000, size 16384, enabled
    cap 01[80] = powerspec 3  supports D0 D3  current D0
    cap 05[90] = MSI supports 32 messages, 64 bit 
    cap 11[b0] = MSI-X supports 65 messages, enabled
                 Table in map 0x10[0x3000], PBA in map 0x10[0x2000]
    cap 10[c0] = PCI-Express 2 endpoint max data 256(512) FLR RO NS
                 max read 512
                 link x4(x4) speed 16.0(16.0) ASPM disabled(L1) ClockPM enabled
    ecap 0001[100] = AER 2 0 fatal 0 non-fatal 0 corrected
    ecap 0018[1b8] = LTR 1
    ecap 0019[300] = PCIe Sec 1 lane errors 0
    ecap 001e[900] = L1 PM Substates 1
    ecap 0025[910] = Data Link Feature 1
    ecap 0027[920] = Lane Margining at Receiver 1
    ecap 0026[9c0] = Physical Layer 16.0 GT/s 1

igc0@pci0:4:0:0:	class=0x020000 rev=0x03 hdr=0x00 vendor=0x8086 device=0x15f3 subvendor=0x1462 subdevice=0x7d28
    vendor     = 'Intel Corporation'
    device     = 'Ethernet Controller I225-V'
    class      = network
    subclass   = ethernet
    bar   [10] = type Memory, range 32, base 0x52700000, size 1048576, enabled
    bar   [1c] = type Memory, range 32, base 0x52800000, size 16384, enabled
    cap 01[40] = powerspec 3  supports D0 D3  current D0
    cap 05[50] = MSI supports 1 message, 64 bit, vector masks 
    cap 11[70] = MSI-X supports 5 messages, enabled
                 Table in map 0x1c[0x0], PBA in map 0x1c[0x2000]
    cap 10[a0] = PCI-Express 2 endpoint max data 256(512) FLR RO NS
                 max read 512
                 link x1(x1) speed 5.0(5.0) ASPM disabled(L1)
    ecap 0001[100] = AER 2 0 fatal 0 non-fatal 0 corrected
    ecap 0003[140] = Serial 1 d8bbc1ffff98ef89
    ecap 0018[1c0] = LTR 1
    ecap 001f[1f0] = Precision Time Measurement 1
    ecap 001e[1e0] = L1 PM Substates 1

igc1@pci0:5:0:0:	class=0x020000 rev=0x03 hdr=0x00 vendor=0x8086 device=0x15f3 subvendor=0x1462 subdevice=0x7d28
    vendor     = 'Intel Corporation'
    device     = 'Ethernet Controller I225-V'
    class      = network
    subclass   = ethernet
    bar   [10] = type Memory, range 32, base 0x52500000, size 1048576, enabled
    bar   [1c] = type Memory, range 32, base 0x52600000, size 16384, enabled
    cap 01[40] = powerspec 3  supports D0 D3  current D0
    cap 05[50] = MSI supports 1 message, 64 bit, vector masks 
    cap 11[70] = MSI-X supports 5 messages, enabled
                 Table in map 0x1c[0x0], PBA in map 0x1c[0x2000]
    cap 10[a0] = PCI-Express 2 endpoint max data 256(512) FLR RO NS
                 max read 512
                 link x1(x1) speed 5.0(5.0) ASPM disabled(L1)
    ecap 0001[100] = AER 2 0 fatal 0 non-fatal 0 corrected
    ecap 0003[140] = Serial 1 d8bbc1ffff98ef8a
    ecap 0018[1c0] = LTR 1
    ecap 001f[1f0] = Precision Time Measurement 1
    ecap 001e[1e0] = L1 PM Substates 1

ahci1@pci0:6:0:0:	class=0x010601 rev=0x02 hdr=0x00 vendor=0x1b21 device=0x0612 subvendor=0x1b21 subdevice=0x1060
    vendor     = 'ASMedia Technology Inc.'
    device     = 'ASM1062 Serial ATA Controller'
    class      = mass storage
    subclass   = SATA
    bar   [10] = type I/O Port, range 32, base 0x4050, size 8, enabled
    bar   [14] = type I/O Port, range 32, base 0x4040, size 4, enabled
    bar   [18] = type I/O Port, range 32, base 0x4030, size 8, enabled
    bar   [1c] = type I/O Port, range 32, base 0x4020, size 4, enabled
    bar   [20] = type I/O Port, range 32, base 0x4000, size 32, enabled
    bar   [24] = type Memory, range 32, base 0x52a00000, size 512, enabled
    cap 05[50] = MSI supports 1 message enabled with 1 message
    cap 01[78] = powerspec 3  supports D0 D3  current D0
    cap 10[80] = PCI-Express 2 legacy endpoint max data 256(512) RO NS
                 max read 512
                 link x1(x1) speed 5.0(5.0)
    ecap 0002[100] = VC 1 max VC0

nvme1@pci0:8:0:0:	class=0x010802 rev=0x00 hdr=0x00 vendor=0x15b7 device=0x5006 subvendor=0x15b7 subdevice=0x5006
    vendor     = 'Sandisk Corp'
    device     = 'WD Black SN750 / PC SN730 NVMe SSD'
    class      = mass storage
    subclass   = NVM
    bar   [10] = type Memory, range 64, base 0x52900000, size 16384, enabled
    bar   [20] = type Memory, range 64, base 0x52904000, size 256, enabled
    cap 01[80] = powerspec 3  supports D0 D3  current D0
    cap 05[90] = MSI supports 32 messages, 64 bit 
    cap 11[b0] = MSI-X supports 65 messages, enabled
                 Table in map 0x10[0x2000], PBA in map 0x20[0x0]
    cap 10[c0] = PCI-Express 2 endpoint max data 256(256) FLR RO NS
                 max read 512
                 link x4(x4) speed 8.0(8.0) ASPM disabled(L1) ClockPM enabled
    ecap 0001[100] = AER 2 0 fatal 0 non-fatal 0 corrected
    ecap 0003[150] = Serial 1 0000000000000000
    ecap 0018[1b8] = LTR 1
    ecap 0019[300] = PCIe Sec 1 lane errors 0
    ecap 001e[900] = L1 PM Substates 1
