hostb0@pci0:0:0:0:	class=0x060000 rev=0x09 hdr=0x00 vendor=0x8086 device=0x1604 subvendor=0x8086 subdevice=0x1604
    vendor     = 'Intel Corporation'
    device     = 'Broadwell-U Host Bridge -OPI'
    class      = bridge
    subclass   = HOST-PCI
    cap 09[e0] = vendor (length 12) Intel cap 0 version 1

vgapci0@pci0:0:2:0:	class=0x030000 rev=0x09 hdr=0x00 vendor=0x8086 device=0x162b subvendor=0x1e50 subdevice=0x8002
    vendor     = 'Intel Corporation'
    device     = 'Iris Graphics 6100'
    class      = display
    subclass   = VGA
    bar   [10] = type Memory, range 64, base 0xa9000000, size 16777216, enabled
    bar   [18] = type Prefetchable Memory, range 64, base 0xb0000000, size 268435456, enabled
    bar   [20] = type I/O Port, range 32, base 0x5000, size 64, enabled
    cap 05[90] = MSI supports 1 message 
    cap 01[d0] = powerspec 2  supports D0 D3  current D0
    cap 13[a4] = PCI Advanced Features: FLR TP

hdac0@pci0:0:3:0:	class=0x040300 rev=0x09 hdr=0x00 vendor=0x8086 device=0x160c subvendor=0x111e subdevice=0x10ec
    vendor     = 'Intel Corporation'
    device     = 'Broadwell-U Audio Controller'
    class      = multimedia
    subclass   = HDA
    bar   [10] = type Memory, range 64, base 0xaa414000, size 16384, enabled
    cap 01[50] = powerspec 2  supports D0 D3  current D0
    cap 05[60] = MSI supports 1 message enabled with 1 message
    cap 10[70] = PCI-Express 1 root endpoint max data 128(128) FLR NS
                 max read 128

xhci0@pci0:0:20:0:	class=0x0c0330 rev=0x03 hdr=0x00 vendor=0x8086 device=0x9cb1 subvendor=0x8086 subdevice=0x9cb1
    vendor     = 'Intel Corporation'
    device     = 'Wildcat Point-LP USB xHCI Controller'
    class      = serial bus
    subclass   = USB
    bar   [10] = type Memory, range 64, base 0xaa400000, size 65536, enabled
    cap 01[70] = powerspec 2  supports D0 D3  current D0
    cap 05[80] = MSI supports 8 messages, 64 bit enabled with 1 message

none0@pci0:0:22:0:	class=0x078000 rev=0x03 hdr=0x00 vendor=0x8086 device=0x9cba subvendor=0x8086 subdevice=0x9cba
    vendor     = 'Intel Corporation'
    device     = 'Wildcat Point-LP MEI Controller'
    class      = simple comms
    bar   [10] = type Memory, range 64, base 0xaa41c000, size 32, enabled
    cap 01[50] = powerspec 3  supports D0 D3  current D0
    cap 05[8c] = MSI supports 1 message, 64 bit 

hdac1@pci0:0:27:0:	class=0x040300 rev=0x03 hdr=0x00 vendor=0x8086 device=0x9ca0 subvendor=0x8086 subdevice=0x9ca0
    vendor     = 'Intel Corporation'
    device     = 'Wildcat Point-LP High Definition Audio Controller'
    class      = multimedia
    subclass   = HDA
    bar   [10] = type Memory, range 64, base 0xaa410000, size 16384, enabled
    cap 01[50] = powerspec 3  supports D0 D3  current D0
    cap 05[60] = MSI supports 1 message, 64 bit enabled with 1 message

pcib1@pci0:0:28:0:	class=0x060400 rev=0xe3 hdr=0x01 vendor=0x8086 device=0x9c94 subvendor=0x8086 subdevice=0x9c94
    vendor     = 'Intel Corporation'
    device     = 'Wildcat Point-LP PCI Express Root Port'
    class      = bridge
    subclass   = PCI-PCI
    cap 10[40] = PCI-Express 2 root port max data 128(128)
                 max read 128
                 link x1(x1) speed 2.5(5.0) ASPM L1(L0s/L1)
                 slot 2 power limit 100 mW
    cap 05[80] = MSI supports 1 message 
    cap 0d[90] = PCI Bridge subvendor=0x8086 subdevice=0x9c94
    cap 01[a0] = powerspec 3  supports D0 D3  current D0
    ecap 0000[100] = unknown 0
    ecap 001e[200] = L1 PM Substates 1

pcib2@pci0:0:28:3:	class=0x060400 rev=0xe3 hdr=0x01 vendor=0x8086 device=0x9c96 subvendor=0x8086 subdevice=0x9c96
    vendor     = 'Intel Corporation'
    device     = 'Wildcat Point-LP PCI Express Root Port'
    class      = bridge
    subclass   = PCI-PCI
    cap 10[40] = PCI-Express 2 root port max data 128(128)
                 max read 128
                 link x1(x1) speed 2.5(5.0) ASPM L0s/L1(L0s/L1)
                 slot 3 power limit 100 mW
    cap 05[80] = MSI supports 1 message 
    cap 0d[90] = PCI Bridge subvendor=0x8086 subdevice=0x9c96
    cap 01[a0] = powerspec 3  supports D0 D3  current D0
    ecap 0000[100] = unknown 0
    ecap 001e[200] = L1 PM Substates 1

pcib3@pci0:0:28:5:	class=0x060400 rev=0xe3 hdr=0x01 vendor=0x8086 device=0x9c9a subvendor=0x8086 subdevice=0x9c9a
    vendor     = 'Intel Corporation'
    device     = 'Wildcat Point-LP PCI Express Root Port'
    class      = bridge
    subclass   = PCI-PCI
    cap 10[40] = PCI-Express 2 root port max data 128(128)
                 max read 128
                 link x1(x1) speed 2.5(5.0) ASPM L1(L0s/L1)
                 slot 5 power limit 100 mW
    cap 05[80] = MSI supports 1 message 
    cap 0d[90] = PCI Bridge subvendor=0x8086 subdevice=0x9c9a
    cap 01[a0] = powerspec 3  supports D0 D3  current D0
    ecap 0000[100] = unknown 0
    ecap 001e[200] = L1 PM Substates 1

ehci0@pci0:0:29:0:	class=0x0c0320 rev=0x03 hdr=0x00 vendor=0x8086 device=0x9ca6 subvendor=0x8086 subdevice=0x9ca6
    vendor     = 'Intel Corporation'
    device     = 'Wildcat Point-LP USB EHCI Controller'
    class      = serial bus
    subclass   = USB
    bar   [10] = type Memory, range 32, base 0xaa41a000, size 1024, enabled
    cap 01[50] = powerspec 3  supports D0 D3  current D0
    cap 0a[58] = EHCI Debug Port at offset 0xa0 in map 0x14
    cap 13[98] = PCI Advanced Features: FLR TP

isab0@pci0:0:31:0:	class=0x060100 rev=0x03 hdr=0x00 vendor=0x8086 device=0x9cc3 subvendor=0x8086 subdevice=0x9cc3
    vendor     = 'Intel Corporation'
    device     = 'Wildcat Point-LP LPC Controller'
    class      = bridge
    subclass   = PCI-ISA
    cap 09[e0] = vendor (length 12) Intel cap 1 version 0
		 features: AMT, 4 PCI-e x1 slots

ahci0@pci0:0:31:2:	class=0x010601 rev=0x03 hdr=0x00 vendor=0x8086 device=0x9c83 subvendor=0x8086 subdevice=0x9c83
    vendor     = 'Intel Corporation'
    device     = 'Wildcat Point-LP SATA Controller [AHCI Mode]'
    class      = mass storage
    subclass   = SATA
    bar   [10] = type I/O Port, range 32, base 0x50b0, size 8, enabled
    bar   [14] = type I/O Port, range 32, base 0x50a0, size 4, enabled
    bar   [18] = type I/O Port, range 32, base 0x5090, size 8, enabled
    bar   [1c] = type I/O Port, range 32, base 0x5080, size 4, enabled
    bar   [20] = type I/O Port, range 32, base 0x5060, size 32, enabled
    bar   [24] = type Memory, range 32, base 0xaa419000, size 2048, enabled
    cap 05[80] = MSI supports 1 message enabled with 1 message
    cap 01[70] = powerspec 3  supports D0 D3  current D0
    cap 12[a8] = SATA Index-Data Pair

ichsmb0@pci0:0:31:3:	class=0x0c0500 rev=0x03 hdr=0x00 vendor=0x8086 device=0x9ca2 subvendor=0x8086 subdevice=0x9ca2
    vendor     = 'Intel Corporation'
    device     = 'Wildcat Point-LP SMBus Controller'
    class      = serial bus
    subclass   = SMBus
    bar   [10] = type Memory, range 64, base 0xaa418000, size 256, enabled
    bar   [20] = type I/O Port, range 32, base 0x5040, size 32, enabled

re0@pci0:1:0:0:	class=0x020000 rev=0x15 hdr=0x00 vendor=0x10ec device=0x8168 subvendor=0x10ec subdevice=0x0123
    vendor     = 'Realtek Semiconductor Co., Ltd.'
    device     = 'RTL8111/8168/8411 PCI Express Gigabit Ethernet Controller'
    class      = network
    subclass   = ethernet
    bar   [10] = type I/O Port, range 32, base 0x4000, size 256, enabled
    bar   [18] = type Memory, range 64, base 0xaa304000, size 4096, enabled
    bar   [20] = type Memory, range 64, base 0xaa300000, size 16384, enabled
    cap 01[40] = powerspec 3  supports D0 D1 D2 D3  current D0
    cap 05[50] = MSI supports 1 message, 64 bit 
    cap 10[70] = PCI-Express 2 endpoint MSI 1 max data 128(128) RO
                 max read 4096
                 link x1(x1) speed 2.5(2.5) ASPM disabled(L0s/L1) ClockPM disabled
    cap 11[b0] = MSI-X supports 4 messages, enabled
                 Table in map 0x20[0x0], PBA in map 0x20[0x800]
    ecap 0001[100] = AER 2 0 fatal 0 non-fatal 0 corrected
    ecap 0002[140] = VC 1 max VC0
    ecap 0003[160] = Serial 1 01000000684ce000
    ecap 0018[170] = LTR 1
    ecap 001e[178] = L1 PM Substates 1

none1@pci0:2:0:0:	class=0x028000 rev=0x31 hdr=0x00 vendor=0x168c device=0x0042 subvendor=0x1a3b subdevice=0x2b51
    vendor     = 'Qualcomm Atheros'
    device     = 'QCA9377 802.11ac Wireless Network Adapter'
    class      = network
    bar   [10] = type Memory, range 64, base 0xaa000000, size 2097152, enabled
    cap 01[40] = powerspec 3  supports D0 D3  current D0
    cap 05[50] = MSI supports 8 messages, vector masks 
    cap 10[70] = PCI-Express 2 endpoint max data 128(256) RO
                 max read 512
                 link x1(x1) speed 2.5(2.5) ASPM L0s/L1(L0s/L1) ClockPM enabled
    ecap 0001[100] = AER 2 0 fatal 0 non-fatal 0 corrected
    ecap 0002[148] = VC 1 max VC0
    ecap 0003[168] = Serial 1 0000000000000000
    ecap 0018[178] = LTR 1
    ecap 001e[180] = L1 PM Substates 1

re1@pci0:3:0:0:	class=0x020000 rev=0x15 hdr=0x00 vendor=0x10ec device=0x8168 subvendor=0x10ec subdevice=0x0123
    vendor     = 'Realtek Semiconductor Co., Ltd.'
    device     = 'RTL8111/8168/8411 PCI Express Gigabit Ethernet Controller'
    class      = network
    subclass   = ethernet
    bar   [10] = type I/O Port, range 32, base 0x3000, size 256, enabled
    bar   [18] = type Memory, range 64, base 0xaa204000, size 4096, enabled
    bar   [20] = type Memory, range 64, base 0xaa200000, size 16384, enabled
    cap 01[40] = powerspec 3  supports D0 D1 D2 D3  current D0
    cap 05[50] = MSI supports 1 message, 64 bit 
    cap 10[70] = PCI-Express 2 endpoint MSI 1 max data 128(128) RO
                 max read 4096
                 link x1(x1) speed 2.5(2.5) ASPM disabled(L0s/L1) ClockPM disabled
    cap 11[b0] = MSI-X supports 4 messages, enabled
                 Table in map 0x20[0x0], PBA in map 0x20[0x800]
    ecap 0001[100] = AER 2 0 fatal 0 non-fatal 0 corrected
    ecap 0002[140] = VC 1 max VC0
    ecap 0003[160] = Serial 1 01000000684ce000
    ecap 0018[170] = LTR 1
    ecap 001e[178] = L1 PM Substates 1
