hostb0@pci0:0:0:0:	class=0x060000 card=0x22b11849 chip=0x22808086 rev=0x21 hdr=0x00
    vendor     = 'Intel Corporation'
    device     = 'Atom/Celeron/Pentium Processor x5-E8000/J3xxx/N3xxx Series SoC Transaction Register'
    class      = bridge
    subclass   = HOST-PCI

vgapci0@pci0:0:2:0:	class=0x030000 card=0x22b11849 chip=0x22b18086 rev=0x21 hdr=0x00
    vendor     = 'Intel Corporation'
    device     = 'Atom/Celeron/Pentium Processor x5-E8000/J3xxx/N3xxx Integrated Graphics Controller'
    class      = display
    subclass   = VGA
    bar   [10] = type Memory, range 64, base 0x90000000, size 16777216, enabled
    bar   [18] = type Prefetchable Memory, range 64, base 0x80000000, size 268435456, enabled
    bar   [20] = type I/O Port, range 32, base 0xf000, size 64, enabled
    cap 01[d0] = powerspec 2  supports D0 D3  current D0
    cap 05[90] = MSI supports 1 message 
    cap 09[b0] = vendor (length 7) Intel cap 0 version 1

xhci0@pci0:0:20:0:	class=0x0c0330 card=0x22b51849 chip=0x22b58086 rev=0x21 hdr=0x00
    vendor     = 'Intel Corporation'
    device     = 'Atom/Celeron/Pentium Processor x5-E8000/J3xxx/N3xxx Series USB xHCI Controller'
    class      = serial bus
    subclass   = USB
    bar   [10] = type Memory, range 64, base 0x91300000, size 65536, enabled
    cap 01[70] = powerspec 2  supports D0 D3  current D0
    cap 05[80] = MSI supports 8 messages, 64 bit enabled with 1 message

none0@pci0:0:26:0:	class=0x108000 card=0x22981849 chip=0x22988086 rev=0x21 hdr=0x00
    vendor     = 'Intel Corporation'
    device     = 'Atom/Celeron/Pentium Processor x5-E8000/J3xxx/N3xxx Series Trusted Execution Engine'
    class      = encrypt/decrypt
    bar   [10] = type Memory, range 32, base 0x91100000, size 1048576, enabled
    bar   [14] = type Memory, range 32, base 0x91000000, size 1048576, enabled
    cap 01[80] = powerspec 3  supports D0 D3  current D3
    cap 05[a0] = MSI supports 1 message 

hdac0@pci0:0:27:0:	class=0x040300 card=0xd8871849 chip=0x22848086 rev=0x21 hdr=0x00
    vendor     = 'Intel Corporation'
    device     = 'Atom/Celeron/Pentium Processor x5-E8000/J3xxx/N3xxx Series High Definition Audio Controller'
    class      = multimedia
    subclass   = HDA
    bar   [10] = type Memory, range 64, base 0x91310000, size 16384, enabled
    cap 01[50] = powerspec 2  supports D0 D3  current D0
    cap 05[60] = MSI supports 1 message, 64 bit enabled with 1 message

pcib1@pci0:0:28:0:	class=0x060400 card=0x22c81849 chip=0x22c88086 rev=0x21 hdr=0x01
    vendor     = 'Intel Corporation'
    device     = 'Atom/Celeron/Pentium Processor x5-E8000/J3xxx/N3xxx Series PCI Express Port'
    class      = bridge
    subclass   = PCI-PCI
    cap 10[40] = PCI-Express 2 root port max data 128(128)
                 link x0(x1) speed 0.0(5.0) ASPM disabled(L0s/L1)
                 slot 0 power limit 0 mW HotPlug(empty) surprise
    cap 05[80] = MSI supports 1 message enabled with 1 message
    cap 0d[90] = PCI Bridge card=0x22c81849
    cap 01[a0] = powerspec 3  supports D0 D3  current D0

pcib2@pci0:0:28:1:	class=0x060400 card=0x22ca1849 chip=0x22ca8086 rev=0x21 hdr=0x01
    vendor     = 'Intel Corporation'
    device     = 'Atom/Celeron/Pentium Processor x5-E8000/J3xxx/N3xxx Series PCI Express Port'
    class      = bridge
    subclass   = PCI-PCI
    cap 10[40] = PCI-Express 2 root port max data 128(128)
                 link x1(x1) speed 2.5(5.0) ASPM disabled(L0s/L1)
                 slot 1 power limit 100 mW
    cap 05[80] = MSI supports 1 message 
    cap 0d[90] = PCI Bridge card=0x22ca1849
    cap 01[a0] = powerspec 3  supports D0 D3  current D0
    ecap 0000[100] = unknown 0
    ecap 001e[200] = unknown 1

isab0@pci0:0:31:0:	class=0x060100 card=0x229c1849 chip=0x229c8086 rev=0x21 hdr=0x00
    vendor     = 'Intel Corporation'
    device     = 'Atom/Celeron/Pentium Processor x5-E8000/J3xxx/N3xxx Series PCU'
    class      = bridge
    subclass   = PCI-ISA
    cap 09[e0] = vendor (length 12) Intel cap 1 version 0
		 features: 4 PCI-e x1 slots

ichsmb0@pci0:0:31:3:	class=0x0c0500 card=0x22921849 chip=0x22928086 rev=0x21 hdr=0x00
    vendor     = 'Intel Corporation'
    device     = 'Atom/Celeron/Pentium Processor x5-E8000/J3xxx/N3xxx SMBus Controller'
    class      = serial bus
    subclass   = SMBus
    bar   [10] = type Memory, range 32, base 0x91314000, size 32, enabled
    bar   [20] = type I/O Port, range 32, base 0xf040, size 32, enabled
    cap 01[50] = powerspec 3  supports D0 D3  current D0

re0@pci0:2:0:0:	class=0x020000 card=0x81681849 chip=0x816810ec rev=0x11 hdr=0x00
    vendor     = 'Realtek Semiconductor Co., Ltd.'
    device     = 'RTL8111/8168/8411 PCI Express Gigabit Ethernet Controller'
    class      = network
    subclass   = ethernet
    bar   [10] = type I/O Port, range 32, base 0xe000, size 256, enabled
    bar   [18] = type Memory, range 64, base 0x91204000, size 4096, enabled
    bar   [20] = type Prefetchable Memory, range 64, base 0x91200000, size 16384, enabled
    cap 01[40] = powerspec 3  supports D0 D1 D2 D3  current D0
    cap 05[50] = MSI supports 1 message, 64 bit 
    cap 10[70] = PCI-Express 2 endpoint MSI 1 max data 128(128) RO
                 link x1(x1) speed 2.5(2.5) ASPM disabled(L0s/L1)
    cap 11[b0] = MSI-X supports 4 messages, enabled
                 Table in map 0x20[0x0], PBA in map 0x20[0x800]
    cap 03[d0] = VPD
    ecap 0001[100] = AER 1 0 fatal 0 non-fatal 0 corrected
    ecap 0002[140] = VC 1 max VC0
    ecap 0003[160] = Serial 1 01000000684ce000
    ecap 0018[170] = LTR 1
