hostb0@pci0:0:0:0:	class=0x060000 rev=0x09 hdr=0x00 vendor=0x8086 device=0x0104 subvendor=0x1025 subdevice=0x0504
    vendor     = 'Intel Corporation'
    device     = '2nd Generation Core Processor Family DRAM Controller'
    class      = bridge
    subclass   = HOST-PCI
    cap 09[e0] = vendor (length 12) Intel cap 0 version 1

pcib1@pci0:0:1:0:	class=0x060400 rev=0x09 hdr=0x01 vendor=0x8086 device=0x0101 subvendor=0x1025 subdevice=0x0504
    vendor     = 'Intel Corporation'
    device     = 'Xeon E3-1200/2nd Generation Core Processor Family PCI Express Root Port'
    class      = bridge
    subclass   = PCI-PCI
    cap 0d[88] = PCI Bridge subvendor=0x1025 subdevice=0x0504
    cap 01[80] = powerspec 3  supports D0 D3  current D0
    cap 05[90] = MSI supports 1 message 
    cap 10[a0] = PCI-Express 2 root port max data 128(128)
                 max read 128
                 link x16(x16) speed 5.0(5.0) ASPM L0s/L1(L0s/L1)
                 slot 1 power limit 75000 mW
    ecap 0002[100] = VC 1 max VC0
    ecap 0005[140] = Root Complex Link Declaration 1

vgapci1@pci0:0:2:0:	class=0x030000 rev=0x09 hdr=0x00 vendor=0x8086 device=0x0116 subvendor=0x1025 subdevice=0x0504
    vendor     = 'Intel Corporation'
    device     = '2nd Generation Core Processor Family Integrated Graphics Controller'
    class      = display
    subclass   = VGA
    bar   [10] = type Memory, range 64, base 0xb1400000, size 4194304, enabled
    bar   [18] = type Prefetchable Memory, range 64, base 0xa0000000, size 268435456, enabled
    bar   [20] = type I/O Port, range 32, base 0x3000, size 64, enabled
    cap 05[90] = MSI supports 1 message enabled with 1 message
    cap 01[d0] = powerspec 2  supports D0 D3  current D0
    cap 13[a4] = PCI Advanced Features: FLR TP

none0@pci0:0:22:0:	class=0x078000 rev=0x04 hdr=0x00 vendor=0x8086 device=0x1c3a subvendor=0x1025 subdevice=0x0504
    vendor     = 'Intel Corporation'
    device     = '6 Series/C200 Series Chipset Family MEI Controller'
    class      = simple comms
    bar   [10] = type Memory, range 64, base 0xb1a04000, size 16, enabled
    cap 01[50] = powerspec 3  supports D0 D3  current D0
    cap 05[8c] = MSI supports 1 message, 64 bit 

ehci0@pci0:0:26:0:	class=0x0c0320 rev=0x04 hdr=0x00 vendor=0x8086 device=0x1c2d subvendor=0x1025 subdevice=0x0504
    vendor     = 'Intel Corporation'
    device     = '6 Series/C200 Series Chipset Family USB Enhanced Host Controller'
    class      = serial bus
    subclass   = USB
    bar   [10] = type Memory, range 32, base 0xb1a0a000, size 1024, enabled
    cap 01[50] = powerspec 2  supports D0 D3  current D0
    cap 0a[58] = EHCI Debug Port at offset 0xa0 in map 0x14
    cap 13[98] = PCI Advanced Features: FLR TP

hdac0@pci0:0:27:0:	class=0x040300 rev=0x04 hdr=0x00 vendor=0x8086 device=0x1c20 subvendor=0x1025 subdevice=0x0504
    vendor     = 'Intel Corporation'
    device     = '6 Series/C200 Series Chipset Family High Definition Audio Controller'
    class      = multimedia
    subclass   = HDA
    bar   [10] = type Memory, range 64, base 0xb1a00000, size 16384, enabled
    cap 01[50] = powerspec 2  supports D0 D3  current D0
    cap 05[60] = MSI supports 1 message, 64 bit enabled with 1 message
    cap 10[70] = PCI-Express 1 root endpoint max data 128(128) FLR NS
                 max read 128
    ecap 0002[100] = VC 1 max VC1
    ecap 0005[130] = Root Complex Link Declaration 1

pcib2@pci0:0:28:0:	class=0x060400 rev=0xb4 hdr=0x01 vendor=0x8086 device=0x1c10 subvendor=0x1025 subdevice=0x0504
    vendor     = 'Intel Corporation'
    device     = '6 Series/C200 Series Chipset Family PCI Express Root Port 1'
    class      = bridge
    subclass   = PCI-PCI
    cap 10[40] = PCI-Express 2 root port max data 128(128)
                 max read 128
                 link x1(x1) speed 2.5(5.0) ASPM L1(L0s/L1)
                 slot 0 power limit 100 mW
    cap 05[80] = MSI supports 1 message 
    cap 0d[90] = PCI Bridge subvendor=0x1025 subdevice=0x0504
    cap 01[a0] = powerspec 2  supports D0 D3  current D0

pcib3@pci0:0:28:1:	class=0x060400 rev=0xb4 hdr=0x01 vendor=0x8086 device=0x1c12 subvendor=0x1025 subdevice=0x0504
    vendor     = 'Intel Corporation'
    device     = '6 Series/C200 Series Chipset Family PCI Express Root Port 2'
    class      = bridge
    subclass   = PCI-PCI
    cap 10[40] = PCI-Express 2 root port max data 128(128)
                 max read 128
                 link x1(x1) speed 2.5(5.0) ASPM L1(L0s/L1)
                 slot 1 power limit 100 mW
    cap 05[80] = MSI supports 1 message 
    cap 0d[90] = PCI Bridge subvendor=0x1025 subdevice=0x0504
    cap 01[a0] = powerspec 2  supports D0 D3  current D0

ehci1@pci0:0:29:0:	class=0x0c0320 rev=0x04 hdr=0x00 vendor=0x8086 device=0x1c26 subvendor=0x1025 subdevice=0x0504
    vendor     = 'Intel Corporation'
    device     = '6 Series/C200 Series Chipset Family USB Enhanced Host Controller'
    class      = serial bus
    subclass   = USB
    bar   [10] = type Memory, range 32, base 0xb1a09000, size 1024, enabled
    cap 01[50] = powerspec 2  supports D0 D3  current D0
    cap 0a[58] = EHCI Debug Port at offset 0xa0 in map 0x14
    cap 13[98] = PCI Advanced Features: FLR TP

isab0@pci0:0:31:0:	class=0x060100 rev=0x04 hdr=0x00 vendor=0x8086 device=0x1c49 subvendor=0x1025 subdevice=0x0504
    vendor     = 'Intel Corporation'
    device     = 'HM65 Express Chipset LPC Controller'
    class      = bridge
    subclass   = PCI-ISA
    cap 09[e0] = vendor (length 12) Intel cap 1 version 0
		 features: AMT, 4 PCI-e x1 slots

ahci0@pci0:0:31:2:	class=0x010601 rev=0x04 hdr=0x00 vendor=0x8086 device=0x1c03 subvendor=0x1025 subdevice=0x0504
    vendor     = 'Intel Corporation'
    device     = '6 Series/C200 Series Chipset Family 6 port Mobile SATA AHCI Controller'
    class      = mass storage
    subclass   = SATA
    bar   [10] = type I/O Port, range 32, base 0x3098, size 8, enabled
    bar   [14] = type I/O Port, range 32, base 0x30bc, size 4, enabled
    bar   [18] = type I/O Port, range 32, base 0x3090, size 8, enabled
    bar   [1c] = type I/O Port, range 32, base 0x30b8, size 4, enabled
    bar   [20] = type I/O Port, range 32, base 0x3060, size 32, enabled
    bar   [24] = type Memory, range 32, base 0xb1a08000, size 2048, enabled
    cap 05[80] = MSI supports 1 message enabled with 1 message
    cap 01[70] = powerspec 3  supports D0 D3  current D0
    cap 12[a8] = SATA Index-Data Pair
    cap 13[b0] = PCI Advanced Features: FLR TP

ichsmb0@pci0:0:31:3:	class=0x0c0500 rev=0x04 hdr=0x00 vendor=0x8086 device=0x1c22 subvendor=0x1025 subdevice=0x0504
    vendor     = 'Intel Corporation'
    device     = '6 Series/C200 Series Chipset Family SMBus Controller'
    class      = serial bus
    subclass   = SMBus
    bar   [10] = type Memory, range 64, base 0xb1a06000, size 256, enabled
    bar   [20] = type I/O Port, range 32, base 0x3040, size 32, enabled

vgapci0@pci0:1:0:0:	class=0x030000 rev=0xa1 hdr=0x00 vendor=0x10de device=0x0dea subvendor=0x1025 subdevice=0x0505
    vendor     = 'NVIDIA Corporation'
    device     = 'GF108M [GeForce 610M]'
    class      = display
    subclass   = VGA
    bar   [10] = type Memory, range 32, base 0xb0000000, size 16777216, enabled
    bar   [14] = type Prefetchable Memory, range 64, base 0x80000000, size 268435456, enabled
    bar   [1c] = type Prefetchable Memory, range 64, base 0x90000000, size 33554432, enabled
    bar   [24] = type I/O Port, range 32, base 0x2000, size 128, enabled
    cap 01[60] = powerspec 3  supports D0 D3  current D0
    cap 05[68] = MSI supports 1 message, 64 bit 
    cap 10[78] = PCI-Express 2 endpoint max data 128(128) RO NS
                 max read 512
                 link x16(x16) speed 5.0(5.0) ASPM L0s/L1(L0s/L1) ClockPM disabled
    cap 09[b4] = vendor (length 20)
    ecap 0002[100] = VC 1 max VC0
    ecap 0004[128] = Power Budgeting 1
    ecap 000b[600] = Vendor [1] ID 0001 Rev 1 Length 36

bge0@pci0:2:0:0:	class=0x020000 rev=0x10 hdr=0x00 vendor=0x14e4 device=0x16b5 subvendor=0x1025 subdevice=0x0504
    vendor     = 'Broadcom Inc. and subsidiaries'
    device     = 'NetLink BCM57785 Gigabit Ethernet PCIe'
    class      = network
    subclass   = ethernet
    bar   [10] = type Prefetchable Memory, range 64, base 0xb1830000, size 65536, enabled
    bar   [18] = type Prefetchable Memory, range 64, base 0xb1840000, size 65536, enabled
    cap 01[48] = powerspec 3  supports D0 D3  current D0
    cap 05[58] = MSI supports 8 messages, 64 bit 
    cap 11[a0] = MSI-X supports 5 messages
                 Table in map 0x18[0x0], PBA in map 0x18[0x120]
    cap 10[ac] = PCI-Express 2 endpoint max data 128(128)
                 max read 4096
                 link x1(x1) speed 2.5(2.5) ASPM L1(L0s/L1) ClockPM enabled
    ecap 0001[100] = AER 1 0 fatal 0 non-fatal 1 corrected
    ecap 0003[13c] = Serial 1 0000dc0ea122a39a
    ecap 0004[150] = Power Budgeting 1
    ecap 0002[160] = VC 1 max VC0

sdhci_pci0@pci0:2:0:1:	class=0x080501 rev=0x10 hdr=0x00 vendor=0x14e4 device=0x16bc subvendor=0x1025 subdevice=0x0504
    vendor     = 'Broadcom Inc. and subsidiaries'
    device     = 'BCM57765/57785 SDXC/MMC Card Reader'
    class      = base peripheral
    subclass   = SD host controller
    bar   [10] = type Prefetchable Memory, range 64, base 0xb1800000, size 65536, enabled
    cap 01[48] = powerspec 3  supports D0 D3  current D0
    cap 05[58] = MSI supports 1 message, 64 bit enabled with 1 message
    cap 10[ac] = PCI-Express 2 endpoint max data 128(128) RO NS
                 max read 4096
                 link x1(x1) speed 2.5(2.5) ASPM L1(L0s/L1) ClockPM enabled
    ecap 0001[100] = AER 1 0 fatal 0 non-fatal 1 corrected
    ecap 0004[150] = Power Budgeting 1
    ecap 0002[160] = VC 1 max VC0

none1@pci0:2:0:2:	class=0x088000 rev=0x10 hdr=0x00 vendor=0x14e4 device=0x16be subvendor=0x1025 subdevice=0x0504
    vendor     = 'Broadcom Inc. and subsidiaries'
    device     = 'BCM57765/57785 MS Card Reader'
    class      = base peripheral
    bar   [10] = type Prefetchable Memory, range 64, base 0xb1810000, size 65536, enabled
    cap 01[48] = powerspec 3  supports D0 D3  current D0
    cap 05[58] = MSI supports 1 message, 64 bit 
    cap 10[ac] = PCI-Express 2 endpoint max data 128(128) RO NS
                 max read 4096
                 link x1(x1) speed 2.5(2.5) ASPM L1(L0s/L1) ClockPM enabled
    ecap 0001[100] = AER 1 0 fatal 0 non-fatal 1 corrected
    ecap 0004[150] = Power Budgeting 1
    ecap 0002[160] = VC 1 max VC0

none2@pci0:2:0:3:	class=0x088000 rev=0x10 hdr=0x00 vendor=0x14e4 device=0x16bf subvendor=0x1025 subdevice=0x0504
    vendor     = 'Broadcom Inc. and subsidiaries'
    device     = 'BCM57765/57785 xD-Picture Card Reader'
    class      = base peripheral
    bar   [10] = type Prefetchable Memory, range 64, base 0xb1820000, size 65536, enabled
    cap 01[48] = powerspec 3  supports D0 D3  current D0
    cap 05[58] = MSI supports 1 message, 64 bit 
    cap 10[ac] = PCI-Express 2 endpoint max data 128(128) RO NS
                 max read 4096
                 link x1(x1) speed 2.5(2.5) ASPM L1(L0s/L1) ClockPM enabled
    ecap 0001[100] = AER 1 0 fatal 0 non-fatal 1 corrected
    ecap 0004[150] = Power Budgeting 1
    ecap 0002[160] = VC 1 max VC0

ral0@pci0:3:0:0:	class=0x028000 rev=0x00 hdr=0x00 vendor=0x1814 device=0x5390 subvendor=0x105b subdevice=0xe054
    vendor     = 'Ralink corp.'
    device     = 'RT5390 Wireless 802.11n 1T/1R PCIe'
    class      = network
    bar   [10] = type Memory, range 32, base 0xb1900000, size 65536, enabled
    cap 01[40] = powerspec 3  supports D0 D3  current D0
    cap 05[50] = MSI supports 32 messages, 64 bit enabled with 1 message
    cap 10[70] = PCI-Express 2 endpoint max data 128(128) RO
                 max read 512
                 link x1(x1) speed 2.5(2.5) ASPM L1(L0s/L1) ClockPM enabled
    ecap 0001[100] = AER 1 0 fatal 0 non-fatal 2 corrected
    ecap 0003[140] = Serial 1 0000b19644239468
