hostb0@pci0:0:0:0:	class=0x060000 rev=0x01 hdr=0x00 vendor=0x15ad device=0x1976 subvendor=0x15ad subdevice=0x1976
    vendor     = 'VMware'
    class      = bridge
    subclass   = HOST-PCI

vgapci0@pci0:0:15:0:	class=0x030000 rev=0x00 hdr=0x00 vendor=0x15ad device=0x0406 subvendor=0x15ad subdevice=0x0406
    vendor     = 'VMware'
    class      = display
    subclass   = VGA
    bar   [10] = type Memory, range 64, base 0x3f400000, size 4194304, enabled
    bar   [18] = type Prefetchable Memory, range 64, base 0x78000000, size 134217728, enabled
    cap 13[40] = PCI Advanced Features: FLR TP
    cap 05[48] = MSI supports 1 message, 64 bit 
    cap 11[60] = MSI-X supports 5 messages
                 Table in map 0x10[0x8000], PBA in map 0x10[0xc000]

pcib1@pci0:0:17:0:	class=0x060401 rev=0x02 hdr=0x01 vendor=0x15ad device=0x0790 subvendor=0x15ad subdevice=0x0790
    vendor     = 'VMware'
    device     = 'PCI bridge'
    class      = bridge
    subclass   = PCI-PCI
    cap 0d[40] = PCI Bridge subvendor=0x15ad subdevice=0x0790

pcib2@pci0:0:21:0:	class=0x060400 rev=0x01 hdr=0x01 vendor=0x15ad device=0x07a0 subvendor=0x15ad subdevice=0x07a0
    vendor     = 'VMware'
    device     = 'PCI Express Root Port'
    class      = bridge
    subclass   = PCI-PCI
    cap 0d[40] = PCI Bridge subvendor=0x15ad subdevice=0x07a0
    cap 01[48] = powerspec 3  supports D0 D3  current D0
    cap 10[50] = PCI-Express 2 root port max data 128(128)
                 max read 128
                 link x32(x32) speed 5.0(5.0) ASPM disabled(L0s)
                 slot 160 power limit 240000 mW HotPlug(present) Attn Button PC(on)
    cap 05[8c] = MSI supports 1 message, 64 bit, vector masks enabled with 1 message

pcib3@pci0:0:21:1:	class=0x060400 rev=0x01 hdr=0x01 vendor=0x15ad device=0x07a0 subvendor=0x15ad subdevice=0x07a0
    vendor     = 'VMware'
    device     = 'PCI Express Root Port'
    class      = bridge
    subclass   = PCI-PCI
    cap 0d[40] = PCI Bridge subvendor=0x15ad subdevice=0x07a0
    cap 01[48] = powerspec 3  supports D0 D3  current D0
    cap 10[50] = PCI-Express 2 root port max data 128(128)
                 max read 128
                 link x32(x32) speed 5.0(5.0) ASPM disabled(L0s)
                 slot 161 power limit 240000 mW HotPlug(empty) Attn Button PC(off)
    cap 05[8c] = MSI supports 1 message, 64 bit, vector masks enabled with 1 message

pcib4@pci0:0:21:2:	class=0x060400 rev=0x01 hdr=0x01 vendor=0x15ad device=0x07a0 subvendor=0x15ad subdevice=0x07a0
    vendor     = 'VMware'
    device     = 'PCI Express Root Port'
    class      = bridge
    subclass   = PCI-PCI
    cap 0d[40] = PCI Bridge subvendor=0x15ad subdevice=0x07a0
    cap 01[48] = powerspec 3  supports D0 D3  current D0
    cap 10[50] = PCI-Express 2 root port max data 128(128)
                 max read 128
                 link x32(x32) speed 5.0(5.0) ASPM disabled(L0s)
                 slot 162 power limit 240000 mW HotPlug(empty) Attn Button PC(off)
    cap 05[8c] = MSI supports 1 message, 64 bit, vector masks enabled with 1 message

pcib5@pci0:0:21:3:	class=0x060400 rev=0x01 hdr=0x01 vendor=0x15ad device=0x07a0 subvendor=0x15ad subdevice=0x07a0
    vendor     = 'VMware'
    device     = 'PCI Express Root Port'
    class      = bridge
    subclass   = PCI-PCI
    cap 0d[40] = PCI Bridge subvendor=0x15ad subdevice=0x07a0
    cap 01[48] = powerspec 3  supports D0 D3  current D0
    cap 10[50] = PCI-Express 2 root port max data 128(128)
                 max read 128
                 link x32(x32) speed 5.0(5.0) ASPM disabled(L0s)
                 slot 163 power limit 240000 mW HotPlug(empty) Attn Button PC(off)
    cap 05[8c] = MSI supports 1 message, 64 bit, vector masks enabled with 1 message

pcib6@pci0:0:21:4:	class=0x060400 rev=0x01 hdr=0x01 vendor=0x15ad device=0x07a0 subvendor=0x15ad subdevice=0x07a0
    vendor     = 'VMware'
    device     = 'PCI Express Root Port'
    class      = bridge
    subclass   = PCI-PCI
    cap 0d[40] = PCI Bridge subvendor=0x15ad subdevice=0x07a0
    cap 01[48] = powerspec 3  supports D0 D3  current D0
    cap 10[50] = PCI-Express 2 root port max data 128(128)
                 max read 128
                 link x32(x32) speed 5.0(5.0) ASPM disabled(L0s)
                 slot 164 power limit 240000 mW HotPlug(empty) Attn Button PC(off)
    cap 05[8c] = MSI supports 1 message, 64 bit, vector masks enabled with 1 message

pcib7@pci0:0:21:5:	class=0x060400 rev=0x01 hdr=0x01 vendor=0x15ad device=0x07a0 subvendor=0x15ad subdevice=0x07a0
    vendor     = 'VMware'
    device     = 'PCI Express Root Port'
    class      = bridge
    subclass   = PCI-PCI
    cap 0d[40] = PCI Bridge subvendor=0x15ad subdevice=0x07a0
    cap 01[48] = powerspec 3  supports D0 D3  current D0
    cap 10[50] = PCI-Express 2 root port max data 128(128)
                 max read 128
                 link x32(x32) speed 5.0(5.0) ASPM disabled(L0s)
                 slot 165 power limit 240000 mW HotPlug(empty) Attn Button PC(off)
    cap 05[8c] = MSI supports 1 message, 64 bit, vector masks enabled with 1 message

pcib8@pci0:0:21:6:	class=0x060400 rev=0x01 hdr=0x01 vendor=0x15ad device=0x07a0 subvendor=0x15ad subdevice=0x07a0
    vendor     = 'VMware'
    device     = 'PCI Express Root Port'
    class      = bridge
    subclass   = PCI-PCI
    cap 0d[40] = PCI Bridge subvendor=0x15ad subdevice=0x07a0
    cap 01[48] = powerspec 3  supports D0 D3  current D0
    cap 10[50] = PCI-Express 2 root port max data 128(128)
                 max read 128
                 link x32(x32) speed 5.0(5.0) ASPM disabled(L0s)
                 slot 166 power limit 240000 mW HotPlug(empty) Attn Button PC(off)
    cap 05[8c] = MSI supports 1 message, 64 bit, vector masks enabled with 1 message

pcib9@pci0:0:21:7:	class=0x060400 rev=0x01 hdr=0x01 vendor=0x15ad device=0x07a0 subvendor=0x15ad subdevice=0x07a0
    vendor     = 'VMware'
    device     = 'PCI Express Root Port'
    class      = bridge
    subclass   = PCI-PCI
    cap 0d[40] = PCI Bridge subvendor=0x15ad subdevice=0x07a0
    cap 01[48] = powerspec 3  supports D0 D3  current D0
    cap 10[50] = PCI-Express 2 root port max data 128(128)
                 max read 128
                 link x32(x32) speed 5.0(5.0) ASPM disabled(L0s)
                 slot 167 power limit 240000 mW HotPlug(empty) Attn Button PC(off)
    cap 05[8c] = MSI supports 1 message, 64 bit, vector masks enabled with 1 message

pcib10@pci0:0:22:0:	class=0x060400 rev=0x01 hdr=0x01 vendor=0x15ad device=0x07a0 subvendor=0x15ad subdevice=0x07a0
    vendor     = 'VMware'
    device     = 'PCI Express Root Port'
    class      = bridge
    subclass   = PCI-PCI
    cap 0d[40] = PCI Bridge subvendor=0x15ad subdevice=0x07a0
    cap 01[48] = powerspec 3  supports D0 D3  current D0
    cap 10[50] = PCI-Express 2 root port max data 128(128)
                 max read 128
                 link x32(x32) speed 5.0(5.0) ASPM disabled(L0s)
                 slot 192 power limit 240000 mW HotPlug(present) Attn Button PC(on)
    cap 05[8c] = MSI supports 1 message, 64 bit, vector masks enabled with 1 message

pcib11@pci0:0:22:1:	class=0x060400 rev=0x01 hdr=0x01 vendor=0x15ad device=0x07a0 subvendor=0x15ad subdevice=0x07a0
    vendor     = 'VMware'
    device     = 'PCI Express Root Port'
    class      = bridge
    subclass   = PCI-PCI
    cap 0d[40] = PCI Bridge subvendor=0x15ad subdevice=0x07a0
    cap 01[48] = powerspec 3  supports D0 D3  current D0
    cap 10[50] = PCI-Express 2 root port max data 128(128)
                 max read 128
                 link x32(x32) speed 5.0(5.0) ASPM disabled(L0s)
                 slot 193 power limit 240000 mW HotPlug(empty) Attn Button PC(off)
    cap 05[8c] = MSI supports 1 message, 64 bit, vector masks enabled with 1 message

pcib12@pci0:0:22:2:	class=0x060400 rev=0x01 hdr=0x01 vendor=0x15ad device=0x07a0 subvendor=0x15ad subdevice=0x07a0
    vendor     = 'VMware'
    device     = 'PCI Express Root Port'
    class      = bridge
    subclass   = PCI-PCI
    cap 0d[40] = PCI Bridge subvendor=0x15ad subdevice=0x07a0
    cap 01[48] = powerspec 3  supports D0 D3  current D0
    cap 10[50] = PCI-Express 2 root port max data 128(128)
                 max read 128
                 link x32(x32) speed 5.0(5.0) ASPM disabled(L0s)
                 slot 194 power limit 240000 mW HotPlug(empty) Attn Button PC(off)
    cap 05[8c] = MSI supports 1 message, 64 bit, vector masks enabled with 1 message

pcib13@pci0:0:22:3:	class=0x060400 rev=0x01 hdr=0x01 vendor=0x15ad device=0x07a0 subvendor=0x15ad subdevice=0x07a0
    vendor     = 'VMware'
    device     = 'PCI Express Root Port'
    class      = bridge
    subclass   = PCI-PCI
    cap 0d[40] = PCI Bridge subvendor=0x15ad subdevice=0x07a0
    cap 01[48] = powerspec 3  supports D0 D3  current D0
    cap 10[50] = PCI-Express 2 root port max data 128(128)
                 max read 128
                 link x32(x32) speed 5.0(5.0) ASPM disabled(L0s)
                 slot 195 power limit 240000 mW HotPlug(empty) Attn Button PC(off)
    cap 05[8c] = MSI supports 1 message, 64 bit, vector masks enabled with 1 message

pcib14@pci0:0:22:4:	class=0x060400 rev=0x01 hdr=0x01 vendor=0x15ad device=0x07a0 subvendor=0x15ad subdevice=0x07a0
    vendor     = 'VMware'
    device     = 'PCI Express Root Port'
    class      = bridge
    subclass   = PCI-PCI
    cap 0d[40] = PCI Bridge subvendor=0x15ad subdevice=0x07a0
    cap 01[48] = powerspec 3  supports D0 D3  current D0
    cap 10[50] = PCI-Express 2 root port max data 128(128)
                 max read 128
                 link x32(x32) speed 5.0(5.0) ASPM disabled(L0s)
                 slot 196 power limit 240000 mW HotPlug(empty) Attn Button PC(off)
    cap 05[8c] = MSI supports 1 message, 64 bit, vector masks enabled with 1 message

pcib15@pci0:0:22:5:	class=0x060400 rev=0x01 hdr=0x01 vendor=0x15ad device=0x07a0 subvendor=0x15ad subdevice=0x07a0
    vendor     = 'VMware'
    device     = 'PCI Express Root Port'
    class      = bridge
    subclass   = PCI-PCI
    cap 0d[40] = PCI Bridge subvendor=0x15ad subdevice=0x07a0
    cap 01[48] = powerspec 3  supports D0 D3  current D0
    cap 10[50] = PCI-Express 2 root port max data 128(128)
                 max read 128
                 link x32(x32) speed 5.0(5.0) ASPM disabled(L0s)
                 slot 197 power limit 240000 mW HotPlug(empty) Attn Button PC(off)
    cap 05[8c] = MSI supports 1 message, 64 bit, vector masks enabled with 1 message

pcib16@pci0:0:22:6:	class=0x060400 rev=0x01 hdr=0x01 vendor=0x15ad device=0x07a0 subvendor=0x15ad subdevice=0x07a0
    vendor     = 'VMware'
    device     = 'PCI Express Root Port'
    class      = bridge
    subclass   = PCI-PCI
    cap 0d[40] = PCI Bridge subvendor=0x15ad subdevice=0x07a0
    cap 01[48] = powerspec 3  supports D0 D3  current D0
    cap 10[50] = PCI-Express 2 root port max data 128(128)
                 max read 128
                 link x32(x32) speed 5.0(5.0) ASPM disabled(L0s)
                 slot 198 power limit 240000 mW HotPlug(empty) Attn Button PC(off)
    cap 05[8c] = MSI supports 1 message, 64 bit, vector masks enabled with 1 message

pcib17@pci0:0:22:7:	class=0x060400 rev=0x01 hdr=0x01 vendor=0x15ad device=0x07a0 subvendor=0x15ad subdevice=0x07a0
    vendor     = 'VMware'
    device     = 'PCI Express Root Port'
    class      = bridge
    subclass   = PCI-PCI
    cap 0d[40] = PCI Bridge subvendor=0x15ad subdevice=0x07a0
    cap 01[48] = powerspec 3  supports D0 D3  current D0
    cap 10[50] = PCI-Express 2 root port max data 128(128)
                 max read 128
                 link x32(x32) speed 5.0(5.0) ASPM disabled(L0s)
                 slot 199 power limit 240000 mW HotPlug(empty) Attn Button PC(off)
    cap 05[8c] = MSI supports 1 message, 64 bit, vector masks enabled with 1 message

pcib18@pci0:0:23:0:	class=0x060400 rev=0x01 hdr=0x01 vendor=0x15ad device=0x07a0 subvendor=0x15ad subdevice=0x07a0
    vendor     = 'VMware'
    device     = 'PCI Express Root Port'
    class      = bridge
    subclass   = PCI-PCI
    cap 0d[40] = PCI Bridge subvendor=0x15ad subdevice=0x07a0
    cap 01[48] = powerspec 3  supports D0 D3  current D0
    cap 10[50] = PCI-Express 2 root port max data 128(128)
                 max read 128
                 link x32(x32) speed 5.0(5.0) ASPM disabled(L0s)
                 slot 224 power limit 240000 mW HotPlug(present) Attn Button PC(on)
    cap 05[8c] = MSI supports 1 message, 64 bit, vector masks enabled with 1 message

pcib19@pci0:0:23:1:	class=0x060400 rev=0x01 hdr=0x01 vendor=0x15ad device=0x07a0 subvendor=0x15ad subdevice=0x07a0
    vendor     = 'VMware'
    device     = 'PCI Express Root Port'
    class      = bridge
    subclass   = PCI-PCI
    cap 0d[40] = PCI Bridge subvendor=0x15ad subdevice=0x07a0
    cap 01[48] = powerspec 3  supports D0 D3  current D0
    cap 10[50] = PCI-Express 2 root port max data 128(128)
                 max read 128
                 link x32(x32) speed 5.0(5.0) ASPM disabled(L0s)
                 slot 225 power limit 240000 mW HotPlug(empty) Attn Button PC(off)
    cap 05[8c] = MSI supports 1 message, 64 bit, vector masks enabled with 1 message

pcib20@pci0:0:23:2:	class=0x060400 rev=0x01 hdr=0x01 vendor=0x15ad device=0x07a0 subvendor=0x15ad subdevice=0x07a0
    vendor     = 'VMware'
    device     = 'PCI Express Root Port'
    class      = bridge
    subclass   = PCI-PCI
    cap 0d[40] = PCI Bridge subvendor=0x15ad subdevice=0x07a0
    cap 01[48] = powerspec 3  supports D0 D3  current D0
    cap 10[50] = PCI-Express 2 root port max data 128(128)
                 max read 128
                 link x32(x32) speed 5.0(5.0) ASPM disabled(L0s)
                 slot 226 power limit 240000 mW HotPlug(empty) Attn Button PC(off)
    cap 05[8c] = MSI supports 1 message, 64 bit, vector masks enabled with 1 message

pcib21@pci0:0:23:3:	class=0x060400 rev=0x01 hdr=0x01 vendor=0x15ad device=0x07a0 subvendor=0x15ad subdevice=0x07a0
    vendor     = 'VMware'
    device     = 'PCI Express Root Port'
    class      = bridge
    subclass   = PCI-PCI
    cap 0d[40] = PCI Bridge subvendor=0x15ad subdevice=0x07a0
    cap 01[48] = powerspec 3  supports D0 D3  current D0
    cap 10[50] = PCI-Express 2 root port max data 128(128)
                 max read 128
                 link x32(x32) speed 5.0(5.0) ASPM disabled(L0s)
                 slot 227 power limit 240000 mW HotPlug(empty) Attn Button PC(off)
    cap 05[8c] = MSI supports 1 message, 64 bit, vector masks enabled with 1 message

pcib22@pci0:0:23:4:	class=0x060400 rev=0x01 hdr=0x01 vendor=0x15ad device=0x07a0 subvendor=0x15ad subdevice=0x07a0
    vendor     = 'VMware'
    device     = 'PCI Express Root Port'
    class      = bridge
    subclass   = PCI-PCI
    cap 0d[40] = PCI Bridge subvendor=0x15ad subdevice=0x07a0
    cap 01[48] = powerspec 3  supports D0 D3  current D0
    cap 10[50] = PCI-Express 2 root port max data 128(128)
                 max read 128
                 link x32(x32) speed 5.0(5.0) ASPM disabled(L0s)
                 slot 228 power limit 240000 mW HotPlug(empty) Attn Button PC(off)
    cap 05[8c] = MSI supports 1 message, 64 bit, vector masks enabled with 1 message

pcib23@pci0:0:23:5:	class=0x060400 rev=0x01 hdr=0x01 vendor=0x15ad device=0x07a0 subvendor=0x15ad subdevice=0x07a0
    vendor     = 'VMware'
    device     = 'PCI Express Root Port'
    class      = bridge
    subclass   = PCI-PCI
    cap 0d[40] = PCI Bridge subvendor=0x15ad subdevice=0x07a0
    cap 01[48] = powerspec 3  supports D0 D3  current D0
    cap 10[50] = PCI-Express 2 root port max data 128(128)
                 max read 128
                 link x32(x32) speed 5.0(5.0) ASPM disabled(L0s)
                 slot 229 power limit 240000 mW HotPlug(empty) Attn Button PC(off)
    cap 05[8c] = MSI supports 1 message, 64 bit, vector masks enabled with 1 message

pcib24@pci0:0:23:6:	class=0x060400 rev=0x01 hdr=0x01 vendor=0x15ad device=0x07a0 subvendor=0x15ad subdevice=0x07a0
    vendor     = 'VMware'
    device     = 'PCI Express Root Port'
    class      = bridge
    subclass   = PCI-PCI
    cap 0d[40] = PCI Bridge subvendor=0x15ad subdevice=0x07a0
    cap 01[48] = powerspec 3  supports D0 D3  current D0
    cap 10[50] = PCI-Express 2 root port max data 128(128)
                 max read 128
                 link x32(x32) speed 5.0(5.0) ASPM disabled(L0s)
                 slot 230 power limit 240000 mW HotPlug(empty) Attn Button PC(off)
    cap 05[8c] = MSI supports 1 message, 64 bit, vector masks enabled with 1 message

pcib25@pci0:0:23:7:	class=0x060400 rev=0x01 hdr=0x01 vendor=0x15ad device=0x07a0 subvendor=0x15ad subdevice=0x07a0
    vendor     = 'VMware'
    device     = 'PCI Express Root Port'
    class      = bridge
    subclass   = PCI-PCI
    cap 0d[40] = PCI Bridge subvendor=0x15ad subdevice=0x07a0
    cap 01[48] = powerspec 3  supports D0 D3  current D0
    cap 10[50] = PCI-Express 2 root port max data 128(128)
                 max read 128
                 link x32(x32) speed 5.0(5.0) ASPM disabled(L0s)
                 slot 231 power limit 240000 mW HotPlug(empty) Attn Button PC(off)
    cap 05[8c] = MSI supports 1 message, 64 bit, vector masks enabled with 1 message

pcib26@pci0:0:24:0:	class=0x060400 rev=0x01 hdr=0x01 vendor=0x15ad device=0x07a0 subvendor=0x15ad subdevice=0x07a0
    vendor     = 'VMware'
    device     = 'PCI Express Root Port'
    class      = bridge
    subclass   = PCI-PCI
    cap 0d[40] = PCI Bridge subvendor=0x15ad subdevice=0x07a0
    cap 01[48] = powerspec 3  supports D0 D3  current D0
    cap 10[50] = PCI-Express 2 root port max data 128(128)
                 max read 128
                 link x32(x32) speed 5.0(5.0) ASPM disabled(L0s)
                 slot 256 power limit 240000 mW HotPlug(empty) Attn Button PC(off)
    cap 05[8c] = MSI supports 1 message, 64 bit, vector masks enabled with 1 message

pcib27@pci0:0:24:1:	class=0x060400 rev=0x01 hdr=0x01 vendor=0x15ad device=0x07a0 subvendor=0x15ad subdevice=0x07a0
    vendor     = 'VMware'
    device     = 'PCI Express Root Port'
    class      = bridge
    subclass   = PCI-PCI
    cap 0d[40] = PCI Bridge subvendor=0x15ad subdevice=0x07a0
    cap 01[48] = powerspec 3  supports D0 D3  current D0
    cap 10[50] = PCI-Express 2 root port max data 128(128)
                 max read 128
                 link x32(x32) speed 5.0(5.0) ASPM disabled(L0s)
                 slot 257 power limit 240000 mW HotPlug(empty) Attn Button PC(off)
    cap 05[8c] = MSI supports 1 message, 64 bit, vector masks enabled with 1 message

pcib28@pci0:0:24:2:	class=0x060400 rev=0x01 hdr=0x01 vendor=0x15ad device=0x07a0 subvendor=0x15ad subdevice=0x07a0
    vendor     = 'VMware'
    device     = 'PCI Express Root Port'
    class      = bridge
    subclass   = PCI-PCI
    cap 0d[40] = PCI Bridge subvendor=0x15ad subdevice=0x07a0
    cap 01[48] = powerspec 3  supports D0 D3  current D0
    cap 10[50] = PCI-Express 2 root port max data 128(128)
                 max read 128
                 link x32(x32) speed 5.0(5.0) ASPM disabled(L0s)
                 slot 258 power limit 240000 mW HotPlug(empty) Attn Button PC(off)
    cap 05[8c] = MSI supports 1 message, 64 bit, vector masks enabled with 1 message

pcib29@pci0:0:24:3:	class=0x060400 rev=0x01 hdr=0x01 vendor=0x15ad device=0x07a0 subvendor=0x15ad subdevice=0x07a0
    vendor     = 'VMware'
    device     = 'PCI Express Root Port'
    class      = bridge
    subclass   = PCI-PCI
    cap 0d[40] = PCI Bridge subvendor=0x15ad subdevice=0x07a0
    cap 01[48] = powerspec 3  supports D0 D3  current D0
    cap 10[50] = PCI-Express 2 root port max data 128(128)
                 max read 128
                 link x32(x32) speed 5.0(5.0) ASPM disabled(L0s)
                 slot 259 power limit 240000 mW HotPlug(empty) Attn Button PC(off)
    cap 05[8c] = MSI supports 1 message, 64 bit, vector masks enabled with 1 message

pcib30@pci0:0:24:4:	class=0x060400 rev=0x01 hdr=0x01 vendor=0x15ad device=0x07a0 subvendor=0x15ad subdevice=0x07a0
    vendor     = 'VMware'
    device     = 'PCI Express Root Port'
    class      = bridge
    subclass   = PCI-PCI
    cap 0d[40] = PCI Bridge subvendor=0x15ad subdevice=0x07a0
    cap 01[48] = powerspec 3  supports D0 D3  current D0
    cap 10[50] = PCI-Express 2 root port max data 128(128)
                 max read 128
                 link x32(x32) speed 5.0(5.0) ASPM disabled(L0s)
                 slot 260 power limit 240000 mW HotPlug(empty) Attn Button PC(off)
    cap 05[8c] = MSI supports 1 message, 64 bit, vector masks enabled with 1 message

pcib31@pci0:0:24:5:	class=0x060400 rev=0x01 hdr=0x01 vendor=0x15ad device=0x07a0 subvendor=0x15ad subdevice=0x07a0
    vendor     = 'VMware'
    device     = 'PCI Express Root Port'
    class      = bridge
    subclass   = PCI-PCI
    cap 0d[40] = PCI Bridge subvendor=0x15ad subdevice=0x07a0
    cap 01[48] = powerspec 3  supports D0 D3  current D0
    cap 10[50] = PCI-Express 2 root port max data 128(128)
                 max read 128
                 link x32(x32) speed 5.0(5.0) ASPM disabled(L0s)
                 slot 261 power limit 240000 mW HotPlug(empty) Attn Button PC(off)
    cap 05[8c] = MSI supports 1 message, 64 bit, vector masks enabled with 1 message

pcib32@pci0:0:24:6:	class=0x060400 rev=0x01 hdr=0x01 vendor=0x15ad device=0x07a0 subvendor=0x15ad subdevice=0x07a0
    vendor     = 'VMware'
    device     = 'PCI Express Root Port'
    class      = bridge
    subclass   = PCI-PCI
    cap 0d[40] = PCI Bridge subvendor=0x15ad subdevice=0x07a0
    cap 01[48] = powerspec 3  supports D0 D3  current D0
    cap 10[50] = PCI-Express 2 root port max data 128(128)
                 max read 128
                 link x32(x32) speed 5.0(5.0) ASPM disabled(L0s)
                 slot 262 power limit 240000 mW HotPlug(empty) Attn Button PC(off)
    cap 05[8c] = MSI supports 1 message, 64 bit, vector masks enabled with 1 message

pcib33@pci0:0:24:7:	class=0x060400 rev=0x01 hdr=0x01 vendor=0x15ad device=0x07a0 subvendor=0x15ad subdevice=0x07a0
    vendor     = 'VMware'
    device     = 'PCI Express Root Port'
    class      = bridge
    subclass   = PCI-PCI
    cap 0d[40] = PCI Bridge subvendor=0x15ad subdevice=0x07a0
    cap 01[48] = powerspec 3  supports D0 D3  current D0
    cap 10[50] = PCI-Express 2 root port max data 128(128)
                 max read 128
                 link x32(x32) speed 5.0(5.0) ASPM disabled(L0s)
                 slot 263 power limit 240000 mW HotPlug(empty) Attn Button PC(off)
    cap 05[8c] = MSI supports 1 message, 64 bit, vector masks enabled with 1 message

uhci0@pci0:1:0:0:	class=0x0c0300 rev=0x00 hdr=0x00 vendor=0x15ad device=0x0774 subvendor=0x15ad subdevice=0x1976
    vendor     = 'VMware'
    device     = 'USB1.1 UHCI Controller'
    class      = serial bus
    subclass   = USB
    bar   [20] = type I/O Port, range 32, base 0xf000, size 32, enabled
    cap 13[40] = PCI Advanced Features: FLR TP

none0@pci0:1:1:0:	class=0x040300 rev=0x09 hdr=0x00 vendor=0x15ad device=0x1977 subvendor=0x15ad subdevice=0x1977
    vendor     = 'VMware'
    device     = 'HD Audio Controller'
    class      = multimedia
    subclass   = HDA
    bar   [10] = type Memory, range 64, base 0x3fb00000, size 16384, enabled
    cap 01[50] = powerspec 2  supports D0 D3  current D0
    cap 05[60] = MSI supports 1 message, 64 bit 
    cap 13[78] = PCI Advanced Features: FLR TP

ehci0@pci0:1:2:0:	class=0x0c0320 rev=0x00 hdr=0x00 vendor=0x15ad device=0x0770 subvendor=0x15ad subdevice=0x0770
    vendor     = 'VMware'
    device     = 'USB2 EHCI Controller'
    class      = serial bus
    subclass   = USB
    bar   [10] = type Memory, range 32, base 0x3fb08000, size 16384, enabled
    cap 13[40] = PCI Advanced Features: FLR TP

ahci0@pci0:1:3:0:	class=0x010601 rev=0x00 hdr=0x00 vendor=0x15ad device=0x07e0 subvendor=0x15ad subdevice=0x07e0
    vendor     = 'VMware'
    device     = 'SATA AHCI controller'
    class      = mass storage
    subclass   = SATA
    bar   [24] = type Memory, range 32, base 0x3fb04000, size 16384, enabled
    cap 01[40] = powerspec 3  supports D0 D3  current D0
    cap 05[48] = MSI supports 1 message, 64 bit enabled with 1 message
    cap 12[60] = SATA Index-Data Pair
    cap 13[70] = PCI Advanced Features: FLR TP

em0@pci0:2:0:0:	class=0x020000 rev=0x00 hdr=0x00 vendor=0x8086 device=0x10d3 subvendor=0x15ad subdevice=0x07d0
    vendor     = 'Intel Corporation'
    device     = '82574L Gigabit Network Connection'
    class      = network
    subclass   = ethernet
    bar   [10] = type Memory, range 32, base 0x3fa00000, size 131072, enabled
    bar   [18] = type I/O Port, range 32, base 0xe000, size 32, enabled
    bar   [1c] = type Memory, range 32, base 0x3fa20000, size 16384, enabled
    cap 01[c8] = powerspec 2  supports D0 D3  current D0
    cap 05[d0] = MSI supports 1 message, 64 bit 
    cap 10[e0] = PCI-Express 1 endpoint max data 128(256)
                 max read 128
                 link x32(x32) speed 5.0(5.0) ASPM disabled(L0s)
    cap 11[a0] = MSI-X supports 5 messages, enabled
                 Table in map 0x1c[0x0], PBA in map 0x1c[0x2000]
    ecap 0003[100] = Serial 1 000c29ffff45ea79

xhci0@pci0:10:0:0:	class=0x0c0330 rev=0x00 hdr=0x00 vendor=0x15ad device=0x0779 subvendor=0x15ad subdevice=0x0779
    vendor     = 'VMware'
    device     = 'USB3 xHCI 1.0 Controller'
    class      = serial bus
    subclass   = USB
    bar   [10] = type Memory, range 64, base 0x3f900000, size 524288, enabled
    cap 01[64] = powerspec 3  supports D0 D3  current D0
    cap 10[6c] = PCI-Express 2 endpoint max data 128(128) FLR
                 max read 128
                 link x32(x32) speed 5.0(5.0) ASPM disabled(L0s)
    cap 05[a8] = MSI supports 1 message, 64 bit, vector masks 
    cap 11[c0] = MSI-X supports 31 messages, enabled
                 Table in map 0x10[0x40000], PBA in map 0x10[0x44000]

nvme0@pci0:18:0:0:	class=0x010802 rev=0x00 hdr=0x00 vendor=0x15ad device=0x07f0 subvendor=0x15ad subdevice=0x07f0
    vendor     = 'VMware'
    class      = mass storage
    subclass   = NVM
    bar   [10] = type Memory, range 64, base 0x3f800000, size 16384, enabled
    bar   [18] = type I/O Port, range 32, base 0xd000, size 8, enabled
    cap 01[40] = powerspec 3  supports D0 D3  current D0
    cap 05[50] = MSI supports 1 message, 64 bit 
    cap 11[70] = MSI-X supports 16 messages, enabled
                 Table in map 0x10[0x2000], PBA in map 0x10[0x3000]
    cap 10[80] = PCI-Express 2 endpoint max data 128(128)
                 max read 128
                 link x32(x32) speed 5.0(5.0) ASPM disabled(L0s)
