hostb0@pci0:0:0:0:	class=0x060000 card=0x05821028 chip=0x01508086 rev=0x09 hdr=0x00
    vendor     = 'Intel Corporation'
    device     = 'Xeon E3-1200 v2/3rd Gen Core processor DRAM Controller'
    class      = bridge
    subclass   = HOST-PCI
    cap 09[e0] = vendor (length 12) Intel cap 0 version 1

pcib1@pci0:0:1:0:	class=0x060400 card=0x05821028 chip=0x01518086 rev=0x09 hdr=0x01
    vendor     = 'Intel Corporation'
    device     = 'Xeon E3-1200 v2/3rd Gen Core processor PCI Express Root Port'
    class      = bridge
    subclass   = PCI-PCI
    cap 0d[88] = PCI Bridge card=0x05821028
    cap 01[80] = powerspec 3  supports D0 D3  current D0
    cap 05[90] = MSI supports 1 message 
    cap 10[a0] = PCI-Express 2 root port max data 256(256)
                 link x0(x16) speed 0.0(5.0) ASPM disabled(L0s/L1)
                 slot 1 power limit 75000 mW
    ecap 0002[100] = VC 1 max VC0
    ecap 0005[140] = Root Complex Link Declaration 1

vgapci0@pci0:0:2:0:	class=0x030000 card=0x05821028 chip=0x01528086 rev=0x09 hdr=0x00
    vendor     = 'Intel Corporation'
    device     = 'Xeon E3-1200 v2/3rd Gen Core processor Graphics Controller'
    class      = display
    subclass   = VGA
    bar   [10] = type Memory, range 64, base 0xf6800000, size 4194304, enabled
    bar   [18] = type Prefetchable Memory, range 64, base 0xe0000000, size 268435456, enabled
    bar   [20] = type I/O Port, range 32, base 0xf000, size 64, enabled
    cap 05[90] = MSI supports 1 message 
    cap 01[d0] = powerspec 2  supports D0 D3  current D0
    cap 13[a4] = PCI Advanced Features: FLR TP

xhci0@pci0:0:20:0:	class=0x0c0330 card=0x05821028 chip=0x1e318086 rev=0x04 hdr=0x00
    vendor     = 'Intel Corporation'
    device     = '7 Series/C210 Series Chipset Family USB xHCI Host Controller'
    class      = serial bus
    subclass   = USB
    bar   [10] = type Memory, range 64, base 0xf7e00000, size 65536, enabled
    cap 01[70] = powerspec 2  supports D0 D3  current D0
    cap 05[80] = MSI supports 8 messages, 64 bit enabled with 1 message

none0@pci0:0:22:0:	class=0x078000 card=0x05821028 chip=0x1e3a8086 rev=0x04 hdr=0x00
    vendor     = 'Intel Corporation'
    device     = '7 Series/C216 Chipset Family MEI Controller'
    class      = simple comms
    bar   [10] = type Memory, range 64, base 0xf7e1b000, size 16, enabled
    cap 01[50] = powerspec 3  supports D0 D3  current D0
    cap 05[8c] = MSI supports 1 message, 64 bit 

ehci0@pci0:0:26:0:	class=0x0c0320 card=0x05821028 chip=0x1e2d8086 rev=0x04 hdr=0x00
    vendor     = 'Intel Corporation'
    device     = '7 Series/C216 Chipset Family USB Enhanced Host Controller'
    class      = serial bus
    subclass   = USB
    bar   [10] = type Memory, range 32, base 0xf7e18000, size 1024, enabled
    cap 01[50] = powerspec 2  supports D0 D3  current D0
    cap 0a[58] = EHCI Debug Port at offset 0xa0 in map 0x14
    cap 13[98] = PCI Advanced Features: FLR TP

hdac0@pci0:0:27:0:	class=0x040300 card=0x05821028 chip=0x1e208086 rev=0x04 hdr=0x00
    vendor     = 'Intel Corporation'
    device     = '7 Series/C216 Chipset Family High Definition Audio Controller'
    class      = multimedia
    subclass   = HDA
    bar   [10] = type Memory, range 64, base 0xf7e10000, size 16384, enabled
    cap 01[50] = powerspec 2  supports D0 D3  current D0
    cap 05[60] = MSI supports 1 message, 64 bit enabled with 1 message
    cap 10[70] = PCI-Express 1 root endpoint max data 128(128) FLR NS
    ecap 0002[100] = VC 1 max VC1
    ecap 0005[130] = Root Complex Link Declaration 1

pcib2@pci0:0:28:0:	class=0x060400 card=0x05821028 chip=0x1e108086 rev=0xc4 hdr=0x01
    vendor     = 'Intel Corporation'
    device     = '7 Series/C216 Chipset Family PCI Express Root Port 1'
    class      = bridge
    subclass   = PCI-PCI
    cap 10[40] = PCI-Express 2 root port max data 128(128)
                 link x0(x1) speed 0.0(5.0) ASPM L0s/L1(L0s/L1)
                 slot 0 power limit 100 mW
    cap 05[80] = MSI supports 1 message 
    cap 0d[90] = PCI Bridge card=0x05821028
    cap 01[a0] = powerspec 2  supports D0 D3  current D0

pcib3@pci0:0:28:1:	class=0x060400 card=0x05821028 chip=0x1e128086 rev=0xc4 hdr=0x01
    vendor     = 'Intel Corporation'
    device     = '7 Series/C210 Series Chipset Family PCI Express Root Port 2'
    class      = bridge
    subclass   = PCI-PCI
    cap 10[40] = PCI-Express 2 root port max data 128(128)
                 link x1(x1) speed 2.5(5.0) ASPM L0s/L1(L0s/L1)
                 slot 1 power limit 100 mW
    cap 05[80] = MSI supports 1 message 
    cap 0d[90] = PCI Bridge card=0x05821028
    cap 01[a0] = powerspec 2  supports D0 D3  current D0

pcib4@pci0:0:28:4:	class=0x060400 card=0x05821028 chip=0x1e188086 rev=0xc4 hdr=0x01
    vendor     = 'Intel Corporation'
    device     = '7 Series/C210 Series Chipset Family PCI Express Root Port 5'
    class      = bridge
    subclass   = PCI-PCI
    cap 10[40] = PCI-Express 2 root port max data 128(128)
                 link x1(x1) speed 2.5(5.0) ASPM L1(L0s/L1)
                 slot 4 power limit 100 mW
    cap 05[80] = MSI supports 1 message 
    cap 0d[90] = PCI Bridge card=0x05821028
    cap 01[a0] = powerspec 2  supports D0 D3  current D0

pcib5@pci0:0:28:5:	class=0x060400 card=0x05821028 chip=0x1e1a8086 rev=0xc4 hdr=0x01
    vendor     = 'Intel Corporation'
    device     = '7 Series/C210 Series Chipset Family PCI Express Root Port 6'
    class      = bridge
    subclass   = PCI-PCI
    cap 10[40] = PCI-Express 2 root port max data 128(128)
                 link x1(x1) speed 2.5(5.0) ASPM L1(L0s/L1)
                 slot 5 power limit 100 mW
    cap 05[80] = MSI supports 1 message 
    cap 0d[90] = PCI Bridge card=0x05821028
    cap 01[a0] = powerspec 2  supports D0 D3  current D0

ehci1@pci0:0:29:0:	class=0x0c0320 card=0x05821028 chip=0x1e268086 rev=0x04 hdr=0x00
    vendor     = 'Intel Corporation'
    device     = '7 Series/C216 Chipset Family USB Enhanced Host Controller'
    class      = serial bus
    subclass   = USB
    bar   [10] = type Memory, range 32, base 0xf7e17000, size 1024, enabled
    cap 01[50] = powerspec 2  supports D0 D3  current D0
    cap 0a[58] = EHCI Debug Port at offset 0xa0 in map 0x14
    cap 13[98] = PCI Advanced Features: FLR TP

pcib6@pci0:0:30:0:	class=0x060401 card=0x05821028 chip=0x244e8086 rev=0xa4 hdr=0x01
    vendor     = 'Intel Corporation'
    device     = '82801 PCI Bridge'
    class      = bridge
    subclass   = PCI-PCI
    cap 0d[50] = PCI Bridge card=0x05821028

isab0@pci0:0:31:0:	class=0x060100 card=0x05821028 chip=0x1e498086 rev=0x04 hdr=0x00
    vendor     = 'Intel Corporation'
    device     = 'B75 Express Chipset LPC Controller'
    class      = bridge
    subclass   = PCI-ISA
    cap 09[e0] = vendor (length 12) Intel cap 1 version 0
		 features: AMT, 4 PCI-e x1 slots

ahci0@pci0:0:31:2:	class=0x010601 card=0x05821028 chip=0x1e028086 rev=0x04 hdr=0x00
    vendor     = 'Intel Corporation'
    device     = '7 Series/C210 Series Chipset Family 6-port SATA Controller [AHCI mode]'
    class      = mass storage
    subclass   = SATA
    bar   [10] = type I/O Port, range 32, base 0xf0b0, size 8, enabled
    bar   [14] = type I/O Port, range 32, base 0xf0a0, size 4, enabled
    bar   [18] = type I/O Port, range 32, base 0xf090, size 8, enabled
    bar   [1c] = type I/O Port, range 32, base 0xf080, size 4, enabled
    bar   [20] = type I/O Port, range 32, base 0xf060, size 32, enabled
    bar   [24] = type Memory, range 32, base 0xf7e16000, size 2048, enabled
    cap 05[80] = MSI supports 1 message enabled with 1 message
    cap 01[70] = powerspec 3  supports D0 D3  current D0
    cap 12[a8] = SATA Index-Data Pair
    cap 13[b0] = PCI Advanced Features: FLR TP

none1@pci0:0:31:3:	class=0x0c0500 card=0x05821028 chip=0x1e228086 rev=0x04 hdr=0x00
    vendor     = 'Intel Corporation'
    device     = '7 Series/C216 Chipset Family SMBus Controller'
    class      = serial bus
    subclass   = SMBus
    bar   [10] = type Memory, range 64, base 0xf7e15000, size 256, enabled
    bar   [20] = type I/O Port, range 32, base 0xf040, size 32, enabled

ath0@pci0:3:0:0:	class=0x028000 card=0x02081028 chip=0x0032168c rev=0x01 hdr=0x00
    vendor     = 'Qualcomm Atheros'
    device     = 'AR9485 Wireless Network Adapter'
    class      = network
    bar   [10] = type Memory, range 64, base 0xf7d00000, size 524288, enabled
    cap 01[40] = powerspec 2  supports D0 D1 D2 D3  current D0
    cap 05[50] = MSI supports 4 messages, 64 bit, vector masks 
    cap 10[70] = PCI-Express 2 endpoint max data 128(128)
                 link x1(x1) speed 2.5(2.5) ASPM L0s/L1(L0s/L1)
    ecap 0001[100] = AER 1 0 fatal 0 non-fatal 0 corrected
    ecap 0002[140] = VC 1 max VC0
    ecap 0003[160] = Serial 1 0000000000000000

igb0@pci0:4:0:0:	class=0x020000 card=0x03191dcf chip=0x10c98086 rev=0x01 hdr=0x00
    vendor     = 'Intel Corporation'
    device     = '82576 Gigabit Network Connection'
    class      = network
    subclass   = ethernet
    bar   [10] = type Memory, range 32, base 0xf7c20000, size 131072, enabled
    bar   [14] = type Memory, range 32, base 0xf7800000, size 4194304, enabled
    bar   [18] = type I/O Port, range 32, base 0xe020, size 32, enabled
    bar   [1c] = type Memory, range 32, base 0xf7c44000, size 16384, enabled
    cap 01[40] = powerspec 3  supports D0 D3  current D0
    cap 05[50] = MSI supports 1 message, 64 bit, vector masks 
    cap 11[70] = MSI-X supports 10 messages, enabled
                 Table in map 0x1c[0x0], PBA in map 0x1c[0x2000]
    cap 10[a0] = PCI-Express 2 endpoint max data 128(512) FLR NS
                 link x1(x4) speed 2.5(2.5) ASPM L1(L0s/L1)
    ecap 0001[100] = AER 1 0 fatal 0 non-fatal 1 corrected
    ecap 0003[140] = Serial 1 80615fffff0835e0
    ecap 000e[150] = ARI 1
    ecap 0010[160] = SR-IOV 1 IOV disabled, Memory Space disabled, ARI disabled
                     0 VFs configured out of 8 supported
                     First VF RID Offset 0x0180, VF RID Stride 0x0002
                     VF Device ID 0x10ca
                     Page Sizes: 4096 (enabled), 8192, 65536, 262144, 1048576, 4194304

igb1@pci0:4:0:1:	class=0x020000 card=0x03191dcf chip=0x10c98086 rev=0x01 hdr=0x00
    vendor     = 'Intel Corporation'
    device     = '82576 Gigabit Network Connection'
    class      = network
    subclass   = ethernet
    bar   [10] = type Memory, range 32, base 0xf7c00000, size 131072, enabled
    bar   [14] = type Memory, range 32, base 0xf7000000, size 4194304, enabled
    bar   [18] = type I/O Port, range 32, base 0xe000, size 32, enabled
    bar   [1c] = type Memory, range 32, base 0xf7c40000, size 16384, enabled
    cap 01[40] = powerspec 3  supports D0 D3  current D0
    cap 05[50] = MSI supports 1 message, 64 bit, vector masks 
    cap 11[70] = MSI-X supports 10 messages, enabled
                 Table in map 0x1c[0x0], PBA in map 0x1c[0x2000]
    cap 10[a0] = PCI-Express 2 endpoint max data 128(512) FLR NS
                 link x1(x4) speed 2.5(2.5) ASPM L1(L0s/L1)
    ecap 0001[100] = AER 1 0 fatal 0 non-fatal 1 corrected
    ecap 0003[140] = Serial 1 80615fffff0835e0
    ecap 000e[150] = ARI 1
    ecap 0010[160] = SR-IOV 1 IOV disabled, Memory Space disabled, ARI disabled
                     0 VFs configured out of 8 supported
                     First VF RID Offset 0x0180, VF RID Stride 0x0002
                     VF Device ID 0x10ca
                     Page Sizes: 4096 (enabled), 8192, 65536, 262144, 1048576, 4194304

re0@pci0:5:0:0:	class=0x020000 card=0x05821028 chip=0x816810ec rev=0x07 hdr=0x00
    vendor     = 'Realtek Semiconductor Co., Ltd.'
    device     = 'RTL8111/8168/8411 PCI Express Gigabit Ethernet Controller'
    class      = network
    subclass   = ethernet
    bar   [10] = type I/O Port, range 32, base 0xd000, size 256, enabled
    bar   [18] = type Prefetchable Memory, range 64, base 0xf0004000, size 4096, enabled
    bar   [20] = type Prefetchable Memory, range 64, base 0xf0000000, size 16384, enabled
    cap 01[40] = powerspec 3  supports D0 D1 D2 D3  current D0
    cap 05[50] = MSI supports 1 message, 64 bit 
    cap 10[70] = PCI-Express 2 endpoint MSI 1 max data 128(128)
                 link x1(x1) speed 2.5(2.5) ASPM disabled(L0s/L1)
    cap 11[b0] = MSI-X supports 4 messages, enabled
                 Table in map 0x20[0x0], PBA in map 0x20[0x800]
    cap 03[d0] = VPD
    ecap 0001[100] = AER 1 0 fatal 0 non-fatal 0 corrected
    ecap 0002[140] = VC 1 max VC0
    ecap 0003[160] = Serial 1 44000000684ce000
