hostb0@pci0:0:0:0:	class=0x060000 card=0x00000000 chip=0x1f018086 rev=0x03 hdr=0x00
    vendor     = 'Intel Corporation'
    device     = 'Atom processor C2000 SoC Transaction Router'
    class      = bridge
    subclass   = HOST-PCI

pcib1@pci0:0:1:0:	class=0x060400 card=0x1f101849 chip=0x1f108086 rev=0x03 hdr=0x01
    vendor     = 'Intel Corporation'
    device     = 'Atom processor C2000 PCIe Root Port 1'
    class      = bridge
    subclass   = PCI-PCI
    bar   [10] = type Memory, range 64, base 0xde640000, size 131072, enabled
    cap 10[40] = PCI-Express 2 root port max data 256(256) ARI enabled
                 link x8(x8) speed 5.0(5.0) ASPM disabled(L1)
                 slot 0 power limit 250 mW
    cap 01[80] = powerspec 3  supports D0 D3  current D0
    cap 0d[88] = PCI Bridge card=0x1f101849
    cap 05[90] = MSI supports 1 message, vector masks 
    ecap 0001[100] = AER 1 0 fatal 0 non-fatal 0 corrected

pcib2@pci0:0:3:0:	class=0x060400 card=0x1f121849 chip=0x1f128086 rev=0x03 hdr=0x01
    vendor     = 'Intel Corporation'
    device     = 'Atom processor C2000 PCIe Root Port 3'
    class      = bridge
    subclass   = PCI-PCI
    bar   [10] = type Memory, range 64, base 0xde620000, size 131072, enabled
    cap 10[40] = PCI-Express 2 root port max data 128(256) ARI disabled
                 link x4(x4) speed 5.0(5.0) ASPM disabled(L1)
                 slot 2 power limit 250 mW
    cap 01[80] = powerspec 3  supports D0 D3  current D0
    cap 0d[88] = PCI Bridge card=0x1f121849
    cap 05[90] = MSI supports 1 message, vector masks 
    ecap 0001[100] = AER 1 0 fatal 0 non-fatal 0 corrected

pcib9@pci0:0:4:0:	class=0x060400 card=0x1f131849 chip=0x1f138086 rev=0x03 hdr=0x01
    vendor     = 'Intel Corporation'
    device     = 'Atom processor C2000 PCIe Root Port 4'
    class      = bridge
    subclass   = PCI-PCI
    bar   [10] = type Memory, range 64, base 0xde600000, size 131072, enabled
    cap 10[40] = PCI-Express 2 root port max data 256(256) ARI disabled
                 link x2(x4) speed 5.0(5.0) ASPM disabled(L1)
                 slot 3 power limit 250 mW
    cap 01[80] = powerspec 3  supports D0 D3  current D0
    cap 0d[88] = PCI Bridge card=0x1f131849
    cap 05[90] = MSI supports 1 message, vector masks 
    ecap 0001[100] = AER 1 0 fatal 0 non-fatal 0 corrected

hostb1@pci0:0:14:0:	class=0x060000 card=0x1f141849 chip=0x1f148086 rev=0x03 hdr=0x00
    vendor     = 'Intel Corporation'
    device     = 'Atom processor C2000 RAS'
    class      = bridge
    subclass   = HOST-PCI
    cap 10[40] = PCI-Express 2 root endpoint max data 256(256)

none0@pci0:0:15:0:	class=0x080600 card=0x1f161849 chip=0x1f168086 rev=0x03 hdr=0x00
    vendor     = 'Intel Corporation'
    device     = 'Atom processor C2000 RCEC'
    class      = base peripheral
    subclass   = IOMMU
    cap 10[40] = PCI-Express 2 event collector max data 256(256)
    cap 01[80] = powerspec 3  supports D0 D3  current D0
    cap 05[90] = MSI supports 1 message, vector masks 
    ecap 0001[100] = AER 1 0 fatal 0 non-fatal 1 corrected
    ecap 0007[150] = Root Complex Event Collector ASsociation 1

none1@pci0:0:19:0:	class=0x088000 card=0x1f151849 chip=0x1f158086 rev=0x03 hdr=0x00
    vendor     = 'Intel Corporation'
    device     = 'Atom processor C2000 SMBus 2.0'
    class      = base peripheral
    bar   [10] = type Memory, range 64, base 0xde664000, size 1024, enabled
    cap 10[40] = PCI-Express 2 root endpoint max data 256(256) FLR NS
    cap 01[80] = powerspec 3  supports D0 D3  current D0
    cap 05[8c] = MSI supports 1 message, 64 bit, vector masks 
    ecap 0001[100] = AER 1 0 fatal 0 non-fatal 0 corrected

ehci0@pci0:0:22:0:	class=0x0c0320 card=0x1f2c1849 chip=0x1f2c8086 rev=0x03 hdr=0x00
    vendor     = 'Intel Corporation'
    device     = 'Atom processor C2000 USB Enhanced Host Controller'
    class      = serial bus
    subclass   = USB
    bar   [10] = type Memory, range 32, base 0xde663000, size 1024, enabled
    cap 01[50] = powerspec 3  supports D0 D3  current D0
    cap 0a[58] = EHCI Debug Port at offset 0xa0 in map 0x14
    cap 13[98] = PCI Advanced Features: FLR TP

ahci2@pci0:0:23:0:	class=0x010601 card=0x1f221849 chip=0x1f228086 rev=0x03 hdr=0x00
    vendor     = 'Intel Corporation'
    device     = 'Atom processor C2000 AHCI SATA2 Controller'
    class      = mass storage
    subclass   = SATA
    bar   [10] = type I/O Port, range 32, base 0xe0d0, size 8, enabled
    bar   [14] = type I/O Port, range 32, base 0xe0c0, size 4, enabled
    bar   [18] = type I/O Port, range 32, base 0xe0b0, size 8, enabled
    bar   [1c] = type I/O Port, range 32, base 0xe0a0, size 4, enabled
    bar   [20] = type I/O Port, range 32, base 0xe040, size 32, enabled
    bar   [24] = type Memory, range 32, base 0xde662000, size 2048, enabled
    cap 05[80] = MSI supports 1 message enabled with 1 message
    cap 01[70] = powerspec 3  supports D0 D3  current D0
    cap 12[a8] = SATA Index-Data Pair

ahci3@pci0:0:24:0:	class=0x010601 card=0x1f321849 chip=0x1f328086 rev=0x03 hdr=0x00
    vendor     = 'Intel Corporation'
    device     = 'Atom processor C2000 AHCI SATA3 Controller'
    class      = mass storage
    subclass   = SATA
    bar   [10] = type I/O Port, range 32, base 0xe090, size 8, enabled
    bar   [14] = type I/O Port, range 32, base 0xe080, size 4, enabled
    bar   [18] = type I/O Port, range 32, base 0xe070, size 8, enabled
    bar   [1c] = type I/O Port, range 32, base 0xe060, size 4, enabled
    bar   [20] = type I/O Port, range 32, base 0xe020, size 32, enabled
    bar   [24] = type Memory, range 32, base 0xde661000, size 2048, enabled
    cap 05[80] = MSI supports 1 message enabled with 1 message
    cap 01[70] = powerspec 3  supports D0 D3  current D0
    cap 12[a8] = SATA Index-Data Pair

isab0@pci0:0:31:0:	class=0x060100 card=0x1f381849 chip=0x1f388086 rev=0x03 hdr=0x00
    vendor     = 'Intel Corporation'
    device     = 'Atom processor C2000 PCU'
    class      = bridge
    subclass   = PCI-ISA
    cap 09[e0] = vendor (length 12) Intel cap 1 version 0
		 features: 4 PCI-e x1 slots

none2@pci0:0:31:3:	class=0x0c0500 card=0x1f3c1849 chip=0x1f3c8086 rev=0x03 hdr=0x00
    vendor     = 'Intel Corporation'
    device     = 'Atom processor C2000 PCU SMBus'
    class      = serial bus
    subclass   = SMBus
    bar   [10] = type Memory, range 32, base 0xde660000, size 32, enabled
    bar   [20] = type I/O Port, range 32, base 0xe000, size 32, enabled

t4iov0@pci0:1:0:0:	class=0x020000 card=0x00001425 chip=0x40011425 rev=0x00 hdr=0x00
    vendor     = 'Chelsio Communications Inc'
    device     = 'T420-CR Unified Wire Ethernet Controller'
    class      = network
    subclass   = ethernet
    bar   [10] = type Memory, range 64, base 0xdf200000, size 262144, enabled
    bar   [20] = type Memory, range 64, base 0xdf24c000, size 8192, enabled
    cap 01[40] = powerspec 3  supports D0 D3  current D0
    cap 05[48] = MSI supports 8 messages, 64 bit, vector masks 
    cap 11[60] = MSI-X supports 8 messages
                 Table in map 0x20[0x0], PBA in map 0x20[0x1000]
    cap 10[6c] = PCI-Express 2 endpoint max data 256(2048) FLR NS
                 link x8(x8) speed 5.0(5.0) ASPM disabled(L0s/L1)
    cap 03[a8] = VPD
    ecap 0001[100] = AER 1 0 fatal 0 non-fatal 1 corrected
    ecap 0008[138] = MFVC 1
    ecap 0003[1b8] = Serial 1 0000000000000000
    ecap 0010[1c4] = SR-IOV 1 IOV disabled, Memory Space disabled, ARI disabled
                     0 VFs configured out of 16 supported
                     First VF RID Offset 0x0008, VF RID Stride 0x0004
                     VF Device ID 0x4801
                     Page Sizes: 4096 (enabled)
    ecap 000e[204] = ARI 1

t4iov1@pci0:1:0:1:	class=0x020000 card=0x00001425 chip=0x40011425 rev=0x00 hdr=0x00
    vendor     = 'Chelsio Communications Inc'
    device     = 'T420-CR Unified Wire Ethernet Controller'
    class      = network
    subclass   = ethernet
    bar   [10] = type Memory, range 64, base 0xdf1c0000, size 262144, enabled
    bar   [20] = type Memory, range 64, base 0xdf24a000, size 8192, enabled
    cap 01[40] = powerspec 3  supports D0 D3  current D0
    cap 05[48] = MSI supports 8 messages, 64 bit, vector masks 
    cap 11[60] = MSI-X supports 8 messages
                 Table in map 0x20[0x0], PBA in map 0x20[0x1000]
    cap 10[6c] = PCI-Express 2 endpoint max data 256(2048) FLR NS
                 link x8(x8) speed 5.0(5.0) ASPM disabled(L0s/L1)
    cap 03[a8] = VPD
    ecap 0001[100] = AER 1 0 fatal 0 non-fatal 1 corrected
    ecap 0003[138] = Serial 1 0000000000000000
    ecap 0010[144] = SR-IOV 1 IOV disabled, Memory Space disabled, ARI disabled
                     0 VFs configured out of 16 supported
                     First VF RID Offset 0x0008, VF RID Stride 0x0004
                     VF Device ID 0x4801
                     Page Sizes: 4096 (enabled)
    ecap 000e[184] = ARI 1

t4iov2@pci0:1:0:2:	class=0x020000 card=0x00001425 chip=0x40011425 rev=0x00 hdr=0x00
    vendor     = 'Chelsio Communications Inc'
    device     = 'T420-CR Unified Wire Ethernet Controller'
    class      = network
    subclass   = ethernet
    bar   [10] = type Memory, range 64, base 0xdf180000, size 262144, enabled
    bar   [20] = type Memory, range 64, base 0xdf248000, size 8192, enabled
    cap 01[40] = powerspec 3  supports D0 D3  current D0
    cap 05[48] = MSI supports 8 messages, 64 bit, vector masks 
    cap 11[60] = MSI-X supports 8 messages
                 Table in map 0x20[0x0], PBA in map 0x20[0x1000]
    cap 10[6c] = PCI-Express 2 endpoint max data 256(2048) FLR NS
                 link x8(x8) speed 5.0(5.0) ASPM disabled(L0s/L1)
    cap 03[a8] = VPD
    ecap 0001[100] = AER 1 0 fatal 0 non-fatal 1 corrected
    ecap 0003[138] = Serial 1 0000000000000000
    ecap 0010[144] = SR-IOV 1 IOV disabled, Memory Space disabled, ARI disabled
                     0 VFs configured out of 16 supported
                     First VF RID Offset 0x0008, VF RID Stride 0x0004
                     VF Device ID 0x4801
                     Page Sizes: 4096 (enabled)
    ecap 000e[184] = ARI 1

t4iov3@pci0:1:0:3:	class=0x020000 card=0x00001425 chip=0x40011425 rev=0x00 hdr=0x00
    vendor     = 'Chelsio Communications Inc'
    device     = 'T420-CR Unified Wire Ethernet Controller'
    class      = network
    subclass   = ethernet
    bar   [10] = type Memory, range 64, base 0xdf140000, size 262144, enabled
    bar   [20] = type Memory, range 64, base 0xdf246000, size 8192, enabled
    cap 01[40] = powerspec 3  supports D0 D3  current D0
    cap 05[48] = MSI supports 8 messages, 64 bit, vector masks 
    cap 11[60] = MSI-X supports 8 messages
                 Table in map 0x20[0x0], PBA in map 0x20[0x1000]
    cap 10[6c] = PCI-Express 2 endpoint max data 256(2048) FLR NS
                 link x8(x8) speed 5.0(5.0) ASPM disabled(L0s/L1)
    cap 03[a8] = VPD
    ecap 0001[100] = AER 1 0 fatal 0 non-fatal 1 corrected
    ecap 0003[138] = Serial 1 0000000000000000
    ecap 0010[144] = SR-IOV 1 IOV disabled, Memory Space disabled, ARI disabled
                     0 VFs configured out of 16 supported
                     First VF RID Offset 0x0008, VF RID Stride 0x0004
                     VF Device ID 0x4801
                     Page Sizes: 4096 (enabled)
    ecap 000e[184] = ARI 1

t4nex0@pci0:1:0:4:	class=0x020000 card=0x00001425 chip=0x44011425 rev=0x00 hdr=0x00
    vendor     = 'Chelsio Communications Inc'
    device     = 'T420-CR Unified Wire Ethernet Controller'
    class      = network
    subclass   = ethernet
    bar   [10] = type Memory, range 64, base 0xdf100000, size 262144, enabled
    bar   [18] = type Memory, range 64, base 0xde800000, size 8388608, enabled
    bar   [20] = type Memory, range 64, base 0xdf244000, size 8192, enabled
    cap 01[40] = powerspec 3  supports D0 D3  current D0
    cap 05[48] = MSI supports 32 messages, 64 bit, vector masks 
    cap 11[60] = MSI-X supports 128 messages, enabled
                 Table in map 0x20[0x0], PBA in map 0x20[0x1000]
    cap 10[6c] = PCI-Express 2 endpoint max data 256(2048) FLR NS
                 link x8(x8) speed 5.0(5.0) ASPM disabled(L0s/L1)
    cap 03[a8] = VPD
    ecap 0001[100] = AER 1 0 fatal 0 non-fatal 1 corrected
    ecap 0003[138] = Serial 1 0000000000000000
    ecap 000e[144] = ARI 1

none3@pci0:1:0:5:	class=0x010000 card=0x00001425 chip=0x45011425 rev=0x00 hdr=0x00
    vendor     = 'Chelsio Communications Inc'
    device     = 'T420-CR Unified Wire Storage Controller'
    class      = mass storage
    subclass   = SCSI
    bar   [10] = type Memory, range 64, base 0xdf0c0000, size 262144, enabled
    bar   [20] = type Memory, range 64, base 0xdf242000, size 8192, enabled
    cap 01[40] = powerspec 3  supports D0 D3  current D0
    cap 05[48] = MSI supports 32 messages, 64 bit, vector masks 
    cap 11[60] = MSI-X supports 40 messages
                 Table in map 0x20[0x0], PBA in map 0x20[0x1000]
    cap 10[6c] = PCI-Express 2 endpoint max data 256(2048) FLR NS
                 link x8(x8) speed 5.0(5.0) ASPM disabled(L0s/L1)
    cap 03[a8] = VPD
    ecap 0001[100] = AER 1 0 fatal 0 non-fatal 1 corrected
    ecap 0003[138] = Serial 1 0000000000000000
    ecap 000e[144] = ARI 1

none4@pci0:1:0:6:	class=0x0c0400 card=0x00001425 chip=0x46011425 rev=0x00 hdr=0x00
    vendor     = 'Chelsio Communications Inc'
    device     = 'T420-CR Unified Wire Storage Controller'
    class      = serial bus
    subclass   = Fibre Channel
    bar   [10] = type Memory, range 64, base 0xdf080000, size 262144, enabled
    bar   [20] = type Memory, range 64, base 0xdf240000, size 8192, enabled
    cap 01[40] = powerspec 3  supports D0 D3  current D0
    cap 05[48] = MSI supports 32 messages, 64 bit, vector masks 
    cap 11[60] = MSI-X supports 40 messages
                 Table in map 0x20[0x0], PBA in map 0x20[0x1000]
    cap 10[6c] = PCI-Express 2 endpoint max data 256(2048) FLR NS
                 link x8(x8) speed 5.0(5.0) ASPM disabled(L0s/L1)
    cap 03[a8] = VPD
    ecap 0001[100] = AER 1 0 fatal 0 non-fatal 1 corrected
    ecap 0003[138] = Serial 1 0000000000000000
    ecap 000e[144] = ARI 1

none5@pci0:1:0:7:	class=0x020000 card=0x00001425 chip=0x00001425 rev=0x00 hdr=0x00
    vendor     = 'Chelsio Communications Inc'
    class      = network
    subclass   = ethernet
    cap 01[40] = powerspec 3  supports D0 D3  current D0
    cap 05[48] = MSI supports 32 messages, 64 bit, vector masks 
    cap 11[60] = MSI-X supports 32 messages
                 Table in map 0x20[0x0], PBA in map 0x20[0x1000]
    cap 10[6c] = PCI-Express 2 endpoint max data 256(2048) FLR NS
                 link x8(x8) speed 5.0(5.0) ASPM disabled(L0s/L1)
    cap 03[a8] = VPD
    ecap 0001[100] = AER 1 0 fatal 0 non-fatal 1 corrected
    ecap 0003[138] = Serial 1 0000000000000000
    ecap 000e[144] = ARI 1

pcib3@pci0:2:0:0:	class=0x060400 card=0x860810b5 chip=0x860810b5 rev=0xba hdr=0x01
    vendor     = 'PLX Technology, Inc.'
    device     = 'PEX 8608 8-lane, 8-Port PCI Express Gen 2 (5.0 GT/s) Switch'
    class      = bridge
    subclass   = PCI-PCI
    bar   [10] = type Memory, range 32, base 0xde500000, size 131072, enabled
    cap 01[40] = powerspec 3  supports D0 D3  current D0
    cap 05[48] = MSI supports 4 messages, 64 bit, vector masks 
    cap 10[68] = PCI-Express 2 upstream port max data 128(512)
                 link x4(x4) speed 5.0(5.0) ASPM disabled(L0s/L1)
    cap 0d[a4] = PCI Bridge card=0x860810b5
    ecap 0003[100] = Serial 1 ba860110b5df0e00
    ecap 0001[fb4] = AER 1 0 fatal 0 non-fatal 1 corrected
    ecap 0004[138] = Power Budgeting 1
    ecap 0002[148] = VC 1 max VC1 lowpri VC0-VC1
    ecap 000b[448] = Vendor 1 ID 0
    ecap 000b[950] = Vendor 1 ID 1

pcib4@pci0:3:1:0:	class=0x060400 card=0x860810b5 chip=0x860810b5 rev=0xba hdr=0x01
    vendor     = 'PLX Technology, Inc.'
    device     = 'PEX 8608 8-lane, 8-Port PCI Express Gen 2 (5.0 GT/s) Switch'
    class      = bridge
    subclass   = PCI-PCI
    cap 01[40] = powerspec 3  supports D0 D3  current D0
    cap 05[48] = MSI supports 4 messages, 64 bit, vector masks 
    cap 10[68] = PCI-Express 2 downstream port max data 128(512) ARI disabled
                 link x1(x1) speed 5.0(5.0) ASPM disabled(L0s/L1)
                 slot 113 power limit 25000 mW
    cap 0d[a4] = PCI Bridge card=0x860810b5
    ecap 0003[100] = Serial 1 ba860110b5df0e00
    ecap 0001[fb4] = AER 1 0 fatal 0 non-fatal 1 corrected
    ecap 0002[148] = VC 1 max VC1 lowpri VC0-VC1
    ecap 000d[520] = ACS 1
    ecap 000b[950] = Vendor 1 ID 1

pcib5@pci0:3:5:0:	class=0x060400 card=0x860810b5 chip=0x860810b5 rev=0xba hdr=0x01
    vendor     = 'PLX Technology, Inc.'
    device     = 'PEX 8608 8-lane, 8-Port PCI Express Gen 2 (5.0 GT/s) Switch'
    class      = bridge
    subclass   = PCI-PCI
    cap 01[40] = powerspec 3  supports D0 D3  current D0
    cap 05[48] = MSI supports 4 messages, 64 bit, vector masks 
    cap 10[68] = PCI-Express 2 downstream port max data 128(512) ARI disabled
                 link x1(x1) speed 2.5(5.0) ASPM disabled(L0s/L1)
                 slot 117 power limit 25000 mW
    cap 0d[a4] = PCI Bridge card=0x860810b5
    ecap 0003[100] = Serial 1 ba860110b5df0e00
    ecap 0001[fb4] = AER 1 0 fatal 0 non-fatal 1 corrected
    ecap 0002[148] = VC 1 max VC1 lowpri VC0-VC1
    ecap 000d[520] = ACS 1
    ecap 000b[950] = Vendor 1 ID 1

pcib7@pci0:3:7:0:	class=0x060400 card=0x860810b5 chip=0x860810b5 rev=0xba hdr=0x01
    vendor     = 'PLX Technology, Inc.'
    device     = 'PEX 8608 8-lane, 8-Port PCI Express Gen 2 (5.0 GT/s) Switch'
    class      = bridge
    subclass   = PCI-PCI
    cap 01[40] = powerspec 3  supports D0 D3  current D0
    cap 05[48] = MSI supports 4 messages, 64 bit, vector masks 
    cap 10[68] = PCI-Express 2 downstream port max data 128(512) ARI disabled
                 link x1(x1) speed 2.5(5.0) ASPM disabled(L0s/L1)
                 slot 119 power limit 25000 mW
    cap 0d[a4] = PCI Bridge card=0x860810b5
    ecap 0003[100] = Serial 1 ba860110b5df0e00
    ecap 0001[fb4] = AER 1 0 fatal 0 non-fatal 1 corrected
    ecap 0002[148] = VC 1 max VC1 lowpri VC0-VC1
    ecap 000d[520] = ACS 1
    ecap 000b[950] = Vendor 1 ID 1

pcib8@pci0:3:9:0:	class=0x060400 card=0x860810b5 chip=0x860810b5 rev=0xba hdr=0x01
    vendor     = 'PLX Technology, Inc.'
    device     = 'PEX 8608 8-lane, 8-Port PCI Express Gen 2 (5.0 GT/s) Switch'
    class      = bridge
    subclass   = PCI-PCI
    cap 01[40] = powerspec 3  supports D0 D3  current D0
    cap 05[48] = MSI supports 4 messages, 64 bit, vector masks 
    cap 10[68] = PCI-Express 2 downstream port max data 128(512) ARI disabled
                 link x1(x1) speed 2.5(5.0) ASPM disabled(L0s/L1)
                 slot 121 power limit 25000 mW
    cap 0d[a4] = PCI Bridge card=0x860810b5
    ecap 0003[100] = Serial 1 ba860110b5df0e00
    ecap 0001[fb4] = AER 1 0 fatal 0 non-fatal 1 corrected
    ecap 0002[148] = VC 1 max VC1 lowpri VC0-VC1
    ecap 000d[520] = ACS 1
    ecap 000b[950] = Vendor 1 ID 1

ahci0@pci0:4:0:0:	class=0x010601 card=0x91721849 chip=0x91721b4b rev=0x12 hdr=0x00
    vendor     = 'Marvell Technology Group Ltd.'
    device     = '88SE9172 SATA 6Gb/s Controller'
    class      = mass storage
    subclass   = SATA
    bar   [10] = type I/O Port, range 32, base 0xc040, size 8, enabled
    bar   [14] = type I/O Port, range 32, base 0xc030, size 4, enabled
    bar   [18] = type I/O Port, range 32, base 0xc020, size 8, enabled
    bar   [1c] = type I/O Port, range 32, base 0xc010, size 4, enabled
    bar   [20] = type I/O Port, range 32, base 0xc000, size 16, enabled
    bar   [24] = type Memory, range 32, base 0xde410000, size 512, enabled
    cap 01[40] = powerspec 3  supports D0 D3  current D0
    cap 05[50] = MSI supports 1 message enabled with 1 message
    cap 10[70] = PCI-Express 2 legacy endpoint max data 128(512)
                 link x1(x1) speed 5.0(5.0) ASPM disabled(L0s/L1)
    ecap 0001[100] = AER 1 0 fatal 0 non-fatal 1 corrected

pcib6@pci0:5:0:0:	class=0x060400 card=0x11501849 chip=0x11501a03 rev=0x02 hdr=0x01
    vendor     = 'ASPEED Technology, Inc.'
    device     = 'AST1150 PCI-to-PCI Bridge'
    class      = bridge
    subclass   = PCI-PCI
    cap 05[50] = MSI supports 1 message, 64 bit 
    cap 01[78] = powerspec 3  supports D0 D1 D2 D3  current D0
    cap 10[80] = PCI-Express 1 PCI bridge max data 128(128) NS
                 link x1(x1) speed 2.5(2.5) ASPM disabled(L0s/L1)
    cap 0d[a4] = PCI Bridge card=0x11501849
    ecap 0002[100] = VC 1 max VC0

vgapci0@pci0:6:0:0:	class=0x030000 card=0x20001849 chip=0x20001a03 rev=0x21 hdr=0x00
    vendor     = 'ASPEED Technology, Inc.'
    device     = 'ASPEED Graphics Family'
    class      = display
    subclass   = VGA
    bar   [10] = type Memory, range 32, base 0xdd000000, size 16777216, enabled
    bar   [14] = type Memory, range 32, base 0xde000000, size 131072, enabled
    bar   [18] = type I/O Port, range 32, base 0xb000, size 128, enabled
    cap 01[40] = powerspec 3  supports D0 D1 D2 D3  current D0

igb0@pci0:7:0:0:	class=0x020000 card=0x15331849 chip=0x15338086 rev=0x03 hdr=0x00
    vendor     = 'Intel Corporation'
    device     = 'I210 Gigabit Network Connection'
    class      = network
    subclass   = ethernet
    bar   [10] = type Memory, range 32, base 0xde300000, size 524288, enabled
    bar   [18] = type I/O Port, range 32, base 0xa000, size 32, enabled
    bar   [1c] = type Memory, range 32, base 0xde380000, size 16384, enabled
    cap 01[40] = powerspec 3  supports D0 D3  current D0
    cap 05[50] = MSI supports 1 message, 64 bit, vector masks 
    cap 11[70] = MSI-X supports 5 messages, enabled
                 Table in map 0x1c[0x0], PBA in map 0x1c[0x2000]
    cap 10[a0] = PCI-Express 2 endpoint max data 128(512) FLR NS
                 link x1(x1) speed 2.5(2.5) ASPM disabled(L0s/L1)
    ecap 0001[100] = AER 2 0 fatal 0 non-fatal 1 corrected
    ecap 0003[140] = Serial 1 d05099ffffc39ede
    ecap 0017[1a0] = TPH Requester 1

igb1@pci0:8:0:0:	class=0x020000 card=0x15331849 chip=0x15338086 rev=0x03 hdr=0x00
    vendor     = 'Intel Corporation'
    device     = 'I210 Gigabit Network Connection'
    class      = network
    subclass   = ethernet
    bar   [10] = type Memory, range 32, base 0xde200000, size 524288, enabled
    bar   [18] = type I/O Port, range 32, base 0x9000, size 32, enabled
    bar   [1c] = type Memory, range 32, base 0xde280000, size 16384, enabled
    cap 01[40] = powerspec 3  supports D0 D3  current D0
    cap 05[50] = MSI supports 1 message, 64 bit, vector masks 
    cap 11[70] = MSI-X supports 5 messages, enabled
                 Table in map 0x1c[0x0], PBA in map 0x1c[0x2000]
    cap 10[a0] = PCI-Express 2 endpoint max data 128(512) FLR NS
                 link x1(x1) speed 2.5(2.5) ASPM disabled(L0s/L1)
    ecap 0001[100] = AER 2 0 fatal 0 non-fatal 1 corrected
    ecap 0003[140] = Serial 1 d05099ffffc39edf
    ecap 0017[1a0] = TPH Requester 1

ahci1@pci0:9:0:0:	class=0x010601 card=0x92301849 chip=0x92301b4b rev=0x11 hdr=0x00
    vendor     = 'Marvell Technology Group Ltd.'
    device     = '88SE9230 PCIe SATA 6Gb/s Controller'
    class      = mass storage
    subclass   = SATA
    bar   [10] = type I/O Port, range 32, base 0xd050, size 8, enabled
    bar   [14] = type I/O Port, range 32, base 0xd040, size 4, enabled
    bar   [18] = type I/O Port, range 32, base 0xd030, size 8, enabled
    bar   [1c] = type I/O Port, range 32, base 0xd020, size 4, enabled
    bar   [20] = type I/O Port, range 32, base 0xd000, size 32, enabled
    bar   [24] = type Memory, range 32, base 0xdf410000, size 2048, enabled
    cap 01[40] = powerspec 3  supports D0 D3  current D0
    cap 05[50] = MSI supports 1 message enabled with 1 message
    cap 10[70] = PCI-Express 2 legacy endpoint max data 256(512)
                 link x2(x2) speed 5.0(5.0) ASPM disabled(L0s/L1)
    cap 12[e0] = SATA Index-Data Pair
    ecap 0001[100] = AER 1 0 fatal 0 non-fatal 1 corrected
