hostb0@pci0:0:0:0:	class=0x060000 card=0x309f17aa chip=0x0c008086 rev=0x06 hdr=0x00
    vendor     = 'Intel Corporation'
    device     = '4th Gen Core Processor DRAM Controller'
    class      = bridge
    subclass   = HOST-PCI
    cap 09[e0] = vendor (length 12) Intel cap 0 version 1

vgapci0@pci0:0:2:0:	class=0x030000 card=0x309f17aa chip=0x041e8086 rev=0x06 hdr=0x00
    vendor     = 'Intel Corporation'
    device     = '4th Generation Core Processor Family Integrated Graphics Controller'
    class      = display
    subclass   = VGA
    bar   [10] = type Memory, range 64, base 0xf7800000, size 4194304, enabled
    bar   [18] = type Prefetchable Memory, range 64, base 0xe0000000, size 268435456, enabled
    bar   [20] = type I/O Port, range 32, base 0xf000, size 64, enabled
    cap 05[90] = MSI supports 1 message enabled with 1 message
    cap 01[d0] = powerspec 2  supports D0 D3  current D0
    cap 13[a4] = PCI Advanced Features: FLR TP

hdac0@pci0:0:3:0:	class=0x040300 card=0x309f17aa chip=0x0c0c8086 rev=0x06 hdr=0x00
    vendor     = 'Intel Corporation'
    device     = 'Xeon E3-1200 v3/4th Gen Core Processor HD Audio Controller'
    class      = multimedia
    subclass   = HDA
    bar   [10] = type Memory, range 64, base 0xf7c34000, size 16384, enabled
    cap 01[50] = powerspec 2  supports D0 D3  current D0
    cap 05[60] = MSI supports 1 message enabled with 1 message
    cap 10[70] = PCI-Express 1 root endpoint max data 128(128) FLR NS

xhci0@pci0:0:20:0:	class=0x0c0330 card=0x309f17aa chip=0x8c318086 rev=0x04 hdr=0x00
    vendor     = 'Intel Corporation'
    device     = '8 Series/C220 Series Chipset Family USB xHCI'
    class      = serial bus
    subclass   = USB
    bar   [10] = type Memory, range 64, base 0xf7c20000, size 65536, enabled
    cap 01[70] = powerspec 2  supports D0 D3  current D0
    cap 05[80] = MSI supports 8 messages, 64 bit enabled with 1 message

none0@pci0:0:22:0:	class=0x078000 card=0x309f17aa chip=0x8c3a8086 rev=0x04 hdr=0x00
    vendor     = 'Intel Corporation'
    device     = '8 Series/C220 Series Chipset Family MEI Controller'
    class      = simple comms
    bar   [10] = type Memory, range 64, base 0xf7c40000, size 16, enabled
    cap 01[50] = powerspec 3  supports D0 D3  current D0
    cap 05[8c] = MSI supports 1 message, 64 bit 

uart2@pci0:0:22:3:	class=0x070002 card=0x309f17aa chip=0x8c3d8086 rev=0x04 hdr=0x00
    vendor     = 'Intel Corporation'
    device     = '8 Series/C220 Series Chipset Family KT Controller'
    class      = simple comms
    subclass   = UART
    bar   [10] = type I/O Port, range 32, base 0xf0e0, size 8, enabled
    bar   [14] = type Memory, range 32, base 0xf7c3e000, size 4096, enabled
    cap 01[c8] = powerspec 3  supports D0 D3  current D0
    cap 05[d0] = MSI supports 1 message, 64 bit enabled with 1 message

em0@pci0:0:25:0:	class=0x020000 card=0x309f17aa chip=0x153a8086 rev=0x04 hdr=0x00
    vendor     = 'Intel Corporation'
    device     = 'Ethernet Connection I217-LM'
    class      = network
    subclass   = ethernet
    bar   [10] = type Memory, range 32, base 0xf7c00000, size 131072, enabled
    bar   [14] = type Memory, range 32, base 0xf7c3d000, size 4096, enabled
    bar   [18] = type I/O Port, range 32, base 0xf080, size 32, enabled
    cap 01[c8] = powerspec 2  supports D0 D3  current D0
    cap 05[d0] = MSI supports 1 message, 64 bit enabled with 1 message
    cap 13[e0] = PCI Advanced Features: FLR TP

ehci0@pci0:0:26:0:	class=0x0c0320 card=0x309f17aa chip=0x8c2d8086 rev=0x04 hdr=0x00
    vendor     = 'Intel Corporation'
    device     = '8 Series/C220 Series Chipset Family USB EHCI'
    class      = serial bus
    subclass   = USB
    bar   [10] = type Memory, range 32, base 0xf7c3c000, size 1024, enabled
    cap 01[50] = powerspec 2  supports D0 D3  current D0
    cap 0a[58] = EHCI Debug Port at offset 0xa0 in map 0x14
    cap 13[98] = PCI Advanced Features: FLR TP

hdac1@pci0:0:27:0:	class=0x040300 card=0x309f17aa chip=0x8c208086 rev=0x04 hdr=0x00
    vendor     = 'Intel Corporation'
    device     = '8 Series/C220 Series Chipset High Definition Audio Controller'
    class      = multimedia
    subclass   = HDA
    bar   [10] = type Memory, range 64, base 0xf7c30000, size 16384, enabled
    cap 01[50] = powerspec 2  supports D0 D3  current D0
    cap 05[60] = MSI supports 1 message, 64 bit enabled with 1 message
    cap 10[70] = PCI-Express 1 root endpoint max data 128(128) FLR NS
    ecap 0002[100] = VC 1 max VC1

ehci1@pci0:0:29:0:	class=0x0c0320 card=0x309f17aa chip=0x8c268086 rev=0x04 hdr=0x00
    vendor     = 'Intel Corporation'
    device     = '8 Series/C220 Series Chipset Family USB EHCI'
    class      = serial bus
    subclass   = USB
    bar   [10] = type Memory, range 32, base 0xf7c3b000, size 1024, enabled
    cap 01[50] = powerspec 2  supports D0 D3  current D0
    cap 0a[58] = EHCI Debug Port at offset 0xa0 in map 0x14
    cap 13[98] = PCI Advanced Features: FLR TP

isab0@pci0:0:31:0:	class=0x060100 card=0x309f17aa chip=0x8c4c8086 rev=0x04 hdr=0x00
    vendor     = 'Intel Corporation'
    device     = 'Q85 Express LPC Controller'
    class      = bridge
    subclass   = PCI-ISA
    cap 09[e0] = vendor (length 12) Intel cap 1 version 0
		 features: AMT, 4 PCI-e x1 slots

ahci0@pci0:0:31:2:	class=0x010601 card=0x309f17aa chip=0x8c028086 rev=0x04 hdr=0x00
    vendor     = 'Intel Corporation'
    device     = '8 Series/C220 Series Chipset Family 6-port SATA Controller 1 [AHCI mode]'
    class      = mass storage
    subclass   = SATA
    bar   [10] = type I/O Port, range 32, base 0xf0d0, size 8, enabled
    bar   [14] = type I/O Port, range 32, base 0xf0c0, size 4, enabled
    bar   [18] = type I/O Port, range 32, base 0xf0b0, size 8, enabled
    bar   [1c] = type I/O Port, range 32, base 0xf0a0, size 4, enabled
    bar   [20] = type I/O Port, range 32, base 0xf060, size 32, enabled
    bar   [24] = type Memory, range 32, base 0xf7c3a000, size 2048, enabled
    cap 05[80] = MSI supports 1 message enabled with 1 message
    cap 01[70] = powerspec 3  supports D0 D3  current D0
    cap 12[a8] = SATA Index-Data Pair

none1@pci0:0:31:3:	class=0x0c0500 card=0x309f17aa chip=0x8c228086 rev=0x04 hdr=0x00
    vendor     = 'Intel Corporation'
    device     = '8 Series/C220 Series Chipset Family SMBus Controller'
    class      = serial bus
    subclass   = SMBus
    bar   [10] = type Memory, range 64, base 0xf7c39000, size 256, enabled
    bar   [20] = type I/O Port, range 32, base 0x580, size 32, enabled
