hostb0@pci0:0:0:0:	class=0x060000 rev=0x03 hdr=0x00 vendor=0x8086 device=0x31f0 subvendor=0x17aa subdevice=0x3807
    vendor     = 'Intel Corporation'
    device     = 'Gemini Lake Host Bridge'
    class      = bridge
    subclass   = HOST-PCI

none0@pci0:0:0:1:	class=0x118000 rev=0x03 hdr=0x00 vendor=0x8086 device=0x318c subvendor=0x0000 subdevice=0x0000
    vendor     = 'Intel Corporation'
    device     = 'Celeron/Pentium Silver Processor Dynamic Platform and Thermal Framework Processor Participant'
    class      = dasp
    bar   [10] = type Memory, range 64, base 0x80000000, size 32768, enabled
    cap 01[d0] = powerspec 3  supports D0 D3  current D0
    cap 09[e0] = vendor (length 12) Intel cap 0 version 1

none1@pci0:0:0:3:	class=0x088000 rev=0x03 hdr=0x00 vendor=0x8086 device=0x3190 subvendor=0x17aa subdevice=0x3807
    vendor     = 'Intel Corporation'
    device     = 'Celeron/Pentium Silver Processor Gaussian Mixture Model'
    class      = base peripheral
    bar   [10] = type Memory, range 64, base 0xa1316000, size 4096, enabled
    cap 05[90] = MSI supports 1 message 
    cap 09[a0] = vendor (length 20) Intel cap 15 version 0
    cap 01[dc] = powerspec 2  supports D0 D3  current D0
    cap 13[f0] = PCI Advanced Features: FLR TP

vgapci0@pci0:0:2:0:	class=0x030000 rev=0x03 hdr=0x00 vendor=0x8086 device=0x3184 subvendor=0x17aa subdevice=0x39fd
    vendor     = 'Intel Corporation'
    device     = 'GeminiLake [UHD Graphics 605]'
    class      = display
    subclass   = VGA
    bar   [10] = type Memory, range 64, base 0xa0000000, size 16777216, enabled
    bar   [18] = type Prefetchable Memory, range 64, base 0x90000000, size 268435456, enabled
    bar   [20] = type I/O Port, range 32, base 0x1000, size 64, enabled
    cap 09[40] = vendor (length 12) Intel cap 0 version 1
    cap 10[70] = PCI-Express 2 root endpoint max data 128(128) FLR
                 max read 128
    cap 05[ac] = MSI supports 1 message enabled with 1 message
    cap 01[d0] = powerspec 2  supports D0 D3  current D0
    ecap 001b[100] = Process Address Space ID 1
    ecap 000f[200] = ATS 1
    ecap 0013[300] = Page Page Request 1

hdac0@pci0:0:14:0:	class=0x040300 rev=0x03 hdr=0x00 vendor=0x8086 device=0x3198 subvendor=0x17aa subdevice=0x3807
    vendor     = 'Intel Corporation'
    device     = 'Celeron/Pentium Silver Processor High Definition Audio'
    class      = multimedia
    subclass   = HDA
    bar   [10] = type Memory, range 64, base 0xa1310000, size 16384, enabled
    bar   [20] = type Memory, range 64, base 0xa1000000, size 1048576, enabled
    cap 01[50] = powerspec 3  supports D0 D3  current D0
    cap 09[80] = vendor (length 20) Intel cap 15 version 0
    cap 05[60] = MSI supports 1 message, 64 bit enabled with 1 message
    cap 10[70] = PCI-Express 1 root endpoint max data 128(128) FLR NS
                 max read 512
                 link x1(x0)

none2@pci0:0:15:0:	class=0x078000 rev=0x03 hdr=0x00 vendor=0x8086 device=0x319a subvendor=0x0000 subdevice=0x0000
    vendor     = 'Intel Corporation'
    device     = 'Celeron/Pentium Silver Processor Trusted Execution Engine Interface'
    class      = simple comms
    bar   [10] = type Memory, range 64, base 0xa1317000, size 4096, enabled
    cap 01[50] = powerspec 3  supports D0 D3  current D0
    cap 05[8c] = MSI supports 1 message, 64 bit 
    cap 09[a4] = vendor (length 20) Intel cap 15 version 0

ahci0@pci0:0:18:0:	class=0x010601 rev=0x03 hdr=0x00 vendor=0x8086 device=0x31e3 subvendor=0x17aa subdevice=0x3807
    vendor     = 'Intel Corporation'
    device     = 'Celeron/Pentium Silver Processor SATA Controller'
    class      = mass storage
    subclass   = SATA
    bar   [10] = type Memory, range 32, base 0xa1314000, size 8192, enabled
    bar   [14] = type Memory, range 32, base 0xa131e000, size 256, enabled
    bar   [18] = type I/O Port, range 32, base 0x1080, size 8, enabled
    bar   [1c] = type I/O Port, range 32, base 0x1088, size 4, enabled
    bar   [20] = type I/O Port, range 32, base 0x1060, size 32, enabled
    bar   [24] = type Memory, range 32, base 0xa131c000, size 2048, enabled
    cap 05[80] = MSI supports 1 message enabled with 1 message
    cap 01[70] = powerspec 3  supports D0 D3  current D0
    cap 12[a8] = SATA Index-Data Pair

pcib1@pci0:0:19:0:	class=0x060400 rev=0xf3 hdr=0x01 vendor=0x8086 device=0x31d8 subvendor=0x0000 subdevice=0x0000
    vendor     = 'Intel Corporation'
    device     = 'Gemini Lake PCI Express Root Port'
    class      = bridge
    subclass   = PCI-PCI
    cap 10[40] = PCI-Express 2 root port max data 256(256) ARI disabled
                 max read 128
                 link x0(x2) speed 0.0(5.0) ASPM L0s/L1(L0s/L1)
                 slot 2 power limit 250 mW
    cap 05[80] = MSI supports 1 message 
    cap 0d[90] = PCI Bridge subvendor=0x0000 subdevice=0x0000
    cap 01[a0] = powerspec 3  supports D0 D3  current D0
    ecap 0000[100] = unknown 0
    ecap 000d[140] = ACS 1
    ecap 0000[150] = unknown 0
    ecap 001e[200] = L1 PM Substates 1
    ecap 0000[220] = unknown 0

pcib2@pci0:0:20:0:	class=0x060400 rev=0xf3 hdr=0x01 vendor=0x8086 device=0x31d6 subvendor=0x0000 subdevice=0x0000
    vendor     = 'Intel Corporation'
    device     = 'Gemini Lake PCI Express Root Port'
    class      = bridge
    subclass   = PCI-PCI
    cap 10[40] = PCI-Express 2 root port max data 256(256) ARI disabled
                 max read 128
                 link x1(x1) speed 2.5(5.0) ASPM L0s/L1(L0s/L1)
                 slot 0 power limit 100 mW
    cap 05[80] = MSI supports 1 message 
    cap 0d[90] = PCI Bridge subvendor=0x0000 subdevice=0x0000
    cap 01[a0] = powerspec 3  supports D0 D3  current D0
    ecap 0000[100] = unknown 0
    ecap 000d[140] = ACS 1
    ecap 0000[150] = unknown 0
    ecap 001e[200] = L1 PM Substates 1
    ecap 0000[220] = unknown 0

pcib3@pci0:0:20:1:	class=0x060400 rev=0xf3 hdr=0x01 vendor=0x8086 device=0x31d7 subvendor=0x0000 subdevice=0x0000
    vendor     = 'Intel Corporation'
    device     = 'Gemini Lake PCI Express Root Port'
    class      = bridge
    subclass   = PCI-PCI
    cap 10[40] = PCI-Express 2 root port max data 256(256) ARI disabled
                 max read 128
                 link x1(x1) speed 2.5(5.0) ASPM L1(L0s/L1)
                 slot 1 power limit 100 mW
    cap 05[80] = MSI supports 1 message 
    cap 0d[90] = PCI Bridge subvendor=0x0000 subdevice=0x0000
    cap 01[a0] = powerspec 3  supports D0 D3  current D0
    ecap 0000[100] = unknown 0
    ecap 000d[140] = ACS 1
    ecap 0000[150] = unknown 0
    ecap 001e[200] = L1 PM Substates 1
    ecap 0000[220] = unknown 0

xhci0@pci0:0:21:0:	class=0x0c0330 rev=0x03 hdr=0x00 vendor=0x8086 device=0x31a8 subvendor=0x17aa subdevice=0x3801
    vendor     = 'Intel Corporation'
    device     = 'Celeron/Pentium Silver Processor USB 3.0 xHCI Controller'
    class      = serial bus
    subclass   = USB
    bar   [10] = type Memory, range 64, base 0xa1300000, size 65536, enabled
    cap 01[70] = powerspec 2  supports D0 D3  current D0
    cap 05[80] = MSI supports 8 messages, 64 bit enabled with 1 message
    cap 09[90] = vendor (length 20) Intel cap 15 version 0

none3@pci0:0:23:0:	class=0x118000 rev=0x03 hdr=0x00 vendor=0x8086 device=0x31b4 subvendor=0x17aa subdevice=0x3807
    vendor     = 'Intel Corporation'
    class      = dasp
    bar   [10] = type Memory, range 64, base 0xa1318000, size 4096, enabled
    bar   [18] = type Memory, range 64, base 0xa1319000, size 4096, enabled
    cap 01[80] = powerspec 3  supports D0 D3  current D0
    cap 09[90] = vendor (length 20) Intel cap 15 version 0

sdhci_pci0@pci0:0:28:0:	class=0x080501 rev=0x03 hdr=0x00 vendor=0x8086 device=0x31cc subvendor=0x17aa subdevice=0x3807
    vendor     = 'Intel Corporation'
    device     = 'Celeron/Pentium Silver Processor SDA Standard Compliant SD Host Controller'
    class      = base peripheral
    subclass   = SD host controller
    bar   [10] = type Memory, range 64, base 0xa131a000, size 4096, enabled
    bar   [18] = type Memory, range 64, base 0xa131b000, size 4096, enabled
    cap 01[80] = powerspec 3  supports D0 D3  current D0
    cap 09[90] = vendor (length 20) Intel cap 15 version 0

isab0@pci0:0:31:0:	class=0x060100 rev=0x03 hdr=0x00 vendor=0x8086 device=0x31e8 subvendor=0x17aa subdevice=0x3802
    vendor     = 'Intel Corporation'
    device     = 'Celeron/Pentium Silver Processor LPC Controller'
    class      = bridge
    subclass   = PCI-ISA

none4@pci0:0:31:1:	class=0x0c0500 rev=0x03 hdr=0x00 vendor=0x8086 device=0x31d4 subvendor=0x0000 subdevice=0x0000
    vendor     = 'Intel Corporation'
    device     = 'Celeron/Pentium Silver Processor Gaussian Mixture Model'
    class      = serial bus
    subclass   = SMBus
    bar   [10] = type Memory, range 64, base 0xa131d000, size 256, enabled
    bar   [20] = type I/O Port, range 32, base 0x1040, size 32, enabled

rtsx0@pci0:2:0:0:	class=0xff0000 rev=0x01 hdr=0x00 vendor=0x10ec device=0x5229 subvendor=0x10ec subdevice=0x5229
    vendor     = 'Realtek Semiconductor Co., Ltd.'
    device     = 'RTS5229 PCI Express Card Reader'
    bar   [10] = type Memory, range 32, base 0xa1200000, size 4096, enabled
    cap 01[40] = powerspec 3  supports D0 D1 D2 D3  current D0
    cap 05[50] = MSI supports 1 message, 64 bit enabled with 1 message
    cap 10[70] = PCI-Express 2 endpoint max data 128(128) RO
                 max read 512
                 link x1(x1) speed 2.5(2.5) ASPM disabled(L0s/L1) ClockPM enabled
    ecap 0001[100] = AER 1 0 fatal 0 non-fatal 2 corrected
    ecap 0003[140] = Serial 1 00000001004ce000

iwm0@pci0:3:0:0:	class=0x028000 rev=0x99 hdr=0x00 vendor=0x8086 device=0x3166 subvendor=0x8086 subdevice=0x4210
    vendor     = 'Intel Corporation'
    device     = 'Dual Band Wireless-AC 3165 Plus Bluetooth'
    class      = network
    bar   [10] = type Memory, range 64, base 0xa1100000, size 8192, enabled
    cap 01[c8] = powerspec 3  supports D0 D3  current D0
    cap 05[d0] = MSI supports 1 message, 64 bit enabled with 1 message
    cap 10[40] = PCI-Express 2 endpoint max data 128(128) FLR RO NS
                 max read 128
                 link x1(x1) speed 2.5(2.5) ASPM L1(L1) ClockPM enabled
    ecap 0001[100] = AER 1 0 fatal 0 non-fatal 0 corrected
    ecap 0003[140] = Serial 1 48a472fffffcb813
    ecap 0018[14c] = LTR 1
    ecap 001e[154] = L1 PM Substates 1
