none0@pci0:0:0:0:	class=0x088000 rev=0x04 hdr=0x00 vendor=0x8086 device=0x09a2 subvendor=0x8086 subdevice=0x1999
    vendor     = 'Intel Corporation'
    class      = base peripheral
    cap 10[40] = PCI-Express 2 root endpoint max data 128(128)
                 max read 128

none1@pci0:0:0:1:	class=0x088000 rev=0x04 hdr=0x00 vendor=0x8086 device=0x09a4 subvendor=0x8086 subdevice=0x0000
    vendor     = 'Intel Corporation'
    class      = base peripheral
    cap 10[40] = PCI-Express 2 root endpoint max data 128(128)
                 max read 128

none2@pci0:0:0:2:	class=0x088000 rev=0x04 hdr=0x00 vendor=0x8086 device=0x09a3 subvendor=0x8086 subdevice=0x0000
    vendor     = 'Intel Corporation'
    class      = base peripheral
    cap 10[40] = PCI-Express 2 root endpoint max data 128(128)
                 max read 128

none3@pci0:0:0:3:	class=0x088000 rev=0x04 hdr=0x00 vendor=0x8086 device=0x09a5 subvendor=0x15d9 subdevice=0x0000
    vendor     = 'Intel Corporation'
    class      = base peripheral
    cap 10[40] = PCI-Express 2 root endpoint max data 128(128)
                 max read 128

hostb0@pci0:0:0:4:	class=0x060000 rev=0x00 hdr=0x00 vendor=0x8086 device=0x0998 subvendor=0x8086 subdevice=0x0000
    vendor     = 'Intel Corporation'
    class      = bridge
    subclass   = HOST-PCI
    cap 10[40] = PCI-Express 2 root endpoint max data 256(256)
                 max read 128

none4@pci0:0:1:0:	class=0x088000 rev=0x00 hdr=0x00 vendor=0x8086 device=0x0b00 subvendor=0x8086 subdevice=0x0000
    vendor     = 'Intel Corporation'
    class      = base peripheral
    bar   [10] = type Memory, range 64, base 0x23fffab0000, size 16384, enabled
    cap 10[40] = PCI-Express 2 root endpoint max data 512(512) FLR
                 max read 512
    cap 01[80] = powerspec 3  supports D0 D3  current D0
    cap 11[ac] = MSI-X supports 1 message
                 Table in map 0x10[0x2000], PBA in map 0x10[0x3000]
    ecap 0001[100] = AER 1 0 fatal 0 non-fatal 0 corrected
    ecap 0018[1d0] = LTR 1

none5@pci0:0:1:1:	class=0x088000 rev=0x00 hdr=0x00 vendor=0x8086 device=0x0b00 subvendor=0x8086 subdevice=0x0000
    vendor     = 'Intel Corporation'
    class      = base peripheral
    bar   [10] = type Memory, range 64, base 0x23fffaac000, size 16384, enabled
    cap 10[40] = PCI-Express 2 root endpoint max data 512(512) FLR
                 max read 512
    cap 01[80] = powerspec 3  supports D0 D3  current D0
    cap 11[ac] = MSI-X supports 1 message
                 Table in map 0x10[0x2000], PBA in map 0x10[0x3000]
    ecap 0001[100] = AER 1 0 fatal 0 non-fatal 0 corrected
    ecap 0018[1d0] = LTR 1

none6@pci0:0:1:2:	class=0x088000 rev=0x00 hdr=0x00 vendor=0x8086 device=0x0b00 subvendor=0x8086 subdevice=0x0000
    vendor     = 'Intel Corporation'
    class      = base peripheral
    bar   [10] = type Memory, range 64, base 0x23fffaa8000, size 16384, enabled
    cap 10[40] = PCI-Express 2 root endpoint max data 512(512) FLR
                 max read 512
    cap 01[80] = powerspec 3  supports D0 D3  current D0
    cap 11[ac] = MSI-X supports 1 message
                 Table in map 0x10[0x2000], PBA in map 0x10[0x3000]
    ecap 0001[100] = AER 1 0 fatal 0 non-fatal 0 corrected
    ecap 0018[1d0] = LTR 1

none7@pci0:0:1:3:	class=0x088000 rev=0x00 hdr=0x00 vendor=0x8086 device=0x0b00 subvendor=0x8086 subdevice=0x0000
    vendor     = 'Intel Corporation'
    class      = base peripheral
    bar   [10] = type Memory, range 64, base 0x23fffaa4000, size 16384, enabled
    cap 10[40] = PCI-Express 2 root endpoint max data 512(512) FLR
                 max read 512
    cap 01[80] = powerspec 3  supports D0 D3  current D0
    cap 11[ac] = MSI-X supports 1 message
                 Table in map 0x10[0x2000], PBA in map 0x10[0x3000]
    ecap 0001[100] = AER 1 0 fatal 0 non-fatal 0 corrected
    ecap 0018[1d0] = LTR 1

none8@pci0:0:1:4:	class=0x088000 rev=0x00 hdr=0x00 vendor=0x8086 device=0x0b00 subvendor=0x8086 subdevice=0x0000
    vendor     = 'Intel Corporation'
    class      = base peripheral
    bar   [10] = type Memory, range 64, base 0x23fffaa0000, size 16384, enabled
    cap 10[40] = PCI-Express 2 root endpoint max data 512(512) FLR
                 max read 512
    cap 01[80] = powerspec 3  supports D0 D3  current D0
    cap 11[ac] = MSI-X supports 1 message
                 Table in map 0x10[0x2000], PBA in map 0x10[0x3000]
    ecap 0001[100] = AER 1 0 fatal 0 non-fatal 0 corrected
    ecap 0018[1d0] = LTR 1

none9@pci0:0:1:5:	class=0x088000 rev=0x00 hdr=0x00 vendor=0x8086 device=0x0b00 subvendor=0x8086 subdevice=0x0000
    vendor     = 'Intel Corporation'
    class      = base peripheral
    bar   [10] = type Memory, range 64, base 0x23fffa9c000, size 16384, enabled
    cap 10[40] = PCI-Express 2 root endpoint max data 512(512) FLR
                 max read 512
    cap 01[80] = powerspec 3  supports D0 D3  current D0
    cap 11[ac] = MSI-X supports 1 message
                 Table in map 0x10[0x2000], PBA in map 0x10[0x3000]
    ecap 0001[100] = AER 1 0 fatal 0 non-fatal 0 corrected
    ecap 0018[1d0] = LTR 1

none10@pci0:0:1:6:	class=0x088000 rev=0x00 hdr=0x00 vendor=0x8086 device=0x0b00 subvendor=0x8086 subdevice=0x0000
    vendor     = 'Intel Corporation'
    class      = base peripheral
    bar   [10] = type Memory, range 64, base 0x23fffa98000, size 16384, enabled
    cap 10[40] = PCI-Express 2 root endpoint max data 512(512) FLR
                 max read 512
    cap 01[80] = powerspec 3  supports D0 D3  current D0
    cap 11[ac] = MSI-X supports 1 message
                 Table in map 0x10[0x2000], PBA in map 0x10[0x3000]
    ecap 0001[100] = AER 1 0 fatal 0 non-fatal 0 corrected
    ecap 0018[1d0] = LTR 1

none11@pci0:0:1:7:	class=0x088000 rev=0x00 hdr=0x00 vendor=0x8086 device=0x0b00 subvendor=0x8086 subdevice=0x0000
    vendor     = 'Intel Corporation'
    class      = base peripheral
    bar   [10] = type Memory, range 64, base 0x23fffa94000, size 16384, enabled
    cap 10[40] = PCI-Express 2 root endpoint max data 512(512) FLR
                 max read 512
    cap 01[80] = powerspec 3  supports D0 D3  current D0
    cap 11[ac] = MSI-X supports 1 message
                 Table in map 0x10[0x2000], PBA in map 0x10[0x3000]
    ecap 0001[100] = AER 1 0 fatal 0 non-fatal 0 corrected
    ecap 0018[1d0] = LTR 1

none12@pci0:0:2:0:	class=0x088000 rev=0x00 hdr=0x00 vendor=0x8086 device=0x09a6 subvendor=0x8086 subdevice=0x0000
    vendor     = 'Intel Corporation'
    class      = base peripheral
    bar   [10] = type Memory, range 32, base 0xa3882000, size 8192, enabled

none13@pci0:0:2:1:	class=0x088000 rev=0x00 hdr=0x00 vendor=0x8086 device=0x09a7 subvendor=0x8086 subdevice=0x0000
    vendor     = 'Intel Corporation'
    class      = base peripheral
    bar   [10] = type Memory, range 32, base 0xa3800000, size 524288, enabled
    bar   [14] = type Memory, range 32, base 0xa3780000, size 524288, enabled

none14@pci0:0:2:4:	class=0x130000 rev=0x01 hdr=0x00 vendor=0x8086 device=0x3456 subvendor=0x0000 subdevice=0x0000
    vendor     = 'Intel Corporation'
    class      = non-essential instrumentation
    bar   [10] = type Memory, range 64, base 0x23fff900000, size 1048576, enabled
    bar   [18] = type Memory, range 64, base 0x23fffa90000, size 16384, enabled
    bar   [20] = type Memory, range 64, base 0x23fffa60000, size 131072, enabled
    cap 00[40] = unknown

ahci0@pci0:0:8:0:	class=0x010601 rev=0x11 hdr=0x00 vendor=0x8086 device=0x18c2 subvendor=0x15d9 subdevice=0x1c4f
    vendor     = 'Intel Corporation'
    class      = mass storage
    subclass   = SATA
    bar   [10] = type Memory, range 32, base 0xa3880000, size 8192, enabled
    bar   [14] = type Memory, range 32, base 0xa3888000, size 256, enabled
    bar   [18] = type I/O Port, range 32, base 0x5080, size 8, enabled
    bar   [1c] = type I/O Port, range 32, base 0x5070, size 4, enabled
    bar   [20] = type I/O Port, range 32, base 0x5020, size 32, enabled
    bar   [24] = type Memory, range 32, base 0xa3887000, size 2048, enabled
    cap 05[80] = MSI supports 1 message enabled with 1 message
    cap 01[70] = powerspec 3  supports D0 D3  current D0
    cap 12[a8] = SATA Index-Data Pair

pcib1@pci0:0:11:0:	class=0x060400 rev=0x11 hdr=0x01 vendor=0x8086 device=0x18a6 subvendor=0x8086 subdevice=0x18a6
    vendor     = 'Intel Corporation'
    class      = bridge
    subclass   = PCI-PCI
    bar   [10] = type Memory, range 64, base 0x23fffa40000, size 131072, enabled
    cap 10[40] = PCI-Express 2 root port max data 256(256) ARI enabled
                 max read 128
                 link x4(x4) speed 8.0(8.0) ASPM disabled(L0s/L1)
                 slot 2 power limit 250 mW MRL(closed)
    cap 01[80] = powerspec 3  supports D0 D3  current D0
    cap 0d[88] = PCI Bridge subvendor=0x8086 subdevice=0x18a6
    cap 05[90] = MSI supports 1 message, vector masks 
    ecap 0001[100] = AER 1 0 fatal 0 non-fatal 0 corrected
    ecap 0002[280] = VC 1 max VC1
    ecap 000d[148] = ACS 1
    ecap 001f[1e0] = Precision Time Measurement 1
    ecap 0019[200] = PCIe Sec 1 lane errors 0
    ecap 001d[190] = Downstream Port Containment 1

none15@pci0:0:15:0:	class=0x088000 rev=0x11 hdr=0x00 vendor=0x8086 device=0x18ac subvendor=0x15d9 subdevice=0x1c4f
    vendor     = 'Intel Corporation'
    class      = base peripheral
    bar   [10] = type Memory, range 64, base 0x23fffabb000, size 1024, enabled
    cap 10[40] = PCI-Express 2 root endpoint max data 256(256)
                 max read 128
    cap 01[80] = powerspec 3  supports D0 D3  current D0
    cap 05[8c] = MSI supports 1 message, 64 bit, vector masks 
    ecap 0001[100] = AER 1 0 fatal 0 non-fatal 0 corrected

pcib2@pci0:0:20:0:	class=0x060400 rev=0x11 hdr=0x01 vendor=0x8086 device=0x18ad subvendor=0x15d9 subdevice=0x1c4f
    vendor     = 'Intel Corporation'
    class      = bridge
    subclass   = PCI-PCI
    bar   [10] = type Memory, range 64, base 0x23fffa20000, size 131072, enabled
    cap 10[40] = PCI-Express 2 root port max data 256(256) ARI enabled
                 max read 128
                 link x4(x4) speed 5.0(8.0) ASPM L1(L0s/L1)
                 slot 8 power limit 250 mW MRL(closed)
    cap 01[80] = powerspec 3  supports D0 D3  current D0
    cap 0d[88] = PCI Bridge subvendor=0x15d9 subdevice=0x1c4f
    cap 05[90] = MSI supports 1 message, vector masks 
    ecap 0001[100] = AER 1 0 fatal 0 non-fatal 0 corrected
    ecap 0002[280] = VC 1 max VC1
    ecap 000d[148] = ACS 1
    ecap 001f[1e0] = Precision Time Measurement 1
    ecap 0019[200] = PCIe Sec 1 lane errors 0
    ecap 001d[190] = Downstream Port Containment 1

pcib3@pci0:0:22:0:	class=0x060400 rev=0x11 hdr=0x01 vendor=0x8086 device=0x18af subvendor=0x8086 subdevice=0x0000
    vendor     = 'Intel Corporation'
    class      = bridge
    subclass   = PCI-PCI
    bar   [10] = type Memory, range 64, base 0x23fffa00000, size 131072, enabled
    cap 10[40] = PCI-Express 2 root port max data 256(256) ARI disabled
                 max read 128
                 link x1(x1) speed 5.0(8.0) ASPM disabled(L0s/L1)
                 slot 10 power limit 100 mW MRL(closed)
    cap 01[80] = powerspec 3  supports D0 D3  current D0
    cap 0d[88] = PCI Bridge subvendor=0x8086 subdevice=0x0000
    cap 05[90] = MSI supports 1 message, vector masks 
    ecap 0001[100] = AER 1 0 fatal 0 non-fatal 0 corrected
    ecap 0002[280] = VC 1 max VC1
    ecap 000d[148] = ACS 1
    ecap 001f[1e0] = Precision Time Measurement 1
    ecap 0019[200] = PCIe Sec 1 lane errors 0
    ecap 001d[190] = Downstream Port Containment 1

none16@pci0:0:24:0:	class=0x078000 rev=0x11 hdr=0x00 vendor=0x8086 device=0x18d3 subvendor=0x15d9 subdevice=0x1c4f
    vendor     = 'Intel Corporation'
    class      = simple comms
    bar   [10] = type Memory, range 64, base 0x23fffaba000, size 4096, enabled
    cap 01[50] = powerspec 3  supports D0 D3  current D0
    cap 05[8c] = MSI supports 1 message, 64 bit 
    cap 09[a4] = vendor (length 20) Intel cap 15 version 0

none17@pci0:0:24:1:	class=0x078000 rev=0x11 hdr=0x00 vendor=0x8086 device=0x18d4 subvendor=0x15d9 subdevice=0x1c4f
    vendor     = 'Intel Corporation'
    class      = simple comms
    bar   [10] = type Memory, range 64, base 0x23fffab9000, size 4096, enabled
    cap 01[50] = powerspec 3  supports D0 D3  current D0
    cap 05[8c] = MSI supports 1 message, 64 bit 
    cap 09[a4] = vendor (length 20) Intel cap 15 version 0

none18@pci0:0:24:4:	class=0x078000 rev=0x11 hdr=0x00 vendor=0x8086 device=0x18d6 subvendor=0x15d9 subdevice=0x1c4f
    vendor     = 'Intel Corporation'
    class      = simple comms
    bar   [10] = type Memory, range 64, base 0x23fffab8000, size 4096, enabled
    cap 01[50] = powerspec 3  supports D0 D3  current D0
    cap 05[8c] = MSI supports 1 message, 64 bit 
    cap 09[a4] = vendor (length 20) Intel cap 15 version 0

none19@pci0:0:26:0:	class=0x070002 rev=0x11 hdr=0x00 vendor=0x8086 device=0x18d8 subvendor=0x15d9 subdevice=0x1c4f
    vendor     = 'Intel Corporation'
    class      = simple comms
    subclass   = UART
    bar   [10] = type I/O Port, range 32, base 0x5060, size 8, enabled
    bar   [14] = type Memory, range 32, base 0xa3886000, size 256, enabled
    cap 05[40] = MSI supports 1 message 
    cap 01[50] = powerspec 3  supports D0 D3  current D0

none20@pci0:0:26:1:	class=0x070002 rev=0x11 hdr=0x00 vendor=0x8086 device=0x18d8 subvendor=0x15d9 subdevice=0x1c4f
    vendor     = 'Intel Corporation'
    class      = simple comms
    subclass   = UART
    bar   [10] = type I/O Port, range 32, base 0x5050, size 8, enabled
    bar   [14] = type Memory, range 32, base 0xa3885000, size 256, enabled
    cap 05[40] = MSI supports 1 message 
    cap 01[50] = powerspec 3  supports D0 D3  current D0

none21@pci0:0:26:2:	class=0x070002 rev=0x11 hdr=0x00 vendor=0x8086 device=0x18d8 subvendor=0x15d9 subdevice=0x1c4f
    vendor     = 'Intel Corporation'
    class      = simple comms
    subclass   = UART
    bar   [10] = type I/O Port, range 32, base 0x5040, size 8, enabled
    bar   [14] = type Memory, range 32, base 0xa3884000, size 256, enabled
    cap 05[40] = MSI supports 1 message 
    cap 01[50] = powerspec 3  supports D0 D3  current D0

none22@pci0:0:26:3:	class=0xff0000 rev=0x11 hdr=0x00 vendor=0x8086 device=0x18d9 subvendor=0x8086 subdevice=0x0000
    vendor     = 'Intel Corporation'
    cap 01[80] = powerspec 3  supports D0 D3  current D0

sdhci_pci0@pci0:0:28:0:	class=0x080501 rev=0x11 hdr=0x00 vendor=0x8086 device=0x18db subvendor=0x15d9 subdevice=0x1c4f
    vendor     = 'Intel Corporation'
    class      = base peripheral
    subclass   = SD host controller
    bar   [10] = type Memory, range 64, base 0x23fffab7000, size 4096, enabled
    cap 01[80] = powerspec 3  supports D0 D3  current D0
    cap 09[90] = vendor (length 20) Intel cap 15 version 0

hostb1@pci0:0:29:0:	class=0x060000 rev=0x00 hdr=0x00 vendor=0x8086 device=0x0998 subvendor=0x15d9 subdevice=0x1c4f
    vendor     = 'Intel Corporation'
    class      = bridge
    subclass   = HOST-PCI
    cap 10[40] = PCI-Express 2 root endpoint max data 256(256)
                 max read 128

xhci0@pci0:0:30:0:	class=0x0c0330 rev=0x11 hdr=0x00 vendor=0x8086 device=0x18d0 subvendor=0x15d9 subdevice=0x1c4f
    vendor     = 'Intel Corporation'
    class      = serial bus
    subclass   = USB
    bar   [10] = type Memory, range 64, base 0x23fffa80000, size 65536, enabled
    cap 01[70] = powerspec 2  supports D0 D3  current D0
    cap 05[80] = MSI supports 8 messages, 64 bit enabled with 1 message

isab0@pci0:0:31:0:	class=0x060100 rev=0x11 hdr=0x00 vendor=0x8086 device=0x18dc subvendor=0x15d9 subdevice=0x1c4f
    vendor     = 'Intel Corporation'
    class      = bridge
    subclass   = PCI-ISA

none23@pci0:0:31:4:	class=0x0c0500 rev=0x11 hdr=0x00 vendor=0x8086 device=0x18df subvendor=0x15d9 subdevice=0x1c4f
    vendor     = 'Intel Corporation'
    class      = serial bus
    subclass   = SMBus
    bar   [10] = type Memory, range 64, base 0x23fffab6000, size 256, enabled
    bar   [20] = type I/O Port, range 32, base 0x5000, size 32, enabled

none24@pci0:0:31:5:	class=0x0c8000 rev=0x11 hdr=0x00 vendor=0x8086 device=0x18e0 subvendor=0x15d9 subdevice=0x1c4f
    vendor     = 'Intel Corporation'
    class      = serial bus
    bar   [10] = type Memory, range 32, base 0xfe010000, size 4096, enabled

none25@pci0:0:31:7:	class=0x130000 rev=0x11 hdr=0x00 vendor=0x8086 device=0x18e1 subvendor=0x15d9 subdevice=0x1c4f
    vendor     = 'Intel Corporation'
    class      = non-essential instrumentation
    bar   [10] = type Memory, range 64, base 0x23fff800000, size 1048576, enabled
    bar   [18] = type Memory, range 64, base 0x23fff000000, size 8388608, enabled
    bar   [20] = type Memory, range 64, base 0x23fffab4000, size 8192, enabled
    cap 00[40] = unknown

ix0@pci0:1:0:0:	class=0x020000 rev=0x01 hdr=0x00 vendor=0x8086 device=0x1563 subvendor=0x15d9 subdevice=0x1563
    vendor     = 'Intel Corporation'
    device     = 'Ethernet Controller 10G X550T'
    class      = network
    subclass   = ethernet
    bar   [10] = type Prefetchable Memory, range 64, base 0xa1800000, size 4194304, enabled
    bar   [20] = type Prefetchable Memory, range 64, base 0xa1c04000, size 16384, enabled
    cap 01[40] = powerspec 3  supports D0 D3  current D0
    cap 05[50] = MSI supports 1 message, 64 bit, vector masks 
    cap 11[70] = MSI-X supports 64 messages, enabled
                 Table in map 0x20[0x0], PBA in map 0x20[0x2000]
    cap 10[a0] = PCI-Express 2 endpoint max data 256(512) FLR RO
                 max read 512
                 link x4(x4) speed 8.0(8.0)
    ecap 0001[100] = AER 2 0 fatal 1 non-fatal 1 corrected
    ecap 0003[140] = Serial 1 000000ffff000000
    ecap 000e[150] = ARI 1
    ecap 0010[160] = SR-IOV 1 IOV disabled, Memory Space disabled, ARI enabled
                     0 VFs configured out of 64 supported
                     First VF RID Offset 0x0080, VF RID Stride 0x0002
                     VF Device ID 0x1565
                     Page Sizes: 4096 (enabled), 8192, 65536, 262144, 1048576, 4194304
    ecap 0017[1a0] = TPH Requester 1
    ecap 000d[1b0] = ACS 1
    ecap 0018[1c0] = LTR 1
    ecap 0019[1d0] = PCIe Sec 1 lane errors 0

ix1@pci0:1:0:1:	class=0x020000 rev=0x01 hdr=0x00 vendor=0x8086 device=0x1563 subvendor=0x15d9 subdevice=0x1563
    vendor     = 'Intel Corporation'
    device     = 'Ethernet Controller 10G X550T'
    class      = network
    subclass   = ethernet
    bar   [10] = type Prefetchable Memory, range 64, base 0xa1400000, size 4194304, enabled
    bar   [20] = type Prefetchable Memory, range 64, base 0xa1c00000, size 16384, enabled
    cap 01[40] = powerspec 3  supports D0 D3  current D0
    cap 05[50] = MSI supports 1 message, 64 bit, vector masks 
    cap 11[70] = MSI-X supports 64 messages, enabled
                 Table in map 0x20[0x0], PBA in map 0x20[0x2000]
    cap 10[a0] = PCI-Express 2 endpoint max data 256(512) FLR RO
                 max read 512
                 link x4(x4) speed 8.0(8.0)
    ecap 0001[100] = AER 2 0 fatal 1 non-fatal 1 corrected
    ecap 0003[140] = Serial 1 000000ffff000000
    ecap 000e[150] = ARI 1
    ecap 0010[160] = SR-IOV 1 IOV disabled, Memory Space disabled, ARI disabled
                     0 VFs configured out of 64 supported
                     First VF RID Offset 0x0080, VF RID Stride 0x0002
                     VF Device ID 0x1565
                     Page Sizes: 4096 (enabled), 8192, 65536, 262144, 1048576, 4194304
    ecap 0017[1a0] = TPH Requester 1
    ecap 000d[1b0] = ACS 1

igb0@pci0:2:0:0:	class=0x020000 rev=0x01 hdr=0x00 vendor=0x8086 device=0x1521 subvendor=0x15d9 subdevice=0x1521
    vendor     = 'Intel Corporation'
    device     = 'I350 Gigabit Network Connection'
    class      = network
    subclass   = ethernet
    bar   [10] = type Memory, range 32, base 0xa3660000, size 131072, enabled
    bar   [18] = type I/O Port, range 32, base 0x4060, size 32, enabled
    bar   [1c] = type Memory, range 32, base 0xa368c000, size 16384, enabled
    cap 01[40] = powerspec 3  supports D0 D3  current D0
    cap 05[50] = MSI supports 1 message, 64 bit, vector masks 
    cap 11[70] = MSI-X supports 10 messages, enabled
                 Table in map 0x1c[0x0], PBA in map 0x1c[0x2000]
    cap 10[a0] = PCI-Express 2 endpoint max data 256(512) FLR RO NS
                 max read 512
                 link x4(x4) speed 5.0(5.0) ASPM L1(L0s/L1)
    ecap 0001[100] = AER 2 0 fatal 1 non-fatal 1 corrected
    ecap 0003[140] = Serial 1 3cecefffffd1113a
    ecap 000e[150] = ARI 1
    ecap 0010[160] = SR-IOV 1 IOV disabled, Memory Space disabled, ARI enabled
                     0 VFs configured out of 8 supported
                     First VF RID Offset 0x0080, VF RID Stride 0x0004
                     VF Device ID 0x1520
                     Page Sizes: 4096 (enabled), 8192, 65536, 262144, 1048576, 4194304
    ecap 0017[1a0] = TPH Requester 1
    ecap 0018[1c0] = LTR 1
    ecap 000d[1d0] = ACS 1

igb1@pci0:2:0:1:	class=0x020000 rev=0x01 hdr=0x00 vendor=0x8086 device=0x1521 subvendor=0x15d9 subdevice=0x1521
    vendor     = 'Intel Corporation'
    device     = 'I350 Gigabit Network Connection'
    class      = network
    subclass   = ethernet
    bar   [10] = type Memory, range 32, base 0xa3640000, size 131072, enabled
    bar   [18] = type I/O Port, range 32, base 0x4040, size 32, enabled
    bar   [1c] = type Memory, range 32, base 0xa3688000, size 16384, enabled
    cap 01[40] = powerspec 3  supports D0 D3  current D0
    cap 05[50] = MSI supports 1 message, 64 bit, vector masks 
    cap 11[70] = MSI-X supports 10 messages, enabled
                 Table in map 0x1c[0x0], PBA in map 0x1c[0x2000]
    cap 10[a0] = PCI-Express 2 endpoint max data 256(512) FLR RO NS
                 max read 512
                 link x4(x4) speed 5.0(5.0) ASPM L1(L0s/L1)
    ecap 0001[100] = AER 2 0 fatal 1 non-fatal 1 corrected
    ecap 0003[140] = Serial 1 3cecefffffd1113a
    ecap 000e[150] = ARI 1
    ecap 0010[160] = SR-IOV 1 IOV disabled, Memory Space disabled, ARI disabled
                     0 VFs configured out of 8 supported
                     First VF RID Offset 0x0080, VF RID Stride 0x0004
                     VF Device ID 0x1520
                     Page Sizes: 4096 (enabled), 8192, 65536, 262144, 1048576, 4194304
    ecap 0017[1a0] = TPH Requester 1
    ecap 000d[1d0] = ACS 1

igb2@pci0:2:0:2:	class=0x020000 rev=0x01 hdr=0x00 vendor=0x8086 device=0x1521 subvendor=0x15d9 subdevice=0x1521
    vendor     = 'Intel Corporation'
    device     = 'I350 Gigabit Network Connection'
    class      = network
    subclass   = ethernet
    bar   [10] = type Memory, range 32, base 0xa3620000, size 131072, enabled
    bar   [18] = type I/O Port, range 32, base 0x4020, size 32, enabled
    bar   [1c] = type Memory, range 32, base 0xa3684000, size 16384, enabled
    cap 01[40] = powerspec 3  supports D0 D3  current D0
    cap 05[50] = MSI supports 1 message, 64 bit, vector masks 
    cap 11[70] = MSI-X supports 10 messages, enabled
                 Table in map 0x1c[0x0], PBA in map 0x1c[0x2000]
    cap 10[a0] = PCI-Express 2 endpoint max data 256(512) FLR RO NS
                 max read 512
                 link x4(x4) speed 5.0(5.0) ASPM L1(L0s/L1)
    ecap 0001[100] = AER 2 0 fatal 1 non-fatal 1 corrected
    ecap 0003[140] = Serial 1 3cecefffffd1113a
    ecap 000e[150] = ARI 1
    ecap 0010[160] = SR-IOV 1 IOV disabled, Memory Space disabled, ARI disabled
                     0 VFs configured out of 8 supported
                     First VF RID Offset 0x0080, VF RID Stride 0x0004
                     VF Device ID 0x1520
                     Page Sizes: 4096 (enabled), 8192, 65536, 262144, 1048576, 4194304
    ecap 0017[1a0] = TPH Requester 1
    ecap 000d[1d0] = ACS 1

igb3@pci0:2:0:3:	class=0x020000 rev=0x01 hdr=0x00 vendor=0x8086 device=0x1521 subvendor=0x15d9 subdevice=0x1521
    vendor     = 'Intel Corporation'
    device     = 'I350 Gigabit Network Connection'
    class      = network
    subclass   = ethernet
    bar   [10] = type Memory, range 32, base 0xa3600000, size 131072, enabled
    bar   [18] = type I/O Port, range 32, base 0x4000, size 32, enabled
    bar   [1c] = type Memory, range 32, base 0xa3680000, size 16384, enabled
    cap 01[40] = powerspec 3  supports D0 D3  current D0
    cap 05[50] = MSI supports 1 message, 64 bit, vector masks 
    cap 11[70] = MSI-X supports 10 messages, enabled
                 Table in map 0x1c[0x0], PBA in map 0x1c[0x2000]
    cap 10[a0] = PCI-Express 2 endpoint max data 256(512) FLR RO NS
                 max read 512
                 link x4(x4) speed 5.0(5.0) ASPM L1(L0s/L1)
    ecap 0001[100] = AER 2 0 fatal 1 non-fatal 1 corrected
    ecap 0003[140] = Serial 1 3cecefffffd1113a
    ecap 000e[150] = ARI 1
    ecap 0010[160] = SR-IOV 1 IOV disabled, Memory Space disabled, ARI disabled
                     0 VFs configured out of 8 supported
                     First VF RID Offset 0x0080, VF RID Stride 0x0004
                     VF Device ID 0x1520
                     Page Sizes: 4096 (enabled), 8192, 65536, 262144, 1048576, 4194304
    ecap 0017[1a0] = TPH Requester 1
    ecap 000d[1d0] = ACS 1

pcib4@pci0:3:0:0:	class=0x060400 rev=0x06 hdr=0x01 vendor=0x1a03 device=0x1150 subvendor=0x15d9 subdevice=0x1c4f
    vendor     = 'ASPEED Technology, Inc.'
    device     = 'AST1150 PCI-to-PCI Bridge'
    class      = bridge
    subclass   = PCI-PCI
    cap 05[50] = MSI supports 32 messages, 64 bit 
    cap 01[78] = powerspec 3  supports D0 D1 D2 D3  current D0
    cap 10[80] = PCI-Express 2 PCI bridge max data 256(512) RO NS
                 max read 512
                 link x1(x1) speed 5.0(5.0) ASPM disabled(L0s/L1)
    cap 0d[c0] = PCI Bridge subvendor=0x15d9 subdevice=0x1c4f
    ecap 0002[100] = VC 1 max VC0
    ecap 0023[200] = Designated Vendor-Specific 1
    ecap 0023[2c0] = Designated Vendor-Specific 1
    ecap 0001[800] = AER 1 0 fatal 1 non-fatal 1 corrected

vgapci0@pci0:4:0:0:	class=0x030000 rev=0x52 hdr=0x00 vendor=0x1a03 device=0x2000 subvendor=0x15d9 subdevice=0x1c4f
    vendor     = 'ASPEED Technology, Inc.'
    device     = 'ASPEED Graphics Family'
    class      = display
    subclass   = VGA
    bar   [10] = type Memory, range 32, base 0xa2000000, size 16777216, enabled
    bar   [14] = type Memory, range 32, base 0xa3000000, size 262144, enabled
    bar   [18] = type I/O Port, range 32, base 0x3000, size 128, enabled
    cap 01[40] = powerspec 3  supports D0 D1 D2 D3  current D0
    cap 05[50] = MSI supports 4 messages, 64 bit 

none26@pci0:21:0:0:	class=0x088000 rev=0x04 hdr=0x00 vendor=0x8086 device=0x09a2 subvendor=0x8086 subdevice=0x0000
    vendor     = 'Intel Corporation'
    class      = base peripheral
    cap 10[40] = PCI-Express 2 root endpoint max data 128(128)
                 max read 128

none27@pci0:21:0:1:	class=0x088000 rev=0x04 hdr=0x00 vendor=0x8086 device=0x09a4 subvendor=0x8086 subdevice=0x0000
    vendor     = 'Intel Corporation'
    class      = base peripheral
    cap 10[40] = PCI-Express 2 root endpoint max data 128(128)
                 max read 128

none28@pci0:21:0:2:	class=0x088000 rev=0x04 hdr=0x00 vendor=0x8086 device=0x09a3 subvendor=0x8086 subdevice=0x0000
    vendor     = 'Intel Corporation'
    class      = base peripheral
    cap 10[40] = PCI-Express 2 root endpoint max data 128(128)
                 max read 128

none29@pci0:21:0:3:	class=0x088000 rev=0x04 hdr=0x00 vendor=0x8086 device=0x09a5 subvendor=0x15d9 subdevice=0x0000
    vendor     = 'Intel Corporation'
    class      = base peripheral
    cap 10[40] = PCI-Express 2 root endpoint max data 128(128)
                 max read 128

hostb2@pci0:21:0:4:	class=0x060000 rev=0x00 hdr=0x00 vendor=0x8086 device=0x0998 subvendor=0x8086 subdevice=0x0000
    vendor     = 'Intel Corporation'
    class      = bridge
    subclass   = HOST-PCI
    cap 10[40] = PCI-Express 2 root endpoint max data 256(256)
                 max read 128

pcib6@pci0:21:2:0:	class=0x060400 rev=0x06 hdr=0x01 vendor=0x8086 device=0x347a subvendor=0x15d9 subdevice=0x1c4f
    vendor     = 'Intel Corporation'
    class      = bridge
    subclass   = PCI-PCI
    bar   [10] = type Memory, range 64, base 0x27ffff00000, size 131072, enabled
    cap 10[40] = PCI-Express 2 root port max data 512(512) ARI enabled
                 max read 128
                 link x2(x16) speed 8.0(16.0)
    cap 01[80] = powerspec 3  supports D0 D3  current D0
    cap 0d[88] = PCI Bridge subvendor=0x15d9 subdevice=0x1c4f
    cap 05[90] = MSI supports 1 message 
    ecap 0001[100] = AER 1 0 fatal 0 non-fatal 0 corrected
    ecap 000d[148] = ACS 1
    ecap 000b[180] = Vendor [1] ID 0003 Rev 0 Length 10
    ecap 001d[190] = Downstream Port Containment 1
    ecap 001f[1e0] = Precision Time Measurement 2
    ecap 0019[200] = PCIe Sec 1 lane errors 0
    ecap 0025[400] = Data Link Feature 1
    ecap 0026[410] = Physical Layer 16.0 GT/s 1
    ecap 0027[450] = Lane Margining at Receiver 1

t5iov0@pci0:22:0:0:	class=0x020000 rev=0x00 hdr=0x00 vendor=0x1425 device=0x5003 subvendor=0x1425 subdevice=0x0000
    vendor     = 'Chelsio Communications Inc'
    device     = 'T540-CR Unified Wire Ethernet Controller'
    class      = network
    subclass   = ethernet
    bar   [10] = type Memory, range 64, base 0xb8900000, size 524288, enabled
    bar   [18] = type Memory, range 64, base 0xb8880000, size 524288, enabled
    bar   [20] = type Memory, range 64, base 0xb8c0c000, size 8192, enabled
    cap 01[40] = powerspec 3  supports D0 D3  current D0
    cap 05[50] = MSI supports 8 messages, 64 bit, vector masks 
    cap 10[70] = PCI-Express 2 endpoint max data 512(2048) FLR RO
                 max read 512
                 link x2(x8) speed 8.0(8.0)
    cap 11[b0] = MSI-X supports 34 messages
                 Table in map 0x20[0x0], PBA in map 0x20[0x1000]
    cap 03[d0] = VPD
    ecap 0001[100] = AER 2 0 fatal 1 non-fatal 1 corrected
    ecap 0002[140] = VC 1 max VC1
    ecap 0003[170] = Serial 1 0000000000000000
    ecap 000e[190] = ARI 1
    ecap 0019[1a0] = PCIe Sec 1 lane errors 0
    ecap 0010[1c0] = SR-IOV 1 IOV disabled, Memory Space disabled, ARI enabled
                     0 VFs configured out of 16 supported
                     First VF RID Offset 0x0008, VF RID Stride 0x0004
                     VF Device ID 0x5803
                     Page Sizes: 4096 (enabled), 8192, 65536, 262144, 1048576, 4194304
    ecap 0017[200] = TPH Requester 1

t5iov1@pci0:22:0:1:	class=0x020000 rev=0x00 hdr=0x00 vendor=0x1425 device=0x5003 subvendor=0x1425 subdevice=0x0000
    vendor     = 'Chelsio Communications Inc'
    device     = 'T540-CR Unified Wire Ethernet Controller'
    class      = network
    subclass   = ethernet
    bar   [10] = type Memory, range 64, base 0xb8780000, size 524288, enabled
    bar   [18] = type Memory, range 64, base 0xb8700000, size 524288, enabled
    bar   [20] = type Memory, range 64, base 0xb8c0a000, size 8192, enabled
    cap 01[40] = powerspec 3  supports D0 D3  current D0
    cap 05[50] = MSI supports 8 messages, 64 bit, vector masks 
    cap 10[70] = PCI-Express 2 endpoint max data 512(2048) FLR RO
                 max read 512
                 link x2(x8) speed 8.0(8.0)
    cap 11[b0] = MSI-X supports 34 messages
                 Table in map 0x20[0x0], PBA in map 0x20[0x1000]
    cap 03[d0] = VPD
    ecap 0001[100] = AER 2 0 fatal 1 non-fatal 1 corrected
    ecap 0003[170] = Serial 1 0000000000000000
    ecap 000e[190] = ARI 1
    ecap 0019[1a0] = PCIe Sec 1 lane errors 0
    ecap 0010[1c0] = SR-IOV 1 IOV disabled, Memory Space disabled, ARI disabled
                     0 VFs configured out of 16 supported
                     First VF RID Offset 0x0008, VF RID Stride 0x0004
                     VF Device ID 0x5803
                     Page Sizes: 4096 (enabled), 8192, 65536, 262144, 1048576, 4194304
    ecap 0017[200] = TPH Requester 1

t5iov2@pci0:22:0:2:	class=0x020000 rev=0x00 hdr=0x00 vendor=0x1425 device=0x5003 subvendor=0x1425 subdevice=0x0000
    vendor     = 'Chelsio Communications Inc'
    device     = 'T540-CR Unified Wire Ethernet Controller'
    class      = network
    subclass   = ethernet
    bar   [10] = type Memory, range 64, base 0xb8600000, size 524288, enabled
    bar   [18] = type Memory, range 64, base 0xb8580000, size 524288, enabled
    bar   [20] = type Memory, range 64, base 0xb8c08000, size 8192, enabled
    cap 01[40] = powerspec 3  supports D0 D3  current D0
    cap 05[50] = MSI supports 8 messages, 64 bit, vector masks 
    cap 10[70] = PCI-Express 2 endpoint max data 512(2048) FLR RO
                 max read 512
                 link x2(x8) speed 8.0(8.0)
    cap 11[b0] = MSI-X supports 34 messages
                 Table in map 0x20[0x0], PBA in map 0x20[0x1000]
    cap 03[d0] = VPD
    ecap 0001[100] = AER 2 0 fatal 1 non-fatal 1 corrected
    ecap 0003[170] = Serial 1 0000000000000000
    ecap 000e[190] = ARI 1
    ecap 0019[1a0] = PCIe Sec 1 lane errors 0
    ecap 0010[1c0] = SR-IOV 1 IOV disabled, Memory Space disabled, ARI disabled
                     0 VFs configured out of 16 supported
                     First VF RID Offset 0x0008, VF RID Stride 0x0004
                     VF Device ID 0x5803
                     Page Sizes: 4096 (enabled), 8192, 65536, 262144, 1048576, 4194304
    ecap 0017[200] = TPH Requester 1

t5iov3@pci0:22:0:3:	class=0x020000 rev=0x00 hdr=0x00 vendor=0x1425 device=0x5003 subvendor=0x1425 subdevice=0x0000
    vendor     = 'Chelsio Communications Inc'
    device     = 'T540-CR Unified Wire Ethernet Controller'
    class      = network
    subclass   = ethernet
    bar   [10] = type Memory, range 64, base 0xb8480000, size 524288, enabled
    bar   [18] = type Memory, range 64, base 0xb8400000, size 524288, enabled
    bar   [20] = type Memory, range 64, base 0xb8c06000, size 8192, enabled
    cap 01[40] = powerspec 3  supports D0 D3  current D0
    cap 05[50] = MSI supports 8 messages, 64 bit, vector masks 
    cap 10[70] = PCI-Express 2 endpoint max data 512(2048) FLR RO
                 max read 512
                 link x2(x8) speed 8.0(8.0)
    cap 11[b0] = MSI-X supports 34 messages
                 Table in map 0x20[0x0], PBA in map 0x20[0x1000]
    cap 03[d0] = VPD
    ecap 0001[100] = AER 2 0 fatal 1 non-fatal 1 corrected
    ecap 0003[170] = Serial 1 0000000000000000
    ecap 000e[190] = ARI 1
    ecap 0019[1a0] = PCIe Sec 1 lane errors 0
    ecap 0010[1c0] = SR-IOV 1 IOV disabled, Memory Space disabled, ARI disabled
                     0 VFs configured out of 16 supported
                     First VF RID Offset 0x0008, VF RID Stride 0x0004
                     VF Device ID 0x5803
                     Page Sizes: 4096 (enabled), 8192, 65536, 262144, 1048576, 4194304
    ecap 0017[200] = TPH Requester 1

t5nex0@pci0:22:0:4:	class=0x020000 rev=0x00 hdr=0x00 vendor=0x1425 device=0x5403 subvendor=0x1425 subdevice=0x0000
    vendor     = 'Chelsio Communications Inc'
    device     = 'T540-CR Unified Wire Ethernet Controller'
    class      = network
    subclass   = ethernet
    bar   [10] = type Memory, range 64, base 0xb8300000, size 524288, enabled
    bar   [18] = type Memory, range 64, base 0xb7000000, size 16777216, enabled
    bar   [20] = type Memory, range 64, base 0xb8c04000, size 8192, enabled
    cap 01[40] = powerspec 3  supports D0 D3  current D0
    cap 05[50] = MSI supports 32 messages, 64 bit, vector masks 
    cap 10[70] = PCI-Express 2 endpoint max data 512(2048) FLR
                 max read 4096
                 link x2(x8) speed 8.0(8.0)
    cap 11[b0] = MSI-X supports 256 messages, enabled
                 Table in map 0x20[0x0], PBA in map 0x20[0x1000]
    cap 03[d0] = VPD
    ecap 0001[100] = AER 2 0 fatal 1 non-fatal 1 corrected
    ecap 0003[170] = Serial 1 0000000000000000
    ecap 000e[190] = ARI 1
    ecap 0019[1a0] = PCIe Sec 1 lane errors 0
    ecap 0010[1c0] = SR-IOV 1 IOV disabled, Memory Space disabled, ARI disabled
                     0 VFs configured out of 0 supported
                     First VF RID Offset 0x0008, VF RID Stride 0x0004
                     VF Device ID 0x5803
                     Page Sizes: 4096 (enabled), 8192, 65536, 262144, 1048576, 4194304
    ecap 0017[200] = TPH Requester 1

none30@pci0:22:0:5:	class=0x010000 rev=0x00 hdr=0x00 vendor=0x1425 device=0x5503 subvendor=0x1425 subdevice=0x0000
    vendor     = 'Chelsio Communications Inc'
    device     = 'T540-CR Unified Wire Storage Controller'
    class      = mass storage
    subclass   = SCSI
    bar   [10] = type Memory, range 64, base 0xb8280000, size 524288, enabled
    bar   [18] = type Memory, range 64, base 0xb8200000, size 524288, enabled
    bar   [20] = type Memory, range 64, base 0xb8c02000, size 8192, enabled
    cap 01[40] = powerspec 3  supports D0 D3  current D0
    cap 05[50] = MSI supports 32 messages, 64 bit, vector masks 
    cap 10[70] = PCI-Express 2 endpoint max data 512(2048) FLR RO
                 max read 512
                 link x2(x8) speed 8.0(8.0)
    cap 11[b0] = MSI-X supports 40 messages
                 Table in map 0x20[0x0], PBA in map 0x20[0x1000]
    cap 03[d0] = VPD
    ecap 0001[100] = AER 2 0 fatal 1 non-fatal 1 corrected
    ecap 0003[170] = Serial 1 0000000000000000
    ecap 000e[190] = ARI 1
    ecap 0019[1a0] = PCIe Sec 1 lane errors 0
    ecap 0010[1c0] = SR-IOV 1 IOV disabled, Memory Space disabled, ARI disabled
                     0 VFs configured out of 0 supported
                     First VF RID Offset 0x0008, VF RID Stride 0x0004
                     VF Device ID 0x5803
                     Page Sizes: 4096 (enabled), 8192, 65536, 262144, 1048576, 4194304
    ecap 0017[200] = TPH Requester 1

none31@pci0:22:0:6:	class=0x0c0400 rev=0x00 hdr=0x00 vendor=0x1425 device=0x5603 subvendor=0x1425 subdevice=0x0000
    vendor     = 'Chelsio Communications Inc'
    device     = 'T540-CR Unified Wire Storage Controller'
    class      = serial bus
    subclass   = Fibre Channel
    bar   [10] = type Memory, range 64, base 0xb8100000, size 524288, enabled
    bar   [18] = type Memory, range 64, base 0xb8080000, size 524288, enabled
    bar   [20] = type Memory, range 64, base 0xb8c00000, size 8192, enabled
    cap 01[40] = powerspec 3  supports D0 D3  current D0
    cap 05[50] = MSI supports 32 messages, 64 bit, vector masks 
    cap 10[70] = PCI-Express 2 endpoint max data 512(2048) FLR RO
                 max read 512
                 link x2(x8) speed 8.0(8.0)
    cap 11[b0] = MSI-X supports 40 messages
                 Table in map 0x20[0x0], PBA in map 0x20[0x1000]
    cap 03[d0] = VPD
    ecap 0001[100] = AER 2 0 fatal 1 non-fatal 1 corrected
    ecap 0003[170] = Serial 1 0000000000000000
    ecap 000e[190] = ARI 1
    ecap 0019[1a0] = PCIe Sec 1 lane errors 0
    ecap 0010[1c0] = SR-IOV 1 IOV disabled, Memory Space disabled, ARI disabled
                     0 VFs configured out of 0 supported
                     First VF RID Offset 0x0008, VF RID Stride 0x0004
                     VF Device ID 0x5803
                     Page Sizes: 4096 (enabled), 8192, 65536, 262144, 1048576, 4194304
    ecap 0017[200] = TPH Requester 1

none32@pci0:128:0:0:	class=0x088000 rev=0x04 hdr=0x00 vendor=0x8086 device=0x09a2 subvendor=0x8086 subdevice=0x0000
    vendor     = 'Intel Corporation'
    class      = base peripheral
    cap 10[40] = PCI-Express 2 root endpoint max data 128(128)
                 max read 128

none33@pci0:128:0:1:	class=0x088000 rev=0x04 hdr=0x00 vendor=0x8086 device=0x09a4 subvendor=0x8086 subdevice=0x0000
    vendor     = 'Intel Corporation'
    class      = base peripheral
    cap 10[40] = PCI-Express 2 root endpoint max data 128(128)
                 max read 128

none34@pci0:128:0:2:	class=0x088000 rev=0x04 hdr=0x00 vendor=0x8086 device=0x09a3 subvendor=0x8086 subdevice=0x0000
    vendor     = 'Intel Corporation'
    class      = base peripheral
    cap 10[40] = PCI-Express 2 root endpoint max data 128(128)
                 max read 128

none35@pci0:128:0:3:	class=0x088000 rev=0x04 hdr=0x00 vendor=0x8086 device=0x09a5 subvendor=0x15d9 subdevice=0x0000
    vendor     = 'Intel Corporation'
    class      = base peripheral
    cap 10[40] = PCI-Express 2 root endpoint max data 128(128)
                 max read 128

hostb3@pci0:128:0:4:	class=0x060000 rev=0x00 hdr=0x00 vendor=0x8086 device=0x0998 subvendor=0x8086 subdevice=0x0000
    vendor     = 'Intel Corporation'
    class      = bridge
    subclass   = HOST-PCI
    cap 10[40] = PCI-Express 2 root endpoint max data 256(256)
                 max read 128

pcib8@pci0:128:5:0:	class=0x060400 rev=0x00 hdr=0x01 vendor=0x8086 device=0x18da subvendor=0x8086 subdevice=0x0000
    vendor     = 'Intel Corporation'
    class      = bridge
    subclass   = PCI-PCI
    cap 10[40] = PCI-Express 2 root port max data 256(256) ARI enabled
                 max read 128
                 link x1(x1) speed 2.5(2.5) ASPM disabled(L0s/L1)
    cap 01[80] = powerspec 3  supports D0 D3  current D0
    cap 0d[88] = PCI Bridge subvendor=0x8086 subdevice=0x0000
    cap 05[90] = MSI supports 1 message, vector masks 
    ecap 0001[100] = AER 1 0 fatal 0 non-fatal 0 corrected
    ecap 000d[148] = ACS 1

none36@pci0:129:0:0:	class=0x0b4000 rev=0x00 hdr=0x00 vendor=0x8086 device=0x18a0 subvendor=0x8086 subdevice=0x0000
    vendor     = 'Intel Corporation'
    device     = 'C4xxx Series QAT'
    class      = processor
    bar   [10] = type Prefetchable Memory, range 64, base 0x2bfff800000, size 8388608, enabled
    bar   [18] = type Memory, range 64, base 0xcf100000, size 524288, enabled
    bar   [20] = type Memory, range 64, base 0xcf000000, size 1048576, enabled
    cap 05[b0] = MSI supports 1 message, 64 bit, vector masks 
    cap 11[60] = MSI-X supports 129 messages
                 Table in map 0x18[0x63000], PBA in map 0x18[0x64000]
    cap 01[6c] = powerspec 3  supports D0 D3  current D0
    cap 10[74] = PCI-Express 2 endpoint max data 256(256) FLR RO NS
                 max read 1024
                 link x1(x1) speed 2.5(2.5) ASPM disabled(L0s/L1)
    ecap 0001[100] = AER 1 0 fatal 1 non-fatal 1 corrected
    ecap 000e[138] = ARI 1
    ecap 0010[140] = SR-IOV 1 IOV disabled, Memory Space disabled, ARI enabled
                     0 VFs configured out of 128 supported
                     First VF RID Offset 0x0001, VF RID Stride 0x0001
                     VF Device ID 0x18a1
                     Page Sizes: 4096 (enabled), 8192, 65536, 262144, 1048576, 4194304
    ecap 000d[1b0] = ACS 1

none37@pci0:136:0:0:	class=0x088000 rev=0x04 hdr=0x00 vendor=0x8086 device=0x09a2 subvendor=0x8086 subdevice=0x0000
    vendor     = 'Intel Corporation'
    class      = base peripheral
    cap 10[40] = PCI-Express 2 root endpoint max data 128(128)
                 max read 128

none38@pci0:136:0:1:	class=0x088000 rev=0x04 hdr=0x00 vendor=0x8086 device=0x09a4 subvendor=0x8086 subdevice=0x0000
    vendor     = 'Intel Corporation'
    class      = base peripheral
    cap 10[40] = PCI-Express 2 root endpoint max data 128(128)
                 max read 128

none39@pci0:136:0:2:	class=0x088000 rev=0x04 hdr=0x00 vendor=0x8086 device=0x09a3 subvendor=0x8086 subdevice=0x0000
    vendor     = 'Intel Corporation'
    class      = base peripheral
    cap 10[40] = PCI-Express 2 root endpoint max data 128(128)
                 max read 128

none40@pci0:136:0:3:	class=0x088000 rev=0x04 hdr=0x00 vendor=0x8086 device=0x09a5 subvendor=0x15d9 subdevice=0x0000
    vendor     = 'Intel Corporation'
    class      = base peripheral
    cap 10[40] = PCI-Express 2 root endpoint max data 128(128)
                 max read 128

hostb4@pci0:136:0:4:	class=0x060000 rev=0x00 hdr=0x00 vendor=0x8086 device=0x0998 subvendor=0x8086 subdevice=0x0000
    vendor     = 'Intel Corporation'
    class      = bridge
    subclass   = HOST-PCI
    cap 10[40] = PCI-Express 2 root endpoint max data 256(256)
                 max read 128

pcib10@pci0:136:4:0:	class=0x060400 rev=0x00 hdr=0x01 vendor=0x8086 device=0x18d1 subvendor=0x8086 subdevice=0x0000
    vendor     = 'Intel Corporation'
    class      = bridge
    subclass   = PCI-PCI
    cap 10[40] = PCI-Express 2 root port max data 256(256) ARI enabled
                 max read 128
                 link x1(x1) speed 2.5(2.5) ASPM disabled(L0s/L1)
    cap 01[80] = powerspec 3  supports D0 D3  current D0
    cap 0d[88] = PCI Bridge subvendor=0x8086 subdevice=0x0000
    cap 05[90] = MSI supports 1 message, vector masks 
    ecap 0001[100] = AER 1 0 fatal 0 non-fatal 0 corrected
    ecap 000d[148] = ACS 1

ice0@pci0:137:0:0:	class=0x020000 rev=0x00 hdr=0x00 vendor=0x8086 device=0x188c subvendor=0x8086 subdevice=0x0000
    vendor     = 'Intel Corporation'
    class      = network
    subclass   = ethernet
    bar   [10] = type Prefetchable Memory, range 64, base 0xd8000000, size 134217728, enabled
    bar   [1c] = type Prefetchable Memory, range 64, base 0xe2010000, size 65536, enabled
    cap 01[40] = powerspec 3  supports D0 D3  current D0
    cap 05[50] = MSI supports 1 message, 64 bit, vector masks 
    cap 11[70] = MSI-X supports 512 messages, enabled
                 Table in map 0x1c[0x0], PBA in map 0x1c[0x8000]
    cap 10[a0] = PCI-Express 2 endpoint max data 256(256) FLR RO
                 max read 512
                 link x1(x1) speed 2.5(2.5) ASPM disabled(L0s/L1)
    cap 03[e0] = VPD
    ecap 0001[100] = AER 2 0 fatal 1 non-fatal 1 corrected
    ecap 000e[148] = ARI 1
    ecap 0010[160] = SR-IOV 1 IOV disabled, Memory Space disabled, ARI enabled
                     0 VFs configured out of 64 supported
                     First VF RID Offset 0x0008, VF RID Stride 0x0001
                     VF Device ID 0x1889
                     Page Sizes: 4096 (enabled), 8192, 65536, 262144, 1048576, 4194304
    ecap 0017[1a0] = TPH Requester 1
    ecap 000d[1b0] = ACS 1

ice1@pci0:137:0:2:	class=0x020000 rev=0x00 hdr=0x00 vendor=0x8086 device=0x188c subvendor=0x8086 subdevice=0x0000
    vendor     = 'Intel Corporation'
    class      = network
    subclass   = ethernet
    bar   [10] = type Prefetchable Memory, range 64, base 0xd0000000, size 134217728, enabled
    bar   [1c] = type Prefetchable Memory, range 64, base 0xe2000000, size 65536, enabled
    cap 01[40] = powerspec 3  supports D0 D3  current D0
    cap 05[50] = MSI supports 1 message, 64 bit, vector masks 
    cap 11[70] = MSI-X supports 512 messages, enabled
                 Table in map 0x1c[0x0], PBA in map 0x1c[0x8000]
    cap 10[a0] = PCI-Express 2 endpoint max data 256(256) FLR RO
                 max read 512
                 link x1(x1) speed 2.5(2.5) ASPM disabled(L0s/L1)
    cap 03[e0] = VPD
    ecap 0001[100] = AER 2 0 fatal 1 non-fatal 1 corrected
    ecap 000e[148] = ARI 1
    ecap 0010[160] = SR-IOV 1 IOV disabled, Memory Space disabled, ARI disabled
                     0 VFs configured out of 64 supported
                     First VF RID Offset 0x0086, VF RID Stride 0x0001
                     VF Device ID 0x1889
                     Page Sizes: 4096 (enabled), 8192, 65536, 262144, 1048576, 4194304
    ecap 0017[1a0] = TPH Requester 1
    ecap 000d[1b0] = ACS 1

none41@pci0:144:0:0:	class=0x088000 rev=0x04 hdr=0x00 vendor=0x8086 device=0x09a2 subvendor=0x8086 subdevice=0x0000
    vendor     = 'Intel Corporation'
    class      = base peripheral
    cap 10[40] = PCI-Express 2 root endpoint max data 128(128)
                 max read 128

none42@pci0:144:0:1:	class=0x088000 rev=0x04 hdr=0x00 vendor=0x8086 device=0x09a4 subvendor=0x8086 subdevice=0x0000
    vendor     = 'Intel Corporation'
    class      = base peripheral
    cap 10[40] = PCI-Express 2 root endpoint max data 128(128)
                 max read 128

none43@pci0:144:0:2:	class=0x088000 rev=0x04 hdr=0x00 vendor=0x8086 device=0x09a3 subvendor=0x8086 subdevice=0x0000
    vendor     = 'Intel Corporation'
    class      = base peripheral
    cap 10[40] = PCI-Express 2 root endpoint max data 128(128)
                 max read 128

none44@pci0:144:0:3:	class=0x088000 rev=0x04 hdr=0x00 vendor=0x8086 device=0x09a5 subvendor=0x15d9 subdevice=0x0000
    vendor     = 'Intel Corporation'
    class      = base peripheral
    cap 10[40] = PCI-Express 2 root endpoint max data 128(128)
                 max read 128

hostb5@pci0:144:0:4:	class=0x060000 rev=0x00 hdr=0x00 vendor=0x8086 device=0x0998 subvendor=0x8086 subdevice=0x0000
    vendor     = 'Intel Corporation'
    class      = bridge
    subclass   = HOST-PCI
    cap 10[40] = PCI-Express 2 root endpoint max data 256(256)
                 max read 128

pcib12@pci0:144:2:0:	class=0x060400 rev=0x06 hdr=0x01 vendor=0x8086 device=0x347a subvendor=0x15d9 subdevice=0x1c4f
    vendor     = 'Intel Corporation'
    class      = bridge
    subclass   = PCI-PCI
    bar   [10] = type Memory, range 64, base 0x33ffff60000, size 131072, enabled
    cap 10[40] = PCI-Express 2 root port max data 128(512) ARI disabled
                 max read 128
                 link x0(x4) speed 0.0(16.0)
                 slot 0 power limit 0 mW HotPlug(empty) Attn Button PC(off)
    cap 01[80] = powerspec 3  supports D0 D3  current D0
    cap 0d[88] = PCI Bridge subvendor=0x15d9 subdevice=0x1c4f
    cap 05[90] = MSI supports 1 message enabled with 1 message
    ecap 0001[100] = AER 1 0 fatal 0 non-fatal 0 corrected
    ecap 000d[148] = ACS 1
    ecap 000b[180] = Vendor [1] ID 0003 Rev 0 Length 10
    ecap 001d[190] = Downstream Port Containment 1
    ecap 001f[1e0] = Precision Time Measurement 2
    ecap 0019[200] = PCIe Sec 1 lane errors 0
    ecap 0025[400] = Data Link Feature 1
    ecap 0026[410] = Physical Layer 16.0 GT/s 1
    ecap 0027[450] = Lane Margining at Receiver 1

pcib13@pci0:144:3:0:	class=0x060400 rev=0x06 hdr=0x01 vendor=0x8086 device=0x347b subvendor=0x15d9 subdevice=0x1c4f
    vendor     = 'Intel Corporation'
    class      = bridge
    subclass   = PCI-PCI
    bar   [10] = type Memory, range 64, base 0x33ffff40000, size 131072, enabled
    cap 10[40] = PCI-Express 2 root port max data 256(512) ARI disabled
                 max read 128
                 link x4(x4) speed 8.0(16.0)
                 slot 0 power limit 0 mW HotPlug(present) Attn Button PC(on)
    cap 01[80] = powerspec 3  supports D0 D3  current D0
    cap 0d[88] = PCI Bridge subvendor=0x15d9 subdevice=0x1c4f
    cap 05[90] = MSI supports 1 message enabled with 1 message
    ecap 0001[100] = AER 1 0 fatal 0 non-fatal 0 corrected
    ecap 000d[148] = ACS 1
    ecap 000b[180] = Vendor [1] ID 0003 Rev 0 Length 10
    ecap 001d[190] = Downstream Port Containment 1
    ecap 001f[1e0] = Precision Time Measurement 2
    ecap 0019[200] = PCIe Sec 1 lane errors 0
    ecap 0025[400] = Data Link Feature 1
    ecap 0026[410] = Physical Layer 16.0 GT/s 1
    ecap 0027[450] = Lane Margining at Receiver 1

pcib14@pci0:144:4:0:	class=0x060400 rev=0x06 hdr=0x01 vendor=0x8086 device=0x347c subvendor=0x15d9 subdevice=0x1c4f
    vendor     = 'Intel Corporation'
    class      = bridge
    subclass   = PCI-PCI
    bar   [10] = type Memory, range 64, base 0x33ffff20000, size 131072, enabled
    cap 10[40] = PCI-Express 2 root port max data 256(512) ARI disabled
                 max read 128
                 link x4(x4) speed 8.0(16.0)
                 slot 0 power limit 0 mW HotPlug(present) Attn Button PC(on)
    cap 01[80] = powerspec 3  supports D0 D3  current D0
    cap 0d[88] = PCI Bridge subvendor=0x15d9 subdevice=0x1c4f
    cap 05[90] = MSI supports 1 message enabled with 1 message
    ecap 0001[100] = AER 1 0 fatal 0 non-fatal 0 corrected
    ecap 000d[148] = ACS 1
    ecap 000b[180] = Vendor [1] ID 0003 Rev 0 Length 10
    ecap 001d[190] = Downstream Port Containment 1
    ecap 001f[1e0] = Precision Time Measurement 2
    ecap 0019[200] = PCIe Sec 1 lane errors 0
    ecap 0025[400] = Data Link Feature 1
    ecap 0026[410] = Physical Layer 16.0 GT/s 1
    ecap 0027[450] = Lane Margining at Receiver 1

pcib15@pci0:144:5:0:	class=0x060400 rev=0x06 hdr=0x01 vendor=0x8086 device=0x347d subvendor=0x15d9 subdevice=0x1c4f
    vendor     = 'Intel Corporation'
    class      = bridge
    subclass   = PCI-PCI
    bar   [10] = type Memory, range 64, base 0x33ffff00000, size 131072, enabled
    cap 10[40] = PCI-Express 2 root port max data 128(512) ARI disabled
                 max read 128
                 link x0(x4) speed 0.0(16.0)
                 slot 0 power limit 0 mW HotPlug(empty) Attn Button PC(off)
    cap 01[80] = powerspec 3  supports D0 D3  current D0
    cap 0d[88] = PCI Bridge subvendor=0x15d9 subdevice=0x1c4f
    cap 05[90] = MSI supports 1 message enabled with 1 message
    ecap 0001[100] = AER 1 0 fatal 0 non-fatal 0 corrected
    ecap 000d[148] = ACS 1
    ecap 000b[180] = Vendor [1] ID 0003 Rev 0 Length 10
    ecap 001d[190] = Downstream Port Containment 1
    ecap 001f[1e0] = Precision Time Measurement 2
    ecap 0019[200] = PCIe Sec 1 lane errors 0
    ecap 0025[400] = Data Link Feature 1
    ecap 0026[410] = Physical Layer 16.0 GT/s 1
    ecap 0027[450] = Lane Margining at Receiver 1

nvme0@pci0:146:0:0:	class=0x010802 rev=0x02 hdr=0x00 vendor=0x1c58 device=0x0023 subvendor=0x1c58 subdevice=0x0023
    vendor     = 'HGST, Inc.'
    device     = 'Ultrastar SN200 Series NVMe SSD'
    class      = mass storage
    subclass   = NVM
    bar   [10] = type Memory, range 64, base 0xfb630000, size 16384, enabled
    bar   [20] = type Memory, range 64, base 0xfb620000, size 65536, enabled
    cap 01[c0] = powerspec 3  supports D0 D3  current D0
    cap 10[70] = PCI-Express 2 endpoint max data 256(256) FLR
                 max read 512
                 link x4(x4) speed 8.0(8.0)
    cap 05[c8] = MSI supports 32 messages, 64 bit, vector masks 
    cap 11[e0] = MSI-X supports 129 messages, enabled
                 Table in map 0x10[0x2000], PBA in map 0x10[0x3000]
    cap 03[60] = VPD
    ecap 0001[100] = AER 2 0 fatal 0 non-fatal 0 corrected
    ecap 0019[180] = PCIe Sec 1 lane errors 0
    ecap 0003[248] = Serial 1 000cca0c03526180

nvme1@pci0:147:0:0:	class=0x010802 rev=0x02 hdr=0x00 vendor=0x1c58 device=0x0023 subvendor=0x1c58 subdevice=0x0023
    vendor     = 'HGST, Inc.'
    device     = 'Ultrastar SN200 Series NVMe SSD'
    class      = mass storage
    subclass   = NVM
    bar   [10] = type Memory, range 64, base 0xfb530000, size 16384, enabled
    bar   [20] = type Memory, range 64, base 0xfb520000, size 65536, enabled
    cap 01[c0] = powerspec 3  supports D0 D3  current D0
    cap 10[70] = PCI-Express 2 endpoint max data 256(256) FLR
                 max read 512
                 link x4(x4) speed 8.0(8.0)
    cap 05[c8] = MSI supports 32 messages, 64 bit, vector masks 
    cap 11[e0] = MSI-X supports 129 messages, enabled
                 Table in map 0x10[0x2000], PBA in map 0x10[0x3000]
    cap 03[60] = VPD
    ecap 0001[100] = AER 2 0 fatal 0 non-fatal 0 corrected
    ecap 0019[180] = PCIe Sec 1 lane errors 0
    ecap 0003[248] = Serial 1 000cca0c03524e00

none45@pci0:254:0:0:	class=0x088000 rev=0x00 hdr=0x00 vendor=0x8086 device=0x3450 subvendor=0x8086 subdevice=0x0000
    vendor     = 'Intel Corporation'
    class      = base peripheral
    cap 10[40] = PCI-Express 2 root endpoint max data 128(128)
                 max read 128

none46@pci0:254:0:1:	class=0x088000 rev=0x00 hdr=0x00 vendor=0x8086 device=0x3451 subvendor=0x8086 subdevice=0x0000
    vendor     = 'Intel Corporation'
    class      = base peripheral
    cap 10[40] = PCI-Express 2 root endpoint max data 128(128)
                 max read 128

none47@pci0:254:0:2:	class=0x088000 rev=0x00 hdr=0x00 vendor=0x8086 device=0x3452 subvendor=0x8086 subdevice=0x0000
    vendor     = 'Intel Corporation'
    class      = base peripheral
    cap 10[40] = PCI-Express 2 root endpoint max data 128(128)
                 max read 128

hostb6@pci0:254:0:3:	class=0x060000 rev=0x00 hdr=0x00 vendor=0x8086 device=0x0998 subvendor=0x8086 subdevice=0x0000
    vendor     = 'Intel Corporation'
    class      = bridge
    subclass   = HOST-PCI
    cap 10[40] = PCI-Express 2 root endpoint max data 128(256)
                 max read 128

none48@pci0:254:0:5:	class=0x088000 rev=0x00 hdr=0x00 vendor=0x8086 device=0x3455 subvendor=0x8086 subdevice=0x0000
    vendor     = 'Intel Corporation'
    class      = base peripheral
    cap 10[40] = PCI-Express 2 root endpoint max data 128(128)
                 max read 128

none49@pci0:254:11:0:	class=0x088000 rev=0x00 hdr=0x00 vendor=0x8086 device=0x3448 subvendor=0x8086 subdevice=0x0000
    vendor     = 'Intel Corporation'
    class      = base peripheral

none50@pci0:254:11:1:	class=0x088000 rev=0x00 hdr=0x00 vendor=0x8086 device=0x3448 subvendor=0x8086 subdevice=0x0000
    vendor     = 'Intel Corporation'
    class      = base peripheral

none51@pci0:254:11:2:	class=0x088000 rev=0x00 hdr=0x00 vendor=0x8086 device=0x344b subvendor=0x8086 subdevice=0x0000
    vendor     = 'Intel Corporation'
    class      = base peripheral

none52@pci0:254:12:0:	class=0x110100 rev=0x00 hdr=0x00 vendor=0x8086 device=0x344a subvendor=0x8086 subdevice=0x0000
    vendor     = 'Intel Corporation'
    class      = dasp
    subclass   = performance counters
    cap 10[40] = PCI-Express 2 root endpoint max data 128(128)
                 max read 128

none53@pci0:254:13:0:	class=0x110100 rev=0x00 hdr=0x00 vendor=0x8086 device=0x344a subvendor=0x8086 subdevice=0x0000
    vendor     = 'Intel Corporation'
    class      = dasp
    subclass   = performance counters
    cap 10[40] = PCI-Express 2 root endpoint max data 128(128)
                 max read 128

none54@pci0:254:26:0:	class=0x110100 rev=0x00 hdr=0x00 vendor=0x8086 device=0x2880 subvendor=0x8086 subdevice=0x0000
    vendor     = 'Intel Corporation'
    class      = dasp
    subclass   = performance counters
    cap 10[40] = PCI-Express 2 root endpoint max data 128(128)
                 max read 128

none55@pci0:254:27:0:	class=0x110100 rev=0x00 hdr=0x00 vendor=0x8086 device=0x2880 subvendor=0x8086 subdevice=0x0000
    vendor     = 'Intel Corporation'
    class      = dasp
    subclass   = performance counters
    cap 10[40] = PCI-Express 2 root endpoint max data 128(128)
                 max read 128

none56@pci0:255:0:0:	class=0x088000 rev=0x00 hdr=0x00 vendor=0x8086 device=0x344c subvendor=0x8086 subdevice=0x0000
    vendor     = 'Intel Corporation'
    class      = base peripheral
    cap 10[40] = PCI-Express 2 root endpoint max data 128(128)
                 max read 128

none57@pci0:255:0:1:	class=0x088000 rev=0x00 hdr=0x00 vendor=0x8086 device=0x344c subvendor=0x8086 subdevice=0x0000
    vendor     = 'Intel Corporation'
    class      = base peripheral
    cap 10[40] = PCI-Express 2 root endpoint max data 128(128)
                 max read 128

none58@pci0:255:0:2:	class=0x088000 rev=0x00 hdr=0x00 vendor=0x8086 device=0x344c subvendor=0x8086 subdevice=0x0000
    vendor     = 'Intel Corporation'
    class      = base peripheral
    cap 10[40] = PCI-Express 2 root endpoint max data 128(128)
                 max read 128

none59@pci0:255:0:3:	class=0x088000 rev=0x00 hdr=0x00 vendor=0x8086 device=0x344c subvendor=0x8086 subdevice=0x0000
    vendor     = 'Intel Corporation'
    class      = base peripheral
    cap 10[40] = PCI-Express 2 root endpoint max data 128(128)
                 max read 128

none60@pci0:255:0:4:	class=0x088000 rev=0x00 hdr=0x00 vendor=0x8086 device=0x344c subvendor=0x8086 subdevice=0x0000
    vendor     = 'Intel Corporation'
    class      = base peripheral
    cap 10[40] = PCI-Express 2 root endpoint max data 128(128)
                 max read 128

none61@pci0:255:0:5:	class=0x088000 rev=0x00 hdr=0x00 vendor=0x8086 device=0x344c subvendor=0x8086 subdevice=0x0000
    vendor     = 'Intel Corporation'
    class      = base peripheral
    cap 10[40] = PCI-Express 2 root endpoint max data 128(128)
                 max read 128

none62@pci0:255:10:0:	class=0x088000 rev=0x00 hdr=0x00 vendor=0x8086 device=0x344d subvendor=0x8086 subdevice=0x0000
    vendor     = 'Intel Corporation'
    class      = base peripheral
    cap 10[40] = PCI-Express 2 root endpoint max data 128(128)
                 max read 128

none63@pci0:255:10:1:	class=0x088000 rev=0x00 hdr=0x00 vendor=0x8086 device=0x344d subvendor=0x8086 subdevice=0x0000
    vendor     = 'Intel Corporation'
    class      = base peripheral
    cap 10[40] = PCI-Express 2 root endpoint max data 128(128)
                 max read 128

none64@pci0:255:10:2:	class=0x088000 rev=0x00 hdr=0x00 vendor=0x8086 device=0x344d subvendor=0x8086 subdevice=0x0000
    vendor     = 'Intel Corporation'
    class      = base peripheral
    cap 10[40] = PCI-Express 2 root endpoint max data 128(128)
                 max read 128

none65@pci0:255:10:3:	class=0x088000 rev=0x00 hdr=0x00 vendor=0x8086 device=0x344d subvendor=0x8086 subdevice=0x0000
    vendor     = 'Intel Corporation'
    class      = base peripheral
    cap 10[40] = PCI-Express 2 root endpoint max data 128(128)
                 max read 128

none66@pci0:255:10:4:	class=0x088000 rev=0x00 hdr=0x00 vendor=0x8086 device=0x344d subvendor=0x8086 subdevice=0x0000
    vendor     = 'Intel Corporation'
    class      = base peripheral
    cap 10[40] = PCI-Express 2 root endpoint max data 128(128)
                 max read 128

none67@pci0:255:10:5:	class=0x088000 rev=0x00 hdr=0x00 vendor=0x8086 device=0x344d subvendor=0x8086 subdevice=0x0000
    vendor     = 'Intel Corporation'
    class      = base peripheral
    cap 10[40] = PCI-Express 2 root endpoint max data 128(128)
                 max read 128

none68@pci0:255:29:0:	class=0x088000 rev=0x00 hdr=0x00 vendor=0x8086 device=0x344f subvendor=0x8086 subdevice=0x0000
    vendor     = 'Intel Corporation'
    class      = base peripheral
    cap 10[40] = PCI-Express 2 root endpoint max data 128(128)
                 max read 128

none69@pci0:255:29:1:	class=0x088000 rev=0x00 hdr=0x00 vendor=0x8086 device=0x3457 subvendor=0x8086 subdevice=0x0000
    vendor     = 'Intel Corporation'
    class      = base peripheral
    cap 10[40] = PCI-Express 2 root endpoint max data 128(128)
                 max read 128

none70@pci0:255:30:0:	class=0x088000 rev=0x01 hdr=0x00 vendor=0x8086 device=0x3458 subvendor=0x8086 subdevice=0x0000
    vendor     = 'Intel Corporation'
    class      = base peripheral

none71@pci0:255:30:1:	class=0x088000 rev=0x01 hdr=0x00 vendor=0x8086 device=0x3459 subvendor=0x8086 subdevice=0x0000
    vendor     = 'Intel Corporation'
    class      = base peripheral

none72@pci0:255:30:2:	class=0x088000 rev=0x01 hdr=0x00 vendor=0x8086 device=0x345a subvendor=0x8086 subdevice=0x0000
    vendor     = 'Intel Corporation'
    class      = base peripheral

none73@pci0:255:30:3:	class=0x088000 rev=0x01 hdr=0x00 vendor=0x8086 device=0x345b subvendor=0x8086 subdevice=0x0000
    vendor     = 'Intel Corporation'
    class      = base peripheral

none74@pci0:255:30:4:	class=0x088000 rev=0x01 hdr=0x00 vendor=0x8086 device=0x345c subvendor=0x8086 subdevice=0x0000
    vendor     = 'Intel Corporation'
    class      = base peripheral

none75@pci0:255:30:5:	class=0x088000 rev=0x01 hdr=0x00 vendor=0x8086 device=0x345d subvendor=0x8086 subdevice=0x0000
    vendor     = 'Intel Corporation'
    class      = base peripheral

none76@pci0:255:30:6:	class=0x088000 rev=0x01 hdr=0x00 vendor=0x8086 device=0x345e subvendor=0x8086 subdevice=0x0000
    vendor     = 'Intel Corporation'
    class      = base peripheral

none77@pci0:255:30:7:	class=0x088000 rev=0x01 hdr=0x00 vendor=0x8086 device=0x345f subvendor=0x8086 subdevice=0x0000
    vendor     = 'Intel Corporation'
    class      = base peripheral
