hostb0@pci0:0:0:0:	class=0x060000 rev=0x00 hdr=0x00 vendor=0x1022 device=0x1510 subvendor=0x1022 subdevice=0x1510
    vendor     = 'Advanced Micro Devices, Inc. [AMD]'
    device     = 'Family 14h Processor Root Complex'
    class      = bridge
    subclass   = HOST-PCI

pcib1@pci0:0:4:0:	class=0x060400 rev=0x00 hdr=0x01 vendor=0x1022 device=0x1512 subvendor=0x1022 subdevice=0x1234
    vendor     = 'Advanced Micro Devices, Inc. [AMD]'
    device     = 'Family 14h Processor Root Port'
    class      = bridge
    subclass   = PCI-PCI
    cap 01[50] = powerspec 3  supports D0 D3  current D0
    cap 10[58] = PCI-Express 2 root port max data 128(128) RO NS
                 max read 512
                 link x1(x1) speed 2.5(5.0) ASPM L0s/L1(L0s/L1)
                 slot 4 power limit 75000 mW
    cap 05[a0] = MSI supports 1 message, 64 bit 
    cap 0d[b0] = PCI Bridge subvendor=0x1022 subdevice=0x1234
    cap 08[b8] = HT MSI fixed address window enabled at 0xfee00000

pcib2@pci0:0:5:0:	class=0x060400 rev=0x00 hdr=0x01 vendor=0x1022 device=0x1513 subvendor=0x1022 subdevice=0x1234
    vendor     = 'Advanced Micro Devices, Inc. [AMD]'
    device     = 'Family 14h Processor Root Port'
    class      = bridge
    subclass   = PCI-PCI
    cap 01[50] = powerspec 3  supports D0 D3  current D0
    cap 10[58] = PCI-Express 2 root port max data 128(128) RO NS
                 max read 512
                 link x1(x1) speed 2.5(5.0) ASPM L0s/L1(L0s/L1)
                 slot 5 power limit 75000 mW
    cap 05[a0] = MSI supports 1 message, 64 bit 
    cap 0d[b0] = PCI Bridge subvendor=0x1022 subdevice=0x1234
    cap 08[b8] = HT MSI fixed address window enabled at 0xfee00000

pcib3@pci0:0:6:0:	class=0x060400 rev=0x00 hdr=0x01 vendor=0x1022 device=0x1514 subvendor=0x1022 subdevice=0x1234
    vendor     = 'Advanced Micro Devices, Inc. [AMD]'
    device     = 'Family 14h Processor Root Port'
    class      = bridge
    subclass   = PCI-PCI
    cap 01[50] = powerspec 3  supports D0 D3  current D0
    cap 10[58] = PCI-Express 2 root port max data 128(128) RO NS
                 max read 512
                 link x1(x1) speed 2.5(5.0) ASPM L0s/L1(L0s/L1)
                 slot 6 power limit 75000 mW
    cap 05[a0] = MSI supports 1 message, 64 bit 
    cap 0d[b0] = PCI Bridge subvendor=0x1022 subdevice=0x1234
    cap 08[b8] = HT MSI fixed address window enabled at 0xfee00000

ahci0@pci0:0:17:0:	class=0x010601 rev=0x40 hdr=0x00 vendor=0x1002 device=0x4391 subvendor=0x1002 subdevice=0x4391
    vendor     = 'Advanced Micro Devices, Inc. [AMD/ATI]'
    device     = 'SB7x0/SB8x0/SB9x0 SATA Controller [AHCI mode]'
    class      = mass storage
    subclass   = SATA
    bar   [10] = type I/O Port, range 32, base 0x4010, size 8, enabled
    bar   [14] = type I/O Port, range 32, base 0x4020, size 4, enabled
    bar   [18] = type I/O Port, range 32, base 0x4018, size 8, enabled
    bar   [1c] = type I/O Port, range 32, base 0x4024, size 4, enabled
    bar   [20] = type I/O Port, range 32, base 0x4000, size 16, enabled
    bar   [24] = type Memory, range 32, base 0xf7f03000, size 1024, enabled
    cap 12[70] = SATA Index-Data Pair
    cap 13[a4] = PCI Advanced Features: FLR TP

ohci0@pci0:0:18:0:	class=0x0c0310 rev=0x00 hdr=0x00 vendor=0x1002 device=0x4397 subvendor=0x1002 subdevice=0x4397
    vendor     = 'Advanced Micro Devices, Inc. [AMD/ATI]'
    device     = 'SB7x0/SB8x0/SB9x0 USB OHCI0 Controller'
    class      = serial bus
    subclass   = USB
    bar   [10] = type Memory, range 32, base 0xf7f00000, size 4096, enabled

ehci0@pci0:0:18:2:	class=0x0c0320 rev=0x00 hdr=0x00 vendor=0x1002 device=0x4396 subvendor=0x1002 subdevice=0x4396
    vendor     = 'Advanced Micro Devices, Inc. [AMD/ATI]'
    device     = 'SB7x0/SB8x0/SB9x0 USB EHCI Controller'
    class      = serial bus
    subclass   = USB
    bar   [10] = type Memory, range 32, base 0xf7f04000, size 256, enabled
    cap 01[c0] = powerspec 2  supports D0 D1 D2 D3  current D0
    cap 0a[e4] = EHCI Debug Port at offset 0xe0 in map 0x14

ohci1@pci0:0:19:0:	class=0x0c0310 rev=0x00 hdr=0x00 vendor=0x1002 device=0x4397 subvendor=0x1002 subdevice=0x4397
    vendor     = 'Advanced Micro Devices, Inc. [AMD/ATI]'
    device     = 'SB7x0/SB8x0/SB9x0 USB OHCI0 Controller'
    class      = serial bus
    subclass   = USB
    bar   [10] = type Memory, range 32, base 0xf7f01000, size 4096, enabled

ehci1@pci0:0:19:2:	class=0x0c0320 rev=0x00 hdr=0x00 vendor=0x1002 device=0x4396 subvendor=0x1002 subdevice=0x4396
    vendor     = 'Advanced Micro Devices, Inc. [AMD/ATI]'
    device     = 'SB7x0/SB8x0/SB9x0 USB EHCI Controller'
    class      = serial bus
    subclass   = USB
    bar   [10] = type Memory, range 32, base 0xf7f05000, size 256, enabled
    cap 01[c0] = powerspec 2  supports D0 D1 D2 D3  current D0
    cap 0a[e4] = EHCI Debug Port at offset 0xe0 in map 0x14

intsmb0@pci0:0:20:0:	class=0x0c0500 rev=0x42 hdr=0x00 vendor=0x1002 device=0x4385 subvendor=0x1022 subdevice=0x1510
    vendor     = 'Advanced Micro Devices, Inc. [AMD/ATI]'
    device     = 'SBx00 SMBus Controller'
    class      = serial bus
    subclass   = SMBus

isab0@pci0:0:20:3:	class=0x060100 rev=0x40 hdr=0x00 vendor=0x1002 device=0x439d subvendor=0x1002 subdevice=0x439d
    vendor     = 'Advanced Micro Devices, Inc. [AMD/ATI]'
    device     = 'SB7x0/SB8x0/SB9x0 LPC host controller'
    class      = bridge
    subclass   = PCI-ISA

pcib4@pci0:0:20:4:	class=0x060401 rev=0x40 hdr=0x01 vendor=0x1002 device=0x4384 subvendor=0x0000 subdevice=0x0000
    vendor     = 'Advanced Micro Devices, Inc. [AMD/ATI]'
    device     = 'SBx00 PCI to PCI Bridge'
    class      = bridge
    subclass   = PCI-PCI

ohci2@pci0:0:22:0:	class=0x0c0310 rev=0x00 hdr=0x00 vendor=0x1002 device=0x4397 subvendor=0x1002 subdevice=0x4397
    vendor     = 'Advanced Micro Devices, Inc. [AMD/ATI]'
    device     = 'SB7x0/SB8x0/SB9x0 USB OHCI0 Controller'
    class      = serial bus
    subclass   = USB
    bar   [10] = type Memory, range 32, base 0xf7f02000, size 4096, enabled

ehci2@pci0:0:22:2:	class=0x0c0320 rev=0x00 hdr=0x00 vendor=0x1002 device=0x4396 subvendor=0x1002 subdevice=0x4396
    vendor     = 'Advanced Micro Devices, Inc. [AMD/ATI]'
    device     = 'SB7x0/SB8x0/SB9x0 USB EHCI Controller'
    class      = serial bus
    subclass   = USB
    bar   [10] = type Memory, range 32, base 0xf7f06000, size 256, enabled
    cap 01[c0] = powerspec 2  supports D0 D1 D2 D3  current D0
    cap 0a[e4] = EHCI Debug Port at offset 0xe0 in map 0x14

hostb1@pci0:0:24:0:	class=0x060000 rev=0x43 hdr=0x00 vendor=0x1022 device=0x1700 subvendor=0x0000 subdevice=0x0000
    vendor     = 'Advanced Micro Devices, Inc. [AMD]'
    device     = 'Family 12h/14h Processor Function 0'
    class      = bridge
    subclass   = HOST-PCI

hostb2@pci0:0:24:1:	class=0x060000 rev=0x00 hdr=0x00 vendor=0x1022 device=0x1701 subvendor=0x0000 subdevice=0x0000
    vendor     = 'Advanced Micro Devices, Inc. [AMD]'
    device     = 'Family 12h/14h Processor Function 1'
    class      = bridge
    subclass   = HOST-PCI

hostb3@pci0:0:24:2:	class=0x060000 rev=0x00 hdr=0x00 vendor=0x1022 device=0x1702 subvendor=0x0000 subdevice=0x0000
    vendor     = 'Advanced Micro Devices, Inc. [AMD]'
    device     = 'Family 12h/14h Processor Function 2'
    class      = bridge
    subclass   = HOST-PCI

hostb4@pci0:0:24:3:	class=0x060000 rev=0x00 hdr=0x00 vendor=0x1022 device=0x1703 subvendor=0x0000 subdevice=0x0000
    vendor     = 'Advanced Micro Devices, Inc. [AMD]'
    device     = 'Family 12h/14h Processor Function 3'
    class      = bridge
    subclass   = HOST-PCI
    cap 0f[f0] = unknown

hostb5@pci0:0:24:4:	class=0x060000 rev=0x00 hdr=0x00 vendor=0x1022 device=0x1704 subvendor=0x0000 subdevice=0x0000
    vendor     = 'Advanced Micro Devices, Inc. [AMD]'
    device     = 'Family 12h/14h Processor Function 4'
    class      = bridge
    subclass   = HOST-PCI

hostb6@pci0:0:24:5:	class=0x060000 rev=0x00 hdr=0x00 vendor=0x1022 device=0x1718 subvendor=0x0000 subdevice=0x0000
    vendor     = 'Advanced Micro Devices, Inc. [AMD]'
    device     = 'Family 12h/14h Processor Function 6'
    class      = bridge
    subclass   = HOST-PCI

hostb7@pci0:0:24:6:	class=0x060000 rev=0x00 hdr=0x00 vendor=0x1022 device=0x1716 subvendor=0x0000 subdevice=0x0000
    vendor     = 'Advanced Micro Devices, Inc. [AMD]'
    device     = 'Family 12h/14h Processor Function 5'
    class      = bridge
    subclass   = HOST-PCI

hostb8@pci0:0:24:7:	class=0x060000 rev=0x00 hdr=0x00 vendor=0x1022 device=0x1719 subvendor=0x0000 subdevice=0x0000
    vendor     = 'Advanced Micro Devices, Inc. [AMD]'
    device     = 'Family 12h/14h Processor Function 7'
    class      = bridge
    subclass   = HOST-PCI

re0@pci0:1:0:0:	class=0x020000 rev=0x06 hdr=0x00 vendor=0x10ec device=0x8168 subvendor=0x10ec subdevice=0x0123
    vendor     = 'Realtek Semiconductor Co., Ltd.'
    device     = 'RTL8111/8168/8411 PCI Express Gigabit Ethernet Controller'
    class      = network
    subclass   = ethernet
    bar   [10] = type I/O Port, range 32, base 0x1000, size 256, enabled
    bar   [18] = type Memory, range 64, base 0xf7a00000, size 4096, enabled
    bar   [20] = type Prefetchable Memory, range 64, base 0xf7900000, size 16384, enabled
    cap 01[40] = powerspec 3  supports D0 D1 D2 D3  current D0
    cap 05[50] = MSI supports 1 message, 64 bit 
    cap 10[70] = PCI-Express 2 endpoint MSI 1 max data 128(128) RO
                 max read 4096
                 link x1(x1) speed 2.5(2.5) ASPM disabled(L0s/L1) ClockPM disabled
    cap 11[b0] = MSI-X supports 4 messages, enabled
                 Table in map 0x20[0x0], PBA in map 0x20[0x800]
    cap 03[d0] = VPD

re1@pci0:2:0:0:	class=0x020000 rev=0x06 hdr=0x00 vendor=0x10ec device=0x8168 subvendor=0x10ec subdevice=0x0123
    vendor     = 'Realtek Semiconductor Co., Ltd.'
    device     = 'RTL8111/8168/8411 PCI Express Gigabit Ethernet Controller'
    class      = network
    subclass   = ethernet
    bar   [10] = type I/O Port, range 32, base 0x2000, size 256, enabled
    bar   [18] = type Memory, range 64, base 0xf7c00000, size 4096, enabled
    bar   [20] = type Prefetchable Memory, range 64, base 0xf7b00000, size 16384, enabled
    cap 01[40] = powerspec 3  supports D0 D1 D2 D3  current D0
    cap 05[50] = MSI supports 1 message, 64 bit 
    cap 10[70] = PCI-Express 2 endpoint MSI 1 max data 128(128) RO
                 max read 512
                 link x1(x1) speed 2.5(2.5) ASPM disabled(L0s/L1) ClockPM disabled
    cap 11[b0] = MSI-X supports 4 messages, enabled
                 Table in map 0x20[0x0], PBA in map 0x20[0x800]
    cap 03[d0] = VPD

re2@pci0:3:0:0:	class=0x020000 rev=0x06 hdr=0x00 vendor=0x10ec device=0x8168 subvendor=0x10ec subdevice=0x0123
    vendor     = 'Realtek Semiconductor Co., Ltd.'
    device     = 'RTL8111/8168/8411 PCI Express Gigabit Ethernet Controller'
    class      = network
    subclass   = ethernet
    bar   [10] = type I/O Port, range 32, base 0x3000, size 256, enabled
    bar   [18] = type Memory, range 64, base 0xf7e00000, size 4096, enabled
    bar   [20] = type Prefetchable Memory, range 64, base 0xf7d00000, size 16384, enabled
    cap 01[40] = powerspec 3  supports D0 D1 D2 D3  current D0
    cap 05[50] = MSI supports 1 message, 64 bit 
    cap 10[70] = PCI-Express 2 endpoint MSI 1 max data 128(128) RO
                 max read 512
                 link x1(x1) speed 2.5(2.5) ASPM disabled(L0s/L1) ClockPM disabled
    cap 11[b0] = MSI-X supports 4 messages, enabled
                 Table in map 0x20[0x0], PBA in map 0x20[0x800]
    cap 03[d0] = VPD
