hostb0@pci0:0:0:0:	class=0x060000 rev=0x08 hdr=0x00 vendor=0x8086 device=0x5914 subvendor=0x17aa subdevice=0x5068
    vendor     = 'Intel Corporation'
    device     = 'Xeon E3-1200 v6/7th Gen Core Processor Host Bridge/DRAM Registers'
    class      = bridge
    subclass   = HOST-PCI
    cap 09[e0] = vendor (length 16) Intel cap 0 version 1

vgapci0@pci0:0:2:0:	class=0x030000 rev=0x07 hdr=0x00 vendor=0x8086 device=0x5917 subvendor=0x17aa subdevice=0x5068
    vendor     = 'Intel Corporation'
    device     = 'UHD Graphics 620'
    class      = display
    subclass   = VGA
    bar   [10] = type Memory, range 64, base 0xe0000000, size 16777216, enabled
    bar   [18] = type Prefetchable Memory, range 64, base 0xc0000000, size 536870912, enabled
    bar   [20] = type I/O Port, range 32, base 0xe000, size 64, enabled
    cap 09[40] = vendor (length 12) Intel cap 0 version 1
    cap 10[70] = PCI-Express 2 root endpoint max data 128(128) FLR
                 max read 128
    cap 05[ac] = MSI supports 1 message enabled with 1 message
    cap 01[d0] = powerspec 2  supports D0 D3  current D0
    ecap 001b[100] = Process Address Space ID 1
    ecap 000f[200] = ATS 1
    ecap 0013[300] = Page Page Request 1

none0@pci0:0:8:0:	class=0x088000 rev=0x00 hdr=0x00 vendor=0x8086 device=0x1911 subvendor=0x17aa subdevice=0x5068
    vendor     = 'Intel Corporation'
    device     = 'Xeon E3-1200 v5/v6 / E3-1500 v5 / 6th/7th/8th Gen Core Processor Gaussian Mixture Model'
    class      = base peripheral
    bar   [10] = type Memory, range 64, base 0xe142a000, size 4096, enabled
    cap 05[90] = MSI supports 1 message 
    cap 01[dc] = powerspec 2  supports D0 D3  current D0
    cap 13[f0] = PCI Advanced Features: FLR TP

xhci0@pci0:0:20:0:	class=0x0c0330 rev=0x21 hdr=0x00 vendor=0x8086 device=0x9d2f subvendor=0x17aa subdevice=0x5068
    vendor     = 'Intel Corporation'
    device     = 'Sunrise Point-LP USB 3.0 xHCI Controller'
    class      = serial bus
    subclass   = USB
    bar   [10] = type Memory, range 64, base 0xe1400000, size 65536, enabled
    cap 01[70] = powerspec 2  supports D0 D3  current D0
    cap 05[80] = MSI supports 8 messages, 64 bit enabled with 1 message

pchtherm0@pci0:0:20:2:	class=0x118000 rev=0x21 hdr=0x00 vendor=0x8086 device=0x9d31 subvendor=0x17aa subdevice=0x5068
    vendor     = 'Intel Corporation'
    device     = 'Sunrise Point-LP Thermal subsystem'
    class      = dasp
    bar   [10] = type Memory, range 64, base 0xe142b000, size 4096, enabled
    cap 01[50] = powerspec 3  supports D0 D3  current D0
    cap 05[80] = MSI supports 1 message 

none1@pci0:0:22:0:	class=0x078000 rev=0x21 hdr=0x00 vendor=0x8086 device=0x9d3a subvendor=0x17aa subdevice=0x5068
    vendor     = 'Intel Corporation'
    device     = 'Sunrise Point-LP CSME HECI'
    class      = simple comms
    bar   [10] = type Memory, range 64, base 0xe142c000, size 4096, enabled
    cap 01[50] = powerspec 3  supports D0 D3  current D0
    cap 05[8c] = MSI supports 1 message, 64 bit 

ahci0@pci0:0:23:0:	class=0x010601 rev=0x21 hdr=0x00 vendor=0x8086 device=0x9d03 subvendor=0x17aa subdevice=0x5068
    vendor     = 'Intel Corporation'
    device     = 'Sunrise Point-LP SATA Controller [AHCI mode]'
    class      = mass storage
    subclass   = SATA
    bar   [10] = type Memory, range 32, base 0xe1428000, size 8192, enabled
    bar   [14] = type Memory, range 32, base 0xe142f000, size 256, enabled
    bar   [18] = type I/O Port, range 32, base 0xe080, size 8, enabled
    bar   [1c] = type I/O Port, range 32, base 0xe088, size 4, enabled
    bar   [20] = type I/O Port, range 32, base 0xe060, size 32, enabled
    bar   [24] = type Memory, range 32, base 0xe142d000, size 2048, enabled
    cap 05[80] = MSI supports 1 message enabled with 1 message
    cap 01[70] = powerspec 3  supports D0 D3  current D0
    cap 12[a8] = SATA Index-Data Pair

pcib1@pci0:0:28:0:	class=0x060400 rev=0xf1 hdr=0x01 vendor=0x8086 device=0x9d10 subvendor=0x17aa subdevice=0x5068
    vendor     = 'Intel Corporation'
    device     = 'Sunrise Point-LP PCI Express Root Port'
    class      = bridge
    subclass   = PCI-PCI
    cap 10[40] = PCI-Express 2 root port max data 128(256) ARI disabled
                 max read 128
                 link x0(x4) speed 0.0(8.0) ASPM disabled(L0s/L1)
                 slot 0 power limit 0 mW HotPlug(empty) surprise
    cap 05[80] = MSI supports 1 message enabled with 1 message
    cap 0d[90] = PCI Bridge subvendor=0x17aa subdevice=0x5068
    cap 01[a0] = powerspec 3  supports D0 D3  current D0

pcib2@pci0:0:28:4:	class=0x060400 rev=0xf1 hdr=0x01 vendor=0x8086 device=0x9d14 subvendor=0x17aa subdevice=0x5068
    vendor     = 'Intel Corporation'
    device     = 'Sunrise Point-LP PCI Express Root Port'
    class      = bridge
    subclass   = PCI-PCI
    cap 10[40] = PCI-Express 2 root port max data 128(256) ARI disabled
                 max read 128
                 link x1(x1) speed 2.5(8.0) ASPM L0s/L1(L0s/L1)
                 slot 4 power limit 100 mW
    cap 05[80] = MSI supports 1 message 
    cap 0d[90] = PCI Bridge subvendor=0x17aa subdevice=0x5068
    cap 01[a0] = powerspec 3  supports D0 D3  current D0
    ecap 0001[100] = AER 1 0 fatal 0 non-fatal 0 corrected
    ecap 000d[140] = ACS 1
    ecap 0019[220] = PCIe Sec 1 lane errors 0

pcib3@pci0:0:29:0:	class=0x060400 rev=0xf1 hdr=0x01 vendor=0x8086 device=0x9d18 subvendor=0x17aa subdevice=0x5068
    vendor     = 'Intel Corporation'
    device     = 'Sunrise Point-LP PCI Express Root Port'
    class      = bridge
    subclass   = PCI-PCI
    cap 10[40] = PCI-Express 2 root port max data 256(256) ARI disabled
                 max read 128
                 link x2(x2) speed 8.0(8.0) ASPM L1(L1)
                 slot 8 power limit 250 mW
    cap 05[80] = MSI supports 1 message 
    cap 0d[90] = PCI Bridge subvendor=0x17aa subdevice=0x5068
    cap 01[a0] = powerspec 3  supports D0 D3  current D0
    ecap 0001[100] = AER 1 0 fatal 0 non-fatal 0 corrected
    ecap 000d[140] = ACS 1
    ecap 001e[200] = L1 PM Substates 1
    ecap 0019[220] = PCIe Sec 1 lane errors 0

pcib4@pci0:0:29:2:	class=0x060400 rev=0xf1 hdr=0x01 vendor=0x8086 device=0x9d1a subvendor=0x17aa subdevice=0x5068
    vendor     = 'Intel Corporation'
    device     = 'Sunrise Point-LP PCI Express Root Port'
    class      = bridge
    subclass   = PCI-PCI
    cap 10[40] = PCI-Express 2 root port max data 128(256) ARI disabled
                 max read 128
                 link x1(x1) speed 2.5(8.0) ASPM L1(L0s/L1)
                 slot 10 power limit 100 mW
    cap 05[80] = MSI supports 1 message 
    cap 0d[90] = PCI Bridge subvendor=0x17aa subdevice=0x5068
    cap 01[a0] = powerspec 3  supports D0 D3  current D0
    ecap 0001[100] = AER 1 0 fatal 0 non-fatal 0 corrected
    ecap 000d[140] = ACS 1
    ecap 0019[220] = PCIe Sec 1 lane errors 0

pcib5@pci0:0:29:3:	class=0x060400 rev=0xf1 hdr=0x01 vendor=0x8086 device=0x9d1b subvendor=0x17aa subdevice=0x5068
    vendor     = 'Intel Corporation'
    class      = bridge
    subclass   = PCI-PCI
    cap 10[40] = PCI-Express 2 root port max data 128(256) ARI disabled
                 max read 128
                 link x1(x1) speed 2.5(8.0) ASPM L0s/L1(L0s/L1)
                 slot 11 power limit 100 mW
    cap 05[80] = MSI supports 1 message 
    cap 0d[90] = PCI Bridge subvendor=0x17aa subdevice=0x5068
    cap 01[a0] = powerspec 3  supports D0 D3  current D0
    ecap 0001[100] = AER 1 0 fatal 0 non-fatal 0 corrected
    ecap 000d[140] = ACS 1
    ecap 001e[200] = L1 PM Substates 1
    ecap 0019[220] = PCIe Sec 1 lane errors 0

isab0@pci0:0:31:0:	class=0x060100 rev=0x21 hdr=0x00 vendor=0x8086 device=0x9d4e subvendor=0x17aa subdevice=0x5068
    vendor     = 'Intel Corporation'
    device     = 'Sunrise Point LPC Controller/eSPI Controller'
    class      = bridge
    subclass   = PCI-ISA

none2@pci0:0:31:2:	class=0x058000 rev=0x21 hdr=0x00 vendor=0x8086 device=0x9d21 subvendor=0x17aa subdevice=0x5068
    vendor     = 'Intel Corporation'
    device     = 'Sunrise Point-LP PMC'
    class      = memory
    bar   [10] = type Memory, range 32, base 0xe1424000, size 16384, enabled

hdac0@pci0:0:31:3:	class=0x040300 rev=0x21 hdr=0x00 vendor=0x8086 device=0x9d71 subvendor=0x17aa subdevice=0x5068
    vendor     = 'Intel Corporation'
    device     = 'Sunrise Point-LP HD Audio'
    class      = multimedia
    subclass   = HDA
    bar   [10] = type Memory, range 64, base 0xe1420000, size 16384, enabled
    bar   [20] = type Memory, range 64, base 0xe1410000, size 65536, enabled
    cap 01[50] = powerspec 3  supports D0 D3  current D0
    cap 05[60] = MSI supports 1 message, 64 bit enabled with 1 message

ichsmb0@pci0:0:31:4:	class=0x0c0500 rev=0x21 hdr=0x00 vendor=0x8086 device=0x9d23 subvendor=0x17aa subdevice=0x5068
    vendor     = 'Intel Corporation'
    device     = 'Sunrise Point-LP SMBus'
    class      = serial bus
    subclass   = SMBus
    bar   [10] = type Memory, range 64, base 0xe142e000, size 256, enabled
    bar   [20] = type I/O Port, range 32, base 0xefa0, size 32, enabled

re0@pci0:3:0:0:	class=0x020000 rev=0x10 hdr=0x00 vendor=0x10ec device=0x8168 subvendor=0x17aa subdevice=0x5068
    vendor     = 'Realtek Semiconductor Co., Ltd.'
    device     = 'RTL8111/8168/8411 PCI Express Gigabit Ethernet Controller'
    class      = network
    subclass   = ethernet
    bar   [10] = type I/O Port, range 32, base 0xd000, size 256, enabled
    bar   [18] = type Memory, range 64, base 0xe1304000, size 4096, enabled
    bar   [20] = type Memory, range 64, base 0xe1300000, size 16384, enabled
    cap 01[40] = powerspec 3  supports D0 D1 D2 D3  current D0
    cap 05[50] = MSI supports 1 message, 64 bit 
    cap 10[70] = PCI-Express 2 endpoint MSI 1 max data 128(128) RO
                 max read 4096
                 link x1(x1) speed 2.5(2.5) ASPM disabled(L0s/L1) ClockPM disabled
    cap 11[b0] = MSI-X supports 4 messages, enabled
                 Table in map 0x20[0x0], PBA in map 0x20[0x800]
    cap 03[d0] = VPD
    ecap 0001[100] = AER 2 0 fatal 0 non-fatal 1 corrected
    ecap 0002[140] = VC 1 max VC0
    ecap 0003[160] = Serial 1 01000000684ce000
    ecap 0018[170] = LTR 1
    ecap 001e[178] = L1 PM Substates 1

nvme0@pci0:4:0:0:	class=0x010802 rev=0x03 hdr=0x00 vendor=0x1cc1 device=0x8201 subvendor=0x1cc1 subdevice=0x8201
    vendor     = 'ADATA Technology Co., Ltd.'
    device     = 'XPG SX8200 Pro PCIe Gen3x4 M.2 2280 Solid State Drive'
    class      = mass storage
    subclass   = NVM
    bar   [10] = type Memory, range 64, base 0xe1200000, size 16384, enabled
    cap 01[40] = powerspec 3  supports D0 D3  current D0
    cap 05[50] = MSI supports 8 messages, 64 bit, vector masks 
    cap 10[70] = PCI-Express 2 endpoint max data 256(256) FLR RO
                 max read 512
                 link x2(x4) speed 8.0(8.0) ASPM L1(L1) ClockPM enabled
    cap 11[b0] = MSI-X supports 16 messages, enabled
                 Table in map 0x10[0x2000], PBA in map 0x10[0x2100]
    ecap 0001[100] = AER 2 0 fatal 0 non-fatal 1 corrected
    ecap 0019[158] = PCIe Sec 1 lane errors 0
    ecap 0018[178] = LTR 1
    ecap 001e[180] = L1 PM Substates 1

iwm0@pci0:5:0:0:	class=0x028000 rev=0x99 hdr=0x00 vendor=0x8086 device=0x3166 subvendor=0x8086 subdevice=0x4210
    vendor     = 'Intel Corporation'
    device     = 'Dual Band Wireless-AC 3165 Plus Bluetooth'
    class      = network
    bar   [10] = type Memory, range 64, base 0xe1100000, size 8192, enabled
    cap 01[c8] = powerspec 3  supports D0 D3  current D0
    cap 05[d0] = MSI supports 1 message, 64 bit enabled with 1 message
    cap 10[40] = PCI-Express 2 endpoint max data 128(128) FLR RO NS
                 max read 128
                 link x1(x1) speed 2.5(2.5) ASPM L1(L1) ClockPM enabled
    ecap 0001[100] = AER 1 0 fatal 0 non-fatal 1 corrected
    ecap 0003[140] = Serial 1 b46bfcffffbc3da1
    ecap 0018[14c] = LTR 1
    ecap 001e[154] = L1 PM Substates 1

sdhci_pci0@pci0:6:0:0:	class=0x080501 rev=0x01 hdr=0x00 vendor=0x1217 device=0x8621 subvendor=0x17aa subdevice=0x5068
    vendor     = 'O2 Micro, Inc.'
    device     = 'SD/MMC Card Reader Controller'
    class      = base peripheral
    subclass   = SD host controller
    bar   [10] = type Memory, range 32, base 0xe1001000, size 4096, enabled
    bar   [14] = type Memory, range 32, base 0xe1000000, size 2048, enabled
    cap 01[6c] = powerspec 3  supports D0 D3  current D0
    cap 05[48] = MSI supports 1 message, 64 bit, vector masks enabled with 1 message
    cap 10[80] = PCI-Express 2 endpoint max data 128(128) RO NS
                 max read 128
                 link x1(x1) speed 2.5(2.5) ASPM L0s/L1(L0s/L1) ClockPM enabled
    ecap 0002[100] = VC 1 max VC0
    ecap 0001[200] = AER 1 0 fatal 0 non-fatal 1 corrected
    ecap 0018[230] = LTR 1
