hostb0@pci0:0:0:0:	class=0x060000 rev=0x11 hdr=0x00 vendor=0x8086 device=0xd131 subvendor=0x8086 subdevice=0xd131
    vendor     = 'Intel Corporation'
    device     = 'Core Processor DMI'
    class      = bridge
    subclass   = HOST-PCI
    cap 00[40] = unknown

pcib1@pci0:0:3:0:	class=0x060400 rev=0x11 hdr=0x01 vendor=0x8086 device=0xd138 subvendor=0x8086 subdevice=0xd138
    vendor     = 'Intel Corporation'
    device     = 'Core Processor PCI Express Root Port 1'
    class      = bridge
    subclass   = PCI-PCI
    cap 0d[40] = PCI Bridge subvendor=0x8086 subdevice=0xd138
    cap 05[60] = MSI supports 2 messages, vector masks 
    cap 10[90] = PCI-Express 2 root port max data 128(256) ARI disabled
                 max read 128
                 link x8(x8) speed 5.0(5.0) ASPM disabled(L0s/L1)
    cap 01[e0] = powerspec 3  supports D0 D3  current D0
    ecap 0001[100] = AER 1 0 fatal 0 non-fatal 0 corrected
    ecap 000d[150] = ACS 1
    ecap 000b[160] = Vendor [0] ID 0002 Rev 0 Length 12

pcib6@pci0:0:5:0:	class=0x060400 rev=0x11 hdr=0x01 vendor=0x8086 device=0xd13a subvendor=0x8086 subdevice=0xd13a
    vendor     = 'Intel Corporation'
    device     = 'Core Processor PCI Express Root Port 3'
    class      = bridge
    subclass   = PCI-PCI
    cap 0d[40] = PCI Bridge subvendor=0x8086 subdevice=0xd13a
    cap 05[60] = MSI supports 2 messages, vector masks 
    cap 10[90] = PCI-Express 2 root port max data 128(256) ARI disabled
                 max read 128
                 link x1(x8) speed 2.5(5.0) ASPM disabled(L0s/L1)
    cap 01[e0] = powerspec 3  supports D0 D3  current D0
    ecap 0001[100] = AER 1 0 fatal 0 non-fatal 0 corrected
    ecap 000d[150] = ACS 1
    ecap 0000[160] = unknown 0

none0@pci0:0:8:0:	class=0x088000 rev=0x11 hdr=0x00 vendor=0x8086 device=0xd155 subvendor=0x0086 subdevice=0x0055
    vendor     = 'Intel Corporation'
    device     = 'Core Processor System Management Registers'
    class      = base peripheral
    cap 10[40] = PCI-Express 2 root endpoint max data 128(128)
                 max read 128
                 link x0(x0) ASPM disabled(L0s)
    ecap 000b[100] = Vendor [0] ID 0000 Rev 0 Length 3840

none1@pci0:0:8:1:	class=0x088000 rev=0x11 hdr=0x00 vendor=0x8086 device=0xd156 subvendor=0x0086 subdevice=0x0056
    vendor     = 'Intel Corporation'
    device     = 'Core Processor Semaphore and Scratchpad Registers'
    class      = base peripheral
    cap 10[40] = PCI-Express 2 root endpoint max data 128(128)
                 max read 128
                 link x0(x0) ASPM disabled(L0s)
    ecap 000b[100] = Vendor [0] ID 0000 Rev 0 Length 3840

none2@pci0:0:8:2:	class=0x088000 rev=0x11 hdr=0x00 vendor=0x8086 device=0xd157 subvendor=0x0086 subdevice=0x0057
    vendor     = 'Intel Corporation'
    device     = 'Core Processor System Control and Status Registers'
    class      = base peripheral
    cap 10[40] = PCI-Express 2 root endpoint max data 128(128)
                 max read 128
                 link x0(x0) ASPM disabled(L0s)
    ecap 000b[100] = Vendor [0] ID 0000 Rev 0 Length 3840

none3@pci0:0:8:3:	class=0x088000 rev=0x11 hdr=0x00 vendor=0x8086 device=0xd158 subvendor=0x0086 subdevice=0x0058
    vendor     = 'Intel Corporation'
    device     = 'Core Processor Miscellaneous Registers'
    class      = base peripheral

none4@pci0:0:16:0:	class=0x088000 rev=0x11 hdr=0x00 vendor=0x8086 device=0xd150 subvendor=0x0086 subdevice=0x0050
    vendor     = 'Intel Corporation'
    device     = 'Core Processor QPI Link'
    class      = base peripheral

none5@pci0:0:16:1:	class=0x088000 rev=0x11 hdr=0x00 vendor=0x8086 device=0xd151 subvendor=0x0086 subdevice=0x0051
    vendor     = 'Intel Corporation'
    device     = 'Core Processor QPI Routing and Protocol Registers'
    class      = base peripheral

pcib8@pci0:0:28:0:	class=0x060400 rev=0x06 hdr=0x01 vendor=0x8086 device=0x3b42 subvendor=0x8086 subdevice=0x3b42
    vendor     = 'Intel Corporation'
    device     = '5 Series/3400 Series Chipset PCI Express Root Port 1'
    class      = bridge
    subclass   = PCI-PCI
    cap 10[40] = PCI-Express 2 root port max data 128(128)
                 max read 128
                 link x1(x1) speed 2.5(2.5) ASPM disabled(L0s/L1)
                 slot 128 power limit 10000 mW HotPlug(present) surprise
    cap 05[80] = MSI supports 1 message enabled with 1 message
    cap 0d[90] = PCI Bridge subvendor=0x8086 subdevice=0x3b42
    cap 01[a0] = powerspec 2  supports D0 D3  current D0

pcib9@pci0:0:28:1:	class=0x060400 rev=0x06 hdr=0x01 vendor=0x8086 device=0x3b44 subvendor=0x8086 subdevice=0x3b44
    vendor     = 'Intel Corporation'
    device     = '5 Series/3400 Series Chipset PCI Express Root Port 2'
    class      = bridge
    subclass   = PCI-PCI
    cap 10[40] = PCI-Express 2 root port max data 128(128)
                 max read 128
                 link x1(x1) speed 2.5(2.5) ASPM disabled(L0s/L1)
                 slot 129 power limit 10000 mW HotPlug(present) surprise
    cap 05[80] = MSI supports 1 message enabled with 1 message
    cap 0d[90] = PCI Bridge subvendor=0x8086 subdevice=0x3b44
    cap 01[a0] = powerspec 2  supports D0 D3  current D0

pcib10@pci0:0:28:2:	class=0x060400 rev=0x06 hdr=0x01 vendor=0x8086 device=0x3b46 subvendor=0x8086 subdevice=0x3b46
    vendor     = 'Intel Corporation'
    device     = '5 Series/3400 Series Chipset PCI Express Root Port 3'
    class      = bridge
    subclass   = PCI-PCI
    cap 10[40] = PCI-Express 2 root port max data 128(128)
                 max read 128
                 link x1(x1) speed 2.5(2.5) ASPM disabled(L0s/L1)
                 slot 130 power limit 10000 mW HotPlug(present) surprise
    cap 05[80] = MSI supports 1 message enabled with 1 message
    cap 0d[90] = PCI Bridge subvendor=0x8086 subdevice=0x3b46
    cap 01[a0] = powerspec 2  supports D0 D3  current D0

pcib11@pci0:0:28:3:	class=0x060400 rev=0x06 hdr=0x01 vendor=0x8086 device=0x3b48 subvendor=0x8086 subdevice=0x3b48
    vendor     = 'Intel Corporation'
    device     = '5 Series/3400 Series Chipset PCI Express Root Port 4'
    class      = bridge
    subclass   = PCI-PCI
    cap 10[40] = PCI-Express 2 root port max data 128(128)
                 max read 128
                 link x1(x1) speed 2.5(2.5) ASPM disabled(L0s/L1)
                 slot 131 power limit 10000 mW HotPlug(present) surprise
    cap 05[80] = MSI supports 1 message enabled with 1 message
    cap 0d[90] = PCI Bridge subvendor=0x8086 subdevice=0x3b48
    cap 01[a0] = powerspec 2  supports D0 D3  current D0

pcib12@pci0:0:28:4:	class=0x060400 rev=0x06 hdr=0x01 vendor=0x8086 device=0x3b4a subvendor=0x8086 subdevice=0x3b4a
    vendor     = 'Intel Corporation'
    device     = '5 Series/3400 Series Chipset PCI Express Root Port 5'
    class      = bridge
    subclass   = PCI-PCI
    cap 10[40] = PCI-Express 2 root port max data 128(128)
                 max read 128
                 link x1(x1) speed 2.5(2.5) ASPM disabled(L0s/L1)
                 slot 132 power limit 10000 mW HotPlug(present) surprise
    cap 05[80] = MSI supports 1 message enabled with 1 message
    cap 0d[90] = PCI Bridge subvendor=0x8086 subdevice=0x3b4a
    cap 01[a0] = powerspec 2  supports D0 D3  current D0

pcib13@pci0:0:28:5:	class=0x060400 rev=0x06 hdr=0x01 vendor=0x8086 device=0x3b4c subvendor=0x8086 subdevice=0x3b4c
    vendor     = 'Intel Corporation'
    device     = '5 Series/3400 Series Chipset PCI Express Root Port 6'
    class      = bridge
    subclass   = PCI-PCI
    cap 10[40] = PCI-Express 2 root port max data 128(128)
                 max read 128
                 link x1(x1) speed 2.5(2.5) ASPM disabled(L0s/L1)
                 slot 133 power limit 10000 mW HotPlug(present) surprise
    cap 05[80] = MSI supports 1 message enabled with 1 message
    cap 0d[90] = PCI Bridge subvendor=0x8086 subdevice=0x3b4c
    cap 01[a0] = powerspec 2  supports D0 D3  current D0

pcib14@pci0:0:28:6:	class=0x060400 rev=0x06 hdr=0x01 vendor=0x8086 device=0x3b4e subvendor=0x8086 subdevice=0x3b4e
    vendor     = 'Intel Corporation'
    device     = '5 Series/3400 Series Chipset PCI Express Root Port 7'
    class      = bridge
    subclass   = PCI-PCI
    cap 10[40] = PCI-Express 2 root port max data 128(128)
                 max read 128
                 link x1(x1) speed 2.5(2.5) ASPM disabled(L0s/L1)
                 slot 134 power limit 10000 mW HotPlug(present) surprise
    cap 05[80] = MSI supports 1 message enabled with 1 message
    cap 0d[90] = PCI Bridge subvendor=0x8086 subdevice=0x3b4e
    cap 01[a0] = powerspec 2  supports D0 D3  current D0

pcib15@pci0:0:28:7:	class=0x060400 rev=0x06 hdr=0x01 vendor=0x8086 device=0x3b50 subvendor=0x8086 subdevice=0x3b50
    vendor     = 'Intel Corporation'
    device     = '5 Series/3400 Series Chipset PCI Express Root Port 8'
    class      = bridge
    subclass   = PCI-PCI
    cap 10[40] = PCI-Express 2 root port max data 128(128)
                 max read 128
                 link x1(x1) speed 2.5(2.5) ASPM disabled(L0s/L1)
                 slot 135 power limit 10000 mW HotPlug(present) surprise
    cap 05[80] = MSI supports 1 message enabled with 1 message
    cap 0d[90] = PCI Bridge subvendor=0x8086 subdevice=0x3b50
    cap 01[a0] = powerspec 2  supports D0 D3  current D0

ehci0@pci0:0:29:0:	class=0x0c0320 rev=0x06 hdr=0x00 vendor=0x8086 device=0x3b34 subvendor=0x8086 subdevice=0x3b34
    vendor     = 'Intel Corporation'
    device     = '5 Series/3400 Series Chipset USB2 Enhanced Host Controller'
    class      = serial bus
    subclass   = USB
    bar   [10] = type Memory, range 32, base 0xfa7fc000, size 1024, enabled
    cap 01[50] = powerspec 2  supports D0 D3  current D0
    cap 0a[58] = EHCI Debug Port at offset 0xa0 in map 0x14
    cap 13[98] = PCI Advanced Features: FLR TP

pcib16@pci0:0:30:0:	class=0x060401 rev=0xa6 hdr=0x01 vendor=0x8086 device=0x244e subvendor=0x8086 subdevice=0x244e
    vendor     = 'Intel Corporation'
    device     = '82801 PCI Bridge'
    class      = bridge
    subclass   = PCI-PCI
    cap 0d[50] = PCI Bridge subvendor=0x8086 subdevice=0x244e

isab0@pci0:0:31:0:	class=0x060100 rev=0x06 hdr=0x00 vendor=0x8086 device=0x3b16 subvendor=0x8086 subdevice=0x3b16
    vendor     = 'Intel Corporation'
    device     = '3450 Chipset LPC Interface Controller'
    class      = bridge
    subclass   = PCI-ISA
    cap 09[e0] = vendor (length 16) Intel cap 1 version 1

ahci0@pci0:0:31:2:	class=0x010601 rev=0x06 hdr=0x00 vendor=0x8086 device=0x3b22 subvendor=0x8086 subdevice=0x3b22
    vendor     = 'Intel Corporation'
    device     = '5 Series/3400 Series Chipset 6 port SATA AHCI Controller'
    class      = mass storage
    subclass   = SATA
    bar   [10] = type I/O Port, range 32, base 0x3c00, size 8, enabled
    bar   [14] = type I/O Port, range 32, base 0x3880, size 4, enabled
    bar   [18] = type I/O Port, range 32, base 0x3800, size 8, enabled
    bar   [1c] = type I/O Port, range 32, base 0x3480, size 4, enabled
    bar   [20] = type I/O Port, range 32, base 0x3400, size 32, enabled
    bar   [24] = type Memory, range 32, base 0xfa7fa000, size 2048, enabled
    cap 05[80] = MSI supports 1 message enabled with 1 message
    cap 01[70] = powerspec 3  supports D0 D3  current D0
    cap 12[a8] = SATA Index-Data Pair
    cap 13[b0] = PCI Advanced Features: FLR TP

ichsmb0@pci0:0:31:3:	class=0x0c0500 rev=0x06 hdr=0x00 vendor=0x8086 device=0x3b30 subvendor=0x8086 subdevice=0x3b30
    vendor     = 'Intel Corporation'
    device     = '5 Series/3400 Series Chipset SMBus Controller'
    class      = serial bus
    subclass   = SMBus
    bar   [10] = type Memory, range 64, base 0xfa7ff800, size 256, enabled
    bar   [20] = type I/O Port, range 32, base 0x400, size 32, enabled

pcib2@pci0:1:0:0:	class=0x060400 rev=0xbb hdr=0x01 vendor=0x10b5 device=0x8616 subvendor=0x10b5 subdevice=0x8616
    vendor     = 'PLX Technology, Inc.'
    device     = 'PEX 8616 16-lane, 4-Port PCI Express Gen 2 (5.0 GT/s) Switch'
    class      = bridge
    subclass   = PCI-PCI
    bar   [10] = type Memory, range 32, base 0xfa8e0000, size 131072, enabled
    cap 01[40] = powerspec 3  supports D0 D3  current D0
    cap 05[48] = MSI supports 4 messages, 64 bit, vector masks 
    cap 10[68] = PCI-Express 2 upstream port max data 128(2048)
                 max read 128
                 link x8(x8) speed 5.0(5.0) ASPM disabled(L0s/L1)
    cap 0d[a4] = PCI Bridge subvendor=0x10b5 subdevice=0x8616
    ecap 0003[100] = Serial 1 aa860010b5df0e00
    ecap 0001[fb4] = AER 1 0 fatal 0 non-fatal 2 corrected
    ecap 0004[138] = Power Budgeting 1
    ecap 0002[148] = VC 1 max VC0
    ecap 000b[448] = Vendor [1] ID 0000 Rev 0 Length 204
    ecap 000b[950] = Vendor [1] ID 0001 Rev 0 Length 16

pcib3@pci0:2:4:0:	class=0x060400 rev=0xbb hdr=0x01 vendor=0x10b5 device=0x8616 subvendor=0x10b5 subdevice=0x8616
    vendor     = 'PLX Technology, Inc.'
    device     = 'PEX 8616 16-lane, 4-Port PCI Express Gen 2 (5.0 GT/s) Switch'
    class      = bridge
    subclass   = PCI-PCI
    cap 01[40] = powerspec 3  supports D0 D3  current D0
    cap 05[48] = MSI supports 4 messages, 64 bit, vector masks 
    cap 10[68] = PCI-Express 2 downstream port max data 128(2048) ARI disabled
                 max read 128
                 link x0(x8) speed 0.0(5.0) ASPM disabled(L0s/L1)
                 slot 4 power limit 25000 mW
    cap 0d[a4] = PCI Bridge subvendor=0x10b5 subdevice=0x8616
    ecap 0003[100] = Serial 1 aa860010b5df0e00
    ecap 0001[fb4] = AER 1 0 fatal 0 non-fatal 1 corrected
    ecap 0002[148] = VC 1 max VC0
    ecap 000d[520] = ACS 1
    ecap 000b[950] = Vendor [1] ID 0001 Rev 0 Length 16

pcib4@pci0:2:5:0:	class=0x060400 rev=0xbb hdr=0x01 vendor=0x10b5 device=0x8616 subvendor=0x10b5 subdevice=0x8616
    vendor     = 'PLX Technology, Inc.'
    device     = 'PEX 8616 16-lane, 4-Port PCI Express Gen 2 (5.0 GT/s) Switch'
    class      = bridge
    subclass   = PCI-PCI
    cap 01[40] = powerspec 3  supports D0 D3  current D0
    cap 05[48] = MSI supports 4 messages, 64 bit, vector masks 
    cap 10[68] = PCI-Express 2 downstream port max data 128(2048) ARI disabled
                 max read 128
                 link x4(x4) speed 5.0(5.0) ASPM disabled(L0s/L1)
                 slot 5 power limit 25000 mW HotPlug(present) Attn Button PC(off) MRL(open)
    cap 0d[a4] = PCI Bridge subvendor=0x10b5 subdevice=0x8616
    ecap 0003[100] = Serial 1 aa860010b5df0e00
    ecap 0001[fb4] = AER 1 0 fatal 0 non-fatal 1 corrected
    ecap 0002[148] = VC 1 max VC0
    ecap 000d[520] = ACS 1
    ecap 000b[950] = Vendor [1] ID 0001 Rev 0 Length 16

pcib5@pci0:2:6:0:	class=0x060400 rev=0xbb hdr=0x01 vendor=0x10b5 device=0x8616 subvendor=0x10b5 subdevice=0x8616
    vendor     = 'PLX Technology, Inc.'
    device     = 'PEX 8616 16-lane, 4-Port PCI Express Gen 2 (5.0 GT/s) Switch'
    class      = bridge
    subclass   = PCI-PCI
    cap 01[40] = powerspec 3  supports D0 D3  current D0
    cap 05[48] = MSI supports 4 messages, 64 bit, vector masks 
    cap 10[68] = PCI-Express 2 downstream port max data 128(2048) ARI disabled
                 max read 128
                 link x4(x4) speed 5.0(5.0) ASPM disabled(L0s/L1)
                 slot 6 power limit 25000 mW
    cap 0d[a4] = PCI Bridge subvendor=0x10b5 subdevice=0x8616
    ecap 0003[100] = Serial 1 aa860010b5df0e00
    ecap 0001[fb4] = AER 1 0 fatal 0 non-fatal 1 corrected
    ecap 0002[148] = VC 1 max VC0
    ecap 000d[520] = ACS 1
    ecap 000b[950] = Vendor [1] ID 0001 Rev 0 Length 16

igb0@pci0:4:0:0:	class=0x020000 rev=0x01 hdr=0x00 vendor=0x8086 device=0x150e subvendor=0x15bb subdevice=0x0000
    vendor     = 'Intel Corporation'
    device     = '82580 Gigabit Network Connection'
    class      = network
    subclass   = ethernet
    bar   [10] = type Memory, range 32, base 0xfab80000, size 524288, enabled
    bar   [18] = type I/O Port, range 32, base 0x4c00, size 32, enabled
    bar   [1c] = type Memory, range 32, base 0xfab7c000, size 16384, enabled
    cap 01[40] = powerspec 3  supports D0 D3  current D0
    cap 05[50] = MSI supports 1 message, 64 bit, vector masks 
    cap 11[70] = MSI-X supports 10 messages, enabled
                 Table in map 0x1c[0x0], PBA in map 0x1c[0x2000]
    cap 10[a0] = PCI-Express 2 endpoint max data 128(512) FLR RO NS
                 max read 512
                 link x4(x4) speed 5.0(5.0) ASPM disabled(L0s/L1)
    ecap 0001[100] = AER 1 0 fatal 0 non-fatal 1 corrected
    ecap 0003[140] = Serial 1 001c7fffff37b3d2
    ecap 0017[1a0] = TPH Requester 1
    ecap 0018[1c0] = LTR 1

igb1@pci0:4:0:1:	class=0x020000 rev=0x01 hdr=0x00 vendor=0x8086 device=0x150e subvendor=0x15bb subdevice=0x0000
    vendor     = 'Intel Corporation'
    device     = '82580 Gigabit Network Connection'
    class      = network
    subclass   = ethernet
    bar   [10] = type Memory, range 32, base 0xfaa80000, size 524288, enabled
    bar   [18] = type I/O Port, range 32, base 0x4880, size 32, enabled
    bar   [1c] = type Memory, range 32, base 0xfab78000, size 16384, enabled
    cap 01[40] = powerspec 3  supports D0 D3  current D0
    cap 05[50] = MSI supports 1 message, 64 bit, vector masks 
    cap 11[70] = MSI-X supports 10 messages, enabled
                 Table in map 0x1c[0x0], PBA in map 0x1c[0x2000]
    cap 10[a0] = PCI-Express 2 endpoint max data 128(512) FLR RO NS
                 max read 512
                 link x4(x4) speed 5.0(5.0) ASPM disabled(L0s/L1)
    ecap 0001[100] = AER 1 0 fatal 0 non-fatal 1 corrected
    ecap 0003[140] = Serial 1 001c7fffff37b3d2
    ecap 0017[1a0] = TPH Requester 1

igb2@pci0:4:0:2:	class=0x020000 rev=0x01 hdr=0x00 vendor=0x8086 device=0x150e subvendor=0x15bb subdevice=0x0000
    vendor     = 'Intel Corporation'
    device     = '82580 Gigabit Network Connection'
    class      = network
    subclass   = ethernet
    bar   [10] = type Memory, range 32, base 0xfaa00000, size 524288, enabled
    bar   [18] = type I/O Port, range 32, base 0x4800, size 32, enabled
    bar   [1c] = type Memory, range 32, base 0xfab74000, size 16384, enabled
    cap 01[40] = powerspec 3  supports D0 D3  current D0
    cap 05[50] = MSI supports 1 message, 64 bit, vector masks 
    cap 11[70] = MSI-X supports 10 messages, enabled
                 Table in map 0x1c[0x0], PBA in map 0x1c[0x2000]
    cap 10[a0] = PCI-Express 2 endpoint max data 128(512) FLR RO NS
                 max read 512
                 link x4(x4) speed 5.0(5.0) ASPM disabled(L0s/L1)
    ecap 0001[100] = AER 1 0 fatal 0 non-fatal 1 corrected
    ecap 0003[140] = Serial 1 001c7fffff37b3d2
    ecap 0017[1a0] = TPH Requester 1

igb3@pci0:4:0:3:	class=0x020000 rev=0x01 hdr=0x00 vendor=0x8086 device=0x150e subvendor=0x15bb subdevice=0x0000
    vendor     = 'Intel Corporation'
    device     = '82580 Gigabit Network Connection'
    class      = network
    subclass   = ethernet
    bar   [10] = type Memory, range 32, base 0xfa980000, size 524288, enabled
    bar   [18] = type I/O Port, range 32, base 0x4480, size 32, enabled
    bar   [1c] = type Memory, range 32, base 0xfab70000, size 16384, enabled
    cap 01[40] = powerspec 3  supports D0 D3  current D0
    cap 05[50] = MSI supports 1 message, 64 bit, vector masks 
    cap 11[70] = MSI-X supports 10 messages, enabled
                 Table in map 0x1c[0x0], PBA in map 0x1c[0x2000]
    cap 10[a0] = PCI-Express 2 endpoint max data 128(512) FLR RO NS
                 max read 512
                 link x4(x4) speed 5.0(5.0) ASPM disabled(L0s/L1)
    ecap 0001[100] = AER 1 0 fatal 0 non-fatal 1 corrected
    ecap 0003[140] = Serial 1 001c7fffff37b3d2
    ecap 0017[1a0] = TPH Requester 1

igb4@pci0:5:0:0:	class=0x020000 rev=0x01 hdr=0x00 vendor=0x8086 device=0x150e subvendor=0x15bb subdevice=0x0000
    vendor     = 'Intel Corporation'
    device     = '82580 Gigabit Network Connection'
    class      = network
    subclass   = ethernet
    bar   [10] = type Memory, range 32, base 0xfae80000, size 524288, enabled
    bar   [18] = type I/O Port, range 32, base 0x5c00, size 32, enabled
    bar   [1c] = type Memory, range 32, base 0xfae7c000, size 16384, enabled
    cap 01[40] = powerspec 3  supports D0 D3  current D0
    cap 05[50] = MSI supports 1 message, 64 bit, vector masks 
    cap 11[70] = MSI-X supports 10 messages, enabled
                 Table in map 0x1c[0x0], PBA in map 0x1c[0x2000]
    cap 10[a0] = PCI-Express 2 endpoint max data 128(512) FLR RO NS
                 max read 512
                 link x4(x4) speed 5.0(5.0) ASPM disabled(L0s/L1)
    ecap 0001[100] = AER 1 0 fatal 0 non-fatal 1 corrected
    ecap 0003[140] = Serial 1 001c7fffff37b3d6
    ecap 0017[1a0] = TPH Requester 1
    ecap 0018[1c0] = LTR 1

igb5@pci0:5:0:1:	class=0x020000 rev=0x01 hdr=0x00 vendor=0x8086 device=0x150e subvendor=0x15bb subdevice=0x0000
    vendor     = 'Intel Corporation'
    device     = '82580 Gigabit Network Connection'
    class      = network
    subclass   = ethernet
    bar   [10] = type Memory, range 32, base 0xfad80000, size 524288, enabled
    bar   [18] = type I/O Port, range 32, base 0x5880, size 32, enabled
    bar   [1c] = type Memory, range 32, base 0xfae78000, size 16384, enabled
    cap 01[40] = powerspec 3  supports D0 D3  current D0
    cap 05[50] = MSI supports 1 message, 64 bit, vector masks 
    cap 11[70] = MSI-X supports 10 messages, enabled
                 Table in map 0x1c[0x0], PBA in map 0x1c[0x2000]
    cap 10[a0] = PCI-Express 2 endpoint max data 128(512) FLR RO NS
                 max read 512
                 link x4(x4) speed 5.0(5.0) ASPM disabled(L0s/L1)
    ecap 0001[100] = AER 1 0 fatal 0 non-fatal 1 corrected
    ecap 0003[140] = Serial 1 001c7fffff37b3d6
    ecap 0017[1a0] = TPH Requester 1

igb6@pci0:5:0:2:	class=0x020000 rev=0x01 hdr=0x00 vendor=0x8086 device=0x150e subvendor=0x15bb subdevice=0x0000
    vendor     = 'Intel Corporation'
    device     = '82580 Gigabit Network Connection'
    class      = network
    subclass   = ethernet
    bar   [10] = type Memory, range 32, base 0xfad00000, size 524288, enabled
    bar   [18] = type I/O Port, range 32, base 0x5800, size 32, enabled
    bar   [1c] = type Memory, range 32, base 0xfae74000, size 16384, enabled
    cap 01[40] = powerspec 3  supports D0 D3  current D0
    cap 05[50] = MSI supports 1 message, 64 bit, vector masks 
    cap 11[70] = MSI-X supports 10 messages, enabled
                 Table in map 0x1c[0x0], PBA in map 0x1c[0x2000]
    cap 10[a0] = PCI-Express 2 endpoint max data 128(512) FLR RO NS
                 max read 512
                 link x4(x4) speed 5.0(5.0) ASPM disabled(L0s/L1)
    ecap 0001[100] = AER 1 0 fatal 0 non-fatal 1 corrected
    ecap 0003[140] = Serial 1 001c7fffff37b3d6
    ecap 0017[1a0] = TPH Requester 1

igb7@pci0:5:0:3:	class=0x020000 rev=0x01 hdr=0x00 vendor=0x8086 device=0x150e subvendor=0x15bb subdevice=0x0000
    vendor     = 'Intel Corporation'
    device     = '82580 Gigabit Network Connection'
    class      = network
    subclass   = ethernet
    bar   [10] = type Memory, range 32, base 0xfac80000, size 524288, enabled
    bar   [18] = type I/O Port, range 32, base 0x5480, size 32, enabled
    bar   [1c] = type Memory, range 32, base 0xfae70000, size 16384, enabled
    cap 01[40] = powerspec 3  supports D0 D3  current D0
    cap 05[50] = MSI supports 1 message, 64 bit, vector masks 
    cap 11[70] = MSI-X supports 10 messages, enabled
                 Table in map 0x1c[0x0], PBA in map 0x1c[0x2000]
    cap 10[a0] = PCI-Express 2 endpoint max data 128(512) FLR RO NS
                 max read 512
                 link x4(x4) speed 5.0(5.0) ASPM disabled(L0s/L1)
    ecap 0001[100] = AER 1 0 fatal 0 non-fatal 1 corrected
    ecap 0003[140] = Serial 1 001c7fffff37b3d6
    ecap 0017[1a0] = TPH Requester 1

pcib7@pci0:6:0:0:	class=0x060400 rev=0x02 hdr=0x01 vendor=0x1a03 device=0x1150 subvendor=0x1a03 subdevice=0x1150
    vendor     = 'ASPEED Technology, Inc.'
    device     = 'AST1150 PCI-to-PCI Bridge'
    class      = bridge
    subclass   = PCI-PCI
    cap 05[50] = MSI supports 1 message, 64 bit 
    cap 01[78] = powerspec 3  supports D0 D1 D2 D3  current D0
    cap 10[80] = PCI-Express 1 PCI bridge max data 128(128) RO NS
                 max read 512
                 link x1(x1) speed 2.5(2.5) ASPM disabled(L0s/L1)
    cap 0d[a4] = PCI Bridge subvendor=0x1a03 subdevice=0x1150
    ecap 0002[100] = VC 1 max VC0

vgapci0@pci0:7:0:0:	class=0x030000 rev=0x21 hdr=0x00 vendor=0x1a03 device=0x2000 subvendor=0x1a03 subdevice=0x2000
    vendor     = 'ASPEED Technology, Inc.'
    device     = 'ASPEED Graphics Family'
    class      = display
    subclass   = VGA
    bar   [10] = type Memory, range 32, base 0xfb000000, size 8388608, enabled
    bar   [14] = type Memory, range 32, base 0xfafe0000, size 131072, enabled
    bar   [18] = type I/O Port, range 32, base 0x6c00, size 128, enabled
    cap 01[40] = powerspec 3  supports D0 D1 D2 D3  current D0

em0@pci0:8:0:0:	class=0x020000 rev=0x00 hdr=0x00 vendor=0x8086 device=0x10d3 subvendor=0x15bb subdevice=0x0000
    vendor     = 'Intel Corporation'
    device     = '82574L Gigabit Network Connection'
    class      = network
    subclass   = ethernet
    bar   [10] = type Memory, range 32, base 0xfb8e0000, size 131072, enabled
    bar   [18] = type I/O Port, range 32, base 0x7c00, size 32, enabled
    bar   [1c] = type Memory, range 32, base 0xfb8dc000, size 16384, enabled
    cap 01[c8] = powerspec 2  supports D0 D3  current D0
    cap 05[d0] = MSI supports 1 message, 64 bit 
    cap 10[e0] = PCI-Express 1 endpoint max data 128(256) RO NS
                 max read 512
                 link x1(x1) speed 2.5(2.5) ASPM disabled(L0s/L1)
    cap 11[a0] = MSI-X supports 5 messages, enabled
                 Table in map 0x1c[0x0], PBA in map 0x1c[0x2000]
    ecap 0001[100] = AER 1 0 fatal 0 non-fatal 1 corrected
    ecap 0003[140] = Serial 1 001c7fffff36ba5a

em1@pci0:9:0:0:	class=0x020000 rev=0x00 hdr=0x00 vendor=0x8086 device=0x10d3 subvendor=0x15bb subdevice=0x0000
    vendor     = 'Intel Corporation'
    device     = '82574L Gigabit Network Connection'
    class      = network
    subclass   = ethernet
    bar   [10] = type Memory, range 32, base 0xfb9e0000, size 131072, enabled
    bar   [18] = type I/O Port, range 32, base 0x8c00, size 32, enabled
    bar   [1c] = type Memory, range 32, base 0xfb9dc000, size 16384, enabled
    cap 01[c8] = powerspec 2  supports D0 D3  current D0
    cap 05[d0] = MSI supports 1 message, 64 bit 
    cap 10[e0] = PCI-Express 1 endpoint max data 128(256) RO NS
                 max read 512
                 link x1(x1) speed 2.5(2.5) ASPM disabled(L0s/L1)
    cap 11[a0] = MSI-X supports 5 messages, enabled
                 Table in map 0x1c[0x0], PBA in map 0x1c[0x2000]
    ecap 0001[100] = AER 1 0 fatal 0 non-fatal 1 corrected
    ecap 0003[140] = Serial 1 001c7fffff36ba5b

em2@pci0:10:0:0:	class=0x020000 rev=0x00 hdr=0x00 vendor=0x8086 device=0x10d3 subvendor=0x15bb subdevice=0x0000
    vendor     = 'Intel Corporation'
    device     = '82574L Gigabit Network Connection'
    class      = network
    subclass   = ethernet
    bar   [10] = type Memory, range 32, base 0xfbae0000, size 131072, enabled
    bar   [18] = type I/O Port, range 32, base 0x9c00, size 32, enabled
    bar   [1c] = type Memory, range 32, base 0xfbadc000, size 16384, enabled
    cap 01[c8] = powerspec 2  supports D0 D3  current D0
    cap 05[d0] = MSI supports 1 message, 64 bit 
    cap 10[e0] = PCI-Express 1 endpoint max data 128(256) RO NS
                 max read 512
                 link x1(x1) speed 2.5(2.5) ASPM disabled(L0s/L1)
    cap 11[a0] = MSI-X supports 5 messages, enabled
                 Table in map 0x1c[0x0], PBA in map 0x1c[0x2000]
    ecap 0001[100] = AER 1 0 fatal 0 non-fatal 1 corrected
    ecap 0003[140] = Serial 1 001c7fffff36ba5c

em3@pci0:11:0:0:	class=0x020000 rev=0x00 hdr=0x00 vendor=0x8086 device=0x10d3 subvendor=0x15bb subdevice=0x0000
    vendor     = 'Intel Corporation'
    device     = '82574L Gigabit Network Connection'
    class      = network
    subclass   = ethernet
    bar   [10] = type Memory, range 32, base 0xfbbe0000, size 131072, enabled
    bar   [18] = type I/O Port, range 32, base 0xac00, size 32, enabled
    bar   [1c] = type Memory, range 32, base 0xfbbdc000, size 16384, enabled
    cap 01[c8] = powerspec 2  supports D0 D3  current D0
    cap 05[d0] = MSI supports 1 message, 64 bit 
    cap 10[e0] = PCI-Express 1 endpoint max data 128(256) RO NS
                 max read 512
                 link x1(x1) speed 2.5(2.5) ASPM disabled(L0s/L1)
    cap 11[a0] = MSI-X supports 5 messages, enabled
                 Table in map 0x1c[0x0], PBA in map 0x1c[0x2000]
    ecap 0001[100] = AER 1 0 fatal 0 non-fatal 1 corrected
    ecap 0003[140] = Serial 1 001c7fffff36ba5d

em4@pci0:12:0:0:	class=0x020000 rev=0x00 hdr=0x00 vendor=0x8086 device=0x10d3 subvendor=0x15bb subdevice=0x0000
    vendor     = 'Intel Corporation'
    device     = '82574L Gigabit Network Connection'
    class      = network
    subclass   = ethernet
    bar   [10] = type Memory, range 32, base 0xfbce0000, size 131072, enabled
    bar   [18] = type I/O Port, range 32, base 0xbc00, size 32, enabled
    bar   [1c] = type Memory, range 32, base 0xfbcdc000, size 16384, enabled
    cap 01[c8] = powerspec 2  supports D0 D3  current D0
    cap 05[d0] = MSI supports 1 message, 64 bit 
    cap 10[e0] = PCI-Express 1 endpoint max data 128(256) RO NS
                 max read 512
                 link x1(x1) speed 2.5(2.5) ASPM disabled(L0s/L1)
    cap 11[a0] = MSI-X supports 5 messages, enabled
                 Table in map 0x1c[0x0], PBA in map 0x1c[0x2000]
    ecap 0001[100] = AER 1 0 fatal 0 non-fatal 1 corrected
    ecap 0003[140] = Serial 1 001c7fffff36ba5e

em5@pci0:13:0:0:	class=0x020000 rev=0x00 hdr=0x00 vendor=0x8086 device=0x10d3 subvendor=0x15bb subdevice=0x0000
    vendor     = 'Intel Corporation'
    device     = '82574L Gigabit Network Connection'
    class      = network
    subclass   = ethernet
    bar   [10] = type Memory, range 32, base 0xfbde0000, size 131072, enabled
    bar   [18] = type I/O Port, range 32, base 0xcc00, size 32, enabled
    bar   [1c] = type Memory, range 32, base 0xfbddc000, size 16384, enabled
    cap 01[c8] = powerspec 2  supports D0 D3  current D0
    cap 05[d0] = MSI supports 1 message, 64 bit 
    cap 10[e0] = PCI-Express 1 endpoint max data 128(256) RO NS
                 max read 512
                 link x1(x1) speed 2.5(2.5) ASPM disabled(L0s/L1)
    cap 11[a0] = MSI-X supports 5 messages, enabled
                 Table in map 0x1c[0x0], PBA in map 0x1c[0x2000]
    ecap 0001[100] = AER 1 0 fatal 0 non-fatal 1 corrected
    ecap 0003[140] = Serial 1 001c7fffff36ba5f

em6@pci0:14:0:0:	class=0x020000 rev=0x00 hdr=0x00 vendor=0x8086 device=0x10d3 subvendor=0x15bb subdevice=0x0000
    vendor     = 'Intel Corporation'
    device     = '82574L Gigabit Network Connection'
    class      = network
    subclass   = ethernet
    bar   [10] = type Memory, range 32, base 0xfbee0000, size 131072, enabled
    bar   [18] = type I/O Port, range 32, base 0xdc00, size 32, enabled
    bar   [1c] = type Memory, range 32, base 0xfbedc000, size 16384, enabled
    cap 01[c8] = powerspec 2  supports D0 D3  current D0
    cap 05[d0] = MSI supports 1 message, 64 bit 
    cap 10[e0] = PCI-Express 1 endpoint max data 128(256) RO NS
                 max read 512
                 link x1(x1) speed 2.5(2.5) ASPM disabled(L0s/L1)
    cap 11[a0] = MSI-X supports 5 messages, enabled
                 Table in map 0x1c[0x0], PBA in map 0x1c[0x2000]
    ecap 0001[100] = AER 1 0 fatal 0 non-fatal 1 corrected
    ecap 0003[140] = Serial 1 001c7fffff36ba60

em7@pci0:15:0:0:	class=0x020000 rev=0x00 hdr=0x00 vendor=0x8086 device=0x10d3 subvendor=0x15bb subdevice=0x0000
    vendor     = 'Intel Corporation'
    device     = '82574L Gigabit Network Connection'
    class      = network
    subclass   = ethernet
    bar   [10] = type Memory, range 32, base 0xfbfe0000, size 131072, enabled
    bar   [18] = type I/O Port, range 32, base 0xec00, size 32, enabled
    bar   [1c] = type Memory, range 32, base 0xfbfdc000, size 16384, enabled
    cap 01[c8] = powerspec 2  supports D0 D3  current D0
    cap 05[d0] = MSI supports 1 message, 64 bit 
    cap 10[e0] = PCI-Express 1 endpoint max data 128(256) RO NS
                 max read 512
                 link x1(x1) speed 2.5(2.5) ASPM disabled(L0s/L1)
    cap 11[a0] = MSI-X supports 5 messages, enabled
                 Table in map 0x1c[0x0], PBA in map 0x1c[0x2000]
    ecap 0001[100] = AER 1 0 fatal 0 non-fatal 1 corrected
    ecap 0003[140] = Serial 1 001c7fffff36ba61
