hostb0@pci0:0:0:0:	class=0x060000 rev=0x09 hdr=0x00 vendor=0x8086 device=0x0100 subvendor=0x1028 subdevice=0x04f5
    vendor     = 'Intel Corporation'
    device     = '2nd Generation Core Processor Family DRAM Controller'
    class      = bridge
    subclass   = HOST-PCI
    cap 09[e0] = vendor (length 12) Intel cap 0 version 1

pcib1@pci0:0:1:0:	class=0x060400 rev=0x09 hdr=0x01 vendor=0x8086 device=0x0101 subvendor=0x1028 subdevice=0x04f5
    vendor     = 'Intel Corporation'
    device     = 'Xeon E3-1200/2nd Generation Core Processor Family PCI Express Root Port'
    class      = bridge
    subclass   = PCI-PCI
    cap 0d[88] = PCI Bridge subvendor=0x1028 subdevice=0x04f5
    cap 01[80] = powerspec 3  supports D0 D3  current D0
    cap 05[90] = MSI supports 1 message 
    cap 10[a0] = PCI-Express 2 root port max data 128(128)
                 max read 128
                 link x8(x16) speed 5.0(5.0) ASPM L0s/L1(L0s/L1)
                 slot 1 power limit 75000 mW
    ecap 0002[100] = VC 1 max VC0
    ecap 0005[140] = Root Complex Link Declaration 1

none0@pci0:0:22:0:	class=0x078000 rev=0x04 hdr=0x00 vendor=0x8086 device=0x1c3a subvendor=0x1028 subdevice=0x04f5
    vendor     = 'Intel Corporation'
    device     = '6 Series/C200 Series Chipset Family MEI Controller'
    class      = simple comms
    bar   [10] = type Memory, range 64, base 0xe1660000, size 16, enabled
    cap 01[50] = powerspec 3  supports D0 D3  current D0
    cap 05[8c] = MSI supports 1 message, 64 bit 

ehci0@pci0:0:26:0:	class=0x0c0320 rev=0x04 hdr=0x00 vendor=0x8086 device=0x1c2d subvendor=0x1028 subdevice=0x04f5
    vendor     = 'Intel Corporation'
    device     = '6 Series/C200 Series Chipset Family USB Enhanced Host Controller'
    class      = serial bus
    subclass   = USB
    bar   [10] = type Memory, range 32, base 0xe1640000, size 1024, enabled
    cap 01[50] = powerspec 2  supports D0 D3  current D0
    cap 0a[58] = EHCI Debug Port at offset 0xa0 in map 0x14
    cap 13[98] = PCI Advanced Features: FLR TP

hdac0@pci0:0:27:0:	class=0x040300 rev=0x04 hdr=0x00 vendor=0x8086 device=0x1c20 subvendor=0x1028 subdevice=0x04f5
    vendor     = 'Intel Corporation'
    device     = '6 Series/C200 Series Chipset Family High Definition Audio Controller'
    class      = multimedia
    subclass   = HDA
    bar   [10] = type Memory, range 64, base 0xe1630000, size 16384, enabled
    cap 01[50] = powerspec 2  supports D0 D3  current D0
    cap 05[60] = MSI supports 1 message, 64 bit enabled with 1 message
    cap 10[70] = PCI-Express 1 root endpoint max data 128(128) FLR NS
                 max read 128
    ecap 0002[100] = VC 1 max VC1
    ecap 0005[130] = Root Complex Link Declaration 1

pcib2@pci0:0:28:0:	class=0x060400 rev=0xb4 hdr=0x01 vendor=0x8086 device=0x1c10 subvendor=0x1028 subdevice=0x04f5
    vendor     = 'Intel Corporation'
    device     = '6 Series/C200 Series Chipset Family PCI Express Root Port 1'
    class      = bridge
    subclass   = PCI-PCI
    cap 10[40] = PCI-Express 2 root port max data 128(128)
                 max read 128
                 link x0(x1) speed 0.0(5.0) ASPM L0s/L1(L0s/L1)
                 slot 0 power limit 100 mW
    cap 05[80] = MSI supports 1 message 
    cap 0d[90] = PCI Bridge subvendor=0x1028 subdevice=0x04f5
    cap 01[a0] = powerspec 2  supports D0 D3  current D0

pcib3@pci0:0:28:2:	class=0x060400 rev=0xb4 hdr=0x01 vendor=0x8086 device=0x1c14 subvendor=0x1028 subdevice=0x04f5
    vendor     = 'Intel Corporation'
    device     = '6 Series/C200 Series Chipset Family PCI Express Root Port 3'
    class      = bridge
    subclass   = PCI-PCI
    cap 10[40] = PCI-Express 2 root port max data 128(128)
                 max read 128
                 link x0(x1) speed 0.0(5.0) ASPM L0s/L1(L0s/L1)
                 slot 2 power limit 100 mW HotPlug(empty) surprise
    cap 05[80] = MSI supports 1 message enabled with 1 message
    cap 0d[90] = PCI Bridge subvendor=0x1028 subdevice=0x04f5
    cap 01[a0] = powerspec 2  supports D0 D3  current D0

pcib4@pci0:0:28:4:	class=0x060400 rev=0xb4 hdr=0x01 vendor=0x8086 device=0x1c18 subvendor=0x1028 subdevice=0x04f5
    vendor     = 'Intel Corporation'
    device     = '6 Series/C200 Series Chipset Family PCI Express Root Port 5'
    class      = bridge
    subclass   = PCI-PCI
    cap 10[40] = PCI-Express 2 root port max data 128(128)
                 max read 128
                 link x1(x1) speed 2.5(5.0) ASPM L1(L0s/L1)
                 slot 4 power limit 100 mW
    cap 05[80] = MSI supports 1 message 
    cap 0d[90] = PCI Bridge subvendor=0x1028 subdevice=0x04f5
    cap 01[a0] = powerspec 2  supports D0 D3  current D0

ehci1@pci0:0:29:0:	class=0x0c0320 rev=0x04 hdr=0x00 vendor=0x8086 device=0x1c26 subvendor=0x1028 subdevice=0x04f5
    vendor     = 'Intel Corporation'
    device     = '6 Series/C200 Series Chipset Family USB Enhanced Host Controller'
    class      = serial bus
    subclass   = USB
    bar   [10] = type Memory, range 32, base 0xe1620000, size 1024, enabled
    cap 01[50] = powerspec 2  supports D0 D3  current D0
    cap 0a[58] = EHCI Debug Port at offset 0xa0 in map 0x14
    cap 13[98] = PCI Advanced Features: FLR TP

isab0@pci0:0:31:0:	class=0x060100 rev=0x04 hdr=0x00 vendor=0x8086 device=0x1c5c subvendor=0x1028 subdevice=0x04f5
    vendor     = 'Intel Corporation'
    device     = 'H61 Express Chipset LPC Controller'
    class      = bridge
    subclass   = PCI-ISA
    cap 09[e0] = vendor (length 12) Intel cap 1 version 0
		 features: AMT, 4 PCI-e x1 slots

atapci0@pci0:0:31:2:	class=0x01018f rev=0x04 hdr=0x00 vendor=0x8086 device=0x1c00 subvendor=0x1028 subdevice=0x04f5
    vendor     = 'Intel Corporation'
    device     = '6 Series/C200 Series Chipset Family Desktop SATA Controller (IDE mode, ports 0-3)'
    class      = mass storage
    subclass   = ATA
    bar   [10] = type I/O Port, range 32, base 0x50d0, size 8, enabled
    bar   [14] = type I/O Port, range 32, base 0x50c0, size 4, enabled
    bar   [18] = type I/O Port, range 32, base 0x50b0, size 8, enabled
    bar   [1c] = type I/O Port, range 32, base 0x50a0, size 4, enabled
    bar   [20] = type I/O Port, range 32, base 0x5090, size 16, enabled
    bar   [24] = type I/O Port, range 32, base 0x5080, size 16, enabled
    cap 01[70] = powerspec 3  supports D0 D3  current D0
    cap 13[b0] = PCI Advanced Features: FLR TP

ichsmb0@pci0:0:31:3:	class=0x0c0500 rev=0x04 hdr=0x00 vendor=0x8086 device=0x1c22 subvendor=0x1028 subdevice=0x04f5
    vendor     = 'Intel Corporation'
    device     = '6 Series/C200 Series Chipset Family SMBus Controller'
    class      = serial bus
    subclass   = SMBus
    bar   [10] = type Memory, range 64, base 0xe1610000, size 256, enabled
    bar   [20] = type I/O Port, range 32, base 0x5000, size 32, enabled

atapci1@pci0:0:31:5:	class=0x010185 rev=0x04 hdr=0x00 vendor=0x8086 device=0x1c08 subvendor=0x1028 subdevice=0x04f5
    vendor     = 'Intel Corporation'
    device     = '6 Series/C200 Series Chipset Family Desktop SATA Controller (IDE mode, ports 4-5)'
    class      = mass storage
    subclass   = ATA
    bar   [10] = type I/O Port, range 32, base 0x5070, size 8, enabled
    bar   [14] = type I/O Port, range 32, base 0x5060, size 4, enabled
    bar   [18] = type I/O Port, range 32, base 0x5050, size 8, enabled
    bar   [1c] = type I/O Port, range 32, base 0x5040, size 4, enabled
    bar   [20] = type I/O Port, range 32, base 0x5030, size 16, enabled
    bar   [24] = type I/O Port, range 32, base 0x5020, size 16, enabled
    cap 01[70] = powerspec 3  supports D0 D3  current D0
    cap 13[b0] = PCI Advanced Features: FLR TP

vgapci0@pci0:1:0:0:	class=0x030000 rev=0x87 hdr=0x00 vendor=0x1002 device=0x6611 subvendor=0x1028 subdevice=0x1002
    vendor     = 'Advanced Micro Devices, Inc. [AMD/ATI]'
    device     = 'Oland [Radeon HD 8570 / R5 430 OEM / R7 240/340 / Radeon 520 OEM]'
    class      = display
    subclass   = VGA
    bar   [10] = type Prefetchable Memory, range 64, base 0xd0000000, size 268435456, enabled
    bar   [18] = type Memory, range 64, base 0xe1500000, size 262144, enabled
    bar   [20] = type I/O Port, range 32, base 0x4000, size 256, enabled
    cap 09[48] = vendor (length 8)
    cap 01[50] = powerspec 3  supports D0 D1 D2 D3  current D0
    cap 10[58] = PCI-Express 2 legacy endpoint max data 128(256) RO NS
                 max read 512
                 link x8(x8) speed 5.0(8.0) ASPM L0s/L1(L0s/L1)
    cap 05[a0] = MSI supports 1 message, 64 bit 
    ecap 000b[100] = Vendor [1] ID 0001 Rev 1 Length 16
    ecap 0001[150] = AER 2 0 fatal 1 non-fatal 1 corrected
    ecap 0015[200] = Resizable BAR 1
    ecap 0019[270] = PCIe Sec 1 lane errors 0

none1@pci0:1:0:1:	class=0x040300 rev=0x00 hdr=0x00 vendor=0x1002 device=0xaab0 subvendor=0x1028 subdevice=0xaab0
    vendor     = 'Advanced Micro Devices, Inc. [AMD/ATI]'
    device     = 'Oland/Hainan/Cape Verde/Pitcairn HDMI Audio [Radeon HD 7000 Series]'
    class      = multimedia
    subclass   = HDA
    bar   [10] = type Memory, range 64, base 0xe1560000, size 16384, enabled
    cap 09[48] = vendor (length 8)
    cap 01[50] = powerspec 3  supports D0 D1 D2 D3  current D0
    cap 10[58] = PCI-Express 2 legacy endpoint max data 128(256) RO NS
                 max read 512
                 link x8(x8) speed 5.0(8.0) ASPM L0s/L1(L0s/L1)
    cap 05[a0] = MSI supports 1 message, 64 bit 
    ecap 000b[100] = Vendor [1] ID 0001 Rev 1 Length 16
    ecap 0001[150] = AER 2 0 fatal 1 non-fatal 1 corrected

re0@pci0:4:0:0:	class=0x020000 rev=0x06 hdr=0x00 vendor=0x10ec device=0x8168 subvendor=0x1028 subdevice=0x04f5
    vendor     = 'Realtek Semiconductor Co., Ltd.'
    device     = 'RTL8111/8168/8411 PCI Express Gigabit Ethernet Controller'
    class      = network
    subclass   = ethernet
    bar   [10] = type I/O Port, range 32, base 0x2000, size 256, enabled
    bar   [18] = type Prefetchable Memory, range 64, base 0xe0a10000, size 4096, enabled
    bar   [20] = type Prefetchable Memory, range 64, base 0xe0a00000, size 16384, enabled
    cap 01[40] = powerspec 3  supports D0 D1 D2 D3  current D0
    cap 05[50] = MSI supports 1 message, 64 bit 
    cap 10[70] = PCI-Express 2 endpoint MSI 1 max data 128(128) RO
                 max read 4096
                 link x1(x1) speed 2.5(2.5) ASPM disabled(L0s/L1) ClockPM disabled
    cap 11[b0] = MSI-X supports 4 messages, enabled
                 Table in map 0x20[0x0], PBA in map 0x20[0x800]
    cap 03[d0] = VPD
    ecap 0001[100] = AER 1 0 fatal 0 non-fatal 0 corrected
    ecap 0002[140] = VC 1 max VC0
    ecap 0003[160] = Serial 1 03000000684ce000
