hostb0@pci0:0:0:0:	class=0x060000 card=0x084215d9 chip=0x0c008086 rev=0x06 hdr=0x00
    vendor     = 'Intel Corporation'
    device     = '4th Gen Core Processor DRAM Controller'
    class      = bridge
    subclass   = HOST-PCI
    cap 09[e0] = vendor (length 12) Intel cap 0 version 1

pcib1@pci0:0:1:0:	class=0x060400 card=0x084215d9 chip=0x0c018086 rev=0x06 hdr=0x01
    vendor     = 'Intel Corporation'
    device     = 'Xeon E3-1200 v3/4th Gen Core Processor PCI Express x16 Controller'
    class      = bridge
    subclass   = PCI-PCI
    cap 0d[88] = PCI Bridge card=0x084215d9
    cap 01[80] = powerspec 3  supports D0 D3  current D0
    cap 05[90] = MSI supports 1 message 
    cap 10[a0] = PCI-Express 2 root port max data 256(256)
                 link x16(x16) speed 8.0(8.0) ASPM disabled(L0s/L1)
                 slot 1 power limit 75000 mW
    ecap 0002[100] = VC 1 max VC0
    ecap 0005[140] = Root Complex Link Declaration 1
    ecap 0019[d94] = PCIe Sec 1 lane errors 0

xhci0@pci0:0:20:0:	class=0x0c0330 card=0x084215d9 chip=0x8c318086 rev=0x05 hdr=0x00
    vendor     = 'Intel Corporation'
    device     = '8 Series/C220 Series Chipset Family USB xHCI'
    class      = serial bus
    subclass   = USB
    bar   [10] = type Memory, range 64, base 0xf7600000, size 65536, enabled
    cap 01[70] = powerspec 2  supports D0 D3  current D0
    cap 05[80] = MSI supports 8 messages, 64 bit enabled with 1 message

none0@pci0:0:22:0:	class=0x078000 card=0x084215d9 chip=0x8c3a8086 rev=0x04 hdr=0x00
    vendor     = 'Intel Corporation'
    device     = '8 Series/C220 Series Chipset Family MEI Controller'
    class      = simple comms
    bar   [10] = type Memory, range 64, base 0xf7616000, size 16, enabled
    cap 01[50] = powerspec 3  supports D0 D3  current D0
    cap 05[8c] = MSI supports 1 message, 64 bit 

none1@pci0:0:22:1:	class=0x078000 card=0x084215d9 chip=0x8c3b8086 rev=0x04 hdr=0x00
    vendor     = 'Intel Corporation'
    device     = '8 Series/C220 Series Chipset Family MEI Controller'
    class      = simple comms
    bar   [10] = type Memory, range 64, base 0xf7615000, size 16, enabled
    cap 01[50] = powerspec 3  supports D0 D3  current D0
    cap 05[8c] = MSI supports 1 message, 64 bit 

ehci0@pci0:0:26:0:	class=0x0c0320 card=0x084215d9 chip=0x8c2d8086 rev=0x05 hdr=0x00
    vendor     = 'Intel Corporation'
    device     = '8 Series/C220 Series Chipset Family USB EHCI'
    class      = serial bus
    subclass   = USB
    bar   [10] = type Memory, range 32, base 0xf7613000, size 1024, enabled
    cap 01[50] = powerspec 2  supports D0 D3  current D0
    cap 0a[58] = EHCI Debug Port at offset 0xa0 in map 0x14
    cap 13[98] = PCI Advanced Features: FLR TP

pcib10@pci0:0:28:0:	class=0x060400 card=0x084215d9 chip=0x8c108086 rev=0xd5 hdr=0x01
    vendor     = 'Intel Corporation'
    device     = '8 Series/C220 Series Chipset Family PCI Express Root Port'
    class      = bridge
    subclass   = PCI-PCI
    cap 10[40] = PCI-Express 2 root port max data 128(128)
                 link x1(x1) speed 2.5(5.0) ASPM disabled(L0s/L1)
                 slot 0 power limit 100 mW
    cap 05[80] = MSI supports 1 message 
    cap 0d[90] = PCI Bridge card=0x084215d9
    cap 01[a0] = powerspec 3  supports D0 D3  current D0

pcib12@pci0:0:28:4:	class=0x060400 card=0x084215d9 chip=0x8c188086 rev=0xd5 hdr=0x01
    vendor     = 'Intel Corporation'
    device     = '8 Series/C220 Series Chipset Family PCI Express Root Port'
    class      = bridge
    subclass   = PCI-PCI
    cap 10[40] = PCI-Express 2 root port max data 128(128)
                 link x1(x4) speed 5.0(5.0) ASPM disabled(L0s/L1)
                 slot 4 power limit 250 mW
    cap 05[80] = MSI supports 1 message 
    cap 0d[90] = PCI Bridge card=0x084215d9
    cap 01[a0] = powerspec 3  supports D0 D3  current D0

ehci1@pci0:0:29:0:	class=0x0c0320 card=0x084215d9 chip=0x8c268086 rev=0x05 hdr=0x00
    vendor     = 'Intel Corporation'
    device     = '8 Series/C220 Series Chipset Family USB EHCI'
    class      = serial bus
    subclass   = USB
    bar   [10] = type Memory, range 32, base 0xf7612000, size 1024, enabled
    cap 01[50] = powerspec 2  supports D0 D3  current D0
    cap 0a[58] = EHCI Debug Port at offset 0xa0 in map 0x14
    cap 13[98] = PCI Advanced Features: FLR TP

isab0@pci0:0:31:0:	class=0x060100 card=0x084215d9 chip=0x8c568086 rev=0x05 hdr=0x00
    vendor     = 'Intel Corporation'
    device     = 'C226 Series Chipset Family Server Advanced SKU LPC Controller'
    class      = bridge
    subclass   = PCI-ISA
    cap 09[e0] = vendor (length 12) Intel cap 1 version 0
		 features: AMT, 4 PCI-e x1 slots

ahci0@pci0:0:31:2:	class=0x010601 card=0x084215d9 chip=0x8c028086 rev=0x05 hdr=0x00
    vendor     = 'Intel Corporation'
    device     = '8 Series/C220 Series Chipset Family 6-port SATA Controller 1 [AHCI mode]'
    class      = mass storage
    subclass   = SATA
    bar   [10] = type I/O Port, range 32, base 0xf050, size 8, enabled
    bar   [14] = type I/O Port, range 32, base 0xf040, size 4, enabled
    bar   [18] = type I/O Port, range 32, base 0xf030, size 8, enabled
    bar   [1c] = type I/O Port, range 32, base 0xf020, size 4, enabled
    bar   [20] = type I/O Port, range 32, base 0xf000, size 32, enabled
    bar   [24] = type Memory, range 32, base 0xf7611000, size 2048, enabled
    cap 05[80] = MSI supports 1 message enabled with 1 message
    cap 01[70] = powerspec 3  supports D0 D3  current D0
    cap 12[a8] = SATA Index-Data Pair

none2@pci0:0:31:3:	class=0x0c0500 card=0x084215d9 chip=0x8c228086 rev=0x05 hdr=0x00
    vendor     = 'Intel Corporation'
    device     = '8 Series/C220 Series Chipset Family SMBus Controller'
    class      = serial bus
    subclass   = SMBus
    bar   [10] = type Memory, range 64, base 0xf7610000, size 256, enabled
    bar   [20] = type I/O Port, range 32, base 0x580, size 32, enabled

none3@pci0:0:31:6:	class=0x118000 card=0x084215d9 chip=0x8c248086 rev=0x05 hdr=0x00
    vendor     = 'Intel Corporation'
    device     = '8 Series Chipset Family Thermal Management Controller'
    class      = dasp
    bar   [10] = type Memory, range 64, base 0xfbff00000, size 4096, enabled
    cap 01[50] = powerspec 3  supports D0 D3  current D0
    cap 05[80] = MSI supports 1 message 

pcib2@pci0:1:0:0:	class=0x060400 card=0x084215d9 chip=0x874710b5 rev=0xca hdr=0x01
    vendor     = 'PLX Technology, Inc.'
    device     = 'PEX 8747 48-Lane, 5-Port PCI Express Gen 3 (8.0 GT/s) Switch'
    class      = bridge
    subclass   = PCI-PCI
    bar   [10] = type Memory, range 32, base 0xf7300000, size 262144, enabled
    cap 01[40] = powerspec 3  supports D0 D3  current D0
    cap 05[48] = MSI supports 8 messages, 64 bit, vector masks 
    cap 10[68] = PCI-Express 2 upstream port max data 256(2048) NS
                 link x16(x16) speed 8.0(8.0) ASPM disabled(L1)
    cap 0d[a4] = PCI Bridge card=0x084215d9
    ecap 0003[100] = Serial 1 ca870010b5df0e00
    ecap 0001[fb4] = AER 1 0 fatal 0 non-fatal 1 corrected
    ecap 0004[138] = Power Budgeting 1
    ecap 0019[10c] = PCIe Sec 1 lane errors 0
    ecap 0002[148] = VC 1 max VC0
    ecap 0012[e00] = Multicast 1
    ecap 0018[b00] = LTR 1
    ecap 000b[b70] = Vendor 1 ID 1

pcib3@pci0:2:8:0:	class=0x060400 card=0x084215d9 chip=0x874710b5 rev=0xca hdr=0x01
    vendor     = 'PLX Technology, Inc.'
    device     = 'PEX 8747 48-Lane, 5-Port PCI Express Gen 3 (8.0 GT/s) Switch'
    class      = bridge
    subclass   = PCI-PCI
    cap 01[40] = powerspec 3  supports D0 D3  current D0
    cap 05[48] = MSI supports 8 messages, 64 bit, vector masks 
    cap 10[68] = PCI-Express 2 downstream port max data 256(2048) NS ARI disabled
                 link x1(x8) speed 5.0(8.0) ASPM disabled(L1)
                 slot 8 power limit 25000 mW
    cap 0d[a4] = PCI Bridge card=0x084215d9
    ecap 0003[100] = Serial 1 ca870010b5df0e00
    ecap 0001[fb4] = AER 1 0 fatal 0 non-fatal 1 corrected
    ecap 0004[138] = Power Budgeting 1
    ecap 0019[10c] = PCIe Sec 1 lane errors 0
    ecap 0002[148] = VC 1 max VC0
    ecap 0012[e00] = Multicast 1
    ecap 000d[f24] = ACS 1
    ecap 000b[b70] = Vendor 1 ID 1

pcib7@pci0:2:9:0:	class=0x060400 card=0x084215d9 chip=0x874710b5 rev=0xca hdr=0x01
    vendor     = 'PLX Technology, Inc.'
    device     = 'PEX 8747 48-Lane, 5-Port PCI Express Gen 3 (8.0 GT/s) Switch'
    class      = bridge
    subclass   = PCI-PCI
    cap 01[40] = powerspec 3  supports D0 D3  current D0
    cap 05[48] = MSI supports 8 messages, 64 bit, vector masks 
    cap 10[68] = PCI-Express 2 downstream port max data 256(2048) NS ARI enabled
                 link x8(x8) speed 5.0(8.0) ASPM disabled(L1)
                 slot 9 power limit 25000 mW HotPlug(present) Attn Button PC(off) MRL(open)
    cap 0d[a4] = PCI Bridge card=0x084215d9
    ecap 0003[100] = Serial 1 ca870010b5df0e00
    ecap 0001[fb4] = AER 1 0 fatal 0 non-fatal 1 corrected
    ecap 0004[138] = Power Budgeting 1
    ecap 0019[10c] = PCIe Sec 1 lane errors 0
    ecap 0002[148] = VC 1 max VC0
    ecap 0012[e00] = Multicast 1
    ecap 000d[f24] = ACS 1
    ecap 000b[b70] = Vendor 1 ID 1

pcib8@pci0:2:16:0:	class=0x060400 card=0x084215d9 chip=0x874710b5 rev=0xca hdr=0x01
    vendor     = 'PLX Technology, Inc.'
    device     = 'PEX 8747 48-Lane, 5-Port PCI Express Gen 3 (8.0 GT/s) Switch'
    class      = bridge
    subclass   = PCI-PCI
    cap 01[40] = powerspec 3  supports D0 D3  current D0
    cap 05[48] = MSI supports 8 messages, 64 bit, vector masks 
    cap 10[68] = PCI-Express 2 downstream port max data 256(2048) NS ARI enabled
                 link x8(x8) speed 5.0(8.0) ASPM disabled(L1)
                 slot 16 power limit 25000 mW
    cap 0d[a4] = PCI Bridge card=0x084215d9
    ecap 0003[100] = Serial 1 ca870010b5df0e00
    ecap 0001[fb4] = AER 1 0 fatal 0 non-fatal 1 corrected
    ecap 0004[138] = Power Budgeting 1
    ecap 0019[10c] = PCIe Sec 1 lane errors 0
    ecap 0002[148] = VC 1 max VC0
    ecap 0012[e00] = Multicast 1
    ecap 000d[f24] = ACS 1
    ecap 000b[b70] = Vendor 1 ID 1

pcib9@pci0:2:17:0:	class=0x060400 card=0x084215d9 chip=0x874710b5 rev=0xca hdr=0x01
    vendor     = 'PLX Technology, Inc.'
    device     = 'PEX 8747 48-Lane, 5-Port PCI Express Gen 3 (8.0 GT/s) Switch'
    class      = bridge
    subclass   = PCI-PCI
    cap 01[40] = powerspec 3  supports D0 D3  current D0
    cap 05[48] = MSI supports 8 messages, 64 bit, vector masks 
    cap 10[68] = PCI-Express 2 downstream port max data 256(2048) NS ARI enabled
                 link x8(x8) speed 5.0(8.0) ASPM disabled(L1)
                 slot 17 power limit 25000 mW
    cap 0d[a4] = PCI Bridge card=0x084215d9
    ecap 0003[100] = Serial 1 ca870010b5df0e00
    ecap 0001[fb4] = AER 1 0 fatal 0 non-fatal 1 corrected
    ecap 0004[138] = Power Budgeting 1
    ecap 0019[10c] = PCIe Sec 1 lane errors 0
    ecap 0002[148] = VC 1 max VC0
    ecap 0012[e00] = Multicast 1
    ecap 000d[f24] = ACS 1
    ecap 000b[b70] = Vendor 1 ID 1

pcib4@pci0:3:0:0:	class=0x060400 card=0x118f1b21 chip=0x11821b21 rev=0x00 hdr=0x01
    vendor     = 'ASMedia Technology Inc.'
    class      = bridge
    subclass   = PCI-PCI
    cap 05[50] = MSI supports 1 message, 64 bit 
    cap 01[78] = powerspec 3  supports D0 D3  current D0
    cap 10[80] = PCI-Express 2 upstream port max data 256(256) NS
                 link x1(x1) speed 5.0(5.0) ASPM disabled(L0s/L1)
    cap 0d[c0] = PCI Bridge card=0x118f1b21
    ecap 0002[100] = VC 1 max VC0
    ecap 0001[200] = AER 1 0 fatal 0 non-fatal 1 corrected
    ecap 000b[300] = Vendor 1 ID 0

pcib5@pci0:4:3:0:	class=0x060400 card=0x118f1b21 chip=0x11821b21 rev=0x00 hdr=0x01
    vendor     = 'ASMedia Technology Inc.'
    class      = bridge
    subclass   = PCI-PCI
    cap 05[50] = MSI supports 1 message, 64 bit 
    cap 01[78] = powerspec 3  supports D0 D3  current D0
    cap 10[80] = PCI-Express 2 downstream port max data 256(256) NS
                 link x1(x1) speed 5.0(5.0) ASPM disabled(L0s/L1)
                 slot 3 power limit 26000 mW
    cap 0d[c0] = PCI Bridge card=0x118f1b21
    ecap 0002[100] = VC 1 max VC0
    ecap 0001[200] = AER 1 0 fatal 0 non-fatal 0 corrected

pcib6@pci0:4:7:0:	class=0x060400 card=0x118f1b21 chip=0x11821b21 rev=0x00 hdr=0x01
    vendor     = 'ASMedia Technology Inc.'
    class      = bridge
    subclass   = PCI-PCI
    cap 05[50] = MSI supports 1 message, 64 bit 
    cap 01[78] = powerspec 3  supports D0 D3  current D0
    cap 10[80] = PCI-Express 2 downstream port max data 256(256) NS
                 link x1(x1) speed 5.0(5.0) ASPM disabled(L0s/L1)
                 slot 7 power limit 26000 mW
    cap 0d[c0] = PCI Bridge card=0x118f1b21
    ecap 0002[100] = VC 1 max VC0
    ecap 0001[200] = AER 1 0 fatal 0 non-fatal 0 corrected

re0@pci0:5:0:0:	class=0x020000 card=0x012310ec chip=0x812510ec rev=0x00 hdr=0x00
    vendor     = 'Realtek Semiconductor Co., Ltd.'
    class      = network
    subclass   = ethernet
    bar   [10] = type I/O Port, range 32, base 0x8000, size 256, enabled
    bar   [18] = type Memory, range 64, base 0xf7210000, size 65536, enabled
    bar   [20] = type Memory, range 64, base 0xf7220000, size 16384, enabled
    cap 01[40] = powerspec 3  supports D0 D1 D2 D3  current D0
    cap 05[50] = MSI supports 1 message, 64 bit, vector masks 
    cap 10[70] = PCI-Express 2 endpoint MSI 1 max data 256(512) FLR
                 link x1(x1) speed 5.0(5.0) ASPM disabled(L0s/L1)
    cap 11[b0] = MSI-X supports 4 messages, enabled
                 Table in map 0x20[0x0], PBA in map 0x20[0x800]
    cap 03[d0] = VPD
    ecap 0001[100] = AER 2 0 fatal 0 non-fatal 1 corrected
    ecap 0002[148] = VC 1 max VC0
    ecap 0003[168] = Serial 1 01000000684ce000
    ecap 000e[178] = ARI 1
    ecap 0010[188] = SR-IOV 1 IOV disabled, Memory Space disabled, ARI disabled
                     0 VFs configured out of 7 supported
                     First VF RID Offset 0x0002, VF RID Stride 0x0001
                     VF Device ID 0x8125
                     Page Sizes: 4096 (enabled), 8192, 65536, 262144, 1048576, 4194304
    ecap 0017[1c8] = TPH Requester 1
    ecap 0018[254] = LTR 1
    ecap 001e[25c] = unknown 1
    ecap 000b[26c] = Vendor 1 ID 2

re1@pci0:6:0:0:	class=0x020000 card=0x012310ec chip=0x812510ec rev=0x00 hdr=0x00
    vendor     = 'Realtek Semiconductor Co., Ltd.'
    class      = network
    subclass   = ethernet
    bar   [10] = type I/O Port, range 32, base 0x7000, size 256, enabled
    bar   [18] = type Memory, range 64, base 0xf7110000, size 65536, enabled
    bar   [20] = type Memory, range 64, base 0xf7120000, size 16384, enabled
    cap 01[40] = powerspec 3  supports D0 D1 D2 D3  current D0
    cap 05[50] = MSI supports 1 message, 64 bit, vector masks 
    cap 10[70] = PCI-Express 2 endpoint MSI 1 max data 256(512) FLR
                 link x1(x1) speed 5.0(5.0) ASPM disabled(L0s/L1)
    cap 11[b0] = MSI-X supports 4 messages, enabled
                 Table in map 0x20[0x0], PBA in map 0x20[0x800]
    cap 03[d0] = VPD
    ecap 0001[100] = AER 2 0 fatal 0 non-fatal 1 corrected
    ecap 0002[148] = VC 1 max VC0
    ecap 0003[168] = Serial 1 01000000684ce000
    ecap 000e[178] = ARI 1
    ecap 0010[188] = SR-IOV 1 IOV disabled, Memory Space disabled, ARI disabled
                     0 VFs configured out of 7 supported
                     First VF RID Offset 0x0002, VF RID Stride 0x0001
                     VF Device ID 0x8125
                     Page Sizes: 4096 (enabled), 8192, 65536, 262144, 1048576, 4194304
    ecap 0017[1c8] = TPH Requester 1
    ecap 0018[254] = LTR 1
    ecap 001e[25c] = unknown 1
    ecap 000b[26c] = Vendor 1 ID 2

ix0@pci0:7:0:0:	class=0x020000 card=0x152815d9 chip=0x15288086 rev=0x01 hdr=0x00
    vendor     = 'Intel Corporation'
    device     = 'Ethernet Controller 10-Gigabit X540-AT2'
    class      = network
    subclass   = ethernet
    bar   [10] = type Prefetchable Memory, range 64, base 0xfbfc00000, size 2097152, enabled
    bar   [18] = type I/O Port, range 32, base 0xb020, size 32, enabled
    bar   [20] = type Prefetchable Memory, range 64, base 0xfbfe04000, size 16384, enabled
    cap 01[40] = powerspec 3  supports D0 D3  current D0
    cap 05[50] = MSI supports 1 message, 64 bit, vector masks 
    cap 11[70] = MSI-X supports 64 messages, enabled
                 Table in map 0x20[0x0], PBA in map 0x20[0x2000]
    cap 10[a0] = PCI-Express 2 endpoint max data 256(512) FLR NS
                 link x8(x8) speed 5.0(5.0) ASPM disabled(L0s/L1)
    ecap 0001[100] = AER 2 0 fatal 0 non-fatal 1 corrected
    ecap 000e[150] = ARI 1
    ecap 0010[160] = SR-IOV 1 IOV disabled, Memory Space disabled, ARI disabled
                     0 VFs configured out of 64 supported
                     First VF RID Offset 0x0180, VF RID Stride 0x0002
                     VF Device ID 0x1515
                     Page Sizes: 4096 (enabled), 8192, 65536, 262144, 1048576, 4194304
    ecap 000d[1d0] = ACS 1

ix1@pci0:7:0:1:	class=0x020000 card=0x152815d9 chip=0x15288086 rev=0x01 hdr=0x00
    vendor     = 'Intel Corporation'
    device     = 'Ethernet Controller 10-Gigabit X540-AT2'
    class      = network
    subclass   = ethernet
    bar   [10] = type Prefetchable Memory, range 64, base 0xfbfa00000, size 2097152, enabled
    bar   [18] = type I/O Port, range 32, base 0xb000, size 32, enabled
    bar   [20] = type Prefetchable Memory, range 64, base 0xfbfe00000, size 16384, enabled
    cap 01[40] = powerspec 3  supports D0 D3  current D0
    cap 05[50] = MSI supports 1 message, 64 bit, vector masks 
    cap 11[70] = MSI-X supports 64 messages, enabled
                 Table in map 0x20[0x0], PBA in map 0x20[0x2000]
    cap 10[a0] = PCI-Express 2 endpoint max data 256(512) FLR NS
                 link x8(x8) speed 5.0(5.0) ASPM disabled(L0s/L1)
    ecap 0001[100] = AER 2 0 fatal 0 non-fatal 1 corrected
    ecap 000e[150] = ARI 1
    ecap 0010[160] = SR-IOV 1 IOV disabled, Memory Space disabled, ARI disabled
                     0 VFs configured out of 64 supported
                     First VF RID Offset 0x0180, VF RID Stride 0x0002
                     VF Device ID 0x1515
                     Page Sizes: 4096 (enabled), 8192, 65536, 262144, 1048576, 4194304
    ecap 000d[1d0] = ACS 1

ix2@pci0:8:0:0:	class=0x020000 card=0x152815d9 chip=0x15288086 rev=0x01 hdr=0x00
    vendor     = 'Intel Corporation'
    device     = 'Ethernet Controller 10-Gigabit X540-AT2'
    class      = network
    subclass   = ethernet
    bar   [10] = type Prefetchable Memory, range 64, base 0xfbf600000, size 2097152, enabled
    bar   [18] = type I/O Port, range 32, base 0xa020, size 32, enabled
    bar   [20] = type Prefetchable Memory, range 64, base 0xfbf804000, size 16384, enabled
    cap 01[40] = powerspec 3  supports D0 D3  current D0
    cap 05[50] = MSI supports 1 message, 64 bit, vector masks 
    cap 11[70] = MSI-X supports 64 messages, enabled
                 Table in map 0x20[0x0], PBA in map 0x20[0x2000]
    cap 10[a0] = PCI-Express 2 endpoint max data 256(512) FLR NS
                 link x8(x8) speed 5.0(5.0) ASPM disabled(L0s/L1)
    ecap 0001[100] = AER 2 0 fatal 0 non-fatal 1 corrected
    ecap 000e[150] = ARI 1
    ecap 0010[160] = SR-IOV 1 IOV disabled, Memory Space disabled, ARI disabled
                     0 VFs configured out of 64 supported
                     First VF RID Offset 0x0180, VF RID Stride 0x0002
                     VF Device ID 0x1515
                     Page Sizes: 4096 (enabled), 8192, 65536, 262144, 1048576, 4194304
    ecap 000d[1d0] = ACS 1

ix3@pci0:8:0:1:	class=0x020000 card=0x152815d9 chip=0x15288086 rev=0x01 hdr=0x00
    vendor     = 'Intel Corporation'
    device     = 'Ethernet Controller 10-Gigabit X540-AT2'
    class      = network
    subclass   = ethernet
    bar   [10] = type Prefetchable Memory, range 64, base 0xfbf400000, size 2097152, enabled
    bar   [18] = type I/O Port, range 32, base 0xa000, size 32, enabled
    bar   [20] = type Prefetchable Memory, range 64, base 0xfbf800000, size 16384, enabled
    cap 01[40] = powerspec 3  supports D0 D3  current D0
    cap 05[50] = MSI supports 1 message, 64 bit, vector masks 
    cap 11[70] = MSI-X supports 64 messages, enabled
                 Table in map 0x20[0x0], PBA in map 0x20[0x2000]
    cap 10[a0] = PCI-Express 2 endpoint max data 256(512) FLR NS
                 link x8(x8) speed 5.0(5.0) ASPM disabled(L0s/L1)
    ecap 0001[100] = AER 2 0 fatal 0 non-fatal 1 corrected
    ecap 000e[150] = ARI 1
    ecap 0010[160] = SR-IOV 1 IOV disabled, Memory Space disabled, ARI disabled
                     0 VFs configured out of 64 supported
                     First VF RID Offset 0x0180, VF RID Stride 0x0002
                     VF Device ID 0x1515
                     Page Sizes: 4096 (enabled), 8192, 65536, 262144, 1048576, 4194304
    ecap 000d[1d0] = ACS 1

ix4@pci0:9:0:0:	class=0x020000 card=0x152815d9 chip=0x15288086 rev=0x01 hdr=0x00
    vendor     = 'Intel Corporation'
    device     = 'Ethernet Controller 10-Gigabit X540-AT2'
    class      = network
    subclass   = ethernet
    bar   [10] = type Prefetchable Memory, range 64, base 0xfbf000000, size 2097152, enabled
    bar   [18] = type I/O Port, range 32, base 0x9020, size 32, enabled
    bar   [20] = type Prefetchable Memory, range 64, base 0xfbf204000, size 16384, enabled
    cap 01[40] = powerspec 3  supports D0 D3  current D0
    cap 05[50] = MSI supports 1 message, 64 bit, vector masks 
    cap 11[70] = MSI-X supports 64 messages, enabled
                 Table in map 0x20[0x0], PBA in map 0x20[0x2000]
    cap 10[a0] = PCI-Express 2 endpoint max data 256(512) FLR NS
                 link x8(x8) speed 5.0(5.0) ASPM disabled(L0s/L1)
    ecap 0001[100] = AER 2 0 fatal 0 non-fatal 1 corrected
    ecap 000e[150] = ARI 1
    ecap 0010[160] = SR-IOV 1 IOV disabled, Memory Space disabled, ARI disabled
                     0 VFs configured out of 64 supported
                     First VF RID Offset 0x0180, VF RID Stride 0x0002
                     VF Device ID 0x1515
                     Page Sizes: 4096 (enabled), 8192, 65536, 262144, 1048576, 4194304
    ecap 000d[1d0] = ACS 1

ix5@pci0:9:0:1:	class=0x020000 card=0x152815d9 chip=0x15288086 rev=0x01 hdr=0x00
    vendor     = 'Intel Corporation'
    device     = 'Ethernet Controller 10-Gigabit X540-AT2'
    class      = network
    subclass   = ethernet
    bar   [10] = type Prefetchable Memory, range 64, base 0xfbee00000, size 2097152, enabled
    bar   [18] = type I/O Port, range 32, base 0x9000, size 32, enabled
    bar   [20] = type Prefetchable Memory, range 64, base 0xfbf200000, size 16384, enabled
    cap 01[40] = powerspec 3  supports D0 D3  current D0
    cap 05[50] = MSI supports 1 message, 64 bit, vector masks 
    cap 11[70] = MSI-X supports 64 messages, enabled
                 Table in map 0x20[0x0], PBA in map 0x20[0x2000]
    cap 10[a0] = PCI-Express 2 endpoint max data 256(512) FLR NS
                 link x8(x8) speed 5.0(5.0) ASPM disabled(L0s/L1)
    ecap 0001[100] = AER 2 0 fatal 0 non-fatal 1 corrected
    ecap 000e[150] = ARI 1
    ecap 0010[160] = SR-IOV 1 IOV disabled, Memory Space disabled, ARI disabled
                     0 VFs configured out of 64 supported
                     First VF RID Offset 0x0180, VF RID Stride 0x0002
                     VF Device ID 0x1515
                     Page Sizes: 4096 (enabled), 8192, 65536, 262144, 1048576, 4194304
    ecap 000d[1d0] = ACS 1

pcib11@pci0:10:0:0:	class=0x060400 card=0x084215d9 chip=0x11501a03 rev=0x03 hdr=0x01
    vendor     = 'ASPEED Technology, Inc.'
    device     = 'AST1150 PCI-to-PCI Bridge'
    class      = bridge
    subclass   = PCI-PCI
    cap 05[50] = MSI supports 1 message, 64 bit 
    cap 01[78] = powerspec 3  supports D0 D1 D2 D3  current D0
    cap 10[80] = PCI-Express 1 PCI bridge max data 128(128) NS
                 link x1(x1) speed 2.5(2.5) ASPM disabled(L0s/L1)
    cap 0d[a4] = PCI Bridge card=0x084215d9
    ecap 0002[100] = VC 1 max VC0

vgapci0@pci0:11:0:0:	class=0x030000 card=0x084215d9 chip=0x20001a03 rev=0x30 hdr=0x00
    vendor     = 'ASPEED Technology, Inc.'
    device     = 'ASPEED Graphics Family'
    class      = display
    subclass   = VGA
    bar   [10] = type Memory, range 32, base 0xf6000000, size 16777216, enabled
    bar   [14] = type Memory, range 32, base 0xf7000000, size 131072, enabled
    bar   [18] = type I/O Port, range 32, base 0xe000, size 128, enabled
    cap 01[40] = powerspec 3  supports D0 D1 D2 D3  current D0
    cap 05[50] = MSI supports 4 messages, 64 bit 

pcib13@pci0:12:0:0:	class=0x060400 card=0x118f1b21 chip=0x11821b21 rev=0x00 hdr=0x01
    vendor     = 'ASMedia Technology Inc.'
    class      = bridge
    subclass   = PCI-PCI
    cap 05[50] = MSI supports 1 message, 64 bit 
    cap 01[78] = powerspec 3  supports D0 D3  current D0
    cap 10[80] = PCI-Express 2 upstream port max data 128(256) NS
                 link x1(x1) speed 5.0(5.0) ASPM disabled(L0s/L1)
    cap 0d[c0] = PCI Bridge card=0x118f1b21
    ecap 0002[100] = VC 1 max VC0
    ecap 0001[200] = AER 1 0 fatal 0 non-fatal 1 corrected
    ecap 000b[300] = Vendor 1 ID 0

pcib14@pci0:13:3:0:	class=0x060400 card=0x118f1b21 chip=0x11821b21 rev=0x00 hdr=0x01
    vendor     = 'ASMedia Technology Inc.'
    class      = bridge
    subclass   = PCI-PCI
    cap 05[50] = MSI supports 1 message, 64 bit 
    cap 01[78] = powerspec 3  supports D0 D3  current D0
    cap 10[80] = PCI-Express 2 downstream port max data 128(256) NS
                 link x1(x1) speed 5.0(5.0) ASPM disabled(L0s/L1)
                 slot 3 power limit 26000 mW
    cap 0d[c0] = PCI Bridge card=0x118f1b21
    ecap 0002[100] = VC 1 max VC0
    ecap 0001[200] = AER 1 0 fatal 0 non-fatal 0 corrected

pcib15@pci0:13:7:0:	class=0x060400 card=0x118f1b21 chip=0x11821b21 rev=0x00 hdr=0x01
    vendor     = 'ASMedia Technology Inc.'
    class      = bridge
    subclass   = PCI-PCI
    cap 05[50] = MSI supports 1 message, 64 bit 
    cap 01[78] = powerspec 3  supports D0 D3  current D0
    cap 10[80] = PCI-Express 2 downstream port max data 128(256) NS
                 link x1(x1) speed 5.0(5.0) ASPM disabled(L0s/L1)
                 slot 7 power limit 26000 mW
    cap 0d[c0] = PCI Bridge card=0x118f1b21
    ecap 0002[100] = VC 1 max VC0
    ecap 0001[200] = AER 1 0 fatal 0 non-fatal 0 corrected

re2@pci0:14:0:0:	class=0x020000 card=0x012310ec chip=0x812510ec rev=0x00 hdr=0x00
    vendor     = 'Realtek Semiconductor Co., Ltd.'
    class      = network
    subclass   = ethernet
    bar   [10] = type I/O Port, range 32, base 0xd000, size 256, enabled
    bar   [18] = type Memory, range 64, base 0xf7510000, size 65536, enabled
    bar   [20] = type Memory, range 64, base 0xf7520000, size 16384, enabled
    cap 01[40] = powerspec 3  supports D0 D1 D2 D3  current D0
    cap 05[50] = MSI supports 1 message, 64 bit, vector masks 
    cap 10[70] = PCI-Express 2 endpoint MSI 1 max data 128(512) FLR
                 link x1(x1) speed 5.0(5.0) ASPM disabled(L0s/L1)
    cap 11[b0] = MSI-X supports 4 messages, enabled
                 Table in map 0x20[0x0], PBA in map 0x20[0x800]
    cap 03[d0] = VPD
    ecap 0001[100] = AER 2 0 fatal 0 non-fatal 1 corrected
    ecap 0002[148] = VC 1 max VC0
    ecap 0003[168] = Serial 1 01000000684ce000
    ecap 000e[178] = ARI 1
    ecap 0010[188] = SR-IOV 1 IOV disabled, Memory Space disabled, ARI disabled
                     0 VFs configured out of 7 supported
                     First VF RID Offset 0x0002, VF RID Stride 0x0001
                     VF Device ID 0x8125
                     Page Sizes: 4096 (enabled), 8192, 65536, 262144, 1048576, 4194304
    ecap 0017[1c8] = TPH Requester 1
    ecap 0018[254] = LTR 1
    ecap 001e[25c] = unknown 1
    ecap 000b[26c] = Vendor 1 ID 2

re3@pci0:15:0:0:	class=0x020000 card=0x012310ec chip=0x812510ec rev=0x00 hdr=0x00
    vendor     = 'Realtek Semiconductor Co., Ltd.'
    class      = network
    subclass   = ethernet
    bar   [10] = type I/O Port, range 32, base 0xc000, size 256, enabled
    bar   [18] = type Memory, range 64, base 0xf7410000, size 65536, enabled
    bar   [20] = type Memory, range 64, base 0xf7420000, size 16384, enabled
    cap 01[40] = powerspec 3  supports D0 D1 D2 D3  current D0
    cap 05[50] = MSI supports 1 message, 64 bit, vector masks 
    cap 10[70] = PCI-Express 2 endpoint MSI 1 max data 128(512) FLR
                 link x1(x1) speed 5.0(5.0) ASPM disabled(L0s/L1)
    cap 11[b0] = MSI-X supports 4 messages, enabled
                 Table in map 0x20[0x0], PBA in map 0x20[0x800]
    cap 03[d0] = VPD
    ecap 0001[100] = AER 2 0 fatal 0 non-fatal 1 corrected
    ecap 0002[148] = VC 1 max VC0
    ecap 0003[168] = Serial 1 01000000684ce000
    ecap 000e[178] = ARI 1
    ecap 0010[188] = SR-IOV 1 IOV disabled, Memory Space disabled, ARI disabled
                     0 VFs configured out of 7 supported
                     First VF RID Offset 0x0002, VF RID Stride 0x0001
                     VF Device ID 0x8125
                     Page Sizes: 4096 (enabled), 8192, 65536, 262144, 1048576, 4194304
    ecap 0017[1c8] = TPH Requester 1
    ecap 0018[254] = LTR 1
    ecap 001e[25c] = unknown 1
    ecap 000b[26c] = Vendor 1 ID 2
