hostb0@pci0:0:0:0:	class=0x060000 rev=0x00 hdr=0x00 vendor=0x1022 device=0x1510 subvendor=0x1849 subdevice=0x1510
    vendor     = 'Advanced Micro Devices, Inc. [AMD]'
    device     = 'Family 14h Processor Root Complex'
    class      = bridge
    subclass   = HOST-PCI

vgapci0@pci0:0:1:0:	class=0x030000 rev=0x00 hdr=0x00 vendor=0x1002 device=0x9802 subvendor=0x1849 subdevice=0x9802
    vendor     = 'Advanced Micro Devices, Inc. [AMD/ATI]'
    device     = 'Wrestler [Radeon HD 6310]'
    class      = display
    subclass   = VGA
    bar   [10] = type Prefetchable Memory, range 32, base 0xc0000000, size 268435456, enabled
    bar   [14] = type I/O Port, range 32, base 0xf000, size 256, enabled
    bar   [18] = type Memory, range 32, base 0xfe900000, size 262144, enabled
    cap 01[50] = powerspec 3  supports D0 D1 D2 D3  current D0
    cap 10[58] = PCI-Express 2 root endpoint max data 128(128) RO NS
                 max read 128
    cap 05[a0] = MSI supports 1 message, 64 bit 
    ecap 000b[100] = Vendor [1] ID 0001 Rev 1 Length 16

hdac0@pci0:0:1:1:	class=0x040300 rev=0x00 hdr=0x00 vendor=0x1002 device=0x1314 subvendor=0x1849 subdevice=0x1314
    vendor     = 'Advanced Micro Devices, Inc. [AMD/ATI]'
    device     = 'Wrestler HDMI Audio'
    class      = multimedia
    subclass   = HDA
    bar   [10] = type Memory, range 32, base 0xfe944000, size 16384, enabled
    cap 01[50] = powerspec 3  supports D0 D1 D2 D3  current D0
    cap 10[58] = PCI-Express 2 root endpoint max data 128(128) RO NS
                 max read 128
    cap 05[a0] = MSI supports 1 message, 64 bit enabled with 1 message
    ecap 000b[100] = Vendor [1] ID 0001 Rev 1 Length 16

pcib1@pci0:0:4:0:	class=0x060400 rev=0x00 hdr=0x01 vendor=0x1022 device=0x1512 subvendor=0x1849 subdevice=0x1512
    vendor     = 'Advanced Micro Devices, Inc. [AMD]'
    device     = 'Family 14h Processor Root Port'
    class      = bridge
    subclass   = PCI-PCI
    cap 01[50] = powerspec 3  supports D0 D3  current D0
    cap 10[58] = PCI-Express 2 root port max data 128(128) NS
                 max read 512
                 link x4(x4) speed 2.5(5.0) ASPM disabled(L0s/L1)
                 slot 4 power limit 75000 mW HotPlug(present)
    cap 05[a0] = MSI supports 1 message, 64 bit enabled with 1 message
    cap 0d[b0] = PCI Bridge subvendor=0x1849 subdevice=0x1512
    cap 08[b8] = HT MSI fixed address window enabled at 0xfee00000
    ecap 000b[100] = Vendor [1] ID 0001 Rev 1 Length 16

ahci0@pci0:0:17:0:	class=0x010601 rev=0x40 hdr=0x00 vendor=0x1002 device=0x4391 subvendor=0x1849 subdevice=0x4391
    vendor     = 'Advanced Micro Devices, Inc. [AMD/ATI]'
    device     = 'SB7x0/SB8x0/SB9x0 SATA Controller [AHCI mode]'
    class      = mass storage
    subclass   = SATA
    bar   [10] = type I/O Port, range 32, base 0xf190, size 8, enabled
    bar   [14] = type I/O Port, range 32, base 0xf180, size 4, enabled
    bar   [18] = type I/O Port, range 32, base 0xf170, size 8, enabled
    bar   [1c] = type I/O Port, range 32, base 0xf160, size 4, enabled
    bar   [20] = type I/O Port, range 32, base 0xf150, size 16, enabled
    bar   [24] = type Memory, range 32, base 0xfe94f000, size 1024, enabled
    cap 12[70] = SATA Index-Data Pair
    cap 13[a4] = PCI Advanced Features: FLR TP

ohci0@pci0:0:18:0:	class=0x0c0310 rev=0x00 hdr=0x00 vendor=0x1002 device=0x4397 subvendor=0x1849 subdevice=0x4397
    vendor     = 'Advanced Micro Devices, Inc. [AMD/ATI]'
    device     = 'SB7x0/SB8x0/SB9x0 USB OHCI0 Controller'
    class      = serial bus
    subclass   = USB
    bar   [10] = type Memory, range 32, base 0xfe94e000, size 4096, enabled

ehci0@pci0:0:18:2:	class=0x0c0320 rev=0x00 hdr=0x00 vendor=0x1002 device=0x4396 subvendor=0x1849 subdevice=0x4396
    vendor     = 'Advanced Micro Devices, Inc. [AMD/ATI]'
    device     = 'SB7x0/SB8x0/SB9x0 USB EHCI Controller'
    class      = serial bus
    subclass   = USB
    bar   [10] = type Memory, range 32, base 0xfe94d000, size 256, enabled
    cap 01[c0] = powerspec 2  supports D0 D1 D2 D3  current D0
    cap 0a[e4] = EHCI Debug Port at offset 0xe0 in map 0x14

ohci1@pci0:0:19:0:	class=0x0c0310 rev=0x00 hdr=0x00 vendor=0x1002 device=0x4397 subvendor=0x1849 subdevice=0x4397
    vendor     = 'Advanced Micro Devices, Inc. [AMD/ATI]'
    device     = 'SB7x0/SB8x0/SB9x0 USB OHCI0 Controller'
    class      = serial bus
    subclass   = USB
    bar   [10] = type Memory, range 32, base 0xfe94c000, size 4096, enabled

ehci1@pci0:0:19:2:	class=0x0c0320 rev=0x00 hdr=0x00 vendor=0x1002 device=0x4396 subvendor=0x1849 subdevice=0x4396
    vendor     = 'Advanced Micro Devices, Inc. [AMD/ATI]'
    device     = 'SB7x0/SB8x0/SB9x0 USB EHCI Controller'
    class      = serial bus
    subclass   = USB
    bar   [10] = type Memory, range 32, base 0xfe94b000, size 256, enabled
    cap 01[c0] = powerspec 2  supports D0 D1 D2 D3  current D0
    cap 0a[e4] = EHCI Debug Port at offset 0xe0 in map 0x14

intsmb0@pci0:0:20:0:	class=0x0c0500 rev=0x42 hdr=0x00 vendor=0x1002 device=0x4385 subvendor=0x1849 subdevice=0x4385
    vendor     = 'Advanced Micro Devices, Inc. [AMD/ATI]'
    device     = 'SBx00 SMBus Controller'
    class      = serial bus
    subclass   = SMBus

atapci0@pci0:0:20:1:	class=0x01018a rev=0x40 hdr=0x00 vendor=0x1002 device=0x439c subvendor=0x1849 subdevice=0x439c
    vendor     = 'Advanced Micro Devices, Inc. [AMD/ATI]'
    device     = 'SB7x0/SB8x0/SB9x0 IDE Controller'
    class      = mass storage
    subclass   = ATA
    bar   [20] = type I/O Port, range 32, base 0xf100, size 16, enabled

hdac1@pci0:0:20:2:	class=0x040300 rev=0x40 hdr=0x00 vendor=0x1002 device=0x4383 subvendor=0x1849 subdevice=0x1892
    vendor     = 'Advanced Micro Devices, Inc. [AMD/ATI]'
    device     = 'SBx00 Azalia (Intel HDA)'
    class      = multimedia
    subclass   = HDA
    bar   [10] = type Memory, range 64, base 0xfe940000, size 16384, enabled
    cap 01[50] = powerspec 2  supports D0 D3  current D0

isab0@pci0:0:20:3:	class=0x060100 rev=0x40 hdr=0x00 vendor=0x1002 device=0x439d subvendor=0x1849 subdevice=0x439d
    vendor     = 'Advanced Micro Devices, Inc. [AMD/ATI]'
    device     = 'SB7x0/SB8x0/SB9x0 LPC host controller'
    class      = bridge
    subclass   = PCI-ISA

pcib2@pci0:0:20:4:	class=0x060401 rev=0x40 hdr=0x01 vendor=0x1002 device=0x4384 subvendor=0x0000 subdevice=0x0000
    vendor     = 'Advanced Micro Devices, Inc. [AMD/ATI]'
    device     = 'SBx00 PCI to PCI Bridge'
    class      = bridge
    subclass   = PCI-PCI

ohci2@pci0:0:20:5:	class=0x0c0310 rev=0x00 hdr=0x00 vendor=0x1002 device=0x4399 subvendor=0x1849 subdevice=0x4399
    vendor     = 'Advanced Micro Devices, Inc. [AMD/ATI]'
    device     = 'SB7x0/SB8x0/SB9x0 USB OHCI2 Controller'
    class      = serial bus
    subclass   = USB
    bar   [10] = type Memory, range 32, base 0xfe94a000, size 4096, enabled

pcib3@pci0:0:21:0:	class=0x060400 rev=0x00 hdr=0x01 vendor=0x1002 device=0x43a0 subvendor=0x1002 subdevice=0x0000
    vendor     = 'Advanced Micro Devices, Inc. [AMD/ATI]'
    device     = 'SB700/SB800/SB900 PCI to PCI bridge (PCIE port 0)'
    class      = bridge
    subclass   = PCI-PCI
    cap 01[50] = powerspec 3  supports D0 D1 D2 D3  current D0
    cap 10[58] = PCI-Express 2 root port max data 128(128) RO NS
                 max read 128
                 link x16(x1) speed undef(2.5) ASPM disabled(L0s/L1)
    cap 05[a0] = MSI supports 1 message, 64 bit 
    cap 0d[b0] = PCI Bridge subvendor=0x1002 subdevice=0x0000
    cap 08[b8] = HT MSI fixed address window enabled at 0xfee00000
    ecap 000b[100] = Vendor [1] ID 0001 Rev 1 Length 16

pcib4@pci0:0:21:1:	class=0x060400 rev=0x00 hdr=0x01 vendor=0x1002 device=0x43a1 subvendor=0x1002 subdevice=0x0000
    vendor     = 'Advanced Micro Devices, Inc. [AMD/ATI]'
    device     = 'SB700/SB800/SB900 PCI to PCI bridge (PCIE port 1)'
    class      = bridge
    subclass   = PCI-PCI
    cap 01[50] = powerspec 3  supports D0 D1 D2 D3  current D0
    cap 10[58] = PCI-Express 2 root port max data 128(128) NS
                 max read 128
                 link x1(x1) speed 2.5(5.0) ASPM disabled(L0s/L1)
    cap 05[a0] = MSI supports 1 message, 64 bit 
    cap 0d[b0] = PCI Bridge subvendor=0x1002 subdevice=0x0000
    cap 08[b8] = HT MSI fixed address window enabled at 0xfee00000
    ecap 000b[100] = Vendor [1] ID 0001 Rev 1 Length 16

ohci3@pci0:0:22:0:	class=0x0c0310 rev=0x00 hdr=0x00 vendor=0x1002 device=0x4397 subvendor=0x1849 subdevice=0x4397
    vendor     = 'Advanced Micro Devices, Inc. [AMD/ATI]'
    device     = 'SB7x0/SB8x0/SB9x0 USB OHCI0 Controller'
    class      = serial bus
    subclass   = USB
    bar   [10] = type Memory, range 32, base 0xfe949000, size 4096, enabled

ehci2@pci0:0:22:2:	class=0x0c0320 rev=0x00 hdr=0x00 vendor=0x1002 device=0x4396 subvendor=0x1849 subdevice=0x4396
    vendor     = 'Advanced Micro Devices, Inc. [AMD/ATI]'
    device     = 'SB7x0/SB8x0/SB9x0 USB EHCI Controller'
    class      = serial bus
    subclass   = USB
    bar   [10] = type Memory, range 32, base 0xfe948000, size 256, enabled
    cap 01[c0] = powerspec 2  supports D0 D1 D2 D3  current D0
    cap 0a[e4] = EHCI Debug Port at offset 0xe0 in map 0x14

hostb1@pci0:0:24:0:	class=0x060000 rev=0x43 hdr=0x00 vendor=0x1022 device=0x1700 subvendor=0x0000 subdevice=0x0000
    vendor     = 'Advanced Micro Devices, Inc. [AMD]'
    device     = 'Family 12h/14h Processor Function 0'
    class      = bridge
    subclass   = HOST-PCI

hostb2@pci0:0:24:1:	class=0x060000 rev=0x00 hdr=0x00 vendor=0x1022 device=0x1701 subvendor=0x0000 subdevice=0x0000
    vendor     = 'Advanced Micro Devices, Inc. [AMD]'
    device     = 'Family 12h/14h Processor Function 1'
    class      = bridge
    subclass   = HOST-PCI

hostb3@pci0:0:24:2:	class=0x060000 rev=0x00 hdr=0x00 vendor=0x1022 device=0x1702 subvendor=0x0000 subdevice=0x0000
    vendor     = 'Advanced Micro Devices, Inc. [AMD]'
    device     = 'Family 12h/14h Processor Function 2'
    class      = bridge
    subclass   = HOST-PCI

hostb4@pci0:0:24:3:	class=0x060000 rev=0x00 hdr=0x00 vendor=0x1022 device=0x1703 subvendor=0x0000 subdevice=0x0000
    vendor     = 'Advanced Micro Devices, Inc. [AMD]'
    device     = 'Family 12h/14h Processor Function 3'
    class      = bridge
    subclass   = HOST-PCI
    cap 0f[f0] = unknown

hostb5@pci0:0:24:4:	class=0x060000 rev=0x00 hdr=0x00 vendor=0x1022 device=0x1704 subvendor=0x0000 subdevice=0x0000
    vendor     = 'Advanced Micro Devices, Inc. [AMD]'
    device     = 'Family 12h/14h Processor Function 4'
    class      = bridge
    subclass   = HOST-PCI

hostb6@pci0:0:24:5:	class=0x060000 rev=0x00 hdr=0x00 vendor=0x1022 device=0x1718 subvendor=0x0000 subdevice=0x0000
    vendor     = 'Advanced Micro Devices, Inc. [AMD]'
    device     = 'Family 12h/14h Processor Function 6'
    class      = bridge
    subclass   = HOST-PCI

hostb7@pci0:0:24:6:	class=0x060000 rev=0x00 hdr=0x00 vendor=0x1022 device=0x1716 subvendor=0x0000 subdevice=0x0000
    vendor     = 'Advanced Micro Devices, Inc. [AMD]'
    device     = 'Family 12h/14h Processor Function 5'
    class      = bridge
    subclass   = HOST-PCI

hostb8@pci0:0:24:7:	class=0x060000 rev=0x00 hdr=0x00 vendor=0x1022 device=0x1719 subvendor=0x0000 subdevice=0x0000
    vendor     = 'Advanced Micro Devices, Inc. [AMD]'
    device     = 'Family 12h/14h Processor Function 7'
    class      = bridge
    subclass   = HOST-PCI

igb0@pci0:1:0:0:	class=0x020000 rev=0x01 hdr=0x00 vendor=0x8086 device=0x150a subvendor=0x1734 subdevice=0x11a7
    vendor     = 'Intel Corporation'
    device     = '82576NS Gigabit Network Connection'
    class      = network
    subclass   = ethernet
    bar   [10] = type Memory, range 32, base 0xfe820000, size 131072, enabled
    bar   [14] = type Memory, range 32, base 0xfe400000, size 4194304, enabled
    bar   [18] = type I/O Port, range 32, base 0xe020, size 32, enabled
    bar   [1c] = type Memory, range 32, base 0xfe844000, size 16384, enabled
    cap 01[40] = powerspec 3  supports D0 D3  current D0
    cap 05[50] = MSI supports 1 message, 64 bit, vector masks 
    cap 11[70] = MSI-X supports 10 messages, enabled
                 Table in map 0x1c[0x0], PBA in map 0x1c[0x2000]
    cap 10[a0] = PCI-Express 2 endpoint max data 128(512) FLR NS
                 max read 512
                 link x4(x4) speed 2.5(2.5) ASPM disabled(L0s/L1)
    ecap 0001[100] = AER 1 0 fatal 0 non-fatal 1 corrected
    ecap 0003[140] = Serial 1 001999ffff89de62
    ecap 000e[150] = ARI 1
    ecap 0010[160] = SR-IOV 1 IOV disabled, Memory Space disabled, ARI disabled
                     0 VFs configured out of 8 supported
                     First VF RID Offset 0x0180, VF RID Stride 0x0002
                     VF Device ID 0x10ca
                     Page Sizes: 4096 (enabled), 8192, 65536, 262144, 1048576, 4194304

igb1@pci0:1:0:1:	class=0x020000 rev=0x01 hdr=0x00 vendor=0x8086 device=0x150a subvendor=0x1734 subdevice=0x11a7
    vendor     = 'Intel Corporation'
    device     = '82576NS Gigabit Network Connection'
    class      = network
    subclass   = ethernet
    bar   [10] = type Memory, range 32, base 0xfe800000, size 131072, enabled
    bar   [14] = type Memory, range 32, base 0xfdc00000, size 4194304, enabled
    bar   [18] = type I/O Port, range 32, base 0xe000, size 32, enabled
    bar   [1c] = type Memory, range 32, base 0xfe840000, size 16384, enabled
    cap 01[40] = powerspec 3  supports D0 D3  current D0
    cap 05[50] = MSI supports 1 message, 64 bit, vector masks 
    cap 11[70] = MSI-X supports 10 messages, enabled
                 Table in map 0x1c[0x0], PBA in map 0x1c[0x2000]
    cap 10[a0] = PCI-Express 2 endpoint max data 128(512) FLR NS
                 max read 512
                 link x4(x4) speed 2.5(2.5) ASPM disabled(L0s/L1)
    ecap 0001[100] = AER 1 0 fatal 0 non-fatal 1 corrected
    ecap 0003[140] = Serial 1 001999ffff89de62
    ecap 000e[150] = ARI 1
    ecap 0010[160] = SR-IOV 1 IOV disabled, Memory Space disabled, ARI disabled
                     0 VFs configured out of 8 supported
                     First VF RID Offset 0x0180, VF RID Stride 0x0002
                     VF Device ID 0x10ca
                     Page Sizes: 4096 (enabled), 8192, 65536, 262144, 1048576, 4194304

re0@pci0:4:0:0:	class=0x020000 rev=0x06 hdr=0x00 vendor=0x10ec device=0x8168 subvendor=0x1849 subdevice=0x8168
    vendor     = 'Realtek Semiconductor Co., Ltd.'
    device     = 'RTL8111/8168/8411 PCI Express Gigabit Ethernet Controller'
    class      = network
    subclass   = ethernet
    bar   [10] = type I/O Port, range 32, base 0xd000, size 256, enabled
    bar   [18] = type Prefetchable Memory, range 64, base 0xd0004000, size 4096, enabled
    bar   [20] = type Prefetchable Memory, range 64, base 0xd0000000, size 16384, enabled
    cap 01[40] = powerspec 3  supports D0 D1 D2 D3  current D0
    cap 05[50] = MSI supports 1 message, 64 bit 
    cap 10[70] = PCI-Express 2 endpoint MSI 1 max data 128(256)
                 max read 4096
                 link x1(x1) speed 2.5(2.5) ASPM disabled(L0s/L1) ClockPM disabled
    cap 11[b0] = MSI-X supports 4 messages, enabled
                 Table in map 0x20[0x0], PBA in map 0x20[0x800]
    cap 03[d0] = VPD
    ecap 0001[100] = AER 1 0 fatal 0 non-fatal 1 corrected
    ecap 0002[140] = VC 1 max VC0
    ecap 0003[160] = Serial 1 01000000684ce000
