hostb0@pci0:0:0:0:	class=0x060000 card=0x72708086 chip=0x4e248086 rev=0x00 hdr=0x00
    vendor     = 'Intel Corporation'
    class      = bridge
    subclass   = HOST-PCI
    cap 09[e0] = vendor (length 16) Intel cap 0 version 1

vgapci0@pci0:0:2:0:	class=0x030000 card=0x22128086 chip=0x4e618086 rev=0x01 hdr=0x00
    vendor     = 'Intel Corporation'
    class      = display
    subclass   = VGA
    bar   [10] = type Memory, range 64, base 0x6000000000, size 16777216, enabled
    bar   [18] = type Prefetchable Memory, range 64, base 0x4000000000, size 268435456, enabled
    bar   [20] = type I/O Port, range 32, base 0x3000, size 64, enabled
    cap 09[40] = vendor (length 12) Intel cap 0 version 1
    cap 10[70] = PCI-Express 2 root endpoint max data 128(128) FLR
                 max read 128
    cap 05[ac] = MSI supports 1 message, vector masks 
    cap 01[d0] = powerspec 2  supports D0 D3  current D0
    ecap 001b[100] = Process Address Space ID 1
    ecap 000f[200] = ATS 1
    ecap 0013[300] = Page Page Request 1

none0@pci0:0:4:0:	class=0x118000 card=0x72708086 chip=0x4e038086 rev=0x00 hdr=0x00
    vendor     = 'Intel Corporation'
    class      = dasp
    bar   [10] = type Memory, range 64, base 0x6001110000, size 65536, enabled
    cap 05[90] = MSI supports 1 message 
    cap 01[d0] = powerspec 3  supports D0 D3  current D0
    cap 09[e0] = vendor (length 12) Intel cap 0 version 1

xhci0@pci0:0:20:0:	class=0x0c0330 card=0x72708086 chip=0x4ded8086 rev=0x01 hdr=0x00
    vendor     = 'Intel Corporation'
    class      = serial bus
    subclass   = USB
    bar   [10] = type Memory, range 64, base 0x6001100000, size 65536, enabled
    cap 01[70] = powerspec 2  supports D0 D3  current D0
    cap 05[80] = MSI supports 8 messages, 64 bit enabled with 1 message
    cap 09[90] = vendor (length 20) Intel cap 15 version 0

none1@pci0:0:20:2:	class=0x050000 card=0x72708086 chip=0x4def8086 rev=0x01 hdr=0x00
    vendor     = 'Intel Corporation'
    class      = memory
    subclass   = RAM
    bar   [10] = type Memory, range 64, base 0x6001124000, size 8192, enabled
    bar   [18] = type Memory, range 64, base 0x6001128000, size 4096, enabled
    cap 01[80] = powerspec 3  supports D0 D3  current D0

none2@pci0:0:22:0:	class=0x078000 card=0x72708086 chip=0x4de08086 rev=0x01 hdr=0x00
    vendor     = 'Intel Corporation'
    class      = simple comms
    bar   [10] = type Memory, range 64, base 0x6001127000, size 4096, enabled
    cap 01[50] = powerspec 3  supports D0 D3  current D0
    cap 05[8c] = MSI supports 1 message, 64 bit 
    cap 09[a4] = vendor (length 20) Intel cap 15 version 0

pcib1@pci0:0:28:0:	class=0x060400 card=0x72708086 chip=0x4db88086 rev=0x01 hdr=0x01
    vendor     = 'Intel Corporation'
    class      = bridge
    subclass   = PCI-PCI
    cap 10[40] = PCI-Express 2 root port max data 256(256) ARI disabled
                 max read 128
                 link x2(x2) speed 8.0(8.0)
                 slot 4 power limit 250 mW
    cap 05[80] = MSI supports 1 message 
    cap 0d[90] = PCI Bridge card=0x72708086
    cap 01[a0] = powerspec 3  supports D0 D3  current D0
    ecap 0001[100] = AER 1 0 fatal 0 non-fatal 0 corrected
    ecap 000d[220] = ACS 1
    ecap 001f[150] = Precision Time Measurement 1
    ecap 0019[a30] = PCIe Sec 1 lane errors 0
    ecap 001d[a00] = Downstream Port Containment 1

pcib2@pci0:0:28:4:	class=0x060400 card=0x72708086 chip=0x4dbc8086 rev=0x01 hdr=0x01
    vendor     = 'Intel Corporation'
    class      = bridge
    subclass   = PCI-PCI
    cap 10[40] = PCI-Express 2 root port max data 256(256) ARI disabled
                 max read 128
                 link x1(x1) speed 5.0(8.0)
                 slot 8 power limit 100 mW
    cap 05[80] = MSI supports 1 message 
    cap 0d[90] = PCI Bridge card=0x72708086
    cap 01[a0] = powerspec 3  supports D0 D3  current D0
    ecap 0001[100] = AER 1 0 fatal 0 non-fatal 0 corrected
    ecap 000d[220] = ACS 1
    ecap 001f[150] = Precision Time Measurement 1
    ecap 0019[a30] = PCIe Sec 1 lane errors 0
    ecap 001d[a00] = Downstream Port Containment 1

pcib3@pci0:0:28:5:	class=0x060400 card=0x72708086 chip=0x4dbd8086 rev=0x01 hdr=0x01
    vendor     = 'Intel Corporation'
    class      = bridge
    subclass   = PCI-PCI
    cap 10[40] = PCI-Express 2 root port max data 256(256) ARI disabled
                 max read 128
                 link x1(x1) speed 5.0(8.0)
                 slot 9 power limit 100 mW
    cap 05[80] = MSI supports 1 message 
    cap 0d[90] = PCI Bridge card=0x72708086
    cap 01[a0] = powerspec 3  supports D0 D3  current D0
    ecap 0001[100] = AER 1 0 fatal 0 non-fatal 0 corrected
    ecap 000d[220] = ACS 1
    ecap 001f[150] = Precision Time Measurement 1
    ecap 0019[a30] = PCIe Sec 1 lane errors 0
    ecap 001d[a00] = Downstream Port Containment 1

pcib4@pci0:0:28:6:	class=0x060400 card=0x72708086 chip=0x4dbe8086 rev=0x01 hdr=0x01
    vendor     = 'Intel Corporation'
    class      = bridge
    subclass   = PCI-PCI
    cap 10[40] = PCI-Express 2 root port max data 256(256) ARI disabled
                 max read 128
                 link x1(x1) speed 5.0(8.0)
                 slot 10 power limit 100 mW
    cap 05[80] = MSI supports 1 message 
    cap 0d[90] = PCI Bridge card=0x72708086
    cap 01[a0] = powerspec 3  supports D0 D3  current D0
    ecap 0001[100] = AER 1 0 fatal 0 non-fatal 0 corrected
    ecap 000d[220] = ACS 1
    ecap 001f[150] = Precision Time Measurement 1
    ecap 0019[a30] = PCIe Sec 1 lane errors 0
    ecap 001d[a00] = Downstream Port Containment 1

pcib5@pci0:0:28:7:	class=0x060400 card=0x72708086 chip=0x4dbf8086 rev=0x01 hdr=0x01
    vendor     = 'Intel Corporation'
    class      = bridge
    subclass   = PCI-PCI
    cap 10[40] = PCI-Express 2 root port max data 256(256) ARI disabled
                 max read 128
                 link x1(x1) speed 5.0(8.0)
                 slot 11 power limit 100 mW
    cap 05[80] = MSI supports 1 message 
    cap 0d[90] = PCI Bridge card=0x72708086
    cap 01[a0] = powerspec 3  supports D0 D3  current D0
    ecap 0001[100] = AER 1 0 fatal 0 non-fatal 0 corrected
    ecap 000d[220] = ACS 1
    ecap 001f[150] = Precision Time Measurement 1
    ecap 0019[a30] = PCIe Sec 1 lane errors 0
    ecap 001d[a00] = Downstream Port Containment 1

isab0@pci0:0:31:0:	class=0x060100 card=0x72708086 chip=0x4d878086 rev=0x01 hdr=0x00
    vendor     = 'Intel Corporation'
    class      = bridge
    subclass   = PCI-ISA

hdac0@pci0:0:31:3:	class=0x040300 card=0x72708086 chip=0x4dc88086 rev=0x01 hdr=0x00
    vendor     = 'Intel Corporation'
    class      = multimedia
    subclass   = HDA
    bar   [10] = type Memory, range 64, base 0x6001120000, size 16384, enabled
    bar   [20] = type Memory, range 64, base 0x6001000000, size 1048576, enabled
    cap 01[50] = powerspec 3  supports D0 D3  current D0
    cap 09[80] = vendor (length 20) Intel cap 15 version 0
    cap 05[60] = MSI supports 1 message, 64 bit enabled with 1 message

none3@pci0:0:31:4:	class=0x0c0500 card=0x72708086 chip=0x4da38086 rev=0x01 hdr=0x00
    vendor     = 'Intel Corporation'
    class      = serial bus
    subclass   = SMBus
    bar   [10] = type Memory, range 64, base 0x6001126000, size 256, enabled
    bar   [20] = type I/O Port, range 32, base 0xefa0, size 32, enabled

none4@pci0:0:31:5:	class=0x0c8000 card=0x72708086 chip=0x4da48086 rev=0x01 hdr=0x00
    vendor     = 'Intel Corporation'
    class      = serial bus
    bar   [10] = type Memory, range 32, base 0xfe010000, size 4096, enabled

nvme0@pci0:1:0:0:	class=0x010802 card=0x540ac0a9 chip=0x540ac0a9 rev=0x01 hdr=0x00
    vendor     = 'Micron/Crucial Technology'
    class      = mass storage
    subclass   = NVM
    bar   [10] = type Memory, range 64, base 0x80400000, size 16384, enabled
    cap 10[80] = PCI-Express 2 endpoint max data 256(256) FLR RO NS
                 max read 512
                 link x2(x4) speed 8.0(8.0) ASPM disabled(L1)
    cap 11[d0] = MSI-X supports 9 messages, enabled
                 Table in map 0x10[0x2000], PBA in map 0x10[0x3000]
    cap 05[e0] = MSI supports 8 messages, 64 bit, vector masks 
    cap 01[f8] = powerspec 3  supports D0 D3  current D0
    ecap 0018[100] = LTR 1
    ecap 001e[110] = L1 PM Substates 1
    ecap 0001[200] = AER 2 0 fatal 0 non-fatal 0 corrected
    ecap 0019[300] = PCIe Sec 1 lane errors 0

igc0@pci0:2:0:0:	class=0x020000 card=0x00008086 chip=0x15f38086 rev=0x03 hdr=0x00
    vendor     = 'Intel Corporation'
    device     = 'Intel(R) Ethernet Controller I225-V'
    class      = network
    subclass   = ethernet
    bar   [10] = type Memory, range 32, base 0x80200000, size 1048576, enabled
    bar   [1c] = type Memory, range 32, base 0x80300000, size 16384, enabled
    cap 01[40] = powerspec 3  supports D0 D3  current D0
    cap 05[50] = MSI supports 1 message, 64 bit, vector masks 
    cap 11[70] = MSI-X supports 5 messages, enabled
                 Table in map 0x1c[0x0], PBA in map 0x1c[0x2000]
    cap 10[a0] = PCI-Express 2 endpoint max data 256(512) FLR RO NS
                 max read 512
                 link x1(x1) speed 5.0(5.0) ASPM disabled(L1)
    ecap 0001[100] = AER 2 0 fatal 0 non-fatal 0 corrected
    ecap 0003[140] = Serial 1 60beb4ffff05118c
    ecap 0018[1c0] = LTR 1
    ecap 001f[1f0] = Precision Time Measurement 1
    ecap 001e[1e0] = L1 PM Substates 1

igc1@pci0:3:0:0:	class=0x020000 card=0x00008086 chip=0x15f38086 rev=0x03 hdr=0x00
    vendor     = 'Intel Corporation'
    device     = 'Intel(R) Ethernet Controller I225-V'
    class      = network
    subclass   = ethernet
    bar   [10] = type Memory, range 32, base 0x80000000, size 1048576, enabled
    bar   [1c] = type Memory, range 32, base 0x80100000, size 16384, enabled
    cap 01[40] = powerspec 3  supports D0 D3  current D0
    cap 05[50] = MSI supports 1 message, 64 bit, vector masks 
    cap 11[70] = MSI-X supports 5 messages, enabled
                 Table in map 0x1c[0x0], PBA in map 0x1c[0x2000]
    cap 10[a0] = PCI-Express 2 endpoint max data 256(512) FLR RO NS
                 max read 512
                 link x1(x1) speed 5.0(5.0) ASPM disabled(L1)
    ecap 0001[100] = AER 2 0 fatal 0 non-fatal 0 corrected
    ecap 0003[140] = Serial 1 60beb4ffff05118d
    ecap 0018[1c0] = LTR 1
    ecap 001f[1f0] = Precision Time Measurement 1
    ecap 001e[1e0] = L1 PM Substates 1

igc2@pci0:4:0:0:	class=0x020000 card=0x00008086 chip=0x15f38086 rev=0x03 hdr=0x00
    vendor     = 'Intel Corporation'
    device     = 'Intel(R) Ethernet Controller I225-V'
    class      = network
    subclass   = ethernet
    bar   [10] = type Memory, range 32, base 0x7fe00000, size 1048576, enabled
    bar   [1c] = type Memory, range 32, base 0x7ff00000, size 16384, enabled
    cap 01[40] = powerspec 3  supports D0 D3  current D0
    cap 05[50] = MSI supports 1 message, 64 bit, vector masks 
    cap 11[70] = MSI-X supports 5 messages, enabled
                 Table in map 0x1c[0x0], PBA in map 0x1c[0x2000]
    cap 10[a0] = PCI-Express 2 endpoint max data 256(512) FLR RO NS
                 max read 512
                 link x1(x1) speed 5.0(5.0) ASPM disabled(L1)
    ecap 0001[100] = AER 2 0 fatal 0 non-fatal 0 corrected
    ecap 0003[140] = Serial 1 60beb4ffff05118e
    ecap 0018[1c0] = LTR 1
    ecap 001f[1f0] = Precision Time Measurement 1
    ecap 001e[1e0] = L1 PM Substates 1

igc3@pci0:5:0:0:	class=0x020000 card=0x00008086 chip=0x15f38086 rev=0x03 hdr=0x00
    vendor     = 'Intel Corporation'
    device     = 'Intel(R) Ethernet Controller I225-V'
    class      = network
    subclass   = ethernet
    bar   [10] = type Memory, range 32, base 0x7fc00000, size 1048576, enabled
    bar   [1c] = type Memory, range 32, base 0x7fd00000, size 16384, enabled
    cap 01[40] = powerspec 3  supports D0 D3  current D0
    cap 05[50] = MSI supports 1 message, 64 bit, vector masks 
    cap 11[70] = MSI-X supports 5 messages, enabled
                 Table in map 0x1c[0x0], PBA in map 0x1c[0x2000]
    cap 10[a0] = PCI-Express 2 endpoint max data 256(512) FLR RO NS
                 max read 512
                 link x1(x1) speed 5.0(5.0) ASPM disabled(L1)
    ecap 0001[100] = AER 2 0 fatal 0 non-fatal 0 corrected
    ecap 0003[140] = Serial 1 60beb4ffff05118f
    ecap 0018[1c0] = LTR 1
    ecap 001f[1f0] = Precision Time Measurement 1
    ecap 001e[1e0] = L1 PM Substates 1
