hostb0@pci0:0:0:0:	class=0x060000 rev=0x05 hdr=0x00 vendor=0x8086 device=0x5910 subvendor=0x1043 subdevice=0x15e0
    vendor     = 'Intel Corporation'
    device     = 'Xeon E3-1200 v6/7th Gen Core Processor Host Bridge/DRAM Registers'
    class      = bridge
    subclass   = HOST-PCI
    cap 09[e0] = vendor (length 16) Intel cap 0 version 1

pcib1@pci0:0:1:0:	class=0x060400 rev=0x05 hdr=0x01 vendor=0x8086 device=0x1901 subvendor=0x1043 subdevice=0x15e0
    vendor     = 'Intel Corporation'
    device     = 'Xeon E3-1200 v5/E3-1500 v5/6th Gen Core Processor PCIe Controller (x16)'
    class      = bridge
    subclass   = PCI-PCI
    cap 0d[88] = PCI Bridge subvendor=0x1043 subdevice=0x15e0
    cap 01[80] = powerspec 3  supports D0 D3  current D0
    cap 05[90] = MSI supports 1 message 
    cap 10[a0] = PCI-Express 2 root port max data 256(256)
                 link x16(x16) speed 8.0(8.0) ASPM disabled(L0s/L1)
                 slot 1 power limit 75000 mW
    ecap 0002[100] = VC 1 max VC0
    ecap 0005[140] = Root Complex Link Declaration 1
    ecap 0019[d94] = PCIe Sec 1 lane errors 0

vgapci1@pci0:0:2:0:	class=0x030000 rev=0x04 hdr=0x00 vendor=0x8086 device=0x591b subvendor=0x1043 subdevice=0x15e0
    vendor     = 'Intel Corporation'
    device     = 'HD Graphics 630'
    class      = display
    subclass   = VGA
    bar   [10] = type Memory, range 64, base 0xdd000000, size 16777216, enabled
    bar   [18] = type Prefetchable Memory, range 64, base 0xb0000000, size 268435456, enabled
    bar   [20] = type I/O Port, range 32, base 0xf000, size 64, enabled
    cap 09[40] = vendor (length 12) Intel cap 0 version 1
    cap 10[70] = PCI-Express 2 root endpoint max data 128(128) FLR
    cap 05[ac] = MSI supports 1 message enabled with 1 message
    cap 01[d0] = powerspec 2  supports D0 D3  current D0
    ecap 001b[100] = Process Address Space ID 1
    ecap 000f[200] = ATS 1
    ecap 0013[300] = Page Page Request 1

none0@pci0:0:8:0:	class=0x088000 rev=0x00 hdr=0x00 vendor=0x8086 device=0x1911 subvendor=0x1043 subdevice=0x15e0
    vendor     = 'Intel Corporation'
    device     = 'Xeon E3-1200 v5/v6 / E3-1500 v5 / 6th/7th/8th Gen Core Processor Gaussian Mixture Model'
    class      = base peripheral
    bar   [10] = type Memory, range 64, base 0xdf430000, size 4096, enabled
    cap 05[90] = MSI supports 1 message 
    cap 01[dc] = powerspec 2  supports D0 D3  current D0
    cap 13[f0] = PCI Advanced Features: FLR TP

xhci0@pci0:0:20:0:	class=0x0c0330 rev=0x31 hdr=0x00 vendor=0x8086 device=0xa12f subvendor=0x1043 subdevice=0x201f
    vendor     = 'Intel Corporation'
    device     = '100 Series/C230 Series Chipset Family USB 3.0 xHCI Controller'
    class      = serial bus
    subclass   = USB
    bar   [10] = type Memory, range 64, base 0xdf410000, size 65536, enabled
    cap 01[70] = powerspec 2  supports D0 D3  current D0
    cap 05[80] = MSI supports 8 messages, 64 bit enabled with 1 message

pchtherm0@pci0:0:20:2:	class=0x118000 rev=0x31 hdr=0x00 vendor=0x8086 device=0xa131 subvendor=0x1043 subdevice=0x15e0
    vendor     = 'Intel Corporation'
    device     = '100 Series/C230 Series Chipset Family Thermal Subsystem'
    class      = dasp
    bar   [10] = type Memory, range 64, base 0xdf42f000, size 4096, enabled
    cap 01[50] = powerspec 3  supports D0 D3  current D0
    cap 05[80] = MSI supports 1 message 

ig4iic0@pci0:0:21:0:	class=0x118000 rev=0x31 hdr=0x00 vendor=0x8086 device=0xa160 subvendor=0x1043 subdevice=0x15e0
    vendor     = 'Intel Corporation'
    device     = '100 Series/C230 Series Chipset Family Serial IO I2C Controller'
    class      = dasp
    bar   [10] = type Memory, range 64, base 0xdf42e000, size 4096, enabled
    cap 01[80] = powerspec 3  supports D0 D3  current D0
    cap 09[90] = vendor (length 20) Intel cap 15 version 0

none1@pci0:0:22:0:	class=0x078000 rev=0x31 hdr=0x00 vendor=0x8086 device=0xa13a subvendor=0x1043 subdevice=0x15e0
    vendor     = 'Intel Corporation'
    device     = '100 Series/C230 Series Chipset Family MEI Controller'
    class      = simple comms
    bar   [10] = type Memory, range 64, base 0xdf42d000, size 4096, enabled
    cap 01[50] = powerspec 3  supports D0 D3  current D0
    cap 05[8c] = MSI supports 1 message, 64 bit 

ahci0@pci0:0:23:0:	class=0x010601 rev=0x31 hdr=0x00 vendor=0x8086 device=0xa103 subvendor=0x1043 subdevice=0x15e0
    vendor     = 'Intel Corporation'
    device     = 'HM170/QM170 Chipset SATA Controller [AHCI Mode]'
    class      = mass storage
    subclass   = SATA
    bar   [10] = type Memory, range 32, base 0xdf428000, size 8192, enabled
    bar   [14] = type Memory, range 32, base 0xdf42c000, size 256, enabled
    bar   [18] = type I/O Port, range 32, base 0xf090, size 8, enabled
    bar   [1c] = type I/O Port, range 32, base 0xf080, size 4, enabled
    bar   [20] = type I/O Port, range 32, base 0xf060, size 32, enabled
    bar   [24] = type Memory, range 32, base 0xdf42b000, size 2048, enabled
    cap 05[80] = MSI supports 1 message enabled with 1 message
    cap 01[70] = powerspec 3  supports D0 D3  current D0
    cap 12[a8] = SATA Index-Data Pair

pcib2@pci0:0:28:0:	class=0x060400 rev=0xf1 hdr=0x01 vendor=0x8086 device=0xa112 subvendor=0x1043 subdevice=0x15e0
    vendor     = 'Intel Corporation'
    device     = '100 Series/C230 Series Chipset Family PCI Express Root Port'
    class      = bridge
    subclass   = PCI-PCI
    cap 10[40] = PCI-Express 2 root port max data 128(256) ARI disabled
                 link x1(x1) speed 2.5(8.0) ASPM L1(L0s/L1)
                 slot 6 power limit 100 mW
    cap 05[80] = MSI supports 1 message 
    cap 0d[90] = PCI Bridge subvendor=0x1043 subdevice=0x15e0
    cap 01[a0] = powerspec 3  supports D0 D3  current D0
    ecap 0001[100] = AER 1 0 fatal 0 non-fatal 0 corrected
    ecap 000d[140] = ACS 1
    ecap 001e[200] = L1 PM Substates 1
    ecap 0019[220] = PCIe Sec 1 lane errors 0

pcib3@pci0:0:28:3:	class=0x060400 rev=0xf1 hdr=0x01 vendor=0x8086 device=0xa113 subvendor=0x1043 subdevice=0x15e0
    vendor     = 'Intel Corporation'
    device     = '100 Series/C230 Series Chipset Family PCI Express Root Port'
    class      = bridge
    subclass   = PCI-PCI
    cap 10[40] = PCI-Express 2 root port max data 128(256) ARI disabled
                 link x1(x1) speed 2.5(8.0) ASPM L1(L0s/L1)
                 slot 7 power limit 100 mW
    cap 05[80] = MSI supports 1 message 
    cap 0d[90] = PCI Bridge subvendor=0x1043 subdevice=0x15e0
    cap 01[a0] = powerspec 3  supports D0 D3  current D0
    ecap 0001[100] = AER 1 0 fatal 0 non-fatal 0 corrected
    ecap 000d[140] = ACS 1
    ecap 001e[200] = L1 PM Substates 1
    ecap 0019[220] = PCIe Sec 1 lane errors 0

pcib4@pci0:0:28:6:	class=0x060400 rev=0xf1 hdr=0x01 vendor=0x8086 device=0xa116 subvendor=0x1043 subdevice=0x15e0
    vendor     = 'Intel Corporation'
    device     = '100 Series/C230 Series Chipset Family PCI Express Root Port'
    class      = bridge
    subclass   = PCI-PCI
    cap 10[40] = PCI-Express 2 root port max data 128(256) ARI disabled
                 link x1(x1) speed 2.5(8.0) ASPM L0s/L1(L0s/L1)
                 slot 10 power limit 100 mW
    cap 05[80] = MSI supports 1 message 
    cap 0d[90] = PCI Bridge subvendor=0x1043 subdevice=0x15e0
    cap 01[a0] = powerspec 3  supports D0 D3  current D0
    ecap 0001[100] = AER 1 0 fatal 0 non-fatal 0 corrected
    ecap 000d[140] = ACS 1
    ecap 001e[200] = L1 PM Substates 1
    ecap 0019[220] = PCIe Sec 1 lane errors 0

isab0@pci0:0:31:0:	class=0x060100 rev=0x31 hdr=0x00 vendor=0x8086 device=0xa152 subvendor=0x1043 subdevice=0x15e0
    vendor     = 'Intel Corporation'
    device     = 'HM175 Chipset LPC/eSPI Controller'
    class      = bridge
    subclass   = PCI-ISA

none2@pci0:0:31:2:	class=0x058000 rev=0x31 hdr=0x00 vendor=0x8086 device=0xa121 subvendor=0x1043 subdevice=0x15e0
    vendor     = 'Intel Corporation'
    device     = '100 Series/C230 Series Chipset Family Power Management Controller'
    class      = memory
    bar   [10] = type Memory, range 32, base 0xdf424000, size 16384, enabled

hdac0@pci0:0:31:3:	class=0x040380 rev=0x31 hdr=0x00 vendor=0x8086 device=0xa171 subvendor=0x1043 subdevice=0x15e0
    vendor     = 'Intel Corporation'
    device     = 'CM238 HD Audio Controller'
    class      = multimedia
    subclass   = HDA
    bar   [10] = type Memory, range 64, base 0xdf420000, size 16384, enabled
    bar   [20] = type Memory, range 64, base 0xdf400000, size 65536, enabled
    cap 01[50] = powerspec 3  supports D0 D3  current D0
    cap 05[60] = MSI supports 1 message, 64 bit enabled with 1 message

ichsmb0@pci0:0:31:4:	class=0x0c0500 rev=0x31 hdr=0x00 vendor=0x8086 device=0xa123 subvendor=0x1043 subdevice=0x15e0
    vendor     = 'Intel Corporation'
    device     = '100 Series/C230 Series Chipset Family SMBus'
    class      = serial bus
    subclass   = SMBus
    bar   [10] = type Memory, range 64, base 0xdf42a000, size 256, enabled
    bar   [20] = type I/O Port, range 32, base 0xf040, size 32, enabled

vgapci0@pci0:1:0:0:	class=0x030200 rev=0xa1 hdr=0x00 vendor=0x10de device=0x1c8c subvendor=0x1043 subdevice=0x15e0
    vendor     = 'NVIDIA Corporation'
    device     = 'GP107M [GeForce GTX 1050 Ti Mobile]'
    class      = display
    subclass   = 3D
    bar   [10] = type Memory, range 32, base 0xde000000, size 16777216, enabled
    bar   [14] = type Prefetchable Memory, range 64, base 0xc0000000, size 268435456, enabled
    bar   [1c] = type Prefetchable Memory, range 64, base 0xd0000000, size 33554432, enabled
    bar   [24] = type I/O Port, range 32, base 0xe000, size 128, enabled
    cap 01[60] = powerspec 3  supports D0 D3  current D0
    cap 05[68] = MSI supports 1 message, 64 bit 
    cap 10[78] = PCI-Express 2 endpoint max data 256(256) NS
                 link x16(x16) speed 8.0(8.0) ASPM disabled(L0s/L1) ClockPM disabled
    ecap 0002[100] = VC 1 max VC0
    ecap 0018[250] = LTR 1
    ecap 001e[258] = L1 PM Substates 1
    ecap 0004[128] = Power Budgeting 1
    ecap 0001[420] = AER 2 0 fatal 0 non-fatal 1 corrected
    ecap 000b[600] = Vendor [1] ID 0001 Rev 1 Length 36
    ecap 0019[900] = PCIe Sec 1 lane errors 0

iwm0@pci0:2:0:0:	class=0x028000 rev=0x59 hdr=0x00 vendor=0x8086 device=0x095a subvendor=0x8086 subdevice=0x5010
    vendor     = 'Intel Corporation'
    device     = 'Wireless 7265'
    class      = network
    bar   [10] = type Memory, range 64, base 0xdf300000, size 8192, enabled
    cap 01[c8] = powerspec 3  supports D0 D3  current D0
    cap 05[d0] = MSI supports 1 message, 64 bit enabled with 1 message
    cap 10[40] = PCI-Express 2 endpoint max data 128(128) FLR NS
                 link x1(x1) speed 2.5(2.5) ASPM L1(L1) ClockPM disabled
    ecap 0001[100] = AER 1 0 fatal 0 non-fatal 1 corrected
    ecap 0003[140] = Serial 1 9cda3effff7791d3
    ecap 0018[14c] = LTR 1
    ecap 001e[154] = L1 PM Substates 1

re0@pci0:3:0:0:	class=0x020000 rev=0x15 hdr=0x00 vendor=0x10ec device=0x8168 subvendor=0x1043 subdevice=0x200f
    vendor     = 'Realtek Semiconductor Co., Ltd.'
    device     = 'RTL8111/8168/8411 PCI Express Gigabit Ethernet Controller'
    class      = network
    subclass   = ethernet
    bar   [10] = type I/O Port, range 32, base 0xd000, size 256, enabled
    bar   [18] = type Memory, range 64, base 0xdf204000, size 4096, enabled
    bar   [20] = type Memory, range 64, base 0xdf200000, size 16384, enabled
    cap 01[40] = powerspec 3  supports D0 D1 D2 D3  current D0
    cap 05[50] = MSI supports 1 message, 64 bit 
    cap 10[70] = PCI-Express 2 endpoint MSI 1 max data 128(128)
                 link x1(x1) speed 2.5(2.5) ASPM disabled(L0s/L1) ClockPM disabled
    cap 11[b0] = MSI-X supports 4 messages, enabled
                 Table in map 0x20[0x0], PBA in map 0x20[0x800]
    ecap 0001[100] = AER 2 0 fatal 0 non-fatal 1 corrected
    ecap 0002[140] = VC 1 max VC0
    ecap 0003[160] = Serial 1 01000000684ce000
    ecap 0018[170] = LTR 1
    ecap 001e[178] = L1 PM Substates 1

none3@pci0:4:0:0:	class=0xff0000 rev=0x01 hdr=0x00 vendor=0x10ec device=0x5229 subvendor=0x1043 subdevice=0x202f
    vendor     = 'Realtek Semiconductor Co., Ltd.'
    device     = 'RTS5229 PCI Express Card Reader'
    bar   [10] = type Memory, range 32, base 0xdf100000, size 4096, enabled
    cap 01[40] = powerspec 3  supports D0 D1 D2 D3  current D0
    cap 05[50] = MSI supports 1 message, 64 bit 
    cap 10[70] = PCI-Express 2 endpoint max data 128(128)
                 link x1(x1) speed 2.5(2.5) ASPM L0s/L1(L0s/L1) ClockPM disabled
    ecap 0001[100] = AER 1 0 fatal 0 non-fatal 2 corrected
    ecap 0003[140] = Serial 1 00000001004ce000
