hostb0@pci0:0:0:0:	class=0x060000 rev=0x02 hdr=0x00 vendor=0x8086 device=0xa000 subvendor=0x8086 subdevice=0xa000
    vendor     = 'Intel Corporation'
    device     = 'Atom Processor D4xx/D5xx/N4xx/N5xx DMI Bridge'
    class      = bridge
    subclass   = HOST-PCI
    cap 09[e0] = vendor (length 8) Intel cap 12 version 1

vgapci0@pci0:0:2:0:	class=0x030000 rev=0x02 hdr=0x00 vendor=0x8086 device=0xa001 subvendor=0x8086 subdevice=0xa001
    vendor     = 'Intel Corporation'
    device     = 'Atom Processor D4xx/D5xx/N4xx/N5xx Integrated Graphics Controller'
    class      = display
    subclass   = VGA
    bar   [10] = type Memory, range 32, base 0xfde80000, size 524288, enabled
    bar   [14] = type I/O Port, range 32, base 0xff00, size 8, enabled
    bar   [18] = type Prefetchable Memory, range 32, base 0xd0000000, size 268435456, enabled
    bar   [1c] = type Memory, range 32, base 0xfdb00000, size 1048576, enabled
    cap 05[90] = MSI supports 1 message 
    cap 01[d0] = powerspec 2  supports D0 D3  current D0

vgapci1@pci0:0:2:1:	class=0x038000 rev=0x02 hdr=0x00 vendor=0x8086 device=0xa002 subvendor=0x8086 subdevice=0xa001
    vendor     = 'Intel Corporation'
    device     = 'Atom Processor D4xx/D5xx/N4xx/N5xx Integrated Graphics Controller'
    class      = display
    bar   [10] = type Memory, range 32, base 0xfdf00000, size 524288, enabled
    cap 01[d0] = powerspec 2  supports D0 D3  current D0

uhci0@pci0:0:26:0:	class=0x0c0300 rev=0x04 hdr=0x00 vendor=0x8086 device=0x2834 subvendor=0x8086 subdevice=0x2834
    vendor     = 'Intel Corporation'
    device     = '82801H (ICH8 Family) USB UHCI Controller'
    class      = serial bus
    subclass   = USB
    bar   [20] = type I/O Port, range 32, base 0xfe00, size 32, enabled

uhci1@pci0:0:26:1:	class=0x0c0300 rev=0x04 hdr=0x00 vendor=0x8086 device=0x2835 subvendor=0x8086 subdevice=0x2835
    vendor     = 'Intel Corporation'
    device     = '82801H (ICH8 Family) USB UHCI Controller'
    class      = serial bus
    subclass   = USB
    bar   [20] = type I/O Port, range 32, base 0xfd00, size 32, enabled

ehci0@pci0:0:26:7:	class=0x0c0320 rev=0x04 hdr=0x00 vendor=0x8086 device=0x283a subvendor=0x8086 subdevice=0x283a
    vendor     = 'Intel Corporation'
    device     = '82801H (ICH8 Family) USB2 EHCI Controller'
    class      = serial bus
    subclass   = USB
    bar   [10] = type Memory, range 32, base 0xfdfff000, size 1024, enabled
    cap 01[50] = powerspec 2  supports D0 D3  current D0
    cap 0a[58] = EHCI Debug Port at offset 0xa0 in map 0x14

hdac0@pci0:0:27:0:	class=0x040300 rev=0x04 hdr=0x00 vendor=0x8086 device=0x284b subvendor=0x8086 subdevice=0x284b
    vendor     = 'Intel Corporation'
    device     = '82801H (ICH8 Family) HD Audio Controller'
    class      = multimedia
    subclass   = HDA
    bar   [10] = type Memory, range 64, base 0xfdff8000, size 16384, enabled
    cap 01[50] = powerspec 2  supports D0 D3  current D0
    cap 05[60] = MSI supports 1 message, 64 bit enabled with 1 message
    cap 10[70] = PCI-Express 1 root endpoint max data 128(128) NS
                 max read 128
    ecap 0002[100] = VC 1 max VC1
    ecap 0005[130] = Root Complex Link Declaration 1

pcib1@pci0:0:28:0:	class=0x060400 rev=0x04 hdr=0x01 vendor=0x8086 device=0x283f subvendor=0x8086 subdevice=0x283f
    vendor     = 'Intel Corporation'
    device     = '82801H (ICH8 Family) PCI Express Port 1'
    class      = bridge
    subclass   = PCI-PCI
    cap 10[40] = PCI-Express 1 root port max data 128(128)
                 max read 128
                 link x1(x1) speed 2.5(2.5) ASPM disabled(L0s/L1)
                 slot 16 power limit 10000 mW HotPlug(present) surprise
    cap 05[80] = MSI supports 1 message enabled with 1 message
    cap 0d[90] = PCI Bridge subvendor=0x8086 subdevice=0x283f
    cap 01[a0] = powerspec 2  supports D0 D3  current D0
    ecap 0002[100] = VC 1 max VC0
    ecap 0005[180] = Root Complex Link Declaration 1

pcib2@pci0:0:28:1:	class=0x060400 rev=0x04 hdr=0x01 vendor=0x8086 device=0x2841 subvendor=0x8086 subdevice=0x2841
    vendor     = 'Intel Corporation'
    device     = '82801H (ICH8 Family) PCI Express Port 2'
    class      = bridge
    subclass   = PCI-PCI
    cap 10[40] = PCI-Express 1 root port max data 128(128)
                 max read 128
                 link x1(x1) speed 2.5(2.5) ASPM disabled(L0s/L1)
                 slot 17 power limit 10000 mW HotPlug(present) surprise
    cap 05[80] = MSI supports 1 message enabled with 1 message
    cap 0d[90] = PCI Bridge subvendor=0x8086 subdevice=0x2841
    cap 01[a0] = powerspec 2  supports D0 D3  current D0
    ecap 0002[100] = VC 1 max VC0
    ecap 0005[180] = Root Complex Link Declaration 1

uhci2@pci0:0:29:0:	class=0x0c0300 rev=0x04 hdr=0x00 vendor=0x8086 device=0x2830 subvendor=0x8086 subdevice=0x2830
    vendor     = 'Intel Corporation'
    device     = '82801H (ICH8 Family) USB UHCI Controller'
    class      = serial bus
    subclass   = USB
    bar   [20] = type I/O Port, range 32, base 0xfc00, size 32, enabled

uhci3@pci0:0:29:1:	class=0x0c0300 rev=0x04 hdr=0x00 vendor=0x8086 device=0x2831 subvendor=0x8086 subdevice=0x2831
    vendor     = 'Intel Corporation'
    device     = '82801H (ICH8 Family) USB UHCI Controller'
    class      = serial bus
    subclass   = USB
    bar   [20] = type I/O Port, range 32, base 0xfb00, size 32, enabled

uhci4@pci0:0:29:2:	class=0x0c0300 rev=0x04 hdr=0x00 vendor=0x8086 device=0x2832 subvendor=0x8086 subdevice=0x2832
    vendor     = 'Intel Corporation'
    device     = '82801H (ICH8 Family) USB UHCI Controller'
    class      = serial bus
    subclass   = USB
    bar   [20] = type I/O Port, range 32, base 0xfa00, size 32, enabled

ehci1@pci0:0:29:7:	class=0x0c0320 rev=0x04 hdr=0x00 vendor=0x8086 device=0x2836 subvendor=0x8086 subdevice=0x2836
    vendor     = 'Intel Corporation'
    device     = '82801H (ICH8 Family) USB2 EHCI Controller'
    class      = serial bus
    subclass   = USB
    bar   [10] = type Memory, range 32, base 0xfdffe000, size 1024, enabled
    cap 01[50] = powerspec 2  supports D0 D3  current D0
    cap 0a[58] = EHCI Debug Port at offset 0xa0 in map 0x14

pcib3@pci0:0:30:0:	class=0x060401 rev=0xf4 hdr=0x01 vendor=0x8086 device=0x2448 subvendor=0x8086 subdevice=0x2448
    vendor     = 'Intel Corporation'
    device     = '82801 Mobile PCI Bridge'
    class      = bridge
    subclass   = PCI-PCI
    cap 0d[50] = PCI Bridge subvendor=0x8086 subdevice=0x2448

isab0@pci0:0:31:0:	class=0x060100 rev=0x04 hdr=0x00 vendor=0x8086 device=0x2815 subvendor=0x8086 subdevice=0x2815
    vendor     = 'Intel Corporation'
    device     = '82801HM (ICH8M) LPC Interface Controller'
    class      = bridge
    subclass   = PCI-ISA
    cap 09[e0] = vendor (length 12) Intel cap 1 version 0
		 features: SATA RAID-5, Mobile, 4 PCI-e x1 slots, SATA RAID-0/1/10

atapci0@pci0:0:31:1:	class=0x01018a rev=0x04 hdr=0x00 vendor=0x8086 device=0x2850 subvendor=0x8086 subdevice=0x2850
    vendor     = 'Intel Corporation'
    device     = '82801HM/HEM (ICH8M/ICH8M-E) IDE Controller'
    class      = mass storage
    subclass   = ATA
    bar   [20] = type I/O Port, range 32, base 0xf900, size 16, enabled

atapci1@pci0:0:31:2:	class=0x01018f rev=0x04 hdr=0x00 vendor=0x8086 device=0x2828 subvendor=0x8086 subdevice=0x2828
    vendor     = 'Intel Corporation'
    device     = '82801HM/HEM (ICH8M/ICH8M-E) SATA Controller [IDE mode]'
    class      = mass storage
    subclass   = ATA
    bar   [10] = type I/O Port, range 32, base 0xf800, size 8, enabled
    bar   [14] = type I/O Port, range 32, base 0xf700, size 4, enabled
    bar   [18] = type I/O Port, range 32, base 0xf600, size 8, enabled
    bar   [1c] = type I/O Port, range 32, base 0xf500, size 4, enabled
    bar   [20] = type I/O Port, range 32, base 0xf400, size 16, enabled
    bar   [24] = type I/O Port, range 32, base 0xf300, size 16, enabled
    cap 01[70] = powerspec 3  supports D0 D3  current D0

ichsmb0@pci0:0:31:3:	class=0x0c0500 rev=0x04 hdr=0x00 vendor=0x8086 device=0x283e subvendor=0x8086 subdevice=0x283e
    vendor     = 'Intel Corporation'
    device     = '82801H (ICH8 Family) SMBus Controller'
    class      = serial bus
    subclass   = SMBus
    bar   [10] = type Memory, range 32, base 0xfdffd000, size 256, enabled
    bar   [20] = type I/O Port, range 32, base 0x500, size 32, enabled

re0@pci0:1:0:0:	class=0x020000 rev=0x03 hdr=0x00 vendor=0x10ec device=0x8168 subvendor=0x10ec subdevice=0x0123
    vendor     = 'Realtek Semiconductor Co., Ltd.'
    device     = 'RTL8111/8168/8411 PCI Express Gigabit Ethernet Controller'
    class      = network
    subclass   = ethernet
    bar   [10] = type I/O Port, range 32, base 0xce00, size 256, enabled
    bar   [18] = type Prefetchable Memory, range 64, base 0xfd7ff000, size 4096, enabled
    bar   [20] = type Prefetchable Memory, range 64, base 0xfd7f8000, size 16384, enabled
    cap 01[40] = powerspec 3  supports D0 D1 D2 D3  current D0
    cap 05[50] = MSI supports 1 message, 64 bit 
    cap 10[70] = PCI-Express 2 endpoint MSI 1 max data 128(256) RO
                 max read 4096
                 link x1(x1) speed 2.5(2.5) ASPM disabled(L0s/L1) ClockPM disabled
    cap 11[ac] = MSI-X supports 4 messages, enabled
                 Table in map 0x20[0x0], PBA in map 0x20[0x800]
    cap 03[cc] = VPD
    ecap 0001[100] = AER 1 0 fatal 0 non-fatal 0 corrected
    ecap 0002[140] = VC 1 max VC0
    ecap 0003[160] = Serial 1 214b0000684ce000

re1@pci0:2:0:0:	class=0x020000 rev=0x03 hdr=0x00 vendor=0x10ec device=0x8168 subvendor=0x10ec subdevice=0x0123
    vendor     = 'Realtek Semiconductor Co., Ltd.'
    device     = 'RTL8111/8168/8411 PCI Express Gigabit Ethernet Controller'
    class      = network
    subclass   = ethernet
    bar   [10] = type I/O Port, range 32, base 0xde00, size 256, enabled
    bar   [18] = type Prefetchable Memory, range 64, base 0xfdcff000, size 4096, enabled
    bar   [20] = type Prefetchable Memory, range 64, base 0xfdcf8000, size 16384, enabled
    cap 01[40] = powerspec 3  supports D0 D1 D2 D3  current D0
    cap 05[50] = MSI supports 1 message, 64 bit 
    cap 10[70] = PCI-Express 2 endpoint MSI 1 max data 128(256) RO
                 max read 4096
                 link x1(x1) speed 2.5(2.5) ASPM disabled(L0s/L1) ClockPM disabled
    cap 11[ac] = MSI-X supports 4 messages, enabled
                 Table in map 0x20[0x0], PBA in map 0x20[0x800]
    cap 03[cc] = VPD
    ecap 0001[100] = AER 1 0 fatal 0 non-fatal 0 corrected
    ecap 0002[140] = VC 1 max VC0
    ecap 0003[160] = Serial 1 224b0000684ce000
