hostb0@pci0:0:0:0:	class=0x060000 card=0x79101002 chip=0x96001022 rev=0x00 hdr=0x00
    vendor     = 'Advanced Micro Devices, Inc. [AMD]'
    device     = 'RS780 Host Bridge'
    class      = bridge
    subclass   = HOST-PCI
    cap 08[c4] = HT slave
    cap 08[54] = HT unit ID clumping
    cap 08[40] = HT retry mode
    cap 08[9c] = HT Gen3
    cap 08[f8] = HT power management

pcib1@pci0:0:2:0:	class=0x060400 card=0x79101002 chip=0x96031022 rev=0x00 hdr=0x01
    vendor     = 'Advanced Micro Devices, Inc. [AMD]'
    device     = 'RS780 PCI to PCI bridge (ext gfx port 0)'
    class      = bridge
    subclass   = PCI-PCI
    cap 01[50] = powerspec 3  supports D0 D3  current D0
    cap 10[58] = PCI-Express 2 root port max data 128(128) RO NS
                 link x8(x16) speed 5.0(5.0) ASPM disabled(L0s/L1)
                 slot 2 power limit 75000 mW
    cap 05[a0] = MSI supports 1 message 
    cap 0d[b0] = PCI Bridge card=0x79101002
    cap 08[b8] = HT MSI fixed address window enabled at 0xfee00000
    ecap 000b[100] = Vendor 1 ID 1
    ecap 0002[110] = VC 1 max VC0

pcib2@pci0:0:4:0:	class=0x060400 card=0x79101002 chip=0x96041022 rev=0x00 hdr=0x01
    vendor     = 'Advanced Micro Devices, Inc. [AMD]'
    device     = 'RS780/RS880 PCI to PCI bridge (PCIE port 0)'
    class      = bridge
    subclass   = PCI-PCI
    cap 01[50] = powerspec 3  supports D0 D3  current D0
    cap 10[58] = PCI-Express 2 root port max data 128(128) RO NS
                 link x1(x1) speed 2.5(5.0) ASPM disabled(L0s/L1)
                 slot 4 power limit 25000 mW
    cap 05[a0] = MSI supports 1 message 
    cap 0d[b0] = PCI Bridge card=0x79101002
    cap 08[b8] = HT MSI fixed address window enabled at 0xfee00000
    ecap 000b[100] = Vendor 1 ID 1
    ecap 0002[110] = VC 1 max VC0

pcib3@pci0:0:6:0:	class=0x060400 card=0x79101002 chip=0x96061022 rev=0x00 hdr=0x01
    vendor     = 'Advanced Micro Devices, Inc. [AMD]'
    device     = 'RS780 PCI to PCI bridge (PCIE port 2)'
    class      = bridge
    subclass   = PCI-PCI
    cap 01[50] = powerspec 3  supports D0 D3  current D0
    cap 10[58] = PCI-Express 2 root port max data 128(128) RO NS
                 link x1(x1) speed 2.5(5.0) ASPM disabled(L0s/L1)
                 slot 6 power limit 25000 mW HotPlug(present) surprise
    cap 05[a0] = MSI supports 1 message enabled with 1 message
    cap 0d[b0] = PCI Bridge card=0x79101002
    cap 08[b8] = HT MSI fixed address window enabled at 0xfee00000
    ecap 000b[100] = Vendor 1 ID 1
    ecap 0002[110] = VC 1 max VC0

ahci1@pci0:0:17:0:	class=0x010601 card=0x43911002 chip=0x43911002 rev=0x00 hdr=0x00
    vendor     = 'Advanced Micro Devices, Inc. [AMD/ATI]'
    device     = 'SB7x0/SB8x0/SB9x0 SATA Controller [AHCI mode]'
    class      = mass storage
    subclass   = SATA
    bar   [10] = type I/O Port, range 32, base 0x9000, size 8, enabled
    bar   [14] = type I/O Port, range 32, base 0x8000, size 4, enabled
    bar   [18] = type I/O Port, range 32, base 0x7000, size 8, enabled
    bar   [1c] = type I/O Port, range 32, base 0x6000, size 4, enabled
    bar   [20] = type I/O Port, range 32, base 0x5000, size 16, enabled
    bar   [24] = type Memory, range 32, base 0xfcfff800, size 1024, enabled
    cap 01[60] = powerspec 2  supports D0 D3  current D0
    cap 05[50] = MSI supports 4 messages, 64 bit 
    cap 12[70] = SATA Index-Data Pair

ohci0@pci0:0:18:0:	class=0x0c0310 card=0x43971002 chip=0x43971002 rev=0x00 hdr=0x00
    vendor     = 'Advanced Micro Devices, Inc. [AMD/ATI]'
    device     = 'SB7x0/SB8x0/SB9x0 USB OHCI0 Controller'
    class      = serial bus
    subclass   = USB
    bar   [10] = type Memory, range 32, base 0xfcffe000, size 4096, enabled

ohci1@pci0:0:18:1:	class=0x0c0310 card=0x43981002 chip=0x43981002 rev=0x00 hdr=0x00
    vendor     = 'Advanced Micro Devices, Inc. [AMD/ATI]'
    device     = 'SB7x0 USB OHCI1 Controller'
    class      = serial bus
    subclass   = USB
    bar   [10] = type Memory, range 32, base 0xfcffd000, size 4096, enabled

ehci0@pci0:0:18:2:	class=0x0c0320 card=0x43971002 chip=0x43961002 rev=0x00 hdr=0x00
    vendor     = 'Advanced Micro Devices, Inc. [AMD/ATI]'
    device     = 'SB7x0/SB8x0/SB9x0 USB EHCI Controller'
    class      = serial bus
    subclass   = USB
    bar   [10] = type Memory, range 32, base 0xfcfff000, size 256, enabled
    cap 01[c0] = powerspec 2  supports D0 D1 D2 D3  current D0
    cap 0a[e4] = EHCI Debug Port at offset 0xe0 in map 0x14

ohci2@pci0:0:19:0:	class=0x0c0310 card=0x43981002 chip=0x43971002 rev=0x00 hdr=0x00
    vendor     = 'Advanced Micro Devices, Inc. [AMD/ATI]'
    device     = 'SB7x0/SB8x0/SB9x0 USB OHCI0 Controller'
    class      = serial bus
    subclass   = USB
    bar   [10] = type Memory, range 32, base 0xfcffc000, size 4096, enabled

ohci3@pci0:0:19:1:	class=0x0c0310 card=0x43991002 chip=0x43981002 rev=0x00 hdr=0x00
    vendor     = 'Advanced Micro Devices, Inc. [AMD/ATI]'
    device     = 'SB7x0 USB OHCI1 Controller'
    class      = serial bus
    subclass   = USB
    bar   [10] = type Memory, range 32, base 0xfcffb000, size 4096, enabled

ehci1@pci0:0:19:2:	class=0x0c0320 card=0x43961002 chip=0x43961002 rev=0x00 hdr=0x00
    vendor     = 'Advanced Micro Devices, Inc. [AMD/ATI]'
    device     = 'SB7x0/SB8x0/SB9x0 USB EHCI Controller'
    class      = serial bus
    subclass   = USB
    bar   [10] = type Memory, range 32, base 0xfcffa800, size 256, enabled
    cap 01[c0] = powerspec 2  supports D0 D1 D2 D3  current D0
    cap 0a[e4] = EHCI Debug Port at offset 0xe0 in map 0x14

intsmb0@pci0:0:20:0:	class=0x0c0500 card=0x00000000 chip=0x43851002 rev=0x3a hdr=0x00
    vendor     = 'Advanced Micro Devices, Inc. [AMD/ATI]'
    device     = 'SBx00 SMBus Controller'
    class      = serial bus
    subclass   = SMBus

atapci0@pci0:0:20:1:	class=0x01018a card=0x82f11043 chip=0x439c1002 rev=0x00 hdr=0x00
    vendor     = 'Advanced Micro Devices, Inc. [AMD/ATI]'
    device     = 'SB7x0/SB8x0/SB9x0 IDE Controller'
    class      = mass storage
    subclass   = ATA
    bar   [20] = type I/O Port, range 32, base 0xff00, size 16, enabled
    cap 05[70] = MSI supports 1 message 

hdac1@pci0:0:20:2:	class=0x040300 card=0x82fe1043 chip=0x43831002 rev=0x00 hdr=0x00
    vendor     = 'Advanced Micro Devices, Inc. [AMD/ATI]'
    device     = 'SBx00 Azalia (Intel HDA)'
    class      = multimedia
    subclass   = HDA
    bar   [10] = type Memory, range 64, base 0xfcff4000, size 16384, enabled
    cap 01[50] = powerspec 2  supports D0 D3  current D0

isab0@pci0:0:20:3:	class=0x060100 card=0x43831002 chip=0x439d1002 rev=0x00 hdr=0x00
    vendor     = 'Advanced Micro Devices, Inc. [AMD/ATI]'
    device     = 'SB7x0/SB8x0/SB9x0 LPC host controller'
    class      = bridge
    subclass   = PCI-ISA

pcib4@pci0:0:20:4:	class=0x060401 card=0x00000000 chip=0x43841002 rev=0x00 hdr=0x01
    vendor     = 'Advanced Micro Devices, Inc. [AMD/ATI]'
    device     = 'SBx00 PCI to PCI Bridge'
    class      = bridge
    subclass   = PCI-PCI

ohci4@pci0:0:20:5:	class=0x0c0310 card=0x43961002 chip=0x43991002 rev=0x00 hdr=0x00
    vendor     = 'Advanced Micro Devices, Inc. [AMD/ATI]'
    device     = 'SB7x0/SB8x0/SB9x0 USB OHCI2 Controller'
    class      = serial bus
    subclass   = USB
    bar   [10] = type Memory, range 32, base 0xfcff9000, size 4096, enabled

hostb1@pci0:0:24:0:	class=0x060000 card=0x00000000 chip=0x12001022 rev=0x00 hdr=0x00
    vendor     = 'Advanced Micro Devices, Inc. [AMD]'
    device     = 'Family 10h Processor HyperTransport Configuration'
    class      = bridge
    subclass   = HOST-PCI
    cap 08[80] = HT host

hostb2@pci0:0:24:1:	class=0x060000 card=0x00000000 chip=0x12011022 rev=0x00 hdr=0x00
    vendor     = 'Advanced Micro Devices, Inc. [AMD]'
    device     = 'Family 10h Processor Address Map'
    class      = bridge
    subclass   = HOST-PCI

hostb3@pci0:0:24:2:	class=0x060000 card=0x00000000 chip=0x12021022 rev=0x00 hdr=0x00
    vendor     = 'Advanced Micro Devices, Inc. [AMD]'
    device     = 'Family 10h Processor DRAM Controller'
    class      = bridge
    subclass   = HOST-PCI

hostb4@pci0:0:24:3:	class=0x060000 card=0x00000000 chip=0x12031022 rev=0x00 hdr=0x00
    vendor     = 'Advanced Micro Devices, Inc. [AMD]'
    device     = 'Family 10h Processor Miscellaneous Control'
    class      = bridge
    subclass   = HOST-PCI
    cap 0f[f0] = unknown

hostb5@pci0:0:24:4:	class=0x060000 card=0x00000000 chip=0x12041022 rev=0x00 hdr=0x00
    vendor     = 'Advanced Micro Devices, Inc. [AMD]'
    device     = 'Family 10h Processor Link Control'
    class      = bridge
    subclass   = HOST-PCI

vgapci0@pci0:1:0:0:	class=0x030000 card=0x8c931462 chip=0x128b10de rev=0xa1 hdr=0x00
    vendor     = 'NVIDIA Corporation'
    device     = 'GK208B [GeForce GT 710]'
    class      = display
    subclass   = VGA
    bar   [10] = type Memory, range 32, base 0xfd000000, size 16777216, enabled
    bar   [14] = type Prefetchable Memory, range 64, base 0xf0000000, size 134217728, enabled
    bar   [1c] = type Prefetchable Memory, range 64, base 0xf8000000, size 33554432, enabled
    bar   [24] = type I/O Port, range 32, base 0xa800, size 128, enabled
    cap 01[60] = powerspec 3  supports D0 D3  current D0
    cap 05[68] = MSI supports 1 message, 64 bit enabled with 1 message
    cap 10[78] = PCI-Express 2 legacy endpoint max data 128(256) RO NS
                 link x8(x8) speed 5.0(5.0) ClockPM enabled
    ecap 0002[100] = VC 1 max VC0
    ecap 0004[128] = Power Budgeting 1
    ecap 000b[600] = Vendor 1 ID 1

hdac0@pci0:1:0:1:	class=0x040300 card=0x8c931462 chip=0x0e0f10de rev=0xa1 hdr=0x00
    vendor     = 'NVIDIA Corporation'
    device     = 'GK208 HDMI/DP Audio Controller'
    class      = multimedia
    subclass   = HDA
    bar   [10] = type Memory, range 32, base 0xfe87c000, size 16384, enabled
    cap 01[60] = powerspec 3  supports D0 D3  current D0
    cap 05[68] = MSI supports 1 message, 64 bit enabled with 1 message
    cap 10[78] = PCI-Express 2 endpoint max data 128(256) NS
                 link x8(x8) speed 5.0(5.0) ClockPM enabled

ahci0@pci0:2:0:0:	class=0x010601 card=0x10601b21 chip=0x06121b21 rev=0x01 hdr=0x00
    vendor     = 'ASMedia Technology Inc.'
    device     = 'ASM1062 Serial ATA Controller'
    class      = mass storage
    subclass   = SATA
    bar   [10] = type I/O Port, range 32, base 0xc800, size 8, enabled
    bar   [14] = type I/O Port, range 32, base 0xc400, size 4, enabled
    bar   [18] = type I/O Port, range 32, base 0xc000, size 8, enabled
    bar   [1c] = type I/O Port, range 32, base 0xb800, size 4, enabled
    bar   [20] = type I/O Port, range 32, base 0xb400, size 32, enabled
    bar   [24] = type Memory, range 32, base 0xfe9ffc00, size 512, enabled
    cap 05[50] = MSI supports 1 message 
    cap 01[78] = powerspec 3  supports D0 D3  current D0
    cap 10[80] = PCI-Express 2 legacy endpoint max data 128(512) RO NS
                 link x1(x1) speed 2.5(5.0) ASPM disabled(L1)
    ecap 0002[100] = VC 1 max VC0

re0@pci0:3:0:0:	class=0x020000 card=0x82c61043 chip=0x816810ec rev=0x02 hdr=0x00
    vendor     = 'Realtek Semiconductor Co., Ltd.'
    device     = 'RTL8111/8168/8411 PCI Express Gigabit Ethernet Controller'
    class      = network
    subclass   = ethernet
    bar   [10] = type I/O Port, range 32, base 0xd800, size 256, enabled
    bar   [18] = type Memory, range 64, base 0xfeaff000, size 4096, enabled
    bar   [20] = type Prefetchable Memory, range 64, base 0xfbff0000, size 65536, enabled
    cap 01[40] = powerspec 3  supports D0 D1 D2 D3  current D0
    cap 05[50] = MSI supports 1 message, 64 bit 
    cap 10[70] = PCI-Express 1 endpoint MSI 1 max data 128(256)
                 link x1(x1) speed 2.5(2.5) ASPM disabled(L0s/L1) ClockPM disabled
    cap 11[b0] = MSI-X supports 2 messages, enabled
                 Table in map 0x20[0x0], PBA in map 0x20[0x800]
    cap 03[d0] = VPD
    ecap 0001[100] = AER 1 0 fatal 0 non-fatal 2 corrected
    ecap 0002[140] = VC 1 max VC0
    ecap 0003[160] = Serial 1 02000000684ce000

none0@pci0:4:5:0:	class=0x048000 card=0x48761043 chip=0x71331131 rev=0xd1 hdr=0x00
    vendor     = 'Philips Semiconductors'
    device     = 'SAA7131/SAA7133/SAA7135 Video Broadcast Decoder'
    class      = multimedia
    bar   [10] = type Memory, range 32, base 0xfebff800, size 2048, enabled
    cap 01[40] = powerspec 2  supports D0 D1 D2 D3  current D0

none1@pci0:4:6:0:	class=0x028000 card=0x70001799 chip=0x432014e4 rev=0x03 hdr=0x00
    vendor     = 'Broadcom Inc. and subsidiaries'
    device     = 'BCM4306 802.11b/g Wireless LAN Controller'
    class      = network
    bar   [10] = type Memory, range 32, base 0xfebfc000, size 8192, enabled

re1@pci0:4:7:0:	class=0x020000 card=0x011616ec chip=0x011616ec rev=0x10 hdr=0x00
    vendor     = 'U.S. Robotics'
    device     = 'USR997902 10/100/1000 Mbps PCI Network Card'
    class      = network
    subclass   = ethernet
    bar   [10] = type I/O Port, range 32, base 0xe800, size 256, enabled
    bar   [14] = type Memory, range 32, base 0xfebff400, size 256, enabled
    cap 01[dc] = powerspec 2  supports D0 D1 D2 D3  current D0
