hostb0@pci0:0:0:0:	class=0x060000 card=0x00008086 chip=0x20208086 rev=0x07 hdr=0x00
    vendor     = 'Intel Corporation'
    device     = 'Sky Lake-E DMI3 Registers'
    class      = bridge
    subclass   = HOST-PCI
    cap 10[90] = PCI-Express 2 root port max data 128(256)
                 link x0(x4) speed 0.0(8.0)
    cap 01[e0] = powerspec 3  supports D0 D3  current D0
    ecap 000b[100] = Vendor 1 ID 2
    ecap 000b[144] = Vendor 1 ID 4
    ecap 000b[1d0] = Vendor 1 ID 3
    ecap 0019[250] = PCIe Sec 1 lane errors 0xf
    ecap 000b[280] = Vendor 1 ID 5
    ecap 000b[300] = Vendor 1 ID 8

none0@pci0:0:5:0:	class=0x088000 card=0x00008086 chip=0x20248086 rev=0x07 hdr=0x00
    vendor     = 'Intel Corporation'
    device     = 'Sky Lake-E MM/Vt-d Configuration Registers'
    class      = base peripheral
    cap 10[40] = PCI-Express 2 root endpoint max data 128(128)

none1@pci0:0:5:2:	class=0x088000 card=0x00000000 chip=0x20258086 rev=0x07 hdr=0x00
    vendor     = 'Intel Corporation'
    device     = 'Sky Lake-E RAS'
    class      = base peripheral
    cap 10[40] = PCI-Express 2 root endpoint max data 128(128)

ioapic0@pci0:0:5:4:	class=0x080020 card=0x20268086 chip=0x20268086 rev=0x07 hdr=0x00
    vendor     = 'Intel Corporation'
    device     = 'Sky Lake-E IOAPIC'
    class      = base peripheral
    subclass   = interrupt controller
    bar   [10] = type Memory, range 32, base 0x92f20000, size 4096, enabled
    cap 10[44] = PCI-Express 1 root endpoint max data 128(128)
    cap 01[e0] = powerspec 3  supports D0 D3  current D0

none2@pci0:0:8:0:	class=0x088000 card=0x00008086 chip=0x20148086 rev=0x07 hdr=0x00
    vendor     = 'Intel Corporation'
    device     = 'Sky Lake-E Ubox Registers'
    class      = base peripheral
    cap 10[40] = PCI-Express 2 root endpoint max data 128(128)

none3@pci0:0:8:1:	class=0x110100 card=0x00008086 chip=0x20158086 rev=0x07 hdr=0x00
    vendor     = 'Intel Corporation'
    device     = 'Sky Lake-E Ubox Registers'
    class      = dasp
    subclass   = performance counters

none4@pci0:0:8:2:	class=0x088000 card=0x00008086 chip=0x20168086 rev=0x07 hdr=0x00
    vendor     = 'Intel Corporation'
    device     = 'Sky Lake-E Ubox Registers'
    class      = base peripheral
    cap 10[40] = PCI-Express 2 root endpoint max data 128(128)

none5@pci0:0:17:0:	class=0xff0000 card=0x07161028 chip=0xa1ec8086 rev=0x09 hdr=0x00
    vendor     = 'Intel Corporation'
    device     = 'C620 Series Chipset Family MROM 0'
    cap 01[80] = powerspec 3  supports D0 D3  current D0

ahci0@pci0:0:17:5:	class=0x010601 card=0x07161028 chip=0xa1d28086 rev=0x09 hdr=0x00
    vendor     = 'Intel Corporation'
    device     = 'C620 Series Chipset Family SSATA Controller [AHCI mode]'
    class      = mass storage
    subclass   = SATA
    bar   [10] = type Memory, range 32, base 0x92f16000, size 8192, enabled
    bar   [14] = type Memory, range 32, base 0x92f1f000, size 256, enabled
    bar   [18] = type I/O Port, range 32, base 0x2068, size 8, enabled
    bar   [1c] = type I/O Port, range 32, base 0x2074, size 4, enabled
    bar   [20] = type I/O Port, range 32, base 0x2040, size 32, enabled
    bar   [24] = type Memory, range 32, base 0x92e80000, size 524288, enabled
    cap 05[80] = MSI supports 1 message enabled with 1 message
    cap 01[70] = powerspec 3  supports D0 D3  current D0
    cap 12[a8] = SATA Index-Data Pair

xhci0@pci0:0:20:0:	class=0x0c0330 card=0x07161028 chip=0xa1af8086 rev=0x09 hdr=0x00
    vendor     = 'Intel Corporation'
    device     = 'C620 Series Chipset Family USB 3.0 xHCI Controller'
    class      = serial bus
    subclass   = USB
    bar   [10] = type Memory, range 64, base 0x92f00000, size 65536, enabled
    cap 01[70] = powerspec 2  supports D0 D3  current D0
    cap 05[80] = MSI supports 8 messages, 64 bit enabled with 1 message

none6@pci0:0:20:2:	class=0x118000 card=0x07161028 chip=0xa1b18086 rev=0x09 hdr=0x00
    vendor     = 'Intel Corporation'
    device     = 'C620 Series Chipset Family Thermal Subsystem'
    class      = dasp
    bar   [10] = type Memory, range 64, base 0x92f1c000, size 4096, enabled
    cap 01[50] = powerspec 3  supports D0 D3  current D0
    cap 05[80] = MSI supports 1 message 

none7@pci0:0:22:0:	class=0x078000 card=0x07161028 chip=0xa1ba8086 rev=0x09 hdr=0x00
    vendor     = 'Intel Corporation'
    device     = 'C620 Series Chipset Family MEI Controller'
    class      = simple comms
    bar   [10] = type Memory, range 64, base 0x92f1b000, size 4096, enabled
    cap 01[50] = powerspec 3  supports D0 D3  current D0
    cap 05[8c] = MSI supports 1 message, 64 bit 

none8@pci0:0:22:1:	class=0x078000 card=0x07161028 chip=0xa1bb8086 rev=0x09 hdr=0x00
    vendor     = 'Intel Corporation'
    device     = 'C620 Series Chipset Family MEI Controller'
    class      = simple comms
    bar   [10] = type Memory, range 64, base 0x92f1a000, size 4096, enabled
    cap 01[50] = powerspec 3  supports D0 D3  current D0
    cap 05[8c] = MSI supports 1 message, 64 bit 

none9@pci0:0:22:4:	class=0x078000 card=0x07161028 chip=0xa1be8086 rev=0x09 hdr=0x00
    vendor     = 'Intel Corporation'
    device     = 'C620 Series Chipset Family MEI Controller'
    class      = simple comms
    bar   [10] = type Memory, range 64, base 0x92f19000, size 4096, enabled
    cap 01[50] = powerspec 3  supports D0 D3  current D0
    cap 05[8c] = MSI supports 1 message, 64 bit 

ahci1@pci0:0:23:0:	class=0x010601 card=0x07161028 chip=0xa1828086 rev=0x09 hdr=0x00
    vendor     = 'Intel Corporation'
    device     = 'C620 Series Chipset Family SATA Controller [AHCI mode]'
    class      = mass storage
    subclass   = SATA
    bar   [10] = type Memory, range 32, base 0x92f14000, size 8192, enabled
    bar   [14] = type Memory, range 32, base 0x92f1e000, size 256, enabled
    bar   [18] = type I/O Port, range 32, base 0x2060, size 8, enabled
    bar   [1c] = type I/O Port, range 32, base 0x2070, size 4, enabled
    bar   [20] = type I/O Port, range 32, base 0x2020, size 32, enabled
    bar   [24] = type Memory, range 32, base 0x92e00000, size 524288, enabled
    cap 05[80] = MSI supports 1 message enabled with 1 message
    cap 01[70] = powerspec 3  supports D0 D3  current D0
    cap 12[a8] = SATA Index-Data Pair

pcib1@pci0:0:28:0:	class=0x060400 card=0x07161028 chip=0xa1908086 rev=0xf9 hdr=0x01
    vendor     = 'Intel Corporation'
    device     = 'C620 Series Chipset Family PCI Express Root Port'
    class      = bridge
    subclass   = PCI-PCI
    cap 10[40] = PCI-Express 2 root port max data 256(256) ARI disabled
                 link x0(x2) speed 0.0(8.0) ASPM disabled(L0s/L1)
                 slot 0 power limit 0 mW HotPlug(empty) surprise
    cap 05[80] = MSI supports 1 message enabled with 1 message
    cap 0d[90] = PCI Bridge card=0x07161028
    cap 01[a0] = powerspec 3  supports D0 D3  current D0

pcib2@pci0:0:28:4:	class=0x060400 card=0x07161028 chip=0xa1948086 rev=0xf9 hdr=0x01
    vendor     = 'Intel Corporation'
    device     = 'C620 Series Chipset Family PCI Express Root Port'
    class      = bridge
    subclass   = PCI-PCI
    cap 10[40] = PCI-Express 2 root port max data 128(128) ARI disabled
                 link x1(x1) speed 5.0(5.0) ASPM disabled(L1)
                 slot 0 power limit 100 mW
    cap 05[80] = MSI supports 1 message 
    cap 0d[90] = PCI Bridge card=0x07161028
    cap 01[a0] = powerspec 3  supports D0 D3  current D0
    ecap 0001[100] = AER 1 0 fatal 0 non-fatal 0 corrected
    ecap 000d[140] = ACS 1

isab0@pci0:0:31:0:	class=0x060100 card=0x07161028 chip=0xa1c18086 rev=0x09 hdr=0x00
    vendor     = 'Intel Corporation'
    device     = 'C621 Series Chipset LPC/eSPI Controller'
    class      = bridge
    subclass   = PCI-ISA

none10@pci0:0:31:2:	class=0x058000 card=0x07161028 chip=0xa1a18086 rev=0x09 hdr=0x00
    vendor     = 'Intel Corporation'
    device     = 'C620 Series Chipset Family Power Management Controller'
    class      = memory
    bar   [10] = type Memory, range 32, base 0x92f10000, size 16384, enabled

none11@pci0:0:31:4:	class=0x0c0500 card=0x07161028 chip=0xa1a38086 rev=0x09 hdr=0x00
    vendor     = 'Intel Corporation'
    device     = 'C620 Series Chipset Family SMBus'
    class      = serial bus
    subclass   = SMBus
    bar   [10] = type Memory, range 64, base 0x92f18000, size 256, enabled
    bar   [20] = type I/O Port, range 32, base 0x2000, size 32, enabled

none12@pci0:0:31:5:	class=0x0c8000 card=0x07161028 chip=0xa1a48086 rev=0x09 hdr=0x00
    vendor     = 'Intel Corporation'
    device     = 'C620 Series Chipset Family SPI Controller'
    class      = serial bus
    bar   [10] = type Memory, range 32, base 0xfe010000, size 4096, enabled

pcib3@pci0:2:0:0:	class=0x060400 card=0x00000000 chip=0xbe001556 rev=0x02 hdr=0x01
    vendor     = 'PLDA'
    class      = bridge
    subclass   = PCI-PCI
    cap 05[50] = MSI supports 1 message, 64 bit 
    cap 01[78] = powerspec 3  supports D0 D3  current D0
    cap 10[80] = PCI-Express 2 PCI bridge max data 128(128) RO NS
                 link x1(x1) speed 5.0(5.0) ASPM disabled(L0s/L1)
    ecap 0002[100] = VC 1 max VC0
    ecap 0001[800] = AER 1 0 fatal 0 non-fatal 1 corrected

vgapci0@pci0:3:0:0:	class=0x030000 card=0x07161028 chip=0x0536102b rev=0x04 hdr=0x00
    vendor     = 'Matrox Electronics Systems Ltd.'
    device     = 'Integrated Matrox G200eW3 Graphics Controller'
    class      = display
    subclass   = VGA
    bar   [10] = type Prefetchable Memory, range 32, base 0x91000000, size 16777216, enabled
    bar   [14] = type Memory, range 32, base 0x92808000, size 16384, enabled
    bar   [18] = type Memory, range 32, base 0x92000000, size 8388608, enabled
    cap 01[dc] = powerspec 3  supports D0 D3  current D0

pcib5@pci0:23:0:0:	class=0x060400 card=0x00008086 chip=0x20308086 rev=0x07 hdr=0x01
    vendor     = 'Intel Corporation'
    device     = 'Sky Lake-E PCI Express Root Port A'
    class      = bridge
    subclass   = PCI-PCI
    cap 0d[40] = PCI Bridge card=0x00008086
    cap 05[60] = MSI supports 2 messages, vector masks 
    cap 10[90] = PCI-Express 2 root port max data 256(256) ARI enabled
                 link x8(x8) speed 8.0(8.0) ASPM disabled(L1)
    cap 01[e0] = powerspec 3  supports D0 D3  current D0
    ecap 000b[100] = Vendor 1 ID 2
    ecap 000d[110] = ACS 1
    ecap 0001[148] = AER 1 0 fatal 0 non-fatal 0 corrected
    ecap 000b[1d0] = Vendor 1 ID 3
    ecap 0019[250] = PCIe Sec 1 lane errors 0
    ecap 000b[280] = Vendor 1 ID 5
    ecap 000b[300] = Vendor 1 ID 8

pcib6@pci0:23:2:0:	class=0x060400 card=0x00008086 chip=0x20328086 rev=0x07 hdr=0x01
    vendor     = 'Intel Corporation'
    device     = 'Sky Lake-E PCI Express Root Port C'
    class      = bridge
    subclass   = PCI-PCI
    cap 0d[40] = PCI Bridge card=0x00008086
    cap 05[60] = MSI supports 2 messages, vector masks 
    cap 10[90] = PCI-Express 2 root port max data 256(256) ARI disabled
                 link x8(x8) speed 8.0(8.0) ASPM disabled(L1)
    cap 01[e0] = powerspec 3  supports D0 D3  current D0
    ecap 000b[100] = Vendor 1 ID 2
    ecap 000d[110] = ACS 1
    ecap 0001[148] = AER 1 0 fatal 0 non-fatal 0 corrected
    ecap 000b[1d0] = Vendor 1 ID 3
    ecap 0019[250] = PCIe Sec 1 lane errors 0
    ecap 000b[280] = Vendor 1 ID 5
    ecap 000b[300] = Vendor 1 ID 8

none13@pci0:23:5:0:	class=0x088000 card=0x00008086 chip=0x20348086 rev=0x07 hdr=0x00
    vendor     = 'Intel Corporation'
    device     = 'Sky Lake-E VT-d'
    class      = base peripheral
    cap 10[40] = PCI-Express 2 root endpoint max data 128(128)

none14@pci0:23:5:2:	class=0x088000 card=0x00000000 chip=0x20358086 rev=0x07 hdr=0x00
    vendor     = 'Intel Corporation'
    device     = 'Sky Lake-E RAS Configuration Registers'
    class      = base peripheral
    cap 10[40] = PCI-Express 2 root endpoint max data 128(128)

ioapic1@pci0:23:5:4:	class=0x080020 card=0x20368086 chip=0x20368086 rev=0x07 hdr=0x00
    vendor     = 'Intel Corporation'
    device     = 'Sky Lake-E IOxAPIC Configuration Registers'
    class      = base peripheral
    subclass   = interrupt controller
    bar   [10] = type Memory, range 32, base 0xa2300000, size 4096, enabled
    cap 10[44] = PCI-Express 1 root endpoint max data 128(128)
    cap 01[e0] = powerspec 3  supports D0 D3  current D0

none15@pci0:23:8:0:	class=0x088000 card=0x00008086 chip=0x208d8086 rev=0x07 hdr=0x00
    vendor     = 'Intel Corporation'
    device     = 'Sky Lake-E CHA Registers'
    class      = base peripheral

none16@pci0:23:8:1:	class=0x088000 card=0x00008086 chip=0x208d8086 rev=0x07 hdr=0x00
    vendor     = 'Intel Corporation'
    device     = 'Sky Lake-E CHA Registers'
    class      = base peripheral

none17@pci0:23:8:2:	class=0x088000 card=0x00008086 chip=0x208d8086 rev=0x07 hdr=0x00
    vendor     = 'Intel Corporation'
    device     = 'Sky Lake-E CHA Registers'
    class      = base peripheral

none18@pci0:23:8:3:	class=0x088000 card=0x00008086 chip=0x208d8086 rev=0x07 hdr=0x00
    vendor     = 'Intel Corporation'
    device     = 'Sky Lake-E CHA Registers'
    class      = base peripheral

none19@pci0:23:8:4:	class=0x088000 card=0x00008086 chip=0x208d8086 rev=0x07 hdr=0x00
    vendor     = 'Intel Corporation'
    device     = 'Sky Lake-E CHA Registers'
    class      = base peripheral

none20@pci0:23:8:5:	class=0x088000 card=0x00008086 chip=0x208d8086 rev=0x07 hdr=0x00
    vendor     = 'Intel Corporation'
    device     = 'Sky Lake-E CHA Registers'
    class      = base peripheral

none21@pci0:23:8:6:	class=0x088000 card=0x00008086 chip=0x208d8086 rev=0x07 hdr=0x00
    vendor     = 'Intel Corporation'
    device     = 'Sky Lake-E CHA Registers'
    class      = base peripheral

none22@pci0:23:8:7:	class=0x088000 card=0x00008086 chip=0x208d8086 rev=0x07 hdr=0x00
    vendor     = 'Intel Corporation'
    device     = 'Sky Lake-E CHA Registers'
    class      = base peripheral

none23@pci0:23:9:0:	class=0x088000 card=0x00008086 chip=0x208d8086 rev=0x07 hdr=0x00
    vendor     = 'Intel Corporation'
    device     = 'Sky Lake-E CHA Registers'
    class      = base peripheral

none24@pci0:23:9:1:	class=0x088000 card=0x00008086 chip=0x208d8086 rev=0x07 hdr=0x00
    vendor     = 'Intel Corporation'
    device     = 'Sky Lake-E CHA Registers'
    class      = base peripheral

none25@pci0:23:9:2:	class=0x088000 card=0x00008086 chip=0x208d8086 rev=0x07 hdr=0x00
    vendor     = 'Intel Corporation'
    device     = 'Sky Lake-E CHA Registers'
    class      = base peripheral

none26@pci0:23:9:3:	class=0x088000 card=0x00008086 chip=0x208d8086 rev=0x07 hdr=0x00
    vendor     = 'Intel Corporation'
    device     = 'Sky Lake-E CHA Registers'
    class      = base peripheral

none27@pci0:23:9:4:	class=0x088000 card=0x00008086 chip=0x208d8086 rev=0x07 hdr=0x00
    vendor     = 'Intel Corporation'
    device     = 'Sky Lake-E CHA Registers'
    class      = base peripheral

none28@pci0:23:9:5:	class=0x088000 card=0x00008086 chip=0x208d8086 rev=0x07 hdr=0x00
    vendor     = 'Intel Corporation'
    device     = 'Sky Lake-E CHA Registers'
    class      = base peripheral

none29@pci0:23:9:6:	class=0x088000 card=0x00008086 chip=0x208d8086 rev=0x07 hdr=0x00
    vendor     = 'Intel Corporation'
    device     = 'Sky Lake-E CHA Registers'
    class      = base peripheral

none30@pci0:23:9:7:	class=0x088000 card=0x00008086 chip=0x208d8086 rev=0x07 hdr=0x00
    vendor     = 'Intel Corporation'
    device     = 'Sky Lake-E CHA Registers'
    class      = base peripheral

none31@pci0:23:10:0:	class=0x088000 card=0x00008086 chip=0x208d8086 rev=0x07 hdr=0x00
    vendor     = 'Intel Corporation'
    device     = 'Sky Lake-E CHA Registers'
    class      = base peripheral

none32@pci0:23:10:1:	class=0x088000 card=0x00008086 chip=0x208d8086 rev=0x07 hdr=0x00
    vendor     = 'Intel Corporation'
    device     = 'Sky Lake-E CHA Registers'
    class      = base peripheral

none33@pci0:23:14:0:	class=0x088000 card=0x00008086 chip=0x208e8086 rev=0x07 hdr=0x00
    vendor     = 'Intel Corporation'
    device     = 'Sky Lake-E CHA Registers'
    class      = base peripheral

none34@pci0:23:14:1:	class=0x088000 card=0x00008086 chip=0x208e8086 rev=0x07 hdr=0x00
    vendor     = 'Intel Corporation'
    device     = 'Sky Lake-E CHA Registers'
    class      = base peripheral

none35@pci0:23:14:2:	class=0x088000 card=0x00008086 chip=0x208e8086 rev=0x07 hdr=0x00
    vendor     = 'Intel Corporation'
    device     = 'Sky Lake-E CHA Registers'
    class      = base peripheral

none36@pci0:23:14:3:	class=0x088000 card=0x00008086 chip=0x208e8086 rev=0x07 hdr=0x00
    vendor     = 'Intel Corporation'
    device     = 'Sky Lake-E CHA Registers'
    class      = base peripheral

none37@pci0:23:14:4:	class=0x088000 card=0x00008086 chip=0x208e8086 rev=0x07 hdr=0x00
    vendor     = 'Intel Corporation'
    device     = 'Sky Lake-E CHA Registers'
    class      = base peripheral

none38@pci0:23:14:5:	class=0x088000 card=0x00008086 chip=0x208e8086 rev=0x07 hdr=0x00
    vendor     = 'Intel Corporation'
    device     = 'Sky Lake-E CHA Registers'
    class      = base peripheral

none39@pci0:23:14:6:	class=0x088000 card=0x00008086 chip=0x208e8086 rev=0x07 hdr=0x00
    vendor     = 'Intel Corporation'
    device     = 'Sky Lake-E CHA Registers'
    class      = base peripheral

none40@pci0:23:14:7:	class=0x088000 card=0x00008086 chip=0x208e8086 rev=0x07 hdr=0x00
    vendor     = 'Intel Corporation'
    device     = 'Sky Lake-E CHA Registers'
    class      = base peripheral

none41@pci0:23:15:0:	class=0x088000 card=0x00008086 chip=0x208e8086 rev=0x07 hdr=0x00
    vendor     = 'Intel Corporation'
    device     = 'Sky Lake-E CHA Registers'
    class      = base peripheral

none42@pci0:23:15:1:	class=0x088000 card=0x00008086 chip=0x208e8086 rev=0x07 hdr=0x00
    vendor     = 'Intel Corporation'
    device     = 'Sky Lake-E CHA Registers'
    class      = base peripheral

none43@pci0:23:15:2:	class=0x088000 card=0x00008086 chip=0x208e8086 rev=0x07 hdr=0x00
    vendor     = 'Intel Corporation'
    device     = 'Sky Lake-E CHA Registers'
    class      = base peripheral

none44@pci0:23:15:3:	class=0x088000 card=0x00008086 chip=0x208e8086 rev=0x07 hdr=0x00
    vendor     = 'Intel Corporation'
    device     = 'Sky Lake-E CHA Registers'
    class      = base peripheral

none45@pci0:23:15:4:	class=0x088000 card=0x00008086 chip=0x208e8086 rev=0x07 hdr=0x00
    vendor     = 'Intel Corporation'
    device     = 'Sky Lake-E CHA Registers'
    class      = base peripheral

none46@pci0:23:15:5:	class=0x088000 card=0x00008086 chip=0x208e8086 rev=0x07 hdr=0x00
    vendor     = 'Intel Corporation'
    device     = 'Sky Lake-E CHA Registers'
    class      = base peripheral

none47@pci0:23:15:6:	class=0x088000 card=0x00008086 chip=0x208e8086 rev=0x07 hdr=0x00
    vendor     = 'Intel Corporation'
    device     = 'Sky Lake-E CHA Registers'
    class      = base peripheral

none48@pci0:23:15:7:	class=0x088000 card=0x00008086 chip=0x208e8086 rev=0x07 hdr=0x00
    vendor     = 'Intel Corporation'
    device     = 'Sky Lake-E CHA Registers'
    class      = base peripheral

none49@pci0:23:16:0:	class=0x088000 card=0x00008086 chip=0x208e8086 rev=0x07 hdr=0x00
    vendor     = 'Intel Corporation'
    device     = 'Sky Lake-E CHA Registers'
    class      = base peripheral

none50@pci0:23:16:1:	class=0x088000 card=0x00008086 chip=0x208e8086 rev=0x07 hdr=0x00
    vendor     = 'Intel Corporation'
    device     = 'Sky Lake-E CHA Registers'
    class      = base peripheral

none51@pci0:23:29:0:	class=0x088000 card=0x00008086 chip=0x20548086 rev=0x07 hdr=0x00
    vendor     = 'Intel Corporation'
    device     = 'Sky Lake-E CHA Registers'
    class      = base peripheral

none52@pci0:23:29:1:	class=0x088000 card=0x00008086 chip=0x20558086 rev=0x07 hdr=0x00
    vendor     = 'Intel Corporation'
    device     = 'Sky Lake-E CHA Registers'
    class      = base peripheral

none53@pci0:23:29:2:	class=0x088000 card=0x00008086 chip=0x20568086 rev=0x07 hdr=0x00
    vendor     = 'Intel Corporation'
    device     = 'Sky Lake-E CHA Registers'
    class      = base peripheral

none54@pci0:23:29:3:	class=0x088000 card=0x00008086 chip=0x20578086 rev=0x07 hdr=0x00
    vendor     = 'Intel Corporation'
    device     = 'Sky Lake-E CHA Registers'
    class      = base peripheral

none55@pci0:23:30:0:	class=0x088000 card=0x00008086 chip=0x20808086 rev=0x07 hdr=0x00
    vendor     = 'Intel Corporation'
    device     = 'Sky Lake-E PCU Registers'
    class      = base peripheral

none56@pci0:23:30:1:	class=0x088000 card=0x00008086 chip=0x20818086 rev=0x07 hdr=0x00
    vendor     = 'Intel Corporation'
    device     = 'Sky Lake-E PCU Registers'
    class      = base peripheral

none57@pci0:23:30:2:	class=0x088000 card=0x00008086 chip=0x20828086 rev=0x07 hdr=0x00
    vendor     = 'Intel Corporation'
    device     = 'Sky Lake-E PCU Registers'
    class      = base peripheral

none58@pci0:23:30:3:	class=0x088000 card=0x00008086 chip=0x20838086 rev=0x07 hdr=0x00
    vendor     = 'Intel Corporation'
    device     = 'Sky Lake-E PCU Registers'
    class      = base peripheral

none59@pci0:23:30:4:	class=0x088000 card=0x00008086 chip=0x20848086 rev=0x07 hdr=0x00
    vendor     = 'Intel Corporation'
    device     = 'Sky Lake-E PCU Registers'
    class      = base peripheral

none60@pci0:23:30:5:	class=0x088000 card=0x00008086 chip=0x20858086 rev=0x07 hdr=0x00
    vendor     = 'Intel Corporation'
    device     = 'Sky Lake-E PCU Registers'
    class      = base peripheral

none61@pci0:23:30:6:	class=0x088000 card=0x00008086 chip=0x20868086 rev=0x07 hdr=0x00
    vendor     = 'Intel Corporation'
    device     = 'Sky Lake-E PCU Registers'
    class      = base peripheral

mfi0@pci0:24:0:0:	class=0x010400 card=0x1f4b1028 chip=0x005f1000 rev=0x02 hdr=0x00
    vendor     = 'LSI Logic / Symbios Logic'
    device     = 'MegaRAID SAS-3 3008 [Fury]'
    class      = mass storage
    subclass   = RAID
    bar   [10] = type I/O Port, range 32, base 0x4000, size 256, enabled
    bar   [14] = type Memory, range 64, base 0xa2200000, size 65536, enabled
    bar   [1c] = type Memory, range 64, base 0xa2100000, size 1048576, enabled
    cap 01[50] = powerspec 3  supports D0 D1 D2 D3  current D0
    cap 10[68] = PCI-Express 2 endpoint max data 256(4096) RO NS
                 link x8(x8) speed 8.0(8.0) ASPM disabled(L0s)
    cap 05[a8] = MSI supports 1 message, 64 bit, vector masks enabled with 1 message
    cap 11[c0] = MSI-X supports 97 messages
                 Table in map 0x14[0xe000], PBA in map 0x14[0xf000]
    ecap 0001[100] = AER 2 0 fatal 0 non-fatal 1 corrected
    ecap 0019[1e0] = PCIe Sec 1 lane errors 0
    ecap 0004[1c0] = Power Budgeting 1
    ecap 000e[148] = ARI 1

ixl0@pci0:25:0:0:	class=0x020000 card=0x1f9c1028 chip=0x15728086 rev=0x02 hdr=0x00
    vendor     = 'Intel Corporation'
    device     = 'Ethernet Controller X710 for 10GbE SFP+'
    class      = network
    subclass   = ethernet
    bar   [10] = type Prefetchable Memory, range 64, base 0xa1000000, size 16777216, enabled
    bar   [1c] = type Prefetchable Memory, range 64, base 0xa2018000, size 32768, enabled
    cap 01[40] = powerspec 3  supports D0 D3  current D0
    cap 05[50] = MSI supports 1 message, 64 bit, vector masks 
    cap 11[70] = MSI-X supports 129 messages, enabled
                 Table in map 0x1c[0x0], PBA in map 0x1c[0x1000]
    cap 10[a0] = PCI-Express 2 endpoint max data 256(2048) FLR RO
                 link x8(x8) speed 8.0(8.0) ASPM disabled(L1)
    cap 03[e0] = VPD
    ecap 0001[100] = AER 2 0 fatal 0 non-fatal 1 corrected
    ecap 0003[140] = Serial 1 00dc07ffff44ac78
    ecap 0017[1a0] = TPH Requester 1
    ecap 000d[1b0] = ACS 1
    ecap 0019[1d0] = PCIe Sec 1 lane errors 0

ixl1@pci0:25:0:1:	class=0x020000 card=0x00001028 chip=0x15728086 rev=0x02 hdr=0x00
    vendor     = 'Intel Corporation'
    device     = 'Ethernet Controller X710 for 10GbE SFP+'
    class      = network
    subclass   = ethernet
    bar   [10] = type Prefetchable Memory, range 64, base 0xa0000000, size 16777216, enabled
    bar   [1c] = type Prefetchable Memory, range 64, base 0xa2010000, size 32768, enabled
    cap 01[40] = powerspec 3  supports D0 D3  current D0
    cap 05[50] = MSI supports 1 message, 64 bit, vector masks 
    cap 11[70] = MSI-X supports 129 messages, enabled
                 Table in map 0x1c[0x0], PBA in map 0x1c[0x1000]
    cap 10[a0] = PCI-Express 2 endpoint max data 256(2048) FLR RO
                 link x8(x8) speed 8.0(8.0) ASPM disabled(L1)
    cap 03[e0] = VPD
    ecap 0001[100] = AER 2 0 fatal 0 non-fatal 1 corrected
    ecap 0003[140] = Serial 1 00dc07ffff44ac78
    ecap 0017[1a0] = TPH Requester 1
    ecap 000d[1b0] = ACS 1

ixl2@pci0:25:0:2:	class=0x020000 card=0x00001028 chip=0x15728086 rev=0x02 hdr=0x00
    vendor     = 'Intel Corporation'
    device     = 'Ethernet Controller X710 for 10GbE SFP+'
    class      = network
    subclass   = ethernet
    bar   [10] = type Prefetchable Memory, range 64, base 0x9f000000, size 16777216, enabled
    bar   [1c] = type Prefetchable Memory, range 64, base 0xa2008000, size 32768, enabled
    cap 01[40] = powerspec 3  supports D0 D3  current D0
    cap 05[50] = MSI supports 1 message, 64 bit, vector masks 
    cap 11[70] = MSI-X supports 129 messages, enabled
                 Table in map 0x1c[0x0], PBA in map 0x1c[0x1000]
    cap 10[a0] = PCI-Express 2 endpoint max data 256(2048) FLR RO
                 link x8(x8) speed 8.0(8.0) ASPM disabled(L1)
    cap 03[e0] = VPD
    ecap 0001[100] = AER 2 0 fatal 0 non-fatal 1 corrected
    ecap 0003[140] = Serial 1 00dc07ffff44ac78
    ecap 0017[1a0] = TPH Requester 1
    ecap 000d[1b0] = ACS 1

ixl3@pci0:25:0:3:	class=0x020000 card=0x00001028 chip=0x15728086 rev=0x02 hdr=0x00
    vendor     = 'Intel Corporation'
    device     = 'Ethernet Controller X710 for 10GbE SFP+'
    class      = network
    subclass   = ethernet
    bar   [10] = type Prefetchable Memory, range 64, base 0x9e000000, size 16777216, enabled
    bar   [1c] = type Prefetchable Memory, range 64, base 0xa2000000, size 32768, enabled
    cap 01[40] = powerspec 3  supports D0 D3  current D0
    cap 05[50] = MSI supports 1 message, 64 bit, vector masks 
    cap 11[70] = MSI-X supports 129 messages, enabled
                 Table in map 0x1c[0x0], PBA in map 0x1c[0x1000]
    cap 10[a0] = PCI-Express 2 endpoint max data 256(2048) FLR RO
                 link x8(x8) speed 8.0(8.0) ASPM disabled(L1)
    cap 03[e0] = VPD
    ecap 0001[100] = AER 2 0 fatal 0 non-fatal 1 corrected
    ecap 0003[140] = Serial 1 00dc07ffff44ac78
    ecap 0017[1a0] = TPH Requester 1
    ecap 000d[1b0] = ACS 1

pcib8@pci0:58:0:0:	class=0x060400 card=0x00008086 chip=0x20308086 rev=0x07 hdr=0x01
    vendor     = 'Intel Corporation'
    device     = 'Sky Lake-E PCI Express Root Port A'
    class      = bridge
    subclass   = PCI-PCI
    cap 0d[40] = PCI Bridge card=0x00008086
    cap 05[60] = MSI supports 2 messages, vector masks 
    cap 10[90] = PCI-Express 2 root port max data 256(256) ARI enabled
                 link x8(x16) speed 8.0(8.0) ASPM disabled(L1)
                 slot 1 power limit 75000 mW
    cap 01[e0] = powerspec 3  supports D0 D3  current D0
    ecap 000b[100] = Vendor 1 ID 2
    ecap 000d[110] = ACS 1
    ecap 0001[148] = AER 1 0 fatal 0 non-fatal 0 corrected
    ecap 000b[1d0] = Vendor 1 ID 3
    ecap 0019[250] = PCIe Sec 1 lane errors 0
    ecap 000b[280] = Vendor 1 ID 5
    ecap 000b[300] = Vendor 1 ID 8

none62@pci0:58:5:0:	class=0x088000 card=0x00008086 chip=0x20348086 rev=0x07 hdr=0x00
    vendor     = 'Intel Corporation'
    device     = 'Sky Lake-E VT-d'
    class      = base peripheral
    cap 10[40] = PCI-Express 2 root endpoint max data 128(128)

none63@pci0:58:5:2:	class=0x088000 card=0x00000000 chip=0x20358086 rev=0x07 hdr=0x00
    vendor     = 'Intel Corporation'
    device     = 'Sky Lake-E RAS Configuration Registers'
    class      = base peripheral
    cap 10[40] = PCI-Express 2 root endpoint max data 128(128)

ioapic2@pci0:58:5:4:	class=0x080020 card=0x20368086 chip=0x20368086 rev=0x07 hdr=0x00
    vendor     = 'Intel Corporation'
    device     = 'Sky Lake-E IOxAPIC Configuration Registers'
    class      = base peripheral
    subclass   = interrupt controller
    bar   [10] = type Memory, range 32, base 0xad100000, size 4096, enabled
    cap 10[44] = PCI-Express 1 root endpoint max data 128(128)
    cap 01[e0] = powerspec 3  supports D0 D3  current D0

none64@pci0:58:8:0:	class=0x088000 card=0x00008086 chip=0x20668086 rev=0x07 hdr=0x00
    vendor     = 'Intel Corporation'
    device     = 'Sky Lake-E Integrated Memory Controller'
    class      = base peripheral
    cap 10[40] = PCI-Express 1 root endpoint max data 128(128)

none65@pci0:58:9:0:	class=0x088000 card=0x00008086 chip=0x20668086 rev=0x07 hdr=0x00
    vendor     = 'Intel Corporation'
    device     = 'Sky Lake-E Integrated Memory Controller'
    class      = base peripheral
    cap 10[40] = PCI-Express 1 root endpoint max data 128(128)

none66@pci0:58:10:0:	class=0x088000 card=0x00008086 chip=0x20408086 rev=0x07 hdr=0x00
    vendor     = 'Intel Corporation'
    device     = 'Sky Lake-E Integrated Memory Controller'
    class      = base peripheral
    cap 10[40] = PCI-Express 1 root endpoint max data 128(128)

none67@pci0:58:10:1:	class=0x088000 card=0x00008086 chip=0x20418086 rev=0x07 hdr=0x00
    vendor     = 'Intel Corporation'
    device     = 'Sky Lake-E Integrated Memory Controller'
    class      = base peripheral
    cap 10[40] = PCI-Express 1 root endpoint max data 128(128)

none68@pci0:58:10:2:	class=0x088000 card=0x00008086 chip=0x20428086 rev=0x07 hdr=0x00
    vendor     = 'Intel Corporation'
    device     = 'Sky Lake-E Integrated Memory Controller'
    class      = base peripheral
    cap 10[40] = PCI-Express 1 root endpoint max data 128(128)

none69@pci0:58:10:3:	class=0x088000 card=0x00008086 chip=0x20438086 rev=0x07 hdr=0x00
    vendor     = 'Intel Corporation'
    device     = 'Sky Lake-E Integrated Memory Controller'
    class      = base peripheral
    cap 10[40] = PCI-Express 1 root endpoint max data 128(128)

none70@pci0:58:10:4:	class=0x088000 card=0x00008086 chip=0x20448086 rev=0x07 hdr=0x00
    vendor     = 'Intel Corporation'
    device     = 'Sky Lake-E Integrated Memory Controller'
    class      = base peripheral
    cap 10[40] = PCI-Express 1 root endpoint max data 128(128)

none71@pci0:58:10:5:	class=0x088000 card=0x00008086 chip=0x20458086 rev=0x07 hdr=0x00
    vendor     = 'Intel Corporation'
    device     = 'Sky Lake-E LM Channel 1'
    class      = base peripheral
    cap 10[40] = PCI-Express 1 root endpoint max data 128(128)

none72@pci0:58:10:6:	class=0x088000 card=0x00008086 chip=0x20468086 rev=0x07 hdr=0x00
    vendor     = 'Intel Corporation'
    device     = 'Sky Lake-E LMS Channel 1'
    class      = base peripheral
    cap 10[40] = PCI-Express 1 root endpoint max data 128(128)

none73@pci0:58:10:7:	class=0x088000 card=0x00008086 chip=0x20478086 rev=0x07 hdr=0x00
    vendor     = 'Intel Corporation'
    device     = 'Sky Lake-E LMDP Channel 1'
    class      = base peripheral
    cap 10[40] = PCI-Express 1 root endpoint max data 128(128)

none74@pci0:58:11:0:	class=0x088000 card=0x00008086 chip=0x20488086 rev=0x07 hdr=0x00
    vendor     = 'Intel Corporation'
    device     = 'Sky Lake-E DECS Channel 2'
    class      = base peripheral
    cap 10[40] = PCI-Express 1 root endpoint max data 128(128)

none75@pci0:58:11:1:	class=0x088000 card=0x00008086 chip=0x20498086 rev=0x07 hdr=0x00
    vendor     = 'Intel Corporation'
    device     = 'Sky Lake-E LM Channel 2'
    class      = base peripheral
    cap 10[40] = PCI-Express 1 root endpoint max data 128(128)

none76@pci0:58:11:2:	class=0x088000 card=0x00008086 chip=0x204a8086 rev=0x07 hdr=0x00
    vendor     = 'Intel Corporation'
    device     = 'Sky Lake-E LMS Channel 2'
    class      = base peripheral
    cap 10[40] = PCI-Express 1 root endpoint max data 128(128)

none77@pci0:58:11:3:	class=0x088000 card=0x00008086 chip=0x204b8086 rev=0x07 hdr=0x00
    vendor     = 'Intel Corporation'
    device     = 'Sky Lake-E LMDP Channel 2'
    class      = base peripheral
    cap 10[40] = PCI-Express 1 root endpoint max data 128(128)

none78@pci0:58:12:0:	class=0x088000 card=0x00008086 chip=0x20408086 rev=0x07 hdr=0x00
    vendor     = 'Intel Corporation'
    device     = 'Sky Lake-E Integrated Memory Controller'
    class      = base peripheral
    cap 10[40] = PCI-Express 1 root endpoint max data 128(128)

none79@pci0:58:12:1:	class=0x088000 card=0x00008086 chip=0x20418086 rev=0x07 hdr=0x00
    vendor     = 'Intel Corporation'
    device     = 'Sky Lake-E Integrated Memory Controller'
    class      = base peripheral
    cap 10[40] = PCI-Express 1 root endpoint max data 128(128)

none80@pci0:58:12:2:	class=0x088000 card=0x00008086 chip=0x20428086 rev=0x07 hdr=0x00
    vendor     = 'Intel Corporation'
    device     = 'Sky Lake-E Integrated Memory Controller'
    class      = base peripheral
    cap 10[40] = PCI-Express 1 root endpoint max data 128(128)

none81@pci0:58:12:3:	class=0x088000 card=0x00008086 chip=0x20438086 rev=0x07 hdr=0x00
    vendor     = 'Intel Corporation'
    device     = 'Sky Lake-E Integrated Memory Controller'
    class      = base peripheral
    cap 10[40] = PCI-Express 1 root endpoint max data 128(128)

none82@pci0:58:12:4:	class=0x088000 card=0x00008086 chip=0x20448086 rev=0x07 hdr=0x00
    vendor     = 'Intel Corporation'
    device     = 'Sky Lake-E Integrated Memory Controller'
    class      = base peripheral
    cap 10[40] = PCI-Express 1 root endpoint max data 128(128)

none83@pci0:58:12:5:	class=0x088000 card=0x00008086 chip=0x20458086 rev=0x07 hdr=0x00
    vendor     = 'Intel Corporation'
    device     = 'Sky Lake-E LM Channel 1'
    class      = base peripheral
    cap 10[40] = PCI-Express 1 root endpoint max data 128(128)

none84@pci0:58:12:6:	class=0x088000 card=0x00008086 chip=0x20468086 rev=0x07 hdr=0x00
    vendor     = 'Intel Corporation'
    device     = 'Sky Lake-E LMS Channel 1'
    class      = base peripheral
    cap 10[40] = PCI-Express 1 root endpoint max data 128(128)

none85@pci0:58:12:7:	class=0x088000 card=0x00008086 chip=0x20478086 rev=0x07 hdr=0x00
    vendor     = 'Intel Corporation'
    device     = 'Sky Lake-E LMDP Channel 1'
    class      = base peripheral
    cap 10[40] = PCI-Express 1 root endpoint max data 128(128)

none86@pci0:58:13:0:	class=0x088000 card=0x00008086 chip=0x20488086 rev=0x07 hdr=0x00
    vendor     = 'Intel Corporation'
    device     = 'Sky Lake-E DECS Channel 2'
    class      = base peripheral
    cap 10[40] = PCI-Express 1 root endpoint max data 128(128)

none87@pci0:58:13:1:	class=0x088000 card=0x00008086 chip=0x20498086 rev=0x07 hdr=0x00
    vendor     = 'Intel Corporation'
    device     = 'Sky Lake-E LM Channel 2'
    class      = base peripheral
    cap 10[40] = PCI-Express 1 root endpoint max data 128(128)

none88@pci0:58:13:2:	class=0x088000 card=0x00008086 chip=0x204a8086 rev=0x07 hdr=0x00
    vendor     = 'Intel Corporation'
    device     = 'Sky Lake-E LMS Channel 2'
    class      = base peripheral
    cap 10[40] = PCI-Express 1 root endpoint max data 128(128)

none89@pci0:58:13:3:	class=0x088000 card=0x00008086 chip=0x204b8086 rev=0x07 hdr=0x00
    vendor     = 'Intel Corporation'
    device     = 'Sky Lake-E LMDP Channel 2'
    class      = base peripheral
    cap 10[40] = PCI-Express 1 root endpoint max data 128(128)

ixl4@pci0:59:0:0:	class=0x020000 card=0x00068086 chip=0x15728086 rev=0x02 hdr=0x00
    vendor     = 'Intel Corporation'
    device     = 'Ethernet Controller X710 for 10GbE SFP+'
    class      = network
    subclass   = ethernet
    bar   [10] = type Prefetchable Memory, range 64, base 0xac000000, size 16777216, enabled
    bar   [1c] = type Prefetchable Memory, range 64, base 0xad008000, size 32768, enabled
    cap 01[40] = powerspec 3  supports D0 D3  current D0
    cap 05[50] = MSI supports 1 message, 64 bit, vector masks 
    cap 11[70] = MSI-X supports 129 messages, enabled
                 Table in map 0x1c[0x0], PBA in map 0x1c[0x1000]
    cap 10[a0] = PCI-Express 2 endpoint max data 256(2048) FLR RO
                 link x8(x8) speed 8.0(8.0) ASPM disabled(L1)
    cap 03[e0] = VPD
    ecap 0001[100] = AER 2 0 fatal 0 non-fatal 1 corrected
    ecap 0003[140] = Serial 1 50dfc9ffff1ef2f8
    ecap 000e[150] = ARI 1
    ecap 0017[1a0] = TPH Requester 1
    ecap 000d[1b0] = ACS 1
    ecap 0019[1d0] = PCIe Sec 1 lane errors 0

ixl5@pci0:59:0:1:	class=0x020000 card=0x00008086 chip=0x15728086 rev=0x02 hdr=0x00
    vendor     = 'Intel Corporation'
    device     = 'Ethernet Controller X710 for 10GbE SFP+'
    class      = network
    subclass   = ethernet
    bar   [10] = type Prefetchable Memory, range 64, base 0xab000000, size 16777216, enabled
    bar   [1c] = type Prefetchable Memory, range 64, base 0xad000000, size 32768, enabled
    cap 01[40] = powerspec 3  supports D0 D3  current D0
    cap 05[50] = MSI supports 1 message, 64 bit, vector masks 
    cap 11[70] = MSI-X supports 129 messages, enabled
                 Table in map 0x1c[0x0], PBA in map 0x1c[0x1000]
    cap 10[a0] = PCI-Express 2 endpoint max data 256(2048) FLR RO
                 link x8(x8) speed 8.0(8.0) ASPM disabled(L1)
    cap 03[e0] = VPD
    ecap 0001[100] = AER 2 0 fatal 0 non-fatal 1 corrected
    ecap 0003[140] = Serial 1 50dfc9ffff1ef2f8
    ecap 000e[150] = ARI 1
    ecap 0017[1a0] = TPH Requester 1
    ecap 000d[1b0] = ACS 1

pcib10@pci0:93:0:0:	class=0x060400 card=0x00008086 chip=0x20308086 rev=0x07 hdr=0x01
    vendor     = 'Intel Corporation'
    device     = 'Sky Lake-E PCI Express Root Port A'
    class      = bridge
    subclass   = PCI-PCI
    cap 0d[40] = PCI Bridge card=0x00008086
    cap 05[60] = MSI supports 2 messages, vector masks 
    cap 10[90] = PCI-Express 2 root port max data 256(256) ARI disabled
                 link x4(x16) speed 5.0(8.0) ASPM disabled(L1)
                 slot 2 power limit 75000 mW
    cap 01[e0] = powerspec 3  supports D0 D3  current D0
    ecap 000b[100] = Vendor 1 ID 2
    ecap 000d[110] = ACS 1
    ecap 0001[148] = AER 1 0 fatal 0 non-fatal 0 corrected
    ecap 000b[1d0] = Vendor 1 ID 3
    ecap 0019[250] = PCIe Sec 1 lane errors 0
    ecap 000b[280] = Vendor 1 ID 5
    ecap 000b[300] = Vendor 1 ID 8

none90@pci0:93:5:0:	class=0x088000 card=0x00008086 chip=0x20348086 rev=0x07 hdr=0x00
    vendor     = 'Intel Corporation'
    device     = 'Sky Lake-E VT-d'
    class      = base peripheral
    cap 10[40] = PCI-Express 2 root endpoint max data 128(128)

none91@pci0:93:5:2:	class=0x088000 card=0x00000000 chip=0x20358086 rev=0x07 hdr=0x00
    vendor     = 'Intel Corporation'
    device     = 'Sky Lake-E RAS Configuration Registers'
    class      = base peripheral
    cap 10[40] = PCI-Express 2 root endpoint max data 128(128)

ioapic3@pci0:93:5:4:	class=0x080020 card=0x20368086 chip=0x20368086 rev=0x07 hdr=0x00
    vendor     = 'Intel Corporation'
    device     = 'Sky Lake-E IOxAPIC Configuration Registers'
    class      = base peripheral
    subclass   = interrupt controller
    bar   [10] = type Memory, range 32, base 0xb8b00000, size 4096, enabled
    cap 10[44] = PCI-Express 1 root endpoint max data 128(128)
    cap 01[e0] = powerspec 3  supports D0 D3  current D0

none92@pci0:93:14:0:	class=0x110100 card=0x00008086 chip=0x20588086 rev=0x07 hdr=0x00
    vendor     = 'Intel Corporation'
    device     = 'Sky Lake-E KTI 0'
    class      = dasp
    subclass   = performance counters
    cap 10[40] = PCI-Express 2 root endpoint max data 128(128)

none93@pci0:93:14:1:	class=0x088000 card=0x00008086 chip=0x20598086 rev=0x07 hdr=0x00
    vendor     = 'Intel Corporation'
    device     = 'Sky Lake-E UPI Registers'
    class      = base peripheral
    cap 10[40] = PCI-Express 2 root endpoint max data 128(128)
    ecap 000b[100] = Vendor 0none94@pci0:93:15:0:	class=0x110100 card=0x00008086 chip=0x20588086 rev=0x07 hdr=0x00
    vendor     = 'Intel Corporation'
    device     = 'Sky Lake-E KTI 0'
    class      = dasp
    subclass   = performance counters
    cap 10[40] = PCI-Express 2 root endpoint max data 128(128)

none95@pci0:93:15:1:	class=0x088000 card=0x00008086 chip=0x20598086 rev=0x07 hdr=0x00
    vendor     = 'Intel Corporation'
    device     = 'Sky Lake-E UPI Registers'
    class      = base peripheral
    cap 10[40] = PCI-Express 2 root endpoint max data 128(128)
    ecap 000b[100] = Vendor 0none96@pci0:93:18:0:	class=0x110100 card=0x00008086 chip=0x204c8086 rev=0x07 hdr=0x00
    vendor     = 'Intel Corporation'
    device     = 'Sky Lake-E M3KTI Registers'
    class      = dasp
    subclass   = performance counters
    cap 10[40] = PCI-Express 2 root endpoint max data 128(128)

none97@pci0:93:18:1:	class=0x110100 card=0x00008086 chip=0x204d8086 rev=0x07 hdr=0x00
    vendor     = 'Intel Corporation'
    device     = 'Sky Lake-E M3KTI Registers'
    class      = dasp
    subclass   = performance counters

none98@pci0:93:18:2:	class=0x088000 card=0x00008086 chip=0x204e8086 rev=0x07 hdr=0x00
    vendor     = 'Intel Corporation'
    device     = 'Sky Lake-E M3KTI Registers'
    class      = base peripheral

none99@pci0:93:21:0:	class=0x088000 card=0x00008086 chip=0x20188086 rev=0x07 hdr=0x00
    vendor     = 'Intel Corporation'
    device     = 'Sky Lake-E M2PCI Registers'
    class      = base peripheral

none100@pci0:93:21:1:	class=0x110100 card=0x00008086 chip=0x20888086 rev=0x07 hdr=0x00
    vendor     = 'Intel Corporation'
    class      = dasp
    subclass   = performance counters

none101@pci0:93:22:0:	class=0x088000 card=0x00008086 chip=0x20188086 rev=0x07 hdr=0x00
    vendor     = 'Intel Corporation'
    device     = 'Sky Lake-E M2PCI Registers'
    class      = base peripheral

none102@pci0:93:22:1:	class=0x110100 card=0x00008086 chip=0x20888086 rev=0x07 hdr=0x00
    vendor     = 'Intel Corporation'
    class      = dasp
    subclass   = performance counters

none103@pci0:93:22:4:	class=0x088000 card=0x00008086 chip=0x20188086 rev=0x07 hdr=0x00
    vendor     = 'Intel Corporation'
    device     = 'Sky Lake-E M2PCI Registers'
    class      = base peripheral

none104@pci0:93:22:5:	class=0x110100 card=0x00008086 chip=0x20888086 rev=0x07 hdr=0x00
    vendor     = 'Intel Corporation'
    class      = dasp
    subclass   = performance counters

igb0@pci0:94:0:0:	class=0x020000 card=0x1780103c chip=0x150e8086 rev=0x01 hdr=0x00
    vendor     = 'Intel Corporation'
    device     = '82580 Gigabit Network Connection'
    class      = network
    subclass   = ethernet
    bar   [10] = type Memory, range 64, base 0xb8980000, size 524288, enabled
    bar   [20] = type Memory, range 64, base 0xb8a0c000, size 16384, enabled
    cap 01[40] = powerspec 3  supports D0 D3  current D0
    cap 05[50] = MSI supports 1 message, 64 bit, vector masks 
    cap 11[70] = MSI-X supports 10 messages, enabled
                 Table in map 0x20[0x0], PBA in map 0x20[0x2000]
    cap 10[a0] = PCI-Express 2 endpoint max data 256(512) FLR RO NS
                 link x4(x4) speed 5.0(5.0) ASPM disabled(L0s/L1)
    cap 03[e0] = VPD
    ecap 0001[100] = AER 1 0 fatal 0 non-fatal 1 corrected
    ecap 0003[140] = Serial 1 f4ce46ffffa71c4f
    ecap 0017[1a0] = TPH Requester 1
    ecap 0018[1c0] = LTR 1

igb1@pci0:94:0:1:	class=0x020000 card=0x1780103c chip=0x150e8086 rev=0x01 hdr=0x00
    vendor     = 'Intel Corporation'
    device     = '82580 Gigabit Network Connection'
    class      = network
    subclass   = ethernet
    bar   [10] = type Memory, range 64, base 0xb8900000, size 524288, enabled
    bar   [20] = type Memory, range 64, base 0xb8a08000, size 16384, enabled
    cap 01[40] = powerspec 3  supports D0 D3  current D0
    cap 05[50] = MSI supports 1 message, 64 bit, vector masks 
    cap 11[70] = MSI-X supports 10 messages, enabled
                 Table in map 0x20[0x0], PBA in map 0x20[0x2000]
    cap 10[a0] = PCI-Express 2 endpoint max data 256(512) FLR RO NS
                 link x4(x4) speed 5.0(5.0) ASPM disabled(L0s/L1)
    cap 03[e0] = VPD
    ecap 0001[100] = AER 1 0 fatal 0 non-fatal 1 corrected
    ecap 0003[140] = Serial 1 f4ce46ffffa71c4f
    ecap 0017[1a0] = TPH Requester 1

igb2@pci0:94:0:2:	class=0x020000 card=0x1780103c chip=0x150e8086 rev=0x01 hdr=0x00
    vendor     = 'Intel Corporation'
    device     = '82580 Gigabit Network Connection'
    class      = network
    subclass   = ethernet
    bar   [10] = type Memory, range 64, base 0xb8880000, size 524288, enabled
    bar   [20] = type Memory, range 64, base 0xb8a04000, size 16384, enabled
    cap 01[40] = powerspec 3  supports D0 D3  current D0
    cap 05[50] = MSI supports 1 message, 64 bit, vector masks 
    cap 11[70] = MSI-X supports 10 messages, enabled
                 Table in map 0x20[0x0], PBA in map 0x20[0x2000]
    cap 10[a0] = PCI-Express 2 endpoint max data 256(512) FLR RO NS
                 link x4(x4) speed 5.0(5.0) ASPM disabled(L0s/L1)
    cap 03[e0] = VPD
    ecap 0001[100] = AER 1 0 fatal 0 non-fatal 1 corrected
    ecap 0003[140] = Serial 1 f4ce46ffffa71c4f
    ecap 0017[1a0] = TPH Requester 1

igb3@pci0:94:0:3:	class=0x020000 card=0x1780103c chip=0x150e8086 rev=0x01 hdr=0x00
    vendor     = 'Intel Corporation'
    device     = '82580 Gigabit Network Connection'
    class      = network
    subclass   = ethernet
    bar   [10] = type Memory, range 64, base 0xb8800000, size 524288, enabled
    bar   [20] = type Memory, range 64, base 0xb8a00000, size 16384, enabled
    cap 01[40] = powerspec 3  supports D0 D3  current D0
    cap 05[50] = MSI supports 1 message, 64 bit, vector masks 
    cap 11[70] = MSI-X supports 10 messages, enabled
                 Table in map 0x20[0x0], PBA in map 0x20[0x2000]
    cap 10[a0] = PCI-Express 2 endpoint max data 256(512) FLR RO NS
                 link x4(x4) speed 5.0(5.0) ASPM disabled(L0s/L1)
    cap 03[e0] = VPD
    ecap 0001[100] = AER 1 0 fatal 0 non-fatal 1 corrected
    ecap 0003[140] = Serial 1 f4ce46ffffa71c4f
    ecap 0017[1a0] = TPH Requester 1

none105@pci0:128:5:0:	class=0x088000 card=0x00008086 chip=0x20248086 rev=0x07 hdr=0x00
    vendor     = 'Intel Corporation'
    device     = 'Sky Lake-E MM/Vt-d Configuration Registers'
    class      = base peripheral
    cap 10[40] = PCI-Express 2 root endpoint max data 128(128)

none106@pci0:128:5:2:	class=0x088000 card=0x00000000 chip=0x20258086 rev=0x07 hdr=0x00
    vendor     = 'Intel Corporation'
    device     = 'Sky Lake-E RAS'
    class      = base peripheral
    cap 10[40] = PCI-Express 2 root endpoint max data 128(128)

ioapic4@pci0:128:5:4:	class=0x080020 card=0x20268086 chip=0x20268086 rev=0x07 hdr=0x00
    vendor     = 'Intel Corporation'
    device     = 'Sky Lake-E IOAPIC'
    class      = base peripheral
    subclass   = interrupt controller
    bar   [10] = type Memory, range 32, base 0xc6000000, size 4096, enabled
    cap 10[44] = PCI-Express 1 root endpoint max data 128(128)
    cap 01[e0] = powerspec 3  supports D0 D3  current D0

none107@pci0:128:8:0:	class=0x088000 card=0x00008086 chip=0x20148086 rev=0x07 hdr=0x00
    vendor     = 'Intel Corporation'
    device     = 'Sky Lake-E Ubox Registers'
    class      = base peripheral
    cap 10[40] = PCI-Express 2 root endpoint max data 128(128)

none108@pci0:128:8:1:	class=0x110100 card=0x00008086 chip=0x20158086 rev=0x07 hdr=0x00
    vendor     = 'Intel Corporation'
    device     = 'Sky Lake-E Ubox Registers'
    class      = dasp
    subclass   = performance counters

none109@pci0:128:8:2:	class=0x088000 card=0x00008086 chip=0x20168086 rev=0x07 hdr=0x00
    vendor     = 'Intel Corporation'
    device     = 'Sky Lake-E Ubox Registers'
    class      = base peripheral
    cap 10[40] = PCI-Express 2 root endpoint max data 128(128)

pcib13@pci0:133:0:0:	class=0x060400 card=0x00008086 chip=0x20308086 rev=0x07 hdr=0x01
    vendor     = 'Intel Corporation'
    device     = 'Sky Lake-E PCI Express Root Port A'
    class      = bridge
    subclass   = PCI-PCI
    cap 0d[40] = PCI Bridge card=0x00008086
    cap 05[60] = MSI supports 2 messages, vector masks enabled with 1 message
    cap 10[90] = PCI-Express 2 root port max data 256(256) ARI disabled
                 link x0(x4) speed 0.0(8.0) ASPM disabled(L1)
                 slot 166 power limit 0 mW HotPlug(empty) surprise
    cap 01[e0] = powerspec 3  supports D0 D3  current D0
    ecap 000b[100] = Vendor 1 ID 2
    ecap 000d[110] = ACS 1
    ecap 0001[148] = AER 1 0 fatal 0 non-fatal 0 corrected
    ecap 000b[1d0] = Vendor 1 ID 3
    ecap 0019[250] = PCIe Sec 1 lane errors 0
    ecap 000b[280] = Vendor 1 ID 5
    ecap 000b[300] = Vendor 1 ID 8

pcib14@pci0:133:1:0:	class=0x060400 card=0x00008086 chip=0x20318086 rev=0x07 hdr=0x01
    vendor     = 'Intel Corporation'
    device     = 'Sky Lake-E PCI Express Root Port B'
    class      = bridge
    subclass   = PCI-PCI
    cap 0d[40] = PCI Bridge card=0x00008086
    cap 05[60] = MSI supports 2 messages, vector masks enabled with 1 message
    cap 10[90] = PCI-Express 2 root port max data 256(256) ARI disabled
                 link x0(x4) speed 0.0(8.0) ASPM disabled(L1)
                 slot 167 power limit 0 mW HotPlug(empty) surprise
    cap 01[e0] = powerspec 3  supports D0 D3  current D0
    ecap 000b[100] = Vendor 1 ID 2
    ecap 000d[110] = ACS 1
    ecap 0001[148] = AER 1 0 fatal 0 non-fatal 0 corrected
    ecap 000b[1d0] = Vendor 1 ID 3
    ecap 0019[250] = PCIe Sec 1 lane errors 0
    ecap 000b[280] = Vendor 1 ID 5
    ecap 000b[300] = Vendor 1 ID 8

pcib15@pci0:133:2:0:	class=0x060400 card=0x00008086 chip=0x20328086 rev=0x07 hdr=0x01
    vendor     = 'Intel Corporation'
    device     = 'Sky Lake-E PCI Express Root Port C'
    class      = bridge
    subclass   = PCI-PCI
    cap 0d[40] = PCI Bridge card=0x00008086
    cap 05[60] = MSI supports 2 messages, vector masks enabled with 1 message
    cap 10[90] = PCI-Express 2 root port max data 256(256) ARI disabled
                 link x0(x4) speed 0.0(8.0) ASPM disabled(L1)
                 slot 168 power limit 0 mW HotPlug(empty) surprise
    cap 01[e0] = powerspec 3  supports D0 D3  current D0
    ecap 000b[100] = Vendor 1 ID 2
    ecap 000d[110] = ACS 1
    ecap 0001[148] = AER 1 0 fatal 0 non-fatal 0 corrected
    ecap 000b[1d0] = Vendor 1 ID 3
    ecap 0019[250] = PCIe Sec 1 lane errors 0
    ecap 000b[280] = Vendor 1 ID 5
    ecap 000b[300] = Vendor 1 ID 8

pcib16@pci0:133:3:0:	class=0x060400 card=0x00008086 chip=0x20338086 rev=0x07 hdr=0x01
    vendor     = 'Intel Corporation'
    device     = 'Sky Lake-E PCI Express Root Port D'
    class      = bridge
    subclass   = PCI-PCI
    cap 0d[40] = PCI Bridge card=0x00008086
    cap 05[60] = MSI supports 2 messages, vector masks enabled with 1 message
    cap 10[90] = PCI-Express 2 root port max data 256(256) ARI disabled
                 link x0(x4) speed 0.0(8.0) ASPM disabled(L1)
                 slot 169 power limit 0 mW HotPlug(empty) surprise
    cap 01[e0] = powerspec 3  supports D0 D3  current D0
    ecap 000b[100] = Vendor 1 ID 2
    ecap 000d[110] = ACS 1
    ecap 0001[148] = AER 1 0 fatal 0 non-fatal 0 corrected
    ecap 000b[1d0] = Vendor 1 ID 3
    ecap 0019[250] = PCIe Sec 1 lane errors 0
    ecap 000b[280] = Vendor 1 ID 5
    ecap 000b[300] = Vendor 1 ID 8

none110@pci0:133:5:0:	class=0x088000 card=0x00008086 chip=0x20348086 rev=0x07 hdr=0x00
    vendor     = 'Intel Corporation'
    device     = 'Sky Lake-E VT-d'
    class      = base peripheral
    cap 10[40] = PCI-Express 2 root endpoint max data 128(128)

none111@pci0:133:5:2:	class=0x088000 card=0x00000000 chip=0x20358086 rev=0x07 hdr=0x00
    vendor     = 'Intel Corporation'
    device     = 'Sky Lake-E RAS Configuration Registers'
    class      = base peripheral
    cap 10[40] = PCI-Express 2 root endpoint max data 128(128)

ioapic5@pci0:133:5:4:	class=0x080020 card=0x20368086 chip=0x20368086 rev=0x07 hdr=0x00
    vendor     = 'Intel Corporation'
    device     = 'Sky Lake-E IOxAPIC Configuration Registers'
    class      = base peripheral
    subclass   = interrupt controller
    bar   [10] = type Memory, range 32, base 0xd4800000, size 4096, enabled
    cap 10[44] = PCI-Express 1 root endpoint max data 128(128)
    cap 01[e0] = powerspec 3  supports D0 D3  current D0

none112@pci0:133:8:0:	class=0x088000 card=0x00008086 chip=0x208d8086 rev=0x07 hdr=0x00
    vendor     = 'Intel Corporation'
    device     = 'Sky Lake-E CHA Registers'
    class      = base peripheral

none113@pci0:133:8:1:	class=0x088000 card=0x00008086 chip=0x208d8086 rev=0x07 hdr=0x00
    vendor     = 'Intel Corporation'
    device     = 'Sky Lake-E CHA Registers'
    class      = base peripheral

none114@pci0:133:8:2:	class=0x088000 card=0x00008086 chip=0x208d8086 rev=0x07 hdr=0x00
    vendor     = 'Intel Corporation'
    device     = 'Sky Lake-E CHA Registers'
    class      = base peripheral

none115@pci0:133:8:3:	class=0x088000 card=0x00008086 chip=0x208d8086 rev=0x07 hdr=0x00
    vendor     = 'Intel Corporation'
    device     = 'Sky Lake-E CHA Registers'
    class      = base peripheral

none116@pci0:133:8:4:	class=0x088000 card=0x00008086 chip=0x208d8086 rev=0x07 hdr=0x00
    vendor     = 'Intel Corporation'
    device     = 'Sky Lake-E CHA Registers'
    class      = base peripheral

none117@pci0:133:8:5:	class=0x088000 card=0x00008086 chip=0x208d8086 rev=0x07 hdr=0x00
    vendor     = 'Intel Corporation'
    device     = 'Sky Lake-E CHA Registers'
    class      = base peripheral

none118@pci0:133:8:6:	class=0x088000 card=0x00008086 chip=0x208d8086 rev=0x07 hdr=0x00
    vendor     = 'Intel Corporation'
    device     = 'Sky Lake-E CHA Registers'
    class      = base peripheral

none119@pci0:133:8:7:	class=0x088000 card=0x00008086 chip=0x208d8086 rev=0x07 hdr=0x00
    vendor     = 'Intel Corporation'
    device     = 'Sky Lake-E CHA Registers'
    class      = base peripheral

none120@pci0:133:9:0:	class=0x088000 card=0x00008086 chip=0x208d8086 rev=0x07 hdr=0x00
    vendor     = 'Intel Corporation'
    device     = 'Sky Lake-E CHA Registers'
    class      = base peripheral

none121@pci0:133:9:1:	class=0x088000 card=0x00008086 chip=0x208d8086 rev=0x07 hdr=0x00
    vendor     = 'Intel Corporation'
    device     = 'Sky Lake-E CHA Registers'
    class      = base peripheral

none122@pci0:133:9:2:	class=0x088000 card=0x00008086 chip=0x208d8086 rev=0x07 hdr=0x00
    vendor     = 'Intel Corporation'
    device     = 'Sky Lake-E CHA Registers'
    class      = base peripheral

none123@pci0:133:9:3:	class=0x088000 card=0x00008086 chip=0x208d8086 rev=0x07 hdr=0x00
    vendor     = 'Intel Corporation'
    device     = 'Sky Lake-E CHA Registers'
    class      = base peripheral

none124@pci0:133:9:4:	class=0x088000 card=0x00008086 chip=0x208d8086 rev=0x07 hdr=0x00
    vendor     = 'Intel Corporation'
    device     = 'Sky Lake-E CHA Registers'
    class      = base peripheral

none125@pci0:133:9:5:	class=0x088000 card=0x00008086 chip=0x208d8086 rev=0x07 hdr=0x00
    vendor     = 'Intel Corporation'
    device     = 'Sky Lake-E CHA Registers'
    class      = base peripheral

none126@pci0:133:9:6:	class=0x088000 card=0x00008086 chip=0x208d8086 rev=0x07 hdr=0x00
    vendor     = 'Intel Corporation'
    device     = 'Sky Lake-E CHA Registers'
    class      = base peripheral

none127@pci0:133:9:7:	class=0x088000 card=0x00008086 chip=0x208d8086 rev=0x07 hdr=0x00
    vendor     = 'Intel Corporation'
    device     = 'Sky Lake-E CHA Registers'
    class      = base peripheral

none128@pci0:133:10:0:	class=0x088000 card=0x00008086 chip=0x208d8086 rev=0x07 hdr=0x00
    vendor     = 'Intel Corporation'
    device     = 'Sky Lake-E CHA Registers'
    class      = base peripheral

none129@pci0:133:10:1:	class=0x088000 card=0x00008086 chip=0x208d8086 rev=0x07 hdr=0x00
    vendor     = 'Intel Corporation'
    device     = 'Sky Lake-E CHA Registers'
    class      = base peripheral

none130@pci0:133:14:0:	class=0x088000 card=0x00008086 chip=0x208e8086 rev=0x07 hdr=0x00
    vendor     = 'Intel Corporation'
    device     = 'Sky Lake-E CHA Registers'
    class      = base peripheral

none131@pci0:133:14:1:	class=0x088000 card=0x00008086 chip=0x208e8086 rev=0x07 hdr=0x00
    vendor     = 'Intel Corporation'
    device     = 'Sky Lake-E CHA Registers'
    class      = base peripheral

none132@pci0:133:14:2:	class=0x088000 card=0x00008086 chip=0x208e8086 rev=0x07 hdr=0x00
    vendor     = 'Intel Corporation'
    device     = 'Sky Lake-E CHA Registers'
    class      = base peripheral

none133@pci0:133:14:3:	class=0x088000 card=0x00008086 chip=0x208e8086 rev=0x07 hdr=0x00
    vendor     = 'Intel Corporation'
    device     = 'Sky Lake-E CHA Registers'
    class      = base peripheral

none134@pci0:133:14:4:	class=0x088000 card=0x00008086 chip=0x208e8086 rev=0x07 hdr=0x00
    vendor     = 'Intel Corporation'
    device     = 'Sky Lake-E CHA Registers'
    class      = base peripheral

none135@pci0:133:14:5:	class=0x088000 card=0x00008086 chip=0x208e8086 rev=0x07 hdr=0x00
    vendor     = 'Intel Corporation'
    device     = 'Sky Lake-E CHA Registers'
    class      = base peripheral

none136@pci0:133:14:6:	class=0x088000 card=0x00008086 chip=0x208e8086 rev=0x07 hdr=0x00
    vendor     = 'Intel Corporation'
    device     = 'Sky Lake-E CHA Registers'
    class      = base peripheral

none137@pci0:133:14:7:	class=0x088000 card=0x00008086 chip=0x208e8086 rev=0x07 hdr=0x00
    vendor     = 'Intel Corporation'
    device     = 'Sky Lake-E CHA Registers'
    class      = base peripheral

none138@pci0:133:15:0:	class=0x088000 card=0x00008086 chip=0x208e8086 rev=0x07 hdr=0x00
    vendor     = 'Intel Corporation'
    device     = 'Sky Lake-E CHA Registers'
    class      = base peripheral

none139@pci0:133:15:1:	class=0x088000 card=0x00008086 chip=0x208e8086 rev=0x07 hdr=0x00
    vendor     = 'Intel Corporation'
    device     = 'Sky Lake-E CHA Registers'
    class      = base peripheral

none140@pci0:133:15:2:	class=0x088000 card=0x00008086 chip=0x208e8086 rev=0x07 hdr=0x00
    vendor     = 'Intel Corporation'
    device     = 'Sky Lake-E CHA Registers'
    class      = base peripheral

none141@pci0:133:15:3:	class=0x088000 card=0x00008086 chip=0x208e8086 rev=0x07 hdr=0x00
    vendor     = 'Intel Corporation'
    device     = 'Sky Lake-E CHA Registers'
    class      = base peripheral

none142@pci0:133:15:4:	class=0x088000 card=0x00008086 chip=0x208e8086 rev=0x07 hdr=0x00
    vendor     = 'Intel Corporation'
    device     = 'Sky Lake-E CHA Registers'
    class      = base peripheral

none143@pci0:133:15:5:	class=0x088000 card=0x00008086 chip=0x208e8086 rev=0x07 hdr=0x00
    vendor     = 'Intel Corporation'
    device     = 'Sky Lake-E CHA Registers'
    class      = base peripheral

none144@pci0:133:15:6:	class=0x088000 card=0x00008086 chip=0x208e8086 rev=0x07 hdr=0x00
    vendor     = 'Intel Corporation'
    device     = 'Sky Lake-E CHA Registers'
    class      = base peripheral

none145@pci0:133:15:7:	class=0x088000 card=0x00008086 chip=0x208e8086 rev=0x07 hdr=0x00
    vendor     = 'Intel Corporation'
    device     = 'Sky Lake-E CHA Registers'
    class      = base peripheral

none146@pci0:133:16:0:	class=0x088000 card=0x00008086 chip=0x208e8086 rev=0x07 hdr=0x00
    vendor     = 'Intel Corporation'
    device     = 'Sky Lake-E CHA Registers'
    class      = base peripheral

none147@pci0:133:16:1:	class=0x088000 card=0x00008086 chip=0x208e8086 rev=0x07 hdr=0x00
    vendor     = 'Intel Corporation'
    device     = 'Sky Lake-E CHA Registers'
    class      = base peripheral

none148@pci0:133:29:0:	class=0x088000 card=0x00008086 chip=0x20548086 rev=0x07 hdr=0x00
    vendor     = 'Intel Corporation'
    device     = 'Sky Lake-E CHA Registers'
    class      = base peripheral

none149@pci0:133:29:1:	class=0x088000 card=0x00008086 chip=0x20558086 rev=0x07 hdr=0x00
    vendor     = 'Intel Corporation'
    device     = 'Sky Lake-E CHA Registers'
    class      = base peripheral

none150@pci0:133:29:2:	class=0x088000 card=0x00008086 chip=0x20568086 rev=0x07 hdr=0x00
    vendor     = 'Intel Corporation'
    device     = 'Sky Lake-E CHA Registers'
    class      = base peripheral

none151@pci0:133:29:3:	class=0x088000 card=0x00008086 chip=0x20578086 rev=0x07 hdr=0x00
    vendor     = 'Intel Corporation'
    device     = 'Sky Lake-E CHA Registers'
    class      = base peripheral

none152@pci0:133:30:0:	class=0x088000 card=0x00008086 chip=0x20808086 rev=0x07 hdr=0x00
    vendor     = 'Intel Corporation'
    device     = 'Sky Lake-E PCU Registers'
    class      = base peripheral

none153@pci0:133:30:1:	class=0x088000 card=0x00008086 chip=0x20818086 rev=0x07 hdr=0x00
    vendor     = 'Intel Corporation'
    device     = 'Sky Lake-E PCU Registers'
    class      = base peripheral

none154@pci0:133:30:2:	class=0x088000 card=0x00008086 chip=0x20828086 rev=0x07 hdr=0x00
    vendor     = 'Intel Corporation'
    device     = 'Sky Lake-E PCU Registers'
    class      = base peripheral

none155@pci0:133:30:3:	class=0x088000 card=0x00008086 chip=0x20838086 rev=0x07 hdr=0x00
    vendor     = 'Intel Corporation'
    device     = 'Sky Lake-E PCU Registers'
    class      = base peripheral

none156@pci0:133:30:4:	class=0x088000 card=0x00008086 chip=0x20848086 rev=0x07 hdr=0x00
    vendor     = 'Intel Corporation'
    device     = 'Sky Lake-E PCU Registers'
    class      = base peripheral

none157@pci0:133:30:5:	class=0x088000 card=0x00008086 chip=0x20858086 rev=0x07 hdr=0x00
    vendor     = 'Intel Corporation'
    device     = 'Sky Lake-E PCU Registers'
    class      = base peripheral

none158@pci0:133:30:6:	class=0x088000 card=0x00008086 chip=0x20868086 rev=0x07 hdr=0x00
    vendor     = 'Intel Corporation'
    device     = 'Sky Lake-E PCU Registers'
    class      = base peripheral

pcib18@pci0:174:0:0:	class=0x060400 card=0x00008086 chip=0x20308086 rev=0x07 hdr=0x01
    vendor     = 'Intel Corporation'
    device     = 'Sky Lake-E PCI Express Root Port A'
    class      = bridge
    subclass   = PCI-PCI
    cap 0d[40] = PCI Bridge card=0x00008086
    cap 05[60] = MSI supports 2 messages, vector masks enabled with 1 message
    cap 10[90] = PCI-Express 2 root port max data 256(256) ARI disabled
                 link x0(x4) speed 0.0(8.0) ASPM disabled(L1)
                 slot 164 power limit 0 mW HotPlug(empty) surprise
    cap 01[e0] = powerspec 3  supports D0 D3  current D0
    ecap 000b[100] = Vendor 1 ID 2
    ecap 000d[110] = ACS 1
    ecap 0001[148] = AER 1 0 fatal 0 non-fatal 0 corrected
    ecap 000b[1d0] = Vendor 1 ID 3
    ecap 0019[250] = PCIe Sec 1 lane errors 0
    ecap 000b[280] = Vendor 1 ID 5
    ecap 000b[300] = Vendor 1 ID 8

pcib19@pci0:174:1:0:	class=0x060400 card=0x00008086 chip=0x20318086 rev=0x07 hdr=0x01
    vendor     = 'Intel Corporation'
    device     = 'Sky Lake-E PCI Express Root Port B'
    class      = bridge
    subclass   = PCI-PCI
    cap 0d[40] = PCI Bridge card=0x00008086
    cap 05[60] = MSI supports 2 messages, vector masks enabled with 1 message
    cap 10[90] = PCI-Express 2 root port max data 256(256) ARI disabled
                 link x0(x4) speed 0.0(8.0) ASPM disabled(L1)
                 slot 165 power limit 0 mW HotPlug(empty) surprise
    cap 01[e0] = powerspec 3  supports D0 D3  current D0
    ecap 000b[100] = Vendor 1 ID 2
    ecap 000d[110] = ACS 1
    ecap 0001[148] = AER 1 0 fatal 0 non-fatal 0 corrected
    ecap 000b[1d0] = Vendor 1 ID 3
    ecap 0019[250] = PCIe Sec 1 lane errors 0
    ecap 000b[280] = Vendor 1 ID 5
    ecap 000b[300] = Vendor 1 ID 8

pcib20@pci0:174:2:0:	class=0x060400 card=0x00008086 chip=0x20328086 rev=0x07 hdr=0x01
    vendor     = 'Intel Corporation'
    device     = 'Sky Lake-E PCI Express Root Port C'
    class      = bridge
    subclass   = PCI-PCI
    cap 0d[40] = PCI Bridge card=0x00008086
    cap 05[60] = MSI supports 2 messages, vector masks enabled with 1 message
    cap 10[90] = PCI-Express 2 root port max data 256(256) ARI disabled
                 link x0(x4) speed 0.0(8.0) ASPM disabled(L1)
                 slot 162 power limit 0 mW HotPlug(empty) surprise
    cap 01[e0] = powerspec 3  supports D0 D3  current D0
    ecap 000b[100] = Vendor 1 ID 2
    ecap 000d[110] = ACS 1
    ecap 0001[148] = AER 1 0 fatal 0 non-fatal 0 corrected
    ecap 000b[1d0] = Vendor 1 ID 3
    ecap 0019[250] = PCIe Sec 1 lane errors 0
    ecap 000b[280] = Vendor 1 ID 5
    ecap 000b[300] = Vendor 1 ID 8

pcib21@pci0:174:3:0:	class=0x060400 card=0x00008086 chip=0x20338086 rev=0x07 hdr=0x01
    vendor     = 'Intel Corporation'
    device     = 'Sky Lake-E PCI Express Root Port D'
    class      = bridge
    subclass   = PCI-PCI
    cap 0d[40] = PCI Bridge card=0x00008086
    cap 05[60] = MSI supports 2 messages, vector masks enabled with 1 message
    cap 10[90] = PCI-Express 2 root port max data 256(256) ARI disabled
                 link x0(x4) speed 0.0(8.0) ASPM disabled(L1)
                 slot 163 power limit 0 mW HotPlug(empty) surprise
    cap 01[e0] = powerspec 3  supports D0 D3  current D0
    ecap 000b[100] = Vendor 1 ID 2
    ecap 000d[110] = ACS 1
    ecap 0001[148] = AER 1 0 fatal 0 non-fatal 0 corrected
    ecap 000b[1d0] = Vendor 1 ID 3
    ecap 0019[250] = PCIe Sec 1 lane errors 0
    ecap 000b[280] = Vendor 1 ID 5
    ecap 000b[300] = Vendor 1 ID 8

none159@pci0:174:5:0:	class=0x088000 card=0x00008086 chip=0x20348086 rev=0x07 hdr=0x00
    vendor     = 'Intel Corporation'
    device     = 'Sky Lake-E VT-d'
    class      = base peripheral
    cap 10[40] = PCI-Express 2 root endpoint max data 128(128)

none160@pci0:174:5:2:	class=0x088000 card=0x00000000 chip=0x20358086 rev=0x07 hdr=0x00
    vendor     = 'Intel Corporation'
    device     = 'Sky Lake-E RAS Configuration Registers'
    class      = base peripheral
    cap 10[40] = PCI-Express 2 root endpoint max data 128(128)

ioapic6@pci0:174:5:4:	class=0x080020 card=0x20368086 chip=0x20368086 rev=0x07 hdr=0x00
    vendor     = 'Intel Corporation'
    device     = 'Sky Lake-E IOxAPIC Configuration Registers'
    class      = base peripheral
    subclass   = interrupt controller
    bar   [10] = type Memory, range 32, base 0xe2000000, size 4096, enabled
    cap 10[44] = PCI-Express 1 root endpoint max data 128(128)
    cap 01[e0] = powerspec 3  supports D0 D3  current D0

none161@pci0:174:8:0:	class=0x088000 card=0x00008086 chip=0x20668086 rev=0x07 hdr=0x00
    vendor     = 'Intel Corporation'
    device     = 'Sky Lake-E Integrated Memory Controller'
    class      = base peripheral
    cap 10[40] = PCI-Express 1 root endpoint max data 128(128)

none162@pci0:174:9:0:	class=0x088000 card=0x00008086 chip=0x20668086 rev=0x07 hdr=0x00
    vendor     = 'Intel Corporation'
    device     = 'Sky Lake-E Integrated Memory Controller'
    class      = base peripheral
    cap 10[40] = PCI-Express 1 root endpoint max data 128(128)

none163@pci0:174:10:0:	class=0x088000 card=0x00008086 chip=0x20408086 rev=0x07 hdr=0x00
    vendor     = 'Intel Corporation'
    device     = 'Sky Lake-E Integrated Memory Controller'
    class      = base peripheral
    cap 10[40] = PCI-Express 1 root endpoint max data 128(128)

none164@pci0:174:10:1:	class=0x088000 card=0x00008086 chip=0x20418086 rev=0x07 hdr=0x00
    vendor     = 'Intel Corporation'
    device     = 'Sky Lake-E Integrated Memory Controller'
    class      = base peripheral
    cap 10[40] = PCI-Express 1 root endpoint max data 128(128)

none165@pci0:174:10:2:	class=0x088000 card=0x00008086 chip=0x20428086 rev=0x07 hdr=0x00
    vendor     = 'Intel Corporation'
    device     = 'Sky Lake-E Integrated Memory Controller'
    class      = base peripheral
    cap 10[40] = PCI-Express 1 root endpoint max data 128(128)

none166@pci0:174:10:3:	class=0x088000 card=0x00008086 chip=0x20438086 rev=0x07 hdr=0x00
    vendor     = 'Intel Corporation'
    device     = 'Sky Lake-E Integrated Memory Controller'
    class      = base peripheral
    cap 10[40] = PCI-Express 1 root endpoint max data 128(128)

none167@pci0:174:10:4:	class=0x088000 card=0x00008086 chip=0x20448086 rev=0x07 hdr=0x00
    vendor     = 'Intel Corporation'
    device     = 'Sky Lake-E Integrated Memory Controller'
    class      = base peripheral
    cap 10[40] = PCI-Express 1 root endpoint max data 128(128)

none168@pci0:174:10:5:	class=0x088000 card=0x00008086 chip=0x20458086 rev=0x07 hdr=0x00
    vendor     = 'Intel Corporation'
    device     = 'Sky Lake-E LM Channel 1'
    class      = base peripheral
    cap 10[40] = PCI-Express 1 root endpoint max data 128(128)

none169@pci0:174:10:6:	class=0x088000 card=0x00008086 chip=0x20468086 rev=0x07 hdr=0x00
    vendor     = 'Intel Corporation'
    device     = 'Sky Lake-E LMS Channel 1'
    class      = base peripheral
    cap 10[40] = PCI-Express 1 root endpoint max data 128(128)

none170@pci0:174:10:7:	class=0x088000 card=0x00008086 chip=0x20478086 rev=0x07 hdr=0x00
    vendor     = 'Intel Corporation'
    device     = 'Sky Lake-E LMDP Channel 1'
    class      = base peripheral
    cap 10[40] = PCI-Express 1 root endpoint max data 128(128)

none171@pci0:174:11:0:	class=0x088000 card=0x00008086 chip=0x20488086 rev=0x07 hdr=0x00
    vendor     = 'Intel Corporation'
    device     = 'Sky Lake-E DECS Channel 2'
    class      = base peripheral
    cap 10[40] = PCI-Express 1 root endpoint max data 128(128)

none172@pci0:174:11:1:	class=0x088000 card=0x00008086 chip=0x20498086 rev=0x07 hdr=0x00
    vendor     = 'Intel Corporation'
    device     = 'Sky Lake-E LM Channel 2'
    class      = base peripheral
    cap 10[40] = PCI-Express 1 root endpoint max data 128(128)

none173@pci0:174:11:2:	class=0x088000 card=0x00008086 chip=0x204a8086 rev=0x07 hdr=0x00
    vendor     = 'Intel Corporation'
    device     = 'Sky Lake-E LMS Channel 2'
    class      = base peripheral
    cap 10[40] = PCI-Express 1 root endpoint max data 128(128)

none174@pci0:174:11:3:	class=0x088000 card=0x00008086 chip=0x204b8086 rev=0x07 hdr=0x00
    vendor     = 'Intel Corporation'
    device     = 'Sky Lake-E LMDP Channel 2'
    class      = base peripheral
    cap 10[40] = PCI-Express 1 root endpoint max data 128(128)

none175@pci0:174:12:0:	class=0x088000 card=0x00008086 chip=0x20408086 rev=0x07 hdr=0x00
    vendor     = 'Intel Corporation'
    device     = 'Sky Lake-E Integrated Memory Controller'
    class      = base peripheral
    cap 10[40] = PCI-Express 1 root endpoint max data 128(128)

none176@pci0:174:12:1:	class=0x088000 card=0x00008086 chip=0x20418086 rev=0x07 hdr=0x00
    vendor     = 'Intel Corporation'
    device     = 'Sky Lake-E Integrated Memory Controller'
    class      = base peripheral
    cap 10[40] = PCI-Express 1 root endpoint max data 128(128)

none177@pci0:174:12:2:	class=0x088000 card=0x00008086 chip=0x20428086 rev=0x07 hdr=0x00
    vendor     = 'Intel Corporation'
    device     = 'Sky Lake-E Integrated Memory Controller'
    class      = base peripheral
    cap 10[40] = PCI-Express 1 root endpoint max data 128(128)

none178@pci0:174:12:3:	class=0x088000 card=0x00008086 chip=0x20438086 rev=0x07 hdr=0x00
    vendor     = 'Intel Corporation'
    device     = 'Sky Lake-E Integrated Memory Controller'
    class      = base peripheral
    cap 10[40] = PCI-Express 1 root endpoint max data 128(128)

none179@pci0:174:12:4:	class=0x088000 card=0x00008086 chip=0x20448086 rev=0x07 hdr=0x00
    vendor     = 'Intel Corporation'
    device     = 'Sky Lake-E Integrated Memory Controller'
    class      = base peripheral
    cap 10[40] = PCI-Express 1 root endpoint max data 128(128)

none180@pci0:174:12:5:	class=0x088000 card=0x00008086 chip=0x20458086 rev=0x07 hdr=0x00
    vendor     = 'Intel Corporation'
    device     = 'Sky Lake-E LM Channel 1'
    class      = base peripheral
    cap 10[40] = PCI-Express 1 root endpoint max data 128(128)

none181@pci0:174:12:6:	class=0x088000 card=0x00008086 chip=0x20468086 rev=0x07 hdr=0x00
    vendor     = 'Intel Corporation'
    device     = 'Sky Lake-E LMS Channel 1'
    class      = base peripheral
    cap 10[40] = PCI-Express 1 root endpoint max data 128(128)

none182@pci0:174:12:7:	class=0x088000 card=0x00008086 chip=0x20478086 rev=0x07 hdr=0x00
    vendor     = 'Intel Corporation'
    device     = 'Sky Lake-E LMDP Channel 1'
    class      = base peripheral
    cap 10[40] = PCI-Express 1 root endpoint max data 128(128)

none183@pci0:174:13:0:	class=0x088000 card=0x00008086 chip=0x20488086 rev=0x07 hdr=0x00
    vendor     = 'Intel Corporation'
    device     = 'Sky Lake-E DECS Channel 2'
    class      = base peripheral
    cap 10[40] = PCI-Express 1 root endpoint max data 128(128)

none184@pci0:174:13:1:	class=0x088000 card=0x00008086 chip=0x20498086 rev=0x07 hdr=0x00
    vendor     = 'Intel Corporation'
    device     = 'Sky Lake-E LM Channel 2'
    class      = base peripheral
    cap 10[40] = PCI-Express 1 root endpoint max data 128(128)

none185@pci0:174:13:2:	class=0x088000 card=0x00008086 chip=0x204a8086 rev=0x07 hdr=0x00
    vendor     = 'Intel Corporation'
    device     = 'Sky Lake-E LMS Channel 2'
    class      = base peripheral
    cap 10[40] = PCI-Express 1 root endpoint max data 128(128)

none186@pci0:174:13:3:	class=0x088000 card=0x00008086 chip=0x204b8086 rev=0x07 hdr=0x00
    vendor     = 'Intel Corporation'
    device     = 'Sky Lake-E LMDP Channel 2'
    class      = base peripheral
    cap 10[40] = PCI-Express 1 root endpoint max data 128(128)

pcib23@pci0:215:0:0:	class=0x060400 card=0x00008086 chip=0x20308086 rev=0x07 hdr=0x01
    vendor     = 'Intel Corporation'
    device     = 'Sky Lake-E PCI Express Root Port A'
    class      = bridge
    subclass   = PCI-PCI
    cap 0d[40] = PCI Bridge card=0x00008086
    cap 05[60] = MSI supports 2 messages, vector masks 
    cap 10[90] = PCI-Express 2 root port max data 256(256) ARI disabled
                 link x4(x16) speed 5.0(8.0) ASPM disabled(L1)
                 slot 3 power limit 75000 mW
    cap 01[e0] = powerspec 3  supports D0 D3  current D0
    ecap 000b[100] = Vendor 1 ID 2
    ecap 000d[110] = ACS 1
    ecap 0001[148] = AER 1 0 fatal 0 non-fatal 0 corrected
    ecap 000b[1d0] = Vendor 1 ID 3
    ecap 0019[250] = PCIe Sec 1 lane errors 0
    ecap 000b[280] = Vendor 1 ID 5
    ecap 000b[300] = Vendor 1 ID 8

none187@pci0:215:5:0:	class=0x088000 card=0x00008086 chip=0x20348086 rev=0x07 hdr=0x00
    vendor     = 'Intel Corporation'
    device     = 'Sky Lake-E VT-d'
    class      = base peripheral
    cap 10[40] = PCI-Express 2 root endpoint max data 128(128)

none188@pci0:215:5:2:	class=0x088000 card=0x00000000 chip=0x20358086 rev=0x07 hdr=0x00
    vendor     = 'Intel Corporation'
    device     = 'Sky Lake-E RAS Configuration Registers'
    class      = base peripheral
    cap 10[40] = PCI-Express 2 root endpoint max data 128(128)

ioapic7@pci0:215:5:4:	class=0x080020 card=0x20368086 chip=0x20368086 rev=0x07 hdr=0x00
    vendor     = 'Intel Corporation'
    device     = 'Sky Lake-E IOxAPIC Configuration Registers'
    class      = base peripheral
    subclass   = interrupt controller
    bar   [10] = type Memory, range 32, base 0xeeb00000, size 4096, enabled
    cap 10[44] = PCI-Express 1 root endpoint max data 128(128)
    cap 01[e0] = powerspec 3  supports D0 D3  current D0

none189@pci0:215:14:0:	class=0x110100 card=0x00008086 chip=0x20588086 rev=0x07 hdr=0x00
    vendor     = 'Intel Corporation'
    device     = 'Sky Lake-E KTI 0'
    class      = dasp
    subclass   = performance counters
    cap 10[40] = PCI-Express 2 root endpoint max data 128(128)

none190@pci0:215:14:1:	class=0x088000 card=0x00008086 chip=0x20598086 rev=0x07 hdr=0x00
    vendor     = 'Intel Corporation'
    device     = 'Sky Lake-E UPI Registers'
    class      = base peripheral
    cap 10[40] = PCI-Express 2 root endpoint max data 128(128)
    ecap 000b[100] = Vendor 0none191@pci0:215:15:0:	class=0x110100 card=0x00008086 chip=0x20588086 rev=0x07 hdr=0x00
    vendor     = 'Intel Corporation'
    device     = 'Sky Lake-E KTI 0'
    class      = dasp
    subclass   = performance counters
    cap 10[40] = PCI-Express 2 root endpoint max data 128(128)

none192@pci0:215:15:1:	class=0x088000 card=0x00008086 chip=0x20598086 rev=0x07 hdr=0x00
    vendor     = 'Intel Corporation'
    device     = 'Sky Lake-E UPI Registers'
    class      = base peripheral
    cap 10[40] = PCI-Express 2 root endpoint max data 128(128)
    ecap 000b[100] = Vendor 0none193@pci0:215:18:0:	class=0x110100 card=0x00008086 chip=0x204c8086 rev=0x07 hdr=0x00
    vendor     = 'Intel Corporation'
    device     = 'Sky Lake-E M3KTI Registers'
    class      = dasp
    subclass   = performance counters
    cap 10[40] = PCI-Express 2 root endpoint max data 128(128)

none194@pci0:215:18:1:	class=0x110100 card=0x00008086 chip=0x204d8086 rev=0x07 hdr=0x00
    vendor     = 'Intel Corporation'
    device     = 'Sky Lake-E M3KTI Registers'
    class      = dasp
    subclass   = performance counters

none195@pci0:215:18:2:	class=0x088000 card=0x00008086 chip=0x204e8086 rev=0x07 hdr=0x00
    vendor     = 'Intel Corporation'
    device     = 'Sky Lake-E M3KTI Registers'
    class      = base peripheral

none196@pci0:215:21:0:	class=0x088000 card=0x00008086 chip=0x20188086 rev=0x07 hdr=0x00
    vendor     = 'Intel Corporation'
    device     = 'Sky Lake-E M2PCI Registers'
    class      = base peripheral

none197@pci0:215:21:1:	class=0x110100 card=0x00008086 chip=0x20888086 rev=0x07 hdr=0x00
    vendor     = 'Intel Corporation'
    class      = dasp
    subclass   = performance counters

none198@pci0:215:22:0:	class=0x088000 card=0x00008086 chip=0x20188086 rev=0x07 hdr=0x00
    vendor     = 'Intel Corporation'
    device     = 'Sky Lake-E M2PCI Registers'
    class      = base peripheral

none199@pci0:215:22:1:	class=0x110100 card=0x00008086 chip=0x20888086 rev=0x07 hdr=0x00
    vendor     = 'Intel Corporation'
    class      = dasp
    subclass   = performance counters

none200@pci0:215:22:4:	class=0x088000 card=0x00008086 chip=0x20188086 rev=0x07 hdr=0x00
    vendor     = 'Intel Corporation'
    device     = 'Sky Lake-E M2PCI Registers'
    class      = base peripheral

none201@pci0:215:22:5:	class=0x110100 card=0x00008086 chip=0x20888086 rev=0x07 hdr=0x00
    vendor     = 'Intel Corporation'
    class      = dasp
    subclass   = performance counters

igb4@pci0:216:0:0:	class=0x020000 card=0x1780103c chip=0x150e8086 rev=0x01 hdr=0x00
    vendor     = 'Intel Corporation'
    device     = '82580 Gigabit Network Connection'
    class      = network
    subclass   = ethernet
    bar   [10] = type Memory, range 64, base 0xee980000, size 524288, enabled
    bar   [20] = type Memory, range 64, base 0xeea0c000, size 16384, enabled
    cap 01[40] = powerspec 3  supports D0 D3  current D0
    cap 05[50] = MSI supports 1 message, 64 bit, vector masks 
    cap 11[70] = MSI-X supports 10 messages, enabled
                 Table in map 0x20[0x0], PBA in map 0x20[0x2000]
    cap 10[a0] = PCI-Express 2 endpoint max data 256(512) FLR RO NS
                 link x4(x4) speed 5.0(5.0) ASPM disabled(L0s/L1)
    cap 03[e0] = VPD
    ecap 0001[100] = AER 1 0 fatal 0 non-fatal 1 corrected
    ecap 0003[140] = Serial 1 f4ce46ffffa60a8b
    ecap 0017[1a0] = TPH Requester 1
    ecap 0018[1c0] = LTR 1

igb5@pci0:216:0:1:	class=0x020000 card=0x1780103c chip=0x150e8086 rev=0x01 hdr=0x00
    vendor     = 'Intel Corporation'
    device     = '82580 Gigabit Network Connection'
    class      = network
    subclass   = ethernet
    bar   [10] = type Memory, range 64, base 0xee900000, size 524288, enabled
    bar   [20] = type Memory, range 64, base 0xeea08000, size 16384, enabled
    cap 01[40] = powerspec 3  supports D0 D3  current D0
    cap 05[50] = MSI supports 1 message, 64 bit, vector masks 
    cap 11[70] = MSI-X supports 10 messages, enabled
                 Table in map 0x20[0x0], PBA in map 0x20[0x2000]
    cap 10[a0] = PCI-Express 2 endpoint max data 256(512) FLR RO NS
                 link x4(x4) speed 5.0(5.0) ASPM disabled(L0s/L1)
    cap 03[e0] = VPD
    ecap 0001[100] = AER 1 0 fatal 0 non-fatal 1 corrected
    ecap 0003[140] = Serial 1 f4ce46ffffa60a8b
    ecap 0017[1a0] = TPH Requester 1

igb6@pci0:216:0:2:	class=0x020000 card=0x1780103c chip=0x150e8086 rev=0x01 hdr=0x00
    vendor     = 'Intel Corporation'
    device     = '82580 Gigabit Network Connection'
    class      = network
    subclass   = ethernet
    bar   [10] = type Memory, range 64, base 0xee880000, size 524288, enabled
    bar   [20] = type Memory, range 64, base 0xeea04000, size 16384, enabled
    cap 01[40] = powerspec 3  supports D0 D3  current D0
    cap 05[50] = MSI supports 1 message, 64 bit, vector masks 
    cap 11[70] = MSI-X supports 10 messages, enabled
                 Table in map 0x20[0x0], PBA in map 0x20[0x2000]
    cap 10[a0] = PCI-Express 2 endpoint max data 256(512) FLR RO NS
                 link x4(x4) speed 5.0(5.0) ASPM disabled(L0s/L1)
    cap 03[e0] = VPD
    ecap 0001[100] = AER 1 0 fatal 0 non-fatal 1 corrected
    ecap 0003[140] = Serial 1 f4ce46ffffa60a8b
    ecap 0017[1a0] = TPH Requester 1

igb7@pci0:216:0:3:	class=0x020000 card=0x1780103c chip=0x150e8086 rev=0x01 hdr=0x00
    vendor     = 'Intel Corporation'
    device     = '82580 Gigabit Network Connection'
    class      = network
    subclass   = ethernet
    bar   [10] = type Memory, range 64, base 0xee800000, size 524288, enabled
    bar   [20] = type Memory, range 64, base 0xeea00000, size 16384, enabled
    cap 01[40] = powerspec 3  supports D0 D3  current D0
    cap 05[50] = MSI supports 1 message, 64 bit, vector masks 
    cap 11[70] = MSI-X supports 10 messages, enabled
                 Table in map 0x20[0x0], PBA in map 0x20[0x2000]
    cap 10[a0] = PCI-Express 2 endpoint max data 256(512) FLR RO NS
                 link x4(x4) speed 5.0(5.0) ASPM disabled(L0s/L1)
    cap 03[e0] = VPD
    ecap 0001[100] = AER 1 0 fatal 0 non-fatal 1 corrected
    ecap 0003[140] = Serial 1 f4ce46ffffa60a8b
    ecap 0017[1a0] = TPH Requester 1
