hostb0@pci0:0:0:0:	class=0x060000 rev=0x02 hdr=0x00 vendor=0x8086 device=0x29a0 subvendor=0x1043 subdevice=0x81ea
    vendor     = 'Intel Corporation'
    device     = '82P965/G965 Memory Controller Hub'
    class      = bridge
    subclass   = HOST-PCI
    cap 09[e0] = vendor (length 9) Intel cap 0 version 1

pcib1@pci0:0:1:0:	class=0x060400 rev=0x02 hdr=0x01 vendor=0x8086 device=0x29a1 subvendor=0x8086 subdevice=0x277d
    vendor     = 'Intel Corporation'
    device     = '82P965/G965 PCI Express Root Port'
    class      = bridge
    subclass   = PCI-PCI
    cap 0d[88] = PCI Bridge subvendor=0x8086 subdevice=0x277d
    cap 01[80] = powerspec 3  supports D0 D3  current D0
    cap 05[90] = MSI supports 1 message 
    cap 10[a0] = PCI-Express 1 root port max data 128(128)
                 max read 128
                 link x16(x16) speed 2.5(2.5) ASPM disabled(L0s)
                 slot 0 power limit 0 mW
    ecap 0002[100] = VC 1 max VC0
    ecap 0005[140] = Root Complex Link Declaration 1

uhci0@pci0:0:26:0:	class=0x0c0300 rev=0x02 hdr=0x00 vendor=0x8086 device=0x2834 subvendor=0x1043 subdevice=0x81ec
    vendor     = 'Intel Corporation'
    device     = '82801H (ICH8 Family) USB UHCI Controller'
    class      = serial bus
    subclass   = USB
    bar   [20] = type I/O Port, range 32, base 0xb880, size 32, enabled

uhci1@pci0:0:26:1:	class=0x0c0300 rev=0x02 hdr=0x00 vendor=0x8086 device=0x2835 subvendor=0x1043 subdevice=0x81ec
    vendor     = 'Intel Corporation'
    device     = '82801H (ICH8 Family) USB UHCI Controller'
    class      = serial bus
    subclass   = USB
    bar   [20] = type I/O Port, range 32, base 0xbc00, size 32, enabled

ehci0@pci0:0:26:7:	class=0x0c0320 rev=0x02 hdr=0x00 vendor=0x8086 device=0x283a subvendor=0x1043 subdevice=0x81ec
    vendor     = 'Intel Corporation'
    device     = '82801H (ICH8 Family) USB2 EHCI Controller'
    class      = serial bus
    subclass   = USB
    bar   [10] = type Memory, range 32, base 0xf9fffc00, size 1024, enabled
    cap 01[50] = powerspec 2  supports D0 D3  current D0
    cap 0a[58] = EHCI Debug Port at offset 0xa0 in map 0x14

hdac1@pci0:0:27:0:	class=0x040300 rev=0x02 hdr=0x00 vendor=0x8086 device=0x284b subvendor=0x1043 subdevice=0x81ec
    vendor     = 'Intel Corporation'
    device     = '82801H (ICH8 Family) HD Audio Controller'
    class      = multimedia
    subclass   = HDA
    bar   [10] = type Memory, range 64, base 0xf9ff8000, size 16384, enabled
    cap 01[50] = powerspec 2  supports D0 D3  current D0
    cap 05[60] = MSI supports 1 message, 64 bit enabled with 1 message
    cap 10[70] = PCI-Express 1 root endpoint max data 128(128) NS
                 max read 128
    ecap 0002[100] = VC 1 max VC1
    ecap 0005[130] = Root Complex Link Declaration 1

pcib2@pci0:0:28:0:	class=0x060400 rev=0x02 hdr=0x01 vendor=0x8086 device=0x283f subvendor=0x1043 subdevice=0x81ec
    vendor     = 'Intel Corporation'
    device     = '82801H (ICH8 Family) PCI Express Port 1'
    class      = bridge
    subclass   = PCI-PCI
    cap 10[40] = PCI-Express 1 root port max data 128(128)
                 max read 128
                 link x0(x2) speed 0.0(2.5) ASPM disabled(L0s/L1)
                 slot 0 power limit 0 mW HotPlug(empty) surprise
    cap 05[80] = MSI supports 1 message enabled with 1 message
    cap 0d[90] = PCI Bridge subvendor=0x1043 subdevice=0x81ec
    cap 01[a0] = powerspec 2  supports D0 D3  current D0
    ecap 0002[100] = VC 1 max VC0
    ecap 0005[180] = Root Complex Link Declaration 1

pcib3@pci0:0:28:2:	class=0x060400 rev=0x02 hdr=0x01 vendor=0x8086 device=0x2843 subvendor=0x1043 subdevice=0x81ec
    vendor     = 'Intel Corporation'
    device     = '82801H (ICH8 Family) PCI Express Port 3'
    class      = bridge
    subclass   = PCI-PCI
    cap 10[40] = PCI-Express 1 root port max data 128(128)
                 max read 128
                 link x1(x2) speed 2.5(2.5) ASPM disabled(L0s/L1)
                 slot 0 power limit 0 mW HotPlug(present) surprise
    cap 05[80] = MSI supports 1 message enabled with 1 message
    cap 0d[90] = PCI Bridge subvendor=0x1043 subdevice=0x81ec
    cap 01[a0] = powerspec 2  supports D0 D3  current D0
    ecap 0002[100] = VC 1 max VC0
    ecap 0005[180] = Root Complex Link Declaration 1

pcib4@pci0:0:28:5:	class=0x060400 rev=0x02 hdr=0x01 vendor=0x8086 device=0x2849 subvendor=0x1043 subdevice=0x81ec
    vendor     = 'Intel Corporation'
    device     = '82801H (ICH8 Family) PCI Express Port 6'
    class      = bridge
    subclass   = PCI-PCI
    cap 10[40] = PCI-Express 1 root port max data 128(128)
                 max read 128
                 link x1(x1) speed 2.5(2.5) ASPM disabled(L0s/L1)
                 slot 0 power limit 0 mW HotPlug(present) surprise
    cap 05[80] = MSI supports 1 message enabled with 1 message
    cap 0d[90] = PCI Bridge subvendor=0x1043 subdevice=0x81ec
    cap 01[a0] = powerspec 2  supports D0 D3  current D0
    ecap 0002[100] = VC 1 max VC0
    ecap 0005[180] = Root Complex Link Declaration 1

uhci2@pci0:0:29:0:	class=0x0c0300 rev=0x02 hdr=0x00 vendor=0x8086 device=0x2830 subvendor=0x1043 subdevice=0x81ec
    vendor     = 'Intel Corporation'
    device     = '82801H (ICH8 Family) USB UHCI Controller'
    class      = serial bus
    subclass   = USB
    bar   [20] = type I/O Port, range 32, base 0xb400, size 32, enabled

uhci3@pci0:0:29:1:	class=0x0c0300 rev=0x02 hdr=0x00 vendor=0x8086 device=0x2831 subvendor=0x1043 subdevice=0x81ec
    vendor     = 'Intel Corporation'
    device     = '82801H (ICH8 Family) USB UHCI Controller'
    class      = serial bus
    subclass   = USB
    bar   [20] = type I/O Port, range 32, base 0xb480, size 32, enabled

uhci4@pci0:0:29:2:	class=0x0c0300 rev=0x02 hdr=0x00 vendor=0x8086 device=0x2832 subvendor=0x1043 subdevice=0x81ec
    vendor     = 'Intel Corporation'
    device     = '82801H (ICH8 Family) USB UHCI Controller'
    class      = serial bus
    subclass   = USB
    bar   [20] = type I/O Port, range 32, base 0xb800, size 32, enabled

ehci1@pci0:0:29:7:	class=0x0c0320 rev=0x02 hdr=0x00 vendor=0x8086 device=0x2836 subvendor=0x1043 subdevice=0x81ec
    vendor     = 'Intel Corporation'
    device     = '82801H (ICH8 Family) USB2 EHCI Controller'
    class      = serial bus
    subclass   = USB
    bar   [10] = type Memory, range 32, base 0xf9fff800, size 1024, enabled
    cap 01[50] = powerspec 2  supports D0 D3  current D0
    cap 0a[58] = EHCI Debug Port at offset 0xa0 in map 0x14

pcib5@pci0:0:30:0:	class=0x060401 rev=0xf2 hdr=0x01 vendor=0x8086 device=0x244e subvendor=0x1043 subdevice=0x81ec
    vendor     = 'Intel Corporation'
    device     = '82801 PCI Bridge'
    class      = bridge
    subclass   = PCI-PCI
    cap 0d[50] = PCI Bridge subvendor=0x1043 subdevice=0x81ec

isab0@pci0:0:31:0:	class=0x060100 rev=0x02 hdr=0x00 vendor=0x8086 device=0x2810 subvendor=0x1043 subdevice=0x81ec
    vendor     = 'Intel Corporation'
    device     = '82801HB/HR (ICH8/R) LPC Interface Controller'
    class      = bridge
    subclass   = PCI-ISA
    cap 09[e0] = vendor (length 12) Intel cap 1 version 0
		 features: 4 PCI-e x1 slots

ahci0@pci0:0:31:2:	class=0x010601 rev=0x02 hdr=0x00 vendor=0x8086 device=0x2821 subvendor=0x1043 subdevice=0x81ec
    vendor     = 'Intel Corporation'
    device     = '82801HR/HO/HH (ICH8R/DO/DH) 6 port SATA Controller [AHCI mode]'
    class      = mass storage
    subclass   = SATA
    bar   [10] = type I/O Port, range 32, base 0xb080, size 8, enabled
    bar   [14] = type I/O Port, range 32, base 0xb000, size 4, enabled
    bar   [18] = type I/O Port, range 32, base 0xac00, size 8, enabled
    bar   [1c] = type I/O Port, range 32, base 0xa880, size 4, enabled
    bar   [20] = type I/O Port, range 32, base 0xa800, size 32, enabled
    bar   [24] = type Memory, range 32, base 0xf9fff000, size 2048, enabled
    cap 05[80] = MSI supports 16 messages enabled with 16 messages
    cap 01[70] = powerspec 3  supports D0 D3  current D0
    cap 12[a8] = SATA Index-Data Pair

ichsmb0@pci0:0:31:3:	class=0x0c0500 rev=0x02 hdr=0x00 vendor=0x8086 device=0x283e subvendor=0x1043 subdevice=0x81ec
    vendor     = 'Intel Corporation'
    device     = '82801H (ICH8 Family) SMBus Controller'
    class      = serial bus
    subclass   = SMBus
    bar   [10] = type Memory, range 32, base 0, size 256, disabled
    bar   [20] = type I/O Port, range 32, base 0x400, size 32, enabled

vgapci0@pci0:1:0:0:	class=0x030000 rev=0xa1 hdr=0x00 vendor=0x10de device=0x0f01 subvendor=0x1569 subdevice=0x0f01
    vendor     = 'NVIDIA Corporation'
    device     = 'GF108 [GeForce GT 620]'
    class      = display
    subclass   = VGA
    bar   [10] = type Memory, range 32, base 0xfa000000, size 16777216, enabled
    bar   [14] = type Prefetchable Memory, range 64, base 0xd8000000, size 134217728, enabled
    bar   [1c] = type Prefetchable Memory, range 64, base 0xd6000000, size 33554432, enabled
    bar   [24] = type I/O Port, range 32, base 0xcc00, size 128, enabled
    cap 01[60] = powerspec 3  supports D0 D3  current D0
    cap 05[68] = MSI supports 1 message, 64 bit enabled with 1 message
    cap 10[78] = PCI-Express 2 endpoint max data 128(128) RO NS
                 max read 512
                 link x16(x16) speed 2.5(2.5) ASPM disabled(L0s/L1) ClockPM enabled
    cap 09[b4] = vendor (length 20)
    ecap 0002[100] = VC 1 max VC0
    ecap 0004[128] = Power Budgeting 1
    ecap 000b[600] = Vendor [1] ID 0001 Rev 1 Length 36

hdac0@pci0:1:0:1:	class=0x040300 rev=0xa1 hdr=0x00 vendor=0x10de device=0x0bea subvendor=0x1569 subdevice=0x0f01
    vendor     = 'NVIDIA Corporation'
    device     = 'GF108 High Definition Audio Controller'
    class      = multimedia
    subclass   = HDA
    bar   [10] = type Memory, range 32, base 0xfbcfc000, size 16384, enabled
    cap 01[60] = powerspec 3  supports D0 D3  current D0
    cap 05[68] = MSI supports 1 message, 64 bit 
    cap 10[78] = PCI-Express 2 endpoint max data 128(128) RO NS
                 max read 512
                 link x16(x16) speed 2.5(2.5) ASPM L0s/L1(L0s/L1) ClockPM enabled

xhci0@pci0:3:0:0:	class=0x0c0330 rev=0x00 hdr=0x00 vendor=0x1b6f device=0x7052 subvendor=0x1b6f subdevice=0x7052
    vendor     = 'Etron Technology, Inc.'
    device     = 'EJ188/EJ198 USB 3.0 Host Controller'
    class      = serial bus
    subclass   = USB
    bar   [10] = type Memory, range 64, base 0xfbef8000, size 32768, enabled
    cap 01[50] = powerspec 3  supports D0 D1 D2 D3  current D0
    cap 05[70] = MSI supports 4 messages, 64 bit, vector masks enabled with 1 message
    cap 10[a0] = PCI-Express 2 endpoint MSI 1 max data 128(1024) FLR RO NS
                 max read 512
                 link x1(x1) speed 2.5(5.0) ASPM disabled(L0s/L1) ClockPM disabled
    ecap 0001[100] = AER 1 0 fatal 0 non-fatal 1 corrected
    ecap 0003[190] = Serial 1 0101010101010101

mskc0@pci0:2:0:0:	class=0x020000 rev=0x12 hdr=0x00 vendor=0x11ab device=0x4364 subvendor=0x1043 subdevice=0x81f8
    vendor     = 'Marvell Technology Group Ltd.'
    device     = '88E8056 PCI-E Gigabit Ethernet Controller'
    class      = network
    subclass   = ethernet
    bar   [10] = type Memory, range 64, base 0xfbdfc000, size 16384, enabled
    bar   [18] = type I/O Port, range 32, base 0xd800, size 256, enabled
    cap 01[48] = powerspec 3  supports D0 D1 D2 D3  current D0
    cap 03[50] = VPD
    cap 05[5c] = MSI supports 1 message, 64 bit enabled with 1 message
    cap 10[e0] = PCI-Express 1 legacy endpoint max data 128(128)
                 max read 2048
                 link x1(x1) speed 2.5(2.5) ASPM disabled(L0s/L1) ClockPM disabled
    ecap 0001[100] = AER 1 0 fatal 0 non-fatal 1 corrected

none0@pci0:5:3:0:	class=0x0c0010 rev=0x00 hdr=0x00 vendor=0x104c device=0x8023 subvendor=0x1043 subdevice=0x815b
    vendor     = 'Texas Instruments'
    device     = 'TSB43AB22A IEEE-1394a-2000 Controller (PHY/Link) [iOHCI-Lynx]'
    class      = serial bus
    subclass   = FireWire
    bar   [10] = type Memory, range 32, base 0xfbfff800, size 2048, enabled
    bar   [14] = type Memory, range 32, base 0xfbff8000, size 16384, enabled
    cap 01[44] = powerspec 2  supports D0 D1 D2 D3  current D0

skc0@pci0:5:4:0:	class=0x020000 rev=0x14 hdr=0x00 vendor=0x11ab device=0x4320 subvendor=0x1043 subdevice=0x811a
    vendor     = 'Marvell Technology Group Ltd.'
    device     = '88E8001 Gigabit Ethernet Controller'
    class      = network
    subclass   = ethernet
    bar   [10] = type Memory, range 32, base 0xfbff4000, size 16384, enabled
    bar   [14] = type I/O Port, range 32, base 0xe800, size 256, enabled
    cap 01[48] = powerspec 2  supports D0 D1 D2 D3  current D0
    cap 03[50] = VPD
