hostb0@pci0:0:0:0:	class=0x060000 rev=0x05 hdr=0x00 vendor=0x8086 device=0x9b53 subvendor=0x15d9 subdevice=0x1b6e
    vendor     = 'Intel Corporation'
    device     = 'Comet Lake-S 6c Host Bridge/DRAM Controller'
    class      = bridge
    subclass   = HOST-PCI
    cap 09[e0] = vendor (length 16) Intel cap 0 version 1

none0@pci0:0:8:0:	class=0x088000 rev=0x00 hdr=0x00 vendor=0x8086 device=0x1911 subvendor=0x15d9 subdevice=0x1b6e
    vendor     = 'Intel Corporation'
    device     = 'Xeon E3-1200 v5/v6 / E3-1500 v5 / 6th/7th/8th Gen Core Processor Gaussian Mixture Model'
    class      = base peripheral
    bar   [10] = type Memory, range 64, base 0xa273f000, size 4096, enabled
    cap 05[90] = MSI supports 1 message 
    cap 01[dc] = powerspec 2  supports D0 D3  current D0
    cap 13[f0] = PCI Advanced Features: FLR TP

pchtherm0@pci0:0:18:0:	class=0x118000 rev=0x00 hdr=0x00 vendor=0x8086 device=0x06f9 subvendor=0x15d9 subdevice=0x1b6e
    vendor     = 'Intel Corporation'
    device     = 'Comet Lake PCH Thermal Controller'
    class      = dasp
    bar   [10] = type Memory, range 64, base 0xa273e000, size 4096, enabled
    cap 01[50] = powerspec 3  supports D0 D3  current D0
    cap 05[80] = MSI supports 1 message 

xhci0@pci0:0:20:0:	class=0x0c0330 rev=0x00 hdr=0x00 vendor=0x8086 device=0x06ed subvendor=0x15d9 subdevice=0x1b6e
    vendor     = 'Intel Corporation'
    device     = 'Comet Lake USB 3.1 xHCI Host Controller'
    class      = serial bus
    subclass   = USB
    bar   [10] = type Memory, range 64, base 0xa2720000, size 65536, enabled
    cap 01[70] = powerspec 2  supports D0 D3  current D0
    cap 05[80] = MSI supports 8 messages, 64 bit enabled with 1 message
    cap 09[90] = vendor (length 20) Intel cap 15 version 0

none1@pci0:0:20:2:	class=0x050000 rev=0x00 hdr=0x00 vendor=0x8086 device=0x06ef subvendor=0x15d9 subdevice=0x1b6e
    vendor     = 'Intel Corporation'
    device     = 'Comet Lake PCH Shared SRAM'
    class      = memory
    subclass   = RAM
    bar   [10] = type Memory, range 64, base 0xa2736000, size 8192, enabled
    bar   [18] = type Memory, range 64, base 0xa273d000, size 4096, enabled
    cap 01[80] = powerspec 3  supports D0 D3  current D0

none2@pci0:0:22:0:	class=0x078000 rev=0x00 hdr=0x00 vendor=0x8086 device=0x06e0 subvendor=0x15d9 subdevice=0x1b6e
    vendor     = 'Intel Corporation'
    device     = 'Comet Lake HECI Controller'
    class      = simple comms
    bar   [10] = type Memory, range 64, base 0xa273c000, size 4096, enabled
    cap 01[50] = powerspec 3  supports D0 D3  current D0
    cap 05[8c] = MSI supports 1 message, 64 bit 
    cap 09[a4] = vendor (length 20) Intel cap 15 version 0

none3@pci0:0:22:3:	class=0x070002 rev=0x00 hdr=0x00 vendor=0x8086 device=0x06e3 subvendor=0x15d9 subdevice=0x1b6e
    vendor     = 'Intel Corporation'
    device     = 'Comet Lake Keyboard and Text (KT) Redirection'
    class      = simple comms
    subclass   = UART
    bar   [10] = type I/O Port, range 32, base 0x6060, size 8, enabled
    bar   [14] = type Memory, range 32, base 0xa273b000, size 4096, enabled
    cap 05[40] = MSI supports 1 message, 64 bit 
    cap 01[50] = powerspec 3  supports D0 D3  current D0

ahci0@pci0:0:23:0:	class=0x010601 rev=0x00 hdr=0x00 vendor=0x8086 device=0x06d2 subvendor=0x15d9 subdevice=0x1b6e
    vendor     = 'Intel Corporation'
    device     = 'Comet Lake SATA AHCI Controller'
    class      = mass storage
    subclass   = SATA
    bar   [10] = type Memory, range 32, base 0xa2734000, size 8192, enabled
    bar   [14] = type Memory, range 32, base 0xa273a000, size 256, enabled
    bar   [18] = type I/O Port, range 32, base 0x6050, size 8, enabled
    bar   [1c] = type I/O Port, range 32, base 0x6040, size 4, enabled
    bar   [20] = type I/O Port, range 32, base 0x6020, size 32, enabled
    bar   [24] = type Memory, range 32, base 0xa2739000, size 2048, enabled
    cap 05[80] = MSI supports 1 message enabled with 1 message
    cap 01[70] = powerspec 3  supports D0 D3  current D0
    cap 12[a8] = SATA Index-Data Pair

pcib1@pci0:0:27:0:	class=0x060400 rev=0xf0 hdr=0x01 vendor=0x8086 device=0x06c0 subvendor=0x15d9 subdevice=0x1b6e
    vendor     = 'Intel Corporation'
    device     = 'Comet Lake PCI Express Root Port'
    class      = bridge
    subclass   = PCI-PCI
    cap 10[40] = PCI-Express 2 root port max data 256(256) ARI disabled
                 max read 128
                 link x4(x4) speed 8.0(8.0) ASPM L1(L0s/L1)
                 slot 20 power limit 250 mW
    cap 05[80] = MSI supports 1 message 
    cap 0d[90] = PCI Bridge subvendor=0x15d9 subdevice=0x1b6e
    cap 01[a0] = powerspec 3  supports D0 D3  current D0
    ecap 0001[100] = AER 1 0 fatal 0 non-fatal 0 corrected
    ecap 000d[140] = ACS 1
    ecap 001f[150] = Precision Time Measurement 1
    ecap 0019[220] = PCIe Sec 1 lane errors 0
    ecap 001d[250] = Downstream Port Containment 1

pcib2@pci0:0:27:4:	class=0x060400 rev=0xf0 hdr=0x01 vendor=0x8086 device=0x06ac subvendor=0x15d9 subdevice=0x1b6e
    vendor     = 'Intel Corporation'
    device     = 'Comet Lake PCI Express Root Port'
    class      = bridge
    subclass   = PCI-PCI
    cap 10[40] = PCI-Express 2 root port max data 256(256) ARI disabled
                 max read 128
                 link x4(x4) speed 8.0(8.0) ASPM L1(L0s/L1)
                 slot 24 power limit 250 mW
    cap 05[80] = MSI supports 1 message 
    cap 0d[90] = PCI Bridge subvendor=0x15d9 subdevice=0x1b6e
    cap 01[a0] = powerspec 3  supports D0 D3  current D0
    ecap 0001[100] = AER 1 0 fatal 0 non-fatal 0 corrected
    ecap 000d[140] = ACS 1
    ecap 001f[150] = Precision Time Measurement 1
    ecap 0019[220] = PCIe Sec 1 lane errors 0
    ecap 001d[250] = Downstream Port Containment 1

pcib3@pci0:0:28:0:	class=0x060400 rev=0xf0 hdr=0x01 vendor=0x8086 device=0x06b8 subvendor=0x15d9 subdevice=0x1b6e
    vendor     = 'Intel Corporation'
    class      = bridge
    subclass   = PCI-PCI
    cap 10[40] = PCI-Express 2 root port max data 256(256) ARI disabled
                 max read 128
                 link x1(x4) speed 2.5(8.0) ASPM L1(L0s/L1)
                 slot 4 power limit 250 mW
    cap 05[80] = MSI supports 1 message 
    cap 0d[90] = PCI Bridge subvendor=0x15d9 subdevice=0x1b6e
    cap 01[a0] = powerspec 3  supports D0 D3  current D0
    ecap 0001[100] = AER 1 0 fatal 0 non-fatal 0 corrected
    ecap 000d[140] = ACS 1
    ecap 001f[150] = Precision Time Measurement 1
    ecap 0019[220] = PCIe Sec 1 lane errors 0
    ecap 001d[250] = Downstream Port Containment 1

pcib4@pci0:0:28:5:	class=0x060400 rev=0xf0 hdr=0x01 vendor=0x8086 device=0x06bd subvendor=0x15d9 subdevice=0x1b6e
    vendor     = 'Intel Corporation'
    device     = 'Comet Lake PCIe Port'
    class      = bridge
    subclass   = PCI-PCI
    cap 10[40] = PCI-Express 2 root port max data 256(256) ARI disabled
                 max read 128
                 link x1(x1) speed 2.5(8.0) ASPM L1(L0s/L1)
                 slot 9 power limit 100 mW
    cap 05[80] = MSI supports 1 message 
    cap 0d[90] = PCI Bridge subvendor=0x15d9 subdevice=0x1b6e
    cap 01[a0] = powerspec 3  supports D0 D3  current D0
    ecap 0001[100] = AER 1 0 fatal 0 non-fatal 0 corrected
    ecap 000d[140] = ACS 1
    ecap 001f[150] = Precision Time Measurement 1
    ecap 0019[220] = PCIe Sec 1 lane errors 0
    ecap 001d[250] = Downstream Port Containment 1

pcib5@pci0:0:28:6:	class=0x060400 rev=0xf0 hdr=0x01 vendor=0x8086 device=0x06be subvendor=0x15d9 subdevice=0x1b6e
    vendor     = 'Intel Corporation'
    class      = bridge
    subclass   = PCI-PCI
    cap 10[40] = PCI-Express 2 root port max data 256(256) ARI disabled
                 max read 128
                 link x1(x1) speed 5.0(8.0) ASPM disabled(L0s/L1)
                 slot 10 power limit 100 mW
    cap 05[80] = MSI supports 1 message 
    cap 0d[90] = PCI Bridge subvendor=0x15d9 subdevice=0x1b6e
    cap 01[a0] = powerspec 3  supports D0 D3  current D0
    ecap 0001[100] = AER 1 0 fatal 0 non-fatal 0 corrected
    ecap 000d[140] = ACS 1
    ecap 001f[150] = Precision Time Measurement 1
    ecap 0019[220] = PCIe Sec 1 lane errors 0
    ecap 001d[250] = Downstream Port Containment 1

pcib7@pci0:0:29:0:	class=0x060400 rev=0xf0 hdr=0x01 vendor=0x8086 device=0x06b0 subvendor=0x15d9 subdevice=0x1b6e
    vendor     = 'Intel Corporation'
    device     = 'Comet Lake PCI Express Root Port'
    class      = bridge
    subclass   = PCI-PCI
    cap 10[40] = PCI-Express 2 root port max data 256(256) ARI enabled
                 max read 128
                 link x4(x4) speed 8.0(8.0)
                 slot 12 power limit 250 mW
    cap 05[80] = MSI supports 1 message 
    cap 0d[90] = PCI Bridge subvendor=0x15d9 subdevice=0x1b6e
    cap 01[a0] = powerspec 3  supports D0 D3  current D0
    ecap 0001[100] = AER 1 0 fatal 0 non-fatal 0 corrected
    ecap 000d[140] = ACS 1
    ecap 001f[150] = Precision Time Measurement 1
    ecap 0019[220] = PCIe Sec 1 lane errors 0
    ecap 001d[250] = Downstream Port Containment 1

isab0@pci0:0:31:0:	class=0x060100 rev=0x00 hdr=0x00 vendor=0x8086 device=0x0697 subvendor=0x15d9 subdevice=0x1b6e
    vendor     = 'Intel Corporation'
    class      = bridge
    subclass   = PCI-ISA

hdac0@pci0:0:31:3:	class=0x040300 rev=0x00 hdr=0x00 vendor=0x8086 device=0x06c8 subvendor=0x15d9 subdevice=0x1b6e
    vendor     = 'Intel Corporation'
    device     = 'Comet Lake PCH cAVS'
    class      = multimedia
    subclass   = HDA
    bar   [10] = type Memory, range 64, base 0xa2730000, size 16384, enabled
    bar   [20] = type Memory, range 64, base 0xa2100000, size 1048576, enabled
    cap 01[50] = powerspec 3  supports D0 D3  current D0
    cap 09[80] = vendor (length 20) Intel cap 15 version 0
    cap 05[60] = MSI supports 1 message, 64 bit enabled with 1 message

ichsmb0@pci0:0:31:4:	class=0x0c0500 rev=0x00 hdr=0x00 vendor=0x8086 device=0x06a3 subvendor=0x15d9 subdevice=0x1b6e
    vendor     = 'Intel Corporation'
    device     = 'Comet Lake PCH SMBus Controller'
    class      = serial bus
    subclass   = SMBus
    bar   [10] = type Memory, range 64, base 0xa2738000, size 256, enabled
    bar   [20] = type I/O Port, range 32, base 0xefa0, size 32, enabled

none4@pci0:0:31:5:	class=0x0c8000 rev=0x00 hdr=0x00 vendor=0x8086 device=0x06a4 subvendor=0x15d9 subdevice=0x1b6e
    vendor     = 'Intel Corporation'
    device     = 'Comet Lake PCH SPI Controller'
    class      = serial bus
    bar   [10] = type Memory, range 32, base 0xfe010000, size 4096, enabled

em1@pci0:0:31:6:	class=0x020000 rev=0x00 hdr=0x00 vendor=0x8086 device=0x0d4c subvendor=0x15d9 subdevice=0x0d4c
    vendor     = 'Intel Corporation'
    device     = 'Ethernet Connection (11) I219-LM'
    class      = network
    subclass   = ethernet
    bar   [10] = type Memory, range 32, base 0xa2700000, size 131072, enabled
    cap 01[c8] = powerspec 3  supports D0 D3  current D0
    cap 05[d0] = MSI supports 1 message, 64 bit enabled with 1 message

nvme0@pci0:1:0:0:	class=0x010802 rev=0x00 hdr=0x00 vendor=0x15b7 device=0x5006 subvendor=0x15b7 subdevice=0x5006
    vendor     = 'Sandisk Corp'
    device     = 'WD Black SN750 / PC SN730 NVMe SSD'
    class      = mass storage
    subclass   = NVM
    bar   [10] = type Memory, range 64, base 0xa2600000, size 16384, enabled
    bar   [20] = type Memory, range 64, base 0xa2604000, size 256, enabled
    cap 01[80] = powerspec 3  supports D0 D3  current D0
    cap 05[90] = MSI supports 32 messages, 64 bit 
    cap 11[b0] = MSI-X supports 65 messages, enabled
                 Table in map 0x10[0x2000], PBA in map 0x20[0x0]
    cap 10[c0] = PCI-Express 2 endpoint max data 256(512) FLR RO NS
                 max read 512
                 link x4(x4) speed 8.0(8.0) ASPM L1(L1) ClockPM enabled
    ecap 0001[100] = AER 2 0 fatal 0 non-fatal 0 corrected
    ecap 0003[150] = Serial 1 0000000000000000
    ecap 0018[1b8] = LTR 1
    ecap 0019[300] = PCIe Sec 1 lane errors 0
    ecap 001e[900] = L1 PM Substates 1

nvme1@pci0:2:0:0:	class=0x010802 rev=0x00 hdr=0x00 vendor=0x15b7 device=0x5006 subvendor=0x15b7 subdevice=0x5006
    vendor     = 'Sandisk Corp'
    device     = 'WD Black SN750 / PC SN730 NVMe SSD'
    class      = mass storage
    subclass   = NVM
    bar   [10] = type Memory, range 64, base 0xa2500000, size 16384, enabled
    bar   [20] = type Memory, range 64, base 0xa2504000, size 256, enabled
    cap 01[80] = powerspec 3  supports D0 D3  current D0
    cap 05[90] = MSI supports 32 messages, 64 bit 
    cap 11[b0] = MSI-X supports 65 messages, enabled
                 Table in map 0x10[0x2000], PBA in map 0x20[0x0]
    cap 10[c0] = PCI-Express 2 endpoint max data 256(512) FLR RO NS
                 max read 512
                 link x4(x4) speed 8.0(8.0) ASPM L1(L1) ClockPM enabled
    ecap 0001[100] = AER 2 0 fatal 0 non-fatal 0 corrected
    ecap 0003[150] = Serial 1 0000000000000000
    ecap 0018[1b8] = LTR 1
    ecap 0019[300] = PCIe Sec 1 lane errors 0
    ecap 001e[900] = L1 PM Substates 1

em0@pci0:3:0:0:	class=0x020000 rev=0x00 hdr=0x00 vendor=0x8086 device=0x10d3 subvendor=0x8086 subdevice=0xa01f
    vendor     = 'Intel Corporation'
    device     = '82574L Gigabit Network Connection'
    class      = network
    subclass   = ethernet
    bar   [10] = type Memory, range 32, base 0xa24c0000, size 131072, enabled
    bar   [14] = type Memory, range 32, base 0xa2400000, size 524288, enabled
    bar   [18] = type I/O Port, range 32, base 0x5000, size 32, enabled
    bar   [1c] = type Memory, range 32, base 0xa24e0000, size 16384, enabled
    cap 01[c8] = powerspec 2  supports D0 D3  current D0
    cap 05[d0] = MSI supports 1 message, 64 bit 
    cap 10[e0] = PCI-Express 1 endpoint max data 256(256) RO NS
                 max read 512
                 link x1(x1) speed 2.5(2.5) ASPM disabled(L0s/L1)
    cap 11[a0] = MSI-X supports 5 messages, enabled
                 Table in map 0x1c[0x0], PBA in map 0x1c[0x2000]
    ecap 0001[100] = AER 1 0 fatal 0 non-fatal 1 corrected
    ecap 0003[140] = Serial 1 6805caffffc8bd09

igb0@pci0:4:0:0:	class=0x020000 rev=0x03 hdr=0x00 vendor=0x8086 device=0x1533 subvendor=0x15d9 subdevice=0x1533
    vendor     = 'Intel Corporation'
    device     = 'I210 Gigabit Network Connection'
    class      = network
    subclass   = ethernet
    bar   [10] = type Memory, range 32, base 0xa2300000, size 524288, enabled
    bar   [18] = type I/O Port, range 32, base 0x4000, size 32, enabled
    bar   [1c] = type Memory, range 32, base 0xa2380000, size 16384, enabled
    cap 01[40] = powerspec 3  supports D0 D3  current D0
    cap 05[50] = MSI supports 1 message, 64 bit, vector masks 
    cap 11[70] = MSI-X supports 5 messages, enabled
                 Table in map 0x1c[0x0], PBA in map 0x1c[0x2000]
    cap 10[a0] = PCI-Express 2 endpoint max data 256(512) FLR RO NS
                 max read 512
                 link x1(x1) speed 2.5(2.5) ASPM L1(L0s/L1)
    ecap 0001[100] = AER 2 0 fatal 0 non-fatal 1 corrected
    ecap 0003[140] = Serial 1 3cecefffff2d4a39
    ecap 0017[1a0] = TPH Requester 1

pcib6@pci0:5:0:0:	class=0x060400 rev=0x04 hdr=0x01 vendor=0x1a03 device=0x1150 subvendor=0x1a03 subdevice=0x1150
    vendor     = 'ASPEED Technology, Inc.'
    device     = 'AST1150 PCI-to-PCI Bridge'
    class      = bridge
    subclass   = PCI-PCI
    cap 05[50] = MSI supports 1 message, 64 bit 
    cap 01[78] = powerspec 3  supports D0 D1 D2 D3  current D0
    cap 10[80] = PCI-Express 2 PCI bridge max data 256(256) RO NS
                 max read 512
                 link x1(x1) speed 5.0(5.0) ASPM disabled(L0s/L1)
    cap 0d[c0] = PCI Bridge subvendor=0x1a03 subdevice=0x1150
    ecap 0002[100] = VC 1 max VC0
    ecap 0001[800] = AER 1 0 fatal 0 non-fatal 1 corrected

vgapci0@pci0:6:0:0:	class=0x030000 rev=0x41 hdr=0x00 vendor=0x1a03 device=0x2000 subvendor=0x15d9 subdevice=0x1b6e
    vendor     = 'ASPEED Technology, Inc.'
    device     = 'ASPEED Graphics Family'
    class      = display
    subclass   = VGA
    bar   [10] = type Memory, range 32, base 0xa1000000, size 16777216, enabled
    bar   [14] = type Memory, range 32, base 0xa2000000, size 131072, enabled
    bar   [18] = type I/O Port, range 32, base 0x3000, size 128, enabled
    cap 01[40] = powerspec 3  supports D0 D1 D2 D3  current D0
    cap 05[50] = MSI supports 2 messages, 64 bit 

ix0@pci0:7:0:0:	class=0x020000 rev=0x01 hdr=0x00 vendor=0x8086 device=0x1563 subvendor=0x15d9 subdevice=0x1563
    vendor     = 'Intel Corporation'
    device     = 'Ethernet Controller 10G X550T'
    class      = network
    subclass   = ethernet
    bar   [10] = type Prefetchable Memory, range 64, base 0xa2c00000, size 4194304, enabled
    bar   [20] = type Prefetchable Memory, range 64, base 0xa3004000, size 16384, enabled
    cap 01[40] = powerspec 3  supports D0 D3  current D0
    cap 05[50] = MSI supports 1 message, 64 bit, vector masks 
    cap 11[70] = MSI-X supports 64 messages, enabled
                 Table in map 0x20[0x0], PBA in map 0x20[0x2000]
    cap 10[a0] = PCI-Express 2 endpoint max data 256(512) FLR RO
                 max read 512
                 link x4(x4) speed 8.0(8.0) ASPM disabled(L0s/L1)
    ecap 0001[100] = AER 2 0 fatal 0 non-fatal 1 corrected
    ecap 0003[140] = Serial 1 0000c9ffff000000
    ecap 000e[150] = ARI 1
    ecap 0010[160] = SR-IOV 1 IOV disabled, Memory Space disabled, ARI disabled
                     0 VFs configured out of 64 supported
                     First VF RID Offset 0x0180, VF RID Stride 0x0002
                     VF Device ID 0x1565
                     Page Sizes: 4096 (enabled), 8192, 65536, 262144, 1048576, 4194304
    ecap 0017[1a0] = TPH Requester 1
    ecap 000d[1b0] = ACS 1
    ecap 0018[1c0] = LTR 1
    ecap 0019[1d0] = PCIe Sec 1 lane errors 0

ix1@pci0:7:0:1:	class=0x020000 rev=0x01 hdr=0x00 vendor=0x8086 device=0x1563 subvendor=0x15d9 subdevice=0x1563
    vendor     = 'Intel Corporation'
    device     = 'Ethernet Controller 10G X550T'
    class      = network
    subclass   = ethernet
    bar   [10] = type Prefetchable Memory, range 64, base 0xa2800000, size 4194304, enabled
    bar   [20] = type Prefetchable Memory, range 64, base 0xa3000000, size 16384, enabled
    cap 01[40] = powerspec 3  supports D0 D3  current D0
    cap 05[50] = MSI supports 1 message, 64 bit, vector masks 
    cap 11[70] = MSI-X supports 64 messages, enabled
                 Table in map 0x20[0x0], PBA in map 0x20[0x2000]
    cap 10[a0] = PCI-Express 2 endpoint max data 256(512) FLR RO
                 max read 512
                 link x4(x4) speed 8.0(8.0) ASPM disabled(L0s/L1)
    ecap 0001[100] = AER 2 0 fatal 0 non-fatal 1 corrected
    ecap 0003[140] = Serial 1 0000c9ffff000000
    ecap 000e[150] = ARI 1
    ecap 0010[160] = SR-IOV 1 IOV disabled, Memory Space disabled, ARI disabled
                     0 VFs configured out of 64 supported
                     First VF RID Offset 0x0180, VF RID Stride 0x0002
                     VF Device ID 0x1565
                     Page Sizes: 4096 (enabled), 8192, 65536, 262144, 1048576, 4194304
    ecap 0017[1a0] = TPH Requester 1
    ecap 000d[1b0] = ACS 1
