hostb0@pci0:0:0:0:	class=0x060000 card=0x50001458 chip=0x9b638086 rev=0x03 hdr=0x00
    vendor     = 'Intel Corporation'
    device     = '10th Gen Core Processor Host Bridge/DRAM Registers'
    class      = bridge
    subclass   = HOST-PCI
    cap 09[e0] = vendor (length 16) Intel cap 0 version 1

pcib1@pci0:0:1:0:	class=0x060400 card=0x50001458 chip=0x19018086 rev=0x03 hdr=0x01
    vendor     = 'Intel Corporation'
    device     = '6th-10th Gen Core Processor PCIe Controller (x16)'
    class      = bridge
    subclass   = PCI-PCI
    cap 0d[88] = PCI Bridge card=0x50001458
    cap 01[80] = powerspec 3  supports D0 D3  current D0
    cap 05[90] = MSI supports 1 message 
    cap 10[a0] = PCI-Express 2 root port max data 128(256)
                 link x16(x16) speed 2.5(8.0) ASPM disabled(L0s/L1)
                 slot 1 power limit 75000 mW
    ecap 0002[100] = VC 1 max VC0
    ecap 0005[140] = Root Complex Link Declaration 1
    ecap 0019[d94] = PCIe Sec 1 lane errors 0

none0@pci0:0:18:0:	class=0x118000 card=0x88881458 chip=0x06f98086 rev=0x00 hdr=0x00
    vendor     = 'Intel Corporation'
    device     = 'Comet Lake PCH Thermal Controller'
    class      = dasp
    bar   [10] = type Memory, range 64, base 0x4223d000, size 4096, enabled
    cap 01[50] = powerspec 3  supports D0 D3  current D0
    cap 05[80] = MSI supports 1 message 

xhci1@pci0:0:20:0:	class=0x0c0330 card=0x50071458 chip=0x06ed8086 rev=0x00 hdr=0x00
    vendor     = 'Intel Corporation'
    device     = 'Comet Lake USB 3.1 xHCI Host Controller'
    class      = serial bus
    subclass   = USB
    bar   [10] = type Memory, range 64, base 0x42220000, size 65536, enabled
    cap 01[70] = powerspec 2  supports D0 D3  current D0
    cap 05[80] = MSI supports 8 messages, 64 bit enabled with 1 message
    cap 09[90] = vendor (length 20) Intel cap 15 version 0

none1@pci0:0:20:2:	class=0x050000 card=0x72708086 chip=0x06ef8086 rev=0x00 hdr=0x00
    vendor     = 'Intel Corporation'
    device     = 'Comet Lake PCH Shared SRAM'
    class      = memory
    subclass   = RAM
    bar   [10] = type Memory, range 64, base 0x42236000, size 8192, enabled
    bar   [18] = type Memory, range 64, base 0x4223c000, size 4096, enabled
    cap 01[80] = powerspec 3  supports D0 D3  current D0

none2@pci0:0:22:0:	class=0x078000 card=0x1c3a1458 chip=0x06e08086 rev=0x00 hdr=0x00
    vendor     = 'Intel Corporation'
    device     = 'Comet Lake HECI Controller'
    class      = simple comms
    bar   [10] = type Memory, range 64, base 0x4223b000, size 4096, enabled
    cap 01[50] = powerspec 3  supports D0 D3  current D0
    cap 05[8c] = MSI supports 1 message, 64 bit 
    cap 09[a4] = vendor (length 20) Intel cap 15 version 0

ahci0@pci0:0:23:0:	class=0x010400 card=0xb0051458 chip=0x28228086 rev=0x00 hdr=0x00
    vendor     = 'Intel Corporation'
    device     = 'SATA Controller [RAID mode]'
    class      = mass storage
    subclass   = RAID
    bar   [10] = type Memory, range 32, base 0x42234000, size 8192, enabled
    bar   [14] = type Memory, range 32, base 0x4223a000, size 256, enabled
    bar   [18] = type I/O Port, range 32, base 0x4050, size 8, enabled
    bar   [1c] = type I/O Port, range 32, base 0x4040, size 4, enabled
    bar   [20] = type I/O Port, range 32, base 0x4020, size 32, enabled
    bar   [24] = type Memory, range 32, base 0x42239000, size 2048, enabled
    cap 11[d0] = MSI-X supports 1 message, enabled
                 Table in map 0x10[0x0], PBA in map 0x14[0x0]
    cap 01[70] = powerspec 3  supports D0 D3  current D0
    cap 12[a8] = SATA Index-Data Pair

pcib2@pci0:0:27:0:	class=0x060400 card=0x50011458 chip=0x06c28086 rev=0xf0 hdr=0x01
    vendor     = 'Intel Corporation'
    class      = bridge
    subclass   = PCI-PCI
    cap 10[40] = PCI-Express 2 root port max data 128(256) ARI disabled
                 link x0(x1) speed 0.0(8.0) ASPM L0s/L1(L0s/L1)
                 slot 0 power limit 0 mW HotPlug(empty) surprise
    cap 05[80] = MSI supports 1 message 
    cap 0d[90] = PCI Bridge card=0x50011458
    cap 01[a0] = powerspec 3  supports D0 D3  current D0

pcib3@pci0:0:27:4:	class=0x060400 card=0x50011458 chip=0x06ac8086 rev=0xf0 hdr=0x01
    vendor     = 'Intel Corporation'
    device     = 'Comet Lake PCI Express Root Port'
    class      = bridge
    subclass   = PCI-PCI
    cap 10[40] = PCI-Express 2 root port max data 128(256) ARI disabled
                 link x0(x4) speed 0.0(8.0) ASPM L0s/L1(L0s/L1)
                 slot 0 power limit 0 mW HotPlug(empty) surprise
    cap 05[80] = MSI supports 1 message 
    cap 0d[90] = PCI Bridge card=0x50011458
    cap 01[a0] = powerspec 3  supports D0 D3  current D0

pcib4@pci0:0:28:0:	class=0x060400 card=0x50011458 chip=0x06bc8086 rev=0xf0 hdr=0x01
    vendor     = 'Intel Corporation'
    class      = bridge
    subclass   = PCI-PCI
    cap 10[40] = PCI-Express 2 root port max data 128(256) ARI disabled
                 link x0(x4) speed 0.0(8.0) ASPM L0s/L1(L0s/L1)
                 slot 0 power limit 0 mW HotPlug(empty) surprise
    cap 05[80] = MSI supports 1 message 
    cap 0d[90] = PCI Bridge card=0x50011458
    cap 01[a0] = powerspec 3  supports D0 D3  current D0

pcib5@pci0:0:29:0:	class=0x060400 card=0x50011458 chip=0x06b08086 rev=0xf0 hdr=0x01
    vendor     = 'Intel Corporation'
    device     = 'Comet Lake PCI Express Root Port'
    class      = bridge
    subclass   = PCI-PCI
    cap 10[40] = PCI-Express 2 root port max data 128(256) ARI disabled
                 link x0(x1) speed 0.0(8.0) ASPM L0s/L1(L0s/L1)
                 slot 0 power limit 0 mW HotPlug(empty) surprise
    cap 05[80] = MSI supports 1 message 
    cap 0d[90] = PCI Bridge card=0x50011458
    cap 01[a0] = powerspec 3  supports D0 D3  current D0

pcib6@pci0:0:29:4:	class=0x060400 card=0x50011458 chip=0x06b48086 rev=0xf0 hdr=0x01
    vendor     = 'Intel Corporation'
    class      = bridge
    subclass   = PCI-PCI
    cap 10[40] = PCI-Express 2 root port max data 128(256) ARI disabled
                 link x0(x1) speed 0.0(8.0) ASPM L0s/L1(L0s/L1)
    cap 05[80] = MSI supports 1 message 
    cap 0d[90] = PCI Bridge card=0x50011458
    cap 01[a0] = powerspec 3  supports D0 D3  current D0

isab0@pci0:0:31:0:	class=0x060100 card=0x50011458 chip=0x06848086 rev=0x00 hdr=0x00
    vendor     = 'Intel Corporation'
    class      = bridge
    subclass   = PCI-ISA

hdac1@pci0:0:31:3:	class=0x040300 card=0xa1841458 chip=0x06c88086 rev=0x00 hdr=0x00
    vendor     = 'Intel Corporation'
    device     = 'Comet Lake PCH cAVS'
    class      = multimedia
    subclass   = HDA
    bar   [10] = type Memory, range 64, base 0x42230000, size 16384, enabled
    bar   [20] = type Memory, range 64, base 0x42100000, size 1048576, enabled
    cap 01[50] = powerspec 3  supports D0 D3  current D0
    cap 09[80] = vendor (length 20) Intel cap 15 version 0
    cap 05[60] = MSI supports 1 message, 64 bit enabled with 1 message

none3@pci0:0:31:4:	class=0x0c0500 card=0x50011458 chip=0x06a38086 rev=0x00 hdr=0x00
    vendor     = 'Intel Corporation'
    device     = 'Comet Lake PCH SMBus Controller'
    class      = serial bus
    subclass   = SMBus
    bar   [10] = type Memory, range 64, base 0x42238000, size 256, enabled
    bar   [20] = type I/O Port, range 32, base 0xefa0, size 32, enabled

none4@pci0:0:31:5:	class=0x0c8000 card=0x72708086 chip=0x06a48086 rev=0x00 hdr=0x00
    vendor     = 'Intel Corporation'
    device     = 'Comet Lake PCH SPI Controller'
    class      = serial bus
    bar   [10] = type Memory, range 32, base 0xfe010000, size 4096, enabled

em0@pci0:0:31:6:	class=0x020000 card=0xe0001458 chip=0x0d4d8086 rev=0x00 hdr=0x00
    vendor     = 'Intel Corporation'
    device     = 'Ethernet Connection (11) I219-V'
    class      = network
    subclass   = ethernet
    bar   [10] = type Memory, range 32, base 0x42200000, size 131072, enabled
    cap 01[c8] = powerspec 3  supports D0 D3  current D0
    cap 05[d0] = MSI supports 1 message, 64 bit enabled with 1 message

vgapci0@pci0:1:0:0:	class=0x030000 card=0x40281458 chip=0x218810de rev=0xa1 hdr=0x00
    vendor     = 'NVIDIA Corporation'
    device     = 'TU116 [GeForce GTX 1650]'
    class      = display
    subclass   = VGA
    bar   [10] = type Memory, range 32, base 0x41000000, size 16777216, enabled
    bar   [14] = type Prefetchable Memory, range 64, base 0x50000000, size 268435456, enabled
    bar   [1c] = type Prefetchable Memory, range 64, base 0x60000000, size 33554432, enabled
    bar   [24] = type I/O Port, range 32, base 0x3000, size 128, enabled
    cap 01[60] = powerspec 3  supports D0 D3  current D0
    cap 05[68] = MSI supports 1 message, 64 bit enabled with 1 message
    cap 10[78] = PCI-Express 2 legacy endpoint max data 128(256) FLR RO
                 link x16(x16) speed 2.5(8.0) ASPM disabled(L0s/L1) ClockPM enabled
    ecap 0002[100] = VC 1 max VC0
    ecap 001e[258] = L1 PM Substates 1
    ecap 0004[128] = Power Budgeting 1
    ecap 0001[420] = AER 2 0 fatal 0 non-fatal 0 corrected
    ecap 000b[600] = Vendor 1 ID 1
    ecap 0019[900] = PCIe Sec 1 lane errors 0
    ecap 0015[bb0] = Resizable BAR 1

hdac0@pci0:1:0:1:	class=0x040300 card=0x40281458 chip=0x1aeb10de rev=0xa1 hdr=0x00
    vendor     = 'NVIDIA Corporation'
    device     = 'TU116 High Definition Audio Controller'
    class      = multimedia
    subclass   = HDA
    bar   [10] = type Memory, range 32, base 0x42080000, size 16384, enabled
    cap 01[60] = powerspec 3  supports D0 D3  current D0
    cap 05[68] = MSI supports 1 message, 64 bit enabled with 1 message
    cap 10[78] = PCI-Express 2 endpoint max data 128(256) RO NS
                 link x16(x16) speed 2.5(8.0) ASPM L0s/L1(L0s/L1) ClockPM enabled
    ecap 0001[100] = AER 2 0 fatal 0 non-fatal 1 corrected

xhci0@pci0:1:0:2:	class=0x0c0330 card=0x40281458 chip=0x1aec10de rev=0xa1 hdr=0x00
    vendor     = 'NVIDIA Corporation'
    device     = 'TU116 USB 3.1 Host Controller'
    class      = serial bus
    subclass   = USB
    bar   [10] = type Prefetchable Memory, range 64, base 0x62000000, size 262144, enabled
    bar   [1c] = type Prefetchable Memory, range 64, base 0x62040000, size 65536, enabled
    cap 05[68] = MSI supports 1 message, 64 bit enabled with 1 message
    cap 10[78] = PCI-Express 2 endpoint max data 128(128) RO NS
                 link x16(x16) speed 2.5(8.0) ASPM disabled(L0s/L1) ClockPM disabled
    cap 01[b4] = powerspec 3  supports D0 D3  current D0
    ecap 0001[100] = AER 2 0 fatal 0 non-fatal 1 corrected

none5@pci0:1:0:3:	class=0x0c8000 card=0x40281458 chip=0x1aed10de rev=0xa1 hdr=0x00
    vendor     = 'NVIDIA Corporation'
    device     = 'TU116 USB Type-C UCSI Controller'
    class      = serial bus
    bar   [10] = type Memory, range 32, base 0x42084000, size 4096, enabled
    cap 05[68] = MSI supports 1 message, 64 bit 
    cap 10[78] = PCI-Express 2 endpoint max data 128(128) RO NS
                 link x16(x16) speed 2.5(8.0) ASPM disabled(L0s/L1) ClockPM disabled
    cap 01[b4] = powerspec 3  supports D0 D3  current D0
    ecap 0001[100] = AER 2 0 fatal 0 non-fatal 1 corrected
