hostb0@pci0:0:0:0:	class=0x060000 rev=0x06 hdr=0x00 vendor=0x8086 device=0x0c08 subvendor=0x1734 subdevice=0x11f4
    vendor     = 'Intel Corporation'
    device     = 'Xeon E3-1200 v3 Processor DRAM Controller'
    class      = bridge
    subclass   = HOST-PCI
    cap 09[e0] = vendor (length 12) Intel cap 0 version 1

pcib1@pci0:0:1:0:	class=0x060400 rev=0x06 hdr=0x01 vendor=0x8086 device=0x0c01 subvendor=0x1734 subdevice=0x11f4
    vendor     = 'Intel Corporation'
    device     = 'Xeon E3-1200 v3/4th Gen Core Processor PCI Express x16 Controller'
    class      = bridge
    subclass   = PCI-PCI
    cap 0d[88] = PCI Bridge subvendor=0x1734 subdevice=0x11f4
    cap 01[80] = powerspec 3  supports D0 D3  current D0
    cap 05[90] = MSI supports 1 message 
    cap 10[a0] = PCI-Express 2 root port max data 128(128)
                 max read 128
                 link x0(x8) speed 0.0(8.0) ASPM disabled(L0s/L1)
                 slot 1 power limit 75000 mW
    ecap 0002[100] = VC 1 max VC0
    ecap 0005[140] = Root Complex Link Declaration 1
    ecap 0019[d94] = PCIe Sec 1 lane errors 0

pcib2@pci0:0:1:1:	class=0x060400 rev=0x06 hdr=0x01 vendor=0x8086 device=0x0c05 subvendor=0x1734 subdevice=0x11f4
    vendor     = 'Intel Corporation'
    device     = 'Xeon E3-1200 v3/4th Gen Core Processor PCI Express x8 Controller'
    class      = bridge
    subclass   = PCI-PCI
    cap 0d[88] = PCI Bridge subvendor=0x1734 subdevice=0x11f4
    cap 01[80] = powerspec 3  supports D0 D3  current D0
    cap 05[90] = MSI supports 1 message 
    cap 10[a0] = PCI-Express 2 root port max data 128(128)
                 max read 128
                 link x1(x8) speed 2.5(8.0) ASPM disabled(L0s/L1)
                 slot 2 power limit 75000 mW
    ecap 0002[100] = VC 1 max VC0
    ecap 0005[140] = Root Complex Link Declaration 1
    ecap 0019[d94] = PCIe Sec 1 lane errors 0

xhci0@pci0:0:20:0:	class=0x0c0330 rev=0x05 hdr=0x00 vendor=0x8086 device=0x8c31 subvendor=0x1734 subdevice=0x11f3
    vendor     = 'Intel Corporation'
    device     = '8 Series/C220 Series Chipset Family USB xHCI'
    class      = serial bus
    subclass   = USB
    bar   [10] = type Memory, range 64, base 0xf7c00000, size 65536, enabled
    cap 01[70] = powerspec 2  supports D0 D3  current D0
    cap 05[80] = MSI supports 8 messages, 64 bit enabled with 1 message

ehci0@pci0:0:26:0:	class=0x0c0320 rev=0x05 hdr=0x00 vendor=0x8086 device=0x8c2d subvendor=0x1734 subdevice=0x11f3
    vendor     = 'Intel Corporation'
    device     = '8 Series/C220 Series Chipset Family USB EHCI'
    class      = serial bus
    subclass   = USB
    bar   [10] = type Memory, range 32, base 0xf7c14000, size 1024, enabled
    cap 01[50] = powerspec 2  supports D0 D3  current D0
    cap 0a[58] = EHCI Debug Port at offset 0xa0 in map 0x14
    cap 13[98] = PCI Advanced Features: FLR TP

pcib3@pci0:0:28:0:	class=0x060400 rev=0xd5 hdr=0x01 vendor=0x8086 device=0x8c10 subvendor=0x1734 subdevice=0x11f3
    vendor     = 'Intel Corporation'
    device     = '8 Series/C220 Series Chipset Family PCI Express Root Port'
    class      = bridge
    subclass   = PCI-PCI
    cap 10[40] = PCI-Express 2 root port max data 128(128)
                 max read 128
                 link x1(x1) speed 2.5(5.0) ASPM disabled(L0s/L1)
                 slot 0 power limit 100 mW
    cap 05[80] = MSI supports 1 message 
    cap 0d[90] = PCI Bridge subvendor=0x1734 subdevice=0x11f3
    cap 01[a0] = powerspec 3  supports D0 D3  current D0
    ecap 0001[100] = AER 1 0 fatal 1 non-fatal 0 corrected

pcib4@pci0:0:28:2:	class=0x060400 rev=0xd5 hdr=0x01 vendor=0x8086 device=0x8c14 subvendor=0x1734 subdevice=0x11f3
    vendor     = 'Intel Corporation'
    device     = '8 Series/C220 Series Chipset Family PCI Express Root Port'
    class      = bridge
    subclass   = PCI-PCI
    cap 10[40] = PCI-Express 2 root port max data 128(128)
                 max read 128
                 link x1(x1) speed 2.5(5.0) ASPM disabled(L0s/L1)
                 slot 2 power limit 100 mW
    cap 05[80] = MSI supports 1 message 
    cap 0d[90] = PCI Bridge subvendor=0x1734 subdevice=0x11f3
    cap 01[a0] = powerspec 3  supports D0 D3  current D0
    ecap 0001[100] = AER 1 0 fatal 0 non-fatal 0 corrected

pcib5@pci0:0:28:3:	class=0x060400 rev=0xd5 hdr=0x01 vendor=0x8086 device=0x8c16 subvendor=0x1734 subdevice=0x11f3
    vendor     = 'Intel Corporation'
    device     = '8 Series/C220 Series Chipset Family PCI Express Root Port'
    class      = bridge
    subclass   = PCI-PCI
    cap 10[40] = PCI-Express 2 root port max data 128(128)
                 max read 128
                 link x1(x1) speed 2.5(5.0) ASPM disabled(L0s/L1)
                 slot 3 power limit 100 mW
    cap 05[80] = MSI supports 1 message 
    cap 0d[90] = PCI Bridge subvendor=0x1734 subdevice=0x11f3
    cap 01[a0] = powerspec 3  supports D0 D3  current D0
    ecap 0001[100] = AER 1 0 fatal 0 non-fatal 0 corrected

ehci1@pci0:0:29:0:	class=0x0c0320 rev=0x05 hdr=0x00 vendor=0x8086 device=0x8c26 subvendor=0x1734 subdevice=0x11f3
    vendor     = 'Intel Corporation'
    device     = '8 Series/C220 Series Chipset Family USB EHCI'
    class      = serial bus
    subclass   = USB
    bar   [10] = type Memory, range 32, base 0xf7c13000, size 1024, enabled
    cap 01[50] = powerspec 2  supports D0 D3  current D0
    cap 0a[58] = EHCI Debug Port at offset 0xa0 in map 0x14
    cap 13[98] = PCI Advanced Features: FLR TP

isab0@pci0:0:31:0:	class=0x060100 rev=0x05 hdr=0x00 vendor=0x8086 device=0x8c56 subvendor=0x1734 subdevice=0x11f3
    vendor     = 'Intel Corporation'
    device     = 'C226 Series Chipset Family Server Advanced SKU LPC Controller'
    class      = bridge
    subclass   = PCI-ISA
    cap 09[e0] = vendor (length 12) Intel cap 1 version 0
		 features: AMT, 4 PCI-e x1 slots

ahci0@pci0:0:31:2:	class=0x010601 rev=0x05 hdr=0x00 vendor=0x8086 device=0x8c02 subvendor=0x1734 subdevice=0x11f3
    vendor     = 'Intel Corporation'
    device     = '8 Series/C220 Series Chipset Family 6-port SATA Controller 1 [AHCI mode]'
    class      = mass storage
    subclass   = SATA
    bar   [10] = type I/O Port, range 32, base 0xf070, size 8, enabled
    bar   [14] = type I/O Port, range 32, base 0xf060, size 4, enabled
    bar   [18] = type I/O Port, range 32, base 0xf050, size 8, enabled
    bar   [1c] = type I/O Port, range 32, base 0xf040, size 4, enabled
    bar   [20] = type I/O Port, range 32, base 0xf020, size 32, enabled
    bar   [24] = type Memory, range 32, base 0xf7c12000, size 2048, enabled
    cap 05[80] = MSI supports 1 message enabled with 1 message
    cap 01[70] = powerspec 3  supports D0 D3  current D0
    cap 12[a8] = SATA Index-Data Pair

ichsmb0@pci0:0:31:3:	class=0x0c0500 rev=0x05 hdr=0x00 vendor=0x8086 device=0x8c22 subvendor=0x1734 subdevice=0x11f3
    vendor     = 'Intel Corporation'
    device     = '8 Series/C220 Series Chipset Family SMBus Controller'
    class      = serial bus
    subclass   = SMBus
    bar   [10] = type Memory, range 64, base 0xf7c11000, size 256, enabled
    bar   [20] = type I/O Port, range 32, base 0xf000, size 32, enabled

pchtherm0@pci0:0:31:6:	class=0x118000 rev=0x05 hdr=0x00 vendor=0x8086 device=0x8c24 subvendor=0x1734 subdevice=0x11f3
    vendor     = 'Intel Corporation'
    device     = '8 Series Chipset Family Thermal Management Controller'
    class      = dasp
    bar   [10] = type Memory, range 64, base 0xf7c10000, size 4096, enabled
    cap 01[50] = powerspec 3  supports D0 D3  current D0
    cap 05[80] = MSI supports 1 message 

re0@pci0:2:0:0:	class=0x020000 rev=0x06 hdr=0x00 vendor=0x10ec device=0x8168 subvendor=0x7470 subdevice=0x3468
    vendor     = 'Realtek Semiconductor Co., Ltd.'
    device     = 'RTL8111/8168/8411 PCI Express Gigabit Ethernet Controller'
    class      = network
    subclass   = ethernet
    bar   [10] = type I/O Port, range 32, base 0xe000, size 256, enabled
    bar   [18] = type Memory, range 64, base 0xf7b00000, size 4096, enabled
    bar   [20] = type Prefetchable Memory, range 64, base 0xf6000000, size 16384, enabled
    cap 01[40] = powerspec 3  supports D0 D1 D2 D3  current D0
    cap 05[50] = MSI supports 1 message, 64 bit 
    cap 10[70] = PCI-Express 2 endpoint MSI 1 max data 128(128)
                 max read 4096
                 link x1(x1) speed 2.5(2.5) ASPM disabled(L0s/L1) ClockPM disabled
    cap 11[b0] = MSI-X supports 4 messages, enabled
                 Table in map 0x20[0x0], PBA in map 0x20[0x800]
    cap 03[d0] = VPD
    ecap 0001[100] = AER 1 0 fatal 0 non-fatal 0 corrected
    ecap 0002[140] = VC 1 max VC0
    ecap 0003[160] = Serial 1 68020000684ce000

vgapci0@pci0:3:0:0:	class=0x030000 rev=0x05 hdr=0x00 vendor=0x102b device=0x0522 subvendor=0x1734 subdevice=0x11cc
    vendor     = 'Matrox Electronics Systems Ltd.'
    device     = 'MGA G200e [Pilot] ServerEngines (SEP1)'
    class      = display
    subclass   = VGA
    bar   [10] = type Prefetchable Memory, range 32, base 0xf5000000, size 16777216, enabled
    bar   [14] = type Memory, range 32, base 0xf7830000, size 16384, enabled
    bar   [18] = type Memory, range 32, base 0xf7000000, size 8388608, enabled
    cap 01[dc] = powerspec 2  supports D0 D3  current D0
    cap 10[e4] = PCI-Express 1 legacy endpoint max data 128(256)
                 max read 128
                 link x1(x1) speed 2.5(2.5) ASPM disabled(L0s)
    cap 05[54] = MSI supports 1 message 

none0@pci0:3:0:1:	class=0x0b4000 rev=0x00 hdr=0x00 vendor=0x19a2 device=0x0800 subvendor=0x1734 subdevice=0x11cc
    vendor     = 'Emulex Corporation'
    device     = 'ServerView iRMC HTI'
    class      = processor
    bar   [10] = type Memory, range 32, base 0xf7800000, size 131072, enabled
    bar   [14] = type Memory, range 32, base 0xf7834000, size 256, enabled

igb0@pci0:4:0:0:	class=0x020000 rev=0x03 hdr=0x00 vendor=0x8086 device=0x1533 subvendor=0x1734 subdevice=0x11f1
    vendor     = 'Intel Corporation'
    device     = 'I210 Gigabit Network Connection'
    class      = network
    subclass   = ethernet
    bar   [10] = type Memory, range 32, base 0xf7a00000, size 524288, enabled
    bar   [18] = type I/O Port, range 32, base 0xd000, size 32, enabled
    bar   [1c] = type Memory, range 32, base 0xf7a80000, size 16384, enabled
    cap 01[40] = powerspec 3  supports D0 D3  current D0
    cap 05[50] = MSI supports 1 message, 64 bit, vector masks 
    cap 11[70] = MSI-X supports 5 messages, enabled
                 Table in map 0x1c[0x0], PBA in map 0x1c[0x2000]
    cap 10[a0] = PCI-Express 2 endpoint max data 128(512) FLR NS
                 max read 512
                 link x1(x1) speed 2.5(2.5) ASPM disabled(L0s/L1)
    ecap 0001[100] = AER 2 0 fatal 0 non-fatal 0 corrected
    ecap 0003[140] = Serial 1 901b0effff25a7b8
    ecap 0017[1a0] = TPH Requester 1

igb1@pci0:5:0:0:	class=0x020000 rev=0x03 hdr=0x00 vendor=0x8086 device=0x1533 subvendor=0x1734 subdevice=0x11f1
    vendor     = 'Intel Corporation'
    device     = 'I210 Gigabit Network Connection'
    class      = network
    subclass   = ethernet
    bar   [10] = type Memory, range 32, base 0xf7900000, size 524288, enabled
    bar   [18] = type I/O Port, range 32, base 0xc000, size 32, enabled
    bar   [1c] = type Memory, range 32, base 0xf7980000, size 16384, enabled
    cap 01[40] = powerspec 3  supports D0 D3  current D0
    cap 05[50] = MSI supports 1 message, 64 bit, vector masks 
    cap 11[70] = MSI-X supports 5 messages, enabled
                 Table in map 0x1c[0x0], PBA in map 0x1c[0x2000]
    cap 10[a0] = PCI-Express 2 endpoint max data 128(512) FLR NS
                 max read 512
                 link x1(x1) speed 2.5(2.5) ASPM disabled(L0s/L1)
    ecap 0001[100] = AER 2 0 fatal 0 non-fatal 0 corrected
    ecap 0003[140] = Serial 1 901b0effff25a59a
    ecap 0017[1a0] = TPH Requester 1
