hostb0@pci0:0:0:0:	class=0x060000 rev=0x12 hdr=0x00 vendor=0x8086 device=0x0048 subvendor=0x1028 subdevice=0x02a6
    vendor     = 'Intel Corporation'
    device     = 'Core Processor DRAM Controller'
    class      = bridge
    subclass   = HOST-PCI
    cap 09[e0] = vendor (length 12) Intel cap 0 version 1

ehci0@pci0:0:26:0:	class=0x0c0320 rev=0x05 hdr=0x00 vendor=0x8086 device=0x3b3c subvendor=0x1028 subdevice=0x02a6
    vendor     = 'Intel Corporation'
    device     = '5 Series/3400 Series Chipset USB2 Enhanced Host Controller'
    class      = serial bus
    subclass   = USB
    bar   [10] = type Memory, range 32, base 0xdf8fa000, size 1024, enabled
    cap 01[50] = powerspec 2  supports D0 D3  current D0
    cap 0a[58] = EHCI Debug Port at offset 0xa0 in map 0x14
    cap 13[98] = PCI Advanced Features: FLR TP

pcib1@pci0:0:28:0:	class=0x060400 rev=0x05 hdr=0x01 vendor=0x8086 device=0x3b42 subvendor=0x1028 subdevice=0x02a6
    vendor     = 'Intel Corporation'
    device     = '5 Series/3400 Series Chipset PCI Express Root Port 1'
    class      = bridge
    subclass   = PCI-PCI
    cap 10[40] = PCI-Express 2 root port max data 128(128)
                 max read 128
                 link x0(x4) speed 0.0(2.5) ASPM disabled(L0s/L1)
                 slot 3 power limit 25000 mW
    cap 05[80] = MSI supports 1 message 
    cap 0d[90] = PCI Bridge subvendor=0x1028 subdevice=0x02a6
    cap 01[a0] = powerspec 2  supports D0 D3  current D0

pcib2@pci0:0:28:4:	class=0x060400 rev=0x05 hdr=0x01 vendor=0x8086 device=0x3b4a subvendor=0x1028 subdevice=0x02a6
    vendor     = 'Intel Corporation'
    device     = '5 Series/3400 Series Chipset PCI Express Root Port 5'
    class      = bridge
    subclass   = PCI-PCI
    cap 10[40] = PCI-Express 2 root port max data 128(128)
                 max read 128
                 link x1(x1) speed 2.5(2.5) ASPM disabled(L0s/L1)
    cap 05[80] = MSI supports 1 message 
    cap 0d[90] = PCI Bridge subvendor=0x1028 subdevice=0x02a6
    cap 01[a0] = powerspec 2  supports D0 D3  current D0

pcib3@pci0:0:28:5:	class=0x060400 rev=0x05 hdr=0x01 vendor=0x8086 device=0x3b4c subvendor=0x1028 subdevice=0x02a6
    vendor     = 'Intel Corporation'
    device     = '5 Series/3400 Series Chipset PCI Express Root Port 6'
    class      = bridge
    subclass   = PCI-PCI
    cap 10[40] = PCI-Express 2 root port max data 128(128)
                 max read 128
                 link x1(x1) speed 2.5(2.5) ASPM disabled(L0s/L1)
                 slot 4 power limit 25000 mW
    cap 05[80] = MSI supports 1 message 
    cap 0d[90] = PCI Bridge subvendor=0x1028 subdevice=0x02a6
    cap 01[a0] = powerspec 2  supports D0 D3  current D0

ehci1@pci0:0:29:0:	class=0x0c0320 rev=0x05 hdr=0x00 vendor=0x8086 device=0x3b34 subvendor=0x1028 subdevice=0x02a6
    vendor     = 'Intel Corporation'
    device     = '5 Series/3400 Series Chipset USB2 Enhanced Host Controller'
    class      = serial bus
    subclass   = USB
    bar   [10] = type Memory, range 32, base 0xdf8fc000, size 1024, enabled
    cap 01[50] = powerspec 2  supports D0 D3  current D0
    cap 0a[58] = EHCI Debug Port at offset 0xa0 in map 0x14
    cap 13[98] = PCI Advanced Features: FLR TP

pcib4@pci0:0:30:0:	class=0x060401 rev=0xa5 hdr=0x01 vendor=0x8086 device=0x244e subvendor=0x1028 subdevice=0x02a6
    vendor     = 'Intel Corporation'
    device     = '82801 PCI Bridge'
    class      = bridge
    subclass   = PCI-PCI
    cap 0d[50] = PCI Bridge subvendor=0x1028 subdevice=0x02a6

isab0@pci0:0:31:0:	class=0x060100 rev=0x05 hdr=0x00 vendor=0x8086 device=0x3b14 subvendor=0x1028 subdevice=0x02a6
    vendor     = 'Intel Corporation'
    device     = '3420 Chipset LPC Interface Controller'
    class      = bridge
    subclass   = PCI-ISA
    cap 09[e0] = vendor (length 16) Intel cap 1 version 1

ahci0@pci0:0:31:2:	class=0x010601 rev=0x05 hdr=0x00 vendor=0x8086 device=0x3b22 subvendor=0x1028 subdevice=0x02a6
    vendor     = 'Intel Corporation'
    device     = '5 Series/3400 Series Chipset 6 port SATA AHCI Controller'
    class      = mass storage
    subclass   = SATA
    bar   [10] = type I/O Port, range 32, base 0xfcd0, size 8, enabled
    bar   [14] = type I/O Port, range 32, base 0xfcc8, size 4, enabled
    bar   [18] = type I/O Port, range 32, base 0xfcd8, size 8, enabled
    bar   [1c] = type I/O Port, range 32, base 0xfccc, size 4, enabled
    bar   [20] = type I/O Port, range 32, base 0xfce0, size 32, enabled
    bar   [24] = type Memory, range 32, base 0xdf8fe000, size 2048, enabled
    cap 05[80] = MSI supports 1 message enabled with 1 message
    cap 01[70] = powerspec 3  supports D0 D3  current D0
    cap 12[a8] = SATA Index-Data Pair
    cap 13[b0] = PCI Advanced Features: FLR TP

bge0@pci0:3:0:0:	class=0x020000 rev=0x00 hdr=0x00 vendor=0x14e4 device=0x165a subvendor=0x1028 subdevice=0x02a6
    vendor     = 'Broadcom Inc. and subsidiaries'
    device     = 'NetXtreme BCM5722 Gigabit Ethernet PCI Express'
    class      = network
    subclass   = ethernet
    bar   [10] = type Memory, range 64, base 0xdf9f0000, size 65536, enabled
    cap 01[48] = powerspec 3  supports D0 D3  current D0
    cap 03[50] = VPD
    cap 09[58] = vendor (length 120)
    cap 05[e8] = MSI supports 1 message, 64 bit enabled with 1 message
    cap 10[d0] = PCI-Express 1 endpoint max data 128(128)
                 max read 4096
                 link x1(x1) speed 2.5(2.5) ASPM disabled(L0s)
    ecap 0001[100] = AER 1 0 fatal 0 non-fatal 0 corrected
    ecap 0002[13c] = VC 1 max VC0
    ecap 0003[160] = Serial 1 b8ac6ffffe82c700
    ecap 0004[16c] = Power Budgeting 1

bge1@pci0:4:0:0:	class=0x020000 rev=0x20 hdr=0x00 vendor=0x14e4 device=0x1677 subvendor=0x14e4 subdevice=0x1677
    vendor     = 'Broadcom Inc. and subsidiaries'
    device     = 'NetXtreme BCM5751 Gigabit Ethernet PCI Express'
    class      = network
    subclass   = ethernet
    bar   [10] = type Memory, range 64, base 0xdfaf0000, size 65536, enabled
    cap 01[48] = powerspec 2  supports D0 D3  current D0
    cap 03[50] = VPD
    cap 05[58] = MSI supports 8 messages, 64 bit enabled with 1 message
    cap 10[d0] = PCI-Express 1 endpoint max data 128(128)
                 max read 4096
                 link x1(x1) speed 2.5(2.5) ASPM disabled(L0s/L1)
    ecap 0001[100] = AER 1 0 fatal 0 non-fatal 0 corrected
    ecap 0002[13c] = VC 1 max VC0
    ecap 0003[160] = Serial 1 00116bfffe47c28f
    ecap 0004[16c] = Power Budgeting 1

vgapci0@pci0:5:3:0:	class=0x030000 rev=0x0a hdr=0x00 vendor=0x102b device=0x0532 subvendor=0x1028 subdevice=0x02a6
    vendor     = 'Matrox Electronics Systems Ltd.'
    device     = 'MGA G200eW WPCM450'
    class      = display
    subclass   = VGA
    bar   [10] = type Prefetchable Memory, range 32, base 0xde000000, size 8388608, enabled
    bar   [14] = type Memory, range 32, base 0xdeffc000, size 16384, enabled
    bar   [18] = type Memory, range 32, base 0xdf000000, size 8388608, enabled
    cap 01[dc] = powerspec 1  supports D0 D3  current D0
