hostb0@pci0:0:0:0:	class=0x060000 rev=0x0b hdr=0x00 vendor=0x8086 device=0x5af0 subvendor=0x1849 subdevice=0x5af0
    vendor     = 'Intel Corporation'
    device     = 'Celeron N3350/Pentium N4200/Atom E3900 Series Host Bridge'
    class      = bridge
    subclass   = HOST-PCI

vgapci0@pci0:0:2:0:	class=0x030000 rev=0x0b hdr=0x00 vendor=0x8086 device=0x5a85 subvendor=0x1849 subdevice=0x5a85
    vendor     = 'Intel Corporation'
    device     = 'HD Graphics 500'
    class      = display
    subclass   = VGA
    bar   [10] = type Memory, range 64, base 0x90000000, size 16777216, enabled
    bar   [18] = type Prefetchable Memory, range 64, base 0x80000000, size 268435456, enabled
    bar   [20] = type I/O Port, range 32, base 0xf000, size 64, enabled
    cap 09[40] = vendor (length 12) Intel cap 0 version 1
    cap 10[70] = PCI-Express 2 root endpoint max data 128(128) FLR
                 max read 128
    cap 05[ac] = MSI supports 1 message 
    cap 01[d0] = powerspec 2  supports D0 D3  current D0
    ecap 001b[100] = Process Address Space ID 1
    ecap 000f[200] = ATS 1
    ecap 0013[300] = Page Page Request 1

none0@pci0:0:15:0:	class=0x078000 rev=0x0b hdr=0x00 vendor=0x8086 device=0x5a9a subvendor=0x1849 subdevice=0x5a9a
    vendor     = 'Intel Corporation'
    device     = 'Celeron N3350/Pentium N4200/Atom E3900 Series Trusted Execution Engine'
    class      = simple comms
    bar   [10] = type Memory, range 64, base 0x91817000, size 4096, enabled
    cap 01[50] = powerspec 3  supports D0 D3  current D0
    cap 05[8c] = MSI supports 1 message, 64 bit 
    cap 09[a4] = vendor (length 20) Intel cap 15 version 0

ahci0@pci0:0:18:0:	class=0x010601 rev=0x0b hdr=0x00 vendor=0x8086 device=0x5ae3 subvendor=0x1849 subdevice=0x5ae3
    vendor     = 'Intel Corporation'
    device     = 'Celeron N3350/Pentium N4200/Atom E3900 Series SATA AHCI Controller'
    class      = mass storage
    subclass   = SATA
    bar   [10] = type Memory, range 32, base 0x91810000, size 8192, enabled
    bar   [14] = type Memory, range 32, base 0x91814000, size 256, enabled
    bar   [18] = type I/O Port, range 32, base 0xf090, size 8, enabled
    bar   [1c] = type I/O Port, range 32, base 0xf080, size 4, enabled
    bar   [20] = type I/O Port, range 32, base 0xf060, size 32, enabled
    bar   [24] = type Memory, range 32, base 0x91813000, size 2048, enabled
    cap 05[80] = MSI supports 1 message enabled with 1 message
    cap 01[70] = powerspec 3  supports D0 D3  current D0
    cap 12[a8] = SATA Index-Data Pair

pcib1@pci0:0:19:0:	class=0x060400 rev=0xfb hdr=0x01 vendor=0x8086 device=0x5ad8 subvendor=0x1849 subdevice=0x5ad8
    vendor     = 'Intel Corporation'
    device     = 'Celeron N3350/Pentium N4200/Atom E3900 Series PCI Express Port A'
    class      = bridge
    subclass   = PCI-PCI
    cap 10[40] = PCI-Express 2 root port max data 128(256) ARI disabled
                 max read 128
                 link x1(x1) speed 2.5(5.0)
                 slot 2 power limit 100 mW
    cap 05[80] = MSI supports 1 message 
    cap 0d[90] = PCI Bridge subvendor=0x1849 subdevice=0x5ad8
    cap 01[a0] = powerspec 3  supports D0 D3  current D0
    ecap 0000[100] = unknown 0
    ecap 000d[140] = ACS 1
    ecap 0000[150] = unknown 0
    ecap 001e[200] = L1 PM Substates 1
    ecap 0000[220] = unknown 0

pcib2@pci0:0:19:1:	class=0x060400 rev=0xfb hdr=0x01 vendor=0x8086 device=0x5ad9 subvendor=0x1849 subdevice=0x5ad9
    vendor     = 'Intel Corporation'
    device     = 'Celeron N3350/Pentium N4200/Atom E3900 Series PCI Express Port A'
    class      = bridge
    subclass   = PCI-PCI
    cap 10[40] = PCI-Express 2 root port max data 256(256) ARI disabled
                 max read 128
                 link x1(x1) speed 2.5(5.0)
                 slot 3 power limit 100 mW
    cap 05[80] = MSI supports 1 message 
    cap 0d[90] = PCI Bridge subvendor=0x1849 subdevice=0x5ad9
    cap 01[a0] = powerspec 3  supports D0 D3  current D0
    ecap 0000[100] = unknown 0
    ecap 000d[140] = ACS 1
    ecap 0000[150] = unknown 0
    ecap 001e[200] = L1 PM Substates 1
    ecap 0000[220] = unknown 0

pcib3@pci0:0:19:2:	class=0x060400 rev=0xfb hdr=0x01 vendor=0x8086 device=0x5ada subvendor=0x1849 subdevice=0x5ada
    vendor     = 'Intel Corporation'
    device     = 'Celeron N3350/Pentium N4200/Atom E3900 Series PCI Express Port A'
    class      = bridge
    subclass   = PCI-PCI
    cap 10[40] = PCI-Express 2 root port max data 256(256) ARI disabled
                 max read 128
                 link x0(x1) speed 0.0(5.0)
                 slot 4 power limit 100 mW
    cap 05[80] = MSI supports 1 message 
    cap 0d[90] = PCI Bridge subvendor=0x1849 subdevice=0x5ada
    cap 01[a0] = powerspec 3  supports D0 D3  current D0
    ecap 0000[100] = unknown 0
    ecap 000d[140] = ACS 1
    ecap 0000[150] = unknown 0
    ecap 001e[200] = L1 PM Substates 1
    ecap 0000[220] = unknown 0

pcib4@pci0:0:19:3:	class=0x060400 rev=0xfb hdr=0x01 vendor=0x8086 device=0x5adb subvendor=0x1849 subdevice=0x5adb
    vendor     = 'Intel Corporation'
    device     = 'Celeron N3350/Pentium N4200/Atom E3900 Series PCI Express Port A'
    class      = bridge
    subclass   = PCI-PCI
    cap 10[40] = PCI-Express 2 root port max data 256(256) ARI disabled
                 max read 128
                 link x0(x1) speed 0.0(5.0)
                 slot 5 power limit 100 mW
    cap 05[80] = MSI supports 1 message 
    cap 0d[90] = PCI Bridge subvendor=0x1849 subdevice=0x5adb
    cap 01[a0] = powerspec 3  supports D0 D3  current D0
    ecap 0000[100] = unknown 0
    ecap 000d[140] = ACS 1
    ecap 0000[150] = unknown 0
    ecap 001e[200] = L1 PM Substates 1
    ecap 0000[220] = unknown 0

xhci0@pci0:0:21:0:	class=0x0c0330 rev=0x0b hdr=0x00 vendor=0x8086 device=0x5aa8 subvendor=0x1849 subdevice=0x5aa8
    vendor     = 'Intel Corporation'
    device     = 'Celeron N3350/Pentium N4200/Atom E3900 Series USB xHCI'
    class      = serial bus
    subclass   = USB
    bar   [10] = type Memory, range 64, base 0x91800000, size 65536, enabled
    cap 01[70] = powerspec 2  supports D0 D3  current D0
    cap 05[80] = MSI supports 8 messages, 64 bit enabled with 1 message
    cap 09[90] = vendor (length 20) Intel cap 15 version 0

isab0@pci0:0:31:0:	class=0x060100 rev=0x0b hdr=0x00 vendor=0x8086 device=0x5ae8 subvendor=0x1849 subdevice=0x5ae8
    vendor     = 'Intel Corporation'
    device     = 'Celeron N3350/Pentium N4200/Atom E3900 Series Low Pin Count Interface'
    class      = bridge
    subclass   = PCI-ISA

none1@pci0:0:31:1:	class=0x0c0500 rev=0x0b hdr=0x00 vendor=0x8086 device=0x5ad4 subvendor=0x1849 subdevice=0x5ad4
    vendor     = 'Intel Corporation'
    device     = 'Celeron N3350/Pentium N4200/Atom E3900 Series SMBus Controller'
    class      = serial bus
    subclass   = SMBus
    bar   [10] = type Memory, range 64, base 0x91812000, size 256, enabled
    bar   [20] = type I/O Port, range 32, base 0xf040, size 32, enabled

re0@pci0:1:0:0:	class=0x020000 rev=0x06 hdr=0x00 vendor=0x10ec device=0x8168 subvendor=0x1849 subdevice=0x8168
    vendor     = 'Realtek Semiconductor Co., Ltd.'
    device     = 'RTL8111/8168/8411 PCI Express Gigabit Ethernet Controller'
    class      = network
    subclass   = ethernet
    bar   [10] = type I/O Port, range 32, base 0xe000, size 256, enabled
    bar   [18] = type Memory, range 64, base 0x91704000, size 4096, enabled
    bar   [20] = type Prefetchable Memory, range 64, base 0x91700000, size 16384, enabled
    cap 01[40] = powerspec 3  supports D0 D1 D2 D3  current D0
    cap 05[50] = MSI supports 1 message, 64 bit 
    cap 10[70] = PCI-Express 2 endpoint MSI 1 max data 128(128) RO
                 max read 4096
                 link x1(x1) speed 2.5(2.5) ASPM disabled(L0s/L1) ClockPM disabled
    cap 11[b0] = MSI-X supports 4 messages, enabled
                 Table in map 0x20[0x0], PBA in map 0x20[0x800]
    cap 03[d0] = VPD
    ecap 0001[100] = AER 1 0 fatal 0 non-fatal 1 corrected
    ecap 0002[140] = VC 1 max VC0
    ecap 0003[160] = Serial 1 01000000684ce000

igb0@pci0:2:0:0:	class=0x020000 rev=0x02 hdr=0x00 vendor=0x8086 device=0x10a7 subvendor=0x1d1a subdevice=0x0000
    vendor     = 'Intel Corporation'
    device     = '82575EB Gigabit Network Connection'
    class      = network
    subclass   = ethernet
    bar   [10] = type Memory, range 32, base 0x91620000, size 131072, enabled
    bar   [14] = type Memory, range 32, base 0x91400000, size 2097152, enabled
    bar   [18] = type I/O Port, range 32, base 0xd020, size 32, enabled
    bar   [1c] = type Memory, range 32, base 0x91644000, size 16384, enabled
    cap 01[40] = powerspec 2  supports D0 D3  current D0
    cap 05[50] = MSI supports 1 message, 64 bit 
    cap 11[60] = MSI-X supports 10 messages, enabled
                 Table in map 0x1c[0x0], PBA in map 0x1c[0x2000]
    cap 10[a0] = PCI-Express 2 endpoint max data 256(256) RO NS
                 max read 512
                 link x1(x4) speed 2.5(2.5)
    ecap 0001[100] = AER 1 0 fatal 1 non-fatal 4 corrected
    ecap 0003[140] = Serial 1 2c534affff04d58e

igb1@pci0:2:0:1:	class=0x020000 rev=0x02 hdr=0x00 vendor=0x8086 device=0x10a7 subvendor=0x1d1a subdevice=0x0000
    vendor     = 'Intel Corporation'
    device     = '82575EB Gigabit Network Connection'
    class      = network
    subclass   = ethernet
    bar   [10] = type Memory, range 32, base 0x91600000, size 131072, enabled
    bar   [14] = type Memory, range 32, base 0x91000000, size 2097152, enabled
    bar   [18] = type I/O Port, range 32, base 0xd000, size 32, enabled
    bar   [1c] = type Memory, range 32, base 0x91640000, size 16384, enabled
    cap 01[40] = powerspec 2  supports D0 D3  current D0
    cap 05[50] = MSI supports 1 message, 64 bit 
    cap 11[60] = MSI-X supports 10 messages, enabled
                 Table in map 0x1c[0x0], PBA in map 0x1c[0x2000]
    cap 10[a0] = PCI-Express 2 endpoint max data 256(256) RO NS
                 max read 512
                 link x1(x4) speed 2.5(2.5)
    ecap 0001[100] = AER 1 0 fatal 1 non-fatal 4 corrected
    ecap 0003[140] = Serial 1 2c534affff04d58e
