hostb0@pci0:0:0:0:	class=0x060000 card=0x80868086 chip=0x25c08086 rev=0x12 hdr=0x00
    vendor     = 'Intel Corporation'
    device     = '5000X Chipset Memory Controller Hub'
    class      = bridge
    subclass   = HOST-PCI
    cap 01[50] = powerspec 2  supports D0 D3  current D0
    cap 05[58] = MSI supports 2 messages 
    cap 10[6c] = PCI-Express 1 root port max data 128(256) NS
                 link x4(x4) speed 2.5(2.5) ASPM disabled(L0s)
    ecap 0001[100] = AER 1 0 fatal 0 non-fatal 0 corrected

pcib1@pci0:0:2:0:	class=0x060400 card=0x00000000 chip=0x25e28086 rev=0x12 hdr=0x01
    vendor     = 'Intel Corporation'
    device     = '5000 Series Chipset PCI Express x4 Port 2'
    class      = bridge
    subclass   = PCI-PCI
    cap 01[50] = powerspec 2  supports D0 D3  current D0
    cap 05[58] = MSI supports 2 messages 
    cap 10[6c] = PCI-Express 1 root port max data 128(256) NS
                 link x4(x4) speed 2.5(2.5) ASPM disabled(L0s)
    ecap 0001[100] = AER 1 0 fatal 0 non-fatal 0 corrected

pcib7@pci0:0:3:0:	class=0x060400 card=0x00000000 chip=0x25e38086 rev=0x12 hdr=0x01
    vendor     = 'Intel Corporation'
    device     = '5000 Series Chipset PCI Express x4 Port 3'
    class      = bridge
    subclass   = PCI-PCI
    cap 01[50] = powerspec 2  supports D0 D3  current D0
    cap 05[58] = MSI supports 2 messages 
    cap 10[6c] = PCI-Express 1 root port max data 256(256) NS
                 link x4(x4) speed 2.5(2.5) ASPM disabled(L0s)
    ecap 0001[100] = AER 1 0 fatal 0 non-fatal 0 corrected

pcib8@pci0:0:4:0:	class=0x060400 card=0x00000000 chip=0x25f88086 rev=0x12 hdr=0x01
    vendor     = 'Intel Corporation'
    device     = '5000 Series Chipset PCI Express x8 Port 4-5'
    class      = bridge
    subclass   = PCI-PCI
    cap 01[50] = powerspec 2  supports D0 D3  current D0
    cap 05[58] = MSI supports 2 messages 
    cap 10[6c] = PCI-Express 1 root port max data 128(256) NS
                 link x4(x8) speed 2.5(2.5) ASPM disabled(L0s)
                 slot 1 power limit 25000 mW
    ecap 0001[100] = AER 1 0 fatal 0 non-fatal 0 corrected

pcib9@pci0:0:5:0:	class=0x060400 card=0x00000000 chip=0x25e58086 rev=0x12 hdr=0x01
    vendor     = 'Intel Corporation'
    device     = '5000 Series Chipset PCI Express x4 Port 5'
    class      = bridge
    subclass   = PCI-PCI
    cap 01[50] = powerspec 2  supports D0 D3  current D0
    cap 05[58] = MSI supports 2 messages 
    cap 10[6c] = PCI-Express 1 root port max data 128(256) NS
                 link x0(x4) speed 0.0(2.5) ASPM disabled(L0s)
    ecap 0001[100] = AER 1 0 fatal 0 non-fatal 0 corrected

pcib10@pci0:0:6:0:	class=0x060400 card=0x00000000 chip=0x25f98086 rev=0x12 hdr=0x01
    vendor     = 'Intel Corporation'
    device     = '5000 Series Chipset PCI Express x8 Port 6-7'
    class      = bridge
    subclass   = PCI-PCI
    cap 01[50] = powerspec 2  supports D0 D3  current D0
    cap 05[58] = MSI supports 2 messages 
    cap 10[6c] = PCI-Express 1 root port max data 256(256) NS
                 link x4(x8) speed 2.5(2.5) ASPM disabled(L0s)
                 slot 2 power limit 25000 mW
    ecap 0001[100] = AER 1 0 fatal 0 non-fatal 0 corrected

pcib11@pci0:0:7:0:	class=0x060400 card=0x00000000 chip=0x25e78086 rev=0x12 hdr=0x01
    vendor     = 'Intel Corporation'
    device     = '5000 Series Chipset PCI Express x4 Port 7'
    class      = bridge
    subclass   = PCI-PCI
    cap 01[50] = powerspec 2  supports D0 D3  current D0
    cap 05[58] = MSI supports 2 messages 
    cap 10[6c] = PCI-Express 1 root port max data 128(256) NS
                 link x0(x4) speed 0.0(2.5) ASPM disabled(L0s)
    ecap 0001[100] = AER 1 0 fatal 0 non-fatal 0 corrected

hostb1@pci0:0:16:0:	class=0x060000 card=0x01b21028 chip=0x25f08086 rev=0x12 hdr=0x00
    vendor     = 'Intel Corporation'
    device     = '5000 Series Chipset FSB Registers'
    class      = bridge
    subclass   = HOST-PCI

hostb2@pci0:0:16:1:	class=0x060000 card=0x01b21028 chip=0x25f08086 rev=0x12 hdr=0x00
    vendor     = 'Intel Corporation'
    device     = '5000 Series Chipset FSB Registers'
    class      = bridge
    subclass   = HOST-PCI

hostb3@pci0:0:16:2:	class=0x060000 card=0x01b21028 chip=0x25f08086 rev=0x12 hdr=0x00
    vendor     = 'Intel Corporation'
    device     = '5000 Series Chipset FSB Registers'
    class      = bridge
    subclass   = HOST-PCI

hostb4@pci0:0:17:0:	class=0x060000 card=0x80868086 chip=0x25f18086 rev=0x12 hdr=0x00
    vendor     = 'Intel Corporation'
    device     = '5000 Series Chipset Reserved Registers'
    class      = bridge
    subclass   = HOST-PCI

hostb5@pci0:0:19:0:	class=0x060000 card=0x80868086 chip=0x25f38086 rev=0x12 hdr=0x00
    vendor     = 'Intel Corporation'
    device     = '5000 Series Chipset Reserved Registers'
    class      = bridge
    subclass   = HOST-PCI

hostb6@pci0:0:21:0:	class=0x060000 card=0x80868086 chip=0x25f58086 rev=0x12 hdr=0x00
    vendor     = 'Intel Corporation'
    device     = '5000 Series Chipset FBD Registers'
    class      = bridge
    subclass   = HOST-PCI

hostb7@pci0:0:22:0:	class=0x060000 card=0x80868086 chip=0x25f68086 rev=0x12 hdr=0x00
    vendor     = 'Intel Corporation'
    device     = '5000 Series Chipset FBD Registers'
    class      = bridge
    subclass   = HOST-PCI

pcib12@pci0:0:28:0:	class=0x060400 card=0x01b21028 chip=0x26908086 rev=0x09 hdr=0x01
    vendor     = 'Intel Corporation'
    device     = '631xESB/632xESB/3100 Chipset PCI Express Root Port 1'
    class      = bridge
    subclass   = PCI-PCI
    cap 10[40] = PCI-Express 1 root port max data 128(128)
                 link x4(x4) speed 2.5(2.5) ASPM disabled(L0s/L1)
    cap 05[80] = MSI supports 1 message 
    cap 0d[90] = PCI Bridge card=0x01b21028
    cap 01[a0] = powerspec 2  supports D0 D3  current D0
    ecap 0002[100] = VC 1 max VC1
    ecap 0005[180] = Root Complex Link Declaration 1

uhci0@pci0:0:29:0:	class=0x0c0300 card=0x01b21028 chip=0x26888086 rev=0x09 hdr=0x00
    vendor     = 'Intel Corporation'
    device     = '631xESB/632xESB/3100 Chipset UHCI USB Controller'
    class      = serial bus
    subclass   = USB
    bar   [20] = type I/O Port, range 32, base 0xcce0, size 32, enabled

uhci1@pci0:0:29:1:	class=0x0c0300 card=0x01b21028 chip=0x26898086 rev=0x09 hdr=0x00
    vendor     = 'Intel Corporation'
    device     = '631xESB/632xESB/3100 Chipset UHCI USB Controller'
    class      = serial bus
    subclass   = USB
    bar   [20] = type I/O Port, range 32, base 0xccc0, size 32, enabled

uhci2@pci0:0:29:2:	class=0x0c0300 card=0x01b21028 chip=0x268a8086 rev=0x09 hdr=0x00
    vendor     = 'Intel Corporation'
    device     = '631xESB/632xESB/3100 Chipset UHCI USB Controller'
    class      = serial bus
    subclass   = USB
    bar   [20] = type I/O Port, range 32, base 0xcca0, size 32, enabled

uhci3@pci0:0:29:3:	class=0x0c0300 card=0x01b21028 chip=0x268b8086 rev=0x09 hdr=0x00
    vendor     = 'Intel Corporation'
    device     = '631xESB/632xESB/3100 Chipset UHCI USB Controller'
    class      = serial bus
    subclass   = USB
    bar   [20] = type I/O Port, range 32, base 0xcc80, size 32, enabled

ehci0@pci0:0:29:7:	class=0x0c0320 card=0x01b21028 chip=0x268c8086 rev=0x09 hdr=0x00
    vendor     = 'Intel Corporation'
    device     = '631xESB/632xESB/3100 Chipset EHCI USB2 Controller'
    class      = serial bus
    subclass   = USB
    bar   [10] = type Memory, range 32, base 0xde500000, size 1024, enabled
    cap 01[50] = powerspec 2  supports D0 D3  current D0
    cap 0a[58] = EHCI Debug Port at offset 0xa0 in map 0x14

pcib14@pci0:0:30:0:	class=0x060401 card=0x00000000 chip=0x244e8086 rev=0xd9 hdr=0x01
    vendor     = 'Intel Corporation'
    device     = '82801 PCI Bridge'
    class      = bridge
    subclass   = PCI-PCI
    cap 0d[50] = PCI Bridge card=0x00000000

isab0@pci0:0:31:0:	class=0x060100 card=0x00000000 chip=0x26708086 rev=0x09 hdr=0x00
    vendor     = 'Intel Corporation'
    device     = '631xESB/632xESB/3100 Chipset LPC Interface Controller'
    class      = bridge
    subclass   = PCI-ISA

atapci0@pci0:0:31:1:	class=0x01018a card=0x01b21028 chip=0x269e8086 rev=0x09 hdr=0x00
    vendor     = 'Intel Corporation'
    device     = '631xESB/632xESB IDE Controller'
    class      = mass storage
    subclass   = ATA
    bar   [20] = type I/O Port, range 32, base 0xfc00, size 16, enabled

pcib2@pci0:4:0:0:	class=0x060400 card=0x00000000 chip=0x35008086 rev=0x01 hdr=0x01
    vendor     = 'Intel Corporation'
    device     = '6311ESB/6321ESB PCI Express Upstream Port'
    class      = bridge
    subclass   = PCI-PCI
    cap 10[44] = PCI-Express 1 upstream port max data 128(256)
                 link x4(x8) speed 2.5(2.5) ASPM disabled(L0s)
    cap 01[70] = powerspec 2  supports D0 D3  current D0
    cap 0d[80] = PCI Bridge card=0x00000000
    ecap 0001[100] = AER 1 0 fatal 1 non-fatal 0 corrected

pcib6@pci0:4:0:3:	class=0x060400 card=0x00000000 chip=0x350c8086 rev=0x01 hdr=0x01
    vendor     = 'Intel Corporation'
    device     = '6311ESB/6321ESB PCI Express to PCI-X Bridge'
    class      = bridge
    subclass   = PCI-PCI
    cap 10[44] = PCI-Express 1 PCI bridge max data 128(256)
                 link x4(x8) speed 2.5(2.5) ASPM disabled(L0s)
    cap 01[6c] = powerspec 2  supports D0 D3  current D0
    cap 0d[80] = PCI Bridge card=0x00000000
    cap 07[d8] = PCI-X bridge 
    ecap 0001[100] = AER 1 0 fatal 1 non-fatal 0 corrected

pcib3@pci0:5:0:0:	class=0x060400 card=0x00000000 chip=0x35108086 rev=0x01 hdr=0x01
    vendor     = 'Intel Corporation'
    device     = '6311ESB/6321ESB PCI Express Downstream Port E1'
    class      = bridge
    subclass   = PCI-PCI
    cap 10[44] = PCI-Express 1 downstream port max data 128(256)
                 link x4(x4) speed 2.5(2.5) ASPM disabled(L0s)
    cap 05[60] = MSI supports 1 message, 64 bit 
    cap 01[70] = powerspec 2  supports D0 D3  current D0
    cap 0d[80] = PCI Bridge card=0x00000000
    ecap 0001[100] = AER 1 0 fatal 0 non-fatal 0 corrected

pcib5@pci0:5:1:0:	class=0x060400 card=0x00000000 chip=0x35148086 rev=0x01 hdr=0x01
    vendor     = 'Intel Corporation'
    device     = '6311ESB/6321ESB PCI Express Downstream Port E2'
    class      = bridge
    subclass   = PCI-PCI
    cap 10[44] = PCI-Express 1 downstream port max data 128(256)
                 link x0(x4) speed 0.0(2.5) ASPM disabled(L0s)
                 slot 3 power limit 25000 mW
    cap 05[60] = MSI supports 1 message, 64 bit 
    cap 01[70] = powerspec 2  supports D0 D3  current D0
    cap 0d[80] = PCI Bridge card=0x00000000
    ecap 0001[100] = AER 1 0 fatal 0 non-fatal 0 corrected

pcib4@pci0:6:0:0:	class=0x060400 card=0x00000000 chip=0x01031166 rev=0xc3 hdr=0x01
    vendor     = 'Broadcom'
    device     = 'EPB PCI-Express to PCI-X Bridge'
    class      = bridge
    subclass   = PCI-PCI
    cap 10[60] = PCI-Express 1 PCI bridge max data 128(128)
                 link x4(x4) speed 2.5(2.5) ASPM disabled(L0s/L1)
    cap 07[90] = PCI-X bridge 
    cap 01[b0] = powerspec 2  supports D0 D3  current D0
    ecap 0001[100] = AER 1 0 fatal 0 non-fatal 0 corrected
    ecap 0004[14c] = Power Budgeting 1
    ecap 0003[160] = Serial 1 002219fffe0b6668

bce0@pci0:7:0:0:	class=0x020000 card=0x01b21028 chip=0x164c14e4 rev=0x12 hdr=0x00
    vendor     = 'Broadcom Inc. and subsidiaries'
    device     = 'NetXtreme II BCM5708 Gigabit Ethernet'
    class      = network
    subclass   = ethernet
    bar   [10] = type Memory, range 64, base 0xd6000000, size 33554432, enabled
    cap 07[40] = PCI-X 64-bit supports 133MHz, 512 burst read, 8 split transactions
    cap 01[48] = powerspec 2  supports D0 D3  current D0
    cap 03[50] = VPD
    cap 05[58] = MSI supports 1 message, 64 bit enabled with 1 message

mfi0@pci0:1:0:0:	class=0x010400 card=0x1f0c1028 chip=0x00601000 rev=0x04 hdr=0x00
    vendor     = 'LSI Logic / Symbios Logic'
    device     = 'MegaRAID SAS 1078'
    class      = mass storage
    subclass   = RAID
    bar   [10] = type Memory, range 64, base 0xde480000, size 262144, enabled
    bar   [18] = type I/O Port, range 32, base 0xec00, size 256, enabled
    bar   [1c] = type Memory, range 64, base 0xde440000, size 262144, enabled
    cap 10[b0] = PCI-Express 1 endpoint max data 256(256) RO NS
                 link x4(x8) speed 2.5(2.5) ASPM disabled(L0s)
    cap 05[c4] = MSI supports 4 messages, 64 bit enabled with 1 message
    cap 11[d4] = MSI-X supports 4 messages
                 Table in map 0x10[0x3e000], PBA in map 0x10[0xfff000]
    cap 01[e0] = powerspec 2  supports D0 D1 D3  current D0
    cap 03[ec] = VPD
    ecap 0004[100] = Power Budgeting 1

bce1@pci0:12:0:0:	class=0x020000 card=0x191714e4 chip=0x163914e4 rev=0x20 hdr=0x00
    vendor     = 'Broadcom Inc. and subsidiaries'
    device     = 'NetXtreme II BCM5709 Gigabit Ethernet'
    class      = network
    subclass   = ethernet
    bar   [10] = type Memory, range 64, base 0xd0000000, size 33554432, enabled
    cap 01[48] = powerspec 3  supports D0 D3  current D0
    cap 03[50] = VPD
    cap 05[58] = MSI supports 16 messages, 64 bit enabled with 1 message
    cap 11[a0] = MSI-X supports 9 messages
                 Table in map 0x10[0xc000], PBA in map 0x10[0xe000]
    cap 10[ac] = PCI-Express 2 endpoint max data 256(512) RO NS
                 link x4(x4) speed 2.5(2.5) ASPM disabled(L0s/L1)
    ecap 0003[100] = Serial 1 001018fffe6999e4
    ecap 0001[110] = AER 1 0 fatal 1 non-fatal 1 corrected
    ecap 0004[150] = Power Budgeting 1
    ecap 0002[160] = VC 1 max VC0

bce2@pci0:12:0:1:	class=0x020000 card=0x191714e4 chip=0x163914e4 rev=0x20 hdr=0x00
    vendor     = 'Broadcom Inc. and subsidiaries'
    device     = 'NetXtreme II BCM5709 Gigabit Ethernet'
    class      = network
    subclass   = ethernet
    bar   [10] = type Memory, range 64, base 0xce000000, size 33554432, enabled
    cap 01[48] = powerspec 3  supports D0 D3  current D0
    cap 03[50] = VPD
    cap 05[58] = MSI supports 16 messages, 64 bit enabled with 1 message
    cap 11[a0] = MSI-X supports 9 messages
                 Table in map 0x10[0xc000], PBA in map 0x10[0xe000]
    cap 10[ac] = PCI-Express 2 endpoint max data 256(512) RO NS
                 link x4(x4) speed 2.5(2.5) ASPM disabled(L0s/L1)
    ecap 0003[100] = Serial 1 001018fffe6999e6
    ecap 0001[110] = AER 1 0 fatal 1 non-fatal 1 corrected
    ecap 0004[150] = Power Budgeting 1
    ecap 0002[160] = VC 1 max VC0

pcib13@pci0:2:0:0:	class=0x060400 card=0x00000000 chip=0x01031166 rev=0xc3 hdr=0x01
    vendor     = 'Broadcom'
    device     = 'EPB PCI-Express to PCI-X Bridge'
    class      = bridge
    subclass   = PCI-PCI
    cap 10[60] = PCI-Express 1 PCI bridge max data 128(128)
                 link x4(x4) speed 2.5(2.5) ASPM disabled(L0s/L1)
    cap 07[90] = PCI-X bridge 
    cap 01[b0] = powerspec 2  supports D0 D3  current D0
    ecap 0001[100] = AER 1 0 fatal 0 non-fatal 0 corrected
    ecap 0004[14c] = Power Budgeting 1
    ecap 0003[160] = Serial 1 002219fffe0b6666

bce3@pci0:3:0:0:	class=0x020000 card=0x01b21028 chip=0x164c14e4 rev=0x12 hdr=0x00
    vendor     = 'Broadcom Inc. and subsidiaries'
    device     = 'NetXtreme II BCM5708 Gigabit Ethernet'
    class      = network
    subclass   = ethernet
    bar   [10] = type Memory, range 64, base 0xda000000, size 33554432, enabled
    cap 07[40] = PCI-X 64-bit supports 133MHz, 512 burst read, 8 split transactions
    cap 01[48] = powerspec 2  supports D0 D3  current D0
    cap 03[50] = VPD
    cap 05[58] = MSI supports 1 message, 64 bit enabled with 1 message

vgapci0@pci0:14:13:0:	class=0x030000 card=0x01b21028 chip=0x515e1002 rev=0x02 hdr=0x00
    vendor     = 'Advanced Micro Devices, Inc. [AMD/ATI]'
    device     = 'ES1000'
    class      = display
    subclass   = VGA
    bar   [10] = type Prefetchable Memory, range 32, base 0xf0000000, size 134217728, enabled
    bar   [14] = type I/O Port, range 32, base 0xdc00, size 256, enabled
    bar   [18] = type Memory, range 32, base 0xde2d0000, size 65536, enabled
    cap 01[50] = powerspec 2  supports D0 D1 D2 D3  current D0
