hostb0@pci0:0:0:0:	class=0x060000 card=0x020d1028 chip=0x29c08086 rev=0x02 hdr=0x00
    vendor     = 'Intel Corporation'
    device     = '82G33/G31/P35/P31 Express DRAM Controller'
    class      = bridge
    subclass   = HOST-PCI
    cap 09[e0] = vendor (length 11) Intel cap 0 version 1

pcib1@pci0:0:1:0:	class=0x060400 card=0x020d1028 chip=0x29c18086 rev=0x02 hdr=0x01
    vendor     = 'Intel Corporation'
    device     = '82G33/G31/P35/P31 Express PCI Express Root Port'
    class      = bridge
    subclass   = PCI-PCI
    cap 0d[88] = PCI Bridge card=0x020d1028
    cap 01[80] = powerspec 3  supports D0 D3  current D0
    cap 05[90] = MSI supports 1 message 
    cap 10[a0] = PCI-Express 1 root port max data 128(128)
                 link x0(x16) speed 0.0(2.5) ASPM disabled(L0s/L1)
                 slot 0 power limit 0 mW
    ecap 0002[100] = VC 1 max VC0
    ecap 0005[140] = Root Complex Link Declaration 1

vgapci0@pci0:0:2:0:	class=0x030000 card=0x020d1028 chip=0x29c28086 rev=0x02 hdr=0x00
    vendor     = 'Intel Corporation'
    device     = '82G33/G31 Express Integrated Graphics Controller'
    class      = display
    subclass   = VGA
    bar   [10] = type Memory, range 32, base 0xfdf00000, size 524288, enabled
    bar   [14] = type I/O Port, range 32, base 0xff00, size 8, enabled
    bar   [18] = type Prefetchable Memory, range 32, base 0xd0000000, size 268435456, enabled
    bar   [1c] = type Memory, range 32, base 0xfdb00000, size 1048576, enabled
    cap 05[90] = MSI supports 1 message 
    cap 01[d0] = powerspec 2  supports D0 D3  current D0

em0@pci0:0:25:0:	class=0x020000 card=0x020d1028 chip=0x10c08086 rev=0x02 hdr=0x00
    vendor     = 'Intel Corporation'
    device     = '82562V-2 10/100 Network Connection'
    class      = network
    subclass   = ethernet
    bar   [10] = type Memory, range 32, base 0xfdfc0000, size 131072, enabled
    bar   [14] = type Memory, range 32, base 0xfdfff000, size 4096, enabled
    bar   [18] = type I/O Port, range 32, base 0xfe00, size 32, enabled
    cap 01[c8] = powerspec 2  supports D0 D3  current D0
    cap 05[d0] = MSI supports 1 message, 64 bit enabled with 1 message
    cap 09[e0] = vendor (length 6) Intel cap 2 version 0

uhci0@pci0:0:26:0:	class=0x0c0300 card=0x020d1028 chip=0x29378086 rev=0x02 hdr=0x00
    vendor     = 'Intel Corporation'
    device     = '82801I (ICH9 Family) USB UHCI Controller'
    class      = serial bus
    subclass   = USB
    bar   [20] = type I/O Port, range 32, base 0xfd00, size 32, enabled
    cap 09[50] = vendor (length 6) Intel cap 2 version 0

uhci1@pci0:0:26:1:	class=0x0c0300 card=0x020d1028 chip=0x29388086 rev=0x02 hdr=0x00
    vendor     = 'Intel Corporation'
    device     = '82801I (ICH9 Family) USB UHCI Controller'
    class      = serial bus
    subclass   = USB
    bar   [20] = type I/O Port, range 32, base 0xfc00, size 32, enabled
    cap 09[50] = vendor (length 6) Intel cap 2 version 0

uhci2@pci0:0:26:2:	class=0x0c0300 card=0x020d1028 chip=0x29398086 rev=0x02 hdr=0x00
    vendor     = 'Intel Corporation'
    device     = '82801I (ICH9 Family) USB UHCI Controller'
    class      = serial bus
    subclass   = USB
    bar   [20] = type I/O Port, range 32, base 0xfb00, size 32, enabled
    cap 09[50] = vendor (length 6) Intel cap 2 version 0

ehci0@pci0:0:26:7:	class=0x0c0320 card=0x020d1028 chip=0x293c8086 rev=0x02 hdr=0x00
    vendor     = 'Intel Corporation'
    device     = '82801I (ICH9 Family) USB2 EHCI Controller'
    class      = serial bus
    subclass   = USB
    bar   [10] = type Memory, range 32, base 0xfdffe000, size 1024, enabled
    cap 01[50] = powerspec 2  supports D0 D3  current D0
    cap 0a[58] = EHCI Debug Port at offset 0xa0 in map 0x14
    cap 09[98] = vendor (length 6) Intel cap 2 version 0

hdac0@pci0:0:27:0:	class=0x040300 card=0x020d1028 chip=0x293e8086 rev=0x02 hdr=0x00
    vendor     = 'Intel Corporation'
    device     = '82801I (ICH9 Family) HD Audio Controller'
    class      = multimedia
    subclass   = HDA
    bar   [10] = type Memory, range 64, base 0xfdff4000, size 16384, enabled
    cap 01[50] = powerspec 2  supports D0 D3  current D0
    cap 05[60] = MSI supports 1 message, 64 bit enabled with 1 message
    cap 10[70] = PCI-Express 1 root endpoint max data 128(128) FLR NS
    ecap 0002[100] = VC 1 max VC1
    ecap 0005[130] = Root Complex Link Declaration 1

uhci3@pci0:0:29:0:	class=0x0c0300 card=0x020d1028 chip=0x29348086 rev=0x02 hdr=0x00
    vendor     = 'Intel Corporation'
    device     = '82801I (ICH9 Family) USB UHCI Controller'
    class      = serial bus
    subclass   = USB
    bar   [20] = type I/O Port, range 32, base 0xfa00, size 32, enabled
    cap 09[50] = vendor (length 6) Intel cap 2 version 0

uhci4@pci0:0:29:1:	class=0x0c0300 card=0x020d1028 chip=0x29358086 rev=0x02 hdr=0x00
    vendor     = 'Intel Corporation'
    device     = '82801I (ICH9 Family) USB UHCI Controller'
    class      = serial bus
    subclass   = USB
    bar   [20] = type I/O Port, range 32, base 0xf900, size 32, enabled
    cap 09[50] = vendor (length 6) Intel cap 2 version 0

uhci5@pci0:0:29:2:	class=0x0c0300 card=0x020d1028 chip=0x29368086 rev=0x02 hdr=0x00
    vendor     = 'Intel Corporation'
    device     = '82801I (ICH9 Family) USB UHCI Controller'
    class      = serial bus
    subclass   = USB
    bar   [20] = type I/O Port, range 32, base 0xf800, size 32, enabled
    cap 09[50] = vendor (length 6) Intel cap 2 version 0

ehci1@pci0:0:29:7:	class=0x0c0320 card=0x020d1028 chip=0x293a8086 rev=0x02 hdr=0x00
    vendor     = 'Intel Corporation'
    device     = '82801I (ICH9 Family) USB2 EHCI Controller'
    class      = serial bus
    subclass   = USB
    bar   [10] = type Memory, range 32, base 0xfdffd000, size 1024, enabled
    cap 01[50] = powerspec 2  supports D0 D3  current D0
    cap 0a[58] = EHCI Debug Port at offset 0xa0 in map 0x14
    cap 09[98] = vendor (length 6) Intel cap 2 version 0

pcib2@pci0:0:30:0:	class=0x060401 card=0x020d1028 chip=0x244e8086 rev=0x92 hdr=0x01
    vendor     = 'Intel Corporation'
    device     = '82801 PCI Bridge'
    class      = bridge
    subclass   = PCI-PCI
    cap 0d[50] = PCI Bridge card=0x020d1028

isab0@pci0:0:31:0:	class=0x060100 card=0x020d1028 chip=0x29168086 rev=0x02 hdr=0x00
    vendor     = 'Intel Corporation'
    device     = '82801IR (ICH9R) LPC Interface Controller'
    class      = bridge
    subclass   = PCI-ISA
    cap 09[e0] = vendor (length 12) Intel cap 1 version 0
		 features: SATA RAID-5, 4 PCI-e x1 slots

atapci0@pci0:0:31:2:	class=0x01018f card=0x020d1028 chip=0x29208086 rev=0x02 hdr=0x00
    vendor     = 'Intel Corporation'
    device     = '82801IR/IO/IH (ICH9R/DO/DH) 4 port SATA Controller [IDE mode]'
    class      = mass storage
    subclass   = ATA
    bar   [10] = type I/O Port, range 32, base 0xf700, size 8, enabled
    bar   [14] = type I/O Port, range 32, base 0xf600, size 4, enabled
    bar   [18] = type I/O Port, range 32, base 0xf500, size 8, enabled
    bar   [1c] = type I/O Port, range 32, base 0xf400, size 4, enabled
    bar   [20] = type I/O Port, range 32, base 0xf300, size 16, enabled
    bar   [24] = type I/O Port, range 32, base 0xf200, size 16, enabled
    cap 01[70] = powerspec 3  supports D0 D3  current D0
    cap 09[b0] = vendor (length 6) Intel cap 2 version 0

none0@pci0:0:31:3:	class=0x0c0500 card=0x020d1028 chip=0x29308086 rev=0x02 hdr=0x00
    vendor     = 'Intel Corporation'
    device     = '82801I (ICH9 Family) SMBus Controller'
    class      = serial bus
    subclass   = SMBus
    bar   [10] = type Memory, range 64, base 0xfdffc000, size 256, enabled
    bar   [20] = type I/O Port, range 32, base 0x500, size 32, enabled

atapci1@pci0:0:31:5:	class=0x010185 card=0x020d1028 chip=0x29268086 rev=0x02 hdr=0x00
    vendor     = 'Intel Corporation'
    device     = '82801I (ICH9 Family) 2 port SATA Controller [IDE mode]'
    class      = mass storage
    subclass   = ATA
    bar   [10] = type I/O Port, range 32, base 0xf000, size 8, enabled
    bar   [14] = type I/O Port, range 32, base 0xef00, size 4, enabled
    bar   [18] = type I/O Port, range 32, base 0xee00, size 8, enabled
    bar   [1c] = type I/O Port, range 32, base 0xed00, size 4, enabled
    bar   [20] = type I/O Port, range 32, base 0xec00, size 16, enabled
    bar   [24] = type I/O Port, range 32, base 0xeb00, size 16, enabled
    cap 01[70] = powerspec 3  supports D0 D3  current D0
    cap 09[b0] = vendor (length 6) Intel cap 2 version 0

ahc0@pci0:2:0:0:	class=0x010000 card=0x78509004 chip=0x50789004 rev=0x03 hdr=0x00
    vendor     = 'Adaptec'
    device     = 'AIC-7850T/7856T [AVA-2902/4/6 / AHA-2910]'
    class      = mass storage
    subclass   = SCSI
    bar   [10] = type I/O Port, range 32, base 0xdc00, size 256, enabled
    bar   [14] = type Memory, range 32, base 0xfddff000, size 4096, enabled
    cap 01[dc] = powerspec 1  supports D0 D3  current D0

fwohci0@pci0:2:1:0:	class=0x0c0010 card=0x30441106 chip=0x30441106 rev=0xc0 hdr=0x00
    vendor     = 'VIA Technologies, Inc.'
    device     = 'VT6306/7/8 [Fire II(M)] IEEE 1394 OHCI Controller'
    class      = serial bus
    subclass   = FireWire
    bar   [10] = type Memory, range 32, base 0xfddfe000, size 2048, enabled
    bar   [14] = type I/O Port, range 32, base 0xdf00, size 128, enabled
    cap 01[50] = powerspec 2  supports D0 D2 D3  current D0
