hostb0@pci0:0:0:0:	class=0x060000 card=0x88dd103c chip=0x16301022 rev=0x00 hdr=0x00
    vendor     = 'Advanced Micro Devices, Inc. [AMD]'
    device     = 'Renoir/Cezanne Root Complex'
    class      = bridge
    subclass   = HOST-PCI

none0@pci0:0:0:2:	class=0x080600 card=0x88dd103c chip=0x16311022 rev=0x00 hdr=0x00
    vendor     = 'Advanced Micro Devices, Inc. [AMD]'
    device     = 'Renoir/Cezanne IOMMU'
    class      = base peripheral
    subclass   = IOMMU
    cap 0f[40] = unknown
    cap 05[64] = MSI supports 4 messages, 64 bit 
    cap 08[74] = HT MSI fixed address window enabled at 0xfee00000

hostb1@pci0:0:1:0:	class=0x060000 card=0x00000000 chip=0x16321022 rev=0x00 hdr=0x00
    vendor     = 'Advanced Micro Devices, Inc. [AMD]'
    device     = 'Renoir PCIe Dummy Host Bridge'
    class      = bridge
    subclass   = HOST-PCI

pcib1@pci0:0:1:1:	class=0x060400 card=0x14531022 chip=0x16331022 rev=0x00 hdr=0x01
    vendor     = 'Advanced Micro Devices, Inc. [AMD]'
    device     = 'Renoir PCIe GPP Bridge'
    class      = bridge
    subclass   = PCI-PCI
    cap 01[50] = powerspec 3  supports D0 D3  current D0
    cap 10[58] = PCI-Express 2 root port max data 256(512) RO NS ARI disabled
                 link x8(x8) speed 8.0(8.0) ASPM L1(L1)
                 slot 0 power limit 75000 mW
    cap 05[a0] = MSI supports 1 message, 64 bit 
    cap 0d[c0] = PCI Bridge card=0x14531022
    cap 08[c8] = HT MSI fixed address window enabled at 0xfee00000
    ecap 000b[100] = Vendor 1 ID 1
    ecap 0019[270] = PCIe Sec 1 lane errors 0
    ecap 000d[2a0] = ACS 1

pcib2@pci0:0:1:2:	class=0x060400 card=0x14531022 chip=0x16341022 rev=0x00 hdr=0x01
    vendor     = 'Advanced Micro Devices, Inc. [AMD]'
    device     = 'Renoir/Cezanne PCIe GPP Bridge'
    class      = bridge
    subclass   = PCI-PCI
    cap 01[50] = powerspec 3  supports D0 D3  current D0
    cap 10[58] = PCI-Express 2 root port max data 128(512) RO NS ARI disabled
                 link x1(x1) speed 2.5(8.0) ASPM L1(L1)
                 slot 0 power limit 75000 mW
    cap 05[a0] = MSI supports 1 message, 64 bit 
    cap 0d[c0] = PCI Bridge card=0x14531022
    cap 08[c8] = HT MSI fixed address window enabled at 0xfee00000
    ecap 000b[100] = Vendor 1 ID 1
    ecap 0019[270] = PCIe Sec 1 lane errors 0
    ecap 000d[2a0] = ACS 1
    ecap 001e[370] = L1 PM Substates 1

hostb2@pci0:0:2:0:	class=0x060000 card=0x00000000 chip=0x16321022 rev=0x00 hdr=0x00
    vendor     = 'Advanced Micro Devices, Inc. [AMD]'
    device     = 'Renoir PCIe Dummy Host Bridge'
    class      = bridge
    subclass   = HOST-PCI

pcib3@pci0:0:2:1:	class=0x060400 card=0x14531022 chip=0x16341022 rev=0x00 hdr=0x01
    vendor     = 'Advanced Micro Devices, Inc. [AMD]'
    device     = 'Renoir/Cezanne PCIe GPP Bridge'
    class      = bridge
    subclass   = PCI-PCI
    cap 01[50] = powerspec 3  supports D0 D3  current D0
    cap 10[58] = PCI-Express 2 root port max data 256(512) RO NS ARI disabled
                 link x1(x1) speed 2.5(8.0) ASPM L1(L1)
                 slot 0 power limit 75000 mW
    cap 05[a0] = MSI supports 1 message, 64 bit 
    cap 0d[c0] = PCI Bridge card=0x14531022
    cap 08[c8] = HT MSI fixed address window enabled at 0xfee00000
    ecap 000b[100] = Vendor 1 ID 1
    ecap 0019[270] = PCIe Sec 1 lane errors 0
    ecap 000d[2a0] = ACS 1
    ecap 001e[370] = L1 PM Substates 1

pcib4@pci0:0:2:4:	class=0x060400 card=0x14531022 chip=0x16341022 rev=0x00 hdr=0x01
    vendor     = 'Advanced Micro Devices, Inc. [AMD]'
    device     = 'Renoir/Cezanne PCIe GPP Bridge'
    class      = bridge
    subclass   = PCI-PCI
    cap 01[50] = powerspec 3  supports D0 D3  current D0
    cap 10[58] = PCI-Express 2 root port max data 128(512) RO NS ARI disabled
                 link x4(x4) speed 5.0(8.0) ASPM L1(L1)
                 slot 0 power limit 75000 mW
    cap 05[a0] = MSI supports 1 message, 64 bit 
    cap 0d[c0] = PCI Bridge card=0x14531022
    cap 08[c8] = HT MSI fixed address window enabled at 0xfee00000
    ecap 000b[100] = Vendor 1 ID 1
    ecap 0019[270] = PCIe Sec 1 lane errors 0
    ecap 000d[2a0] = ACS 1
    ecap 001e[370] = L1 PM Substates 1

hostb3@pci0:0:8:0:	class=0x060000 card=0x00000000 chip=0x16321022 rev=0x00 hdr=0x00
    vendor     = 'Advanced Micro Devices, Inc. [AMD]'
    device     = 'Renoir PCIe Dummy Host Bridge'
    class      = bridge
    subclass   = HOST-PCI

pcib5@pci0:0:8:1:	class=0x060400 card=0x16351022 chip=0x16351022 rev=0x00 hdr=0x01
    vendor     = 'Advanced Micro Devices, Inc. [AMD]'
    device     = 'Renoir Internal PCIe GPP Bridge to Bus'
    class      = bridge
    subclass   = PCI-PCI
    cap 01[50] = powerspec 3  supports D0 D3  current D0
    cap 10[58] = PCI-Express 2 root port max data 256(512) RO NS
                 link x16(x16) speed 8.0(8.0) ASPM disabled(L0s/L1)
    cap 05[a0] = MSI supports 1 message, 64 bit 
    cap 0d[c0] = PCI Bridge card=0x16351022
    ecap 000b[100] = Vendor 1 ID 1
    ecap 0019[270] = PCIe Sec 1 lane errors 0
    ecap 0025[400] = Data Link Feature 1
    ecap 0026[410] = Physical Layer 16.0 GT/s 1
    ecap 0027[440] = Lane Margining at Receiver 1

pcib6@pci0:0:8:2:	class=0x060400 card=0x16351022 chip=0x16351022 rev=0x00 hdr=0x01
    vendor     = 'Advanced Micro Devices, Inc. [AMD]'
    device     = 'Renoir Internal PCIe GPP Bridge to Bus'
    class      = bridge
    subclass   = PCI-PCI
    cap 01[50] = powerspec 3  supports D0 D3  current D0
    cap 10[58] = PCI-Express 2 root port max data 256(512) RO NS
                 link x16(x16) speed 8.0(8.0) ASPM disabled(L0s/L1)
    cap 05[a0] = MSI supports 1 message, 64 bit 
    cap 0d[c0] = PCI Bridge card=0x16351022
    ecap 000b[100] = Vendor 1 ID 1
    ecap 0019[270] = PCIe Sec 1 lane errors 0
    ecap 0025[400] = Data Link Feature 1
    ecap 0026[410] = Physical Layer 16.0 GT/s 1
    ecap 0027[440] = Lane Margining at Receiver 1

none1@pci0:0:20:0:	class=0x0c0500 card=0x790b1022 chip=0x790b1022 rev=0x51 hdr=0x00
    vendor     = 'Advanced Micro Devices, Inc. [AMD]'
    device     = 'FCH SMBus Controller'
    class      = serial bus
    subclass   = SMBus

isab0@pci0:0:20:3:	class=0x060100 card=0x790e1022 chip=0x790e1022 rev=0x51 hdr=0x00
    vendor     = 'Advanced Micro Devices, Inc. [AMD]'
    device     = 'FCH LPC Bridge'
    class      = bridge
    subclass   = PCI-ISA

hostb4@pci0:0:24:0:	class=0x060000 card=0x00000000 chip=0x166a1022 rev=0x00 hdr=0x00
    vendor     = 'Advanced Micro Devices, Inc. [AMD]'
    class      = bridge
    subclass   = HOST-PCI

hostb5@pci0:0:24:1:	class=0x060000 card=0x00000000 chip=0x166b1022 rev=0x00 hdr=0x00
    vendor     = 'Advanced Micro Devices, Inc. [AMD]'
    class      = bridge
    subclass   = HOST-PCI

hostb6@pci0:0:24:2:	class=0x060000 card=0x00000000 chip=0x166c1022 rev=0x00 hdr=0x00
    vendor     = 'Advanced Micro Devices, Inc. [AMD]'
    class      = bridge
    subclass   = HOST-PCI

hostb7@pci0:0:24:3:	class=0x060000 card=0x00000000 chip=0x166d1022 rev=0x00 hdr=0x00
    vendor     = 'Advanced Micro Devices, Inc. [AMD]'
    class      = bridge
    subclass   = HOST-PCI

hostb8@pci0:0:24:4:	class=0x060000 card=0x00000000 chip=0x166e1022 rev=0x00 hdr=0x00
    vendor     = 'Advanced Micro Devices, Inc. [AMD]'
    class      = bridge
    subclass   = HOST-PCI

hostb9@pci0:0:24:5:	class=0x060000 card=0x00000000 chip=0x166f1022 rev=0x00 hdr=0x00
    vendor     = 'Advanced Micro Devices, Inc. [AMD]'
    class      = bridge
    subclass   = HOST-PCI

hostb10@pci0:0:24:6:	class=0x060000 card=0x00000000 chip=0x16701022 rev=0x00 hdr=0x00
    vendor     = 'Advanced Micro Devices, Inc. [AMD]'
    class      = bridge
    subclass   = HOST-PCI

hostb11@pci0:0:24:7:	class=0x060000 card=0x00000000 chip=0x16711022 rev=0x00 hdr=0x00
    vendor     = 'Advanced Micro Devices, Inc. [AMD]'
    class      = bridge
    subclass   = HOST-PCI

vgapci0@pci0:1:0:0:	class=0x030000 card=0x88dd103c chip=0x1f9910de rev=0xa1 hdr=0x00
    vendor     = 'NVIDIA Corporation'
    device     = 'TU117M'
    class      = display
    subclass   = VGA
    bar   [10] = type Memory, range 32, base 0xfb000000, size 16777216, enabled
    bar   [14] = type Prefetchable Memory, range 64, base 0xffe0000000, size 268435456, enabled
    bar   [1c] = type Prefetchable Memory, range 64, base 0xfff0000000, size 33554432, enabled
    bar   [24] = type I/O Port, range 32, base 0xf000, size 128, enabled
    cap 01[60] = powerspec 3  supports D0 D3  current D0
    cap 05[68] = MSI supports 1 message, 64 bit 
    cap 10[78] = PCI-Express 2 legacy endpoint max data 256(256) FLR RO NS
                 link x8(x16) speed 8.0(8.0) ASPM L1(L0s/L1) ClockPM enabled
    ecap 0002[100] = VC 1 max VC0
    ecap 0018[250] = LTR 1
    ecap 001e[258] = L1 PM Substates 1
    ecap 0004[128] = Power Budgeting 1
    ecap 0001[420] = AER 2 0 fatal 0 non-fatal 1 corrected
    ecap 000b[600] = Vendor 1 ID 1
    ecap 0019[900] = PCIe Sec 1 lane errors 0
    ecap 0015[bb0] = Resizable BAR 1

hdac0@pci0:1:0:1:	class=0x040300 card=0x88dd103c chip=0x10fa10de rev=0xa1 hdr=0x00
    vendor     = 'NVIDIA Corporation'
    class      = multimedia
    subclass   = HDA
    bar   [10] = type Memory, range 32, base 0xfc080000, size 16384, enabled
    cap 01[60] = powerspec 3  supports D0 D3  current D0
    cap 05[68] = MSI supports 1 message, 64 bit enabled with 1 message
    cap 10[78] = PCI-Express 2 endpoint max data 256(256) RO NS
                 link x8(x16) speed 8.0(8.0) ASPM L1(L0s/L1) ClockPM enabled
    ecap 0001[100] = AER 2 0 fatal 0 non-fatal 1 corrected

re0@pci0:2:0:0:	class=0x020000 card=0x88dd103c chip=0x816810ec rev=0x16 hdr=0x00
    vendor     = 'Realtek Semiconductor Co., Ltd.'
    device     = 'RTL8111/8168/8411 PCI Express Gigabit Ethernet Controller'
    class      = network
    subclass   = ethernet
    bar   [10] = type I/O Port, range 32, base 0xe000, size 256, enabled
    bar   [18] = type Memory, range 64, base 0xfc904000, size 4096, enabled
    bar   [20] = type Memory, range 64, base 0xfc900000, size 16384, enabled
    cap 01[40] = powerspec 3  supports D0 D1 D2 D3  current D0
    cap 05[50] = MSI supports 1 message, 64 bit 
    cap 10[70] = PCI-Express 2 endpoint MSI 1 max data 128(128) RO
                 link x1(x1) speed 2.5(2.5) ASPM disabled(L0s/L1) ClockPM disabled
    cap 11[b0] = MSI-X supports 4 messages, enabled
                 Table in map 0x20[0x0], PBA in map 0x20[0x800]
    ecap 0001[100] = AER 2 0 fatal 1 non-fatal 0 corrected
    ecap 0002[140] = VC 1 max VC0
    ecap 0003[160] = Serial 1 0000000000000000
    ecap 0018[170] = LTR 1
    ecap 001e[178] = L1 PM Substates 1

none2@pci0:3:0:0:	class=0x028000 card=0x88e1103c chip=0x885210ec rev=0x00 hdr=0x00
    vendor     = 'Realtek Semiconductor Co., Ltd.'
    device     = 'RTL8852AE 802.11ax PCIe Wireless Network Adapter'
    class      = network
    bar   [10] = type I/O Port, range 32, base 0xd000, size 256, enabled
    bar   [18] = type Memory, range 64, base 0xfc800000, size 1048576, enabled
    cap 01[40] = powerspec 3  supports D0 D1 D2 D3  current D0
    cap 05[50] = MSI supports 1 message, 64 bit 
    cap 10[70] = PCI-Express 2 endpoint max data 256(256) FLR RO
                 link x1(x1) speed 2.5(2.5) ASPM L1(L0s/L1) ClockPM enabled
    ecap 0001[100] = AER 2 0 fatal 0 non-fatal 0 corrected
    ecap 0003[148] = Serial 1 00e04cfffe885201
    ecap 0018[158] = LTR 1
    ecap 001e[160] = L1 PM Substates 1

nvme0@pci0:4:0:0:	class=0x010802 card=0x50102646 chip=0x50102646 rev=0x03 hdr=0x00
    vendor     = 'Kingston Technology Company, Inc.'
    class      = mass storage
    subclass   = NVM
    bar   [10] = type Memory, range 64, base 0xfc700000, size 16384, enabled
    cap 01[40] = powerspec 3  supports D0 D3  current D0
    cap 05[50] = MSI supports 8 messages, 64 bit, vector masks 
    cap 10[70] = PCI-Express 2 endpoint max data 128(128) FLR RO
                 link x4(x4) speed 5.0(8.0) ASPM L1(L1) ClockPM enabled
    cap 11[b0] = MSI-X supports 16 messages, enabled
                 Table in map 0x10[0x2000], PBA in map 0x10[0x2100]
    ecap 0001[100] = AER 2 0 fatal 0 non-fatal 0 corrected
    ecap 0019[158] = PCIe Sec 1 lane errors 0
    ecap 0018[178] = LTR 1
    ecap 001e[180] = L1 PM Substates 1

vgapci1@pci0:5:0:0:	class=0x030000 card=0x88dd103c chip=0x16381002 rev=0xc6 hdr=0x00
    vendor     = 'Advanced Micro Devices, Inc. [AMD/ATI]'
    device     = 'Cezanne'
    class      = display
    subclass   = VGA
    bar   [10] = type Prefetchable Memory, range 64, base 0xd0000000, size 268435456, enabled
    bar   [18] = type Prefetchable Memory, range 64, base 0xe0000000, size 2097152, enabled
    bar   [20] = type I/O Port, range 32, base 0xc000, size 256, enabled
    bar   [24] = type Memory, range 32, base 0xfc500000, size 524288, enabled
    cap 09[48] = vendor (length 8)
    cap 01[50] = powerspec 3  supports D0 D3  current D0
    cap 10[64] = PCI-Express 2 legacy endpoint max data 256(256) RO NS
                 link x16(x16) speed 8.0(8.0) ASPM disabled(L0s/L1)
    cap 05[a0] = MSI supports 4 messages, 64 bit 
    cap 11[c0] = MSI-X supports 4 messages
                 Table in map 0x24[0x42000], PBA in map 0x24[0x43000]
    ecap 000b[100] = Vendor 1 ID 1
    ecap 0019[270] = PCIe Sec 1 lane errors 0
    ecap 000f[2b0] = ATS 1
    ecap 0013[2c0] = Page Page Request 1
    ecap 001b[2d0] = Process Address Space ID 1
    ecap 0025[400] = Data Link Feature 1
    ecap 0026[410] = Physical Layer 16.0 GT/s 1
    ecap 0027[440] = Lane Margining at Receiver 1

none3@pci0:5:0:2:	class=0x108000 card=0x88dd103c chip=0x15df1022 rev=0x00 hdr=0x00
    vendor     = 'Advanced Micro Devices, Inc. [AMD]'
    device     = 'Family 17h (Models 10h-1fh) Platform Security Processor'
    class      = encrypt/decrypt
    bar   [18] = type Memory, range 32, base 0xfc400000, size 1048576, enabled
    bar   [24] = type Memory, range 32, base 0xfc5c8000, size 8192, enabled
    cap 09[48] = vendor (length 8)
    cap 01[50] = powerspec 3  supports D0 D3  current D0
    cap 10[64] = PCI-Express 2 endpoint max data 256(256) RO NS
                 link x16(x16) speed 8.0(8.0) ASPM disabled(L0s/L1)
    cap 05[a0] = MSI supports 2 messages, 64 bit 
    cap 11[c0] = MSI-X supports 2 messages
                 Table in map 0x24[0x0], PBA in map 0x24[0x1000]
    ecap 000b[100] = Vendor 1 ID 1

xhci0@pci0:5:0:3:	class=0x0c0330 card=0x88dd103c chip=0x16391022 rev=0x00 hdr=0x00
    vendor     = 'Advanced Micro Devices, Inc. [AMD]'
    device     = 'Renoir/Cezanne USB 3.1'
    class      = serial bus
    subclass   = USB
    bar   [10] = type Memory, range 64, base 0xfc300000, size 1048576, enabled
    cap 09[48] = vendor (length 8)
    cap 01[50] = powerspec 3  supports D0 D3  current D0
    cap 10[64] = PCI-Express 2 endpoint max data 256(256) RO NS
                 link x16(x16) speed 8.0(8.0) ASPM disabled(L0s/L1)
    cap 05[a0] = MSI supports 8 messages, 64 bit enabled with 1 message
    cap 11[c0] = MSI-X supports 8 messages
                 Table in map 0x10[0xfe000], PBA in map 0x10[0xff000]
    ecap 000b[100] = Vendor 1 ID 1

xhci1@pci0:5:0:4:	class=0x0c0330 card=0x88dd103c chip=0x16391022 rev=0x00 hdr=0x00
    vendor     = 'Advanced Micro Devices, Inc. [AMD]'
    device     = 'Renoir/Cezanne USB 3.1'
    class      = serial bus
    subclass   = USB
    bar   [10] = type Memory, range 64, base 0xfc200000, size 1048576, enabled
    cap 09[48] = vendor (length 8)
    cap 01[50] = powerspec 3  supports D0 D3  current D0
    cap 10[64] = PCI-Express 2 endpoint max data 256(256) RO NS
                 link x16(x16) speed 8.0(8.0) ASPM disabled(L0s/L1)
    cap 05[a0] = MSI supports 8 messages, 64 bit enabled with 1 message
    cap 11[c0] = MSI-X supports 8 messages
                 Table in map 0x10[0xfe000], PBA in map 0x10[0xff000]
    ecap 000b[100] = Vendor 1 ID 1

none4@pci0:5:0:5:	class=0x048000 card=0x88dd103c chip=0x15e21022 rev=0x01 hdr=0x00
    vendor     = 'Advanced Micro Devices, Inc. [AMD]'
    device     = 'Raven/Raven2/FireFlight/Renoir Audio Processor'
    class      = multimedia
    bar   [10] = type Memory, range 32, base 0xfc580000, size 262144, enabled
    cap 09[48] = vendor (length 8)
    cap 01[50] = powerspec 3  supports D0 D3  current D0
    cap 10[64] = PCI-Express 2 endpoint max data 256(256) RO NS
                 link x16(x16) speed 8.0(8.0) ASPM disabled(L0s/L1)
    cap 05[a0] = MSI supports 1 message, 64 bit 
    ecap 000b[100] = Vendor 1 ID 1

hdac1@pci0:5:0:6:	class=0x040300 card=0x88dd103c chip=0x15e31022 rev=0x00 hdr=0x00
    vendor     = 'Advanced Micro Devices, Inc. [AMD]'
    device     = 'Family 17h (Models 10h-1fh) HD Audio Controller'
    class      = multimedia
    subclass   = HDA
    bar   [10] = type Memory, range 32, base 0xfc5c0000, size 32768, enabled
    cap 09[48] = vendor (length 8)
    cap 01[50] = powerspec 3  supports D0 D3  current D0
    cap 10[64] = PCI-Express 2 endpoint max data 256(256) RO NS
                 link x16(x16) speed 8.0(8.0) ASPM disabled(L0s/L1)
    cap 05[a0] = MSI supports 1 message, 64 bit enabled with 1 message
    ecap 000b[100] = Vendor 1 ID 1

ahci0@pci0:6:0:0:	class=0x010601 card=0x88dd103c chip=0x79011022 rev=0x81 hdr=0x00
    vendor     = 'Advanced Micro Devices, Inc. [AMD]'
    device     = 'FCH SATA Controller [AHCI mode]'
    class      = mass storage
    subclass   = SATA
    bar   [24] = type Memory, range 32, base 0xfc601000, size 2048, enabled
    cap 09[48] = vendor (length 8)
    cap 01[50] = powerspec 3  supports D0 D3  current D0
    cap 10[64] = PCI-Express 2 endpoint max data 256(256) RO NS
                 link x16(x16) speed 8.0(8.0) ASPM disabled(L0s/L1)
    cap 05[a0] = MSI supports 2 messages, 64 bit enabled with 1 message
    cap 12[d0] = SATA Index-Data Pair
    ecap 000b[100] = Vendor 1 ID 1
    ecap 0019[270] = PCIe Sec 1 lane errors 0
    ecap 0025[400] = Data Link Feature 1
    ecap 0026[410] = Physical Layer 16.0 GT/s 1
    ecap 0027[440] = Lane Margining at Receiver 1

ahci1@pci0:6:0:1:	class=0x010601 card=0x88dd103c chip=0x79011022 rev=0x81 hdr=0x00
    vendor     = 'Advanced Micro Devices, Inc. [AMD]'
    device     = 'FCH SATA Controller [AHCI mode]'
    class      = mass storage
    subclass   = SATA
    bar   [24] = type Memory, range 32, base 0xfc600000, size 2048, enabled
    cap 09[48] = vendor (length 8)
    cap 01[50] = powerspec 3  supports D0 D3  current D0
    cap 10[64] = PCI-Express 2 endpoint max data 256(256) RO NS
                 link x16(x16) speed 8.0(8.0) ASPM disabled(L0s/L1)
    cap 05[a0] = MSI supports 2 messages, 64 bit enabled with 1 message
    cap 12[d0] = SATA Index-Data Pair
    ecap 000b[100] = Vendor 1 ID 1
