hostb0@pci0:0:0:0:	class=0x060000 rev=0x09 hdr=0x00 vendor=0x8086 device=0x0100 subvendor=0x1043 subdevice=0x844d
    vendor     = 'Intel Corporation'
    device     = '2nd Generation Core Processor Family DRAM Controller'
    class      = bridge
    subclass   = HOST-PCI
    cap 09[e0] = vendor (length 12) Intel cap 0 version 1

pcib1@pci0:0:1:0:	class=0x060400 rev=0x09 hdr=0x01 vendor=0x8086 device=0x0101 subvendor=0x1043 subdevice=0x844d
    vendor     = 'Intel Corporation'
    device     = 'Xeon E3-1200/2nd Generation Core Processor Family PCI Express Root Port'
    class      = bridge
    subclass   = PCI-PCI
    cap 0d[88] = PCI Bridge subvendor=0x1043 subdevice=0x844d
    cap 01[80] = powerspec 3  supports D0 D3  current D0
    cap 05[90] = MSI supports 1 message 
    cap 10[a0] = PCI-Express 2 root port max data 128(128)
                 max read 128
                 link x0(x16) speed 0.0(5.0)
                 slot 0 power limit 0 mW
    ecap 0002[100] = VC 1 max VC0
    ecap 0005[140] = Root Complex Link Declaration 1

vgapci0@pci0:0:2:0:	class=0x030000 rev=0x09 hdr=0x00 vendor=0x8086 device=0x0102 subvendor=0x1043 subdevice=0x844d
    vendor     = 'Intel Corporation'
    device     = '2nd Generation Core Processor Family Integrated Graphics Controller'
    class      = display
    subclass   = VGA
    bar   [10] = type Memory, range 64, base 0xfe000000, size 4194304, enabled
    bar   [18] = type Prefetchable Memory, range 64, base 0xc0000000, size 268435456, enabled
    bar   [20] = type I/O Port, range 32, base 0xf000, size 64, enabled
    cap 05[90] = MSI supports 1 message enabled with 1 message
    cap 01[d0] = powerspec 2  supports D0 D3  current D0
    cap 13[a4] = PCI Advanced Features: FLR TP

none0@pci0:0:22:0:	class=0x078000 rev=0x04 hdr=0x00 vendor=0x8086 device=0x1c3a subvendor=0x1043 subdevice=0x844d
    vendor     = 'Intel Corporation'
    device     = '6 Series/C200 Series Chipset Family MEI Controller'
    class      = simple comms
    bar   [10] = type Memory, range 64, base 0xfe604000, size 16, enabled
    cap 01[50] = powerspec 3  supports D0 D3  current D0
    cap 05[8c] = MSI supports 1 message, 64 bit 

ehci0@pci0:0:26:0:	class=0x0c0320 rev=0x05 hdr=0x00 vendor=0x8086 device=0x1c2d subvendor=0x1043 subdevice=0x844d
    vendor     = 'Intel Corporation'
    device     = '6 Series/C200 Series Chipset Family USB Enhanced Host Controller'
    class      = serial bus
    subclass   = USB
    bar   [10] = type Memory, range 32, base 0xfe603000, size 1024, enabled
    cap 01[50] = powerspec 2  supports D0 D3  current D0
    cap 0a[58] = EHCI Debug Port at offset 0xa0 in map 0x14
    cap 13[98] = PCI Advanced Features: FLR TP

pcib2@pci0:0:28:0:	class=0x060400 rev=0xb5 hdr=0x01 vendor=0x8086 device=0x1c10 subvendor=0x1043 subdevice=0x844d
    vendor     = 'Intel Corporation'
    device     = '6 Series/C200 Series Chipset Family PCI Express Root Port 1'
    class      = bridge
    subclass   = PCI-PCI
    cap 10[40] = PCI-Express 2 root port max data 128(128)
                 max read 128
                 link x0(x4) speed 0.0(5.0) ASPM disabled(L0s/L1)
                 slot 0 power limit 250 mW
    cap 05[80] = MSI supports 1 message 
    cap 0d[90] = PCI Bridge subvendor=0x1043 subdevice=0x844d
    cap 01[a0] = powerspec 2  supports D0 D3  current D0

pcib3@pci0:0:28:4:	class=0x060400 rev=0xb5 hdr=0x01 vendor=0x8086 device=0x1c18 subvendor=0x1043 subdevice=0x844d
    vendor     = 'Intel Corporation'
    device     = '6 Series/C200 Series Chipset Family PCI Express Root Port 5'
    class      = bridge
    subclass   = PCI-PCI
    cap 10[40] = PCI-Express 2 root port max data 128(128)
                 max read 128
                 link x1(x1) speed 2.5(5.0) ASPM disabled(L0s/L1)
                 slot 4 power limit 100 mW
    cap 05[80] = MSI supports 1 message 
    cap 0d[90] = PCI Bridge subvendor=0x1043 subdevice=0x844d
    cap 01[a0] = powerspec 2  supports D0 D3  current D0

pcib4@pci0:0:28:5:	class=0x060400 rev=0xb5 hdr=0x01 vendor=0x8086 device=0x1c1a subvendor=0x1043 subdevice=0x844d
    vendor     = 'Intel Corporation'
    device     = '6 Series/C200 Series Chipset Family PCI Express Root Port 6'
    class      = bridge
    subclass   = PCI-PCI
    cap 10[40] = PCI-Express 2 root port max data 128(128)
                 max read 128
                 link x1(x1) speed 5.0(5.0) ASPM disabled(L0s/L1)
                 slot 5 power limit 100 mW
    cap 05[80] = MSI supports 1 message 
    cap 0d[90] = PCI Bridge subvendor=0x1043 subdevice=0x844d
    cap 01[a0] = powerspec 2  supports D0 D3  current D0

pcib5@pci0:0:28:6:	class=0x060400 rev=0xb5 hdr=0x01 vendor=0x8086 device=0x1c1c subvendor=0x1043 subdevice=0x844d
    vendor     = 'Intel Corporation'
    device     = '6 Series/C200 Series Chipset Family PCI Express Root Port 7'
    class      = bridge
    subclass   = PCI-PCI
    cap 10[40] = PCI-Express 2 root port max data 128(128)
                 max read 128
                 link x1(x1) speed 2.5(5.0) ASPM disabled(L0s/L1)
                 slot 6 power limit 100 mW
    cap 05[80] = MSI supports 1 message 
    cap 0d[90] = PCI Bridge subvendor=0x1043 subdevice=0x844d
    cap 01[a0] = powerspec 2  supports D0 D3  current D0

pcib6@pci0:0:28:7:	class=0x060401 rev=0xb5 hdr=0x01 vendor=0x8086 device=0x244e subvendor=0x1043 subdevice=0x844d
    vendor     = 'Intel Corporation'
    device     = '82801 PCI Bridge'
    class      = bridge
    subclass   = PCI-PCI
    cap 10[40] = PCI-Express 2 root port max data 128(128)
                 max read 128
                 link x1(x1) speed 2.5(5.0) ASPM disabled(L0s/L1)
                 slot 7 power limit 100 mW
    cap 05[80] = MSI supports 1 message 
    cap 0d[90] = PCI Bridge subvendor=0x1043 subdevice=0x844d
    cap 01[a0] = powerspec 2  supports D0 D3  current D0

ehci1@pci0:0:29:0:	class=0x0c0320 rev=0x05 hdr=0x00 vendor=0x8086 device=0x1c26 subvendor=0x1043 subdevice=0x844d
    vendor     = 'Intel Corporation'
    device     = '6 Series/C200 Series Chipset Family USB Enhanced Host Controller'
    class      = serial bus
    subclass   = USB
    bar   [10] = type Memory, range 32, base 0xfe602000, size 1024, enabled
    cap 01[50] = powerspec 2  supports D0 D3  current D0
    cap 0a[58] = EHCI Debug Port at offset 0xa0 in map 0x14
    cap 13[98] = PCI Advanced Features: FLR TP

isab0@pci0:0:31:0:	class=0x060100 rev=0x05 hdr=0x00 vendor=0x8086 device=0x1c4a subvendor=0x1043 subdevice=0x844d
    vendor     = 'Intel Corporation'
    device     = 'H67 Express Chipset LPC Controller'
    class      = bridge
    subclass   = PCI-ISA
    cap 09[e0] = vendor (length 12) Intel cap 1 version 0
		 features: AMT, 4 PCI-e x1 slots

ahci0@pci0:0:31:2:	class=0x010601 rev=0x05 hdr=0x00 vendor=0x8086 device=0x1c02 subvendor=0x1043 subdevice=0x844d
    vendor     = 'Intel Corporation'
    device     = '6 Series/C200 Series Chipset Family 6 port Desktop SATA AHCI Controller'
    class      = mass storage
    subclass   = SATA
    bar   [10] = type I/O Port, range 32, base 0xf0b0, size 8, enabled
    bar   [14] = type I/O Port, range 32, base 0xf0a0, size 4, enabled
    bar   [18] = type I/O Port, range 32, base 0xf090, size 8, enabled
    bar   [1c] = type I/O Port, range 32, base 0xf080, size 4, enabled
    bar   [20] = type I/O Port, range 32, base 0xf060, size 32, enabled
    bar   [24] = type Memory, range 32, base 0xfe601000, size 2048, enabled
    cap 05[80] = MSI supports 1 message enabled with 1 message
    cap 01[70] = powerspec 3  supports D0 D3  current D0
    cap 12[a8] = SATA Index-Data Pair
    cap 13[b0] = PCI Advanced Features: FLR TP

ichsmb0@pci0:0:31:3:	class=0x0c0500 rev=0x05 hdr=0x00 vendor=0x8086 device=0x1c22 subvendor=0x1043 subdevice=0x844d
    vendor     = 'Intel Corporation'
    device     = '6 Series/C200 Series Chipset Family SMBus Controller'
    class      = serial bus
    subclass   = SMBus
    bar   [10] = type Memory, range 64, base 0xfe600000, size 256, enabled
    bar   [20] = type I/O Port, range 32, base 0xf040, size 32, enabled

atapci0@pci0:3:0:0:	class=0x010185 rev=0x00 hdr=0x00 vendor=0x1106 device=0x0415 subvendor=0x1043 subdevice=0x838f
    vendor     = 'VIA Technologies, Inc.'
    device     = 'VT6415 PATA IDE Host Controller'
    class      = mass storage
    subclass   = ATA
    bar   [10] = type I/O Port, range 32, base 0xe040, size 8, enabled
    bar   [14] = type I/O Port, range 32, base 0xe030, size 4, enabled
    bar   [18] = type I/O Port, range 32, base 0xe020, size 8, enabled
    bar   [1c] = type I/O Port, range 32, base 0xe010, size 4, enabled
    bar   [20] = type I/O Port, range 32, base 0xe000, size 16, enabled
    cap 01[50] = powerspec 3  supports D0 D1 D2 D3  current D0
    cap 05[70] = MSI supports 1 message, 64 bit, vector masks 
    cap 10[90] = PCI-Express 1 legacy endpoint max data 128(128)
                 max read 512
                 link x1(x1) speed 2.5(2.5) ASPM disabled(L0s/L1)
    ecap 0001[100] = AER 1 0 fatal 0 non-fatal 1 corrected
    ecap 0003[130] = Serial 1 004063ffff634000

xhci0@pci0:4:0:0:	class=0x0c0330 rev=0x00 hdr=0x00 vendor=0x1b21 device=0x1042 subvendor=0x1043 subdevice=0x8488
    vendor     = 'ASMedia Technology Inc.'
    device     = 'ASM1042 SuperSpeed USB Host Controller'
    class      = serial bus
    subclass   = USB
    bar   [10] = type Memory, range 64, base 0xfe400000, size 32768, enabled
    cap 05[50] = MSI supports 8 messages, 64 bit 
    cap 11[68] = MSI-X supports 8 messages, enabled
                 Table in map 0x10[0x2000], PBA in map 0x10[0x2080]
    cap 01[78] = powerspec 3  supports D0 D3  current D0
    cap 10[80] = PCI-Express 2 legacy endpoint max data 128(512) NS
                 max read 512
                 link x1(x1) speed 5.0(5.0) ASPM disabled(L0s/L1)
    ecap 0002[100] = VC 1 max VC0

re0@pci0:5:0:0:	class=0x020000 rev=0x06 hdr=0x00 vendor=0x10ec device=0x8168 subvendor=0x1043 subdevice=0x8432
    vendor     = 'Realtek Semiconductor Co., Ltd.'
    device     = 'RTL8111/8168/8411 PCI Express Gigabit Ethernet Controller'
    class      = network
    subclass   = ethernet
    bar   [10] = type I/O Port, range 32, base 0xd000, size 256, enabled
    bar   [18] = type Prefetchable Memory, range 64, base 0xd0004000, size 4096, enabled
    bar   [20] = type Prefetchable Memory, range 64, base 0xd0000000, size 16384, enabled
    cap 01[40] = powerspec 3  supports D0 D1 D2 D3  current D0
    cap 05[50] = MSI supports 1 message, 64 bit 
    cap 10[70] = PCI-Express 2 endpoint MSI 1 max data 128(256)
                 max read 4096
                 link x1(x1) speed 2.5(2.5) ASPM disabled(L0s/L1) ClockPM disabled
    cap 11[b0] = MSI-X supports 4 messages, enabled
                 Table in map 0x20[0x0], PBA in map 0x20[0x800]
    cap 03[d0] = VPD
    ecap 0001[100] = AER 1 0 fatal 0 non-fatal 3 corrected
    ecap 0002[140] = VC 1 max VC0
    ecap 0003[160] = Serial 1 30000000684ce000

pcib7@pci0:6:0:0:	class=0x060401 rev=0x01 hdr=0x01 vendor=0x1b21 device=0x1080 subvendor=0x1043 subdevice=0x8489
    vendor     = 'ASMedia Technology Inc.'
    device     = 'ASM1083/1085 PCIe to PCI Bridge'
    class      = bridge
    subclass   = PCI-PCI
    cap 0d[c0] = PCI Bridge subvendor=0x1043 subdevice=0x8489
