hostb0@pci0:0:0:0:	class=0x060000 rev=0x04 hdr=0x00 vendor=0x8086 device=0x0bf3 subvendor=0x8086 subdevice=0x1999
    vendor     = 'Intel Corporation'
    device     = 'Atom Processor D2xxx/N2xxx DRAM Controller'
    class      = bridge
    subclass   = HOST-PCI

vgapci0@pci0:0:2:0:	class=0x030000 rev=0x0b hdr=0x00 vendor=0x8086 device=0x0be2 subvendor=0x8086 subdevice=0x1999
    vendor     = 'Intel Corporation'
    device     = 'Atom Processor D2xxx/N2xxx Integrated Graphics Controller'
    class      = display
    subclass   = VGA
    bar   [10] = type Memory, range 32, base 0xc0300000, size 1048576, enabled
    bar   [14] = type I/O Port, range 32, base 0x4110, size 8, enabled
    cap 01[d0] = powerspec 2  supports D0 D3  current D0
    cap 09[b0] = vendor (length 7) Intel cap 0 version 1
    cap 05[90] = MSI supports 1 message 

uhci0@pci0:0:26:0:	class=0x0c0300 rev=0x00 hdr=0x00 vendor=0x8086 device=0x3a37 subvendor=0x8086 subdevice=0x3a34
    vendor     = 'Intel Corporation'
    device     = '82801JI (ICH10 Family) USB UHCI Controller'
    class      = serial bus
    subclass   = USB
    bar   [20] = type I/O Port, range 32, base 0x40e0, size 32, enabled
    cap 13[50] = PCI Advanced Features: FLR TP

uhci1@pci0:0:26:1:	class=0x0c0300 rev=0x00 hdr=0x00 vendor=0x8086 device=0x3a38 subvendor=0x8086 subdevice=0x3a34
    vendor     = 'Intel Corporation'
    device     = '82801JI (ICH10 Family) USB UHCI Controller'
    class      = serial bus
    subclass   = USB
    bar   [20] = type I/O Port, range 32, base 0x40c0, size 32, enabled
    cap 13[50] = PCI Advanced Features: FLR TP

uhci2@pci0:0:26:2:	class=0x0c0300 rev=0x00 hdr=0x00 vendor=0x8086 device=0x3a39 subvendor=0x8086 subdevice=0x3a34
    vendor     = 'Intel Corporation'
    device     = '82801JI (ICH10 Family) USB UHCI Controller'
    class      = serial bus
    subclass   = USB
    bar   [20] = type I/O Port, range 32, base 0x40a0, size 32, enabled
    cap 13[50] = PCI Advanced Features: FLR TP

ehci0@pci0:0:26:7:	class=0x0c0320 rev=0x00 hdr=0x00 vendor=0x8086 device=0x3a3c subvendor=0x8086 subdevice=0x3a3a
    vendor     = 'Intel Corporation'
    device     = '82801JI (ICH10 Family) USB2 EHCI Controller'
    class      = serial bus
    subclass   = USB
    bar   [10] = type Memory, range 32, base 0xc0404c00, size 1024, enabled
    cap 01[50] = powerspec 2  supports D0 D3  current D0
    cap 0a[58] = EHCI Debug Port at offset 0xa0 in map 0x14
    cap 13[98] = PCI Advanced Features: FLR TP

hdac0@pci0:0:27:0:	class=0x040300 rev=0x00 hdr=0x00 vendor=0x8086 device=0x3a3e subvendor=0x8086 subdevice=0x3a3e
    vendor     = 'Intel Corporation'
    device     = '82801JI (ICH10 Family) HD Audio Controller'
    class      = multimedia
    subclass   = HDA
    bar   [10] = type Memory, range 64, base 0xc0400000, size 16384, enabled
    cap 01[50] = powerspec 2  supports D0 D3  current D0
    cap 05[60] = MSI supports 1 message, 64 bit enabled with 1 message
    cap 10[70] = PCI-Express 1 root endpoint max data 128(128) FLR NS
                 max read 128
    ecap 0002[100] = VC 1 max VC1
    ecap 0005[130] = Root Complex Link Declaration 1

pcib1@pci0:0:28:0:	class=0x060400 rev=0x00 hdr=0x01 vendor=0x8086 device=0x3a40 subvendor=0x8086 subdevice=0x244e
    vendor     = 'Intel Corporation'
    device     = '82801JI (ICH10 Family) PCI Express Root Port 1'
    class      = bridge
    subclass   = PCI-PCI
    cap 10[40] = PCI-Express 1 root port max data 128(128)
                 max read 128
                 link x0(x1) speed 0.0(2.5) ASPM disabled(L0s/L1)
    cap 05[80] = MSI supports 1 message 
    cap 0d[90] = PCI Bridge subvendor=0x8086 subdevice=0x244e
    cap 01[a0] = powerspec 2  supports D0 D3  current D0
    ecap 0002[100] = VC 1 max VC0
    ecap 0005[180] = Root Complex Link Declaration 1

pcib2@pci0:0:28:1:	class=0x060400 rev=0x00 hdr=0x01 vendor=0x8086 device=0x3a42 subvendor=0x8086 subdevice=0x244e
    vendor     = 'Intel Corporation'
    device     = '82801JI (ICH10 Family) PCI Express Port 2'
    class      = bridge
    subclass   = PCI-PCI
    cap 10[40] = PCI-Express 1 root port max data 128(128)
                 max read 128
                 link x0(x1) speed 0.0(2.5) ASPM disabled(L0s/L1)
    cap 05[80] = MSI supports 1 message 
    cap 0d[90] = PCI Bridge subvendor=0x8086 subdevice=0x244e
    cap 01[a0] = powerspec 2  supports D0 D3  current D0
    ecap 0002[100] = VC 1 max VC0
    ecap 0005[180] = Root Complex Link Declaration 1

pcib3@pci0:0:28:2:	class=0x060400 rev=0x00 hdr=0x01 vendor=0x8086 device=0x3a44 subvendor=0x8086 subdevice=0x244e
    vendor     = 'Intel Corporation'
    device     = '82801JI (ICH10 Family) PCI Express Root Port 3'
    class      = bridge
    subclass   = PCI-PCI
    cap 10[40] = PCI-Express 1 root port max data 128(128)
                 max read 128
                 link x1(x1) speed 2.5(2.5) ASPM disabled(L0s/L1)
    cap 05[80] = MSI supports 1 message 
    cap 0d[90] = PCI Bridge subvendor=0x8086 subdevice=0x244e
    cap 01[a0] = powerspec 2  supports D0 D3  current D0
    ecap 0002[100] = VC 1 max VC0
    ecap 0005[180] = Root Complex Link Declaration 1

pcib4@pci0:0:28:3:	class=0x060400 rev=0x00 hdr=0x01 vendor=0x8086 device=0x3a46 subvendor=0x8086 subdevice=0x244e
    vendor     = 'Intel Corporation'
    device     = '82801JI (ICH10 Family) PCI Express Root Port 4'
    class      = bridge
    subclass   = PCI-PCI
    cap 10[40] = PCI-Express 1 root port max data 128(128)
                 max read 128
                 link x1(x1) speed 2.5(2.5) ASPM disabled(L0s/L1)
    cap 05[80] = MSI supports 1 message 
    cap 0d[90] = PCI Bridge subvendor=0x8086 subdevice=0x244e
    cap 01[a0] = powerspec 2  supports D0 D3  current D0
    ecap 0002[100] = VC 1 max VC0
    ecap 0005[180] = Root Complex Link Declaration 1

pcib5@pci0:0:28:4:	class=0x060400 rev=0x00 hdr=0x01 vendor=0x8086 device=0x3a48 subvendor=0x0000 subdevice=0x0000
    vendor     = 'Intel Corporation'
    device     = '82801JI (ICH10 Family) PCI Express Root Port 5'
    class      = bridge
    subclass   = PCI-PCI
    cap 10[40] = PCI-Express 1 root port max data 128(128)
                 max read 128
                 link x1(x1) speed 2.5(2.5) ASPM disabled(L0s/L1)
    cap 05[80] = MSI supports 1 message 
    cap 0d[90] = PCI Bridge subvendor=0x0000 subdevice=0x0000
    cap 01[a0] = powerspec 2  supports D0 D3  current D0
    ecap 0002[100] = VC 1 max VC0
    ecap 0005[180] = Root Complex Link Declaration 1

pcib6@pci0:0:28:5:	class=0x060400 rev=0x00 hdr=0x01 vendor=0x8086 device=0x3a4a subvendor=0x0000 subdevice=0x0000
    vendor     = 'Intel Corporation'
    device     = '82801JI (ICH10 Family) PCI Express Root Port 6'
    class      = bridge
    subclass   = PCI-PCI
    cap 10[40] = PCI-Express 1 root port max data 128(128)
                 max read 128
                 link x0(x1) speed 0.0(2.5) ASPM disabled(L0s/L1)
    cap 05[80] = MSI supports 1 message 
    cap 0d[90] = PCI Bridge subvendor=0x0000 subdevice=0x0000
    cap 01[a0] = powerspec 2  supports D0 D3  current D0
    ecap 0002[100] = VC 1 max VC0
    ecap 0005[180] = Root Complex Link Declaration 1

uhci3@pci0:0:29:0:	class=0x0c0300 rev=0x00 hdr=0x00 vendor=0x8086 device=0x3a34 subvendor=0x8086 subdevice=0x3a34
    vendor     = 'Intel Corporation'
    device     = '82801JI (ICH10 Family) USB UHCI Controller'
    class      = serial bus
    subclass   = USB
    bar   [20] = type I/O Port, range 32, base 0x4080, size 32, enabled
    cap 13[50] = PCI Advanced Features: FLR TP

uhci4@pci0:0:29:1:	class=0x0c0300 rev=0x00 hdr=0x00 vendor=0x8086 device=0x3a35 subvendor=0x8086 subdevice=0x3a34
    vendor     = 'Intel Corporation'
    device     = '82801JI (ICH10 Family) USB UHCI Controller'
    class      = serial bus
    subclass   = USB
    bar   [20] = type I/O Port, range 32, base 0x4060, size 32, enabled
    cap 13[50] = PCI Advanced Features: FLR TP

uhci5@pci0:0:29:2:	class=0x0c0300 rev=0x00 hdr=0x00 vendor=0x8086 device=0x3a36 subvendor=0x8086 subdevice=0x3a34
    vendor     = 'Intel Corporation'
    device     = '82801JI (ICH10 Family) USB UHCI Controller'
    class      = serial bus
    subclass   = USB
    bar   [20] = type I/O Port, range 32, base 0x4040, size 32, enabled
    cap 13[50] = PCI Advanced Features: FLR TP

ehci1@pci0:0:29:7:	class=0x0c0320 rev=0x00 hdr=0x00 vendor=0x8086 device=0x3a3a subvendor=0x8086 subdevice=0x3a3a
    vendor     = 'Intel Corporation'
    device     = '82801JI (ICH10 Family) USB2 EHCI Controller'
    class      = serial bus
    subclass   = USB
    bar   [10] = type Memory, range 32, base 0xc0404800, size 1024, enabled
    cap 01[50] = powerspec 2  supports D0 D3  current D0
    cap 0a[58] = EHCI Debug Port at offset 0xa0 in map 0x14
    cap 13[98] = PCI Advanced Features: FLR TP

pcib7@pci0:0:30:0:	class=0x060401 rev=0x90 hdr=0x01 vendor=0x8086 device=0x244e subvendor=0x8086 subdevice=0x244e
    vendor     = 'Intel Corporation'
    device     = '82801 PCI Bridge'
    class      = bridge
    subclass   = PCI-PCI
    cap 0d[50] = PCI Bridge subvendor=0x8086 subdevice=0x244e

isab0@pci0:0:31:0:	class=0x060100 rev=0x00 hdr=0x00 vendor=0x8086 device=0x3a16 subvendor=0x8086 subdevice=0x3a16
    vendor     = 'Intel Corporation'
    device     = '82801JIR (ICH10R) LPC Interface Controller'
    class      = bridge
    subclass   = PCI-ISA
    cap 09[e0] = vendor (length 12) Intel cap 1 version 0
		 features: SATA RAID-5, 4 PCI-e x1 slots

ahci0@pci0:0:31:2:	class=0x010601 rev=0x00 hdr=0x00 vendor=0x8086 device=0x3a22 subvendor=0x0000 subdevice=0x0000
    vendor     = 'Intel Corporation'
    device     = '82801JI (ICH10 Family) SATA AHCI Controller'
    class      = mass storage
    subclass   = SATA
    bar   [10] = type I/O Port, range 32, base 0x4108, size 8, enabled
    bar   [14] = type I/O Port, range 32, base 0x411c, size 4, enabled
    bar   [18] = type I/O Port, range 32, base 0x4100, size 8, enabled
    bar   [1c] = type I/O Port, range 32, base 0x4118, size 4, enabled
    bar   [20] = type I/O Port, range 32, base 0x4020, size 32, enabled
    bar   [24] = type Memory, range 32, base 0xc0404000, size 2048, enabled
    cap 05[80] = MSI supports 16 messages enabled with 16 messages
    cap 01[70] = powerspec 3  supports D0 D3  current D0
    cap 12[a8] = SATA Index-Data Pair
    cap 13[b0] = PCI Advanced Features: FLR TP

ichsmb0@pci0:0:31:3:	class=0x0c0500 rev=0x00 hdr=0x00 vendor=0x8086 device=0x3a30 subvendor=0x8086 subdevice=0x3a30
    vendor     = 'Intel Corporation'
    device     = '82801JI (ICH10 Family) SMBus Controller'
    class      = serial bus
    subclass   = SMBus
    bar   [10] = type Memory, range 64, base 0xc0405000, size 256, enabled
    bar   [20] = type I/O Port, range 32, base 0xefa0, size 32, enabled

xhci0@pci0:3:0:0:	class=0x0c0330 rev=0x00 hdr=0x00 vendor=0x1b6f device=0x7052 subvendor=0x1b6f subdevice=0x7052
    vendor     = 'Etron Technology, Inc.'
    device     = 'EJ188/EJ198 USB 3.0 Host Controller'
    class      = serial bus
    subclass   = USB
    bar   [10] = type Memory, range 64, base 0xc0200000, size 32768, enabled
    cap 01[50] = powerspec 3  supports D0 D1 D2 D3  current D0
    cap 05[70] = MSI supports 4 messages, 64 bit, vector masks enabled with 1 message
    cap 10[a0] = PCI-Express 2 endpoint MSI 1 max data 128(1024) FLR RO NS
                 max read 512
                 link x1(x1) speed 2.5(5.0) ASPM disabled(L0s/L1) ClockPM disabled
    ecap 0001[100] = AER 1 0 fatal 0 non-fatal 1 corrected
    ecap 0003[190] = Serial 1 0101010101010101

em0@pci0:4:0:0:	class=0x020000 rev=0x00 hdr=0x00 vendor=0x8086 device=0x10d3 subvendor=0x8086 subdevice=0x0000
    vendor     = 'Intel Corporation'
    device     = '82574L Gigabit Network Connection'
    class      = network
    subclass   = ethernet
    bar   [10] = type Memory, range 32, base 0xc0100000, size 131072, enabled
    bar   [18] = type I/O Port, range 32, base 0x3000, size 32, enabled
    bar   [1c] = type Memory, range 32, base 0xc0120000, size 16384, enabled
    cap 01[c8] = powerspec 2  supports D0 D3  current D0
    cap 05[d0] = MSI supports 1 message, 64 bit 
    cap 10[e0] = PCI-Express 1 endpoint max data 128(256) RO NS
                 max read 512
                 link x1(x1) speed 2.5(2.5) ASPM disabled(L0s/L1)
    cap 11[a0] = MSI-X supports 5 messages, enabled
                 Table in map 0x1c[0x0], PBA in map 0x1c[0x2000]
    ecap 0001[100] = AER 1 0 fatal 0 non-fatal 1 corrected
    ecap 0003[140] = Serial 1 00089bffffd7fe96

em1@pci0:5:0:0:	class=0x020000 rev=0x00 hdr=0x00 vendor=0x8086 device=0x10d3 subvendor=0x8086 subdevice=0x0000
    vendor     = 'Intel Corporation'
    device     = '82574L Gigabit Network Connection'
    class      = network
    subclass   = ethernet
    bar   [10] = type Memory, range 32, base 0xc0000000, size 131072, enabled
    bar   [18] = type I/O Port, range 32, base 0x2000, size 32, enabled
    bar   [1c] = type Memory, range 32, base 0xc0020000, size 16384, enabled
    cap 01[c8] = powerspec 2  supports D0 D3  current D0
    cap 05[d0] = MSI supports 1 message, 64 bit 
    cap 10[e0] = PCI-Express 1 endpoint max data 128(256) RO NS
                 max read 512
                 link x1(x1) speed 2.5(2.5) ASPM disabled(L0s/L1)
    cap 11[a0] = MSI-X supports 5 messages, enabled
                 Table in map 0x1c[0x0], PBA in map 0x1c[0x2000]
    ecap 0001[100] = AER 1 0 fatal 0 non-fatal 1 corrected
    ecap 0003[140] = Serial 1 00089bffffd7fe95
