hostb0@pci0:0:0:0:	class=0x060000 card=0x04981025 chip=0x00448086 rev=0x18 hdr=0x00
    vendor     = 'Intel Corporation'
    device     = 'Core Processor DRAM Controller'
    class      = bridge
    subclass   = HOST-PCI
    cap 09[e0] = vendor (length 12) Intel cap 0 version 1

pcib1@pci0:0:1:0:	class=0x060400 card=0x04981025 chip=0x00458086 rev=0x18 hdr=0x01
    vendor     = 'Intel Corporation'
    device     = 'Core Processor PCI Express x16 Root Port'
    class      = bridge
    subclass   = PCI-PCI
    cap 0d[88] = PCI Bridge card=0x04981025
    cap 01[80] = powerspec 3  supports D0 D3  current D0
    cap 05[90] = MSI supports 1 message 
    cap 10[a0] = PCI-Express 2 root port max data 128(128)
                 link x16(x16) speed 2.5(2.5) ASPM L0s/L1(L0s/L1)
                 slot 17 power limit 75000 mW
    ecap 0002[100] = VC 1 max VC0

none0@pci0:0:22:0:	class=0x078000 card=0x04981025 chip=0x3b648086 rev=0x06 hdr=0x00
    vendor     = 'Intel Corporation'
    device     = '5 Series/3400 Series Chipset HECI Controller'
    class      = simple comms
    bar   [10] = type Memory, range 64, base 0xd4105900, size 16, enabled
    cap 01[50] = powerspec 3  supports D0 D3  current D0
    cap 05[8c] = MSI supports 1 message, 64 bit 

ehci0@pci0:0:26:0:	class=0x0c0320 card=0x04981025 chip=0x3b3c8086 rev=0x05 hdr=0x00
    vendor     = 'Intel Corporation'
    device     = '5 Series/3400 Series Chipset USB2 Enhanced Host Controller'
    class      = serial bus
    subclass   = USB
    bar   [10] = type Memory, range 32, base 0xd4105400, size 1024, enabled
    cap 01[50] = powerspec 2  supports D0 D3  current D0
    cap 0a[58] = EHCI Debug Port at offset 0xa0 in map 0x14
    cap 13[98] = PCI Advanced Features: FLR TP

hdac1@pci0:0:27:0:	class=0x040300 card=0x04981025 chip=0x3b568086 rev=0x05 hdr=0x00
    vendor     = 'Intel Corporation'
    device     = '5 Series/3400 Series Chipset High Definition Audio'
    class      = multimedia
    subclass   = HDA
    bar   [10] = type Memory, range 64, base 0xd0000000, size 16384, enabled
    cap 01[50] = powerspec 2  supports D0 D3  current D0
    cap 05[60] = MSI supports 1 message, 64 bit enabled with 1 message
    cap 10[70] = PCI-Express 1 root endpoint max data 128(128) FLR NS
    ecap 0002[100] = VC 1 max VC1
    ecap 0005[130] = Root Complex Link Declaration 1

pcib2@pci0:0:28:0:	class=0x060400 card=0x04981025 chip=0x3b428086 rev=0x05 hdr=0x01
    vendor     = 'Intel Corporation'
    device     = '5 Series/3400 Series Chipset PCI Express Root Port 1'
    class      = bridge
    subclass   = PCI-PCI
    cap 10[40] = PCI-Express 2 root port max data 128(128)
                 link x1(x1) speed 2.5(2.5) ASPM L1(L0s/L1)
                 slot 0 power limit 100 mW HotPlug(present) surprise
    cap 05[80] = MSI supports 1 message enabled with 1 message
    cap 0d[90] = PCI Bridge card=0x04981025
    cap 01[a0] = powerspec 2  supports D0 D3  current D0

pcib3@pci0:0:28:5:	class=0x060400 card=0x04981025 chip=0x3b4c8086 rev=0x05 hdr=0x01
    vendor     = 'Intel Corporation'
    device     = '5 Series/3400 Series Chipset PCI Express Root Port 6'
    class      = bridge
    subclass   = PCI-PCI
    cap 10[40] = PCI-Express 2 root port max data 128(128)
                 link x1(x1) speed 2.5(2.5) ASPM L1(L0s/L1)
                 slot 5 power limit 100 mW HotPlug(present) surprise
    cap 05[80] = MSI supports 1 message enabled with 1 message
    cap 0d[90] = PCI Bridge card=0x04981025
    cap 01[a0] = powerspec 2  supports D0 D3  current D0

ehci1@pci0:0:29:0:	class=0x0c0320 card=0x04981025 chip=0x3b348086 rev=0x05 hdr=0x00
    vendor     = 'Intel Corporation'
    device     = '5 Series/3400 Series Chipset USB2 Enhanced Host Controller'
    class      = serial bus
    subclass   = USB
    bar   [10] = type Memory, range 32, base 0xd4105000, size 1024, enabled
    cap 01[50] = powerspec 2  supports D0 D3  current D0
    cap 0a[58] = EHCI Debug Port at offset 0xa0 in map 0x14
    cap 13[98] = PCI Advanced Features: FLR TP

pcib4@pci0:0:30:0:	class=0x060401 card=0x04981025 chip=0x24488086 rev=0xa5 hdr=0x01
    vendor     = 'Intel Corporation'
    device     = '82801 Mobile PCI Bridge'
    class      = bridge
    subclass   = PCI-PCI
    cap 0d[50] = PCI Bridge card=0x04981025

isab0@pci0:0:31:0:	class=0x060100 card=0x04981025 chip=0x3b098086 rev=0x05 hdr=0x00
    vendor     = 'Intel Corporation'
    device     = 'HM55 Chipset LPC Interface Controller'
    class      = bridge
    subclass   = PCI-ISA
    cap 09[e0] = vendor (length 16) Intel cap 1 version 1

atapci0@pci0:0:31:2:	class=0x01018f card=0x04981025 chip=0x3b288086 rev=0x05 hdr=0x00
    vendor     = 'Intel Corporation'
    device     = '5 Series/3400 Series Chipset 4 port SATA IDE Controller'
    class      = mass storage
    subclass   = ATA
    bar   [10] = type I/O Port, range 32, base 0x4078, size 8, enabled
    bar   [14] = type I/O Port, range 32, base 0x408c, size 4, enabled
    bar   [18] = type I/O Port, range 32, base 0x4070, size 8, enabled
    bar   [1c] = type I/O Port, range 32, base 0x4088, size 4, enabled
    bar   [20] = type I/O Port, range 32, base 0x4050, size 16, enabled
    bar   [24] = type I/O Port, range 32, base 0x4040, size 16, enabled
    cap 01[70] = powerspec 3  supports D0 D3  current D0
    cap 13[b0] = PCI Advanced Features: FLR TP

none1@pci0:0:31:3:	class=0x0c0500 card=0x04981025 chip=0x3b308086 rev=0x05 hdr=0x00
    vendor     = 'Intel Corporation'
    device     = '5 Series/3400 Series Chipset SMBus Controller'
    class      = serial bus
    subclass   = SMBus
    bar   [10] = type Memory, range 64, base 0xd4105800, size 256, enabled
    bar   [20] = type I/O Port, range 32, base 0x4000, size 32, enabled

atapci1@pci0:0:31:5:	class=0x010185 card=0x04981025 chip=0x3b2d8086 rev=0x05 hdr=0x00
    vendor     = 'Intel Corporation'
    device     = '5 Series/3400 Series Chipset 2 port SATA IDE Controller'
    class      = mass storage
    subclass   = ATA
    bar   [10] = type I/O Port, range 32, base 0x4068, size 8, enabled
    bar   [14] = type I/O Port, range 32, base 0x4084, size 4, enabled
    bar   [18] = type I/O Port, range 32, base 0x4060, size 8, enabled
    bar   [1c] = type I/O Port, range 32, base 0x4080, size 4, enabled
    bar   [20] = type I/O Port, range 32, base 0x4030, size 16, enabled
    bar   [24] = type I/O Port, range 32, base 0x4020, size 16, enabled
    cap 01[70] = powerspec 3  supports D0 D3  current D0
    cap 13[b0] = PCI Advanced Features: FLR TP

vgapci0@pci0:1:0:0:	class=0x030000 card=0x04981025 chip=0x68e01002 rev=0x00 hdr=0x00
    vendor     = 'Advanced Micro Devices, Inc. [AMD/ATI]'
    device     = 'Park [Mobility Radeon HD 5430/5450/5470]'
    class      = display
    subclass   = VGA
    bar   [10] = type Prefetchable Memory, range 64, base 0xc0000000, size 268435456, enabled
    bar   [18] = type Memory, range 64, base 0xd4000000, size 131072, enabled
    bar   [20] = type I/O Port, range 32, base 0x3000, size 256, enabled
    cap 01[50] = powerspec 3  supports D0 D1 D2 D3  current D0
    cap 10[58] = PCI-Express 2 legacy endpoint max data 128(256) RO NS
                 link x16(x16) speed 2.5(2.5) ASPM L0s/L1(L0s/L1)
    cap 05[a0] = MSI supports 1 message, 64 bit enabled with 1 message
    ecap 000b[100] = Vendor 1 ID 1

hdac0@pci0:1:0:1:	class=0x040300 card=0x04981025 chip=0xaa681002 rev=0x00 hdr=0x00
    vendor     = 'Advanced Micro Devices, Inc. [AMD/ATI]'
    device     = 'Cedar HDMI Audio [Radeon HD 5400/6300/7300 Series]'
    class      = multimedia
    subclass   = HDA
    bar   [10] = type Memory, range 64, base 0xd4020000, size 16384, enabled
    cap 01[50] = powerspec 3  supports D0 D1 D2 D3  current D0
    cap 10[58] = PCI-Express 2 legacy endpoint max data 128(256) RO NS
                 link x16(x16) speed 2.5(2.5) ASPM L0s/L1(L0s/L1)
    cap 05[a0] = MSI supports 1 message, 64 bit enabled with 1 message
    ecap 000b[100] = Vendor 1 ID 1

bge0@pci0:2:0:0:	class=0x020000 card=0x047f1025 chip=0x169214e4 rev=0x01 hdr=0x00
    vendor     = 'Broadcom Inc. and subsidiaries'
    device     = 'NetLink BCM57780 Gigabit Ethernet PCIe'
    class      = network
    subclass   = ethernet
    bar   [10] = type Memory, range 64, base 0xd3000000, size 65536, enabled
    cap 01[48] = powerspec 3  supports D0 D3  current D0
    cap 09[60] = vendor (length 108)
    cap 05[50] = MSI supports 1 message, 64 bit enabled with 1 message
    cap 10[cc] = PCI-Express 2 endpoint max data 128(128)
                 link x1(x1) speed 2.5(2.5) ASPM L1(L0s/L1)
    ecap 0001[100] = AER 1 0 fatal 1 non-fatal 1 corrected
    ecap 0002[13c] = VC 1 max VC0
    ecap 0003[160] = Serial 1 60eb69fffe7bcb3f
    ecap 0004[16c] = Power Budgeting 1

bwn_pci0@pci0:3:0:0:	class=0x028000 card=0xe021105b chip=0x435714e4 rev=0x01 hdr=0x00
    vendor     = 'Broadcom Inc. and subsidiaries'
    device     = 'BCM43225 802.11b/g/n'
    class      = network
    bar   [10] = type Memory, range 64, base 0xd2000000, size 16384, enabled
    cap 01[40] = powerspec 3  supports D0 D1 D2 D3  current D0
    cap 09[58] = vendor (length 120)
    cap 05[48] = MSI supports 1 message, 64 bit 
    cap 10[d0] = PCI-Express 1 endpoint max data 128(128)
                 link x1(x1) speed 2.5(2.5) ASPM L1(L0s/L1)
    ecap 0001[100] = AER 1 0 fatal 0 non-fatal 1 corrected
    ecap 0002[13c] = VC 1 max VC0
    ecap 0003[160] = Serial 1 00006affffb118f4
    ecap 0004[16c] = Power Budgeting 1

hostb1@pci0:127:0:0:	class=0x060000 card=0x04981025 chip=0x2c628086 rev=0x05 hdr=0x00
    vendor     = 'Intel Corporation'
    device     = 'Core Processor QuickPath Architecture Generic Non-core Registers'
    class      = bridge
    subclass   = HOST-PCI

hostb2@pci0:127:0:1:	class=0x060000 card=0x04981025 chip=0x2d018086 rev=0x05 hdr=0x00
    vendor     = 'Intel Corporation'
    device     = 'Core Processor QuickPath Architecture System Address Decoder'
    class      = bridge
    subclass   = HOST-PCI

hostb3@pci0:127:2:0:	class=0x060000 card=0x04981025 chip=0x2d108086 rev=0x05 hdr=0x00
    vendor     = 'Intel Corporation'
    device     = 'Core Processor QPI Link 0'
    class      = bridge
    subclass   = HOST-PCI

hostb4@pci0:127:2:1:	class=0x060000 card=0x04981025 chip=0x2d118086 rev=0x05 hdr=0x00
    vendor     = 'Intel Corporation'
    device     = '1st Generation Core i3/5/7 Processor QPI Physical 0'
    class      = bridge
    subclass   = HOST-PCI

hostb5@pci0:127:2:2:	class=0x060000 card=0x04981025 chip=0x2d128086 rev=0x05 hdr=0x00
    vendor     = 'Intel Corporation'
    device     = '1st Generation Core i3/5/7 Processor Reserved'
    class      = bridge
    subclass   = HOST-PCI

hostb6@pci0:127:2:3:	class=0x060000 card=0x04981025 chip=0x2d138086 rev=0x05 hdr=0x00
    vendor     = 'Intel Corporation'
    device     = '1st Generation Core i3/5/7 Processor Reserved'
    class      = bridge
    subclass   = HOST-PCI
