hostb0@pci0:0:0:0:	class=0x060000 rev=0x01 hdr=0x00 vendor=0x8086 device=0x4c63 subvendor=0x15d9 subdevice=0x1c3b
    vendor     = 'Intel Corporation'
    class      = bridge
    subclass   = HOST-PCI

pcib1@pci0:0:1:0:	class=0x060400 rev=0x01 hdr=0x01 vendor=0x8086 device=0x4c01 subvendor=0x15d9 subdevice=0x1c3b
    vendor     = 'Intel Corporation'
    class      = bridge
    subclass   = PCI-PCI
    cap 10[40] = PCI-Express 2 root port max data 256(256) ARI enabled
                 max read 128
                 link x8(x16) speed 8.0(16.0) ASPM L1(L1)
                 slot 1 power limit 75000 mW
    cap 05[80] = MSI supports 1 message 
    cap 0d[90] = PCI Bridge subvendor=0x15d9 subdevice=0x1c3b
    cap 01[a0] = powerspec 3  supports D0 D3  current D0
    ecap 0001[100] = AER 1 1 fatal 0 non-fatal 1 corrected
    ecap 000d[220] = ACS 1
    ecap 001f[150] = Precision Time Measurement 1
    ecap 0002[280] = VC 1 max VC0
    ecap 001d[a00] = Downstream Port Containment 1
    ecap 0019[a30] = PCIe Sec 1 lane errors 0
    ecap 0025[a90] = Data Link Feature 1
    ecap 0026[a9c] = Physical Layer 16.0 GT/s 1
    ecap 0027[edc] = Lane Margining at Receiver 1

none0@pci0:0:8:0:	class=0x088000 rev=0x01 hdr=0x00 vendor=0x8086 device=0x4c11 subvendor=0x15d9 subdevice=0x1c3b
    vendor     = 'Intel Corporation'
    class      = base peripheral
    bar   [10] = type Memory, range 64, base 0x400402d000, size 4096, enabled
    cap 05[90] = MSI supports 1 message 
    cap 09[a0] = vendor (length 20) Intel cap 15 version 0
    cap 01[dc] = powerspec 2  supports D0 D3  current D0
    cap 13[f0] = PCI Advanced Features: FLR TP

none1@pci0:0:18:0:	class=0x070000 rev=0x11 hdr=0x00 vendor=0x8086 device=0x43fc subvendor=0x15d9 subdevice=0x1c3b
    vendor     = 'Intel Corporation'
    class      = simple comms
    subclass   = UART
    bar   [10] = type Memory, range 64, base 0x4004010000, size 65536, enabled
    cap 01[80] = powerspec 3  supports D0 D3  current D0
    cap 09[90] = vendor (length 20) Intel cap 15 version 0

xhci0@pci0:0:20:0:	class=0x0c0330 rev=0x11 hdr=0x00 vendor=0x8086 device=0x43ed subvendor=0x15d9 subdevice=0x1c3b
    vendor     = 'Intel Corporation'
    device     = 'Tiger Lake-H USB 3.2 Gen 2x1 xHCI Host Controller'
    class      = serial bus
    subclass   = USB
    bar   [10] = type Memory, range 64, base 0x4004000000, size 65536, enabled
    cap 01[70] = powerspec 2  supports D0 D3  current D0
    cap 05[80] = MSI supports 8 messages, 64 bit enabled with 1 message
    cap 09[90] = vendor (length 20) Intel cap 15 version 0
    cap 09[b0] = vendor (length 0) Intel cap 0 version 1

none2@pci0:0:20:2:	class=0x050000 rev=0x11 hdr=0x00 vendor=0x8086 device=0x43ef subvendor=0x0000 subdevice=0x0000
    vendor     = 'Intel Corporation'
    device     = 'Tiger Lake-H Shared SRAM'
    class      = memory
    subclass   = RAM
    bar   [10] = type Memory, range 64, base 0x4004020000, size 16384, enabled
    bar   [18] = type Memory, range 64, base 0x400402c000, size 4096, enabled
    cap 01[80] = powerspec 3  supports D0 D3  current D0

ig4iic0@pci0:0:21:0:	class=0x0c8000 rev=0x11 hdr=0x00 vendor=0x8086 device=0x43e8 subvendor=0x15d9 subdevice=0x1c3b
    vendor     = 'Intel Corporation'
    device     = 'Tiger Lake-H Serial IO I2C Controller'
    class      = serial bus
    bar   [10] = type Memory, range 64, base 0xa1504000, size 4096, enabled
    cap 01[80] = powerspec 3  supports D0 D3  current D0
    cap 09[90] = vendor (length 20) Intel cap 15 version 0

ig4iic1@pci0:0:21:1:	class=0x0c8000 rev=0x11 hdr=0x00 vendor=0x8086 device=0x43e9 subvendor=0x15d9 subdevice=0x1c3b
    vendor     = 'Intel Corporation'
    class      = serial bus
    bar   [10] = type Memory, range 64, base 0xa1505000, size 4096, enabled
    cap 01[80] = powerspec 3  supports D0 D3  current D0
    cap 09[90] = vendor (length 20) Intel cap 15 version 0

ig4iic2@pci0:0:21:3:	class=0x0c8000 rev=0x11 hdr=0x00 vendor=0x8086 device=0x43eb subvendor=0x15d9 subdevice=0x1c3b
    vendor     = 'Intel Corporation'
    class      = serial bus
    bar   [10] = type Memory, range 64, base 0xa1506000, size 4096, enabled
    cap 01[80] = powerspec 3  supports D0 D3  current D0
    cap 09[90] = vendor (length 20) Intel cap 15 version 0

none3@pci0:0:22:0:	class=0x078000 rev=0x11 hdr=0x00 vendor=0x8086 device=0x43e0 subvendor=0x15d9 subdevice=0x1c3b
    vendor     = 'Intel Corporation'
    device     = 'Tiger Lake-H Management Engine Interface'
    class      = simple comms
    bar   [10] = type Memory, range 64, base 0x4004028000, size 4096, enabled
    cap 01[50] = powerspec 3  supports D0 D3  current D0
    cap 05[8c] = MSI supports 1 message, 64 bit 
    cap 09[a4] = vendor (length 20) Intel cap 15 version 0

none4@pci0:0:22:4:	class=0x078000 rev=0x11 hdr=0x00 vendor=0x8086 device=0x43e4 subvendor=0x15d9 subdevice=0x1c3b
    vendor     = 'Intel Corporation'
    class      = simple comms
    bar   [10] = type Memory, range 64, base 0x4004027000, size 4096, enabled
    cap 01[50] = powerspec 3  supports D0 D3  current D0
    cap 05[8c] = MSI supports 1 message, 64 bit 
    cap 09[a4] = vendor (length 20) Intel cap 15 version 0

ahci0@pci0:0:23:0:	class=0x010601 rev=0x11 hdr=0x00 vendor=0x8086 device=0x43d2 subvendor=0x15d9 subdevice=0x1c3b
    vendor     = 'Intel Corporation'
    class      = mass storage
    subclass   = SATA
    bar   [10] = type Memory, range 32, base 0xa1500000, size 8192, enabled
    bar   [14] = type Memory, range 32, base 0xa1503000, size 256, enabled
    bar   [18] = type I/O Port, range 32, base 0x6050, size 8, enabled
    bar   [1c] = type I/O Port, range 32, base 0x6040, size 4, enabled
    bar   [20] = type I/O Port, range 32, base 0x6020, size 32, enabled
    bar   [24] = type Memory, range 32, base 0xa1502000, size 2048, enabled
    cap 05[80] = MSI supports 1 message enabled with 1 message
    cap 01[70] = powerspec 3  supports D0 D3  current D0
    cap 12[a8] = SATA Index-Data Pair

ig4iic3@pci0:0:25:0:	class=0x0c8000 rev=0x11 hdr=0x00 vendor=0x8086 device=0x43ad subvendor=0x15d9 subdevice=0x1c3b
    vendor     = 'Intel Corporation'
    class      = serial bus
    bar   [10] = type Memory, range 64, base 0xa1507000, size 4096, enabled
    cap 01[80] = powerspec 3  supports D0 D3  current D0
    cap 09[90] = vendor (length 20) Intel cap 15 version 0

ig4iic4@pci0:0:25:1:	class=0x0c8000 rev=0x11 hdr=0x00 vendor=0x8086 device=0x43ae subvendor=0x15d9 subdevice=0x1c3b
    vendor     = 'Intel Corporation'
    class      = serial bus
    bar   [10] = type Memory, range 64, base 0xa1508000, size 4096, enabled
    cap 01[80] = powerspec 3  supports D0 D3  current D0
    cap 09[90] = vendor (length 20) Intel cap 15 version 0

pcib2@pci0:0:28:0:	class=0x060400 rev=0x11 hdr=0x01 vendor=0x8086 device=0x43b8 subvendor=0x15d9 subdevice=0x1c3b
    vendor     = 'Intel Corporation'
    class      = bridge
    subclass   = PCI-PCI
    cap 10[40] = PCI-Express 2 root port max data 128(256) ARI disabled
                 max read 128
                 link x0(x1) speed 0.0(8.0) ASPM L0s/L1(L0s/L1)
                 slot 0 power limit 0 mW HotPlug(empty) surprise
    cap 05[80] = MSI supports 1 message enabled with 1 message
    cap 0d[90] = PCI Bridge subvendor=0x15d9 subdevice=0x1c3b
    cap 01[a0] = powerspec 3  supports D0 D3  current D0

pcib3@pci0:0:28:1:	class=0x060400 rev=0x11 hdr=0x01 vendor=0x8086 device=0x43b9 subvendor=0x15d9 subdevice=0x1c3b
    vendor     = 'Intel Corporation'
    class      = bridge
    subclass   = PCI-PCI
    cap 10[40] = PCI-Express 2 root port max data 256(256) ARI disabled
                 max read 128
                 link x1(x1) speed 5.0(8.0) ASPM disabled(L0s/L1)
                 slot 5 power limit 100 mW
    cap 05[80] = MSI supports 1 message 
    cap 0d[90] = PCI Bridge subvendor=0x15d9 subdevice=0x1c3b
    cap 01[a0] = powerspec 3  supports D0 D3  current D0
    ecap 0001[100] = AER 1 0 fatal 0 non-fatal 0 corrected
    ecap 000d[220] = ACS 1
    ecap 001f[150] = Precision Time Measurement 1
    ecap 0019[a30] = PCIe Sec 1 lane errors 0
    ecap 001d[a00] = Downstream Port Containment 1

pcib5@pci0:0:29:0:	class=0x060400 rev=0x11 hdr=0x01 vendor=0x8086 device=0x43b0 subvendor=0x15d9 subdevice=0x1c3b
    vendor     = 'Intel Corporation'
    device     = 'Tiger Lake-H PCI Express Root Port'
    class      = bridge
    subclass   = PCI-PCI
    cap 10[40] = PCI-Express 2 root port max data 256(256) ARI disabled
                 max read 128
                 link x1(x1) speed 2.5(8.0) ASPM L1(L0s/L1)
                 slot 12 power limit 100 mW
    cap 05[80] = MSI supports 1 message 
    cap 0d[90] = PCI Bridge subvendor=0x15d9 subdevice=0x1c3b
    cap 01[a0] = powerspec 3  supports D0 D3  current D0
    ecap 0001[100] = AER 1 0 fatal 0 non-fatal 0 corrected
    ecap 000d[220] = ACS 1
    ecap 001f[150] = Precision Time Measurement 1
    ecap 0019[a30] = PCIe Sec 1 lane errors 0
    ecap 001d[a00] = Downstream Port Containment 1

pcib6@pci0:0:29:2:	class=0x060400 rev=0x11 hdr=0x01 vendor=0x8086 device=0x43b2 subvendor=0x15d9 subdevice=0x1c3b
    vendor     = 'Intel Corporation'
    class      = bridge
    subclass   = PCI-PCI
    cap 10[40] = PCI-Express 2 root port max data 256(256) ARI disabled
                 max read 128
                 link x1(x1) speed 2.5(8.0) ASPM L1(L0s/L1)
                 slot 14 power limit 100 mW
    cap 05[80] = MSI supports 1 message 
    cap 0d[90] = PCI Bridge subvendor=0x15d9 subdevice=0x1c3b
    cap 01[a0] = powerspec 3  supports D0 D3  current D0
    ecap 0001[100] = AER 1 0 fatal 0 non-fatal 0 corrected
    ecap 000d[220] = ACS 1
    ecap 001f[150] = Precision Time Measurement 1
    ecap 0019[a30] = PCIe Sec 1 lane errors 0
    ecap 001d[a00] = Downstream Port Containment 1

isab0@pci0:0:31:0:	class=0x060100 rev=0x11 hdr=0x00 vendor=0x8086 device=0x438c subvendor=0x15d9 subdevice=0x1c3b
    vendor     = 'Intel Corporation'
    class      = bridge
    subclass   = PCI-ISA

ichsmb0@pci0:0:31:4:	class=0x0c0500 rev=0x11 hdr=0x00 vendor=0x8086 device=0x43a3 subvendor=0x15d9 subdevice=0x1c3b
    vendor     = 'Intel Corporation'
    device     = 'Tiger Lake-H SMBus Controller'
    class      = serial bus
    subclass   = SMBus
    bar   [10] = type Memory, range 64, base 0x4004024000, size 256, enabled
    bar   [20] = type I/O Port, range 32, base 0xefa0, size 32, enabled

none5@pci0:0:31:5:	class=0x0c8000 rev=0x11 hdr=0x00 vendor=0x8086 device=0x43a4 subvendor=0x15d9 subdevice=0x1c3b
    vendor     = 'Intel Corporation'
    device     = 'Tiger Lake-H SPI Controller'
    class      = serial bus
    bar   [10] = type Memory, range 32, base 0xfe010000, size 4096, enabled

mlx5_core0@pci0:1:0:0:	class=0x020000 rev=0x00 hdr=0x00 vendor=0x15b3 device=0x1015 subvendor=0x15b3 subdevice=0x0004
    vendor     = 'Mellanox Technologies'
    device     = 'MT27710 Family [ConnectX-4 Lx]'
    class      = network
    subclass   = ethernet
    bar   [10] = type Prefetchable Memory, range 64, base 0x4002000000, size 33554432, enabled
    cap 10[60] = PCI-Express 2 endpoint max data 256(512) FLR RO NS
                 max read 512
                 link x8(x8) speed 8.0(8.0) ASPM L1(L1)
    cap 03[48] = VPD
    cap 11[9c] = MSI-X supports 64 messages, enabled
                 Table in map 0x10[0x2000], PBA in map 0x10[0x3000]
    cap 09[c0] = vendor (length 24)
    cap 01[40] = powerspec 3  supports D0 D3  current D0
    ecap 0001[100] = AER 1 0 fatal 0 non-fatal 1 corrected
    ecap 000e[150] = ARI 1
    ecap 0010[180] = SR-IOV 1 IOV disabled, Memory Space disabled, ARI disabled
                     0 VFs configured out of 8 supported
                     First VF RID Offset 0x0002, VF RID Stride 0x0001
                     VF Device ID 0x1016
                     Page Sizes: 4096 (enabled), 8192, 16384, 32768, 65536, 131072, 262144, 524288, 1048576, 2097152, 4194304
    ecap 0019[1c0] = PCIe Sec 1 lane errors 0
    ecap 000d[230] = ACS 1

mlx5_core1@pci0:1:0:1:	class=0x020000 rev=0x00 hdr=0x00 vendor=0x15b3 device=0x1015 subvendor=0x15b3 subdevice=0x0004
    vendor     = 'Mellanox Technologies'
    device     = 'MT27710 Family [ConnectX-4 Lx]'
    class      = network
    subclass   = ethernet
    bar   [10] = type Prefetchable Memory, range 64, base 0x4000000000, size 33554432, enabled
    cap 10[60] = PCI-Express 2 endpoint max data 256(512) FLR RO NS
                 max read 512
                 link x8(x8) speed 8.0(8.0) ASPM L1(L1)
    cap 03[48] = VPD
    cap 11[9c] = MSI-X supports 64 messages, enabled
                 Table in map 0x10[0x2000], PBA in map 0x10[0x3000]
    cap 09[c0] = vendor (length 24)
    cap 01[40] = powerspec 3  supports D0 D3  current D0
    ecap 0001[100] = AER 1 0 fatal 0 non-fatal 1 corrected
    ecap 000e[150] = ARI 1
    ecap 0010[180] = SR-IOV 1 IOV disabled, Memory Space disabled, ARI disabled
                     0 VFs configured out of 8 supported
                     First VF RID Offset 0x0009, VF RID Stride 0x0001
                     VF Device ID 0x1016
                     Page Sizes: 4096 (enabled), 8192, 16384, 32768, 65536, 131072, 262144, 524288, 1048576, 2097152, 4194304
    ecap 000d[230] = ACS 1

pcib4@pci0:3:0:0:	class=0x060400 rev=0x06 hdr=0x01 vendor=0x1a03 device=0x1150 subvendor=0x15d9 subdevice=0x1c3b
    vendor     = 'ASPEED Technology, Inc.'
    device     = 'AST1150 PCI-to-PCI Bridge'
    class      = bridge
    subclass   = PCI-PCI
    cap 05[50] = MSI supports 32 messages, 64 bit 
    cap 01[78] = powerspec 3  supports D0 D1 D2 D3  current D0
    cap 10[80] = PCI-Express 2 PCI bridge max data 256(512) RO NS
                 max read 512
                 link x1(x1) speed 5.0(5.0) ASPM disabled(L0s/L1)
    cap 0d[c0] = PCI Bridge subvendor=0x15d9 subdevice=0x1c3b
    ecap 0002[100] = VC 1 max VC0
    ecap 0023[200] = Designated Vendor-Specific 1
    ecap 0023[2c0] = Designated Vendor-Specific 1
    ecap 0001[800] = AER 1 0 fatal 0 non-fatal 1 corrected

vgapci0@pci0:4:0:0:	class=0x030000 rev=0x52 hdr=0x00 vendor=0x1a03 device=0x2000 subvendor=0x15d9 subdevice=0x1c3b
    vendor     = 'ASPEED Technology, Inc.'
    device     = 'ASPEED Graphics Family'
    class      = display
    subclass   = VGA
    bar   [10] = type Memory, range 32, base 0xa0000000, size 16777216, enabled
    bar   [14] = type Memory, range 32, base 0xa1000000, size 262144, enabled
    bar   [18] = type I/O Port, range 32, base 0x5000, size 128, enabled
    cap 01[40] = powerspec 3  supports D0 D1 D2 D3  current D0
    cap 05[50] = MSI supports 4 messages, 64 bit 

igb0@pci0:5:0:0:	class=0x020000 rev=0x03 hdr=0x00 vendor=0x8086 device=0x1533 subvendor=0x15d9 subdevice=0x1533
    vendor     = 'Intel Corporation'
    device     = 'I210 Gigabit Network Connection'
    class      = network
    subclass   = ethernet
    bar   [10] = type Memory, range 32, base 0xa1400000, size 524288, enabled
    bar   [18] = type I/O Port, range 32, base 0x4000, size 32, enabled
    bar   [1c] = type Memory, range 32, base 0xa1480000, size 16384, enabled
    cap 01[40] = powerspec 3  supports D0 D3  current D0
    cap 05[50] = MSI supports 1 message, 64 bit, vector masks 
    cap 11[70] = MSI-X supports 5 messages, enabled
                 Table in map 0x1c[0x0], PBA in map 0x1c[0x2000]
    cap 10[a0] = PCI-Express 2 endpoint max data 256(512) FLR RO NS
                 max read 512
                 link x1(x1) speed 2.5(2.5) ASPM L1(L0s/L1)
    ecap 0001[100] = AER 2 0 fatal 0 non-fatal 1 corrected
    ecap 0003[140] = Serial 1 3cecefffff7e6ae0
    ecap 0017[1a0] = TPH Requester 1

igb1@pci0:6:0:0:	class=0x020000 rev=0x03 hdr=0x00 vendor=0x8086 device=0x1533 subvendor=0x15d9 subdevice=0x1533
    vendor     = 'Intel Corporation'
    device     = 'I210 Gigabit Network Connection'
    class      = network
    subclass   = ethernet
    bar   [10] = type Memory, range 32, base 0xa1300000, size 524288, enabled
    bar   [18] = type I/O Port, range 32, base 0x3000, size 32, enabled
    bar   [1c] = type Memory, range 32, base 0xa1380000, size 16384, enabled
    cap 01[40] = powerspec 3  supports D0 D3  current D0
    cap 05[50] = MSI supports 1 message, 64 bit, vector masks 
    cap 11[70] = MSI-X supports 5 messages, enabled
                 Table in map 0x1c[0x0], PBA in map 0x1c[0x2000]
    cap 10[a0] = PCI-Express 2 endpoint max data 256(512) FLR RO NS
                 max read 512
                 link x1(x1) speed 2.5(2.5) ASPM L1(L0s/L1)
    ecap 0001[100] = AER 2 0 fatal 0 non-fatal 0 corrected
    ecap 0003[140] = Serial 1 3cecefffff7e6ae1
    ecap 0017[1a0] = TPH Requester 1
