hostb0@pci0:0:0:0:	class=0x060000 rev=0x00 hdr=0x00 vendor=0x1022 device=0x1480 subvendor=0x1043 subdevice=0x87c0
    vendor     = 'Advanced Micro Devices, Inc. [AMD]'
    device     = 'Starship/Matisse Root Complex'
    class      = bridge
    subclass   = HOST-PCI

none0@pci0:0:0:2:	class=0x080600 rev=0x00 hdr=0x00 vendor=0x1022 device=0x1481 subvendor=0x1043 subdevice=0x87c0
    vendor     = 'Advanced Micro Devices, Inc. [AMD]'
    device     = 'Starship/Matisse IOMMU'
    class      = base peripheral
    subclass   = IOMMU
    cap 0f[40] = unknown
    cap 05[64] = MSI supports 4 messages, 64 bit 
    cap 08[74] = HT MSI fixed address window enabled at 0xfee00000
    cap 09[c8] = vendor (length 24)

hostb1@pci0:0:1:0:	class=0x060000 rev=0x00 hdr=0x00 vendor=0x1022 device=0x1482 subvendor=0x0000 subdevice=0x0000
    vendor     = 'Advanced Micro Devices, Inc. [AMD]'
    device     = 'Starship/Matisse PCIe Dummy Host Bridge'
    class      = bridge
    subclass   = HOST-PCI

pcib1@pci0:0:1:2:	class=0x060400 rev=0x00 hdr=0x01 vendor=0x1022 device=0x1483 subvendor=0x1043 subdevice=0x87c0
    vendor     = 'Advanced Micro Devices, Inc. [AMD]'
    device     = 'Starship/Matisse GPP Bridge'
    class      = bridge
    subclass   = PCI-PCI
    cap 01[50] = powerspec 3  supports D0 D3  current D0
    cap 10[58] = PCI-Express 2 root port max data 256(512) RO NS
                 max read 512
                 link x4(x8) speed 16.0(16.0) ASPM disabled(L1)
                 slot 0 power limit 0 mW
    cap 05[a0] = MSI supports 1 message, 64 bit 
    cap 0d[c0] = PCI Bridge subvendor=0x1043 subdevice=0x87c0
    cap 08[c8] = HT MSI fixed address window enabled at 0xfee00000
    ecap 000b[100] = Vendor [1] ID 0001 Rev 1 Length 16
    ecap 0019[270] = PCIe Sec 1 lane errors 0x1
    ecap 000d[2a0] = ACS 1
    ecap 001e[370] = L1 PM Substates 1
    ecap 0023[3c4] = Designated Vendor-Specific 1
    ecap 0025[400] = Data Link Feature 1
    ecap 0026[410] = Physical Layer 16.0 GT/s 1
    ecap 0027[440] = Lane Margining at Receiver 1

hostb2@pci0:0:2:0:	class=0x060000 rev=0x00 hdr=0x00 vendor=0x1022 device=0x1482 subvendor=0x0000 subdevice=0x0000
    vendor     = 'Advanced Micro Devices, Inc. [AMD]'
    device     = 'Starship/Matisse PCIe Dummy Host Bridge'
    class      = bridge
    subclass   = HOST-PCI

hostb3@pci0:0:3:0:	class=0x060000 rev=0x00 hdr=0x00 vendor=0x1022 device=0x1482 subvendor=0x0000 subdevice=0x0000
    vendor     = 'Advanced Micro Devices, Inc. [AMD]'
    device     = 'Starship/Matisse PCIe Dummy Host Bridge'
    class      = bridge
    subclass   = HOST-PCI

pcib11@pci0:0:3:1:	class=0x060400 rev=0x00 hdr=0x01 vendor=0x1022 device=0x1483 subvendor=0x1043 subdevice=0x87c0
    vendor     = 'Advanced Micro Devices, Inc. [AMD]'
    device     = 'Starship/Matisse GPP Bridge'
    class      = bridge
    subclass   = PCI-PCI
    cap 01[50] = powerspec 3  supports D0 D3  current D0
    cap 10[58] = PCI-Express 2 root port max data 256(512) RO NS
                 max read 512
                 link x8(x8) speed 2.5(16.0) ASPM disabled(L1)
                 slot 0 power limit 0 mW
    cap 05[a0] = MSI supports 1 message, 64 bit 
    cap 0d[c0] = PCI Bridge subvendor=0x1043 subdevice=0x87c0
    cap 08[c8] = HT MSI fixed address window enabled at 0xfee00000
    ecap 000b[100] = Vendor [1] ID 0001 Rev 1 Length 16
    ecap 0019[270] = PCIe Sec 1 lane errors 0xff
    ecap 000d[2a0] = ACS 1
    ecap 001e[370] = L1 PM Substates 1
    ecap 0023[3c4] = Designated Vendor-Specific 1
    ecap 0025[400] = Data Link Feature 1
    ecap 0026[410] = Physical Layer 16.0 GT/s 1
    ecap 0027[440] = Lane Margining at Receiver 1

pcib12@pci0:0:3:2:	class=0x060400 rev=0x00 hdr=0x01 vendor=0x1022 device=0x1483 subvendor=0x1043 subdevice=0x87c0
    vendor     = 'Advanced Micro Devices, Inc. [AMD]'
    device     = 'Starship/Matisse GPP Bridge'
    class      = bridge
    subclass   = PCI-PCI
    cap 01[50] = powerspec 3  supports D0 D3  current D0
    cap 10[58] = PCI-Express 2 root port max data 512(512) RO NS
                 max read 512
                 link x8(x8) speed 5.0(16.0) ASPM disabled(L1)
                 slot 0 power limit 0 mW
    cap 05[a0] = MSI supports 1 message, 64 bit 
    cap 0d[c0] = PCI Bridge subvendor=0x1043 subdevice=0x87c0
    cap 08[c8] = HT MSI fixed address window enabled at 0xfee00000
    ecap 000b[100] = Vendor [1] ID 0001 Rev 1 Length 16
    ecap 0019[270] = PCIe Sec 1 lane errors 0xff
    ecap 000d[2a0] = ACS 1
    ecap 001e[370] = L1 PM Substates 1
    ecap 0023[3c4] = Designated Vendor-Specific 1
    ecap 0025[400] = Data Link Feature 1
    ecap 0026[410] = Physical Layer 16.0 GT/s 1
    ecap 0027[440] = Lane Margining at Receiver 1

hostb4@pci0:0:4:0:	class=0x060000 rev=0x00 hdr=0x00 vendor=0x1022 device=0x1482 subvendor=0x0000 subdevice=0x0000
    vendor     = 'Advanced Micro Devices, Inc. [AMD]'
    device     = 'Starship/Matisse PCIe Dummy Host Bridge'
    class      = bridge
    subclass   = HOST-PCI

hostb5@pci0:0:5:0:	class=0x060000 rev=0x00 hdr=0x00 vendor=0x1022 device=0x1482 subvendor=0x0000 subdevice=0x0000
    vendor     = 'Advanced Micro Devices, Inc. [AMD]'
    device     = 'Starship/Matisse PCIe Dummy Host Bridge'
    class      = bridge
    subclass   = HOST-PCI

hostb6@pci0:0:7:0:	class=0x060000 rev=0x00 hdr=0x00 vendor=0x1022 device=0x1482 subvendor=0x0000 subdevice=0x0000
    vendor     = 'Advanced Micro Devices, Inc. [AMD]'
    device     = 'Starship/Matisse PCIe Dummy Host Bridge'
    class      = bridge
    subclass   = HOST-PCI

pcib13@pci0:0:7:1:	class=0x060400 rev=0x00 hdr=0x01 vendor=0x1022 device=0x1484 subvendor=0x1022 subdevice=0x1484
    vendor     = 'Advanced Micro Devices, Inc. [AMD]'
    device     = 'Starship/Matisse Internal PCIe GPP Bridge 0 to bus[E:B]'
    class      = bridge
    subclass   = PCI-PCI
    cap 01[50] = powerspec 3  supports D0 D3  current D0
    cap 10[58] = PCI-Express 2 root port max data 256(512) RO NS
                 max read 512
                 link x16(x16) speed 16.0(16.0) ASPM disabled(L0s/L1)
    cap 05[a0] = MSI supports 1 message, 64 bit 
    cap 0d[c0] = PCI Bridge subvendor=0x1022 subdevice=0x1484
    cap 08[c8] = HT MSI fixed address window enabled at 0xfee00000
    ecap 000b[100] = Vendor [1] ID 0001 Rev 1 Length 16
    ecap 0001[150] = AER 2 0 fatal 0 non-fatal 0 corrected
    ecap 0019[270] = PCIe Sec 1 lane errors 0
    ecap 000d[2a0] = ACS 1
    ecap 0025[400] = Data Link Feature 1
    ecap 0026[410] = Physical Layer 16.0 GT/s 1
    ecap 0027[440] = Lane Margining at Receiver 1

hostb7@pci0:0:8:0:	class=0x060000 rev=0x00 hdr=0x00 vendor=0x1022 device=0x1482 subvendor=0x0000 subdevice=0x0000
    vendor     = 'Advanced Micro Devices, Inc. [AMD]'
    device     = 'Starship/Matisse PCIe Dummy Host Bridge'
    class      = bridge
    subclass   = HOST-PCI

pcib14@pci0:0:8:1:	class=0x060400 rev=0x00 hdr=0x01 vendor=0x1022 device=0x1484 subvendor=0x1022 subdevice=0x1484
    vendor     = 'Advanced Micro Devices, Inc. [AMD]'
    device     = 'Starship/Matisse Internal PCIe GPP Bridge 0 to bus[E:B]'
    class      = bridge
    subclass   = PCI-PCI
    cap 01[50] = powerspec 3  supports D0 D3  current D0
    cap 10[58] = PCI-Express 2 root port max data 256(512) RO NS
                 max read 512
                 link x16(x16) speed 16.0(16.0) ASPM disabled(L0s/L1)
    cap 05[a0] = MSI supports 1 message, 64 bit 
    cap 0d[c0] = PCI Bridge subvendor=0x1022 subdevice=0x1484
    cap 08[c8] = HT MSI fixed address window enabled at 0xfee00000
    ecap 000b[100] = Vendor [1] ID 0001 Rev 1 Length 16
    ecap 0001[150] = AER 2 0 fatal 0 non-fatal 0 corrected
    ecap 0019[270] = PCIe Sec 1 lane errors 0
    ecap 000d[2a0] = ACS 1
    ecap 0025[400] = Data Link Feature 1
    ecap 0026[410] = Physical Layer 16.0 GT/s 1
    ecap 0027[440] = Lane Margining at Receiver 1

pcib15@pci0:0:8:2:	class=0x060400 rev=0x00 hdr=0x01 vendor=0x1022 device=0x1484 subvendor=0x1022 subdevice=0x1484
    vendor     = 'Advanced Micro Devices, Inc. [AMD]'
    device     = 'Starship/Matisse Internal PCIe GPP Bridge 0 to bus[E:B]'
    class      = bridge
    subclass   = PCI-PCI
    cap 01[50] = powerspec 3  supports D0 D3  current D0
    cap 10[58] = PCI-Express 2 root port max data 256(512) RO NS
                 max read 512
                 link x16(x16) speed 16.0(16.0) ASPM disabled(L0s/L1)
    cap 05[a0] = MSI supports 1 message, 64 bit 
    cap 0d[c0] = PCI Bridge subvendor=0x1022 subdevice=0x1484
    cap 08[c8] = HT MSI fixed address window enabled at 0xfee00000
    ecap 000b[100] = Vendor [1] ID 0001 Rev 1 Length 16
    ecap 0001[150] = AER 2 0 fatal 0 non-fatal 0 corrected
    ecap 0019[270] = PCIe Sec 1 lane errors 0
    ecap 000d[2a0] = ACS 1
    ecap 0025[400] = Data Link Feature 1
    ecap 0026[410] = Physical Layer 16.0 GT/s 1
    ecap 0027[440] = Lane Margining at Receiver 1

pcib16@pci0:0:8:3:	class=0x060400 rev=0x00 hdr=0x01 vendor=0x1022 device=0x1484 subvendor=0x1022 subdevice=0x1484
    vendor     = 'Advanced Micro Devices, Inc. [AMD]'
    device     = 'Starship/Matisse Internal PCIe GPP Bridge 0 to bus[E:B]'
    class      = bridge
    subclass   = PCI-PCI
    cap 01[50] = powerspec 3  supports D0 D3  current D0
    cap 10[58] = PCI-Express 2 root port max data 256(512) RO NS
                 max read 512
                 link x16(x16) speed 16.0(16.0) ASPM disabled(L0s/L1)
    cap 05[a0] = MSI supports 1 message, 64 bit 
    cap 0d[c0] = PCI Bridge subvendor=0x1022 subdevice=0x1484
    cap 08[c8] = HT MSI fixed address window enabled at 0xfee00000
    ecap 000b[100] = Vendor [1] ID 0001 Rev 1 Length 16
    ecap 0001[150] = AER 2 0 fatal 0 non-fatal 0 corrected
    ecap 0019[270] = PCIe Sec 1 lane errors 0
    ecap 000d[2a0] = ACS 1
    ecap 0025[400] = Data Link Feature 1
    ecap 0026[410] = Physical Layer 16.0 GT/s 1
    ecap 0027[440] = Lane Margining at Receiver 1

intsmb0@pci0:0:20:0:	class=0x0c0500 rev=0x61 hdr=0x00 vendor=0x1022 device=0x790b subvendor=0x1043 subdevice=0x87c0
    vendor     = 'Advanced Micro Devices, Inc. [AMD]'
    device     = 'FCH SMBus Controller'
    class      = serial bus
    subclass   = SMBus

isab0@pci0:0:20:3:	class=0x060100 rev=0x51 hdr=0x00 vendor=0x1022 device=0x790e subvendor=0x1043 subdevice=0x87c0
    vendor     = 'Advanced Micro Devices, Inc. [AMD]'
    device     = 'FCH LPC Bridge'
    class      = bridge
    subclass   = PCI-ISA

hostb8@pci0:0:24:0:	class=0x060000 rev=0x00 hdr=0x00 vendor=0x1022 device=0x1440 subvendor=0x0000 subdevice=0x0000
    vendor     = 'Advanced Micro Devices, Inc. [AMD]'
    device     = 'Matisse/Vermeer Data Fabric: Device 18h; Function 0'
    class      = bridge
    subclass   = HOST-PCI

hostb9@pci0:0:24:1:	class=0x060000 rev=0x00 hdr=0x00 vendor=0x1022 device=0x1441 subvendor=0x0000 subdevice=0x0000
    vendor     = 'Advanced Micro Devices, Inc. [AMD]'
    device     = 'Matisse/Vermeer Data Fabric: Device 18h; Function 1'
    class      = bridge
    subclass   = HOST-PCI

hostb10@pci0:0:24:2:	class=0x060000 rev=0x00 hdr=0x00 vendor=0x1022 device=0x1442 subvendor=0x0000 subdevice=0x0000
    vendor     = 'Advanced Micro Devices, Inc. [AMD]'
    device     = 'Matisse/Vermeer Data Fabric: Device 18h; Function 2'
    class      = bridge
    subclass   = HOST-PCI

hostb11@pci0:0:24:3:	class=0x060000 rev=0x00 hdr=0x00 vendor=0x1022 device=0x1443 subvendor=0x0000 subdevice=0x0000
    vendor     = 'Advanced Micro Devices, Inc. [AMD]'
    device     = 'Matisse/Vermeer Data Fabric: Device 18h; Function 3'
    class      = bridge
    subclass   = HOST-PCI

hostb12@pci0:0:24:4:	class=0x060000 rev=0x00 hdr=0x00 vendor=0x1022 device=0x1444 subvendor=0x0000 subdevice=0x0000
    vendor     = 'Advanced Micro Devices, Inc. [AMD]'
    device     = 'Matisse/Vermeer Data Fabric: Device 18h; Function 4'
    class      = bridge
    subclass   = HOST-PCI

hostb13@pci0:0:24:5:	class=0x060000 rev=0x00 hdr=0x00 vendor=0x1022 device=0x1445 subvendor=0x0000 subdevice=0x0000
    vendor     = 'Advanced Micro Devices, Inc. [AMD]'
    device     = 'Matisse/Vermeer Data Fabric: Device 18h; Function 5'
    class      = bridge
    subclass   = HOST-PCI

hostb14@pci0:0:24:6:	class=0x060000 rev=0x00 hdr=0x00 vendor=0x1022 device=0x1446 subvendor=0x0000 subdevice=0x0000
    vendor     = 'Advanced Micro Devices, Inc. [AMD]'
    device     = 'Matisse/Vermeer Data Fabric: Device 18h; Function 6'
    class      = bridge
    subclass   = HOST-PCI

hostb15@pci0:0:24:7:	class=0x060000 rev=0x00 hdr=0x00 vendor=0x1022 device=0x1447 subvendor=0x0000 subdevice=0x0000
    vendor     = 'Advanced Micro Devices, Inc. [AMD]'
    device     = 'Matisse/Vermeer Data Fabric: Device 18h; Function 7'
    class      = bridge
    subclass   = HOST-PCI

pcib2@pci0:1:0:0:	class=0x060400 rev=0x00 hdr=0x01 vendor=0x1022 device=0x57ad subvendor=0x0000 subdevice=0x0000
    vendor     = 'Advanced Micro Devices, Inc. [AMD]'
    device     = 'Matisse Switch Upstream'
    class      = bridge
    subclass   = PCI-PCI
    cap 01[50] = powerspec 3  supports D0 D3  current D0
    cap 10[58] = PCI-Express 2 upstream port max data 256(512) RO NS
                 max read 512
                 link x4(x8) speed 16.0(16.0) ASPM disabled(L1)
    cap 05[a0] = MSI supports 1 message, 64 bit 
    ecap 000b[100] = Vendor [1] ID 0001 Rev 1 Length 16
    ecap 0019[270] = PCIe Sec 1 lane errors 0
    ecap 001e[370] = L1 PM Substates 1
    ecap 0025[400] = Data Link Feature 1
    ecap 0026[410] = Physical Layer 16.0 GT/s 1
    ecap 0027[440] = Lane Margining at Receiver 1

pcib3@pci0:2:2:0:	class=0x060400 rev=0x00 hdr=0x01 vendor=0x1022 device=0x57a3 subvendor=0x1043 subdevice=0x87c0
    vendor     = 'Advanced Micro Devices, Inc. [AMD]'
    device     = 'Matisse PCIe GPP Bridge'
    class      = bridge
    subclass   = PCI-PCI
    cap 01[50] = powerspec 3  supports D0 D3  current D0
    cap 10[58] = PCI-Express 2 downstream port max data 256(512) RO NS
                 max read 512
                 link x4(x4) speed 2.5(16.0) ASPM disabled(L1)
                 slot 0 power limit 0 mW
    cap 05[a0] = MSI supports 1 message, 64 bit 
    cap 0d[c0] = PCI Bridge subvendor=0x1043 subdevice=0x87c0
    cap 08[c8] = HT MSI fixed address window enabled at 0xfee00000
    ecap 000b[100] = Vendor [1] ID 0001 Rev 1 Length 16
    ecap 0019[270] = PCIe Sec 1 lane errors 0xf
    ecap 000d[2a0] = ACS 1
    ecap 001e[370] = L1 PM Substates 1
    ecap 0025[400] = Data Link Feature 1
    ecap 0026[410] = Physical Layer 16.0 GT/s 1
    ecap 0027[440] = Lane Margining at Receiver 1

pcib7@pci0:2:5:0:	class=0x060400 rev=0x00 hdr=0x01 vendor=0x1022 device=0x57a3 subvendor=0x1043 subdevice=0x87c0
    vendor     = 'Advanced Micro Devices, Inc. [AMD]'
    device     = 'Matisse PCIe GPP Bridge'
    class      = bridge
    subclass   = PCI-PCI
    cap 01[50] = powerspec 3  supports D0 D3  current D0
    cap 10[58] = PCI-Express 2 downstream port max data 256(256) RO NS
                 max read 512
                 link x1(x1) speed 2.5(16.0) ASPM disabled(L1)
                 slot 0 power limit 0 mW
    cap 05[a0] = MSI supports 1 message, 64 bit 
    cap 0d[c0] = PCI Bridge subvendor=0x1043 subdevice=0x87c0
    cap 08[c8] = HT MSI fixed address window enabled at 0xfee00000
    ecap 000b[100] = Vendor [1] ID 0001 Rev 1 Length 16
    ecap 0019[270] = PCIe Sec 1 lane errors 0
    ecap 000d[2a0] = ACS 1
    ecap 001e[370] = L1 PM Substates 1
    ecap 0025[400] = Data Link Feature 1
    ecap 0026[410] = Physical Layer 16.0 GT/s 1
    ecap 0027[440] = Lane Margining at Receiver 1

pcib8@pci0:2:8:0:	class=0x060400 rev=0x00 hdr=0x01 vendor=0x1022 device=0x57a4 subvendor=0x1022 subdevice=0x1484
    vendor     = 'Advanced Micro Devices, Inc. [AMD]'
    device     = 'Matisse PCIe GPP Bridge'
    class      = bridge
    subclass   = PCI-PCI
    cap 01[50] = powerspec 3  supports D0 D3  current D0
    cap 10[58] = PCI-Express 2 downstream port max data 256(512) RO NS
                 max read 512
                 link x16(x16) speed 16.0(16.0) ASPM disabled(L0s/L1)
    cap 05[a0] = MSI supports 1 message, 64 bit 
    cap 0d[c0] = PCI Bridge subvendor=0x1022 subdevice=0x1484
    cap 08[c8] = HT MSI fixed address window enabled at 0xfee00000
    ecap 000b[100] = Vendor [1] ID 0001 Rev 1 Length 16
    ecap 0019[270] = PCIe Sec 1 lane errors 0
    ecap 0025[400] = Data Link Feature 1
    ecap 0026[410] = Physical Layer 16.0 GT/s 1
    ecap 0027[440] = Lane Margining at Receiver 1

pcib9@pci0:2:9:0:	class=0x060400 rev=0x00 hdr=0x01 vendor=0x1022 device=0x57a4 subvendor=0x1022 subdevice=0x1484
    vendor     = 'Advanced Micro Devices, Inc. [AMD]'
    device     = 'Matisse PCIe GPP Bridge'
    class      = bridge
    subclass   = PCI-PCI
    cap 01[50] = powerspec 3  supports D0 D3  current D0
    cap 10[58] = PCI-Express 2 downstream port max data 256(512) RO NS
                 max read 512
                 link x16(x16) speed 16.0(16.0) ASPM disabled(L0s/L1)
    cap 05[a0] = MSI supports 1 message, 64 bit 
    cap 0d[c0] = PCI Bridge subvendor=0x1022 subdevice=0x1484
    cap 08[c8] = HT MSI fixed address window enabled at 0xfee00000
    ecap 000b[100] = Vendor [1] ID 0001 Rev 1 Length 16
    ecap 0019[270] = PCIe Sec 1 lane errors 0
    ecap 0025[400] = Data Link Feature 1
    ecap 0026[410] = Physical Layer 16.0 GT/s 1
    ecap 0027[440] = Lane Margining at Receiver 1

pcib10@pci0:2:10:0:	class=0x060400 rev=0x00 hdr=0x01 vendor=0x1022 device=0x57a4 subvendor=0x1022 subdevice=0x1484
    vendor     = 'Advanced Micro Devices, Inc. [AMD]'
    device     = 'Matisse PCIe GPP Bridge'
    class      = bridge
    subclass   = PCI-PCI
    cap 01[50] = powerspec 3  supports D0 D3  current D0
    cap 10[58] = PCI-Express 2 downstream port max data 256(512) RO NS
                 max read 512
                 link x16(x16) speed 16.0(16.0) ASPM disabled(L0s/L1)
    cap 05[a0] = MSI supports 1 message, 64 bit 
    cap 0d[c0] = PCI Bridge subvendor=0x1022 subdevice=0x1484
    cap 08[c8] = HT MSI fixed address window enabled at 0xfee00000
    ecap 000b[100] = Vendor [1] ID 0001 Rev 1 Length 16
    ecap 0019[270] = PCIe Sec 1 lane errors 0
    ecap 0025[400] = Data Link Feature 1
    ecap 0026[410] = Physical Layer 16.0 GT/s 1
    ecap 0027[440] = Lane Margining at Receiver 1

pcib4@pci0:3:0:0:	class=0x060400 rev=0x0e hdr=0x01 vendor=0x111d device=0x8018 subvendor=0x0000 subdevice=0x0000
    vendor     = 'Microsemi / PMC / IDT'
    device     = 'PES12N3A 12-lane 3-Port PCI Express Switch'
    class      = bridge
    subclass   = PCI-PCI
    cap 10[40] = PCI-Express 1 upstream port max data 256(2048)
                 max read 128
                 link x4(x4) speed 2.5(2.5) ASPM disabled(L0s/L1)
    cap 01[c0] = powerspec 3  supports D0 D3  current D0
    ecap 0001[100] = AER 1 0 fatal 0 non-fatal 1 corrected
    ecap 0002[200] = VC 1 max VC0

pcib5@pci0:4:2:0:	class=0x060400 rev=0x0e hdr=0x01 vendor=0x111d device=0x8018 subvendor=0x0000 subdevice=0x0000
    vendor     = 'Microsemi / PMC / IDT'
    device     = 'PES12N3A 12-lane 3-Port PCI Express Switch'
    class      = bridge
    subclass   = PCI-PCI
    cap 10[40] = PCI-Express 1 downstream port max data 256(2048)
                 max read 128
                 link x4(x4) speed 2.5(2.5) ASPM disabled(L0s/L1)
    cap 01[c0] = powerspec 3  supports D0 D3  current D0
    cap 05[d0] = MSI supports 1 message, 64 bit 
    ecap 0001[100] = AER 1 0 fatal 0 non-fatal 1 corrected
    ecap 0002[200] = VC 1 max VC0

pcib6@pci0:4:4:0:	class=0x060400 rev=0x0e hdr=0x01 vendor=0x111d device=0x8018 subvendor=0x0000 subdevice=0x0000
    vendor     = 'Microsemi / PMC / IDT'
    device     = 'PES12N3A 12-lane 3-Port PCI Express Switch'
    class      = bridge
    subclass   = PCI-PCI
    cap 10[40] = PCI-Express 1 downstream port max data 256(2048)
                 max read 128
                 link x4(x4) speed 2.5(2.5) ASPM disabled(L0s/L1)
    cap 01[c0] = powerspec 3  supports D0 D3  current D0
    cap 05[d0] = MSI supports 1 message, 64 bit 
    ecap 0001[100] = AER 1 0 fatal 0 non-fatal 1 corrected
    ecap 0002[200] = VC 1 max VC0

igb0@pci0:5:0:0:	class=0x020000 rev=0x02 hdr=0x00 vendor=0x8086 device=0x10d6 subvendor=0x8086 subdevice=0x145a
    vendor     = 'Intel Corporation'
    device     = '82575GB Gigabit Network Connection'
    class      = network
    subclass   = ethernet
    bar   [10] = type Memory, range 32, base 0xf7020000, size 131072, enabled
    bar   [14] = type Memory, range 32, base 0xf6e00000, size 2097152, enabled
    bar   [18] = type I/O Port, range 32, base 0xc020, size 32, enabled
    bar   [1c] = type Memory, range 32, base 0xf7044000, size 16384, enabled
    cap 01[40] = powerspec 2  supports D0 D3  current D0
    cap 05[50] = MSI supports 1 message, 64 bit 
    cap 11[60] = MSI-X supports 10 messages, enabled
                 Table in map 0x1c[0x0], PBA in map 0x1c[0x2000]
    cap 10[a0] = PCI-Express 2 endpoint max data 256(256) RO NS
                 max read 512
                 link x4(x4) speed 2.5(2.5)
    ecap 0001[100] = AER 1 0 fatal 0 non-fatal 4 corrected
    ecap 0003[140] = Serial 1 001b21ffff201418

igb1@pci0:5:0:1:	class=0x020000 rev=0x02 hdr=0x00 vendor=0x8086 device=0x10d6 subvendor=0x8086 subdevice=0x145a
    vendor     = 'Intel Corporation'
    device     = '82575GB Gigabit Network Connection'
    class      = network
    subclass   = ethernet
    bar   [10] = type Memory, range 32, base 0xf7000000, size 131072, enabled
    bar   [14] = type Memory, range 32, base 0xf6c00000, size 2097152, enabled
    bar   [18] = type I/O Port, range 32, base 0xc000, size 32, enabled
    bar   [1c] = type Memory, range 32, base 0xf7040000, size 16384, enabled
    cap 01[40] = powerspec 2  supports D0 D3  current D0
    cap 05[50] = MSI supports 1 message, 64 bit 
    cap 11[60] = MSI-X supports 10 messages, enabled
                 Table in map 0x1c[0x0], PBA in map 0x1c[0x2000]
    cap 10[a0] = PCI-Express 2 endpoint max data 256(256) RO NS
                 max read 512
                 link x4(x4) speed 2.5(2.5)
    ecap 0001[100] = AER 1 0 fatal 0 non-fatal 4 corrected
    ecap 0003[140] = Serial 1 001b21ffff201418

igb2@pci0:6:0:0:	class=0x020000 rev=0x02 hdr=0x00 vendor=0x8086 device=0x10d6 subvendor=0x8086 subdevice=0x145a
    vendor     = 'Intel Corporation'
    device     = '82575GB Gigabit Network Connection'
    class      = network
    subclass   = ethernet
    bar   [10] = type Memory, range 32, base 0xf6a20000, size 131072, enabled
    bar   [14] = type Memory, range 32, base 0xf6800000, size 2097152, enabled
    bar   [18] = type I/O Port, range 32, base 0xb020, size 32, enabled
    bar   [1c] = type Memory, range 32, base 0xf6a44000, size 16384, enabled
    cap 01[40] = powerspec 2  supports D0 D3  current D0
    cap 05[50] = MSI supports 1 message, 64 bit 
    cap 11[60] = MSI-X supports 10 messages, enabled
                 Table in map 0x1c[0x0], PBA in map 0x1c[0x2000]
    cap 10[a0] = PCI-Express 2 endpoint max data 256(256) RO NS
                 max read 512
                 link x4(x4) speed 2.5(2.5)
    ecap 0001[100] = AER 1 0 fatal 0 non-fatal 1 corrected
    ecap 0003[140] = Serial 1 001b21ffff20141c

igb3@pci0:6:0:1:	class=0x020000 rev=0x02 hdr=0x00 vendor=0x8086 device=0x10d6 subvendor=0x8086 subdevice=0x145a
    vendor     = 'Intel Corporation'
    device     = '82575GB Gigabit Network Connection'
    class      = network
    subclass   = ethernet
    bar   [10] = type Memory, range 32, base 0xf6a00000, size 131072, enabled
    bar   [14] = type Memory, range 32, base 0xf6600000, size 2097152, enabled
    bar   [18] = type I/O Port, range 32, base 0xb000, size 32, enabled
    bar   [1c] = type Memory, range 32, base 0xf6a40000, size 16384, enabled
    cap 01[40] = powerspec 2  supports D0 D3  current D0
    cap 05[50] = MSI supports 1 message, 64 bit 
    cap 11[60] = MSI-X supports 10 messages, enabled
                 Table in map 0x1c[0x0], PBA in map 0x1c[0x2000]
    cap 10[a0] = PCI-Express 2 endpoint max data 256(256) RO NS
                 max read 512
                 link x4(x4) speed 2.5(2.5)
    ecap 0001[100] = AER 1 0 fatal 0 non-fatal 1 corrected
    ecap 0003[140] = Serial 1 001b21ffff20141c

igb4@pci0:7:0:0:	class=0x020000 rev=0x03 hdr=0x00 vendor=0x8086 device=0x1539 subvendor=0x1043 subdevice=0x85f0
    vendor     = 'Intel Corporation'
    device     = 'I211 Gigabit Network Connection'
    class      = network
    subclass   = ethernet
    bar   [10] = type Memory, range 32, base 0xf7600000, size 131072, enabled
    bar   [18] = type I/O Port, range 32, base 0xd000, size 32, enabled
    bar   [1c] = type Memory, range 32, base 0xf7620000, size 16384, enabled
    cap 01[40] = powerspec 3  supports D0 D3  current D0
    cap 05[50] = MSI supports 1 message, 64 bit, vector masks 
    cap 11[70] = MSI-X supports 5 messages, enabled
                 Table in map 0x1c[0x0], PBA in map 0x1c[0x2000]
    cap 10[a0] = PCI-Express 2 endpoint max data 256(512) FLR RO NS
                 max read 512
                 link x1(x1) speed 2.5(2.5) ASPM disabled(L0s/L1)
    ecap 0001[100] = AER 2 0 fatal 0 non-fatal 1 corrected
    ecap 0003[140] = Serial 1 d45d64ffff47e2fe
    ecap 0017[1a0] = TPH Requester 1

none1@pci0:8:0:0:	class=0x130000 rev=0x00 hdr=0x00 vendor=0x1022 device=0x1485 subvendor=0x1043 subdevice=0x87c0
    vendor     = 'Advanced Micro Devices, Inc. [AMD]'
    device     = 'Starship/Matisse Reserved SPP'
    class      = non-essential instrumentation
    cap 09[48] = vendor (length 8)
    cap 01[50] = powerspec 3  supports D0 D3  current D0
    cap 10[64] = PCI-Express 2 endpoint max data 256(256) RO NS
                 max read 512
                 link x16(x16) speed 16.0(16.0) ASPM disabled(L0s/L1)
    ecap 000b[100] = Vendor [1] ID 0001 Rev 1 Length 16
    ecap 0019[270] = PCIe Sec 1 lane errors 0
    ecap 0025[400] = Data Link Feature 1
    ecap 0026[410] = Physical Layer 16.0 GT/s 1
    ecap 0027[440] = Lane Margining at Receiver 1

xhci0@pci0:8:0:1:	class=0x0c0330 rev=0x00 hdr=0x00 vendor=0x1022 device=0x149c subvendor=0x1043 subdevice=0x87c0
    vendor     = 'Advanced Micro Devices, Inc. [AMD]'
    device     = 'Matisse USB 3.0 Host Controller'
    class      = serial bus
    subclass   = USB
    bar   [10] = type Memory, range 64, base 0xf7300000, size 1048576, enabled
    cap 09[48] = vendor (length 8)
    cap 01[50] = powerspec 3  supports D0 D3  current D0
    cap 10[64] = PCI-Express 2 endpoint max data 256(256) RO NS
                 max read 512
                 link x16(x16) speed 16.0(16.0) ASPM disabled(L0s/L1)
    cap 05[a0] = MSI supports 1 message, 64 bit enabled with 1 message
    ecap 000b[100] = Vendor [1] ID 0001 Rev 1 Length 16

xhci1@pci0:8:0:3:	class=0x0c0330 rev=0x00 hdr=0x00 vendor=0x1022 device=0x149c subvendor=0x1022 subdevice=0x148c
    vendor     = 'Advanced Micro Devices, Inc. [AMD]'
    device     = 'Matisse USB 3.0 Host Controller'
    class      = serial bus
    subclass   = USB
    bar   [10] = type Memory, range 64, base 0xf7200000, size 1048576, enabled
    cap 09[48] = vendor (length 8)
    cap 01[50] = powerspec 3  supports D0 D3  current D0
    cap 10[64] = PCI-Express 2 endpoint max data 256(256) RO NS
                 max read 512
                 link x16(x16) speed 16.0(16.0) ASPM disabled(L0s/L1)
    cap 05[a0] = MSI supports 8 messages, 64 bit 
    cap 11[c0] = MSI-X supports 8 messages, enabled
                 Table in map 0x10[0xfe000], PBA in map 0x10[0xff000]
    ecap 000b[100] = Vendor [1] ID 0001 Rev 1 Length 16

ahci0@pci0:9:0:0:	class=0x010601 rev=0x51 hdr=0x00 vendor=0x1022 device=0x7901 subvendor=0x1022 subdevice=0x7901
    vendor     = 'Advanced Micro Devices, Inc. [AMD]'
    device     = 'FCH SATA Controller [AHCI mode]'
    class      = mass storage
    subclass   = SATA
    bar   [24] = type Memory, range 32, base 0xf7500000, size 2048, enabled
    cap 09[48] = vendor (length 8)
    cap 01[50] = powerspec 3  supports D0 D3  current D0
    cap 10[64] = PCI-Express 2 endpoint max data 256(256) RO NS
                 max read 512
                 link x16(x16) speed 16.0(16.0) ASPM disabled(L0s/L1)
    cap 05[a0] = MSI supports 16 messages, 64 bit enabled with 16 messages
    cap 12[d0] = SATA Index-Data Pair
    ecap 000b[100] = Vendor [1] ID 0001 Rev 1 Length 16
    ecap 0019[270] = PCIe Sec 1 lane errors 0
    ecap 0025[400] = Data Link Feature 1
    ecap 0026[410] = Physical Layer 16.0 GT/s 1
    ecap 0027[440] = Lane Margining at Receiver 1

ahci1@pci0:10:0:0:	class=0x010601 rev=0x51 hdr=0x00 vendor=0x1022 device=0x7901 subvendor=0x1022 subdevice=0x7901
    vendor     = 'Advanced Micro Devices, Inc. [AMD]'
    device     = 'FCH SATA Controller [AHCI mode]'
    class      = mass storage
    subclass   = SATA
    bar   [24] = type Memory, range 32, base 0xf7400000, size 2048, enabled
    cap 09[48] = vendor (length 8)
    cap 01[50] = powerspec 3  supports D0 D3  current D0
    cap 10[64] = PCI-Express 2 endpoint max data 256(256) RO NS
                 max read 512
                 link x16(x16) speed 16.0(16.0) ASPM disabled(L0s/L1)
    cap 05[a0] = MSI supports 16 messages, 64 bit enabled with 16 messages
    cap 12[d0] = SATA Index-Data Pair
    ecap 000b[100] = Vendor [1] ID 0001 Rev 1 Length 16
    ecap 0019[270] = PCIe Sec 1 lane errors 0
    ecap 0025[400] = Data Link Feature 1
    ecap 0026[410] = Physical Layer 16.0 GT/s 1
    ecap 0027[440] = Lane Margining at Receiver 1

vgapci0@pci0:11:0:0:	class=0x030000 rev=0x00 hdr=0x00 vendor=0x1002 device=0x6771 subvendor=0x174b subdevice=0xa01c
    vendor     = 'Advanced Micro Devices, Inc. [AMD/ATI]'
    device     = 'Caicos XTX [Radeon HD 8490 / R5 235X OEM]'
    class      = display
    subclass   = VGA
    bar   [10] = type Prefetchable Memory, range 64, base 0xe0000000, size 268435456, enabled
    bar   [18] = type Memory, range 64, base 0xf7e20000, size 131072, enabled
    bar   [20] = type I/O Port, range 32, base 0xf000, size 256, enabled
    cap 01[50] = powerspec 3  supports D0 D1 D2 D3  current D0
    cap 10[58] = PCI-Express 2 legacy endpoint max data 256(256) RO NS
                 max read 512
                 link x8(x16) speed 2.5(5.0) ASPM disabled(L0s/L1)
    cap 05[a0] = MSI supports 1 message, 64 bit enabled with 1 message
    ecap 000b[100] = Vendor [1] ID 0001 Rev 1 Length 16
    ecap 0001[150] = AER 1 0 fatal 1 non-fatal 1 corrected

hdac0@pci0:11:0:1:	class=0x040300 rev=0x00 hdr=0x00 vendor=0x1002 device=0xaa98 subvendor=0x174b subdevice=0xaa98
    vendor     = 'Advanced Micro Devices, Inc. [AMD/ATI]'
    device     = 'Caicos HDMI Audio [Radeon HD 6450 / 7450/8450/8490 OEM / R5 230/235/235X OEM]'
    class      = multimedia
    subclass   = HDA
    bar   [10] = type Memory, range 64, base 0xf7e40000, size 16384, enabled
    cap 01[50] = powerspec 3  supports D0 D1 D2 D3  current D0
    cap 10[58] = PCI-Express 2 legacy endpoint max data 256(256) RO NS
                 max read 512
                 link x8(x16) speed 2.5(5.0) ASPM disabled(L0s/L1)
    cap 05[a0] = MSI supports 1 message, 64 bit enabled with 1 message
    ecap 000b[100] = Vendor [1] ID 0001 Rev 1 Length 16
    ecap 0001[150] = AER 1 0 fatal 1 non-fatal 1 corrected

mps0@pci0:12:0:0:	class=0x010700 rev=0x03 hdr=0x00 vendor=0x1000 device=0x0072 subvendor=0x1000 subdevice=0x3020
    vendor     = 'Broadcom / LSI'
    device     = 'SAS2008 PCI-Express Fusion-MPT SAS-2 [Falcon]'
    class      = mass storage
    subclass   = SAS
    bar   [10] = type I/O Port, range 32, base 0xe000, size 256, enabled
    bar   [14] = type Memory, range 64, base 0xf7dc0000, size 16384, enabled
    bar   [1c] = type Memory, range 64, base 0xf7d80000, size 262144, enabled
    cap 01[50] = powerspec 3  supports D0 D1 D2 D3  current D0
    cap 10[68] = PCI-Express 2 endpoint max data 512(4096) FLR RO NS
                 max read 512
                 link x8(x8) speed 5.0(5.0) ASPM disabled(L0s)
    cap 03[d0] = VPD
    cap 05[a8] = MSI supports 1 message, 64 bit 
    cap 11[c0] = MSI-X supports 15 messages, enabled
                 Table in map 0x14[0x2000], PBA in map 0x14[0x3800]
    ecap 0001[100] = AER 1 0 fatal 0 non-fatal 0 corrected
    ecap 0004[138] = Power Budgeting 1
    ecap 0010[150] = SR-IOV 1 IOV disabled, Memory Space disabled, ARI disabled
                     0 VFs configured out of 16 supported
                     First VF RID Offset 0x0001, VF RID Stride 0x0001
                     VF Device ID 0x0072
                     Page Sizes: 4096 (enabled), 8192, 65536, 262144, 1048576, 4194304
    ecap 000e[190] = ARI 1

none2@pci0:13:0:0:	class=0x130000 rev=0x00 hdr=0x00 vendor=0x1022 device=0x148a subvendor=0x1043 subdevice=0x87c0
    vendor     = 'Advanced Micro Devices, Inc. [AMD]'
    device     = 'Starship/Matisse PCIe Dummy Function'
    class      = non-essential instrumentation
    cap 09[48] = vendor (length 8)
    cap 01[50] = powerspec 3  supports D0 D3  current D0
    cap 10[64] = PCI-Express 2 endpoint max data 256(256) FLR RO NS
                 max read 512
                 link x16(x16) speed 16.0(16.0) ASPM disabled(L0s/L1)
    ecap 000b[100] = Vendor [1] ID 0001 Rev 1 Length 16
    ecap 0001[150] = AER 2 0 fatal 0 non-fatal 0 corrected
    ecap 0019[270] = PCIe Sec 1 lane errors 0
    ecap 000d[2a0] = ACS 1
    ecap 0025[400] = Data Link Feature 1
    ecap 0026[410] = Physical Layer 16.0 GT/s 1
    ecap 0027[440] = Lane Margining at Receiver 1

none3@pci0:14:0:0:	class=0x130000 rev=0x00 hdr=0x00 vendor=0x1022 device=0x1485 subvendor=0x1043 subdevice=0x87c0
    vendor     = 'Advanced Micro Devices, Inc. [AMD]'
    device     = 'Starship/Matisse Reserved SPP'
    class      = non-essential instrumentation
    cap 09[48] = vendor (length 8)
    cap 01[50] = powerspec 3  supports D0 D3  current D0
    cap 10[64] = PCI-Express 2 endpoint max data 256(256) FLR RO NS
                 max read 512
                 link x16(x16) speed 16.0(16.0) ASPM disabled(L0s/L1)
    ecap 000b[100] = Vendor [1] ID 0001 Rev 1 Length 16
    ecap 0001[150] = AER 2 0 fatal 0 non-fatal 1 corrected
    ecap 0019[270] = PCIe Sec 1 lane errors 0
    ecap 000d[2a0] = ACS 1
    ecap 0025[400] = Data Link Feature 1
    ecap 0026[410] = Physical Layer 16.0 GT/s 1
    ecap 0027[440] = Lane Margining at Receiver 1

none4@pci0:14:0:1:	class=0x108000 rev=0x00 hdr=0x00 vendor=0x1022 device=0x1486 subvendor=0x1043 subdevice=0x87c0
    vendor     = 'Advanced Micro Devices, Inc. [AMD]'
    device     = 'Starship/Matisse Cryptographic Coprocessor PSPCPP'
    class      = encrypt/decrypt
    bar   [18] = type Memory, range 32, base 0xf7900000, size 1048576, enabled
    bar   [24] = type Memory, range 32, base 0xf7a08000, size 8192, enabled
    cap 09[48] = vendor (length 8)
    cap 01[50] = powerspec 3  supports D0 D3  current D0
    cap 10[64] = PCI-Express 2 endpoint max data 256(256) FLR RO NS
                 max read 512
                 link x16(x16) speed 16.0(16.0) ASPM disabled(L0s/L1)
    cap 05[a0] = MSI supports 1 message, 64 bit 
    cap 11[c0] = MSI-X supports 2 messages
                 Table in map 0x24[0x0], PBA in map 0x24[0x1000]
    ecap 000b[100] = Vendor [1] ID 0001 Rev 1 Length 16
    ecap 0001[150] = AER 2 0 fatal 0 non-fatal 1 corrected
    ecap 000d[2a0] = ACS 1
    ecap 0017[370] = TPH Requester 1

xhci2@pci0:14:0:3:	class=0x0c0330 rev=0x00 hdr=0x00 vendor=0x1022 device=0x149c subvendor=0x1043 subdevice=0x87c0
    vendor     = 'Advanced Micro Devices, Inc. [AMD]'
    device     = 'Matisse USB 3.0 Host Controller'
    class      = serial bus
    subclass   = USB
    bar   [10] = type Memory, range 64, base 0xf7800000, size 1048576, enabled
    cap 09[48] = vendor (length 8)
    cap 01[50] = powerspec 3  supports D0 D3  current D0
    cap 10[64] = PCI-Express 2 endpoint max data 256(256) FLR RO NS
                 max read 512
                 link x16(x16) speed 16.0(16.0) ASPM disabled(L0s/L1)
    cap 05[a0] = MSI supports 8 messages, 64 bit 
    cap 11[c0] = MSI-X supports 8 messages, enabled
                 Table in map 0x10[0xfe000], PBA in map 0x10[0xff000]
    ecap 000b[100] = Vendor [1] ID 0001 Rev 1 Length 16
    ecap 0001[150] = AER 2 0 fatal 0 non-fatal 1 corrected
    ecap 000d[2a0] = ACS 1
    ecap 0017[370] = TPH Requester 1

hdac1@pci0:14:0:4:	class=0x040300 rev=0x00 hdr=0x00 vendor=0x1022 device=0x1487 subvendor=0x1043 subdevice=0x87c5
    vendor     = 'Advanced Micro Devices, Inc. [AMD]'
    device     = 'Starship/Matisse HD Audio Controller'
    class      = multimedia
    subclass   = HDA
    bar   [10] = type Memory, range 32, base 0xf7a00000, size 32768, enabled
    cap 09[48] = vendor (length 8)
    cap 01[50] = powerspec 3  supports D0 D3  current D0
    cap 10[64] = PCI-Express 2 endpoint max data 256(256) FLR RO NS
                 max read 512
                 link x16(x16) speed 16.0(16.0) ASPM disabled(L0s/L1)
    cap 05[a0] = MSI supports 1 message, 64 bit enabled with 1 message
    ecap 000b[100] = Vendor [1] ID 0001 Rev 1 Length 16
    ecap 0001[150] = AER 2 0 fatal 0 non-fatal 1 corrected
    ecap 000d[2a0] = ACS 1
    ecap 0017[370] = TPH Requester 1

ahci2@pci0:15:0:0:	class=0x010601 rev=0x51 hdr=0x00 vendor=0x1022 device=0x7901 subvendor=0x1043 subdevice=0x87c0
    vendor     = 'Advanced Micro Devices, Inc. [AMD]'
    device     = 'FCH SATA Controller [AHCI mode]'
    class      = mass storage
    subclass   = SATA
    bar   [24] = type Memory, range 32, base 0xf7c00000, size 2048, enabled
    cap 09[48] = vendor (length 8)
    cap 01[50] = powerspec 3  supports D0 D3  current D0
    cap 10[64] = PCI-Express 2 endpoint max data 256(256) FLR RO NS
                 max read 512
                 link x16(x16) speed 16.0(16.0) ASPM disabled(L0s/L1)
    cap 05[a0] = MSI supports 16 messages, 64 bit enabled with 1 message
    cap 12[d0] = SATA Index-Data Pair
    ecap 000b[100] = Vendor [1] ID 0001 Rev 1 Length 16
    ecap 0001[150] = AER 2 0 fatal 0 non-fatal 0 corrected
    ecap 0019[270] = PCIe Sec 1 lane errors 0
    ecap 000d[2a0] = ACS 1
    ecap 0017[370] = TPH Requester 1
    ecap 0025[400] = Data Link Feature 1
    ecap 0026[410] = Physical Layer 16.0 GT/s 1
    ecap 0027[440] = Lane Margining at Receiver 1

ahci3@pci0:16:0:0:	class=0x010601 rev=0x51 hdr=0x00 vendor=0x1022 device=0x7901 subvendor=0x1043 subdevice=0x87c0
    vendor     = 'Advanced Micro Devices, Inc. [AMD]'
    device     = 'FCH SATA Controller [AHCI mode]'
    class      = mass storage
    subclass   = SATA
    bar   [24] = type Memory, range 32, base 0xf7b00000, size 2048, enabled
    cap 09[48] = vendor (length 8)
    cap 01[50] = powerspec 3  supports D0 D3  current D0
    cap 10[64] = PCI-Express 2 endpoint max data 256(256) FLR RO NS
                 max read 512
                 link x16(x16) speed 16.0(16.0) ASPM disabled(L0s/L1)
    cap 05[a0] = MSI supports 16 messages, 64 bit enabled with 1 message
    cap 12[d0] = SATA Index-Data Pair
    ecap 000b[100] = Vendor [1] ID 0001 Rev 1 Length 16
    ecap 0001[150] = AER 2 0 fatal 0 non-fatal 0 corrected
    ecap 0019[270] = PCIe Sec 1 lane errors 0
    ecap 000d[2a0] = ACS 1
    ecap 0017[370] = TPH Requester 1
    ecap 0025[400] = Data Link Feature 1
    ecap 0026[410] = Physical Layer 16.0 GT/s 1
    ecap 0027[440] = Lane Margining at Receiver 1
