hostb0@pci0:0:0:0:	class=0x060000 card=0x060a15d9 chip=0xa0008086 rev=0x02 hdr=0x00
    vendor     = 'Intel Corporation'
    device     = 'Atom Processor D4xx/D5xx/N4xx/N5xx DMI Bridge'
    class      = bridge
    subclass   = HOST-PCI
    cap 09[e0] = vendor (length 8) Intel cap 12 version 1

uhci0@pci0:0:26:0:	class=0x0c0300 card=0x060a15d9 chip=0x29378086 rev=0x02 hdr=0x00
    vendor     = 'Intel Corporation'
    device     = '82801I (ICH9 Family) USB UHCI Controller'
    class      = serial bus
    subclass   = USB
    bar   [20] = type I/O Port, range 32, base 0xac00, size 32, enabled
    cap 13[50] = PCI Advanced Features: FLR TP

uhci1@pci0:0:26:1:	class=0x0c0300 card=0x060a15d9 chip=0x29388086 rev=0x02 hdr=0x00
    vendor     = 'Intel Corporation'
    device     = '82801I (ICH9 Family) USB UHCI Controller'
    class      = serial bus
    subclass   = USB
    bar   [20] = type I/O Port, range 32, base 0xa880, size 32, enabled
    cap 13[50] = PCI Advanced Features: FLR TP

uhci2@pci0:0:26:2:	class=0x0c0300 card=0x060a15d9 chip=0x29398086 rev=0x02 hdr=0x00
    vendor     = 'Intel Corporation'
    device     = '82801I (ICH9 Family) USB UHCI Controller'
    class      = serial bus
    subclass   = USB
    bar   [20] = type I/O Port, range 32, base 0xa800, size 32, enabled
    cap 13[50] = PCI Advanced Features: FLR TP

ehci0@pci0:0:26:7:	class=0x0c0320 card=0x060a15d9 chip=0x293c8086 rev=0x02 hdr=0x00
    vendor     = 'Intel Corporation'
    device     = '82801I (ICH9 Family) USB2 EHCI Controller'
    class      = serial bus
    subclass   = USB
    bar   [10] = type Memory, range 32, base 0xfebfbc00, size 1024, enabled
    cap 01[50] = powerspec 2  supports D0 D3  current D0
    cap 0a[58] = EHCI Debug Port at offset 0xa0 in map 0x14
    cap 13[98] = PCI Advanced Features: FLR TP

pcib1@pci0:0:28:0:	class=0x060400 card=0x060a15d9 chip=0x29408086 rev=0x02 hdr=0x01
    vendor     = 'Intel Corporation'
    device     = '82801I (ICH9 Family) PCI Express Port 1'
    class      = bridge
    subclass   = PCI-PCI
    cap 10[40] = PCI-Express 1 root port max data 128(128)
                 max read 128
                 link x4(x4) speed 2.5(2.5)
                 slot 0 power limit 25000 mW HotPlug(present) surprise
    cap 05[80] = MSI supports 1 message enabled with 1 message
    cap 0d[90] = PCI Bridge card=0x060a15d9
    cap 01[a0] = powerspec 2  supports D0 D3  current D0
    ecap 0002[100] = VC 1 max VC0
    ecap 0005[180] = Root Complex Link Declaration 1

pcib5@pci0:0:28:4:	class=0x060400 card=0x060a15d9 chip=0x29488086 rev=0x02 hdr=0x01
    vendor     = 'Intel Corporation'
    device     = '82801I (ICH9 Family) PCI Express Port 5'
    class      = bridge
    subclass   = PCI-PCI
    cap 10[40] = PCI-Express 1 root port max data 128(128)
                 max read 128
                 link x1(x1) speed 2.5(2.5)
                 slot 0 power limit 10000 mW HotPlug(present) surprise
    cap 05[80] = MSI supports 1 message enabled with 1 message
    cap 0d[90] = PCI Bridge card=0x060a15d9
    cap 01[a0] = powerspec 2  supports D0 D3  current D0
    ecap 0002[100] = VC 1 max VC0
    ecap 0005[180] = Root Complex Link Declaration 1

pcib6@pci0:0:28:5:	class=0x060400 card=0x060a15d9 chip=0x294a8086 rev=0x02 hdr=0x01
    vendor     = 'Intel Corporation'
    device     = '82801I (ICH9 Family) PCI Express Port 6'
    class      = bridge
    subclass   = PCI-PCI
    cap 10[40] = PCI-Express 1 root port max data 128(128)
                 max read 128
                 link x1(x1) speed 2.5(2.5)
                 slot 0 power limit 10000 mW HotPlug(present) surprise
    cap 05[80] = MSI supports 1 message enabled with 1 message
    cap 0d[90] = PCI Bridge card=0x060a15d9
    cap 01[a0] = powerspec 2  supports D0 D3  current D0
    ecap 0002[100] = VC 1 max VC0
    ecap 0005[180] = Root Complex Link Declaration 1

uhci3@pci0:0:29:0:	class=0x0c0300 card=0x060a15d9 chip=0x29348086 rev=0x02 hdr=0x00
    vendor     = 'Intel Corporation'
    device     = '82801I (ICH9 Family) USB UHCI Controller'
    class      = serial bus
    subclass   = USB
    bar   [20] = type I/O Port, range 32, base 0xa480, size 32, enabled
    cap 13[50] = PCI Advanced Features: FLR TP

uhci4@pci0:0:29:1:	class=0x0c0300 card=0x060a15d9 chip=0x29358086 rev=0x02 hdr=0x00
    vendor     = 'Intel Corporation'
    device     = '82801I (ICH9 Family) USB UHCI Controller'
    class      = serial bus
    subclass   = USB
    bar   [20] = type I/O Port, range 32, base 0xa400, size 32, enabled
    cap 13[50] = PCI Advanced Features: FLR TP

uhci5@pci0:0:29:2:	class=0x0c0300 card=0x060a15d9 chip=0x29368086 rev=0x02 hdr=0x00
    vendor     = 'Intel Corporation'
    device     = '82801I (ICH9 Family) USB UHCI Controller'
    class      = serial bus
    subclass   = USB
    bar   [20] = type I/O Port, range 32, base 0xa080, size 32, enabled
    cap 13[50] = PCI Advanced Features: FLR TP

ehci1@pci0:0:29:7:	class=0x0c0320 card=0x060a15d9 chip=0x293a8086 rev=0x02 hdr=0x00
    vendor     = 'Intel Corporation'
    device     = '82801I (ICH9 Family) USB2 EHCI Controller'
    class      = serial bus
    subclass   = USB
    bar   [10] = type Memory, range 32, base 0xfebfb800, size 1024, enabled
    cap 01[50] = powerspec 2  supports D0 D3  current D0
    cap 0a[58] = EHCI Debug Port at offset 0xa0 in map 0x14
    cap 13[98] = PCI Advanced Features: FLR TP

pcib7@pci0:0:30:0:	class=0x060401 card=0x060a15d9 chip=0x244e8086 rev=0x92 hdr=0x01
    vendor     = 'Intel Corporation'
    device     = '82801 PCI Bridge'
    class      = bridge
    subclass   = PCI-PCI
    cap 0d[50] = PCI Bridge card=0x060a15d9

isab0@pci0:0:31:0:	class=0x060100 card=0x060a15d9 chip=0x29168086 rev=0x02 hdr=0x00
    vendor     = 'Intel Corporation'
    device     = '82801IR (ICH9R) LPC Interface Controller'
    class      = bridge
    subclass   = PCI-ISA
    cap 09[e0] = vendor (length 12) Intel cap 1 version 0
		 features: SATA RAID-5, 4 PCI-e x1 slots

ahci0@pci0:0:31:2:	class=0x010601 card=0x060a15d9 chip=0x29228086 rev=0x02 hdr=0x00
    vendor     = 'Intel Corporation'
    device     = '82801IR/IO/IH (ICH9R/DO/DH) 6 port SATA Controller [AHCI mode]'
    class      = mass storage
    subclass   = SATA
    bar   [10] = type I/O Port, range 32, base 0x9480, size 8, enabled
    bar   [14] = type I/O Port, range 32, base 0xa000, size 4, enabled
    bar   [18] = type I/O Port, range 32, base 0x9c00, size 8, enabled
    bar   [1c] = type I/O Port, range 32, base 0x9880, size 4, enabled
    bar   [20] = type I/O Port, range 32, base 0x9800, size 32, enabled
    bar   [24] = type Memory, range 32, base 0xfebfb000, size 2048, enabled
    cap 05[80] = MSI supports 16 messages enabled with 16 messages
    cap 01[70] = powerspec 3  supports D0 D3  current D0
    cap 12[a8] = SATA Index-Data Pair
    cap 13[b0] = PCI Advanced Features: FLR TP

none0@pci0:0:31:3:	class=0x0c0500 card=0x060a15d9 chip=0x29308086 rev=0x02 hdr=0x00
    vendor     = 'Intel Corporation'
    device     = '82801I (ICH9 Family) SMBus Controller'
    class      = serial bus
    subclass   = SMBus
    bar   [10] = type Memory, range 64, base 0xfebfac00, size 256, enabled
    bar   [20] = type I/O Port, range 32, base 0x400, size 32, enabled

pcib2@pci0:1:0:0:	class=0x060400 card=0x00000000 chip=0x8018111d rev=0x0e hdr=0x01
    vendor     = 'Microsemi / PMC / IDT'
    device     = 'PES12N3A 12-lane 3-Port PCI Express Switch'
    class      = bridge
    subclass   = PCI-PCI
    cap 10[40] = PCI-Express 1 upstream port max data 128(2048)
                 max read 128
                 link x4(x4) speed 2.5(2.5) ASPM disabled(L0s/L1)
    cap 01[c0] = powerspec 3  supports D0 D3  current D0
    ecap 0001[100] = AER 1 0 fatal 0 non-fatal 2 corrected
    ecap 0002[200] = VC 1 max VC0

pcib3@pci0:2:2:0:	class=0x060400 card=0x00000000 chip=0x8018111d rev=0x0e hdr=0x01
    vendor     = 'Microsemi / PMC / IDT'
    device     = 'PES12N3A 12-lane 3-Port PCI Express Switch'
    class      = bridge
    subclass   = PCI-PCI
    cap 10[40] = PCI-Express 1 downstream port max data 128(2048)
                 max read 128
                 link x4(x4) speed 2.5(2.5) ASPM disabled(L0s/L1)
    cap 01[c0] = powerspec 3  supports D0 D3  current D0
    cap 05[d0] = MSI supports 1 message, 64 bit 
    ecap 0001[100] = AER 1 1 fatal 0 non-fatal 4 corrected
    ecap 0002[200] = VC 1 max VC0

pcib4@pci0:2:4:0:	class=0x060400 card=0x00000000 chip=0x8018111d rev=0x0e hdr=0x01
    vendor     = 'Microsemi / PMC / IDT'
    device     = 'PES12N3A 12-lane 3-Port PCI Express Switch'
    class      = bridge
    subclass   = PCI-PCI
    cap 10[40] = PCI-Express 1 downstream port max data 128(2048)
                 max read 128
                 link x4(x4) speed 2.5(2.5) ASPM disabled(L0s/L1)
    cap 01[c0] = powerspec 3  supports D0 D3  current D0
    cap 05[d0] = MSI supports 1 message, 64 bit 
    ecap 0001[100] = AER 1 1 fatal 0 non-fatal 4 corrected
    ecap 0002[200] = VC 1 max VC0

igb0@pci0:3:0:0:	class=0x020000 card=0x145a8086 chip=0x10d68086 rev=0x02 hdr=0x00
    vendor     = 'Intel Corporation'
    device     = '82575GB Gigabit Network Connection'
    class      = network
    subclass   = ethernet
    bar   [10] = type Memory, range 32, base 0xfd3e0000, size 131072, enabled
    bar   [14] = type Memory, range 32, base 0xfd400000, size 2097152, enabled
    bar   [18] = type I/O Port, range 32, base 0xbc00, size 32, enabled
    bar   [1c] = type Memory, range 32, base 0xfd3dc000, size 16384, enabled
    cap 01[40] = powerspec 2  supports D0 D3  current D0
    cap 05[50] = MSI supports 1 message, 64 bit 
    cap 11[60] = MSI-X supports 10 messages, enabled
                 Table in map 0x1c[0x0], PBA in map 0x1c[0x2000]
    cap 10[a0] = PCI-Express 2 endpoint max data 128(256) RO NS
                 max read 512
                 link x4(x4) speed 2.5(2.5)
    ecap 0001[100] = AER 1 0 fatal 0 non-fatal 4 corrected
    ecap 0003[140] = Serial 1 001b21ffff455ec0

igb1@pci0:3:0:1:	class=0x020000 card=0x145a8086 chip=0x10d68086 rev=0x02 hdr=0x00
    vendor     = 'Intel Corporation'
    device     = '82575GB Gigabit Network Connection'
    class      = network
    subclass   = ethernet
    bar   [10] = type Memory, range 32, base 0xfcfe0000, size 131072, enabled
    bar   [14] = type Memory, range 32, base 0xfd000000, size 2097152, enabled
    bar   [18] = type I/O Port, range 32, base 0xb880, size 32, enabled
    bar   [1c] = type Memory, range 32, base 0xfcfdc000, size 16384, enabled
    cap 01[40] = powerspec 2  supports D0 D3  current D0
    cap 05[50] = MSI supports 1 message, 64 bit 
    cap 11[60] = MSI-X supports 10 messages, enabled
                 Table in map 0x1c[0x0], PBA in map 0x1c[0x2000]
    cap 10[a0] = PCI-Express 2 endpoint max data 128(256) RO NS
                 max read 512
                 link x4(x4) speed 2.5(2.5)
    ecap 0001[100] = AER 1 0 fatal 0 non-fatal 4 corrected
    ecap 0003[140] = Serial 1 001b21ffff455ec0

igb2@pci0:4:0:0:	class=0x020000 card=0x145a8086 chip=0x10d68086 rev=0x02 hdr=0x00
    vendor     = 'Intel Corporation'
    device     = '82575GB Gigabit Network Connection'
    class      = network
    subclass   = ethernet
    bar   [10] = type Memory, range 32, base 0xfdbe0000, size 131072, enabled
    bar   [14] = type Memory, range 32, base 0xfdc00000, size 2097152, enabled
    bar   [18] = type I/O Port, range 32, base 0xcc00, size 32, enabled
    bar   [1c] = type Memory, range 32, base 0xfdbdc000, size 16384, enabled
    cap 01[40] = powerspec 2  supports D0 D3  current D0
    cap 05[50] = MSI supports 1 message, 64 bit 
    cap 11[60] = MSI-X supports 10 messages, enabled
                 Table in map 0x1c[0x0], PBA in map 0x1c[0x2000]
    cap 10[a0] = PCI-Express 2 endpoint max data 128(256) RO NS
                 max read 512
                 link x4(x4) speed 2.5(2.5)
    ecap 0001[100] = AER 1 0 fatal 0 non-fatal 3 corrected
    ecap 0003[140] = Serial 1 001b21ffff455ec4

igb3@pci0:4:0:1:	class=0x020000 card=0x145a8086 chip=0x10d68086 rev=0x02 hdr=0x00
    vendor     = 'Intel Corporation'
    device     = '82575GB Gigabit Network Connection'
    class      = network
    subclass   = ethernet
    bar   [10] = type Memory, range 32, base 0xfd7e0000, size 131072, enabled
    bar   [14] = type Memory, range 32, base 0xfd800000, size 2097152, enabled
    bar   [18] = type I/O Port, range 32, base 0xc880, size 32, enabled
    bar   [1c] = type Memory, range 32, base 0xfd7dc000, size 16384, enabled
    cap 01[40] = powerspec 2  supports D0 D3  current D0
    cap 05[50] = MSI supports 1 message, 64 bit 
    cap 11[60] = MSI-X supports 10 messages, enabled
                 Table in map 0x1c[0x0], PBA in map 0x1c[0x2000]
    cap 10[a0] = PCI-Express 2 endpoint max data 128(256) RO NS
                 max read 512
                 link x4(x4) speed 2.5(2.5)
    ecap 0001[100] = AER 1 0 fatal 0 non-fatal 3 corrected
    ecap 0003[140] = Serial 1 001b21ffff455ec4

em0@pci0:5:0:0:	class=0x020000 card=0x10d315d9 chip=0x10d38086 rev=0x00 hdr=0x00
    vendor     = 'Intel Corporation'
    device     = '82574L Gigabit Network Connection'
    class      = network
    subclass   = ethernet
    bar   [10] = type Memory, range 32, base 0xfe9e0000, size 131072, enabled
    bar   [18] = type I/O Port, range 32, base 0xdc00, size 32, enabled
    bar   [1c] = type Memory, range 32, base 0xfe9dc000, size 16384, enabled
    cap 01[c8] = powerspec 2  supports D0 D3  current D0
    cap 05[d0] = MSI supports 1 message, 64 bit 
    cap 10[e0] = PCI-Express 1 endpoint max data 128(256) RO NS
                 max read 512
                 link x1(x1) speed 2.5(2.5) ASPM disabled(L0s/L1)
    cap 11[a0] = MSI-X supports 5 messages, enabled
                 Table in map 0x1c[0x0], PBA in map 0x1c[0x2000]
    ecap 0001[100] = AER 1 0 fatal 0 non-fatal 3 corrected
    ecap 0003[140] = Serial 1 002590ffffc15744

em1@pci0:6:0:0:	class=0x020000 card=0x10d315d9 chip=0x10d38086 rev=0x00 hdr=0x00
    vendor     = 'Intel Corporation'
    device     = '82574L Gigabit Network Connection'
    class      = network
    subclass   = ethernet
    bar   [10] = type Memory, range 32, base 0xfeae0000, size 131072, enabled
    bar   [18] = type I/O Port, range 32, base 0xec00, size 32, enabled
    bar   [1c] = type Memory, range 32, base 0xfeadc000, size 16384, enabled
    cap 01[c8] = powerspec 2  supports D0 D3  current D0
    cap 05[d0] = MSI supports 1 message, 64 bit 
    cap 10[e0] = PCI-Express 1 endpoint max data 128(256) RO NS
                 max read 512
                 link x1(x1) speed 2.5(2.5) ASPM disabled(L0s/L1)
    cap 11[a0] = MSI-X supports 5 messages, enabled
                 Table in map 0x1c[0x0], PBA in map 0x1c[0x2000]
    ecap 0001[100] = AER 1 0 fatal 0 non-fatal 3 corrected
    ecap 0003[140] = Serial 1 002590ffffc15745

vgapci0@pci0:7:4:0:	class=0x030000 card=0x060a15d9 chip=0x0532102b rev=0x0a hdr=0x00
    vendor     = 'Matrox Electronics Systems Ltd.'
    device     = 'MGA G200eW WPCM450'
    class      = display
    subclass   = VGA
    bar   [10] = type Prefetchable Memory, range 32, base 0xfb000000, size 16777216, enabled
    bar   [14] = type Memory, range 32, base 0xfdffc000, size 16384, enabled
    bar   [18] = type Memory, range 32, base 0xfe000000, size 8388608, enabled
    cap 01[dc] = powerspec 1  supports D0 D3  current D0
