hostb0@pci0:0:0:0:	class=0x060000 rev=0x09 hdr=0x00 vendor=0x8086 device=0x0158 subvendor=0x1849 subdevice=0x0158
    vendor     = 'Intel Corporation'
    device     = 'Xeon E3-1200 v2/Ivy Bridge DRAM Controller'
    class      = bridge
    subclass   = HOST-PCI
    cap 09[e0] = vendor (length 12) Intel cap 0 version 1

pcib1@pci0:0:1:0:	class=0x060400 rev=0x09 hdr=0x01 vendor=0x8086 device=0x0151 subvendor=0x1849 subdevice=0x0151
    vendor     = 'Intel Corporation'
    device     = 'Xeon E3-1200 v2/3rd Gen Core processor PCI Express Root Port'
    class      = bridge
    subclass   = PCI-PCI
    cap 0d[88] = PCI Bridge subvendor=0x1849 subdevice=0x0151
    cap 01[80] = powerspec 3  supports D0 D3  current D0
    cap 05[90] = MSI supports 1 message 
    cap 10[a0] = PCI-Express 2 root port max data 128(256)
                 max read 128
                 link x16(x16) speed 2.5(8.0) ASPM disabled(L0s/L1)
                 slot 1 power limit 75000 mW
    ecap 0002[100] = VC 1 max VC0
    ecap 0005[140] = Root Complex Link Declaration 1
    ecap 0019[d94] = PCIe Sec 1 lane errors 0

xhci0@pci0:0:20:0:	class=0x0c0330 rev=0x04 hdr=0x00 vendor=0x8086 device=0x1e31 subvendor=0x1849 subdevice=0x1e31
    vendor     = 'Intel Corporation'
    device     = '7 Series/C210 Series Chipset Family USB xHCI Host Controller'
    class      = serial bus
    subclass   = USB
    bar   [10] = type Memory, range 64, base 0xf7500000, size 65536, enabled
    cap 01[70] = powerspec 2  supports D0 D3  current D0
    cap 05[80] = MSI supports 8 messages, 64 bit enabled with 1 message

none0@pci0:0:22:0:	class=0x078000 rev=0x04 hdr=0x00 vendor=0x8086 device=0x1e3a subvendor=0x1849 subdevice=0x1e3a
    vendor     = 'Intel Corporation'
    device     = '7 Series/C216 Chipset Family MEI Controller'
    class      = simple comms
    bar   [10] = type Memory, range 64, base 0xf751b000, size 16, enabled
    cap 01[50] = powerspec 3  supports D0 D3  current D0
    cap 05[8c] = MSI supports 1 message, 64 bit 

ehci0@pci0:0:26:0:	class=0x0c0320 rev=0x04 hdr=0x00 vendor=0x8086 device=0x1e2d subvendor=0x1849 subdevice=0x1e2d
    vendor     = 'Intel Corporation'
    device     = '7 Series/C216 Chipset Family USB Enhanced Host Controller'
    class      = serial bus
    subclass   = USB
    bar   [10] = type Memory, range 32, base 0xf7518000, size 1024, enabled
    cap 01[50] = powerspec 2  supports D0 D3  current D0
    cap 0a[58] = EHCI Debug Port at offset 0xa0 in map 0x14
    cap 13[98] = PCI Advanced Features: FLR TP

hdac1@pci0:0:27:0:	class=0x040300 rev=0x04 hdr=0x00 vendor=0x8086 device=0x1e20 subvendor=0x1849 subdevice=0x8892
    vendor     = 'Intel Corporation'
    device     = '7 Series/C216 Chipset Family High Definition Audio Controller'
    class      = multimedia
    subclass   = HDA
    bar   [10] = type Memory, range 64, base 0xf7510000, size 16384, enabled
    cap 01[50] = powerspec 2  supports D0 D3  current D0
    cap 05[60] = MSI supports 1 message, 64 bit enabled with 1 message
    cap 10[70] = PCI-Express 1 root endpoint max data 128(128) FLR NS
                 max read 128
    ecap 0002[100] = VC 1 max VC1
    ecap 0005[130] = Root Complex Link Declaration 1

pcib2@pci0:0:28:0:	class=0x060400 rev=0xc4 hdr=0x01 vendor=0x8086 device=0x1e10 subvendor=0x1849 subdevice=0x1e10
    vendor     = 'Intel Corporation'
    device     = '7 Series/C216 Chipset Family PCI Express Root Port 1'
    class      = bridge
    subclass   = PCI-PCI
    cap 10[40] = PCI-Express 2 root port max data 128(128)
                 max read 128
                 link x1(x1) speed 2.5(5.0) ASPM disabled(L0s/L1)
                 slot 0 power limit 100 mW
    cap 05[80] = MSI supports 1 message 
    cap 0d[90] = PCI Bridge subvendor=0x1849 subdevice=0x1e10
    cap 01[a0] = powerspec 2  supports D0 D3  current D0

pcib3@pci0:0:28:1:	class=0x060400 rev=0xc4 hdr=0x01 vendor=0x8086 device=0x1e12 subvendor=0x1849 subdevice=0x1e12
    vendor     = 'Intel Corporation'
    device     = '7 Series/C210 Series Chipset Family PCI Express Root Port 2'
    class      = bridge
    subclass   = PCI-PCI
    cap 10[40] = PCI-Express 2 root port max data 128(128)
                 max read 128
                 link x1(x1) speed 5.0(5.0) ASPM disabled(L0s/L1)
                 slot 1 power limit 100 mW
    cap 05[80] = MSI supports 1 message 
    cap 0d[90] = PCI Bridge subvendor=0x1849 subdevice=0x1e12
    cap 01[a0] = powerspec 2  supports D0 D3  current D0

pcib4@pci0:0:28:2:	class=0x060400 rev=0xc4 hdr=0x01 vendor=0x8086 device=0x1e14 subvendor=0x1849 subdevice=0x1e14
    vendor     = 'Intel Corporation'
    device     = '7 Series/C210 Series Chipset Family PCI Express Root Port 3'
    class      = bridge
    subclass   = PCI-PCI
    cap 10[40] = PCI-Express 2 root port max data 128(128)
                 max read 128
                 link x1(x1) speed 2.5(5.0) ASPM disabled(L0s/L1)
                 slot 2 power limit 100 mW
    cap 05[80] = MSI supports 1 message 
    cap 0d[90] = PCI Bridge subvendor=0x1849 subdevice=0x1e14
    cap 01[a0] = powerspec 2  supports D0 D3  current D0

pcib5@pci0:0:28:4:	class=0x060400 rev=0xc4 hdr=0x01 vendor=0x8086 device=0x1e18 subvendor=0x1849 subdevice=0x1e18
    vendor     = 'Intel Corporation'
    device     = '7 Series/C210 Series Chipset Family PCI Express Root Port 5'
    class      = bridge
    subclass   = PCI-PCI
    cap 10[40] = PCI-Express 2 root port max data 128(128)
                 max read 128
                 link x4(x4) speed 5.0(5.0) ASPM disabled(L0s/L1)
                 slot 4 power limit 250 mW
    cap 05[80] = MSI supports 1 message 
    cap 0d[90] = PCI Bridge subvendor=0x1849 subdevice=0x1e18
    cap 01[a0] = powerspec 2  supports D0 D3  current D0

ehci1@pci0:0:29:0:	class=0x0c0320 rev=0x04 hdr=0x00 vendor=0x8086 device=0x1e26 subvendor=0x1849 subdevice=0x1e26
    vendor     = 'Intel Corporation'
    device     = '7 Series/C216 Chipset Family USB Enhanced Host Controller'
    class      = serial bus
    subclass   = USB
    bar   [10] = type Memory, range 32, base 0xf7517000, size 1024, enabled
    cap 01[50] = powerspec 2  supports D0 D3  current D0
    cap 0a[58] = EHCI Debug Port at offset 0xa0 in map 0x14
    cap 13[98] = PCI Advanced Features: FLR TP

pcib6@pci0:0:30:0:	class=0x060401 rev=0xa4 hdr=0x01 vendor=0x8086 device=0x244e subvendor=0x1849 subdevice=0x244e
    vendor     = 'Intel Corporation'
    device     = '82801 PCI Bridge'
    class      = bridge
    subclass   = PCI-PCI
    cap 0d[50] = PCI Bridge subvendor=0x1849 subdevice=0x244e

isab0@pci0:0:31:0:	class=0x060100 rev=0x04 hdr=0x00 vendor=0x8086 device=0x1e49 subvendor=0x1849 subdevice=0x1e49
    vendor     = 'Intel Corporation'
    device     = 'B75 Express Chipset LPC Controller'
    class      = bridge
    subclass   = PCI-ISA
    cap 09[e0] = vendor (length 12) Intel cap 1 version 0
		 features: AMT, 4 PCI-e x1 slots

ahci1@pci0:0:31:2:	class=0x010601 rev=0x04 hdr=0x00 vendor=0x8086 device=0x1e02 subvendor=0x1849 subdevice=0x1e02
    vendor     = 'Intel Corporation'
    device     = '7 Series/C210 Series Chipset Family 6-port SATA Controller [AHCI mode]'
    class      = mass storage
    subclass   = SATA
    bar   [10] = type I/O Port, range 32, base 0xf070, size 8, enabled
    bar   [14] = type I/O Port, range 32, base 0xf060, size 4, enabled
    bar   [18] = type I/O Port, range 32, base 0xf050, size 8, enabled
    bar   [1c] = type I/O Port, range 32, base 0xf040, size 4, enabled
    bar   [20] = type I/O Port, range 32, base 0xf020, size 32, enabled
    bar   [24] = type Memory, range 32, base 0xf7516000, size 2048, enabled
    cap 05[80] = MSI supports 1 message enabled with 1 message
    cap 01[70] = powerspec 3  supports D0 D3  current D0
    cap 12[a8] = SATA Index-Data Pair
    cap 13[b0] = PCI Advanced Features: FLR TP

ichsmb0@pci0:0:31:3:	class=0x0c0500 rev=0x04 hdr=0x00 vendor=0x8086 device=0x1e22 subvendor=0x1849 subdevice=0x1e22
    vendor     = 'Intel Corporation'
    device     = '7 Series/C216 Chipset Family SMBus Controller'
    class      = serial bus
    subclass   = SMBus
    bar   [10] = type Memory, range 64, base 0xf7515000, size 256, enabled
    bar   [20] = type I/O Port, range 32, base 0xf000, size 32, enabled

vgapci0@pci0:1:0:0:	class=0x030000 rev=0xa1 hdr=0x00 vendor=0x10de device=0x0de1 subvendor=0x0000 subdevice=0x0000
    vendor     = 'NVIDIA Corporation'
    device     = 'GF108 [GeForce GT 430]'
    class      = display
    subclass   = VGA
    bar   [10] = type Memory, range 32, base 0xf6000000, size 16777216, enabled
    bar   [14] = type Prefetchable Memory, range 64, base 0xe8000000, size 134217728, enabled
    bar   [1c] = type Prefetchable Memory, range 64, base 0xf0000000, size 33554432, enabled
    bar   [24] = type I/O Port, range 32, base 0xe000, size 128, enabled
    cap 01[60] = powerspec 3  supports D0 D3  current D0
    cap 05[68] = MSI supports 1 message, 64 bit enabled with 1 message
    cap 10[78] = PCI-Express 2 endpoint max data 128(128) RO NS
                 max read 512
                 link x16(x16) speed 2.5(2.5) ASPM disabled(L0s/L1) ClockPM enabled
    cap 09[b4] = vendor (length 20)
    ecap 0002[100] = VC 1 max VC0
    ecap 0004[128] = Power Budgeting 1
    ecap 000b[600] = Vendor [1] ID 0001 Rev 1 Length 36

hdac0@pci0:1:0:1:	class=0x040300 rev=0xa1 hdr=0x00 vendor=0x10de device=0x0bea subvendor=0x0000 subdevice=0x0000
    vendor     = 'NVIDIA Corporation'
    device     = 'GF108 High Definition Audio Controller'
    class      = multimedia
    subclass   = HDA
    bar   [10] = type Memory, range 32, base 0xf7080000, size 16384, enabled
    cap 01[60] = powerspec 3  supports D0 D3  current D0
    cap 05[68] = MSI supports 1 message, 64 bit 
    cap 10[78] = PCI-Express 2 endpoint max data 128(128) NS
                 max read 512
                 link x16(x16) speed 2.5(2.5) ASPM disabled(L0s/L1) ClockPM enabled

bge0@pci0:2:0:0:	class=0x020000 rev=0x11 hdr=0x00 vendor=0x14e4 device=0x1677 subvendor=0x14e4 subdevice=0x1677
    vendor     = 'Broadcom Inc. and subsidiaries'
    device     = 'NetXtreme BCM5751 Gigabit Ethernet PCI Express'
    class      = network
    subclass   = ethernet
    bar   [10] = type Memory, range 64, base 0xf7410000, size 65536, enabled
    cap 01[48] = powerspec 2  supports D0 D3  current D0
    cap 03[50] = VPD
    cap 05[58] = MSI supports 8 messages, 64 bit 
    cap 10[d0] = PCI-Express 1 endpoint max data 128(128)
                 max read 4096
                 link x1(x1) speed 2.5(2.5) ASPM disabled(L0s)
    ecap 0001[100] = AER 1 0 fatal 0 non-fatal 1 corrected
    ecap 0002[13c] = VC 1 max VC0

ahci0@pci0:3:0:0:	class=0x010601 rev=0x01 hdr=0x00 vendor=0x1b21 device=0x0612 subvendor=0x1849 subdevice=0x0612
    vendor     = 'ASMedia Technology Inc.'
    device     = 'ASM1062 Serial ATA Controller'
    class      = mass storage
    subclass   = SATA
    bar   [10] = type I/O Port, range 32, base 0xd050, size 8, enabled
    bar   [14] = type I/O Port, range 32, base 0xd040, size 4, enabled
    bar   [18] = type I/O Port, range 32, base 0xd030, size 8, enabled
    bar   [1c] = type I/O Port, range 32, base 0xd020, size 4, enabled
    bar   [20] = type I/O Port, range 32, base 0xd000, size 32, enabled
    bar   [24] = type Memory, range 32, base 0xf7300000, size 512, enabled
    cap 05[50] = MSI supports 1 message enabled with 1 message
    cap 01[78] = powerspec 3  supports D0 D3  current D0
    cap 10[80] = PCI-Express 2 legacy endpoint max data 128(512) NS
                 max read 512
                 link x1(x1) speed 5.0(5.0) ASPM disabled(L0s)
    ecap 0002[100] = VC 1 max VC0

re0@pci0:4:0:0:	class=0x020000 rev=0x06 hdr=0x00 vendor=0x10ec device=0x8168 subvendor=0x1849 subdevice=0x8168
    vendor     = 'Realtek Semiconductor Co., Ltd.'
    device     = 'RTL8111/8168/8411 PCI Express Gigabit Ethernet Controller'
    class      = network
    subclass   = ethernet
    bar   [10] = type I/O Port, range 32, base 0xc000, size 256, enabled
    bar   [18] = type Prefetchable Memory, range 64, base 0xf2104000, size 4096, enabled
    bar   [20] = type Prefetchable Memory, range 64, base 0xf2100000, size 16384, enabled
    cap 01[40] = powerspec 3  supports D0 D1 D2 D3  current D0
    cap 05[50] = MSI supports 1 message, 64 bit 
    cap 10[70] = PCI-Express 2 endpoint MSI 1 max data 128(128)
                 max read 4096
                 link x1(x1) speed 2.5(2.5) ASPM disabled(L0s/L1) ClockPM disabled
    cap 11[b0] = MSI-X supports 4 messages, enabled
                 Table in map 0x20[0x0], PBA in map 0x20[0x800]
    cap 03[d0] = VPD
    ecap 0001[100] = AER 1 0 fatal 0 non-fatal 0 corrected
    ecap 0002[140] = VC 1 max VC0
    ecap 0003[160] = Serial 1 01000000684ce000

mps0@pci0:5:0:0:	class=0x010700 rev=0x03 hdr=0x00 vendor=0x1000 device=0x0072 subvendor=0x1028 subdevice=0x1f1c
    vendor     = 'Broadcom / LSI'
    device     = 'SAS2008 PCI-Express Fusion-MPT SAS-2 [Falcon]'
    class      = mass storage
    subclass   = SAS
    bar   [10] = type I/O Port, range 32, base 0xb000, size 256, enabled
    bar   [14] = type Memory, range 64, base 0xf7240000, size 65536, enabled
    bar   [1c] = type Memory, range 64, base 0xf7200000, size 262144, enabled
    cap 01[50] = powerspec 3  supports D0 D1 D2 D3  current D0
    cap 10[68] = PCI-Express 2 endpoint max data 128(4096) FLR NS
                 max read 512
                 link x4(x8) speed 5.0(5.0) ASPM disabled(L0s)
    cap 03[d0] = VPD
    cap 05[a8] = MSI supports 1 message, 64 bit 
    cap 11[c0] = MSI-X supports 15 messages, enabled
                 Table in map 0x14[0xe000], PBA in map 0x14[0xf800]
    ecap 0001[100] = AER 1 0 fatal 0 non-fatal 1 corrected
    ecap 0004[138] = Power Budgeting 1
