hostb0@pci0:0:0:0:	class=0x060000 rev=0x22 hdr=0x00 vendor=0x8086 device=0x3403 subvendor=0x15d9 subdevice=0x0006
    vendor     = 'Intel Corporation'
    device     = '5500 I/O Hub to ESI Port'
    class      = bridge
    subclass   = HOST-PCI
    cap 05[60] = MSI supports 2 messages, vector masks 
    cap 10[90] = PCI-Express 2 root port max data 128(128) ARI disabled
                 max read 128
                 link x4(x4) speed 2.5(2.5) ASPM disabled(L0s/L1)
    cap 01[e0] = powerspec 3  supports D0 D3  current D0
    ecap 0001[100] = AER 1 0 fatal 0 non-fatal 0 corrected
    ecap 000d[150] = ACS 1
    ecap 000b[160] = Vendor [0] ID 0002 Rev 0 Length 12

pcib1@pci0:0:1:0:	class=0x060400 rev=0x22 hdr=0x01 vendor=0x8086 device=0x3408 subvendor=0x15d9 subdevice=0x0006
    vendor     = 'Intel Corporation'
    device     = '5520/5500/X58 I/O Hub PCI Express Root Port 1'
    class      = bridge
    subclass   = PCI-PCI
    cap 0d[40] = PCI Bridge subvendor=0x15d9 subdevice=0x0006
    cap 05[60] = MSI supports 2 messages, vector masks 
    cap 10[90] = PCI-Express 2 root port max data 128(256) ARI disabled
                 max read 128
                 link x0(x4) speed 0.0(5.0) ASPM disabled(L0s/L1)
                 slot 5 power limit 25000 mW
    cap 01[e0] = powerspec 3  supports D0 D3  current D0
    ecap 0001[100] = AER 1 0 fatal 0 non-fatal 0 corrected
    ecap 000d[150] = ACS 1
    ecap 000b[160] = Vendor [0] ID 0002 Rev 0 Length 12

pcib2@pci0:0:3:0:	class=0x060400 rev=0x22 hdr=0x01 vendor=0x8086 device=0x340a subvendor=0x15d9 subdevice=0x0006
    vendor     = 'Intel Corporation'
    device     = '5520/5500/X58 I/O Hub PCI Express Root Port 3'
    class      = bridge
    subclass   = PCI-PCI
    cap 0d[40] = PCI Bridge subvendor=0x15d9 subdevice=0x0006
    cap 05[60] = MSI supports 2 messages, vector masks 
    cap 10[90] = PCI-Express 2 root port max data 128(256) ARI disabled
                 max read 128
                 link x0(x8) speed 0.0(5.0) ASPM disabled(L0s/L1)
                 slot 51 power limit 25000 mW
    cap 01[e0] = powerspec 3  supports D0 D3  current D0
    ecap 0001[100] = AER 1 0 fatal 0 non-fatal 0 corrected
    ecap 000d[150] = ACS 1
    ecap 000b[160] = Vendor [0] ID 0002 Rev 0 Length 12

pcib3@pci0:0:7:0:	class=0x060400 rev=0x22 hdr=0x01 vendor=0x8086 device=0x340e subvendor=0x15d9 subdevice=0x0006
    vendor     = 'Intel Corporation'
    device     = '5520/5500/X58 I/O Hub PCI Express Root Port 7'
    class      = bridge
    subclass   = PCI-PCI
    cap 0d[40] = PCI Bridge subvendor=0x15d9 subdevice=0x0006
    cap 05[60] = MSI supports 2 messages, vector masks 
    cap 10[90] = PCI-Express 2 root port max data 256(256) ARI disabled
                 max read 128
                 link x4(x8) speed 2.5(5.0) ASPM disabled(L0s/L1)
                 slot 6 power limit 25000 mW
    cap 01[e0] = powerspec 3  supports D0 D3  current D0
    ecap 0001[100] = AER 1 0 fatal 0 non-fatal 0 corrected
    ecap 000d[150] = ACS 1
    ecap 000b[160] = Vendor [0] ID 0002 Rev 0 Length 12

pcib7@pci0:0:9:0:	class=0x060400 rev=0x22 hdr=0x01 vendor=0x8086 device=0x3410 subvendor=0x15d9 subdevice=0x0006
    vendor     = 'Intel Corporation'
    device     = '7500/5520/5500/X58 I/O Hub PCI Express Root Port 9'
    class      = bridge
    subclass   = PCI-PCI
    cap 0d[40] = PCI Bridge subvendor=0x15d9 subdevice=0x0006
    cap 05[60] = MSI supports 2 messages, vector masks 
    cap 10[90] = PCI-Express 2 root port max data 128(256) ARI disabled
                 max read 128
                 link x0(x8) speed 0.0(5.0) ASPM disabled(L0s/L1)
                 slot 4 power limit 25000 mW
    cap 01[e0] = powerspec 3  supports D0 D3  current D0
    ecap 0001[100] = AER 1 0 fatal 0 non-fatal 0 corrected
    ecap 000d[150] = ACS 1

ioapic0@pci0:0:19:0:	class=0x080020 rev=0x22 hdr=0x00 vendor=0x8086 device=0x342d subvendor=0x0000 subdevice=0x0000
    vendor     = 'Intel Corporation'
    device     = '7500/5520/5500/X58 I/O Hub I/OxAPIC Interrupt Controller'
    class      = base peripheral
    subclass   = interrupt controller
    bar   [10] = type Memory, range 32, base 0xfec8a000, size 4096, enabled
    cap 01[6c] = powerspec 3  supports D0 D3  current D0

none0@pci0:0:20:0:	class=0x080000 rev=0x22 hdr=0x00 vendor=0x8086 device=0x342e subvendor=0x0000 subdevice=0x0000
    vendor     = 'Intel Corporation'
    device     = '7500/5520/5500/X58 I/O Hub System Management Registers'
    class      = base peripheral
    subclass   = interrupt controller
    cap 10[40] = PCI-Express 2 root endpoint max data 128(128)
                 max read 128
                 link x0(x0) ASPM disabled(L0s)

none1@pci0:0:20:1:	class=0x080000 rev=0x22 hdr=0x00 vendor=0x8086 device=0x3422 subvendor=0x0000 subdevice=0x0000
    vendor     = 'Intel Corporation'
    device     = '7500/5520/5500/X58 I/O Hub GPIO and Scratch Pad Registers'
    class      = base peripheral
    subclass   = interrupt controller
    cap 10[40] = PCI-Express 2 root endpoint max data 128(128)
                 max read 128
                 link x0(x0) ASPM disabled(L0s)

none2@pci0:0:20:2:	class=0x080000 rev=0x22 hdr=0x00 vendor=0x8086 device=0x3423 subvendor=0x0000 subdevice=0x0000
    vendor     = 'Intel Corporation'
    device     = '7500/5520/5500/X58 I/O Hub Control Status and RAS Registers'
    class      = base peripheral
    subclass   = interrupt controller
    cap 10[40] = PCI-Express 2 root endpoint max data 128(128)
                 max read 128
                 link x0(x0) ASPM disabled(L0s)

none3@pci0:0:20:3:	class=0x080000 rev=0x22 hdr=0x00 vendor=0x8086 device=0x3438 subvendor=0x0000 subdevice=0x0000
    vendor     = 'Intel Corporation'
    device     = '7500/5520/5500/X58 I/O Hub Throttle Registers'
    class      = base peripheral
    subclass   = interrupt controller

ioat0@pci0:0:22:0:	class=0x088000 rev=0x22 hdr=0x00 vendor=0x8086 device=0x3430 subvendor=0x15d9 subdevice=0x0006
    vendor     = 'Intel Corporation'
    device     = '5520/5500/X58 Chipset QuickData Technology Device'
    class      = base peripheral
    bar   [10] = type Memory, range 64, base 0xfbef8000, size 16384, enabled
    cap 11[80] = MSI-X supports 1 message, enabled
                 Table in map 0x10[0x2000], PBA in map 0x10[0x3000]
    cap 10[90] = PCI-Express 2 root endpoint max data 128(128)
                 max read 128
    cap 01[e0] = powerspec 3  supports D0 D3  current D0

ioat1@pci0:0:22:1:	class=0x088000 rev=0x22 hdr=0x00 vendor=0x8086 device=0x3431 subvendor=0x15d9 subdevice=0x0006
    vendor     = 'Intel Corporation'
    device     = '5520/5500/X58 Chipset QuickData Technology Device'
    class      = base peripheral
    bar   [10] = type Memory, range 64, base 0xfbef4000, size 16384, enabled
    cap 11[80] = MSI-X supports 1 message, enabled
                 Table in map 0x10[0x2000], PBA in map 0x10[0x3000]
    cap 10[90] = PCI-Express 2 root endpoint max data 128(128)
                 max read 128
    cap 01[e0] = powerspec 3  supports D0 D3  current D0

ioat2@pci0:0:22:2:	class=0x088000 rev=0x22 hdr=0x00 vendor=0x8086 device=0x3432 subvendor=0x15d9 subdevice=0x0006
    vendor     = 'Intel Corporation'
    device     = '5520/5500/X58 Chipset QuickData Technology Device'
    class      = base peripheral
    bar   [10] = type Memory, range 64, base 0xfbef0000, size 16384, enabled
    cap 11[80] = MSI-X supports 1 message, enabled
                 Table in map 0x10[0x2000], PBA in map 0x10[0x3000]
    cap 10[90] = PCI-Express 2 root endpoint max data 128(128)
                 max read 128
    cap 01[e0] = powerspec 3  supports D0 D3  current D0

ioat3@pci0:0:22:3:	class=0x088000 rev=0x22 hdr=0x00 vendor=0x8086 device=0x3433 subvendor=0x15d9 subdevice=0x0006
    vendor     = 'Intel Corporation'
    device     = '5520/5500/X58 Chipset QuickData Technology Device'
    class      = base peripheral
    bar   [10] = type Memory, range 64, base 0xfbeec000, size 16384, enabled
    cap 11[80] = MSI-X supports 1 message, enabled
                 Table in map 0x10[0x2000], PBA in map 0x10[0x3000]
    cap 10[90] = PCI-Express 2 root endpoint max data 128(128)
                 max read 128
    cap 01[e0] = powerspec 3  supports D0 D3  current D0

ioat4@pci0:0:22:4:	class=0x088000 rev=0x22 hdr=0x00 vendor=0x8086 device=0x3429 subvendor=0x15d9 subdevice=0x0006
    vendor     = 'Intel Corporation'
    device     = '5520/5500/X58 Chipset QuickData Technology Device'
    class      = base peripheral
    bar   [10] = type Memory, range 64, base 0xfbee8000, size 16384, enabled
    cap 11[80] = MSI-X supports 1 message, enabled
                 Table in map 0x10[0x2000], PBA in map 0x10[0x3000]
    cap 10[90] = PCI-Express 2 root endpoint max data 128(128)
                 max read 128
    cap 01[e0] = powerspec 3  supports D0 D3  current D0

ioat5@pci0:0:22:5:	class=0x088000 rev=0x22 hdr=0x00 vendor=0x8086 device=0x342a subvendor=0x15d9 subdevice=0x0006
    vendor     = 'Intel Corporation'
    device     = '5520/5500/X58 Chipset QuickData Technology Device'
    class      = base peripheral
    bar   [10] = type Memory, range 64, base 0xfbee4000, size 16384, enabled
    cap 11[80] = MSI-X supports 1 message, enabled
                 Table in map 0x10[0x2000], PBA in map 0x10[0x3000]
    cap 10[90] = PCI-Express 2 root endpoint max data 128(128)
                 max read 128
    cap 01[e0] = powerspec 3  supports D0 D3  current D0

ioat6@pci0:0:22:6:	class=0x088000 rev=0x22 hdr=0x00 vendor=0x8086 device=0x342b subvendor=0x15d9 subdevice=0x0006
    vendor     = 'Intel Corporation'
    device     = '5520/5500/X58 Chipset QuickData Technology Device'
    class      = base peripheral
    bar   [10] = type Memory, range 64, base 0xfbee0000, size 16384, enabled
    cap 11[80] = MSI-X supports 1 message, enabled
                 Table in map 0x10[0x2000], PBA in map 0x10[0x3000]
    cap 10[90] = PCI-Express 2 root endpoint max data 128(128)
                 max read 128
    cap 01[e0] = powerspec 3  supports D0 D3  current D0

ioat7@pci0:0:22:7:	class=0x088000 rev=0x22 hdr=0x00 vendor=0x8086 device=0x342c subvendor=0x15d9 subdevice=0x0006
    vendor     = 'Intel Corporation'
    device     = '5520/5500/X58 Chipset QuickData Technology Device'
    class      = base peripheral
    bar   [10] = type Memory, range 64, base 0xfbedc000, size 16384, enabled
    cap 11[80] = MSI-X supports 1 message, enabled
                 Table in map 0x10[0x2000], PBA in map 0x10[0x3000]
    cap 10[90] = PCI-Express 2 root endpoint max data 128(128)
                 max read 128
    cap 01[e0] = powerspec 3  supports D0 D3  current D0

uhci0@pci0:0:26:0:	class=0x0c0300 rev=0x00 hdr=0x00 vendor=0x8086 device=0x3a37 subvendor=0x15d9 subdevice=0x0006
    vendor     = 'Intel Corporation'
    device     = '82801JI (ICH10 Family) USB UHCI Controller'
    class      = serial bus
    subclass   = USB
    bar   [20] = type I/O Port, range 32, base 0xac00, size 32, enabled
    cap 13[50] = PCI Advanced Features: FLR TP

uhci1@pci0:0:26:1:	class=0x0c0300 rev=0x00 hdr=0x00 vendor=0x8086 device=0x3a38 subvendor=0x15d9 subdevice=0x0006
    vendor     = 'Intel Corporation'
    device     = '82801JI (ICH10 Family) USB UHCI Controller'
    class      = serial bus
    subclass   = USB
    bar   [20] = type I/O Port, range 32, base 0xa880, size 32, enabled
    cap 13[50] = PCI Advanced Features: FLR TP

uhci2@pci0:0:26:2:	class=0x0c0300 rev=0x00 hdr=0x00 vendor=0x8086 device=0x3a39 subvendor=0x15d9 subdevice=0x0006
    vendor     = 'Intel Corporation'
    device     = '82801JI (ICH10 Family) USB UHCI Controller'
    class      = serial bus
    subclass   = USB
    bar   [20] = type I/O Port, range 32, base 0xa800, size 32, enabled
    cap 13[50] = PCI Advanced Features: FLR TP

ehci0@pci0:0:26:7:	class=0x0c0320 rev=0x00 hdr=0x00 vendor=0x8086 device=0x3a3c subvendor=0x15d9 subdevice=0x0006
    vendor     = 'Intel Corporation'
    device     = '82801JI (ICH10 Family) USB2 EHCI Controller'
    class      = serial bus
    subclass   = USB
    bar   [10] = type Memory, range 32, base 0xfbeda000, size 1024, enabled
    cap 01[50] = powerspec 2  supports D0 D3  current D0
    cap 0a[58] = EHCI Debug Port at offset 0xa0 in map 0x14
    cap 13[98] = PCI Advanced Features: FLR TP

hdac0@pci0:0:27:0:	class=0x040300 rev=0x00 hdr=0x00 vendor=0x8086 device=0x3a3e subvendor=0x15d9 subdevice=0x0006
    vendor     = 'Intel Corporation'
    device     = '82801JI (ICH10 Family) HD Audio Controller'
    class      = multimedia
    subclass   = HDA
    bar   [10] = type Memory, range 64, base 0xfbed4000, size 16384, enabled
    cap 01[50] = powerspec 2  supports D0 D3  current D0
    cap 05[60] = MSI supports 1 message, 64 bit enabled with 1 message
    cap 10[70] = PCI-Express 1 root endpoint max data 128(128) FLR NS
                 max read 128
    ecap 0002[100] = VC 1 max VC1
    ecap 0005[130] = Root Complex Link Declaration 1

pcib8@pci0:0:28:0:	class=0x060400 rev=0x00 hdr=0x01 vendor=0x8086 device=0x3a40 subvendor=0x15d9 subdevice=0x0006
    vendor     = 'Intel Corporation'
    device     = '82801JI (ICH10 Family) PCI Express Root Port 1'
    class      = bridge
    subclass   = PCI-PCI
    cap 10[40] = PCI-Express 1 root port max data 128(128)
                 max read 128
                 link x0(x4) speed 0.0(2.5) ASPM disabled(L0s/L1)
                 slot 0 power limit 10000 mW HotPlug(empty) surprise
    cap 05[80] = MSI supports 1 message 
    cap 0d[90] = PCI Bridge subvendor=0x15d9 subdevice=0x0006
    cap 01[a0] = powerspec 2  supports D0 D3  current D0
    ecap 0002[100] = VC 1 max VC0
    ecap 0005[180] = Root Complex Link Declaration 1

pcib9@pci0:0:28:4:	class=0x060400 rev=0x00 hdr=0x01 vendor=0x8086 device=0x3a48 subvendor=0x15d9 subdevice=0x0006
    vendor     = 'Intel Corporation'
    device     = '82801JI (ICH10 Family) PCI Express Root Port 5'
    class      = bridge
    subclass   = PCI-PCI
    cap 10[40] = PCI-Express 1 root port max data 128(128)
                 max read 128
                 link x1(x1) speed 2.5(2.5) ASPM disabled(L0s/L1)
                 slot 0 power limit 10000 mW HotPlug(present) surprise
    cap 05[80] = MSI supports 1 message 
    cap 0d[90] = PCI Bridge subvendor=0x15d9 subdevice=0x0006
    cap 01[a0] = powerspec 2  supports D0 D3  current D0
    ecap 0002[100] = VC 1 max VC0
    ecap 0005[180] = Root Complex Link Declaration 1

pcib10@pci0:0:28:5:	class=0x060400 rev=0x00 hdr=0x01 vendor=0x8086 device=0x3a4a subvendor=0x15d9 subdevice=0x0006
    vendor     = 'Intel Corporation'
    device     = '82801JI (ICH10 Family) PCI Express Root Port 6'
    class      = bridge
    subclass   = PCI-PCI
    cap 10[40] = PCI-Express 1 root port max data 128(128)
                 max read 128
                 link x1(x1) speed 2.5(2.5) ASPM disabled(L0s/L1)
                 slot 0 power limit 10000 mW HotPlug(present) surprise
    cap 05[80] = MSI supports 1 message 
    cap 0d[90] = PCI Bridge subvendor=0x15d9 subdevice=0x0006
    cap 01[a0] = powerspec 2  supports D0 D3  current D0
    ecap 0002[100] = VC 1 max VC0
    ecap 0005[180] = Root Complex Link Declaration 1

uhci3@pci0:0:29:0:	class=0x0c0300 rev=0x00 hdr=0x00 vendor=0x8086 device=0x3a34 subvendor=0x15d9 subdevice=0x0006
    vendor     = 'Intel Corporation'
    device     = '82801JI (ICH10 Family) USB UHCI Controller'
    class      = serial bus
    subclass   = USB
    bar   [20] = type I/O Port, range 32, base 0xa480, size 32, enabled
    cap 13[50] = PCI Advanced Features: FLR TP

uhci4@pci0:0:29:1:	class=0x0c0300 rev=0x00 hdr=0x00 vendor=0x8086 device=0x3a35 subvendor=0x15d9 subdevice=0x0006
    vendor     = 'Intel Corporation'
    device     = '82801JI (ICH10 Family) USB UHCI Controller'
    class      = serial bus
    subclass   = USB
    bar   [20] = type I/O Port, range 32, base 0xa400, size 32, enabled
    cap 13[50] = PCI Advanced Features: FLR TP

uhci5@pci0:0:29:2:	class=0x0c0300 rev=0x00 hdr=0x00 vendor=0x8086 device=0x3a36 subvendor=0x15d9 subdevice=0x0006
    vendor     = 'Intel Corporation'
    device     = '82801JI (ICH10 Family) USB UHCI Controller'
    class      = serial bus
    subclass   = USB
    bar   [20] = type I/O Port, range 32, base 0xa080, size 32, enabled
    cap 13[50] = PCI Advanced Features: FLR TP

ehci1@pci0:0:29:7:	class=0x0c0320 rev=0x00 hdr=0x00 vendor=0x8086 device=0x3a3a subvendor=0x15d9 subdevice=0x0006
    vendor     = 'Intel Corporation'
    device     = '82801JI (ICH10 Family) USB2 EHCI Controller'
    class      = serial bus
    subclass   = USB
    bar   [10] = type Memory, range 32, base 0xfbed8000, size 1024, enabled
    cap 01[50] = powerspec 2  supports D0 D3  current D0
    cap 0a[58] = EHCI Debug Port at offset 0xa0 in map 0x14
    cap 13[98] = PCI Advanced Features: FLR TP

pcib11@pci0:0:30:0:	class=0x060401 rev=0x90 hdr=0x01 vendor=0x8086 device=0x244e subvendor=0x15d9 subdevice=0x0006
    vendor     = 'Intel Corporation'
    device     = '82801 PCI Bridge'
    class      = bridge
    subclass   = PCI-PCI
    cap 0d[50] = PCI Bridge subvendor=0x15d9 subdevice=0x0006

isab0@pci0:0:31:0:	class=0x060100 rev=0x00 hdr=0x00 vendor=0x8086 device=0x3a16 subvendor=0x15d9 subdevice=0x0006
    vendor     = 'Intel Corporation'
    device     = '82801JIR (ICH10R) LPC Interface Controller'
    class      = bridge
    subclass   = PCI-ISA
    cap 09[e0] = vendor (length 12) Intel cap 1 version 0
		 features: SATA RAID-5, 4 PCI-e x1 slots

atapci0@pci0:0:31:2:	class=0x01018f rev=0x00 hdr=0x00 vendor=0x8086 device=0x3a20 subvendor=0x15d9 subdevice=0x0006
    vendor     = 'Intel Corporation'
    device     = '82801JI (ICH10 Family) 4 port SATA IDE Controller'
    class      = mass storage
    subclass   = ATA
    bar   [10] = type I/O Port, range 32, base 0xa000, size 8, enabled
    bar   [14] = type I/O Port, range 32, base 0x9c00, size 4, enabled
    bar   [18] = type I/O Port, range 32, base 0x9880, size 8, enabled
    bar   [1c] = type I/O Port, range 32, base 0x9800, size 4, enabled
    bar   [20] = type I/O Port, range 32, base 0x9480, size 16, enabled
    bar   [24] = type I/O Port, range 32, base 0x9400, size 16, enabled
    cap 01[70] = powerspec 3  supports D0 D3  current D0
    cap 13[b0] = PCI Advanced Features: FLR TP

ichsmb0@pci0:0:31:3:	class=0x0c0500 rev=0x00 hdr=0x00 vendor=0x8086 device=0x3a30 subvendor=0x15d9 subdevice=0x0006
    vendor     = 'Intel Corporation'
    device     = '82801JI (ICH10 Family) SMBus Controller'
    class      = serial bus
    subclass   = SMBus
    bar   [10] = type Memory, range 64, base 0xfbed2000, size 256, enabled
    bar   [20] = type I/O Port, range 32, base 0x400, size 32, enabled

atapci1@pci0:0:31:5:	class=0x010185 rev=0x00 hdr=0x00 vendor=0x8086 device=0x3a26 subvendor=0x15d9 subdevice=0x0006
    vendor     = 'Intel Corporation'
    device     = '82801JI (ICH10 Family) 2 port SATA IDE Controller'
    class      = mass storage
    subclass   = ATA
    bar   [10] = type I/O Port, range 32, base 0x9000, size 8, enabled
    bar   [14] = type I/O Port, range 32, base 0x8c00, size 4, enabled
    bar   [18] = type I/O Port, range 32, base 0x8880, size 8, enabled
    bar   [1c] = type I/O Port, range 32, base 0x8800, size 4, enabled
    bar   [20] = type I/O Port, range 32, base 0x8480, size 16, enabled
    bar   [24] = type I/O Port, range 32, base 0x8400, size 16, enabled
    cap 01[70] = powerspec 3  supports D0 D3  current D0
    cap 13[b0] = PCI Advanced Features: FLR TP

pcib4@pci0:3:0:0:	class=0x060400 rev=0x04 hdr=0x01 vendor=0x111d device=0x8018 subvendor=0x0000 subdevice=0x0000
    vendor     = 'Microsemi / PMC / IDT'
    device     = 'PES12N3A 12-lane 3-Port PCI Express Switch'
    class      = bridge
    subclass   = PCI-PCI
    cap 10[40] = PCI-Express 1 upstream port max data 256(2048)
                 max read 128
                 link x4(x4) speed 2.5(2.5) ASPM disabled(L0s/L1)
    cap 01[70] = powerspec 2  supports D0 D3  current D0
    ecap 0002[100] = VC 1 max VC0

pcib5@pci0:4:0:0:	class=0x060400 rev=0x04 hdr=0x01 vendor=0x111d device=0x8018 subvendor=0x0000 subdevice=0x0000
    vendor     = 'Microsemi / PMC / IDT'
    device     = 'PES12N3A 12-lane 3-Port PCI Express Switch'
    class      = bridge
    subclass   = PCI-PCI
    cap 10[40] = PCI-Express 1 downstream port max data 256(2048)
                 max read 128
                 link x4(x4) speed 2.5(2.5) ASPM disabled(L0s/L1)
    cap 01[70] = powerspec 2  supports D0 D3  current D0
    cap 05[7c] = MSI supports 1 message, 64 bit 
    ecap 0002[100] = VC 1 max VC0

pcib6@pci0:4:1:0:	class=0x060400 rev=0x04 hdr=0x01 vendor=0x111d device=0x8018 subvendor=0x0000 subdevice=0x0000
    vendor     = 'Microsemi / PMC / IDT'
    device     = 'PES12N3A 12-lane 3-Port PCI Express Switch'
    class      = bridge
    subclass   = PCI-PCI
    cap 10[40] = PCI-Express 1 downstream port max data 256(2048)
                 max read 128
                 link x4(x4) speed 2.5(2.5) ASPM disabled(L0s/L1)
    cap 01[70] = powerspec 2  supports D0 D3  current D0
    cap 05[7c] = MSI supports 1 message, 64 bit 
    ecap 0002[100] = VC 1 max VC0

em0@pci0:5:0:0:	class=0x020000 rev=0x06 hdr=0x00 vendor=0x8086 device=0x10a4 subvendor=0x8086 subdevice=0x10a4
    vendor     = 'Intel Corporation'
    device     = '82571EB Gigabit Ethernet Controller'
    class      = network
    subclass   = ethernet
    bar   [10] = type Memory, range 32, base 0xfbae0000, size 131072, enabled
    bar   [14] = type Memory, range 32, base 0xfbac0000, size 131072, enabled
    bar   [18] = type I/O Port, range 32, base 0xbc00, size 32, enabled
    cap 01[c8] = powerspec 2  supports D0 D3  current D0
    cap 05[d0] = MSI supports 1 message, 64 bit enabled with 1 message
    cap 10[e0] = PCI-Express 1 endpoint max data 256(256) RO NS
                 max read 512
                 link x4(x4) speed 2.5(2.5) ASPM disabled(L0s)
    ecap 0001[100] = AER 1 0 fatal 1 non-fatal 0 corrected
    ecap 0003[140] = Serial 1 001517ffff1eba80

em1@pci0:5:0:1:	class=0x020000 rev=0x06 hdr=0x00 vendor=0x8086 device=0x10a4 subvendor=0x8086 subdevice=0x10a4
    vendor     = 'Intel Corporation'
    device     = '82571EB Gigabit Ethernet Controller'
    class      = network
    subclass   = ethernet
    bar   [10] = type Memory, range 32, base 0xfba80000, size 131072, enabled
    bar   [14] = type Memory, range 32, base 0xfba60000, size 131072, enabled
    bar   [18] = type I/O Port, range 32, base 0xb880, size 32, enabled
    cap 01[c8] = powerspec 2  supports D0 D3  current D0
    cap 05[d0] = MSI supports 1 message, 64 bit enabled with 1 message
    cap 10[e0] = PCI-Express 1 endpoint max data 256(256) RO NS
                 max read 512
                 link x4(x4) speed 2.5(2.5) ASPM disabled(L0s)
    ecap 0001[100] = AER 1 0 fatal 1 non-fatal 0 corrected
    ecap 0003[140] = Serial 1 001517ffff1eba80

em2@pci0:6:0:0:	class=0x020000 rev=0x06 hdr=0x00 vendor=0x8086 device=0x10a4 subvendor=0x8086 subdevice=0x10a4
    vendor     = 'Intel Corporation'
    device     = '82571EB Gigabit Ethernet Controller'
    class      = network
    subclass   = ethernet
    bar   [10] = type Memory, range 32, base 0xfbbe0000, size 131072, enabled
    bar   [14] = type Memory, range 32, base 0xfbbc0000, size 131072, enabled
    bar   [18] = type I/O Port, range 32, base 0xcc00, size 32, enabled
    cap 01[c8] = powerspec 2  supports D0 D3  current D0
    cap 05[d0] = MSI supports 1 message, 64 bit enabled with 1 message
    cap 10[e0] = PCI-Express 1 endpoint max data 256(256) RO NS
                 max read 512
                 link x4(x4) speed 2.5(2.5) ASPM disabled(L0s)
    ecap 0001[100] = AER 1 0 fatal 1 non-fatal 0 corrected
    ecap 0003[140] = Serial 1 001517ffff1eba82

em3@pci0:6:0:1:	class=0x020000 rev=0x06 hdr=0x00 vendor=0x8086 device=0x10a4 subvendor=0x8086 subdevice=0x10a4
    vendor     = 'Intel Corporation'
    device     = '82571EB Gigabit Ethernet Controller'
    class      = network
    subclass   = ethernet
    bar   [10] = type Memory, range 32, base 0xfbb80000, size 131072, enabled
    bar   [14] = type Memory, range 32, base 0xfbb60000, size 131072, enabled
    bar   [18] = type I/O Port, range 32, base 0xc880, size 32, enabled
    cap 01[c8] = powerspec 2  supports D0 D3  current D0
    cap 05[d0] = MSI supports 1 message, 64 bit enabled with 1 message
    cap 10[e0] = PCI-Express 1 endpoint max data 256(256) RO NS
                 max read 512
                 link x4(x4) speed 2.5(2.5) ASPM disabled(L0s)
    ecap 0001[100] = AER 1 0 fatal 1 non-fatal 0 corrected
    ecap 0003[140] = Serial 1 001517ffff1eba82

em4@pci0:9:0:0:	class=0x020000 rev=0x00 hdr=0x00 vendor=0x8086 device=0x10d3 subvendor=0x15d9 subdevice=0x10d3
    vendor     = 'Intel Corporation'
    device     = '82574L Gigabit Network Connection'
    class      = network
    subclass   = ethernet
    bar   [10] = type Memory, range 32, base 0xfbce0000, size 131072, enabled
    bar   [18] = type I/O Port, range 32, base 0xdc00, size 32, enabled
    bar   [1c] = type Memory, range 32, base 0xfbcdc000, size 16384, enabled
    cap 01[c8] = powerspec 2  supports D0 D3  current D0
    cap 05[d0] = MSI supports 1 message, 64 bit 
    cap 10[e0] = PCI-Express 1 endpoint max data 128(256) RO NS
                 max read 512
                 link x1(x1) speed 2.5(2.5) ASPM disabled(L0s/L1)
    cap 11[a0] = MSI-X supports 5 messages, enabled
                 Table in map 0x1c[0x0], PBA in map 0x1c[0x2000]
    ecap 0001[100] = AER 1 0 fatal 0 non-fatal 0 corrected

em5@pci0:10:0:0:	class=0x020000 rev=0x00 hdr=0x00 vendor=0x8086 device=0x10d3 subvendor=0x15d9 subdevice=0x10d3
    vendor     = 'Intel Corporation'
    device     = '82574L Gigabit Network Connection'
    class      = network
    subclass   = ethernet
    bar   [10] = type Memory, range 32, base 0xfbde0000, size 131072, enabled
    bar   [18] = type I/O Port, range 32, base 0xec00, size 32, enabled
    bar   [1c] = type Memory, range 32, base 0xfbddc000, size 16384, enabled
    cap 01[c8] = powerspec 2  supports D0 D3  current D0
    cap 05[d0] = MSI supports 1 message, 64 bit 
    cap 10[e0] = PCI-Express 1 endpoint max data 128(256) RO NS
                 max read 512
                 link x1(x1) speed 2.5(2.5) ASPM disabled(L0s/L1)
    cap 11[a0] = MSI-X supports 5 messages, enabled
                 Table in map 0x1c[0x0], PBA in map 0x1c[0x2000]
    ecap 0001[100] = AER 1 0 fatal 0 non-fatal 0 corrected

vgapci0@pci0:11:1:0:	class=0x030000 rev=0x0a hdr=0x00 vendor=0x102b device=0x0532 subvendor=0x15d9 subdevice=0x0006
    vendor     = 'Matrox Electronics Systems Ltd.'
    device     = 'MGA G200eW WPCM450'
    class      = display
    subclass   = VGA
    bar   [10] = type Prefetchable Memory, range 32, base 0xf9000000, size 16777216, enabled
    bar   [14] = type Memory, range 32, base 0xfaffc000, size 16384, enabled
    bar   [18] = type Memory, range 32, base 0xfb000000, size 8388608, enabled
    cap 01[dc] = powerspec 1  supports D0 D3  current D0
