hostb0@pci0:0:0:0:	class=0x060000 card=0x06511039 chip=0x06511039 rev=0x02 hdr=0x00
    vendor     = 'Silicon Integrated Systems [SiS]'
    device     = '651 Host'
    class      = bridge
    subclass   = HOST-PCI
    bar   [10] = type Memory, range 32, base 0xe2000000, size 16777216, enabled
    cap 02[c0] = AGP 4x 2x 1x SBA disabled

pcib1@pci0:0:1:0:	class=0x060400 card=0x00000000 chip=0x00011039 rev=0x00 hdr=0x01
    vendor     = 'Silicon Integrated Systems [SiS]'
    device     = 'AGP Port (virtual PCI-to-PCI bridge)'
    class      = bridge
    subclass   = PCI-PCI

isab0@pci0:0:2:0:	class=0x060100 card=0x00000000 chip=0x00081039 rev=0x25 hdr=0x00
    vendor     = 'Silicon Integrated Systems [SiS]'
    device     = 'SiS85C503/5513 (LPC Bridge)'
    class      = bridge
    subclass   = PCI-ISA

atapci0@pci0:0:2:5:	class=0x01018a card=0x53321462 chip=0x55131039 rev=0x00 hdr=0x00
    vendor     = 'Silicon Integrated Systems [SiS]'
    device     = '5513 IDE Controller'
    class      = mass storage
    subclass   = ATA
    bar   [20] = type I/O Port, range 32, base 0x4000, size 16, enabled
    cap 01[58] = powerspec 2  supports D0 D1 D2 D3  current D0

pcm0@pci0:0:2:7:	class=0x040100 card=0x53321462 chip=0x70121039 rev=0xa0 hdr=0x00
    vendor     = 'Silicon Integrated Systems [SiS]'
    device     = 'SiS7012 AC'97 Sound Controller'
    class      = multimedia
    subclass   = audio
    bar   [10] = type I/O Port, range 32, base 0xe000, size 256, enabled
    bar   [14] = type I/O Port, range 32, base 0xe400, size 128, enabled
    cap 01[48] = powerspec 2  supports D0 D1 D2 D3  current D0

ohci0@pci0:0:3:0:	class=0x0c0310 card=0x53321462 chip=0x70011039 rev=0x0f hdr=0x00
    vendor     = 'Silicon Integrated Systems [SiS]'
    device     = 'USB 1.1 Controller'
    class      = serial bus
    subclass   = USB
    bar   [10] = type Memory, range 32, base 0xe4006000, size 4096, enabled

ohci1@pci0:0:3:1:	class=0x0c0310 card=0x53321462 chip=0x70011039 rev=0x0f hdr=0x00
    vendor     = 'Silicon Integrated Systems [SiS]'
    device     = 'USB 1.1 Controller'
    class      = serial bus
    subclass   = USB
    bar   [10] = type Memory, range 32, base 0xe4000000, size 4096, enabled

ehci0@pci0:0:3:3:	class=0x0c0320 card=0x53321462 chip=0x70021039 rev=0x00 hdr=0x00
    vendor     = 'Silicon Integrated Systems [SiS]'
    device     = 'USB 2.0 Controller'
    class      = serial bus
    subclass   = USB
    bar   [10] = type Memory, range 32, base 0xe4001000, size 4096, enabled
    cap 01[50] = powerspec 2  supports D0 D3  current D0

ohci2@pci0:0:8:0:	class=0x0c0310 card=0x00351033 chip=0x00351033 rev=0x41 hdr=0x00
    vendor     = 'NEC Corporation'
    device     = 'OHCI USB Controller'
    class      = serial bus
    subclass   = USB
    bar   [10] = type Memory, range 32, base 0xe4002000, size 4096, enabled
    cap 01[40] = powerspec 2  supports D0 D1 D2 D3  current D0

ohci3@pci0:0:8:1:	class=0x0c0310 card=0x00351033 chip=0x00351033 rev=0x41 hdr=0x00
    vendor     = 'NEC Corporation'
    device     = 'OHCI USB Controller'
    class      = serial bus
    subclass   = USB
    bar   [10] = type Memory, range 32, base 0xe4003000, size 4096, enabled
    cap 01[40] = powerspec 2  supports D0 D1 D2 D3  current D0

ehci1@pci0:0:8:2:	class=0x0c0320 card=0x00e01033 chip=0x00e01033 rev=0x02 hdr=0x00
    vendor     = 'NEC Corporation'
    device     = 'uPD72010x USB 2.0 Controller'
    class      = serial bus
    subclass   = USB
    bar   [10] = type Memory, range 32, base 0xe4004000, size 256, enabled
    cap 01[40] = powerspec 2  supports D0 D1 D2 D3  current D0

rl0@pci0:0:15:0:	class=0x020000 card=0x813910ec chip=0x813910ec rev=0x10 hdr=0x00
    vendor     = 'Realtek Semiconductor Co., Ltd.'
    device     = 'RTL-8100/8101L/8139 PCI Fast Ethernet Adapter'
    class      = network
    subclass   = ethernet
    bar   [10] = type I/O Port, range 32, base 0xe800, size 256, enabled
    bar   [14] = type Memory, range 32, base 0xe4005000, size 256, enabled
    cap 01[50] = powerspec 2  supports D0 D1 D2 D3  current D0

vgapci0@pci0:1:0:0:	class=0x030000 card=0x59601002 chip=0x59601002 rev=0x01 hdr=0x00
    vendor     = 'Advanced Micro Devices, Inc. [AMD/ATI]'
    device     = 'RV280 [Radeon 9200 PRO]'
    class      = display
    subclass   = VGA
    bar   [10] = type Prefetchable Memory, range 32, base 0xd0000000, size 134217728, enabled
    bar   [14] = type I/O Port, range 32, base 0xd000, size 256, enabled
    bar   [18] = type Memory, range 32, base 0xe1000000, size 65536, enabled
    cap 02[58] = AGP 4x 2x 1x SBA disabled
    cap 01[50] = powerspec 2  supports D0 D1 D2 D3  current D0

vgapci1@pci0:1:0:1:	class=0x038000 card=0x59611002 chip=0x59401002 rev=0x01 hdr=0x00
    vendor     = 'Advanced Micro Devices, Inc. [AMD/ATI]'
    device     = 'RV280 [Radeon 9200 PRO] (Secondary)'
    class      = display
    bar   [10] = type Prefetchable Memory, range 32, base 0xd8000000, size 134217728, enabled
    bar   [14] = type Memory, range 32, base 0xe1010000, size 65536, enabled
    cap 01[50] = powerspec 2  supports D0 D1 D2 D3  current D0
