hostb0@pci0:0:0:0:	class=0x060000 rev=0x03 hdr=0x00 vendor=0x8086 device=0x9b53 subvendor=0x1458 subdevice=0x5000
    vendor     = 'Intel Corporation'
    device     = 'Comet Lake-S 6c Host Bridge/DRAM Controller'
    class      = bridge
    subclass   = HOST-PCI
    cap 09[e0] = vendor (length 16) Intel cap 0 version 1

pcib1@pci0:0:1:0:	class=0x060400 rev=0x03 hdr=0x01 vendor=0x8086 device=0x1901 subvendor=0x1458 subdevice=0x5000
    vendor     = 'Intel Corporation'
    device     = '6th-10th Gen Core Processor PCIe Controller (x16)'
    class      = bridge
    subclass   = PCI-PCI
    cap 0d[88] = PCI Bridge subvendor=0x1458 subdevice=0x5000
    cap 01[80] = powerspec 3  supports D0 D3  current D0
    cap 05[90] = MSI supports 1 message 
    cap 10[a0] = PCI-Express 2 root port max data 256(256)
                 max read 128
                 link x16(x16) speed 2.5(8.0) ASPM disabled(L0s/L1)
                 slot 1 power limit 75000 mW
    ecap 0002[100] = VC 1 max VC0
    ecap 0005[140] = Root Complex Link Declaration 1
    ecap 0019[d94] = PCIe Sec 1 lane errors 0

xhci0@pci0:0:20:0:	class=0x0c0330 rev=0x11 hdr=0x00 vendor=0x8086 device=0x43ed subvendor=0x1458 subdevice=0x5007
    vendor     = 'Intel Corporation'
    device     = 'Tiger Lake-H USB 3.2 Gen 2x1 xHCI Host Controller'
    class      = serial bus
    subclass   = USB
    bar   [10] = type Memory, range 64, base 0x50600000, size 65536, enabled
    cap 01[70] = powerspec 2  supports D0 D3  current D0
    cap 05[80] = MSI supports 8 messages, 64 bit enabled with 1 message
    cap 09[90] = vendor (length 20) Intel cap 15 version 0
    cap 09[b0] = vendor (length 0) Intel cap 0 version 1

none0@pci0:0:20:2:	class=0x050000 rev=0x11 hdr=0x00 vendor=0x8086 device=0x43ef subvendor=0x0000 subdevice=0x0000
    vendor     = 'Intel Corporation'
    device     = 'Tiger Lake-H Shared SRAM'
    class      = memory
    subclass   = RAM
    bar   [10] = type Memory, range 64, base 0x50614000, size 16384, enabled
    bar   [18] = type Memory, range 64, base 0x5061e000, size 4096, enabled
    cap 01[80] = powerspec 3  supports D0 D3  current D0

none1@pci0:0:22:0:	class=0x078000 rev=0x11 hdr=0x00 vendor=0x8086 device=0x43e0 subvendor=0x1458 subdevice=0x1c3a
    vendor     = 'Intel Corporation'
    device     = 'Tiger Lake-H Management Engine Interface'
    class      = simple comms
    bar   [10] = type Memory, range 64, base 0x5061d000, size 4096, enabled
    cap 01[50] = powerspec 3  supports D0 D3  current D0
    cap 05[8c] = MSI supports 1 message, 64 bit 
    cap 09[a4] = vendor (length 20) Intel cap 15 version 0

ahci0@pci0:0:23:0:	class=0x010601 rev=0x11 hdr=0x00 vendor=0x8086 device=0x43d2 subvendor=0x1458 subdevice=0xb005
    vendor     = 'Intel Corporation'
    class      = mass storage
    subclass   = SATA
    bar   [10] = type Memory, range 32, base 0x50618000, size 8192, enabled
    bar   [14] = type Memory, range 32, base 0x5061c000, size 256, enabled
    bar   [18] = type I/O Port, range 32, base 0x5050, size 8, enabled
    bar   [1c] = type I/O Port, range 32, base 0x5040, size 4, enabled
    bar   [20] = type I/O Port, range 32, base 0x5020, size 32, enabled
    bar   [24] = type Memory, range 32, base 0x5061b000, size 2048, enabled
    cap 05[80] = MSI supports 1 message enabled with 1 message
    cap 01[70] = powerspec 3  supports D0 D3  current D0
    cap 12[a8] = SATA Index-Data Pair

pcib2@pci0:0:28:0:	class=0x060400 rev=0x11 hdr=0x01 vendor=0x8086 device=0x43bc subvendor=0x1458 subdevice=0x5001
    vendor     = 'Intel Corporation'
    device     = 'Tiger Lake-H PCI Express Root Port'
    class      = bridge
    subclass   = PCI-PCI
    cap 10[40] = PCI-Express 2 root port max data 256(256) ARI disabled
                 max read 128
                 link x4(x4) speed 8.0(8.0)
                 slot 8 power limit 250 mW
    cap 05[80] = MSI supports 1 message 
    cap 0d[90] = PCI Bridge subvendor=0x1458 subdevice=0x5001
    cap 01[a0] = powerspec 3  supports D0 D3  current D0
    ecap 0001[100] = AER 1 0 fatal 0 non-fatal 0 corrected
    ecap 000d[220] = ACS 1
    ecap 001f[150] = Precision Time Measurement 1
    ecap 0019[a30] = PCIe Sec 1 lane errors 0
    ecap 001d[a00] = Downstream Port Containment 1

pcib3@pci0:0:29:0:	class=0x060400 rev=0x11 hdr=0x01 vendor=0x8086 device=0x43b2 subvendor=0x1458 subdevice=0x5001
    vendor     = 'Intel Corporation'
    class      = bridge
    subclass   = PCI-PCI
    cap 10[40] = PCI-Express 2 root port max data 128(256) ARI disabled
                 max read 128
                 link x1(x1) speed 2.5(8.0)
                 slot 14 power limit 100 mW
    cap 05[80] = MSI supports 1 message 
    cap 0d[90] = PCI Bridge subvendor=0x1458 subdevice=0x5001
    cap 01[a0] = powerspec 3  supports D0 D3  current D0
    ecap 0001[100] = AER 1 0 fatal 0 non-fatal 0 corrected
    ecap 000d[220] = ACS 1
    ecap 001f[150] = Precision Time Measurement 1
    ecap 0019[a30] = PCIe Sec 1 lane errors 0
    ecap 001d[a00] = Downstream Port Containment 1

isab0@pci0:0:31:0:	class=0x060100 rev=0x11 hdr=0x00 vendor=0x8086 device=0x4388 subvendor=0x1458 subdevice=0x5001
    vendor     = 'Intel Corporation'
    class      = bridge
    subclass   = PCI-ISA

hdac1@pci0:0:31:3:	class=0x040300 rev=0x11 hdr=0x00 vendor=0x8086 device=0xf0c8 subvendor=0x1458 subdevice=0xa194
    vendor     = 'Intel Corporation'
    class      = multimedia
    subclass   = HDA
    bar   [10] = type Memory, range 64, base 0x50610000, size 16384, enabled
    bar   [20] = type Memory, range 64, base 0x50200000, size 1048576, enabled
    cap 01[50] = powerspec 3  supports D0 D3  current D0
    cap 09[80] = vendor (length 20) Intel cap 15 version 0
    cap 05[60] = MSI supports 1 message, 64 bit enabled with 1 message

ichsmb0@pci0:0:31:4:	class=0x0c0500 rev=0x11 hdr=0x00 vendor=0x8086 device=0x43a3 subvendor=0x1458 subdevice=0x5001
    vendor     = 'Intel Corporation'
    device     = 'Tiger Lake-H SMBus Controller'
    class      = serial bus
    subclass   = SMBus
    bar   [10] = type Memory, range 64, base 0x5061a000, size 256, enabled
    bar   [20] = type I/O Port, range 32, base 0xefa0, size 32, enabled

none2@pci0:0:31:5:	class=0x0c8000 rev=0x11 hdr=0x00 vendor=0x8086 device=0x43a4 subvendor=0x0000 subdevice=0x0000
    vendor     = 'Intel Corporation'
    device     = 'Tiger Lake-H SPI Controller'
    class      = serial bus
    bar   [10] = type Memory, range 32, base 0xfe010000, size 4096, enabled

vgapci0@pci0:1:0:0:	class=0x030000 rev=0xcf hdr=0x00 vendor=0x1002 device=0x67df subvendor=0x1682 subdevice=0x9470
    vendor     = 'Advanced Micro Devices, Inc. [AMD/ATI]'
    device     = 'Ellesmere [Radeon RX 470/480/570/570X/580/580X/590]'
    class      = display
    subclass   = VGA
    bar   [10] = type Prefetchable Memory, range 64, base 0x40000000, size 268435456, enabled
    bar   [18] = type Prefetchable Memory, range 64, base 0x50000000, size 2097152, enabled
    bar   [20] = type I/O Port, range 32, base 0x4000, size 256, enabled
    bar   [24] = type Memory, range 32, base 0x50500000, size 262144, enabled
    cap 09[48] = vendor (length 8)
    cap 01[50] = powerspec 3  supports D0 D1 D2 D3  current D0
    cap 10[58] = PCI-Express 2 legacy endpoint max data 256(256) RO NS
                 max read 512
                 link x16(x16) speed 2.5(8.0) ASPM disabled(L1)
    cap 05[a0] = MSI supports 1 message, 64 bit enabled with 1 message
    ecap 000b[100] = Vendor [1] ID 0001 Rev 1 Length 16
    ecap 0001[150] = AER 2 0 fatal 0 non-fatal 1 corrected
    ecap 0015[200] = Resizable BAR 1
    ecap 0019[270] = PCIe Sec 1 lane errors 0
    ecap 000f[2b0] = ATS 1
    ecap 0013[2c0] = Page Page Request 1
    ecap 001b[2d0] = Process Address Space ID 1
    ecap 0018[320] = LTR 1
    ecap 000e[328] = ARI 1
    ecap 001e[370] = L1 PM Substates 1

hdac0@pci0:1:0:1:	class=0x040300 rev=0x00 hdr=0x00 vendor=0x1002 device=0xaaf0 subvendor=0x1682 subdevice=0xaaf0
    vendor     = 'Advanced Micro Devices, Inc. [AMD/ATI]'
    device     = 'Ellesmere HDMI Audio [Radeon RX 470/480 / 570/580/590]'
    class      = multimedia
    subclass   = HDA
    bar   [10] = type Memory, range 64, base 0x50560000, size 16384, enabled
    cap 09[48] = vendor (length 8)
    cap 01[50] = powerspec 3  supports D0 D1 D2 D3  current D0
    cap 10[58] = PCI-Express 2 legacy endpoint max data 256(256) RO NS
                 max read 512
                 link x16(x16) speed 2.5(8.0) ASPM disabled(L1)
    cap 05[a0] = MSI supports 1 message, 64 bit enabled with 1 message
    ecap 000b[100] = Vendor [1] ID 0001 Rev 1 Length 16
    ecap 0001[150] = AER 2 0 fatal 0 non-fatal 1 corrected
    ecap 000e[328] = ARI 1

nvme0@pci0:2:0:0:	class=0x010802 rev=0x01 hdr=0x00 vendor=0x1d97 device=0x5216 subvendor=0x1dbe subdevice=0x5216
    vendor     = 'Shenzhen Longsys Electronics Co., Ltd.'
    class      = mass storage
    subclass   = NVM
    bar   [10] = type Memory, range 64, base 0x50420000, size 16384, enabled
    cap 01[40] = powerspec 3  supports D0 D3  current D0
    cap 05[50] = MSI supports 1 message, 64 bit, vector masks 
    cap 10[70] = PCI-Express 2 endpoint max data 256(512) FLR RO
                 max read 512
                 link x4(x4) speed 8.0(8.0) ASPM disabled(L1)
    cap 11[b0] = MSI-X supports 9 messages, enabled
                 Table in map 0x10[0x2000], PBA in map 0x10[0x3000]
    ecap 0001[100] = AER 2 0 fatal 0 non-fatal 0 corrected
    ecap 0019[148] = PCIe Sec 1 lane errors 0
    ecap 0018[168] = LTR 1
    ecap 001e[170] = L1 PM Substates 1
    ecap 000b[180] = Vendor [1] ID 0001 Rev 1 Length 56
    ecap 0025[1b8] = Data Link Feature 1

re0@pci0:3:0:0:	class=0x020000 rev=0x16 hdr=0x00 vendor=0x10ec device=0x8168 subvendor=0x1458 subdevice=0xe000
    vendor     = 'Realtek Semiconductor Co., Ltd.'
    device     = 'RTL8111/8168/8411 PCI Express Gigabit Ethernet Controller'
    class      = network
    subclass   = ethernet
    bar   [10] = type I/O Port, range 32, base 0x3000, size 256, enabled
    bar   [18] = type Memory, range 64, base 0x50304000, size 4096, enabled
    bar   [20] = type Memory, range 64, base 0x50300000, size 16384, enabled
    cap 01[40] = powerspec 3  supports D0 D1 D2 D3  current D0
    cap 05[50] = MSI supports 1 message, 64 bit 
    cap 10[70] = PCI-Express 2 endpoint MSI 1 max data 128(128) RO
                 max read 4096
                 link x1(x1) speed 2.5(2.5) ASPM disabled(L0s/L1) ClockPM disabled
    cap 11[b0] = MSI-X supports 4 messages, enabled
                 Table in map 0x20[0x0], PBA in map 0x20[0x800]
    ecap 0001[100] = AER 2 0 fatal 0 non-fatal 0 corrected
    ecap 0002[140] = VC 1 max VC0
    ecap 0003[160] = Serial 1 01000000684ce000
    ecap 0018[170] = LTR 1
    ecap 001e[178] = L1 PM Substates 1
