hostb0@pci0:0:0:0:	class=0x060000 rev=0x07 hdr=0x00 vendor=0x8086 device=0x3ec2 subvendor=0x103c subdevice=0x8592
    vendor     = 'Intel Corporation'
    device     = '8th Gen Core Processor Host Bridge/DRAM Registers'
    class      = bridge
    subclass   = HOST-PCI
    cap 09[e0] = vendor (length 16) Intel cap 0 version 1

pcib1@pci0:0:1:0:	class=0x060400 rev=0x07 hdr=0x01 vendor=0x8086 device=0x1901 subvendor=0x103c subdevice=0x8592
    vendor     = 'Intel Corporation'
    device     = '6th-10th Gen Core Processor PCIe Controller (x16)'
    class      = bridge
    subclass   = PCI-PCI
    cap 0d[88] = PCI Bridge subvendor=0x103c subdevice=0x8592
    cap 01[80] = powerspec 3  supports D0 D3  current D0
    cap 05[90] = MSI supports 1 message 
    cap 10[a0] = PCI-Express 2 root port max data 256(256)
                 max read 128
                 link x4(x16) speed 2.5(8.0) ASPM disabled(L0s/L1)
                 slot 1 power limit 75000 mW
    ecap 0002[100] = VC 1 max VC0
    ecap 0005[140] = Root Complex Link Declaration 1
    ecap 0019[d94] = PCIe Sec 1 lane errors 0

vgapci0@pci0:0:2:0:	class=0x030000 rev=0x00 hdr=0x00 vendor=0x8086 device=0x3e92 subvendor=0x103c subdevice=0x8592
    vendor     = 'Intel Corporation'
    device     = 'CometLake-S GT2 [UHD Graphics 630]'
    class      = display
    subclass   = VGA
    bar   [10] = type Memory, range 64, base 0xe0000000, size 16777216, enabled
    bar   [18] = type Prefetchable Memory, range 64, base 0xd0000000, size 268435456, enabled
    bar   [20] = type I/O Port, range 32, base 0x7000, size 64, enabled
    cap 09[40] = vendor (length 12) Intel cap 0 version 1
    cap 10[70] = PCI-Express 2 root endpoint max data 128(128) FLR
                 max read 128
    cap 05[ac] = MSI supports 1 message 
    cap 01[d0] = powerspec 2  supports D0 D3  current D0
    ecap 001b[100] = Process Address Space ID 1
    ecap 000f[200] = ATS 1
    ecap 0013[300] = Page Page Request 1

pchtherm0@pci0:0:18:0:	class=0x118000 rev=0x10 hdr=0x00 vendor=0x8086 device=0xa379 subvendor=0x103c subdevice=0x8592
    vendor     = 'Intel Corporation'
    device     = 'Cannon Lake PCH Thermal Controller'
    class      = dasp
    bar   [10] = type Memory, range 64, base 0x4000107000, size 4096, enabled
    cap 01[50] = powerspec 3  supports D0 D3  current D0
    cap 05[80] = MSI supports 1 message 

xhci0@pci0:0:20:0:	class=0x0c0330 rev=0x10 hdr=0x00 vendor=0x8086 device=0xa36d subvendor=0x103c subdevice=0x8592
    vendor     = 'Intel Corporation'
    device     = 'Cannon Lake PCH USB 3.1 xHCI Host Controller'
    class      = serial bus
    subclass   = USB
    bar   [10] = type Memory, range 64, base 0xe1560000, size 65536, enabled
    cap 01[70] = powerspec 2  supports D0 D3  current D0
    cap 05[80] = MSI supports 8 messages, 64 bit enabled with 1 message
    cap 09[90] = vendor (length 20) Intel cap 15 version 0

none0@pci0:0:20:2:	class=0x050000 rev=0x10 hdr=0x00 vendor=0x8086 device=0xa36f subvendor=0x103c subdevice=0x8592
    vendor     = 'Intel Corporation'
    device     = 'Cannon Lake PCH Shared SRAM'
    class      = memory
    subclass   = RAM
    bar   [10] = type Memory, range 64, base 0xe1572000, size 8192, enabled
    bar   [18] = type Memory, range 64, base 0x4000106000, size 4096, enabled
    cap 01[80] = powerspec 3  supports D0 D3  current D0

none1@pci0:0:22:0:	class=0x078000 rev=0x10 hdr=0x00 vendor=0x8086 device=0xa360 subvendor=0x103c subdevice=0x8592
    vendor     = 'Intel Corporation'
    device     = 'Cannon Lake PCH HECI Controller'
    class      = simple comms
    bar   [10] = type Memory, range 64, base 0x4000105000, size 4096, enabled
    cap 01[50] = powerspec 3  supports D0 D3  current D0
    cap 05[8c] = MSI supports 1 message, 64 bit 
    cap 09[a4] = vendor (length 20) Intel cap 15 version 0

none2@pci0:0:22:3:	class=0x070002 rev=0x10 hdr=0x00 vendor=0x8086 device=0xa363 subvendor=0x103c subdevice=0x8592
    vendor     = 'Intel Corporation'
    device     = 'Cannon Lake PCH Active Management Technology - SOL'
    class      = simple comms
    subclass   = UART
    bar   [10] = type I/O Port, range 32, base 0x7088, size 8, enabled
    bar   [14] = type Memory, range 32, base 0xe1577000, size 4096, enabled
    cap 05[40] = MSI supports 1 message, 64 bit 
    cap 01[50] = powerspec 3  supports D0 D3  current D0

ahci0@pci0:0:23:0:	class=0x010601 rev=0x10 hdr=0x00 vendor=0x8086 device=0xa352 subvendor=0x103c subdevice=0x8592
    vendor     = 'Intel Corporation'
    device     = 'Cannon Lake PCH SATA AHCI Controller'
    class      = mass storage
    subclass   = SATA
    bar   [10] = type Memory, range 32, base 0xe1570000, size 8192, enabled
    bar   [14] = type Memory, range 32, base 0xe1576000, size 256, enabled
    bar   [18] = type I/O Port, range 32, base 0x7080, size 8, enabled
    bar   [1c] = type I/O Port, range 32, base 0x7090, size 4, enabled
    bar   [20] = type I/O Port, range 32, base 0x7060, size 32, enabled
    bar   [24] = type Memory, range 32, base 0xe1575000, size 2048, enabled
    cap 05[80] = MSI supports 1 message enabled with 1 message
    cap 01[70] = powerspec 3  supports D0 D3  current D0
    cap 12[a8] = SATA Index-Data Pair

pcib5@pci0:0:27:0:	class=0x060400 rev=0xf0 hdr=0x01 vendor=0x8086 device=0xa32c subvendor=0x103c subdevice=0x8592
    vendor     = 'Intel Corporation'
    device     = 'Cannon Lake PCH PCI Express Root Port'
    class      = bridge
    subclass   = PCI-PCI
    cap 10[40] = PCI-Express 2 root port max data 256(256) ARI disabled
                 max read 128
                 link x4(x4) speed 8.0(8.0) ASPM L1(L0s/L1)
                 slot 20 power limit 250 mW
    cap 05[80] = MSI supports 1 message 
    cap 0d[90] = PCI Bridge subvendor=0x103c subdevice=0x8592
    cap 01[a0] = powerspec 3  supports D0 D3  current D0
    ecap 0001[100] = AER 1 0 fatal 0 non-fatal 0 corrected
    ecap 000d[140] = ACS 1
    ecap 001f[150] = Precision Time Measurement 1
    ecap 001e[200] = L1 PM Substates 1
    ecap 0019[220] = PCIe Sec 1 lane errors 0
    ecap 001d[250] = Downstream Port Containment 1

pcib6@pci0:0:28:0:	class=0x060400 rev=0xf0 hdr=0x01 vendor=0x8086 device=0xa33e subvendor=0x103c subdevice=0x8592
    vendor     = 'Intel Corporation'
    device     = 'Cannon Lake PCH PCI Express Root Port'
    class      = bridge
    subclass   = PCI-PCI
    cap 10[40] = PCI-Express 2 root port max data 256(256) ARI disabled
                 max read 128
                 link x1(x1) speed 2.5(8.0) ASPM L1(L0s/L1)
                 slot 6 power limit 100 mW
    cap 05[80] = MSI supports 1 message 
    cap 0d[90] = PCI Bridge subvendor=0x103c subdevice=0x8592
    cap 01[a0] = powerspec 3  supports D0 D3  current D0
    ecap 0001[100] = AER 1 0 fatal 0 non-fatal 0 corrected
    ecap 000d[140] = ACS 1
    ecap 001f[150] = Precision Time Measurement 1
    ecap 001e[200] = L1 PM Substates 1
    ecap 0019[220] = PCIe Sec 1 lane errors 0
    ecap 001d[250] = Downstream Port Containment 1

pcib7@pci0:0:29:0:	class=0x060400 rev=0xf0 hdr=0x01 vendor=0x8086 device=0xa330 subvendor=0x103c subdevice=0x8592
    vendor     = 'Intel Corporation'
    device     = 'Cannon Lake PCH PCI Express Root Port'
    class      = bridge
    subclass   = PCI-PCI
    cap 10[40] = PCI-Express 2 root port max data 256(256) ARI disabled
                 max read 128
                 link x4(x4) speed 2.5(8.0) ASPM disabled(L0s/L1)
                 slot 8 power limit 250 mW
    cap 05[80] = MSI supports 1 message 
    cap 0d[90] = PCI Bridge subvendor=0x103c subdevice=0x8592
    cap 01[a0] = powerspec 3  supports D0 D3  current D0
    ecap 0001[100] = AER 1 0 fatal 0 non-fatal 0 corrected
    ecap 000d[140] = ACS 1
    ecap 001f[150] = Precision Time Measurement 1
    ecap 001e[200] = L1 PM Substates 1
    ecap 0019[220] = PCIe Sec 1 lane errors 0
    ecap 001d[250] = Downstream Port Containment 1

isab0@pci0:0:31:0:	class=0x060100 rev=0x10 hdr=0x00 vendor=0x8086 device=0xa306 subvendor=0x103c subdevice=0x8592
    vendor     = 'Intel Corporation'
    device     = 'Q370 Chipset LPC/eSPI Controller'
    class      = bridge
    subclass   = PCI-ISA

hdac0@pci0:0:31:3:	class=0x040300 rev=0x10 hdr=0x00 vendor=0x8086 device=0xa348 subvendor=0x103c subdevice=0x8592
    vendor     = 'Intel Corporation'
    device     = 'Cannon Lake PCH cAVS'
    class      = multimedia
    subclass   = HDA
    bar   [10] = type Memory, range 64, base 0x4000100000, size 16384, enabled
    bar   [20] = type Memory, range 64, base 0x4000000000, size 1048576, enabled
    cap 01[50] = powerspec 3  supports D0 D3  current D0
    cap 09[80] = vendor (length 20) Intel cap 15 version 0
    cap 05[60] = MSI supports 1 message, 64 bit enabled with 1 message

ichsmb0@pci0:0:31:4:	class=0x0c0500 rev=0x10 hdr=0x00 vendor=0x8086 device=0xa323 subvendor=0x103c subdevice=0x8592
    vendor     = 'Intel Corporation'
    device     = 'Cannon Lake PCH SMBus Controller'
    class      = serial bus
    subclass   = SMBus
    bar   [10] = type Memory, range 64, base 0x4000104000, size 256, enabled
    bar   [20] = type I/O Port, range 32, base 0xefa0, size 32, enabled

none3@pci0:0:31:5:	class=0x0c8000 rev=0x10 hdr=0x00 vendor=0x8086 device=0xa324 subvendor=0x103c subdevice=0x8592
    vendor     = 'Intel Corporation'
    device     = 'Cannon Lake PCH SPI Controller'
    class      = serial bus
    bar   [10] = type Memory, range 32, base 0xfe010000, size 4096, enabled

em7@pci0:0:31:6:	class=0x020000 rev=0x10 hdr=0x00 vendor=0x8086 device=0x15bb subvendor=0x103c subdevice=0x8591
    vendor     = 'Intel Corporation'
    device     = 'Ethernet Connection (7) I219-LM'
    class      = network
    subclass   = ethernet
    bar   [10] = type Memory, range 32, base 0xe1540000, size 131072, enabled
    cap 01[c8] = powerspec 3  supports D0 D3  current D0
    cap 05[d0] = MSI supports 1 message, 64 bit enabled with 1 message

pcib2@pci0:1:0:0:	class=0x060400 rev=0x0e hdr=0x01 vendor=0x111d device=0x8018 subvendor=0x0000 subdevice=0x0000
    vendor     = 'Microsemi / PMC / IDT'
    device     = 'PES12N3A 12-lane 3-Port PCI Express Switch'
    class      = bridge
    subclass   = PCI-PCI
    cap 10[40] = PCI-Express 1 upstream port max data 256(2048)
                 max read 128
                 link x4(x4) speed 2.5(2.5) ASPM disabled(L0s/L1)
    cap 01[c0] = powerspec 3  supports D0 D3  current D0
    ecap 0001[100] = AER 1 0 fatal 0 non-fatal 1 corrected
    ecap 0002[200] = VC 1 max VC0

pcib3@pci0:2:2:0:	class=0x060400 rev=0x0e hdr=0x01 vendor=0x111d device=0x8018 subvendor=0x0000 subdevice=0x0000
    vendor     = 'Microsemi / PMC / IDT'
    device     = 'PES12N3A 12-lane 3-Port PCI Express Switch'
    class      = bridge
    subclass   = PCI-PCI
    cap 10[40] = PCI-Express 1 downstream port max data 256(2048)
                 max read 128
                 link x4(x4) speed 2.5(2.5) ASPM disabled(L0s/L1)
    cap 01[c0] = powerspec 3  supports D0 D3  current D0
    cap 05[d0] = MSI supports 1 message, 64 bit 
    ecap 0001[100] = AER 1 1 fatal 0 non-fatal 1 corrected
    ecap 0002[200] = VC 1 max VC0

pcib4@pci0:2:4:0:	class=0x060400 rev=0x0e hdr=0x01 vendor=0x111d device=0x8018 subvendor=0x0000 subdevice=0x0000
    vendor     = 'Microsemi / PMC / IDT'
    device     = 'PES12N3A 12-lane 3-Port PCI Express Switch'
    class      = bridge
    subclass   = PCI-PCI
    cap 10[40] = PCI-Express 1 downstream port max data 256(2048)
                 max read 128
                 link x4(x4) speed 2.5(2.5) ASPM disabled(L0s/L1)
    cap 01[c0] = powerspec 3  supports D0 D3  current D0
    cap 05[d0] = MSI supports 1 message, 64 bit 
    ecap 0001[100] = AER 1 1 fatal 0 non-fatal 1 corrected
    ecap 0002[200] = VC 1 max VC0

em0@pci0:3:0:0:	class=0x020000 rev=0x06 hdr=0x00 vendor=0x8086 device=0x10bc subvendor=0x8086 subdevice=0x11bc
    vendor     = 'Intel Corporation'
    device     = '82571EB/82571GB Gigabit Ethernet Controller (Copper)'
    class      = network
    subclass   = ethernet
    bar   [10] = type Memory, range 32, base 0xe1460000, size 131072, enabled
    bar   [14] = type Memory, range 32, base 0xe1440000, size 131072, enabled
    bar   [18] = type I/O Port, range 32, base 0x6020, size 32, enabled
    cap 01[c8] = powerspec 2  supports D0 D3  current D0
    cap 05[d0] = MSI supports 1 message, 64 bit enabled with 1 message
    cap 10[e0] = PCI-Express 1 endpoint max data 256(256) RO NS
                 max read 512
                 link x4(x4) speed 2.5(2.5) ASPM disabled(L0s)
    ecap 0001[100] = AER 1 0 fatal 1 non-fatal 0 corrected
    ecap 0003[140] = Serial 1 001517fffff97cc0

em1@pci0:3:0:1:	class=0x020000 rev=0x06 hdr=0x00 vendor=0x8086 device=0x10bc subvendor=0x8086 subdevice=0x11bc
    vendor     = 'Intel Corporation'
    device     = '82571EB/82571GB Gigabit Ethernet Controller (Copper)'
    class      = network
    subclass   = ethernet
    bar   [10] = type Memory, range 32, base 0xe1420000, size 131072, enabled
    bar   [14] = type Memory, range 32, base 0xe1400000, size 131072, enabled
    bar   [18] = type I/O Port, range 32, base 0x6000, size 32, enabled
    cap 01[c8] = powerspec 2  supports D0 D3  current D0
    cap 05[d0] = MSI supports 1 message, 64 bit enabled with 1 message
    cap 10[e0] = PCI-Express 1 endpoint max data 256(256) RO NS
                 max read 512
                 link x4(x4) speed 2.5(2.5) ASPM disabled(L0s)
    ecap 0001[100] = AER 1 0 fatal 1 non-fatal 0 corrected
    ecap 0003[140] = Serial 1 001517fffff97cc0

em2@pci0:4:0:0:	class=0x020000 rev=0x06 hdr=0x00 vendor=0x8086 device=0x10bc subvendor=0x8086 subdevice=0x11bc
    vendor     = 'Intel Corporation'
    device     = '82571EB/82571GB Gigabit Ethernet Controller (Copper)'
    class      = network
    subclass   = ethernet
    bar   [10] = type Memory, range 32, base 0xe1360000, size 131072, enabled
    bar   [14] = type Memory, range 32, base 0xe1340000, size 131072, enabled
    bar   [18] = type I/O Port, range 32, base 0x5020, size 32, enabled
    cap 01[c8] = powerspec 2  supports D0 D3  current D0
    cap 05[d0] = MSI supports 1 message, 64 bit enabled with 1 message
    cap 10[e0] = PCI-Express 1 endpoint max data 256(256) RO NS
                 max read 512
                 link x4(x4) speed 2.5(2.5) ASPM disabled(L0s)
    ecap 0001[100] = AER 1 0 fatal 1 non-fatal 0 corrected
    ecap 0003[140] = Serial 1 001517fffff97cc2

em3@pci0:4:0:1:	class=0x020000 rev=0x06 hdr=0x00 vendor=0x8086 device=0x10bc subvendor=0x8086 subdevice=0x11bc
    vendor     = 'Intel Corporation'
    device     = '82571EB/82571GB Gigabit Ethernet Controller (Copper)'
    class      = network
    subclass   = ethernet
    bar   [10] = type Memory, range 32, base 0xe1320000, size 131072, enabled
    bar   [14] = type Memory, range 32, base 0xe1300000, size 131072, enabled
    bar   [18] = type I/O Port, range 32, base 0x5000, size 32, enabled
    cap 01[c8] = powerspec 2  supports D0 D3  current D0
    cap 05[d0] = MSI supports 1 message, 64 bit enabled with 1 message
    cap 10[e0] = PCI-Express 1 endpoint max data 256(256) RO NS
                 max read 512
                 link x4(x4) speed 2.5(2.5) ASPM disabled(L0s)
    ecap 0001[100] = AER 1 0 fatal 1 non-fatal 0 corrected
    ecap 0003[140] = Serial 1 001517fffff97cc2

nvme0@pci0:5:0:0:	class=0x010802 rev=0x00 hdr=0x00 vendor=0x1179 device=0x011a subvendor=0x1179 subdevice=0x0001
    vendor     = 'Toshiba Corporation'
    device     = 'XG6 NVMe SSD Controller'
    class      = mass storage
    subclass   = NVM
    bar   [10] = type Memory, range 64, base 0xe1200000, size 16384, enabled
    cap 10[40] = PCI-Express 2 endpoint max data 256(256) FLR
                 max read 512
                 link x4(x4) speed 8.0(8.0) ASPM L1(L1)
    cap 01[80] = powerspec 3  supports D0 D3  current D0
    cap 05[90] = MSI supports 32 messages, 64 bit, vector masks 
    cap 11[b0] = MSI-X supports 33 messages, enabled
                 Table in map 0x10[0x2000], PBA in map 0x10[0x3000]
    ecap 0001[100] = AER 2 0 fatal 0 non-fatal 0 corrected
    ecap 0018[260] = LTR 1
    ecap 0019[300] = PCIe Sec 1 lane errors 0
    ecap 001e[400] = L1 PM Substates 1

em4@pci0:6:0:0:	class=0x020000 rev=0x00 hdr=0x00 vendor=0x8086 device=0x10d3 subvendor=0x8086 subdevice=0xa01f
    vendor     = 'Intel Corporation'
    device     = '82574L Gigabit Network Connection'
    class      = network
    subclass   = ethernet
    bar   [10] = type Memory, range 32, base 0xe1180000, size 131072, enabled
    bar   [14] = type Memory, range 32, base 0xe1100000, size 524288, enabled
    bar   [18] = type I/O Port, range 32, base 0x4000, size 32, enabled
    bar   [1c] = type Memory, range 32, base 0xe11a0000, size 16384, enabled
    cap 01[c8] = powerspec 2  supports D0 D3  current D0
    cap 05[d0] = MSI supports 1 message, 64 bit 
    cap 10[e0] = PCI-Express 1 endpoint max data 256(256) RO NS
                 max read 512
                 link x1(x1) speed 2.5(2.5) ASPM disabled(L0s/L1)
    cap 11[a0] = MSI-X supports 5 messages, enabled
                 Table in map 0x1c[0x0], PBA in map 0x1c[0x2000]
    ecap 0001[100] = AER 1 0 fatal 0 non-fatal 0 corrected
    ecap 0003[140] = Serial 1 6805caffff0c5ec9

em5@pci0:7:0:0:	class=0x020000 rev=0x06 hdr=0x00 vendor=0x8086 device=0x105f subvendor=0x8086 subdevice=0x125f
    vendor     = 'Intel Corporation'
    device     = '82571EB Gigabit Ethernet Controller'
    class      = network
    subclass   = ethernet
    bar   [10] = type Memory, range 32, base 0xe1060000, size 131072, enabled
    bar   [14] = type Memory, range 32, base 0xe1040000, size 131072, enabled
    bar   [18] = type I/O Port, range 32, base 0x3020, size 32, enabled
    cap 01[c8] = powerspec 2  supports D0 D3  current D0
    cap 05[d0] = MSI supports 1 message, 64 bit enabled with 1 message
    cap 10[e0] = PCI-Express 1 endpoint max data 256(256) RO NS
                 max read 512
                 link x4(x4) speed 2.5(2.5) ASPM disabled(L0s)
    ecap 0001[100] = AER 1 0 fatal 1 non-fatal 0 corrected
    ecap 0003[140] = Serial 1 001517ffff1c08d2

em6@pci0:7:0:1:	class=0x020000 rev=0x06 hdr=0x00 vendor=0x8086 device=0x105f subvendor=0x8086 subdevice=0x125f
    vendor     = 'Intel Corporation'
    device     = '82571EB Gigabit Ethernet Controller'
    class      = network
    subclass   = ethernet
    bar   [10] = type Memory, range 32, base 0xe1020000, size 131072, enabled
    bar   [14] = type Memory, range 32, base 0xe1000000, size 131072, enabled
    bar   [18] = type I/O Port, range 32, base 0x3000, size 32, enabled
    cap 01[c8] = powerspec 2  supports D0 D3  current D0
    cap 05[d0] = MSI supports 1 message, 64 bit enabled with 1 message
    cap 10[e0] = PCI-Express 1 endpoint max data 256(256) RO NS
                 max read 512
                 link x4(x4) speed 2.5(2.5) ASPM disabled(L0s)
    ecap 0001[100] = AER 1 0 fatal 1 non-fatal 0 corrected
    ecap 0003[140] = Serial 1 001517ffff1c08d2
