hostb0@pci0:0:0:0:	class=0x060000 rev=0x07 hdr=0x00 vendor=0x8086 device=0x3c00 subvendor=0x1028 subdevice=0x0497
    vendor     = 'Intel Corporation'
    device     = 'Xeon E5/Core i7 DMI2'
    class      = bridge
    subclass   = HOST-PCI
    cap 10[90] = PCI-Express 2 root port max data 128(128)
                 max read 128
                 link x0(x4) speed 0.0(5.0) ASPM disabled(L0s/L1)
    cap 01[e0] = powerspec 3  supports D0 D3  current D0
    ecap 000b[100] = Vendor [1] ID 0002 Rev 0 Length 12
    ecap 000b[144] = Vendor [1] ID 0004 Rev 1 Length 60
    ecap 000b[1d0] = Vendor [1] ID 0003 Rev 1 Length 10
    ecap 000b[280] = Vendor [1] ID 0004 Rev 2 Length 24

pcib1@pci0:0:1:0:	class=0x060400 rev=0x07 hdr=0x01 vendor=0x8086 device=0x3c02 subvendor=0x1028 subdevice=0x0497
    vendor     = 'Intel Corporation'
    device     = 'Xeon E5/Core i7 IIO PCI Express Root Port 1a'
    class      = bridge
    subclass   = PCI-PCI
    cap 0d[40] = PCI Bridge subvendor=0x1028 subdevice=0x0497
    cap 05[60] = MSI supports 2 messages, vector masks 
    cap 10[90] = PCI-Express 2 root port max data 128(256) ARI disabled
                 max read 128
                 link x0(x4) speed 0.0(8.0) ASPM disabled(L1)
    cap 01[e0] = powerspec 3  supports D0 D3  current D0
    ecap 000b[100] = Vendor [1] ID 0002 Rev 0 Length 12
    ecap 000d[110] = ACS 1
    ecap 0001[148] = AER 1 0 fatal 0 non-fatal 0 corrected
    ecap 000b[1d0] = Vendor [1] ID 0003 Rev 1 Length 10
    ecap 0019[250] = PCIe Sec 1 lane errors 0
    ecap 000b[280] = Vendor [1] ID 0004 Rev 2 Length 24

pcib2@pci0:0:1:1:	class=0x060400 rev=0x07 hdr=0x01 vendor=0x8086 device=0x3c03 subvendor=0x1028 subdevice=0x0497
    vendor     = 'Intel Corporation'
    device     = 'Xeon E5/Core i7 IIO PCI Express Root Port 1b'
    class      = bridge
    subclass   = PCI-PCI
    cap 0d[40] = PCI Bridge subvendor=0x1028 subdevice=0x0497
    cap 05[60] = MSI supports 2 messages, vector masks 
    cap 10[90] = PCI-Express 2 root port max data 128(256) ARI disabled
                 max read 128
                 link x0(x4) speed 0.0(8.0) ASPM disabled(L1)
                 slot 0 power limit 0 mW
    cap 01[e0] = powerspec 3  supports D0 D3  current D0
    ecap 000b[100] = Vendor [1] ID 0002 Rev 0 Length 12
    ecap 000d[110] = ACS 1
    ecap 0001[148] = AER 1 0 fatal 0 non-fatal 0 corrected
    ecap 000b[1d0] = Vendor [1] ID 0003 Rev 1 Length 10
    ecap 0019[250] = PCIe Sec 1 lane errors 0
    ecap 000b[280] = Vendor [1] ID 0004 Rev 2 Length 24

pcib3@pci0:0:2:0:	class=0x060400 rev=0x07 hdr=0x01 vendor=0x8086 device=0x3c04 subvendor=0x1028 subdevice=0x0497
    vendor     = 'Intel Corporation'
    device     = 'Xeon E5/Core i7 IIO PCI Express Root Port 2a'
    class      = bridge
    subclass   = PCI-PCI
    cap 0d[40] = PCI Bridge subvendor=0x1028 subdevice=0x0497
    cap 05[60] = MSI supports 2 messages, vector masks 
    cap 10[90] = PCI-Express 2 root port max data 256(256) ARI disabled
                 max read 128
                 link x16(x16) speed 2.5(8.0) ASPM disabled(L1)
                 slot 2 power limit 244 mW
    cap 01[e0] = powerspec 3  supports D0 D3  current D0
    ecap 000b[100] = Vendor [1] ID 0002 Rev 0 Length 12
    ecap 000d[110] = ACS 1
    ecap 0001[148] = AER 1 0 fatal 0 non-fatal 0 corrected
    ecap 000b[1d0] = Vendor [1] ID 0003 Rev 1 Length 10
    ecap 0019[250] = PCIe Sec 1 lane errors 0
    ecap 000b[280] = Vendor [1] ID 0004 Rev 2 Length 24

pcib4@pci0:0:3:0:	class=0x060400 rev=0x07 hdr=0x01 vendor=0x8086 device=0x3c08 subvendor=0x1028 subdevice=0x0497
    vendor     = 'Intel Corporation'
    device     = 'Xeon E5/Core i7 IIO PCI Express Root Port 3a in PCI Express Mode'
    class      = bridge
    subclass   = PCI-PCI
    cap 0d[40] = PCI Bridge subvendor=0x1028 subdevice=0x0497
    cap 05[60] = MSI supports 2 messages, vector masks 
    cap 10[90] = PCI-Express 2 root port max data 128(256) ARI disabled
                 max read 128
                 link x0(x16) speed 0.0(8.0) ASPM disabled(L1)
                 slot 0 power limit 0 mW
    cap 01[e0] = powerspec 3  supports D0 D3  current D0
    ecap 000b[100] = Vendor [1] ID 0002 Rev 0 Length 12
    ecap 000d[110] = ACS 1
    ecap 0001[148] = AER 1 0 fatal 0 non-fatal 0 corrected
    ecap 000b[1d0] = Vendor [1] ID 0003 Rev 1 Length 10
    ecap 0019[250] = PCIe Sec 1 lane errors 0
    ecap 000b[280] = Vendor [1] ID 0004 Rev 2 Length 24

none0@pci0:0:5:0:	class=0x088000 rev=0x07 hdr=0x00 vendor=0x8086 device=0x3c28 subvendor=0x1028 subdevice=0x0497
    vendor     = 'Intel Corporation'
    device     = 'Xeon E5/Core i7 Address Map, VTd_Misc, System Management'
    class      = base peripheral
    cap 10[40] = PCI-Express 2 root endpoint max data 128(128)
                 max read 128

none1@pci0:0:5:2:	class=0x088000 rev=0x07 hdr=0x00 vendor=0x8086 device=0x3c2a subvendor=0x1028 subdevice=0x0497
    vendor     = 'Intel Corporation'
    device     = 'Xeon E5/Core i7 Control Status and Global Errors'
    class      = base peripheral
    cap 10[40] = PCI-Express 2 root endpoint max data 128(128) RO NS
                 max read 128

ioapic0@pci0:0:5:4:	class=0x080020 rev=0x07 hdr=0x00 vendor=0x8086 device=0x3c2c subvendor=0x1028 subdevice=0x0497
    vendor     = 'Intel Corporation'
    device     = 'Xeon E5/Core i7 I/O APIC'
    class      = base peripheral
    subclass   = interrupt controller
    bar   [10] = type Memory, range 32, base 0xfbf2d000, size 4096, enabled
    cap 01[6c] = powerspec 3  supports D0 D3  current D0

pcib5@pci0:0:17:0:	class=0x060400 rev=0x05 hdr=0x01 vendor=0x8086 device=0x1d3e subvendor=0x8086 subdevice=0x0000
    vendor     = 'Intel Corporation'
    device     = 'C600/X79 series chipset PCI Express Virtual Root Port'
    class      = bridge
    subclass   = PCI-PCI
    cap 10[40] = PCI-Express 2 root port max data 128(128) ARI disabled
                 max read 128
                 link x1(x1) speed 2.5(2.5) ASPM disabled(L0s/L1)
    cap 01[80] = powerspec 3  supports D0 D3  current D0
    cap 0d[88] = PCI Bridge subvendor=0x8086 subdevice=0x0000
    cap 05[90] = MSI supports 1 message 
    ecap 0001[100] = AER 1 0 fatal 0 non-fatal 0 corrected
    ecap 000d[138] = ACS 1

none2@pci0:0:22:0:	class=0x078000 rev=0x05 hdr=0x00 vendor=0x8086 device=0x1d3a subvendor=0x1028 subdevice=0x0497
    vendor     = 'Intel Corporation'
    device     = 'C600/X79 series chipset MEI Controller'
    class      = simple comms
    bar   [10] = type Memory, range 64, base 0xfbf2c000, size 16, enabled
    cap 01[50] = powerspec 3  supports D0 D3  current D0
    cap 05[8c] = MSI supports 1 message, 64 bit 

em0@pci0:0:25:0:	class=0x020000 rev=0x05 hdr=0x00 vendor=0x8086 device=0x1502 subvendor=0x1028 subdevice=0x0497
    vendor     = 'Intel Corporation'
    device     = '82579LM Gigabit Network Connection (Lewisville)'
    class      = network
    subclass   = ethernet
    bar   [10] = type Memory, range 32, base 0xfbf00000, size 131072, enabled
    bar   [14] = type Memory, range 32, base 0xfbf29000, size 4096, enabled
    bar   [18] = type I/O Port, range 32, base 0xf040, size 32, enabled
    cap 01[c8] = powerspec 2  supports D0 D3  current D0
    cap 05[d0] = MSI supports 1 message, 64 bit enabled with 1 message
    cap 13[e0] = PCI Advanced Features: FLR TP

ehci0@pci0:0:26:0:	class=0x0c0320 rev=0x05 hdr=0x00 vendor=0x8086 device=0x1d2d subvendor=0x1028 subdevice=0x0497
    vendor     = 'Intel Corporation'
    device     = 'C600/X79 series chipset USB2 Enhanced Host Controller'
    class      = serial bus
    subclass   = USB
    bar   [10] = type Memory, range 32, base 0xfbf28000, size 1024, enabled
    cap 01[50] = powerspec 2  supports D0 D3  current D0
    cap 0a[58] = EHCI Debug Port at offset 0xa0 in map 0x14
    cap 13[98] = PCI Advanced Features: FLR TP

hdac1@pci0:0:27:0:	class=0x040300 rev=0x05 hdr=0x00 vendor=0x8086 device=0x1d20 subvendor=0x1028 subdevice=0x0497
    vendor     = 'Intel Corporation'
    device     = 'C600/X79 series chipset High Definition Audio Controller'
    class      = multimedia
    subclass   = HDA
    bar   [10] = type Memory, range 64, base 0xfbf20000, size 16384, enabled
    cap 01[50] = powerspec 2  supports D0 D3  current D0
    cap 05[60] = MSI supports 1 message, 64 bit enabled with 1 message
    cap 10[70] = PCI-Express 1 root endpoint max data 128(128) FLR NS
                 max read 128
    ecap 0002[100] = VC 1 max VC1
    ecap 0005[130] = Root Complex Link Declaration 1

pcib6@pci0:0:28:0:	class=0x060400 rev=0xb5 hdr=0x01 vendor=0x8086 device=0x1d16 subvendor=0x1028 subdevice=0x0497
    vendor     = 'Intel Corporation'
    device     = 'C600/X79 series chipset PCI Express Root Port 4'
    class      = bridge
    subclass   = PCI-PCI
    cap 10[40] = PCI-Express 2 root port max data 128(128)
                 max read 128
                 link x0(x1) speed 0.0(5.0) ASPM disabled(L0s/L1)
                 slot 3 power limit 100 mW
    cap 05[80] = MSI supports 1 message 
    cap 0d[90] = PCI Bridge subvendor=0x1028 subdevice=0x0497
    cap 01[a0] = powerspec 2  supports D0 D3  current D0

pcib7@pci0:0:28:2:	class=0x060400 rev=0xb5 hdr=0x01 vendor=0x8086 device=0x1d14 subvendor=0x1028 subdevice=0x0497
    vendor     = 'Intel Corporation'
    device     = 'C600/X79 series chipset PCI Express Root Port 3'
    class      = bridge
    subclass   = PCI-PCI
    cap 10[40] = PCI-Express 2 root port max data 128(128)
                 max read 128
                 link x1(x1) speed 5.0(5.0) ASPM disabled(L0s/L1)
                 slot 2 power limit 100 mW
    cap 05[80] = MSI supports 1 message 
    cap 0d[90] = PCI Bridge subvendor=0x1028 subdevice=0x0497
    cap 01[a0] = powerspec 2  supports D0 D3  current D0

ehci1@pci0:0:29:0:	class=0x0c0320 rev=0x05 hdr=0x00 vendor=0x8086 device=0x1d26 subvendor=0x1028 subdevice=0x0497
    vendor     = 'Intel Corporation'
    device     = 'C600/X79 series chipset USB2 Enhanced Host Controller'
    class      = serial bus
    subclass   = USB
    bar   [10] = type Memory, range 32, base 0xfbf27000, size 1024, enabled
    cap 01[50] = powerspec 2  supports D0 D3  current D0
    cap 0a[58] = EHCI Debug Port at offset 0xa0 in map 0x14
    cap 13[98] = PCI Advanced Features: FLR TP

pcib8@pci0:0:30:0:	class=0x060401 rev=0xa5 hdr=0x01 vendor=0x8086 device=0x244e subvendor=0x1028 subdevice=0x0497
    vendor     = 'Intel Corporation'
    device     = '82801 PCI Bridge'
    class      = bridge
    subclass   = PCI-PCI
    cap 0d[50] = PCI Bridge subvendor=0x1028 subdevice=0x0497

isab0@pci0:0:31:0:	class=0x060100 rev=0x05 hdr=0x00 vendor=0x8086 device=0x1d41 subvendor=0x1028 subdevice=0x0497
    vendor     = 'Intel Corporation'
    device     = 'C600/X79 series chipset LPC Controller'
    class      = bridge
    subclass   = PCI-ISA
    cap 09[e0] = vendor (length 12) Intel cap 1 version 0
		 features: 4 PCI-e x1 slots

ahci0@pci0:0:31:2:	class=0x010601 rev=0x05 hdr=0x00 vendor=0x8086 device=0x1d02 subvendor=0x1028 subdevice=0x0497
    vendor     = 'Intel Corporation'
    device     = 'C600/X79 series chipset 6-Port SATA AHCI Controller'
    class      = mass storage
    subclass   = SATA
    bar   [10] = type I/O Port, range 32, base 0xf090, size 8, enabled
    bar   [14] = type I/O Port, range 32, base 0xf080, size 4, enabled
    bar   [18] = type I/O Port, range 32, base 0xf070, size 8, enabled
    bar   [1c] = type I/O Port, range 32, base 0xf060, size 4, enabled
    bar   [20] = type I/O Port, range 32, base 0xf020, size 32, enabled
    bar   [24] = type Memory, range 32, base 0xfbf26000, size 2048, enabled
    cap 05[80] = MSI supports 1 message enabled with 1 message
    cap 01[70] = powerspec 3  supports D0 D3  current D0
    cap 12[a8] = SATA Index-Data Pair
    cap 13[b0] = PCI Advanced Features: FLR TP

ichsmb0@pci0:0:31:3:	class=0x0c0500 rev=0x05 hdr=0x00 vendor=0x8086 device=0x1d22 subvendor=0x1028 subdevice=0x0497
    vendor     = 'Intel Corporation'
    device     = 'C600/X79 series chipset SMBus Host Controller'
    class      = serial bus
    subclass   = SMBus
    bar   [10] = type Memory, range 64, base 0xfbf25000, size 256, enabled
    bar   [20] = type I/O Port, range 32, base 0xf000, size 32, enabled

vgapci0@pci0:3:0:0:	class=0x030000 rev=0x00 hdr=0x00 vendor=0x1002 device=0x6738 subvendor=0x1682 subdevice=0x3100
    vendor     = 'Advanced Micro Devices, Inc. [AMD/ATI]'
    device     = 'Barts XT [Radeon HD 6870]'
    class      = display
    subclass   = VGA
    bar   [10] = type Prefetchable Memory, range 64, base 0xe0000000, size 268435456, enabled
    bar   [18] = type Memory, range 64, base 0xfbe20000, size 131072, enabled
    bar   [20] = type I/O Port, range 32, base 0xe000, size 256, enabled
    cap 01[50] = powerspec 3  supports D0 D1 D2 D3  current D0
    cap 10[58] = PCI-Express 2 legacy endpoint max data 256(256) NS
                 max read 4096
                 link x16(x16) speed 2.5(5.0) ASPM disabled(L0s/L1)
    cap 05[a0] = MSI supports 1 message, 64 bit enabled with 1 message
    ecap 000b[100] = Vendor [1] ID 0001 Rev 1 Length 16
    ecap 0001[150] = AER 1 0 fatal 1 non-fatal 1 corrected

hdac0@pci0:3:0:1:	class=0x040300 rev=0x00 hdr=0x00 vendor=0x1002 device=0xaa88 subvendor=0x1682 subdevice=0xaa88
    vendor     = 'Advanced Micro Devices, Inc. [AMD/ATI]'
    device     = 'Barts HDMI Audio [Radeon HD 6790/6850/6870 / 7720 OEM]'
    class      = multimedia
    subclass   = HDA
    bar   [10] = type Memory, range 64, base 0xfbe40000, size 16384, enabled
    cap 01[50] = powerspec 3  supports D0 D1 D2 D3  current D0
    cap 10[58] = PCI-Express 2 legacy endpoint max data 256(256) NS
                 max read 4096
                 link x16(x16) speed 2.5(5.0) ASPM disabled(L0s/L1)
    cap 05[a0] = MSI supports 1 message, 64 bit enabled with 1 message
    ecap 000b[100] = Vendor [1] ID 0001 Rev 1 Length 16
    ecap 0001[150] = AER 1 0 fatal 1 non-fatal 1 corrected

xhci0@pci0:7:0:0:	class=0x0c0330 rev=0x04 hdr=0x00 vendor=0x1033 device=0x0194 subvendor=0x1028 subdevice=0x0497
    vendor     = 'NEC Corporation'
    device     = 'uPD720200 USB 3.0 Host Controller'
    class      = serial bus
    subclass   = USB
    bar   [10] = type Memory, range 64, base 0xfbc00000, size 8192, enabled
    cap 01[50] = powerspec 3  supports D0 D3  current D0
    cap 05[70] = MSI supports 8 messages, 64 bit 
    cap 11[90] = MSI-X supports 8 messages, enabled
                 Table in map 0x10[0x1000], PBA in map 0x10[0x1080]
    cap 10[a0] = PCI-Express 2 endpoint max data 128(128) NS
                 max read 4096
                 link x1(x1) speed 5.0(5.0) ASPM disabled(L0s/L1) ClockPM enabled
    ecap 0001[100] = AER 1 0 fatal 0 non-fatal 1 corrected
    ecap 0003[140] = Serial 1 ffffffffffffffff
    ecap 0018[150] = LTR 1
