hostb0@pci0:0:0:0:	class=0x060000 card=0x82d31043 chip=0x2e208086 rev=0x03 hdr=0x00
    vendor     = 'Intel Corporation'
    device     = '4 Series Chipset DRAM Controller'
    class      = bridge
    subclass   = HOST-PCI
    cap 09[e0] = vendor (length 12) Intel cap 8 version 1

pcib1@pci0:0:1:0:	class=0x060400 card=0x82d31043 chip=0x2e218086 rev=0x03 hdr=0x01
    vendor     = 'Intel Corporation'
    device     = '4 Series Chipset PCI Express Root Port'
    class      = bridge
    subclass   = PCI-PCI
    cap 0d[88] = PCI Bridge card=0x82d31043
    cap 01[80] = powerspec 3  supports D0 D3  current D0
    cap 05[90] = MSI supports 1 message 
    cap 10[a0] = PCI-Express 2 root port max data 128(128)
                 link x16(x16) speed 2.5(5.0) ASPM disabled(L0s)
                 slot 0 power limit 75000 mW
    ecap 0002[100] = VC 1 max VC0
    ecap 0005[140] = Root Complex Link Declaration 1

uhci0@pci0:0:26:0:	class=0x0c0300 card=0x82d41043 chip=0x3a378086 rev=0x00 hdr=0x00
    vendor     = 'Intel Corporation'
    device     = '82801JI (ICH10 Family) USB UHCI Controller'
    class      = serial bus
    subclass   = USB
    bar   [20] = type I/O Port, range 32, base 0x9800, size 32, enabled
    cap 09[50] = vendor (length 6) Intel cap 2 version 0

uhci1@pci0:0:26:1:	class=0x0c0300 card=0x82d41043 chip=0x3a388086 rev=0x00 hdr=0x00
    vendor     = 'Intel Corporation'
    device     = '82801JI (ICH10 Family) USB UHCI Controller'
    class      = serial bus
    subclass   = USB
    bar   [20] = type I/O Port, range 32, base 0x9880, size 32, enabled
    cap 09[50] = vendor (length 6) Intel cap 2 version 0

uhci2@pci0:0:26:2:	class=0x0c0300 card=0x82d41043 chip=0x3a398086 rev=0x00 hdr=0x00
    vendor     = 'Intel Corporation'
    device     = '82801JI (ICH10 Family) USB UHCI Controller'
    class      = serial bus
    subclass   = USB
    bar   [20] = type I/O Port, range 32, base 0x9c00, size 32, enabled
    cap 09[50] = vendor (length 6) Intel cap 2 version 0

ehci0@pci0:0:26:7:	class=0x0c0320 card=0x82d41043 chip=0x3a3c8086 rev=0x00 hdr=0x00
    vendor     = 'Intel Corporation'
    device     = '82801JI (ICH10 Family) USB2 EHCI Controller'
    class      = serial bus
    subclass   = USB
    bar   [10] = type Memory, range 32, base 0xf9fffc00, size 1024, enabled
    cap 01[50] = powerspec 2  supports D0 D3  current D0
    cap 0a[58] = EHCI Debug Port at offset 0xa0 in map 0x14
    cap 09[98] = vendor (length 6) Intel cap 2 version 0

hdac0@pci0:0:27:0:	class=0x040300 card=0x83ae1043 chip=0x3a3e8086 rev=0x00 hdr=0x00
    vendor     = 'Intel Corporation'
    device     = '82801JI (ICH10 Family) HD Audio Controller'
    class      = multimedia
    subclass   = HDA
    bar   [10] = type Memory, range 64, base 0xf9ff8000, size 16384, enabled
    cap 01[50] = powerspec 2  supports D0 D3  current D0
    cap 05[60] = MSI supports 1 message, 64 bit enabled with 1 message
    cap 10[70] = PCI-Express 1 root endpoint max data 128(128) FLR NS
    ecap 0002[100] = VC 1 max VC1
    ecap 0005[130] = Root Complex Link Declaration 1

pcib2@pci0:0:28:0:	class=0x060400 card=0x82d41043 chip=0x3a408086 rev=0x00 hdr=0x01
    vendor     = 'Intel Corporation'
    device     = '82801JI (ICH10 Family) PCI Express Root Port 1'
    class      = bridge
    subclass   = PCI-PCI
    cap 10[40] = PCI-Express 1 root port max data 128(128)
                 link x0(x1) speed 0.0(2.5) ASPM disabled(L0s/L1)
                 slot 0 power limit 10000 mW HotPlug(empty) surprise
    cap 05[80] = MSI supports 1 message enabled with 1 message
    cap 0d[90] = PCI Bridge card=0x82d41043
    cap 01[a0] = powerspec 2  supports D0 D3  current D0
    ecap 0002[100] = VC 1 max VC0
    ecap 0005[180] = Root Complex Link Declaration 1

pcib3@pci0:0:28:3:	class=0x060400 card=0x82d41043 chip=0x3a468086 rev=0x00 hdr=0x01
    vendor     = 'Intel Corporation'
    device     = '82801JI (ICH10 Family) PCI Express Root Port 4'
    class      = bridge
    subclass   = PCI-PCI
    cap 10[40] = PCI-Express 1 root port max data 128(128)
                 link x1(x1) speed 2.5(2.5) ASPM disabled(L0s/L1)
                 slot 0 power limit 10000 mW HotPlug(present) surprise
    cap 05[80] = MSI supports 1 message enabled with 1 message
    cap 0d[90] = PCI Bridge card=0x82d41043
    cap 01[a0] = powerspec 2  supports D0 D3  current D0
    ecap 0002[100] = VC 1 max VC0
    ecap 0005[180] = Root Complex Link Declaration 1

pcib4@pci0:0:28:4:	class=0x060400 card=0x82d41043 chip=0x3a488086 rev=0x00 hdr=0x01
    vendor     = 'Intel Corporation'
    device     = '82801JI (ICH10 Family) PCI Express Root Port 5'
    class      = bridge
    subclass   = PCI-PCI
    cap 10[40] = PCI-Express 1 root port max data 128(128)
                 link x1(x1) speed 2.5(2.5) ASPM disabled(L0s/L1)
                 slot 0 power limit 10000 mW HotPlug(present) surprise
    cap 05[80] = MSI supports 1 message enabled with 1 message
    cap 0d[90] = PCI Bridge card=0x82d41043
    cap 01[a0] = powerspec 2  supports D0 D3  current D0
    ecap 0002[100] = VC 1 max VC0
    ecap 0005[180] = Root Complex Link Declaration 1

pcib5@pci0:0:28:5:	class=0x060400 card=0x82d41043 chip=0x3a4a8086 rev=0x00 hdr=0x01
    vendor     = 'Intel Corporation'
    device     = '82801JI (ICH10 Family) PCI Express Root Port 6'
    class      = bridge
    subclass   = PCI-PCI
    cap 10[40] = PCI-Express 1 root port max data 128(128)
                 link x1(x1) speed 2.5(2.5) ASPM disabled(L0s/L1)
                 slot 0 power limit 10000 mW HotPlug(present) surprise
    cap 05[80] = MSI supports 1 message enabled with 1 message
    cap 0d[90] = PCI Bridge card=0x82d41043
    cap 01[a0] = powerspec 2  supports D0 D3  current D0
    ecap 0002[100] = VC 1 max VC0
    ecap 0005[180] = Root Complex Link Declaration 1

uhci3@pci0:0:29:0:	class=0x0c0300 card=0x82d41043 chip=0x3a348086 rev=0x00 hdr=0x00
    vendor     = 'Intel Corporation'
    device     = '82801JI (ICH10 Family) USB UHCI Controller'
    class      = serial bus
    subclass   = USB
    bar   [20] = type I/O Port, range 32, base 0x9080, size 32, enabled
    cap 09[50] = vendor (length 6) Intel cap 2 version 0

uhci4@pci0:0:29:1:	class=0x0c0300 card=0x82d41043 chip=0x3a358086 rev=0x00 hdr=0x00
    vendor     = 'Intel Corporation'
    device     = '82801JI (ICH10 Family) USB UHCI Controller'
    class      = serial bus
    subclass   = USB
    bar   [20] = type I/O Port, range 32, base 0x9400, size 32, enabled
    cap 09[50] = vendor (length 6) Intel cap 2 version 0

uhci5@pci0:0:29:2:	class=0x0c0300 card=0x82d41043 chip=0x3a368086 rev=0x00 hdr=0x00
    vendor     = 'Intel Corporation'
    device     = '82801JI (ICH10 Family) USB UHCI Controller'
    class      = serial bus
    subclass   = USB
    bar   [20] = type I/O Port, range 32, base 0x9480, size 32, enabled
    cap 09[50] = vendor (length 6) Intel cap 2 version 0

ehci1@pci0:0:29:7:	class=0x0c0320 card=0x82d41043 chip=0x3a3a8086 rev=0x00 hdr=0x00
    vendor     = 'Intel Corporation'
    device     = '82801JI (ICH10 Family) USB2 EHCI Controller'
    class      = serial bus
    subclass   = USB
    bar   [10] = type Memory, range 32, base 0xf9fff800, size 1024, enabled
    cap 01[50] = powerspec 2  supports D0 D3  current D0
    cap 0a[58] = EHCI Debug Port at offset 0xa0 in map 0x14
    cap 09[98] = vendor (length 6) Intel cap 2 version 0

pcib6@pci0:0:30:0:	class=0x060401 card=0x82d41043 chip=0x244e8086 rev=0x90 hdr=0x01
    vendor     = 'Intel Corporation'
    device     = '82801 PCI Bridge'
    class      = bridge
    subclass   = PCI-PCI
    cap 0d[50] = PCI Bridge card=0x82d41043

isab0@pci0:0:31:0:	class=0x060100 card=0x82d41043 chip=0x3a168086 rev=0x00 hdr=0x00
    vendor     = 'Intel Corporation'
    device     = '82801JIR (ICH10R) LPC Interface Controller'
    class      = bridge
    subclass   = PCI-ISA
    cap 09[e0] = vendor (length 12) Intel cap 1 version 0
		 features: SATA RAID-5, 4 PCI-e x1 slots

atapci1@pci0:0:31:2:	class=0x01018f card=0x82d41043 chip=0x3a208086 rev=0x00 hdr=0x00
    vendor     = 'Intel Corporation'
    device     = '82801JI (ICH10 Family) 4 port SATA IDE Controller'
    class      = mass storage
    subclass   = ATA
    bar   [10] = type I/O Port, range 32, base 0x8000, size 8, enabled
    bar   [14] = type I/O Port, range 32, base 0x7c00, size 4, enabled
    bar   [18] = type I/O Port, range 32, base 0x7880, size 8, enabled
    bar   [1c] = type I/O Port, range 32, base 0x7800, size 4, enabled
    bar   [20] = type I/O Port, range 32, base 0x7480, size 16, enabled
    bar   [24] = type I/O Port, range 32, base 0x7400, size 16, enabled
    cap 01[70] = powerspec 3  supports D0 D3  current D0
    cap 09[b0] = vendor (length 6) Intel cap 2 version 0

none0@pci0:0:31:3:	class=0x0c0500 card=0x82d41043 chip=0x3a308086 rev=0x00 hdr=0x00
    vendor     = 'Intel Corporation'
    device     = '82801JI (ICH10 Family) SMBus Controller'
    class      = serial bus
    subclass   = SMBus
    bar   [10] = type Memory, range 64, base 0xf9fff400, size 256, enabled
    bar   [20] = type I/O Port, range 32, base 0x400, size 32, enabled

atapci2@pci0:0:31:5:	class=0x010185 card=0x82d41043 chip=0x3a268086 rev=0x00 hdr=0x00
    vendor     = 'Intel Corporation'
    device     = '82801JI (ICH10 Family) 2 port SATA IDE Controller'
    class      = mass storage
    subclass   = ATA
    bar   [10] = type I/O Port, range 32, base 0x9000, size 8, enabled
    bar   [14] = type I/O Port, range 32, base 0x8c00, size 4, enabled
    bar   [18] = type I/O Port, range 32, base 0x8880, size 8, enabled
    bar   [1c] = type I/O Port, range 32, base 0x8800, size 4, enabled
    bar   [20] = type I/O Port, range 32, base 0x8480, size 16, enabled
    bar   [24] = type I/O Port, range 32, base 0x8400, size 16, enabled
    cap 01[70] = powerspec 3  supports D0 D3  current D0
    cap 09[b0] = vendor (length 6) Intel cap 2 version 0

vgapci0@pci0:1:0:0:	class=0x030000 card=0x00000000 chip=0x064010de rev=0xa1 hdr=0x00
    vendor     = 'NVIDIA Corporation'
    device     = 'G96C [GeForce 9500 GT]'
    class      = display
    subclass   = VGA
    bar   [10] = type Memory, range 32, base 0xfd000000, size 16777216, enabled
    bar   [14] = type Prefetchable Memory, range 64, base 0xd0000000, size 268435456, enabled
    bar   [1c] = type Memory, range 64, base 0xfa000000, size 33554432, enabled
    bar   [24] = type I/O Port, range 32, base 0xac00, size 128, enabled
    cap 01[60] = powerspec 3  supports D0 D3  current D0
    cap 05[68] = MSI supports 1 message, 64 bit 
    cap 10[78] = PCI-Express 1 endpoint max data 128(128) RO NS
                 link x16(x16) speed 2.5(2.5) ASPM disabled(L0s/L1)
    cap 09[b4] = vendor (length 20)
    ecap 0002[100] = VC 1 max VC0
    ecap 0004[128] = Power Budgeting 1
    ecap 000b[600] = Vendor 1 ID 1

none1@pci0:4:0:0:	class=0x0c0010 card=0x83841043 chip=0x34031106 rev=0x00 hdr=0x00
    vendor     = 'VIA Technologies, Inc.'
    device     = 'VT6315 Series Firewire Controller'
    class      = serial bus
    subclass   = FireWire
    bar   [10] = type Memory, range 64, base 0xfeaff800, size 2048, enabled
    bar   [18] = type I/O Port, range 32, base 0xd800, size 256, enabled
    cap 01[50] = powerspec 3  supports D0 D2 D3  current D0
    cap 05[80] = MSI supports 1 message, 64 bit, vector masks 
    cap 10[98] = PCI-Express 1 endpoint max data 128(128)
                 link x1(x1) speed 2.5(2.5) ASPM disabled(L0s/L1)
    ecap 0001[100] = AER 1 0 fatal 0 non-fatal 1 corrected
    ecap 0003[130] = Serial 1 001e8cffffbced25

atapci0@pci0:3:0:0:	class=0x010185 card=0x824f1043 chip=0x2361197b rev=0x02 hdr=0x00
    vendor     = 'JMicron Technology Corp.'
    device     = 'JMB361 AHCI/IDE'
    class      = mass storage
    subclass   = ATA
    bar   [10] = type I/O Port, range 32, base 0xcc00, size 8, enabled
    bar   [14] = type I/O Port, range 32, base 0xc880, size 4, enabled
    bar   [18] = type I/O Port, range 32, base 0xc800, size 8, enabled
    bar   [1c] = type I/O Port, range 32, base 0xc480, size 4, enabled
    bar   [20] = type I/O Port, range 32, base 0xc400, size 16, enabled
    bar   [24] = type Memory, range 32, base 0xfe9fe000, size 8192, enabled
    cap 01[68] = powerspec 2  supports D0 D3  current D0
    cap 10[50] = PCI-Express 1 legacy endpoint MSI 1 max data 128(128)
                 link x1(x1) speed 2.5(2.5) ASPM disabled(L0s)

ale0@pci0:2:0:0:	class=0x020000 card=0x82261043 chip=0x10261969 rev=0xb0 hdr=0x00
    vendor     = 'Qualcomm Atheros'
    device     = 'AR8121/AR8113/AR8114 Gigabit or Fast Ethernet'
    class      = network
    subclass   = ethernet
    bar   [10] = type Memory, range 64, base 0xfe8c0000, size 262144, enabled
    bar   [18] = type I/O Port, range 32, base 0xbc00, size 128, enabled
    cap 01[40] = powerspec 2  supports D0 D3  current D0
    cap 05[48] = MSI supports 1 message, 64 bit enabled with 1 message
    cap 10[58] = PCI-Express 1 endpoint max data 128(4096)
                 link x1(x1) speed 2.5(2.5) ASPM disabled(L0s)
    ecap 0001[100] = AER 1 0 fatal 1 non-fatal 0 corrected
    ecap 0003[180] = Serial 1 fff6089f90e6baff

ral0@pci0:6:0:0:	class=0x028000 card=0x3c041186 chip=0x30601814 rev=0x00 hdr=0x00
    vendor     = 'Ralink corp.'
    device     = 'RT3060 Wireless 802.11n 1T/1R'
    class      = network
    bar   [10] = type Memory, range 32, base 0xfebf0000, size 65536, enabled
    cap 01[40] = powerspec 3  supports D0 D3  current D0

re0@pci0:6:1:0:	class=0x020000 card=0x43001186 chip=0x43001186 rev=0x10 hdr=0x00
    vendor     = 'D-Link System Inc'
    device     = 'DGE-528T Gigabit Ethernet Adapter'
    class      = network
    subclass   = ethernet
    bar   [10] = type I/O Port, range 32, base 0xe800, size 256, enabled
    bar   [14] = type Memory, range 32, base 0xfebefc00, size 256, enabled
    cap 01[dc] = powerspec 2  supports D0 D1 D2 D3  current D0
