hostb0@pci0:0:0:0:	class=0x060000 rev=0x01 hdr=0x00 vendor=0x8086 device=0x9a14 subvendor=0x144d subdevice=0xc1ad
    vendor     = 'Intel Corporation'
    device     = '11th Gen Core Processor Host Bridge/DRAM Registers'
    class      = bridge
    subclass   = HOST-PCI
    cap 09[e0] = vendor (length 20) Intel cap 0 version 1

vgapci0@pci0:0:2:0:	class=0x030000 rev=0x01 hdr=0x00 vendor=0x8086 device=0x9a49 subvendor=0x144d subdevice=0xc1ad
    vendor     = 'Intel Corporation'
    device     = 'TigerLake-LP GT2 [Iris Xe Graphics]'
    class      = display
    subclass   = VGA
    bar   [10] = type Memory, range 64, base 0x6100000000, size 16777216, enabled
    bar   [18] = type Prefetchable Memory, range 64, base 0x4000000000, size 268435456, enabled
    bar   [20] = type I/O Port, range 32, base 0x3000, size 64, enabled
    cap 09[40] = vendor (length 12) Intel cap 0 version 1
    cap 10[70] = PCI-Express 2 root endpoint max data 128(128) FLR
                 max read 128
    cap 05[ac] = MSI supports 1 message, vector masks enabled with 1 message
    cap 01[d0] = powerspec 2  supports D0 D3  current D0
    ecap 001b[100] = Process Address Space ID 1
    ecap 000f[200] = ATS 1
    ecap 0013[300] = Page Page Request 1
    ecap 0010[320] = SR-IOV 1 IOV disabled, Memory Space disabled, ARI disabled
                     0 VFs configured out of 7 supported
                     First VF RID Offset 0x0001, VF RID Stride 0x0001
                     VF Device ID 0x9a49
                     Page Sizes: 4096 (enabled), 8192, 65536, 262144, 1048576, 4194304

none0@pci0:0:4:0:	class=0x118000 rev=0x01 hdr=0x00 vendor=0x8086 device=0x9a03 subvendor=0x144d subdevice=0xc1ad
    vendor     = 'Intel Corporation'
    device     = 'TigerLake-LP Dynamic Tuning Processor Participant'
    class      = dasp
    bar   [10] = type Memory, range 64, base 0x6101100000, size 131072, enabled
    cap 05[90] = MSI supports 1 message 
    cap 01[d0] = powerspec 3  supports D0 D3  current D0
    cap 09[e0] = vendor (length 12) Intel cap 0 version 1

pcib1@pci0:0:6:0:	class=0x060400 rev=0x01 hdr=0x01 vendor=0x8086 device=0x9a09 subvendor=0x0000 subdevice=0x0000
    vendor     = 'Intel Corporation'
    device     = '11th Gen Core Processor PCIe Controller'
    class      = bridge
    subclass   = PCI-PCI
    cap 10[40] = PCI-Express 2 root port max data 128(256) ARI disabled
                 max read 128
                 link x4(x4) speed 16.0(16.0) ASPM disabled(L1)
                 slot 0 power limit 75000 mW
    cap 05[80] = MSI supports 1 message 
    cap 0d[90] = PCI Bridge subvendor=0x0000 subdevice=0x0000
    cap 01[a0] = powerspec 3  supports D0 D3  current D0
    ecap 0001[100] = AER 1 0 fatal 1 non-fatal 0 corrected
    ecap 000d[220] = ACS 1
    ecap 001e[200] = L1 PM Substates 1
    ecap 001f[150] = Precision Time Measurement 1
    ecap 0002[280] = VC 1 max VC0
    ecap 001d[a00] = Downstream Port Containment 1
    ecap 0019[a30] = PCIe Sec 1 lane errors 0
    ecap 0025[a90] = Data Link Feature 1
    ecap 0026[a9c] = Physical Layer 16.0 GT/s 1
    ecap 0027[edc] = Lane Margining at Receiver 1

none1@pci0:0:8:0:	class=0x088000 rev=0x01 hdr=0x00 vendor=0x8086 device=0x9a11 subvendor=0x144d subdevice=0xc1ad
    vendor     = 'Intel Corporation'
    device     = 'GNA Scoring Accelerator module'
    class      = base peripheral
    bar   [10] = type Memory, range 64, base 0x6101152000, size 4096, enabled
    cap 05[90] = MSI supports 1 message 
    cap 09[a0] = vendor (length 20) Intel cap 15 version 0
    cap 01[dc] = powerspec 2  supports D0 D3  current D0
    cap 13[f0] = PCI Advanced Features: FLR TP

xhci0@pci0:0:13:0:	class=0x0c0330 rev=0x01 hdr=0x00 vendor=0x8086 device=0x9a13 subvendor=0x0000 subdevice=0x0000
    vendor     = 'Intel Corporation'
    device     = 'Tiger Lake-LP Thunderbolt 4 USB Controller'
    class      = serial bus
    subclass   = USB
    bar   [10] = type Memory, range 64, base 0x6101130000, size 65536, enabled
    cap 01[70] = powerspec 2  supports D0 D3  current D0
    cap 05[80] = MSI supports 8 messages, 64 bit enabled with 1 message
    cap 09[90] = vendor (length 20) Intel cap 15 version 0
    cap 09[b0] = vendor (length 0) Intel cap 0 version 1

xhci1@pci0:0:20:0:	class=0x0c0330 rev=0x20 hdr=0x00 vendor=0x8086 device=0xa0ed subvendor=0x144d subdevice=0xc1ad
    vendor     = 'Intel Corporation'
    device     = 'Tiger Lake-LP USB 3.2 Gen 2x1 xHCI Host Controller'
    class      = serial bus
    subclass   = USB
    bar   [10] = type Memory, range 64, base 0x6101120000, size 65536, enabled
    cap 01[70] = powerspec 2  supports D0 D3  current D0
    cap 05[80] = MSI supports 8 messages, 64 bit enabled with 1 message
    cap 09[90] = vendor (length 20) Intel cap 15 version 0
    cap 09[b0] = vendor (length 0) Intel cap 0 version 1

none2@pci0:0:20:2:	class=0x050000 rev=0x20 hdr=0x00 vendor=0x8086 device=0xa0ef subvendor=0x144d subdevice=0xc1ad
    vendor     = 'Intel Corporation'
    device     = 'Tiger Lake-LP Shared SRAM'
    class      = memory
    subclass   = RAM
    bar   [10] = type Memory, range 64, base 0x6101148000, size 16384, enabled
    bar   [18] = type Memory, range 64, base 0x6101151000, size 4096, enabled
    cap 01[80] = powerspec 3  supports D0 D3  current D0

iwlwifi0@pci0:0:20:3:	class=0x028000 rev=0x20 hdr=0x00 vendor=0x8086 device=0xa0f0 subvendor=0x8086 subdevice=0x6074
    vendor     = 'Intel Corporation'
    device     = 'Wi-Fi 6 AX201'
    class      = network
    bar   [10] = type Memory, range 64, base 0x6101144000, size 16384, enabled
    cap 01[c8] = powerspec 3  supports D0 D3  current D0
    cap 05[d0] = MSI supports 1 message, 64 bit 
    cap 10[40] = PCI-Express 2 root endpoint max data 128(128) FLR RO NS
                 max read 128
    cap 11[80] = MSI-X supports 16 messages, enabled
                 Table in map 0x10[0x2000], PBA in map 0x10[0x3000]
    ecap 0018[100] = LTR 1
    ecap 000b[164] = Vendor [1] ID 0010 Rev 0 Length 20

ig4iic0@pci0:0:21:0:	class=0x0c8000 rev=0x20 hdr=0x00 vendor=0x8086 device=0xa0e8 subvendor=0x144d subdevice=0xc1ad
    vendor     = 'Intel Corporation'
    device     = 'Tiger Lake-LP Serial IO I2C Controller'
    class      = serial bus
    bar   [10] = type Memory, range 64, base 0x80000000, size 4096, enabled
    cap 01[80] = powerspec 3  supports D0 D3  current D0
    cap 09[90] = vendor (length 20) Intel cap 15 version 0

ig4iic1@pci0:0:21:1:	class=0x0c8000 rev=0x20 hdr=0x00 vendor=0x8086 device=0xa0e9 subvendor=0x144d subdevice=0xc1ad
    vendor     = 'Intel Corporation'
    device     = 'Tiger Lake-LP Serial IO I2C Controller'
    class      = serial bus
    bar   [10] = type Memory, range 64, base 0x80001000, size 4096, enabled
    cap 01[80] = powerspec 3  supports D0 D3  current D0
    cap 09[90] = vendor (length 20) Intel cap 15 version 0

ig4iic2@pci0:0:21:3:	class=0x0c8000 rev=0x20 hdr=0x00 vendor=0x8086 device=0xa0eb subvendor=0x144d subdevice=0xc1ad
    vendor     = 'Intel Corporation'
    device     = 'Tiger Lake-LP Serial IO I2C Controller'
    class      = serial bus
    bar   [10] = type Memory, range 64, base 0x80002000, size 4096, enabled
    cap 01[80] = powerspec 3  supports D0 D3  current D0
    cap 09[90] = vendor (length 20) Intel cap 15 version 0

none3@pci0:0:22:0:	class=0x078000 rev=0x20 hdr=0x00 vendor=0x8086 device=0xa0e0 subvendor=0x144d subdevice=0xc1ad
    vendor     = 'Intel Corporation'
    device     = 'Tiger Lake-LP Management Engine Interface'
    class      = simple comms
    bar   [10] = type Memory, range 64, base 0x610114d000, size 4096, enabled
    cap 01[50] = powerspec 3  supports D0 D3  current D0
    cap 05[8c] = MSI supports 1 message, 64 bit 
    cap 09[a4] = vendor (length 20) Intel cap 15 version 0

pcib5@pci0:0:29:0:	class=0x060400 rev=0x20 hdr=0x01 vendor=0x8086 device=0xa0b0 subvendor=0x144d subdevice=0xc1ad
    vendor     = 'Intel Corporation'
    device     = 'Tiger Lake-LP PCI Express Root Port'
    class      = bridge
    subclass   = PCI-PCI
    cap 10[40] = PCI-Express 2 root port max data 256(256) ARI disabled
                 max read 128
                 link x4(x4) speed 8.0(8.0) ASPM L1(L1)
                 slot 12 power limit 250 mW
    cap 05[80] = MSI supports 1 message 
    cap 0d[90] = PCI Bridge subvendor=0x144d subdevice=0xc1ad
    cap 01[a0] = powerspec 3  supports D0 D3  current D0
    ecap 0001[100] = AER 1 0 fatal 0 non-fatal 0 corrected
    ecap 000d[220] = ACS 1
    ecap 001f[150] = Precision Time Measurement 1
    ecap 001e[200] = L1 PM Substates 1
    ecap 0019[a30] = PCIe Sec 1 lane errors 0
    ecap 001d[a00] = Downstream Port Containment 1

isab0@pci0:0:31:0:	class=0x060100 rev=0x20 hdr=0x00 vendor=0x8086 device=0xa082 subvendor=0x144d subdevice=0xc1ad
    vendor     = 'Intel Corporation'
    device     = 'Tiger Lake-LP LPC Controller'
    class      = bridge
    subclass   = PCI-ISA

hdac0@pci0:0:31:3:	class=0x040100 rev=0x20 hdr=0x00 vendor=0x8086 device=0xa0c8 subvendor=0x144d subdevice=0xc1ad
    vendor     = 'Intel Corporation'
    device     = 'Tiger Lake-LP Smart Sound Technology Audio Controller'
    class      = multimedia
    subclass   = audio
    bar   [10] = type Memory, range 64, base 0x6101140000, size 16384, enabled
    bar   [20] = type Memory, range 64, base 0x6101000000, size 1048576, enabled
    cap 01[50] = powerspec 3  supports D0 D3  current D0
    cap 09[80] = vendor (length 20) Intel cap 15 version 0
    cap 05[60] = MSI supports 1 message, 64 bit enabled with 1 message

ichsmb0@pci0:0:31:4:	class=0x0c0500 rev=0x20 hdr=0x00 vendor=0x8086 device=0xa0a3 subvendor=0x144d subdevice=0xc1ad
    vendor     = 'Intel Corporation'
    device     = 'Tiger Lake-LP SMBus Controller'
    class      = serial bus
    subclass   = SMBus
    bar   [10] = type Memory, range 64, base 0x610114c000, size 256, enabled
    bar   [20] = type I/O Port, range 32, base 0xefa0, size 32, enabled

none4@pci0:0:31:5:	class=0x0c8000 rev=0x20 hdr=0x00 vendor=0x8086 device=0xa0a4 subvendor=0x144d subdevice=0xc1ad
    vendor     = 'Intel Corporation'
    device     = 'Tiger Lake-LP SPI Controller'
    class      = serial bus
    bar   [10] = type Memory, range 32, base 0xfe010000, size 4096, enabled

pcib2@pci0:1:0:0:	class=0x060400 rev=0x00 hdr=0x01 vendor=0x8086 device=0x4910 subvendor=0x8086 subdevice=0x0000
    vendor     = 'Intel Corporation'
    class      = bridge
    subclass   = PCI-PCI
    bar   [10] = type Memory, range 64, base 0x53000000, size 131072, enabled
    cap 10[40] = PCI-Express 2 upstream port max data 128(128)
                 max read 512
                 link x4(x8) speed 16.0(16.0)
    cap 01[a0] = powerspec 3  supports D0 D3  current D0
    cap 0d[7c] = PCI Bridge subvendor=0x8086 subdevice=0x0000
    ecap 0001[100] = AER 1 0 fatal 1 non-fatal 1 corrected
    ecap 000b[190] = Vendor [1] ID 0003 Rev 0 Length 10
    ecap 0018[1e8] = LTR 1
    ecap 0019[200] = PCIe Sec 1 lane errors 0
    ecap 0025[400] = Data Link Feature 1
    ecap 0026[410] = Physical Layer 16.0 GT/s 1
    ecap 0027[450] = Lane Margining at Receiver 1

pcib3@pci0:2:1:0:	class=0x060400 rev=0x00 hdr=0x01 vendor=0x8086 device=0x490f subvendor=0x8086 subdevice=0x490f
    vendor     = 'Intel Corporation'
    class      = bridge
    subclass   = PCI-PCI
    cap 10[40] = PCI-Express 2 downstream port max data 128(128) RO ARI disabled
                 max read 128
                 link x1(x1) speed 2.5(2.5) ASPM L0s(L0s/L1)
    cap 01[a0] = powerspec 3  supports D0 D3  current D0
    cap 0d[7c] = PCI Bridge subvendor=0x8086 subdevice=0x490f
    ecap 0001[100] = AER 1 0 fatal 0 non-fatal 1 corrected
    ecap 000d[148] = ACS 1

pcib4@pci0:2:5:0:	class=0x060400 rev=0x00 hdr=0x01 vendor=0x8086 device=0x490f subvendor=0x8086 subdevice=0x0000
    vendor     = 'Intel Corporation'
    class      = bridge
    subclass   = PCI-PCI
    cap 10[40] = PCI-Express 2 downstream port max data 128(128) RO ARI disabled
                 max read 128
                 link x1(x1) speed 2.5(2.5) ASPM L0s/L1(L0s/L1)
    cap 01[a0] = powerspec 3  supports D0 D3  current D0
    cap 0d[7c] = PCI Bridge subvendor=0x8086 subdevice=0x0000
    ecap 0001[100] = AER 1 1 fatal 0 non-fatal 0 corrected
    ecap 000d[148] = ACS 1

vgapci1@pci0:3:0:0:	class=0x030000 rev=0x01 hdr=0x00 vendor=0x8086 device=0x4905 subvendor=0x144d subdevice=0xc1ad
    vendor     = 'Intel Corporation'
    device     = 'DG1 [Iris Xe MAX Graphics]'
    class      = display
    subclass   = VGA
    bar   [10] = type Memory, range 64, base 0x50000000, size 16777216, enabled
    bar   [18] = type Prefetchable Memory, range 64, base 0x6000000000, size 4294967296, enabled
    cap 09[40] = vendor (length 12) Intel cap 0 version 1
    cap 10[70] = PCI-Express 2 endpoint max data 128(128) FLR RO NS
                 max read 128
                 link x1(x1) speed 2.5(2.5) ASPM L0s(L0s/L1)
    cap 05[ac] = MSI supports 1 message, 64 bit, vector masks 
    cap 01[d0] = powerspec 3  supports D0 D3  current D0
    ecap 0018[100] = LTR 1

none5@pci0:4:0:0:	class=0x058000 rev=0x00 hdr=0x00 vendor=0x8086 device=0x490e subvendor=0x0000 subdevice=0x0000
    vendor     = 'Intel Corporation'
    class      = memory
    bar   [10] = type Memory, range 64, base 0x52000000, size 16777216, enabled

nvme0@pci0:5:0:0:	class=0x010802 rev=0x00 hdr=0x00 vendor=0x144d device=0xa809 subvendor=0x144d subdevice=0xa801
    vendor     = 'Samsung Electronics Co Ltd'
    device     = 'NVMe SSD Controller 980'
    class      = mass storage
    subclass   = NVM
    bar   [10] = type Memory, range 64, base 0x53200000, size 16384, enabled
    cap 01[40] = powerspec 3  supports D0 D3  current D0
    cap 05[50] = MSI supports 32 messages, 64 bit 
    cap 10[70] = PCI-Express 2 endpoint max data 256(256) FLR RO NS
                 max read 512
                 link x4(x4) speed 8.0(8.0) ASPM L1(L1) ClockPM enabled
    cap 11[b0] = MSI-X supports 13 messages, enabled
                 Table in map 0x10[0x3000], PBA in map 0x10[0x2000]
    ecap 0001[100] = AER 2 0 fatal 0 non-fatal 0 corrected
    ecap 0003[148] = Serial 1 0000000000000000
    ecap 0004[158] = Power Budgeting 1
    ecap 0019[168] = PCIe Sec 1 lane errors 0
    ecap 0018[188] = LTR 1
    ecap 001e[190] = L1 PM Substates 1
