hostb0@pci0:0:0:0:	class=0x060000 rev=0x0e hdr=0x00 vendor=0x8086 device=0x0f00 subvendor=0x15d9 subdevice=0x0816
    vendor     = 'Intel Corporation'
    device     = 'Atom Processor Z36xxx/Z37xxx Series SoC Transaction Register'
    class      = bridge
    subclass   = HOST-PCI

vgapci0@pci0:0:2:0:	class=0x030000 rev=0x0e hdr=0x00 vendor=0x8086 device=0x0f31 subvendor=0x15d9 subdevice=0x0816
    vendor     = 'Intel Corporation'
    device     = 'Atom Processor Z36xxx/Z37xxx Series Graphics & Display'
    class      = display
    subclass   = VGA
    bar   [10] = type Memory, range 32, base 0x90000000, size 4194304, enabled
    bar   [18] = type Prefetchable Memory, range 32, base 0x80000000, size 268435456, enabled
    bar   [20] = type I/O Port, range 32, base 0xe020, size 8, enabled
    cap 01[d0] = powerspec 2  supports D0 D3  current D0
    cap 05[90] = MSI supports 1 message 
    cap 09[b0] = vendor (length 7) Intel cap 0 version 1

none0@pci0:0:26:0:	class=0x108000 rev=0x0e hdr=0x00 vendor=0x8086 device=0x0f18 subvendor=0x15d9 subdevice=0x0816
    vendor     = 'Intel Corporation'
    device     = 'Atom Processor Z36xxx/Z37xxx Series Trusted Execution Engine'
    class      = encrypt/decrypt
    bar   [10] = type Memory, range 32, base 0x90500000, size 1048576, enabled
    bar   [14] = type Memory, range 32, base 0x90400000, size 1048576, enabled
    cap 01[80] = powerspec 3  supports D0 D3  current D0
    cap 05[a0] = MSI supports 1 message 

hdac0@pci0:0:27:0:	class=0x040300 rev=0x0e hdr=0x00 vendor=0x8086 device=0x0f04 subvendor=0x15d9 subdevice=0x0816
    vendor     = 'Intel Corporation'
    device     = 'Atom Processor Z36xxx/Z37xxx Series High Definition Audio Controller'
    class      = multimedia
    subclass   = HDA
    bar   [10] = type Memory, range 64, base 0x90a00000, size 16384, enabled
    cap 01[50] = powerspec 2  supports D0 D3  current D0
    cap 05[60] = MSI supports 1 message, 64 bit enabled with 1 message

pcib1@pci0:0:28:0:	class=0x060400 rev=0x0e hdr=0x01 vendor=0x8086 device=0x0f48 subvendor=0x15d9 subdevice=0x0816
    vendor     = 'Intel Corporation'
    device     = 'Atom Processor E3800 Series PCI Express Root Port 1'
    class      = bridge
    subclass   = PCI-PCI
    cap 10[40] = PCI-Express 2 root port max data 128(128)
                 max read 128
                 link x0(x2) speed 0.0(5.0) ASPM disabled(L0s/L1)
                 slot 0 power limit 0 mW HotPlug(empty) surprise
    cap 05[80] = MSI supports 1 message 
    cap 0d[90] = PCI Bridge subvendor=0x15d9 subdevice=0x0816
    cap 01[a0] = powerspec 3  supports D0 D3  current D0

pcib2@pci0:0:28:2:	class=0x060400 rev=0x0e hdr=0x01 vendor=0x8086 device=0x0f4c subvendor=0x15d9 subdevice=0x0816
    vendor     = 'Intel Corporation'
    device     = 'Atom Processor E3800 Series PCI Express Root Port 3'
    class      = bridge
    subclass   = PCI-PCI
    cap 10[40] = PCI-Express 2 root port max data 128(128)
                 max read 128
                 link x1(x1) speed 2.5(5.0) ASPM disabled(L0s/L1)
                 slot 2 power limit 100 mW HotPlug(present) surprise
    cap 05[80] = MSI supports 1 message 
    cap 0d[90] = PCI Bridge subvendor=0x15d9 subdevice=0x0816
    cap 01[a0] = powerspec 3  supports D0 D3  current D0

pcib3@pci0:0:28:3:	class=0x060400 rev=0x0e hdr=0x01 vendor=0x8086 device=0x0f4e subvendor=0x15d9 subdevice=0x0816
    vendor     = 'Intel Corporation'
    device     = 'Atom Processor E3800 Series PCI Express Root Port 4'
    class      = bridge
    subclass   = PCI-PCI
    cap 10[40] = PCI-Express 2 root port max data 128(128)
                 max read 128
                 link x1(x1) speed 5.0(5.0) ASPM disabled(L0s/L1)
                 slot 3 power limit 100 mW HotPlug(present) surprise
    cap 05[80] = MSI supports 1 message 
    cap 0d[90] = PCI Bridge subvendor=0x15d9 subdevice=0x0816
    cap 01[a0] = powerspec 3  supports D0 D3  current D0

ehci0@pci0:0:29:0:	class=0x0c0320 rev=0x0e hdr=0x00 vendor=0x8086 device=0x0f34 subvendor=0x15d9 subdevice=0x0816
    vendor     = 'Intel Corporation'
    device     = 'Atom Processor Z36xxx/Z37xxx Series USB EHCI'
    class      = serial bus
    subclass   = USB
    bar   [10] = type Memory, range 32, base 0x90a05000, size 1024, enabled
    cap 01[50] = powerspec 3  supports D0 D3  current D0
    cap 0a[58] = EHCI Debug Port at offset 0xa0 in map 0x14
    cap 13[98] = PCI Advanced Features: FLR TP

isab0@pci0:0:31:0:	class=0x060100 rev=0x0e hdr=0x00 vendor=0x8086 device=0x0f1c subvendor=0x15d9 subdevice=0x0816
    vendor     = 'Intel Corporation'
    device     = 'Atom Processor Z36xxx/Z37xxx Series Power Control Unit'
    class      = bridge
    subclass   = PCI-ISA
    cap 09[e0] = vendor (length 12) Intel cap 1 version 0
		 features: 4 PCI-e x1 slots

ichsmb0@pci0:0:31:3:	class=0x0c0500 rev=0x0e hdr=0x00 vendor=0x8086 device=0x0f12 subvendor=0x15d9 subdevice=0x0816
    vendor     = 'Intel Corporation'
    device     = 'Atom Processor E3800/CE2700 Series SMBus Controller'
    class      = serial bus
    subclass   = SMBus
    bar   [10] = type Memory, range 32, base 0x90a04000, size 32, enabled
    bar   [20] = type I/O Port, range 32, base 0xe000, size 32, enabled
    cap 01[50] = powerspec 3  supports D0 D3  current D0

igb0@pci0:2:0:0:	class=0x020000 rev=0x03 hdr=0x00 vendor=0x8086 device=0x1533 subvendor=0x15d9 subdevice=0x1533
    vendor     = 'Intel Corporation'
    device     = 'I210 Gigabit Network Connection'
    class      = network
    subclass   = ethernet
    bar   [10] = type Memory, range 32, base 0x90900000, size 524288, enabled
    bar   [18] = type I/O Port, range 32, base 0xd000, size 32, enabled
    bar   [1c] = type Memory, range 32, base 0x90980000, size 16384, enabled
    cap 01[40] = powerspec 3  supports D0 D3  current D0
    cap 05[50] = MSI supports 1 message, 64 bit, vector masks 
    cap 11[70] = MSI-X supports 5 messages, enabled
                 Table in map 0x1c[0x0], PBA in map 0x1c[0x2000]
    cap 10[a0] = PCI-Express 2 endpoint max data 128(512) FLR NS
                 max read 512
                 link x1(x1) speed 2.5(2.5) ASPM disabled(L0s/L1)
    ecap 0001[100] = AER 2 0 fatal 0 non-fatal 2 corrected
    ecap 0003[140] = Serial 1 0cc47affffb019d4
    ecap 0017[1a0] = TPH Requester 1

pcib4@pci0:3:0:0:	class=0x060400 rev=0xab hdr=0x01 vendor=0x10b5 device=0x8605 subvendor=0x15d9 subdevice=0x0816
    vendor     = 'PLX Technology, Inc.'
    device     = 'PEX 8605 PCI Express 4-port Gen2 Switch'
    class      = bridge
    subclass   = PCI-PCI
    bar   [10] = type Memory, range 32, base 0x90800000, size 16384, enabled
    cap 01[40] = powerspec 3  supports D0 D1 D2 D3  current D0
    cap 05[48] = MSI supports 4 messages, 64 bit, vector masks 
    cap 10[68] = PCI-Express 2 upstream port max data 128(256) NS
                 max read 128
                 link x1(x1) speed 5.0(5.0) ASPM disabled(L0s/L1)
    cap 0d[a4] = PCI Bridge subvendor=0x15d9 subdevice=0x0816
    ecap 0003[100] = Serial 1 ab860210b5df0e00
    ecap 0001[fb4] = AER 1 0 fatal 0 non-fatal 3 corrected
    ecap 0004[138] = Power Budgeting 1
    ecap 0002[148] = VC 1 max VC0
    ecap 000b[950] = Vendor [1] ID 0001 Rev 0 Length 40

pcib5@pci0:4:1:0:	class=0x060400 rev=0xab hdr=0x01 vendor=0x10b5 device=0x8605 subvendor=0x15d9 subdevice=0x0816
    vendor     = 'PLX Technology, Inc.'
    device     = 'PEX 8605 PCI Express 4-port Gen2 Switch'
    class      = bridge
    subclass   = PCI-PCI
    cap 01[40] = powerspec 3  supports D0 D1 D2 D3  current D0
    cap 05[48] = MSI supports 4 messages, 64 bit, vector masks 
    cap 10[68] = PCI-Express 2 downstream port max data 128(256) NS ARI disabled
                 max read 128
                 link x1(x1) speed 2.5(5.0) ASPM disabled(L0s/L1)
                 slot 1 power limit 25000 mW
    cap 0d[a4] = PCI Bridge subvendor=0x15d9 subdevice=0x0816
    ecap 0003[100] = Serial 1 ab860210b5df0e00
    ecap 0001[fb4] = AER 1 0 fatal 0 non-fatal 1 corrected
    ecap 0002[148] = VC 1 max VC0
    ecap 000d[520] = ACS 1
    ecap 000b[950] = Vendor [1] ID 0001 Rev 0 Length 40

pcib6@pci0:4:2:0:	class=0x060400 rev=0xab hdr=0x01 vendor=0x10b5 device=0x8605 subvendor=0x15d9 subdevice=0x0816
    vendor     = 'PLX Technology, Inc.'
    device     = 'PEX 8605 PCI Express 4-port Gen2 Switch'
    class      = bridge
    subclass   = PCI-PCI
    cap 01[40] = powerspec 3  supports D0 D1 D2 D3  current D0
    cap 05[48] = MSI supports 4 messages, 64 bit, vector masks 
    cap 10[68] = PCI-Express 2 downstream port max data 128(256) RO NS ARI disabled
                 max read 128
                 link x0(x1) speed 0.0(5.0) ASPM disabled(L0s/L1)
                 slot 2 power limit 25000 mW
    cap 0d[a4] = PCI Bridge subvendor=0x15d9 subdevice=0x0816
    ecap 0003[100] = Serial 1 ab860210b5df0e00
    ecap 0001[fb4] = AER 1 0 fatal 0 non-fatal 1 corrected
    ecap 0002[148] = VC 1 max VC0
    ecap 000d[520] = ACS 1
    ecap 000b[950] = Vendor [1] ID 0001 Rev 0 Length 40

pcib7@pci0:4:3:0:	class=0x060400 rev=0xab hdr=0x01 vendor=0x10b5 device=0x8605 subvendor=0x15d9 subdevice=0x0816
    vendor     = 'PLX Technology, Inc.'
    device     = 'PEX 8605 PCI Express 4-port Gen2 Switch'
    class      = bridge
    subclass   = PCI-PCI
    cap 01[40] = powerspec 3  supports D0 D1 D2 D3  current D0
    cap 05[48] = MSI supports 4 messages, 64 bit, vector masks 
    cap 10[68] = PCI-Express 2 downstream port max data 128(256) NS ARI disabled
                 max read 128
                 link x1(x1) speed 5.0(5.0) ASPM disabled(L0s/L1)
                 slot 3 power limit 25000 mW
    cap 0d[a4] = PCI Bridge subvendor=0x15d9 subdevice=0x0816
    ecap 0003[100] = Serial 1 ab860210b5df0e00
    ecap 0001[fb4] = AER 1 0 fatal 0 non-fatal 1 corrected
    ecap 0002[148] = VC 1 max VC0
    ecap 000d[520] = ACS 1
    ecap 000b[950] = Vendor [1] ID 0001 Rev 0 Length 40

igb1@pci0:5:0:0:	class=0x020000 rev=0x03 hdr=0x00 vendor=0x8086 device=0x1533 subvendor=0x15d9 subdevice=0x1533
    vendor     = 'Intel Corporation'
    device     = 'I210 Gigabit Network Connection'
    class      = network
    subclass   = ethernet
    bar   [10] = type Memory, range 32, base 0x90700000, size 524288, enabled
    bar   [18] = type I/O Port, range 32, base 0xc000, size 32, enabled
    bar   [1c] = type Memory, range 32, base 0x90780000, size 16384, enabled
    cap 01[40] = powerspec 3  supports D0 D3  current D0
    cap 05[50] = MSI supports 1 message, 64 bit, vector masks 
    cap 11[70] = MSI-X supports 5 messages, enabled
                 Table in map 0x1c[0x0], PBA in map 0x1c[0x2000]
    cap 10[a0] = PCI-Express 2 endpoint max data 128(512) FLR NS
                 max read 512
                 link x1(x1) speed 2.5(2.5) ASPM disabled(L0s/L1)
    ecap 0001[100] = AER 2 0 fatal 0 non-fatal 1 corrected
    ecap 0003[140] = Serial 1 0cc47affffb019d5
    ecap 0017[1a0] = TPH Requester 1

ahci0@pci0:7:0:0:	class=0x010601 rev=0x11 hdr=0x00 vendor=0x1b4b device=0x9230 subvendor=0x1b4b subdevice=0x9230
    vendor     = 'Marvell Technology Group Ltd.'
    device     = '88SE9230 PCIe 2.0 x2 4-port SATA 6 Gb/s RAID Controller'
    class      = mass storage
    subclass   = SATA
    bar   [10] = type I/O Port, range 32, base 0xb050, size 8, enabled
    bar   [14] = type I/O Port, range 32, base 0xb040, size 4, enabled
    bar   [18] = type I/O Port, range 32, base 0xb030, size 8, enabled
    bar   [1c] = type I/O Port, range 32, base 0xb020, size 4, enabled
    bar   [20] = type I/O Port, range 32, base 0xb000, size 32, enabled
    bar   [24] = type Memory, range 32, base 0x90610000, size 2048, enabled
    cap 01[40] = powerspec 3  supports D0 D3  current D0
    cap 05[50] = MSI supports 1 message enabled with 1 message
    cap 10[70] = PCI-Express 2 legacy endpoint max data 128(512)
                 max read 512
                 link x1(x2) speed 5.0(5.0) ASPM disabled(L0s/L1)
    cap 12[e0] = SATA Index-Data Pair
    ecap 0001[100] = AER 1 0 fatal 0 non-fatal 0 corrected
