hostb0@pci0:0:0:0:	class=0x060000 rev=0x04 hdr=0x00 vendor=0x8086 device=0x2020 subvendor=0x1590 subdevice=0x00ea
    vendor     = 'Intel Corporation'
    device     = 'Sky Lake-E DMI3 Registers'
    class      = bridge
    subclass   = HOST-PCI
    cap 10[90] = PCI-Express 2 root port max data 128(256)
                 max read 128
                 link x0(x4) speed 0.0(8.0)
    cap 01[e0] = powerspec 3  supports D0 D3  current D0
    ecap 000b[100] = Vendor [1] ID 0002 Rev 0 Length 12
    ecap 000b[144] = Vendor [1] ID 0004 Rev 1 Length 60
    ecap 000b[1d0] = Vendor [1] ID 0003 Rev 1 Length 10
    ecap 0019[250] = PCIe Sec 1 lane errors 0x7
    ecap 000b[280] = Vendor [1] ID 0005 Rev 3 Length 24
    ecap 000b[300] = Vendor [1] ID 0008 Rev 0 Length 56

ioat0@pci0:0:4:0:	class=0x088000 rev=0x04 hdr=0x00 vendor=0x8086 device=0x2021 subvendor=0x1590 subdevice=0x00ea
    vendor     = 'Intel Corporation'
    device     = 'Sky Lake-E CBDMA Registers'
    class      = base peripheral
    bar   [10] = type Memory, range 64, base 0xc3ffff1c000, size 16384, enabled
    cap 11[80] = MSI-X supports 1 message, enabled
                 Table in map 0x10[0x2000], PBA in map 0x10[0x3000]
    cap 10[90] = PCI-Express 2 root endpoint max data 128(128) NS
                 max read 128
    cap 01[e0] = powerspec 3  supports D0 D3  current D0

ioat1@pci0:0:4:1:	class=0x088000 rev=0x04 hdr=0x00 vendor=0x8086 device=0x2021 subvendor=0x1590 subdevice=0x00ea
    vendor     = 'Intel Corporation'
    device     = 'Sky Lake-E CBDMA Registers'
    class      = base peripheral
    bar   [10] = type Memory, range 64, base 0xc3ffff18000, size 16384, enabled
    cap 11[80] = MSI-X supports 1 message, enabled
                 Table in map 0x10[0x2000], PBA in map 0x10[0x3000]
    cap 10[90] = PCI-Express 2 root endpoint max data 128(128) NS
                 max read 128
    cap 01[e0] = powerspec 3  supports D0 D3  current D0

ioat2@pci0:0:4:2:	class=0x088000 rev=0x04 hdr=0x00 vendor=0x8086 device=0x2021 subvendor=0x1590 subdevice=0x00ea
    vendor     = 'Intel Corporation'
    device     = 'Sky Lake-E CBDMA Registers'
    class      = base peripheral
    bar   [10] = type Memory, range 64, base 0xc3ffff14000, size 16384, enabled
    cap 11[80] = MSI-X supports 1 message, enabled
                 Table in map 0x10[0x2000], PBA in map 0x10[0x3000]
    cap 10[90] = PCI-Express 2 root endpoint max data 128(128) NS
                 max read 128
    cap 01[e0] = powerspec 3  supports D0 D3  current D0

ioat3@pci0:0:4:3:	class=0x088000 rev=0x04 hdr=0x00 vendor=0x8086 device=0x2021 subvendor=0x1590 subdevice=0x00ea
    vendor     = 'Intel Corporation'
    device     = 'Sky Lake-E CBDMA Registers'
    class      = base peripheral
    bar   [10] = type Memory, range 64, base 0xc3ffff10000, size 16384, enabled
    cap 11[80] = MSI-X supports 1 message, enabled
                 Table in map 0x10[0x2000], PBA in map 0x10[0x3000]
    cap 10[90] = PCI-Express 2 root endpoint max data 128(128) NS
                 max read 128
    cap 01[e0] = powerspec 3  supports D0 D3  current D0

ioat4@pci0:0:4:4:	class=0x088000 rev=0x04 hdr=0x00 vendor=0x8086 device=0x2021 subvendor=0x1590 subdevice=0x00ea
    vendor     = 'Intel Corporation'
    device     = 'Sky Lake-E CBDMA Registers'
    class      = base peripheral
    bar   [10] = type Memory, range 64, base 0xc3ffff0c000, size 16384, enabled
    cap 11[80] = MSI-X supports 1 message, enabled
                 Table in map 0x10[0x2000], PBA in map 0x10[0x3000]
    cap 10[90] = PCI-Express 2 root endpoint max data 128(128) NS
                 max read 128
    cap 01[e0] = powerspec 3  supports D0 D3  current D0

ioat5@pci0:0:4:5:	class=0x088000 rev=0x04 hdr=0x00 vendor=0x8086 device=0x2021 subvendor=0x1590 subdevice=0x00ea
    vendor     = 'Intel Corporation'
    device     = 'Sky Lake-E CBDMA Registers'
    class      = base peripheral
    bar   [10] = type Memory, range 64, base 0xc3ffff08000, size 16384, enabled
    cap 11[80] = MSI-X supports 1 message, enabled
                 Table in map 0x10[0x2000], PBA in map 0x10[0x3000]
    cap 10[90] = PCI-Express 2 root endpoint max data 128(128) NS
                 max read 128
    cap 01[e0] = powerspec 3  supports D0 D3  current D0

ioat6@pci0:0:4:6:	class=0x088000 rev=0x04 hdr=0x00 vendor=0x8086 device=0x2021 subvendor=0x1590 subdevice=0x00ea
    vendor     = 'Intel Corporation'
    device     = 'Sky Lake-E CBDMA Registers'
    class      = base peripheral
    bar   [10] = type Memory, range 64, base 0xc3ffff04000, size 16384, enabled
    cap 11[80] = MSI-X supports 1 message, enabled
                 Table in map 0x10[0x2000], PBA in map 0x10[0x3000]
    cap 10[90] = PCI-Express 2 root endpoint max data 128(128) NS
                 max read 128
    cap 01[e0] = powerspec 3  supports D0 D3  current D0

ioat7@pci0:0:4:7:	class=0x088000 rev=0x04 hdr=0x00 vendor=0x8086 device=0x2021 subvendor=0x1590 subdevice=0x00ea
    vendor     = 'Intel Corporation'
    device     = 'Sky Lake-E CBDMA Registers'
    class      = base peripheral
    bar   [10] = type Memory, range 64, base 0xc3ffff00000, size 16384, enabled
    cap 11[80] = MSI-X supports 1 message, enabled
                 Table in map 0x10[0x2000], PBA in map 0x10[0x3000]
    cap 10[90] = PCI-Express 2 root endpoint max data 128(128) NS
                 max read 128
    cap 01[e0] = powerspec 3  supports D0 D3  current D0

none0@pci0:0:5:0:	class=0x088000 rev=0x04 hdr=0x00 vendor=0x8086 device=0x2024 subvendor=0x1590 subdevice=0x00ea
    vendor     = 'Intel Corporation'
    device     = 'Sky Lake-E MM/Vt-d Configuration Registers'
    class      = base peripheral
    cap 10[40] = PCI-Express 2 root endpoint max data 128(128)
                 max read 128

none1@pci0:0:5:2:	class=0x088000 rev=0x04 hdr=0x00 vendor=0x8086 device=0x2025 subvendor=0x1590 subdevice=0x00ea
    vendor     = 'Intel Corporation'
    device     = 'Sky Lake-E RAS'
    class      = base peripheral
    cap 10[40] = PCI-Express 2 root endpoint max data 128(128)
                 max read 128

ioapic0@pci0:0:5:4:	class=0x080020 rev=0x04 hdr=0x00 vendor=0x8086 device=0x2026 subvendor=0x1590 subdevice=0x18a9
    vendor     = 'Intel Corporation'
    device     = 'Sky Lake-E IOAPIC'
    class      = base peripheral
    subclass   = interrupt controller
    bar   [10] = type Memory, range 32, base 0xd9e1a000, size 4096, enabled
    cap 10[44] = PCI-Express 1 root endpoint max data 128(128)
                 max read 128
    cap 01[e0] = powerspec 3  supports D0 D3  current D0

none2@pci0:0:8:0:	class=0x088000 rev=0x04 hdr=0x00 vendor=0x8086 device=0x2014 subvendor=0x1590 subdevice=0x00ea
    vendor     = 'Intel Corporation'
    device     = 'Sky Lake-E Ubox Registers'
    class      = base peripheral
    cap 10[40] = PCI-Express 2 root endpoint max data 128(128)
                 max read 128

none3@pci0:0:8:1:	class=0x110100 rev=0x04 hdr=0x00 vendor=0x8086 device=0x2015 subvendor=0x1590 subdevice=0x00ea
    vendor     = 'Intel Corporation'
    device     = 'Sky Lake-E Ubox Registers'
    class      = dasp
    subclass   = performance counters

none4@pci0:0:8:2:	class=0x088000 rev=0x04 hdr=0x00 vendor=0x8086 device=0x2016 subvendor=0x1590 subdevice=0x00ea
    vendor     = 'Intel Corporation'
    device     = 'Sky Lake-E Ubox Registers'
    class      = base peripheral
    cap 10[40] = PCI-Express 2 root endpoint max data 128(128)
                 max read 128

none5@pci0:0:17:0:	class=0xff0000 rev=0x09 hdr=0x00 vendor=0x8086 device=0xa1ec subvendor=0x1590 subdevice=0x00eb
    vendor     = 'Intel Corporation'
    device     = 'C620 Series Chipset Family MROM 0'
    cap 01[80] = powerspec 3  supports D0 D3  current D0

none6@pci0:0:17:1:	class=0xff0000 rev=0x09 hdr=0x00 vendor=0x8086 device=0xa1ed subvendor=0x1590 subdevice=0x00eb
    vendor     = 'Intel Corporation'
    device     = 'C620 Series Chipset Family MROM 1'
    cap 01[80] = powerspec 3  supports D0 D3  current D0

ahci0@pci0:0:17:5:	class=0x010400 rev=0x09 hdr=0x00 vendor=0x8086 device=0xa1d6 subvendor=0x1590 subdevice=0x00e6
    vendor     = 'Intel Corporation'
    device     = 'C620 Series Chipset Family SSATA Controller [RAID mode]'
    class      = mass storage
    subclass   = RAID
    bar   [10] = type Memory, range 32, base 0xd9e16000, size 8192, enabled
    bar   [14] = type Memory, range 32, base 0xd9e19000, size 256, enabled
    bar   [18] = type I/O Port, range 32, base 0x2068, size 8, enabled
    bar   [1c] = type I/O Port, range 32, base 0x2074, size 4, enabled
    bar   [20] = type I/O Port, range 32, base 0x2040, size 32, enabled
    bar   [24] = type Memory, range 32, base 0xd9d80000, size 524288, enabled
    cap 05[80] = MSI supports 1 message enabled with 1 message
    cap 01[70] = powerspec 3  supports D0 D3  current D0
    cap 12[a8] = SATA Index-Data Pair

xhci0@pci0:0:20:0:	class=0x0c0330 rev=0x09 hdr=0x00 vendor=0x8086 device=0xa1af subvendor=0x1590 subdevice=0x00eb
    vendor     = 'Intel Corporation'
    device     = 'C620 Series Chipset Family USB 3.0 xHCI Controller'
    class      = serial bus
    subclass   = USB
    bar   [10] = type Memory, range 64, base 0xd9e00000, size 65536, enabled
    cap 01[70] = powerspec 2  supports D0 D3  current D0
    cap 05[80] = MSI supports 8 messages, 64 bit enabled with 1 message

pchtherm0@pci0:0:20:2:	class=0x118000 rev=0x09 hdr=0x00 vendor=0x8086 device=0xa1b1 subvendor=0x1590 subdevice=0x00eb
    vendor     = 'Intel Corporation'
    device     = 'C620 Series Chipset Family Thermal Subsystem'
    class      = dasp
    bar   [10] = type Memory, range 64, base 0xc3ffff23000, size 4096, enabled
    cap 01[50] = powerspec 3  supports D0 D3  current D0
    cap 05[80] = MSI supports 1 message 

none7@pci0:0:22:0:	class=0x078000 rev=0x09 hdr=0x00 vendor=0x8086 device=0xa1ba subvendor=0x1590 subdevice=0x00eb
    vendor     = 'Intel Corporation'
    device     = 'C620 Series Chipset Family MEI Controller'
    class      = simple comms
    bar   [10] = type Memory, range 64, base 0xc3ffff22000, size 4096, enabled
    cap 01[50] = powerspec 3  supports D0 D3  current D0
    cap 05[8c] = MSI supports 1 message, 64 bit 

none8@pci0:0:22:4:	class=0x078000 rev=0x09 hdr=0x00 vendor=0x8086 device=0xa1be subvendor=0x1590 subdevice=0x00eb
    vendor     = 'Intel Corporation'
    device     = 'C620 Series Chipset Family MEI Controller'
    class      = simple comms
    bar   [10] = type Memory, range 64, base 0xc3ffff21000, size 4096, enabled
    cap 01[50] = powerspec 3  supports D0 D3  current D0
    cap 05[8c] = MSI supports 1 message, 64 bit 

ahci1@pci0:0:23:0:	class=0x010400 rev=0x09 hdr=0x00 vendor=0x8086 device=0xa186 subvendor=0x1590 subdevice=0x00e5
    vendor     = 'Intel Corporation'
    device     = 'C620 Series Chipset Family SATA Controller [RAID mode]'
    class      = mass storage
    subclass   = RAID
    bar   [10] = type Memory, range 32, base 0xd9e14000, size 8192, enabled
    bar   [14] = type Memory, range 32, base 0xd9e18000, size 256, enabled
    bar   [18] = type I/O Port, range 32, base 0x2060, size 8, enabled
    bar   [1c] = type I/O Port, range 32, base 0x2070, size 4, enabled
    bar   [20] = type I/O Port, range 32, base 0x2020, size 32, enabled
    bar   [24] = type Memory, range 32, base 0xd9d00000, size 524288, enabled
    cap 05[80] = MSI supports 1 message enabled with 1 message
    cap 01[70] = powerspec 3  supports D0 D3  current D0
    cap 12[a8] = SATA Index-Data Pair

pcib1@pci0:0:28:0:	class=0x060400 rev=0xf9 hdr=0x01 vendor=0x8086 device=0xa190 subvendor=0x1590 subdevice=0x00eb
    vendor     = 'Intel Corporation'
    device     = 'C620 Series Chipset Family PCI Express Root Port'
    class      = bridge
    subclass   = PCI-PCI
    cap 10[40] = PCI-Express 2 root port max data 128(256) ARI disabled
                 max read 128
                 link x0(x4) speed 0.0(8.0) ASPM disabled(L0s/L1)
                 slot 0 power limit 0 mW HotPlug(empty) surprise
    cap 05[80] = MSI supports 1 message enabled with 1 message
    cap 0d[90] = PCI Bridge subvendor=0x1590 subdevice=0x00eb
    cap 01[a0] = powerspec 3  supports D0 D3  current D0

pcib2@pci0:0:28:4:	class=0x060400 rev=0xf9 hdr=0x01 vendor=0x8086 device=0xa194 subvendor=0x1590 subdevice=0x00eb
    vendor     = 'Intel Corporation'
    device     = 'C620 Series Chipset Family PCI Express Root Port'
    class      = bridge
    subclass   = PCI-PCI
    cap 10[40] = PCI-Express 2 root port max data 128(128) ARI disabled
                 max read 128
                 link x1(x1) speed 5.0(8.0)
    cap 05[80] = MSI supports 1 message 
    cap 0d[90] = PCI Bridge subvendor=0x1590 subdevice=0x00eb
    cap 01[a0] = powerspec 3  supports D0 D3  current D0
    ecap 0001[100] = AER 1 0 fatal 0 non-fatal 0 corrected
    ecap 000d[140] = ACS 1
    ecap 0019[220] = PCIe Sec 1 lane errors 0

isab0@pci0:0:31:0:	class=0x060100 rev=0x09 hdr=0x00 vendor=0x8086 device=0xa1c1 subvendor=0x1590 subdevice=0x00eb
    vendor     = 'Intel Corporation'
    device     = 'C621 Series Chipset LPC/eSPI Controller'
    class      = bridge
    subclass   = PCI-ISA

none9@pci0:0:31:2:	class=0x058000 rev=0x09 hdr=0x00 vendor=0x8086 device=0xa1a1 subvendor=0x1590 subdevice=0x00eb
    vendor     = 'Intel Corporation'
    device     = 'C620 Series Chipset Family Power Management Controller'
    class      = memory
    bar   [10] = type Memory, range 32, base 0xd9e10000, size 16384, enabled

none10@pci0:1:0:0:	class=0x088000 rev=0x07 hdr=0x00 vendor=0x103c device=0x3306 subvendor=0x1590 subdevice=0x00e4
    vendor     = 'Hewlett-Packard Company'
    device     = 'Integrated Lights-Out Standard Slave Instrumentation & System Support'
    class      = base peripheral
    bar   [10] = type I/O Port, range 32, base 0x1200, size 256, enabled
    bar   [14] = type Memory, range 32, base 0xd9ba6000, size 1024, enabled
    bar   [18] = type I/O Port, range 32, base 0x1100, size 256, enabled
    bar   [1c] = type Memory, range 32, base 0xd4000000, size 67108864, enabled
    bar   [20] = type Memory, range 32, base 0xd9800000, size 2097152, enabled
    cap 01[78] = powerspec 3  supports D0 D3  current D0
    cap 05[b0] = MSI supports 1 message, 64 bit 
    cap 10[c0] = PCI-Express 2 legacy endpoint max data 128(128)
                 max read 128
                 link x1(x1) speed 5.0(5.0) ASPM disabled(L0s)
    ecap 0001[100] = AER 2 0 fatal 0 non-fatal 1 corrected

vgapci0@pci0:1:0:1:	class=0x030000 rev=0x02 hdr=0x00 vendor=0x102b device=0x0538 subvendor=0x1590 subdevice=0x00e4
    vendor     = 'Matrox Electronics Systems Ltd.'
    device     = 'MGA G200eH3'
    class      = display
    subclass   = VGA
    bar   [10] = type Prefetchable Memory, range 32, base 0xd8000000, size 16777216, enabled
    bar   [14] = type Memory, range 32, base 0xd9ba0000, size 16384, enabled
    bar   [18] = type Memory, range 32, base 0xd9000000, size 8388608, enabled
    cap 01[a8] = powerspec 3  supports D0 D3  current D0
    cap 05[b0] = MSI supports 1 message, 64 bit 
    cap 10[c0] = PCI-Express 2 legacy endpoint max data 128(128)
                 max read 128
                 link x1(x1) speed 5.0(5.0) ASPM disabled(L0s)
    ecap 0001[100] = AER 2 0 fatal 0 non-fatal 1 corrected

none11@pci0:1:0:2:	class=0x088000 rev=0x07 hdr=0x00 vendor=0x103c device=0x3307 subvendor=0x1590 subdevice=0x00e4
    vendor     = 'Hewlett-Packard Company'
    device     = 'Integrated Lights-Out Standard Management Processor Support and Messaging'
    class      = base peripheral
    bar   [10] = type I/O Port, range 32, base 0x1000, size 256, enabled
    bar   [14] = type Memory, range 32, base 0xd9ba5000, size 256, enabled
    bar   [18] = type Memory, range 32, base 0xd9a00000, size 1048576, enabled
    bar   [1c] = type Memory, range 32, base 0xd9b00000, size 524288, enabled
    bar   [20] = type Memory, range 32, base 0xd9b90000, size 32768, enabled
    bar   [24] = type Memory, range 32, base 0xd9b80000, size 65536, enabled
    cap 01[78] = powerspec 3  supports D0 D3  current D0
    cap 05[b0] = MSI supports 1 message, 64 bit 
    cap 10[c0] = PCI-Express 2 legacy endpoint max data 128(128)
                 max read 128
                 link x1(x1) speed 5.0(5.0) ASPM disabled(L0s)
    ecap 0001[100] = AER 2 0 fatal 0 non-fatal 1 corrected

ehci0@pci0:1:0:4:	class=0x0c0320 rev=0x00 hdr=0x00 vendor=0x103c device=0x22f6 subvendor=0x1590 subdevice=0x00e4
    vendor     = 'Hewlett-Packard Company'
    device     = 'iLO5 Virtual USB Controller'
    class      = serial bus
    subclass   = USB
    bar   [10] = type Memory, range 32, base 0xd9ba4000, size 256, enabled
    cap 05[70] = MSI supports 1 message, 64 bit 
    cap 10[80] = PCI-Express 2 legacy endpoint max data 128(128)
                 max read 128
                 link x1(x1) speed 5.0(5.0) ASPM disabled(L0s)
    cap 01[f0] = powerspec 3  supports D0 D3  current D0
    ecap 0001[100] = AER 2 0 fatal 0 non-fatal 1 corrected

none12@pci0:1:0:7:	class=0x010400 rev=0x01 hdr=0x00 vendor=0x103c device=0x193f subvendor=0x1590 subdevice=0x00e4
    vendor     = 'Hewlett-Packard Company'
    class      = mass storage
    subclass   = RAID
    bar   [10] = type Memory, range 32, base 0xd9b9c000, size 16384, enabled
    bar   [18] = type Memory, range 32, base 0xd9b98000, size 16384, enabled
    cap 11[70] = MSI-X supports 4 messages
                 Table in map 0x10[0x2000], PBA in map 0x10[0x3000]
    cap 10[80] = PCI-Express 2 legacy endpoint max data 128(128)
                 max read 128
                 link x1(x1) speed 5.0(5.0) ASPM disabled(L0s)
    cap 01[f0] = powerspec 3  supports D0 D3  current D0
    ecap 0001[100] = AER 2 0 fatal 0 non-fatal 1 corrected

pcib4@pci0:16:0:0:	class=0x060400 rev=0x04 hdr=0x01 vendor=0x8086 device=0x2030 subvendor=0x1590 subdevice=0x00ea
    vendor     = 'Intel Corporation'
    device     = 'Sky Lake-E PCI Express Root Port A'
    class      = bridge
    subclass   = PCI-PCI
    cap 0d[40] = PCI Bridge subvendor=0x1590 subdevice=0x00ea
    cap 05[60] = MSI supports 2 messages, vector masks 
    cap 10[90] = PCI-Express 2 root port max data 256(256) ARI disabled
                 max read 128
                 link x8(x8) speed 8.0(8.0) ASPM disabled(L1)
                 slot 3 power limit 25000 mW
    cap 01[e0] = powerspec 3  supports D0 D3  current D0
    ecap 000b[100] = Vendor [1] ID 0002 Rev 0 Length 12
    ecap 000d[110] = ACS 1
    ecap 0001[148] = AER 1 0 fatal 0 non-fatal 0 corrected
    ecap 000b[1d0] = Vendor [1] ID 0003 Rev 1 Length 10
    ecap 0019[250] = PCIe Sec 1 lane errors 0
    ecap 000b[280] = Vendor [1] ID 0005 Rev 3 Length 24
    ecap 000b[300] = Vendor [1] ID 0008 Rev 0 Length 56

pcib5@pci0:16:2:0:	class=0x060400 rev=0x04 hdr=0x01 vendor=0x8086 device=0x2032 subvendor=0x1590 subdevice=0x00ea
    vendor     = 'Intel Corporation'
    device     = 'Sky Lake-E PCI Express Root Port C'
    class      = bridge
    subclass   = PCI-PCI
    cap 0d[40] = PCI Bridge subvendor=0x1590 subdevice=0x00ea
    cap 05[60] = MSI supports 2 messages, vector masks 
    cap 10[90] = PCI-Express 2 root port max data 256(256) ARI disabled
                 max read 128
                 link x0(x4) speed 0.0(8.0) ASPM disabled(L1)
                 slot 2 power limit 0 mW
    cap 01[e0] = powerspec 3  supports D0 D3  current D0
    ecap 000b[100] = Vendor [1] ID 0002 Rev 0 Length 12
    ecap 000d[110] = ACS 1
    ecap 0001[148] = AER 1 0 fatal 0 non-fatal 0 corrected
    ecap 000b[1d0] = Vendor [1] ID 0003 Rev 1 Length 10
    ecap 0019[250] = PCIe Sec 1 lane errors 0
    ecap 000b[280] = Vendor [1] ID 0005 Rev 3 Length 24
    ecap 000b[300] = Vendor [1] ID 0008 Rev 0 Length 56

pcib6@pci0:16:3:0:	class=0x060400 rev=0x04 hdr=0x01 vendor=0x8086 device=0x2033 subvendor=0x1590 subdevice=0x00ea
    vendor     = 'Intel Corporation'
    device     = 'Sky Lake-E PCI Express Root Port D'
    class      = bridge
    subclass   = PCI-PCI
    cap 0d[40] = PCI Bridge subvendor=0x1590 subdevice=0x00ea
    cap 05[60] = MSI supports 2 messages, vector masks 
    cap 10[90] = PCI-Express 2 root port max data 256(256) ARI disabled
                 max read 128
                 link x1(x4) speed 5.0(8.0) ASPM disabled(L1)
    cap 01[e0] = powerspec 3  supports D0 D3  current D0
    ecap 000b[100] = Vendor [1] ID 0002 Rev 0 Length 12
    ecap 000d[110] = ACS 1
    ecap 0001[148] = AER 1 0 fatal 0 non-fatal 0 corrected
    ecap 000b[1d0] = Vendor [1] ID 0003 Rev 1 Length 10
    ecap 0019[250] = PCIe Sec 1 lane errors 0
    ecap 000b[280] = Vendor [1] ID 0005 Rev 3 Length 24
    ecap 000b[300] = Vendor [1] ID 0008 Rev 0 Length 56

none13@pci0:16:5:0:	class=0x088000 rev=0x04 hdr=0x00 vendor=0x8086 device=0x2034 subvendor=0x1590 subdevice=0x00ea
    vendor     = 'Intel Corporation'
    device     = 'Sky Lake-E VT-d'
    class      = base peripheral
    cap 10[40] = PCI-Express 2 root endpoint max data 128(128)
                 max read 128

none14@pci0:16:5:2:	class=0x088000 rev=0x04 hdr=0x00 vendor=0x8086 device=0x2035 subvendor=0x1590 subdevice=0x00ea
    vendor     = 'Intel Corporation'
    device     = 'Sky Lake-E RAS Configuration Registers'
    class      = base peripheral
    cap 10[40] = PCI-Express 2 root endpoint max data 128(128)
                 max read 128

ioapic1@pci0:16:5:4:	class=0x080020 rev=0x04 hdr=0x00 vendor=0x8086 device=0x2036 subvendor=0x1590 subdevice=0x18a9
    vendor     = 'Intel Corporation'
    device     = 'Sky Lake-E IOxAPIC Configuration Registers'
    class      = base peripheral
    subclass   = interrupt controller
    bar   [10] = type Memory, range 32, base 0xe2a00000, size 4096, enabled
    cap 10[44] = PCI-Express 1 root endpoint max data 128(128)
                 max read 128
    cap 01[e0] = powerspec 3  supports D0 D3  current D0

none15@pci0:16:8:0:	class=0x088000 rev=0x04 hdr=0x00 vendor=0x8086 device=0x208d subvendor=0x1590 subdevice=0x00ea
    vendor     = 'Intel Corporation'
    device     = 'Sky Lake-E CHA Registers'
    class      = base peripheral

none16@pci0:16:8:1:	class=0x088000 rev=0x04 hdr=0x00 vendor=0x8086 device=0x208d subvendor=0x1590 subdevice=0x00ea
    vendor     = 'Intel Corporation'
    device     = 'Sky Lake-E CHA Registers'
    class      = base peripheral

none17@pci0:16:8:2:	class=0x088000 rev=0x04 hdr=0x00 vendor=0x8086 device=0x208d subvendor=0x1590 subdevice=0x00ea
    vendor     = 'Intel Corporation'
    device     = 'Sky Lake-E CHA Registers'
    class      = base peripheral

none18@pci0:16:8:3:	class=0x088000 rev=0x04 hdr=0x00 vendor=0x8086 device=0x208d subvendor=0x1590 subdevice=0x00ea
    vendor     = 'Intel Corporation'
    device     = 'Sky Lake-E CHA Registers'
    class      = base peripheral

none19@pci0:16:8:4:	class=0x088000 rev=0x04 hdr=0x00 vendor=0x8086 device=0x208d subvendor=0x1590 subdevice=0x00ea
    vendor     = 'Intel Corporation'
    device     = 'Sky Lake-E CHA Registers'
    class      = base peripheral

none20@pci0:16:8:5:	class=0x088000 rev=0x04 hdr=0x00 vendor=0x8086 device=0x208d subvendor=0x1590 subdevice=0x00ea
    vendor     = 'Intel Corporation'
    device     = 'Sky Lake-E CHA Registers'
    class      = base peripheral

none21@pci0:16:8:6:	class=0x088000 rev=0x04 hdr=0x00 vendor=0x8086 device=0x208d subvendor=0x1590 subdevice=0x00ea
    vendor     = 'Intel Corporation'
    device     = 'Sky Lake-E CHA Registers'
    class      = base peripheral

none22@pci0:16:8:7:	class=0x088000 rev=0x04 hdr=0x00 vendor=0x8086 device=0x208d subvendor=0x1590 subdevice=0x00ea
    vendor     = 'Intel Corporation'
    device     = 'Sky Lake-E CHA Registers'
    class      = base peripheral

none23@pci0:16:9:0:	class=0x088000 rev=0x04 hdr=0x00 vendor=0x8086 device=0x208d subvendor=0x1590 subdevice=0x00ea
    vendor     = 'Intel Corporation'
    device     = 'Sky Lake-E CHA Registers'
    class      = base peripheral

none24@pci0:16:9:1:	class=0x088000 rev=0x04 hdr=0x00 vendor=0x8086 device=0x208d subvendor=0x1590 subdevice=0x00ea
    vendor     = 'Intel Corporation'
    device     = 'Sky Lake-E CHA Registers'
    class      = base peripheral

none25@pci0:16:14:0:	class=0x088000 rev=0x04 hdr=0x00 vendor=0x8086 device=0x208e subvendor=0x1590 subdevice=0x00ea
    vendor     = 'Intel Corporation'
    device     = 'Sky Lake-E CHA Registers'
    class      = base peripheral

none26@pci0:16:14:1:	class=0x088000 rev=0x04 hdr=0x00 vendor=0x8086 device=0x208e subvendor=0x1590 subdevice=0x00ea
    vendor     = 'Intel Corporation'
    device     = 'Sky Lake-E CHA Registers'
    class      = base peripheral

none27@pci0:16:14:2:	class=0x088000 rev=0x04 hdr=0x00 vendor=0x8086 device=0x208e subvendor=0x1590 subdevice=0x00ea
    vendor     = 'Intel Corporation'
    device     = 'Sky Lake-E CHA Registers'
    class      = base peripheral

none28@pci0:16:14:3:	class=0x088000 rev=0x04 hdr=0x00 vendor=0x8086 device=0x208e subvendor=0x1590 subdevice=0x00ea
    vendor     = 'Intel Corporation'
    device     = 'Sky Lake-E CHA Registers'
    class      = base peripheral

none29@pci0:16:14:4:	class=0x088000 rev=0x04 hdr=0x00 vendor=0x8086 device=0x208e subvendor=0x1590 subdevice=0x00ea
    vendor     = 'Intel Corporation'
    device     = 'Sky Lake-E CHA Registers'
    class      = base peripheral

none30@pci0:16:14:5:	class=0x088000 rev=0x04 hdr=0x00 vendor=0x8086 device=0x208e subvendor=0x1590 subdevice=0x00ea
    vendor     = 'Intel Corporation'
    device     = 'Sky Lake-E CHA Registers'
    class      = base peripheral

none31@pci0:16:14:6:	class=0x088000 rev=0x04 hdr=0x00 vendor=0x8086 device=0x208e subvendor=0x1590 subdevice=0x00ea
    vendor     = 'Intel Corporation'
    device     = 'Sky Lake-E CHA Registers'
    class      = base peripheral

none32@pci0:16:14:7:	class=0x088000 rev=0x04 hdr=0x00 vendor=0x8086 device=0x208e subvendor=0x1590 subdevice=0x00ea
    vendor     = 'Intel Corporation'
    device     = 'Sky Lake-E CHA Registers'
    class      = base peripheral

none33@pci0:16:15:0:	class=0x088000 rev=0x04 hdr=0x00 vendor=0x8086 device=0x208e subvendor=0x1590 subdevice=0x00ea
    vendor     = 'Intel Corporation'
    device     = 'Sky Lake-E CHA Registers'
    class      = base peripheral

none34@pci0:16:15:1:	class=0x088000 rev=0x04 hdr=0x00 vendor=0x8086 device=0x208e subvendor=0x1590 subdevice=0x00ea
    vendor     = 'Intel Corporation'
    device     = 'Sky Lake-E CHA Registers'
    class      = base peripheral

none35@pci0:16:29:0:	class=0x088000 rev=0x04 hdr=0x00 vendor=0x8086 device=0x2054 subvendor=0x1590 subdevice=0x00ea
    vendor     = 'Intel Corporation'
    device     = 'Sky Lake-E CHA Registers'
    class      = base peripheral

none36@pci0:16:29:1:	class=0x088000 rev=0x04 hdr=0x00 vendor=0x8086 device=0x2055 subvendor=0x1590 subdevice=0x00ea
    vendor     = 'Intel Corporation'
    device     = 'Sky Lake-E CHA Registers'
    class      = base peripheral

none37@pci0:16:29:2:	class=0x088000 rev=0x04 hdr=0x00 vendor=0x8086 device=0x2056 subvendor=0x1590 subdevice=0x00ea
    vendor     = 'Intel Corporation'
    device     = 'Sky Lake-E CHA Registers'
    class      = base peripheral

none38@pci0:16:29:3:	class=0x088000 rev=0x04 hdr=0x00 vendor=0x8086 device=0x2057 subvendor=0x1590 subdevice=0x00ea
    vendor     = 'Intel Corporation'
    device     = 'Sky Lake-E CHA Registers'
    class      = base peripheral

none39@pci0:16:30:0:	class=0x088000 rev=0x04 hdr=0x00 vendor=0x8086 device=0x2080 subvendor=0x1590 subdevice=0x00ea
    vendor     = 'Intel Corporation'
    device     = 'Sky Lake-E PCU Registers'
    class      = base peripheral

none40@pci0:16:30:1:	class=0x088000 rev=0x04 hdr=0x00 vendor=0x8086 device=0x2081 subvendor=0x1590 subdevice=0x00ea
    vendor     = 'Intel Corporation'
    device     = 'Sky Lake-E PCU Registers'
    class      = base peripheral

none41@pci0:16:30:2:	class=0x088000 rev=0x04 hdr=0x00 vendor=0x8086 device=0x2082 subvendor=0x1590 subdevice=0x00ea
    vendor     = 'Intel Corporation'
    device     = 'Sky Lake-E PCU Registers'
    class      = base peripheral

none42@pci0:16:30:3:	class=0x088000 rev=0x04 hdr=0x00 vendor=0x8086 device=0x2083 subvendor=0x1590 subdevice=0x00ea
    vendor     = 'Intel Corporation'
    device     = 'Sky Lake-E PCU Registers'
    class      = base peripheral

none43@pci0:16:30:4:	class=0x088000 rev=0x04 hdr=0x00 vendor=0x8086 device=0x2084 subvendor=0x1590 subdevice=0x00ea
    vendor     = 'Intel Corporation'
    device     = 'Sky Lake-E PCU Registers'
    class      = base peripheral

none44@pci0:16:30:5:	class=0x088000 rev=0x04 hdr=0x00 vendor=0x8086 device=0x2085 subvendor=0x1590 subdevice=0x00ea
    vendor     = 'Intel Corporation'
    device     = 'Sky Lake-E PCU Registers'
    class      = base peripheral

none45@pci0:16:30:6:	class=0x088000 rev=0x04 hdr=0x00 vendor=0x8086 device=0x2086 subvendor=0x1590 subdevice=0x00ea
    vendor     = 'Intel Corporation'
    device     = 'Sky Lake-E PCU Registers'
    class      = base peripheral

smartpqi0@pci0:17:0:0:	class=0x010700 rev=0x01 hdr=0x00 vendor=0x9005 device=0x028f subvendor=0x103c subdevice=0x0600
    vendor     = 'Adaptec'
    device     = 'Smart Storage PQI SAS'
    class      = mass storage
    subclass   = SAS
    bar   [10] = type Memory, range 64, base 0xe2900000, size 32768, enabled
    bar   [20] = type I/O Port, range 32, base 0x4000, size 256, enabled
    cap 01[80] = powerspec 3  supports D0 D1 D3  current D0
    cap 11[b0] = MSI-X supports 64 messages, enabled
                 Table in map 0x10[0x2000], PBA in map 0x10[0x3000]
    cap 10[c0] = PCI-Express 2 endpoint max data 256(512) RO NS
                 max read 4096
                 link x8(x8) speed 8.0(8.0) ASPM disabled(L1)
    ecap 0001[100] = AER 2 0 fatal 0 non-fatal 1 corrected
    ecap 0019[300] = PCIe Sec 1 lane errors 0

bge0@pci0:19:0:0:	class=0x020000 rev=0x00 hdr=0x00 vendor=0x14e4 device=0x165f subvendor=0x103c subdevice=0x22e8
    vendor     = 'Broadcom Inc. and subsidiaries'
    device     = 'NetXtreme BCM5720 Gigabit Ethernet PCIe'
    class      = network
    subclass   = ethernet
    bar   [10] = type Prefetchable Memory, range 64, base 0xe2830000, size 65536, enabled
    bar   [18] = type Prefetchable Memory, range 64, base 0xe2840000, size 65536, enabled
    bar   [20] = type Prefetchable Memory, range 64, base 0xe2850000, size 65536, enabled
    cap 01[48] = powerspec 3  supports D0 D3  current D0
    cap 03[50] = VPD
    cap 05[58] = MSI supports 8 messages, 64 bit enabled with 1 message
    cap 11[a0] = MSI-X supports 17 messages
                 Table in map 0x20[0x0], PBA in map 0x20[0x1000]
    cap 10[ac] = PCI-Express 2 endpoint max data 256(256) FLR
                 max read 2048
                 link x1(x2) speed 5.0(5.0) ClockPM disabled
    ecap 0001[100] = AER 1 0 fatal 0 non-fatal 1 corrected
    ecap 0003[13c] = Serial 1 000008f1ea161a9c
    ecap 0004[150] = Power Budgeting 1
    ecap 0002[160] = VC 1 max VC0

bge1@pci0:19:0:1:	class=0x020000 rev=0x00 hdr=0x00 vendor=0x14e4 device=0x165f subvendor=0x103c subdevice=0x22e8
    vendor     = 'Broadcom Inc. and subsidiaries'
    device     = 'NetXtreme BCM5720 Gigabit Ethernet PCIe'
    class      = network
    subclass   = ethernet
    bar   [10] = type Prefetchable Memory, range 64, base 0xe2800000, size 65536, enabled
    bar   [18] = type Prefetchable Memory, range 64, base 0xe2810000, size 65536, enabled
    bar   [20] = type Prefetchable Memory, range 64, base 0xe2820000, size 65536, enabled
    cap 01[48] = powerspec 3  supports D0 D3  current D0
    cap 03[50] = VPD
    cap 05[58] = MSI supports 8 messages, 64 bit enabled with 1 message
    cap 11[a0] = MSI-X supports 17 messages
                 Table in map 0x20[0x0], PBA in map 0x20[0x1000]
    cap 10[ac] = PCI-Express 2 endpoint max data 256(256) FLR
                 max read 2048
                 link x1(x2) speed 5.0(5.0) ClockPM disabled
    ecap 0001[100] = AER 1 0 fatal 0 non-fatal 1 corrected
    ecap 0003[13c] = Serial 1 000008f1ea161a9d
    ecap 0004[150] = Power Budgeting 1
    ecap 0002[160] = VC 1 max VC0

pcib8@pci0:96:0:0:	class=0x060400 rev=0x04 hdr=0x01 vendor=0x8086 device=0x2030 subvendor=0x1590 subdevice=0x00ea
    vendor     = 'Intel Corporation'
    device     = 'Sky Lake-E PCI Express Root Port A'
    class      = bridge
    subclass   = PCI-PCI
    cap 0d[40] = PCI Bridge subvendor=0x1590 subdevice=0x00ea
    cap 05[60] = MSI supports 2 messages, vector masks 
    cap 10[90] = PCI-Express 2 root port max data 256(256) ARI enabled
                 max read 128
                 link x8(x16) speed 5.0(8.0) ASPM disabled(L1)
                 slot 4 power limit 75000 mW
    cap 01[e0] = powerspec 3  supports D0 D3  current D0
    ecap 000b[100] = Vendor [1] ID 0002 Rev 0 Length 12
    ecap 000d[110] = ACS 1
    ecap 0001[148] = AER 1 0 fatal 0 non-fatal 0 corrected
    ecap 000b[1d0] = Vendor [1] ID 0003 Rev 1 Length 10
    ecap 0019[250] = PCIe Sec 1 lane errors 0
    ecap 000b[280] = Vendor [1] ID 0005 Rev 3 Length 24
    ecap 000b[300] = Vendor [1] ID 0008 Rev 0 Length 56

none46@pci0:96:5:0:	class=0x088000 rev=0x04 hdr=0x00 vendor=0x8086 device=0x2034 subvendor=0x1590 subdevice=0x00ea
    vendor     = 'Intel Corporation'
    device     = 'Sky Lake-E VT-d'
    class      = base peripheral
    cap 10[40] = PCI-Express 2 root endpoint max data 128(128)
                 max read 128

none47@pci0:96:5:2:	class=0x088000 rev=0x04 hdr=0x00 vendor=0x8086 device=0x2035 subvendor=0x1590 subdevice=0x00ea
    vendor     = 'Intel Corporation'
    device     = 'Sky Lake-E RAS Configuration Registers'
    class      = base peripheral
    cap 10[40] = PCI-Express 2 root endpoint max data 128(128)
                 max read 128

ioapic2@pci0:96:5:4:	class=0x080020 rev=0x04 hdr=0x00 vendor=0x8086 device=0x2036 subvendor=0x1590 subdevice=0x18a9
    vendor     = 'Intel Corporation'
    device     = 'Sky Lake-E IOxAPIC Configuration Registers'
    class      = base peripheral
    subclass   = interrupt controller
    bar   [10] = type Memory, range 32, base 0xed100000, size 4096, enabled
    cap 10[44] = PCI-Express 1 root endpoint max data 128(128)
                 max read 128
    cap 01[e0] = powerspec 3  supports D0 D3  current D0

none48@pci0:96:8:0:	class=0x088000 rev=0x04 hdr=0x00 vendor=0x8086 device=0x2066 subvendor=0x1590 subdevice=0x00ea
    vendor     = 'Intel Corporation'
    device     = 'Sky Lake-E Integrated Memory Controller'
    class      = base peripheral
    cap 10[40] = PCI-Express 1 root endpoint max data 128(128)
                 max read 128

none49@pci0:96:9:0:	class=0x088000 rev=0x04 hdr=0x00 vendor=0x8086 device=0x2066 subvendor=0x1590 subdevice=0x00ea
    vendor     = 'Intel Corporation'
    device     = 'Sky Lake-E Integrated Memory Controller'
    class      = base peripheral
    cap 10[40] = PCI-Express 1 root endpoint max data 128(128)
                 max read 128

none50@pci0:96:10:0:	class=0x088000 rev=0x04 hdr=0x00 vendor=0x8086 device=0x2040 subvendor=0x1590 subdevice=0x00ea
    vendor     = 'Intel Corporation'
    device     = 'Sky Lake-E Integrated Memory Controller'
    class      = base peripheral
    cap 10[40] = PCI-Express 1 root endpoint max data 128(128)
                 max read 128

none51@pci0:96:10:1:	class=0x088000 rev=0x04 hdr=0x00 vendor=0x8086 device=0x2041 subvendor=0x1590 subdevice=0x00ea
    vendor     = 'Intel Corporation'
    device     = 'Sky Lake-E Integrated Memory Controller'
    class      = base peripheral
    cap 10[40] = PCI-Express 1 root endpoint max data 128(128)
                 max read 128

none52@pci0:96:10:2:	class=0x088000 rev=0x04 hdr=0x00 vendor=0x8086 device=0x2042 subvendor=0x1590 subdevice=0x00ea
    vendor     = 'Intel Corporation'
    device     = 'Sky Lake-E Integrated Memory Controller'
    class      = base peripheral
    cap 10[40] = PCI-Express 1 root endpoint max data 128(128)
                 max read 128

none53@pci0:96:10:3:	class=0x088000 rev=0x04 hdr=0x00 vendor=0x8086 device=0x2043 subvendor=0x1590 subdevice=0x00ea
    vendor     = 'Intel Corporation'
    device     = 'Sky Lake-E Integrated Memory Controller'
    class      = base peripheral
    cap 10[40] = PCI-Express 1 root endpoint max data 128(128)
                 max read 128

none54@pci0:96:10:4:	class=0x088000 rev=0x04 hdr=0x00 vendor=0x8086 device=0x2044 subvendor=0x1590 subdevice=0x00ea
    vendor     = 'Intel Corporation'
    device     = 'Sky Lake-E Integrated Memory Controller'
    class      = base peripheral
    cap 10[40] = PCI-Express 1 root endpoint max data 128(128)
                 max read 128

none55@pci0:96:10:5:	class=0x088000 rev=0x04 hdr=0x00 vendor=0x8086 device=0x2045 subvendor=0x1590 subdevice=0x00ea
    vendor     = 'Intel Corporation'
    device     = 'Sky Lake-E LM Channel 1'
    class      = base peripheral
    cap 10[40] = PCI-Express 1 root endpoint max data 128(128)
                 max read 128

none56@pci0:96:10:6:	class=0x088000 rev=0x04 hdr=0x00 vendor=0x8086 device=0x2046 subvendor=0x1590 subdevice=0x00ea
    vendor     = 'Intel Corporation'
    device     = 'Sky Lake-E LMS Channel 1'
    class      = base peripheral
    cap 10[40] = PCI-Express 1 root endpoint max data 128(128)
                 max read 128

none57@pci0:96:10:7:	class=0x088000 rev=0x04 hdr=0x00 vendor=0x8086 device=0x2047 subvendor=0x1590 subdevice=0x00ea
    vendor     = 'Intel Corporation'
    device     = 'Sky Lake-E LMDP Channel 1'
    class      = base peripheral
    cap 10[40] = PCI-Express 1 root endpoint max data 128(128)
                 max read 128

none58@pci0:96:11:0:	class=0x088000 rev=0x04 hdr=0x00 vendor=0x8086 device=0x2048 subvendor=0x1590 subdevice=0x00ea
    vendor     = 'Intel Corporation'
    device     = 'Sky Lake-E DECS Channel 2'
    class      = base peripheral
    cap 10[40] = PCI-Express 1 root endpoint max data 128(128)
                 max read 128

none59@pci0:96:11:1:	class=0x088000 rev=0x04 hdr=0x00 vendor=0x8086 device=0x2049 subvendor=0x1590 subdevice=0x00ea
    vendor     = 'Intel Corporation'
    device     = 'Sky Lake-E LM Channel 2'
    class      = base peripheral
    cap 10[40] = PCI-Express 1 root endpoint max data 128(128)
                 max read 128

none60@pci0:96:11:2:	class=0x088000 rev=0x04 hdr=0x00 vendor=0x8086 device=0x204a subvendor=0x1590 subdevice=0x00ea
    vendor     = 'Intel Corporation'
    device     = 'Sky Lake-E LMS Channel 2'
    class      = base peripheral
    cap 10[40] = PCI-Express 1 root endpoint max data 128(128)
                 max read 128

none61@pci0:96:11:3:	class=0x088000 rev=0x04 hdr=0x00 vendor=0x8086 device=0x204b subvendor=0x1590 subdevice=0x00ea
    vendor     = 'Intel Corporation'
    device     = 'Sky Lake-E LMDP Channel 2'
    class      = base peripheral
    cap 10[40] = PCI-Express 1 root endpoint max data 128(128)
                 max read 128

none62@pci0:96:12:0:	class=0x088000 rev=0x04 hdr=0x00 vendor=0x8086 device=0x2040 subvendor=0x1590 subdevice=0x00ea
    vendor     = 'Intel Corporation'
    device     = 'Sky Lake-E Integrated Memory Controller'
    class      = base peripheral
    cap 10[40] = PCI-Express 1 root endpoint max data 128(128)
                 max read 128

none63@pci0:96:12:1:	class=0x088000 rev=0x04 hdr=0x00 vendor=0x8086 device=0x2041 subvendor=0x1590 subdevice=0x00ea
    vendor     = 'Intel Corporation'
    device     = 'Sky Lake-E Integrated Memory Controller'
    class      = base peripheral
    cap 10[40] = PCI-Express 1 root endpoint max data 128(128)
                 max read 128

none64@pci0:96:12:2:	class=0x088000 rev=0x04 hdr=0x00 vendor=0x8086 device=0x2042 subvendor=0x1590 subdevice=0x00ea
    vendor     = 'Intel Corporation'
    device     = 'Sky Lake-E Integrated Memory Controller'
    class      = base peripheral
    cap 10[40] = PCI-Express 1 root endpoint max data 128(128)
                 max read 128

none65@pci0:96:12:3:	class=0x088000 rev=0x04 hdr=0x00 vendor=0x8086 device=0x2043 subvendor=0x1590 subdevice=0x00ea
    vendor     = 'Intel Corporation'
    device     = 'Sky Lake-E Integrated Memory Controller'
    class      = base peripheral
    cap 10[40] = PCI-Express 1 root endpoint max data 128(128)
                 max read 128

none66@pci0:96:12:4:	class=0x088000 rev=0x04 hdr=0x00 vendor=0x8086 device=0x2044 subvendor=0x1590 subdevice=0x00ea
    vendor     = 'Intel Corporation'
    device     = 'Sky Lake-E Integrated Memory Controller'
    class      = base peripheral
    cap 10[40] = PCI-Express 1 root endpoint max data 128(128)
                 max read 128

none67@pci0:96:12:5:	class=0x088000 rev=0x04 hdr=0x00 vendor=0x8086 device=0x2045 subvendor=0x1590 subdevice=0x00ea
    vendor     = 'Intel Corporation'
    device     = 'Sky Lake-E LM Channel 1'
    class      = base peripheral
    cap 10[40] = PCI-Express 1 root endpoint max data 128(128)
                 max read 128

none68@pci0:96:12:6:	class=0x088000 rev=0x04 hdr=0x00 vendor=0x8086 device=0x2046 subvendor=0x1590 subdevice=0x00ea
    vendor     = 'Intel Corporation'
    device     = 'Sky Lake-E LMS Channel 1'
    class      = base peripheral
    cap 10[40] = PCI-Express 1 root endpoint max data 128(128)
                 max read 128

none69@pci0:96:12:7:	class=0x088000 rev=0x04 hdr=0x00 vendor=0x8086 device=0x2047 subvendor=0x1590 subdevice=0x00ea
    vendor     = 'Intel Corporation'
    device     = 'Sky Lake-E LMDP Channel 1'
    class      = base peripheral
    cap 10[40] = PCI-Express 1 root endpoint max data 128(128)
                 max read 128

none70@pci0:96:13:0:	class=0x088000 rev=0x04 hdr=0x00 vendor=0x8086 device=0x2048 subvendor=0x1590 subdevice=0x00ea
    vendor     = 'Intel Corporation'
    device     = 'Sky Lake-E DECS Channel 2'
    class      = base peripheral
    cap 10[40] = PCI-Express 1 root endpoint max data 128(128)
                 max read 128

none71@pci0:96:13:1:	class=0x088000 rev=0x04 hdr=0x00 vendor=0x8086 device=0x2049 subvendor=0x1590 subdevice=0x00ea
    vendor     = 'Intel Corporation'
    device     = 'Sky Lake-E LM Channel 2'
    class      = base peripheral
    cap 10[40] = PCI-Express 1 root endpoint max data 128(128)
                 max read 128

none72@pci0:96:13:2:	class=0x088000 rev=0x04 hdr=0x00 vendor=0x8086 device=0x204a subvendor=0x1590 subdevice=0x00ea
    vendor     = 'Intel Corporation'
    device     = 'Sky Lake-E LMS Channel 2'
    class      = base peripheral
    cap 10[40] = PCI-Express 1 root endpoint max data 128(128)
                 max read 128

none73@pci0:96:13:3:	class=0x088000 rev=0x04 hdr=0x00 vendor=0x8086 device=0x204b subvendor=0x1590 subdevice=0x00ea
    vendor     = 'Intel Corporation'
    device     = 'Sky Lake-E LMDP Channel 2'
    class      = base peripheral
    cap 10[40] = PCI-Express 1 root endpoint max data 128(128)
                 max read 128

bxe0@pci0:97:0:0:	class=0x020000 rev=0x10 hdr=0x00 vendor=0x14e4 device=0x168e subvendor=0x103c subdevice=0x18d3
    vendor     = 'Broadcom Inc. and subsidiaries'
    device     = 'NetXtreme II BCM57810 10 Gigabit Ethernet'
    class      = network
    subclass   = ethernet
    bar   [10] = type Prefetchable Memory, range 64, base 0xeb800000, size 8388608, enabled
    bar   [18] = type Prefetchable Memory, range 64, base 0xeb000000, size 8388608, enabled
    bar   [20] = type Prefetchable Memory, range 64, base 0xed000000, size 65536, enabled
    cap 01[48] = powerspec 3  supports D0 D3  current D0
    cap 03[50] = VPD
    cap 11[a0] = MSI-X supports 32 messages, enabled
                 Table in map 0x20[0x0], PBA in map 0x20[0x1000]
    cap 10[ac] = PCI-Express 2 endpoint max data 256(512) FLR RO NS
                 max read 4096
                 link x8(x8) speed 5.0(5.0) ASPM disabled(L0s/L1) ClockPM disabled
    ecap 0001[100] = AER 1 0 fatal 0 non-fatal 1 corrected
    ecap 0003[13c] = Serial 1 20677cfffe010ee0
    ecap 0004[150] = Power Budgeting 1
    ecap 0002[160] = VC 1 max VC0
    ecap 000e[1b8] = ARI 1
    ecap 0010[1c0] = SR-IOV 1 IOV disabled, Memory Space disabled, ARI enabled
                     0 VFs configured out of 16 supported
                     First VF RID Offset 0x0008, VF RID Stride 0x0001
                     VF Device ID 0x16af
                     Page Sizes: 4096 (enabled), 8192, 16384, 32768, 65536, 131072, 262144, 524288, 1048576, 4194304
    ecap 0015[220] = Resizable BAR 1
    ecap 0019[300] = PCIe Sec 1 lane errors 0

bxe1@pci0:97:0:1:	class=0x020000 rev=0x10 hdr=0x00 vendor=0x14e4 device=0x168e subvendor=0x103c subdevice=0x18d3
    vendor     = 'Broadcom Inc. and subsidiaries'
    device     = 'NetXtreme II BCM57810 10 Gigabit Ethernet'
    class      = network
    subclass   = ethernet
    bar   [10] = type Prefetchable Memory, range 64, base 0xec800000, size 8388608, enabled
    bar   [18] = type Prefetchable Memory, range 64, base 0xec000000, size 8388608, enabled
    bar   [20] = type Prefetchable Memory, range 64, base 0xed010000, size 65536, enabled
    cap 01[48] = powerspec 3  supports D0 D3  current D0
    cap 03[50] = VPD
    cap 11[a0] = MSI-X supports 32 messages, enabled
                 Table in map 0x20[0x0], PBA in map 0x20[0x1000]
    cap 10[ac] = PCI-Express 2 endpoint max data 256(512) FLR RO NS
                 max read 4096
                 link x8(x8) speed 5.0(5.0) ASPM disabled(L0s/L1) ClockPM disabled
    ecap 0001[100] = AER 1 0 fatal 0 non-fatal 1 corrected
    ecap 0003[13c] = Serial 1 20677cfffe010ee0
    ecap 0004[150] = Power Budgeting 1
    ecap 0002[160] = VC 1 max VC0
    ecap 000e[1b8] = ARI 1
    ecap 0010[1c0] = SR-IOV 1 IOV disabled, Memory Space disabled, ARI disabled
                     0 VFs configured out of 16 supported
                     First VF RID Offset 0x0047, VF RID Stride 0x0001
                     VF Device ID 0x16af
                     Page Sizes: 4096 (enabled), 8192, 16384, 32768, 65536, 131072, 262144, 524288, 1048576, 4194304
    ecap 0015[220] = Resizable BAR 1

pcib10@pci0:176:0:0:	class=0x060400 rev=0x04 hdr=0x01 vendor=0x8086 device=0x2030 subvendor=0x1590 subdevice=0x00ea
    vendor     = 'Intel Corporation'
    device     = 'Sky Lake-E PCI Express Root Port A'
    class      = bridge
    subclass   = PCI-PCI
    cap 0d[40] = PCI Bridge subvendor=0x1590 subdevice=0x00ea
    cap 05[60] = MSI supports 2 messages, vector masks 
    cap 10[90] = PCI-Express 2 root port max data 256(256) ARI enabled
                 max read 128
                 link x8(x16) speed 5.0(8.0) ASPM disabled(L1)
                 slot 1 power limit 75000 mW
    cap 01[e0] = powerspec 3  supports D0 D3  current D0
    ecap 000b[100] = Vendor [1] ID 0002 Rev 0 Length 12
    ecap 000d[110] = ACS 1
    ecap 0001[148] = AER 1 0 fatal 0 non-fatal 0 corrected
    ecap 000b[1d0] = Vendor [1] ID 0003 Rev 1 Length 10
    ecap 0019[250] = PCIe Sec 1 lane errors 0
    ecap 000b[280] = Vendor [1] ID 0005 Rev 3 Length 24
    ecap 000b[300] = Vendor [1] ID 0008 Rev 0 Length 56

none74@pci0:176:5:0:	class=0x088000 rev=0x04 hdr=0x00 vendor=0x8086 device=0x2034 subvendor=0x1590 subdevice=0x00ea
    vendor     = 'Intel Corporation'
    device     = 'Sky Lake-E VT-d'
    class      = base peripheral
    cap 10[40] = PCI-Express 2 root endpoint max data 128(128)
                 max read 128

none75@pci0:176:5:2:	class=0x088000 rev=0x04 hdr=0x00 vendor=0x8086 device=0x2035 subvendor=0x1590 subdevice=0x00ea
    vendor     = 'Intel Corporation'
    device     = 'Sky Lake-E RAS Configuration Registers'
    class      = base peripheral
    cap 10[40] = PCI-Express 2 root endpoint max data 128(128)
                 max read 128

ioapic3@pci0:176:5:4:	class=0x080020 rev=0x04 hdr=0x00 vendor=0x8086 device=0x2036 subvendor=0x1590 subdevice=0x18a9
    vendor     = 'Intel Corporation'
    device     = 'Sky Lake-E IOxAPIC Configuration Registers'
    class      = base peripheral
    subclass   = interrupt controller
    bar   [10] = type Memory, range 32, base 0xf5900000, size 4096, enabled
    cap 10[44] = PCI-Express 1 root endpoint max data 128(128)
                 max read 128
    cap 01[e0] = powerspec 3  supports D0 D3  current D0

none76@pci0:176:14:0:	class=0x110100 rev=0x04 hdr=0x00 vendor=0x8086 device=0x2058 subvendor=0x1590 subdevice=0x00ea
    vendor     = 'Intel Corporation'
    device     = 'Sky Lake-E KTI 0'
    class      = dasp
    subclass   = performance counters
    cap 10[40] = PCI-Express 2 root endpoint max data 128(128)
                 max read 128

none77@pci0:176:14:1:	class=0x088000 rev=0x04 hdr=0x00 vendor=0x8086 device=0x2059 subvendor=0x1590 subdevice=0x00ea
    vendor     = 'Intel Corporation'
    device     = 'Sky Lake-E UPI Registers'
    class      = base peripheral
    cap 10[40] = PCI-Express 2 root endpoint max data 128(128)
                 max read 128
    ecap 000b[100] = Vendor [0] ID 0001 Rev 0 Length 240

none78@pci0:176:15:0:	class=0x110100 rev=0x04 hdr=0x00 vendor=0x8086 device=0x2058 subvendor=0x1590 subdevice=0x00ea
    vendor     = 'Intel Corporation'
    device     = 'Sky Lake-E KTI 0'
    class      = dasp
    subclass   = performance counters
    cap 10[40] = PCI-Express 2 root endpoint max data 128(128)
                 max read 128

none79@pci0:176:15:1:	class=0x088000 rev=0x04 hdr=0x00 vendor=0x8086 device=0x2059 subvendor=0x1590 subdevice=0x00ea
    vendor     = 'Intel Corporation'
    device     = 'Sky Lake-E UPI Registers'
    class      = base peripheral
    cap 10[40] = PCI-Express 2 root endpoint max data 128(128)
                 max read 128
    ecap 000b[100] = Vendor [0] ID 0001 Rev 0 Length 240

none80@pci0:176:18:0:	class=0x110100 rev=0x04 hdr=0x00 vendor=0x8086 device=0x204c subvendor=0x1590 subdevice=0x00ea
    vendor     = 'Intel Corporation'
    device     = 'Sky Lake-E M3KTI Registers'
    class      = dasp
    subclass   = performance counters
    cap 10[40] = PCI-Express 2 root endpoint max data 128(128)
                 max read 128

none81@pci0:176:18:1:	class=0x110100 rev=0x04 hdr=0x00 vendor=0x8086 device=0x204d subvendor=0x1590 subdevice=0x00ea
    vendor     = 'Intel Corporation'
    device     = 'Sky Lake-E M3KTI Registers'
    class      = dasp
    subclass   = performance counters

none82@pci0:176:18:2:	class=0x088000 rev=0x04 hdr=0x00 vendor=0x8086 device=0x204e subvendor=0x1590 subdevice=0x00ea
    vendor     = 'Intel Corporation'
    device     = 'Sky Lake-E M3KTI Registers'
    class      = base peripheral

none83@pci0:176:21:0:	class=0x088000 rev=0x04 hdr=0x00 vendor=0x8086 device=0x2018 subvendor=0x1590 subdevice=0x00ea
    vendor     = 'Intel Corporation'
    device     = 'Sky Lake-E M2PCI Registers'
    class      = base peripheral

none84@pci0:176:22:0:	class=0x088000 rev=0x04 hdr=0x00 vendor=0x8086 device=0x2018 subvendor=0x1590 subdevice=0x00ea
    vendor     = 'Intel Corporation'
    device     = 'Sky Lake-E M2PCI Registers'
    class      = base peripheral

none85@pci0:176:22:4:	class=0x088000 rev=0x04 hdr=0x00 vendor=0x8086 device=0x2018 subvendor=0x1590 subdevice=0x00ea
    vendor     = 'Intel Corporation'
    device     = 'Sky Lake-E M2PCI Registers'
    class      = base peripheral

bxe2@pci0:177:0:0:	class=0x020000 rev=0x10 hdr=0x00 vendor=0x14e4 device=0x168e subvendor=0x103c subdevice=0x18d3
    vendor     = 'Broadcom Inc. and subsidiaries'
    device     = 'NetXtreme II BCM57810 10 Gigabit Ethernet'
    class      = network
    subclass   = ethernet
    bar   [10] = type Prefetchable Memory, range 64, base 0xf4000000, size 8388608, enabled
    bar   [18] = type Prefetchable Memory, range 64, base 0xf3800000, size 8388608, enabled
    bar   [20] = type Prefetchable Memory, range 64, base 0xf5800000, size 65536, enabled
    cap 01[48] = powerspec 3  supports D0 D3  current D0
    cap 03[50] = VPD
    cap 11[a0] = MSI-X supports 32 messages, enabled
                 Table in map 0x20[0x0], PBA in map 0x20[0x1000]
    cap 10[ac] = PCI-Express 2 endpoint max data 256(512) FLR RO NS
                 max read 4096
                 link x8(x8) speed 5.0(5.0) ASPM disabled(L0s/L1) ClockPM disabled
    ecap 0001[100] = AER 1 0 fatal 0 non-fatal 1 corrected
    ecap 0003[13c] = Serial 1 20677cfffe0110f0
    ecap 0004[150] = Power Budgeting 1
    ecap 0002[160] = VC 1 max VC0
    ecap 000e[1b8] = ARI 1
    ecap 0010[1c0] = SR-IOV 1 IOV disabled, Memory Space disabled, ARI enabled
                     0 VFs configured out of 16 supported
                     First VF RID Offset 0x0008, VF RID Stride 0x0001
                     VF Device ID 0x16af
                     Page Sizes: 4096 (enabled), 8192, 16384, 32768, 65536, 131072, 262144, 524288, 1048576, 4194304
    ecap 0015[220] = Resizable BAR 1
    ecap 0019[300] = PCIe Sec 1 lane errors 0

bxe3@pci0:177:0:1:	class=0x020000 rev=0x10 hdr=0x00 vendor=0x14e4 device=0x168e subvendor=0x103c subdevice=0x18d3
    vendor     = 'Broadcom Inc. and subsidiaries'
    device     = 'NetXtreme II BCM57810 10 Gigabit Ethernet'
    class      = network
    subclass   = ethernet
    bar   [10] = type Prefetchable Memory, range 64, base 0xf5000000, size 8388608, enabled
    bar   [18] = type Prefetchable Memory, range 64, base 0xf4800000, size 8388608, enabled
    bar   [20] = type Prefetchable Memory, range 64, base 0xf5810000, size 65536, enabled
    cap 01[48] = powerspec 3  supports D0 D3  current D0
    cap 03[50] = VPD
    cap 11[a0] = MSI-X supports 32 messages, enabled
                 Table in map 0x20[0x0], PBA in map 0x20[0x1000]
    cap 10[ac] = PCI-Express 2 endpoint max data 256(512) FLR RO NS
                 max read 4096
                 link x8(x8) speed 5.0(5.0) ASPM disabled(L0s/L1) ClockPM disabled
    ecap 0001[100] = AER 1 0 fatal 0 non-fatal 1 corrected
    ecap 0003[13c] = Serial 1 20677cfffe0110f0
    ecap 0004[150] = Power Budgeting 1
    ecap 0002[160] = VC 1 max VC0
    ecap 000e[1b8] = ARI 1
    ecap 0010[1c0] = SR-IOV 1 IOV disabled, Memory Space disabled, ARI disabled
                     0 VFs configured out of 16 supported
                     First VF RID Offset 0x0047, VF RID Stride 0x0001
                     VF Device ID 0x16af
                     Page Sizes: 4096 (enabled), 8192, 16384, 32768, 65536, 131072, 262144, 524288, 1048576, 4194304
    ecap 0015[220] = Resizable BAR 1
