hostb0@pci0:0:0:0:	class=0x060000 rev=0x01 hdr=0x00 vendor=0x8086 device=0x29f0 subvendor=0x0000 subdevice=0x0000
    vendor     = 'Intel Corporation'
    device     = '3200/3210 Chipset DRAM Controller'
    class      = bridge
    subclass   = HOST-PCI
    cap 09[e0] = vendor (length 12) Intel cap 9 version 1

pcib1@pci0:0:1:0:	class=0x060400 rev=0x01 hdr=0x01 vendor=0x8086 device=0x29f1 subvendor=0x1028 subdevice=0x023c
    vendor     = 'Intel Corporation'
    device     = '3200/3210 Chipset Host-Primary PCI Express Bridge'
    class      = bridge
    subclass   = PCI-PCI
    cap 0d[88] = PCI Bridge subvendor=0x1028 subdevice=0x023c
    cap 01[80] = powerspec 3  supports D0 D3  current D0
    cap 05[90] = MSI supports 1 message 
    cap 10[a0] = PCI-Express 2 root port max data 128(128)
                 max read 128
                 link x0(x8) speed 0.0(2.5) ASPM disabled(L0s)
                 slot 2 power limit 25000 mW
    ecap 0002[100] = VC 1 max VC0
    ecap 0005[140] = Root Complex Link Declaration 1

pcib2@pci0:0:28:0:	class=0x060400 rev=0x02 hdr=0x01 vendor=0x8086 device=0x2940 subvendor=0x1028 subdevice=0x023c
    vendor     = 'Intel Corporation'
    device     = '82801I (ICH9 Family) PCI Express Port 1'
    class      = bridge
    subclass   = PCI-PCI
    cap 10[40] = PCI-Express 1 root port max data 128(128)
                 max read 128
                 link x4(x4) speed 2.5(2.5) ASPM disabled(L0s/L1)
                 slot 1 power limit 25000 mW HotPlug(present) surprise
    cap 05[80] = MSI supports 1 message enabled with 1 message
    cap 0d[90] = PCI Bridge subvendor=0x1028 subdevice=0x023c
    cap 01[a0] = powerspec 2  supports D0 D3  current D0
    ecap 0002[100] = VC 1 max VC0
    ecap 0005[180] = Root Complex Link Declaration 1

pcib3@pci0:0:28:4:	class=0x060400 rev=0x02 hdr=0x01 vendor=0x8086 device=0x2948 subvendor=0x1028 subdevice=0x023c
    vendor     = 'Intel Corporation'
    device     = '82801I (ICH9 Family) PCI Express Port 5'
    class      = bridge
    subclass   = PCI-PCI
    cap 10[40] = PCI-Express 1 root port max data 128(128)
                 max read 128
                 link x1(x1) speed 2.5(2.5) ASPM disabled(L0s/L1)
    cap 05[80] = MSI supports 1 message 
    cap 0d[90] = PCI Bridge subvendor=0x1028 subdevice=0x023c
    cap 01[a0] = powerspec 2  supports D0 D3  current D0
    ecap 0002[100] = VC 1 max VC0
    ecap 0005[180] = Root Complex Link Declaration 1

pcib4@pci0:0:28:5:	class=0x060400 rev=0x02 hdr=0x01 vendor=0x8086 device=0x294a subvendor=0x1028 subdevice=0x023c
    vendor     = 'Intel Corporation'
    device     = '82801I (ICH9 Family) PCI Express Port 6'
    class      = bridge
    subclass   = PCI-PCI
    cap 10[40] = PCI-Express 1 root port max data 128(128)
                 max read 128
                 link x1(x1) speed 2.5(2.5) ASPM disabled(L0s/L1)
    cap 05[80] = MSI supports 1 message 
    cap 0d[90] = PCI Bridge subvendor=0x1028 subdevice=0x023c
    cap 01[a0] = powerspec 2  supports D0 D3  current D0
    ecap 0002[100] = VC 1 max VC0
    ecap 0005[180] = Root Complex Link Declaration 1

uhci0@pci0:0:29:0:	class=0x0c0300 rev=0x02 hdr=0x00 vendor=0x8086 device=0x2934 subvendor=0x1028 subdevice=0x023c
    vendor     = 'Intel Corporation'
    device     = '82801I (ICH9 Family) USB UHCI Controller'
    class      = serial bus
    subclass   = USB
    bar   [20] = type I/O Port, range 32, base 0xdc60, size 32, enabled
    cap 13[50] = PCI Advanced Features: FLR TP

uhci1@pci0:0:29:1:	class=0x0c0300 rev=0x02 hdr=0x00 vendor=0x8086 device=0x2935 subvendor=0x1028 subdevice=0x023c
    vendor     = 'Intel Corporation'
    device     = '82801I (ICH9 Family) USB UHCI Controller'
    class      = serial bus
    subclass   = USB
    bar   [20] = type I/O Port, range 32, base 0xdc80, size 32, enabled
    cap 13[50] = PCI Advanced Features: FLR TP

uhci2@pci0:0:29:2:	class=0x0c0300 rev=0x02 hdr=0x00 vendor=0x8086 device=0x2936 subvendor=0x1028 subdevice=0x023c
    vendor     = 'Intel Corporation'
    device     = '82801I (ICH9 Family) USB UHCI Controller'
    class      = serial bus
    subclass   = USB
    bar   [20] = type I/O Port, range 32, base 0xdca0, size 32, enabled
    cap 13[50] = PCI Advanced Features: FLR TP

ehci0@pci0:0:29:7:	class=0x0c0320 rev=0x02 hdr=0x00 vendor=0x8086 device=0x293a subvendor=0x1028 subdevice=0x023c
    vendor     = 'Intel Corporation'
    device     = '82801I (ICH9 Family) USB2 EHCI Controller'
    class      = serial bus
    subclass   = USB
    bar   [10] = type Memory, range 32, base 0xde0ffc00, size 1024, enabled
    cap 01[50] = powerspec 2  supports D0 D3  current D0
    cap 0a[58] = EHCI Debug Port at offset 0xa0 in map 0x14
    cap 13[98] = PCI Advanced Features: FLR TP

pcib5@pci0:0:30:0:	class=0x060401 rev=0x92 hdr=0x01 vendor=0x8086 device=0x244e subvendor=0x0000 subdevice=0x0000
    vendor     = 'Intel Corporation'
    device     = '82801 PCI Bridge'
    class      = bridge
    subclass   = PCI-PCI
    cap 0d[50] = PCI Bridge subvendor=0x0000 subdevice=0x0000

isab0@pci0:0:31:0:	class=0x060100 rev=0x02 hdr=0x00 vendor=0x8086 device=0x2916 subvendor=0x0000 subdevice=0x0000
    vendor     = 'Intel Corporation'
    device     = '82801IR (ICH9R) LPC Interface Controller'
    class      = bridge
    subclass   = PCI-ISA
    cap 09[e0] = vendor (length 12) Intel cap 1 version 0
		 features: SATA RAID-5, 4 PCI-e x1 slots

atapci0@pci0:0:31:2:	class=0x01018f rev=0x02 hdr=0x00 vendor=0x8086 device=0x2920 subvendor=0x1028 subdevice=0x023c
    vendor     = 'Intel Corporation'
    device     = '82801IR/IO/IH (ICH9R/DO/DH) 4 port SATA Controller [IDE mode]'
    class      = mass storage
    subclass   = ATA
    bar   [10] = type I/O Port, range 32, base 0xdc30, size 8, enabled
    bar   [14] = type I/O Port, range 32, base 0xdc28, size 4, enabled
    bar   [18] = type I/O Port, range 32, base 0xdc38, size 8, enabled
    bar   [1c] = type I/O Port, range 32, base 0xdc2c, size 4, enabled
    bar   [20] = type I/O Port, range 32, base 0xdc40, size 16, enabled
    bar   [24] = type I/O Port, range 32, base 0xdc50, size 16, enabled
    cap 01[70] = powerspec 3  supports D0 D3  current D0
    cap 13[b0] = PCI Advanced Features: FLR TP

bce0@pci0:2:0:0:	class=0x020000 rev=0x20 hdr=0x00 vendor=0x14e4 device=0x1639 subvendor=0x14e4 subdevice=0x0907
    vendor     = 'Broadcom Inc. and subsidiaries'
    device     = 'NetXtreme II BCM5709 Gigabit Ethernet'
    class      = network
    subclass   = ethernet
    bar   [10] = type Memory, range 64, base 0xda000000, size 33554432, enabled
    cap 01[48] = powerspec 3  supports D0 D3  current D0
    cap 03[50] = VPD
    cap 05[58] = MSI supports 16 messages, 64 bit enabled with 1 message
    cap 11[a0] = MSI-X supports 9 messages
                 Table in map 0x10[0xc000], PBA in map 0x10[0xe000]
    cap 10[ac] = PCI-Express 2 endpoint max data 128(512) RO NS
                 max read 512
                 link x4(x4) speed 2.5(2.5) ASPM disabled(L0s/L1)
    ecap 0003[100] = Serial 1 000af7fffe09d8ec
    ecap 0001[110] = AER 1 0 fatal 0 non-fatal 1 corrected
    ecap 0004[150] = Power Budgeting 1
    ecap 0002[160] = VC 1 max VC0

bce1@pci0:2:0:1:	class=0x020000 rev=0x20 hdr=0x00 vendor=0x14e4 device=0x1639 subvendor=0x14e4 subdevice=0x0907
    vendor     = 'Broadcom Inc. and subsidiaries'
    device     = 'NetXtreme II BCM5709 Gigabit Ethernet'
    class      = network
    subclass   = ethernet
    bar   [10] = type Memory, range 64, base 0xdc000000, size 33554432, enabled
    cap 01[48] = powerspec 3  supports D0 D3  current D0
    cap 03[50] = VPD
    cap 05[58] = MSI supports 16 messages, 64 bit enabled with 1 message
    cap 11[a0] = MSI-X supports 9 messages
                 Table in map 0x10[0xc000], PBA in map 0x10[0xe000]
    cap 10[ac] = PCI-Express 2 endpoint max data 128(512) RO NS
                 max read 512
                 link x4(x4) speed 2.5(2.5) ASPM disabled(L0s/L1)
    ecap 0003[100] = Serial 1 000af7fffe09d8ee
    ecap 0001[110] = AER 1 0 fatal 0 non-fatal 1 corrected
    ecap 0004[150] = Power Budgeting 1
    ecap 0002[160] = VC 1 max VC0

bge0@pci0:3:0:0:	class=0x020000 rev=0x21 hdr=0x00 vendor=0x14e4 device=0x1659 subvendor=0x1028 subdevice=0x023c
    vendor     = 'Broadcom Inc. and subsidiaries'
    device     = 'NetXtreme BCM5721 Gigabit Ethernet PCI Express'
    class      = network
    subclass   = ethernet
    bar   [10] = type Memory, range 64, base 0xde1f0000, size 65536, enabled
    cap 01[48] = powerspec 2  supports D0 D3  current D0
    cap 03[50] = VPD
    cap 05[58] = MSI supports 8 messages, 64 bit enabled with 1 message
    cap 10[d0] = PCI-Express 1 endpoint max data 128(128)
                 max read 4096
                 link x1(x1) speed 2.5(2.5) ASPM disabled(L0s/L1)
    ecap 0001[100] = AER 1 0 fatal 1 non-fatal 0 corrected
    ecap 0002[13c] = VC 1 max VC0
    ecap 0003[160] = Serial 1 001ec9fffebb3df1
    ecap 0004[16c] = Power Budgeting 1

bge1@pci0:4:0:0:	class=0x020000 rev=0x21 hdr=0x00 vendor=0x14e4 device=0x1659 subvendor=0x1028 subdevice=0x023c
    vendor     = 'Broadcom Inc. and subsidiaries'
    device     = 'NetXtreme BCM5721 Gigabit Ethernet PCI Express'
    class      = network
    subclass   = ethernet
    bar   [10] = type Memory, range 64, base 0xde2f0000, size 65536, enabled
    cap 01[48] = powerspec 2  supports D0 D3  current D0
    cap 03[50] = VPD
    cap 05[58] = MSI supports 8 messages, 64 bit enabled with 1 message
    cap 10[d0] = PCI-Express 1 endpoint max data 128(128)
                 max read 4096
                 link x1(x1) speed 2.5(2.5) ASPM disabled(L0s/L1)
    ecap 0001[100] = AER 1 0 fatal 1 non-fatal 0 corrected
    ecap 0002[13c] = VC 1 max VC0
    ecap 0003[160] = Serial 1 001ec9fffebb3df2
    ecap 0004[16c] = Power Budgeting 1

vgapci0@pci0:5:5:0:	class=0x030000 rev=0x02 hdr=0x00 vendor=0x1002 device=0x515e subvendor=0x1028 subdevice=0x023c
    vendor     = 'Advanced Micro Devices, Inc. [AMD/ATI]'
    device     = 'ES1000'
    class      = display
    subclass   = VGA
    bar   [10] = type Prefetchable Memory, range 32, base 0xd0000000, size 134217728, enabled
    bar   [14] = type I/O Port, range 32, base 0xec00, size 256, enabled
    bar   [18] = type Memory, range 32, base 0xde3f0000, size 65536, enabled
    cap 01[50] = powerspec 2  supports D0 D1 D2 D3  current D0
