hostb0@pci0:0:0:0:	class=0x060000 rev=0x0b hdr=0x00 vendor=0x8086 device=0x0a04 subvendor=0x103c subdevice=0x1991
    vendor     = 'Intel Corporation'
    device     = 'Haswell-ULT DRAM Controller'
    class      = bridge
    subclass   = HOST-PCI
    cap 09[e0] = vendor (length 12) Intel cap 0 version 1

vgapci0@pci0:0:2:0:	class=0x030000 rev=0x0b hdr=0x00 vendor=0x8086 device=0x0a16 subvendor=0x103c subdevice=0x1991
    vendor     = 'Intel Corporation'
    device     = 'Haswell-ULT Integrated Graphics Controller'
    class      = display
    subclass   = VGA
    bar   [10] = type Memory, range 64, base 0xd0000000, size 4194304, enabled
    bar   [18] = type Prefetchable Memory, range 64, base 0xc0000000, size 268435456, enabled
    bar   [20] = type I/O Port, range 32, base 0x3000, size 64, enabled
    cap 05[90] = MSI supports 1 message enabled with 1 message
    cap 01[d0] = powerspec 2  supports D0 D3  current D0
    cap 13[a4] = PCI Advanced Features: FLR TP

hdac0@pci0:0:3:0:	class=0x040300 rev=0x0b hdr=0x00 vendor=0x8086 device=0x0a0c subvendor=0x103c subdevice=0x1991
    vendor     = 'Intel Corporation'
    device     = 'Haswell-ULT HD Audio Controller'
    class      = multimedia
    subclass   = HDA
    bar   [10] = type Memory, range 64, base 0xd0720000, size 16384, enabled
    cap 01[50] = powerspec 2  supports D0 D3  current D0
    cap 05[60] = MSI supports 1 message enabled with 1 message
    cap 10[70] = PCI-Express 1 root endpoint max data 128(128) FLR NS
                 max read 128

none0@pci0:0:22:0:	class=0x078000 rev=0x04 hdr=0x00 vendor=0x8086 device=0x9c3a subvendor=0x103c subdevice=0x1991
    vendor     = 'Intel Corporation'
    device     = '8 Series HECI'
    class      = simple comms
    bar   [10] = type Memory, range 64, base 0xd0729000, size 32, enabled
    cap 01[50] = powerspec 3  supports D0 D3  current D0
    cap 05[8c] = MSI supports 1 message, 64 bit 

uart2@pci0:0:22:3:	class=0x070002 rev=0x04 hdr=0x00 vendor=0x8086 device=0x9c3d subvendor=0x103c subdevice=0x1991
    vendor     = 'Intel Corporation'
    device     = '8 Series HECI KT'
    class      = simple comms
    subclass   = UART
    bar   [10] = type I/O Port, range 32, base 0x30b0, size 8, enabled
    bar   [14] = type Memory, range 32, base 0xd072f000, size 4096, enabled
    cap 01[c8] = powerspec 3  supports D0 D3  current D0
    cap 05[d0] = MSI supports 1 message, 64 bit enabled with 1 message

em0@pci0:0:25:0:	class=0x020000 rev=0x04 hdr=0x00 vendor=0x8086 device=0x155a subvendor=0x103c subdevice=0x1991
    vendor     = 'Intel Corporation'
    device     = 'Ethernet Connection I218-LM'
    class      = network
    subclass   = ethernet
    bar   [10] = type Memory, range 32, base 0xd0700000, size 131072, enabled
    bar   [14] = type Memory, range 32, base 0xd072e000, size 4096, enabled
    bar   [18] = type I/O Port, range 32, base 0x3080, size 32, enabled
    cap 01[c8] = powerspec 2  supports D0 D3  current D0
    cap 05[d0] = MSI supports 1 message, 64 bit enabled with 1 message
    cap 13[e0] = PCI Advanced Features: FLR TP

hdac1@pci0:0:27:0:	class=0x040300 rev=0x04 hdr=0x00 vendor=0x8086 device=0x9c20 subvendor=0x103c subdevice=0x1991
    vendor     = 'Intel Corporation'
    device     = '8 Series HD Audio Controller'
    class      = multimedia
    subclass   = HDA
    bar   [10] = type Memory, range 64, base 0xd0724000, size 16384, enabled
    cap 01[50] = powerspec 3  supports D0 D3  current D0
    cap 05[60] = MSI supports 1 message, 64 bit enabled with 1 message
    cap 10[70] = PCI-Express 1 root endpoint max data 128(128) FLR NS
                 max read 128
    ecap 0002[100] = VC 1 max VC1

pcib1@pci0:0:28:0:	class=0x060400 rev=0xe4 hdr=0x01 vendor=0x8086 device=0x9c10 subvendor=0x103c subdevice=0x1991
    vendor     = 'Intel Corporation'
    device     = '8 Series PCI Express Root Port 1'
    class      = bridge
    subclass   = PCI-PCI
    cap 10[40] = PCI-Express 2 root port max data 128(128)
                 max read 128
                 link x0(x1) speed 0.0(5.0) ASPM disabled(L0s/L1)
    cap 05[80] = MSI supports 1 message 
    cap 0d[90] = PCI Bridge subvendor=0x103c subdevice=0x1991
    cap 01[a0] = powerspec 3  supports D0 D3  current D0

pcib2@pci0:0:28:3:	class=0x060400 rev=0xe4 hdr=0x01 vendor=0x8086 device=0x9c16 subvendor=0x103c subdevice=0x1991
    vendor     = 'Intel Corporation'
    device     = '8 Series PCI Express Root Port 4'
    class      = bridge
    subclass   = PCI-PCI
    cap 10[40] = PCI-Express 2 root port max data 128(128)
                 max read 128
                 link x1(x1) speed 2.5(5.0) ASPM L1(L0s/L1)
                 slot 3 power limit 100 mW
    cap 05[80] = MSI supports 1 message 
    cap 0d[90] = PCI Bridge subvendor=0x103c subdevice=0x1991
    cap 01[a0] = powerspec 3  supports D0 D3  current D0
    ecap 0000[100] = unknown 0
    ecap 001e[200] = L1 PM Substates 1

pcib3@pci0:0:28:5:	class=0x060400 rev=0xe4 hdr=0x01 vendor=0x8086 device=0x9c1a subvendor=0x103c subdevice=0x1991
    vendor     = 'Intel Corporation'
    device     = '8 Series PCI Express Root Port 6'
    class      = bridge
    subclass   = PCI-PCI
    cap 10[40] = PCI-Express 2 root port max data 128(128)
                 max read 128
                 link x1(x1) speed 2.5(5.0) ASPM L1(L0s/L1)
                 slot 5 power limit 100 mW HotPlug(present) surprise
    cap 05[80] = MSI supports 1 message enabled with 1 message
    cap 0d[90] = PCI Bridge subvendor=0x103c subdevice=0x1991
    cap 01[a0] = powerspec 3  supports D0 D3  current D0
    ecap 0000[100] = unknown 0
    ecap 001e[200] = L1 PM Substates 1

ehci0@pci0:0:29:0:	class=0x0c0320 rev=0x04 hdr=0x00 vendor=0x8086 device=0x9c26 subvendor=0x103c subdevice=0x1991
    vendor     = 'Intel Corporation'
    device     = '8 Series USB EHCI'
    class      = serial bus
    subclass   = USB
    bar   [10] = type Memory, range 32, base 0xd072d000, size 1024, enabled
    cap 01[50] = powerspec 3  supports D0 D3  current D0
    cap 0a[58] = EHCI Debug Port at offset 0xa0 in map 0x14
    cap 13[98] = PCI Advanced Features: FLR TP

isab0@pci0:0:31:0:	class=0x060100 rev=0x04 hdr=0x00 vendor=0x8086 device=0x9c43 subvendor=0x103c subdevice=0x1991
    vendor     = 'Intel Corporation'
    device     = '8 Series LPC Controller'
    class      = bridge
    subclass   = PCI-ISA
    cap 09[e0] = vendor (length 12) Intel cap 1 version 0
		 features: AMT, 4 PCI-e x1 slots

ahci0@pci0:0:31:2:	class=0x010601 rev=0x04 hdr=0x00 vendor=0x8086 device=0x9c03 subvendor=0x103c subdevice=0x1991
    vendor     = 'Intel Corporation'
    device     = '8 Series SATA Controller 1 [AHCI mode]'
    class      = mass storage
    subclass   = SATA
    bar   [10] = type I/O Port, range 32, base 0x30a8, size 8, enabled
    bar   [14] = type I/O Port, range 32, base 0x30bc, size 4, enabled
    bar   [18] = type I/O Port, range 32, base 0x30a0, size 8, enabled
    bar   [1c] = type I/O Port, range 32, base 0x30b8, size 4, enabled
    bar   [20] = type I/O Port, range 32, base 0x3060, size 32, enabled
    bar   [24] = type Memory, range 32, base 0xd072c000, size 2048, enabled
    cap 05[80] = MSI supports 1 message enabled with 1 message
    cap 01[70] = powerspec 3  supports D0 D3  current D0
    cap 12[a8] = SATA Index-Data Pair

ichsmb0@pci0:0:31:3:	class=0x0c0500 rev=0x04 hdr=0x00 vendor=0x8086 device=0x9c22 subvendor=0x103c subdevice=0x1991
    vendor     = 'Intel Corporation'
    device     = '8 Series SMBus Controller'
    class      = serial bus
    subclass   = SMBus
    bar   [10] = type Memory, range 64, base 0xd0728000, size 256, enabled
    bar   [20] = type I/O Port, range 32, base 0xef80, size 32, enabled

none1@pci0:2:0:0:	class=0x028000 rev=0x01 hdr=0x00 vendor=0x14e4 device=0x4727 subvendor=0x1028 subdevice=0x0010
    vendor     = 'Broadcom Inc. and subsidiaries'
    device     = 'BCM4313 802.11bgn Wireless Network Adapter'
    class      = network
    bar   [10] = type Memory, range 64, base 0xd0500000, size 16384, enabled
    cap 01[40] = powerspec 3  supports D0 D1 D2 D3  current D0
    cap 09[58] = vendor (length 120)
    cap 05[48] = MSI supports 1 message, 64 bit 
    cap 10[d0] = PCI-Express 1 endpoint max data 128(128)
                 max read 128
                 link x1(x1) speed 2.5(2.5) ASPM L1(L0s/L1) ClockPM enabled
    ecap 0001[100] = AER 1 0 fatal 0 non-fatal 0 corrected
    ecap 0002[13c] = VC 1 max VC0
    ecap 0003[160] = Serial 1 00009dffff6f1c65
    ecap 0004[16c] = Power Budgeting 1

rtsx0@pci0:3:0:0:	class=0xff0000 rev=0x01 hdr=0x00 vendor=0x10ec device=0x5227 subvendor=0x103c subdevice=0x1991
    vendor     = 'Realtek Semiconductor Co., Ltd.'
    device     = 'RTS5227 PCI Express Card Reader'
    bar   [10] = type Memory, range 32, base 0xd0400000, size 4096, enabled
    cap 01[40] = powerspec 3  supports D0 D1 D2 D3  current D0
    cap 05[50] = MSI supports 1 message, 64 bit enabled with 1 message
    cap 10[70] = PCI-Express 2 endpoint max data 128(128) RO
                 max read 512
                 link x1(x1) speed 2.5(2.5) ASPM disabled(L0s/L1) ClockPM enabled
    ecap 0001[100] = AER 2 0 fatal 0 non-fatal 0 corrected
    ecap 0003[140] = Serial 1 00000001004ce000
    ecap 0018[150] = LTR 1
    ecap 001e[158] = L1 PM Substates 1
