hostb0@pci0:0:0:0:	class=0x060000 card=0x16048086 chip=0x16048086 rev=0x09 hdr=0x00
    vendor     = 'Intel Corporation'
    device     = 'Broadwell-U Host Bridge -OPI'
    class      = bridge
    subclass   = HOST-PCI
    cap 09[e0] = vendor (length 12) Intel cap 0 version 1

vgapci0@pci0:0:2:0:	class=0x030000 card=0x16068086 chip=0x16068086 rev=0x09 hdr=0x00
    vendor     = 'Intel Corporation'
    device     = 'HD Graphics'
    class      = display
    subclass   = VGA
    bar   [10] = type Memory, range 64, base 0xe0000000, size 16777216, enabled
    bar   [18] = type Prefetchable Memory, range 64, base 0xd0000000, size 268435456, enabled
    bar   [20] = type I/O Port, range 32, base 0x3000, size 64, enabled
    cap 05[90] = MSI supports 1 message 
    cap 01[d0] = powerspec 2  supports D0 D3  current D0
    cap 13[a4] = PCI Advanced Features: FLR TP

hdac0@pci0:0:3:0:	class=0x040300 card=0x160c8086 chip=0x160c8086 rev=0x09 hdr=0x00
    vendor     = 'Intel Corporation'
    device     = 'Broadwell-U Audio Controller'
    class      = multimedia
    subclass   = HDA
    bar   [10] = type Memory, range 64, base 0xe1318000, size 16384, enabled
    cap 01[50] = powerspec 2  supports D0 D3  current D0
    cap 05[60] = MSI supports 1 message enabled with 1 message
    cap 10[70] = PCI-Express 1 root endpoint max data 128(128) FLR NS

xhci0@pci0:0:20:0:	class=0x0c0330 card=0x9cb18086 chip=0x9cb18086 rev=0x03 hdr=0x00
    vendor     = 'Intel Corporation'
    device     = 'Wildcat Point-LP USB xHCI Controller'
    class      = serial bus
    subclass   = USB
    bar   [10] = type Memory, range 64, base 0xe1300000, size 65536, enabled
    cap 01[70] = powerspec 2  supports D0 D3  current D0
    cap 05[80] = MSI supports 8 messages, 64 bit enabled with 1 message

none0@pci0:0:22:0:	class=0x078000 card=0x9cba8086 chip=0x9cba8086 rev=0x03 hdr=0x00
    vendor     = 'Intel Corporation'
    device     = 'Wildcat Point-LP MEI Controller'
    class      = simple comms
    bar   [10] = type Memory, range 64, base 0xe1322000, size 32, enabled
    cap 01[50] = powerspec 3  supports D0 D3  current D0
    cap 05[8c] = MSI supports 1 message, 64 bit 

hdac1@pci0:0:27:0:	class=0x040300 card=0x9ca08086 chip=0x9ca08086 rev=0x03 hdr=0x00
    vendor     = 'Intel Corporation'
    device     = 'Wildcat Point-LP High Definition Audio Controller'
    class      = multimedia
    subclass   = HDA
    bar   [10] = type Memory, range 64, base 0xe131c000, size 16384, enabled
    cap 01[50] = powerspec 3  supports D0 D3  current D0
    cap 05[60] = MSI supports 1 message, 64 bit enabled with 1 message
    cap 10[70] = PCI-Express 1 root endpoint max data 128(128) FLR NS
    ecap 0002[100] = VC 1 max VC1

pcib1@pci0:0:28:0:	class=0x060400 card=0x9c948086 chip=0x9c948086 rev=0xe3 hdr=0x01
    vendor     = 'Intel Corporation'
    device     = 'Wildcat Point-LP PCI Express Root Port'
    class      = bridge
    subclass   = PCI-PCI
    cap 10[40] = PCI-Express 2 root port max data 128(128)
                 link x1(x1) speed 2.5(5.0) ASPM L1(L0s/L1)
    cap 05[80] = MSI supports 1 message 
    cap 0d[90] = PCI Bridge card=0x9c948086
    cap 01[a0] = powerspec 3  supports D0 D3  current D0
    ecap 0001[100] = AER 1 0 fatal 0 non-fatal 0 corrected
    ecap 001e[200] = unknown 0

pcib2@pci0:0:28:1:	class=0x060400 card=0x9c968086 chip=0x9c968086 rev=0xe3 hdr=0x01
    vendor     = 'Intel Corporation'
    device     = 'Wildcat Point-LP PCI Express Root Port'
    class      = bridge
    subclass   = PCI-PCI
    cap 10[40] = PCI-Express 2 root port max data 128(128)
                 link x1(x1) speed 2.5(5.0) ASPM L1(L0s/L1)
    cap 05[80] = MSI supports 1 message 
    cap 0d[90] = PCI Bridge card=0x9c968086
    cap 01[a0] = powerspec 3  supports D0 D3  current D0
    ecap 0001[100] = AER 1 0 fatal 0 non-fatal 0 corrected
    ecap 001e[200] = unknown 0

pcib3@pci0:0:28:2:	class=0x060400 card=0x9c988086 chip=0x9c988086 rev=0xe3 hdr=0x01
    vendor     = 'Intel Corporation'
    device     = 'Wildcat Point-LP PCI Express Root Port'
    class      = bridge
    subclass   = PCI-PCI
    cap 10[40] = PCI-Express 2 root port max data 128(128)
                 link x0(x4) speed 0.0(5.0) ASPM disabled(L0s/L1)
    cap 05[80] = MSI supports 1 message 
    cap 0d[90] = PCI Bridge card=0x9c988086
    cap 01[a0] = powerspec 3  supports D0 D3  current D0
    ecap 0001[100] = AER 1 0 fatal 0 non-fatal 0 corrected
    ecap 001e[200] = unknown 0

isab0@pci0:0:31:0:	class=0x060100 card=0x9cc58086 chip=0x9cc58086 rev=0x03 hdr=0x00
    vendor     = 'Intel Corporation'
    device     = 'Wildcat Point-LP LPC Controller'
    class      = bridge
    subclass   = PCI-ISA
    cap 09[e0] = vendor (length 12) Intel cap 1 version 0
		 features: AMT, 4 PCI-e x1 slots

ahci0@pci0:0:31:2:	class=0x010601 card=0x9c838086 chip=0x9c838086 rev=0x03 hdr=0x00
    vendor     = 'Intel Corporation'
    device     = 'Wildcat Point-LP SATA Controller [AHCI Mode]'
    class      = mass storage
    subclass   = SATA
    bar   [10] = type I/O Port, range 32, base 0x3060, size 8, enabled
    bar   [14] = type I/O Port, range 32, base 0x3070, size 4, enabled
    bar   [18] = type I/O Port, range 32, base 0x3068, size 8, enabled
    bar   [1c] = type I/O Port, range 32, base 0x3074, size 4, enabled
    bar   [20] = type I/O Port, range 32, base 0x3040, size 32, enabled
    bar   [24] = type Memory, range 32, base 0xe1310000, size 32768, enabled
    cap 05[80] = MSI supports 1 message enabled with 1 message
    cap 01[70] = powerspec 3  supports D0 D3  current D0
    cap 12[a8] = SATA Index-Data Pair

none1@pci0:0:31:3:	class=0x0c0500 card=0x9ca28086 chip=0x9ca28086 rev=0x03 hdr=0x00
    vendor     = 'Intel Corporation'
    device     = 'Wildcat Point-LP SMBus Controller'
    class      = serial bus
    subclass   = SMBus
    bar   [10] = type Memory, range 64, base 0xe1321000, size 256, enabled
    bar   [20] = type I/O Port, range 32, base 0x400, size 32, enabled

none2@pci0:0:31:6:	class=0x118000 card=0x9ca48086 chip=0x9ca48086 rev=0x03 hdr=0x00
    vendor     = 'Intel Corporation'
    device     = 'Wildcat Point-LP Thermal Management Controller'
    class      = dasp
    bar   [10] = type Memory, range 64, base 0xe1320000, size 4096, enabled
    cap 01[50] = powerspec 3  supports D0 D3  current D0
    cap 05[80] = MSI supports 1 message 

re0@pci0:1:0:0:	class=0x020000 card=0x816810ec chip=0x816810ec rev=0x0c hdr=0x00
    vendor     = 'Realtek Semiconductor Co., Ltd.'
    device     = 'RTL8111/8168/8411 PCI Express Gigabit Ethernet Controller'
    class      = network
    subclass   = ethernet
    bar   [10] = type I/O Port, range 32, base 0x2000, size 256, enabled
    bar   [18] = type Memory, range 64, base 0xe1100000, size 4096, enabled
    bar   [20] = type Prefetchable Memory, range 64, base 0xe1000000, size 16384, enabled
    cap 01[40] = powerspec 3  supports D0 D1 D2 D3  current D0
    cap 05[50] = MSI supports 1 message, 64 bit 
    cap 10[70] = PCI-Express 2 endpoint MSI 1 max data 128(128) RO
                 link x1(x1) speed 2.5(2.5) ASPM disabled(L0s/L1)
    cap 11[b0] = MSI-X supports 4 messages, enabled
                 Table in map 0x20[0x0], PBA in map 0x20[0x800]
    cap 03[d0] = VPD
    ecap 0001[100] = AER 1 0 fatal 0 non-fatal 0 corrected
    ecap 0002[140] = VC 1 max VC0
    ecap 0003[160] = Serial 1 0000000000000000
    ecap 0018[170] = LTR 1

iwm0@pci0:2:0:0:	class=0x028000 card=0x40708086 chip=0x08b18086 rev=0xbb hdr=0x00
    vendor     = 'Intel Corporation'
    device     = 'Wireless 7260'
    class      = network
    bar   [10] = type Memory, range 64, base 0xe1200000, size 8192, enabled
    cap 01[c8] = powerspec 3  supports D0 D3  current D0
    cap 05[d0] = MSI supports 1 message, 64 bit enabled with 1 message
    cap 10[40] = PCI-Express 2 endpoint max data 128(128) FLR RO NS
                 link x1(x1) speed 2.5(2.5) ASPM L1(L0s/L1)
    ecap 0001[100] = AER 1 0 fatal 0 non-fatal 0 corrected
    ecap 0003[140] = Serial 1 44032cffffdcbd88
    ecap 0018[14c] = LTR 1
    ecap 000b[154] = Vendor 1 ID 51966
