hostb0@pci0:0:0:0:	class=0x060000 card=0x31f9103c chip=0x27788086 rev=0xc0 hdr=0x00
    vendor     = 'Intel Corporation'
    device     = 'E7230/3000/3010 Memory Controller Hub'
    class      = bridge
    subclass   = HOST-PCI
    cap 09[e0] = vendor (length 9) Intel cap 4 version 1

pcib1@pci0:0:1:0:	class=0x060400 card=0x00008086 chip=0x27798086 rev=0xc0 hdr=0x01
    vendor     = 'Intel Corporation'
    device     = 'E7230/3000/3010 PCI Express Root Port'
    class      = bridge
    subclass   = PCI-PCI
    cap 0d[88] = PCI Bridge card=0x00008086
    cap 01[80] = powerspec 2  supports D0 D3  current D0
    cap 05[90] = MSI supports 1 message 
    cap 10[a0] = PCI-Express 1 root port max data 128(128)
                 link x0(x8) speed 0.0(2.5) ASPM disabled(L0s/L1)
                 slot 0 power limit 0 mW
    ecap 0002[100] = VC 1 max VC1
    ecap 0005[140] = Root Complex Link Declaration 1

pcib2@pci0:0:28:0:	class=0x060400 card=0x00000000 chip=0x27d08086 rev=0x01 hdr=0x01
    vendor     = 'Intel Corporation'
    device     = 'NM10/ICH7 Family PCI Express Port 1'
    class      = bridge
    subclass   = PCI-PCI
    cap 10[40] = PCI-Express 1 root port max data 128(128)
                 link x4(x4) speed 2.5(2.5) ASPM disabled(L0s/L1)
    cap 05[80] = MSI supports 1 message 
    cap 0d[90] = PCI Bridge card=0x00000000
    cap 01[a0] = powerspec 2  supports D0 D3  current D0
    ecap 0002[100] = VC 1 max VC1
    ecap 0005[180] = Root Complex Link Declaration 1

pcib5@pci0:0:28:4:	class=0x060400 card=0x00000000 chip=0x27e08086 rev=0x01 hdr=0x01
    vendor     = 'Intel Corporation'
    device     = '82801GR/GH/GHM (ICH7 Family) PCI Express Port 5'
    class      = bridge
    subclass   = PCI-PCI
    cap 10[40] = PCI-Express 1 root port max data 128(128)
                 link x0(x1) speed 0.0(2.5) ASPM disabled(L0s/L1)
    cap 05[80] = MSI supports 1 message 
    cap 0d[90] = PCI Bridge card=0x00000000
    cap 01[a0] = powerspec 2  supports D0 D3  current D0
    ecap 0002[100] = VC 1 max VC1
    ecap 0005[180] = Root Complex Link Declaration 1

pcib6@pci0:0:28:5:	class=0x060400 card=0x00000000 chip=0x27e28086 rev=0x01 hdr=0x01
    vendor     = 'Intel Corporation'
    device     = '82801GR/GH/GHM (ICH7 Family) PCI Express Port 6'
    class      = bridge
    subclass   = PCI-PCI
    cap 10[40] = PCI-Express 1 root port max data 128(128)
                 link x0(x1) speed 0.0(2.5) ASPM disabled(L0s/L1)
    cap 05[80] = MSI supports 1 message 
    cap 0d[90] = PCI Bridge card=0x00000000
    cap 01[a0] = powerspec 2  supports D0 D3  current D0
    ecap 0002[100] = VC 1 max VC1
    ecap 0005[180] = Root Complex Link Declaration 1

uhci0@pci0:0:29:0:	class=0x0c0300 card=0x31fe103c chip=0x27c88086 rev=0x01 hdr=0x00
    vendor     = 'Intel Corporation'
    device     = 'NM10/ICH7 Family USB UHCI Controller'
    class      = serial bus
    subclass   = USB
    bar   [20] = type I/O Port, range 32, base 0x1000, size 32, enabled

uhci1@pci0:0:29:1:	class=0x0c0300 card=0x31fe103c chip=0x27c98086 rev=0x01 hdr=0x00
    vendor     = 'Intel Corporation'
    device     = 'NM10/ICH7 Family USB UHCI Controller'
    class      = serial bus
    subclass   = USB
    bar   [20] = type I/O Port, range 32, base 0x1020, size 32, enabled

uhci2@pci0:0:29:2:	class=0x0c0300 card=0x31fe103c chip=0x27ca8086 rev=0x01 hdr=0x00
    vendor     = 'Intel Corporation'
    device     = 'NM10/ICH7 Family USB UHCI Controller'
    class      = serial bus
    subclass   = USB
    bar   [20] = type I/O Port, range 32, base 0x1040, size 32, enabled

uhci3@pci0:0:29:3:	class=0x0c0300 card=0x31fe103c chip=0x27cb8086 rev=0x01 hdr=0x00
    vendor     = 'Intel Corporation'
    device     = 'NM10/ICH7 Family USB UHCI Controller'
    class      = serial bus
    subclass   = USB
    bar   [20] = type I/O Port, range 32, base 0x1060, size 32, enabled

ehci0@pci0:0:29:7:	class=0x0c0320 card=0x31fe103c chip=0x27cc8086 rev=0x01 hdr=0x00
    vendor     = 'Intel Corporation'
    device     = 'NM10/ICH7 Family USB2 EHCI Controller'
    class      = serial bus
    subclass   = USB
    bar   [10] = type Memory, range 32, base 0xfdcf0000, size 1024, enabled
    cap 01[50] = powerspec 2  supports D0 D3  current D0
    cap 0a[58] = EHCI Debug Port at offset 0xa0 in map 0x14

pcib7@pci0:0:30:0:	class=0x060401 card=0x00000000 chip=0x244e8086 rev=0xe1 hdr=0x01
    vendor     = 'Intel Corporation'
    device     = '82801 PCI Bridge'
    class      = bridge
    subclass   = PCI-PCI
    cap 0d[50] = PCI Bridge card=0x00000000

isab0@pci0:0:31:0:	class=0x060100 card=0x00000000 chip=0x27b88086 rev=0x01 hdr=0x00
    vendor     = 'Intel Corporation'
    device     = '82801GB/GR (ICH7 Family) LPC Interface Bridge'
    class      = bridge
    subclass   = PCI-ISA
    cap 09[e0] = vendor (length 12) Intel cap 1 version 0
		 features: Quick Resume, 4 PCI-e x1 slots

atapci0@pci0:0:31:1:	class=0x01018a card=0x31fe103c chip=0x27df8086 rev=0x01 hdr=0x00
    vendor     = 'Intel Corporation'
    device     = '82801G (ICH7 Family) IDE Controller'
    class      = mass storage
    subclass   = ATA
    bar   [20] = type I/O Port, range 32, base 0x500, size 16, enabled

ahci0@pci0:0:31:2:	class=0x010400 card=0x3206103c chip=0x27c38086 rev=0x01 hdr=0x00
    vendor     = 'Intel Corporation'
    device     = '82801GR/GDH (ICH7R/ICH7DH) SATA Controller [RAID mode]'
    class      = mass storage
    subclass   = RAID
    bar   [10] = type I/O Port, range 32, base 0x1080, size 8, enabled
    bar   [14] = type I/O Port, range 32, base 0x1088, size 4, enabled
    bar   [18] = type I/O Port, range 32, base 0x1090, size 8, enabled
    bar   [1c] = type I/O Port, range 32, base 0x1098, size 4, enabled
    bar   [20] = type I/O Port, range 32, base 0x10a0, size 32, enabled
    bar   [24] = type Memory, range 32, base 0xfdce0000, size 1024, enabled
    cap 05[80] = MSI supports 1 message enabled with 1 message
    cap 01[70] = powerspec 2  supports D0 D3  current D0
    cap 12[a8] = SATA Index-Data Pair

pcib3@pci0:2:0:0:	class=0x060400 card=0x00000000 chip=0x01031166 rev=0xb5 hdr=0x01
    vendor     = 'Broadcom'
    device     = 'EPB PCI-Express to PCI-X Bridge'
    class      = bridge
    subclass   = PCI-PCI
    cap 10[60] = PCI-Express 1 PCI bridge max data 128(128)
                 link x4(x4) speed 2.5(2.5) ASPM disabled(L0s/L1)
    cap 07[90] = PCI-X bridge 
    cap 01[b0] = powerspec 2  supports D0 D3  current D0
    ecap 0001[100] = AER 1 0 fatal 0 non-fatal 0 corrected
    ecap 0004[14c] = Power Budgeting 1

bge0@pci0:3:4:0:	class=0x020000 card=0x7039103c chip=0x166814e4 rev=0xa3 hdr=0x00
    vendor     = 'Broadcom Inc. and subsidiaries'
    device     = 'NetXtreme BCM5714 Gigabit Ethernet'
    class      = network
    subclass   = ethernet
    bar   [10] = type Memory, range 64, base 0xfdff0000, size 65536, enabled
    bar   [18] = type Memory, range 64, base 0xfdfe0000, size 65536, enabled
    cap 07[40] = PCI-X 64-bit supports 133MHz, 2048 burst read, 1 split transaction
    cap 01[48] = powerspec 2  supports D0 D3  current D0
    cap 03[50] = VPD
    cap 05[58] = MSI supports 8 messages, 64 bit enabled with 1 message

bge1@pci0:3:4:1:	class=0x020000 card=0x7039103c chip=0x166814e4 rev=0xa3 hdr=0x00
    vendor     = 'Broadcom Inc. and subsidiaries'
    device     = 'NetXtreme BCM5714 Gigabit Ethernet'
    class      = network
    subclass   = ethernet
    bar   [10] = type Memory, range 64, base 0xfdfd0000, size 65536, enabled
    bar   [18] = type Memory, range 64, base 0xfdfc0000, size 65536, enabled
    cap 07[40] = PCI-X 64-bit supports 133MHz, 2048 burst read, 1 split transaction
    cap 01[48] = powerspec 2  supports D0 D3  current D0
    cap 03[50] = VPD
    cap 05[58] = MSI supports 8 messages, 64 bit enabled with 1 message

pcib4@pci0:3:8:0:	class=0x060400 card=0x00000000 chip=0x01041166 rev=0xb4 hdr=0x01
    vendor     = 'Broadcom'
    device     = 'BCM5785 [HT1000] PCI/PCI-X Bridge'
    class      = bridge
    subclass   = PCI-PCI
    cap 07[90] = PCI-X 64-bit bridge supports 133MHz

vgapci0@pci0:1:3:0:	class=0x030000 card=0x31fb103c chip=0x515e1002 rev=0x02 hdr=0x00
    vendor     = 'Advanced Micro Devices, Inc. [AMD/ATI]'
    device     = 'ES1000'
    class      = display
    subclass   = VGA
    bar   [10] = type Prefetchable Memory, range 32, base 0xd8000000, size 134217728, enabled
    bar   [14] = type I/O Port, range 32, base 0x3000, size 256, enabled
    bar   [18] = type Memory, range 32, base 0xfdef0000, size 65536, enabled
    cap 01[50] = powerspec 2  supports D0 D1 D2 D3  current D0

none0@pci0:1:4:0:	class=0x088000 card=0x3305103c chip=0xb2030e11 rev=0x03 hdr=0x00
    vendor     = 'Compaq Computer Corporation'
    device     = 'Integrated Lights Out Controller'
    class      = base peripheral
    bar   [10] = type I/O Port, range 32, base 0x2800, size 256, enabled
    bar   [14] = type Memory, range 32, base 0xfdee0000, size 512, enabled
    cap 01[f0] = powerspec 3  supports D0 D3  current D0

none1@pci0:1:4:2:	class=0x088000 card=0x3305103c chip=0xb2040e11 rev=0x03 hdr=0x00
    vendor     = 'Compaq Computer Corporation'
    device     = 'Integrated Lights Out  Processor'
    class      = base peripheral
    bar   [10] = type I/O Port, range 32, base 0x3400, size 256, enabled
    bar   [14] = type Memory, range 32, base 0xfded0000, size 2048, enabled
    bar   [18] = type Memory, range 32, base 0xfdec0000, size 8192, enabled
    bar   [1c] = type Memory, range 32, base 0xfde00000, size 524288, enabled
    cap 01[f0] = powerspec 3  supports D0 D3  current D0

uhci4@pci0:1:4:4:	class=0x0c0300 card=0x3305103c chip=0x3300103c rev=0x00 hdr=0x00
    vendor     = 'Hewlett-Packard Company'
    device     = 'Integrated Lights-Out Standard Virtual USB Controller'
    class      = serial bus
    subclass   = USB
    bar   [20] = type I/O Port, range 32, base 0x3800, size 32, enabled
    cap 01[f0] = powerspec 3  supports D0 D3  current D0

none2@pci0:1:4:6:	class=0x0c0701 card=0x3305103c chip=0x3302103c rev=0x00 hdr=0x00
    vendor     = 'Hewlett-Packard Company'
    device     = 'Integrated Lights-Out Standard KCS Interface'
    class      = serial bus
    subclass   = IPMI
    bar   [10] = type Memory, range 32, base 0xfddf0000, size 256, enabled
    cap 01[f0] = powerspec 3  supports D0 D3  current D0
