hostb0@pci0:0:0:0:	class=0x060000 card=0x10171043 chip=0x00448086 rev=0x18 hdr=0x00
    vendor     = 'Intel Corporation'
    device     = 'Core Processor DRAM Controller'
    class      = bridge
    subclass   = HOST-PCI
    cap 09[e0] = vendor (length 12) Intel cap 0 version 1

pcib1@pci0:0:1:0:	class=0x060400 card=0x10171043 chip=0x00458086 rev=0x18 hdr=0x01
    vendor     = 'Intel Corporation'
    device     = 'Core Processor PCI Express x16 Root Port'
    class      = bridge
    subclass   = PCI-PCI
    cap 0d[88] = PCI Bridge card=0x10171043
    cap 01[80] = powerspec 3  supports D0 D3  current D0
    cap 05[90] = MSI supports 1 message 
    cap 10[a0] = PCI-Express 2 root port max data 128(128)
                 link x8(x8) speed 2.5(2.5) ASPM L0s/L1(L0s/L1)
                 slot 17 power limit 75000 mW
    ecap 0002[100] = VC 1 max VC0

none0@pci0:0:22:0:	class=0x078000 card=0x10171043 chip=0x3b648086 rev=0x06 hdr=0x00
    vendor     = 'Intel Corporation'
    device     = '5 Series/3400 Series Chipset HECI Controller'
    class      = simple comms
    bar   [10] = type Memory, range 64, base 0xd6e0a000, size 16, enabled
    cap 01[50] = powerspec 3  supports D0 D3  current D0
    cap 05[8c] = MSI supports 1 message, 64 bit 

ehci0@pci0:0:26:0:	class=0x0c0320 card=0x10171043 chip=0x3b3c8086 rev=0x06 hdr=0x00
    vendor     = 'Intel Corporation'
    device     = '5 Series/3400 Series Chipset USB2 Enhanced Host Controller'
    class      = serial bus
    subclass   = USB
    bar   [10] = type Memory, range 32, base 0xd6e08000, size 1024, enabled
    cap 01[50] = powerspec 2  supports D0 D3  current D0
    cap 0a[58] = EHCI Debug Port at offset 0xa0 in map 0x14
    cap 13[98] = PCI Advanced Features: FLR TP

hdac1@pci0:0:27:0:	class=0x040300 card=0x11e31043 chip=0x3b568086 rev=0x06 hdr=0x00
    vendor     = 'Intel Corporation'
    device     = '5 Series/3400 Series Chipset High Definition Audio'
    class      = multimedia
    subclass   = HDA
    bar   [10] = type Memory, range 64, base 0xd6e00000, size 16384, enabled
    cap 01[50] = powerspec 2  supports D0 D3  current D0
    cap 05[60] = MSI supports 1 message, 64 bit enabled with 1 message
    cap 10[70] = PCI-Express 1 root endpoint max data 128(128) FLR NS
    ecap 0002[100] = VC 1 max VC1
    ecap 0005[130] = Root Complex Link Declaration 1

pcib2@pci0:0:28:0:	class=0x060400 card=0x10171043 chip=0x3b428086 rev=0x06 hdr=0x01
    vendor     = 'Intel Corporation'
    device     = '5 Series/3400 Series Chipset PCI Express Root Port 1'
    class      = bridge
    subclass   = PCI-PCI
    cap 10[40] = PCI-Express 2 root port max data 128(128)
                 link x0(x1) speed 0.0(2.5) ASPM L0s/L1(L0s/L1)
                 slot 0 power limit 100 mW HotPlug(empty) surprise
    cap 05[80] = MSI supports 1 message enabled with 1 message
    cap 0d[90] = PCI Bridge card=0x10171043
    cap 01[a0] = powerspec 2  supports D0 D3  current D0

pcib3@pci0:0:28:3:	class=0x060400 card=0x10171043 chip=0x3b488086 rev=0x06 hdr=0x01
    vendor     = 'Intel Corporation'
    device     = '5 Series/3400 Series Chipset PCI Express Root Port 4'
    class      = bridge
    subclass   = PCI-PCI
    cap 10[40] = PCI-Express 2 root port max data 128(128)
                 link x1(x1) speed 2.5(2.5) ASPM L1(L0s/L1)
                 slot 3 power limit 100 mW HotPlug(present) surprise
    cap 05[80] = MSI supports 1 message enabled with 1 message
    cap 0d[90] = PCI Bridge card=0x10171043
    cap 01[a0] = powerspec 2  supports D0 D3  current D0

pcib4@pci0:0:28:5:	class=0x060400 card=0x10171043 chip=0x3b4c8086 rev=0x06 hdr=0x01
    vendor     = 'Intel Corporation'
    device     = '5 Series/3400 Series Chipset PCI Express Root Port 6'
    class      = bridge
    subclass   = PCI-PCI
    cap 10[40] = PCI-Express 2 root port max data 128(128)
                 link x1(x1) speed 2.5(2.5) ASPM L1(L0s/L1)
                 slot 5 power limit 100 mW HotPlug(present) surprise
    cap 05[80] = MSI supports 1 message enabled with 1 message
    cap 0d[90] = PCI Bridge card=0x10171043
    cap 01[a0] = powerspec 2  supports D0 D3  current D0

ehci1@pci0:0:29:0:	class=0x0c0320 card=0x10171043 chip=0x3b348086 rev=0x06 hdr=0x00
    vendor     = 'Intel Corporation'
    device     = '5 Series/3400 Series Chipset USB2 Enhanced Host Controller'
    class      = serial bus
    subclass   = USB
    bar   [10] = type Memory, range 32, base 0xd6e07000, size 1024, enabled
    cap 01[50] = powerspec 2  supports D0 D3  current D0
    cap 0a[58] = EHCI Debug Port at offset 0xa0 in map 0x14
    cap 13[98] = PCI Advanced Features: FLR TP

pcib5@pci0:0:30:0:	class=0x060401 card=0x10171043 chip=0x24488086 rev=0xa6 hdr=0x01
    vendor     = 'Intel Corporation'
    device     = '82801 Mobile PCI Bridge'
    class      = bridge
    subclass   = PCI-PCI
    cap 0d[50] = PCI Bridge card=0x10171043

isab0@pci0:0:31:0:	class=0x060100 card=0x10171043 chip=0x3b098086 rev=0x06 hdr=0x00
    vendor     = 'Intel Corporation'
    device     = 'HM55 Chipset LPC Interface Controller'
    class      = bridge
    subclass   = PCI-ISA
    cap 09[e0] = vendor (length 16) Intel cap 1 version 1

ahci0@pci0:0:31:2:	class=0x010601 card=0x10171043 chip=0x3b298086 rev=0x06 hdr=0x00
    vendor     = 'Intel Corporation'
    device     = '5 Series/3400 Series Chipset 4 port SATA AHCI Controller'
    class      = mass storage
    subclass   = SATA
    bar   [10] = type I/O Port, range 32, base 0xe070, size 8, enabled
    bar   [14] = type I/O Port, range 32, base 0xe060, size 4, enabled
    bar   [18] = type I/O Port, range 32, base 0xe050, size 8, enabled
    bar   [1c] = type I/O Port, range 32, base 0xe040, size 4, enabled
    bar   [20] = type I/O Port, range 32, base 0xe020, size 32, enabled
    bar   [24] = type Memory, range 32, base 0xd6e06000, size 2048, enabled
    cap 05[80] = MSI supports 1 message enabled with 1 message
    cap 01[70] = powerspec 3  supports D0 D3  current D0
    cap 12[a8] = SATA Index-Data Pair
    cap 13[b0] = PCI Advanced Features: FLR TP

vgapci0@pci0:1:0:0:	class=0x030000 card=0x13f21043 chip=0x0a7010de rev=0xa2 hdr=0x00
    vendor     = 'NVIDIA Corporation'
    device     = 'GT218M [GeForce 310M]'
    class      = display
    subclass   = VGA
    bar   [10] = type Memory, range 32, base 0xd2000000, size 16777216, enabled
    bar   [14] = type Prefetchable Memory, range 64, base 0xc0000000, size 268435456, enabled
    bar   [1c] = type Prefetchable Memory, range 64, base 0xd0000000, size 33554432, enabled
    bar   [24] = type I/O Port, range 32, base 0xd000, size 128, enabled
    cap 01[60] = powerspec 3  supports D0 D3  current D0
    cap 05[68] = MSI supports 1 message, 64 bit 
    cap 10[78] = PCI-Express 2 endpoint max data 128(128) RO NS
                 link x8(x16) speed 2.5(5.0) ASPM L0s/L1(L0s/L1) ClockPM disabled
    cap 09[b4] = vendor (length 20)
    ecap 0002[100] = VC 1 max VC0
    ecap 0004[128] = Power Budgeting 1
    ecap 000b[600] = Vendor 1 ID 1

hdac0@pci0:1:0:1:	class=0x040300 card=0x00000000 chip=0x0be310de rev=0xa1 hdr=0x00
    vendor     = 'NVIDIA Corporation'
    device     = 'High Definition Audio Controller'
    class      = multimedia
    subclass   = HDA
    bar   [10] = type Memory, range 32, base 0xd3080000, size 16384, enabled
    cap 01[60] = powerspec 3  supports D0 D3  current D0
    cap 05[68] = MSI supports 1 message, 64 bit 
    cap 10[78] = PCI-Express 2 endpoint max data 128(128) RO NS
                 link x8(x16) speed 2.5(5.0) ASPM L0s/L1(L0s/L1) ClockPM disabled

xhci0@pci0:3:0:0:	class=0x0c0330 card=0x10191043 chip=0x01941033 rev=0x03 hdr=0x00
    vendor     = 'NEC Corporation'
    device     = 'uPD720200 USB 3.0 Host Controller'
    class      = serial bus
    subclass   = USB
    bar   [10] = type Memory, range 64, base 0xd4600000, size 8192, enabled
    cap 01[50] = powerspec 3  supports D0 D3  current D0
    cap 05[70] = MSI supports 8 messages, 64 bit enabled with 1 message
    cap 11[90] = MSI-X supports 8 messages
                 Table in map 0x10[0x1000], PBA in map 0x10[0x1080]
    cap 10[a0] = PCI-Express 2 endpoint max data 128(128) NS
                 link x1(x1) speed 2.5(5.0) ASPM L1(L0s/L1) ClockPM enabled
    ecap 0001[100] = AER 1 0 fatal 0 non-fatal 1 corrected
    ecap 0003[140] = Serial 1 ffffffffffffffff
    ecap 0018[150] = LTR 1

alc0@pci0:4:0:0:	class=0x020000 card=0x18201043 chip=0x10631969 rev=0xc0 hdr=0x00
    vendor     = 'Qualcomm Atheros'
    device     = 'AR8131 Gigabit Ethernet'
    class      = network
    subclass   = ethernet
    bar   [10] = type Memory, range 64, base 0xd3200000, size 262144, enabled
    bar   [18] = type I/O Port, range 32, base 0xa000, size 128, enabled
    cap 01[40] = powerspec 3  supports D0 D3  current D0
    cap 05[48] = MSI supports 1 message, 64 bit enabled with 1 message
    cap 10[58] = PCI-Express 1 endpoint max data 128(4096)
                 link x1(x1) speed 2.5(2.5) ASPM L1(L0s/L1) ClockPM enabled
    cap 03[6c] = VPD
    ecap 0001[100] = AER 1 0 fatal 2 non-fatal 0 corrected
    ecap 0003[180] = Serial 1 ff44a94920cf30ff

hostb1@pci0:255:0:0:	class=0x060000 card=0x80868086 chip=0x2c628086 rev=0x05 hdr=0x00
    vendor     = 'Intel Corporation'
    device     = 'Core Processor QuickPath Architecture Generic Non-core Registers'
    class      = bridge
    subclass   = HOST-PCI

hostb2@pci0:255:0:1:	class=0x060000 card=0x80868086 chip=0x2d018086 rev=0x05 hdr=0x00
    vendor     = 'Intel Corporation'
    device     = 'Core Processor QuickPath Architecture System Address Decoder'
    class      = bridge
    subclass   = HOST-PCI

hostb3@pci0:255:2:0:	class=0x060000 card=0x80868086 chip=0x2d108086 rev=0x05 hdr=0x00
    vendor     = 'Intel Corporation'
    device     = 'Core Processor QPI Link 0'
    class      = bridge
    subclass   = HOST-PCI

hostb4@pci0:255:2:1:	class=0x060000 card=0x80868086 chip=0x2d118086 rev=0x05 hdr=0x00
    vendor     = 'Intel Corporation'
    device     = '1st Generation Core i3/5/7 Processor QPI Physical 0'
    class      = bridge
    subclass   = HOST-PCI

hostb5@pci0:255:2:2:	class=0x060000 card=0x80868086 chip=0x2d128086 rev=0x05 hdr=0x00
    vendor     = 'Intel Corporation'
    device     = '1st Generation Core i3/5/7 Processor Reserved'
    class      = bridge
    subclass   = HOST-PCI

hostb6@pci0:255:2:3:	class=0x060000 card=0x80868086 chip=0x2d138086 rev=0x05 hdr=0x00
    vendor     = 'Intel Corporation'
    device     = '1st Generation Core i3/5/7 Processor Reserved'
    class      = bridge
    subclass   = HOST-PCI
