hostb0@pci0:0:0:0:	class=0x060000 rev=0x05 hdr=0x00 vendor=0x8086 device=0x591f subvendor=0x103c subdevice=0x82a1
    vendor     = 'Intel Corporation'
    device     = 'Xeon E3-1200 v6/7th Gen Core Processor Host Bridge/DRAM Registers'
    class      = bridge
    subclass   = HOST-PCI
    cap 09[e0] = vendor (length 16) Intel cap 0 version 1

vgapci0@pci0:0:2:0:	class=0x030000 rev=0x04 hdr=0x00 vendor=0x8086 device=0x5912 subvendor=0x103c subdevice=0x82a1
    vendor     = 'Intel Corporation'
    device     = 'HD Graphics 630'
    class      = display
    subclass   = VGA
    bar   [10] = type Memory, range 64, base 0x1ffe000000, size 16777216, enabled
    bar   [18] = type Prefetchable Memory, range 64, base 0xd0000000, size 268435456, enabled
    bar   [20] = type I/O Port, range 32, base 0x6000, size 64, enabled
    cap 09[40] = vendor (length 12) Intel cap 0 version 1
    cap 10[70] = PCI-Express 2 root endpoint max data 128(128) FLR
                 max read 128
    cap 05[ac] = MSI supports 1 message 
    cap 01[d0] = powerspec 2  supports D0 D3  current D0
    ecap 001b[100] = Process Address Space ID 1
    ecap 000f[200] = ATS 1
    ecap 0013[300] = Page Page Request 1

xhci0@pci0:0:20:0:	class=0x0c0330 rev=0x00 hdr=0x00 vendor=0x8086 device=0xa2af subvendor=0x103c subdevice=0x82a1
    vendor     = 'Intel Corporation'
    device     = '200 Series/Z370 Chipset Family USB 3.0 xHCI Controller'
    class      = serial bus
    subclass   = USB
    bar   [10] = type Memory, range 64, base 0xe1600000, size 65536, enabled
    cap 01[70] = powerspec 2  supports D0 D3  current D0
    cap 05[80] = MSI supports 8 messages, 64 bit enabled with 1 message

none0@pci0:0:20:2:	class=0x118000 rev=0x00 hdr=0x00 vendor=0x8086 device=0xa2b1 subvendor=0x103c subdevice=0x82a1
    vendor     = 'Intel Corporation'
    device     = '200 Series PCH Thermal Subsystem'
    class      = dasp
    bar   [10] = type Memory, range 64, base 0x1fff016000, size 4096, enabled
    cap 01[50] = powerspec 3  supports D0 D3  current D0
    cap 05[80] = MSI supports 1 message 

none1@pci0:0:22:0:	class=0x078000 rev=0x00 hdr=0x00 vendor=0x8086 device=0xa2ba subvendor=0x103c subdevice=0x82a1
    vendor     = 'Intel Corporation'
    device     = '200 Series PCH CSME HECI'
    class      = simple comms
    bar   [10] = type Memory, range 64, base 0x1fff015000, size 4096, enabled
    cap 01[50] = powerspec 3  supports D0 D3  current D0
    cap 05[8c] = MSI supports 1 message, 64 bit 

ahci0@pci0:0:23:0:	class=0x010601 rev=0x00 hdr=0x00 vendor=0x8086 device=0xa282 subvendor=0x103c subdevice=0x82a1
    vendor     = 'Intel Corporation'
    device     = '200 Series PCH SATA controller [AHCI mode]'
    class      = mass storage
    subclass   = SATA
    bar   [10] = type Memory, range 32, base 0xe1614000, size 8192, enabled
    bar   [14] = type Memory, range 32, base 0xe1617000, size 256, enabled
    bar   [18] = type I/O Port, range 32, base 0x6080, size 8, enabled
    bar   [1c] = type I/O Port, range 32, base 0x6088, size 4, enabled
    bar   [20] = type I/O Port, range 32, base 0x6060, size 32, enabled
    bar   [24] = type Memory, range 32, base 0xe1616000, size 2048, enabled
    cap 05[80] = MSI supports 1 message enabled with 1 message
    cap 01[70] = powerspec 3  supports D0 D3  current D0
    cap 12[a8] = SATA Index-Data Pair

pcib1@pci0:0:28:0:	class=0x060400 rev=0xf0 hdr=0x01 vendor=0x8086 device=0xa294 subvendor=0x103c subdevice=0x82a1
    vendor     = 'Intel Corporation'
    device     = '200 Series PCH PCI Express Root Port'
    class      = bridge
    subclass   = PCI-PCI
    cap 10[40] = PCI-Express 2 root port max data 128(256) ARI disabled
                 max read 128
                 link x1(x1) speed 2.5(8.0) ASPM L1(L1)
                 slot 4 power limit 100 mW
    cap 05[80] = MSI supports 1 message 
    cap 0d[90] = PCI Bridge subvendor=0x103c subdevice=0x82a1
    cap 01[a0] = powerspec 3  supports D0 D3  current D0
    ecap 0001[100] = AER 1 0 fatal 0 non-fatal 0 corrected
    ecap 000d[140] = ACS 1
    ecap 0019[220] = PCIe Sec 1 lane errors 0

pcib2@pci0:0:29:0:	class=0x060400 rev=0xf0 hdr=0x01 vendor=0x8086 device=0xa298 subvendor=0x103c subdevice=0x82a1
    vendor     = 'Intel Corporation'
    device     = '200 Series PCH PCI Express Root Port'
    class      = bridge
    subclass   = PCI-PCI
    cap 10[40] = PCI-Express 2 root port max data 256(256) ARI disabled
                 max read 128
                 link x4(x4) speed 2.5(8.0) ASPM disabled(L0s/L1)
                 slot 8 power limit 250 mW
    cap 05[80] = MSI supports 1 message 
    cap 0d[90] = PCI Bridge subvendor=0x103c subdevice=0x82a1
    cap 01[a0] = powerspec 3  supports D0 D3  current D0
    ecap 0001[100] = AER 1 0 fatal 0 non-fatal 0 corrected
    ecap 000d[140] = ACS 1
    ecap 0019[220] = PCIe Sec 1 lane errors 0

isab0@pci0:0:31:0:	class=0x060100 rev=0x00 hdr=0x00 vendor=0x8086 device=0xa2c4 subvendor=0x103c subdevice=0x82a1
    vendor     = 'Intel Corporation'
    device     = '200 Series PCH LPC Controller (H270)'
    class      = bridge
    subclass   = PCI-ISA

none2@pci0:0:31:2:	class=0x058000 rev=0x00 hdr=0x00 vendor=0x8086 device=0xa2a1 subvendor=0x103c subdevice=0x82a1
    vendor     = 'Intel Corporation'
    device     = '200 Series/Z370 Chipset Family Power Management Controller'
    class      = memory
    bar   [10] = type Memory, range 32, base 0xe1610000, size 16384, enabled

hdac0@pci0:0:31:3:	class=0x040300 rev=0x00 hdr=0x00 vendor=0x8086 device=0xa2f0 subvendor=0x103c subdevice=0x82a1
    vendor     = 'Intel Corporation'
    device     = '200 Series PCH HD Audio'
    class      = multimedia
    subclass   = HDA
    bar   [10] = type Memory, range 64, base 0x1fff010000, size 16384, enabled
    bar   [20] = type Memory, range 64, base 0x1fff000000, size 65536, enabled
    cap 01[50] = powerspec 3  supports D0 D3  current D0
    cap 05[60] = MSI supports 1 message, 64 bit enabled with 1 message

ichsmb0@pci0:0:31:4:	class=0x0c0500 rev=0x00 hdr=0x00 vendor=0x8086 device=0xa2a3 subvendor=0x103c subdevice=0x82a1
    vendor     = 'Intel Corporation'
    device     = '200 Series/Z370 Chipset Family SMBus Controller'
    class      = serial bus
    subclass   = SMBus
    bar   [10] = type Memory, range 64, base 0x1fff014000, size 256, enabled
    bar   [20] = type I/O Port, range 32, base 0xefa0, size 32, enabled

re0@pci0:1:0:0:	class=0x020000 rev=0x15 hdr=0x00 vendor=0x10ec device=0x8168 subvendor=0x103c subdevice=0x82a1
    vendor     = 'Realtek Semiconductor Co., Ltd.'
    device     = 'RTL8111/8168/8411 PCI Express Gigabit Ethernet Controller'
    class      = network
    subclass   = ethernet
    bar   [10] = type I/O Port, range 32, base 0x5000, size 256, enabled
    bar   [18] = type Memory, range 64, base 0xe1504000, size 4096, enabled
    bar   [20] = type Memory, range 64, base 0xe1500000, size 16384, enabled
    cap 01[40] = powerspec 3  supports D0 D1 D2 D3  current D0
    cap 05[50] = MSI supports 1 message, 64 bit 
    cap 10[70] = PCI-Express 2 endpoint MSI 1 max data 128(128) RO
                 max read 4096
                 link x1(x1) speed 2.5(2.5) ASPM disabled(L0s/L1) ClockPM disabled
    cap 11[b0] = MSI-X supports 4 messages, enabled
                 Table in map 0x20[0x0], PBA in map 0x20[0x800]
    ecap 0001[100] = AER 2 0 fatal 0 non-fatal 0 corrected
    ecap 0002[140] = VC 1 max VC0
    ecap 0003[160] = Serial 1 01000000684ce000
    ecap 0018[170] = LTR 1
    ecap 001e[178] = L1 PM Substates 1

pcib3@pci0:2:0:0:	class=0x060400 rev=0x0e hdr=0x01 vendor=0x111d device=0x8018 subvendor=0x0000 subdevice=0x0000
    vendor     = 'Microsemi / PMC / IDT'
    device     = 'PES12N3A 12-lane 3-Port PCI Express Switch'
    class      = bridge
    subclass   = PCI-PCI
    cap 10[40] = PCI-Express 1 upstream port max data 256(2048)
                 max read 128
                 link x4(x4) speed 2.5(2.5) ASPM disabled(L0s/L1)
    cap 01[c0] = powerspec 3  supports D0 D3  current D0
    ecap 0001[100] = AER 1 0 fatal 0 non-fatal 1 corrected
    ecap 0002[200] = VC 1 max VC0

pcib4@pci0:3:2:0:	class=0x060400 rev=0x0e hdr=0x01 vendor=0x111d device=0x8018 subvendor=0x0000 subdevice=0x0000
    vendor     = 'Microsemi / PMC / IDT'
    device     = 'PES12N3A 12-lane 3-Port PCI Express Switch'
    class      = bridge
    subclass   = PCI-PCI
    cap 10[40] = PCI-Express 1 downstream port max data 256(2048)
                 max read 128
                 link x4(x4) speed 2.5(2.5) ASPM disabled(L0s/L1)
    cap 01[c0] = powerspec 3  supports D0 D3  current D0
    cap 05[d0] = MSI supports 1 message, 64 bit 
    ecap 0001[100] = AER 1 0 fatal 0 non-fatal 1 corrected
    ecap 0002[200] = VC 1 max VC0

pcib5@pci0:3:4:0:	class=0x060400 rev=0x0e hdr=0x01 vendor=0x111d device=0x8018 subvendor=0x0000 subdevice=0x0000
    vendor     = 'Microsemi / PMC / IDT'
    device     = 'PES12N3A 12-lane 3-Port PCI Express Switch'
    class      = bridge
    subclass   = PCI-PCI
    cap 10[40] = PCI-Express 1 downstream port max data 256(2048)
                 max read 128
                 link x4(x4) speed 2.5(2.5) ASPM disabled(L0s/L1)
    cap 01[c0] = powerspec 3  supports D0 D3  current D0
    cap 05[d0] = MSI supports 1 message, 64 bit 
    ecap 0001[100] = AER 1 0 fatal 0 non-fatal 1 corrected
    ecap 0002[200] = VC 1 max VC0

igb0@pci0:4:0:0:	class=0x020000 rev=0x01 hdr=0x00 vendor=0x8086 device=0x10e8 subvendor=0x8086 subdevice=0xa02c
    vendor     = 'Intel Corporation'
    device     = '82576 Gigabit Network Connection'
    class      = network
    subclass   = ethernet
    bar   [10] = type Memory, range 32, base 0xe1420000, size 131072, enabled
    bar   [14] = type Memory, range 32, base 0xe1000000, size 4194304, enabled
    bar   [18] = type I/O Port, range 32, base 0x4020, size 32, enabled
    bar   [1c] = type Memory, range 32, base 0xe1444000, size 16384, enabled
    cap 01[40] = powerspec 3  supports D0 D3  current D0
    cap 05[50] = MSI supports 1 message, 64 bit, vector masks 
    cap 11[70] = MSI-X supports 10 messages, enabled
                 Table in map 0x1c[0x0], PBA in map 0x1c[0x2000]
    cap 10[a0] = PCI-Express 2 endpoint max data 256(512) FLR RO NS
                 max read 512
                 link x4(x4) speed 2.5(2.5) ASPM disabled(L0s/L1)
    ecap 0001[100] = AER 1 0 fatal 0 non-fatal 1 corrected
    ecap 0003[140] = Serial 1 001b21ffff69bc18
    ecap 000e[150] = ARI 1
    ecap 0010[160] = SR-IOV 1 IOV disabled, Memory Space disabled, ARI disabled
                     0 VFs configured out of 8 supported
                     First VF RID Offset 0x0180, VF RID Stride 0x0002
                     VF Device ID 0x10ca
                     Page Sizes: 4096 (enabled), 8192, 65536, 262144, 1048576, 4194304

igb1@pci0:4:0:1:	class=0x020000 rev=0x01 hdr=0x00 vendor=0x8086 device=0x10e8 subvendor=0x8086 subdevice=0xa02c
    vendor     = 'Intel Corporation'
    device     = '82576 Gigabit Network Connection'
    class      = network
    subclass   = ethernet
    bar   [10] = type Memory, range 32, base 0xe1400000, size 131072, enabled
    bar   [14] = type Memory, range 32, base 0xe0c00000, size 4194304, enabled
    bar   [18] = type I/O Port, range 32, base 0x4000, size 32, enabled
    bar   [1c] = type Memory, range 32, base 0xe1440000, size 16384, enabled
    cap 01[40] = powerspec 3  supports D0 D3  current D0
    cap 05[50] = MSI supports 1 message, 64 bit, vector masks 
    cap 11[70] = MSI-X supports 10 messages, enabled
                 Table in map 0x1c[0x0], PBA in map 0x1c[0x2000]
    cap 10[a0] = PCI-Express 2 endpoint max data 256(512) FLR RO NS
                 max read 512
                 link x4(x4) speed 2.5(2.5) ASPM disabled(L0s/L1)
    ecap 0001[100] = AER 1 0 fatal 0 non-fatal 1 corrected
    ecap 0003[140] = Serial 1 001b21ffff69bc18
    ecap 000e[150] = ARI 1
    ecap 0010[160] = SR-IOV 1 IOV disabled, Memory Space disabled, ARI disabled
                     0 VFs configured out of 8 supported
                     First VF RID Offset 0x0180, VF RID Stride 0x0002
                     VF Device ID 0x10ca
                     Page Sizes: 4096 (enabled), 8192, 65536, 262144, 1048576, 4194304

igb2@pci0:5:0:0:	class=0x020000 rev=0x01 hdr=0x00 vendor=0x8086 device=0x10e8 subvendor=0x8086 subdevice=0xa02c
    vendor     = 'Intel Corporation'
    device     = '82576 Gigabit Network Connection'
    class      = network
    subclass   = ethernet
    bar   [10] = type Memory, range 32, base 0xe0820000, size 131072, enabled
    bar   [14] = type Memory, range 32, base 0xe0400000, size 4194304, enabled
    bar   [18] = type I/O Port, range 32, base 0x3020, size 32, enabled
    bar   [1c] = type Memory, range 32, base 0xe0844000, size 16384, enabled
    cap 01[40] = powerspec 3  supports D0 D3  current D0
    cap 05[50] = MSI supports 1 message, 64 bit, vector masks 
    cap 11[70] = MSI-X supports 10 messages, enabled
                 Table in map 0x1c[0x0], PBA in map 0x1c[0x2000]
    cap 10[a0] = PCI-Express 2 endpoint max data 256(512) FLR RO NS
                 max read 512
                 link x4(x4) speed 2.5(2.5) ASPM disabled(L0s/L1)
    ecap 0001[100] = AER 1 0 fatal 0 non-fatal 1 corrected
    ecap 0003[140] = Serial 1 001b21ffff69bc1c
    ecap 000e[150] = ARI 1
    ecap 0010[160] = SR-IOV 1 IOV disabled, Memory Space disabled, ARI disabled
                     0 VFs configured out of 8 supported
                     First VF RID Offset 0x0180, VF RID Stride 0x0002
                     VF Device ID 0x10ca
                     Page Sizes: 4096 (enabled), 8192, 65536, 262144, 1048576, 4194304

igb3@pci0:5:0:1:	class=0x020000 rev=0x01 hdr=0x00 vendor=0x8086 device=0x10e8 subvendor=0x8086 subdevice=0xa02c
    vendor     = 'Intel Corporation'
    device     = '82576 Gigabit Network Connection'
    class      = network
    subclass   = ethernet
    bar   [10] = type Memory, range 32, base 0xe0800000, size 131072, enabled
    bar   [14] = type Memory, range 32, base 0xe0000000, size 4194304, enabled
    bar   [18] = type I/O Port, range 32, base 0x3000, size 32, enabled
    bar   [1c] = type Memory, range 32, base 0xe0840000, size 16384, enabled
    cap 01[40] = powerspec 3  supports D0 D3  current D0
    cap 05[50] = MSI supports 1 message, 64 bit, vector masks 
    cap 11[70] = MSI-X supports 10 messages, enabled
                 Table in map 0x1c[0x0], PBA in map 0x1c[0x2000]
    cap 10[a0] = PCI-Express 2 endpoint max data 256(512) FLR RO NS
                 max read 512
                 link x4(x4) speed 2.5(2.5) ASPM disabled(L0s/L1)
    ecap 0001[100] = AER 1 0 fatal 0 non-fatal 1 corrected
    ecap 0003[140] = Serial 1 001b21ffff69bc1c
    ecap 000e[150] = ARI 1
    ecap 0010[160] = SR-IOV 1 IOV disabled, Memory Space disabled, ARI disabled
                     0 VFs configured out of 8 supported
                     First VF RID Offset 0x0180, VF RID Stride 0x0002
                     VF Device ID 0x10ca
                     Page Sizes: 4096 (enabled), 8192, 65536, 262144, 1048576, 4194304
