hostb0@pci0:0:0:0:	class=0x060000 rev=0x02 hdr=0x00 vendor=0x8086 device=0x2570 subvendor=0x1043 subdevice=0x80a5
    vendor     = 'Intel Corporation'
    device     = '82865G/PE/P DRAM Controller/Host-Hub Interface'
    class      = bridge
    subclass   = HOST-PCI
    bar   [10] = type Prefetchable Memory, range 32, base 0xfe800000, size 4194304, enabled
    cap 09[e4] = vendor (length 6) Intel cap 0 version 1

vgapci0@pci0:0:2:0:	class=0x030000 rev=0x02 hdr=0x00 vendor=0x8086 device=0x2572 subvendor=0x1043 subdevice=0x80a5
    vendor     = 'Intel Corporation'
    device     = '82865G Integrated Graphics Controller'
    class      = display
    subclass   = VGA
    bar   [10] = type Prefetchable Memory, range 32, base 0xf0000000, size 134217728, enabled
    bar   [14] = type Memory, range 32, base 0xfe780000, size 524288, enabled
    bar   [18] = type I/O Port, range 32, base 0xefe0, size 8, enabled
    cap 01[d0] = powerspec 1  supports D0 D3  current D0

uhci0@pci0:0:29:0:	class=0x0c0300 rev=0x02 hdr=0x00 vendor=0x8086 device=0x24d2 subvendor=0x1043 subdevice=0x80a6
    vendor     = 'Intel Corporation'
    device     = '82801EB/ER (ICH5/ICH5R) USB UHCI Controller'
    class      = serial bus
    subclass   = USB
    bar   [20] = type I/O Port, range 32, base 0xef00, size 32, enabled

uhci1@pci0:0:29:1:	class=0x0c0300 rev=0x02 hdr=0x00 vendor=0x8086 device=0x24d4 subvendor=0x1043 subdevice=0x80a6
    vendor     = 'Intel Corporation'
    device     = '82801EB/ER (ICH5/ICH5R) USB UHCI Controller'
    class      = serial bus
    subclass   = USB
    bar   [20] = type I/O Port, range 32, base 0xef20, size 32, enabled

uhci2@pci0:0:29:2:	class=0x0c0300 rev=0x02 hdr=0x00 vendor=0x8086 device=0x24d7 subvendor=0x1043 subdevice=0x80a6
    vendor     = 'Intel Corporation'
    device     = '82801EB/ER (ICH5/ICH5R) USB UHCI Controller'
    class      = serial bus
    subclass   = USB
    bar   [20] = type I/O Port, range 32, base 0xef40, size 32, enabled

uhci3@pci0:0:29:3:	class=0x0c0300 rev=0x02 hdr=0x00 vendor=0x8086 device=0x24de subvendor=0x1043 subdevice=0x80a6
    vendor     = 'Intel Corporation'
    device     = '82801EB/ER (ICH5/ICH5R) USB UHCI Controller'
    class      = serial bus
    subclass   = USB
    bar   [20] = type I/O Port, range 32, base 0xef80, size 32, enabled

ehci0@pci0:0:29:7:	class=0x0c0320 rev=0x02 hdr=0x00 vendor=0x8086 device=0x24dd subvendor=0x1043 subdevice=0x80a6
    vendor     = 'Intel Corporation'
    device     = '82801EB/ER (ICH5/ICH5R) USB2 EHCI Controller'
    class      = serial bus
    subclass   = USB
    bar   [10] = type Memory, range 32, base 0xfe77bc00, size 1024, enabled
    cap 01[50] = powerspec 2  supports D0 D3  current D0
    cap 0a[58] = EHCI Debug Port at offset 0xa0 in map 0x14

pcib1@pci0:0:30:0:	class=0x060400 rev=0xc2 hdr=0x01 vendor=0x8086 device=0x244e subvendor=0x0000 subdevice=0x0000
    vendor     = 'Intel Corporation'
    device     = '82801 PCI Bridge'
    class      = bridge
    subclass   = PCI-PCI

isab0@pci0:0:31:0:	class=0x060100 rev=0x02 hdr=0x00 vendor=0x8086 device=0x24d0 subvendor=0x0000 subdevice=0x0000
    vendor     = 'Intel Corporation'
    device     = '82801EB/ER (ICH5/ICH5R) LPC Interface Bridge'
    class      = bridge
    subclass   = PCI-ISA

atapci0@pci0:0:31:1:	class=0x01018a rev=0x02 hdr=0x00 vendor=0x8086 device=0x24db subvendor=0x1043 subdevice=0x80a6
    vendor     = 'Intel Corporation'
    device     = '82801EB/ER (ICH5/ICH5R) IDE Controller'
    class      = mass storage
    subclass   = ATA
    bar   [20] = type I/O Port, range 32, base 0xfc00, size 16, enabled
    bar   [24] = type Memory, range 32, base 0, size 1024, disabled

atapci1@pci0:0:31:2:	class=0x01018f rev=0x02 hdr=0x00 vendor=0x8086 device=0x24d1 subvendor=0x1043 subdevice=0x80a6
    vendor     = 'Intel Corporation'
    device     = '82801EB (ICH5) SATA Controller'
    class      = mass storage
    subclass   = ATA
    bar   [10] = type I/O Port, range 32, base 0xefa8, size 8, enabled
    bar   [14] = type I/O Port, range 32, base 0xefa4, size 4, enabled
    bar   [18] = type I/O Port, range 32, base 0xef68, size 8, enabled
    bar   [1c] = type I/O Port, range 32, base 0xefa0, size 4, enabled
    bar   [20] = type I/O Port, range 32, base 0xeed0, size 16, enabled

ichsmb0@pci0:0:31:3:	class=0x0c0500 rev=0x02 hdr=0x00 vendor=0x8086 device=0x24d3 subvendor=0x1043 subdevice=0x80a6
    vendor     = 'Intel Corporation'
    device     = '82801EB/ER (ICH5/ICH5R) SMBus Controller'
    class      = serial bus
    subclass   = SMBus
    bar   [20] = type I/O Port, range 32, base 0x400, size 32, enabled

pcm0@pci0:0:31:5:	class=0x040100 rev=0x02 hdr=0x00 vendor=0x8086 device=0x24d5 subvendor=0x1043 subdevice=0x80b0
    vendor     = 'Intel Corporation'
    device     = '82801EB/ER (ICH5/ICH5R) AC'97 Audio Controller'
    class      = multimedia
    subclass   = audio
    bar   [10] = type I/O Port, range 32, base 0xe800, size 256, enabled
    bar   [14] = type I/O Port, range 32, base 0xee80, size 64, enabled
    bar   [18] = type Memory, range 32, base 0xfe77b800, size 512, enabled
    bar   [1c] = type Memory, range 32, base 0xfe77b400, size 256, enabled
    cap 01[50] = powerspec 2  supports D0 D3  current D0

fxp0@pci0:1:8:0:	class=0x020000 rev=0x02 hdr=0x00 vendor=0x8086 device=0x1050 subvendor=0x1043 subdevice=0x80f8
    vendor     = 'Intel Corporation'
    device     = '82562EZ 10/100 Ethernet Controller'
    class      = network
    subclass   = ethernet
    bar   [10] = type Memory, range 32, base 0xfe5ff000, size 4096, enabled
    bar   [14] = type I/O Port, range 32, base 0xdf00, size 64, enabled
    cap 01[dc] = powerspec 2  supports D0 D1 D2 D3  current D0

xl0@pci0:1:9:0:	class=0x020000 rev=0x30 hdr=0x00 vendor=0x10b7 device=0x9055 subvendor=0x10b7 subdevice=0x9055
    vendor     = '3Com Corporation'
    device     = '3c905B 100BaseTX [Cyclone]'
    class      = network
    subclass   = ethernet
    bar   [10] = type I/O Port, range 32, base 0xdc00, size 128, enabled
    bar   [14] = type Memory, range 32, base 0xfe5fec00, size 128, enabled
    cap 01[dc] = powerspec 1  supports D0 D1 D2 D3  current D0

vr0@pci0:1:10:0:	class=0x020000 rev=0x8b hdr=0x00 vendor=0x1106 device=0x3106 subvendor=0x1186 subdevice=0x1405
    vendor     = 'VIA Technologies, Inc.'
    device     = 'VT6105/VT6106S [Rhine-III]'
    class      = network
    subclass   = ethernet
    bar   [10] = type I/O Port, range 32, base 0xd800, size 256, enabled
    bar   [14] = type Memory, range 32, base 0xfe5fe800, size 256, enabled
    cap 01[44] = powerspec 2  supports D0 D1 D2 D3  current D0

pcib2@pci0:1:11:0:	class=0x060400 rev=0x00 hdr=0x01 vendor=0x8086 device=0xb152 subvendor=0x0000 subdevice=0x0000
    vendor     = 'Intel Corporation'
    device     = '21152 PCI-to-PCI Bridge'
    class      = bridge
    subclass   = PCI-PCI
    cap 01[dc] = powerspec 2  supports D0 D3  current D0

ste0@pci0:2:4:0:	class=0x020000 rev=0x15 hdr=0x00 vendor=0x1186 device=0x1002 subvendor=0x1186 subdevice=0x1012
    vendor     = 'D-Link System Inc'
    device     = 'DL10050 Sundance Ethernet'
    class      = network
    subclass   = ethernet
    bar   [10] = type I/O Port, range 32, base 0xcc00, size 128, enabled
    cap 01[50] = powerspec 2  supports D0 D1 D2 D3  current D0

ste1@pci0:2:5:0:	class=0x020000 rev=0x15 hdr=0x00 vendor=0x1186 device=0x1002 subvendor=0x1186 subdevice=0x1012
    vendor     = 'D-Link System Inc'
    device     = 'DL10050 Sundance Ethernet'
    class      = network
    subclass   = ethernet
    bar   [10] = type I/O Port, range 32, base 0xc880, size 128, enabled
    cap 01[50] = powerspec 2  supports D0 D1 D2 D3  current D0

ste2@pci0:2:6:0:	class=0x020000 rev=0x15 hdr=0x00 vendor=0x1186 device=0x1002 subvendor=0x1186 subdevice=0x1012
    vendor     = 'D-Link System Inc'
    device     = 'DL10050 Sundance Ethernet'
    class      = network
    subclass   = ethernet
    bar   [10] = type I/O Port, range 32, base 0xc800, size 128, enabled
    cap 01[50] = powerspec 2  supports D0 D1 D2 D3  current D0

ste3@pci0:2:7:0:	class=0x020000 rev=0x15 hdr=0x00 vendor=0x1186 device=0x1002 subvendor=0x1186 subdevice=0x1012
    vendor     = 'D-Link System Inc'
    device     = 'DL10050 Sundance Ethernet'
    class      = network
    subclass   = ethernet
    bar   [10] = type I/O Port, range 32, base 0xc480, size 128, enabled
    cap 01[50] = powerspec 2  supports D0 D1 D2 D3  current D0
