hostb0@pci0:0:0:0:	class=0x060000 card=0x200d8086 chip=0x01008086 rev=0x09 hdr=0x00
    vendor     = 'Intel Corporation'
    device     = '2nd Generation Core Processor Family DRAM Controller'
    class      = bridge
    subclass   = HOST-PCI
    cap 09[e0] = vendor (length 12) Intel cap 0 version 1

pcib1@pci0:0:1:0:	class=0x060400 card=0x200d8086 chip=0x01018086 rev=0x09 hdr=0x01
    vendor     = 'Intel Corporation'
    device     = 'Xeon E3-1200/2nd Generation Core Processor Family PCI Express Root Port'
    class      = bridge
    subclass   = PCI-PCI
    cap 0d[88] = PCI Bridge card=0x200d8086
    cap 01[80] = powerspec 3  supports D0 D3  current D0
    cap 05[90] = MSI supports 1 message 
    cap 10[a0] = PCI-Express 2 root port max data 128(128)
                 max read 128
                 link x16(x16) speed 2.5(5.0) ASPM disabled(L0s/L1)
                 slot 0 power limit 75000 mW
    ecap 0002[100] = VC 1 max VC0
    ecap 0005[140] = Root Complex Link Declaration 1

none0@pci0:0:22:0:	class=0x078000 card=0x200d8086 chip=0x1c3a8086 rev=0x04 hdr=0x00
    vendor     = 'Intel Corporation'
    device     = '6 Series/C200 Series Chipset Family MEI Controller'
    class      = simple comms
    bar   [10] = type Memory, range 64, base 0xfe729000, size 16, enabled
    cap 01[50] = powerspec 3  supports D0 D3  current D0
    cap 05[8c] = MSI supports 1 message, 64 bit 

em0@pci0:0:25:0:	class=0x020000 card=0x200d8086 chip=0x15038086 rev=0x05 hdr=0x00
    vendor     = 'Intel Corporation'
    device     = '82579V Gigabit Network Connection'
    class      = network
    subclass   = ethernet
    bar   [10] = type Memory, range 32, base 0xfe700000, size 131072, enabled
    bar   [14] = type Memory, range 32, base 0xfe728000, size 4096, enabled
    bar   [18] = type I/O Port, range 32, base 0xf040, size 32, enabled
    cap 01[c8] = powerspec 2  supports D0 D3  current D0
    cap 05[d0] = MSI supports 1 message, 64 bit enabled with 1 message
    cap 13[e0] = PCI Advanced Features: FLR TP

ehci0@pci0:0:26:0:	class=0x0c0320 card=0x200d8086 chip=0x1c2d8086 rev=0x05 hdr=0x00
    vendor     = 'Intel Corporation'
    device     = '6 Series/C200 Series Chipset Family USB Enhanced Host Controller'
    class      = serial bus
    subclass   = USB
    bar   [10] = type Memory, range 32, base 0xfe727000, size 1024, enabled
    cap 01[50] = powerspec 2  supports D0 D3  current D0
    cap 0a[58] = EHCI Debug Port at offset 0xa0 in map 0x14
    cap 13[98] = PCI Advanced Features: FLR TP

hdac1@pci0:0:27:0:	class=0x040300 card=0x200d8086 chip=0x1c208086 rev=0x05 hdr=0x00
    vendor     = 'Intel Corporation'
    device     = '6 Series/C200 Series Chipset Family High Definition Audio Controller'
    class      = multimedia
    subclass   = HDA
    bar   [10] = type Memory, range 64, base 0xfe720000, size 16384, enabled
    cap 01[50] = powerspec 2  supports D0 D3  current D0
    cap 05[60] = MSI supports 1 message, 64 bit enabled with 1 message
    cap 10[70] = PCI-Express 1 root endpoint max data 128(128) FLR NS
                 max read 128
    ecap 0002[100] = VC 1 max VC1
    ecap 0005[130] = Root Complex Link Declaration 1

pcib2@pci0:0:28:0:	class=0x060400 card=0x200d8086 chip=0x1c108086 rev=0xb5 hdr=0x01
    vendor     = 'Intel Corporation'
    device     = '6 Series/C200 Series Chipset Family PCI Express Root Port 1'
    class      = bridge
    subclass   = PCI-PCI
    cap 10[40] = PCI-Express 2 root port max data 128(128)
                 max read 128
                 link x1(x1) speed 2.5(5.0) ASPM disabled(L0s/L1)
                 slot 0 power limit 100 mW
    cap 05[80] = MSI supports 1 message 
    cap 0d[90] = PCI Bridge card=0x200d8086
    cap 01[a0] = powerspec 2  supports D0 D3  current D0

ehci1@pci0:0:29:0:	class=0x0c0320 card=0x200d8086 chip=0x1c268086 rev=0x05 hdr=0x00
    vendor     = 'Intel Corporation'
    device     = '6 Series/C200 Series Chipset Family USB Enhanced Host Controller'
    class      = serial bus
    subclass   = USB
    bar   [10] = type Memory, range 32, base 0xfe726000, size 1024, enabled
    cap 01[50] = powerspec 2  supports D0 D3  current D0
    cap 0a[58] = EHCI Debug Port at offset 0xa0 in map 0x14
    cap 13[98] = PCI Advanced Features: FLR TP

isab0@pci0:0:31:0:	class=0x060100 card=0x200d8086 chip=0x1c5c8086 rev=0x05 hdr=0x00
    vendor     = 'Intel Corporation'
    device     = 'H61 Express Chipset LPC Controller'
    class      = bridge
    subclass   = PCI-ISA
    cap 09[e0] = vendor (length 12) Intel cap 1 version 0
		 features: AMT, 4 PCI-e x1 slots

ahci0@pci0:0:31:2:	class=0x010601 card=0x200d8086 chip=0x1c028086 rev=0x05 hdr=0x00
    vendor     = 'Intel Corporation'
    device     = '6 Series/C200 Series Chipset Family 6 port Desktop SATA AHCI Controller'
    class      = mass storage
    subclass   = SATA
    bar   [10] = type I/O Port, range 32, base 0xf090, size 8, enabled
    bar   [14] = type I/O Port, range 32, base 0xf080, size 4, enabled
    bar   [18] = type I/O Port, range 32, base 0xf070, size 8, enabled
    bar   [1c] = type I/O Port, range 32, base 0xf060, size 4, enabled
    bar   [20] = type I/O Port, range 32, base 0xf020, size 32, enabled
    bar   [24] = type Memory, range 32, base 0xfe725000, size 2048, enabled
    cap 05[80] = MSI supports 1 message enabled with 1 message
    cap 01[70] = powerspec 3  supports D0 D3  current D0
    cap 12[a8] = SATA Index-Data Pair
    cap 13[b0] = PCI Advanced Features: FLR TP

none1@pci0:0:31:3:	class=0x0c0500 card=0x200d8086 chip=0x1c228086 rev=0x05 hdr=0x00
    vendor     = 'Intel Corporation'
    device     = '6 Series/C200 Series Chipset Family SMBus Controller'
    class      = serial bus
    subclass   = SMBus
    bar   [10] = type Memory, range 64, base 0xfe724000, size 256, enabled
    bar   [20] = type I/O Port, range 32, base 0xf000, size 32, enabled

vgapci0@pci0:1:0:0:	class=0x030000 card=0x25421028 chip=0x94901002 rev=0x00 hdr=0x00
    vendor     = 'Advanced Micro Devices, Inc. [AMD/ATI]'
    device     = 'RV730 XT [Radeon HD 4670]'
    class      = display
    subclass   = VGA
    bar   [10] = type Prefetchable Memory, range 64, base 0xe0000000, size 268435456, enabled
    bar   [18] = type Memory, range 64, base 0xfe620000, size 65536, enabled
    bar   [20] = type I/O Port, range 32, base 0xe000, size 256, enabled
    cap 01[50] = powerspec 3  supports D0 D1 D2 D3  current D0
    cap 10[58] = PCI-Express 2 legacy endpoint max data 128(128) NS
                 max read 128
                 link x16(x16) speed 2.5(2.5) ASPM disabled(L0s/L1)
    cap 05[a0] = MSI supports 1 message, 64 bit 
    ecap 000b[100] = Vendor 1 ID 1

hdac0@pci0:1:0:1:	class=0x040300 card=0xaa381028 chip=0xaa381002 rev=0x00 hdr=0x00
    vendor     = 'Advanced Micro Devices, Inc. [AMD/ATI]'
    device     = 'RV710/730 HDMI Audio [Radeon HD 4000 series]'
    class      = multimedia
    subclass   = HDA
    bar   [10] = type Memory, range 64, base 0xfe630000, size 16384, enabled
    cap 01[50] = powerspec 3  supports D0 D1 D2 D3  current D0
    cap 10[58] = PCI-Express 2 legacy endpoint max data 128(128) NS
                 max read 128
                 link x16(x16) speed 2.5(2.5) ASPM disabled(L0s/L1)
    cap 05[a0] = MSI supports 1 message, 64 bit enabled with 1 message
    ecap 000b[100] = Vendor 1 ID 1

pcib3@pci0:2:0:0:	class=0x060400 card=0x200d8086 chip=0x88921283 rev=0x10 hdr=0x01
    vendor     = 'Integrated Technology Express, Inc.'
    device     = 'IT8892E PCIe to PCI Bridge'
    class      = bridge
    subclass   = PCI-PCI
    cap 10[70] = PCI-Express 1 PCI bridge max data 128(128)
                 max read 512
                 link x1(x1) speed undef(2.5) ASPM disabled(L0s/L1)
    cap 01[90] = powerspec 2  supports D0 D1 D2 D3  current D0
    cap 0d[a0] = PCI Bridge card=0x200d8086
    ecap 0003[100] = Serial 1 00000000832e7383
