hostb0@pci0:255:0:0:	class=0x060000 card=0x11681734 chip=0x2c508086 rev=0x04 hdr=0x00
    vendor     = 'Intel Corporation'
    device     = 'Core Processor QuickPath Architecture Generic Non-Core Registers'
    class      = bridge
    subclass   = HOST-PCI

hostb1@pci0:255:0:1:	class=0x060000 card=0x11681734 chip=0x2c818086 rev=0x04 hdr=0x00
    vendor     = 'Intel Corporation'
    device     = 'Core Processor QuickPath Architecture System Address Decoder'
    class      = bridge
    subclass   = HOST-PCI

hostb2@pci0:255:2:0:	class=0x060000 card=0x11681734 chip=0x2c908086 rev=0x04 hdr=0x00
    vendor     = 'Intel Corporation'
    device     = 'Core Processor QPI Link 0'
    class      = bridge
    subclass   = HOST-PCI

hostb3@pci0:255:2:1:	class=0x060000 card=0x11681734 chip=0x2c918086 rev=0x04 hdr=0x00
    vendor     = 'Intel Corporation'
    device     = 'Core Processor QPI Physical 0'
    class      = bridge
    subclass   = HOST-PCI

hostb4@pci0:255:3:0:	class=0x060000 card=0x11681734 chip=0x2c988086 rev=0x04 hdr=0x00
    vendor     = 'Intel Corporation'
    device     = 'Core Processor Integrated Memory Controller'
    class      = bridge
    subclass   = HOST-PCI

hostb5@pci0:255:3:1:	class=0x060000 card=0x11681734 chip=0x2c998086 rev=0x04 hdr=0x00
    vendor     = 'Intel Corporation'
    device     = 'Core Processor Integrated Memory Controller Target Address Decoder'
    class      = bridge
    subclass   = HOST-PCI

hostb6@pci0:255:3:2:	class=0x060000 card=0x11681734 chip=0x2c9a8086 rev=0x04 hdr=0x00
    vendor     = 'Intel Corporation'
    device     = 'Core Processor Integrated Memory Controller Test Registers'
    class      = bridge
    subclass   = HOST-PCI

hostb7@pci0:255:3:4:	class=0x060000 card=0x11681734 chip=0x2c9c8086 rev=0x04 hdr=0x00
    vendor     = 'Intel Corporation'
    device     = 'Core Processor Integrated Memory Controller Test Registers'
    class      = bridge
    subclass   = HOST-PCI

hostb8@pci0:255:4:0:	class=0x060000 card=0x11681734 chip=0x2ca08086 rev=0x04 hdr=0x00
    vendor     = 'Intel Corporation'
    device     = 'Core Processor Integrated Memory Controller Channel 0 Control Registers'
    class      = bridge
    subclass   = HOST-PCI

hostb9@pci0:255:4:1:	class=0x060000 card=0x11681734 chip=0x2ca18086 rev=0x04 hdr=0x00
    vendor     = 'Intel Corporation'
    device     = 'Core Processor Integrated Memory Controller Channel 0 Address Registers'
    class      = bridge
    subclass   = HOST-PCI

hostb10@pci0:255:4:2:	class=0x060000 card=0x11681734 chip=0x2ca28086 rev=0x04 hdr=0x00
    vendor     = 'Intel Corporation'
    device     = 'Core Processor Integrated Memory Controller Channel 0 Rank Registers'
    class      = bridge
    subclass   = HOST-PCI

hostb11@pci0:255:4:3:	class=0x060000 card=0x11681734 chip=0x2ca38086 rev=0x04 hdr=0x00
    vendor     = 'Intel Corporation'
    device     = 'Core Processor Integrated Memory Controller Channel 0 Thermal Control Registers'
    class      = bridge
    subclass   = HOST-PCI

hostb12@pci0:255:5:0:	class=0x060000 card=0x11681734 chip=0x2ca88086 rev=0x04 hdr=0x00
    vendor     = 'Intel Corporation'
    device     = 'Core Processor Integrated Memory Controller Channel 1 Control Registers'
    class      = bridge
    subclass   = HOST-PCI

hostb13@pci0:255:5:1:	class=0x060000 card=0x11681734 chip=0x2ca98086 rev=0x04 hdr=0x00
    vendor     = 'Intel Corporation'
    device     = 'Core Processor Integrated Memory Controller Channel 1 Address Registers'
    class      = bridge
    subclass   = HOST-PCI

hostb14@pci0:255:5:2:	class=0x060000 card=0x11681734 chip=0x2caa8086 rev=0x04 hdr=0x00
    vendor     = 'Intel Corporation'
    device     = 'Core Processor Integrated Memory Controller Channel 1 Rank Registers'
    class      = bridge
    subclass   = HOST-PCI

hostb15@pci0:255:5:3:	class=0x060000 card=0x11681734 chip=0x2cab8086 rev=0x04 hdr=0x00
    vendor     = 'Intel Corporation'
    device     = 'Core Processor Integrated Memory Controller Channel 1 Thermal Control Registers'
    class      = bridge
    subclass   = HOST-PCI

hostb16@pci0:0:0:0:	class=0x060000 card=0x00008086 chip=0xd1308086 rev=0x11 hdr=0x00
    vendor     = 'Intel Corporation'
    device     = 'Core Processor DMI'
    class      = bridge
    subclass   = HOST-PCI
    cap 00[40] = unknown

pcib3@pci0:0:3:0:	class=0x060400 card=0x11681734 chip=0xd1388086 rev=0x11 hdr=0x01
    vendor     = 'Intel Corporation'
    device     = 'Core Processor PCI Express Root Port 1'
    class      = bridge
    subclass   = PCI-PCI
    cap 0d[40] = PCI Bridge card=0x11681734
    cap 05[60] = MSI supports 2 messages, vector masks 
    cap 10[90] = PCI-Express 2 root port max data 128(256) ARI disabled
                 link x0(x4) speed 0.0(5.0) ASPM disabled(L0s/L1)
    cap 01[e0] = powerspec 3  supports D0 D3  current D0
    ecap 0001[100] = AER 1 0 fatal 0 non-fatal 0 corrected
    ecap 000d[150] = ACS 1
    ecap 000b[160] = Vendor 0pcib4@pci0:0:5:0:	class=0x060400 card=0x11681734 chip=0xd13a8086 rev=0x11 hdr=0x01
    vendor     = 'Intel Corporation'
    device     = 'Core Processor PCI Express Root Port 3'
    class      = bridge
    subclass   = PCI-PCI
    cap 0d[40] = PCI Bridge card=0x11681734
    cap 05[60] = MSI supports 2 messages, vector masks 
    cap 10[90] = PCI-Express 2 root port max data 128(256) ARI disabled
                 link x0(x4) speed 0.0(5.0) ASPM disabled(L0s/L1)
    cap 01[e0] = powerspec 3  supports D0 D3  current D0
    ecap 0001[100] = AER 1 0 fatal 0 non-fatal 0 corrected
    ecap 000d[150] = ACS 1
    ecap 0000[160] = unknown 0

none0@pci0:0:8:0:	class=0x088000 card=0x00680034 chip=0xd1558086 rev=0x11 hdr=0x00
    vendor     = 'Intel Corporation'
    device     = 'Core Processor System Management Registers'
    class      = base peripheral
    cap 10[40] = PCI-Express 2 root endpoint max data 128(128)
                 link x0(x0) ASPM disabled(L0s)
    ecap 000b[100] = Vendor 0none1@pci0:0:8:1:	class=0x088000 card=0x00680034 chip=0xd1568086 rev=0x11 hdr=0x00
    vendor     = 'Intel Corporation'
    device     = 'Core Processor Semaphore and Scratchpad Registers'
    class      = base peripheral
    cap 10[40] = PCI-Express 2 root endpoint max data 128(128)
                 link x0(x0) ASPM disabled(L0s)
    ecap 000b[100] = Vendor 0none2@pci0:0:8:2:	class=0x088000 card=0x00680034 chip=0xd1578086 rev=0x11 hdr=0x00
    vendor     = 'Intel Corporation'
    device     = 'Core Processor System Control and Status Registers'
    class      = base peripheral
    cap 10[40] = PCI-Express 2 root endpoint max data 128(128)
                 link x0(x0) ASPM disabled(L0s)
    ecap 000b[100] = Vendor 0none3@pci0:0:8:3:	class=0x088000 card=0x00680034 chip=0xd1588086 rev=0x11 hdr=0x00
    vendor     = 'Intel Corporation'
    device     = 'Core Processor Miscellaneous Registers'
    class      = base peripheral

none4@pci0:0:16:0:	class=0x088000 card=0x00680034 chip=0xd1508086 rev=0x11 hdr=0x00
    vendor     = 'Intel Corporation'
    device     = 'Core Processor QPI Link'
    class      = base peripheral

none5@pci0:0:16:1:	class=0x088000 card=0x00680034 chip=0xd1518086 rev=0x11 hdr=0x00
    vendor     = 'Intel Corporation'
    device     = 'Core Processor QPI Routing and Protocol Registers'
    class      = base peripheral

em0@pci0:0:25:0:	class=0x020000 card=0x11741734 chip=0x10ef8086 rev=0x05 hdr=0x00
    vendor     = 'Intel Corporation'
    device     = '82578DM Gigabit Network Connection'
    class      = network
    subclass   = ethernet
    bar   [10] = type Memory, range 32, base 0xce020000, size 131072, enabled
    bar   [14] = type Memory, range 32, base 0xce002000, size 4096, enabled
    bar   [18] = type I/O Port, range 32, base 0x1820, size 32, enabled
    cap 01[c8] = powerspec 2  supports D0 D3  current D0
    cap 05[d0] = MSI supports 1 message, 64 bit enabled with 1 message
    cap 13[e0] = PCI Advanced Features: FLR TP

ehci0@pci0:0:26:0:	class=0x0c0320 card=0x11671734 chip=0x3b3c8086 rev=0x05 hdr=0x00
    vendor     = 'Intel Corporation'
    device     = '5 Series/3400 Series Chipset USB2 Enhanced Host Controller'
    class      = serial bus
    subclass   = USB
    bar   [10] = type Memory, range 32, base 0xce003000, size 1024, enabled
    cap 01[50] = powerspec 2  supports D0 D3  current D0
    cap 0a[58] = EHCI Debug Port at offset 0xa0 in map 0x14
    cap 13[98] = PCI Advanced Features: FLR TP

pcib5@pci0:0:28:0:	class=0x060400 card=0x11671734 chip=0x3b428086 rev=0x05 hdr=0x01
    vendor     = 'Intel Corporation'
    device     = '5 Series/3400 Series Chipset PCI Express Root Port 1'
    class      = bridge
    subclass   = PCI-PCI
    cap 10[40] = PCI-Express 2 root port max data 128(128)
                 link x4(x4) speed 2.5(2.5) ASPM disabled(L0s/L1)
                 slot 1 power limit 25000 mW HotPlug(present) surprise
    cap 05[80] = MSI supports 1 message enabled with 1 message
    cap 0d[90] = PCI Bridge card=0x11671734
    cap 01[a0] = powerspec 2  supports D0 D3  current D0

pcib6@pci0:0:28:6:	class=0x060400 card=0x11671734 chip=0x3b4e8086 rev=0x05 hdr=0x01
    vendor     = 'Intel Corporation'
    device     = '5 Series/3400 Series Chipset PCI Express Root Port 7'
    class      = bridge
    subclass   = PCI-PCI
    cap 10[40] = PCI-Express 2 root port max data 128(128)
                 link x1(x1) speed 2.5(2.5) ASPM disabled(L0s/L1)
                 slot 7 power limit 10000 mW HotPlug(present) surprise
    cap 05[80] = MSI supports 1 message enabled with 1 message
    cap 0d[90] = PCI Bridge card=0x11671734
    cap 01[a0] = powerspec 2  supports D0 D3  current D0

pcib7@pci0:0:28:7:	class=0x060400 card=0x11671734 chip=0x3b508086 rev=0x05 hdr=0x01
    vendor     = 'Intel Corporation'
    device     = '5 Series/3400 Series Chipset PCI Express Root Port 8'
    class      = bridge
    subclass   = PCI-PCI
    cap 10[40] = PCI-Express 2 root port max data 128(128)
                 link x1(x1) speed 2.5(2.5) ASPM disabled(L0s/L1)
                 slot 8 power limit 10000 mW HotPlug(present) surprise
    cap 05[80] = MSI supports 1 message enabled with 1 message
    cap 0d[90] = PCI Bridge card=0x11671734
    cap 01[a0] = powerspec 2  supports D0 D3  current D0

ehci1@pci0:0:29:0:	class=0x0c0320 card=0x11671734 chip=0x3b348086 rev=0x05 hdr=0x00
    vendor     = 'Intel Corporation'
    device     = '5 Series/3400 Series Chipset USB2 Enhanced Host Controller'
    class      = serial bus
    subclass   = USB
    bar   [10] = type Memory, range 32, base 0xce004000, size 1024, enabled
    cap 01[50] = powerspec 2  supports D0 D3  current D0
    cap 0a[58] = EHCI Debug Port at offset 0xa0 in map 0x14
    cap 13[98] = PCI Advanced Features: FLR TP

pcib8@pci0:0:30:0:	class=0x060401 card=0x11671734 chip=0x244e8086 rev=0xa5 hdr=0x01
    vendor     = 'Intel Corporation'
    device     = '82801 PCI Bridge'
    class      = bridge
    subclass   = PCI-PCI
    cap 0d[50] = PCI Bridge card=0x11671734

isab0@pci0:0:31:0:	class=0x060100 card=0x11671734 chip=0x3b148086 rev=0x05 hdr=0x00
    vendor     = 'Intel Corporation'
    device     = '3420 Chipset LPC Interface Controller'
    class      = bridge
    subclass   = PCI-ISA
    cap 09[e0] = vendor (length 16) Intel cap 1 version 1

atapci0@pci0:0:31:2:	class=0x01018f card=0x11671734 chip=0x3b208086 rev=0x05 hdr=0x00
    vendor     = 'Intel Corporation'
    device     = '5 Series/3400 Series Chipset 4 port SATA IDE Controller'
    class      = mass storage
    subclass   = ATA
    bar   [10] = type I/O Port, range 32, base 0x18b0, size 8, enabled
    bar   [14] = type I/O Port, range 32, base 0x18a4, size 4, enabled
    bar   [18] = type I/O Port, range 32, base 0x18a8, size 8, enabled
    bar   [1c] = type I/O Port, range 32, base 0x18a0, size 4, enabled
    bar   [20] = type I/O Port, range 32, base 0x1870, size 16, enabled
    bar   [24] = type I/O Port, range 32, base 0x1860, size 16, enabled
    cap 01[70] = powerspec 3  supports D0 D3  current D0
    cap 13[b0] = PCI Advanced Features: FLR TP

none6@pci0:0:31:3:	class=0x0c0500 card=0x11671734 chip=0x3b308086 rev=0x05 hdr=0x00
    vendor     = 'Intel Corporation'
    device     = '5 Series/3400 Series Chipset SMBus Controller'
    class      = serial bus
    subclass   = SMBus
    bar   [10] = type Memory, range 64, base 0xce005000, size 256, enabled
    bar   [20] = type I/O Port, range 32, base 0x1840, size 32, enabled

atapci1@pci0:0:31:5:	class=0x010185 card=0x11671734 chip=0x3b268086 rev=0x05 hdr=0x00
    vendor     = 'Intel Corporation'
    device     = '5 Series/3400 Series Chipset 2 port SATA IDE Controller'
    class      = mass storage
    subclass   = ATA
    bar   [10] = type I/O Port, range 32, base 0x18c8, size 8, enabled
    bar   [14] = type I/O Port, range 32, base 0x18bc, size 4, enabled
    bar   [18] = type I/O Port, range 32, base 0x18c0, size 8, enabled
    bar   [1c] = type I/O Port, range 32, base 0x18b8, size 4, enabled
    bar   [20] = type I/O Port, range 32, base 0x1890, size 16, enabled
    bar   [24] = type I/O Port, range 32, base 0x1880, size 16, enabled
    cap 01[70] = powerspec 3  supports D0 D3  current D0
    cap 13[b0] = PCI Advanced Features: FLR TP

mfi0@pci0:5:0:0:	class=0x010400 card=0x11771734 chip=0x00731000 rev=0x03 hdr=0x00
    vendor     = 'Broadcom / LSI'
    device     = 'MegaRAID SAS 2008 [Falcon]'
    class      = mass storage
    subclass   = RAID
    bar   [10] = type I/O Port, range 32, base 0x2000, size 256, enabled
    bar   [14] = type Memory, range 64, base 0xce100000, size 16384, enabled
    bar   [1c] = type Memory, range 64, base 0xce180000, size 262144, enabled
    cap 01[50] = powerspec 3  supports D0 D1 D2 D3  current D0
    cap 10[68] = PCI-Express 2 endpoint max data 128(4096) FLR RO NS
                 link x4(x8) speed 2.5(5.0) ASPM disabled(L0s)
    cap 05[a8] = MSI supports 1 message, 64 bit enabled with 1 message
    cap 11[c0] = MSI-X supports 15 messages
                 Table in map 0x14[0x2000], PBA in map 0x14[0x3800]
    ecap 0001[100] = AER 1 0 fatal 0 non-fatal 1 corrected
    ecap 0004[138] = Power Budgeting 1

em1@pci0:6:0:0:	class=0x020000 card=0x11921734 chip=0x10d38086 rev=0x00 hdr=0x00
    vendor     = 'Intel Corporation'
    device     = '82574L Gigabit Network Connection'
    class      = network
    subclass   = ethernet
    bar   [10] = type Memory, range 32, base 0xce220000, size 131072, enabled
    bar   [18] = type I/O Port, range 32, base 0x3000, size 32, enabled
    bar   [1c] = type Memory, range 32, base 0xce200000, size 16384, enabled
    cap 01[c8] = powerspec 2  supports D0 D3  current D0
    cap 05[d0] = MSI supports 1 message, 64 bit 
    cap 10[e0] = PCI-Express 1 endpoint max data 128(256) RO NS
                 link x1(x1) speed 2.5(2.5) ASPM disabled(L0s/L1)
    cap 11[a0] = MSI-X supports 5 messages, enabled
                 Table in map 0x1c[0x0], PBA in map 0x1c[0x2000]
    ecap 0001[100] = AER 1 0 fatal 0 non-fatal 1 corrected
    ecap 0003[140] = Serial 1 00224dffff385d12

vgapci0@pci0:7:0:0:	class=0x030000 card=0x108e1734 chip=0x0522102b rev=0x02 hdr=0x00
    vendor     = 'Matrox Electronics Systems Ltd.'
    device     = 'MGA G200e [Pilot] ServerEngines (SEP1)'
    class      = display
    subclass   = VGA
    bar   [10] = type Prefetchable Memory, range 32, base 0xcf000000, size 16777216, enabled
    bar   [14] = type Memory, range 32, base 0xce300000, size 16384, enabled
    bar   [18] = type Memory, range 32, base 0xce800000, size 8388608, enabled
    cap 01[dc] = powerspec 2  supports D0 D3  current D0
    cap 10[e4] = PCI-Express 1 legacy endpoint max data 128(128)
                 link x1(x1) speed 2.5(2.5) ASPM disabled(L0s)
    cap 05[54] = MSI supports 1 message 
