hostb0@pci0:0:0:0:	class=0x060000 rev=0x18 hdr=0x00 vendor=0x8086 device=0x0040 subvendor=0x103c subdevice=0x2a9c
    vendor     = 'Intel Corporation'
    device     = 'Core Processor DRAM Controller'
    class      = bridge
    subclass   = HOST-PCI
    cap 09[e0] = vendor (length 12) Intel cap 0 version 1

pcib1@pci0:0:1:0:	class=0x060400 rev=0x18 hdr=0x01 vendor=0x8086 device=0x0041 subvendor=0x103c subdevice=0x2a9c
    vendor     = 'Intel Corporation'
    device     = 'Core Processor PCI Express x16 Root Port'
    class      = bridge
    subclass   = PCI-PCI
    cap 0d[88] = PCI Bridge subvendor=0x103c subdevice=0x2a9c
    cap 01[80] = powerspec 3  supports D0 D3  current D0
    cap 05[90] = MSI supports 1 message 
    cap 10[a0] = PCI-Express 2 root port max data 128(128)
                 max read 128
                 link x4(x16) speed 2.5(5.0) ASPM disabled(L0s/L1)
                 slot 0 power limit 0 mW
    ecap 0002[100] = VC 1 max VC0

vgapci0@pci0:0:2:0:	class=0x030000 rev=0x18 hdr=0x00 vendor=0x8086 device=0x0042 subvendor=0x103c subdevice=0x2a9c
    vendor     = 'Intel Corporation'
    device     = 'Core Processor Integrated Graphics Controller'
    class      = display
    subclass   = VGA
    bar   [10] = type Memory, range 64, base 0xfb800000, size 4194304, enabled
    bar   [18] = type Prefetchable Memory, range 64, base 0xd0000000, size 268435456, enabled
    bar   [20] = type I/O Port, range 32, base 0xcc00, size 8, enabled
    cap 05[90] = MSI supports 1 message 
    cap 01[d0] = powerspec 2  supports D0 D3  current D0
    cap 13[a4] = PCI Advanced Features: FLR TP

none0@pci0:0:22:0:	class=0x078000 rev=0x06 hdr=0x00 vendor=0x8086 device=0x3b64 subvendor=0x103c subdevice=0x2a9c
    vendor     = 'Intel Corporation'
    device     = '5 Series/3400 Series Chipset HECI Controller'
    class      = simple comms
    bar   [10] = type Memory, range 64, base 0xfbdfbc00, size 16, enabled
    cap 01[50] = powerspec 3  supports D0 D3  current D0
    cap 05[8c] = MSI supports 1 message, 64 bit 

ehci0@pci0:0:26:0:	class=0x0c0320 rev=0x06 hdr=0x00 vendor=0x8086 device=0x3b3c subvendor=0x103c subdevice=0x2a9c
    vendor     = 'Intel Corporation'
    device     = '5 Series/3400 Series Chipset USB2 Enhanced Host Controller'
    class      = serial bus
    subclass   = USB
    bar   [10] = type Memory, range 32, base 0xfbdf8000, size 1024, enabled
    cap 01[50] = powerspec 2  supports D0 D3  current D0
    cap 0a[58] = EHCI Debug Port at offset 0xa0 in map 0x14
    cap 13[98] = PCI Advanced Features: FLR TP

hdac0@pci0:0:27:0:	class=0x040300 rev=0x06 hdr=0x00 vendor=0x8086 device=0x3b56 subvendor=0x103c subdevice=0x2a9c
    vendor     = 'Intel Corporation'
    device     = '5 Series/3400 Series Chipset High Definition Audio'
    class      = multimedia
    subclass   = HDA
    bar   [10] = type Memory, range 64, base 0xfbdf4000, size 16384, enabled
    cap 01[50] = powerspec 2  supports D0 D3  current D0
    cap 05[60] = MSI supports 1 message, 64 bit enabled with 1 message
    cap 10[70] = PCI-Express 1 root endpoint max data 128(128) FLR NS
                 max read 128
    ecap 0002[100] = VC 1 max VC1
    ecap 0005[130] = Root Complex Link Declaration 1

pcib2@pci0:0:28:0:	class=0x060400 rev=0x06 hdr=0x01 vendor=0x8086 device=0x3b42 subvendor=0x103c subdevice=0x2a9c
    vendor     = 'Intel Corporation'
    device     = '5 Series/3400 Series Chipset PCI Express Root Port 1'
    class      = bridge
    subclass   = PCI-PCI
    cap 10[40] = PCI-Express 2 root port max data 128(128)
                 max read 128
                 link x1(x1) speed 2.5(2.5) ASPM disabled(L0s/L1)
                 slot 128 power limit 10000 mW HotPlug(present) surprise
    cap 05[80] = MSI supports 1 message enabled with 1 message
    cap 0d[90] = PCI Bridge subvendor=0x103c subdevice=0x2a9c
    cap 01[a0] = powerspec 2  supports D0 D3  current D0

ehci1@pci0:0:29:0:	class=0x0c0320 rev=0x06 hdr=0x00 vendor=0x8086 device=0x3b34 subvendor=0x103c subdevice=0x2a9c
    vendor     = 'Intel Corporation'
    device     = '5 Series/3400 Series Chipset USB2 Enhanced Host Controller'
    class      = serial bus
    subclass   = USB
    bar   [10] = type Memory, range 32, base 0xfbdf2000, size 1024, enabled
    cap 01[50] = powerspec 2  supports D0 D3  current D0
    cap 0a[58] = EHCI Debug Port at offset 0xa0 in map 0x14
    cap 13[98] = PCI Advanced Features: FLR TP

pcib3@pci0:0:30:0:	class=0x060401 rev=0xa6 hdr=0x01 vendor=0x8086 device=0x244e subvendor=0x103c subdevice=0x2a9c
    vendor     = 'Intel Corporation'
    device     = '82801 PCI Bridge'
    class      = bridge
    subclass   = PCI-PCI
    cap 0d[50] = PCI Bridge subvendor=0x103c subdevice=0x2a9c

isab0@pci0:0:31:0:	class=0x060100 rev=0x06 hdr=0x00 vendor=0x8086 device=0x3b08 subvendor=0x103c subdevice=0x2a9c
    vendor     = 'Intel Corporation'
    device     = 'H57 Chipset LPC Interface Controller'
    class      = bridge
    subclass   = PCI-ISA
    cap 09[e0] = vendor (length 16) Intel cap 1 version 1

ahci0@pci0:0:31:2:	class=0x010601 rev=0x06 hdr=0x00 vendor=0x8086 device=0x3b22 subvendor=0x103c subdevice=0x2a9c
    vendor     = 'Intel Corporation'
    device     = '5 Series/3400 Series Chipset 6 port SATA AHCI Controller'
    class      = mass storage
    subclass   = SATA
    bar   [10] = type I/O Port, range 32, base 0xc880, size 8, enabled
    bar   [14] = type I/O Port, range 32, base 0xc800, size 4, enabled
    bar   [18] = type I/O Port, range 32, base 0xc480, size 8, enabled
    bar   [1c] = type I/O Port, range 32, base 0xc400, size 4, enabled
    bar   [20] = type I/O Port, range 32, base 0xc080, size 32, enabled
    bar   [24] = type Memory, range 32, base 0xfbdf0000, size 2048, enabled
    cap 05[80] = MSI supports 1 message enabled with 1 message
    cap 01[70] = powerspec 3  supports D0 D3  current D0
    cap 12[a8] = SATA Index-Data Pair
    cap 13[b0] = PCI Advanced Features: FLR TP

ichsmb0@pci0:0:31:3:	class=0x0c0500 rev=0x06 hdr=0x00 vendor=0x8086 device=0x3b30 subvendor=0x103c subdevice=0x2a9c
    vendor     = 'Intel Corporation'
    device     = '5 Series/3400 Series Chipset SMBus Controller'
    class      = serial bus
    subclass   = SMBus
    bar   [10] = type Memory, range 64, base 0xfbdfb800, size 256, enabled
    bar   [20] = type I/O Port, range 32, base 0x400, size 32, enabled

em0@pci0:1:0:0:	class=0x020000 rev=0x06 hdr=0x00 vendor=0x8086 device=0x105e subvendor=0x8086 subdevice=0x135e
    vendor     = 'Intel Corporation'
    device     = '82571EB/82571GB Gigabit Ethernet Controller D0/D1 (copper applications)'
    class      = network
    subclass   = ethernet
    bar   [10] = type Memory, range 32, base 0xfbee0000, size 131072, enabled
    bar   [14] = type Memory, range 32, base 0xfbec0000, size 131072, enabled
    bar   [18] = type I/O Port, range 32, base 0xdc00, size 32, enabled
    cap 01[c8] = powerspec 2  supports D0 D3  current D0
    cap 05[d0] = MSI supports 1 message, 64 bit enabled with 1 message
    cap 10[e0] = PCI-Express 1 endpoint max data 128(256) RO NS
                 max read 512
                 link x4(x4) speed 2.5(2.5) ASPM disabled(L0s/L1)
    ecap 0001[100] = AER 1 0 fatal 1 non-fatal 1 corrected
    ecap 0003[140] = Serial 1 001517ffff4a44e2

em1@pci0:1:0:1:	class=0x020000 rev=0x06 hdr=0x00 vendor=0x8086 device=0x105e subvendor=0x8086 subdevice=0x135e
    vendor     = 'Intel Corporation'
    device     = '82571EB/82571GB Gigabit Ethernet Controller D0/D1 (copper applications)'
    class      = network
    subclass   = ethernet
    bar   [10] = type Memory, range 32, base 0xfbea0000, size 131072, enabled
    bar   [14] = type Memory, range 32, base 0xfbe80000, size 131072, enabled
    bar   [18] = type I/O Port, range 32, base 0xd880, size 32, enabled
    cap 01[c8] = powerspec 2  supports D0 D3  current D0
    cap 05[d0] = MSI supports 1 message, 64 bit enabled with 1 message
    cap 10[e0] = PCI-Express 1 endpoint max data 128(256) RO NS
                 max read 512
                 link x4(x4) speed 2.5(2.5) ASPM disabled(L0s/L1)
    ecap 0001[100] = AER 1 0 fatal 1 non-fatal 1 corrected
    ecap 0003[140] = Serial 1 001517ffff4a44e2

re0@pci0:2:0:0:	class=0x020000 rev=0x03 hdr=0x00 vendor=0x10ec device=0x8168 subvendor=0x103c subdevice=0x2a9c
    vendor     = 'Realtek Semiconductor Co., Ltd.'
    device     = 'RTL8111/8168/8411 PCI Express Gigabit Ethernet Controller'
    class      = network
    subclass   = ethernet
    bar   [10] = type I/O Port, range 32, base 0xe800, size 256, enabled
    bar   [18] = type Memory, range 64, base 0xfbfff000, size 4096, enabled
    bar   [20] = type Prefetchable Memory, range 64, base 0xfaffc000, size 16384, enabled
    cap 01[40] = powerspec 3  supports D0 D1 D2 D3  current D0
    cap 05[50] = MSI supports 1 message, 64 bit 
    cap 10[70] = PCI-Express 2 endpoint MSI 1 max data 128(128) RO
                 max read 512
                 link x1(x1) speed 2.5(2.5) ASPM disabled(L0s/L1) ClockPM disabled
    cap 11[ac] = MSI-X supports 4 messages, enabled
                 Table in map 0x20[0x0], PBA in map 0x20[0x800]
    cap 03[cc] = VPD
    ecap 0001[100] = AER 1 0 fatal 0 non-fatal 1 corrected
    ecap 0002[140] = VC 1 max VC0
    ecap 0003[160] = Serial 1 05000000684ce000
