hostb0@pci0:0:0:0:	class=0x060000 rev=0x01 hdr=0x00 vendor=0x8086 device=0x9a14 subvendor=0x0000 subdevice=0x0000
    vendor     = 'Intel Corporation'
    device     = '11th Gen Core Processor Host Bridge/DRAM Registers'
    class      = bridge
    subclass   = HOST-PCI
    cap 09[e0] = vendor (length 20) Intel cap 0 version 1

vgapci0@pci0:0:2:0:	class=0x030000 rev=0x01 hdr=0x00 vendor=0x8086 device=0x9a49 subvendor=0x1e39 subdevice=0xa029
    vendor     = 'Intel Corporation'
    device     = 'TigerLake-LP GT2 [Iris Xe Graphics]'
    class      = display
    subclass   = VGA
    bar   [10] = type Memory, range 64, base 0x601c000000, size 16777216, enabled
    bar   [18] = type Prefetchable Memory, range 64, base 0x4000000000, size 268435456, enabled
    bar   [20] = type I/O Port, range 32, base 0x3000, size 64, enabled
    cap 09[40] = vendor (length 12) Intel cap 0 version 1
    cap 10[70] = PCI-Express 2 root endpoint max data 128(128) FLR
                 max read 128
    cap 05[ac] = MSI supports 1 message, vector masks enabled with 1 message
    cap 01[d0] = powerspec 2  supports D0 D3  current D0
    ecap 001b[100] = Process Address Space ID 1
    ecap 000f[200] = ATS 1
    ecap 0013[300] = Page Page Request 1
    ecap 0010[320] = SR-IOV 1 IOV disabled, Memory Space disabled, ARI disabled
                     0 VFs configured out of 7 supported
                     First VF RID Offset 0x0001, VF RID Stride 0x0001
                     VF Device ID 0x9a49
                     Page Sizes: 4096 (enabled), 8192, 65536, 262144, 1048576, 4194304

pcib1@pci0:0:7:0:	class=0x060400 rev=0x01 hdr=0x01 vendor=0x8086 device=0x9a25 subvendor=0x0000 subdevice=0x0000
    vendor     = 'Intel Corporation'
    device     = 'Tiger Lake-LP Thunderbolt 4 PCI Express Root Port'
    class      = bridge
    subclass   = PCI-PCI
    cap 10[40] = PCI-Express 2 root port max data 128(128) ARI disabled
                 max read 128
                 link x0(x4) speed 0.0(2.5) ASPM L1(L1)
                 slot 0 power limit 0 mW HotPlug(empty) surprise
    cap 05[80] = MSI supports 1 message enabled with 1 message
    cap 0d[90] = PCI Bridge subvendor=0x0000 subdevice=0x0000
    cap 01[a0] = powerspec 3  supports D0 D3  current D0
    ecap 0000[100] = unknown 0
    ecap 000d[220] = ACS 1
    ecap 001d[a00] = Downstream Port Containment 1

none0@pci0:0:8:0:	class=0x088000 rev=0x01 hdr=0x00 vendor=0x8086 device=0x9a11 subvendor=0x0000 subdevice=0x0000
    vendor     = 'Intel Corporation'
    device     = 'GNA Scoring Accelerator module'
    class      = base peripheral
    bar   [10] = type Memory, range 64, base 0x601d17b000, size 4096, enabled
    cap 05[90] = MSI supports 1 message 
    cap 09[a0] = vendor (length 20) Intel cap 15 version 0
    cap 01[dc] = powerspec 2  supports D0 D3  current D0
    cap 13[f0] = PCI Advanced Features: FLR TP

none1@pci0:0:10:0:	class=0x118000 rev=0x01 hdr=0x00 vendor=0x8086 device=0x9a0d subvendor=0x0000 subdevice=0x0000
    vendor     = 'Intel Corporation'
    device     = 'Tigerlake Telemetry Aggregator Driver'
    class      = dasp
    bar   [10] = type Memory, range 64, base 0x601d160000, size 32768, enabled
    cap 10[70] = PCI-Express 2 root endpoint max data 128(128)
                 max read 128
    cap 01[d0] = powerspec 3  supports D0 D3  current D0
    ecap 0023[100] = Designated Vendor-Specific 1
    ecap 0023[110] = Designated Vendor-Specific 1
    ecap 0023[120] = Designated Vendor-Specific 1

xhci0@pci0:0:13:0:	class=0x0c0330 rev=0x01 hdr=0x00 vendor=0x8086 device=0x9a13 subvendor=0x0000 subdevice=0x0000
    vendor     = 'Intel Corporation'
    device     = 'Tiger Lake-LP Thunderbolt 4 USB Controller'
    class      = serial bus
    subclass   = USB
    bar   [10] = type Memory, range 64, base 0x601d150000, size 65536, enabled
    cap 01[70] = powerspec 2  supports D0 D3  current D0
    cap 05[80] = MSI supports 8 messages, 64 bit enabled with 1 message
    cap 09[90] = vendor (length 20) Intel cap 15 version 0
    cap 09[b0] = vendor (length 0) Intel cap 0 version 1

none2@pci0:0:13:2:	class=0x0c0340 rev=0x01 hdr=0x00 vendor=0x8086 device=0x9a1b subvendor=0x2222 subdevice=0x1111
    vendor     = 'Intel Corporation'
    device     = 'Tiger Lake-LP Thunderbolt 4 NHI'
    class      = serial bus
    subclass   = USB
    bar   [10] = type Memory, range 64, base 0x601d100000, size 262144, enabled
    bar   [18] = type Memory, range 64, base 0x601d17a000, size 4096, enabled
    cap 01[80] = powerspec 3  supports D0 D1 D2 D3  current D0
    cap 05[88] = MSI supports 1 message, 64 bit 
    cap 11[a0] = MSI-X supports 16 messages
                 Table in map 0x18[0x0], PBA in map 0x18[0xfa0]

xhci1@pci0:0:20:0:	class=0x0c0330 rev=0x20 hdr=0x00 vendor=0x8086 device=0xa0ed subvendor=0x0000 subdevice=0x0000
    vendor     = 'Intel Corporation'
    device     = 'Tiger Lake-LP USB 3.2 Gen 2x1 xHCI Host Controller'
    class      = serial bus
    subclass   = USB
    bar   [10] = type Memory, range 64, base 0x601d140000, size 65536, enabled
    cap 01[70] = powerspec 2  supports D0 D3  current D0
    cap 05[80] = MSI supports 8 messages, 64 bit enabled with 1 message
    cap 09[90] = vendor (length 20) Intel cap 15 version 0
    cap 09[b0] = vendor (length 0) Intel cap 0 version 1

none3@pci0:0:20:2:	class=0x050000 rev=0x20 hdr=0x00 vendor=0x8086 device=0xa0ef subvendor=0x0000 subdevice=0x0000
    vendor     = 'Intel Corporation'
    device     = 'Tiger Lake-LP Shared SRAM'
    class      = memory
    subclass   = RAM
    bar   [10] = type Memory, range 64, base 0x601d170000, size 16384, enabled
    bar   [18] = type Memory, range 64, base 0x601d179000, size 4096, enabled
    cap 01[80] = powerspec 3  supports D0 D3  current D0

iwlwifi0@pci0:0:20:3:	class=0x028000 rev=0x20 hdr=0x00 vendor=0x8086 device=0xa0f0 subvendor=0x8086 subdevice=0x0074
    vendor     = 'Intel Corporation'
    device     = 'Wi-Fi 6 AX201'
    class      = network
    bar   [10] = type Memory, range 64, base 0x601d16c000, size 16384, enabled
    cap 01[c8] = powerspec 3  supports D0 D3  current D0
    cap 05[d0] = MSI supports 1 message, 64 bit 
    cap 10[40] = PCI-Express 2 root endpoint max data 128(128) FLR RO NS
                 max read 128
    cap 11[80] = MSI-X supports 16 messages, enabled
                 Table in map 0x10[0x2000], PBA in map 0x10[0x3000]
    ecap 0018[100] = LTR 1
    ecap 000b[164] = Vendor [1] ID 0010 Rev 0 Length 20

ig4iic0@pci0:0:21:0:	class=0x0c8000 rev=0x20 hdr=0x00 vendor=0x8086 device=0xa0e8 subvendor=0x0000 subdevice=0x0000
    vendor     = 'Intel Corporation'
    device     = 'Tiger Lake-LP Serial IO I2C Controller'
    class      = serial bus
    bar   [10] = type Memory, range 64, base 0x80000000, size 4096, enabled
    cap 01[80] = powerspec 3  supports D0 D3  current D0
    cap 09[90] = vendor (length 20) Intel cap 15 version 0

none4@pci0:0:22:0:	class=0x078000 rev=0x20 hdr=0x00 vendor=0x8086 device=0xa0e0 subvendor=0x0000 subdevice=0x0000
    vendor     = 'Intel Corporation'
    device     = 'Tiger Lake-LP Management Engine Interface'
    class      = simple comms
    bar   [10] = type Memory, range 64, base 0x601d177000, size 4096, enabled
    cap 01[50] = powerspec 3  supports D0 D3  current D0
    cap 05[8c] = MSI supports 1 message, 64 bit 
    cap 09[a4] = vendor (length 20) Intel cap 15 version 0

pcib2@pci0:0:29:0:	class=0x060400 rev=0x20 hdr=0x01 vendor=0x8086 device=0xa0b0 subvendor=0x0000 subdevice=0x0000
    vendor     = 'Intel Corporation'
    device     = 'Tiger Lake-LP PCI Express Root Port'
    class      = bridge
    subclass   = PCI-PCI
    cap 10[40] = PCI-Express 2 root port max data 256(256) ARI enabled
                 max read 128
                 link x4(x4) speed 8.0(8.0) ASPM L1(L1)
                 slot 12 power limit 250 mW
    cap 05[80] = MSI supports 1 message 
    cap 0d[90] = PCI Bridge subvendor=0x0000 subdevice=0x0000
    cap 01[a0] = powerspec 3  supports D0 D3  current D0
    ecap 0001[100] = AER 1 0 fatal 0 non-fatal 0 corrected
    ecap 000d[220] = ACS 1
    ecap 001f[150] = Precision Time Measurement 1
    ecap 001e[200] = L1 PM Substates 1
    ecap 0019[a30] = PCIe Sec 1 lane errors 0
    ecap 001d[a00] = Downstream Port Containment 1

none5@pci0:0:30:0:	class=0x078000 rev=0x20 hdr=0x00 vendor=0x8086 device=0xa0a8 subvendor=0x0000 subdevice=0x0000
    vendor     = 'Intel Corporation'
    device     = 'Tiger Lake-LP Serial IO UART Controller'
    class      = simple comms
    bar   [10] = type Memory, range 64, base 0, size 4096, disabled
    cap 01[80] = powerspec 3  supports D0 D3  current D0
    cap 09[90] = vendor (length 20) Intel cap 15 version 0

none6@pci0:0:30:3:	class=0x0c8000 rev=0x20 hdr=0x00 vendor=0x8086 device=0xa0ab subvendor=0x0000 subdevice=0x0000
    vendor     = 'Intel Corporation'
    device     = 'Tiger Lake-LP Serial IO SPI Controller'
    class      = serial bus
    bar   [10] = type Memory, range 64, base 0, size 4096, disabled
    cap 01[80] = powerspec 3  supports D0 D3  current D0
    cap 09[90] = vendor (length 20) Intel cap 15 version 0

isab0@pci0:0:31:0:	class=0x060100 rev=0x20 hdr=0x00 vendor=0x8086 device=0xa082 subvendor=0x0000 subdevice=0x0000
    vendor     = 'Intel Corporation'
    device     = 'Tiger Lake-LP LPC Controller'
    class      = bridge
    subclass   = PCI-ISA

hdac0@pci0:0:31:3:	class=0x040100 rev=0x20 hdr=0x00 vendor=0x8086 device=0xa0c8 subvendor=0x1e39 subdevice=0xb036
    vendor     = 'Intel Corporation'
    device     = 'Tiger Lake-LP Smart Sound Technology Audio Controller'
    class      = multimedia
    subclass   = audio
    bar   [10] = type Memory, range 64, base 0x601d168000, size 16384, enabled
    bar   [20] = type Memory, range 64, base 0x601d000000, size 1048576, enabled
    cap 01[50] = powerspec 3  supports D0 D3  current D0
    cap 09[80] = vendor (length 20) Intel cap 15 version 0
    cap 05[60] = MSI supports 1 message, 64 bit enabled with 1 message

ichsmb0@pci0:0:31:4:	class=0x0c0500 rev=0x20 hdr=0x00 vendor=0x8086 device=0xa0a3 subvendor=0x0000 subdevice=0x0000
    vendor     = 'Intel Corporation'
    device     = 'Tiger Lake-LP SMBus Controller'
    class      = serial bus
    subclass   = SMBus
    bar   [10] = type Memory, range 64, base 0x601d174000, size 256, enabled
    bar   [20] = type I/O Port, range 32, base 0xefa0, size 32, enabled

none7@pci0:0:31:5:	class=0x0c8000 rev=0x20 hdr=0x00 vendor=0x8086 device=0xa0a4 subvendor=0x0000 subdevice=0x0000
    vendor     = 'Intel Corporation'
    device     = 'Tiger Lake-LP SPI Controller'
    class      = serial bus
    bar   [10] = type Memory, range 32, base 0xfe010000, size 4096, enabled

nvme0@pci0:44:0:0:	class=0x010802 rev=0x01 hdr=0x00 vendor=0x1987 device=0x5012 subvendor=0x1987 subdevice=0x5012
    vendor     = 'Phison Electronics Corporation'
    device     = 'E12 NVMe Controller'
    class      = mass storage
    subclass   = NVM
    bar   [10] = type Memory, range 64, base 0x5e300000, size 16384, enabled
    cap 10[80] = PCI-Express 2 endpoint max data 256(256) FLR RO NS
                 max read 512
                 link x4(x4) speed 8.0(8.0) ASPM L1(L1)
    cap 11[d0] = MSI-X supports 9 messages, enabled
                 Table in map 0x10[0x2000], PBA in map 0x10[0x3000]
    cap 05[e0] = MSI supports 8 messages, 64 bit 
    cap 01[f8] = powerspec 3  supports D0 D3  current D0
    ecap 0018[100] = LTR 1
    ecap 001e[110] = L1 PM Substates 1
    ecap 000e[128] = ARI 1
    ecap 0001[200] = AER 2 0 fatal 0 non-fatal 0 corrected
    ecap 0019[300] = PCIe Sec 1 lane errors 0
