hostb0@pci0:0:0:0:	class=0x060000 rev=0x20 hdr=0x00 vendor=0x8086 device=0x4003 subvendor=0x103c subdevice=0x1306
    vendor     = 'Intel Corporation'
    device     = '5400 Chipset Memory Controller Hub'
    class      = bridge
    subclass   = HOST-PCI
    cap 01[50] = powerspec 3  supports D0 D3  current D0
    cap 05[58] = MSI supports 2 messages 
    cap 10[6c] = PCI-Express 2 root port max data 128(256)
                 max read 128
                 link x4(x4) speed 2.5(2.5) ASPM disabled(L0s/L1)
    ecap 0001[100] = AER 1 0 fatal 0 non-fatal 0 corrected

pcib1@pci0:0:1:0:	class=0x060400 rev=0x20 hdr=0x01 vendor=0x8086 device=0x4021 subvendor=0x103c subdevice=0x1306
    vendor     = 'Intel Corporation'
    device     = '5400 Chipset PCI Express Port 1'
    class      = bridge
    subclass   = PCI-PCI
    cap 01[50] = powerspec 3  supports D0 D3  current D0
    cap 05[58] = MSI supports 2 messages 
    cap 10[6c] = PCI-Express 2 root port max data 128(256)
                 max read 128
                 link x0(x8) speed 0.0(5.0) ASPM disabled(L0s/L1)
                 slot 0 power limit 150000 mW
    cap 0d[b0] = PCI Bridge subvendor=0x103c subdevice=0x1306
    ecap 0001[100] = AER 1 0 fatal 0 non-fatal 0 corrected

pcib2@pci0:0:3:0:	class=0x060400 rev=0x20 hdr=0x01 vendor=0x8086 device=0x4023 subvendor=0x103c subdevice=0x1306
    vendor     = 'Intel Corporation'
    device     = '5400 Chipset PCI Express Port 3'
    class      = bridge
    subclass   = PCI-PCI
    cap 01[50] = powerspec 3  supports D0 D3  current D0
    cap 05[58] = MSI supports 2 messages 
    cap 10[6c] = PCI-Express 2 root port max data 128(256)
                 max read 128
                 link x4(x8) speed 2.5(5.0) ASPM disabled(L0s/L1)
                 slot 0 power limit 25000 mW
    cap 0d[b0] = PCI Bridge subvendor=0x103c subdevice=0x1306
    ecap 0001[100] = AER 1 0 fatal 0 non-fatal 0 corrected

pcib6@pci0:0:5:0:	class=0x060400 rev=0x20 hdr=0x01 vendor=0x8086 device=0x4025 subvendor=0x103c subdevice=0x1306
    vendor     = 'Intel Corporation'
    device     = '5400 Chipset PCI Express Port 5'
    class      = bridge
    subclass   = PCI-PCI
    cap 01[50] = powerspec 3  supports D0 D3  current D0
    cap 05[58] = MSI supports 2 messages 
    cap 10[6c] = PCI-Express 2 root port max data 128(256)
                 max read 128
                 link x16(x16) speed 2.5(5.0) ASPM disabled(L0s/L1)
                 slot 0 power limit 150000 mW
    cap 0d[b0] = PCI Bridge subvendor=0x103c subdevice=0x1306
    ecap 0001[100] = AER 1 0 fatal 0 non-fatal 0 corrected

pcib7@pci0:0:9:0:	class=0x060400 rev=0x20 hdr=0x01 vendor=0x8086 device=0x4029 subvendor=0x103c subdevice=0x1306
    vendor     = 'Intel Corporation'
    device     = '5400 Chipset PCI Express Port 9'
    class      = bridge
    subclass   = PCI-PCI
    cap 01[50] = powerspec 3  supports D0 D3  current D0
    cap 05[58] = MSI supports 2 messages 
    cap 10[6c] = PCI-Express 2 root port max data 128(256)
                 max read 128
                 link x4(x4) speed 2.5(5.0) ASPM disabled(L0s/L1)
                 slot 0 power limit 25000 mW
    cap 0d[b0] = PCI Bridge subvendor=0x103c subdevice=0x1306
    ecap 0001[100] = AER 1 0 fatal 0 non-fatal 0 corrected

hostb1@pci0:0:16:0:	class=0x060000 rev=0x20 hdr=0x00 vendor=0x8086 device=0x4030 subvendor=0x103c subdevice=0x1306
    vendor     = 'Intel Corporation'
    device     = '5400 Chipset FSB Registers'
    class      = bridge
    subclass   = HOST-PCI

hostb2@pci0:0:16:1:	class=0x060000 rev=0x20 hdr=0x00 vendor=0x8086 device=0x4030 subvendor=0x103c subdevice=0x1306
    vendor     = 'Intel Corporation'
    device     = '5400 Chipset FSB Registers'
    class      = bridge
    subclass   = HOST-PCI

hostb3@pci0:0:16:2:	class=0x060000 rev=0x20 hdr=0x00 vendor=0x8086 device=0x4030 subvendor=0x103c subdevice=0x1306
    vendor     = 'Intel Corporation'
    device     = '5400 Chipset FSB Registers'
    class      = bridge
    subclass   = HOST-PCI

hostb4@pci0:0:16:3:	class=0x060000 rev=0x20 hdr=0x00 vendor=0x8086 device=0x4030 subvendor=0x8086 subdevice=0x8086
    vendor     = 'Intel Corporation'
    device     = '5400 Chipset FSB Registers'
    class      = bridge
    subclass   = HOST-PCI

hostb5@pci0:0:16:4:	class=0x060000 rev=0x20 hdr=0x00 vendor=0x8086 device=0x4030 subvendor=0x8086 subdevice=0x8086
    vendor     = 'Intel Corporation'
    device     = '5400 Chipset FSB Registers'
    class      = bridge
    subclass   = HOST-PCI

hostb6@pci0:0:17:0:	class=0x060000 rev=0x20 hdr=0x00 vendor=0x8086 device=0x4031 subvendor=0x103c subdevice=0x1306
    vendor     = 'Intel Corporation'
    device     = '5400 Chipset CE/SF Registers'
    class      = bridge
    subclass   = HOST-PCI

hostb7@pci0:0:21:0:	class=0x060000 rev=0x20 hdr=0x00 vendor=0x8086 device=0x4035 subvendor=0x103c subdevice=0x1306
    vendor     = 'Intel Corporation'
    device     = '5400 Chipset FBD Registers'
    class      = bridge
    subclass   = HOST-PCI

hostb8@pci0:0:21:1:	class=0x060000 rev=0x20 hdr=0x00 vendor=0x8086 device=0x4035 subvendor=0x103c subdevice=0x1306
    vendor     = 'Intel Corporation'
    device     = '5400 Chipset FBD Registers'
    class      = bridge
    subclass   = HOST-PCI

hostb9@pci0:0:22:0:	class=0x060000 rev=0x20 hdr=0x00 vendor=0x8086 device=0x4036 subvendor=0x103c subdevice=0x1306
    vendor     = 'Intel Corporation'
    device     = '5400 Chipset FBD Registers'
    class      = bridge
    subclass   = HOST-PCI

hostb10@pci0:0:22:1:	class=0x060000 rev=0x20 hdr=0x00 vendor=0x8086 device=0x4036 subvendor=0x103c subdevice=0x1306
    vendor     = 'Intel Corporation'
    device     = '5400 Chipset FBD Registers'
    class      = bridge
    subclass   = HOST-PCI

pcib12@pci0:0:28:0:	class=0x060400 rev=0x09 hdr=0x01 vendor=0x8086 device=0x2690 subvendor=0x103c subdevice=0x1306
    vendor     = 'Intel Corporation'
    device     = '631xESB/632xESB/3100 Chipset PCI Express Root Port 1'
    class      = bridge
    subclass   = PCI-PCI
    cap 10[40] = PCI-Express 1 root port max data 128(128)
                 max read 128
                 link x1(x1) speed 2.5(2.5) ASPM disabled(L0s/L1)
    cap 05[80] = MSI supports 1 message 
    cap 0d[90] = PCI Bridge subvendor=0x103c subdevice=0x1306
    cap 01[a0] = powerspec 2  supports D0 D3  current D0
    ecap 0002[100] = VC 1 max VC1
    ecap 0005[180] = Root Complex Link Declaration 1

pcib13@pci0:0:28:1:	class=0x060400 rev=0x09 hdr=0x01 vendor=0x8086 device=0x2692 subvendor=0x103c subdevice=0x1306
    vendor     = 'Intel Corporation'
    device     = '631xESB/632xESB/3100 Chipset PCI Express Root Port 2'
    class      = bridge
    subclass   = PCI-PCI
    cap 10[40] = PCI-Express 1 root port max data 128(128)
                 max read 128
                 link x1(x1) speed 2.5(2.5) ASPM disabled(L0s/L1)
    cap 05[80] = MSI supports 1 message 
    cap 0d[90] = PCI Bridge subvendor=0x103c subdevice=0x1306
    cap 01[a0] = powerspec 2  supports D0 D3  current D0
    ecap 0002[100] = VC 1 max VC1
    ecap 0005[180] = Root Complex Link Declaration 1

uhci0@pci0:0:29:0:	class=0x0c0300 rev=0x09 hdr=0x00 vendor=0x8086 device=0x2688 subvendor=0x103c subdevice=0x1306
    vendor     = 'Intel Corporation'
    device     = '631xESB/632xESB/3100 Chipset UHCI USB Controller'
    class      = serial bus
    subclass   = USB
    bar   [20] = type I/O Port, range 32, base 0x5000, size 32, enabled

uhci1@pci0:0:29:1:	class=0x0c0300 rev=0x09 hdr=0x00 vendor=0x8086 device=0x2689 subvendor=0x103c subdevice=0x1306
    vendor     = 'Intel Corporation'
    device     = '631xESB/632xESB/3100 Chipset UHCI USB Controller'
    class      = serial bus
    subclass   = USB
    bar   [20] = type I/O Port, range 32, base 0x5020, size 32, enabled

uhci2@pci0:0:29:2:	class=0x0c0300 rev=0x09 hdr=0x00 vendor=0x8086 device=0x268a subvendor=0x103c subdevice=0x1306
    vendor     = 'Intel Corporation'
    device     = '631xESB/632xESB/3100 Chipset UHCI USB Controller'
    class      = serial bus
    subclass   = USB
    bar   [20] = type I/O Port, range 32, base 0x5040, size 32, enabled

uhci3@pci0:0:29:3:	class=0x0c0300 rev=0x09 hdr=0x00 vendor=0x8086 device=0x268b subvendor=0x103c subdevice=0x1306
    vendor     = 'Intel Corporation'
    device     = '631xESB/632xESB/3100 Chipset UHCI USB Controller'
    class      = serial bus
    subclass   = USB
    bar   [20] = type I/O Port, range 32, base 0x5060, size 32, enabled

ehci0@pci0:0:29:7:	class=0x0c0320 rev=0x09 hdr=0x00 vendor=0x8086 device=0x268c subvendor=0x103c subdevice=0x1306
    vendor     = 'Intel Corporation'
    device     = '631xESB/632xESB/3100 Chipset EHCI USB2 Controller'
    class      = serial bus
    subclass   = USB
    bar   [10] = type Memory, range 32, base 0xd3d04000, size 1024, enabled
    cap 01[50] = powerspec 2  supports D0 D3  current D0
    cap 0a[58] = EHCI Debug Port at offset 0xa0 in map 0x14

pcib14@pci0:0:30:0:	class=0x060401 rev=0xd9 hdr=0x01 vendor=0x8086 device=0x244e subvendor=0x103c subdevice=0x1306
    vendor     = 'Intel Corporation'
    device     = '82801 PCI Bridge'
    class      = bridge
    subclass   = PCI-PCI
    cap 0d[50] = PCI Bridge subvendor=0x103c subdevice=0x1306

isab0@pci0:0:31:0:	class=0x060100 rev=0x09 hdr=0x00 vendor=0x8086 device=0x2670 subvendor=0x103c subdevice=0x1306
    vendor     = 'Intel Corporation'
    device     = '631xESB/632xESB/3100 Chipset LPC Interface Controller'
    class      = bridge
    subclass   = PCI-ISA

atapci0@pci0:0:31:1:	class=0x01018a rev=0x09 hdr=0x00 vendor=0x8086 device=0x269e subvendor=0x103c subdevice=0x1306
    vendor     = 'Intel Corporation'
    device     = '631xESB/632xESB IDE Controller'
    class      = mass storage
    subclass   = ATA
    bar   [20] = type I/O Port, range 32, base 0x50c0, size 16, enabled

ahci0@pci0:0:31:2:	class=0x010400 rev=0x09 hdr=0x00 vendor=0x8086 device=0x2682 subvendor=0x103c subdevice=0x1306
    vendor     = 'Intel Corporation'
    device     = '631xESB/632xESB SATA RAID Controller'
    class      = mass storage
    subclass   = RAID
    bar   [10] = type I/O Port, range 32, base 0x50e0, size 8, enabled
    bar   [14] = type I/O Port, range 32, base 0x50f8, size 4, enabled
    bar   [18] = type I/O Port, range 32, base 0x50e8, size 8, enabled
    bar   [1c] = type I/O Port, range 32, base 0x50fc, size 4, enabled
    bar   [20] = type I/O Port, range 32, base 0x5080, size 32, enabled
    bar   [24] = type Memory, range 32, base 0xd3d04400, size 1024, enabled
    cap 01[70] = powerspec 2  supports D0 D3  current D0
    cap 12[a8] = SATA Index-Data Pair

pcib3@pci0:160:0:0:	class=0x060400 rev=0x04 hdr=0x01 vendor=0x111d device=0x8018 subvendor=0x0000 subdevice=0x0000
    vendor     = 'Microsemi / PMC / IDT'
    device     = 'PES12N3A 12-lane 3-Port PCI Express Switch'
    class      = bridge
    subclass   = PCI-PCI
    cap 10[40] = PCI-Express 1 upstream port max data 128(2048)
                 max read 128
                 link x4(x4) speed 2.5(2.5) ASPM disabled(L0s/L1)
    cap 01[70] = powerspec 2  supports D0 D3  current D0
    ecap 0002[100] = VC 1 max VC0

pcib4@pci0:161:0:0:	class=0x060400 rev=0x04 hdr=0x01 vendor=0x111d device=0x8018 subvendor=0x0000 subdevice=0x0000
    vendor     = 'Microsemi / PMC / IDT'
    device     = 'PES12N3A 12-lane 3-Port PCI Express Switch'
    class      = bridge
    subclass   = PCI-PCI
    cap 10[40] = PCI-Express 1 downstream port max data 128(2048)
                 max read 128
                 link x4(x4) speed 2.5(2.5) ASPM disabled(L0s/L1)
    cap 01[70] = powerspec 2  supports D0 D3  current D0
    cap 05[7c] = MSI supports 1 message, 64 bit 
    ecap 0002[100] = VC 1 max VC0

pcib5@pci0:161:1:0:	class=0x060400 rev=0x04 hdr=0x01 vendor=0x111d device=0x8018 subvendor=0x0000 subdevice=0x0000
    vendor     = 'Microsemi / PMC / IDT'
    device     = 'PES12N3A 12-lane 3-Port PCI Express Switch'
    class      = bridge
    subclass   = PCI-PCI
    cap 10[40] = PCI-Express 1 downstream port max data 128(2048)
                 max read 128
                 link x4(x4) speed 2.5(2.5) ASPM disabled(L0s/L1)
    cap 01[70] = powerspec 2  supports D0 D3  current D0
    cap 05[7c] = MSI supports 1 message, 64 bit 
    ecap 0002[100] = VC 1 max VC0

em0@pci0:162:0:0:	class=0x020000 rev=0x06 hdr=0x00 vendor=0x8086 device=0x10a4 subvendor=0x8086 subdevice=0x10a4
    vendor     = 'Intel Corporation'
    device     = '82571EB Gigabit Ethernet Controller'
    class      = network
    subclass   = ethernet
    bar   [10] = type Memory, range 32, base 0xd3800000, size 131072, enabled
    bar   [14] = type Memory, range 32, base 0xd3820000, size 131072, enabled
    bar   [18] = type I/O Port, range 32, base 0x2000, size 32, disabled
    cap 01[c8] = powerspec 2  supports D0 D3  current D0
    cap 05[d0] = MSI supports 1 message, 64 bit enabled with 1 message
    cap 10[e0] = PCI-Express 1 endpoint max data 128(256) RO NS
                 max read 512
                 link x4(x4) speed 2.5(2.5) ASPM disabled(L0s)
    ecap 0001[100] = AER 1 0 fatal 1 non-fatal 0 corrected
    ecap 0003[140] = Serial 1 001517ffff57eb34

em1@pci0:162:0:1:	class=0x020000 rev=0x06 hdr=0x00 vendor=0x8086 device=0x10a4 subvendor=0x8086 subdevice=0x10a4
    vendor     = 'Intel Corporation'
    device     = '82571EB Gigabit Ethernet Controller'
    class      = network
    subclass   = ethernet
    bar   [10] = type Memory, range 32, base 0xd3840000, size 131072, enabled
    bar   [14] = type Memory, range 32, base 0xd3860000, size 131072, enabled
    bar   [18] = type I/O Port, range 32, base 0x2020, size 32, disabled
    cap 01[c8] = powerspec 2  supports D0 D3  current D0
    cap 05[d0] = MSI supports 1 message, 64 bit enabled with 1 message
    cap 10[e0] = PCI-Express 1 endpoint max data 128(256) RO NS
                 max read 512
                 link x4(x4) speed 2.5(2.5) ASPM disabled(L0s)
    ecap 0001[100] = AER 1 0 fatal 1 non-fatal 0 corrected
    ecap 0003[140] = Serial 1 001517ffff57eb34

em2@pci0:163:0:0:	class=0x020000 rev=0x06 hdr=0x00 vendor=0x8086 device=0x10a4 subvendor=0x8086 subdevice=0x10a4
    vendor     = 'Intel Corporation'
    device     = '82571EB Gigabit Ethernet Controller'
    class      = network
    subclass   = ethernet
    bar   [10] = type Memory, range 32, base 0xd3700000, size 131072, enabled
    bar   [14] = type Memory, range 32, base 0xd3720000, size 131072, enabled
    bar   [18] = type I/O Port, range 32, base 0x1000, size 32, disabled
    cap 01[c8] = powerspec 2  supports D0 D3  current D0
    cap 05[d0] = MSI supports 1 message, 64 bit enabled with 1 message
    cap 10[e0] = PCI-Express 1 endpoint max data 128(256) RO NS
                 max read 512
                 link x4(x4) speed 2.5(2.5) ASPM disabled(L0s)
    ecap 0001[100] = AER 1 0 fatal 1 non-fatal 0 corrected
    ecap 0003[140] = Serial 1 001517ffff57eb36

em3@pci0:163:0:1:	class=0x020000 rev=0x06 hdr=0x00 vendor=0x8086 device=0x10a4 subvendor=0x8086 subdevice=0x10a4
    vendor     = 'Intel Corporation'
    device     = '82571EB Gigabit Ethernet Controller'
    class      = network
    subclass   = ethernet
    bar   [10] = type Memory, range 32, base 0xd3740000, size 131072, enabled
    bar   [14] = type Memory, range 32, base 0xd3760000, size 131072, enabled
    bar   [18] = type I/O Port, range 32, base 0x1020, size 32, disabled
    cap 01[c8] = powerspec 2  supports D0 D3  current D0
    cap 05[d0] = MSI supports 1 message, 64 bit enabled with 1 message
    cap 10[e0] = PCI-Express 1 endpoint max data 128(256) RO NS
                 max read 512
                 link x4(x4) speed 2.5(2.5) ASPM disabled(L0s)
    ecap 0001[100] = AER 1 0 fatal 1 non-fatal 0 corrected
    ecap 0003[140] = Serial 1 001517ffff57eb36

vgapci0@pci0:96:0:0:	class=0x030000 rev=0xa1 hdr=0x00 vendor=0x10de device=0x0ffd subvendor=0x103c subdevice=0x0967
    vendor     = 'NVIDIA Corporation'
    device     = 'GK107 [NVS 510]'
    class      = display
    subclass   = VGA
    bar   [10] = type Memory, range 32, base 0xd2000000, size 16777216, enabled
    bar   [14] = type Prefetchable Memory, range 64, base 0xc0000000, size 268435456, enabled
    bar   [1c] = type Prefetchable Memory, range 64, base 0xd0000000, size 33554432, enabled
    bar   [24] = type I/O Port, range 32, base 0x3000, size 128, enabled
    cap 01[60] = powerspec 3  supports D0 D3  current D0
    cap 05[68] = MSI supports 1 message, 64 bit 
    cap 10[78] = PCI-Express 2 endpoint max data 128(256) RO NS
                 max read 512
                 link x16(x16) speed 2.5(8.0) ASPM disabled(L0s/L1) ClockPM disabled
    cap 09[b4] = vendor (length 20)
    ecap 0002[100] = VC 1 max VC0
    ecap 0004[128] = Power Budgeting 1
    ecap 000b[600] = Vendor [1] ID 0001 Rev 1 Length 36
    ecap 0019[900] = PCIe Sec 1 lane errors 0

hdac0@pci0:96:0:1:	class=0x040300 rev=0xa1 hdr=0x00 vendor=0x10de device=0x0e1b subvendor=0x103c subdevice=0x0967
    vendor     = 'NVIDIA Corporation'
    device     = 'GK107 HDMI Audio Controller'
    class      = multimedia
    subclass   = HDA
    bar   [10] = type Memory, range 32, base 0xd3000000, size 16384, enabled
    cap 01[60] = powerspec 3  supports D0 D3  current D0
    cap 05[68] = MSI supports 1 message, 64 bit enabled with 1 message
    cap 10[78] = PCI-Express 2 endpoint max data 128(256) RO NS
                 max read 512
                 link x16(x16) speed 2.5(8.0) ASPM L0s/L1(L0s/L1) ClockPM disabled

pcib8@pci0:16:0:0:	class=0x060400 rev=0x01 hdr=0x01 vendor=0x8086 device=0x3500 subvendor=0x103c subdevice=0x1306
    vendor     = 'Intel Corporation'
    device     = '6311ESB/6321ESB PCI Express Upstream Port'
    class      = bridge
    subclass   = PCI-PCI
    cap 10[44] = PCI-Express 1 upstream port max data 128(256)
                 max read 4096
                 link x4(x8) speed 2.5(2.5) ASPM disabled(L0s)
    cap 01[70] = powerspec 2  supports D0 D3  current D0
    cap 0d[80] = PCI Bridge subvendor=0x103c subdevice=0x1306
    ecap 0001[100] = AER 1 0 fatal 1 non-fatal 0 corrected

pcib11@pci0:16:0:3:	class=0x060400 rev=0x01 hdr=0x01 vendor=0x8086 device=0x350c subvendor=0x103c subdevice=0x1306
    vendor     = 'Intel Corporation'
    device     = '6311ESB/6321ESB PCI Express to PCI-X Bridge'
    class      = bridge
    subclass   = PCI-PCI
    cap 10[44] = PCI-Express 1 PCI bridge max data 128(256)
                 max read 256
                 link x4(x8) speed 2.5(2.5) ASPM disabled(L0s)
    cap 01[6c] = powerspec 2  supports D0 D3  current D0
    cap 0d[80] = PCI Bridge subvendor=0x103c subdevice=0x1306
    cap 07[d8] = PCI-X bridge 
    ecap 0001[100] = AER 1 0 fatal 1 non-fatal 0 corrected

pcib9@pci0:30:0:0:	class=0x060400 rev=0x01 hdr=0x01 vendor=0x8086 device=0x3510 subvendor=0x103c subdevice=0x1306
    vendor     = 'Intel Corporation'
    device     = '6311ESB/6321ESB PCI Express Downstream Port E1'
    class      = bridge
    subclass   = PCI-PCI
    cap 10[44] = PCI-Express 1 downstream port max data 128(256)
                 max read 4096
                 link x0(x4) speed 0.0(2.5) ASPM disabled(L0s)
    cap 05[60] = MSI supports 1 message, 64 bit 
    cap 01[70] = powerspec 2  supports D0 D3  current D0
    cap 0d[80] = PCI Bridge subvendor=0x103c subdevice=0x1306
    ecap 0001[100] = AER 1 0 fatal 0 non-fatal 0 corrected

pcib10@pci0:30:1:0:	class=0x060400 rev=0x01 hdr=0x01 vendor=0x8086 device=0x3514 subvendor=0x103c subdevice=0x1306
    vendor     = 'Intel Corporation'
    device     = '6311ESB/6321ESB PCI Express Downstream Port E2'
    class      = bridge
    subclass   = PCI-PCI
    cap 10[44] = PCI-Express 1 downstream port max data 128(256)
                 max read 4096
                 link x4(x4) speed 2.5(2.5) ASPM disabled(L0s)
    cap 05[60] = MSI supports 1 message, 64 bit 
    cap 01[70] = powerspec 2  supports D0 D3  current D0
    cap 0d[80] = PCI Bridge subvendor=0x103c subdevice=0x1306
    ecap 0001[100] = AER 1 0 fatal 0 non-fatal 0 corrected

ix0@pci0:64:0:0:	class=0x020000 rev=0x01 hdr=0x00 vendor=0x8086 device=0x1528 subvendor=0x8086 subdevice=0x5003
    vendor     = 'Intel Corporation'
    device     = 'Ethernet Controller 10-Gigabit X540-AT2'
    class      = network
    subclass   = ethernet
    bar   [10] = type Prefetchable Memory, range 64, base 0xd3200000, size 2097152, enabled
    bar   [20] = type Prefetchable Memory, range 64, base 0xd3600000, size 16384, enabled
    cap 01[40] = powerspec 3  supports D0 D3  current D0
    cap 05[50] = MSI supports 1 message, 64 bit, vector masks 
    cap 11[70] = MSI-X supports 64 messages, enabled
                 Table in map 0x20[0x0], PBA in map 0x20[0x2000]
    cap 10[a0] = PCI-Express 2 endpoint max data 128(512) FLR RO NS
                 max read 512
                 link x4(x8) speed 2.5(5.0) ASPM disabled(L0s/L1)
    cap 03[e0] = VPD
    ecap 0001[100] = AER 2 0 fatal 0 non-fatal 1 corrected
    ecap 000e[150] = ARI 1
    ecap 0010[160] = SR-IOV 1 IOV disabled, Memory Space disabled, ARI disabled
                     0 VFs configured out of 64 supported
                     First VF RID Offset 0x0180, VF RID Stride 0x0002
                     VF Device ID 0x1515
                     Page Sizes: 4096 (enabled), 8192, 65536, 262144, 1048576, 4194304
    ecap 000d[1d0] = ACS 1

ix1@pci0:64:0:1:	class=0x020000 rev=0x01 hdr=0x00 vendor=0x8086 device=0x1528 subvendor=0x8086 subdevice=0x5003
    vendor     = 'Intel Corporation'
    device     = 'Ethernet Controller 10-Gigabit X540-AT2'
    class      = network
    subclass   = ethernet
    bar   [10] = type Prefetchable Memory, range 64, base 0xd3400000, size 2097152, enabled
    bar   [20] = type Prefetchable Memory, range 64, base 0xd3604000, size 16384, enabled
    cap 01[40] = powerspec 3  supports D0 D3  current D0
    cap 05[50] = MSI supports 1 message, 64 bit, vector masks 
    cap 11[70] = MSI-X supports 64 messages, enabled
                 Table in map 0x20[0x0], PBA in map 0x20[0x2000]
    cap 10[a0] = PCI-Express 2 endpoint max data 128(512) FLR RO NS
                 max read 512
                 link x4(x8) speed 2.5(5.0) ASPM disabled(L0s/L1)
    cap 03[e0] = VPD
    ecap 0001[100] = AER 2 0 fatal 0 non-fatal 1 corrected
    ecap 000e[150] = ARI 1
    ecap 0010[160] = SR-IOV 1 IOV disabled, Memory Space disabled, ARI disabled
                     0 VFs configured out of 64 supported
                     First VF RID Offset 0x0180, VF RID Stride 0x0002
                     VF Device ID 0x1515
                     Page Sizes: 4096 (enabled), 8192, 65536, 262144, 1048576, 4194304
    ecap 000d[1d0] = ACS 1

mpt0@pci0:17:6:0:	class=0x010000 rev=0x02 hdr=0x00 vendor=0x1000 device=0x0054 subvendor=0x103c subdevice=0x0a98
    vendor     = 'Broadcom / LSI'
    device     = 'SAS1068 PCI-X Fusion-MPT SAS'
    class      = mass storage
    subclass   = SCSI
    bar   [10] = type I/O Port, range 32, base 0x4000, size 256, disabled
    bar   [14] = type Memory, range 64, base 0xd3910000, size 16384, enabled
    bar   [1c] = type Memory, range 64, base 0xd3900000, size 65536, enabled
    cap 01[50] = powerspec 2  supports D0 D1 D2 D3  current D0
    cap 05[98] = MSI supports 1 message, 64 bit 
    cap 07[68] = PCI-X 64-bit supports 133MHz, 2048 burst read, 16 split transactions
    cap 11[b0] = MSI-X supports 1 message, enabled
                 Table in map 0x14[0x2000], PBA in map 0x14[0x3000]

bge0@pci0:14:0:0:	class=0x020000 rev=0x02 hdr=0x00 vendor=0x14e4 device=0x167b subvendor=0x103c subdevice=0x1306
    vendor     = 'Broadcom Inc. and subsidiaries'
    device     = 'NetXtreme BCM5755 Gigabit Ethernet PCI Express'
    class      = network
    subclass   = ethernet
    bar   [10] = type Memory, range 64, base 0xd3b00000, size 65536, enabled
    cap 01[48] = powerspec 3  supports D0 D3  current D0
    cap 03[50] = VPD
    cap 09[58] = vendor (length 120)
    cap 05[e8] = MSI supports 1 message, 64 bit enabled with 1 message
    cap 10[d0] = PCI-Express 1 endpoint max data 128(128)
                 max read 4096
                 link x1(x1) speed 2.5(2.5) ASPM disabled(L0s)
    ecap 0001[100] = AER 1 0 fatal 0 non-fatal 1 corrected
    ecap 0002[13c] = VC 1 max VC0
    ecap 0003[160] = Serial 1 0025b3fffe2839c9
    ecap 0004[16c] = Power Budgeting 1

bge1@pci0:15:0:0:	class=0x020000 rev=0x02 hdr=0x00 vendor=0x14e4 device=0x167b subvendor=0x103c subdevice=0x1306
    vendor     = 'Broadcom Inc. and subsidiaries'
    device     = 'NetXtreme BCM5755 Gigabit Ethernet PCI Express'
    class      = network
    subclass   = ethernet
    bar   [10] = type Memory, range 64, base 0xd3100000, size 65536, enabled
    cap 01[48] = powerspec 3  supports D0 D3  current D0
    cap 03[50] = VPD
    cap 09[58] = vendor (length 120)
    cap 05[e8] = MSI supports 1 message, 64 bit enabled with 1 message
    cap 10[d0] = PCI-Express 1 endpoint max data 128(128)
                 max read 4096
                 link x1(x1) speed 2.5(2.5) ASPM disabled(L0s)
    ecap 0001[100] = AER 1 0 fatal 0 non-fatal 2 corrected
    ecap 0002[13c] = VC 1 max VC0
    ecap 0003[160] = Serial 1 0025b3fffe2839c8
    ecap 0004[16c] = Power Budgeting 1

none0@pci0:1:5:0:	class=0x0c0010 rev=0x00 hdr=0x00 vendor=0x104c device=0x8023 subvendor=0x103c subdevice=0x1306
    vendor     = 'Texas Instruments'
    device     = 'TSB43AB22A IEEE-1394a-2000 Controller (PHY/Link) [iOHCI-Lynx]'
    class      = serial bus
    subclass   = FireWire
    bar   [10] = type Memory, range 32, base 0xd3c04000, size 2048, enabled
    bar   [14] = type Memory, range 32, base 0xd3c00000, size 16384, enabled
    cap 01[44] = powerspec 2  supports D0 D1 D2 D3  current D0
