hostb0@pci0:0:0:0:	class=0x060000 rev=0x00 hdr=0x00 vendor=0x1022 device=0x1566 subvendor=0x1022 subdevice=0x1566
    vendor     = 'Advanced Micro Devices, Inc. [AMD]'
    device     = 'Family 16h (Models 30h-3fh) Processor Root Complex'
    class      = bridge
    subclass   = HOST-PCI

none0@pci0:0:0:2:	class=0x080600 rev=0x00 hdr=0x00 vendor=0x1022 device=0x1567 subvendor=0x1022 subdevice=0x1567
    vendor     = 'Advanced Micro Devices, Inc. [AMD]'
    device     = 'Mullins IOMMU'
    class      = base peripheral
    subclass   = IOMMU
    cap 0f[40] = unknown
    cap 05[64] = MSI supports 4 messages, 64 bit enabled with 1 message
    cap 08[74] = HT MSI fixed address window enabled at 0xfee00000

vgapci0@pci0:0:1:0:	class=0x030000 rev=0x01 hdr=0x00 vendor=0x1002 device=0x9851 subvendor=0x1002 subdevice=0x0123
    vendor     = 'Advanced Micro Devices, Inc. [AMD/ATI]'
    device     = 'Mullins [Radeon R4/R5 Graphics]'
    class      = display
    subclass   = VGA
    bar   [10] = type Prefetchable Memory, range 64, base 0xc0000000, size 268435456, enabled
    bar   [18] = type Prefetchable Memory, range 64, base 0xd0000000, size 8388608, enabled
    bar   [20] = type I/O Port, range 32, base 0xf000, size 256, enabled
    bar   [24] = type Memory, range 32, base 0xfea00000, size 262144, enabled
    cap 09[48] = vendor (length 8)
    cap 01[50] = powerspec 3  supports D0 D1 D2 D3  current D0
    cap 10[58] = PCI-Express 2 root endpoint max data 128(256) RO NS
                 max read 512
    cap 05[a0] = MSI supports 1 message, 64 bit 
    ecap 000b[100] = Vendor [1] ID 0001 Rev 1 Length 16
    ecap 0019[270] = PCIe Sec 1 lane errors 0
    ecap 000f[2b0] = ATS 1
    ecap 0013[2c0] = Page Page Request 1
    ecap 001b[2d0] = Process Address Space ID 1

hdac0@pci0:0:1:1:	class=0x040300 rev=0x00 hdr=0x00 vendor=0x1002 device=0x9840 subvendor=0x1002 subdevice=0x9840
    vendor     = 'Advanced Micro Devices, Inc. [AMD/ATI]'
    device     = 'Kabini HDMI/DP Audio'
    class      = multimedia
    subclass   = HDA
    bar   [10] = type Memory, range 64, base 0xfea64000, size 16384, enabled
    cap 09[48] = vendor (length 8)
    cap 01[50] = powerspec 3  supports D0 D1 D2 D3  current D0
    cap 10[58] = PCI-Express 2 root endpoint max data 128(256) RO NS
                 max read 512
    cap 05[a0] = MSI supports 1 message, 64 bit enabled with 1 message
    ecap 000b[100] = Vendor [1] ID 0001 Rev 1 Length 16

hostb1@pci0:0:2:0:	class=0x060000 rev=0x00 hdr=0x00 vendor=0x1022 device=0x156b subvendor=0x0000 subdevice=0x0000
    vendor     = 'Advanced Micro Devices, Inc. [AMD]'
    device     = 'Family 16h (Models 30h-3fh) Host Bridge'
    class      = bridge
    subclass   = HOST-PCI

pcib1@pci0:0:2:1:	class=0x060400 rev=0x00 hdr=0x01 vendor=0x1022 device=0x1439 subvendor=0x1022 subdevice=0x1234
    vendor     = 'Advanced Micro Devices, Inc. [AMD]'
    device     = 'Family 16h Processor Functions 5:1'
    class      = bridge
    subclass   = PCI-PCI
    cap 01[50] = powerspec 3  supports D0 D3  current D0
    cap 10[58] = PCI-Express 2 root port max data 256(512) NS
                 max read 512
                 link x4(x4) speed 5.0(5.0) ASPM disabled(L0s/L1)
                 slot 0 power limit 0 mW
    cap 05[a0] = MSI supports 1 message, 64 bit 
    cap 0d[b0] = PCI Bridge subvendor=0x1022 subdevice=0x1234
    cap 08[b8] = HT MSI fixed address window enabled at 0xfee00000
    ecap 000b[100] = Vendor [1] ID 0001 Rev 1 Length 16

pcib2@pci0:0:2:2:	class=0x060400 rev=0x00 hdr=0x01 vendor=0x1022 device=0x1439 subvendor=0x1022 subdevice=0x1234
    vendor     = 'Advanced Micro Devices, Inc. [AMD]'
    device     = 'Family 16h Processor Functions 5:1'
    class      = bridge
    subclass   = PCI-PCI
    cap 01[50] = powerspec 3  supports D0 D3  current D0
    cap 10[58] = PCI-Express 2 root port max data 256(512) NS
                 max read 512
                 link x1(x1) speed 5.0(5.0) ASPM disabled(L0s/L1)
                 slot 0 power limit 0 mW
    cap 05[a0] = MSI supports 1 message, 64 bit 
    cap 0d[b0] = PCI Bridge subvendor=0x1022 subdevice=0x1234
    cap 08[b8] = HT MSI fixed address window enabled at 0xfee00000
    ecap 000b[100] = Vendor [1] ID 0001 Rev 1 Length 16

pcib3@pci0:0:2:3:	class=0x060400 rev=0x00 hdr=0x01 vendor=0x1022 device=0x1439 subvendor=0x1022 subdevice=0x1234
    vendor     = 'Advanced Micro Devices, Inc. [AMD]'
    device     = 'Family 16h Processor Functions 5:1'
    class      = bridge
    subclass   = PCI-PCI
    cap 01[50] = powerspec 3  supports D0 D3  current D0
    cap 10[58] = PCI-Express 2 root port max data 256(512) NS
                 max read 512
                 link x1(x1) speed 5.0(5.0) ASPM disabled(L0s/L1)
                 slot 0 power limit 0 mW
    cap 05[a0] = MSI supports 1 message, 64 bit 
    cap 0d[b0] = PCI Bridge subvendor=0x1022 subdevice=0x1234
    cap 08[b8] = HT MSI fixed address window enabled at 0xfee00000
    ecap 000b[100] = Vendor [1] ID 0001 Rev 1 Length 16

pcib4@pci0:0:2:5:	class=0x060400 rev=0x00 hdr=0x01 vendor=0x1022 device=0x1439 subvendor=0x1022 subdevice=0x1234
    vendor     = 'Advanced Micro Devices, Inc. [AMD]'
    device     = 'Family 16h Processor Functions 5:1'
    class      = bridge
    subclass   = PCI-PCI
    cap 01[50] = powerspec 3  supports D0 D3  current D0
    cap 10[58] = PCI-Express 2 root port max data 256(512) NS
                 max read 512
                 link x1(x1) speed 5.0(5.0) ASPM disabled(L0s/L1)
                 slot 0 power limit 0 mW
    cap 05[a0] = MSI supports 1 message, 64 bit 
    cap 0d[b0] = PCI Bridge subvendor=0x1022 subdevice=0x1234
    cap 08[b8] = HT MSI fixed address window enabled at 0xfee00000
    ecap 000b[100] = Vendor [1] ID 0001 Rev 1 Length 16

none1@pci0:0:8:0:	class=0x108000 rev=0x00 hdr=0x00 vendor=0x1022 device=0x1537 subvendor=0x1022 subdevice=0x1537
    vendor     = 'Advanced Micro Devices, Inc. [AMD]'
    device     = 'Kabini/Mullins PSP-Platform Security Processor'
    class      = encrypt/decrypt
    bar   [10] = type Prefetchable Memory, range 64, base 0xd0800000, size 131072, enabled
    bar   [18] = type Memory, range 32, base 0xfe400000, size 1048576, enabled
    bar   [1c] = type Memory, range 32, base 0xfea70000, size 4096, enabled
    bar   [24] = type Memory, range 32, base 0xfea6a000, size 8192, enabled
    cap 11[50] = MSI-X supports 2 messages
                 Table in map 0x24[0x0], PBA in map 0x24[0x1000]
    cap 08[5c] = HT MSI fixed address window enabled at 0xfee00000
    cap 01[60] = powerspec 3  supports D0 D3  current D0

xhci0@pci0:0:16:0:	class=0x0c0330 rev=0x11 hdr=0x00 vendor=0x1022 device=0x7814 subvendor=0x1022 subdevice=0x7814
    vendor     = 'Advanced Micro Devices, Inc. [AMD]'
    device     = 'FCH USB XHCI Controller'
    class      = serial bus
    subclass   = USB
    bar   [10] = type Memory, range 64, base 0xfea68000, size 8192, enabled
    cap 01[50] = powerspec 3  supports D0 D3  current D0
    cap 05[70] = MSI supports 8 messages, 64 bit 
    cap 11[90] = MSI-X supports 8 messages, enabled
                 Table in map 0x10[0x1000], PBA in map 0x10[0x1080]
    cap 10[a0] = PCI-Express 2 root endpoint max data 128(128) NS
                 max read 512
    ecap 0018[100] = LTR 1

ahci2@pci0:0:17:0:	class=0x010601 rev=0x40 hdr=0x00 vendor=0x1022 device=0x7801 subvendor=0x1022 subdevice=0x7801
    vendor     = 'Advanced Micro Devices, Inc. [AMD]'
    device     = 'FCH SATA Controller [AHCI mode]'
    class      = mass storage
    subclass   = SATA
    bar   [10] = type I/O Port, range 32, base 0xf140, size 8, enabled
    bar   [14] = type I/O Port, range 32, base 0xf130, size 4, enabled
    bar   [18] = type I/O Port, range 32, base 0xf120, size 8, enabled
    bar   [1c] = type I/O Port, range 32, base 0xf110, size 4, enabled
    bar   [20] = type I/O Port, range 32, base 0xf100, size 16, enabled
    bar   [24] = type Memory, range 32, base 0xfea6f000, size 1024, enabled
    cap 01[60] = powerspec 3  supports D0 D3  current D0
    cap 12[70] = SATA Index-Data Pair
    cap 05[50] = MSI supports 8 messages, 64 bit enabled with 8 messages

ehci0@pci0:0:18:0:	class=0x0c0320 rev=0x39 hdr=0x00 vendor=0x1022 device=0x7808 subvendor=0x1022 subdevice=0x7808
    vendor     = 'Advanced Micro Devices, Inc. [AMD]'
    device     = 'FCH USB EHCI Controller'
    class      = serial bus
    subclass   = USB
    bar   [10] = type Memory, range 32, base 0xfea6e000, size 256, enabled
    cap 01[c0] = powerspec 2  supports D0 D1 D2 D3  current D0
    cap 0a[e4] = EHCI Debug Port at offset 0xe0 in map 0x14

ehci1@pci0:0:19:0:	class=0x0c0320 rev=0x39 hdr=0x00 vendor=0x1022 device=0x7808 subvendor=0x1022 subdevice=0x7808
    vendor     = 'Advanced Micro Devices, Inc. [AMD]'
    device     = 'FCH USB EHCI Controller'
    class      = serial bus
    subclass   = USB
    bar   [10] = type Memory, range 32, base 0xfea6d000, size 256, enabled
    cap 01[c0] = powerspec 2  supports D0 D1 D2 D3  current D0
    cap 0a[e4] = EHCI Debug Port at offset 0xe0 in map 0x14

intsmb0@pci0:0:20:0:	class=0x0c0500 rev=0x42 hdr=0x00 vendor=0x1022 device=0x780b subvendor=0x1022 subdevice=0x780b
    vendor     = 'Advanced Micro Devices, Inc. [AMD]'
    device     = 'FCH SMBus Controller'
    class      = serial bus
    subclass   = SMBus

hdac1@pci0:0:20:2:	class=0x040300 rev=0x02 hdr=0x00 vendor=0x1022 device=0x780d subvendor=0x1022 subdevice=0x780d
    vendor     = 'Advanced Micro Devices, Inc. [AMD]'
    device     = 'FCH Azalia Controller'
    class      = multimedia
    subclass   = HDA
    bar   [10] = type Memory, range 64, base 0xfea60000, size 16384, enabled
    cap 01[50] = powerspec 2  supports D0 D3  current D0

isab0@pci0:0:20:3:	class=0x060100 rev=0x11 hdr=0x00 vendor=0x1022 device=0x780e subvendor=0x1022 subdevice=0x780e
    vendor     = 'Advanced Micro Devices, Inc. [AMD]'
    device     = 'FCH LPC Bridge'
    class      = bridge
    subclass   = PCI-ISA

sdhci_pci0@pci0:0:20:7:	class=0x080501 rev=0x01 hdr=0x00 vendor=0x1022 device=0x7813 subvendor=0x1022 subdevice=0x7813
    vendor     = 'Advanced Micro Devices, Inc. [AMD]'
    device     = 'FCH SD Flash Controller'
    class      = base peripheral
    subclass   = SD host controller
    bar   [10] = type Memory, range 64, base 0xfea6c000, size 256, enabled
    cap 05[80] = MSI supports 1 message, 64 bit enabled with 1 message
    cap 01[90] = powerspec 3  supports D0 D3  current D0

hostb2@pci0:0:24:0:	class=0x060000 rev=0x00 hdr=0x00 vendor=0x1022 device=0x1580 subvendor=0x0000 subdevice=0x0000
    vendor     = 'Advanced Micro Devices, Inc. [AMD]'
    device     = 'Family 16h (Models 30h-3fh) Processor Function 0'
    class      = bridge
    subclass   = HOST-PCI

hostb3@pci0:0:24:1:	class=0x060000 rev=0x00 hdr=0x00 vendor=0x1022 device=0x1581 subvendor=0x0000 subdevice=0x0000
    vendor     = 'Advanced Micro Devices, Inc. [AMD]'
    device     = 'Family 16h (Models 30h-3fh) Processor Function 1'
    class      = bridge
    subclass   = HOST-PCI

hostb4@pci0:0:24:2:	class=0x060000 rev=0x00 hdr=0x00 vendor=0x1022 device=0x1582 subvendor=0x0000 subdevice=0x0000
    vendor     = 'Advanced Micro Devices, Inc. [AMD]'
    device     = 'Family 16h (Models 30h-3fh) Processor Function 2'
    class      = bridge
    subclass   = HOST-PCI

hostb5@pci0:0:24:3:	class=0x060000 rev=0x00 hdr=0x00 vendor=0x1022 device=0x1583 subvendor=0x0000 subdevice=0x0000
    vendor     = 'Advanced Micro Devices, Inc. [AMD]'
    device     = 'Family 16h (Models 30h-3fh) Processor Function 3'
    class      = bridge
    subclass   = HOST-PCI
    cap 0f[f0] = unknown

hostb6@pci0:0:24:4:	class=0x060000 rev=0x00 hdr=0x00 vendor=0x1022 device=0x1584 subvendor=0x0000 subdevice=0x0000
    vendor     = 'Advanced Micro Devices, Inc. [AMD]'
    device     = 'Family 16h (Models 30h-3fh) Processor Function 4'
    class      = bridge
    subclass   = HOST-PCI

hostb7@pci0:0:24:5:	class=0x060000 rev=0x00 hdr=0x00 vendor=0x1022 device=0x1585 subvendor=0x0000 subdevice=0x0000
    vendor     = 'Advanced Micro Devices, Inc. [AMD]'
    device     = 'Family 16h (Models 30h-3fh) Processor Function 5'
    class      = bridge
    subclass   = HOST-PCI

nvme0@pci0:1:0:0:	class=0x010802 rev=0x01 hdr=0x00 vendor=0x1987 device=0x5007 subvendor=0x1987 subdevice=0x5007
    vendor     = 'Phison Electronics Corporation'
    device     = 'E7 NVMe Controller'
    class      = mass storage
    subclass   = NVM
    bar   [10] = type Memory, range 64, base 0xfe900000, size 16384, enabled
    cap 01[40] = powerspec 3  supports D0 D3  current D0
    cap 05[50] = MSI supports 8 messages, 64 bit 
    cap 10[70] = PCI-Express 2 endpoint max data 256(256) FLR
                 max read 512
                 link x4(x4) speed 5.0(8.0) ASPM disabled(L0s/L1) ClockPM disabled
    cap 11[b0] = MSI-X supports 8 messages, enabled
                 Table in map 0x10[0x2000], PBA in map 0x10[0x3000]
    ecap 0001[100] = AER 1 0 fatal 0 non-fatal 1 corrected
    ecap 0003[148] = Serial 1 0000000000000000
    ecap 0004[158] = Power Budgeting 1
    ecap 000e[168] = ARI 1
    ecap 0019[178] = PCIe Sec 1 lane errors 0
    ecap 0018[198] = LTR 1
    ecap 001e[1a0] = L1 PM Substates 1

ahci0@pci0:2:0:0:	class=0x010601 rev=0x11 hdr=0x00 vendor=0x1b4b device=0x9215 subvendor=0x1b4b subdevice=0x9215
    vendor     = 'Marvell Technology Group Ltd.'
    class      = mass storage
    subclass   = SATA
    bar   [10] = type I/O Port, range 32, base 0xe050, size 8, enabled
    bar   [14] = type I/O Port, range 32, base 0xe040, size 4, enabled
    bar   [18] = type I/O Port, range 32, base 0xe030, size 8, enabled
    bar   [1c] = type I/O Port, range 32, base 0xe020, size 4, enabled
    bar   [20] = type I/O Port, range 32, base 0xe000, size 32, enabled
    bar   [24] = type Memory, range 32, base 0xfe810000, size 2048, enabled
    cap 01[40] = powerspec 3  supports D0 D3  current D0
    cap 05[50] = MSI supports 1 message enabled with 1 message
    cap 10[70] = PCI-Express 2 legacy endpoint max data 256(512)
                 max read 512
                 link x1(x1) speed 5.0(5.0) ASPM disabled(L0s/L1)
    cap 12[e0] = SATA Index-Data Pair
    ecap 0001[100] = AER 1 0 fatal 0 non-fatal 0 corrected

ahci1@pci0:3:0:0:	class=0x010601 rev=0x11 hdr=0x00 vendor=0x1b4b device=0x9215 subvendor=0x1b4b subdevice=0x9215
    vendor     = 'Marvell Technology Group Ltd.'
    class      = mass storage
    subclass   = SATA
    bar   [10] = type I/O Port, range 32, base 0xd050, size 8, enabled
    bar   [14] = type I/O Port, range 32, base 0xd040, size 4, enabled
    bar   [18] = type I/O Port, range 32, base 0xd030, size 8, enabled
    bar   [1c] = type I/O Port, range 32, base 0xd020, size 4, enabled
    bar   [20] = type I/O Port, range 32, base 0xd000, size 32, enabled
    bar   [24] = type Memory, range 32, base 0xfe710000, size 2048, enabled
    cap 01[40] = powerspec 3  supports D0 D3  current D0
    cap 05[50] = MSI supports 1 message enabled with 1 message
    cap 10[70] = PCI-Express 2 legacy endpoint max data 256(512)
                 max read 512
                 link x1(x1) speed 5.0(5.0) ASPM disabled(L0s/L1)
    cap 12[e0] = SATA Index-Data Pair
    ecap 0001[100] = AER 1 0 fatal 0 non-fatal 0 corrected

pcib5@pci0:4:0:0:	class=0x060400 rev=0x00 hdr=0x01 vendor=0x1b21 device=0x1182 subvendor=0x1b21 subdevice=0x118f
    vendor     = 'ASMedia Technology Inc.'
    class      = bridge
    subclass   = PCI-PCI
    cap 05[50] = MSI supports 1 message, 64 bit 
    cap 01[78] = powerspec 3  supports D0 D3  current D0
    cap 10[80] = PCI-Express 2 upstream port max data 256(256) NS
                 max read 512
                 link x1(x1) speed 5.0(5.0) ASPM disabled(L0s/L1)
    cap 0d[c0] = PCI Bridge subvendor=0x1b21 subdevice=0x118f
    ecap 0002[100] = VC 1 max VC0
    ecap 0001[200] = AER 1 0 fatal 0 non-fatal 0 corrected
    ecap 000b[300] = Vendor [1] ID 0000 Rev 0 Length 3072

pcib6@pci0:5:3:0:	class=0x060400 rev=0x00 hdr=0x01 vendor=0x1b21 device=0x1182 subvendor=0x1b21 subdevice=0x118f
    vendor     = 'ASMedia Technology Inc.'
    class      = bridge
    subclass   = PCI-PCI
    cap 05[50] = MSI supports 1 message, 64 bit 
    cap 01[78] = powerspec 3  supports D0 D3  current D0
    cap 10[80] = PCI-Express 2 downstream port max data 256(256) NS
                 max read 512
                 link x1(x1) speed 2.5(5.0) ASPM disabled(L0s/L1)
                 slot 3 power limit 26000 mW
    cap 0d[c0] = PCI Bridge subvendor=0x1b21 subdevice=0x118f
    ecap 0002[100] = VC 1 max VC0
    ecap 0001[200] = AER 1 0 fatal 0 non-fatal 0 corrected

pcib7@pci0:5:7:0:	class=0x060400 rev=0x00 hdr=0x01 vendor=0x1b21 device=0x1182 subvendor=0x1b21 subdevice=0x118f
    vendor     = 'ASMedia Technology Inc.'
    class      = bridge
    subclass   = PCI-PCI
    cap 05[50] = MSI supports 1 message, 64 bit 
    cap 01[78] = powerspec 3  supports D0 D3  current D0
    cap 10[80] = PCI-Express 2 downstream port max data 256(256) NS
                 max read 512
                 link x1(x1) speed 2.5(5.0) ASPM disabled(L0s/L1)
                 slot 7 power limit 26000 mW
    cap 0d[c0] = PCI Bridge subvendor=0x1b21 subdevice=0x118f
    ecap 0002[100] = VC 1 max VC0
    ecap 0001[200] = AER 1 0 fatal 0 non-fatal 0 corrected

igb0@pci0:6:0:0:	class=0x020000 rev=0x03 hdr=0x00 vendor=0x8086 device=0x1533 subvendor=0xffff subdevice=0x0000
    vendor     = 'Intel Corporation'
    device     = 'I210 Gigabit Network Connection'
    class      = network
    subclass   = ethernet
    bar   [10] = type Memory, range 32, base 0xfe600000, size 524288, enabled
    bar   [18] = type I/O Port, range 32, base 0xc000, size 32, enabled
    bar   [1c] = type Memory, range 32, base 0xfe680000, size 16384, enabled
    cap 01[40] = powerspec 3  supports D0 D3  current D0
    cap 05[50] = MSI supports 1 message, 64 bit, vector masks 
    cap 11[70] = MSI-X supports 5 messages, enabled
                 Table in map 0x1c[0x0], PBA in map 0x1c[0x2000]
    cap 10[a0] = PCI-Express 2 endpoint max data 256(512) FLR NS
                 max read 512
                 link x1(x1) speed 2.5(2.5) ASPM disabled(L0s/L1)
    ecap 0001[100] = AER 2 0 fatal 0 non-fatal 0 corrected
    ecap 0003[140] = Serial 1 00089bffffed87ff
    ecap 0017[1a0] = TPH Requester 1

igb1@pci0:7:0:0:	class=0x020000 rev=0x03 hdr=0x00 vendor=0x8086 device=0x1533 subvendor=0xffff subdevice=0x0000
    vendor     = 'Intel Corporation'
    device     = 'I210 Gigabit Network Connection'
    class      = network
    subclass   = ethernet
    bar   [10] = type Memory, range 32, base 0xfe500000, size 524288, enabled
    bar   [18] = type I/O Port, range 32, base 0xb000, size 32, enabled
    bar   [1c] = type Memory, range 32, base 0xfe580000, size 16384, enabled
    cap 01[40] = powerspec 3  supports D0 D3  current D0
    cap 05[50] = MSI supports 1 message, 64 bit, vector masks 
    cap 11[70] = MSI-X supports 5 messages, enabled
                 Table in map 0x1c[0x0], PBA in map 0x1c[0x2000]
    cap 10[a0] = PCI-Express 2 endpoint max data 256(512) FLR NS
                 max read 512
                 link x1(x1) speed 2.5(2.5) ASPM disabled(L0s/L1)
    ecap 0001[100] = AER 2 0 fatal 0 non-fatal 0 corrected
    ecap 0003[140] = Serial 1 00089bffffed8800
    ecap 0017[1a0] = TPH Requester 1
