hostb0@pci0:0:0:0:	class=0x060000 card=0x86941043 chip=0x191f8086 rev=0x07 hdr=0x00
    vendor     = 'Intel Corporation'
    device     = 'Xeon E3-1200 v5/E3-1500 v5/6th Gen Core Processor Host Bridge/DRAM Registers'
    class      = bridge
    subclass   = HOST-PCI
    cap 09[e0] = vendor (length 16) Intel cap 0 version 1

pcib1@pci0:0:1:0:	class=0x060400 card=0x86941043 chip=0x19018086 rev=0x07 hdr=0x01
    vendor     = 'Intel Corporation'
    device     = 'Xeon E3-1200 v5/E3-1500 v5/6th Gen Core Processor PCIe Controller (x16)'
    class      = bridge
    subclass   = PCI-PCI
    cap 0d[88] = PCI Bridge card=0x86941043
    cap 01[80] = powerspec 3  supports D0 D3  current D0
    cap 05[90] = MSI supports 1 message 
    cap 10[a0] = PCI-Express 2 root port max data 256(256)
                 link x8(x8) speed 2.5(8.0) ASPM disabled(L0s/L1)
                 slot 1 power limit 75000 mW
    ecap 0002[100] = VC 1 max VC0
    ecap 0005[140] = Root Complex Link Declaration 1
    ecap 0019[d94] = PCIe Sec 1 lane errors 0

pcib2@pci0:0:1:1:	class=0x060400 card=0x86941043 chip=0x19058086 rev=0x07 hdr=0x01
    vendor     = 'Intel Corporation'
    device     = 'Xeon E3-1200 v5/E3-1500 v5/6th Gen Core Processor PCIe Controller (x8)'
    class      = bridge
    subclass   = PCI-PCI
    cap 0d[88] = PCI Bridge card=0x86941043
    cap 01[80] = powerspec 3  supports D0 D3  current D0
    cap 05[90] = MSI supports 1 message 
    cap 10[a0] = PCI-Express 2 root port max data 256(256)
                 link x4(x4) speed 5.0(8.0) ASPM disabled(L0s/L1)
                 slot 2 power limit 75000 mW
    ecap 0002[100] = VC 1 max VC0
    ecap 0005[140] = Root Complex Link Declaration 1
    ecap 0019[d94] = PCIe Sec 1 lane errors 0

pcib3@pci0:0:1:2:	class=0x060400 card=0x86941043 chip=0x19098086 rev=0x07 hdr=0x01
    vendor     = 'Intel Corporation'
    device     = 'Xeon E3-1200 v5/E3-1500 v5/6th Gen Core Processor PCIe Controller (x4)'
    class      = bridge
    subclass   = PCI-PCI
    cap 0d[88] = PCI Bridge card=0x86941043
    cap 01[80] = powerspec 3  supports D0 D3  current D0
    cap 05[90] = MSI supports 1 message 
    cap 10[a0] = PCI-Express 2 root port max data 256(256)
                 link x4(x4) speed 8.0(8.0) ASPM disabled(L0s/L1)
                 slot 3 power limit 75000 mW
    ecap 0002[100] = VC 1 max VC0
    ecap 0005[140] = Root Complex Link Declaration 1
    ecap 0019[d94] = PCIe Sec 1 lane errors 0

xhci0@pci0:0:20:0:	class=0x0c0330 card=0x86941043 chip=0xa12f8086 rev=0x31 hdr=0x00
    vendor     = 'Intel Corporation'
    device     = '100 Series/C230 Series Chipset Family USB 3.0 xHCI Controller'
    class      = serial bus
    subclass   = USB
    bar   [10] = type Memory, range 64, base 0xdc130000, size 65536, enabled
    cap 01[70] = powerspec 2  supports D0 D3  current D0
    cap 05[80] = MSI supports 8 messages, 64 bit enabled with 1 message

none0@pci0:0:22:0:	class=0x078000 card=0x86941043 chip=0xa13a8086 rev=0x31 hdr=0x00
    vendor     = 'Intel Corporation'
    device     = '100 Series/C230 Series Chipset Family MEI Controller'
    class      = simple comms
    bar   [10] = type Memory, range 64, base 0xdc14d000, size 4096, enabled
    cap 01[50] = powerspec 3  supports D0 D3  current D0
    cap 05[8c] = MSI supports 1 message, 64 bit 

ahci0@pci0:0:23:0:	class=0x010601 card=0x86941043 chip=0xa1028086 rev=0x31 hdr=0x00
    vendor     = 'Intel Corporation'
    device     = 'Q170/Q150/B150/H170/H110/Z170/CM236 Chipset SATA Controller [AHCI Mode]'
    class      = mass storage
    subclass   = SATA
    bar   [10] = type Memory, range 32, base 0xdc148000, size 8192, enabled
    bar   [14] = type Memory, range 32, base 0xdc14c000, size 256, enabled
    bar   [18] = type I/O Port, range 32, base 0xf050, size 8, enabled
    bar   [1c] = type I/O Port, range 32, base 0xf040, size 4, enabled
    bar   [20] = type I/O Port, range 32, base 0xf020, size 32, enabled
    bar   [24] = type Memory, range 32, base 0xdc14b000, size 2048, enabled
    cap 05[80] = MSI supports 1 message enabled with 1 message
    cap 01[70] = powerspec 3  supports D0 D3  current D0
    cap 12[a8] = SATA Index-Data Pair

pcib4@pci0:0:27:0:	class=0x060400 card=0x86941043 chip=0xa1678086 rev=0xf1 hdr=0x01
    vendor     = 'Intel Corporation'
    device     = '100 Series/C230 Series Chipset Family PCI Express Root Port'
    class      = bridge
    subclass   = PCI-PCI
    cap 10[40] = PCI-Express 2 root port max data 128(256) ARI disabled
                 link x0(x2) speed 0.0(8.0) ASPM disabled(L0s/L1)
                 slot 0 power limit 0 mW HotPlug(empty) surprise
    cap 05[80] = MSI supports 1 message enabled with 1 message
    cap 0d[90] = PCI Bridge card=0x86941043
    cap 01[a0] = powerspec 3  supports D0 D3  current D0

pcib5@pci0:0:28:0:	class=0x060400 card=0x86941043 chip=0xa1108086 rev=0xf1 hdr=0x01
    vendor     = 'Intel Corporation'
    device     = '100 Series/C230 Series Chipset Family PCI Express Root Port'
    class      = bridge
    subclass   = PCI-PCI
    cap 10[40] = PCI-Express 2 root port max data 256(256) ARI disabled
                 link x2(x2) speed 5.0(8.0)
                 slot 4 power limit 250 mW
    cap 05[80] = MSI supports 1 message 
    cap 0d[90] = PCI Bridge card=0x86941043
    cap 01[a0] = powerspec 3  supports D0 D3  current D0
    ecap 0001[100] = AER 1 0 fatal 0 non-fatal 0 corrected
    ecap 000d[140] = ACS 1
    ecap 0019[220] = PCIe Sec 1 lane errors 0

pcib6@pci0:0:28:2:	class=0x060400 card=0x86941043 chip=0xa1128086 rev=0xf1 hdr=0x01
    vendor     = 'Intel Corporation'
    device     = '100 Series/C230 Series Chipset Family PCI Express Root Port'
    class      = bridge
    subclass   = PCI-PCI
    cap 10[40] = PCI-Express 2 root port max data 256(256) ARI disabled
                 link x1(x1) speed 5.0(8.0)
                 slot 6 power limit 100 mW
    cap 05[80] = MSI supports 1 message 
    cap 0d[90] = PCI Bridge card=0x86941043
    cap 01[a0] = powerspec 3  supports D0 D3  current D0
    ecap 0001[100] = AER 1 0 fatal 0 non-fatal 0 corrected
    ecap 000d[140] = ACS 1
    ecap 0019[220] = PCIe Sec 1 lane errors 0

pcib15@pci0:0:28:4:	class=0x060400 card=0x86941043 chip=0xa1148086 rev=0xf1 hdr=0x01
    vendor     = 'Intel Corporation'
    device     = '100 Series/C230 Series Chipset Family PCI Express Root Port'
    class      = bridge
    subclass   = PCI-PCI
    cap 10[40] = PCI-Express 2 root port max data 128(128) ARI disabled
                 link x4(x4) speed 8.0(8.0)
                 slot 8 power limit 250 mW HotPlug(present) surprise
    cap 05[80] = MSI supports 1 message enabled with 1 message
    cap 0d[90] = PCI Bridge card=0x86941043
    cap 01[a0] = powerspec 3  supports D0 D3  current D0
    ecap 0001[100] = AER 1 0 fatal 0 non-fatal 0 corrected
    ecap 000d[140] = ACS 1
    ecap 0019[220] = PCIe Sec 1 lane errors 0

pcib21@pci0:0:29:0:	class=0x060400 card=0x86941043 chip=0xa1188086 rev=0xf1 hdr=0x01
    vendor     = 'Intel Corporation'
    device     = '100 Series/C230 Series Chipset Family PCI Express Root Port'
    class      = bridge
    subclass   = PCI-PCI
    cap 10[40] = PCI-Express 2 root port max data 128(256) ARI disabled
                 link x4(x4) speed 8.0(8.0)
                 slot 12 power limit 250 mW
    cap 05[80] = MSI supports 1 message 
    cap 0d[90] = PCI Bridge card=0x86941043
    cap 01[a0] = powerspec 3  supports D0 D3  current D0
    ecap 0001[100] = AER 1 0 fatal 0 non-fatal 0 corrected
    ecap 000d[140] = ACS 1
    ecap 0019[220] = PCIe Sec 1 lane errors 0

isab0@pci0:0:31:0:	class=0x060100 card=0x86941043 chip=0xa1458086 rev=0x31 hdr=0x00
    vendor     = 'Intel Corporation'
    device     = 'Z170 Chipset LPC/eSPI Controller'
    class      = bridge
    subclass   = PCI-ISA

none1@pci0:0:31:2:	class=0x058000 card=0x86941043 chip=0xa1218086 rev=0x31 hdr=0x00
    vendor     = 'Intel Corporation'
    device     = '100 Series/C230 Series Chipset Family Power Management Controller'
    class      = memory
    bar   [10] = type Memory, range 32, base 0xdc144000, size 16384, enabled

hdac1@pci0:0:31:3:	class=0x040300 card=0x86911043 chip=0xa1708086 rev=0x31 hdr=0x00
    vendor     = 'Intel Corporation'
    device     = '100 Series/C230 Series Chipset Family HD Audio Controller'
    class      = multimedia
    subclass   = HDA
    bar   [10] = type Memory, range 64, base 0xdc140000, size 16384, enabled
    bar   [20] = type Memory, range 64, base 0xdc120000, size 65536, enabled
    cap 01[50] = powerspec 3  supports D0 D3  current D0
    cap 05[60] = MSI supports 1 message, 64 bit enabled with 1 message

none2@pci0:0:31:4:	class=0x0c0500 card=0x86941043 chip=0xa1238086 rev=0x31 hdr=0x00
    vendor     = 'Intel Corporation'
    device     = '100 Series/C230 Series Chipset Family SMBus'
    class      = serial bus
    subclass   = SMBus
    bar   [10] = type Memory, range 64, base 0xdc14a000, size 256, enabled
    bar   [20] = type I/O Port, range 32, base 0xf000, size 32, enabled

em0@pci0:0:31:6:	class=0x020000 card=0x86721043 chip=0x15b88086 rev=0x31 hdr=0x00
    vendor     = 'Intel Corporation'
    device     = 'Ethernet Connection (2) I219-V'
    class      = network
    subclass   = ethernet
    bar   [10] = type Memory, range 32, base 0xdc100000, size 131072, enabled
    cap 01[c8] = powerspec 3  supports D0 D3  current D0
    cap 05[d0] = MSI supports 1 message, 64 bit enabled with 1 message
    cap 13[e0] = PCI Advanced Features: FLR TP

vgapci0@pci0:1:0:0:	class=0x030000 card=0x368f1458 chip=0x140110de rev=0xa1 hdr=0x00
    vendor     = 'NVIDIA Corporation'
    device     = 'GM206 [GeForce GTX 960]'
    class      = display
    subclass   = VGA
    bar   [10] = type Memory, range 32, base 0xdb000000, size 16777216, enabled
    bar   [14] = type Prefetchable Memory, range 64, base 0x90000000, size 268435456, enabled
    bar   [1c] = type Prefetchable Memory, range 64, base 0xa0000000, size 33554432, enabled
    bar   [24] = type I/O Port, range 32, base 0xe000, size 128, enabled
    cap 01[60] = powerspec 3  supports D0 D3  current D0
    cap 05[68] = MSI supports 1 message, 64 bit 
    cap 10[78] = PCI-Express 2 legacy endpoint max data 256(256) RO NS
                 link x8(x16) speed 2.5(8.0)
    ecap 0002[100] = VC 1 max VC0
    ecap 001e[258] = unknown 1
    ecap 0004[128] = Power Budgeting 1
    ecap 0001[420] = AER 2 0 fatal 0 non-fatal 1 corrected
    ecap 000b[600] = Vendor 1 ID 1
    ecap 0019[900] = PCIe Sec 1 lane errors 0

hdac0@pci0:1:0:1:	class=0x040300 card=0x368f1458 chip=0x0fba10de rev=0xa1 hdr=0x00
    vendor     = 'NVIDIA Corporation'
    device     = 'GM206 High Definition Audio Controller'
    class      = multimedia
    subclass   = HDA
    bar   [10] = type Memory, range 32, base 0xdc080000, size 16384, enabled
    cap 01[60] = powerspec 3  supports D0 D3  current D0
    cap 05[68] = MSI supports 1 message, 64 bit enabled with 1 message
    cap 10[78] = PCI-Express 2 endpoint max data 256(256) RO NS
                 link x8(x16) speed 2.5(8.0)

ix0@pci0:2:0:0:	class=0x020000 card=0x00038086 chip=0x10fb8086 rev=0x01 hdr=0x00
    vendor     = 'Intel Corporation'
    device     = '82599ES 10-Gigabit SFI/SFP+ Network Connection'
    class      = network
    subclass   = ethernet
    bar   [10] = type Prefetchable Memory, range 64, base 0xa2180000, size 524288, enabled
    bar   [18] = type I/O Port, range 32, base 0xd020, size 32, enabled
    bar   [20] = type Prefetchable Memory, range 64, base 0xa2204000, size 16384, enabled
    cap 01[40] = powerspec 3  supports D0 D3  current D0
    cap 05[50] = MSI supports 1 message, 64 bit, vector masks 
    cap 11[70] = MSI-X supports 64 messages, enabled
                 Table in map 0x20[0x0], PBA in map 0x20[0x2000]
    cap 10[a0] = PCI-Express 2 endpoint max data 256(512) FLR RO NS
                 link x4(x8) speed 5.0(5.0) ASPM disabled(L0s)
    ecap 0001[100] = AER 1 0 fatal 0 non-fatal 1 corrected
    ecap 0003[140] = Serial 1 f8f21effffb12fbc
    ecap 000e[150] = ARI 1
    ecap 0010[160] = SR-IOV 1 IOV disabled, Memory Space disabled, ARI disabled
                     0 VFs configured out of 64 supported
                     First VF RID Offset 0x0180, VF RID Stride 0x0002
                     VF Device ID 0x10ed
                     Page Sizes: 4096 (enabled), 8192, 65536, 262144, 1048576, 4194304

ix1@pci0:2:0:1:	class=0x020000 card=0x00038086 chip=0x10fb8086 rev=0x01 hdr=0x00
    vendor     = 'Intel Corporation'
    device     = '82599ES 10-Gigabit SFI/SFP+ Network Connection'
    class      = network
    subclass   = ethernet
    bar   [10] = type Prefetchable Memory, range 64, base 0xa2100000, size 524288, enabled
    bar   [18] = type I/O Port, range 32, base 0xd000, size 32, enabled
    bar   [20] = type Prefetchable Memory, range 64, base 0xa2200000, size 16384, enabled
    cap 01[40] = powerspec 3  supports D0 D3  current D0
    cap 05[50] = MSI supports 1 message, 64 bit, vector masks 
    cap 11[70] = MSI-X supports 64 messages, enabled
                 Table in map 0x20[0x0], PBA in map 0x20[0x2000]
    cap 10[a0] = PCI-Express 2 endpoint max data 256(512) FLR RO NS
                 link x4(x8) speed 5.0(5.0) ASPM disabled(L0s)
    ecap 0001[100] = AER 1 0 fatal 0 non-fatal 1 corrected
    ecap 0003[140] = Serial 1 f8f21effffb12fbc
    ecap 000e[150] = ARI 1
    ecap 0010[160] = SR-IOV 1 IOV disabled, Memory Space disabled, ARI disabled
                     0 VFs configured out of 64 supported
                     First VF RID Offset 0x0180, VF RID Stride 0x0002
                     VF Device ID 0x10ed
                     Page Sizes: 4096 (enabled), 8192, 65536, 262144, 1048576, 4194304

none3@pci0:3:0:0:	class=0x020000 card=0x87411043 chip=0xd1071d6a rev=0x02 hdr=0x00
    vendor     = 'Aquantia Corp.'
    device     = 'AQC107 NBase-T/IEEE 802.3bz Ethernet Controller [AQtion]'
    class      = network
    subclass   = ethernet
    bar   [10] = type Memory, range 64, base 0xdc840000, size 65536, enabled
    bar   [18] = type Memory, range 64, base 0xdc850000, size 4096, enabled
    bar   [20] = type Memory, range 64, base 0xdc400000, size 4194304, enabled
    cap 10[40] = PCI-Express 2 endpoint max data 256(512) FLR RO NS
                 link x4(x4) speed 8.0(8.0) ASPM disabled(L0s/L1)
    cap 01[80] = powerspec 3  supports D0 D1 D2 D3  current D0
    cap 11[90] = MSI-X supports 32 messages
                 Table in map 0x18[0x0], PBA in map 0x18[0x200]
    cap 05[a0] = MSI supports 32 messages, 64 bit 
    cap 03[c0] = VPD
    ecap 0001[100] = AER 2 0 fatal 0 non-fatal 1 corrected
    ecap 000b[150] = Vendor 1 ID 1
    ecap 0019[180] = PCIe Sec 1 lane errors 0

xhci1@pci0:5:0:0:	class=0x0c0330 card=0x86751043 chip=0x12421b21 rev=0x00 hdr=0x00
    vendor     = 'ASMedia Technology Inc.'
    device     = 'ASM1142 USB 3.1 Host Controller'
    class      = serial bus
    subclass   = USB
    bar   [10] = type Memory, range 64, base 0xdd100000, size 32768, enabled
    cap 05[50] = MSI supports 8 messages, 64 bit enabled with 1 message
    cap 11[68] = MSI-X supports 8 messages
                 Table in map 0x10[0x2000], PBA in map 0x10[0x2080]
    cap 01[78] = powerspec 3  supports D0 D3  current D0
    cap 10[80] = PCI-Express 2 endpoint max data 256(512) RO NS
                 link x2(x2) speed 5.0(5.0) ASPM disabled(L0s/L1)
    ecap 0002[100] = VC 1 max VC0
    ecap 0001[200] = AER 1 0 fatal 0 non-fatal 0 corrected
    ecap 0019[280] = PCIe Sec 1 lane errors 0
    ecap 0018[300] = LTR 1

pcib7@pci0:6:0:0:	class=0x060400 card=0x118f1b21 chip=0x11871b21 rev=0x00 hdr=0x01
    vendor     = 'ASMedia Technology Inc.'
    class      = bridge
    subclass   = PCI-PCI
    cap 05[50] = MSI supports 1 message, 64 bit 
    cap 01[78] = powerspec 3  supports D0 D3  current D0
    cap 10[80] = PCI-Express 2 upstream port max data 256(256) RO NS
                 link x1(x1) speed 5.0(5.0) ASPM disabled(L0s/L1)
    cap 0d[c0] = PCI Bridge card=0x118f1b21
    ecap 0002[100] = VC 1 max VC0
    ecap 0001[200] = AER 1 0 fatal 0 non-fatal 0 corrected
    ecap 000b[300] = Vendor 1 ID 0

pcib8@pci0:7:1:0:	class=0x060400 card=0x118f1b21 chip=0x11871b21 rev=0x00 hdr=0x01
    vendor     = 'ASMedia Technology Inc.'
    class      = bridge
    subclass   = PCI-PCI
    cap 05[50] = MSI supports 1 message, 64 bit 
    cap 01[78] = powerspec 3  supports D0 D3  current D0
    cap 10[80] = PCI-Express 2 downstream port max data 256(256) RO NS
                 link x1(x1) speed 2.5(5.0) ASPM disabled(L0s/L1)
                 slot 1 power limit 26000 mW
    cap 0d[c0] = PCI Bridge card=0x118f1b21
    ecap 0002[100] = VC 1 max VC0
    ecap 0001[200] = AER 1 0 fatal 0 non-fatal 0 corrected

pcib9@pci0:7:2:0:	class=0x060400 card=0x118f1b21 chip=0x11871b21 rev=0x00 hdr=0x01
    vendor     = 'ASMedia Technology Inc.'
    class      = bridge
    subclass   = PCI-PCI
    cap 05[50] = MSI supports 1 message, 64 bit 
    cap 01[78] = powerspec 3  supports D0 D3  current D0
    cap 10[80] = PCI-Express 2 downstream port max data 256(256) RO NS
                 link x1(x1) speed 2.5(5.0) ASPM disabled(L0s/L1)
                 slot 2 power limit 26000 mW
    cap 0d[c0] = PCI Bridge card=0x118f1b21
    ecap 0002[100] = VC 1 max VC0
    ecap 0001[200] = AER 1 0 fatal 1 non-fatal 0 corrected

pcib10@pci0:7:3:0:	class=0x060400 card=0x118f1b21 chip=0x11871b21 rev=0x00 hdr=0x01
    vendor     = 'ASMedia Technology Inc.'
    class      = bridge
    subclass   = PCI-PCI
    cap 05[50] = MSI supports 1 message, 64 bit 
    cap 01[78] = powerspec 3  supports D0 D3  current D0
    cap 10[80] = PCI-Express 2 downstream port max data 256(256) RO NS
                 link x1(x1) speed 5.0(5.0) ASPM disabled(L0s/L1)
                 slot 3 power limit 26000 mW
    cap 0d[c0] = PCI Bridge card=0x118f1b21
    ecap 0002[100] = VC 1 max VC0
    ecap 0001[200] = AER 1 0 fatal 0 non-fatal 0 corrected

pcib11@pci0:7:4:0:	class=0x060400 card=0x118f1b21 chip=0x11871b21 rev=0x00 hdr=0x01
    vendor     = 'ASMedia Technology Inc.'
    class      = bridge
    subclass   = PCI-PCI
    cap 05[50] = MSI supports 1 message, 64 bit 
    cap 01[78] = powerspec 3  supports D0 D3  current D0
    cap 10[80] = PCI-Express 2 downstream port max data 256(256) RO NS
                 link x0(x4) speed 0.0(5.0) ASPM disabled(L0s/L1)
                 slot 4 power limit 26000 mW
    cap 0d[c0] = PCI Bridge card=0x118f1b21
    ecap 0002[100] = VC 1 max VC0
    ecap 0001[200] = AER 1 0 fatal 0 non-fatal 0 corrected

pcib12@pci0:7:5:0:	class=0x060400 card=0x118f1b21 chip=0x11871b21 rev=0x00 hdr=0x01
    vendor     = 'ASMedia Technology Inc.'
    class      = bridge
    subclass   = PCI-PCI
    cap 05[50] = MSI supports 1 message, 64 bit 
    cap 01[78] = powerspec 3  supports D0 D3  current D0
    cap 10[80] = PCI-Express 2 downstream port max data 256(256) RO NS
                 link x1(x1) speed 5.0(5.0) ASPM disabled(L0s/L1)
                 slot 5 power limit 26000 mW
    cap 0d[c0] = PCI Bridge card=0x118f1b21
    ecap 0002[100] = VC 1 max VC0
    ecap 0001[200] = AER 1 0 fatal 0 non-fatal 0 corrected

pcib13@pci0:7:6:0:	class=0x060400 card=0x118f1b21 chip=0x11871b21 rev=0x00 hdr=0x01
    vendor     = 'ASMedia Technology Inc.'
    class      = bridge
    subclass   = PCI-PCI
    cap 05[50] = MSI supports 1 message, 64 bit 
    cap 01[78] = powerspec 3  supports D0 D3  current D0
    cap 10[80] = PCI-Express 2 downstream port max data 256(256) RO NS
                 link x1(x1) speed 2.5(5.0) ASPM disabled(L0s/L1)
                 slot 6 power limit 26000 mW
    cap 0d[c0] = PCI Bridge card=0x118f1b21
    ecap 0002[100] = VC 1 max VC0
    ecap 0001[200] = AER 1 0 fatal 0 non-fatal 0 corrected

pcib14@pci0:7:7:0:	class=0x060400 card=0x118f1b21 chip=0x11871b21 rev=0x00 hdr=0x01
    vendor     = 'ASMedia Technology Inc.'
    class      = bridge
    subclass   = PCI-PCI
    cap 05[50] = MSI supports 1 message, 64 bit 
    cap 01[78] = powerspec 3  supports D0 D3  current D0
    cap 10[80] = PCI-Express 2 downstream port max data 256(256) RO NS
                 link x1(x1) speed 2.5(5.0) ASPM disabled(L0s/L1)
                 slot 7 power limit 26000 mW
    cap 0d[c0] = PCI Bridge card=0x118f1b21
    ecap 0002[100] = VC 1 max VC0
    ecap 0001[200] = AER 1 0 fatal 0 non-fatal 0 corrected

none4@pci0:9:0:0:	class=0x028000 card=0x86591043 chip=0x43a014e4 rev=0x03 hdr=0x00
    vendor     = 'Broadcom Inc. and subsidiaries'
    device     = 'BCM4360 802.11ac Wireless Network Adapter'
    class      = network
    bar   [10] = type Memory, range 64, base 0xdcc00000, size 32768, enabled
    bar   [18] = type Memory, range 64, base 0xdca00000, size 2097152, enabled
    cap 01[48] = powerspec 3  supports D0 D1 D2 D3  current D0
    cap 05[58] = MSI supports 1 message, 64 bit 
    cap 09[68] = vendor (length 68)
    cap 10[ac] = PCI-Express 2 endpoint max data 256(256) RO NS
                 link x1(x1) speed 2.5(2.5) ASPM disabled(L0s/L1)
    ecap 0001[100] = AER 1 0 fatal 0 non-fatal 0 corrected
    ecap 0003[13c] = Serial 1 000000ffff000001
    ecap 0004[150] = Power Budgeting 1
    ecap 0002[160] = VC 1 max VC0
    ecap 0018[1b0] = LTR 1
    ecap 0015[220] = Resizable BAR 1

ahci1@pci0:10:0:0:	class=0x010601 card=0x858d1043 chip=0x06121b21 rev=0x02 hdr=0x00
    vendor     = 'ASMedia Technology Inc.'
    device     = 'ASM1062 Serial ATA Controller'
    class      = mass storage
    subclass   = SATA
    bar   [10] = type I/O Port, range 32, base 0xc050, size 8, enabled
    bar   [14] = type I/O Port, range 32, base 0xc040, size 4, enabled
    bar   [18] = type I/O Port, range 32, base 0xc030, size 8, enabled
    bar   [1c] = type I/O Port, range 32, base 0xc020, size 4, enabled
    bar   [20] = type I/O Port, range 32, base 0xc000, size 32, enabled
    bar   [24] = type Memory, range 32, base 0xdcf00000, size 512, enabled
    cap 01[78] = powerspec 3  supports D0 D3  current D0
    cap 10[80] = PCI-Express 2 legacy endpoint max data 256(512) RO NS
                 link x1(x1) speed 5.0(5.0) ASPM disabled(L0s)
    ecap 0002[100] = VC 1 max VC0

xhci2@pci0:12:0:0:	class=0x0c0330 card=0x85fd1043 chip=0x11421b21 rev=0x00 hdr=0x00
    vendor     = 'ASMedia Technology Inc.'
    device     = 'ASM1042A USB 3.0 Host Controller'
    class      = serial bus
    subclass   = USB
    bar   [10] = type Memory, range 64, base 0xdce00000, size 32768, enabled
    cap 05[50] = MSI supports 8 messages, 64 bit enabled with 1 message
    cap 11[68] = MSI-X supports 8 messages
                 Table in map 0x10[0x2000], PBA in map 0x10[0x2080]
    cap 01[78] = powerspec 3  supports D0 D3  current D0
    cap 10[80] = PCI-Express 2 legacy endpoint max data 256(512) RO NS
                 link x1(x1) speed 5.0(5.0) ASPM disabled(L0s/L1)
    ecap 0002[100] = VC 1 max VC0

pcib16@pci0:15:0:0:	class=0x060400 card=0x11112222 chip=0x15788086 rev=0x00 hdr=0x01
    vendor     = 'Intel Corporation'
    device     = 'DSL6540 Thunderbolt 3 Bridge [Alpine Ridge 4C 2015]'
    class      = bridge
    subclass   = PCI-PCI
    cap 01[80] = powerspec 3  supports D0 D1 D2 D3  current D0
    cap 05[88] = MSI supports 1 message, 64 bit 
    cap 0d[ac] = PCI Bridge card=0x11112222
    cap 10[c0] = PCI-Express 2 upstream port max data 128(128) RO NS
                 link x4(x4) speed 8.0(8.0) ASPM disabled(L0s/L1)
    ecap 0003[100] = Serial 1 0ab934f92de90700
    ecap 0001[200] = AER 1 0 fatal 0 non-fatal 1 corrected
    ecap 0002[300] = VC 1 max VC0
    ecap 0004[400] = Power Budgeting 1
    ecap 000b[500] = Vendor 1 ID 4660
    ecap 0018[600] = LTR 1
    ecap 0019[700] = PCIe Sec 1 lane errors 0

pcib17@pci0:16:0:0:	class=0x060400 card=0x11112222 chip=0x15788086 rev=0x00 hdr=0x01
    vendor     = 'Intel Corporation'
    device     = 'DSL6540 Thunderbolt 3 Bridge [Alpine Ridge 4C 2015]'
    class      = bridge
    subclass   = PCI-PCI
    cap 01[80] = powerspec 3  supports D0 D1 D2 D3  current D0
    cap 05[88] = MSI supports 1 message, 64 bit 
    cap 0d[ac] = PCI Bridge card=0x11112222
    cap 10[c0] = PCI-Express 2 downstream port max data 128(128) RO NS
                 link x4(x4) speed 2.5(2.5) ASPM disabled(L0s/L1)
    ecap 0003[100] = Serial 1 0ab934f92de90700
    ecap 0001[200] = AER 1 0 fatal 0 non-fatal 0 corrected
    ecap 0002[300] = VC 1 max VC0
    ecap 0004[400] = Power Budgeting 1
    ecap 000b[500] = Vendor 1 ID 4660
    ecap 0019[700] = PCIe Sec 1 lane errors 0

pcib18@pci0:16:1:0:	class=0x060400 card=0x11112222 chip=0x15788086 rev=0x00 hdr=0x01
    vendor     = 'Intel Corporation'
    device     = 'DSL6540 Thunderbolt 3 Bridge [Alpine Ridge 4C 2015]'
    class      = bridge
    subclass   = PCI-PCI
    cap 01[80] = powerspec 3  supports D0 D1 D2 D3  current D0
    cap 05[88] = MSI supports 1 message, 64 bit enabled with 1 message
    cap 0d[ac] = PCI Bridge card=0x11112222
    cap 10[c0] = PCI-Express 2 downstream port max data 128(128) RO NS
                 link x4(x4) speed 2.5(2.5) ASPM disabled(L0s/L1)
                 slot 1 power limit 0 mW HotPlug(empty) surprise
    ecap 0003[100] = Serial 1 0ab934f92de90700
    ecap 0001[200] = AER 1 0 fatal 0 non-fatal 0 corrected
    ecap 0002[300] = VC 1 max VC0
    ecap 0004[400] = Power Budgeting 1
    ecap 000b[500] = Vendor 1 ID 4660
    ecap 0019[700] = PCIe Sec 1 lane errors 0

pcib19@pci0:16:2:0:	class=0x060400 card=0x11112222 chip=0x15788086 rev=0x00 hdr=0x01
    vendor     = 'Intel Corporation'
    device     = 'DSL6540 Thunderbolt 3 Bridge [Alpine Ridge 4C 2015]'
    class      = bridge
    subclass   = PCI-PCI
    cap 01[80] = powerspec 3  supports D0 D1 D2 D3  current D0
    cap 05[88] = MSI supports 1 message, 64 bit 
    cap 0d[ac] = PCI Bridge card=0x11112222
    cap 10[c0] = PCI-Express 2 downstream port max data 128(128) RO NS
                 link x4(x4) speed 2.5(2.5) ASPM disabled(L0s/L1)
    ecap 0003[100] = Serial 1 0ab934f92de90700
    ecap 0001[200] = AER 1 0 fatal 0 non-fatal 0 corrected
    ecap 0002[300] = VC 1 max VC0
    ecap 0004[400] = Power Budgeting 1
    ecap 000b[500] = Vendor 1 ID 4660
    ecap 0019[700] = PCIe Sec 1 lane errors 0

pcib20@pci0:16:4:0:	class=0x060400 card=0x11112222 chip=0x15788086 rev=0x00 hdr=0x01
    vendor     = 'Intel Corporation'
    device     = 'DSL6540 Thunderbolt 3 Bridge [Alpine Ridge 4C 2015]'
    class      = bridge
    subclass   = PCI-PCI
    cap 01[80] = powerspec 3  supports D0 D1 D2 D3  current D0
    cap 05[88] = MSI supports 1 message, 64 bit enabled with 1 message
    cap 0d[ac] = PCI Bridge card=0x11112222
    cap 10[c0] = PCI-Express 2 downstream port max data 128(128) RO NS
                 link x4(x4) speed 2.5(2.5) ASPM disabled(L0s/L1)
                 slot 4 power limit 0 mW HotPlug(empty) surprise
    ecap 0003[100] = Serial 1 0ab934f92de90700
    ecap 0001[200] = AER 1 0 fatal 0 non-fatal 0 corrected
    ecap 0002[300] = VC 1 max VC0
    ecap 0004[400] = Power Budgeting 1
    ecap 000b[500] = Vendor 1 ID 4660
    ecap 0019[700] = PCIe Sec 1 lane errors 0

xhci3@pci0:69:0:0:	class=0x0c0330 card=0x11112222 chip=0x15b68086 rev=0x00 hdr=0x00
    vendor     = 'Intel Corporation'
    device     = 'DSL6540 USB 3.1 Controller [Alpine Ridge]'
    class      = serial bus
    subclass   = USB
    bar   [10] = type Memory, range 32, base 0xc3f00000, size 65536, enabled
    cap 01[80] = powerspec 3  supports D0 D1 D2 D3  current D0
    cap 05[88] = MSI supports 8 messages, 64 bit enabled with 1 message
    cap 10[c0] = PCI-Express 2 endpoint max data 128(128) RO NS
                 link x4(x4) speed 2.5(2.5) ASPM disabled(L0s/L1)
    ecap 0003[100] = Serial 1 0ab934f92de90700
    ecap 0001[200] = AER 1 0 fatal 0 non-fatal 1 corrected
    ecap 0002[300] = VC 1 max VC0
    ecap 0004[400] = Power Budgeting 1
    ecap 000b[500] = Vendor 1 ID 4660
    ecap 0018[600] = LTR 1
    ecap 0019[700] = PCIe Sec 1 lane errors 0

nvme0@pci0:122:0:0:	class=0x010802 card=0x390a8086 chip=0xf1a58086 rev=0x03 hdr=0x00
    vendor     = 'Intel Corporation'
    device     = 'SSD 600P Series'
    class      = mass storage
    subclass   = NVM
    bar   [10] = type Memory, range 64, base 0xdd000000, size 16384, enabled
    cap 01[40] = powerspec 3  supports D0 D3  current D0
    cap 10[70] = PCI-Express 2 endpoint max data 128(128) FLR RO
                 link x4(x4) speed 8.0(8.0) ASPM disabled(L1)
    cap 11[b0] = MSI-X supports 16 messages, enabled
                 Table in map 0x10[0x2000], PBA in map 0x10[0x2100]
    ecap 0001[100] = AER 2 0 fatal 0 non-fatal 0 corrected
    ecap 0019[158] = PCIe Sec 1 lane errors 0
    ecap 0018[178] = LTR 1
    ecap 001e[180] = unknown 1
