hostb0@pci0:0:0:0:	class=0x060000 card=0x19998086 chip=0x19808086 rev=0x11 hdr=0x00
    vendor     = 'Intel Corporation'
    class      = bridge
    subclass   = HOST-PCI

hostb1@pci0:0:4:0:	class=0x060000 card=0x00008086 chip=0x19a18086 rev=0x11 hdr=0x00
    vendor     = 'Intel Corporation'
    class      = bridge
    subclass   = HOST-PCI
    cap 10[40] = PCI-Express 2 root endpoint max data 128(256)

none0@pci0:0:5:0:	class=0x080700 card=0x00008086 chip=0x19a28086 rev=0x11 hdr=0x00
    vendor     = 'Intel Corporation'
    class      = base peripheral
    cap 10[40] = PCI-Express 2 event collector max data 128(256)
    cap 01[80] = powerspec 3  supports D0 D3  current D0
    cap 05[90] = MSI supports 1 message, vector masks 
    ecap 0001[100] = AER 1 0 fatal 1 non-fatal 1 corrected
    ecap 0007[150] = Root Complex Event Collector ASsociation 1

pcib1@pci0:0:6:0:	class=0x060400 card=0x00008086 chip=0x19a38086 rev=0x11 hdr=0x01
    vendor     = 'Intel Corporation'
    class      = bridge
    subclass   = PCI-PCI
    cap 10[40] = PCI-Express 2 root port max data 128(128) ARI enabled
                 link x1(x1) speed 2.5(2.5) ASPM disabled(L0s/L1)
    cap 01[80] = powerspec 3  supports D0 D3  current D0
    cap 0d[88] = PCI Bridge card=0x00008086
    cap 05[90] = MSI supports 1 message, vector masks 
    ecap 0001[100] = AER 1 0 fatal 0 non-fatal 0 corrected
    ecap 000d[138] = ACS 1

pcib2@pci0:0:9:0:	class=0x060400 card=0x00008086 chip=0x19a48086 rev=0x11 hdr=0x01
    vendor     = 'Intel Corporation'
    class      = bridge
    subclass   = PCI-PCI
    bar   [10] = type Memory, range 64, base 0xdf680000, size 131072, enabled
    cap 10[40] = PCI-Express 2 root port max data 128(256) ARI disabled
                 link x1(x8) speed 2.5(8.0) ASPM disabled(L1)
    cap 01[80] = powerspec 3  supports D0 D3  current D0
    cap 0d[88] = PCI Bridge card=0x00008086
    cap 05[90] = MSI supports 1 message, vector masks 
    ecap 0001[100] = AER 1 0 fatal 0 non-fatal 0 corrected
    ecap 000d[138] = ACS 1
    ecap 0012[150] = Multicast 1
    ecap 000b[180] = Vendor 1 ID 3
    ecap 001d[190] = unknown 1
    ecap 001e[1d0] = unknown 1
    ecap 0019[200] = PCIe Sec 1 lane errors 0

pcib3@pci0:0:14:0:	class=0x060400 card=0x19a88086 chip=0x19a88086 rev=0x11 hdr=0x01
    vendor     = 'Intel Corporation'
    class      = bridge
    subclass   = PCI-PCI
    bar   [10] = type Memory, range 64, base 0xdf660000, size 131072, enabled
    cap 10[40] = PCI-Express 2 root port max data 128(256) ARI disabled
                 link x1(x1) speed 5.0(8.0) ASPM disabled(L1)
    cap 01[80] = powerspec 3  supports D0 D3  current D0
    cap 0d[88] = PCI Bridge card=0x19a88086
    cap 05[90] = MSI supports 1 message, vector masks 
    ecap 0001[100] = AER 1 0 fatal 0 non-fatal 0 corrected
    ecap 000d[138] = ACS 1
    ecap 0012[150] = Multicast 1
    ecap 000b[180] = Vendor 1 ID 3
    ecap 001d[190] = unknown 1
    ecap 001e[1d0] = unknown 1
    ecap 0019[200] = PCIe Sec 1 lane errors 0

pcib5@pci0:0:15:0:	class=0x060400 card=0x19a98086 chip=0x19a98086 rev=0x11 hdr=0x01
    vendor     = 'Intel Corporation'
    class      = bridge
    subclass   = PCI-PCI
    bar   [10] = type Memory, range 64, base 0xdf640000, size 131072, enabled
    cap 10[40] = PCI-Express 2 root port max data 128(256) ARI disabled
                 link x1(x1) speed 5.0(8.0) ASPM disabled(L1)
    cap 01[80] = powerspec 3  supports D0 D3  current D0
    cap 0d[88] = PCI Bridge card=0x19a98086
    cap 05[90] = MSI supports 1 message, vector masks 
    ecap 0001[100] = AER 1 0 fatal 0 non-fatal 0 corrected
    ecap 000d[138] = ACS 1
    ecap 0012[150] = Multicast 1
    ecap 000b[180] = Vendor 1 ID 3
    ecap 001d[190] = unknown 1
    ecap 001e[1d0] = unknown 1
    ecap 0019[200] = PCIe Sec 1 lane errors 0

pcib9@pci0:0:16:0:	class=0x060400 card=0x19aa8086 chip=0x19aa8086 rev=0x11 hdr=0x01
    vendor     = 'Intel Corporation'
    class      = bridge
    subclass   = PCI-PCI
    bar   [10] = type Memory, range 64, base 0xdf620000, size 131072, enabled
    cap 10[40] = PCI-Express 2 root port max data 128(256) ARI disabled
                 link x2(x2) speed 5.0(8.0) ASPM disabled(L1)
    cap 01[80] = powerspec 3  supports D0 D3  current D0
    cap 0d[88] = PCI Bridge card=0x19aa8086
    cap 05[90] = MSI supports 1 message, vector masks 
    ecap 0001[100] = AER 1 0 fatal 0 non-fatal 0 corrected
    ecap 000d[138] = ACS 1
    ecap 0012[150] = Multicast 1
    ecap 000b[180] = Vendor 1 ID 3
    ecap 001d[190] = unknown 1
    ecap 001e[1d0] = unknown 1
    ecap 0019[200] = PCIe Sec 1 lane errors 0

pcib15@pci0:0:17:0:	class=0x060400 card=0x19ab8086 chip=0x19ab8086 rev=0x11 hdr=0x01
    vendor     = 'Intel Corporation'
    class      = bridge
    subclass   = PCI-PCI
    bar   [10] = type Memory, range 64, base 0xdf600000, size 131072, enabled
    cap 10[40] = PCI-Express 2 root port max data 128(256) ARI disabled
                 link x2(x2) speed 5.0(8.0) ASPM disabled(L1)
    cap 01[80] = powerspec 3  supports D0 D3  current D0
    cap 0d[88] = PCI Bridge card=0x19ab8086
    cap 05[90] = MSI supports 1 message, vector masks 
    ecap 0001[100] = AER 1 0 fatal 0 non-fatal 0 corrected
    ecap 000d[138] = ACS 1
    ecap 0012[150] = Multicast 1
    ecap 000b[180] = Vendor 1 ID 3
    ecap 001d[190] = unknown 1
    ecap 001e[1d0] = unknown 1
    ecap 0019[200] = PCIe Sec 1 lane errors 0

none1@pci0:0:18:0:	class=0x088000 card=0x00008086 chip=0x19ac8086 rev=0x11 hdr=0x00
    vendor     = 'Intel Corporation'
    device     = 'Atom Processor C3000 Series SMBus Contoller - Host'
    class      = base peripheral
    bar   [10] = type Memory, range 64, base 0xdf6bf000, size 1024, enabled
    cap 10[40] = PCI-Express 2 root endpoint max data 128(256) FLR NS
    cap 01[80] = powerspec 3  supports D0 D3  current D0
    cap 05[8c] = MSI supports 1 message, 64 bit, vector masks 
    ecap 0001[100] = AER 1 0 fatal 0 non-fatal 0 corrected

ahci0@pci0:0:19:0:	class=0x010601 card=0x72708086 chip=0x19b28086 rev=0x11 hdr=0x00
    vendor     = 'Intel Corporation'
    device     = 'Atom Processor C3000 Series SATA Controller 0'
    class      = mass storage
    subclass   = SATA
    bar   [10] = type Memory, range 32, base 0xdf6b6000, size 8192, enabled
    bar   [14] = type Memory, range 32, base 0xdf6be000, size 256, enabled
    bar   [18] = type I/O Port, range 32, base 0xe0a0, size 8, enabled
    bar   [1c] = type I/O Port, range 32, base 0xe090, size 4, enabled
    bar   [20] = type I/O Port, range 32, base 0xe040, size 32, enabled
    bar   [24] = type Memory, range 32, base 0xdf6bd000, size 2048, enabled
    cap 05[80] = MSI supports 1 message 
    cap 01[70] = powerspec 3  supports D0 D3  current D0
    cap 12[a8] = SATA Index-Data Pair
    cap 11[d0] = MSI-X supports 8 messages, enabled
                 Table in map 0x10[0x0], PBA in map 0x14[0x0]

ahci1@pci0:0:20:0:	class=0x010601 card=0x72708086 chip=0x19c28086 rev=0x11 hdr=0x00
    vendor     = 'Intel Corporation'
    device     = 'Atom Processor C3000 Series SATA Controller 1'
    class      = mass storage
    subclass   = SATA
    bar   [10] = type Memory, range 32, base 0xdf6b4000, size 8192, enabled
    bar   [14] = type Memory, range 32, base 0xdf6bc000, size 256, enabled
    bar   [18] = type I/O Port, range 32, base 0xe080, size 8, enabled
    bar   [1c] = type I/O Port, range 32, base 0xe070, size 4, enabled
    bar   [20] = type I/O Port, range 32, base 0xe020, size 32, enabled
    bar   [24] = type Memory, range 32, base 0xdf6bb000, size 2048, enabled
    cap 05[80] = MSI supports 1 message 
    cap 01[70] = powerspec 3  supports D0 D3  current D0
    cap 12[a8] = SATA Index-Data Pair
    cap 11[d0] = MSI-X supports 8 messages, enabled
                 Table in map 0x10[0x0], PBA in map 0x14[0x0]

xhci0@pci0:0:21:0:	class=0x0c0330 card=0x72708086 chip=0x19d08086 rev=0x11 hdr=0x00
    vendor     = 'Intel Corporation'
    device     = 'Atom Processor C3000 Series USB 3.0 xHCI Controller'
    class      = serial bus
    subclass   = USB
    bar   [10] = type Memory, range 64, base 0xdf6a0000, size 65536, enabled
    cap 01[70] = powerspec 2  supports D0 D3  current D0
    cap 05[80] = MSI supports 8 messages, 64 bit enabled with 1 message

pcib21@pci0:0:22:0:	class=0x060400 card=0x00008086 chip=0x19d18086 rev=0x11 hdr=0x01
    vendor     = 'Intel Corporation'
    class      = bridge
    subclass   = PCI-PCI
    cap 10[40] = PCI-Express 2 root port max data 128(128) ARI enabled
                 link x1(x1) speed 2.5(2.5) ASPM disabled(L0s/L1)
    cap 01[80] = powerspec 3  supports D0 D3  current D0
    cap 0d[88] = PCI Bridge card=0x00008086
    cap 05[90] = MSI supports 1 message, vector masks 
    ecap 0001[100] = AER 1 0 fatal 0 non-fatal 1 corrected
    ecap 000d[138] = ACS 1

pcib22@pci0:0:23:0:	class=0x060400 card=0x00008086 chip=0x19d28086 rev=0x11 hdr=0x01
    vendor     = 'Intel Corporation'
    class      = bridge
    subclass   = PCI-PCI
    cap 10[40] = PCI-Express 2 root port max data 128(128) ARI enabled
                 link x1(x1) speed 2.5(2.5) ASPM disabled(L0s/L1)
    cap 01[80] = powerspec 3  supports D0 D3  current D0
    cap 0d[88] = PCI Bridge card=0x00008086
    cap 05[90] = MSI supports 1 message, vector masks 
    ecap 0001[100] = AER 1 0 fatal 0 non-fatal 1 corrected
    ecap 000d[138] = ACS 1

none2@pci0:0:24:0:	class=0x078000 card=0x19d38086 chip=0x19d38086 rev=0x11 hdr=0x00
    vendor     = 'Intel Corporation'
    class      = simple comms
    bar   [10] = type Memory, range 64, base 0xdf6ba000, size 4096, enabled
    cap 01[50] = powerspec 3  supports D0 D3  current D0
    cap 05[8c] = MSI supports 1 message, 64 bit 

none3@pci0:0:26:0:	class=0x070002 card=0x00008086 chip=0x19d88086 rev=0x11 hdr=0x00
    vendor     = 'Intel Corporation'
    class      = simple comms
    subclass   = UART
    bar   [10] = type I/O Port, range 32, base 0xe060, size 8, enabled
    bar   [14] = type Memory, range 32, base 0xdf6b9000, size 256, enabled
    cap 05[40] = MSI supports 1 message 
    cap 01[50] = powerspec 3  supports D0 D3  current D0

isab0@pci0:0:31:0:	class=0x060100 card=0x72708086 chip=0x19dc8086 rev=0x11 hdr=0x00
    vendor     = 'Intel Corporation'
    device     = 'Atom Processor C3000 Series LPC or eSPI'
    class      = bridge
    subclass   = PCI-ISA

none4@pci0:0:31:2:	class=0x058000 card=0x72708086 chip=0x19de8086 rev=0x11 hdr=0x00
    vendor     = 'Intel Corporation'
    class      = memory
    bar   [10] = type Memory, range 32, base 0xdf6b0000, size 16384, enabled

none5@pci0:0:31:4:	class=0x0c0500 card=0x72708086 chip=0x19df8086 rev=0x11 hdr=0x00
    vendor     = 'Intel Corporation'
    device     = 'Atom Processor C3000 Series SMBus controller'
    class      = serial bus
    subclass   = SMBus
    bar   [10] = type Memory, range 64, base 0xdf6b8000, size 256, enabled
    bar   [20] = type I/O Port, range 32, base 0xe000, size 32, enabled

none6@pci0:0:31:5:	class=0x0c8000 card=0x72708086 chip=0x19e08086 rev=0x11 hdr=0x00
    vendor     = 'Intel Corporation'
    device     = 'Atom Processor C3000 Series SPI Controller'
    class      = serial bus
    bar   [10] = type Memory, range 32, base 0xfe010000, size 4096, enabled

none7@pci0:1:0:0:	class=0x0b4000 card=0x00008086 chip=0x19e28086 rev=0x11 hdr=0x00
    vendor     = 'Intel Corporation'
    device     = 'Atom Processor C3000 Series QuickAssist Technology'
    class      = processor
    bar   [18] = type Memory, range 64, base 0xdf540000, size 262144, enabled
    bar   [20] = type Memory, range 64, base 0xdf500000, size 262144, enabled
    cap 05[b0] = MSI supports 1 message, 64 bit, vector masks 
    cap 11[60] = MSI-X supports 17 messages
                 Table in map 0x18[0x3b000], PBA in map 0x18[0x3b800]
    cap 01[6c] = powerspec 3  supports D0 D3  current D0
    cap 10[74] = PCI-Express 2 endpoint max data 128(16384) FLR RO NS
                 link x16(x16) speed 5.0(5.0) ASPM disabled(L0s/L1)
    ecap 0001[100] = AER 1 0 fatal 0 non-fatal 0 corrected
    ecap 000e[138] = ARI 1
    ecap 0010[140] = SR-IOV 1 IOV disabled, Memory Space disabled, ARI disabled
                     0 VFs configured out of 16 supported
                     First VF RID Offset 0x0008, VF RID Stride 0x0001
                     VF Device ID 0x19e3
                     Page Sizes: 4096 (enabled), 8192, 65536, 262144, 1048576, 4194304
    ecap 000d[1b0] = ACS 1

puc0@pci0:2:0:0:	class=0x070002 card=0xc3081415 chip=0xc3081415 rev=0x00 hdr=0x00
    vendor     = 'Oxford Semiconductor Ltd'
    device     = 'EX-44016 16-port serial'
    class      = simple comms
    subclass   = UART
    bar   [10] = type Memory, range 32, base 0xde600000, size 16384, enabled
    bar   [14] = type Memory, range 32, base 0xde400000, size 2097152, enabled
    bar   [18] = type Memory, range 32, base 0xde200000, size 2097152, enabled
    cap 01[40] = powerspec 3  supports D0 D1 D2 D3  current D0
    cap 10[70] = PCI-Express 1 endpoint max data 128(128) RO
                 link x1(x1) speed 2.5(2.5) ASPM disabled(L0s/L1)
    cap 11[b0] = MSI-X supports 16 messages
                 Table in map 0x14[0x1b3000], PBA in map 0x14[0x1b2000]
    ecap 0003[100] = Serial 1 0030e01111000300
    ecap 0004[110] = Power Budgeting 1

pcib4@pci0:3:0:0:	class=0x060400 card=0x11501a03 chip=0x11501a03 rev=0x04 hdr=0x01
    vendor     = 'ASPEED Technology, Inc.'
    device     = 'AST1150 PCI-to-PCI Bridge'
    class      = bridge
    subclass   = PCI-PCI
    cap 05[50] = MSI supports 1 message, 64 bit 
    cap 01[78] = powerspec 3  supports D0 D1 D2 D3  current D0
    cap 10[80] = PCI-Express 2 PCI bridge max data 128(256) RO NS
                 link x1(x1) speed 5.0(5.0) ASPM disabled(L0s/L1)
    cap 0d[c0] = PCI Bridge card=0x11501a03
    ecap 0002[100] = VC 1 max VC0
    ecap 0001[800] = AER 1 0 fatal 0 non-fatal 1 corrected

vgapci0@pci0:4:0:0:	class=0x030000 card=0x20001a03 chip=0x20001a03 rev=0x41 hdr=0x00
    vendor     = 'ASPEED Technology, Inc.'
    device     = 'ASPEED Graphics Family'
    class      = display
    subclass   = VGA
    bar   [10] = type Memory, range 32, base 0xdd000000, size 16777216, enabled
    bar   [14] = type Memory, range 32, base 0xde040000, size 131072, enabled
    bar   [18] = type I/O Port, range 32, base 0xd000, size 128, enabled
    cap 01[40] = powerspec 3  supports D0 D1 D2 D3  current D0
    cap 05[50] = MSI supports 2 messages, 64 bit 

pcib6@pci0:5:0:0:	class=0x060400 card=0x118f1b21 chip=0x11821b21 rev=0x00 hdr=0x01
    vendor     = 'ASMedia Technology Inc.'
    class      = bridge
    subclass   = PCI-PCI
    cap 05[50] = MSI supports 1 message, 64 bit 
    cap 01[78] = powerspec 3  supports D0 D3  current D0
    cap 10[80] = PCI-Express 2 upstream port max data 128(256) RO NS
                 link x1(x1) speed 5.0(5.0) ASPM disabled(L0s/L1)
    cap 0d[c0] = PCI Bridge card=0x118f1b21
    ecap 0002[100] = VC 1 max VC0
    ecap 0001[200] = AER 1 0 fatal 0 non-fatal 1 corrected
    ecap 000b[300] = Vendor 1 ID 0

pcib7@pci0:6:3:0:	class=0x060400 card=0x118f1b21 chip=0x11821b21 rev=0x00 hdr=0x01
    vendor     = 'ASMedia Technology Inc.'
    class      = bridge
    subclass   = PCI-PCI
    cap 05[50] = MSI supports 1 message, 64 bit 
    cap 01[78] = powerspec 3  supports D0 D3  current D0
    cap 10[80] = PCI-Express 2 downstream port max data 128(256) RO NS
                 link x1(x1) speed 2.5(5.0) ASPM disabled(L0s/L1)
                 slot 3 power limit 26000 mW
    cap 0d[c0] = PCI Bridge card=0x118f1b21
    ecap 0002[100] = VC 1 max VC0
    ecap 0001[200] = AER 1 0 fatal 0 non-fatal 0 corrected

pcib8@pci0:6:7:0:	class=0x060400 card=0x118f1b21 chip=0x11821b21 rev=0x00 hdr=0x01
    vendor     = 'ASMedia Technology Inc.'
    class      = bridge
    subclass   = PCI-PCI
    cap 05[50] = MSI supports 1 message, 64 bit 
    cap 01[78] = powerspec 3  supports D0 D3  current D0
    cap 10[80] = PCI-Express 2 downstream port max data 128(256) RO NS
                 link x1(x1) speed 2.5(5.0) ASPM disabled(L0s/L1)
                 slot 7 power limit 26000 mW
    cap 0d[c0] = PCI Bridge card=0x118f1b21
    ecap 0002[100] = VC 1 max VC0
    ecap 0001[200] = AER 1 0 fatal 0 non-fatal 0 corrected

igb0@pci0:7:0:0:	class=0x020000 card=0x0000ffff chip=0x15368086 rev=0x03 hdr=0x00
    vendor     = 'Intel Corporation'
    device     = 'I210 Gigabit Fiber Network Connection'
    class      = network
    subclass   = ethernet
    bar   [10] = type Memory, range 32, base 0xdf000000, size 1048576, enabled
    bar   [18] = type I/O Port, range 32, base 0xc000, size 32, enabled
    bar   [1c] = type Memory, range 32, base 0xdf100000, size 16384, enabled
    cap 01[40] = powerspec 3  supports D0 D3  current D0
    cap 05[50] = MSI supports 1 message, 64 bit, vector masks 
    cap 11[70] = MSI-X supports 5 messages, enabled
                 Table in map 0x1c[0x0], PBA in map 0x1c[0x2000]
    cap 10[a0] = PCI-Express 2 endpoint max data 128(512) FLR RO NS
                 link x1(x1) speed 2.5(2.5) ASPM disabled(L0s/L1)
    ecap 0001[100] = AER 2 0 fatal 0 non-fatal 1 corrected
    ecap 0003[140] = Serial 1 0002b6ffff460cfc
    ecap 0017[1a0] = TPH Requester 1

igb1@pci0:8:0:0:	class=0x020000 card=0x00008086 chip=0x157b8086 rev=0x03 hdr=0x00
    vendor     = 'Intel Corporation'
    device     = 'I210 Gigabit Network Connection'
    class      = network
    subclass   = ethernet
    bar   [10] = type Memory, range 32, base 0xdf200000, size 131072, enabled
    bar   [18] = type I/O Port, range 32, base 0xb000, size 32, enabled
    bar   [1c] = type Memory, range 32, base 0xdf220000, size 16384, enabled
    cap 01[40] = powerspec 3  supports D0 D3  current D0
    cap 05[50] = MSI supports 1 message, 64 bit, vector masks 
    cap 11[70] = MSI-X supports 5 messages, enabled
                 Table in map 0x1c[0x0], PBA in map 0x1c[0x2000]
    cap 10[a0] = PCI-Express 2 endpoint max data 128(512) FLR RO NS
                 link x1(x1) speed 2.5(2.5) ASPM disabled(L0s/L1)
    ecap 0001[100] = AER 2 0 fatal 0 non-fatal 1 corrected
    ecap 0003[140] = Serial 1 0002b6ffff460cfd
    ecap 0017[1a0] = TPH Requester 1

pcib10@pci0:9:0:0:	class=0x060400 card=0x00000000 chip=0x18061b21 rev=0x01 hdr=0x01
    vendor     = 'ASMedia Technology Inc.'
    class      = bridge
    subclass   = PCI-PCI
    cap 01[40] = powerspec 3  supports D0 D3  current D0
    cap 05[50] = MSI supports 1 message, 64 bit 
    cap 10[80] = PCI-Express 2 upstream port max data 128(512) RO NS ARI disabled
                 link x2(x2) speed 5.0(5.0) ASPM disabled(L1)
    cap 0d[c0] = PCI Bridge card=0x00000000
    ecap 0001[100] = AER 1 0 fatal 1 non-fatal 1 corrected
    ecap 0004[140] = Power Budgeting 1
    ecap 0018[160] = LTR 1
    ecap 0012[180] = Multicast 1
    ecap 0019[1c0] = PCIe Sec 1 lane errors 0
    ecap 001e[200] = unknown 1

pcib11@pci0:10:0:0:	class=0x060400 card=0x00000000 chip=0x18061b21 rev=0x01 hdr=0x01
    vendor     = 'ASMedia Technology Inc.'
    class      = bridge
    subclass   = PCI-PCI
    cap 01[40] = powerspec 3  supports D0 D3  current D0
    cap 05[50] = MSI supports 1 message, 64 bit 
    cap 10[80] = PCI-Express 2 downstream port max data 128(512) RO NS ARI disabled
                 link x1(x1) speed 2.5(5.0) ASPM disabled(L1)
                 slot 0 power limit 0 mW
    cap 0d[c0] = PCI Bridge card=0x00000000
    ecap 0001[100] = AER 1 0 fatal 0 non-fatal 0 corrected
    ecap 0004[140] = Power Budgeting 1
    ecap 000d[150] = ACS 1
    ecap 0012[180] = Multicast 1
    ecap 0019[1c0] = PCIe Sec 1 lane errors 0
    ecap 001e[200] = unknown 1

pcib12@pci0:10:2:0:	class=0x060400 card=0x00000000 chip=0x18061b21 rev=0x01 hdr=0x01
    vendor     = 'ASMedia Technology Inc.'
    class      = bridge
    subclass   = PCI-PCI
    cap 01[40] = powerspec 3  supports D0 D3  current D0
    cap 05[50] = MSI supports 1 message, 64 bit 
    cap 10[80] = PCI-Express 2 downstream port max data 128(512) RO NS ARI disabled
                 link x1(x1) speed 2.5(5.0) ASPM disabled(L1)
                 slot 0 power limit 0 mW
    cap 0d[c0] = PCI Bridge card=0x00000000
    ecap 0001[100] = AER 1 0 fatal 0 non-fatal 0 corrected
    ecap 0004[140] = Power Budgeting 1
    ecap 000d[150] = ACS 1
    ecap 0012[180] = Multicast 1
    ecap 0019[1c0] = PCIe Sec 1 lane errors 0
    ecap 001e[200] = unknown 1

pcib13@pci0:10:6:0:	class=0x060400 card=0x00000000 chip=0x18061b21 rev=0x01 hdr=0x01
    vendor     = 'ASMedia Technology Inc.'
    class      = bridge
    subclass   = PCI-PCI
    cap 01[40] = powerspec 3  supports D0 D3  current D0
    cap 05[50] = MSI supports 1 message, 64 bit 
    cap 10[80] = PCI-Express 2 downstream port max data 128(512) RO NS ARI disabled
                 link x1(x1) speed 2.5(5.0) ASPM disabled(L1)
                 slot 0 power limit 0 mW
    cap 0d[c0] = PCI Bridge card=0x00000000
    ecap 0001[100] = AER 1 0 fatal 0 non-fatal 0 corrected
    ecap 0004[140] = Power Budgeting 1
    ecap 000d[150] = ACS 1
    ecap 0012[180] = Multicast 1
    ecap 0019[1c0] = PCIe Sec 1 lane errors 0
    ecap 001e[200] = unknown 1

pcib14@pci0:10:14:0:	class=0x060400 card=0x00000000 chip=0x18061b21 rev=0x01 hdr=0x01
    vendor     = 'ASMedia Technology Inc.'
    class      = bridge
    subclass   = PCI-PCI
    cap 01[40] = powerspec 3  supports D0 D3  current D0
    cap 05[50] = MSI supports 1 message, 64 bit 
    cap 10[80] = PCI-Express 2 downstream port max data 128(512) RO NS ARI disabled
                 link x1(x1) speed 2.5(5.0) ASPM disabled(L1)
                 slot 0 power limit 0 mW
    cap 0d[c0] = PCI Bridge card=0x00000000
    ecap 0001[100] = AER 1 0 fatal 0 non-fatal 0 corrected
    ecap 0004[140] = Power Budgeting 1
    ecap 000d[150] = ACS 1
    ecap 0012[180] = Multicast 1
    ecap 0019[1c0] = PCIe Sec 1 lane errors 0
    ecap 001e[200] = unknown 1

igb2@pci0:11:0:0:	class=0x020000 card=0x00008086 chip=0x15398086 rev=0x03 hdr=0x00
    vendor     = 'Intel Corporation'
    device     = 'I211 Gigabit Network Connection'
    class      = network
    subclass   = ethernet
    bar   [10] = type Memory, range 32, base 0xdee00000, size 131072, enabled
    bar   [18] = type I/O Port, range 32, base 0xa000, size 32, enabled
    bar   [1c] = type Memory, range 32, base 0xdee20000, size 16384, enabled
    cap 01[40] = powerspec 3  supports D0 D3  current D0
    cap 05[50] = MSI supports 1 message, 64 bit, vector masks 
    cap 11[70] = MSI-X supports 5 messages, enabled
                 Table in map 0x1c[0x0], PBA in map 0x1c[0x2000]
    cap 10[a0] = PCI-Express 2 endpoint max data 128(512) FLR RO NS
                 link x1(x1) speed 2.5(2.5) ASPM disabled(L0s/L1)
    ecap 0001[100] = AER 2 0 fatal 0 non-fatal 1 corrected
    ecap 0003[140] = Serial 1 0002b6ffff460cfe
    ecap 0017[1a0] = TPH Requester 1

igb3@pci0:12:0:0:	class=0x020000 card=0x00008086 chip=0x15398086 rev=0x03 hdr=0x00
    vendor     = 'Intel Corporation'
    device     = 'I211 Gigabit Network Connection'
    class      = network
    subclass   = ethernet
    bar   [10] = type Memory, range 32, base 0xded00000, size 131072, enabled
    bar   [18] = type I/O Port, range 32, base 0x9000, size 32, enabled
    bar   [1c] = type Memory, range 32, base 0xded20000, size 16384, enabled
    cap 01[40] = powerspec 3  supports D0 D3  current D0
    cap 05[50] = MSI supports 1 message, 64 bit, vector masks 
    cap 11[70] = MSI-X supports 5 messages, enabled
                 Table in map 0x1c[0x0], PBA in map 0x1c[0x2000]
    cap 10[a0] = PCI-Express 2 endpoint max data 128(512) FLR RO NS
                 link x1(x1) speed 2.5(2.5) ASPM disabled(L0s/L1)
    ecap 0001[100] = AER 2 0 fatal 0 non-fatal 1 corrected
    ecap 0003[140] = Serial 1 0002b6ffff460cff
    ecap 0017[1a0] = TPH Requester 1

igb4@pci0:13:0:0:	class=0x020000 card=0x00008086 chip=0x15398086 rev=0x03 hdr=0x00
    vendor     = 'Intel Corporation'
    device     = 'I211 Gigabit Network Connection'
    class      = network
    subclass   = ethernet
    bar   [10] = type Memory, range 32, base 0xdec00000, size 131072, enabled
    bar   [18] = type I/O Port, range 32, base 0x8000, size 32, enabled
    bar   [1c] = type Memory, range 32, base 0xdec20000, size 16384, enabled
    cap 01[40] = powerspec 3  supports D0 D3  current D0
    cap 05[50] = MSI supports 1 message, 64 bit, vector masks 
    cap 11[70] = MSI-X supports 5 messages, enabled
                 Table in map 0x1c[0x0], PBA in map 0x1c[0x2000]
    cap 10[a0] = PCI-Express 2 endpoint max data 128(512) FLR RO NS
                 link x1(x1) speed 2.5(2.5) ASPM disabled(L0s/L1)
    ecap 0001[100] = AER 2 0 fatal 0 non-fatal 1 corrected
    ecap 0003[140] = Serial 1 0002b6ffff460d00
    ecap 0017[1a0] = TPH Requester 1

igb5@pci0:14:0:0:	class=0x020000 card=0x00008086 chip=0x15398086 rev=0x03 hdr=0x00
    vendor     = 'Intel Corporation'
    device     = 'I211 Gigabit Network Connection'
    class      = network
    subclass   = ethernet
    bar   [10] = type Memory, range 32, base 0xdeb00000, size 131072, enabled
    bar   [18] = type I/O Port, range 32, base 0x7000, size 32, enabled
    bar   [1c] = type Memory, range 32, base 0xdeb20000, size 16384, enabled
    cap 01[40] = powerspec 3  supports D0 D3  current D0
    cap 05[50] = MSI supports 1 message, 64 bit, vector masks 
    cap 11[70] = MSI-X supports 5 messages, enabled
                 Table in map 0x1c[0x0], PBA in map 0x1c[0x2000]
    cap 10[a0] = PCI-Express 2 endpoint max data 128(512) FLR RO NS
                 link x1(x1) speed 2.5(2.5) ASPM disabled(L0s/L1)
    ecap 0001[100] = AER 2 0 fatal 0 non-fatal 1 corrected
    ecap 0003[140] = Serial 1 0002b6ffff460d01
    ecap 0017[1a0] = TPH Requester 1

pcib16@pci0:15:0:0:	class=0x060400 card=0x00000000 chip=0x18061b21 rev=0x01 hdr=0x01
    vendor     = 'ASMedia Technology Inc.'
    class      = bridge
    subclass   = PCI-PCI
    cap 01[40] = powerspec 3  supports D0 D3  current D0
    cap 05[50] = MSI supports 1 message, 64 bit 
    cap 10[80] = PCI-Express 2 upstream port max data 128(512) RO NS ARI disabled
                 link x2(x2) speed 5.0(5.0) ASPM disabled(L1)
    cap 0d[c0] = PCI Bridge card=0x00000000
    ecap 0001[100] = AER 1 0 fatal 1 non-fatal 1 corrected
    ecap 0004[140] = Power Budgeting 1
    ecap 0018[160] = LTR 1
    ecap 0012[180] = Multicast 1
    ecap 0019[1c0] = PCIe Sec 1 lane errors 0
    ecap 001e[200] = unknown 1

pcib17@pci0:16:0:0:	class=0x060400 card=0x00000000 chip=0x18061b21 rev=0x01 hdr=0x01
    vendor     = 'ASMedia Technology Inc.'
    class      = bridge
    subclass   = PCI-PCI
    cap 01[40] = powerspec 3  supports D0 D3  current D0
    cap 05[50] = MSI supports 1 message, 64 bit 
    cap 10[80] = PCI-Express 2 downstream port max data 128(512) RO NS ARI disabled
                 link x1(x1) speed 2.5(5.0) ASPM disabled(L1)
                 slot 0 power limit 0 mW
    cap 0d[c0] = PCI Bridge card=0x00000000
    ecap 0001[100] = AER 1 0 fatal 0 non-fatal 0 corrected
    ecap 0004[140] = Power Budgeting 1
    ecap 000d[150] = ACS 1
    ecap 0012[180] = Multicast 1
    ecap 0019[1c0] = PCIe Sec 1 lane errors 0
    ecap 001e[200] = unknown 1

pcib18@pci0:16:2:0:	class=0x060400 card=0x00000000 chip=0x18061b21 rev=0x01 hdr=0x01
    vendor     = 'ASMedia Technology Inc.'
    class      = bridge
    subclass   = PCI-PCI
    cap 01[40] = powerspec 3  supports D0 D3  current D0
    cap 05[50] = MSI supports 1 message, 64 bit 
    cap 10[80] = PCI-Express 2 downstream port max data 128(512) RO NS ARI disabled
                 link x1(x1) speed 2.5(5.0) ASPM disabled(L1)
                 slot 0 power limit 0 mW
    cap 0d[c0] = PCI Bridge card=0x00000000
    ecap 0001[100] = AER 1 0 fatal 0 non-fatal 0 corrected
    ecap 0004[140] = Power Budgeting 1
    ecap 000d[150] = ACS 1
    ecap 0012[180] = Multicast 1
    ecap 0019[1c0] = PCIe Sec 1 lane errors 0
    ecap 001e[200] = unknown 1

pcib19@pci0:16:6:0:	class=0x060400 card=0x00000000 chip=0x18061b21 rev=0x01 hdr=0x01
    vendor     = 'ASMedia Technology Inc.'
    class      = bridge
    subclass   = PCI-PCI
    cap 01[40] = powerspec 3  supports D0 D3  current D0
    cap 05[50] = MSI supports 1 message, 64 bit 
    cap 10[80] = PCI-Express 2 downstream port max data 128(512) RO NS ARI disabled
                 link x1(x1) speed 2.5(5.0) ASPM disabled(L1)
                 slot 0 power limit 0 mW
    cap 0d[c0] = PCI Bridge card=0x00000000
    ecap 0001[100] = AER 1 0 fatal 0 non-fatal 0 corrected
    ecap 0004[140] = Power Budgeting 1
    ecap 000d[150] = ACS 1
    ecap 0012[180] = Multicast 1
    ecap 0019[1c0] = PCIe Sec 1 lane errors 0
    ecap 001e[200] = unknown 1

pcib20@pci0:16:14:0:	class=0x060400 card=0x00000000 chip=0x18061b21 rev=0x01 hdr=0x01
    vendor     = 'ASMedia Technology Inc.'
    class      = bridge
    subclass   = PCI-PCI
    cap 01[40] = powerspec 3  supports D0 D3  current D0
    cap 05[50] = MSI supports 1 message, 64 bit 
    cap 10[80] = PCI-Express 2 downstream port max data 128(512) RO NS ARI disabled
                 link x1(x1) speed 2.5(5.0) ASPM disabled(L1)
                 slot 0 power limit 0 mW
    cap 0d[c0] = PCI Bridge card=0x00000000
    ecap 0001[100] = AER 1 0 fatal 0 non-fatal 0 corrected
    ecap 0004[140] = Power Budgeting 1
    ecap 000d[150] = ACS 1
    ecap 0012[180] = Multicast 1
    ecap 0019[1c0] = PCIe Sec 1 lane errors 0
    ecap 001e[200] = unknown 1

igb6@pci0:17:0:0:	class=0x020000 card=0x00008086 chip=0x15398086 rev=0x03 hdr=0x00
    vendor     = 'Intel Corporation'
    device     = 'I211 Gigabit Network Connection'
    class      = network
    subclass   = ethernet
    bar   [10] = type Memory, range 32, base 0xdea00000, size 131072, enabled
    bar   [18] = type I/O Port, range 32, base 0x6000, size 32, enabled
    bar   [1c] = type Memory, range 32, base 0xdea20000, size 16384, enabled
    cap 01[40] = powerspec 3  supports D0 D3  current D0
    cap 05[50] = MSI supports 1 message, 64 bit, vector masks 
    cap 11[70] = MSI-X supports 5 messages, enabled
                 Table in map 0x1c[0x0], PBA in map 0x1c[0x2000]
    cap 10[a0] = PCI-Express 2 endpoint max data 128(512) FLR RO NS
                 link x1(x1) speed 2.5(2.5) ASPM disabled(L0s/L1)
    ecap 0001[100] = AER 2 0 fatal 0 non-fatal 1 corrected
    ecap 0003[140] = Serial 1 0002b6ffff460d02
    ecap 0017[1a0] = TPH Requester 1

igb7@pci0:18:0:0:	class=0x020000 card=0x00008086 chip=0x15398086 rev=0x03 hdr=0x00
    vendor     = 'Intel Corporation'
    device     = 'I211 Gigabit Network Connection'
    class      = network
    subclass   = ethernet
    bar   [10] = type Memory, range 32, base 0xde900000, size 131072, enabled
    bar   [18] = type I/O Port, range 32, base 0x5000, size 32, enabled
    bar   [1c] = type Memory, range 32, base 0xde920000, size 16384, enabled
    cap 01[40] = powerspec 3  supports D0 D3  current D0
    cap 05[50] = MSI supports 1 message, 64 bit, vector masks 
    cap 11[70] = MSI-X supports 5 messages, enabled
                 Table in map 0x1c[0x0], PBA in map 0x1c[0x2000]
    cap 10[a0] = PCI-Express 2 endpoint max data 128(512) FLR RO NS
                 link x1(x1) speed 2.5(2.5) ASPM disabled(L0s/L1)
    ecap 0001[100] = AER 2 0 fatal 0 non-fatal 1 corrected
    ecap 0003[140] = Serial 1 0002b6ffff460d03
    ecap 0017[1a0] = TPH Requester 1

igb8@pci0:19:0:0:	class=0x020000 card=0x00008086 chip=0x15398086 rev=0x03 hdr=0x00
    vendor     = 'Intel Corporation'
    device     = 'I211 Gigabit Network Connection'
    class      = network
    subclass   = ethernet
    bar   [10] = type Memory, range 32, base 0xde800000, size 131072, enabled
    bar   [18] = type I/O Port, range 32, base 0x4000, size 32, enabled
    bar   [1c] = type Memory, range 32, base 0xde820000, size 16384, enabled
    cap 01[40] = powerspec 3  supports D0 D3  current D0
    cap 05[50] = MSI supports 1 message, 64 bit, vector masks 
    cap 11[70] = MSI-X supports 5 messages, enabled
                 Table in map 0x1c[0x0], PBA in map 0x1c[0x2000]
    cap 10[a0] = PCI-Express 2 endpoint max data 128(512) FLR RO NS
                 link x1(x1) speed 2.5(2.5) ASPM disabled(L0s/L1)
    ecap 0001[100] = AER 2 0 fatal 0 non-fatal 1 corrected
    ecap 0003[140] = Serial 1 0002b6ffff460d04
    ecap 0017[1a0] = TPH Requester 1

igb9@pci0:20:0:0:	class=0x020000 card=0x00008086 chip=0x15398086 rev=0x03 hdr=0x00
    vendor     = 'Intel Corporation'
    device     = 'I211 Gigabit Network Connection'
    class      = network
    subclass   = ethernet
    bar   [10] = type Memory, range 32, base 0xde700000, size 131072, enabled
    bar   [18] = type I/O Port, range 32, base 0x3000, size 32, enabled
    bar   [1c] = type Memory, range 32, base 0xde720000, size 16384, enabled
    cap 01[40] = powerspec 3  supports D0 D3  current D0
    cap 05[50] = MSI supports 1 message, 64 bit, vector masks 
    cap 11[70] = MSI-X supports 5 messages, enabled
                 Table in map 0x1c[0x0], PBA in map 0x1c[0x2000]
    cap 10[a0] = PCI-Express 2 endpoint max data 128(512) FLR RO NS
                 link x1(x1) speed 2.5(2.5) ASPM disabled(L0s/L1)
    ecap 0001[100] = AER 2 0 fatal 0 non-fatal 1 corrected
    ecap 0003[140] = Serial 1 0002b6ffff460d05
    ecap 0017[1a0] = TPH Requester 1

ix0@pci0:21:0:0:	class=0x020000 card=0x00008086 chip=0x15c48086 rev=0x11 hdr=0x00
    vendor     = 'Intel Corporation'
    device     = 'Ethernet Connection X553 10 GbE SFP+'
    class      = network
    subclass   = ethernet
    bar   [10] = type Prefetchable Memory, range 64, base 0xdcc00000, size 2097152, enabled
    bar   [20] = type Prefetchable Memory, range 64, base 0xdce04000, size 16384, enabled
    cap 01[40] = powerspec 3  supports D0 D3  current D0
    cap 05[50] = MSI supports 1 message, 64 bit, vector masks 
    cap 11[70] = MSI-X supports 64 messages, enabled
                 Table in map 0x20[0x0], PBA in map 0x20[0x2000]
    cap 10[a0] = PCI-Express 2 endpoint max data 128(128) FLR RO
                 link x1(x1) speed 2.5(2.5) ASPM disabled(L0s/L1)
    ecap 0001[100] = AER 2 0 fatal 0 non-fatal 1 corrected
    ecap 0003[140] = Serial 1 0000c9ffff000000
    ecap 000e[150] = ARI 1
    ecap 0010[160] = SR-IOV 1 IOV disabled, Memory Space disabled, ARI disabled
                     0 VFs configured out of 64 supported
                     First VF RID Offset 0x0180, VF RID Stride 0x0002
                     VF Device ID 0x15c5
                     Page Sizes: 4096 (enabled), 8192, 65536, 262144, 1048576, 4194304
    ecap 000d[1b0] = ACS 1

ix1@pci0:21:0:1:	class=0x020000 card=0x00008086 chip=0x15c48086 rev=0x11 hdr=0x00
    vendor     = 'Intel Corporation'
    device     = 'Ethernet Connection X553 10 GbE SFP+'
    class      = network
    subclass   = ethernet
    bar   [10] = type Prefetchable Memory, range 64, base 0xdca00000, size 2097152, enabled
    bar   [20] = type Prefetchable Memory, range 64, base 0xdce00000, size 16384, enabled
    cap 01[40] = powerspec 3  supports D0 D3  current D0
    cap 05[50] = MSI supports 1 message, 64 bit, vector masks 
    cap 11[70] = MSI-X supports 64 messages, enabled
                 Table in map 0x20[0x0], PBA in map 0x20[0x2000]
    cap 10[a0] = PCI-Express 2 endpoint max data 128(128) FLR RO
                 link x1(x1) speed 2.5(2.5) ASPM disabled(L0s/L1)
    ecap 0001[100] = AER 2 0 fatal 0 non-fatal 1 corrected
    ecap 0003[140] = Serial 1 0000c9ffff000000
    ecap 000e[150] = ARI 1
    ecap 0010[160] = SR-IOV 1 IOV disabled, Memory Space disabled, ARI disabled
                     0 VFs configured out of 64 supported
                     First VF RID Offset 0x0180, VF RID Stride 0x0002
                     VF Device ID 0x15c5
                     Page Sizes: 4096 (enabled), 8192, 65536, 262144, 1048576, 4194304
    ecap 000d[1b0] = ACS 1

ix2@pci0:22:0:0:	class=0x020000 card=0x00008086 chip=0x15c48086 rev=0x11 hdr=0x00
    vendor     = 'Intel Corporation'
    device     = 'Ethernet Connection X553 10 GbE SFP+'
    class      = network
    subclass   = ethernet
    bar   [10] = type Prefetchable Memory, range 64, base 0xdc600000, size 2097152, enabled
    bar   [20] = type Prefetchable Memory, range 64, base 0xdc804000, size 16384, enabled
    cap 01[40] = powerspec 3  supports D0 D3  current D0
    cap 05[50] = MSI supports 1 message, 64 bit, vector masks 
    cap 11[70] = MSI-X supports 64 messages, enabled
                 Table in map 0x20[0x0], PBA in map 0x20[0x2000]
    cap 10[a0] = PCI-Express 2 endpoint max data 128(128) FLR RO
                 link x1(x1) speed 2.5(2.5) ASPM disabled(L0s/L1)
    ecap 0001[100] = AER 2 0 fatal 0 non-fatal 1 corrected
    ecap 0003[140] = Serial 1 0100c9ffff000000
    ecap 000e[150] = ARI 1
    ecap 0010[160] = SR-IOV 1 IOV disabled, Memory Space disabled, ARI disabled
                     0 VFs configured out of 64 supported
                     First VF RID Offset 0x0180, VF RID Stride 0x0002
                     VF Device ID 0x15c5
                     Page Sizes: 4096 (enabled), 8192, 65536, 262144, 1048576, 4194304
    ecap 000d[1b0] = ACS 1

ix3@pci0:22:0:1:	class=0x020000 card=0x00008086 chip=0x15c48086 rev=0x11 hdr=0x00
    vendor     = 'Intel Corporation'
    device     = 'Ethernet Connection X553 10 GbE SFP+'
    class      = network
    subclass   = ethernet
    bar   [10] = type Prefetchable Memory, range 64, base 0xdc400000, size 2097152, enabled
    bar   [20] = type Prefetchable Memory, range 64, base 0xdc800000, size 16384, enabled
    cap 01[40] = powerspec 3  supports D0 D3  current D0
    cap 05[50] = MSI supports 1 message, 64 bit, vector masks 
    cap 11[70] = MSI-X supports 64 messages, enabled
                 Table in map 0x20[0x0], PBA in map 0x20[0x2000]
    cap 10[a0] = PCI-Express 2 endpoint max data 128(128) FLR RO
                 link x1(x1) speed 2.5(2.5) ASPM disabled(L0s/L1)
    ecap 0001[100] = AER 2 0 fatal 0 non-fatal 1 corrected
    ecap 0003[140] = Serial 1 0100c9ffff000000
    ecap 000e[150] = ARI 1
    ecap 0010[160] = SR-IOV 1 IOV disabled, Memory Space disabled, ARI disabled
                     0 VFs configured out of 64 supported
                     First VF RID Offset 0x0180, VF RID Stride 0x0002
                     VF Device ID 0x15c5
                     Page Sizes: 4096 (enabled), 8192, 65536, 262144, 1048576, 4194304
    ecap 000d[1b0] = ACS 1
