hostb0@pci0:0:0:0:	class=0x060000 card=0xa0008086 chip=0xa0008086 rev=0x02 hdr=0x00
    vendor     = 'Intel Corporation'
    device     = 'Atom Processor D4xx/D5xx/N4xx/N5xx DMI Bridge'
    class      = bridge
    subclass   = HOST-PCI
    cap 09[e0] = vendor (length 8) Intel cap 12 version 1

vgapci0@pci0:0:2:0:	class=0x030000 card=0xa0018086 chip=0xa0018086 rev=0x02 hdr=0x00
    vendor     = 'Intel Corporation'
    device     = 'Atom Processor D4xx/D5xx/N4xx/N5xx Integrated Graphics Controller'
    class      = display
    subclass   = VGA
    bar   [10] = type Memory, range 32, base 0xfe480000, size 524288, enabled
    bar   [14] = type I/O Port, range 32, base 0xac00, size 8, enabled
    bar   [18] = type Prefetchable Memory, range 32, base 0xd0000000, size 268435456, enabled
    bar   [1c] = type Memory, range 32, base 0xfe500000, size 1048576, enabled
    cap 05[90] = MSI supports 1 message 
    cap 01[d0] = powerspec 2  supports D0 D3  current D0

pcib1@pci0:0:28:0:	class=0x060400 card=0x27d08086 chip=0x27d08086 rev=0x02 hdr=0x01
    vendor     = 'Intel Corporation'
    device     = 'NM10/ICH7 Family PCI Express Port 1'
    class      = bridge
    subclass   = PCI-PCI
    cap 10[40] = PCI-Express 1 root port max data 128(128)
                 link x1(x1) speed 2.5(2.5) ASPM disabled(L0s/L1)
                 slot 32 power limit 10000 mW HotPlug(present) surprise
    cap 05[80] = MSI supports 1 message 
    cap 0d[90] = PCI Bridge card=0x27d08086
    cap 01[a0] = powerspec 2  supports D0 D3  current D0
    ecap 0002[100] = VC 1 max VC1
    ecap 0005[180] = Root Complex Link Declaration 1

pcib2@pci0:0:28:1:	class=0x060400 card=0x27d28086 chip=0x27d28086 rev=0x02 hdr=0x01
    vendor     = 'Intel Corporation'
    device     = 'NM10/ICH7 Family PCI Express Port 2'
    class      = bridge
    subclass   = PCI-PCI
    cap 10[40] = PCI-Express 1 root port max data 128(128)
                 link x1(x1) speed 2.5(2.5) ASPM disabled(L0s/L1)
                 slot 33 power limit 10000 mW HotPlug(present) surprise
    cap 05[80] = MSI supports 1 message 
    cap 0d[90] = PCI Bridge card=0x27d28086
    cap 01[a0] = powerspec 2  supports D0 D3  current D0
    ecap 0002[100] = VC 1 max VC1
    ecap 0005[180] = Root Complex Link Declaration 1

pcib3@pci0:0:28:2:	class=0x060400 card=0x27d48086 chip=0x27d48086 rev=0x02 hdr=0x01
    vendor     = 'Intel Corporation'
    device     = 'NM10/ICH7 Family PCI Express Port 3'
    class      = bridge
    subclass   = PCI-PCI
    cap 10[40] = PCI-Express 1 root port max data 128(128)
                 link x1(x1) speed 2.5(2.5) ASPM disabled(L0s/L1)
                 slot 34 power limit 10000 mW HotPlug(present) surprise
    cap 05[80] = MSI supports 1 message 
    cap 0d[90] = PCI Bridge card=0x27d48086
    cap 01[a0] = powerspec 2  supports D0 D3  current D0
    ecap 0002[100] = VC 1 max VC1
    ecap 0005[180] = Root Complex Link Declaration 1

uhci0@pci0:0:29:0:	class=0x0c0300 card=0x27c88086 chip=0x27c88086 rev=0x02 hdr=0x00
    vendor     = 'Intel Corporation'
    device     = 'NM10/ICH7 Family USB UHCI Controller'
    class      = serial bus
    subclass   = USB
    bar   [20] = type I/O Port, range 32, base 0xa880, size 32, enabled

uhci1@pci0:0:29:1:	class=0x0c0300 card=0x27c98086 chip=0x27c98086 rev=0x02 hdr=0x00
    vendor     = 'Intel Corporation'
    device     = 'NM10/ICH7 Family USB UHCI Controller'
    class      = serial bus
    subclass   = USB
    bar   [20] = type I/O Port, range 32, base 0xa800, size 32, enabled

uhci2@pci0:0:29:2:	class=0x0c0300 card=0x27ca8086 chip=0x27ca8086 rev=0x02 hdr=0x00
    vendor     = 'Intel Corporation'
    device     = 'NM10/ICH7 Family USB UHCI Controller'
    class      = serial bus
    subclass   = USB
    bar   [20] = type I/O Port, range 32, base 0xa480, size 32, enabled

uhci3@pci0:0:29:3:	class=0x0c0300 card=0x27cb8086 chip=0x27cb8086 rev=0x02 hdr=0x00
    vendor     = 'Intel Corporation'
    device     = 'NM10/ICH7 Family USB UHCI Controller'
    class      = serial bus
    subclass   = USB
    bar   [20] = type I/O Port, range 32, base 0xa400, size 32, enabled

ehci0@pci0:0:29:7:	class=0x0c0320 card=0x27cc0010 chip=0x27cc8086 rev=0x02 hdr=0x00
    vendor     = 'Intel Corporation'
    device     = 'NM10/ICH7 Family USB2 EHCI Controller'
    class      = serial bus
    subclass   = USB
    bar   [10] = type Memory, range 32, base 0xfe47bc00, size 1024, enabled
    cap 01[50] = powerspec 2  supports D0 D3  current D0
    cap 0a[58] = EHCI Debug Port at offset 0xa0 in map 0x14

pcib4@pci0:0:30:0:	class=0x060401 card=0x24488086 chip=0x24488086 rev=0xe2 hdr=0x01
    vendor     = 'Intel Corporation'
    device     = '82801 Mobile PCI Bridge'
    class      = bridge
    subclass   = PCI-PCI
    cap 0d[50] = PCI Bridge card=0x24488086

isab0@pci0:0:31:0:	class=0x060100 card=0x27bc8086 chip=0x27bc8086 rev=0x02 hdr=0x00
    vendor     = 'Intel Corporation'
    device     = 'NM10 Family LPC Controller'
    class      = bridge
    subclass   = PCI-ISA
    cap 09[e0] = vendor (length 12) Intel cap 1 version 0
		 features: Quick Resume, SATA RAID-5, Mobile, 6 PCI-e x1 slots, SATA RAID-0/1/10

ahci0@pci0:0:31:2:	class=0x010601 card=0x27c18086 chip=0x27c18086 rev=0x02 hdr=0x00
    vendor     = 'Intel Corporation'
    device     = 'NM10/ICH7 Family SATA Controller [AHCI mode]'
    class      = mass storage
    subclass   = SATA
    bar   [10] = type I/O Port, range 32, base 0x9800, size 8, enabled
    bar   [14] = type I/O Port, range 32, base 0xa080, size 4, enabled
    bar   [18] = type I/O Port, range 32, base 0xa000, size 8, enabled
    bar   [1c] = type I/O Port, range 32, base 0x9c00, size 4, enabled
    bar   [20] = type I/O Port, range 32, base 0x9880, size 32, enabled
    bar   [24] = type Memory, range 32, base 0xfe47b800, size 1024, enabled
    cap 05[80] = MSI supports 1 message enabled with 1 message
    cap 01[70] = powerspec 2  supports D0 D3  current D0
    cap 12[a8] = SATA Index-Data Pair

none0@pci0:0:31:3:	class=0x0c0500 card=0x27da8086 chip=0x27da8086 rev=0x02 hdr=0x00
    vendor     = 'Intel Corporation'
    device     = 'NM10/ICH7 Family SMBus Controller'
    class      = serial bus
    subclass   = SMBus
    bar   [20] = type I/O Port, range 32, base 0x400, size 32, enabled

atapci0@pci0:1:0:0:	class=0x010185 card=0x2368197b chip=0x2368197b rev=0x00 hdr=0x00
    vendor     = 'JMicron Technology Corp.'
    device     = 'JMB368 IDE controller'
    class      = mass storage
    subclass   = ATA
    bar   [10] = type I/O Port, range 32, base 0xbc00, size 8, enabled
    bar   [14] = type I/O Port, range 32, base 0xb880, size 4, enabled
    bar   [18] = type I/O Port, range 32, base 0xb800, size 8, enabled
    bar   [1c] = type I/O Port, range 32, base 0xb480, size 4, enabled
    bar   [20] = type I/O Port, range 32, base 0xb400, size 16, enabled
    cap 01[68] = powerspec 2  supports D0 D3  current D0
    cap 10[50] = PCI-Express 1 legacy endpoint MSI 1 max data 128(128)
                 link x1(x1) speed 2.5(2.5) ASPM disabled(L0s)

re0@pci0:2:0:0:	class=0x020000 card=0x816810ec chip=0x816810ec rev=0x03 hdr=0x00
    vendor     = 'Realtek Semiconductor Co., Ltd.'
    device     = 'RTL8111/8168/8411 PCI Express Gigabit Ethernet Controller'
    class      = network
    subclass   = ethernet
    bar   [10] = type I/O Port, range 32, base 0xc800, size 256, enabled
    bar   [18] = type Prefetchable Memory, range 64, base 0xfddfb000, size 4096, enabled
    bar   [20] = type Prefetchable Memory, range 64, base 0xfddfc000, size 16384, enabled
    cap 01[40] = powerspec 3  supports D0 D1 D2 D3  current D0
    cap 05[50] = MSI supports 1 message, 64 bit 
    cap 10[70] = PCI-Express 2 endpoint MSI 1 max data 128(256) RO
                 link x1(x1) speed 2.5(2.5) ASPM disabled(L0s/L1)
    cap 11[ac] = MSI-X supports 4 messages, enabled
                 Table in map 0x20[0x0], PBA in map 0x20[0x800]
    cap 03[cc] = VPD
    ecap 0001[100] = AER 1 0 fatal 0 non-fatal 2 corrected
    ecap 0002[140] = VC 1 max VC0
    ecap 0003[160] = Serial 1 23000000684ce000

re1@pci0:3:0:0:	class=0x020000 card=0x816810ec chip=0x816810ec rev=0x03 hdr=0x00
    vendor     = 'Realtek Semiconductor Co., Ltd.'
    device     = 'RTL8111/8168/8411 PCI Express Gigabit Ethernet Controller'
    class      = network
    subclass   = ethernet
    bar   [10] = type I/O Port, range 32, base 0xd800, size 256, enabled
    bar   [18] = type Prefetchable Memory, range 64, base 0xfdefb000, size 4096, enabled
    bar   [20] = type Prefetchable Memory, range 64, base 0xfdefc000, size 16384, enabled
    cap 01[40] = powerspec 3  supports D0 D1 D2 D3  current D0
    cap 05[50] = MSI supports 1 message, 64 bit 
    cap 10[70] = PCI-Express 2 endpoint MSI 1 max data 128(256) RO
                 link x1(x1) speed 2.5(2.5) ASPM disabled(L0s/L1)
    cap 11[ac] = MSI-X supports 4 messages, enabled
                 Table in map 0x20[0x0], PBA in map 0x20[0x800]
    cap 03[cc] = VPD
    ecap 0001[100] = AER 1 0 fatal 0 non-fatal 2 corrected
    ecap 0002[140] = VC 1 max VC0
    ecap 0003[160] = Serial 1 24000000684ce000

pcib5@pci0:4:5:0:	class=0x060400 card=0x00000000 chip=0x00241011 rev=0x03 hdr=0x01
    vendor     = 'Digital Equipment Corporation'
    device     = 'DECchip 21152'
    class      = bridge
    subclass   = PCI-PCI
    cap 01[dc] = powerspec 1  supports D0 D3  current D0

fxp0@pci0:5:4:0:	class=0x020000 card=0x10f08086 chip=0x12298086 rev=0x05 hdr=0x00
    vendor     = 'Intel Corporation'
    device     = '82557/8/9/0/1 Ethernet Pro 100'
    class      = network
    subclass   = ethernet
    bar   [10] = type Prefetchable Memory, range 32, base 0xfdfff000, size 4096, enabled
    bar   [14] = type I/O Port, range 32, base 0xec00, size 32, enabled
    bar   [18] = type Memory, range 32, base 0xfeb00000, size 1048576, enabled
    cap 01[dc] = powerspec 1  supports D0 D1 D2 D3  current D0

fxp1@pci0:5:5:0:	class=0x020000 card=0x10f08086 chip=0x12298086 rev=0x05 hdr=0x00
    vendor     = 'Intel Corporation'
    device     = '82557/8/9/0/1 Ethernet Pro 100'
    class      = network
    subclass   = ethernet
    bar   [10] = type Prefetchable Memory, range 32, base 0xfdffe000, size 4096, enabled
    bar   [14] = type I/O Port, range 32, base 0xe880, size 32, enabled
    bar   [18] = type Memory, range 32, base 0xfe900000, size 1048576, enabled
    cap 01[dc] = powerspec 1  supports D0 D1 D2 D3  current D0
