hostb0@pci0:0:0:0:	class=0x060000 rev=0x22 hdr=0x00 vendor=0x8086 device=0x3406 subvendor=0x15d9 subdevice=0x0404
    vendor     = 'Intel Corporation'
    device     = '5520 I/O Hub to ESI Port'
    class      = bridge
    subclass   = HOST-PCI
    cap 05[60] = MSI supports 2 messages, vector masks 
    cap 10[90] = PCI-Express 2 root port max data 128(128) ARI disabled
                 max read 128
                 link x4(x4) speed 2.5(2.5) ASPM disabled(L0s/L1)
    cap 01[e0] = powerspec 3  supports D0 D3  current D0
    ecap 0001[100] = AER 1 0 fatal 0 non-fatal 0 corrected
    ecap 000d[150] = ACS 1
    ecap 000b[160] = Vendor [0] ID 0002 Rev 0 Length 12

pcib1@pci0:0:1:0:	class=0x060400 rev=0x22 hdr=0x01 vendor=0x8086 device=0x3408 subvendor=0x15d9 subdevice=0x0404
    vendor     = 'Intel Corporation'
    device     = '5520/5500/X58 I/O Hub PCI Express Root Port 1'
    class      = bridge
    subclass   = PCI-PCI
    cap 0d[40] = PCI Bridge subvendor=0x15d9 subdevice=0x0404
    cap 05[60] = MSI supports 2 messages, vector masks 
    cap 10[90] = PCI-Express 2 root port max data 256(256) ARI disabled
                 max read 128
                 link x1(x4) speed 5.0(5.0) ASPM disabled(L0s/L1)
                 slot 3 power limit 10000 mW
    cap 01[e0] = powerspec 3  supports D0 D3  current D0
    ecap 0001[100] = AER 1 0 fatal 0 non-fatal 0 corrected
    ecap 000d[150] = ACS 1
    ecap 000b[160] = Vendor [0] ID 0002 Rev 0 Length 12

pcib2@pci0:0:3:0:	class=0x060400 rev=0x22 hdr=0x01 vendor=0x8086 device=0x340a subvendor=0x15d9 subdevice=0x0404
    vendor     = 'Intel Corporation'
    device     = '5520/5500/X58 I/O Hub PCI Express Root Port 3'
    class      = bridge
    subclass   = PCI-PCI
    cap 0d[40] = PCI Bridge subvendor=0x15d9 subdevice=0x0404
    cap 05[60] = MSI supports 2 messages, vector masks 
    cap 10[90] = PCI-Express 2 root port max data 128(256) ARI disabled
                 max read 128
                 link x0(x8) speed 0.0(5.0) ASPM disabled(L0s/L1)
                 slot 6 power limit 25000 mW
    cap 01[e0] = powerspec 3  supports D0 D3  current D0
    ecap 0001[100] = AER 1 0 fatal 0 non-fatal 0 corrected
    ecap 000d[150] = ACS 1
    ecap 000b[160] = Vendor [0] ID 0002 Rev 0 Length 12

pcib3@pci0:0:5:0:	class=0x060400 rev=0x22 hdr=0x01 vendor=0x8086 device=0x340c subvendor=0x15d9 subdevice=0x0404
    vendor     = 'Intel Corporation'
    device     = '5520/X58 I/O Hub PCI Express Root Port 5'
    class      = bridge
    subclass   = PCI-PCI
    cap 0d[40] = PCI Bridge subvendor=0x15d9 subdevice=0x0404
    cap 05[60] = MSI supports 2 messages, vector masks 
    cap 10[90] = PCI-Express 2 root port max data 256(256) ARI disabled
                 max read 128
                 link x8(x8) speed 2.5(5.0) ASPM disabled(L0s/L1)
                 slot 6 power limit 25000 mW
    cap 01[e0] = powerspec 3  supports D0 D3  current D0
    ecap 0001[100] = AER 1 0 fatal 0 non-fatal 0 corrected
    ecap 000d[150] = ACS 1

pcib4@pci0:0:7:0:	class=0x060400 rev=0x22 hdr=0x01 vendor=0x8086 device=0x340e subvendor=0x15d9 subdevice=0x0404
    vendor     = 'Intel Corporation'
    device     = '5520/5500/X58 I/O Hub PCI Express Root Port 7'
    class      = bridge
    subclass   = PCI-PCI
    cap 0d[40] = PCI Bridge subvendor=0x15d9 subdevice=0x0404
    cap 05[60] = MSI supports 2 messages, vector masks 
    cap 10[90] = PCI-Express 2 root port max data 256(256) ARI enabled
                 max read 128
                 link x8(x8) speed 5.0(5.0) ASPM disabled(L0s/L1)
                 slot 5 power limit 25000 mW
    cap 01[e0] = powerspec 3  supports D0 D3  current D0
    ecap 0001[100] = AER 1 0 fatal 0 non-fatal 0 corrected
    ecap 000d[150] = ACS 1
    ecap 000b[160] = Vendor [0] ID 0002 Rev 0 Length 12

pcib5@pci0:0:9:0:	class=0x060400 rev=0x22 hdr=0x01 vendor=0x8086 device=0x3410 subvendor=0x15d9 subdevice=0x0404
    vendor     = 'Intel Corporation'
    device     = '7500/5520/5500/X58 I/O Hub PCI Express Root Port 9'
    class      = bridge
    subclass   = PCI-PCI
    cap 0d[40] = PCI Bridge subvendor=0x15d9 subdevice=0x0404
    cap 05[60] = MSI supports 2 messages, vector masks 
    cap 10[90] = PCI-Express 2 root port max data 256(256) ARI enabled
                 max read 128
                 link x8(x8) speed 5.0(5.0) ASPM disabled(L0s/L1)
                 slot 4 power limit 25000 mW
    cap 01[e0] = powerspec 3  supports D0 D3  current D0
    ecap 0001[100] = AER 1 0 fatal 0 non-fatal 0 corrected
    ecap 000d[150] = ACS 1

hostb1@pci0:0:13:0:	class=0x060000 rev=0x22 hdr=0x00 vendor=0x8086 device=0x343a subvendor=0x0000 subdevice=0x0000
    vendor     = 'Intel Corporation'
    class      = bridge
    subclass   = HOST-PCI
    cap 10[40] = PCI-Express 2 root endpoint max data 128(128)
                 max read 128
                 link x0(x0) ASPM disabled(L0s)
    cap 00[60] = unknown
    ecap 000b[100] = Vendor [0] ID 0001 Rev 0 Length 184
    ecap 000b[800] = Vendor [0] ID 0001 Rev 0 Length 184

hostb2@pci0:0:13:1:	class=0x060000 rev=0x22 hdr=0x00 vendor=0x8086 device=0x343b subvendor=0x0000 subdevice=0x0000
    vendor     = 'Intel Corporation'
    class      = bridge
    subclass   = HOST-PCI
    cap 10[40] = PCI-Express 2 root endpoint max data 128(128)
                 max read 128
                 link x0(x0) ASPM disabled(L0s)
    cap 00[60] = unknown
    ecap 000b[100] = Vendor [0] ID 0001 Rev 0 Length 184
    ecap 000b[800] = Vendor [0] ID 0001 Rev 0 Length 184

hostb3@pci0:0:13:2:	class=0x060000 rev=0x22 hdr=0x00 vendor=0x8086 device=0x343c subvendor=0x0000 subdevice=0x0000
    vendor     = 'Intel Corporation'
    class      = bridge
    subclass   = HOST-PCI
    cap 10[40] = PCI-Express 2 root endpoint max data 128(128)
                 max read 128
                 link x0(x0) ASPM disabled(L0s)
    cap 00[60] = unknown

hostb4@pci0:0:13:3:	class=0x060000 rev=0x22 hdr=0x00 vendor=0x8086 device=0x343d subvendor=0x0000 subdevice=0x0000
    vendor     = 'Intel Corporation'
    class      = bridge
    subclass   = HOST-PCI
    cap 10[40] = PCI-Express 2 root endpoint max data 128(128)
                 max read 128
                 link x0(x0) ASPM disabled(L0s)
    cap 00[60] = unknown
    ecap 000b[100] = Vendor [0] ID 0001 Rev 0 Length 184

hostb5@pci0:0:13:4:	class=0x060000 rev=0x22 hdr=0x00 vendor=0x8086 device=0x3418 subvendor=0x0000 subdevice=0x0000
    vendor     = 'Intel Corporation'
    device     = '7500/5520/5500/X58 Physical Layer Port 0'
    class      = bridge
    subclass   = HOST-PCI
    cap 10[40] = PCI-Express 2 root endpoint max data 128(128)
                 max read 128
                 link x0(x0) ASPM disabled(L0s)
    cap 00[60] = unknown

hostb6@pci0:0:13:5:	class=0x060000 rev=0x22 hdr=0x00 vendor=0x8086 device=0x3419 subvendor=0x0000 subdevice=0x0000
    vendor     = 'Intel Corporation'
    device     = '7500/5520/5500 Physical Layer Port 1'
    class      = bridge
    subclass   = HOST-PCI
    cap 10[40] = PCI-Express 2 root endpoint max data 128(128)
                 max read 128
                 link x0(x0) ASPM disabled(L0s)
    cap 00[60] = unknown

hostb7@pci0:0:13:6:	class=0x060000 rev=0x22 hdr=0x00 vendor=0x8086 device=0x341a subvendor=0x0000 subdevice=0x0000
    vendor     = 'Intel Corporation'
    class      = bridge
    subclass   = HOST-PCI
    cap 10[40] = PCI-Express 2 root endpoint max data 128(128)
                 max read 128
                 link x0(x0) ASPM disabled(L0s)
    cap 00[60] = unknown

hostb8@pci0:0:14:0:	class=0x060000 rev=0x22 hdr=0x00 vendor=0x8086 device=0x341c subvendor=0x0000 subdevice=0x0000
    vendor     = 'Intel Corporation'
    class      = bridge
    subclass   = HOST-PCI
    cap 10[40] = PCI-Express 2 root endpoint max data 128(128)
                 max read 128
                 link x0(x0) ASPM disabled(L0s)
    cap 00[60] = unknown
    ecap 000b[100] = Vendor [0] ID 0001 Rev 0 Length 184

hostb9@pci0:0:14:1:	class=0x060000 rev=0x22 hdr=0x00 vendor=0x8086 device=0x341d subvendor=0x0000 subdevice=0x0000
    vendor     = 'Intel Corporation'
    class      = bridge
    subclass   = HOST-PCI
    cap 10[40] = PCI-Express 2 root endpoint max data 128(128)
                 max read 128
                 link x0(x0) ASPM disabled(L0s)
    cap 00[60] = unknown

hostb10@pci0:0:14:2:	class=0x060000 rev=0x22 hdr=0x00 vendor=0x8086 device=0x341e subvendor=0x0000 subdevice=0x0000
    vendor     = 'Intel Corporation'
    class      = bridge
    subclass   = HOST-PCI
    cap 10[40] = PCI-Express 2 root endpoint max data 128(128)
                 max read 128
                 link x0(x0) ASPM disabled(L0s)
    cap 00[60] = unknown

hostb11@pci0:0:14:4:	class=0x060000 rev=0x22 hdr=0x00 vendor=0x8086 device=0x3439 subvendor=0x0000 subdevice=0x0000
    vendor     = 'Intel Corporation'
    class      = bridge
    subclass   = HOST-PCI
    cap 10[40] = PCI-Express 2 root endpoint max data 128(128)
                 max read 128
                 link x0(x0) ASPM disabled(L0s)

ioapic0@pci0:0:19:0:	class=0x080020 rev=0x22 hdr=0x00 vendor=0x8086 device=0x342d subvendor=0x0000 subdevice=0x0000
    vendor     = 'Intel Corporation'
    device     = '7500/5520/5500/X58 I/O Hub I/OxAPIC Interrupt Controller'
    class      = base peripheral
    subclass   = interrupt controller
    bar   [10] = type Memory, range 32, base 0xfec8a000, size 4096, enabled
    cap 01[6c] = powerspec 3  supports D0 D3  current D0

none0@pci0:0:20:0:	class=0x080000 rev=0x22 hdr=0x00 vendor=0x8086 device=0x342e subvendor=0x0000 subdevice=0x0000
    vendor     = 'Intel Corporation'
    device     = '7500/5520/5500/X58 I/O Hub System Management Registers'
    class      = base peripheral
    subclass   = interrupt controller
    cap 10[40] = PCI-Express 2 root endpoint max data 128(128)
                 max read 128
                 link x0(x0) ASPM disabled(L0s)

none1@pci0:0:20:1:	class=0x080000 rev=0x22 hdr=0x00 vendor=0x8086 device=0x3422 subvendor=0x0000 subdevice=0x0000
    vendor     = 'Intel Corporation'
    device     = '7500/5520/5500/X58 I/O Hub GPIO and Scratch Pad Registers'
    class      = base peripheral
    subclass   = interrupt controller
    cap 10[40] = PCI-Express 2 root endpoint max data 128(128)
                 max read 128
                 link x0(x0) ASPM disabled(L0s)

none2@pci0:0:20:2:	class=0x080000 rev=0x22 hdr=0x00 vendor=0x8086 device=0x3423 subvendor=0x0000 subdevice=0x0000
    vendor     = 'Intel Corporation'
    device     = '7500/5520/5500/X58 I/O Hub Control Status and RAS Registers'
    class      = base peripheral
    subclass   = interrupt controller
    cap 10[40] = PCI-Express 2 root endpoint max data 128(128)
                 max read 128
                 link x0(x0) ASPM disabled(L0s)

none3@pci0:0:20:3:	class=0x080000 rev=0x22 hdr=0x00 vendor=0x8086 device=0x3438 subvendor=0x0000 subdevice=0x0000
    vendor     = 'Intel Corporation'
    device     = '7500/5520/5500/X58 I/O Hub Throttle Registers'
    class      = base peripheral
    subclass   = interrupt controller

ioat0@pci0:0:22:0:	class=0x088000 rev=0x22 hdr=0x00 vendor=0x8086 device=0x3430 subvendor=0x15d9 subdevice=0x0404
    vendor     = 'Intel Corporation'
    device     = '5520/5500/X58 Chipset QuickData Technology Device'
    class      = base peripheral
    bar   [10] = type Memory, range 64, base 0xf99f0000, size 16384, enabled
    cap 11[80] = MSI-X supports 1 message, enabled
                 Table in map 0x10[0x2000], PBA in map 0x10[0x3000]
    cap 10[90] = PCI-Express 2 root endpoint max data 128(128) NS
                 max read 128
    cap 01[e0] = powerspec 3  supports D0 D3  current D0

ioat1@pci0:0:22:1:	class=0x088000 rev=0x22 hdr=0x00 vendor=0x8086 device=0x3431 subvendor=0x15d9 subdevice=0x0404
    vendor     = 'Intel Corporation'
    device     = '5520/5500/X58 Chipset QuickData Technology Device'
    class      = base peripheral
    bar   [10] = type Memory, range 64, base 0xf99ec000, size 16384, enabled
    cap 11[80] = MSI-X supports 1 message, enabled
                 Table in map 0x10[0x2000], PBA in map 0x10[0x3000]
    cap 10[90] = PCI-Express 2 root endpoint max data 128(128) NS
                 max read 128
    cap 01[e0] = powerspec 3  supports D0 D3  current D0

ioat2@pci0:0:22:2:	class=0x088000 rev=0x22 hdr=0x00 vendor=0x8086 device=0x3432 subvendor=0x15d9 subdevice=0x0404
    vendor     = 'Intel Corporation'
    device     = '5520/5500/X58 Chipset QuickData Technology Device'
    class      = base peripheral
    bar   [10] = type Memory, range 64, base 0xf99e8000, size 16384, enabled
    cap 11[80] = MSI-X supports 1 message, enabled
                 Table in map 0x10[0x2000], PBA in map 0x10[0x3000]
    cap 10[90] = PCI-Express 2 root endpoint max data 128(128) NS
                 max read 128
    cap 01[e0] = powerspec 3  supports D0 D3  current D0

ioat3@pci0:0:22:3:	class=0x088000 rev=0x22 hdr=0x00 vendor=0x8086 device=0x3433 subvendor=0x15d9 subdevice=0x0404
    vendor     = 'Intel Corporation'
    device     = '5520/5500/X58 Chipset QuickData Technology Device'
    class      = base peripheral
    bar   [10] = type Memory, range 64, base 0xf99e4000, size 16384, enabled
    cap 11[80] = MSI-X supports 1 message, enabled
                 Table in map 0x10[0x2000], PBA in map 0x10[0x3000]
    cap 10[90] = PCI-Express 2 root endpoint max data 128(128) NS
                 max read 128
    cap 01[e0] = powerspec 3  supports D0 D3  current D0

ioat4@pci0:0:22:4:	class=0x088000 rev=0x22 hdr=0x00 vendor=0x8086 device=0x3429 subvendor=0x15d9 subdevice=0x0404
    vendor     = 'Intel Corporation'
    device     = '5520/5500/X58 Chipset QuickData Technology Device'
    class      = base peripheral
    bar   [10] = type Memory, range 64, base 0xf99e0000, size 16384, enabled
    cap 11[80] = MSI-X supports 1 message, enabled
                 Table in map 0x10[0x2000], PBA in map 0x10[0x3000]
    cap 10[90] = PCI-Express 2 root endpoint max data 128(128) NS
                 max read 128
    cap 01[e0] = powerspec 3  supports D0 D3  current D0

ioat5@pci0:0:22:5:	class=0x088000 rev=0x22 hdr=0x00 vendor=0x8086 device=0x342a subvendor=0x15d9 subdevice=0x0404
    vendor     = 'Intel Corporation'
    device     = '5520/5500/X58 Chipset QuickData Technology Device'
    class      = base peripheral
    bar   [10] = type Memory, range 64, base 0xf99dc000, size 16384, enabled
    cap 11[80] = MSI-X supports 1 message, enabled
                 Table in map 0x10[0x2000], PBA in map 0x10[0x3000]
    cap 10[90] = PCI-Express 2 root endpoint max data 128(128) NS
                 max read 128
    cap 01[e0] = powerspec 3  supports D0 D3  current D0

ioat6@pci0:0:22:6:	class=0x088000 rev=0x22 hdr=0x00 vendor=0x8086 device=0x342b subvendor=0x15d9 subdevice=0x0404
    vendor     = 'Intel Corporation'
    device     = '5520/5500/X58 Chipset QuickData Technology Device'
    class      = base peripheral
    bar   [10] = type Memory, range 64, base 0xf99d8000, size 16384, enabled
    cap 11[80] = MSI-X supports 1 message, enabled
                 Table in map 0x10[0x2000], PBA in map 0x10[0x3000]
    cap 10[90] = PCI-Express 2 root endpoint max data 128(128) NS
                 max read 128
    cap 01[e0] = powerspec 3  supports D0 D3  current D0

ioat7@pci0:0:22:7:	class=0x088000 rev=0x22 hdr=0x00 vendor=0x8086 device=0x342c subvendor=0x15d9 subdevice=0x0404
    vendor     = 'Intel Corporation'
    device     = '5520/5500/X58 Chipset QuickData Technology Device'
    class      = base peripheral
    bar   [10] = type Memory, range 64, base 0xf99d4000, size 16384, enabled
    cap 11[80] = MSI-X supports 1 message, enabled
                 Table in map 0x10[0x2000], PBA in map 0x10[0x3000]
    cap 10[90] = PCI-Express 2 root endpoint max data 128(128) NS
                 max read 128
    cap 01[e0] = powerspec 3  supports D0 D3  current D0

uhci0@pci0:0:26:0:	class=0x0c0300 rev=0x00 hdr=0x00 vendor=0x8086 device=0x3a37 subvendor=0x15d9 subdevice=0x0404
    vendor     = 'Intel Corporation'
    device     = '82801JI (ICH10 Family) USB UHCI Controller'
    class      = serial bus
    subclass   = USB
    bar   [20] = type I/O Port, range 32, base 0xaea0, size 32, enabled
    cap 13[50] = PCI Advanced Features: FLR TP

uhci1@pci0:0:26:1:	class=0x0c0300 rev=0x00 hdr=0x00 vendor=0x8086 device=0x3a38 subvendor=0x15d9 subdevice=0x0404
    vendor     = 'Intel Corporation'
    device     = '82801JI (ICH10 Family) USB UHCI Controller'
    class      = serial bus
    subclass   = USB
    bar   [20] = type I/O Port, range 32, base 0xae80, size 32, enabled
    cap 13[50] = PCI Advanced Features: FLR TP

uhci2@pci0:0:26:2:	class=0x0c0300 rev=0x00 hdr=0x00 vendor=0x8086 device=0x3a39 subvendor=0x15d9 subdevice=0x0404
    vendor     = 'Intel Corporation'
    device     = '82801JI (ICH10 Family) USB UHCI Controller'
    class      = serial bus
    subclass   = USB
    bar   [20] = type I/O Port, range 32, base 0xae20, size 32, enabled
    cap 13[50] = PCI Advanced Features: FLR TP

ehci0@pci0:0:26:7:	class=0x0c0320 rev=0x00 hdr=0x00 vendor=0x8086 device=0x3a3c subvendor=0x15d9 subdevice=0x0404
    vendor     = 'Intel Corporation'
    device     = '82801JI (ICH10 Family) USB2 EHCI Controller'
    class      = serial bus
    subclass   = USB
    bar   [10] = type Memory, range 32, base 0xf99f4000, size 1024, enabled
    cap 01[50] = powerspec 2  supports D0 D3  current D0
    cap 0a[58] = EHCI Debug Port at offset 0xa0 in map 0x14
    cap 13[98] = PCI Advanced Features: FLR TP

pcib6@pci0:0:28:0:	class=0x060400 rev=0x00 hdr=0x01 vendor=0x8086 device=0x3a40 subvendor=0x15d9 subdevice=0x0404
    vendor     = 'Intel Corporation'
    device     = '82801JI (ICH10 Family) PCI Express Root Port 1'
    class      = bridge
    subclass   = PCI-PCI
    cap 10[40] = PCI-Express 1 root port max data 128(128)
                 max read 128
                 link x0(x4) speed 0.0(2.5) ASPM disabled(L0s/L1)
                 slot 0 power limit 10000 mW HotPlug(empty) surprise
    cap 05[80] = MSI supports 1 message 
    cap 0d[90] = PCI Bridge subvendor=0x15d9 subdevice=0x0404
    cap 01[a0] = powerspec 2  supports D0 D3  current D0
    ecap 0002[100] = VC 1 max VC0
    ecap 0005[180] = Root Complex Link Declaration 1

pcib7@pci0:0:28:4:	class=0x060400 rev=0x00 hdr=0x01 vendor=0x8086 device=0x3a48 subvendor=0x15d9 subdevice=0x0404
    vendor     = 'Intel Corporation'
    device     = '82801JI (ICH10 Family) PCI Express Root Port 5'
    class      = bridge
    subclass   = PCI-PCI
    cap 10[40] = PCI-Express 1 root port max data 128(128)
                 max read 128
                 link x1(x1) speed 2.5(2.5) ASPM disabled(L0s/L1)
                 slot 0 power limit 10000 mW HotPlug(present) surprise
    cap 05[80] = MSI supports 1 message 
    cap 0d[90] = PCI Bridge subvendor=0x15d9 subdevice=0x0404
    cap 01[a0] = powerspec 2  supports D0 D3  current D0
    ecap 0002[100] = VC 1 max VC0
    ecap 0005[180] = Root Complex Link Declaration 1

pcib8@pci0:0:28:5:	class=0x060400 rev=0x00 hdr=0x01 vendor=0x8086 device=0x3a4a subvendor=0x15d9 subdevice=0x0404
    vendor     = 'Intel Corporation'
    device     = '82801JI (ICH10 Family) PCI Express Root Port 6'
    class      = bridge
    subclass   = PCI-PCI
    cap 10[40] = PCI-Express 1 root port max data 128(128)
                 max read 128
                 link x1(x1) speed 2.5(2.5) ASPM disabled(L0s/L1)
                 slot 0 power limit 10000 mW HotPlug(present) surprise
    cap 05[80] = MSI supports 1 message 
    cap 0d[90] = PCI Bridge subvendor=0x15d9 subdevice=0x0404
    cap 01[a0] = powerspec 2  supports D0 D3  current D0
    ecap 0002[100] = VC 1 max VC0
    ecap 0005[180] = Root Complex Link Declaration 1

uhci3@pci0:0:29:0:	class=0x0c0300 rev=0x00 hdr=0x00 vendor=0x8086 device=0x3a34 subvendor=0x15d9 subdevice=0x0404
    vendor     = 'Intel Corporation'
    device     = '82801JI (ICH10 Family) USB UHCI Controller'
    class      = serial bus
    subclass   = USB
    bar   [20] = type I/O Port, range 32, base 0xaf20, size 32, enabled
    cap 13[50] = PCI Advanced Features: FLR TP

uhci4@pci0:0:29:1:	class=0x0c0300 rev=0x00 hdr=0x00 vendor=0x8086 device=0x3a35 subvendor=0x15d9 subdevice=0x0404
    vendor     = 'Intel Corporation'
    device     = '82801JI (ICH10 Family) USB UHCI Controller'
    class      = serial bus
    subclass   = USB
    bar   [20] = type I/O Port, range 32, base 0xaf00, size 32, enabled
    cap 13[50] = PCI Advanced Features: FLR TP

uhci5@pci0:0:29:2:	class=0x0c0300 rev=0x00 hdr=0x00 vendor=0x8086 device=0x3a36 subvendor=0x15d9 subdevice=0x0404
    vendor     = 'Intel Corporation'
    device     = '82801JI (ICH10 Family) USB UHCI Controller'
    class      = serial bus
    subclass   = USB
    bar   [20] = type I/O Port, range 32, base 0xaec0, size 32, enabled
    cap 13[50] = PCI Advanced Features: FLR TP

ehci1@pci0:0:29:7:	class=0x0c0320 rev=0x00 hdr=0x00 vendor=0x8086 device=0x3a3a subvendor=0x15d9 subdevice=0x0404
    vendor     = 'Intel Corporation'
    device     = '82801JI (ICH10 Family) USB2 EHCI Controller'
    class      = serial bus
    subclass   = USB
    bar   [10] = type Memory, range 32, base 0xf99f6000, size 1024, enabled
    cap 01[50] = powerspec 2  supports D0 D3  current D0
    cap 0a[58] = EHCI Debug Port at offset 0xa0 in map 0x14
    cap 13[98] = PCI Advanced Features: FLR TP

pcib9@pci0:0:30:0:	class=0x060401 rev=0x90 hdr=0x01 vendor=0x8086 device=0x244e subvendor=0x15d9 subdevice=0x0404
    vendor     = 'Intel Corporation'
    device     = '82801 PCI Bridge'
    class      = bridge
    subclass   = PCI-PCI
    cap 0d[50] = PCI Bridge subvendor=0x15d9 subdevice=0x0404

isab0@pci0:0:31:0:	class=0x060100 rev=0x00 hdr=0x00 vendor=0x8086 device=0x3a16 subvendor=0x15d9 subdevice=0x0404
    vendor     = 'Intel Corporation'
    device     = '82801JIR (ICH10R) LPC Interface Controller'
    class      = bridge
    subclass   = PCI-ISA
    cap 09[e0] = vendor (length 12) Intel cap 1 version 0
		 features: SATA RAID-5, 4 PCI-e x1 slots

ahci0@pci0:0:31:2:	class=0x010601 rev=0x00 hdr=0x00 vendor=0x8086 device=0x3a22 subvendor=0x15d9 subdevice=0x0404
    vendor     = 'Intel Corporation'
    device     = '82801JI (ICH10 Family) SATA AHCI Controller'
    class      = mass storage
    subclass   = SATA
    bar   [10] = type I/O Port, range 32, base 0xaff0, size 8, enabled
    bar   [14] = type I/O Port, range 32, base 0xafac, size 4, enabled
    bar   [18] = type I/O Port, range 32, base 0xafe0, size 8, enabled
    bar   [1c] = type I/O Port, range 32, base 0xafa8, size 4, enabled
    bar   [20] = type I/O Port, range 32, base 0xaf80, size 32, enabled
    bar   [24] = type Memory, range 32, base 0xf99fa000, size 2048, enabled
    cap 05[80] = MSI supports 16 messages enabled with 16 messages
    cap 01[70] = powerspec 3  supports D0 D3  current D0
    cap 12[a8] = SATA Index-Data Pair
    cap 13[b0] = PCI Advanced Features: FLR TP

ichsmb0@pci0:0:31:3:	class=0x0c0500 rev=0x00 hdr=0x00 vendor=0x8086 device=0x3a30 subvendor=0x15d9 subdevice=0x0404
    vendor     = 'Intel Corporation'
    device     = '82801JI (ICH10 Family) SMBus Controller'
    class      = serial bus
    subclass   = SMBus
    bar   [10] = type Memory, range 64, base 0xf99f8000, size 256, enabled
    bar   [20] = type I/O Port, range 32, base 0x400, size 32, enabled

xhci0@pci0:9:0:0:	class=0x0c0330 rev=0x10 hdr=0x00 vendor=0x1b73 device=0x1100 subvendor=0x1b73 subdevice=0x1100
    vendor     = 'Fresco Logic'
    device     = 'FL1100 USB 3.0 Host Controller'
    class      = serial bus
    subclass   = USB
    bar   [10] = type Memory, range 64, base 0xfaff0000, size 65536, enabled
    bar   [18] = type Memory, range 64, base 0xfafef000, size 4096, enabled
    bar   [20] = type Memory, range 64, base 0xfafee000, size 4096, enabled
    cap 01[40] = powerspec 3  supports D0 D1 D3  current D0
    cap 05[50] = MSI supports 8 messages, 64 bit enabled with 1 message
    cap 10[70] = PCI-Express 2 endpoint max data 256(512) RO NS
                 max read 512
                 link x1(x1) speed 5.0(5.0) ASPM disabled(L0s/L1)
    cap 11[b0] = MSI-X supports 8 messages
                 Table in map 0x18[0x0], PBA in map 0x20[0x0]
    ecap 0001[100] = AER 1 0 fatal 0 non-fatal 1 corrected

mxge0@pci0:7:0:0:	class=0x020000 rev=0x01 hdr=0x00 vendor=0x14c1 device=0x0008 subvendor=0x14c1 subdevice=0x000a
    vendor     = 'MYRICOM Inc.'
    device     = 'Myri-10G Dual-Protocol NIC'
    class      = network
    subclass   = ethernet
    bar   [10] = type Prefetchable Memory, range 64, base 0xf7000000, size 16777216, enabled
    bar   [18] = type Memory, range 64, base 0xfae00000, size 1048576, enabled
    cap 05[44] = MSI supports 1 message, 64 bit enabled with 1 message
    cap 01[54] = powerspec 3  supports D0 D3  current D0
    cap 10[5c] = PCI-Express 2 endpoint max data 256(4096) FLR RO NS
                 max read 4096
                 link x8(x8) speed 2.5(2.5) ASPM disabled(L0s)
    cap 09[a0] = vendor (length 32)
    cap 11[d0] = MSI-X supports 128 messages
                 Table in map 0x18[0xf0000], PBA in map 0x18[0xf9000]
    cap 03[e0] = VPD
    ecap 0001[100] = AER 1 0 fatal 0 non-fatal 1 corrected
    ecap 0003[1a8] = Serial 1 0060ddffff444318

mps0@pci0:6:0:0:	class=0x010700 rev=0x03 hdr=0x00 vendor=0x1000 device=0x0072 subvendor=0x1000 subdevice=0x3020
    vendor     = 'Broadcom / LSI'
    device     = 'SAS2008 PCI-Express Fusion-MPT SAS-2 [Falcon]'
    class      = mass storage
    subclass   = SAS
    bar   [10] = type I/O Port, range 32, base 0xe000, size 256, enabled
    bar   [14] = type Memory, range 64, base 0xfac3c000, size 16384, enabled
    bar   [1c] = type Memory, range 64, base 0xfac40000, size 262144, enabled
    cap 01[50] = powerspec 3  supports D0 D1 D2 D3  current D0
    cap 10[68] = PCI-Express 2 endpoint max data 256(4096) FLR RO NS
                 max read 512
                 link x8(x8) speed 5.0(5.0) ASPM disabled(L0s)
    cap 03[d0] = VPD
    cap 05[a8] = MSI supports 1 message, 64 bit 
    cap 11[c0] = MSI-X supports 15 messages, enabled
                 Table in map 0x14[0x2000], PBA in map 0x14[0x3800]
    ecap 0001[100] = AER 1 0 fatal 0 non-fatal 1 corrected
    ecap 0004[138] = Power Budgeting 1
    ecap 0010[150] = SR-IOV 1 IOV disabled, Memory Space disabled, ARI disabled
                     0 VFs configured out of 16 supported
                     First VF RID Offset 0x0001, VF RID Stride 0x0001
                     VF Device ID 0x0072
                     Page Sizes: 4096 (enabled), 8192, 65536, 262144, 1048576, 4194304
    ecap 000e[190] = ARI 1

mps1@pci0:5:0:0:	class=0x010700 rev=0x03 hdr=0x00 vendor=0x1000 device=0x0072 subvendor=0x15d9 subdevice=0x0400
    vendor     = 'Broadcom / LSI'
    device     = 'SAS2008 PCI-Express Fusion-MPT SAS-2 [Falcon]'
    class      = mass storage
    subclass   = SAS
    bar   [10] = type I/O Port, range 32, base 0xd000, size 256, enabled
    bar   [14] = type Memory, range 64, base 0xfa33c000, size 16384, enabled
    bar   [1c] = type Memory, range 64, base 0xfa340000, size 262144, enabled
    cap 01[50] = powerspec 3  supports D0 D1 D2 D3  current D0
    cap 10[68] = PCI-Express 2 endpoint max data 256(4096) FLR RO NS
                 max read 512
                 link x8(x8) speed 5.0(5.0) ASPM disabled(L0s)
    cap 03[d0] = VPD
    cap 05[a8] = MSI supports 1 message, 64 bit 
    cap 11[c0] = MSI-X supports 15 messages, enabled
                 Table in map 0x14[0x2000], PBA in map 0x14[0x3800]
    ecap 0001[100] = AER 1 0 fatal 0 non-fatal 1 corrected
    ecap 0004[138] = Power Budgeting 1
    ecap 0010[150] = SR-IOV 1 IOV disabled, Memory Space disabled, ARI disabled
                     0 VFs configured out of 16 supported
                     First VF RID Offset 0x0001, VF RID Stride 0x0001
                     VF Device ID 0x0072
                     Page Sizes: 4096 (enabled), 8192, 65536, 262144, 1048576, 4194304
    ecap 000e[190] = ARI 1

em0@pci0:3:0:0:	class=0x020000 rev=0x00 hdr=0x00 vendor=0x8086 device=0x10d3 subvendor=0x15d9 subdevice=0x10d3
    vendor     = 'Intel Corporation'
    device     = '82574L Gigabit Network Connection'
    class      = network
    subclass   = ethernet
    bar   [10] = type Memory, range 32, base 0xf9ae0000, size 131072, enabled
    bar   [18] = type I/O Port, range 32, base 0xbf80, size 32, enabled
    bar   [1c] = type Memory, range 32, base 0xf9adc000, size 16384, enabled
    cap 01[c8] = powerspec 2  supports D0 D3  current D0
    cap 05[d0] = MSI supports 1 message, 64 bit 
    cap 10[e0] = PCI-Express 1 endpoint max data 128(256) RO NS
                 max read 512
                 link x1(x1) speed 2.5(2.5) ASPM disabled(L0s/L1)
    cap 11[a0] = MSI-X supports 5 messages, enabled
                 Table in map 0x1c[0x0], PBA in map 0x1c[0x2000]
    ecap 0001[100] = AER 1 0 fatal 0 non-fatal 0 corrected
    ecap 0003[140] = Serial 1 002590ffff6192d2

em1@pci0:4:0:0:	class=0x020000 rev=0x00 hdr=0x00 vendor=0x8086 device=0x10d3 subvendor=0x15d9 subdevice=0x10d3
    vendor     = 'Intel Corporation'
    device     = '82574L Gigabit Network Connection'
    class      = network
    subclass   = ethernet
    bar   [10] = type Memory, range 32, base 0xf9be0000, size 131072, enabled
    bar   [18] = type I/O Port, range 32, base 0xcf80, size 32, enabled
    bar   [1c] = type Memory, range 32, base 0xf9bdc000, size 16384, enabled
    cap 01[c8] = powerspec 2  supports D0 D3  current D0
    cap 05[d0] = MSI supports 1 message, 64 bit 
    cap 10[e0] = PCI-Express 1 endpoint max data 128(256) RO NS
                 max read 512
                 link x1(x1) speed 2.5(2.5) ASPM disabled(L0s/L1)
    cap 11[a0] = MSI-X supports 5 messages, enabled
                 Table in map 0x1c[0x0], PBA in map 0x1c[0x2000]
    ecap 0001[100] = AER 1 0 fatal 0 non-fatal 0 corrected
    ecap 0003[140] = Serial 1 002590ffff6192d3

vgapci0@pci0:1:3:0:	class=0x030000 rev=0x0a hdr=0x00 vendor=0x102b device=0x0532 subvendor=0x15d9 subdevice=0x0404
    vendor     = 'Matrox Electronics Systems Ltd.'
    device     = 'MGA G200eW WPCM450'
    class      = display
    subclass   = VGA
    bar   [10] = type Prefetchable Memory, range 32, base 0xf6000000, size 16777216, enabled
    bar   [14] = type Memory, range 32, base 0xf8ffc000, size 16384, enabled
    bar   [18] = type Memory, range 32, base 0xf9000000, size 8388608, enabled
    cap 01[dc] = powerspec 1  supports D0 D3  current D0
