hostb0@pci0:0:0:0:	class=0x060000 card=0x00a0106b chip=0x2a008086 rev=0x03 hdr=0x00
    vendor     = 'Intel Corporation'
    device     = 'Mobile PM965/GM965/GL960 Memory Controller Hub'
    class      = bridge
    subclass   = HOST-PCI
    cap 09[e0] = vendor (length 10) Intel cap 9 version 1

pcib1@pci0:0:1:0:	class=0x060400 card=0x00008086 chip=0x2a018086 rev=0x03 hdr=0x01
    vendor     = 'Intel Corporation'
    device     = 'Mobile PM965/GM965/GL960 PCI Express Root Port'
    class      = bridge
    subclass   = PCI-PCI
    cap 0d[88] = PCI Bridge card=0x00008086
    cap 01[80] = powerspec 3  supports D0 D3  current D0
    cap 05[90] = MSI supports 1 message 
    cap 10[a0] = PCI-Express 1 root port max data 128(128)
                 max read 128
                 link x16(x16) speed 2.5(2.5) ASPM L1(L0s/L1)
                 slot 1 power limit 75000 mW HotPlug(present)
    ecap 0002[100] = VC 1 max VC0
    ecap 0005[140] = Root Complex Link Declaration 1

uhci0@pci0:0:26:0:	class=0x0c0300 card=0x00000000 chip=0x28348086 rev=0x03 hdr=0x00
    vendor     = 'Intel Corporation'
    device     = '82801H (ICH8 Family) USB UHCI Controller'
    class      = serial bus
    subclass   = USB
    bar   [20] = type I/O Port, range 32, base 0x40c0, size 32, enabled

uhci1@pci0:0:26:1:	class=0x0c0300 card=0x00a0106b chip=0x28358086 rev=0x03 hdr=0x00
    vendor     = 'Intel Corporation'
    device     = '82801H (ICH8 Family) USB UHCI Controller'
    class      = serial bus
    subclass   = USB
    bar   [20] = type I/O Port, range 32, base 0x40a0, size 32, enabled

ehci0@pci0:0:26:7:	class=0x0c0320 card=0x00a0106b chip=0x283a8086 rev=0x03 hdr=0x00
    vendor     = 'Intel Corporation'
    device     = '82801H (ICH8 Family) USB2 EHCI Controller'
    class      = serial bus
    subclass   = USB
    bar   [10] = type Memory, range 32, base 0xd0704c00, size 1024, enabled
    cap 01[50] = powerspec 2  supports D0 D3  current D0
    cap 0a[58] = EHCI Debug Port at offset 0xa0 in map 0x14

hdac0@pci0:0:27:0:	class=0x040300 card=0x00a0106b chip=0x284b8086 rev=0x03 hdr=0x00
    vendor     = 'Intel Corporation'
    device     = '82801H (ICH8 Family) HD Audio Controller'
    class      = multimedia
    subclass   = HDA
    bar   [10] = type Memory, range 64, base 0xd0700000, size 16384, enabled
    cap 01[50] = powerspec 2  supports D0 D3  current D0
    cap 05[60] = MSI supports 1 message, 64 bit enabled with 1 message
    cap 10[70] = PCI-Express 1 root endpoint max data 128(128) NS
                 max read 128
    ecap 0002[100] = VC 1 max VC1
    ecap 0005[130] = Root Complex Link Declaration 1

pcib2@pci0:0:28:0:	class=0x060400 card=0x00000000 chip=0x283f8086 rev=0x03 hdr=0x01
    vendor     = 'Intel Corporation'
    device     = '82801H (ICH8 Family) PCI Express Port 1'
    class      = bridge
    subclass   = PCI-PCI
    cap 10[40] = PCI-Express 1 root port max data 128(128)
                 max read 128
                 link x0(x1) speed 0.0(2.5) ASPM disabled(L0s/L1)
                 slot 0 power limit 65 mW HotPlug(empty) surprise
    cap 05[80] = MSI supports 1 message enabled with 1 message
    cap 0d[90] = PCI Bridge card=0x00000000
    cap 01[a0] = powerspec 2  supports D0 D3  current D0
    ecap 0002[100] = VC 1 max VC0
    ecap 0005[180] = Root Complex Link Declaration 1

pcib3@pci0:0:28:3:	class=0x060400 card=0x00000000 chip=0x28458086 rev=0x03 hdr=0x01
    vendor     = 'Intel Corporation'
    device     = '82801H (ICH8 Family) PCI Express Port 4'
    class      = bridge
    subclass   = PCI-PCI
    cap 10[40] = PCI-Express 1 root port max data 128(128)
                 max read 128
                 link x1(x1) speed 2.5(2.5) ASPM disabled(L0s/L1)
                 slot 3 power limit 65 mW HotPlug(present) surprise
    cap 05[80] = MSI supports 1 message enabled with 1 message
    cap 0d[90] = PCI Bridge card=0x00000000
    cap 01[a0] = powerspec 2  supports D0 D3  current D0
    ecap 0002[100] = VC 1 max VC0
    ecap 0005[180] = Root Complex Link Declaration 1

pcib4@pci0:0:28:4:	class=0x060400 card=0x00000000 chip=0x28478086 rev=0x03 hdr=0x01
    vendor     = 'Intel Corporation'
    device     = '82801H (ICH8 Family) PCI Express Port 5'
    class      = bridge
    subclass   = PCI-PCI
    cap 10[40] = PCI-Express 1 root port max data 128(128)
                 max read 128
                 link x1(x1) speed 2.5(2.5) ASPM L1(L0s/L1)
                 slot 4 power limit 65 mW HotPlug(present) surprise
    cap 05[80] = MSI supports 1 message enabled with 1 message
    cap 0d[90] = PCI Bridge card=0x00000000
    cap 01[a0] = powerspec 2  supports D0 D3  current D0
    ecap 0002[100] = VC 1 max VC0
    ecap 0005[180] = Root Complex Link Declaration 1

pcib5@pci0:0:28:5:	class=0x060400 card=0x00000000 chip=0x28498086 rev=0x03 hdr=0x01
    vendor     = 'Intel Corporation'
    device     = '82801H (ICH8 Family) PCI Express Port 6'
    class      = bridge
    subclass   = PCI-PCI
    cap 10[40] = PCI-Express 1 root port max data 128(128)
                 max read 128
                 link x1(x1) speed 2.5(2.5) ASPM L1(L0s/L1)
                 slot 5 power limit 65 mW HotPlug(present) surprise
    cap 05[80] = MSI supports 1 message enabled with 1 message
    cap 0d[90] = PCI Bridge card=0x00000000
    cap 01[a0] = powerspec 2  supports D0 D3  current D0
    ecap 0002[100] = VC 1 max VC0
    ecap 0005[180] = Root Complex Link Declaration 1

uhci2@pci0:0:29:0:	class=0x0c0300 card=0x00a0106b chip=0x28308086 rev=0x03 hdr=0x00
    vendor     = 'Intel Corporation'
    device     = '82801H (ICH8 Family) USB UHCI Controller'
    class      = serial bus
    subclass   = USB
    bar   [20] = type I/O Port, range 32, base 0x4080, size 32, enabled

uhci3@pci0:0:29:1:	class=0x0c0300 card=0x00a0106b chip=0x28318086 rev=0x03 hdr=0x00
    vendor     = 'Intel Corporation'
    device     = '82801H (ICH8 Family) USB UHCI Controller'
    class      = serial bus
    subclass   = USB
    bar   [20] = type I/O Port, range 32, base 0x4060, size 32, enabled

uhci4@pci0:0:29:2:	class=0x0c0300 card=0x00a0106b chip=0x28328086 rev=0x03 hdr=0x00
    vendor     = 'Intel Corporation'
    device     = '82801H (ICH8 Family) USB UHCI Controller'
    class      = serial bus
    subclass   = USB
    bar   [20] = type I/O Port, range 32, base 0x4040, size 32, enabled

ehci1@pci0:0:29:7:	class=0x0c0320 card=0x00a0106b chip=0x28368086 rev=0x03 hdr=0x00
    vendor     = 'Intel Corporation'
    device     = '82801H (ICH8 Family) USB2 EHCI Controller'
    class      = serial bus
    subclass   = USB
    bar   [10] = type Memory, range 32, base 0xd0704800, size 1024, enabled
    cap 01[50] = powerspec 2  supports D0 D3  current D0
    cap 0a[58] = EHCI Debug Port at offset 0xa0 in map 0x14

pcib6@pci0:0:30:0:	class=0x060401 card=0x00000000 chip=0x24488086 rev=0xf3 hdr=0x01
    vendor     = 'Intel Corporation'
    device     = '82801 Mobile PCI Bridge'
    class      = bridge
    subclass   = PCI-PCI
    cap 0d[50] = PCI Bridge card=0x00000000

isab0@pci0:0:31:0:	class=0x060100 card=0x00a0106b chip=0x28158086 rev=0x03 hdr=0x00
    vendor     = 'Intel Corporation'
    device     = '82801HM (ICH8M) LPC Interface Controller'
    class      = bridge
    subclass   = PCI-ISA
    cap 09[e0] = vendor (length 12) Intel cap 1 version 0
		 features: SATA RAID-5, Mobile, 4 PCI-e x1 slots, SATA RAID-0/1/10

atapci0@pci0:0:31:1:	class=0x01018f card=0x00a0106b chip=0x28508086 rev=0x03 hdr=0x00
    vendor     = 'Intel Corporation'
    device     = '82801HM/HEM (ICH8M/ICH8M-E) IDE Controller'
    class      = mass storage
    subclass   = ATA
    bar   [10] = type I/O Port, range 32, base 0x4108, size 8, enabled
    bar   [14] = type I/O Port, range 32, base 0x411c, size 4, enabled
    bar   [18] = type I/O Port, range 32, base 0x4100, size 8, enabled
    bar   [1c] = type I/O Port, range 32, base 0x4118, size 4, enabled
    bar   [20] = type I/O Port, range 32, base 0x40e0, size 16, enabled

ahci0@pci0:0:31:2:	class=0x010601 card=0x00a0106b chip=0x28298086 rev=0x03 hdr=0x00
    vendor     = 'Intel Corporation'
    device     = '82801HM/HEM (ICH8M/ICH8M-E) SATA Controller [AHCI mode]'
    class      = mass storage
    subclass   = SATA
    bar   [10] = type I/O Port, range 32, base 0x40f8, size 8, enabled
    bar   [14] = type I/O Port, range 32, base 0x4114, size 4, enabled
    bar   [18] = type I/O Port, range 32, base 0x40f0, size 8, enabled
    bar   [1c] = type I/O Port, range 32, base 0x4110, size 4, enabled
    bar   [20] = type I/O Port, range 32, base 0x4020, size 32, enabled
    bar   [24] = type Memory, range 32, base 0xd0704000, size 2048, enabled
    cap 05[80] = MSI supports 4 messages enabled with 4 messages
    cap 01[70] = powerspec 3  supports D0 D3  current D0
    cap 12[a8] = SATA Index-Data Pair

none0@pci0:0:31:3:	class=0x0c0500 card=0x00a0106b chip=0x283e8086 rev=0x03 hdr=0x00
    vendor     = 'Intel Corporation'
    device     = '82801H (ICH8 Family) SMBus Controller'
    class      = serial bus
    subclass   = SMBus
    bar   [10] = type Memory, range 32, base 0xd0705000, size 256, enabled
    bar   [20] = type I/O Port, range 32, base 0xefa0, size 32, enabled

vgapci0@pci0:1:0:0:	class=0x030000 card=0x0083106b chip=0x95831002 rev=0x00 hdr=0x00
    vendor     = 'Advanced Micro Devices, Inc. [AMD/ATI]'
    device     = 'RV630/M76 [Mobility Radeon HD 2600 XT/2700]'
    class      = display
    subclass   = VGA
    bar   [10] = type Prefetchable Memory, range 64, base 0xc0000000, size 268435456, enabled
    bar   [18] = type Memory, range 64, base 0xd0620000, size 65536, enabled
    bar   [20] = type I/O Port, range 32, base 0x3000, size 256, enabled
    cap 01[50] = powerspec 3  supports D0 D1 D2 D3  current D0
    cap 10[58] = PCI-Express 1 legacy endpoint max data 128(128) RO NS
                 max read 128
                 link x16(x16) speed 2.5(2.5) ASPM L1(L0s/L1)
    cap 05[a0] = MSI supports 1 message, 64 bit 
    ecap 000b[100] = Vendor 1 ID 1

none1@pci0:3:0:0:	class=0x0c0010 card=0x590011c1 chip=0x590111c1 rev=0x05 hdr=0x00
    vendor     = 'LSI Corporation'
    device     = 'FW643 [TrueFire] PCIe 1394b Controller'
    class      = serial bus
    subclass   = FireWire
    bar   [10] = type Memory, range 64, base 0xd0400000, size 4096, enabled
    cap 01[44] = powerspec 3  supports D0 D1 D2 D3  current D0
    cap 05[4c] = MSI supports 1 message, 64 bit 
    cap 10[60] = PCI-Express 1 endpoint max data 128(256) RO
                 max read 2048
                 link x1(x1) speed 2.5(2.5) ASPM disabled(L0s/L1) ClockPM disabled
    ecap 0001[100] = AER 1 0 fatal 0 non-fatal 1 corrected
    ecap 0002[140] = VC 1 max VC1
    ecap 0003[170] = Serial 1 0000000000000000

bwn_pci0@pci0:4:0:0:	class=0x028000 card=0x0088106b chip=0x432814e4 rev=0x03 hdr=0x00
    vendor     = 'Broadcom Inc. and subsidiaries'
    device     = 'BCM4321 802.11a/b/g/n'
    class      = network
    bar   [10] = type Memory, range 64, base 0xd0300000, size 16384, enabled
    bar   [18] = type Prefetchable Memory, range 64, base 0xd0000000, size 1048576, enabled
    cap 01[40] = powerspec 2  supports D0 D1 D2 D3  current D0
    cap 09[58] = vendor (length 120)
    cap 05[e8] = MSI supports 1 message, 64 bit 
    cap 10[d0] = PCI-Express 1 endpoint max data 128(128)
                 max read 128
                 link x1(x1) speed 2.5(2.5)
    ecap 0001[100] = AER 1 0 fatal 0 non-fatal 1 corrected
    ecap 0002[13c] = VC 1 max VC0
    ecap 0003[160] = Serial 1 2502b3ffff74001c
    ecap 0004[16c] = Power Budgeting 1

mskc0@pci0:5:0:0:	class=0x020000 card=0x00ba11ab chip=0x436a11ab rev=0x13 hdr=0x00
    vendor     = 'Marvell Technology Group Ltd.'
    device     = '88E8058 PCI-E Gigabit Ethernet Controller'
    class      = network
    subclass   = ethernet
    bar   [10] = type Memory, range 64, base 0xd0200000, size 16384, enabled
    bar   [18] = type I/O Port, range 32, base 0x2000, size 256, enabled
    cap 01[48] = powerspec 3  supports D0 D1 D2 D3  current D0
    cap 03[50] = VPD
    cap 05[5c] = MSI supports 1 message, 64 bit enabled with 1 message
    cap 10[e0] = PCI-Express 1 legacy endpoint max data 128(128)
                 max read 2048
                 link x1(x1) speed 2.5(2.5) ASPM L0s/L1(L0s/L1) ClockPM disabled
    ecap 0001[100] = AER 1 0 fatal 0 non-fatal 1 corrected
