hostb0@pci0:0:0:0:	class=0x060000 rev=0x09 hdr=0x00 vendor=0x8086 device=0x1604 subvendor=0x1028 subdevice=0x062e
    vendor     = 'Intel Corporation'
    device     = 'Broadwell-U Host Bridge -OPI'
    class      = bridge
    subclass   = HOST-PCI
    cap 09[e0] = vendor (length 12) Intel cap 0 version 1

vgapci0@pci0:0:2:0:	class=0x030000 rev=0x09 hdr=0x00 vendor=0x8086 device=0x1616 subvendor=0x1028 subdevice=0x062e
    vendor     = 'Intel Corporation'
    device     = 'HD Graphics 5500'
    class      = display
    subclass   = VGA
    bar   [10] = type Memory, range 64, base 0xf6000000, size 16777216, enabled
    bar   [18] = type Prefetchable Memory, range 64, base 0xe0000000, size 268435456, enabled
    bar   [20] = type I/O Port, range 32, base 0xf000, size 64, enabled
    cap 05[90] = MSI supports 1 message enabled with 1 message
    cap 01[d0] = powerspec 2  supports D0 D3  current D0
    cap 13[a4] = PCI Advanced Features: FLR TP

hdac0@pci0:0:3:0:	class=0x040300 rev=0x09 hdr=0x00 vendor=0x8086 device=0x160c subvendor=0x1028 subdevice=0x062e
    vendor     = 'Intel Corporation'
    device     = 'Broadwell-U Audio Controller'
    class      = multimedia
    subclass   = HDA
    bar   [10] = type Memory, range 64, base 0xf743c000, size 16384, enabled
    cap 01[50] = powerspec 2  supports D0 D3  current D0
    cap 05[60] = MSI supports 1 message enabled with 1 message
    cap 10[70] = PCI-Express 1 root endpoint max data 128(128) FLR NS
                 max read 128

none0@pci0:0:4:0:	class=0x118000 rev=0x09 hdr=0x00 vendor=0x8086 device=0x1603 subvendor=0x1028 subdevice=0x062e
    vendor     = 'Intel Corporation'
    device     = 'Broadwell-U Processor Thermal Subsystem'
    class      = dasp
    bar   [10] = type Memory, range 64, base 0xf7430000, size 32768, enabled
    cap 05[90] = MSI supports 1 message 
    cap 01[d0] = powerspec 3  supports D0 D3  current D0
    cap 09[e0] = vendor (length 12) Intel cap 0 version 1

xhci0@pci0:0:20:0:	class=0x0c0330 rev=0x03 hdr=0x00 vendor=0x8086 device=0x9cb1 subvendor=0x1028 subdevice=0x062e
    vendor     = 'Intel Corporation'
    device     = 'Wildcat Point-LP USB xHCI Controller'
    class      = serial bus
    subclass   = USB
    bar   [10] = type Memory, range 64, base 0xf7420000, size 65536, enabled
    cap 01[70] = powerspec 2  supports D0 D3  current D0
    cap 05[80] = MSI supports 8 messages, 64 bit enabled with 1 message

none1@pci0:0:22:0:	class=0x078000 rev=0x03 hdr=0x00 vendor=0x8086 device=0x9cba subvendor=0x1028 subdevice=0x062e
    vendor     = 'Intel Corporation'
    device     = 'Wildcat Point-LP MEI Controller'
    class      = simple comms
    bar   [10] = type Memory, range 64, base 0xf7445000, size 32, enabled
    cap 01[50] = powerspec 3  supports D0 D3  current D0
    cap 05[8c] = MSI supports 1 message, 64 bit 

em0@pci0:0:25:0:	class=0x020000 rev=0x03 hdr=0x00 vendor=0x8086 device=0x15a2 subvendor=0x1028 subdevice=0x062e
    vendor     = 'Intel Corporation'
    device     = 'Ethernet Connection (3) I218-LM'
    class      = network
    subclass   = ethernet
    bar   [10] = type Memory, range 32, base 0xf7400000, size 131072, enabled
    bar   [14] = type Memory, range 32, base 0xf7443000, size 4096, enabled
    bar   [18] = type I/O Port, range 32, base 0xf080, size 32, enabled
    cap 01[c8] = powerspec 2  supports D0 D3  current D0
    cap 05[d0] = MSI supports 1 message, 64 bit enabled with 1 message
    cap 13[e0] = PCI Advanced Features: FLR TP

hdac1@pci0:0:27:0:	class=0x040300 rev=0x03 hdr=0x00 vendor=0x8086 device=0x9ca0 subvendor=0x1028 subdevice=0x062e
    vendor     = 'Intel Corporation'
    device     = 'Wildcat Point-LP High Definition Audio Controller'
    class      = multimedia
    subclass   = HDA
    bar   [10] = type Memory, range 64, base 0xf7438000, size 16384, enabled
    cap 01[50] = powerspec 3  supports D0 D3  current D0
    cap 05[60] = MSI supports 1 message, 64 bit enabled with 1 message

pcib1@pci0:0:28:0:	class=0x060400 rev=0xe3 hdr=0x01 vendor=0x8086 device=0x9c90 subvendor=0x1028 subdevice=0x062e
    vendor     = 'Intel Corporation'
    device     = 'Wildcat Point-LP PCI Express Root Port'
    class      = bridge
    subclass   = PCI-PCI
    cap 10[40] = PCI-Express 2 root port max data 128(128)
                 max read 128
                 link x1(x1) speed 2.5(5.0) ASPM L0s/L1(L0s/L1)
                 slot 0 power limit 100 mW
    cap 05[80] = MSI supports 1 message 
    cap 0d[90] = PCI Bridge subvendor=0x1028 subdevice=0x062e
    cap 01[a0] = powerspec 3  supports D0 D3  current D0
    ecap 0000[100] = unknown 0
    ecap 001e[200] = L1 PM Substates 1

pcib2@pci0:0:28:3:	class=0x060400 rev=0xe3 hdr=0x01 vendor=0x8086 device=0x9c96 subvendor=0x1028 subdevice=0x062e
    vendor     = 'Intel Corporation'
    device     = 'Wildcat Point-LP PCI Express Root Port'
    class      = bridge
    subclass   = PCI-PCI
    cap 10[40] = PCI-Express 2 root port max data 128(128)
                 max read 128
                 link x1(x1) speed 2.5(5.0) ASPM L1(L0s/L1)
                 slot 3 power limit 100 mW
    cap 05[80] = MSI supports 1 message 
    cap 0d[90] = PCI Bridge subvendor=0x1028 subdevice=0x062e
    cap 01[a0] = powerspec 3  supports D0 D3  current D0
    ecap 0000[100] = unknown 0
    ecap 001e[200] = L1 PM Substates 1

pcib3@pci0:0:28:4:	class=0x060400 rev=0xe3 hdr=0x01 vendor=0x8086 device=0x9c98 subvendor=0x1028 subdevice=0x062e
    vendor     = 'Intel Corporation'
    device     = 'Wildcat Point-LP PCI Express Root Port'
    class      = bridge
    subclass   = PCI-PCI
    cap 10[40] = PCI-Express 2 root port max data 128(128)
                 max read 128
                 link x0(x4) speed 0.0(5.0) ASPM L0s/L1(L0s/L1)
                 slot 4 power limit 250 mW
    cap 05[80] = MSI supports 1 message 
    cap 0d[90] = PCI Bridge subvendor=0x1028 subdevice=0x062e
    cap 01[a0] = powerspec 3  supports D0 D3  current D0
    ecap 0000[100] = unknown 0
    ecap 001e[200] = L1 PM Substates 1

ehci0@pci0:0:29:0:	class=0x0c0320 rev=0x03 hdr=0x00 vendor=0x8086 device=0x9ca6 subvendor=0x1028 subdevice=0x062e
    vendor     = 'Intel Corporation'
    device     = 'Wildcat Point-LP USB EHCI Controller'
    class      = serial bus
    subclass   = USB
    bar   [10] = type Memory, range 32, base 0xf7442000, size 1024, enabled
    cap 01[50] = powerspec 3  supports D0 D3  current D0
    cap 0a[58] = EHCI Debug Port at offset 0xa0 in map 0x14
    cap 13[98] = PCI Advanced Features: FLR TP

isab0@pci0:0:31:0:	class=0x060100 rev=0x03 hdr=0x00 vendor=0x8086 device=0x9cc3 subvendor=0x1028 subdevice=0x062e
    vendor     = 'Intel Corporation'
    device     = 'Wildcat Point-LP LPC Controller'
    class      = bridge
    subclass   = PCI-ISA
    cap 09[e0] = vendor (length 12) Intel cap 1 version 0
		 features: AMT, 4 PCI-e x1 slots

ahci0@pci0:0:31:2:	class=0x010601 rev=0x03 hdr=0x00 vendor=0x8086 device=0x9c83 subvendor=0x1028 subdevice=0x062e
    vendor     = 'Intel Corporation'
    device     = 'Wildcat Point-LP SATA Controller [AHCI Mode]'
    class      = mass storage
    subclass   = SATA
    bar   [10] = type I/O Port, range 32, base 0xf0d0, size 8, enabled
    bar   [14] = type I/O Port, range 32, base 0xf0c0, size 4, enabled
    bar   [18] = type I/O Port, range 32, base 0xf0b0, size 8, enabled
    bar   [1c] = type I/O Port, range 32, base 0xf0a0, size 4, enabled
    bar   [20] = type I/O Port, range 32, base 0xf060, size 32, enabled
    bar   [24] = type Memory, range 32, base 0xf7441000, size 2048, enabled
    cap 05[80] = MSI supports 1 message enabled with 1 message
    cap 01[70] = powerspec 3  supports D0 D3  current D0
    cap 12[a8] = SATA Index-Data Pair

ichsmb0@pci0:0:31:3:	class=0x0c0500 rev=0x03 hdr=0x00 vendor=0x8086 device=0x9ca2 subvendor=0x1028 subdevice=0x062e
    vendor     = 'Intel Corporation'
    device     = 'Wildcat Point-LP SMBus Controller'
    class      = serial bus
    subclass   = SMBus
    bar   [10] = type Memory, range 64, base 0xf7440000, size 256, enabled
    bar   [20] = type I/O Port, range 32, base 0xf040, size 32, enabled

sdhci_pci0@pci0:1:0:0:	class=0x080501 rev=0x01 hdr=0x00 vendor=0x1217 device=0x8520 subvendor=0x1028 subdevice=0x062e
    vendor     = 'O2 Micro, Inc.'
    device     = 'SD/MMC Card Reader Controller'
    class      = base peripheral
    subclass   = SD host controller
    bar   [10] = type Memory, range 32, base 0xf7301000, size 4096, enabled
    bar   [14] = type Memory, range 32, base 0xf7300000, size 2048, enabled
    cap 01[6c] = powerspec 3  supports D0 D3  current D0
    cap 05[48] = MSI supports 1 message, 64 bit, vector masks enabled with 1 message
    cap 10[80] = PCI-Express 2 endpoint max data 128(128) RO NS
                 max read 128
                 link x1(x1) speed 2.5(2.5) ASPM L0s/L1(L0s/L1) ClockPM enabled
    ecap 0002[100] = VC 1 max VC0
    ecap 0018[230] = LTR 1
    ecap 001e[240] = L1 PM Substates 1

none2@pci0:2:0:0:	class=0x028000 rev=0x03 hdr=0x00 vendor=0x14e4 device=0x43b1 subvendor=0x1028 subdevice=0x0019
    vendor     = 'Broadcom Inc. and subsidiaries'
    device     = 'BCM4352 802.11ac Wireless Network Adapter'
    class      = network
    bar   [10] = type Memory, range 64, base 0xf7200000, size 32768, enabled
    bar   [18] = type Memory, range 64, base 0xf7000000, size 2097152, enabled
    cap 01[48] = powerspec 3  supports D0 D1 D2 D3  current D0
    cap 05[58] = MSI supports 1 message, 64 bit 
    cap 09[68] = vendor (length 68)
    cap 10[ac] = PCI-Express 2 endpoint max data 128(256) RO NS
                 max read 512
                 link x1(x1) speed 2.5(2.5) ASPM L1(L0s/L1) ClockPM enabled
    ecap 0001[100] = AER 1 0 fatal 0 non-fatal 1 corrected
    ecap 0003[13c] = Serial 1 c48e00ffff000001
    ecap 0004[150] = Power Budgeting 1
    ecap 0002[160] = VC 1 max VC0
    ecap 0018[1b0] = LTR 1
    ecap 0015[220] = Resizable BAR 1
