hostb0@pci0:0:0:0:	class=0x060000 rev=0x0a hdr=0x00 vendor=0x8086 device=0x3ec2 subvendor=0x1043 subdevice=0x8694
    vendor     = 'Intel Corporation'
    device     = '8th Gen Core Processor Host Bridge/DRAM Registers'
    class      = bridge
    subclass   = HOST-PCI
    cap 09[e0] = vendor (length 16) Intel cap 0 version 1

vgapci0@pci0:0:2:0:	class=0x030000 rev=0x00 hdr=0x00 vendor=0x8086 device=0x3e98 subvendor=0x1043 subdevice=0x8694
    vendor     = 'Intel Corporation'
    device     = 'CoffeeLake-S GT2 [UHD Graphics 630]'
    class      = display
    subclass   = VGA
    bar   [10] = type Memory, range 64, base 0xa0000000, size 16777216, enabled
    bar   [18] = type Prefetchable Memory, range 64, base 0x90000000, size 268435456, enabled
    bar   [20] = type I/O Port, range 32, base 0x3000, size 64, enabled
    cap 09[40] = vendor (length 12) Intel cap 0 version 1
    cap 10[70] = PCI-Express 2 root endpoint max data 128(128) FLR
                 max read 128
    cap 05[ac] = MSI supports 1 message enabled with 1 message
    cap 01[d0] = powerspec 2  supports D0 D3  current D0
    ecap 001b[100] = Process Address Space ID 1
    ecap 000f[200] = ATS 1
    ecap 0013[300] = Page Page Request 1

xhci0@pci0:0:20:0:	class=0x0c0330 rev=0x10 hdr=0x00 vendor=0x8086 device=0xa36d subvendor=0x1043 subdevice=0x8694
    vendor     = 'Intel Corporation'
    device     = 'Cannon Lake PCH USB 3.1 xHCI Host Controller'
    class      = serial bus
    subclass   = USB
    bar   [10] = type Memory, range 64, base 0xa1220000, size 65536, enabled
    cap 01[70] = powerspec 2  supports D0 D3  current D0
    cap 05[80] = MSI supports 8 messages, 64 bit enabled with 1 message
    cap 09[90] = vendor (length 20) Intel cap 15 version 0

none0@pci0:0:20:2:	class=0x050000 rev=0x10 hdr=0x00 vendor=0x8086 device=0xa36f subvendor=0x1043 subdevice=0x8694
    vendor     = 'Intel Corporation'
    device     = 'Cannon Lake PCH Shared SRAM'
    class      = memory
    subclass   = RAM
    bar   [10] = type Memory, range 64, base 0xa1236000, size 8192, enabled
    bar   [18] = type Memory, range 64, base 0xa123c000, size 4096, enabled
    cap 01[80] = powerspec 3  supports D0 D3  current D0

none1@pci0:0:22:0:	class=0x078000 rev=0x10 hdr=0x00 vendor=0x8086 device=0xa360 subvendor=0x1043 subdevice=0x8694
    vendor     = 'Intel Corporation'
    device     = 'Cannon Lake PCH HECI Controller'
    class      = simple comms
    bar   [10] = type Memory, range 64, base 0xa123b000, size 4096, enabled
    cap 01[50] = powerspec 3  supports D0 D3  current D0
    cap 05[8c] = MSI supports 1 message, 64 bit 
    cap 09[a4] = vendor (length 20) Intel cap 15 version 0

ahci0@pci0:0:23:0:	class=0x010601 rev=0x10 hdr=0x00 vendor=0x8086 device=0xa352 subvendor=0x1043 subdevice=0x8694
    vendor     = 'Intel Corporation'
    device     = 'Cannon Lake PCH SATA AHCI Controller'
    class      = mass storage
    subclass   = SATA
    bar   [10] = type Memory, range 32, base 0xa1234000, size 8192, enabled
    bar   [14] = type Memory, range 32, base 0xa123a000, size 256, enabled
    bar   [18] = type I/O Port, range 32, base 0x3090, size 8, enabled
    bar   [1c] = type I/O Port, range 32, base 0x3080, size 4, enabled
    bar   [20] = type I/O Port, range 32, base 0x3060, size 32, enabled
    bar   [24] = type Memory, range 32, base 0xa1239000, size 2048, enabled
    cap 05[80] = MSI supports 1 message enabled with 1 message
    cap 01[70] = powerspec 3  supports D0 D3  current D0
    cap 12[a8] = SATA Index-Data Pair

pcib1@pci0:0:27:0:	class=0x060400 rev=0xf0 hdr=0x01 vendor=0x8086 device=0xa32c subvendor=0x1043 subdevice=0x8694
    vendor     = 'Intel Corporation'
    device     = 'Cannon Lake PCH PCI Express Root Port'
    class      = bridge
    subclass   = PCI-PCI
    cap 10[40] = PCI-Express 2 root port max data 128(256) ARI disabled
                 max read 128
                 link x0(x4) speed 0.0(8.0) ASPM L0s/L1(L0s/L1)
                 slot 0 power limit 0 mW HotPlug(empty) surprise
    cap 05[80] = MSI supports 1 message 
    cap 0d[90] = PCI Bridge subvendor=0x1043 subdevice=0x8694
    cap 01[a0] = powerspec 3  supports D0 D3  current D0

pcib2@pci0:0:28:0:	class=0x060400 rev=0xf0 hdr=0x01 vendor=0x8086 device=0xa33c subvendor=0x1043 subdevice=0x8694
    vendor     = 'Intel Corporation'
    device     = 'Cannon Lake PCH PCI Express Root Port'
    class      = bridge
    subclass   = PCI-PCI
    cap 10[40] = PCI-Express 2 root port max data 128(256) ARI disabled
                 max read 128
                 link x0(x1) speed 0.0(8.0) ASPM L0s/L1(L0s/L1)
    cap 05[80] = MSI supports 1 message 
    cap 0d[90] = PCI Bridge subvendor=0x1043 subdevice=0x8694
    cap 01[a0] = powerspec 3  supports D0 D3  current D0

pcib3@pci0:0:28:5:	class=0x060400 rev=0xf0 hdr=0x01 vendor=0x8086 device=0xa33d subvendor=0x1043 subdevice=0x8694
    vendor     = 'Intel Corporation'
    device     = 'Cannon Lake PCH PCI Express Root Port'
    class      = bridge
    subclass   = PCI-PCI
    cap 10[40] = PCI-Express 2 root port max data 128(256) ARI disabled
                 max read 128
                 link x1(x1) speed 2.5(8.0)
                 slot 9 power limit 100 mW
    cap 05[80] = MSI supports 1 message 
    cap 0d[90] = PCI Bridge subvendor=0x1043 subdevice=0x8694
    cap 01[a0] = powerspec 3  supports D0 D3  current D0
    ecap 0001[100] = AER 1 0 fatal 0 non-fatal 0 corrected
    ecap 000d[140] = ACS 1
    ecap 001f[150] = Precision Time Measurement 1
    ecap 0019[220] = PCIe Sec 1 lane errors 0
    ecap 001d[250] = Downstream Port Containment 1

pcib5@pci0:0:29:0:	class=0x060400 rev=0xf0 hdr=0x01 vendor=0x8086 device=0xa330 subvendor=0x1043 subdevice=0x8694
    vendor     = 'Intel Corporation'
    device     = 'Cannon Lake PCH PCI Express Root Port'
    class      = bridge
    subclass   = PCI-PCI
    cap 10[40] = PCI-Express 2 root port max data 256(256) ARI disabled
                 max read 128
                 link x4(x4) speed 8.0(8.0)
                 slot 12 power limit 250 mW
    cap 05[80] = MSI supports 1 message 
    cap 0d[90] = PCI Bridge subvendor=0x1043 subdevice=0x8694
    cap 01[a0] = powerspec 3  supports D0 D3  current D0
    ecap 0001[100] = AER 1 0 fatal 0 non-fatal 0 corrected
    ecap 000d[140] = ACS 1
    ecap 001f[150] = Precision Time Measurement 1
    ecap 0019[220] = PCIe Sec 1 lane errors 0
    ecap 001d[250] = Downstream Port Containment 1

isab0@pci0:0:31:0:	class=0x060100 rev=0x10 hdr=0x00 vendor=0x8086 device=0xa308 subvendor=0x1043 subdevice=0x8694
    vendor     = 'Intel Corporation'
    class      = bridge
    subclass   = PCI-ISA

hdac0@pci0:0:31:3:	class=0x040300 rev=0x10 hdr=0x00 vendor=0x8086 device=0xa348 subvendor=0x1043 subdevice=0x86ca
    vendor     = 'Intel Corporation'
    device     = 'Cannon Lake PCH cAVS'
    class      = multimedia
    subclass   = HDA
    bar   [10] = type Memory, range 64, base 0xa1230000, size 16384, enabled
    bar   [20] = type Memory, range 64, base 0xa1000000, size 1048576, enabled
    cap 01[50] = powerspec 3  supports D0 D3  current D0
    cap 09[80] = vendor (length 20) Intel cap 15 version 0
    cap 05[60] = MSI supports 1 message, 64 bit enabled with 1 message

ichsmb0@pci0:0:31:4:	class=0x0c0500 rev=0x10 hdr=0x00 vendor=0x8086 device=0xa323 subvendor=0x1043 subdevice=0x8694
    vendor     = 'Intel Corporation'
    device     = 'Cannon Lake PCH SMBus Controller'
    class      = serial bus
    subclass   = SMBus
    bar   [10] = type Memory, range 64, base 0xa1238000, size 256, enabled
    bar   [20] = type I/O Port, range 32, base 0xefa0, size 32, enabled

none2@pci0:0:31:5:	class=0x0c8000 rev=0x10 hdr=0x00 vendor=0x8086 device=0xa324 subvendor=0x1043 subdevice=0x8694
    vendor     = 'Intel Corporation'
    device     = 'Cannon Lake PCH SPI Controller'
    class      = serial bus
    bar   [10] = type Memory, range 32, base 0xfe010000, size 4096, enabled

em0@pci0:0:31:6:	class=0x020000 rev=0x10 hdr=0x00 vendor=0x8086 device=0x15bc subvendor=0x1043 subdevice=0x8672
    vendor     = 'Intel Corporation'
    device     = 'Ethernet Connection (7) I219-V'
    class      = network
    subclass   = ethernet
    bar   [10] = type Memory, range 32, base 0xa1200000, size 131072, enabled
    cap 01[c8] = powerspec 3  supports D0 D3  current D0
    cap 05[d0] = MSI supports 1 message, 64 bit enabled with 1 message

pcib4@pci0:3:0:0:	class=0x060400 rev=0x04 hdr=0x01 vendor=0x1b21 device=0x1080 subvendor=0x1043 subdevice=0x8489
    vendor     = 'ASMedia Technology Inc.'
    device     = 'ASM1083/1085 PCIe to PCI Bridge'
    class      = bridge
    subclass   = PCI-PCI
    cap 05[50] = MSI supports 1 message, 64 bit 
    cap 01[78] = powerspec 3  supports D0 D1 D2 D3  current D0
    cap 10[80] = PCI-Express 1 PCI bridge max data 128(128) RO NS
                 max read 512
                 link x1(x1) speed 2.5(2.5) ASPM disabled(L0s/L1)
    cap 0d[c0] = PCI Bridge subvendor=0x1043 subdevice=0x8489
    ecap 0002[100] = VC 1 max VC0

nvme0@pci0:5:0:0:	class=0x010802 rev=0x01 hdr=0x00 vendor=0x1987 device=0x5013 subvendor=0x1987 subdevice=0x5013
    vendor     = 'Phison Electronics Corporation'
    device     = 'PS5013 E13 NVMe Controller'
    class      = mass storage
    subclass   = NVM
    bar   [10] = type Memory, range 64, base 0xa1100000, size 16384, enabled
    cap 10[80] = PCI-Express 2 endpoint max data 256(256) FLR RO NS
                 max read 512
                 link x4(x4) speed 8.0(8.0) ASPM disabled(L1)
    cap 11[d0] = MSI-X supports 9 messages, enabled
                 Table in map 0x10[0x2000], PBA in map 0x10[0x3000]
    cap 05[e0] = MSI supports 8 messages, 64 bit, vector masks 
    cap 01[f8] = powerspec 3  supports D0 D3  current D0
    ecap 0018[100] = LTR 1
    ecap 001e[110] = L1 PM Substates 1
    ecap 0001[200] = AER 2 0 fatal 0 non-fatal 0 corrected
    ecap 0019[300] = PCIe Sec 1 lane errors 0
